{
  "titulo": "Ley de Hacienda para el Estado de Coahuila de Zaragoza",
  "Contenido": "EL C. ROGELIO MONTEMAYOR SEGUY, GOBERNADOR CONSTITUCIONAL DEL ESTADO\nINDEPENDIENTE, LIBRE Y SOBERANO DE COAHUILA DE ZARAGOZA, A SUS HABITANTES SABED:\nQUE EL CONGRESO DEL ESTADO INDEPENDIENTE, LIBRE Y SOBERANO DE COAHUILA DE\nZARAGOZA;\nTITULO I\nCAPITULO UNICO\nDISPOSICIONES GENERALES\nARTICULO 1.- La presente Ley tiene por objeto regular los ingresos de la Hacienda Pública del Estado de Coahuila, por los diversos conceptos tributarios a que se refiere el Código Fiscal para el Estado de\nCoahuila.\nARTICULO 2.- La iniciativa de Ley de Ingresos del Estado se formulará de conformidad con la\nGobernador Constitucional del Estado a la consideración, y en su caso, aprobación al H. Congreso del\nEstado a más tardar el 30 de noviembre de cada año, o hasta el 15 de diciembre en los años en que inicie su encargo.\nLa Ley de Ingresos regirá en el curso del año para el cual se expida, pero si por cualquier circunstancia no se publicara, continuará en vigor la del año anterior, salvo los casos de excepción que establezca el\nCongreso.\n(REFORMADO, P.O. 29 DE DICIEMBRE DE 2000)\nARTICULO 3.- Las cuotas y tarifas de las contribuciones que establece esta ley en cantidades determinadas, se actualizarán a partir del 1o. de enero de cada año, con el factor que resulte de dividir el índice del mes de octubre del año anterior al señalado.\nPara la actualización de las cuotas, en ningún caso podrá aplicarse un factor distinto al señalado. contribución, se aplicará ésta, en lugar de lo dispuesto en este artículo.\nLas cuotas actualizadas deberán publicarse anualmente, por la Secretaría de Finanzas, en el Periódico\nTITULO II\nDE LOS IMPUESTOS\nCAPITULO PRIMERO\nOBJETO\nARTICULO 4.- Es objeto de este impuesto, los ingresos que se obtengan por la realización o explotación de diversiones y espectáculos públicos, dentro del territorio del Estado.\nPor diversión y espectáculo público debe entenderse toda representación, función, acto, evento o exhibición artística, musical, deportiva, taurina, ecuestre, circense, teatral, cultural, de fiestas o ferias regionales, así como por el uso de juegos mecánicos; que se verifique en salones, teatros, calles, plazas, locales abiertos o cerrados y se pague una suma de dinero por el boleto o derecho de entrada o uso del juego.\n(REFORMADO, P.O. 28 DE DICIEMBRE DE 2007)\nPara efectos de este impuesto, no se consideran espectáculos públicos, los prestados en restaurantes, bares, cabarets, salones de fiesta o de baile y centros nocturnos, que cuenten con sus licencias respectivas y organicen, por cuenta propia y como parte de su variedad, este tipo de eventos.\nSUJETO\nARTICULO 5.- Son sujetos del Impuesto Sobre Espectáculos y Diversiones Públicas, las personas físicas o morales que promuevan, organicen o exploten esas actividades.\nBASE\nARTICULO 6.- Servirá de base para el pago de este impuesto, los ingresos que se generen por el boleto o cuota de entrada a las diversiones o espectáculos públicos.\nOBLIGACIONES\n(REFORMADO, P.O. 28 DE DICIEMBRE DE 2007)\nARTICULO 7.- Los sujetos de este impuesto están obligados a recabar, cuando menos con tres días de anticipación a la celebración del acto, la autorización de la Secretaría de Finanzas, debiendo presentar solicitud que contendrá, cuando menos los siguientes requisitos:\nI.- Nombre y domicilio de quien promueva, organice o explote la diversión o espectáculo público para el cual se solicita autorización;\nII.- Clase de diversión o espectáculo;\nIII.- Ubicación del inmueble o predio en que se va a efectuar y nombre del propietario o poseedor del mismo;\nIV.- Hora señalada para que principien las funciones; y\nV.- Número de localidades de cada clase que haya en el local destinado al espectáculo y su precio al público; así como el número de cortesías, debidamente marcadas como tales, que serán entregadas para cada función.\nCualquier modificación a los datos comprendidos en las fracciones precedentes, deberá comunicarse por escrito a la Secretaría de Finanzas, dentro de los tres días hábiles anteriores a la fecha en que vaya a realizarse la actividad objeto de este impuesto. como cortesías siempre y cuando se presenten para su sellado conforme al artículo 8.\nARTICULO 8.- Una vez concedida la autorización, los sujetos de este impuesto tienen las obligaciones siguientes:\nI.- Presentar a la Secretaría de Finanzas, la emisión total de los boletos de entrada, cuando menos un día antes al de la realización de la actividad autorizada, a fin de que se autoricen con el sello respectivo;\nII.- Entregar a la misma dependencia, por duplicado y dentro del mismo término, los programas del espectáculo;\nIII.- No variar los programas y precios dados a conocer sin que se dé aviso a la Secretaría de Finanzas y se recabe nueva autorización antes de la realización de la actividad; y\nIV.- Garantizar el interés fiscal.\n(REFORMADO, P.O. 28 DE DICIEMBRE DE 2007)\nARTICULO 9.- Los organizadores, promotores o representantes de las empresas de espectáculos y diversiones públicas, están obligados a permitir que los interventores comisionados por las autoridades fiscales desempeñen adecuadamente sus funciones, así como a proporcionarles libros, documentos y cuantos datos requieran para definir la correcta causación del impuesto a que se refiere este Capítulo.\n(REFORMADO, P.O. 28 DE DICIEMBRE DE 2007)\nARTICULO 10.- Las autoridades fiscales del Estado podrán suspender o clausurar cualquier diversión o espectáculo, cuando quienes organicen o exploten se nieguen a permitir que los interventores vigilen la entrada, liquiden o recauden el impuesto, o cuando no se hayan observado las disposiciones precedentes.\n(REFORMADO, P.O. 11 DE DICIEMBRE DE 1998)\nARTICULO 11.- El Impuesto Sobre Diversiones y Espectáculos Públicos, se calculará y pagará aplicando a la base gravable las siguientes tasas:\nI.- Espectáculos:\na) Circos…………………………………………………….…… 4%\nb) Carpas, cualquiera que sea el espectáculo que presente 4%\nc) (DEROGADA, P.O. 29 DE DICIEMBRE DE 2000)\nd) Deportivos……………………………………………………… 6%\ne) Taurinos y ecuestres…………………………………………. 6%\nf) Teatrales………………………………………………………… 4%\ng) Culturales………………………………………………………. 6%\nII.- Diversiones:\na) Ferias y fiestas regionales…………………………………… 6%\nb) Bailes…………………………………………………………….. 6%\nc) Juegos mecánicos…………………………………………….. 6%\nd) Palenques……………………………………………………….. 6%\nPAGO\nARTICULO 12.- El impuesto a que se refiere este Capítulo se pagará en las oficinas recaudadoras de rentas de la Secretaría de Finanzas o en las instituciones de crédito o establecimientos autorizados.\nEn la fecha en que se realice el evento, el interventor autorizado podrá recabar el pago correspondiente al impuesto y expedir un recibo provisional válido con el cual el organizador podrá exigir a contra-entrega de Finanzas.\nCuando no se realice el pago conforme a lo establecido en el presente artículo, la autoridad fiscal procederá a hacerlo efectivo mediante el Procedimiento Administrativo de Ejecución, o en su caso, aplicar la garantía otorgada por el contribuyente.\nI.- (DEROGADA, P.O. 28 DE DICIEMBRE DE 2007)\nII.- (DEROGADA, P.O. 28 DE DICIEMBRE DE 2007)\nCAPITULO SEGUNDO\nDEL IMPUESTO SOBRE ENAJENACION DE VEHICULOS DE MOTOR\nOBJETO\nARTICULO 13.- Es objeto de este impuesto, la transmisión de la propiedad por cualquier título, de automóviles, camiones y demás vehículos de motor, siempre que no sean nuevos y que la misma no se encuentre gravada por la Ley del Impuesto al Valor Agregado.\nCuando parte de la operación se encuentre gravada por el Impuesto al Valor Agregado, será objeto de este impuesto la parte no gravada por el impuesto señalado.\nSUJETO\nARTICULO 14.- Son sujetos de este impuesto, quienes por cualquier título transmitan la propiedad de los bienes a que se refiere el artículo anterior.\nARTICULO 15.- Son solidariamente responsables del pago de este impuesto:\nI.- Los adquirentes de los vehículos; y\nII.- Las personas comisionistas o físicas y morales propietarios de agencias, lotes o distribuidoras de automóviles, por los vehículos que adquieran.\nBASE\nARTICULO 16.- Es base de este impuesto, el valor que resulte mayor entre el precio consignado en la anteriores al año en curso.\nPara modelos del año en curso, será base del impuesto, el 100% del importe de la primera facturación.\nPara vehículos cuya enajenación se encuentre parcialmente gravada por el Impuesto al Valor Agregado, la base será la cantidad no gravada en la factura correspondiente por ese impuesto.\nTASA\nARTICULO 17.- La tasa correspondiente al Impuesto Sobre Enajenación de Vehículos de Motor, será el\n1.25%, aplicado a la base gravable, establecida en el artículo anterior.\nPAGO\nARTICULO 18.- El pago de este impuesto deberá efectuarse en las oficinas recaudadoras de rentas de la días siguientes a la celebración de la operación, aplicando la tasa que establezca esta ley.\nARTICULO 19.- Las personas que lleven a cabo las operaciones objeto de este impuesto, deberán presentar a la Secretaría de Finanzas, o en las instituciones de crédito autorizadas, una manifestación en las formas oficialmente aprobadas, que contenga los datos del vehículo y documentos relativos a la operación.\nARTICULO 20.- Los automóviles, camiones y demás vehículos de motor transmitidos o adquiridos, quedarán afectos preferentemente al pago del impuesto a que se refiere este artículo.\nCAPITULO TERCERO\nDEL IMPUESTO SOBRE NOMINAS\nOBJETO\n(REFORMADO, P.O. 22 DE DICIEMBRE DE 2006)\nARTICULO 21.- Es objeto de este impuesto, la realización de erogaciones en efectivo o en especie por concepto de remuneraciones al trabajo personal prestado dentro del territorio del Estado de Coahuila, bajo la dirección y dependencia de un patrón, independientemente de la designación que se les otorgue.\nSUJETO\nARTICULO 22.- Son sujetos de este impuesto, las personas físicas y morales que realicen las erogaciones a que se refiere el artículo anterior.\nBASE\nARTICULO 23.- Es base de este impuesto, el monto total de las erogaciones realizadas por concepto de remuneraciones al trabajo personal subordinado, los cuales comprenden: los pagos hechos en efectivo por cuota diaria, y las gratificaciones, percepciones, alimentación, habitación, primas, comisiones, prestaciones en especie y cualquier otra cantidad que se entregue al trabajador por sus servicios.\nTASA\nARTICULO 24.- La tasa correspondiente al Impuesto Sobre Nóminas, será el 1% sobre el monto total de las erogaciones gravadas por este impuesto.\nPAGO\nARTICULO 25.- El pago de este impuesto deberá efectuarse en las oficinas recaudadoras de rentas de la aquél en que se hubieren realizado las erogaciones objeto del mismo, en las formas aprobadas por la\nARTICULO 26.- Cuando los contribuyentes cuenten con sucursales en diversos municipios del Estado, deberán presentar declaración en cada municipio en que se encuentren ubicadas las sucursales. En aquellos casos en que no exista oficina recaudadora de rentas en el municipio de que se trate, las cercanos al domicilio del contribuyente.\nARTICULO 27.- Los contribuyentes podrán optar por pagar en la declaración del mes de enero el impuesto correspondiente a todo el ejercicio fiscal, siempre y cuando, el monto de lo pagado en el ejercicio anterior, no haya excedido de la cantidad de $30,000.00 (TREINTA MIL PESOS 00/100 M.N.)\nLa cantidad señalada en el párrafo anterior se actualizará anualmente conforme a lo dispuesto por el artículo 3 de esta ley.\nARTICULO 28.- Los contribuyentes que tengan derecho y se acojan a la opción establecida en el artículo anterior, deberán presentar la declaración del mes de enero asentando en la parte superior derecha la siguiente leyenda “SE OPTA POR PAGO ANUAL”, quedando relevados de la obligación de presentar las declaraciones por los meses de febrero a noviembre, pero estarán obligados a presentar la declaración correspondiente al mes de diciembre, en la que liquidarán en forma definitiva el impuesto anual a su cargo, señalando la diferencia a pagar, el saldo a su favor o marcándola en ceros, según corresponda.\n(REFORMADO, P.O. 29 DE DICIEMBRE DE 2000)\nARTICULO 29.- Los contribuyentes que se acojan a la opción señalada en el artículo 27 de esta ley, gozarán de un estímulo fiscal consistente en una reducción parcial del impuesto a su cargo, en el porcentaje que mediante Decreto establezca el Ejecutivo del Estado anualmente. Para tener derecho a este estímulo la declaración correspondiente al mes de enero, deberá presentarse dentro del plazo establecido en esta ley.\n(ADICIONADO, P.O. 28 DE DICIEMBRE DE 2007)\nARTÍCULO 29-A.- Las empresas que contraten adultos mayores y/o a personas con capacidades diferentes, tendrán derecho a los estímulos fiscales siguientes:\nI. No se pagará el impuesto que se cause por las erogaciones correspondientes a las personas mayores o con capacidades diferentes.\nII. Adicionalmente, tendrán derecho a las reducciones siguientes:\nEl 20% del impuesto que se cause, cuando ocupen de un 4% hasta un 5% de su planta de trabajadores con personas mayores y/o con capacidades diferentes.\nEl 25% del impuesto que se cause, cuando ocupen más de un 5% hasta un 7% de su planta de trabajadores con personas mayores y/o con capacidades diferentes.\nEl 30% del impuesto que se cause, cuando ocupen más de un 7% hasta un 10% de su planta de trabajadores con personas mayores y/o con capacidades diferentes.\nEl 50% del impuesto que se cause, cuando ocupen más del 10% de su planta de trabajadores con personas mayores y/o con capacidades diferentes.\nARTÍCULO 29-B.- Para tener derecho al estímulo que otorga el artículo anterior, los contribuyentes deberán señalar en las declaraciones del Impuesto sobre Nóminas, el número de personas mayores o con capacidades diferentes que trabajen en la empresa y su remuneración.\nEXENCIONES\nARTICULO 30.- Están exentas del pago de este impuesto:\nI.- Las erogaciones que se cubran por concepto de:\n1.Indemnizaciones derivadas de la rescisión o terminación de las relaciones de trabajo;\n2.Indemnizaciones por riesgos de trabajo, que se concedan de acuerdo a las leyes o contratos respectivos;\n3.Pensiones y jubilaciones en los casos de invalidez, vejez, cesantía o muerte;\n4.Los instrumentos de trabajo, tales como herramientas, ropa y otros similares;\n5.El ahorro, cuando se integre por un depósito de cantidad semanaria o mensual igual del trabajador y de la empresa; y las cantidades otorgadas por el patrón para fines sociales o sindicales;\nLas aportaciones al Instituto del Fondo Nacional de la Vivienda para los Trabajadores y al Instituto\nMexicano del Seguro Social;\n6.Las participaciones de los trabajadores en las utilidades de las empresas;\n7.Los premios por asistencia;\n(REFORMADO, P.O. 24 DE DICIEMBRE DE 1996)\n8.- Los premios por asistencia y puntualidad, siempre que el importe de cada uno de los conceptos no rebase el diez por ciento del salario base;\n(REFORMADO, P.O. 24 DE DICIEMBRE DE 1996)\n9.- Los pagos por tiempo extraordinario, cuando no rebase las tres horas diarias ni tres veces por semana de trabajo, ni cuando este tipo de servicios esté pactado en forma de tiempo fijo;\n10.La alimentación y habitación, cuando no se proporcionen gratuitamente al trabajador, así como las despensas;\n(REFORMADO, P.O. 24 DE DICIEMBRE DE 1996)\n11.- La alimentación y habitación, cuando se entreguen en forma onerosa a trabajadores; se entiende que son onerosas estas prestaciones cuando representen cada una de ellas, como mínimo, el veinte por ciento del salario mínimo general diario de la zona; así como las despensas en especie o en dinero, siempre y cuando su importe no rebase el cuarenta por ciento del salario mínimo general diario de la zona;\n12. Contraprestaciones cubiertas a trabajadores domésticos.\nII.- Las erogaciones que efectúen:\n2. Instituciones sin fines de lucro conformadas como Asociación Civil, que promuevan o realicen asistencia social, actividades deportivas, culturales o sociales.\n3. Sindicatos de trabajadores, agrupaciones de empresarios o de propietarios en cámaras, uniones o asociaciones, agrupaciones de profesionistas en institutos, colegios o asociaciones sin fines de lucro;\n4. Partidos y asociaciones políticas constituidos conforme a la ley de la materia;\n6. Ejidos y comunidades;\n7. Uniones de ejidos y comunidades;\n8. La empresa social, constituida por avecindados e hijos de ejidatarios con derechos a salvo;\n9. Las asociaciones rurales de interés colectivo; y\n10. La unidad agrícola industrial de la mujer campesina.\nCAPITULO CUARTO\nOBJETO\n(REFORMADO, P.O. 28 DE DICIEMBRE DE 1999)\nARTICULO 31.- Es objeto de este impuesto, la tenencia o uso de vehículos automotores modelo de más de diez años de fabricación anteriores al ejercicio fiscal en curso, a que se refiere el artículo 5o., fracción\nV de la Ley del Impuesto Sobre Tenencia o Uso de Vehículos en materia federal, así como de todo tipo de remolques cualquiera que sea su modelo.\nSUJETO\n(REFORMADO, P.O. 28 DE DICIEMBRE DE 1999)\nARTICULO 32.- Están obligados al pago del impuesto establecido en este artículo, las personas físicas o morales, tenedoras o usuarias de los vehículos a que se refiere el artículo anterior.\nPara los efectos de este impuesto, se presume que el propietario es tenedor o usuario del vehículo y que el año modelo del vehículo, es el de fabricación.\n(REFORMADO, P.O. 28 DE DICIEMBRE DE 1999)\nARTICULO 33.- Las autoridades competentes no autorizarán registros de vehículos, matrículas, altas o bajas, cambio de placas o efectuarán la renovación de los mismos, si el tenedor o usuario del vehículo no comprueba el pago del impuesto o, en su caso, acredita que se encuentra liberado de esta obligación.\n(REFORMADO, P.O. 28 DE DICIEMBRE DE 1999)\nARTICULO 34.- Son responsables solidarios del pago del Impuesto:\nI.- Quienes por cualquier título, adquieran la propiedad, tenencia o uso del vehículo, por el adeudo del impuesto que en su caso existiera, aun cuando se trate de personas que no están obligadas al pago de este impuesto;\nII.- Quienes reciban en consignación o comisión para su enajenación vehículos, por el adeudo del impuesto que en su caso existiera;\nIII.- Las autoridades federales, estatales o municipales competentes, que autoricen el registro de vehículos, matrículas, altas, cambios o bajas de placas o efectúen la renovación de los mismos, sin haberse cerciorado que se haya pagado el impuesto; y\nIV.- Los funcionarios o empleados públicos que en ejercicio de sus funciones, autoricen la expedición de placas, tarjeta de circulación o calcomanía, sin cerciorarse del pago del impuesto. hayan efectuado.\nARTICULO 35.- Son responsables solidarios del pago del Impuesto:\nI.- Quienes por cualquier título adquieran la propiedad, tenencia o uso de los vehículos gravados por este impuesto;\nII.- Quienes reciban en consignación o comisión para su enajenación, los vehículos a que se refiere este artículo; y\nIII.- Los funcionarios o empleados públicos que en ejercicio de sus funciones, autoricen la expedición de placas, tarjeta de circulación o calcomanía, sin cerciorarse del pago del impuesto.\n(REFORMADO, P.O. 28 DE DICIEMBRE DE 1999)\nARTICULO 36.- El Impuesto Sobre Tenencia o Uso de Vehículos, se pagará conforme a las siguientes:\nTARIFA\nI.- Motocicletas $ 47.00\nII.- Automóviles y Camionetas $117.00\nIII.- Minibuses, microbuses, camiones de carga, autobuses integrales y ómnibuses $141.00 y\nIV.- Remolques $ 95.00\n(DEROGADO ULTIMO PARRAFO, P.O. 22 DE DICIEMBRE DE 2006)\nPAGO\n(REFORMADO, P.O. 28 DE DICIEMBRE DE 2007)\nARTICULO 37.- El pago de este impuesto deberá efectuarse en las oficinas recaudadoras de rentas de la\nSecretaría de Finanzas, Instituciones de Crédito o establecimientos autorizados, dentro de los tres primeros meses de cada año, en el mismo recibo con el que se paguen las contribuciones de control vehicular.\nSECCION PRIMERA\nANTERIORES AL DEL EJERCICIO FISCAL EN CURSO\nSECCION SEGUNDA\nPARA LOS VEHICULOS DE MAS DE 10 AÑOS DE FABRICACION ANTERIORES AL DEL EJERCICIO\nFISCAL EN CURSO\nSECCION TERCERA\nPARA OTROS VEHICULOS\nARTICULO 47.- (DEROGADO, P.O. 28 DE DICIEMBRE DE 1999)\nARTICULO 48.- (DEROGADO, P.O. 28 DE DICIEMBRE DE 1999)\nARTICULO 49.- (DEROGADO, P.O. 28 DE DICIEMBRE DE 1999)\nARTICULO 50.- (DEROGADO, P.O. 28 DE DICIEMBRE DE 1999)\nARTICULO 51.- (DEROGADO, P.O. 28 DE DICIEMBRE DE 1999)\nARTICULO 52.- (DEROGADO, P.O. 28 DE DICIEMBRE DE 1999)\nARTICULO 53.- (DEROGADO, P.O. 28 DE DICIEMBRE DE 1999)\nARTICULO 54.- (DEROGADO, P.O. 28 DE DICIEMBRE DE 1999)\nCAPITULO QUINTO\nIMPUESTO POR SERVICIOS DE HOSPEDAJE\nOBJETO\n(REFORMADO, P.O. 24 DE DICIEMBRE DE 1996)\nARTICULO 55.- Es objeto de este impuesto, la prestación de servicios de hospedaje, campamentos y de tiempo compartido, en el territorio del Estado. Para los efectos de este impuesto sólo se considerará el albergue, sin incluir los alimentos y demás servicios relacionados con los mismos.\nSe consideran servicios de hospedaje, el acto por el cual se concede a una persona el uso, goce y demás derechos que se adquieran sobre un bien o parte del mismo, otorgados en establecimientos de hospedaje durante un período determinado.\nPara los efectos de este artículo, se consideran establecimientos de hospedaje los hoteles, moteles, albergues, habitaciones con sistema de tiempo compartido o de operación hotelera, suites, villas o bungalows, ex-haciendas y construcciones en las que se proporcione el servicio de alojamiento.\nSUJETO\nARTICULO 56.- Son sujetos de este impuesto las personas físicas y morales, que presten los servicios a que se refiere el artículo anterior.\nBASE\nARTICULO 57.- Es base de este impuesto el monto total de los ingresos que perciban las personas físicas o morales por los servicios de hospedaje que presten. Para los efectos de este impuesto sólo se considerarán los ingresos que se obtengan por el albergue, sin incluir los obtenidos por alimentos y demás servicios relacionados con los mismos.\nTASA\n(REFORMADO, P.O. 24 DE DICIEMBRE DE 1996)\nARTICULO 58.- El impuesto por servicios de hospedaje se causará con la tasa del 3% aplicado sobre la base gravable establecida en el artículo anterior.\n(REFORMADO, P.O. 24 DE DICIEMBRE DE 1996)\nARTICULO 59.- Los contribuyentes trasladarán en forma expresa y por separado el impuesto a las personas que reciban los servicios.\nSe entenderá por traslado del impuesto el cobro o cargo que los contribuyentes deben hacer a dichas personas por un monto equivalente al impuesto establecido en este Capítulo.\n(REFORMADO, P.O. 28 DE DICIEMBRE DE 2007)\nARTICULO 60.- El pago de este impuesto deberá efectuarse en las oficinas recaudadoras de rentas de la\nSecretaría de Finanzas, instituciones de crédito o establecimientos autorizados, mediante declaración mensual que deberá presentarse dentro de los primeros diecisiete días naturales del mes siguiente a aquél en que se obtengan los ingresos por los servicios gravados por este impuesto, en las formas aprobadas por la Secretaría de Finanzas.\n(DEROGADO, P.O. 28 DE DICIEMBRE DE 1999)\nCAPITULO SEXTO\nDEL IMPUESTO SOBRE AUTOMOVILES NUEVOS\nOBJETO\nCAPITULO SEPTIMO\nDEL IMPUESTO SOBRE INGRESOS POR PREMIOS DERIVADOS DE LOTERIAS, RIFAS, SORTEOS,\nJUEGOS CON APUESTAS Y CONCURSOS\nOBJETO\nARTICULO 73.- Es objeto de este impuesto, la obtención de premios derivados o relacionados con loterías, rifas, sorteos, juegos con apuestas permitidas y concursos de toda clase, aún cuando por dichos eventos no se cobre cantidad alguna que represente el derecho a participar en los mismos.\nSUJETO\n(REFORMADO, P.O. 24 DE DICIEMBRE DE 1996)\nARTICULO 74.- Son sujetos de este impuesto, las personas físicas o morales que tengan su domicilio en el Estado de Coahuila, que obtengan premios derivados o relacionados con loterías, rifas, sorteos, juegos con apuestas permitidas y concursos de toda clase.\nBASE\n(REFORMADO, P.O. 24 DE DICIEMBRE DE 1996)\nARTICULO 75.- Es base gravable de este impuesto, el valor o avalúo de los premios derivados de loterías, rifas, sorteos, juegos con apuestas permitidas y concursos de toda clase.\nCuando los premios sean en especie y no se exprese su valor o cuando el valor expresado sea inferior al que tenga en el mercado el bien que se entrega como premio, éstos serán valuados por perito que será designado por la Secretaría de Finanzas.\nEl impuesto que resulte a cargo de quienes reciban premios, deberá ser retenido por las personas que realicen el pago de éstos. Esta retención deberá realizarse aún cuando el retenedor resida en otra entidad federativa.\nTASA\n(REFORMADO, P.O. 24 DE DICIEMBRE DE 1996)\nARTICULO 76.- La tasa correspondiente al impuesto sobre ingresos por premios derivados de loterías, rifas, sorteos, juegos con apuestas y concursos será el 6%, aplicado a la base gravable establecida en el artículo anterior.\nLos contribuyentes de este impuesto, podrán pagar el mismo mediante una cuota fija mensual, la que será determinada por una estimativa que practiquen las autoridades fiscales. Para ello, dichas obligado al pago de este impuesto, pudiendo considerar el valor estimado de dichas actividades durante un año calendario, en cuyo caso dicho valor se dividirá entre doce para obtener el valor de las actividades mensuales estimadas.\nPAGO\nARTICULO 77.- El pago de este impuesto deberá efectuarse por el retenedor en las oficinas recaudadoras de rentas de la Secretaría de Finanzas, instituciones de crédito o establecimientos autorizados, dentro de los diecisiete días naturales del mes siguiente a aquél en el cual se haga entrega del premio.\nOBLIGACIONES\nARTICULO 78.- Quienes entreguen los premios a que se refiere este Capítulo, además de efectuar las retenciones de este impuesto tendrán las obligaciones siguientes:\nI.- Proporcionar cuando así lo solicite el interesado constancia de retención de impuesto a la persona que obtenga el premio; y\nII.- Conservar de conformidad con el Código Fiscal para el Estado de Coahuila, la documentación relacionada con las constancias de entrega de premios y retenciones del impuesto.\nTITULO III\nDE LOS DERECHOS\nCAPITULO PRIMERO\nPOR SERVICIOS DE LA SECRETARIA DE GOBIERNO\nSECCION PRIMERA\nPOR SERVICIOS DEL REGISTRO PUBLICO DE LA\nPROPIEDAD Y DEL COMERCIO\nPRIMERA PARTE\nDE LA PROPIEDAD\n(REFORMADO, P.O. 29 DE DICIEMBRE DE 2000)\nARTICULO 79.- Los servicios prestados por el Registro Público, relativos a la propiedad, causarán derechos conforme a la siguiente:\nTARIFA\nI.- El examen de todo documento público o privado que se presente para su inscripción, cuando se resolución judicial, $21.00 (VEINTIUN PESOS 00/100 M.N.);\nII.- La inscripción o registro de documentos públicos o privados, de resoluciones judiciales, administrativas o de cualquier clase de títulos, por virtud de los cuales se adquiera, transmita, modifique o extinga el dominio o la posesión de bienes inmuebles:\n1.- Hasta con valor de $10,000.00 (DIEZ MIL PESOS 00/100 M.N.), se pagarán $150.00 (CIENTO\nCINCUENTA PESOS 00/100 M.N.).\n2.- Si el valor excede de $10,000.00 (DIEZ MIL PESOS 00/100 M.N.), se pagará por los primeros\n$10,000.00, conforme al inciso anterior y por lo que exceda de dicha cantidad hasta $50,000.00\n(CINCUENTA MIL PESOS 00/100 M.N.), el 15 al millar.\n3.- Si el valor excede de $50,000.00 (CINCUENTA MIL PESOS 00/100 M.N.), se pagará por los primeros\n$50,000.00, conforme a los incisos anteriores y por lo que exceda de dicha cantidad hasta $100,000.00\n(CIEN MIL PESOS 00/100 M.N.), el 12 al millar.\n4.- Si el valor excede de $100,000.00 (CIEN MIL PESOS 00/100), se pagará por los primeros\n$100,000.00, conforme a los incisos anteriores y por lo que exceda de dicha cantidad hasta $150,000.00\n(CIENTO CINCUENTA MIL PESOS 00/100 M.N.), el 8 al millar.\n5.- Si el valor excede de $150,000.00 (CIENTO CINCUENTA MIL PESOS 00/100 M.N.), se pagará por los primeros $150,000.00, conforme a los incisos anteriores y por lo que exceda de dicha cantidad, el 6 al millar.\n(REFORMADO, P.O. 24 DE DICIEMBRE DE 1996)\n6.- Si el valor es indeterminado, se pagarán $21.00 (VEINTIUN PESOS 00/100 M.N.), por hoja.\nCuando una parte del valor sea determinada y la otra indeterminada se pagará por cada parte lo que corresponde, con arreglo a lo dispuesto en esta fracción.\nIII.- (DEROGADA, P.O. 31 DE DICIEMBRE DE 2002)\n(REFORMADA, P.O. 31 DE DICIEMBRE DE 2002)\nIV.- La inscripción de la escritura constitutiva de sociedades civiles y asociaciones de carácter civil, así como cualquier modificación a la escritura constitutiva, $39.00 (TREINTA NUEVE PESOS 00/100 M.N.) por hoja.\n(REFORMADA, P.O. 24 DE DICIEMBRE DE 1996)\nV.- Los contratos mercantiles en que medie condición suspensiva, resolutoria, reserva de dominio o cualquier otra modalidad que dé lugar a una inscripción complementaria para su perfeccionamiento, lo que resulte mayor entre el 25% de los derechos que se hayan causado por la primera inscripción o\n$21.00 (VEINTIUN PESOS 00/100 M.N.), por hoja;\nVI.- La inscripción de gravámenes sobre bienes inmuebles, sea por contrato, por resolución judicial o por disposición testamentaria; la de los títulos por virtud de los cuales se adquieran, transmitan, modifiquen o extingan derechos reales sobre inmuebles, distintos del dominio; los que limiten el dominio del vendedor, del embargo, así como de cédulas hipotecarias, de servidumbres y de fianzas, se pagarán conforme a la fracción II, de este artículo;\n(ADICIONADO, P.O. 24 DE DICIEMBRE DE 1996) laborales, se pagarán $21.00 (VEINTIUN PESOS 00/100 M.N.) por hoja;\nCuando las inscripciones a que se refiere el primer párrafo de este artículo, se deriven de la inscripción de actos jurídicos por los que se deban pagar los derechos establecidos en el artículo 82 fracción IV de la\nSección de Comercio, se pagarán $38.00 por hoja;\nVII.- La inscripción de títulos de propiedad, de bienes o derechos que modifiquen, aclaren o disminuyan el las mismas partes que figuran en la primera escritura, sin aumentar el capital ni transferir derechos, $21.00 (VEINTIUN PESOS 00/100 M.N.) por hoja;\nVIII.- La inscripción del título o contrato a que se refiere la fracción anterior, cuando se aumente el capital o se transfiera algún derecho, se pagará conforme a la fracción II de este artículo, sobre el importe del aumento del capital o del derecho que se transfiera;\nIX.- La inscripción de las autorizaciones para fraccionamiento, $110.00 (CIENTO DIEZ PESOS 00/100\nM.N.);\nX.- DEROGADA)\nXI.- El depósito de cualquier otro documento, $55.00 (CINCUENTA Y CINCO PESOS 00/100 M.N.);\nXII.- La expedición de certificados de no antecedentes registrales de inmuebles, independientemente de la búsqueda, $292.00 (DOSCIENTOS NOVENTA Y DOS PESOS 00/100 M.N.);\nXIII.- La constancia que extienda el Registro al calce de los documentos privados que se le presenten, expresando que se ha cerciorado de la autenticidad de las firmas y de la voluntad de las partes, $39.00\n(TREINTA Y NUEVE PESOS 00/100 M.N.) por hoja.\nXIV.- La búsqueda de constancias para la expedición de certificados o informes, por cada predio y por cada período de cinco años o fracción, $23.00 (VEINTITRES PESOS 00/100 M.N.);\nXV.- La expedición de certificados o certificaciones relativos a las constancias del Registro, independientemente de la búsqueda:\n1.- Certificados de existencia de gravámenes, $63.00 (SESENTA Y TRES PESOS 00/100 M.N.), por cada lote.\n2.- Certificados de no existencia de gravámenes, $63.00 (SESENTA Y TRES PESOS 00/100 M.N.), por cada lote.\n3.- Otros certificados y certificaciones, $63.00 (SESENTA Y TRES PESOS 00/100 M.N.).\n(REFORMADA, P.O. 31 DE DICIEMBRE DE 2002)\nXVI.- La cancelación de inscripciones en el registro causará el 10% de los derechos que se causaron por su inscripción, sin que pueda ser inferior a $39.00 (TREINTA Y NUEVE PESOS 00/100 M.N.).\nXVII.- La inscripción de declaración unilateral de voluntad en que se contenga la lotificación de un fraccionamiento, por lote $15.00 (QUINCE PESOS 00/100 M.N.); y\nXVIII.- Por otros no especificados, $86.00 (OCHENTA Y SEIS PESOS 00/100 M.N.).\nARTICULO 80.- El pago de estos derechos deberá efectuarse en las oficinas recaudadoras de rentas de la Secretaría de Finanzas, Instituciones de Crédito o establecimientos autorizados, conforme a las tasas y tarifas que establece esta ley, previamente a la prestación del servicio.\nARTICULO 81.- Para la determinación de los derechos que establece la Primera Parte de esta Sección, serán aplicables las siguientes reglas:\nI.- Cuando se trate de actos, contratos o resoluciones por los que se transmita el dominio o la posesión de inmuebles o derechos reales, el que resulte más alto entre el valor declarado en el título o documento respectivo, el determinado en avalúo formulado por Institución Bancaria autorizada por la Secretaría de\nFinanzas y el determinado por la autoridad catastral estatal;\nII.- En los contratos de garantía, en los embargos y otros gravámenes, el monto de las obligaciones garantizadas, cuando el monto sea indeterminado, se tomará como base el valor catastral;\nIII.- En los casos de información ad-perpetuam, el valor catastral de los inmuebles;\nIV.- En las emisiones de cédulas hipotecarias en que se constituya hipoteca en favor de una institución de crédito, cuyas comisiones, cuotas, derechos u otros conceptos no puedan determinarse al momento de realizarse la operación, se pagará por la inscripción de dicha hipoteca, independientemente de la que se constituye a favor de los tenedores de las cédulas, las cuotas correspondientes por cantidad indeterminada;\nV.- En toda transmisión de bienes o derechos reales que se realizan por contrato o por resolución judicial, cuando en ella queden comprendidos varios bienes, se pagará sobre el valor de cada uno de ellos. Si la transmisión comprende varios bienes y se realiza por una suma alzada, los interesados determinarán el valor que corresponda a cada uno de dichos bienes a fin de que sirva de base para el cobro de los derechos; en ningún caso la base de los derechos será inferior al valor catastral;\nVI.- En las operaciones de bienes inmuebles sujetas a condiciones suspensivas, resolutorias, reserva de dominio o cualquier otra que dé lugar a una inscripción complementaria, se pagará el 75% de lo que correspondería con arreglo a la fracción II del artículo 79 y al practicarse la inscripción complementaria se cubrirá el 25% restante;\nVII.- Para aplicación de las tarifas establecidas en la fracción II del artículo 79 la nuda propiedad se valuará, en su caso, con el 75% del valor del inmueble y el usufructo en el 25% del mismo; y\nVIII.- Cuando se trate de contratos, demandas o resoluciones que se refieren a prestaciones periódicas, se tendrá como valor la suma total de éstas si se puede determinar exactamente su cuantía, en caso contrario, se tomará como base la cantidad que resulte, haciendo el cómputo por un año.\n(ADICIONADA, P.O. 31 DE DICIEMBRE DE 2002)\nIX.- En ningún caso los derechos por los servicios prestados por el Registro Público, relativos a la propiedad podrán ser superiores a tres días de salario mínimo general vigente en el Estado, elevado al año.\nSEGUNDA PARTE\nDEL COMERCIO\n(REFORMADO, P.O. 29 DE DICIEMBRE DE 2000)\nARTICULO 82.- Los servicios prestados por el Registro Público, relativos al comercio, causarán derechos conforme a la siguiente:\nTARIFA\nI.- El examen de todo documento público o privado que se presente para su inscripción, cuando se resolución judicial, $21.00 (VEINTIUN PESOS 00/100 M.N.);\nII.- La inscripción de la escritura constitutiva de sociedades mercantiles o de las relativas a aumentos de su capital social, se pagará conforme a la fracción II del artículo 79 de esta ley, sobre el monto del capital social o de sus aumentos.\nTratándose de sociedades mercantiles de capital variable, se pagará conforme a esta fracción, por los aumentos de capital en su parte variable, que se presente para su inscripción.\nIII.- La inscripción de las modificaciones a la escritura constitutiva de sociedades mercantiles, que no se refieran a aumento de capital social, $21.00 (VEINTIUN PESOS 00/100 M.N.), por hoja.\nIV.- La inscripción de créditos de cualquier clase, hipotecarios, prendarios, refaccionarios, de habilitación o avío y otros, otorgados por instituciones de crédito, agrupaciones financieras o particulares, sobre el importe de la operación, el 4 al millar.\nLa inscripción de reestructuración de créditos, causará derechos conforme a esta fracción, únicamente sobre el monto en el que se incremente el crédito ya inscrito, cuando no exista incremento se pagarán\n$36.00 (TREINTA Y SEIS PESOS 00/100 M.N.)por hoja.\nLa misma tarifa se aplicará a los contratos celebrados por arrendadoras financieras, públicas o privadas que se refieran a financiamientos;\nV.- La búsqueda de datos para certificados e informes, por cada período de cinco años o fracción, $29.00\n(VEINTINUEVE PESOS 00/100 M.N.);\nVI.- La expedición de certificados o certificaciones relativos a constancias del registro, independientemente de la búsqueda:\n1.- Por la primera hoja, $63.00 (SESENTA Y TRES PESOS 00/100).\n2.- Por cada hoja adicional, $5.00 (CINCO PESOS 00/100 M.N.).\n3.- Por otros, $37.00 (TREINTA Y SIETE PESOS 00/100 M.N.).\nVII.- La inscripción de títulos o documentos relativos a sociedades mercantiles o civiles que no expresen valor y que de su texto no pueda deducirse, siendo condición indispensable, que la escritura constitutiva se encuentre inscrita previamente en el Registro, $21.00 (VEINTIUN PESOS 00/100 M.N.) por hoja;\nCuando parte del valor sea indeterminado y parte determinado, se pagará por cada parte lo que corresponda, con arreglo a las fracciones anteriores.\nSi en una misma escritura se consignaren diversos contratos, se pagará por cada parte lo que corresponda, con arreglo a las fracciones anteriores.\nVIII.- Las inscripciones complementarias derivadas de contratos mercantiles en que medie condición suspensiva, resolutoria, reserva de dominio o cualquier otra modalidad, $21.00 (VEINTIUN PESOS\n00/100 M.N.) por hoja.\n(REFORMADA, P.O. 31 DE DICIEMBRE DE 2002)\nIX.- La cancelación de inscripciones relativas al comercio causará el 10% de los derechos que se causaron por su inscripción, sin que pueda ser inferior a $39.00 (TREINTA Y NUEVE PESOS 00/100\nM.N.)\nARTICULO 83.- El pago de estos derechos deberá efectuarse en las oficinas recaudadoras de rentas la tarifas que establece esta ley, previamente a la prestación del servicio.\nARTICULO 84.- La determinación del pago del derecho que establece el artículo 82, se sujetará además a las siguientes reglas:\nI.- Los contratos en que se pacten prestaciones periódicas se valuarán en la suma de éstas si se puede determinar exactamente su cuantía, y en caso contrario, por lo que resulte de hacer el cómputo correspondiente a un año;\nII.- Cuando un mismo título origine dos o más inscripciones, los derechos se causarán por cada una de ellas;\nIII.- En los casos en que un título tenga que inscribirse en varias secciones, la cotización se hará separadamente por cada una de ellas; y\nIV.- Cuando deban hacerse inscripciones de distintas operaciones que deriven de la constitución o disolución de alguna sociedad mercantil, se causarán los derechos por la inscripción en la Sección de\nComercio, independientemente de los que causen las otras inscripciones.\nV.- En ningún caso los derechos por los servicios prestados por el Registro Público, relativos al comercio, podrán ser superiores a tres días de salario mínimo general vigente en el Estado, elevado al año.\nSECCION SEGUNDA\nPOR SERVICIOS DEL REGISTRO CIVIL\n(REFORMADO, P.O. 24 DE DICIEMBRE DE 1996)\nARTICULO 85.- Los servicios que se presten en relación con el Registro Civil, causarán derechos conforme a la siguiente:\nTARIFA\nI.- Registro de nacimientos, $19.00 (DIECINUEVE PESOS 00/100 M.N.);\nII.- Registro de reconocimientos, $48.00 (CUARENTA Y OCHO PESOS 00/100 M.N.);\nIII.- Inscripción de actas de adopción, tutela, de ejecutorias que declaren la ausencia, la presunción de muerte o que se ha perdido la capacidad legal para administrar bienes; o bien, de las resoluciones que rectifiquen o modifiquen una acta del Registro Civil, $48.00 (CUARENTA Y OCHO PESOS 00/100 M.N.);\nIV.- Registro de matrimonios, $194.00 (CIENTO NOVENTA Y CUATRO PESOS 00/100 M.N.);\nV.- Registro de divorcios, $194.00 (CIENTO NOVENTA Y CUATRO PESOS 00/100 M.N.);\nVI.- Registro de defunciones, $15.00 (QUINCE PESOS 00/100 M.N.);\nVII.- Inscripción de actos o hechos registrados en el extranjero, $149.00 (CIENTO CUARENTA Y NUEVE\nPESOS 00/100 M.N.);\n(CUARENTA Y OCHO PESOS 00/100 M.N.);\nIX.- Expedición de copias certificadas, $19.00 (DIECINUEVE PESOS 00/100 M.N.), por hoja;\nX.- Rectificaciones relativas a actas del Registro Civil, $114.00 (CIENTO CATORCE PESOS 00/100\nM.N.);\nXI.- Expedición de certificados de inexistencia y cualquier otra clase de constancia relativa al Registro\nCivil, $48.00 (CUARENTA Y OCHO PESOS 00/100 M.N.);\nXII.- Búsqueda de actas en el Registro Civil, $24.00 (VEINTICUATRO PESOS 00/100 M.N.); y\nXIII.- Por otros servicios no especificados, $48.00 (CUARENTA Y OCHO PESOS 00/100 M.N.).\nARTICULO 86.- El pago de los derechos por los servicios prestados por la Dirección Estatal y las oficialías del Registro Civil a que se refiere esta Sección, deberá efectuarse en las oficinas recaudadoras de rentas de la Secretaría de Finanzas, Instituciones de Crédito o establecimientos autorizados, previamente a la prestación del servicio.\nSECCION TERCERA\nPOR OTROS SERVICIOS\nARTICULO 87.- Los otros servicios que presta la Secretaría de Gobierno, causarán derechos conforme a la siguiente:\nTARIFA\nI.- Certificaciones, $55.00 (CINCUENTA Y CINCO PESOS 00/100 M.N.), por hoja;\nII.- Apostillar documentos, $69.00 (SESENTA Y NUEVE PESOS 00/100 M.N.);\nIII.- Presentación de examen para obtener patente de aspirante a notario, $1,785.00 (MIL SETECIENTOS\nOCHENTA Y CINCO PESOS 00/100 M.N.);\nIV.- Expedición de patente de aspirante a notario, $3,570.00 (TRES MIL QUINIENTOS SETENTA PESOS\n00/100 M.N.);\nV.- Presentación de examen de selección para obtener la expedición de Fiat Notarial, $2,975.00 (DOS\nMIL NOVECIENTOS SETENTA Y CINCO PESOS 00/100 M.N.);\nVI.- Expedición del Fiat Notarial, $14,280.00 (CATORCE MIL DOSCIENTOS OCHENTA PESOS 00/100\nM.N.);\nVII.- Expedición de certificados de necesidad, para adquisición de terrenos que hagan las sociedades mercantiles, según lo establecido en el artículo 27, fracción IV de la Constitución Política de los Estados\nUnidos Mexicanos, $1,785.00 (MIL SETECIENTOS OCHENTA Y CINCO PESOS 00/100 M.N.);\nVIII.- Por la revisión de documentos requeridos para la celebración de eventos tradicionales $446.00\n(CUATROCIENTOS CUARENTA Y SEIS PESOS 00/100 M.N.);\nIX.- Autorizaciones en materia de explosivos, $521.00 (QUINIENTOS VEINTIUN PESOS 00/100 M.N.);\nX.- Legalización de firmas en cualquier documento, $69.00 (SESENTA Y NUEVE PESOS 00/100 M.N.), por firma;\nXI.- Expedición de copias certificadas de constancias existentes en las Oficinas Públicas: primera hoja\n$23.00 (VEINTITRES PESOS 00/100 M.N.); cada hoja subsecuente $5.00 (CINCO PESOS 00/100 M.N.);\nXII.- Certificaciones de hechos ocurridos en presencia de la autoridad: primera hoja $23.00 (VEINTITRES\nPESOS 00/100 M.N.); cada hoja subsecuente $5.00 (CINCO PESOS 00/100 M.N.);\nXIII.- Legalización de firmas de notarios, de funcionarios estatales y municipales y de documentos del registro civil, $69.00 (SESENTA Y NUEVE PESOS 00/100 M.N.) por firma;\nXIV.- Exhorto y legalización de firmas de éste a otro Estado, $171.00 (CIENTO SETENTA Y UN PESOS\n00/100 M.N.);\nXV.- Exhorto de otro Estado a éste, $171.00 (CIENTO SETENTA Y UN PESOS 00/100 M.N.);\nXVI.- Búsqueda de antecedentes notariales, $45.00 (CUARENTA Y CINCO PESOS 00/100 M.N.) por año;\nXVII.- Expedición de segundos testimonios que obren en la Dirección de Notarías, $112.00 (CIENTO\nDOCE PESOS 00/100 M.N.);\nXVIII.- Expedición de copias certificadas que obren en la Dirección de Notarías, $45.00 (CUARENTA Y\nCINCO PESOS 00/100 M.N.) por hoja;\nXIX.- Expedición de copias simples de documentos que obren en la Dirección de Notarías, $23.00\n(VEINTITRES PESOS 00/100 M.N.) por hoja;\nXX.- Autorización para cambio de adscripción notarial, $4,760.00 (CUATRO MIL SETECIENTOS\nSESENTA PESOS 00/100 M.N.);\nXXI.- Autorización de exhumación de cadáveres para ser reinhumados en el mismo panteón $89.00\n(OCHENTA Y NUEVE PESOS 00/100 M.N.);\nXXII.- Autorización para la exhumación de cadáveres para ser reinhumados en otro panteón dentro del mismo municipio $119.00 (CIENTO DIECINUEVE PESOS 00/100 M.N.);\nXXIII.- Autorización para la exhumación de cadáveres para ser reinhumados en otros municipios del\nEstado $149.00 (CIENTO CUARENTA Y NUEVE PESOS 00/100 M.N.);\nXXIV.- Autorización para la exhumación de cadáveres para ser reinhumados fuera del Estado $224.00\n(DOSCIENTOS VEINTICUATRO PESOS 00/100 M.N.);\n(ADICIONADA, P.O. 29 DE DICIEMBRE DE 2000)\nXXIV. A.- Por el trámite de pasaporte ordinario mexicano que se realice en las oficinas de enlace con la\nSecretaría de Relaciones Exteriores, $120.00 (CIENTO VEINTE PESOS 00/100M.M.N)\n(ADICIONADA, P.O. 29 DE DICIEMBRE DE 2000)\nXXIV-B.- Por el trámite del permiso a que se refiere el artículo 27 Constitucional que se realice en las oficinas de enlace con la Secretaría de Relaciones Exteriores, $175.00 (CIENTO SETENTA Y CINCO\nPESOS 00/100 M.N.)\nLas autorizaciones a que se refieren las fracciones XXI, XXII, XXIII y XXIV se expedirán previo cumplimiento de los requisitos exigidos por la Ley Estatal de Salud; y\nXXV.- Por otros servicios no especificados, $86.00 (OCHENTA Y SEIS PESOS 00/100 M.N.).\nSUJETO\nARTICULO 88.- Son sujetos de este derecho, las personas que soliciten los servicios que se establecen en el artículo que antecede.\nPAGO\nARTICULO 89.- El pago de los derechos a que se refiere esta Sección, deberá efectuarse en las oficinas recaudadoras de rentas la Secretaría de Finanzas, Instituciones de Crédito o establecimientos autorizados, previamente a la prestación del servicio.\nSECCION CUARTA\nESTADO\nOBJETO\nARTICULO 90.- Los servicios prestados por el organismo desconcentrado de la Secretaría de Gobierno, denominado “Periódico Oficial del Gobierno del Estado”, causarán derechos conforme a la siguiente:\nTARIFA\nI.- Avisos judiciales y administrativos:\na).- Por cada palabra en primera o única inserción, $0.48 (CUARENTA Y OCHO CENTAVOS M.N.);\nb).- Por cada palabra en inserciones subsecuentes, $0.24 (VEINTICUATRO CENTAVOS M.N.).\nII.- Por publicación de aviso de registro de fierro de herrar, arete o collar o cancelación de los mismos, señal de sangre o venta, $178.00 (CIENTO SETENTA Y OCHO PESOS 00/100 M.N.);\nIII.- Publicación de balances o estados financieros, $230.00 (DOSCIENTOS TREINTA PESOS 00/100\nM.N.);\nIV.- Por costo de tipografía relativa a los fierros de registro, arete o collar por cada figura, $178.00\n(CIENTO SETENTA Y OCHO PESOS 00/100 M.N.);\n(REFORMADA, P.O. 29 DE DICIEMBRE DE 2000)\nV.- Suscripciones:\na).- Por un año, $1,078.00 (MIL SETENTA Y OCHO PESOS 00/100 M.N.);\nb).- Por seis meses, $538.00 (QUINIENTOS TREINTA Y OCHO PESOS 00/100 M.N.); y\nc).- Por tres meses, $282.00 (DOSCIENTOS OCHENTA Y DOS PESOS 00/100 M.N.).\nVI.- Número del día, $6.00 (SEIS PESOS 00/100 M.N.);\nVII.- Números atrasados hasta 6 años, $24.00 (VEINTICUATRO PESOS 00/100 M.N.);\nVIII.- Números atrasados de más de 6 años, $45.00 (CUARENTA Y CINCO PESOS 00/100 M.N.); y\nIX.- Códigos, leyes, reglamentos, suplementos o ediciones de más de 24 páginas, $59.00 (CINCUENTA\nY NUEVE PESOS 00/100 M.N.).\nEl pago de las cuotas establecidas en la fracción V, darán derecho a que el contribuyente reciba por la suscripción, todos los ejemplares incluyendo Códigos, Leyes y Reglamentos.\nPAGO\nARTICULO 91.- El pago de los derechos por los servicios a que se refiere esta Sección, deberá efectuarse en las oficinas recaudadoras de rentas de la Secretaría de Finanzas, Instituciones de Crédito o establecimientos autorizados, previamente a la prestación del servicio.\nCAPITULO SEGUNDO\nPOR SERVICIOS DE LA SECRETARIA DE FINANZAS\nSECCION PRIMERA\nOBJETO\n(REFORMADO, P.O. 28 DE DICIEMBRE DE 2007)\nARTICULO 92.- Es objeto de este Derecho, los servicios que presta la Secretaría de Finanzas, en coordinación con la Secretaría de Salud del Estado y la Secretaría de Gobierno, en el ámbito de sus respectivas competencias y en aplicación de los ordenamientos de la materia, por la expedición de licencias para el funcionamiento de establecimientos cuyos giros sean la enajenación de bebidas alcohólicas o la prestación de servicios que incluyan el expendio de dichas bebidas siempre que se efectúe total o parcialmente con el público en general y el refrendo anual de las mismas.\nSUJETO\nREFORMADO, P.O. 24 DE DICIEMBRE DE 1996)\nARTICULO 93.- Son sujetos de este derecho las personas físicas y morales que se dediquen a enajenar bebidas alcohólicas o a la prestación de servicios que incluyan el expendio de dichas bebidas, total o parcialmente con el público en general.\nOBLIGACIONES\n(REFORMADO PRIMER PÁRRAFO, P.O. 28 DE DICIEMBRE DE 2007)\nARTICULO 94.- Los sujetos de este derecho están obligados a solicitar a la Secretaría de Finanzas, previamente a la iniciación de sus actividades, la expedición de la licencia para el funcionamiento del establecimiento y el refrendo anual correspondiente.\nCuando el titular de la licencia no sea quien enajene o preste los servicios, objeto de este derecho, deberá registrar ante la Secretaría de Finanzas el nombre de la persona que en su lugar explota los derechos que le otorga la licencia mencionada.\nARTICULO 95.- Los sujetos de este derecho que cuenten con licencia para su funcionamiento, deberán de estos establecimientos.\nLa licencia y el refrendo anual, deberán exhibirse por los contribuyentes en un lugar visible del establecimiento.\nFiscal para el Estado de Coahuila.\nARTICULO 96.- Los titulares de una licencia de funcionamiento para los establecimientos señalados, de domicilio del establecimiento autorizado o de titular de la licencia.\nLas autoridades fiscales, podrán autorizar el cambio de domicilio o de titular que se solicite, siempre y expedición de una licencia de funcionamiento.\nARTICULO 97.- A la solicitud mencionada en el artículo 94, se acompañará:\nI.- Croquis en el que se indique en forma clara y precisa la ubicación del local en que se pretenda establecer.\nII.- Copia de la cédula del Registro Federal de Contribuyentes.\nIII.- Copia certificada del testimonio de la escritura pública constitutiva si se trata de una sociedad mercantil o acta de nacimiento tratándose de personas físicas.\n(REFORMADA, P.O. 28 DE DICIEMBRE DE 2007)\nIV.- Licencia municipal vigente expedida a favor del solicitante. Tratándose de solicitantes distintos al titular, se podrá expedir licencia con vigencia anual y el solicitante deberá acompañar escrito de conformidad del titular de la licencia municipal, para el uso o goce de los derechos que le otorga dicha licencia.\n(REFORMADO, P.O. 28 DE DICIEMBRE DE 2007)\nARTICULO 98.- Recibida la solicitud y documentación a que se refieren los artículos 94 y 97 de esta ley, la Secretaría de Finanzas del Gobierno del Estado, ordenará a las oficinas recaudadoras de rentas, la práctica de una inspección al local para determinar si reúne los requisitos que exige este Capítulo.\n(ADICIONADO, P.O. 24 DE DICIEMBRE DE 1996)\nARTICULO 99.- Las solicitudes de empadronamiento, las manifestaciones y los avisos se formularán haciendo uso de las formas aprobadas por la Secretaría de Finanzas del Gobierno del Estado, debiéndose asentar en ellas los datos que se señalan, anexando los documentos que se requieran.\n(REFORMADO PRIMER PÁRRAFO, P.O. 28 DE DICIEMBRE DE 2007)\nARTICULO 100.- Son causas de cancelación de la licencia para el funcionamiento de establecimientos que expendan bebidas alcohólicas y clausura de los mismos, las siguientes:\n(REFORMADA, P.O. 28 DE DICIEMBRE DE 2007)\nI.- Que no obtenga el refrendo de la licencia dentro de los tres primeros meses del ejercicio fiscal.\nII.- Que el establecimiento funciones en lugar distinto al autorizado en la licencia; o con un giro diferente al manifestado en la misma.\nIII.- Cuando habiendo presentado suspensión de actividades, esta dura más de tres años.\nIV.- Cuando se dé alguna de las otras causales de cancelación de la licencia establecidas en el artículo\n102 de esta Ley. realizando la actividad sin licencia para el funcionamiento y revalidación anual.\nARTICULO 100-A.- La Secretaría de Finanzas, en coordinación con la Secretaría de Salud del Estado y la inspección y vigilancia de los establecimientos que expendan bebidas alcohólicas, para verificar periódicamente que éstos reúnan las condiciones de salubridad e higiene que establecen las leyes, cumplan con la ubicación para le enajenación y expendio de bebidas alcohólicas, contenidos en las disposiciones legales aplicables y que su funcionamiento no ofenda la moral y las buenas costumbres.\nARTICULO 101.- Las autoridades fiscales darán a conocer mediante resolución, la cancelación de las licencias de los establecimientos que expendan bebidas alcohólicas, la cual deberá estar debidamente fundada y motivada. La motivación de la cancelación de las licencias se hará de acuerdo a los procedimientos realizados por las autoridades de salud y seguridad pública en cumplimiento con las visitas correspondientes que conforme a las normas aplicables en la materia deban efectuarse.\nEsta resolución podrá ser impugnada conforme a las disposiciones aplicables para el recurso administrativo de revocación establecido en el Código Fiscal para el Estado de Coahuila, dentro de los quince días siguientes al en que surta efectos la notificación a la que se refiere el párrafo anterior. En el mismo plazo, el contribuyente deberá suspender la enajenación o expendio de bebidas alcohólicas que realizaba al amparo de la licencia cancelada, hasta en tanto no se resuelva en definitiva sobre la inconformidad.\n(REFORMADO, P.O. 24 DE DICIEMBRE DE 1996)\nARTICULO 102.- La Secretaría de Finanzas, podrá autorizar o negar el funcionamiento de establecimientos para enajenar bebidas alcohólicas tomando en cuenta su ubicación, el número de establecimientos existentes en cada municipio, la conveniencia de combatir el alcoholismo y las disposiciones de salubridad aplicables.\n(REFORMADO, P.O. 12 DE DICIEMBRE DE 1997)\nLas autoridades fiscales negarán la expedición o cancelarán la licencia para el funcionamiento de aquellos establecimientos que con su funcionamiento o su ubicación ofendan la moral pública o las buenas costumbres, o cuando estén ubicados en la cercanía de escuelas, hospitales, parques y jardines públicos, instalaciones deportivas, cuarteles, centros de trabajo, centros culturales y templos religiosos o por así requerirlo el interés social, o cuando el establecimiento no cumpla con las normas de salubridad e higiene que establecen las leyes, incumpla en más de tres ocasiones con los horarios autorizados para la enajenación y expendio de bebidas, independientemente de las sanciones a que se haga acreedor por estos motivos. Para lo anterior la Secretaría de Finanzas solicitará la información correspondiente de las autoridades de salud y seguridad pública del Estado competentes.\nLa Secretaría de Finanzas, cuando lo considere conveniente, podrá autorizar la reubicación de los establecimientos cuya licencia de funcionamiento hubiere sido cancelada en términos del párrafo anterior.\n(REFORMADA, P.O. 28 DE DICIEMBRE DE 2007)\nARTICULO 103.- Las autoridades fiscales clausurarán los establecimientos que expendan bebidas alcohólicas cuando no cuenten con la licencia de funcionamiento y el refrendo anual, así como aquellos artículo 101 de esta Ley, cuando sea cancelada la licencia de funcionamiento con que operaba.\nARTICULO 104.- La expedición de licencia para el funcionamiento de establecimientos que enajenen bebidas alcohólicas o que presten servicios en los que se expendan dichas bebidas, causarán derechos conforme a la siguiente:\nTARIFA\nI.- Distribuidor de cerveza o vinos, ladies bar, cabaret, discotec bar, video bar, salón de baile, casa de huéspedes, hoteles de paso y moteles de paso $29,750.00 (VEINTINUEVE MIL SETECIENTOS\nCINCUENTA PESOS 00/100 M.N.);\nII.- Tienda de autoservicio $22,312.00 (VEINTIDOS MIL TRESCIENTOS DOCE PESOS 00/100 M.N.);\nIII.- Restaurante bar, restaurantes y estadios $14,875.00 (CATORCE MIL OCHOCIENTOS SETENTA Y\nCINCO PESOS 00/100 M.N.);\nIV.- Supermercados, agencias y cantina o bar $10,412.00 (DIEZ MIL CUATROCIENTOS DOCE PESOS\n00/100 M.N.);\nV.- Expendio de vinos y licores, tiendas de abarrotes, minisuper, casinos, clubes sociales y deportivos, círculos sociales y semejantes, billares y boliches, hoteles, salón de fiesta, y subagencia $7,437.00\n(SIETE MIL CUATROCIENTOS TREINTA Y SIETE PESOS 00/100 M.N.);\nVI.- Cervecerías, depósitos de cerveza y otros establecimientos en los que únicamente se enajene\ncerveza, $4,760.00 (CUATRO MIL SETECIENTOS SESENTA PESOS 00/100 M.N.); y\nVII.- Fonda, taquerías y otros de naturaleza análoga $2,380.00 (DOS MIL TRESCIENTOS OCHENTA\nPESOS 00/100 M.N.).\n(ADICIONADA, P.O. 28 DE DICIEMBRE DE 2007)\nVIII. Misceláneas $ 2,200.00 (DOS MIL DOSCIENTOS PESOS 00/100 M.N.)\n(ADICIONADO, P.O. 28 DE DICIEMBRE DE 2007)\nLa licencia para el giro de miscelánea se expedirá exclusivamente a las personas físicas que tributen bajo el Régimen de Pequeños Contribuyentes, tendrá vigencia anual y no causará los derechos por el refrendo anual.\n(ADICIONADO, P.O. 28 DE DICIEMBRE DE 2007)\nSe entenderá por giro de miscelánea, la compraventa al público en general, de productos comestibles, no comestibles, de higiene personal y de aseo para el hogar a granel, envasados, empaquetados, etiquetados y con envoltura, sin renta de máquinas de videojuegos; con venta exclusivamente de cerveza en botella cerrada y cuya rotación en inventarios mensual por la compraventa sea menor a la tarifa más baja por licencia establecida en el presente Artículo.\n(ADICIONADO, P.O. 28 DE DICIEMBRE DE 2007)\nARTICULO 104-A.- Las personas físicas y morales con establecimientos temporales que con motivo de festividades regionales, ferias, verbenas, espectáculos públicos, y eventos recreativos de naturaleza análoga, se dediquen a enajenar bebidas alcohólicas o a la prestación de servicios que incluyan el expendio de dichas bebidas, total o parcialmente con el público en general, deberán obtener el permiso del Estado.\nPara el otorgamiento del permiso, deberá hacerse una solicitud en la oficina recaudadora de rentas que corresponda, cumpliendo los requisitos que al efecto señale la autoridad estatal, acompañado del permiso temporal otorgado por el municipio en original y copia para su cotejo. giro del establecimiento que se pretende instalar. El permiso se expedirá en un plazo no menor de cinco días hábiles, previa presentación del recibo de pago y en forma individual por cada local.\nEl permiso únicamente será válido por el tiempo y en el lugar para el cual fue expedido, en ningún caso los permisos a que se refiere este artículo, podrán tener una vigencia superior a un mes, pudiendo la autoridad estatal en el ámbito de su competencia, inspeccionar y vigilar su funcionamiento. Cuando el establecimiento no cumpla con las normas que establecen las leyes, se procederá a la cancelación del\nQUE EXPENDEN BEBIDAS ALCOHOLICAS\nSECCION SEGUNDA\nOBJETO\nARTICULO 105.- La expedición de la revalidación anual para el funcionamiento de establecimientos que enajenen bebidas alcohólicas o que presten servicios en los que se expendan dichas bebidas, causarán derechos por la cantidad de $3,500.00 (TRES MIL QUINIENTOS PESOS 00/100 M.N.).\nARTICULO 105-B.- (DEROGADO, P.O. 25 DE DICIEMBRE DE 2001)\nARTICULO 105-C.- (DEROGADO, P.O. 25 DE DICIEMBRE DE 2001)\n(ADICIONADA CON LOS ARTICULOS QUE LA INTEGRAN, P.O. 29 DE DICIEMBRE DE 1998)\nSECCIÓN TERCERA\nARTICULO 105-D.- (DEROGADO, P.O. 25 DE DICIEMBRE DE 2001)\nARTICULO 105-E.- (DEROGADO, P.O. 25 DE DICIEMBRE DE 2001)\nARTICULO 105-F.- (DEROGADO, P.O. 25 DE DICIEMBRE DE 2001)\nARTICULO 105-G.- (DEROGADO, P.O. 25 DE DICIEMBRE DE 2001)\n(ADICIONADA, P.O. 29 DE DICIEMBRE DE 1998)\nSECCIÓN CUARTA\nARTICULO 105-H.- (DEROGADO, P.O. 25 DE DICIEMBRE DE 2001)\nARTICULO 105-I.- (DEROGADO, P.O. 25 DE DICIEMBRE DE 2001)\nARTICULO 105-J.- (DEROGADO, P.O. 25 DE DICIEMBRE DE 2001)\nARTICULO 105-K.- (DEROGADO, P.O. 25 DE DICIEMBRE DE 2001)\nARTICULO 106.- Cuando el establecimiento cuente con licencia y habiendo presentado aviso de suspensión de actividades, las reinicie en el 1o., 2o., 3o. o 4o., trimestre, pagará por ese año el 100%, 75%, 50% o 25%, respectivamente de las tarifas establecidas en el artículo 105, sin perjuicio de las reducciones a que se tenga derecho conforme a los artículos 109 y 110 de esta Ley.\nARTICULO 107.- La autorización de cambio de titular de una licencia causará derechos a razón del 50% de la tarifa establecida en el artículo 104, según el establecimiento de que se trate.\nARTICULO 108.- La autorización de cambio de domicilio de una licencia causará derechos a razón del\n25% de la tarifa establecida en el artículo 104, según el establecimiento de que se trate. tarifa establecida en el artículo 104, según el establecimiento de que se trate. En ningún caso dará lugar a devolución por cambio de giro.\nARTICULO 109.- Las tarifas establecidas en los artículos 104, 105, 107 y 108, se reducirán en un 25%, de los siguientes municipios: Allende, Francisco I. Madero, Matamoros, Múzquiz, Nava, Parras, San\nBuenaventura, San Juan de Sabinas y San Pedro.\n(REFORMADO, P.O. 28 DE DICIEMBRE DE 2007)\nARTICULO 110.- Las tarifas establecidas en los artículos 104, 105, 107 y 108, se reducirán en un 50%, cuando el establecimiento para el que se expida la autorización y licencia anual se encuentre en alguno de los siguientes municipios: Abasolo, Candela, Castaños, Cuatro Ciénegas, Escobedo, General Cepeda, Guerrero, Hidalgo, Jiménez, Juárez, Lamadrid, Morelos, Nadadores, Ocampo, Progreso, Sacramento, Sierra Mojada, Viesca, Villa Unión y Zaragoza.\nPAGO\n(REFORMADO, P.O. 28 DE DICIEMBRE DE 2007)\nARTICULO 111.- El pago de este derecho deberá realizarse en las oficinas recaudadoras de rentas de la\nSecretaría de Finanzas, Instituciones de Crédito o establecimientos autorizados, dentro de los tres primeros meses de cada ejercicio fiscal y previamente a la expedición de la licencia de funcionamiento y refrendo anual, en su caso.\n(REFORMADA, P.O. 29 DE DICIEMBRE DE 1998)\nSECCION QUINTA\nLOS PRESTADOS POR SUS UNIDADES ADMINISTRATIVAS\n(REFORMADO, P.O. 24 DE DICIEMBRE DE 1996)\nARTICULO 112.- Los demás servicios que presta la Secretaría de Finanzas a través de sus Unidades\nAdministrativas causarán derechos conforme a la siguiente:\nTARIFA\nI.- Certificaciones, $55.00 (CINCUENTA Y CINCO PESOS 00/100 M.N.), por la primera hoja; $17.00\n(DIECISIETE PESOS 00/100 M.N.), por hoja adicional;\nII.- Expedición de copia simple, $2.00 (DOS PESOS 00/100 M.N.), por hoja;\nIII.- Servicios periciales contables, $36.00 (TREINTA Y SEIS PESOS 00/100 M.N.) por hora, por auditor; y\nIV.- Por constancias del padrón vehicular, $55.00 (CINCUENTA Y CINCO PESOS 00/100 M.N.), por la primera hoja; $17.00 (DIECISIETE PESOS 00/100 M.N.) por hoja adicional.\nARTICULO 113.- El pago de los derechos a que se refiere esta Sección deberá efectuarse en las oficinas recaudadoras de rentas de la Secretaría de Finanzas, Instituciones de Crédito o establecimientos autorizados, previamente a la prestación del servicio.\nCAPITULO TERCERO\nARTICULO 114.- Los servicios que presta la Secretaría de Desarrollo Social, causarán derechos conforme a la siguiente:\nTARIFA\nI.- Aprobación de planos y expedición de licencias para fraccionamientos:\n1.- Residencial, $0.24 (VEINTICUATRO CENTAVOS M.N.), por metro cuadrado vendible;\n2.- Medio, $0.12 (DOCE CENTAVOS M.N.), por metro cuadrado vendible;\n3.- Interés social, $0.04 (CUATRO CENTAVOS M.N.), por metro cuadrado vendible;\n4.- Popular, $0.06 (SEIS CENTAVOS M.N.), por metro cuadrado vendible;\n5.- Comerciales, $0.44 (CUARENTA Y CUATRO CENTAVOS M.N.), por metro cuadrado vendible;\n6.- Industriales, $0.12 (DOCE CENTAVOS M.N.), por metro cuadrado vendible;\n7.- Cementerios, $0.06 (SEIS CENTAVOS M.N.), por metro cuadrado vendible; y\n8.- Campestres, $0.07 (SIETE CENTAVOS M.N.), por metro cuadrado vendible;\nII.- Adecuaciones de lotificaciones, $75.00 (SETENTA Y CINCO PESOS 00/100 M.N.) cada una;\nIII.- Relotificaciones:\n1.- Habitacionales, $0.12 (DOCE CENTAVOS M.N.), por metro cuadrado vendible;\n2.- Campestres, $0.13 (TRECE CENTAVOS M.N.), por metro cuadrado vendible;\n3.- Industriales, $0.07 (SIETE CENTAVOS M.N.), metro cuadrado vendible; y\n4.- Comerciales, $0.11 (ONCE CENTAVOS M.N.), por metro cuadrado vendible.\nIV.- Condominios, $0.11 (ONCE CENTAVOS M.N.), por metro cuadrado de construcción;\nV.- Expedición de planos, pliegos de requisitos, especificaciones y documentación necesaria para la participación en los concursos, para la adjudicación de contratos de obra pública o de suministro de materiales, $540.00 (QUINIENTOS CUARENTA PESOS 00/100 M.N.);\nVI.- Licencias para construcción de industrias de más de 5,000 metros cuadrados, $0.18 (DIECIOCHO\nCENTAVOS M.N.), por metro cuadrado;\nVII.- Licencias para construcción de edificios de más de 1,000 metros cuadrados, $0.36 (TREINTA Y\nSEIS CENTAVOS M.N.) por metro cuadrado;\nVIII.- Evaluación de la manifestación de impacto ambiental en su modalidad general, $1,190.00 (MIL\nCIENTO NOVENTA PESOS 00/100 M.N.);\nIX.- Expedición de certificados de aptitud para la prestación de servicios profesionales y emisión de estudios químico-analíticos, en materia ambiental, $1,095.00 (MIL NOVENTA Y CINCO PESOS 00/100\nM.N.);\nX.- Determinación del informe preventivo de impacto ambiental, $595.00 (QUINIENTOS NOVENTA Y\nCINCO PESOS 00/100 M.N.); y\nXI.- Otros servicios:\n1.- Por uso del tren escénico de la Unidad Deportiva Francisco I. Madero, $2.00 (DOS PESOS 00/100\nM.N.), por persona; y\n2.- Por uso de las embarcaciones recreativas de la Unidad Deportiva Francisco I. Madero, $2.00 (DOS\nPESOS 00/100 M.N.), por persona.\nSUJETO\n(REFORMADO, P.O. 24 DE DICIEMBRE DE 1996)\nARTICULO 115.- Son sujetos de este derecho, las personas físicas o morales que soliciten los servicios mencionados en el artículo anterior.\nSon solidariamente responsables del pago de este derecho los constructores y contratistas que realicen obras relativas al objeto de este derecho.\nPAGO\n(REFORMADO, P.O. 28 DE DICIEMBRE DE 2007)\nARTICULO 116.- El pago de los derechos a que se refiere este Capítulo deberá efectuarse en las oficinas recaudadoras de rentas de la Secretaría de Finanzas, Instituciones de Crédito o establecimientos autorizados, previamente a la prestación del servicio.\nEXENCIONES\n(REFORMADO, P.O. 24 DE DICIEMBRE DE 1996)\nARTICULO 117.- No se causará este derecho cuando los servicios que se presten tengan por objeto la regularización de la tenencia de la tierra urbana y sean solicitados por Dependencias o Entidades\nPúblicas Estatales, Federales y Municipales, que tengan a su cargo la responsabilidad de este tipo de programas.\nCAPITULO CUARTO\nSECCION PRIMERA\nPOR SERVICIOS DE CONTROL VEHICULAR\nARTICULO 118.- Los servicios que presta la Secretaría de Obras Públicas y Transporte, relativos a control vehicular causarán derechos conforme a la siguiente:\nTARIFA\nI.- Expedición de tarjetas de circulación y calcomanía con número identificatorio o refrendo anual:\n1.- Automóviles, camiones y camionetas:\na).- Hasta de 10 años de fabricación anteriores al ejercicio fiscal en curso, $312.00 (TRESCIENTOS\nDOCE PESOS 00/100 M.N.).\nb).- De más de 10 años y hasta 20 años de fabricación anteriores al ejercicio fiscal en curso, $238.00\n(DOSCIENTOS TREINTA Y OCHO PESOS 00/100 M.N.).\nc).- De más de 20 años de fabricación anteriores al ejercicio fiscal en curso, $164.00 (CIENTO SESENTA\nY CUATRO PESOS 00/100 M.N.).\nd) Los vehículos con capacidad de carga de tres o más toneladas, omnibuses y tractores no agrícolas tipo quinta rueda, además de la cuota que les corresponde conforme a los subincisos anteriores, deberán pagar la cantidad de $543.00 (QUINIENTOS CUARENTA Y TRES PESOS 00/100 M.N.) con el refrendo anual, a excepción de los vehículos que presten el servicio público de pasajeros o carga, mediante concesión otorgada por las autoridades estatales o municipales.\n2.- Vehículos de servicio público, $387.00 (TRESCIENTOS OCHENTA Y SIETE PESOS 00/100 M.N.).\n3.- Remolque de servicio público, $220.00 (DOSCIENTOS VEINTE PESOS 00/100 M.N.).\n4.- Para demostración, $387.00 (TRESCIENTOS OCHENTA Y SIETE PESOS 00/100 M.N.).\nII.- Expedición de juego de placas para demostración de vehículos $744.00 (SETECIENTOS CUARENTA\nY CUATRO PESOS 00/100 M.N.);\nIII.- Expedición de tarjeta de circulación para remolques accionados por vehículos de tracción mecánica;\n$238.00 (DOSCIENTOS TREINTA Y OCHO PESOS 00/100 M.N.);\nIV.- Expedición de placa y tarjeta de circulación con vigencia anual para motocicleta, $75.00 (SETENTA Y\nCINCO PESOS 00/100 M.N.);\nV.- Expedición de placa para bicicleta, $23.00 (VEINTITRES PESOS 00/100 M.N.);\nVI.- Dotación de placas metálicas con número identificatorio para los vehículos siguientes:\n(REFORMADO, P.O. 22 DE DICIEMBRE DE 2006)\n1.- Automóviles, camiones y camionetas, $480.00 (CUATROCIENTOS OCHENTA PESOS 00/100 M.N.);\n2.- Vehículos de servicio público, $245.00 (DOSCIENTOS CUARENTA Y CINCO PESOS 00/100 M.N.); y\n3.- Remolques $119.00 (CIENTO DIECINUEVE PESOS 00/100 M.N.).\nEn el caso de que el contribuyente adquiera placas metálicas con número identificatorio, además deberá identificatorio.\nVII.- Expedición de licencias para conducir vehículos:\n1.- Motociclista $30.00 (TREINTA PESOS 00/100 M.N.);\n2.- Chofer servicio particular $95.00 (NOVENTA Y CINCO PESOS 00/100 M.N.);\n3.- Automovilista $95.00 (NOVENTA Y CINCO PESOS 00/100 M.N.);\n4.- Chofer de servicio público $133.00 (CIENTO TREINTA Y TRES PESOS 00/100 M.N.);\n5.- Chofer para transporte de materiales peligrosos, $170.00 (CIENTO SETENTA PESOS 00/100 M.N.); y\n6.- Costo de la fotografía digitalizada en la licencia, $40.00.\n7.- DEROGADO\nVIII.- Expedición de permisos por quince días para circular sin placas por una sola vez $45.00\n(CUARENTA Y CINCO PESOS 00/100 M.N.);\nIX.- Reposición o cambio de tarjeta de circulación, $112.00 (CIENTO DOCE PESOS 00/100 M.N.);\nX.- Tarjetón de identificación del servicio público de transporte, $100.00 (CIEN PESOS 00/100 M.N.);\nXI.- Expedición de constancia o certificación de documentos relativos a derechos de control vehicular,\n$55.00 (CINCUENTA Y CINCO PESOS 00/100 M.N.); y\nXII.- La baja de placas del Estado y de otros Estados $0.00.\nOBLIGACIONES\n(REFORMADO, P.O. 24 DE DICIEMBRE DE 1996)\nARTICULO 119.- El propietario de un vehículo deberá dar aviso si se llevase a cabo la enajenación de éste o fuese motivo de baja en la circulación.\nLos avisos a que se refiere este artículo deberán presentarse dentro de los quince días siguientes al en que se realice la operación.\n(REFORMADO, P.O. 24 DE DICIEMBRE DE 1996)\nARTICULO 120.- El solicitante del servicio de control vehicular y el adquirente de placas y tarjeta de circulación, deberán dar aviso de cuantos cambios de domicilio lleve a cabo que alteren el registro vehicular.\nLos avisos a que se refiere este artículo, deberán presentarse dentro de los quince días siguientes al en que se realice la operación.\nPAGO\n(REFORMADO PRIMER PÁRRAFO, P.O. 28 DE DICIEMBRE DE 2007)\nARTICULO 121.- El pago de estos derechos deberá hacerse en las oficinas recaudadoras de rentas de la que establece esta ley.\nLa adquisición de placas, tarjeta de circulación y engomado con número identificatorio, deberá realizarse dentro de los primeros tres meses del año siguiente al en que venza su vigencia. Las personas físicas o morales que adquieran vehículos nuevos o usados que no cuenten con placas, deberán hacerlo dentro de los quince días siguientes a la fecha de adquisición.\nEl refrendo anual correspondiente a las placas metálicas, deberá pagarse dentro de los primeros tres meses de cada año.\nLos demás derechos regulados en esta Sección, se pagarán en el momento en que se soliciten.\nARTICULO 122.- Los documentos relativos a los servicios de control vehicular serán entregados a los contribuyentes por la Secretaría de Finanzas previo pago de las contribuciones correspondientes.\nARTICULO 123.- La falta de pago oportuno de los derechos a que se refieren las fracciones I, III, IV, V y\nVI del artículo 118 de esta ley, causarán recargos conforme a la tasa que establezca la Ley de Ingresos del Estado.\nARTICULO 124.- Los vehículos, cuyos propietarios no cumplan dentro del plazo establecido en este\nCapítulo, con sus obligaciones fiscales de control vehicular, y por consecuencia no cuenten con tarjeta de circulación vigente, amparada por el engomado correspondiente, serán sujetos a los procedimientos económicos coactivos previstos en la legislación aplicable en el Estado.\n(REFORMADO, P.O. 23 DE ENERO DE 1998)\nARTICULO 125.- Las autoridades fiscales, en cumplimiento a lo señalado en el artículo que antecede, podrán embargar precautoriamente los vehículos que no cuenten con la tarjeta de circulación actualizada por el engomado correspondiente, cuando se incumplan las obligaciones fiscales de control vehicular en dos ejercicios fiscales consecutivos, siguiendo para ello los procedimientos legales correspondientes.\n(ADICIONADO, P.O. 23 DE ENERO DE 1998)\nSi el contribuyente, en la diligencia de embargo, se niega a ser depositario del vehículo con todas las obligaciones inherentes a la depositaría judicial que contemple el Código de Procedimientos Civiles, o durante la diligencia omite o se niega a manifestar su aceptación de la referida depositaria, no obstante ser informado de ese derecho, el vehículo quedará bajo la depositaria de la autoridad fiscal, en el lugar que ésta designe para su guarda, corriendo el contribuyente con los gastos que se originen por este concepto.\n(ADICIONADO, P.O. 23 DE ENERO DE 1998)\nEn los supuestos del párrafo anterior, si es necesario, la autoridad fiscal podrá requerir el auxilio de la fuerza pública para el traslado del vehículo al lugar designado por aquélla.\n(ADICIONADO, P.O. 23 DE ENERO DE 1998)\nSi antes de que se agote el procedimiento económico-coactivo, el contribuyente cumple con el pago de los derechos a que se refiere esta Sección y los recargos correspondientes, o conviene con las autoridades fiscales el cumplimiento de su adeudo, se levantará el embargo que se hubiere practicado sobre su vehículo.\nSECCION SEGUNDA\nPOR OTROS SERVICIOS\nARTICULO 126.- Los servicios prestados por la Secretaría de Obras Públicas y Transporte, causarán derechos conforme a la siguiente:\nTARIFA\nI.- Concesiones de ruta para explotar el servicio de autotransporte de pasajeros en carreteras locales:\n1.- Expedición, $3,178.00 (TRES MIL CIENTO SETENTA Y OCHO PESOS 00/100 M.N.); y\n2.- Refrendo anual, $953.00 (NOVECIENTOS CINCUENTA Y TRES PESOS 00/100 M.N.).\nII.- Permiso con vigencia de cinco años para servicio de transporte especializado escolar o para trabajadores:\n1.- Expedición, $1,000.00 (MIL PESOS 00/100 M.N.);\n2.- Refrendo:\na).- En planteles educativos, $317.00 (TRESCIENTOS DIECISIETE PESOS 00/100 M.N.); y\nb).- En empresas, $381.00 (TRESCIENTOS OCHENTA Y UN PESOS 00/100 M.N.).\nIII.- Permiso anual para transporte de carga especializada de materiales o residuos peligrosos, $750.00\n(SETECIENTOS CINCUENTA PESOS 00/100 M.N.);\nIV.- Permiso anual para servicio de transporte especializado de carga:\n1.- De comestibles, $350.00 (TRESCIENTOS CINCUENTA PESOS 00/100 M.N.);\n2.- De minerales, $892.00 (OCHOCIENTOS NOVENTA Y DOS PESOS 00/100 M.N.);\n3.- Material de construcción, $744.00 (SETECIENTOS CUARENTA Y CUATRO PESOS 00/100 M.N.); y\n4.- Otros productos, $350.00 (TRESCIENTOS CINCUENTA PESOS 00/100 M.N.).\nV.- Permiso anual para grúas, $744.00 (SETECIENTOS CUARENTA Y CUATRO PESOS 00/100 M.N.);\nVI.- Transferencia de concesiones, $892.00 (OCHOCIENTOS NOVENTA Y DOS PESOS 00/100 M.N.);\nVII.- Autorización de nueva ruta $4,462.00 (CUATRO MIL CUATROCIENTOS SESENTA Y DOS PESOS\n00/100 M.N.);\nVIII.- Ampliación de ruta del servicio de transporte de pasajeros, $2,231.00 (DOS MIL DOSCIENTOS\nTREINTA Y UN PESOS 00/100 M.N.);\nIX.- Permiso temporal hasta por treinta días naturales para circular fuera de ruta, $224.00 (DOSCIENTOS\nVEINTICUATRO PESOS 00/100 M.N.);\nX.- Revisión mecánica a vehículos de servicio público, $45.00 (CUARENTA Y CINCO PESOS 00/100\nM.N.);\nXI.- Verificación de emisiones de contaminantes, $36.00 (TREINTA Y SEIS PESOS 00/100 M.N.);\nXII.- Constancia de extravío de documentos $45.00 (CUARENTA Y CINCO PESOS 00/100 M.N.); y\nXIII.- Otros servicios:\n1.- Construcción de obras para acceso, $311.00 (TRESCIENTOS ONCE PESOS 00/100 M.N.);\n2.- Cruzamientos, instalaciones marginales y áreas subterráneas, $311.00 (TRESCIENTOS ONCE\nPESOS 00/100 M.N.);\n3.- Construcción de obras para fines de publicidad, $415.00 (CUATROCIENTOS QUINCE PESOS 00/100\nM.N.);\n4.- Conservación, modificación, ampliación y reparación de obras en el derecho de vía, $156.00 (CIENTO\nCINCUENTA Y SEIS PESOS 00/100 M.N.);\n5.- Retiro de anuncios u obras publicitarias, $156.00 (CIENTO CINCUENTA Y SEIS PESOS 00/100\nM.N.);\n6.- Por la autorización para operar y por prórroga para operar las Escuelas de Manejo, conforme al\n7.- SE DEROGA.\n8.- SE DEROGA.\nXIV.- Por los servicios relacionados con el otorgamiento de permisos para la construcción de obras dentro del derecho de vía de los caminos y puentes de jurisdicción estatal, se pagarán derechos conforme a las siguientes cuotas:\n1.- Estudios técnicos de planos, proyectos y memorias de obra, para obras de instalaciones marginales dentro del derecho de vía en carreteras y puentes de jurisdicción estatal por cada cien metros lineales o fracción que exceda de dicha longitud $1,332.00.\n2.- Estudios técnicos de planos, proyectos y memorias de obra, para construcción de obras por cruzamientos superficiales, subterráneos o aéreos que atraviesen carreteras o puentes de jurisdicción estatal $1,332.00.\n3.- Autorización para la construcción de accesos que afecten el derecho de vía de una carretera, incluyendo la supervisión de las obras 14% sobre el costo de la misma.\n4.- Por el estudio técnico del proyecto, supervisión y autorización de obra para paradores 1% sobre el costo total de la obra.\n5.- Por el estudio de planos, proyectos y memorias de obras y expedición de autorización para la construcción de obras e instalaciones marginales subterráneas para cables de redes de telecomunicación que se realicen dentro del derecho de vía de carreteras estatales, por kilómetro o fracción $795.60.\n(ADICIONADA, P.O. 25 DE DICIEMBRE DE 2001)\nXV.- Por el permiso para la construcción de accesos que afecten el derecho de vía de un camino o puente de cuota, incluyendo la supervisión de la obra se pagarán derechos conforme a las siguientes cuotas:\n1.- Proyecto a realizar en terreno plano $13,041.60.\n2.- Proyecto a realizar en terreno de lomerío con geometría en corte $14,365.20.\n3.- Proyecto a realizar en terreno de lomerío con geometría en terraplén $15,688.80.\n4.- Proyecto a realizar en terreno montañoso con geometría en corte $17,011.20\n5.- Proyecto a realizar en terreno montañoso con geometría en terraplén $18,334.80.\nXVI.- Por el estudio técnico del proyecto, supervisión y permiso de obras para paradores en camino y puentes se pagarán derechos conforme a lo siguiente:\n1.- Con superficie total de proyecto hasta 3,000 metros cuadrados $3,020.40.\n2.- Con superficie total de proyecto hasta 5,000 metros cuadrados $36,480.00.\n3.- Con superficie total de proyecto hasta 10,000 metros cuadrados $42,717.60.\n4.- Con superficie mayor a los 10,000 metros cuadrados, por cada 1,000 metros cuadrados adicionales $1,228.80.\nSUJETO\nARTICULO 127.- Son sujetos de este derecho, las personas físicas o morales que soliciten los servicios mencionados en el artículo anterior. obras relativas al objeto de este derecho.\n(REFORMADO, P.O. 28 DE DICIEMBRE DE 2007)\nARTICULO 128.- El pago de los derechos a que se refiere esta Sección, deberá efectuarse en las oficinas recaudadoras de rentas de la Secretaría de Finanzas, Instituciones de Crédito o establecimientos autorizados, previamente a la prestación del servicio.\nCAPITULO QUINTO\nPOR SERVICIOS DE LA SECRETARIA DE EDUCACION Y CULTURA\n(REFORMADO, P.O. 22 DE DICIEMBRE DE 2006)\nARTICULO 129.- Los servicios que presta la Secretaría de Educación y Cultura causarán derechos, conforme a la siguiente:\nTARIFA\n(REFORMADA, P.O. 29 DE JUNIO DE 1999)\nI.- Registros de títulos profesionales, excepto los que expidan las Escuelas Normales del Estado, el\nInstituto Estatal de Capacitación y Actualización del Magisterio y la Universidad Pedagógica Nacional\n$236.00 (DOSCIENTOS TREINTA Y SEIS PESOS 00/100 M.N.);\nII.- Registro de títulos profesionales que procedan de otro Estado, $357.00 (TRESCIENTOS CINCUENTA\nY SIETE PESOS 00/100 M.N.);\n(REFORMADA, P.O. 30 DE DICIEMBRE DE 2005)\nIII.- Registro de documentos que acrediten estudios en escuelas comerciales o de formación para el\ntrabajo, $336.00 (TRESCIENTOS TREINTA Y SEIS PESOS 00/100 M.N.);\nIV.- Legalización de firmas de certificados universitarios y de la Secretaría de Educación Pública del\nEstado, $69.00 (SESENTA Y NUEVE PESOS 00/100 M.N.) por firma;\nV.- Por autorización de incorporación de planteles escolares $7,437.00 (SIETE MIL CUATROCIENTOS\nTREINTA Y SIETE PESOS 00/100 M.N.);\nVI.- Por trámite de autorización para la incorporación de planteles escolares $744.00 (SETECIENTOS\nCUARENTA Y CUATRO PESOS 00/100 M.N.);\nVII.- Por incorporación y el refrendo anual al sistema educativo estatal de las escuelas particulares de educación inicial, preescolar, primaria, secundaria bachillerato, academias comerciales o carreras terminales sin bachillerato y educación superior $35.00 (TREINTA Y CINCO PESOS 00/100 M.N.), por alumno.\nLos derechos que establece esta fracción, deberán pagarse dentro del mes de octubre de cada año.\nLa omisión en el pago de este derecho dentro del plazo establecido en el párrafo que antecede, causará recargos conforme a la tasa que establezca la Ley de Ingresos para el Estado de Coahuila.\nVIII.- Por autorización de examen a título de suficiencia en escuelas de nivel medio superior y superior\n$75.00 (SETENTA Y CINCO PESOS 00/100 M.N.);\nIX.- Por equivalencia de estudios de nivel medio y superior $149.00 (CIENTO CUARENTA Y NUEVE\nPESOS 00/100 M.N.); y\nX.- Por revalidación de estudios de primaria, secundaria y bachillerato hechos en el extranjero $149.00\n(CIENTO CUARENTA Y NUEVE PESOS 00/100 M.N.).\n(ADICIONADA, P.O. 25 DE DICIEMBRE DE 2001)\nXI.- Por registro de Título y expedición de cédula profesional, $508.00\n(ADICIONADA, P.O. 25 DE DICIEMBRE DE 2001)\nXII.- Por registro Estatal de Profesionistas $120.00\n(ADICIONADA, P.O. 25 DE DICIEMBRE DE 2001)\nXIII.- Por registro de Colegios de Profesionistas $3,500.00\n(ADICIONADA, P.O. 25 DE DICIEMBRE DE 2001)\nXIV.- Por encomienda al Registro del Colegio de Profesionistas:\n1.- Por cambio de nomenclatura del Colegio $400.00\n2.- Por cambios en nómina de socios $100.00\n3.- Por cada miembro anexado $50.00\n(ADICIONADA, P.O. 25 DE DICIEMBRE DE 2001)\nXV.- Por consultas de Archivo $40.00\n(ADICIONADA, P.O. 25 DE DICIEMBRE DE 2001)\nXVI.- Por constancia de antecedentes profesionales $90.00\n(ADICIONADA, P.O. 25 DE DICIEMBRE DE 2001)\nXVII.- Por constancia por cédula profesional en trámite $50.00\n(ADICIONADA, P.O. 25 DE DICIEMBRE DE 2001)\nXVIII.- Por expedición por cada documento en archivo $5.00\nXIX.- Por la elaboración de constancias de trámites, $100.00.\nXX.- Por movimientos de escuelas incorporadas a las cuales se les otorga nuevo acuerdo de incorporación, $500.00.\nXXI.- Por cotejo de documentos originales, $20.00.\nXXII.- Por copias simples de oficios y documentos, $15.00 por hoja tamaño carta u oficio.\nXXIII.- Por constancia de estudio $30.00.\nXXIV.- Por certificación de documentos $20.00.\nSUJETO\nARTICULO 130.- Son sujetos de este derecho, las personas que soliciten los servicios que se establecen en el artículo que antecede.\nPAGO\n(REFORMADO, P.O. 28 DE DICIEMBRE DE 2007)\nARTICULO 131.- El pago de los derechos a que se refiere este Capítulo, deberá efectuarse en las oficinas recaudadoras de rentas de la Secretaría de Finanzas, Instituciones de Crédito o establecimientos autorizados, previamente a la prestación del servicio.\nCAPITULO SEXTO\nPOR SERVICIOS DE LA SECRETARIA DE LA FUNCIÓN PÚBLICA\n(REFORMADO, P.O. 22 DE DICIEMBRE DE 2006)\nARTICULO 132.- Por el servicio de verificación, evaluación y supervisión que las leyes de la materia encomiendan a la Secretaría de la Función Pública en la ejecución de obra pública, los contratistas con quienes se celebren contratos de obra pública directa del Estado y de servicios relacionados con la misma, pagarán un derecho equivalente de 5 al millar sobre le importe de cada una de las estimaciones de obra que presenten o sobre el importe del contrato.\n(REFORMADO, P.O. 24 DE DICIEMBRE DE 1996)\nARTICULO 133.- Por otros servicios:\nI.- Por la expedición de certificados de no existencia de registros de inhabilitación para desempeñar un empleo, cargo o comisión en el servicio público $60.00 (SESENTA PESOS 00/100 M.N.);\nII.- Por la expedición de certificado de aptitud para ser proveedor del Gobierno del Estado, $595.00\n(QUINIENTOS NOVENTA Y CINCO PESOS 00/100 M.N.);\nIII.- Por inscripción en el padrón de proveedores, $0.00; y\nIV.- Por la expedición de copias certificadas $55.00 (CINCUENTA Y CINCO PESOS 00/100 M.N.), por la primera hoja; $17.00 (DIECISIETE PESOS 00/100 M.N.) por hoja adicional.\nSUJETO\nARTICULO 134.- Son sujetos de este derecho, las personas que soliciten los servicios que establece este Capítulo.\nPAGO hacer el pago parcial o total de las obras o servicios, retendrá el importe de los derechos a que se refiere el artículo 132 de esta ley.\nEl pago de los derechos por los servicios a que se refiere el artículo 133, deberá efectuarse en las oficinas recaudadoras de la Secretaría de Finanzas, instituciones de crédito o establecimientos autorizados, previamente a la prestación del servicio.\nCAPITULO SEPTIMO\nOBJETO\n(REFORMADO, P.O. 24 DE DICIEMBRE DE 1996)\nARTICULO 136.- Los servicios que presta la Procuraduría General de Justicia del Estado a través de sus unidades administrativas, causarán derechos conforme a la siguiente:\nTARIFA\nI.- Los prestados por el Departamento de Servicios Periciales de:\n1.- Pruebas y Técnicas:\n(REFORMADO, P.O. 29 DE DICIEMBRE DE 2000)\na).- Prueba de espermatobioscopia, $107.00 (CIENTO SIETE PESOS 00/100 M.N.)\nb).- Técnica de bencidina, $89.00 (OCHENTA Y NUEVE PESOS 00/100 M.N.);\nc).- Técnica de fonolftaleina, $104.00 (CIENTO CUATRO PESOS 00/100 M.N.);\nd).- Prueba de leucomalaquita verde, $105.00 (CIENTO CINCO PESOS 00/100 M.N.);\ne).- Prueba de determinación de grupo sanguíneo, $155.00 (CIENTO CINCUENTA Y CINCO PESOS\n00/100 M.N.);\nf).- Prueba de determinación de grupo sanguíneo/factor R.H., $202.00 (DOSCIENTOS DOS PESOS\n00/100 M.N.);\ng).- Prueba de dequenois, $107.00 (CIENTO SIETE PESOS 00/100 M.N.);\nh).- Prueba de radiozonato de sodio, $119.00 (CIENTO DIECINUEVE PESOS 00/100 M.N.);\ni).- Prueba de walker, $263.00 (DOSCIENTOS SESENTA Y TRES PESOS 00/100 M.N.);\nj).- Técnica de adler, $104.00 (CIENTO CUATRO PESOS 00/100 M.N.);\nk).- Técnica de takayama, $150.00 (CIENTO CINCUENTA PESOS 00/100 M.N.);\nl).- Prueba de fosfatasa, $416.00 (CUATROCIENTOS DIECISEIS PESOS 00/100 M.N.);\nm).- Prueba de identificación de drogas diversas (anfetaminas, heroína, cocaína, etc.), $208.00\n(DOSCIENTOS OCHO PESOS 00/100 M.N.); y\nn).- Prueba para detectar el consumo de substancias consideradas como narcóticos (antidoping), $221.00\n(DOSCIENTOS VEINTIUN PESOS 00/100 M.N.).\n2.- Otros servicios periciales:\na).- Cotejo de proyectiles, $409.00 (CUATROCIENTOS NUEVE PESOS 00/100 M.N.);\nb).- Peritaje de tránsito terrestre, $973.00 (NOVECIENTOS SETENTA Y TRES PESOS 00/100 M.N.);\nc).- Grafoscopía, $714.00 (SETECIENTOS CATORCE PESOS 00/100 M.N.);\nd).- Valoración de daños, $940.00 (NOVECIENTOS CUARENTA PESOS 00/100 M.N.);\ne).- Dactiloscopía, $568.00 (QUINIENTOS SESENTA Y OCHO PESOS 00/100 M.N.);\nf).- Certificado de no antecedentes policíacos, $44.00 (CUARENTA Y CUATRO PESOS 00/100 M.N.)\ng).- Certificaciones y constancias, $55.00 (CINCUENTA Y CINCO PESOS 00/100 M.N.).\n(REFORMADO, P.O. 29 DE DICIEMBRE DE 2000)\nEn todos los casos en que el personal del Departamento de servicios periciales, con o sin equipo, deba trasladarse fuera de los locales en que normalmente presten sus servicios, se causarán derechos de\n$11.00 (ONCE PESOS 00/100 M.N.) por kilómetro.\nII.- Los prestados por otras unidades administrativas de la Procuraduría General de Justicia:\n(REFORMADO, P.O. 29 DE DICIEMBRE DE 2000)\n1.- Certificaciones y constancias, $75.00 (SETENTA Y CINCO PESOS 00/100 M.N.)\n2.- Por otros servicios no especificados, $74.00 (SETENTA Y CUATRO PESOS 00/100 M.N.).\nPAGO\n(REFORMADO, P.O. 28 DE DICIEMBRE DE 2007)\nARTICULO 137.- El pago de los servicios a que se refiere este Capítulo deberá efectuarse en las oficinas recaudadoras de rentas de la Secretaría de Finanzas, Instituciones de Crédito o establecimientos autorizados, previamente a la prestación del servicio.\nCAPITULO OCTAVO\nPOR SERVICIOS AEROPORTUARIOS\nOBJETO\nCAPITULO NOVENO\nOBJETO\nARTICULO 140-A.- Es objeto de este derecho, los servicios que prestan las dependencias de la\nAdministración Pública Centralizada a que se refiere el artículo 17 de la Ley Orgánica para la\nAdministración Pública del Estado de Coahuila de Zaragoza, por los documentos físicos o que en medios magnéticos les sean solicitados en materia del derecho de acceso a la información pública.\nSUJETO\nARTICULO 140-B.- Son sujetos de este derecho las personas físicas y morales que soliciten los servicios a que se refiere el artículo anterior.\n(ADICIONADO, P.O. 31 DE DICIEMBRE DE 2004)\nARTICULO 140-C.- Los servicios a que se refiere el presente Capítulo, causarán derechos conforme a la siguiente:\nTARIFA\nI.- Por la expedición de copia simple, se pagará $1.00 (UN PESO 00/100 M.N.), por hoja.\nII.- Por expedición de copia certificada, se pagarán $30.00 (TREINTA PESOS 00/100 M.N.), por hoja.\nIII.- Por expedición de copia a color, se pagarán $15.00 (QUINCE PESOS 00/100 M.N.), por hoja.\nIV.- Por cada disco flexible de 3.5 pulgadas que contenga la información requerida, se pagarán $5.00\n(CINCO PESOS 00/100 M.N.).\nV.- Por cada disco compacto que contenga la información requerida, se pagarán $10.00 (DIEZ PESOS\n00/100 M.N.).\nVI.- Por expedición de copia simple de planos, se pagarán de $50.00 (CINCUENTA PESOS 00/100 M.N.) por metro cuadrado.\nVII.- Por expedición de copia certificada de planos, se pagarán $30.00 (TREINTA PESOS 00/100 M.N.) adicionales a la cuota que le corresponde conforme a la fracción VI de éste artículo.\n(ADICIONADO, P.O. 31 DE DICIEMBRE DE 2004)\nARTICULO 140-D.- Las personas obligadas al pago de los derechos a que se refiere el presente\nCapítulo, deberán cubrir, en su caso, los gastos de envío que se generen.\nEl envío de la información solicitada, podrá realizarse por correo simple, correo certificado con acuse de correspondiente al momento de emitir la liquidación a que se refiere el artículo siguiente.\nPAGO\nARTICULO 140-E.- El pago de los servicios y gastos a que se refiere este Capítulo, deberá efectuarse en las oficinas recaudadoras de rentas de la Secretaría de Finanzas, Instituciones de Crédito o establecimientos autorizados, previamente a la prestación del servicio, conforme a la liquidación que expida la Dependencia que preste el servicio.\nLa Dependencia, al realizar la liquidación para el pago de los derechos a que se refiere éste capítulo, deberá precisar los servicios prestados, el costo de cada uno y el importe de los gastos de envío.\nTITULO IV\nCONTRIBUCIONES ESPECIALES\nCAPITULO PRIMERO\nCONTRIBUCION POR GASTO\nOBJETO\nARTICULO 141.- Es objeto de esta contribución el gasto público específico que se origine por el ejercicio de una determinada actividad de particulares.\nSUJETO\n(REFORMADO, P.O. 24 DE DICIEMBRE DE 1996)\nARTICULO 142.- Son sujetos de la contribución a que se refiere este Capítulo:\nI.- Por responsabilidad directa:\nLas personas físicas o morales que originen un gasto público por el ejercicio de una determinada actividad.\nII.- Por responsabilidad solidaria:\n1. La persona o personas, cualquiera que sea el nombre con que se les designe, que tengan conferida la representación legal, la Dirección General, la Gerencia General o la administración única de las personas morales sujeto de esta contribución; y\n2. Quienes ejerzan la patria potestad o tutela, por las contribuciones a cargo de su representado.\nBASE\n(REFORMADO, P.O. 24 DE DICIEMBRE DE 1996)\nARTICULO 143.- La base de las contribuciones a que se refiere este Capítulo será el importe del gasto público provocado.\n(REFORMADO, P.O. 24 DE DICIEMBRE DE 1996)\nARTICULO 144.- La Secretaría de Finanzas estará facultada para determinar el importe de las contribuciones, quien debera tomar en cuenta para su determinación, el costo real del gasto público originado.\nPAGO\nARTICULO 145.- Las contribuciones por gasto deberán ser pagadas en las oficinas recaudadoras de rentas de la Secretaría de Finanzas o en las Instituciones de Crédito autorizadas, dentro de los quince las contribuciones.\nARTICULO 146.- El monto total de la contribución en cada caso, no podrá exceder del costo del gasto público de que se trate.\nARTICULO 147.- La Secretaría de Finanzas, formulará y notificará la resolución que determine las contribuciones a cargo de los contribuyentes, en la que se expresará la causa y monto del gasto provocado.\nARTICULO 148.- En lo no previsto en este Capítulo, la aplicación y recaudación de las contribuciones, se hará con apego a las disposiciones del Código Fiscal para el Estado de Coahuila.\nCAPITULO SEGUNDO\nPARA EL FOMENTO A LA EDUCACION EN EL ESTADO\nOBJETO\n(REFORMADO, P.O. 24 DE DICIEMBRE DE 1996)\nARTICULO 149.- Es objeto de esta contribución la realización de pagos por concepto de impuestos, derechos y cualquier otra contribución que se cause conforme a la presente ley y demás disposiciones fiscales del Estado, así como los accesorios que se paguen.\n(REFORMADO, P.O. 31 DE DICIEMBRE DE 2004)\nNo se considerarán incluidos en el objeto de ésta contribución los pagos correspondientes al Impuesto\nSobre Nóminas, al Impuesto Sobre Diversiones y Espectáculos Públicos relativos a eventos cinematográficos, teatrales y de circo, al Impuesto Sobre Hospedaje, al Impuesto Sobre Ingresos por\nPermisos Derivados de Loterías, Rifas, Sorteos, Juegos con Apuestas y Concursos, al Impuesto\nAdicional Sobre los Derechos que se causen por los Servicios que presta el Registro Público, los\nDerechos que se causen por los Servicios que presta la Secretaría de Educación Pública, y los que se causen por los Servicios prestados por las Dependencias de la Administración Pública Centralizada, relativas al Derecho de Acceso a la Información Pública.\nEl rendimiento de esta contribución será destinado exclusivamente al fomento a la educación en el\nEstado.\nSUJETO\n(REFORMADO, P.O. 24 DE DICIEMBRE DE 1996)\nARTICULO 150.- Son sujetos de esta contribución, las personas físicas, morales o unidades económicas que realicen pagos por concepto de impuestos, derechos y cualquier otra contribución que se cause conforme a la presente ley y demás disposiciones fiscales del Estado, con excepción de los señalados en el artículo anterior.\nBASE\nARTICULO 151.- La base de esta contribución, es el importe de los pagos que se realicen por concepto de impuestos, derechos y demás contribuciones incluyendo sus accesorios, excepto los pagos de las contribuciones que se exceptúan en el artículo 149 de esta ley.\nTASA\nARTICULO 152.- La tasa correspondiente a esta contribución para el fomento a la educación, será el\n15% sobre el monto de los pagos por concepto de los impuestos, derechos y cualquier otra contribución y los accesorios de éstos, que se paguen con excepción de los señalados.\nPAGO\nARTICULO 153.- El pago de esta contribución deberá efectuarse en las oficinas recaudadoras de rentas de la Secretaría de Finanzas, Instituciones de Crédito o establecimientos autorizados, en el mismo recibo con que se realicen los pagos objeto de esta contribución.\nCAPITULO TERCERO\nSALTILLO, RAMOS ARIZPE Y TORREÓN\nOBJETO\nARTICULO 154.- Es objeto de esta contribución para el mantenimiento y la conservación del Centro\nHistórico de las ciudades de Saltillo, Ramos Arizpe y Torreón, la realización de pagos por concepto de derechos de control vehicular que se causen en los municipios señalados.\nLos ingresos que se obtengan por esta contribución, serán destinados exclusivamente para los fines señalados, asignándose a cada municipio el importe del ingreso que se genere en el mismo.\nSUJETO\n(REFORMADO, P.O. 24 DE DICIEMBRE DE 1996)\nARTICULO 155.- Son sujetos de esta contribución, las personas físicas, morales o unidades económicas que realicen pagos por los conceptos a que se refiere el artículo anterior.\nBASE\n(REFORMADO, P.O. 24 DE DICIEMBRE DE 1996)\nARTICULO 156.- La base de esta contribución, es la realización de los pagos por concepto de los derechos señalados.\nCUOTA\n(REFORMADO, P.O. 24 DE DICIEMBRE DE 1996)\nARTICULO 157.- La cuota correspondiente a esta contribución será la cantidad de $24.00 por cada trámite de refrendo u obtención de placas que se realice.\nLos contribuyentes que realicen dos o más trámites por los que se causen derechos de control vehicular en un mismo ejercicio fiscal, únicamente estarán obligados a realizar un solo pago durante el ejercicio.\nPAGO\nARTICULO 158.- El pago de esta contribución deberá efectuarse en las oficinas recaudadoras de rentas de la Secretaría de Finanzas, instituciones de crédito o establecimientos autorizados, en el mismo recibo con que se realicen los pagos de los derechos objeto de esta contribución.\nCAPITULO CUARTO\nCONTRIBUCION POR OBRA PUBLICA\nOBJETO\nARTICULO 159.- Es objeto de la contribución por obra pública, la construcción, reconstrucción y ampliación de las siguientes obras:\nI.- Vías públicas, tales como calles, avenidas, calzadas, viaductos, pasos a desnivel, obras de seguridad relacionadas con el tránsito de vehículos y peatones, puentes y plazas, construcción de vialidades e infraestructura carretera.\nII.- Introducción de agua potable a los poblados y desagüe general de los mismos;\nIII.- Redes de distribución de agua potable, drenaje y alcantarillado;\nIV.- Alumbrado público;\nV.- Obras de electrificación;\nVI.- Conexión de la red general de agua potable a centros de población;\nVII.- Conexión del sistema general de drenaje a centros de población;\nVIII.- Obras básicas para agua y drenaje;\nIX.- Centros deportivos y recreativos, parques y jardines;\nX.- Caminos;\nXI.- Bordos, canales e irrigación;\nXII.- Obras de embellecimiento y remodelación de poblaciones; y\nXIII.- Otras obras públicas que generen beneficios en su ejecución a los inmuebles y/o cooperadores.\nSUJETO\n(REFORMADO, P.O. 24 DE DICIEMBRE DE 1996)\nARTICULO 160.- Son sujetos de la contribución por obra pública:\nI.- Por responsabilidad directa:\n1.- Los propietarios y copropietarios de los inmuebles, que resulten beneficiados con la realización de una obra pública;\n2.- Los poseedores a título de dueño de inmuebles beneficiados con la realización de una obra pública; y\n3.- Las personas físicas y morales que hayan adquirido derechos sobre los inmuebles ubicados en el área de beneficio de una obra pública.\nII.- Por responsabilidad solidaria:\n1.- Los promitentes vendedores y sus contratantes, en las operaciones con reserva de dominio, por las contribuciones que se adeuden; y\n2.- Las instituciones fiduciarias cuando los predios estén afectados en fideicomiso. Dicha institución cubrirá las contribuciones con cargo a quien quede como propietario del predio beneficiado.\nBASE\nARTICULO 161.- La base de la contribución a que se refiere este Capítulo será el costo total de la obra pública específica.\nARTICULO 162.- Cuando se trate de obras por cooperación de carácter estatal, la Secretaría de Obras\nPúblicas y Transporte y la Secretaría de Finanzas, serán el conducto del Ejecutivo del Estado para tomar las siguientes determinaciones:\nI.- Proyectos, programas, especificaciones de construcción y presupuestos con el costo total de las obras;\nII.- Area beneficiada con la obra y zona de influencia; y\nIII.- Determinar la cantidad global que deban cubrir los contribuyentes beneficiados.\n(REFORMADO, P.O. 24 DE DICIEMBRE DE 1996)\nARTICULO 163.- En todo caso, a la Secretaría de Finanzas le corresponderá:\nI.- Determinar la cuota que corresponda pagar a cada contribuyente en particular; y\nII.- Establecer el plazo y forma en que deban efectuarse los pagos.\n(REFORMADO, P.O. 24 DE DICIEMBRE DE 1996)\nARTICULO 164.- Las contribuciones a que se refiere este Capítulo podrán ser de carácter voluntario, o de carácter obligatorio, de acuerdo con las siguientes normas:\nI.- Será voluntaria aquélla en la cual los particulares aporten total o parcialmente la suma necesaria para realizar las obras de que se trate en forma espontánea y de acuerdo con el plan correspondiente, o a promoción de las autoridades estatales.\nLa cooperación voluntaria se convertirá en obligatoria una vez formalizado el convenio correspondiente y será exigible en los términos del presente ordenamiento y de las leyes fiscales relativas.\nII.- Son cooperaciones obligatorias las siguientes:\n(REFORMADO, P.O. 25 DE DICIEMBRE DE 2001)\n1.- La pavimentación o repavimentación de las vías públicas, el embanquetado y construcción de las mismas, tales como calles, avenidas, calzadas, viaductos, pasos a desnivel, obras de seguridad relacionadas con el tránsito de vehículos y peatones, puentes y plazas, construcción de vialidades e infraestructura carretera.\n2.- La electrificación de las zonas urbanas o rurales, tanto para usos domésticos como para usos industriales y agropecuarios;\n3.- Las necesarias para adoptar o mejorar el alumbrado público;\n4.- Las que se requieran para adoptar o mejorar los servicios de agua potable, drenaje sanitario, drenaje pluvial y gas natural para uso doméstico;\n5.- Las necesarias para la construcción y conservación de caminos vecinales; y\n6.- Las demás que determine el Congreso del Estado como obligatorias.\nARTICULO 165.- Para que se cause la contribución por obra pública a que se refiere el artículo anterior, será necesario que los predios se encuentren en las siguientes circunstancias:\nI.- Si son exteriores, tener frente a la calle donde se ejecuten las obras; y\nII.- Si son interiores, tener acceso mediante servidumbre de paso a la calle en que se ejecuten las obras.\nARTICULO 166.- Cuando se trate de edificios sujetos al régimen de propiedad en condominio, divididos en pisos, departamentos, viviendas o locales, se considerará que la totalidad del predio se beneficia con la obra. La parte de la contribución por obra pública a cargo de cada propietario se determinará dividiendo el monto que corresponda a todo el inmueble, entre la superficie cubierta de construcción que resulte de sumar la de todos los pisos, exceptuando la que se destine a servicios de uso común y multiplicando ese cociente por el número de metros que corresponda al piso, departamento, vivienda o local de que se trate.\n(REFORMADO, P.O. 24 DE DICIEMBRE DE 1996)\nARTICULO 167.- Las contribuciones por obra pública se determinarán aplicando el procedimiento que establece la Ley de Cooperación para Obras Públicas del Estado de Coahuila de Zaragoza, en todo caso, el porcentaje a contribuir por los particulares, se dividirá conforme al mencionado procedimiento entre los propietarios de los predios beneficiados.\n(REFORMADO, P.O. 24 DE DICIEMBRE DE 1996)\nARTICULO 168.- La contribución por obra pública se causará cuando la autoridad competente acuerde realizar la obra, mediante el concurso público o de invitación, que estará sujeto a las reglamentaciones respectivas. Para los efectos de esta contribución cuando se trate de obras de pavimentación o repavimentación, no podrá volver a cobrarse por el mismo concepto en un período mínimo de 10 años y, en consecuencia no se podrá acordar una nueva realización de la misma obra por cooperación antes de ese plazo.\nPAGO\n(REFORMADO, P.O. 28 DE DICIEMBRE DE 2007)\nARTICULO 169.- Las contribuciones por obra pública deberán ser pagadas en las oficinas recaudadoras de rentas de la Secretaría de Finanzas, o en las instituciones de crédito autorizadas, al inicio de la obra o dentro del plazo que se establezca en los convenios que se celebren con los particulares, en la forma y plazo que ésta determine.\n(REFORMADO, P.O. 24 DE DICIEMBRE DE 1996)\nARTICULO 170.- La Secretaría de Finanzas del Estado formulará la liquidación de la contribución por obra pública para cada contribuyente en particular.\nARTICULO 171.- La resolución que determine las contribuciones a pagar por la obra, deberá estar debidamente fundada y motivada y contener además los siguientes datos:\nI.- Descripción genérica de la obra;\nII.- Costo total estimado;\nIII.- Area beneficiada con la obra y zona de influencia;\nIV.- Ubicación del predio;\nV.- Períodos de iniciación y terminación de la obra.\nVI.- Cantidad total que deben aportar los beneficiados.\nVII.- La cantidad a pagar por el contribuyente; y\nVIII.- Plazo y forma en que deberá hacerse la contribución.\nARTICULO 172.- Los predios beneficiados por la ejecución de obras públicas por cooperación, estarán afectos en forma preferente al pago del importe de las contribuciones a que se refiere este Capítulo.\nTASA\nARTICULO 173.- La tasa correspondiente a la contribución obligatoria para obra pública, será el 50% del costo total de la obra; sin embargo, cuando se trate de contribuciones voluntarias para obra pública, los particulares podrán cooperar con un porcentaje distinto al señalado, el que se establecerá de común acuerdo entre las autoridades estatales y los particulares.\n(REFORMADO, P.O. 24 DE DICIEMBRE DE 1996)\nARTICULO 174.- Para hacer efectivas estas contribuciones, de ser necesario, se aplicará el procedimiento administrativo de ejecución previsto en el Código Fiscal para el Estado de Coahuila.\n(REFORMADO, P.O. 24 DE DICIEMBRE DE 1996)\nARTICULO 175.- Estarán exentos del pago de esta contribución los bienes del dominio público de la federación, del Estado y de los municipios.\nCAPITULO QUINTO\nCONTRIBUCION POR RESPONSABILIDAD OBJETIVA\nOBJETO\n(REFORMADO, P.O. 24 DE DICIEMBRE DE 1996)\nARTICULO 176.- Es objeto de esta contribución la realización de actividades que dañen o deterioren instalaciones, infraestructura caminera, hidráulica y de servicios, de uso comunitario y beneficio social, que sean propiedad del Estado, de dominio público o uso común.\nSUJETO\n(REFORMADO, P.O. 24 DE DICIEMBRE DE 1996)\nARTICULO 177.- Son sujetos de esta contribución las personas físicas y morales que realicen actividades que en forma directa o indirecta ocasionen los daños o deterioro a que se refiere el artículo anterior.\nBASE\n(REFORMADO, P.O. 26 DE ENERO DE 2007)\nARTICULO 178.- Servirá de base para el pago de esta contribución la cuantificación de los daños o deterioros causados por el uso de las instalaciones, infraestructura caminera, hidráulica y de servicios, o de uso comunitario y beneficio social, que sean propiedad del Estado, del dominio público o uso común, Transporte.\nARTICULO 179.- La contribución por responsabilidad objetiva se pagará en las oficinas recaudadoras de rentas de la Secretaría de Finanzas o en las Instituciones de Crédito autorizadas, dentro de los quince cabo la Secretaría de Comunicaciones y Obras Públicas.\nTASA\nARTICULO 180.- El pago de esta contribución deberá comprender el importe total de los daños o deterioros causados a instalaciones, infraestructura caminera, hidráulica y de servicios, de uso comunitario y beneficio social, que sean propiedad del Estado.\nTITULO V\nPRODUCTOS\nARTICULO 181.- Quedan comprendidos dentro de esta clasificación, los ingresos que obtenga el Estado de:\nI.- Venta de bienes muebles o inmuebles propiedad del Estado;\nII.- Arrendamiento de bienes muebles o inmuebles propiedad del Estado;\nIII.- Explotación o enajenación de cualquier naturaleza, de los bienes propiedad del Estado;\nIV.- Réditos de capitales y valores del Estado;\nV.- Bienes de beneficencia;\nVI.- Establecimientos y Empresas Estatales;\nVII.- Trabajos gráficos y editoriales;\nVIII.- Venta de impresos y papel;\nIX.- Otorgamiento de aval en favor de las entidades a que se refiere la Ley de Deuda Pública para el\nEstado de Coahuila;\nX.- La explotación de las concesiones que en su favor otorgue el Gobierno Federal sobre vías generales de comunicación; y\nXI.- Otros no especificados.\nTITULO VI\nAPROVECHAMIENTOS\nARTICULO 182.- Quedan comprendidos dentro de esta clasificación, los ingresos que obtenga el Estado por:\nI.- Recargos;\nII.- Gastos de ejecución;\nIII.- Multas;\nIV.- Subsidios;\nV.- Reintegros o indemnizaciones;\nVI.- Cauciones cuyas pérdidas se declaren por resolución firme a favor del Estado;\nVII.- Bienes y herencias vacantes, tesoros ocultos, herencias, legados, donaciones y otros conceptos en favor del Estado;\nIX.- Honorarios de notificación; y\nX.- Otros no especificados.\nTITULO VII\nINGRESOS COORDINADOS\nARTICULO 183.- Las participaciones, incentivos, subsidios y demás aportaciones que por virtud de la coordinación con la Federación, correspondan al Estado, se recaudarán con arreglo a la Ley de\nCoordinación Fiscal y a los convenios y acuerdos que tenga celebrados y que celebre el Estado con la\nFederación.\nTITULO VIII\nINGRESOS EXTRAORDINARIOS\n(REFORMADO, P.O. 24 DE DICIEMBRE DE 1996)\nARTICULO 184.- Quedan comprendidos dentro de esta clasificación los ingresos cuya percepción se decrete excepcionalmente para proveer el pago de gastos o inversiones accidentales, extraordinarias o especiales del Estado, así como los derivados de créditos o empréstitos contratados para este fin.\nARTICULO PRIMERO.- El presente Decreto entrará en vigor a partir del 1o. de enero de 1996.\nARTICULO SEGUNDO.- Se abroga la Ley de Hacienda para el Estado de Coahuila de Zaragoza contenida en el Decreto No. 453, publicada en el Periódico Oficial del Estado No. 103 de fecha 24 de diciembre de 1993.\nARTICULO TERCERO.- Se derogan todas las disposiciones que se opongan al presente Decreto.\nARTICULO CUARTO.- Para los efectos del artículo 3 de esta ley, la actualización de las contribuciones\nARTICULO QUINTO.- Con el propósito de sufragar los gastos que origina al Estado el mejoramiento y\nRegistro Público, se causará un impuesto adicional del 10% sobre los derechos que se causen por los servicios que presta el Registro Público de la Propiedad establecidos en esta ley.\nFinanzas, instituciones de crédito o establecimientos autorizados, en el mismo recibo con que se realicen los pagos objeto de este impuesto.\nARTICULO SEXTO.- Queda en suspenso el derecho por expedición de licencias para establecimientos que expendan bebidas alcohólicas fijado en la Ley de Hacienda, por virtud de que el Estado se encuentra coordinado en derechos con la Federación, y por así exigirlo el artículo 10-A de la Ley de Coordinación\nFiscal, por lo que no se podrá exigir cobro alguno por este concepto. Sin embargo, para efectos del control que el Estado debe tener sobre estas actividades, los contribuyentes están obligados a cumplir con las obligaciones correspondientes a la obtención de la licencia y su revalidación anual.\nSi se dan por terminadas la coordinación en materia de derechos con la Federación o en su caso, si se reforma el artículo 10-A de la Ley de Coordinación Fiscal, permitiendo al Estado cobrar por estos derechos, entrarán en vigor las tarifas correspondientes al día siguiente al en que surta efectos la terminación de los convenios o la reforma al artículo mencionado, o en caso de ocurrir la reforma antes del 1° de enero de 1996, estas tarifas entrarán en vigor a partir de esta fecha.\nARTICULO SEPTIMO.- Queda en suspenso el Impuesto por Servicios de Hospedajes por estar adherido el Estado al Sistema Nacional de Coordinación Fiscal, prohibiendo el artículo 41 de la Ley del Impuesto al\nValor Agregado, que el Estado mantenga en vigor esta contribución, por lo que no podrá exigirse cobro alguno por este concepto.\nSi se reforma el artículo 41 de la Ley del Impuesto al Valor Agregado, permitiendo al Estado cobrar por este impuesto, entrarán en vigor las tarifas correspondientes al día siguiente al en que surta efectos la reforma al artículo mencionado, o en caso de ocurrir la reforma del mencionado artículo y su entrada en vigor antes del 1° de enero de 1996, estas tarifas entrarán en vigor a partir de esta fecha.\nDISPOSICION DE VIGENCIA ANUAL\nUNICA.- Los contribuyentes del Impuesto Sobre Nóminas podrán optar por el pago anual del impuesto en términos del artículo 27 de la Ley de Hacienda para el Estado de Coahuila de Zaragoza, siempre y cuando el monto de lo pagado por este mismo concepto durante el ejercicio fiscal anterior, no exceda de la cantidad de $1,000.00 (MIL PESOS 00/100 M.N.).\nLos contribuyentes que se acojan a la opción señalada en el párrafo anterior, gozarán de un estímulo fiscal consistente en un descuento del 15% (quince porciento) del impuesto a su cargo, siempre y cuando la declaración correspondiente al mes de enero, se presente dentro del plazo establecido en la Ley de\nHacienda para el Estado de Coahuila de Zaragoza. días del mes de diciembre de mil novecientos noventa y cinco.\nDIPUTADO PRESIDENTE\nHORACIO VELOZ MUÑOZ\nDIPUTADO SECRETARIO DIPUTADO SECRETARIO\nLUIS RAMIREZ RIOS PABLO WONG SANABRIA\nIMPRIMASE, COMUNIQUESE Y OBSERVESE\nSUFRAGIO EFECTIVO. NO REELECCION\nEL GOBERNADOR CONSTITUCIONAL DEL ESTADO\nROGELIO MONTEMAYOR SEGUY\nEL SECRETARIO DE GOBIERNO\nLIC. CARLOS JUARISTI SEPTIEN\nEL SECRETARIO DE FINANZAS\nLIC. ANTONIO JUAN MARCOS ISSA\nN. DE E. A CONTINUACION SE TRANSCRIBEN LOS ARTICULOS TRANSITORIOS DE LOS DECRETOS DE REFORMAS A LA PRESENTE LEY.\nARTICULO PRIMERO.- El presente Decreto entrará en vigor a partir del 1o. de enero de 1997.\nARTICULO SEGUNDO.- Se derogan todas las disposiciones que se opongan al presente Decreto.\nARTICULO TERCERO.- Queda en suspenso la aplicación de los artículos 40, 41, 42, 43, 44, 47, 48, 49, 50, 51, 52 y 53 correspondientes a\nSECCIONES PRIMERA Y TERCERA del CAPITULO CUARTO del Título II de esta ley, relativo al Impuesto Sobre Tenencia o Uso de Vehículos, los cuales entrarán en vigor a partir del ejercicio fiscal en que se decrete la suspensión de Impuesto Sobre Tenencia o Uso de Vehículos de aplicación federal.\nARTICULO CUARTO.- Queda en suspenso la aplicación de los artículo 61 a 72 correspondientes al CAPITULO SEXTO del TITULO II de esta Ley, relativo al Impuesto Sobre Automóviles, los cuales entrarán en vigor a partir del ejercicio fiscal en que se decrete la suspensión del Impuesto Sobre\nAutomóviles Nuevos de aplicación federal.\nDISPOSICION DE VIGENCIA ANUAL\nUNICA.- Los contribuyentes del Impuesto Sobre Nóminas podrán optar por el pago anual del impuesto en términos del artículo 27 de esta ley siempre y cuando el monto de lo pagado por este mismo concepto durante el ejercicio fiscal anterior no exceda de $1,500.00 (MIL QUINIENTOS PESOS\n00/100 M.N.).\nLos contribuyentes que se acojan a la opción señalada en el párrafo anterior, gozarán de un estímulo fiscal consistente en un descuento del 15%\n(quince porciento) del impuesto a su cargo, siempre y cuando la declaración correspondiente al mes de enero, se presente dentro del plazo establecido en esta ley.\nSEGUNDO.- Los propietarios de establecimientos que enajenen o expendan bebidas alcohólicas, que por cualquier motivo no hubieren pagado los derechos por la revalidación de la licencia de funcionamiento, de acuerdo a las tarifas establecidas en el artículo 105 de la Ley de Hacienda para el\nEstado de Coahuila que mediante el presente Decreto se reforma, deberán pagarlos dentro del mes siguiente a la fecha de entrada en vigor de este\nDecreto.\nTERCERO.- Se derogan todas las disposiciones que se opongan al presente Decreto.\nCUARTO.- La presente reforma no deroga el Artículo 475-D del Código Municipal para el Estado de Coahuila.\nSEGUNDO.- Para el ejercicio fiscal de 1998, no será aplicable lo dispuesto por el artículo 3 de la Ley de Hacienda para el Estado de Coahuila en lo previsto por el artículo 105 que se reforma.\nTERCERO.- Se derogan todas las disposiciones que se opongan al presente Decreto.\nSEGUNDO.- Se derogan todas las disposiciones que se opongan a estas reformas.\nP.O. 11 DE DICIEMBRE DE 1998\nARTICULO PRIMERO.- El presente Decreto entrará en vigor a partir del 1o. de enero de 1999.\nARTICULO SEGUNDO.- Se derogan todas las disposiciones que se opongan al presente Decreto.\nP.O. 29 DE DICIEMBRE DE 1998\nARTICULO PRIMERO.- El presente Decreto entrará en vigor al día siguiente de su publicación en el Periódico Oficial del Gobierno del Estado.\nARTICULO SEGUNDO.- Se derogan todas las disposiciones que se opongan al presente Decreto.\nP.O. 29 DE JUNIO DE 1999\nPRIMERO.- El presente decreto entrará en vigor el día siguiente al de su publicación en el Periódico Oficial del Gobierno del Estado.\nSEGUNDO.- Se derogan todas las disposiciones que se opongan al presente Decreto.\nP.O. 28 DE DICIEMBRE DE 1999\nARTICULO PRIMERO.- El presente Decreto entrará en vigor a partir del 1o. de enero del año 2000.\nARTICULO SEGUNDO.- Se derogan los artículos 3° y 4° transitorios del Decreto 412 publicado en el Periódico Oficial de Gobierno del Estado No. 103 de fecha 24 de Diciembre de 1996, así mismo se derogan todas las disposiciones que se opongan al presente Decreto.\nP.O. 29 DE DICIEMBRE DE 2000\nARTÍCULO PRIMERO.- El presente Decreto entrará en vigor el primero de enero del 2001.\nARTÍCULO SEGUNDO.- Se derogan todas las disposiciones que se opongan al presente Decreto.\nARTICULO SEGUNDO.- Se derogan todas las disposiciones que se opongan al presente Decreto.\nARTICULO SEGUNDO.- Se derogan todas las disposiciones que se opongan al presente Decreto.\nARTICULO SEGUNDO.- Se derogan todas las disposiciones que se opongan al presente Decreto.\nARTICULO SEGUNDO.- Se derogan todas las disposiciones que se opongan al presente Decreto.\nSEGUNDO.- Se derogan toas las disposiciones que se opongan el presente Decreto.\nÚnico.- Esta reforma entrará en vigor: al día siguiente de su publicación en el Periódico Oficial del Estado.\nARTÍCULO SEGUNDO.- Se derogan todas las disposiciones que se opongan al presente Decreto.\nSEGUNDO.- Se derogan todas las disposiciones legales que se opongan al presente Decreto.\nARTICULO SEGUNDO.- Se derogan todas las disposiciones que se opongan al presente Decreto.",
  "ordenamiento": "REGLAMENTO",
  "jurisdiccion": "COAHUILA",
  "fuente_oficial": "DIARIO OFICIAL DE LA FEDERACION",
  "Fecha de Publicación": "22 de diciembre de 1995",
  "ULTIMA REFORMA PUBLICADA": "28 DE DICIEMBRE DE 2007",
  "es_escaneado": false,
  "tiene_tablas": false,
  "materia": [
    "fiscal"
  ]
}