{
  "titulo": "Ley para el Desarrollo Integral de las Personas con Discapacidad en el Estado de Coahuila",
  "Contenido": "DE COAHUILA\nEL C. ROGELIO MONTEMAYOR SEGUY, GOBERNADOR CONSTITUCIONAL DE L ESTADO\nINDEPENDIENTE, LIBRE Y SOBERANO DE COAHUILA DE ZARAGOZA, A SUS HABITANTES SABED:\nQUE EL CONGRESO DEL ESTADO INDEPENDIENTE, LIBRE Y SOBERANO DE COAHUILA DE\nZARAGOZA,\nLEY PARA EL DESARROLLO INTEGRAL DE LAS PERSONAS CON DISCAPACIDAD EN EL\nESTADO DE COAHUILA\nTITULO I\nDISPOSICIONES GENERALES\nArtículo 1.- La presente ley es de orden público y de interés general, sus disposiciones son de observancia obligatoria en el Estado, y tiene por objeto establecer y regular las medidas y acciones tendientes a promover el desarrollo integral de las personas con discapacidad, así mismo se pretende motivar a la colectividad para que favorezca la incorporación de este grupo a las diferentes actividades.\nArtículo 2.- En los términos de esta ley son beneficiarios de la misma los individuos disminuidos en sus capacidades físicas, psíquicas, sensoriales y de relación social que les limite e impida realizar su desarrollo integral.\n(REFORMADO, P.O. 13 DE NOVIEMBRE DE 2007)\nArtículo 3.- Para los efectos de esta Ley se entiende por:\nAsistencia Social: El conjunto de acciones tendientes a modificar y mejorar las circunstancias de carácter social, que impidan al individuo su desarrollo integral, así como la protección física, mental y social de personas en estado de necesidad, desprotección o desventaja física y mental, hasta lograr su incorporación a una vida plena y productiva.\nDiscapacidad: Toda restricción o ausencia de la capacidad de realizar alguna actividad en la forma o dentro del margen que se considera normal para un ser humano.\nLey: Ley para el Desarrollo Integral de las Personas con Discapacidad en el Estado de Coahuila de\nZaragoza\nPersona con discapacidad: Todo ser humano que padece temporal o permanentemente una disminución en sus facultades físicas, psíquicas o sensoriales que le impide realizar una actividad normal.\nPrevención: La adopción de medidas encaminadas a impedir que se produzcan deficiencias físicas, mentales y sensoriales, (Prevención primaria) o a impedir que las deficiencias cuando se han producido, tengan consecuencias físicas, psicológicas y sociales negativas.\nRehabilitación: Al conjunto de medidas médicas, psicológicas, sociales, educativas y ocupacionales que tienen por objetivos compensar la pérdida de una función o una limitación funcional con- ayudas técnicas les permitan ser útiles así mismos, a su familia e integrarse a la vida social.\nPerro Guía o de Asistencia: aquel que habiendo pasado pruebas de selección física, genética y sanitaria, ha concluido su adiestramiento en centros especializados reconocidos, y adquirido las aptitudes y destrezas necesarias para la compañía, conducción y auxilio de personas con discapacidad, debiendo estar acreditados e identificados de la forma establecida en esta ley.\nServicios básicos de salud en materia de asistencia social, para las personas con discapacidad: Los enunciados en el Artículo 12 Fracciones I, V y IX de la Ley de Asistencia Social.\nTransportes públicos: todo medio de transporte colectivo de uso público, y los servicios urbanos e interurbanos de transportes de viajeros, sometidos a la competencia del estado y los municipios.\nArtículo 4.- Son derechos que la Ley reconoce y protege en favor de los discapacitados:\nI. Tener la oportunidad plena del derecho a la educación, dentro del marco jurídico de nuestra\nConstitución;\nII. El tener oportunidades laborales de acuerdo a su perfil Profesional, técnico, manual y de sus capacidades físicas;\nIII. Ofrecer en los espacios públicos y privados, abiertos o cerrados, condiciones propicias para su libre y seguro desplazamiento;\nIV. El disfrutar de los servicios públicos en igualdad de circunstancias que cualquier persona no discapacitada; y\nV. La facilidad de acceso y desplazamiento en el interior de espacios laborales, educativas, comerciales y recreativos.\nArtículo 5.- Para los efectos de esta Ley son autoridades encargadas de observar su aplicación de acuerdo a su competencia:\nI.- El Ejecutivo del Estado;\nII.- Secretaría de Gobierno;\nIII.- Secretaría de Desarrollo Social;\nIV.- Secretaría de Obras Públicas y Transporte;\nV.- Secretaría de Salud y Desarrollo Comunitario;\nVI.- Secretaría de Educación Pública;\nVII.- El Sistema Estatal para el Desarrollo Integral de la Familia; y\nVIII.- Los ayuntamientos de los municipios.\nTITULO II\nCAPITULO I\nDE LA ASISTENCIA SOCIAL\nArtículo 7.- Son sujetos de la recepción de los servicios de asistencia social preferentemente por considerarse personas con discapacidad: los mencionados en la Ley de Asistencia Social, en su Artículo\n4º Fracción VI.\nArtículo 8.- Es el Sistema para el Desarrollo Integral de la Familia del Estado de Coahuila de Zaragoza, el organismo rector de la asistencia social en el ámbito Estatal, de acuerdo a la Ley de Asistencia Social en su Capítulo Segundo tiene como objetivos, la promoción de las actividades relacionadas con la materia, la prestación de los servicios asistenciales, la promoción de la interrelación sistemática de acciones, que en este campo lleven a cabo las instituciones públicas y privadas.\nArtículo 9.- (DEROGADO, P.O. 13 DE NOVIEMBRE DE 2007)\nCAPITULO II\nDE LA COMISION ESTATAL COORDINADORA PARA EL BIENESTAR Y LA INCORPORACION AL\nDESARROLLO DE LAS PERSONAS CON DISCAPACIDAD\nArtículo 10.- Mediante la presente Ley, se crea el Organismo Interinstitucional Consultivo del Ejecutivo\nEstatal, denominado Comisión Estatal Coordinadora para el Bienestar y la Incorporación al Desarrollo de las Personas con Discapacidad en Coahuila, cuyas atribuciones estarán comprendidas en su reglamento interno que para el efecto se expida.\nArtículo 11.- La Comisión Estatal Coordinadora para el Bienestar y la Incorporación al Desarrollo de las\nPersonas con Discapacidad, estará integrada de la siguiente manera:\nI. Un Presidente, designado por el Titular del Ejecutivo del Estado;\nII. Un Secretario Ejecutivo, que será el Director General del Sistema Estatal para el Desarrollo Integral de la Familia;\nIII. Un Secretario Técnico, que será el representante de un organismo no gubernamental elegido por los integrantes de la Comisión, de una terna presentada al Presidente por parte del Secretario Ejecutivo de la misma;\nIV. Nueve Vocalías, que atenderán las siguientes áreas:\nA) Salud, Bienestar y Seguridad Social;\nB) Educación;\nC) Rehabilitación laboral, capacitación y trabajo;\nD) Cultura, recreación y deporte;\nE) Accesibilidad, telecomunicaciones y transporte;\nF) Comunicación;\nG) Legislación y Derechos Humanos;\nH) Estadística e Informática; y\nI) De los Organismos No Gubernamentales.\nCada Vocalía contará con un representante propietario, que será designado, previa invitación del\nSecretario Ejecutivo de la Comisión, por la institución pública o privada cuyo objeto se adecue a las funciones que para tal efecto se les encomienden. Las instituciones miembros de la Comisión podrán participar en una o más vocalías, dependiendo del objeto social que se persiga, más no podrá ser representante propietario de más de una de ellas.\nCada uno de los miembros de la Comisión contará con un suplente, designado por la propia institución, dependencia u organismo al que represente.\nEl desempeño de los cargos a que se refiere el presente Artículo será honorífico, por lo que los miembros de la Comisión no percibirán remuneración alguna.\nArtículo 12.- Esta Comisión elaborará el Programa Estatal para el Bienestar y la Incorporación al\nDesarrollo de las Personas con Discapacidad, cuyo propósito será garantizar el pleno respeto y ejercicio a los derechos humanos, políticos y sociales, la igualdad de oportunidades y la equidad en el acceso a los servicios de salud, educación, capacitación, empleo, cultura, recreación, deporte e infraestructura, que permita la movilidad y el transporte de las personas con discapacidad.\nArtículo 13.- El programa que presente la Comisión será realizado por las Dependencias Estatales, Municipales, Federales y los Organismos no Gubernamentales en el Estado; con relación a las dependencias y entidades federales será en el marco jurídico vigente que le confiera responsabilidad para la atención de personas con discapacidad, y por lo tanto se considerarán de carácter obligatorio.\nART. 14.- En el Estado y sus Municipios se promoverá la creación de Comisiones Coordinadoras que permitan multiplicar esfuerzos y recursos locales, en el marco de los convenios de desarrollo, así como la coordinación de acciones entre la Federación y el Estado.\nArtículo 15.- Respecto a las organizaciones sociales y privadas, locales, nacionales e internacionales se realizarán las acciones necesarias a través de convenios de concertación de acciones y aportaciones de recursos para la ejecución de los programas. Para la sociedad en general se promoverá una nueva cultura de integración, de respeto a la dignidad y a la diversidad de las personas, considerando a la familia como el fundamento de la unión y de la fuerza de toda sociedad.\nArtículo 16.- La Comisión Estatal Coordinadora para el Bienestar y la Incorporación al Desarrollo de las\nPersonas con Discapacidad en Coahuila, elaborará su propio Reglamento Interno.\nArtículo 17.- Para aquellas facultades y deberes de la Comisión Estatal Coordinadora para el Bienestar y cumplimiento de la presente Ley nos remitiremos a su reglamento interno.\nTITULO III\nCAPITULO I\nDE LA REHABILITACION\nArtículo 19.- El proceso de rehabilitación de las personas con discapacidad comprende:\nI. Rehabilitación médico-funcional.\nII. Orientación y tratamiento psicológico.\nIII. Educación general y especial.\nIV. Rehabilitación socioeconómica y laboral.\nArtículo 20.- El Estado fomentará y podrá establecer con otras instituciones gubernamentales o privadas, los servicios y actividades que comprende el proceso de rehabilitación, procurando acercar el servicio a los usuarios en las comunidades.\nCAPITULO II\nDE LA REHABILITACION MEDICO FUNCIONAL\nArtículo 21.- La rehabilitación médico-funcional está dirigida a dotar de las condiciones precisas para su recuperación a aquellas personas que presentan una disminución de capacidad física, psicológica o de relación social; deberá comenzar de forma inmediata con la detección y diagnóstico de cualquier anomalía o deficiencia debiendo continuarse hasta conseguir el máximo de funcionalidad posible, así como el mantenimiento de ésta.\nArtículo 22.- Para los efectos de lo previsto en el Artículo anterior, toda persona que presente alguna disminución funcional calificada, tendrá derecho a beneficiarse con la rehabilitación médica necesaria para corregir o mejorar su estado físico, mental o social, cuando éste constituya un obstáculo para su integración educativa, laboral o social. Para lo cual se deberá observar las cuotas de recuperación, previo estudio socioeconómico.\nArtículo 23.- Los procesos de rehabilitación se complementarán con la prescripción y la adaptación de prótesis, órtesis y otros elementos auxiliares para los discapacitados cuya condición lo amerite. De igual manera se observarán las cuotas de recuperación previo estudio socio-económico.\nCAPITULO III\nDE LA REHABILITACION PARA LA INCORPORACION LABORAL\nArtículo 24.- Los procesos de rehabilitación para la incorporación laboral o profesional comprenderán entre otras, las etapas siguientes:\nI. Los tratamientos de rehabilitación médico-funcional específico para la incorporación de alguna función laboral.\nII. La orientación ocupacional y vocacional.\nIII. La formación, readaptación y reeducación ocupacional.\nIV. La ubicación de acuerdo a la aptitud y actitud de la persona con discapacidad.\nV. Efectuar el seguimiento y evaluación del proceso de incorporación, desde el punto de vista físico, psicológico y laboral del discapacitado.\nArtículo 25.- La orientación ocupacional tendrá en cuenta las potencialidades reales de discapacidad determinadas en base a los informes que la soporte. Se tomará en cuenta la escolaridad recibida, la capacidad laboral profesional y las perspectivas de empleos existentes en cada caso, así mismo, la atención ha sus motivaciones, aptitudes y preferencias vocacionales.\nArtículo 26.- Los procesos de rehabilitación serán prestados tomando en cuenta la coordinación entre las fases médica, psicológica, escolar y laboral.\nCAPITULO IV\nDE LA READAPTACION PROFESIONAL\nArtículo 27.- Para los efectos del presente capítulo, se entiende por persona discapacitada todo individuo cuyas posibilidades de obtener y conservar un empleo adecuado y de progresar en el mismo, queden reconocida.\nI. La finalidad de la readaptación profesional es la de permitir que la persona discapacitada obtenga y conserve un empleo adecuado y que se promueva, así la integración o la reintegración de personas con discapacidad en la sociedad.\nII. Todo lo relativo a la readaptación profesional se aplicará en base a las medidas aprobadas y de acuerdo con condiciones y las prácticas nacionales.\nCAPITULO V\nPRINCIPIOS DE POLITICA DE READAPTACION PROFESIONAL Y DE EMPLEO PARA PERSONAS\nCON DISCAPACIDAD\nArtículo 28.- De conformidad con las condiciones prácticas y posibilidades nacionales, se formulará, aplicará y revisará periódicamente la política sobre la readaptación profesional y el empleo de personas discapacitadas.\nArtículo 29.- Dicha política estará destinada a asegurar que existan medidas adecuadas de readaptación profesional al alcance de todas las categorías de personas discapacitadas y a promover oportunidades de empleo para las personas discapacitadas en el mercado regular de empleo.\nArtículo 30.- Dicha política se basará en el principio de igualdad de oportunidades entre los trabajadores discapacitados y los trabajadores en general. Deberá respetarse la igualdad de oportunidades y de trato para los trabajadores discapacitados. Las medidas positivas especiales encaminadas a lograr la igualdad deberán considerarse discriminatorias de estos últimos.\nArtículo 31.- Se consultará a las organizaciones representativas de empleadores y de trabajadores sobre la aplicación de dicha política y, en particular sobre las medidas que deben adoptarse para promover la readaptación profesional. Se consultará, así mismo, a las organizaciones representativas constituidas por personas discapacitadas o que se ocupan de dichas personas.\nCAPITULO VI\nEMPLEO PARA PERSONAS CON DISCAPACIDAD\nArtículo 32.- Mediante la legislación nacional y por otros métodos conforme con las condiciones y prácticas nacionales, deberán adoptarse las medidas necesarias, para aplicar los artículos 58, 59, 60 y\n61 de la presente Ley.\nArtículo 33.- Las autoridades competentes deberán adoptar medidas para proporcionar y evaluar los servicios de orientación y formación profesionales, colocación, empleo y otros afines, a fin de que las personas discapacitadas puedan lograr y conservar un empleo y progresar en el mismo, siempre que sea posible y adecuado, se utilizarán los servicios existentes para los trabajadores en general, con las adaptaciones necesarias.\nArtículo 34.- Se adoptarán medidas para facilitar el acceso a las personas discapacitadas de las zonas rurales y en las comunidades apartadas, a los servicios de readaptación profesional y de empleos.\nArtículo 35.- Todo miembro de los centros de trabajo deberá esforzarse en asegurar la formación y la disponibilidad de asesores en materia de readaptación y de otro personal calificado que se ocupe de la orientación y formación profesional, la colocación y el empleo de personas con discapacidad.\nCAPITULO VII\nDE LA REHABILITACION SOCIO-ECONOMICA\nArtículo 36.- La finalidad primordial de la política de empleo de trabajadores discapacitados, será su integración en el sistema ordinario de trabajo o, en su caso, su incorporación a sistemas de trabajo protegido, en condiciones salubres, dignas y de mínimo riesgo a su seguridad.\nArtículo 37.- Se fomentará el empleo de los trabajadores discapacitados mediante el establecimiento de sistemas que faciliten su integración laboral: éstos podrán consistir en el beneficio de estímulos fiscales que otorgue la federación para la adaptación de los centros de trabajo, la eliminación al acceso o barreras arquitectónicas que dificulten su movilidad en centros de producción.\nArtículo 38.- El Estado a través de la Unidad competente en la materia, establecerá programas de promoción del empleo de los discapacitados creando al efecto una bolsa de trabajo, en la que se concentren listas de aspirantes con sus aptitudes y capacidades.\nArtículo 39.- El Estado procurará por la creación de centros especiales de capacitación para el empleo cuyo objetivo principal será buscar un trabajo remunerado a personas discapacitadas.\nArtículo 40.- Los centros especiales de capacitación para el empleo podrán ser creados por la Autoridad\nPública, bien directamente o en colaboración con otros organismos o personas físicas, o por particulares interesados en respaldar estos programas.\nArtículo 41.- El trabajo que realice el discapacitado en los Centros Especiales de capacitación para el empleo deberá ser productivo y remunerado, adecuado a las características individuales del trabajador, con el objeto de favorecer su adaptación personal y social y facilitar, en su caso, su posterior integración laboral en el mercado ordinario de trabajo.\nCAPITULO VIII\nDE LA ORIENTACION Y TRATAMIENTO PSICOLOGICO\nArtículo 42.- La orientación y tratamiento psicológico se empleará durante las distintas fases del proceso de rehabilitación, se iniciarán en el seno familiar donde ésta buscará lograr del discapacitado la superación de su situación y desarrollo de su personalidad e integración social.\nArtículo 43.- La autoridad competente al otorgar apoyo y orientación psicológica requeridas por las personas discapacitadas tendrá en cuenta sus características personales, motivaciones e interés, así máximo el uso de sus potencialidades.\nTITULO IV\nCAPITULO I\nDE LA EDUCACION GENERAL Y ESPECIAL\nArtículo 44.- Para efectos de esta Ley se considera lo enunciado en la Ley de Educación Estatal del\nEstado de Coahuila, en cuanto a la Educación Especial para las personas con necesidades especiales, transitorias o definitivas, además del adiestramiento y capacitación para el trabajo.\nArtículo 45.- La educación especial tendrá como propósito favorecer la integración de menores con necesidades especiales a los planteles de educación regular. Así mismo, promoverá alternativas de\nEducación Especial para aquellos alumnos que no se logren integrar a las de carácter regular en las que se satisfagan las necesidades básicas de aprendizaje y la convivencia autónoma social y productiva.\nArtículo 46.- El servicio de Educación Especial incluirá orientación a los padres o tutores y a los maestros de las escuelas regulares a las que se integren alumnos con necesidades especiales.\nArtículo 47.- La educación especial tendrá las siguientes características y finalidades:\nI. Integrar a los sujetos excepcionales a la educación básica regular cuando sus condiciones biopsicosociales lo permitan;\nII. Desarrollar conocimientos, hábitos, habilidades, actitudes y aptitudes para un adecuado desenvolvimiento social; y\nIII. Propiciar la superación de la dificultad o trastorno del alumno para que se incorpore a la vida productiva.\nTITULO V\nCAPITULO I\nDE LAS BARRERAS ARQUITECTONICAS\nArtículo 48.- Se considera barreras arquitectónicas todos aquellos elementos de construcción que dificulten, o impidan el libre desplazamiento en espacios interiores o exteriores del sector público, social o privado, a personas discapacitadas, así como, el uso de las instalaciones, debiendo consecuentemente regularse el diseño de los elementos arquitectónicos y urbanísticos.\nArtículo 49.- Los elementos viales ubicados en lugares públicos deberán, en su caso, ser reconstruidos para facilitar el libre tránsito de las personas con discapacidad.\nLos elementos considerados como obstáculos son:\nI. Las aceras, banquetas o escarpas;\nII. Las intersecciones de aceras o calles;\nIII. Las coladeras, sumideros o bocas de alcantarillas;\nIV. Los estacionamientos;\nV. Las escaleras y puentes peatonales;\nVI. Las rampas;\nVII. Los teléfonos públicos;\nVIII. Los tensores para postes;\nIX. Los buzones postales;\nX. Los contenedores para depósito de basura y puestos ambulantes;\nXI. Los semáforos y toda clase de disposiciones de tránsito y vialidad, tales como banderolas, postes, cadenas y en general anuncios que limitan el tránsito vehicular;\nXII. El uso de banquetas y postes adaptados como estacionamientos para bicicletas, motocicletas, diablitos, carretillas y la expansión de comercios establecidos sobre las aceras; y\nXIII. Cualesquiera otros objetos que dificulten, entorpezcan o impidan el libre tránsito, principalmente a los discapacitados.\nArtículo 50.- Los obstáculos viales ubicados en lugares con acceso al público, deberán ser reconstruidos, en su caso, con facilidades para las personas con discapacidad.\nComo obstáculos viales son considerados:\nI. Las rampas y escaleras;\nII. Las puertas, exteriores e interiores;\nIII. Los sanitarios;\nIV. Señalización de servicios y espacios;\nV. Los elevadores; y\nVI. Cualquiera otra estructura que dificulte, entorpezca o impida el libre tránsito, a las personas con discapacidad.\nAsí como se consideran lugares con acceso al público:\nI. Las clínicas, sanatorios, hospitales, terminales aéreas, terrestres, ferroviarias y marítimas;\nII. Los comedores de autoservicio, restaurantes y cafeterías;\nIII. Los auditorios, cinematógrafos, teatros y en general cualquier sala de espectáculos;\nIV. Las instalaciones del Sector turístico, marítimas y hotelero;\nV. Las aulas, bibliotecas, talleres y cualquier otro espacio de un centro escolar;\nVI. Los parques y jardines;\nArtículo 51.- El Ejecutivo del Estado incluirá en sus Programas para el Desarrollo Urbano del Estado, las adecuaciones de facilidades urbanísticas y arquitectónicas que se requieran, conforme a las necesidades de los discapacitados, debiendo contemplar las directrices a que deban someterse los proyectos de construcciones o modificaciones respectivas.\nLos proyectos de construcción de conjuntos habitacionales que constituyan un complejo arquitectónico, deberán observar el reglamento de construcciones, a fin de que tales inmuebles resulten de fácil acceso para las personas con discapacidad.\nCAPITULO II\nDE LOS OBSTACULOS EN LA VIA PUBLICA, EN LOS LUGARES CON ACCESO AL PUBLICO Y EN\nLOS SERVICIOS\nArtículo 52.- Las aceras deben permitir, en las esquinas o sitios propios para el cruce de personas, las facilidades para que los discapacitados en sillas de ruedas puedan, en forma independiente y con un máximo de seguridad, descender o ascender de las mismas.\nArtículo 53.- En las aceras e intersecciones en que se construyan rampas para sillas de ruedas, deberá haber señales para la circulación de invidentes o débiles visuales. Así como en las propiedades particulares que tengan en la banqueta pendientes para el acceso de vehículos, deberá disminuirse el borde o guarnición hacia el interior de la edificación, para no impedir la libre circulación de personas que se transporten en sillas de ruedas o accesorios de apoyo para locomoción.\nArtículo 54.- En las zonas urbanas de nueva creación o desarrollo deberán contemplarse las características arquitectónicas que permiten el libre acceso, vialidad y servicios acordes a las necesidades especiales de las personas con discapacidad. La Ley de Asentamientos Humanos y\nDesarrollo Urbano del Estado y su Reglamento de Construcciones señalarán los requisitos respectivos.\nArtículo 55.- Los tensores que en las vías públicas se instalen, como apoyo de los postes de los servicios públicos, deberán contar con un protector metálico, el cual deberá ser recubierto con pintura de color vivo a fin de que los transeúntes, principalmente los débiles visuales, los identifiquen con facilidad para evitar tropezarse.\nDe igual manera y con la misma finalidad deberán pintarse de colores contrastantes los postes, semáforos, contenedores de basura de todo tipo y cualquier otro mueble urbano que se deposite sobre las aceras, cruceros o intersecciones de calles.\nLa colocación de los obstáculos viales se efectuará de manera estratégica evitando el centro de pasillos y camellones a efecto de que no se impida el desplazamiento de una silla de ruedas, de un aparato de apoyo o de un invidente.\nArtículo 56.- Los restaurantes de cualquier tipo y las cafeterías, sin que ello implique instalaciones de los discapacitados, deberán contar con, cuando menos, dos mesas en forma rectangular, estratégicamente colocadas, que tengan una altura de setenta y cinco centímetros libre del piso a la parte inferior de la mesa, con la finalidad de brindar comodidades a comensales en sillas de ruedas.\nAsí mismo, cada restaurante, deberá contar cuando menos con un juego de menú en sistema Braille.\nArtículo 57.- En todos los demás aspectos relativos a este capítulo nos remitimos al reglamento de construcciones para el Estado de Coahuila.\nTITULO VI\nCAPITULO I\nPERSONAS CON DISCAPACIDAD\nArtículo 58.- El Ejecutivo del Estado, y los municipios a través de sus diferentes direcciones administrativas, diseñará e instrumentará programas, campañas permanentes de educación vial, cortesía urbana y respeto hacia discapacitados en su tránsito por la vía pública y en lugares de acceso al público, sociales, económicas y políticas de la comunidad, evitando su marginación o discriminación, o el hacerlos objeto de mofa o de abuso alguno, de simple indiferencia.\nEstos programas de campaña se difundirán ampliamente por los medios masivos de comunicación existentes en la Entidad.\nLo anterior será para reafirmar una cultura de trato digno hacia las personas con discapacidad.\n(ADICIONADO, P.O. 13 DE NOVIEMBRE DE 2007)\nArtículo 58 bis. Con el objetivo de lograr que la aceptación social y cultural de las personas con discapacidad acompañadas de perros guía sea total y efectiva, el Gobierno Estatal, junto a las organizaciones de la sociedad civil interesadas, promoverá y llevará a cabo campañas informativas orientadas de manera especial a sectores como la hotelería, comercio, escuelas, transporte y servicios públicos; igualmente desarrollará otras de orden educativo dirigidas a la población en general.\n(ADICIONADO, P.O. 13 DE NOVIEMBRE DE 2007)\nArticulo 58 ter. El Gobierno del Estado junto con los municipios, promoverá y llevará a cabo campañas de adiestramiento como perros guía, de animales que se encuentren en los centros antirrábicos y de perros abandonados, o albergues de asociaciones protectoras de animales; siempre y cuando sus características físicas y de obediencia permitan su adiestramiento como perros de asistencia.\nArtículo 59.- En todos los demás aspectos relativos a este capítulo nos remitimos al reglamento de la\nLey de Tránsito y Transporte para el Estado de Coahuila.\n(ADICIONADO, P.O. 13 DE NOVIEMBRE DE 2007)\nTITULO VI\nCAPITULO II\nArtículo 59-A. En el Estado de Coahuila, se reconoce de interés público, que toda persona con discapacidad pueda acceder al uso de un Perro Guía; igualmente se reconoce su derecho al acceso, recorridos y permanencia junto con éste, en todos los lugares, locales y demás espacios de uso público, así como su viaje en transportes públicos, en uso de su derecho de libre tránsito, en condiciones de igualdad con el resto de la ciudadanía.. ley. pago adicional, salvo que su movilización constituya la prestación de un servicio agregado. serán donados a los usuarios de escasos recursos que así lo requieran, o bien cubiertos con instituciones públicas y privadas, tanto nacionales como extranjeras, para formar fondos de apoyo a estas actividades.\nArtículo 59-B. Una vez reconocida la condición de Perro Guía, se mantendrá a lo largo de su vida, salvo que se presenten alguna causa de las previstas en el artículo 59-H.\n(ADICIONADO, P.O. 13 DE NOVIEMBRE DE 2007)\nArtículo 59-C. Para los efectos de lo establecido en el artículo 59-A, tendrán la categoría de lugares de libre acceso a las personas con discapacidad en compañía de sus perros guías, los siguientes:\nI. Los lugares de esparcimiento al aire libre, tales como parques, jardines y otros espacios de uso público, incluidos los centros de recreación, parques de diversiones y complejos de entretenimiento.\nII. Los locales e instalaciones donde se realicen espectáculos públicos y/o desarrollen actividades recreativas.\nIII. Los asilos, hogares para la atención a los adultos mayores, centros de rehabilitación y los establecimientos similares, sean de propiedad pública o privada.\nIV. Los edificios públicos, cuyo acceso no se encuentre prohibido o restringido al público en general.\nV. Los centros educativos, deportivos y de salud, públicos y privados de todos los niveles y grados, modalidades y especialidades. Igualmente los museos, bibliotecas, teatros, salas de cine, de exposiciones y conferencias.\nVI. Los almacenes, tiendas, despachos profesionales y centros comerciales.\nVII. Los espacios de uso público de las estaciones de autobús, ferrocarril, aeropuertos y paradas de vehículos de transporte..\nVIII. Los hoteles, restaurantes, establecimientos turísticos y cualquier otro lugar abierto al público en el que se presten servicios relacionados con el turismo.\nIX. En general, cualquier otro lugar, local o establecimiento de uso público o de atención al público.\nX. Los Transportes públicos y los servicios urbanos de transportes de viajeros y autos de alquiler de competencia del estado y los municipios.\nEn el caso de que la infraestructura no permita el adecuado traslado a las personas con discapacidad, acompañadas de perros de asistencia, se procurará, cuando ello sea posible, un recorrido alterno. necesaria para hacer las adecuaciones físicas en los lugares antes mencionados.\nLa persona con discapacidad acompañada de perro guía, tendrá preferencia para ocupar los asientos con mayor espacio libre o adyacente a un pasillo, según el medio de transporte de que se trate.\nEn los servicios de autos de alquiler, el perro guía irá preferentemente en la parte trasera del vehículo, a los pies de la persona con deficiencias visuales o con discapacidad. No obstante, y a elección de las personas usuarias de perros guía, se podrán ocupar asientos delanteros, teniendo el perro a sus pies, especialmente en los trayectos de largo recorrido.\nArticulo 59-D. Todo perro guía deberá ser acreditado por el Comité Estatal para la Certificación de\nPerros Guía. La acreditación se concederá previa comprobación de que el perro reúne las condiciones higiénico-sanitarias, de adiestramiento y de aptitud para auxiliar a personas con discapacidad.\nLos reconocimientos otorgados por otras entidades y países, a perros guía, serán revalidados por el\nComité.\nArtículo 59-E. La condición de Perro Guía se reconocerá, y procederá a su acreditación siempre que se justifique:\nI. Que está entrenado en un centro oficialmente autorizado por el Comité de Certificación, para la práctica de perros guía.\nII. Que cumple la normativa sanitaria vigente y lo previsto en el artículo 59-G de esta ley.\nIII. Que está vinculado a un trabajo de asistencia y guía a la persona que lo usa para los fines previstos en la presente ley.\nIV. Que ayude a disminuir los efectos de la discapacidad de su propietario.\nEl reconocimiento de la condición de perro de asistencia se efectuará por el Comité antes mencionado y se mantendrá durante toda la vida del perro guía, con las excepciones señaladas en esta ley.\n(ADICIONADO, P.O. 13 DE NOVIEMBRE DE 2007)\nArtículo 59-F. Los perros guía se hallarán identificados, mediante la colocación, en lugar visible, del distintivo que le otorgue el Comité Estatal para la Certificación de Perros Guía.\nTambién deberán estar identificados permanentemente mediante microchip, según acuerde el Comité.\nEl usuario del perro guía, previo requerimiento, deberá exhibir su identificación que lo acredite como la persona autorizada para el uso del perro guía, expedida por el Comité, así como documentación que acredite las condiciones sanitarias que se mencionan en el artículo siguiente.\n(ADICIONADO, P.O. 13 DE NOVIEMBRE DE 2007)\nArticulo 59-G. Además de cumplir las obligaciones sanitarias que se deben satisfacer como animales domésticos, los poseedores de perros guía o de asistencia deberán cumplir las siguientes con relación al animal:\nI. Una inspección veterinaria donde se demuestre que no padece ninguna enfermedad transmisible al hombre.\nII. Estar vacunado contra la rabia, recibir los tratamientos periódicos y practicarse las pruebas clínicas que instruya el Comité.\nIII. Todas aquellas que reglamentariamente se determinen. referidas, mismas que se acreditarán mediante certificación expedida por Médico Veterinario. Tratándose de personas de escasos recursos, el estado celebrará convenios para buscar disminuir al mínimo los costos de estos servicios veterinarios.\nPara mantener la condición de perro de asistencia, será necesario un reconocimiento periódico anual, debiéndose acreditar en el mismo el cumplimiento de las condiciones a que se refiere este artículo, mismo que podrá obtenerse con Médico Veterinario Titulado.\nArtículo 59-H. El perro guía perderá su condición, por alguno de los siguientes motivos:\nI. Por dejar de prestar asistencia a una persona con discapacidad.\nII. Por manifiesta incapacidad en el desempeño de las funciones para las que fue entrenado.\nIII. Por manifestar comportamiento agresivo o violento.\nIV. Por incumplir las condiciones referidas en la Ley y en los reglamentos que para tal efecto se expidan.\nPara poder acreditar las causas contenidas en las fracciones II, III y IV se requerirá certificado de veterinario en ejercicio.\nLa pérdida de la condición de perro guía, se declarará por el mismo órgano o entidad que la otorgó, quien procederá igualmente a la revocación de la acreditación.\nCuando alguno de los motivos señalados sea temporal, se determinará la suspensión provisional de la condición de perro guía por un periodo máximo de seis meses. Transcurrido dicho plazo sin que se modifique la situación, se procederá a declarar la pérdida de la condición de perro guía.\nEl usuario que no desee seguir con la posesión de un perro guía deberá notificarlo al Comité para su reasignación\n(ADICIONADO, P.O. 13 DE NOVIEMBRE DE 2007)\nArtículo 59-I. El derecho de acceso a que se refiere el artículo 59-A de esta ley comprende, también la permanencia ilimitada y constante del perro guía junto al usuario.\nNo obstante lo dispuesto en el párrafo anterior, el usuario del perro de asistencia no podrá ejercitar los derechos reconocidos en esta ley, cuando concurra alguna de las siguientes circunstancias:\na) En caso de grave peligro inminente para el usuario, para tercera persona o para el propio perro de asistencia.\nb) Cuando el animal presente síntomas de enfermedad visibles o heridas que por su tamaño o aspecto supongan un presumible riesgo para las personas o se evidencie la falta de aseo o de atención.\n(ADICIONADO, P.O. 13 DE NOVIEMBRE DE 2007)\nArtículo 59-J. La persona usuaria de un perro guía deberá cumplir con las obligaciones que señala la normativa vigente y, en particular, con las siguientes:\nI. Mantener al perro a su lado, con la correa y arnés que en su caso sea necesario, en los lugares, establecimientos y transportes a que se refiere esta ley.\nII Llevar identificado de forma visible al perro guía, de acuerdo con lo previsto en el artículo 59-F de ésta ley, llevando consigo y exhibir la documentación sanitaria, cuando sea requerido para ello.\nIII. Utilizar al perro de asistencia para aquellas funciones para las que fue entrenado, atendiendo siempre a las normas de higiene y seguridad en los lugares públicos o de uso público, en la medida en que su deficiencia visual o discapacidad le permita.\nIV. Cumplir y hacer que los demás cumplan los principios de respeto, defensa, convivencia pacífica y protección del perro guía.\nV. Garantizar el adecuado nivel de bienestar e higiene del perro guía, a efecto de proporcionarle una buena calidad de vida.\nArtículo 59-K. El usuario del perro guía, como responsable de su correcto comportamiento, deberá ocasionados por el perro.\nArticulo 59-L El incumplimiento de lo dispuesto en la presente ley con relación al libre acceso de personas con discapacidad y sus perros guía a los lugares, aquí mencionados, constituye infracción administrativa y será sancionado conforme se dispone en esta ley.\nArtículo 59-M. Son sujetos responsables de las infracciones administrativas las personas físicas o morales que realicen, directa o indirectamente, las acciones u omisiones señaladas en la presente ley\n(ADICIONADO, P.O. 13 DE NOVIEMBRE DE 2007)\nArtículo 59-N Serán responsables solidarios las personas físicas o morales, propietarias del establecimiento, de la concesión, licencia o permiso del que sea empleado o dependiente la persona infractora.\n(ADICIONADO, P.O. 13 DE NOVIEMBRE DE 2007)\nArtículo 59-0. Se instituye el Comité para la Certificación de Perros Guía como órgano técnico de apoyo en la certificación de perros guía. dicho Comité será presidido por el servidor público que designe el\nTitular del Ejecutivo y contará con tres vocales que serán personas de la sociedad civil con conocimientos amplios en la materia y cuyos nombramientos serán honorarios.\nEl Comité se reunirá por lo menos una vez al mes conforme lo establezca su reglamento, donde también se determinarán los procedimientos para su operación, y en sus sesiones conocerá de los asuntos que le encomiende la presente ley.\nEl Comité podrá otorgar plazos para el cumplimiento de las obligaciones previstas en esta ley cuando existan causas de fuerza mayor.\nTITULO VII\nCAPITULO UNICO\nESTIMULOS\nArtículo 60.- El Gobierno del Estado, otorgará estímulos, beneficios y reconocimientos a aquellas programas que les beneficien, mismos que serán entregados en actos públicos, con el propósito de promover dichas actitudes. a aquellas personas con discapacidad que se distingan en cualquier actividad, con el propósito de que la\nSociedad les reconozca sus hechos y actitudes, ya sea en su desempeño diario o con la realización de acciones tendientes a superarse así mismo en su trabajo, en el deporte, en la ciencia o arte.\nTITULO VIII\nCAPITULO UNICO\nSANCIONES Y MULTAS\nArtículo 62.- Las infracción a las disposiciones contenidas en este cuerpo legal, serán denunciadas a las autoridades correspondientes quien considerando la gravedad de la falta, aplicará la sanción establecida.\nArtículo 62-A. Son infracciones leves:\nI. Ocupar indebidamente los espacios de estacionamiento preferencial;\nII. Obstruir las rampas o accesos para personas con discapacidad\nIII. La exigencia de pago alguno por el acceso de los perros de guía sin que su entrada implique gasto adicional, conforme la presente ley.\nIV. El daño físico que le sea infligido a un perro guía por negligencia.\nV. Todas las conductas pasivas o activas que dificulten el ejercicio de los derechos reconocidos a las personas con discapacidad y a sus perros guía.\n(ADICIONADO, P.O. 13 DE NOVIEMBRE DE 2007)\nArtículo 62-B. Son infracciones graves:\nI. El infringir los derechos reconocidos en la presente ley en cuanto a lugares, alojamientos, establecimientos, locales de propiedad privada.\nII. La comisión de tres faltas leves, sancionadas, en un período de dos años.\nIII. Todas las conductas pasivas o activas que impidan en forma manifiesta y notoria el ejercicio de los derechos reconocidos a las personas con discapacidad y/o a sus perros guía.\n(ADICIONADO, P.O. 13 DE NOVIEMBRE DE 2007)\nArtículo 62-C. Son infracciones muy graves:\nI. Negar el acceso o permanencia en lugares, alojamientos, locales y transportes públicos, previstos en el articulo 59-C de esta Ley.\nII. Que los empresarios, administradores y organizadores de espectáculos públicos omitan o ubiquen discriminatoriamente los espacios reservados, así como las facilidades de acceso, para personas con discapacidad.\nIII. El daño físico que le sea infligido en forma dolosa a un perro guía.\nIV. La comisión de tres faltas graves, sancionadas, en un período de dos años.\nArtículo 63.- Para los efectos de la presente Ley, se aplicará, independientemente de lo dispuesto por otras disposiciones legales, las siguientes sanciones:\nI. Para las infracciones leves, multa equivalente de 10 a 50 días de salario mínimo vigente en la zona económica de que se trate.\nII. Para las infracciones graves, multa equivalente de 51 a 100 días de salario mínimo vigente en la zona económica de que se trate.\nIII. Para las infracciones muy graves, multa equivalente de 100 a 300 días de salario mínimo en la zona económica de que se trate.\nArtículo 63-A. En caso de incurrir tres ocasiones en la misma falta, se procederá a la clausura temporal del local por cinco días.\nArtículo 63-B. Para la graduación de las sanciones se atenderá a la intencionalidad de la falta o grado de negligencia, la importancia del daño generado, la reincidencia de la conducta y las condiciones propias del caso.\nArtículo 63-C. La imposición de cualquier sanción prevista en esta ley no excluye la responsabilidad civil y penal y la eventual indemnización de daños y perjuicios que puedan corresponder al infractor.\nLas sanciones anteriores se tramitarán y resolverán por parte del Sistema para el Desarrollo Integral de la\nFamilia, sin perjuicio de lo dispuesto en el arto 58 de la Ley Federal de Protección del Consumidor.\nTITULO IX\nCAPITULO UNICO\nDE LOS RECURSOS DE RECONSIDERACION E INCONFORMIDAD\nArtículo 64.- Las resoluciones que se dicten en la aplicación de disposiciones de esta Ley, podrán ser impugnadas, ante la misma autoridad que las emita, a través del recurso de reconsideración.\nArtículo 65.- El recurso de reconsideración se hará valer, mediante escrito en el cual se precisen los agravios que la resolución origine al recurrente, precisamente dentro de los diez días hábiles siguientes a la fecha en que esta tenga conocimiento de la resolución impugnada.\nArtículo 66.- El recurso se resolverá sin más trámite que el escrito de impugnación y vista del expediente que se haya formado para dictar la resolución combatida. La autoridad deberá decidir sobre el recurso en un termino no mayor de quince días.\nArtículo 67.- Cuando el recurso se interponga en contra de la resolución que imponga una multa, el interesado como requisito de procedibilidad de la impugnación deberá acreditar haber garantizado el importe de la sanción ante la correspondiente dependencia fiscal.\nArtículo 68.- La interposición del recurso, salvo en el caso de que trata el artículo anterior, provocará la suspensión de la ejecución del acto que se reclame, hasta en tanto que aquel no sea decidido.\nArtículo 69.- La resolución que se dicte en la reconsideración no admitirá recurso alguno.\nArtículo 70.- Contra las resoluciones en las que se impongan las sanciones contenidas en esta Ley procederá el recurso de inconformidad, que se interpondrá dentro de los quince días hábiles siguientes a la fecha de notificación de la resolución ante la misma autoridad que la emita.\nTRANSITORIOS\nARTICULO PRIMERO.- La presente Ley entrará en vigor al día siguiente de su publicación, en el\nPeriódico Oficial del Estado.\nARTICULO SEGUNDO.- Se derogan todas las disposiciones que se opongan a la presente Ley. efectuar para la eliminación de barreras arquitectónicas y urbanas en edificios y vía pública, se efectuará una vez que el Congreso del Estado autorice las partidas correspondientes para tal efecto.\nARTICULO CUARTO.- Los propietarios de inmuebles, contarán con un plazo de 180 días a partir de la publicación de la presente Ley, para realizar a sus correspondientes bienes las adecuaciones tendientes al cumplimiento de esta Ley. Salvo que pericialmente quede acreditada la imposibilidad de efectuarlas.\nDADO en el Salón de Sesiones del Congreso del Estado, en la ciudad de Saltillo, Coahuila, a los treinta días del mes de diciembre de mil novecientos noventa y seis.\nDIPUTADO PRESIDENTE\nHORACIO VELOZ MUÑOZ\nDIPUTADA SECRETARIA DIPUTADO SECRETARIO\nIMPRIMASE, COMUNIQUESE Y OBSERVESE.\nSaltillo, Coahuila, 31 de diciembre de 1996.\nEL GOBERNADOR DEL ESTADO\nROGELIO MONTEMAYOR SEGUY\nEL SECRETARIO DE GOBIERNO\nLIC. CARLOS JUARISTI SEPTIEN\nEL SECRETARIO DE FINANZAS\nLIC. ANTONIO JUAN MARCOS ISSA\nEL SECRETARIO DE COMUNICACIONES\nY OBRAS PUBLICAS\nLIC. ANTONIO KARAM MACCISE\nEL SECRETARIO DE DESARROLLO SOCIAL\nLIC. ROGELIO RAMOS ORANDAY\nDRA. LOURDES QUINTANILLA RODRIGUEZ\nEL SECRETARIO DE EDUCACION PUBLICA\nLIC. OSCAR PIMENTEL GONZALEZ\nN. DE E. A CONTINUACION SE TRANSCRIBEN LOS ARTICULOS TRANSITORIOS DE LOS DECRETOS DE REFORMAS A LA\nPRESENTE LEY.\nSEGUNDO.- Se derogan todas las disposiciones legales que se opongan al presente Decreto.\nPRIMERO.- La entrada en vigor del presente decreto, será en noventa días naturales, a partir de la fecha de su publicación en el\nPeriódico Oficial del Estado.\nSEGUNDO.- Los perros guía existentes en la actualidad, deberán adecuarse a los requisitos de reconocimiento e identificación previstos en esta ley, dentro del plazo de seis meses a partir del desarrollo reglamentario de ésta ley.\nTERCERO.- Los Municipios, dentro del ámbito de sus respectivas competencias, adaptarán sus reglamentos municipales sobre la materia a las normas contenidas en la presente ley, en el plazo de seis meses a partir de la entrada en vigor de esta ley.",
  "ordenamiento": "REGLAMENTO",
  "jurisdiccion": "COAHUILA",
  "fuente_oficial": "DIARIO OFICIAL DE LA FEDERACION",
  "Fecha de Publicación": "13 DE NOVIEMBRE DE 2007",
  "ULTIMA REFORMA PUBLICADA": "13 DE NOVIEMBRE DE 2007",
  "es_escaneado": false,
  "tiene_tablas": false,
  "materia": [
    "general"
  ]
}