{
  "titulo": "Ley Orgánica del Poder Judicial del Estado de Coahuila de Zaragoza",
  "Contenido": "EL C. LIC. ELISEO FRANCISCO MENDOZA BERRUETO, GOBERNADOR CONSTITUCIONAL\nDEL ESTADO INDEPENDIENTE, LIBRE Y SOBRANO DE COAHUILA DE ZARAGOZA, A SUS\nHABITANTES SABED:\nQUE EL CONGRESO DEL ESTADO INDEPENDIENTE, LIBRE Y SOBERANO DE COAHUILA DE\nZARAGOZA, decreta:\nTITULO PRIMERO\nDISPOSICIONES GENERALES\nARTICULO 1o.- La justicia se imparte en nombre del pueblo y se administra por el Estado a través de la función jurisdiccional, ejercida por magistrados y jueces integrantes del Poder Judicial, independientes, imparciales, responsables y sometidos únicamente al imperio de la Ley.\nEl ejercicio de la potestad jurisdiccional en todo tipo de procesos, corresponde exclusivamente a los órganos del Poder Judicial en los negocios que les encomienden las leyes, según los procedimientos que las mismas establezcan.\n(REFORMADO, P.O. 28 DE DICIEMBRE DE 2007)\nEl Tribunal Electoral, con excepción de lo dispuesto en el artículo 158 de la Constitución Política del Estado, el Tribunal de lo Contencioso-Administrativo, el Tribunal de Conciliación y Arbitraje y el\nTribunal de Apelación Especializado en materia de Adolescentes, serán máximas autoridades jurisdiccionales en la materia y órganos especializados del Poder Judicial; los tres primeros en los términos que establece el artículo 136 de dicha Constitución y el último por imperativo del artículo\n18 de la Constitución Política de los Estados Unidos Mexicanos; así como por lo dispuesto en las demás leyes aplicables.\n(REFORMADO, P.O. 28 DE DICIEMBRE DE 2007)\nARTICULO 2º. El Poder Judicial del Estado se integra por:\nI.- El Tribunal Superior de Justicia;\nII.- Tribunales especializados, que por razón de la materia serán:\na). El Tribunal Electoral,\nb). El Tribunal de lo Contencioso-Administrativo,\nc). El Tribunal de Conciliación y Arbitraje, y\nd). El Tribunal de Apelación Especializado en Materia de Adolescentes.\nIII.- Tribunales Distritales;\nIV.- Juzgados de Primera Instancia, que en razón de la materia serán:\na) Civiles;\nb) Mercantiles, que para todos los efectos legales conocerán de asuntos en jurisdicción concurrente;\nc) Familiares;\nd) Penales;\ne) Mixtos, cuando deban conocer de dos o más materias; y\nf) De Adolescentes.\nV.- Juzgados Letrados, que en razón de la materia serán:\na) Civiles;\nb) Penales; y\nc) Mixtos, cuando conozcan, a la vez de dos o más materias.\nAsimismo, los Juzgados Letrados podrán conocer de diversa materia, cuando así lo determine el\nConsejo de la Judicatura.\nVI.- El Consejo de la Judicatura; y,\nVII.- Los demás órganos que con cualquier otra denominación determinen las leyes o sean creados por las autoridades competentes.\nLos árbitros voluntarios no ejercerán autoridad pública, pero conocerán del asunto o asuntos que les encomienden los interesados de acuerdo a las reglas y restricciones que fijen las leyes y según los términos de los compromisos respectivos.\nEl Consejo de la Judicatura tendrá la competencia y atribuciones que señalen la Constitución\nARTICULO 3o.- Son Auxiliares de la administración de justicia:\n(REFORMADA, P.O. 2 DE JULIO DE 1996)\nI.- El Ministerio Público y la Policía Ministerial;\nII.- La Dirección de Seguridad Pública en el Estado;\nIII.- (DEROGADA, P.O. 2 DE JULIO DE 1996)\nIV.- (DEROGADA, P.O. 2 DE JULIO DE 1996)\nV.- El director y los jefes de las oficinas del Registro Público de la Propiedad;\nVI.- El director y los oficiales del Registro Civil;\nVII.- Los depositarios e interventores;\nVIII.- Los peritos médicos legistas;\nIX.- Los intérpretes y demás peritos en los ramos que se les encomienden;\nX.- Los síndicos e interventores de concursos y quiebras;\nXI.- Los albaceas e interventores de sucesiones;\nXII.- Los tutores y curadores;\nXIII.- Los comandantes, delegados y agentes de Policía y Tránsito del Estado o Municipales;\nXIV.- Los abogados y los notarios públicos; y\nXV.- Todos los demás a quienes las leyes les confieran este carácter.\nARTICULO 4o. Son obligaciones de las autoridades jurisdiccionales:\nI.- Ajustar sus procedimientos y resoluciones a las leyes;\nII.- Ejercer la función jurisdiccional gratuitamente;\nIII.- Auxiliar a la Justicia Federal y demás autoridades, en los términos de las disposiciones legales aplicables;\nIV. Diligenciar o mandar diligenciar exhortos, despachos, requisitorias y oficios procedentes de las demás autoridades del interior del Estado o de fuera de él, si estuvieren conforme a derecho.\nV.- Proporcionar a las autoridades competentes los datos e informes que éstas soliciten, cuando así proceda conforme a la Ley; y\nVI.- Las demás que las leyes les impongan.\nTITULO SEGUNDO\nDE LA DIVISION TERRITORIAL\n(REFORMADO, P.O. 20 DE MARZO DE 2001)\nARTICULO 5o.- Para la impartición de la justicia, el Estado de Coahuila de Zaragoza se dividirá en distritos judiciales y demás circunscripciones necesarias, con base en la agrupación de sus municipios.\nEl Consejo de la Judicatura es la autoridad competente para determinar los distritos judiciales y las circunscripciones de acuerdo con las reglas siguientes:\nI. Se fijarán para posibilitar el acceso a la justicia pronta, expedita y completa en beneficio del pueblo coahuilense.\nII. Previa a la aprobación de la división judicial, el Consejo de la Judicatura pedirá la opinión de los ayuntamientos que formen parte del distrito o circunscripción de que se trate. En ese caso, éstos recibido la petición.\nIgualmente deberá solicitarse la opinión del pleno del Tribunal Superior de Justicia.\nIII. El Consejo de la Judicatura fijará los distritos judiciales y demás circunscripciones que exija el buen servicio de la impartición de justicia, una vez transcurrido el término precitado.\nIV. La aprobación de los distritos judiciales y demás circunscripciones se mandarán publicar en el\nV. Se podrá modificar el número de distritos y circunscripciones determinadas por el Consejo de la\nJudicatura, previo el procedimiento que establece este artículo.\nTITULO TERCERO\nCAPITULO I\nDEL TRIBUNAL SUPERIOR DE JUSTICIA\nARTICULO 6o.- El Tribunal Superior de Justicia del Estado, estará integrado por catorce\nMagistrados Numerarios y nueve Supernumerarios, y funcionará en Pleno o en Salas.\nSerá Presidente uno de los Magistrados numerarios designado por el Pleno, quien no integrará\nSala durante el tiempo que dure su encargo.\nEsta ley y los demás ordenamientos aplicables determinarán la competencia, organización y atribuciones de las Salas, así como la forma en que deberá designarse al Presidente del Tribunal.\n(REFORMADO, P.O. 28 DE DICIEMBRE DE 2007)\nARTICULO 7o.- Los magistrados numerarios que integren el Tribunal Superior de Justicia durarán en su encargo quince años y sólo podrán ser privados de sus puestos en los términos del Título\nSéptimo de la Constitución Política local.\nLos magistrados supernumerarios del Tribunal Superior de Justicia durarán en su cargo seis años, al término del cual podrán ser designados para un nuevo período.\nCAPITULO II\nDEL PLENO DEL TRIBUNAL SUPERIOR DE JUSTICIA\n(REFORMADO, P.O. 28 DE DICIEMBRE DE 2007)\nARTICULO 8o.- El Pleno del Tribunal Superior de Justicia, se integra por el Presidente electo en los términos del artículo 13 de esta ley, los diez Magistrados Numerarios de las Salas que residan en la capital del Estado y con el Presidente de la Sala Auxiliar con jurisdicción en los Distritos\nJudiciales de Viesca y San Pedro.\nLas faltas temporales que ocurran en el Pleno, serán suplidas por los Magistrados supernumerarios adscritos a las Salas a que se refieren los artículos 22 y 23 de esta ley.\n(REFORMADO PRIMER PÁRRAFO, P.O. 28 DE DICIEMBRE DE 2007)\nARTICULO 9o.- El Pleno del Tribunal Superior de Justicia sólo podrá funcionar con la votos de los magistrados presentes. Si de la votación resultare empate, el Presidente del Tribunal tendrá voto de calidad.\nLas resoluciones del Pleno deberán ser autorizadas por el Presidente, el Magistrado ponente si lo hubiere y el Secretario General de acuerdos y, en su caso, también por los magistrados disidentes.\nLas observaciones y los votos particulares que se hagan por escrito, deberán ser firmados por los magistrados que los formulen.\nARTICULO 10.- Las sesiones del Pleno del Tribunal Superior de Justicia, podrán ser ordinarias o extraordinarias y, en ambos casos, públicas o secretas. El Presidente convocará a las sesiones\nLas sesiones en el proceso disciplinario siempre serán secretas.\nCuando sea necesaria una reunión extraordinaria del Tribunal Pleno y no concurra el Presidente, Magistrado que deba sustituirlo en los términos de esta Ley.\nARTICULO 11.- Corresponde al Pleno del Tribunal Superior de Justicia:\nI.- Ejercer el derecho de iniciar leyes, en los términos de la fracción III, del artículo 59, de la\n(REFORMADA, P.O. 16 DE NOVIEMBRE DE 2001)\nII. Conocer en segunda instancia de las causas civiles en que el estado sea parte, en los términos que señale la ley.\nIII.- Conocer en única instancia de los procesos a que se refiere el tercer párrafo del artículo 165 de\n(REFORMADA, P.O. 28 DE DICIEMBRE DE 2007)\nIV.- Conocer del procedimiento de anulación de sentencia ejecutoria por declaración de inocencia;\nV.- Calificar los impedimentos, recusaciones y excusas de sus miembros y cuando se trate de los\nMagistrados en conjunto de una Sala;\nVI.- Dirimir cualquier controversia que se suscite entre las Salas del Tribunal;\n(REFORMADA, P.O. 28 DE DICIEMBRE DE 2007)\nVII.- Resolver, en única instancia, las demandas que por responsabilidad civil se presenten contra los Magistrados del Tribunal Superior y de los Tribunales Especializados a que se refiere esta ley;\n(REFORMADA, P.O. 5 DE DICIEMBRE DE 1997)\nVIII.- Ejercer la jurisdicción disciplinaria que le corresponde por faltas administrativas, excepto la que sea competencia del Consejo de la Judicatura, en los términos del capítulo IV del título décimo de esta ley;\n(REFORMADA, P.O. 18 DE MAYO DE 1999)\nIX.- Fijar jurisprudencia por reiteración o por contradicción en los términos que establezca esta ley.\nX.- Elegir al Presidente del Tribunal Superior, que lo será también del Pleno;\nXI.- Realizar los cambios que sean necesarios entre los magistrados numerarios, con motivo de la elección del Presidente del Tribunal;\nXII.- Exigir del presidente del Tribunal el fiel cumplimiento de sus obligaciones y la responsabilidad en que incurra de acuerdo a la Ley, en el ejercicio de sus funciones;\nXIII.- Conocer de las controversias constitucionales y acciones de inconstitucionalidad locales a\nXV.- Señalar la adscripción de los Magistrados para la integración de cada una de las Salas, así como ratificar la adscripción, de acuerdo a las necesidades del servicio;\nXVII.- Discutir, aprobar y modificar, según proceda, el proyecto de Presupuesto Anual de Egresos que corresponda a las Salas del Tribunal Superior de Justicia, a propuesta del Presidente del\nTribunal;\nXVIII.- Acordar el aumento o supresión de las Salas del Tribunal Superior, así como la planta de servidores públicos adscritos a ellas, cuando las necesidades del servicio lo requieran y lo permita el presupuesto asignado al Tribunal Superior de Justicia. Los secretarios de estudio y cuenta de cada magistrado, serán designados y removidos libremente por el magistrado que corresponda.\nSin perjuicio de que, en el último supuesto, los secretarios conserven el derecho de escalafón si sirvieron por más de un año y se les dé preferencia, si se encuentran en condiciones de igualdad con otros, para su designación en otros cargos;\n(REFORMADA, P.O. 16 DE NOVIEMBRE DE 2001)\nXIX. Acordar, en los mismos términos que se señalan en la fracción que antecede y conforme lo autorice el presupuesto, que los Magistrados Supernumerarios integren Salas Auxiliares del\nTribunal Superior, señalándoles en el mismo acuerdo, el tiempo que deberán funcionar y los asuntos de los que deberán conocer. En este caso, los magistrados supernumerarios percibirán los mismos emolumentos que los numerarios.\nLos acuerdos a que se refiere esta fracción y la que antecede, serán publicados previamente en el\nPeriódico Oficial del Gobierno del Estado, para que surtan sus efectos.\n(REFORMADA, P.O. 16 DE NOVIEMBRE DE 2001)\nXX. Solicitar al Consejo de la Judicatura, la práctica de visitas ordinarias o extraordinarias a los\nTribunales Unitarios de Distrito y a los juzgados.\n(REFORMADA, P.O. 5 DE DICIEMBRE DE 1997)\nXXI.- Conferir a los magistrados supernumerarios, cuando no estén en funciones, las comisiones y representaciones que juzgue pertinentes, en beneficio de la administración de justicia, siempre que no se trate de la competencia del Consejo de la Judicatura;\nXXII.- (DEROGADA, P.O. 5 DE DICIEMBRE DE 1997)\n(REFORMADA, P.O. 16 DE NOVIEMBRE DE 2001)\nXXIII. Fijar, en el último Pleno del año, el calendario de labores del Poder Judicial, correspondiente al siguiente año, precisando los períodos de vacaciones, los días inhábiles y aquellos en los que no habrá actuaciones; así como decretar la suspensión de labores, en los casos que se estime necesario.\nXXIV. Aprobar las listas y sus actualizaciones, de las personas que podrán ejercer los cargos de síndicos e interventores en los juicios de concurso; albaceas e interventores en los juicios sucesorios; depositarios y demás auxiliares de la administración de justicia que deban designarse en los asuntos que se tramiten ante los tribunales y juzgados, en los términos previstos por esta ley.\nXXV.- Fijar los emolumentos que deban percibir los magistrados supernumerarios, cuando conozcan de uno o varios asuntos determinados, excepto cuando la asignación de funciones competa al Consejo de la Judicatura;\nXXVII. Dictar, en la esfera de su competencia, providencias necesarias para que la administración de justicia sea eficaz, pronta y expedita.\nXXVIII.- Expedir su reglamento interior, para su funcionamiento;\n(REFORMADA, P.O. 16 DE NOVIEMBRE DE 2001)\nXXX. Determinar los mecanismos para la supervisión e inspección del funcionamiento de las Salas del Tribunal Superior de Justicia.\n(REFORMADA, P.O. 16 DE NOVIEMBRE DE 2001)\nXXXI. Las demás que le confieran las leyes u otras disposiciones aplicables.\nARTICULO 12.- El Tribunal Pleno designará un secretario General de Acuerdos y a los servidores públicos que se requiera.\nPara ser Secretario General de Acuerdos del Tribunal Pleno, son necesarios los mismos requisitos que para ser Juez de Primera Instancia.\nEl Secretario General de Acuerdos será el fedatario de las actuaciones del Pleno y tendrá las demás facultades y obligaciones que este le otorgue.\nCAPITULO III\nDEL PRESIDENTE DEL TRIBUNAL SUPERIOR DE JUSTICIA\n(REFORMADO, P.O. 28 DE DICIEMBRE DE 2007)\nARTICULO 13.- El Presidente del Tribunal Superior de Justicia será electo por el Pleno de entre sus miembros, en escrutinio secreto, cada cinco años y podrá ser reelecto por igual período.\nEn la última sesión del Pleno que corresponda al período señalado en el párrafo anterior, se realizará nueva elección de Presidente, quien iniciará sus funciones a partir de la siguiente sesión a la de su elección.\nARTICULO 14.- Corresponde al presidente del Tribunal Superior de Justicia:\nSuperior de Justicia, así como del Pleno del propio Tribunal y del Consejo de la Judicatura, con todas las facultades, aún las que requieran cláusula especial.\nII. Dictar, en los asuntos de su competencia, las providencias necesarias para que la administración de justicia sea eficaz, pronta y expedita.\nIII. Distribuir entre los magistrados del Tribunal Superior de Justicia, los asuntos que sean de la competencia del Pleno para que los instruyan, dictando los acuerdos y autos necesarios y presidan las audiencias que se requieran, hasta ponerlos en estado de resolución. Los magistrados serán ponentes de los asuntos que instruyan.\nPleno, en los términos que establezca la ley.\nIV. Autorizar con su firma, en unión a la del Secretario General de Acuerdos, los proveídos que emita, así como las actas de las sesiones plenarias, haciendo constar en ellas una síntesis de las deliberaciones y los acuerdos que se tomen.\nV.- Presidir las sesiones que celebre el Tribunal Pleno; dirigir los debates conservando el orden durante las sesiones y poner a votación los negocios sometidos al conocimiento del Pleno, cuando se declare cerrada la discusión;\n(REFORMADA, P.O. 16 DE NOVIEMBRE DE 2001)\nVI. Convocar a sesiones extraordinarias del Pleno del Tribunal y del Consejo de la Judicatura.\n(REFORMADA, P.O. 16 DE NOVIEMBRE DE 2001)\nVII. Formular anualmente el proyecto de Presupuesto de Egresos del Poder Judicial y presentarlo a la consideración del Pleno o del Consejo de la Judicatura, según proceda, sin perjuicio de proponer las ampliaciones que fueren necesarias.\nVIII.- Establecer las políticas generales, supervisar la administración de los recursos humanos y el ejercicio del Presupuesto de Egresos que se fije para el Poder Judicial, así como los del Fondo de\nMejoramiento de la Administración de Justicia;\nIX.- Rendir ante el Congreso del Estado, en el mes de enero de cada año, un informe sobre los movimientos de ingresos y egresos del año anterior, tanto del Presupuesto de Egresos como del\nFondo para el Mejoramiento de la Administración de Justicia;\n(REFORMADA, P.O. 16 DE NOVIEMBRE DE 2001)\nX. Rendir anualmente al Pleno del Tribunal y al Consejo de la Judicatura, un informe sobre las actividades desarrolladas por el Poder Judicial.\n(REFORMADA, P.O. 16 DE NOVIEMBRE DE 2001)\nXI. Recibir las quejas motivadas por demoras o faltas en el despacho de los negocios de las Salas; integrando los expedientes respectivos; emitiendo opinión y turnándolos al Consejo de la\nJudicatura para su conocimiento y resolución.\n(REFORMADA, P.O. 16 DE NOVIEMBRE DE 2001)\nXII. Dar cuenta al Pleno del Tribunal de las demandas de responsabilidad civil que se presenten en contra de los Magistrados del Tribunal Superior, así como al Consejo de la Judicatura respecto de aquéllas, así como de las que se presenten en contra de los demás servidores públicos del Poder\nJudicial.\nXIII. Conceder licencias económicas con goce de sueldo, por causa justificada hasta por quince dependan de las Salas, del Tribunal Electoral, del Tribunal de lo Contencioso-Administrativo, del las relativas a las licencias que correspondan a los Magistrados y Jueces.\nXIV.- Someter a consideración del Consejo de la Judicatura las solicitudes de licencias de los\nJusticia, cuando excedan de un mes;\nXV.- Comunicar al Gobernador del Estado, al Congreso y al Consejo de la Judicatura, las faltas absolutas de los Magistrados del Tribunal Superior, para los efectos de que se haga designación;\nXVI. Comunicar al Consejo de la Judicatura las faltas temporales de los servidores públicos del realice la designación que proceda en los términos de esta ley.\n(REFORMADA, P.O. 28 DE DICIEMBRE DE 2007)\nXVII. Llevar el turno de los Magistrados Supernumerarios, haciendo las designaciones correspondientes para suplir las faltas temporales que ocurran en el Pleno, atendiendo a lo dispuesto por el artículo 8 de esta ley;\nXVIII.- Dirigir la Revista de Información Judicial y cualesquiera otra publicación de difusión judicial;\nXIX.- Compilar y publicar las ejecutorias sobresalientes pronunciadas por el Pleno, las Salas y los\nTribunales Unitarios de Distrito;\nXX.- Presidir el Consejo de la Judicatura;\n(REFORMADA, P.O. 28 DE DICIEMBRE DE 2007)\nXXI.- Atender las excitativas de justicia, a petición fundada de parte, relacionadas con los asuntos en que los servidores públicos judiciales omitan o retarden la realización de un acto judicial o administrativo que les competa, cuando no sean oportunamente atendidas por las Salas o\nTribunales Especializados; en los términos que para tal efecto establezca el reglamento del Pleno.\nXXII.- Supervisar que la Oficialía Mayor lleve las hojas de servicio de todos los servidores de la administración de justicia y que en ella se hagan las anotaciones que procedan, incluyendo quejas fundadas y correcciones disciplinarias impuestas;\n(REFORMADA, P.O. 28 DE DICIEMBRE DE 2007)\nXXIII.- Realizar todas aquellas acciones que estime conducentes y tengan por objeto atender asuntos jurisdiccionales y administrativos de carácter urgente, y en los que no se admita demora; dando cuenta en la siguiente sesión ordinaria al Pleno o al Consejo de la Judicatura, según corresponda.\nXXIV.- Llevar la correspondencia oficial del Tribunal;\nXXV.- Proponer anualmente al Pleno, en el mes de enero, una lista de personas que puedan ejercer las funciones que se señalan en la fracción XXIV del artículo 11 de esta Ley;\nXXVII.- Formular manuales de trámite y programas indispensables para mejorar la administración de la justicia;\nXXVIII.- Vigilar el buen funcionamiento de la Biblioteca y del Archivo Judicial; así como de las\nXXIX.- Autorizar el registro, en la Secretaría del Pleno, de los títulos de abogados o licenciados en derecho, cuando ejerzan la profesión en el territorio del Estado;\nXXX.- Llevar el control estadístico y de evaluación de juicios iniciados, en trámite y concluidos. Y\nJusticia y al Consejo de la judicatura de los que rindan los Magistrados de Distrito y jueces, así como de las evaluaciones respectivas;\nXXXI.- Tener bajo su control el servicio de vigilancia de los edificios donde residan las diversas\nXXXIII.- Expedir oportunamente los nombramientos que acuerden el Tribunal Pleno o el Consejo de la Judicatura, en su caso;\nXXXIV.- Integrar comisiones entre los magistrados del Tribunal Superior, para llevar a cabo estudios especiales, organizar seminarios y conferencias para la capacitación de los miembros del\nPoder Judicial e integrar secciones editoriales de la Revista de Información Judicial o de otras publicaciones;\nXXXV.- Ejercer la jurisdicción disciplinaria que le corresponda, en los términos del Título Décimo de esta Ley; y\n(REFORMADA [N. DE E. ADICIONADA], P.O. 5 DE DICIEMBRE DE 1997)\nXXXVI.- Designar y remover libremente al Oficial Mayor, al Secretario Particular de la Presidencia del Tribunal, al Director del Archivo General del Poder Judicial y demás personal de esas dependencias;\n(REFORMADA, P.O. 5 DE DICIEMBRE DE 1997)\nXXXVII.- Las demás que determinen las Leyes y demás disposiciones aplicables.\n(REFORMADO, P.O. 5 DE DICIEMBRE DE 1997)\nARTICULO 15.- La Presidencia del Tribunal Superior de Justicia dispondrá del número de empleados que sean necesarios para el despacho de los asuntos de su competencia y que fije el presupuesto anual, cuyos nombramientos y readscripciones serán efectuados libremente por el\nPresidente del Tribunal Superior de Justicia, así como sus remociones cuando se trate de personal de confianza.\nCAPITULO IV\n(REFORMADA SU DENOMINACIÓN, P.O. 28 DE DICIEMBRE DE 2007)\nDE LAS SALAS DEL TRIBUNAL SUPERIOR DE JUSTICIA\n(REFORMADO, P.O. 28 DE DICIEMBRE DE 2007)\nARTICULO 16.- El Tribunal Superior de Justicia tendrá cuando menos dos Salas con residencia en la capital del estado y con jurisdicción en todos los Distritos Judiciales, excepción hecha de los de Viesca y San Pedro, en donde contará con una Sala Auxiliar que tendrá como sede la ciudad de\nTorreón, Coahuila; en uno y otro caso, con la competencia que les asigne el Pleno, quien podrá determinar la creación de nuevas Salas, en atención a las necesidades del servicio y conforme al presupuesto anual de egresos. necesidades del servicio. magistrados numerarios y tres supernumerarios designados para tal efecto.\nARTICULO 17.- Las sesiones serán públicas, excepto cuando los integrantes de la Sala determinen que deban ser secretas por que estimen que se afecta la moral o el orden público. Las sesiones tendrán verificativo por lo menos un día hábil de cada semana.\nARTICULO 18.- Las resoluciones serán tomadas por mayoría de votos de los magistrados, quienes no podrán abstenerse de votar sino por impedimento, excusa o recusación que previamente calificará la propia Sala, en cuyo caso se llamará al supernumerario.\nCada Magistrado será ponente de los asuntos que le sean turnados.\nLas resoluciones llevarán la firma de los Magistrados que las acuerden y del secretario de acuerdos de la Sala.\nLos votos particulares y las observaciones por escrito deberán ser firmadas por el magistrado que los formule.\n(REFORMADO, P.O. 28 DE DICIEMBRE DE 2007)\nARTICULO 19.- En la primera sesión del año, cada Sala elegirá de entre los Magistrados que la componen un Presidente, que durará en el cargo un año y podrá ser reelecto por igual período.\nARTICULO 20.- Corresponde a los Presidentes de Sala:\n(REFORMADO PRIMER PÁRRAFO, P.O. 28 DE DICIEMBRE DE 2007)\nI.- Instruir los asuntos de la competencia de la Sala hasta ponerlos en estado de resolución.\nCitados los asuntos para sentencia, en el acuerdo respectivo, el Presidente lo turnará al Magistrado relator que corresponda para su estudio y presentación oportuna del proyecto de resolución, en los términos que establezca la ley de la materia;\n(REFORMADO, P.O. 16 DE NOVIEMBRE DE 2001)\nLas providencias y acuerdos del Presidente podrán ser impugnadas ante el Pleno de la Sala, mediante los recursos que establezca la ley de la materia.\n(REFORMADA, P.O. 28 DE DICIEMBRE DE 2007)\nII.- Presidir las audiencias en los asuntos de la competencia de la Sala, atendiendo a las disposiciones de la ley de que se trate;\nIII.- Presidir las sesiones, dirigir la discusión de los negocios sometidos al conocimiento de la Sala, audiencias;\nIV.- Dar a la Secretaría de Acuerdos de la Sala, los puntos que comprendan las disposiciones resolutivas votadas y aprobadas;\nV.- Llevar la correspondencia de la Sala, autorizándola con su firma;\nVI.- Aprobar las cuentas de los gastos de oficina, dando razón pormenorizada de ello cada mes a la Presidencia del Tribunal;\nVII.- Vigilar que los Secretarios y demás personal de la adscripción cumplan con sus deberes y dar cuenta a la Sala de los casos de inobservancia;\nVIII.- Conceder permisos económicos, con goce de sueldo o sin él, al personal de la Sala hasta por cinco días, los permisos a los secretarios de estudio y cuenta, requieren autorización del magistrado al cual se encuentren adscritos;\nIX.- Rendir por escrito, al Pleno del Tribunal, un informe mensual de las labores desarrolladas por la Sala;\nX.- Llevar el turno de los Magistrados supernumerarios adscritos a la Sala, haciendo las designaciones correspondientes para suplir las faltas de los magistrados numerarios;\nXI.- Autorizar con su firma en unión del secretario de acuerdos, los autos de trámite y las actas de las sesiones, haciendo constar en ellas una síntesis de las deliberaciones y los acuerdos que se tomen;\n(REFORMADA, P.O. 28 DE DICIEMBRE DE 2007)\nXII.- Expedir oportunamente los nombramientos del personal de la Sala que acuerde el Consejo de la Judicatura, de conformidad con las disposiciones establecidas en esta ley en materia de carrera judicial;\nXIII.- Seleccionar y enviar bimestralmente al Presidente del Tribunal, las tesis más importantes que se sustenten por la Sala; y\nXIV.- Las demás que le encomienden esta Ley y otros ordenamientos aplicables.\nARTICULO 21.- Corresponde a las Salas del Tribunal, en lo general:\nI.- Calificar los impedimentos, recusaciones y excusas de los magistrados de los Tribunales\nUnitarios de Distrito, en asuntos de sus respectivas competencias;\nII.- Dirimir los conflictos de competencia que se susciten entre los magistrados de los Tribunales\nUnitarios; los que surgieren entre los demás órganos judiciales subalternos, que correspondan a jurisdicciones de distintos Tribunales Unitarios de Distrito; en estos casos, atendiendo a la materia que tenga asignada cada Sala.\n(DEROGADO SEGUNDO PARRAFO, P.O. 5 DE DICIEMBRE DE 1997)\nIII.- Elegir al Presidente de la Sala;\n(REFORMADA, P.O. 28 DE DICIEMBRE DE 2007)\nIV.- Expedir los nombramientos de la misma, en los términos de las disposiciones aplicables;\nLa proposición de los secretarios de estudio y cuenta la harán los magistrados a los que vayan a estar adscritos, de entre la lista que figure en la reserva judicial;\nV.- Proponer, como corresponda, al personal judicial que se haga acreedor a recibir estímulos y recompensas;\nVI.- Atender excitativas de justicia, en asuntos de su competencia a petición fundada de parte;\nVII.- Conceder licencias económicas al personal de su adscripción, con goce de sueldo o sin él, de más de cinco días sin pasar de quince. además, autorización del magistrado a quien estén adscritos; y\nVIII.- Las demás que les confieran las disposiciones legales aplicables.\nARTICULO 22.- La Sala en Materia Civil y Familiar, conocerá de los siguientes asuntos, siempre\nPedro:\nI.- De los recursos de apelación contra sentencias definitivas pronunciadas por los Jueces de\nPrimera Instancia, en asuntos en materia civil, mercantil y familiar;\nII.- De los recursos de Apelación contra resoluciones que se dicten en los asuntos a que se refiere la fracción anterior, que de ser revocadas deban tener como consecuencia que el Tribunal ad quem decida sobre el fondo del negocio;\n(REFORMADA, P.O. 14 DE MAYO DE 1991)\nIII.- En primera instancia de las causas civiles en que el Estado sea parte;\n(REFORMADA, P.O. 14 DE MAYO DE 1991)\nIV.- En única instancia, de las demandas de responsabilidad civil presentadas contra los\nMagistrados de los Tribunales Unitarios de Distrito y Jueces de Primera Instancia;\n(REFORMADA, P.O. 5 DE DICIEMBRE DE 1997)\nV.- De los negocios que deba conocer el Tribunal Unitario de Distrito, a petición fundada del propio\nTribunal o de oficio, cuando por sus características especiales el asunto lo amerite; y\n(REFORMADA [N. DE E. ADICIONADA], P.O. 2 DE JULIO DE 1996)\nVI.- De las revisiones forzosas en materia familiar; y,\n(REFORMADA [N. DE E. ADICIONADA P.O. 18 DE MAYO DE 1999)\nVII.- Fijar jurisprudencia por contradicción, reiteración o por declaración en los términos que establezca esta ley.\n(ADICIONADA, P.O. 18 DE MAYO DE 1999)\nVIII.- De los demás asuntos que le encomiende la ley.\n(REFORMADO PRIMER PÁRRAFO, P.O. 28 DE DICIEMBRE DE 2007)\nARTICULO 23.- La Sala en Materia Penal conocerá de los siguientes asuntos, siempre que no correspondan a la Sala Auxiliar con jurisdicción en los distritos judiciales de Viesca y San Pedro:\nI.- De los recursos de apelación contra sentencias definitivas pronunciadas por los jueces de\nPrimera Instancia, en Materia Penal;\nII.- En única instancia, de las demandas de responsabilidad civil presentadas en contra de los magistrados de los Tribunales Unitarios de Distrito y jueces, derivadas de su actuación en procesos penales;\n(REFORMADA, P.O. 5 DE DICIEMBRE DE 1997)\nIII.- De los negocios que deba conocer el Tribunal Unitario de Distrito, a petición fundada del propio\nTribunal o de oficio, cuando por sus características especiales el asunto lo amerite; y\nIV.- Fijar jurisprudencia por contradicción, reiteración o por declaración en los términos que establezca esta ley.\nV.- De los demás asuntos que le encomiende la ley.\nARTICULO 24.- La Sala Auxiliar con jurisdicción en los distritos judiciales de Viesca y San Pedro tendrá competencia en materia civil, mercantil, familiar y penal y conocerá de:\nI.- Los recursos de apelación contra sentencias definitivas pronunciadas por los Jueces de Primera\nInstancia con residencia en los distritos de su jurisdicción;\nII.- Los recursos de apelación contra resoluciones que se dicten en los asuntos a que se refiere la fracción anterior, que de ser revocadas deban tener como consecuencia que el Tribunal ad quem decida sobre el fondo del negocio;\nIII.- Las revisiones forzosas en materia familiar;\nIV.- Los procedimientos para fijar jurisprudencia por reiteración o por declaración en los términos que establezca esta ley; y\nV.- De los demás asuntos que le encomiende la ley.\nARTICULO 25.- Para el desempeño de sus funciones cada Sala tendrá los secretarios de acuerdos, de estudio y cuenta adscritos a cada uno de los magistrados, actuarios y demás servidores públicos que hayan sido designados por el Consejo de la Judicatura, en el ámbito de su competencia y de conformidad con las disposiciones en materia de carrera judicial. Lo anterior, en atención a las necesidades del servicio y a la autorización del Presupuesto de Egresos correspondiente.\n(ADICIONADO, P.O. 16 DE NOVIEMBRE DE 2001)\nCAPITULO IV BIS\nEL TRIBUNAL ELECTORAL\n(ADICIONADO, P.O. 16 DE NOVIEMBRE DE 2001)\nARTICULO 25-A. El Tribunal Electoral es un órgano especializado del Poder Judicial, dotado de autonomía, independencia y plena jurisdicción, en los términos que establece el artículo 136 de la\nEl Tribunal Electoral contará con un Secretario General de Acuerdos, Secretarios de Estudio y\nCuenta, Actuarios y demás personal que se requiera para el servicio, de acuerdo con el presupuesto de egresos correspondiente.\n(ADICIONADO, P.O. 16 DE NOVIEMBRE DE 2001)\nARTICULO 25-B. Corresponde al Pleno del Tribunal Electoral, en lo general:\nI. Conocer y resolver de los asuntos de su competencia en los términos previstos por el artículo\nII. Dictar, en la esfera de su competencia, las providencias necesarias para que la administración de la justicia electoral sea eficaz, pronta y expedita.\nIII. Calificar los impedimentos, las recusaciones y las excusas de los magistrados del Tribunal\nElectoral, en los asuntos de su respectiva competencia.\nIV. Elegir, en escrutinio secreto, al Presidente del Tribunal Electoral.\nV. Proponer al Consejo de la Judicatura la designación del personal del tribunal, en los términos de las disposiciones aplicables. estar adscritos, de entre la lista que figure en la reserva judicial de su materia.\nVI. Proponer al Consejo de la Judicatura el personal judicial que se haga acreedor a recibir estímulos y recompensas.\nVII. Conceder licencias económicas al personal de su adscripción, con goce de sueldo o sin él, de más de cinco y hasta por quince días. Toda solicitud de licencia requiere causa justificada y las de los Secretarios de Estudio y Cuenta además, autorización del magistrado al cual estén adscritos.\nVIII. Proponer al Consejo de la Judicatura, el proyecto del Reglamento Interior del Tribunal\nElectoral y demás acuerdos generales para regular su organización y funcionamiento interno.\nIX. Las demás que le confiera esta ley u otras disposiciones legales aplicables.\nARTICULO 25-C. Corresponde al Presidente del Tribunal Electoral:\nI. Representar legalmente al Tribunal Electoral ante toda clase de autoridades federales, estatales y municipales, para el cumplimiento de sus funciones, con todas las facultades, aún las que requieran cláusula especial.\nII. Distribuir por turnos, los asuntos de la competencia del Tribunal Electoral entre los magistrados que lo integran, para que los instruyan hasta ponerlos en estado de resolución con el proyecto respectivo.\nLos proveídos y acuerdos de los magistrados instructores, podrán ser reclamados ante el Pleno del\nTribunal Electoral, dentro del término de veinticuatro horas siguientes contadas a partir de que surta efectos la notificación de la resolución de que se trate, siempre que la reclamación se presente por alguna de las partes con motivo fundado. Dicha reclamación se resolverá de plano.\nIII. Presidir las sesiones, dirigir la discusión de los negocios sometidos al conocimiento del Tribunal\nElectoral, ponerlos a votación cuando declare cerrado el debate y conservar el orden durante las audiencias.\nIV. Dar a la Secretaría General de Acuerdos, los puntos que comprendan las disposiciones resolutivas votadas y aprobadas.\nV. Llevar la correspondencia del Tribunal autorizándola con su firma.\nVI. Aprobar las cuentas de los gastos de oficina, dando razón pormenorizada de ello cada mes al\nConsejo de la Judicatura del Estado.\nVII. Vigilar que los Secretarios, Actuarios y demás personal adscrito al Tribunal Electoral, cumplan con sus deberes y dar cuenta al Pleno del Tribunal Electoral de los casos de inobservancia.\nVIII. Conceder permisos económicos, con goce de sueldo o sin él, al personal del Tribunal Electoral hasta por cinco días. Los permisos a los Secretarios de Estudio y Cuenta, requerirán autorización del magistrado al cual se encuentren adscritos.\nIX. Rendir por escrito al Consejo de la Judicatura un informe mensual de las labores desarrolladas por el Tribunal Electoral;\nX. Llevar el turno de los magistrados supernumerarios del Tribunal Electoral, haciendo las numerarios, según lo acuerde el Pleno del Tribunal Electoral.\nXI. Autorizar con su firma, en unión a la del Secretario General de Acuerdos, los proveídos que emita y las actas de las sesiones del Tribunal Electoral.\nXII. Expedir los nombramientos del personal del tribunal que acuerde el Consejo de la Judicatura, de conformidad con las disposiciones establecidas en esta ley en materia de carrera judicial;\nXIII. Seleccionar y enviar mensualmente al Presidente del Tribunal Superior de Justicia, los criterios jurisprudenciales o aislados que apruebe el Tribunal Electoral, en los términos que establece esta ley, para su publicación en el Boletín de Información Judicial.\nXIV. Comunicar a las autoridades correspondientes la iniciación y conclusión del proceso electoral.\nXV. Formar parte del Consejo de la Judicatura del Estado con voz y voto, únicamente para los asuntos relacionados con el Tribunal Electoral.\nXVI. Acordar y dar a conocer al público en general por medio de los estrados del Tribunal Electoral, el nombre y domicilio de los funcionarios autorizados para recibir documentos relativos a los medios de impugnación previstos en la ley de la materia, fuera del horario ordinario del Tribunal\nElectoral.\nXVII. Las demás que le encomienden esta ley u otras disposiciones aplicables.\n(ADICIONADO, P.O. 16 DE NOVIEMBRE DE 2001)\nARTICULO 25-D. El Tribunal Electoral funcionará en Pleno conforme a las bases siguientes:\nI. De entre los tres magistrados que lo integran, elegirán por voto secreto al Presidente del Tribunal\nElectoral, que durará en el cargo tres años y podrá ser reelecto por igual término.\nII. Las sesiones en donde tenga verificativo la resolución de un asunto de su competencia, se sujetarán a las bases siguientes:\n1. Serán públicas, excepto cuando sus integrantes determinen que deban ser secretas por que estimen que se afecta la moral o el orden público.\n2. Abierta la sesión pública por el Presidente del Tribunal Electoral, el Secretario General de\nAcuerdos verificará el quórum legal.\n3. Enseguida, el magistrado ponente hará una síntesis del asunto a tratar y explicará las consideraciones que fundamentan el proyecto de resolución.\n4. A continuación, los magistrados procederán analizar y, en su caso, discutir el proyecto presentado por el magistrado ponente. En su caso, se dará lectura a determinadas constancias cuando así lo requiera alguno de los magistrados.\n5. Cuando el Presidente del Tribunal estime suficientemente discutido el proyecto, lo someterá a votación. El Secretario General de Acuerdos certificará la votación.\n6. El magistrado que disienta de la mayoría podrá formular observaciones o un voto particular, que se agregará a la resolución sí así lo solicita y lo presenta por escrito dentro de las cuarenta y ocho horas siguientes.\n7. Cuando el proyecto sea rechazado, deberá ser presentado nuevamente a más tardar dentro de las cuarenta y ocho horas siguientes, con las observaciones o modificaciones acordadas, para su nueva discusión y, en su caso, aprobación.\n8. En casos extraordinarios el Tribunal Electoral podrá diferir la resolución de un asunto listado para ser resuelto en la sesión siguiente.\n9. El Secretario General de Acuerdos levantará el acta de cada sesión que contendrá una síntesis de los asuntos aprobados.\n10. Al día siguiente de la sesión, el Secretario General de Acuerdos publicará en los estrados la lista de los asuntos resueltos.\nIII. Las sesiones ordinarias tendrán verificativo por lo menos un día hábil de cada semana, sin perjuicio de las sesiones extraordinarias que al efecto convoque el Presidente. Para la celebración de las sesiones se requerirá la presencia de los tres magistrados; en consecuencia, si algún magistrado numerario se encuentra ausente, deberá llamarse de inmediato al supernumerario que corresponda para que lo supla en la sesión.\nIV. Las resoluciones serán tomadas por unanimidad o mayoría de votos de los magistrados, quienes no podrán abstenerse de votar sino por impedimento, excusa o recusación, que previamente calificará el propio Tribunal Electoral. En este caso, el Presidente llamará al magistrado supernumerario que corresponda, para que supla la ausencia temporal del magistrado numerario de que se trate.\nCada magistrado será ponente de los asuntos que le sean turnados.\nV. Las resoluciones definitivas llevarán la firma de los magistrados presentes en la sesión y del\nSecretario General de Acuerdos del Tribunal Electoral. Los acuerdos de trámite y sustanciación llevarán sólo la firma del magistrado instructor y la del Secretario General de Acuerdos.\nVI. Los votos particulares y las observaciones por escrito deberán ser firmadas por el magistrado que los formule y, en su caso, formarán parte de la resolución que corresponda.\n(REFORMADO, P.O. 28 DE DICIEMBRE DE 2007)\nARTICULO 25-E. Las disposiciones previstas en esta ley en materia disciplinaria, responsabilidades administrativas y carrera judicial, serán aplicables al personal del Tribunal\nElectoral.\nARTICULO 25-F. (DEROGADO, P.O. 28 DE DICIEMBRE DE 2007)\n(ADICIONADO, P.O. 16 DE NOVIEMBRE DE 2001)\nARTICULO 25-G. Además de lo dispuesto en este capítulo, son aplicables al Tribunal Electoral, a sus magistrados y demás servidores públicos adscritos a él, las disposiciones que establece esta ley en todo lo que resulte conducente.\n(ADICIONADO, P.O. 1 DE SEPTIEMBRE DE 2006)\nCAPITULO IV TER\nDEL TRIBUNAL DE LO CONTENCIOSO-ADMINISTRATIVO\nARTÍCULO 25-H. El Tribunal de lo Contencioso-Administrativo es un órgano especializado del\nPara su funcionamiento, contará con una Sala Superior y con las Salas Distritales que se requieran conforme a las necesidades del servicio y al presupuesto anual de egresos respectivo.\nLa Sala Superior es el órgano supremo del Tribunal, estará integrada por tres Magistrados numerarios y tres Magistrados supernumerarios y tendrá su residencia en la capital del Estado.\nContará con un Secretario General de Acuerdos, Secretarios de Estudio y Cuenta, Actuarios y demás personal que se requiera para el servicio, de acuerdo con el presupuesto de egresos correspondiente. y estarán integradas por un Magistrado numerario, un Secretario de Acuerdos, los Secretarios de\nEstudio y Cuenta, Actuarios y personal administrativo que requieran para su funcionamiento.\nARTÍCULO 25-I. Corresponde a la Sala Superior del Tribunal de lo Contencioso-Administrativo, en lo general:\nI. Conocer y resolver las controversias que se susciten en relación con la legalidad, interpretación, cumplimiento y efectos de actos, procedimientos y resoluciones de naturaleza administrativa y fiscal, que emitan, ordenen, ejecuten o traten de ejecutar las autoridades de la Administración Pública del Estado y de los Municipios, cuya actuación afecte la esfera jurídica de los particulares, en los términos que determine la\nLey de la materia y los demás ordenamientos aplicables.\nII. Dictar, en la esfera de su competencia, las providencias necesarias para que la administración de la justicia contenciosa administrativa sea eficaz, pronta y expedita.\nIII. Elegir, en escrutinio secreto, al Presidente del Tribunal de lo ContenciosoAdministrativo, quien será también Presidente de la Sala Superior.\n(REFORMADA, P.O. 28 DE DICIEMBRE DE 2007)\nIV. Calificar los impedimentos, recusaciones y excusas de los Magistrados numerarios de la propia Sala, en los asuntos de su respectiva competencia y, en su caso, designar a los Magistrados supernumerarios que deban sustituirlos.\nV. (DEROGADA, P.O. 28 DE DICIEMBRE DE 2007)\n(REFORMADA, P.O. 28 DE DICIEMBRE DE 2007)\nVI. Proponer al Consejo de la Judicatura la designación del personal del tribunal, en los términos de las disposiciones aplicables.\nLa propuesta de los secretarios de estudio y cuenta la harán los magistrados a los que hayan de estar adscritos, de entre la lista que figure en la reserva judicial de su materia.\nVII. Proponer al Consejo de la Judicatura, por conducto de su Presidente, la adscripción de los Magistrados de las Salas Distritales.\nVIII. Resolver los conflictos de competencia que se susciten entre las Salas Distritales.\nIX. Proponer al Consejo de la Judicatura el personal judicial que se haga acreedor a recibir estímulos y recompensas.\nXI. Proponer al Consejo de la Judicatura, el proyecto del Reglamento Interior del Tribunal de lo Contencioso-Administrativo y demás acuerdos generales para regular su organización y funcionamiento interno.\nXII. Las demás que le confiera esta ley u otras disposiciones legales aplicables.\nARTÍCULO 25-J. Corresponde al Presidente del Tribunal de lo Contencioso-Administrativo: autoridades federales, estatales y municipales, para el cumplimiento de sus funciones, con todas las facultades, aún las que requieran cláusula especial.\nII. Instruir los asuntos de la competencia de la Sala Superior hasta ponerlos en estado de resolución. Citados los asuntos para sentencia, en el acuerdo respectivo, el Presidente oportuna del proyecto de resolución, en los términos que establezca la ley de la materia.\nLas providencias y acuerdos del Presidente podrán ser impugnadas ante el Pleno de la Sala Superior, mediante los recursos que establezca la ley de la materia.\nPresidir las audiencias en los asuntos de la competencia de la Sala Superior, atendiendo a las disposiciones de la ley de que se trate.\nIII. Presidir las sesiones, dirigir la discusión de los negocios sometidos al conocimiento de la Sala Superior, ponerlos a votación cuando declare cerrado el debate y conservar el orden durante las audiencias.\nIV. Dar a la Secretaría General de Acuerdos, los puntos que comprendan a las disposiciones resolutivas votadas y aprobadas.\nV. Llevar la correspondencia del Tribunal y de la Sala Superior autorizándola con su firma.\nVI. Aprobar las cuentas de los gastos de oficina, dando razón pormenorizada de ello cada mes al Consejo de la Judicatura del Estado.\nVII. Vigilar que los Secretarios, Actuarios y demás personal adscrito al Tribunal de lo\nContencioso-Administrativo, cumplan con sus deberes y dar cuenta a la Sala Superior de los casos de inobservancia.\n(REFORMADA, P.O. 28 DE DICIEMBRE DE 2007)\nVIII. Conceder permisos, con goce de sueldo o sin él, al personal de la Sala Superior hasta por quince días. Los permisos a los secretarios de estudio y cuenta, requerirán autorización del magistrado al cual se encuentren adscritos;\n(REFORMADA, P.O. 28 DE DICIEMBRE DE 2007)\nIX. Rendir por escrito al Consejo de la Judicatura un informe mensual de las labores desarrolladas por el Tribunal de lo Contencioso-Administrativo;\nX. Llevar el turno de los Magistrados supernumerarios del Tribunal de lo ContenciosoAdministrativo, haciendo las designaciones correspondientes para suplir las faltas temporales o definitivas de los Magistrados numerarios, según lo acuerde la Sala\nSuperior.\nXI. Autorizar con su firma, en unión a la del Secretario General de Acuerdos, los proveídos que emita y las actas de las sesiones de la Sala Superior.\nXII. Comunicar al Consejo de la Judicatura las vacantes de los cargos y licencias del personal del Tribunal, a efecto de que acuerde las designaciones respectivas conforme a las disposiciones de esta ley, para la expedición de los nombramientos correspondientes;\nXIII. Seleccionar y enviar mensualmente al Presidente del Tribunal Superior de Justicia, los criterios jurisprudenciales o aislados que apruebe el Tribunal de lo ContenciosoAdministrativo, en los términos que establece esta ley, para su publicación en el\nBoletín de Información Judicial.\nXIV. Formar parte del Consejo de la Judicatura del Estado con voz y voto, únicamente para los asuntos relacionados con el Tribunal de lo Contencioso-Administrativo.\nXV. Las demás que le encomienden esta ley u otras disposiciones aplicables.\nARTÍCULO 25-K. La Sala Superior del Tribunal de lo Contencioso-Administrativo funcionará conforme a las bases siguientes:\nI. De entre los tres Magistrados numerarios que lo integran, elegirán por voto secreto al\nPresidente del Tribunal de lo Contencioso-Administrativo, quien también lo será de la\nSala Superior y durará en el cargo tres años, pudiendo ser reelecto por igual período.\nII. Las sesiones en donde tenga verificativo la resolución de un asunto de su competencia, se sujetarán a las bases siguientes:\n1. Serán públicas, excepto cuando sus integrantes determinen que deban ser secretas por que estimen que se afecta la moral o el orden público.\n2. Abierta la sesión pública por el Presidente, el Secretario General de Acuerdos verificará el quórum legal.\n3. Enseguida, el Magistrado ponente hará una síntesis del asunto a tratar y explicará las consideraciones que fundamentan el proyecto de resolución.\n4. A continuación, los Magistrados procederán analizar y, en su caso, discutir el proyecto presentado por el Magistrado ponente. En su caso, se dará lectura a determinadas constancias cuando así lo requiera alguno de los Magistrados.\n5. Cuando el Presidente de la Sala Superior estime suficientemente discutido el proyecto, lo someterá a votación. El Secretario General de Acuerdos certificará la votación.\n6. El Magistrado que disienta de la mayoría podrá formular observaciones o un voto particular, que se agregará a la resolución sí así lo solicita y lo presenta por escrito dentro de las cuarenta y ocho horas siguientes.\n7. Si el proyecto del Magistrado ponente no fuere aprobado, se designará uno de los fundamentos legales que se hayan tomado en consideración en la discusión, debiendo quedar firmado el engrose dentro de los cinco días siguientes.\n8. Los asuntos se fallarán en el orden en que se enlisten. Si no pudieren ser despachados en la audiencia todos los asuntos listados los restantes, figuraran en la lista siguiente en primer término, sin perjuicio de que la Sala Superior, en su caso, acuerde que se altere el orden de la lista, que se retire algún asunto, o que se aplace la vista del mismo, cuando exista causa justificada. El aplazamiento no podrá exceder de diez días.\n9. El Secretario General de Acuerdos levantará el acta de cada sesión que contendrá una síntesis de los asuntos aprobados.\n10. Al día siguiente de la sesión, el Secretario General de Acuerdos publicará en los estrados la lista de los asuntos resueltos.\nIII. Las sesiones ordinarias tendrán verificativo por lo menos un día hábil de cada semana, sin perjuicio de las sesiones extraordinarias que al efecto convoque el\nPresidente. Para la celebración de las sesiones se requerirá la presencia de los tres\nMagistrados; en consecuencia, si algún Magistrado numerario se encuentra ausente, en la sesión.\nIV. Las resoluciones serán tomadas por unanimidad o mayoría de votos de los\nMagistrados, quienes no podrán abstenerse de votar sino por impedimento, excusa o recusación conforme a la ley de la materia, que previamente calificará la propia Sala\nSuperior. En este caso, el Presidente llamará al Magistrado supernumerario que corresponda, para que supla la ausencia temporal del Magistrado numerario de que se trate.\nCada Magistrado será ponente de los asuntos que le sean turnados.\nV. Las resoluciones definitivas llevarán la firma de los Magistrados presentes en la sesión y del Secretario General de Acuerdos de la Sala Superior. Los acuerdos de trámite y sustanciación llevarán sólo la firma del Magistrado instructor y la del Secretario\nGeneral de Acuerdos.\nVI. Los votos particulares y las observaciones por escrito deberán ser firmadas por el\nMagistrado que los formule y, en su caso, formarán parte de la resolución que corresponda.\n(REFORMADO, P.O. 28 DE DICIEMBRE DE 2007)\nARTÍCULO 25-L. El Tribunal de lo Contencioso-Administrativo podrá funcionar con las Salas\nDistritales cuya competencia determine el Consejo de la Judicatura y sean necesarias de acuerdo con los requerimientos del servicio y la disponibilidad del presupuesto de egresos correspondiente.\nEl acuerdo que determine el establecimiento de las Salas Distritales fijará su competencia territorial y deberá publicarse en el Boletín Judicial, así como en el Periódico Oficial del Gobierno del Estado.\nARTÍCULO 25-M. (DEROGADO, P.O. 28 DE DICIEMBRE DE 2007)\n(REFORMADO, P.O. 28 DE DICIEMBRE DE 2007)\nARTÍCULO 25-N. Las disposiciones previstas en esta ley en materia disciplinaria, responsabilidades administrativas y carrera judicial, serán aplicables al personal del Tribunal de lo\nContencioso-Administrativo.\nARTÍCULO 25-O. Además de lo dispuesto en este capítulo, son aplicables al Tribunal de lo\nContencioso-Administrativo, a sus Magistrados y demás servidores públicos adscritos a él, las disposiciones que establece esta ley en todo lo que resulte conducente.\nCAPÍTULO IV TER-A\nDEL TRIBUNAL DE CONCILIACIÓN Y ARBITRAJE\nARTÍCULO 25-O-1.- El Tribunal de Conciliación y Arbitraje es un órgano especializado del Poder\nJudicial, dotado de autonomía, independencia y plena jurisdicción, en los términos que establece el\nPara su funcionamiento, contará con una Sala Superior y con las Salas Especiales que se requieran conforme a las necesidades del servicio y al presupuesto anual de egresos respectivo.\nLa Sala Superior es el órgano supremo del Tribunal, estará integrada por tres magistrados numerarios y tres magistrados supernumerarios y tendrá su residencia en la capital del Estado.\nContará con un secretario general de acuerdos, los secretarios de estudio y cuenta, actuarios y demás personal que se requiera para el servicio, de acuerdo con el presupuesto de egresos correspondiente. y estarán integradas por un magistrado numerario, un secretario de acuerdo, los secretarios de estudio y cuenta, actuarios y personal administrativo que requieran para su funcionamiento.\nARTÍCULO 25-O-2.- Corresponde a la Sala Superior del Tribunal de Conciliación y Arbitraje, en lo general:\nI.- Conocer y resolver, en los términos de las leyes de la materia, los conflictos que se susciten entre:\na) El Poder Legislativo y sus trabajadores;\nb) El Poder Ejecutivo y sus trabajadores;\nc) El Poder Judicial y sus trabajadores, con excepción de los del Tribunal Superior de\nJusticia, el que conocerá de los conflictos laborales con sus trabajadores;\nd) Los Municipios y sus trabajadores;\ne) Los organismos públicos autónomos y sus trabajadores;\nf) Los trabajadores al servicio de la educación y sus sindicatos, con cualquiera de los tres\nPoderes y organismos públicos autónomos.\nII.- Dictar, en la esfera de su competencia, las providencias necesarias para que la administración de justicia sea pronta y expedita;\nIII.- Elegir, en escrutinio secreto, al presidente del Tribunal de Conciliación y Arbitraje, quien será también presidente de la Sala Superior;\nIV.- Calificar los impedimentos, recusaciones y excusas de los magistrados numerarios del Tribunal de Conciliación y Arbitraje, en los asuntos de su competencia y, en su caso, designar a los magistrados supernumerarios que deban sustituirlos;\nV.- Proponer al Consejo de la Judicatura la designación del personal del tribunal, en los términos de las disposiciones aplicables.\nLa propuesta de los secretarios de estudio y cuenta la harán los magistrados a los que hayan de estar adscritos, de entre la lista que figure en la reserva judicial de su materia.\nVI.- Proponer al Consejo de la Judicatura, por conducto de su presidente, la adscripción de los magistrados de las Salas Especiales;\nVII.- Resolver los conflictos de competencia que se susciten entre las Salas Especiales;\nVIII.- Proponer al Consejo de la Judicatura el personal judicial que se haga acreedor a recibir estímulos y recompensas;\nIX.- Proponer al Consejo de la Judicatura, el proyecto del Reglamento Interior del Tribunal de interno; y\nX.- Las demás que le confiera esta ley u otras disposiciones legales aplicables.\nARTÍCULO 25-O-3.- Corresponde al Presidente del Tribunal de Conciliación y Arbitraje: federales, estatales y municipales, para el cumplimiento de sus funciones, con todas las facultades, aún las que requieran cláusula especial;\nII.- Instruir los asuntos de la competencia de la Sala Superior hasta ponerlos en estado de resolución. Citados los asuntos para sentencia, en el acuerdo respectivo, el Presidente lo turnará al resolución, en los términos que establezca la ley de la materia.\nSuperior, mediante los recursos que establezca la ley de la materia.\nPresidir las audiencias en los asuntos de la competencia de la Sala Superior, atendiendo a las disposiciones de la ley de que se trate.\nIII.- Presidir las sesiones, dirigir la discusión de los negocios sometidos al conocimiento de la Sala\nSuperior, ponerlos a votación cuando declare cerrado el debate y conservar el orden durante las audiencias;\nIV.- Dar a la secretaría general de acuerdos, los puntos resolutivos de las resoluciones votadas y aprobadas en la sesión respectiva;\nV.- Llevar la correspondencia del Tribunal y de la Sala Superior autorizándola con su firma;\nVI.- Aprobar las cuentas de los gastos de oficina, dando razón pormenorizada de ello cada mes al\nConsejo de la Judicatura del Estado;\nVII.- Vigilar que los secretarios, actuarios y demás personal adscrito al Tribunal de Conciliación y\nArbitraje, cumplan con sus deberes y dar cuenta a la Sala Superior de los casos de inobservancia;\nVIII.- Conceder permisos, con goce de sueldo o sin él, al personal de la Sala Superior hasta por quince días. Los permisos a los secretarios de estudio y cuenta, requerirán autorización del magistrado al cual se encuentren adscritos;\nIX.- Rendir por escrito al Consejo de la Judicatura del Estado, un informe mensual de las labores desarrolladas por el Tribunal de Conciliación y Arbitraje;\nX.- Llevar el turno de los magistrados supernumerarios del Tribunal de Conciliación y Arbitraje, haciendo las designaciones correspondientes para suplir las faltas temporales o definitivas de los magistrados numerarios, según lo acuerde la Sala Superior;\nXI.- Autorizar con su firma, en unión a la del secretario general de acuerdos, los proveídos que emita y las actas de las sesiones de la Sala Superior;\nXII.- Comunicar al Consejo de la Judicatura las vacantes de los cargos y licencias de personal del\nTribunal, a efecto de que acuerde las designaciones respectivas conforme a las disposiciones de esta ley, para la expedición de los nombramientos correspondientes;\nXIII.- Seleccionar y enviar mensualmente al presidente del Tribunal Superior de Justicia, los criterios jurisprudenciales o aislados que apruebe el Tribunal de Conciliación y Arbitraje, en los términos que establece esta ley, para su publicación en el Boletín de Información Judicial;\nXIV.- Formar parte del Consejo de la Judicatura del Estado con voz y voto, únicamente para los asuntos relacionados con el Tribunal de Conciliación y Arbitraje; y\nXV.- Las demás que le encomienden esta ley u otras disposiciones aplicables.\nARTÍCULO 25-O-4.- La Sala Superior del Tribunal de Conciliación y Arbitraje funcionará conforme a las bases siguientes:\nI. De entre los tres magistrados numerarios que lo integran, elegirán por voto secreto al presidente del Tribunal de Conciliación y Arbitraje, quien también lo será de la\nSala Superior y durará en el cargo tres años, pudiendo ser reelecto por igual período;\nII. Las sesiones en donde tenga verificativo la resolución de un asunto de su competencia, se sujetarán a las bases siguientes:\n1. Serán públicas, excepto cuando sus integrantes determinen que deban ser secretas por que estimen que se afecta la moral o el orden público.\n2. Abierta la sesión pública por el presidente, el secretario general de acuerdos verificará el quórum legal.\n3. Enseguida, el magistrado ponente hará una síntesis del asunto a tratar y explicará las consideraciones que fundamentan el proyecto de resolución.\n4. A continuación, los magistrados procederán a analizar y, en su caso, a discutir el proyecto presentado por el magistrado ponente. En su caso, se dará lectura a determinadas constancias cuando así lo requiera alguno de los magistrados.\n5. Cuando el presidente de la Sala Superior estime suficientemente discutido el proyecto, lo someterá a votación. El secretario general de acuerdos certificará la votación.\n6. El magistrado que disienta de la mayoría podrá formular observaciones o un voto particular, que se agregará a la resolución sí así lo solicita y lo presenta por escrito dentro de las cuarenta y ocho horas siguientes.\n7. Si el proyecto del magistrado ponente no fuere aprobado, se designará uno de los de la mayoría para que redacte la sentencia de acuerdo con los hechos probados y los fundamentos legales que se hayan tomado en consideración en la discusión, debiendo quedar firmado el engrose dentro de los cinco días siguientes.\n8. Los asuntos se fallarán en el orden en que se enlisten. Si no pudieren ser despachados en la audiencia todos los asuntos listados, los restantes figurarán en la lista siguiente en primer término, sin perjuicio de que la Sala Superior, en su caso, acuerde que se altere el orden de la lista, que se retire algún asunto, o que se aplace la vista del mismo, cuando exista causa justificada. El aplazamiento no podrá exceder de diez días.\n9. El secretario general de acuerdos levantará el acta de cada sesión que contendrá una síntesis de los asuntos aprobados.\n10. Al día siguiente de la sesión, el secretario general de acuerdos publicará en los estrados la lista de los asuntos resueltos.\nIII. Las sesiones ordinarias tendrán verificativo por lo menos un día hábil de cada semana, sin perjuicio de las sesiones extraordinarias que, en uno y otro caso, al efecto convoque el presidente. Para la celebración de las sesiones, se requerirá la presencia de los tres magistrados; en consecuencia, si algún magistrado numerario se encuentra ausente, deberá llamarse de inmediato al supernumerario que corresponda para que lo supla en la sesión;\nIV. Las resoluciones serán tomadas por unanimidad o mayoría de votos de los magistrados, quienes no podrán abstenerse de votar sino por impedimento, excusa o recusación conforme a la ley de la materia, que previamente calificará la propia\nSala Superior. En este caso, el presidente llamará al magistrado supernumerario que corresponda, para que supla la ausencia temporal del magistrado numerario de que se trate.\nCada magistrado será ponente de los asuntos que le sean turnados;\nV. Las resoluciones definitivas llevarán la firma de los magistrados presentes en la sesión y del secretario general de acuerdos de la Sala Superior. Los acuerdos de trámite y sustanciación llevarán sólo la firma del magistrado instructor y la del secretario general de acuerdos; y\nVI. Los votos particulares y las observaciones por escrito deberán ser firmadas por el magistrado que los formule y, en su caso, formarán parte de la resolución que corresponda.\nARTÍCULO 25-O-5.- El Tribunal de Conciliación y Arbitraje podrá funcionar con las Salas\nEspeciales que considere necesarias el Consejo de la Judicatura, de acuerdo con los requerimientos del servicio y la disponibilidad del presupuesto de egresos correspondiente. El acuerdo que determine el establecimiento de las Salas Especiales fijará su competencia y deberá publicarse en el Boletín Judicial, así como en el Periódico Oficial del Gobierno del Estado.\nARTÍCULO 25-O-6.- Las disposiciones previstas en esta ley en materia disciplinaria, responsabilidades administrativas y carrera judicial, serán aplicables al personal del Tribunal de\nConciliación y Arbitraje.\nARTÍCULO 25-O-7.- Además de lo dispuesto en esta sección, son aplicables a los magistrados y demás servidores públicos adscritos al Tribunal de Conciliación y Arbitraje, las disposiciones que establece esta ley en todo lo que resulte conducente.\n(ADICIONADO, P.O. 1 DE SEPTIEMBRE DE 2006)\nCAPITULO IV QUARTER\nDEL TRIBUNAL DE APELACIÓN ESPECIALIZADO\nEN MATERIA DE ADOLESCENTES\nARTÍCULO 25-P. El Tribunal de Apelación Especializado en materia de Adolescentes es un órgano términos que establece esta ley y demás disposiciones aplicables.\nEstado. Contará con un Secretario General de Acuerdos y los Secretarios, Actuarios y demás personal necesario para el cumplimiento de sus funciones, de acuerdo con el presupuesto de egresos correspondiente.\nJudicatura del Estado, los que deberán reunir los requisitos que para ser Magistrados Unitarios de\nDistrito establece esta ley, además de contar con conocimientos en la materia penal y en la prevención y tratamiento de la conducta de los adolescentes.\nARTÍCULO 25-Q. Corresponde al Tribunal de Apelación Especializado en materia de\nAdolescentes, en lo general:\nI. Conocer y resolver de los asuntos de su competencia en los términos previstos por la\nLey de Justicia para Adolescentes del Estado y demás leyes aplicables.\nII. Dictar, en la esfera de su competencia, las providencias necesarias para que la administración de la justicia en materia de adolescentes sea eficaz, pronta y expedita.\nIII. Calificar los impedimentos, las recusaciones y las excusas de los Jueces de Primera\nInstancia en materia de Adolescentes, en los asuntos de su respectiva competencia y, en su caso, designar a los Jueces que deban sustituirlos.\nIV. De los conflictos de competencia que se susciten entre los Jueces de Primera\nInstancia en materia de Adolescentes.\nV. Resolver de manera definitiva e inatacable los recursos que se presenten en contra de las resoluciones que dicten los Jueces de Primera Instancia en materia de\nAdolescentes, en los términos que para el efecto determine la ley de la materia.\nVI. Compilar los criterios que emanen de las resoluciones que dicte en asuntos de su conocimiento. Cuando en tres resoluciones ininterrumpidas por otra en contrario se sostenga el mismo criterio constituirán jurisprudencia obligatoria para los Jueces de\nPrimera Instancia en materia de Adolescentes.\n(REFORMADA, P.O. 28 DE DICIEMBRE DE 2007)\nVII. Proponer al Consejo de la Judicatura la designación del personal del tribunal, en los términos de las disposiciones aplicables.\nLa propuesta de los secretarios de estudio y cuenta la hará el magistrado, de entre la lista que figure en la reserva judicial de su materia;\nVIII. Proponer al Consejo de la Judicatura el personal judicial que se haga acreedor a recibir estímulos y recompensas.\nIX. Conceder licencias económicas al personal de su adscripción, con goce de sueldo o sin él, de más de cinco y hasta por quince días. Toda solicitud de licencia requiere causa justificada.\nX. Proponer al Consejo de la Judicatura el proyecto del Reglamento Interior del Tribunal para regular su organización y funcionamiento interno.\nXI. Las demás que le confiera esta ley u otras disposiciones legales aplicables.\nARTÍCULO 25-R. Corresponde al Magistrado del Tribunal de Apelación Especializado en materia de Adolescentes:\nI. Representar legalmente al Tribunal ante toda clase de autoridades federales, estatales y municipales, para el cumplimiento de sus funciones, con todas las facultades, aún las que requieran cláusula especial.\nII. Instruir los asuntos de su competencia hasta ponerlos en estado de resolución.\nIII. Dar a la Secretaría General de Acuerdos, los puntos que comprendan a las resoluciones definitivas dictadas, para los efectos correspondientes.\nIV. Llevar la correspondencia del Tribunal autorizándola con su firma.\nV. Aprobar las cuentas de los gastos de oficina, dando razón pormenorizada de ello cada mes al Consejo de la Judicatura del Estado.\nVI. Vigilar que los Secretarios, Actuarios y demás personal adscrito al Tribunal, cumplan con sus deberes.\nVII. Conceder permisos económicos, con goce de sueldo o sin él, al personal del Tribunal.\nVIII. Rendir por escrito al Consejo de la Judicatura, un informe mensual de las labores desarrolladas por el Tribunal de Apelación Especializado en materia de Adolescentes;\nIX. Autorizar con su firma, en unión a la del Secretario General de Acuerdos, los proveídos que emita.\nX. Enviar mensualmente al Presidente del Tribunal Superior de Justicia, las tesis en materia de adolescentes que serán aplicables en el Estado, para su publicación en el\nBoletín de Información Judicial.\nXI. Formar parte del Consejo de la Judicatura del Estado con voz y voto, únicamente para los asuntos relacionados con el Tribunal de Apelación Especializado en materia de\nAdolescentes.\nXII. Las demás que le encomienden esta ley u otras disposiciones aplicables.\n(REFORMADO, P.O. 28 DE DICIEMBRE DE 2007)\nARTÍCULO 25-S.- Las disposiciones previstas en esta ley en materia disciplinaria, responsabilidades administrativas y carrera judicial, serán aplicables al personal del Tribunal de\nApelación Especializado en materia de Adolescentes.\nARTÍCULO 25-T. Además de lo dispuesto en este capítulo, son aplicables al Magistrado del\nTribunal de Apelación Especializado en materia de Adolescentes y demás servidores públicos adscritos a él, las disposiciones que establece esta ley en todo lo que resulte conducente.\nCAPITULO V\nDE LOS TRIBUNALES DISTRITATES\nARTICULO 26.- Los Tribunales Distritales, tendrán la jurisdicción y competencia que esta Ley les asigna, para su identificación se designarán por número ordinal y se distribuirán en el territorio del\nEstado, como sigue:\nI.- Primer Tribunal Distrital, con residencia en la Capital del Estado y con jurisdicción en los Distritos\nJudiciales de Saltillo y Parras de la Fuente;\nII.- Segundo Tribunal Distrital, con residencia en la ciudad de Torreón y con jurisdicción en los\nDistritos Judiciales de Viesca y San Pedro;\nIII.- Tercer Tribunal Distrital, con residencia en la ciudad de Monclova y con jurisdicción en los\nDistritos Judiciales de Monclova y Sabinas; y\nIV.- Cuarto Tribunal Distrital, con residencia en la ciudad de Piedras Negras y con jurisdicción en los Distritos Judiciales de Río Grande y Acuña.\nA los Tribunales Distritales, quedarán adscritos, para los asuntos de su competencia, los demás asignada.\nARTICULO 27.- Corresponde a los Tribunales Distritales, el conocimiento de los siguientes asuntos:\n(REFORMADA, P.O. 28 DE DICIEMBRE DE 2007)\nI. De los recursos de apelación y de queja en contra de autos y sentencias interlocutorias dictadas por los jueces de primera instancia y letrados, que estén adscritos a su circunscripción territorial, en asuntos civiles, mercantiles, familiares y penales; así como del recurso de apelación extraordinaria en todos los casos previstos por la ley;\n(REFORMADA, P.O. 16 DE NOVIEMBRE DE 2001)\nII. De los recursos de apelación contra sentencias definitivas dictadas por los jueces letrados en materia civil de su circunscripción territorial, así como de las dictadas por los Jueces de Primera\nInstancia en la misma materia cuando la cuantía del negocio no exceda de 500 veces el salario mínimo general vigente en el lugar del juicio al momento de la presentación de la demanda en el principal;\n(REFORMADA, P.O. 28 DE DICIEMBRE DE 2007)\nIII. De los recursos de apelación contra sentencias definitivas dictadas por los jueces mercantiles o mixtos de primera instancia, en aquellos negocios cuya cuantía sea mayor de 182 y hasta de 500 veces el salario mínimo general vigente en el lugar del juicio a la fecha de la presentación de la demanda en el principal;\n(REFORMADA, P.O. 16 DE NOVIEMBRE DE 2001)\nIV. Del recurso de apelación interpuesto ante los juzgados letrados en materia penal, en aquellos casos en que sea procedente.\n(REFORMADA, P.O. 16 DE NOVIEMBRE DE 2001)\nV. De los impedimentos, excusas y recusaciones de los Jueces de Primera Instancia y Jueces\nLetrados de su adscripción;\n(REFORMADA, P.O. 16 DE NOVIEMBRE DE 2001)\nVI. De los conflictos de competencia que se susciten entre los diversos órganos judiciales de su adscripción;\nVII. De la resolución de las denuncias, quejas y acusaciones por faltas administrativas que se presenten en contra del personal del Tribunal Unitario;\nVIII. De la compilación de los criterios que emanen de las resoluciones que dicten en asuntos de su conocimiento. Cuando en tres resoluciones ininterrumpidas sostengan el mismo criterio, deberán enviar la tesis a la Sala que corresponda para que ésta fije la jurisprudencia por declaración, que confirmará o modificará el criterio; y\nIX. De los demás asuntos que le señalen esta ley y demás disposiciones legales.\nARTICULO 28.- Al Magistrado Titular del Tribunal Unitario corresponde:\nI.- Nombrar y remover al personal del Tribunal, en los términos que señale la ley;\nII.- Proponer, como corresponda, al personal judicial que se haga acreedor a recibir estímulos y recompensas;\nIII.- Rendir al Tribunal Pleno, informe mensual de las labores desarrolladas;\nIV.- Conceder licencias económicas por causa justificada, con goce de sueldo o sin él, hasta por quince días al personal que dependa del Tribunal;\nV.- Vigilar el debido desempeño de las labores del personal, tomando las medidas convenientes para la prestación eficaz del servicio de administración de justicia; y\nVI.- Las demás que le confiera la Ley y el Pleno del Tribunal.\n(FE DE ERRATAS, P.O. 5, MARTES 15 DE ENERO DE 1991)\nARTICULO 29.- Cada Tribunal Unitario de Distrito tendrá, además del magistrado titular, los secretarios de acuerdos, de estudio y cuenta, actuarios y demás personal que requieran las necesidades del servicio y autorice el Presupuesto de Egresos.\nCAPITULO VI\n(REFORMADA SU DENOMINACIÓN, P.O. 28 DE DICIEMBRE DE 2007)\nDE LOS JUZGADOS DE PRIMERA INSTANCIA\n(REFORMADO PRIMER PÁRRAFO, P.O. 28 DE DICIEMBRE DE 2007)\nARTICULO 30.- En los distritos judiciales del Estado habrán los Juzgados de Primera Instancia en\nMateria Civil, Mercantil, Familiar, Penal y Mixtos que autorice el Pleno del Tribunal Superior de\nJusticia, atendiendo a las necesidades del servicio y a la disponibilidad presupuestal.\nLos Juzgados tendrán la residencia y jurisdicción territorial que acuerde el propio Pleno del\nTribunal.\n(REFORMADO PRIMER PÁRRAFO, P.O. 28 DE DICIEMBRE DE 2007)\nARTICULO 31.- Cuando funcionen en un mismo lugar varios Juzgados de Primera Instancia en\nMateria Civil, Mercantil o de lo Familiar, el Pleno del Tribunal Superior de Justicia acordará el sistema de recepción, turnos y distribución de demandas entre los mismos.\nTratándose de Juzgados Penales, éstos conocerán por riguroso turno semanal.\nARTICULO 32.- En los Juzgados de Primera Instancia, habrá un juez que será el titular del órgano, el número de secretarios, actuarios y empleados que requieran, conforme a las necesidades del servicio y que autorice el Presupuesto de Egresos.\nARTICULO 33.- Los Jueces de Primera Instancia en Materia Civil, conocerán:\nI. De los asuntos civiles, a excepción de los que correspondan al conocimiento de un Juez Letrado en los términos de esta ley, y aquellos en que se controviertan cuestiones relacionadas con el patrimonio de familia, en los cuales la competencia corresponde a los Jueces de lo Familiar;\nII.- De los juicios hereditarios y de sus conexidades, así como de las acciones de petición de herencia;\nIII.- De los negocios de jurisdicción voluntaria cuyo conocimiento no corresponda específicamente a los jueces de lo Familiar;\nIV.- De las diligencias preliminares de consignación en asuntos de carácter civil;\nV.- De las diligencias de exhortos, rogatorias, suplicatorias, requisitorias y despachos, relacionados con asuntos civiles;\nVI.- De los asuntos en materia familiar y mercantil, cuando en el lugar de su residencia no hayan juzgados de esas materias;\n(REFORMADA, P.O. 28 DE DICIEMBRE DE 2007)\nVII.- De los negocios de la competencia de los jueces de Primera Instancia en materia penal o mercantil, según el caso, en los supuestos de impedimento, recusación o excusa de éste; y\nVIII.- De los demás asuntos que le encomienden las Leyes.\n(ADICIONADO, P.O. 28 DE DICIEMBRE DE 2007)\nARTÍCULO 33 BIS.- Los Jueces de Primera Instancia en Materia Mercantil conocerán:\nI.- De las controversias que se susciten sobre el cumplimiento y aplicación de las leyes en materia mercantil, a excepción de los que correspondan al conocimiento de un Juez Letrado en los términos de esta ley;\nII.- De las diligencias preliminares de consignación en asuntos de carácter mercantil en jurisdicción concurrente;\nIII.- De las diligencias de exhortos, rogatorias, suplicatorias, requisitorias y despachos relacionados con asuntos mercantiles en jurisdicción concurrente;\nIV.- De los asuntos en materia civil, cuando en el lugar de su residencia no exista juzgado de esa materia;\nV.- De los negocios de la competencia de los jueces de Primera Instancia en los casos de impedimento, recusación o excusa de éste, conforme al artículo 127 de esta ley; y\nVI.- De los demás asuntos que le encomienden las leyes.\n(REFORMADO PRIMER PARRAFO, P.O. 5 DE DICIEMBRE DE 1997)\nARTICULO 34.- Los Jueces de Primera Instancia en Materia Penal conocerán:\nI.- Los jueces de primera instancia en materia penal o de primera instancia mixtos, conocerán de delitos cuya pena máxima de prisión sea superior a seis años; y de los que esa pena sea menor pero el delito sea grave.\nCuando se trate de delitos conexos que por su gravedad diversa, sean competentes jueces locales letrados y de primera instancia, estos últimos conocerán preferentemente de todos los delitos. Sin perjuicio de considerar válido, en su caso, todo lo que conocieren los locales letrados.\nII.- De los asuntos de lo familiar por incompetencia subjetiva del juez de esa materia, los jueces penales solamente conocerán si también el juez civil del mismo lugar está impedido;\nIII.- De la diligenciación de exhortos, requisitorias, rogatorias, suplicatorias y despachos, relacionadas con asuntos penales; y\nIV.- De los demás asuntos que les competan de acuerdo con las leyes.\nARTICULO 35.- Los Jueces de Primera Instancia en Materia Familiar conocerán:\nI.- De los procedimientos contenciosos relativos al matrimonio, a la ilicitud o nulidad del mismo y al divorcio, incluyendo los que se refieren al régimen de bienes en el matrimonio; de los que tengan por objeto modificaciones o rectificaciones en las actas del Registro Civil; de los que afecten el tengan por objeto cuestiones relativas a la patria potestad, estado de interdicción y tutela y las cuestiones de ausencia y de presunción de muerte; de los que se refieran a cualquier cuestión relacionada con el patrimonio de familia como su constitución, disminución, extinción o afectación en cualquier forma;\nII.- De los negocios de jurisdicción voluntaria relacionados con el Derecho Familiar;\nIII.- De los asuntos concernientes a otras acciones relativas al estado civil, a la capacidad de las personas y a las derivadas del parentesco;\nIV.- De las diligencias de consignación en todo lo relativo al derecho familiar;\nV.- De la diligenciación de los exhortos, requisitorias y despachos, relacionados con el derecho familiar; y\n(FE DE ERRATAS, P.O. 5, MARTES 15 DE ENERO DE 1991)\nVI.- De las cuestiones que afecten en sus derechos de personas a los menores e incapacitados y, en general, de todas las cuestiones familiares que reclamen la intervención judicial.\n(REFORMADO, P.O. 28 DE DICIEMBRE DE 2007)\nARTICULO 36.- Los Jueces Mixtos de Primera Instancia conocerán de las causas civiles, mercantiles, penales y de lo familiar, con las facultades y atribuciones que establecen los artículos\n33, 33 BIS, 34 y 35 de esta Ley.\n(REFORMADO, P.O. 1 DE SEPTIEMBRE DE 2006)\nARTÍCULO 37. Los Jueces de Primera Instancia en materia de Adolescentes conocerán:\nI. De las conductas tipificadas como delitos por las leyes penales que se atribuya a personas mayores de doce y menores de dieciocho años de edad, conforme a la ley que regule la materia de justicia para adolescentes.\nII. De los demás asuntos que le competan de acuerdo con las leyes.\nCada Juzgado de Primera Instancia en materia de Adolescentes, contará con un Juez\nSupernumerario designado por el Consejo de la Judicatura, que conocerá de los asuntos de esta para Adolescentes del Estado de Coahuila; además de los casos de excusas y recusaciones de los jueces de la materia una vez calificadas por la autoridad competente.\nARTÍCULO 38. Son facultades y obligaciones de los Jueces de Primera Instancia, en la esfera de su competencia:\nI. Practicar visitas a los Centros de Readaptación Social y de Internación, cuando menos cada mes, para los efectos de la parte final del artículo 19 de la Constitución General de la República e informar a los procesados sobre el estado de su causa;\nII. Remitir cada mes al Tribunal Superior de Justicia, por conducto de la Dirección de\nInformática, una relación de los procesos señalando su número, el nombre de las personas contra quienes se instruye, el, delito o la conducta tipificada como tal, así como el estado que guarden.\nLos Jueces de Primera Instancia deberán rendir al Consejo de la Judicatura, un informe estadístico mensual de asuntos iniciados, en trámite y concluidos, en los primeros cinco días de cada mes, uno anual en la fecha que les señale el Consejo, y los demás que le sean solicitados;\nIII. Practicar las diligencias que el Pleno o las Salas del Tribunal, los Tribunales Unitarios, el Tribunal de Apelación Especializado en materia de Adolescentes o los Jueces del\nEstado, les soliciten en auxilio judicial, así como las que con el mismo carácter les sean solicitadas por los Tribunales de la Federación y de otras entidades de la\nRepública;\nIV. Administrar los recursos económicos que se asignen para el funcionamiento del juzgado, conforme a los lineamientos que acuerde el Consejo de la Judicatura;\nV. Supervisar y, en su caso, adoptar las medidas administrativas conducentes a fin de que los servidores públicos adscritos al juzgado a su cargo, cumplan con sus facultades y obligaciones;\nVI. Ejercer en términos de Ley, la jurisdicción disciplinaria que le corresponde respecto de su personal;\nVII. Compilar sus criterios que emanen de las resoluciones que dicten en asuntos de su conocimiento; y\nVIII. Las demás que les confieran las leyes.\nARTICULO 39.- En los Juzgados de Primera Instancia habrá los secretarios de estudio y cuenta que las necesidades del servicio requieran y autorice el Presupuesto de Egresos.\n(REFORMADA SU DENOMINACION, P.O. 16 DE NOVIEMBRE DE 2001)\nCAPITULO VII\nLOS JUECES LETRADOS CIVILES, PENALES Y MIXTOS\n(REFORMADO, P.O. 16 DE NOVIEMBRE DE 2001)\nARTICULO 40.- Existirán, en los distritos en que determine el Consejo de la Judicatura, el número disposición presupuestal.\nARTICULO 41.- Cuando en un mismo lugar se establezcan dos o más Juzgados Letrados con igual competencia, o Juzgados de Primera Instancia Civiles, Mercantiles, Penales o Mixtos, para la asignación de los asuntos que habrán de conocer, el Consejo de la Judicatura determinará el sistema de recepción y distribución de éstos, el que se publicará en el Periódico Oficial del\nARTICULO 42.- Los Juzgados Letrados estarán a cargo de un juez designado por el Consejo de la Judicatura y contarán con el número de secretarios, actuarios y empleados que se requieran, ARTICULO 43.- Los Jueces Letrados en Materia Civil conocerán de los juicios civiles y mercantiles, cuya cuantía no exceda de 182 días de salario mínimo general, vigente en el lugar de residencia del juzgado al momento de la presentación de la demanda.\nARTICULO 44.- Los Jueces Letrados en Materia Penal o Mixtos, serán competentes para conocer de delitos que sin incluir atenuante, su pena máxima de prisión sea hasta seis años; siempre y cuando no sean graves.\n(REFORMADO, P.O. 16 DE NOVIEMBRE DE 2001)\nARTICULO 45.- Los Jueces Letrados Mixtos conocerán de los asuntos a que se refieren los artículos 43 y 44 de esta ley.\n(REFORMADO, P.O. 1 DE SEPTIEMBRE DE 2006)\nARTÍCULO 46.- Son facultades y obligaciones de los Jueces Letrados, en la esfera de su competencia, las establecidas en el artículo 38 fracciones III, V, VI, VII y VIII de esta ley.\n(DEROGADO, P.O. 20 DE MARZO DE 2001)\nCAPITULO VIII\nDE LOS JUECES DE CONCILIACION\nARTICULO 47.- (DEROGADO, P.O. 20 DE MARZO DE 2001)\nARTICULO 48.- (DEROGADO, P.O. 20 DE MARZO DE 2001)\nCAPITULO IX\nDE LOS SECRETARIOS, OFICIAL MAYOR, ACTUARIOS Y DEMAS EMPLEADOS DE LA\nADMINISTRACIÓN DE JUSTICIA\nARTICULO 49.- Los Secretarios de Acuerdos y los actuarios, tendrán fe pública en todo lo relativo al ejercicio de su cargo. Igual fe tendrán los demás empleados de la administración de justicia que en cada caso autorice la Ley, el Tribunal Superior de Justicia, Sala, Tribunal Unitario o Juez de\nPrimera Instancia, para desempeñar funciones secretariales.\nARTICULO 50.- Son obligaciones de los Secretarios de Acuerdos:\nI.- Recibir los escritos que se les presenten, anotando al calce: la razón del día y hora de presentación del documento y el nombre de la persona que la haga; el número de fojas que contengan y documentos que se acompañen. Asimismo, deben asentar razón idéntica en la copia, cuando se exija, con la firma de quien recibe el escrito y el sello de la oficina, para que dicha copia quede en poder del interesado para su resguardo;\nII.- Dar cuenta diariamente al Superior de quien dependan, bajo su más estricta responsabilidad y dentro de las veinticuatro horas siguientes a la de su presentación, con los escritos, oficios, promociones y demás documentos que se reciban;\nIII.- Autorizar los despachos, exhortos, requisitorias, actas, diligencias, autos y toda clase de resoluciones que se expidan, asienten, practiquen o dicten por el Tribunal Superior, Sala, Tribunal\nUnitario o juez correspondiente;\nIV.- Hacer constar en los expedientes, el día en que comienzan a correr los términos y aquél en que deben concluir; cuidando que los procedimientos se desarrollen en los términos y plazos que establece la Ley;\nV.- Asistir a las diligencias de prueba que se reciban en el Pleno del Tribunal, la Sala, el Tribunal\nUnitario o el Juez, en su caso;\nVI.- Expedir y autorizar las copias que la ley determine o que deban darse a las partes por decreto judicial;\nVII.- Cuidar de que los expedientes sean debidamente foliados al agregarse cada una de las hojas, sellando por sí mismo las actuaciones, oficios y demás documentos que lo requieran, estampando su rúbrica en el centro del escrito;\nVIII.- Guardar en el secreto de la oficina, bajo su responsabilidad, los valores, escritos y documentos, cuando así lo disponga la ley;\nIX.- Levantar inventario y conservar en su poder los expedientes en trámite, mientras no se remitan al Archivo Judicial o al Superior, en su caso, debiendo entregarlos con las formalidades legales, cuando haya lugar a la remisión;\nX.- Proporcionar a los interesados los expedientes en que fueren partes y que soliciten para informarse del estado de los mismos, o para cualquier otro efecto legal, siempre que sea en su presencia y sin extraer las actuaciones de la oficina;\n(REFORMADA, P.O. 16 DE NOVIEMBRE DE 2001)\nXI. Notificar personalmente a las partes en los juicios o asuntos en trámite, con arreglo al artículo\n202 del Código Procesal Civil.\nXII.- Evacuar las audiencias y practicar las diligencias que se les encomienden;\nXIII.- Remitir los expedientes al Archivo Judicial, a la Superioridad o al substituto legal, previa anotación en el libro de control;\nXIV.- Ordenar y vigilar que se despachen sin demora los asuntos y correspondencia del Tribunal\nSuperior, de la Sala, Tribunal Unitario de Distrito o Juzgado, según corresponda;\nXV.- Tener a su cargo, bajo su responsabilidad, los libros pertenecientes a la oficina, designando, entre los servidores subalternos, al que deba llevarlos;\nXVI.- Conservar en su poder el sello de la oficina;\nXVIII.- Ejercer la supervisión y control sobre todos los servidores de su dependencia y proponer, en su caso, la imposición de medidas disciplinarias contra quienes no cumplan con su función; y\nXIX.- Las demás funciones que la ley les encomiende.\nARTICULO 51.- Los Secretarios de estudio y cuenta, proyectarán, bajo la más absoluta reserva, las resoluciones que les encomienden el magistrado o el juez, al cual se encuentren adscritos, previo estudio que hagan del asunto. Para tal efecto, el magistrado o el juez, instruirán al secretario sobre los motivo de hecho y de derecho que deban fundar el proyecto de resolución. mexicano, en pleno ejercicio de sus derechos civiles y políticos, y tener licenciatura en derecho o licenciatura en el área de administración.\nEl Oficial Mayor tendrá las atribuciones siguientes:\nI.- Llevar el registro de abogados en ejercicio y la hoja de servicio de magistrados, jueces y demás servidores públicos, así como de los auxiliares de la administración de justicia;\nII.- Elaborar los sistemas de organización y métodos de trabajo de las dependencias judiciales y sugerir los cambios que juzgue pertinentes;\nIII.- Ponderar los requerimientos de la administración de justicia y las necesidades existentes, acordando lo conducente con el Presidente del Tribunal;\nIV.- Preparar anualmente el anteproyecto de Presupuesto de Egresos del Poder Judicial y ejercerlo conforme a las políticas generales que señale el Presidente del Tribunal;\n(FE DE ERRATAS, P.O. 5, MARTES 15 DE ENERO DE 1991)\nV.- Manejar y la administración de la Revista de información judicial;\nVI.- Llevar el control de la información estadística de todas las dependencias del Poder Judicial; y\n(FE DE ERRATAS, P.O. 5, MARTES 15 DE ENERO DE 1991)\nVII.- Atender los demás asuntos que le correspondan, en los términos de la Ley o aquellos cuya atención le encomiende el Pleno o el Presidente del Tribunal Superior.\nARTICULO 53.- Los actuarios tendrán las obligaciones siguientes:\nI.- Recibir de los secretarios de acuerdos los expedientes de notificación personal, o de diligencias que deban efectuarse fuera de la oficina, firmando los conocimientos respectivos;\nII.- Hacer la notificación personal y practicar las diligencias decretadas, dentro de las horas hábiles del día, levantando el acta correspondiente en el lugar en que se efectúen y devolviendo el expediente al Secretario, previas las anotaciones correspondientes en el libro respectivo; y\nIII.- Las demás que la ley o sus superiores les encomienden.\nARTICULO 54.- Los demás servidores públicos de las dependencias judiciales, desempeñarán las labores que la Ley o sus superiores les encomienden.\nARTICULO 55.- El Pleno del Tribunal Superior de Justicia determinará los requisitos que deban satisfacer los pasantes que cumplan con su servicio social, adscritos a las diversas dependencias inherentes al puesto de su asignación.\nTITULO CUARTO\nCAPITULO I\nDEL CONSEJO DE LA JUDICATURA como funciones la administración, vigilancia y disciplina de los órganos jurisdiccionales en los términos de esta ley. La administración de las dependencias del Pleno, la Presidencia y las Salas, estará a cargo del Presidente del Tribunal Superior de Justicia.\nEl Consejo de la Judicatura estará integrado por seis Consejeros, uno de los cuales será el\nPresidente del Tribunal Superior de Justicia del Estado, quien lo presidirá con voz y voto de calidad; uno designado por el Ejecutivo del Estado; uno designado por el Congreso del Estado; un\nMagistrado del Tribunal Superior de Justicia, un Magistrado de Tribunal Distrital y un Juez de\nPrimera Instancia, que serán seleccionados en cada periodo entre los de mayor antigüedad en el ejercicio de los respectivos cargos, en la última sesión que se celebre con los consejeros que concluyan en sus funciones. El Presidente del Tribunal Electoral, el Presidente del Tribunal de lo\nContencioso-Administrativo, el Presidente del Tribunal de Conciliación y Arbitraje y el Magistrado del Tribunal de Apelación Especializado en materia de Adolescentes únicamente formarán parte del Consejo, cuando se traten asuntos relativos al Tribunal que presiden.\nLos consejeros deberán reunir los requisitos exigidos para ser magistrado y, salvo el Presidente, durarán tres años en su cargo. Por cada uno de los consejeros, habrá un suplente.\nLas ausencias temporales del Presidente, serán suplidas por el Consejero Magistrado del Tribunal\nSuperior.\nLos consejeros ejercerán su función con independencia e imparcialidad y durante su encargo, sólo podrán ser removidos en los términos del Título Séptimo de la Constitución.\n(REFORMADO, P.O. 28 DE DICIEMBRE DE 2007)\nEl Consejo funcionará en Pleno o en comisiones. El Pleno resolverá sobre la designación, adscripción, ratificación de adscripción y remoción de Magistrados de los Tribunales Distritales y los jueces, así como de los demás asuntos que la ley determine y estará facultado para expedir los reglamentos y acuerdos generales con el fin de regular el adecuado funcionamiento del Poder\nJudicial, de conformidad con lo que establezca la ley. Las comisiones tendrán la duración, objeto y funciones que acuerde el Pleno.\nLas decisiones del Consejo se tomarán por mayoría de votos y serán definitivas e inatacables.\n(ADICIONADO, P.O. 16 DE NOVIEMBRE DE 2001)\nARTICULO 56 BIS. El Comité Consultivo del Consejo de la Judicatura será un órgano honorífico, excepción del Tribunal Superior de Justicia.\nEste Comité Consultivo funcionará conforme a las bases siguientes:\nI. Se integrará por cinco abogados de reconocido prestigio en el Estado, designados por el Pleno del Consejo. Durarán en su encargo tres años y podrán ser reelectos por igual término.\nII. Los colegios, barras y asociaciones de abogados con registro en el Tribunal Superior de Justicia, Consultivo.\nIII. El Comité Consultivo se reunirá con los consejeros y magistrados del Tribunal que para tales efectos el Presidente del Tribunal y del Consejo comisione, por lo menos dos veces al año.\nIV. El Consejo de la Judicatura podrá crear comisiones interinstitucionales y ciudadanas en el\nComité Consultivo, para emitir su opinión sobre los asuntos que acuerde el Pleno del Tribunal o del\nV. Su funcionamiento interno se regirá por los reglamentos o acuerdos generales que para tal efecto expida el Consejo de la Judicatura.\nARTICULO 57.- Son atribuciones del Consejo de la Judicatura las siguientes:\nI. Nombrar y remover en los términos que señale la ley a los Magistrados del Tribunal de Apelación\nEspecializado en materia de Adolescentes, a los Magistrados Distritales, a los Jueces de Primera\nInstancia, Jueces Letrados y demás personal del Poder Judicial que no dependa del Pleno y de la\nPresidencia del Tribunal Superior de Justicia;\n(REFORMADA, P.O. 28 DE DICIEMBRE DE 2007)\nII. Crear, a propuesta de su Presidente, según lo exijan las necesidades del servicio y lo permita el presupuesto de egresos, órganos jurisdiccionales auxiliares, cuyos titulares esté facultado a nombrar según la fracción anterior;\n(REFORMADA, P.O. 28 DE DICIEMBRE DE 2007)\nIII. A propuesta de su Presidente, señalar o cambiar la adscripción de los titulares y demás servidores públicos de los órganos jurisdiccionales, variar la materia y circunscripción territorial de éstos y cambiar el lugar de su residencia; así como establecer los criterios generales que sean necesarios para la adecuada distribución de los asuntos en los lugares donde existan varios\nJuzgados de Primera Instancia o Juzgados Letrados;\n(REFORMADA, P.O. 16 DE NOVIEMBRE DE 2001)\nIV. Discutir, aprobar y/o modificar, según proceda, el proyecto del Presupuesto de Egresos que proponga el Presidente del Tribunal Superior de Justicia y del Consejo de la Judicatura, con excepción del que corresponde al Tribunal Superior de Justicia y sus Salas.\n(REFORMADO, P.O. 28 DE DICIEMBRE DE 2007)\nEn todo caso el proyecto de presupuesto de egresos, deberá contener las partidas suficientes para el funcionamiento del Tribunal Electoral, del Tribunal de lo Contencioso-Administrativo, del Tribunal de Conciliación y Arbitraje y del Tribunal de Apelación Especializado en materia de Adolescentes como órganos jurisdiccionales especializados;\n(REFORMADA, P.O. 28 DE DICIEMBRE DE 2007)\nV.- Ordenar, por conducto del Presidente del Consejo, que la Visitaduría Judicial realice las auditorias especiales, o las visitas de inspección ordinarias o extraordinarias al Tribunal Electoral, al Tribunal de lo Contencioso-Administrativo, al Tribunal de Conciliación y Arbitraje, al Tribunal de\nApelación Especializado en materia de Adolescentes, a los Tribunales Distritales, a los Juzgados justicia. En aquellos casos que a juicio del Presidente del Consejo sean urgentes, éste podrá ordenar las visitas extraordinarias que estime necesarias, por medio de la Visitaduría, debiendo informar de ello al Consejo de la Judicatura en la sesión más próxima. En el caso de los Juzgados\nJueces de Primera Instancia.\nVI.- Conferir a los magistrados supernumerarios, cuando no estén en funciones, las comisiones y representaciones que juzgue pertinentes, en beneficio de la administración de justicia, con excepción de aquellas que sean competencia del Pleno del Tribunal Superior de Justicia;\nVII.- Fijar los emolumentos que deban percibir los magistrados supernumerarios, cuando conozcan de uno o varios asuntos determinados, excepto cuando las funciones se les asignen por el Pleno del Tribunal Superior de Justicia, en la esfera de su competencia. de la administración de justicia, con excepción del Pleno del Tribunal;\nIX.- Fijar los criterios generales de evaluación mensual de juicios iniciados, en trámite y concluidos previa ponderación de las evaluaciones respectivas, tomar las providencias que estimen necesarias, con excepción del Pleno del Tribunal;\n(REFORMADA, P.O. 16 DE NOVIEMBRE DE 2001)\nX. Instrumentar y vigilar la Carrera Judicial en los términos que dispone esta ley.\n(REFORMADA, P.O. 28 DE DICIEMBRE DE 2007)\nXI. Expedir su reglamento interior, los reglamentos y acuerdos generales que sean necesarios para regular el funcionamiento del Poder Judicial y de sus órganos, así como el reglamento relativo al haber por retiro en caso de conclusión del período constitucional de magistrados del Poder Judicial;\n(REFORMADA, P.O. 16 DE NOVIEMBRE DE 2001)\nXII. Nombrar y remover al director del Instituto de Especialización Judicial y supervisar el funcionamiento de dicho Instituto.\n(ADICIONADA, P.O. 16 DE NOVIEMBRE DE 2001)\nXIII. Designar a los abogados que integren el Comité Consultivo del Consejo.\n(ADICIONADA, P.O. 16 DE NOVIEMBRE DE 2001)\nXIV. Integrar Comisiones dentro del Consejo y señalarles su duración, objeto y funciones.\n(ADICIONADA, P.O. 16 DE NOVIEMBRE DE 2001)\nXV. Las demás que le asigne esta ley y demás disposiciones aplicables.\nEl Consejo de Judicatura sesionará cuando menos una vez al mes, y cuando se convoque por su\nPresidente o por más de tres de sus miembros.\nPara que haya quórum legal en sus sesiones, se requerirá la asistencia de su Presidente y de la mayoría de sus integrantes. A falta del primero, el quórum legal será de las dos terceras partes de sus integrantes. Sus acuerdos se tomarán por mayoría de los votos de los presentes. Cuando haya empate, tendrá calidad el sentido en que haya votado el Presidente.\nEl Consejo de la Judicatura, por conducto del Presidente del Tribunal Superior de Justicia, podrá solicitar el auxilio de los Magistrados del Tribunal Superior de Justicia, de los Magistrados de los\nTribunales Unitarios de Distrito y de los jueces, cualquiera que sea su denominación, para el mejor cumplimiento de sus funciones.\nEl Consejo de la Judicatura contará con un Secretario de Acuerdo y Trámite, con los Secretarios de\nEstudio y Cuenta y demás personal que sea necesario y autorice el presupuesto. Los secretarios\nTrámite, y de Estudio y Cuenta, respectivamente, quienes tendrán el escalafón que corresponde a los Secretarios de Acuerdo y Trámite, y de Estudio y Cuenta de las Salas.\nARTÍCULO 58. Cuando deban designarse Magistrados del Tribunal Superior de Justicia, del\nTribunal Electoral, del Tribunal de lo Contencioso-Administrativo y del Tribunal de Conciliación y\nArbitraje el Consejo propondrá al Gobernador del Estado, las respectivas listas de candidatos, en\nPara la formulación de las listas a que se refiere el párrafo anterior, el Consejo de la Judicatura cuidará que los propuestos satisfagan los requisitos correspondientes, prefiriendo en todo caso a la administración de justicia o que lo merezcan por su honorabilidad y competencia, ampliamente acreditada en el ejercicio de la profesión de abogado.\nARTICULO 60.- El Consejo de la Judicatura vigilará el estricto cumplimiento de las garantías constitucionales de la jurisdicción comprendidas en el ámbito de aplicación de esta Ley. En consecuencia, podrá solicitar ante la autoridad competente el cumplimiento estricto de las bases que regulan la carrera judicial; denunciar ante la propia autoridad todo acto arbitrario que afecte la permanencia de su cargo a cualquier miembro del Poder Judicial que en su concepto mantenga las cualidades o atributos que dieron lugar a su nombramiento y solicitar el ejercicio de la jurisdicción disciplinaria por la conducta de aquellos que así lo ameriten.\nCAPITULO II\nDE LA CARRERA JUDICIAL\nARTICULO 61.- La carrera judicial importa la determinación del sistema de ingreso en la judicatura y la forma como se obtiene el ascenso dentro de ella.\nARTICULO 62.- Las condiciones para el ingreso, formación, permanencia, ascenso y retiro del personal de servicio de la administración de justicia se sujetará a las bases siguientes:\n(REFORMADA, P.O. 16 DE NOVIEMBRE DE 2001)\nI. El Consejo de la Judicatura vigilará e implementará los sistemas de selección, ingreso, formación, ascenso y retiro del servicio de la judicatura.\n(REFORMADA, P.O. 28 DE DICIEMBRE DE 2007)\nII. El Consejo de la Judicatura, por conducto de la Oficialía Mayor, formará un cuerpo de aspirantes que se integrará con los abogados que deseen ingresar a la carrera judicial y que reúnan los requisitos para ocupar los cargos de entrada en las especializaciones civil, mercantil, familiar y penal, conforme a la reglamentación que se expida para las admisiones.\n(REFORMADA, P.O. 28 DE DICIEMBRE DE 2007)\nIII. El ingreso a la carrera judicial presupone la aprobación del examen de méritos, consistente en la evaluación de conocimientos, así como de los indicadores de capacidad profesional, aptitud y actitud para el cargo, conducta profesional, fama pública y antecedentes laborales; los que serán evaluados por el Consejo de la Judicatura, mediante los mecanismos que se estimen pertinentes.\nIV. La carrera judicial se inicia en el puesto de Actuario de Juzgado Letrado y termina en el de\nMagistrado de Tribunal Unitario.\nV. Los ascensos del escalafón sólo podrán hacerse con la voluntad del interesado, quien no podrá ser suspendido o cesado, salvo por falta o delito y en la forma y términos que dispone esta Ley.\nVI. El Consejo de la Judicatura será la única autoridad facultada para formalizar el examen de méritos y acordar nombramientos y ascensos en los términos que establece esta ley.\nVII. Todos los Magistrados de los Tribunales Distritales, el Magistrado del Tribunal de Apelación\nEspecializado en materia de Adolescentes; los Jueces, los Secretarios y Actuarios serán numerados en los escalafones correspondientes a sus especialidades, civil, mercantil, familiar, penal y de adolescentes.\nVIII. Cada especialidad del escalafón se dividirá en categorías ascendentes tomando como base las cantidades percibidas por concepto de sueldo y la categoría de la función.\n(REFORMADA, P.O. 28 DE DICIEMBRE DE 2007)\nIX. Los factores de ascenso para la carrera judicial serán: los antecedentes profesionales, la antigüedad en el servicio judicial, la diligencia en el despacho de los asuntos, los datos de la hoja de servicios y el resultado del examen de méritos.\n(REFORMADA, P.O. 16 DE NOVIEMBRE DE 2001)\nX. No podrán ascender a ningún puesto superior, los que carezcan de algún requisito legal.\n(REFORMADA, P.O. 16 DE NOVIEMBRE DE 2001)\nXI. Las promociones escalafonarias serán públicas, para que soliciten su ascenso quienes se crean con derecho a ello.\n(REFORMADA, P.O. 16 DE NOVIEMBRE DE 2001)\nXII. Los servidores de la administración de justicia de carrera, disfrutarán de sueldos iguales cuando estén comprendidos en la misma categoría.\n(REFORMADA, P.O. 28 DE DICIEMBRE DE 2007)\nXIII. Para los efectos de la carrera judicial electoral, contenciosa-administrativa, de conciliación y arbitraje y de adolescentes se tomarán las bases establecidas en este artículo y lo que disponga en particular el Consejo de la Judicatura.\n(REFORMADA, P.O. 28 DE DICIEMBRE DE 2007)\nXIV. Los servidores públicos del Tribunal Electoral, del Tribunal de lo Contencioso-Administrativo, del Tribunal de Conciliación y Arbitraje y del Tribunal de Apelación Especializado en materia de\nAdolescentes, podrán participar en las promociones escalafonarias de los demás órganos jurisdiccionales, pero deberán demostrar conocimientos en la materia para la que deseen concursar.\n(REFORMADA, P.O. 28 DE DICIEMBRE DE 2007)\nXV. Los servidores públicos del Poder Judicial que deseen integrarse a la carrera judicial electoral, contenciosa-administrativa, de conciliación y arbitraje y/o de adolescentes, podrán hacerlo en la categoría equivalente o en una superior, siempre que demuestren conocimientos suficientes en las materias electoral, contenciosa administrativa, de conciliación y arbitraje y/o de adolescentes, en los respectivos concursos y en los términos que acuerde el Consejo de la Judicatura.\nARTÍCULO 63. Las vacantes o nuevas plazas que se registren en los cargos de Magistrados del\nTribunal de Apelación Especializado en materia de Adolescentes, de Tribunales Distritales, Jueces de Primera Instancia, Jueces Letrados, así como Secretarios, cualquiera que sea su categoría, y demás servidores públicos de la Administración de Justicia, serán cubiertas de acuerdo con el turno correspondiente y, en su caso, por escalafón, teniendo en cuenta los siguientes aspectos:\nI. La capacidad, aptitud y actitud del aspirante, sus antecedentes profesionales, conducta laboral, fama pública y la honestidad en los mismos.\nII. Las calificaciones periódicas que haya obtenido por su conducta, organización, rendimiento, eficiencia y eficacia de su trabajo, en el ejercicio de los cargos que haya desempeñado.\nIII. Las calificaciones que haya obtenido en el Instituto de Especialización Judicial.\nIV. En igualdad de circunstancias, su antigüedad en el servicio.\nLo anterior sin perjuicio de que, según el turno, también puedan cubrirse las vacantes con personas que sean merecedoras por su honradez, competencia y antecedentes. Respecto de los que también se valorará, si fuere el caso, los cursos que hubieren tomado.\nEn todo caso, unos y otros deberán sustentar y aprobar el examen de méritos correspondiente.\nARTICULO 64.- El orden de escalafón en los cargos judiciales, es el siguiente:\n(REFORMADO, P.O. 16 DE NOVIEMBRE DE 2001)\na) Actuario de Juzgado Letrado;\nb).- Actuario de Juzgado de Primera Instancia;\n(REFORMADO, P.O. 1 DE SEPTIEMBRE DE 2006)\nc) Actuario del Tribunal Unitario de Distrito o del Tribunal de Apelación Especializado en materia de\nAdolescentes;\n(REFORMADO, P.O. 28 DE DICIEMBRE DE 2007)\nd) Actuario de las Salas del Tribunal Superior de Justicia, del Tribunal Electoral, del Tribunal de lo\nContencioso-Administrativo y del Tribunal de Conciliación y Arbitraje;\n(REFORMADO, P.O. 16 DE NOVIEMBRE DE 2001)\ne) Secretario de Acuerdo y Trámite, y Secretario de Estudio y Cuenta de Juzgado Letrado;\nf).- Secretario de Acuerdo y Trámite, y de Estudio y Cuenta de Juzgado de Primera Instancia;\n(REFORMADO, P.O. 1 DE SEPTIEMBRE DE 2006)\ng) Secretario de Acuerdo y Trámite, y de Estudio y Cuenta del Tribunal Unitario de Distrito o\nSecretario General de Acuerdos del Tribunal de Apelación Especializado en materia de\nAdolescentes;\n(REFORMADO, P.O. 28 DE DICIEMBRE DE 2007)\nh) Secretario de Estudio y Cuenta de las Salas del Tribunal Superior de Justicia, del Tribunal\nElectoral, del Tribunal de lo Contencioso-Administrativo o del Tribunal de Conciliación y Arbitraje;\n(REFORMADO, P.O. 28 DE DICIEMBRE DE 2007)\ni) Secretario de Acuerdo y Trámite de las Salas del Tribunal Superior de Justicia, del Tribunal\nElectoral, del Tribunal de lo Contencioso-Administrativo o del Tribunal de Conciliación y Arbitraje;\nk) Secretario General de Acuerdos del Tribunal Electoral, del Tribunal de lo ContenciosoAdministrativo o del Tribunal de Conciliación y Arbitraje;\nl) Secretario General del Pleno del Tribunal Superior de Justicia;\nm) Juez de Primera Instancia o Juez Letrado;.\nn) Magistrado del Tribunal Distrital, Magistrado del Tribunal de Apelación Especializado en Materia de Adolescentes, Magistrado de Sala Distrital del Tribunal de lo Contencioso Administrativo y\nMagistrado de Sala Especial del Tribunal de Conciliación y Arbitraje.\nJusticia, así como al Consejo de la Judicatura, tendrán los niveles escalafonarios equivalentes a los de las Salas del Tribunal Superior.\nEl personal de los órganos jurisdiccionales que se creen, con cualquier denominación, tendrá el nivel escalafonario que se precise en el instrumento de su creación.\n(FE DE ERRATAS, P.O. 5, MARTES 15 DE ENERO DE 1991)\nARTICULO 65.- Los ascensos por escalafón y el examen de méritos que deben sustentar y aprobar los aspirantes a un cargo dentro de la judicatura, responden al propósito de lograr una rigurosa selección de servidores capaces y moralmente idóneos, para preservar la dignidad del\nPoder Judicial.\nARTICULO 66.- Habrá lugar a aplicar examen de méritos:\nI.- Para ingresar por primera vez a la Judicatura;\nII.- Para obtener un ascenso, cuando ocurra una vacante en un cargo de categoría superior, de acuerdo con el escalafón; y\nIII.- En todos los casos, cuando tengan lugar nuevos nombramientos.\n(REFORMADO, P.O. 28 DE DICIEMBRE DE 2007)\nEl Consejo de la Judicatura, de acuerdo con las necesidades del servicio, y de conformidad con el\nReglamento respectivo, instrumentará la aplicación de exámenes a quienes deseen ingresar a la judicatura, y quienes resulten aprobados, formarán parte de la reserva, cuyo registro se llevará en la Presidencia del Tribunal.\n(REFORMADO, P.O. 28 DE DICIEMBRE DE 2007)\nTambién se aplicarán exámenes de méritos, previo acuerdo del Consejo de la Judicatura, a los servidores públicos del Poder Judicial que deseen ascender en su oportunidad en la carrera judicial, integrándose la respectiva reserva con los que hubiesen aprobado.\n(REFORMADO PRIMER PÁRRAFO, P.O. 28 DE DICIEMBRE DE 2007)\nARTICULO 67.- El examen de méritos constará de evaluaciones de aptitudes, conocimientos y méritos conforme a las disposiciones reglamentarias existentes.\nAntes de implementar el examen, el Consejo, examinará los expedientes de los aspirantes y podrá excluir a los que no reúnan las condiciones legales.\nNo se harán públicos los motivos de la exclusión, a menos que lo pida el excluido.\nARTICULO 68.- El Consejo de la Judicatura señalará, oportunamente, el lugar, el día y la hora en que habrán de inscribirse los aspirantes y sustentarse el examen de méritos; lo que se hará saber mediante circulares y avisos que se fijen en los estrados de los juzgados y del Tribunal.\nARTICULO 69.- Calificado el examen de méritos, se darán a conocer los nombres de quienes lo hayan aprobado, según lo dispuesto en la parte final del artículo anterior.\nARTICULO 70.- Al escoger entre los aspirantes que hayan aprobado, no se preferirá al de grado más alta que la de los de grado superior o de la misma especialidad.\nARTICULO 71.- En caso de que el número de concursantes sea superior al número de vacantes por cubrir, el ingreso se determinará por orden de calificaciones, atentos los demás requisitos que establece esta Ley.\nCumplida la provisión de vacantes, los nombres de los aspirantes aprobados y no designados, continuarán figurando con sus calificaciones, durante el período respectivo, y serán enviados a quien corresponda llevar el registro de reservas.\n(REFORMADO, P.O. 28 DE DICIEMBRE DE 2007)\nARTICULO 72.- El Consejo de la Judicatura y el Pleno del Tribunal Superior de Justicia, deberán ser informados oportunamente del resultado general del examen, de los aspirantes aprobados y de aquellos que hubieren sido designados, así como de quienes integrarán la reserva judicial.\n(REFORMADO, P.O. 28 DE DICIEMBRE DE 2007)\nARTÍCULO 73. Inmediatamente que ocurra una vacante, el titular del órgano jurisdiccional, con excepción del Presidente del Tribunal Superior de Justicia, los de las Salas, el del Tribunal\nElectoral, el del Tribunal de lo Contencioso-Administrativo y el del Tribunal de Conciliación y\nArbitraje dará aviso a la Presidencia del Consejo de la Judicatura, para que se haga la designación correspondiente de entre los aspirantes que figuren en la lista de reserva.\nLos titulares de las Salas, del Tribunal Electoral, del Tribunal de lo Contencioso-Administrativo y del\nTribunal de Conciliación y Arbitraje harán las designaciones correspondientes respetando en todo caso el orden que corresponda en las listas de reserva, en los términos que establece esta ley.\nARTICULO 74.- Cuando no haya aspirantes aprobados para cubrir una vacante porque no se registren solicitudes, o se hubiere declarado desierto el examen de méritos, podrá prescindirse provisionalmente de este requisito y hacerse designación discrecional, con carácter interino, mientras se satisface. En tal caso no se producirá ascenso en el escalafón, ni permanencia en el cargo, más allá del tiempo necesario para que se cubra dicha formalidad.\n(REFORMADO, P.O. 28 DE DICIEMBRE DE 2007)\nARTÍCULO 75. Los titulares de las Salas comunicarán a la Presidencia del Tribunal Superior de\nJusticia la designación que hagan, a más tardar dentro del tercer día. Los presidentes del Tribunal\nElectoral, del Tribunal de lo Contencioso-Administrativo y del Tribunal de Conciliación y Arbitraje harán lo propio ante el Presidente del Consejo de la Judicatura. treinta días siguientes a la fecha de su designación. por escalafón, en los términos que establece la Ley del Servicio Civil.\nCAPITULO III\nDE LAS DESIGNACIONES serán hechos, preferentemente, entre aquellas personas que hayan prestado su servicio con eficiencia y probidad en la administración de justicia, o que lo merezcan por su honorabilidad, competencia y antecedentes en otras ramas de la profesión jurídica.\nARTÍCULO 80. Para ser nombrado Magistrado del Tribunal Superior de Justicia, del Tribunal\nElectoral, del Tribunal de lo Contencioso-Administrativo o del Tribunal de Conciliación y Arbitraje se requiere:\nI. Ser ciudadano mexicano por nacimiento, en el pleno ejercicio de sus derechos políticos y civiles;\nII. Tener cuando menos 35 años cumplidos el día de la designación;\nIII. Poseer el día de la designación, con antigüedad mínima de diez años, título profesional de\nLicenciado en Derecho, expedido por autoridad o institución legalmente facultada para ello;\nIV. Gozar de buena reputación y no haber sido condenado por delito que amerite pena corporal de más de un año de prisión; pero si se tratare de robo, fraude, falsificación, abuso de confianza u otro que lastime seriamente la buena fama en el concepto público, inhabilitará para el cargo, cualquiera que haya sido la pena; y\nV. Haber residido en el Estado durante los dos años anteriores al día de la designación;\nVI. No haber ocupado el cargo de Secretario del Ramo, o su equivalente, en la Administración\nPública Estatal, Procurador General de Justicia en el Estado, Diputado Local, o alguno de los cargos mencionados en la fracción VI del artículo 95 de la Constitución Política de los Estados\nUnidos Mexicanos, durante el año previo al día de su nombramiento.\nLos nombramientos de los Magistrados deberán recaer preferentemente entre aquellas personas que hayan servido con eficiencia, capacidad y probidad en la impartición de justicia o que se hayan distinguido por su honorabilidad, competencia y antecedentes profesionales en el ejercicio de la actividad jurídica.\n(DEROGADO, P.O. 1 DE SEPTIEMBRE DE 2006)\nARTICULO 80 BIS. SE DEROGA\n(REFORMADO PRIMER PÁRRAFO, P.O. 28 DE DICIEMBRE DE 2007)\nARTÍCULO 81. Los nombramientos de los Magistrados del Tribunal Superior de Justicia, del\nTribunal Electoral, del Tribunal de lo Contencioso-Administrativo y del Tribunal de Conciliación y\nArbitraje serán hechos por el Gobernador del Estado de la lista de candidatos que le presente el\nConsejo de la Judicatura y sometidos a la aprobación del Congreso, el que la otorgará o negará, dentro del improrrogable término de cinco días.\nLa lista de candidatos podrá ser rechazada por el Ejecutivo por una sola ocasión, en cuyo caso el\nConsejo de la Judicatura someterá a su consideración una nueva para que formule nombramiento.\nCuando el Congreso no resuelva dentro del término que se señala para el efecto, se tendrán por aprobados los nombramientos.\nEn el caso de que el Congreso del Estado no apruebe un nombramiento, el Gobernador del Estado hará una nueva designación dentro de las propuestas, que surtirá sus efectos desde luego, como ordinario de Sesiones. En este período de sesiones, dentro de los primeros cinco días, el Congreso deberá aprobar o desaprobar el nombramiento, y si lo aprueba o nada resuelve, el magistrado nombrado provisionalmente, continuará en sus funciones con el carácter de definitivo. Si el\nCongreso desecha el nombramiento, se reiterará el procedimiento, cesando desde luego el magistrado provisional.\nARTÍCULO 82. Para ser designado Magistrado de Tribunal Distrital o Magistrado del Tribunal de\nApelación Especializado en materia de Adolescentes, se requieren los mismos requisitos que para ser nombrado Magistrado del Tribunal Superior de Justicia del Estado, más el haber sustentado y aprobado el examen de méritos correspondiente.\nARTICULO 83.- Para ser Juez de Primera Instancia o Juez Letrado, se requiere:\nI.- Ser mexicano por nacimiento, en pleno ejercicio de sus derechos civiles y políticos;\n(REFORMADA, P.O. 28 DE DICIEMBRE DE 2007)\nII.- No menos de 25, el día de la designación;\nIII.- Tener título oficial de abogado y haber ejercido la profesión tres años por lo menos;\nIV.- Gozar de buena reputación y no haber sido condenado por delito intencional que amerite pena corporal de más de un año de prisión; pero si se tratare de robo, fraude, falsificación, abuso de confianza u otro que lastime la buena fama en concepto público, inhabilitará para el cargo cualquiera que haya sido la pena; y\nV.- Sustentar y aprobar el examen de méritos.\n(ADICIONADO, P.O. 1 DE SEPTIEMBRE DE 2006)\nLos Jueces de Primera Instancia en materia de Adolescentes deberán de contar, además, con conocimientos en la materia penal y en la prevención y tratamiento de la conducta de los adolescentes.\n(REFORMADO PRIMER PARRAFO, P.O. 16 DE NOVIEMBRE DE 2001)\nARTICULO 84.- Los Magistrados de los Tribunales Unitarios de Distrito, los Jueces de Primera\nInstancia y los Jueces Letrados, serán nombrados por el Consejo de la Judicatura, con base en el procedimiento y requisitos que establezca la ley y demás disposiciones aplicables.\nSe establecen dos turnos para los nombramientos de magistrados y jueces para cada una de las especialidades correspondientes.\nEl Primer Turno, en el que se cubrirá el 70% de las vacantes por ascensos, con sujeción estricta al escalafón, criterios legales de selección y previa la aprobación del examen de méritos.\nSegundo Turno, en el que se cubrirán el 30% de las vacantes con personas que no presten sus prestado con eficiencia y probidad. O por personas que sean merecedoras por su honradez, competencia y antecedentes en el ejercicio de la profesión, siempre y cuando unos y otros aprueben el examen de méritos.\nCuando se produzca una vacante o se cree plaza nueva, se atenderá al turno de la especialidad que corresponda en estricto orden. Si se agota el turno sin que se cubra la vacante o plaza nueva, se pasará al turno siguiente.\nPresidente del Tribunal Superior y al Consejo de la Judicatura. En las convocatorias para exámenes de mérito y después de las designaciones, se dará a conocer la lista y el estado en que se encuentren los turnos, o su actualización, en los estrados de los juzgados, tribunales unitarios, Salas y Presidencia del Tribunal Superior de Justicia.\nCuando los turnos estén vacantes, hasta en tanto se acuerde o realice debido procedimiento de selección y en caso de cargo vacante o plaza nueva, se designará a un interino.\nSe procederá de la misma forma señalada en los párrafos anteriores, tratándose de nombramientos de Secretarios de Tribunales Unitarios y de Juzgados de Primera Instancia, así como para los nombramientos de Secretarios de Juzgados Letrados.\nARTICULO 85.- (DEROGADO, P.O. 28 DE DICIEMBRE DE 2007)\nARTICULO 86.- (DEROGADO, P.O. 2 DE JULIO DE 1996)\nARTICULO 87.- (DEROGADO, P.O. 20 DE MARZO DE 2001)\nARTICULO 88.- (DEROGADO, P.O. 20 DE MARZO DE 2001)\nARTICULO 89.- Para ser Secretario en cualquiera de sus calidades se requiere:\nI.- Ser ciudadano mexicano por nacimiento, en pleno ejercicio de sus derechos civiles y políticos;\n(REFORMADA, P.O. 28 DE DICIEMBRE DE 2007)\nII.- No tener menos de 21, el día de la designación;\nIII.- Tener título oficial de abogado;\n(FE DE ERRATAS, P.O. 5, MARTES 15 DE ENERO DE 1991)\nIV.- Gozar de buena reputación y no haber sido condenado por delito intencional que amerite pena corporal de más de un año de prisión; pero si se tratare de robo, fraude, falsificación, abuso de confianza u otro que lastime la buena fama en concepto público, inhabilitará para el cargo cualquiera que haya sido la pena; y\nV.- Sustentar y aprobar el examen de méritos.\n(REFORMADO PRIMER PARRAFO, P.O. 28 DE DICIEMBRE DE 2007)\nARTÍCULO 90. Para ser actuario en cualquiera de sus calidades, se deberán satisfacer los siguientes requisitos:\nI.- Ser ciudadano mexicano por nacimiento, mayor de edad, en ejercicio de sus derechos civiles y políticos;\nII.- Tener buenos antecedentes de moralidad;\nIII.- Tener título de licenciado en derecho; y\nIV.- Sustentar y aprobar el examen de méritos.\nARTÍCULO 92. Los Magistrados del Tribunal Superior de Justicia, del Tribunal Electoral, del\nTribunal de lo Contencioso-Administrativo y del Tribunal de Conciliación y Arbitraje al iniciar el ejercicio de su cargo, rendirán la protesta de Ley ante el Congreso del Estado, y en sus recesos, ante la Diputación Permanente.\nLos Magistrados de Distrito, los Jueces de Primera Instancia y Letrados, lo harán ante el Consejo de la Judicatura o su Presidente.\nLos demás servidores de la administración de justicia, rendirán la protesta de ley ante la autoridad de quien dependan. corresponda, en los términos siguientes: \"¿Protesta desempeñar leal y patrióticamente el cargo de\n(el que confiere al interesado) que se le ha conferido; guardar y hacer guardar la Constitución ellas emanen y cumplir fielmente los deberes que dicho cargo impone, mirando en todo por el bien y prosperidad de la unión y del estado?\". El interesado responderá: \"Si protesto\". La autoridad que toma la protesta añadirá: \"Si no lo hiciereis así, el Estado os lo demande\".\n(REFORMADO, P.O. 16 DE NOVIEMBRE DE 2001)\nARTICULO 94.- De toda protesta de los servidores públicos del Poder Judicial, se levantará acta con el número de copias necesarias, una de las cuales se remitirá a la Oficialía Mayor del Poder\nJudicial, para ser agregada a la hoja de servicios correspondiente.\nCAPITULO IV\nDE LA PERMANENCIA EN EL CARGO\n(REFORMADO, P.O. 28 DE DICIEMBRE DE 2007)\nARTÍCULO 95. El periodo constitucional de los integrantes del Poder Judicial será:\nI.- De quince años, para los Magistrados del Tribunal Superior de Justicia;\nII.- De diez años, para los Magistrados del Tribunal Electoral;\nIII.- De seis años en el primer ejercicio del encargo para el Magistrado del Tribunal de Apelación\nEspecializado en materia de Adolescentes, para los Magistrados del Tribunal de lo ContenciosoAdministrativo, del Tribunal de Conciliación y Arbitraje y de los Tribunales Distritales, que se contará a partir de la fecha de su designación. Al término del citado período podrán ser designados nuevamente, por única vez, por un período de nueve años.\nLos Jueces de Primera Instancia y los Jueces Letrados durarán en el ejercicio de su cargo seis años, podrán ser reelectos, y si lo fueren, no podrán ser removidos sin previo juicio político o este ordenamiento.\nARTICULO 96.- Los Secretarios y Actuarios una vez designados, no podrán ser suspendidos o cesados, salvo por falta o delitos y en la forma y términos previstos en esta Ley.\nCAPITULO V\nDE LAS INCOMPATIBILIDADES\nARTICULO 97.- Ningún servidor público de la administración de justicia, podrá tener ocupación en particular. Consecuentemente, los cargos de la rama jurisdiccional son incompatibles con el desempeño de cualquier otro cargo retribuido; con los cargos de elección popular y representación política; con la calidad de Ministro de cualquier culto; con la milicia; con la gestión profesional de negocios ajenos y, con cualquier cargo auxiliar de la administración de justicia.\nSe exceptúan de este precepto las actividades docentes y honoríficas, siempre que no se afecte la prestación regular de la función judicial.\nARTICULO 98.- Los magistrados numerarios, aún cuando gocen de licencia, no podrán ejercer su profesión de abogados ni patrocinar negocios ante los tribunales, salvo que se trate de negocios propios.\n(FE DE ERRATAS, P.O. 5, MARTES 15 DE ENERO DE 1991)\nARTICULO 99.- Para ningún cargo de la administración de justicia podrá designarse a personas que sean ascendientes, descendientes, cónyuges o colaterales, dentro del cuarto grado, por consanguinidad, segundo por afinidad, o civil, del servidor público que intervenga en la designación.\n(REFORMADO, P.O. 28 DE DICIEMBRE DE 2007)\nARTÍCULO 100. No podrán formar parte de la plantilla de personal de la Presidencia, de una misma Sala, del Tribunal Electoral, del Tribunal de lo Contencioso-Administrativo, del Tribunal de\nConciliación y Arbitraje, del Tribunal de Apelación Especializado en materia de Adolescentes, de un\nTribunal Distrital o de un Juzgado, dos o más personas que sean cónyuges o parientes entre sí, en los mismos grados a que alude el artículo anterior.\nCAPITULO VI\nDE LA TERMINACION DEL CARGO\n(ADICIONADO, P.O. 28 DE DICIEMBRE DE 2007)\nARTÍCULO 100 BIS.- Los Magistrados del Tribunal Superior de Justicia, de los Tribunales\nEspecializados y de los Tribunales Distritales, a la conclusión de sus respectivos períodos constitucionales, tendrán derecho a un haber por retiro que comprenderá las percepciones, que durante un año correspondan a los magistrados en activo, así como a las demás prestaciones legales, de acuerdo al nivel nominal de que se trate. Para el efecto anterior, el Consejo de la\nJudicatura deberá realizar la declaratoria correspondiente en los términos que señale el reglamento de la materia.\nEl haber por retiro a que se refiere este artículo se otorgará únicamente a los magistrados que no sean designados para otro periodo en el desempeño de su cargo.\nSólo tendrán derecho a la percepción de los emolumentos a que se refiere el párrafo anterior, los magistrados que hubiesen cumplido con el período constitucional para el que fueron designados, o cuando se jubilen o se incapaciten de manera permanente durante dicho período. Si fuesen separados de su cargo de manera definitiva antes de la conclusión del período constitucional, en los términos del Título Séptimo de la Constitución Política local o por renuncia voluntaria, no gozarán de esta percepción. que regulen esa materia.\nARTICULO 101.- Son causas de retiro forzoso de los magistrados, jueces y demás servidores del\nII.- Padecer incapacidad física incurable o mental, incluso cuando ésta fuese parcial o transitoria.\nARTICULO 102.- Los magistrados y jueces jubilados que así lo deseen, podrán seguir adscritos al servicio de la judicatura en el Instituto de Especialización Judicial.\nTITULO QUINTO\nCAPITULO I\n(REFORMADO PRIMER PÁRRAFO, P.O. 28 DE DICIEMBRE DE 2007)\nARTICULO 104.- El Tribunal Superior de Justicia tendrá cada año dos períodos de sesiones; el primero, iniciará el primer día hábil del mes de enero y concluirá el último día hábil anterior al primer periodo vacacional que se establezca en el calendario oficial del Poder Judicial del Estado; el segundo, comenzará el primer día hábil siguiente a la conclusión del primer periodo vacacional y terminará el último día hábil anterior al segundo periodo vacacional conforme al calendario referido.\n(REFORMADO, P.O. 28 DE DICIEMBRE DE 2007)\nAl clausurarse cada período de sesiones el Pleno designará a uno o más magistrados que provean los trámites en asuntos urgentes y despachen, durante el receso, los de resolución de notoria urgencia siempre que no correspondan en definitiva al Pleno o a las Salas y dicten las órdenes o medidas provisionales, también de carácter urgente, que exija el buen servicio de la justicia, debiendo dar cuenta al Presidente del Tribunal al reanudar éste sus sesiones, para que someta a la consideración del Pleno las resoluciones, órdenes o medidas provisionales dictadas durante el receso. Al efecto, se atenderá lo dispuesto por el Reglamento Interior del Pleno.\nTambién designará el Tribunal Superior al secretario y empleados que deban despachar los asuntos a que se refiere el párrafo anterior.\n(REFORMADO PRIMER PÁRRAFO, P.O. 28 DE DICIEMBRE DE 2007)\nARTICULO 105.- Al iniciarse cada período de sesiones, el Tribunal lo comunicará a los Poderes del Estado. Se enviará al Periódico Oficial del Estado copia del acta relativa para su publicación y\nLo mismo se observará en el caso de nuevas designaciones de Magistrados del Tribunal Superior.\nCAPITULO II\nDEL TRIBUNAL PLENO\nARTICULO 106.- El Pleno del Tribunal Superior de Justicia celebrará sesiones ordinarias, cuando menos una vez a la semana.\nARTICULO 107.- Cuando las circunstancias lo requieran, el Tribunal Pleno sesionará en forma extraordinaria, en los términos previstos por el artículo 10 de esta Ley.\nARTICULO 108.- La Secretaría del Pleno distribuirá oportunamente entre los Magistrados, una relación de los asuntos a tratar en las sesiones.\nARTICULO 109.- Las sesiones del Pleno se desarrollarán en la forma siguiente:\nI.- El Presidente pasará lista de asistencia y declarará, en su caso, la integración del Pleno;\nII.- La Secretaría dará lectura al acta de la sesión anterior, para su aprobación, en su caso, y la misma será autorizada con las firmas del Presidente y del Secretario;\nIII.- Se dará curso a los asuntos de su competencia, dándoseles el trámite correspondiente; y\nIV.- Se proveerá sobre los demás asuntos que por disposición legal, o a juicio del Pleno, requieran su intervención.\n(FE DE ERRATAS, P.O. 5, MARTES 15 DE ENERO DE 1991)\nARTICULO 110.- En los casos sujetos a decisión, el Presidente propondrá el acuerdo y lo someterá a la consideración de los Magistrados, recabándose la aprobación del mismo por unanimidad, o por mayoría de votos. En caso de oposición, el asunto se someterá a debate. El\nPresidente cuidará de que la discusión sea moderada y sin apartarse del tema, para lo cual se concederá el uso de la palabra al disidente, quien podrá replicar a los que secunden la propuesta.\nTranscurrido el tiempo que se juzgue necesario para el desarrollo del debate, se pasará a votación.\nEl Presidente tendrá voto de calidad, en caso de empate. El voto particular se asentará en la resolución respectiva, sin perjuicio de que sea razonado, cuando así lo solicitare el magistrado disidente.\nCAPITULO III\n(REFORMADO SU DENOMINACIÓN, P.O. 28 DE DICIEMBRE DE 2007)\nDE LAS SALAS, DE LOS TRIBUNALES ESPECIALIZADOS, DE LOS TRIBUNALES\nDISTRITALES Y DE LOS JUZGADO\n(REFORMADO, P.O. 16 DE NOVIEMBRE DE 2001)\nARTICULO 111.- El Poder Judicial laborará todos los días del año, excepción hecha de los sábados, domingos y aquellos días que las leyes declaren festivos, o en los que el Pleno del\nTribunal acuerde que no haya actuaciones judiciales. En el año en que tengan verificativo procesos electorales, para el Tribunal Electoral todos los días y horas son hábiles para la presentación, sustanciación y resolución de los medios de impugnación, en los términos que establezca la ley de la materia y demás disposiciones aplicables.\nEl despacho diario del Poder Judicial se efectuará en los horarios que acuerde el Consejo de la\nJudicatura, previa opinión del Pleno del Tribunal y atendiendo a las necesidades del servicio.\nARTICULO 112.- Son deberes de magistrado y jueces:\nI.- Dirigir el proceso; vigilar su correcto desarrollo; adoptar las medidas conducentes para evitar tácticas dilatorias ilegales y procurar la mayor economía procesal;\nII.- Mantener la igualdad de las partes en el proceso;\nIII.- Prevenir, remediar y sancionar, en su caso, los actos contrarios a la administración de justicia, así como la buena fe que debe presidir el desarrollo del proceso, denunciando al Ministerio Público todo hecho que pueda constituir un delito;\nIV.- Guardar reserva sobre las decisiones que se proponga dictar en el proceso; y\nV.- Dictar las resoluciones que proceda dentro de los términos legales.\nVI.- Ejercer la supervisión y control sobre todos los servidores de su adscripción, e instruir, en su caso, los procedimientos de responsabilidad administrativa, imponiendo las sanciones disciplinarias conducentes.\nARTICULO 113.- Las audiencias serán públicas, a menos que por la naturaleza del asunto, el titular del órgano considere que deben ser privadas.\nSerán presididas por el Presidente del Tribunal Superior de Justicia, el Magistrado instructor en los asuntos del Pleno, el Presidente de la Sala, el Magistrado Presidente del Tribunal Electoral, el\nMagistrado Presidente del Tribunal de lo Contencioso-Administrativo, el Magistrado Presidente del\nTribunal de Conciliación y Arbitraje, el Magistrado del Tribunal Distrital o el Juez. En su caso, y bajo su vigilancia, podrán delegar su dirección a un Secretario.\n(ADICIONADO, P.O. 1 DE SEPTIEMBRE DE 2006)\nLas audiencias del Tribunal de Apelación Especializado en materia de Adolescentes se llevarán a cabo conforme lo determina el ordenamiento que regula la justicia para adolescentes.\nARTICULO 114.- Queda prohibida la práctica de dictar los alegatos durante la audiencia. Los alegatos serán verbales; pero las partes pueden presentar sus conclusiones por escrito.\n(REFORMADO PRIMER PARRAFO, P.O. 16 DE NOVIEMBRE DE 2001)\nARTICULO 115.- Los Secretarios de Acuerdos, deberán llevar, bajo su control y vigilancia, los siguientes libros y legajos:\n(REFORMADA, P.O. 16 DE NOVIEMBRE DE 2001)\nI. Libro de registro, en el que se asentará el registro de entradas y salidas en forma progresiva y por numeración consecutiva de los expedientes.\n(FE DE ERRATAS, P.O. 5, MARTES 15 DE ENERO DE 1991)\nII.- De registro de valores, independiente de los legajos que con aquéllos se formen por riguroso orden numérico, conforme a la fecha de su presentación;\n(REFORMADA, P.O. 16 DE NOVIEMBRE DE 2001)\nIII. Libro de exhortos, despachos, oficios y requisitorias, recibidos y diligenciados.\nIV.- De relación de negocios citados para sentencia definitiva, interlocutoria, y resueltos, independientemente de los legajos de copias certificadas de las resoluciones dictadas y glosadas en el orden de su pronunciamiento:\nV.- De asistencia del personal;\nVI.- De inventario de bienes;\nVII. Libro de medios de impugnación, en el que se registre la fecha de presentación de cualquier medio de impugnación; en su caso, la de remisión de los expedientes enviados a la Segunda\nInstancia y la de recepción de los expedientes provenientes de las Salas, Tribunales Unitarios u otras autoridades.\nVIII. Libro de amparos, en el que se registren las demandas de amparo así como la tramitación de los mismos.\nIX. Libro Auxiliar, en el que se registren promociones irregulares y expedientes auxiliares.\nX. El libro de índice alfabético, en el que se asentará el registro de los asuntos por nombre del actor, del solicitante o del autor de la sucesión, si se trata de procesos civiles y familiares, o del inculpado, si se trata de procesos penales.\nXI. El legajo en el que consten los listados de los expedientes enviados a la oficina correspondiente del archivo judicial.\nXII. Los demás que determine el Pleno del Tribunal o el Consejo de la Judicatura, en el ámbito de sus respectivas competencias.\n(ADICIONADO, P.O. 16 DE NOVIEMBRE DE 2001)\nEl Consejo de la Judicatura podrá autorizar la utilización de medios electrónicos para registrar la información a que se refiere este artículo, en sustitución de los libros.\nARTICULO 116.- En los juzgados del ramo penal deberán llevarse, además de los libros a que se refiere el artículo anterior, los siguientes:\nI.- De control de órdenes de aprehensión;\nII.- De presentaciones de procesados, con su auxiliar de lista de asistencia;\nIII.- De objetos e instrumentos de delito;\n(REFORMADA, P.O. 16 DE NOVIEMBRE DE 2001)\nIV.- De medidas cautelares, provisionales y de aseguramiento; y\nV.- De actas de visita a los centros de detención.\n(ADICIONADO, P.O. 1 DE SEPTIEMBRE DE 2006)\nEstos mismos libros serán llevados, en su caso, por los Juzgados de Primera Instancia en materia de Adolescentes\nARTICULO 117.- Los actuarios, o quienes hagan sus veces, deberán llevar un libro en el que asienten diariamente las diligencias y notificaciones que practiquen fuera del local de la oficina en que presten sus servicios, con expresión:\nI.- De la fecha en que reciba el expediente respectivo;\nII.- De la fecha del auto que deban diligenciar;\nIII.- Del lugar en que deba llevarse a cabo la diligencia, indicando la calle y número de la casa de que se trate;\nIV.- De la fecha en que se haya practicado la diligencia, notificación o actos de que se trate, o los motivos por los cuales no se hayan verificado; y\nV.- De la fecha de devolución del expediente.\nEl titular revisará periódicamente el contenido de este libro y proveerá lo conducente.\nARTICULO 118.- Los expedientes sólo podrán ser facilitados, para su examen dentro de la oficina, previo el recibo correspondiente:\nI.- A las partes;\nII.- A los abogados de las partes, con título legalmente registrado;\nIII.- A los empleados de éstos, debidamente autorizados, siempre que sean pasantes de Derecho;\nIV.- A las personas designadas en cada proceso como auxiliares de la Administración de Justicia, para el exclusivo desempeño de su cargo;\nV.- A los servidores públicos, que lo requieran en razón de sus funciones; y\nVI.- A las personas autorizadas por el Titular, para fines docentes o de investigación científica.\nCAPITULO IV\nDE LA VIGILANCIA JUDICIAL\nARTICULO 119.- La vigilancia judicial tiene por objeto velar por que la justicia se administre oportuna y eficazmente, y conlleva al examen de la conducta de los servidores de la Administración de Justicia y puntual desempeño de sus deberes.\n(REFORMADO PRIMER PÁRRAFO, P.O. 28 DE DICIEMBRE DE 2007)\nARTÍCULO 120. La Visitaduría Judicial General es el órgano auxiliar del Consejo de la Judicatura competente para inspeccionar el funcionamiento del Tribunal Electoral, del Tribunal de lo\nContencioso-Administrativo, del Tribunal de Conciliación y Arbitraje, del Tribunal de Apelación\nEspecializado en materia de Adolescentes, de los Tribunales Distritales, de los Juzgados de\nPrimera Instancia y Letrados, así como para supervisar las conductas de los integrantes de estos órganos.\nEl Pleno del Tribunal determinará los mecanismos de inspección para las Salas.\n(REFORMADO, P.O. 5 DE DICIEMBRE DE 1997)\nARTICULO 121.- El Visitador Judicial será designado y removido libremente por el Consejo de la\nJudicatura, a propuesta de su Presidente.\nEl Visitador deberá satisfacer los requisitos siguientes: contar con treinta y cinco años de edad o más; gozar de buena reputación; no haber sido condenado por delito con pena privativa de libertad; tener título de licenciado en derecho legalmente expedido y práctica profesional de cuando menos cinco años.\nEl Consejo de la Judicatura establecerá, a propuesta del Presidente, mediante acuerdos generales, los sistemas que permitan evaluar de manera periódica el desempeño del Visitador para efectos de lo dispuesto en esta ley en materia de responsabilidad.\nCorresponde a la Visitaduría Judicial General, formular y proponer al Consejo de la Judicatura, por conducto de su Presidente los criterios generales de evaluación mensual, semestral y anual de rendimiento y eficiencia; así como llevar el control de las evaluaciones y verificar la autenticidad de los datos que se proporcionen en los informes estadísticos correspondientes. Igualmente, informar de ello periódicamente y cuando sea necesario al Consejo, por conducto de su Presidente.\nARTICULO 122.- El Visitador Judicial General se auxiliará en el desempeño de sus funciones por\nConsejo de la Judicatura; ejercerá sus funciones de conformidad con las disposiciones generales del Tribunal. El Consejo de la Judicatura fijará los criterios de selección de los visitadores judiciales. de la Judicatura, de las visitas ordinarias de inspección que se vayan a practicar a fin de que se proceda a fijar el correspondiente aviso en los estrados del órgano, con una anticipación mínima de quince días, para el efecto de que las personas interesadas puedan acudir a la visita y manifestar sus quejas o denuncias.\nARTICULO 122 A.- En las visitas ordinarias el Visitador Judicial General o los visitadores judiciales, considerando las particularidades de cada órgano, realizarán, además de lo que específicamente determine el Consejo de la Judicatura, lo siguiente:\nI.- Solicitar la lista del personal para comprobar su asistencia;\nII.- Verificar que los valores estén debidamente guardados, ya sea en la caja de seguridad del órgano visitado, o en alguna institución de crédito;\nIII.- Comprobar que se encuentren debidamente asegurados los instrumentos y objetos de delito;\nIV.- Revisar los libros de gobierno a fin de determinar si se encuentran en orden y contienen los datos requeridos;\nV.- Hacer constar el número de asuntos que hayan ingresado al órgano visitado durante el tiempo que comprenda la visita. Y determinar si los procesados que disfrutan de libertad caucional han cumplido con la obligación de presentarse en los plazos fijos, y el estado en que se encuentran los procesos en suspenso con relación al término de prescripción de la acción penal;\nVI.- Examinar los expedientes a fin de verificar: que se lleven con arreglo a la ley; que las resoluciones y acuerdos hayan sido dictados y cumplidos oportunamente; que las notificaciones y diligencias se efectúen en los plazos legales; que los exhortos y despachos hayan sido diligenciados; y que se observen los términos constitucionales y demás garantías que la ofendidos.\nCuando el visitador advierta que en un proceso se venció el término para dictar sentencia o pronunciar otra resolución, recomendará que ésta se pronuncie a la brevedad posible. En cada uno de los expedientes revisados, se pondrá la constancia respectiva, y\nVII.- Revisar que se haya cumplido con la ley en los juicios de amparo en que el órgano visitado sea autoridad responsable;\n(REFORMADO, P.O. 16 DE NOVIEMBRE DE 2001)\nDe toda visita de inspección deberá levantarse acta circunstanciada. En la cual se hará constar el desarrollo de la misma, las quejas o denuncias presentadas en contra de los titulares y demás servidores del órgano de que se trate, las manifestaciones que respecto de la visita o del contenido del acta quisieran realizar los propios titulares o servidores del órgano, y la firma del juez o magistrado que corresponda y la del visitador. En el ejercicio de sus funciones, el visitador general y los visitadores judiciales estarán investidos de fe pública, por lo que lo asentado en las actas de visita se tendrá por cierto salvo prueba en contrario.\nEl acta original levantada por el visitador se entregará al Presidente del Consejo de la Judicatura; una copia al Presidente del Tribunal Superior, otra al titular del órgano visitado, y una más que conservará en su poder el Visitador. Si del contenido del acta levantada se advierte una responsabilidad oficial, el Consejo de la Judicatura procederá conforme a los ordenamientos legales aplicables.\nARTICULO 122 B.- El Consejo de Judicatura, por conducto del Presidente del Tribunal, podrá comprendan determinado período de tiempo y/o expedientes, así como visitas extraordinarias de inspección o la integración de comités de investigación, siempre que a juicio existan elementos que a su supervisión.\nCAPITULO V\nDE LA VALORACION DEL SERVICIO\n(REFORMADO, P.O. 5 DE DICIEMBRE DE 1997)\nARTICULO 123.- El Pleno del Tribunal se encargará de ponderar periódicamente los méritos y la conducta profesional observada por los Magistrados integrantes de las Salas Colegiadas; el\nConsejo de la Judicatura lo hará respecto del resto del personal al servicio del Poder Judicial, con excepción del Secretario del Pleno, Secretaría Particular, Dirección del Archivo General del Poder\nJudicial y del Oficial Mayor, cuya evaluación será hecha por el Presidente del Tribunal.\n(REFORMADO, P.O. 2 DE JULIO DE 1996)\nARTICULO 124.- El presidente del Tribunal Superior de Justicia, los Magistrados, y los Jueces, harán una evaluación periódica de la actuación de sus Secretarios, actuarios y demás servidores que laboren en sus respectivas dependencias.\n(REFORMADO PRIMER PÁRRAFO, P.O. 1 DE SEPTIEMBRE DE 2006)\nARTÍCULO 125. Las evaluaciones de los miembros del Poder Judicial serán concentradas en la\nPresidencia del Tribunal Superior de Justicia, y una vez analizadas por el órgano competente para los efectos a que tenga lugar, se anotarán en la hoja de servicios de cada servidor público de la\nAdministración de Justicia.\nEl Presidente comunicará sus resultados al Consejo de la Judicatura.\nTITULO SEXTO\n(FE DE ERRATAS, P.O. 5, MARTES 15 DE ENERO DE 1991)\nDE LA SUSTITUCION EN CASO DE IMPEDIMENTO, EXCUSA O RECUSACION\nARTICULO 126.- Si un magistrado del Tribunal Superior de Justicia dejare de conocer de algún asunto correspondiente al Pleno, por impedimento, excusa o recusación, será suplido por el magistrado numerario a quien corresponda el turno que deberá llevar el presidente del Tribunal.\nSi la excusa del magistrado es para no conocer de un asunto de Sala, la suplencia la hará el magistrado supernumerario que designe la Sala.\nSi todos los magistrados de una Sala estuvieren impedidos para conocer, pasará el asunto al conocimiento de la Sala que siga en número.\nSi un magistrado del Tribunal Unitario de Distrito dejare de conocer de un asunto por impedimento, recusación o excusa, pasará el negocio al Tribunal Unitario de Distrito más cercano.\nLos impedimentos, excusas o recusaciones de los Magistrados del Tribunal Electoral, del Tribunal de lo Contencioso-Administrativo, del Tribunal de Conciliación y Arbitraje o del Tribunal de las leyes que regulan su funcionamiento.\nARTICULO 127.- Para la distribución de los asuntos en casos de impedimento, excusa o recusación de jueces de primera instancia, se atenderá a la prelación por materia en el siguiente orden: civil, mercantil, familiar y penal, observándose el siguiente procedimiento:\nI.- Cuando se trate de jueces civiles, los asuntos que dejaren de conocer pasarán al juzgado de la misma materia en el propio distrito judicial, atendiendo a su número ordinal.\nSi todos los jueces civiles de un distrito dejaren de conocer, el asunto pasará al Juez Primero de\nPrimera Instancia en Materia Mercantil del mismo distrito; en caso de que estuviere impedido, pasará al siguiente Juez de la misma Instancia y materia en el propio distrito, si lo hubiere.\nEn caso de que los jueces mercantiles estuvieren impedidos, pasará al conocimiento del Juez\nPrimero de Primera Instancia de lo Familiar en el mismo distrito; y en caso de impedimento de éste, pasará al siguiente juez familiar en el propio distrito, si lo hubiere. Si todos los jueces familiares estuvieren impedidos, el asunto se remitirá al Juez Primero de Primera Instancia en materia penal, en caso de que estuviere impedido, pasará al siguiente Juez de la misma Instancia y materia en el propio distrito, si lo hubiere. Si todos los jueces penales estuvieren impedidos, pasará al juzgado civil del distrito judicial más próximo, quien, en su caso, atenderá a las reglas señaladas en este artículo.\nII.- Cuando se trate de jueces mercantiles, los asuntos que dejaren de conocer, pasarán al juzgado de la misma materia en el propio distrito judicial, atendiendo a su número ordinal.\nSi todos los jueces mercantiles de un distrito dejaren de conocer, el asunto pasará al Juez Primero de Primera Instancia en materia civil del mismo distrito; en caso de que estuviere impedido, pasará al siguiente Juez de la misma instancia y materia en el propio distrito, si lo hubiere.\nEn caso de que los jueces civiles estuvieren impedidos, pasará al conocimiento del Juez Primero de Primera Instancia de lo Familiar en el mismo distrito; y en caso de impedimento de éste, pasará al siguiente juez familiar en el propio distrito, si lo hubiere. Si todos los jueces familiares estuvieren impedidos, el asunto se remitirá al Juez Primero de Primera Instancia en materia penal, en caso de que estuviere impedido, pasará al siguiente Juez de la misma instancia y materia en el propio distrito, si lo hubiere. Si todos los jueces penales estuvieren impedidos, pasará al juzgado mercantil del distrito judicial más próximo, quien, en su caso, atenderá a las reglas señaladas en este artículo.\nIII.- Cuando se trate de jueces familiares, los asuntos que dejaren de conocer pasarán al juzgado de la misma materia en el propio distrito judicial, atendiendo a su número ordinal.\nSi todos los jueces familiares de un distrito dejaren de conocer, el asunto pasará al Juez Primero de Primera Instancia en materia civil del mismo distrito; en caso de que estuviere impedido, pasará al siguiente Juez de la misma instancia y materia en el propio distrito, si lo hubiere.\nEn caso de que los jueces civiles estuvieren impedidos, pasará al conocimiento del Juez Primero de Primera Instancia en materia mercantil en el mismo distrito; y en caso de impedimento de éste, pasará al siguiente juez mercantil en el propio distrito, si lo hubiere. Si todos los jueces mercantiles estuvieren impedidos, el asunto se remitirá al Juez Primero de Primera Instancia en materia penal, en caso de que estuviere impedido, pasará al siguiente Juez de la misma instancia y materia en el propio distrito, si lo hubiere. En caso de que todos los jueces penales estuvieren impedidos, pasará al juez familiar del distrito judicial más próximo, quien, en su caso, atenderá a las reglas señaladas en este artículo.\nIV.- Cuando se trate de jueces penales, los asuntos que dejaren de conocer pasarán al juzgado de la misma materia en el propio distrito judicial, atendiendo a su número ordinal.\nSi todos los jueces penales de un distrito dejaren de conocer, el asunto pasará al Juez Primero de\nPrimera Instancia en materia civil del mismo distrito; en caso de que estuviere impedido, pasará al siguiente Juez de la misma instancia y materia en el propio distrito, si lo hubiere.\nPrimera Instancia en materia mercantil en el mismo distrito; y en caso de impedimento de éste, pasará al siguiente juez mercantil en el propio distrito, si lo hubiere. Si todos los jueces mercantiles estuvieren impedidos, el asunto se remitirá al Juez Primero de Primera Instancia en Materia\nFamiliar, en caso de que estuviere impedido, pasará al siguiente Juez de la misma instancia y materia en el propio distrito, si lo hubiere. Si todos los jueces familiares estuvieren impedidos, pasará al Juez de Primera Instancia en Materia Penal del distrito judicial más próximo, quien, en su caso, atenderá a las reglas señaladas en este artículo.\n(REFORMADO, P.O. 16 DE NOVIEMBRE DE 2001)\nARTICULO 128.- Si un Juez Letrado deja de conocer de un negocio por excusa, recusación o impedimento, conocerá, en los lugares en que existan dos o más Jueces Letrados, el que le siga en número, y en aquéllos en que sólo exista un juez, el asunto pasará al Juez de Primera Instancia de la materia que corresponda, y agotados éstos o en su defecto, al Juez Letrado más cercano.\nARTICULO 129.- En casos de excusa, recusación o impedimento de los Secretarios, éstos serán suplidos en los términos que esta Ley establece para sus faltas temporales.\nTITULO SEPTIMO\nDE LAS DEPENDENCIAS DEL TRIBUNAL SUPERIOR DE JUSTICIA\nCAPITULO I\nDEL ARCHIVO JUDICIAL\n(REFORMADO, P.O. 5 DE DICIEMBRE DE 1997)\nARTICULO 130.- El Archivo General del Poder Judicial dependerá de la Presidencia del Tribunal\nSuperior de Justicia y se integrará con el siguiente personal; Un Director quien preferentemente deberá contar con título de abogado, un Secretario y demás servidores públicos que señale el\nPresupuesto de Egresos. El Presidente dictará las medidas que estime convenientes, y por medio de la Visitaduría Judicial General o las comisiones que para el efecto designe, practicará visitas semestrales ordinarias, y las extraordinarias que considere necesario.\n(REFORMADO, P.O. 16 DE NOVIEMBRE DE 2001)\nARTICULO 131.- El Archivo Judicial del Estado tendrá sus oficinas centrales en la Capital del\nEstado, y si el servicio lo requiere, previo acuerdo del Consejo de la Judicatura, se establecerán las oficinas regionales o distritales que sean necesarias.\nARTICULO 132.- Se depositarán en el Archivo General y en los archivos distritales regionales:\nI.- Todos los expedientes del orden civil, mercantil, de lo familiar, penal y de adolescentes totalmente concluidos, tanto por el Tribunal Superior de Justicia como por los Tribunales Distritales, del Tribunal de Apelación Especializado en materia de Adolescentes, Juzgados de Primera\nInstancia y demás órganos jurisdiccionales.\nII.- Los expedientes aún no concluidos en los que haya habido inactividad procesal de las partes por más de un año;\nIII.- Cualesquiera otros expedientes concluidos que conforme a la ley deban integrarse por el\nTribunal Superior y cuya remisión o entrega no haya de hacerse a oficina determinada, o a los interesados; y\nIV.- Los demás documentos y objetos que las leyes y el Tribunal Superior determinen.\nARTÍCULO 133. Habrá en el Archivo seis departamentos: uno de ellos corresponderá al ramo civil, otro al mercantil, otro al familiar, otro a adolescentes, otro al penal y otro al administrativo.\nARTICULO 134.- Las dependencias a que se refiere este capítulo, remitirán al archivo los expedientes respectivos para su resguardo; llevarán un libro en el cual harán constar, en forma de inventario, los expedientes que contengan cada remisión y al calce del inventario firmará de recibo el Jefe del Archivo.\nARTICULO 135.- Los expedientes y documentos entregados al Archivo serán anotados en un libro general de entrada y en otro que se llevará por orden alfabético, marcándoseles con sello de la oficina y arreglándolos convenientemente para que no sufran deterioro. Se clasificarán y depositarán según el departamento a que correspondan, controlándose además mediante el sistema de tarjetas índices.\nARTICULO 136.- Por ningún motivo se extraerá expediente o documento alguno del Archivo\nJudicial, a no ser por orden escrita del presidente del Tribunal, o cuando medie solicitud de la autoridad que lo haya remitido a la oficina, o de la que legalmente la sustituya.\nLa orden se clasificará en el lugar que ocupe el expediente extraído, y el conocimiento respectivo de salida de éste será suscrito por persona legalmente autorizada para recibirlo.\nARTICULO 137.- El Jefe del Archivo puede expedir previo acuerdo del presidente del Tribunal o de la autoridad remisora, copia certificada de los documentos o expedientes que estén depositados en dicha oficina.\nARTICULO 138.- El examen de libros, documentos o expedientes del Archivo, sólo podrán hacerse dentro de la oficina y en presencia del Jefe de la misma, por los interesados o sus procuradores, o por cualquier abogado con título oficial.\nSerá motivo de responsabilidad para el Jefe del Archivo impedir el examen a que se refiere este artículo, y la sanción respectiva será impuesta por el Presidente del Tribunal Superior de Justicia.\nARTICULO 139.- La omisión en que incurran los secretarios por no remitir los expedientes al\nArchivo, será sancionada por el presidente del Tribunal, al recibir el informe del visitador.\nARTICULO 140.- Cualquier defecto o irregularidad que advierta el jefe del archivo en los expedientes o documentos que se le remitan para su depósito, lo comunicará al Presidente del\nTribunal.\nCAPITULO II\nDEL INSTITUTO DE ESPECIALIZACION JUDICIAL\nARTICULO 141.- Se crea el Instituto de Especialización Judicial con el propósito de preparar y iguales o análogas, se dará preferencia a quién haya cursado y aprobado en el Instituto disciplinas relacionadas con el escalafón o con la materia del cargo que corresponda. A menos que quien no lo haya hecho acredite haber aprobado otras análogas, o cursado un grado académico superior al de Licenciado en Derecho, relacionado con la materia del cargo al que pretende acceder.\nARTICULO 142.- La Dirección del Instituto de Especialización Judicial, estará a cargo de la persona que designe Consejo de la Judicatura.\nEl Instituto tendrá un Consejo Académico, integrado por el Presidente del Tribunal Superior de\nJusticia, quien lo presidirá, un Magistrado de cada Sala del Tribunal, un Magistrado del Tribunal\nElectoral, un Magistrado del Tribunal de lo Contencioso-Administrativo, un Magistrado del Tribunal de Conciliación y Arbitraje, el Magistrado del Tribunal de Apelación Especializado en materia de\nAdolescentes, el Magistrado del Tribunal Distrital del Primer Distrito, un Juez de Primera Instancia de cada materia de la Capital del Estado y un Juez Letrado del Distrito Judicial de Saltillo.\nEl Consejo Académico será un órgano consultivo que tendrá como función principal la evaluación y autorización de los planes y programas de estudios que proponga el director del Instituto.\n(REFORMADO, P.O. 5 DE DICIEMBRE DE 1997)\nARTICULO 143.- La organización interna y el funcionamiento, los programas y planes de estudios; los requisitos de ingresos y sistemas de evaluación, serán precisados en el estatuto que expida el\nConsejo de la Judicatura oyendo la opinión del Consejo del Instituto de Especialización Judicial.\nCAPITULO III\nDE LA BIBLIOTECA\nARTICULO 144.- El Tribunal Superior de Justicia, contará con servicio de biblioteca, en los términos que disponga el reglamento interior.\n(REFORMADO, P.O. 5 DE DICIEMBRE DE 1997)\nARTICULO 145.- La Dirección de la biblioteca estará a cargo de un bibliotecario, quien será nombrado por el Presidente del Tribunal.\nARTICULO 146.- Corresponde al bibliotecario:\nI.- Formar un inventario alfabético por autores de todos los libros y papeles de la biblioteca y un inventario general de muebles y útiles de dicha dependencia;\nII.- Clasificar las obras de biblioteca conforme al sistema adoptado por el Tribunal Superior de\nJusticia.\nIII.- Formar cada semestre una relación de obras para su adquisición y de las que requieran encuadernación, enviándola al Presidente del Tribunal con el presupuesto respectivo;\nIV.- Conservar en buen estado los libros y papeles que integran, así como los muebles y útiles de la misma, dando cuenta de los desperfectos que sufran;\nV.- Llevar una relación diaria de lectores para fines de estadística; y\nVI.- Las demás que señalen las leyes y los reglamentos respectivos.\nCAPITULO IV\nSECCION PRIMERA\nDE LA ADMINISTRACION DEL FONDO\nARTICULO 147.- La Oficina del Fondo para el Mejoramiento de la Administración de Justicia estará integrada por: aplicación a los fines a los que los términos de la presente ley esta destinada.\nARTICULO 148.- El patrimonio del fondo para el Mejoramiento de la Administración de Justicia se integrará con:\nI.- Las multas, fianzas y cauciones que las autoridades judiciales hagan efectivas, las cuales serán remitidas al Fondo;\nII.- El monto de la reparación del daño, cuando la parte ofendida se niegue o renuncie a recibir su importe o no se presente persona alguna que justifique su derecho a recibirlo en el término de tres años;\nIII.- Los intereses provenientes de cualquier tipo de depósito que entreguen al Fondo las autoridades judiciales del Estado; y\nIV.- En general los ingresos que se produzcan por la administración de valores o por cualquier otra prestación autorizada en la Ley.\n(REFORMADO, P.O. 5 DE DICIEMBRE DE 1997)\nARTICULO 149.- En auxilio del Consejo de la Judicatura y para el mejor cumplimiento de la administración del fondo para el mejoramiento de la administración de justicia que esta ley encomienda al Presidente del Tribunal, éste contará con un administrador, que deberá ser perito en ciencias administrativas, y quien tendrá a su cargo, ilustrativa pero no limitativamente las siguientes funciones:\nI.- La contabilización de la documentación relativa al Fondo;\nII.- El manejo de los fondos recibidos de las autoridades judiciales por conceptos de fianzas, multas o cauciones;\nIII.- Elaborar informes semestrales acerca de la posición financiera que guarde el Fondo durante el período comprendido de 1° de enero al 30 de junio y del 1° de julio al 31 de diciembre de cada año; y\nIV.- Colaborar con la administración del Tribunal Superior de Justicia en las actividades que el\nPleno, el Presidente del Tribunal o el Reglamento Interior, le asignen con relación a las funciones propias de su competencia.\nARTICULO 150.- La administración del fondo estará a cargo del Consejo de la Judicatura por conducto de su Presidente, debiendo invertirse en la adquisición de títulos valores de renta fija, que\nARTICULO 151.- El Presidente del Tribunal ordenará que se practique una auditoría, que cuando menos deberá ser anual, para verificar el manejo del fondo. Dicha auditoría se practicará por quien designe el Consejo de la Judicatura a propuesta de su Presidente.\nSECCION SEGUNDA\nJUSTICIA\nARTICULO 152.- El patrimonio del Fondo se destinará:\nI.- A sufragar los gastos que origine su administración;\nII.- A la adquisición de los bienes materiales requeridos para la administración de justicia;\nIII.- A la capacitación y mejoramiento profesional de los integrantes del Poder Judicial;\n(REFORMADA, P.O. 5 DE DICIEMBRE DE 1997)\nIV.- A sufragar los gastos necesarios para la participación de magistrados, integrantes del Consejo de la Judicatura, jueces, y demás personal que estime conveniente, en congresos, seminarios y reuniones que tengan por objeto evaluaciones, encuentros y mejoramiento de la Administración de\nJusticia;\nV.- Sufragar los gastos que por estímulo y recompensas se entreguen a los funcionarios y empleados del Poder Judicial; y\nVI.- Los demás objetivos que se acuerden por el Pleno.\nCAPITULO V\nDEL BOLETIN DE INFORMACION JUDICIAL\nARTICULO 153.- Se publicará semestralmente un Boletín de Información Judicial, como órgano del Poder Judicial del Estado, que tendrá por objeto dar a conocer:\nI.- Los fallos sobresalientes que sobre cualquier materia se pronuncien por los diversos tribunales del Estado;\nII.- Monografías sobre investigaciones jurídicas;\nIII.- Informes de la Presidencia; y\nARTÍCULO 154. El Consejo Editorial del Boletín se integrará con el Presidente del Tribunal, quien fungirá como Director, los Magistrados de las Salas, un Magistrado del Tribunal Electoral, un\nMagistrado del Tribunal de lo Contencioso-Administrativo, un Magistrado del Tribunal de\nConciliación y Arbitraje, el Magistrado del Tribunal de Apelación Especializado en materia de\nAdolescentes, el Magistrado del Tribunal Distrital del Primer Distrito, un Juez de Primera Instancia en cada materia, un Secretario de Redacción y un administrador, que será el Oficial Mayor del\nLa designación del Magistrado del Tribunal Distrital, de los Jueces y del Secretario de Redacción lo hará el Pleno del Tribunal, cada tres años.\nARTICULO 155.- En todo lo relativo a la Administración del Boletín, el Consejo Editorial tendrá las más amplias facultades, tanto para el manejo y aplicación de los ingresos que se obtengan, así como para la designación y remoción del personal administrativo.\nCAPITULO VI\nDE LAS OFICINAS DE PERSONAL E INTENDENCIA\nARTICULO 156.- La oficina de personal estará a cargo de un jefe que dependerá de la Oficialía\nMayor y tendrá las atribuciones que ésta le asigne, por acuerdo del presidente del Pleno.\n(FE DE ERRATAS, P.O. 5, MARTES 15 DE ENERO DE 1991)\nARTICULO 157.- El cuidado, vigilancia, aseo y limpieza del edificio que ocupa el Tribunal, así como de los muebles y útiles de servicio de las oficinas respectivas, estarán directamente a cargo de los vigilantes e intendentes que sean necesarios.\nTITULO OCTAVO\nDE LAS AUSENCIAS TEMPORALES Y ABSOLUTAS EN EL DESEMPEÑO DE LOS CARGOS\nCAPITULO I\nDE LOS PERMISOS, LICENCIAS Y VACACIONES\n(REFORMADO, P.O. 28 DE DICIEMBRE DE 2007)\nARTICULO 158.- Los servidores públicos de la Administración de Justicia tienen derecho a que se les otorguen permisos con goce de sueldo por enfermedad, hasta el límite de la incapacidad que precise el certificado médico oficial, o por causa justificada, a juicio de quien lo conceda, hasta por quince días.\nARTICULO 159.- Los servidores públicos de la administración de justicia tienen derecho a licencia no remunerada, hasta por seis meses en el año, teniendo ésta el carácter de irrenunciable.\nARTICULO 160.- Los permisos y las licencias serán concedidos por el superior jerárquico del solicitante.\nARTICULO 161.- En la época que determinen el Pleno del Tribunal Superior de Justicia y el\nConsejo de la Judicatura en la esfera de sus competencias, los magistrados, jueces, secretarios, actuarios y demás servidores de la administración de justicia, disfrutarán anualmente de dos períodos de vacaciones de diez días hábiles cada uno. necesidades del servicio y en los términos de la Ley de la materia.\nCAPITULO II\nDE LA INSUBSISTENCIA, SUSPENSION Y PERDIDA DEL ENCARGO\nARTICULO 162.- La designación hecha para ocupar un cargo en la administración de justicia queda insubsistente:\nI.- Por la no aceptación; y\nII.- Por no presentarse la persona nombrada a rendir la protesta de Ley.\nARTICULO 163.- La suspensión en el desempeño del cargo puede tener lugar:\nI.- Por sujeción a juicio político, penal o administrativo del titular, en los términos del Título Décimo de esta Ley o de la Ley de responsabilidades de los servidores públicos del Estado; y\nII.- Por sanciones impuestas por autoridad competente.\nARTICULO 164.- El encargo se pierde:\nI.- Por renuncia aceptada;\nII.- Por ejercer otro cargo público, incompatible con el que se viene desempeñando;\nIII.- Por no presentarse a reanudar su función, vencido el término del permiso o licencia concedidos; y\nIV.- Por destitución, mediante resolución firme.\nTITULO NOVENO\nDEL PROCEDIMIENTO PARA SUPLIR LAS FALTAS TEMPORALES Y ABSOLUTAS DE LOS\nSERVIDORES PUBLICOS DE LA ADMINISTRACION DE JUSTICIA\n(REFORMADO, P.O. 5 DE DICIEMBRE DE 1997)\nARTICULO 165.- Las faltas temporales de los Presidentes del Tribunal y de las Salas, cuando no excedan de treinta días, serán suplidas por el magistrado decano correspondiente.\nSi la ausencia excede de treinta días, la sustitución se hará por acuerdo del Pleno, y en igual forma se suplirá la ausencia definitiva, en cuyo caso el designado concluirá el período legal respectivo.\n(REFORMADO PRIMER PÁRRAFO, P.O. 28 DE DICIEMBRE DE 2007)\nARTÍCULO 166. Las faltas temporales y absolutas de los Magistrados del Tribunal Superior de\nJusticia, del Tribunal Electoral, del Tribunal de lo Contencioso-Administrativo y del Tribunal de\nConciliación y Arbitraje, serán suplidas por el Magistrado Supernumerario que corresponda, en el orden respectivo y de acuerdo con el turno que lleve el Presidente del Tribunal de que se trate. En caso de falta absoluta, el Magistrado Supernumerario actuará hasta en tanto se realice la nueva designación, para lo cual el Presidente del órgano colegiado de que se trate, inmediatamente que aquella ocurra, dará cuenta al Consejo de la Judicatura quien atenderá al procedimiento establecido en esta ley. adolescentes.\nARTICULO 167.- Las faltas temporales de los Magistrados de los Tribunales Unitarios de Distrito, de los Jueces de Primera Instancia y de los Jueces Letrados, serán suplidas por los respectivos\nSecretarios de Acuerdo y Trámite que corresponda. Si las faltas exceden de quince días o son absolutas, continuarán los secretarios supliendo a los titulares en tanto se hace nueva designación interina o definitiva, según el caso. temporales, que no excedan de un mes, en la forma que para el efecto determine el Magistrado del\nTribunal de Apelación Especializado en materia de Adolescentes.\n(REFORMADO PRIMER PÁRRAFO, P.O. 28 DE DICIEMBRE DE 2007)\nARTICULO 168.- Las faltas temporales del Secretario del Pleno cuando no excedan de un mes quince días, serán suplidas en los términos que fije el reglamento interior.\nSi las faltas excedan del término a que se refiere el párrafo anterior, o son absolutas, motivarán la designación por el Pleno del Interino o definitivo que corresponda.\nARTICULO 169.- Las faltas temporales de los Secretarios de las Salas, cuando no excedan de quince días, serán suplidas por el Secretario de estudio y cuenta que corresponda conforme al turno que al efecto llevará la Presidencia de la propia Sala.\nSi la ausencia excede de quince días o es absoluta, se hará la designación del secretario interino o definitivo correspondiente.\n(REFORMADO, P.O. 16 DE NOVIEMBRE DE 2001)\nARTICULO 170.- Las faltas temporales de los Secretarios de los Juzgados de Primera Instancia y\nLetrados serán suplidas por el Secretario de Estudio y Cuenta si lo hay, en caso contrario por el\nActuario de mayor antigüedad.\n(ADICIONADO P.O. 1 DE SEPTIEMBRE DE 2006)\nLos Secretarios, Actuarios y demás personal del Juzgado de Primera Instancia en materia de\nAdolescentes serán suplidos en sus ausencias temporales, que no excedan de un mes, en la forma que determine el titular del propio juzgado.\nARTICULO 171.- (DEROGADO, P.O. 20 DE MARZO DE 2001)\nTITULO DECIMO\nDE LA RESPONSABILIDAD DE LOS SERVIDORES PUBLICOS DE LA ADMINISTRACION DE\nJUSTICIA\nCAPITULO I\nDISPOSICIONES GENERALES\nARTÍCULO 172. Para los efectos de las responsabilidades a que se refiere este título se reputarán como servidores públicos de la administración de justicia: a los Magistrados del Tribunal Superior de Justicia; a los Magistrados del Tribunal Electoral; a los Magistrados del Tribunal de lo\nContencioso-Administrativo; a los Magistrados del Tribunal de Conciliación y Arbitraje; al\nMagistrado del Tribunal de Apelación Especializado en materia de Adolescentes, a los Magistrados de los Tribunales Distritales; a los Jueces de primera instancia; a los Jueces letrados; y en general a toda persona que desempeña un empleo, cargo o comisión de cualquier naturaleza dentro del\nARTICULO 173.- Los servidores públicos de la Administración de Justicia podrán ser sancionados cuando incurran en responsabilidad, de conformidad con las prevenciones siguientes:\nI.- Se les impondrá, mediante juicio político, las sanciones de destitución e inhabilitación para desempeñar funciones, empleos, cargos o comisiones de cualquier naturaleza en el servicio público, cuando en el ejercicio de sus funciones incurran en actos u omisiones que redunden en perjuicio de los intereses públicos fundamentales, o de su buen desempeño;\nII.- La comisión de delitos será sancionada con arreglo a la legislación penal; y\nIII.- Se aplicarán sanciones administrativas por los actos u omisiones que afecten la legalidad, honradez, lealtad, imparcialidad y eficiencia, que deban observar en el desempeño de su empleo, cargo o comisión.\nLos procedimientos para la aplicación de las sanciones mencionadas serán autónomos en su desarrollo, sin que puedan imponer dos veces, por una sola conducta, sanciones de la misma naturaleza.\n(REFORMADO, P.O. 1 DE SEPTIEMBRE DE 2006)\nARTÍCULO 174.- Cuando los titulares de los órganos jurisdiccionales, con motivo de sus funciones, adviertan que algún servidor de la administración de justicia incurrió en alguna de las responsabilidades previstas en el artículo anterior, deberán hacerlo del conocimiento del Consejo de la Judicatura para que proceda conforme a los ordenamientos legales aplicables.\nTodo ciudadano o persona moral por conducto de sus órganos de representación, bajo su responsabilidad, podrá formular denuncia por escrito ante quien corresponda, respecto de las conductas a que se refiere el artículo anterior, anunciando las pruebas en las que sustente dicha denuncia.\nCAPITULO II\nDEL JUICIO POLITICO\n(REFORMADO, P.O. 28 DE DICIEMBRE DE 2007)\nARTÍCULO 175. Son sujetos de juicio político: los Magistrados del Tribunal Superior de Justicia; los Magistrados del Tribunal Electoral; los Magistrados del Tribunal de lo ContenciosoAdministrativo; los Magistrados del Tribunal de Conciliación y Arbitraje, el Magistrado del Tribunal de Apelación Especializado en materia de Adolescentes, los Magistrados de los Tribunales\nDistritales; y los Jueces de Primera Instancia, cualquiera que sea su denominación.\n(FE DE ERRATAS, P.O. 5, MARTES 15 DE ENERO DE 1991)\nARTICULO 176.- Corresponde al Congreso del Estado, instruir el procedimiento relativo al juicio político, por las causas y con formalidades establecidas por la Ley de Responsabilidades de los\nServidores Públicos Estatales y Municipales del Estado, así como imponer, en su caso, las sanciones que juzgue aplicables de acuerdo con la misma Ley.\nARTICULO 177.- El procedimiento de juicio político sólo podrá iniciarse durante el período en que el servidor público desempeñe su cargo y dentro del año siguiente a él que se separe, por cualquier causa, del ejercicio de sus funciones. Las sanciones correspondientes se aplicarán en un período no mayor de un año, a partir de iniciado el procedimiento.\nCAPITULO III\nARTÍCULO 178. Para proceder penalmente contra los Magistrados del Tribunal Superior de\nJusticia, del Tribunal Electoral, del Tribunal de lo Contencioso-Administrativo o del Tribunal de\nConciliación y Arbitraje, por la comisión de delitos durante el tiempo de su encargo, el Congreso del\nEstado deberá declarar, mediante resolución de las dos terceras partes del total de sus miembros, si ha lugar o no a proceder contra el inculpado.\nARTICULO 179.- La responsabilidad derivada de delitos cometidos por los magistrados durante el tiempo de su encargo, será exigible de acuerdo con los plazos de prescripción consignados en el prescripción en tanto el magistrado se encuentre en el desempeño de su cargo.\nCAPITULO IV\nDE LA RESPONSABILIDAD ADMINISTRATIVA\nSECCION PRIMERA\nDE LOS SUJETOS\nARTICULO 180.- Son sujetos de responsabilidad administrativa todos los miembros del Poder\nJudicial, cualquiera que sea su jerarquía.\nARTICULO 181.- (DEROGADO, P.O. 16 DE NOVIEMBRE DE 2001)\nARTICULO 182.- La acción disciplinaria prescribe en tres años, contados desde el día siguiente a aquel en que se hubiere cometido la falta, o a partir del momento en que hubiese cesado, si fuere de carácter continuado. La iniciación del procedimiento interrumpe la prescripción.\nSECCION SEGUNDA\nDE LAS FALTAS ADMINISTRATIVAS\nARTICULO 183.- Se consideran como faltas de los Magistrados en su actuación relacionada con el Pleno, las siguientes:\nI.- Dejar de asistir a las sesiones sin causa justificada;\nII.- Desintegrar sin motivo justificado, el quórum de los Plenos, una vez comenzados;\nIII.- Dictar acuerdos o providencias que contengan decisiones generales sobre interpretación de las leyes;\nIV.- Llevar a su conocimiento los negocios en trámite ante los Tribunales Unitarios de Distrito, Jueces de Primera Instancia y demás órganos jurisdiccionales, a menos que se trate de una investigación; y\nV.- Violar las normas que regulan el procedimiento para llevar a cabo los nombramientos que le competan.\nARTÍCULO 184.- Son faltas administrativas de los magistrados y jueces:\nI. Hacer constar falsamente en una diligencia judicial hechos no acaecidos o dejar de mencionar los ocurridos, cuando en ambos casos se actúe de manera dolosa;\nII. Asesorar a las partes en asuntos de su conocimiento o del conocimiento de otras autoridades judiciales;\nIII. No fundar ni motivar sus resoluciones habitualmente;\nIV. Dictar resoluciones o efectuar trámites notoriamente innecesarios que tengan como consecuencia la dilación del procedimiento;\nV. Actuar en negocios en que estuvieren impedidos, conociendo la causa del impedimento;\nVI. Impedir, por cualquier medio ilegal, que las partes hagan uso de los recursos establecidos en la ley;\nVII. Hacer en sus resoluciones calificaciones ofensivas o calumniosas, en perjuicio de las personas que intervienen en el proceso;\nVIII. Dictar, sin causa justificada, las resoluciones que procedan en los negocios de su conocimiento, fuera de los términos señalados por la Ley, u omitir su pronunciamiento;\nIX. No rechazar de plano incidentes, promociones o recursos manifiestamente improcedentes;\nX. Hacer declaración de rebeldía en perjuicio de alguna de las partes, sin cerciorarse de su legal emplazamiento, o antes de que expire el término establecido por la ley;\nXI. No admitir o recibir, injustificadamente, las pruebas a las partes, o admitir las notoriamente inconducentes o impertinentes;\nXII. Fijar fianzas y contrafianzas notoriamente excesivas o insuficientes, en los casos que prescriban las leyes, así como admitir las de personas que no acrediten su solvencia; y\nXIII. Dejar de asistir, sin justa causa, a los actos o diligencias que requieran su presencia.\nLas faltas a que se refiere este artículo serán sancionadas conforme a las disposiciones previstas en los artículos 196 y 198 de esta ley.\n(REFORMADO, P.O. 1 DE SEPTIEMBRE DE 2006)\nARTÍCULO 185.- Son faltas administrativas de los secretarios:\nI. Actuar con negligencia en la custodia de los expedientes y documentos de su dependencia; propiciando su deterioro, destrucción, ocultamiento, sustracción o pérdida;\nII. Actuar en los negocios en que estuvieren impedidos, conociendo el impedimento;\nIII. Omitir entregar oportunamente a los Actuarios los expedientes que requieran notificación personal, o estén pendientes de diligenciación, cuando deba actuarse fuera del Juzgado;\nIV. Omitir dar cuenta, dentro de los términos legales, con los documentos oficiales, así como con las promociones de las partes;\nV. Dejar de asentar en autos dentro del término legal, las certificaciones y constancias que procedan por disposición de la Ley o por mandato judicial;\nVI. Omitir formular el proyecto de resolución que se les hubiere encomendado, en el término fijado para ello;\nVII. Facilitar expedientes a quienes no cuenten con la debida autorización u omitir mostrarlos a las partes, sin motivo justificado; y en los artículos 196 y 198 de esta ley.\nARTÍCULO 186.- Son faltas de los actuarios:\nI. Redactar indebida o maliciosamente las notificaciones, emplazamientos, embargos o diligencias de cualquier género que deban realizar;\nII. Practicar embargos, aseguramientos, retención de bienes o lanzamientos, de personas o corporaciones, que no estén mencionadas concretamente en la resolución que se cumplimenta, o cuando en el acto de la diligencia, se le haga ver que esos bienes son ajenos, en cuyo caso deberá agregar a los autos la documentación que se le presente y dar cuenta al juez;\nIII. Omitir realizar, con la debida oportunidad y sin causa justificada, las notificaciones personales que procedan, o dejar de llevar a cabo las diligencias que se les encomienden, cuando deban efectuarse fuera del juzgado o tribunal;\nIV. Practicar notificaciones, citaciones o emplazamientos a las partes, por cédula o instructivo, fuera del lugar designado en autos, o sin cerciorarse, cuando proceda, de que el interesado tiene su domicilio en el lugar donde se lleva a cabo la diligencia;\nV. Recibir gratificaciones por el desempeño de su función, que no sea lo estrictamente necesario para su traslado al lugar en que deba efectuarse la diligencia; y\nVI. Omitir levantar el acta relativa a la diligencia que practique, en el lugar y momento en que ésta se efectúe.\nLas faltas a que se refiere este artículo serán sancionadas conforme a las disposiciones previstas en los artículos 196 y 198 de esta ley.\n(REFORMADO, P.O. 1 DE SEPTIEMBRE DE 2006)\nARTÍCULO 187.- Son faltas administrativas de los servidores públicos de base:\nI. Dejar de observar el debido respeto y subordinación legítima hacia sus superiores jerárquicos inmediatos o mediatos;\nII. Incumplir con las disposiciones que sus superiores jerárquicos dicten en el ejercicio de sus atribuciones;\nIII. Actuar con negligencia en el cumplimiento de las instrucciones, requerimientos o trabajos que les sean encomendados;\nIV. Recibir gratificaciones por copias de actuaciones que excedan del valor que, por hoja, haya fijado la Oficialía Mayor del Tribunal; y\nV. Realizar trabajos ajenos a su función en el horario de labores. en los artículos 196 y 198 de esta ley.\nARTÍCULO 188.- Constituyen faltas administrativas comunes a todos los servidores públicos de la administración de Justicia, además de las previstas en la Ley de Responsabilidades de los\nServidores Públicos Estatales y Municipales del Estado de Coahuila de Zaragoza, en lo relativo, las siguientes:\nI. Realizar conductas contra la independencia e imparcialidad de la función judicial, tales como aceptar o ejercer consignas, presiones, encargos o comisiones, o cualquier acción que genere o implique subordinación respecto de alguna persona, del mismo u otro poder;\nII. Solicitar o recibir dádivas, préstamos, regalos y obtener toda clase de percepciones provenientes, directa o indirectamente, de alguna de las partes o de sus representantes o intermediarios, en negocios sometidos a su conocimiento, o en los que haya de intervenir;\nIII. Obtener o tratar de obtener por el desempeño de su función, beneficios adicionales a las prestaciones que le sean cubiertas con cargo al erario público;\nIV. Ejercer funciones de un empleo, cargo o comisión cuando goce de licencia, haya sido suspendido o hubiere concluido el período para el cual se le designó, o se le haya separado por alguna otra causa del ejercicio de sus funciones;\nV. Embriagarse habitualmente; hacer uso indebido de estupefacientes o psicotrópicos; practicar juegos prohibidos; incurrir en acoso sexual; o realizar cualquier otro comportamiento inmoral con motivo del ejercicio de sus funciones;\nVI. Expedir nombramiento en favor de quien haya sido destituido o se encuentre inhabilitado por resolución firme de autoridad competente;\nVII. Desempeñar algún otro empleo, cargo o comisión oficial o particular, que la ley prohíba;\nVIII. Desempeñar en forma negligente o deficiente los trabajos propios de sus funciones o los relacionados con éstas, que le sean encomendados;\nIX. Influir, directa o indirectamente, en el nombramiento, promociones, suspensión, remoción, cese o sanción de cualquier servidor público de la administración de justicia, ya sea por interés personal, familiar o de negocios, o porque con ello pretenda derivar alguna ventaja o beneficio para sí o para un tercero;\nX. Emitir opinión pública que implique prejuzgar sobre un asunto de su conocimiento;\nXI. Proporcionar información telefónica, por escrito, o por cualquier otro medio a los interesados sobre el estado de los autos;\nXII. Abstenerse de cumplir las comisiones que legalmente se les confieran o retardar injustificadamente su ejecución;\nXIII. Dejar de asistir sin motivo justificado al despacho de su oficina o limitar indebidamente las horas de trabajo, así como dejar de desempeñar las funciones o las labores que tenga a su cargo;\nXIV. Autorizar a un subordinado a no asistir a sus labores sin causa justificada, así como otorgarle indebidamente permisos, licencias o comisiones con goce parcial o total de sueldo;\nXV. Dejar de observar la debida consideración que se deben entre sí los servidores públicos de la administración de justicia, independientemente de su jerarquía;\nXVI. Realizar actos ajenos a sus funciones u omitir los que le son propios con motivo de ellas, en el desempeño de su empleo, cargo o comisión;\nXVII. No atender con la debida corrección a los litigantes y al público en general; y\nXVIII. Todo incumplimiento de los deberes y funciones propios del cargo, previstos en éste y otros ordenamientos legales. en los artículos 196 y 198 de esta ley.\nSECCION TERCERA\nDE LAS SANCIONES\nARTICULO 189.- Las sanciones aplicables a las faltas administrativas consistirán en:\nI.- Apercibimiento;\nII.- Amonestación;\nIII.- Multa;\nIV.- Suspensión;\nV.- Destitución del cargo; y\nVI.- Inhabilitación temporal para desempeñar empleo, cargo o comisión en el servicio público.\nARTICULO 190.- El apercibimiento consiste en la prevención verbal o escrita que se haga al servidor público, en el sentido de que de incurrir en nueva falta, se le aplicarán una o más de las sanciones previstas en el artículo anterior, según el caso.\nARTICULO 191.- La amonestación consiste en la reprensión que se haga al infractor, por la falta cometida.\nARTICULO 192.- La multa consiste en la sanción pecuniaria impuesta al infractor en favor del\nEstado, la cual no podrá ser inferior al valor de tres días de sueldo, ni exceder al de un mes, debiendo hacerse efectiva mediante descuento en nómina, de cuotas iguales, no superiores a la quinta parte del sueldo mensual, o a través del procedimiento económico-coactivo, con intervención de la autoridad competente.\nARTICULO 193.- La suspensión consiste en la separación temporal, que no podrá exceder de tres meses, del cargo, empleo o comisión, privando al servidor público del derecho a percibir remuneración, o cualesquiera otras prestaciones económicas a que tenga derecho.\nARTICULO 194.- La destitución consiste en la pérdida definitiva del cargo, empleo o comisión.\nARTICULO 195.- La inhabilitación implica la incapacidad temporal, hasta por diez años para obtener y ejercer cargo, empleo o comisión.\nARTICULO 196.- Las faltas administrativas serán muy graves, graves y no graves.\nPara calificar la falta e imponer la sanción correspondiente, la autoridad disciplinaria atenderá a lo previsto por el artículo 198 de esta ley, y analizará los siguientes indicadores:\nI. La modalidad de la falta en que se haya incurrido;\nII. El grado de participación;\nIII. Los motivos determinantes y los medios de ejecución;\nIV. La antigüedad en el servicio;\nV. La reincidencia;\nVI. El monto del beneficio, daño o perjuicio económico derivados de la falta; y\nVII. El grado de afectación a la administración de justicia.\nARTICULO 197.- Las sanciones impuestas se anotarán en la hoja de servicios del servidor público, a cuyo efecto deberá enviarse copia autorizada de la resolución relativa a la Oficialía Mayor del\nPoder Judicial.\n(REFORMADO, P.O. 1 DE SEPTIEMBRE DE 2006)\nARTÍCULO 198. Para la aplicación de las sanciones por faltas administrativas, además de lo previsto en los artículos precedentes, se observarán las reglas siguientes:\nI. Las faltas muy graves darán lugar a la destitución, independientemente de las sanciones que correspondan conforme a otros ordenamientos aplicables. Serán faltas muy graves las previstas en las fracciones I y II del artículo 184; I del artículo 185; I y II del artículo 186; y I a V del artículo 188 de esta ley, además de las que en cada caso considere la autoridad disciplinaria, conforme a los indicadores a que se refiere el artículo 196 de esta ley;\nII. Las faltas graves darán lugar a la suspensión, independientemente de las sanciones que correspondan conforme a otros ordenamientos aplicables. Serán faltas graves las contenidas en las fracciones III a VII del artículo 184; II y III del artículo 185; III a V del artículo 186; I del artículo\n187; y VI a VIII del artículo 188, además de las que en cada caso considere la autoridad disciplinaria, conforme a los indicadores a que se refiere el artículo 196 de esta ley;\nIII. Las faltas no graves ameritarán apercibimiento o amonestación a criterio de la autoridad disciplinaria, conforme a los indicadores a que se refiere el artículo 196 de esta ley;\nIV. La multa podrá aplicarse como sanción autónoma, con independencia de la calificación de la falta; y en forma conjunta con otras sanciones;\nV. La reincidencia en falta no grave, dará motivo a la suspensión. La reiteración por más de dos ocasiones en faltas no graves o la reincidencia por falta grave, dará lugar a la destitución; y\nVI. La inhabilitación sólo será aplicable por resolución jurisdiccional, que dictará el órgano que corresponda, con arreglo a las leyes aplicables.\nCuando la destitución del empleo, cargo o comisión, afecte a un servidor público de base, se\nJudicial del Estado, a solicitud de la autoridad que aplicó la sanción.\nSECCION CUARTA\nARTICULO 199.- La jurisdicción disciplinaria, se ejercerá en única instancia:\nI.- Por el Tribunal Pleno, cuando se trate de quejas en contra de su Presidente o de los magistrados de las Salas;\nII. Por el Consejo de la Judicatura, cuando se trate de quejas en contra de los servidores públicos judiciales integrantes de las Salas del Tribunal Superior de Justicia, del Tribunal Electoral, del\nTribunal de lo Contencioso-Administrativo, del Tribunal de Conciliación y Arbitraje, del Tribunal de\nApelación Especializado en materia de Adolescentes, de los Tribunales Distritales y de los\nJuzgados del Poder Judicial;\nIII.- Por el Presidente del Tribunal Superior de Justicia, cuando se trate de quejas en contra de personal de la Presidencia o de sus dependencias;\nIV. (DEROGADA, P.O. 28 DE DICIEMBRE DE 2007)\n(REFORMADA, P.O. 28 DE DICIEMBRE DE 2007)\nV.- Por los magistrados y jueces, cuando se trate de quejas contra el personal administrativo, debiendo instruir el procedimiento en los términos previstos por esta ley. Únicamente se emitirá resolución cuando la falta amerite apercibimiento o amonestación.\n(ADICIONADO, P.O. 28 DE DICIEMBRE DE 2007)\nSi del estudio de autos aparece que la sanción a imponer debe ser mayor que las señaladas en el párrafo anterior, remitirá el expediente al Consejo de la Judicatura para que emita la resolución correspondiente.\n(DEROGADO, P.O. 28 DE DICIEMBRE DE 2007)\n(REFORMADO, P.O. 16 DE NOVIEMBRE DE 2001)\nEn el supuesto de la fracción II de este artículo, el Consejo de la Judicatura podrá comisionar a uno de sus integrantes para la instrucción del procedimiento y formulación del proyecto de resolución que corresponda, y actuará asistido del secretario del propio Consejo.\n(REFORMADO, P.O. 16 DE NOVIEMBRE DE 2001)\nARTICULO 200.- Contra el presunto autor de alguna de las faltas previstas en la Sección Segunda de este Capítulo, se procederá de oficio o en virtud de queja presentada por escrito o comparecencia, ante la autoridad que corresponda, en los términos del artículo anterior.\nToda queja o la iniciación oficiosa del procedimiento, será improcedente cuando se trate de resoluciones de naturaleza estrictamente jurisdiccional, a menos que se pronuncien en contra de criterio jurisprudencial o precepto legal claro y terminante, aplicable al caso de que se trate.\nCuando a quien se atribuya la falta, por cualquier motivo deje definitivamente el cargo, el procedimiento se declarará sin materia, cualquiera que sea el estado en que se encuentre.\nARTICULO 201.- Todos los servidores públicos tiene la obligación de respetar y hacer respetar el derecho a la formulación de quejas, y de evitar que, con motivo de éstas, se originen molestias indebidas al quejoso.\nIncurre en responsabilidad el servidor público que por sí, o por interpósita persona, empleando cualquier medio, impida la presentación de alguna queja, o que con motivo de ésta, realice cualquier acto u omisión que lesione injustamente los intereses de quien la formule.\nARTICULO 202.- El Presidente del Tribunal Superior de Justicia, a petición de parte interesada, procedimiento disciplinario. La persistencia en la omisión o retardo, será considerada falta grave y de ella conocerá directamente el Consejo de la Judicatura.\nARTICULO 203.- Si los hechos materia de la queja fueren además, constitutivos de responsabilidad política o penal, se ordenará ponerlos en conocimiento de la autoridad competente, acompañándole copia autorizada de lo necesario. La existencia, en su caso de un juicio político o penal sobre los mismos hechos, no dará lugar a suspensión de la jurisdicción disciplinaria.\nARTICULO 204.- El escrito de queja deberá contener:\nI. El nombre del quejoso y el domicilio para oír y recibir notificaciones, en el lugar en que se tramite el procedimiento disciplinario y, en su caso, la autorización a una persona de su confianza, preferentemente profesional del derecho, para que promueva y oiga notificaciones en su nombre.\nII. Datos suficientes para la identificación del servidor público judicial contra quien se interpone, así como el lugar donde desempeña su función.\nIII. Los hechos concretos y la conducta o conductas que se estimen constitutivos de la falta o faltas;\n(REFORMADA, P.O. 1 DE SEPTIEMBRE DE 2006)\nIV. Las pruebas o elementos de convicción suficientes con los que se estima acreditar la falta o faltas atribuidas al servidor público de que se trate, relacionándolas con los hechos que se le imputan; y en su caso acompañando los documentos que se ofrezcan con tal carácter o el escrito, con acuse de recibo, mediante el que se solicitaron a la autoridad correspondiente.\nSi la queja no reúne los requisitos a que se refieren las fracciones I y II de este artículo, se prevendrá al quejoso para que la aclare dentro de los tres días siguientes; de no subsanarse la falta de domicilio, todas las notificaciones se le harán por estrados, y la falta de identificación del servidor público judicial contra quien se presenta la queja, tendrá como consecuencia su improcedencia.\nSi la queja no reúne los requisitos de las fracciones III y IV de este artículo, será declarada improcedente.\n(REFORMADO, P.O. 16 DE NOVIEMBRE DE 2001)\nARTICULO 205.- Sólo producirá efectos la queja que sea ratificada ante la autoridad a quien competa conocer, quien le dará trámite, asignándole el número de identificación que corresponda y dará cuenta al superior para que resuelva si la misma reúne los requisitos legales de procedencia, a efecto de que pueda ser radicada e instaurado el procedimiento, en caso contrario será declarada improcedente.\nSon causas de improcedencia, cuando de los hechos o las pruebas que se presentan, se acredite que se trata de un asunto de carácter jurisdiccional; cuando se hubieren ejecutado actos queja; o cuando hubieren transcurrido tres años desde la fecha del acto que se estima causó agravio. fondo, la que podrá dictar en cualquier momento del procedimiento.\nARTICULO 206.- La imposición de las sanciones administrativas a que se refiere este capítulo, se hará conforme al procedimiento siguiente:\nI. Recibido el escrito de queja, se ordenará la correspondiente ratificación dentro de las setenta y dos horas que sigan a su presentación. Si el interesado no se presenta a ratificar su escrito en el plazo señalado, la queja se desechará de plano y no se podrá volver a presentar.\nII. La autoridad responsable de instruir el procedimiento disciplinario, si estima improcedente la queja, dictará o propondrá, según sea el caso, la resolución respectiva, la cual será notificada personalmente al quejoso. Para determinar la procedencia o improcedencia de la queja, la autoridad encargada de la instrucción del procedimiento disciplinario, podrá ordenar las diligencias que estime necesarias para mejor proveer.\n(REFORMADA, P.O. 1 DE SEPTIEMBRE DE 2006)\nIII.- Si no existe motivo de improcedencia, se dictará auto inicial del proceso disciplinario, en el que se ordenará correr traslado al probable responsable, con copia del escrito o del acta en la que conste la queja, para que dentro del término de cinco días rinda informe por escrito, acompañando las pruebas que a su derecho convenga.\n(ADICIONADA, P.O. 1 DE SEPTIEMBRE DE 2006)\nIV.- En el procedimiento disciplinario es admisible toda clase de pruebas, excepto la confesional por posiciones y las que fueren contra la moral o el derecho.\n(REFORMADA, P.O. 1 DE SEPTIEMBRE DE 2006)\nV.- Una vez recibido el informe o transcurrido el término a que se refiere la fracción III de este artículo, la autoridad disciplinaria admitirá las pruebas que procedan y ordenará su preparación, a efecto de que las mismas se reciban en la audiencia de pruebas y alegatos, que se fijará a más tardar dentro del término de quince días, debiendo citarse con toda oportunidad a los testigos y a los peritos que designen el juzgador y los interesados.\nVI. Abierta la audiencia se procederá a recibir, por su orden, las pruebas y los alegatos por escrito, esto último sin perjuicio de que los interesados puedan alegar verbalmente, sin que sus alegaciones se hagan constar en autos. En cualquier tiempo antes de fallar, podrá el juzgador decretar pruebas para mejor proveer.\nVII. Se levantará acta circunstanciada de las diligencias que se practiquen, mismas que suscribirán quienes en ellas intervengan. La inasistencia del quejoso, del servidor público o de ambos, no impedirá la celebración de la audiencia.\n(REFORMADA, P.O. 24 DE MAYO DE 2005)\nVIII. Concluida la audiencia, se pronunciará la resolución definitiva que proceda, en sesión posterior, cuando la autoridad competente sea el Consejo de la Judicatura. En los demás casos, la resolución se pronunciará dentro de los treinta días hábiles siguientes; en la que se resolverá sobre la procedencia de la queja, imponiendo al infractor, en su caso, las sanciones administrativas correspondientes, notificándosele personalmente a las partes la resolución, en breve término.\nEn lo no previsto en este artículo, se aplicará supletoriamente y en lo pertinente lo dispuesto en el\nCódigo de Procedimientos Penales del Estado.\nARTICULO 208.- En cualquier momento, antes o después de la iniciación del proceso disciplinario, se podrá acordar la suspensión temporal del presunto autor en su cargo, empleo o comisión, si a juicio de la autoridad instructora o resolutiva, así conviniere para el desarrollo de la investigación.\nLa suspensión temporal no prejuzga sobre la determinación final que se tome. Si el servidor público temporalmente suspendido, no resultare responsable de la falta que se le haya imputado, será restituido en el goce de sus derechos, y se le cubrirán las percepciones que debió recibir durante el término de la suspensión.\nARTICULO 209.- La ejecución de las sanciones administrativas impuestas en resolución firme, se llevará a cabo de inmediato en sus términos; pero tratándose de los servidores públicos de base, la destitución se sujetará a lo previsto por la Ley del servicio civil.\nARTICULO 210.- Si el presunto autor confesare la responsabilidad, se procederá de inmediato a dictar resolución, a no ser que quien conoce del procedimiento, disponga la recepción de pruebas aplicable, si es de naturaleza económica, pero en lo relativo a la indemnización deberá ser suficiente para cubrir el importe de los daños y perjuicios originados, y siempre deberá restituir lo que hubiere percibido con motivo de la infracción. Quedará al arbitrio prudencial de quien resuelva, dispensar al infractor de la suspensión, separación o inhabilitación.\nARTICULO 211.- Para el cumplimiento de las atribuciones que les confiere esta Ley, las autoridades a que se refiere el Artículo 199, podrán emplear los siguientes medios de apremio:\nI.- Sanción económica de hasta veinte veces el salario mínimo diario vigente en la Capital del\nEstado; y\nII.- Auxilio de la fuerza pública.\nSi existiere resistencia al mandamiento legítimo de autoridad se estará a lo dispuesto en las prevenciones que establezca la legislación penal.\nTITULO DECIMO PRIMERO\nDE LOS ESTIMULOS Y RECOMPENSAS\nCAPITULO I\nDISPOSICIONES GENERALES\nARTICULO 212.- Unicamente los servidores públicos de la Administración de Justicia podrán obtener los reconocimientos previstos en este Título, siempre que reúnan los requisitos que en él se establecen.\nARTICULO 213.- Los estímulos se otorgarán a los servidores públicos de confianza, por el reconocimiento público o trayectoria ejemplar; por la actuación sobresaliente en el desempeño de las funciones que tengan asignadas, así como por cualquier acto excepcional, realizado con desinterés, que contribuya a los fines de la Justicia.\nEstos últimos podrán acompañarse de recompensas, conforme a las prevenciones de esta Ley.\nARTICULO 214.- Las recompensas se otorgarán a los servidores públicos de base, con más de\n25 años de servicio, por su laboriosidad y comportamiento ejemplar.\nARTICULO 215.- Son estímulos:\nI.- La venera;\nII.- La roseta; y\nIII.- La mención honorífica.\nARTICULO 216.- Son recompensas;\nI.- La mención honorífica;\nII.- La entrega de tres meses de sueldo; y\nIII.- La concesión de quince días de vacaciones extraordinarias.\nARTICULO 217.- La venera combinará el símbolo de la Justicia con el Escudo del Estado. Sus características y diseño no podrán modificarse, una vez aprobados por el Pleno del Tribunal\nJudicial.\nARTICULO 218.- La roseta es un botón que se ostenta sobre la prenda de vestir y representa la venera recibida.\n(FE DE ERRATAS, P.O. 5, MARTES 15 DE ENERO DE 1991)\nARTICULO 219.- Con el estímulo o la recompensa se entregará una mención honorífica, en la que se expresarán las razones por las que se otorgaron, y deberá contener las firmas de presidente y magistrados del Tribunal Superior de Justicia.\nARTICULO 220.- El derecho al uso de la venera y la roseta, se pierde cuando el que las recibió sea sancionado con suspensión o pérdida del cargo.\nCAPITULO II\nDEL ORGANO Y PROCEDIMIENTO PARA EL OTORGAMIENTO\nARTICULO 221.- El presidente y los magistrados del Tribunal Superior de Justicia, de consuno, resolverán los expedientes que se integren para el otorgamiento de los estímulos y recompensas.\nARTICULO 222.- Sólo habrá una asignación por año para un servidor público de confianza y para un servidor público de base; sin que sea obligatorio el otorgamiento de estímulos y recompensas, cuando no haya lugar a conferirlos.\nARTICULO 223.- Los estímulos y recompensas se tramitarán a propuesta:\nI.- Del titular de la dependencia;\nII.- De los compañeros de labores;\nIII.- De las asociaciones de abogados legalmente constituidas e inscritas en el Tribunal;\nIV.- De los representantes del Sindicato de los Trabajadores al Servicio del Estado; y\nV.- Del interesado que se considere con derecho a ello.\nARTICULO 224.- Toda proposición será debidamente fundada y expresará los merecimientos del candidato.\nARTICULO 225.- El presidente del Tribunal Superior de Justicia llevará el registro de las candidaturas que se presenten e integrará los expedientes respectivos, que deberán iniciarse con la hoja de servicio del candidato.\nARTICULO 226.- El presidente y los magistrados sesionarán durante el mes de enero de cada año, para dictaminar sobre los expedientes sometidos a su consideración. Sus decisiones se tomarán por mayoría de votos y, en caso de empate, el presidente tendrá voto de calidad.\nSe designará a uno de los Magistrados para que engrose el dictamen y una vez formalizado, se señalará el lugar y fecha en que deba tener verificativo la ceremonia respectiva.\nARTICULO 227.- Podrá proponerse el otorgamiento póstumo de un estímulo o recompensa.\nARTICULO 228.- En el Libro de Honor que debe llevar la Presidencia del Tribunal, se registrarán los nombres de las personas a quienes se haya otorgado un estímulo o recompensa, asentándose el texto íntegro del dictamen emitido y del acta de entrega.\nARTICULO 229.- Las erogaciones que motive el otorgamiento de estímulo y recompensas, serán con cargo al erario público.\nTITULO DECIMO SEGUNDO\nDE LOS AUXILIARES DE LA ADMINISTRACION DE JUSTICIA\nCAPITULO I\nDISPOSICIONES GENERALES\nARTICULO 230.- Los cargos de los auxiliares de la administración de justicia son oficios de interés público que deben ser desempeñados por personas de buena conducta, imparcialidad e idoneidad absoluta. La función de los auxiliares no constituye una profesión. Para cada oficio se exigirán conocimientos y experiencia en la materia que corresponda y, cuando el caso lo requiera, título profesional legalmente expedido. Los honorarios respectivos son garantía constitucional y una equitativa retribución del servicio; pero en ningún caso podrán significar una carga excesiva para los que soliciten la intervención del órgano jurisdiccional.\n(REFORMADO, P.O. 16 DE NOVIEMBRE DE 2001)\nARTICULO 231.- Las personas que tengan interés en figurar en las listas de auxiliares de la administración de justicia como peritos, intérpretes, depositarios, interventores, síndicos de concursos, albaceas, partidores, liquidadores, tutores, curadores, notarios públicos y corredores, deberán formular su solicitud ante la Presidencia del Tribunal Superior de Justicia, directamente, o por conducto de un Juzgado de Primera Instancia, con expresión de su identidad, domicilio, estudios, títulos profesionales, práctica y experiencia en su especialidad, cargos desempeñados y servicios que aspiren a prestar.\nARTICULO 232.- El Pleno del Tribunal integrará el cuerpo de auxiliares y colaboradores de la que se estime necesarias, haciendo una escrupulosa selección de los solicitantes, teniendo en cuenta su especialidad y antecedentes, y publicará la lista respectiva; asimismo, cuando lo estime pertinente, mandará publicar las actualizaciones de la lista que correspondan.\nARTICULO 233.- El Pleno del Tribunal dividirá la lista general por distritos judiciales, teniendo en cuenta el lugar de residencia del seleccionado. La lista de cada distrito judicial se ordenará, procurando incluir en ella por lo menos un auxiliar para cada cargo, y por lo que toca a los peritos, uno por cada especialidad. En las listas así formadas, las personas en ellas comprendidas avocadas a los distintos cargos y especialidades, se colocarán en orden alfabético por apellidos.\nARTÍCULO 234. Las listas se harán llegar oportunamente a las Salas del Tribunal Superior de\nJusticia, al Tribunal Electoral, al Tribunal de lo Contencioso-Administrativo, al Tribunal de\nConciliación y Arbitraje, al Tribunal de Apelación Especializado en materia de Adolescentes, a los permanecerán a la vista del público, durante todo el año.\nARTICULO 235.- Si en la lista de un distrito judicial quedare desierto un cargo o especialidad, el\nPleno del Tribunal la integrará con el nombre de la persona que posea la aptitud necesaria.\nARTICULO 236.- No podrán formar parte de las listas de auxiliares de la administración de justicia:\nI.- Los incapaces;\nII.- Los que hayan sido declarados responsables de cualquier delito intencional;\nIII.- Quienes hayan rendido dictamen pericial, contra el cual hubieren prosperado objeciones por dolo, negligencia, soborno o simulación;\nIV.- Quienes como depositarios, síndicos, interventores, albaceas, liquidadores, partidores, tutelares o curadores, con administración de bienes, no hayan rendido oportunamente cuentas de su gestión, cubierto el saldo que resulte a su cargo, reintegrados los bienes que se le confiaron o que hayan utilizado éstos en provecho propio o de tercero, o se les haya fincado responsabilidad por administración negligente;\nV.- Aquellos que hayan sido suspendidos en el ejercicio de su profesión;\nVI.- Aquellos que hayan sido suspendidos o destituidos de su cargo o empleo, como servidores públicos por sanción disciplinaria;\nVII.- Quienes sin causa justificada se negaren a aceptar o ejercer el cargo de auxiliar para el que fueron designados; y\nVIII.- Los auxiliares de la Administración de Justicia que con motivo del cargo que se les hubiere conferido, hayan convenido honorarios con las partes, o solicitado o recibido el pago de ellos con anterioridad a la tasación de los mismos hecha por el juez, o excediendo el importe de la misma.\nARTICULO 237.- Cualquier ciudadano y el Ministerio Público podrán solicitar ante el Pleno del\nTribunal, la exclusión de una persona que figure en la lista de auxiliares de la Administración de\nJusticia, invocando las causales previstas en el artículo precedente o alegando falta de idoneidad moral o técnica de aquella.\nPara la exclusión solicitada se notificará personalmente al auxiliar de que se trate, y se tramitará la instancia en la vía incidental, sin que ello impida su nombramiento en tanto se pronuncie la resolución correspondiente.\nARTICULO 238.- Si se decreta la exclusión ésta se comunicará a los juzgados de los distritos judiciales del domicilio del auxiliar excluido para los efectos consiguientes.\nARTICULO 239.- En la designación de auxiliares de la Administración de Justicia se observarán las siguientes reglas:\nI.- La autoridad judicial hará la designación de auxiliar que le corresponda, entre las personas que figuran en las listas, siguiendo el orden establecido en ellas;\nII.- La designación será rotatoria, de suerte que la misma persona no pueda ser nombrada por segunda vez, sino cuando se haya agotado la lista correspondiente. Empero, si al iniciarse o continuarse una diligencia faltaren los auxiliares, podrá procederse de inmediato a su reemplazo, con cualquiera de las personas que figuren en la lista correspondiente;\nIII.- Cuando en una lista no hubiere auxiliares de la especialidad requerida para el caso, se hará la designación en persona calificada para el oficio;\nIV.- En los asuntos del orden penal, se recurrirá a los servidores públicos, profesionales y técnicos, que presten sus servicios en establecimientos o corporaciones dependientes del Gobierno del\nEstado o de los Municipios. En su defecto, se designará a alguno de los auxiliares en los términos a que se refieren las fracciones precedentes, y sus honorarios serán a cargo del Estado; y\nV.- Las partes interesadas podrán nombrar libremente a los auxiliares de la Administración de\nJusticia, en los casos autorizados por la Ley.\nARTICULO 240.- Todo nombramiento será notificado al auxiliar designado, mediante oficio, remitido por correo certificado con acuse de recibo, al domicilio del mismo que figure en la lista oficial, de todo lo cual se dejará constancia en el expediente.\nARTICULO 241.- Si la persona designada estuviere impedida para desempeñar la función, se excusare de prestar el servicio, no tomare posesión oportuna, no concurriere a la diligencia o no cumpliere con su cargo dentro del término señalado, se procederá inmediatamente a su sustitución.\n(FE DE ERRATAS, P.O. 5, MARTES 15 DE ENERO DE 1991)\nARTICULO 242.- Siempre que se deje de practicar una prueba o diligencia por culpa de un auxiliar de la Administración de Justicia, el Tribunal o el Juez del conocimiento, le impondrá una multa de tres a treinta tantos del salario mínimo diario vigente en la capital del Estado, sin perjuicio de las responsabilidades que procedan en su contra.\nARTICULO 243.- La Autoridad Judicial que no tome en cuenta las listas de auxiliares al hacer la designación correspondiente, incurrirá en falta administrativa que será sancionada con la suspensión del cargo por el término de diez días.\n(REFORMADO PRIMER PARRAFO, P.O. 16 DE NOVIEMBRE DE 2001)\nARTICULO 244.- La autoridad que conozca del negocio fijará, de oficio, en el acto de la designación, el monto de los honorarios que se causarán por la intervención de los auxiliares de la justicia, individualizando su monto, según su prudente arbitrio, entre un mínimo del 0.5% y un máximo del 3% sobre la cuantía del asunto, teniendo en cuenta la naturaleza del servicio; las dificultades que ofrezcan; las condiciones en que habrá de prestarse; el importe de las prestaciones reclamadas; la situación económica de quien deba cubrir los honorarios y los requerimientos profesionales o técnicos propios del cargo.\nEn los asuntos de valor indeterminado, así como en aquellos que carezcan de cuantía, el juez tasará discrecionalmente los honorarios, tomando en cuenta la naturaleza e importancia del servicio, dentro de un mínimo de tres tantos y un máximo de cien tantos del salario mínimo diario, vigente en la capital del Estado.\nARTICULO 245.- Cuando los honorarios del auxiliar fueren objetados, la regulación se hará en forma incidental.\nARTICULO 246.- Una vez que quede firme la providencia que fije el monto de los honorarios del auxiliar, la parte interesada deberá exhibir certificado de depósito por el importe de su valor.\nLos honorarios de los peritos designados por el juez sin intervención de los interesados, serán garantizados y cubiertos por ambas partes, por mitad, sin perjuicio de lo que resuelva la sentencia definitiva respecto al pago de las costas.\nARTICULO 247.- Los auxiliares tendrán derecho a que, además de sus honorarios, se les reembolsen los gastos que justifiquen haber realizado en el desempeño de su función.\nARTICULO 248.- Cuando prosperen las objeciones por dolo, negligencia, soborno o simulación contra la actuación del auxiliar, no habrá lugar al pago de honorarios.\nCAPITULO II\nDE LOS ABOGADOS\nARTICULO 249.- El ejercicio de la abogacía tiene como una de sus principales funciones, la de colaborar con las Autoridades Judiciales a la consecución de una recta y expedita Administración de Justicia.\nARTICULO 250.- Los profesionales del Derecho y las asociaciones de abogados en su caso, deberán:\nI.- Conservar la dignidad y el decoro de la profesión;\nII.- Colaborar en la recta y cumplida Administración de la Justicia;\nIII.- Observar y exigir el respeto debido a las Autoridades Judiciales, colaboradores y auxiliares de la justicia, así como a la contraparte, sus abogados y demás personas que intervengan en los asuntos relacionados con su profesión;\nIV.- Obrar con lealtad y honradez en el desempeño de su profesión; y\nV.- Guardar el secreto profesional.\nARTICULO 251.- Para ejercer en el Estado de Coahuila la profesión de abogado, se requiere poseer título legalmente expedido y debidamente registrado en el Tribunal Superior de Justicia.\nARTICULO 252.- Quien solicite el registro de su título, deberá hacerlo por escrito ante el Tribunal exhibiendo el original y copia de aquel, así como el comprobante del pago de los derechos correspondientes.\nARTICULO 253.- El título se mandará registrar por acuerdo de la Presidencia, en el libro especial que se llevará para ese efecto, después de constatar su legalidad y autenticidad.\nARTICULO 254.- La Presidencia del Tribunal expedirá al interesado constancia del registro, debiendo citarse el número de éste, en cualquier trámite o promoción ante las Autoridades\nJudiciales.\nARTICULO 255.- Sólo los abogados con título debidamente registrado pueden ser admitidos como apoderados, patronos, voceros o autorizados para oír notificaciones.\nA las personas que sin estos requisitos hicieren promociones escritas, les serán devueltas sin acordar; pero si indebidamente se les diere curso, la parte contraria podrá alegar estas circunstancias como excepción dilatoria.\nLa Autoridad Judicial que tolere la actuación de quien no tenga esa calidad, incurrirá en falta disciplinaria que será sancionada con multa, la primera vez, y con suspensión, en caso de reincidencia.\nARTICULO 256.- Se exceptúan de lo dispuesto en el artículo anterior, los siguientes casos:\nI.- La intervención de negocios propios promovidos por personas físicas, o por sí o por conducto de sus representantes legales, o por las personas morales, a través de sus órganos de representación;\nII.- La designación de defensor en los procesos penales;\nIII.- (DEROGADA, P.O. 20 DE MARZO DE 2001)\nIV.- En general, el ejercicio del derecho de petición y de las acciones públicas consagradas por la\nConstitución y las leyes respectivas.\nARTICULO 257.- La persona que ejerza la abogacía sin título, o sin contar con el registro correspondiente, no podrá cobrar honorarios profesionales.\nARTICULO 258.- El hecho de que alguna persona se atribuya el carácter de abogado sin tener título legal, o ejerza actos propios de la profesión, será castigado con las sanciones que establece el Código Penal del Estado.\nARTICULO 259.- Las asociaciones de abogados podrán solicitar y obtener su registro ante el\nTribunal Superior de Justicia, cumplidos los siguientes requisitos:\nI.- Exhibir el testimonio de protocolización de su escritura constitutiva y sus Estatutos, así como copia certificada de dichos documentos; y\nII.- Acompañar el directorio de sus miembros, así como una relación de los socios que integran su\nConsejo Directivo y su Comisión de Honor.\nARTICULO 260.- La asociaciones de abogados legalmente constituidas y registradas, quedan debidamente autorizadas para gestionar ante la Autoridad Judicial que corresponda, lo que estimen conducente para la mejor administración de justicia.\n(ADICIONADO, P.O. 18 DE MAYO DE 1999)\nTÍTULO DECIMOTERCERO\nDE LA JURISPRUDENCIA LOCAL\nCAPÍTULO I\nDISPOSICIONES GENERALES es una garantía jurisdiccional. El Pleno y las Salas del Tribunal Superior de Justicia, el Tribunal\nElectoral, el Tribunal de lo Contencioso-Administrativo, el Tribunal de Conciliación y Arbitraje, el\nTribunal de Apelación Especializado en materia de Adolescentes y los Tribunales Distritales, están facultados para formar jurisprudencia en los términos que dispone esta ley.\nARTÍCULO 262.- El Pleno del Tribunal Superior de Justicia formará jurisprudencia cuando:\nI. Sustente el mismo criterio en dos resoluciones ininterrumpidas.\nII. Fije en contradicción de criterios el que debe prevalecer.\nARTÍCULO 263. Las Salas del Tribunal Superior de Justicia y la Sala Auxiliar del mismo, formarán jurisprudencia cuando:\nI. Sustenten el mismo criterio en tres resoluciones ininterrumpidas.\nII. Fijen en contradicción de criterios el que debe prevalecer.\nIII. Exista declaración de confirmación o modificación del criterio emanado de un tribunal unitario de distrito.\n(REFORMADA, P.O. 28 DE DICIEMBRE DE 2007)\nARTÍCULO 263 BIS. El Tribunal Electoral, el Tribunal de lo Contencioso-Administrativo, el Tribunal de Conciliación y Arbitraje y el Tribunal de Apelación Especializado en materia de Adolescentes formarán jurisprudencia cuando sustenten el mismo criterio en tres resoluciones ininterrumpidas.\n(ADICIONADO, P.O. 18 DE MAYO DE 1999)\nARTÍCULO 264. Los tribunales unitarios de distrito cuando sostengan el mismo criterio en tres resoluciones ininterrumpidas, deberán enviarlo a la Sala que corresponda para que realice la declaratoria de jurisprudencia en los términos que señala esta ley.\n(ADICIONADO, P.O. 18 DE MAYO DE 1999)\nARTÍCULO 265. El Consejo de la Judicatura formará jurisprudencia disciplinaria cuando:\nI. Sustente el mismo criterio en tres resoluciones ininterrumpidas.\nII. Fije en contradicción de tesis el criterio que debe prevalecer.\nIII. Exista declaración de confirmación o modificación del criterio disciplinario emanado de un tribunal unitario de distrito.\n(ADICIONADO, P.O. 18 DE MAYO DE 1999)\nARTÍCULO 266. Las tesis de jurisprudencia no afectarán las situaciones jurídicas concretas generado la reiteración, la contradicción o la declaración.\nARTÍCULO 267. Cuando las partes invoquen la existencia de una jurisprudencia local deberán expresarlo por escrito identificando claramente su fuente, rubro y tesis. En todo caso, la autoridad\nEl Pleno, el Consejo o las Salas por sí o por conducto de sus presidencias, enviarán copia\nJudicial.\nEl Tribunal Electoral, por conducto de su Presidencia, enviará copia certificada de las tesis de jurisprudencia aprobadas, al Instituto Electoral y de Participación Ciudadana de Coahuila para su inmediata observancia obligatoria.\nEl Tribunal de lo Contencioso-Administrativo y el Tribunal de Conciliación y Arbitraje, por conducto de su Presidencia, enviarán copia certificada de las tesis de jurisprudencia aprobadas a las Salas\nDistritales o Especiales, según corresponda.\n(ADICIONADO, P.O. 1 DE SEPTIEMBRE DE 2006)\nEl Tribunal de Apelación Especializado en materia de Adolescentes, por conducto de su\nMagistrado, enviará copia certificada de las tesis aprobadas a los Jueces de Primera Instancia en materia de adolescentes.\n(ADICIONADO, P.O. 18 DE MAYO DE 1999)\nCAPÍTULO II\nDE LA JURISPRUDENCIA POR REITERACIÓN,\nCONTRADICCIÓN O DECLARACIÓN\n(REFORMADO, P.O. 28 DE DICIEMBRE DE 2007)\nARTÍCULO 268. La jurisprudencia por reiteración que emane del Pleno y de las Salas del Tribunal\nSuperior de Justicia, del Tribunal Electoral, del Tribunal de lo Contencioso-Administrativo, del\nTribunal de Conciliación y Arbitraje, del Tribunal de Apelación Especializado en materia de\nAdolescentes o del Consejo de la Judicatura, deberá estar debidamente glosada en tesis y aprobadas para su debida publicación.\n(REFORMADO PRIMER PÁRRAFO, P.O. 28 DE DICIEMBRE DE 2007)\nARTÍCULO 269. La jurisprudencia del Pleno del Tribunal Superior de Justicia por contradicción se regirá de acuerdo al procedimiento siguiente:\nI. La denuncia de contradicción se podrá formular por cualquier persona o autoridad. En todo caso se deberá señalar el órgano u órganos que incurren en contradicción, en qué consiste ésta y, si está a su disposición, el denunciante deberá acompañar el original o copia autorizada de la o las resoluciones que sean materia de la contradicción. Sin perjuicio de lo anterior, la Presidencia podrá mandar traer los documentos necesarios para analizar la denuncia de que se trate.\n(REFORMADA, P.O. 28 DE DICIEMBRE DE 2007)\nII. La denuncia versará sobre criterios sustentados por las Salas del Tribunal Superior de Justicia o por su Sala Auxiliar.\nIII. La denuncia de contradicción se presentará ante la Secretaría del Pleno. La Presidencia mediante oficio mandará dar vista al Procurador de Justicia de la denuncia, para que dentro de los quince días siguientes manifieste su opinión. Transcurrido dicho plazo, con o sin opinión, la la materia sobre la que verse prevalentemente la contradicción, poniendo a su disposición el expediente respectivo. La ponencia se deberá formular dentro de los sesenta días siguientes, con inclusión de los que sean inhábiles o festivos. De la misma se dará cuenta al Pleno por conducto de la Presidencia para su discusión y aprobación.\nIV. Cuando la denuncia de contradicción se refiera a criterios sustentados exclusivamente en materia civil, mercantil, familiar o penal y en la votación para resolver sobre ellas exista empate, tendrá calidad el sentido en que hayan votado la mayoría de los Magistrados del Pleno.\nARTÍCULO 270. La jurisprudencia de las Salas por contradicción se regirá de acuerdo al procedimiento que en lo conducente señalan las fracciones I, II y III del artículo anterior. Mas la corresponda; y versará sobre criterios sustentados por los Tribunales Distritales o los jueces del\nARTÍCULO 270 BIS. La jurisprudencia de los Tribunales Electoral, de lo ContenciosoAdministrativo y de Conciliación y Arbitraje por contradicción de tesis se regirá de acuerdo al procedimiento que señalan las fracciones I, II y III del artículo 269 de esta ley, pero la denuncia por contradicción se presentará ante el Secretario de Acuerdos del Tribunal que corresponda.\nTratándose de los dos últimos tribunales la jurisprudencia versará sobre criterios sustentados por las Salas Distritales o Especiales, según el caso, procurando su uniformidad.\n(ADICIONADO, P.O. 28 DE DICIEMBRE DE 2007)\nTendrá calidad el sentido en que hayan votado la mayoría de los Magistrados de la materia que corresponda.\n(ADICIONADO, P.O. 18 DE MAYO DE 1999)\nARTÍCULO 271. La jurisprudencia del Consejo por contradicción se regirá de acuerdo al procedimiento siguiente:\nI. La denuncia de contradicción se podrá formular por el Consejo de la Judicatura o su Presidencia; o por las autoridades o partes legitimadas que intervinieron en el procedimiento disciplinario que suscite el criterio contradictorio. En todo caso se deberá señalar el órgano u órganos que incurren en contradicción, en qué consiste ésta, o los criterios en cuestión y, si está a su disposición, el denunciante deberá acompañar el original o copia autorizada de la o las ejecutorias que sean materia de la contradicción. Sin perjuicio de lo anterior, la Presidencia podrá mandar traer los documentos necesarios para analizar la denuncia de que se trate.\nII. La denuncia versará sobre criterios disciplinarios sustentados por el Consejo, los tribunales unitarios de Distrito o los jueces del estado o sus subalternos que ejerzan jurisdicción disciplinaria en los casos que establece esta ley, o entre éstos, procurando su uniformidad.\nIII. La denuncia de contradicción se presentará ante la Secretaría del Consejo. La Presidencia una vez analizada la legitimidad del denunciante, podrá formular la ponencia por conducto de la\nSecretaría de Estudio y Cuenta del Consejo o acordará que la misma se encargue en estricto turno a uno de los Consejeros, poniendo a su disposición el expediente respectivo. Dicha ponencia deberá formularse, en todo caso, dentro de los sesenta días siguientes, con inclusión de los que sean inhábiles o festivos. De la misma se dará cuenta al Consejo por conducto de la Presidencia para su discusión y aprobación.\nARTÍCULO 272. En toda resolución que emane de una denuncia de criterios contradictorios se deberá determinar la procedencia de la contradicción y, en su caso, precisar el criterio que debe prevalecer y la tesis de jurisprudencia debidamente glosada y aprobada por el Pleno, la Sala, el\nTribunal Especializado o el Consejo de la Judicatura para su debida publicación, según el caso.\nPodrá fijarse un criterio distinto a los que sean materia de la contradicción.\nARTÍCULO 273. La jurisprudencia por declaración se regirá de acuerdo al procedimiento siguiente:\nI. El tribunal unitario de distrito que sostenga el mismo criterio en tres resoluciones ininterrumpidas, que prevalentemente consista el criterio, o al Consejo si se trata de un criterio disciplinario. Todo conflicto o duda sobre la competencia de la Sala será resuelta de plano por el Pleno.\nII. El tribunal unitario anexara original o copia autorizada de las resoluciones que dieron lugar al criterio materia de la declaración.\nIII. La Presidencia de la Sala o del Consejo, según el caso, deberán encargar en estricto turno la ponencia respectiva a un magistrado que integra la misma o un consejero. Dentro de los treinta días siguientes, la Sala o el Consejo resolverá la declaratoria de jurisprudencia debidamente glosada para mandarla a publicar.\nIV. La declaratoria de jurisprudencia podrá confirmar o sustentar un criterio distinto al señalado por el tribunal unitario. En todo caso, el criterio fijado por la Sala o el Consejo es el que formará jurisprudencia obligatoria.\n(ADICIONADO, P.O. 1 DE SEPTIEMBRE DE 2006)\nEl Tribunal de Apelación Especializado en materia de Adolescentes solo deberá observar este procedimiento, cuando los tres criterios que sustente en el mismo sentido, en forma ininterrumpida, se ocupen de la interpretación de disposiciones de las leyes penales o de la aplicación de normas que establezcan medidas disciplinarias. Los criterios que establezca en la materia de su especialidad, distintos a los señalados, formarán jurisprudencia sin necesidad de la declaración a que se refiere este artículo.\n(ADICIONADO, P.O. 18 DE MAYO DE 1999)\nCAPÍTULO III\nDE LA OBLIGATORIEDAD DE LA JURISPRUDENCIA\n(ADICIONADO, P.O. 18 DE MAYO DE 1999)\nARTÍCULO 274. La jurisprudencia que pronuncie el Pleno del Tribunal Superior de Justicia tendrá observancia obligatoria para las Salas, los tribunales unitarios de distrito y los juzgados del Poder\nJudicial, así como para todas las autoridades del estado.\nLa jurisprudencia que pronuncien las Salas del Tribunal Superior de Justicia tendrá observancia obligatoria para los tribunales unitarios de distrito y los juzgados del Poder Judicial, así como para todas las autoridades del estado.\n(REFORMADO, P.O. 16 DE NOVIEMBRE DE 2001)\nLa jurisprudencia que pronuncie el Tribunal Electoral tendrá observancia obligatoria para el Instituto\nElectoral y de Participación Ciudadana, para los partidos políticos y para todas las autoridades del estado, con excepción del Tribunal Superior de Justicia.\n(REFORMADO, P.O. 28 DE DICIEMBRE DE 2007)\nLa jurisprudencia que pronuncien los Tribunales de lo Contencioso-Administrativo y de Conciliación y Arbitraje tendrá observancia obligatoria para las Salas Distritales y las Salas Especiales, según el caso, y para todas las autoridades del Estado.\nAdolescentes. obligatorios para ellos.\nARTÍCULO 275. La jurisprudencia disciplinaria que pronuncie el Consejo de la Judicatura tendrá observancia obligatoria solamente para los Tribunales Especializados a que se refiere esta ley, para los Tribunales Distritales y los Jueces del Estado.\nARTÍCULO 276. La obligatoriedad de la jurisprudencia local surtirá sus efectos al día siguiente de que se publique en el Boletín de Información Judicial o en el Periódico Oficial del Estado, según ocurra primero.\nCAPÍTULO IV\nDE LA INTERRUPCIÓN Y MODIFICABILIDAD\nDE LA JURISPRUDENCIA\n(REFORMADO, P.O. 28 DE DICIEMBRE DE 2007)\nARTÍCULO 277. La interrupción de la jurisprudencia tendrá como consecuencia que deje de surtir sus efectos de obligatoriedad. El Pleno y las Salas del Tribunal Superior de Justicia, el Tribunal\nElectoral, el Tribunal de lo Contencioso-Administrativo, el Tribunal de Conciliación y Arbitraje, el\nTribunal de Apelación Especializado en materia de Adolescentes y el Consejo de la Judicatura, estarán facultados para interrumpir su jurisprudencia sólo en los casos y bajo las condiciones que establece este capítulo.\n(REFORMADO PRIMER PÁRRAFO, P.O. 28 DE DICIEMBRE DE 2007)\nARTÍCULO 278. La jurisprudencia por reiteración o por contradicción que emane del Pleno y de las\nSalas del Tribunal Superior de Justicia, del Tribunal Electoral, del Tribunal de lo ContenciosoAdministrativo, del Tribunal de Conciliación y Arbitraje o del Tribunal de Apelación Especializado en materia de Adolescentes, según el caso, se interrumpirá por otras en contrario de ellas, según corresponda, siempre y cuando:\nI. Tratándose del Pleno, la interrupción se apruebe por lo menos por las dos terceras partes de los magistrados y existan dos resoluciones subsecuentes en contrario que se dicten de manera ininterrumpida por parte del Pleno.\nSi se trata de una jurisprudencia por reiteración de una de las Salas, es necesario que existan tres resoluciones subsecuentes en contrario que se dicten de manera ininterrumpida.\n(REFORMADO, P.O. 28 DE DICIEMBRE DE 2007)\nSi se trata del Tribunal Electoral, del Tribunal de lo Contencioso-Administrativo o del Tribunal de\nConciliación y Arbitraje, que la interrupción se apruebe por lo menos por dos Magistrados y existan dos resoluciones subsecuentes en contrario que se dicten de manera ininterrumpida por parte del\nPleno de esos Tribunales.\n(ADICIONADO, P.O. 1 DE SEPTIEMBRE DE 2006)\nSi se trata de una jurisprudencia por reiteración del Tribunal de Apelación Especializado en materia de Adolescentes, es necesario que existan tres resoluciones subsecuentes en contrario que se dicten de manera ininterrumpida.\nEn todos los casos, en la primera ejecutoria que se pronuncie deberán expresarse las razones en que se apoye la interrupción, las cuales se referirán a las que se obtuvieron en consideración para establecer la jurisprudencia relativa.\nII. Si se trata de una jurisprudencia por contradicción, además de la jurisprudencia por reiteración, el Pleno o las Salas, según el caso; podrán interrumpirla sólo con base en las propuestas que concretos sometidos a su consideración.\nARTÍCULO 279. La jurisprudencia por reiteración o contradicción que emane del Consejo, se interrumpirá por otra en contrario de aquél, siempre que esté aprobada por lo menos por las dos terceras partes de los consejeros y se siga el procedimiento siguiente:\nI. Si se trata de una jurisprudencia por reiteración, es necesario que existan tres resoluciones subsecuentes en contrario que se dicten de manera ininterrumpida por parte del Consejo.\nII. Si se trata de una jurisprudencia por contradicción, además de la jurisprudencia por reiteración, unitarios de Distrito o los jueces sobre la necesaria interrupción de la tesis jurisprudencial en cuestión por su inaplicabilidad en los casos concretos sometidos a su consideración.\n(REFORMADO, P.O. 28 DE DICIEMBRE DE 2007)\nARTÍCULO 280. El Pleno y las Salas del Tribunal Superior de Justicia, el Tribunal Electoral, el\nTribunal de lo Contencioso-Administrativo, el Tribunal de Conciliación y Arbitraje, el Tribunal de\nApelación Especializado en materia de Adolescentes y el Consejo de la Judicatura estarán facultados para modificar su jurisprudencia, señalando en todo caso las razones fundadas para hacerlo. Es necesario que exista pronunciamiento previo de una resolución en un caso concreto para modificar la jurisprudencia, observándose las mismas reglas establecidas en esta ley para su formación.\nEl Pleno y las Salas del Tribunal Superior de Justicia, el Tribunal de lo Contencioso-Administrativo, el Tribunal de Conciliación y Arbitraje, el Tribunal de Apelación Especializado en materia de\nAdolescentes y el Consejo de la Judicatura, por sí mismos, o bien por conducto de las propuestas que realicen los Tribunales Distritales o los Jueces, en su caso, podrán modificar la jurisprudencia en la forma prevista en el párrafo anterior.\nEn los casos de las propuestas de las Salas Distritales, Salas Especiales, Tribunales Distritales o los Jueces se harán por vía de denuncia ante el Pleno y las Salas del Tribunal Superior de Justicia, el Tribunal de lo Contencioso-Administrativo, el Tribunal de Conciliación y Arbitraje, el Tribunal de\nApelación Especializado en materia de Adolescentes o el Consejo de la Judicatura, según el caso, para que éstos determinen si ha lugar o no a modificar el criterio. La propuesta de modificación deberá identificar la tesis jurisprudencial en cuestión, las razones que motiven la denuncia y, en su caso, las constancias necesarias que sirvan de base para fundamentar que en los casos concretos es justificada la modificación propuesta.\nEl Pleno y las Salas del Tribunal Superior de Justicia, el Tribunal de lo Contencioso-Administrativo, el Tribunal de Conciliación y Arbitraje, el Tribunal de Apelación Especializado en materia de\nAdolescentes o el Consejo de la Judicatura podrán modificar sus tesis de jurisprudencia sin que estén vinculados por la denuncia de modificación.\nARTÍCULO 281. La jurisprudencia local dejara de tener carácter obligatorio sin necesidad de declaratoria judicial cuando:\nI. Exista jurisprudencia en contrario de la Suprema Corte de Justicia de la Nación exactamente aplicable.\nII. Exista jurisprudencia de alguno de los tribunales colegiados del circuito federal exactamente aplicable. sea obligatoria para las autoridades del estado, exactamente aplicable.\nIV. Por nueva disposición constitucional o legal aplicables.\nCAPÍTULO V\nDE LA COMPILACIÓN Y SISTEMATIZACIÓN DE LA\nJURISPRUDENCIA Y TESIS AISLADAS\nARTÍCULO 282. El Presidente del Tribunal Superior de Justicia emitirá las circulares bajo las cuales se formularán, depurarán y glosarán las tesis aisladas o de jurisprudencia.\n(REFORMADO, P.O. 28 DE DICIEMBRE DE 2007)\nARTÍCULO 283. El Pleno y las Salas del Tribunal Superior de Justicia, el Tribunal Electoral, el\nTribunal de lo Contencioso-Administrativo, el Tribunal de Conciliación y Arbitraje, el Tribunal de\nApelación Especializado en materia de Adolescentes y el Consejo de la Judicatura formularán sus tesis de jurisprudencia y ordenarán que se publiquen dentro de los sesenta días siguientes al que se aprueben. En cualquier caso, se deberá enviar para su publicación la tesis de jurisprudencia al\nBoletín de Información Judicial o al Periódico Oficial del Gobierno del Estado, quince días antes de que venza el plazo anterior.\n(REFORMADO PRIMER PÁRRAFO, P.O. 28 DE DICIEMBRE DE 2007)\nARTÍCULO 284. En todo caso, el Pleno y las Salas del Tribunal Superior de Justicia, el Tribunal\nElectoral, el Tribunal de lo Contencioso-Administrativo, el Tribunal de Conciliación y Arbitraje, el\nTribunal de Apelación Especializado en materia de Adolescentes, el Consejo de la Judicatura, los\nTribunales Distritales y los Jueces del Poder Judicial, según corresponda, deberán remitir mensualmente a la Presidencia las tesis que contengan jurisprudencia, mencionando esta circunstancia; o los criterios debidamente formulados que estimen relevantes, sustentados en las resoluciones dictadas en los procesos en que hayan conocido.\nLa Presidencia del Tribunal depurará y compilará las tesis, los criterios o acuerdos relevantes para ser publicados.\n(REFORMADO, P.O. 16 DE NOVIEMBRE DE 2001)\nARTÍCULO 285.- La Presidencia del Tribunal publicará semestralmente en el Boletín de\nInformación Judicial del Estado los criterios enviados, así como las tesis de jurisprudencia por reiteración, contradicción o declaración.\nTRANSITORIOS\nARTICULO PRIMERO.- Esta Ley empezará a regir el día quince de enero de mil novecientos noventa y uno.\nARTICULO SEGUNDO.- En sesión extraordinaria a la que se convoque al Pleno, se designará al\nPresidente del Tribunal Superior de Justicia; y se adscribirán a las Salas correspondientes, los magistrados numerarios y supernumerarios. En cuanto a éstos últimos se les adscribirá por orden de las Salas para las que fueron designados, llamándose en primer término a los de la Primera\nSala y así sucesivamente hasta completar los que sean necesarios en los términos de la Ley. El resto, si lo hubiere, quedarán en disponibilidad para cubrir futuras suplencias si se presentaren antes del término de su encargo.\nARTICULO TERCERO.- En tanto se establezca la Tercera Sala de lo Familiar, los negocios que son de su competencia serán conocidos y resueltos por la Primera Sala de lo Civil.\nARTICULO CUARTO.- Los asuntos en trámite o citados para sentencia, radicados en cada una de las Salas Unitarias, se turnarán a la Sala Colegiada correspondiente por razón de la materia.\nARTICULO QUINTO.- Se prorroga el período para el que fueron designados los actuales\nMagistrados del Tribunal Superior de Justicia del Estado, en los términos previstos por el Artículo\nCuarto Transitorio del Decreto número 457, de reformas y adiciones a la Constitución Política del\nEstado de Coahuila de Zaragoza, de quince de junio de mil novecientos ochenta y ocho, publicado propio año.\nARTICULO SEXTO.- El Tribunal Superior de Justicia, por conducto de la Sala Colegiada que corresponda por razón de la materia, continuará conociendo de los asuntos de la competencia del\nPrimer Tribunal Unitario de Distrito, en tanto éste se crea en la capital del Estado.\nEl Tercer Tribunal Unitario de Distrito, con residencia en Monclova, Coahuila conocerá de los asuntos de su competencia y además de los que correspondan al Cuarto Tribunal Unitario de\nDistrito, con residencia en Piedras Negras, en tanto se crea este Tribunal.\nARTICULO SEPTIMO.- Los asuntos en trámite o citados para sentencia, radicados en cada una de las Salas que sean de la competencia de los Tribunales Unitarios de Distrito, se turnarán al que corresponda, según su jurisdicción.\nARTICULO OCTAVO.- Los magistrados de los Tribunales Unitarios de Distrito serán nombrados por el Pleno del Tribunal, en los términos de esta Ley. Iniciarán sus funciones el día 1o. de febrero de 1991 y las concluirán el 31 de enero de 1994. Al término de su encargo podrán ser reelectos y, si lo fueren, quedarán cubiertos por régimen previsto por este ordenamiento, para los casos de reelección.\nARTICULO NOVENO.- Se prorroga el término para el cual fueron designados los jueces de\nPrimera Instancia y los integrantes de los Tribunales Tutelares para Menores, conforme a lo previsto en el Artículo Cuarto Transitorio del Decreto de reformas y adiciones de la Constitución ocho, a que se alude en Artículo Quinto Transitorio de esta Ley.\nARTICULO DECIMO.- Cuando así proceda, los Juzgados de Primera Instancia de materia Civil que vienen actuando como delegados de Tribunales Tutelares para Menores, remitirán las causas que ante ellos se encuentren pendientes, cualquiera que sea su estado, al Juzgado de lo Familiar que designe el Pleno del Tribunal.\nARTICULO DECIMO PRIMERO.- Los asuntos en trámite que se encuentren en los Juzgados\nMunicipales que desaparecen en los términos de esta Ley, se remitirán a los Juzgados de Primera\nInstancia que correspondan en razón de la materia.\nARTICULO DECIMO SEGUNDO.- Los Juzgados de Conciliación que sustituyen a los Juzgados\nAuxiliares seguirán dependiendo en lo económico de los ayuntamientos, por lo que estos deberán autorizar las erogaciones indispensables para su funcionamiento, en sus presupuestos de egresos correspondientes al año de 1991. Los propios ayuntamientos deberán proponer ante el Pleno del\n1994.\nARTICULO DECIMO TERCERO.- Los artículos correspondientes al título relativo a los auxiliares de la Administración de Justicia, se observarán una vez que el Pleno del Tribunal tenga a su disposición los elementos necesarios para elaborar las listas de auxiliares que en ellos se indican.\nARTICULO DECIMO CUARTO.- El Consejo de la Judicatura iniciará sus funciones de inmediato, a\nARTICULO DECIMO QUINTO.- En lo no previsto, el Tribunal Superior de Justicia en Pleno, y por mayoría de votos, dictará los acuerdos necesarios para hacer efectivas las disposiciones de la presente Ley.\nARTICULO DECIMO SEXTO.- Quedan abrogados el Reglamento Interior del Tribunal Superior de de 1940 y derogadas, las demás disposiciones que se contengan en cualquier ordenamiento legal, y se opongan a la presente Ley.\nSALTILLO, COAHUILA, A LOS VEINTIOCHO DIAS DE MES DE SEPTIEMBRE DE MIL\nNOVECIENTOS NOVENTA.\nDIPUTADO PRESIDENTE.- PROFR. JOSE FEDERICO BORJON DE LOS SANTOS. (RUBRICA)\nDIPUTADO SECRETARIO.- MANUEL D. JIMENEZ HERRERA.(RUBRICA)\nDIPUTADO SECRETARIO.- PROFRA. Y LIC. MA. ANTONIETA NAVARRETE RAMOS.\n(RUBRICA)\nIMPRIMASE, COMUNIQUESE Y OBSERVESE\nSALTILLO, COAHUILA, A 10 DE DICIEMBRE DE 1990.\nEL GOBERNADOR CONSTITUCIONAL DEL ESTADO\nLIC. ELISEO MENDOZA BERRUETO.\n(RUBRICA).\nEL SECRETARIO DE GOBIERNO\nLIC. JOSE FUENTES GARCIA.\n(RUBRICA).\nN. DE E. A CONTINUACION SE TRANSCRIBEN LOS ARTICULOS TRANSITORIOS DE LOS DECRETOS DE\nREFORMAS A LA PRESENTE LEY.\nARTICULO PRIMERO.- Este Decreto entrará en vigor al día siguiente de su publicación en el Periódico Oficial del Gobierno del Estado.\nARTICULO SEGUNDO.- Se derogan las disposiciones que se opongan al presente decreto.\nARTICULO TERCERO.- Los asuntos de naturaleza mercantil que no rebasen su cuantía a los 182 días de salario mínimo y que se encuentren actualmente en trámite en los juzgados civiles serán resueltos por estos.\nPRIMERO.- El presente decreto entrará en vigor al día siguiente de aquel en que se publique en el Periódico Oficial del\n1996.\nSEGUNDO.- Se derogan todas las disposiciones que se opongan al presente decreto.\nARTÍCULO PRIMERO.- Las presentes reformas, adiciones y derogaciones a los diversos artículos de la Ley Orgánica del\nPoder Judicial, del Código de Procedimientos Civiles y del Código de Procedimientos Penales, con relación a los Juzgados\nLocales Letrados, entrarán en vigor el primero de mayo de mil novecientos noventa y ocho, sin perjuicio del acuerdo que emitan el Consejo de la judicatura para la instalación de cada uno de los Juzgados Locales Letrados, Civiles, Penales y\nMixtos, según se estime conveniente. Mismo que deberá ser publicado en el Periódico Oficial del Estado. Con relación a todas las restantes reformas, adiciones y derogaciones, entrarán en vigor al día siguiente al de su publicación en el\nPeriódico Oficial del Gobierno del Estado.\nLos jueces de primera instancia seguirán conociendo de los asuntos que les competen a los Juzgados Locales Letrados hasta en tanto cada uno de estos se instalen. Pero en los asuntos que se inicien a partir de la vigencia de estas reformas, aquellos se ajustarán al procedimiento señalado en éstas.\nARTÍCULO SEGUNDO.- Los asuntos radicados en los Juzgados de Primera Instancia en Materia Civil, Penal o Mixtos que por razón de la cuantía ya no les corresponda conocer, conforme a las disposiciones de estas reformas, deberán ser remitidos a la brevedad posible al Juzgado Local Letrado de su circunscripción, una vez que éste se instale, para que este último continúe su trámite y resolución.\nARTÍCULO TERCERO.- Los asuntos que al momento de entrar en vigor la presente ley se encuentren citados para sentencia, cuya competencia corresponda a los Jueces Locales Letrados en Materia Civil, Penal o Mixta, se resolverán por el tribunal que citó el negocio para la sentencia relativa.\nARTÍCULO CUARTO.- En los distritos judiciales en los que aún no se establezcan Juzgados Locales Letrados en materia civil, penal o mixta, los jueces de primera instancia de esas materias asumirán la competencia de aquellos.\nARTÍCULO QUINTO.- Los asuntos radicados con anterioridad a la entrada en vigor de la presente ley en los Juzgados de\nConciliación de las cabeceras de distrito judicial, relativos a juicio ejecutivos mercantiles, se substanciarán y resolverán por dichos juzgados.\nARTÍCULO SEXTO.- Todos los procedimientos disciplinarios que se encuentren sin concluir o sin resolver en el Tribunal\nTribunal Superior, al Consejo de la Judicatura, para que en este último se continúe su trámite y/o resolución.\nARTÍCULO SÉPTIMO.- Respecto a los secretarios de estudio y cuenta de cada magistrado, que actualmente se encuentren\nARTÍCULO OCTAVO.- Para los efectos de formar jurisprudencia obligatoria, las denuncias de contradicción de criterios solo estas reformas; así como sobre aquellos criterios que se sustenten en las resoluciones que se dicten a partir del inicio de vigencia de estas reformas, con relación a criterios aplicables sostenidos en resoluciones pronunciadas dentro de los seis últimos años anteriores al año de inició de vigencia de estas reformas.\nARTÍCULO NOVENO.- Se derogan todas las disposiciones que se opongan a las presentes reformas, modificaciones y adiciones.\nARTÍCULO PRIMERO. Estas reformas iniciarán su vigencia a partir del día 1° de septiembre; toda vez que para esa de los jueces en la materia.\nARTÍCULO SEGUNDO. Para los efectos de formar jurisprudencia local se tomarán en cuenta aquellos criterios que se sustenten en las resoluciones que se dicten a partir del inicio de vigencia de estas reformas, con relación a criterios aplicables sostenidos en resoluciones pronunciadas dentro de los seis últimos años, anteriores al año del inicio de vigencia de estas reformas.\nP.O. 20 DE MARZO DE 2001)\nARTÍCULO PRIMERO. Este decreto entrará en vigor el día de su publicación en el Periódico Oficial del Gobierno del\nEstado.\nARTÍCULO SEGUNDO. El Congreso del Estado en coordinación con todos los Ayuntamientos de la entidad, antes del inicio del ejercicio fiscal del año 2002, establecerán los criterios necesarios para que los valores unitarios de suelo y de construcción que sirven de base para el cobro de las contribuciones sobre la propiedad inmobiliaria, sean equiparables a los valores del mercado de dicha propiedad y procederán, en su caso, a realizar las reformas o adiciones legales correspondientes a las tasas aplicables para el cobro de las mencionadas contribuciones, a fin de garantizar su apego a los principios de proporcionalidad y equidad.\nPara tal efecto, el Congreso del Estado a través de la Comisión de Finanzas coordinará, a partir de la entrada en vigor de este decreto, un programa con los municipios para definir los criterios proporcionales y equitativos que se deben establecer para fijar la base de las contribuciones sobre la propiedad inmobiliaria, de conformidad con las disposiciones aplicables.\nEn este programa deberá participar el Instituto Coahuilense del Catastro y la Información Territorial como órgano de apoyo y asesoría necesaria.\nARTÍCULO TERCERO. Los juzgados de conciliación deberán continuar con la denominación y competencia que actualmente tienen, hasta el treinta y uno de agosto del año dos mil uno, fecha en que concluirán sus funciones, quedando sin efecto los nombramientos de sus titulares. Consecuentemente, las disposiciones contenidas en los artículos de la Ley\nOrgánica del Poder Judicial que hagan referencia a los juzgados de conciliación estarán en vigor hasta la fecha señalada, con excepción de lo dispuesto en la fracción I del artículo 43.\nEl personal que formaba parte de los Juzgados de Conciliación podrán integrar los juzgados municipales que establece el\nCódigo Municipal, según lo acuerde el Ayuntamiento respectivo.\nEn todo caso, se deberán respetar los derechos laborales del personal que formaba parte de los Juzgados de Conciliación.\nLos ayuntamientos emitirán los acuerdos necesarios para regularizar su situación laboral y su reorganización dentro de la administración pública municipal.\nHasta en tanto el Consejo de la Judicatura determine nuevos distritos judiciales, seguirán vigentes, para todos los efectos legales, los ocho distritos previstos en el texto anterior del artículo 5° de la Ley Orgánica del Poder Judicial, que ahora se reforma; y que tienen como cabecera las ciudades de: Saltillo, Monclova, Sabinas, Piedras Negras, Acuña, Torreón, San\nPedro de las Colonia y Parras de la Fuente.\nARTÍCULO CUARTO. Los Ayuntamientos dentro del plazo de un año contado a partir de la entrada en vigor de este decreto, deberán instalar las Unidades Municipales de Protección Civil, según sus necesidades, condiciones y particularidades socioeconómicas.\nEstas unidades formarán parte de la administración pública municipal, según el acuerdo que emita el Ayuntamiento.\nEn aquellos municipios que no cuenten con estas unidades, el Ejecutivo del Estado a través de la instancia correspondiente podrá coadyuvar, colaborar o sustituir la función de las mismas hasta en tanto el municipio pueda asumir plenamente esta función.\nARTÍCULO QUINTO. Dentro del plazo de un año contado a partir de la entrada en vigor de este decreto, los ayuntamientos deberán adecuar su reglamentación, acuerdos, circulares y demás disposiciones generales.\nARTÍCULO SEXTO. Se derogan todas las disposiciones en contrario.\nARTÍCULO PRIMERO. Estas reformas, adiciones, derogaciones y modificaciones a diversas disposiciones de la Ley\nARTÍCULO SEGUNDO. El Tribunal Electoral en sus primeras sesiones que celebre designará libremente al personal que estará adscrito a él, conforme a lo previsto en las disposiciones aplicables previstas en este Decreto, sin perjuicio de que el personal designado por el Tribunal Electoral.\nARTÍCULO TERCERO. En tanto el Pleno del Tribunal Superior de Justicia no modifique la denominación y competencias de las Salas, seguirán funcionando como Sala Civil y Familiar y Sala Penal de acuerdo con el presupuesto autorizado.\nARTÍCULO CUARTO. Los asuntos civiles y mercantiles cuya cuantía sea superior a 182 y hasta de 500 días de salario mínimo general vigente al momento de presentación de la demanda en el lugar de residencia del juzgado respectivo, y que se encuentren pendientes de resolución ante los juzgados letrados al momento de entrar en vigor el presente Decreto, continuarán su tramitación ante la misma autoridad hasta su conclusión definitiva, pero todos los asuntos nuevos que se presenten deberán ser turnados al Juzgado de Primera Instancia que corresponda.\nARTÍCULO QUINTO. La lista de auxiliares de la Administración de Justicia aprobada para el año dos mil uno, seguirá vigente hasta en tanto el Pleno del Tribunal acuerde la publicación de una nueva lista o su actualización.\nARTÍCULO SEXTO. Se derogan todas las disposiciones legales o reglamentarias que se opongan al presente Decreto.\nP.O. 24 DE MAYO DE 2005\nUNICO.- El presente decreto entrará en vigor al día siguiente de su publicación en el Periódico Oficial del Gobierno del\nEstado.\nP.O. 1 DE SEPTIEMBRE DE 2006\nPRIMERO. El presente Decreto entrará en vigor el día siguiente al de su publicación en el Periódico Oficial del Gobierno del\nEstado, con excepción de las disposiciones en materia contenciosa-administrativo y de adolescentes infractores, las cuales iniciarán su vigencia conforme a los términos y circunstancias señalados en los artículos transitorios subsecuentes.\nSEGUNDO. Las reformas relativas a la materia contenciosa-administrativa a que refiere el presente decreto, entrarán en vigor de manera conjunta con la legislación que regule la justicia administrativa que, en su oportunidad, apruebe el\nCongreso del Estado.\nTERCERO. Las reformas relativas a la materia de adolescentes a que se refiere el presente decreto, entrarán en vigor de manera conjunta con la legislación que regule la justicia para adolescentes que, en su oportunidad, apruebe el Congreso del\nEstado.\nCUARTO. Los órganos que actualmente conforman el Consejo de Menores, como órgano desconcentrado de la Secretaría de Gobierno del Poder Ejecutivo, pasarán a formar parte de los órganos especializados del Poder Judicial que se establecen mediante el presente decreto, a cuyo efecto sus titulares deberán acreditar el cumplimiento de los requisitos correspondientes para cada caso.\nQUINTO.- Los procedimientos en trámite y las sanciones por aplicar al iniciarse la vigencia del presente Decreto, se regirán a su vigencia, pendientes de queja, se regirán conforme a las disposiciones de este Decreto.\nSEXTO. Se derogan todas las disposiciones que se opongan al presente Decreto.\nPRIMERO.- El presente Decreto entrará en vigor el día siguiente al de su publicación en el Periódico Oficial del Gobierno del Estado.\nSEGUNDO.- Las reformas a los artículos 6°, 8°, 9°, 16 y 24 del presente Decreto, iniciarán su vigencia hasta en tanto se realice la designación de los Magistrados, en los términos de lo dispuesto por los artículos Tercero y Cuarto Transitorios de este Decreto.\nTERCERO.- El Consejo de la Judicatura del Estado iniciará el procedimiento para la designación de los magistrados numerarios y supernumerarios del Tribunal Superior de Justicia, a fin de alcanzar el número de los previstos en este\nDecreto, dentro del plazo de sesenta días siguientes a la fecha en que inicie su vigencia.\nDecreto correspondiente a la aprobación de sus nombramientos, una vez que rindan la protesta de ley.\nCUARTO.- En la fecha señalada por el Congreso del Estado a que se refiere el párrafo final del artículo precedente, reunidos en sesión especial la totalidad de los Magistrados en ejercicio y los recién designados, con la asistencia del\nSecretario del Tribunal Pleno, se procederá a declarar la instalación del Tribunal Superior de Justicia del Estado de\nCoahuila de Zaragoza, conforme a su nueva integración y se determinarán las adscripciones de los Magistrados recién designados.\nEn la fecha en que deba iniciar sus funciones la Sala Auxiliar con jurisdicción en los Distritos judiciales de Viesca y San\nPedro, el Presidente del Tribunal Superior de Justicia del Estado procederá a declararla instalada en la ciudad de Torreón, Coahuila. Hecho lo anterior, los Magistrados integrantes de la Sala Auxiliar, en sesión plenaria especial y en escrutinio secreto, designarán a su Presidente.\nLo anterior se hará del conocimiento del Presidente del Tribunal Superior de Justicia, quien declarará la nueva integración del Pleno del Tribunal conforme a este Decreto y lo comunicará a los Poderes Ejecutivo y Legislativo del Estado.\nQUINTO.- Para los efectos de lo dispuesto por el artículo 13 de este Decreto, continuará en sus funciones como Presidente del Tribunal Superior de Justicia, el Magistrado electo el 30 de diciembre de 2005, cuyo periodo se extenderá hasta el 29 de diciembre de 2010.\nLos nombramientos de los Magistrados Numerarios del Tribunal Superior de Justicia designados mediante decreto 616 del\nCongreso del Estado, se ampliarán hasta el 29 de diciembre de 2020.\nSEXTO.- Los Magistrados Supernumerarios que integran el Tribunal Superior de Justicia, continuarán con su nombramiento hasta la fecha de su conclusión conforme al Decreto de fecha 21 de diciembre de 2005.\nSÉPTIMO.- En los artículos en que se haga referencia a los Tribunales Unitarios de Distrito se entenderá como Tribunales\nDistritales en el contenido general de la Ley Orgánica del Poder Judicial del Estado de Coahuila de Zaragoza y en los demás ordenamientos en que se aluda a esa denominación.\nOCTAVO.- Los juzgados civiles y mercantiles de primera instancia continuarán con el conocimiento de los asuntos de esas materias, respectivamente, que hubiesen radicado a la fecha de la entrada en vigor del presente Decreto, hasta su total conclusión inclusive en ejecución o vía de apremio.\nNOVENO.- Las disposiciones relativas al Tribunal de Conciliación y Arbitraje contenidas en este Decreto serán aplicables competencia y procedimientos. Este Tribunal iniciará sus funciones una vez aprobada la partida presupuestal para su operación.\nDÉCIMO.- Se derogan todas las disposiciones que se opongan al presente Decreto.",
  "ordenamiento": "REGLAMENTO",
  "jurisdiccion": "COAHUILA",
  "fuente_oficial": "DIARIO OFICIAL DE LA FEDERACION",
  "Fecha de Publicación": "11 de diciembre de 1990",
  "ULTIMA REFORMA PUBLICADA": "28 DE DICIEMBRE DE 2007",
  "es_escaneado": false,
  "tiene_tablas": true,
  "materia": [
    "judicial"
  ]
}