{
  "titulo": "Ley de Planeación del Estado de Coahuila de Zaragoza",
  "Contenido": "LEY DE PLANEACIÓN DEL ESTADO DE COAHUILA DE ZARAGOZA.\nEL C. PROFR. HUMBERTO MOREIRA VALDÉS, GOBERNADOR CONSTITUCIONAL DEL ESTADO\nINDEPENDIENTE, LIBRE Y SOBERANO DE COAHUILA DE ZARAGOZA, A SUS HABITANTES SABED:\nQUE EL CONGRESO DEL ESTADO INDEPENDIENTE, LIBRE Y SOBERANO DE COAHUILA DE ZARAGOZA;\nDECRETA:\nNÚMERO 656.CAPÍTULO PRIMERO\nDISPOSICIONES GENERALES\nArtículo 1.- Las disposiciones de esta Ley son de orden público e interés social y tienen por objeto establecer:\nI. Las normas y principios básicos para la planeación del desarrollo del Estado y su ejecución por la administración pública estatal y municipal;\nII. Las bases de integración y funcionamiento del Sistema Estatal de Planeación fortaleciendo el papel estratégico del Plan Estatal de Desarrollo;\nIII. Las bases de integración y operación del proceso de Planeación para el Desarrollo;\nIV. Las bases conforme a las cuales el Poder Ejecutivo del Estado podrá coordinar un proceso de planeación con los órdenes de gobierno Federal y Municipal; y\nV. Las bases para promover la participación de la sociedad en la formulación de los planes y los programas a los que se refiere esta Ley.\nArtículo 2.- La planeación es un proceso para el desempeño eficaz de la responsabilidad del Estado sobre el desarrollo de la Entidad, a través del Plan Estatal de Desarrollo y conforme a los ordenamientos legales aplicables. atendiendo también al Plan Estatal de Desarrollo y los ordenamientos en la materia.\nArtículo 3.- Para efectos de esta Ley se entenderá por:\nI. Planeación: a la ordenación racional y sistemática de las acciones gubernamentales cuyo objetivo fundamental es impulsar un desarrollo equilibrado y equitativo.\nII. Sistema Estatal de Planeación: al conjunto de interacciones a través de las cuales las dependencias y atribuciones que tienen conferidas para lograr su misión institucional, tendiente a mejorar las condiciones económicas y sociales prevalecientes en la Entidad, conforme al marco normativo y al proceso de Planeación.\nIII. Comité: Comité de Planeación para el Desarrollo del Estado de Coahuila.\nIV. Copladem: Comité de Planeación para el Desarrollo Municipal.\nV. Fondos Estatales: El Fondo Estatal para la Educación Básica y Normal; el Fondo Estatal para los Servicios de Salud; el Fondo Estatal de Aportaciones Múltiples; el Fondo Estatal para la Educación Tecnológica y de\nAdultos; el Fondo Estatal para la Seguridad Pública, y el Fondo Estatal para la Infraestructura Social; el Fondo\nEstado celebre con la Federación o los Municipios.\nVI. Fondos Municipales: El Fondo para la Infraestructura Social Municipal; el Fondo para el Fortalecimiento de los Municipios y demás que se establezcan.\nArtículo 4.- Es responsabilidad y atribución del Titular del Ejecutivo del Estado, conducir el proceso de planeación estatal de conformidad con lo dispuesto en la presente Ley.\nEl proceso de planeación para el desarrollo municipal se llevará a cabo por cada Municipio conforme a las disposiciones legales aplicables.\nArtículo 5.- El proceso de planeación normado por la presente Ley se fundamenta en el contenido del Plan Estatal de Desarrollo. Con base en él se elaborarán los demás instrumentos de la planeación, tales como los programas estatales y los proyectos de inversión.\nArtículo 6.- La planeación deberá estar basada en los siguientes principios:\nI. El fortalecimiento de la soberanía del Estado y la autonomía del Municipio Libre en el marco del pacto federal;\nII. La consolidación de la democracia como sistema de vida, fundada en el bienestar y mejoramiento de la sociedad;\nIII. La transparencia de los objetivos, metas y acciones de la administración pública estatal y municipal;\nIV. El respeto irrestricto a las garantías individuales y los derechos sociales;\nV. El equilibrio de los factores productivos, que proteja y promueva el empleo y la inversión en un marco que garantice el bienestar social, la estabilidad económica y la sustentabilidad ambiental;\nVI. La coordinación de esfuerzos, objetivos, estrategias y acciones entre los distintos órdenes de gobierno para promover el desarrollo equitativo y sustentable en el Estado;\nVII. El fortalecimiento de los mecanismos para la participación activa y responsable de la sociedad y su incorporación a la planeación para el desarrollo;\nVIII. El impulso al desarrollo equilibrado entre municipios y regiones, con base en sus potencialidades, basado en políticas diferenciadas de desarrollo y en el aprovechamiento racional de los recursos naturales, humanos, técnicos y financieros del Estado.\nArtículo 7.- Los planes y programas derivados del proceso de planeación, serán la base para que el Ejecutivo equitativo del Estado. la realidad cambiante del Estado y en consideración de los indicadores de desarrollo. que le correspondan, atendiendo fundamentalmente a los criterios de equidad y equilibrio regional establecidos en el\nPlan Estatal de Desarrollo de Coahuila.\nArtículo 9.- En caso de duda sobre la interpretación de las disposiciones de esta Ley se estará a lo que resuelva\nEn todo lo no previsto expresamente por esta Ley, se utilizarán supletoriamente las demás disposiciones estatales que resulten aplicables.\nCAPÍTULO SEGUNDO\nDEL SISTEMA ESTATAL DE PLANEACIÓN\nArtículo 10.- La planeación que realizarán las dependencias y entidades de la administración pública estatal y municipal se hará en los términos de esta Ley y demás ordenamientos aplicables.\nEl Sistema Estatal de Planeación estará integrado por:\nI. Marco Normativo. Es el conjunto de disposiciones legales que, en materia de planeación, regulan el funcionamiento de la administración pública estatal y municipal, y su interacción con otros órdenes de gobierno y entidades federativas, así como la participación de la sociedad en estas tareas;\nII. Dependencias y entidades de la administración pública estatal y municipal. Las que deberán conducir sus actividades conforme al Proceso de Planeación definido en esta Ley; y\nIII. Proceso de Planeación para el Desarrollo Estatal. El cual se integra con las etapas de planeación, programación y presupuestación, evaluación, control y rendición de cuentas.\nCAPÍTULO TERCERO\nDE LAS AUTORIDADES COMPETENTES\nArtículo 11.- Son autoridades y órganos competentes para llevar a cabo la planeación del desarrollo:\nA).- De la administración pública estatal:\nI. El Gobernador Constitucional del Estado;\nII. El Comité de Planeación para el Desarrollo del Estado de Coahuila; y\nIII. Las dependencias y entidades que integran la administración pública estatal.\nB).- De la administración pública municipal:\nI. Los ayuntamientos del estado;\nII. Los Comités de Planeación para el Desarrollo Municipal.\nArtículo 12.- El Comité de Planeación para el Desarrollo del Estado de Coahuila, estará integrado por:\nI. Por un Presidente que será el Titular del Ejecutivo del Estado;\nII. Por un Coordinador General que será el Secretario Ejecutivo del Servicio de Administración Tributaria del\nEstado de Coahuila;\nIII. Por un Secretario Técnico que será el Administración General de Políticas Públicas del Servicio de\nAdministración Tributaria del Estado de Coahuila;\n(ADICIONADA, RECORRIDENDOSE LAS ULTERIORES, P.O. 22 DE OCTUBRE DE 2010)\nIV. Por un Vocal que será el Tesorero General del Estado;\nV. Por un Vocal que será el Secretario de Gobierno;\nVI. Por un Vocal que será el Secretario de Obras Públicas y Transporte;\nVII. Por un Vocal que será el Secretario de Desarrollo Social;\nVIII. Por un Vocal que será el Secretario de la Función Pública;\n(REFORMADA, P.O. 22 DE OCTUBRE DE 2010)\nIX. Por un Vocal que será el Administrador General de Planeación del Servicio de Administración Tributaria del\nEstado de Coahuila;\nX. Los Coordinadores de los Gabinetes Temáticos que fungirán como Vocales, de acuerdo a su área de competencia; y\nXI. Los demás funcionarios que designe el Titular del Poder Ejecutivo.\nPara efectos de la fracción IX de este artículo, el Gabinete Temático se integra por los titulares de las Dependencias y Entidades que no forman parte del Comité.\nArtículo 13.- El Comité contará con una comisión permanente que estará integrada por el Secretario Ejecutivo del\nServicio de Administración Tributaria del Estado de Coahuila; el Secretario de la Función Pública; el Administrador\nGeneral de Políticas Públicas del Servicio de Administración Tributaria del Estado de Coahuila; el Subsecretario de\nPlaneación del Servicio de Administración Tributaria del Estado de Coahuila; y el Titular de la Dependencia\nEjecutora.\nEl Comité podrá delegar en esta Comisión la planeación, programación, presupuestación y autorización de la ejecución de los programas, proyectos y obras de inversión, con cargo a los fondos estatales y convenios que el\nArtículo 14.- Se constituirán en cada Municipio Comités de Planeación para el Desarrollo Municipal los cuales\nAyuntamiento.\nArtículo 15.- Las autoridades a que se refiere el artículo 11 de esta Ley, tendrán las siguientes atribuciones:\nII. Establecer las políticas y directrices generales en materia de planeación; y\nB).- El Comité de Planeación para el Desarrollo del Estado del Estado de Coahuila:\nI. Proponer el Plan Estatal de Desarrollo y sus modificaciones;\nII. Ser el órgano máximo para la planeación, programación, presupuestación y autorización de la ejecución de los programas, proyectos y obras de inversión.\nIII. Establecer mecanismos y líneas de acción para la consulta ciudadana respecto a la integración del Plan\nEstatal de Desarrollo;\nIV. Analizar y seleccionar las obras a realizar con los recursos los Fondos Estatales;\nV. Dar seguimiento a la ejecución del Proceso de Planeación;\nVI. Señalar los lineamientos en relación a la realización de los programas operativos anuales y su congruencia con el contenido del Plan Estatal de Desarrollo;\nVII. Revisar el Programa Anual de Gasto Público y su congruencia con el contenido del Plan Estatal de\nDesarrollo y con los programas estatales y de inversión;\nVIII. Apoyar al Titular del Ejecutivo del Estado en la concertación de acciones previstas en el Plan Estatal de\nDesarrollo; y\nIX. Las demás que se deriven de la presente Ley y disposiciones legales aplicables o en cumplimiento a instrucciones del Titular del Ejecutivo.\nC).- El Coordinador General del Comité:\nI. Proponer al Titular del Ejecutivo la planeación financiera, el programa estatal de inversión pública y los anteproyectos de la Ley de Ingresos y del Presupuesto de Egresos.\nII. Proponer al Titular del Ejecutivo el Programa Anual de Gasto Público.\nIII. Presidir el Comité en ausencia del Presidente;\nIV. Dirigir la Comisión permanente del Comité;\nV. Convocar a través del Secretario Técnico a las sesiones del Comité;\nVI. Determinar y convocar a los vocales del Gabinete Temático que deban participar en cada sesión.\nD).- El Secretario Técnico:\nI. Convocar por instrucciones del Coordinador General a las sesiones del Comité;\nII. Levantar las actas correspondientes a cada sesión;\nIII. Coordinar las tareas y dar seguimiento al Proceso de Planeación a través de las acciones de programación y presupuestación;\nIV. Llevar el control y seguimiento de los acuerdos del Comité;\nV. Las demás que le asigne el Comité.\nE).- Los titulares de las Dependencias y Entidades de la Administración Pública Estatal:\nI. Cumplir las disposiciones de esta Ley en su dependencia u organismo;\nII. Elaborar y ejecutar los programas estatales en el ámbito de su competencia;\nIII. Asegurar la congruencia de los programas estatales y los proyectos de inversión en los que participe, con el Plan Estatal de Desarrollo;\nIV. Elaborar y ejecutar los programas operativos anuales;\nV. Conducir y dar seguimiento a los programas y presupuesto de la dependencia o entidad, y del Proceso de Planeación en el ámbito de su competencia, conforme a los objetivos y lineamientos del Plan Estatal de Desarrollo y la legislación aplicable, previendo las acciones que permitan garantizar el impacto social y económico más benéfico;\nVI. Participar en la planeación por medio del Gabinetes Temáticos; y\nVII. Las demás facultades que determinen esta Ley y las disposiciones legales aplicables.\nArtículo 16.- Son atribuciones de las autoridades municipales en materia de planeación:\nA).- Del Ayuntamiento\nI. Formular, aprobar, controlar y evaluar el Plan de Desarrollo Municipal, con arreglo a la ley;\nII. Llevar el seguimiento del Plan de Desarrollo Municipal y sus programas; y\nIII. Asegurar la congruencia y cumplimiento de los compromisos que se deriven del Plan Estatal de\nDesarrollo.\nB).- Del Comité de Planeación para el Desarrollo Municipal:\nI. Elaborar y presentar al Ayuntamiento el Plan de Desarrollo Municipal y sus modificaciones;\nII. Participar coordinadamente con los gobiernos estatal y federal en las estrategias y programas de desarrollo mediante los convenios respectivos; y\nIII. Las demás que le atribuyan esta Ley y otras disposiciones en la materia.\nArtículo 17.- El Comité deberá sesionar de manera ordinaria cada seis meses y de manera extraordinaria cuando sea convocado por el Presidente o Coordinador General.\nLos Copladem lo harán conforme a sus propias disposiciones.\nCAPÍTULO CUARTO\nDEL PROCESO DE PLANEACIÓN\nArtículo 18.- El Proceso de Planeación se integra con las etapas de planeación, programación y presupuestación, control, evaluación y rendición de cuentas, cuyas características y criterios para su operación se emitirán por el\nComité.\nSECCIÓN PRIMERA\nDE LA PLANEACIÓN\nArtículo 19.- La etapa de planeación se refiere a la elaboración y actualización del Plan Estatal de Desarrollo, de los programas estatales, así como del Plan de Desarrollo Municipal y a la actualización de los demás planes contemplados en la legislación vigente del Estado.\nArtículo 20.- El Plan Estatal de Desarrollo será el documento en el que se identifiquen las prioridades para el desarrollo estatal, se presenten los objetivos y se integren las estrategias y líneas de acción que la Administración\nPública Estatal llevará a cabo para lograr dichos objetivos.\nAl inicio de cada administración el Ejecutivo Estatal deberá realizar un ejercicio de consulta ciudadana para que, antes de que transcurran los primeros seis meses, se dé a conocer a la población en general el Plan Estatal de\nDesarrollo.\nUna vez aprobado por el Titular del Ejecutivo, el Plan Estatal de Desarrollo será publicado en el Periódico Oficial del\nEstado.\nArtículo 21.- Los programas estatales serán los instrumentos de la administración pública estatal en los que se organicen y se detallen los objetivos, metas y acciones a ejecutar por el Estado para cumplir con las responsabilidades que la Ley le otorga.\nLos programas estatales atenderán, en congruencia con el Plan Estatal de Desarrollo, a las prioridades de tipo regional, sectorial o especial que se determinen.\nArtículo 22.- En el ámbito municipal, el Plan de Desarrollo Municipal permitirá identificar los programas y acciones que de manera prioritaria se instrumentarán para alcanzar los propósitos de desarrollo, buscando siempre en el\nSECCIÓN SEGUNDA\nDE LA PROGRAMACIÓN Y PRESUPUESTACIÓN\nArtículo 23.- La etapa de programación se refiere a la ordenación sectorial y programática de los programas estatales con las responsabilidades gubernamentales y las unidades administrativas ejecutoras, para cumplir los objetivos o prioridades señaladas en el Plan Estatal de Desarrollo. El Comité de Planeación para el Desarrollo del del estado.\nArtículo 24.- Las dependencias y entidades de la administración pública estatal deberán incorporar en su programa operativo anual, objetivos, metas a alcanzar en el ejercicio presupuestario, costos estimados y beneficiarios de las obras planeadas.\nLos ayuntamientos formularán sus programas operativos anuales conforme a sus programas de desarrollo atendiendo a los objetivos y directrices del Plan de Desarrollo Municipal.\nLos programas operativos anuales incluirán las obras, acciones, proyectos y actividades específicas que efectuará en el año, así mismo, deberá comprender las metas definidas en los programas estatales.\nArtículo 25.- El Programa Anual de Gasto Público deberá relacionar los recursos disponibles e integrarse a partir de los programas operativos anuales.\nArtículo 26.- El Programa Anual de Gasto Público deberá incluir un Programa Estatal de Inversión con el presupuesto asignado por programa y unidad administrativa responsable, su calendario de ejecución y las metas por alcanzar.\nEl Programa Anual de Gasto Público, el anteproyecto de Presupuesto de Egresos, el Programa Estatal de Inversión y los programas operativos anuales deberán estar organizados y ser congruentes con el Plan Estatal de Desarrollo.\nSECCIÓN TERCERA\nDE LA EVALUACIÓN\nArtículo 27.- La evaluación se refiere a la etapa de medición de la efectividad y el costo de las políticas públicas que se deriven del Plan Estatal de Desarrollo y de los programas estatales, de acuerdo a los resultados alcanzados.\nEl Comité y el Copladem emitirán las políticas, criterios y normatividad para llevar a cabo la evaluación de los resultados de políticas y programas.\nSECCIÓN CUARTA\nDEL CONTROL\nArtículo 28.- El Comité y el Copladem en el ámbito de su competencia, vigilarán el cumplimiento por parte de las dependencias y entidades de la administración pública, de las disposiciones en materia de planeación, programación y presupuestación y ejercicio del gasto.\nSECCIÓN QUINTA\nDE LA RENDICIÓN DE CUENTAS\nArtículo 29.- Las Dependencias y Entidades que tienen a su cargo programas o proyectos de inversión, deberán rendir un informe anual o cuando éste lo requiera al Comité y al Copladem según se trate, sobre la situación de los mismos, para los efectos del artículo 27 de esta Ley.\nCAPÍTULO QUINTO\nDE LA COORDINACIÓN\nArtículo 30.- El Ejecutivo del Estado y los Gobiernos Municipales podrán celebrar convenios con la Federación y con los sectores sociales y privado, para apoyarse recíprocamente y coadyuvar en el ámbito de sus respectivas jurisdicciones; así como coordinarse con los Gobiernos de otros Estados para ejecutar acciones de desarrollo regional.\nArtículo 31.- Para los efectos del artículo anterior, el Ejecutivo del Estado podrá convenir con la Federación:\nI. La participación de la Entidad en la planeación nacional, a través de la presentación de las propuestas que se estimen pertinentes;\nII. Los procedimientos e instrumentos de coordinación entre las autoridades federales, estatales y municipales para propiciar la planeación del desarrollo, así como para promover la participación de los diversos sectores de la sociedad en las actividades de planeación;\nIII. Los lineamientos y metodologías de apoyo para la realización de las actividades de planeación en el ámbito estatal;\nIV. La participación en la elaboración de los programas regionales del Gobierno Federal que incidan en el Estado;\nV. La ejecución de las acciones que deban realizarse en el Estado y que competan a diversos órdenes de gobierno.\nVI. El Ejecutivo del Estado podrá asignar los recursos de conformidad con los ordenamientos que dicten los acuerdos que se tomen en el Comité.\nVII. Las demás que le otorgue la Constitución y demás ordenamientos legales aplicables.\nArtículo 32.- El Ejecutivo del Estado y los Ayuntamientos podrán convenir:\nI. La participación de los municipios en la planeación estatal, mediante la presentación de las propuestas que éstos estimen pertinentes;\nII. Los procedimientos e instrumentos de cooperación y coordinación entre las autoridades estatales y planeación estatal;\nIII. La asesoría técnica para la realización de actividades de planeación, en el ámbito de su jurisdicción;\nIV. La participación en la formulación, instrumentación y ejecución de programas para el desarrollo municipal y regional; y\nV. La ejecución de las acciones que deban realizarse en cada municipio y que competan a ambos órdenes de\nGobierno.\nVI. Las demás acciones que sean necesarias para alcanzar los objetivos y metas de los planes estatal y municipal de desarrollo.\nArtículo 33.- En los convenios a que se refiere este Capítulo, el Ejecutivo del Estado y los Ayuntamientos acordarán ejecución.\nCAPÍTULO SEXTO\nDE LA PARTICIPACIÓN CIUDADANA EN LA PLANEACIÓN\nArtículo 34.- En el ámbito de la planeación, los ciudadanos y los diversos grupos sociales y privados podrán participar directamente en:\nI. Foros abiertos de consulta ciudadana para la formulación de propuestas a incorporarse en el Plan Estatal o\nMunicipal de Desarrollo; y\nII. Órganos ciudadanos de consulta permanente para temas específicos, que serán integrados a invitación del\nEjecutivo Estatal, por representantes de los distintos sectores de la sociedad.\nArtículo 35.- Las solicitudes que realicen la ciudadanía y las derivadas de las audiencias públicas serán consideradas por el Comité o el Copladem según corresponda, para la formulación de políticas públicas, el diseño de programas especiales y proyectos de inversión pública cuando su realización sea pertinente, viable y prioritaria.\nCAPÍTULO SÉPTIMO\nDE LA CONCERTACIÓN\nArtículo 36.- El Ejecutivo del Estado o los Ayuntamientos a través de las dependencias y entidades de la administración pública, podrá concertar la realización de las acciones previstas en los Planes de Desarrollo y los programas y proyectos, con las representaciones de los grupos sociales o con los particulares interesados, tomando en cuenta los criterios que emitan el Comité y el Copladem.\nArtículo 37.- La concertación a que se refiere el artículo anterior será objeto de contratos o convenios en los cuales se establecerán las responsabilidades que se deriven por su incumplimiento, a fin de asegurar el interés general y garantizar su ejecución en tiempo y forma.\nPRIMERO. El presente decreto entrará en vigor el día siguiente de su publicación en el Periódico Oficial del\nSEGUNDO. Se abroga la Ley de Planeación del Estado de Coahuila de Zaragoza, publicada en el Periódico Oficial\nTERCERO. Quedan vigentes todas las leyes, reglamentos y demás disposiciones legales en materia de planeación, en cuanto no se opongan a la presente Ley.\nDADO en el Salón de Sesiones del Congreso del Estado, en la Ciudad de Saltillo, Coahuila, a los nueve días del mes de diciembre del año dos mil ocho.\nDIPUTADO PRESIDENTE\nFRANCISCO JAVIER Z´ CRUZ SÁNCHEZ\n(RÚBRICA)\nDIPUTADO SECRETARIO DIPUTADO SECRETARIO\nJOSÉ REFUGIO SANDOVAL RODRÍGUEZ GENARO EDUARDO FUANTOS SÁNCHEZ\n(RÚBRICA) (RÚBRICA)\nIMPRÍMASE, COMUNÍQUESE Y OBSÉRVESE.\nSaltillo, Coahuila, 31 de Diciembre de 2008\nEL GOBERNADOR DEL ESTADO\nPROFR. HUMBERTO MOREIRA VALDÉS\n(RÚBRICA)\nARMANDO LUNA CANALES LIC. JAVIER VILLARREAL HERNÁNDEZ\n(RÚBRICA) (RÚBRICA)\nTRANSPORTE\nLIC. HUGO MARTÍNEZ GONZÁLEZ C.P. MARÍA ESTHER MONSIVÁIS GUAJARDO\n(RÚBRICA) (RÚBRICA)\nEL SECRETARIO DE LA FUNCIÓN PÚBLICA\nING. ISMAEL E. RAMOS FLORES\n(RÚBRICA)\nA CONTINUACION SE TRANSCRIBEN LOS ARTICULOS TRANSITORIOS DE LOS DECRETOS DE REFORMAS A LA PRESENTE LEY.\nSEGUNDO.- Las referencias que cualquier ordenamiento haga a la Secretaría de Finanzas del Estado, se entenderán hechas a la Tesorería\nGeneral del Estado, y las que se hagan al Secretario de Finanzas se entenderán al Tesorero General del Estado. y coordinación correspondiente a las entidades paraestatales; el conocimiento e integración de las propuestas de gasto e inversión que formulen las Dependencias y Entidades de la administración pública estatal; la presentación al Ejecutivo del Estado para su aprobación de los programas de inversión pública y autorización de los proyectos derivados de los mismos; la autorización de los montos globales de inversión pública del estado; la programación y operación de recursos destinados a los programas de inversión pública de las dependencias del\nEjecutivo, de sus organismos auxiliares y de las entidades paraestatales; el establecimiento y operación del sistema de seguimiento de los programas federales y estatales de inversión, conforme a las leyes y acuerdos de coordinación; y la representación del Ejecutivo en la celebración de negociaciones y convenios que involucren transferencias de fondos, ante la federación, los estados y entidades u organismos de los sectores paraestatal y privado, serán ejercidos por el Servicio de Administración Tributaria del Estado de Coahuila.\nCUARTO.- Se derogan todas las disposiciones legales y reglamentarias que se opongan al presente Decreto.",
  "ordenamiento": "REGLAMENTO",
  "jurisdiccion": "COAHUILA",
  "fuente_oficial": "DIARIO OFICIAL DE LA FEDERACION",
  "Fecha de Publicación": "17 de abril de 2009",
  "ULTIMA REFORMA PUBLICADA": "22 DE OCTUBRE DE 2010",
  "es_escaneado": false,
  "tiene_tablas": false,
  "materia": [
    "general"
  ]
}