{
  "titulo": "Ley Reglamentaria del Presupuesto de Egresos del Estado de Coahuila de Zaragoza.",
  "Contenido": "ZARAGOZA.\nEL C. ING. EULALIO GUTIERREZ TREVIÑO, GOBERNADOR CONSTITUCIONAL DEL ESTADO\nINDEPENDIENTE, LIBRE Y SOBERANO DE COAHUILA DE ZARAGOZA, A SUS HABITANTES SABED:\nEL XLVI CONGRESO CONSTITUCIONAL DEL ESTADO INDEPENDIENTE, LIBRE Y SOBERANO DE\nCOAHUILA DE ZARAGOZA,\nLEY REGLAMENTARIA DEL PRESUPUESTO DE EGRESOS DEL ESTADO DE COAHUILA DE\nZARAGOZA.\nCAPITULO PRIMERO\nCOMPETENCIA Y ATRIBUCIONES DE LA SECRETARÍA DE FINANZAS EN MATERIA DE\nPRESUPUESTO DE EGRESOS.\nARTICULO 1o.- Se entiende por Presupuesto de Egresos del Estado, la ley expedida por la Legislatura\nLocal, a iniciativa del Ejecutivo, en la que se contienen las previsiones financieras para sufragar el gasto público a cargo del Gobierno del Estado, durante el año fiscal que corresponda.\n(REFORMADO, P.O. 28 DE AGOSTO DE 2007)\nARTICULO 2o.- La Secretaría de Finanzas en materia de Presupuesto de Egresos, tendrá las atribuciones siguientes:\nI.- De acuerdo con las instrucciones del Ejecutivo, determinar anualmente en el proyecto de Presupuesto de Egresos, las sumas que se proponga destinar a cada una de las dependencias gubernamentales, en el ejercicio fiscal correspondiente; sin que el total de estas sumas exceda a la estimación de los ingresos del mismo ejercicio fiscal;\nII.- Revisar los proyectos preliminares de presupuestos que presenten las diversas dependencias de los\nPoderes Legislativo, Ejecutivo y Judicial, aumentando o disminuyendo sus dotaciones de conformidad con el programa elaborado para tal efecto por el C. Gobernador del Estado;\nIII.- Preparar y formular el proyecto de Presupuesto de Egresos del Estado, de conformidad con las prevenciones de esta Ley y su Reglamento;\nIV.- Vigilar la estricta ejecución del Presupuesto de Egresos de conformidad con lo dispuesto en esta Ley y su Reglamento, sin perjuicio de la facultad que la Constitución Política Local otorga a la Comisión de\nHacienda del Congreso del Estado en su articulo 67 Fracción XXXI.\nV.- Autorizar previamente los pagos o erogaciones de fondos que deban hacerse con cargo al\nPresupuesto de Egresos, con las excepciones que señale el Reglamento de esta Ley; así como establecer la forma de justificar y comprobar los pagos con cargo al Presupuesto de Egresos;\nVI.- Examinar en su aspecto financiero los contratos y demás actos que impongan obligaciones pecuniarias para el Estado, y dictaminar en relación a su procedencia en virtud de los limites presupuestales;\nVII.- Dictaminar sobre la conveniencia de que el Ejecutivo del Estado contrate los empréstitos o compromisos que requiera el desarrollo integral de la Entidad;\nVIII.- Realizar estudios de carácter presupuestal, con el propósito de formar estadísticas razonadas prestan. El resultado de los estudios y estadísticas a que se refiere esta fracción, servirá a la Secretaría para vigilar el correcto ejercicio del Presupuesto de Egresos, y la preparación del que habrá de regir en el ejercicio fiscal siguiente;\nIX.- Expedir el instructivo que regule la formación y aplicación del Presupuesto de Egresos, a que se refiere esta Ley.\n(REFORMADO, P.O. 28 DE AGOSTO DE 2007)\nARTICULO 3o.- La Secretaría de Finanzas desempeñará las atribuciones señaladas en el Artículo anterior, por conducto de la Dirección de Egresos de conformidad con las prescripciones de esta Ley y su\nReglamento.\n(REFORMADO, P.O. 28 DE AGOSTO DE 2007)\nARTICULO 4o.- La Secretaría de Finanzas deberá proporcionar a las diversas dependencias del\nEjecutivo y al Poder Judicial, todos los datos estadísticos, estudios o informes que requieran para la preparación y ejecución del Presupuesto, en lo que éste respectivamente les concierna.\n(REFORMADO, P.O. 28 DE AGOSTO DE 2007)\nARTICULO 5o.- La comisión que designe el Congreso del Estado, podrá recabar de la Secretaría de\nFinanzas todos los datos estadísticos o informes que puedan contribuir a la mejor inteligencia de las proposiciones contenidas en el proyecto de Presupuesto de Egresos.\nCAPITULO SEGUNDO.\nDE LA ESTRUCTURA DEL PRESUPUESTO DE EGRESOS.\nARTICULO 6o.- Para los efectos de esta Ley, el proyecto de Presupuesto de Egresos es el documento en virtud del cual el Ejecutivo presenta ante la Legislatura Local, en forma de previsiones de egresos, el programa de las actividades oficiales, obras y servicios públicos a cargo del Gobierno del Estado.\nARTICULO 7o.- El documento que presentará el Ejecutivo a la Legislatura de acuerdo con el artículo anterior, deberá contener:\nI.- Una estimación total de los ingresos correspondientes al próximo ejercicio fiscal;\nII.- Las previsiones de egresos destinados a cada rama de la administración pública; y\nIII.- Los demás informes financieros y datos estadísticos que el Ejecutivo estime conveniente agregar para la mejor inteligencia de su política hacendaria y del programa de la administración.\nARTICULO 8o.- Las previsiones de egresos a que se refiere la fracción II del artículo anterior, se clasificarán por ramas de la administración, y comprenderán por separado: los Poderes Legislativo y pública.\nARTICULO 9o.- Independientemente de la separación funcional, a que se refiere el artículo anterior, las previsiones de egresos se calcularán por su naturaleza, para someterlas a la aprobación del Congreso\nLocal, considerando las bases siguientes:\nI.- Como grupos fundamentales del gasto público, se considerarán los Capítulos que a continuación se enumeran:\nSERVICIOS PERSONALES;\nCOMPRA DE MUEBLES PARA ADMINISTRACION;\nSERVICIOS GENERALES;\nTRANSFERENCIAS;\nADQUISICION DE BIENES PARA FONDO Y CONSERVACION;\nOBRAS PUBLICAS Y CONSTRUCCIONES;\nINVERSIONES FINANCIERAS;\nEROGACIONES ESPECIALES;\nCANCELACION DE PASIVO;\nII.- Estos capítulos se distribuirán en partidas que representarán las autorizaciones específicas del\nPresupuesto.\n(REFORMADO, P.O. 28 DE AGOSTO DE 2007)\nARTICULO 10.- La división de los capítulos en partidas se hará en forma que determine el instructivo que al efecto expedirá la Secretaría de Finanzas, en los términos de la Fracción IX del Artículo 2o. de esta\nLey.\n(REFORMADO, P.O. 28 DE AGOSTO DE 2007)\nARTICULO 11.- El instructivo a que se refiere el artículo anterior, contendrá una clasificación de empleos en la que se cuidará de agrupar funciones afines, con el propósito de que las remuneraciones guarden una estrecha relación con el servicio que se desempeñe, en el entendido de que queda a juicio de la\nSecretaría de Finanzas, modificar la clasificación cuando así lo considere conveniente.\nCAPITULO TERCERO.\nDE LA PREPARACION DEL PRESUPUESTO.\n(REFORMADO, P.O. 28 DE AGOSTO DE 2007)\nARTICULO 12.- Antes del último día hábil del mes de Julio de cada año, las dependencias del Gobierno del Estado deberán enviar a la Secretaría de Finanzas, las observaciones que crean convenientes hacer al Presupuesto de Egresos en vigor, en lo que les concierne a cada una de ellas, proponiendo las modificaciones correspondientes para el ejercicio fiscal siguiente.\nARTICULO 13.- Con base en las observaciones y propuestas a que se refiere el artículo que precede, la\nPresupuesto, señalando las sumas asignadas a cada dependencia, de acuerdo con las indicaciones recibidas del C. Gobernador del Estado. El instructivo, una vez modificados se dará a conocer por la\nTesorería a cada una de las dependencias antes del último día hábil del mes de Agosto.\nARTICULO 14.- Dentro de los primeros 15 días del mes de septiembre a más tardar, las dependencias de cada uno de los Poderes del Estado enviarán a la Secretaría de Finanzas, sus proyectos preliminares de Presupuesto, ajustándose a la suma asignada de acuerdo con el Artículo anterior. Los proyectos en cuanto a su estructura formal, deberán seguir los lineamientos prescritos por el instructivo recibido de la\nTesorería.\nARTICULO 15.- Previos los estudios, revisiones o investigaciones que la Secretaría de Finanzas, estime necesario hacer, de acuerdo con lo previsto en el Capítulo Primero de esta Ley, esta Dependencia del último día hábil del mes de octubre. Anexo al proyecto de que se trata, la Secretaría presentará un informe en el que se hagan consistir los datos y consideraciones que sirvieron de base a la elaboración del mismo.\n(REFORMADO, P.O. 28 DE AGOSTO DE 2007)\nARTICULO 16.- Si alguna de las dependencias dejare de presentar su proyecto de Presupuesto en el plazo que fija la presente ley, la Secretaría de Finanzas quedará facultada para formularlo, a efecto de que se presente con oportunidad el proyecto de Presupuesto íntegro, a la Legislatura del Estado.\nCAPITULO CUARTO.\nDE LA INICIATIVA, DISCUSION Y APROBACION DEL PRESUPUESTO DE EGRESOS.\nARTICULO 17.- El C. Gobernador deberá presentar a la consideración de la Legislatura del Estado, el\nProyecto de Presupuesto de Egresos, en un plazo de 30 días contado a partir de la fecha en que se inicie el Período Ordinario de Sesiones del Congreso.\n(ADICIONADO, P.O. 17 DE AGOSTO DE 2007)\nARTICULO 18.- Una vez que la Legislatura del Estado haya aprobado la Ley de Ingresos, previa la discusión de la iniciativa correspondiente, presentada por el Ejecutivo de conformidad con la Constitución\nPolítica Local, se procederá al examen y estudio del proyecto de Presupuesto de Egresos, por conducto de la Comisión respectiva.\n(ADICIONADO, P.O. 17 DE AGOSTO DE 2007)\nEn el caso de no aprobarse alguna de las leyes de ingresos, continuarán en vigor las del año inmediato anterior del municipio o municipios de que se trate, con las actualizaciones que sean pertinentes de acuerdo al índice nacional de precios al consumidor.\n(REFORMADO, P.O. 28 DE AGOSTO DE 2007)\nARTICULO 19.- La Legislatura del Estado podrá solicitar la presencia del Secretario de Finanzas en las\nSesiones en que se discuta el proyecto de Presupuesto de Egresos.\nARTICULO 20.- Las asignaciones del Presupuesto que estuvieren previstas por leyes especiales, no podrán modificarse sin reformar dichas leyes por los procedimientos ordinarios.\nCAPITULO QUINTO.\nDE LA EJECUCION DEL PRESUPUESTO.\nARTICULO 21.- La Secretaría de Finanzas cuidará de la exacta aplicación del Presupuesto aprobado por la Legislatura Local, de conformidad con las disposiciones de esta Ley y su Reglamento. En el ejercicio\nPolítica Local otorga a la Comisión de Hacienda del Congreso del Estado, en su Artículo 67 Fracción\nXXXI.\nARTICULO 22.- La Secretaría de Finanzas no hará ningún pago que no esté expresamente consignado en el Presupuesto de Egresos, o autorizado por Leyes o Decretos especiales.\nARTICULO 23.- La asignación de las partidas fija el límite máximo de las erogaciones, a no ser que se\nPresupuesto, para aquellas erogaciones cuyo monto no sea posible prever.\nARTICULO 24.- La ministración de fondos públicos se hará por medio de autorizaciones de pago\nLey, o en su defecto, la Secretaría de Finanzas.\n(REFORMADO, P.O. 28 DE AGOSTO DE 2007)\nARTICULO 25.- La Secretaría de Finanzas examinará y emitirá el dictamen correspondiente, en relación a los actos y contratos que comprometan el crédito público para que por conducto del Gobernador del\nEstado sometidos a la consideración del Congreso del Estado para los efectos señalados en el Artículo\n67, fracción XIV de la Constitución Política Local.\n(REFORMADO, P.O. 28 DE AGOSTO DE 2007)\nARTICULO 26.- Ningún acto o contrato que genere un gasto con cargo al Presupuesto, se considerará exigible dentro del año fiscal en ejercicio, si no ha sido registrado y autorizado por la Secretaría de\nFinanzas, dentro de los límites presupuestales.\nARTICULO 27.- Se prohibe el traspaso de dotación de partidas. En casos urgentes de conveniencia general a juicio del Ejecutivo, éste solicitará al Congreso del Estado autorice las transferencias pertinentes con la modalidad requerida.\nARTICULO 28.- Las remuneraciones fijadas al personal que preste sus servicios al Gobierno del Estado, no podrán ser modificadas si no está previsto en el Presupuesto de Egresos respectivo.\nARTICULO 29.- La acción para exigir el pago de las remuneraciones del personal al servicio del\nGobierno del Estado, prescribe en la forma y términos que señala el Estatuto Jurídico para los\nTrabajadores al Servicio del Estado.\nARTICULO 30.- En todo caso en que se consignen en el Presupuesto sumas alzadas para cubrir salarios del personal obrero, será requisito indispensable hacer el Subpresupuesto correspondiente, separando las sumas que se destinen al personal fijo de elaboración y construcciones, de aquéllas que se refieran a personal extraordinario o contratado a destajo. Por ningún motivo se podrá cargar a partidas de esta naturaleza, gastos, sueldos u honorarios que no se refieran a salarios del personal obrero.\nARTICULO 31.- Cuando alguna dependencia del Ejecutivo utilice temporalmente personal ajeno a su ramo, el sueldo del empleado quedará a cargo de la oficina de que depende permanentemente; y si percibe por su comisión alguna otra remuneración ésta se cubrirá con cargo a la dependencia que en forma temporal utilice sus servicios.\nARTICULO 32.- Es incompatible el desempeño de un empleo o comisión remunerada con cargo a alguna partida del Presupuesto, con la percepción de otra remuneración por empleo o comisión del Estado, ARTICULO 33.- Sólo por acuerdo del C. Gobernador del Estado, podrán ser autorizados los pagos de cantidades con cargo a las partidas de Imprevistos, Gastos de Orden Social y las correspondientes a\nSubsidios y Subvenciones.\nCAPITULO SEXTO.\nDE LA EJECUCION DEL PRESUPUESTO EN MATERIA DE DEUDA PUBLICA.\nARTICULO 34.- Las partidas comprendidas en el Presupuesto sólo serán afectadas por el importe de los vencimientos del propio ejercicio, a excepción de las relativas a la Deuda Pública. En consecuencia, no se les deberán hacer cargos por conceptos que hubieren debido pagarse en años anteriores, ni anticipos por cuenta de ejercicios venideros. Tampoco es lícito contraer obligaciones que deban ser satisfechas en años posteriores, a menos que sean autorizadas por la Legislatura del Estado. En este último caso, las el registro, previsión y control de los compromisos para ejercicios futuros.\nARTICULO 35.- Para los efectos del Presupuesto, la deuda pública comprende las obligaciones provenientes de adeudos contraídos dentro de las asignaciones presupuestales, durante el ejercicio para el cual fueron fijadas, y que no hayan sido satisfechas a la terminación del propio ejercicio.\nLa deuda pública comprenderá asimismo, las obligaciones que deban ser satisfechas en años posteriores al que fueron contraídas, de conformidad con la autorización del Congreso del Estado.\n(REFORMADO, P.O. 28 DE AGOSTO DE 2007)\nARTICULO 36.- Cuando se pretenda contraer obligaciones financieras que afecten futuros ejercicios fiscales, la Secretaría de Finanzas emitirá un dictamen, manifestando su opinión en relación a la conveniencia o inconveniencia de la celebración de actos o contratos que contengan obligaciones financieras que afecten futuros ejercicios fiscales.\nARTICULO 37.- Para pagar las obligaciones que dentro de los términos legales se contraigan en un ejercicio fiscal, que deban cubrirse en años futuros, es necesario que las Dependencias incluyan dentro de sus presupuestos las cantidades necesarias para hacerlas efectivas, en las proporciones que se vayan devengando en cada ejercicio, pues sólo se comprenderán en la deuda pública, cuando para contraer esas obligaciones se haya hecho necesaria la contratación de un empréstito.\n(REFORMADO, P.O. 28 DE AGOSTO DE 2007)\nARTICULO 38.- Con los datos ministrados por las Dependencias del Gobierno, la Secretaría de Finanzas formulará, a más tardar el último de marzo, un estado que muestre el monto de la deuda pública flotante proveniente del ejercicio del Presupuesto. Las asignaciones por concepto de deuda pública destinada a cubrir las asignaciones a que se refiere el artículo anterior, se ampliaran aprovechando los saldos no afectados de las partidas del ejercicio fiscal precedente, hasta la cantidad necesaria para cubrir las obligaciones consignadas en el Estado formulado por la Secretaría de Finanzas.\nARTICULO 39.- El personal oficial que intervenga en los diversos trámites relativos a la aplicación de las disposiciones presupuestarias, estará obligado a guardar absoluta reserva en lo concerniente a la documentación y demás datos que se relacionen con la función que desempeñe. Dicha reserva no funcionarios encargados de la administración y de la defensa de los intereses fiscales estatales, a las\nCAPITULO SEPTIMO.\nDE LAS REFORMAS AL PRESUPUESTO DE EGRESOS.\nARTICULO 40.- La aplicación de leyes o decretos posteriores a la aprobación del Presupuesto de\nEgresos que implique el desembolso de fondos públicos no previstos, motivará las modificaciones necesarias al propio Presupuesto.\nARTICULO 41.- En los casos a que se refiere el artículo anterior, el Ejecutivo, por conducto de la\nPresupuesto General. gasto público autorizado para el Ejercicio Fiscal, el Ejecutivo del Estado, previa autorización del\nCongreso, queda facultado para aplicarlas dentro de la programación general de las actividades oficiales.\nARTICULO 42.- Cuando las asignaciones fijadas en el Presupuesto de Egresos resultaren insuficientes o inadecuadas para cubrir el servicio a que se destinen, las Dependencias Gubernamentales solicitarán de la Secretaría de Finanzas, las modificaciones correspondientes, presentando al efecto los informes que justifiquen su petición.\nEn los casos en que se considere justificada la modificación, la Secretaría de Finanzas preparará la iniciativa correspondiente para ser sometida por el Ejecutivo a la consideración de la Legislatura del\nEstado, si aquél lo estima pertinente.\nARTICULO PRIMERO.- La presente Ley entrará en vigor treinta días después de su publicación en el\nPeriódico Oficial del Gobierno del Estado.\nARTICULO SEGUNDO.- Se derogan todas las disposiciones legales que se opongan a esta Ley. mes de Abril de mil novecientos setenta y cinco.\nDIPUTADO PRESIDENTE.\nProfr. Arturo Berrueto González.\n(Rúbrica).\nDIPUTADO SECRETARIO. DIPUTADO SECRETARIO.\nLic. Jorge Cano Loperena. Ing. Santana Armando Guadiana Tijerina.\n(Rúbrica). (Rúbrica).\nIMPRIMASE, COMUNIQUESE Y OBSERVESE.\nSaltillo, Coahuila, Mayo 6 de 1975.\nEL GOBERNADOR CONSTITUCIONAL DEL ESTADO.\nING. EULALIO GUTIERREZ TREVIÑO.- Rúbrica.\nEL SECRETARIO DEL EJECUTIVO DEL ESTADO.\nLIC. OSCAR VILLEGAS RICO.- Rúbrica.\nN. DE E. A CONTINUACION SE TRANSCRIBEN LOS ARTICULOS TRANSITORIOS DE LOS DECRETOS DE\nREFORMAS A LA PRESENTE LEY.\nPRIMERO. El presente decreto entrará en vigor al día siguiente de su publicación en el Periódico Oficial del Estado.\nSEGUNDO. Se derogan todas las disposiciones que se opongan al presente decreto.\nPRIMERO. El presente decreto entrará en vigor al día siguiente de su publicación en el Periódico Oficial del Gobierno del Estado.\nSEGUNDO. Quedan derogadas las disposiciones legales que se opongan al presente decreto.",
  "ordenamiento": "REGLAMENTO",
  "jurisdiccion": "COAHUILA",
  "fuente_oficial": "DIARIO OFICIAL DE LA FEDERACION",
  "Fecha de Publicación": "2 de julio de 1975",
  "ULTIMA REFORMA PUBLICADA": "28 DE AGOSTO DE 2007",
  "es_escaneado": false,
  "tiene_tablas": false,
  "materia": [
    "fiscal"
  ]
}