{
  "titulo": "Ley de Responsabilidades de los Servidores Públicos Estatales y Municipales del Estado de Coahuila D",
  "Contenido": "ESTADO DE COAHUILA DE ZARAGOZA\nEL C. LIC. JOSE DE LAS FUENTES RODRIGUEZ, GOBERNADOR CONSTITUCIONAL DEL ESTADO\nINDEPENDIENTE, LIBRE Y SOBERANO DE COAHUILA DE ZARAGOZA, A SUS HABITANTES\nSABED:\nQue el Congreso del mismo ha decretado lo siguiente:\nEL CONGRESO DEL ESTADO INDEPENDIENTE, LIBRE Y SOBERANO DE COAHUILA DE\nZARAGOZA,\nLEY DE RESPONSABILIDAD DE LOS SERVIDORES PUBLICOS ESTATALES Y MUNICIPALES DEL\nESTADO DE COAHUILA DE ZARAGOZA\nTITULO PRIMERO\nCAPITULO UNICO\nDISPOSICIONES GENERALES\n(REFORMADO PRIMER PARRAFO, P.O. 16 DE NOVIEMBRE DE 2001)\nARTICULO 1o.- Esta ley tiene por objeto reglamentar el Capítulo Único del Título Séptimo de la\nI.- Los sujetos de responsabilidad en el servicio público;\nII.- Las obligaciones en el servicio público;\nIII.- Las responsabilidades y sanciones administrativas en el servicio público, así como las que se deban resolver mediante Juicio Político;\nIV.- Las autoridades competentes y los procedimientos para aplicar dichas sanciones;\nV.- Las autoridades competentes y los procedimientos para declarar la procedencia del enjuiciamiento\nVI.- El registro patrimonial de los servidores públicos.\nARTICULO 2o.- Son sujetos de esta Ley: estado y de los municipios cualquiera que sea su jerarquía, rango u origen de su nombramiento o lugar en que presten sus servicios, los consejeros electorales del Consejo General del Instituto Electoral y de\nParticipación Ciudadana de Coahuila y, en general, toda persona que desempeñe un empleo, cargo o comisión de cualquier naturaleza en la Administración Pública, Estatal o Municipal, y en las entidades paraestatales o paramunicipales.\nII.- Todos aquellos servidores públicos o personas que manejen o apliquen recursos económicos, estatales y municipales.\nIII.- Todos aquellos servidores públicos o personas que manejen o apliquen recursos económicos federales, transferidos a los estados y municipios, mediante los convenios y acuerdos respectivos.\nARTICULO 3o.- Son autoridades competentes para aplicar la presente Ley:\nI.- El Gobernador del Estado;\nII.- El Congreso del Estado;\nIII.- El pleno del Tribunal Superior de Justicia del Estado;\nIV.- La Procuraduría General de Justicia en el Estado;\n(REFORMADA, P.O. 26 DE ENERO DE 2007)\nV.- La Secretaría de la Función Pública;\nVI.- Los Organos de Control de los Poderes Legislativo y Judicial;\nVII.- Las Dependencias de los Poderes Ejecutivo, Legislativo y Judicial;\nVIII.- Los Ayuntamientos Municipales y sus Dependencias;\nIX.- Los Organos Municipales de Control;\n(REFORMADA, P.O. 16 DE NOVIEMBRE DE 2001)\nX. Los organismos públicos autónomos, así como los Consejos Directivos u órganos de gobierno equivalentes, y las dependencias respectivas de las entidades paraestatales y paramunicipales; y\nXI.- Los demás Organos que determinen los Ordenamientos Legales aplicables.\nARTICULO 4o.- Los procedimientos para la aplicación de las sanciones a que se refiere el último párrafo naturaleza y por la vía procesal que corresponda, debiendo las autoridades a que alude el artículo anterior turnar las denuncias a quien deba conocer de ellas. No podrán imponerse dos veces por una sola conducta, sanciones de la misma naturaleza.\nARTICULO 5o.- Para los efectos de esta Ley se entenderá:\nI.- Por Comisión Instructora: La Comisión Instructora de Juicio Político y Declaración de Procedencia en\nMateria de Responsabilidad Penal del Congreso;\nII.- Por Órgano Estatal de Control: La Secretaría de la Función Pública;\nIII.- Por Organos de Control de los Poderes Legislativo y Judicial: Las áreas o unidades administrativas que tengan a su cargo las funciones de control;\nIV.- Por Organo Municipal de Control: El órgano administrativo dependiente del Ayuntamiento, que tenga a su cargo las funciones de contraloría;\nV.- Por Titular de la Dependencia: El servidor público que conforme a los ordenamientos jurídicos o administrativos aplicables, desempeñe la titularidad o sea responsable legal de una determinada área, órgano o dependencia de los Poderes Legislativo, Ejecutivo o Judicial; de los Ayuntamientos o de\nEntidades Paraestatales o Paramunicipales;\nVI.- Por Superior Jerárquico: El jefe inmediato del servidor público, en los términos de los Ordenamientos\nJurídicos o Administrativos aplicables.\nTITULO SEGUNDO\nDECLARACION DE PROCEDENCIA\nCAPITULO PRIMERO\nSUJETOS, CAUSAS DE JUICIO POLITICO Y SANCIONES\n(REFORMADO, P.O. 16 DE NOVIEMBRE DE 2001)\nARTICULO 6o.- Son sujetos de juicio político: los Diputados del Congreso del Estado; el Gobernador del\nEstado; los secretarios del ramo; el Procurador General de Justicia; los subsecretarios; los subprocuradores de justicia; los directores generales y los directores de las dependencias del Poder\nEjecutivo; los Magistrados del Tribunal Superior de Justicia; los Magistrados del Tribunal Electoral; los\nMagistrados de los Tribunales Unitarios de Distrito; los Jueces de Primera Instancia; los presidentes, regidores y síndicos de los Ayuntamientos del estado; los integrantes de los Concejos Municipales; los directores generales o sus equivalentes de las entidades paraestatales y paramunicipales y los consejeros electorales propietarios del Consejo General del Instituto Electoral y de Participación\nCiudadana de Coahuila.\nARTICULO 7o.- Es procedente el juicio político, cuando los actos u omisiones de los servidores públicos a que se refiere el artículo anterior, redunden en perjuicio de los intereses públicos fundamentales o de su buen despacho.\nARTICULO 8o.- Redundan en perjuicio de los intereses públicos fundamentales y de su buen despacho:\nI.- El ataque a las instituciones democráticas;\nII.- El ataque a la forma de gobierno republicano, representativo y popular; así como a los niveles de gobierno federal, estatal y municipal;\nIII.- Las violaciones graves y sistemáticas a las garantías individuales o sociales;\nIV.- El ataque a la libertad de sufragio;\nV.- La usurpación de atribuciones;\nVI.- Cualquier infracción a la Constitución Política de los Estados Unidos Mexicanos, a la Constitución a la Federación, al Estado, a uno o varios Municipios del Estado, a la sociedad, o motive algún trastorno en el funcionamiento normal de las instituciones;\nVII.- Las omisiones de carácter grave, en los términos de la fracción anterior;\nVIII.- Las violaciones sistemáticas o graves a los planes, programas y presupuestos de la Administración\nPública Estatal o de los Municipios; a las leyes y demás ordenamientos que determinen el manejo de los recursos económicos estatales y municipales, y a los convenios y acuerdos de coordinación que para la transferencia de dichos recursos se celebren.\nNo procede el juicio político por la mera expresión de ideas. artículo. Cuando aquéllos tengan carácter delictuoso se formulará la declaración de procedencia a que alude la presente Ley, y se estará a lo dispuesto por la legislación penal aplicable al caso concreto.\nARTICULO 9o.- Si la resolución que se dicte en el juicio político es condenatoria, se sancionará al servidor público con destitución. Podrá también imponerse inhabilitación para el ejercicio de empleos, cargos o comisiones en el servicio público desde un año hasta veinte años.\nCAPITULO SEGUNDO\nPROCEDIMIENTO EN EL JUICIO POLITICO\nARTICULO 10.- El juicio político sólo podrá iniciarse durante el tiempo en que el servidor público desempeñe su empleo, cargo o comisión y dentro de un año después de que se separe del ejercicio de sus funciones, o en su caso, de la fecha en la que concluya el término de los efectos de su nombramiento.\nLas sanciones respectivas se aplicarán en un plazo no mayor de un año a partir de iniciado el procedimiento.\n(REFORMADO, P.O. 26 DE ENERO DE 2007)\nARTICULO 11.- Corresponde al Congreso del Estado, instruir el procedimiento relativo al juicio político en los términos de su Ley Orgánica y la presente Ley.\nAl efecto, una vez instalado el Congreso, en el año en que deba llevarse a cabo su renovación, dentro de las comisiones permanentes que se nombren, deberá designarse la Comisión Instructora del Juicio\nPolítico y de Declaración de Procedencia en Materia de Responsabilidad Penal, misma que para la sustanciación del procedimiento consignado en la presente ley, se constituirá en órgano de acusación, y el Congreso, en jurado de sentencia, previa declaración de su Presidente.\nARTICULO 12.- Los miembros de la Comisión Instructora y los demás Diputados del Congreso del\nEstado, que hayan de intervenir en algún acto del procedimiento, podrán excusarse o ser recusados por algunas de las causas e impedimentos que señala el Código de Procedimientos Penales. Unicamente con expresión de causa, podrá el inculpado recusar a unos u otros.\nEl propio servidor público sólo podrá hacer valer la recusación, desde que se le requiera para el nombramiento de defensor, hasta la fecha en que se cite al Congreso del Estado para resolver como jurado de sentencia.\nARTICULO 13.- Presentada la excusa o la recusación, se calificará dentro de los ocho días naturales siguientes, en un incidente que se sustanciará ante la Comisión Instructora, si se refiere a uno de sus miembros o ante el Congreso si se refiere a los demás Diputados. Si en uno u otro caso se califica de legal la excusa o recusación, se llamará a los suplentes. En el incidente se escuchará al denunciante y al servidor público denunciado, recibiéndose las pruebas correspondientes.\nARTICULO 14.- Cualquier ciudadano bajo su más estricta responsabilidad y presentando los elementos de prueba correspondientes, podrá formular por escrito denuncia, fundada y motivada, ante el Congreso del Estado por las conductas de los servidores públicos a que se refiere el artículo 6o. de la presente Ley.\nPresentada la denuncia, y ratificada que sea ésta dentro de los tres días naturales de la fecha de su presentación, se turnará con la documentación correspondiente, a la Comisión de Gobernación y Puntos\nConstitucionales, para que dictamine si la conducta atribuida corresponde a las enumeradas, en el artículo 8o.; y si el inculpado esta comprendido entre los servidores públicos a que se refiere el artículo\n6o. de esta Ley; así como si la denuncia es procedente, y por lo tanto amerita la incoación del procedimiento.\nUna vez acreditados estos supuestos, la denuncia se turnará a la Comisión Instructora. En caso contrario, declarará su improcedencia archivándose el expediente. Las denuncias anónimas o que no están suscritas o ratificadas por el denunciante, no producirán ningún efecto.\nARTICULO 15.- La Comisión Instructora, una vez que haya recibido la denuncia practicará todas las diligencias necesarias para la comprobación de la conducta o hecho materia de aquella; estableciendo las características y circunstancias del caso, y precisando la intervención que haya tenido el servidor público denunciado.\nHecho lo anterior, notificará la misma al denunciado dentro de los tres días naturales siguientes a la fecha del dictamen respectivo, haciéndole saber que deberá comparecer o informar por escrito en un plazo que no excederá de siete días naturales, lo que a su derecho convenga; si no lo hiciere, se entenderá que niega los hechos de la denuncia.\nARTICULO 16.- La Comisión Instructora abrirá un período de prueba de treinta días naturales, dentro del cual recibirá las pruebas que ofrezca el denunciante y el servidor público, así como las que la propia\nComisión Instructora estime necesarias.\nSi al concluir el plazo señalado no hubiese sido posible recibir las pruebas ofrecidas oportunamente o es preciso allegarse otras, la Comisión Instructora podrá ampliarlo en la medida que resulte necesario.\nEn todo caso, la Comisión Instructora calificará la pertinencia de las pruebas, desechando las que a su juicio sean improcedentes.\nARTICULO 17.- Terminada la instrucción del procedimiento, se pondrá el expediente a la vista del denunciante por un plazo de tres días naturales y posteriormente, por otros tres días, al servidor público y sus defensores, a fin de que se alleguen los datos necesarios para formular alegatos, mismos que deberán presentar por escrito, dentro de los seis días naturales siguientes a la conclusión del segundo plazo mencionado.\nARTICULO 18.- Transcurrido el plazo para la presentación de alegatos, se hayan o no entregado estos, la Comisión Instructora formulará sus conclusiones en vista de las constancias del procedimiento. Para este efecto analizará clara y metódicamente la conducta de los hechos imputados y hará las consideraciones jurídicas que proceden para justificar, en su caso, la conclusión o la continuación del procedimiento.\nARTICULO 19.- La Comisión Instructora podrá ordenar en cualquier etapa del procedimiento, la realización de diligencias que le permitan recabar mayores elementos de juicio, requiriéndose cuando se estime necesario la comparecencia del denunciado o denunciante, o la aportación por escrito de la información que les solicite la Comisión.\nCuando estas diligencias deban efectuarse en lugar distinto a la Capital del Estado, ésta podrá encomendarlas al Juez de Primera Instancia competente en el lugar en que deban efectuarse, mediante requisitoria que firmarán los integrantes de la Comisión Instructora.\nEl juez requerido practicará las diligencias encomendadas, con sujeción a las determinaciones que se le comuniquen.\nARTICULO 20.- La Comisión Instructora deberá practicar todas las diligencias y formular sus conclusiones hasta entregarlas a los Secretarios del Congreso, dentro del plazo de noventa días naturales, contados desde el día siguiente a la fecha en que se le haya turnado la denuncia, a no ser que por causa razonable y fundada se encuentre impedida para hacerlo. En este caso, podrá solicitar del\nCongreso que se amplíe el plazo por el tiempo indispensable para perfeccionar la instrucción. El nuevo plazo que se conceda no excederá de sesenta días.\nARTICULO 21.- Si de las constancias del procedimiento se desprende la inocencia del servidor público, proceder en su contra por la conducta o el hecho materia de la denuncia que dió origen al procedimiento.\nEn caso contrario, si de las constancias aparece justificable la responsabilidad del servidor público, a juicio de la Comisión Instructora, sus conclusiones terminarán proponiendo al Congreso la aprobación de lo siguiente:\nI.- Que esta legalmente comprobada la conducta o el hecho materia de la denuncia;\nII.- Que existe responsabilidad del servidor público denunciado; y\nIII.- La sanción que deba imponerse de acuerdo con el artículo 9o. de esta Ley.\nDe igual manera deberán asentarse en las conclusiones las circunstancias que hubieren concurrido en los hechos.\nARTICULO 22.- Una vez emitidas las conclusiones a que se refiere el artículo anterior, la Comisión\nInstructora las entregará a los Secretarios del Congreso para que a su vez, las hagan llegar al Presidente, quien anunciará que éste deberá reunirse y resolver sobre la imputación, dentro de los tres días naturales siguientes, erigido en jurado de sentencia.\nTal hecho lo comunicarán los Secretarios al denunciante, y al servidor público denunciado, para que aquel se presente por sí, y éste lo haga personalmente asistido de su defensor, a fin de que aleguen lo que a su derecho convenga.\nARTICULO 23.- El Congreso no podrá erigirse en jurado de sentencia, sin que antes se compruebe fehacientemente que el servidor público, su defensor y el denunciante, han sido debidamente notificados para comparecer a la sesión a que se refiere el artículo anterior.\nARTICULO 24.- No podrán votar en ningún caso los Diputados que hubiesen presentado la imputación contra el servidor público. Tampoco podrán hacerlo el o los Diputados que hayan aceptado el cargo de defensor, aún cuando lo renuncien después de haber comenzado a ejercer el cargo.\nARTICULO 25.- Las declaraciones y resoluciones que en materia de juicio político emita el Congreso, se acordarán en sesión pública, excepto en la que se presente la denuncia, o cuando las buenas costumbres o el interés general exija que la audiencia sea secreta.\nARTICULO 26.- El día señalado conforme al artículo 22, el Congreso se erigirá en jurado de sentencia previa declaración de su Presidente. En seguida la Secretaría dará lectura a las constancias conclusiones de la Comisión Instructora. Acto continuo se concederá la palabra al denunciante y en lo que convenga a sus derechos.\nEl denunciante podrá replicar y si lo hiciere, el imputado y su defensor podrán hacer uso de la palabra en último término. conclusiones y propuestas de la Comisión Instructora.\nARTICULO 27.- Si el Congreso resolviere que no procede acusar al servidor público, éste continuará en el ejercicio de su cargo. En caso contrario, el Congreso erigido en Jurado de Sentencia, impondrá las sanciones a que se refiere el artículo 9o. de esta Ley, mediante la resolución de las dos terceras partes del total de sus miembros.\nARTICULO 28.- Cuando en los términos del segundo párrafo del artículo 110 de la Constitución Política de los Estados Unidos Mexicanos y el artículo 24 de la Ley Federal de Responsabilidad de los servidores expediente integrado con motivo del juicio político instaurado en contra del Gobernador del Estado, Diputados del Congreso Local, y Magistrados del Tribunal Superior de Justicia, éste deberá celebrar una sesión, cuya fecha y hora le será comunicada por la Secretaría del Congreso al servidor público sentenciado.\nEn la fecha y hora señalada, y una vez reunido el Congreso en Pleno, la Secretaría procederá a dar lectura a las constancias procedimentales que obren en el expediente respectivo.\nConocida que sea la sentencia emitida por la Cámara de Senadores, el Congreso mediante la resolución de las dos terceras partes del total de sus miembros, procederá en los términos que señala la\nCongreso en este caso, será inatacable.\n(REFORMADO, P.O. 26 DE ENERO DE 2007)\nSi la remisión del expediente a que se refiere el primer párrafo de este artículo, tuviere lugar una vez concluido el período ordinario de sesiones del Congreso, la Diputación Permanente convocará a un período extraordinario, para que sea el Congreso en pleno, quien acuerde lo procedente.\nCAPITULO TERCERO\nDE LA DECLARACION DE PROCEDENCIA EN MATERIA DE RESPONSABILIDAD PENAL\nARTICULO 29.- Para los efectos de este capítulo, por declaración de procedencia se entiende la resolución emitida por el Congreso del Estado, determinando la procedibilidad del enjuiciamiento del servidor público, quien quedará a disposición de la autoridad competente, para que se proceda conforme a la legislación de la materia.\nARTICULO 30.- Cualquier ciudadano, bajo su más estricta responsabilidad y presentando los elementos de prueba correspondientes, podrá formular por escrito, denuncia o querella, fundada y motivada, ante el\nCongreso del Estado, por la Comisión de delitos cometidos durante el tiempo de su encargo por los servidores públicos a que se refiere el artículo 31 de la presente ley.\nEl Ministerio Público, en su caso, podrá formular requerimientos ante el propio Congreso del Estado, para los mismos efectos.\nARTICULO 31.- Para proceder penalmente contra el Gobernador del Estado; los Diputados del Congreso\nLocal; los Magistrados del Tribunal Superior de Justicia; los Magistrados del Tribunal Electoral; los secretarios del ramo; el Procurador General de Justicia; los presidentes, regidores y síndicos de los\nAyuntamientos; los integrantes de los Concejos Municipales; los consejeros electorales propietarios del\nConsejo General del Instituto Electoral y de Participación Ciudadana de Coahuila, por la comisión de delitos durante el tiempo de su encargo, el Congreso del Estado deberá declarar mediante resolución de las dos terceras partes del total de sus miembros, si ha o no lugar a proceder contra el inculpado, sujetándose a la garantía de audiencia.\nARTICULO 32.- Corresponde al Congreso del Estado instruir el procedimiento relativo a la declaración de procedencia en materia de responsabilidad penal.\nPresentada la denuncia o querella, o requerimiento del Ministerio Público y ratificada que sea esta dentro de los tres días naturales a la fecha de su presentación, el Presidente del Congreso la turnará, por riguroso orden, a la Comisión de Gobernación y Puntos Constitucionales, para que dictamine su procedencia, y si por lo tanto amerita la incoación del procedimiento.\nDe dictaminarse la procedencia de las denuncias, querellas o requerimientos del Ministerio Público, se turnarán a la Comisión Instructora a que se refiere el artículo 11 de esta Ley. En caso contrario, se declarará su improcedencia, archivándose el expediente. Las denuncias anónimas o que no están suscritas o sean ratificadas por el denunciante o querellante, no producirán ningún efecto.\nLos miembros de la Comisión Instructora, y los demás Diputados del Congreso que hayan de intervenir en algún acto del procedimiento, deberán excusarse o podrán ser recusados en los términos de los artículos 12 y 13 de esta Ley.\nARTICULO 33.- Para los efectos de la práctica de diligencias, requisitos legales que deban contener, notificaciones; plazos, y efectos de las mismas, términos y duración del período probatorio y demás actos procedimentales que se efectúen, a partir de que se turne la denuncia o querella o requerimiento del\nMinisterio Público a la Comisión Instructora, hasta la resolución de declaración emitida por el Congreso del Estado, se observarán en lo pertinente las disposiciones contenidas en los artículos 15, 16, 17, 18, 19, 20, 21, fracción I y II, 22, 23, 24, 25 y 26 de la presente Ley.\nARTICULO 34.- Si el Congreso resolviere que no procede acusar al servidor público denunciado, éste continuará en el ejercicio de su cargo. En caso contrario, el Congreso pondrá al inculpado a disposición de la autoridad competente, para los efectos legales que correspondan.\nLas declaraciones que en estos casos emita el Congreso del Estado, serán inatacables.\n(REFORMADO, P.O. 16 DE NOVIEMBRE DE 2001)\nARTICULO 35.- Cuando se trate del Gobernador del Estado, de los Diputados del Congreso Local, de los\nMagistrados del Tribunal Superior de Justicia, de los Magistrados del Tribunal Electoral, o de los consejeros electorales propietarios del Consejo General del Instituto Electoral y de Participación\nCiudadana, éstos quedarán sujetos a la acción del Pleno del Tribunal Superior de Justicia, el cual fallará en definitiva, previas las formalidades esenciales del procedimiento y con audiencia del inculpado, del\nMinisterio Público y del acusador, si lo hubiere.\nARTICULO 36.- Si la declaración del Congreso fuere en sentido negativo, se suspenderá todo procedimiento ulterior, pero ello no será obstáculo para que la imputación por la comisión del delito continúe su curso, cuando el inculpado haya concluido el ejercicio de su encargo, pues la resolución no prejuzga los fundamentos de la imputación.\nARTICULO 37.- El efecto de la declaración de que ha lugar a proceder contra el inculpado, será suspenderlo de su encargo en tanto esté sujeto a proceso penal. Si este culmina en sentencia absolutoria, el inculpado podrá reasumir su cargo si no ha concluido el período legal del mismo. Si la sentencia fuese condenatoria, no se concederá al reo la gracia del indulto.\nARTICULO 38.- Las sanciones penales se aplicarán de acuerdo con lo dispuesto en la legislación penal; y tratándose de delitos por cuya comisión el autor obtenga un beneficio económico, o cause daños o perjuicios patrimoniales, deberán graduarse de acuerdo con el lucro obtenido y con la necesidad de satisfacer los daños y perjuicios causados por su conducta ilícita.\nLas sanciones económicas que se impongan en éstos casos, no podrán exceder de tres tantos de los beneficios obtenidos o de los daños o perjuicios causados.\nARTICULO 39.- No se requerirá declaración de procedencia por parte del Congreso del Estado, cuando alguno de los servidores públicos a que se refiere el artículo 31 de esta Ley, cometa un delito durante el tiempo en que se encuentre separado de su encargo.\nSi el servidor público volviere a ejercer sus funciones, fuese nombrado, o resultare electo para desempeñar un cargo distinto, pero de los enumerados en el artículo 31, se procederá de acuerdo con lo dispuesto por ese mismo artículo.\nAsimismo, no se requerirá la declaración de procedencia cuando se entablen demandas del orden civil en contra de cualquiera de los servidores públicos a que se refiere el artículo 31 del presente ordenamiento.\nARTICULO 40.- Cuando se siga proceso penal a un servidor público de los señalados en el artículo 31 del presente ordenamiento, sin haber satisfecho el procedimiento de declaración de procedencia en materia de responsabilidad penal, el Presidente del Congreso librará oficio al Juez o Tribunal que conozca de la causa, a fin de que suspenda el proceso en tanto se plantea y resuelve si ha lugar a proceder.\nARTICULO 41.- Cuando en el curso del procedimiento instaurado en contra de un servidor público de los señalados en el artículo 31 de esta Ley, se presentare nueva denuncia en su contra, se procederá respecto de ella con arreglo a este Ordenamiento hasta agotar la instrucción de los diversos procedimientos, procurando, de ser posible, la acumulación procesal.\nSi la acumulación fuese procedente, la Comisión Instructora formulará en un solo documento sus resoluciones, que comprenderán el resultado de los diversos procedimientos.\nARTICULO 42.- Cuando en los términos del 5o. párrafo del artículo 111 de la Constitución Política de los\nEstados Unidos Mexicanos y párrafo 2o. del artículo 28 de la Ley Federal de Responsabilidad de los\nServidores Públicos, el Congreso del Estado reciba de la Cámara de Diputados del Congreso de la\nUnión, la declaración de procedencia por la posible comisión de delitos federales por parte del\nGobernador del Estado, Diputados del Congreso Local, y Magistrados del Tribunal Superior de Justicia, éste deberá celebrar una sesión, cuya fecha y hora, se le comunicará por la Secretaría del Congreso al servidor público inculpado.\nEn la fecha y hora señalada, y una vez satisfecho el quórum legal, la Secretaría del Congreso procederá a dar lectura a las constancias procedimentales que obren y fundamenten la declaratoria respectiva.\nConocida que sea la declaración de procedencia emitida por la Cámara de Diputados, el Congreso del\nEstado, procederá en los términos que señala la Constitución Política Local y los demás ordenamientos jurídicos aplicables. La resolución que emita el Congreso en este caso será inatacable.\n(REFORMADO, P.O. 26 DE ENERO DE 2007)\nSi la remisión de la declaración de procedencia tuviere lugar una vez concluido el período ordinario de sesiones del Congreso, la Diputación Permanente convocará a un período extraordinario, para que sea el\nCongreso en pleno quien acuerde lo procedente.\n(REFORMADO, P.O. 26 DE ENERO DE 2007)\nARTICULO 43.- Tratándose de la presentación de denuncias o querellas o requerimientos del Ministerio\nPúblico, por la comisión de delitos, por los servidores públicos a que se refiere el artículo 31 de la presente Ley, una vez concluido el período ordinario de sesiones del Congreso, la Diputación\nPermanente calificará la importancia o gravedad de los hechos imputados, para determinar si procede convocar al Congreso a un período extraordinario de sesiones, para que sea éste en pleno, quien acuerde lo procedente.\nARTICULO 44.- La responsabilidad derivada de delitos cometidos por cualquier servidor público, durante el tiempo del encargo, será exigible de acuerdo con los plazos de prescripción consignados en el Código\nPenal, los cuales nunca deberán de ser inferiores a tres años. Los plazos de prescripción se interrumpen en tanto el servidor público desempeña alguno de los cargos a que hace referencia el artículo 31 de la presente Ley.\nCAPITULO CUARTO\nARTICULO 45.- Las partes que intervengan en los procedimientos de juicio político y de declaración de procedencia en materia de responsabilidad penal, podrán solicitar de las oficinas o autoridades correspondientes, las copias certificadas de documentos que pretendan ofrecer como prueba ante la\nComisión Instructora o ante el Congreso.\nLas autoridades estarán obligadas a expedir dichas copias certificadas sin demora, y si no lo hicieren, la\nComisión Instructora o el Congreso del Estado, a petición del interesado, señalará a la autoridad omisa un plazo razonable para que las expida bajo apercibimiento de imponerle una multa de diez a cien veces el salario mínimo vigente correspondiente a la Capital del Estado, sanción que se hará efectiva si la autoridad no la expidiere. Si resultare falso que el interesado hubiere solicitado las constancias, la multa se hará efectiva en su contra.\n(REFORMADO, P.O. 26 DE ENERO DE 2007)\nARTICULO 46.- Las declaraciones o resoluciones aprobadas por el Congreso con apego a esta Ley, se comunicarán al propio Servidor Público, al Titular de la Dependencia donde éste preste sus servicios, al\nAyuntamiento Municipal respectivo, al Secretario de Finanzas, para su conocimiento y efectos legales, y al Secretario de Gobierno, para su publicación en el Periódico Oficial del Gobierno del Estado.\nARTICULO 47.- La Comisión Instructora de Juicio Político y de Declaración de Procedencia en materia de Responsabilidad Penal, podrá disponer las medidas de apercibimiento que fueren procedentes mediante acuerdo de la mayoría de sus miembros.\nARTICULO 48.- En ningún caso, podrá dispensarse un trámite de los establecidos para el procedimiento de juicio político y de declaración de procedencia en materia de responsabilidad penal.\nARTICULO 49.- Los plazos a que se refieren los procedimientos de juicio político y de declaración de procedencia en materia de responsabilidad penal, se entienden comprendidos dentro del período ordinario de sesiones del Congreso del Estado, o bien dentro del siguiente extraordinario a que se convoque.\nARTICULO 50.- En todas las cuestiones relativas a los procedimientos de juicio político y de declaración de procedencia en materia de responsabilidad penal, no previstas en esta Ley, así como en la apreciación de las pruebas, se observarán las disposiciones del Código de Procedimientos Penales vigente en el Estado. Asimismo, se atenderán en lo conducente las del Código Penal del Estado.\nTITULO TERCERO\nRESPONSABILIDADES ADMINISTRATIVAS\nCAPITULO I\nSUJETOS Y OBLIGACIONES DEL SERVIDOR PUBLICO\nARTICULO 51.- Incurren en responsabilidad administrativa, los servidores públicos a que se refiere el del Estado, queda excluido de responsabilidad administrativa.\nARTICULO 52.- Todo servidor publico tendrá las siguientes obligaciones para salvaguardar la legalidad, honradez, lealtad, imparcialidad y eficiencia que deben ser observadas en el desempeño de su empleo, según la naturaleza de la infracción en que incurra, y sin perjuicio de sus derechos laborales:\nI.- Cumplir con la máxima diligencia el servicio que le sea encomendado y abstenerse de cualquier acto u un empleo, cargo o comisión;\nII.- Formular y ejecutar legalmente, en su caso, los planes, programas y presupuestos correspondientes a su competencia, y cumplir las leyes y otras normas que determinen el manejo de recursos económicos públicos;\nIII.- Utilizar los recursos que tenga asignados para el desempeño de su empleo, cargo o comisión; las facultades que le sean atribuidas o la información reservada a que tenga acceso por su función, exclusivamente para los fines a que estén afectos;\nIV.- Custodiar y cuidar la documentación e información que por razón de su empleo, cargo o comisión, conserve bajo su cuidado o a la cual tenga acceso, impidiendo o evitando el uso, la sustracción, destrucción, ocultamiento o inutilización indebidas de aquéllas;\n(REFORMADA, P.O. 31 DE JULIO DE 2007)\nV.- Observar buena conducta en su empleo, cargo o comisión, tratando con respeto, diligencia, imparcialidad y rectitud a las personas con las que tenga relación con motivo de éste, evitando la discriminación y segregación de las mismas, por razón de sexo, edad, preferencias sexuales, creencias religiosas, estado de gravidez, antecedentes penales o cualquier otra que signifique un detrimento hacia la igualdad de las personas;\nVI.- Observar en la dirección de sus inferiores jerárquicos las debidas reglas del trato y abstenerse de incurrir en agravio, desviación o abuso de autoridad;\nVII.- Observar respeto y subordinación legítima, con respecto a sus superiores jerárquicos inmediatos o mediatos, cumpliendo las disposiciones que estos dicten en el ejercicio de sus atribuciones;\n(REFORMADA, P.O. 22 DE JUNIO DE 1993)\nVIII.- Comunicar por escrito al titular de la dependencia o entidad en que preste sus servicios, las dudas justificadas que le suscite la procedencia de las órdenes que reciba, debiendo fundar debidamente sus observaciones;\nIV.- Abstenerse de ejercer las funciones de un empleo cargo o comisión, después de concluido el período para el cual se le designo o de haber cesado, por cualquier otra causa, en el ejercicio de sus funciones;\nX.- Abstenerse de disponer o autorizar a un subordinado a no asistir a sus labores sin causa justificada, por más de quince días continuos o treinta discontinuos en un año, así como de otorgar indebidamente licencias, permisos o comisiones con goce parcial o total de sueldo y otras percepciones, cuando las necesidades del servicio público no lo exijan;\nXI.- Abstenerse de desempeñar algún otro empleo, cargo o comisión oficial o particular que la ley le prohiba;\nXII.- Abstenerse de autorizar la selección, contratación, nombramiento o designación de quien se encuentre inhabilitado por resolución firme de la autoridad competente, para ocupar un empleo, cargo o comisión en el servicio público;\nXIII.- Abstenerse de efectuar cualquier práctica discriminatoria que limite u obstaculice las oportunidades de acceso, permanencia y ascenso de trabajo, así como el ingreso a los programas de capacitación y formación profesional, o cualquier otra que signifique un detrimento hacia la igualdad de las personas;\nXIV.- Excusarse de intervenir en cualquier forma en la atención, tramitación o resolución de asuntos en los que tengan interés personal, familiar o de negocios, incluyendo aquellas de los que pueda resultar algún beneficio para él, su cónyuge o parientes consanguíneos hasta el cuarto grado, por afinidad o civiles, o para terceros con los que tenga relaciones profesionales, laborales o de negocios, o para socios o sociedades de las que el servidor público o las personas antes referidas formen o hayan formado parte;\nXV.- Informar por escrito al superior jerárquico, sobre la atención, trámite o resolución de los asuntos a que hace referencia la fracción anterior y que sean de su conocimiento; y observar sus instrucciones por escrito sobre su atención, tramitación y resolución, cuando el servidor público no pueda abstenerse de intervenir en ellos;\nXVI.- Abstenerse, durante el ejercicio de sus funciones de solicitar, aceptar o recibir, por sí o por interpósita persona, dinero, objetos, mediante enajenación a su favor, en precio notoriamente inferior al que el bien de que se trate tenga en el mercado ordinario, o cualquier donación, empleo, cargo o comisión para sí, o para las personas a que se refiere la fracción XIII, y que procedan de cualquier persona física o moral cuyas actividades profesionales, comerciales o industriales se encuentren directamente vinculadas, reguladas o supervisadas por el servidor público de que se trate, en el desempeño de su empleo, cargo o comisión y que implique intereses en conflicto. Esta prevención es aplicable hasta un año después de que se haya retirado del empleo, cargo o comisión;\nXVII.- Desempeñar su empleo, cargo o comisión, sin obtener o pretender obtener beneficios adicionales a las contraprestaciones comprobadas que el Estado, Municipio o entidades paraestatales o paramunicipales, le otorguen por el desempeño de su función, sean para él o para las personas a que se refiere la fracción XIII;\nXVIII.- Abstenerse de intervenir o participar indebidamente en la selección, nombramiento, designación, contratación, promoción, suspensión, remoción, cese o sanción de cualquier servidor público, cuando tenga interés personal, familiar o de negocios, en el caso, o pueda derivar alguna ventaja o beneficio para él o para las personas a las que se refiere la fracción XIII;\n(REFORMADA, P.O. 26 DE ENERO DE 2007)\nXIX.- Presentar con oportunidad y veracidad la Declaración de situación patrimonial, ante órgano estatal de control;\n(REFORMADO, P.O. 26 DE ENERO DE 2007)\nXX.- Atender con diligencia las instrucciones, requerimientos o resoluciones que reciba del órgano estatal de control o, en su caso, del órgano municipal de control correspondiente, o de los órganos que tengan a su cargo estas funciones, en los Poderes Judicial y Legislativo;\nXXI.- Informar al superior jerárquico de todo acto u omisión de los servidores públicos sujetos a su dirección, que pueda implicar inobservancia de las obligaciones a que se refieren las fracciones de este artículo, y en los términos de las disposiciones que al efecto se dicten;\nXXII.- Abstenerse de cualquier acto u omisión que implique incumplimiento de cualquier disposición jurídica relacionada con el servidor público;\nXXIII.- Abstener, en ejercicio de sus funciones o con motivo de ellas, de celebrar o autorizar la celebración de pedidos o contratos relacionados con adquisiciones, arrendamientos y enajenación de todo tipo de bienes, prestación de servicios de cualquier naturaleza y la contratación de obra pública, con quien desempeña un empleo, cargo o comisión en el Servicio Público, o bien con las sociedades de que dichas personas formen parte, sin la autorización previa y específica de la autoridad competente a propuesta razonada, conforme a las disposiciones legales aplicables, del titular de la dependencia o entidad que se trate. Por ningún motivo podrá celebrarse pedido o contrato alguno con quien se encuentre inhabilitado para desempeñar un empleo, cargo o comisión en el servicio público; y\nXXIV.- Las demás que le impongan los ordenamientos jurídicos y administrativos aplicables.\nEl incumplimiento de estas obligaciones será sancionado como falta administrativa.\nARTICULO 53.- Corresponderá a los titulares de las dependencias estatales o municipales, o a los directores o sus equivalentes en las entidades del sector paraestatal y paramunicipal, vigilar el cumplimiento de las obligaciones de los servidores públicos subalternos y, al órgano estatal de control y a los órganos municipales de control, y a los que hagan sus veces en los Poderes Legislativo y Judicial y a los organismos públicos autónomos, vigilar el cumplimiento de las obligaciones a cargo de los titulares de las dependencias.\nEl titular del órgano estatal de control y los titulares de los órganos municipales de control, responderán, respectivamente, ante el Gobernador y los Ayuntamientos. Los responsables de los órganos equivalentes de los Poderes Judicial, Legislativo y de los organismos públicos autónomos, responderán ante los plenos del Tribunal Superior de Justicia, del Congreso del Estado o del órgano público autónomo, según sea el caso.\nCAPITULO SEGUNDO\nSANCIONES ADMINISTRATIVAS Y PROCEDIMIENTOS PARA APLICARLAS\nARTICULO 54.- Cualquier ciudadano bajo su más estricta responsabilidad, y presentando los elementos de pruebas correspondientes, podrá formular por escrito denuncia o queja, fundada y motivada, ante el superior jerárquico respectivo, por el incumplimiento de las obligaciones de los servidores públicos, a que se refiere el artículo 52 de esta ley.\nLas denuncias o quejas anónimas o que no están suscritas o ratificadas por el denunciante, no producirá ningún efecto.\n(REFORMADO, P.O. 26 DE ENERO DE 2007)\nEl órgano estatal de control o en su caso, los órganos de control municipal, o los de los Poderes\nLegislativo y Judicial, cuando reciban denuncias o quejas, las turnarán por riguroso orden, a las autoridades competentes para su desahogo procedimental.\nARTICULO 55.- Todos los servidores públicos tienen la obligación de respetar y hacer respetar el derecho a la formulación de quejas y denuncias a que se refiere el artículo 52, y de evitar que con motivo de estas se causen molestias indebidas al quejoso.\nIncurre en responsabilidad, el servidor público que por sí, o por interpósita persona, utilizando cualquier medio inhiba al quejoso para evitar la formulación o presentación de quejas y denuncias, o que con motivo de ello realice cualquier conducta injusta u omita una justa y debida, que lesione los intereses de quienes la formulen o presenten.\nARTICULO 56.- Las sanciones por falta administrativa consistirán en:\nI.- Apercibimiento privado o público;\nII.- Amonestación privada o pública;\nIII.- Suspensión;\nIV.- Destitución del puesto;\nV.- Sanción económica; y\nVI.- Inhabilitación temporal para desempeñar empleos, cargos o comisiones en el servicio público. daños y perjuicios, será de seis meses a tres años si el monto de aquellos no excede de cien veces el salario mínimo mensual vigente en la zona económica, correspondiente a la Capital del Estado; y de tres años a diez años si excede de dicho límite.\nARTICULO 57.- Las sanciones administrativas se impondrán, tomando en cuenta los siguientes elementos:\nI.- La gravedad de la responsabilidad en que se incurra y la conveniencia de suprimir prácticas que infrinjan, en cualquier forma, las disposiciones de esta ley o las que se dicten con base en ella;\nII.- Las circunstancias socioeconómicas del servidor público;\nIII.- El nivel jerárquico, los antecedentes y condiciones del infractor;\nIV.- Las condiciones exteriores y los medios de ejecución;\nV.- La antigüedad en el servicio;\nVI.- La reincidencia en el incumplimiento de obligaciones; y\nVII.- El monto del beneficio, daño o perjuicio económico derivado del incumplimiento de obligaciones.\nARTICULO 58.- En caso de aplicación de sanciones económicas por beneficios obtenidos y daños y perjuicios causados por incumplimiento de las obligaciones establecidas en el artículo 52, se aplicarán dos tantos del lucro obtenido y de los daños y perjuicios causados.\nLas sanciones económicas establecidas en este artículo se pagarán, una vez determinadas, en cantidad líquida, en su equivalencia en salarios mínimos vigentes al día de su pago, conforme al siguiente procedimiento:\nI.- La sanción económica impuesta se dividirá entre la cantidad líquida que corresponda y el salario mínimo mensual vigente en la zona económica correspondiente a la capital del Estado al día de su imposición; y\nII.- El cociente se multiplicará por el salario mínimo mensual vigente en la capital del Estado, al día de pago de la sanción.\nPara los efectos de esta Ley se entenderá por salario mínimo mensual, el equivalente a treinta veces el salario mínimo diario vigente en la zona correspondiente a la capital del Estado. reglamentos interiores, establecerán los órganos y procedimientos para determinar las responsabilidades dependencia, a que se refiere el artículo 52 de la presente ley, así como para aplicar las sanciones correspondientes. En dichos ordenamientos legales se observarán, en lo aplicable, las normas contenidas en esta ley.\nARTICULO 60.- Para la aplicación de las sanciones a que hace referencia el artículo 56, a los servidores públicos de la Administración Pública del Estado, centralizada y paraestatal, se observarán las siguientes reglas:\nI.- El apercibimiento, la amonestación y la suspensión del empleo, cargo o comisión de los servidores públicos de base y de confianza de la administración pública centralizada y paraestatal, se aplicarán por la autoridad que sustancíe el procedimiento respectivo, conforme a lo dispuesto en el artículo 63 de esta\nLey;\nLa suspensión del empleo, cargo o comisión, no será menor de tres días ni mayor de 3 meses y mientras dure, el servidor público sancionado no recibirá la remuneración ni las prestaciones económicas a que tenga derecho.\nII.- La destitución del empleo, cargo o comisión de los servidores públicos de base y de confianza de la administración pública centralizada y paraestatal, se aplicarán por la autoridad que sustancie el procedimiento respectivo, en los términos del artículo 63 de esta misma Ley;\n(REFORMADA, P.O. 26 DE ENERO DE 2007)\nIII.- La destitución del empleo, cargo o comisión de los servidores públicos de base de la administración pública centralizada, se demandará por la Secretaría de Finanzas, a petición de la autoridad que sustancie el procedimiento, y por el órgano de gobierno de la entidad de que se trate, cuando pertenezcan al sector paraestatal de acuerdo con los procedimientos consecuentes con la naturaleza de la relación y en los términos de la legislación aplicable;\n(REFORMADA, P.O. 26 DE ENERO DE 2007)\nIV.- El órgano estatal de control promoverá los procedimientos a que se refieren las fracciones anteriores, en caso de que las autoridades que deban hacerlo sean omisas. Una vez desahogados los trámites correspondientes, el órgano estatal de control exhibirá las constancias respectivas a la Secretaría de\nFinanzas o al órgano de gobierno de la entidad paraestatal de que se trate, según corresponda;\nV.- La inhabilitación para desempeñar un empleo, cargo o comisión en el servicio público, será aplicable por resolución jurisdiccional, que dictará el órgano que corresponda, según las leyes aplicables; y\n(REFORMADA, P.O. 26 DE ENERO DE 2007)\nVI.- Las sanciones económicas se aplicarán por la autoridad que desahogue el procedimiento respectivo, en los términos del Artículo 63 de la presente Ley, cuando no excedan de un monto equivalente a cien veces el salario mínimo diario vigente en la zona económica correspondiente a la capital del Estado, y por el órgano estatal de control cuando excedan de esta cantidad.\nARTICULO 61.- Las autoridades a las que corresponde aplicar las sanciones en los ámbitos de sus respectivas competencias, podrán abstenerse de sancionar al infractor, por una sola vez, cuando lo estimen pertinente, justificando e informando a quien corresponda la causa de la abstención, siempre que se trate de hechos que no revistan la gravedad ni constituyan delito, cuando lo ameriten los antecedentes y circunstancias del infractor y el daño causado por este, no exceda de cien veces el salario mínimo diario vigente en la Capital del Estado.\nARTICULO 62.- En el caso de los servidores públicos de la Administración Pública del Estado, centralizada y paraestatal, las sanciones administrativas a que se refiere este Capítulo, se impondrán mediante el siguiente procedimiento:\nI.- Se citará por escrito al presunto responsable a una audiencia, haciéndosele saber la responsabilidad o responsabilidades que se le imputen, el lugar día y hora en que tendrá verificativo dicha audiencia, y su derecho a ofrecer pruebas y alegatos por sí o por medio de un defensor.\nTambién podrá asistir a la audiencia, un representante de la dependencia en que labore el servidor público.\nEntre la fecha de la notificación y la verificación de la audiencia, deberá mediar un plazo no menor de cinco días ni mayor de quince días hábiles. traslade al lugar en que resida la autoridad competente, dicho plazo no será menor de diez ni mayor de veinte días hábiles;\nII.- Al concluir la audiencia, o dentro de los quince días hábiles siguientes, se resolverá sobre la existencia o no responsabilidad, imponiéndose al infractor, en su caso, las sanciones administrativas correspondientes o notificándose por escrito dicha resolución, dentro de las 24 horas siguientes, al interesado, al superior jerárquico responsable de la oficina, unidad o área administrativa de su adscripción; al titular de la dependencia o al órgano estatal de control;\nIII.- Si en dicha audiencia se advierte la falta de elementos suficientes para resolver, o encontraren elementos que impliquen nueva responsabilidad administrativa a cargo del presunto responsable, o de otras personas, se podrá disponer la práctica de nuevas investigaciones y citar para otra u otras audiencias; y\nIV.- En cualquier momento, previa o posteriormente al citatorio a que se refiere la fracción I de este artículo, se podrá determinar la suspensión temporal del presunto responsable de su cargo, empleo o comisión, si a juicio del titular de la dependencia, de los órganos de gobierno, de las entidades paraestatales o del Ejecutivo del Estado, según el caso, asi conviniere para la conducción o continuación de las investigaciones.\nLa suspensión temporal no prejuzga sobre la responsabilidad que se impute. En la determinación que se tome, se hará contar expresamente esta salvedad.\nLa suspensión temporal a que se refiere la fracción IV, suspenderá los efectos del acto que haya dado origen a la ocupación del empleo, cargo o comisión, y regirá desde el momento en que sea notificada al interesado o éste quede enterado de la resolución para cualquier medio. La suspensión cesará cuando así se resuelva, independientemente de la iniciación, continuación o conclusión del procedimiento a que se refiere dicha fracción IV, en relación con la presunta responsabilidad del servidor público.\nSi el servidor público suspendido temporalmente no resultare responsable de la falta que se le imputa, será restituido en el goce de sus derechos, y se le cubrirán las percepciones que debió recibir durante el tiempo en que estuviere suspendido.\nARTICULO 63.- El procedimiento a que se refiere el artículo anterior, se sustanciará:\nI.- Ante el superior jerárquico, que tenga el carácter de responsable de una oficina, unidad o área administrativa, cualquiera que sea la denominación y ubicación de ésta, cuando se trate de quejas o denuncias en contra de servidores públicos que le sean subalternos;\nII.- Ante el titular de la dependencia cuando se trate de quejas o denuncias en contra de servidores públicos responsables de oficinas, unidades o áreas administrativas de su adscripción, cualquiera que sea la denominación y publicación de éstas;\nIII.- Ante el órgano estatal de control, cuando se trate de quejas o denuncias en contra de los servidores públicos que sean titulares de las dependencias de la administración pública centralizada, a excepción del Secretario de Gobierno;\nIV.- Ante el Secretario de Gobierno, cuando se trate de quejas o denuncias en contra del titular del órgano estatal de control;\nGobierno; y en contra de los servidores públicos que sean sus titulares.\nEl órgano estatal de control, se encargará del desahogo del procedimiento cuando las autoridades que sean competentes conforme a lo antes establecido, no lo hagan, exhibiendo a las mismas las constancias respectivas, una vez concluido dicho procedimiento.\nARTICULO 64.- Se levantará acta circunstanciada de todas las diligencias que se practiquen, mismas que suscribirán quienes intervengan en ellas, apercibidas de las sanciones en que incurren quienes falten a la verdad.\n(REFORMADO, P.O. 26 DE ENERO DE 2007)\nARTICULO 65.- Las resoluciones y acuerdos que tengan lugar durante el procedimiento al que se refiere este capítulo constarán por escrito, y se asentarán en el registro respectivo del órgano estatal de control, mismo que comprenderá las secciones correspondientes a los procedimientos disciplinarios y sanciones impuestas, entre ellas, en todo caso, las de inhabilitación.\n(REFORMADO, P.O. 26 DE ENERO DE 2007)\nARTICULO 66.- El órgano estatal de control expedirá las constancias respectivas que acrediten la no existencia de registro de inhabilitación, mismas que serán exhibidas por las personas que sean requeridas para desempeñar un empleo, cargo o comisión en el servicio público.\nARTICULO 67.- Las resoluciones que dicten las autoridades que desahoguen el procedimiento para imponer sanciones administrativas a los servidores públicos, de la administración pública centralizada y paraestatal, podrán ser impugnadas por los afectados, mediante recurso de revisión que se interpondrá en la siguiente forma:\nI.- Ante el titular de la dependencia a que pertenezca el servidor público, cuando la sanción se hubiere impuesto por el superior jerárquico responsable de una oficina, unidad o área administrativa;\n(REFORMADA, P.O. 26 DE ENERO DE 2007)\nII.- Ante el órgano estatal de control, cuando el servidor público sancionado sea el responsable de una oficina, unidad o área administrativa de una dependencia centralizada o paraestatal;\n(REFORMADA, P.O. 26 DE ENERO DE 2007)\nIII.- Ante el Secretario de Gobierno, cuando el servidor público sancionado tenga el carácter de titular de una dependencia centralizada o paraestatal, a excepción de titular del órgano estatal de control;\n(REFORMADA, P.O. 26 DE ENERO DE 2007)\nIV.- Ante el titular del Poder Ejecutivo, cuando el servidor público sancionado sea el titular del órgano estatal de control;\nV.- La interposición de dicho recurso, deberá hacerse dentro de los tres días hábiles siguientes a la fecha en que surta efectos la notificación de la resolución recurrida;\nVI.- Las resoluciones mediante las cuales se imponga como sanción la inhabilitación del servidor público se impugnarán en los términos de los ordenamientos legales aplicables. de Gobierno, no procederá la interposición de recurso alguno.\nARTICULO 68.- La tramitación del recurso de revisión, se sujetará al procedimiento siguiente:\nI.- Se iniciará mediante escrito en el que deberán expresarse los agravios que a juicio del servidor público le cause la resolución, acompañando copia de ésta y constancia de la notificación de la misma, así como la proposición de las pruebas que considere necesario rendir;\nII.- La autoridad revisorá acordará sobre la admisibilidad del recurso y de las pruebas ofrecidas, desechando de plano las que no fuesen idóneas para desvirtuar los hechos en que se base la resolución.\nLas pruebas admitidas se desahogarán en un plazo de cinco días, que a solicitud del servidor público o de la autoridad, podrá ampliarse una sola vez más por cinco días; y\nIII.- Concluido el período probatorio, la autoridad revisora emitirá resolución en el acto, o dentro de los quince días siguientes, notificándolo al interesado.\nARTICULO 69.- La interposición del recurso suspenderá la ejecución de la resolución recurrida, si lo solicitare el promovente, conforme a estas reglas:\nI.- Tratándose de sanciones económicas, si el pago de éstas se garantiza en los términos que prevenga el Código Fiscal del Estado; y\nII.- Tratándose de otras sanciones, se concederá la suspensión si concurren los siguientes requisitos:\nA).- Que se admita el recurso;\nB).- Que la ejecución de la resolución recurrida produzca daños o perjuicios de imposible reparación en contra del recurrente; y\nC).- Que la suspensión no traiga como consecuencia la consumación o continuación de actos u omisiones que impliquen perjuicios al interés social o al servicio público.\nARTICULO 70.- La ejecución de las sanciones administrativas impuestas en resolución firme, se llevará a cabo de inmediato en los términos que disponga la resolución. La suspensión, destitución o inhabilitación que se impongan a los servidores públicos de confianza, surtirán efecto al notificarse la resolución y se considerarán de orden público.\nTratándose de los servidores públicos de base, la suspensión hasta por tres meses, surtirá efectos al notificarse la resolución. La destitución se sujetará a lo previsto en la ley correspondiente.\nLas sanciones económicas que se impongan constituirán créditos fiscales a favor del erario del Estado, se harán efectivas mediante el procedimiento económico-coactivo de ejecución, tendrán la prelación prevista para dichos créditos, y se sujetarán, en todo, a las disposiciones fiscales aplicables a esta materia.\nARTICULO 71.- Si el servidor público presunto responsable, confesare su responsabilidad por el incumplimiento de las obligaciones a que hace referencia la presente ley, se procederá de inmediato a dictar resolución, a no ser que quien conoce del procedimiento, disponga la recepción de pruebas para acreditar la veracidad de la confesión. En caso de que se acepte la plena validez probatoria de la confesión, se impondrá al interesado dos tercios de la sanción aplicable, si es de naturaleza económica, pero en lo que respecta a indemnización, ésta, en todo caso, deberá ser suficiente para cubrir los daños y perjuicios causados, y siempre deberá restituirse cualquier bien o producto que se hubiere percibido con motivo de la infracción. Quedará a juicio de quien resuelva, disponer o no la suspensión, separación o inhabilitación.\nARTICULO 72.- Para el cumplimiento de las atribuciones que les confiere esta Ley, las autoridades a que se refiere el artículo 60, podrán emplear los siguientes medios de apremio:\nI.- Sanción económica de hasta veinte veces el salario mínimo diario vigente en la Capital del Estado; y\nII.- Auxilio de la fuerza pública. que establezca la legislación penal.\nARTICULO 73.- Las facultades de las autoridades a que se refiere el Artículo 60 para imponer las sanciones que preve esta Ley se sujetarán a lo siguiente:\nI.- Prescribirán en tres meses, si el beneficio obtenido o el daño causado por el infractor, no exceda de diez veces el salario mínimo diario vigente en la capital del Estado, o si la responsabilidad no fuese estimable en dinero. El plazo de prescripción se contará a partir del día siguiente a aquel en que se continuo; y\nII.- En los demás casos prescribirán en tres años.\nTITULO CUARTO\nCAPITULO UNICO\nDEL REGISTRO PATRIMONIAL DE LOS SERVIDORES PUBLICOS\n(REFORMADO, P.O. 26 DE ENERO DE 2007)\nARTICULO 74.- Corresponderá al órgano estatal de control, llevar el registro de la situación patrimonial de los servidores públicos de los Poderes Ejecutivo, Legislativo y Judicial del Estado; de los Municipios de la entidad, de los de las entidades Paraestatales y Paramunicipales, de conformidad con esta Ley, y demás ordenamientos legales aplicables.\nARTICULO 75.- Tienen obligación de presentar declaración anual de situación patrimonial, bajo protesta de decir verdad:\nI.- En los Poderes Legislativo, Ejecutivo y Judicial: los servidores públicos nombrados por elección popular y todos aquellos que tengan el carácter de servidores públicos de confianza;\nII.- En el sector paraestatal de la administración pública del Estado: los titulares y los demás servidores públicos de confianza de las entidades que formen parte del mismo;\nIII.- En la administración pública de los municipios de la entidad; los miembros de los Ayuntamientos, los titulares de las entidades paramunicipales y los demás servidores públicos de confianza de las dependencias centralizadas y entidades paramunicipales.\nARTICULO 76.- La declaración de situación patrimonial deberá presentarse en los siguientes plazos:\nI.- Dentro de los sesenta días naturales siguientes a la toma de posesión;\nII.- Dentro de los treinta días naturales siguientes a la conclusión del encargo; y\nIII.- Durante el mes de mayo de cada año deberá presentarse la declaración de situación patrimonial, Ley del Impuesto Sobre la Renta, salvo que en ese mismo año se hubiese presentado la declaración a que se refiere la fracción I.\nSi transcurrido el plazo a que se refiere la fracción I, no se hubiese presentado la declaración correspondiente sin causa justificada, el órgano estatal de control, señalará un nuevo plazo que no excederá de 90 días para su presentación. Concluido dicho término si no se hubiese presentado la declaración requerida, el órgano estatal de control solicitará a los titulares de los Poderes Ejecutivo, paraestatales o paramunicipales según sea el caso, que den de baja al servidor público que no haya cumplido con lo dispuesto en este artículo. Lo mismo ocurrirá cuando se omita la declaración contemplada en la fracción III.\nARTICULO 77.- El órgano estatal de control, expedirá las normas y los formatos bajo los cuales el servidor público deberá presentar la declaración de situación patrimonial, así como los manuales e instructivos que indicarán lo que es obligatorio declarar.\nARTICULO 78.- En la declaración inicial y final de situación patrimonial se manifestarán los bienes inmuebles, con fecha y valor de adquisición.\nEn las declaraciones anuales se manifestarán solo las modificaciones al patrimonio, con fecha y valor de la adquisición.\n(REFORMADO, P.O. 26 DE ENERO DE 2007)\nTratándose de bienes muebles, el órgano estatal de control, expedirá los formatos en los que se señalen las características que deba tener la declaración.\n(REFORMADO, P.O. 26 DE ENERO DE 2007)\nARTICULO 79.- Cuando los signos exteriores de riqueza sean ostensibles y notoriamente superiores a los ingresos lícitos que pudiera tener un servidor público, el órgano estatal de control, podrá ordenar, fundando y motivando su acuerdo, la práctica de visitas de inspección y auditorías. Cuando estos actos requieran orden de autoridad judicial, el órgano estatal de control hará ante ésta la solicitud correspondiente.\nPreviamente a la inspección o al inicio de la auditoria, se dará cuenta al servidor público de los hechos que motivan estas actuaciones y se le presentarán las actas en que aquellos consten, para que exponga lo que a su derecho convenga.\n(REFORMADO, P.O. 26 DE ENERO DE 2007)\nARTICULO 80.- El servidor público a quien se practique visita de inspección o auditoría podrá interponer inconformidad ante el órgano estatal de control, contra los hechos contenidos en las actas, mediante escrito que deberá presentar dentro de los cinco días siguientes a la conclusión de aquellas, en la que se expresará los motivos de inconformidad y ofrecerá las pruebas que considere necesario acompañar o rendir dentro de los treinta días siguientes a la presentación del recurso.\nTodas las actas que se levanten con motivo de la vista deberán ir firmadas por el servidor público y los testigos que para tal efecto designe. Si el servidor público o los testigos se negaren a firmar, el visitador lo hará constar, sin que estas circunstancias afecten el valor probatorio que, en su caso, posea el documento.\nARTICULO 81.- Serán sancionados en los términos que disponga la legislación penal los servidores públicos que incurran en enriquecimiento ilícito.\nARTICULO 82.- Para los efectos de esta Ley y del Código Penal del Estado, se computarán entre los bienes que adquieran los servidores públicos o con respecto de los cuales se conduzcan como dueños, los que reciban o de los que dispongan su cónyuge y sus dependientes económicos directos, salvo que se acredite que éstos los obtuvieron por sí mismos y por motivos ajenos al servidor público.\nARTICULO 83.- Durante el desempeño de su empleo, cargo o comisión, y un año después, los servidores públicos no podrán solicitar, aceptar o recibir por sí, o por interpósita persona, dinero o cualquier otra donación, servicio, empleo, cargo o comisión para sí o para las personas a que se refiere la fracción XIII del artículo 52 y que procedan de cualquier persona cuyas actividades profesionales, comerciales o industriales se encuentren directamente vinculadas, reguladas o supervisadas por el servidor público en el desempeño de su empleo, cargo o comisión, que determinen conflicto de intereses.\nPara los efectos del párrafo anterior, no se considerarán los que reciba el servidor público en una o más ocasiones, de una misma persona física o moral, de las mencionadas en el párrafo precedente, durante un año, cuando el valor acumulado durante ese año no sea superior a diez veces el salario mínimo diario vigente en el Estado en el momento de su recepción.\nEn ningún caso se podrán recibir de dichas personas títulos valor, bienes inmuebles o cesiones de propiedad sobre bienes de cualquier clase.\nSe castigará como cohecho las conductas de los servidores públicos que violen lo dispuesto en este artículo y serán sancionados en términos de la Legislación Penal.\nARTICULO 84.- Cuando los servidores públicos reciban obsequios, donativos o beneficios en general de los que se menciona en el artículo anterior y cuyo monto sea superior al que en él se establece o sean de los estrictamente prohibidos, deberán de informar de ello a la autoridad que el Titular del Ejecutivo del\nEstado o el Presidente Municipal, según sea el caso, determinen a fin de ponerlos a su disposición. La autoridad correspondiente llevará un registro de dichos bienes.\n(REFORMADO, P.O. 26 DE ENERO DE 2007)\nARTICULO 85.- El órgano estatal de control expedirá declaratoria de que el funcionario sujeto a la investigación respectiva, en los términos de la presente Ley, no justifico la procedencia lícita del incremento sustancial de su patrimonio de los bienes adquiridos o de aquellos sobre los que se conduzca como dueño, durante el tiempo de su encargo o por motivos del mismo.\nARTICULO PRIMERO.- Esta Ley abroga la Ley de Residencia del Estado de Coahuila de Zaragoza, contenida en el Decreto del Congreso del Estado No. 27, publicado en el Periódico Oficial del Gobierno del Estado No. 5, de fecha 17 de enero de 1934, y se derogan todas aquellas disposiciones que se opongan a la presente Ley.\nIndependientemente de las disposiciones que establece la presente Ley, quedan preservados los derechos sindicales de los trabajadores.\nSEGUNDO.- Una vez que esta Ley entre en vigor, el Congreso del Estado procederá en el primer período ordinario o extraordinario a que se convoque, a integrar la Comisión Instructora de Juicio Político y de\nDeclaración de Procedencia en Materia de Responsabilidad Penal.\nTERCERO.- En un término que no excederá de treinta días, contados a partir de la entrada en vigor del presente ordenamiento, el Tribunal Superior de Justicia deberá remitir a la Procuraduría General de\nJusticia del Estado, las declaraciones sobre situación patrimonial efectuadas con apego a lo dispuesto en la Ley de Residencia.\nCUARTO.- La declaración de situación patrimonial correspondiente al año de 1984, deberán de presentarla los servidores públicos a que se refiere el artículo 75, dentro de los seis meses siguientes, a partir de la fecha de entrada en vigor de la presente Ley.\nQUINTO.- Los servidores públicos de los Poderes Judicial, Legislativo, de los Municipios del Estado y de las Entidades Paramunicipales, quedarán sujetos a las disposiciones aplicables de la presente ley, en materia de responsabilidad administrativa, hasta en tanto sean expedidos sus respectivos ordenamientos jurídicos, en sus correspondientes ámbitos de trabajo.\nSEXTO.- La presente ley entrará en vigor al día siguiente de su publicación en el Periódico Oficial del del mes de marzo de mil novecientos ochenta y cuatro.\nDIPUTADO PRESIDENTE\nLic. Marcial Villarreal Múzquiz (Rúbrica)\nDIPUTADO SECRETARIO: DIPUTADO SECRETARIO:\nJosé Luis Chaires Medina Profr. Carlos Cárdenas V.\n(Rúbrica) (Rúbrica)\nIMPRIMASE, COMUNIQUESE Y OBSERVESE\nSaltillo, Coah., 10 de Abril de 1984\nEL GOBERNADOR CONSTITUCIONAL DEL ESTADO DE COAHUILA\nLIC. JOSE DE LAS FUENTES RODRÍGUEZ (Rúbrica)\nEL SECRETARIO DEL EJECUTIVO DEL ESTADO\nLIC. ENRIQUE MARTINEZ Y MARTINEZ (Rúbrica)\nN. DE.E. A CONTINUACION SE TRANSCRIBEN LOS ARTICULOS TRANSITORIOS DE LOS DECRETOS DE REFORMAS DE LA\nPRESENTE LEY:\nP.O. 22 DE JUNIO DE 1993\nUNICO.- El presente Decreto entrará en vigor al día siguiente de su publicación en el Periódico Oficial del Gobierno del Estado.\nP.O. 16 DE NOVIEMBRE DE 2001\nARTÍCULO PRIMERO. Estas reformas y adiciones a diversas disposiciones del Código Municipal para el Estado de Coahuila de\nZaragoza y a la Ley de Responsabilidades de los Servidores Públicos Estatales y Municipales del Estado de Coahuila de Zaragoza, partir de la renovación de los Ayuntamientos del año 2005 y, por tanto, los presidentes municipales, regidores y síndicos de los\nAyuntamientos elegidos en el año 2005 durarán en su encargo cuatro años. Esta norma no podrá aplicarse en forma retroactiva.\nARTÍCULO TERCERO. Se derogan todas las disposiciones legales o reglamentarias que se opongan al presente Decreto.\nÚNICO.- El presente Decreto entrará en vigor a partir del día siguiente al de su publicación en el Periódico Oficial del Gobierno del\nEstado.\nSEGUNDO. Se derogan todas las disposiciones que se opongan al presente decreto.",
  "ordenamiento": "REGLAMENTO",
  "jurisdiccion": "COAHUILA",
  "fuente_oficial": "DIARIO OFICIAL DE LA FEDERACION",
  "Fecha de Publicación": "24 de abril de 1984",
  "ULTIMA REFORMA PUBLICADA": "31 DE JULIO DE 2007",
  "es_escaneado": false,
  "tiene_tablas": false,
  "materia": [
    "laboral",
    "anticorrupción"
  ]
}