{
  "titulo": "Ley para el Fomento y Desarrollo de la Fruticultura en el Estado de Coahuila de Zaragoza.",
  "Contenido": "COAHUILA DE ZARAGOZA.\nEL C. HUMBERTO MOREIRA VALDÉS, GOBERNADOR CONSTITUCIONAL DEL ESTADO\nINDEPENDIENTE, LIBRE Y SOBRANO DE COAHUILA DE ZARAGOZA, A SUS HABITANTES\nSABED:\nQUE EL CONGRESO DEL ESTADO INDEPENDIENTE, LIBRE Y SOBERANO DE COAHUILA\nDE ZARAGOZA;\nDECRETA:\nNÚMERO 521.LEY PARA EL FOMENTO Y DESARROLLO DE LA FRUTICULTURA EN EL ESTADO DE\nCOAHUILA DE ZARAGOZA.\nCAPITULO I\nDISPOSICIONES GENERALES\nARTICULO 1º.- Esta ley es de orden público, interés social y de observancia obligatoria en todo el régimen interior del estado en materia de fruticultura.\nARTÍCULO 2º.- Esta ley tiene por objeto garantizar el desarrollo e industrialización de la producción frutícola en el estado.\nARTÍCULO 3º.- Esta ley tiene como finalidad:\nI. Determinar las bases para la organización de los productores frutícolas.\nII. Establecer las medidas para la protección y sanidad de las plantaciones frutícolas.\nIII. Promover la tecnificación, industrialización y comercialización de la fruticultura en el estado.\nIV. Fortalecer las organizaciones de los productores de frutas.\nV. Fortalecer los sistemas de comercialización de los insumos y productos frutícolas.\nVI. Fomentar el desarrollo de la actividad frutícola mediante el asesoramiento profesional y de investigación científica.\nARTICULO 4º.- Se declaran de utilidad pública e interés social todas las acciones encaminadas a incrementar la producción y la productividad frutícola, su industrialización, comercialización y estado.\nARTICULO 5º. Son sujetos de esta ley:\nI. Todas las personas físicas o morales que se dediquen de manera habitual a la explotación de frutales, así como a la industrialización de sus productos y subproductos;\nII. Todas las personas físicas o morales que habitual o accidentalmente se dediquen al comercio o transporte de productos frutícolas;\nIII. Las áreas consideradas como adecuadas para el crecimiento y desarrollo de la fruticultura en el Estado.\nARTICULO 6º.- Para los efectos de esta ley, se entenderá por:\nI. Estado. Estado de Coahuila de Zaragoza.\nII. Secretaría. La Secretaría de Fomento Agropecuario del Estado de Coahuila.\nIII. Delegación. La Delegación Coahuila de la Secretaría de Agricultura, Ganadería, Desarrollo Rural, Pesca y Alimentación del Gobierno Federal.\nIV. Campaña Fitosanitaria. Conjunto de medidas fitosanitarias tendientes a la erradicación de plagas que afectan a las plantaciones frutales en un área geográfica determinada.\nV. Certificado Fitosanitario. Documento oficial expedido por la Delegación o las personas aprobadas o acreditadas para tal efecto, que constata el cumplimiento de las disposiciones fitosanitarias a que se sujetan la movilización, importación o exportación de frutas, sus productos o subproductos.\nVI. Moscas de la fruta. Insectos del orden díptera, de la familia Tephritidae.\nVII. Movilización. Transportar, llevar o trasladar de un lugar a otro productos frutícolas.\nVIII. Plaga. Forma de vida vegetal, animal o agente patogénico, dañino o potencialmente dañino a los frutales.\nIX. Profesional Fitosanitario. Profesionista con estudios relacionados con la sanidad vegetal y que es apto para la determinación de medidas fitosanitarias.\nCAPITULO II\nDE LOS DERECHOS Y OBLIGACIONES DE LAS\nPERSONAS SUJETAS A ESTA LEY de los siguientes derechos:\nI. Acceder a los apoyos económicos, programas o acciones que los tres niveles de gobierno instrumenten para los fruticultores organizados.\nII. Formar parte de la organización de fruticultores de la localidad donde se encuentre ubicada su explotación.\nIII. Convenir con la Secretaría, el manejo y expedición de certificados fitosanitarios de movilización de productos frutícolas.\nIV. Solicitar y obtener por conducto de la organización a que pertenezca, la credencial de fruticultor.\nV. Participar en la integración de organismos técnicos o de consulta que se establezcan para la protección y mejoramiento de la fruticultura.\nVI. Promover y organizar coordinadamente con las dependencias del Gobierno del Estado, concursos, exposiciones o actos, que tiendan al mejoramiento técnico del fruticultor y sus actividades.\nVII. Recibir asesoría y asistencia técnica para el mejor manejo y producción de sus frutales.\nVIII. Participar de las acciones de investigación.\nIX. Manifestar sus opiniones cuando consideren afectados sus intereses.\nX. Coordinarse con los productores frutícolas para la promoción de actividades conjuntas que alienten el desarrollo de sus actividades preponderantes.\nARTICULO 8º.-Son obligaciones de los sujetos de esta ley:\nI. Constituirse en organización conforme a las disposiciones de esta ley.\nII. Registrar ante la Secretaría, la existencia e instalación de plantas procesadoras y empacadoras de productos frutículas; así como centros de acopio y distribución.\nIII. Rendir informes anuales a la Secretaría, sobre la producción obtenida, así como de la comercialización realizada en el mercado interno y externo.\nIV. Sujetarse al certificado fitosanitario de movilización y otros documentos necesarios para la movilización de sus productos.\nV. Notificar a la Secretaría y la Delegación sobre toda sospecha de plagas y enfermedades de las plantas con el fin de que oportunamente tomen las medidas correspondientes.\nVI. Cumplir las disposiciones que dicte la Secretaría para el manejo de las plantas procesadoras y empacadoras de productos frutícolas.\nVII. Obtener de la Secretaría, la certificación de aptitud del suelo para la explotación frutícola.\nVIII. Obtener de la Secretaría, el permiso correspondiente para la destrucción de árboles frutales.\nIX. Realizar los procesos productivos con el máximo cuidado del medio ambiente, evitando la contaminación.\nX. Acatar las disposiciones federales y estatales, relativas al control de plagas y enfermedades de las frutas; en especial de la mosca de la fruta; y\nXI. Realizar las aportaciones económicas establecidas para la operación de campañas o\nCAPITULO III\nDE LAS AUTORIDADES\nARTICULO 9º.- Son autoridades competentes para la aplicación de esta ley:\nI. El Ejecutivo del Estado.\nII. La Secretaría de Fomento Agropecuario del Estado.\nIII. La Secretaría de Finanzas; y\nIV. Los Ayuntamientos de los 38 Municipios del Estado.\nARTICULO 10.-Son dependencias y órganos auxiliares para la aplicación de esta ley:\n(REFORMADA, P.O. 12 DE MAYO DE 2009)\nI. La Fiscalía General del Estado.\nII. La Dirección de Seguridad Pública Municipal y\nIII. Las Asociaciones Frutícolas constituidas conforme a la ley y con registro vigente.\nARTICULO 11.- La Secretaría tendrá las obligaciones y facultades siguientes:\nI. Planear, coordinar y estimular la realización de programas integrales que tiendan al mejoramiento cualitativo y cuantitativo de la fruticultura.\nII. Coordinarse con las dependencias del gobierno federal, para la mejor aplicación de las\nNormas Oficiales Mexicanas en la materia y conjuntamente con ellas, dictar y aplicar medidas que tiendan a la protección, fomento, programación y desarrollo de la fruticultura.\nIII. Vigilar la aplicación y cumplimiento de las medidas de control y preventivas de las enfermedades de las frutas.\nIV. Llevar a cabo la vigilancia e inspección para el cumplimiento de esta ley así como en su caso, imponer las sanciones a que haya lugar.\nV. Favorecer la modernización de los procesos industriales, así como la incorporación de incrementar la productividad.\nVI. Concertar con las organizaciones, contratos y convenios de colaboración y apoyo para incrementar la producción frutícula.\nVII. Llevar el registro de las asociaciones frutícolas constituidas en el estado y el seguimiento de las actividades realizadas.\nVIII. Promover la creación de centros estratégicos de investigación, experimentación y enseñanza vinculadas al sector, con el objeto de desarrollar la tecnología más adecuada al medio ambiente.\nIX. Promover la diversificación de especies y variedades necesarias y convenientes en las zonas frutícolas de la entidad, protegiendo sus ecosistemas.\nX. Establecer acciones para que los productores tengan acceso directo y oportuno a los mercados nacionales e internacionales y los que se establezcan para el ámbito interno.\nXI. Promover la denominación de origen y la exportación de los productos coahuilenses.\nXII. Establecer premios, estímulos y reconocimientos a las organizaciones y productores que se distingan por su creatividad, productividad y eficiencia, atendiendo a la ley de la materia.\nXIII. Alentar en la empresa de la fruticultura las prácticas de calidad y el sometimiento a procesos de certificación, como instrumento para promover la exportación; y\nXIV. Las demás de la materia que se deriven de las leyes vigentes o que le sean asignadas por el Ejecutivo del Estado.\nCAPITULO IV\nDEL CONSEJO FRUTICOLA\nARTICULO 12.- Con el objeto de alentar el fomento, vigilancia y protección de la fruticultura y atender con oportunidad los problemas de los fruticultores, deberá integrarse un órgano de consulta y colaboración denominada Consejo Frutícola del Estado de Coahuila.\nEl Consejo estará integrado por un Presidente, un Secretario Técnico y seis Vocales, quienes serán designados en la siguiente forma:\n• El Presidente será el Secretario de Fomento Agropecuario del Estado de Coahuila.\n• El Secretario Técnico será nombrado por el Presidente; quién deberá elaborar las actas correspondientes y dar seguimiento a los acuerdos aprobados; y\n• Los seis vocales serán designados uno por cada una de las dependencias e Instituciones siguientes: Secretaría de Agricultura, Ganadería, Desarrollo Rural, Pesca Delegación\nCoahuila, Secretaria de Fomento Agropecuario del Estado de Coahuila, Asociación\nEstatal de Fruticultores, Universidad Autónoma Agraria “Antonio Narro”, la Delegación y Agropecuario (INAFAP).\nARTICULO 13.- El Consejo Frutícola del Estado de Coahuila, tendrá las siguientes atribuciones:\nI. Definir políticas generales para integrarlas al Plan y los Programas de Fomento Frutícola que ejecute la Secretaría.\nII. Fungir como entidad de asesoría y consulta en la materia, con el fin de coordinar en el estado.\nIII. Intervenir en la solución de los problemas que se presenten y pongan en peligro la fruticultura.\nIV. Formular recomendaciones generales para la determinación de las políticas públicas y programas de fomento frutícola para su desarrollo.\nV. Opinar sobre la comercialización de los productos frutícolas con el fin de evitar la especulación; así como sugerir la intervención ante los mercados nacionales e internacionales con el fin de obtener mejores cotizaciones de los productos frutícolas del estado.\nVI. Opinar sobre las iniciativas o proyectos de reglamentos que en materia frutícola formule el\nEjecutivo del Estado.\nVII. Opinar sobre la creación de centros de procesamiento de los productos frutícolas.\nVIII. Apoyar a la Secretaria en sus programas de fomento así como en el cumplimiento de sus atribuciones.\nIX. Opinar sobre la forma de organización de fruticultores; y\nX. Alentar la constitución de las figuras de organización de fruticultores conforme a las disposiciones de esta ley.\nCAPITULO V\nDE LA ORGANIZACION DE FRUTICULTORES\nARTICULO 14.- Los fruticultores del Estado podrán asociarse en cada localidad, Municipio o región, para la promoción de sus intereses, por cada ramo de la producción frutícola, no importando su régimen de tenencia de la tierra.\nLa constitución de las asociaciones de fruticultores deberá apegarse a la siguientes bases:\nI. Para constituir una asociación de fruticultores, se requiere un mínimo de seis socios y cubrir los requisitos de formalidad exigidos por la ley para estos fines, así como registrarse ante la Secretaría.\nII. En las zonas en las que funcionen tres o más asociaciones locales podrá constituirse una\nAsociación Municipal.\nIII. Cuando en una región productiva funcionen tres o más asociaciones municipales, podrá constituirse una Unión Regional.\nIV. Cuando en el Estado existan dos o más Uniones Regionales podrán constituir una\nFederación Estatal.\nV. Las Asociaciones Municipales, las Uniones Regionales y las Federaciones Estatales se formarán con tres delegados por cada asociación integrante.\nARTICULO 15.- Para ser miembro de una asociación, es requisito indispensable ser productor de la jurisdicción correspondiente, propietario, arrendatario, aparcero o ejidatario.\nARTICULO 16.- Ninguna organización podrá objetar la instalación de apiarios de productores, cuando ésta se realice con apego a lo establecido por esta ley.\nARTICULO 17.- Son obligaciones de las organizaciones frutícolas:\nI. Conservar y fomentar la actividad frutícola en el estado.\nII. Pugnar por la agrupación de los fruticultores de su zona de influencia.\nIII. Acatar las disposiciones expedidas por las dependencias correspondientes, para el control de las plagas y enfermedades de los árboles frutales.\nIV. Colaborar con la Secretaría y demás instituciones en la realización de programas para el desarrollo frutícola, así como en la estricta observancia de esta ley.\nV. Participar en las campañas que efectúen las autoridades y organismos públicos, privados, nacionales o extranjeros contra plagas y enfermedades de las frutas.\nVI. Promover ante las dependencias del Estado, la creación de centros de investigación y de producción de variedades mejoradas.\nVII. Promover la apertura de mercados tanto en el ámbito local como en el internacional y paralelamente a ello, emprender campañas a través de los medios masivos sobre el consumo de productos frutícolas y sus derivados.\nVIII. Promover y hacer cumplir las disposiciones emanadas de la normatividad federal para el desarrollo de las campañas fitosanitarias en coordinación con el Comité Estatal de\nSanidad Vegetal.\nIX. Proponer el cultivo de nuevas especies y variedades frutícolas que se adapten a la región por sus características climatológicas y fisiográficas, así como socioeconómicas de la población y por su rentabilidad en el mercado.\nX. Promover el procesamiento o industrialización de las frutas de su región en el ámbito artesanal y comercial, mediante la investigación y divulgación de tecnologías para aprovechamiento integral del fruto, tales como dulces, jaleas, mermeladas, cócteles, pulpas deshidratadas, jugos, concentrados, bebidas saborizadas, y otros que permitan el aprovechamiento de todas las partes del fruto.\nXI. Gestionar el establecimiento de plantas de procesamiento frutícola con financiamiento federal y estatal, promocionando su recuperación mediante las cuotas que los fruticultores aporten por concepto de maquila.\nXII. Levantar registros de los socios.\nXIII. Promover la instalación de plantas procesadoras con miras a la exportación directa.\nXIV. Participar en la elaboración de las políticas y programas de protección y fomento frutícola en el Estado.\nXV. Convertirse en cooperantes e inspectores de las Normas Oficiales Mexicanas en materia fitosanitaria.\nXVI. Promover beneficios económicos, subsidios y crédito que tengan como finalidad el control de plagas y enfermedades y mejorar la producción; y\nXVII. Contar con la asistencia permanente de profesionales fitosanitarios aprobados para la certificación de la sanidad, la calidad y la inocuidad y promover ante sus asociados la asistencia profesional permanente.\nARTICULO 18.- El comercializador de cualquier Estado de la República o del extranjero, que pretenda introducir, transportar o movilizar productos frutícolas en la entidad, temporal o definitivamente, deberá obtener la autorización de la Secretaría, quien deberá llevar un registro para su verificación en los puestos de control.\nARTICULO 19.- La Secretaría llevará el registro de las Asociaciones Frutícolas que se constituyan en el Estado.\nEn dicho registro, se asentarán las actas constitutivas, estatutos, reglamento interno y en su caso el acta de disolución o liquidación, haciendo referencia especial a su domicilio social, número de asociados y el área geográfica a que pertenece.\nCAPITULO VI\nDE LA SANIDAD\nARTICULO 20.- Con el objeto de mantener la salud de los árboles frutales y consecuentemente su productividad, cada fruticultor deberá:\nI. Adoptar las medidas necesarias con el fin de disminuir la incidencia de plagas y enfermedades y evitar su difusión.\nII. Observar las Normas Oficiales Mexicanas y participar en las campañas y programas establecidas para estos efectos.\nIII. Observar las disposiciones relativas al cuidado y protección del entorno ecológico; y\nIV. Procurar la asistencia de profesionales certificados en la producción asistida. soliciten.\nARTICULO 21.- Los fruticultores y asociaciones frutícolas, están obligados a participar en las campañas de sanidad vegetal que establezca la Secretaría de Agricultura, Ganadería, Desarrollo Rural, Pesca y Alimentación, conforme a la Ley Federal de Sanidad Vegetal.\nCAPITULO VII\nARTICULO 22.- La Secretaría vigilará el cumplimiento de la esta ley y conocerá de las infracciones a la misma, imponiendo las sanciones correspondientes.\nLa Secretaría, a través del personal debidamente autorizado, podrá realizar las visitas de inspección que considere necesarias.\nPara tal efecto, el inspector acreditará tal carácter con la credencial correspondiente y con la orden en que se funde y motive la inspección.\nARTICULO 23.- Las visitas de inspección se practicarán con la finalidad de:\nI. Conocer los procedimientos, métodos y acciones que se realicen para la protección e industrialización de los productos frutícolas.\nII. Verificar si los fruticultores cumplen las medidas de movilización de los productos establecidos por esta ley, las Normas Oficiales Mexicanas y demás disposiciones legales aplicables.\nIII. Confirmar que se cumplan debidamente las disposiciones de esta ley; y\nIV. Determinar la vocación del uso de suelo correspondiente.\nARTICULO 24.- Las inspecciones podrán ser ordinarias y extraordinarias. Las primeras son las que se llevan a cabo en días y horas hábiles; las segundas, son aquellas que pueden realizarse en cualquier momento y que tienen una finalidad específica.\nARTICULO 25.- Cuando el inspector no encuentre al dueño o representante de las plantaciones frutícolas, de las industrias o comercializadoras, dejará un citatorio a la persona con quien se entienda la diligencia, para que aquél lo espere el día y hora que se fije, apercibiéndolo de que en caso de no esperar o de no permitir la visita, se le impondrá la sanción que corresponda.\nEl inspector levantará constancia del citatorio con la firma de quien lo recibió, o la de dos testigos, si aquél se negare afirmar.\nSi se impidiera al inspector efectuar la visita ordenada, a pesar de cubrir las formalidades de ley, podrá solicitar el auxilio de la fuerza pública para llevarla acabo.\nARTICULO 26.- En caso de infracción a las disposiciones de esta ley, se levantará una acta circunstanciada en la que se consignarán, pormenorizadamente, los hechos que constituyen la infracción, expresando los datos del inspector, los generales, los nombres y domicilios de los infractores y de los testigos, así como los pormenores que revelen la gravedad de la infracción.\nVegetal y sus Reglamentos que observe durante las visitas de inspección que realice, a efecto de que se proceda conforme a las mismas.\nARTICULO 27.- Las medidas preventivas o de combate tendientes a evitar la propagación de plagas y enfermedades que dicte la Secretaría de Agricultura, Ganadería, Desarrollo Rural, Pesca y Alimentación, serán de carácter obligatorio para los fruticultores del Estado.\nARTICULO 28.- En los casos en los que por causa derivada del incumplimiento de las normas de control consignadas en esta ley, se ocasionen daños a personas o animales, los productores serán responsables de los daños que se originen de conformidad con las leyes aplicables.\nCAPITULO VIII\nDE LAS INFRACCIONES Y SANCIONES\nARTICULO 29.- Corresponde a la Secretaría, identificar, declarar y sancionar las infracciones a esta ley, así como turnar las actuaciones practicadas a la Secretaría de Finanzas, en un término no menor de 5 días hábiles, con el fin de hacer efectivas las sanciones conforme al Código\nFiscal para el Estado de Coahuila.\n(REFORMADO, P.O. 12 DE MAYO DE 2009)\nSi la infracción constituye además un delito, la Secretaría consignará los hechos a la Fiscalía\nGeneral del Estado, sin perjuicio de aplicar las sanciones administrativas que procedan.\nARTÍCULO 30.- Son infracciones a la esta ley:\nI. Faltar a la obligación de registrar la existencia e instalación de plantas procesadoras, empacadoras de productos frutícolas o de centros de acopio y distribución.\nII. No dar los avisos que dispone esta ley o hacerlo fuera del plazo establecido.\nIII. No rendir el informe anual estipulado en esta ley.\nIV. Usar productos que dañen el medio ambiente o bien, que sean riesgosos a la salud de las personas o animales.\nV. Faltar a la obligación de participar oportunamente en los programas o acciones emprendidas para el mejoramiento de la actividad frutícola.\nVI. Ejercer la movilización de productos de otros Estados sin la documentación y requisitos establecidos en esta ley.\nVII. Llevar a cabo el transporte y movilización de productos frutícolas del estado sin observar los requisitos establecidos en la presente ley.\nVIII. Impedir o resistirse a que las autoridades competentes, practiquen las visitas, inspecciones o exámenes que les faculta esta ley;\nIX. Incumplir con las disposiciones dictadas por las Campañas Nacional y Estatal para el\nControl de la mosca de la fruta;\nX. Las demás que expresamente se consignen en la presente ley o las que se deriven de los demás ordenamientos vigentes.\nARTÍCULO 31.- Las infracciones previstas en el artículo anterior, se sancionarán de la siguiente manera:\nI. Con multa equivalente de 20 a 100 veces el salario mínimo vigente en la capital del\nEstado, en los casos previstos en las fracciones I, II y III.\nII. Con multa equivalente de 50 a 200 veces el salario mínimo vigente en la capital del estado, en los casos previstos en las fracciones IV, V, VI y VII.\nIII. Con multa equivalente de 200 a 500 veces el salario mínimo vigente en la Capital del\nEstado, en los casos previstos en las fracciones VIII y IX.\nARTICULO 32.- En los casos de reincidencia, se aplicará multa equivalente al doble de la impuesta por la fracción originaria.\nSe incurre en reincidencia, cuando la misma persona cometa dos o más veces, durante un ejercicio fiscal, infracciones de la misma naturaleza.\nARTICULO 33.- Las multas que deban imponerse por infracciones a esta ley, se fundarán y motivarán debidamente mediante escrito que formulará la autoridad fiscal a quien corresponda la imposición de la multa de que se trate.\nLas sanciones pecuniarias que se impongan conforme a esta ley, deberán ser cubiertas dentro del término de quince días, contados a partir de su notificación al responsable.\nPasado el término de referencia sin que se hubiesen cubierto los montos, la Secretaría de\nFinanzas hará efectivo el cobro conforme a lo dispuesto por el Código Fiscal para el Estado de\nCoahuila.\nCAPITULO IX\nDE LOS MEDIOS DE DEFENSA\nARTICULO 34.- Contra los actos o las resoluciones de las autoridades aludidas en esta ley, procederá el recurso de inconformidad.\nARTICULO 35.- El recurso de inconformidad podrá hacerse valer únicamente por los afectados ante el órgano que emitió el acto, y se interpondrá:\nI. Contra resoluciones o actos que se estimen improcedentes o violatorios a las disposiciones de esta ley; y\nII. Contra resoluciones que impliquen la imposición de sanciones administrativas, derivadas la misma y que a juicio del inconformado se estimen infundadas.\nARTÍCULO 36.- La tramitación del recurso de inconformidad se sujetará a las reglas siguientes:\nI. Se interpondrá por escrito ante el órgano que emitió el acto; en él se precisará el nombre, domicilio y firma del promovente; los agravios que cause la resolución o acto impugnado. y las pruebas que estime pertinentes.\nII. El escrito deberá presentarse dentro de los 5 días hábiles siguientes a la fecha en que se haya notificado la resolución o se haya conocido el acto impugnado, directamente o por correo certificado.\nIII. Dentro del término de cinco días hábiles se desahogarán las pruebas, los estudios, inspecciones y demás diligencias que en relación con el acto o actos impugnados se consideren necesarios.\nIV. Desahogadas las pruebas ofrecidas por el inconforme, o las que de oficio se hayan ordenado practicar, se emitirá la resolución que corresponda, en un plazo que no excederá de diez días hábiles y se procederá a su notificación al interesado, en los términos que señala el Código Fiscal para el Estado de Coahuila.\nARTICULO 37.- Contra los actos administrativos dictados en materia fiscal estatal, se podrá interponer el medio de defensa regulado en el Título V, Capítulo I, Sección I del Código Fiscal para el Estado de Coahuila.\nPRIMERO. La presente ley entrará en vigor al día siguiente al de su publicación en el Periódico\nOficial del Estado.\nSEGUNDO. Se derogan todas las disposiciones que se contrapongan con las disposiciones de esta Ley.\nTERCERO. Las Asociaciones de Productores Frutícolas actualmente en funciones, contarán con un plazo de 30 días contados a partir de la publicación de la presente ley, para acudir a su registro ante la Secretaría y de 90 días para realizar los ajustes necesarios a la integración del régimen que dispone esta ley, en sus estatutos y reglamentos.\nCUARTO. El Ejecutivo del Estado, deberá expedir el reglamento de esta ley, en un plazo de 60\nEstado de Coahuila.\nDADO en el Salón de Sesiones del Congreso del Estado, en la Ciudad de Saltillo, Coahuila, a los ocho días del mes de noviembre del año dos mil cinco.\nDIPUTADA PRESIDENTA.\nMARÍA EUGENIA CÁZARES MARTÍNEZ.\nDIPUTADO SECRETARIO. DIPUTADO SECRETARIO.\nMIGUEL FELIPE MERY AYUP. GREGORIO CONTRERAS PACHECO.\nIMPRÍMASE, COMUNÍQUESE Y OBSÉRVESE\nEL GOBERNADOR DEL ESTADO\nPROFR. HUMBERTO MOREIRA\nVALDES\n(RÚBRICA)\nEL SECRETARIO DE GOBIERNO\nOSCAR PIMENTEL GONZÁLEZ\n(RÚBRICA)\nEL SECRETARIO DE FINANZAS\nLIC. JORGE TORRES LÓPEZ\n(RÚBRICA)\nEL SECRETARIO DE FOMENTO\nAGROPECUARIO\nLIC. HÉCTOR OSCAR FERNÁNDEZ\nAGUIRRE\n(RÚBRICA)\nN. DE E. A CONTINUACION SE TRANSCRIBEN LOS ARTICULOS TRANSITORIOS DE LOS DECRETOS DE REFORMAS A\nLA PRESENTE LEY.\nP.O. 38 / 12 de Mayo de 2009 / Decreto 051\nPRIMERO. La presente Decreto entrará en vigor al día siguiente de su publicación en el Periódico Oficial del Estado.\nSEGUNDO. Todas las disposiciones, menciones y referencias que se hagan en las leyes y reglamentos nacionales, estatales y municipales a la Procuraduría General de Justicia del Estado y al Procurador General de Justicia del Estado; a la Secretaría de\nSeguridad Pública del Estado y al Secretario de Seguridad Pública del Estado, se entenderán hechas a la Fiscalía General y al\nFiscal General.\nTERCERO. Todas las disposiciones, menciones y referencias que se hagan en las leyes y reglamentos nacionales, estatales y especializados, conforme a las siguientes denominaciones:\nSubprocurador Ministerial: Fiscal Ministerial, de Investigación y Operación Policial.\nSubprocurador de Control de Procesos y Legalidad: Fiscal de Control de Procesos y Legalidad.\nSubprocurador Jurídico de Profesionalización y de Proyectos: Fiscal Jurídico, de Profesionalización y de Proyectos.\nCUARTO. Se derogan todas las disposiciones que se opongan al presente Decreto.",
  "ordenamiento": "REGLAMENTO",
  "jurisdiccion": "COAHUILA",
  "fuente_oficial": "DIARIO OFICIAL DE LA FEDERACION",
  "Fecha de Publicación": "27 de octubre de 2006",
  "ULTIMA REFORMA PUBLICADA": "12 DE MAYO DE 2009",
  "es_escaneado": false,
  "tiene_tablas": false,
  "materia": [
    "cultura"
  ]
}