{
  "titulo": "Ley para la Prevención y Gestión Integral de Residuos para el Estado de Coahuila",
  "Contenido": "COAHUILA\nEL C. ENRIQUE MARTÍNEZ Y MARTÍNEZ, GOBERNADOR CONSTITUCIONAL DEL ESTADO\nINDEPENDIENTE, LIBRE Y SOBERANO DE COAHUILA DE ZARAGOZA, A SUS HABITANTES\nSABED:\nQUE EL CONGRESO DEL ESTADO INDEPENDIENTE, LIBRE Y SOBERANO DE COAHUILA DE\nZARAGOZA;\nDECRETA:\nNÚMERO 549.LEY PARA LA PREVENCIÓN Y GESTIÓN INTEGRAL DE RESIDUOS PARA EL ESTADO DE\nCOAHUILA DE ZARAGOZA\nTÍTULO PRIMERO\nDISPOSICIONES GENERALES\nCapítulo Único\nDel Objeto de la Ley\nARTÍCULO 1. La presente ley es de orden público e interés social y tiene por objeto garantizar el derecho de toda persona a un adecuado medio ambiente y de propiciar el desarrollo sustentable por medio de la regulación, de la generación, valorización y gestión integral de los residuos sólidos urbanos y de manejo especial, así como la prevención de la contaminación y la remediación de suelos contaminados con residuos.\nARTÍCULO 2. Para los efectos de la presente ley, son aplicables las definiciones contenidas en la Ley\nGeneral para la Prevención y Gestión Integral de los Residuos y demás ordenamientos jurídicos aplicables, así como las siguientes:\nI. Acopio: La acción de reunir residuos en un lugar determinado y apropiado para prevenir riesgos a la salud y al ambiente, a fin de facilitar su recolección;\nII. Almacenamiento: Retención temporal de los residuos en lugares propicios para prevenir daños al tratados para su aprovechamiento o se dispone de ellos;\nIII. Composta: la descomposición aerobia de la materia orgánica mediante la acción de microorganismos específicos, que permite el aprovechamiento de los residuos sólidos orgánicos como mejoradores de suelos;\nIV. Contenedor: El recipiente destinado al depósito ambientalmente adecuado y de forma temporal de residuos sólidos urbanos o de manejo especial, durante su acopio y traslado;\nV. Diagnóstico básico: El estudio elaborado por la autoridad correspondiente que considera la cantidad y composición de los residuos, así como la infraestructura para manejarlos integralmente;\nVI. Empresa de servicio de manejo: Persona física o moral registrada y autorizada a prestar servicios a autorización;\nVII. Gran generador: Persona física o moral que genere una cantidad igual o mayor a diez toneladas de residuos al año;\nIX. Ley general: Ley General para la Prevención y Gestión Integral de los Residuos; valor de aquellos cuya generación no sea posible evitar;\nXI. Recolección: La acción de recibir los residuos sólidos urbanos o de manejo especial de sus generadores y trasladarlos a las instalaciones autorizadas, almacenarlos, reutilizarlos, reciclarlos, tratarlos o disponer de ellos en rellenos sanitarios o en sitios controlados;\nXII. Residuos inorgánicos: Son aquellos no biodegradables;\nXIII. Residuos orgánicos: Aquellos que por sus características son biodegradables;\n(REFORMADA, P.O. 6 DE JUNIO DE 2008)\nXIV. Secretaría: La Secretaría de Medio Ambiente; y\n(ADICIONADA, P.O. 6 DE JUNIO DE 2008)\nXV. Sistema de manejo ambiental: Conjunto de medidas adoptadas a través de las cuales se incorporan criterios ambientales en las actividades cotidianas de los entes públicos, con el objetivo de minimizar su impacto negativo al ambiente, mediante el ahorro y consumo eficiente de agua, energía y materiales, y que alienta con sus políticas de adquisiciones la prevención de la generación de residuos, su aprovechamiento y su manejo integral.\nARTÍCULO 3. Se consideran causas de utilidad pública:\nI. Las medidas necesarias para evitar el deterioro o la destrucción que los elementos naturales puedan sufrir en perjuicio de la colectividad por la liberación al ambiente de residuos;\nII. La ejecución de obras destinadas a la prevención, conservación, protección del medio ambiente y remediación de sitios contaminados cuando éstas sean imprescindibles para reducir riesgos a la salud;\nIII. Las medidas de emergencia que las autoridades apliquen en caso fortuito o fuerza mayor, tratándose de contaminación por residuos de competencia de esta ley, y\nIV. Las acciones de emergencia para contener los riesgos a la salud derivados del manejo de residuos competencia de esta ley.\nTÍTULO SEGUNDO\nCapítulo Primero\nDe las Autoridades y sus Facultades\nARTÍCULO 4. Son autoridades competentes para aplicar la presente ley:\nI. El Ejecutivo del Estado;\nII. La Secretaría de Medio Ambiente; y\nIII. Los ayuntamientos.\nARTÍCULO 5. El Ejecutivo del Estado tendrá las siguientes facultades:\nI. Establecer la política estatal en materia de residuos;\nII. Vincular e integrar a la política ambiental, así como las disposiciones que esta ley establece en materia de gestión integral de residuos;\nIII. Establecer y evaluar el programa estatal para la prevención y gestión integral de los residuos, y en su caso los programas regionales;\nIV. Establecer y evaluar el programa para la prevención y gestión integral de residuos de manejo especial;\nV. Regular la gestión integral de residuos de manejo especial y la prevención y control de la contaminación generada por este tipo de residuos;\nVI. Promover en coordinación con el gobierno federal y los ayuntamientos, la creación de infraestructura para el manejo integral de residuos sólidos urbanos, de manejo especial y residuos peligrosos en el estado, con la participación de inversionistas y representantes de los sectores sociales interesados;\nVII. Promover la investigación, el desarrollo y la aplicación de tecnologías, equipos, sistemas y procesos que eliminen, reduzcan o minimicen la liberación al ambiente y la transferencia de uno a otro de sus elementos, de contaminantes provenientes del manejo integral de los residuos sólidos urbanos y de manejo especial;\nVIII. Promover la participación de los sectores privado y social para el cumplimiento del objeto de esta ley;\nIX. Participar en el establecimiento y operación, en el marco del sistema nacional de protección civil y en coordinación con la federación, de un sistema para la prevención y control de contingencias y emergencias ambientales derivadas de la gestión de residuos de manejo especial;\nX. Promover la educación y capacitación continua de personas de todos los sectores de la sociedad con el objeto de contribuir al cambio de hábitos a favor del ambiente;\nXI. Suscribir convenios con la federación con el propósito de promover lo establecido en la fracción anterior, en las instituciones educativas federales ubicadas en el estado; sobre la gestión integral de residuos de su competencia;\nXIII. Suscribir convenios y acuerdos con los grupos y organizaciones privadas y sociales, para cumplir con el objeto de esta ley;\nXIV. Diseñar el establecimiento y aplicación de los instrumentos económicos, fiscales, financieros y de mercado que tengan por objeto prevenir o reducir la generación de residuos y su gestión integral, y\nXV. Las demás que se establezcan en esta ley, las normas oficiales mexicanas y otros ordenamientos jurídicos que resulten aplicables.\nARTÍCULO 6. La Secretaría tendrá las siguientes atribuciones:\nI. Formular, conducir y revisar la política estatal en materia de residuos de manejo especial;\nII. Formular los programas para la prevención y gestión integral de los residuos que conforme a la Ley\nGeneral le correspondan a las Entidades Federativas;\nIII. Establecer y mantener actualizado un registro de planes de manejo de residuos de manejo especial conforme a los lineamientos que se determinen en el reglamento de esta ley;\nIV. Proponer al Ejecutivo Federal los residuos de manejo especial que puedan agregarse al listado de las normas oficiales mexicanas, por considerarse sujetos a planes de manejo;\nV. Autorizar el manejo integral de residuos de manejo especial;\nVI. Elaborar un padrón de empresas de servicios de manejo;\nVII. Determinar los indicadores que permitan evaluar la aplicación del presente ordenamiento, e integrar los resultados al sistema de información ambiental y de recursos naturales;\nVIII. Realizar los estudios y proyectos de obras de infraestructura para el manejo de residuos sólidos urbanos y de manejo especial;\nIX. Emitir opinión sobre el diseño, construcción, operación y cierre de estaciones de transferencia, plantas de selección y tratamiento, y sitios de disposición final de residuos;\nX. Promover el establecimiento y aplicación de instrumentos económicos, fiscales, financieros y de mercado que tengan por objeto prevenir o evitar la generación de residuos, su valorización y su gestión integral y sustentable;\nXI. Requerir a las autoridades municipales, a los generadores y a las empresas de servicios de manejo la información necesaria para realizar los diagnósticos básicos de residuos que sirvan para la elaboración de los programas de su competencia;\nXII. Formular, establecer y evaluar los sistemas de manejo ambiental de la administración pública estatal;\nXIII. Promover los programas de prevención y gestión integral de los residuos sólidos urbanos y de manejo especial, con la participación de las partes interesadas;\nXIV. Proponer al titular del ejecutivo la expedición de los ordenamientos jurídicos que permitan la gestión integral de residuos de manejo especial, así como la prevención de la contaminación de sitios con dichos residuos y su remediación;\nXV. Autorizar y controlar las actividades realizadas por los microgeneradores de residuos peligrosos así establezcan los convenios que se suscriban con la federación, y en su caso, con los municipios conforme a lo dispuesto por los artículos 11 y 12 de este ordenamiento;\nXVI. Coadyuvar en la promoción de la prevención de la contaminación de sitios con residuos peligrosos y su remediación, educativas, organismos no gubernamentales, personas físicas y morales, para realizar acciones que faciliten el cumplimiento de la presente ley y;\nXVII. Las demás que se establezcan en esta ley y otros ordenamientos que resulten aplicables.\nARTÍCULO 7. La Secretaría tendrá las siguientes atribuciones::\nI. Verificar el cumplimiento de los instrumentos y disposiciones jurídicas en materia de residuos de manejo especial;\nII. Inspeccionar y vigilar el manejo integral de los residuos de manejo especial;\nIII. Imponer las sanciones y medidas de seguridad que procedan de acuerdo con la normatividad aplicable y lo que establezcan los convenios que se suscriban con la federación y con los municipios, conforme a lo dispuesto en los artículos 11 y 12 de este ordenamiento, y\nIV. Las demás que se establezcan en esta ley y otros ordenamientos jurídicos aplicables.\nARTÍCULO 8. Los ayuntamientos tendrán las siguientes facultades:\n(REFORMADA, P.O. 6 DE JUNIO DE 2008)\nI. Formular por sí o con el apoyo de la Secretaría y con la participación de representantes de los distintos sectores sociales, los programas municipales para la prevención y gestión integral de los residuos sólidos urbanos, los cuales deberán observar lo dispuesto en el programa estatal para la prevención y gestión integral de los residuos;\nII. Expedir los reglamentos y demás disposiciones jurídico-administrativas de observancia general dentro de sus jurisdicciones respectivas, a fin de dar cumplimiento a lo establecido en la presente ley y en la ley general;\nIII. Establecer programas graduales de separación de la fuente de residuos orgánicos e inorgánicos y los mecanismos para promover su aprovechamiento;\nIV. Prevenir la generación y controlar el manejo integral de los residuos sólidos urbanos;\nV. Capacitar a los servidores públicos que intervienen en la prestación del servicio público de limpia, recolección, traslado, tratamiento y disposición final de residuos;\nVI. Concesionar de manera total o parcial la prestación del servicio público de limpia, recolección, traslado, tratamiento y disposición final de residuos, estos servicios forman parte del manejo integral;\nVII. Autorizar aquellas etapas del manejo integral de residuos sólidos urbanos que no sean consideradas como servicio público;\nVIII. Establecer y mantener actualizado el registro de grandes generadores de residuos sólidos urbanos;\nIX. Verificar el cumplimiento de las disposiciones de esta ley, normas oficiales mexicanas y demás seguridad que resulten aplicables;\nX. Participar en el control de los residuos peligrosos generados o manejados por microgeneradores, así establecido en la ley general;\nXI. Coadyuvar en la prevención de la contaminación de sitios con residuos peligrosos y su remediación;\nXII. Determinar con la asistencia técnica de la Secretaría, los costos de las distintas etapas de la operación de los servicios de manejo integral de residuos sólidos urbanos;\nXIII. Proponer al Congreso del Estado, las tarifas aplicables al derecho por la prestación del servicio público de limpia, recolección, traslado, tratamiento y disposición final, comprendido en las etapas del manejo integral de residuos sólidos urbanos;\nXIV. Evitar los tiraderos a cielo abierto o sitios no controlados de residuos sólidos urbanos;\nXV. Difundir entre la población prácticas de separación, reutilización y reciclaje de residuos;\nXVI. Instalar en la vía pública equipamiento para el depósito por separado de residuos sólidos urbanos;\nXVII. Promover y dar seguimiento a la formulación, implementación y evaluación del sistema de manejo ambiental en las dependencias y entidades de la administración pública municipal, y\nXVIII. Las demás que se establezcan en esta ley y otros ordenamientos jurídicos que resulten aplicables.\nCapítulo Segundo\nDe la Coordinación\nARTÍCULO 9. El Ejecutivo del Estado podrá suscribir convenios o acuerdos de coordinación con la federación de conformidad con esta ley y la ley general, para asumir las siguientes funciones:\nI. La autorización y el control de las actividades realizadas por los microgeneradores de residuos peligrosos de conformidad con las normas oficiales mexicanas correspondientes;\nII. El control de los residuos peligrosos que estén sujetos a los planes de manejo;\nIII. El establecimiento y actualización de los registros que correspondan en los casos anteriores, y\nIV. La imposición de las sanciones aplicables relacionadas con los actos a los que se refiere este artículo.\nARTÍCULO 10. Para los efectos del artículo anterior, los convenios o acuerdos de coordinación que celebre el Ejecutivo del Estado con la federación, con la participación en su caso, de los municipios, deberán ajustarse a lo dispuesto por el artículo 12 de la Ley General del Equilibrio Ecológico y la\nProtección al Ambiente.\nTÍTULO TERCERO\nINSTRUMENTOS DE LA POLÍTICA DE PREVENCIÓN\nY GESTIÓN INTEGRAL DE LOS RESIDUOS\nCapítulo Primero\nDel Programa Estatal para la Prevención y Gestión Integral de los Residuos\nARTÍCULO 11. El Ejecutivo del Estado a través de la Secretaría establecerá el programa estatal para la prevención y gestión integral de los residuos, de conformidad con esta ley, con el diagnóstico básico para la gestión integral de residuos sólidos urbanos y de manejo especial y demás disposiciones aplicables. concordancia con lo que establezca el programa nacional de la materia, considerando los siguientes lineamientos:\nI. Aplicar los principios de valorización, responsabilidad compartida y manejo integral de residuos;\nII. Adoptar medidas para la reducción de la generación de residuos, su separación en la fuente de origen, así como su adecuado aprovechamiento, tratamiento y disposición final; transferencia de contaminantes de un medio a otro;\nIV. Promover la reducción de la cantidad de los residuos que lleguen a disposición final;\nV. Prever la infraestructura necesaria para asegurar que los residuos se manejen de manera ambientalmente adecuada;\nVI. Armonizar las políticas de ordenamiento territorial y ecológico con el manejo integral de residuos, identificando las áreas apropiadas para la realización de obras de infraestructura para su almacenamiento, tratamiento y disposición final;\nVII. Promover la cultura, educación y capacitación ambientales, así como la participación del sector social, público y privado para el manejo integral de los residuos;\nVIII. Promover medidas para evitar el acopio de residuos en áreas o en condiciones no autorizados por la autoridad competente;\nIX. Establecer las medidas adecuadas para reincorporar al ciclo productivo residuos reutilizables o reciclables, así como promover el desarrollo de mercados de subproductos para la valorización de los residuos;\nX. Determinar las medidas conducentes para evitar la disposición final de residuos que sean incompatibles y puedan provocar reacciones que liberen gases, provoquen incendios o explosiones o que no hayan sido sometidos a procesos de tratamiento, y\nXI. Los demás que establezca el reglamento de esta ley y otros ordenamientos jurídicos aplicables.\n(REFORMADO, P.O. 6 DE JUNIO DE 2008)\nARTÍCULO 12. La Secretaría formulará, instrumentará y revisará el programa para la prevención y gestión integral de los residuos de manejo especial.\nDe igual forma, los ayuntamientos formularán, instrumentarán y evaluarán sus programas municipales para la prevención y gestión integral de los residuos sólidos urbanos, quienes para tal fin podrán solicitar el apoyo técnico de la Secretaría.\nARTÍCULO 13. Los programas a que hace referencia el artículo anterior, deberán contener al menos lo siguiente:\nI. La política en materia de residuos sólidos urbanos y de manejo especial, según corresponda;\nII. La definición de objetivos y metas para la prevención de la generación y el mejoramiento de la gestión de los residuos sólidos urbanos y de manejo especial, así como las estrategias y plazos para su cumplimiento;\nIII. Los medios de financiamiento de las acciones consideradas en los programas, y\nIV. Los mecanismos para fomentar la vinculación entre los programas correspondientes, a fin de crear sinergias.\nCapítulo Segundo\nDe los Planes de Manejo\nARTÍCULO 14. Los planes de manejo de residuos sólidos urbanos y de manejo especial, deberán estar encaminados, entre otros a:\nI. Identificar formas de prevenir o reducir su generación;\nII. Establecer esquemas de manejo en los que aplique el principio de responsabilidad compartida de los distintos sectores involucrados;\nIII. Establecer mecanismos para reutilizar, reciclar o aprovechar los residuos que no se puedan evitar, de conformidad con las disposiciones legales aplicables y en la medida que esto sea ambientalmente adecuado, económicamente viable y tecnológicamente factible;\nIV. Reducir el volumen y riesgo en el manejo de los residuos que no se puedan valorizar, de conformidad con las disposiciones legales aplicables;\nV. Alentar la innovación de procesos, métodos y tecnologías para lograr un manejo integral de los residuos, que sea económicamente factible, y\nVI. Disponer finalmente en un relleno sanitario o en un sitio controlado, según corresponda, los residuos que no puedan ser susceptibles de valorizarse.\nARTÍCULO 15. El contenido de los planes de manejo se sujetará a lo previsto en el reglamento de esta ley, la Ley General, los ordenamientos que de ella deriven y en las normas oficiales mexicanas.\nARTÍCULO 16. Estarán obligados a la formulación y ejecución de los planes de manejo los grandes generadores y los productores, importadores, exportadores y distribuidores de los productos que al desecharse se convierten en residuos sólidos urbanos o de manejo especial que se incluyan en los listados de residuos sujetos a planes de manejo, de conformidad con las normas oficiales mexicanas correspondientes.\nARTÍCULO 17. La determinación de residuos que podrán sujetarse a planes de manejo se llevará a cabo con base en los criterios siguientes y los que establezcan las normas oficiales mexicanas:\nI. Que los materiales que los componen tengan un alto valor económico;\nII. Que se trate de residuos de alto volumen de generación, producidos por un número reducido de generadores, y naturales.\nARTÍCULO 18. Los grandes generadores de residuos sólidos urbanos y de manejo especial, deberán integrar una propuesta para sustentar el desarrollo de cada uno de los planes de manejo, que se entregará a la Secretaría para su validación y en la cual se asentará, entre otros, lo siguiente:\nI. El nombre, la denominación o razón social de quien presente la propuesta, del representante legal en su caso, el nombre de los autorizados para recibir notificaciones, al órgano administrativo al que se dirijan, el lugar y fecha de formulación. La propuesta deberá estar firmada por el interesado o su representante legal;\nII. Los residuos generados que serán objeto de los planes de manejo;\nIII. Los procedimientos, métodos o técnicas que se emplearán en la reutilización, reciclado o tratamiento de los residuos;\nIV. Las empresas autorizadas y registradas como prestadoras de servicios que se ocuparán del manejo integral de los residuos sujetos a los planes de manejo, en cualquiera de sus etapas;\nV. Cronograma enunciando las principales actividades y sus fechas de implantación, así como la periodicidad para evaluación y entrega de actualizaciones;\nVI. Los responsables de la implantación y seguimiento de los planes de manejo correspondientes;\n(REFORMADA, P.O. 6 DE JUNIO DE 2008)\nVII. La indicación de que parte de la información proporcionada a la Secretaría deberá manejarse de manera confidencial por tratarse de información privilegiada de valor comercial, y\nVIII. Los indicadores para evaluar el desempeño del plan de manejo.\n(REFORMADO PRIMER PÁRRAFO, P.O. 6 DE JUNIO DE 2008)\nARTÍCULO 19. La Secretaría podrá convocar conjuntamente con los ayuntamientos de manera gradual, a los productores, importadores, distribuidores y comercializadores de productos de consumo que al desecharse se conviertan en residuos sólidos urbanos y de manejo especial, susceptibles de ser objeto de planes de manejo de conformidad con las disposiciones de la ley general, las normas oficiales mexicanas y esta ley a fin de:\nI. Dar a conocer que son prioritarios para su atención por el grado de dificultad que implica el manejo de los residuos correspondientes o los problemas ambientales que se han visto asociados a las formas de disposición final comunes de los mismos;\nII. Proponer la formulación de proyectos piloto que de manera gradual permitan la devolución de los residuos por los consumidores, a fin de que se ocupen de su reciclaje, tratamiento o disposición final;\nIII. Identificar conjuntamente las alianzas y redes de colaboración que es necesario establecer, en el marco de la responsabilidad compartida pero diferenciada, a fin de contar con el apoyo necesario de las partes interesadas para facilitar la formulación e implantación de los proyectos piloto a los que hace referencia la fracción anterior de este artículo;\nIV. Identificar el tipo de instrumentos económicos o de otra índole que permitirán sustentar el costo del manejo de los residuos en su fase post-consumo, así como de facilidades administrativas, incentivos o reconocimientos que podrán implantarse para alentar el desarrollo de los planes de manejo;\nV. Identificar los medios y mecanismos a través de los cuales se podrá hacer del conocimiento público la los planes de manejo de los residuos;\nVI. Identificar las necesidades de infraestructura para el manejo integral de los residuos devueltos por los consumidores y la capacidad instalada en el estado o en el país para ello,\nVII. Identificar las necesidades a satisfacer para crear o fortalecer los mercados del reciclaje de los materiales valorizables que puedan recuperarse de los residuos sujetos a los planes de manejo.\nARTÍCULO 20. En ningún caso los planes de manejo podrán plantear formas de manejo contrarias a los riesgos del residuo de que se trate, ni realizarse a través de empresas que no estén autorizadas ante las autoridades competentes.\nARTÍCULO 21. El Ejecutivo del Estado y los ayuntamientos deberán publicar en el Periódico Oficial del manejo.\nCapítulo tercero y gestión integral de los residuos\nARTÍCULO 22. El Ejecutivo del Estado, en coordinación con las autoridades competentes, evaluará, desarrollará y promoverá la implantación de instrumentos económicos, fiscales, financieros o de mercado que incentiven la prevención de la generación, la separación, acopio y aprovechamiento, así como el tratamiento y disposición final de los residuos sujetos a las disposiciones de esta ley.\nEn aquellos casos en que sea técnica y económicamente factible, se promoverá la creación de cadenas productivas y se brindarán incentivos para el establecimiento de los planes de manejo.\n(REFORMADO, P.O. 6 DE JUNIO DE 2008)\nARTÍCULO 23. La Secretaría promoverá la aplicación de incentivos para alentar la inversión del sector privado en el desarrollo tecnológico, adquisición de equipos y en la construcción de infraestructura para facilitar la prevención de la generación, la reutilización, el reciclaje, el tratamiento y la disposición final ambientalmente adecuados de los residuos sólidos urbanos y de manejo especial, así como de los residuos peligrosos domiciliarios y los generados por los microgeneradores.\nCapítulo Cuarto\nDe la Cultura Ambiental\nARTÍCULO 24. Las autoridades educativas del Estado promoverán la incorporación de contenidos de cultura ambiental a los programas de estudio que permitan el desarrollo de hábitos tendientes a lograr la minimización de residuos.\nLas instituciones educativas del estado están obligadas a incorporar como parte de su equipamiento, contenedores para el depósito separado de residuos sólidos urbanos y de manejo especial de conformidad con las disposiciones de esta ley y otros ordenamientos jurídicos aplicables.\n(REFORMADO, P.O. 6 DE JUNIO DE 2008)\nLa Secretaría prestará su apoyo a dichas instituciones a efecto de impulsar la educación y cultura ambiental en la entidad.\nCapítulo Quinto\nDe la Participación Social\nARTÍCULO 25. El Ejecutivo del Estado y los ayuntamientos, en la esfera de su competencia, promoverán la participación de los sectores de la sociedad para prevenir la generación, fomentar la valorización y contaminación ambiental producida por su manejo, para lo cual:\nI. Promoverán y apoyarán la conformación, consolidación y operación de grupos intersectoriales interesados en participar en el diseño e instrumentación de políticas y programas correspondientes, así como para prevenir la contaminación de sitios con residuos y llevar a cabo su remediación;\nII. Convocarán a los grupos sociales organizados a participar en proyectos destinados a generar la información necesaria para sustentar programas de gestión integral de residuos;\nIII. Celebrarán convenios de concertación con organizaciones sociales y privadas en la materia objeto de la presente ley;\nIV. Celebrarán convenios con medios de comunicación masiva para la promoción de las acciones de prevención y gestión integral de los residuos;\nV. Promoverán el reconocimiento a los esfuerzos más destacados de la sociedad en materia de prevención y gestión integral de los residuos;\nVI. Impulsarán la conciencia ecológica y la aplicación de la presente ley a través de la realización de acciones conjuntas con la sociedad para la prevención y gestión integral de los residuos, y\nVII. Concertarán acciones e inversiones con los sectores sociales y privados, instituciones académicas, grupos y organizaciones sociales y demás personas físicas y morales interesadas.\nARTÍCULO 26. El Ejecutivo del Estado y los ayuntamientos, integrarán órganos de consulta en los que participen entidades y dependencias de la administración pública, instituciones académicas, organizaciones sociales y empresariales que tendrán funciones de asesoría, evaluación y seguimiento en materia de la política de prevención y gestión integral de los residuos y podrán emitir las opiniones y observaciones que estimen pertinentes.\nPara su organización y funcionamiento, se sujetarán a las disposiciones contenidas en la Ley del\nEquilibrio Ecológico y la Protección al Ambiente del Estado y su reglamento en la materia.\nCapítulo Sexto\nDe los Sistemas de Manejo Ambiental\nARTÍCULO 27. Los poderes Ejecutivo, Legislativo y Judicial del Estado, los ayuntamientos, así como los organismos autónomos, implementarán sistemas de manejo ambiental en todas sus dependencias y entidades, así como programas de capacitación y mejoramiento ambiental en la prestación de servicios públicos, los que tendrán por objeto prevenir y minimizar la generación de residuos y aprovechar su valor, a través de:\nI. La promoción de una cultura de responsabilidad ambiental en los servidores públicos;\nII. La disminución del impacto ambiental generado por las actividades administrativas de sus dependencias y entidades, y\nIII. La eficiencia administrativa, a través del consumo racional y sustentable de los recursos materiales y financieros.\nAsimismo, promoverán que en sus procesos de adquisiciones de bienes para la prestación de sus servicios y cumplimiento de sus funciones, se opte por la utilización y el consumo de productos compuestos total o parcialmente de materiales valorizables.\nARTÍCULO 28. La Secretaría prestará su apoyo a los poderes del Estado, a los ayuntamientos, así como a los organismos autónomos en la formulación de los sistemas de manejo ambiental.\nTÍTULO CUARTO\nDEL MANEJO INTEGRAL DE LOS RESIDUOS\nCapítulo Primero\nDe la Clasificasion de los Residuos\nARTÍCULO 29. Los residuos de manejo especial se clasifican como se indica a continuación, salvo mexicanas correspondientes:\nI. Residuos de las rocas o los productos de su descomposición que sólo puedan utilizarse para la fabricación de materiales de construcción o se destinen para este fin, así como los productos derivados de la descomposición de las rocas, excluidos de la competencia federal conforme a las fracciones IV y V del artículo 5 de la Ley Minera;\nII. Residuos de servicios de salud, generados por los establecimientos que realicen actividades médicoasistenciales a las poblaciones humanas o animales, centros de investigación, con excepción de los biológico-infecciosos;\nIII. Residuos generados por las actividades piscícolas, agrícolas, silvícolas, forestales, avícolas o ganaderas incluyendo los residuos de los insumos utilizados en esas actividades;\nIV. Residuos industriales no peligrosos generados en instalaciones o por procesos industriales que no presentan características de peligrosidad, conforme a la normatividad ambiental vigente;\nV. Residuos de los servicios de transporte, así como los generados a consecuencia de las actividades que se realizan en aeropuertos, terminales ferroviarias y aduanas;\nVI. Lodos provenientes del tratamiento de aguas residuales;\nVII. Residuos de tiendas departamentales o centros comerciales generados en grandes volúmenes;\nVIII. Residuos de la construcción, mantenimiento y demolición en general;\nIX. Residuos tecnológicos provenientes de las industrias de la informática, fabricantes de productos electrónicos o de vehículos automotores y otros que al transcurrir su vida útil, por sus características, requieren de un manejo específico, y\n(REFORMADA, P.O. 6 DE JUNIO DE 2008)\nX. Otros que sean determinados como tales por la Secretaría.\nARTÍCULO 30. Los residuos sólidos urbanos podrán clasificarse en orgánicos e inorgánicos con objeto de facilitar su separación primaria y secundaria, de conformidad con los programas estatales y municipales para la prevención y gestión integral de los residuos y demás ordenamientos aplicables.\nARTÍCULO 31. La clasificación de residuos sólidos urbanos y de manejo especial sujetos a planes de manejo, se llevará a cabo de conformidad con los criterios que se establezcan en las normas oficiales cargo de la Secretaría.\nCapítulo Segundo\nARTÍCULO 32. Las personas físicas y morales que generen residuos sólidos urbanos y de manejo especial serán responsables hasta su reuso y/o disposición final.\nARTÍCULO 33. Es obligación de toda persona generadora de residuos sólidos urbanos y de manejo especial:\nI. Separar y reducir la generación de residuos;\nII. Fomentar la reutilización y reciclaje de los residuos;\nIII. Cumplir con las disposiciones específicas, criterios, normas y recomendaciones técnicas aplicables al manejo integral de los residuos sólidos urbanos y de manejo especial;\nIV. Poner en conocimiento de las autoridades competentes las infracciones que se estimen se hubieran cometido contra la normatividad de los residuos, y\nV. Las demás que establezcan los ordenamientos jurídicos aplicables.\nARTÍCULO 34. Los grandes generadores de residuos de manejo especial, están obligados a:\n(REFORMADO, P.O. 6 DE JUNIO DE 2008)\nI. Registrarse ante la Secretaría y obtener autorización para su manejo;\n(REFORMADO, P.O. 6 DE JUNIO DE 2008)\nII. Establecer los planes de manejo y registrarlos ante la Secretaría, en caso de que requieran ser modificados o actualizados, notificarlo oportunamente al mismo;\n(REFORMADO, P.O. 6 DE JUNIO DE 2008)\nIII. Utilizar el sistema de manifiestos que establezca la Secretaría, para hacer el seguimiento de la generación y formas de manejo de sus residuos a lo largo de su ciclo de vida integral;\nIV. Llevar bitácoras en la que registren el volumen y tipo de residuos generados y la forma de manejo a la que fueron sometidos;\nV. Llevar a cabo el manejo integral de sus residuos, de conformidad con las disposiciones de esta ley y otros ordenamientos que resulten aplicables, y\n(REFORMADO, P.O. 6 DE JUNIO DE 2008)\nVI. Presentar a la Secretaría un informe anual de los volúmenes de generación y formas de manejo de los residuos de manejo especial generados en grandes volúmenes.\nARTÍCULO 35. Las personas consideradas como microgeneradores de residuos peligrosos, en los términos de la ley general, están obligadas a:\n(REFORMADO, P.O. 6 DE JUNIO DE 2008)\nI. Registrarse ante la Secretaría;\nII. Sujetar los residuos peligrosos que generen, a los programas y planes de manejo que se establezcan\nIII. Trasladar sus residuos peligrosos a los centros de acopio autorizados o enviarlos a través de transportación autorizada, de conformidad con las disposiciones legales aplicables.\nARTÍCULO 36. De conformidad con lo que establece la ley general, los residuos peligrosos que se generen en los domicilios, en oficinas públicas y privadas en cantidades iguales o menores a las que generan los microgeneradores, deberán ser manejados de acuerdo con los programas y planes de manejo según lo dispuesto en esta ley.\nTÍTULO QUINTO\nDEL MANEJO INTEGRAL DE RESIDUOS\nCapítulo Primero\nDe las Autorizaciones\nARTÍCULO 37. El manejo integral de los residuos comprende las siguientes etapas:\nI. Reducción en la fuente;\nII. Separación;\nIII. Reutilización;\nIV. Limpia o barrido;\nV. Acopio;\nVI. Recolección;\nVII. Almacenamiento;\nVIII. Traslado o transportación;\nIX. Co-procesamiento;\nX. Tratamiento;\nXI. Reciclaje, y\nXII. Disposición final.\nLa etapa de limpia o barrido se excluye del manejo integral de residuos de manejo especial.\nTratándose de los residuos sólidos urbanos, las etapas de limpia o barrido, recolección, traslado o trasportación, tratamiento y disposición final estarán a cargo de los municipios por ser un servicio público.\n(REFORMADO PRIMER PÁRRAFO, P.O. 6 DE JUNIO DE 2008)\nARTÍCULO 38. Se requiere autorización de la Secretaría para llevar a cabo las etapas del manejo integral de residuos de manejo especial establecidas en las fracciones II, III y de la V a la XII del artículo anterior. señaladas en las fracciones V, VII, IX y XI del artículo anterior.\nLas autorizaciones deberán otorgarse por tiempo determinado.\nEn el Reglamento de la presente ley, se señalarán los términos y condiciones de las autorizaciones.\nARTÍCULO 39. Para el otorgamiento de autorizaciones se requiere:\nI. Ubicarse en lugares que reúnan los criterios que establezca la normatividad aplicable;\nII. Instrumentar un plan de manejo registrado ante la Secretaría para la operación segura y ambientalmente adecuada de los residuos que maneje;\nIII. Contar con programas para prevenir y responder a contingencias o emergencias ambientales y accidentes;\nIV. Contar con personal capacitado y continuamente actualizado, y\nV. Otorgar garantías para asegurar que al cierre de las operaciones de sus instalaciones, éstas queden salud humana y el ambiente.\nAdemás de los requisitos señalados en este artículo, la persona física o moral deberá atender a las condiciones de carácter técnico que por la naturaleza del servicio le sean exigibles por el Instituto, mismas que formarán parte de la autorización, así mismo quedará sujeto a las inspecciones periódicas con el fin de asegurar el funcionamiento de la misma, de acuerdo a lo previsto por la presente ley, así como a la normatividad aplicable.\nARTÍCULO 40. Durante la vigencia de la autorización la empresa de servicio de manejo deberá presentar informes acerca de los residuos recibidos y las formas de manejo a los que fueron sometidos en los términos que la autorización establezca.\nARTÍCULO 41. Son causas de revocación de las autorizaciones:\n(REFORMADA, P.O. 6 DE JUNIO DE 2008)\nI. Que exista falsedad en la información proporcionada a la Secretaría;\nII. Cuando las actividades de manejo integral de los residuos contravengan la normatividad aplicable;\nIII. No renovar las garantías otorgadas;\nIV. No realizar la reparación del daño ambiental que se cause con motivo de las actividades autorizadas,\nV. Incumplir con las obligaciones establecidas en la autorización, la presente ley y demás disposiciones aplicables.\nCapítulo Segundo\nDe las Fases del Manejo Integral de Residuos\nARTÍCULO 42. Las fases que comprenden el manejo integral de residuos se deberán llevar a cabo conforme a lo que establezca esta ley y demás disposiciones aplicables.\nARTÍCULO 43. Es responsabilidad de todo generador de residuos sólidos urbanos y de manejo especial, buscar alternativas e implementar acciones para reducir o minimizar la generación o en su caso, procurar la biodegradabilidad de los mismos.\nARTÍCULO 44. Todo generador de residuos deberá llevar a cabo su separación con el objeto de evitar que se mezclen con otros generados en las actividades que realice y prolongar su vida útil.\nARTÍCULO 45. El Ejecutivo del Estado y los ayuntamientos instrumentarán sistemas de separación primaria y secundaria de los residuos sólidos urbanos y de manejo especial, conforme a las disposiciones jurídicas aplicables.\nAsimismo, realizarán campañas para fomentar la separación de residuos desde la fuente de su generación con el fin de facilitar su disposición adecuada.\nARTÍCULO 46. Los contenedores que se coloquen en la vía pública deberán ser diferenciados y inorgánicos.\nARTÍCULO 47. Toda persona tendrá la obligación de buscar el mejor aprovechamiento y utilidad de los residuos. Para tal efecto en sus actividades domiciliarias, industriales, comerciales o de servicios buscará reutilizar los residuos que genere.\nARTÍCULO 48. La limpieza o barrido de áreas y vialidades públicas así como la recolección de residuos sólidos urbanos y su traslado o transportación compete a las autoridades municipales, sin detrimento de las disposiciones reglamentarias y sin perjuicio de las concesiones que otorguen a los interesados, observando las disposiciones jurídicas que lo determinan.\nARTÍCULO 49. La recolección de residuos sólidos urbanos se realizará de acuerdo a las disposiciones administrativas que expidan las autoridades municipales, las que deberán establecer cuando menos las rutas, horarios y días en que se realizará, así como su periodicidad.\nARTÍCULO 50. Las personas que realicen actividades de acopio o almacenamiento de residuos sólidos urbanos para su reciclaje, deberán observar las disposiciones administrativas que el municipio determine, a fin de que el lugar y la actividad cumplan con esta ley.\nARTÍCULO 51. La recolección de residuos de manejo especial es obligación de sus generadores quienes podrán contratar con una empresa de servicio de manejo la realización de esta etapa.\nARTÍCULO 52. Los vehículos destinados a la recolección y traslado o transportación de residuos, preferentemente deberán contar con contenedores distintos que hagan factible su acopio por separado.\nARTÍCULO 53. La transportación de residuos sólidos urbanos y de manejo especial en el estado, se realizará con la autorización de las autoridades estatales y municipales en materia de su competencia.\nPara la transportación de residuos sólidos urbanos y de manejo especial se deberán considerar:\nI. Las condiciones necesarias para el transporte, dependiendo del tipo de residuos de que se trate;\nII. Las medidas de seguridad en el transporte, tanto para el medio ambiente de forma integral así como prioritariamente la salud humana, y\nIII. Las mejores rutas de transporte, dependiendo de los lugares de salida y destino de los residuos.\nARTÍCULO 54. Los sitios destinados al tratamiento y disposición final de residuos sólidos urbanos y de manejo especial además de cumplir con los requisitos señalados en el artículo 39 de esta ley, deberán contar con la autorización de impacto ambiental en los términos que se establece la Ley del Equilibrio\nEcológico y Protección al ambiente del Estado y demás normatividad aplicable.\nCapítulo Tercero\nDe la Valorización de los Residuos\nSección Primera\nDel Reciclaje\nARTÍCULO 55. Los productores y comercializadores cuyos productos y servicios generen residuos las acciones para minimizar la generación de sus residuos, su manejo responsable y para orientar a los consumidores sobre las oportunidades y beneficios de dicha valorización para su aprovechamiento.\nARTÍCULO 56. La Secretaría en coordinación con los ayuntamientos de conformidad con el programa estatal para la prevención y gestión integral de los residuos, instrumentarán programas para la utilización aprovechamiento, vinculando al sector privado, organizaciones sociales y otros agentes económicos.\nARTÍCULO 57. Los residuos que hayan sido seleccionados para su reciclaje y que por sus características no puedan ser procesados, deberán enviarse para su disposición final, en los términos que disponga el reglamento de la presente ley.\nSección Segunda\nDe la Producción de Composta\nARTÍCULO 58. Los ayuntamientos diseñarán, construirán y operarán centros de generación de composta de residuos sólidos urbanos orgánicos, de conformidad con lo que se establezca en el programa estatal para la prevención y gestión integral de los residuos y con los programas municipales correspondientes.\nAdemás ambas autoridades participarán en la difusión de la información sobre como realizar una composta de calidad y su aprovechamiento, a través de guías y cursos informativos.\n(REFORMADO, P.O. 6 DE JUNIO DE 2008)\nPara tal efecto, podrán solicitar el apoyo técnico de la Secretaría.\nARTÍCULO 59. Los lineamientos sobre las características apropiadas de los residuos para la producción de composta o criterios para cada tipo de composta, se fijarán en las normas técnicas ambientales que al efecto se expidan.\nLa composta que no pueda ser aprovechada deberá ser enviada a los rellenos sanitarios para su disposición final.\nARTÍCULO 60. Toda persona que lleve a cabo procesos de tratamiento de residuos sólidos urbanos orgánicos para composta deberá cumplir con las disposiciones que establecen las normas oficiales mexicanas y las normas técnicas ambientales en la materia.\nTÍTULO SEXTO\nPREVENCIÓN, CONTROL Y REMEDIACIÓN DEL SUELO\nCapítulo Primero\nDe la Prevención y Control de Sitios\nARTÍCULO 61. Es responsabilidad de toda persona que genere y maneje residuos, hacerlo de manera que no implique daños a la salud humana ni al ambiente.\nARTÍCULO 62. La selección, opresión y clausura de sitios de disposición final de los residuos se deberá realizar de acuerdo a la normatividad ambiental aplicable.\nARTÍCULO 63. En los sitios de disposición final se deberá:\nI. Evitar el confinamiento de residuos líquidos o semilíquidos, sin que hayan sido sometidos a procesos de secado, y\nII. Evitar el confinamiento de residuos mezclados que sean incompatibles y que puedan provocar afectaciones al medio ambiente.\nCapítulo Segundo\nDe la Remediación del Suelo\nARTÍCULO 64. Quienes resulten responsables de la contaminación del suelo, así como de daños a la salud como consecuencia de ésta, independientemente de las sanciones penales o administrativas que procedan, estarán obligados a:\nI. Llevar a cabo las acciones necesarias para remediar las condiciones del suelo, de acuerdo a lo establecido en las disposiciones jurídicas aplicables, y\nII. En caso de que la remediación no fuera factible, a reparar el daño causado a terceros o al ambiente de conformidad con la legislación aplicable.\n(REFORMADO, P.O. 6 DE JUNIO DE 2008)\nARTÍCULO 65. La Secretaría establecerá los lineamientos generales para la remediación de los sitios contaminados.\nARTÍCULO 66. En caso de que no sea posible identificar al responsable de la contaminación de un sitio por residuos, las autoridades estatales y municipales coordinadamente llevarán a cabo las acciones necesarias para su remediación.\nTÍTULO SÉPTIMO\nDE LAS MEDIDAS DE SEGURIDAD, SANCIONES,\nREPARACIÓN DEL DAÑO Y RECURSO DE REVISIÓN\nCapítulo Primero\nDe la Inspección y Vigilancia\n(REFORMADO, P.O. 6 DE JUNIO DE 2008)\nARTÍCULO 67. La Secretaría realizará en el ámbito de su competencia, los actos de inspección y vigilancia del cumplimiento de las disposiciones contenidas en el presente ordenamiento, así como las que del mismo se deriven.\n(REFORMADO, P.O. 6 DE JUNIO DE 2008)\nARTÍCULO 68. Las visitas de inspección que realice la Secretaría, se realizarán conforme a las\nProtección al Ambiente del Estado.\nCapítulo Segundo\nDe las Medidas de Seguridad\nARTÍCULO 69. La Secretaría y los ayuntamientos podrán según corresponda ordenar fundada y motivadamente, cuando las operaciones y procesos empleados durante el acopio, recolección, almacenamiento, transporte, co-procesamiento, reciclaje, tratamiento o disposición final de residuos representen riesgos inminentes o significativos de desequilibrio ecológico, o de daño o deterioro grave a los recursos naturales, casos de contaminación con repercusiones peligrosas para los ecosistemas, sus componentes o para la salud pública las siguientes medidas de seguridad:\nI. Asegurar los materiales, residuos o sustancias contaminantes, vehículos, utensilios e instrumentos directamente relacionados con la conducta a que da lugar la imposición de la medida de seguridad, según lo previsto en el párrafo primero de este artículo;\nII. Asegurar, aislar, suspender o retirar temporalmente en forma parcial o total, según corresponda, los bienes, equipos y actividades que generen el riesgo o daño significativo;\nIII. Clausurar temporal o definitivamente, parcial o totalmente las instalaciones en que se manejen o se artículo, y\nIV. Suspender las actividades en tanto no se mitiguen los daños causados.\nLa autoridad correspondiente podrá solicitar el auxilio de la fuerza pública para ejecutar cualquiera de las acciones anteriores.\nARTÍCULO 70. Cuando se ordene alguna de las medidas de seguridad previstas en esta ley, se indicará al interesado, cuando proceda, las acciones que debe llevar a cabo para subsanar las irregularidades que motivaron la imposición de dichas medidas, así como los plazos para su realización, a fin de que una vez cumplidas éstas, se ordene el retiro de la medida de seguridad impuesta.\nCapítulo Tercero\nDe las Sanciones Administrativas\n(REFORMADO, P.O. 6 DE JUNIO DE 2008)\nARTÍCULO 71. Las violaciones a los preceptos de esta ley, sus reglamentos y las disposiciones que de ella emanen, serán sancionadas administrativamente por la Secretaría en los términos de la Ley del\nEquilibrio Ecológico y Protección al Ambiente del Estado y por las autoridades municipales en el ámbito de su competencia, considerándose además para su imposición que sean acordes con el daño ambiental ocasionado y con el beneficio económico obtenido por la violación a la legislación ambiental vigente.\nCapítulo Cuarto\nDe la Denuncia Popular\n(REFORMADO, P.O. 6 DE JUNIO DE 2008)\nARTÍCULO 72. Toda persona podrá denunciar ante la Secretaría o ante otras autoridades que resulten competentes todo hecho, acto u omisión que produzca o pueda producir desequilibrio ecológico o daños al ambiente o a los recursos naturales derivados del manejo inadecuado de los residuos, o contravenga con la misma.\nARTÍCULO 73. Para la presentación y trámite de la denuncia popular a que se refiere el artículo anterior, se estará a lo dispuesto por La Ley de Equilibrio Ecológico y la Protección al Ambiente del Estado.\nCapítulo Quinto\nDe la Reparación del Daño\nARTÍCULO 74. Se establece la responsabilidad solidaria, independiente de toda falta, de los generadores de residuos sólidos y operadores de instalaciones, por los daños y perjuicios que ocasione a los recursos\nLa exención de responsabilidad sólo se producirá acreditando que, a pesar de haberse adoptado todas instalaciones, los daños y perjuicios se produjeron por culpa exclusiva de la víctima o de un tercero por quien no se deba responder.\nARTÍCULO 75. Todo servidor público está obligado a denunciar ante la Secretaría o la Procuraduría cualquier alteración al ambiente de que tenga conocimiento en razón de su cargo. Los funcionarios responsabilidad solidaria en caso de omisión o incumplimiento de deberes, sin perjuicio de las responsabilidades que correspondan. Además serán proporcionalmente responsables por los daños causados al ambiente en el tanto que les sean imputables.\nARTÍCULO 76. La prescripción de las responsabilidades establecidas en este capítulo es de cinco años a partir de la realización del hecho.\nCapítulo Sexto\nDe la Información Pública\nARTÍCULO 77. La información obtenida por el Instituto y las autoridades municipales en el ejercicio de sus funciones, será pública en los términos de la Ley de Acceso a la Información Pública.\nARTICULO 78. Las autoridades estatales y municipales, en el ámbito de sus respectivas competencias, integrarán el Sistema de Información sobre la Gestión Integral de Residuos, que contendrá la información relativa a la situación local, los inventarios de residuos generados, la infraestructura disponible para su manejo, las disposiciones jurídicas aplicables a su regulación y control y otros aspectos que faciliten el logro de los objetivos de esta Ley y los ordenamientos que de ella deriven; de la Ley del Equilibrio\nEcológico y Protección al Ambiente del Estado; la Ley de Acceso a la Información Pública del Estado y demás disposiciones aplicables.\nARTICULO 79. Las autoridades estatales y municipales elaborarán y difundirán informes periódicos, sobre los aspectos relevantes contenidos en los sistemas de información a los que se hace referencia en el presente capítulo.\nARTICULO 80. Las autoridades estatales y municipales elaborarán, actualizarán y difundirán los inventarios de generación de residuos peligrosos, residuos sólidos urbanos y residuos de manejo especial, de acuerdo con sus atribuciones respectivas, para lo cual se basarán en los datos que les sean proporcionados por los generadores y las empresas de servicios de manejo de residuos, conforme a lo dispuesto en la presente Ley y en los ordenamientos jurídicos que de ella deriven.\nAdemás, integrarán inventarios de tiraderos de residuos o sitios donde se han abandonado clandestinamente residuos de diferente índole en cada entidad, en los cuales se asienten datos acerca de su ubicación, el origen, características y otros elementos de información que sean útiles a las autoridades, para desarrollar medidas tendientes a evitar o reducir riesgos. La integración de inventarios se sustentará en criterios, métodos y sistemas informáticos, previamente acordados, estandarizados y difundidos.\nCapítulo Séptimo\nDel Recurso de Revisión\nARTÍCULO 81. Las resoluciones definitivas dictadas en los procedimientos administrativos con motivo de la aplicación de esta ley, sus reglamentos y disposiciones que de ella emanen, podrán ser impugnadas por los afectados mediante el recurso de revisión, dentro de los quince días hábiles siguientes a la fecha de su notificación, directamente ante la autoridad que emitió la resolución impugnada. estará a lo dispuesto en la Ley del Equilibrio Ecológico y Protección al Ambiente del Estado.\nPRIMERO. El presente ordenamiento entrará en vigor a los noventa días naturales siguientes al de su\nSEGUNDO. El reglamento de la presente ley deberá ser expedido por el Gobernador del Estado en un plazo no mayor de ciento veinte días naturales, contados a partir de la entrada en vigor del presente decreto. En tanto se expide, continuarán vigentes las disposiciones jurídicas aplicables en lo que no se opongan a la presente ley.\nTERCERO. Los ayuntamientos deberán expedir sus reglamentos derivados de esta ley, en un plazo no mayor de ciento ochenta días naturales contados a partir de la entrada en vigor de esta ley.\nCUARTO. Todos los procedimientos y demás asuntos relacionados con las materias a que refiere esta ley, iniciados con anterioridad a la entrada en vigor al presente decreto, se tramitarán y resolverán conforme a las disposiciones vigentes en ese momento.\nQUINTO. EL Congreso del Estado realizara las adecuaciones a la Ley de Equilibrio Ecológico y la\nProtección al Ambiente del Estado de Coahuila en un plazo no mayor de 90 días a la publicación del presente decreto.\nSEXTO. En todo lo no previsto en la presente ley, se aplicarán en lo conducente y de manera supletoria las disposiciones contenidas en la Ley General para la Prevención y Gestión Integral de los Residuos, la\nLey del Equilibrio Ecológico y la Protección al Ambiente del Estado y demás disposiciones jurídicas aplicables.\nDADO en el Salón de Sesiones del Congreso del Estado, en la Ciudad de Saltillo, Coahuila, a los quince días del mes de noviembre del año dos mil cinco.\nDIPUTADA PRESIDENTA.\nMARÍA EUGENIA CÁZARES MARTÍNEZ.\nDIPUTADA SECRETARIA. DIPUTADO SECRETARIO.\nMARTHA LOERA ARÁMBULA. FRANCISCO ORTÍZ DEL CAMPO.\nIMPRÍMASE, COMUNÍQUESE Y OBSÉRVESE\nEL GOBERNADOR DEL ESTADO\nLIC. ENRIQUE MARTÍNEZ Y MARTÍNEZ\nEL SECRETARIO DE GOBIERNO\nLIC. JOSÉ ABRAHAM CEPEDA IZAGUIRRE\nEL SECRETARIO DE PLANEACIÓN Y DESARROLLO\nC.P. IGNACIO DIEGO MUÑOZ.\nN. DE E. A CONTINUACION SE TRANSCRIBEN LOS ARTICULOS TRANSITORIOS DE LOS DECRETOS DE\nREFORMAS A LA PRESENTE LEY.\nPRIMERO. El presente decreto entrará en vigor al día siguiente de su publicación en el Periódico Oficial del Gobierno del Estado.\nSEGUNDO. Se derogan todas las disposiciones legales y reglamentarias que se opongan al presente Decreto.",
  "ordenamiento": "REGLAMENTO",
  "jurisdiccion": "COAHUILA",
  "fuente_oficial": "DIARIO OFICIAL DE LA FEDERACION",
  "Fecha de Publicación": "2 de diciembre de 2005",
  "ULTIMA REFORMA PUBLICADA": "6 DE JUNIO DE 2008",
  "es_escaneado": false,
  "tiene_tablas": false,
  "materia": [
    "ambiental"
  ]
}