{
  "titulo": "Ley Que Establece las Bases y los Lineamientos Generales para la Recepción de las Aportaciones Feder",
  "Contenido": "federales, y la creación, distribución, aplicación y seguimiento de esos recursos en \"LOS FONDOS\nESTATALES PARA EL DESARROLLO SOCIAL EN COAHUILA\".\nEL C. ROGELIO MONTEMAYOR SEGUY, GOBERNADOR CONSTITUCIONAL DEL ESTADO\nINDEPENDIENTE, LIBRE Y SOBERANO DE COAHUILA DE ZARAGOZA, A SUS HABITANTES\nSABED:\nQUE EL CONGRESO DEL ESTADO INDEPENDIENTE, LIBRE Y SOBERANO DE COAHUILA DE\nZARAGOZA;\nLey que establece las bases y los lineamientos generales para la recepción de las aportaciones federales, y la creación, distribución, aplicación y seguimiento de esos recursos en \"LOS\nFONDOS ESTATALES PARA EL DESARROLLO SOCIAL EN COAHUILA\".\nCAPITULO I\nDISPOSICIONES GENERALES\nArtículo 1.- Las disposiciones de esta Ley, son de orden público e interés social y tendrán aplicación para las autoridades y servidores públicos Estatales y Municipales del Estado de Coahuila.\n(ADICIONADO, P.O. 21 DE FEBRERO DE 2003)\nPara los efectos de esta Ley se entiende por:\n(ADICIONADA, P.O. 21 DE FEBRERO DE 2003)\nI. Fondos Estatales: El Fondo Estatal para la Educación Básica y Normal; el Fondo Estatal para los Servicios de Salud; el Fondo Estatal de Aportaciones Múltiples; el Fondo Estatal para la\nEducación Tecnológica y de Adultos; el Fondo Estatal para la Seguridad Pública, y el Fondo\nEstatal para la Infraestructura Social.\n(ADICIONADA, P.O. 21 DE FEBRERO DE 2003)\nII. Fondos Municipales: El Fondo para la Infraestructura Social Municipal y el Fondo para el\nFortalecimiento de los Municipios.\n(ADICIONADA, P.O. 21 DE FEBRERO DE 2003)\nIII. COPLADEC: El Comité de Planeación para el Desarrollo del Estado de Coahuila, cuya crea.\nIV. COPLADEM: El Comité de Planeación para el Desarrollo Municipal que se regulará por las disposiciones conducentes del Código Municipal para Estado de Coahuila de Zaragoza.\nV. Contraloría Social: La participación de los ciudadanos que consiste en vigilar la aplicación de los fondos estatales, a cargo de la Secretaría de la Contraloría y Modernización\nAdministrativa, así como la que, para los Fondos de Infraestructura Social Municipal y el\nFortalecimiento de los Municipios, implementarán los Órganos Internos Municipales con el\nContaduría Mayor de Hacienda;\nVI. Vocal de Control y Vigilancia: La persona electa en el seno del COPLADEC, los COPLADEM, los Consejos de Desarrollo Municipales o de los Comités Comunitarios, que vigila la beneficio social.\nArtículo 2.- El Ejecutivo del Estado y los Republicanos Ayuntamientos de la Entidad, ejercerán las atribuciones contenidas en esta Ley por sí o a través de sus dependencias y organismos.\nArtículo 3.- La aplicación de esta Ley corresponde al Gobierno del Estado y a los Republicanos\nAyuntamientos, los que ejercerán sus atribuciones de manera propia, concurrente y coordinada en el ámbito de sus respectivas competencias.\nCAPITULO II\nDE LAS APORTACIONES FEDERALES\n(REFORMADO, P.O. 21 DE FEBRERO DE 2003)\nArtículo 4.- El Gobierno del Estado de Coahuila, a través del Ejecutivo del Estado, recibirá de la\nFederación dentro de los plazos convenidos las aportaciones federales que le corresponden a la\nEntidad, de conformidad con lo previsto en los artículos del 25 al 46 y demás aplicables de la Ley de Coordinación Fiscal de la Federación. Los Fondos Municipales, además se regularán conforme a lo previsto en los artículos del 12 al 18 y demás aplicables de la Ley para la Distribución de\nParticipaciones y Aportaciones Federales a los Municipios del Estado de Coahuila.\n(REFORMADO, P.O. 21 DE FEBRERO DE 2003)\nArtículo 5.- El Gobierno del Estado, a través del Ejecutivo Estatal, recibirá las aportaciones federales a que se refiere el presente capítulo para su administración, asignación, distribución y ejercicio, en su caso, así como para la supervisión y el control de su correcta aplicación. Tendrán el carácter de recursos estatales y, respecto de los fondos que reciba el Estado y entere a los\nMunicipios, serán ejercidos y administrados por éstos y tendrán el carácter de municipales.\nDeberán ser registrados en las cuentas públicas estatales y municipales, según corresponda a cada Fondo.\nCAPITULO III\n(REFORMADO, SU DENOMINACIÓN P.O. 21 DE FEBRERO DE 2003)\nDE LOS FONDOS ESTATALES Y MUNCIPALES\nArtículo 6.- Con los recursos de estas aportaciones, la Secretaría de Finanzas del Gobierno del\nEstado de Coahuila, constituirá seis Fondos Estatales y dos municipales para impulsar el desarrollo social del Estado de Coahuila, orientando el gasto de una manera equilibrada para la atención de las prioridades sociales.\nArtículo 7.- De conformidad y acorde a lo dispuesto en el Capítulo V de la Ley de Coordinación Fiscal de la Federación, se constituyen los Fondos Estatales y Municipales siguientes:\nI. Fondo Estatal para la Educación Básica y Normal;\nII. Fondo Estatal para los Servicios de Salud;\nIII. Fondo Estatal para la Infraestructura Social;\nIV. Fondo para la Infraestructura Social Municipal;\nV. Fondo para el Fortalecimiento de los Municipios;\nVI. Fondo Estatal de Aportaciones Múltiples;\nVII. Fondo Estatal para la Educación Tecnológica y de Adultos, y\nVIII. Fondo Estatal para la Seguridad Pública.\nArtículo 8.- La Secretaría de Finanzas del Gobierno del Estado y las Tesorerías Municipales, llevarán en cuenta bancaria productiva y específica los recursos de cada uno de los Fondos\nEstatales y Municipales, según corresponda.\n(REFORMADO, P.O. 21 DE FEBRERO DE 2003)\nArtículo 9.- La Secretaría de Finanzas del Gobierno del Estado enterará mensualmente, en los primeros diez meses del año y, distribuirá a los municipios de la Entidad, los recursos del Fondo para la Infraestructura Social Municipal y, mensualmente, durante el año, del Fondo para el\nFortalecimiento de los Municipios que les correspondan, de conformidad con los términos que se establecen en la presente Ley.\n(REFORMADO, P.O. 21 DE FEBRERO DE 2003)\nArtículo 10.- Los recursos correspondientes del Fondo para la Infraestructura Social Municipal y del Fondo para el Fortalecimiento de los Municipios, les serán entregados a la autoridad municipal sin reserva, de manera ágil y directa sin limitaciones ni restricciones incluyendo las de carácter administrativo, por lo que no podrán ser embargables, gravables, ni afectables en garantía, ni ser objeto de retención. Los Municipios de la Entidad dispondrán de los recursos que les correspondan de estos Fondos Municipales, de conformidad con el cumplimiento de la normatividad y los convenios aplicables a la materia, condicionando su gasto a la consecución y cumplimiento de los objetivos que para cada tipo de fondo corresponda y no podrán destinarlos a fines distintos de los previstos por esta ley y la Ley para la Distribución de Participaciones y\nAportaciones Federales a los Municipios del Estado de Coahuila.\n(REFORMADO, P.O. 21 DE FEBRERO DE 2003)\nArtículo 11.- Cuando los recursos de los Fondos Estatales y Municipales a que se refiere la presente Ley, se destinen a obras públicas, el Gobierno del Estado y los Municipios de la Entidad, presentarán ante las dependencias estatales normativas los expedientes técnicos para el efecto de su análisis y aprobación respectiva.\nArtículo 12.- El Ejecutivo del Estado anualmente, durante el primer trimestre del año, firmará con los Municipios Convenios de Alianza Coahuilense, a efecto de coordinar la ejecución de acciones\nFondos Municipales, que permitan llevar a cabo la política para el combate a la pobreza en el\nEstado e impulsar el desarrollo regional y social, así como para definir la corresponsabilidad de desarrollo social.\nCAPITULO IV calidad y la cobertura de la educación básica y normal en la Entidad, en cumplimiento a los compromisos establecidos en el Acuerdo Nacional para la Educación Básica y Normal, así como en la Ley General de\nEducación, en la Ley de Educación Pública del Estado y en las demás disposiciones aplicables. cobertura de los salarios y prestaciones de la plantilla del sector educativo del Estado, así como a incrementar la capacitación y actualización del magisterio.\nArtículo 15.- El Gobierno del Estado programará y ejercerá las partidas presupuestales derivadas del\nFondo Estatal para la Educación Básica y Normal, de acuerdo a las necesidades que en materia de educación sean prioritaria y conforme a los lineamientos de los órganos de planeación y educación del\nEstado.\nArtículo 16.- Las autoridades estatales responsables del ejercicio presupuestal, así como las educativas, en forma coordinada y de manera periódica, se reunirán con las autoridades federales del ramo, para informar sobre el ejercicio del gasto del sector educativo y para analizar fórmulas que permitan incrementar la equidad y la optimización de los recursos para los programas de educación pública en el\nEstado.\nArtículo 17.- Para la administración del Fondo Estatal para la Educación Básica y Normal, la Secretaría de Educación Pública del Estado ejercerá las atribuciones que le confiere la Ley Orgánica de la\nAdministración Pública del Estado, la Ley de Educación Pública del Estado y las demás disposiciones aplicables a la materia.\n(ADICIONADO, P.O. 21 DE FEBRERO DE 2003)\nCAPITULO V\nDEL FONDO ESTATAL PARA LOS SERVICIOS DE SALUD\nArtículo 18.- El Gobierno del Estado promoverá y establecerá los programas orientados a mejorar la calidad y la cobertura de los servicios de salud en la Entidad, especialmente en las zonas marginadas.\nAsimismo, buscará mejorar la eficiencia en la prestación de los servicios médicos que se llevan a cabo en clínicas y hospitales con el fin de lograr un mejor aprovechamiento de los recursos públicos, de conformidad con lo establecido en el Sistema Nacional de Salud y en la Ley General de Salud, así como en la Ley Estatal de la materia.\nArtículo 19.- El Gobierno del Estado promoverá un Sistema de Salud y Asistencia Social que beneficie a la población más desprotegida y que permita prestar estos servicios con mayor eficacia y equidad, para coadyuvar al mejoramiento constante del nivel de vida de la comunidad. y quirúrgico; así como a impulsar las acciones necesarias encaminadas a la prevención de enfermedades, con especial énfasis en la atención materno-infantil, en las campañas de planificación familiar y de vacunación; al igual que promover los programas institucionales destinados a la salud y desarrollo integral de la mujer.\nFondo Estatal para los Servicios de Salud, de acuerdo a las necesidades que en materia de salud sean prioritarias y conforme a los lineamientos de los órganos de planeación y salud del Estado.\nArtículo 21.- Las autoridades estatales responsables del ejercicio presupuestal, así como las de salud, en forma coordinada y de manera periódica, se reunirán con las autoridades federales del ramo, para equidad y la optimización de los recursos destinados a los programas de salud pública en el Estado.\nArtículo 22.- Para la administración del Fondo Estatal para los Servicios de Salud, la Secretaría de Salud\nAdministración Pública del Estado, la Ley Estatal de Salud y las demás disposiciones aplicables a la materia.\nCAPITULO VI\nDEL FONDO ESTATAL PARA LA INFRAESTRUCTURA SOCIAL\n(REFORMADO, P.O. 21 DE FEBRERO DE 2003)\nArtículo 23.- Los recursos del Fondo Estatal para la Infraestructura Social se destinarán preferentemente al financiamiento de obras, acciones sociales básicas e inversiones que tengan un alcance o ámbito regional o intermunicipal que beneficien directamente a sectores de la población que se encuentren en condiciones de rezago social y de pobreza extrema.\n(ADICIONADO, P.O. 21 DE FEBRERO DE 2003)\nArtículo 23-A.- La Secretaría de Finanzas del Gobierno del Estado ministrará los recursos conforme a la autorización que expidan el titular de la dependencia estatal competente y el\nCOPLADEC, conforme al calendario de enteros que la Federación haga a favor del Estado. Podrá aquélla afectarlos en su caso en fideicomisos.\nEstos recursos y los que recibiera de manera adicional y de rendimientos generados por la cuenta bancaria productiva, quedarán sujetos en cuanto a su administración y ejecución, a los fines establecidos en el artículo anterior.\n(ADICIONADO, P.O. 21 DE FEBRERO DE 2003)\nArtículo 23-B.- El Ejecutivo del Estado celebrará convenios con las dependencias federales, estatales y los Municipios para la ejecución de obras o acciones a realizar con los recursos del\nFondo Estatal para la Infraestructura Social, ya sea por administración directa o por contratos.\nLas dependencias y entidades ejecutoras, a través del procedimiento establecido para tal efecto, presentarán la documentación original a la Secretaría de Finanzas al solicitar el pago correspondiente y ésta tendrá bajo su responsabilidad el resguardo de la documentación original que deberá presentar a la Secretaría de la Contraloría y Modernización Administrativa o, en su caso, a la Contaduría Mayor de Hacienda, cuando éstas lo requieran.\nCuando la ejecución de las obras esté a cargo de las autoridades municipales, éstas serán responsables de su terminación y operación. En caso de que el ejecutor sea una dependencia o entidad estatal, el responsable será el titular de la misma.\nArtículo 23-C.- Para los efectos del refrendo, la entidad ejecutora identificará a más tardar el 15 de noviembre de cada año, las obras y acciones cuyo presupuesto asignado se estime que no será ejercido en el mismo año. Los recursos y sus rendimientos no ejercidos se ejercerán en el siguiente año. Las obras y acciones de los recursos refrendados deberán quedar concluidas a más tardar el último día del mes de marzo del año siguiente. mes de enero del año siguiente. Para la entrega y recepción de las obras y acciones, las participación que le corresponda a la Secretaría de la Contraloría y Modernización Administrativa.\nEn el caso de los recursos que se refrendan, se elaborará el cierre de ejercicio complementario a más tardar el último día hábil del mes de abril del siguiente año. recursos del Fondo Estatal para la Infraestructura Social del Estado, atendiendo\nDesarrollo de Coahuila. Para ello, se dará atención prioritaria a cubrir las necesidades de los municipios rurales de la Entidad.\nEl Comité de Planeación para el Desarrollo del Estado de Coahuila, en su condición de órgano de participación social, será responsable de analizar y seleccionar las obras a realizar con los recursos del Fondo Estatal para la Infraestructura Social del Estado.\n(ADICIONADO, P.O. 21 DE FEBRERO DE 2003)\nCAPITULO VII\nDEL FONDO PARA LA INFRAESTRUCTURA SOCIAL MUNICIPAL\n(REFORMADO, P.O. 21 DE FEBRERO DE 2003)\nArtículo 24.- Las autoridades municipales de la Entidad deberán destinar los recursos económicos del Fondo para la Infraestructura Social Municipal exclusivamente al financiamiento de obras, acciones sociales básicas e inversiones a los sectores de su población que se encuentren en condiciones de rezago social y de pobreza extrema, previamente autorizados por los COPLADEM.\n(REFORMADO, P.O. 21 DE FEBRERO DE 2003)\nArtículo 25.- Con los recursos económicos provenientes del Fondo para la Infraestructura Social, las autoridades municipales atenderán a los fines establecidos en el artículo 12 de la Ley para la\nDistribución de Participaciones y Aportaciones Federales a los Municipios del Estado de Coahuila.\nArtículo 26.- El Gobierno del Estado y los Municipios de la Entidad, a través de sus órganos de planeación y participación social (COPLADEC Y COPLADEM), garantizarán la coordinación y complementariedad de la aplicación de los recursos del Fondo Estatal de Infraestructura Social, a efecto de lograr un uso eficiente y racional de los recursos de este Fondo.\n(REFORMADO, P.O. 21 DE FEBRERO DE 2003)\nArtículo 27.- Las obras y acciones que se realicen con los recursos del Fondo a que se refiere este capítulo, deberán ser compatibles con la preservación y protección del medio ambiente e impulsar el desarrollo sustentable. La dependencia estatal competente informará conforme al artículo 15, Municipios del Estado de Coahuila.\nArtículo 28.- Se deroga\nArtículo 29.- Los municipios de la Entidad, a través de sus dependencias y organismos, ejercerán los recursos del Fondo Estatal para la Infraestructura Social Municipal, atendiendo exclusivamente la apertura programática descrita en el artículo 24 de esta Ley. propuestas de las organizaciones sociales representativas por localidad, para asignar prioridades y conformar un programa de inversión. mensualmente entre los municipios de la Entidad, en los primeros diez meses del año correspondiente, los recursos económicos del Fondo Estatal para la Infraestructura Social\nMunicipal. Estos recursos se asignarán a los municipios de la Entidad de conformidad con la formula de distribución estatal que se determine, la cual se definirá de acuerdo a lo establecido en\nSocial del Gobierno Federal. Esta fórmula y los montos asignados a los municipios de la Entidad se publicarán en el Periódico Oficial del Gobierno del Estado.\n(REFORMADO, P.O. 21 DE FEBRERO DE 2003)\nArtículo 31.- La Secretaría de Finanzas del Gobierno del Estado de Coahuila, así como las\nTesorerías Municipales de la Entidad, llevarán en cuenta aparte los recursos económicos del\nFondo Estatal para la Infraestructura Social y los Fondos Municipales, respectivamente.\n(REFORMADO, P.O. 21 DE FEBRERO DE 2003)\nArtículo 32.- Para los efectos de la celebración de convenios, integración y resguardo de la documentación comprobatoria, refrendos, entrega y recepción de las obras y acciones, las autoridades municipales, en el ámbito de su competencia, se sujetarán en lo conducente a las disposiciones previstas en los artículos 23-B y 23-C de esta Ley, con la participación que le corresponda al Órgano de Control Interno Municipal y a la Contaduría Mayor de Hacienda.\n(REFORMADO, P.O. 21 DE FEBRERO DE 2003)\nArtículo 33.- El Comité de Planeación para el Desarrollo del Estado de Coahuila, apoyado por el área técnica correspondiente de la Secretaría de Planeación y Desarrollo, aprobará mediante oficio los recursos económicos para financiar las propuestas municipales del Fondo Estatal para la Infraestructura Social Municipal, en función del cumplimiento de la normatividad y los convenios aplicables a esta materia.\nArtículo 34.- Los municipios del Estado podrán disponer de hasta un 2% del total de los recursos del\nFondo Estatal para la Infraestructura Social Municipal que les correspondan, para la realización de programas de Desarrollo Institucional, previo convenio con los Gobiernos Federal y Estatal.\n(REFORMADO, P.O. 21 DE FEBRERO DE 2003)\nArtículo 35.- Para los efectos de dar cumplimiento al artículo 46 de la Ley de Coordinación Fiscal de la Federación, el Ejecutivo del Estado instrumentará la normatividad correspondiente a través del Manual de Operación del Fondo Estatal para la Infraestructura Social Municipal, convenios y demás disposiciones en donde se precise la competencia de las diversas instancias operativas, al igual que los mecanismos y los procedimientos de ejecución, supervisión y vigilancia que infraestructura Social Municipal.\nCAPITULO VIII\nDEL FONDO PARA EL FORTALECIMIENTO DE LOS MUNICIPIOS.\nArtículo 36.- El objetivo del Fondo Estatal para el Fortalecimiento de los Municipios es el de impulsar de manera proritaria las Haciendas Públicas Municipales, así como elevar el bienestar de la población al contribuir en mejorar las condiciones de seguridad pública, además de atender otros requerimientos municipales. entre los municipios de la Entidad, los recursos del Fondo Estatal para el Funcionamiento de los\nMunicipios, de conformidad al número de sus habitantes.\nArtículo 38.- Con el propósito de definir el número de habitantes de los municipios de la Entidad, para efectos de realizar la distribución de recursos del Fondo Estatal para el Fortalecimiento de los Municipios, Estadística, Geografía e Informática, y de esta manera dar cumplimiento con el diverso 38 de la Ley de\nCoordinación Fiscal de la Federación.\nArtículo 39.- Los Municipios del Estado de Coahuila deberán destinar los recursos económicos del\nFondo para el Fortalecimiento de los Municipios, prioritariamente para:\nI.- Cumplir con sus obligaciones financieras, dando prioridad al servicio de las deudas bancarias y a los pasivos con proveedores, así como a los programas derivados de las prestaciones sociales de los trabajadores municipales.\n(REFORMADA PRIMER PARRAFO, P.O. 21 DE FEBRERO DE 2003)\nII.- Financiar programas de ampliación y mejoramiento de los servicios preventivos de seguridad pública de los Municipios. Para tal efecto, las autoridades municipales elaborarán programas con la asesoría de los Consejos Municipales de Seguridad Pública, estableciéndose los montos de asignación de los Fondos que les correspondan, que orientarán a estos programas.\nLos programas preventivos de seguridad pública municipal, incluyen la cobertura de: salarios derivados de nuevas plazas; comisiones y estímulos; nuevas presentaciones sociales; entrenamiento y capacitación; así como la adquisición de equipamiento y materiales que sean inherentes para el desempeño de esta función, tales como: uniformes, vehículos, aparatos de telecomunicación, y equipo para protección y seguridad, entre otros.\n(ADICIONADA, P.O. 21 DE FEBRERO DE 2003)\nIII. Obras públicas municipales, siempre que existieren recursos suficientes una vez cubiertos los renglones financiero y de seguridad pública a que se refiere este artículo.\nArtículo 40.- Una vez que los municipios de la Entidad hayan cubierto satisfactoriamente los programas descritos en el artículo anterior, en el caso de existir recursos remanentes del Fondo Estatal para el\nFortalecimiento de los Municipios, éstos deberán ser destinados para cubrir requerimientos orientados a la prestación de servicios públicos, así como a los programas de inversión referentes al mejoramiento de la infraestructura urbana, de la vialidad y de espacios educativos.\nLas organizaciones sociales existentes, relacionadas con la inversión de que se trate, participarán con el\nAyuntamiento en la definición de las prioridades de los programas de inversión, a atender con los recursos remanentes del Fondo Estatal para el Fortalecimiento de los Municipios.\n(REFORMADO, P.O. 21 DE FEBRERO DE 2003)\nArtículo 41.- Para los efectos de dar cumplimiento al artículo 46 de la Ley de Coordinación Fiscal, las diversas instancias operativas, al igual que los mecanismos y los procedimientos de ejecución. Corresponderá la supervisión y vigilancia a los Órganos de Control Interno\nMunicipales.\nArtículo 42.- El Congreso del Estado aprobará a cada uno de los Municipios de la Entidad los municipales, en donde se deberá describir y desglosar el programa financiero de conformidad a\nFinanciero para los Municipios, que realicen los municipios con los recursos provenientes de este\nFondo Municipal.\nArtículo 43.- El Fideicomiso de Seguridad Pública del Estado podrá apoyar a los Municipios de la\nEntidad, mediante solicitud de la autoridad municipal, con comodatos y donaciones de bienes en especie del Fondo Estatal para la Seguridad Pública, con el propósito de complementar eficientemente los programas estatal y municipales en esta materia, en donde se deberá precisar, en su caso, las cesiones de derechos o la modalidad del contrato a favor de los Municipios.\n(REFORMADO, P.O. 21 DE FEBRERO DE 2003)\nCAPITULO IX\nDEL FONDO ESTATAL DE APORTACIONES MULTIPLES\nArtículo 44.- El Gobierno del Estado destinará y ejercerá los recursos del Fondo Estatal de Aportaciones\nMúltiples, a los programas de asistencia social en apoyo a la población en desamparo, así como al fortalecimiento de la infraestructura educativa pública básica y superior.\nArtículo 45.- El Gobierno del Estado, a través de sus dependencias y organismos, instrumentará con los recursos del Fondo Estatal de Aportaciones Múltiples, las acciones necesarias para destinarlos exclusivamente a cubrir los conceptos siguientes:\nA) Apoyos alimentarios y de asistencia social, a la población en condiciones de pobreza extrema, dando prioridad a la que se encuentre en edad escolar.\nB) Apoyos a la población en desamparo.\nC) A la construcción y equipamiento de infraestructura física de los niveles de educación básica y superior.\nArtículo 46.- De conformidad con el Sistema Nacional de Asistencia Social, y atendiendo a las prioridades establecidas en el Plan Estatal de Desarrollo de Coahuila, el Gobierno del Estado promoverá y establecerá los programas encaminados a mejorar la calidad y la cobertura de los servicios de la asistencia social en la Entidad, con especial atención a las zonas marginadas, así como instrumentará las acciones necesarias que garanticen la concurrencia y la colaboración institucional con las autoridades municipales y las organizaciones de asistencia social de la Entidad.\nArtículo 47.- El Gobierno del Estado programará y ejercerá los recursos del Fondo Estatal de\nAportaciones Múltiples que se destinen a implementar acciones orientadas a la construcción y al equipamiento de la infraestructura física educativa de carácter pública de los niveles básico y superior, mismo propósito.\nCAPITULO X\nArtículo 48.- El Ejecutivo del Estado promoverá programas orientados a mejorar la calidad y la cobertura de la educación tecnológica y de adultos, en cumplimiento a los Convenios de\nCoordinación suscritos con el Ejecutivo Federal para dicho efecto y, conforme a la distribución que señala la Ley de Coordinación Fiscal, se ejercerán para los fines previstos. rezago en materia de alfabetización, educación básica y formación para el trabajo, mismos que se ejercerán conforme a los convenios que se suscriban con la Federación.\nArtículo 48-A.- El Ejecutivo del Estado destinará, programará y ejercerá las partidas presupuestales derivadas del Fondo Estatal para la Educación Tecnológica y de Adultos, a los recursos humanos, materiales y financieros necesarios para elevar la calidad en los servicios de educación tecnológica y de adultos en Coahuila, así como a programas y acciones definidas por el COPLADEC, que permitan mantener, incrementar y mejorar la infraestructura de los recursos humanos, materiales, financieros y de equipamiento para alcanzar los propósitos señalados\nLa Secretaría de Educación Pública, los Organismos Descentralizados de Educación Tecnológica y el Instituto Estatal de Educación de Adultos ejercerán los recursos orientados a las obras y acciones mediante los procedimientos normativos de supervisión y control establecidos por el\nGobierno del Estado y a los previstos en los Convenios específicos suscritos o que se suscriban con el Gobierno Federal, conforme a las atribuciones que les confieran la Ley Orgánica de la\nAdministración Pública Estatal, la Ley de Educación Pública del Estado, los Reglamentos, Acuerdos y Decretos y demás disposiciones aplicables en materia de educación tecnológica y de educación para adultos.\n(ADICIONADO, P.O. 21 DE FEBRERO DE 2003)\nCAPITULO XI\nDEL FONDO ESTATAL PARA LA SEGURIDAD PÚBLICA\n(REFORMADO, P.O. 21 DE FEBRERO DE 2003)\nArtículo 49.- Los recursos del Fondo Estatal para la Seguridad Pública que sean determinados y distribuidos por la Federación, conforme a lo dispuesto por la Ley de Coordinación Fiscal, serán recibidos durante los primeros diez meses del año correspondiente, y depositados en cuenta bancaria productiva y específica, de manera ágil y directa, sin más limitaciones ni restricciones, incluyendo aquellas de carácter administrativo, a favor del Fideicomiso de Seguridad Pública del\nEstado de Coahuila y se ejercerán por su Comité Técnico y, en su caso, los recursos que no se ejerzan y sus rendimientos generados al 15 de diciembre del año del ejercicio presupuestario correspondiente, podrán ser refrendados en esa misma fecha por un Acuerdo que emitirá el\nComité Técnico del Fideicomiso de Seguridad Pública, debiéndose destinar exclusivamente para:\nI. Reclutar, seleccionar, depurar, evaluar y formar los recursos humanos vinculados con tareas de seguridad pública;\nII. Complementar las dotaciones de los Agentes del Ministerio Público, los policías judiciales o sus equivalentes y los peritos de la Procuraduría General de Justicia del Estado, de los infractores;\nIII. Equipar a las policías preventivas y ministeriales o sus equivalentes, a los peritos, los ministerios públicos y custodios de centros penitenciarios y de menores infractores;\nIV. Establecer y operar la red nacional de telecomunicaciones e informática para la seguridad pública y el servicio de telefonía nacional de emergencia;\nV. Construir, mejorar o ampliar las instalaciones e infraestructura para la procuración e impartición de justicia, de los centros de readaptación social y de menores infractores, así como las instalaciones de los cuerpos de seguridad pública y sus centros de capacitación; y\nVI. Dar seguimiento y evaluar los programas señalados en las fracciones que anteceden.\nEstado y la dependencia correspondiente del Ejecutivo Federal.\nArtículo 49-A.- La aplicación de los recursos que integran este Fondo se realizará conforme a los\nProgramas Estatales de Seguridad Pública, mediante acciones y obras que se autoricen en el seno del Comité Técnico del Fideicomiso de Seguridad Pública del Estado de Coahuila, de conformidad con las disposiciones de la Ley General que establece las bases de Coordinación del\nSistema Nacional de Seguridad Pública, así como de la Ley de Seguridad Pública del Estado de\nCoahuila y sus reglamentos, los acuerdos, resoluciones, convenios y anexos específicos que al respecto emita o, en su caso, suscriban la dependencia correspondiente del Ejecutivo Federal y el\nEstado.\n(ADICIONADO, P.O. 21 DE FEBRERO DE 2003)\nArtículo 49-B.- El Gobierno del Estado, por conducto de la Secretaría de Gobierno y de la\nSecretaría de Seguridad Pública y Protección Ciudadana, podrá proporcionar al Gobierno Federal, a través de la dependencia correspondiente del Ejecutivo Federal, la información financiera, operativa y estadística relativa a la administración del Fondo Estatal para la Seguridad Pública.\n(ADICIONADO, P.O. 21 DE FEBRERO DE 2003)\nCAPITULO XII\nDE LA CONTRALORÍA SOCIAL Y DE LA COORDINACIÓN INTERGUBERNAMENTAL\n(REFORMADO, P.O. 21 DE FEBRERO DE 2003)\nArtículo 50.- Para la definición, aplicación, ejercicio y vigilancia de los recursos provenientes de los Fondos Estatales y de los Fondos Municipales, las autoridades estatal y municipales integrarán y tomarán en cuenta la participación ciudadana y de las organizaciones sociales, específicamente de sus comités de planeación para el desarrollo, tanto estatal como municipales, de los Comités Comunitarios, Contraloría Social y la designación de los miembros que asumirán el cargo de Vocales de Control y Vigilancia en dichas organizaciones. Los fondos se estarán a lo previsto por los Convenios a que refiere el artículo 12 y demás disposiciones de la presente Ley.\nLos Órganos de Control Interno Municipales promoverán, establecerán e impulsarán la Contraloría\nSocial a través de la expresión, organización y participación activa de los ciudadanos y grupos sociales organizados en las labores de inspección y vigilancia de los Fondos Municipales a que refiere esta Ley, mediante la capacitación y asistencia técnica de la Secretaría de la Contraloría y\nModernización Administrativa y de la Contaduría Mayor de Hacienda, y según corresponda, Social, apoyando y promoviendo la participación comunitaria e impartirán cursos para la formación de los Vocales de Control y Vigilancia y atenderán, tramitarán y resolverán las quejas y denuncias presentadas dentro del Sistema Estatal y Municipal de Quejas y Denuncias.\nEn las obras o acciones de los Fondos Estatales a que refiere esta Ley, la Secretaría de la impartirá la capacitación, apoyo y orientación a la ciudadanía y organizaciones sociales, en las labores de inspección y vigilancia de los programas y acciones que se deriven de dichos fondos.\nArtículo 51.- Las autoridades estatales y municipales impulsaran la Contraloría Social, en pobreza. Corresponderá a los municipios promover la integración de las organizaciones sociales, través de la Secretaría de la Contraloría y Modernización Administrativa, corresponderá capacitar, asesorar y supervisar a los Vocales de Control y Vigilancia de la Contraloría Social.\nArtículo 52.- Estas organizaciones sociales deberán seguir participando en la definición de las prioridades a atender, así como en la integración de propuestas y en la vigilancia social de la operación de los programas de obras y servicios derivados de los Fondos Estatales y de los\nFondos Municipales para el Desarrollo Social de Coahuila, descritos en la presente Ley.\n(REFORMADO, P.O. 21 DE FEBRERO DE 2003)\nArtículo 53.- La coordinación entre el Estado y los Municipios de la Entidad, tendrá como propósito fundamental estimular el desarrollo equilibrado e integral de las comunidades con base en una amplia participación social, así como instrumentar, en el marco de las atribuciones del\nCOPLADEC y los COPLADEM, en el ámbito de sus respectivas competencias, la concurrencia y la complementariedad de acciones para ejercer los recursos de los Fondos Estatales y de los\nFondos Municipales descritos en la presente Ley, de una manera racional y eficiente para evitar duplicidades en el gasto y procurar beneficios en el desarrollo regional comunitario acorde a los\nConvenios de Alianza Coahuilense.\n(REFORMADO, P.O. 21 DE FEBRERO DE 2003)\nArtículo 54.- Para los efectos del artículo anterior, el Estado se apoyará en el Comité de\nPlaneación para el Desarrollo del Estado, como instancia democrática y de participación social encargada de planear, discutir, analizar y definir las obras y acciones a realizar con los recursos de los Fondos Estatales enunciados en esta Ley.\nLos municipios de la entidad, así mismo, se apoyarán en los Comités de Planeación para el\nDesarrollo Municipal, como instancias democráticas y de participación social encargadas de planear, discutir, analizar y definir las obras y acciones a realizar con los recursos de los Fondos\nMunicipales, en congruencia con los Planes Nacional, Estatal y Municipales de Desarrollo.\n(REFORMADO, P.O. 21 DE FEBRERO DE 2003)\nArtículo 55.- El Estado y los Municipios de la Entidad deberán hacer del conocimiento oportuno de sus habitantes, a través de medios de comunicación y electrónicos, los montos del Fondo Estatal de Infraestructura Social y de los Fondos Municipales a ejercer respectivamente, al igual que las obras y acciones a realizar, el costo de cada una de ellas, su ubicación y el número de beneficiarios; promoverán la participación de las comunidades en su destino, aplicación y vigilancia, e impulsarán y fortalecerán la Contraloría Social.\n(REFORMADO, P.O. 21 DE FEBRERO DE 2003)\nArtículo 56.- De igual forma, el Estado y los Municipios de la Entidad al término de cada ejercicio, informarán a la comunidad sobre los resultados y las metas alcanzadas, procurando que las obras desarrollo sustentable. referencia el artículo 12 de la presente Ley, con cada una de los Municipios de la Entidad dentro de los primeros tres meses de cada año.\nArtículo 58.- Para efectos de asegurar la coordinación de acciones y la complementariedad de que se destinen a los espacios educativos y de salud, las autoridades Estatales y Municipales construcción de espacios y de competencia municipal su mantenimiento y rehabilitación.\nCAPITULO XIII\nDE LA SUPERVISIÓN Y CONTROL erogación total, corresponderá a la Secretaría de la Contraloría y Modernización Administrativa del\nGobierno del Estado, el control, supervisión y vigilancia de dichos Fondos. De igual manera, corresponderá a los Órganos de Control Interno Municipales el seguimiento, supervisión, control y vigilancia de los Fondos Municipales que se entreguen y reciban los Gobiernos de los\nMunicipios.\nLa supervisión y vigilancia no podrán implicar limitaciones ni restricciones de cualquier índole, en la administración y ejercicio de dichos fondos. Así mismo, la Secretaría de Finanzas entregará a la\nSecretaría de la Contraloría y Modernización Administrativa el 2 al millar del monto total de cada uno de los Fondos Estatales, conforme a las ministraciones que se reciban por parte de la\nFederación, por concepto de los servicios de inspección, vigilancia, control y supervisión; por el mismo concepto, las Tesorerías Municipales entregarán a su Órgano de Control Interno Municipal, el 2 al millar del monto total de cada uno de los Fondos Municipales.\nLa Secretaría de la Contraloría y Modernización Administrativa y los Órganos de Control Interno\nMunicipales, en el ámbito de sus respectivas competencias, fincarán las responsabilidades administrativas, civiles y penales que correspondan, en su caso, conforme a las leyes estatales, ya sea como resultado de sus actuaciones propias o de las solicitudes efectuadas por las\nAutoridades Federales competentes.\nLa Contaduría Mayor de Hacienda del Congreso del Estado podrá fincar las responsabilidades antes mencionadas, derivadas de los resultados de sus procesos de fiscalización de las Cuentas\nPúblicas Estatales o Municipales, o a solicitud de las Autoridades Federales competentes.\n(REFORMADO, P.O. 21 DE FEBRERO DE 2003)\nArtículo 60.- En los términos y plazos de ley, el Gobierno del Estado y los Ayuntamientos de la\nEntidad remitirán al Congreso del Estado la documentación comprobatoria respectiva del ejercicio de los recursos de los Fondos Estatales y de los Fondos Municipales descritos en la presente Ley, la cual formará parte integrante de las Cuentas Públicas Estatales y Municipales respectivas.\nLa fiscalización de las cuentas públicas del Gobierno del Estado y de los Municipios será efectuada por el Congreso del Estado, a través de la Contaduría Mayor de Hacienda, conforme a los ordenamientos aplicables, a fin de verificar que las dependencias y entidades estatales y municipales respectivamente, aplicaron los recursos de los Fondos a los fines previstos en esta\nLey.\nCuando las autoridades de control y supervisión interna del Estado y Municipales, que en no han sido aplicados a los fines que para cada Fondo se señalan en esta Ley, deberán hacerlo\nMayor de Hacienda del Congreso del Estado en forma inmediata.\nArtículo 61.- En la administración y aplicación de los recursos de los Fondos Estatales y deberán observar las disposiciones contenidas en esta Ley, así como en las leyes estatales en materia de obras públicas y de adquisiciones, arrendamientos y contratación de servicios, al igual que en la Ley Reglamentaria del Presupuesto de Egresos del Estado, en lo conducente.\nArtículo 62.- Cuando los recursos de los Fondos Estatales y Municipales descritos en la presente\nEntidad presentarán ante las dependencias competentes, los expedientes técnicos de las obras aprobadas; debiendo sujetarse además de lo dispuesto en el artículo anterior, a la normatividad, supervisión técnica y asesoría que, para tales efectos, emitan dichas dependencias.\n(REFORMADO, P.O. 21 DE FEBRERO DE 2003)\nArtículo 63.- El Gobierno del Estado podrán destinar hasta un 3% de los recursos correspondientes al Fondo Estatal de Infraestructura Social para ser aplicados como gastos indirectos a las obras por concepto de planeación y programación; elaboración de proyectos; supervisión y control de obras; gastos administrativos relacionados con la ejecución de obras; y apoyo a los programas de Contraloría Social. De igual manera los Municipios podrán disponer el equivalente de hasta el 3% del Fondo de Infraestructura Social Municipal que le sean asignados para cubrir los conceptos descritos en este artículo.\n(ADICIONADO, P.O. 21 DE FEBRERO DE 2003)\nCAPITULO XIV\nDE LAS RESPONSABILIDADES Y SANCIONES\n(ADICIONADO, P.O. 21 DE FEBRERO DE 2003)\nArtículo 64.- Las responsabilidades administrativas, civiles y penales en que incurran los servidores públicos, estatales y municipales, en el ejercicio y aplicación de los Fondos a que se refiere esta Ley, serán sancionados en los términos del artículo 46 de la Ley de Coordinación\nFiscal y demás disposiciones aplicables.\nArtículo Primero.- Esta Ley entrará en vigor el día siguiente de su publicación en el Periódico Oficial del\nEstado.\nArtículo Segundo.- Los recursos económicos que se destinen al Programa de Estímulos a la Educación\nBásica de 1998, que se señala en el Artículo 24, de esta Ley, deberán asegurar al menos el número de beneficiarios atendidos en 1997 y se fincarán con recursos provenientes del Fondo Estatal para la cubrir este Programa.\nArtículo Tercero.- Los municipios del Estado participarán con el 70% de la recaudación que se obtenga como resultado de actos de verificación de las autoridades municipales, en los términos de los Convenios de Colaboración Administrativa en Materia Fiscal Federal y con sus municipios. Dicha participación se liquidará en los términos del artículo 3-B de la Ley de Coordinación Fiscal. Los recursos provenientes de esta recaudación deberán ser integrados al Fondo Estatal para la Infraestructura Social Municipal, aplicables.\nArtículo Cuarto.- Por lo menos el 50% del Fondo Estatal para la Infraestructura Social Estatal, se asignará en 1998, para aquellos municipios que vieron disminuidas sus aportaciones en el Fondo Estatal para la Infraestructura Social Municipal, con relación a 1997, proveniente del Fondo de Desarrollo Social\nMunicipal. Estos recursos se adicionarán, para el mismo propósito, al fondo de contingencia previsto en el\nFederales a los municipios del Estado de Coahuila. La distribución a estos municipios, se hará en forma\nDADO en el Salón de Sesiones del Congreso del Estado, en la ciudad de Saltillo, Coahuila, a los cuatro días del mes de febrero de mil novecientos noventa y ocho.\nDIPUTADO PRESIDENTE\nANTONIO BERCHELMANN ARIZPE\nRUBRICA\nDIPUTADO SECRETARIO DIPUTADO SECRETARIO\nSERGIO RESENDIZ BOONE TRINIDAD MORALES VARGAS\nRUBRICA RUBRICA\nIMPRIMASE, COMUNIQUESE Y OBSERVESE.\nSaltillo, Coahuila, 6 de febrero de 1998\nEL GOBERNADOR DEL ESTADO\nROGELIO MONTEMAYOR SEGUY\nRUBRICA\nEL SECRETARIO DE GOBIERNO EL SECRETARIO DE FINANZAS\nLIC. CARLOS JUARISTI SEPTIEN LIC. ANTONIO JUAN MARCOS ISSA\nRUBRICA RUBRICA\nEL SECRETARIO DE DESARROLLO EL SECRETARIO DE FOMENTO\nSOCIAL ECONOMICO\nLIC. ROGELIO RAMOS ORANDAY ING. JOSE A. MURRA GIACOMAN\nRUBRICA RUBRICA\nN. DE E. A CONTINUACION SE TRANSCRIBEN LOS ARTICULOS TRANSITORIOS DE LOS\nDECRETOS DE REFORMAS A LA PRESENTE LEY.\nPrimero. El presente Decreto entrará en vigor el día siguiente de su publicación en el Periódico\nOficial del Estado.\nSegundo. Se derogan todas las disposiciones que se opongan a este Decreto.",
  "ordenamiento": "REGLAMENTO",
  "jurisdiccion": "COAHUILA",
  "fuente_oficial": "DIARIO OFICIAL DE LA FEDERACION",
  "Fecha de Publicación": "10 de febrero de 1998",
  "ULTIMA REFORMA PUBLICADA": "21 DE FEBRERO DE 2003",
  "es_escaneado": false,
  "tiene_tablas": false,
  "materia": [
    "general"
  ]
}