{
  "titulo": "Ley de Procuración de Justicia del Estado de Coahuila de Zaragoza",
  "Contenido": "LEY DE PROCURACIÓN DE JUSTICIA DEL ESTADO DE COAHUILA DE ZARAGOZA.\nEL C. HUMBERTO MOREIRA VALDÉS, GOBERNADOR CONSTITUCIONAL DEL ESTADO INDEPENDIENTE,\nQUE EL CONGRESO DEL ESTADO INDEPENDIENTE, LIBRE Y SOBERANO DE COAHUILA DE ZARAGOZA;\nDECRETA:\nNÚMERO 512.LEY DE PROCURACIÓN DE JUSTICIA DEL ESTADO DE COAHUILA DE ZARAGOZA.\nTÍTULO PRELIMINAR.\nDISPOSICIONES GENERALES.\nARTÍCULO 1. OBJETO.- La presente Ley es de orden público e interés general y tiene por objeto organizar al\nMinisterio Público, establecer sus atribuciones generales y normar su actividad en la investigación de los hechos posiblemente constitutivos de delitos como fase preparatoria de la acción penal y, en su caso, como presupuesto para definir la existencia del interés social en su persecución.\nARTÍCULO 2.- AMBITO DE APLICACIÓN.- Esta Ley se aplicará por los delitos que sean competencia de las\nAutoridades del Estado conforme a las reglas establecidas en el Código Penal.\nARTÍCULO 3.- OBLIGATORIEDAD.- Sus disposiciones son obligatorias para el Ministerio Público, sus auxiliares y apoyos jurídicos, administrativos y técnicos; y deberán ser observadas, en cuanto a los deberes que impongan y facultades que concedan, por los Tribunales, Autoridades, Organismos y Dependencias establecidos en el Estado; así como por las personas físicas y morales que en él residan o transiten.\nLos Tribunales del Estado, además, aplicarán y atenderán a la presente Ley por cuanto a los actos realizados por el\nMinisterio Público bajo el imperio de la misma.\nARTÍCULO 4.- INTERPRETACIÓN Y APLICACIÓN.- La presente Ley deberá aplicarse e interpretarse en armonía con sus principios rectores, conforme a las garantías individuales, a las normas constitucionales relativas a la función\nCuando la Ley no señale un procedimiento especial o una forma determinada para la realización de un acto, serán admisibles y válidas todas aquellas formas que resulten adecuadas para lograr los fines del mismo, siempre que no se contrapongan a sus disposiciones.\nARTÍCULO 5.- GLOSARIO.- Salvo mención expresa, para los efectos, aplicación e interpretación de esta Ley se entiende por:\nAgente. El Agente del Ministerio Público.\nCódigo de Procedimientos Penales. El Código de Procedimientos Penales vigente en el Estado.\nConstitución. La Constitución Política de los Estados Unidos Mexicanos.\nConvenios de colaboración. Los Convenios celebrados por la Fiscalía General del Estado con otra u otras\nProcuradurías de otros Estados o con la Procuraduría General de la República.\nCoordinador. El Coordinador de Agentes del Ministerio Público.\nDelegado. El Delegado del Ministerio Público o el funcionario a cargo de las Delegaciones Regionales de la Fiscalía\nGeneral del Estado.\nDiligencia. Cualquier actuación practicada en Averiguación Previa.\nMinisterio Público. El funcionario que tenga el carácter de Agente del Ministerio Público, independientemente de su jerarquía o denominación; o la institución misma que ejerce dicha función.\nPolicía. Las Corporaciones Policiales Federales, Estatales y Municipales o los agentes que formen parte de ellas.\n(REFORMADO, P.O. 12 DE MAYO DE 2009)\nFiscal General. El Fiscal General del Estado.\n(REFORMADO, P.O. 12 DE MAYO DE 2009)\nFiscalía General. La Fiscalía General del Estado.\n(REFORMADO, P.O. 12 DE MAYO DE 2009)\nServicios Periciales. La Dependencia de la Fiscalía General del Estado que tenga a su cargo lo relativo al servicio pericial.\nARTÍCULO 6.- PRINCIPIOS RECTORES. Son principios rectores de la presente Ley los siguientes:\nA. En lo referente a las atribuciones del Ministerio Público:\nI. UNIDAD. El Ministerio Público constituye una unidad colectiva, por lo que sus agentes actúan representando en cada uno de sus actos el interés exclusivo y único de la institución. actuación de sus similares, independientemente de su jerarquía, particularidades de su nombramiento o funciones específicamente encomendadas.\nII. INDIVISIBLILIDAD. Como unidad colectiva, el Ministerio Público, no obstante la pluralidad de agentes que lo conforman, posee indivisibilidad de funciones. Cada uno de sus agentes puede sustituirse en cualquier momento por otro, sin que sea necesario el cumplimiento de formalidades y sin que se afecte la validez de lo actuado por cualquiera de ellos. esta y otras leyes para la investigación de los delitos y para su persecución ante los Tribunales; salvo las que expresamente se encuentren reservadas para órganos o funcionarios específicos.\nSin perjuicio de lo anterior el titular de la dependencia, por cualquier medio, podrá establecer limitantes a las facultades y deberes otorgados al personal que conforma la Institución, las que únicamente tendrán efectos para la determinación de responsabilidades individuales; por lo que, en su caso, no podrán ser invocadas para afectar la validez del acto realizado en contravención a las mismas.\nIII. INDEPENDENCIA. Los Agentes del Ministerio Público serán autónomos en su decisión sobre casos concretos, sin perjuicio de los mecanismos de revisión, supervisión, atracción y control jerárquico que establezca la Ley.\nAgente a quien se dirigen no se oponga a las mismas o, en caso de oposición, a que se le comuniquen por escrito y en forma razonada.\nIV. JERARQUÍA. El Ministerio Público constituye una estructura jerarquizada en la que cada superior controla el desempeño de quienes le asisten y es responsable por la gestión de los funcionarios a su cargo, sin perjuicio de las responsabilidades en que cada uno de ellos pueda incurrir por sus propios actos.\nEl superior jerárquico posee facultad de atracción respecto de los asuntos en conocimiento de sus subordinados y goza de sus mismas atribuciones aunque no le estén expresamente encomendadas.\nV. BUENA FE. El Ministerio Público no persigue intereses propios o ajenos, sino que, como representante de la sociedad, realiza llanamente la voluntad de la Ley.\nEn la investigación de los delitos debe tomar en cuenta no sólo las circunstancias que eventualmente le permitan probar su acusación, sino también las que sirvan para atenuar o excluir la responsabilidad del inculpado.\nSus funcionarios deberán abstenerse de incurrir en practicas dilatorias o en abuso de las facultades que la ley les confiere.\nVI. IRRECUSABILIDAD. El Ministerio Público tiene potestad para conocer de cualquier asunto de su competencia, independientemente de cualquier circunstancia subjetiva que le acompañe.\nVII. GRATUIDAD. Los servicios que proporcione el Ministerio Público y sus Órganos Auxiliares durante la investigación y persecución de los delitos de su competencia serán gratuitos. Los servicios de carácter pericial que se otorguen fuera de dichos supuestos se sujetaran a lo que dispongan las leyes correspondientes. del Ministerio Público durante el proceso, correrán con sus propios gastos y con los derivados de la práctica de del Ministerio Público.\nVIII. LEGALIDAD. El Ministerio Público realizará sus actos con estricta sujeción a la Ley. investigarlo. La misma obligación tendrá respecto de los delitos que sólo se persigan por querella a partir de que la misma le sea formulada.\nEl ejercicio de la acción penal será obligatoria tan pronto estime acreditadas las categorías procesales, según las contemple el Código de Procedimientos Penales, y siempre que la misma resulte procedente conforme a lo dispuesto en esta Ley.\nEl no ejercicio de la acción penal sólo podrá decretarse por las causales expresamente determinadas en la ley.\nIX. OPORTUNIDAD. En función del principio de legalidad el Ministerio Público sólo podrá suspender la investigación del delito o prescindir total o parcialmente de su persecución ante los Tribunales, en los casos expresamente establecidos en la Ley y en los términos señalados por la misma. afecten gravemente el interés público.\n(REFORMADO, P.O. 12 DE MAYO DE 2009)\nLa aplicación de criterios de oportunidad se hará siempre con base en razones objetivas valoradas conforme a las pautas generales fijadas por el Fiscal General y estará sujeta a los controles institucionales que determine la presente Ley.\nB. En lo referente a la integración de la Averiguación Previa y a la actuación del Ministerio Público durante el proceso:\n(REFORMADA PRIMER PÁRRAFO, P.O. 12 DE MAYO DE 2009)\nI. DIRECCIÓN DE LA INVESTIGACION. Corresponde a los Agentes del Ministerio Público la investigación de los delitos, para lo cual se auxiliarán de la Policía del Estado, los que estarán bajo su autoridad y mando inmediato.\n(REFORMADO, P.O. 12 DE MAYO DE 2009)\nLos titulares de la Policía del Estado y de los Servicios Periciales deberán cumplir y hacer cumplir las órdenes del\nMinisterio Público, cualquiera que sea la jerarquía del funcionario del cual emanen.\nLas órdenes del Ministerio Público no afectarán las opiniones técnicas y científicas que emitan los peritos en sus dictámenes.\nEl Ministerio Público tiene el carácter de Autoridad en términos de lo dispuesto por la Constitución Política de los\nII. FE PÚBLICA.- Los Agentes del Ministerio Público darán fe de sus propios actos, los que serán válidos aún cuando no se asiente expresamente razón de ello.\nTampoco será necesario que actúen en compañía de testigos de asistencia o de otros funcionarios. expresamente la Ley.\nIII. COLABORACIÓN. Las Autoridades, Tribunales, Organismos y Dependencias oficiales establecidas en el Estado, así como las personas físicas y morales que en él residan o transiten, están obligadas a proporcionar el auxilio que les requiera el Ministerio Público en el ejercicio de sus atribuciones. estricta sujeción a las instrucciones que de él reciban.\nSalvo las excepciones establecidas en la presente Ley, quien presencie o tenga conocimiento de la comisión de un esclarecimiento. mismas.\nEl Ministerio Público podrá recurrir a los medios que le autorice la Ley para hacer cumplir sus determinaciones.\nIV. LEALTAD. Quienes con cualquier carácter intervengan en la Averiguación Previa deberán conducirse con lealtad y buena fe, evitando planteamientos dilatorios o meramente formales, así como cualquier abuso en las facultades que les concede la Ley.\nLo dispuesto en la presente fracción no podrá afectar o restringir en modo alguno los derechos de defensa.\nV. REGULARIDAD. El Ministerio Público velará por la regularidad en la integración de las indagatorias, vigilará el correcto ejercicio de las facultades otorgadas a quienes en ellas intervienen y procurará su celeridad y su encauzamiento al descubrimiento de la verdad histórica.\nPodrá aplicar criterios de economía procesal y subsanar y corregir los defectos o excesos en sus actuaciones siempre que la Ley no disponga lo contrario y ello resulte conducente para los fines de la indagatoria o para preservar los derechos de los involucrados o de cualquier tercero con interés debidamente acreditado.\nVI. RESERVA. Todas las actuaciones de la Averiguación Previa serán reservadas, salvo para el ofendido, víctima, representantes o sus abogados; el inculpado o su defensor; quienes tendrán acceso a las constancias en los términos que fije la presente Ley.\nLas promociones o pedimentos que el Ministerio Público pretenda presentar en el proceso y las constancias que hubiere obtenido del mismo sólo podrán ser mostradas al ofendido, a la víctima, a sus representantes o a sus abogados.\nEl Ministerio Público cuidará que la información que deba proporcionar no lesione el honor ni los derechos de la personalidad de los involucrados en las indagatorias, ni ponga en peligro las investigaciones que se realicen.\nVII. TRATO DIGNO. El Ministerio Público y sus auxiliares deberán proporcionar un trato digno y adecuado a toda persona con la que, con motivo de sus funciones, deban interactuar, independientemente de su edad, sexo, estado civil, raza, idioma, religión, ideología, orientación sexual, posición social o económica, discapacidad, condición física o estado de salud.\nSiempre que el ofendido o la víctima se lo solicite le orientará y explicará suficientemente los tramites, resultado de la integración de la indagatoria en la que estuvieren interviniendo.\nARTÍCULO 7.- ATRIBUCIONES DEL MINISTERIO PÚBLICO. El Ministerio Público tendrá las atribuciones y obligaciones que le señalen la Constitución Política de los Estados Unidos Mexicanos, la Constitución Política del\nEstado, la Ley Orgánica de la Administración Pública Estatal, el Código de Procedimientos Penales, la presente Ley y otros ordenamientos jurídicos; además de las siguientes:\nA. En la Averiguación Previa:\nI. Recibir las denuncias o querellas sobre hechos que puedan constituir delito de la competencia de los Tribunales del fuero común en el Estado.\nII. Hacer la clasificación legal de los hechos que le son denunciados con base en las constancias que se desprendan de la denuncia o de la Averiguación Previa, sin obligación de sujetarse o atender a la que hubieren hecho los denunciantes o querellantes.\nIII. Investigar los delitos de su competencia con todas las facultades que este y otros ordenamientos jurídicos le otorguen. Para ello se auxiliará de la Policía del Estado y de los Servicios Periciales y, en su caso, de los demás\nÓrganos y Autoridades que prevea la Ley.\nIV. Turnar a las Autoridades correspondientes las indagatorias que no sean de su competencia, lo que hará de inmediato en los casos en que conozca de ellas con motivo de la detención en flagrancia de el o los probables responsables.\nV. Recabar testimonios, ordenar peritajes, formular requerimientos, practicar inspecciones, preservar el lugar de los hechos, obtener evidencias y desahogar e integrar a la Averiguación Previa las pruebas que tiendan a acreditar las categorías procesales que determine el Código de Procedimientos Penales para fundamentar el ejercicio de la acción penal; así como para acreditar y cuantificar la reparación de los daños y perjuicios causados.\nVI. Solicitar a la Autoridad Judicial el desahogo de los medios de prueba que sólo por su conducto puedan recabarse; así como las órdenes de cateo, de arraigo, restricción y otras medidas precautorias que sean procedentes.\nVII. Decretar el aseguramiento de los objetos, instrumentos y productos del delito, así como de las cosas, evidencias, valores o substancias relacionadas con el mismo.\nVIII. Solicitar la colaboración para la practica de diligencias al Ministerio Público Federal, Militar y al del resto de las entidades federativas; así como obsequiar las que les sean solicitadas, en los términos que establezcan los convenios correspondientes.\nIX. Ordenar la detención y, en su caso, retener al o los probables responsables de la comisión de delitos, en los términos previstos por el artículo 16 de la Constitución Política de los Estados Unidos Mexicanos y demás ordenamientos aplicables.\nX. Otorgar la libertad caucional a los inculpados que se encuentren a su disposición, cuando proceda.\nXI. Restituir provisionalmente al ofendido en el goce de sus derechos, en los términos que dispone esta Ley o, en su caso, ordenar que los bienes controvertidos se mantengan a disposición del Ministerio Público cuando ello sea procedente.\nXII. Poner a disposición del Ministerio Público Especializado, a los menores de dieciocho años que hubieren incurrido en conductas tipificadas como delitos por las leyes penales, cuando sea notoria o se encuentre acreditada su minoría de edad; remitiéndole de inmediato las actuaciones que se hubieren practicado.\nXIII. Aplicar los criterios de oportunidad que autoriza esta Ley, cuando ello sea procedente.\nXIV. Procurar la solución del conflicto penal mediante el recurso a las formas o procedimientos de justicia\nXV. Requerir el auxilio de las Autoridades Estatales y Municipales cuando ello sea necesario para el ejercicio de sus funciones.\nXVI. Aplicar las medidas de apremio y las correcciones disciplinarias que le autorice la Ley para hacer cumplir sus determinaciones; independientemente de la facultad para iniciar Averiguación Previa por desacato o demás delitos que resulten cometidos.\nXVII. Recurrir en queja o mediante el procedimiento que establezca la Ley, ante el superior jerárquico o el órgano de control correspondiente, por los actos indebidos o negligentes en que incurran las autoridades al resolver los requerimientos o solicitudes que les hubiere formulado.\nXVIII. Acordar el archivo provisional de las indagatorias cuando no se reúnan las categorías procesales necesarias para el ejercicio de la acción penal.\nXIX. Poner a disposición del Órgano Jurisdiccional a los inimputables mayores de edad a quienes se deban aplicar medidas de seguridad, ejercitando las acciones correspondientes, en los términos establecidos por los\nOrdenamientos Jurídicos aplicables.\nXX. Levantar actas circunstanciadas, conciliaciones y constancias de hechos, en los supuestos que esta Ley expresamente determine y, en su caso, expedir constancia de las mismas a los interesados, cuando ello sea procedente.\nXXI. Determinar el no ejercicio de la acción penal en los casos que esta y otras leyes establezcan.\nXXII. Las demás que establezcan las normas aplicables.\nB. En ejercicio de la acción penal y como parte en el proceso:\nI. Ejercitar la acción penal ante la Autoridad Jurisdiccional competente, en la vía que corresponda, concretando la acusación y, en su caso, ampliar ésta cuando proceda.\nII. Aclarar los pedimentos de ejercicio de la acción penal en los que la Autoridad Judicial haya determinado que no se encuentran satisfechos los requisitos de los mismos.\nIII. Solicitar a la Autoridad Judicial las órdenes de aprehensión, de reaprehensión, y de comparecencia o de presentación, cuando se reúnan los requisitos del artículo 16 de la Constitución Política de los Estados Unidos\nMexicanos y los que las demás disposiciones legales establezcan.\nIV. Poner a disposición de la Autoridad Judicial a las personas detenidas, aprehendidas o reaprehendidas; así como a los objetos y evidencias aseguradas, en los términos de las disposiciones jurídicas aplicables.\nV. Solicitar que se preserve el lugar de los hechos, los instrumentos, objetos y evidencias del delito; así como la identidad y domicilios del inculpado y de los testigos, cuando ello sea necesario.\nVI. Pedir el embargo precautorio de bienes para los efectos de la reparación del daño, en los términos que prevenga la ley.\nVII. Solicitar las órdenes de arraigo, de cateo y otras medidas precautorias, que sean procedentes.\nVIII. Aportar las pruebas y promover todo lo conducente para el completo esclarecimiento de los hechos delictuosos y de las circunstancias en que éstos se realizaron; así como para acreditar las particularidades del inculpado; ello con el fin de que en su oportunidad se impongan, a quienes hayan incurrido en las conductas materia de su acusación, las sanciones y medidas de seguridad previstas en las leyes; de igual forma, para demostrar los daños y perjuicios causados y fijar el monto de su reparación.\nIX. Formular conclusiones acusatorias, cuando sean necesarias, en los términos que establezca el Código de\nProcedimientos Penales; desahogar las vistas que se le formulen y solicitar las sanciones y medidas de seguridad que correspondan según el caso.\nX. Interponer los recursos que la ley establece y expresar los agravios correspondientes, así como promover y dar seguimiento a los incidentes que la misma admite.\nXI. Solicitar ante la Autoridad Judicial la libertad del inculpado, cuando no se tipifique como delito la conducta correspondiente; cuando de tipificarse no resulte atribuible al inculpado; o cuando obre en su favor alguna o algunas de las causas excluyentes de delito, excusa absolutoria o causa de extinción de la acción penal, previstas en el\nCódigo Penal.\nXII. Oponerse al otorgamiento de la libertad provisional del inculpado y promover lo conducente para ello cuando existan razones de interés público.\nXIII. Orientar a las víctimas y ofendidos respecto de los trámites y vicisitudes del proceso; así como coordinar las actividades de quien se haya constituido en su coadyuvante.\nXIV. Vigilar que el proceso se tramite en forma regular, promoviendo lo necesario para que el Juzgador aplique las leyes y para que se cumplan sus determinaciones.\nXV. Recurrir en queja o mediante el procedimiento que establezca la Ley, ante el superior jerárquico o el órgano de control correspondiente, por los actos indebidos o negligentes en que incurran las Autoridades al resolver las promociones o solicitudes que les hubiere formulado.\nXVI. Requerir el auxilio de las Autoridades Estatales y Municipales cuando ello sea necesario para el ejercicio de sus funciones.\nXVII. Desistirse de la acción penal de acuerdo con lo previsto en esta Ley y en el Código de Procedimientos Penales del Estado.\nXVIII. Las demás que prevengan este y otros Ordenamientos Jurídicos aplicables.\nC. Generales:\nI. Velar, en la esfera de su competencia, por el respeto de los derechos humanos que otorgan la Constitución Política\nIII. Realizar estudios y programas de prevención del delito, en el ámbito de su competencia y coadyuvar con organismos sociales, educativos o de seguridad pública en la difusión e implementación de estrategias para la prevención de la criminalidad en general.\nIV. Promover la participación de la comunidad en los programas que implemente o en los que participe, en los términos que los mismos establezcan.\nV. Promover lo necesario, dentro de sus atribuciones, para la recta y expedita administración de justicia.\nVI. Cuidar que en los asuntos en que intervenga, se cumplan las determinaciones de la Autoridad Judicial.\nVII. Intervenir, en su carácter de Representante Social, ante los Órganos Jurisdiccionales del orden Civil y Familiar, en la protección de los menores e incapaces, en los juicios en que, de acuerdo con la ley de la materia, tenga intervención.\nVIII. Presentar ante las Autoridades Judiciales las promociones conducentes al interés de la institución.\nIX. Rendir los informes que le sean solicitados por las Autoridades Judiciales Federales.\nX. Auxiliar a las Autoridades Federales y de otras entidades de la República, en la persecución de los delitos de la competencia de éstos, en los términos de los convenios, bases y demás instrumentos de colaboración celebrados al efecto.\nXI. Participar en el Sistema Nacional de Seguridad Pública, de conformidad con la Ley General que Establece las\nBases de Coordinación del Sistema Nacional de Seguridad Pública, la presente Ley y demás Ordenamientos\nJurídicos.\nXII. Ejercer las facultades que en materia de Seguridad Pública le confiere la Ley.\nXIII. Recabar de las Autoridades Federales, Estatales y Municipales, así como de instituciones públicas y privadas, los informes, documentos y pruebas que se requieran para el ejercicio de sus funciones.\nXIV. Orientar a los particulares que formulen quejas por irregularidades o hechos que no sean constitutivos de delito, para que acudan ante las instancias competentes.\nXV. Resguardar e implementar las medidas necesarias para la conservación, asignación y adjudicación de los bienes que se encuentren a su disposición y que no hubieren sido reclamados.\nXVI. Administrar y disponer de los fondos propios que le asigne o faculte la ley a constituir, en los términos que la misma disponga.\nXVII. Las demás que le señalen este y otros ordenamientos.\nARTÍCULO 8.- APLICACION PREFERENTE DE LAS LEYES ESPECIALES. En materia de justicia para adolescentes y cualquiera otra que se encuentre regulada por leyes especiales en las que se de intervención al\nMinisterio Público, se aplicarán los principios y disposiciones contenidos en esta Ley, en cuanto no se opongan expresamente a los que las mismas establezcan.\nARTÍCULO 9.- SUPLETORIEDAD. En todo lo que no se encuentre expresamente regulado en la presente Ley se aplicará supletoriamente, en cuanto resulten conducentes y no se le opongan, las disposiciones contenidas en el que imperen en el Estado por lo que hace a las instituciones y categorías jurídicas que les sean afines.\nARTÍCULO 10.- VALOR DE LOS APOSTILLADOS. Las apostillas, brevetes o epígrafes que se encuentren consulta y la fácil localización de sus preceptos, por lo que si llegare a existir contradicción entre los rubros y sus contenidos deberán prevalecer estos últimos.\nLIBRO PRIMERO.\nDE LA AVERIGUACIÓN PREVIA.\nTÍTULO PRIMERO.\nGENERALIDADES.\nCAPÍTULO I.\nCONCEPTO Y FINALIDAD.\nARTÍCULO 11.- CONCEPTO DE AVERIGUACIÓN PREVIA. La Averiguación Previa es el procedimiento de orden público mediante el cual el Ministerio Público, con el apoyo de sus Órganos Auxiliares y la colaboración de\nAutoridades y Gobernados, investiga los hechos puestos en su conocimiento como posiblemente constitutivos de delito.\nLos vocablos averiguación previa o indagatoria designan tanto al procedimiento mismo como al expediente formado para hacerlo constar.\nARTÍCULO 12.- FINALIDAD DE LA AVERIGUACIÓN PREVIA. La averiguación previa tiene por finalidad la reunión de datos suficientes que tiendan al descubrimiento de la verdad histórica de los hechos denunciados para, con base en ellos, sustentar el ejercicio de la acción penal o, en su caso, determinar la ausencia de interés social en su persecución o proveer a la solución del conflicto que les es subyacente.\nCAPÍTULO II.\nTITULARIDAD DE LA INVESTIGACIÓN E INTERVENCIÓN DE ORGANOS AUXILIARES\n(REFORMADO, P.O. 12 DE MAYO DE 2009)\nARTÍCULO 13.- TITULARIDAD DE LA INVESTIGACIÓN. Corresponde al Ministerio Público la titularidad de la investigación, para lo cual se auxiliará del personal bajo su mando, de la Policía del Estado y de los peritos que el designe, formen o no parte de la propia institución; así como de las Policías Preventivas Municipales y los Síndicos de los Ayuntamientos en los términos que disponga esta Ley y los demás ordenamientos aplicables.\n(REFORMADO PRIMER PÁRRAFO, P.O. 12 DE MAYO DE 2009)\nARTÍCULO 14.- INTERVENCIÓN DE LA POLICÍA DEL ESTADO. La Policía del Estado auxiliará al Ministerio\nPúblico mediante el ejercicio de las siguientes atribuciones:\nI. Investigar los hechos posiblemente delictuosos en los términos que le ordene el Ministerio Público, para lo cual podrá acudir al lugar de los hechos, entrevistarse con personas y Autoridades que puedan tener conocimiento de los mismos, vigilar el comportamiento de quienes puedan estar involucrados, obtener información de los bancos de datos que obren en poder de las Autoridades e Instituciones Públicas y localizar, recoger, preservar y poner a disposición del Ministerio Público los instrumentos, evidencias, objetos y productos del delito en los términos que este y otros ordenamientos jurídicos determinen.\nII. Documentar el resultado de sus investigaciones mediante la suscripción de partes informativos, toma de ordenamientos aplicables; así como intervenir las comunicaciones privadas en los supuestos y términos que establezca la Ley.\nIII. Investigar cuando tenga noticia de un hecho posiblemente constitutivo de delito que sea perseguible de oficio, impedir que se pierdan, destruyan o alteren los instrumentos, evidencias, objetos y productos del ilícito; así como para propiciar la seguridad y el auxilio a las víctimas y ofendidos.\nIV. Detener, en los casos de flagrancia, al probable responsable de los hechos y ponerlo de inmediato a disposición del Ministerio Público.\nV. Cumplir las ordenes de localización, presentación, comparecencia y detención que le ordene el Ministerio Público.\nVI. Ejecutar las órdenes de presentación, comparecencia, aprehensión, reaprehensión, arresto y cateo emitidas por la Autoridad Judicial.\nVII. Ejecutar los arraigos y vigilar el cumplimiento de las órdenes de restricción, en los términos autorizados por la\nAutoridad Judicial o Ministerial.\nVIII. Preservar y vigilar los lugares y objetos que le ordene el Ministerio Público.\nIX. Asegurar que las ordenes y determinaciones del Ministerio Público sean cumplidas.\nX. Efectuar y participar en los operativos policiales conforme a las instrucciones que para el efecto reciban.\nXI. Atender los auxilios que se le soliciten en los términos que le sean autorizados.\n(REFORMADA, P.O. 12 DE MAYO DE 2009)\nXII. Las demás que esta Ley, la Ley Orgánica de la Fiscalía General del Estado de Coahuila de Zaragoza, el reglamento interior correspondiente y otros ordenamientos Jurídicos dispongan.\nARTÍCULO 15.- INTERVENCIÓN DE PERITOS. Los peritos dilucidarán las cuestiones técnicas, artísticas o científicas que les plantee el Ministerio Público. Los que pertenezcan a la misma institución orientarán y asesorarán además al Ministerio Público, cuando así se les requiera, en materia de investigación criminal y apreciación de pruebas sin que ello comprometa la independencia y objetividad de su función.\nLos peritos oficiales, además, recolectaran la evidencia procediendo a su debido embalaje y preservación y pondrán a disposición del Ministerio Público el material sensible significativo que resulte de sus intervenciones.\nRendirán sus dictámenes e informes dentro de los términos que les sean fijados por el Ministerio Público.\n(REFORMADO PRIMER PÁRRAFO, P.O. 12 DE MAYO DE 2009)\nARTÍCULO 16.- AUXILIO DE LAS POLICÍAS PREVENTIVAS MUNICIPALES. Las Policías Preventivas Municipales proporcionaran los auxilios y apoyos que les requiera el Ministerio Público con estricta sujeción a las órdenes que de él reciban. necesarias para preservar el lugar de los hechos e impedir que se pierdan, destruyan o alteren los instrumentos, evidencias, objetos y productos del delito; así como para propiciar la seguridad y el auxilio a las víctimas y ofendidos.\nDe igual manera asegurarán a los probables responsables en los casos en que ello sea procedente, poniéndolos de inmediato a disposición del Ministerio Público.\nTan pronto intervenga el Ministerio Público o la Policía del Estado en el conocimiento de los hechos, cederán a estos el mando de las acciones, proporcionándoles todos los datos que hubieren obtenido respecto de los mismos; sin perjuicio de que continúen brindando los apoyos que dichas autoridades dispongan. informativos.\nARTÍCULO 17.- SÍNDICOS DE LOS AYUNTAMIENTOS EN FUNCIONES DE MINISTERIO PÚBLICO. En los que de acudir al mismo o esperar su intervención se comprometa el resultado de las investigaciones; los Síndicos de practicar las diligencias que deban realizarse de inmediato.\nPúblico de residencia más próxima o accesible sujetándose a las instrucciones que de él reciban. Tan pronto el\nMinisterio Público se haga presente pondrán a su disposición lo que hubieren actuado, informándole los pormenores del caso y absteniéndose desde ese momento de cualquier otra intervención que no les sea requerida.\nEl Ministerio Público examinará las actuaciones que le hubieren sido entregadas y dispondrá lo conducente para la regularización de la indagatoria.\nCAPÍTULO III.\nHECHOS MATERIA DE LA AVERIGUACIÓN PREVIA.\nARTÍCULO 18.- OBLIGACIÓN DE INVESTIGAR. El Ministerio Público tendrá obligación de investigar los hechos posiblemente constitutivos de delito que sean de su conocimiento.\nLos hechos citados como antecedentes o meras referencias sólo serán materia de investigación cuando el Ministerio\nPúblico estime que puedan resultar conducentes para los fines de la Averiguación Previa. Si se advierte que los mismos pudieran ser constitutivos de diversos delitos existirá obligación de investigarlos sólo cuando sean parte de una secuela o cuando se trate de delitos que no admitan la aplicación de criterios de oportunidad o formas de justicia restaurativa y las acciones penales se encuentren vigentes.\nARTÍCULO 19.- APARICIÓN DE NUEVOS HECHOS DURANTE LA INTEGRACIÓN DE LA AVERIGUACIÓN\nPREVIA. Si durante la Averiguación Previa aparecieren hechos no considerados en la noticia del delito, el Ministerio\nPúblico procederá a su investigación dentro de la misma o en diversa indagatoria. Si los mismos fueren perseguibles por querella comunicará lo anterior al legitimado para formularla, cuando su identificación y localización sean posibles, sujetándose a lo dispuesto para dicha clase de delitos.\nARTÍCULO 20.- DESGLOSE DE LA INDAGATORIA. Cuando en una misma Averiguación Previa se comprendan diversos hechos que puedan ser constitutivos de delitos que, conforme a las disposiciones de esta ley, admitan distintos tratamientos, el Ministerio Público resolverá lo correspondiente a cada uno de ellos haciendo el desglose de la indagatoria para continuar las investigaciones respecto de aquellos en los que no este en aptitud de resolver. únicamente respecto de alguno o algunos de los inculpados, conservara la facultad de investigar los que hubieren quedado pendientes aunque no asiente razón expresa de ello.\nARTÍCULO 21.- ACCION PENAL FALLIDA. Cuando los Tribunales dicten resolución que en cualquier forma absuelva en forma definitiva al o los inculpados y la misma quede firme, el Ministerio Público deberá continuar con la indagatoria para, en su caso, proceder en contra de quien o quienes resulten efectivamente responsables sin que dichas acciones puedan incluir a los absueltos.\nARTÍCULO 22.- CLASIFICACION LEGAL DE LOS HECHOS. Corresponde al Ministerio Público durante la\nAveriguación Previa la clasificación técnico-legal de los hechos denunciados, con base en las circunstancias que se denunciante.\nDicha clasificación podrá variarse o modificarse en cualquier momento de la indagatoria, sin necesidad de acuerdo expreso, hasta en tanto se emita resolución definitiva respecto de los hechos materia de la misma, en cuyo caso sólo podrá modificarse en los supuestos que este y los demás ordenamientos determinen.\nPara la emisión de determinaciones que pongan o puedan poner fin a la indagatoria, el Ministerio Público clasificará los hechos con base en las constancias que obren en el expediente hasta dicho momento. por los que hubiere clasificado los hechos el denunciante o el querellante.\nAl hacer del conocimiento del inculpado los hechos que se le imputen se abstendrá de clasificarlos legalmente, limitándose a informárselos en los términos en que hubieren sido denunciados y a poner a su disposición las constancias que obren en la indagatoria conforme lo disponga la presente Ley.\nCAPÍTULO IV.\nDE LOS SUJETOS QUE INTERVIENEN EN LA AVERIGUACIÓN PREVIA.\nARTÍCULO 23.- VÍCTIMAS Y OFENDIDOS. Tendrán el carácter de víctimas y ofendidos los que se encuentren en los supuestos previstos por el Código Penal. El Ministerio Público reconocerá tal carácter según se desprenda de las constancias que obren en la averiguación previa, dándoles la intervención que conforme a lo dispuesto por esta Ley les corresponda.\nARTÍCULO 24.- DERECHOS Y OBLIGACIONES DE LAS VÍCTIMAS Y OFENDIDOS. Durante la Averiguación\nPrevia los ofendidos y, en su caso, las víctimas, tendrán los siguientes derechos y obligaciones:\nA. Derechos:\n(REFORMADA, P.O. 12 DE MAYO DE 2009)\nI. ASISTENCIA MÉDICA Y PSICOLÓGICA DE URGENCIA. A que se les preste atención médica y psicológica de urgencia cuando las requieran, desde el momento de la comisión del delito. Para el efecto el Ministerio Público informará o canalizará a quienes se encuentren en tal supuesto a las instituciones especializadas en la materia. En su caso, la Policía del Estado y las Policías Preventivas Municipales, al tomar conocimiento de los hechos, solicitaran los servicios médicos de urgencia tomando las medidas necesarias para asegurar los fines de la indagatoria. enfermedades de transmisión sexual.\nII. SEGURIDAD Y PROTECCIÓN PERSONAL. A que se le proporcione seguridad y protección personal siempre que se trate de delito grave, lo solicite el interesado, existan datos objetivos que acrediten la necesidad de las medidas y exista disponibilidad de recursos para el efecto.\nIII. FACILIDADES PARA LA PRESENTACIÓN DE DENUNCIAS Y QUERELLAS Y PARA SUS\nCOMPARECENCIAS. A que el Ministerio Público acuda al lugar en donde se encuentre para los efectos de tomar sus denuncias, querellas o declaraciones, siempre que acredite que sus condiciones de salud le impiden acudir personalmente a realizarlas o que se encuentren presos.\nIV. INFORMACIÓN Y ASESORIA JURÍDICA. A que el Ministerio Público le proporcione asesoría jurídica e información respecto de la integración de la Averiguación Previa, de los trámites a seguir durante el proceso y, en su caso, de las vicisitudes que puedan presentarse en una y otro.\nV. ACCESO A LAS CONSTANCIAS. A tener acceso a las constancias de la Averiguación Previa, de las que se podrá enterar en presencia del Agente del Ministerio Público que conozca de la investigación.\nVI. PRESENTACIÓN DE PRUEBAS. A que se le reciban todos los datos y elementos de prueba con los que cuente, siempre y cuando precise lo que desea acreditar y ello sea conducente a los fines de la Averiguación Previa.\nPodrá estar presente en las confrontaciones, testimonios, inspecciones y reconstrucciones; así como en las declaraciones del inculpado. A los testigos, peritos e inculpado les podrá formular las preguntas que sean conducentes, las que serán planteadas por conducto del Ministerio Público previa calificación que haga de las mismas.\nEl Ministerio Público no tendrá obligación de notificarle la admisión o desahogo de los medios de prueba y podrá ejercitar la acción penal o determinar su inejercicio sin recibir los que la víctima u ofendido hubieren ofrecido.\nVII. COADYUVANCIA Y PARTE CIVIL. A anticipar desde la indagatoria su deseo de constituirse en parte civil o en coadyuvante del Ministerio Público durante el proceso.\nVIII. IMPUGNACIÓN DE DETERMINACIÓN DE NO EJERCICIO DE ACCION PENAL. A impugnar las determinaciones de no ejercicio de la acción penal.\nIX. PRESENTACIÓN DE QUEJAS Y RECURSOS. A formular quejas y promover los recursos procedentes por la indebida actuación del personal de la institución del Ministerio Público, en los términos que establezca la Ley.\nB. Obligaciones:\nI. IDENTIFICACIÓN. Identificarse fehacientemente en sus comparecencias ante el Ministerio Público.\nII. DESIGNACION DE DOMICILIO. Designar, desde la primera comparecencia o escrito que presente, domicilio para oír y recibir notificaciones en el lugar donde radique la indagatoria e informar oportunamente los cambios del mismo.\nIII. ORDEN Y RESPETO. Dirigirse a la Autoridad Ministerial con el orden y respeto debidos.\nIV. COLABORACIÓN. Aportar todos los datos y medios de prueba que puedan ser conducentes a los fines de la\nAveriguación Previa, presentar a las personas cuyos testimonios ofrezca, cumplir con los requerimientos que le formule el Ministerio Público y comparecer cuantas veces sea llamado.\nV. LEALTAD Y BUENA FE. Conducirse con lealtad y buena fe durante la integración de la indagatoria, informando investigaciones; abstenerse de incurrir en conductas que puedan incidir en la reiteración o agravamiento del conflicto cuando se hubiere sometido a ellos.\nARTÍCULO 25. INTERVENCIÓN DE ABOGADOS DE VÍCTIMAS Y OFENDIDOS. La víctima y el ofendido podrán ejercer los derechos y obligaciones a que se refiere el artículo anterior, cuando no sean personalísimos, por conducto de abogado que para el efecto designe, el cual por su sola aceptación asumirá por sí mismo, además de las enumeradas, las siguientes obligaciones:\nI. FIRMAR LAS CONSTANCIAS. Firmar las constancias de las diligencias en que intervenga.\nII. NOTIFICARSE. Oír y recibir las notificaciones que le formule el Ministerio Público, las que surtirán efectos como si se hubieren hecho a su representado.\nIII. INFORMACIÓN DE RENUNCIA O REVOCACIÓN DE SU NOMBRAMIENTO. Informar al Ministerio Público la revocación o renuncia al mandato otorgado por su representado y abstenerse de actuar a partir de dicho momento.\nIV. ASESORIA. Asesorar en forma debida a su representado, abstenerse de prácticas dilatorias y conducirse con lealtad hacía los intereses de su mandante. obligaciones a que se refiere el presente artículo, a menos que quien haga dicha designación señale expresamente las limitaciones que desee imponerle. El cargo de abogado se tendrá por aceptado desde que exista manifestación expresa o desde que el designado intervenga en la indagatoria para la cual fue designado.\nCuando la designación recaiga en varias personas, el ofendido nombrará un representante común; pero si no lo hace se tendrá por designado al primero de los nombrados.\nLa víctima y el ofendido podrán también designar abogado o pasante de derecho para el sólo efecto de imponerse de constancias.\nARTÍCULO 26.- IMPEDIMENTOS PARA SER ABOGADO DEL OFENDIDO O LA VÍCTIMA. Están impedidos para ser designados abogados de la víctima o el ofendido:\nI. FALTA DE TÍTULO DE ABOGADO. Los que no posean al momento de la designación título de Abogado o\nLicenciado en Derecho debidamente expedido por instituciones autorizadas; salvo que el nombramiento sea para el sólo efecto de imponerse de constancias, en cuyo caso bastará la calidad de pasante de derecho.\nII. PRESOS. Los que se hallen presos.\nIII. INHABILITACIÓN. Los que estén inhabilitados para el ejercicio de la profesión.\n(REFORMADO, P.O. 12 DE MAYO DE 2009)\nIV. INCOMPATIBILIDADES. Los que hubieren tenido conocimiento previo de la indagatoria con el carácter de Juez, Agente del Ministerio Público, Perito, Policía del Estado o escribiente; los que intervengan o hubieren intervenido con cualquier carácter dentro de la Averiguación Previa y los que patrocinen intereses que puedan ser contradictorios dentro de la misma. presente artículo.\nARTÍCULO 27. INCULPADO. Tendrá calidad de inculpado la persona a la que durante la Averiguación Previa, el\nMinisterio Público le atribuya intervención típica en un delito. forma.\nUna vez que se adquiere la calidad de inculpado, se conserva durante toda la Averiguación Previa hasta que se consigne o quede firme la determinación de no ejercitar la acción penal.\nIgualmente terminará cuando exista error en la persona por confusión de sus generales y así se declare.\nLa mera sospecha no confiere el carácter de inculpado.\nARTÍCULO 28.- IDENTIDAD DEL INCULPADO (IGNORANCIA O ERROR EN LOS GENERALES O DE\nPERSONA). Cuando es cierta la identidad física del inculpado, la imposibilidad de conocer sus generales no suspende la Averiguación Previa.\nLas generales falsas por las que se llegue a identificar al inculpado podrán rectificarse en cualquier momento, sin que ello afecte la calidad de aquél.\nCuando de constancias se advierta error en el nombre de la persona señalada o identificada como inculpado, bastará para su rectificación acuerdo del Ministerio Público mediante el cual haga constar dicha circunstancia; pero para mantener en retención legal al detenido, si lo hubiere, para que manifiesten lo que a sus intereses convenga.\nMas cuando en la averiguación previa resulte evidente que se procede contra una persona que no intervino en el delito, por confundir su identidad o sus generales con las del inculpado, el Ministerio Público así lo declarará.\nARTÍCULO 29.- DERECHOS DEL INCULPADO. Durante la Averiguación Previa el inculpado tendrá los siguientes derechos:\nI. LIBERTAD PERSONAL. A estar en libertad, salvo que hubiere sido detenido en delito flagrante, por caso urgente o se encuentre bajo arraigo. Si el inculpado es extranjero, a que se comunique su detención a la representación diplomática o consular que corresponda. La retención o detención de los hombres será en lugar separado al de las mujeres.\nDe igual manera tendrá derecho a la libertad provisional bajo caución en los supuestos y bajo las condiciones que esta Ley prevea.\nII. COMUNICACIÓN Y AUSENCIA DE VIOLENCIA. A comunicarse y estar libre de intimidación, tortura o cualquier forma de violencia indebida.\nIII. AUDIENCIA. A que se le haga saber el hecho concreto y conducta que se le imputa y, en su caso, el nombre del querellante o denunciante. Si faltare denunciante o querellante se le harán saber los hechos tal y como se desprendan de las constancias de la averiguación previa.\nDe igual manera se le harán saber los derechos establecidos en el presente artículo.\nCuando el inculpado no hable español, se le designará un traductor. Si es sordomudo, se procederá por medio de interprete. Estos le harán saber los derechos a que se refiere este artículo y le comunicarán los términos en que se desarrollen las diligencias.\nIV. DECLARACIÓN Y ASISTENCIA DE DEFENSOR EN CASO DE CONFESIÓN. A declarar sobre los hechos, pero sólo si es su libre voluntad.\nSi desea confesar, será necesario, además, que lo haga ante el Agente del Ministerio Público y que durante la\nLey. detenido ilegalmente o cuando este incomunicado o medie violencia en su contra, carecerá de valor probatorio.\nV. DEFENSA. A defenderse por sí, por abogado o por persona de su confianza en los términos que esta Ley señala.\nVI. INFORMACIÓN DE CONSTANCIAS. A tener acceso a las constancias que obren en la Averiguación Previa siempre que tengan relación con los hechos que se le imputen, de las que él o su defensor se podrán enterar y tomar las notas que deseen, en presencia del Agente del Ministerio Público que conozca de la investigación.\nVII. ACTIVIDAD PROBATORIA. A que se le reciban los testigos y demás elementos de prueba que ofrezca, siempre y cuando precise lo que en particular desea acreditar y ello sea conducente a los fines de la Averiguación Previa. El\nPodrá estar presente en las confrontaciones, testimonios, inspecciones y reconstrucciones; a los testigos y peritos les podrá formular las preguntas que sean conducentes, las que serán planteadas por conducto del Ministerio\nPúblico.\nEl Ministerio Público no tendrá obligación de notificarle la admisión o desahogo de los medios de prueba y podrá ejercitar la acción penal o determinar su inejercicio sin recibir los que el inculpado o su defensor hubieren ofrecido.\nLos derechos a que se refieren las fracciones III, IV, VI y VII se harán vigentes sólo a partir de que el inculpado sea detenido, se le cite o comparezca en forma ante el Ministerio Público.\nARTÍCULO 30.- NOMBRAMIENTO DE DEFENSOR. Durante la Averiguación Previa el inculpado tendrá derecho a defenderse por sí, por abogado o por persona de su confianza.\nCuando el inculpado designe a abogado para que se haga cargo de su defensa, éste deberá acreditar que posee título o cédula legalmente expedidos por las instancias competentes, que lo autoricen para el ejercicio de la profesión. Para efectos de tal acreditación el Ministerio Público implementará los mecanismos necesarios para que los abogados que así lo deseen puedan registrar sus títulos o cedulas profesionales, en cuyo caso bastará la consulta a dichos registros para tener por demostrada su calidad de abogado.\nSi el inculpado desea defenderse por sí mismo o por persona de su confianza que no posea o no acredite poseer título de abogado que lo habilite para el ejercicio de la profesión en los términos señalados en el párrafo anterior, el\nMinisterio Público proveerá a su defensa adecuada mediante la designación del defensor de oficio para los efectos de que les asesore, apoye y comparezca con ellos en las diligencias en que debieren intervenir.\nSi el inculpado no quiere o no puede nombrar defensor, después de haber sido requerido para hacerlo, el Ministerio\nPúblico le designará un defensor de oficio. Si no hubiere defensores de oficio disponibles dicha designación podrá recaer en abogado o persona que pueda brindarle defensa adecuada, pero sólo si el inculpado confía en ella.\nEl inculpado podrá, además, designar a abogado o pasante de derecho para el sólo efecto de que se imponga de las constancias.\nARTÍCULO 31.- COMUNICACIÓN DEL NOMBRAMIENTO DE DEFENSOR, ACEPTACIÓN Y PROTESTA DEL\nCARGO. El nombramiento de defensor podrá ser comunicado a la persona en quien recaiga, por conducto del inculpado o del Ministerio Público. Si aquél se encontrare presente, dicho nombramiento se le hará saber desde luego.\nSi el defensor designado acepta el cargo deberá manifestarlo expresamente y protestar su fiel desempeño, por escrito o mediante comparecencia.\nEl Ministerio Público sólo estará obligado a actuar con defensor del inculpado cuando éste desee confesar, cuando así lo pida siempre que se encuentre detenido y en los demás casos que lo exija esta Ley; mas si el defensor designado no se encuentra presente, el Ministerio Público le designará al defensor de oficio que se encuentre disponible para que asuma su defensa durante el desahogo de la diligencia en que se registre dicha ausencia.\nARTÍCULO 32.- REPRESENTANTE COMÚN DE LA DEFENSA. Cuando el inculpado nombre varios defensores, cualquiera podrá actuar con tal carácter; pero aquél deberá designar un representante común, para que con él se entiendan las notificaciones. Si omite designarlo, el Ministerio Público conferirá el cargo al primero que hubiere nombrado el inculpado.\nARTÍCULO 33.- DERECHOS Y OBLIGACIONES DEL DEFENSOR. Durante la averiguación previa el defensor tendrá los siguientes derechos y obligaciones:\nI. IDENTIFICACIÓN. Identificarse fehacientemente en sus comparecencias ante el Ministerio Público.\nII. DESIGNACIÓN DE DOMICILIO. Designar, desde la primera comparecencia o escrito que presente, domicilio para oír y recibir notificaciones en el lugar donde radique la indagatoria e informar oportunamente los cambios del mismo.\nIII. FIRMAR LAS CONSTANCIAS. Firmar las constancias de las diligencias en que hubiere intervenido. El incumplimiento de la presente obligación dará lugar a la revocación del cargo.\nIV. NOTIFICARSE. Oír y recibir las notificaciones que le formule el Ministerio Público, las que surtirán efectos como si se hubieren hecho a su defensa.\nV. BRINDAR DEFENSA ADECUADA. Brindar una defensa adecuada a su representado, estar presente en todas las audiencias y diligencias que se practiquen en la indagatoria, salvo las que se practiquen bajo reserva de identidad; y promover los medios de prueba e intentar los recursos que crea convenientes.\nPara que pueda desistirse de los medios de prueba que promueva y de los recursos que interponga, el defensor deberá contar con el consentimiento expreso del inculpado. De igual forma, éste sólo podrá desistirse de los medios de prueba que promueva y de los recursos que interponga, con el consentimiento de su defensor. Lo anterior deberá ser debidamente constatado por el Ministerio Público.\nVI. ABSTENERSE DE ABANDONAR LA DEFENSA. No abandonar la defensa hasta que el Ministerio Público admita su renuncia o revocación.\nVII. GUARDAR EL SECRETO PROFESIONAL. Guardar el secreto profesional para con su cliente.\nVIII. COLABORACIÓN. Facilitar el cumplimiento de las medidas adoptadas con motivo de los procedimientos de justicia restaurativa, cuando el inculpado se hubiere sometido a ellos.\nIX. ORDEN Y RESPETO. Dirigirse a la Autoridad Ministerial con el orden y respeto debidos.\nX. PRESENTACIÓN DE QUEJAS. A formular quejas por la indebida actuación del personal de la institución del\nMinisterio Público, en los términos que establezca la Ley. facultades y deberes a que se refieren las fracciones I, VII y IX del presente artículo.\nARTÍCULO 34.- IMPEDIMENTOS PARA SER DEFENSOR. Están impedidos para ser defensores:\nI. FALTA DE TÍTULO DE ABOGADO. Los que no posean al momento de la designación, título de Abogado o\nLicenciado en Derecho debidamente expedido por instituciones autorizadas; salvo lo dispuesto en el tercer párrafo del artículo 30 de la presente Ley.\nII. PRESOS. Los que se hallen presos.\nIII. INHABILITACIÓN. Los que estén inhabilitados para el ejercicio de la profesión.\nIV. INCOMPATIBILIDADES. Los que hubieren tenido conocimiento previo de la indagatoria con el carácter de Juez, Agente del Ministerio Público, Perito, Policía del Estado o escribiente; así como los que intervengan o hubieren intervenido con cualquier carácter dentro de la Averiguación Previa.\nV. DEFENSA CONTRADICTORIA. Los que ya defiendan a otro inculpado cuyos intereses jurídicos estén en conflicto con los de quien pretendan defender.\nSe entiende que existe conflicto de intereses únicamente cuando un inculpado imputa intervención típica o responsabilidad a otro, excluyendo las que a él le pudieran resultar.\nEl Ministerio Público no dará intervención alguna a las personas designadas en contravención a lo dispuesto en el presente artículo. Lo mismo hará cuando, sin que exista alguno de los impedimentos señalados, el defensor designado comparezca a las diligencias en estado de ebriedad o bajo el influjo de sustancias tóxicas o estupefacientes.\nARTÍCULO 35.- RENUNCIA Y REVOCACIÓN DEL CARGO DE DEFENSOR. Cuando el defensor renuncie al cargo conferido el Ministerio Público comunicará dicha circunstancia al inculpado en la siguiente diligencia a la que comparezca, si aquél no lo hubiere hecho. De igual manera, si el inculpado revoca el cargo de defensor que hubiere conferido o que el Ministerio Público hubiere asignado, se comunicará en los mismos términos a aquél en quien hubiere recaído.\nLa renuncia o la revocación del cargo de defensor surtirán efectos sólo desde el momento en que el Ministerio\nPúblico acuerde su aceptación, pero si se omitiere dictar dicho acuerdo aquellas surtirán efectos por ministerio de ley a los cinco días contados a partir de que las mismas se hubieren comunicado al Ministerio Público.\nEl Ministerio Público deberá, además, revocar de plano la designación que se hubiere hecho cuando se presente alguno de los impedimentos señalados en el artículo anterior o se percate de su existencia; así como cuando el defensor se niegue a firmar las constancias en que hubiere intervenido.\nEn cualquier caso, la sustitución del defensor se hará mediante los procedimientos establecidos para su designación.\nARTÍCULO 36.- OTROS SUJETOS QUE INTERVIENEN EN LA AVERIGUACIÓN PREVIA. Los testigos, peritos, policías, funcionarios y demás personas que intervengan en la Averiguación Previa tendrán los derechos y obligaciones que esta y las demás leyes establezcan.\nTÍTULO SEGUNDO.\nDE LA COMPETENCIA.\nCAPÍTULO I.\nDE LA COMPETENCIA OBJETIVA.\nARTÍCULO 37.- COMPETENCIA PLENA. Los Agentes del Ministerio Público conocerán de los delitos que sean competencia de las Autoridades Estatales conforme a las reglas establecidas en el Código Penal, independientemente del lugar en que residan, la jerarquía o cargo que ostenten y la especificidad de los hechos denunciados. Su competencia se extiende tanto para la investigación de los hechos como para su eventual persecución ante los Órganos Jurisdiccionales.\nSin perjuicio de lo anterior, el Fiscal General podrá establecer criterios territoriales y de especialidad para efectos de división del trabajo y control jerárquico, sin que los mismos afecten las facultades y competencias otorgadas por esta\nLey ni invaliden los actos realizados en contravención a ellos. Los Agentes del Ministerio Público serán identificados oficialmente con base a la especialidad o residencia que en dichos términos se les asigne.\n(REFORMADO, P.O. 12 DE MAYO DE 2009)\nCuando, con base en los criterios territoriales y de especialidad que fije el Fiscal General, surjan conflictos respecto del Agente del Ministerio Público autorizado para tomar conocimiento de los hechos, el funcionario que tenga jerarquía sobre los involucrados determinará lo conducente, sin mayores trámites.\n(REFORMADO, P.O. 12 DE MAYO DE 2009)\nLo dispuesto en este artículo se aplicará también al personal de Policía del Estado y de Servicios Periciales, en cuanto resulte conducente.\nARTÍCULO 38.- FACULTAD DE ATRACCIÓN. El superior jerárquico podrá en cualquier momento ejercer la facultad de atracción respecto de los asuntos en conocimiento de sus inferiores, para realizar determinados actos o para asumirlos integralmente, por sí mismo o por cualquier otro Agente que designe, sin más limitaciones que las que la presente Ley señale. Para el ejercicio de la facultad de atracción no será necesaria la emisión de acuerdo escrito.\nEn cualquier caso, el funcionario que tenga carácter de Ministerio Público podrá actuar dentro de las indagatorias que le correspondan revisar, para regularizar su integración.\nARTÍCULO 39.- INTERVENCIÓN DE VARIOS AGENTES DEL MINISTERIO PÚBLICO. Cuando en una misma averiguación previa o proceso intervengan varios Agentes del Ministerio Público podrán actuar conjunta o indistintamente, pero se sujetarán en todo caso a las instrucciones que reciban de sus superiores jerárquicos o del que hubiere sido designado responsable de su integración o seguimiento.\n(REFORMADO, P.O. 12 DE MAYO DE 2009)\nARTÍCULO 40.- AUXILIOS Y EXHORTOS MINISTERIALES DENTRO DEL ESTADO. Cuando el Agente del\nMinisterio Público que conozca de la indagatoria deba realizar actos fuera de su lugar de residencia, pero dentro del mismo Estado, podrá hacerlo en forma directa y sin mayores trámites o bien, solicitar el auxilio de sus homólogos mediante exhorto que hará llegar por conducto de los Delegados o de la instancia que determine el Fiscal General.\nARTÍCULO 41.- AUXILIOS Y EXHORTOS MINISTERIALES FUERA DEL ESTADO. Cuando sea necesario realizar actos fuera del territorio del Estado o que requieran la intervención de otras Procuradurías, el Agente del Ministerio\nInterprocuradurías celebrados conforme a lo dispuesto por la Constitución Política de los Estados Unidos Mexicanos. de otras Procuradurías.\nARTÍCULO 42.- INCOMPETENCIA DE LAS AUTORIDADES DEL ESTADO. Cuando el Agente del Ministerio o del Estado, emitirá acuerdo debidamente razonado y lo hará llegar, junto con las constancias de las diligencias que hubiere practicado, a la Dirección General de Averiguaciones Previas o al funcionario que designe el Fiscal General, quien, de estimar procedente la incompetencia planteada, remitirá todo lo actuado a la Procuraduría que se considere facultada para conocer de los hechos. En caso contrario, remitirá las mismas al funcionario a quien le corresponda conocer. correspondiente.\nCuando otra Procuraduría sostenga competencia con la del Estado o rechace la que se le hubiere planteado, se establezcan. En cualquier caso el Ministerio Público del Estado podrá reconsiderar y aceptar o negar su competencia.\n(REFORMADO, P.O. 12 DE MAYO DE 2009)\nARTÍCULO 43.- COMPETENCIA POR HECHOS EN CONOCIMIENTO DE OTRAS PROCURADURÍAS. Cuando otras Procuradurías remitan las constancias de los hechos de que hubieren tomado conocimiento por considerar que los mismos son competencia de las Autoridades del Estado, el Director General de Averiguaciones Previas o el funcionario que designe el Fiscal General hará la calificación respectiva y si estima procedente la competencia remitirá las constancias al Agente del Ministerio Público a quien corresponda conocer.\nCuando se considere competente sólo respecto de ciertos hechos hará el desglose de la indagatoria y remitirá las constancias relativas a los hechos respecto de los cuales se considere incompetente a la autoridad que considere facultada para conocer.\n(REFORMADO, P.O. 12 DE MAYO DE 2009)\nSi se planteara conflicto de competencia entre la Fiscalía y otras procuradurías o entidades encargadas de la procuración de justicia se procederá conforme a lo señalado en el último párrafo del artículo anterior.\nARTÍCULO 44.- INTERRUPCIÓN DE LA PRESCRIPCIÓN POR PLANTEAMIENTOS DE COMPETENCIA. El término de prescripción de la acción penal se interrumpirá desde que se plantee cualquier cuestión de competencia y hasta que la misma sea resuelta.\nARTÍCULO 45.- VALIDEZ DE LAS DILIGENCIAS DESAHOGADAS POR OTRAS PROCURADURÍAS. Las diligencias practicadas por personal de otras Procuradurías que se hubieren declarado incompetentes o las que hubieren realizado con motivo de auxilio o colaboración solicitada, serán válidas en el Estado y su legal constitución se examinará conforme a la legislación del lugar o fuero en que se hayan practicado.\nARTÍCULO 46.- COMPETENCIA JUDICIAL. El Ministerio Público ejercitara la acción penal ante los Órganos\nJurisdiccionales que resulten competentes conforme a las reglas que fije el Código de Procedimientos Penales.\nCAPÍTULO II.\nDE LA COMPETENCIA SUBJETIVA.\nARTÍCULO 47.- IRRECUSABILIDAD DEL MINISTERIO PÚBLICO. Los Agentes del Ministerio Público son irrecusables, pero deberán excusarse cuando exista alguna de las causas a que se refiere el artículo siguiente.\nARTÍCULO 48.- MOTIVOS DE EXCUSA. Son causas de excusa las siguientes:\nI RELACIÓN DEL AGENTE DEL MINISTERIO PÚBLICO CON EL INCULPADO, DEFENSOR, VÍCTIMA, OFENDIDO O SUS ABOGADOS. Tener respecto del inculpado, defensor, víctima u ofendido o sus abogados:\na) Parentesco en línea recta sin limitación de grados, en la colateral por consanguinidad hasta el cuarto grado y en la colateral por afinidad hasta el segundo grado.\nb) Estrecha amistad o enemistad manifiesta.\nc) El carácter de socio, arrendador o arrendatario.\nd) El carácter de acreedor, deudor o fiador o tener dicha calidad su cónyuge o alguno de sus hijos.\ne) El carácter de heredero, legatario o donatario, siempre que hubiere aceptado la herencia o el legado o hubiere hecho alguna manifestación en dicho sentido.\nf) El carácter de tutor, curador o administrador de sus bienes por cualquier título, aunque dicha calidad hubiere cesado.\nII. RELACIÓN DEL AGENTE DEL MINISTERIO PÚBLICO, SU CÓNYUGE O PARIENTES CON ALGUNO DE LOS\nINTERESADOS. Encontrarse el Agente del Ministerio Público, su cónyuge o sus parientes en línea recta sin limitación de grados, en la colateral por consanguinidad hasta el cuarto grado y en la colateral por afinidad hasta el segundo grado; en cualquiera de los siguientes supuestos:\na) Haber demandado, denunciado o presentado querella en contra del inculpado, su defensor, víctima u ofendido o sus abogados o de los cónyuges o parientes en línea recta sin limitación de grados, en la colateral por consanguinidad hasta el cuarto grado y en la colateral por afinidad hasta el segundo grado; de cualquiera de ellos.\nb) Haber sido demandado, denunciado o querellado por el inculpado, su defensor, victima u ofendido o sus abogados o por los cónyuges o parientes en línea recta sin limitación de grados, en la colateral por consanguinidad hasta el cuarto grado y en la colateral por afinidad hasta el segundo grado; de cualquiera de ellos.\nc) Tener interés personal en la indagatoria o en el proceso.\nIII. NEGOCIO EN EL QUE SEA JUEZ O ARBITRO ALGUNO DE LOS INTERESADOS. Seguir algún negocio en el que sea Juez o Arbitro el inculpado, su defensor, la víctima u ofendido o sus abogados.\nIV. RECIBIR PRESENTES, SERVICIOS O CONVITES DE ALGUNO DE LOS INTERESADOS. Aceptar dadivas o servicios del inculpado, su defensor, la víctima u ofendido o sus abogados; o asistir a convites que para él organice cualquiera de ellos durante la tramitación de la indagatoria o el proceso.\nV. HACER PROMESAS QUE IMPLIQUEN PARCIALIDAD. Hacer promesas que impliquen parcialidad a favor o en contra del inculpado, su defensor, la víctima u ofendido o sus abogados.\nVI. HABER INTERVENIDO PREVIAMENTE EN LA INDAGATORIA O PROCESO CON DIVERSA CALIDAD. Haber intervenido previamente en la averiguación previa o proceso con el carácter de perito, testigo, defensor, abogado, Juez o Magistrado; o haber gestionado o recomendado el asunto a favor o en contra del inculpado, la víctima o el ofendido.\nARTÍCULO 49.- CALIFICACIÓN DE LA EXCUSA. Las excusas del personal adscrito a las Delegaciones serán calificadas por el Delegado correspondiente, las del personal adscrito a las diversas direcciones serán calificadas por los titulares de las mismas, las de los Directores y Delegados serán calificadas por el Fiscal Especializado que corresponda según su adscripción o etapa procedimental en que se plantee, las que promuevan los Fiscales\nEspecializados serán calificadas por el Fiscal General. El Fiscal General será irrecusable, pero cuando se encuentre corresponda suplir sus ausencias para que tome el conocimiento del asunto.\nARTÍCULO 50.- TRÁMITE DE LA EXCUSA. Cuando el funcionario que conozca del asunto estime que se encuentra en alguno de los supuestos que motiven su excusa, se abstendrá de plano de cualquier actuación, salvo aquéllas que resulten impostergables; emitirá acuerdo en el que razone la causa que le afecte y lo remitirá de inmediato, junto con las constancias que le sirvan de sustento, al funcionario a quien competa calificarla.\nEl funcionario competente, sin mayor trámite, calificará la excusa con base en las constancias que se le hubieren remitido y si la considerare procedente asignará el conocimiento del caso a otro funcionario. De lo contrario ordenará al funcionario que hubiere planteado la excusa que continúe en su conocimiento. Las resoluciones que se dicten serán irrecurribles.\nEl planteamiento y trámite de la excusa no suspenderán la continuación de la averiguación previa, en todo caso, el funcionario a quien le corresponda resolver dictará las medidas necesarias para que se continúe con las actuaciones.\nTÍTULO TERCERO.\nDEL INICIO DE LA AVERIGUACIÓN PREVIA.\nCAPÍTULO I.\nDEL CONOCIMIENTO DE LA NOTICIA DEL DELITO\nARTÍCULO 51.- CONOCIMIENTO DE LA NOTICIA DEL DELITO. Cuando el Ministerio Público tenga noticia de la comisión de un delito que sea de su competencia tendrá la obligación de investigarlo.\nSi el delito sólo se persigue por querella o condición equivalente, el deber de investigarlo existirá desde que aquellas se cumplan. Pero si el Ministerio Público o sus auxiliares llegan a practicar diligencias, éstas tendrán validez.\nLa falta de querella o condición equivalente sólo es obstáculo para perseguir el delito y por lo tanto, para el desarrollo válido del proceso.\nARTÍCULO 52.- OBLIGACIÓN DE DENUNCIAR. Quien presencie la comisión de un delito perseguible de oficio, tendrá obligación de denunciarlo ante el Ministerio Público.\nLa autoridad que en ejercicio o con motivo de sus funciones presencie la comisión de un delito perseguible de oficio, de inmediato lo comunicará al Ministerio Público; le transmitirá los datos que tenga y las constancias que hubiere levantado y pondrá a su disposición a los inculpados, si se les detuvo. salud, clínicas y en general los profesionales en medicina, así como los que ejercieren prestaciones auxiliares de éstas; cuando notaren en una persona o un cadáver señas que hagan presumible la comisión de un delito.\nARTÍCULO 53.- EXONERACIÓN DEL DEBER DE DENUNCIAR. Nadie esta obligado a formular denuncia contra su cónyuge, concubina o concubinario, persona con quien se encuentre legalmente ligado en pacto civil de solidaridad, consanguíneos dentro del segundo grado en línea recta o transversal o parientes por afinidad en ese mismo grado; salvo que se trate de delitos cometidos en contra de menores sujetos a su custodia o patria potestad; ni a denunciar legalmente el deber de guardar secreto profesional.\nARTÍCULO 54.- DENUNCIA. Denuncia es la relación de hechos posiblemente constitutivos de delito que se ponen ejercicio de sus funciones o con motivo de ellas.\nARTÍCULO 55.- QUERELLA. Querella es la expresión potestativa de voluntad que revela el deseo o intención de investigados o perseguidos. La querella sólo será necesaria en los casos en que la Ley expresamente lo determine. específicas.\nARTÍCULO 56.- LEGITIMACIÓN PARA LA PRESENTACIÓN DE QUERELLAS. Están legitimados para formular querella:\nI. EL OFENDIDO.- El ofendido o sus representantes legales cuando estos se admitan, salvo si alguno de ellos es inculpado. Además, en defecto de los anteriores, las personas o dependencias que la Ley autorice.\nCuando el ofendido tenga menos de dieciocho años de edad pero se le considere emancipado en los términos que señala el Código Civil, formulará querella por sí mismo; en caso contrario sólo la podrán formular sus representantes legales o alguno de ellos; o en su defecto las personas o dependencias que autorice la Ley.\nSi el ofendido es incapaz la querella podrá ser formulada por sus representantes o alguno de ellos y en su defecto por las personas o dependencias autorizadas por la Ley.\nII. PLURALIDAD DE OFENDIDOS EN DELITOS PATRIMONIALES. En tratándose de delitos patrimoniales en que la cosa pertenezca a varios dueños o se posea o utilice por varias personas con título legal, será suficiente la querella de cualquiera de ellas. De igual manera podrá formular querella la persona que sin ser propietaria de la cosa, la tenga bajo su poder por cualquier título legal.\nIII. PERSONAS QUE GUARDAN VÍNCULOS CON LOS OFENDIDOS CUANDO SE TRATA DE CIERTOS\nHOMICIDIOS CULPOSOS. Cuando el ofendido hubiere fallecido por homicidio culposo perseguible por querella conforme a lo dispuesto por el Código Penal, tendrá derecho a formularla:\na) Su cónyuge, concubina o concubinario o la persona con quien se encuentre legalmente ligado en pacto civil de solidaridad.\nb) Sus representantes legales, si se tratare de menores o incapaces.\nc) Sus hijos consanguíneos o adoptados.\nd) Sus padres consanguíneos o adoptantes.\ne) Sus hermanos.\nf) Sus consanguíneos en ulterior y hasta el cuarto grado, por cualquier línea. situado en ellos haya fallecido, haya sido declarado legalmente ausente o sea el inculpado.\nCuando varias personas se sitúen en el mismo nivel, cualquiera de ellas podrá concurrir a la formulación de la querella. estado de ebriedad o al influjo de estupefacientes, psicotrópicos o cualquier sustancia que produzca efectos análogos. Sin perjuicio de que al cesar la duda se recabe la querella o, en su defecto, se archive la indagatoria o se sobresea el proceso.\nIV. PERSONAS QUE GUARDAN VÍNCULOS CON LOS OFENDIDOS POR LESIONES CULPOSAS QUE\nPRODUZCAN INCAPACIDAD. Cuando con motivo de lesiones culposas el ofendido quede con incapacidad física o mental para presentar querella, podrá formularla cualquier persona, dependencia o institución que se haga cargo de su guarda y cuidados o que cubra el importe de los mismos, en el tiempo que dure su incapacidad.\nQuien formule la querella acompañará certificación médica de la incapacidad e informará al Ministerio Público el lugar en que se encuentre el lesionado, el lugar en donde este siendo atendido y el nombre de su médico tratante.\nSin estos requisitos la querella no podrá tenerse por formulada.\nEl Ministerio Público podrá en cualquier momento ordenar la practica de peritajes para determinar la existencia o terminación de la incapacidad.\nSi la incapacidad cesa y la indagatoria esta sin concluir, el ofendido deberá ratificar la querella dentro de los treinta días siguientes. De omitir hacerlo se archivará la indagatoria dejando a salvo su derecho para formularla posteriormente, para el caso de que el mismo se pueda encontrar vigente. Si la indagatoria hubiere sido consignada y no se ratifica en dicho término se sobreseerá el proceso. De ello se prevendrá a la persona que haya formulado la querella por el ofendido, desde el momento de su formulación.\nEn cualquier caso quien formule la querella tendrá los mismos derechos y obligaciones que establezca la Ley para los ofendidos y víctimas, hasta en tanto cese la incapacidad o se le nombre representante legal en términos de Ley.\nARTÍCULO 57.- INTERVENCIÓN DE APODERADOS EN DENUNCIAS O QUERELLAS. No se admitirá intervención de apoderado jurídico para formular denuncias o querellas a nombre de personas físicas.\nLas personas morales podrán actuar por conducto de apoderado general para pleitos y cobranzas, siempre y cuando concurran las condiciones siguientes: 1) El poder se otorgue por representante legal de la persona moral. 2) El poder contenga cláusula general para formular denuncias o querellas. 3) El poder se otorgue ante notario público.\nPara el poder será innecesario: 1) Acuerdo o ratificación del consejo de administración o de la asamblea de socios o accionistas. 2) Poder especial para el caso concreto. 3) instrucciones concretas del mandante. la ley o sus reglamentos autoricen; pero la formulación de querellas sólo podrá hacerse por quien posea la representación legal del Estado o del Municipio o por quien cuente con poder general para pleitos y cobranzas, otorgado en los términos señalados en el párrafo segundo de este mismo artículo. moral. Mas si quien denuncia un delito perseguible de oficio que se cometió contra persona moral, se ostenta como su representante o apoderado legal y omite acreditar su representación o poder, se entenderá que lo denuncia por su propio derecho y bajo su responsabilidad.\nARTÍCULO 58.- FORMA Y CONTENIDO DE LA DENUNCIA Y QUERELLA. Las denuncias y las querellas se pueden formular verbalmente o por escrito, pero siempre ante el Ministerio Público. En ellas se observará la prevención constitucional para el derecho de petición. circunstancias de tiempo, modo y lugar de comisión; según los haya conocido.\nLo que manifieste el denunciante o querellante se asentará en primera persona y con sus propias palabras; sin perjuicio de que el Ministerio Público asiente las aclaraciones o explicaciones que estime pertinentes. Las circunstancias de tiempo se señalaran en días calendario, si fuere posible, o por aproximaciones. El Ministerio\nPúblico podrá formular preguntas especiales al querellante o denunciante, asentando la misma seguida de su respuesta.\nCuando una denuncia o querella sea irrespetuosa o imprecisa, el funcionario que la reciba prevendrá al denunciante o querellante que la modifique o aclare, ajustándola a los párrafos anteriores. De no hacerlo se tendrá por no puesta, mas si quien incumple con la aclaración o modificación fuere funcionario público, además, se comunicará lo anterior a su superior jerárquico.\nCualquiera que sea el caso se informará al querellante o denunciante, dejando constancia escrita, que es delito conducirse falsamente ante las autoridades; o formular denuncia o querella por hechos falsos. Dicha prevención se hará al momento de la presentación de la denuncia, si fuere oral, o al ratificar la que hubiere sido presentada por escrito.\nARTÍCULO 59.- RATIFICACIÓN DE DENUNCIA O QUERELLA. Cuando la denuncia o querella se presente por escrito, quien la formule deberá ratificarla ante el Ministerio Público dentro de los treinta días siguientes a su presentación. Si no la ratifica dentro de ese plazo, ningún efecto producirá la denuncia o querella y la averiguación se podrá archivar.\nCuando la denuncia o querella fuere formulada por funcionario público en el ejercicio de sus funciones o con motivo de ellas, no será necesario que la ratifique; pero quien la reciba podrá asegurarse del carácter de quien la formule y de la autenticidad del documento en que se presente.\nSi la ratificación de la denuncia o de la querella o su modificación o aclaración se hicieren en tiempo, sus efectos se harán retroactivos al momento de la presentación de aquélla. Lo anterior también se aplicará para el caso de que la querella hubiere sido presentada por persona distinta al ofendido en los casos en que esta Ley lo permite.\n(REFORMADO PRIMER PÁRRAFO, P.O. 12 DE MAYO DE 2009)\nARTÍCULO 60.- CONOCIMIENTO DEL DELITO POR PARTE INFORMATIVO Y OTROS MEDIOS. Cuando agentes constitutivos de delito, antes que el Ministerio Público, lo comunicarán con la mayor prontitud a éste mediante parte informativo o por cualquier medio de comunicación a su alcance.\nSi se trata de medio distinto al parte informativo escrito, el Ministerio Público deberá dejar constancia de la forma en que los agentes policiales le hubieren informado los hechos de que se trate.\nSi la noticia del delito procede de una fuente no identificada o persona anónima, antes de informar al Ministerio\nPúblico, el agente de la Policía del Estado que la reciba deberá confirmarla y hacer constar por escrito el medio por el que la recibió, asentando el día, la hora y los datos que le hubieren sido proporcionados.\nCuando el Ministerio Público tome conocimiento de hechos posiblemente delictuosos, por cualquier otro medio, deberá hacer constar las circunstancias en que hubiere tenido noticia de los mismos.\nCAPÍTULO II.\nDE LAS ACTAS CIRCUNSTANCIADAS, CONSTANCIAS DE HECHOS Y ACTAS DE CONCILIACIÓN\nPRELIMINAR.\nARTÍCULO 61.- CONSTANCIAS DE HECHOS. Constancia de hechos es la relación de acontecimientos puestos en considerarlos constitutivos de delito.\nARTÍCULO 62.- SUPUESTOS EN QUE PROCEDE EL LEVANTAMIENTO DE CONSTANCIAS DE HECHOS. El\nMinisterio Público levantará constancia de hechos en los siguientes casos:\nI. PERDIDA DE DOCUMENTOS U OBJETOS. Cuando se trate de la perdida o extravío de documentos personales, identificaciones u objetos.\nII. DECESOS. Cuando se trate de decesos ocurridos por causas naturales, procesos patológicos o por las previas condiciones de salud del occiso no atribuibles a agentes externos; siempre que exista certificado médico en el que se expresen las causas de la muerte.\nIII. DECESOS O DAÑOS POR HECHOS DE LA NATURALEZA. Cuando se trate de fallecimientos o daños ocurridos a consecuencia de hechos de la naturaleza.\nIV. REFERENCIAS O ANTECEDENTES. En los demás casos en que el interesado desee hacer constar hechos como mera referencia o antecedente.\nARTÍCULO 63.- EFECTOS DEL LEVANTAMIENTO DE CONSTANCIAS DE HECHOS. El levantamiento de constancias de hechos no ameritará investigación por parte del Ministerio Público quien únicamente se limitará a expedir constancia o testimonio de ella si lo pidiere el interesado.\nLas constancias que al efecto se levanten no se consideraran como denuncias o querellas, para los efectos legales.\nARTÍCULO 64.- ACTAS CIRCUNSTANCIADAS. Son actas circunstanciadas los expedientes formados por el\nMinisterio Público con motivo del conocimiento de hechos que por sí mimos no revelen la posible comisión de delito, pero que eventualmente por el resultado de las investigaciones pudiera evidenciarse la comisión de alguno; así como los formados cuando se hagan de su conocimiento, por instancias o dependencias oficiales, hechos posiblemente constitutivos de delitos que sólo puedan ser perseguidos por querella en tanto ésta no se encuentre satisfecha.\nARTÍCULO 65.- SUPUESTOS DE PROCEDENCIA DE LAS ACTAS CIRCUNSTANCIADAS. El Ministerio Público formará acta circunstanciada sólo en los siguientes casos:\nI. PARTES INFORMATIVOS Y COMUNICADOS OFICIALES. Cuando reciba partes informativos, vistas o perseguibles por querella, en tanto la misma no se encuentre satisfecha.\nII. SUICIDIOS Y ACCIDENTES. Cuando tenga conocimiento del fallecimiento de personas por causas presuntamente derivadas de suicidios o de accidentes no motivados por hechos de tránsito.\nIII. DESAPARICIÓN DE PERSONAS. Cuando tome conocimiento de la desaparición de personas, sin que se le proporcionen datos objetivos que revelen que las mismas hubieren obedecido a causas ajenas a su libre voluntad.\nARTÍCULO 66.- EFECTOS DE LA FORMACIÓN DE ACTAS CIRCUNSTANCIADAS. En los casos previstos en la garantizar la preservación de las pruebas o evidencias, pero tendrá obligación de hacerlo siempre que se hubiere puesto a su disposición persona detenida. Si la querella no fuere presentada dentro del término de cinco días contados a partir de que se recibió el parte o comunicado, el expediente se archivara sin más tramite; sin perjuicio de que si la misma se formula posteriormente se retome su integración como averiguación previa. investigaciones a fin de determinar si los hechos son o no constitutivos de delito. Cuando conforme a las investigaciones realizadas se desprenda que los hechos no son constitutivos de delito el expediente se archivara de plano, bastando para ello acuerdo fundado y motivado del Ministerio Público. Mas si surgieren indicios de la posible comisión de delito se continuará con su integración como averiguación previa. En estos casos el archivo que se decrete estará siempre sujeto a que al aparecer nuevos elementos de prueba que permitan establecer la posible comisión de delito se retomen las investigaciones.\nEn cualquier caso las actuaciones realizadas se considerarán como Averiguación Previa para los efectos de la acción penal y para el ejercicio de las atribuciones encomendadas al Ministerio Público y se sujetarán a los requisitos y formalidades que establece la presente Ley.\nARTÍCULO 67. ACTAS DE CONCILIACIÓN PRELIMINAR. EL Ministerio Público formará actas de conciliación preliminar cuando se le denuncien hechos que aún pudiendo ser eventualmente constitutivos de los delitos de injurias, amenazas, calumnia, difamación, lesiones levísimas no calificadas o robo simple de menor cuantía, el ofendido o víctima acepten expresamente someterse a conciliación ante el propio Ministerio Público.\nEn estos casos el Ministerio Público levantará constancia de los hechos denunciados y procederá a citar al inculpado convenido y se archivará lo actuado. En caso contrario procederá a la integración de la averiguación previa que corresponda.\nTÍTULO CUARTO.\nDE LAS FORMAS EN LA INTEGRACIÓN DE LA AVERIGUACIÓN PREVIA.\nCAPÍTULO I.\nFORMAS GENERALES DE LAS ACTUACIONES, DILIGENCIAS Y PROVEIDOS MINISTERIALES.\nARTÍCULO 68.- MOMENTO EN QUE PUEDEN PRACTICARSE LAS DILIGENCIAS. Las actuaciones y diligencias del Ministerio Público y sus auxiliares podrán practicarse a toda hora y aún en días inhábiles, sin necesidad de previa habilitación. hayan señalado, se hará constar la razón por la cual no se practicó.\nARTÍCULO 69.- FORMA DE HACER CONSTAR LAS ACTUACIONES Y DILIGENCIAS. Para hacer constar las actuaciones y diligencias el Ministerio Público utilizará la forma escrita, por medio mecanográfico, electrónico o equivalente o por simple escritura a mano. En cualquier caso, además de agregar al expediente el documento escrito o impreso de las constancias que hubiere levantado o de los documentos que se le hubieren entregado, procurará que quede registro electrónico de las mismas.\nPodrá emplear también cualquier medio que tenga por objeto reproducir sonidos, imágenes o imágenes con sonido, empleando preferentemente grabación magnetofónica o de audio video, pero en ellas deberá narrase o describirse lo acontecido. En estos casos el Ministerio Público deberá levantar acta por escrito en la que hará constar: el objeto de la actuación o diligencia, el lugar, hora, día, mes y año en que se efectúe; las personas y el carácter con que intervienen, el medio empleado para su reproducción, las incidencias que se presenten al maniobrar u operar dicho medio; así como la forma empleada para embalar e identificar la cinta, disquete o instrumento en que se hubiere registrado la diligencia. Dicha acta se levantará por cuadruplicado durante la actuación o diligencia y deberá ser firmada por las personas que en ella intervengan, conforme a lo que esta Ley establece para las firmas y huellas digitales. La cinta, disquete o instrumento en que se hubiere registrado la diligencia se respaldará o reproducirá en tres tantos más, utilizando instrumentos de la misma naturaleza y características, cada uno de los cuales se agregarán a los expedientes que se hubieren formado con motivo de la indagatoria. El instrumento original se embalará de manera que se impida su alteración, se identificará en forma que permita su correlación con la acta que se hubiere levantado y se resguardará en lugar seguro junto con un tanto del acta que se hubiere levantado. Cuando se haga necesaria la consulta de lo actuado en la diligencia se empleará cualquiera de los duplicados o respaldos agregados a los expedientes. La consulta o reproducción del instrumento original sólo podrá realizarse por mandato de autoridad judicial, observándose las medidas necesarias para impedir su alteración y levantándose constancia de ello.\nSalvo que se trate de inspecciones o reconstrucciones de hechos en las que bastará el levantamiento del acta a que se refiere el párrafo anterior; dentro de los cinco días siguientes a la fecha en que se hubiere desahogado la diligencia, el Ministerio Público deberá transcribir íntegramente el contenido de la grabación que se hubiere realizado, en la que hará constar lo que se diga y acontezca en la misma, identificando por su nombre, y apellidos a las personas cada que hagan uso de la voz, a menos de que, si se trata del inculpado, no sea posible su identificación o la misma sea dudosa, en cuyo caso bastará referirse a él como inculpado. Dicha trascripción deberá ser firmada por los que hubieren intervenido en la diligencia, pero bastará la firma del Ministerio Público para que tenga validez, siempre que se hubiere cumplido con lo dispuesto en el párrafo anterior.\nTodo lo que digan las personas que aparecieren en la grabación o lo que se diga de ellas en la misma, se tendrá por no manifestado cuando no se hubiere asentado razón de su intervención en el acta respectiva.\nLas grabaciones y transcripciones realizadas en contravención a lo dispuesto por este artículo, carecerán de valor.\nSin perjuicio de lo anterior, en cualquier caso el Ministerio Público podrá adicionalmente video grabar o tomar imágenes o sonidos de las actuaciones que levante en forma escrita.\nARTÍCULO 70.- USO DEL ESPAÑOL. En las actuaciones y diligencias se empleará el español. Las promociones, informes, dictámenes y escritos que se dirijan al Ministerio Público se redactarán en ese mismo idioma. Carecerán de validez las actuaciones que consten en otro idioma, si no están acompañadas de su traducción.\nLos documentos que se presenten en otro idioma se acompañarán con su traducción al español, de lo contrario ningún efecto producirán. En cualquier caso, si el Ministerio Público lo estima necesario ordenará su traducción por medio de perito.\nARTÍCULO 71.- INTERVENCIÓN DE TRADUCTORES E INTÉRPRETES. Cuando la persona con quien se entienda la diligencia no hable español, el Ministerio Público designará uno o más traductores mayores de edad observando los procedimientos para la designación de peritos. Si no hay traductor de esa edad, podrá designarse a quien tenga dieciséis años o más.\nSi la persona con quien se entiende la diligencia es sordo, mudo o sordomudo y no sabe leer ni escribir, se le nombrará interprete a cualquier persona con quien pueda hacerse entender. En este caso quien funja como interprete protestará interpretar fielmente las preguntas, respuestas y manifestaciones que se transmitan.\nA los sordos, mudos y sordomudos que sepan leer y escribir se les interrogará por escrito y producirán sus respuestas de igual forma.\nARTÍCULO 72.- BREVETE. En el acta o documento en que conste cada actuación o diligencia se agregará un brevete inicial que indique el objeto de la misma. Más aquella tendrá valor si se omite éste.\nARTÍCULO 73.- CONTENIDO DE LAS ACTAS Y PROVEIDOS MINISTERIALES. Las actas y proveídos ministeriales contendrán la relación de lo que acontezca durante el desarrollo de la diligencia que hagan constar o, en su caso, el razonamiento o sentido de lo acordado o resuelto. En unos y otras se consignarán y se dará cumplimiento a los requisitos y formalidades que para el deshogo específico de la diligencia o la emisión del proveído establezca la presente Ley; pero en cualquier caso se hará constar el lugar, la hora y fecha en que se hubiere efectuado el acto que consignen, así como el nombre, apellidos, dirección y teléfono de las personas que intervengan en ellas; salvo que se trate del Ministerio Público quien sólo asentará su nombre y apellidos.\nQuienes comparezcan a las diligencias deberán identificarse con documento oficial o por cualquier otro medio que autorice la Ley, pero si se trata de denunciantes, querellantes o testigos deberán acompañar además comprobante de domicilio para el caso de que el que hubieren proporcionado no se corresponda con el asentado en la identificación que presenten.\nEl Ministerio Público agregará a la indagatoria copia certificada de las identificaciones y comprobantes de domicilio que se le hubieren presentado.\nARTÍCULO 74.- GENERALES DE LOS COMPARECIENTES Y SEÑALAMIENTO DE DOMICILIO. Los ofendidos, inculpados, defensores, abogados, testigos, peritos y demás personas que intervengan en cualquier acto de la averiguación previa, darán sus nombres, apellidos, domicilio y teléfono, desde la primera diligencia en que intervengan o escrito que presenten. Pero en todos los actos deberán identificarse en los términos que señala esta\nLey.\nTendrán obligación de comunicar el cambio o error en cualquiera de ellos, a las autoridades ante las que intervinieron.\nARTÍCULO 75.- RESERVA DE IDENTIDAD. Cuando la diligencia que se haya de practicar pueda exponer a quien figure como denunciante, captor, ofendido, víctima o testigo, a un daño o peligro grave para su persona o la de sus allegados, se podrá reservar la identidad del compareciente y se le dará la protección que resulte conveniente. Para ello se usarán todos los medios jurídicos, materiales y técnicos disponibles. trate, pero sin asentarse ningún dato que identifique a la persona, salvo su huella dactilar; consignándose en ella razón de que se levanta bajo reserva de identidad.\nEn estos casos el Ministerio Público deberá, además, levantar acta por separado en la que asentará el nombre, apellidos, domicilio, teléfono y demás datos de identificación de la persona que interviene bajo reserva; así como los datos que permitan correlacionarla con la diligencia y expediente correspondientes. Dicha acta deberá ser firmada por los que hubieren participado en la diligencia, con sujeción a lo dispuesto por esta Ley para las firmas y huellas digitales. La constancia que así se levante se colocará, junto con la copia de los documentos de identificación de los comparecientes y un tanto de la diligencia desahogada, en un sobre cerrado con cintilla de pegar, colocándole los sellos de tal forma que impidan su violación y se resguardará en lugar seguro, poniéndola a disposición del Juez correspondiente cuando la indagatoria sea consignada.\nLa reserva sólo podrá ser levantada por la Autoridad Judicial en los supuestos y bajo los términos que la Ley prevea; pero en cualquier caso el Ministerio Público, con la autorización expresa del Fiscal General, podrá, durante el proceso, renunciar o desistirse del medio de prueba o de la diligencia que haya desahogado bajo reserva de identidad, cuando considere que las condiciones de riesgo o peligro para el compareciente subsistan.\nLa reserva de identidad sólo procederá cuando se trate de delitos graves.\nLa reserva de identidad del Agente del Ministerio Público y de los Policías se sujetará a los mismos términos, pero deberá ser previamente autorizada por el Fiscal General.\nARTÍCULO 76.- FIRMAS Y HUELLAS DIGITALES. Quienes intervengan en las diligencias firmarán inmediatamente al margen y al calce de cada una de las hojas en que se hubieren hecho constar las mismas. Pero para su validez bastará que firmen una sola vez en cualquier lugar de la hoja en que conste la diligencia, salvo que se acredite que la misma fue alterada con posterioridad al momento en que firmó.\nSi el compareciente o interviniente no supiere o no pudiere firmar imprimirá cualquiera de sus huellas digitales en los mismos términos dispuestos para las firmas. Si tampoco ello fuere posible, firmarán a su nombre dos personas que se encuentren en el lugar en que se desarrolle la diligencia, debidamente identificadas. En cualquier caso se harán constar en el acta dichas circunstancias.\nCuando el compareciente o interviniente se negare a firmar o, en su caso, a imprimir su huella digital, se asentará razón de ello.\nSi se estima conveniente, la persona que hubiere firmado el acta, podrá también imprimir su huella digital.\nEl Ministerio Público firmará al calce y, si lo considera conveniente, lo hará también al margen.\nARTÍCULO 77.- ENMENDADURAS. En las actas y proveídos que levante o emita el Ministerio Público, así como en las promociones, informes, dictámenes y escritos que se le dirijan, se evitarán las abreviaturas y raspaduras. De igual manera se evitará alterar las palabras con error, sobre ellas sólo se pondrá una línea delgada que permita su lectura. De lo contrario carecerá de valor lo que se abrevie, raspe o altere; sin perjuicio de que por cualquier otro medio se acredite el sentido real de lo que aparezca abreviado, raspado o alterado. Las fechas y cantidades se asentarán con letra.\nLos errores en la hora, fecha, lugar y nombres de las personas que intervinieren en las diligencias o que se encontraren referidos en los proveídos ministeriales, podrán ser rectificados en cualquier momento por el Ministerio\nPúblico, siempre que se levante constancia de ello; la que deberán firmar las personas que hubieren intervenido o que se hubieren referido en el acto motivo de la rectificación. En estos casos, se dará vista de la rectificación al que a sus intereses convengan.\nARTÍCULO 78.- RECTIFICACIÓN DE MANIFESTACIONES. Las rectificaciones que hagan quienes intervinieren en las diligencias se harán constar antes de que firmen o pongan sus huellas en las actas correspondientes. Si la rectificación se hace después, pero antes de retirarse los interesados, se asentará la rectificación en actuación o diligencia inmediata y firmaran el acta los que en ella intervinieron, en la forma que señala esta Ley.\nLas rectificaciones que se hagan fuera de los supuestos señalados podrán hacerse en cualquier momento, pero siempre se harán constar en acta levantada para el efecto. En estos casos, para valorar lo que se hubiere rectificado, se atenderá al apoyo que le presten los demás medios de prueba que obren en la indagatoria.\nARTÍCULO 79.- PRESENTACIÓN DE PROMOCIONES POR ESCRITO. Las promociones que por escrito se presenten o dirijan al Ministerio Público por cualquiera de los interesados, deberán contener la firma autógrafa o la huella digital de su autor. De lo contrario ningún efecto producirán.\nEl Ministerio Público podrá ordenar su ratificación cuando lo estime necesario, pero deberá hacerlo en los casos que esta Ley expresamente lo disponga.\nLos escritos ilegibles serán inadmisibles, pero si quien aparece como su autor es el inculpado y se encuentra preso, el Ministerio Público lo llamará para que haga su petición por comparecencia.\nLos escritos y promociones deberán presentarse por triplicado. Los interesados podrán presentar una copia más de sus escritos para que se les devuelva con firma, sello y anotación de la hora y fecha de su presentación.\nARTÍCULO 80.- PRESENTACIÓN, CERTIFICACIÓN Y DEVOLUCIÓN DE DOCUMENTOS. Quienes presenten documentos para su anexión a la indagatoria lo harán por triplicado. Si sólo uno de ellos fuere original el Ministerio\nPúblico hará el cotejo y certificación de los restantes; sin perjuicio de que el presentante los exhiba en copias certificadas por fedatario público. Cuando ninguno de los documentos sea original el Ministerio Público asentará razón de ello en cada uno de los tantos que se le presenten.\nLos interesados podrán pedir, por escrito o por comparecencia, la devolución de los documentos que presenten a la indagatoria, pero para ello será necesario que exhiban un tanto más de los mismos a fin de que el Ministerio Público proceda a su cotejo y certificación. Si los documentos fueron previamente incorporados al expediente y contaren con sus folios correspondientes, se asentará razón de ello en la certificación que se haga y los documentos certificados se anexarán en el espacio que hubiere dejado los que sean objeto de la devolución, evitando la alteración en la continuidad de los folios. Para que proceda la devolución de documentos será necesario que quien los reciba proteste presentarlos al Ministerio Público o a la Autoridad Judicial cuantas veces se le requiera.\nEn ningún caso se devolverán documentos que deban ser objeto de peritaje o cuando hayan sido el medio u objeto sobre el que recayó la conducta presuntamente delictiva; hasta en tanto haya quedado firme la determinación de no ejercicio de acción penal o se haya consignado la indagatoria, en cuyo caso la Autoridad Judicial resolverá lo conducente.\nARTÍCULO 81.- RECEPCIÓN DE PROMOCIONES Y DOCUMENTOS. Las promociones que se hagan por escrito, así como los documentos que se pretenda incorporar a la indagatoria, deberán presentarse en la oficialía de partes o directamente al Agente del Ministerio Público que corresponda. En cualquier caso el funcionario que reciba la promoción o documentos asentará sobre los mismos la fecha y hora en que le fueron presentados, el número de fojas en que consten, el nombre de la persona que los presente y una breve identificación de los documentos recibidos; firmando enseguida la razón que hubiere asentado. Si quien recibe es personal de la oficialía de partes, dirigidos.\nARTÍCULO 82.- INTEGRACIÓN DEL EXPEDIENTE. Las constancias y actas de las diligencias; así como las promociones, escritos, documentos y proveídos, se asentarán en los expedientes en forma continua, sin dejar hojas o espacios en blanco o sin testar. Los proveídos que emitan instancias o funcionarios diversos al Agente encargado de la indagatoria, que guarden relación con ella, se anexarán en la misma forma.\nLas constancias que obren en la indagatoria se glosarán preferentemente en su orden cronológico, se foliarán y sellarán, además de rubricarse por el Ministerio Público. Cuando las constancias o documentos anexados al expediente sean numerosos, a juicio del funcionario, podrán glosarse y foliarse por aparte, pero siempre de forma que permita su identificación y correlación con el expediente principal.\nARTÍCULO 83.- ACTUACIÓN POR TRIPLICADO. Los expedientes se llevarán por triplicado. En cada uno de ellos se anexara un tanto de las actuaciones, escritos, promociones y documentos que se hubieren desahogado o presentado a la indagatoria. Cuando sólo uno de los tantos sea original, se hará el cotejo y certificación de las copias que se hubieren obtenido o presentado. Si los documentos allegados a la indagatoria excedieren de quinientas fojas, bastará que se anexen a dos de los expedientes formados, siempre que exista u obre copia auténtica de los mismos en los archivos de cualquier dependencia u oficina pública.\nARTÍCULO 84.- ACUMULACIÓN Y DESGLOSE DE EXPEDIENTES. Cuando el Ministerio Público tome conocimiento de diversos hechos de igual o similar naturaleza cometidos por un mismo inculpado o con su participación, podrá investigarlos en la misma o distintas indagatorias. De igual manera podrá acumular o desglosar las que estuviere integrando para el sólo efecto de facilitar sus investigaciones. En cualquier caso deberá respetarse la garantía de defensa del inculpado y darle acceso a las constancias que correspondan, conforme a lo dispuesto por esta Ley.\nPara los efectos del ejercicio de la acción penal el Ministerio Público se sujetará a lo que dispongan esta Ley y el\nCódigo de Procedimientos Penales.\nARTÍCULO 85.- PÉRDIDA Y REPOSICIÓN DE EXPEDIENTES O CONSTANCIAS. Cuando no se encuentre un expediente o constancia dentro de los diez días siguientes a que el Ministerio Público tenga conocimiento de su desaparición o extravío, el funcionario encargado de su integración levantará acta certificando su existencia y falta posterior.\nSi existiere alguno de los expedientes formados por triplicado u obre agregado a alguno de ellos un tanto de la constancia de que se trate, el Ministerio Público procederá a obtener copias de uno u otra, las que, previo cotejo, certificará y tendrá como expediente o constancia de reposición con los mismos efectos que si se tratare del extraviado.\nCuando hubieren desaparecido todos los tantos con que cuente el Ministerio Público, se procederá a abrir un periodo de diez días para que el Ministerio Público recabe y los interesados aporten las constancias o registros con que cuenten o que obren en poder de otras instancias o dependencias. Para el efecto podrán obtenerse impresiones de los registros electrónicos de las diligencias que obren en las bases de datos con los que se cuente. Las constancias que se aporten o se logren obtener deberán ser reconocidas y ratificadas por quienes en ellas hubieren intervenido para que se tengan por repuestas. Si las mismas no fueren reconocidas ni ratificadas deberán practicarse nuevamente. El acuerdo que ordene la apertura de dicho periodo deberá notificarse en forma debida al inculpado, a su defensor, al ofendido y en su caso a la víctima. Si con posterioridad apareciere el expediente extraviado se\nARTÍCULO 86.- RESERVA DE LA AVERIGUACIÓN PREVIA Y EXPEDICIÓN DE COPIAS. Todas las actuaciones de la Averiguación Previa serán reservadas, salvo para el inculpado, defensor, ofendido y víctima, quienes podrán imponerse de las constancias en presencia del Ministerio Público y con sujeción a lo dispuesto por los artículos 24 y\n29 de esta Ley. por determinación de no ejercicio de acción penal que quede firme o por mandamiento judicial. Igualmente podrá razone la necesidad y los fines de su obtención. En este último caso el Delegado o el funcionario que determine el\nFiscal General, determinará si procede o no su autorización.\nARTÍCULO 87.- AUDIENCIAS. En las audiencias solo estarán presentes quienes deban intervenir en ellas. Durante las mismas no se permitirán fotografías, ni grabaciones de video o similares; salvo cuando se dispongan por el propio Ministerio Público para constancia o respaldo de aquéllas.\nCAPÍTULO II.\nDE LOS PROVEIDOS, PEDIMENTOS Y MANDAMIENTOS MINISTERIALES\nARTÍCULO 88.- ÓRDENES. El Ministerio Público podrá emitir órdenes a sus auxiliares y personal dependiente, sin necesidad de sujetarse a formalidad alguna ni de que las mismas obren por escrito; salvo lo que expresamente disponga la Ley según el mandamiento de que se trate.\nEn los mismos términos podrá tomar todas las providencias que se requieran para el desahogo de sus diligencias y actuaciones; sin perjuicio de que, si la Ley precisa requisitos especiales para aquéllas, dentro de las veinticuatro horas siguientes se glose el mandamiento escrito en forma debida.\nARTÍCULO 89.- DECRETOS. Para cuestiones de mero trámite que no impliquen una especial valoración jurídica, el\nMinisterio Público emitirá decretos; los que deberán obrar por escrito siempre que sea necesario establecer el origen, motivo o circunstancias de incorporación a la indagatoria de documentos, escritos o diligencias.\nARTÍCULO 90.- ACUERDOS. Para cualquier otra medida, resolución o mandamiento que implique una especial valoración jurídica el Ministerio Público emitirá acuerdos por escrito, los que deberán estar debidamente fundados y motivados.\nARTÍCULO 91.- REQUERIMIENTOS. Si el mandamiento de que se trate implica requerimiento de cumplir determinado acto, el acuerdo que se emita deberá especificar el acto cuyo cumplimiento se requiera, el término otorgado para ello y las prevenciones y medidas de apremio a emplear para el caso de incumplimiento sin causa justificada. Dicho acuerdo podrá ser notificado a la persona sujeta al requerimiento mediante transcripción del proveído correspondiente en lo que resulte conducente o a través de oficio que cumpla con los requisitos señalados en la presente disposición.\nEn cualquier caso, cuando sea necesario para la preservación de posibles pruebas o evidencias o cuando las circunstancias de urgencia así lo ameriten, el Ministerio Público podrá formular sus requerimientos en forma verbal, pero dentro de las veinticuatro horas siguientes deberá glosar a la indagatoria el mandamiento escrito en forma debida.\nARTÍCULO 92.- VISTAS. Cuando el Agente del Ministerio Público que conozca de la integración de una acción penal, emitirá vista por escrito que deberá contener, cuando menos: la clasificación técnica del delito por el que considere que debe ejercitarse la acción penal, incluyendo sus modalidades; la identificación de las personas que estime como probables responsables y sus formas de intervención; así como el razonamiento correlacionado con las pruebas que obren en la indagatoria, con el que pretenda acreditar dichos extremos. Dicha vista se remitirá, junto con el expediente integrado en debida forma, al Agente del Ministerio Público a quien corresponda ejercitar la acción penal.\nSi el Agente del Ministerio Público estima que lo procedente es determinar el no ejercicio de la acción penal, emitirá vista por escrito que deberá contener, cuando menos: la clasificación técnica del delito que hubiere sido susceptible de configurarse, incluyendo sus modalidades; la causal por la que considere deba determinarse el no ejercicio de la acción penal; así como el razonamiento correlacionado con las pruebas que obren en la indagatoria, con el que pretenda acreditar dichos extremos. Dicha vista se remitirá, junto con el expediente integrado en debida forma, al funcionario a quien corresponda determinar el no ejercicio de la acción penal. de medios probatorios, emitirá vista y la remitirá junto con el expediente al Coordinador o al funcionario que designe el Fiscal General, para los efectos de su aprobación.\nEl funcionario a quien corresponda resolver respecto de las vistas referidas en los párrafos anteriores, podrá satisfacen los requisitos señalados en la presente disposición, para lo cual bastará acuerdo que señale las deficiencias que hubiere detectado, pudiendo ordenar en el mismo su subsanación o reposición.\nLas vistas que en cualquier supuesto emita el Agente del Ministerio Público no vincularán la decisión del funcionario a quien corresponda resolver, por lo que el mismo podrá pronunciarse en sentido diverso, variar la clasificación técnica-legal del delito, excluir a los que se hubiere señalado como probables responsables o incluir a otros no mencionados, considerar otras formas de participación o causales de no ejercicio de acción penal; así como atender a cuestiones no consideradas en las vistas.\nLo dispuesto en el presente artículo no será aplicable cuando el propio Agente del Ministerio Público sea quien deba ejercitar acción penal o quien deba resolver en definitiva el no ejercicio de la acción penal.\nARTÍCULO 93.- DETERMINACIONES. Cuando el Ministerio Público deba ejercitar acción penal o declarar su no ejercicio emitirá determinación por escrito, fundada y motivada en debida forma.\nLa determinación de ejercitar acción penal se entiende implícita en el pedimento correspondiente, por lo que deberá sujetarse a lo dispuesto por el Código de Procedimientos Penales.\nLa determinación de no ejercicio de acción penal deberá ser emitida por el funcionario que esta Ley autorice para el efecto, contener los razonamientos que se hubieren tomado en cuenta para ello y ajustarse a lo establecido por esta\nLey para la emisión de dicha clase de determinaciones.\nCualquiera que sea el caso, no será necesario que la resolución o pedimento haga referencia o contenga razonamientos relativos al contendido de la vista que, eventualmente, se hubiere formulado.\nARTÍCULO 94.- CITATORIOS. El Ministerio Público citará a las personas que deban intervenir en las diligencias presentación. El personal que se encuentre bajo su mando podrá ser citado mediante simple orden emitida en los términos de lo dispuesto por el artículo 88 de esta Ley.\nToda persona deberá presentarse ante el Ministerio Público cuando se le cite, salvo cuando esté impedida por enfermedad u otra causa física que se acredite. Cuando se trate de altos servidores públicos federales, estatales y municipales, se les podrá pedir que informen por escrito o se acudirá a su lugar de trabajo para practicar la diligencia en forma reservada; salvo que los mismos figuren como inculpados en la indagatoria.\nCualquiera que sea la forma por la que se opte para emitir los citatorios, siempre deberá prevenirse al citado que si omite comparecer se ordenará su presentación por medio de la fuerza pública.\nLa emisión de citatorios podrá hacerse sin necesidad acuerdo o decreto previo, salvo cuando se trate de personas que no aparezcan referidas en la indagatoria.\nARTÍCULO 95.- CITATORIOS POR MEDIO DE CEDULA. Los citatorios podrán girarse mediante cédula, que deberá contener:\nI. NOMBRE Y DOMICILIO. El nombre, apellido, domicilio y/o lugar en que trabaje la persona a quien se cita.\nEn caso de ignorarse alguno de estos datos: los que se tengan para identificarlo.\nII. AUTORIDAD. La autoridad ante la que se deba presentar.\nIII. DIA Y LUGAR. El día, hora y lugar en que deba presentarse.\nIV. CALIDAD EN QUE SE CITA. El carácter con el que deba intervenir en la diligencia de que se trate y los datos de identificación del expediente en que se actúe.\nV. PREVENCIONES Y APERCIBIMIENTOS. La prevención de que si no comparece se ordenará su presentación mediante el uso de la fuerza pública, la medida de apremio que, sin perjuicio de lo anterior, habrá de aplicarse y, además, la prevención de que podrá iniciarse en su contra averiguación previa por el delito de desacato.\nVI. FIRMA. La firma y el carácter del funcionario que ordena la citación, así como el sello correspondiente. Si la cedula se envía por telegrama, la constancia de la firma.\nEl citatorio emitido en forma de cédula deberá ser entregado en forma personal o mediante mensajería, correo con acuse de recibo, telégrafo o por cualquier otro medio que deje constancia de su recepción. La cedula deberá ser entregada cuando menos con veinticuatro horas de anticipación al momento señalado para el desahogo de la diligencia de que se trate. En cualquier caso la cedula se emitirá, cuando menos, por duplicado, a fin de que en uno de los tantos se asienten las incidencias de su envío o entrega y se agregue a la indagatoria en que se actúe.\nCuando se opte por la forma personal, el citatorio podrá ser entregado por conducto del Ministerio Público o cualquiera de sus auxiliares, de notificador o del propio interesado. En estos casos la cedula se entregará al destinatario en el lugar donde se le localice, recabándose su firma o huella digital con los datos de la fecha, hora y lugar de recepción; mas si el destinatario no pudiere o no quisiere firmar o imprimir su huella, se hará constar dicha circunstancia en el duplicado de la cedula. Si el destinatario no fuere localizado, pero exista certeza de que su domicilio o lugar de trabajo corresponde al señalado en la cedula, el citatorio se entregará a cualquier persona que habite o trabaje en cualquiera de ellos; quien reciba la cédula deberá proporcionar su nombre y apellidos y firmar o imprimir su huella digital en el duplicado de la misma; pero si se negare a proporcionar sus datos o a recibir la cédula, la misma se fijará en el sitio de acceso. En todo caso las incidencias que se presenten durante la entrega de la cedula y las circunstancias a que se atienda para proceder en cualquiera de las formas señaladas, deberán hacerse constar en el duplicado correspondiente, junto con los datos de identificación de la persona que realice su entrega; pero si quien la realiza no es el Ministerio Público o notificador con nombramiento debidamente expedido, será necesario que se recaben, además, los datos de cuando menos una persona que hubiere atestiguado las incidencias y circunstancias de la entrega.\nCuando la cedula sea entregada por el interesado, éste deberá entregar el duplicado al Ministerio Público antes de la fecha y hora que se hubiere señalado para el desahogo de la diligencia de que se trate.\nEn cualquier caso, quien tuviere a su cargo la entrega de la cedula informará al Ministerio Público cuando no hubiere podido realizarla, señalándole los motivos de ello. El incumplimiento de lo anterior dará lugar a la aplicación de medidas disciplinarias; pero si se trataré del interesado y el mismo hubiere sido quien ofreció el medio de prueba que motivó la citación, podrá decláresele desierto dicho medio de prueba.\nSi se opta por otro de los medios autorizados para la entrega de la cedula, deberá asentarse en el duplicado de la misma el tipo de medio empleado y los datos de su envío; el cual se anexará a la indagatoria junto con el documento que acredite su recepción. domicilio o lugar de trabajo del citado, o cuando los mismos no correspondan a los asentados en la misma.\nARTÍCULO 96.- CITATORIOS A MILITARES Y EMPLEADOS PUBLICOS. Los militares y empleados públicos podrán ser citados por conducto de sus superiores jerárquicos, mediante debido oficio dirigido a éstos. citado, requiriéndole dicte las medidas necesarias para lograr su presentación.\nARTÍCULO 97.- CITACIÓN POR TELEFONO Y OTROS MEDIOS. Cuando lo estime necesario el Ministerio Público podrá hacer las citaciones por teléfono o por cualquier otro medio que permita la transmisión efectiva de la cita. En estos casos se levantará constancia en la que se hará constar el medio utilizado y la fecha y hora en que se hubiere realizado, sin que sea necesario emitir cedula alguna.\nARTÍCULO 98.- ÓRDENES DE PRESENTACIÓN. Cuando se trate de delito flagrante o detención por caso urgente, cuando el inculpado se encuentre sujeto a arraigo o cuando la urgencia del caso así lo requiera; el ministerio público podrá ordenar la presentación de las personas que deban intervenir en las diligencias sin necesidad de girarles citatorio previo. Podrá también ordenar la presentación de las personas que habiendo sido previamente citadas en los términos de lo dispuesto por los artículos 93, 94, 95 y 96 de esta ley, hubieren omitido comparecer sin causa justificada, en la fecha y hora señalada para el efecto.\nEn cualquier caso la emisión y ejecución de las órdenes de presentación se sujetarán a lo siguiente:\nI. NECESIDAD DE ACUERDO. El Ministerio Público deberá emitir acuerdo debidamente fundado y motivado que razone, en su caso, la urgencia de la medida o el incumplimiento del citatorio previamente enviado.\nSi la orden de presentación deriva del incumplimiento a citatorio previamente emitido, deberá, además, obrar constancia del incumplimiento o del no desahogo de la diligencia de que se trate.\nSi fuere el caso, en el propio acuerdo podrán hacerse efectivas las medidas de apremio y prevenciones que se hubieren formulado.\nII. FORMA ESCRITA. La orden de presentación deberá constar por escrito en el que se transcriba el acuerdo correspondiente o el extracto del mismo que resulte conducente y deberá contener, además: la autoridad a quien se encomiende su ejecución, los datos que permitan identificar a la persona que habrá de ser presentada y el carácter con el que deberá comparecer, los datos de identificación de la indagatoria en que se actúe, la autoridad ante la que habrá de presentársele y la firma y sellos de la autoridad emisora.\nIII. USO DE LA FUERZA PÚBLICA. La orden de presentación supone la autorización para el empleo de la fuerza pública, por lo que la comparecencia de la persona contra quien se hubiere emitido podrá realizarse aún en contra de su voluntad. que funjan como auxiliares del Ministerio Público. presentación se le hubiere encomendado; si ésta lo solicita, le proporcionará copia de la misma.\nPúblico mediante parte informativo. Si no hubiere sido posible lograr la presentación dentro de las cuarenta y ocho horas siguientes a su emisión, el encargado de su ejecución lo informará en forma razonada y por escrito al\nMinisterio Público, quien resolverá si insiste en su cumplimentación o si la deja sin efectos. El ministerio Público podrá acortar dicho término cuando se trate de casos cuya urgencia así lo amerite.\nSe practicará examen de integridad física, cuando así lo solicite el interesado o el Ministerio Público lo estime conveniente.\nV. EFECTOS. La persona que hubiere sido presentada en los términos de este artículo sólo intervendrá con el carácter con el que se le hubiere hecho comparecer y únicamente en la indagatoria en que se hubiere emitido la orden; salvo lo que expresamente autorice el presentado.\n(REFORMADO, P.O. 12 DE MAYO DE 2009)\nSin sujeción a lo dispuesto en este artículo, la Policía del Estado podrá presentar a cualquier persona cuando ésta así se lo solicite o acceda voluntariamente a ello.\nARTÍCULO 99.- REQUERIMIENTOS, CITATORIOS Y ORDENES DE PRESENTACIÓN CUANDO SE TRATE DE\nMENORES. Cuando el sujeto a requerimiento, citatorio u orden de presentación sea menor de dieciocho años y no se encuentre emancipado en los términos del Código Civil; el mandamiento o actuación ministerial se entenderá con sus representantes legales, a quienes, además, se dirigirán las prevenciones, apercibimientos y medidas de apremio que resulten conducentes.\nARTÍCULO 100.- REQUERIMIENTOS Y CITATORIOS CUANDO SE TRATE DE REPRESENTANTES LEGALES\nDE PERSONAS MORALES. Cuando el requerimiento o citatorio se dirija a representante legal de persona moral y se desconozca su identidad; el mandamiento o actuación ministerial se entenderá con el encargado de la oficina en que se lleven a cabo o de cualquier establecimiento de dicha persona moral. En estos casos el encargado de la oficina o establecimiento deberá proporcionar de inmediato los datos de identificación de la persona que funja como representante legal y tomar las medidas necesarias para que el mismo se haga presente en el lugar o cumpla con lo ordenado; de lo contrario las prevenciones, apercibimientos y medidas de apremio que resulten conducentes se dirigirán y entenderán con ella. De todo lo anterior se levantará constancia.\nARTÍCULO 101.- PROMOCIONES JUDICIALES. Durante la averiguación previa el Ministerio Público podrá solicitar la intervención de la Autoridad Judicial para la autorización de los actos o el desahogo de las diligencias que esta\nLey prevea, sin necesidad de ejercitar acción penal. En estos casos la promoción deberá formularse por escrito debidamente firmado por el Agente del Ministerio Público que solicite la intervención, en el que deberá precisar la medida solicitada y razonar la necesidad de la misma, además de cumplir con los requisitos según el tipo de acto o medida de que se trate.\nCuando se trate de delitos graves, se esté dentro de los términos de la flagrancia y la urgencia del caso impida cumplir o acreditar los extremos necesarios para la autorización del acto o medida solicitada; bastará que el\nMinisterio Público motive su urgencia y que acompañe parte informativo que le sirva de sustento, para que el Juez obsequie lo solicitado; pero dentro de las veinticuatro horas siguientes el Ministerio Público deberá cumplir con los requisitos que hubieren sido necesarios, para que el Juez pueda engrosar su mandamiento o acuerdo en debida forma. siguientes a la recepción de la solicitud. En cualquier caso todos los días y horas serán hábiles, sin necesidad de previa habilitación.\nARTÍCULO 102.- EJECUCIÓN DE MANDAMIENTOS JUDICIALES. Los mandamientos y acuerdos judiciales cuya ejecución corresponda al Ministerio Público o sus auxiliares, serán transmitidos por conducto del Agente del del que deriven, quien proveerá lo necesario para que se acaten en sus términos.\nLas órdenes de aprehensión, reaprehensión y comparecencia será entregadas al Ministerio Público dentro de los siete días siguientes a su emisión, quien de inmediato las remitirá al Coordinador o funcionario que determine el\nFiscal General a fin de que asigne su cumplimentación a los Agentes de Policía del Estado que correspondan y de seguimiento a su ejecución. Los Agentes de Policía del Estado deberán identificarse debidamente al ejecutar dichas ordenes y dispensar un trato adecuado a los sujetos a las mismas.\n(REFORMADO, P.O. 12 DE MAYO DE 2009)\nLos agentes de Policía del Estado deberán informar al funcionario encargado de su seguimiento, dentro de las veinticuatro horas siguientes, las incidencias a motivos que hubieren impedido su ejecución. En su caso, dicho funcionario verificará cada treinta días el estado de las órdenes que se encuentren pendientes de cumplimentación y podrá reasignarlas a otros agentes policiales o determinar lo conducente para lograr su debida ejecución.\nCAPÍTULO III.\nDE LAS NOTIFICACIONES.\nARTÍCULO 103.- NOTIFICACIONES POR DISPOSICIÓN DE LA LEY. Con excepción de los casos en que esta Ley disponga una forma específica, las actuaciones practicadas en Averiguación Previa se tendrán por notificadas por su sola emisión o desahogo y surtirán sus efectos desde su propia fecha.\nARTÍCULO 104.- NOTIFICACIONES DE PROVEIDOS QUE IMPLICAN O SEÑALAN PLAZOS. Siempre que los proveídos ministeriales impliquen o señalen un plazo para el desahogo de una vista o para la posible interposición de un recurso, deberán notificarse al destinatario en la forma que disponen los artículos siguientes; salvo que la Ley señale un procedimiento específico según la actuación o proveído de que se trate.\nLo mismo se observará cuando se trate de actos que, conforme a la Ley, deban ser notificados personalmente\nARTÍCULO 105.- NOTIFICADORES. Las notificaciones se harán por el Ministerio Público, sus auxiliares, notificador o por cualquier empleado que aquél autorice.\nARTÍCULO 106.- FORMAS DE LAS NOTIFICACIONES. Cuando el interesado hubiere señalado domicilio en el lugar en donde se integre la indagatoria, los proveídos a que se refriere el artículo 104 le serán notificados en forma personal. En caso contrario o cuando hubiere cambiado su domicilio sin dar aviso o señalado uno falso; se le notificará por lista de acuerdos.\nARTÍCULO 107.- NOTIFICACIONES PERSONALES. Las notificaciones personales podrán hacerse en cualquiera de las siguientes formas:\nI. POR COMPARECENCIA. Cuando el interesado o cualquiera de sus autorizados para oír notificaciones comparezcan ante el Ministerio Público o se encuentren presentes, éste les informará el contenido del proveído o actuación objeto de la notificación y, si se le solicita, les dará acceso al expediente para que se impongan del documento. De lo anterior deberá levantarse constancia en los términos que señala la presente Ley.\nEn cualquier caso, si el Ministerio Público lo estima pertinente podrá emitir citatorio al interesado para que comparezca a notificarse.\nII. EN EL DOMICILIO DEL INTERESADO. Si el interesado no se hubiere hecho presente o no se hubiere logrado su notificación por comparecencia, el Ministerio Público le dirigirá oficio en el que le comunicará el contenido y fecha de emisión del proveído o actuación objeto de la notificación; lo que podrá realizar mediante traslado en copia simple o transcripción del proveído, en su totalidad o en lo que resulte conducente.\nEn estos casos el oficio se entregará al destinatario en el domicilio que hubiere señalado o donde se le localice, recabándose su firma o huella digital o los de la persona autorizada para oír notificaciones; así como los datos de la fecha, hora y lugar de recepción. Mas si el destinatario o el autorizado no pudiere o no quisiere firmar o imprimir su huella, se hará constar dicha circunstancia en el duplicado del oficio o en acta que al efecto se levante.\nSi el destinatario no fuere localizado la diligencia se entenderá con cualquier persona que viva o trabaje en el domicilio señalado; si no hubiere nadie en el lugar el Ministerio Público podrá ordenar que se le busque posteriormente o disponer su notificación por correo certificado, mensajería o telégrafo; pero si el domicilio señalado fuere falso, no existiere, se encuentre abandonado o bajo dominio o disposición de personas distintas al interesado o sus autorizados para oír notificaciones; se le notificará por lista de acuerdos.\nEn todo caso las incidencias que se presenten durante la notificación y las circunstancias a que se atienda para proceder en cualquiera de las formas señaladas, deberán hacerse constar en el duplicado correspondiente, junto con los datos de identificación de la persona que la realice; pero si quien la efectúa no es el Ministerio Público o notificador con nombramiento debidamente expedido, será necesario que se recaben, además, los datos de cuando menos una persona que hubiere atestiguado las incidencias y circunstancias de la notificación.\nIII. POR CORREO CERTIFICADO, MENSAJERIA O TELEGRAFO. Cuando no hubiere sido posible localizar al interesado o en cualquier caso que el Ministerio Público lo estime conveniente; la notificación personal podrá hacerse por medio de mensajería, correo certificado o telégrafo. En estos casos el Ministerio Público emitirá oficio en los mismos términos a que se refiere el párrafo primero de la fracción anterior, y lo remitirá al interesado o a cualquiera de sus autorizados para oír notificaciones por alguno de los medios señalados; anexado al expediente un tanto o copia del oficio remitido, así como la constancia del acuse de recibo o del envío telegráfico.\nIV. POR MODEM, FAX Y OTROS MEDIOS. El oficio a que se refieren las fracciones anteriores podrá enviarse al interesado o a cualquiera de sus autorizados para oír notificaciones, por medio de fax, módem o correo electrónico; pero para ello será necesario que dichas personas hubieren proporcionado previamente sus datos correspondientes dentro de la indagatoria y que hubieren autorizado dicho medio.\nEn este supuesto se agregará al expediente un tanto o copia del oficio mencionado; así como constancia del envío correspondiente.\nARTÍCULO 108.- NOTIFICACIONES POR LISTA DE ACUERDOS. El Ministerio Público diariamente elaborará una relación de los proveídos que hubiere emitido y que deban ser notificados por lista de acuerdos; en la que señalará el número de averiguación previa, el nombre de la persona a notificar, la fecha del proveído y una breve descripción de su contenido. La lista deberá ser firmada por el Ministerio Público y colocada en un lugar visible del local donde despache y deberá permanecer ahí por tres días incluyendo el de su fecha, al término de los cuales se resguardará en archivo especial en el que obren las listas previamente publicadas.\nEl Ministerio Público asentará en el expediente razón de publicación de la lista y de su fecha.\nARTÍCULO 109.- EFECTO DE LAS NOTIFICACIONES. Las notificaciones personales surten efecto el mismo día y momento en que se hagan; o el día que se recibieron en el domicilio señalado, según el acuse de recibo.\nLas notificaciones por lista de acuerdos surten efecto al día siguiente laborable al de su última publicación. A menos que el proveído correspondiente se hubiere notificado antes en forma personal. se notificó irregularmente se hace sabedora del proveído o actuación, porque así se deduzca de alguna promoción o manifestación que conste en la indagatoria, se le tendrá por notificada legalmente desde ese momento. Igual acontecerá cuando hubiere transcurrido un año contado a partir de la fecha del proveído, sin que el interesado hubiere reclamado o impugnado defectos de su notificación.\nLa falta de notificación de un acto o proveído no suspende la averiguación previa.\nCAPÍTULO IV.\nDE LOS PLAZOS\nARTÍCULO 111.- CÓMPUTO DE LOS PLAZOS. Los plazos empezarán a correr al día siguiente al que surta efectos la notificación, salvo los casos que esta Ley señale. Se contarán por días naturales, pero no se tomarán en cuenta los sábados y domingos, ni los días no laborables.\nSe exceptúan de lo anterior los plazos fijados en horas, los cuales se computarán de momento a momento y empezarán a correr desde que surta efectos la notificación.\nLos plazos para detener, retener o mantener en detención o bajo arraigo u orden de restricción al inculpado; siempre se computarán de momento a momento.\nARTÍCULO 112.- PLAZOS PARA LA REALIZACIÓN DE CIERTOS ACTOS DE AVERIGUACION PREVIA. El\nMinisterio Público y sus Auxiliares, según sea el caso, se sujetarán a los siguientes plazos:\nI. RENDICIÓN DE DICTÁMENES PERICIALES. Hasta treinta días para la rendición de dictámenes periciales.\n(REFORMADA, P.O. 12 DE MAYO DE 2009)\nII. PARTES INFORMATIVOS. Hasta treinta días para que la Policía del Estado informe el resultado de sus investigaciones.\nIII. RESOLUCIÓN DE COMPETENCIAS. Hasta quince días para resolver cuestiones de competencia si el expediente no excede de cien fojas y hasta treinta días si excede de dicha cantidad.\nIV. DILIGENCIACIÓN DE EXHORTOS Y AUXILIOS MINISTERIALES. Hasta treinta días para desahogar las diligencias requeridas por exhorto o solicitudes de colaboración.\nV. DEVOLUCIÓN DE VISTAS POR DEFECTOS DE FORMA. Hasta diez días para devolver los expedientes en que se haya emitido vista para consignación o para no ejercicio de acción penal, por defectos que, conforme al artículo\n92 de esta ley, impiden su estudio.\nVI. PEDIMENTOS PARA EJERCITAR ACCIÓN PENAL. Hasta ocho días para ejercitar acción penal en los asuntos en que se haya emitido vista para el efecto, siempre que el expediente no exceda de trescientas fojas. Si excede de dicha cantidad el plazo será de treinta días.\nVII. DETERMINACIÓN DE NO EJERCICIO DE LA ACCION PENAL. Hasta treinta días para resolver las vistas de no ejercicio de acción penal, si el expediente no excede de cien fojas; y noventa días si sobrepasa dicha cantidad.\nVIII. DESAHOGO DE DILIGENCIAS ORDENADAS POR LA SUPERIORIDAD. Hasta treinta días para desahogar las diligencias ordenadas por la superioridad.\nIX. REQUERIMIENTOS DE SUPERIORES. Hasta quince días para cumplimentar los requerimientos e instrucciones formulados por la superioridad.\nX. REMISION DE RECURSOS INTERPUESTOS. Hasta quince días para remitir las constancias a la autoridad a quien corresponda resolver las vistas emitidas y los recursos que se hayan interpuesto.\nXI. DESAHOGO DE CONSULTAS. Hasta quince días para resolver las consultas formuladas por el personal subordinado, en los casos que prevea esta ley.\nXII. OTRAS ACTUACIONES. Tres días para todos los demás casos que no tengan fijado un plazo específico.\nLa integración y resolución de la Averiguación Previa como tal, no esta sujeta a plazo.\nARTÍCULO 113.- PLAZOS FIJADOS POR EL MINISTERIO PÚBLICO. Cuando el Ministerio Público no señale plazo a personas ajenas a la institución para el cumplimiento de determinaciones, desahogo de vistas o ejecución de requerimientos; se entenderá fijado por quince días.\nARTÍCULO 114.- REDUCCIÓN Y PRÓRROGA DE PLAZOS. En cualquier caso la autoridad ministerial podrá reducir libremente los plazos a que se refieren los dos artículos anteriores; pero sólo podrá prorrogarlos por una sola vez mediante proveído que razone la necesidad de la medida.\nARTÍCULO 115.- EFECTOS DEL INCUMPLIMIENTO DE LOS PLAZOS. Las actuaciones desahogadas fuera de sus plazos serán válidas, pero el servidor público quedará sujeto a las responsabilidades que determine la presente\nLey.\nCAPÍTULO V.\nDESPACHO DE LOS NEGOCIOS Y MEDIDAS DE APREMIO.\nARTÍCULO 116.- ORDEN Y RESPETO. Durante el desahogo de sus actuaciones el Ministerio Público mantendrá el orden y exigirá que se guarde respeto tanto a él como a las demás autoridades y personas. Quienes estén presentes en las mismas deberán guardar silencio y abstenerse de intervenir sin que les autorice el Ministerio Público. Si el que renuncia a su derecho a estar presente; lo que en su caso se hará efectivo sin perjuicio de la aplicación de las medidas de apremio que autorice la Ley.\nARTÍCULO 117.- MEDIDAS DE APREMIO. Para hacer cumplir sus determinaciones, mandamientos y proveídos; así como para mantener el orden y respeto durante el desahogo de sus actuaciones, el Ministerio Público podrá emplear a discreción el medio de apremio que estime más eficaz, de entre los siguientes:\nI. USO DE LA FUERZA PÚBLICA. El uso de la fuerza pública, lo que supone la facultad de autorizar a cualquiera de cumplimiento de sus proveídos, determinaciones o mandamientos; aún en contra de la voluntad del destinatario.\nII. MULTA. Multa hasta por doscientos días de salario mínimo general vigente en el lugar y la fecha en que se apremie; la que se hará efectiva por conducto de la autoridad hacendaria estatal y que se aplicará al Fondo Para la\nProcuración de Justicia.\nIII. ARRESTO. Arresto hasta por treinta y seis horas; el que deberá ser cumplido en cualquiera de los lugares\nARTÍCULO 118.- PROCEDIMIENTO PARA LA APLICACIÓN DE MEDIDAS DE APREMIO. Para hacer efectivas las medidas de apremio el Ministerio Público individualizará, mediante acuerdo, la medida a aplicar; la que se ejecutará de inmediato en los términos que establece la presente Ley. Para ello será necesario que previamente se haya prevenido al contumaz de la medida concretamente aplicable.\nSólo se excusará el incumplimiento cuando antes de la emisión del acuerdo a que se refiere el párrafo anterior, el interesado acredite enfermedad o imposibilidad física para comparecer o acatar el mandamiento o requerimiento de que se trate.\nARTÍCULO 119.- PREVENCIÓN DE DESACATO. Las medidas de apremio se ejecutarán sin perjuicio de que las conductas omisivas que les hayan dado lugar sean consideradas como constitutivas del delito de desacato. El\nMinisterio Público prevendrá de lo anterior al destinatario en el requerimiento o mandamiento de que se trate.\nCAPÍTULO VI.\nDE LAS NULIDADES.\nARTÍCULO 120.- SUBSANABILIDAD DE LAS DILIGENCIAS DE AVERIGUACIÓN PREVIA. Por esencia los vicios o defectos en las diligencias practicadas en Averiguación Previa son subsanables por convalidación o ratificación expresa, salvo que los mismos produzcan la nulidad absoluta del acto por disposición expresa de la Ley.\nCuando esta ley no prevea una forma específica de convalidación bastará que el contenido o alcances de la diligencia viciada o deficiente sean reconocidos o ratificados por quien dio lugar a ellos o por aquel cuya intervención haya sido afectada por los mismos, para que la misma sea eficaz. Dicha ratificación o reconocimiento podrá ser promovida por el Ministerio Público incluso en el proceso, siempre que el vicio o defecto que presente la actuación de que se trate no hubiere sido específicamente valorado en resolución judicial.\nEn cualquier caso el Ministerio Público podrá optar por reponer la diligencia viciada o deficiente, previa declaratoria de nulidad que haga de la misma.\nLa subsanación de la diligencia viciada o deficiente podrá ser ordenada por cualquier funcionario que tenga el carácter de Ministerio Público, aunque no hubiere intervenido o intervenga en la integración o en diligencia alguna de la indagatoria.\nARTÍCULO 121.- NULIDAD ABSOLUTA. Están afectados de nulidad absoluta:\nI. FALTA DE FIRMAS DEL MINISTERIO PÚBLICO. Las actuaciones que carezcan de firma del Agente del\nMinisterio Público, cuando se trate de diligencias por él desahogadas.\nII. FALTA DE FIRMA DEL INCULPADO. Las actuaciones en que falte la firma o huella del inculpado cuando falte también la del defensor, siempre que se trate de actos en que la Ley exija la presencia de ambos.\nIII. FALTA DE FIRMAS DE OTROS INTERVINIENTES. Las actuaciones en que falte la firma o huella de cualquier haya suplido dicha circunstancia en los términos de Ley; siempre que no se haya convalidado o ratificado la actuación en los términos de lo dispuesto por el artículo anterior.\nIV. RECTIFICACIONES DEFICIENTES. Las actuaciones que se hayan rectificado en los supuestos a que se refieren los artículos 77 y 78 de la presente Ley, cuando las mismas se hayan efectuado sin sujetarse a las formas dispuestas por los citados dispositivos legales.\nV. NOTIFICACIÓN DEFICIENTE. Las notificaciones hechas sin sujetarse a las formas establecidas por la presente\nLey, salvo lo dispuesto por el artículo 110 de la misma.\nVI. REQUERIMIENTOS Y CITACIONES IRREGULARES. Los requerimientos o citaciones formulados en contravención a lo dispuesto por las normas que los regulan; a menos que el destinatario se hubiere hecho sabedor de los mismos porque así se deduzca de alguna promoción o manifestación que conste en la indagatoria.\nVII. OTROS CASOS QUE PREVEA LA LEY. Los demás casos que expresamente prevea la Ley.\nARTÍCULO 122.- DECLARATORIA DE NULIDAD. El Ministerio Público que conozca o intervenga en la indagatoria, de oficio o a petición de cualquier interesado, declarará de plano la nulidad de la actuación que se encuentre en cualquiera de los supuestos a que se refiere el artículo anterior.\nLo mismo hará cualquier funcionario que tenga el carácter de Ministerio Público cuando se percate de dicha circunstancia, aunque no hubiere intervenido o intervenga en la integración o en diligencia alguna de la indagatoria.\nLa nulidad de las diligencias de averiguación previa sólo podrá decretarse por el Ministerio Público; sin perjuicio de la facultad del juzgador para valorarlas atendiendo a su legal constitución, la que justipreciará de acuerdo a lo dispuesto por la presente Ley.\nARTÍCULO 123.- EFECTOS DE LA NULIDAD. La actuación nula no surte efecto jurídico alguno, salvo lo relativo a la determinación de responsabilidades; pero al declararse la misma se ordenará su inmediata reposición a efecto de que se desahogue nuevamente en debida forma, cuando ello sea posible.\nARTÍCULO 124.- ALCANCES DE LA NULIDAD. La nulidad de una actuación no produce por sí misma la nulidad de las actuaciones previas, subsecuentes o derivadas de la misma.\nCuando se trate de actuación en la que intervengan varias personas, la nulidad por falta de firmas o huellas sólo afectará lo referente a la intervención de la persona cuya firma o huella falte; salvo que se trate de la del Ministerio\nPúblico que producirá la nulidad de la actuación en su integridad.\nARTÍCULO 125.- VALIDEZ DE LAS ACTUACIONES DESAHOGADAS CUANDO EXISTA CUESTIÓN\nPREJUDICIAL ESPECÍFICA O FALTE CONDICIÓN DE PROCEDIBILIDAD. La falta de condición de procedibilidad se llegaren a practicar. Sin embargo, tales extremos deberán satisfacerse antes de que se proceda al ejercicio de la acción penal, en su caso.\nTÍTULO QUINTO.\nDE LAS MEDIDAS OFICIOSAS DE ESPECIAL DILIGENCIACION.\nCAPÍTULO I.\nDEL OBJETO Y REGLAS GENERALES.\nARTÍCULO 126.- OBJETO DE LAS MEDIDAS OFICIOSAS DE ESPECIAL DILIGENCIACION. Las medidas de las víctimas y ofendidos, asegurar la adecuada investigación de los hechos, preparar la legal constitución de las pruebas y evitar su impunidad.\nARTÍCULO 127.- MOMENTO EN QUE PUEDEN PRACTICARSE. Las medidas oficiosas de especial diligenciación lo permitan; pero el Ministerio Público procurará desahogarlas con la oportunidad necesaria para alcanzar su cometido.\nARTÍCULO 128.- CARÁCTER ENUNCIATIVO DE LAS MEDIDAS OFICIOSAS DE ESPECIAL DILIGENCIACIÓN.\nLa enumeración de las medidas oficiosas de especial diligenciación contenida en el presente título tiene carácter enunciativo y no limitativo, por lo que el Ministerio Público podrá practicar todas aquellas que este u otros ordenamientos le permitan.\nARTÍCULO 129.- CARÁCTER REGLADO DE LAS MEDIDAS OFICIOSAS DE ESPECIAL DILIGENCIACIÓN. Las medidas oficiosas de especial diligenciación se sujetarán a lo dispuesto por la ley que las contenga.\nCuando por sí mismas representen o contengan algún medio de prueba, para su legal constitución como tal bastará que se atienda a las reglas contenidas en el título séptimo del libro segundo de la presente Ley.\nCAPÍTULO II.\nDE LA RECOLECCIÓN DE EVIDENCIA Y LA CADENA DE CUSTODIA.\nARTÍCULO 130.- RECOLECCIÓN Y OBTENCIÓN DE EVIDENCIA. El Ministerio Público, por sí o por conducto de sus auxiliares, procederá, cuando sea el caso, a recabar y recolectar los objetos, instrumentos y productos del delito; así como el material sensible significativo relacionado con el mismo, documentando debidamente las circunstancias de su hallazgo y proveyendo a su adecuada conservación.\nARTÍCULO 131.- INTERVENCIÓN DEL MINISTERIO PÚBLICO Y SUS POLICÍAS AUXILIARES. El Ministerio\nPúblico y sus Policías Auxiliares podrán recibir la evidencia a que se refiere el artículo anterior cuando la misma les sea entregada por cualquier persona que la tenga en su poder, para cuyo efecto se levantará acta o parte informativo, según corresponda, en la que se asentarán las circunstancias de su entrega; así como los datos de quien la hubiere entregado y de la forma en que éste refiera haberla obtenido.\n(REFORMADO, P.O. 12 DE MAYO DE 2009)\nDe igual forma la Policía del Estado podrá realizar revisiones físicas a personas y vehículos en lugares públicos, noticia, debiendo comunicar al Ministerio Público, mediante parte informativo, los resultados obtenidos.\nEn los demás casos se procurará que la recolección la efectúe personal de servicios periciales; salvo que de esperar personas o de sus bienes.\nLa Policía del Estado y demás corporaciones auxiliares, así como el personal de Servicios Periciales podrán proceder a la recolección de la evidencia, en los términos a que se refieren los párrafos anteriores, tan pronto tengan conocimiento de la posible comisión de un delito, sin necesidad de mandamiento previo del Ministerio Público; pero recolectado.\nEn cualquier caso el Ministerio Público podrá estar presente durante la recolección de evidencia y dar fe de ello.\nARTÍCULO 132.- CONTENIDO DEL INFORME DE RECOLECCION DE EVIDENCIA. Cuando quien recolecte la evidencia sea personal de Servicios Periciales, deberá rendir informe al Ministerio Público, que contendrá:\nI. TIEMPO Y LUGAR DE RECOLECCIÓN. El lugar, hora y fecha de recolección.\nII. MOTIVO DE INTERVENCIÓN. El motivo de su intervención.\nIII. DATOS DE QUIEN REALIZA LA ENTREGA. En su caso, los datos de la persona de quien reciban el objeto, instrumento, producto o evidencia y la forma o motivo por el que ésta la hubiere obtenido.\nIV. CONDICIONES AMBIENTALES. La temperatura y condiciones físicas o ambientales del lugar de recolección, cuando ello sea relevante.\nV. PROCEDIMIENTO EMPLEADO. La técnica o procedimiento empleado para la recolección.\nVI. DESCRIPCIÓN DE LO RECOLECTADO. La clasificación y descripción de lo recolectado, con inclusión de su cantidad, peso y medida cuando ello sea relevante.\nVII. EMBALAJE Y ETIQUETAMIENTO. Las medidas tomadas para su embalaje o preservación y los datos de identificación y etiquetamiento de lo recolectado.\nVIII. CONDICIONES PARA SU PRESERVACIÓN. El tiempo posible estimado de preservación y las condiciones necesarias para ello, siempre que así se requiera.\nIX. OTROS DATOS. Las demás observaciones que se estimen necesarias.\nEl informe que se emita podrá hacerse acompañar de fotografías.\nARTÍCULO 133.- RESGUARDO DE LO RECOLECTADO. Los objetos, instrumentos y productos del delito; así como el material sensible significativo que se hubiere recolectado, se pondrán a disposición del Ministerio Público que conozca de la indagatoria; quien de inmediato los remitirá a la unidad administrativa encargada de su resguardo, cerciorándose de que se encuentren debidamente etiquetados para permitir en todo tiempo su correlación con los datos de la indagatoria en que se actúe.\nEl personal de servicios periciales podrá conservar materialmente lo recolectado, siempre que ello sea necesario para su preservación.\nSi el caso amerita el desahogo inmediato de alguna prueba pericial, el Ministerio Público lo ordenará desde luego.\nEl Ministerio Público podrá disponer que lo recolectado permanezca en su poder, se anexe a la indagatoria o se entregue en depositaria; cuando ello sea necesario para agilizar o eficientar la integración de la averiguación previa o para salvaguardar los derechos de quienes tengan interés legítimo sobre ello.\nEl resguardo de armas y objetos de uso ilícito o peligrosos se sujetará, además, a lo que dispongan los ordenamientos de la materia.\nARTÍCULO 134.- ASEGURAMIENTO Y DEPOSITARÍA. Los objetos, instrumentos y productos del delito; así como el material sensible significativo que se hubieren recolectado, se entienden afectos a la indagatoria en que se actúe; ser reclamados por quien tenga interés legítimo en ello.\nSin perjuicio de lo anterior, el Ministerio Público podrá entregar los bienes en depositaría siempre que: se trate de objetos susceptibles de reclamación, lo solicite quien acredite derecho legítimo sobre ellos, se hayan desahogado las pruebas periciales y de cualquier otra naturaleza que sobre las mismas resulten pertinentes y no se trate de armas, objetos de uso ilícito, sustancias o componentes químicos, orgánicos, biológicos o de naturaleza similar; o de bienes decomisables. Cuando sea necesario para los fines de la indagatoria se podrá exigir al solicitante, además, que requerido.\nDe la solicitud de depositaria se dará vista al inculpado o al ofendido o víctima, según sea el caso, para que dentro del plazo de tres días manifieste si desea ofrecer peritaje o medio de prueba relacionado con el objeto de que se trate, con base en lo cual el Ministerio Público resolverá lo conducente.\nARTÍCULO 135.- CADENA DE CUSTODIA. Los objetos, instrumentos y productos del delito; así como el material sensible significativo que se hubieren recolectado estarán sujetos a cadena de custodia, la que deberá mostrar en todo momento la secuencia y continuidad de los actos de entrega y recepción para su resguardo, desahogo de pruebas o para su simple tenencia.\nPara el efecto, quien recolecte o recabe la evidencia levantará un registro en el que hará constar la descripción del objeto de que se trate, las circunstancias de su recolección y, en su caso, los datos de su etiquetamiento; firmándolo de inmediato y entregándolo a quien corresponda junto con el objeto referido en el registro. Quien reciba la evidencia asentará en el registro la fecha, hora y el nombre de la persona que la entrega así como las condiciones de embalaje y etiquetamiento de lo que recibe; plasmando enseguida su nombre y su firma y sus datos de identificación cuando ellos no obren en la indagatoria. Se procederá de la misma manera siempre que lo recolectado cambie de manos o sea entregado a cualquier persona, independientemente del motivo para ello.\nEl Ministerio Público podrá conservar un tanto del registro correspondiente.\nARTÍCULO 136.- INICIO Y TERMINACIÓN DE LA CADENA DE CUSTODIA. La cadena de custodia inicia en el momento en que se recaba o recolecta la evidencia y concluye cuando la determinación de no ejercicio de acción penal quede firme, cuando así lo declare expresamente el Ministerio Público, cuando la evidencia sea puesta materialmente a disposición de la Autoridad Judicial que conozca del proceso o cuando la autoridad competente así lo decrete.\nARTÍCULO 137.- CONSIGNACIÓN DE LA EVIDENCIA A LA AUTORIDAD JUDICIAL. El Ministerio Público pondrá a disposición de la autoridad judicial la evidencia que hubiere recolectado o recabado, al ejercitar acción penal, cuando ella sea necesaria para el efecto.\nSiempre que la evidencia requiera de condiciones o cuidados especiales para su preservación, el Ministerio Público conservará el resguardo de la evidencia hasta en tanto el Juez de la causa ordene lo contrario. En estos casos se el efecto deberá indicar el Ministerio Público; subsistiendo las obligaciones señaladas con relación a la cadena de custodia. la evidencia o cuando su preservación sea difícil o gravosa; el Ministerio Público podrá poner a disposición del Juez la evidencia, sin ejercitar acción penal, para que desahogue las pruebas que fueren necesarias respecto de ella. En tal caso, la cadena de custodia concluirá en el momento en que la evidencia se ponga materialmente a disposición de la autoridad judicial o de la persona que ella ordene.\nCAPÍTULO III.\nDE LAS INSPECCIONES.\nARTÍCULO 138.- OBJETO DE LAS INSPECCIONES. Siempre que el Ministerio Público tenga noticia de la posible comisión de un delito que altere materialmente el entorno, objetos o personas en los que tuvo lugar o sobre los que haya recaído, deberá inspeccionar con prontitud de manera ocular todas las posibles alteraciones. Lo mismo hará respecto de las personas, cosas o lugares, que aún sin encontrarse en los supuestos anteriores, resulten relevantes para la indagatoria.\nARTÍCULO 139.- INSPECCIÓN DE PERSONAS. Las inspecciones corporales de personas se practicarán en privado. Cuando tengan que inspeccionarse partes pudendas de la anatomía se procurará que quien lo realice sea del mismo sexo que el sujeto de inspección.\nSi fuese necesario constatar circunstancias decisivas para la investigación o tomar muestras corporales y la persona a examinar negare su consentimiento para el efecto, el Ministerio Público levantará constancia de ello y pedirá al\nJuez que ordene su desahogo en vía de Averiguación Previa.\nARTÍCULO 140.- INSPECCIÓN DE LUGARES CERRADOS. EL Ministerio Público podrá practicar inspecciones en lugares cerrados, sean públicos o privados con acceso al público, en los horarios oficiales en que esté permitido dicho acceso. Fuera de dichos supuestos será necesario el consentimiento expreso del propietario o encargado del lugar de que se trate o que se realice mediante cateo.\nDurante la inspección podrá ordenarse que no se ausenten quienes se encuentren en el lugar o quienes arriben al mismo en el transcurso de la diligencia.\nARTÍCULO 141.- OPOSICIÓN A LA INSPECCIÓN. Cuando exista oposición a la práctica de las inspecciones se emplearán las medidas de apremio que se estimen necesarias.\nCAPÍTULO IV.\nDEL CATEO.\nARTÍCULO 142.- MANDAMIENTO Y OBJETO DEL CATEO. El cateo sólo se practicará a solicitud del Ministerio\nPúblico y en virtud de orden escrita de Autoridad Judicial competente, en la que se expresará: 1) El domicilio donde se llevará a cabo y, en su caso, si algún lugar será objeto de inspección. 2) La persona que haya de asegurarse o arrestarse. Y/o 3) La clase de objetos o documentos que deban localizarse, asegurarse o inspeccionarse.\nARTÍCULO 143.- MOTIVOS PARA EL CATEO. Para ordenar un cateo será suficiente que exista un indicio grave o dos leves que hagan presumir cualquiera de las circunstancias siguientes: 1) Que la persona a quien se pretende asegurar, hacer comparecer o arrestar se encuentre en el lugar en que se deba efectuar la diligencia. 2) Que en el lugar se hallen los objetos, instrumentos o productos del delito u otras evidencias que puedan servir para comprobarlo. 3). Que sea necesaria la inspección del lugar o de parte de él.\nEl cateo para asegurar, hacer comparecer o arrestar a una persona se obsequiará sólo cuando previamente exista la orden correspondiente; a menos que la orden mencionada deba ser otorgada por la Autoridad Judicial, en cuyo caso se podrán solicitar conjuntamente.\nCuando se pretenda efectuar la detención en flagrancia se deberá motivar la solicitud en tal sentido, pero sólo se podrá llevar a cabo dentro del plazo que esta Ley autoriza para el delito flagrante.\nARTÍCULO 144.- PLAZO PARA ORDENAR Y PRACTICAR EL CATEO. El Juez deberá resolver la solicitud de para los demás casos.\nEl cateo sólo se podrá practicar de las seis de la mañana a las dieciocho horas. Si al concluir dicho tiempo aún no se termina podrá continuarse hasta su fin.\nCuando se trate de delito grave o la urgencia del caso lo requiera, los cateos podrán practicarse a cualquier hora, debiendo expresarse tal circunstancia en la solicitud y en el mandamiento judicial. ordenado.\nARTÍCULO 145.- FORMA DE PRACTICAR EL CATEO. El cateo se practicará por el Juez que lo ordene o por el\nSecretario o Actuario que aquél autorice, con la presencia del Ministerio Público que lo haya solicitado o conozca de la indagatoria y del personal bajo su mando que éste designe. Si el Juez lo considera necesario, además, se realizará en presencia de dos testigos que proponga el ocupante del lugar cateado y en su ausencia o ante su negativa, de los que designe la autoridad que practique la diligencia.\nEn cualquier caso, el Juez podrá autorizar al Ministerio Público para que realice el cateo por sí mismo y sin presencia judicial.\nSi se tratare del cateo para asegurar, arrestar o hacer comparecer a alguna persona y se le localiza en el lugar, el\nJuez o quien tenga a su cargo el cateo lo pondrá de inmediato a disposición del Ministerio Público para que proceda en los términos de ley.\nCuando fuere necesaria la recolección o aseguramiento de objetos o evidencia, quien tenga a su cargo la diligencia dará intervención al Ministerio Público para que proceda conforme a lo dispuesto en el capítulo II de este Título. Sin perjuicio de ello la autoridad judicial levantará su propio inventario.\nSi sólo se trata de inspeccionar el lugar o algún objeto la Autoridad Judicial la practicará por sí mismo, pero atenderá a las manifestaciones que le formule el Ministerio Público. Si el cateo es realizado por el Ministerio Público la inspección la practicará él mismo.\nEn cualquier caso la Autoridad Judicial deberá levantar acta circunstanciada de todo lo que ocurra durante la diligencia; la que entregará al Ministerio Público dentro de las tres horas siguientes a su conclusión, si se trata de delito grave o de flagrancia, o dentro de veinticuatro horas para los demás casos. Lo anterior no será necesario cuando lo practique el Ministerio Público.\nARTÍCULO 146.- DESCUBRIMIENTO DE UN DELITO DISTINTO. Si al practicar un cateo resulta casualmente el descubrimiento de un delito distinto, se hará constar en el acta respectiva y se dará al Ministerio Público la intervención que le corresponda en los términos del artículo anterior.\nARTÍCULO 147.- CATEO EN OFICINAS PÚBLICAS. Para practicar cateo en oficinas públicas estatales o municipales, el Juzgador, si lo estima necesario, avisará a la autoridad respectiva.\nARTÍCULO 148.- PRESERVACIÓN DEL LUGAR DE CATEO. Antes, durante y después del cateo, el Ministerio se lleve a cabo.\nARTÍCULO 149.- USO DE LA FUERZA. Cuando la autoridad que practique el cateo encuentre cerrado el lugar y sus propietarios, poseedores o encargados se nieguen a abrirlo, hará uso de la fuerza material para introducirse, así se buscan. Si nadie abre y no hay indicio de persona adentro, se utilizará cerrajero o cualquier otro medio para ingresar. En tal caso se dejará aviso del cateo en lugar visible.\nCAPÍTULO V.\nDE LAS DILIGENCIAS DE POLICÍA.\nARTÍCULO 150.- CONOCIMIENTO DEL DELITO POR LA POLICÍA. Cuando sea la Policía del Estado o cualquiera de las corporaciones auxiliares del Ministerio Público quienes primero conozcan del delito, procederán de inmediato a dictar las medidas necesarias para salvaguardar la seguridad de las personas y los bienes que pudieran estar en riesgo, evitar que el delito se consume si ello fuere posible y lograr el aseguramiento de quienes aparezcan como probables responsables de los hechos, en los supuestos que la Ley lo autorice.\nDe igual forma indagarán qué personas fueron posibles testigos de los hechos, recabando los datos que permitan su identificación y posterior localización. Si recibieren de cualquier persona objetos o evidencia que pudiera estar relacionada con los hechos procederán de acuerdo a lo dispuesto para la recolección de evidencia y la cadena de custodia.\nEn cualquier caso, dictarán las medidas necesarias para preservar el lugar de los hechos hasta en tanto el Ministerio\nPúblico se haga presente y disponga lo conducente. Pero si éste no acudiere al sitio, la Policía que hubiere tomado conocimiento del caso tomará nota de todas las particularidades del mismo que fueren relevantes, sin perjuicio de la intervención que corresponda a los servicios periciales.\n(REFORMADO, P.O. 12 DE MAYO DE 2009)\nARTÍCULO 151.- INVESTIGACIÓN POLICIAL. El Ministerio Público podrá ordenar a la Policía del Estado que realice las investigaciones tendientes a esclarecer los hechos de que tenga conocimiento sin necesidad de detallar las actividades encomendadas; por lo que la Policía podrá desplegar todas aquellas que la Ley le permita y que resulten conducentes.\n(REFORMADO, P.O. 12 DE MAYO DE 2009)\nARTÍCULO 152.- ELABORACIÓN DE PARTES INFORMATIVOS. La Policía del Estado y las demás corporaciones auxiliares rendirán al Ministerio Público parte informativo en el que describirán los resultados de sus intervenciones.\nCAPÍTULO VI.\nDE LAS MEDIDAS ESPECIALES PARA CIERTOS DELITOS.\nARTÍCULO 153.- LESIONES Y OTROS DELITOS QUE LAS IMPLICAN. Cuando se trate de los delitos de Lesiones, en cualquiera de sus formas, o de cualquier otro que implique o cause daño a la salud, se practicará inspección y dictamen pericial de las mismas, si fueren externas. Si se tratare de lesiones internas o de enfermedad bastará dictamen pericial.\nEn el dictamen se describirán y clasificarán razonadamente en orden a su naturaleza, gravedad y consecuencias; procurándose además su clasificación de acuerdo a lo que establece la Ley Federal del Trabajo. Si fuere posible se establecerá también su antigüedad.\nLos dictámenes médicos serán siempre definitivos, a menos que el dictaminador exprese razonadamente la necesidad de valoración posterior, en cuyo caso deberá señalar el propósito y objeto de la futura valoración y el tiempo pertinente para ello.\nSe procurará anexar al dictamen que se emita fotografías o imágenes de video de las mismas; además de las radiografías o estudios que en su caso le sirvan de sustento.\nEn las inspecciones y dictámenes podrán asentarse las manifestaciones que el lesionado refiera como síntomas.\nARTÍCULO 154.- INTERVENCIÓN DE MÉDICOS PARTICULARES. En los supuestos del artículo anterior los legal, cuando se los requiera el Ministerio Público. En tales casos sus dictámenes tendrán el carácter de peritajes expediente clínico, protocolo o notas médicas que registren la atención proporcionada.\nSin perjuicio de lo anterior, el Ministerio Público podrá ordenar la práctica de diverso peritaje, con base en la revisión directa del lesionado o de la información suministrada por el médico y la institución tratante; así como practicar inspección de lesiones acompañado de perito.\nSe procederá en la misma forma cuando se trate de determinar el estado mental de las personas.\nARTÍCULO 155.- LESIONES GRAVES POR CICATRIZ EN LA CARA PERMANENTEMENTE NOTABLE. Cuando se trate de lesiones graves por cicatriz en la cara permanentemente notable, el Ministerio Público ordenará peritaje para determinar su existencia y permanencia y practicará inspección para evaluar su notabilidad a una distancia de cuando menos cinco metros.\nARTÍCULO 156.- HOMICIDIO Y OTROS DELITOS CONTRA LA VIDA. Cuando se trate de homicidio o de otros delitos contra la vida se procederá de la manera siguiente:\nI. INSPECCIÓN DE CADÁVER. Se practicará inspección del cadáver, en la que se describirán su posición corporal y orientación, sus características físicas, vestimenta y lesiones que presente; así como todas aquellas particularidades que se estimen relevantes.\nII. INSPECCIÓN DE LUGAR. Se inspeccionará también el lugar en donde hubiere sido encontrado o donde se presuma que hubiere fallecido o haya sido lesionado, tomando nota de las condiciones climáticas y ambientales del lugar.\nSi se estima conveniente, la inspección de cadáver y de lugar podrán practicarse en una misma diligencia.\nIII. RECOLECCIÓN DE EVIDENCIA Y LEVANTAMIENTO DEL CADÁVER. Igualmente se procederá a recolectar la evidencia que hubiere, en los términos de lo dispuesto por el capítulo II del presente título; ordenando el levantamiento y traslado del cuerpo para la practica de la necropsia.\nIV. NECROPSIA. Se ordenará a perito médico que practique la necropsia y emita el dictamen correspondiente en el que asentará: 1). Las características, naturaleza, extensión, profundidad, trayectoria, coloración y antigüedad de las lesiones que en su caso presente el cadáver. 2). En su caso, la clase de objeto que pudo haberlas provocado. Si las lesiones fueren de características variadas, se correlacionará cada una de ellas con la clase de objeto que las pudo haber provocado. 3). La causa de la muerte y la descripción del proceso o mecanismo que la originó. 4). Las demás circunstancias que se consideren relevantes. corporales, conforme a lo dispuesto para la recolección de evidencia y la cadena de custodia.\nEl Ministerio Público procurará estar presente durante la práctica de la necropsia.\nV. IDENTIFICACIÓN Y RECONOCIMIENTO DE CADÁVER. Si hubiere persona que pueda reconocer al cadáver, se le hará comparecer para el efecto; asentándose la razón por la cual lo reconoce y todos los datos que proporcione y que puedan ser de utilidad para las investigaciones.\nCuando no hubiere quien lo reconozca, pero el cadáver se encuentre en condiciones de ser identificado, se procederá a tomarle impresiones fotográficas que permitan su futuro reconocimiento. facial, el registro de sus huellas dactilares, el moldeado de su dentadura, la toma de muestras para identificación genética o cualquier otro medio que permita su eventual reconocimiento o identificación en el futuro.\nEn cualquier caso, las vestimentas podrán ser empleadas para el mismo fin.\n(REFORMADO, P.O. 12 DE MAYO DE 2009)\nARTÍCULO 157.- DISPENSA DE NECROPSIA. La necropsia se practicará siempre que exista la presunción de que el fallecimiento implique la posible comisión de un delito. No obstante lo anterior, la misma se podrá omitir siempre que el Ministerio Público que conozca de la indagatoria y el perito médico estimen que la misma es innecesaria. En tal caso será necesario, además, que así lo autorice el Fiscal General y que el perito dictamine de manera razonada que la muerte fue resultado claro y necesario de las lesiones que presente el occiso.\nARTÍCULO 158.- IMPOSIBILIDAD DE PRACTICAR NECROPSIA. Cuando no haya médico que pueda practicar la necropsia, el cadáver no se encuentre o por cualquier otro motivo la misma no pueda practicarse; será suficiente que dos peritos, en vista de los datos que obren en el expediente, dictaminen razonadamente las causas de la muerte.\nEn cualquier caso, si el cadáver hubiese sido sepultado, el Ministerio Público podrá ordenar su exhumación.\nARTÍCULO 159.- CASOS DE MUERTE CEREBRAL. Para todos los efectos legales se considerará que hay muerte de la persona en cualquiera de los casos siguientes: a) Cuando cesen en forma definitiva e irreversible sus funciones vitales. b) Cuando un médico legista y otro médico legalmente autorizado para ejercer la profesión, certifiquen que existe muerte cerebral; y se reúnan, además, las condiciones que establece la Ley General de Salud. En el segundo caso, la certificación establecerá y probará la muerte de la persona y la pérdida de su vida.\nEl médico que asista al legista para determinar que se está en el caso de muerte cerebral deberá contar con certificación profesional sobre conocimientos en muerte cerebral y no tener ningún interés con relación a la donación o implante de los órganos del examinado.\nUna vez que se realice la certificación a que se refiere este artículo, ningún Agente del Ministerio Público, ni ninguna otra autoridad, tendrá facultades para entorpecer o evitar que se lleve a cabo la disposición de órganos y tejidos.\nSiempre y cuando exista consentimiento otorgado en vida por la persona cuya muerte se certifica o, en su defecto la autorización de los disponentes secundarios.\nA falta del consentimiento otorgado en vida, será necesaria la autorización de los disponentes secundarios; en el orden de prelación siguiente: 1) El cónyuge; concubina o concubinario o la persona con quien se encuentre legalmente ligado en pacto civil de solidaridad. 2) Los ascendientes consanguíneos directos en primer grado. 3) Los descendientes consanguíneos directos en primer grado mayores de 18 años de edad. 4) Los ascendientes consanguíneos directos en segundo grado. 5) Los descendientes consanguíneos directos en segundo grado mayores de 18 años de edad. 6) Los parientes colaterales hasta el segundo grado, mayores de 18 años de edad. A falta de los anteriores, podrán otorgar la autorización dos médicos legistas.\nEn los casos anteriores no se practicará la necropsia, sin perjuicio de que dos médicos dictaminen cual fue la causa de la muerte cerebral y la medida en que influyeron en ella las lesiones u otras causas.\nPara que el órgano o tejido de que se dispuso, se implante o dé a otra persona, será indispensable que existan todos los exámenes previos que revelen la sanidad del órgano o tejido.\nARTÍCULO 160.- DISPOSICIÓN DE CADÁVERES. Cuando el Ministerio Público hubiere agotado las diligencias a practicar sobre el cadáver, dispondrá su entrega a sus deudos y ordenará la expedición del certificado de defunción correspondiente. dispongan los convenios que para el efecto tenga celebrados, siempre que se trate de cuerpos que no hubiesen sido reclamados. Para el efecto, si el cadáver hubiere sido reconocido, el Ministerio Público notificará al familiar más cercano del que se tenga noticia o a la persona que hubiere hecho el reconocimiento, que se procederá en los términos apuntados si no acuden a hacer la reclamación correspondiente dentro de los quince días siguientes al de la notificación. Si se trata de cadáver no identificado o no identificable dicha comunicación se hará mediante boletín que se hará llegar a las procuradurías o dependencias que se estime necesario.\nLo anterior no será aplicable cuando se trate de cadáveres de los que se tenga conocimiento de que hubieren sido extranjeros, caso en el cual se comunicará a la representación diplomática o consular que corresponda para los efectos de su posible reclamación. Mas si tal reclamación no fuere formulada en un plazo de treinta días siguientes a aquél en que fue hecha la comunicación, se procederá a la inhumación del cuerpo.\nEn cualquier caso, el Ministerio Público ordenará la inmediata inhumación del cadáver cuando exista riesgo a la salud pública.\nARTÍCULO 161.- MUERTE O LESIONES POR ENVENENAMIENTO. Cuando se trate de lesiones o muerte posiblemente causadas por envenenamiento, se recogerán con cuidado todas las vasijas y demás objetos que pudo usar el enfermo; los restos de los alimentos, bebidas y medicinas que pudo ingerir; las deyecciones y vómitos. Se conservarán en forma adecuada y se ordenará analizar las sustancias para determinar su carácter tóxico y si pudieron causar la enfermedad.\nAdemás, se describirán los síntomas y de inmediato se llamará a peritos para que examinen. En caso de muerte, se ordenará practicar la necropsia del cadáver.\nARTÍCULO 162.- ABORTO E INFANTICIDIO. En los casos de aborto o infanticidio, además de las diligencias que resulten conducentes de las mencionadas en los artículos 156, 157, 158 y 159; se dictaminará médicamente a la\nDe igual forma se practicará peritaje sobre el producto, al que se le tomarán muestras de tejidos y fluidos corporales para la práctica de las pruebas que resulten pertinentes; y se indagará en las cínicas, centros de salud y entre los vecinos del lugar si tuvieron conocimiento de los hechos.\nEn estos casos la disposición del cuerpo o producto que no hubiere sido reclamado se realizará sin mayor trámite, a partir de los quince días siguientes al hallazgo del mismo.\nARTÍCULO 163.- DELITOS CONTRA LA LIBERTAD Y SEGURIDAD SEXUAL. Cuando se trate de delitos contra la libertad y seguridad sexual, además de las diligencias que se estimen pertinentes, se practicará dictamen médico pericial en el que se asentarán, en su caso, la descripción de las lesiones que presente la persona ofendida, si hubo o no penetración, las lesiones o traumas causadas por la misma y su antigüedad, precisando los tiempos tomados como parámetro; de igual forma se asentará si existen síntomas de probable enfermedad de transmisión sexual.\nSi se trata de atentados al pudor, el examen sólo se practicará cuando haya mediado violencia o cuando se trate de menor de doce años de edad o incapaz o si lo consiente el ofendido. practica de peritajes de genética y demás diligencias que pueda ordenar el Ministerio Público; observando lo relativo a la recolección de evidencias y la cadena de custodia.\nEl dictamen que se emita deberá acompañarse de las fotografías, videos o imágenes gráficas que se hubieren tomado; las que se anexarán a la indagatoria de forma tal que se impida su visualización a simple vista por cualquier persona. La consulta de dichas imágenes sólo podrá ser autorizada por la Autoridad Judicial o por el Ministerio\nPúblico, quien tomará las medidas necesarias para proteger el pudor del ofendido.\nSi el ofendido fuere menor de edad o incapaz se tomará de inmediato su declaración, procurando la asistencia de psicólogo quien lo auxiliará para la mejor comunicación con el ofendido. Si se considera necesario, al finalizar la declaración, se dará el uso de la voz al psicólogo para que emita su opinión respecto del estado emocional del menor.\nARTICULO 164.- DELITOS CONTRA LA SEGURIDAD EN LOS MEDIOS INFORMATICOS Y OTROS DELITOS\nCOMETIDOS POR DICHOS MEDIOS. En tratándose de delitos contra la seguridad de los medios informáticos y de otros delitos cometidos con la utilización de dichos medios, el Ministerio Público ordenará los peritajes que estime pertinentes.\nSin perjuicio de lo anterior, la policía especializada podrá realizar pesquisas para detectar posibles delitos en medios informáticos; pero cuando detecte alguno lo comunicará sin demora al Ministerio Público a fin de que levante constancia de los procedimientos empleados durante la investigación. Si fuere necesaria la presencia de peritos se les dará la intervención que corresponda.\nCAPÍTULO VII.\nDE LAS MEDIDAS DE RESTRICCIÓN.\nARTÍCULO 165.- MEDIDAS DE RESTRICCIÓN. Durante la Averiguación Previa el Ministerio Público, de oficio o a petición del interesado, podrá solicitar a la Autoridad Judicial la aplicación de cualquiera de las siguientes medidas con relación al inculpado:\nI. SEPARACIÓN DE PERSONAS. La separación provisional de personas que cohabiten en un mismo lugar, señalando el domicilio en que deban residir cada una de ellas. La que se aplicará sólo cuando exista consentimiento del interesado.\nII. ABANDONO DEL DOMICILIO EN QUE HABITE EL INCULPADO. La obligación para el inculpado de abandonar el domicilio en el que cohabite con el ofendido, víctima o con la persona en favor de quien se pida la medida.\nIII. PROHIBICIÓN DE ACERCARSE A DETERMINADOS LUGARES O PERSONAS. La prohibición de acercarse a menos de cierta distancia del lugar en que habite, trabaje o desempeñe alguna actividad cotidiana el ofendido, víctima o la persona en favor de quien se pida la medida; o bien de acercarse deliberadamente a cualquiera de ellas.\nIV. PROHIBICIÓN DE ACUDIR A DETERMINADOS LUGARES. La prohibición de acudir a determinados lugares.\nV. PROHIBICIÓN DE SUSTRAER DETERMINADOS BIENES. OBJETOS O DOCUMENTOS. La prohibición de sustraer determinados bienes, objetos o documentos del lugar donde se encuentren.\nVI. PROHIBICIÓN DE CONDUCIR VEHÍCULOS. La prohibición de conducir vehículos.\nVII. SUSPENSIÓN DE ACTIVIDADES. La suspensión de determinadas actividades. Esta medida también podrá aplicarse a las personas morales cuyas actividades estén relacionadas con la comisión del delito de que se trate.\nARTÍCULO 166.- CONDICIONES DE PROCEDENCIA. Para la procedencia de la medida será necesario que se se solicita. Además, deberá razonarse la necesidad de la medida y su idoneidad o conducencia para evitar que la delictiva de que se trate.\nARTÍCULO 167.- PLAZOS PARA RESOLVER Y DE VIGENCIA DE LAS MEDIDAS. El Juez deberá resolver dentro de las tres horas siguientes a la presentación de la solicitud cuando el Ministerio Público razone debidamente su urgencia, o dentro de las veinticuatro horas para los demás casos.\nLa medida se otorgará hasta por treinta días, prorrogables por una sola vez.\nARTÍCULO 168.- EJECUCION Y VIGILANCIA DE LA MEDIDA. De encontrarla procedente, el Juez emitirá orden de restricción en la que precisará su modalidad y su tiempo de vigencia y la comunicará al Ministerio Público para los efectos de su notificación y vigilancia de su ejecución.\nEl Ministerio Público notificará personalmente la medida a la persona contra quien se hubiere dictado y le hará los apercibimientos que estime necesarios para el caso de incumplimiento, con la prevención, además, de que tal incumplimiento será considerado como desacato.\nLa vigilancia de su cumplimiento estará a cargo del Ministerio Público quien podrá encomendarla a cualquiera de sus\nPolicías Auxiliares con las condiciones y modalidades que el mismo determine. Sin perjuicio de lo anterior, el interesado podrá comunicar a aquel su incumplimiento o solicitar la intervención de cualquiera de las corporaciones policiales. En este último caso la autoridad cuya intervención se solicite se cerciorará de la vigencia de la medida y procederá a dictar las medidas necesarias para asegurar su cumplimiento, comunicando lo anterior al Ministerio\nPúblico.\nEl Ministerio Público entregará copia certificada del mandamiento judicial, a la persona en cuyo favor se hubiere decretado la medida.\nEn cualquier caso, para vigilar el cumplimiento de la medida decretada el Ministerio Público podrá emplear brazalete o dispositivo electrónico de localización.\nCAPÍTULO VIII.\nMEDIDAS DE RESTITUCIÓN, EMBARGO Y RETENCIÓN DE BIENES.\nARTÍCULO 169.- RESTITUCIÓN AL OFENDIDO EN EL GOCE DE SUS DERECHOS. El Ministerio Público durante la Averiguación Previa y antes de ejercitar acción penal podrá dictar las providencias necesarias, a solicitud del interesado, para restituirle en el goce de sus derechos. Siempre y cuando se acrediten y no aparezcan datos que los controviertan. controvertidos, podrá proceder a su devolución cuando se acredite el cuerpo del delito y se otorgue caución bastante para garantizar daños y perjuicios a terceros.\nEn cualquier caso, el Ministerio Público podrá solicitar al Juez que dicte la resolución correspondiente sin necesidad de ejercitar antes la acción penal. la averiguación previa se desvanezcan las causas que la motivaron.\nARTÍCULO 170.- RETENCION DE COSAS. El Ministerio Público podrá retener las cosas cuando ello sea necesario para sustentar o constituir un medio de prueba o cuando sea indispensable para la causa.\nLos automóviles, camiones y otros objetos de uso lícito con que se cometa el delito se asegurarán de oficio.\nEn cualquier caso el Ministerio Público podrá, a petición por escrito del interesado, solicitar a la Autoridad Judicial el embargo precautorio en los términos que disponga el Código de Procedimientos Penales. Pero si lo hiciere antes de ejercitar acción penal, será necesario acuerdo que funde y motive la necesidad de la medida.\nTÍTULO SEXTO.\nDEL ASEGURAMIENTO DEL INCULPADO\nCAPÍTULO I.\nDE LA DETENCIÓN POR FLAGRANCIA.\nARTÍCULO 171.- DELITO FLAGRANTE. En los casos de delito flagrante, cualquier persona puede detener al indiciado. Quien lo haga deberá ponerlo sin demora a disposición de la autoridad inmediata y ésta, con la misma prontitud, a la del Ministerio Público.\nARTÍCULO 172.- CASOS DE DELITO FLAGRANTE. Se consideran casos de delito flagrante: 1) Cuando se detiene al indiciado en el momento de estar cometiendo el delito. 2) Cuando inmediatamente después de cometer el delito se detiene al indiciado porque se encuentra en su poder el objeto del delito; el instrumento con que aparezca cometido; o huellas que hagan presumir su intervención; o porque se le persigue materialmente.\nARTÍCULO 173.- RETENCIÓN POR DELITO FLAGRANTE. Al recibir al indiciado, el Ministerio Público decretará la retención de aquél, sólo si la detención obedeció a un caso de delito flagrante. La retención podrá durar hasta cuarenta y ocho horas, desde que se puso al indiciado a su disposición. Dentro de ese plazo ordenará su libertad o lo pondrá a disposición del juzgador.\nSerá penalmente responsable el Ministerio Público o funcionario que decrete indebidamente la retención. A la persona así detenida se le pondrá en inmediata libertad.\nARTÍCULO 174.- RETENCIÓN CUANDO SE TRATE DE DELITOS PERSEGUIBLES POR QUERELLA. El equivalente, aunque el mismo no se encuentre satisfecho; pero deberá ordenar su libertad si dentro de las cuarenta y ocho horas siguientes de que fue puesto a su disposición dicho requisito no es satisfecho.\nARTÍCULO 175.- LIBERTAD CAUCIONAL DEL RETENIDO. El indiciado que se encuentre retenido por el Ministerio\nPúblico tendrá derecho a obtener su libertad caucional, salvo que se encuentre en alguno de los supuestos siguientes:\nI. DELITO GRAVE. Que se trate de delito grave.\nII. REITERACIÓN DELICTIVA. Que se encuentre en alguno de los supuestos de reiteración delictiva o cuando previamente hubiere sido sujeto a proceso por delito grave.\nIII. ALGUNAS MODALIDADES DEL ROBO. Cuando se trate del delito de Robo con Intimidación en las Personas, Robo de Autopartes, Robo en Establecimiento Destinado al Comercio, Industria, Almacén o Bodega en Horas del\nServicio al Público; o Robo Sirviéndose de un Menor.\nIV. ATENTADOS AL PUDOR EN PERJUICIO DE MENOR DE DIECIOCHO AÑOS. Cuando se trate del delito de\nAtentados al Pudor cometido en perjuicio de persona menor de dieciocho años.\nV. CIERTOS DELITOS DE LESIONES. Cuando se trate del delito de Lesiones, sean dolosas o culposas, a menos que obre en la indagatoria dictamen médico que certifique que se trate de lesiones levísimas, leves o graves.\nVI. VENTA INDEBIDA DE BEBIDAS ALCOHÓLICAS. Cuando se trate del delito de Venta Indebida de Bebidas\nAlcohólicas.\nVII. CIERTOS DELITOS CULPOSOS. Cuando se trate de delito culposo que se cometa con motivo del tránsito de vehículos que el indiciado cometa por ebriedad; o por el influjo de estupefacientes, psicotrópico u otra substancia que produzca efectos similares.\nVIII. GRAFITO. Cuando se trate de delito de Grafito previsto por el Artículo 438 Bis del Código Penal siempre y cuando se trate de reincidencia.\nARTÍCULO 176.- CRITERIOS PARA FIJAR EL MONTO DE LA CAUCIÓN. Para resolver el monto de la caución, el\nMinisterio Público deberá tomar en cuenta la naturaleza, modalidades y circunstancias del delito; las características del inculpado y la posibilidad de cumplimiento de las obligaciones procedimentales a su cargo; los daños y perjuicios causados al ofendido; así como la sanción pecuniaria que, en su caso, pueda imponerse al inculpado. Para ello se atenderá a lo siguiente:\nI. NATURALEZA, MODALIDADES Y CIRCUNSTANCIAS DEL DELITO. Para valorar la naturaleza, modalidades y circunstancias del delito de que se trate se atenderá al término medio aritmético de la penalidad que le corresponda, con base en el cual se fijará su monto en equivalencia a razón de cincuenta días de salario mínimo vigente por año o fracción que exceda de la mitad.\nII. DAÑOS Y PERJUICIOS CAUSADOS. A lo anterior se sumará el monto de la reparación del daño, según se desprenda de constancias. Si el daño no estuviere determinado se sumará otro tanto de la equivalencia señalada en la fracción anterior.\nIII. SANCIÓN PECUNIARIA QUE PUEDA IMPONERSE. A ello se agregará el monto de la multa que pueda imponerse al inculpado conforme a las reglas fijadas por el Código de Procedimientos Penales.\nIV. CARACTERÍSTICAS DEL INCULPADO Y POSIBILIDAD DE CUMPLIMIENTO DE LAS OBLIGACIONES\nPROCEDIMENTALES. El resultado de lo anterior podrá disminuirse para hacerlo asequible al inculpado, según sus características y las posibilidades de cumplir las obligaciones procedimentales que se le impongan; pero nunca por debajo de la cantidad fijada como monto de los daños y perjuicios causados.\nARTÍCULO 177.- FORMA DE LA CAUCIÓN. El Ministerio Público, atendiendo a la naturaleza, modalidades y procedimentales a su cargo; podrá fijar la caución en cualquiera de las siguientes formas:\nI. DEPÓSITO EN EFECTIVO. Mediante depósito en efectivo a favor del Fondo Para el Mejoramiento de la autorice el Fiscal General. Cuando la institución en donde deba realizarse el depósito se encuentre cerrada y no exista posibilidad de hacerlo por medios electrónicos, el Ministerio Público recibirá la suma en efectivo y, previa expedición de recibo, ordenará depositarla al primer día hábil siguiente.\nII. FIANZA. Mediante póliza expedida por compañía afianzadora en la que se consigne expresamente que se acepta sin reserva la afectación de la garantía a la reparación del daño; así como a los demás riesgos y consecuencias que se señalen en el presente capítulo. En estos casos será necesario, además, que en la póliza se consigne en forma expresa que se acepta sin reserva pagar el monto de la fianza tan pronto así se le requiera por el Ministerio Público al agente o representante de aquélla que extienda la póliza; renunciando al procedimiento de ejecución de la Ley de\nFianzas y al fuero de su domicilio.\nIII. HIPOTECA. Mediante hipoteca legalmente constituida, siempre que el inmueble sobre el que se constituya no tenga gravamen alguno y su valor fiscal no sea menor al doble de la suma fijada como caución más la cantidad suficiente para cubrir los gastos para hacerla efectiva en su caso.\nIV. PRENDA. A través de prenda legalmente constituida, siempre que el valor del bien de que se trate sea de cuando menos el doble del monto fijado como caución.\nARTÍCULO 178.- PREVENCIÓN DE RIESGO DE LAS GARANTÍAS Y PAGO CUALQUIERA QUE SEA SU FORMA\nY TITULAR. Toda caución que se exhiba para disfrutar de la libertad provisional, cualquiera que sea su forma y titular; siempre se entenderán exhibidas bajo el riesgo de que si el inculpado se sustrae a la Averiguación Previa o incumple cualquiera de las prevenciones que se le hubieren formulado; se aplicarán como pago preventivo para reparar el daño, hasta por el monto de la caución; a favor de quien tenga derecho a reclamar aquél; siempre y cuando lo pida dentro de los ciento ochenta días que sigan al día en que se le notifique de la sustracción o del incumplimiento de las prevenciones. Asimismo, que el remanente de lo anterior, o el total si no se reclama en ese plazo, se hará efectiva a favor del Fondo para el Mejoramiento de la Procuración de Justicia.\nDe igual forma se entenderá que, en caso de que la caución se prorrogue hasta el proceso, la misma se sujetará a las condiciones que fije el Código de Procedimientos Penales y a lo que determine el Juez competente.\nARTÍCULO 179.- PREVENCIONES CUANDO SE DEJE EN LIBERTAD CAUCIONAL AL RETENIDO. Cuando el\nMinisterio Público deje libre al indiciado, lo prevendrá para que comparezca cuantas veces lo cite durante la\nAveriguación Previa. Además, le podrá hacer otras prevenciones para evitar que se acerque o moleste al ofendido, víctimas o testigos; o se ausente de la ciudad. Igualmente, lo prevendrá que deberá comparecer ante el Juez que se consigne la causa.\nTratándose del delito de violencia intrafamiliar, propio o equiparado, el Ministerio Público siempre prohibirá al indiciado que se acerque al o los ofendidos y que vaya al lugar donde éstos residan.\nEn cualquier caso, se podrán aplicar como prevenciones las mismas medidas de restricción a que se refiere la presente ley.\nARTÍCULO 180.- FORMA DE HACER EFECTIVA LA CAUCIÓN Y CANCELACIÓN DE LA GARANTIA. El prevención que se le impuso. Para ello dará vista al inculpado y, en su caso, a la Compañía Afianzadora, para que manifiesten lo que a su interés convenga dentro del plazo de tres días, hecho lo cual resolverá lo conducente.\nLa caución que se haga efectiva se aplicará a la reparación del daño y, en su caso, al Fondo Para el Mejoramiento de la Procuración de Justicia, en los términos de lo dispuesto por el artículo 178 de la presente ley.\nLa garantía se cancelará y se devolverá por el Ministerio Público, cuando quede firme el no-ejercicio de la acción penal. Más si la misma no se reclama dentro de los treinta días siguientes a su notificación, se podrá hacer efectiva a favor del Fondo Para el Mejoramiento de la Procuración de Justicia siempre que se trate de depósito en efectivo.\nARTÍCULO 181.- PRÓRROGA DE LA LIBERTAD CAUCIONAL DEL RETENIDO CUANDO SE EJERCITE LA\nACCIÓN PENAL. Al ejercitar la acción penal, el Ministerio Público acompañará la caución que se exhibió durante la\nAveriguación Previa, endosándola al juez que conozca, a menos que la misma se haya hecho efectiva en los términos de lo dispuesto por el artículo anterior.\nCon ello, la libertad caucional se considerará prorrogada tácitamente, hasta en tanto el juzgador la revoque, modifique o cancele.\nCAPÍTULO II.\nDE LA DETENCIÓN POR CASO URGENTE.\nARTÍCULO 182.- DETENCIÓN POR CASO URGENTE. Para que el Ministerio Público, bajo su responsabilidad, pueda ordenar por escrito motivado y fundado la detención de una persona por caso urgente, será necesario:\nI. DELITO GRAVE. Que se trate de un delito que la Ley considere grave.\nII. RIESGO FUNDADO DE SUSTRACCIÓN. Que exista riesgo fundado que el indiciado se sustraiga a la acción de la justicia.\nIII. IMPOSIBILIDAD DE ACUDIR AL JUEZ. Que, demostrado el cuerpo del delito, haya indicio grave de que el indiciado intervino y se espere hacer probable su responsabilidad penal dentro de las cuarenta y ocho horas siguientes; o que demostrada aquella, además del cuerpo del delito, por razón de la hora o lugar no se pueda acudir ante el Juez a solicitar la orden de aprehensión.\n(REFORMADO, P.O. 12 DE MAYO DE 2009)\nARTÍCULO 183.- EJECUCIÓN DE LA ORDEN DE DETENCIÓN POR CASO URGENTE Y TIEMPO DE LA\nDETENCIÓN. La orden de detención por caso urgente la ejecutará la Policía del Estado. La detención del indiciado podrá durar hasta cuarenta y ocho horas, desde que se efectúe. Dentro de ese plazo el Ministerio Público ordenará su libertad o lo pondrá a disposición del juzgador.\nCAPÍTULO III.\nDEL ARRAIGO.\nARTÍCULO 184.- ARRAIGO DEL INDICIADO. Cuando se trate de delito grave y siempre que sea necesario para el éxito de la investigación, la protección de personas o bienes jurídicos, o cuando exista riesgo fundado de que el inculpado se sustraiga de la acción de la justicia, el Ministerio Público podrá pedir motivadamente al juzgador, que decrete el arraigo con vigilancia de la autoridad. La que ejercerán el Ministerio Público y la Policía del Estado. La petición de arraigo se resolverá dentro de las tres horas siguientes.\nEl arraigo se otorgará por el tiempo que el Ministerio Público estime indispensable para integrar la indagatoria; sin que pueda exceder de cuarenta días. En la solicitud se anunciarán las diligencias que se estime necesario practicar, pero tal enunciación no será vinculatoria para el Ministerio Público, por lo que podrá desahogar diligencias distintas u omitir las anunciadas. arraigo, éste se prolongará hasta que el juzgador resuelva sobre la orden de aprehensión o comparecencia; y, además, por el tiempo indispensable para ejecutarla. En tales casos, el juzgador resolverá sobre la aprehensión o comparecencia a más tardar al día siguiente laborable de la consignación.\nARTÍCULO 185.- MODALIDADES DE ARRAIGO DEL INDICIADO. El arraigo podrá consistir en una o más de las modalidades siguientes:\n(REFORMADO, P.O. 12 DE MAYO DE 2009)\n1) Que el indiciado se sujete a la vigilancia de la Policía del Estado y evite salir de la ciudad sin permiso del\nMinisterio Público. 2) Que se presente periódicamente a la oficina del Ministerio Público. En la petición de arraigo se precisará el lugar y la periodicidad. 3) Que el indiciado permanezca en su domicilio, con o sin traslado al lugar de trabajo, de educación o capacitación. A los mayores de setenta años de edad sólo se les podrá aplicar esta medida.\n4) Que permanezca en habitación de hotel o en casa habilitada para el efecto por parte del Ministerio Público y a su costa. 6) Que se sujete a vigilancia por medio de brazalete o dispositivo electrónico de localización.\nEl Ministerio Público precisará y motivará en la petición al Juez, las medidas de arraigo que estime conducentes.\nLa modalidad del arraigo decretado y, en su caso, el lugar en que deba de cumplirse podrá ser modificada en cualquier momento por el Juez que lo haya ordenado, siempre que razonadamente se lo solicite el Ministerio Público.\nCAPÍTULO IV.\nDISPOSICIONES COMUNES PARA DETENIDOS, RETENIDOS Y ARRAIGADOS.\nARTÍCULO 186.- ATENCIÓN MÉDICA. Cuando la persona retenida, detenida o arraigada esté enferma o lesionada y necesite atención hospitalaria, el Ministerio Público podrá autorizar el traslado de aquélla a un hospital público o privado. Para ello, recabará los informes médicos conducentes y tomará las medidas necesarias para evitar la fuga del inculpado. Si se tratare de arraigado, comunicará lo anterior sin demora al Juez que lo hubiere decretado para que modifique el lugar o la modalidad autorizada por el tiempo que dure la estancia hospitalaria.\nARTÍCULO 187.- ARRAIGO Y CUSTODIA EN HOSPITALES. Si la persona a quien se pretende arraigar se encuentra bajo atención médica en instituciones de salud, el Ministerio Público podrá solicitar al Juez que el arraigo se ejecute en dicho lugar en tanto dure su estancia; al término de la cual el arraigo se ejecutará en los términos de lo dispuesto por el artículo 185 de esta Ley.\nCuando el detenido fuere puesto a disposición del Ministerio Público en hospital o institución de salud, éstas serán consideradas como su lugar de reclusión por el tiempo que dure su estancia. Para el efecto el Ministerio Público ordenará las medidas necesarias para su debida custodia.\nARTÍCULO 188.- INTERVENCIÓN DEL DETENIDO, RETENIDO O ARRAIGADO EN INDAGATORIAS DISTINTAS\nA LA QUE MOTIVA SU CONDICION. El inculpado que se encuentre detenido, retenido o arraigado podrá actuar e intervenir en indagatorias distintas a aquella que motive dicha situación jurídica; pero será necesario que en las diligencias en que intervenga se haga constar dicha circunstancia.\nTÍTULO SÉPTIMO.\nINTERVENCIÓN DE COMUNICACIONES PRIVADAS.\nCAPÍTULO UNICO.\nDISPOSICIONES GENERALES:\nARTÍCULO 189.- INTERVENCIÓN DE COMUNICACIONES. El Fiscal General podrá solicitar al Juez de Distrito en turno, la autorización de intervención de comunicaciones privadas de las personas que aparezcan como inculpadas y de los inculpados.\nLa solicitud de intervención de comunicaciones privadas, deberá contener:\nI. Los indicios que hagan presumir, fundadamente, la posible comisión de un delito.\nII. Los preceptos legales que la fundan.\nIII. El razonamiento por el que se considera procedente.\nIV. El objeto y la necesidad de la intervención.\nV. El tipo de comunicaciones, los sujetos y los lugares que serán intervenidos.\n(REFORMADA, P.O. 12 DE MAYO DE 2009)\nVI. El período durante el cual se llevarán a cabo las intervenciones. Éste podrá ser prorrogado, sin que él mismo, incluyendo sus prórrogas, pueda exceder de seis meses; después de dicho plazo, solo se podrán autorizarse nuevas intervenciones cuando el Fiscal General, acredite nuevos elementos que así lo justifiquen.\nVII. En su caso, las instituciones públicas o privadas referentes al ramo de comunicaciones de que se trate y los modos específicos en que colaborarán en la Intervención de comunicaciones privadas.\nPara los efectos de la presente Ley, podrán ser objeto de intervención: las comunicaciones que se realicen en forma oral, escrita, por signos, señales o mediante el empleo de aparatos electrónicos, eléctricos, mecánicos, alámbricos, inalámbricos, sistemas de cómputo o equipos informáticos; así como cualquier otro medio o forma que permita la comunicación entre uno o varios emisores y uno o varios receptores.\nARTÍCULO 190.- NORMAS APLICABLES EN MATERIA DE INTERVENCIÓN DE COMUNICACIONES. La autorización de la intervención de comunicaciones deberá sujetarse a lo establecido, en su caso, en el Código\nFederal de Procedimientos Penales, la Ley Federal contra la Delincuencia Organizada y demás ordenamientos aplicables. términos de los ordenamientos señalados en el primer párrafo de este artículo.\nARTÍCULO 191.- FORMALIDADES DE LA INTERVENCIÓN. El Ministerio Público deberá levantar acta circunstanciada de la intervención de comunicaciones privadas que realice, la cual contendrá:\nI. Las fechas de inicio y conclusión de la intervención de comunicaciones privadas.\nII. El inventario pormenorizado de los documentos, objetos y cintas de audio o video que contengan los sonidos o imágenes captadas durante la misma.\nIII. La identificación de quienes hayan participado en las diligencias, así como los demás datos que considere relevantes para la investigación.\nLas cintas originales y el duplicado de cada una de ellas, se numerarán progresivamente y contendrán los datos necesarios para su identificación, debiéndose guardar en sobre cerrado y bajo las formalidades establecidas para la preservación de las evidencias del delito.\nARTÍCULO 192.- CUSTODIA DE LAS CINTAS. Durante la Averiguación Previa, las cintas y datos que se obtengan como resultado de la intervención de comunicaciones privadas, se mantendrán bajo el más estricto resguardo del\nMinisterio Público.\nEn caso de que no se ejercite acción penal el Ministerio Público será el responsable de la destrucción de los medios de prueba que se obtengan con motivo de la intervención de comunicaciones, lo que se efectuará una vez que la determinación de no ejercicio quede firme conforme a la Ley y levantando el acta correspondiente.\nAl ejercitar la acción penal el Ministerio Público pondrá a disposición de la Autoridad Judicial que conozca del proceso, las cintas y evidencias que con motivo de la intervención haya obtenido, las que a partir de ese momento quedarán bajo su resguardo y responsabilidad. Asimismo, podrá ponerlas a disposición del inculpado y de su defensor, por un término de diez días, bajo la supervisión adecuada, tomando todas las medidas necesarias para evitar su alteración o destrucción.\nTÍTULO OCTAVO.\nDEL CARÁCTER PROBATORIO DE LAS DILIGENCIAS MINISTERIALES.\nCAPÍTULO I.\nGENERALIDADES SOBRE LA PRUEBA.\nARTÍCULO 193.- FINALIDAD PROBATORIA DE LA AVERIGUACIÓN PREVIA. Durante la Averiguación Previa el\nMinisterio Público reunirá las pruebas que tiendan a acreditar las categorías procesales y las condiciones necesarias para el ejercicio de la acción penal, así como para sustentar las pretensiones que de ella deriven; o bien, aquellas que demuestren los extremos que sustenten su no ejercicio. En tal virtud, las diligencias y actuaciones que practique el Ministerio Público tendrán siempre carácter probatorio.\nPara tal fin, el Ministerio Público desahogará cuantas diligencias estime conducentes e incorporará los medios de prueba que le alleguen quienes intervengan en la indagatoria, en los términos y condiciones que esta Ley prevé.\nARTÍCULO 194.- OBJETO DE PRUEBA. Sólo los hechos son objeto de prueba. Será objeto de prueba: 1) Todo lo que puede representar una conducta humana, los sucesos o acontecimientos, hechos o actos humanos, voluntarios o involuntarios, individuales o colectivos; que sea perceptibles. 2) Los hechos de la Naturaleza. 3) Las cosas o los objetos materiales; así como cualquier aspecto de la realidad material, sea o no producto del hombre, incluyendo documentos. 4) La persona física humana, su existencia y características. 5) Los estados y hechos psíquicos del hombre, incluyendo el conocimiento subjetivo, cierta intención o voluntad y el consentimiento tácito o la conformidad.\nNo se considera como objeto de prueba al Derecho, con excepción de cuando se refiera a una ley extranjera.\nARTÍCULO 195.- HECHOS NOTORIOS. No es necesario probar los hechos notorios, los cuales deben ser hechos tan generalmente conocidos que produzcan en la conciencia una convicción plena, racionalmente superior a la que nace de la prueba.\nCuando sea el caso, el Ministerio Público podrá desahogar diligencia en la que haga constar el hecho que estima notorio y el razonamiento que conduzca a tal apreciación.\nARTÍCULO 196.- PRUEBA CONTRA PRESUNCIÓN LEGAL. Cuando un hecho goza de presunción legal está exento de prueba; sin embargo se admitirán pruebas en contrario cuando así lo determine la norma jurídica que establezca la presunción legal.\nARTÍCULO 197.- IGUALDAD Y OPORTUNIDAD PROBATORIA. Dentro de la Averiguación Previa se recibirán todos los medios de prueba que ofrezcan tanto la defensa y/o el inculpado, como el ofendido o víctima, por sí o por conducto de sus abogados; siempre y cuando digan qué es en particular lo que desean acreditar y ello sea conducente a los fines de la Averiguación Previa. Sin embargo, las pruebas que se ofrezcan cuando ya existan indicios suficientes para acreditar el cuerpo del delito y la probable responsabilidad penal no se admitirán, a fin de evitar la dilación de la consignación de la Averiguación Previa Penal. Tampoco se admitirán pruebas cuando ya se haya emitido vista o determinación de no ejercicio de la acción penal.\nARTÍCULO 198.- QUERELLANTE Y LA CARGA DE LA PRUEBA. En los delitos que se persiguen por querella, quien la presente tendrá la obligación de allegar a la Averiguación Previa todas las pruebas que tenga a su alcance para acreditar los hechos que pretenda probar, sin perjuicio de la obligación constitucional del Ministerio Público de investigar el delito. Sin embargo, cuando de las constancias que obran en la indagatoria se desprenda que existen pruebas que sólo del querellante se puedan obtener y que sean determinantes para los fines de la indagatoria, el\nMinisterio Público requerirá al querellante para que en los términos expresados por esta Ley, presente dichas probanzas. En caso de no presentarlas se considerará como abandono de la querella y será causa de inejercicio de la acción penal.\nARTÍCULO 199.- PRUEBA COMÚN. Cuando el Ministerio Público deba desahogar un medio de prueba relativo a una pluralidad de hechos de igual o similar naturaleza que sean materia de la misma o diversa indagatoria, podrá realizarla en un solo acto. Cuando sea el caso bastará que agregue un tanto o copia certificada de la constancia en que se hubiere hecho constar su desahogo, para que se tenga como si se hubiera desahogado en la indagatoria de que se trate y para que surta efectos con relación a todos los hechos sujetos a investigación sobre los que hubiere versado.\nARTÍCULO 200.- PRUEBA TRASLADADA. Los medios de prueba que se practiquen válidamente en una\nAveriguación Previa o proceso, se podrán trasladar a otra en copia auténtica. No se requerirán mas formalidades para que se tengan como si se hubieran desahogado en la indagatoria de que se trate; pero ello no excluirá que se dé a la contraparte su derecho a contradecirlos; ni que se valoren según la naturaleza del medio de prueba que contengan.\nARTÍCULO 201.- PETICIÓN DE PRUEBAS AL JUEZ EN VÍA DE AVERIGUACIÓN PREVIA. El Ministerio Público recabarse. Dicha petición no suspende la facultad investigadora del Ministerio Público por lo que podrá recabar medios de prueba como autoridad, reservándose la facultad para ejercitar acción penal. Sin embargo, si lo estima indispensable ejercitará acción penal, pondrá la Averiguación Previa a disposición del Juez y en su oportunidad, según el resultado de los medios de prueba solicitados, concretará su acusación y pedirá orden de aprehensión o comparecencia, según corresponda. constancias de la Averiguación Previa que motiven la petición. Una vez que el Juez admita el medio de prueba, lo desahogará con reserva y en privado, con asistencia del Ministerio Público cuando así se requiera. En caso contrario se declarará desierto. Se entregará al Ministerio Público copia certificada del medio de prueba desahogado y el original se guardará en secreto.\nPara pedir cateo, será innecesario ejercitar acción penal, salvo que a la vez se solicite la orden de aprehensión o comparecencia.\nARTÍCULO 202.- PRUEBA ANTICIPADA. El Ministerio Público podrá preparar el juicio solicitando al Juez el desahogo anticipado de pruebas, sin necesidad de ejercitar acción penal, en cualquiera de los casos siguientes:\nI. Cuando se trate de pruebas periciales cuyo desahogo implique la destrucción o el consumo de la sustancia, evidencia u objeto sobre el que deba recaer.\nII. Cuando la conservación del objeto o la evidencia sobre la que deba recaer un medio de prueba resulte gravoso o perjudicial para el titular de los derechos sobre ellas o para quien tenga a su cargo dicha conservación.\nIII. Cuando el objeto o evidencia sobre el que deba recaer alguna prueba, se pueda deteriorar o desvanecer por el sólo paso del tiempo.\nIV. Cuando exista el riesgo fundado de que quien deponga en la indagatoria se ausente del lugar en que deba llevarse el proceso y no comparezca al mismo; o cuando se trate de personas de edad avanzada o en condiciones precarias de salud que pongan en riesgo su comparecencia.\nCualquiera que sea el caso, el Ministerio Público deberá expresar el objeto de la prueba, justificar la necesidad de su desahogo en tal forma y señalar el nombre y domicilio de la persona que aparezca como inculpado; así como la imputación que pretenda formularle. El Juez desahogará la prueba conforme a lo dispuesto por el Código de\nProcedimientos Penales, pero citará previamente al inculpado a fin de hacerle saber la imputación que el Ministerio\nPúblico pretenda formularle. En ese mismo acto el Juez prevendrá al inculpado de que cualquier intervención que le pueda corresponder en el desahogo de la probanza solicitada o para el desahogo de diversa prueba derivada de la ofrecida por el Ministerio Público, deberá ejercerse hasta antes de que la misma se lleve a cabo; y que de no hacerlo perderá su derecho a hacerlo durante el proceso.\nLa prueba así desahogada surtirá sus efectos como si se hubiera desahogado dentro del proceso siempre que el\nMinisterio Público la aporte durante el mismo y no hubiere variado la imputación hecha al quejoso.\nContra la negativa del Juez a desahogar la prueba anticipada procede el recurso de apelación.\nARTÍCULO 203.- REQUISITOS DE LAS DILIGENCIAS PROBATORIAS. El Ministerio Público podrá desahogar cualquier medio de prueba que no sea contraria a derecho, aunque no se encuentre específicamente nominada o reglamentada. Se exceptúan de lo anterior los careos, los que no podrán practicarse en Averiguación Previa. Para en el presente título para cada una de ellas.\nARTÍCULO 204.- VALORACIÓN DE LAS PRUEBAS PRACTICADAS EN AVERIGUACIÓN PREVIA. Las pruebas practicadas en Averiguación Previa se valorarán conforme a lo dispuesto por el Código de Procedimientos Penales; pero para apreciar su legal constitución, tanto durante la indagatoria como en el proceso, se atenderá a lo dispuesto por esta Ley.\nCAPÍTULO II.\nDE LOS PARTES INFORMATIVOS.\nARTÍCULO 205.- REQUISITOS DE LOS PARTES INFORMATIVOS. Los partes informativos deberán contener:\nI. Los datos referentes a la causa que motivó la intervención de los agentes policiales que hubieren participado en su elaboración.\nII. La descripción de las investigaciones realizadas con inclusión de los datos que identifiquen sus fuentes de información, cuando ello sea posible; o la causa por la que no hubiere sido posible obtenerlos.\nIII. Cuando se hubiere asegurado a alguna persona: la fecha, hora, lugar y circunstancias de la detención; los datos la captura.\nIV. Los datos a que se refiere el artículo 131 de la presente Ley, cuando se hubiere recolectado u obtenido evidencia física.\nV. Los nombres de todos los oficiales que hubieren participado en la diligencia o los datos que conduzcan a su identificación.\nVI. La fecha y lugar de emisión del parte; y\nVII. La firma de cuando menos uno de los agentes que hubieren intervenido en las acciones; pero si se tratare del aseguramiento de persona será necesaria la firma de todos los que materialmente hubieren realizado la detención.\nSólo quienes hubieren intervenido en las acciones podrán suscribir el parte informativo.\nARTÍCULO 206.- PROHIBICIONES CON RELACIÓN AL PARTE INFORMATIVO. En el parte informativo no se podrán desahogar confesiones, mas si se hicieren, las mismas carecerán de valor. No se atenderá a las referencias de testigos, cuando los mismos no se hubieren identificado.\nLas referencias propias de los agentes policiales sólo serán atendibles cuando los mismos hayan observado directamente los hechos sobre los que versen o capturado inmediatamente después de cometido el delito al inculpado si éste tenía en su poder el objeto materia del delito.\nARTÍCULO 207.- RATIFICACIÓN INNECESARIA. No será necesaria la ratificación del parte informativo para su validez; pero cuando el Ministerio Público lo estime necesario podrá hacer comparecer a quienes lo suscriban para que reconozcan su contenido o firma o para que amplíen o aclaren la información que contengan.\nCAPÍTULO III.\nDE LA DENUNCIA O QUERELLA.\nARTÍCULO 208.- ALCANCE PROBATORIO DE LA DENUNCIA Y QUERELLA. Las denuncias y querellas se valorarán como pruebas siempre que:\nI. Hayan sido formuladas ante el Ministerio Público, por persona cierta y bajo protesta de decir verdad.\nII. Se hubiere apercibido a quien la presente de las penas aplicables a quienes se conducen con falsedad ante una autoridad en ejercicio de sus funciones.\nIII. Se circunstancien los hechos sobre los que versen.\nARTÍCULO 209.- AMPLIACIÓN Y ACLARACIÓN DE DENUNCIAS Y QUERELLAS. Las ampliaciones y aclaraciones que se hicieren de las denuncias y querellas se considerarán como partes integrantes de las mismas.\nCAPÍTULO IV.\nDE LA IDENTIFICACIÓN DE AUDIO E IMÁGENES.\nARTÍCULO 210.- IDENTIFICACIÓN POR MEDIO DE FOTOGRAFÍAS O VIDEO. Cuando no fuere posible la presentación de la persona a quien se deba identificar, su identificación podrá hacerse por medio de fotografía o imagen de video, siempre que las mismas posean nitidez suficiente para apreciar a simple vista los rasgos y características de la cara y tengan una antigüedad menor a un año desde que hubieren sido tomadas hasta la fecha de la diligencia. En estos casos el Ministerio Público deberá hacer constar la forma en que obtuvo dicha imagen y quien realice la identificación deberá expresar los motivos para ello.\nSi la persona identificada aparece con posterioridad se procederá a la confrontación, si ello fuere posible.\nARTÍCULO 211.- IDENTIFICACIÓN DE VOZ. Cuando quien deponga en la indagatoria manifieste que puede identificar a la persona por su voz y el Ministerio Público tenga grabaciones o registros de la misma, se procederá a reproducirlas en su presencia para que señale si reconoce o no la voz o la grabación como aquellas que refiera haber escuchado. En la diligencia se asentará la forma en que el Ministerio Público hubiere obtenido las grabaciones o registros y todas las observaciones que señale el deponente.\nCAPÍTULO V.\nDE LA CONFRONTACIÓN.\nARTÍCULO 212.- CASOS EN QUE PROCEDE LA CONFRONTACIÓN. Procederá la confrontación, cuando quien declare no pueda dar noticia exacta de la persona a la que se refiera, pero exprese poder reconocerla si se le presenta o la escucha; o cuando asegure conocer a una persona y exista motivo para sospechar que no la conoce.\nLa confrontación podrá ser visual o auditiva.\nARTÍCULO 213.- FORMA DE DESARROLLAR LA CONFRONTACIÓN VISUAL. Para llevar a cabo la confrontación visual se interrogará a quien deba hacer la identificación, bajo protesta de decir verdad y con los apercibimientos para las personas que se conducen con falsedad, respecto de las características de la persona de que se trate; si la conoce o con anterioridad la ha visto en persona o en imágenes; si después del hecho volvió a verla, en qué lugar y con qué motivo; y si persiste en lo que hubiere declarado previamente.\nEnseguida se invitará a la persona que deba ser sometida a reconocimiento a que escoja su colocación entre cuando menos cuatro personas más de aspecto físico y vestimentas semejantes y se solicitará, a quien deba efectuar el reconocimiento, que diga si entre las personas presentes se halla aquella a la que se hubiere referido en sus declaraciones y, en caso afirmativo, la señale con precisión. Si la reconoce se le interrogará respecto de las hubiere aludido en su declaración. personas sujetas a reconocimiento, el número que se les hubiere asignado y las demás circunstancias que se estimen relevantes.\nLa confrontación procederá aún sin consentimiento del inculpado, pero siempre en presencia de su defensor. Quien fila de sujetos a reconocimiento. Se tomarán las previsiones necesarias para que el inculpado no altere u oculte su apariencia.\nSi fueren varios los sujetos a confrontación, se practicará una diligencia por cada uno de ellos.\nARTÍCULO 214.- FORMA DE DESARROLLAR LA CONFRONTACIÓN AUDITIVA. Cuando quien deponga en la indagatoria señale no haber visto a la persona a la que se hubiere referido, pero sí escuchado su voz, se procederá de la siguiente forma:\nSe interrogará a quien deba hacer la identificación, bajo protesta de decir verdad y con los apercibimientos para las personas que se conducen con falsedad, respecto de las características de la voz de la persona de que se trate; si la conoce o con anterioridad la ha escuchado; si después del hecho volvió a oírla, en qué lugar y con qué motivo; y si persiste en lo que hubiere declarado previamente.\nEnseguida se solicitará a la persona que deba ser sometida a reconocimiento a que escoja su turno entre cuando menos cuatro personas más de su mismo sexo, edad aproximada y similar grado de instrucción.\nActo seguido el Ministerio Público pedirá a cada uno de los participantes, según su turno y por separado, que lean en voz alta, por espacio de cinco minutos, un texto previamente seleccionado por la autoridad que lleve a cabo la diligencia y, concluida la intervención de todos, se pedirá a quien deba hacer la identificación que manifieste si reconoce la voz de la persona a la que se hubiere referido en sus declaraciones y, en caso afirmativo, la señale con precisión. Quien deba efectuar el reconocimiento deberá ser ubicado en un lugar desde el cual no sea visto por los integrantes de la ronda de sujetos a reconocimiento.\nSi el inculpado no supiere leer se les dictará a todos los participantes el texto por cualquier medio técnico que permita su fluidez. En cualquier caso el texto deberá referirse a cuestiones ajenas a la indagatoria.\nEn el acta de la diligencia se hará constar el nombre y domicilio de las personas que hubieren integrado la ronda de personas sujetas a reconocimiento, el turno que se les hubiere asignado y las demás circunstancias que se estimen relevantes.\nSi el inculpado se negare a participar en la diligencia se hará constar en el acta dicha circunstancia sin hacerla del conocimiento de quien deba realizar la identificación.\nSi fueren varios los sujetos a confrontación, se practicará una diligencia por cada uno de ellos.\nLa diligencia se grabará en cinta de audio para que, si existiere sospecha de que alguno de los participantes simuló o modificó su voz, se hagan los peritajes correspondientes.\nCAPÍTULO VI.\nDE LAS INSPECCIONES.\nARTÍCULO 215.- CONTENIDO DE LAS INSPECCIONES. Mediante la inspección se describirá y se dejará constancia del estado de las personas, las características de los lugares, las cosas, las huellas, vestigios y cualquier o partícipes. En la diligencia podrá ordenarse o procederse a la recolección de evidencia en los términos señalados en la presente Ley.\nSi el hecho no hubiere dejado rastros o no hubiere producido efectos materiales, o si éstos hubieren desaparecido o exista evidencia de su alteración; se procurará describir el estado de lo que fuere objeto de inspección y, en su caso, el modo, tiempo y causa posible de su alteración o desaparición; así como los indicios a partir de los cuales se obtuvo ese conocimiento.\nPara la práctica de inspecciones el Ministerio Público podrá auxiliarse de peritos, pero lo que los mismos manifiesten en su apoyo u orientación se hará constar con razón de dicha circunstancia. su estado físico o emocional.\nCuando se inspeccione un lugar se identificará con precisión su ubicación. Si el lugar estuviere ubicado en área urbana o rural sin calles o sin nomenclatura que las identifique, el Ministerio Público procurará auxiliarse de testigos del lugar, asentando sus generales y la razón de su dicho. tenga en su poder o bajo su resguardo, además de todo lo que sea objeto de la inspección.\nARTÍCULO 216.- MEDIOS DE DESCRIPCIÓN. Para la descripción de lo que se inspeccione podrán emplearse dibujos, planos topográficos, fotografías ordinarias o métricas, moldeados o cualquier otro medio para reproducir las cosas; haciéndose constar cuales se emplearon, en qué forma y con qué objeto.\nSe hará la descripción de todo lo que no hubiere sido posible efectuar por los medios anteriores; pero se procurará fijar con claridad las señales o vestigios dejados por el delito; así como el instrumento o medio que posiblemente se empleó para provocarlos.\nEn cualquier caso se podrá optar por desahogar la diligencia por cualquiera de los medios a que se refiere el artículo\n69 de la presente Ley.\nARTÍCULO 217.- DECLARACIÓN DE PERSONAS DURANTE LAS INSPECCIONES. Al practicar una inspección se podrán asentar las declaraciones de las personas que se encuentren presentes y puedan proporcionar algún dato útil; sin perjuicio de que, si se estima necesario, posteriormente se recaben sus informaciones testimoniales en debida forma.\nCAPÍTULO VII.\nDE LA RECONSTRUCCIÓN DE HECHOS.\nARTÍCULO 218.- CASOS EN QUE PROCEDE LA RECONSTRUCCIÓN DE HECHOS. La reconstrucción de hechos se practicará siempre que la naturaleza del hecho y los medios de prueba recabados la hagan necesaria. Su objeto será recrear el hecho delictivo con base en las deposiciones que obren en la indagatoria.\nCuando existan varias versiones de los hechos y las mismas sean discrepantes, el Ministerio Público podrá practicar reconstrucción de hechos por cada una de ellas. y peritajes procedentes.\nARTÍCULO 219.- FORMA DE DESARROLLAR LA RECONSTRUCCIÓN DE HECHOS. La reconstrucción de hechos se verificará en el lugar y la hora en que se cometió el delito, si ello fuera relevante para el esclarecimiento de los hechos; pero cuando no sea posible podrá efectuarse en cualquier hora y lugar. posiciones y realicen las acciones que el deponente, cuya versión se reconstruye, vaya describiendo. El deponente expresará libremente su versión de los hechos, pero el Ministerio Público podrá pedirle que explique, aclare o amplíe la misma, cuando lo estime necesario. En las reconstrucciones de las versiones de los testigos, podrá estar presente y tener intervención el inculpado, si así lo solicita; pero en la reconstrucción de la versión del inculpado, sólo se atenderá a lo que el mismo manifieste.\nEn la diligencia podrán estar presentes, además, el ofendido o víctima y los peritos que disponga el Ministerio\nPúblico; pero los mismos no tendrán participación activa en la misma.\nLa reconstrucción se hará constar en cualquiera de las formas a que se refiere el artículo 69 de la presente Ley; pero si se hiciere mediante acta será necesario que además se agreguen fotografías tomadas de la diligencia.\nARTÍCULO 220.- PERITAJES DERIVADOS DE LA RECONSTRUCCIÓN DE HECHOS. Cuando fuere necesario podrán ponerse las diligencias de reconstrucción de hechos levantadas, junto con las demás constancias que se estimen pertinentes, a disposición del perito que determine el Ministerio Público para que, mediante dictamen pericial, determine si la versión recreada resulta o no congruente con la información pericial que obre en la indagatoria.\nCAPÍTULO VIII.\nDE LOS TESTIMONIOS.\nARTÍCULO 221.- OBLIGACIÓN DE TESTIFICAR. Toda persona, cualquiera que sea su edad, sexo o condición social, tiene el deber de rendir testimonio ante el Agente del Ministerio Público que se lo pida o concurrir por sí mismo, cuando tenga conocimiento de algún hecho posiblemente delictivo. El testigo no tendrá obligación de declarar en los casos que determine esta Ley.\nARTÍCULO 222.- QUIÉNES ESTÁN FACULTADOS PARA NO DECLARAR. El Ministerio Público deberá informar al testigo que podrá abstenerse de declarar en los supuestos siguientes:\nI. Cuando el inculpado sea su cónyuge, persona unida en pacto civil de solidaridad, adoptante o adoptado; tutor, curador o pupilo; así como cuando hubiere vivido en forma permanente con el inculpado por un lapso de dos años anteriores al hecho.\nII. Cuando tenga con el inculpado parentesco por consanguinidad o afinidad en línea recta ascendente o descendente sin limitación de grados y en la colateral hasta el cuarto grado. Motivos de afecto por intimidad, estrecha amistad o gratitud.\nIII. Cuando tenga obligación de guardar secreto profesional.\nEl motivo de abstención se deberá de comprobar en forma eficaz con medios de prueba conducentes. Sin embargo, no podrán abstenerse de declarar cuando el delito no se pueda comprobar de otra manera; salvo que se trate de quienes deban guardar el secreto profesional.\nARTÍCULO 223.- TESTIMONIO POR ESCRITO DE ALGUNOS SERVIDORES PÚBLICOS. Se solicitará que rindan testimonio por escrito, previo interrogatorio que se les envíe, o se acudirá al lugar de trabajo a tomarles testimonio: al\nGobernador, Diputados, Magistrados, Fiscal General y Fiscales Especializados; Secretarios y Subsecretarios del\nEjecutivo Estatal; Jueces, Directores Generales de la Administración Central Estatal, Presidentes Municipales, Regidores o Síndicos; así como a los Directores o Representantes de entidades paraestatales o paramunicipales; descentralizadas o desconcentradas.\nARTÍCULO 224.- TESTIMONIOS ESPECIALES. Cuando se deban recibir testimonios de menores de edad u ofendidos de los delitos de violación en cualquiera de sus modalidades, corrupción de menores o secuestro; el especializados.\nLos menores de dieciocho años siempre deberán estar acompañados de alguno de sus padres, tutor, representante legal o de persona designada por la dependencia encargada de la representación o protección de los menores.\nARTÍCULO 225.- IDENTIFICACIÓN Y PROTESTA DE TESTIGOS. Antes de que el testigo comience a declarar, se le pedirá identificación, haciendo constar los datos del documento con el que se identifique. Si el testigo no porta identificación bastará la presencia de diversa persona que dé razón de su identidad. Después, se le instruirá acerca de las sanciones que el Código Penal establece para quien se conduce con falsedad o se niega a declarar.\nEnseguida, se le tomará la protesta de decir verdad y se le hará saber su derecho a contar con abogado para que lo asista en la diligencia, quien podrá objetar las preguntas que se le formulen, pero no podrá producirle las respuestas.\nA los menores de dieciocho años sólo se les exhortará para que se conduzcan con verdad.\nARTÍCULO 226.- GENERALES DE LOS TESTIGOS. Después de tomarle al testigo la protesta de decir verdad, se le preguntará su nombre, apellidos, edad, lugar de origen, domicilio, estado civil, profesión y ocupación. Igualmente, si tiene relación con el inculpado, ofendido o víctimas por vínculos de parentesco, amistad o cualesquier otro. Así como si tiene algún motivo de odio o rencor contra alguno de ellos.\nARTÍCULO 227.- FORMA Y CONTENIDO DEL TESTIMONIO. Los testigos declararán de viva voz. Hasta donde sea posible las declaraciones se asentarán con las mismas palabras que emplee el testigo.\nNarrará los hechos preferentemente en la forma secuencial que los percibió. Cuando el testigo no conozca o no recuerde el nombre de alguna persona, dará las señas particulares y demás pormenores que sirvan para identificarla.\nAsí mismo, estará obligado a explicar, cuándo, en qué lugar y de qué manera percibió el hecho sobre el que declara, lo cual constituye la razón de su dicho.\nLas manifestaciones que no tengan relación con los temas de prueba se podrán excluir del acta.\nDespués se le harán las preguntas que se estimen necesarias para conocer la verdad histórica del hecho; o acerca de los puntos de su testimonio; o de cualquier otra circunstancia que se estime pertinente.\nEl ofendido, inculpado o su defensor tienen derecho a formular preguntas al testigo, por conducto del Ministerio\nPúblico, quien podrá desechar las preguntas que estime notoriamente inconducentes o capciosas.\nEl Ministerio Público, en la misma diligencia, podrá solicitar al testigo que aclare o amplíe lo que hubiere declarado o respondido.\nARTÍCULO 228.- RESPUESTA DE LOS TESTIGOS. En el acta se hará constar cada pregunta que se formule al testigo, la objeción si lo hubiere y, en su caso, si ésta se admitió o desechó. Enseguida se hará constar la respuesta y las aclaraciones pertinentes.\nNo tendrá valor la respuesta en la que no aparezca la pregunta previa. No se asentará la respuesta que se dé cuando la pregunta se objete con oportunidad y se admita la objeción. De ello se prevendrá al testigo. Cuando el testigo no entienda una pregunta podrá solicitar que se le aclare.\nARTÍCULO 229.- DECLARACIONES SOBRE OBJETOS Y VESTIGIOS. Si el testimonio se refiere a algún objeto, después de interrogar al testigo sobre las señas que le caractericen, se le pondrá a la vista para que lo reconozca, si ello fuere posible.\nCuando el testimonio se refiera a un hecho que dejó vestigios en algún lugar, se podrá acudir al lugar con el testigo para que él dé la explicación pertinente.\nARTÍCULO 230.- LECTURA DE LA DECLARACIÓN DEL TESTIGO. El Ministerio Público hará saber al testigo que tiene derecho de leer por sí mismo su declaración, una vez que se levante el acta. Si no puede hacerlo se la leerá el\nMinisterio Público, traductor o intérprete según el caso. Posteriormente se recabará la firma o huella digital en la forma prevista por esta Ley.\nARTÍCULO 231.- TESTIMONIO TÉCNICO. El testimonio será técnico cuando verse sobre hechos apreciados mediante determinado conocimiento técnico, científico o artístico y quien lo rinda posea título debidamente expedido en la materia.\nARTÍCULO 232.- LOS TESTIGOS NO SON TACHABLES. En materia penal no pueden oponerse tachas a los testigos. Pero de oficio o a petición de parte, el Ministerio Público hará constar las circunstancias que puedan influir en el valor probatorio de las declaraciones.\nARTÍCULO 233.- ACUSACIÓN POR FALSO TESTIMONIO. En caso de que un testigo falte a la verdad, se ordenará sacar copia de las actuaciones conducentes al falso testimonio y se integrará Averiguación Previa conforme a\nDerecho.\nSi es manifiesta la comisión del delito en el momento de la declaración del testigo, se le podrá detener desde luego.\nARTÍCULO 234.- ARRAIGO DEL TESTIGO. Cuando algún testigo tenga que ausentarse del lugar donde se sigue la\nAveriguación Previa, el Ministerio Público procederá a tomarle declaración si fuere posible; de lo contrario se pedirá a la Autoridad Judicial arraigo para que el testigo permanezca por el tiempo indispensable para que comparezca a declarar.\nCAPÍTULO IX.\nDE LA DECLARACIÓN DEL INCULPADO.\nARTÍCULO 235.- APERSONAMIENTO DEL INCULPADO EN LA INDAGATORIA. Cuando el inculpado comparezca por primera vez a la indagatoria se le harán de su conocimiento y se cumplirán en lo conducente, los derechos a que se refieren los artículos 29 y 30 de la presente Ley. Si el inculpado hubiere sido detenido en flagrancia, lo anterior se realizará en el propio acuerdo de retención o inmediatamente después de éste. Cuando se trate de detención por caso urgente se procederá a ello tan pronto haya sido puesto a disposición del Ministerio Público. En cualquier caso se levantará constancia. en el párrafo anterior, salvo que el mismo hubiere sido sujeto a alguna medida de aseguramiento, restricción, cateo o de afectación a su persona o sus bienes derivadas de la propia indagatoria. Las promociones o escritos que presente en contravención a lo señalado, ningún efecto producirán. efecto, se levantará constancia de ello con la que se dará por cumplido lo dispuesto en el presente artículo.\nARTÍCULO 236.- DECLARACIÓN DEL INCULPADO. En la misma diligencia a que se refiere el artículo anterior o con posterioridad a ella, el inculpado podrá deponer sobre los hechos materia de la indagatoria, pero sólo si así lo desea.\nCuando el inculpado desee presentar su declaración por escrito, podrá hacerlo; sin embargo deberá reconocer en forma expresa tanto su contenido como su firma ante el Ministerio Público.\nAl inculpado se le podrán formular preguntas por el Ministerio Público, su defensor, la parte civil, el ofendido, víctima, sus representantes legales y sus abogados; pero previamente se le prevendrá de que no está obligado a responderlas. Las preguntas siempre se formularán directamente por el Ministerio Público. Enseguida de la pregunta siempre se asentará la respuesta. Si después de formularle una pregunta el inculpado manifiesta que no la entiende, se le darán las explicaciones a que hubiere lugar. Cuando la pregunta fuere asertiva la respuesta deberá contestar si es o no es cierto el hecho objeto de la pregunta. La pregunta que no sea asertiva se deberá responder concretamente y sin evasivas. Pero en ambos casos, el inculpado podrá adicionarla con explicaciones atinentes al hecho. Las preguntas no serán capciosas ni inconducentes.\nEl Ministerio Público podrá pedir explicaciones sobre el sentido y los alcances de las preguntas y respuestas. En el acta se asentará la declaración; así como cada pregunta y a continuación la respuesta, con las palabras textuales que se utilicen. No tendrá valor la respuesta a la que no le preceda una pregunta.\nARTÍCULO 237.- CONCEPTO DE LA CONFESIÓN. La confesión es la declaración circunstanciada sobre hechos propios constitutivos del tipo penal de un delito.\nLo declarado por el inculpado, que no constituya confesión, se apreciará como testimonio; tanto en lo que le beneficie como en lo que le perjudique.\nARTÍCULO 238.- CONDICIONES PARA LA VALIDEZ DE LA CONFESIÓN. Para que la confesión del inculpado verificada durante la Averiguación Previa tenga validez, deberá rendirse:\nI. Ante el Ministerio Público.\nII. Con asistencia del defensor del inculpado, designado conforme a lo dispuesto por los artículos 30 y 31 de la presente Ley. Además, será necesario que antes de su declaración, el defensor proteste cumplir el cargo con fidelidad; si es que no lo hizo anteriormente.\nIII. Con conocimiento previo del hecho que se le atribuye y de la advertencia de que lo que diga se podrá usar en su contra. Se entenderá que se ha puesto en conocimiento del inculpado el hecho que se le atribuye, cuando se haya cumplido con lo dispuesto por el artículo 235 de esta Ley.\nIV. De manera voluntaria; sin coacción, ni incomunicación y en pleno uso de sus facultades mentales.\nCuando la confesión se rinda por escrito, deberá ratificarse con presencia del defensor.\nARTÍCULO 239.- CONFESIÓN DE DIVERSO DELITO. Para que la confesión rendida por delito diverso al que se refiera la indagatoria sea válida, será necesario que, además, se rinda en forma espontánea.\nCAPÍTULO X.\nDE LOS DOCUMENTOS.\nARTÍCULO 240.- CLASES DE DOCUMENTOS. Son documentos: los escritos, impresos, planos o dibujos. Los cuadros, fotografías y cintas cinematográficas. Los discos, grabaciones o reproducciones magnetofónicas, electrónicas, de audio o video. Las radiografías, talones, contraseñas, cupones, etiquetas, sellos y en general todo objeto mueble que tenga o reproduzca caracteres representativos o declarativos. actuaciones, los mismos serán apreciados conforme a las reglas del medio de prueba que contengan.\nEl Ministerio Público podrá de oficio verificar la autenticidad de un documento, por cualquier medio lícito que estime pertinente.\nARTÍCULO 241.- DOCUMENTOS PÚBLICOS Y PRIVADOS. Documento público es el otorgado por funcionario público en ejercicio de su cargo o generado con su intervención debida; así como los otorgados ante fedatarios públicos.\nDocumento privado es el que no reúne los requisitos para ser documento público.\nARTÍCULO 242.- DOCUMENTO AUTÉNTICO. Los documentos públicos y privados serán auténticos cuando exista certeza sobre la persona que los firmó, elaboró o de la cual emanan. El documento público se presume auténtico, mientras no se pruebe lo contrario mediante tacha o falsedad. El documento privado es auténtico en los casos siguientes:\nI. DOCUMENTO AUTÉNTICO PRIVADO POR RECONOCIMIENTO PREVIO. Si se reconoció ante el Ministerio\nPúblico, Juez o Notario; o si judicialmente se ordenó tenerlo por reconocido.\nII. DOCUMENTO AUTÉNTICO PRIVADO POR INSCRIPCIÓN EN UN REGISTRO PÚBLICO. Si se inscribió en un registro público a petición de quien lo firmó o participó en él.\nIII. DOCUMENTO AUTÉNTICO PRIVADO PORQUE NO SE TACHÓ DE FALSO OPORTUNAMENTE. Si se aportó a la Averiguación Previa afirmándose que lo suscribió o escribió aquél contra quien se opone; o se derive para éste alguna obligación o se establezca alguna circunstancia; siempre y cuando no lo tache de falso en la actuación inmediatamente siguiente en que comparezca, estando en posibilidad de hacerlo. O cuando la objeción planteada como tacha resulte inacreditada.\nIV. DOCUMENTO PRIVADO QUE JUDICIALMENTE SE DECLARÓ AUTÉNTICO. Si se declaró auténtico en providencia judicial que se dictó en proceso diverso.\nV. DOCUMENTOS EMANADOS DE TERCEROS. Si, tratándose de documentos emanados de terceros, los mismos no son objetados por quien tenga interés en ello; así como cuando la objeción resulte inacreditada.\nARTÍCULO 243.- FOTOGRAFÍAS Y CINTAS CINEMATOGRÁFICAS, DE AUDIO Y/O VIDEO. Las fotografías y cintas cinematográficas, de audio y/o video serán tenidas como medio probatorio sólo en los siguientes casos:\nI. HECHOS VERIFICADOS EN ESPACIOS PÚBLICOS. Cuando registren hechos o situaciones acontecidos en espacios públicos, independientemente de la persona o entidad que los haya grabado o registrado. Se entenderán como espacios públicos, además, los edificios, fincas o lugares en estado de abandono.\nII. HECHOS VERIFICADOS EN ESPACIOS PRIVADOS CON ACCESO AL PÚBLICO. Cuando registren hechos o situaciones verificados en espacios privados con acceso al público; siempre que los dispositivos de grabación o registro se encuentren anunciados o visibles a simple vista.\nIII. HECHOS DELICTIVOS POR SÍ MISMOS VERIFICADOS EN ESPACIOS PRIVADOS. Cuando registren hechos o situaciones por sí mismos delictivos acontecidos en espacios privados; siempre que quien los grabe o registre habite o comparta dichos espacios; así como cuando se trate de grabaciones o registros verificados por el propio inculpado o con su consentimiento.\nIV. OBJETOS O MEDIOS PARA LA COMISIÓN DEL DELITO. Cuando se trate de fotografías o cintas que constituyan el objeto del delito o el medio para su comisión.\nARTÍCULO 244.- APORTACIÓN DE DOCUMENTOS. Los documentos se aportarán a la Averiguación Previa en original o en copia. Las copias del documento podrán consistir en trascripción mecánica o por cualquier otro medio; la copia deberá ser autentificada por Notario, Ministerio Público o, en su caso, por el Juez o sus secretarios; previo el respectivo cotejo.\nARTÍCULO 245.- DOCUMENTOS QUE OBREN EN ARCHIVOS PÚBLICOS. Cuando alguna de las partes, el defensor, ofendido o víctima, ofrezca como medio de prueba un documento relacionado con el delito que se investiga, que obre en las oficinas públicas y que no pueda obtener directamente: El Ministerio Público solicitará copia certificada al funcionario respectivo, quien estará obligado a expedirla; a excepción de aquellos en los cuales la ley expresamente disponga que la solicitud deberá realizarse a través de la Autoridad Judicial respectiva.\nARTÍCULO 246.- DOCUMENTOS EN PODER DE PARTICULARES. Cuando se ofrezcan como prueba documentos que tengan relación con el delito, que sólo obren en poder de particulares: El Ministerio Público ordenará que se exhiban para su incorporación a la indagatoria o para su cotejo. Si hubiere oposición a ello se aplicarán las medidas de apremio y en su caso el cateo.\nARTÍCULO 247.- DOCUMENTOS EN IDIOMA EXTRANJERO. Los documentos en idioma extranjero se presentarán originales; pero con su traducción al español.\nSi la traducción se objeta, se ordenará que el documento se traduzca por perito que designe el Ministerio Público.\nARTÍCULO 248.- COTEJO DE DOCUMENTOS SIMPLES. Cuando se ofrezca un documento en copia simple por no estar a su alcance el original, cualquiera de las partes, defensor, ofendido o víctima, podrán solicitar su cotejo con éste. A falta de original, con una copia auténtica expedida con anterioridad a aquélla.\nARTÍCULO 249.- RECONOCIMIENTO IMPLÍCITO DE DOCUMENTOS PRIVADOS. La parte que aporte al proceso un documento privado reconoce con ello su autenticidad y no podrá impugnarlo; excepto cuando al presentarlo alegue su falsedad.\nExiste también reconocimiento implícito cuando el interesado no lo objete o promueva la tacha de falsedad.\nARTÍCULO 250. OBJECIÓN Y TACHA DE FALSEDAD. Cuando el documento incorporado a la indagatoria sea objetado o tachado de falso, se practicarán los medios de prueba que resulten conducentes para verificar su autenticidad. idóneo para el efecto.\nARTÍCULO 251.- CADENA DE CUSTODIA DE DOCUMENTOS. Cuando el documento constituya el objeto o instrumento del delito o cuando por sí mismo sea evidencia de él; se observará lo conducente a la recolección de\nCAPÍTULO XI.\nDE LAS PERICIALES.\nARTÍCULO 252.- INTERVENCIÓN DE PERITOS. Siempre que sea necesario dilucidar alguna cuestión para la que se requieran conocimientos especiales en determinada ciencia, técnica o arte; se procederá con intervención de peritos, quienes mediante dictamen suministrarán argumentos o razones para la formación de convencimiento respecto del objeto de su peritaje.\nARTÍCULO 253.- DESIGNACIÓN DE PERITOS. Cuando se requiera la intervención de peritos durante la\nAveriguación Previa, el Ministerio Público designará para la práctica de los peritajes, a los peritos oficiales que laboren en la Fiscalía General. Sólo a falta de ellos podrá designar perito de acuerdo a la prelación que establece el\nCódigo de Procedimientos Penales, los cuales acreditarán su capacidad conforme a lo dispuesto por el mismo ordenamiento jurídico.\nEl servicio pericial dentro de la Averiguación Previa es de interés público.\nARTÍCULO 254.- QUIÉNES NO PUEDEN SER PERITOS. No podrán fungir como peritos las personas que:\nI. Intervengan en la indagatoria con cualquier otro carácter.\nII. Tengan con el inculpado o con el ofendido vínculo matrimonial, pacto civil de solidaridad, adopción o tutela; así como cuando hubieren vivido en forma permanente con cualquiera de ellos por un lapso de dos años anteriores al hecho.\nIII. Tengan con el inculpado u ofendido parentesco por consanguinidad; o afinidad en línea recta ascendente o descendente sin limitación de grados y en la colateral hasta el cuarto grado. Motivos de afecto por intimidad, estrecha amistad o gratitud.\nIV. Los condenados por delitos contra el patrimonio o cualquiera de los que contempla el título Tercero, apartado\nCuarto, Libro Segundo del Código Penal.\nARTÍCULO 255.- IRRECUSABILIDAD DE LOS PERITOS. Los peritos son irrecusables; pero se deberán excusar cuando les afecte alguno de los impedimentos establecidos por esta Ley para el Ministerio Público.\nLa excusa de los peritos será calificada por el Ministerio Público que conozca de la indagatoria.\nARTÍCULO 256.- DESIGNACIÓN, ACEPTACIÓN, PROTESTA Y RATIFICACIÓN. Al designar perito, el Ministerio\nPúblico deberá indicar la cuestión que se deba dilucidar; salvo que se trate de necropsias o dictámenes de integridad física en los que bastará que se ordene su realización; o de los supuestos a que se refiere el capítulo sexto del título quinto de la presente Ley. el Código de Procedimientos Penales, se entenderá que por ese solo hecho aceptan y protestan legalmente el cargo conferido. En los demás casos será necesario que manifiesten ante el Ministerio Público su aceptación y rindan protesta de cumplir su fiel y legal desempeño.\nGeneral; pero el Ministerio Público podrá ordenar que aún en esos casos se ratifiquen.\nEn casos urgentes la protesta podrá rendirse al producir o ratificar el dictamen.\nARTÍCULO 257.- TIEMPO PARA EL PERITAJE. El Ministerio Público fijará a los peritos un plazo para rendir su dictamen. Si omite presentar su dictamen, se hará uso de los medios de apremio y/o, en su caso, se les sancionará conforme a lo establecido en esta Ley.\nARTÍCULO 258.- PERITOS MÉDICOS. Los médicos que intervengan en los supuestos a que se refiere el artículo\n154 de la presente Ley, se considerarán como peritos oficiales. Lo anterior sin perjuicio de la facultad del Ministerio\nPúblico para ordenar diverso peritaje.\nARTÍCULO 259.- NECROPSIA EN LOS HOSPITALES PÚBLICOS. La necropsia de los cadáveres de personas que con motivo de delito fallezcan en un hospital público, podrán ser practicadas por los médicos del establecimiento cuando así lo determine el Ministerio Público.\nARTÍCULO 260.- FACULTADES DEL MINISTERIO PÚBLICO CON RELACIÓN A LOS PERITAJES. El Ministerio\nPúblico, cuando lo considere útil o necesario, podrá asistir a la peritación, formular a los peritos las preguntas que estime procedentes; o autorizarlos para que examinen la averiguación o cualquier otro objeto o evidencia o para que asistan a inspecciones, reconstrucciones o diligencias a desahogar dentro de la indagatoria.\nARTÍCULO 261.- PERITAJE PSIQUIÁTRICO. Si el Ministerio Público ordena que peritos psiquiatras examinen al inculpado, siempre les preguntará si éste pudo carecer de capacidad de comprender la naturaleza del hecho o su ilicitud penal y de decidir de acuerdo con esa comprensión; así como si la tienen para comprender la de la averiguación a la que se enfrentan. Igualmente y según el caso, si aquél es peligroso.\nARTÍCULO 262.- PRECAUCIONES PARA PRESERVAR LA EVIDENCIA CONSUMIBLE. En caso de que el peritaje recaiga sobre evidencias que se consuman por la peritación, el Ministerio Público procurará que el examen se realice cuando mucho sobre la mitad de la substancia; a menos que los peritos no puedan emitir su opinión sin consumir una cantidad mayor o por completo. En cualquier caso el Ministerio Público podrá optar por recurrir a la prueba anticipada.\nARTÍCULO 263.- FORMA Y FUNDAMENTACIÓN DEL DICTAMEN. Los peritos practicarán todas las investigaciones, operaciones y experimentos que su ciencia, técnicas o arte les sugiera, y se consignarán los conducentes en el dictamen, así como los procedimientos aplicados. El peritaje será siempre por escrito y deberá contener la explicación de las razones técnicas, científicas o artísticas que los peritos tuvieron en cuenta para adoptar sus conclusiones, expresando unas y otras en forma clara, precisa y convincente; las conclusiones deberán, además, ser consecuencia lógica de sus fundamentos y versar únicamente sobre el objeto del dictamen.\nSin perjuicio del lenguaje técnico que se emplee, se procurará, además, su expresión llana y coloquial.\nAl dictamen se anexará el material utilizado cuando ello sea posible o su descripción o fijación por medios gráficos.\nARTÍCULO 264.- ACLARACIÓN, AMPLIACIÓN Y OBJECIÓN DEL DICTAMEN. Durante la averiguación previa el práctica de un nuevo peritaje.\nLa aclaración de dictamen tendrá por objeto que se explique el peritaje que se estima oscuro, ambiguo o carente de conclusiones.\nLa ampliación del dictamen tendrá por objeto resolver cuestiones que se relacionen con las planteadas, o cuando las mismas sólo se hayan dilucidado parcialmente. señalados en la presente Ley o cuando alguno de los interesados lo objete en sus conclusiones, siempre que señale las razones para ello. El Ministerio Público designará al perito que deba rendir el nuevo peritaje.\nLa ampliación y aclaración del dictamen podrán rendirse por escrito o en comparecencia. El nuevo peritaje será siempre por escrito. En cualquier caso el Ministerio Público, las partes y el defensor podrán formular, oralmente o por escrito, las preguntas que estimen pertinentes a los peritos. Si para responder a una o varias de las interrogantes, el perito o peritos requieren de peritación adicional, explicarán la razón. Si se estima conveniente, se decretará su recepción con posterioridad.\nDurante la Averiguación Previa no habrá lugar a junta de peritos ni los interesados podrán ofrecer perito de su intención; por lo que sólo podrán objetar los dictámenes que se hayan rendido, en los términos del presente artículo.\nCAPÍTULO XII.\nDE LAS OPINIONES TÉCNICAS.\nARTÍCULO 265.- OPINIONES TÉCNICAS. Son opiniones técnicas los dictámenes o estudios científicos, técnicos o artísticos que el ofendido, víctima o interesado en la investigación del delito haya ordenado o practicado para conocer o determinar los hechos materia de su denuncia o querella o alguna cuestión relacionada con los mismos o de la cual se deriven; siempre que los haya obtenido previo a su formulación. Igualmente se considerarán como tales los dictámenes definitivos emitidos por las Comisiones de Arbitraje Médico.\nARTÍCULO 266.- REQUISITOS DE LAS OPINIONES TÉCNICAS. Para que los estudios o dictámenes a que se refiere el artículo anterior sean considerados como opiniones técnicas, será necesario, además:\nI. Que sean emitidos por persona que posea título debidamente expedido en la materia sobre la que versen y, en su caso, que cumpla con los requisitos legales necesarios para su práctica.\nII. Que describa la metodología utilizada para su formulación, las fuentes y material de estudio, el período o fecha en que se llevó a cabo y las conclusiones derivadas del mismo; así como, en su caso, que contenga como anexo, el material utilizado cuando ello sea posible o su descripción o fijación por medios gráficos. Cuando se trate de dictámenes médicos expedidos por instituciones públicas, bastará que se describa el método de diagnóstico empleado y su resultado.\nIII. Que contenga el nombre y firma de su emisor; y\nIV. Que sea ratificado por quien lo suscribe, ante el Ministerio Público. En la ratificación el Ministerio Público podrá cuestionar al emisor respecto de los motivos y condiciones en que se elaboró el estudio o dictamen; así como sobre su capacidad técnica y demás circunstancias que estime pertinentes.\nCAPÍTULO XIII.\nDE LA EVIDENCIA FÍSICA Y SU RECOLECCIÓN.\nARTÍCULO 267.- EVIDENCIA FÍSICA DEL DELITO. Los objetos, instrumentos y productos del delito; así como la evidencia física de su comisión, se incorporarán a la indagatoria con sujeción a lo dispuesto por esta Ley para su recolección y cadena de custodia.\nARTÍCULO 268.- ALCANCE PROBATORIO. El carácter probatorio de los objetos, instrumentos, productos y evidencia física del delito; abarcará al objeto mismo y/o a sus circunstancias de recolección.\nTÍTULO NOVENO.\nCAPÍTULO I.\nDEL ARCHIVO PROVISIONAL POR RESERVA.\nARTÍCULO 269.- ARCHIVO PROVISIONAL POR RESERVA. El Ministerio Público procederá al archivo provisional de la indagatoria cuando, desahogadas las diligencias oficiosas de especial diligenciación que sean conducentes y agotadas las investigaciones que se deriven de lo actuado en el expediente, exista insuficiencia de prueba para determinar el ejercicio o no ejercicio de la acción penal. Para el efecto, quien conozca de su integración formulara vista de archivo provisional y la turnará al Coordinador o al funcionario que designe el Fiscal General, quien dictará el acuerdo correspondiente.\nARTÍCULO 270.- EFECTOS DEL ARCHIVO PROVISIONAL Y TIEMPO EN QUE PUEDE DECRETARSE. El archivo provisional por reserva de la indagatoria no suspende ni interrumpe los plazos de prescripción o preclusión; pero no podrá decretarse antes de tres meses contados a partir de que se recibió la noticia del delito.\nEl archivo provisional por reserva se levantará, sin necesidad de acuerdo previo, cuando aparezcan medios de prueba o líneas de investigación conducentes para los fines de la Averiguación Previa.\nAl decretarse el archivo provisional por reserva se procurará que la información que se desprenda de la indagatoria se incorpore a las bases de datos que para el efecto se lleven.\n(REFORMADO, P.O. 12 DE MAYO DE 2009)\nARTÍCULO 271.- REVISIÓN DEL ARCHIVO PROVISIONAL POR RESERVA. La Dirección General de\nAveriguaciones Previas o la instancia que determine el Fiscal General revisará periódicamente las indagatorias en que se halla decretado el archivo provisional por reserva, para valorar el estado que guarden las mismas.\nCAPÍTULO II.\nDEL RECURSO DE RECLAMACIÓN.\nARTÍCULO 272.- SUPUESTOS DE PROCEDENCIA. Procederá el recurso de reclamación en cualquiera de los siguientes supuestos:\nI. Cuando el Ministerio Público hubiere decretado el archivo provisional por reserva de la Averiguación Previa sin cumplir con los requisitos para ello.\nII. Cuando el Ministerio Público hubiere dejado de actuar en la indagatoria por un lapso mayor a tres meses, contados a partir de la última diligencia.\nARTÍCULO 273.- LEGITIMADOS PARA LA INTERPOSICIÓN DEL RECURSO. Están legitimados para la interposición del recurso de reclamación: el inculpado, su defensor, el ofendido, la víctima o los abogados de uno u otro.\nARTÍCULO 274.- PLAZO. El recurso de reclamación podrá interponerse en cualquier momento, a partir de cuando se produzca la situación que lo motive; pero sólo si ésta subsiste o aún no queda sin materia.\nARTÍCULO 275.- SUBSTANCIACIÓN DEL RECURSO. El recurso de reclamación deberá interponerse por escrito en el que se expresen las causas que lo motiven y la relación de las diligencias que, a juicio del promovente, sea procedente practicar. cuando la indagatoria se integre por Agente del Ministerio Público que no se encuentre adscrito a Delegación, quien, previa revisión de la averiguación previa, resolverá lo procedente en un plazo no mayor a quince días contados a partir de la interposición del recurso.\nEn la resolución que se emita deberá determinarse si procede el archivo provisional por reserva de la indagatoria, la emisión de vista de ejercicio o no ejercicio de acción penal o el desahogo de nuevas diligencias con señalamiento de las mismas; y se fijará plazo al Agente del Ministerio Público que conozca de la indagatoria para que cumpla con ello.\nCAPÍTULO III.\nDEL PRINCIPIO DE OPORTUNIDAD.\nARTÍCULO 276.- PRINCIPIO DE OPORTUNIDAD. El Ministerio Público deberá ejercitar acción penal en todos los casos en que sea procedente conforme a la Ley; no obstante, atendiendo a la concreta trascendencia del hecho cometido, al mejor interés de la justicia, a la racionalidad de la sanción penal o a la eficientación de la función ministerial; podrá determinar el no ejercicio o la suspensión de la acción penal o acotar su pretensión de pena, cuando ello sea más útil o conveniente para el interés social que representa.\nLo anterior podrá hacerlo con relación a uno o varios hechos o a alguna, algunas o a la totalidad de las personas que participaron en su realización.\nARTÍCULO 277.- CARÁCTER REGLADO DEL PRINCIPIO DE OPORTUNIDAD. La facultad a que se refiere el artículo anterior sólo podrá ejercerse con base en los criterios de oportunidad expresamente señalados por la Ley.\nEl Fiscal General podrá emitir pautas generales para objetivar y uniformar la aplicación de tales criterios.\nARTÍCULO 278.- CRITERIOS DE OPORTUNIDAD. Son criterios de oportunidad:\nA. Para determinar el no ejercicio de la acción penal. criterios:\nI. Cuando se trate de delitos de contenido patrimonial en los que el objeto material se haya encontrado a tal grado deteriorado que haga irracional o desproporcionada su persecución; o cuando el monto del mismo sea claramente insignificante con relación a las condiciones particulares del ofendido y del inculpado; siempre que no se trate de en diversa indagatoria.\nII. Cuando se trate de delitos contra la administración pública o la procuración o administración de justicia, cometidos por particulares; siempre que la afectación al interés público o tutelado sea de escasa significación.\nIII. Cuando de la indagatoria se advierta que el ofendido haya actuado con notoria mala fe o temeridad para propiciar la comisión del delito; siempre que no se trate de delito grave o cometido en riña.\nIV. Cuando el inculpado haya sufrido, a consecuencia del hecho, daño físico o psicológico grave que torne desproporcionada la aplicación de una pena, o cuando en ocasión de un delito culposo haya sufrido un daño moral de difícil superación.\nV. Cuando la pena o medida de seguridad que pueda imponerse por el hecho cometido, carezca de importancia en consideración a la ya impuesta en otro u otros procesos seguidos en la misma o diferente jurisdicción; siempre que ésta haya quedado firme.\nVI. Cuando el inculpado sea sujeto a extradición o sea sometido a la jurisdicción de una corte internacional, por los mismos hechos.\nB. Para determinar el no ejercicio o la suspensión de la acción penal; o para acotar su pretensión de pena:\nEl Ministerio Público podrá determinar el no ejercicio o la suspensión de la acción penal, ejercitarla sólo por ciertos delitos o solicitar la aplicación de penalidad atenuada, con base en cualquiera de los siguientes criterios:\nI. Cuando el inculpado colabore eficazmente para evitar que se consume, continúe o realice el delito o que se cometan otros y, además, rinda confesión.\nII. Cuando el inculpado haya prestado o brinde auxilio efectivo para identificar o localizar diversos autores o partícipes con relación al o los delitos que se le atribuyan.\nIII. Cuando el inculpado haya prestado o brinde auxilio efectivo para obtener otros medios de prueba conducentes para acreditar la participación de otros involucrados en esos delitos.\nIV. Cuando el inculpado haya prestado o brinde auxilio efectivo para establecer la identidad o localización de autores o partícipes en otro delito de análoga o mayor gravedad.\n(REFORMADO, P.O. 12 DE MAYO DE 2009)\nEn los casos a que se refieren las fracciones II, III y IV del apartado B del presente artículo será necesario, además:\n1) que no estén previamente identificados, localizados o acreditada la intervención de los autores o partícipes; ni se hayan obtenido ya los medios de prueba sobre los que se da información; 2) que se verifique la utilidad del auxilio; 3) que el inculpado no sea jefe o cabecilla en grupo o banda de secuestradores, de ladrones o asaltantes; de pandilla criminal o de asociación delictuosa; y 4) que así lo autorice el Fiscal General.\nCAPÍTULO IV.\nDE LA JUSTICIA RESTAURATIVA.\nARTÍCULO 279.- JUSTICIA RESTAURATIVA. Justicia restaurativa es todo proceso en el que el ofendido o víctima y del delito, en busca de un resultado restaurativo, con o sin la participación de un facilitador. colectivas de los involucrados y afectados por el delito; así como el cumplimiento de las medidas tendientes a lograr su reintegración a la comunidad con base en la reparación, la restitución y el servicio a la comunidad.\nARTÍCULO 280.- SUPUESTOS DE PROCEDENCIA DE LA JUSTICIA RESTAURATIVA. La justicia restaurativa procederá siempre que se reúnan las condiciones siguientes:\nI. Se trate de delito cuya penalidad no exceda en su término medio aritmético de cinco años.\nII. No se trate de delito grave\nIII. No se trate de delito cometido por servidor público con motivo o derivado de sus funciones; o cuando tal carácter sea contemplado como agravante del delito de que se trate.\nIV. El inculpado no se encuentre dentro de los casos de reiteración delictiva y no se haya determinado en su beneficio el no ejercicio de la acción penal por sometimiento a la justicia restaurativa en un plazo anterior igual al del término de prescripción del delito por el que se haya decretado dicho inejercicio. Lo anterior no será aplicable cuando se trate de delitos culposos.\nV. No se trate de los delitos tipificados por los artículos: 182, 186, 187, 190, 196, 198, 204, 215, 224, 233, 235, 237, 238, 240, 251, 252, 253, 265, 266, 267, 268, 269, 271, 273, 291, 291 bis, 291 bis 1, 296 fracción II, 306 fracción IV, 310, 311, 353, 356, 393, 398, 412 cuando el valor de lo robado exceda de cincuenta veces el salario mínimo, 414 fracción VII o cuando el valor de lo robado exceda de cincuenta veces el salario mínimo y 436; todos del Código\nPenal.\nVI. Que el inculpado se haya apersonado o comparecido a la indagatoria; y\nVII. Que el ofendido o víctima y el inculpado consientan libremente someterse a dicho procedimiento.\nARTÍCULO 281.- TIEMPO EN QUE PROCEDE. Los procedimientos de justicia restaurativa procederán en cualquier estado de la Averiguación Previa hasta antes de que se determine el ejercicio o no ejercicio de acción penal; pero el\nMinisterio Público deberá hacer del conocimiento del ofendido o víctima y del inculpado, conjuntamente o por separado, la opción que tienen para someterse a dichos procedimientos, en qué consisten y sus consecuencias; dejando debida constancia de ello. Si alguno de ellos no acepta someterse a dichos procedimientos o nada manifiesta al respecto, se continuará con la integración de la indagatoria; sin perjuicio de que si posteriormente cambia de decisión se proceda a llevarlos a cabo.\nCuando la Averiguación Previa sea consignada sin que el Ministerio Público hubiere cumplido con la obligación a que se refiere el párrafo anterior, el Juez devolverá la indagatoria para que se dé debido cumplimiento a ello. Tal omisión, sin embargo, no afectará el desarrollo del proceso ni a la acción penal misma, cuando la relación procesal ya se haya establecido. Se procederá de igual forma cuando se haya emitido vista de no ejercicio de acción penal.\nARTÍCULO 282.- REPRESENTACIÓN CUANDO SE TRATA DE OFENDIDO O VICTIMA INDETERMINADOS. Para todos los efectos del presente capítulo, cuando no exista ofendido o víctima determinados o cuando el delito afecte intereses difusos o colectivos, el Ministerio Público asumirá su representación.\nARTÍCULO 283.- PROCEDIMIENTO DE JUSTICIA RESTAURATIVA CON INTERVENCIÓN DE FACILITADOR.\nCuando los interesados hayan externado su deseo de someterse a la justicia restaurativa, el Ministerio Público autorizadas para fungir como tal y les señalará un plazo de treinta días para el desarrollo de la mediación. La designación de mediador se comunicará por escrito a quien deba fungir como tal, haciendo de su conocimiento que al concluir el plazo mencionado, o antes si es el caso, deberá comunicar al Agente del Ministerio Público el resultado de su intervención. Dicho plazo podrá ser prorrogado cuando el mediador razonadamente lo solicite en vista de los resultados que estime pueda obtener.\nLa mediación tendrá por objeto que el ofendido o víctima y el inculpado, bajo la dirección de un mediador, dialoguen en busca de soluciones al conflicto que haya propiciado la comisión del delito o que haya derivado de él.\nCuando los interesados hayan alcanzado acuerdo, el mediador lo comunicará de inmediato al Ministerio Público, quien hará comparecer a los involucrados para que manifiesten si son conformes con las soluciones alcanzadas; en señalado por los artículos 286 y 287 de esta Ley.\nLos acuerdos de mediación sólo se tendrán por efectivos cuando el ofendido o víctima se dé por reparado del daño.\nSi el ofendido o víctima no se da por reparado del daño o si la mediación no concluye con resultados positivos por cualquier causa, se continuará con la integración de la indagatoria.\nARTÍCULO 284.- PROCEDIMIENTO DE JUSTICIA RESTAURATIVA POR REPARACIÓN DEL DAÑO. El ofendido podrá darse por reparado del daño en cualquier estado de la Averiguación Previa, se haya sometido o no al procedimiento a que se refiere el artículo anterior. En tal caso el Ministerio Público procederá a comunicar lo anterior al inculpado para que manifieste si es su voluntad someterse a las medidas de justicia restaurativa. Cuando el inculpado acepte someterse a dichas medidas se procederá a fijarle la multa o la medida sustitutiva correspondiente, en los términos de lo dispuesto por los artículos 286 y 287 de esta Ley.\nSi el inculpado se opone a someterse a dichas medidas o nada manifiesta al respecto, se continuará con la integración de la indagatoria.\nCuando el ofendido sea una entidad pública o sea ésta quien resienta el daño causado por el delito, no será necesaria la mediación; pero sí que se acredite haberse reparado el daño, para que procedan las medidas y consecuencias derivadas de la justicia restaurativa.\nARTÍCULO 285.- PROCEDIMIENTO DE JUSTICIA RESTAURATIVA EN DELITOS SIN OFENDIDO O VICTIMA\nDETERMINADOS. Cuando se trate de delitos en los que no exista ofendido o víctima determinados o cuando el delito afecte intereses difusos o colectivos y el inculpado manifieste su deseo de someterse a la justicia restaurativa, el Ministerio Público procederá a cuantificar el monto de la reparación del daño por cualquier medio posible; si el daño no fuere cuantificable se fijará como monto del mismo una cantidad igual a la correspondiente a la multa a fijar como medida de justicia restaurativa. En estos casos el pago de la reparación del daño deberá cubrirse dentro de los treinta días naturales siguientes a su determinación, mediante exhibición en efectivo o depósito a favor del Fondo para la Procuración de Justicia. comisión del delito o si acata las obligaciones cuyo incumplimiento hubiera dado lugar al mismo; siempre que se trate de acciones remediables.\nCubierta o satisfecha la reparación del daño en los términos a que se refieren los párrafos anteriores, el Ministerio\nPúblico procederá a fijar al inculpado la multa o la medida sustitutiva correspondiente, conforme a lo dispuesto por los artículos 286 y 287 de esta Ley.\nARTÍCULO 286.- FIJACIÓN DE MULTA COMO MEDIDA RESTAURATORIA. Cuando se haya satisfecho la reparación del daño en los términos de lo dispuesto por los artículos anteriores, el Ministerio Público procederá a fijar trate a razón de cincuenta días de salario mínimo por año; sin que nunca pueda ser inferior a diez días de salario.\nLa multa deberá ser cubierta dentro de los treinta días naturales siguientes a su fijación, mediante pago en efectivo o depósito a favor del Fondo para la Procuración de Justicia.\nARTÍCULO 287.- MEDIDAS SUSTITUTIVAS DE LA MULTA. Cuando el inculpado lo solicite, el Ministerio Público cometidos, de entre las siguientes:\nI. TRABAJO EN FAVOR DE LA COMUNIDAD. Por trabajo en favor de la comunidad, la que consistirá en prestar servicios o laborar sin remuneración en instituciones, dependencias, organismos desconcentrados o descentralizados del Estado o Municipios; o en empresas públicas estatales o municipales; o privadas si son asistenciales, educativas o no lucrativas. Para el efecto, el Ministerio Público remitirá al inculpado a la dependencia o entidad con disponibilidad para ello, la que se encargará de vigilar e informar el cumplimiento de la medida.\nEl trabajo se prestará en horarios que no interfieran con las actividades laborales o académicas del inculpado y su duración se determinará por equivalencia con la multa correspondiente a razón de una hora de trabajo por día multa.\n(REFORMADA PRIMER PÁRRAFO, P.O. 12 DE MAYO DE 2009)\nII. SOMETIMIENTO A TRATAMIENTOS O TERAPIAS ESPECÍFICAS. Por el sometimiento a tratamientos, programas o terapias psicológicas contra la violencia o las adicciones, grupales o familiares; o a cualquier tipo de programa cuyo objetivo sea incidir en alguno o algunos de los aspectos del comportamiento humano relacionados con el delito cometido; siempre que sean proporcionadas por instituciones públicas o privadas debidamente acreditadas ante la Fiscalía General para el efecto.\nEn este caso el Ministerio Público remitirá al inculpado a la institución que corresponda; la que deberá informar a aquél la duración y periodicidad del tratamiento; así como el cumplimiento del mismo.\nLa duración del tratamiento no podrá exceder de un año.\nIII. OBLIGACIÓN DE OBTENER EMPLEO. Por la obligación de obtener empleo. Para el efecto el Ministerio Público otorgará al inculpado un plazo de treinta días naturales para que acredite fehacientemente dicha circunstancia.\nEn cualquier caso el inculpado deberá solicitar la medida sustitutiva dentro del plazo de treinta días fijado para el pago de la multa.\nARTÍCULO 288.- EFECTOS DE LA JUSTICIA RESTAURATIVA. El cumplimiento de las condiciones o resultados restaurativos a que se refiere el presente capitulo producirá los siguientes efectos:\nI. EL NO EJERCICIO DE LA ACCIÓN PENAL. Que se determine el no ejercicio de la acción penal a favor del inculpado que se haya sometido a ella.\nII. LA NO GENERACIÓN DE ANTECEDENTES PENALES. Que no se generen antecedentes penales con relación al inculpado que se haya sometido a ella, por el delito o delitos de que se trate.\nIII. INAPLICABILIDAD DE OTRAS SANCIONES. Que se prescinda de otras sanciones distintas a las contempladas en el presente capítulo.\nARTÍCULO 289.- SUSPENSIÓN DE LA AVERIGUACIÓN PREVIA. La Averiguación Previa se suspenderá durante el tiempo en que se desarrollen los procedimientos de justicia restaurativa; sin perjuicio de que el Ministerio Público practique las diligencias necesarias para asegurar la prueba de los hechos sujetos a investigación.\nCuando el inculpado se oponga, inconforme o incumpla con cualquiera de las medidas o procedimientos señalados en el presente capítulo, no se surtirán los efectos a que se refiere el artículo anterior y se continuará con la integración de la indagatoria.\nLo que manifieste el ofendido, la víctima o el inculpado durante la mediación y sus consentimientos a someterse a la justicia restaurativa no tendrán efectos probatorios en la indagatoria ni en el proceso.\nCAPÍTULO V.\nDEL NO EJERCICIO DE LA ACCIÓN PENAL.\nARTÍCULO 290.- SUPUESTOS DE PROCEDENCIA. El Ministerio Público determinará el no ejercicio de la acción penal sólo en los siguientes casos:\nI. EXTINCIÓN DE LA ACCIÓN PENAL. Cuando se extinga la acción penal.\nII. PRUEBA DE NO INTERVENCIÓN O DE EXCLUYENTE DE DELITO. Cuando se compruebe que el inculpado no intervino en el delito o que existió a su favor causa excluyente de delito.\nIII. PRUEBA DE HECHO ATÍPICO. Cuando los hechos no sean constitutivos de tipo penal de un delito; bien sea por su naturaleza o por que así se pruebe.\nIV. CRITERIOS DE OPORTUNIDAD. Cuando se aplique alguno de los criterios de oportunidad señalados por la Ley.\nV. JUSTICIA RESTAURATIVA. Cuando se haya cumplido con las medidas y condiciones de justicia restaurativa.\nVI. ABANDONO DE LA QUERELLA. Cuando se trate de delitos perseguibles por querella y quien la haya formulado sea requerido en debida forma por el Ministerio Público para allegar medios de prueba que sólo por su conducto o con su intervención se puedan obtener y que sean determinantes para los fines de la indagatoria; sin que lo haga dentro del término concedido para el efecto\nVII. OTROS QUE PREVEA LA LEY. Cuando se dé algún otro motivo que prevean esta u otras leyes.\nARTÍCULO 291.- PROCEDIMIENTO. Cuando exista alguna de las causas a que se refiere el artículo anterior, el\nMinisterio Público que conozca de la indagatoria emitirá vista de no ejercicio de acción penal en los términos señalados en el artículo 92 de esta Ley y la remitirá, junto con el expediente correspondiente, al funcionario a quien competa resolver.\nEn los casos de las fracciones I, V y VI del artículo anterior compete resolver y, en su caso, determinar en definitiva el no ejercicio de la acción penal, al Coordinador de Agentes del Ministerio Público que corresponda; pero si el\nAgente emisor de la vista no se encuentra adscrito a alguna Delegación, será el Director General de Averiguaciones\nPrevias el competente para el efecto. En los demás casos será el Fiscal de Control de Procesos y Legalidad quien resuelva y, en su caso, determine el no ejercicio de la acción penal.\nEn cualquier caso, el Fiscal General o el Fiscal de Control de Procesos y Legalidad podrán ejercer la facultad de atracción para determinar el ejercicio o no ejercicio de la acción penal.\nEmitida la vista de no ejercicio de acción penal y remitida la indagatoria al funcionario a quien competa resolver, no podrán admitirse medios de prueba ni promociones o alegatos por parte de los interesados. impugnarlas en los términos que esta Ley prevé. En el acto de la notificación se hará saber al ofendido o víctima el derecho que tiene de recurrir la resolución. Si se omite dar a conocer tal derecho, se duplicará el plazo para interponer el recurso de inconformidad.\nARTÍCULO 292.- EFICACIA DEL NO EJERCICIO DE LA ACCIÓN PENAL Y SU RECURRIBILIDAD. Para que la determinación del Ministerio Público; o que aquélla, previo recurso, se confirme en la vía jurisdiccional.\nLas determinaciones de no ejercicio de acción penal que queden firmes, impedirán definitivamente iniciar la acción penal por los hechos que las motiven; o con relación a la persona inculpada, según corresponda.\nARTÍCULO 293.- RECURSO DE INCONFORMIDAD. Son resoluciones impugnables a través del recurso de inconformidad, las determinaciones del Ministerio Público que decidan en forma definitiva el no-ejercicio de la acción penal.\nARTÍCULO 294.- PERSONAS LEGITIMADAS PARA INTERPONER EL RECURSO DE INCONFORMIDAD.\nTendrán legitimación para interponer el recurso de inconformidad el ofendido o víctima; o el abogado de éstos.\nARTÍCULO 295.- INTERPOSICIÓN DEL RECURSO Y PLAZO PARA INTERPONERLO. El ofendido o víctima, por sí o por conducto de su apoderado o abogado, podrán interponer el recurso de inconformidad, por escrito; dentro de los quince días siguientes al día que se notifique la determinación de no-ejercicio de la acción penal. Al interponer el recurso expresarán los agravios.\nLa falta de agravios, motivará que el recurso se declare desierto. Esta declaración la hará el Tribunal Distrital. Sin embargo, el Tribunal Distrital podrá suplir la deficiencia de los agravios que sí se presenten.\n(REFORMADO, P.O. 12 DE MAYO DE 2009)\nEl recurso se interpondrá ante la dependencia de la Fiscalía General que resolvió el no-ejercicio, o ante la Agencia del Ministerio Público que integró la averiguación.\n(REFORMADO, P.O. 12 DE MAYO DE 2009)\nEl Agente del Ministerio Público o la dependencia de la Fiscalía General que resuelva el no-ejercicio; dentro de los tres días siguientes de recibir el recurso, mandarán notificar personalmente a los inculpados si tienen su domicilio en el lugar y ya hayan comparecido con tal carácter. En su defecto, notificarán por lista en la propia dependencia.\n(REFORMADO, P.O. 12 DE MAYO DE 2009)\nSi se interpone el recurso ante el Agente del Ministerio Público que integró la averiguación, una vez que notifique, lo remitirá de inmediato a la dependencia de la Fiscalía General que legalmente le corresponda la determinación de noejercicio de la acción penal.\nEn cualquier caso, corresponderá a quien hubiere emitido la determinación definitiva de no ejercicio de la acción ejercitar la acción penal. A él adjuntará el expediente de Averiguación Previa y las constancias de las notificaciones personales al ofendido y/o víctimas e inculpados; o la razón de que se hicieron por lista.\nARTÍCULO 296.- RADICACIÓN Y TRAMITACIÓN DEL RECURSO ANTE EL AD QUEM. El Tribunal Distrital que siga en número al Tribunal de la jurisdicción territorial donde se debería ejercitar la acción penal, radicará y admitirá o desechará el recurso dentro de los tres días siguientes de recibirlo. Si lo desecha, declarará firme la resolución recurrida.\nEn el primer caso fijará, además, una audiencia dentro de los quince días siguientes. El auto se notificará mediante\nDistrital. En caso contrario, la notificación se hará por lista. Las notificaciones al Ministerio Público se harán por conducto del agente adscrito al Tribunal Distrital.\nDesde el auto de radicación del recurso se ordenará poner el expediente a la vista de las partes, quienes en la audiencia podrán formular alegatos y enseguida en ella se citará a sentencia; la que se pronunciará dentro de los veinte días siguientes.\nLa resolución del Tribunal Distrital que resuelva la procedencia o improcedencia del recurso, podrá confirmar, modificar o revocar la determinación de no-ejercicio de la acción penal.\nARTÍCULO 297.- INTERVENCIÓN DEL INCULPADO COMO TERCERO INTERESADO. Quienes aparezcan como inculpados podrán intervenir como parte en el recurso de inconformidad, en su calidad de terceros interesados, a efecto de que puedan formular alegatos en la audiencia de vista o interponer los recursos de revocación que estimen procedentes en los términos que disponga el Código de Procedimientos Penales.\nARTÍCULO 298.- BASES PARA DECIDIR LA PROCEDENCIA O IMPROCEDENCIA DEL RECURSO DE\nINCONFORMIDAD. Para decidir sobre la procedencia del recurso de inconformidad, el Tribunal Distrital atenderá, según los casos, a lo siguiente: a) Si se reúnen los requisitos para ejercitar la acción penal y formular acusación en los términos que dispone esta Ley y el Código de Procedimientos Penales del Estado. b) Si existe medio de prueba posible de desahogar y sea claramente conducente para preparar la acción penal. c) Si no se satisfizo alguno de los supuestos que la ley autoriza para determinar el no-ejercicio de la acción penal.\nEn caso contrario declarará la improcedencia del recurso.\nARTÍCULO 299.- CUMPLIMENTACIÓN DE LA RESOLUCIÓN DEL RECURSO. Si el Tribunal Distrital resuelve revocar o modificar la determinación de no-ejercicio de la acción penal, de tal manera que ésta se deba ejercitar; remitirá a quien la hubiera emitido, el testimonio de la resolución y las demás constancias que integran el expediente de la Averiguación Previa.\nÉsta de inmediato las enviará al Agente del Ministerio Público que deba ejercitar la acción penal ante el juzgado competente, para que formule el pedimento de inicio en debida forma.\nARTÍCULO 300.- DEFINITIVIDAD DE LAS RESOLUCIONES DE NO-EJERCICIO DE LA ACCIÓN PENAL. La resolución de no-ejercicio de la acción penal que pronuncie el Ministerio Público quedará firme en su integridad o en parte de ella, cuando:\nI. AUSENCIA DE RECURSO VÁLIDO. El ofendido o víctima manifieste su conformidad con ella; o no la recurran.\nII. RECURSO INADMISIBLE. Cuando la recurran fuera de tiempo u omitan expresar agravios; según resolución firme del Tribunal Distrital que deseche el recurso o lo declare sin materia por tales motivos.\nIII. CONFIRMACIÓN O MODIFICACIÓN POR EL TRIBUNAL DISTRITAL. El Tribunal Distrital confirme la determinación de no-ejercicio o la modifique; de tal manera que queden a salvo algunos delitos y/o inculpados por los que la acción penal no deba ejercitarse.\nARTÍCULO 301.- MEDIDA DE SALVAGUARDA DE LA GARANTÍA DE IGUALDAD PROCESAL DE LAS PARTES,\nFRENTE A LA RESOLUCIÓN JUDICIAL QUE ORDENA EL EJERCICIO DE LA ACCIÓN PENAL. La resolución del\nTribunal Distrital en el sentido de que se ejercite acción penal, no vinculará al Juez que conozca de ésta; quien resolverá con plena autonomía de aquella sobre la orden de aprehensión o comparecencia que se solicite.\nCAPÍTULO VI.\nDEL EJERCICIO DE LA ACCIÓN PENAL.\nARTÍCULO 302.- EJERCICIO DE LA ACCIÓN PENAL. El Ministerio Público ejercitará la acción penal y proseguirá el proceso con base en lo dispuesto por el Código de Procedimientos Penales.\nARTÍCULO 303.- DESISTIMIENTO DE LA ACCIÓN PENAL. El Ministerio Público no podrá formular conclusiones no acusatorias; pero podrá desistirse de la acción penal, en los términos que determine el Código de Procedimientos\nPenales, cuando concurra alguna de las causas señaladas por las fracciones I, II, III, IV y VII del artículo 290 de esta\nLey.\n(REFORMADO, P.O. 12 DE MAYO DE 2009)\nEl desistimiento de la acción penal deberá ser autorizado por el Fiscal General.\nLIBRO SEGUNDO.\nDE LA ORGANIZACIÓN DEL MINISTERIO PÚBLICO.\n(DEROGADO, P.O. 12 DE MAYO DE 2009)\nTÍTULO PRIMERO.\nDISPOSICIONES GENERALES\n(DEROGADO, P.O. 12 DE MAYO DE 2009)\nCAPÍTULO ÚNICO.\nDEL MINISTERIO PÚBLICO\nARTÍCULO 304.(DEROGADO, P.O. 12 DE MAYO DE 2009)\nARTÍCULO 305.(DEROGADO, P.O. 12 DE MAYO DE 2009)\nARTÍCULO 306.(DEROGADO, P.O. 12 DE MAYO DE 2009)\nARTÍCULO 307.(DEROGADO, P.O. 12 DE MAYO DE 2009)\nARTÍCULO 308.-\nARTÍCULO 309.TÍTULO SEGUNDO.\nBASES GENERALES DE ORGANIZACIÓN.\nCAPÍTULO I.\nDE LA ORGANIZACIÓN DEL MINISTERIO PÚBLICO.\nARTÍCULO 310.-\nARTÍCULO 311.-\nARTÍCULO 312.-\nARTÍCULO 313.-\nARTÍCULO 314.-\nARTÍCULO 315.(DEROGADO, P.O. 12 DE MAYO DE 2009)\nARTÍCULO 316.(DEROGADO, P.O. 12 DE MAYO DE 2009)\nARTÍCULO 317.(DEREOGADO, P.O. 12 DE MAYO DE 2009)\n(DEROGADO, P.O. 12 DE MAYO DE 2009)\nCAPÍTULO II.\nDE LAS ATRIBUCIONES.\nARTÍCULO 318.(DEROGADO, P.O. 12 DE MAYO DE 2009)\nARTÍCULO 319.(DEROGADO, P.O. 12 DE MAYO DE 2009)\nARTÍCULO 320.(DEROGADO, P.O. 12 DE MAYO DE 2009)\nARTÍCULO 321.(DEROGADO, P.O. 12 DE MAYO DE 2009)\nARTÍCULO 322.(DEROGADO, P.O. 12 DE MAYO DE 2009)\nARTÍCULO 323.(DEROGADO, P.O. 12 DE MAYO DE 2009)\nARTÍCULO 324.(DEROGADO, P.O. 12 DE MAYO DE 2009)\nARTÍCULO 325.(DEROGADO, P.O. 12 DE MAYO DE 2009)\nARTÍCULO 326.(DEROGADO, P.O. 12 DE MAYO DE 2009)\nARTÍCULO 327.(DEROGADO, P.O. 12 DE MAYO DE 2009)\nCAPÍTULO III.\nDE LOS NOMBRAMIENTOS:\nARTÍCULO. 328.-\nARTÍCULO 329.-\nARTÍCULO 330.-\nARTÍCULO 331.-\nARTÍCULO 332.-\nARTÍCULO 333.-\nARTÍCULO 334.-\nARTÍCULO 335.\nARTÍCULO 336.(DEROGADO, P.O. 12 DE MAYO DE 2009)\n(DEROGADO, P.O. 12 DE MAYO DE 2009)\nCAPÍTULO IV.\nDE LAS SUPLENCIAS:\nARTÍCULO 337.(DEROGADO, P.O. 12 DE MAYO DE 2009)\nARTÍCULO 338.(DEROGADO, P.O. 12 DE MAYO DE 2009)\nARTÍCULO 339.(DEROGADO, P.O. 12 DE MAYO DE 2009)\nARTÍCULO 340.(DEROGADO, P.O. 12 DE MAYO DE 2009)\nARTÍCULO 341.(DEROGADO, P.O. 12 DE MAYO DE 2009)\nARTÍCULO 342.(DEROGADO, P.O. 12 DE MAYO DE 2009)\n(DEROGADO, P.O. 12 DE MAYO DE 2009)\nCAPÍTULO V.\nDE LA NORMATIVIDAD INTERNA.\nARTÍCULO 343.(DEROGADO, P.O. 12 DE MAYO DE 2009)\nARTÍCULO 344.(DEROGADO, P.O. 12 DE MAYO DE 2009)\nARTÍCULO 345.(DEROGADO, P.O. 12 DE MAYO DE 2009)\nARTÍCULO 346.-\nARTÍCULO 347.-\nARTÍCULO 348.TÍTULO TERCERO.\nDEL SERVICIO CIVIL DE CARRERA:\nCAPÍTULO I.\nDISPOSICIONES GENERALES\nARTÍCULO 349.-\nARTÍCULO 350.-\nARTÍCULO 351.-\nARTÍCULO 352.(DEROGADO, P.O. 12 DE MAYO DE 2009)\n(DEROGADO, P.O. 12 DE MAYO DE 2009)\nCAPÍTULO II.\nBASES DE ESTRUCTURACIÓN:\nARTÍCULO 353.(DEROGADO, P.O. 12 DE MAYO DE 2009)\nARTÍCULO 354.(DEROGADO, P.O. 12 DE MAYO DE 2009)\nARTÍCULO 355.(DEROGADO, P.O. 12 DE MAYO DE 2009)\nARTÍCULO 356.(DEROGADO, P.O. 12 DE MAYO DE 2009)\nARTÍCULO 357.(DEROGADO, P.O. 12 DE MAYO DE 2009)\nARTÍCULO 358.(DEROGADO, P.O. 12 DE MAYO DE 2009)\nARTÍCULO 359.(DEROGADO, P.O. 12 DE MAYO DE 2009)\n(DEROGADO, P.O. 12 DE MAYO DE 2009)\nTÍTULO CUARTO.\nDE LAS RESPONSABILIDADES.\n(DEROGADO, P.O. 12 DE MAYO DE 2009)\nCAPÍTULO I.\nDISPOSICIONES GENERALES:\nARTÍCULO 360.(DEROGADO, P.O. 12 DE MAYO DE 2009)\nARTÍCULO 361.-\nARTÍCULO 362.-\nCAPÍTULO II.\nDE LOS DEBERES:\nARTÍCULO 363.-\nARTÍCULO 364.-\nARTÍCULO 365.-\nARTÍCULO 366.TÍTULO QUINTO.\nDE LOS TRÁMITES Y PROCEDIMIENTOS.\nCAPÍTULO I.\nDEL NO EJERCICIO DE LA ACCIÓN PENAL.\n(REFORMADO, P.O. 12 DE MAYO DE 2009)\nARTÍCULO 367.- SUBSTANCIACIÓN DEL PROCEDIMIENTO ANTE LA FISCALÍA DE CONTROL DE PROCESOS\nY LEGALIDAD. El procedimiento de determinación de las vistas de no ejercicio de la acción penal, ante la Fiscalía de Control de Procesos y Legalidad, se sujetará a las reglas siguientes:\nRecibido el expediente en que se haya emitido la vista sujeta a revisión, el Fiscal de Control de Procesos y\nLegalidad, si estima que se satisfacen los requisitos de forma, dictará determinación inicial de radicación, y dispondrá que se turne a la Dirección General de Control de Legalidad, para que formule proyecto de resolución. En caso contrario, ordenará la devolución del expediente para que se subsanen las deficiencias que se adviertan.\nRadicado el expediente, el Director General de Control de Legalidad formulará o supervisará, según sea el caso, el proyecto de determinación que someterá a la aprobación del Fiscal de Control de Procesos y Legalidad, sobre si es procedente o no ejercitar la acción penal, o si debe reponerse el procedimiento por falta de elementos para determinar, precisando en este caso, las diligencias que a su juicio hayan de practicarse.\nDictada la resolución, el Director General de Control de Legalidad remitirá el expediente a la Agencia del Ministerio\nPúblico correspondiente, con copia certificada de la resolución, para su notificación al ofendido o víctima y remitirá otra copia de dicha resolución al Delegado Regional para su conocimiento y vigilancia de su cumplimiento.\n(REFORMADO PRIMER PÁRRAFO, P.O. 12 DE MAYO DE 2009)\nARTÍCULO 368.- SECRETARÍA DE ACUERDOS. Para la substanciación del procedimiento, la Fiscalía de Control de Procesos y Legalidad se auxiliará de una Secretaría de Acuerdos que estará a cargo de un Agente del Ministerio\nPúblico, con las atribuciones siguientes:\nI. Recibir los escritos, anotando al calce: la razón del día y hora de presentación del documento y el nombre de la persona que la haga; el número de fojas que contengan y anexos que se acompañen, dando razón en la copia, con su firma y sello de la oficina.\nII. Dar cuenta diariamente, bajo su más estricta responsabilidad, con los escritos, oficios, promociones y demás documentos que se reciban.\nIII. Autorizar las actas, diligencias, proveídos y determinaciones que se realicen en la Fiscalía de Control de\nProcesos y Legalidad.\nIV. Hacer constar en los expedientes el día en que inician y concluyen los términos, supervisando que se cumplan los procedimientos en los plazos que establecen las normas jurídicas aplicables.\nV. Foliar, sellar y firmar los expedientes y demás documentos que lo requieran.\nVI. Levantar inventario y conservar en su poder los expedientes en trámite, debiendo entregarlos con las formalidades legales cuando haya lugar a la remisión.\nVII. Notificar a los interesados, en los casos en que la Ley lo disponga.\nVIII. Practicar las diligencias que se le encomienden.\nIX. Remitir, cuando así proceda, los expedientes al archivo de la Fiscalía General, previa anotación en el libro de control correspondiente.\nX. Tener a su cargo los registros pertenecientes a la oficina.\nXI. Resguardar el sello de la oficina.\nXII. Las demás atribuciones que le confieran este ordenamiento u otras disposiciones aplicables o le encomienden sus superiores.\n(REFORMADO, P.O. 12 DE MAYO DE 2009)\nARTÍCULO 369.- PERSONAL DE APOYO. La Dirección General de Control de Legalidad contará con el número de proyectistas, Agentes del Ministerio Público, que requieran las necesidades del servicio, quienes, bajo la más absoluta confidencialidad elaborarán los proyectos de resolución que les sean turnados por el Director General de su adscripción o por el Fiscal de Control de Procesos y Legalidad, sometiendo el proyecto para su revisión a dicho\nDirector General y posterior acuerdo del Fiscal Especializado respectivo.\nARTÍCULO 370.- SUBSTANCIACIÓN DEL PROCEDIMIENTO ANTE OTRAS INSTANCIAS. Cuando el procedimiento deba ser desahogado por otras instancias, según lo dispuesto por el artículo 291 de la presente Ley, se seguirá en lo conducente el procedimiento señalado en los artículos anteriores; pero en tales casos el resolutor podrá realizar por si mismo los actos señalados.\n(REFORMADO, P.O. 12 DE MAYO DE 2009)\nEn caso de que el Fiscal General, en uso de las facultades de atracción que le competen, se haga cargo de la revisión de algún asunto, se observará en lo conducente el procedimiento precisado en los artículos anteriores.\nCAPÍTULO II.\nDEL RECURSO DE RECLAMACIÓN:\nARTÍCULO 371.- SUBSTANCIACIÓN. El recurso de reclamación se substanciará con arreglo a lo dispuesto por el\nCapítulo II, Título Noveno, Libro Primero de la Presente Ley.\nCAPÍTULO III.\nDE LA EXPEDICIÓN DE COPIAS:\nARTÍCULO 372.- EXPEDICIÓN DE COPIAS CERTIFICADAS. El Ministerio Público y los demás funcionarios de la\nFiscalía General, podrán acordar la expedición de copias certificadas de constancias, registros y documentos que obren en su poder, cuando exista mandamiento de autoridad competente que motive y funde su requerimiento o cuando las soliciten el denunciante o el querellante, la víctima, el ofendido, el indiciado y sus defensores o quienes tengan interés jurídico para el ejercicio de derechos o el cumplimiento de obligaciones previstas por la Ley. Sólo se expresamente lo determine.\nARTÍCULO 373.- AUTORIZACIÓN PARA EXPEDIR COPIAS. Están autorizados para acordar la expedición de copias certificadas de constancias, registros y documentos:\nI. El Fiscal General, de cualquiera de los archivos de la Fiscalía General.\nII. Los Fiscales Especializados, de los archivos que obren en sus oficinas y en las unidades de su Área.\nIII. Los Directores Generales, Regionales, de Área y los Delegados, de los archivos respectivos y de las unidades subalternas de su adscripción.\nIV. Los agentes del Ministerio Público, de las constancias, registros y documentos que formen parte de las\nAveriguaciones Previas en que actúen y de los documentos que obren en sus respectivas oficinas.\n(REFORMADA, P.O. 12 DE MAYO DE 2009)\nV. Todos los funcionarios de la Fiscalía General, cuando les sean requeridas por la autoridad judicial federal, en términos de la Ley Reglamentaria de los artículos 103 y 107 de la Constitución Política de los Estados Unidos\nMexicanos, en los juicios de amparo.\n(REFORMADO, P.O. 12 DE MAYO DE 2009)\nLos funcionarios de la Fiscalía General deberán tener en cuenta la reserva de las actuaciones ministeriales al acordar lo relativo a la expedición de copias certificadas.\nCAPÍTULO IV.\nDEL RESGUARDO Y CUSTODIA DE LOS BIENES ASEGURADOS:\nARTÍCULO 374.- SECCIONES. La Dirección de Recursos Materiales y Bienes Asegurados o la dependencia facultada para el efecto, llevará las siguientes secciones de bienes asegurados:\nI. De bienes muebles.\nII. De bienes inmuebles.\nIII. De vehículos.\nIV. De dinero, valores, joyas y obras de arte.\nARTÍCULO 375.- REGISTRO. La Dirección o Dependencia competente llevará los registros correspondientes a cada una de las secciones señaladas en el artículo anterior y en los que se asentará el historial del bien, desde su aseguramiento hasta su destino final.\nARTÍCULO 376.- RESGUARDO DE BIENES MUEBLES. Tratándose de bienes muebles, tales como vehículos, valores, joyas, obras de arte, entre otros; el Agente del Ministerio Público que decrete el aseguramiento, deberá custodia o resguardo, levantando el inventario correspondiente.\nARTÍCULO 377.- DINERO. Tratándose de sumas de dinero, se depositarán en el Fondo para el Mejoramiento de la\nProcuración de Justicia.\nDe todo depósito de dinero que se realice al Fondo, se llevará, en la sección correspondiente, el registro y control respectivo.\nARTÍCULO 378.- ARMAS DE FUEGO Y EXPLOSIVOS. Tratándose de armas de fuego y explosivos, se estará a lo que prevenga la legislación federal respectiva.\nARTÍCULO 379.- INMUEBLES Y OTROS OBJETOS. Los inmuebles y objetos propios de actividades agropecuarias, así como los semovientes, serán administrados de conformidad a su destino.\nCAPÍTULO V.\nDE LA DISPOSICIÓN DE BIENES ASEGURADOS:\nARTÍCULO 380.- BIENES ASEGURADOS. Los bienes que constituyan instrumentos, objetos, productos o evidencia material de delito, que hayan sido asegurados por el Ministerio Público permanecerán afectos a la indagatoria hasta que se hayan puesto a disposición de la Autoridad Judicial correspondiente o hasta que se haya emitido determinación de no ejercicio de acción penal que quede firme o hasta que se levante el aseguramiento por cualquier medio que autorice la Ley.\nARTÍCULO 381.- ASEGURAMIENTO DE PRUEBA. No obstante lo dispuesto en el numeral anterior, el Ministerio\nPúblico podrá disponer de los bienes asegurados que se encuentren a su disposición en los términos que señalan los artículos siguientes, siempre que no resulte indispensable ponerlos a disposición de la Autoridad Judicial para los efectos de la consignación de la indagatoria correspondiente o que se haya asegurado la prueba conforme a lo dispuesto en la presente Ley.\nARTÍCULO 382.- DESTRUCCIÓN DE BIENES NOCIVOS Y PELIGROSOS. Los instrumentos y objetos de uso ilícito, así como las sustancias, materiales y demás elementos asegurados podrán ser destruidos tan pronto se asegure debidamente la prueba en los términos que señala la presente Ley; siempre que puedan resultar nocivos, tóxicos o peligrosos.\nARTÍCULO 383.- BIENES PERECEDEROS O DE DIFÍCIL CONSERVACIÓN. Los bienes cuya conservación sea difícil o costosa podrán ser dados en depositaría; mas si esta no se solicita y los mismos no son reclamados dentro de los seis meses siguientes a su aseguramiento, por quien acredite derecho legítimo, se entenderán abandonados a favor del Estado. Si los mismos fueren reclamados oportunamente sólo se devolverán a su titular cuando el mismo cubra los costos y gastos erogados para su conservación. En cualquier caso el bien asegurado se entenderá afecto en garantía del pago de los mencionados costos. total destrucción cuando ello sea necesario.\nARTÍCULO 384.- DINERO Y VALORES. El dinero y los valores bursátiles o similares serán depositados en el Fondo para el Mejoramiento de la Procuración de Justicia, sin que sus réditos o rendimientos puedan ser reclamados por medio alguno.\nARTÍCULO 385.- DECOMISO POR MINISTERIO DE LEY. Las armas y los instrumentos y objetos de uso prohibido o ilícito que se hubieren asegurado se entenderán decomisados por ministerio de Ley. El ministerio Público dispondrá de ellos en los términos que señalen las disposiciones aplicables, siempre que no resulte indispensable ponerlos a disposición de la Autoridad Judicial para los efectos de la consignación de la indagatoria correspondiente.\nLos instrumentos de uso lícito se decomisarán sólo mediante sentencia, en los términos que disponga el Código\nPenal y el Código de Procedimientos Penales vigentes en el estado.\nARTÍCULO 386.- ABANDONO DE BIENES. Los bienes asegurados y los que bajo cualquier título se encuentren a disposición del Ministerio Público, se entenderán abandonados a favor del Estado si los mismos no son reclamados haya sido levantado o quedado sin efectos o de un año a partir de su aseguramiento. Lo mismo sucederá en el supuesto a que se refiere el primer párrafo del artículo 383.\nJusticia.\nTÍTULO SEXTO.\nDEL FONDO PARA EL MEJORAMIENTO DE LA PROCURACIÓN DE JUSTICIA.\nCAPÍTULO UNICO.\nDE LA CONSTITUCIÓN, ADMINISTRACIÓN Y DISPOSICIÓN DEL FONDO.\nARTÍCULO 387. INTEGRACIÓN. El Patrimonio del Fondo para el Mejoramiento de la Procuración de Justicia, se integrará con:\n(REFORMADA, P.O. 12 DE MAYO DE 2009)\nI. El importe de las multas y las pólizas de fianzas otorgadas a favor de la Fiscalía General o del Ministerio Público, que se hagan efectivas.\nII. El importe de la reparación del daño cubierto en los supuestos a que se refiere el artículo 285 de la presente Ley.\nIII. El importe de la venta que se haga de objetos decomisados o abandonados, de sus frutos y rendimientos, que se encuentren a disposición del Ministerio Público y que no hayan sido reclamados en los términos de la legislación aplicable.\nIV. Los intereses que devenguen las cantidades depositadas en instituciones bancarias o por la inversión en títulos valor.\nV. Los demás recursos o partidas que establezcan las disposiciones jurídicas aplicables.\n(REFORMADO, P.O. 12 DE MAYO DE 2009)\nARTÍCULO 388.- ADMINISTRACIÓN. El Fondo para el Mejoramiento de la Procuración de Justicia será administrado por el Director General Administrativo, a través del Director de Recursos Financieros, quien se encargará de ejecutar las directrices señaladas por el Fiscal General para su administración, invirtiendo en la adquisición de títulos valores de renta fija que deberán ser nominativos a favor de la Fiscalía General.\nARTÍCULO 389.- VIGILANCIA. La Dirección General de Responsabilidades, por conducto del Subdirector de\nAuditoria, se encargará de verificar el correcto manejo del fondo, para lo cual el Director General Administrativo comprenderán, del primero de enero al treinta de junio y del primero de julio al treinta y uno de diciembre, respectivamente, de cada año.\nEl Fiscal General podrá ordenar al Visitador General, cuando así lo estime conveniente, la práctica de auditorias y la solicitud de rendición de informes sobre la situación del Fondo, al Director General Administrativo o al subalterno encargado del mismo.\nARTÍCULO 390.- DESTINO Y DISPOSICIÓN. El Patrimonio del Fondo se destinará:\nI. A sufragar los gastos que origine su administración.\nII. A la adquisición de los recursos materiales requeridos para la procuración de justicia.\nIII. A la construcción de edificios y su equipamiento, así como a la adquisición de equipo, recursos materiales, y los gastos necesarios que se generen para la consecución de los objetivos de la procuración de justicia.\nIV. A los cursos de actualización, capacitación, especialización y superación que organice el Instituto.\nV. A sufragar los gastos necesarios para la participación de los funcionarios y el personal administrativo, que se estime conveniente en congresos, seminarios y demás eventos académicos que tengan los mismos fines que los cursos que imparta el Instituto.\nVI. A los programas de estímulos y recompensas que se implementen.\n(DEROGADO, P.O. 12 DE MAYO DE 2009)\nTÍTULO SÉPTIMO.\nDEL REGIMEN DE SERVICIO\n(DEROGADO, P.O. 12 DE MAYO DE 2009)\nCAPÍTULO I.\nDE LA NATURALEZA Y CONDICIONES DE SERVICIO:\nARTÍCULO 391.(DEROGADO, P.O. 12 DE MAYO DE 2009)\nARTÍCULO 392.(DEROGADO, P.O. 12 DE MAYO DE 2009)\n(DEROGADO, P.O. 12 DE MAYO DE 2009)\nCAPÍTULO II.\nDE LAS VACACIONES Y LICENCIAS:\nARTÍCULO 393.(DEROGADO, P.O. 12 DE MAYO DE 2009)\nARTÍCULO 394.-\nARTÍCULO 395.TÍTULO OCTAVO.\nDISPOSICIONES COMPLEMENTARIAS.\nCAPÍTULO I.\nDEL INGRESO Y SELECCIÓN DEL PERSONAL.\nARTÍCULO 396.-\nARTÍCULO 397.-\nCAPÍTULO II.\nOTRAS DISPOSICIONES:\nARTÍCULO 398.-\nARTÍCULO 399.(DEROGADO, P.O. 12 DE MAYO DE 2009)\nARTÍCULO 400.(DEROGADO, P.O. 12 DE MAYO DE 2009)\nARTÍCULO 401.(DEROGADO, P.O. 12 DE MAYO DE 2009)\nARTÍCULO 402.(DEROGADO, P.O. 12 DE MAYO DE 2009)\nARTÍCULO 403.(DEROGADO, P.O. 12 DE MAYO DE 2009)\nARTÍCULO 404.(DEROGADO, P.O. 12 DE MAYO DE 2009)\nARTÍCULO 405.(DEROGADO, P.O. 12 DE MAYO DE 2009)\nPRIMERO. Publíquese en el Periódico Oficial del Gobierno del Estado.\nSEGUNDO. La presente Ley entrará en vigor a los seis meses contados a partir del día siguiente al de su publicación en el Periódico Oficial del Gobierno del Estado.\nTERCERO. Desde la fecha que inicie su vigencia queda abrogada la Ley Orgánica del Ministerio Público del Estado de Coahuila de Zaragoza publicada en el Periódico Oficial del Gobierno del Estado del día once de marzo de dos mil cinco y sus reformas subsecuentes. Las menciones que de dicha Ley se hagan en otras disposiciones legales se entenderán referidas a la Ley de Procuración de Justicia.\nCUARTO. La presente ley sustituye la normatividad relativa a la Averiguación Previa y a las atribuciones del\nMinisterio Público en la investigación de los delitos, por lo que a partir de su vigencia se derogan todas las disposiciones en lo que se opongan a la misma.\nQUINTO. Las Averiguaciones Previas que se inicien bajo su vigencia se sujetarán a lo dispuesto en la presente Ley.\nLas Averiguaciones Previas que se encuentren en tramite se sujetarán en lo sucesivo a ella. Los actos concretos y concluirán con base en las disposiciones de la legislación conforme a la que iniciaron.\nSEXTO. Las disposiciones relativas a la libertad bajo caución, libertad por penalidad alternativa para los efectos procesales, la oblación, la falta penal, el perdón en delitos perseguibles de oficio, las causales de no ejercicio de acción penal y los demás beneficios análogos contenidos en las disposiciones que se derogan o abrogan, se podrán aplicar a las Averiguaciones Previas y, en su caso, a los Procesos, que se hayan iniciado antes de la vigencia de la presente Ley; en cuanto resulten más benéficas al inculpado o éste las solicite.\nSÉPTIMO. Durante los Procesos los actos y las actuaciones de Averiguación Previa se valorarán y examinarán de acuerdo a las disposiciones legales conforme a las cuales se hayan constituido, de conformidad en lo dispuesto en los artículos anteriores. Los Tribunales y demás autoridades reconocerán las atribuciones y la normatividad que rige al Ministerio Público contenidas en la presente Ley a partir de inicio de su vigencia.\nOCTAVO. Los nombramientos expedidos con anterioridad continuarán generando sus efectos hasta que se expidan los nuevos; pero conferirán las atribuciones contenidas en la presente Ley a partir del inicio de su vigencia, por lo que la adscripción o especialidad que los mismos contemplen se entenderá como comisión.\nNOVENO. Se derogan las disposiciones de la Ley de Seguridad Pública del Estado exclusivamente en lo que se refieran a la selección y admisión de personal y al servicio de carrera del personal del Ministerio Público y sus auxiliares directos; en cuanto se opongan a la presente Ley.\nDÉCIMO. El personal que desee incorporarse al Servicio Civil de Carrera contará con el plazo de un año a partir de que la presente Ley entre en vigor, para solicitar su incorporación.\nDÉCIMO PRIMERO. Las Agencias y las Coordinaciones del Ministerio Público conservarán su denominación, especialización o adscripción territorial, hasta en tanto no se modifiquen con sujeción a lo dispuesto por la presente\nLey.\nDADO en el Salón de Sesiones del Congreso del Estado, en la Ciudad de Saltillo, Coahuila, a los trece días del mes de mayo de dos mil ocho.\nDIPUTADA PRESIDENTA.\nLETICIA RIVERA SOTO.\n(RÚBRICA)\nDIPUTADA SECRETARIA. DIPUTADO SECRETARIO.\nJULIETA LÓPEZ FUENTES. GENARO EDUARDO FUANTOS SÁNCHEZ.\n(RÚBRICA) (RÚBRICA)\nIMPRÍMASE COMUNÍQUESE Y OBSÉRVESE\nEL GOBERNADOR DEL ESTADO\nPROFR. HUMBERTO MOREIRA VALDÉZ\n(RÚBRICA)\nEL SECRETARIO DE GOBIERNO\nLIC. HOMERO RAMOS GLORIA\n(RÚBRICA)\nEL PROCURADOR GENERAL DE JUSTICIA DEL ESTADO\nLIC. JESÚS TORRES CHARLES\n(RÚBRICA)\nN. DE E. A CONTINUACION SE TRANSCRIBEN LOS ARTICULOS TRANSITORIOS DE LOS DECRETOS DE REFORMAS A\nLA PRESENTE LEY.\nPRIMERO. La presente Decreto entrará en vigor al día siguiente de su publicación en el Periódico Oficial del Estado.\nSEGUNDO. Todas las disposiciones, menciones y referencias que se hagan en las leyes y reglamentos nacionales, estatales y municipales a la Procuraduría General de Justicia del Estado y al Procurador General de Justicia del Estado; a la Secretaría de\nSeguridad Pública del Estado y al Secretario de Seguridad Pública del Estado, se entenderán hechas a la Fiscalía General y al\nFiscal General.\nTERCERO. Todas las disposiciones, menciones y referencias que se hagan en las leyes y reglamentos nacionales, estatales y especializados, conforme a las siguientes denominaciones:\nSubprocurador Ministerial: Fiscal Ministerial, de Investigación y Operación Policial.\nSubprocurador de Control de Procesos y Legalidad: Fiscal de Control de Procesos y Legalidad.\nSubprocurador Jurídico de Profesionalización y de Proyectos: Fiscal Jurídico, de Profesionalización y de Proyectos.\nCUARTO. Se derogan todas las disposiciones que se opongan al presente Decreto.",
  "ordenamiento": "REGLAMENTO",
  "jurisdiccion": "COAHUILA",
  "fuente_oficial": "DIARIO OFICIAL DE LA FEDERACION",
  "Fecha de Publicación": "16 de mayo de 2008",
  "ULTIMA REFORMA PUBLICADA": "12 DE MAYO DE 2009",
  "es_escaneado": false,
  "tiene_tablas": false,
  "materia": [
    "judicial"
  ]
}