{
  "titulo": "Ley del Notariado del Estado de Coahuila",
  "Contenido": "LEY DEL NOTARIADO DEL ESTADO DE COAHUILA\nEL C. OSCAR FLORES TAPIA, GOBERNADOR CONSTITUCIONAL DEL ESTADO INDEPENDIENTE, Que el Congreso del mismo ha decretado lo siguiente:\nEL CONGRESO DEL ESTADO INDEPENDIENTE, LIBRE Y SOBERANO DE COAHUILA DE\nZARAGOZA,\nLEY DEL NOTARIADO DEL ESTADO DE COAHUILA\nTITULO PRIMERO\nDEL NOTARIO EN EJERCICIO DE SUS FUNCIONES\nCAPITULO PRIMERO\nDE LAS FUNCIONES DEL NOTARIO\nARTICULO 1o.- El ejercicio del Notariado en el Estado de Coahuila, es una función de orden público; está a cargo del Ejecutivo del Estado y, por delegación, se encomienda a profesionales del Derecho, en virtud del fiat que para el efecto les otorga el Congreso del Estado.\nARTICULO 2o.- El Notario es la persona investida de fe pública, autorizada para autentificar los actos y los hechos, a los que los interesados deban o deseen dar forma conforme a las Leyes.\nARTICULO 3o.- La función del Notario es vitalicia, y no se podrá destituir a los que la ejerzan legalmente, sino en los casos y con las formalidades que determinan las leyes, especialmente la presente.\nARTICULO 4o.- El Notario está obligado a ejercer sus funciones cuando para tal efecto sea requerido.\nDebe rehusarlas:\nI.- Si el acto que se le pide autorizar, esta prohibido por la Ley, si es manifestante contrario a las buenas costumbres, o si corresponden su autorización exclusivamente a otro funcionario;\nII.- Si como partes intervinieren su cónyuge, sus parientes consanguíneos o afines en líneas recta sin limitación de grado, o en la colateral hasta el segundo grado inclusive;\nIII.- Si el acto interesa en sí mismo al Notario, o su cónyuge, a algunos de sus parientes en los grados que expresa la fracción anterior, o a personas de quienes algunos de ellos fuera apoderado o representante legal en el acto que se trata de autorizar; y\nIV.- Cuando haya intervenido como abogado de los interesados en el negocio judicial del que emana el documento o acto que se le pide autorizar.\nARTICULO 5o.- El Notario puede rehusar el ejercicio de sus funciones por las razones siguientes:\nI.- Estar ocupado en otro acto notarial;\nII.- Padecer enfermedad que le impida trabajar;\nIII.- En días festivos, o en horas que sean de oficina;\nIV.- Si los interesados no anticipan los gastos y honorarios, pudiendo, en su caso, rehusar la expedición del testimonio, mientras no se le haga dicho pago, excepto cuando se trate de testamento de persona grave;\nV.- Si su intervención notarial en el acto o el hecho que se le pide autorizar, pone en peligro su vida, su salud o sus intereses;\nVI.- Si tratándose de un asunto claramente contencioso, el Notario considera ser en el mismo un testigo a quien le toquen las tachas de la Ley conforme a la legislación común, por virtud de las personas a quien interesa o afecta el acto que se le pide autorizar.\n(REFORMADO, P.O. 24 DE OCTUBRE DE 1980)\nARTICULO 6o.- El ejercicio de la función del notario es incompatible con el desempeño de:\nI.- Cargos de funcionario o empleado al servicio de cualquiera de los tres Poderes del Estado o de la\nFederación, o de Entidades desconcentradas o descentralizadas del Gobierno Federal o Estatal;\nII.- Cargo de funcionario o empleado al servicio del Municipio o de Entidades desconcentradas o descentralizadas municipales;\nIII.- Cargos de funcionario o empleado, bajo la dirección y dependencia de personas físicas o morales;\nIV.- Aquellos cargos que las Leyes u otros ordenamientos jurídicos señalen expresamente.\n(REFORMADO, P.O. 31 DE DICIEMBRE DE 1996)\nSe exceptúan de las incompatibilidades señaladas, los cargos docentes, asistenciales y electorales.\nARTICULO 7o.- El Notario residirá, y sólo podrá ejercer sus funciones dentro del Distrito de su adscripción. Los actos que autorice pueden referirse a cualquier otro lugar.\nCuando se trate de actos por los cuales se constituya, modifique o extinga algún derecho real sobre bienes inmuebles localizados en el Distrito Notarial de su adscripción, el Notario personalmente y bajo su más estricta responsabilidad, podrá recabar las firmas de los interesados en lugar distinto a su Distrito, haciendo constar esta circunstancia en el instrumento correspondiente.\nARTICULO 8o.- Los Notarios no serán remunerados por el erario, sino que cobrarán a los interesados, en cada caso los honorarios que devenguen.\nARTICULO 9o.- Son atribuciones y facultades de los Notarios:\nI.- Autorizar en sus protocolos con total arreglo a las leyes vigentes toda clase de instrumentos públicos;\nII.- Certificar y ratificar fuera de Protocolo contratos y documentos privados en los términos de la presente\nLey y de las demás disposiciones legales aplicables.\nIII.- Actuar como Arbitro, Secretario o Actuario en juicios o procedimientos arbitrales; desempeñar el carácter de Notario.\nIV.- Autorizar los testamentos cerrados;\nV.- Hacer substitución de poderes;\n(REFORMADA, P.O. 31 DE DICIEMBRE DE 1996)\nVI.- Levantar aceptaciones y protestos, sujetándose a las reglas de la legislación respectiva.\n(REFORMADA, P.O. 31 DE DICIEMBRE DE 1996)\nVII.- Certificar copias de los documentos que se les presenten y expedir testimonios de los que autoricen.\nVIII.- Poner notas al calce o margen de otros instrumentos públicos y en los casos de cancelación, venta, adjudicación y cualquier otro en que sean necesarias, siempre que esas notas procedan de contrarios legalmente autorizados;\nIX.- Autorizar y extender íntegramente en el protocolo los contratos originales ya escritos que presenten las partes, lo cual harán siempre que dichos contratos no se opongan a las leyes o a las buenas costumbres;\nX.- Protocolo todos los documentos y demás actos que les soliciten, siempre y cuando no sean contrarios a las leyes y a las buenas costumbres;\nXI.- (DEROGADA, P.O. 31 DE DICIEMBRE DE 1996)\nXII.- Enviar a la oficina respectiva el aviso a que se refiere el artículo 48 de la Ley Reglamentaria del\nRegistro Público de la Propiedad;\n(REFORMADA, P.O. 31 DE DICIEMBRE DE 1996) (F. DE E., P.O. 14 DE FEBRERO DE 1997)\nXIII.- Intervenir, cuando el interesado opte por esta vía y no por la judicial, conforme a las disposiciones legales aplicables, en los procedimientos a que se refiere el Título Décimo Quinto del Código de\nProcedimientos Civiles del Estado.\nXIV.- Intervenir en la tramitación extrajudicial de sucesiones testamentarias e intestamentarias, conforme a las disposiciones legales aplicables en cada caso.\nXV.- Las demás que establezcan las leyes.\nCAPITULO SEGUNDO\nDEL PROTOCOLO\nARTICULO 10.- El protocolo de los Notarios Públicos está constituido por los siguientes elementos:\na).- Las hojas sueltas en las cuales se asientan las escrituras, que deben tener las características que esta Ley señala;\nb).- Los libros formados con las hojas sueltas a que se refiere el inicio (sic) anterior, las cuales deberán ser sólidamente encuadernados en la forma y términos que señale el artículo 16 de esta Ley;\nc).- El apéndice, que se forma con la glosa de todos los documentos relativos a cada una de las escrituras, los que se deberán encuadernar sólidamente en uno o más tomos, en la forma que se señala en el artículo 16 de esta Ley;\nd).- El índice, que deberá llevarse en los términos que señala esta Ley.\nARTICULO 11.- Las hojas con las cuales se forman los protocolos, deberán ser de la mejor calidad, a fin de que perduren sin deterioro; tendrán de 33 a 35 centímetros de largo por 21.5 a 24 centímetros de ancho en su parte utilizable. Al escribirse en ellas las escrituras y actas notariales se dejará en blanco una tercera parte a la izquierda, separada por medio de una línea de tinta para poner en dicha parte las razones y anotaciones que legalmente deban asentarse ahí. Cuando se agote esta parte pondrá razón de que las anotaciones se continúan en hoja por separado especialmente destinada al efecto, hoja que se agregará al apéndice.\nAdemás, se dejará siempre en blanco una faja de un centímetro de ancho por el lado del doblez del libro y otro igual a la orilla que servirá para la encuadernación y para proteger lo escrito. Al reverso de la hoja se dejarán los mismos espacios en forma inversa.\nARTICULO 12.- Todas las hojas del protocolo tendrán el número progresivo de su foliatura en letras y cifras y en ellas se estamparán el sello de autorizar y la rúbrica del Notario a cuyo cargo esté el protocolo respectivo.\nARTICULO 13.- Las escrituras se asentarán en forma manuscrita o mediante el empleo de cualquier tipo de máquina de escribir o de impresión; también se podrán asentar mediante cualquier sistema de reproducción química, fotográfica, fotostática, electrostática, o hectográfica y en general por cualquier otro sistema análogo a los anteriores, siempre y cuando lo escrito sea perfectamente legible indeleble y claro.\nNo se escribirán más de cuarenta líneas por página, a igual distancia una de las otras.\n(REFORMADO, P.O. 24 DE OCTUBRE DE 1980)\nARTICULO 14.- Los Notarios abrirán su protocolo, antes del primer instrumento, asentando una acta donde conste su nombre y apellidos, el número de la Notaría asignada, el lugar, domicilio de la Notaría, fecha de apertura, su sello y su firma. El 31 de diciembre de cada año, lo Notarios cerrarán su protocolo salvo permiso, licencias o encontrase ausentes del lugar de su residencia en los términos previstos por esta Ley, asentando bajo protesta, una certificación donde conste cuantos instrumentos contiene el protocolo que se cierra, de cuantas fojas está compuesto, cuantos instrumentos pasaron, cuántos no pasaron, cuantos están pendientes de autorización definitiva, señalando sus números, de cuantos documentos consta el apéndice y por último, la firma y el sello del Notario.\nEl Notario podrá una vez cerrado el protocolo, autorizar definitivamente los instrumentos que hubiesen quedado pendientes dentro de los plazos y una vez cubiertos los requisitos de las Leyes respectivas.\nARTICULO 15.- En las hojas que componen el protocolo, no deberán dejarse entre un instrumento y el siguiente, más espacio que el estrictamente necesario, para las firmas de las personas que intervengan y del Notario, su sello y la autorización definitiva.\nSin embargo, cuando el Notario utilice algún procedimiento de impresión o reproducción podrá, comenzar sus escrituras al principio de página, debiendo cancelar el espacio en blanco que quede de la anterior, de manera que para todos los efectos legales se le considere inutilizable.\nARTICULO 16.- Dentro de los noventa días siguientes a la fecha en que se cierre un protocolo, se procederá a su encuadernación bajo la más estricta vigilancia del Notario, debiendo observarse que los libros no deban exceder de 400 hojas o sea 800 páginas cada uno y si resultaren varios se numerarán progresivamente.\nAl encuadernarse los protocolos se observará:\nI.- Que las cubiertas sean de color negro;\nII.- Que en el Lomo y cubierta principal se señale:\n\"Notaría Número......\", protocolo, número progresivo que le corresponda o sea \"Libro número.......\", y el año en el que se actuó.\nEl Apéndice se encuadernará en los tomos que sean necesarios debiendo corresponder uno por cada libro del protocolo, en la forma que previenen las fracciones anteriores con la salvedad de llevar la leyenda \"Apéndice del Libro Número........\" en lugar de la palabra protocolo.\nARTICULO 17.- Los Notarios intervendrán personalmente en todos los actos que autoricen, sin poder encomendarlos a otra persona. Tendrán obligación de indagar hasta donde sea posible la capacidad de las personas que ante ellos comparecen y a instruirlas del alcance y consecuencias legales del acto que van a otorgar, cerciorándose de que obran por su espontánea voluntad y sin coacción ni violencia.\n(REFORMADO, P.O. 24 DE OCTUBRE DE 1980)\nARTICULO 18.- Unicamente los titulares de la Notarías están facultados para extraer y trasladar de ellas sus protocolos.\nLos protocolos pertenecen al Estado, pero el Notario podrá conservarlos hasta por un plazo de 10 años.\nTranscurriendo este término, los remitirá a la Dirección de Notarías, dentro de los primeros 30 días del año en que deban ser enviados.\n(REFORMADO, P.O. 24 DE OCTUBRE DE 1980)\nARTICULO 19.- Fuera de las casas de substitución autorizada a que se refiere esta Ley, son nulos los instrumentos que se autoricen en el protocolo por Notario diverso del que lo tiene a su cargo; el que se hubiere realizado esta autorización, así como el Notario responsable del protocolo sufrirán la pena de suspensión por un año y serán responsables de la indemnización de daños y perjuicios a las partes.\nSerán igualmente nulos los instrumentos que autorice el Notario que tenga la incompatibilidad conforme a esta Ley y responderá de los daños y perjuicios que cauce a las partes, independientemente de la sanción que corresponda en los términos previstos en ésta y otros ordenamientos jurídicos.\nARTICULO 20.- Los protocolos no se presentarán a ninguna persona. Los instrumentos sólo podrán caso de que se necesite el reconocimiento de alguna escritura, por orden administrativa o judicial dada por escrito, los Notarios pondrán de manifiesto el documento a que se refiere la orden en la misma\nNotaría, a los peritos encargados de hacer el reconocimiento o cotejo, o a los funcionarios y jueces que lo practiquen, lo que harán siempre en presencia del mismo Notario, quien pondrá razón de esta diligencia al margen del instrumento que haya motivado la inspección.\nARTICULO 21.- Los Notarios no violan el secreto profesional por el hecho de dar a las autoridades administrativas y judiciales los datos e informes que le soliciten, o los avisos que prevengan la Ley; pero si necesitaren copia de las escrituras o actas notariales, deberá pedirse al Notario por escrito sin que su expedición origine costo alguno para la autoridad solicitante.\nARTICULO 22.- En el margen de las hojas donde conste una escritura, deberán hacerse invariablemente las anotaciones a que se refiere el Capítulo \"De las anotaciones Marginales\".\nARTICULO 23.- En el protocolo no puede haber raspaduras ni enmendaduras de lo escrito; en caso de que fuere necesario hacer alguna corrección, se testará el texto erróneo con una línea indeleble que permita su lectura, y al final de la escritura, antes de las firmas respectivas se salvará mediante transcripción y la razón de que no vale; los textos que deben ser entrelineados, también se salvarán al final mediante su transcripción y la razón de que sí valen.\nCAPITULO TERCERO\nDEL APENDICE\nARTICULO 24.- Los documentos relativos a cada escritura formarán el apéndice, el que, a su vez, se considerará parte integrante del protocolo.\n(REFORMADO, P.O. 12 DE ENERO DE 1996)\nARTICULO 25.- En cada documento de los mencionados en el artículo anterior, el Notario asentará en forma manuscrita, a máquina, por medio de sellos, o por una combinación de estos medios, una razón donde constará el número de la escritura correspondiente, y un inciso, alfabético o numérico, con el cual se identificará particularmente el documento respectivo, además de su sello de autorizar y su rúbrica.\nARTICULO 26.- Dentro de los 90 días siguientes a la fecha de cierre anual del protocolo, los documentos del apéndice deberán ser sólidamente encuadernados en la forma que previene el artículo 16 de esta\nLey.\nARTICULO 27.- Los documentos del apéndice por ningún motivo podrán ser desglosados, pero el Notario podrá expedir copias certificadas de los mismos cuando legalmente proceda.\nCAPITULO CUARTO\nDEL INDICE\nARTICULO 28.- Los Notarios llevarán un índice en papel igual al del protocolo, en el que por orden cronológico anotarán un asiento por cada instrumento que otorguen en su protocolo, en el que se asentarán: el número del libro, el número de la escritura correspondiente, el de las hojas en que comienza y acaba, la fecha de su otorgamiento, la naturaleza del acto de que se trate y los nombres de los otorgantes, así como el número de los documentos que le correspondan en el apéndice. Esta razón se firmará en forma análoga al protocolo. Sólo firmará el asiento el Notario cuando el instrumento no pase.\nARTICULO 29.- Al cerrarse el protocolo en la forma prevista en el artículo 14 de esta Ley, el Notario remitirá una copia certificada del índice al Archivo de Notarías, dentro del mes de enero siguiente. Dicha copia podrá ser escrita original en máquina, manuscrita con tinta, fotostática, fotográfica, heliográfica o elaborada mediante cualquier otro sistema de reproducción o de impresión, a condición de que sea indeleble y clara.\nCAPITULO QUINTO\nDE LAS ESCRITURAS\nARTICULO 30.- La escritura es el instrumento asentado por el Notario en su protocolo, haciendo constar un acto jurídico. La escritura se integrará por su texto escrito y por los documentos relativos a la misma que se agreguen al apéndice.\nARTICULO 31.- Las escrituras se asentarán con letra clara y sin guarismos, a no ser de que éstos aparezcan asentados en letras, o que se trate de transcripciones. Los blancos o huecos, si los hubiere, se cubrirán con líneas fuertemente grabadas, precisamente antes de que se firme la escritura. Al final de ella se salvarán las palabras testadas y entrerrenglonadas. Las testaduras se harán con una línea horizontal que deje legible el texto, haciéndose constar al final que no valen. El espacio en blanco que puede quedar antes y después de las firmas, debe ser llenado con líneas para que quede cancelado dicho espacio. Se prohiben las enmendaduras y raspaduras.\nARTICULO 32.- Toda escritura se extenderá sujetándose a las reglas siguientes:\nI.- Se redactará en castellano, escribiéndose sin abreviaturas, guarismos, raspaduras, enmendaduras y sin dejar huecos. Cuando existan éstos, se llenarán precisamente antes de firmar la escritura con líneas de tinta fuertemente grabados;\n(ADICIONADO, P.O. 12 DE ENERO DE 1996)\nA solicitud de alguna de las partes y a su costa, se podrá incluir en las escrituras, una versión de su contenido redactado en idioma distinto del castellano, con la intervención de un perito traductor designado por el Notario, de entre aquellos que se encuentren registrados como tales ante los Tribunales de la localidad;\nII.- Los Notarios firmarán la razón de autorización y únicamente rubricarán las razones marginales;\n(REFORMADA, P.O. 24 DE OCTUBRE DE 1980)\nIII.- Consignará el Notario su nombre y apellidos, el número de la Notaría y el lugar del Distrito en que se extiende;\nIV.- Expresará su número que siempre será progresivo, la fecha del otorgamiento, el nombre, apellido, edad, estado civil, nacionalidad, profesión y oficio y domicilio de los contratantes y de los intérpretes y testigos de conocimiento y además que conforme a las leyes sean necesarias. La fecha en que cada interesado haya firmado la escritura en caso de que sea distinta a aquella en que empezó a ser asentada en el protocolo;\nV.- Invariablemente se expresará en los testamentos y en las constituciones de hipotecas, la hora del otorgamiento, así como en los demás casos en los que la Ley lo prevenga;\nVI.- Al expresar el domicilio no sólo debe hacerse constar la vecindad en general, sino también el número de la casa, el nombre de la calle o cualquier otro dato que indique la residencia de la persona de quien se trate, de la mejor manera posible;\nVII.- Los Notarios consignarán el acto o contrato por medio de cláusulas redactadas con claridad y concisión, evitando toda palabra inútil, limitándose a expresar con precisión el contrato que se celebra o el acto que se autoriza;\nVIII.- Se designarán con exactitud, las cosas que formen el objeto de la disposición o convenio, de tal manera que no puedan ser confundidas con otras. Si se tratare de bienes inmuebles, determinará su naturaleza, ubicación, indicando el municipio, el distrito y la entidad federativa; sus colindancias; y en cuanto fuere posible sus límites topográficos y su extensión superficial; así como los antecedentes de propiedad y registro, exigiendo los documentos que comprueben que estan cubiertos los impuestos prediales tanto municipales como estatales; que se encuentren libres, en su caso, de todo gravamen, y los planos y avalúos periciales de los inmuebles materia de la operación. Los documentos mencionados se agregarán al apéndice del protocolo respectivo, haciéndose una relación de ellos en la escritura e insertándolos o agregando copia autorizada en el testimonio respectivo;\nIX.- Se compulsará cualquier documento que se presente y del que deba hacerse inserción a la letra, remitiéndose a él, cotejándolo debidamente y dejándolo sellado y rubricado; y en su caso será agregado al legajo respectivo del apéndice. Cualquier inserción se hará literalmente;\n(REFORMADA, P.O. 24 DE OCTUBRE DE 1980)\nX.- A efecto de determinar los extremos de los artículos 2211 y 2214 del Código Civil del Estado, así como cuando se trate de hipotecas en el caso del artículo 2798 del mismo Código tratándose de escrituras privadas que contengan actos relativos a bienes inmuebles y que se presenten a los Notarios para su ratificación, exigirán además la exhibición de certificados del valor fiscal del inmueble, que extenderá la oficina catastral o en su defecto la Recaudación de Rentas del Estado del lugar de ubicación del inmueble. Asimismo el Notario exigirá copia de la Escritura privada y de los documentos que la integren, la que remitirá la Dirección de Notarías, dentro de los 30 días siguientes.\nXI.- Se determinará de manera precisa la renuncia que se haga por los contratantes, de alguna Ley que no sea de las prohibitivas o de aquellas que afecten al interés o derecho público o a las buenas costumbres, observándose en este punto, lo que previenen las leyes de la materia.\nXII.- Se llenarán los requisitos establecidos por la Ley Orgánica y Reglamentos de las fracciones I y IV del artículo 27 constitucional, en la organización de sociedades y en la adquisición de bienes raíces por extranjeros, así como los demás requisitos que exijan el Código de Comercio, la Ley General de\nSociedades Mercantiles y las demás leyes en relación a los contratos y documentos en que intervengan los Notarios;\n(REFORMADA, P.O. 24 DE OCTUBRE DE 1980)\nXIII.- Cuando el otorgante sea ciego, mudo, sordo, o no sepa leer y escribir se estará a lo dispuesto en el\nCódigo Civil del Estado;\nXIV.- La parte que no supiere el idioma español, se hará acompañar de un intérprete elegido por ella, que hará protesta formal ante el Notario de cumplir lealmente a su cargo. La parte que conozca el idioma español podrá también llevar otro intérprete para lo que a su derecho convenga;\n(REFORMADA, P.O. 12 DE ENERO DE 1996)\nXV.- Firmarán los otorgantes, testigos de identidad y los demás que intervengan, los intérpretes y por último el Notario, quien además pondrá su sello. Cuando alguno de los otorgantes no pueda o no sepa firmar, lo hará a su ruego otra persona. Las firmas de las partes podrán ser recabadas por el Notario aun cuando aquéllas no estén conjuntamente presentes ante él.\nEn los casos de protestas, interpelaciones, requerimientos y demás diligencias notariales de la misma índole, en que se niegue a firmar la persona con quien se entienda la diligencia, lo hará constar así el\nNotario;\nXVI.- Si las partes quisieren hacer alguna adición o modificación antes de que firme el Notario, se asentarán aquellas, sin dejar espacio en blanco, mediante declaración de que se leyeron, la cual será suscrita por los interesados y el Notario, quien sellará al pie la adición o variación verificada;\nXVII.- Los espacios en blanco que puedan quedar antes de las firmas en las actas notariales, deberán ser llenadas con líneas de tinta;\nXVIII.- Las testamentarías que se tramiten ante los Notarios se llevarán mediante actas levantadas en el protocolo. Siempre que se otorgue un testamento público abierto, cerrado o simplificado, el Notario ante quien se celebre dicho acto jurídico dará aviso por escrito a la Dirección de Notarias dentro de los 8 días hábiles siguientes, en el que se expresará:\na).- Nombre completo del testador;\nb).- Nacionalidad;\nc).- Ocupación y domicilio;\nd).- Lugar y fecha de nacimiento;\ne).- Clave Única de Registro de Población;\nf).- Estado civil, régimen matrimonial y nombre completo del cónyuge, en su caso;\ng).- Nombre completo de los padres;\nh).- Tipo de testamento;\ni).- Número de escritura;\nj).- Volumen o tomo;\nk).- Lugar, hora y fecha de otorgamiento de la escritura;\nl).- Disposiciones de contenido irrevocable, en caso de haberse establecido;\nm).- Nombre completo del Notario;\nn).- Tipo de Notaría, en su caso;\no).- Número de Notaría;\np).- Municipio y/o Distrito Notarial, y\nq).- Mención si el testamento cancela o revoca otra disposición testamentaria otorgada con anterioridad, en caso de que así sea.\nSi el testamento fuere cerrado indicará además la persona en cuyo poder se depositó o el lugar en que se haya hecho el depósito.\nLa Dirección de Notarías dentro de los 15 días hábiles siguientes a aquel en que lo reciba, ingresará el aviso de testamento por vía electrónica a la base de datos del Registro Nacional de Avisos de\nTestamento, así mismo, llevará un libro especial destinado a asentar las inscripciones relativas y los datos que se mencionan.\nLa autoridad judicial o el Notario Público ante quien se inicie un procedimiento sucesorio deberá recabar, previa a la radicación del mismo, un informe sobre la existencia o inexistencia de alguna disposición testamentaria otorgada por el autor de la sucesión, mediante la solicitud de búsqueda local o nacional a la Dirección de Notarías.\nNacional de Avisos de Testamento.\nXIX.- Al citar el nombre de un Notario ante cuya fe haya pasado algún instrumento, se mencionará el número de la notaría de que se trata y la fecha del acto;\nXX.- La personalidad de quien comparezca en representación de otros, quedará acreditada, insertado, agregando o extractando los documentos respectivos; o bien relacionándolos en la escritura y asentando que quedan agregados al apéndice, para ser extractados o transcritos en el testimonio o agregando copia autorizada de los mismos;\nXXI.- Se compulsarán los documentos de los cuales deba hacerse la inserción a la letra;\nXXII.- Al agregarse al apéndice cualquier documento, se observará lo dispuesto en el artículo 25 de esta\nLey;\nXXIII.- El Notario hará constar bajo su fe:\na).- Que conoce a los comparecientes y que tienen capacidad legal para efectuar el acto de que se trate;\nb).- Que les leyó la escritura, así como a los testigos de conocimiento o intérpretes, si los hubiere, o que los comparecientes la leyeron por sí mismos;\nc).- Que a los comparecientes les explicó el valor y las consecuencias legales del contenido de la escritura;\nd).- Que los comparecientes manifestaron su conformidad con la escritura y la firmaron. En caso de que no sepan o no puedan firmar los comparecientes, imprimirán su huella digital y firmarán a su ruego las personas que al efecto elijan; y\ne).- Los hechos que presencie el Notario y que sean integrantes del acto que autorice, como entrega de dinero, de títulos u otros.\nXXIV.- Se satisfacerán todos los demás requisitos establecidos por el Código Civil del Estado y por la Ley\nReglamentaria del Registro Público de la Propiedad del Estado y demás Leyes aplicables.\nARTICULO 33.- Para que el Notario dé fe de conocer a los comparecientes y de que tienen capacidad legal, bastará con que sepa su nombre y apellido, que no observe en ellas manifestaciones patentes de incapacidad natural y que no tenga noticias de que estan sujetos a incapacidad civil.\nARTICULO 34.- En caso de no serle conocidos los comparecientes, hará constar su identidad si le presentan documentos oficiales, a satisfacción del Notario, o por declaración de dos personas idóneas a quienes conozca el propio Notario; circunstancia que expresará en la escritura. En caso de identificación por documentos, asentará en la escritura los principales datos del documento respectivo.\nARTICULO 35.- Si el Notario no pudiere identificar a alguna de las partes, no se otorgará la escritura, salvo caso grave o urgente, expresando el Notario la razón correspondiente.\nLa escritura se confirmará, comprobada que sea plenamente la identidad del otorgante.\nARTICULO 36.- Inmediatamente después de que la escritura sea firmada por los otorgantes, será firmada y sellada por el Notario. Aún cuando los interesados no firmen una escritura, ésta siempre deberá tener en cada una de las hojas que la componen el sello y la rúbrica del Notario y al final la firma completa del mismo y el sello.\nARTICULO 37.- Independientemente de la autorización definitiva que deberá poner el Notario al pie de los instrumentos notariales, después de que se hayan pagado los tributos que se causen, y de que se hayan cumplido los demás requisitos que previenen de las leyes, el Notario ante cuya fe haya pasado la escritura de que se trate, pondrá inmediatamente después de que hubiere firmado el último de los otorgantes, la autorización preventiva consistente en esta razón: \"pasó ante mí\". Dicha razón será sellada y firmada por el Notario ante quien haya pasado la escritura.\nCuando el contrato o acto no cause ningún tributo, ni sea necesario aguardar el cumplimiento de cualquier otro requisito previo a la autorización definitiva de la escritura, se pondrá desde luego dicha autorización definitiva.\nARTICULO 38.- Los Notarios pondrán antes de su firma en la razón de autorización definitiva de las escrituras, la fecha y el lugar en que las autoricen.\nARTICULO 39.- Cuando por cualquier motivo el Notario ante quien se hubiere otorgado en debida forma una escritura, cesare en sus funciones antes de autorizarla definitivamente, el Notario que lo supla podrá, si procediere, realizar la autorización omitida; y si no hubiere tal suplente en funciones, la autorización será realizada por el Notario Público que designe el Ejecutivo del Estado, a propuesta del Consejo de\nNotarios.\nEl Notario suplente, el Notario designado, o el Director del Archivo de Notarías expedirá los testimonios de las escrituras otorgadas ante el Notario que cesare en sus funciones.\nARTICULO 40.- Si quienes deban suscribir una escritura no se presentan a firmarla dentro de los treinta días hábiles siguientes a la fecha de que se extendió en el protocolo, la misma quedará sin efecto y el\nNotario pondrá alcance de ella y firmará una razón de \" NO PASO \".\nARTICULO 41.- Si en una escritura se contienen varios actos jurídicos, el notario deberá autorizarla por lo que se refiere a aquéllos en que se hayan satisfecho los requisitos legales y pondrá nota marginal asentando cuáles actos no pasaron.\nARTICULO 42.- El notario no podrá autorizar acto alguno, sino haciéndolo constar en el protocolo y observando las formalidades prescritas en esta Ley.\nSe exceptúan de lo dispuesto en el párrafo anterior, los actos que, conforme a esta Ley, pueden hacerse constar en actas fuera de protocolo.\nARTICULO 43.- Tratándose de protocolización de documentos o constancias judiciales, el notario hará previamente una relación que los identifique de la manera más clara; en todo caso agregará tales documentos o constancias al apéndice marcados con los números que les correspondan. El requisito de protocolización de documentos, incluyendo la llamada Nota del Timbre y los recibos de Traslación de\nDominio, etcétera, será cumplido con el hecho de agregar el documento respectivo al apéndice, insertándolo posteriormente en el testimonio respectivo, mediante transcripción o incorporación de copia en los términos de la presente ley.\n(REFORMADO, P.O. 28 DE FEBRERO DE 1989)\nARTICULO 44.- Las transmisiones de bienes inmuebles, cuyo valor sea mayor de trescientas sesenta y cinco veces el salario mínimo general diario vigente en el Estado en el momento de la operación, y la\nConstitución, transmisión o cancelación de derechos reales sobre inmuebles por tal cantidad, deberán constar para su validez y escritura pública.\nARTICULO 45.- El Notario redactará las actas notariales asentándolas en el protocolo, sin necesidad de dar intervención a testigos instrumentales, excepción hecha de los testigos de identificación de los otorgantes, cuando sea necesario, o de los testigos que previene el Código Civil del Estado para el otorgamiento de testamentos. Las actas notariales serán firmadas por los otorgantes y por el notario y en su caso por los testigos.\nARTICULO 46.- La protocolización de los instrumentos públicos otorgados en el extranjero, la llevarán a\nFederal de Procedimientos Civiles.\nCAPITULO SEXTO\nDE LOS TESTIMONIOS\nARTICULO 47.- El testimonio es la copia fiel de una acta asentada en el protocolo y de los documentos que con respecto a la misma se agregan al apéndice, que debidamente autorizada expide el notario.\nEl testimonio podrá expedirse en forma parcial o en lo conducente, a juicio y bajo la responsabilidad del notario, siempre y cuando se trate de casos permitidos y la naturaleza del acto y de los documentos así lo permita, y sin que se desvirtúe en el menor sentido el contenido real de la escritura, o se pueda causar perjuicio a tercera persona al no transcribirse la totalidad de la escritura. leyes podrá expedírseles testimonio de la misma.\nLa expedición de testimonios a las partes otorgantes en ningún caso requerirá autorización judicial.\nLos terceros podrán obtener testimonio de alguna escritura, sólo mediante mandato de autoridad judicial competente.\nARTICULO 49.- Los testimonios podrán expedirse escritos en máquina, manuscritos con tinta, impresos, mediante copias fotostáticas, fotográficas, heliográficas o por cualquier otro medio de reproducción, a condición de que lo escrito sea indeleble y claro. Los notarios pueden integrar el testimonio mediante transcripción o incorporación de documentos, o sirviéndose simultáneamente de ambos sistemas, pero en todo caso las hojas de que consten, llevarán la rúbrica y sello originales del notario, y al final la firma completa de éste en la autorización respectiva.\nTodo testimonio deberá ser cotejado con su matriz por el propio notario, quien así lo hará constar en la autorización respectiva. Las testaduras y entrerrenglonaduras deberán ser salvadas de la misma manera que las practicadas en el Protocolo.\nARTICULO 50.- En la autorización de los testimonios se asentará una razón en donde consten como mínimo los siguientes datos:\na).- El número de orden que le corresponda al testimonio;\nb).- La persona física o moral a cuyo favor se expida y a que título;\nc).- El número de hojas de que se componga el testimonio;\nd).- La forma en que se obtuvo;\ne).- La razón de que fue cotejado y de que concuerda fielmente con su original;\nf).- La fecha y lugar de su expedición; y\ng).- El sello y la firma del notario.\nARTICULO 51.- Cuando en una escritura se consigne un acto del que resulte la existencia de varias partes interesadas, el notario podrá expedirles a cada una de ellas, simultáneamente, el primero o ulteriores testimonios que le soliciten, asentando en cada caso el nombre del solicitante y el número de orden con que se le expida el testimonio respectivo, mediante la siguiente razón: \"ES PRIMERO (O\nSEGUNDO O TERCER), TESTIMONIO, PRIMERO (O SEGUNDO O TERCERO) EN SU ORDEN,\nEXPEDIDO PARA USOS DE......\"\nCAPITULO SEPTIMO\nARTICULO 52.- Cada escritura llevará al margen su número progresivo, así como la mención por su nombre del acto que en ella se consigna y los nombres de los otorgantes.\nARTICULO 53.- Al margen de la escritura, el Notario deberá hacer constar la anotación que corresponda título.\nARTICULO 54.- El Notario que autorice una escritura que tenga relación con otra u otras existentes en su protocolo, hará en estas las anotaciones marginales correspondientes.\nARTICULO 55.- Las razones puestas por el Registro Público de la Propiedad y del Comercio Agrario, de\nMinería, etcétera, al calce de los testimonios, de ser posible serán extractadas o transcritas por el Notario en una anotación que pondrá al margen de la respectiva escritura.\nARTICULO 56.- Está prohibido a los Notarios consignar revocaciones, aclaraciones, rescisiones o modificaciones al contenido de una escritura notarial, por simple razón puesta al margen o al calce de élla. En tales casos debe otorgarse una nueva escritura y hacerse la anotación respectiva en la escritura referida, salvo disposición expresa de la Ley en sentido diverso.\nARTICULO 57.- En las escrituras que importen transmisión, creación, modificación o extinción de derechos reales, el Notario, deberá exigir la exhibición de los testimonios de las escrituras públicas o de los documentos privados que acreditan los derechos de los otorgantes y una vez autorizado el acto, anotará al calce de los documentos exhibidos una razón que contenga la descripción suscinta del acto otorgado, en relación con tales derechos. De la misma manera anotará los documentos que se exhiban en caso de substitución, delegación o revocación de poderes o de rescisión o modificación de arrendamientos y otros actos jurídicos de tracto sucesivo.\nARTICULO 58.- En caso de que los otorgantes no pudieren o no quisieren exhibir al Notario los documentos y certificados a que se refiere el artículo anterior, el acto será autorizado, asentando el\nNotario estas circunstancias y las advertencias que en el caso haya hecho o los otorgantes.\nARTICULO 59.- Todas las anotaciones marginales deberán llevar la firma o media firma o rúbrica del\nNotario, y serán numeradas.\nCAPITULO OCTAVO\nDE LAS ACTAS FUERA DEL PROTOCOLO\nARTICULO 60.- Acta Notarial es el instrumento original que el Notario levanta fuera de protocolo y autoriza con su firma y sello, para hacer constar un hecho que acontezca en su presencia.\nDe cada acta notarial, el Notario enviará copia a la Dirección de Notarías, dentro de los 10 días hábiles siguientes.\nARTICULO 61.- Los preceptos del capítulo anterior relativos a las escrituras, serán aplicables a las actas notariales en cuanto sean compatibles con la naturaleza del hecho que sea motivo del acta.\nARTICULO 62.- Entre los hechos que puede consignar el notario en actas fuera de protocolo, se encuentran, enunciativa y no limitativamente los siguientes:\na).- Notificaciones, interpelaciones, requerimientos, protesto de documentos mercantiles, tramitación de sucesiones testamentarias o intestamentarias, diligencias de jurisdicción voluntaria y otras diligencias en las que deba intervenir el Notario según las Leyes.\nb).- La comprobación de que determinadas personas estamparon su firma o huella digital en algún documento y de que ratifican el contenido y firma del mismo;\nc).- Hechos materiales, cotejo de documentos y certificaciones de escrituras, planos y fotografías, etcétera; y\nd).- Cualesquiera otros que la ley determine;\nARTICULO 63.- En las actas relativas a los hechos a que se refiere el inciso a) del artículo anterior, se observarán las reglas siguientes:\na).- En el acta se hará constar el nombre y demás generales de la persona a cuya solicitud se practica la diligencia respectiva; pero no será necesario asentar esos datos con respecto a la persona o a las personas con quienes se entienden las diligencias;\nb).- Si las personas con quienes se entienda la diligencia no quieren oír la lectura del acta, manifiestan su inconformidad con ella o se rehusan a firmar, así lo hará constar el notario, sin que sea necesaria la intervención de testigos.\nc).- El intérprete, de ser necesario, será elegido por el Notario, sin perjuicio de que él o los interesados puedan nombrar otro u otros por su parte;\nd).- El Notario autorizará el acta aun cuando no haya sido firmada por el interesado. En los casos de protesto no será necesario que el Notario conozca a las personas con quienes se entienda.\n(ADICIONADO, P.O. 31 DE DICIEMBRE DE 1996)\ne).- En los casos de sucesiones o diligencias de jurisdicción voluntaria, se integrará por el notario expediente con la documentación e información que aporten los solicitantes, las actas notariales que se levanten con motivo de tales diligencias y las demás determinaciones que se emitan durante su tramitación. Al concluir las diligencias, procederá el Notario a la Protocolización de las Constancias que en estos supuestos señala la Ley y, en su defecto, de las que sean concluyentes respecto a los hechos o derechos acreditados.\nARTICULO 64.- La fuerza pública prestará a los Notarios el auxilio que requieran para llevar a cabo las diligencias que aquéllos deban practicar conforme a la ley, cuando se les opusiera resistencia o se use o pueda usarse violencia en contra de los mismos. Bastará para ello que el notario verbalmente o por escrito solicite a los cuerpos de seguridad pública municipales o estatales dicha colaboración.\nARTICULO 65.- En los casos de ratificación de firmas o de huellas digitales, éstas figurarán no sólo en el acta, sino en las certificaciones que de ellas se expidan y en todos estos documentos el Notario hará constar que ante él se puso la firma o huella digital y que conoce a la persona a quien pertenece.\nARTICULO 66.- Tratándose de cotejo de una copia de partida parroquial, el acta se levantará en la especificará las diferencias que encuentre.\nARTICULO 67.- Cuando se trate de cotejo de un documento con su copia fotostática, fotográfica, o heliográfica u otras similares, se presentarán ambos al Notario, quien hará constar que la copia es fiel reproducción del documento original debiéndose consignar el lugar y la fecha de la certificación.\nTITULO SEGUNDO\nDE LA ORGANIZACION DEL NOTARIADO\nCAPITULO PRIMERO\nDISPOSICIONES PRELIMINARES\nARTICULO 68.- Los Notarios en el Estado de Coahuila, serán de número y sólo podrán tener una oficina que se denominará \"Notaría Pública No.........\" y estará abierta por lo menos ocho horas diarias, los días letrero, con el nombre y apellidos del Notario y el número de la Notaría. y se proveerá de otro a su costa, al que se le pondrá un signo especial que la diferencie del anterior.\nCuando aparezca el sello extraviado, el Notario no podrá hacer uso de él, debiendo entregarlo en un plazo no mayor de 15 días hábiles en la Dirección de Notarías, para su inutilización.\nTambién se inutilizarán por esa dependencia el sello del Notario que fallezca y aquellos sellos que por cualquiera circunstancia no reúnan los requisitos establecidos en esta Ley, debiendo el interesado proceder en los términos del párrafo anterior. De la entrega del sello para el efecto mencionado se levantarán un acta por duplicado, quedando el original, una vez recabadas las firmas, en la mencionada dependencia y su copia en poder del interesado.\nARTICULO 69.- Los Notarios sólo podrán ser suspendidos o cesados en los términos de la presente ley y previo el cumplimiento de todas y cada una de las formalidades que señala.\n(REFORMADO, P.O. 12 DE ENERO DE 1996)\nARTICULO 70.- El Ejecutivo del Estado, atendiendo entre otros indicadores, a las condiciones socioeconómicas de las poblaciones; al volumen de los actos que requieran la intervención notarial; a la permanencia, regularidad y continuidad de la misma función, fijará el número de Notarías y su residencia para cada Distrito, procurando que exista un Notario por cada veinte mil habitantes, en las poblaciones que excedan de esa cantidad. En aquellas cuya población sea menor, pero mayor de diez mil, procurará que cuenten con cuando menos un Notario, en atención a los mismos indicadores.\nPara evitar la concentración de Notarios en una sola ciudad dentro de un Distrito, el propio Ejecutivo adoptará las providencias que, a su juicio correspondan, a fin de que, las notarías sean distribuidas dispuesto en el presente artículo.\nCAPITULO SEGUNDO\nDE LAS NOTARIAS, DISTRITOS NOTARIALES Y ACTUACION DE JUECES POR RECEPTORIA\nARTICULO 71.- Los distritos notariales corresponderán a los Distritos Judiciales.\nARTICULO 72.- Cada Notaría será servida por un notario. Y estará obligado a aceptar por lo menos un aspirante a notario.\nARTICULO 73.- En los lugares donde resida un Juzgado de Primera Instancia y que no haya Notaría\nPública, así como en los casos de impedimento o falta del único Notario, los Jueces de Primera Instancia del Ramo Civil o los Mixtos ejercerán las funciones de Notario en casos urgentes, sin necesidad de autorización expresa del Ejecutivo del Estado.\nARTICULO 74.- Cuando no haya Notario ni Juez de Primera Instancia, los jueces locales actuarán por receptoría sólo en los siguientes casos:\nI.- En la ratificación de documentos privados;\nII.- En la certificación de hechos; y\nIII.- Cuando el caso fuere urgente, en el otorgamiento de escrituras públicas que contengan poderes o testamentos, haciéndose siempre constar los motivos de tal urgencia; asentando el acto en actuaciones judiciales, que remitirán para su protocolización a un Notario de número.\nARTICULO 75.- Tanto los Jueces de Primera Instancia como los Jueces Locales al actuar por receptoría, lo harán en actas destacadas con intervención del Secretario, sin necesidad de testigos, salvo los casos en que las leyes los exijan expresamente.\nCAPITULO TERCERO\nDE LOS ASPIRANTES AL EJERCICIO DEL NOTARIADO\nARTICULO 76.- Para obtener la patente de aspirante a Notario, el interesado deberá satisfacer los requisitos siguientes:\nI.- Ser ciudadano mexicano por nacimiento en pleno ejercicio de sus derechos;\nII.- Tener el título de abogado o licenciado en derecho, expedido por facultad o escuela reconocida oficialmente; y registrado en la Dirección General de Profesiones y en el Supremo Tribunal de Justicia del\nEstado;\nIII.- Tener cuando menos 3 años de experiencia en la práctica de la profesión de abogado, posteriores a lo señalado en la Fracción anterior;\nIV.- Haber desarrollado una práctica ininterrumpida en alguna Notaría cuando menos por un lapso de un año, salvo el caso de que el Notario dejare de ejercer sus funciones por los motivos previstos por esta\nLey; tiempo que se computará con la que se realice en otra Notaría;\nV.- No padecer enfermedad habitual o permanente que impida el uso de las facultades mentales o incapacidad física que se oponga al ejercicio del notariado.\nVI.- Acreditar haber tenido y tener buena conducta;\nVII.- No haber sido condenado por delito intencional;\nVIII.- No haber sido cesado del ejercicio de Notario en la República;\nIX.- No haber sido declarado en quiebra o concurso de acreedores, salvo que haya sido rehabilitado;\nX.- No ser Ministro de culto religioso;\nXI.- Aprobar el examen de aspirante a Notario; y\nXII.- Pagar en la Tesorería General del Estado los derechos que señala la Ley de Hacienda para presentar el examen y los correspondientes a la expedición de la patente, en su caso.\nEl Ejecutivo del Estado podrá, a solicitud del interesado, dispensar el cumplimiento de los requisitos a que se refieren las fracciones III, IV, y XI, cuando considere que el solicitante, esté suficientemente capacitado para el ejercicio de la función Notarial.\nARTICULO 77.- El requisito de que habla la fracción I del artículo anterior, se acreditará en la forma que previene el Código Civil; el requisito a que se refiere la fracción II del propio artículo mediante la presentación de la copia fotostática, certificada por Notario, del título correspondiente; los requisitos de que se ocupan las fracciones III y de la V a la X por una información de 7 testigos de reconocida reputación que residan en el lugar en donde el aspirante tenga su domicilio, información que se rendirá previa autorización del Supremo Tribunal de Justicia del Estado ante un Juez de Primera Instancia del\nRamo Civil o Mixto del Distrito Judicial en donde radique el interesado. La información se recibirá con previa citación del Síndico del Ayuntamiento en donde radique el aspirante, quien podrá rendir prueba en contrario, emitiendo en todo caso su juicio razonado en pedimento formal. El Juez declarará comprobados o no los hechos, siendo esta resolución apelable por el interesado, o por el Síndico, en cuyo caso, la apelación se substanciará en la forma que previene el Código de Procedimientos Civiles.\nConcluida la información con la declaración definitiva se mandará archivar el expediente, expidiéndose previamente al interesado, el testimonio de ella, que será el comprobante de los hechos; el requisito, señalado en la fracción IV mediante certificación que expida el Consejo de Notarios del Estado; el requisito previsto en la fracción XI se justificará con la copia certificada del acta del examen respectivo, y el pago de los derechos de que habla la fracción XII con el recibo correspondiente expedido por la\nTesorería General del Estado.\n(REFORMADO, P.O. 24 DE OCTUBRE DE 1980)\nARTICULO 78.- El que pretenda examen para obtener patente de aspirante a Notario, lo solicitará por escrito al Ejecutivo del Estado, anexando las constancias necesarias para dar cumplimiento al artículo 76, notificando su domicilio para los efectos a que haya lugar.\n(REFORMADO, P.O. 24 DE OCTUBRE DE 1980)\nARTICULO 79.- Una vez reciba la solicitud, el Ejecutivo del Estado dictaminará sobre su procedencia, notificando al interesado.\n(REFORMADO, P.O. 24 DE OCTUBRE DE 1980)\nARTICULO 80.- Declarada la procedencia de la solicitud el Ejecutivo del Estado, señalará local, día y hora para que en la Capital del Estado, se celebre el examen correspondiente, notificándolo al interesado\nARTICULO 81.- El jurado que lleve a cabo el examen se compondrá de 5 sinodales que serán: Un\nRepresentante del Ejecutivo, que deberá ser Licenciado en Derecho y de preferencia Notario, el cual fungirá como Presidente del jurado; el Presidente del Supremo Tribunal del Justicia; el Presidente del\nConsejo de Notarios; el Director del Archivo de Notarías y un representante de Colegio de Notarios. El\nSecretario del jurado será designado de entre los cuatro sinodales restantes por mayoría de votos. Los sinodales no podrán abstenerse de votar.\nARTICULO 82.- No podrán formar parte del jurado los Notarios con quienes haya hecho práctica el sustentante; ni aquéllos que sean parientes del sustentante consanguíneos o afines, sin limitación de grado en la línea recta ascendente o descendente y dentro del cuarto grado inclusive en la línea colateral.\nLos miembros del jurado en los que concurriere algunos de los impedimentos señalados, deberá excusarse de intervenir en el examen con 5 días como mínimo antes de la fecha designada para el examen, quedando a cargo del Ejecutivo la designación del sustituto, y en su caso de que intervenga, el examen será nulo.\nARTICULO 83.- El examen constará de una prueba práctica consistente en la redacción de un instrumento, cuyo tema se sorteará de entre 15 propuestos por los miembros del jurado, sellados y colocados en sobres cerrados. cada uno de los miembros del jurado hará al sustentante las preguntas que considere pertinentes, siempre y cuando sean relacionadas con el caso jurídico notarial a que se refiere el tema, calificándose al sustentante por mayoría de votos.\nARTICULO 84.- Si el sustentante fuere reprobado no se le podrá conceder un nuevo examen, sino hasta después de transcurrido un año de la celebración del anterior, siempre y cuando cubra el derecho a que se refiere la fracción XII del artículo 76.\nARTICULO 85.- El secretario del jurado levantará el acta relativa al examen por cuadruplicado, las cuales una vez firmadas por todos los sinodales se enviará el original al Ejecutivo del Estado para ser agregado al expediente del aspirante y cada una de las copias para el archivo de Notarías, Consejo de Notarios y al sustentante.\nARTICULO 86.- Cumplidos los requisitos exigidos en los artículos anteriores, y si el examinado resultare aprobado, el Ejecutivo del Estado extenderá en favor del interesado la patente de aspirante de Notario, previo pago que se haga del derecho a que se refiere la fracción XII del artículo 76.\nARTICULO 87.- Expedida la patente se mandará publicar por una sola vez en el Periódico Oficial del\nGobierno del Estado a costa del interesado.\nARTICULO 88.- Si después de extendida la patente de aspirante a Notario resultare que por causa superveniente el favorecido con ella estuviere sujeto a una incapacidad física o mental para el desempeño de las funciones notariales, quedará privado del derecho que le dió la patente.\nARTICULO 89.- No podrán considerarse como aspirante a Notario los Jueces que por ministerio de Ley ejerzan como tales por receptoría durante el tiempo de su encargo.\nCAPITULO CUARTO\nDEL NOMBRAMIENTO DE LOS NOTARIOS\nARTICULO 90.- Para obtener el Fiat de Notario, se requiere:\nI.- Tener la patente de aspirante a Notario;\nII.- Continuar reuniendo, los requisitos que la presente Ley establece, para la obtención de la patente de aspirante a Notario;\nIII.- Existir alguna Notaría acéfala o de nueva creación en los términos de esta Ley;\nIV.- Aprobar el examen de selección; y\nV.- Cubrir los derechos que establezca la Ley de Hacienda del Estado para presentar examen de selección y los correspondientes a la expedición del Fiat, en su caso.\nEl Ejecutivo del Estado, podrá a solicitud del interesado, eximir del cumplimiento del requisito a que se refiere la fracción IV de este artículo, cuando considere que el solicitante esté suficientemente capacitado para el ejercicio de la función Notarial.\nARTICULO 91.- Los requisitos a que se refiere el Artículo anterior se comprobarán en la siguiente forma:\nEl mencionado en la fracción I, mediante la presentación de la patente respectiva; el de la fracción II, mediante certificación del Consejo de Notarios del Estado, el que para tal efecto, se allegará previamente los medios de prueba que estime pertinentes; el de la fracción III, mediante certificación del Ejecutivo del\nEstado, que la podrá otorgar al remitir el expediente al Congreso del Estado en los Términos del artículo\n100 de este Ordenamiento; el de la fracción IV, se comprobará con el acta del examen correspondiente y el expresado en la fracción V a través del comprobante del pago respectivo expedido por la Tesorería\nGeneral del Estado.\nLas certificaciones a que se refiere este artículo, deberán expedirse dentro de los siguientes 15 días hábiles, al de su solicitud.\n(REFORMADO, P.O. 24 DE OCTUBRE DE 1980)\nARTICULO 92.- Cuando de conformidad con lo dispuesto por el artículo 70, el Ejecutivo del Estado, acuerde la creación de una nueva Notaría, o cuando esté acéfala en alguna ya existente por cualquier causa que sea, el propio Ejecutivo revisará la relación de los aspirantes a Notario, a quienes se le haya otorgado la patente, a efecto de seleccionar al que o a los que deberán presentarse a sustentar el examen.\nUnicamente en el caso de que el aspirante se le dispense del requisito a que se refiere la fracción IV del artículo 90 de esta Ley y una vez cubiertos los demás requisitos a que se refiere dicho precepto, el\nEjecutivo del Estado procederá en los términos del artículo 100 de este ordenamiento, notificando al interesado y al Consejo de Notarios para su conocimiento.\nEn los demás casos se observará lo dispuesto en los artículos siguientes.\n(REFORMADO, P.O. 12 DE ENERO DE 1996)\nARTICULO 93.- A efecto de cubrir las vacantes a que se refiere el artículo anterior, el Ejecutivo del\nEstado señalará día y hora para la celebración del examen de selección, informando de ello al Consejo de Notarios del Estado y a los aspirantes cuando menos con 15 días hábiles de anticipación a la fecha del examen, por medio de oficio enviado al domicilio que al efecto hubieren designado en su solicitud, mediante pieza postal certificada y con acuse de recibo.\nARTICULO 94.- El jurado del examen de selección se integrará y le será aplicable lo previsto en los artículos 81 y 82 de la presente Ley, respectivamente.\nARTICULO 95.- El examen de selección consistirá en dos ejercicios: Uno práctico y otro teórico. Para el primero el jurado deberá tener en sobres cerrados y numerados 10 temas para redacción de instrumentos. Para el ejercicio teórico los miembros del jurado replicarán a cada sustentante sobre puntos de derecho que se relacionen únicamente con los temas materia del examen.\nARTICULO 96.- El día y hora señalados para el ejercicio práctico, se reunirán él o los candidatos si fuesen varios, y en su presencia y del jurado, el Secretario del mismo extraerá de una ánfora una ficha y abrirá el sobre que contenga el tema marcado con el número de la ficha. El o los candidatos se enterarán del tema y procederán desde luego a la redacción del instrumento correspondiente, cada uno por su parte y sin auxilio de ninguna persona, bajo la vigilancia de los miembros del jurado, excepción hecha de la mecanógrafa que designe el propio jurado, aunque provisto de las leyes necesarias. Para el efecto, dispondrá hasta de seis horas corridas; concluidas las cuales el jurado recogerá él o los trabajos hechos, guardándolos en sobres que serán firmados por los sinodales y por cada interesado.\nARTICULO 97.- El examen teórico se hará a cada uno de los candidatos por el orden de presentación de sus solicitudes, en el caso de que fueren varios. El que por cualquier motivo no acuda, perderá su turno y será el último. Si no se presenta en el día y hora del examen, se entenderá que ha desistido, pero si el candidato justifica los motivos de su falta a juicio del jurado, podrá concedérsele un breve plazo improrrogable.\nConcluido el examen teórico, cada sinodal calificará al sustentante con notas del uno al diez, mismas que de inmediato se darán a conocer.\nARTICULO 98.- Después del examen teórico, el jurado a puerta cerrada oirá la lectura de los trabajos prácticos presentados y cada uno de sus miembros calificará al sustentante con notas del uno al diez. Si la mayoría de los jurados vota la reprobación del sustentante, no se podrá conceder un nuevo examen a éste, sino después de transcurrido un año desde la celebración del examen.\nARTICULO 99.- Se declarará seleccionado al candidato que obtenga las más altas notas en los exámenes teórico y práctico, en el supuesto de dos o más candidatos; en caso de empate, lo será el primero que haya obtenido su patente de aspirante a Notario.\nObservándose, además, lo dispuesto en el artículo 85 de esta Ley.\n(REFORMADO, P.O. 24 DE OCTUBRE DE 1980)\nARTICULO 100.- Cumplidos los requisitos a que se refiere el Artículo 90 de esta Ley, el Ejecutivo del\nEstado, emitiendo opinión, remitirá el expediente al Congreso del Estado, quien expedirá el Decreto correspondiente otorgando el Fiat para ejercer el Notariado, el cual se sancionará por el Ejecutivo y ordenará su publicación en el Periódico Oficial del Gobierno del Estado.\nCAPITULO QUINTO\nDE LA ASIGNACION DE DISTRITO Y NUMERO\nARTICULO 101.- La asignación de Distrito Notarial y número corresponde al Ejecutivo del Estado, una vez que el Congreso del Estado, haya expedido el Fiat para ejercer el Notariado, de conformidad con lo señalado en el Capítulo anterior.\nARTICULO 102.- La asignación a que se refiere el Artículo anterior, será definitiva, salvo lo dispuesto en el artículo siguiente, y se publicará el Acuerdo por una sola vez en el Periódico Oficial del Gobierno del\nEstado.\nARTICULO 103.- En caso de que un Notario desee cambiar de Distrito, lo comunicará a la Secretaría del\nEjecutivo del Estado, para que en su oportunidad, ésta resuelva lo conducente.\nARTICULO 104.- Cuando dos o más Notarios de número tengan igual fecha de presentación de solicitud de cambio de Distrito, será preferida la del Notario con mayor antigüedad según su asignación.\nARTICULO 105.- En el caso de rechazo de la Notaría acéfala o de nueva creación por parte del Notario que hubiese solicitado cambio de Distrito, éste no podrá volver a formular solicitud de cambio sino hasta que transcurra un año contado a partir de la fecha que hubiere rechazado.\nARTICULO 106.- Cuando se acuerde una solicitud de cambio de Distrito favorablemente, se publicará\nCAPITULO SEXTO\nDEL INICIO DE LA FUNCION NOTARIAL\nARTICULO 107.- Para que el Notario pueda ejercer su función no basta que obtenga el acuerdo de que habla el artículo 102 de esta Ley, sino que además deberá satisfacer los siguientes requisitos:\nI.- Proveerse a su costa del sello de autoridad y hacerlo registrar con su firma en el Supremo Tribunal de\nJusticia del Estado, en la Secretaría del Ejecutivo del Estado, en la Dirección General del Registro\nPúblico de la Propiedad, en la Oficina de dicho Registro en el Distrito en donde el Notario vaya a ejercer, en el Archivo de Notarías, en el Consejo de Notarios y en la Delegación de éste que corresponda a su\nDistrito. El sello de cada Notario debe ser de forma circular y tener, precisamente, un diámetro de cuatro centímetros, representar el Escudo de Armas del Estado en el centro y tener inscrito en rededor el nombre y apellidos del Notario, el nombre del Distrito, el número de la Notaría y las palabras \"Estado de\nCoahuila de Zaragoza\".\nII.- Constituir depósito por la cantidad de $25,000.00, en la Tesorería General del Estado;\nIII.- Otorgar la protesta de ley ante el Ejecutivo del Estado dentro de los 30 días siguientes a la fecha de la expedición del acuerdo a que se refiere el artículo 102 de esta Ley;\nIV.- Establecer su Notaría e iniciar sus funciones, dentro de los 30 días siguientes a la fecha en que haya otorgado la protesta, informando de ello inmediatamente a las Autoridades y Dependencias mencionadas en la Fracción I y avisando al público mediante publicación a su costa en el Periódico Oficial del Gobierno del Estado.\n(REFORMADA SU DENOMINACION, P.O. 31 DE DICIEMBRE DE 1996)\nCAPITULO SEPTIMO\nDE LAS LICENCIAS, SUSPENSIONES TEMPORALES, SUPLENCIAS Y ASOCIACION DE NOTARIOS\n(REFORMADO, P.O. 24 DE OCTUBRE DE 1980)\nARTICULO 108.- Los Notarios tienen derecho a solicitar del Ejecutivo del Estado, licencia para separarse de su función hasta por el término de un año.\nCuando hubieren hecho uso de una licencia mayor de 3 meses en un año, no podrán solicitar otra, sino hasta después de haber transcurrido un año en el ejercicio del personal de su función, salvo caso de enfermedad, fuerza mayor o por otra causa debidamente justificada, a juicio del Ejecutivo.\nEl Notario tiene derecho a que el Ejecutivo del Estado le otorgue licencia por todo el tiempo que dure en el desempeño de un cargo o empleo que sea incompatible con la función notarial, en los términos del artículo 6o. de esta Ley, quedando obligado, una vez otorgada la licencia a entregar personalmente en un plazo no mayor de 10 días hábiles siguientes, su protocolo y sello de autorizar a la Dirección de Notarías.\nARTICULO 109.- Los Notarios, sin necesidad de obtener licencia, podrán separarse del ejercicio de sus alternados en cada trimestre o hasta por un mes en cada semestre, siempre y cuando haya más de un\nNotario en ejercicio en el Distrito y den previo aviso por escrito a la Dirección de Notarías.\nARTICULO 110.- Las licencias se darán a conocer al Archivo de Notarías, al Consejo de Notarios, al solicitante.\nARTICULO 111.- El Notario de número tiene derecho de proponer al Ejecutivo del Estado el nombramiento de su suplente en el caso de licencia, suplente que siempre será otro Notario en funciones en el mismo Distrito. El Ejecutivo del Estado al acordar la concesión de la licencia solicitada, determinará que se haga cargo de la Notaría el Notario sustituto propuesto. Se exceptúa la hipótesis prevista en el párrafo tercero del artículo 108 de esta Ley, en cuyo caso no habrá sustituto.\nARTICULO 112.- El Notario no podrá interrumpir el uso de la licencia concedida reintegrándose al ejercicio del cargo y proseguir después el disfrute de aquélla por el tiempo que restare, con tal que la interrupción no exceda de la mitad del plazo concedido. La interrupción deberá comunicarse a las\nAutoridades mencionadas en el artículo 110 de esta Ley y publicarse en los términos de la misma disposición legal.\n(REFORMADO PRIMER PARRAFO, P.O. 24 DE OCTUBRE DE 1980)\nARTICULO 113.- Son causas de suspensión temporal de un Notario en el ejercicio de sus funciones, las originadas por:\n(REFORMADA, P.O. 24 DE OCTUBRE DE 1980)\nI.- Sanción Administrativa impuesta por el Ejecutivo del Estado, por faltas comprobadas del Notario en el ejercicio de sus funciones, en los casos previstos por esta Ley;\nII.- Impedimentos físicos o intelectuales transitorios comprobados, que coloquen al Notario en la imposibilidad de actuar, en cuyo caso surtirá efecto la suspensión por todo el tiempo que dure el impedimento, siempre que no exceda de dos años; y\nIII.- Por determinación judicial.\n(REFORMADO, P.O. 24 DE OCTUBRE DE 1980)\nEn todos estos supuestos y en su caso, comprobados los hechos correspondientes, el Ejecutivo del\nEstado dictará acuerdo suspendiendo temporalmente al Notario y designando al sustituto, que siempre lo será otro Notario en funciones en el mismo Distrito.\n(REFORMADO, P.O. 24 DE OCTUBRE DE 1980)\nLa resolución determinando la suspensión temporal y el nombramiento del sustituto, se comunicará a las autoridades a que se refiere el artículo 110 y se publicará por una sola vez en el Periódico Oficial del\nGobierno del Estado.\nARTICULO 114.- El Notario suplente, cuando actúe tendrá las mismas facultades, derechos, responsabilidades de su actuación y obligaciones que el titular; actuará en el protocolo de éste y en consecuencia, los instrumentos que autoricen tendrán el mismo valor que los autorizados por el titular.\nARTICULO 115.- En los casos de sustitución temporal no se trasladarán los protocolos a la Notaría del sustituto y los actos e instrumentos que autorice se harán en el domicilio de la Notaría del sustituto.\nARTICULO 116.- Cuando el sustituto deba encargarse de una notaría por licencia o por suspensión temporal, el sustituido pondrá a continuación de la última escritura del protocolo, una nota o constancia fechada y firmada el día en que se ausente haciendo mención de la causa de la sustitución. El sustituto igualmente pondrá una nota o constancia a continuación de la del sustituido. A su regreso el pondrá nota a continuación del último instrumento de haber vuelto a encargarse de su notaría.\nARTICULO 117.- El Notario sustituto tendrá derecho en todo caso a percibir íntegramente los honorarios que devengue en los instrumentos, actos y documentos que autorice por el sustituido. En los casos de sustitución por enfermedad y otras similares, podrá convenirse que una parte de los honorarios los perciba el sustituido, cuyo convenio lo pondrá en conocimiento del Consejo de Notarios del Estado.\nARTICULO 118.- No se considerarán como ausencias las salidas que por razones de su cargo tenga que hacer el Notario.\nARTICULO 118-BIS.- Los titulares de las Notarías Públicas correspondientes al mismo Distrito notarial y al mismo domicilio dentro del municipio en que actúan, podrán asociarse por el tiempo que estimen conveniente.\nLos notarios Asociados, que pueden ser hasta dos, podrán actuar indistintamente en un mismo Protocolo, que será de preferencia el del notario más antiguo y en caso de disolución del Convenio de Asociación, cada notario seguirá actuando en su propio Protocolo.\nCada uno de los notarios Asociados tendrá la misma capacidad para actuar y usará su propio sello.\nDurante la vigencia del Convenio de Asociación, los Notarios Asociados se suplirán recíprocamente en sus faltas temporales. El Notario Asociado que continúe en funciones, podrá autorizar definitivamente los instrumentos autorizados preventivamente por el Notario suplido, así como expedir los testimonios correspondientes y cumplir los trámites subsecuentes que legalmente debiera realizar éste último.\nLa falta definitiva de cualquiera de los Notarios Asociados, será causa de terminación del Convenio de\nAsociación y el Notario que quede en funciones, podrá continuar usando el mismo Protocolo en que se haya actuado. Si este Protocolo fuera el del Notario faltante, deberá gestionarse, por el Notario que quede al cargo ante el Ejecutivo del Estado, el cambio de número de su Notaría y proveerse del nuevo sello con el número de la Notaría correspondiente al Notario faltante. Mientras los obtiene, seguirá actuando con su sello y su número anteriores. La Notaría correspondiente al Notario que sustituya al que falte, quedará vacante.\nLos Convenios de Asociación y la disolución de los mismos, por cualquier causa, deberán registrarse en la Dirección de Notarías del Estado y en la Oficina del Registro Público de la Propiedad y de Comercio del Distrito que corresponda al de las Notarías que se pretenden asociar. Tanto los Convenios de\nAsociación como de disolución serán publicados en el Periódico Oficial del Gobierno del Estado.\nCAPITULO OCTAVO\nDE LA DETERMINACION DEL CARGO DE NOTARIO\nARTICULO 119.- El cargo de Notario termina por cualesquiera de las siguientes causas:\nI.- Muerte;\nII.- Renuncia expresa;\nIII.- Abandono del cargo, en los términos previstos por la presente Ley;\nIV.- Hechos supervenientes de los que impiden su ingreso a la función o que los impedimentos indicados en la fracción II del artículo 113, duren más de dos años;\nV.- Separación definitiva del cargo como sanción impuesta por el Ejecutivo del Estado en los términos de la fracción IV del artículo 158; y\nVI.- Sanción impuesta por los tribunales competentes por sentencia firme e irrevocable.\nARTICULO 120.- Se considerará abandonado el cargo y en consecuencia quedará sin efecto el nombramiento de Notario, si dentro del término de 30 días siguientes al de la protesta rendida ante la deba desempeñarlas, salvo caso de fuerza mayor que se lo impida a juicio del Ejecutivo del Estado. En este caso de excepción, el término empezará a contar cuando la causa haya cesado.\nSe considerará abandonado el cargo si a pesar de la incompatibilidad establecida en el artículo 6o., el\nNotario continúa desempeñando simultáneamente la función notarial.\nIgualmente se considerará abandonado el cargo, si transcurrido el plazo de la licencia que se le hubiere concedido, el Notario no se presenta a reanudar sus labores, sin causa debidamente justificada a juicio del Ejecutivo del Estado.\nEn estos casos se declarará vacante la plaza y se procederá a cubrirla en los términos de esta Ley.\nARTICULO 121.- El Notario puede renunciar a su cargo ante el Ejecutivo del Estado, pero como abogado, quedará impedido por intervenir, con carácter de mandatario judicial, en los litigios que se relacionen con las escrituras que hubiere autorizado.\n(REFORMADO, P.O. 24 DE OCTUBRE DE 1980)\nARTICULO 122.- Los Oficiales del Registro Civil, ante quienes se registre el fallecimiento de un Notario, lo comunicarán dentro de los 5 días hábiles siguientes y remitirán copia certificada del acta respectiva a la\nDirección de Notarías.\nARTICULO 123.- Siempre que se promueva judicialmente la interdicción de algún Notario, el Juez respectivo comunicará tal hecho por escrito al Secretario del Ejecutivo del Estado.\nARTICULO 124.- Tan luego como el Ejecutivo del Estado tenga conocimiento de que un Notario adolece de impedimentos físicos o intelectuales de conformidad con esta Ley para el ejercicio del Notariado, requerirá al Consejo de Notarios, para que proponga 5 médicos de los cuales se designarán 2 para que determinen acerca de la naturaleza del padecimiento y si éste lo imposibilita para actuar y la duración del mismo.\nARTICULO 125.- Comprobados los hechos que originen la terminación del nombramiento de Notario, el\nEjecutivo del Estado dictará acuerdo en tal sentido, lo cual se publicará por una sola vez en el Periódico\nOficial y se comunicará a las autoridades a que se refiere el artículo 110 de esta Ley.\nARTICULO 126.- Dictado el acuerdo de terminación del cargo de Notario, el Ejecutivo del Estado a través de la Secretaría del Ejecutivo del Estado, con un representante del Consejo de Notarios, procederá a levantar la diligencia correspondiente para la clausura del protocolo, en los términos del artículo 128; remitiéndose el mismo al Archivo de Notarías, para que sea entregado al Notario que lo suceda en sus funciones.\nARTICULO 127.- El Notario que suceda en sus funciones a aquél cuya terminación del nombramiento se acordó, autorizará los actos o contratos que en su caso proceda y expedirá los testimonios respectivos. Si testimonios lo hará el notario que designe el Ejecutivo del Estado.\nUna vez concluidos los trámites, el protocolo se remitirá a la Dirección de Notarías.\nCAPITULO NOVENO\nCLAUSURA DE PROTOCOLOS\nARTICULO 128.- Cuando por cualquier circunstancia haya lugar a clausurar un protocolo, esta diligencia de Notarios. Los interventores al cerrar los libros de protocolo procederán a poner razón de la causa que motive el acto en el protocolo del año y agregarán todas las circunstancias que estimen convenientes, suscribiendo dicha razón con sus firmas.\nARTICULO 129.- Los interventores que fueren designados para actuar en la clausura de un protocolo, llevarse y los valores depositados y los testamentos cerrados que estuvieren en guarda, con expresión del estado de sus cubiertas y sello. El protocolo clausurado se enviará al Archivo de Notarías.\nARTICULO 130.- El Notario que por cualquier causa reciba una Notaría ya establecida, deberá hacerlo por riguroso inventario de los libros y documentos a que se refiere el artículo anterior sin que esté facultado para tomar posesión de los demás bienes que se encuentren en la oficina del Notario a quien substituye. La diligencia de recepción se llevará a cabo con asistencia de los interventores a que se refiere el artículo 128. De la misma se levantará acta por cuadruplicado, cuyos ejemplares se distribuirán entre el Ejecutivo del Estado, el Consejo de Notarios, el Notario que reciba la Notaría y el Notario substituto.\nARTICULO 131.- El Notario substituido tiene derecho a asistir a las diligencias de clausura de protocolo y de entrega de éste al Notario substituto. Si la vacante es por causa de delito, asistirá también a dichas diligencias el Agente del Ministerio Público que designe el Procurador General de Justicia del Estado.\nTITULO TERCERO\nCAPITULO UNICO\nDEL COLEGIO Y DEL CONSEJO DE NOTARIOS\nARTICULO 132.- En el Estado de Coahuila habrá un Colegio de Notarios, con sede en la Capital del\nEstado, que tendrá personalidad jurídica propia y al que pertenecerán todos los Notarios en funciones, salvo los Jueces de Primera Instancia o Locales que actúen por receptoría. El Colegio tendrá las atribuciones que se derivan de la presente Ley y las que señalen sus estatutos y reglamentos que el propio Colegio elaborará y someterá a la aprobación del Ejecutivo.\nARTICULO 133.- El Colegio de Notarios del Estado estará dirigido por un Consejo de Notarios compuesto de: un Presidente, un Vicepresidente, un Secretario, un Tesorero y seis Vocales.\nLos Notarios residentes y en funciones en el Distrito de Saltillo, elegirán a 5 representantes, que a su vez ocupar los cargos a que se refiere el párrafo anterior.\nARTICULO 134.- En las cabeceras de todos los distritos notariales se establecerá una Delegación del\nColegio de Notarios. La Delegación tendrá un Consejo Directivo compuesto de un Presidente, un\nVicepresidente, un Secretario, un Tesorero y un Vocal, que serán electos por los notarios residentes y en funciones en el Distrito.\nEl Consejo de Notarios, será a su vez el Consejo Directivo de la Delegación del Distrito de Saltillo.\nARTICULO 135.- La elección de los Consejos de las Delegaciones se hará durante la primera quincena y previa convocatoria que se haga para tal efecto por el Consejo de la Delegación en funciones.\nARTICULO 136.- Durante la última semana del mes de enero de cada año, el Secretario del Ejecutivo del\nEstado, tomará la protesta a los miembros del Consejo del Colegio de Notarios del Estado. La Secretaría del Ejecutivo del Estado señalará oportunamente día, hora y lugar de la reunión.\nARTICULO 137.- Si por cualquier motivo no se efectuare la elección del Consejo de Notarios del Estado o del Consejo de las Delegaciones, continuarán en funciones las mismas personas. Si una Delegación no está funcionando o no se integrare, el Consejo de Notarios del Estado designará las personas que integrarán el Consejo de la Delegación o éste lo suplirá.\nARTICULO 138.- El Consejo de Notarios del Colegio de Notarios del Estado tendrá las siguientes atribuciones.\nI.- Vigilar el cumplimiento de esta Ley;\nII.- Auxiliar al Ejecutivo del Estado en Materia de Notariado;\nIII.- Proponer al Ejecutivo del Estado las expediciones y reformas de los reglamentos o leyes que conduzcan al progreso de la institución;\nIV.- Desempeñar funciones consultivas que le encomiende el Ejecutivo del Estado;\nV.- Expedir sus propios estatutos y reglamentos, sin contrariar la presente Ley; y\nVI.- Las demás que le confieran las leyes, los estatutos y reglamentos.\nARTICULO 139.- Los Consejos Directivos de las Delegaciones, tendrán las atribuciones siguientes:\nI.- Vigilar el cumplimiento de esta Ley;\nII.- Auxiliar al Consejo de Notarios en la dirección del notariado.\nIII.- Proponer al Consejo de Notarios para que éste a su vez le proponga al Ejecutivo del Estado las expediciones y reformas de reglamentos o leyes que conduzcan al progreso de la institución;\nIV.- Desempeñar las funciones consultivas que les encomienden el Ejecutivo del Estado y el Consejo del\nColegio de Notarios del Estado.\nV.- Las demás que les confiere esta Ley y los estatutos y reglamentos respectivos.\nARTICULO 140.- Tanto el Colegio como el Consejo de Notarios del Estado y sus delegaciones serán ajenos a toda actividad política o electoral, quedándoles prohibido tratar asuntos de esta naturaleza en sus asambleas.\nARTICULO 141.- Los cargos del Consejo de Notarios son gratuitos e irrenunciables y quedan obligados a asistir a sus propias sesiones.\nARTICULO 142.- Los consejeros sólo podrán estar separados de su cargo, durante el tiempo en que legalmente lo estén del desempeño de sus funciones notariales. La cesación en el ejercicio del notariado importa la del cargo del consejero.\nTITULO CUARTO\nCAPITULO UNICO\nDE LAS VISITAS\nARTICULO 143.- Cada año, si la Secretaría del Ejecutivo estima conveniente, se practicará una visita ordinaria a todas las Notarías del Estado. Esta visita ordinaria se referirá al año anterior.\nAdemás de las visitas ordinarias, la Secretaría del Ejecutivo del Estado, podrá mandar que se practiquen\nARTICULO 144.- Cuando la visita no tenga por objeto la investigación de un delito, cuya averiguación se esté practicando por las autoridades competentes, se dará aviso al Notario con ocho días de anticipación.\nARTICULO 145.- En las visitas se observarán las siguientes reglas:\n(REFORMADA P.O. 24 DE OCTUBRE DE 1980)\nI.- Si la visita fuere general, el visitador revisara todo el protocolo o diversas partes de él, según lo estime necesario, para cerciorarse de la observancia de todos los requisitos de forma. Además se hará presentar los testamentos cerrados que se conserven en guarda;\n(REFORMADA, P.O. 24 DE OCTUBRE DE 1980)\nII.- Si se ordena la visita de un tomo determinado, el visitador se limitará a verificar el cumplimiento de los requisitos de forma...... y la redacción de las escrituras en el tomo señalado;\nIII.- Si la visita tiene por objeto un instrumento determinado, se examinarán los requisitos de forma, su redacción y las cláusulas y declaraciones;\nIV.- En todo caso el visitador cuidará de cerciorarse que, después de tres meses de cerrados los protocolos hayan sido encuadernados con sus correspondientes apéndices.\nARTICULO 146.- De toda visita se levantará una acta donde se harán constar las irregularidades observadas; se consignarán en general los puntos en que la Ley no haya sido fielmente cumplida y los hechos y fundamentos que el Notario exponga en su defensa. El Notario tendrá derecho a duplicado del acta firmada por el visitador y por el mismo.\nARTICULO 147.- Las visitas se practicarán por acuerdo orden del Ejecutivo del Estado y se llevarán a cabo por la Dirección de Notarías.\nTITULO QUINTO\nCAPITULO UNICO\nDE LA DIRECCION DE NOTARIAS\nARTICULO 148.- La Dirección de Notarías tendrá a su cargo la atención y el despacho de todos los asuntos relacionados con el Notariado, así como la organización, conservación y guarda del Archivo de\nNotarías.\nARTICULO 149.- El Archivo de Notarías se formará:\nI.- Con los documentos que los Notarios del Estado deben remitir, según las prevenciones establecidas en esta Ley;\nII.- Con los protocolos que no sean de aquellos que los Notarios puedan conservar en su poder;\nIII.- Con los demás documentos propios del Archivo correspondiente; y\nIV.- Con los sellos de los Notarios que deben depositarse o inutilizarse conforme a las prescripciones de esta Ley.\n(REFORMADO, P.O. 24 DE OCTUBRE DE 1980)\nARTICULO 150.- La Dirección de Notarías dependerá de la Secretaría General de Gobierno y estará a cargo de un Director nombrado y removido libremente por el Ejecutivo del Estado, y del personal que determine el presupuesto de egresos del Estado.\n(REFORMADO, P.O. 24 DE OCTUBRE DE 1980)\nARTICULO 151.- La Dirección de Notarías usará un sello igual al de los Notarios, pero en su circunferencia dirá: \"Dirección de Notarías, Estado de Coahuila de Zaragoza\".\n(REFORMADO, P.O. 24 DE OCTUBRE DE 1980)\nARTICULO 152.- Son obligaciones y atribuciones del la Dirección de Notarías:\nI.- Comunicar al Secretario del Ejecutivo del Estado las irregularidades y violaciones de la Ley, que advierta en el ejercicio de la función notarial;\nII.- Vigilar el funcionamiento general de las Notarías a través de los visitadores a su mando;\nIII.- Inutilizar los sellos de los Notarios, cuando proceda conforme a la Ley y conservar aquellos que deban depositarse;\nIV.- Levar el registro de expedición de patentes de aspirantes y de Notarios; de ellos y firmas de estos últimos y de las suplencias. En estos registros se asentarán la fecha de los nombramientos, aquellos en que se haya dejado de actuar por virtud de licencia, permiso o suspensión del Notario y su reanudación;\n(REFORMADA, P.O. 12 DE DICIEMBRE DE 2006)\nV.- Llevar un registro de los testamentos que autoricen los Notarios e ingresar por vía electrónica los avisos de testamento que con tal motivo reciba a la base de datos del Registro Nacional de Avisos de\nTestamento, y rendir los informes que le soliciten las autoridades judiciales competentes o notarios públicos en cumplimiento a los dispuesto por la presente ley.\nVI.- Rendir los informes y la cooperación técnica que le sea requerida por otras dependencias del\nVII.- Expedir, cuando proceda legalmente, previo pago de los derechos en la Tesorería General del escrituras o actos notariales registrados en los protocolos, cuyo depósito y conservación le encomienda la presente Ley; sujetándose en la expedición de dichos testimonios a las reglas establecidas en este ordenamiento;\nVIII.- Llevar los índices generales, según las reglas que acuerde el Ejecutivo;\nIX.- Autorizar definitivamente los instrumentos notariales en los términos del artículo 34 cuando el Notario ha cesado en sus funciones, en los casos previstos por esta Ley;\nX.- Llevar el control de las partes de las actas que se levanten con motivo de las visitas que practique por si a través de los visitadores de la dependencia a su cargo;\nXI.- Las demás que sean propias y naturales del cargo o fije esta Ley u otros ordenamientos jurídicos.\nARTICULO 153.- La Dirección de Notarías, será responsable de la custodia, conservación y guarda de los protocolos, sellos, libros, papeles y demás documentos que se hallen en el Archivo de Notarías; el titular tendrá la misma responsabilidad que los Notarios en ejercicio, respecto de los testimonios que expida; y las faltas o irregularidades que cometa en el ejercicio de su cargo, serán sancionadas por el\nEjecutivo del Estado, con las penas determinadas en esta Ley.\n(REFORMADO, P.O. 24 DE OCTUBRE DE 1980)\nARTICULO 154.- Para el eficaz desempeño de su función, la Dirección de Notarías, contará con los visitadores que determine el Ejecutivo del Estado, quienes deberán tener título de Licenciado en Derecho y conocimientos sobre la función notarial.\nLos visitadores ejercerán las funciones que les sean encomendadas por el titular de la dependencia.\nTITULO SEXTO\nCAPITULO UNICO\nDE LAS RESPONSABILIDADES Y SANCIONES\nARTICULO 155.- Los Notarios son responsables por los delitos y faltas que cometan con motivo del ejercicio de su función en los mismos términos en que lo son los demás ciudadanos; en consecuencia, quedarán sometidos a la jurisdicción de las autoridades penales en todo lo concerniente a los actos y omisiones delictuosas en que incurran.\nARTICULO 156.- De la responsabilidad civil en que incurran los Notarios, conocerán los tribunales civiles, a instancia de parte legítima y en los términos de su respectiva competencia.\n(ADICIONADO, P.O. 31 DE DICIEMBRE DE 1996)\nA los Notarios Públicos que sean llamados para dar testimonio judicial de los actos en que hubieren intervenido con motivo del ejercicio de sus funciones, se les solicitará su declaración por oficio y la rendirán por la misma vía.\nCuando sea el caso de contestar interrogatorios, se remitirá al Notario en sobre cerrado, el pliego de preguntas y repreguntas que se hubieren formulado por las partes, debiendo contestar por escrito las que hayan sido calificadas de legales por la Autoridad Judicial que conozca del procedimiento.\nARTICULO 157.- La responsabilidad administrativa en que incurran los Notarios, por violaciones a la presente Ley, se hará efectiva por el Ejecutivo del Estado por conducto de la Dirección de Notarías.\nARTICULO 158.- El Ejecutivo del Estado, en su caso, sancionará administrativamente a los Notarios, por violaciones a los preceptos de esta Ley, aplicándoles las siguientes sanciones:\nI.- Amonestación por oficio;\nII.- Multa de cien a mil pesos;\nIII.- Suspensión del cargo hasta por un año; y\nIV.- Separación definitiva del cargo.\nPara aplicar a los Notarios la sanción administrativa que establece la fracción II de este artículo, el\nEjecutivo del Estado ordenará que se practique una investigación, de cuyo resultado y tomando en cuenta la gravedad y de más circunstancias que concurran en el acto de que se trate, dictará resolución oyendo previamente en defensa al Notario.\nARTICULO 159.- Tratándose de actos u omisiones de los Notarios, que por su gravedad pudieran motivar las sanciones a que se refieren las fracciones III y IV del artículo anterior, antes de dictar resolución sobre el particular, se seguirá el siguiente procedimiento.\nEl Ejecutivo del Estado designará un visitador que practique la investigación que corresponda, y con el resultado de la misma se dará conocimiento al Consejo del Colegio de Notarios para que, éste opine en el plazo que se fijará prudencialmente.\nRecibido el Informe del Consejo, el Ejecutivo del Estado oirá personalmente al Notario de que se trate, concediéndole el término de quince días para que aporte pruebas en su defensa y fenecido el término, se dictará la resolución definitiva, sin que haya lugar a ulterior recurso administrativo. La substanciación del procedimiento señalado, en ningún caso podrá exceder del término de dos meses.\nARTICULO 160.- Las acusaciones, denuncias y querellas por delitos atribuidos a los Notarios en ejercicio de sus funciones se presentarán ante el Procurador General de Justicia del Estado, quien dará vista con ella a la Secretaría del Ejecutivo del Estado y al Consejo de Notarios del Estado para que intervengan previamente y rindan su dictamen, en un plazo máximo de 15 días, hecho lo cual, se procederá conforme a la Ley.\nTITULO SEPTIMO\nCAPITULO UNICO\nARTICULO 161.- Los notarios en ejercicio de sus funciones al realizar la labor y desempeñar los cargos que menciona el Artículo 2o,. de la presente Ley, percibirán como honorarios los que se señalan en el presente arancel.\nPor la redacción o autorización de las escrituras o actas notariales:\nI.- Del valor determinado que no tenga cuota especial en este arancel, percibirán:\na).- Si el valor excede de $ 5,000.00 …..………………………….…………………………. $ 500.00\nb).- Si el valor excede de $ 5,000.00 pero no de $ 10,000.00…………………………….. $ 600.00\nc).- Si el valor excede de $ 10,000.00 pero no de $ 15,000.00 ……………………………$ 700.00\nd).- Si el valor excede de $ 15,000.00 pero no de $ 20,000.00 ……………………………$ 800.00\ne).- Si el valor excede de $ 20,000.00, por esta cantidad se cobrará conforme al inciso anterior, y por el excedente se cobrará además el uno por ciento.\nII.- Cuando se refieren a pensión, renta, intereses o cualesquiera otra prestación periódica de plazo determinado, se tomará como base el importe total de esas prestaciones y se aplicará la fracción anterior.\nIII.- Del valor indeterminado, por cada foja, $ 100.00.\nARTICULO 162.- Tratándose de constitución de Sociedades Mercantiles, de aumento o disminución del capital social, de disolución y liquidación, se cobrarán:\na).- Hasta de $ 25,000.00 de capital ………………………………………………………. $ 1,000.00\nb).- De más de $ 25,000.00 hasta $ 100,000.00 de capital …………………………….. $ 1,500.00\nc).- De más de $ 100,000.00 hasta $ 250,000.00 de capital …………………………… $ 3,000.00\nSi el valor del capital excede de $ 250,000.00 se cobrará conforme al inciso c) y además sobre el excedente se cobrará el uno por ciento.\nARTICULO 163.- Si se trata de protocolizaciones de actos no estimables en dinero, $ 200.00 por hoja, pero si la operación se estimare en dinero, se aplicará la fracción I del artículo 161 de este arancel. Por actas notariales fuera de protocolo, que no sean de los actos previstos en los artículos correspondientes a este capítulo, se cobrarán de $400.00 a $750.00 y por cada hoja o fracción que exceda de las tres primeras, se cobrará además la cantidad de $ 200.00.\nARTICULO 164.- Si se trata de prestaciones periódicas por tiempo indeterminado, se tomará como base su importe durante cinco anualidades y se aplicará la cuota de la fracción I del artículo 161 de esta Ley.\nARTICULO 165.- En los actos o contratos de mutuo con garantía hipotecaria en que se determinen capital e intereses o en aquellos en que se consignen otras prestaciones accesorias, se aplicará la cuota de la Fracción I del Artículo 161 de este arancel, únicamente sobre lo que importe la suerte principal.\nARTICULO 166.- Por la cancelación o extinción de obligaciones, se aplicará el 50% de las cuotas a que se refiere el artículo 161 de esta Ley.\nARTICULO 167.- Por el otorgamiento de mandatos y por las substituciones, revocaciones, protocolizaciones o cancelaciones de estos actos, cobrarán de $ 500.00 a $ 750.00, si el mandante fuese persona física y de $ 700.00 a $ 1,500.00 si fuesen otorgados por sociedades. Por la ratificación de la firma de los mandatos a que se refiere el artículo 2449 del Código Civil vigente en el Estado de Coahuila, se cobrarán de $ 100.00 a $ 200.00.\nARTICULO 168.- Por los protestos de documentos que las leyes autoricen, se cobrarán:\n1.- Si el valor del documento no excede de $ 500.00 …………………………………………. $ 50.00\n2.- Si excede de $ 500.00 hasta $ 1,000.00 …………………………………………………….$ 75.00\n3.- Si excede de $ 1,000.00 hasta $ 2,000.00 ……………………………………………….. $ 100.00\n4.- Si excede de $ 2,000.00 hasta $ 5,000.00 ……………………………………………….. $ 200.00\n5.- Si excede de $ 5,000.00 …………………………………………………………………….. $ 300.00 tengan que llenarse los requisitos del artículo 148 de la Ley de Títulos de Operaciones de Crédito, se aplicará la misma cuota.\nARTICULO 169.- En los testamentos, si el acto se practica en el despacho del Notario cobrarán de $\n500.00 a $ 3,500.00, más el excedente que convencionalmente se fije si se practica fuera de él, atendiendo a las circunstancias del acto.\nARTICULO 170.- Siempre que una escritura o acta notarial, contenga diversos contratos o actos, los honorarios se fijarán en totalidad por cada uno de los contratos o actos principales, y en una mitad por cada uno de los accesorios complementarios.\nARTICULO 171.- Por los trabajos notariales hechos entre las 20 horas y las 8 horas, así como en días oficialmente señalados como feriados, cobrarán un 100% más del valor correspondiente a la cuota ordinaria.\nARTICULO 172.- Además de los honorarios señalados en los casos previstos en los Artículos anteriores, cobrarán lo siguiente:\n1o.- Por el examen de cualquier clase de documentos necesarios o relacionados con la escritura, comprendiendo aquellos con los que se acredite representación, $ 50.00 por cada uno si se trata de personas físicas y $ 100.00 tratándose de persona moral; si el examen se hace fuera del despacho del\nNotario, con causa justificada, se duplicará la cuota.\n2o.- Por la toma de firmas fuera de la Notaría, $ 100.00 por cada una y los gastos de traslado.\n3o.- Por la redacción y gestión de liquidaciones para el pago de impuestos, solicitudes de certificados y comunicaciones en general que origine el otorgamiento, tramitación y autorización de actos y contratos de $ 50.00 a $ 1,000.00 en total, según la importancia del negocio o número de gestiones.\n4o.- Por cada anotación o razón marginal puesta en el protocolo, en los testimonios o en cualquier otro documento, cobrarán de $ 50.00 a $ 100.00.\n5o.- Por el cotejo y por lo escrito, $ 40.00 por hoja salvo las que contengan las cifras que hayan de sumarse al final de la plana, por las que cobrarán $ 60.00.\n6o.- Por autorización de testimonios, copias certificadas o certificaciones, cobrarán de $ 100.00 a $\n300.00.\nARTICULO 173.- El importe de los timbres de protocolo, testimonio, copias o certificaciones, gastos de escribiente y demás erogaciones justificadas que se causen por la escritura o por la actuación notarial, serán cubiertos por los interesados.\nARTICULO 174.- En el caso en que de conformidad con la Ley el notario tenga que poner a las escrituras o actas la nota de \"NO PASO\", cobrarán íntegramente el valor de los honorarios y gastos; pero si esa escritura se repite ante el mismo notario, entonces cobrará por la nueva escritura o acta, únicamente el\n50% de los honorarios.\nARTICULO 175.- Por la protocolización de documentos relativos a sociedades extranjeras para que ejerzan el comercio dentro de la República, cobrarán los honorarios sobre el importe del capital que fije para operar en México. En caso de que no esté determinado, sobre el mínimo que la Ley de Sociedades\nMercantiles les señale a la sociedad con la que más se asemeje la que es objeto de la protocolización.\nTratándose de sociedades de crédito o de seguros, se considerará como capital social para el cobro de honorarios, una cantidad igual al mínimo que para cada ramo de la institución de crédito y organización\nInstituciones de Seguros.\nARTICULO 176.- Por cada conferencia o consulta verbal que no amerite el otorgamiento de escritura o acta, si se celebra en el despacho de la notaría se cobrarán $ 100.00 por la primera media hora o fracción y $ 200.00 por cada media hora excedente. Fuera del despacho de la notaría, la cuota se duplica.\nARTICULO 177.- Por cada consulta por escrito, lo que convengan las partes. A falta de convenio, según la importancia del asunto, las dificultades técnicas del negocio y su extensión, se cobrarán de $ 300.00 a\n$ 2,500.00.\nARTICULO 178.- Por ser Actuario en Juicio Arbitral, los honorarios que se convengan o en su defecto a razón de $ 200.00 a $ 500.00 diarios.\nARTICULO 179.- Por patrocinar a los interesados en los procedimientos judiciales necesarios para obtener el registro de escritura de sociedades, cobrarán $ 500.00 si el capital es hasta de $ 10,000.00; $\n600.00 si es hasta de $ 25,000.00; $ 700.00 hasta $ 50,000.00; $ 850.00 hasta $ 100,000.00; de $\n100,000.00 a $ 500,000.00, $ 1,000.00 y de $ 500,000.00 en adelante 2 al millar.\nARTICULO 180.- Por patrocinar a los interesados en la obtención del permiso para la constitución de sociedades o la suscripción de acciones o partes sociales, los honorarios serán convencionales e igualmente por patrocinar a los interesados en registros oficiales federales que prevengan las leyes.\nARTICULO 181.- Por tramitar sucesiones, en los términos que establece el Capítulo VIII del Título XIX del Código de Procedimientos Civiles, independientemente de los honorarios que se causen por las distintas actas notariales, consideradas por hoja o por valor según el caso, cobrarán el 65% de las cuotas establecidas en el inciso (sic) I del artículo 161 de esta Ley, tomando como valor real de los bienes inventariados y por la tramitación administrativa para obtener el pago del Impuesto de Herencias, o la declaración de exención, el 10% del valor del impuesto.\nARTICULO 182.- Los notarios percibirán cuando salgan fuera de su residencia oficial a razón de $ 2.50 por kilómetro, más los gastos de viaje y los correspondientes a los de su estancia en el lugar de su destino y por honorarios la cantidad de $ 1,000.00 diarios por los primeros diez días y $ 1,500.00 por los posteriores a ese tiempo.\nARTICULO 183.- Las partes serán solidariamente responsables para con el Notario, del importe total de los gastos y honorarios.\nARTICULO 184.- Los notarios no ratificarán ninguna escritura de traslación de dominio de bienes inmuebles o de derechos reales, si no les justifican haberse cumplido con lo dispuesto en los artículos 32,\nFracción X, y 37 de esta Ley. En caso contrario, la ratificación será nula y no tendrá derecho a cobrar honorarios.\nARTICULO 185.- Los Notarios, en los casos en que se trate de Instituciones de Enseñanza o ciento.\nEn los casos en que intervengan el Instituto Estatal de la Vivienda Popular, reducirán los honorarios en un treinta y cinco por ciento de los fijados en el presente Título.\nTratándose de programas para el fomento de la vivienda de interés social y popular, en los que intervengan, financien o promuevan de alguna manera instituciones de crédito y organismos públicos de vivienda sean federales estatales, municipales o de cualquier otro tipo los notarios se limitarán a cobrar como únicos honorarios y gastos notariales los siguientes:\n1º.- Cuando se trate de la adquisición de vivienda nueva por regularización de la tenencia de la tierra sin crédito hipotecario, una cantidad equivalente a 15 días de salarios mínimo general vigente en el Estado, como máximo.\n2º.- En aquellos casos en que sea necesaria la protocolización de créditos hipotecarios en las operaciones a que se refiere el párrafo anterior se estará al arancel siguiente:\na).- El 1% del valor catastral del inmueble, tratándose de vivienda de interés social, pero en ningún caso, el monto de los honorarios podrá ser inferior al importe de 20 días de salario mínimo general vigente en el\nEstado.\nb).- El 1% del valor catastral del inmueble, tratándose de vivienda de tipo popular, pero, en ningún caso, el monto de los honorarios podrá ser inferior al importe de 30 días de salarío mínimo general vigente en el\nEstado.\n(ADICIONADO, P.O. 31 DE AGOSTO DE 1993)\nSe entenderá que el arancel notarial a que se refieren los incisos 1º y 2º incluye la totalidad de las operaciones que se protocolicen en uno o más instrumentos y que se requieran para la titulación de la vivienda de interés social y de tipo popular, tales como enajenación del inmueble, la cancelación de créditos y mutuos con garantía hipotecaria.\n(REFORMADO, P.O. 31 DE AGOSTO DE 1993)\nARTICULO 186.- Para los efectos del Artículo anterior, se considera vivienda de interés social aquella cuyo valor, al término de su edificación, no exceda de la suma que resulte de multiplicar por quince el salario mínimo general elevado al año vigente en el Estado; y vivienda de tipo popular, aquella cuyo valor, al término de su edificación, no exceda de la suma que resulte de multiplicar por veinticinco el salario mínimo general vigente en el Estado elevado al año.\n(REFORMADO, P.O. 31 DE AGOSTO DE 1993)\nARTICULO 187.- Con excepción de lo dispuesto en el Artículo 185 de esta ley, los honorarios con cantidades fijas que señala el presente arancel, se incrementarán automáticamente al inicio de cada año, de acuerdo con el porcentaje en que se incrementan los salarios mínimos en el Estado.\nARTICULO 188.- Cualquier caso no previsto en este arancel, se cotizará de acuerdo con el que tenga más semejanza con los antes señalados.\nTRANSITORIOS\nARTICULO PRIMERO.- La presente Ley entrará en vigor treinta días después de su publicación en el\nARTICULO SEGUNDO.- Se abroga la Ley del Notariado del Estado de Coahuila, promulgada el día 4 de\n1969.\nARTICULO TERCERO.- Se derogan todas las disposiciones legales, decretos o circulares que se opongan a la presente Ley.\nARTICULO CUARTO.- Los Notarios de Número actualmente nombrados, continuarán el ejercicio de sus funciones en los lugares y con los números que se les han asignado.\nARTICULO QUINTO.- El número de notarías fijado actualmente para cada uno de los Distritos del Estado\n70 de la presente Ley. En ningún caso podrá disminuirse el número de notarías que estén autorizadas.\nARTICULO SEXTO.- Las personas a quienes a la iniciación de la vigencia de esta Ley, el Congreso del\nEstado les haya concedido Fiat para ejercer el notariado en determinado Distrito, podrán hacerlo en el\nDistrito que les señale el Ejecutivo del Estado, en los términos de la presente Ley.\nARTICULO SEPTIMO.- Las personas que a la fecha de la iniciación de la vigencia de esta Ley, hayan presentado al Congreso del Estado su solicitud para obtener la autorización para el ejercicio del notariado, en los términos del artículo 7o., de la Ley del Notariado publicada en el Periódico Oficial del día\n15 de marzo de 1969, y hayan llenado los requisitos previstos por los artículos 5o., 6o., y demás relativos de la mencionada Ley, tendrán derecho a que se les expida la autorización solicitada.\nEl Congreso del Estado o la Diputación permanente en su caso, una vez comprobados los requisitos previstos por la Ley que se abroga, expedirá la autorización respectiva a quien primero haya hecho la solicitud y así sucesivamente se continuará otorgando las autorizaciones, siguiendo el orden cronológico de su presentación.\nPara tal efecto, al entrar en vigor la presente Ley, el Congreso del Estado o la Comisión permanente en su caso, expedirá una certificación, haciendo constar los actos relativos a los Fiats otorgados y a las solicitudes que llenen los requisitos señalados por la Ley que se abroga y que hayan sido presentados para tal efecto. Copias de esta certificación serán enviadas al Ejecutivo del Estado y a los Consejos de\nNotarios y Directivos de las Delegaciones del Colegio de Notarios del Estado.\nARTICULO OCTAVO.- Cuando se presente una notaría acéfala por cualquiera de las causas previstas por esta Ley, se designará primeramente a las personas a quienes se les haya otorgado el Fiat y posteriormente a quienes tengan presentada su solicitud al Congreso del Estado, siguiendo un estricto orden de precedencia cronológica.\nUna vez que se hayan asignado Distrito y Número a las personas que están en los supuestos que señalan los artículos 6o. y 7o. de estos transitorios se procederá conforme lo previene la presente Ley.\nARTICULO NOVENO.- Cuando dos o más Notarios sin número tengan igual fecha de otorgamiento de\nFiat, el Secretario del Ejecutivo del Estado, en presencia de los interesados realizará un sorteo para señalar al designado.\nARTICULO DECIMO.- Cuando se produzca un rechazo de Notaría acéfala o de nueva creación por parte de alguno o algunos de los notarios sin número que cuenten con Fiat debidamente autorizado, estos continuarán en el mismo orden de preferencia conforme a la antigüedad de la autorización de su Fiat\nNotarial.\nARTICULO DECIMO PRIMERO.- Conforme a lo dispuesto por el Capítulo Séptimo del Título segundo de esta Ley, los Notarios que venían disfrutando de licencia en los términos de la Ley anterior, deberán en un plazo de 30 días, contados a partir de la fecha en que entre en vigor el presente ordenamiento, manifestar a la Secretaría del Ejecutivo del Estado si desean seguir disfrutando de la misma, en cuyo caso entregará el Protocolo y sello correspondiente.\nARTICULO DECIMO SEGUNDO.- Los notarios que están en los supuestos señalados en el artículo 6o. de esta Ley, deberán optar por ejercer el Notariado o solicitar licencia, en los términos previstos por el\nCapítulo Séptimo del Título Segundo de la misma, dentro de los 30 días siguientes a su vigencia.\nARTICULO DECIMO TERCERO.- Las personas que al momento de la iniciación de la vigencia de esta\nLey integren el actual Consejo de Notarios del Estado y de sus Delegaciones, constituirán automáticamente los Consejos Directivos del Colegio de Notarios del Estado y sus delegaciones, cuyas\nLey.\nARTICULO DECIMO CUARTO.- El Consejo de Notarios del Colegio de Notarios del Estado, de común acuerdo con los Consejos Directivos de las Delegaciones Distritales, formularán su Reglamento y\nEstatutos dentro de un plazo de 90 días a partir de la fecha de iniciación de la vigencia de la presente Ley y los pondrán a la consideración del Ejecutivo del Estado para su aprobación.\nARTICULO DECIMO QUINTO.- El Archivo de Notarías será instalado dentro de los 60 días siguientes a la fecha en que entre en vigor la presente Ley. Todos los protocolos y demás documentos que deban ingresar a dicho Archivo y obren en poder de distintas autoridades o particulares, deberán ser remitidos al\nArchivo de Notarías, dentro de los 60 días posteriores a la instalación del mismo.\nARTICULO DECIMO SEXTO.- Los Notarios en ejercicio al entrar en vigor la presente Ley, seguirán utilizando el Protocolo del presente año y continuarán con la numeración de instrumentos que actualmente llevan, pero ajustando éstos a partir de la iniciación de su vigencia, a los requisitos de forma y fondo que la misma establece. mes de febrero de mil novecientos setenta y nueve.\nDIPUTADO PRESIDENTE\nProfr. Roberto Vega Mandujano\n(Rúbrica).\nDIPUTADO SECRETARIO. DIPUTADO SECRETARIO.\nLic. Enrique Neávez Muñiz. C.P. Saúl López Aldape.\n(Rúbrica). (Rúbrica).\nIMPRIMASE, COMUNIQUESE Y OBSERVESE.\nEL GOBERNADOR CONSTITUCIONAL DEL ESTADO\nOSCAR FLORES TAPIA.- (Rúbrica).\nEL SECRETARIO DEL EJECUTIVO DEL ESTADO\nLIC. ROBERTO OROZCO MELO.-(Rúbrica).\nN. DE E. A CONTINUACION SE TRANSCRIBEN LOS ARTICULOS TRANSITORIOS DE LOS DECRETOS DE\nREFORMAS A LA PRESENTE LEY.\nARTICULO PRIMERO.- El presente Decreto entrará en vigor diez días después de su publicación en el Periódico\nARTICULO SEGUNDO.- Se derogan todas aquellas disposiciones que se opongan al presente Decreto.\nARTICULO TERCERO.- Los Notarios que tengan las incompatibilidades en el artículo 6, que se reforma mediante este Decreto, deberán optar por ejercer el notariado o solicitar licencia del Ejecutivo del Estado en los términos del artículo 108, tercer párrafo que se modifica, dentro de los 60 días hábiles siguientes a su vigencia.\nARTICULO CUARTO.- Los Notarios que al entrar en vigor el presente Decreto, tengan en su poder protocolos que deban depositar en la Dirección de Notarías, disponen de un plazo de 60 días para entregarlos a la citada dependencia.\nARTICULO QUINTO.- El sello de los Notarios en ejercicio deberá reunir los requisitos que establece el artículo 107 fracción I de la Ley del Notariado.\nP.O. 28 DE FEBRERO DE 1989.\nSE TRANSCRIBEN UNICAMENTE LOS TRANSITORIOS DEL DECRETO DE REFORMAS QUE SE RELACIONAN\nCON LA LEY.\nPRIMERO.- Este Decreto entrará en vigor al día siguiente de su publicación en el Periódico Oficial del Gobierno del\nEstado.\nTERCERO.- Se derogan todas las disposiciones legales que se opongan al presente Decreto.\nCON LA LEY.\nARTICULO PRIMERO.- El presente decreto entrará en vigor el día siguiente al de su publicación en el Periódico\nARTICULO TERCERO.- Se derogan todas las disposiciones que se opongan al presente Decreto.\nARTICULO PRIMERO.- Se derogan todas las disposiciones que se opongan al presente Decreto.\nARTICULO SEGUNDO.- Este Decreto entrará en vigor el día siguiente de su publicación en el Periódico Oficial del\nARTICULO TERCERO.- Para los efectos del artículo 70 de la presente reforma, el Ejecutivo del Estado, tomará las relación a la población de un municipio, se adscriban a otra población dentro del mismo Distrito que carezca de\nNotario.\nARTICULO CUARTO.- Las reformas al artículo 9o. en sus fracciones XIII y XIV entrarán en vigor una vez que se realicen las correspondientes al Código adjetivo de la materia.\nPRIMERO.- Este Decreto entrará en vigor el día siguiente de su publicación en el Periódico Oficial del Gobierno del\nEstado.\nSEGUNDO.- Se derogan todas las disposiciones que se opongan al presente Decreto.\nPRIMERO.- Este Decreto entrará en vigor el día siguiente de su publicación en el Periódico Oficial del Gobierno del\nEstado.\nSEGUNDO.- Se derogan todas las disposiciones legales y reglamentarias que se opongan al presente Decreto.",
  "ordenamiento": "REGLAMENTO",
  "jurisdiccion": "COAHUILA",
  "fuente_oficial": "DIARIO OFICIAL DE LA FEDERACION",
  "Fecha de Publicación": "6 de febrero de 1979",
  "ULTIMA REFORMA PUBLICADA": "12 DE DICIEMBRE DE 2006",
  "es_escaneado": false,
  "tiene_tablas": false,
  "materia": [
    "notariado"
  ]
}