{
  "titulo": "Ley para el Funcionamiento de las Juntas de Mejoras Materiales en el Estado",
  "Contenido": "EL C. LIC. EVELIO H. GONZALEZ TREVIÑO, Gobernador Constitucional Interino del Estado\nIndependiente Libre y Soberano de Coahuila de Zaragoza, a sus habitantes sabed:\nEl XXXVII Congreso Constitucional del Estado Independiente, Libre y Soberano de Coahuila de\nZaragoza,\nDECRETA:\nNúmero 354.“LEY PARA EL FUNCIONAMIENTO DE LAS JUNTAS DE MEJORAS MATERIALES EN EL ESTADO”\nARTICULO 1o.- Las Juntas de Mejoras Materiales del Estado administrarán el patrimonio que esta Ley les señala, invirtiéndolo en obras de beneficio general dentro de su jurisdicción, de acuerdo con el\nArtículo 7o.\nARTICULO 2o.- Se establecerán Juntas Locales de Mejoras Materiales en la cabecera de cada\nMunicipio, las que tendrán personalidad jurídica y patrimonio propio, en los términos de la presente Ley.\n(REFORMADO, P.O. 8 DE ABRIL DE 1967)\nARTICULO 3o.- Las Juntas Locales de Mejoras Materiales se integrarán:\n(REFORMADA, P.O. 27 DE OCTUBRE DE 1998)\nI.- Por un Presidente, que será un representante del gobierno del Estado, designado por el Titular del\nEjecutivo;\n(REFORMADA, P.O. 27 DE OCTUBRE DE 1998)\nII.- Por un Secretario, que será un representante designado por el Presidente Municipal del Ayuntamiento correspondiente.\n(REFORMADA, P.O. 27 DE OCTUBRE DE 1998)\nIII.- Por un Tesorero, designado por el Presidente de la Junta de la propuesta en terna, que presenten de entre ellos mismos, los Vocales a que se refiere la fracción IV de este artículo; y\n(REFORMADA, P.O. 27 DE OCTUBRE DE 1998)\nIV.- Por Vocales, que no serán menos de tres ni más de 10, entre los que se incluirá a un representante de cada una de las organizaciones privadas y sociales más representativas de la comunidad.\nCada miembro propietario de la Junta, contará con un suplente que se designará por aquél.\nARTICULO 4o.- En caso de no existir Cámara de Propietarios en la localidad, los dos representantes serán designados por mayoría de votos en una asamblea de propietarios de inmuebles, convocada con\nARTICULO 5o.- Si transcurridos los diez días la asamblea de propietarios convocada no hace las designaciones, estas quedarán a cargo del Ejecutivo del Estado.\nARTICULO 6o.- El patrimonio de las Juntas se constituirá:\nI.- Con los impuestos directos, especiales o adicionales que el Congreso del Estado decrete para la realización de obras materiales.\nIII.- Con los fondos que los Municipios pongan a disposición de las Juntas para los mismos fines.\nIV.- Con las obras que dichas Juntas construyan, en tanto no estén terminadas.\nV.- Con las propiedades que adquieran para la realización de sus propios fines.\nVI.- Con las concesiones que se les otorguen.\nVII.- Con los subsidios que se les concedan.\nVIII.- Con los donativos que las Juntas obtengan de instituciones públicas o privadas y de particulares.\nIX.- Con los legados y donaciones que reciban, y\nX.- Con cualquiera otros ingresos que obtengan en ejercicio de su actividad legal.\nARTICULO 7o.- Las Juntas Locales de Mejoras Materiales, invertirán los recursos de su patrimonio, sujetándose al orden que a continuación se establece:\na).- Planificación y pavimentación de calzadas, avenidas, calles, parques, jardines y demás sitios de recreo.\nb).- Alumbrado público.\nc).- Escuelas, y\nd).- Edificios públicos municipales.\nARTICULO 8o.- Podrán ejecutarse obras distintas a las mencionadas en el Artículo anterior, o podrá alterarse el orden establecido en el mismo, cuando así lo acuerde la Junta por mayoría de votos del total de sus miembros, y con aprobación expresa de la Junta Central de Mejoras Materiales, a que se refiere el\nArtículo 24.\nARTICULO 9o.- Las Juntas Locales de Mejoras Materiales encomendarán las obras a que esta Ley se refiere a contratistas especializados o al personal de administración que designen. Podrán además, celebrar contratos mediante concurso público, previa aprobación de ambos por la Junta Central de\nMejoras Materiales.\nARTICULO 10.- Concluidas las obras, las Juntas deberán entregarlas para su uso o administración con aprobación de la Junta Central de Mejoras Materiales, al H. Ayuntamiento de su jurisdicción.\nARTICULO 11.- Para la enajenación de los bienes del patrimonio de las Juntas Locales de Mejoras\nMateriales, se requiere acuerdo de la Junta tomado por mayoría de votos de los miembros que la integran; debiendo obtenerse la sanción de la Junta Central de Mejoras Materiales.\nARTICULO 12.- Corresponde a los Presidentes de las Juntas Locales de Mejoras Materiales, la representación jurídica de las mismas, quedando autorizados para delegar su representación.\nARTICULO 13.- El Tesorero de la Junta, rendirá mensualmente a la misma informe del movimiento de\nMateriales.\nARTICULO 14.- Las Juntas Locales de Mejoras Materiales mandarán publicar mensualmente, por los medios disponibles el corte de caja correspondiente para conocimiento del público en general.\nARTICULO 15.- El Ejecutivo del Estado tiene facultades para practicar auditorías en cualquier momento, a las Juntas Central y Locales de Mejoras Materiales.\nARTICULO 16.- Las Juntas Locales celebrarán sesiones ordinarias cada quince días y extraordinarias cuando para ello sean convocadas por sus Presidentes o por la Junta Central de Mejoras Materiales.\nLos acuerdos se tomarán por mayoría de votos y se registrarán en un libro de actas; en caso de empate el Presidente tendrá voto de calidad.\nARTICULO 17.- Para integrar quórum, se requiere la mayoría de los miembros de la Junta.\nARTICULO 18.- Las Juntas se renovarán cada año y quedan facultadas para designar al personal que reclame las necesidades de las mismas, previa aprobación de su presupuesto por la Junta Central.\nARTICULO 19.- Los representantes a que se refiere el Artículo 3o. de esta Ley, podrán ser reelectos. En caso de que durante su ejercicio les fuere retirado el mandato por quienes los designaron, esos mismos\nOrganismos están facultados para nombrar al substituto.\nARTICULO 20.- Los cargos de miembros de las Juntas Locales de Mejoras Materiales, serán honorarios.\nARTICULO 21.- Los Tesoreros de las Juntas y los empleados de las mismas que manejen fondos, para tomar posesión de su cargo deberán caucionar su gestión. En el caso de los Tesoreros, la prima de la fianza relativa será por cuenta de la Junta de que se trate.\nARTICULO 22.- Las Juntas deberán depositar las cantidades que perciban en la Sucursal del Banco de\nMéxico, o, en su defecto, en otra institución Bancaria.\nARTICULO 23.- Se considera a las Juntas Locales de Mejoras Materiales como auxiliares de la Tesorería\nGeneral del Estado, en la percepción y cobro de los impuestos, derechos, productos y aprovechamientos que les corresponda, con facultades para proponer por conducto de la Recaudación de Rentas respectiva, el ejercicio de la facultad económico-coactiva en contra de los causantes morosos.\nARTICULO 24.- En la Capital del Estado funcionará una Junta Central de Mejoras Materiales que tendrá las facultades y atribuciones que esta Ley le concede.\nARTICULO 25.- La Junta Central de Mejoras Materiales se integrará:\nII.- Por un representante designado por la mayoría de los Ayuntamientos, que fungirá como Tesorero.\nIII.- Por un representante designado por la mayoría de las Cámaras de Propietarios del Estado que fungirá como Secretario, y\nIV.- Por un representante común designado por la mayoría de los organismos a que se refiere el inciso IV del Artículo 3o. de la presente Ley, que fungirá como Vocal.\nARTICULO 26.- Para designar los representantes a que se refieren los incisos II, III y IV del Artículo anterior, solamente tendrán derecho a voto los organismos de las poblaciones donde hubiere Junta Local de Mejoras Materiales.\nARTICULO 27.- Los cargos de miembros de la Junta Central de Mejoras Materiales, serán honorarios.\nARTICULO 28.- Los representantes a que se refiere el Artículo 25, durarán en su encargo un año, pudiendo ser reelectos. En caso de que durante su ejercicio les fuera retirado su mandato por quienes los designaron, esos mismos Organismos están facultados para nombrar al substituto.\nARTICULO 29.- La Junta Central de Mejoras Materiales sesionará cuantas veces sea necesario para conocer de los asuntos que se le presenten por las Juntas Locales y para los propios de la misma.\nARTICULO 30.- Las resoluciones de la Junta Central se tomarán por mayoría de votos, teniendo su\nPresidente el de calidad para el caso de empate.\nARTICULO 1o.- Esta Ley entrará en vigor a partir de su publicación en el Periódico Oficial del Estado.\nARTICULO 2o.- Se deroga el Reglamento para el funcionamiento de las Juntas Locales de Mejoras\nMateriales en el Estado, de 30 de Agosto de 1941, publicado en el Periódico Oficial de la misma fecha, y cualquier otra disposición o disposiciones que contraríen el nuevo Ordenamiento.\nARTICULO 3o.- Continúan en vigor los arbitrios autorizados a las Juntas de Mejoras Materiales existentes en la Entidad, hasta en tanto se les fije el patrimonio de conformidad con lo dispuesto por el\nArtículo 6o., de esta Ley.\nARTICULO 4o.- Se concede un plazo de diez días a las Juntas de Mejoras Materiales que han venido funcionando en el Estado, para que hagan entrega de todo cuanto les corresponde a las nuevas Juntas creadas conforme a la presente Ley.\nARTICULO 5o.- En caso de que en los diez días a que se contrae el artículo anterior, no hayan sido designados los representantes a que se refieren los incisos III y IV del Artículo 3o., de esta Ley, la Junta iniciará desde luego sus labores con el resto de los representantes.\nARTICULO 6o.- Los representantes que se elijan en los términos del Artículo 3o., de este Ordenamiento, durarán en sus funciones por esta vez, hasta el 31 de diciembre de 1949, a fin de que la revocación de\nARTICULO 7o.- La Junta Central de Mejoras Materiales, deberá quedar integrada en el término de diez\nARTICULO 8o.- La Junta Local de Mejoras Materiales que se integrará en el Municipio de San Pedro de las Colonias, en los términos de este Ordenamiento, se subroga en los derechos y obligaciones de 1945 y 21 de julio del propio año, respectivamente. mes de marzo de mil novecientos cuarenta y nueve.\nDIPUTADO PRESIDENTE:\nArturo Cepeda C.\n(Rúbrica).\nDIPUTADO SECRETARIO: DIPUTADO SECRETARIO:\nManuel Martínez R. Dr. Gonzalo Valdés V.\n(Rúbrica). (Rúbrica).\nIMPRIMASE, COMUNIQUESE Y OBSERVESE.\nSaltillo, Coah., Marzo 10 de 1949.\nEVELIO H. GONZALEZ TREVIÑO.- Rúbrica.\nEL OFICIAL MAYOR ENC. DEL DESPACHO\nLIC. CARLOS VALDES VILLARREAL.- Rúbrica\nN. DE E. A CONTINUACION SE TRANSCRIBEN LOS ARTICULOS TRANSITORIOS DE LOS\nDECRETOS DE REFORMAS A LA PRESENTE LEY.\nARTICULO UNICO:- Se fija un Término de noventa días contados a partir de la publicación de este\nDecreto en el Periódico Oficial, para que las Juntas Locales de Mejoras Materiales que actualmente funcionan en el Estado, se restructuren ajustándose a lo dispuesto en el Artículo Tercero.\nPRIMERO.- El presente decreto entrará en vigor el día siguiente al de su publicación en el Periódico\nSEGUNDO. Se derogan todas las disposiciones que se opongan a este decreto.",
  "ordenamiento": "REGLAMENTO",
  "jurisdiccion": "COAHUILA",
  "fuente_oficial": "DIARIO OFICIAL DE LA FEDERACION",
  "Fecha de Publicación": "12 de marzo de 1949",
  "ULTIMA REFORMA PUBLICADA": "27 DE OCTUBRE DE 1998",
  "es_escaneado": false,
  "tiene_tablas": false,
  "materia": [
    "general"
  ]
}