{
  "titulo": "Ley de Participación Ciudadana para el Estado de Coahuila de Zaragoza",
  "Contenido": "EL C. ENRIQUE MARTÍNEZ Y MARTÍNEZ, GOBERNADOR CONSTITUCIONAL DEL ESTADO\nINDEPENDIENTE, LIBRE Y SOBERANO DE COAHUILA DE ZARAGOZA, A SUS HABITANTES\nSABED:\nQUE EL CONGRESO DEL ESTADO INDEPENDIENTE, LIBRE Y SOBERANO DE COAHUILA DE\nZARAGOZA,\nDECRETA:\nNÚMERO 177.LEY DE PARTICIPACIÓN CIUDADANA PARA\nEL ESTADO DE COAHUILA DE ZARAGOZA\nTÍTULO PRIMERO\nPRINCIPIOS GENERALES\nARTÍCULO 1°. EL ÁMBITO DE APLICACIÓN DE LA LEY Y DE LAS INSTANCIAS COMPETENTES\nPARA APLICARLAS. Esta ley es de orden público, interés social y de observancia obligatoria en todo el régimen interior del estado en materia de participación y organización ciudadana y comunitaria.\nPara todos los efectos legales de este ordenamiento, se entenderá por:\nI. Instituto: el Instituto Electoral y de Participación Ciudadana de Coahuila previsto en el artículo 27\nII. Tribunal Electoral: el Tribunal Electoral del Poder Judicial del Estado previsto en el artículo 136 de\nARTÍCULO 2°. EL OBJETO DE LA LEY. Esta ley, dentro del ámbito de competencia de los gobiernos estatal y municipal, tiene por objeto:\nI. Fomentar, promover y salvaguardar el derecho de los ciudadanos y habitantes coahuilenses, para participar en la vida pública.\nII. Fomentar, promover y regular la organización y participación ciudadana y comunitaria en la toma de decisiones públicas fundamentales, a fin de que gobierno y comunidad:\n1. Promuevan e instrumenten las demandas comunitarias.\n2. Establezcan mecanismos de control comunitario para garantizar el ejercicio legal, democrático y transparente del poder público.\n3. Colaboren de manera plural, constructiva y corresponsable en la planeación, ejecución, vigilancia y evaluación de la función pública.\nIII. Fomentar, promover e instrumentar una política de desarrollo comunitario.\nARTÍCULO 3°. LOS PRINCIPIOS DE LA PARTICIPACIÓN Y ORGANIZACIÓN CIUDADANA Y\nCOMUNITARIA. La participación y organización ciudadana y comunitaria, se basan en los principios de democracia, legalidad, gobernabilidad, certeza, objetividad, independencia, libertad, equidad, confianza, transparencia, solidaridad, corresponsabilidad y sustentabilidad.\nARTÍCULO 4°. LOS INSTRUMENTOS DE PARTICIPACIÓN CIUDADANA Y/O COMUNITARIA. Los instrumentos de participación ciudadana y/o comunitaria son:\nI. El plebiscito.\nII. El referendo.\nIII. La iniciativa popular.\nIV. La consulta popular.\nV. La colaboración comunitaria.\nVI. La audiencia pública.\nVII. Los demás que establezcan otras disposiciones aplicables o las autoridades estatales o municipales, en los ámbitos de sus competencias, para garantizar la participación ciudadana y comunitaria en su vida pública.\nLos instrumentos de participación y organización ciudadana y comunitaria son complementarios entre sí.\nARTÍCULO 5°. LOS INSTRUMENTOS DE ORGANIZACIÓN CIUDADANA Y/O COMUNITARIA. Los instrumentos de organización ciudadana y/o comunitaria son:\nI. Los Consejos de Participación Ciudadana.\nII. Los Consejos de Participación Comunitaria.\nIII. Los demás que establezcan otras disposiciones aplicables o las autoridades estatales o municipales, en los ámbitos de sus competencias, para garantizar la organización ciudadana y comunitaria en su vida pública.\nARTÍCULO 6°. EL GARANTISMO DE LOS INSTRUMENTOS DE PARTICIPACIÓN Y ORGANIZACIÓN\nCIUDADANA Y COMUNITARIA. Los gobiernos estatal y municipal, en los ámbitos de sus competencias, establecerán las garantías necesarias para que los instrumentos de participación y organización ciudadana y comunitaria sean reales, efectivos y democráticos. Para tal efecto, removerán los obstáculos que impidan o dificulten el ejercicio del derecho de las personas a participar en la vida política, económica, cultural y social del estado.\nEsta obligación es extensible a toda autoridad encargada de observar esta ley.\nARTÍCULO 7°. EL GARANTISMO DE NO-EXCLUSIÓN DE OTROS INSTRUMENTOS DE\nPARTICIPACIÓN Y ORGANIZACIÓN CIUDADANA Y COMUNITARIA. Los instrumentos de participación y organización ciudadana y comunitaria previstos en esta ley, no excluyen ni afectan el instrumentos, siempre que no vulneren los principios previstos en el artículo 3° de esta ley.\nTÍTULO SEGUNDO\nARTÍCULO 8°. EL CIUDADANO/ELECTOR/COAHUILENSE COMO SUJETO DE LA PARTICIPACIÓN\nCIUDADANA. Los ciudadanos electores coahuilenses podrán ejercer: esta ley, sin perjuicio de que el previsto en la fracción III podrá ejercerse también por aquellos que no sean ciudadanos electores coahuilenses, pero que acrediten haber residido en el Estado por más de tres años.\nII. El instrumento de organización ciudadana previsto en la fracción I del artículo 5° de esta ley.\nPara determinar la calidad de estos sujetos, se observará lo dispuesto por la Constitución Política del\nEstado y demás disposiciones aplicables; pero, en todo caso, deberán contar con credencial de elector vigente expedida por la autoridad competente.\nARTÍCULO 9°. EL HABITANTE/COAHUILENSE COMO SUJETO DE LA PARTICIPACIÓN\nCOMUNITARIA. Los habitantes coahuilenses podrán ejercer:\nI. Los instrumentos de participación comunitaria previstos en las fracciones IV a VI del artículo 4° de esta ley.\nII. El instrumento de organización comunitaria previsto en la fracción II del artículo 5° de esta ley.\nPor habitante coahuilense, se entiende toda persona, física o moral, de nacionalidad mexicana que resida temporal o permanentemente en el territorio del estado.\nARTÍCULO 10. LOS LÍMITES DEL DERECHO A LA PARTICIPACIÓN Y ORGANIZACIÓN\nCIUDADANA Y COMUNITARIA. Los derechos de los ciudadanos y de los habitantes del estado previstos en esta ley, se ejercerán sin perturbar ni afectar el orden constitucional o legal, la tranquilidad pública o el derecho de terceros.\nEn todo caso, la participación y organización ciudadana y comunitaria se sujetarán a las normas, valores y principios del estado humanista, social y democrático de derecho que emana de la Constitución Política del Estado y demás disposiciones aplicables.\nARTÍCULO 11. LA OBLIGACIÓN DE GARANTIZAR LA PARTICIPACIÓN Y ORGANIZACIÓN\nCIUDADANA Y COMUNITARIA. Es obligación de los gobiernos estatal y municipal, en el ámbito de sus respectivas competencias, garantizar el respeto de los derechos fundamentales de los ciudadanos y de los habitantes del estado.\nEn todo caso, deberán coadyuvar en la organización ciudadana o comunitaria, a efecto de que los ciudadanos y habitantes coahuilenses puedan ejercer el derecho a participar en la vida pública.\nTÍTULO TERCERO\nARTÍCULO 12. LA CULTURA DE PARTICIPACIÓN CIUDADANA Y COMUNITARIA. El estado, los municipios y la comunidad en general deberán promover, fomentar e instrumentar de manera conjunta, permanente y eficaz una cultura de participación ciudadana y comunitaria.\nARTÍCULO 13. LOS PRINCIPIOS DEMOCRÁTICOS DE LA CULTURA DE PARTICIPACIÓN\nCIUDADANA Y COMUNITARIA. La cultura de participación ciudadana y comunitaria, se basa en los principios siguientes:\nI. La educación democrática del ser humano.\nII. El respeto a los derechos fundamentales del ser humano.\nIII. La cultura de la constitucionalidad y legalidad.\nIV. El diálogo permanente, respetuoso, tolerante, constructivo y civilizado entre gobierno y comunidad.\nV. La colaboración corresponsable, constructiva y armónica entre gobierno y comunidad, para prevenir y resolver los problemas de interés público.\nVI. La libre asociación y organización de todos los sectores de la comunidad y su participación democrática, representativa y legal en la vida pública de los gobiernos estatal y municipal.\nVII. La gobernabilidad humanista, social y democrática.\nARTÍCULO 14. EL CIUDADANO/HABITANTE/PARTICIPATIVO. La cultura de participación ciudadana y comunitaria, tiene por objeto formar al ciudadano y/o al habitante coahuilense:\nI. Crítico, autocrítico, propositivo, objetivo, imparcial e informado.\nII. Sensible y comprometido con el interés público y la dignidad y el libre desarrollo del ser humano.\nIII. Honorable, honesto y congruente.\nIV. Visionario, innovador y participativo.\nV. Tolerante, respetuoso, plural, incluyente y conciliador.\nCon base en estas características enunciativas, el Instituto elaborará el decálogo del ciudadano/habitante/participativo como norma de conducta que sustente la participación y organización ciudadana y comunitaria.\nARTÍCULO 15. EL PROGRAMA DE LA CULTURA DE PARTICIPACIÓN CIUDADANA Y\nCOMUNITARIA. El Instituto elaborará el Programa de la Cultura de Participación Ciudadana y\nComunitaria, conforme a las bases siguientes:\nI. Se definirán los objetivos, estrategias y acciones particulares para alcanzar el desarrollo integral y democrático del ciudadano/habitante/participativo.\nII. Se definirá la participación que corresponderá a las dependencias y/o entidades del estado, los\nIII. Este programa deberá propiciar la colaboración y participación activa del Instituto con las autoridades estatales, municipales y la comunidad en su conjunto, conforme a los lineamientos siguientes:\n1. Se instrumentarán cursos de capacitación, talleres, conferencias o cualquier otra forma de aprendizaje social, a fin de que las personas tengan la oportunidad real de ejercer los derechos que establece esta ley.\n2. El Instituto autorizará los formatos necesarios, a fin de que a los ciudadanos se les facilite el ejercicio de los instrumentos de participación y organización ciudadana y/o comunitaria.\n3. El Instituto certificará a partidos políticos, los consejos, organizaciones u asociaciones que ofrezcan, en forma interdisciplinaria y profesional, la posibilidad de llevar a cabo cursos o talleres en materia de participación ciudadana y comunitaria.\n4. Los gobiernos estatal y municipal, en los ámbitos de sus competencias, autorizarán los formatos necesarios, a fin de que a los habitantes se les facilite el ejercicio de los instrumentos de participación y organización ciudadana y/o comunitaria.\n5. Las asociaciones, barras y colegios de abogados en el estado ofrecerán una función social participación y organización ciudadana y/o comunitaria.\n6. El Ejecutivo del Estado, por conducto de la dependencia o entidad a la que le corresponda la participación ciudadana, tendrá la obligación de prestar la asesoría, el apoyo o el auxilio necesario a las personas que pretendan ejercitar los instrumentos de participación y organización ciudadana y/o comunitaria. Para tal efecto, diseñará e instrumentará mecanismos que faciliten el ejercicio pleno de los derechos de los ciudadanos y habitantes.\nIV. Se evaluará objetiva, sistemática y periódicamente, el avance del programa y los resultados de su ejecución, así como su incidencia en la consecución de los objetivos previstos en esta ley.\nV. Con base en las evaluaciones, el programa se modificará y/o adicionará en la medida en que el\nInstituto lo estime necesario.\nARTÍCULO 16. LA PUBLICACIÓN Y DIFUSIÓN DEL PROGRAMA. El Programa de la Cultura de\nParticipación Ciudadana y Comunitaria deberá publicarse en el Periódico Oficial del Gobierno del Estado.\nEl Instituto establecerá los mecanismos para la difusión del programa.\nTÍTULO CUARTO\nLA AGENDA PARA EL DESARROLLO COMUNITARIO\nARTÍCULO 17. LA AGENDA COMUNITARIA ESTATAL. El Ejecutivo del Estado, a través de la\nSecretaría de Gobierno, será el responsable de integrar la agenda comunitaria estatal para identificar, analizar y evaluar los temas y problemas del desarrollo comunitario en el estado, a partir de la participación de la comunidad.\nPara tal efecto, la Secretaría de Gobierno coordinará la elaboración y seguimiento de la agenda a través del Consejo de Participación previsto en el artículo 119 de esta ley.\nARTÍCULO 18. LA AGENDA COMUNITARIA MUNICIPAL. Cada Ayuntamiento, a través de su presidente municipal, será el responsable de integrar la agenda comunitaria municipal para identificar, analizar y evaluar los temas y problemas del desarrollo comunitario del municipio de que se trate, a partir de la participación de la comunidad.\nPara tal efecto, el presidente municipal coordinará la elaboración y seguimiento de la agenda a través del\nConsejo de Participación previsto en el artículo 120 de esta ley.\nARTÍCULO 19. LA COMPETENCIA Y COMPLEMENTARIEDAD DE LA AGENDA COMUNITARIA. Para la elaboración de la agenda comunitaria, se observarán los ámbitos de competencia estatal y municipal, demás disposiciones aplicables.\nLas agendas comunitarias estatal y municipal serán complementarias entre sí.\nARTÍCULO 20. LAS PERSONAS QUE PARTICIPAN EN LA AGENDA COMUNITARIA. En la elaboración de la agenda comunitaria estatal y municipal, podrán participar, en forma especializada e interdisciplinariamente, las personas siguientes:\nI. Las autoridades federales, estatales y/o municipales involucradas en los temas y problemas comunitarios de que se trate.\nII. Los Consejos de Participación Ciudadana y Comunitaria.\nIII. Las instituciones de investigación.\nIV. Las instituciones de educación superior.\nV. Los colegios de profesionistas.\nVI. Las organizaciones sociales.\nVII. Las organizaciones vecinales.\nVIII. Las organizaciones empresariales.\nIX. Las organizaciones no-gubernamentales.\nX. Las asociaciones civiles.\nXI. Los Partidos Políticos.\nXII. Cualquier otra asociación u organización con fin lícito.\nXIII. Cualquier ciudadano o habitante coahuilense.\nEl Ejecutivo del Estado o el Ayuntamiento de que se trate, podrán crear comisiones ciudadanas y/o interinstitucionales para coadyuvar en la elaboración de la agenda comunitaria estatal o municipal, con la participación de las personas a que se refiere este artículo.\nARTÍCULO 21. EL CONTENIDO DE LA AGENDA COMUNITARIA. Toda agenda comunitaria estatal o municipal, contendrá los elementos siguientes:\nI. La identificación de los temas y problemas comunitarios, bajo los criterios siguientes:\n1. La sectorización gubernamental, competencia, ubicación, materia, precisión, interés e importancia.\n2. La relación con el desarrollo sustentable y la calidad de vida de los habitantes.\n3. El monitoreo ciudadano, profesional e interdisciplinario para identificar los problemas de la comunidad.\n4. Cualquier otro criterio para detectar, depurar o clasificar los problemas de la comunidad.\nII. Las cuestiones a tratar, bajo los criterios siguientes:\n1. La delimitación de las causas, efectos y vertientes del tema o problema comunitario.\n2. La problemática social, cultural, económica y política del tema o problema comunitario.\n3. Cualquier otro criterio para delimitar las cuestiones principales del tema o problema comunitario.\nIII. Las políticas, lineamientos o acciones realizadas por las autoridades para tratar el tema o problema comunitario.\nIV. El desarrollo de las líneas de análisis del tema o problema comunitario.\nV. Las propuestas de solución.\nVI. Los esquemas de acopio de información.\nVII. La evaluación de los temas o problemas comunitarios, bajo los criterios siguientes:\n1. La identificación de indicadores confiables para medir objetivamente el seguimiento del tema o problema comunitario.\n2. La creación de observatorios comunitarios.\n3. Cualquier otro criterio objetivo para evaluar los temas o problemas de la comunidad.\nVIII. Los mecanismos de participación de los ciudadanos o habitantes en la solución de los problemas comunitarios.\nARTÍCULO 22. LA COLABORACIÓN EN LA AGENDA COMUNITARIA. Toda autoridad estatal y municipal y la comunidad en general, deberán colaborar entre sí, para la elaboración y seguimiento de la agenda comunitaria de que se trate.\nLas autoridades responsables de integrar la agenda comunitaria estatal o municipal, podrán emitir recomendaciones a las autoridades competentes para solucionar el tema o problema comunitario, según los contenidos de la agenda.\nTÍTULO QUINTO\nLA PARTICIPACIÓN CIUDADANA\nCAPÍTULO PRIMERO\nEL PLEBISCITO\nARTÍCULO 23. EL CONCEPTO DE PLEBISCITO. El plebiscito es la consulta mediante la cual los\nAyuntamientos.\nARTÍCULO 24. EL PLEBISCITO ESTATAL Y MUNICIPAL. El plebiscito estatal se circunscribirá a las decisiones del Ejecutivo del Estado que sean trascendentales para la vida pública de la entidad. trascendentales para la vida pública del municipio de que se trate, incluyéndose los reglamentos de carácter general que éste expida.\nARTÍCULO 25. LOS SUJETOS FACULTADOS PARA SOLICITAR EL PLEBISCITO ESTATAL. Podrán solicitar el plebiscito estatal:\nI. El tres por ciento de los ciudadanos inscritos en la lista nominal de electores del estado, quienes deberán anexar a su solicitud una relación con sus nombres, firmas y claves de su credencial de elector.\nEl Instituto realizará el cotejo respectivo con la lista nominal utilizada en el último proceso electoral.\nIII. El cincuenta por ciento de los miembros del Congreso del Estado.\nIV. La mitad más uno de los Ayuntamientos del estado. En este caso, se requerirá que cada\nAyuntamiento apruebe la solicitud con la mitad más uno de sus miembros.\nARTÍCULO 26. LOS SUJETOS FACULTADOS PARA SOLICITAR EL PLEBISCITO MUNICIPAL.\nPodrán solicitar el plebiscito municipal:\nI. En los municipios cuyo número de electores sea de hasta diez mil, el cuarenta por ciento de los ciudadanos inscritos en la lista nominal de electores del municipio de que se trate. En los municipios que tengan más de diez mil y hasta veinte mil electores, el treinta por ciento de los ciudadanos inscritos en la lista nominal de electores del municipio de que se trate. En los municipios que tengan más de veinte mil y hasta cincuenta mil electores, el veinte por ciento de los ciudadanos inscritos en la lista nominal de electores del municipio de que se trate. En los municipios que tengan más de cincuenta mil y hasta cien mil, el diez por ciento de los ciudadanos inscritos en la lista nominal de electores del municipio de que se trate. En los municipios cuyo número de electores sea mayor a cien mil, el cinco por ciento de los ciudadanos inscritos en la lista nominal de electores del municipio de que se trate.\nEl Instituto realizará el cotejo respectivo con la lista nominal utilizada en el último proceso electoral.\nII. El titular del Poder Ejecutivo del Estado.\nIII. Las dos terceras partes de los miembros del Congreso del Estado.\nIV. El presidente municipal o la mitad más uno de los miembros del Ayuntamiento respectivo.\nARTÍCULO 27. LOS REQUISITOS DE LA SOLICITUD DEL PLEBISCITO. Toda solicitud de plebiscito que se presente ante el Instituto en los términos previstos en esta ley, deberá reunir los requisitos siguientes:\nI. Presentarse por escrito.\nII. Precisar la decisión de gobierno materia del plebiscito.\nIII. Exponer los motivos, razones y fundamentos por los cuales, la decisión se considera trascendental para la vida pública del estado o del municipio de que se trate.\nIV. Cuando se presente por los ciudadanos, incluir la relación que contenga los nombres, firmas y claves de la credencial de elector. En este caso, los solicitantes deberán señalar un representante y domicilio para oír y recibir toda clase de documentos y/o notificaciones.\nPara todos los efectos legales, se entenderá que el representante designado podrá realizar todos los actos necesarios para tramitar el procedimiento.\nARTÍCULO 28. LOS EFECTOS SUSPENSIVOS DE LA PROCEDENCIA DEL PLEBISCITO. La resolución que declare la procedencia del plebiscito, deberá comunicarse por el Instituto dentro de los tres días siguientes al Ejecutivo del Estado o al Ayuntamiento, según se trate.\nEn todo caso, la procedencia del plebiscito suspenderá la ejecución y/o la implementación de la decisión mismo. El plebiscito no procederá contra decisiones ejecutadas y/o implementadas.\nARTÍCULO 29. LA CONVOCATORIA DEL PLEBISCITO. Toda convocatoria de plebiscito que sea emitida por el Instituto estatal en los términos de esta ley, deberá contener los requisitos siguientes:\nI. El objeto del plebiscito.\nII. Una síntesis de los motivos, razones y fundamentos por los cuales la decisión se somete a plebiscito.\nIII. La fecha, el lugar y el formato mediante el cual se consultará a los electores coahuilenses.\nIV. Los demás elementos de información que estime señalar el Instituto.\nARTÍCULO 30. LOS EFECTOS DEL PLEBISCITO. Los resultados del plebiscito serán obligatorios para el Ejecutivo del Estado o para los Ayuntamientos, siempre y cuando una de las opciones obtenga la mayoría de la votación válidamente emitida y ésta corresponda cuando menos, al veinte porciento de los ciudadanos inscritos en la lista nominal de electores del estado o del municipio, según se trate.\nEn caso contrario, el plebiscito únicamente tendrá el carácter de recomendación.\nEn todo caso, el Instituto deberá comunicar al Ejecutivo del Estado o al Ayuntamiento correspondiente, los resultados del plebiscito dentro de los tres días siguientes al en que se verificó la consulta.\nToda omisión, acto o resolución del Poder Ejecutivo o de los Ayuntamientos que violen los resultados vinculatorios del plebiscito, podrán ser impugnadas en los términos de la ley de la materia.\nCAPÍTULO SEGUNDO\nEL REFERENDO\nARTÍCULO 31. EL CONCEPTO DEL REFERENDO. El referendo es la consulta mediante la cual los ciudadanos electores coahuilenses aprueban o rechazan una iniciativa de ley o decreto o, en su caso, El referendo se tramitará conforme al procedimiento previsto en esta ley.\nARTÍCULO 32. EL OBJETO DEL REFERENDO. El objeto del referendo será:\nI. Determinar la creación, modificación, adición, derogación o abrogación de la norma o normas de la ley o decreto materia del referendo; ó\nII. Determinar la observancia o inobservancia de la norma o normas de la ley o decreto aprobado por\nARTÍCULO 33. LOS SUJETOS FACULTADOS PARA SOLICITAR EL REFERENDO. Podrán solicitar el referendo:\nI. El tres por ciento de los ciudadanos inscritos en la lista nominal de electores del estado, quienes deberán anexar a su solicitud una relación con sus nombres, firmas y claves de su credencial de elector.\nEl Instituto realizará el cotejo respectivo con la lista nominal utilizada en el último proceso electoral.\nII. El cincuenta por ciento de los miembros del Congreso del Estado.\nIV. La mitad más uno de los Ayuntamientos del estado. En este caso, se requerirá que cada\nAyuntamiento apruebe la solicitud con la mitad más uno de sus miembros.\nARTÍCULO 34. LOS REQUISITOS DE LA SOLICITUD DEL REFERENDO. Toda solicitud de referendo que se presente ante el Instituto en los términos previstos en esta ley, deberá reunir los requisitos siguientes:\nI. Presentarse por escrito.\nII. Precisar la iniciativa de ley o decreto o, en su caso, la ley o decreto o el artículo o artículos que sean materia del referendo.\nIII. Señalar las razones, motivos y fundamentos por los cuales la iniciativa correspondiente, la ley o el decreto o parte de su articulado deben someterse al referendo.\nIV. Cuando se presente por los ciudadanos, incluir la relación que contenga nombres, firmas y claves de la credencial de elector. En este caso, los solicitantes deberán señalar un representante y domicilio para oír y recibir toda clase de documentos y/o notificaciones.\nPara todos los efectos legales, se entenderá que el representante podrá realizar todos los actos necesarios para tramitar el procedimiento correspondiente.\nARTÍCULO 35. LOS EFECTOS SUSPENSIVOS DE LA PROCEDENCIA DEL REFERENDO. La resolución que declare la procedencia del referendo deberá comunicarse por el Instituto dentro de los tres días siguientes al Poder Legislativo del Estado.\nLa procedencia del referendo para los efectos previstos en la fracción I del artículo 32 de esta ley, no suspenderá el trámite legislativo de la iniciativa de ley o decreto hasta en tanto se conozcan los resultados del mismo.\nEn el caso previsto en la fracción II del artículo 32 de esta ley, el Congreso del Estado deberá legislar las disposiciones transitorias conducentes en la ley o decreto aprobado materia del referendo.\nARTÍCULO 36. LA CONVOCATORIA DEL REFERENDO. Toda convocatoria de referendo que sea emitida por el Instituto en los términos previstos en esta ley, deberá contener los requisitos siguientes:\nI. Precisar el objeto del referendo.\nII. Contener una síntesis de las razones, motivos y fundamentos por los cuales la iniciativa correspondiente, la ley, el decreto, o bien, parte de su articulado se someten a referendo.\nIII. Señalar la fecha, el lugar y el formato mediante el cual se consultará a los ciudadanos electores coahuilenses.\nIV. Los demás elementos informativos que estime necesario señalar el Instituto.\nARTÍCULO 37. LOS EFECTOS DEL REFERENDO. Los resultados del referendo serán obligatorios para la lista nominal de electores del estado.\nEn caso contrario, el referendo únicamente tendrá el carácter de recomendación. dentro de los tres días siguientes a la consulta.\nARTÍCULO 38. EL TRÁMITE LEGISLATIVO PARA INSTRUMENTAR LOS EFECTOS OBLIGATORIOS\nDEL REFERENDO. Una vez que el Instituto notifique al Congreso del Estado o, en su caso, a la\nDiputación Permanente los efectos obligatorios del referendo, se turnará a la comisión correspondiente para que ésta, sin demora, presente el dictamen en el sentido del referendo al Congreso del Estado, para su discusión y aprobación.\nToda omisión, acto o resolución del Congreso del Estado o de la Diputación Permanente que viole los resultados vinculatorios del referendo, podrá ser impugnada en los términos de la ley de la materia.\nCAPÍTULO TERCERO\nLA INICIATIVA POPULAR\n(REFORMADO, P.O. 27 DE JUNIO DE 2008)\nARTÍCULO 39. EL CONCEPTO DE INICIATIVA POPULAR. La iniciativa popular es el derecho de los ciudadanos coahuilenses y de los que sin serlo acrediten haber residido en el Estado por más de tres años para iniciar leyes, decretos, reglamentos o normas administrativas de carácter general.\nARTÍCULO 40. EL OBJETO DE LA INICIATIVA POPULAR. La iniciativa popular tendrá por objeto:\nI. Que el Poder Legislativo del Estado conozca de la creación, modificación, adición, derogación o abrogación de leyes o decretos.\nII. Que el Poder Ejecutivo del Estado conozca de la creación, modificación, adición, derogación o abrogación de reglamentos o normas administrativas de carácter general dentro del ámbito de su competencia estatal.\nIII. Que el Ayuntamiento de que se trate conozca de la creación, modificación, adición, derogación o de su competencia municipal.\nARTÍCULO 42. LOS REQUISITOS DE LA INICIATIVA POPULAR. Toda iniciativa popular que se tramite ante la autoridad competente en los términos previstos en esta ley, deberá reunir los requisitos siguientes:\nI. Presentarse por escrito.\nII. Dirigirse a la autoridad competente para conocer de la iniciativa.\nIII. Presentarse con exposición de motivos y con proyecto de articulado.\nIV. Señalar un domicilio para oír y recibir toda clase de documentos y/o notificaciones, en el lugar donde resida la autoridad competente para conocer de la iniciativa.\nV. Nombre y firma de quien la presenta.\nEl solicitante podrá designar un representante para oír y recibir notificaciones, mismo que podrá ser facultado para realizar todos los actos correspondientes al trámite de la iniciativa popular.\nARTÍCULO 43. EL TRÁMITE PARA DECIDIR LA PROCEDENCIA DE LA INICIATIVA POPULAR EN\nMATERIA LEGISLATIVA. Toda iniciativa popular en materia legislativa que se presente ante el Poder\nLegislativo del Estado, se sujetará al trámite legislativo siguiente:\nI. El Congreso del Estado o, en su caso, la Diputación Permanente turnará la iniciativa a una comisión que se integrará con siete diputados.\nEl funcionamiento de la comisión se regirá por la Ley Orgánica del Congreso del Estado.\nII. La comisión resolverá sobre la procedencia de la iniciativa, bajo las reglas siguientes:\n(REFORMADO, P.O. 27 DE JUNIO DE 2008)\n1. Verificará que la iniciativa cumpla con los requisitos previstos en el artículo anterior.\n(REFORMADO, P.O. 27 DE JUNIO DE 2008)\n2. En caso de que falte alguno de los requisitos previstos en el artículo anterior, se notificará al solicitante para que en un plazo no mayor de quince días hábiles presente la información requerida.\n(REFORMADO, P.O. 27 DE JUNIO DE 2008)\n3. Una vez cumplidos los requisitos necesarios para la iniciativa popular, la comisión resolverá, en su caso, sobre la procedencia de la misma.\n(REFORMADO, P.O. 27 DE JUNIO DE 2008)\n4. Si el solicitante no cumple con lo previsto en el numeral 2 de esta fracción, la comisión declarará la improcedencia de plano en los términos previstos por la ley.\n(REFORMADO, P.O. 27 DE JUNIO DE 2008)\n5. La comisión notificará al solicitante o, en su caso, a su representante la resolución sobre la procedencia o improcedencia de la iniciativa popular.\n6. La iniciativa que se declare procedente se sujetará al proceso legislativo que establece la\n(REFORMADO, P.O. 27 DE JUNIO DE 2008)\n7. En la discusión de la iniciativa, podrán participar con voz hasta tres personas autorizadas por los solicitantes ciudadanos.\nIII. Toda omisión, acto o resolución del Congreso del Estado o de la Diputación Permanente que viole el trámite de la iniciativa popular, podrá ser impugnada en los términos de la ley de la materia.\nARTÍCULO 44. EL TRÁMITE PARA DECIDIR LA PROCEDENCIA DE LA INICIATIVA POPULAR EN\nMATERIA ADMINISTRATIVA. Toda iniciativa popular en materia administrativa que se presente ante el\nI. El Ejecutivo del Estado, por conducto de la Secretaría de Gobierno, verificará que la iniciativa cumpla con los requisitos previstos en el artículo 42.\nIII. El Ejecutivo del Estado, emitirá la declaratoria de procedencia de la iniciativa, bajo las reglas siguientes:\n1. En caso de que falte alguno de los requisitos previstos en el artículo 42, se notificará al requerida.\n(REFORMADO, P.O. 27 DE JUNIO DE 2008)\n2. Una vez cumplidos los requisitos necesarios para la iniciativa popular por parte del solicitante, la Secretaría de Gobierno resolverá, en su caso, sobre la procedencia de la misma.\n(REFORMADO, P.O. 27 DE JUNIO DE 2008)\n3. Si el solicitante no cumple con lo previsto en el numeral 1 de esta fracción, la Secretaría de\nGobierno declarará la improcedencia de plano en los términos previstos por esta ley y notificará al solicitante o, en su caso, a su representante la resolución sobre la procedencia o improcedencia de la iniciativa popular.\n4. (DEROGADO, P.O. 27 DE JUNIO DE 2008)\n(REFORMADO, P.O. 27 DE JUNIO DE 2008)\n5. La iniciativa que se declare procedente, se sujetará al proceso de revisión de toda iniciativa de reglamento o norma administrativa de carácter general que establecen la Ley Orgánica de la Administración Pública del Estado y demás disposiciones aplicables.\n(REFORMADO, P.O. 27 DE JUNIO DE 2008)\n6. En la revisión de la iniciativa podrán participar él o los solicitantes.\n(REFORMADA, P.O. 27 DE JUNIO DE 2008)\nIV. Toda omisión, acto o resolución del Poder Ejecutivo del Estado que viole el trámite de la iniciativa popular, podrá ser impugnada en los términos de la ley de la materia.\nV. (DEROGADA, P.O. 27 DE JUNIO DE 2008)\nARTÍCULO 45. EL TRÁMITE PARA DECIDIR LA PROCEDENCIA DE LA INICIATIVA POPULAR EN\nMATERIA MUNICIPAL. Toda iniciativa popular en materia municipal que se presente ante los\nAyuntamientos, se sujetará al trámite siguiente:\nI. El Ayuntamiento, a través de su cabildo, turnará la iniciativa a una comisión que se integrará con siete munícipes.\nEl funcionamiento de la comisión se regirá por el Código Municipal para el Estado.\nII. La comisión resolverá sobre la procedencia de la iniciativa, bajo las reglas siguientes:\n1. Verificará que la iniciativa cumpla con los requisitos previstos en el artículo 42.\n2. En caso de que falte alguno de los requisitos previstos en el artículo 42, se notificará al requerida.\n3. Una vez cumplidos los requisitos necesarios para la iniciativa popular, la comisión resolverá, en su caso, sobre la procedencia de la misma.\n4. Si el solicitante no cumple con lo previsto en el numeral 2 de esta fracción, la comisión declarará la improcedencia de plano en los términos previstos por esta ley.\n5. La iniciativa popular que se declare procedente, se sujetará al proceso reglamentario que señala el Código Municipal para el Estado.\n6. En la revisión de la iniciativa podrán participar los solicitantes.\n(REFORMADA, P.O. 27 DE JUNIO DE 2008)\nIII. Toda omisión, acto o resolución de los Ayuntamientos que viole el trámite de la iniciativa popular, podrá ser impugnada en los términos de la ley de la materia.\nIV. (REFORMADA, P.O. 27 DE JUNIO DE 2008)\n(REFORMADO, P.O. 27 DE JUNIO DE 2008)\nARTÍCULO 46. NUEVA PRESENTACIÓN DE INICIATIVA POPULAR QUE SE DECLARE\nIMPROCEDENTE. Toda iniciativa popular que haya sido declarada improcedente, podrá presentarse nuevamente al año siguiente, contado a partir de la fecha de la notificación correspondiente, con las modificaciones, adiciones y/o correcciones necesarias para que proceda en los términos que establece esta ley.\nARTÍCULO 47. LA PUBLICACIÓN, DOCUMENTACIÓN, COMPILACIÓN, DIFUSIÓN Y PREMIO DE\nLAS INICIATIVAS POPULARES. Toda iniciativa popular deberá ser publicada en el Periódico Oficial del\nGobierno del Estado.\nEl Congreso del Estado, el Ejecutivo del Estado y los Ayuntamientos, en forma separada o conjunta documentarán, compilarán y difundirán las iniciativas populares que hayan aprobado.\nLas autoridades realizarán un reconocimiento público a los ciudadanos que hubieren presentado una iniciativa popular que haya sido aprobada e instrumentarán, en forma conjunta, un mecanismo de difusión de la iniciativa.\nCAPÍTULO CUARTO\nREGLAS COMUNES PARA EL PLEBISCITO, EL REFERENDO Y LA INICIATIVA POPULAR\nSECCIÓN PRIMERA\nARTÍCULO 48. LOS PRINCIPIOS DEL PROCEDIMIENTO. Todo procedimiento del plebiscito o del referendo, se sujetará a los principios de constitucionalidad, legalidad, imparcialidad, objetividad, certeza e independencia.\nPara reformar, adicionar o derogar las figuras del plebiscito, referendo e iniciativa popular, sus procedimientos y toda norma relacionada con ellas que se prevea en esta ley, se requerirá de la aprobación de las dos terceras partes de los miembros del Congreso del Estado. En caso contrario, las reformas, adiciones o derogaciones serán invalidas.\nARTÍCULO 49. LAS BASES DEL PROCEDIMIENTO. El procedimiento del plebiscito o del referendo, se sujetará a las bases siguientes:\nI. El Instituto se encargará de preparar, organizar, vigilar, computar y declarar los efectos del plebiscito o del referendo.\nEn todo caso, el Instituto estará facultado para emitir los acuerdos que estime necesarios para el desarrollo del procedimiento.\nII. Para organizar el plebiscito o el referendo, el Instituto tomará en cuenta las reglas siguientes:\n1. Según las necesidades del procedimiento, su naturaleza y el ámbito territorial de aplicación, establecerá la estructura para realizar el plebiscito o el referendo.\n2. En todo caso, podrá establecer las instancias que se requieran, mismas que tendrán las facultades y atribuciones que les confiera el propio Instituto.\n3. Las mesas directivas se integrarán de conformidad a lo que establece la Ley de Instituciones\nPolíticas y Procedimientos Electorales para el Estado de Coahuila. Sus funcionarios tendrán para los efectos de esta ley las mismas facultades y obligaciones que dicho ordenamiento jurídico les confiere.\n4. Según las necesidades particulares de cada plebiscito o referendo, el Instituto decidirá el número y ubicación de las casillas, debiendo establecerse cuando menos una casilla por cada cinco secciones contenidas en el área territorial donde se aplicará el procedimiento, en el caso del área urbana y de una para el caso del área rural.\nIII. La solicitud del plebiscito o del referendo se presentará ante el Instituto. Dentro de los veinte días siguientes, el Instituto decidirá la procedencia del plebiscito o del referendo, bajo las reglas siguientes:\n1. Pondrá sin demora a la vista la solicitud en un lugar de su oficina visible al público, para que cualquier ciudadano y/o autoridad estatal o municipal manifieste lo que a su juicio proceda.\nEn el caso de las autoridades estatales o municipales cuyos actos o decisiones se propongan someter al plebiscito o al referendo, el Instituto deberá enviarles una copia de la solicitud de que se trate dentro de los tres días siguientes de haberla recibido.\n2. En caso de que la solicitud sea vaga, obscura o incompleta, el Instituto requerirá a los solicitantes para que subsanen la irregularidad dentro de los tres días siguientes. Hecho lo cual, el Instituto resolverá lo que conforme a derecho proceda.\n3. Si se declara procedente la solicitud, el Instituto iniciará el plebiscito o referendo mediante realización de la consulta de que se trate. difundirse en los medios de comunicación oficiales. Para mayor divulgación, la convocatoria mayor afluencia al público.\nIV. El Instituto instrumentará una campaña de información, bajo las reglas siguientes:\n1. El objeto consistirá en que los ciudadanos conozcan los argumentos en pro y en contra del objeto de la consulta.\n2. La campaña se difundirá en los medios de comunicación oficiales. Se podrán utilizar medios de comunicación, debates, foros o cualquier otra forma de comunicación confiable, objetiva, transparente e ilustrativa.\n3. Cualquiera de las personas que soliciten el plebiscito o referendo o tres mil ciudadanos electores coahuilenses o más, podrán participar directamente en la campaña de información, conforme a las reglas siguientes:\na) Presentarán ante el Instituto una solicitud de registro de campaña, a la que anexarán una relación con sus nombres, firmas y claves de su credencial de elector.\nb) Se inscribirán como partidarios en pro o en contra del objeto de la consulta, según su posición.\nc) Presentarán la metodología, formato, objeto y participantes de su campaña de información.\nd) El Instituto deberá garantizar la participación en la campaña de información registrada por los ciudadanos.\nV. El Instituto determinará el número de opciones y sus variantes que se consultarán a los ciudadanos electores coahuilenses en el plebiscito o en el referendo, con base en la solicitud del procedimiento de que se trate, la opinión de las autoridades o el debate público que se genere.\nVI. El Instituto podrá auxiliarse de las autoridades estatales y/o municipales, de los consejos de participación, de las instituciones de educación superior, de investigación, de organismos, asociaciones u organizaciones públicas, sociales o civiles.\nEl Ejecutivo del Estado y los Ayuntamientos deberán prestar al Instituto el apoyo y auxilio necesarios para llevar a cabo la consulta.\nVII. Si durante el desarrollo del procedimiento, existen datos fundados que revelen que la consulta pudiere generar desorden público o un ambiente de intimidación para los ciudadanos, el Instituto, previa consulta con los solicitantes gubernamentales y del Congreso del Estado, suspenderá temporal o definitivamente la realización del plebiscito o del referendo hasta que existan condiciones para la consulta de que se trate.\nPara tal efecto, el Instituto deberá emitir un informe fundado y motivado a la ciudadanía. La suspensión podrá ser impugnada ante el Tribunal Electoral en los términos que establezca la ley de la materia.\nVIII. Los resultados del plebiscito o del referendo se publicarán en el Periódico Oficial del Gobierno del\nEstado. Para mayor difusión, los resultados se podrán publicar o difundir en los medios de comunicación o en los lugares de mayor afluencia al público.\nARTÍCULO 50. LOS LÍMITES DEL PLEBISCITO Y DEL REFERENDO. Todo procedimiento del plebiscito o del referendo, se sujetará a los límites y condiciones siguientes:\nI. En ningún caso, el procedimiento procederá noventa días naturales antes del inicio del proceso electoral local o noventa días después de su terminación, conforme a los plazos que establezca la ley de la materia.\nII. Los procedimientos se irán programando en la medida en que exista la capacidad real del Instituto para organizarlos, de acuerdo a su naturaleza, complejidad, plazos y etapas previstas en esta ley; pero en todo caso, no podrán exceder de dos procedimientos por año sean plebiscitos o referendos.\nIII. No podrán realizarse en un solo procedimiento dos o más consultas, salvo que el Instituto autorice llevar a cabo los plebiscitos y/o referendos en un solo procedimiento bajo las modalidades que juzgue pertinentes, según su naturaleza, complejidad y economía procesal.\nIV. Si se trata de solicitudes sobre un mismo tema o relacionados en forma lógica, se podrán acumular en un solo procedimiento.\nARTÍCULO 51. EL TRÁMITE PREFERENTE DE DOS O MÁS SOLICITUDES DE PLEBISCITO Y/O\nREFERENDO. Cuando se presenten dos o más solicitudes de plebiscito y/o de referendo, el Instituto las tramitará de la siguiente manera:\nI. La preferencia del procedimiento se regirá por su oportunidad en la presentación.\nII. Si se trata de solicitudes ciudadanas y/o gubernamentales presentadas al mismo tiempo, se dará preferencia a la instancia ciudadana siempre que se cumpla en tiempo y forma el porcentaje ciudadano requerido por esta ley.\nIII. Si se trata de dos solicitudes ciudadanas presentadas al mismo tiempo, se preferirá aquella que tenga mayor apoyo ciudadano.\nIV. Por excepción y en todos los casos previstos en las fracciones que anteceden, el Instituto podrá declarar el trámite preferente del plebiscito y/o referendo basado en el criterio más trascendental para el interés público, según los lineamientos siguientes:\n1. La naturaleza del tema o problema comunitario.\n2. Su impacto en el desarrollo comunitario sustentable.\n3. La premura o urgencia de resolver el asunto.\n4. El ámbito de comprensión dentro de la comunidad.\nSECCIÓN SEGUNDA\nLAS FORMAS ALTERNATIVAS DE ACCESO CIUDADANO\nARTÍCULO 52. LAS FORMAS ALTERNATIVAS DE ACCESO CIUDADANAS EN EL PLEBISCITO O\nEL REFERENDO. En el plebiscito o el referendo, los ciudadanos tendrán derecho a las siguientes opciones:\nI. El procedimiento preparatorio de firmas.\nII. La suscripción directa de las autoridades.\nIII. La comisión ciudadana y/o interinstitucional.\nIV. La consulta ciudadana.\nARTÍCULO 53. EL PROCEDIMIENTO PREPARATORIO DE FIRMAS. El procedimiento preparatorio de firmas, se sujetará a las bases siguientes:\nI. Podrá solicitarlo, en el caso del plebiscito estatal y del referendo, el uno punto cinco por ciento de los ciudadanos inscritos en la lista nominal de electores del estado.\nII. La solicitud deberá cumplir con los requisitos que establece esta ley para el plebiscito o el referendo, respectivamente.\nIII. El Instituto dentro de los diez días siguientes calificará la procedencia del procedimiento, conforme a las bases siguientes:\n1. En caso de que la solicitud no cumpla con los requisitos que establece esta ley, el Instituto cinco días siguientes. Hecho lo cual, el Instituto resolverá sobre su procedencia.\n2. En caso de que la solicitud cumpla con los requisitos que establece esta ley, el Instituto iniciará el procedimiento preparatorio de firmas de la manera siguiente:\na) Instrumentará una campaña de difusión para recabar las firmas ciudadanas necesarias, para que en su caso, proceda el plebiscito o el referendo, según se trate.\nb) Establecerá el lugar o lugares donde los ciudadanos podrán adherirse a la solicitud de que se trate. En este caso, el Instituto recabará las firmas ciudadanas, previa consulta y/o cotejo respectivo.\nc) El plazo para que los ciudadanos manifiesten su adhesión a la solicitud, no podrá exceder de quince días naturales contados a partir de la fecha en que se instalen los lugares autorizados para recibir las firmas. El Instituto se encargará de computar este plazo y hacerlo saber a la ciudadanía en general.\nIV. Para la instrumentación de la campaña de difusión, el Instituto deberá cumplir los siguientes requisitos:\n1. Expedirá una convocatoria abierta para que la ciudadanía conozca el objeto de la solicitud del plebiscito o referendo. En este caso, los solicitantes podrán anexar un proyecto de convocatoria.\n2. Organizará foros de información, de análisis y de discusión sobre el objeto de la solicitud del plebiscito o referendo.\n3. Establecerá mecanismos confiables, objetivos y expeditos para recabar las firmas ciudadanas.\n4. En la instrumentación de la campaña de difusión, podrán participar los ciudadanos solicitantes y la comunidad en general, en los términos previstos por esta ley.\nV. Transcurrido el plazo para recibir las firmas ciudadanas, el Instituto declarará si procede o no el plebiscito o referendo.\nARTÍCULO 54. EL PROCEDIMIENTO DE SUSCRIPCIÓN DIRECTA DE LAS AUTORIDADES. El procedimiento de suscripción directa de las autoridades, se sujetará a las bases siguientes:\nI. Podrán solicitarlo cien ciudadanos a cualquiera de las autoridades que puedan promover el plebiscito o el referendo.\nII. Las autoridades deberán fundar y motivar por escrito su respuesta, afirmativa o negativa, dentro de los quince días hábiles siguientes a la fecha en que se haya presentado la solicitud.\nIII. En caso de que la autoridad estime procedente la solicitud, suscribirá en representación de los ciudadanos la solicitud de que se trate, para que el Instituto califique su procedencia.\nIV. La autoridad que suscriba la solicitud ciudadana podrá corregirla, modificarla y/o adicionarla para su presentación ante el Instituto.\nARTÍCULO 55. EL PROCEDIMIENTO DE CREACIÓN DE LA COMISIÓN CIUDADANA Y/O\nINTERINSTITUCIONAL. El procedimiento de creación de la comisión ciudadana y/o interinstitucional, se sujetará a las bases siguientes:\nI. Podrán solicitarlo cien ciudadanos a cualquiera de las autoridades que puedan promover el plebiscito o el referendo. comisión en los términos de las disposiciones aplicables.\nIII. La comisión emitirá su opinión a las autoridades de que se trate.\nIV. La opinión será la base para valorar si la autoridad decide o no, suscribir directamente la solicitud del plebiscito o del referendo.\nARTÍCULO 56. EL PROCEDIMIENTO DE LA CONSULTA CIUDADANA. El procedimiento de la consulta ciudadana, se sujetará a las reglas siguientes:\nI. Podrán solicitarlo cien ciudadanos a cualquiera de las autoridades competentes, para que realicen una consulta ciudadana para medir el apoyo ciudadano de la solicitud del plebiscito o referendo.\nII. Las autoridades a quienes se dirija la petición deberán fundar y motivar por escrito su respuesta, afirmativa o negativa, dentro de los quince días hábiles siguientes a la fecha en que se haya presentado la solicitud.\nIII. En caso de que la autoridad estime procedente la solicitud, instrumentará la consulta ciudadana.\nIV. Los resultados serán definitivos para valorar si la autoridad decide o no suscribir directamente la solicitud del plebiscito o referendo.\nSECCIÓN TERCERA\nLAS CAUSAS DE IMPROCEDENCIA\nARTÍCULO 57. LAS CAUSAS DE IMPROCEDENCIA DEL PLEBISCITO O DEL REFERENDO SE\nDECRETAN DE OFICIO O A PETICIÓN DE PARTE. El Instituto decretará de oficio o a petición de parte, la improcedencia del procedimiento del plebiscito o referendo.\n(REFORMADO, P.O. 27 DE JUNIO DE 2008)\nARTÍCULO 58. LA IMPROCEDENCIA DE LA INICIATIVA POPULAR SE DECRETA DE OFICIO O A\nPETICIÓN DE PARTE. La autoridad competente que conozca de la iniciativa popular decretará de oficio\nARTÍCULO 59. LAS CAUSAS DE IMPROCEDENCIA DEL PLEBISCITO. Las causas de improcedencia del plebiscito son:\nI. Cuando la decisión no sea trascendental para el orden público o interés social del estado o del municipio.\nII. Cuando, en los casos en que la solicitud fuere realizada por ciudadanos, las firmas de apoyo no sean auténticas, los ciudadanos firmantes no estén inscritos en el listado nominal de electores o los trate.\nIII. Cuando el objeto del plebiscito se haya consumado por haberse ejecutado el acto o decisión por la autoridad competente y, por tanto, no puedan restituirse las cosas a la situación que guardaban con anterioridad.\nIV. Cuando la solicitud incumpla con los requisitos para ejercer el derecho de petición.\nV. Cuando la solicitud incumpla con los requisitos que establece la presente ley.\nVI. Cuando se trate de las materias siguientes:\n1. Financieras, tributarias, fiscales, presupuestales, de ingresos o similares.\n2. Régimen interno de la administración pública estatal o municipal.\n3. Los actos cuya realización sea obligatoria en los términos de las leyes aplicables.\n4. Los nombramientos o destituciones de funcionarios públicos del gobierno del estado o del municipio.\nVII. Cuando en el año en que se presente la solicitud tengan verificativo elecciones para renovación de cargos de elección popular del estado o del municipio, en el supuesto que prevé la fracción I del artículo 50 de esta ley.\nVIII. En los demás casos en que la improcedencia resulte por analogía o por disposición legal aplicable.\nEn todo caso la declaración de improcedencia será recurrible ante el Tribunal Electoral del Poder Judicial del Estado.\nARTÍCULO 60. LAS CAUSAS DE IMPROCEDENCIA DEL REFERENDO. Las causas de improcedencia del referendo son:\nI. En los casos en que la solicitud fuere realizada por ciudadanos, cuando las firmas de apoyo no sean auténticas, los ciudadanos firmantes no estén inscritos en la lista nominal de electores o los datos vaciados en el escrito no concuerden con los datos registrados en la lista nominal de que se trate.\nII. Cuando la solicitud incumpla con los requisitos para ejercer el derecho de petición.\nIII. Cuando la solicitud incumpla con los requisitos que establece la presente ley.\nIV. Cuando se trate de las materias siguientes:\n1. Financieras, tributarias, fiscales, presupuestales, de ingresos o similares.\n2. Régimen interno de la administración pública estatal o municipal.\n3. Regulación interna del Congreso del Estado y de la Contaduría Mayor de Hacienda.\n4. Regulación interna de los órganos de la función jurisdiccional del estado.\nMexicanos.\n6. Los actos cuya realización sea obligatoria en los términos de las leyes aplicables.\nV. Cuando en el año en que se presente la solicitud tengan verificativo elecciones para la renovación de los cargos de elección popular del estado o del municipio, en el supuesto que prevé la fracción I del artículo 50 de esta ley.\nVI. En los demás casos en que la improcedencia resulte por analogía o por disposición legal aplicable.\nARTÍCULO 61. LAS CAUSAS DE IMPROCEDENCIA DE LA INICIATIVA POPULAR. Las causas de improcedencia de la iniciativa popular son:\nI. Cuando vaya directamente en contra de la Constitución Política de los Estados Unidos Mexicanos.\nII. Cuando en materia de legislación secundaria o de reglamentación vaya directamente en contra de salvo que la iniciativa popular proponga una reforma constitucional local en este último caso.\nIII. (DEROGADA, P.O. 27 DE JUNIO DE 2008)\nIV. Cuando la solicitud incumpla con los requisitos para ejercer el derecho de petición.\nV. Cuando la solicitud incumpla con los requisitos que establece la presente ley.\nVI. Cuando se trate de las materias siguientes:\n1. Financieras, tributarias, fiscales, presupuestales o de ingresos.\n2. Las demás que determinen las leyes aplicables.\nVII. En los demás casos en que la improcedencia resulte por analogía o por disposición legal aplicable.\nSECCIÓN CUARTA\nLOS PLAZOS\nARTÍCULO 62. LA NATURALEZA DE LOS PLAZOS. En los procedimientos del plebiscito, referendo e iniciativa popular, los plazos son improrrogables.\nARTÍCULO 63. EL CÓMPUTO DE LOS PLAZOS. Los plazos se contarán por días hábiles, salvo que esta ley establezca los días naturales.\nARTÍCULO 64. EL PLAZO PARA LOS CASOS NO PREVISTOS. Cuando esta ley no fije plazo especial, el término será de tres días.\nSECCIÓN QUINTA\nLAS NOTIFICACIONES\nARTÍCULO 65. LOS NOTIFICADORES. Las notificaciones durante los procedimientos del plebiscito o referendo, se realizarán por los empleados del Instituto que se comisionen de manera general o particular. competente que conozca de la iniciativa y que se comisionen de manera general o particular.\nARTÍCULO 66. EL DOMICILIO PARA RECIBIR NOTIFICACIONES Y/O DOCUMENTOS. Los en su primera diligencia o audiencia, su domicilio y un representante para oír y recibir toda clase de notificaciones y/o documentos, en el lugar donde resida el Instituto.\nEn el caso de la iniciativa popular, el interesado designará en su solicitud o en su primera diligencia o audiencia, su domicilio y un representante, en su caso, para oír y recibir toda clase de notificaciones y/o documentos, en el lugar donde resida la autoridad competente para conocer de la iniciativa.\nARTÍCULO 67. EL LUGAR PARA HACER NOTIFICACIONES. Las notificaciones se harán en el lugar que señalaron las partes o en el local del Instituto o de la autoridad competente, según se trate.\nARTÍCULO 68. LA FORMA DE REALIZAR LAS NOTIFICACIONES DE LAS RESOLUCIONES. Toda resolución se notificará por vía de oficio que se entregará en el lugar señalado por las partes o en forma personal.\nEl notificador hará constar la forma de la notificación.\nARTÍCULO 69. LAS NOTIFICACIONES POR LISTA. El Instituto publicará diariamente una lista de acuerdos. En ella expresará el número del expediente, las partes, el procedimiento y el rubro del asunto acordado.\nLa lista se publicará el día laborable siguiente al día de la resolución, a más tardar, en la última hora laborable.\nARTÍCULO 70. LOS EFECTOS DE LAS NOTIFICACIONES. Las notificaciones surten efecto el mismo día que se hagan o el día que se recibieron en el domicilio señalado.\nLas notificaciones por lista surten efecto al día siguiente laborable de su publicación, a menos que la resolución respectiva se hubiere notificado antes, en forma personal.\nSECCIÓN SEXTA\nREGLAS COMPLEMENTARIAS DEL PLEBISCITO,\nREFERENDO E INICIATIVA POPULAR\nARTÍCULO 71. LA GARANTÍA JURISDICCIONAL DE SOLUCIÓN DE CONFLICTOS. Toda controversia del procedimiento del plebiscito, del referendo y de la iniciativa popular, será resuelta por el Tribunal\nElectoral de conformidad con la ley de la materia.\nARTÍCULO 72. EL ORDENAMIENTO LEGAL SUPLETORIO DEL PROCEDIMIENTO DEL\nPLEBISCITO, REFERENDO E INICIATIVA POPULAR. A falta de norma expresa, en el procedimiento del plebiscito, referendo e iniciativa popular se aplicarán en lo conducente las disposiciones relativas a las leyes electorales o de participación ciudadana en el estado. establecimiento de la figura jurídica de representantes de los partidos políticos o coaliciones, así como sus facultades, derechos y atribuciones.\nARTÍCULO 73. LA LISTA NOMINAL PARA REALIZAR EL COTEJO DEL PORCENTAJE CIUDADANO. utilizada en el último proceso electoral.\nEl Instituto establecerá los mecanismos que estime conducentes para realizar el cotejo respectivo.\nTÍTULO SEXTO\nLA PARTICIPACIÓN COMUNITARIA\nCAPÍTULO PRIMERO\nLA CONSULTA POPULAR\nARTÍCULO 74. EL CONCEPTO DE CONSULTA POPULAR. La consulta popular es el instrumento mediante el cual los habitantes coahuilenses emiten su opinión y/o propuestas de solución a asuntos de interés público o problemas comunitarios del lugar donde residan.\nARTÍCULO 75. LA CONSULTA POPULAR PUEDE SOLICITARSE POR LOS HABITANTES\nCOAHUILENSES. La consulta popular podrá solicitarse por cien o más habitantes coahuilenses del lugar donde se ubique el asunto de interés público o el problema comunitario a consultar.\nARTÍCULO 76. LA SOLICITUD DE LA CONSULTA POPULAR. Toda solicitud para convocar a una consulta popular, debe reunir los requisitos siguientes:\nI. Presentarse por escrito debidamente firmado por los solicitantes.\nII. Señalar domicilio para oír y recibir toda clase de documentos y/o notificaciones.\nLos solicitantes podrán designar un representante común que podrá realizar todos los actos necesarios para tramitar la solicitud.\nIII. Dirigirse a la autoridad competente.\nIV. Señalar el objeto, el procedimiento, la metodología y la forma de la consulta.\nV. Precisar la fecha, el lugar y el formato mediante el cual se consultará a los habitantes coahuilenses.\nARTÍCULO 77. LA RESPUESTA DE LA SOLICITUD DE LA CONSULTA POPULAR. La autoridad estatal o municipal competente resolverá sobre la procedencia de la consulta popular, bajo las reglas siguientes:\nI. La autoridad de que se trate dentro de los veinticinco días siguientes resolverá la procedencia y, en su caso, expedirá la convocatoria.\nII. Determinará el objeto, el procedimiento, la metodología y la forma de la consulta.\nIII. Determinará la fecha, el lugar y el formato mediante el cual se consultará a los habitantes coahuilenses.\nIV. Según las disponibilidades presupuestales, la autoridad podrá concurrir con recursos financieros, materiales y humanos para coadyuvar en la ejecución de la consulta.\nARTÍCULO 78. LA CONVOCATORIA DE LA CONSULTA POPULAR. La consulta popular será convocada por los titulares de las dependencias y/o entidades competentes del gobierno estatal y/o municipal del lugar donde se lleve a cabo la consulta.\nARTÍCULO 79. EL CONTENIDO DE LA CONVOCATORIA DE LA CONSULTA POPULAR. Toda convocatoria de consulta popular, deberá satisfacer los requisitos siguientes:\nI. Precisar el objeto de la consulta, el procedimiento, la metodología y la forma de la consulta.\nII. Señalar la fecha, el lugar y el formato mediante el cual se consultará a los habitantes coahuilenses. comunicación oficiales. Para mayor divulgación, la convocatoria podrá publicarse y/o difundirse en los principales medios de comunicación o en los lugares de mayor afluencia.\nIV. Los demás elementos de información que estime señalar el convocante.\nARTÍCULO 80. LAS FORMAS DE LA CONSULTA POPULAR. La consulta popular podrá realizarse a través de:\nI. Consulta directa.\nII. Entrevistas.\nIII. Encuestas.\nIV. Sondeos de opinión.\nV. Otros medios de consulta que resulten confiables.\nARTÍCULO 81. LA PUBLICACIÓN DE LOS RESULTADOS DE LA CONSULTA POPULAR. Los resultados de la consulta popular se publicarán en el Periódico Oficial del Gobierno del Estado y se difundirán en los medios de comunicación oficiales.\nEn todo caso, los resultados de la consulta se difundirán en el ámbito en que haya sido realizada la misma.\nARTÍCULO 82. LOS EFECTOS DE LA CONSULTA POPULAR. Los resultados de la consulta popular no tendrán carácter vinculatorio. Sólo serán elementos de juicio para el ejercicio de las funciones del convocante.\nCAPÍTULO SEGUNDO\nLA COLABORACIÓN COMUNITARIA\nARTÍCULO 83. EL CONCEPTO DE COLABORACIÓN COMUNITARIA. La colaboración comunitaria es gobiernos estatal y/o municipal.\nARTÍCULO 84. LAS FORMAS DE COLABORACIÓN COMUNITARIA. Los habitantes coahuilenses podrán coadyuvar con los gobiernos estatal y/o municipal, mediante la aportación de recursos corresponsable.\nARTÍCULO 85. LA SOLICITUD DE COLABORACIÓN COMUNITARIA. Toda solicitud de colaboración deberá reunir los requisitos siguientes:\nI. Presentarse por escrito, debidamente firmada por los solicitantes.\nII. Señalar el domicilio para oír y recibir toda clase de documentos y/o notificaciones. necesarios para tramitar la solicitud.\nIII. Dirigirse a la autoridad competente.\nIV. Señalar el objeto y forma de la colaboración.\nARTÍCULO 86. LA RESPUESTA DE LA SOLICITUD DE COLABORACIÓN COMUNITARIA. La autoridad estatal o municipal resolverá sobre la procedencia de la colaboración comunitaria, bajo las reglas siguientes:\nI. La autoridad de que se trate dentro de los veinticinco días siguientes resolverá sobre la procedencia y, en su caso, la forma, modalidad y el calendario de la colaboración comunitaria.\nII. Se determinarán los procedimientos legales para satisfacer la forma de colaboración propuesta.\nIII. Según las disponibilidades presupuestales, la autoridad de que se trate concurrirá con recursos financieros, materiales y humanos para coadyuvar en la ejecución de los actos que se realicen por colaboración comunitaria.\nARTÍCULO 87. LA CONVOCATORIA PÚBLICA DE COLABORACIÓN COMUNITARIA. En todo caso, la autoridad estatal y/o municipal convocarán a sus habitantes para colaborar con ellas en los términos que se les indiquen.\nEn todo caso, las autoridades estatales y municipales procurarán colaborar en forma conjunta y corresponsablemente en la ejecución de los actos que se realicen por colaboración comunitaria.\nCAPÍTULO TERCERO\nLA AUDIENCIA PÚBLICA\nARTÍCULO 88. EL CONCEPTO DE LA AUDIENCIA PÚBLICA. La audiencia pública es el derecho de los habitantes coahuilenses para que las autoridades competentes de los gobiernos estatal o municipal, los reciban para tratar asuntos de interés público.\nARTÍCULO 89. EL OBJETO DE LA AUDIENCIA PÚBLICA. La audiencia pública tendrá por objeto que los habitantes coahuilenses:\nI. Propongan la implementación de programas, acuerdos y/o la realización de actos concretos para el mejor ejercicio de la función pública.\nII. Reciban la información pública con relación a determinados programas, acciones y funciones.\nIII. Traten asuntos de interés público de la comunidad en que residan.\nARTÍCULO 90. LOS SUJETOS FACULTADOS PARA PEDIR LA AUDIENCIA PÚBLICA. Podrán solicitar la audiencia pública:\nI. Los Consejos de Participación Ciudadana y Comunitaria.\nII. Los miembros de cualquier organización o asociación lícita de habitantes coahuilenses.\nIII. Los habitantes coahuilenses.\nARTÍCULO 91. LA SOLICITUD DE AUDIENCIA PÚBLICA. Toda solicitud de audiencia pública deberá reunir los requisitos siguientes:\nI. Presentarse por escrito, debidamente firmada por los solicitantes.\nII. Señalar el domicilio para oír y recibir toda clase de documentos y/o notificaciones. para tramitar la solicitud.\nIII. Dirigirse a la autoridad competente para conocer del asunto a tratar.\nIV. Señalar el objeto de la audiencia.\nARTÍCULO 92. LA RESPUESTA DE LA SOLICITUD DE AUDIENCIA PÚBLICA. La autoridad estatal o municipal resolverá la solicitud de audiencia pública, bajo las reglas siguientes:\nI. Dentro de los quince días siguientes a la recepción de la solicitud, deberá resolver sobre la misma.\nII. La respuesta deberá señalar día y hora para la realización de la audiencia y el nombre y cargo del servidor público que asistirá a la misma.\nIII. La audiencia se llevará a cabo preferentemente en el lugar donde residan los habitantes interesados, en forma verbal o escrita.\nEn la audiencia pública dirigida a dependencias y entidades del Poder Ejecutivo del Estado, los servidores públicos deberán dirigir copia de la respuesta a la Procuraduría Social y de Atención\nCiudadana del Estado de Coahuila, para el seguimiento respectivo.\nARTÍCULO 93. LA CONVOCATORIA DE LA AUDIENCIA PÚBLICA. La audiencia pública podrá ser convocada por el titular de la dependencia o entidad de los gobiernos estatal y/o municipal, según se trate.\nARTÍCULO 94. EL DESAHOGO Y TRÁMITE DE RESPUESTA DE LA AUDIENCIA PÚBLICA. En la audiencia pública, los habitantes interesados expresarán libremente ante las autoridades competentes sus peticiones, propuestas o quejas.\nDentro de los quince días siguientes de haberse desahogado la audiencia, la autoridad estatal y/o municipal informará por escrito a los interesados los aspectos siguientes:\nI. En su caso, el plazo en que el asunto será analizado.\nII. Los procedimientos legales para satisfacer las peticiones, propuestas o quejas.\nIII. La factibilidad de atender su petición. del Estado de Coahuila, para el seguimiento respectivo.\nARTÍCULO 95. LA RESOLUCIÓN INMEDIATA DEL ASUNTO. Cuando la naturaleza del asunto lo permita, las autoridades estatales o municipales instrumentarán lo necesario para la resolución inmediata del asunto planteado, designando para tal efecto al servidor público responsable de su ejecución.\nTÍTULO SÉPTIMO\nLA ORGANIZACIÓN CIUDADANA\nCAPÍTULO ÚNICO\nLOS CONSEJOS DE PARTICIPACIÓN CIUDADANA\nSECCIÓN PRIMERA\nBASES GENERALES\nARTÍCULO 96. LOS CONSEJOS DE PARTICIPACIÓN CIUDADANA COMO ÓRGANOS\nCIUDADANOS DE INTERÉS PÚBLICO Y DE REPRESENTACIÓN COMUNITARIA. Los Consejos de\nParticipación Ciudadana son órganos ciudadanos de interés público, que tienen por objeto representar a los intereses de sus miembros como integrantes de la comunidad coahuilense ante los gobiernos estatal y municipal.\nEn ningún caso, estos órganos ciudadanos podrán ejercer funciones propias de los gobiernos estatal y municipales.\nARTÍCULO 97. EL OBJETO DE LOS CONSEJOS DE PARTICIPACIÓN CIUDADANA. Los Consejos de\nParticipación Ciudadana tienen por objeto:\nI. La organización ciudadana de los electores coahuilenses.\nII. La participación ciudadana en la vida pública del estado y de los municipios.\nARTÍCULO 98. EL DERECHO PREFERENTE A PARTICIPAR EN LA VIDA PÚBLICA DEL ESTADO O\nDEL MUNICIPIO. Los integrantes de los Consejos de Participación Ciudadana tendrán los derechos preferentes siguientes:\nI. Para desempeñar los cargos de representación o dirección de los diversos sectores de la comunidad en los órganos de gobierno, de dirección, de asesoría, de consulta o de cualquier otra naturaleza, que formen parte de las dependencias o entidades del gobierno estatal o municipal.\nII. Para desempeñar, en los términos de las disposiciones aplicables, los cargos de los Concejos\nMunicipales.\nIII. Para participar en los diversos programas oficiales, en los consejos de obra pública, en la instrumenten para tal efecto. materia o en la política pública determinada.\nARTÍCULO 99. LA COORDINACIÓN DE LOS CONSEJOS DE PARTICIPACIÓN CIUDADANA CON\nLOS GOBIERNOS ESTATAL Y/O MUNICIPAL. Para lograr la coordinación eficaz con la autoridad, los ordenamientos, quedarán adscritos a la dependencia o entidad del gobierno estatal o municipal respectiva, según la materia o política pública determinada. ordenamientos, a través de la Secretaria de Gobierno, se coordinaran con la entidad o dependencia pública estatal estrictamente pertinente y competente, para el cumplimiento preciso de sus objetivos.\nLos Ayuntamientos, por conducto del presidente municipal, se encargarán para los efectos internos de la administración pública municipal, de coordinar y adscribir a los Consejos de Participación Ciudadana u otros órganos de naturaleza similar previstos en otros ordenamientos, a las asociaciones u organizaciones sociales, civiles, no gubernamentales o cualquier otro grupo de la comunidad que formen parte de éstos, con la entidad o dependencia pública municipal competente, para lograr una mejor funcionalidad de la relación entre gobierno y comunidad.\nARTÍCULO 100. LA GARANTÍA DE ASOCIACIÓN O REUNIÓN LIBRE CON FIN LÍCITO. En ningún caso, la integración o el funcionamiento de los Consejos de Participación Ciudadana afectará el ejercicio del derecho de los individuos a asociarse o reunirse libremente con fin lícito.\nEn todo caso, los individuos asociados o reunidos en forma distinta, podrán ejercer sus derechos fundamentales en los términos que establece la Constitución Política de los Estados Unidos Mexicanos y demás disposiciones aplicables.\nARTÍCULO 101. LA GARANTÍA DE COADYUVANCIA DE LOS GOBIERNOS ESTATAL Y/O\nMUNICIPAL. Los gobiernos estatal y/o municipal coadyuvarán con los ciudadanos y las asociaciones u organizaciones coahuilenses para la integración, organización y funcionamiento de los Consejos de\nParticipación Ciudadana.\nARTÍCULO 102. LA GARANTÍA DE TRANSPARENCIA DEL CONSEJO DE PARTICIPACIÓN\nCIUDADANA. Los gobiernos estatal y/o municipal, a través de sus órganos de control, estarán facultados en todo momento para fiscalizar todo recurso público y/o proveniente de los particulares que ejerza el\nConsejo de Participación Ciudadana, para determinar el funcionamiento lícito de la asociación u organización, cualesquiera que sea su denominación.\nSECCIÓN SEGUNDA\nLA INTEGRACIÓN Y EL FUNCIONAMIENTO DE LOS CONSEJOS\nDE PARTICIPACIÓN CIUDADANA\nARTÍCULO 103. LA INTEGRACIÓN DE LOS CONSEJOS DE PARTICIPACIÓN CIUDADANA. Los ciudadanos electores coahuilenses, por sí o a través de alguna asociación u organización social, civil, no gubernamental o cualquier otro grupo de la comunidad que resida en el estado, podrán constituir los\nConsejos de Participación Ciudadana, conforme a las bases siguientes:\nI. Se integrarán por materia o política pública determinada de acuerdo con los niveles de representación siguientes:\n1. Por ámbito estatal, municipal o regional; ó\n2. Por ámbito vecinal: colonia, fraccionamiento, ejido, ranchería o cualquier otra forma de organización vecinal en el estado.\nII. Las asociaciones u organizaciones, por sí o a través de sus representantes, deberán renovar cada pertenezcan. Los miembros de las asociaciones u organizaciones de que se trate, podrán reelegir a sus directivos o representantes por una sola ocasión; pero, en todo caso, deberán rotar a sus diferentes integrantes para que participen en los órganos del Consejo de Participación Ciudadana.\nIII. En la integración y funcionamiento de los Consejos de Participación Ciudadana, las asociaciones u organizaciones deberán observar los lineamientos democráticos siguientes:\n1. El adecuado equilibrio entre los sectores social y privado.\n2. La integración de profesores, investigadores o académicos de las instituciones educativas o de estudios superiores.\n3. La adecuada integración de mujeres y jóvenes.\n4. La adecuada integración de personas adultas mayores, con capacidades diferentes o de cualquier grupo vulnerable de la comunidad.\n5. La transparencia en el ejercicio de sus recursos.\n6. La cultura democrática de participación ciudadana.\nIV. Cada Consejo de Participación Ciudadana contará con una mesa directiva, que será su órgano de representación. La mesa directiva se constituirá de la manera siguiente:\n1. De entre los miembros del consejo designarán por medio de una planilla a un presidente, un secretario, un tesorero y cuatro comisarios.\n2. Se renovará en su totalidad cada tres años, sin perjuicio de que la planilla pueda reelegirse por una sola ocasión.\n3. Los cargos serán honoríficos.\n4. Cada uno de los integrantes de la mesa directiva podrán designar a un suplente que lo sustituirá en sus funciones. En todo caso, el suplente deberá ser miembro del consejo.\nV. El número mínimo de integrantes para constituir los consejos, se sujetará a las bases siguientes:\n1. En el ámbito estatal, no podrá ser menor de mil quinientos ciudadanos electores coahuilenses, conforme a las bases mínimas siguientes:\na) En cada una de las cinco regiones del estado, residirán trescientos ciudadanos.\nb) En cada municipio de la región de que se trate, residirán veinte ciudadanos.\nc) Los restantes ciudadanos electores podrán residir en cualquiera de los municipios de las regiones del estado.\n2. En el ámbito municipal, no podrá ser menor de trescientos ciudadanos electores coahuilenses que residan en el municipio de que se trate.\n3. En el ámbito regional, no podrá ser menor de seiscientos ciudadanos electores coahuilenses, conforme a las bases mínimas siguientes:\na) Si se trata de una sola región, el consejo se integrará de la manera siguiente: i. En cada uno de los municipios de la región de que se trate, residirán veinte ciudadanos. ii. Los restantes ciudadanos electores podrán residir en cualquiera de los municipios de la región de que se trate.\nb) Si se trata de dos a cuatro regiones, el consejo se integrará de la manera siguiente: i. En cada una de las regiones, residirán igual número de ciudadanos electores que que se trate. ii. En cada uno de los municipios de la región de que se trate, residirán veinte ciudadanos electores coahuilenses. iii. Los restantes ciudadanos electores coahuilenses podrán residir en cualquiera de los municipios de la región de que se trate.\n4. En el ámbito vecinal, no podrá ser menor de cincuenta ciudadanos electores coahuilenses que habiten en la colonia, fraccionamiento, ejido, ranchería o cualquier otra forma de organización vecinal en el estado, según se trate.\nVI. Los Consejos de Participación Ciudadana, previo acuerdo entre ellos, podrán dividirse o fusionarse. El Instituto certificará la división o fusión de que se trate.\nARTÍCULO 104. EL PROCEDIMIENTO DE CONSTITUCIÓN DE LOS CONSEJOS DE PARTICIPACIÓN\nCIUDADANA. La constitución de los Consejos de Participación Ciudadana, se sujetará al procedimiento siguiente:\nI. Los ciudadanos electores coahuilenses presentarán una solicitud ante el Instituto, la cual deberá reunir los requisitos siguientes:\n1. Presentarse por escrito, debidamente firmada por el o los solicitantes.\n2. Presentar la relación de los ciudadanos electores coahuilenses integrantes del consejo, que contenga nombres, firmas y claves de la credencial de elector. Esta relación deberá contener una leyenda en donde quede clara la voluntad de los ciudadanos electores de formar parte del Consejo de Participación Ciudadana que se pretende crear.\n3. Señalar un representante y domicilio para oír y recibir toda clase de documentos y/o notificaciones. Este domicilio será su lugar de residencia.\nPara todos los efectos legales, se entenderá que el representante designado podrá realizar\nParticipación Ciudadana.\n4. Señalar el objeto, la denominación y demás elementos que identifiquen al Consejo de\nParticipación Ciudadana.\n5. Identificar y determinar, en su caso, las organizaciones u asociaciones y sus representantes que formaran parte del Consejo de Participación Ciudadana.\n6. Presentar la propuesta de planilla o planillas para integrar la mesa directiva.\nII. El Instituto, a través de la Comisión de Participación Ciudadana, podrá verificar los requisitos de la solicitud, bajo las reglas siguientes:\n1. Establecerá los mecanismos confiables para corroborar, autentificar y validar el número de integrantes del Consejo de Participación Ciudadana.\n2. Verificará el cumplimiento de los demás requisitos para integrar el Consejo de Participación\nCiudadana.\n3. Si no se reúnen los requisitos, requerirá a los solicitantes para que dentro de los quince días siguientes cumplan con el requisito o requisitos omitidos.\n4. Si se reúnen todos los requisitos, el Instituto expedirá la constancia de constitución del\nConsejo de Participación Ciudadana y señalará día, lugar y hora para la conformación de la mesa directiva.\n5. Para conformar la mesa directiva, se procederá de la manera siguiente:\na) El día, lugar y hora señalado por el Instituto, deberán acudir por lo menos más de la mitad de los integrantes del Consejo de Participación Ciudadana.\nb) En caso de que no se reúna el quórum de asistencia, la comisión realizará una nueva convocatoria hasta por tres ocasiones. Si no se reúne el quórum de asistencia, la comisión emitirá un dictamen para que el Consejo General del Instituto determine lo conducente.\nc) Los integrantes presentes del Consejo de Participación Ciudadana emitirán su voto por la planilla o planillas de que se trate.\nd) La planilla ganadora será la que obtenga el cincuenta y uno porciento de los votos de los presentes.\ne) La comisión realizará el cómputo y emitirá la declaratoria de la planilla ganadora.\nf) Dentro de los cinco días siguientes, el Instituto expedirá la constancia de la mesa directiva conformada.\n6. Un notario público del lugar de residencia del consejo podrá dar fe del procedimiento de conformación, renovación o reelección de la mesa directiva, en los términos, condiciones y límites que el Instituto autorice.\n7. El Instituto podrá comisionar a los funcionarios públicos que estime necesarios, para llevar a cabo el procedimiento de la constitución del consejo o la conformación, renovación o reelección de su mesa directiva.\n8. En año electoral no se podrán constituir consejos, ni tampoco conformar, renovar o reelegir sus mesas directivas, a menos que el Instituto estime que tiene la capacidad de tramitar el procedimiento sin distraer o entorpecer su función electoral.\nEn todo caso, el Instituto tramitará hasta el año siguiente tanto la constitución del consejo como la conformación, renovación o reelección de la mesa directiva.\nIII. Para las subsecuentes renovaciones de la mesa directiva, se observarán las mismas reglas previstas en la fracción que antecede bajo las modalidades siguientes:\n1. El presidente solicitará al Instituto que expida una convocatoria pública para renovar o reelegir la mesa directiva, tres meses antes de que concluya el periodo de la mesa directiva en funciones.\n2. La convocatoria deberá contener las fechas, formato, organización y desarrollo de las diferentes etapas de la renovación o reelección de la mesa directiva, conforme a las bases siguientes:\na) El registro de planillas ante la comisión durará cinco días. La solicitud de registro de\nParticipación Ciudadana, los que anexarán el plan de trabajo de la planilla propuesta.\nb) La difusión del plan de trabajo de la planilla durará diez días. El plan de trabajo se comunicación oficiales.\nc) Precisar el lugar, la fecha y hora para llevar a cabo la renovación o reelección.\n3. La convocatoria se publicará en el Periódico Oficial del Gobierno del Estado y se difundirá en los medios de comunicación oficiales.\n4. La comisión vigilará que las etapas de la renovación o reelección se realicen en forma transparente, equitativa y legalmente.\nIV. Los ciudadanos electores coahuilenses podrán en cualquier momento formar parte de los Consejos de Participación Ciudadana conformados. Para tal efecto, presentarán su solicitud ante el Instituto y deberán acompañar los documentos que acrediten los requisitos siguientes:\n1. Ser ciudadano coahuilense, en pleno ejercicio de sus derechos.\n2. Contar con credencial de elector.\n3. En su caso, residir en la región, municipio, colonia, fraccionamiento, ejido, ranchería o en la organización vecinal correspondiente.\n4. No haber sido condenado por delito doloso.\n5. No desempeñar cargo o función pública federal, estatal o municipal.\nEl Instituto dará vista de la solicitud a la mesa directiva del Consejo de Participación Ciudadana.\nDentro de los diez días siguientes, el Instituto verificará el cumplimiento de los requisitos y, en su caso, expedirá la constancia de miembro del Consejo de Participación Ciudadana y la comunicará a la mesa directiva de que se trate.\nV. El Instituto llevará un registro de los Consejos de Participación Ciudadana y de sus miembros. Se deberá actualizar en forma permanente. El registro será público.\nVI. El Instituto se encargará en forma permanente de vigilar, evaluar y certificar que los Consejos de\nParticipación Ciudadana se integren y funcionen en los términos que establece esta ley.\nVII. Las controversias que se generen con motivo de la integración y del funcionamiento de los\nConsejos de Participación Ciudadana, serán resueltas por el Instituto.\nARTÍCULO 105. LAS FUNCIONES DE LOS CONSEJOS DE PARTICIPACIÓN CIUDADANA. Las competente y únicamente representarán los intereses de sus miembros.\nEn ningún caso, las funciones de los Consejos de Participación Ciudadana u otros organismos de naturaleza similar previstos en otros ordenamientos, interferirán con las atribuciones de los gobiernos estatal o municipales que la Constitución, las leyes y demás disposiciones aplicables les confiere.\nLa autoridades estatales y municipales, en el ámbito de su competencia, emitirán los reglamentos respectivos para regular en forma específica las funciones de estos organismos ciudadanos.\nARTÍCULO 106. EL FUNCIONAMIENTO DEL CONSEJO DE PARTICIPACIÓN CIUDADANA. El\nLa asamblea o la mesa directiva podrán ejercer cualquiera de las funciones previstas en el artículo 105 de esta ley; pero, en todo caso, la decisión de la asamblea prevalecerá sobre la de la mesa directiva.\nARTÍCULO 107. LA ASAMBLEA DEL CONSEJO DE PARTICIPACIÓN CIUDADANA. La asamblea del consejo sólo funcionará en los casos siguientes:\nI. Cuando haya lugar la renovación o reelección de la mesa directiva.\nII. Cuando haya lugar la división o fusión del consejo.\nIII. Cuando se decida sobre la separación de alguno de los miembros del consejo.\nIV. Cuando se convoque por la mesa directiva o el treinta por ciento de los integrantes del consejo.\nEn todo caso, para que funcione válidamente la asamblea es necesario que asistan a la reunión el cincuenta y uno por ciento de los integrantes del consejo.\nARTÍCULO 108. LA MESA DIRECTIVA DEL CONSEJO DE PARTICIPACIÓN CIUDADANA. La mesa directiva funcionará de la manera siguiente:\nI. Para la toma de decisiones funcionará colegiadamente, sea en pleno con sus siete miembros o mediante comisiones que podrán crear con los integrantes de la mesa directiva o del consejo.\nII. Para toda decisión deberán estar presentes la mitad más uno de sus integrantes.\nIII. Las decisiones se tomarán por el voto de la mayoría. El presidente tendrá voto de calidad.\nIV. De toda sesión de la mesa directiva se levantará el acta correspondiente por conducto de su secretario. Las actas deberán ser firmadas por el presidente de la mesa directiva y el secretario.\nNo podrán formar parte de la mesa directiva de los Consejos de Participación Ciudadana, en sus distintos ámbitos de actuación, ningún dirigente de partido político de un comité directivo u órgano equivalente de carácter municipal, estatal o nacional. El incumplimiento de esta disposición hará inválida la constitución del Consejo de Participación Ciudadana de que se trate.\nARTÍCULO 109. LAS FUNCIONES DE LOS INTEGRANTES DE LA MESA DIRECTIVA DEL CONSEJO\nDE PARTICIPACIÓN CIUDADANA. Los miembros de la mesa directiva se desempeñarán de la manera siguiente:\nI. El presidente será el representante del consejo y se encargará de coordinar los trabajos, convocar a las reuniones, por sí o a solicitud del treinta por ciento de los integrantes del consejo y promover, ejecutar e instrumentar la coordinación del consejo con otros consejos y/o con las autoridades.\nII. El secretario se encargará de tramitar los asuntos del consejo.\nIII. El tesorero se encargará de administrar los recursos del consejo.\nIV. Los comisarios se encargarán de la supervisión, vigilancia y fiscalización de las funciones del consejo.\nARTÍCULO 110. EL ESTATUTO DE LOS CONSEJOS DE PARTICIPACIÓN CIUDADANA. Cada uno de los Consejos de Participación Ciudadana funcionarán en los términos de las disposiciones aplicables.\nARTÍCULO 111. LA OBLIGACIÓN DE LA MESA DIRECTIVA DE INFORMAR SOBRE SUS\nACTIVIDADES. La mesa directiva deberá informar por lo menos dos veces al año de todas sus actividades y decisiones a los miembros del Consejo de Participación Ciudadana. entidad, estatal o municipal a que esté adscrito, sobre las actividades desarrolladas en el ejercicio de sus funciones. Los informes deberán presentarse cuando menos dos veces al año.\nSECCIÓN TERCERA\nCONSEJO DE PARTICIPACIÓN CIUDADANA\nARTÍCULO 112. LOS DERECHOS DE LOS MIEMBROS DEL CONSEJO DE PARTICIPACIÓN\nCIUDADANA. Son derechos de los integrantes de los Consejos de Participación Ciudadana los siguientes:\nI. Formar parte de la mesa directiva, previa designación de los miembros del consejo en los términos que establece esta ley.\nII. Formar parte de las comisiones de trabajo.\nIII. Participar en los trabajos, actividades y deliberaciones de la mesa directiva.\nIV. Presentar propuestas relativas al ejercicio de las funciones del consejo y su mesa directiva.\nV. Ser informados sobre los trabajos, actividades y decisiones de la mesa directiva.\nVI. Las demás que establezcan esta ley u otras disposiciones aplicables.\nARTÍCULO 113. LAS OBLIGACIONES DE LOS MIEMBROS DEL CONSEJO DE PARTICIPACIÓN\nCIUDADANA. Son obligaciones de los miembros de los Consejos de Participación Ciudadana las siguientes:\nI. Consultar a los habitantes y ciudadanos a los que representan.\nII. Representar los intereses de los habitantes y ciudadanos de su entorno.\nIII. Promover la organización y participación ciudadana.\nIV. Cumplir las decisiones de la mesa directiva del consejo.\nV. Asistir a las reuniones de la mesa directiva del consejo.\nVI. Participar en los trabajos de las comisiones a las que pertenezcan.\nVII. Informar de su actuación a los integrantes del consejo, sea en asamblea o en la mesa directiva.\nVIII. Las demás que establezcan esta ley u otras disposiciones aplicables.\nSECCIÓN CUARTA\nLA RESPONSABILIDAD CIUDADANA\nARTÍCULO 114. LAS CAUSAS DE RESPONSABILIDAD CIUDADANA. Son causas de responsabilidad ciudadana de los miembros del Consejo de Participación Ciudadana, las siguientes:\nI. Faltar sin causa justificada a más de tres sesiones consecutivas de la asamblea, de la mesa directiva o de las comisiones a las que pertenezcan.\nII. Obtener o pretender obtener lucro por las gestiones que realice en el ejercicio de sus funciones.\nIII. Incumplir con las funciones que le correspondan.\nIV. Incumplir de manera grave con las disposiciones legales y reglamentarias aplicables.\nARTÍCULO 115. EL JUICIO DE RESPONSABILIDAD CIUDADANA. Toda responsabilidad ciudadana se sujetará al procedimiento siguiente:\nI. El presidente de la mesa directiva tramitará de oficio o a petición de parte el procedimiento.\nII. Se le dará vista por escrito al presunto infractor de la causa o causas que originan el procedimiento.\nIII. Se desahogará una etapa de audiencia de pruebas y alegatos.\nIV. Se presentará el asunto a la asamblea o la mesa directiva, para que decida lo que conforme a derecho proceda.\nV. Podrán imponerse las sanciones de apercibimiento, amonestación, multa, suspensión de derechos dentro del consejo y la separación.\nVI. La decisión de separación sólo será acordada por las dos terceras partes de los miembros de la asamblea o de la mesa directiva. En los demás casos bastará la mayoría de votos.\nVII La resolución de responsabilidad ciudadana podrá ser impugnada por el afectado ante el Instituto.\nARTÍCULO 116. LA SUSPENSIÓN PROVISIONAL DE LOS DERECHOS DE LOS MIEMBROS DEL\nCONSEJO DE PARTICIPACIÓN CIUADANA. Cuando un miembro del Consejo de Participación establece esta ley, la mesa directiva comprobará tal circunstancia y suspenderá provisionalmente los derechos que tiene el ciudadano dentro del consejo hasta en tanto se levante la causa de la suspensión.\nEsta resolución de suspensión provisional deberá comunicarse al Instituto.\nTÍTULO OCTAVO\nLA ORGANIZACIÓN COMUNITARIA\nCAPÍTULO ÚNICO\nLOS CONSEJOS DE PARTICIPACIÓN COMUNITARIA\nSECCIÓN PRIMERA\nLOS CONSEJOS DE PARTICIPACIÓN COMUNITARIA\nESTATAL Y MUNICIPAL\nARTÍCULO 117. LOS CONSEJOS DE PARTICIPACIÓN DENTRO DE LA ADMINISTRACIÓN PÚBLICA\nESTATAL. Cada secretaría del ramo de la administración pública estatal contará en forma permanente con un Consejo de Participación Comunitaria, conforme a las bases siguientes:\nI. Será un órgano de consulta en el ejercicio de las funciones públicas de cada secretaría.\nII. Se integrará cuando menos por siete habitantes coahuilenses de reconocido prestigio en el área de competencia de la secretaria.\nIII. Los cargos serán honoríficos.\nIV. Conocerán y analizarán las diversas actividades, programas y funciones que ejerza la secretaría.\nV. El Ejecutivo del Estado, por conducto de la Secretaría de Gobierno vigilará que en cada secretaría del ramo funcione el Consejo de Participación que corresponda.\nARTÍCULO 118. LOS CONSEJOS DE PARTICIPACIÓN DENTRO DE LA ADMINISTRACIÓN PÚBLICA\nMUNICIPAL. Los municipios contarán con sus Consejos de Participación Comunitaria en los términos que establezcan sus reglamentos.\nEn todo caso, los municipios deberán garantizar la participación y organización vecinal.\nSECCIÓN SEGUNDA\nLOS CONSEJOS DE PARTICIPACIÓN PARA LA AGENDA\nCOMUNITARIA ESTATAL Y MUNICIPAL\nARTÍCULO 119. EL CONSEJO DE PARTICIPACIÓN PARA LA AGENDA COMUNITARIA ESTATAL. El\nConsejo de Participación para la Agenda Comunitaria Estatal, se conformará de la manera siguiente:\nI. Un coordinador, que será el titular de la Secretaría de Gobierno.\nII. Cinco funcionarios de la administración pública estatal, que serán designados por el Ejecutivo del\nEstado.\nIII. Cinco habitantes coahuilenses con conocimientos en los temas comunitarios, designados por el\nInstituto a través de convocatoria pública. sustituirá en sus ausencias.\nARTÍCULO 120. EL CONSEJO DE PARTICIPACIÓN PARA LA AGENDA COMUNITARIA MUNICIPAL.\nCada Ayuntamiento integrará un Consejo de Participación para la Agenda Comunitaria Municipal, conforme a las bases siguientes:\nI. Se garantizará la representación de habitantes coahuilenses con conocimientos en los temas comunitarios.\nII. Se garantizará la representación interinstitucional de las entidades y dependencias del municipio relacionadas con el desarrollo sustentable y la calidad de vida.\nIII. El consejo contará con un coordinador que será el Secretario del Ayuntamiento respectivo y se designados por el cabildo mediante convocatoria pública.\nIV. Cada uno de los miembros del consejo contará con un suplente que será designado por él y quien lo sustituirá en sus ausencias.\nV. Los cargos que desempeñen los integrantes del consejo serán honoríficos. Sus miembros por ese motivo no percibirán remuneración alguna.\nARTÍCULO 121. LAS REGLAS GENERALES PARA EL FUNCIONAMIENTO DE LOS CONSEJOS DE\nPARTICIPACIÓN COMUNITARIA. El funcionamiento de los Consejos de Participación Comunitaria previstos en esta sección, se sujetará a las bases siguientes:\nI. Se reunirán de manera trimestral, sin perjuicio de reunirse en forma extraordinaria en cualquier tiempo, previa convocatoria de su presidente o coordinador o de la mayoría de sus integrantes.\nII. Las reuniones serán válidas cuando se integren con la mitad más uno de los miembros del consejo, siempre que esté presente su presidente o coordinador o quien deba de suplirlos.\nIII. Podrán asistir a las sesiones que celebre el consejo, otras personas con amplia experiencia y conocimientos reconocidos en cualquier tema relacionado con el objeto de la reunión, los cuales participarán en ellas con voz, pero sin voto.\nIV. De toda sesión del consejo se levantará el acta respectiva a través del secretario del consejo. Las actas deberán contener una síntesis del asunto a tratar y el punto o puntos acordados. Se resguardarán por la secretaría del consejo.\nV. El presidente, el coordinador o quien deba de suplirlos presidirá la sesión, dirigirá los debates, declarará cerrada la discusión y, finalmente, someterá a votación los asuntos correspondientes.\nVI. Las votaciones del consejo se tomarán por mayoría de votos de los miembros presentes. En caso de empate, el presidente, el coordinador o quien deba de suplirlos, tendrá voto de calidad.\nARTÍCULO 122. EL ESTATUTO DE LOS CONSEJOS DE PARTICIPACIÓN COMUNITARIA. Cada uno de los Consejos de Participación Comunitaria previstos en este capítulo, expedirá su estatuto que regulará su organización y funcionamiento.\nARTÍCULO 123. LA GARANTÍA DE ASOCIACIÓN O REUNIÓN LIBRE CON FIN LÍCITO. En ningún caso, la integración o el funcionamiento de los Consejos de Participación Comunitaria afectará el ejercicio del derecho de los habitantes coahuilenses a asociarse o reunirse libremente con fin lícito.\nEn todo caso, los individuos asociados o reunidos en forma distinta, podrán ejercer sus derechos fundamentales en los términos que establezcan las leyes.\nTÍTULO DÉCIMO\nDISPOSICIONES FINALES\nCAPÍTULO PRIMERO\nLOS REGLAMENTOS del Estado, en el ámbito de su competencia, emitirá un reglamento para regular, conforme a esta ley, la iniciativa popular en materia legislativa, la consulta popular, la colaboración comunitaria, la audiencia participación ciudadana y comunitaria en su vida pública.\nARTÍCULO 125. EL REGLAMENTO DEL EJECUTIVO DEL ESTADO. El Ejecutivo del Estado, en el ámbito de su competencia, emitirá un reglamento para regular, conforme a esta ley, la agenda comunitaria estatal, la iniciativa popular en materia administrativa, la consulta popular, la colaboración comunitaria, la audiencia pública, los Consejos de Participación Comunitaria Estatal y demás instrumentos de participación que le corresponda instrumentar para garantizar la participación ciudadana y comunitaria en su vida pública.\nARTÍCULO 126. EL REGLAMENTO DE LOS MUNICIPIOS. Los Ayuntamientos, en el ámbito de su competencia, emitirán un reglamento para regular, conforme a esta ley, la agenda comunitaria municipal, la iniciativa popular en materia municipal, la consulta popular, la colaboración comunitaria, la difusión pública, la audiencia pública, los Consejos de Participación Comunitaria Municipal y demás instrumentos de participación que les corresponda diseñar para garantizar la participación ciudadana y comunitaria en su vida pública.\nARTÍCULO 127. EL REGLAMENTO DEL INSTITUTO. El Instituto emitirá un reglamento para regular el procedimiento del plebiscito y referendo y los Consejos de Participación Ciudadana, en los términos que establece esta ley.\nARTÍCULO 128. LA PARTICIPACIÓN CIUDADANA PARA LA ELABORACIÓN DE LOS\nREGLAMENTOS. Para elaborar los reglamentos, las autoridades podrán organizar talleres, foros, consultas o cualquier otro mecanismo, a fin de que los ciudadanos interesados participen en los términos que establece esta ley.\nCAPÍTULO SEGUNDO\nPRINCIPIOS COMPLEMENTARIOS\nARTÍCULO 129. EL PRINCIPIO DE CORRECCIÓN Y AYUDA DE LAS SOLICITUDES CIUDADANAS O\nCOMUNITARIAS. Cuando las solicitudes presentadas por los ciudadanos o habitantes coahuilenses sean oscuras, vagas o incompletas, la autoridad correspondiente mandará aclarar la solicitud para que los solicitantes subsanen las irregularidades; pero en todo caso, deberá analizar la solicitud en su conjunto bajo el principio de exhaustividad.\nEn todo caso, los ciudadanos o habitantes coahuilenses podrán acudir al Instituto o a la autoridad estatal o municipal que le corresponda la materia de participación ciudadana, para que le presten el apoyo, asesoría y auxilio necesario.\nARTÍCULO 130. EL PRINCIPIO DE ATENCIÓN DE UN ASUNTO DE INCOMPETENCIA. Cuando los autoridad a quien se dirigen, la misma deberá enviar el asunto sin demora a las autoridades que estime competentes para tramitar o resolver la petición comunitaria.\nARTÍCULO 131. EL PRINCIPIO DEL DERECHO A LA INFORMACIÓN. Toda entidad u organismo público deberá instrumentar los mecanismos necesarios, para que los ciudadanos y habitantes coahuilenses tengan acceso al derecho a la información en los términos de la ley aplicable.\nCAPÍTULO TERCERO\nLA EQUIDAD Y GÉNERO\nARTÍCULO 132. DE LA EQUIDAD Y GÉNERO. Si por exigencias de construcción gramatical, enumeración, orden u otra circunstancia un texto legal usa el género masculino, esa ley deberá ser interpretada en sentido igualitario para hombre y mujeres, de modo que éstas y aquéllos puedan adquirir toda clase de derechos y contraer igualmente toda clase de deberes jurídicos.\nARTÍCULO PRIMERO. La presente ley entrará en vigor a los ochenta días naturales siguientes de la\nARTÍCULO SEGUNDO. Dentro de los 280 días siguientes de entrar en vigor esta ley, el Congreso del\nEstado, el Ejecutivo del Estado, los Ayuntamientos y el Instituto deberán expedir los reglamentos que correspondan.\nARTÍCULO TERCERO. El Congreso del Estado, el Ejecutivo del Estado, los Ayuntamientos y el Instituto, en forma separada o conjunta, instrumentarán los mecanismos de difusión de esta ley.\nARTÍCULO CUARTO. Dentro de los 180 días siguientes de entrar en vigor esta ley, el Ejecutivo del\nEstado, por conducto de la Secretaría de Gobierno se encargará de integrar el Consejo de Participación para la Agenda Comunitaria Estatal.\nDentro de los 180 días siguientes de entrar en vigor esta ley, los Ayuntamientos, por conducto de su presidente municipal se encargará de integrar el Consejo de Participación para la Agenda Comunitaria\nMunicipal.\nARTÍCULO QUINTO. El Ejecutivo del Estado, por conducto de la Secretaría de Gobierno se encargará de coordinar un programa de sectorización y coordinación de las organizaciones sociales, civiles, no gubernamentales o cualquier otro grupo de la sociedad organizada en el estado que participe en asuntos de interés público, para coordinar sus esfuerzos con la entidad y/o dependencia pública estatal que corresponda.\nLos Ayuntamientos, a través de sus instancias correspondientes, procederán conforme al párrafo que antecede en lo que respecta a sus órganos de participación ciudadana y vecinal en materia municipal.\nARTÍCULO SEXTO. Dentro de los 300 días siguientes de entrar en vigor esta ley, el Instituto elaborará el\nPrograma de la Cultura de Participación Ciudadana y Comunitaria.\nARTÍCULO SÉPTIMO. Los reglamentos a que se refiere el artículo 105 de la presente ley, deberán fecha de entrada en vigor de este decreto.\nDADO en el Salón de Sesiones del Congreso del Estado, en la Ciudad de Saltillo, Coahuila, el día primero de noviembre del año dos mil uno.\nDIPUTADA PRESIDENTA.\nLAURA REYES RETANA RAMOS.\nDIPUTADA SECRETARIA. DIPUTADO SECRETARIO.\nNORMA VIOLETA DAVILA SALINAS. JOSE LUIS MARQUEZ FERNANDEZ.\nIMPRIMASE, COMUNIQUESE Y OBSERVESE\nEL GOBERNADOR DEL ESTADO\nLIC. ENRIQUE MARTINEZ Y MARTINEZ\nEL SECRETARIO DE GOBIERNO\nLIC. JOSE JESÚS RAUL SIFUENTES GUERRERO\nN. DE E. A CONTINUACION SE TRANSCRIBEN LOS ARTICULOS TRANSITORIOS DE LOS DECRETOS DE REFORMAS A LA\nPRESENTE LEY.\nSEGUNDO. Se derogan todas las disposiciones legales y reglamentarias que se opongan al presente Decreto.",
  "ordenamiento": "REGLAMENTO",
  "jurisdiccion": "COAHUILA",
  "fuente_oficial": "DIARIO OFICIAL DE LA FEDERACION",
  "Fecha de Publicación": "16 de noviembre de 2001",
  "ULTIMA REFORMA PUBLICADA": "27 DE JUNIO DE 2008",
  "es_escaneado": false,
  "tiene_tablas": true,
  "materia": [
    "participación ciudadana"
  ]
}