{
  "titulo": "Ley de Acceso A la Información Pública del Estado de Coahuila de Zaragoza",
  "Contenido": "EL C. ENRIQUE MARTÍNEZ Y MARTÍNEZ, GOBERNADOR CONSTITUCIONAL DEL ESTADO\nINDEPENDIENTE, LIBRE Y SOBERANO DE COAHUILA DE ZARAGOZA, A SUS HABITANTES\nSABED:\nQUE EL CONGRESO DEL ESTADO INDEPENDIENTE, LIBRE Y SOBERANO DE COAHUILA DE\nZARAGOZA;\nDECRETA:\nNÚMERO 96.LEY DE ACCESO A LA INFORMACIÓN PÚBLICA\nDEL ESTADO DE COAHUILA DE ZARAGOZA\nTÍTULO PRIMERO\nBASES NORMATIVAS\nARTÍCULO 1°. EL ÁMBITO DE VALIDEZ FORMAL DE LA LEY. Esta ley es de orden público y de observancia obligatoria en todo el régimen interior del estado en materia de acceso a la información pública.\nARTÍCULO 2°. EL ÁMBITO DE VALIDEZ SUSTANCIAL DE LA LEY. El diseño, la interpretación y la aplicación de los actos o normas en materia de acceso a la información pública, deberán ajustarse a los principios, normas y valores del estado humanista, social y democrático de derecho que establece la\nConstitución.\nARTÍCULO 3°. EL OBJETO DE LA LEY. Esta ley tiene por objeto garantizar el derecho de acceso a la información pública previsto en la Constitución.\nARTÍCULO 4°. LA FINALIDAD DE LA LEY. Esta ley tiene como finalidad:\nI. Consolidar en la entidad el estado humanista, social y democrático de derecho.\nII. Garantizar la participación comunitaria y ciudadana en la toma de las decisiones públicas.\nIII. Garantizar los principios siguientes:\n1. La máxima publicidad de la información.\n2. El acceso libre, gratuito, sencillo, antiformal, eficaz, pronto y expedito de la información.\n3. La interpretación constitucional más favorable del principio de publicidad.\n4. La interpretación estricta de la información reservada.\n5. La cultura de la transparencia informativa.\n6. La transparencia y la rendición de cuentas.\nIV. Garantizar el control social de los ciudadanos. esta ley.\nARTÍCULO 5°. EL CATÁLOGO DE DENOMINACIONES. Para los efectos de esta ley, se entenderá por:\nII. Instituto. El Instituto Coahuilense de Acceso a la Información Pública.\nIII. Entidad (es) pública (s). Las siguientes:\n1. El gobierno estatal: cualesquiera que sea su denominación.\nb) El Poder Ejecutivo del Estado y todas sus dependencias, entidades u órganos de la administración pública estatal, centralizada o paraestatal.\nc) El Poder Judicial del Estado y todas sus dependencias, entidades u órganos, cualesquiera que sea su denominación.\n2. El gobierno municipal:\na) Los ayuntamientos o, en su defecto, los concejos municipales.\nb) Todas las dependencias y entidades de la administración pública municipal centralizada, descentralizada y paramunicipal.\n3. Los organismos públicos autónomos, cualesquiera que sea su denominación.\n4. Las universidades públicas dotadas de autonomía por ley.\n5. Los partidos políticos y las organizaciones políticas.\n6. Las personas de derecho público y privado, cuando en el ejercicio de sus actividades actúen en auxilio o colaboración de las entidades públicas o cuando ejerzan gasto público, reciban subsidio o subvención.\n7. Las demás entidades públicas, organismos no gubernamentales, asociaciones civiles o cualquier persona física o moral que reciba, utilice o disponga de recursos públicos, cualesquiera que sea su denominación.\nIV. Información pública. Todo registro, archivo o cualquier dato que se recopile, mantenga, procese o se encuentre en poder de las entidades públicas a que se refiere esta ley, con excepción de la información que contengan datos personales que se regirá por la ley de la materia.\nV. Información reservada. La información pública que se encuentra temporalmente sujeta a alguna de las excepciones de reserva previstas en esta ley, por razón de interés público.\nVI. Información confidencial. La información que defina la ley de la materia para la protección del derecho a la intimidad.\nVII. Interés público. Categoría atribuida a los fines que persigue la consulta, el examen y la comunicación de la información pública, a fin de contribuir a la toma de decisiones de las personas, en el marco de una sociedad democrática.\nVIII. Persona. Toda persona física, individual, asociada o en grupo, o personas morales conforme a la ley.\nIX. Servidor público. La personas física que realice cualquier actividad en nombre o al servicio de alguna entidad pública, cualquiera que sea su nivel jerárquico, en los términos de la Constitución y demás disposiciones aplicables.\nTÍTULO SEGUNDO\nLOS PRINCIPIOS FUNDAMENTALES DEL DERECHO\nA LA INFORMACIÓN PÚBLICA\nARTÍCULO 6°. EL DERECHO A LA INFORMACIÓN PÚBLICA COMO BIEN PÚBLICO. El derecho a la información pública es un bien del dominio público accesible a cualesquier persona, en los términos previstos por la Constitución, esta ley y demás disposiciones aplicables.\nLa garantía de acceso salvaguarda el derecho de todas las personas a investigar, conocer, recibir, utilizar y difundir la información pública.\nARTÍCULO 7°. LA GARANTÍA DEL DERECHO A LA INFORMACIÓN PÚBLICA. Las entidades públicas, en el ámbito de sus competencias, establecerán las garantías necesarias para que el acceso a la información pública sea real, efectivo y democrático.\nEn todo caso, las entidades públicas deberán remover los obstáculos que impidan o dificulten el ejercicio de este derecho, a fin de que las personas conozcan, deliberen y participen sobre la vida política, económica, cultural y social del estado.\nARTÍCULO 8°. LOS PRINCIPIOS QUE GARANTIZAN EL ACCESO EFECTIVO A LA INFORMACIÓN\nPÚBLICA. Las entidades públicas, para hacer efectiva la garantía de acceso a la información pública, deberán observar los principios siguientes:\nI. El acceso libre se regirá por:\n1. La igualdad y la no-discriminación de las personas.\n2. La obligación constitucional de transparencia de la entidad pública de proporcionar la información solicitada.\n3. La información pública mínima.\n4. La libertad de las personas de utilizar, difundir o reproducir por cualquier medio los documentos públicos.\n5. El organismo público autónomo para garantizar el derecho.\n6. El debido procedimiento para acceder a la información pública y el sistema de impugnación.\n7. La legitimidad sin expresión de causa.\nII. El acceso gratuito se regirá por:\n1. La disponibilidad presupuestal para la implementación del acceso a la información pública, bajo criterios de eficiencia, racionalidad, optimización de recursos e interés social.\n2. El no-cobro por la información pública.\n3. Los derechos proporcionales y equitativos por el servicio o trámite público correspondiente, en los términos de las disposiciones fiscales aplicables.\n4. El cobro de las copias, cualquier otro tipo de reproducciones o gastos, para acceder a la información.\nIII. El acceso antiformal se regirá por:\n1. La finalidad del derecho sobre la formalidad inesencial.\n2. La formalidad esencial para garantizar la autenticidad, confiabilidad, seguridad y validez del derecho.\n3. La subsanabilidad, racionabilidad y proporcionalidad del acceso.\nIV. El acceso eficaz se regirá por:\n1. La interpretación constitucional más favorable del principio de publicidad, bajo criterios gramaticales, sistemáticos, funcionales o cualquier otro, para la ampliación del derecho fundamental.\n2. La aplicación restrictiva de la información reservada, bajo criterios de gobernabilidad democrática.\n3. La conservación de los actos válidos.\nV. El acceso pronto se regirá por:\n1. El breve acceso a la información pública.\n2. Los plazos razonables.\n3. La oportunidad.\nVI. El acceso expedito se regirá por:\n1. La remoción de todo obstáculo que impida o dificulte el ejercicio del derecho.\n2. El acceso sencillo a la información pública.\nARTÍCULO 9°. LA LEGITIMIDAD DEL DERECHO A LA INFORMACIÓN PÚBLICA SIN EXPRESIÓN\nDE CAUSA. El derecho a la información pública es una garantía individual de interés social. subjetivos, interés jurídico o legítimo o las razones que motiven su solicitud, salvo en el caso de la protección del derecho a la intimidad de las personas en los términos de la ley de la materia.\nARTÍCULO 10. EL PRINCIPIO DE GRATUIDAD DE LA INFORMACIÓN PÚBLICA. La información pública es gratuita.\nNinguna persona negociará o comercializará con la información pública.\nLa persona que solicite la información pagará previamente los costos de las copias, cualquier otro tipo de reproducciones o gastos de envío, para poder acceder a ella, sin perjuicio de las cuotas o tarifas que deberá pagar por los derechos en los términos de las disposiciones fiscales aplicables.\nARTÍCULO 11. EL PRINCIPIO ANTIFORMAL DE LA INFORMACIÓN PÚBLICA. El acceso antiformal o obstaculicen el ejercicio del derecho.\nLos requisitos para acceder a la información deberán ser subsanables, razonables y proporcionales en función de la finalidad del derecho.\nEl antiformalismo no excluye el debido procedimiento para acceder a la información pública, mucho menos implica la inobservancia del principio de documentación pública que toda entidad pública debe cumplir para dejar testimonio de lo acontecido en la vida pública del estado.\nARTÍCULO 12. EL PRINCIPIO DE EFICACIA DE LA INFORMACIÓN PÚBLICA. El acceso eficaz a la información pública, tiene por objeto que las autoridades interpreten, desarrollen y apliquen las normas de la materia para favorecer el ejercicio de este derecho.\nEn todo caso, la interpretación y aplicación del derecho a la información pública se regirá por los criterios siguientes:\nI. El marco constitucional se determina por la Constitución Federal, la Constitución, la Declaración\nUniversal de los Derechos Humanos, el Pacto de Derechos Civiles y Políticos, la Convención\nInteramericana de Derechos Humanos y los demás instrumentos internacionales suscritos y ratificados por el Estado mexicano.\nII. Sin perjuicio del precedente judicial federal o local y su obligatoriedad, se tomará en cuenta la interpretación de los órganos internacionales especializados en la materia.\nIII. La aplicación estricta de la información reservada se sujetará a los principios siguientes:\n1. No hay reserva sin causa legal.\n2. No hay causa legal sin lesividad de interés público.\n3. No hay lesividad sin prevalencia democrática de la reserva.\nIV. En el caso de que las normas constitucionales o legales pudieran tener diversas interpretaciones, pública.\nV. Cuando resulte algún conflicto entre métodos de interpretación, prevalecerá aquél que desarrolle los principios del estado humanista, social y democrático que postula la Constitución.\nARTÍCULO 13. LOS PRINCIPIOS DE PRONTITUD Y EXPEDITEZ DE LA INFORMACIÓN PÚBLICA. El acceso pronto y expedito a la información pública, tiene por objeto que las personas obtengan la información mediante procedimientos sencillos, rápidos y oportunos.\nTÍTULO TERCERO\nLA CULTURA DE TRANSPARENCIA INFORMATIVA\nARTÍCULO 14. LA CULTURA DE TRANSPARENCIA INFORMATIVA. El Instituto, en coordinación con las entidades públicas, deberá promover, fomentar e instrumentar como política pública, una cultura de transparencia informativa.\nARTÍCULO 15. LOS PRINCIPIOS DE LA CULTURA DE TRANSPARENCIA INFORMATIVA. La cultura de transparencia informativa se basa en los principios siguientes:\nI. La educación democrática de las personas, a partir de las libertades de pensamiento, expresión, imprenta e información, en el marco de la pluralidad, diversidad, tolerancia y racionalidad.\nII. La ampliación de los derechos fundamentales de la persona, a partir del respeto a su dignidad, igualdad y libre desarrollo.\nIII. La promoción, fomento y ejercicio de una cultura política basada en la pluralidad, diversidad, tolerancia y racionalidad, en el marco de una sociedad democrática.\nIV. El libre acceso a la información pública y sus excepciones razonables por un principio democrático.\nV. La cultura de la constitucionalidad y legalidad en la materia.\nVI. La protección del derecho a la intimidad de las personas.\nVII. El diálogo permanente, respetuoso, tolerante y constructivo entre gobierno y comunidad.\nVIII. La colaboración corresponsable, constructiva y armónica entre gobierno y comunidad, para prevenir, analizar y resolver los problemas de interés público.\nIX. La gobernabilidad humanista, social y democrática de derecho.\nARTÍCULO 16. EL PROFESIONALISMO EN MATERIA DE TRANSPARENCIA INFORMATIVA. El\nInstituto, en coordinación con las entidades públicas, elaborará e instrumentará un programa anual de capacitación y actualización de los servidores públicos en materia de transparencia informativa.\nEsta capacitación y actualización se llevará a cabo a través de cursos, seminarios, talleres, conferencias o cualquier otra forma de enseñanza/aprendizaje.\nARTÍCULO 17. LA EDUCACIÓN EN MATERIA DE TRANSPARENCIA INFORMATIVA. El Instituto promoverá que en los planes y programas de estudio de la educación preescolar, primaria, secundaria, normal y demás para la formación de maestros de educación básica que se impartan en el estado, se incluyan contenidos sobre la importancia del derecho a la información pública.\nEl Instituto coadyuvará con las autoridades educativas en la preparación de los contenidos y en el diseño de los materiales didácticos de dichos planes y programas.\nLas universidades públicas y privadas incluirán, dentro de sus actividades académicas, temas del derecho a la información pública.\nEl Instituto, en coordinación con las instituciones de educación superior, promoverá la integración de un centro de investigación, difusión y docencia sobre el derecho a la información pública.\nARTÍCULO 18. EL PROGRAMA DE LA CULTURA DE TRANSPARENCIA INFORMATIVA. El Instituto elaborará el Programa de la Cultura de Transparencia Informativa, conforme a las bases siguientes:\nI. Se definirán los objetivos, estrategias y acciones particulares para alcanzar el libre acceso a la información pública.\nIII. Este programa deberá propiciar la colaboración y participación activa del Instituto con las entidades públicas y las personas, conforme a los lineamientos siguientes:\n1. Se instrumentarán cursos de capacitación, talleres, conferencias o cualquier otra forma de aprendizaje, a fin de que las personas tengan la oportunidad real de ejercer los derechos que establece esta ley.\n2. Con la asesoría del Instituto, las entidades públicas autorizarán los formatos necesarios, a fin de que a los ciudadanos se les facilite el ejercicio del derecho a la información pública.\n3. El Instituto certificará a las entidades públicas, organizaciones u asociaciones de la sociedad que ofrezcan, en forma interdisciplinaria y profesional, la posibilidad de llevar a cabo cursos o talleres en materia de acceso a la información pública.\n4. Las escuelas o facultades de derecho o de las ciencias sociales relacionadas con el tema, así como las asociaciones, barras y colegios de abogados en el estado, ofrecerán una función social de asesoría y apoyo legal a las personas que pretendan ejercitar el derecho a la información pública.\n5. El Instituto tendrá la obligación de prestar la asesoría, el apoyo o el auxilio necesario a las personas que pretendan ejercitar el derecho a la información pública. Para tal efecto, diseñará e instrumentará mecanismos que faciliten el ejercicio pleno de este derecho.\nIV. Se evaluará objetiva, sistemática y periódicamente, el avance del programa y los resultados de su ejecución, así como su incidencia en la consecución de la finalidad prevista en esta ley.\nV. Con base en las evaluaciones correspondientes, el programa se modificará y/o adicionará en la medida en que el Instituto lo estime necesario.\nARTÍCULO 19. LA PUBLICACIÓN Y DIFUSIÓN DEL PROGRAMA. El Programa de la Cultura de\nTransparencia Informativa y sus reformas, deberán publicarse en el Periódico Oficial del Gobierno del\nEstado.\nEl Instituto instrumentará los mecanismos para la difusión, eficacia y vigencia permanente de dicho programa.\nTÍTULO CUARTO\nEL LIBRE ACCESO A LA INFORMACIÓN PÚBLICA\nCAPÍTULO PRIMERO\nLOS SUJETOS DE LA LEY\nARTÍCULO 20. EL SUJETO ACTIVO DEL DERECHO A LA INFORMACIÓN PÚBLICA. Todas las personas pueden ejercer los derechos tutelados en la presente ley, previo el debido procedimiento para acceder a la información pública.\nPor interés público, toda persona podrá acceder en forma directa e inmediata a la documentación e información relativas al uso, destino y aplicación de recursos públicos que reciban las organizaciones no gubernamentales, sindicatos o personas físicas o morales, cualesquiera que sea su denominación.\nLa información de los partidos políticos y de las agrupaciones políticas, se sujetará al principio de máxima publicidad y la transparencia en el financiamiento, conforme a la ley de la materia.\nARTÍCULO 21. EL SUJETO OBLIGADO DEL DERECHO A LA INFORMACIÓN PÚBLICA. Todas las entidades y sus servidores públicos son sujetos obligados a proporcionar la información pública.\nLas entidades públicas tienen la obligación de administrar, conservar y preservar la documentación pública, en los términos de la ley de la materia.\nLa función de acceso a la información pública, se basa en los principios de constitucionalidad, legalidad, certeza, independencia, imparcialidad, objetividad y profesionalismo.\nARTÍCULO 22. EL PRINCIPIO DE RESPONSABILIDAD DEL SERVIDOR PÚBLICO. Todos los normas, políticas y acciones en la materia, en los términos de las disposiciones aplicables.\nDel conocimiento público de documentos e información clasificada como reservada, sólo serán responsables los servidores públicos, de acuerdo con esta ley y demás disposiciones aplicables.\nARTÍCULO 23. LA GARANTÍA DE RESPONSABILIDAD EN EL USO DE LA INFORMACIÓN PÚBLICA.\nEl uso de la información pública es responsabilidad de la persona o servidor que tiene en su poder la información, en los términos de las disposiciones aplicables.\nNinguna entidad pública podrá tomar acciones en contra de aquella persona que use o disponga lícitamente de la información pública recibida, en los términos previstos en esta ley.\nLa pérdida, destrucción, alteración u ocultamiento de la información pública y de los documentos en que se contenga, serán sancionados en los términos de las disposiciones aplicables.\nCAPÍTULO SEGUNDO\nLA GARANTÍA DE LA INFORMACIÓN PÚBLICA MÍNIMA\nARTÍCULO 24. LA GARANTÍA MÍNÍMA DEL LIBRE ACCESO A LA INFORMACIÓN PÚBLICA. La garantía mínima del libre acceso a la información pública, se sujetará a las reglas siguientes:\nI. En general, todas las entidades públicas deberán informar por lo menos:\n1. Su estructura orgánica, los servicios que en general presta, las atribuciones por unidad o área administrativa y la normatividad que las rige.\n2. Las leyes, decretos, acuerdos, reglamentos, circulares y demás disposiciones de observancia general que rijan en el ámbito de su competencia.\n3. Manuales de organización y, en general, la base legal que fundamente la actuación de las entidades públicas.\n4. El directorio de servidores públicos, desde el nivel de jefe de departamento o sus equivalentes hasta los mandos superiores.\n5. La remuneración mensual por puesto, incluyendo todas las percepciones.\n6. Las convocatorias a concurso o licitación de obras, adquisiciones, arrendamientos, prestación de servicios, concesiones, permisos y autorizaciones, así como sus resultados.\n7. Las opiniones, datos y fundamentos finales contenidos en los expedientes administrativos que justifican el otorgamiento de permisos, concesiones o licencias que la ley confiere autorizar a cualquiera de las entidades públicas, así como las contrataciones, licitaciones y los procesos de toda adquisición de bienes o servicios.\n8. El Sistema Integral de Información Financiera.\n9. Los balances generales y los estados financieros.\n10. La ejecución del presupuesto de egresos conforme el ejercicio correspondiente.\n11. Los resultados de todo tipo de auditorías concluidas y practicadas al ejercicio presupuestal de cada una de las entidades públicas.\n12. La entrega de recursos públicos, cualquiera que sea su destino.\n13. El nombre, domicilio oficial y dirección electrónica, en su caso, de los servidores públicos encargados de gestionar y resolver las solicitudes de información pública.\n14. Los instrumentos de participación comunitaria o ciudadana.\n15. Los servicios públicos y los programas que ofrecen, así como los trámites, requisitos y formatos para acceder a los mismos.\n16. Información anual de actividades.\n17. La calendarización de las sesiones o reuniones públicas y las correspondientes minutas o actas de dichas sesiones.\n18. El boletín de información pública de sus actividades.\n19. Cualquier otra información que sea de utilidad para el ejercicio del derecho a la información pública, o la que conforme a la ley tenga que hacerse pública.\nII. Además de lo previsto en la fracción anterior, el Poder Legislativo del Estado deberá informar:\n1. Las cuentas públicas del estado, de los municipios, de los órganos públicos autónomos y demás entidades sujetas a fiscalización, en los términos de la ley de la materia.\n2. Las leyes y decretos aprobados por el Congreso del Estado o la Diputación Permanente.\n3. Los dictámenes sobre iniciativas de ley o decreto.\n4. El Diario de Debates.\n5. Las controversias entre poderes públicos, iniciadas por el Congreso o cualquiera de sus integrantes.\n1. El Plan Estatal de Desarrollo.\n3. La Agenda Comunitaria Estatal en los términos de la ley de la materia.\n4. Las iniciativas de leyes o decretos y demás disposiciones generales o particulares en materia administrativa. informar:\n1. Los procedimientos de justicia constitucional local.\n2. Las tesis aisladas y jurisprudenciales publicadas en el Boletín de Información Judicial o en el\n3. Los expedientes judiciales y administrativos concluidos que estarán a disposición del público en el archivo judicial, salvo la información confidencial o reservada, en los términos de las disposiciones aplicables.\n4. Las listas de acuerdos.\n5. Los acuerdos administrativos del Consejo de la Judicatura.\n6. La aplicación del Fondo para Mejorar la Administración de Justicia.\nV. Sin perjuicio de lo previsto en la fracción I de este artículo, los ayuntamientos deberán informar:\n1. El Plan Municipal de Desarrollo.\n2. Los programas, planes o proyectos de gobierno de sus entidades y dependencias.\n3. La Agenda Comunitaria Municipal en los términos de la ley de la materia.\n4. Las iniciativas de ley, decretos, reglamentos o disposiciones de carácter general o particular en materia municipal.\nVI. Además de lo previsto en la fracción I de este artículo, el Instituto Electoral y de Participación\nCiudadana de Coahuila y, en su caso, los partidos y asociaciones políticas, deberán informar:\n1. Las plataformas políticas, los estatutos y demás normas internas de los partidos políticos.\n2. Los informes presentados por los partidos políticos o asociaciones políticas ante la autoridad electoral.\n3. La fiscalización de todos los recursos públicos y no públicos de los partidos políticos, bajo el principio de la transparencia en el financiamiento.\n4. Las quejas resueltas por violaciones a las leyes electorales o de participación ciudadana.\n5. El registro de los Consejos de Participación Ciudadana.\n6. Los partidos y las organizaciones políticas con registro oficial, rendirán información respecto a los recursos públicos y no públicos, bajo el principio de transparencia en el financiamiento. entidades públicas, previa solicitud del interesado en los términos previstos en esta ley.\nARTÍCULO 25. LA INFORMACIÓN ESPECIAL EN MATERIA DE ADQUISICIONES, ARRENDAMIENTOS, OBRAS Y SERVICIOS RELACIONADOS CON ELLAS. Los resultados de las convocatorias a concurso o licitación de obras, adquisiciones, arrendamientos y prestación de servicios, deberán contener:\nI. La identificación precisa del contrato.\nII. El monto.\nIII. Los requerimientos técnicos y administrativos de la compra gubernamental.\nIV. El nombre del proveedor, contratista o de la persona física o moral con quien o quienes se haya celebrado el contrato.\nV. El plazo para su cumplimiento.\nVI. Mecanismos de vigilancia y/o supervisión de la sociedad civil que se observaron en los términos de ley.\nVII. Los instrumentos de participación comunitaria o ciudadana que se observaron en los términos de ley.\nARTÍCULO 26. LA INFORMACIÓN ESPECIAL EN MATERIA DE CONCESIONES, PERMISOS O\nAUTORIZACIONES A PARTICULARES. La información de concesiones, permisos o autorizaciones a particulares, deberá precisar:\nI. Nombre o razón social del titular.\nII. Concepto de la concesión, autorización o permiso.\nIII. Vigencia.\nIV. Mecanismos de vigilancia y/o supervisión de la sociedad civil que se observaron en los términos de ley.\nV. Los instrumentos de participación comunitaria o ciudadana que se observaron en los términos de ley.\nARTÍCULO 27. LA INFORMACIÓN ESPECIAL EN MATERIA DE OBRA PÚBLICA. La información de obra pública que ejecute cualquier entidad pública, deberá precisar:\nI. El monto.\nII. Los requerimientos técnicos y administrativos de la obra pública.\nIII. El lugar.\nIV. El plazo de ejecución.\nV. La identificación del órgano público responsable de la obra.\nVI. Mecanismos de vigilancia y/o supervisión de la sociedad civil que se observaron en los términos de ley.\nVII. Los instrumentos de participación comunitaria o ciudadana que se observaron en los términos de ley.\nCAPÍTULO TERCERO\nEL DEBIDO PROCEDIMIENTO PARA ACCEDER\nA LA INFORMACIÓN PÚBLICA\nAPARTADO PRIMERO\nPRINCIPIOS GENERALES\nARTÍCULO 28. LA PETICIÓN DIRECTA ANTE LA ENTIDAD PÚBLICA. Las personas ejercerán su derecho de acceso a la información ante la entidad pública que la tenga. Dicha entidad tendrá la obligación de proporcionar la información, a menos de que en su adscripción exista una unidad de atención o un comité interinstitucional que se encargue en forma sencilla, pronta y expedita del trámite de las solicitudes correspondientes, en los plazos previstos por esta ley.\nCuando se trate de las entidades privadas a que se refiere los numerales 6 y 7 de la fracción III del artículo 5 de esta ley, el ciudadano podrá solicitar la información ante la entidad que entregó el recurso público. En todo caso, la entidad pública requerirá de inmediato a la entidad privada toda la información necesaria para la transparencia y rendición de cuentas, en lo que respecta al ejercicio, destino o aplicación de los recursos públicos.\nARTÍCULO 29. LA ATENCIÓN DE LAS SOLICITUDES. Las entidades públicas designarán de entre sus servidores públicos, al responsable de la atención de las solicitudes de información que formulen las personas.\nSe podrán crear unidades de atención o comités interinstitucionales, según lo acuerde el superior jerárquico de la entidad pública que corresponda. Este acuerdo se publicará en el Periódico Oficial del\nGobierno del Estado, en donde se establecerá la organización y el funcionamiento de dichas unidades o comités.\nARTÍCULO 30. LA FUNCIÓN DE LAS UNIDADES O COMITÉS. En todo caso, las unidades o los comités podrán contar, según el acuerdo respectivo, con las funciones siguientes:\nI. Recibir, tramitar y resolver las solicitudes de acceso a la información pública.\nII. Difundir en coordinación con las dependencias y unidades administrativas correspondientes la información pública mínima.\nIII. Administrar, sistematizar, archivar y resguardar la información clasificada como reservada y confidencial en coordinación con las dependencias y unidades administrativas correspondientes.\nIV. Promover y coordinar ante las entidades públicas de su adscripción, la actualización periódica de la información.\nV. Orientar y auxiliar a las personas en la elaboración y entrega de las solicitudes de acceso a la información.\nVI. Realizar los trámites y gestiones dentro de la entidad pública de su adscripción para entregar la información solicitada y efectuar las notificaciones correspondientes.\nVII. Promover la capacitación, actualización y habilitación oficial de los servidores públicos que se encargarán de recibir y dar trámite a las solicitudes presentadas.\nVIII. Administrar y actualizar mensualmente el registro de las solicitudes, respuestas, trámites y costos que implique el cumplimiento de sus funciones.\nIX. La protección del derecho a la intimidad de las personas en los términos de la ley de la materia.\nX. Las demás funciones necesarias para facilitar el ejercicio del derecho de acceso a la información.\nARTÍCULO 31. LA RESPONSABILIDAD DE DOCUMENTAR LA INFORMACIÓN PÚBLICA. Quienes produzcan, administren, manejen, archiven o conserven información pública, serán responsables de documentarla en los términos de las disposiciones aplicables.\nEn todo caso, la documentación pública responderá a criterios de calidad, veracidad, confiabilidad y oportunidad.\nARTÍCULO 32. LA DISPOSICIÓN DE LA INFORMACIÓN PÚBLICA. Toda la información en poder de de la materia, para que puedan solicitar o examinar la información, salvo aquella que se considere como reservada o confidencial, en los términos de las disposiciones aplicables.\nARTÍCULO 33. EL LIBRE ACCESO A LA INFORMACIÓN PÚBLICA. El que solicite información pública tiene derecho, a su elección, a que se le proporcione de manera verbal o por escrito, y a obtener por cualquier medio, la reproducción de los documentos en que se contenga, previo el pago respectivo.\nEn caso de la información verbal, la entidad pública deberá levantar el acta o el formato correspondiente para evidenciar el acceso a la información.\nARTÍCULO 34. LA ENTREGA DE LA INFORMACIÓN PÚBLICA. La información se proporcionará en el estado en que se encuentre en las entidades públicas. La obligación de la entidad pública de proporcionar información no comprende el procesamiento de la misma, ni el presentarla conforme al interés particular del solicitante.\nSin perjuicio de lo anterior, las entidades públicas deberán sistematizar la información.\nARTÍCULO 35. LA SISTEMATIZACIÓN DE LA INFORMACIÓN PÚBLICA. Cada entidad pública deberá sistematizar la información para facilitar el acceso de las personas a la misma, así como su publicación a través de los medios disponibles utilizando sistemas computacionales e información en línea en Internet.\nDe igual manera, tienen la obligación de proveer la información contenida en documentos escritos, fotografías, gráficos, grabaciones, soporte electrónico o digital, o en cualquier otro medio o formato, que se encuentre en su posesión o bajo su control.\nCuando por las características de la información y los sistemas informativos utilizados no sea posible subir toda la información a la red electrónica, se difundirá sólo el índice o catálogo donde se describan sus características técnicas, la oficina y ubicación y los responsables de su administración, archivo y resguardo.\nDe acuerdo con la disponibilidad presupuestal, las entidades públicas proveerán la instalación de un equipo de cómputo que facilite el acceso a la información pública mínima, así como los mecanismos eficaces para facilitar el acceso a la información pública a personas con capacidades diferentes en forma concreta.\nARTÍCULO 36. LA ACTUALIZACIÓN DE LA INFORMACIÓN MÍNIMA. Las entidades públicas están obligadas a realizar actualizaciones periódicas de la información pública mínima a que se refiere esta ley.\nARTÍCULO 37. LOS LINEAMIENTOS PARA LA CONSULTA EXPEDITA DE LA INFORMACIÓN. El\nInstituto, en coordinación con las entidades públicas, expedirá los lineamientos pertinentes, con el propósito de establecer formatos sencillos, entendibles y claros para la consulta expedita de la información difundida por las entidades públicas.\nARTÍCULO 38. LA PRESUNCIÓN DE LA REUNIÓN PÚBLICA Y EL LEVANTAMIENTO DE UNA\nMINUTA. Por regla general, las reuniones o sesiones de las entidades y sus servidores públicos son públicas, salvo que por disposición expresa de la ley, del titular de la entidad o del órgano correspondiente, se determine que deban realizarse con carácter reservado o privado. levantarse una minuta que deberá administrarse, conservarse y preservarse en los archivos oficiales en los términos de la ley de la materia.\nAPARTADO SEGUNDO\nLA SOLICITUD DE LA INFORMACIÓN PÚBLICA\nARTÍCULO 39. LA SOLICITUD ESCRITA O VERBAL. La solicitud deberá hacerse por escrito, a menos que la índole del asunto permita que sea verbal, en cuyo caso la entidad registrará en un acta o formato las características de la solicitud y procederá a entregar una copia de la misma al interesado.\nEn todo caso, el Instituto se coordinará con las isposici públicas para poner a isposición de las personas los formatos necesarios, a fin de que se les facilite el ejercicio del derecho a la información pública.\nARTÍCULO 40. LOS REQUISITOS DE LA SOLICITUD. La solicitud de acceso a la información deberá contener cuando menos los siguientes datos:\nI. Identificación de la autoridad a quien se dirija.\nII. Nombre completo, domicilio, firma autógrafa y datos generales del solicitante.\nIII. Identificación de los datos e informaciones que requiere.\nIV. Lugar o medio señalado para recibir la información.\n(ADICIONADO, P.O. 17 DE ABRIL DE 2007)\nEn caso de que el peticionario realice la solicitud por medios remotos de comunicación, no será necesario incluir firma autógrafa, si no que podrá ser sustituida por un nombre de usuario en los términos de las disposiciones reglamentarias que para tal efecto se expidan.\nARTÍCULO 41. LA SUBSANABILIDAD DE LA SOLICITUD. Si la solicitud es obscura o no contiene todos los datos requeridos, la entidad pública deberá hacérselo saber por escrito al solicitante, en un plazo no mayor de tres días hábiles después de recibida aquélla, a fin de que la aclare o complete.\nEn todo caso, el solicitante deberá contar con el apoyo del servidor público correspondiente designado por la entidad pública para recibir y tramitar las solicitudes, en caso de así requerirlo.\nSi la solicitud es presentada ante una oficina que no es competente para entregar la información, dicha oficina deberá enviarle la solicitud a la entidad pública competente para su contestación. En todo caso, se deberá orientar al solicitante para continuar con el trámite de su solicitud.\nARTÍCULO 42. LA GARANTÍA DE GRATUIDAD DE LA INFORMACIÓN PÚBLICA. El examen y la consulta que soliciten las personas de la información pública serán gratuitos.\nARTÍCULO 43. EL COSTO DEL SERVICIO DE ACCESO A LA INFORMACIÓN PÚBLICA. La reproducción, los gastos de envío o el proceso de búsqueda de información pública que no se encuentre disponible en la oficina donde se formuló la consulta, facultará a la entidad pública a realizar el cobro de un derecho en los términos de la ley de la materia.\nLos costos por obtener la información pública se ajustarán a los criterios siguientes:\nI. No podrán ser superiores a la suma del costo de los materiales utilizados en la reproducción de la información.\nII. No podrán ser superiores a la suma del costo de envío.\nIII. Las entidades públicas procurarán reducir, al máximo, los tiempos y costos de entrega de información.\nARTÍCULO 44. LA SENCILLEZ EN EL ACCESO A LA INFORMACIÓN PÚBLICA. Las entidades procedimientos que deben efectuarse, las autoridades o instancias competentes, la forma de realizarlos, la manera de llenar los formularios que se requieran, así como de las entidades ante las que se puede acudir para solicitar orientación o formular quejas, consultas o reclamos sobre la prestación del servicio o sobre el ejercicio de las funciones o competencias a cargo de la autoridad de que se trate.\nEn todo caso, las entidades públicas darán una oportuna y amplia difusión de los programas sociales que operan en forma transparente.\nARTÍCULO 45. LA INADMISIÓN DE LA SOLICITUD. En el caso de que la solicitud sea rechazada, se le comunicará por escrito al solicitante dentro de los tres días hábiles siguientes a su presentación. Esta negativa deberá estar fundada y motivada.\nSi los vicios o irregularidades de la solicitud son inesenciales, la entidad pública deberá proveer lo necesario para que la persona pueda acceder en forma efectiva a la información pública solicitada.\n(REFORMADO, P.O. 17 DE ABRIL DE 2007)\nARTÍCULO 46. LA GARANTÍA DE CONTESTACIÓN DE LA SOLICITUD DE ACCESO A LA\nINFORMACIÓN PÚBLICA. Toda solicitud de información pública presentada por escrito o en forma verbal, deberá ser contestada en forma positiva o negativa en un plazo no mayor de diez días hábiles contados a partir del día siguiente de su presentación.\nEl plazo se podrá prorrogar en forma excepcional por otros diez días hábiles de mediar circunstancias que hagan difícil reunir la información solicitada. En su caso, la entidad pública deberá comunicar al interesado, antes del vencimiento del plazo de diez días, las razones por las cuales hará uso de la prórroga excepcional.\nEn ningún caso el plazo excederá de veinte días hábiles.\nLas solicitudes realizadas por medios remotos de comunicación deberán ser contestadas en forma positiva o negativa en un plazo no mayor a veinte días hábiles. El plazo se podrá prorrogar en forma excepcional por diez días hábiles más, cuando medien circunstancias que hagan difícil reunir la información solicitada. En ningún caso este plazo excederá de treinta días hábiles.\nARTÍCULO 47. LA GARANTÍA DE ACUDIR ANTE EL INSTITUTO PARA REQUERIR LA\nINFORMACIÓN EN CASO DE OMISIÓN. Cumplido el plazo previsto en el artículo anterior, si la solicitud de información no se hubiese satisfecho o la respuesta fuese ambigua o parcial a juicio del solicitante, el correspondiente la información solicitada, sin perjuicio de lo previsto en el sistema de medios de impugnación a que se refiere el apartado siguiente de esta ley.\nCuando por negligencia no se dé respuesta en tiempo y forma a la solicitud de acceso a la información, la autoridad queda obligada a otorgarle la información, previo requerimiento del Instituto, en un período no mayor a los diez días hábiles, cubriendo, en su caso, todos los gastos generados por la reproducción del material informativo, siempre y cuando la información de referencia no sea reservada o confidencial.\nAPARTADO TERCERO\nEL SISTEMA DE MEDIOS DE IMPUGNACIÓN\nARTÍCULO 48. EL DERECHO A IMPUGNAR. Toda persona tiene derecho a un recurso para reparar las violaciones al acceso a la información pública, de acuerdo a la garantía de la tutela judicial efectiva.\nEl sistema de medios de impugnación se integra por:\nI. El recurso de reconsideración.\nII. El recurso para la protección del acceso a la información pública.\nIII. La acción para la protección del derecho a la intimidad de las personas.\nARTÍCULO 49. LAS BASES DEL RECURSO DE RECONSIDERACIÓN. Toda persona tiene derecho al recurso de reconsideración conforme a las bases siguientes:\nI. Procede contra todo acto u omisión de la entidad pública.\nII. Se interpondrá ante el superior jerárquico del titular de la entidad pública responsable, dentro de los diez días hábiles, contados a partir de la fecha en que surta efectos la notificación del acto o de que se tenga conocimiento del mismo.\nIII. Este recurso será optativo cuando se trate del requerimiento previsto en el artículo 47 de esta ley.\nIV. Se deberá garantizar un acceso sencillo, eficaz, esencial, pronto y expedito al recurso, en los términos del artículo 8 de esta ley.\nV. La aplicación restrictiva de las causas de inadmisión.\nVI. Se dará la oportunidad de ofrecer y desahogar pruebas, y alegar.\nVII. En todo caso, el recurso se deberá resolver en un plazo máximo de diez días hábiles, a partir de la fecha en que se presentó.\nARTÍCULO 50. LAS FORMALIDADES DEL RECURSO DE RECONSIDERACIÓN. El recurso de reconsideración deberá presentarse por escrito cumpliendo con los siguientes requisitos:\nI. Estar dirigido al superior jerárquico del titular de la entidad pública responsable.\nII. Señalar el nombre del inconforme y, en su caso, el de su representante legal, así como estampar su firma o huella digital.\nIII. Señalar domicilio para recibir notificaciones y, en su caso, a quien en su nombre las pueda oír y recibir.\nIV. Precisar el acto u omisión y la autoridad responsable del mismo.\nV. Señalar la fecha en que se hizo la notificación o sabedor del acto.\nVI. Mencionar de manera expresa y clara los hechos en que se funde la impugnación, los agravios que le cause el acto o resolución impugnados y los preceptos legales presuntamente violados.\nVII. Acompañar, en su caso, copia de la resolución o acto que se impugna y de la notificación correspondiente.\nVIII. Ofrecer y aportar, en su caso, pruebas que tengan relación directa con el acto o resolución que se impugnen, debiendo acompañar las documentales con las que cuente.\nARTÍCULO 51. LA SUBSANABILIDAD DEL RECURSO DE RECONSIDERACIÓN. La autoridad deberá prevenir al inconforme sobre los errores de forma y fondo de los que, en su caso, adolezca su escrito de impugnación. Para subsanar dichos errores deberá concederle un plazo de tres días contados a partir de la notificación.\nCuando el recurso sea notoriamente improcedente, se desechará de plano.\nARTÍCULO 52. LA FUNDAMENTACIÓN Y MOTIVACIÓN DE LA RESOLUCIÓN. La resolución del recurso de reconsideración deberá estar por escrito debidamente fundada y motivada.\nEn los casos en que se confirme la negativa a liberar información, la autoridad estará obligada a especificar los recursos e instancias con los que cuenta el quejoso para hacer valer sus medios de defensa.\nARTÍCULO 53. EL RECURSO PARA LA PROTECCIÓN DEL ACCESO A LA INFORMACIÓN\nPÚBLICA. El recurso para la protección del acceso a la información pública, podrá interponerse contra las resoluciones que pongan fin al recurso de reconsideración. La omisión de resolver también se podrá impugnar.\nDeberá presentarse ante el Instituto, observando en lo conducente las formalidades previstas para el recurso de reconsideración y las demás disposiciones aplicables en el reglamento respectivo.\nEl recurso para la protección del derecho a la intimidad de las personas, se sujetará a la ley de la materia.\nARTÍCULO 54. LA GARANTÍA DE IMPUGNAR POR LA VÍA JUDICIAL. La persona agraviada tendrá el derecho de acudir al órgano jurisdiccional competente para hacer valer lo que a su derecho corresponda, en los términos de la ley de la materia.\nARTÍCULO 55. LA REGLAMENTACIÓN DE LOS RECURSOS. El Instituto reglamentará los recursos previstos en este apartado, de acuerdo con los principios previstos en la Constitución y esta ley.\nTÍTULO QUINTO\nLA INFORMACIÓN RESERVADA\nARTÍCULO 56. LA LIMITACIÓN DE ORDEN PÚBLICO AL LIBRE ACCESO A LA INFORMACIÓN\nPÚBLICA. El ejercicio del derecho a la información pública sólo será restringido en los términos previstos por esta ley, mediante la figura de la información reservada.\nLa información confidencial para la protección del derecho a la intimidad de la personas, se regirá por la ley de la materia.\nARTÍCULO 57. EL CONCEPTO DE LA INFORMACIÓN RESERVADA. La información reservada es la que se clasifica como tal mediante acuerdo por escrito del titular de cada una de las entidades públicas, reservada.\nARTÍCULO 58. LOS RESPONSABLES DE LA INFORMACIÓN RESERVADA. Cada entidad pública señalará los servidores públicos responsables de la clasificación, administración, resguardo, conservación y preservación de la información reservada.\nSin perjuicio de lo anterior, se podrán crear comités para la clasificación de la información reservada, según lo acuerde el titular de la entidad pública que corresponda. Este acuerdo se publicará en el dichos comités.\nARTÍCULO 59. LAS FUNCIONES DE LOS RESPONSABLES DE LA INFORMACIÓN RESERVADA. En todo caso, los funcionarios públicos responsables o, en su caso, los comités para la clasificación de la información reservada, según el acuerdo respectivo, tendrán las atribuciones siguientes:\nI. Recibir y dar trámite a todas las solicitudes que pretendan clasificar como reservada la información por la entidad pública.\nII. Clasificar la información reservada, previa fundamentación y motivación por escrito.\nIII. Resolver acerca de los fundamentos y motivaciones que se adujeron en las respuestas negativas a las solicitudes de información, con el objeto de confirmar, modificar o revocar la clasificación de la información reservada realizada por los titulares de las entidades públicas o unidades administrativas responsables, en su caso.\nIV. Requerir a las unidades o áreas administrativas y servidores públicos, la entrega de la información correspondiente, para determinar sobre su clasificación reservada.\nV. Realizar las gestiones necesarias ante las entidades públicas que corresponda, para cumplir con sus funciones de reservar la información.\nVI. Supervisar dentro de la entidad pública que corresponda la aplicación de las disposiciones en la materia.\nVII. Las demás funciones necesarias para facilitar la facultad de clasificar como reservada la información pública correspondiente.\nARTÍCULO 60. LA CAUSA LEGAL DE LA INFORMACIÓN RESERVADA. La clasificación de la información sólo procede en los siguientes casos:\nI. Cuando se trate de información cuya divulgación ponga en riesgo la seguridad interior del estado, la vida, la seguridad o la salud de cualquier persona o el desarrollo de investigaciones oficiales reservadas.\nII. La información cuya divulgación pueda causar un serio perjuicio a las actividades de prevención o persecución de los delitos, la gobernabilidad democrática, la impartición de justicia, la recaudación de las contribuciones, o cualquier otra acción que tenga por objeto la aplicación de las leyes.\nIII. Los expedientes de procesos judiciales o administrativos en tanto no hayan causado ejecutoria, salvo público, en los términos de esta ley y demás disposiciones aplicables.\nIV. Las averiguaciones previas y la información que comprometa los procedimientos de investigación penal o penitenciaria, salvo los casos de excepción previstos por la ley.\nV. Cuando se trate de información sobre estudios y proyectos cuya divulgación pueda causar daños al interés del estado o suponga un riesgo para su realización.\nVI. Cuando se trate de información de particulares recibida por la administración pública bajo promesa de reserva o esté relacionada con la propiedad intelectual, patentes o marcas en poder de las autoridades.\nVII. Cuando se trate de información correspondiente a documentos o comunicaciones internas que sean parte de un proceso deliberativo, previo a la toma de una decisión administrativa o judicial.\nVIII. Cuando se trate de información que pueda generar una ventaja personal indebida en perjuicio de un tercero.\nIX. La que por disposición legal sea considerada reservada.\nARTÍCULO 61. EL ACUERDO DE LA INFORMACIÓN RESERVADA. El acuerdo que clasifique la información como reservada deberá demostrar que:\nI. La información encuadra legítimamente en alguna de las hipótesis de excepción previstas en la presente ley.\nII. La liberación de la información de referencia constituye un riesgo para el interés público protegido por la ley.\nIII. El riesgo y los daños que pueden producirse con la liberación de la información, sean superiores al interés de conocer la información.\nARTÍCULO 62. EL ACUERDO DE LA INFORMACIÓN RESERVADA. El acuerdo que, en su caso, clasifique la información como reservada, deberá fundar y motivar:\nI. La fuente y el archivo donde se encuentra la información.\nII. La justificación por la cual se clasifica.\nIII. La parte o las partes del documento que se reserva.\nIV. El plazo de reserva.\nV. La designación de la autoridad responsable para su protección.\nARTÍCULO 63. LA CLÁUSULA EXPRESA DE LA INFORMACIÓN RESERVADA. Las partes de un documento que no estén expresamente reservadas, se considerarán de libre acceso público.\nARTÍCULO 64. LA INADMISIÓN DE LA INFORMACIÓN RESERVADA POR VIOLACIONES DE\nDERECHOS FUNDAMENTALES. No podrá clasificarse como reservada, la información pública que sea relevante para la protección de derechos fundamentales, de acuerdo con las leyes mexicanas y los instrumentos internacionales en la materia.\nARTÍCULO 65. EL PLAZO DE DURACIÓN DE LA INFORMACIÓN RESERVADA. La información clasificada como reservada tendrá este carácter hasta por doce años. Ésta será accesible al público, aún cuando no se hubiese cumplido el plazo anterior, si dejan de concurrir las circunstancias que motivaron su clasificación, a juicio de la entidad pública.\nLas entidades públicas podrán ampliar por igual término el período de reserva, siempre y cuando subsistan las causas que dieron origen a su clasificación.\nARTÍCULO 66. LA RESPONSABILIDAD DE LA INFORMACIÓN RESERVADA. Los servidores públicos en posición de garantes conforme a la ley, serán responsables por el quebrantamiento de la reserva de información. administración, conservación, preservación y control.\nEl Instituto y la autoridad judicial competente, podrán acceder a los elementos que sustentan la información reservada, exclusivamente para revisar la legitimidad de la clasificación, siempre y cuando medios de impugnación en la materia. La parte interesada, en ningún momento, podrá conocer dichos elementos en tanto el Instituto o la autoridad judicial resuelve lo que conforme a derecho proceda.\nTÍTULO SEXTO\nDISPOSICIONES FINALES\nARTÍCULO 67. EL INSTITUTO PARA GARANTIZAR EL DERECHO. La ley de la materia establecerá la organización y funcionamiento del Instituto para salvaguardar el derecho de acceso a la información pública.\nARTÍCULO 68. LA PROTECCIÓN DEL DERECHO A LA INTIMIDAD DE LAS PERSONAS. La ley de la materia establecerá la máxima protección del derecho a la intimidad, como información confidencial que limita el acceso a la información pública.\nARTÍCULO 69. LA DOCUMENTACIÓN PÚBLICA. Las entidades públicas deberán administrar, conservar y preservar la documentación pública a través de medios confiables, eficientes y eficaces, en los términos de la ley de la materia.\nARTÍCULO 70. LAS FALTAS ADMINISTRATIVAS Y SU CLÁUSULA DE INTANGIBILIDAD. Las faltas en materia de acceso a la información pública que cometan los servidores públicos, se sancionarán en los términos de la ley de la materia.\nEn ningún caso, se sancionará a un servidor público que comunique o publique información pública que revele corrupción o prácticas irregulares.\nARTÍCULO 71. EL REENVÍO A OTROS ORDENAMIENTOS LEGALES. En todo caso, a falta de lo previsto en esta ley, se estará a lo dispuesto en los ordenamientos legales aplicables, siempre y cuando no contravengan los principios para acceder a la información pública previstos en esta ley.\nPRIMERO. La presente ley entrará en vigor a los 90 días hábiles siguientes a su publicación en el\nDurante el plazo de vacancia, los poderes legislativo, ejecutivo y judicial promoverán la difusión de esta ley, para garantizar el derecho fundamental de las personas de conocer esta ley.\nSEGUNDO. Dentro del año siguiente contado a partir de que el Instituto entre en funciones, se expedirán\nI. El Programa de la Cultura de Transparencia Informativa en los términos de los artículos 14 a 19 de esta ley.\nII. En coordinación con las entidades públicas, el Instituto emitirá los lineamientos pertinentes para establecer los formatos para la consulta expedita de la información en los términos de esta ley.\nIII. El Reglamento de Medios de Impugnación en Materia de Acceso a la Información Pública y demás reglamentos y acuerdos sobre la materia que establezcan otras leyes.\nIV. El Instituto elaborará un Programa de Seguimiento para la Implementación del Acceso a la\nInformación Pública, a partir de los criterios siguientes:\n1. Dentro de los seis meses siguientes a su funcionamiento, el Instituto elaborará y entregará las recomendaciones pertinentes a cada una de las entidades públicas para que:\na) Cada entidad pública esté en condiciones de establecer los servidores públicos, las unidades de atención o los comités interinstitucionales, en los términos de esta ley, para dar respuesta a las solicitudes.\nb) Cada entidad pública esté en condiciones de establecer los servidores públicos o los comités para la información reservada, en los términos de esta ley.\nc) Cada entidad pública ponga a disposición el catálogo o índice de la información pública, en los términos de esta ley y demás disposiciones aplicables.\n2. Las entidades públicas contarán con un plazo de cuatro meses después de la entrada en vigor de esta ley, para que realicen la difusión de la información pública mínima.\nTERCERO. Las personas podrán ejercer el derecho de acceso a la información pública a partir del día 1º de Diciembre de 2004.\nCUARTO. Se derogan todas aquellas disposiciones que se opongan al contenido de la presente ley.\nEn todo caso, el Congreso del Estado realizará las adecuaciones a la legislación secundaria para evitar cualquier antinomia, contradicción, ambigüedad o laguna en materia de acceso a la información pública.\nDADO en el Salón de Sesiones del Congreso del Estado, en la Ciudad de Saltillo, Coahuila, a los ocho días del mes de octubre del año dos mil tres.\nDIPUTADO PRESIDENTE.\nFERNANDO DE LA FUENTE VILLARREAL.\nDIPUTADA SECRETARIA DIPUTADO SECRETARIO.\nHILDA ESTHELA FLORES ESCALERA. FRANCISCO ORTIZ DEL CAMPO.\nIMPRIMASE, COMUNIQUESE Y OBSERVERSE\nEL GOBERNADOR DEL ESTADO\nLIC. ENRIQUE MARTINEZ Y MARTINEZ\nEL SECRETARIO DE GOBIERNO\nLIC. JOSE JESÚS RAUL SIFUENTES GUERRERO\nC.P. MARIA INES GARZA ORTA\nEL SECRETARIO DE FINANZAS\nLIC. JAVIER GUERRERO GARCIA\nN. DE E. A CONTINUACION SE TRANSCRIBEN LOS ARTICULOS TRANSITORIOS DE LOS DECRETOS DE\nREFORMAS A LA PRESENTE LEY.\nPRIMERO. El presente decreto entrará en vigor al día siguiente de su publicación en el Periódico Oficial del Gobierno del Estado.\nSEGUNDO. Los sujetos obligados a proporcionar la información según lo previsto en la Ley de Acceso a la\nInformación Pública, contarán con trescientos días naturales después de la publicación del presente Decreto, para que en el ámbito de su capacidad técnica y presupuestal, realicen las acciones necesarias para dar cumplimiento al presente.",
  "ordenamiento": "REGLAMENTO",
  "jurisdiccion": "COAHUILA",
  "fuente_oficial": "DIARIO OFICIAL DE LA FEDERACION",
  "Fecha de Publicación": "4 de noviembre de 2003",
  "ULTIMA REFORMA PUBLICADA": "17 DE ABRIL DE 2007",
  "es_escaneado": false,
  "tiene_tablas": false,
  "materia": [
    "transparencia"
  ]
}