{
  "titulo": "Ley Estatal de Salud",
  "Contenido": "LEY ESTATAL DE SALUD\nEL C. LIC. ELISEO MENDOZA BERRUETO, GOBERNADOR CONSTITUCIONAL DEL ESTADO\nINDEPENDIENTE, LIBRE Y SOBERANO DE COAUHILA DE ZARAGOZA, A SUS HABITANTES SABED:\nQUE EL CONGRESO DEL ESTADO INDEPENDIENTE, LIBRE Y SOBERANO DE COAHUILA DE\nZARAGOZA, DECRETA:\nNUMERO: 252\nLEY ESTATAL DE SALUD\nTITULO PRIMERO\nDISPOSICIONES GENERALES\nCAPITULO UNICO\nArtículo 1o. La presente Ley es de orden público e interés social y tiene por objeto la protección de la salud, así como establecer las bases y modalidades para el acceso a los servicios de salud proporcionados por el Estado y la concurrencia de éste y sus municipios en materia de salubridad local, en términos del Artículo 4o. de la Constitución Política de los Estados Unidos Mexicanos y de la Ley\nGeneral de Salud. Es de aplicación en el Estado de Coahuila.\nArtículo 2o. El derecho a la protección de la salud, tiene las siguientes finalidades:\nI. El bienestar físico y mental del hombre, para contribuir al ejercicio pleno de sus capacidades;\nII. La prolongación y el mejoramiento de la calidad de la vida humana;\nIII. La protección y el acrecentamiento de los valores que coadyuven a la creación, conservación y disfrute de condiciones de salud que contribuyan al desarrollo social;\nIV. La extensión de actitudes solidarias y responsables de la población en la preservación, conservación, mejoramiento y restauración de la salud;\nV. El disfrute de servicios de salud que satisfagan eficaz y oportunamente las necesidades de la población;\nVI. El conocimiento para el adecuado aprovechamiento y utilización de los servicios de salud, y\nVII. El desarrollo de la enseñanza y la investigación científica y tecnológica para la salud.\nArtículo 3o. Son autoridades sanitarias estatales:\nI. El Gobernador del Estado;\nII. La Secretaría de Salud del Estado, y\nIII. Los Ayuntamientos en el ámbito de su respectiva competencia.\nArtículo 4o. En los términos de la Ley General de Salud y de la presente Ley, corresponde al Estado de\nCoahuila.\nA. En materia de Salubridad General:\nI. La atención médica, preferentemente en beneficio de grupos vulnerables;\nII. La atención materno-infantil;\nIII. La prestación de servicios de planificación familiar;\nIV. La salud mental;\nV. La organización, coordinación y vigilancia del ejercicio de las actividades profesionales, técnicas y auxiliares para la salud;\nVI. La promoción de la formación de recursos humanos para la salud;\nVII. La coordinación de la investigación para la salud y el control de ésta en los seres humanos;\nVIII. La información relativa a las condiciones, recursos y servicios de salud;\nIX. La educación para la salud;\nX. La orientación y vigilancia en materia de nutrición;\nXI. La prevención y el control de los efectos nocivos de los factores ambientales en la salud del hombre;\nXII. La salud ocupacional y el saneamiento básico;\nXIII. La prevención y el control de enfermedades transmisibles;\nXIV. La prevención y el control de las enfermedades no transmisibles y accidentes;\nXV. La prevención de la invalidez y la rehabilitación de los inválidos;\n(DEROGADA, P.O. 15 DE FEBRERO DE 2005)\nXVI. DEROGADA\nXVII. Participar con las autoridades federales en el desarrollo de los programas contra el alcoholismo, el tabaquismo y la farmacodependencia, de conformidad con el acuerdo de coordinación específico que al efecto se celebre;\nXVIII. Ejercer la verificación y el control sanitario de los establecimientos que expendan o suministren al público alimentos y bebidas no alcohólicas y alcohólicas, en estado natural, mezclados, preparados, adicionados o acondicionados, para su consumo dentro o fuera del mismo establecimiento basándose en las normas oficiales mexicanas y las normas técnicas que al efecto se emitan;\nXIX. Las demás que establezca la Ley General de Salud y otras disposiciones jurídicas aplicables.\nB. En materia de Salubridad Local:\nI. Mercados y centros de abasto;\nII. Construcciones, excepto la de los establecimientos de salud;\nIII. Cementerios, crematorios y funerarias;\nIV. Limpieza pública;\nV. Rastros;\nVI. Agua potable y alcantarillado;\nVII. Establos, granjas avícolas, porcícolas, apiarios y establecimientos similares;\nVIII. Prostitución;\nIX. Reclusorios o Centros de Readaptación Social;\nX. Baños públicos;\nXI. Centros de reunión y espectáculos;\nXII. Establecimientos dedicados a la prestación de servicios como peluquerías, salones de belleza o estéticas y otros similares;\nXIII. Establecimientos para el hospedaje;\nXIV. Transporte estatal y municipal;\nXV. Gasolinerías;\nXVI. Prevención y control de la rabia en animales y seres humanos, y\nXVII. Las demás materias que determine esta Ley y las disposiciones legales aplicables.\nTITULO SEGUNDO\nSISTEMA ESTATAL DE SALUD\nCAPITULO I\nDISPOSICIONES COMUNES\nArtículo 5o. El Sistema Estatal de Salud está constituido por las dependencias y entidades públicas y en el Estado, así como por los mecanismos de coordinación de acciones a fin de dar cumplimiento al derecho a la protección de la salud en el territorio del Estado de Coahuila.\nEl Sistema Estatal de Salud, con la intervención que corresponda al Comité de Planeación para el\nDesarrollo del Estado de Coahuila, definirán los mecanismos de coordinación y colaboración en materia de planeación, de los servicios de salud en el Estado, de conformidad con las disposiciones de esta Ley y las que al respecto sean aplicables.\nArtículo 6o. El Sistema Estatal de Salud tiene los siguientes objetivos:\nI. Proporcionar servicios de salud a toda la población del Estado y mejorar la calidad de los mismos, daños a la salud, con especial interés en las acciones preventivas;\nII. Contribuir al desarrollo demográfico armónico del Estado;\nIII. Se deroga.\nIV. Dar impulso al desarrollo de la familia y de la comunidad, así como a la integración social y al crecimiento físico y mental de la niñez;\nV. Apoyar el mejoramiento de las condiciones sanitarias del medio ambiente del Estado, que propicien el desarrollo satisfactorio de la vida;\nVI. Impulsar, en el ámbito estatal un sistema racional de administración y desarrollo de los recursos humanos para mejorar la salud, y\nVII. Coadyuvar a la modificación de los patrones culturales que determinen hábitos, costumbres y actitudes relacionados con la salud y con el uso de los servicios que presten para su protección.\nArtículo 7o. La coordinación del Sistema Estatal de Salud estará a cargo de la Secretaría de Salud del\nEstado, correspondiéndole lo siguiente:\nI. Establecer y conducir la política estatal en materia de salud, en los términos de esta Ley y demás disposiciones legales aplicables y de conformidad con las políticas del Sistema Nacional de Salud y con lo dispuesto por el Ejecutivo Estatal;\nII. Coordinar los programas de servicios de salud de las dependencias y entidades de la Administración\nPública Estatal;\nIII. Apoyar la coordinación de los programas y servicios de salud de toda dependencia o entidad pública estatal en los términos de la legislación aplicable y de los acuerdos de coordinación que en su caso se celebren. En el caso de los programas y servicios de instituciones federales de seguridad social, el apoyo se realizará tomando en cuenta lo que establezcan las leyes que rigen el funcionamiento de ésta;\nIV. Impulsar la desconcentración y descentralización a los municipios de los servicios de salud;\nV. Promover, coordinar y realizar la evaluación de programas y servicios de salud que le sea solicitada por el Ejecutivo Estatal;\nVI. Determinar la periodicidad y características de la información que deberán proporcionar las dependencias y entidades de salud del Estado, con sujeción a las disposiciones generales aplicables;\nVII. Coordinar el proceso de programación de las actividades de salud en el Estado, con sujeción a las disposiciones aplicables;\nVIII. Formular recomendaciones a las dependencias competentes sobre la asignación de los recursos que requieran los programas de salud del Estado;\nIX. Impulsar, en el ámbito estatal, las actividades científicas y tecnológicas en el campo de la salud;\nX. Coadyuvar con las dependencias federales competentes a la regulación y control de la transferencia de tecnología en el área de salud;\nXI. Promover el establecimiento de un sistema estatal de información básica en materia de salud;\nXII. Apoyar la coordinación entre las instituciones de salud y las educativas estatales y federales para formar y capacitar recursos humanos para la salud;\nXIII. Coadyuvar a que la formación y distribución de los recursos humanos para la salud sea congruente con las prioridades del Sistema Estatal de Salud;\nXIV. Promover e impulsar la participación de la comunidad del Estado en el cuidado de su salud;\nXV. Impulsar la permanente actualización de las disposiciones legales en materia de salud, y\nXVI. Las demás atribuciones, afines a las anteriores, que se requieran para el cumplimiento de los objetivos del Sistema Estatal de Salud, y las que determinen las disposiciones generales aplicables.\nArtículo 8o. La Secretaría de Salud del Estado, promoverá la participación en el Sistema Estatal de\nSalud de los prestadores de servicios de salud de los sectores público, social y privado, así como de sus trabajadores y de los usuarios de los mismos, en términos de las disposiciones que al efecto se expidan.\nAsimismo, fomentará la coordinación con los proveedores de insumos para las (sic) alud (sic), a fin de racionalizar y procurar la disponibilidad de estos últimos.\nArtículo 9o. La concertación de acciones entre la Secretaría de Salud del Estado y los integrantes de los sectores social y privado, se realizará mediante convenios y contratos, los cuales se ajustarán a las siguientes bases:\nI. Definición de las responsabilidades que asuman los integrantes de los sectores social y privado;\nII. Determinación de las acciones de orientación, estímulo y apoyo que llevará a cabo la Secretaría de\nSalud del Estado;\nIII. Especificación del carácter operativo de la concertación de acciones, con reserva de las funciones de autoridad de la Secretaría de Salud del Estado, y\nIV. Expresión de las demás estipulaciones que de común acuerdo establezcan las partes.\nArtículo 10. La competencia de las autoridades sanitarias en la planeación, regulación, organización y funcionamiento del Sistema Estatal de Salud, se regirá por las disposiciones de esta Ley y demás normas generales aplicables.\nDesarrollo Estatal, elaborará el Programa Estatal de Salud, tomando en cuenta las prioridades y los servicios del Sistema Estatal de Salud.\nCAPITULO II\nDISTRIBUCION DE COMPETENCIAS\nA. En materia de Salubridad General:\nI. Aplicar y vigilar el cumplimiento de las normas oficiales mexicanas que emita la Secretaría de Salud del\nII. En coordinación con el Ejecutivo Federal, organizar, operar, supervisar y evaluar los servicios de salud a que se refiere el apartado \"A\" del Artículo 4o., de esta Ley;\nIII. Coordinar el Sistema Estatal de Salud y coadyuvar en el funcionamiento y consolidación del Sistema\nNacional de Salud;\nIV. Formular y desarrollar programas locales de salud en el marco del Sistema Estatal de Salud y del\nSistema Nacional de Salud, de acuerdo con los principios y objetivos de la planeación nacional;\nV. Vigilar y hacer cumplir, en la esfera de su competencia, la Ley General de Salud, la presente Ley y las demás disposiciones aplicables;\nVI. Celebrar con la Federación los acuerdos de coordinación y en materia de salubridad general concurrente y exclusiva, y los convenios en los cuales éste asuma el ejercicio de las funciones, la ejecución y operación de obras y la prestación de servicios sanitarios, cuando el desarrollo económico y social lo haga necesario, de conformidad con la fracción VI del Artículo 116 de la Constitución Política de los Estados Unidos Mexicanos;\nVII. Celebrar los convenios con los ayuntamientos para la prestación de los servicios sanitarios locales o la atención de las funciones de salud;\nVIII. Las demás atribuciones que sean necesarias para hacer efectivas las facultades anteriores y las que deriven de esta Ley y demás disposiciones generales aplicables.\nB. En materia de Salubridad Local:\nI. Ejercer el control sanitario de los establecimientos y servicios a que se refiere el Artículo 4o. apartado\n\"B\" de esta Ley y verificar su cumplimiento;\nII. Dictar las normas técnicas en materia de salubridad local;\nIII. Establecer las acciones sanitarias en los límites territoriales con otras entidades federativas;\nIV. Llevar a cabo los programas y acciones que en materia de salubridad local se implanten;\nV. Promover, orientar, fomentar y apoyar las acciones en materia de salubridad local a cargo de los municipios, con sujeción a las políticas nacional y estatal de salud y a los convenios que al efecto se celebren;\nVI. Vigilar en la esfera de su competencia, el cumplimiento de esta Ley y demás disposiciones legales aplicables, y\nVII. Las demás que establezca esta Ley y otras disposiciones legales aplicables.\nArtículo 13. El Ejecutivo Estatal podrá convenir con los Ayuntamientos, con la asesoría de la Secretaría de la prestación de los servicios de salubridad general concurrente y de salubridad local, cuando su desarrollo económico y social lo haga necesario, en los términos de la fracción III del artículo 115 de la\nConstitución General de la República, de la Constitución Política Local, de esta Ley y demás disposiciones legales aplicables.\nArtículo 14. Corresponde a los Ayuntamientos:\nI. Asumir sus atribuciones en los términos de esta Ley y de los convenios que suscriban con el Ejecutivo del Estado;\nII. Certificar la calidad del agua para uso y consumo humano, en los términos de los convenios que\nIII. Expedir bandos de policía y buen gobierno, reglamentos, circulares y disposiciones administrativas relacionados con los servicios de salud que estén a su cargo;\nIV. Formular y desarrollar programas municipales de salud en el marco del Sistema Nacional y Estatal de\nSalud, y\nV. Vigilar y hacer cumplir en la esfera de su competencia los ordenamientos legales correspondientes.\nArtículo 15. Se entenderá por norma técnica el conjunto de reglas científicas o tecnológicas de carácter obligatorio, emitidas por la Secretaría de Salud del Estado, que establezcan los requisitos que deben satisfacerse en el desarrollo de actividades en materia de salubridad local, con el objeto de uniformar principios, criterios, políticas y estrategias.\nArtículo 16. El Gobierno del Estado y los municipios, de conformidad con las disposiciones legales aplicables, aportarán los recursos humanos materiales y financieros que sean necesarios para la operación de los servicios de salubridad local que queden comprendidos en los convenios que ambos celebren.\nLos recursos que aporten las partes quedarán expresamente destinados a los fines del convenio respectivo y sujetos al régimen legal que les corresponda.\nArtículo 17. Los ingresos que se obtengan por los servicios de salubridad local que se presten en los términos de los convenios a que se refiere el artículo anterior, se afectarán a los mismos conceptos en la forma que establezca la legislación fiscal aplicable.\nArtículo 18. El Gobierno del Estado y los municipios en el ámbito de sus respectivas competencias y en los términos de los convenios que celebren, darán prioridad a los siguientes servicios sanitarios:\nI. Proporcionar el servicio de agua potable para uso y consumo humano y vigilar su calidad, de conformidad con la normativa que emita la Secretaría de Salud del Ejecutivo Federal;\nII. Establecer sistemas de alcantarillado;\nIII. Instalación de retretes o sanitarios públicos, y\nIV. Prestar servicios de limpieza pública y la eliminación de desechos sólidos y líquidos.\nArtículo 19. Los Ayuntamientos conforme a las leyes aplicables, promoverán la desconcentración de los servicios sanitarios básicos de su competencia. con los gobiernos de los estados circunvecinos, sobre aquellas materias que sean de su interés común.\nArtículo 21. Los ayuntamientos del Estado en el ámbito de su competencia podrán celebrar entre ellos convenios de coordinación y cooperación sobre materia sanitaria. fin de que asuma temporalmente la prestación de servicios de salud en el Estado, en los términos que en los acuerdos se convengan.\nFederal, que se haga cargo de la prestación de los servicios de salud en el Estado. A este propósito el para el correcto funcionamiento de la citada estructura administrativa.\nArtículo 24. La Administración del organismo público mencionado, en el artículo anterior, estará a cargo, en los términos que se convengan en el acuerdo de coordinación correspondiente, del Gobierno del\nEstado, dicho organismo tendrá a su cargo la aplicación, en el ámbito estatal, de la legislación sanitaria federal y estatal, de conformidad con las disposiciones legales aplicables.\nTITULO TERCERO\nPRESTACION DE LOS SERVICIOS DE SALUD\nCAPITULO I\nDISPOSICIONES COMUNES\nArtículo 25. Para los efectos de esta Ley se entenderá por servicio de salud, todas aquellas acciones que se realicen con el fin de proteger, promover, y restaurar la salud de la persona y de la colectividad.\nArtículo 26. Los servicios de salud se clasifican en tres tipos:\nI. De atención médica;\nII. De salud pública, y\n(DEROGADA, P.O. 15 DE FEBRERO DE 2005)\nIII. Se deroga.\nArtículo 27. Conforme a las prioridades del Sistema Estatal de Salud, se garantizará la extensión cuantitativa y cualitativa de los servicios de salud, preferentemente a los grupos vulnerables.\nArtículo 28. Para la organización y administración de los servicios de salud, se definirán los criterios de distribución de universos de usuarios, de regionalización y de escalonamiento de los servicios, así como universalización de cobertura y de colaboración Interinstitucional.\nArtículo 29. Para los efectos del derecho a la protección de la salud, se consideran servicios básicos de salud los referentes a:\nI. La educación para la salud, la promoción del saneamiento básico y el mejoramiento de las condiciones sanitarias del ambiente;\nII. La prevención y el control de las enfermedades transmisibles de atención prioritaria, de las no transmisibles más frecuentes y de los accidentes;\nIII. La atención médica, que comprende actividades preventivas, curativas y de rehabilitación, incluyendo la atención de urgencias;\nIV. La atención materno-infantil;\nV. La planificación familiar;\nVI. La salud mental;\nVII. La prevención y el control de las enfermedades bucodentales;\nVIII. La disponibilidad de medicamentos y otros insumos esenciales para la salud;\nIX. La promoción del mejoramiento de la nutrición;\nX. Se deroga.\nXI. Las demás que establezca esta Ley o disposiciones legales aplicables. las instituciones que presten servicios de salud en la entidad, apliquen el cuadro básico de insumos del dependencias y entidades del Estado que presten servicios de salud, podrán participar en la elaboración del mencionado cuadro básico.\nArtículo 31. El Gobierno del Estado coadyuvará con las autoridades federales competentes para:\nI. Que se garantice a la población del Estado la disponibilidad de medicamentos básicos, y\nII. Que los establecimientos de los sectores público, social y privado dedicados al expendio de medicamentos y a la provisión de insumos para su elaboración, se ajusten a los preceptos legales aplicables.\nCAPITULO II\nATENCION MEDICA\nArtículo 32. Se entiende por atención médica, el conjunto de servicios que se proporcionan al individuo con el fin de proteger, promover y restaurar su salud.\nArtículo 33. Las actividades de atención médica son:\nI. Preventivas, que incluyen las de promoción general y las de protección específica;\nII. Curativas, que tienen como fin efectuar un diagnóstico temprano y proporcionar tratamiento oportuno, y\nIII. De rehabilitación, que incluyen acciones tendientes a corregir las invalideses físicas y mentales.\nArtículo 34. Para los efectos de esta Ley, los servicios de salud, atendiendo a los prestadores de los mismos, se clasifican en:\nI. Servicios públicos a la población en general;\nII. Servicios a derecho habientes de la institución en cargada (sic) de ofrecer servicios de seguridad social a los servidores públicos del Estado y de los municipios;\nIII. Servicios sociales y privados sea cual fuere la forma en que contraten, y\nCAPITULO III\nPRESTADORES DE SERVICIOS DE SALUD\nArtículo 35. Son servicios públicos a la población en general los que se presten en establecimientos públicos de salud a los habitantes del Estado que así lo requieran, regidos por criterios de universalidad y de gratuidad fundada en las condiciones socioeconómicas de los usuarios.\nArtículo 36. Las cuotas de recuperación que en su caso se recauden por la prestación de servicios de salud, se ajustarán a lo que disponga la legislación fiscal del Estado y al convenio de coordinación que se celebre en la materia con el Ejecutivo Federal. Para la determinación de las cuotas de recuperación se tomará en cuenta el costo de los servicios y las condiciones socioeconómicas del usuario. ingresos de los usuarios, debiéndose eximir del cobro cuando el usuario carezca de recursos para cubrirlas, o en las zonas de menor desarrollo económico y social, conforme a las disposiciones del\nGobierno del Estado.\nArtículo 37. Son servicios a derechohabientes, los prestados por la institución a que se refiere la fracción\nII del Artículo 34 de esta Ley a las personas que cotizan o a las que se hubieren cotizado en las mismas conforme a sus leyes y a sus beneficiarios, así como los que con sus propios recursos o por encargo del\nEjecutivo Estatal preste dicha institución a otros grupos usuarios.\nArtículo 38. Los servicios de salud que presten las entidades públicas estatales y empresas privadas a sus empleados y a los beneficiarios de los mismos, con recursos propios o mediante la contratación de seguros individuales o colectivos,se (sic) regirán por las convenciones entre prestadores y usuarios, sin perjuicio de lo que establezcan las disposiciones de esta Ley y demás normas aplicables a las instituciones de salud respectivas.\nArtículo 39. Los trabajadores de los establecimientos estatales de salud podrán participar en la gestión de los mismos, de conformidad con las disposiciones generales aplicables, y podrán opinar y emitir sugerencias tendientes al mejoramiento de los servicios de salud.\nArtículo 40. El Gobierno del Estado y los Ayuntamientos podrán convenir con las instituciones federales de seguridad social, la prestación de servicios de salud para sus trabajadores.\nArtículo 41. El Gobierno del Estado y la Secretaría de Salud del Gobierno Federal, en el ámbito de sus respectivas competencias, en coordinación con las autoridades educativas, vigilarán el ejercicio de los profesionales, técnicos y auxiliares de la salud, en la prestación de los servicios respectivos.\nArtículo 42. La Secretaría de Salud del Estado coadyuvará con las autoridades educativas competentes, para la promoción y fomento de la constitución de colegios,asociaciones (sic) y organizaciones de profesionales, técnicos y auxiliares de la salud, así mismo estimulará su participación en el Sistema\nEstatal de Salud, como instancias éticas del ejercicio de las profesiones, promotoras de la superación permanente de sus miembros, sí como consultoras de las autoridades sanitarias cuanto éstas lo requieran.\nCAPITULO IV\nArtículo 43. Para los efectos de esta Ley, se considera usuario de servicios de salud a toda persona que requiera y obtenga los que presten los sectores público,social (sic) y privado, en las condiciones y aplicables.\nArtículo 44. Los usuarios tendrán derecho a obtener prestaciones de salud oportunas y de calidad los profesionales, técnicos y auxiliares.\nArtículo 45. Los usuarios deberán ajustarse a las reglamentaciones internas de las instituciones prestadoras de servicios de salud, y dispensar cuidado y diligencia en el uso y conservación de los materiales y equipos médicos que se pongan a su disposición.\nArtículo 46. La Secretaría de Salud del Estado establecerá los procedimientos para regular las sociales y privados, en el Estado.\nArtículo 47. Las autoridades sanitarias del Estado y las propias Instituciones de Salud, establecerán sistemas de orientación y asesoría a los usuarios sobre el uso de los servicios de salud que requieran, así como mecanismos para que presenten sus quejas, reclamaciones y sugerencias respecto a la prestación de los servicios de salud y en relación a la falta de probidad, en su caso, de los servidores públicos.\nArtículo 48. Las personas o instituciones públicas o privadas que tengan conocimiento de accidentes o de personas que requieran de la prestación urgente de servicios de salud, cuidarán, por los medios a su alcance, que los mismos sean trasladados a los establecimientos de salud más cercanos, en los que puedan recibir atención inmediata sin perjuicio de su posterior remisión a otras instituciones.\nArtículo 49. De conformidad con lo que señalen las disposiciones generales aplicables, los agentes del\nMinisterio Público que reciban informes o denuncias sobre personas que requieran de servicios de salud de urgencia, deberán disponer que las mismas sean trasladadas de inmediato al establecimiento de salud más cercano.\nArtículo 50. La participación de la comunidad en los programas de protección de la salud y en la prestación de los servicios respectivos, tendrá por objeto fortalecer la estructura y funcionamiento de los sistemas de salud e incrementar el mejoramiento del nivel de salud de la población del Estado.\nArtículo 51. La comunidad podrá participar en los servicios de salud de los sectores público, social y privado a través de las siguientes acciones:\nI. La promoción de hábitos de conducta que contribuyan a proteger la salud o a solucionar problemas de salud, e intervención en programas de promoción y mejoramiento de la salud y de prevención de enfermedades y accidentes;\nII. Colaboración en la prevención o tratamiento de problemas ambientales y vinculados a la salud;\n(REFORMADA, P.O. 15 DE FEBRERO DE 2005)\nIII. Incorporación, como auxiliares voluntarios, en la realización de tareas simples de atención médica y participación en determinadas actividades de operación de los servicios de salud, bajo la dirección y control de las autoridades correspondientes;\nIV. Notificación de la existencia de personas que requieran de servicios de salud, cuando éstas se encuentren impedidas de solicitar auxilio por si mismas;\nV. Formulación de sugerencias para mejorar los servicios de salud, y\nVI. Las demás que coadyuven a la protección de la salud.\nArtículo 52. La Secretaría de Salud del Estado, y demás instituciones de salud estatales, promoverán y apoyarán la constitución de grupos, asociaciones y demás instituciones que tengan por objeto participar organizadamente en los programas de promoción y mejoramiento de la salud individual o colectiva, así como en los de prevención de enfermedades y accidentes, y de invalidez y de rehabilitación de inválidos.\nArtículo 53. Para los efectos del artículo anterior, en los centros de población, se constituirán comités de salud que podrán ser integrados por núcleos de población urbana, rural o indígena los cuales tendrán y promover mejores condiciones ambientales que favorezcan la salud de la población, así como la básica y social y mantenimiento de unidades.\nArtículo 54. Los Ayuntamientos con sujeción en las disposiciones legales aplicables, en coordinación con las instituciones de salud y las autoridades educativas competentes, tendrán la responsabilidad de organizar los comités a que se refiere el artículo anterior y de que cumplan los fines para los que sean creados.\nArtículo 55. Se concede acción popular para denunciar ante las autoridades sanitarias del Estado todo hecho, acto u omisión que represente un riesgo o provoque un daño a la salud de la población.\nLa acción popular podrá ejercitarse por cualquier persona, bastando para darle curso el señalamiento de los datos que permitan localizar la causa del riesgo.\nCAPITULO V\nATENCION MATERNO-INFANTIL\nArtículo 56. La atención materno-infantil tiene carácter prioritario y comprende las siguientes acciones:\nI. La atención de la mujer durante el embarazo, el parto y el puerperio;\nII. La atención del niño y la vigilancia de su crecimiento y desarrollo, incluyendo la promoción de la vacunación oportuna, y\nIII. La promoción de la integración y del bienestar familiar.\nArtículo 57. En los servicios de salud se promoverá la organización institucional de comités de prevención de la mortalidad materna e infantil, a efecto de conocer, sistematizar y evaluar el problema y adoptar las medidas conducentes.\nArtículo 58. La protección de la salud física y mental de los menores es una responsabilidad que comparten los padres, tutores o quienes ejerzan la patria potestad sobre ellos, el Estado y la sociedad en general.\nArtículo 59. En la organización y operación de los servicios de salud destinados a la atención maternoinfantil, las autoridades sanitarias del Estado de Coahuila establecerán:\nI. Procedimientos que permitan la participación activa de la familia en la prevención y atención oportuna de los padecimientos de los usuarios;\nII. Acciones de orientación y vigilancia institucional, fomento a la lactancia materna y, en su caso, la ayuda alimentaria directa tendiente a mejorar el estado nutricional del grupo materno-infantil, y\nIII. Acciones para controlar las enfermedades prevenibles por vacunación, los procesos diarréicos y las infecciones respiratorias agudas de los menores de 5 años.\nArtículo 60. Las autoridades sanitarias estatales, educativas y laborales, en sus respectivos ámbitos de competencia, apoyarán y fomentarán:\nI. Los programas para padres de familia destinados a promover la atención materno-infantil;\nII. Las actividades recreativas de esparcimiento y culturales destinadas a fortalecer el núcleo familiar y promover la salud física y mental de sus integrantes;\nIII. La vigilancia de actividades ocupacionales que puedan poner en peligro la salud física y mental de los menores y de las mujeres embarazadas;\nIV. Acciones relacionadas con educación básica, alfabetización de adultos, accesos al agua potable y medios sanitarios de eliminación de excreta, y\nV. Las demás que coadyuven a la salud materno-infantil.\nArtículo 61. En materia de higiene escolar, corresponde al Gobierno del Estado, establecer las normas técnicas para proteger la salud del educando y de la comunidad escolar de los centros educativos dependientes del Estado, las autoridades educativas y sanitarias estatales se coordinarán para la aplicación de las mismas.\nLa prestación de servicios de salud a los escolares se efectuará de conformidad con las bases de coordinación que se establezca entre las autoridades sanitarias estatales y educativas competentes.\nCAPITULO VI\nSERVICIOS DE PLANIFICACION FAMILIAR\nArtículo 62. La planificación familiar tiene carácter prioritario. En sus actividades se debe incluir la información y orientación educativa para los adolescentes y jóvenes. Asimismo, para disminuir el riesgo reproductivo, se debe informar a la mujer y al hombre sobre la inconveniencia del embarazo antes de los\n20 años o bien después de los 35, así como la conveniencia de espaciar los embarazos y reducir su número; todo ello, mediante una correcta información anticonceptiva, la cual debe ser oportuna, eficaz y completa a la pareja.\nLos servicios que se presten en la materia constituyen un medio para el ejercicio del derecho de toda persona a decidir de manera libre, responsable e informada sobre el número y espaciamiento de los hijos, con pleno respeto a su dignidad.\nQuienes practiquen esterilización sin la voluntad del paciente o ejerzan presión para que éste la admita serán sancionados conforme a las disposiciones de esta Ley, independientemente de la responsabilidad penal en que incurran.\nArtículo 63. Los servicios de planificación familiar comprenden:\nI. La promoción del desarrollo de programas de comunicación educativa en materia de servicios de planificación familiar y educación sexual, con base en los contenidos y estrategias que establezca el\nConsejo Nacional de Población;\nII. La atención y vigilancia de los aceptantes y usuarios de servicios de planificación familiar;\nIII. La asesoría para la prestación de servicios de planificación familiar a cargo de los sectores público, social y privado y la supervisión y evaluación en su ejecución, de acuerdo con la política establecida por el Consejo Nacional de Población;\nIV. El apoyo y fomento de la investigación en materia de anticoncepción, infertilidad humana, planificación familiar y biología de la reproducción humana;\nV. La participación en el establecimiento de mecanismos idóneos para la determinación, elaboración, adquisición, almacenamiento y distribución de medicamentos y otros insumos destinados a los servicios de planificación familiar, y\nVI. La recopilación, sistematización y actualización de la información necesaria para el adecuado seguimiento de las actividades desarrolladas.\nArtículo 64. Los Comités de Salud a que se refiere el Artículo 53 de esta Ley, promoverán que en las materia de planificación familiar y educación sexual, las instituciones de salud y educativas brindarán al efecto el apoyo necesario.\nArtículo 65. El Gobierno del Estado, coadyuvará con la Secretaría de Salud, en las acciones del\nPrograma Nacional de Planificación Familiar que formule el Consejo Nacional de Población y del\nPrograma de Planificación Familiar del Sector Salud y cuidará que se incorporen en los Programas\nEstatales de Salud.\nCAPITULO VII\nSALUD MENTAL\nArtículo 66. La prevención de las enfermedades mentales tiene carácter prioritario, se basará en el conocimiento de los factores que afectan la salud mental, las causas de las alteraciones de la conducta, los métodos de prevención y control de las enfermedades mentales, así como otros aspectos relacionados con la salud mental.\nArtículo 67. Para la promoción de la salud mental, la Secretaría de Salud del Estado y las instituciones de Salud en coordinación con las autoridades competentes en cada materia, fomentarán y apoyarán:\nI. El desarrollo de actividades educativas socioculturales y recreativas que contribuyan a la salud mental, preferentemente de la infancia y de la juventud;\nII. La difusión de las orientaciones para la promoción de la salud mental;\nIII. La realización de programas para prevención del uso de substancias psicotrópicas, estupefacientes, inhalantes y otras substancias que puedan causar alteraciones mentales o dependencias, y\nIV. Las demás acciones que directa o indirectamente contribuyan al fomento de la salud mental de la población.\nArtículo 68. La atención de las enfermedades mentales comprende:\nI. La atención de personas con padecimientos mentales, la rehabilitación psiquiátrica de enfermos mentales crónicos, deficientes mentales, alcohólicos y personas que usen habitualmente estupefacientes o substancias psicotrópicas, y\nII. La organización, operación y supervisión de instituciones dedicadas al estudio, tratamiento y rehabilitación de enfermos mentales.\nArtículo 69. La Secretaría de Salud del Estado conforme a las normas oficiales mexicanas básicas que mental.\nA estos efectos, se establecerá la coordinación necesaria entre las autoridades sanitarias, judiciales, administrativas y otras, según corresponda.\nArtículo 70. Los padres, tutores o quienes ejerzan la patria potestad de menores, los responsables de su guarda, las autoridades educativas y cualquier persona que esté en contacto con los mismos, procurarán existencia de enfermedades mentales.\nA tal efecto, podrán obtener orientación y asesoramiento en las instituciones públicas dedicadas a la atención de enfermos mentales.\nTITULO CUARTO\nRECURSOS HUMANOS PARA LOS SERVICIOS DE SALUD\nCAPITULO I\nPROFESIONALES, TECNICOS Y AUXILIARES\nArtículo 71. Es el Estado el ejercicio de las profesiones, de las actividades técnicas y auxiliares y de las especialidades para la salud, estará sujeto a:\nI. La Ley de Profesiones del Estado de Coahuila;\nII. Las bases de coordinación que, conforme a la Ley, se definan entre las autoridades educativas y las autoridades sanitarias del Estado;\nIII. Los convenios que al efecto se suscriban entre el Gobierno del Estado y la Federación, y\nIV. Las disposiciones de esta Ley y demás normas jurídicas aplicables.\nArtículo 72. Para el ejercicio de actividades profesionales en el campo de la medicina, odontología, veterinaria, biología, bacteriología, enfermería, trabajo social, química, psicología, ingeniería sanitaria, nutrición, dietología, patología y sus ramas, y las demás que establezcan otras disposiciones legales aplicables, se requiere que los títulos profesionales o certificados de especialización hayan sido legalmente expedidos y registrados por las autoridades educativas competentes.\nPara el ejercicio de actividades técnicas y auxiliares que requieran conocimientos específicos en el campo de la medicina, odontología, veterinaria, enfermería, laboratorio clínico, radiología, terapia física, terapia ocupacional, terapia del lenguaje, prótesis y órtesis, trabajo social, nutrición, citotecnología, patología, bioestadística, codificación clínica bioterios, farmacia, saneamiento, histopatología y embalsamiento y sus ramas, se requiere que los diplomas correspondientes hayan sido expedidos y registrados por las autoridades educativas competentes.\nArtículo 73. Las autoridades educativas del Estado proporcionarán a las autoridades sanitarias estatales la relación de títulos, diplomas y certificados del área de la salud que hayan registrado y la de cédulas profesionales expedidas, así como la información complementaria sobre la materia que sea necesaria. En información a que se refiere el párrafo anterior.\nArtículo 74. Quienes ejerzan las actividades profesionales, técnicas y auxiliares y las especialidades a que se refiere este capítulo, deberán poner a la vista del público un anuncio que indique la institución que les expidió el título, diploma o certificado y, en su caso, el número de su correspondiente cédula profesional. Iguales menciones deberán considerarse en los documentos y papelería que utilicen en el ejercicio de tales actividades y en la publicidad que realicen a su respecto.\nCAPITULO II\nSERVICIO SOCIAL DE PASANTES Y PROFESIONALES\nArtículo 75. Todos los pasantes de las profesiones para la salud y sus ramas deberán prestar el servicio social en los términos de las disposiciones legales aplicables en materia educativa y de las de esta Ley.\nArtículo 76. Los aspectos docentes de la prestación del servicio social se regularán por lo que establezcan las instituciones de educación superior, de conformidad con las atribuciones que les otorgan las disposiciones que rigen su organización y funcionamiento y lo que determinen las autoridades educativas competentes.\nLa operación de los programas en los establecimientos de salud del Estado se llevará a cabo de acuerdo a los lineamientos establecidos por cada una de las Instituciones de Salud y lo que determinen las autoridades sanitarias estatales.\nArtículo 77. Para los efectos de la eficaz prestación del servicio social de pasantes de las profesiones para la salud, se establecerán mecanismos de coordinación entre las autoridades sanitarias del Estado y las educativas, con la participación que corresponda a otras dependencias competentes.\nArtículo 78. La prestación del servicio social de los pasantes de las profesiones para la salud, se llevará a cabo mediante la participación de los mismos en las unidades aplicativas del primer nivel de atención, prioritariamente en áreas urbanas y rurales de menor desarrollo económico y social del Estado.\nPara los efectos del párrafo anterior el Gobierno del Estado, en coordinación con las instituciones educativas y de salud, definirán los mecanismos para que los pasantes de las profesiones para la salud participen en la organización y operación de los comités de salud a que alude el Artículo 33 de esta Ley.\nArtículo 79. El Gobierno del Estado, con la participación de las instituciones de educación superior, elaborarán programas de carácter social para los profesionales de la salud, en beneficio de la colectividad del Estado de Coahuila, de conformidad con las disposiciones legales aplicables para el ejercicio profesional.\nCAPITULO III\nFORMACION, CAPACITACION Y ACTUALIZACION DEL PERSONAL\nArtículo 80. Las autoridades educativas, en coordinación con las autoridades sanitarias estatales y con la participación de las instituciones de educación superior, recomendarán normas y criterios, para la formación de recursos humanos para la salud.\nLas autoridades sanitarias, sin perjuicio de la competencia que sobre la materia corresponda a las autoridades educativas y en coordinación con ellas, así como con la participación de las instituciones de salud, establecerán las normas y criterios para la capacitación y actualización de los recursos humanos para la salud. educativas en la materia y en coordinación con éstas:\nI. Promover actividades tendientes a la formación, capacitación y actualización de los recursos humanos que se requieran para la satisfacción de las necesidades del Estado en materia de salud;\nII. Apoyar la creación de centros de capacitación y actualización de los recursos humanos para la salud;\nIII. Otorgar facilidades para la enseñanza y adiestramiento en servicios dentro de los establecimientos de salud, a las instituciones que tengan por objeto la formación, capacitación o actualización de profesionales, técnicos y auxiliares de la salud, de conformidad con las normas que rijan el funcionamiento de los primeros, y\nIV. Promover la participación voluntaria de profesionales, técnicos y auxiliares de la salud en actividades docentes o técnicas.\nArtículo 82. La Secretaría de Salud del Estado, sugerirá a las autoridades e instituciones educativas, cuando éstas lo soliciten, criterios sobre:\nI. Los requisitos para la apertura y funcionamiento de instituciones dedicadas a la formación de recursos humanos para la salud, en los diferentes niveles académicos y técnicos, y\nII. El perfil de los profesionales para la salud en sus etapas de formación.\nArtículo 83. La Secretaría de Salud del Estado, en coordinación con las autoridades federales competentes, impulsarán y fomentarán la formación, capacitación y actualización de los recursos humanos para los servicios de salud, de conformidad con los objetivos y prioridades de los sistemas nacional y estatal de Salud, de los programas educativos y de las necesidades de salud del Estado.\nArtículo 84. Los aspectos docentes del internado de pregrado y de las residencias de especialización, se regirán por lo que establezcan las instituciones de educación superior; deberán contribuir al logro de los objetivos de los Sistemas Nacional y Estatal de Salud, de conformidad con las atribuciones que les otorguen las disposiciones que rigen su organización y funcionamiento y lo que determinen las autoridades educativas competentes.\nLa operación de los programas correspondientes en los establecimientos de salud, se llevará a cabo de acuerdo a los lineamientos establecidos por cada una de las Instituciones de Salud y lo que determinen las autoridades sanitarias competentes.\nTITULO QUINTO\nINVESTIGACION PARA LA SALUD\nCAPITULO UNICO\nArtículo 85. La investigación para la salud comprende el desarrollo de acciones que contribuyan:\nI. Al conocimiento de los procesos biológicos psicológicos en los seres humanos;\nII. Al conocimiento de los vínculos entre las causas de enfermedad, la práctica médica y la estructura social;\nIII. A la prevención y control de los problemas de salud que se consideren prioritarios para la población;\nIV. Al conocimiento y control de los efectos nocivos del ambiente en la salud;\nV. Al estudio de las técnicas y métodos que se recomienden o empleen para la prestación de los servicios de salud, y\nVI. A la producción nacional de insumos para la salud.\nArtículo 86. La Secretaría de Salud del Estado, apoyará y estimulará la promoción, constitución y el funcionamiento de establecimientos destinados a la investigación para la salud.\nArtículo 87. La investigación en seres humanos se desarrollará conforme a las siguientes bases:\nI. Deberá adaptarse a los principios científicos y éticos que justifican la investigación médica, desarrollo de nuevos campos de la ciencia médica;\nII. Podrá realizarse sólo cuando el conocimiento que pretenda producir no pueda obtenerse por otro método idóneo;\nIII. Podrá efectuarse sólo cuando exista una razonable seguridad de que no expone a riesgos ni daños innecesarios al sujeto en experimentación;\nIV. Se deberá contar con el consentimiento por escrito del sujeto en quien se realizará la investigación, o de su representante legal en caso de incapacidad legal de aquél, una vez enterado de los objetivos de la experimentación y de las posibles consecuencias positivas o negativas para su salud;\nV. Sólo podrá realizarse por profesionales de la salud en instituciones médicas que actúen bajo la vigilancia de las autoridades sanitarias competentes;\nVI. El profesional responsable suspenderá la investigación en cualquier momento, si sobreviene el riesgo de lesiones graves, invalidez o muerte del sujeto en quien se realice la investigación, y\nVII. Las demás que establezca esta Ley y la correspondiente reglamentación.\nArtículo 88. Quien realice investigación en seres humanos en contravención a lo dispuesto en esta Ley y demás disposiciones aplicables se hará acreedor de las sanciones correspondientes.\nArtículo 89. En cualquier tratamiento de una persona enferma, el médico podrá utilizar nuevos recursos terapéuticos o de diagnóstico, cuando exista posibilidad fundada de salvar la vida, restablecer la salud o disminuir ir (sic) el sufrimiento del paciente,siempre (sic) que cuente con el consentimiento por escrito de éste, de su representante legal, en su caso, o del familiar más cercano en vínculo, y sin perjuicio de cumplir con los demás requisitos que determine esta Ley y otras disposiciones aplicables.\nTITULO SEXTO\nINFORMACION PARA LA SALUD\nCAPITULO UNICO\nArtículo 90. La Secretaría de Salud del Estado, y de conformidad con la Ley de Información Estadística y\nGeografía, y con los criterios de carácter general que emita el Ejecutivo Federal, captará, producirá y procesará la información necesaria para el proceso de planeación, programación, presupuestación y control de los Sistemas Nacional y Estatal de Salud, así como sobre el estado y evolución de la salud pública de la entidad.\nLa información se referirá fundamentalmente, a los siguientes aspectos:\nI. Estadísticas de natalidad, mortalidad, morbilidad e invalidez;\nII. Factores demográficos, económicos, sociales y ambientales vinculados a la salud, y\nIII. Recursos físicos, humanos y financieros disponibles para la protección de la salud de la población, y su utilización.\nArtículo 91. Los establecimientos que presten servicios de salud, los profesionales, técnicos y auxiliares de la salud del Estado, llevarán a cabo estadísticas que en materia de salud les señalen las autoridades correspondiente, sin perjuicio de las obligaciones de suministrar la información que señalen otras disposiciones legales aplicables.\nTITULO SEPTIMO\nPROMOCION DE LA SALUD\nCAPITULO I\nDISPOSICIONES COMUNES\nArtículo 92. La promoción de la salud tiene por objeto crear, conservar y mejorar las condiciones deseables de salud para toda la población y propiciar en el individuo las actitudes, valores y conductas adecuadas para motivar su participación en beneficio de la salud individual y colectiva.\nArtículo 93. La promoción de la salud comprende:\nI. Educación para la salud;\nII. Nutrición;\nIII. Control de los efectos nocivos del ambiente en la salud;\nIV. Salud ocupacional, y\nV. Fomento sanitario.\nCAPITULO II\nEDUCACION PARA LA SALUD\nArtículo 94. La educación para la salud tiene por objeto:\nI. Fomentar en la población el desarrollo de actitudes y conductas que le permitan participar en la prevención de enfermedades individuales, colectivas y accidentes, y proteger de los riesgos que pongan en peligro su salud;\nII. Proporcionar a la población los conocimientos sobre las causas de las enfermedades y de los daños provocados por los efectos nocivos del ambiente en la salud, y\nIII. Orientar y capacitar a la población preferentemente en materia de nutrición, salud mental, salud bucal, educación sexual, planificación familiar, riesgo de automedicación, prevención de la farmacodependencia, salud ocupacional, uso adecuado de los servicios de salud, prevención de accidentes, prevención y rehabilitación de la invalidez y detección oportuna de enfermedades.\nArtículo 95. Las autoridades sanitarias estatales en coordinación con las autoridades federales competentes, formularán, propondrán y desarrollarán programas de educación para la salud, los cuales podrán ser difundidos en los medios masivos de comunicación que actúen en el ámbito del Estado, procurando optimizar los recursos y alcanzar una cobertura total de la población.\nCAPITULO III\nNUTRICION promoviendo la participación en los mismos de las unidades estatales del Sector Salud, cuyas actividades se relacionen con la nutrición y la disponibilidad de alimentos así como de los sectores social y privado.\nArtículo 97. En los programas a que se refiere el artículo anterior, se incorporarán acciones que promuevan el consumo de alimentos de producción regional, y procurará, al efecto, la participación de las organizaciones campesinas, ganaderas, cooperativas y otras organizaciones sociales cuyas actividades se relacionen con la producción de alimentos.\nCAPITULO IV\nEFECTOS DEL AMBIENTE EN LA SALUD\nArtículo 98. Las autoridades sanitarias del Estado establecerán las normas, tomarán las medidas y realizarán las actividades a que se refiere esta Ley tendientes a la protección de la salud humana ante los riesgos y daños derivados de las condiciones del ambiente.\nArtículo 99. Corresponde al Gobierno Estatal:\nI. Desarrollar investigación permanente y sistemática de los riesgos y daños que para la salud de la población (sic) origine la contaminación del ambiente;\nII. Vigilar y certificar la calidad del agua para uso y consumo humano;\nIII. Promover y apoyar el saneamiento básico, y\nIV. En general, ejercer actividades similares a las anteriores ante situaciones que causen riesgos o daños a la salud de las personas.\nArtículo 100. La Secretaría de Salud del Estado se coordinará con las dependencias federales, estatales y municipales, para la prestación de los servicios a que se refiere este capítulo.\nArtículo 101. Los organismos o entidades que intervengan en el abastecimiento de agua no podrán suprimir la dotación de servicios de agua potable y avenamiento de los edificios habitados, excepto en los casos que determinen las disposiciones generales aplicables.\nArtículo 102. Queda prohibida la descarga de aguas residuales sin el tratamiento para satisfacer los criterios sanitarios que, mediante las normas oficiales mexicanas en materia ecológica emitan las autoridades federales competentes, con el propósito de fijar las condiciones particulares de descarga, el tratamiento y uso de aguas residuales, así como de residuos peligrosos que conlleven riesgos para la salud pública, a cuerpos de agua que se destinen para uso o consumo humano.\nArtículo 103. La Secretaría de Salud del Estado, en coordinación con las autoridades federales y municipales competentes y con la autoridad estatal encargada de la administración del distrito de riego, orientará a la población, para evitar la contaminación de aguas de presas, pluviales, lagos y otras que se utilicen para riego o para uso doméstico, originada por plaguicidas, substancias tóxicas y desperdicios o basura.\nCAPITULO V\nSALUD OCUPACIONAL\nArtículo 104. La Secretaría de Salud del Estado tendrá a su cargo el control sanitario de los establecimientos en los que se desarrollen actividades ocupacionales, para el cumplimiento de los requisitos que en cada caso deberá reunir, de conformidad con lo que establezcan los reglamentos respectivos.\nArtículo 105. El Gobierno del Estado, en coordinación con las dependencias y entidades federales competentes, desarrollará y difundirá investigación multidisciplinaria que permita prevenir y controlar las enfermedades y accidentes ocupacionales, así como estudios para adecuar los instrumentos y equipo de trabajo a las características del hombre.\nTITULO OCTAVO\nPREVENCION Y CONTROL DE ENFERMEDADES Y ACCIDENTES\nCAPITULO I\nDISPOSICIONES COMUNES\nArtículo 106. El Gobierno del Estado, a través de la Secretaría de Salud, en coordinación con las autoridades e instituciones federales competentes, realizará las siguientes acciones:\nI. Coadyuvar en la aplicación de las normas oficiales mexicanas para la prevención y el control de enfermedades y accidentes que dicte la Secretaría de Salud del Gobierno Federal;\nII. Apoyar en el Estado el Sistema Nacional de Vigilancia Epidemiológica, de conformidad con la Ley\nGeneral de Salud, esta Ley y las demás disposiciones que al efecto se expidan, y\nIII. Coadyuvar en la aplicación de programas y actividades que establezca la Secretaría de Salud del\nCAPITULO II\nENFERMEDADES TRANSMISIBLES con las autoridades sanitarias federales elaborarán programas o campañas temporales o permanentes, potencial para la protección de la salud general a la población.\nAsimismo, realizarán actividades de vigilancia epidemiológica, de prevención y control de las siguientes enfermedades transmisibles:\nI. Cólera, fiebre tifoidea, paratifoidea, shigelosis, amibiasis, hepatitis virales y otras enfermedades del aparato digestivo;\nII. Influenza epidémica, otras infecciones agudas del aparato respiratorio, infecciones meningocócicas y enfermedades causadas por estreptococos;\nIII. Tuberculosis;\nIV. Difteria, tosferina, tétanos, sarampión, poliomielitis, rubeola y parotiditis infecciosa;\nV. Rabia, peste, brucelosis y otras zoonosis. En estos casos se coordinará con la Secretaría de Salud y con otras dependencias competentes en esta materia;\nVI. Fiebre amarilla, dengue y otras enfermedades virales transmitidas por artrópodos;\nVII. Paludismo, tifo, fiebre recurrente transmitida por piojo, otras rickettsiosis, leishemaniasis, tripanosomiasis, oncocercosis;\nVIII. Sífilis, infecciones gonocócicas y otras enfermedades de transmisión sexual;\nIX. Lepra y mal del pinto;\nX. Micosis profundas;\nXI. Helminitiasis intestinales y extraintestinales;\nXII. Toxoplasmosis;\nXIII. Síndrome de inmunodeficiencia adquirida (SIDA), y\nXIV. Las demás que determinen el Consejo de Salubridad General y otros tratados y convenciones internacionales en los que los Estados Unidos Mexicanos sean parte.\nArtículo 108. Es obligatoria la notificación a la autoridad sanitaria más cercana, de las siguientes enfermedades y en los términos que a continuación se especifican:\nI. Inmediatamente, en los casos individuales de enfermedades objeto del reglamento sanitario internacional; fiebre amarilla, peste y cólera;\nII. Inmediatamente, en los casos de cualquier enfermedad que se presente en forma de brote o epidemia;\nIII. En un plazo no mayor de veinticuatro horas en los casos individuales de enfermedades objeto de vigilancia internacional: poliomielitis, meningitis meningocócica, tifo epidémico, fiebre recurrente transmitida por piojo, influenza viral, paludismo, sarampión, tosferina, así como los de difteria y los casos humanos de encefalitis equina venezolana;\nIV. En un plazo no mayor de veinticuatro horas de los primeros casos individuales de las demás enfermedades transmisibles que se presenten en un área no afectada, y\nV. Notificación obligatoria inmediata a la autoridad sanitaria más cercana de los casos en que se detecte la presencia del virus de la inmunodeficiencia humana, (VIH) o de anticuerpos de dichos virus, en algunas personas.\nArtículo 109. Las personas que ejerzan la medicina o que realicen actividades afines, están obligadas a dar aviso a las autoridades sanitarias de los casos de enfermedades transmisibles, posteriormente a su diagnóstico o sospecha diagnóstica.\nArtículo 110. Están obligados a dar aviso, en los términos del Artículo 108 de esta Ley, los jefes o encargados de laboratorios, los directores de unidades médicas, escuelas, fábricas, talleres, asilos, los jefes de oficinas, establecimientos comerciales o de cualquier otra índole, y en general, toda persona que a que se refiere esta Ley.\nArtículo 111. Las medidas que se requieran para la prevención y el control de las enfermedades que enumera el Artículo 107 de esta Ley, deberán ser observadas por los particulares, el ejercicio de esta acción comprenderá una o más de las siguientes medidas, según el caso de que se trate:\nI. La confirmación de la enfermedad por los medios clínicos disponibles;\nII. El aislamiento, por el tiempo estrictamente necesarios, de los enfermos, de los sospechosos de padecer la enfermedad y de los portadores de gérmenes de la misma, así como la limitación de sus actividades, cuando así se amerite por razones epidemiológicas;\nIII. La observación, en el grado que se requiera, de los contactos humanos y animales;\nIV. La aplicación desueros (sic), vacunas y otros recursos preventivos y terapéuticos;\nV. La descontaminación microbiana o parasitaria, desinfección y desinsectación de zonas, habitaciones, ropas, utensilios y otros objetos expuestos a la contaminación;\nVI. La destrucción o control de vectores y reservorios y fuentes de infección naturales o artificiales, cuando presenten peligro para la salud;\nVII. La inspección de pasajeros que puedan ser portadores de gérmenes, así como la de equipajes, medios de transporte, mercancías y otros objetos que puedan ser fuentes o vehículos de agentes patógenos, y\nVIII. Las demás que determine esta Ley, sus reglamentos y la Secretaría de Salud del Gobierno Federal.\nArtículo 112. Las autoridades no sanitarias cooperarán en el ejercicio de la acción para combatir las enfermedades transmisibles, estableciendo las medidas que estimen necesarias, sin contravenir las disposiciones de la Ley General de Salud, esta Ley, las que expida el Consejo de Salubridad General y las normas oficiales mexicanas que dicte la Secretaría de Salud del Gobierno Federal.\nArtículo 113. Los profesionales, técnicos y auxiliares de la salud, al tener conocimiento de un caso de enfermedad transmisible, están obligados a tomar las medidas necesarias, de acuerdo con la naturaleza y características del padecimiento, aplicando los recursos a su alcance para proteger la salud individual y colectiva.\nArtículo 114. Los trabajadores de la salud, del Gobierno de esta Entidad Federativa y de los municipios, así como los de otras instituciones autorizadas por las autoridades sanitarias del Estado, por necesidades habitación para el cumplimiento de actividades encomendadas a su responsabilidad, para cuyo fin deberán estar debidamente acreditadas por alguna de las autoridades sanitarias competentes, en los términos de las disposiciones aplicables.\nArtículo 115. Quedan facultadas las autoridades sanitarias competentes para utilizar como elementos auxiliares en la lucha contra las epidemias, todos los recursos médicos y de asistencia social de los sectores público, social y privado existentes en las regiones afectadas y en las colindantes, de acuerdo con las disposiciones de esta Ley y los reglamentos aplicables.\nArtículo 116. Las autoridades sanitarias del Estado señalarán el tipo de enfermos o portadores de gérmenes que podrán ser excluidos de los sitios de reunión, tales como hoteles, restaurantes, fábricas, talleres, cárceles, oficinas, escuelas, dormitorios, habitaciones colectivas, centros de espectáculos y deportivos.\nArtículo 117. El aislamiento de las personas que padezcan enfermedades transmisibles se llevará a cabo en sitios adecuados a juicio de las autoridades sanitarias.\nArtículo 118. Las autoridades sanitarias del Estado podrán ordenar, por causas de epidemia la clausura temporal de los locales o centros de reunión de cualquier índole.\nArtículo 119. El transporte de enfermos de afecciones transmisibles deberá efectuarse en vehículos acondicionados al efecto, a falta de éstos, podrán utilizarse los que autorice la autoridad sanitaria. Los mismos podrán usarse posteriormente para otros fines, previa la aplicación de las medidas que procedan.\nArtículo 120. Las autoridades sanitarias determinarán los casos en que se deba proceder a la descontaminación microbiana o parasitaria, desinfección, desinsectación, desinfestación u otras medidas de saneamiento de lugares, edificios, vehículos y objetos.\nCAPITULO III\nENFERMEDADES NO TRANSMISIBLES\nArtículo 121. Las autoridades sanitarias del Estado, realizarán actividades de prevención y control de las enfermedades no transmisibles que las propias autoridades sanitarias federales determinen.\nArtículo 122. El ejercicio de la acción de prevención y control de las enfermedades no transmisibles, comprenderá una o más de las siguientes medidas, según el caso de que se trate:\nI. La detección oportuna de las enfermedades no transmisibles y la evaluación del riesgo de contraerlas;\nII. La divulgación de medidas higiénicas para el control de los padecimientos;\nIII. La prevención específica en cada caso y la vigilancia de su cumplimiento;\nIV. La realización de estudios epidemiológicos, y\nV. Las demás que sean necesarias para la prevención, tratamiento y control de los padecimientos, que se presenten en la población.\nArtículo 123. Los profesionales, técnicos y auxiliares de la salud deberán rendir los informes que la autoridad sanitaria requiera acerca de las enfermedades no transmisibles, en los términos de los reglamentos que al efecto se expidan.\nCAPITULO IV\nACCIDENTES\nArtículo 124. Para los efectos de esta Ley, se entiende por accidente el hecho súbito que ocasione daños a la salud, y que se produzca por la concurrencia de condiciones potencialmente prevenibles.\nArtículo 125. La acción en materia de prevención y control de accidentes comprende:\nI. El conocimiento de las causas más usuales que generen accidentes;\nII. La adopción de medidas para prevenir accidentes;\nIII. El desarrollo de la investigación para la prevención de los mismos;\nIV. El fomento, dentro de los programas de educación para la salud, de la orientación a la población para la prevención de accidentes;\nV. La atención de los padecimientos que se produzcan como consecuencia de ellos, y\nVI. La promoción de la participación de la comunidad en la prevención de accidentes;\nPara la mayor eficacia de las acciones a las que se refiere este artículo, se creará el Consejo Estatal para la Prevención de Accidentes, del que formarán parte representantes de los sectores público, social y privado del Estado.\nDicho Consejo se coordinará con el Consejo Nacional para la Prevención de Accidentes, dentro del marco de los Sistemas Nacional y Estatal de Salud.\nTITULO NOVENO\n(REFORMADO EL TÍTULO, P.O. 15 DE FEBRERO DE 2005)\nPREVENCION DE INVALIDEZ Y REHABILITACION DE INVALIDOS\nCAPITULO UNICO\n(DEROGADA, P.O. 15 DE FEBRERO DE 2005)\nArtículo 126. Se deroga.\n(DEROGADA, P.O. 15 DE FEBRERO DE 2005)\nArtículo 127. Se deroga.\n(DEROGADA, P.O. 15 DE FEBRERO DE 2005)\nArtículo 128. Se deroga.\n(DEROGADA, P.O. 15 DE FEBRERO DE 2005)\nArtículo 129. Se deroga.\nArtículo 130. Los integrantes del Sistema Estatal de Salud deberán dar atención preferente e inmediata a menores y ancianos sometidos a cualquier forma de maltrato que ponga en peligro su salud física y mental. Asimismo, darán esa atención a quienes hayan sido sujetos pasivos de la comisión de delitos que atenten contra la integridad física o mental o el normal desarrollo psico-somático de los individuos.\nEn estos casos, las Instituciones de Salud del Estado, podrán tomar las medidas inmediatas que sean necesarias para la protección de la salud de los menores y ancianos, sin perjuicio de dar intervención a las autoridades competentes.\nArtículo 131. Se deroga. que se dé atención a personas con padecimientos mentales, a niños desprotegidos y ancianos desamparados.\nArtículo 133. Se deroga.\nArtículo 134. Se deroga.\nArtículo 135. Se deroga.\nArtículo 136. Se deroga.\nArtículo 137. Se deroga.\nArtículo 138. Se deroga.\n(DEROGADA, P.O. 15 DE FEBRERO DE 2005)\nArtículo 139. Se deroga.\n(DEROGADA, P.O. 15 DE FEBRERO DE 2005)\nArtículo 140. Se deroga.\n(DEROGADA, P.O. 15 DE FEBRERO DE 2005)\nArtículo 141. Se deroga.\nArtículo 142. Las autoridades sanitarias y educativas del Estado, en el ámbito de sus respectivas competencias, colaborarán para proporcionar atención rehabilitatoria, cuando así se requiera.\nArtículo 143. La Secretaría de Salud del Estado, en coordinación con otras instituciones públicas, promoverá que en los lugares en que se presten servicios al público, se dispongan facilidades para las personas inválidas.\n(DEROGADA, P.O. 15 DE FEBRERO DE 2005)\nArtículo 144. Se deroga.\nArtículo 145. Para los efectos de esta Ley, se entiende por invalidez la limitación en la capacidad de una persona para realizar por sí misma actividades necesarias para el desempeño físico, mental, social, ocupacional y económico como consecuencia de una insuficiencia somática, psicológica o social.\nArtículo 146. La atención en materia de prevención de invalidez y rehabilitación de inválidos comprende.\nI. La investigación de las causas de la invalidez y de los factores que la condicionan;\nII. La promoción de la participación de la comunidad en la prevención y control de las causas condicionantes de la invalidez;\nIII. La identificación temprana y la atención oportuna de procesos físicos, mentales o sociales que puedan causar invalidez;\nIV. La orientación educativa en materia de rehabilitación a la colectividad en general, y en particular a las familias que cuenten con algún inválido promoviendo al efecto la solidaridad social;\nV. La atención integral de los inválidos, incluyendo la adaptación de la (sic) prótesis, órtesis y ayudas funcionales que requieran;\nVI. Promoción para adecuar facilidades urbanísticas y arquitectónicas a las necesidades de los inválidos,\nVII. La promoción de la educación y la capacitación para el trabajo, así como la promoción del empleo de las personas en proceso de rehabilitación.\nArtículo 147. Los servicios de rehabilitación que proporcionen los establecimientos del Sector Salud del\nEstado, estarán vinculados sistemáticamente a los de rehabilitación y asistencia social que preste el\nSistema para el Desarrollo Integral de la Familia en el Estado de Coahuila.\nArtículo 148. Se deroga.\n(DEROGADA, P.O. 15 DE FEBRERO DE 2005)\nArtículo 149. Se deroga.\nTITULO DECIMO\nPROGRAMA CONTRA LAS ADICCIONES\nCAPITULO I\nPROGRAMA CONTRA EL ALCOHOLISMO Y EL ABUSO DE BEBIDAS ALCOHOLICAS\nArtículo 150. El Gobierno del Estado se coordinará con las autoridades sanitarias federales para la ejecución en el Estado del Programa contra el Alcoholismo y el Abuso de Bebidas Alcohólicas que comprenderá, entre otras las siguientes acciones:\nI. La prevención y el tratamiento del alcoholismo y, en su caso, la rehabilitación de los alcohólicos;\nII. La educación sobre los efectos del alcohol en la salud y en las relaciones sociales, dirigida especialmente a niños, adolescentes, obreros y campesinos, a través de métodos individuales, sociales o de comunicación masiva, y\nIII. El fomento de actividades cívicas, deportivas y culturales que coadyuven en la lucha contra el alcoholismo especialmente en zonas rurales y en los grupos de población considerados de alto riesgo.\nArtículo 151. Para obtener la información que oriente las acciones contra el alcoholismo y el abuso de bebidas alcohólicas, las autoridades sanitarias del Estado, en coordinación con otras dependencias y entidades públicas, realizarán actividades de investigación en los siguientes aspectos:\nI. Causas del alcoholismo y acciones para controlarlas;\nII. Efectos de la publicidad en la incidencia del alcoholismo y en los problemas relacionados con el consumo de bebidas alcohólicas;\nIII. Hábitos de consumo de alcohol en los diferentes grupos de población, y\nIV. Efectos del abuso de bebidas alcohólicas en los ámbitos familiar, social, deportivo, de los espectáculos, laboral y educativo.\nCAPITULO II\nPROGRAMA CONTRA EL TABAQUISMO ejecución en el Estado del Programa contra el Tabaquismo, que comprenderá entre otras, las siguientes acciones:\nI. La prevención y el tratamiento de padecimientos originados por el tabaquismo, y\nII. La educación sobre los efectos del tabaquismo en la salud, dirigida especialmente a la familia, niños, adolescentes, a través de métodos individuales, colectivos o de comunicación masiva, incluyendo la orientación a la población para que se abstenga de fumar en lugares públicos.\nArtículo 153. Para poner en práctica las acciones contra el tabaquismo, se tendrá en cuenta los siguientes aspectos:\nI. La investigación de las causas del tabaquismo y de las acciones para controlarlas, y\nII. La educación a la familia para prevenir el consumo de tabaco por parte de niños y adolescentes.\nCAPITULO III\nPROGRAMA CONTRA LA FARMACODEPENDENCIA\nArtículo 154. El Gobierno del Estado, realizará acciones coordinadas con la Secretaría de Salud del\nGobierno Federal, en la ejecución del Programa Nacional contra la Farmacodependencia, en los términos del acuerdo de coordinación específico que celebren ambos órdenes de gobierno.\nArtículo 155. El Gobierno del Estado y los municipios para evitar y prevenir el consumo de substancias inhalables, que produzcan efectos psicotrópicos en las personas, se ajustarán a lo siguiente:\nI. Determinarán y ejercerán medios de control en el expendio de substancias inhalables, para prevenir su consumo por parte de menores de edad e incapaces;\nII. Establecerán sistemas de vigilancia en los establecimientos destinados al expendio y uso de dichas substancias, para evitar el empleo indebido de las mismas;\nIII. Brindarán la atención médica que se requiera, a las personas que realicen o hayan realizado el consumo de inhalables, y\nIV. Promoverán y llevarán a cabo campañas permanentes de información y orientación al público, para la prevención de daños a la salud provocados por el consumo de substancias inhalables. ajusten al control que dispongan el Gobierno Estatal y los municipios, así como a los responsables de los mismos, se les aplicarán las sanciones administrativas que correspondan en los términos de esta Ley.\nTITULO DECIMO PRIMERO\nDE LOS EXPENDIOS DE ALIMENTOS, BEBIDAS NO ALCOHOLICAS Y ALCOHOLICAS.\nCAPITULO UNICO\nArtículo 156. La Secretaría de Salud del Estado, ejercerá la verificación y control sanitario de los establecimientos que expendan o suministren al público alimentos y bebidas no alcohólicas y alcohólicas, en estado natural, mezclados, preparados, adicionados o acondicionados, para su consumo dentro y fuera del mismo establecimiento, de conformidad con las normas oficiales mexicanas que al efecto emita\nArtículo 157. Corresponde al Ejecutivo del Estado determinar la ubicación y el horario de funcionamiento de los establecimientos en que se expendan bebidas alcohólicas en la entidad.\nArtículo 158. Para determinar la ubicación y horario de los establecimientos dedicados a la venta de bebidas alcohólicas, el Ejecutivo del Estado tomará en cuenta la distancia establecida de centros de recreo, culturales y otros similares, a efecto de coadyuvar eficazmente con las acciones derivadas del\nPrograma Nacional contra el Alcoholismo.\nArtículo 159. Los propietarios, encargados o responsables de los establecimientos en que se expendan o suministren bebidas alcohólicas, en ningún caso y de ninguna forma las expenderán o suministrarán a menores de edad.\nTITULO DECIMO SEGUNDO\nSALUBRIDAD LOCAL\nCAPITULO I\nDISPOSICIONES COMUNES\nArtículo 160. Compete al Gobierno del Estado y a los Municipios, en el ámbito de sus respectivas competencias, en los términos de esta Ley, de las demás disposiciones legales aplicables y de los convenios que celebren en la materia, el control sanitario de las materias a que se refiere el Artículo 4o. apartado \"B\" de esta Ley.\nArtículo 161. Para efectos de este Título, se entiende por control sanitario, el conjunto de acciones de orientación, educación, muestreo, verificación y en su caso, aplicación de medidas de seguridad y sanciones que ejerce la Secretaría de Salud del Estado, en base a lo que establecen las normas técnicas, las normas oficiales mexicanas y otras disposiciones legales aplicables.\nEl ejercicio del control sanitario será aplicable a:\nI. Los establecimientos, a que se refiere la fracción XVIII del Artículo 4o. apartado \"A\" de esta Ley.\nII. Los establecimientos y servicios a que se refiere el Artículo 4o. apartado \"b\" de esta Ley.\nArtículo 162. La Secretaría de Salud del Estado, emitirá las normas técnicas a que quedará sujeto el control sanitario de las materias de salubridad local.\nArtículo 163. Los establecimientos que señala el Artículo 4o. apartado \"B\" de esta Ley, no requerirán de autorización sanitaria; debiéndose ajustar al control y verificación sanitarios, así como a los requisitos salubridad local se expidan.\nArtículo 164. Los establecimientos a que se refiere el título Décimo Primero y el presente Título, que no requieran para su funcionamiento de autorización sanitaria, deberán dar aviso por escrito a la Secretaría de Salud del Estado 30 días antes del inicio de operaciones; dicho aviso deberá contener los siguientes datos:\nI. Nombre y domicilio de la persona física o moral propietario del establecimiento, y\nII. Domicilio del establecimiento donde se realiza el proceso y fecha de inicio de operaciones.\nArtículo 165. Todo cambio de propietario de un establecimiento, de razón social, denominación o cesión de derechos de productos, deberá ser comunicado a la autoridad sanitaria competente en un plazo no mayor de treinta días hábiles a partir de la fecha en que se hubiese realizado, sujetándose al cumplimiento de las normas técnicas que al efecto se expidan. las normas técnicas en materia de salubridad local que se expidan y en caso de ser necesario, las notificaciones de las resoluciones administrativas que dispone esta Ley.\nLas notificaciones que conforme a esta Ley deban publicarse, surtirán efecto a partir del día siguiente de su publicación.\nCAPITULO II\nMERCADOS Y CENTROS DE ABASTO\nArtículo 167. Para los efectos de esta Ley se entienden por:\nI. Mercados: El sitio público destinado a la compra y venta de productos en general, preferentemente agrícolas y de primera necesidad, en forma permanente o en días determinados, y\nII. Centros de Abasto: El sitio destinado al servicio público en maniobras de carga y descarga, la conservación en frío y demás operaciones relativas a la compra-venta al mayoreo y medio mayoreo de productos en general.\nArtículo 168. La Secretaría de Salud del Estado, verificará que los mercados y centros de abasto, sean provisionales o permanentes, cumplan con los requisitos que establezca esta Ley, las disposiciones reglamentarias aplicables y las normas técnicas que se emitan para tal efecto.\nArtículo 169. Los vendedores, locatarios y personas que su actividad esté vinculada con los mercados y centros de abasto estarán obligados a conservar las condiciones higiénicas indispensables para el debido mantenimiento de sus locales y el ejercicio de sus actividades se sujetarán a lo que disponga esta Ley, los reglamentos respectivos, otras disposiciones legales aplicables y las normas técnicas y las normas oficiales mexicanas correspondientes.\nCAPITULO III\nDE LAS CONSTRUCCIONES\nArtículo 170. Para los efectos de esta Ley, se entiende por construcción toda edificación o local que se destine a la habitación, comercio, enseñanza, recreación, trabajo o cualquier otro uso.\nArtículo 171. En los aspectos sanitarios, las construcciones, reconstrucciones, modificaciones y adaptaciones deberán cumplir con esta Ley, las demás disposiciones legales aplicables, las normas técnicas y las normas oficiales mexicanas correspondientes.\nArtículo 172. Para iniciar y realizar la construcción, reconstrucción, modificación o acondicionamiento total o parcial de un edificio o local, se deberá dar el aviso a que se refiere el Artículo 164 de esta Ley, anexando el proyecto en cuanto a iluminación, ventilación, instalaciones sanitarias y contra accidentes, de conformidad con las disposiciones reglamentarias aplicables.\nArtículo 173. Cuando el uso que se pretenda dar a un edificio o local sea público, además de los requisitos previstos en otras disposiciones aplicables, se deberá contar con agua potable corriente y retretes públicos, los cuales deberán reunir los requisitos técnicos sanitarios correspondientes.\nArtículo 174. El encargado de la construcción, reconstrucción, modificación o acondicionamiento de cualquiera de los establecimientos a que se refiere este capítulo, deberá dar aviso de inicio y terminación aprobados en el proyecto.\nArtículo 175. Los edificios y locales terminados, podrán dedicarse al uso que se destinen, una vez verificados y declarada la conformidad por parte de la autoridad sanitaria competente.\nArtículo 176. Los edificios, locales, construcciones o terrenos urbanos, podrán ser verificados por la autoridad sanitaria competente, la que ordenará las obras necesarias para satisfacer las condiciones higiénicas y de seguridad en los términos de esta Ley, otras disposiciones legales aplicables, las normas oficiales mexicanas y normas técnicas correspondientes.\nArtículo 177. Los propietarios o poseedores de los edificios y locales, o de los negocios en ellos establecidos, están obligados a ejecutar las obras que se requieran para cumplir con las condiciones de higiene y de seguridad que establezcan las disposiciones legales aplicables, normas oficiales mexicanas y las normas técnicas correspondientes.\nArtículo 178. Cuando los edificios, construcciones o terrenos representen un peligro por su insalubridad o inseguridad, las autoridades sanitarias competentes, podrán ordenar la ejecución de las obras que estime de urgencia con cargo a sus propietarios, encargados o poseedores o a los dueños de las negociaciones en ellos establecidos, cuando no las realicen dentro de los plazos concedidos.\nCAPITULO IV\nCEMENTERIOS, CREMATORIOS Y FUNERARIAS\nArtículo 179. Para los efectos de esta Ley se considera:\nI. Cementerio: El lugar destinado a la inhumación de los cadáveres y restos humanos, y en su caso, la exhumación de los mismos;\nII. Crematorios: Las instalaciones destinadas a la incineración de cadáveres y restos humanos, y\nIII. Funeraria: El establecimiento dedicado a la prestación del servicio, venta de féretros, velación y traslado de cadáveres de seres humanos a los cementerios o crematorios.\nArtículo 180. Para establecer un nuevo cementerio o crematorio se requiere el cumplimiento de las disposiciones legales aplicables.\nArtículo 181. El funcionamiento de los cementerios, crematorios y funerarias estará sujeto a esta Ley, otras disposiciones reglamentarias aplicables, las normas oficiales mexicanas y las normas técnicas correspondientes.\nArtículo 182. La autoridad sanitaria competente verificará el establecimiento, funcionamiento, establezcan las disposiciones legales y reglamentarias aplicables.\nArtículo 183. Los cementerios deberán contar con áreas verdes y zonas destinadas a reforestación.\nArtículo 184. La aprobación de las solicitudes de refrigeración, exhumación, traslado y cremación de\nCAPITULO V\nLIMPIEZA PUBLICA\nArtículo 185. Para los efectos de esta Ley se entiende por servicio de limpieza pública la recolección, manejo, disposición y tratamiento de residuos sólidos, a cargo de los Ayuntamientos, los que estarán obligados a prestar este servicio de una manera regular y eficiente.\nArtículo 186. Para efectos de la presente Ley, se entenderá por residuo sólido, el material generado de los procesos de extracción, beneficio, transformación, producción, consumo, utilización, control, tratamiento, de cualquier producto cuya calidad no permita usarlo nuevamente en el proceso que lo generó que provengan de actividades que se desarrollen en casas-habitación, establecimientos mercantiles, industriales o de servicios y de las vías públicas.\nArtículo 187. El servicio de limpieza pública se sujetará a lo siguiente:\nI. Los desechos sólidos se manipularán lo estrictamente indispensable durante el transporte a su destino final, vigilando que no se ocasionen riesgos a la salud;\nII. Queda prohibida la quema o incineración de residuos sólidos, cuya combustión sea nociva para la salud, fuera de los lugares que determine la autoridad sanitaria;\nIII. Los residuos sólidos patológicos de los hospitales deberán manejarse separadamente de los otros, procediéndose a su incineración o eliminación a través de cualquier otro método previsto en las disposiciones legales aplicables;\nIV. Los restos de animales encontrados en la vía pública deberán incinerarse o enterrarse por la autoridad municipal, procurando que no entren en estado de descomposición;\nV. El depósito final de los residuos sólidos deberá estar situado a una distancia no menor de dos kilómetros de asentamientos humanos, en contra de los vientos dominantes y sin que sea visible desde las carreteras, correspondiendo a la autoridad sanitaria fijar criterios de ubicación de los mismos, sin perjuicio de lo que establezcan las disposiciones legales en la materia;\nVI. La basura deberá incinerarse periódicamente en los lugares dispuestos para tal efecto o destruirse por otros procedimientos, excepto cuando sea industrializable o tenga empleo útil, siempre y cuando no signifique un peligro para la salud, y\nVII. El cumplimiento de las demás medidas y requisitos que establezcan las leyes y reglamentos vigentes en el Estado y las normas oficiales mexicanas que expida la autoridad sanitaria.\nArtículo 188. Las autoridades municipales, fijarán lugares especiales para depositar la basura, tomando en cuenta, al efecto, la legislación aplicable en materia de contaminación ambiental. en los parques, jardines, paseos públicos y en otros lugares en la vía pública que estén dentro de su jurisdicción, además de ordenar la fumigación periódica en los mismos; así mismo, fijará lugares especiales para depositar la basura, tomando en cuenta lo que sobre el particular disponga la legislación aplicable en materia de contaminación ambiental.\nArtículo 190. Para toda actividad relacionada con este capítulo, se estará a lo dispuesto por esta Ley, otras disposiciones legales aplicables, las normas oficiales mexicanas y las normas técnicas correspondientes.\nCAPITULO VI\nRASTROS\nArtículo 191. Para los efectos de esta Ley, se entiende por rastro, el establecimiento destinado al sacrificio de animales cuya carne se destinará para el consumo público.\nArtículo 192. El funcionamiento, aseo y conservación de los rastros municipales, quedará a cargo de la autoridad municipal competente. Si fueren concesionados a particulares, las acciones anteriores, quedarán a cargo de los mismos y bajo la verificación de las autoridades municipales competentes. En ambos casos, quedan sujetos a la observación de lo dispuesto por esta Ley y otras disposiciones legales aplicables.\nQueda prohibido el funcionamiento de rastros y el sacrificio en condiciones inhumanas que no cumplan con los requisitos sanitarios establecidos en esta Ley y demás disposiciones legales aplicables.\nArtículo 193. Los animales deberán ser examinados en pie y en canal por la autoridad sanitaria competente la cual señalará qué carne puede destinarse a la venta pública.\nArtículo 194. Queda prohibido el sacrificio de animales en domicilios particulares o en la vía pública, cuando las carnes sean destinadas al consumo público.\nPodrá sacrificarse ganado menor en domicilios particulares, sólo en el caso de que se destine la carne y los demás productos derivados de éste, al consumo familiar.\nArtículo 195. El sacrificio de los animales sujetos al aprovechamiento humano, en cualquiera de sus formas, deberá ser humanitario, y se utilizarán métodos científicos y técnicos actualizados y específicos que señalen las disposiciones reglamentarias, las normas técnicas y las normas oficiales mexicanas correspondientes, con el objeto de impedir toda crueldad que cause sufrimiento a los animales.\nArtículo 196. En el reglamento correspondiente, se establecerán los requisitos sanitarios, relativos al manejo, tratamiento, cuidado y conservación de los animales destinados al sacrificio.\nArtículo 197. La norma técnica correspondiente, establecerá los requisitos sanitarios y medidas de funcionamiento que deberán cumplir los vehículos para transportar animales destinados al sacrificio.\nArtículo 198. El sacrificio de animales en los rastros se efectuará en los días y horas que fijen las autoridades sanitaria y municipal, tomando en consideración las condiciones del lugar y los elementos de que dispongan dichas autoridades para realizar las verificaciones necesarias.\nCAPITULO VII\nAGUA POTABLE Y ALCANTARILLADO\nArtículo 199. El Gobierno Estatal y Municipal, en sus respectivos ámbitos de competencia, se servicio regular de aprovisionamiento y distribución de agua potable.\nArtículo 200. Los proyectos de sistemas de abastecimiento de agua potable deberán ser sometidos a la consideración de la autoridad sanitaria municipal o estatal en su caso, para la aprobación del sistema adoptado y para el análisis minucioso de las aguas.\nArtículo 201. La autoridad sanitaria competente realizará periódicamente análisis de la potabilidad del agua, conforme a esta Ley, otras disposiciones legales aplicables y las normas oficiales mexicanas correspondientes.\nArtículo 202. En los municipios que carezcan del sistema de agua potable y alcantarillado, deberán proteger las fuentes de abastecimiento para prevenir Su (sic) contaminación, conforme a las normas oficiales mexicanas correspondientes.\nQueda prohibido utilizar para el consumo humano, el agua de pozo o aljibe que no se encuentre situado a una distancia mínima de 15 metros considerando la corriente o flujo subterráneo de éstos de: retretes, alcantarillados, estercoleros o depósitos de desperdicios que puedan contaminarlos.\nArtículo 203. Las personas que intervengan en el abastecimiento de agua no podrán suprimir la dotación de servicios de agua potable y avenamiento de los edificios habitados, excepto en los casos que determinen las disposiciones generales aplicables.\nArtículo 204. Todas las poblaciones del Estado deberán contar con sistemas para el desagüe rápido e higiénico de sus desechos, preferentemente por medio de alcantarillado o fosas sépticas.\nArtículo 205. En las poblaciones donde no haya sistema de alcantarillado se estará a lo dispuesto por esta Ley y demás disposiciones aplicables.\nArtículo 206. Los proyectos para la implantación de sistemas de alcantarillado deberán ser estudiados y aprobados por la autoridad municipal, con la intervención que corresponda al Gobierno del Estado y la obra se llevará a cabo bajo la verificación de la misma.\nArtículo 207. Queda prohibido que los desechos o líquidos que conduzcan los caños sean vertidos en ríos, arroyos, acueductos, corrientes o canales por donde fluyan aguas destinadas al uso o consumo humano, en todo caso deberán ser tratados y cumplir con las disposiciones legales aplicables.\nCAPITULO VIII\nESTABLOS, GRANJAS AVICOLAS, PORCICOLAS, APIARIOS Y ESTABLECIMIENTOS SIMILARES\nArtículo 208. Para los efectos de esta Ley se entiende por:\nI. Establos: Todos aquellos sitios dedicados a la explotación de animales productores de lácteos y sus derivados;\nII. Granjas avícolas: Los establecimientos dedicados a la cría reproducción y explotación de las especies y variedades de aves útiles a la alimentación humana;\nIII. Granjas porcícolas: Los establecimientos dedicados a la cría, reproducción, mejoramiento y explotación de cerdos;\nIV. Apiarios: El conjunto de colmenas destinados a la cría, explotación y mejoramiento genético de abejas, y\nV. Establecimientos Similares: Todos aquellos dedicados a la cría, reproducción, mejoramiento y explotación de especies animales no incluidas en las fracciones anteriores.\nArtículo 209. Los establecimientos a que se refiere este capítulo, no podrán estar ubicados en el centro de los lugares poblados o en lugares contiguos a ellos,en (sic) un radio que delimitará la autoridad sanitaria municipal, conforme a las disposiciones legales en vigor. Los establecimientos de esta naturaleza que actualmente se localicen en dichos lugares, deberán salir de las poblaciones en el plazo que señalen los Ayuntamientos.\nArtículo 210. Las condiciones y requisitos sanitarios que deban reunir los establecimientos a que se refiere el Artículo 209 de esta Ley, serán fijados en las disposiciones reglamentarias y las normas técnicas correspondientes.\nCAPITULO IX\nPROSTITUCION\nArtículo 211. Para los efectos de esta Ley se entiende por prostitución la actividad que realizan las personas utilizando sus funciones sexuales como medio de vida.\n(REFORMADO, P.O. 21 DE JULIO DE 1998)\nArtículo 212. Toda persona que se dedique a la prostitución, deberá conocer y utilizar medidas preventivas para evitar el contagio y la transmisión de enfermedades a través del contacto sexual.\nAsimismo, se sujetarán a exámenes médicos y de laboratorio periódicos, con inclusión del VIH. Al igual que a (sic) los demás requisitos que se establezcan en las disposiciones reglamentarias aplicables.\nArtículo 213. Queda prohibido el ejercicio de la prostitución a personas menores de edad.\nArtículo 214. Queda prohibido el ejercicio de la prostitución a las personas que padezcan de alguna enfermedad sexualmente transmisible u otra grave en período infectante, que ponga en riesgo de contagio la salud de otra, por relaciones sexuales. Las personas que hubieren contraído alguna enfermedad de este tipo, deberán comprobar ante la autoridad sanitaria que ya no la padece, mediante los análisis y el certificado médico que así lo acredite, o en su caso se harán acreedores a las sanciones que establezcan otras disposiciones legales.\nArtículo 215. El ejercicio de esta actividad estará sujeto a lo que dispone esta Ley y otras disposiciones legales aplicables.\nArtículo 216. Queda prohibido el acceso de menores de edad al interior de los establecimientos o zonas en donde se autorice el ejercicio de la prostitución.\nArtículo 217. La autoridad municipal, determinará los lugares en donde se permitirá el ejercicio de la prostitución, para lo cual podrá solicitar la opinión de la Secretaría de Salud del Estado, de conformidad con las disposiciones legales reglamentarias aplicables.\nQueda prohibido el funcionamiento de prostíbulos en lugares cercanos a las áreas habitacionales, escuelas, cuarteles o retenes militares o de policía, oficinas públicas, bancos, centros fabriles, culturales, religiosos, deportivos u otros similares.\nPara la determinación del criterio de cercanía, se medirá una distancia de tres kilómetros a los puntos señalados en el párrafo anterior, el cual se considerará área no autorizada.\nCAPITULO X\nRECLUSORIOS O CENTROS DE READAPTACION SOCIAL\nArtículo 218. Para los efectos de esta Ley, se entiende por reclusorio o Centro de Readaptación Social, una resolución judicial o administrativa. con las disposiciones que se señalan en esta Ley y demás disposiciones generales aplicables.\nArtículo 220. Los reclusorios y Centros de Readaptación Social deberán contar además de lo previsto baños de regadera, y con un consultorio médico, que cuente con el equipo necesario para la atención de aquellos casos de enfermedad de los internos en que no sea requerido el traslado de éstos a un hospital.\nArtículo 221. Tratándose de enfermedades de emergencia, graves o cuando así lo requiera el tratamiento a juicio del personal médico de la Institución, previa autorización del director de la misma, el interno podrá ser trasladado a la unidad hospitalaria que él mismo determine; en cuyo caso se deberá hacer del conocimiento de las autoridades competentes. Las personas encargadas de los servicios médicos de los reclusorios y Centros de Readaptación Social, deberán a partir de que tengan conocimiento de alguna enfermedad transmisible adoptar las medidas de seguridad sanitaria que procedan, para evitar la propagación de la misma, así como observar lo dispuesto por el Artículo 108 de esta Ley.\nCAPITULO XI\nBAÑOS PUBLICOS\nArtículo 222. Para los efectos de esta Ley, se entiende por baño público el establecimiento destinado a utilizar el agua para el aseo corporal, deporte o uso medicinal bajo la forma de baño y al que pueda concurrir el público. Quedan incluidos en la denominación de baños, los llamados de vapor y de aire caliente.\nArtículo 223. Para abrir al servicio público estos establecimientos, deberán sujetarse al cumplimiento de las disposiciones reglamentarias y las normas técnicas correspondientes.\nArtículo 224. La actividad de estos establecimientos estará sujeta a lo dispuesto por esta Ley, otras disposiciones legales aplicables y las normas técnicas en materia de salubridad local correspondientes que dicte la Secretaría de Salud del Estado.\nCAPITULO XII\nCENTROS DE REUNION Y ESPECTACULOS\nArtículo 225. Para efectos de esta Ley, se entiende por centros de reunión y espectáculos, los establecimientos destinados a la concentración de personas con fines recreativos, sociales, deportivos o culturales.\nArtículo 226. La Secretaría de Salud del Estado, podrá en cualquier momento ordenar la clausura de los garantizar la vida y la salud de las personas que a ellos concurran, dicha clausura prevalecerá entre tanto no sean corregidas las causas que la motivaron.\nArtículo 227. El funcionamiento de los establecimientos a que se refiere el Artículo 225 de esta Ley, seguridad e higiene que se establezcan por los reglamentos de esta Ley, otras disposiciones legales aplicables y las normas técnicas correspondientes.\nCAPITULO XIII\nESTABLECIMIENTOS DEDICADOS A LA PRESTACION DE SERVICIOS COMO PELUQUERIA,\nSALONES DE BELLEZA, ESTETICAS Y OTROS SIMILARES\nArtículo 228. Para los efectos de esta Ley, se entiende por peluquería, salones de belleza y estéticas, los establecimientos dedicados a rasurar, teñir, peinar, cortar, rizar o realizar cualquier actividad similar con de belleza en general al público.\nArtículo 229. El funcionamiento y personal de los establecimientos señalados en el Artículo 228 deberán apegarse a lo establecido en esta Ley, otras disposiciones legales aplicables, y las normas técnicas correspondientes.\nCAPITULO XIV\nTINTORERIAS, LAVANDERIAS Y LAVADEROS PUBLICOS\nArtículo 230. Para los efectos de esta Ley, se entiende por:\nI. Tintorería: el establecimiento dedicado al lavado y planchado de ropa, independientemente del procedimiento utilizado;\nII. Lavandería: el establecimiento dedicado al lavado de ropa, y\nIII. Lavadero público: el establecimiento al cual acuden los interesados para realizar personalmente el lavado de la ropa.\nArtículo 231. Corresponde a la autoridad sanitaria competente ejercer la verificación sanitaria de los establecimientos a que se refiere este capítulo, conforme a las disposiciones legales aplicables.\nCAPITULO XV\nESTABLECIMIENTOS PARA EL HOSPEDAJE\nArtículo 232. Para los efectos de esta Ley, se entiende por establecimientos para el hospedaje, cualquier edificación que se destine a albergar a toda aquella persona que paga por ello.\nArtículo 233. La Secretaría de Salud del Estado, realizará la verificación sanitaria a los establecimientos para el hospedaje, que conforme a esta Ley y otras disposiciones legales aplicables le corresponda.\nArtículo 234. Para la construcción o acondicionamiento de un inmueble que se pretenda destinar como establecimiento para el hospedaje, así como para su funcionamiento, se deberá dar cumplimiento a lo establecido en esta Ley y demás disposiciones aplicables.\nCAPITULO XVI\nTRANSPORTE ESTATAL Y MUNICIPAL\nArtículo 235. Para los efectos de esta Ley, se entiende por transporte, todo aquel vehículo destinado al traslado de carga, o de pasajeros sea cual fuere su medio de propulsión.\nArtículo 236. Los transportes que circulen por uno o más municipios del Estado de Coahuila no requerirán de autorización sanitaria, debiendo cumplir con los requisitos sanitarios establecidos en las disposiciones reglamentarias aplicables y las normas técnicas que para tal efecto se emitan.\nCAPITULO XVII\nGASOLINERIAS\nArtículo 237. Para los efectos de esta Ley, se entiende por gasolinería el establecimiento destinado al expendio o suministro de gasolinas, aceites y demás productos derivados del petróleo que sean usados en vehículos automotores.\nArtículo 238. Las gasolinerías deberán contar con las instalaciones de seguridad que establezcan las disposiciones legales y reglamentarias aplicables y las normas oficiales mexicanas correspondientes.\nCAPITULO XVIII\nPREVENCION Y CONTROL DE LA RABIA EN ANIMALES Y SERES HUMANOS\nArtículo 239. Para efectos de esta Ley, se entiende por Centro Antirrábico el establecimiento operado o concesionado por el Ayuntamiento con el propósito de contribuirá (sic) la prevención y control de la rabia animal y coadyuvar con las autoridades sanitarias competentes en los casos en que seres humanos hubieren contraído dicha enfermedad.\nArtículo 240. Los centros antirrábicos que establezcan los Ayuntamientos, tendrán las siguientes funciones:\nI. Atender quejas sobre animales agresores;\nII. Capturar animales agresores y callejeros;\nIII. Observar clínicamente a los animales capturados dentro de un lapso de 48 horas, para que su propietario lo reclame;\nIV. Vacunar a los animales capturados y reclamados por su propietario, acosta del mismo, dentro del lapso señalado en la fracción anterior; así como también, de aquellos que para tal fin sean llevados voluntariamente por sus propietarios.\nV. Practicar la necropsia de animales sospechosos de padecer rabia;\nVI. Obtener los diagnósticos de rabia por medio de análisis de laboratorio;\nVII. Canalizar a las personas agredidas, para su tratamiento oportuno, y\nVIII. El sacrificio humanitario de los animales que habiendo cumplido el lapso de observación, no hayan sido reclamados por sus propietarios o cuando éstos así lo soliciten.\nArtículo 241. Los propietarios de los animales a que se refiere el artículo anterior estarán obligados a vacunarlos ante las autoridades sanitarias o servicios particulares, así como a mantenerlos dentro de sus domicilios y bajo su control.\nArtículo 242. Las autoridades sanitarias, mantendrán campañas permanentes de orientación a la población, enfocadas a la vacunación y control de animales domésticos, susceptibles de contraer la rabia.\nTITULO DECIMO TERCERO\nAUTORIZACIONES Y CERTIFICADOS\nCAPITULO I\nAUTORIZACIONES\nArtículo 243. La autorización sanitaria es el acto administrativo mediante el cual la autoridad sanitaria competente, permite a una persona pública o privada, la realización de actividades relacionadas con la salud humana, en los casos y con los requisitos y modalidades que determine esta Ley y demás disposiciones generales aplicables.\nLas autorizaciones sanitarias tendrán el carácter de licencias, permisos o tarjetas de control sanitario.\nArtículo 244. Las autorizaciones sanitarias serán otorgadas por tiempo indeterminado, con las excepciones que establezca esta Ley, en caso de incumplimiento de las disposiciones reglamentarias y las normas técnicas, las autorizaciones serán canceladas.\nArtículo 245. La autoridad sanitaria competente expedirá las autorizaciones respectivas cuando el solicitante hubiere satisfecho los requisitos que señalen las normas aplicables y cubierto en su caso, los derechos que establezca la legislación físcal aplicable.\nArtículo 246. Los establecimientos que prestan servicios de asistencia social, no requerirán para su funcionamiento de autorización sanitaria, y serán sujetos del control y vigilancia sanitaria, así como de los requisitos que establezcan las disposiciones reglamentarias y las normas técnicas que se expidan.\nArtículo 247. Los derechos a que se refiere esta Ley se regirán por lo que disponga la legislación fiscal y los convenios de coordinación que celebren en la materia, el Gobierno del Estado con el Ejecutivo\nFederal.\nCAPITULO II\nREVOCACION DE AUTORIZACIONES SANITARIAS\nArtículo 248. La autoridad sanitaria local competente podrá revocar las autorizaciones que haya otorgado, en los siguientes casos:\nI. Cuando, por causas supervenientes, se compruebe que los productos o el ejercicio de las actividades que se hubieren autorizado, constituían riesgo o daño para la salud humana;\nII. Cuando el ejercicio de la actividad que se hubiere autorizado, exceda los límites fijados en la autorización respectiva;\nIII. Porque se dé un uso distinto a la autorización;\nIV. Por incumplimiento grave a las disposiciones de esta Ley, sus reglamentos y demás disposiciones generales aplicables;\nV. Por reiterada renuencia a acatar las ordenes que dicte la autoridad sanitaria, en los términos de esta\nLey y demás disposiciones generales aplicables;\nVI. Cuando resulten falsos los datos o documentos proporcionados por el interesado, que hubieren servido de base a la autoridad sanitaria, para otorgar la autorización;\nVII. Cuando el interesado no se ajuste a los términos, condiciones y requisitos en que se le haya otorgado la autorización o haga uso indebido de ésta;\nVIII. Cuando lo solicite el interesado;\nIX. Cuando los establecimientos o personas dejen de reunir las condiciones o requisitos bajo los cuales se hayan otorgado las autorizaciones, y\nX. En los demás casos que conforme a esta Ley y demás disposiciones legales aplicables, lo determine la autoridad sanitaria competente.\nArtículo 249. Cuando la revocación de una autorización se funde en los riesgos o daños que pueda causar o cause un servicio, la autoridad sanitaria dará conocimiento de tales revocaciones a las dependencias y entidades públicas que tengan atribuciones de orientación al consumidor.\nArtículo 250. En los casos a que se refiere el Artículo 248 de esta Ley, con excepción del previsto en la fracción VIII, la autoridad sanitaria citará al interesado a una audiencia para que éste ofrezca pruebas y alegue lo que a su derecho convenga.\nEn el citatorio, que se entregará personalmente al interesado, se le hará saber la causa que motive el procedimiento, el lugar, día y hora de celebración de la audiencia, el derecho que tiene para ofrecer pruebas y alegar lo que a su interés convenga, así como el apercibimiento de que si no comparece sin justa causa, la resolución se dictará tomando en cuenta sólo las constancias del expediente.\nLa audiencia se celebrará dentro de un plazo no menor de cinco días hábiles, contados a partir del día siguiente de la notificación.\nEn los casos en que las autoridades sanitarias del Estado, fundadamente no puedan realizar las notificaciones en forma personal, ésta se practicará a través del Periódico Oficial del Gobierno del Estado y de un periódico de amplia circulación en el Estado.\nArtículo 251. En la substanciación del procedimiento de la revocación de autorizaciones, se observará lo dispuesto por los Artículos 316 y 319 de esta Ley.\nArtículo 252. La audiencia se celebrará el día y hora señalados, con o sin la asistencia del interesado. En este último caso, se deberá dar cuenta con la copia del citatorio que se hubiese girado al interesado y con la constancia que acredite de que fue efectivamente entregado, o con el ejemplar, en su caso, de los periódicos en que hubiere aparecido publicado el citatorio.\nArtículo 253. La celebración de la audiencia podrá diferirse por una sola vez, cuando lo solicite el interesado por una causa debidamente justificada.\nArtículo 254. La autoridad sanitaria competente emitirá la resolución que corresponda al concluir la audiencia o dentro de los cinco días hábiles siguientes, la cual se notificará de manera personal al interesado.\nArtículo 255. La resolución administrativa o de revocación en su caso, surtirá efecto, de clausura definitiva, prohibición de uso, prohibición de venta o de ejercicio de las actividades a que se refiere la autorización revocada.\nCAPITULO III\nCERTIFICADOS\nArtículo 256. Para los efectos de esta Ley, se entiende por certificado la constancia expedida en los términos que establezcan las autoridades sanitarias competentes, para la comprobación o información de determinados hechos.\nArtículo 257. Para fines sanitarios se extenderán los siguientes certificados:\nI. Prenupciales;\nII. De defunción;\nIII. De muerte fetal, y\nIV. Los demás que determine la Ley General de Salud.\nArtículo 258. El certificado médico prenupcial será requerido por las autoridades del Registro Civil a quienes pretendan contraer matrimonio, con las excepciones que establezcan las disposiciones generales aplicables.\nArtículo 259. Los certificados de defunción y de muerte fetal serán expedidos, una vez comprobado el fallecimiento y determinadas sus causas, por profesionales de la medicina o personas autorizadas por la\nSecretaría de Salud del Estado.\nArtículo 260. Los certificados a que se refiere este Título, se extenderán en los modelos aprobados por la Secretaría de Salud del gobierno federal y de conformidad con las (sic) norma oficial Mexicana que la misma emita. Las autoridades judiciales o administrativas sólo admitirán como válidos los certificados que se ajusten a lo dispuesto en el párrafo anterior.\nTITULO DECIMO CUARTO\nVIGILANCIA SANITARIA\nCAPITULO UNICO\nArtículo 261. Corresponde a la Secretaría de Salud del Estado o los Ayuntamientos, en el ámbito de sus respectivas competencias, la vigilancia del cumplimiento de esta Ley y demás disposiciones reglamentarias que se dicten con base en ella.\nArtículo 262. Las demás dependencias y entidades públicas en el Estado coadyuvarán a la vigilancia del cumplimiento de las normas sanitarias y, cuando encontraren irregularidades que a su juicio constituyan violaciones a las mismas, lo harán del conocimiento de las autoridades sanitarias competentes. emanen, podrá ser objeto de orientación y educación de los infractores, con independencia de que se apliquen, si procedieren, las medidas de seguridad y las sanciones correspondientes en esos casos.\nArtículo 264. La vigilancia sanitaria se realizará mediante visitas de verificación a cargo del personal expresamente autorizado por la autoridad sanitaria estatal competente, el cual deberá realizar las aplicables.\nArtículo 265. Las autoridades sanitarias competentes en el Estado podrán encomendar a sus verificadores, además, actividades de orientación, educativas y aplicación, en su caso, de las medidas de seguridad a que se refieren las fracciones VII, VIII y XI del Artículo 278 de esta Ley.\nArtículo 266. Las verificaciones podrán ser ordinarias y extraordinarias. Las primeras se efectuarán en días y horas hábiles y las segundas en cualquier tiempo.\nPara los efectos de esta Ley, tratándose de establecimientos industriales, comerciales o de servicios, se consideran horas hábiles las de su funcionamiento habitual o autorizado.\nArtículo 267. Los verificadores en el ejercicio de sus funciones tendrán libre acceso en los edificios, establecimientos comerciales, de servicio y en general a todos los lugares a que hace referencia esta\nLey.\nLos propietarios, responsables, encargados u ocupantes de establecimientos o conductores de los transportes objeto de verificación, estarán obligados a permitir el acceso y a dar facilidades e informes a los verificadores para el desarrollo de su labor.\nArtículo 268. Los verificadores, para practicar visitas, deberán estar provistos de órdenes escritas, con firma autógrafa, expedidas por la autoridad sanitaria competente en las que se deberá precisar el lugar o zona que ha de verificarse, el objeto de la visita, el alcance que debe tener y las disposiciones legales que la fundamenten.\nTratándose de actividades que se realicen en la vía pública, las órdenes podrán darse para vigilar una rama determinada de actividades o una zona que se delimitará en la misma orden.\nArtículo 269. En la diligencia de verificación sanitaria se deberán observar las siguientes reglas:\nI. Al iniciar la visita el verificador deberá exhibir la credencial vigente, expedida por la autoridad sanitaria competente, que lo acredite legalmente para desempeñar dicha función así como la orden expresa a que se refiere el Artículo 268 de esta Ley, de la que deberá dejar copia al propietario, responsable, encargado u ocupante del establecimiento. Esta circunstancia se deberá anotar en el acta correspondiente:\nII. Al inicio de la visita, se deberá requerir al propietario, responsable, encargado u ocupante del establecimiento o conductor del transporte, que proponga a dos testigos que deberán permanecer durante el desarrollo de la visita. Ante la negativa o ausencia del visitado, los designará la autoridad que practique la verificación. Estas circunstancias, el nombre, domicilio, y firma de los testigos, se hará constar en el acta;\nIII. En el acta que se levante con motivo de la verificación, se hará constar las circunstancias de las diligencias, las deficiencias o anomalías sanitarias observadas, el número y tipo de muestras tomadas o en su caso las medidas de seguridad que se ejecuten, y\nIV. Al concluir la verificación, se dará oportunidad al propietario, responsable, encargado u ocupante del establecimiento o conductor del transporte, de manifestar lo que a su derecho convenga, asentando su dicho en el acta respectiva y recabando su firma en el propio documento, del que se le entregará una constar en el referido documento y no afectará su validez, ni de la diligencia practicada.\nArtículo 270. La recolección de muestras se efectuará con sujeción a las siguientes reglas:\nI. Se observarán las formalidades y requisitos exigidos para las visitas de verificación;\nII. La toma de muestras podrá realizarse en cualquiera de las etapas del proceso, pero deberán tomarse del mismo lote, producción o recipiente, procediéndose a identificar las muestras en envases que puedan ser cerrados y sellados;\nIII. Se obtendrán tres muestras del producto. Una de ellas se dejará en poder de la persona con quien se entienda la diligencia para su análisis particular, otra muestra podrá quedar en poder de la misma persona a disposición de la autoridad sanitaria competente y tendrá el carácter de muestra testigo; la última será enviada por la autoridad sanitaria competente al laboratorio autorizado y habilitado por ésta, para su análisis oficial;\nIV. El resultado del análisis oficial se notificará en forma personal o por correo certificado con acuse de recibo al interesado, dentro de los treinta días hábiles siguientes a la fecha de la toma de muestras;\nV. En caso de desacuerdo con el resultado que se haya notificado, el interesado los podrá impugnar dentro de un plazo de quince días hábiles a partir de la notificación del análisis oficial.\nTranscurrido este plazo sin que se haya impugnado el resultado del análisis oficial, éste quedará firme y la autoridad sanitaria competente procederá conforme a la fracción VII de este Artículo, según corresponda;\nVI. Con la impugnación a que se refiere la fracción anterior, el interesado deberá acompañar el original del análisis particular que se hubiere practicado a la muestra que haya sido dejada en poder de la persona con quien se entendió la diligencia de muestreo, así como, en su caso, la muestra testigo, sin el cumplimiento de este requisito no se dará trámite a la impugnación y el resultado del análisis oficial quedará firme;\nVII. La impugnación presentada en términos de las fracciones anteriores dará lugar a que la autoridad sanitaria competente analice la muestra testigo en un laboratorio que la misma señale en presencia de las partes interesadas. El resultado del análisis de la muestra testigo será el que en definitiva acredite si el producto en cuestión reúne o no los requisitos y especificaciones sanitarios exigidos, y\nVIII. El resultado del análisis de la muestra testigo se notificará en forma personal o por correo certificado con acuse de recibo al interesado de que se trate, y en caso de que el producto reúna los requisitos y especificaciones requeridos, la autoridad sanitaria procederá a ordenar el levantamiento de la medida de seguridad que se hubiera ejecutado, según corresponda.\nSi el resultado a que se refiere la fracción anterior comprueba que el producto no satisface los requisitos y especificaciones sanitarios, la autoridad competente procederá a dictar y ejecutar las medidas de seguridad sanitarias que procedan o a confirmar las sanciones que correspondan.\nEn este caso, el titular podrá inconformarse, solicitando sea realizado el análisis de la muestra testigo.\nEl depositario de la muestra testigo será responsable solidario con el interesado, si no conserva la muestra citada.\nEl procedimiento de muestreo no impide que la autoridad sanitaria competente dicte y ejecute las medidas de seguridad sanitarias que procedan, en cuyo caso se asentará en el acta de verificación las que se hubieren ejecutado y los productos que comprenda.\nArtículo 271. En el caso de muestras de productos perecederos deberá conservarse en condiciones óptimas para evitar su descomposición, su análisis deberá iniciarse, dentro de las cuarenta y ocho horas siguientes a la hora en que se recibieron. El resultado del análisis se notificará en forma personal al verificación. El particular podrá impugnar el resultado del análisis en un plazo de tres días contados a partir de la notificación, en cuyo caso se procederá en los términos de las fracciones VI y VII del artículo anterior.\nTranscurrido este plazo, sin que se haya impugnado el resultado del análisis oficial, éste quedará firme.\nArtículo 272. En el caso de los productos recogidos en procedimientos de muestreo o verificación, sólo los laboratorios autorizados o habilitados por la autoridad sanitaria competente en el Estado, determinarán por medio de los análisis practicados, si tales productos reúnen o no sus especificaciones.\nTITULO DECIMO QUINTO\nMEDIDAS DE SEGURIDAD SANITARIA Y SANCIONES\nCAPITULO I\nMEDIDAS DE SEGURIDAD SANITARIA\nArtículo 273. Se consideran medidas de seguridad, las disposiciones que dicte la Secretaría de Salud del\nEstado y los Ayuntamientos en el ámbito de su competencia, de conformidad con los preceptos de esta\nLey y demás disposiciones aplicables, para proteger la salud de la población. Las medidas de seguridad se aplicarán sin perjuicio de las sanciones que, en su caso, correspondieren.\nArtículo 274. La participación de los municipios estará determinada por los convenios que celebren con los gobiernos de las respectivas entidades federativas y por lo que dispongan otros ordenamientos locales.\nArtículo 275. Son medidas de seguridad sanitaria las siguientes:\nI. El aislamiento;\nII. La cuarentena;\nIII. La observación personal;\nIV. La vacunación de personas;\nV. La vacunación de animales;\nVI. La destrucción o control de insectos y otra fauna transmisora y nociva;\nVII. La suspensión de trabajos o servicios;\nVIII. El aseguramiento o destrucción de objetos, productos o substancias;\nIX. La desocupación o desalojo de casas, edificios, establecimientos y, en general, de cualquier predio;\nX. La prohibición de actos de uso, y\nXI. Las demás de índole sanitaria que determinen las autoridades sanitarias del Estado, que puedan evitar que se causen o continúen causando riesgos o daños a la salud.\nSon de inmediata ejecución las medidas de seguridad señaladas en el presente artículo.\nArtículo 276. Se entiende por aislamiento, la separación de personas infectadas, durante el período de transmisibilidad, en lugares y condiciones que eviten el peligro de contagio. El aislamiento se ordenará por escrito, por la autoridad sanitaria competente, previo dictamen médico y durará el tiempo estrictamente necesario para que desaparezca el peligro.\nArtículo 277. Se entiende por cuarentena la limitación a la libertad de tránsito de personas sanas que hubieren estado expuestas a una enfermedad transmisible, por el tiempo estrictamente necesario para controlar el riesgo de contagio. La cuarentena se ordenará por escrito, por la autoridad sanitaria competente, previo dictamen médico y consistirá en que las personas expuestas no abandonen determinado sitio o se restrinja su asistencia a determinados lugares.\nArtículo 278. La observación personal consiste en la estrecha supervisión sanitaria de los presuntos portadores, sin limitar su libertad de tránsito, con el fin de facilitar la rápida identificación de la infección o enfermedad transmisible.\nArtículo 279. La autoridad sanitaria competente ordenará la vacunación de personas expuestas a contraer enfermedades transmisibles, en los siguientes casos:\nI. Cuando no hayan sido vacunados contra la tosferina, la difteria, el tétanos, la tuberculosis, la poliomielitis, el sarampión y demás enfermedades transmisibles cuya vacunación se estime obligatoria;\nII. En caso de epidemia grave, y\nIII. Si existiere peligro de invasión de dichos padecimientos en el Estado.\nArtículo 280. El Gobierno del Estado podrá ordenar o proceder a la vacunación de animales que puedan constituirse en transmisores de enfermedades al hombre o que pongan en riesgo su salud, en coordinación, en su caso, con las dependencias encargadas de la sanidad animal.\nArtículo 281. La Secretaría de Salud del Estado y los Ayuntamientos en el ámbito de su respectiva competencia, ejecutarán las medidas para la destrucción y control de insectos u otra fauna transmisora y nociva, cuando éstos constituyan un peligro grave para la salud de las personas.\nEn todo caso, se dará a las dependencias encargadas de la sanidad animal la intervención que corresponda.\nArtículo 282. La Secretaría de Salud del Estado y los Ayuntamientos en el ámbito de su respectiva competencia podrán ordenar la inmediata suspensión de trabajos o de servicios o la prohibición de actos de uso, cuando, de continuar aquellos, se ponga en peligro la salud de las personas.\nArtículo 283. La suspensión de trabajos o servicios será temporal. Podrá ser total o parcial y se aplicará por el tiempo estrictamente necesario para corregir las irregularidades que pongan en peligro la salud de las personas. Se ejecutarán las acciones necesarias que permitan asegurar la referida suspensión. Esta será levantada a instancias del interesado o por la propia autoridad que la ordenó, cuando cese la causa por la cual fue decretada.\nDurante la suspensión se podrá permitir el acceso de las personas que tengan encomendada la corrección de las irregularidades que la motivaron.\nArtículo 284. El aseguramiento de objetos, productos o sustancias, tendrá lugar cuando se presuma que pueden ser nocivos para la salud de las personas o carezcan de los requisitos esenciales que se establezcan en las disposiciones legales aplicables. La Secretaría de Salud del Estado y los municipios podrán retenerlos o dejarlos en depósito hasta en tanto se determine, previo dictamen, su destino. establecidos en esta Ley y demás disposiciones generales aplicables, la autoridad sanitaria concederá al interesado un plazo hasta de treinta días para que tramiten el cumplimiento de los requisitos omitidos. Si acreditando el cumplimiento de lo ordenado por la autoridad sanitaria, se entenderá que la materia del aprovechamiento lícito.\nSi del dictamen resultara que el bien asegurado es nocivo, la autoridad sanitaria, dentro del plazo establecido en el anterior párrafo y previa la observancia de la garantía de audiencia, podrá determinar posible su legal aprovechamiento, de ser posible, en cuyo caso y previo el dictamen de la autoridad sanitaria, el interesado podrá disponer de los bienes que haya sometido a tratamiento para destinarlos a los fines que la propia autoridad le señale.\nLos productos perecederos asegurados que se descompongan en poder de la autoridad sanitaria, así como los objetos, productos o sustancias que se encuentren en evidente estado de descomposición, adulteración o contaminación que no los hagan aptos para su consumo, serán destruidos de inmediato por la autoridad sanitaria, la que levantará un acta circunstanciada de la destrucción.\nLos productos perecederos que no se reclamen por los interesados dentro de las veinticuatro horas de que hayan sido asegurados quedarán a disposición sanitaria la que los entregará para su aprovechamiento, de preferencia, a instituciones de asistencia social, públicas o privadas.\nArtículo 285. La desocupación o desalojo de casas, edificios, establecimientos y, en general, de cualquier predio, se ordenará, previa la observancia de la garantía de audiencia y de dictamen pericial, cuando, a juicio de las autoridades sanitarias, se considere que es indispensable para evitar un daño grave a la salud o la vida de las personas.\nCAPITULO II\nSANCIONES ADMINISTRATIVAS\nArtículo 286. Las violaciones a los preceptos de esta Ley, sus reglamentos y demás disposiciones que emanen de ella, serán sancionadas administrativamente por las autoridades sanitarias competentes, sin perjuicio de las penas que correspondan cuando sean constitutivos de delitos.\nArtículo 287. Las sanciones administrativas podrán ser:\nI. Amonestación con apercibimiento;\nII. Multa;\nIII. Clausura temporal o definitiva, que podrá ser parcial o total, y\nIV. Arresto hasta por treinta y seis horas.\nArtículo 288. Al imponerse una sanción, se fundará y motivará la resolución, tomando en cuenta:\nI. Los daños que se hayan producido o puedan producirse en la salud de las personas;\nII. La gravedad de la infracción;\nIII. Las condiciones socio-económicas del infractor, y\nIV. La calidad de reincidente del infractor.\nArtículo 289. Se sancionará con multa equivalente hasta de veinte veces el salario mínimo general diario vigente en la zona económica de que se trate, la violación de las disposiciones contenidas en los\nArtículos 48, 49, 74, 109, 110, 111, 123, 164, 165, 169, 171, 172, 173, 174, 178, 181, 187, 193, 194, 195, 197, 209, 241, 259 y 260.\nLa violación de la disposición contenida en el Artículo 89 de esta Ley, se sancionará con multa trate.\nArtículo 290. Se sancionará con multa equivalente de diez hasta cien veces el salario mínimo general diario vigente en la zona económica de que se trate, la violación a las disposiciones contenidas en los\nArtículos 101, 113, 119, 177, 180, 184, 203, 207, 223, 226 y 238 de esta Ley.\nLa violación de las disposiciones contenidas en los Artículos 267 y 282 de esta Ley, se sancionará con económica de que se trate.\nArtículo 291. Se sancionará con multa equivalente de doscientas a dos mil veces el salario mínimo general diario vigente en la zona económica de que se trate. La violación a las disposiciones contenidas en los Artículos 62, 87, 88 y 102, de esta Ley.\nArtículo 292. Las infracciones no previstas en este capítulo serán sancionadas con multa hasta por quinientas veces el salario mínimo general diario vigente, en la zona económica de que se trate, atendiendo a las reglas de calificación que se establecen en el Artículo 288 de esta Ley.\nArtículo 293. En caso de reincidencia se duplicará el monto de la multa que corresponda. Para los efectos de este capítulo se entiende por reincidencia, que el infractor cometa la misma violación a las disposiciones de esta Ley o sus reglamentos dos o más veces dentro del período de un año, contado a partir de la fecha en que se le hubiera notificado la sanción inmediata anterior.\nArtículo 294. La aplicación de las multas serán sin perjuicio de que se dicten las medidas de seguridad sanitaria que procedan, hasta en tanto se subsanen las irregularidades.\nArtículo 295. Procederá la clausura temporal o definitiva, parcial o total según la gravedad de la infracción y las características de la actividad o establecimiento, en los siguientes casos:\nI. Cuando los establecimientos a que se refiere el Artículo 161 no reúnan los requisitos sanitarios que establece esta Ley, las demás disposiciones reglamentarias aplicables y las normas técnicas correspondientes:\nII. Cuando el peligro para la salud de las personas se origine por la violación reiterada de los preceptos de esta Ley y de las disposiciones que de ella emanen, constituyendo rebeldía a cumplir los requerimientos y disposiciones de la autoridad sanitaria;\nIII. Cuando después de la reapertura de un establecimiento, local, fábrica, construcción o edificio, por motivo de suspensión de trabajos o actividades, o clausura temporal, las actividades que en él se realicen sigan constituyendo un peligro para la salud, y\nIV. Cuando por la peligrosidad de las actividades que se realicen o por la naturaleza del establecimiento, local, fábrica, construcción o edificio de que se trate, sea necesario proteger la salud de la población.\nArtículo 296. En los casos de clausura definitiva quedarán sin efecto las autorizaciones que, en su caso, se hubieren otorgado al establecimiento, local, fábrica o edificio de que se trate.\nArtículo 297. Se sancionará con arresto hasta por treinta y seis horas:\nI. A la persona que interfiera o se oponga al ejercicio de las funciones de la autoridad sanitaria, y\nII. A la persona que en rebeldía se niegue a cumplir los requerimientos y disposiciones de la autoridad sanitaria, provocando con ello un peligro a la salud de las personas.\nSólo procederá esta sanción, si previamente se dictó cualquiera otra de las sanciones a que se refiere este capítulo.\nImpuesto el arresto, se comunicará la resolución a la autoridad correspondiente para que la ejecute.\nCAPITULO III\nArtículo 298. Para los efectos de esta Ley, el ejercicio de las facultades discrecionales por parte del\nI. Se fundará y motivará en los términos de los Artículos 14 y 16 de la Constitución Política de los Estados\nII. Se tomará en cuenta las necesidades sociales y estatales, y en general los derechos e intereses de la sociedad;\nIII. Se considerarán los precedentes que se hayan dado en el ejercicio de las facultades específicas que van a ser usadas, así como la experiencia acumulada a ese respecto;\nIV. Los demás que establezca el superior jerárquico, tendientes a la predictibilidad de la resolución de los funcionarios, y\nV. La resolución que se adopte se hará saber por escrito al interesado dentro del plazo que marca la Ley, para el caso de que no exista éste, dentro de un plazo no mayor de cuatro meses contados a partir de la recepción de la solicitud del particular.\nArtículo 299. La definición, observancia e instrucción de los procedimientos que se establecen en esta\nLey se sujetarán a los siguientes principios jurídicos y administrativos:\nI. Legalidad;\nII. Imparcialidad;\nIII. Eficacia;\nIV. Economía;\nV. Providad;\nVI. Participación;\nVII. Publicidad;\nVIII. Coordinación;\nIX. Eficiencia;\nX. Jerarquía, y\nXI. Buena fe.\nArtículo 300. La Secretaría de Salud del Estado y los municipios, con base en los resultados de la visita de verificación a que se refiere el Artículo 264 de esta Ley podrán dictar las medidas para corregir las\nArtículo 40, apartado \"A\", así como los establecimientos y servicios a que se refiere el apartado \"B\" del mismo Artículo de esta Ley, notificándolas al interesado y dándole un plazo adecuado para su realización.\nArtículo 301. Las autoridades sanitarias competentes harán uso de las medidas legales necesarias, incluyendo el auxilio de la fuerza pública, para lograr la ejecución de las sanciones y medidas de seguridad que procedan.\nArtículo 302. Derivado de las irregularidades sanitarias que reporte el acta de verificación, la autoridad sanitaria competente citará al interesado personalmente o por correo certificado con acuse de recibo, asentados en el acta de verificación.\nArtículo 303. El cómputo de los plazos que señale la autoridad sanitaria competente para el cumplimiento de sus disposiciones sanitarias, se hará entendiendo los días como naturales, con las excepciones que esta Ley establezca.\nArtículo 304. Una vez oído al presunto infractor o a su representante legal y desahogadas las pruebas que ofreciere y fueren admitidas, se procederá dentro de los cinco días hábiles siguientes, a dictar, por escrito, la resolución que proceda, la cual será notificada en forma personal o por correo certificado con acuse de recibo al interesado o a su representante legal.\nArtículo 305. En caso de que el presunto infractor no compareciera dentro del plazo fijado por el Artículo\n302 se procederá a dictar, en rebeldía, la resolución definitiva y a notificarla personalmente o por correo certificado con acuse de recibo.\nArtículo 306. En los casos de suspensión de trabajos o de servicios o de clausura temporal o definitiva, parcial o total, el personal comisionado para su ejecución procederá a levantar acta detallada de la diligencia, siguiendo para ello los lineamientos generales establecidos para las verificaciones.\nArtículo 307. Cuando del contenido de un acta de verificación se desprenda la posible comisión de uno o varios delitos, la autoridad sanitaria competente formulará la denuncia correspondiente ante el Ministerio\nPúblico, sin perjuicio de la aplicación de la sanción administrativa que proceda.\nCAPITULO IV\nRECURSOS DE INCONFORMIDAD\nArtículo 308. Contra actos y resoluciones que dicten las autoridades sanitarias del Estado que con motivo de la aplicación de esta Ley den fin a una instancia o resuelvan un expediente, los interesados podrán interponer el recurso de inconformidad.\nArtículo 309. El plazo para interponer el recurso será de quince días hábiles, contados a partir del día siguiente a aquél en que se hubiere notificado la resolución o acto que se recurra.\nArtículo 310. El recurso se interpondrá ante la unidad administrativa que hubiere dictado la resolución o acto combatido, directamente o por correo certificado, con acuse de recibo. En este último caso, se tendrá como fecha de presentación la del día de su depósito en la oficina de correos.\nArtículo 311. En el escrito se precisará el nombre y domicilio de quien promueva, los hechos objetos del recurso, la fecha en que, bajo protesta de decir verdad, manifieste el recurrente que tuvo conocimiento de la resolución o acto impugnado, los agravios que, a juicio del recurrente, le cause la resolución o acto impugnado, la mención de la autoridad que haya dictado la resolución, ordenado o ejecutado el acto y el ofrecimiento de las pruebas que el inconforme se proponga rendir.\nAl escrito deberán acompañarse los siguientes documentos:\nI. Los que acrediten la personalidad del promovente, siempre que no sea el directamente afectado y competente, en la instancia o expediente que concluyó con la resolución impugnada;\nII. Los documentos que el recurrente ofrezca como pruebas y que tengan relación inmediata y directa con la resolución o acto impugnado, y\nIII. Original de la resolución impugnada, en su caso.\nArtículo 312. En la tramitación del recurso se admitirá toda clase de medios probatorios, excepto la confesional.\nArtículo 313. Al recibir el recurso, la unidad respectiva verificará si éste es procedente, y si fue interpuesto en tiempo debe admitirlo o, en su caso, requerirá al promovente para que lo aclare, concediéndole al efecto un término de cinco días hábiles.\nEn el caso que la unidad citada considere, previo estudio de los antecedentes respectivos, que procede su desechamiento, emitirá opinión técnica en tal sentido.\nArtículo 314. En la substanciación del recurso sólo procederán las pruebas que se hayan ofrecido en la instancia o expediente que concluyó con la resolución o acto impugnado y las supervenientes.\nLas pruebas ofrecidas que procedan se admitirán por el área competente que deba continuar el trámite del recurso y para su desahogo, en su caso, se dispondrá de un término de treinta días hábiles contados a partir de la fecha en que hayan sido admitidas.\nArtículo 315. En el caso de que el recurso fuere admitido, la unidad respectiva, sin resolver en lo relativo a la admisión de las pruebas que se ofrezcan, emitirá una opinión técnica del asunto dentro de un plazo de treinta días hábiles contados a partir del auto admisorio, y de inmediato remitirá el recurso y el expediente que contenga los antecedentes del caso, al área competente de la autoridad sanitaria que corresponda y que debe continuar el trámite del recurso.\nEl titular del poder ejecutivo, en su caso los Ayuntamientos, resolverán los recursos que se interpongan con base en esta Ley. Esta facultad podrá ser delegada en acuerdo que se publique en el Periódico\nOficial del Gobierno del Estado.\nArtículo 316. El titular del Poder Ejecutivo del Estado y los titulares de los Ayuntamientos, en el ámbito de su competencia, resolverá los recursos que se interpongan de conformidad con esta Ley, y al efecto, podrá confirmar, modificar o revocar el acto o resolución que se haya combatido.\nDichas autoridades, en uso de las facultades que les confiere la legislación aplicable, podrán delegar dicha atribución, debiéndose publicar el acuerdo respectivo en el Periódico Oficial del Gobierno del\nEstado.\nArtículo 317. A solicitud de los particulares que se consideren afectados por alguna resolución o acto de las autoridades sanitarias, éstas los orientarán sobre el derecho que tienen de recurrir la resolución o acto de que se trate, y sobre la tramitación del recurso.\nArtículo 318. La interposición del recurso suspenderá la ejecución de las sanciones pecuniarias, si el infractor garantiza el interés fiscal.\nTratándose de otro tipo de actos o resoluciones, la interposición del recurso suspenderá su ejecución, siempre y cuando se satisfagan los siguientes requisitos:\nI. Que lo solicite el recurrente;\nII. Que no se siga perjuicio al interés social, ni se contravengan disposiciones de orden público, y\nIII. Que fueren de difícil reparación los daños y perjuicios que se causen al recurrente, con la ejecución del acto o resolución combatida.\nArtículo 319. En la tramitación del recurso de inconformidad, se aplicará supletoriamente el Código de\nProcedimientos Civiles del Estado.\nCAPITULO V\nPRESCRIPCION\nArtículo 320. El ejercicio de la facultad para imponer las sanciones administrativas previstas en la presente Ley, prescribirá en el término de cinco años.\nArtículo 321. Los términos para la prescripción serán continuos y se contarán desde el día en que se cometió la falta o infracción administrativa, si fuere consumada, o desde que cesó, si fuere continua.\nArtículo 322. Cuando el presunto infractor impugnare los actos de la autoridad sanitaria competente, se interrumpirá la prescripción, hasta en tanto la resolución definitiva que se dicte no admita ulterior recurso.\nArtículo 323. Los interesados podrán hacer valer la prescripción, por vía de excepción. La autoridad deberá declararla de oficio.\nTRANSITORIOS\nArtículo Primero. Se abroga la Ley Estatal de Salud de Coahuila, publicada en el Periódico Oficial del\nGobierno del Estado de Coahuila, el 8 de septiembre de 1987.\nArtículo Segundo. En tanto se expidan las disposiciones administrativas derivadas de esta Ley, seguirán en vigor las que rigen actualmente, en lo que no la contravengan, y su referencia a la Ley Estatal de\nSalud que se abroga, se entienden hechas en lo aplicable a la presente Ley.\nArtículo Tercero. Todos los actos, procedimientos y recursos administrativos relacionados con la materia de esta Ley, que se hubieren iniciado bajo la vigencia de la misma que se abroga, se tramitarán y resolverán conforme a las disposiciones de la citada Ley.\nArtículo Cuarto. Se derogan todas las disposiciones que se opongan a la presente Ley.\nArtículo Quinto. Los Servicios Coordinados de Salud Pública en el Estado, prestarán los servicios y ejercerán las funciones de autoridad sanitaria en materia de Salubridad Local, hasta en tanto no se diecisiete días del mes de junio de mil novecientos noventa y tres.\nDIPUTADA PRESIDENTA\nLAURA ELIA DELGADO DE LA FUENTE\nDIPUTADO SECRETARIO DIPUTADO SECRETARIO\nIMPRIMASE, COMUNIQUESE Y OBSERVESE\nEL GOBERNADOR DEL ESTADO\nLIC. ELISEO FRANCISCO MENDOZA BERRUETO\nEL SECRETARIO DE GOBIERNO\nLIC. FELIPE GONZALEZ RODRIGUEZ\nEL SECRETARIO DE SALUD\nDR. RAYMUNDO VERDUZCO ROSAN\nN. DE E. A CONTINUACION SE TRANSCRIBEN LOS ARTICULOS TRANSITORIOS DE LOS\nDECRETOS DE REFORMAS A LA PRESENTE LEY.\nARTICULO UNICO.- La presente reforma entrará en vigor el día siguiente al que se publique en el\nPeriódico Oficial del Estado.\nPRIMERO. El presente decreto entrará en vigor el día siguiente al de su publicación en el Periódico\nSEGUNDO. Se derogan todas las disposiciones que se opongan a este decreto.",
  "ordenamiento": "REGLAMENTO",
  "jurisdiccion": "COAHUILA",
  "fuente_oficial": "DIARIO OFICIAL DE LA FEDERACION",
  "Fecha de Publicación": "30 de julio de 1993",
  "ULTIMA REFORMA PUBLICADA": "15 DE FEBRERO DE 2005",
  "es_escaneado": false,
  "tiene_tablas": false,
  "materia": [
    "salud"
  ]
}