{
  "titulo": "Ley de Prevención, Asistencia y Atención de la Violencia Familiar",
  "Contenido": "LEY DE PREVENCION, ASISTENCIA Y ATENCION DE LA VIOLENCIA FAMILIAR\nEL C. ENRIQUE MARTÍNEZ Y MARTÍNEZ, GOBERNADOR CONSTITUCIONAL DEL ESTADO\nINDEPENDIENTE, LIBRE Y SOBERANO DE COAHUILA DE ZARAGOZA, A SUS HABITANTES\nSABED:\nQUE EL CONGRESO DEL ESTADO, INDEPENDIENTE, LIBRE Y SOBERANO DE COAHUILA DE\nZARAGOZA;\nDECRETA:\nNUMERO 253.LEY DE PREVENCION, ASISTENCIA Y ATENCION DE LA VIOLENCIA FAMILIAR\nTITULO PRIMERO\nNORMAS PRELIMINARES\nCAPITULO I\nDISPOSICIONES GENERALES\nArtículo 1. La unidad familiar, la equidad de género, la igualdad de derechos y deberes de los cónyuges o de la pareja, de las hijas y de los hijos, la protección de las y los menores de edad, de las mujeres, de las personas con capacidades diferentes y de las personas de la tercera edad, constituyen principios fundamentales para la aplicación e interpretación de esta ley.\nArtículo 2. El Estado y sus autoridades están obligadas a garantizar el respeto a los derechos humanos las niñas, de los niños, de las mujeres, de las personas con capacidades diferentes y de las personas de la tercera edad; así como a asegurarles oportunidades para su desarrollo físico, mental, ético, social y económico, en condiciones de libertad, respeto y dignidad, sin discriminación alguna por razón de género, convicciones políticas o religiosas, y situación socio económica.\nLos bienes jurídicos tutelados por la presente ley son: la integridad, la preservación y el desarrollo de la salud física y mental de las mujeres, las niñas, los niños y en general de quienes integran la familia, sustrato de la sociedad.\nArtículo 3. Las disposiciones contenidas en la presente ley son de orden público e interés social, y tienen\nEstado, instituciones y procedimientos, para la atención de personas receptoras y generadoras de violencia; su prevención y sanción, con el fin de erradicar la violencia familiar en el Estado. integrantes a efecto de que no sean restringidos de una manera arbitraria, ni se lesione su esencia por la coexistencia con otros derechos y deberes, salvo que se trate del interés superior de alguno de sus miembros.\nArtículo 5. La atención especializada que se proporcione en materia de violencia familiar por cualquier institución, ya sea pública o privada, no contará entre sus criterios con patrones estereotipados de comportamiento, ni prácticas sociales y culturales basadas en conceptos discriminatorios o de subordinación.\nArtículo 6. La aplicación de esta Ley en el ámbito de sus respectivas competencias:\na) La Secretaría de Gobierno.\nb) La Secretaría de Educación.\nc) La Secretaría de Salud.\nd) La Secretaría de Desarrollo Social.\n(REFORMADO, P.O. 15 DE ENERO DE 2008)\ne) La Secretaría de Seguridad Pública.\nf) La Procuraduría General de Justicia del Estado.\ng) El Sistema para el Desarrollo Integral de la Familia.\nh) La Procuraduría de la Familia.\ni) El Instituto Coahuilense de las Mujeres.\nII. Al Congreso del Estado a través de la Comisión de Equidad y Género.\nIII. Al Poder Judicial a través de:\na) El Pleno\nb) La Sala Civil y de lo Familiar.\nc) Los Tribunales Unitarios.\nd) Los Jueces de Primera Instancia en Materia Familiar.\nIV. A los Ayuntamientos\nArtículo 7. Para los efectos de esta ley, la Procuraduría de la Familia, las Delegaciones de la misma y las Unidades de Atención, podrán actuar con el carácter de Autoridades para decretar custodias de emergencia; separaciones provisionales o preventivas del seno familiar; medidas de apremio; cauciones de no ofender con cargo a las personas generadoras de violencia familiar; prohibición para ir a lugar determinado o residir en él; imponer sanciones administrativas y en los demás casos en que la ley les autorice.\nArtículo 8. Las personas particulares, las autoridades administrativas y judiciales y en especial las corporaciones policíacas, cualquiera que sea su denominación o categoría, deberán prestar su cooperación para el cumplimiento de las disposiciones de esta ley.\nCAPITULO II\nDEFINICIONES Y PRINCIPIOS BASICOS\nArtículo 9. Para los efectos de esta ley, por cuanto a los órganos encargados de su aplicación, se entiende por:\nI. “Administración Pública”: La administración pública del Estado y la de los Municipios.\nII. “Consejo Estatal”: El Consejo Estatal para la Prevención, Asistencia y Atención de la Violencia\nFamiliar en el Estado.\nIII. “Junta Directiva”: La Junta Directiva para la Prevención, Asistencia y Atención de la Violencia\nFamiliar en el Estado.\nIV. “Consejos Regionales”: Los órganos político administrativos establecidos en las diferentes regiones del Estado, para la prevención, asistencia y atención de la violencia familiar.\nV. “Unidades de Atención”: Las instancias, de la administración pública establecidas en las cabeceras municipales, encargadas de prevenir la violencia, asistir y atender a las personas receptoras y generadoras de violencia familiar, en los términos que establezca el programa general.\nTendrán a su cargo la dirección de los procedimientos de mediación, conciliatorios y amigable composición, así como la ejecución, en su caso, de las medidas requeridas para hacer cesar y erradicar la violencia familiar.\nVI. “DIF”: El Sistema para el Desarrollo Integral de la Familia.\nVII. “Procuraduría”: La Procuraduría de la Familia.\nVIII. “Organizaciones sociales”: Las Instituciones legalmente constituidas, que se ocupen de la materia de esta ley y que se hayan distinguido por su labor.\nArtículo 10. En orden a los sujetos y supuestos de aplicación de esta ley, se entiende por:\nI. “ Persona Receptora de la violencia familiar”: La persona o grupo de personas que sufren el maltrato físico, verbal, psicoemocional, sexual o económico en su esfera biopsicosexual o patrimonial.\nII. “Persona Generadora de la violencia familiar”: Quienes realizan actos de maltrato físico, verbal, psicoemocional, sexual, por negligencia o económico, hacia las personas con las que tengan o hayan tenido algún vínculo familiar; se hallen bajo su guarda o custodia o mantengan relaciones de hecho similares a las que se originan con motivo del matrimonio o en el seno familiar.\nIII. “Violencia familiar”: Aquel acto de poder u omisión intencional, dirigido a dominar, someter, controlar o agredir física, verbal, psicoemocional, por negligencia, económica ó sexualmente a cualquier miembro de la familia, que tenga relación de parentesco por consanguinidad, tenga o lo haya tenido por afinidad o civil, o se halle en unión libre, de hecho o concubinato; realizado dentro o fuera del domicilio familiar, y que tenga por efecto causar daño, en cualquiera de las siguientes modalidades:\na) “Maltrato físico”: Todo acto de agresión intencional, en el que se utilice alguna parte del cuerpo, algún objeto, arma o sustancia para sujetar, inmovilizar o causar daño a la integridad de la otra persona, encaminado hacia su sometimiento y control, provocándole cualquier alteración en su salud física o mental.\nb) “Maltrato psicoemocional”: Todo acto u omisión, consistente en cualquier clase de prohibiciones, condicionamientos, coacciones, intimidaciones, amenazas, actitudes devaluatorias o de abandono, que provoquen en quien las recibe, deterioro, disminución de la autoestima o devaluación del autoconcepto. un menor de edad, será considerado maltrato emocional en los términos de este artículo, aunque se argumente como justificación su educación o formación.\nc) “Maltrato sexual”: Todo acto y omisión que provoque burla y humillación de la sexualidad; niegue las necesidades sexoafectivas; induzca coactivamente a la realización de actos o prácticas sexuales no deseadas o que generen dolor; o se practique la celotipia como medio de control, manipulación o dominio de la persona, generando un daño; así como los delitos contra la libertad y el normal desarrollo psicosexual a que se refiere el Código Penal del Estado, respecto a los cuales la presente ley solo surte efectos en el ámbito de la prevención, de la atención y de la asistencia.\nd) “Maltrato verbal”: Toda expresión, concreta, intencional y reiterada, que indique el propósito de ofender o manifestar desprecio al otro y que haga imposible la vida en familia.\ne) “Maltrato por negligencia”: Toda conducta omisiva consistente en faltar gravemente a los deberes de proveer adecuadamente al sustento, al vestido, a la vivienda, a la educación o a la atención de la salud a los que tienen derecho quienes integran una familia, que por su edad, capacidad o particular condición, se encuentren en situación de dependencia.\nf) “Afectación económica o patrimonial”: Todo acto u omisión que genere daño, destrucción, deterioro, sustracción o retención de bienes muebles o inmuebles, propiedad de la víctima o destinados a la satisfacción de necesidades familiares.\nArtículo 11. Para los efectos de esta ley, respecto a las medidas, instancias y procedimientos, se entiende por:\nI. “Prevención”: Las medidas tendientes a evitar que se produzca la violencia en cualquiera de sus modalidades, entre las personas que tengan algún vínculo o parentesco familiar.\nII. “Asistencia”: Los servicios de apoyo y protección adecuados, proporcionados a quienes son sujetos de violencia familiar.\nIII. “Atención”: Los servicios médicos, pedagógicos, psicológicos y jurídicos que se brindan con el fin de promover, proteger y restaurar la salud física y mental de las y los receptores de la violencia familiar, así como de quienes la generan.\nIV. “Promoción de la equidad y la igualdad entre los géneros”: Todas aquellas acciones encaminadas a eliminar cualquier forma de discriminación contra las mujeres, así como a fortalecer relaciones equitativas entre los hombres y las mujeres.\nV. “Sujeto de informe”: Las dependencias o personas obligadas a informar de todos aquellos casos donde exista, se sospeche que exista una situación de violencia familiar.\nVI. “Custodia de emergencia”: La que se ejerce en situaciones excepcionales, determinadas por la gravedad del suceso, dentro de un hospital u otra instalación médica o lugar previamente designado para esta custodia por el Ministerio Público, o por alguna dependencia de la\nProcuraduría de la Familia, sujeta a posterior revisión por un Juez Familiar o por un Consejo\nTutelar.\nVII. “Custodia legal”: La que tiene el padre y la madre en virtud del ejercicio de la patria potestad, los ascendientes de uno u otra, o la otorgada por un tribunal competente.\nVIII. “Separación provisional o preventiva del seno familiar”: La decretada por el Procurador de la\nFamilia o por sus Delegados, tratándose de mujeres, menores de edad, personas con capacidades diferentes y de la tercera edad, que sufran maltrato físico, mental, psicoemocional, verbal, por negligencia económico, incluyendo el abuso sexual en los términos de esta ley.\nIX. “Esfuerzos razonables”: Los dirigidos a evitar la remoción de las personas receptoras de la violencia de su hogar, siempre que ello sea posible en orden a su seguridad, dignidad, y respeto a sus derechos.\nX. “Mejor interés del receptor de violencia familiar”: Toda determinación dirigida a garantizar la seguridad, salud y el bienestar físico, mental, emocional y educacional de la víctima, así como proveerle de un ambiente seguro y estable.\nXI. “Servicios de protección”: Los servicios sociales, públicos o privados, de consejería, albergue, asistencia legal y atención psicoterapéutica y médica.\nXII. “Mediación”: Procedimiento no adversarial, informal, voluntario, confidencial, que se sigue ante un tercero neutral, en el cual las partes adoptan sus propias decisiones sobre la solución de sus conflictos familiares, en atención a sus propuestas e intereses, mediante la suscripción de los acuerdos adoptados.\nXIII. “Conciliación”: El arreglo amistoso de un conflicto familiar por las partes, a su propia iniciativa, mediante la conducción de un conciliador que limitará su intervención a la propuesta de alternativas de solución y a la formulación, en su caso, del convenio que le ponga fin al conflicto.\nXIV. “Amigable composición”: El arreglo de un conflicto de intereses entre las partes, provocado por actos de violencia familiar, mediante la intervención de un tercero amigable componedor, a través de procedimientos sencillos, sin sujeción estricta a normas de derecho, y mediante una decisión fundada en la equidad y en la confianza.\nXV. “Procedimientos en casos de violencia familiar”: Los de mediación, conciliación y amigable composición, que se instruyen por las Unidades de Atención.\nXVI. “Procesos en casos de violencia familiar”: El que se tramita ante un Juez de Primera Instancia en materia Familiar, en los términos previstos por Código Procesal Civil para el Estado.\nXVII. “Sanciones”: Las que aplica la Procuraduría de la Familia, sus delegaciones y las unidades de atención, por las infracciones previstas en esta ley.\nXVIII. “Caución de no ofender”: Medida impuesta a una persona por las autoridades a que se refiere la fracción anterior, para prevenir que pueda incurrir en nuevos hechos de violencia familiar.\nXIX. “Ley”: La Ley de Prevención, Asistencia y Atención de la Violencia Familiar.\nTITULO SEGUNDO\nDE LA COORDINACION DE LAS ACCIONES\nPUBLICAS Y PRIVADAS\nCAPITULO I\nDE LA COORDINACION INTERINSTITUCIONAL\nArtículo 12. Se crea el Consejo para la Prevención, Asistencia y Atención de la Violencia Familiar en el\nEstado, como órgano honorario de planeación, apoyo y evaluación.\nEl Consejo estará integrado por:\nI. Una Presidencia colegiada, conformada por los representantes de los Poderes Ejecutivo, Legislativo y Judicial.\nII. Una Vicepresidencia, con cargo a la persona que se desempeñe en la Presidencia de los\nPatronatos del Sistema para el Desarrollo Integral de la Familia y Voluntariado Coahuila.\nIII. Seis vocalías a cargo de las y los titulares de las siguientes dependencias del Ejecutivo:\na) Secretaría de Gobierno.\nb) Secretaría de Educación.\nc) Secretaría de Salud.\nd) Secretaría de Desarrollo Social.\n(REFORMADA, P.O. 15 DE ENERO DE 2008)\ne) Secretaría de Seguridad Pública.\nf) Procuraduría General de Justicia.\nIV. Dos vocalías del Poder Legislativo cubiertas por integrantes de la Comisión de Equidad y Género.\nV. Un vocalía a cargo de la Directora del Instituto Coahuilense de las Mujeres.\nVI. Un vocalía, a cargo de quien presida la Comisión de Derechos Humanos en el Estado.\nVII. Cuatro vocalías que serán cubiertas por Presidentes Municipales, representantes de los\nRepublicanos Ayuntamientos del Estado, invitados anualmente por el Gobernador del Estado.\nVIII. Tres vocalías, a cargo de representantes de los organismos sociales que se hayan destacado por su trabajo y estudio en la materia de violencia familiar, invitados anualmente mediante convocatoria del Ejecutivo del Estado.\nEl Consejo deberá celebrar por lo menos dos sesiones semestrales en el año, de preferencia, en las fechas más próximas a su inicio y conclusión, y será convocado por el Titular del Poder Ejecutivo, por conducto de la Secretaría de Gobierno\nArtículo 13. Se crea la Junta Directiva para la Prevención, Asistencia y Atención de la Violencia Familiar en el Estado, como órgano honorario, de apoyo y operativo.\nLa Junta Directiva estará integrada por:\nI. Una Presidencia colegiada, conformada por quien funja como titular de la Dirección del Sistema para el Desarrollo Integral de la Familia; por la persona que presida la Comisión de Equidad y\nGénero y por quien presida la Sala Civil y Familiar del Tribunal Superior de Justicia del Estado.\nII. Seis vocalías, de las dependencias del Ejecutivo del Estado, nombrados por los titulares que se mencionan en la fracción III del artículo anterior, de entre quienes tengan un nivel jerárquico inmediato inferior a ellos.\nIII. Tres vocalías, una del Instituto Coahuilense de las Mujeres por designación de su Directora y dos de las organizaciones sociales a que alude la fracción VIII del artículo anterior, seleccionados por ellas, de entre sus miembros.\nIV. Una Secretaría Ejecutiva, ejercida por quien tenga la titularidad de la Procuraduría de la Familia.\nLa Junta Directiva deberá reunirse mensualmente y cuantas veces sea indispensable, para atender los asuntos que se programen en el orden del día. La convocatoria será remitida por conducto de la\nProcuraduría de la Familia.\nArtículo 14. Se crean cinco Consejos Regionales para la Prevención, Asistencia y Atención de la\nViolencia Familiar:\nI. Uno con residencia en la ciudad de Saltillo, que comprenderá los Distritos Judiciales de Saltillo y\nParras.\nII. Uno con residencia en la ciudad de Torreón, que abarcará los Distritos Judiciales de Viesca y San\nPedro.\nIII. Uno con residencia en Monclova, que comprenderá el Distrito Judicial de Monclova.\nIV. Uno con residencia en Sabinas, que ejercerá sus funciones en el Distrito Judicial de Sabinas.\nV. Uno con residencia en Piedras Negras, que incluirá los Distritos Judiciales de Río Grande y Acuña.\nEstos Consejos Regionales tendrán las mismas características del Consejo Estatal; estarán presididos por las y los Delegados de la Procuraduría de la Familia e integrados por representantes de las dependencias del Poder Ejecutivo que se mencionan en el artículo 12 de esta Ley, designados por sus titulares, de entre quienes presten servicios en las regiones correspondientes; por el Síndico del\nAyuntamiento en el que tiene su residencia el Consejo; a invitación, por dos Síndicos de los\nAyuntamientos de los Municipios de la región respectiva, según se ubiquen geográficamente los temas que se aborden; así como tres representantes del sector no gubernamental, seleccionados de entre las organizaciones que atiendan en la región situaciones que se relacionen con la materia de esta Ley.\nLos Consejos Regionales, previa convocatoria de las Delegaciones de la Procuraduría de la Familia, se reunirán una vez al mes para atender los asuntos de su competencia.\nArtículo 15. La Junta Directiva, por conducto de la Procuraduría de la Familia, creará en cada cabecera municipal una o más Unidades de Atención, según sea necesario, para la Prevención, Atención y\nAsistencia de la Violencia Familiar, las que deberán contar con los recursos necesarios para el cumplimiento de sus funciones.\nEstas Unidades estarán presididas por la persona designada para ese efecto y contará con un grupo técnico de expertas y expertos en las áreas: psicoterapéutica, jurídica, clínico-médica y de trabajo social, especialistas en la atención de la violencia familiar.\nLa forma de organización, selección del personal y funciones de las Unidades, se establecerán en el reglamento que formule la Junta Directiva, aprobado por el Consejo Estatal.\nArtículo 16. El Consejo Estatal para la Prevención, Asistencia y Atención de la Violencia Familiar, tendrá las siguientes atribuciones:\nI. Aprobar el Programa General para la Prevención, Asistencia y Atención de la Violencia Familiar en el Estado; así como el presupuesto necesario para su implementación, presentado por la Junta\nDirectiva. dicho Consejo.\nII. Fomentar y fortalecer la coordinación, colaboración e información entre las Instituciones Públicas y\nPrivadas que se ocupan de esta materia.\nIII. Establecer un sistema de comunicación y enlace interdisciplinario que permita a las y los servidores públicos de todos los niveles, mantener comunicación y trabajar en estrecha colaboración para mejorar los servicios de detección, atención, prevención, información y evaluación de la violencia familiar y enfrentarla de manera integral desde cualquier ámbito.\nIV. Analizar y aprobar los lineamientos administrativos y técnicos que permitan afrontar eficazmente la violencia familiar en el Estado, así como los modelos de atención psicoterapéuticos y de salud más adecuados.\nV. Solicitar, por conducto del Presidente del Tribunal Superior de Justicia, que los órganos del Poder\nJudicial competentes analicen las prácticas jurídicas e interpretaciones legales que impidan que se imparta justicia a las personas receptoras de violencia familiar y se resuelvan los problemas que les ocasiona.\nVI. Contar con sistemas de información estadística completos sobre la violencia familiar que incluyan causas, consecuencias, incidencias, etc., que permitan evaluar la eficacia de las medidas y reorientarlas en caso de que fuera necesario.\nVII. Aprobar modelos de comunicación social masivos o por medios electrónicos, que lleven a la exclusión de la violencia como forma de resolver los conflictos familiares.\nVIII. Contribuir a la difusión de la legislación en la que se establecen medidas para evitar la violencia familiar.\nIX. Aprobar indicadores elaborados por las Unidades de Atención que permitan evaluar semestralmente los logros y avances del Programa General.\nArtículo 17. La Junta Directiva, tendrá las siguientes atribuciones:\nI. Ejecutar los acuerdos del Consejo Estatal para la Prevención, Asistencia y Atención de la Violencia\nFamiliar en el Estado.\nII. Contar con un diagnóstico permanente sobre los problemas de violencia familiar en el Estado, que sustente la política, los programas las acciones y el presupuesto aprobado por el Consejo Estatal.\nIII. Llevar cuenta de la información estadística sobre los diferentes aspectos de la violencia familiar, sus causas, consecuencias e incidencias que le proporcione el Procurador, para formular el diagnóstico que sirva de base para la formulación del Programa General.\nIV. Diseñar y poner en marcha una base de datos común a todas las instituciones, que atienda a indicadores de detección uniforme.\nV. Conformar por conducto de la Procuraduría de la Familia, las Unidades de Atención, seleccionando del Reglamento respectivo.\nVI. Coordinar las acciones de concertación, defensa, protección, prevención y atención de la violencia, en particular la que afecta a las mujeres, menores de edad, a las personas con\nVII. Promover programas permanentes de capacitación, con perspectiva de género, para servidoras y servidores públicos encargados de la política de prevención de la violencia familiar, y de la asistencia y atención de las víctimas de esa violencia.\nEn particular, impulsar la capacitación y sensibilizar, con perspectiva de género, a servidoras y servidores públicos de los sectores de salud, educación, desarrollo y asistencia social, para que puedan detectar o percibir problemas de violencia familiar en las personas usuarias de los servicios, e identificar las autoridades a quienes deben canalizarlas, para su atención integral.\nVIII. Dar seguimiento a los programas de combate a la violencia familiar.\nIX. Impulsar programas y modelos de atención que favorezcan el tratamiento integral, remedial, a favor de las personas receptoras de violencia familiar.\nX. Fomentar y apoyar programas educativos para crear conciencia sobre las consecuencias de la violencia familiar, los problemas derivados de ella, los recursos legales con que cuentan las personas receptoras y el resarcimiento de daños y perjuicios que les corresponden.\nXI. Aprobar los indicadores en orden a la propuesta que le proporcione el Procurador de la Familia sobre violencia familiar que hagan posible el seguimiento, la evaluación y la reorientación de programas.\nXII. Formular catálogos de medidas protectoras de carácter urgente, que posibiliten la interrupción de los ciclos de violencia familiar y ponerlos a consideración del Consejo Estatal, para que en su caso, de ser necesario, se efectúen las reformas o adiciones a algún texto legal, mediante la propuesta correspondiente.\nXIII. Alentar a los medios de difusión para que contribuyan en el esfuerzo por erradicar la violencia familiar en el Estado.\nXIV. Las demás que le sean conferidas por el Consejo Estatal para la Prevención, Asistencia y Atención de la Violencia Familiar en el Estado, conforme a la ley.\nArtículo 18. Los Consejos Regionales, tendrán las atribuciones siguientes:\nI. Dar seguimiento a los acuerdos y disposiciones del Consejo Estatal y de la Junta Directiva para la\nPrevención, Asistencia y Atención de la Violencia Familiar.\nII. Fomentar la vinculación y la colaboración entre los órganos del sector público y social de la región.\nIII. Inventariar los apoyos que puedan brindarse a las personas receptoras de la violencia, y difundirlos para conocimiento.\nIV. Mantener estrecha relación con las Unidades de Atención en apoyo a su desempeño en el ámbito de su competencia.\nV. Apoyar al Consejo Estatal en las funciones de su competencia en el ámbito regional.\nVI. Propiciar la formación de una conciencia social regional, acerca de la problemática de la violencia familiar.\nVII. Las demás que les sean conferidas por el Consejo Estatal y por la Junta Directiva para la\nPrevención, Asistencia y Atención de la Violencia Familiar.\nArtículo 19. Los órganos a que se refiere este capítulo, normarán su actuación en base a las siguientes premisas:\nI. Procurarán que los abusos cometidos dentro de la familia, no queden impunes.\nII. Tomarán en cuenta el interés superior de las personas receptoras de violencia y les otorgarán protección total.\nCAPITULO II\nDE LAS ACCIONES PUBLICAS\nSECCION PRIMERA\nDISPOSICIONES COMUNES\nArtículo 20. Es deber del Estado y sus autoridades resguardar a la familia como un espacio de afecto, seguridad y desarrollo, a cuyo efecto deberá implementar todas las medidas indispensables para impedir que en su seno se produzca cualquier forma de maltrato que afecte a sus miembros, así mismo brindará particular atención a las niñas y a los niños, a las mujeres, a las personas con capacidades diferentes o de la tercera edad, evitando que sean victimas de la violencia familiar.\nArtículo 21. Las autoridades involucradas en esta problemática, a las que alude este capítulo, además de las funciones que les son propias, llevarán a cabo las que esta ley les atribuye; a cuyo efecto deberán presentar sus programas y evaluaciones para su aprobación ante el Consejo Estatal para la Prevención, Asistencia y Atención de la Violencia Familiar en el Estado.\nSECCION SEGUNDA\nDE LA PREVENCION\nArtículo 22. Corresponde a la Secretaría de Educación:\nI. Desarrollar programas educativos, para la prevención de la violencia familiar con las instancias competentes y promoverlos en cada una de las instituciones públicas y privadas.\nII. Organizar cursos y talleres de capacitación, con perspectiva de género, para el personal de los diferentes niveles educativos.\nIII. Promover campañas para difundir los derechos humanos y eliminar en los contenidos educativos modelos discriminatorios de género.\nIV. Generar políticas educativas que modifiquen los patrones socioculturales de conducta de hombres y de mujeres, mediante la educación formal y no formal, a fin de contrarrestar prejuicios y identidades de género, que constituyen causas y exacerban la violencia familiar.\nV. Fomentar y apoyar programas de educación para crear conciencia sobre las consecuencias de la violencia familiar, los problemas derivados de ella, los medios de prevenirla y evitarla.\nVI. Establecer formas de capacitación y sensibilización, con perspectiva de género, del personal educativo, a fin de que detecte y de una primera respuesta urgente a los casos de educandos que sufran violencia familiar.\nVII. Diseñar y poner en marcha planes pilotos para identificar casos de violencia familiar, con información reservada proveniente de los educandos.\nVIII. A través de programas como el de Escuela para Padres y el diseño de materiales educativos dirigidos a los miembros de las familias; impulsar estrategias para evitar la violencia familiar, poniendo especial atención a la que se ejerce contra las niñas y los niños.\nIX. Establecer cursos de especialización sobre violencia familiar.\nX. Promover en las universidades públicas y privadas que cuenten con la Carrera de Derecho, con\nCentros de Investigaciones Jurídicas o Centros de Estudios de Género, así como entre las organizaciones no gubernamentales académicas relacionadas con la materia de la presente Ley, el violencia familiar, así como de las vías y los recursos con que cuentan para su defensa.\nXI. Desarrollar programas educativos que incorporen en el proceso de enseñanza aprendizaje, desde la infancia, orientaciones y valores de equidad entre los géneros y de respeto a los derechos humanos.\nXII. Eliminar de los contenidos educativos, modelos discriminatorios de género.\nXIII. Impartir talleres sobre la aplicación en México de las convenciones internacionales en materia de violencia familiar o contra la mujer.\nXIV. Llevar registro de los casos de violencia familiar que tengan lugar en los centros educativos de su dependencia y del tratamiento de que fueron objeto.\nXV. Las demás que establezcan las leyes.\nArtículo 23. Corresponde a la Secretaría de Desarrollo Social:\nI. Contribuir a que las familias participen activa y concientemente en los programas que tiendan a satisfacer sus necesidades básicas y desarrollar sus capacidades.\nII. Promover talleres de capacitación, con perspectiva de género, que permitan a las mujeres, a las personas con capacidades diferentes y a las de la tercera edad, acceder a un empleo o a un autoempleo.\nIII. Promover programas de intervención temprana en comunidades de escasos recursos para prevenir, desde dónde se genera, violencia familiar, incorporando a la población en las operaciones de dichos programas.\nIV. Orientar para el acceso a un empleo digno o para recibir asistencia y atención, a personas receptoras de violencia familiar.\nV. Promover programas que garanticen el registro de títulos de propiedad de la tierra y vivienda a las mujeres que soliciten la regularización de su tenencia.\nVI. Establecer proyectos productivos, sin estereotipos de género, a favor de mujeres que enfrentan problemas de violencia familiar.\nVII. Las demás que establezcan las leyes\nArtículo 24. Corresponde al Sistema para el Desarrollo Integral de la Familia.\nI. Establecer un sistema general de prevención de la violencia familiar mediante el cual se logre que deje de ser patrón de las relaciones familiares, sustituyéndolo por otros patrones basados, tanto en el respeto de la individualidad, como en las diferencias de género.\nII. Crear modelos de detección de violencia familiar.\nIII. Promover la creación de espacios que sirvan de albergues temporales, para las personas receptoras de violencia familiar en situación de emergencia.\nIV. Establecer los mecanismos necesarios para que todas las instituciones del sector público o privado canalicen los casos de violencia familiar a las autoridades competentes, particularmente a las\nUnidades de Atención.\nV. Editar y distribuir, de la forma más amplia posible, material impreso: Trípticos, carteles y cartillas informativas, para sensibilizar a la población en orden a la violencia familiar.\nVI. Organizar campañas masivas de comunicación social, incluidos los medios electrónicos, para prevenir la violencia familiar.\nVII. Promover foros de discusión sobre todos los aspectos de la violencia familiar.\nVIII. Establecer los vínculos necesarios con instituciones de asistencia social o privadas, para obtener los apoyos institucionales en materia de violencia familiar.\nIX. Y las demás que le confieran las leyes.\nArtículo 25. Corresponde al Instituto Coahuilense de las Mujeres:\nI. Coadyuvar en la erradicación de la violencia de género en las personas de las niñas y las mujeres.\nII. Diseñar campañas para la promoción de imágenes plurales, no estereotipadas de género, que garanticen el respeto entre los hombres y mujeres y permitan erradicar la violencia.\nIII. Coadyuvar en la difusión de los derechos de las mujeres.\nIV. Canalizar para su atención, los casos de violencia familiar que sean de su conocimiento.\nV. Impartir en todo el Estado talleres sobre la aplicación de las Convenciones Internacionales para\nPrevenir, Sancionar y Erradicar la Violencia contra la Mujer, para la eliminación de todas las formas de discriminación contra las mujeres y demás signadas por México.\nVI. Y las demás que les confieran las leyes.\nSECCION TERCERA\nDE LA ASISTENCIA Y ATENCIÓN\nArtículo 26. La atención especializada que se proporcione en materia de violencia familiar, por las\nUnidades de Atención o por cualquier institución de la administración pública o del sector privado, tendrá por objeto la protección de la integridad física y mental y de las personas receptoras de la violencia, así como la reeducación, respecto a quien la provoca en la familia.\nDel mismo modo, estará libre de prejuicios de género, raza, condición socioeconómica, religión o credo, nacionalidad o de cualquier otro tipo, y no contará entre sus criterios con patrones estereotipados de subordinación.\nArtículo 27. La atención a quienes incurran en actos de violencia familiar, se basará en modelos psicoterapéuticos reeducativos, tendientes a disminuir y, en su caso, erradicar las conductas violentas que hayan sido empleadas y evaluadas con anterioridad a su aplicación.\nDicha atención tendrá lugar en las Unidades de Atención establecidas para el efecto.\nEn estas Unidades, podrá hacerse extensiva la atención a quienes cuenten con sentencia ejecutoria relacionada con eventos de violencia familiar a solicitud de la autoridad jurisdiccional, de acuerdo con las facultades que tiene conferidas el Juez Penal o Familiar, o bien, a solicitud del propio interesado.\nArtículo 28. El personal de las instituciones a que se refieren los dos artículos anteriores, deberá ser profesional y acreditado por las instituciones educativas públicas o privadas, debiendo contar con la inscripción y registro correspondiente ante la Secretaría de Educación y la Secretaría de Salud.\nDicho personal deberá participar en los procesos de selección, capacitación y sensibilización, que en su oportunidad se implementen, a fin de que cuenten con el perfil adecuado.\nArtículo 29. Corresponde a la Procuraduría de la Familia:\nI. Crear las Unidades de Atención, con especialistas en las áreas psicológica, médica, jurídica y social.\nII. Establecer y mantener una coordinación adecuada con las Unidades de Atención y con las\nAgencias del Ministerio Público; así como con las autoridades policíacas del Estado y los\nMunicipios, para lograr su intervención oportuna y brindar atención a quienes resulten víctimas de la violencia familiar.\nIII. Organizar y promover cursos de capacitación y sensibilización al personal de las diferentes áreas a quienes corresponda la prevención, asistencia y atención de la violencia familiar, a efecto de optimizar la prestación de servicios a quienes los requieran.\nIV. Sensibilizar, a través de programas de difusión sobre la violencia familiar, a las comunidades del área de influencia de las Unidades de Atención; difundiendo información respecto a las medidas de atención y prevención que estas y otras instituciones ofrecen en materia de violencia familiar.\nV. Promover campañas en coordinación con el Instituto Coahuilense de las Mujeres, encaminadas a sensibilizar y concientizar a la población en general, sobre las formas de expresión de la violencia familiar, sus efectos en las víctimas y demás integrantes del núcleo de convivencia, así como de las formas de prevenirla, combatirla y erradicarla.\nVI. Incentivar el estudio e investigación sobre violencia familiar y difundir los resultados que derivan de dichos estudios e investigaciones.\nVII. Instrumentar programas de prevención, asistencia, asesoría, defensa, protección y orientación a las personas receptoras de violencia familiar.\nVIII. Diseñar un modelo de atención integral para las personas involucradas en casos de violencia dentro de la familia, a fin de apoyarlas en el aprendizaje de formas de convivencia pacífica o bien sanción y rehabilitación de las personas generadoras de la misma.\nIX. Establecer mecanismos de consulta constante y urgente, y de intercambio de datos sobre la detección, la atención y los resultados de las investigaciones en materia de violencia familiar.\nX. Aplicar métodos para la eficaz atención de las diversas personas involucradas en los casos de violencia familiar.\nXI. Recibir por sí o a través de sus delegados todas las denuncias de maltrato de menores, mujeres, derecho proceda.\nXII. Conocer por sí o a través de las Unidades de Atención de los actos de violencia familiar.\nXIII. Establecer las políticas administrativas necesarias, para la prevención y atención de la violencia familiar, en las Unidades de Atención.\nXIV. Decretar por sí o a través de las Unidades de Atención, las custodias de emergencia, las separaciones provisionales o preventivas del seno familiar, las cauciones de no ofender, las prohibiciones de ir a determinado lugar y las sanciones administrativas a que se refiere esta ley.\nXV. Promover, en su caso, ante las autoridades judiciales la tramitación de los juicios relativos a custodias definitivas, pérdidas de la patria potestad o procedimientos de violencia familiar.\nXVI. Crear un modelo de detección de violencia familiar entre menores infractores, para identificar su posible relación con la conducta antisocial asumida.\nXVII. Establecer un modelo de atención psicoterapéutica, que permita determinar en qué medida la violencia familiar es factor de riesgo para la comisión de infracciones por menores de edad.\nXVIII. Promover y fomentar la creación de brigadas para la prevención y atención de problemas familiares.\nXIX. Difundir por los medios más eficaces el contenido y sentido de la presente ley, a efecto de lograr su plena observancia.\nXX. Editar manuales explicativos de los modelos de atención a personas receptoras de violencia, dirigidos a servidoras y servidores públicos y a las personas usuarias de los diferentes servicios.\nXXI. Las demás que establezcan las leyes.\nArtículo 30. Las Unidades de Atención, tendrán las siguientes atribuciones:\nI. Promover acciones y programas de protección y atención a las personas receptoras de violencia familiar.\nII. Conocer de los procedimientos de mediación, conciliación y amigable composición.\nIII. Solicitar a la Procuraduría General de Justicia del Estado, a través de las Agencias Especializadas del Ministerio Público y de los Servicios Periciales, las siguientes colaboraciones:\na) La remisión de las personas receptoras y generadoras de la violencia familiar, para los efectos procedimentales que les confiere la ley, cuando no existe ilícito penal o se trata de delitos de querella.\nb) Elaborar o proporcionar los certificados provisionales y definitivos de las lesiones y daños psicoemocionales ocasionados a la víctima con motivo de la violencia familiar.\nIV. A través de quienes instruyan los procedimientos de mediación, conciliación o amigable composición:\na) Decretar custodias de emergencia y separaciones provisionales o preventivas en el seno familiar, en los casos que se estimen necesarios.\nb) Atender los procedimientos de mediación, conciliación y amigable composición.\nc) Determinar las cauciones de no ofender y las prohibiciones de ir a determinados lugares, en los casos que estime necesarios.\nd) Aplicar medidas de apremio y sanciones administrativas cuando procedan.\nV. Solicitar a los jueces familiares que dicten las medidas cautelares o precautorias previstas en el\nCódigo Procesal Civil, a efecto de proteger a las personas receptoras del maltrato, que estén en riesgo de sufrir graves daños a su salud como consecuencia de la violencia familiar.\nVI. Promover, en su caso, por instrucción de la Procuraduría de la Familia ante las autoridades judiciales, la tramitación de los juicios relativos a custodias definitivas, pérdidas de la patria potestad o procedimientos de violencia familiar.\nVII. Denunciar los hechos de violencia familiar de los que tenga conocimiento, que ameriten la intervención del Ministerio Público.\nVIII. Coadyuvar con las víctimas de la violencia familiar en la formulación de denuncias, cuando así se lo soliciten o canalizarlas a las defensorías de oficio para que reciban la asistencia necesaria.\nIX. Atender con modelos psicoterapéuticos a las personas receptoras y generadoras de violencia, para prevenir y erradicar esta conducta.\nX. Procurar atención, o en su caso canalizar a las clínicas de salud o centros hospitalarios, a las víctimas de violencia familiar que requieran atención medica.\nXI. Llevar un registro con la información obligatoria de quienes afrontan violencia familiar; características sociodemográficas de los actores del hecho, estructura de la familia, forma de la violencia denunciada, medidas adoptadas, curso y evaluación del tratamiento.\nXII. Asegurar la adhesión de la comunidad a las medidas destinadas a combatir la violencia familiar, a través de los medios de comunicación.\nXIII. Realizar las investigaciones y estudios que consideren pertinentes a fin de orientar la planeación de las acciones establecidas en el Programa General.\nXIV. Las demás que les confieran las leyes y el Reglamento que norme sus actividades; así como las que expresamente les encomiende la Junta Directiva para la Prevención, Asistencia y Atención de la Violencia Familiar en el Estado.\nArtículo 31. Corresponde a la Secretaría de Gobierno:\nI. Coadyuvar a través del Registro Civil a la difusión del contenido y alcance de la presente ley.\nII. Instrumentar a través de la Dirección General de dicho Registro, una sección especial en la que se inscriban todas las personas que hayan sido condenadas por sentencia ejecutoriada, por tribunales civiles y penales, como autores de actos de violencia familiar, a cuyo efecto, éstos deberán remitirle copia certificada de estas resoluciones. autoridades administrativas o jurisdiccionales especializadas en la materia.\nIII. Llevar un registro de instituciones gubernamentales y no gubernamentales, que por razón de sus funciones y fines, puedan prestar apoyos y servicios en los casos de violencia familiar.\nIV. Promover la capacitación y sensibilización, con perspectiva de genero, de las y los defensores y personal profesional auxiliar, que presten sus servicios en la Defensoría de Oficio en materia\nFamiliar y Penal, a efecto de mejorar la atención de las personas receptoras de la violencia que requieran la intervención de dicha Defensoría.\nV. Vigilar y garantizar el cumplimiento de esta ley, de conformidad con las atribuciones que establece la Ley Orgánica de la Administración Pública del Estado.\nVI. Las demás que establecen las leyes.\nArtículo 32. Corresponde a la Secretaría de Seguridad Pública:\nI. Coordinarse con la Procuraduría General de Justicia y la Procuraduría de la Familia para diseñar y llevar a cabo acciones de prevención, atención y asistencia de la violencia familiar.\nII. Crear un cuerpo especializado, con enfoque de género, que preste auxilio y colabore con las autoridades y organismos públicos del Estado en los casos de violencia familiar.\nEl personal que conforme dicho cuerpo, deberá recibir capacitación especial y sensibilización en procedimientos de manejo de conducta de menores, mujeres, personas de capacidad diferente y de la tercera edad.\nIII. Hacer cumplir las normas y disposiciones que expidan las autoridades competentes en materia de violencia familiar.\nIV. Brindar apoyo a las víctimas de violencia familiar, procurando en todo momento el respeto a su dignidad, discreción y privacidad.\nV. Vigilar que los elementos de la policía de Seguridad Pública den cuenta inmediata a la autoridad competente de los casos de violencia familiar que sean de su conocimiento, con motivo del ejercicio de sus funciones.\nVI. Hacer llegar por los conductos que estime necesarios, los diversos citatorios que emitan las autoridades competentes, a presuntas personas generadores de la violencia familiar.\nVII. A través de sus elementos, llevar a cabo las presentaciones para hacer efectivos los arrestos administrativos que se impongan con motivo de la ley.\nVIII. Incluir en sus programas de formación policíaca, cursos sobre violencia familiar.\nIX. Las demás que le confieran las leyes.\nArtículo 33. Corresponde a la Procuraduría General de Justicia del Estado:\nI. Instalar en las cabeceras distritales del Estado, Agencias Especializadas del Ministerio Público en la atención de víctima de violencia familiar y delitos sexuales, o bien procurar que en las agencias ya existentes, se integren grupos de agentes, de preferencia mujeres, que atiendan a esas víctimas.\nII. Organizar un modelo interdisciplinario de investigación criminal especializada en la violencia familiar y los delitos sexuales, que permita integrar los elementos del tipo y preservar las evidencias, para procurar una mejor impartición de justicia.\nIII. Organizar métodos de trato a las víctimas, para procurar disminuir su angustia y el estado postraumático en el que se encuentre a raíz de la violencia sufrida.\nIV. Capacitar y sensibilizar al personal del Ministerio Público, particularmente al especializado, con perspectiva de género, en orden a la práctica de las investigaciones y trato a las víctimas de la violencia familiar.\nV. Crear talleres dirigidos a Agentes y Policías Ministeriales, Médicos Legistas y servidores públicos encargados de atender quejas, a fin de darles herramientas útiles para que atiendan situaciones de emergencia y den las respuestas necesarias para la protección de las personas receptoras de violencia familiar.\nVI. Establecer una línea telefónica de emergencia que proporcione información y asistencia a las personas receptoras de violencia familiar que lo soliciten, o a terceras personas que tengan conocimiento de dicha violencia.\nVII. Encausar a las autoridades competentes, los casos de violencia familiar que no sean objeto de enjuiciamiento penal, y hacer de su conocimiento estos últimos para los efectos legales consiguientes.\nVIII. Llevar una información estadística por separado sobre los casos de violencia familiar de su conocimiento y el curso que se les ha dado.\nIX. Las demás que le confieran las leyes.\nArtículo 34. Corresponde a la Secretaría de Salud:\nI. Poner en práctica Programas de Asistencia y Prevención de la Violencia Familiar.\nII. Crear modelos de respuesta al fenómeno de la violencia familiar como problema de salud pública y establecer formas de prevención y solución sus consecuencias, tanto psicológicas como fisiológicas, en la salud de las personas receptoras de la violencia.\nIII. Fomentar, en coordinación con instituciones públicas, privadas y sociales, la realización de investigaciones sobre el fenómeno de la violencia familiar, para diseñar nuevos modelos de prevención y atención.\nIV. Concurrir, con fines preventivos o de seguimiento, a los sitios donde exista violencia familiar, mediante trabajadoras sociales y personal médico, con el propósito de desalentarla.\nV. Organizar cursos y talleres de capacitación y sensibilización para el personal de las diferentes áreas de salud a quienes corresponda la prevención y atención de la violencia familiar, con el propósito de procurar la adecuada atención de quienes requieren de sus servicios.\nVI. Llevar a cabo programas de concientización y de formación y capacitación, sobre formas de hospitales generales, materno infantiles y pediátricos; así como del personal médico dependiente de las instituciones hospitalarias.\nDel mismo modo, deberá celebrar convenios con instituciones de salud privadas, a efecto de que en las mismas se lleven a cabo los programas antes mencionados.\nVII. Elaborar formatos médicos para recabar los datos que permitan determinar la existencia de casos de violencia familiar.\nVIII. Llevar a cabo campañas encaminadas a sensibilizar y concientizar a la población en general, sobre las formas de expresión de la violencia familiar y sus efectos; así como las formas de prevenirla, combatirla y erradicarla. relativas a la prestación de servicios de salud y criterios para la atención de la violencia familiar.\nX. Llevar un registro puntual de los casos de violencia familiar que se atienden en las diversas instituciones hospitalarias públicas y privadas, que permita conocer si la víctima ha sido objeto de agresiones anteriores, los organismos que han intervenido y el resultado de las acciones llevadas a cabo.\nXI. Las demás que establezcan las leyes.\nCAPITULO III\nDE LAS ACCIONES PRIVADAS\nArtículo 35. El Estado incentivará todas las iniciativas del sector privado y social, con miras a la creación de centros o establecimientos de asistencia, habilitación y rehabilitación para menores, mujeres, personas con capacidades diferentes y de la tercera edad, que sufran violencia familiar.\nArtículo 36. Los centros o establecimientos a que se refiere el artículo anterior, deberán coordinarse en sus acciones con el Sistema para el Desarrollo Integral de la Familia y el Voluntariado de Coahuila.\nCorresponderá a los entes rectores establecer los requisitos para la creación de dichos centros y expedir la licencia respectiva para su funcionamiento.\nEstos centros o establecimientos tienen la obligación de enviar semestralmente el informe estadístico relativo a las atenciones que brinden.\nArtículo 37. El personal que atienda y dirija los centros o establecimientos, deberá reunir las condiciones de idoneidad y moralidad suficientes, según la clase de servicios que presta.\nCorresponderá al ente regulador, asegurar la orientación y capacitación del personal y la supervisión y certificación de los citados centros y establecimientos.\nArtículo 38. El ingreso de las y los menores, mujeres, personas con capacidades diferentes y de la tercera edad a los centros o establecimientos, deberá ser objeto de un estudio socio-psicológico previo, del que deberá llevarse un seguimiento. En la atención y tratamiento se procurará mantener permanentemente la relación con los familiares del ingresado.\nArtículo 39. Las organizaciones sociales y filantrópicas que organicen centros o establecimientos de asistencia, tendrán derecho de participar en los patronatos, directivas o consejos, a fin de vigilar el correcto manejo y destino de los fondos afectados, así como el cumplimiento eficiente de sus objetivos.\nTITULO TERCERO\nDE LOS PROCESOS Y PROCEDIMIENTOS EN\nMATERIA DE VIOLENCIA FAMILIAR\nCAPITULO I\nDEFINICIONES Y PRINCIPIOS BASICOS\nArtículo 40. Los procesos y procedimientos en materia de violencia familiar están constituidas por las gestiones o actuaciones, ya sea a petición de parte interesada o de oficio, en todos los asuntos que requieran la intervención o decisión de los órganos previstos en esta ley, para hacer efectivos los preceptos que en ella se contienen.\nArtículo 41. Los procesos y procedimientos en materia de violencia familiar serán reservados y confidenciales; pero tendrán acceso a ellos las partes, sus representantes legales o voluntarios, los familiares y las personas que demuestren tener interés legítimo en la causa.\nArtículo 42. Quienes tengan a su cargo un proceso o procedimiento en materia de violencia familiar, procurarán adoptar determinaciones o resoluciones justas y eficaces y, a tal efecto, pondrán especial empeño en emplear fórmulas expeditas y sencillas, para dejar claramente resuelto el asunto bajo su conocimiento, en el menor tiempo posible.\nEn los procesos y procedimientos se atenderá siempre al mejor interés de la persona receptora de la violencia familiar.\nArtículo 43. El impulso y dirección de los procesos o procedimientos corresponde a quienes deben instruirlos, para cuyo efecto cuidarán de su rápida tramitación, sin perjuicio de la garantía de audiencia que corresponda a las personas interesadas. En todos los casos se evitará las dilaciones innecesarias o su paralización.\nArtículo 44. Los órganos del Poder Judicial, del Ministerio Público, Registros y demás autoridades y funcionarios del Estado, prestarán gratuitamente los oficios legales de su cargo a los instructores de los procesos o procedimientos, en cualquier acto o diligencia en que sea necesario contar con constancias o copias certificadas.\nArtículo 45. En todo lo que no se oponga a las normas especiales de esa ley, son aplicables las disposiciones del Código Civil y del Código Procesal Civil del Estado\nCAPITULO II\nDEL CONOCIMIENTO DE LOS CONFLICTOS EN\nMATERIA DE VIOLENCIA FAMILIAR\nArtículo 46. Para el conocimiento de los conflictos en materia de violencia familiar en las vías de mediación, conciliación y amigable composición, serán competentes las Unidades de Atención.\nEn estos casos el procedimiento lo instruirá el Titular de la Unidad, quien podrá delegar su atención, tratándose del de mediación o el de conciliación, a los integrantes de la Unidad, preferentemente a quienes cuenten con especializaciones en psicología o psiquiatría.\nQuien medie, concilie o actúe como amigable componedor, podrá asociar a quienes conforman el equipo técnico interdisciplinario de la Unidad, o solo a aquellos cuya opinión estime necesaria.\nEn los lugares en que no fuese posible contar con una persona especialista dentro del equipo, la evaluación podrá ser encomendada a las instituciones o profesionales del lugar.\nArtículo 47. En los conflictos en materia de violencia familiar, será competente por razón del territorio, la\nUnidad de Atención en que resida la persona receptora de la violencia.\nArtículo 48. Cuando la controversia en materia de violencia familiar amerite la intervención del órgano jurisdiccional; será competente para conocer de ella los Jueces de Primera Instancia en Materia Familiar\nCAPITULO III\nFAMILIAR\nArtículo 49. En la tramitación y resolución de los procesos y procedimientos de violencia familiar, rigen los principio de oficio, de gratuidad, de reserva, de confidencialidad, de mejor interés de la persona receptora de violencia familiar, de inmediación, de breve trámite y de oralidad.\nArtículo 50. Los órganos encargados del conocimiento de los asuntos de violencia familiar, dictarán las medidas que estimen convenientes con prevalencia del interés superior de la víctima. Así mismo, están obligados a investigar la verdad de los conflictos que se les plantean, mediante la práctica de las diligencias probatorias que consideren necesarias.\nAdemás de los medios de prueba establecidos por el Código Procesal Civil del Estado, podrán utilizarse cualquiera otro medio probatorio no prohibido por la ley. Las pruebas serán apreciadas conforme a las reglas de la sana crítica.\nArtículo 51. En cualquier fase del conflicto, las autoridades del conocimiento podrán ordenar las diligencias que consideren convenientes para mejor proveer.\nArtículo 52. Si para la práctica de una prueba fuere necesaria la colaboración material o personal de quien generó la violencia y éste se negare; su negativa podrá ser apreciada en forma desfavorable al dictarse la determinación o resolución correspondiente, salvo las garantías que la Constitución otorga.\nArtículo 53. Las diligencias sobre notificaciones y citatorios podrán practicarse según las circunstancias, por correo, por telégrafo, por conducto del personal autorizado de las Unidades de Atención o por la policía preventiva estatal o municipal, y deberá dejarse constancia razonada del medio empleado.\nCAPITULO IV\nDEL IMPULSO INICIAL DE LOS PROCESOS Y PROCEDIMIENTOS\nArtículo 54. Toda persona que sufra violencia familiar, cuando esta no revista carácter judicial, podrá requerir los servicios de las Unidades de Atención.\nSi la violencia familiar amerita la intervención de un órgano jurisdiccional, la petición se formulará en los familiar.\nArtículo 55. Están obligados a informar, en un término no mayor de 24 horas, desde que tienen conocimiento de la existencia de una situación de violencia familiar, las siguientes personas o instituciones:\nI. Las personas profesionales o funcionarios públicos, y las entidades públicas o privadas, que en el desempeño de sus actividades o funciones, tuvieren conocimiento o sospecha de la existencia de una situación de violencia familiar.\nII. Los profesionales de la salud, educación y los directores de las instituciones hospitalarias y educativas; así como las personas dedicadas a labores de dirección, en instituciones o centros de atención y cuidado de menores, mujeres, personas con capacidades diferentes y de la tercera edad.\nIII. Agentes del Ministerio Público, Elementos de la Policía Preventiva Estatal o Municipal o de la problemática.\nIV. En general, cualquier persona que tuviera conocimiento o sospecha de un caso de violencia familiar.\nArtículo 56. La información suministrada será mantenida en estricta confidencialidad, así como el nombre de la persona informante, mientras no sea legalmente necesario revelar su identidad.\nLa omisión de información injustificada o el hecho de impedir que otra persona actuando en forma razonable lo haga; se considerará como complicidad en la comisión de la violencia familiar de que se trate.\nArtículo 57. Cualquier persona, funcionario o institución obligados a suministrar información sobre violencia familiar, tendrán causa de justificación legal contra cualquier acción civil o penal que pudiera ser promovida a consecuencia de dicho acto.\nArtículo 58. Las informaciones falsas proporcionadas por particulares, darán lugar a la imposición de una multa equivalente a la mínima prevista en esta ley.\nArtículo 59. Las dependencias de la Procuraduría General de Justicia del Estado y de la Procuraduría de la Familia, particularmente encargadas de los asuntos de violencia familiar, contarán con un sistema especial de comunicación telefónica denominado “Línea Directa para Situaciones de Violencia Familiar”, a través del cual todas las personas e instituciones podrán informar sobre los casos de que tengan conocimiento, a cualquier hora del día o de la noche y cualquier día de la semana.\nCAPITULO V\nMEDIDAS DE EMERGENCIA Y PROVIDENCIAS CAUTELARES\nArtículo 60. Toda autoridad administrativa, director o administrador de un hospital u otra institución de salud pública o privada, director de escuela o maestro, podrá asumir la protección de menores, mujeres, personas con capacidades diferentes o de la tercera edad, cuando tenga motivo razonable para creer que ha sido víctima de violencia familiar. Esta protección no podrá exceder de 36 horas, excepción hecha de que por cualquier medio se produzca la intervención de un Juez de lo Familiar, en cuyos casos se estará a lo que éste disponga.\nArtículo 61. Los Juzgados de lo Familiar o la Procuraduría de la Familia a través de su titular, o por conducto de sus Delegados o titulares de las Unidades de Atención, en caso de urgencia, informados de una situación de violencia familiar o requeridos al efecto, adoptarán las medidas que estimen convenientes, según la gravedad del caso, incluyendo la hospitalización y el tratamiento médico de la persona receptora de la violencia.\nAsí mismo, estarán obligados a prevenir la repetición de los hechos, para lo cual dispondrán, a través de los organismos competentes, una adecuada atención psicoterapéutica y rehabilitación de las personas receptoras de la violencia, independientemente de que se exija al generador de la violencia una caución de no ofender o la prohibición de ir a lugar determinado o residir en él, o cualquier otra medida que se estime efectiva.\nArtículo 62. Cualquier persona de las obligadas a suministrar información en los casos de violencia familiar, puede tomar o hacer que se tomen fotografías de las áreas de trauma de la víctima y de ser médicamente indicado le practicará, o harán que se le practique exámenes radiológicos y dentales, pruebas de laboratorio o cualquier otro examen médico que sea necesario.\nEstas evidencias se recogerán de manera que no afecten al receptor de la violencia, ni atenten contra su dignidad y se remitirán a la autoridad que tome a su cargo el conocimiento del caso de violencia familiar.\nEstas evidencias también estarán disponibles para iniciar, en su caso, procesos civiles o penales por violencia familiar.\nArtículo 63. Quienes tienen a su cargo la investigación o el conocimiento de casos de violencia familiar, podrán entrevistar directamente, sin mayores requisitos, en el lugar en que se encuentre, a la persona de la que tengan conocimiento o sospechen que ha sido víctima de violencia familiar.\nLa entrevista podrá practicarse en la escuela, pública o privada, en los hospitales o centros de salud, o en cualquier otro lugar donde la víctima de la violencia se halle, siempre y cuando esté garantizada su seguridad.\nArtículo 64. Quien tiene a su cargo la sustanciación de un proceso o procedimiento de violencia familiar, cuando considere necesaria la protección de los derechos de la persona receptora de la violencia, antes o durante la tramitación de aquellos, podrá decretar de oficio o a petición de parte, las medidas cautelares o tutelares que estime convenientes, las cuales se ordenarán sin más trámite y sin necesidad de prestar caución, cuando tenga justo motivo.\nArtículo 65. Las medidas cautelares o tutelares a que se refiere el artículo anterior, podrán ser las siguientes:\nI. Ordenar la exclusión de la persona generadora de la violencia, de la vivienda donde habita el grupo familiar.\nII. Prohibir el acceso de la persona generadora de la violencia, al domicilio de la persona afectada, así como a los lugares donde trabaja o estudia.\nIII. Depositar a la persona receptora de la violencia en un domicilio que garantice su seguridad.\nIV. Ordenar el reintegro al domicilio a petición de quien debió salir del mismo por razones de seguridad personal y disponer la exclusión de la persona generadora de la violencia\nEn todos estos casos deberá establecerse la duración de la medida, en vista a la determinación definitiva que habrá de adoptarse.\nArtículo 66. La Procuraduría de la Familia proveerá de servicios de protección, directamente o mediante contratos o acuerdos con organismos e instituciones que los presten, a los menores, mujeres, personas con capacidades diferentes o de la tercera edad, que estén en riesgo sustancial de ser víctimas de la violencia familiar y no tengan domicilio o persona que se haga cargo de su cuidado. resguardar los derechos de las personas afectadas, de sus deberes de cuidado y de garantizar el bienestar de los mismos.\nCAPITULO VI\nDE LOS PROCEDIMIENTOS DE MEDIACION, CONCILIACION\nY AMIGABLE COMPOSICION\nArtículo 67. Las partes en un conflicto familiar podrán resolver sus diferencias extrajudicialmente, mediante los procedimientos:\nI. De mediación.\nII. De conciliación.\nIII. De amigable composición.\nDichos procedimientos estarán a cargo de las Unidades de Atención y serán voluntarios e informales.\nLas actuaciones que en ellos tengan lugar, excepción hecha de los acuerdos y resoluciones que se adopten, serán confidenciales y no podrán ser utilizadas como medio de prueba en otros juicios, ni los mediadores, conciliadores o amigables componedores podrán ser compelidos a declarar como testigos.\nSe exceptúan de lo dispuesto en este artículo, aquellas controversias que versen sobre acciones o derechos del estado civil irrenunciables o delitos que se persigan de oficio.\nArtículo 68. Es obligación de la persona mediadora, conciliadora o amigable componedora, antes de iniciar cualquier procedimiento, preguntar a las partes si éstas se encuentran dirimiendo sus conflictos ante autoridad judicial, civil o penal, e informarles pormenorizadamente del contenido y alcances de la presente ley y de los procedimientos administrativos, jurisdiccionales, civiles y penales que existan en la materia; así como de las sanciones a las que se harán acreedores en caso de incumplimiento de las determinaciones que en estas vías se dicten o en caso de reincidencia.\nArtículo 69. Los procedimientos previstos en la presente ley no excluyen, ni son presupuesto previo para llevar a cabo un procedimiento jurisdiccional. Al término de los procedimientos de mediación, conciliación, o amigable composición, en caso de que existiera un litigio en relación con el mismo asunto, el mediador, el conciliador o el amigable componedor, enviará al juez de la causa el convenio o la resolución correspondiente, con total reserva de las actuaciones, en los términos previstos por el artículo 67, párrafo segundo de esta Ley.\nArtículo 70. Los procedimientos de solución de los conflictos familiares a que se refieren los artículos anteriores, se llevarán a cabo a lo sumo en dos audiencias.\nEn todo caso, tratándose de menores antes de dictar la resolución o de establecer la conciliación, deberá oírseles atendiendo a su edad y condición, a fin de que su opinión sea tomada en cuenta en todos los asuntos que les afecten.\nArtículo 71. Las audiencias de mediación se desarrollarán mediante entrevistas iniciales con cada una de las partes, seguidas por entrevistas conjuntas, en las que la persona mediadora les ayudará a desarrollar opciones y propuestas alternativas para solucionar su conflicto, a fin de que lo puedan concluir mediante un acuerdo mutuo aceptable.\nLa persona mediadora omitirá externar opiniones y emitir juicios, limitándose a conducir el proceso de mediación.\nArtículo 72. Para el caso de que en el procedimiento de mediación no se obtengan resultados favorables; las partes, si esta es su voluntad, podrán sujetarse al procedimiento de conciliación.\nEn las audiencias de conciliación, la persona conciliadora procederá a buscar la avenencia entre las partes, proporcionándoles toda clase de alternativas, exhortándolos a que lo hagan, dándoles a conocer las consecuencias en caso de continuar con su conflicto.\nUna vez que las partes lleguen a una conciliación, se celebrará el convenio correspondiente que será firmado, por quienes intervengan en el mismo.\nArtículo 73. De no verificarse el supuesto anterior, podrá intentarse la amigable composición una vez que las partes hubiesen decidido de común acuerdo y por escrito someterse a ella, en cuyo caso la decisión de quien intervenga en la amigable composición, tendrá carácter vinculatorio y será exigible para ambas partes, a quienes se informará sobre las consecuencias que puede generar el no cumplimiento de las determinaciones.\nArtículo 74. El procedimiento de amigable composición a que hace alusión el artículo anterior, se verificará en las audiencias de amigable composición y resolución de la siguiente forma:\nI. Se iniciará con la comparecencia de ambas partes o con la presentación de la constancia administrativa proveniente de autoridad competente, en la que se contengan los datos generales y la relación sucinta de los hechos constitutivos de la violencia familiar, así como la aceptación expresa de someterse al procedimiento.\nII. Las partes en dicha comparecencia ofrecerán las pruebas que a su derecho convenga a excepción de la confesional, pudiendo allegarse, la o el amigable componedor de todos los medios de prueba que estén reconocidos legalmente, que le permitan emitir su resolución, aplicándose supletoriamente el Código Procesal Civil del Estado.\nIII. Una vez admitidas y desahogadas las pruebas, se recibirán los alegatos verbales de las partes quedando asentados en autos, procediendo la o el amigable componedor a emitir su resolución en conciencia, conforme a la equidad.\nArtículo 75. Cuando alguna de las partes incumpla con las obligaciones y deberes establecidos en los convenios o en la resolución de la amigable composición; la otra, podrá acudir ante la autoridad jurisdiccional respectiva para su ejecución, quien deberá despachársela sin mayores requisitos, salvo que el convenio conciliatorio sea contrario a derecho; ello independientemente de la sanción administrativa que sea aplicable por el incumplimiento.\nCAPITULO VII\nDE LOS PROCESOS JUDICIALES POR HECHOS\nQUE IMPORTEN VIOLENCIA FAMILIAR\nArtículo 76. Quien sufra violencia familiar en cualquiera de las modalidades previstas por el artículo 10, fracción III de esta ley, podrá denunciar el hecho en forma verbal o escrita, ante el Juez en materia\nFamiliar que sea competente en razón del territorio.\nEn los lugares donde no resida Juez en materia Familiar, los Jueces de Primera Instancia en materia\nCivil, asumirán plenamente la competencia de aquellos para la recepción de la denuncia, el conocimiento de los hechos y la resolución del conflicto.\nArtículo 77. Cuando el afectado fuere menor de edad, persona de capacidad diferente o de la tercera edad, los hechos deberán ser denunciados por sus representantes legales, por el Ministerio Público, por el Procurador de la Familia, por sus Delegados o por quienes presidan las Unidades de Atención.\nTambién estarán obligados a efectuar esta denuncia los encargados de los servicios asistenciales, sociales o educativos, públicos o privados, los profesionales de la salud y todos los funcionarios públicos en razón de su labor, cuando el caso de violencia familiar de que tengan conocimiento, por su gravedad, amerite la intervención jurisdiccional.\nArtículo 78. Los procesos en los casos de violencia familiar se tramitarán en la forma y términos previstos por el Código Procesal Civil del Estado.\nCAPITULO VIII\nMEDIOS DE IMPUGNACION\nArtículo 79. El recurso de revisión, del que conocerán los Delegados de la Procuraduría de la Familia, las resoluciones que importen la imposición de multas superiores a 60 días de salario mínimo general vigente en la capital del Estado, arresto administrativo, caución de no ofender o prohibición de ir a determinado lugar o residir en él.\nArtículo 80. La interposición del recurso solo tendrá efectos suspensivos:\nI. Cuando se impugnen las multas impuestas, siempre que se garantice su importe, mediante depósito, fianza, prenda o hipoteca.\nII. Cuando se imponga la sanción de arresto administrativo, a condición de que se otorgue caución bastante que asegure la disponibilidad del recurrente para cumplir el arresto decretado, en caso de que se confirme la resolución en que se impuso.\nArtículo 81. El recurso de revisión se interpondrá por conducto del titular de la Unidad de Atención que haya conocido del procedimiento. El término para hacerlo valer será de tres días, contados desde el día siguiente en que se haga saber la resolución al afectado.\nArtículo 82. Interpuesta la revisión por escrito en el que se expresarán agravios y decretada la suspensión en los casos que proceda; se remitirán las actuaciones al Delegado de la Procuraduría de la\nFamilia, competente por razón de territorio, dentro de las 24 horas siguientes para su resolución. La parte contraria podrá adherirse a la revisión o formular alegatos dentro de igual término, en cuyo caso se remitirán con las demás constancias.\nArtículo 83. El Delegado de la Procuraduría de la Familia calificará la procedencia del recurso y acto seguido dentro de los tres días siguientes lo resolverá de plano.\nArtículo 84. En los casos de las resoluciones dictadas por los Jueces de Primera Instancia en materia\nFamiliar, los recursos procedentes serán los que establece el Código Procesal Civil del Estado y de ellos conocerán las autoridades judiciales en los términos de la Ley Orgánica del Poder Judicial del Estado.\nTITULO CUARTO\nMEDIDAS ALTERNAS E INFRACCIONES Y SANCIONES\nEN LOS CASOS DE VIOLENCIA FAMILIAR\nCAPITULO I\nMEDIDAS ALTERNAS\nArtículo 85. En los casos en que se considere que una persona es generadora de violencia familiar, sea por la vía administrativa o jurisdiccional, se les someterá al programa de terapia familiar aprobado por la\nJunta Directiva para la Prevención, Asistencia y Atención de la Violencia Familiar en el Estado. También podrá ordenársele, en su caso, participación concurrente en programas de rehabilitación por el consumo de alcohol u otras drogas.\nEl término de los programas se fijará tomando en consideración los resultados de las terapias, previa evaluación.\nArtículo 86. Si la persona generadora de la violencia se haya sujeta a un proceso civil o penal ante la autoridad jurisdiccional por haber incurrido en hechos de violencia familiar que no se estimen graves; podrá suspenderse dicho proceso si así lo solicita el interesado o su defensor, previo acuerdo del\nMinisterio Público, a condición de que dicha persona convenga en asistir al programa de terapia familiar\nSi durante el desarrollo del o de los programas, la persona no viola ninguna de las condiciones impuestas y acredita que se ha sometido rigurosamente al tratamiento y se ha beneficiado del mismo, según evaluaciones que así lo acrediten; podrá sobreseerse la causa.\nEste beneficio, solo podrá utilizarse una vez, por lo que si el beneficiado vuelve a incurrir en hechos de violencia familiar el proceso o procedimiento que se le instruya, según sea el caso, deberá llevarse hasta sus últimas consecuencias, con aplicación de la sanción que corresponda, que en todo caso deberá ser agravada, en virtud de la reincidencia.\nArtículo 87. Las personas receptoras de violencia familiar, podrán recibir los tratamientos que se estimen adecuados para superar las secuelas físicas y psíquicas que se le hayan originado por el maltrato.\nLas autoridades competentes se encargarán de canalizarlas a las instituciones especializadas en esos tratamientos.\nCAPITULO II\nINFRACCIONES Y SANCIONES\nArtículo 88. Se considerarán infracciones a la presente ley:\nI. No asistir sin causa justificada a los citatorios que formulen las autoridades competentes.\nII. El incumplimiento al convenio derivado de los procedimientos de mediación y conciliación.\nIII. El incumplimiento a la resolución de la amigable composición a la que se sometieron las partes de común acuerdo.\nIV. Los actos de violencia familiar señalados en el artículo 10, fracción III de esta ley, que no estén previstos como delito por el Código Penal.\nArtículo 89. Las sanciones aplicables a las infracciones previstas en el artículo anterior serán:\nI. Multa de 30 a 180 días de salario mínimo general vigente en la capital del Estado al momento en que se cometa la infracción.\nSi el infractor fuese jornalero, obrero o trabajador no asalariado, la multa será equivalente a un día de su jornal, salario o ingreso diario.\nII. Arresto administrativo inconmutable, hasta por treinta y seis horas.\nArtículo 90. Se sancionará con multa de 30 a 90 días de salario mínimo general vigente en la capital del\nEstado, por el incumplimiento de la fracción I, del artículo 88, que se duplicará en caso de conducta reiterada. se sancionarán con multa de 90 a 180 días de salario mínimo general vigente en la capital del Estado, y en todo caso se procederá conforme a lo previsto en el artículo 75 de esta ley.\nArtículo 91. La infracción prevista en la fracción IV del artículo 88, se sancionará con multa hasta de 30 a\n180 días de salario mínimo general vigente en la capital del Estado.\nLa reincidencia se sancionará con arresto administrativo inconmutable por 36 horas.\nArtículo 92. Para la acreditación de las infracciones o de la reincidencia a que hacen mención los artículos anteriores, se citará nuevamente a las partes para que éstas manifiesten lo que a su derecho convenga, antes de que quienes median, concilien o intervengan como amigables componedores sancionen dicho incumplimiento sin dar oportunidad a acreditar alguna causa de justificación.\nArtículo 93. Independientemente de las multas impuestas por las infracciones previstas en las fracciones II, III y IV del artículo 88 de esta ley, se exigirá al autor de la violencia, caución de no ofender, cuyo monto fijará la autoridad del conocimiento según su prudente arbitrio, y en atención a las circunstancias del caso, sin que pueda exceder de 500 veces el salario mínimo vigente en la capital del\nEstado y por un término no mayor de un año.\nAl que no otorgue la caución de no ofender, podrá sujetársele a proceso penal por el delito de desobediencia al mandato de una autoridad.\nArtículo 94. En los casos de violencia familiar demostrada, se podrá aplicar al responsable la prohibición de ir al lugar determinado o de residir en él, bajo las siguientes modalidades:\nI. Exclusión del hogar conyugal o de la pareja del autor de la violencia familiar, si se advierte que la continuación de la convivencia implica un riesgo para la integridad física y psíquica del que ha sido víctima de dicha violencia.\nII. A solicitud del afectado, disponer su reintegro al hogar del que debió salir en razón de los hechos violentos, excluyéndose en tal supuesto de dicha vivienda al agresor.\nIII. Prohibir a petición del receptor de la agresión, el acceso del agresor a los lugares donde habitualmente concurre, el afectado como son las instituciones educativas o los centros de trabajo.\nArtículo 95. Las medidas a que se refiere el artículo anterior, por cuanto a su duración, no podrán exceder del término de 6 meses, sin que se justifiquen mediante resolución judicial por mayor tiempo.\nArtículo Primero. La presente ley entrará en vigor, noventa días después de su publicación en el\nPeriódico Oficial del Estado.\nArtículo Segundo. A partir de esa fecha, queda abrogada la Ley de Asistencia y Atención para la\nPrevención de la Violencia Intrafamiliar, publicada en el Periódico Oficial del Estado del 7 de enero de\n1997 y derogadas todas las disposiciones que sean contrarias a la misma.\nArtículo Tercero. El Consejo Estatal, la Junta Directiva y los Consejos Regionales a los que alude esta ley, deberán quedar instalados dentro de los treinta días siguientes a la fecha en que entre en vigor.\nArtículo Cuarto. Un mes después de su instalación, la Junta Directiva, formulará el Reglamento de las\nUnidades de Atención, para someterlo a la aprobación del Consejo Estatal para la Prevención, Asistencia y Atención de la Violencia Familiar.\nArtículo Quinto. La Secretaría de Gobierno, por conducto de la Dirección del Registro Civil, dispondrá la instrumentación necesaria para el asiento registral de los hechos generadores de violencia familiar, con las características que dispone esta ley.\nArtículo Sexto. La Procuraduría General de Justicia tendrá la obligación de instalar las Agencias\nSexuales, en un plazo que no será mayor a los 30 días anteriores a la fecha en que entre en vigor esta\nLey.\nArtículo Séptimo. La Junta Directiva, a través de la Procuraduría de la Familia, en base al Reglamento a que se refiere el artículo cuarto transitorio, deberá instalar las Unidades de Atención para la Prevención, Asistencia y Atención de la Violencia Familiar, quince días antes de la fecha en que entre en vigor esta\nLey. dieciséis días del mes de abril del año dos mil dos.\nDIPUTADA PRESIDENTA\nNORMA VIOLETA DAVILA SALINAS\nDIPUTADA SECRETARIA DIPUTADO SECRETARIO\nROXANA CUEVAS FLORES JESUS ZÚÑIGA ROMERO\nIMPRIMASE, COMUNIQUESE Y OBSERVESE.\nEL GOBERNADOR DEL ESTADO\nLIC. ENRIQUE MARTINEZ Y MARTINEZ\nEL SECRETARIO DE GOBIERNO\nLIC. JOSE JESÚS RAUL SIFUENTES GUERRERO\nEL SECRETARIO DE EDUCACIÓN PUBLICA\nPROF. HUMBERTO MOREIRA VALDÉS\nLA SECRETARIA DE SALUD\nDRA. BERTA C. CASTELLANOS MUÑOZ.\nEL SECRETARIO DE DESARROLLO SOCIAL\nLIC. HORACIO DEL BOSQUE DÁVILA\nN. DE E. A CONTINUACION SE TRANSCRIBEN LOS ARTICULOS TRANSITORIOS DE LOS DECRETOS DE REFORMAS A LA\nPRESENTE LEY.\nSEGUNDO. Las dependencias y entidades que actualmente ejecutan funciones que mediante el presente Decreto se transfieren a la Secretaría de Gobierno, contarán con un término de 30 días hábiles para adecuar los manuales de organización y demás procedimientos administrativos necesarios para el cumplimiento de lo previsto en este Decreto.\nTERCERO. Se otorga un plazo de 30 días hábiles para que se lleven a cabo las reformas y adecuaciones a las disposiciones reglamentarias que correspondan.\nCUARTO. Se derogan todas las disposiciones legales y reglamentarias que se opongan al presente Decreto.",
  "ordenamiento": "REGLAMENTO",
  "jurisdiccion": "COAHUILA",
  "fuente_oficial": "DIARIO OFICIAL DE LA FEDERACION",
  "Fecha de Publicación": "25 de octubre de 2002",
  "ULTIMA REFORMA PUBLICADA": "15 DE ENERO DE 2008",
  "es_escaneado": false,
  "tiene_tablas": false,
  "materia": [
    "civil"
  ]
}