{
  "titulo": "Ley de Ejecución de Sanciones Privativas y Restrictivas de la Libertad para el Estado de Coahuila",
  "Contenido": "LIBERTAD PARA EL ESTADO DE COAHUILA.\nEL C. ENRIQUE MARTÍNEZ Y MARTÍNEZ, GOBERNADOR CONSTITUCIONAL DEL\nESTADO INDEPENDIENTE, LIBRE Y SOBERANO DE COAHUILA DE ZARAGOZA,\nA SUS HABITANTES SABED:\nQUE EL CONGRESO DEL ESTADO INDEPENDIENTE, LIBRE Y SOBERANO DE\nCOAHUILA DE ZARAGOZA;\nDECRETA:\nNÚMERO 520.LEY DE EJECUCIÓN DE SANCIONES PRIVATIVAS Y RESTRICTIVAS\nDE LA LIBERTAD PARA EL ESTADO DE COAHUILA.\nTITULO PRIMERO\nDE LA LEY Y SU APLICACIÓN\nCAPÍTULO ÚNICO\nPRINCIPIOS GENERALES\nARTÍCULO 1°. Esta ley tiene por objeto la ejecución de las sanciones privativas y restrictivas de la libertad impuestas por los Tribunales del Estado de Coahuila de\nZaragoza, en sentencia que haya causado ejecutoria y la determinación del sistema, que en lo conducente, resulte aplicable a las personas sujetas a prisión preventiva.\n(REFORMADO, P.O. 15 DE ENERO DE 2008)\nARTÍCULO 2°. El cumplimiento de esta ley corresponde al Ejecutivo del Estado, por\nReadaptación Social y Dirección de Ejecución de Sentencias, dependientes de la\nARTÍCULO 3°. La ejecución de las sanciones privativas y restrictivas de la libertad tiene por objeto, cumplir un mandamiento emanado de autoridad jurisdiccional, y la readaptación social del sentenciado.\nARTÍCULO 4°. La readaptación social del sentenciado será mediante un sistema progresivo, técnico e individualizado, que tendrá como bases la disciplina, el trabajo, la capacitación para el mismo y la educación.\nARTÍCULO 5°. El Ejecutivo del Estado podrá celebrar con los diferentes ayuntamientos del estado, los convenios que estime necesarios para la exacta aplicación de esta ley.\nAsimismo, podrá celebrar con la federación los convenios de coordinación que fueren necesarios para la aplicación de las leyes de la materia.\nARTÍCULO 6°. El sitio que se destine para el internamiento de procesados será distinto que ameriten tratamiento especializado, como los enfermos, adultos mayores o discapacitados. Los procesados quedarán sujetos al régimen interno general establecido por la presente ley, así como al régimen interno particular que se establezca para el centro en que se encuentren. Se aplicarán a los procesados, en lo conducente con las limitaciones que imponga su específica situación jurídica, las normas previstas en esta ley para el sistema de readaptación.\nTITULO SEGUNDO\nDE LOS ÓRGANOS Y MEDIOS DE EJECUCIÓN\nCAPÍTULO PRIMERO\nDE LA DIRECCIONES DE READAPTACIÓN SOCIAL\nY DE EJECUCIÓN DE SENTENCIAS\nARTÍCULO 7°. Son atribuciones de la Dirección de Readaptación Social las siguientes:\nI. Organizar y dirigir los Centros de Readaptación Social a que se refiere el artículo\n18 de esta ley así como controlar la administración de los mismos.\nII. Con base en esta ley y conforme a las normas técnicas que estime pertinentes, planificar y hacer ejecutar los regímenes de estudio y diagnóstico, trabajo, educación y disciplina, tendientes a lograr la readaptación social de los internos.\n(REFORMADA, P.O. 15 DE ENERO DE 2008)\nIII. Proponer al Ejecutivo del Estado, los nombramientos, destituciones y autorización conducto del Secretario de Gobierno.\nIV. La distribución o traslado de toda persona que sea privada de su libertad por orden de los Tribunales Judiciales del Estado, desde el momento de su ingreso a\n720 del Código de Procedimientos Penales para el Estado; así como por corporaciones federales cuándo sea necesario.\nV. Conocer, investigar y resolver las quejas de los internos respecto al trato de que a las autoridades respectivas;\nVI. Coadyuvar con el Patronato para el Fomento de la Industria Penitenciaria y la desempeño de sus funciones;\nVII. Crear, organizar y administrar el Registro de Internos.\nVIII. Confeccionar las estadísticas penales del estado y con base en sus resultados, proponer al Ejecutivo del Estado, la adopción de las medidas que estime pertinentes para la prevención general de la delincuencia y la represión del delito;\nIX. Las demás señaladas por ésta u otras leyes y los reglamentos aplicables.\nARTÍCULO 8°. Son atribuciones de la Dirección de Ejecución de Sentencias las siguientes:\nI. Proponer al Ejecutivo del Estado, los proyectos de reglamentos necesarios para la aplicación de la presente ley.\nII. Resolver sobre la aplicación del tratamiento semi-institucional de preliberación.\nIII. Someter a la consideración del Gobernador del Estado para su resolución, los expedientes integrados con motivo de las solicitudes de indulto; de la modificación de la sanción por incompatibilidad; de libertad preparatoria y remisión parcial de la sanción.\nIV. Coadyuvar con el Patronato para el Fomento de la Industria Penitenciaria y la\nReincorporación de Liberados y Externados del Estado de Coahuila en el desempeño de sus funciones.\nV. Crear, organizar y administrar el Servicio de Identificación Judicial del Estado.\nVI. Determinar, considerando las opiniones y sugerencias que emitan los Consejos\nTécnicos Interdisciplinarios, el beneficio que en su caso, se otorgará a cada interno que lo solicite, de conformidad al grado de readaptación que se hubiere obtenido.\nVII. Integrar el Archivo General de Internos.\nVIII. Proporcionar la información sobre antecedentes o no antecedentes penales solicitados por autoridades y personas, previos los trámites reglamentarios.\nARTÍCULO 9. La Dirección de Readaptación Social contará con un Director y un\nSubdirector, los cuales deberán contar con título de licenciado en Derecho o de alguna licenciatura afín al penitenciarismo. Dicha Dirección contará con el personal jurídico, técnico y administrativo que determine el Presupuesto de Egresos del Estado.\nARTÍCULO 10. La Dirección de Ejecución de Sentencias contará con un Director y un\nSubdirector, quienes deberán ser licenciados en derecho, preferentemente especializados en alguna ciencia afín al penitenciarismo. Dicha Dirección contará con el personal jurídico, técnico y administrativo que determine el Presupuesto de Egresos del\nEstado.\nARTÍCULO 11. La Dirección de Ejecución de Sentencias dispondrá de un\nDepartamento de Ejecución de Sentencias en Libertad que tendrá a su cargo la vigilancia de los sentenciados a quienes se les haya suspendido la ejecución de una condena y a los sujetos a la vigilancia de la autoridad.\nPara los efectos y el cumplimiento del presente artículo, la Dirección de Ejecución de\nSentencias se auxiliará de los ayuntamientos a través de la Dirección de Seguridad\nPública Municipal, la que deberá proporcionar la información necesaria sobre aquellas personas que se encuentren gozando de algún beneficio y hayan incurrido en alguna falta administrativa conforme al reglamento municipal respectivo.\nARTÍCULO 12. El Registro de Internos en el Estado tendrá por objeto llevar un control permanente de todas las personas que se encuentren recluidas en los Centros de\nReadaptación Social en el Estado, en su carácter de procesados o sentenciados, por delitos del orden común o federal; así como además de las personas que hayan obtenido su libertad provisional bajo caución en ambas jurisdicciones, además de aquellos que se encuentren gozando de algún beneficio o sustitutivo penal.\nARTÍCULO 13. La finalidad del Registro de Internos es:\nI. Determinar, en su caso, la distribución y traslado de los internos; canalizar las peticiones y quejas de los mismos con motivo del retraso en los términos constitucionales de los procesos y confeccionar las estadísticas penales de la entidad para proponer al Gobernador del Estado, la adopción de medidas de prevención de la delincuencia y represión del delito;\nII. Agilizar los trámites y resoluciones sobre el tratamiento semi-institucional de preliberación;\nIII. Integrar y tramitar con mayor celeridad los expedientes con motivo de las solicitudes de indulto, modificación de la sanción por incompatibilidad, libertad preparatoria y remisión parcial de la sanción.\nARTÍCULO 14. Para los efectos de los artículos anteriores, la Dirección de Ejecución de Sentencias integrará un Archivo General de Internos, formando un expediente para cada uno de los procesados y sentenciados del orden común o federal, que se encuentren en cada establecimiento, el cuál deberá contener, según el caso:\nI. Copia del Oficio que determine la detención legal.\nII. Copia del auto de formal prisión o reporte del mismo por parte del Director del\nCentro respectivo, auto de libertad así como orden expedida por el Director del resolver la situación jurídica del interno.\nIII. Copia de la ficha de identificación de los procesados.\nIV. Copia del estudio clínico-criminológico.\nV. Copia del auto en el cuál se concede la libertad provisional bajo caución o reporte de lo anterior por parte del Director del Centro respectivo.\nVI. Copia de los estudios a que se refiere el artículo 28 de esta ley, practicados al interno por el Consejo Técnico Interdisciplinario, cuando ésta exista en el Centro respectivo.\nVII. Copia de la resolución pronunciada en el incidente de desvanecimiento de datos.\nVIII. Copia del auto de sobreseimiento.\nIX. Copias de las sentencias de primera y segunda instancia o, en su defecto, del auto en que se declare ejecutoriada la de primera.\nX. Copia del auto donde se pone al interno a disposición del Ejecutivo del Estado, o reporte del mismo.\nXI. Copia de la actualización de los estudios de personalidad que se practiquen al interno.\nXII. Copia de los estudios de grado de readaptabilidad cuando exista conforme a las disposiciones de la presente ley la posibilidad de otorgarle algún beneficio.\nXIII. Reporte de los actos de indisciplina por parte del interno o de inobservancia de las disposiciones de esta ley, de los reglamentos o de las circulares giradas por la\nDirección de Readaptación Social.\nXIV. Reporte de las medidas de estímulo otorgadas a los internos;\nXV. Copia del oficio de señalamiento del establecimiento en que debe compurgar el federal;\nXVI. Reporte, en su caso, de intento de evasión o de la consumación de la misma;\nXVII. Copia o reporte, en su caso, del auto en que se admita la demanda de amparo;\nXVIII. Copia o reporte, en su caso, de la resolución en donde se sobresee, niega o concede el amparo; y\nXIX. Copia de la resolución donde se autorice, en su caso, el tratamiento semiinstitucional de preliberación o de condena condicional. penales, cartas u oficios a que se refiere el artículo 122 de la Ley de Seguridad Pública del Estado.\nARTÍCULO 15. Para dar debido cumplimiento a lo dispuesto en el artículo anterior, el\nTribunal Superior de Justicia del Estado acordará lo pertinente para que se hagan llegar a la Dirección de Ejecución de Sentencias, las resoluciones judiciales a que se hace alusión en el artículo anterior. Con igual propósito, la Dirección de Ejecución de\nSentencias solicitará a las autoridades federales competentes la colaboración necesaria.\nARTÍCULO 16. El Servicio de Identificación Judicial del Estado tendrá por objeto proporcionar a las autoridades que competa, previa solicitud por escrito, los antecedentes de los internos; llevar un control de las personas sujetas a libertad vigilada con motivo del tratamiento semi-institucional, de preliberación, condena condicional o libertad preparatoria e integrar las estadísticas penales de la entidad.\nARTÍCULO 17. El Servicio de Identificación Judicial en el Estado se generará con base en los expedientes integrados con motivo del Registro de Internos, a los que se agregará la resolución en la que se declare en absoluta libertad, o aquella en que se hubiere concedido alguno de los beneficios previstos en las leyes o, en su caso, el reporte de evasión correspondiente.\nCAPÍTULO SEGUNDO\nDE LOS CENTROS DE READAPTACIÓN SOCIAL\nARTÍCULO 18. Los Centros de Readaptación Social se destinarán al internamiento de indiciados, procesados y sentenciados del fuero común y federal. judicial.\nARTÍCULO 19. Los Centros de Readaptación Social del Estado contarán con las instalaciones siguientes, siempre y cuando las condiciones de infraestructura así lo permitan:\nI. Locales para escuelas de alfabetización, así como bibliotecas, las que deberán estar a cargo de personal capacitado en la materia.\nII. Locales para talleres.\nIII. Un área de hospital y/o enfermería para atender problemas o complicaciones en la salud de los internos.\nIV. Un área de guardería.\nV. Un área de infectocontagiosos.\nVI. Un área de psiquiatría.\nVII. Un área de desintoxicación.\nVIII. Un área de usos múltiples destinada a funciones de cine, de teatro y festividades colectivas.\nIX. Comedores en cada uno de los pabellones.\nX. Un pabellón especial donde se practique la visita íntima, con discreción, previa autorización de los departamentos médico, psicológico y de trabajo social;\nXI. Locutorios donde los internos reciban las visitas de defensores y las visitas extraordinarias de parientes y amigos que sean autorizados, según los reglamentos y en las condiciones de seguridad y de tiempo que se determinen.\nXII. Instalaciones para la realización de actividades deportivas.\nXIII. Dormitorios generales y especiales, y\nXIV. Todas aquellas que resulten necesarias.\nARTÍCULO 20. Las mujeres sentenciadas serán internadas en instituciones destinadas especialmente para ellas, o en su defecto, en secciones especiales de los establecimientos, pero siempre separadas de los hombres.\nARTÍCULO 21. Las internas con hijos podrán retenerlos consigo hasta que cumplan su familiar que pueda hacerse cargo del menor, podrán solicitar su asilo en las instituciones autorizadas para tal efecto, a fin de que permanezcan en las mismas durante la estancia de la interna.\nARTÍCULO 22. Por ningún motivo se dará entrada a las instituciones a que se refiere este capítulo, a menores infractores; éstos deberán ser internados, en su caso, en los centros especializados que previenen las leyes respectivas.\nARTÍCULO 23. En el caso de que en los Centros de Readaptación Social del Estado se encuentren recluidos enfermos mentales o inimputables, éstos, con base en los convenios celebrados, deberán ser trasladados a instituciones especializadas.\nSECCIÓN PRIMERA\nDEL RÉGIMEN INTERNO Y DEL PERSONAL PENITENCIARIO.\nSUBSECCIÓN PRIMERA\nDEL RÉGIMEN INTERNO\nARTÍCULO 24. Las disposiciones relativas a la organización y régimen interno de los\nCentros de Readaptación Social estarán contenidas en los reglamentos respectivos que emanen de esta ley, así mismo, en circulares suscritas por la Dirección de\nReadaptación Social para ser acatadas por los Directores y demás personal de los establecimientos, y en lo concerniente serán dadas a conocer a los internos desde su ingreso. Para los efectos anteriores, se estará a los lineamientos generales que se especifican en el presente título.\nARTÍCULO 25. Toda persona, al momento de quedar recluida en un establecimiento penitenciario, será examinada y valorada por el médico de la institución o en su defecto por el médico del sector salud de la localidad correspondiente, ello con el fin de conocer su estado de salud. De lo anterior se deberá dejar constancia en el expediente respectivo.\nEn caso de que la valoración médica así lo indique, se le suministrará la atención médica correspondiente. De igual forma, se procurará conocer sus necesidades vitales para satisfacerlas en la medida que lo permita la capacidad del establecimiento.\nARTÍCULO 26. En todo establecimiento destinado a procesados y sentenciados, se llevará al día un libro de registro estampado y foliado. Dicho libro deberá contener: a. La identificación de los procesados o sentenciados, mediante la asignación antropométrica y en su caso, la ficha dactiloscópica. b. Los datos fundamentales de los actos de mayor importancia que sean comunicados por la autoridad judicial que conociere del caso; y c. El día y la hora, el motivo de su ingreso y salida y la autoridad que lo dispuso.\nLa identificación a que se refiere el inciso a de este artículo, no tendrá otro objeto que el de facilitar la búsqueda de los antecedentes de los procesados. En todo caso, se correspondiente.\nARTICULO 27. Los horarios generales de actividades de los internos en que se prevea el trabajo, la educación, las actividades deportivas, las actividades artísticas y culturales y otros, serán determinados por los reglamentos de los Centros de Readaptación Social respectivos.\nARTÍCULO 28. Dictado el auto de formal prisión, se procederá de inmediato a practicar el estudio integral de la personalidad del sujeto. Dicho estudio será puesto en conocimiento del Juez instructor, quien para los efectos del artículo 71 del Código\nPenal, tendrá la obligación de valorarlo.\nARTÍCULO 29. Tanto quienes practiquen los estudios a que se refiere el artículo anterior, como el Juez instructor, deberán tener presente que el propósito de los mismos es conocer la personalidad del inculpado y obtener datos concretos para que se provea a la individualización de la pena, y, en su caso, a la suspensión de la misma, encontrándose absolutamente vedado utilizarlos como medio para obtener pruebas acerca de la comisión del delito o de la responsabilidad, salvo los casos en que de los mismos se entreviere la inimputabilidad del agente, en los cuales el Juez podrá decretar de oficio la ampliación de los estudios médicos, psicológicos y psiquiátricos.\nARTÍCULO 30. A los indiciados, procesados y sentenciados en general, se les concederán todas las facilidades razonables para comunicarse con sus defensores en horas hábiles conforme a las disposiciones contenidas en el reglamento interior del centro respectivo y con las restricciones derivadas de la seguridad del mismo.\nARTÍCULO 31. Tanto las personas y los vehículos que entren o salgan de algún centro de readaptación social, como los objetos que sean transportados por los mismos, quedarán sujetos a las medidas de revisión y registro establecidas en el reglamento interior del centro respectivo.\nARTÍCULO 32. Todo interno tiene derecho a comunicarse con sus familiares y otras personas, sujetándose al reglamento o a lo dispuesto por medio de las circulares pertinentes giradas por la Dirección Readaptación Social. Así mismo, los internos podrán enviar y recibir correspondencia, así como cualquier tipo de paquetes, los que podrán ser abiertos y supervisados por la Dirección del centro, de acuerdo a las disposiciones reglamentarias del mismo. La apertura de paquetes destinados a los internos la hará el Director o persona que él determine en presencia del interno, Readaptación Social.\nARTÍCULO 33. Los internos tienen derecho a ser recibidos en audiencia por funcionarios del reclusorio; trasmitir quejas o peticiones pacíficas y respetuosas a las autoridades del exterior, o exponerlas personalmente en las visitas que efectúen al establecimiento dichas autoridades.\nARTÍCULO 34. Los escritos y las solicitudes de audiencias que los internos dirijan a sus inmediatamente.\nARTÍCULO 35 Los internos podrán ejercitar libremente los derechos civiles de que no cumplimiento de la sanción, con el tratamiento dispuesto y con la seguridad y buen funcionamiento del establecimiento.\nARTÍCULO 36. A todo interno se le informará sin demora el fallecimiento o enfermedad grave de un pariente cercano. En estos casos, se podrá autorizar a los internos, cuando las circunstancias lo permitan, su salida temporal del respectivo Centro, con el fin de que ocurran al funeral o visiten al enfermo. Estas visitas siempre se realizarán con custodia.\nSi el fallecimiento o la enfermedad grave ocurre dentro de la jurisdicción del Centro, la autorización será emitida por el Director del mismo; en caso de que ocurra fuera de dicha jurisdicción, la autorización deberá ser otorgada por la Dirección de Readaptación\nSocial.\nARTÍCULO 37. Cuando el interno padezca de una enfermedad para cuyo tratamiento y curación sea indispensable su externamiento, el Director del Centro la podrá autorizar, siempre y cuando la atención vaya a ser recibida dentro de la jurisdicción del mismo; en caso contrario la autorización deberá ser emitida por la Dirección de Readaptación\nSocial.\nLa autorización se dará siempre y cuando se haya comprobado fehacientemente la existencia de la enfermedad, se realice en horas hábiles y previa expedición del certificado conducente por el médico del Centro o, en su defecto, por el médico del sector salud de la localidad. En estos casos, siempre se proveerá la custodia del externado, con las medidas de seguridad pertinentes.\nARTÍCULO 38. En los casos de enfermedad, cuya atención sea de notoria urgencia y exista la necesidad de trasladar al interno a alguna institución de salud, esta se hará bajo severas medidas de seguridad y la más estricta responsabilidad del personal de seguridad y custodia o quien se encuentre a cargo del Centro.\nARTÍCULO 39. Salvo lo previsto por los artículos anteriores, los Directores de los sentenciados, sino únicamente cuando lo ordene la Dirección de Readaptación Social o la autoridad a cuya disposición se encuentren.\nARTÍCULO 40. Se equipará al delito de evasión de presos y se aplicarán las penas señaladas en los artículos 243, 244 245 y demás relativos del Código Penal del Estado, internos sin acatar las normas legales y reglamentarias pertinentes, o sin contar con el consentimiento de la autoridad a cuya disposición se encuentren.\nSUBSECCIÓN SEGUNDA\nDEL PERSONAL PENITENCIARIO\nARTÍCULO 41. Los Centros de Readaptación Social estarán a cargo del personal directivo, administrativo, técnico y de custodia que fuere necesario de acuerdo con la capacidad de cada Centro.\nARTÍCULO 42. Para la mejor aplicación del sistema de readaptación, el personal penitenciario será idóneo y adecuado. Su elección se hará, tomando en cuenta la vocación, aptitudes, preparación académica y antecedentes personales.\nARTÍCULO 43. El personal penitenciario estará integrado por civiles.\nARTÍCULO 44. La custodia de las mujeres estará atendida exclusivamente por personal femenino, pero en el exterior del Centro o sección respectiva, se podrá contar con personal de custodia masculino. Excepcionalmente, en casos de fuerza mayor y bajo la estricta responsabilidad del encargado del establecimiento, podrán entrar varones a ese sector.\nARTÍCULO 45. El Director de cada establecimiento de readaptación social, deberá satisfacer los requisitos siguientes:\nI. Tener título de licenciado en Derecho o de alguna licenciatura afín al penitenciarismo.\nII. Ser persona honorable y mayor de 21 años.\nIII. Tener vocación en materia penitenciaria; y\nIV. No haber sido condenado por la comisión de delitos dolosos.\nARTÍCULO 46. El Director del Centro respectivo tendrá a su cargo el gobierno del establecimiento, el estricto cumplimiento de esta ley y del Reglamento del Centro de\nReadaptación Social de que se trate, debiendo cuidar, primordialmente, de la efectiva aplicación del sistema de readaptación; de la observancia del régimen interno; del medidas y órdenes legítimas que se acuerden por la Dirección de Readaptación Social.\nReadaptación Social, el traslado de internos a otro Centro, cuando con su estancia se vea afectada la seguridad y buen orden del Centro respectivo.\nARTÍCULO 47. Todos los integrantes del personal penitenciario quedarán sujetos a la obligación de asistir a los cursos de capacitación, formación y actualización sobre disciplinas penitenciarias, criminológicas y de relaciones humanas que establezca la\nDirección de Readaptación Social.\nEstudios de Seguridad Pública del Estado; dicho personal deberá sujetarse a lo dispuesto en el Reglamento de Agentes de Seguridad Penitenciaria del Estado, Centro.\nTITULO TERCERO\nDEL SISTEMA DE READAPTACIÓN\nCAPITULO PRIMERO\nREGLAS GENERALES\nARTÍCULO 48. Las disposiciones legales contenidas en esta ley y en los reglamentos internos de cada institución, serán aplicadas imparcialmente y por igual a todos los internos, según su específica situación jurídica.\nARTÍCULO 49. La privación de la libertad no tiene por objeto infringir sufrimientos físicos, ni humillar la dignidad personal. El sistema que se aplique estará exento de toda violencia corporal o psíquica.\nARTÍCULO 50. Las actas de nacimiento de los niños nacidos en las instituciones penitenciarias señalarán como domicilio el del padre, o en su defecto, el que tenía la madre antes de su detención.\nARTÍCULO 51. En los actos relativos al estado civil de los internos, se hará constar el domicilio anterior a su detención.\nARTÍCULO 52. Los dormitorios, en los Centro de Readaptación Social en el Estado, serán higiénicos, particularmente en lo que concierne al volumen del aire, superficie mínima, alumbrado y ventilación. Contarán con instalaciones sanitarias suficientes para que los internos puedan satisfacer sus necesidades naturales.\nARTÍCULO 53. La alimentación de los internos será basta y suficiente, de buena calidad y nutriológicamente balanceada.\nARTÍCULO 54. Para hacer más efectiva la aplicación de las normas contenidas en este título y de las correspondientes que se contengan en los reglamentos respectivos, la\nDirección de Readaptación Social podrá girar las circulares que estime pertinentes.\nCAPÍTULO SEGUNDO\nDEL CARÁCTER PROGRESIVO, TÉCNICO\nE INDIVIDUALIZADO DEL SISTEMA\nSECCIÓN PRIMERA\nPRINCIPIOS GENERALES\nARTÍCULO 55. El sistema de readaptación social tendrá carácter progresivo, técnico e individualizado, se aplicará a los sentenciados y, en lo conducente, a los procesados.\nConstará por lo que respecta a su desarrollo, de los períodos siguientes:\nI. Estudio y Diagnóstico.\nII. Tratamiento, y\nIII. Reintegración.\nCAPÍTULO TERCERO\nPERIODO DE ESTUDIO Y DIAGNÒSTICO\nARTÍCULO 56. El período de estudio y diagnóstico tiene por objeto conocer la personalidad del interno, su grado de readaptabilidad y formular su diagnóstico clínicocriminológico, para los efectos de la individualización del tratamiento.\nPara cumplir con los objetivos señalados en el párrafo precedente, el período de estudio y diagnóstico se desarrollará en la sección respectiva del Centro correspondiente y será realizado por el Consejo Técnico Interdisciplinario de la\nInstitución, que mantendrá trato directo y personal con el interno.\nPara los efectos del tratamiento, el Consejo determinará conforme a los estudios la asignación en celda y los regímenes de trabajo, educación y disciplina para cada interno.\nEl estudio integral de la personalidad del interno, se hará desde los puntos de vista médico, psicológico, criminológico, social, pedagógico, ocupacional y psiquiátrico, en su caso.\nARTÍCULO 57. En relación a cada interno, el Centro respectivo llevará un expediente al situación jurídica del mismo, pronunciadas por los tribunales y autoridades competentes que hayan conocido de su caso y se dividirá en las siguientes secciones:\nI. Sección Disciplinaria, donde se harán constar los antecedentes sobre su conducta, sanciones disciplinarias, estímulos y recompensas.\nII. Sección Médico-Psicológica, donde se incluirán los estudios que se realicen sobre el estado de salud física y mental del interno.\nIII. Sección Pedagógica, donde se consignará el grado de instrucción, comportamiento escolar, tipo de educación recibida, rendimiento escolar, la correspondiente, así como en su caso, los progresos y calificaciones obtenidas durante su estancia en el establecimiento.\nIV. Sección Ocupacional, donde se indicará su aptitud para el trabajo, así como las tiempo trabajado, su rendimiento y conducta en el trabajo, la habilidad laboral y el grado de capacitación para el mismo.\nV. Sección de Estudio Social, que incluirá el análisis de la relación del individuo con su entorno familiar y social, su diagnóstico y las evoluciones posteriores con base al tratamiento aplicado.\nCAPÍTULO CUARTO\nPERIODO DE TRATAMIENTO\nSECCIÓN PRIMERA\nDE LOS TIPOS DE TRATAMIENTO\nARTÍCULO 58. El tratamiento podrá ser de tres tipos: institucional, semi-institucional y en libertad.\nARTÍCULO 59. El tratamiento institucional implica un régimen básico que se aplicará dentro de los confines de un establecimiento penitenciario.\nARTÍCULO 60. El tratamiento semi-institucional de preliberación implica un régimen de semilibertad.\nARTÍCULO 61. El tratamiento en libertad implica un régimen condicionado de vida en la condena condicional.\nSUBSECCIÓN PRIMERA\nDEL TRATAMIENTO INSTITUCIONAL\nARTÍCULO 62. El régimen básico del tratamiento institucional se fundará primordialmente en medidas de trabajo, educación y disciplina dentro del establecimiento.\nEste tipo de tratamiento podrá complementarse con relaciones del exterior, actividades culturales, deportivas y recreativas que no impliquen externamiento.\nARTÍCULO 63. Para los efectos del artículo anterior, se estará a lo dispuesto por los capítulos relativos al trabajo, educación, disciplina y de relaciones con el exterior, contenidos en el presente título y de acuerdo a los reglamentos respectivos.\nARTÍCULO 64. La enajenación mental no suspende la ejecución de la sanción y solamente determina el cambio de lugar para la extinción de la pena. cayere en estado de enajenación mental, sea trasladado a la sección que para tal efecto se designe en el Centro o, bien, a una institución psiquiátrica.\nPRIMERA PARTE\nDE LA EDUCACIÓN\nARTÍCULO 65. Los procesados y sentenciados analfabetas o que no hubiesen concluido la enseñanza primaria y secundaria deberán seguir los cursos que correspondan en la escuela de la Institución. De acuerdo con lo anterior, toda persona que ingrese a un establecimiento de readaptación social será sometida, conforme al examen pedagógico que se le practique, al régimen educacional que corresponda, sea de alfabetización o de educación primaria y secundaria siendo éstos obligatorios.\nA los demás internos se les proporcionarán los medios necesarios para proseguir los estudios superiores adecuados a su vocación, si así lo solicitaren y fuere posible, pero en todo caso, desarrollarán regularmente actividades culturales.\nARTÍCULO 66. La educación que se imparta en los centros de readaptación social quedará a cargo, preferentemente, de maestros especializados. Dicha educación, además de tener un carácter académico, será también cívica, social, higiénica, artística, cultural, física y ética y estará encausada a la reforma moral del interno y a prepararlo para su reintegración a la sociedad. La educación que reciban los internos deberá estar encaminada a combatir la toxicomanía, el alcoholismo y cualquier otro vicio que degrade al individuo.\nARTÍCULO 67. Los certificados de estudios que se expidan con base en la educación impartida en los centros de readaptación social, no harán mención alguna de que fueron realizados en una institución penitenciaria.\nARTÍCULO 68. Los maestros que impartan educación en los centros de readaptación social, podrán, previa anuencia del Director del Centro, organizar conferencias, veladas literarias, representaciones teatrales, funciones de cine, conciertos y eventos deportivos; asimismo deberán organizar y administrar las respectivas bibliotecas.\nARTÍCULO 69. Tanto las autoridades penitenciarias como los maestros que impartan educación en los centros de readaptación social, deberán organizar eventos culturales y deportivos en los cuales los internos tomen parte activa. Para tal efecto, se fomentará la formación de grupos artísticos, culturales o deportivos entre los mismos. Estos grupos no podrán, bajo ninguna circunstancia, actuar fuera del establecimiento de readaptación social.\nARTÍCULO 70. Todos los internos a quienes su edad y condición física y mental se los permita, deberán disponer de cuando menos cinco horas a la semana para recibir educación física.\nSEGUNDA PARTE\nDEL TRABAJO\nARTÍCULO 71. El trabajo será un medio de readaptación para todos los internos, según su aptitud física y mental.\nARTÍCULO 72. El trabajo penitenciario es aquella labor desempeñada por el interno con materiales adquiridos por sus propios medios y cuya venta la realizará por sí o con ayuda de sus familiares. o amigos\nARTÍCULO 73. La industria penitenciaria es aquella labor desempeñada por el interno a favor de alguna industria o empresa privada. Por dicha actividad, los internos percibirán un sueldo conforme al convenio respectivo celebrado por la Empresa y el\nPatronato para el Fomento a la Industria Penitenciaria y la Reincorporación de\nLiberados y Externados para el Estado de Coahuila.\nARTÍCULO 74. En la organización del trabajo, se atenderá en primer lugar, al rendimiento económico, pero en todo caso se tendrá en cuenta, dentro de las posibilidades industriales o agrícolas del establecimiento, la vocación y aptitud de los internos. En caso de que los internos carecieran de conocimientos sobre algún arte u oficio, éstos deberán ser impartidos dentro del centro de readaptación social, ello con el objetivo de que puedan subvenir a sus necesidades.\nA los procesados y sentenciados se les estimulará con el trabajo, proporcionándoles en lo posible, los medios necesarios para la realización del mismo. En caso de que a los primeros se les dictase sentencia condenatoria, el tiempo que hayan trabajado se les tomará en consideración para los efectos de la remisión parcial de la sanción.\nARTÍCULO 75. Están exceptuados de trabajar: a. Los internos mayores de 60 años. b. Los impedidos física y mentalmente, y c. Las mujeres, durante las seis semanas anteriores al parto y en las seis siguientes al mismo. podrán dedicarse a la ocupación que elijan siempre que no fuere perjudicial a su salud.\nARTÍCULO 76. El trabajo, en sus diversas ramas, será planeado con sistemas administrativos y contables, de acuerdo con la capacidad de cada establecimiento, para lograr una mejor capacitación del interno, una mayor capacidad de producción y la autosuficiencia del establecimiento.\nARTÍCULO 77. La planeación a que se refiere el artículo anterior, se realizará previo estudio de la economía local, especialmente del mercado oficial, a fin de establecer la correspondencia entre las demandas de éstos y la producción penitenciaria. Para el efecto se procurará el auxilio de órganos, dependencias o instituciones especializadas.\nARTÍCULO 78. El trabajo de los internos será organizado y dirigido por la Dirección del\nCentro, pero podrá ser supervisado por la Dirección de Readaptación Social y en caso de la Industria Penitenciaria por el Patronato para el Fomento a la Industria\nPenitenciaria y la Reincorporación de Liberados y Externados para el Estado de\nCoahuila, para el efecto del exacto cumplimiento de las normas previstas en este\nCapítulo y las reglamentarias correspondientes.\nARTÍCULO 79. La Dirección de Readaptación Social cuidará que el monto de la remuneración del interno sea justo y proporcional al trabajo que desempeñe.\nARTÍCULO 80. En los Centros de Readaptación Social se adoptarán todas las medidas de higiene y seguridad para proteger la vida y la salud de los internos, según disponga la Ley Federal del Trabajo y la Ley Estatal de Salud.\nARTÍCULO 81. El trabajo de los internos deberá realizarse, en lo posible, bajo las condiciones y lineamientos del trabajo en el exterior y en las instalaciones que para tal efecto existan.\nARTÍCULO 82. Tratándose de internos que realicen actividades artísticas o intelectuales, éstas podrán ocupar el mayor tiempo laborable de acuerdo con los horarios establecidos, sin perjuicio del tratamiento a que estén sometidos.\nARTÍCULO 83. El interno se rotará de acuerdo con sus aptitudes en las diversas ramas de trabajo que existan en el establecimiento, para obtener una capacitación más amplia y una mayor posibilidad de aceptación en el exterior.\nARTÍCULO 84. Los internos contribuirán al sostenimiento de los Centros de desempeñen, con una cantidad que en ningún caso podrá exceder del 10% sobre el monto total de la misma. el Centro respectivo, se distribuirá en la forma siguiente: a. Un 50% para el sostenimiento de sus dependientes económicos; salvo en aquellos determine otro porcentaje. b. Un 10% para la constitución de su fondo de ahorros; y c. Un 40% para sus gastos menores.\nSi el interno no tiene dependientes económicos, la cuota respectiva formará parte del fondo de ahorros. fondo de ahorros, el cuál se depositará en cuenta bancaria a nombre del interno, siempre que sea posible y éste así lo solicite.\nARTÍCULO 85. Ningún interno podrá desempeñar funciones de autoridad o ejercer dentro del establecimiento, empleo o cargo alguno.\nTERCERA PARTE\nDE LA DISCIPLINA\nARTÍCULO 86. Tanto los internos como los integrantes del personal penitenciario, deberán sujetarse a lo dispuesto en esta ley, en el reglamento interno de cada establecimiento y a lo que disponga la Dirección de Readaptación Social, para el mejor desarrollo del sistema.\nARTÍCULO 87. En el reglamento interno de cada establecimiento de readaptación social, se harán constar clara y terminantemente las infracciones y las correcciones disciplinarias, así como los hechos meritorios y medidas de estímulo.\nARTÍCULO 88. A cada interno se entregará un instructivo donde aparezcan detalladamente sus derechos, deberes y en general, el régimen de vida en la institución.\nARTÍCULO 89. El Director de cada establecimiento, podrá imponer a los internos, las medidas disciplinarias que correspondan, sujetándose al reglamento interno del centro de readaptación social. El procedimiento, a través del cual se imponga las medidas disciplinarias, deberá respetar en todo caso la garantía de audiencia de los internos.\nExcepción hecha de la persuasión y amonestación, el interno podrá inconformarse por escrito, dentro de las 48 horas siguientes, con la corrección decretada, ante el Director, el interno en su defensa.\nEl acta a que se refiere el párrafo anterior se enviará dentro de las 24 horas siguientes\n48 horas. en tanto la Dirección de Readaptación Social la confirme, modifique, varíe o revoque.\nARTÍCULO 90. Las medidas disciplinarias podrán consistir:\nI. Persuasión o advertencia.\nII. Amonestación en privado.\nIII. Amonestación ante un pequeño grupo.\nIV. Exclusión temporal de ciertas diversiones.\nV. Exclusión temporal de actividades de entrenamiento y de práctica de deportes.\nVI. Cambio de labores.\nVII. Suspensión de comisiones honoríficas.\nVIII. Asignación de labores o servicios no retribuidos.\nIX. Reclasificación.\nX. Suspensión de visitas familiares.\nXI. Suspensión de visitas especiales.\nXII. Suspensión de la visita íntima.\nXIII. Aislamiento en celda propia o en celda distinta por no más de 30 días.\nXIV. Internamiento en otro Centro de Readaptación Social\nARTÍCULO 91. En todo centro de readaptación en el estado, no se empleará, contra los reclusos, más fuerza que la necesaria para reducir su rebeldía o resistencia a una orden basada en las normas legales.\nARTÍCULO 92. Los actos u omisiones que puedan ser constitutivos de falta disciplinaria, se comunicarán de inmediato al Director del establecimiento, sin perjuicio de que, en caso de notoria urgencia, el personal adopte por sí las medidas que racionalmente estime necesarias para garantizar el orden y la seguridad.\nARTÍCULO 93. Los internos de los centros de readaptación social en el estado podrán poseer cualquier objeto o artículo personal, siempre que no sea de los catalogados\nSocial.\nARTÍCULO 94. Los internos serán responsables del importe de los daños que en forma intencional causen a los bienes, útiles, herramientas e instalaciones del establecimiento; dicho importe será descontado, previa audiencia del responsable, por conducto de la Dirección correspondiente, con cargo a su fondo de ahorros si lo tuviere; denuncia correspondiente por los delitos que resulten.\nCUARTA PARTE\nDE LAS RELACIONES DE LOS INTERNOS CON EL EXTERIOR\nARTÍCULO 95. El tratamiento se complementará fomentando las relaciones positivas del interno con personas del exterior. El control de las mismas lo llevará la Dirección del establecimiento de readaptación social.\nARTÍCULO 96. Todos los internos (as) que acrediten estar casados legalmente tienen derecho a la visita íntima con su cónyuge. Sin embargo, para ser sujeto a este derecho, se deberá atender a los dictámenes que en materia medico-psicológicas y social emita el Consejo Técnico Interdisciplinario correspondiente.\nAdemás de los sujetos mencionados en el primer párrafo de este artículo, aquellas personas que acrediten ante el Consejo Técnico interdisciplinario tener una pareja estable, también podrán gozar de este derecho.\nPara los efectos de esta ley, se entiende por pareja estable aquella persona que haya vivido con el interno (a) públicamente sea como cónyuge sin estar casados o porque mantenía una relación sentimental pública, continua y lícita. En ambos casos, para tener derecho a la visita íntima, no debe existir ningún impedimento legal para que contrajesen matrimonio uno con otro.\nARTÍCULO 97. Los internos, de acuerdo con el reglamento respectivo, también tendrán derecho a la visita familiar, a la de otras personas cuya relación con éstos resulte\nARTÍCULO 98. Los horarios y condiciones en que tengan lugar las visitas anteriormente aludidas, se fijarán con precisión en los reglamentos internos de cada establecimiento.\nARTÍCULO 99. Para visitar a los internos de cualquier establecimiento, se requiere un permiso del Director o persona que lo sustituya, con excepción de los funcionarios judiciales en ejercicio de su cargo. Se podrán conceder visitas fuera de los días y horas reglamentarias cuando circunstancias especiales lo ameriten, a juicio de la Dirección del establecimiento.\nQUINTA PARTE\nDE LOS CONSEJOS TÉCNICOS INTERDISCIPLINARIOS\nARTÍCULO 100. Los Consejos Técnicos interdisciplinarios tendrán funciones consultivas para la aplicación individual del sistema progresivo, del tratamiento y de beneficios de los internos. Los Consejos Técnicos podrán sugerir a las autoridades ejecutivas de los Centros de Readaptación Social respectivos, las medidas de alcance general para la buena marcha de los mismos.\nARTÍCULO 101. Habrá un Consejo Técnico Interdisciplinario en cada Centro de\nReadaptación Social que estará presidido por el Director del establecimiento, o por el funcionario que lo sustituya en sus faltas, y se integrará con los miembros de superior jerarquía del personal administrativo, técnico y, en su caso de custodia.\n(REFORMADO, P.O. 15 DE ENERO DE 2008)\nEn los Centros en que no estén creados los Departamentos anteriores, el Consejo\nTécnico del Reclusorio se organizará con el Director del establecimiento o el funcionario que lo sustituya, el médico del sector salud que sea designado, un profesor que designe la Secretaría de Educación y Cultura en el Estado y el miembro de mayor jerarquía del personal de vigilancia. A falta de éstos funcionarios, con Consejeros Técnicos\nHonorarios designados por la Secretaría de Gobierno a propuesta de la Subsecretaría de Adaptación y Readaptación Social.\nARTÍCULO 102. La Dirección de Readaptación Social, podrá intervenir, cuando lo estime conveniente, en las sesiones de los Consejos, con objeto de supervisar su funcionamiento, teniendo derecho de voz pero no de voto.\nARTÍCULO 103. Entre los integrantes del Consejo Técnico, se designará un Secretario del mismo, quien elaborará la convocatoria que contendrá el orden del día a la que se ajustará la sesión del Consejo, misma que se dará a conocer a los demás integrantes, con la anticipación necesaria.\nDe manera ordinaria, las sesiones del Consejo Técnico interdisciplinario se efectuarán, por lo menos, una vez por semana. De manera extraordinaria, el Consejo podrá sesionar cuando así lo soliciten dos o más de sus miembros o, en su caso, a solicitud del Director del Centro, cuando las circunstancias así lo ameriten.\nARTÍCULO 104. Las sesiones del Consejo Técnico Interdisciplinario deberán realizarse a puerta cerrada en lugar destinado al efecto, no deberán ser interrumpidas sino por orden del día correspondiente.\nARTÍCULO 105. Durante la sesión del Consejo Técnico Interdisciplinario, el Director del\nCentro, en su carácter de Presidente del mismo, velará porque sus miembros guarden el orden y la compostura debidos, cuidando de que cada caso sea examinado por separado, debiendo proceder para ello de la siguiente manera:\nI. Harán uso de la palabra cada uno de sus integrantes, exclusivamente para exponer los datos que hayan sido recabados por su Departamento.\nII. Una vez que todos los integrantes hayan hecho su exposición, se aclararán las dudas que pudieran plantearse, cuando se aporten datos contradictorios o incompletos o haya diferencia en cuanto a la terminología empleada; se procederá luego a votación, en la cual deberá razonarse el voto cualquiera que sea el sentido en que se emita.\nIII. A fin de darle celeridad a las sesiones, el Presidente del Consejo no permitirá que se hagan consideraciones ajenas al caso objeto de examen; y\nIV. No se pasará al siguiente punto de la orden del día sino hasta que se haya agotado el que se está analizando.\nARTÍCULO 106. El Secretario del Consejo deberá levantar actas de las sesiones que éste celebre, haciendo constar la orden del día a la que se ajustó la sesión, el acuerdo tomado sobre cada caso concreto y las razones expuestas por cada uno de los integrantes al emitir su voto. Las actas deberán obrar en un libro que se llevará para ese efecto, a fin de que posteriormente el Director del Centro esté en posibilidad de expedir certificaciones de los acuerdos adoptados y dictámenes emitidos por el propio\nConsejo.\nARTÍCULO 107. Cuando a la Dirección del Centro le sea solicitado, por parte de la\nDirección de Readaptación Social, un dictamen del Consejo Técnico Interdisciplinario, deberá remitir copia certificada del acta de la sesión donde se haya emitido el dictamen respectivo, citándose el número de fojas del libro de actas en que aparece la misma y anexando copia de los estudios practicados por cada uno de los Departamentos, cuando éstos no los posea la Dirección de Readaptación Social.\nARTÍCULO 108. La Dirección deberá llevar una agenda con el objeto de que se revisen alguna sesión.\nSUBSECCIÓN SEGUNDA\nDEL TRATAMIENTO SEMI-INSTITUCIONAL\nPRIMERA PARTE\nDE LA PRELIBERACIÓN\nARTÍCULO 109. El tratamiento semi-institucional de preliberación tiene por objeto beneficio de los previstos en las leyes, tomando en cuenta las circunstancias particulares de cada caso.\nARTÍCULO 110. Para determinar si el interno está preparado para acceder al tratamiento semi-institucional de preliberación, se atenderá a la evolución de la personalidad y al grado de readaptabilidad que el interno haya alcanzado, según el criterio del Consejo Técnico Interdisciplinario.\nSerá la Dirección de Ejecución de Sentencias quien, atendiendo a lo establecido en el párrafo anterior, podrá determinar discrecionalmente la aplicación del mismo en todos los casos.\nARTÍCULO 111. El tratamiento semi-institucional de preliberación podrá comprender cualquiera de las medidas siguientes:\nI. Permiso de salida semanal con el fin de realizar alguna actividad productiva y con reclusión los días de fin de semana, en los cuales la reclusión podrá ser únicamente nocturna o durante todo el fin de semana.\nII. Permiso de salida semanal con el fin de realizar alguna actividad productiva y durante el fin de semana, la prestación de servicios en beneficio de la sociedad en los términos y condiciones establecidas por la Dirección de Ejecución de\nSentencias.\nIII. Traslado a una Institución Abierta.\nARTÍCULO 112. Compete exclusivamente a la Dirección de Ejecución de Sentencias, la concesión del tratamiento semi-institucional de preliberación, atendiendo a los estudios practicados por los Departamentos del Centro y la opinión del Consejo Técnico respecto a la evolución de la personalidad y al grado de readaptabilidad alcanzado por el interno.\nEn dicha opinión se deberá contener, además la medida específica que el Consejo estime recomendable. siguientes:\nI. Que el delito no sea calificado como grave por el Código de Procedimientos\nPenales vigente en el Estado, salvo aquellos casos en que atendiendo a la estudios practicados por el Consejo Técnico Interdisciplinario, a discreción de la\nDirección de Ejecución de Sentencias, puedan ser considerados para el otorgamiento de este tratamiento.\nII. Que haya observado buena conducta durante el tiempo de su reclusión; y\nIII. Que en el examen de personalidad se determine que está socialmente readaptado y en condiciones de no volver a delinquir. garantía sobre la misma; salvo en caso de que dicha reparación se encuentre en obtención del mismo; excepción hecha para el caso en que la autoridad judicial hubiere emitido la declaratoria de insolvencia.\nARTÍCULO 113. Para la concesión del tratamiento semi-institucional de preliberación, será siempre requisito indispensable la opinión favorable del Consejo Técnico\nInterdisciplinario y del Consejo Consultivo de Evaluación Ciudadana, pero desde un punto de vista formal, la base general para la aplicación de la medida que implique externamiento será el haber compurgado como mínimo el 50% de la pena que le hubiese sido impuesta por la autoridad judicial.\nEl término previsto en el párrafo anterior podrá, ampliarse hasta seis meses, previa opinión unánime de la Dirección de Ejecución de Sentencias y por el Consejo de\nEvaluación Ciudadana.\nAl cómputo para la aplicación del tratamiento de preliberación, podrá sumarse el de la remisión parcial de la sanción, cuando ésta haya sido concedida.\nARTÍCULO 114. El Director del Centro de Readaptación Social respectivo, será responsable de la vigilancia y supervisión de las medidas de tratamiento semiinstitucional de preliberación, para que éstas sean cumplidas en los términos de las autorizaciones correspondientes y, deberá informar periódicamente a la Dirección de\nEjecución de Sentencias, los resultados de las mismas. que disfrute, el Director del Centro de Readaptación Social deberá suspenderla y comunicarlo de inmediato a la Dirección de Ejecución de Sentencias. Si el incumplimiento fue injustificado, no podrá concederse la reanudación de la medida sino hasta por lo menos dos meses después de haberse verificado el incumplimiento, Dirección de Ejecución de Sentencias.\nSi el incumplimiento fue justificado, la Dirección de Ejecución de Sentencias podrá levantar la suspensión en cualquier tiempo.\nARTÍCULO 115. Los sujetos a tratamiento semi-institucional que no ocurran al Centro respectivo dentro de las 72 horas siguientes, contadas a partir del momento en que deban presentarse, según los términos de la medida otorgada, se les tendrá por evadidos para los efectos legales correspondientes, debiendo el Director del establecimiento comunicarlo de inmediato a la Dirección de Ejecución de Sentencias.\nARTÍCULO 116. Cuando el interno tenga dos o más sanciones, el cómputo para aplicar el término formal de la procedencia de la Preliberación, se hará sumando la totalidad de las mismas, siempre y cuando se trate de sanciones del fuero común, debidamente ejecutoriadas.\nARTÍCULO 117. El tratamiento semi-institucional de preliberación se sujetará a las condiciones siguientes:\nI. Que la persona semi-liberada se abstenga de ingerir bebidas embriagantes, de usar estupefacientes o sustancias de efectos análogos, salvo en los casos que su utilización obedezca a prescripción médica;\nII. Que la persona semi-liberada se abstenga de ocurrir a cantinas, bares, tabernas, cervecerías, billares, cabarets u otros sitios análogos;\nIII. Que cumpla en los términos y extensión con la medida otorgada; y\nI. Que mantenga su forma honesta de vivir.\nARTÍCULO 118. El tratamiento semi-institucional de preliberación se suspenderá de oficio si al semi-liberado se le instruye otro proceso, en cuyo caso volverá a la institución penitenciaria hasta en tanto no se dicte sentencia o se resuelva su situación jurídica sobre el mismo.\nARTÍCULO 119. El tratamiento semi-institucional de preliberación se revocará:\nI. Si el semi-liberado no cumple con las condiciones citadas en el artículo precedente.\nII. Cuando se observe que el semi-liberado guarda mala conducta familiar o social fuera de la Institución, aunque cuando ésta no sea delictiva.\nIII. Si el semi-liberado es condenado por nuevo delito mediante sentencia ejecutoria, en cuyo caso será de oficio la revocación.\nDirección de Ejecución de Sentencias se podrá conceder al semi-liberado una nueva oportunidad, amonestándole debidamente. En el caso de la fracción III, la Dirección de del sujeto que incurrió en el referido supuesto, por considerarlo reincidente.\nARTÍCULO 120. En relación a la fracción III del artículo 111 de este ordenamiento, el reincidentes, cuyos estudios de personalidad arrojen un grado de peligrosidad mínima, con salud mental y física óptimas, sin problemas victimológicos y sin adeudos en lo que se refiere a la reparación del daño, así como arraigo familiar en la entidad.\nAdemás de los requisitos señalados en el párrafo anterior, el interno deberá de solicitar a la Dirección de Ejecución de Sentencias su ingreso a la Institución Abierta, señalando por escrito que considera reunir tales requisitos, comprometiéndose a cumplir su tratamiento readaptatorio, así como respetar las leyes y demás ordenamientos vigentes en bien de la comunidad.\nARTÍCULO 121. En lo referente a la organización, funcionamiento, sanciones y medidas disciplinarias de las Instituciones Abiertas del Estado, éstos serán regulados por el reglamento que para tal efecto se expida.\nSEGUNDA PARTE\nDEL CONSEJO CONSULTIVO DE EVALUACIÓN CIUDADANA\nARTÍCULO 122. El Consejo Consultivo de Evaluación Ciudadana es un órgano plural, de apoyo técnico del Ejecutivo del Estado, cuyo objeto es el análisis y emitir opinión sobre la concesión o aplazamiento de la aplicación del tratamiento semi institucional de preliberación.\nLas bases para su integración, organización y funcionamiento se establecerán en el reglamento que para tal efecto expida el Ejecutivo del Estado.\nARTÍCULO 123. El Consejo Consultivo de Evaluación Ciudadana se integrará por:\nI. Un representante de la Comisión de Derechos Humanos del Estado.\nII. Un representante de los foros o colegios de abogados existentes en la región correspondiente.\nIII. Un representante de las facultades o escuelas de Derecho existentes en la región correspondiente.\nIV. Un representante de las instituciones religiosas que intervengan en los centros penitenciarios.\nV. Demás organismos no gubernamentales que tengan una estrecha relación con la función penitenciaria.\nVI. Los representantes del Sistema Penitenciario Estatal que determine el Ejecutivo del Estado.\nARTÍCULO 124. Son facultades de los miembros del Consejo Consultivo de Evaluación\nCiudadana las siguientes:\nI. Dar su opinión sobre la aplicación del tratamiento semi institucional de\nSentencias.\nII. Proponer, ante la Dirección de Ejecución de Sentencias, la integración de los expedientes, de aquellos internos que reúnan los requisitos mínimos necesarios para la aplicación del tratamiento semi-institucional de preliberación.\nIII. Para los casos que se establecen en los artículos 112 fracción I y 131 fracción I del presente ordenamiento, la Dirección de Ejecución de Sentencias podrá tomar en consideración la opinión que emita este consejo\nARTÍCULO 125. El Consejo Consultivo de Evaluación Ciudadana funcionará en las siguientes regiones:\nI. Región Sureste: Comprendiendo los Centros de Readaptación Social Femenil y\nVaronil de Saltillo, así como el Centro ubicado en Parras.\nII. Región Laguna: Comprendiendo los Centros de Readaptación Social de Torreón y\nSan Pedro de las Colonias.\nIII. Región Centro: Comprendiendo los Centros de Readaptación Social de Monclova y Sabinas.\nIV. Región Norte: Comprendiendo los Centros de Readaptación Social de Piedras\nNegras y Acuña.\nARTÍCULO 126. El Consejo sesionará, en forma ordinaria, por lo menos tres veces al año sin perjuicio de que se realicen las demás sesiones que se estimen necesarias, dejando a consideración de la Dirección de Ejecución de Sentencias la facultad para citar a dichas sesiones, en cuyo caso participarán el personal adscrito a la misma.\n(REFORMADO, P.O. 15 DE ENERO DE 2008)\nLas sesiones del Consejo serán presididas por el Subsecretario de Adaptación y ausencias.\nSe nombrará a un Secretario Ejecutivo de entre los mismos miembros del Comité, quien, de cada sesión del Consejo, deberá levantar acta de la misma, en la cual deberá quedar asentada las aprobaciones o aplazamiento de los beneficio propuestos, denegados los mismos, los acuerdos tomados en la sesión y deberá estar firmada por cada uno de los asistentes, debiendo entregarse copia de la misma a cada uno de los integrantes.\nARTÍCULO 127. Corresponde a la Dirección de Ejecución de Sentencias, la integración contenidos en la presente ley. Dichos expedientes quedarán a disposición de los\nSUBSECCIÓN TERCERA\nDEL TRATAMIENTO EN LIBERTAD\nARTÍCULO 128. Para los efectos de la aplicación del tratamiento en libertad, se estará a las disposiciones relativas a la libertad preparatoria; a los artículos 11 y 132 y al Título\nCuarto de esta ley.\nCAPÍTULO QUINTO\nDE LA REINTEGRACIÓN\nARTÍCULO 129. El período de reintegración implica tanto la reincorporación del interno a la sociedad como la plena recuperación de sus derechos que hubieren sido afectados con motivo de la sanción privativa o restrictiva de la libertad y se regirá conforme lo estipulan las disposiciones legales relativas al Indulto y liberación definitiva, así como también se estará a lo dispuesto por el Reglamento del Patronato para el Fomento de la\nIndustria Penitenciaria y la Reincorporación de Liberados y Externados del Estado de\nCoahuila.\nTÍTULO CUARTO\nOTRAS INSTITUCIONES DE READAPTACIÓN SOCIAL\nCAPÍTULO PRIMERO\nDE LA CONDENA CONDICIONAL\nARTÍCULO 130. Los sentenciados que obtengan su libertad, de conformidad con lo dispuesto en el artículo 77 del Código Penal del Estado, quedarán, durante el término de la sanción impuesta en la sentencia correspondiente, sujetos a la vigilancia de la\nDirección de Ejecución de Sentencias, a través del Departamento de Ejecución de\nSentencias en Libertad. Dicho Departamento podrá auxiliarse con la autoridad municipal del lugar en que resida el liberado.\nEl término al que se alude en el párrafo anterior, se computará a partir del día en que el sentenciado se acoja a la condena condicional.\nCAPÍTULO SEGUNDO\nDE LA LIBERTAD PREPARATORIA\nARTÍCULO 131. El Gobernador del Estado, de manera discrecional, podrá otorgar el cumplido las tres quintas partes de su pena, ello sí se trata de delito doloso, o la mitad de la misma, en caso de delito culposo, siempre y cuando satisfaga los requisitos siguientes:\nI. Que el delito no sea de los calificados como grave por el Código de\nProcedimientos Penales vigente en el Estado, salvo aquellos casos en que interno, según los estudios practicados por el Consejo Técnico Interdisciplinario, a discreción de la Dirección de Ejecución de Sentencias, puedan ser considerados para el otorgamiento de este beneficio.\nII. Que haya observado buena conducta durante el tiempo de su reclusión.\nIII. Que en el examen de personalidad que se le practique al sentenciado, se determine que está socialmente readaptado y en condiciones de no volver a delinquir; y\nIV. Que designe fiador y se cubra la fianza correspondiente.\nEn los casos en los que el sentenciado haya sido condenado al pago de la reparación del daño en cantidad líquida, será necesario que esta haya sido cubierta o bien, que se haya otorgado garantía sobre la misma, salvo en el caso de que dicha reparación se encuentre en cantidad ilíquida y no exista incidente de liquidación o no exista interés procesal para la obtención del mismo; excepción hecha para el caso en que la autoridad judicial hubiere emitido la declaratoria de insolvencia.\nARTÍCULO 132. Los internos que reúnan las condiciones previstas en el artículo 131 de esta ley, podrán solicitar por escrito, ante la Dirección de Ejecución de Sentencias, el beneficio de la libertad preparatoria.\nARTÍCULO 133. Para los efectos de este capítulo, la Dirección de Ejecución de\nSentencias recabará de oficio, la documentación pertinente, debiendo solicitar al duración; las actividades educativas y culturales en que haya participado; a la alfabetización y, en términos generales, cualquier estudio que estime necesarios para conocer su grado de readaptabilidad.\nARTÍCULO 134. Cuando el interno tenga dos o más sanciones, el cómputo para aplicar el término formal de la procedencia de la Libertad Preparatoria, se hará sumando la totalidad de las mismas, siempre y cuando se trate de sanciones aplicadas por autoridades del fuero común.\nARTÍCULO 135. La Dirección de Ejecución de Sentencias tomará en consideración los informes suministrados y someterá a consideración del Gobernador del Estado, por conducto de la Secretaría de Gobierno, a través de la Subsecretaría de Adaptación y\nReadaptación Social, la concesión o negación de la libertad, sujeta, en el primer caso, a las condiciones siguientes:\nI. Residir, o en su caso no residir en lugar determinado e informar a la autoridad los cambios de su domicilio. La designación de lugar de su residencia se hará lugar que se fije, con el hecho de que su permanencia no sea un obstáculo para su enmienda;\nII. Desempeñar en el plazo que la resolución determine, un oficio, arte, industria o profesión lícitos, si no tuviere medios propios de subsistencia.\nIII. Abstenerse del abuso de bebidas embriagantes y del empleo de estupefacientes o substancias de efectos análogos, salvo prescripción médica; y\nIV. Sujetarse a las medidas de orientación y supervisión que se le dicten por la\nDirección de Ejecución de Sentencias, así como a la vigilancia de una persona honrada de arraigo que se obligue a ello mediante el otorgamiento de una fianza.\nEl monto de ésta será fijado por la Dirección de Ejecución de Sentencias.\nARTÍCULO 136. Las personas a que se hace alusión en la fracción IV del artículo anterior, deberán ser personas físicas que tengan un modo honesto de vivir y sean de buena fama en el lugar donde radican. El otorgamiento de la fianza será en efectivo y se depositará en las oficinas de recaudación de rentas respectivas. El certificado que en este caso se expida, se entregará a la Dirección Ejecución de Sentencias.\nPara fijar el monto de la fianza se tomará en consideración lo siguiente:\nI. Los antecedentes del sentenciado, y\nII. La gravedad y circunstancias de comisión del delito o delitos.\nARTÍCULO 137. La Libertad Preparatoria se suspenderá de oficio, si al liberado se le instruye otro proceso, en cuyo caso volverá a la institución penitenciaria, hasta en tanto no se dicte sentencia o se resuelva la situación jurídica sobre el mismo.\nARTÍCULO 138. La Libertad Preparatoria se revocará por la Dirección de Ejecución de\nSentencias, cuando concurran las siguientes circunstancias:\nI. Si el liberado no cumple con las condiciones citadas en el artículo 135 de esta ley.\nII. Cuando se observe que guarda mala conducta familiar o social, aun cuándo ésta no sea delictiva, durante el tiempo en que disfrute de la Libertad Preparatoria.\nIII. Cuando el fiador así lo solicite y pida se le libere de la obligación contraída, y\nIV. Si el liberado es condenado por nuevo delito mediante sentencia ejecutoria.\nDirección de Ejecución de Sentencias, se podrá conceder al liberado una nueva oportunidad, amonestándolo debidamente.\nARTÍCULO 139. La revocación de la Libertad Preparatoria trae como consecuencia la aplicación del tratamiento institucional, no computándose el tiempo en que se hubiere encontrado en libertad, para el efecto del cumplimiento íntegro de la parte de la condena que le faltaba por compurgar sin perjuicio de que, en su caso, se pueda conceder tratamiento en preliberación.\nLa revocación implica que se hagan efectivas las correspondientes fianzas, salvo el supuesto previsto en la fracción III del artículo anterior.\nARTÍCULO 140. Los sentenciados que disfruten de Libertad Preparatoria quedarán bajo la orientación y vigilancia de la Dirección de Ejecución de Sentencias por conducto del Departamento de Ejecución de Sentencias en Libertad en los términos del artículo\n11 del presente ordenamiento.\nARTÍCULO 141. Una vez expirado el término de la condena impuesta en la sentencia, la Dirección de Ejecución de Sentencias, hará la declaración de quedar el sentenciado en absoluta libertad, para los efectos legales correspondientes.\nCAPÍTULO TERCERO\nDE LA REMISIÓN PARCIAL DE LA SANCIÓN\nARTÍCULO 142. Para facilitar la readaptación del sentenciado del fuero común sobre la base de su trabajo, por cada dos días que labore dentro del establecimiento, se hará remisión de uno de prisión, siempre que el sentenciado observe buena conducta, participe regularmente en actividades educativas, culturales y deportivas y revele a través de éstas y otros datos un alto grado de readaptabilidad social. Esta última será factor determinante para conceder o negar la remisión parcial de la sanción, la cual en sentenciado, ni en su participación en actividades educativas o de otra índole.\nARTÍCULO 143. El sentenciado que con los días laborados cumpla cualesquiera de los términos exigidos para la libertad preparatoria, podrá obtener dicho beneficio siempre y pertinentes. tiempo que el sentenciado participe en actividades educativas, culturales y deportivas, sentenciado desarrolle dentro del establecimiento.\nARTÍCULO 144. La Remisión Parcial de la Sanción podrá ser concedida cuando, una vez hecha la remisión, el sentenciado compurgue la sanción impuesta o bien, le preparatoria. Tratándose de internos que se encuentren compurgando sanciones privativas de la libertad que excedan de los 15 años, éstos podrán ser tomados en consideración para el otorgamiento de este beneficio, ello a discreción de la Dirección de Ejecución de Sentencias.\nCuando el interno tenga dos o más sanciones, se deberá observar en lo conducente, lo previsto por el artículo 134 de esta ley.\nARTÍCULO 145. La solicitud de Remisión Parcial de la Sanción se formulará por escrito ante la Dirección de Ejecución de Sentencias, por aquellos internos que estimen reunir los requisitos del artículo 142. En este caso se deberá seguir el procedimiento establecido en el artículo 133 de esta ley.\n(REFORMADO, P.O. 15 DE ENERO DE 2008)\nARTÍCULO 146. La Dirección de Ejecución de Sentencias, una vez tomados en consideración los informes suministrados y, con base en el grado de readaptabilidad logrado por el interno, someterá, por conducto de la Secretaría de Gobierno a través de la Subsecretaría de Adaptación y Readaptación Social, a la consideración del\nGobernador, la posibilidad de otorgar el beneficio de la Remisión Parcial de la Pena. El\nEjecutivo del Estado, de manera discrecional, resolverá lo conducente.\nARTÍCULO 147. El interno que intente fugarse, o bien el que habiéndose fugado sea reaprendido, podrá perder el derecho a la Libertad Preparatoria o a la Remisión Parcial de la Sanción, previa determinación de la Dirección de Ejecución de Sentencias. Lo anterior se hará saber a todos los internos al ingresar al establecimiento.\nCAPÍTULO CUARTO\nMODIFICACIÓN DE LA SANCIÓN POR\nINCOMPATIBILIDAD CON LA PENA\nARTÍCULO 148. Cuando el sentenciado del fuero común acredite plenamente que no puede cumplir alguna de las circunstancias de la sanción que le fue impuesta, por ser incompatible con su edad, constitución física o salud, el Ejecutivo del Estado, previo el trámite que realice la Dirección de Ejecución de Sentencias, acordará de oficio la modificación de aquélla, siempre que ésta no sea esencial.\nCAPÍTULO QUINTO\nDE LA LIBERACIÓN DEFINITIVA\nARTÍCULO 149. La liberación definitiva de los internos procederá:\nI. Por cumplimiento de la resolución dictada por la autoridad judicial en la que se declare la inocencia del sujeto.\nII. Por razón de indulto.\nIII. Por los efectos de la remisión parcial de la sanción.\nIV. En el caso previsto en el artículo 4 del Código Penal vigente en el Estado.\nV. En los casos de condena condicional cuando haya cumplido los requisitos que se le impongan para obtenerla.\nARTÍCULO 150. El cómputo de la sanción privativa al sentenciado, se hará en los términos prescritos en la sentencia. Cuando a un sentenciado le hayan impuesto dos o más sanciones privativas de su libertad en proceso diverso, el cómputo del tiempo en que debe cumplirse la sanción se hará en forma sucesiva y no simultánea.\nARTÍCULO 151. Todo liberado, ya sea definitiva o preparatoriamente, será provisto de la ropa necesaria y recibirá el saldo que tuviere a su favor por concepto del fondo de ahorros. También se le entregarán los objetos que hubiese dejado en guarda al entrar al establecimiento, de acuerdo con el inventario levantado, la documentación que acredite su aptitud para el trabajo, el grado de educación adquirido y la constancia de libertad, comunicándose al Patronato para el Fomento de la Industria Penitenciaria y la\nReincorporación de Liberados y Externados del Estado de Coahuila su condición de libre para los fines legales consiguientes.\nCAPITULO SEXTO\nDEL CONFINAMIENTO\nARTÍCULO 152. Los sentenciados a confinamiento por lo tribunales, residirán en el lugar señalado por la autoridad, quedando el sentenciado sujeto a la vigilancia y medidas de orientación de la Dirección de Ejecución de Sentencias.\nTÍTULO QUINTO\nDE LA LIBERTAD Y DE LOS SUJETOS\nA LA VIGILANCIA DE LA AUTORIDAD\nCAPÍTULO ÚNICO\nREGLAS COMUNES PARA LOS LIBERADOS SUJETOS\nA LA VIGILANCIA DE LA AUTORIDAD\nARTÍCULO 153. Los sentenciados a la vigilancia de la autoridad quedarán sujetos al control de la Dirección de Ejecución de Sentencias, conforme a lo establecido por el artículo 11 de la presente ley.\nARTÍCULO 154. Los sentenciados a la vigilancia de la autoridad podrán transitar libremente en el lugar designado por el Ejecutivo, pero no podrán salir de él sin autorización de la Dirección de Ejecución de Sentencias. Las autoridades encargadas de la vigilancia, cuidarán de aconsejar al liberado sobre un buen comportamiento, y que cuente con un trabajo a través de la instancia correspondiente; debiendo además, suministrar, dentro de los términos y condiciones que se les fije, los informes sobre su conducta.\nTITULO SEXTO\nEL PATRONATO PARA EL FOMENTO DE LA INDUSTRIA\nPENITENCIARIA Y LA REINCORPORACIÓN DE LIBERADOS Y EXTERNADOS\nDEL ESTADO DE COAHUILA\nCAPÍTULO ÚNICO\nDISPOSICIONES GENERALES\nARTÍCULO 155. El Patronato para el Fomento de la Industria Penitenciaria y la\nReincorporación de Liberados y Externados del Estado de Coahuila tendrá por objeto apoyar a los sujetos de atención en su reincorporación social mediante asistencia de carácter laboral educativa, jurídica, médica, moral y ocasionalmente económica estudiando la evolución de la conducta del individuo y orientándolo hacia la prevención de conductas antisociales.\nAsí mismo coadyuvará con la Dirección de Readaptación Social en los programas encaminados a la capacitación para el trabajo y a la concretización de nuevas fuentes de trabajo, para que a través de este se logre el desarrollo laboral y social del interno.\nARTÍCULO 156. El Patronato se organizará y regulará su funcionamiento en los términos establecidos en el reglamento respectivo.\nPRIMERO. Esta ley entrará en vigor al día siguiente de su publicación en el Periódico\nSEGUNDO. Se abroga la Ley de Ejecución de Sanciones Privativas y Restrictivas de la\nLibertad para el Estado de Coahuila de Zaragoza, publicada en el Periódico Oficial del\nTERCERO. Se derogan todas las disposiciones legales que se opongan a lo establecido por esta ley.\nARTÍCULO CUARTO. Todas las solicitudes de libertad preparatoria, remisión parcial de la sanción, modificación de sanción o cualquier otra que se encuentre pendiente de resolución al entrar en vigor esta ley, se resolverán en lo procedente, de acuerdo a ella.\nDADO en el Salón de Sesiones del Congreso del Estado, en la Ciudad de Saltillo, Coahuila, a los ocho días del mes de noviembre del año dos mil cinco.\nDIPUTADA PRESIDENTA.\nMARÍA EUGENIA CÁZARES MARTÍNEZ.\nDIPUTADO SECRETARIO. DIPUTADO SECRETARIO.\nMIGUEL FELIPE MERY AYUP. GREGORIO CONTRERAS PACHECO.\nIMPRÍMASE, COMUNÍQUESE Y OBSÉRVESE\nEL GOBERNADOR DEL ESTADO\nLIC. ENRIQUE MARTÍNEZ Y MARTÍNEZ\nEL SECRETARIO DE GOBIERNO\nLIC. JOSÉ ABRAHAM CEPEDA IZAGUIRRE\nEL SECRETARIO DE SEGURIDAD PÚBLICA\nY PROTECCIÓN CIUDADANA\nCOMISARIO JEFE ANTONIO GARZA GARCÍA\nN. DE E. A CONTINUACION SE TRANSCRIBEN LOS ARTICULOS TRANSITORIOS DE LOS DECRETOS DE REFORMAS A LA\nPRESENTE LEY.\nSEGUNDO. Las dependencias y entidades que actualmente ejecutan funciones que mediante el presente Decreto se transfieren a la Secretaría de Gobierno, contarán con un término de 30 días hábiles para adecuar los manuales de organización y demás procedimientos administrativos necesarios para el cumplimiento de lo previsto en este Decreto.\nTERCERO. Se otorga un plazo de 30 días hábiles para que se lleven a cabo las reformas y adecuaciones a las disposiciones reglamentarias que correspondan.\nCUARTO. Se derogan todas las disposiciones legales y reglamentarias que se opongan al presente Decreto.",
  "ordenamiento": "REGLAMENTO",
  "jurisdiccion": "COAHUILA",
  "fuente_oficial": "DIARIO OFICIAL DE LA FEDERACION",
  "Fecha de Publicación": "2 de diciembre de 2005",
  "ULTIMA REFORMA PUBLICADA": "15 DE ENERO DE 2008",
  "es_escaneado": false,
  "tiene_tablas": false,
  "materia": [
    "penal"
  ]
}