{
  "titulo": "Acta de Sesión Solemne de Instalación y Toma de Protesta de los Consejeros Propietarios y Suplentes",
  "Contenido": "HONOR Y JUSTICIA DE LA POLICÍA ESTATAL Y DE\nLA COMISIÓN DEL SERVICIO PROFESIONAL DE\nCARRERA POLICIAL DE FECHA VEINTICINCO DE\nFEBRERO DE DOS MIL CATORCE\nTEXTO ORIGINAL.\nActa Publicada en el Periódico Oficial del Gobierno del estado No. 45, el día Viernes 06 de Junio de 2014.\nACTA DE SESIÓN SOLEMNE DE INSTALACIÓN Y TOMA DE PROTESTA DE LOS CONSEJEROS\nPROPIETARIOS Y SUPLENTES DEL CONSEJO DE HONOR Y JUSTICIA DE LA POLICÍA ESTATAL\nY DE LA COMISIÓN DEL SERVICIO PROFESIONAL DE CARRERA POLICIAL DE FECHA\nVEINTICINCO DE FEBRERO DE DOS MIL CATORCE.\nEn la Ciudad de Chilpancingo de los Bravo, Gro, siendo las doce horas del día veinticinco de febrero de dos mil catorce, reunidos en la sala de sesiones y audiencias del Consejo de Honor y Justicia de la Policía Estatal y Comisión del Servicio Profesional de Carrera Policial, ubicada en el interior del edificio del Instituto Universitario de Ciencias Policiales del Consejo Estatal de Seguridad Pública, a un costado de la oficina de radio internet de la Secretaría de Seguridad Pública y Protección Civil del Estado de Guerrero, con domicilio en carretera nacional México-Acapulco kilómetro 271, Colonia Hermenegildo\nGaleana, C. P. 39010, en esta ciudad capital; los CC. LIC. EDILBERTO CALDERÓN JUÁREZ, JEFE DE\nLA UNIDAD DE ASUNTOS JURÍDICOS Y DERECHOS HUMANOS EN REPRESENTACIÓN DEL\nCOMISARIO GRAL. D.M.P. Y LIC. LEONARDO OCTAVIO VÁZQUEZ PÉREZ, SECRETARIO DE\nSEGURIDAD PÚBLICA Y PROTECCIÓN CIVIL DEL ESTADO DE GUERRERO y el OFICIAL Y LIC.\nVALENTÍN CATALÁN ARIAS, PRESIDENTE DEL CONSEJO DE HONOR Y JUSTICIA DE LA POLICÍA\nESTATAL Y DE LA COMISIÓN DEL SERVICIO PROFESIONAL DE CARRERA POLICIAL, quienes actúan por ante el Lic. Pedro Borja Albino, Secretario General de Acuerdos del Consejo, quien autoriza y da fe; con el objeto de llevar a cabo la instalación y toma de protesta de Ley de los consejeros propietarios y suplentes del Consejo de Honor y Justicia de la Policía Estatal y de la Comisión del\nServicio Profesional de Carrera Policial, por lo que en cumplimiento a lo que dispone el numeral 9 del\nReglamento del Consejo de Honor y Justicia de la Policía Estatal de la Secretaría de Seguridad Pública y\nProtección Civil del Gobierno del Estado de Guerrero, en lo relativo al proceso de instalación de este cuerpo colegiado y los puntos que señala la convocatoria emitida por el titular de esta institución policial, en fecha treinta y uno de enero de dos mil catorce, en la que se establecen las bases y lineamientos de la instalación del Consejo y de la Comisión, se procede a la ceremonia solemne mediante el desarrollo del siguiente:\nORDEN DEL DÍA.\n1. Palabras de bienvenida y pase de lista del presídium por parte del Presidente del Consejo de\nHonor y Justicia de la Policía Estatal y de la Comisión del Servicio Profesional de Carrera Policial.\n2. Toma de protesta de Ley de los consejeros y/o vocales propietarios y suplentes del Consejo de Honor y Justicia de la Policía Estatal y de la Comisión del Servicio Profesional de Carrera Policial, por parte del Lic. Edilberto Calderón Juárez, Jefe de la Unidad de Asuntos Jurídicos y Derechos Humanos en\nHONOR Y JUSTICIA DE LA POLICÍA ESTATAL Y DE\nLA COMISIÓN DEL SERVICIO PROFESIONAL DE\nCARRERA POLICIAL DE FECHA VEINTICINCO DE\nFEBRERO DE DOS MIL CATORCE representación del Comisario Gral. D.M.P. y Lic. Leonardo Octavio Vázquez Pérez, Secretario de\nSeguridad Pública y Protección Civil del Estado de Guerrero.\n3. Declaratoria formal de instalación del nuevo Consejo de Honor y Justicia de la Policía Estatal y de la nueva Comisión del Servicio Profesional de Carrera Policial, así como clausura de la sesión solemne por parte del Presidente del Consejo de Honor y Justicia de la Policía Estatal y de la Comisión del Servicio Profesional de Carrera Policial.\nDESAHOGO DEL ORDEN DEL DÍA.\nPUNTO NÚMERO UNO. En el desahogo de este punto, el Presidente del Consejo de Honor y\nJusticia de la Policía Estatal y de la Comisión del Servicio Profesional de Carrera Policial, expreso \"Muy buenas tardes a todos, bienvenidos a este acto solemne de toma de protesta de los nuevos integrantes del Consejo de Honor y Justicia de la Policial Estatal dependiente de la Secretaría de Seguridad Pública y\nProtección Civil del Estado de Guerrero, a continuación procedo a realizar el pase de lista, a fin de verificar la asistencia de los convocados a la sesión solemne.\n1.- Lic. Nadim Saab Cabrera, Subsecretario de Administración, Apoyo Técnico y desarrollo\nHumano.\n2.- Lic. Miguel Ángel A. Orihuela Hernández, Subsecretario del Sistema Penitenciario.\n3.- Lic. Carlos Alberto Amezcua Ávalos, Subsecretario de Protección Civil.\n4.- Inspector General Juan José Gatica Martínez, Subsecretario de Prevención y Operación\nPolicial.\n5.- Lic. José Manuel Cortez Lorenzo. Director General de Desarrollo Humano.\n7.- Lic. Ana Georgina Vargas Catalán, Jefa de la Unidad de Asesoría, Política y Alertamiento.\n6.- Lic. Ana Lizeth Contreras Casillas, Jefa de la Unidad de Contraloría y Asuntos Internos.\n7.- Lic. Fabián Hernández Catalán, Secretario Ejecutivo del Consejo Estatal de Seguridad\nPública del Estado.\n8.- Lic. Guillermo Alberto Hidalgo Montes, Director del Instituto Universitario de Ciencias\nPoliciales.\nPUNTO NÚMERO DOS. En este punto se procede a la toma de protesta de Ley por parte del\nLIC. EDILBERTO CALDERÓN JUÁREZ, JEFE DE LA UNIDAD DE ASUNTOS JURÍDICOS Y\nHONOR Y JUSTICIA DE LA POLICÍA ESTATAL Y DE\nLA COMISIÓN DEL SERVICIO PROFESIONAL DE\nCARRERA POLICIAL DE FECHA VEINTICINCO DE\nFEBRERO DE DOS MIL CATORCE\nDERECHOS HUMANOS EN REPRESENTACIÓN DEL COMISARIO GRAL. D.M.P. Y LIC. LEONARDO\nOCTAVIO VÁZQUEZ PÉREZ, SECRETARIO DE SEGURIDAD PÚBLICA Y PROTECCIÓN CIVIL DEL\nESTADO DE GUERRERO, a los nuevos integrantes del Consejo de Honor y Justicia de la Policía Estatal y de la Comisión del Servicio Profesional de Carrera Policial, por lo que en uso de la palabra expresó:\n\"Muy buenos días distinguidos asistentes a esta sesión solemne, honorables integrantes del\nConsejo de Honor y Justicia y de la Comisión del Servicio Profesional de Carrera Policial, en esta fecha constituiremos éstos órganos garantes de la justicia al interior del cuerpo de Policía Estatal, cuya finalidad es vigilar que los integrantes se conduzcan observando los principios plasmados en nuestra Constitución Política de los Estados Unidos Mexicanos, en nuestra Constitución\nSeguridad Pública, en la Ley número 281 de Seguridad Pública del Estado de Guerrero y demás normatividad que rigen el actuar policial, por lo que antes de proceder a la toma de protesta que exige la norma, me permito exhortarlos para que en el desempeño de tales funciones que le han encomendado sus compañeros, la realicen con honorabilidad, rectitud y justicia, siempre apegados a los principios constitucionales rectores de la función policial: legalidad, objetividad, eficiencia, profesionalismo, honradez, respeto al estado de derecho y a los derechos humanos, ratificando en este momento al presidente y secretario general de acuerdos de este consejo por el mismo periodo, por lo que invito a que nos pongamos de pie, para la toma de Ley correspondiente\".\nCompañeros electos a integrar del Consejo de Honor y Justicia de la Policía Estatal y de la\nComisión del Servicio Profesional de Carrera Policial de la Secretaría de Seguridad Pública y Protección\nCivil del Estado de Guerrero ¿PROTESTAN GUARDAR Y HACER GUARDAR LA CONSTITUCIÓN\nDISPOSICIONES QUE DE UNA U OTRA EMANEN, ASÍ COMO DESEMPEÑAR FIEL Y\nPATRIÓTICAMENTE EL CARGO QUE SE LES HA CONFERIDO, MIRANDO EN TODO POR EL BIEN\nY PROSPERIDAD DEL ESTADO?\nLos consejeros y/o vocales electos levantando la mano derecha, respondieron: \"SI\nPROTESTAMOS\".\nContinúa diciendo el titular de la Unidad de Asuntos Jurídicos y Derechos Humanos, representante del Secretario de Seguridad Pública y Protección Civil: \"SI ASÍ LO HICIEREN, QUE EL\nESTADO, LA SOCIEDAD Y LOS INTEGRANTES DEL CUERPO DE POLICÍA ESTATAL SE LO\nRECONOZCAN Y LOS PREMIEN, SI NO SE LO DEMANDEN\", por lo que deberán conducirse con estricta sujeción a Leyes y normas que rigen el sistema policial, a las disposiciones que se aplican de colegiados. ¡En hora buena!\nHONOR Y JUSTICIA DE LA POLICÍA ESTATAL Y DE\nLA COMISIÓN DEL SERVICIO PROFESIONAL DE\nCARRERA POLICIAL DE FECHA VEINTICINCO DE\nFEBRERO DE DOS MIL CATORCE\nJusticia de la Policía Estatal y de la Comisión del Servicio Profesional de Carrera Policial, que la comisión que desempeñaran será de carácter honorífico, por lo que no recibirán remuneración extra por las actividades que desempeñen en el seno del mismo. Además, que tales encargos deberán desempeñarse en estricto apego a la normatividad policial y.\nPUNTO NÚMERO TRES. En uso de la palabra, el Presidente del Consejo de Honor y Justicia de la Policía Estatal y de la Comisión del Servicio Profesional de Carrera Policial, al emitir la declaratoria formal de la instalación del nuevo Consejo de Honor y de la nueva Comisión del Servicio Profesional de\nCarrera Policial clausura la sesión solemne, expresó: \"Con el permiso Licenciado Edilberto Calderón\nJuárez, Jefe de la Unidad de Asuntos Jurídico Derechos Humanos, en representación del\nSecretario de Seguridad Pública y Protección Civil del Estado de Guerrero, agradezco la asistencia a todos los presentes, sirva este espacio para manifestar que las acciones materializadas en esta fecha, con la instalación y toma de protesta de los nuevos integrantes de estos cuerpos colegiados de justicia, se refrenda el compromiso de esta Institución en conducir con sus acciones bajo parámetros de legalidad y respeto a los derechos fundamentales, estando a la vanguardia en lo que se refiere a la impartición de justicia a quienes integran sus instituciones policiales; en tal sentido, se reitera el deber de conducir los trabajos de este Consejo de Honor y\nJusticia bajo estándares internacionales y nacionales de justicia, equidad y transparencia, privilegiando el concepto de alto honor y los principios constitucionales rectores de la función policial, por lo que en este acto se declara formalmente instalado el consejo de honor y justicia de la policía estatal y de la comisión del servicio profesional de carrera policial del veinticinco de febrero de dos mil catorce al veinticinco de febrero de dos mil diecisiete, quedando integrado de la siguiente manera:\nCONSEJERO PRESIDENTE. LIC. VALENTÍN CATALÁN ARIAS.\nUNIDADES CONSEJEROS Y/O VOCALES CONSEJEROS y/o VOCALES\nOPERATIVAS. PROPIETARIOS. SUPLENTES.\nPREVENCIÓN SOCIAL POLICÍA FRANCISCO VÁZQUEZ POLICÍA TERCERO LUCAS BELLO JULIÁN.\nDEL DELITO. RAMÍREZ.\nPOLICÍA ESTATAL. OFICIAL LUIS MOCTEZUMA NAVA. OFICIAL PEDRO ROMERO HERNÁNDEZ.\nPROTECCIÓN CIVIL. OFICIAL SAÚL ZEFERINO MEJÍA. OFICIAL OMAR DE LA CRUZ BRAVO.\nHONOR Y JUSTICIA DE LA POLICÍA ESTATAL Y DE\nLA COMISIÓN DEL SERVICIO PROFESIONAL DE\nCARRERA POLICIAL DE FECHA VEINTICINCO DE\nFEBRERO DE DOS MIL CATORCE\nECOLÓGICA.\nOFICIAL MAXIMILIANO PALACIOS POLICÍA MARCO ANTONIO ROJAS\nCAYETANO. DELGADO.\nCUSTODIOS POLICÍA EIRA CHÁVEZ ZAVALETA. POLICÍA BERNARDINO SANTIAGO\nPENITENCIARIOS. CARBAJAL.\nTRÁNSITO.\nPOLICÍA JUAN PABLO BUATISTA POLICÍA ELMER VARGAS GALLARDO.\nGODÍNEZ.\nSECRETARIO GENERAL DE ACUERDOS. LIC. PEDRO BORJA ALBINO.\nSiendo las trece horas del día de la fecha, se da por concluida esta sesión solemne, ordenándose levantar el acta respectiva para debida constancia legal, firmando al margen y al calce, los que en la misma intervinieron.\nPOR LA SECRETARÍA DE\nSEGURIDAD PÚBLICA Y\nPROTECCIÓN CIVIL DEL ESTADO\nDE GUERRERO.\nLIC. EDILBERTO CALDERÓN JUÁREZ.\nJEFE DE LA UNIDAD DE ASUNTOS JURÍDICOS\nY DERECHOS HUMANOS.\nPOR EL CONSEJO DE HONOR Y\nJUSTICIA DE LA POLICÍA ESTATAL\nY DE LA COMISIÓN DEL\nSERVICIO PROFESIONAL DE\nCARRERA POLICIAL.\nCONSEJERO PRESIDENTE.\nOFICIAL Y LIC. VALENTÍN CATALÁN ARIAS.\nHONOR Y JUSTICIA DE LA POLICÍA ESTATAL Y DE\nLA COMISIÓN DEL SERVICIO PROFESIONAL DE\nCARRERA POLICIAL DE FECHA VEINTICINCO DE\nFEBRERO DE DOS MIL CATORCE\nCONSEJEROS Y/O VOCALES PROPIETARIOS.\nPOLICÍA. FRANCISCO VÁZQUEZ RAMÍREZ.\nRúbrica.\nOFICIAL LUIS MOCTEZUMA NAVA.\nRúbrica.\nOFICIAL SAÚL ZEFERINO MEJÍA.\nRúbrica.\nOFICIAL MAXIMILIANO PALACIOS CAYETANO.\nRúbrica.\nPOLICÍA EIRA CHAVEZ ZAVALETA.\nRúbrica.\nPOLICIA. JUAN PABLO BUATISTA GODÍNEZ.\nRúbrica.\nCONSEJEROS Y/O VOCALES SUPLENTES.\nPOLICÍA LUCAS BELLO JULIÁN.\nRúbrica.\nOFICIAL PEDRO ROMERO HERNÁNDEZ.\nOFICIAL OMAR DE LA CRUZ BRAVO.\nPOLICÍA. MARCO ANTONIO ROJAS DELGADO.\nPOLICÍA BERNARDINO SANTIAGO CARBAJAL.\nPOLICÍA ELMER VARGAS GALLARDO.\nHONOR Y JUSTICIA DE LA POLICÍA ESTATAL Y DE\nLA COMISIÓN DEL SERVICIO PROFESIONAL DE\nCARRERA POLICIAL DE FECHA VEINTICINCO DE\nFEBRERO DE DOS MIL CATORCE\nSECRETARIO GENERAL DE ACUERDOS.\nLIC. PEDRO BORJA ALBINO.",
  "ordenamiento": "ACTA",
  "jurisdiccion": "GUERRERO",
  "fuente_oficial": "DIARIO OFICIAL DE LA FEDERACION",
  "Fecha de Publicación": "06 de Junio \nde 2014",
  "ULTIMA REFORMA PUBLICADA": null,
  "status": "VIGENTE",
  "es_escaneado": false,
  "tiene_tablas": true,
  "materia": [
    "general"
  ]
}