{
  "titulo": "Acuerdo por el Que Se Crea el Programa Extensionismo y Desarrollo de Capacidades y Se Emiten Sus Reg",
  "Contenido": "EJERCICIO FISCAL 2020\nTEXTO ORIGINAL.\nCAPACIDADES Y SE EMITEN SUS REGLAS DE OPERACIÓN PARA EL EJERCICIO FISCAL 2020.\nPoder Ejecutivo.\nLICENCIADO HÉCTOR ANTONIO ASTUDILLO FLORES, GOBERNADOR CONSTITUCIONAL DEL\nESTADO DE GUERRERO, CON FUNDAMENTO EN LO DISPUESTO POR LOS ARTÍCULOS 71, 87, 88,\nCONFIEREN LOS ARTÍCULOS 2, 3, 6, 7, 10, 11, 18 APARTADO A FRACCIONES I Y XII, 20 FRACCIÓN\nIII Y 31 DE LA LEY ORGÁNICA DE LA ADMINISTRACIÓN PÚBLICA DEL ESTADO DE GUERRERO\nNÚMERO 08; 1, 2 FRACCIÓN I, 18 Y 25 DE LA LEY NÚMERO 454 DE PRESUPUESTO Y DISCIPLINA\nFISCAL DEL ESTADO DE GUERRERO; 18 FRACCIÓN I Y 106 DE LA LEY NÚMERO 814 DE\nDESARROLLO RURAL SUSTENTABLE DEL ESTADO DE GUERRERO; EN RELACIÓN CON EL\nARTÍCULO 55 Y ANEXOS 21 Y 21-A DEL DECRETO NÚMERO 447 DEL PRESUPUESTO DE EGRESOS\nDEL ESTADO DE GUERRERO PARA EL EJERCICIO FISCAL 2020 Y LOS LINEAMIENTOS PARA LA\nELABORACIÓN DE LAS REGLAS DE OPERACIÓN DE LOS PROGRAMAS SOCIALES ESTATALES\nPARA EL EJERCICIO FISCAL 2017.\nQue en el Plan Estatal de Desarrollo 2016-2021 en su objetivo 3.1. Denominado “Construir un\nEstado garante pleno de los derechos sociales de las personas” en su Estrategia 3.1.2, establece que fortalecerá el desarrollo de capacidades de las y los integrantes de una sociedad con carencias que permitan contribuir a incrementar su capacidad productiva y su calidad de vida, en el cual se emprenderán programas especiales de asistencia social a grupos vulnerables, con el fin de brindar condiciones mínimas necesarias para el desarrollo humano.\nUno de los compromisos del Ejecutivo Estatal con la ciudadanía guerrerense, al asumir y tomar protesta como Gobernador Constitucional del Estado, es lograr un Guerrero de tranquilidad, de paz, de justicia, de crecimiento y de empleo, contribuyendo con ello a construir historias de éxitos individuales y colectivos que permitan consolidar el crecimiento económico y estabilidad social.\nGuerrero.\nEl Programa Extensionismo y Desarrollo de Capacidades, tiene como objetivo general, fomentar en la población rural, la producción de alimentos a través de la contratación de extensionistas que brindarán\nEJERCICIO FISCAL 2020 servicios de capacitación y asistencia técnica con el fin de que los productores adopten nuevas tecnologías, que les permita incrementar la producción reduciendo costos.\nLa Secretaría de Agricultura, Ganadería, Pesca y Desarrollo Rural, tendrá a su cargo la implementación, operación, ejecución, evaluación y administración del Programa Extensionismo y\nDesarrollo de Capacidades.\nEn cumplimiento de lo anterior, he tenido a bien expedir el siguiente:\nACUERDO POR EL QUE SE CREA EL PROGRAMA EXTENSIONISMO Y DESARROLLO DE\nCAPACIDADES Y SE EMITEN SUS REGLAS DE OPERACIÓN PARA EL EJERCICIO FISCAL 2020.\nArtículo 1. Se crea el Programa Extensionismo y Desarrollo de Capacidades, para el Ejercicio\nFiscal 2020, el cual tiene por objeto otorgar servicios de capacitación y asistencia técnica con el fin de que los productores adopten nuevas tecnologías, lo cual les permitirá incrementar la producción reduciendo costos.\nArtículo 2. Se emiten las Reglas de Operación del Programa Extensionismo y Desarrollo de\nCapacidades para el Ejercicio Fiscal 2020, en las que se establecen los principios de eficiencia, eficacia, oportunidad, equitativa y transparencia de los recursos públicos y requisitos que se deben de cumplir para poder acceder ha dicho Programa.\nLas Reglas de Operación del Programa Extensionismo y Desarrollo de Capacidades para el\nEjercicio Fiscal 2020, establece los criterios y requisitos que se deben de cumplir para poder acceder a dicho Programa.\nArtículo 3. La Secretaría de Agricultura, Ganadería, Pesca y Desarrollo Rural tendrá a su cargo la implementación, operación, ejecución, evaluación y administración del Programa Extensionismo y\nDesarrollo de Capacidades, bajo los criterios de objetividad, equidad, transparencia, publicidad, selectividad y temporalidad, con estricto apego a la normatividad aplicable, por lo tanto será la encargada de la dispersión y asignación de los recursos del Programa apegándose plenamente a las Reglas de\nOperación siguientes:\nPARA EL EJERCICIO FISCAL 2020.\n1. Introducción\n1.1. Antecedentes\nEl extensionismo se inició en el año 2012, brindando a los productores agrícolas solamente asistencia técnica en su cultivo de maíz, tomando en cuenta el paquete de fertilizante subsidiado y preservando su semilla criolla, a partir del año 2015, se firmó un convenio de coordinación con el Centro\nInternacional de Mejoramiento del Maíz y Trigo (CIMMYT). Para capacitar a los extensionistas contratados\nEJERCICIO FISCAL 2020 inversión con los métodos de la agricultura de conservación, realizando muestreos de suelo para que se desengañara el productor lo importante que es esta actividad, ya que año con año reciben el fertilizante que les da el municipio sin conocer las condiciones edáficas de su suelo.\nEn el año 2019, el Gobierno Federal retira el programa de Extensionismo, resintiendo el cambio los municipios y localidades que se estaban atendiendo por las innovaciones que dejaron de darle continuidad, como la utilización de Semilla Mejorada, Control Biológico, Fertilización Integral y Manejo de\nPos-cosecha. Con estas innovaciones el productor logró incrementar su rendimiento a 8 tons/ha., ya que el extensionismo se define como el proceso de intervención de carácter educativo y transformador cuyo objetivo es el desarrollo económico y social de las familias rurales, a través de servicios de asistencia técnica, intercambio de tecnología, desarrollo de capacidades, e innovación. Ante esta importante tarea, los obstáculos y retos no son menores, por ejemplo: existe un desconocimiento social de las actividades vinculadas a los procesos de extensionismo rural, así como de sus principales actores, lo que impide su reconocimiento y consolidación como instrumento de política pública para promover el desarrollo rural sustentable.\nBajo este panorama, se ha hecho necesario replantear un nuevo modelo de extensionismo en\nMéxico, como uno de los elementos fundamentales para superar las condiciones de pobreza y marginación que padecen muchos de los habitantes del medio rural, así como para elevar la producción de alimentos y conservar los recursos naturales.\nEl Plan Estatal de Desarrollo 2016-2021 establece como plan de acción, promover la diversificación de la economía y aprovechar las potencialidades que existen en nuestro Estado. Para que\nGuerrero tenga un cambio cualitativo en su economía, en este sentido se definieron cinco proyectos estratégicos, dentro de los que se encuentra impulsar la producción agroindustrial, y como objetivo establece construir un sector agropecuario y pesquero productivo, que garantice la seguridad alimentaria del Estado.\nLa presente administración, emprende y fomenta acciones para dar viabilidad a un proyecto integral de desarrollo que mejore sustancialmente las condiciones de vida de las y los guerrerenses, por eso es nuestro afán de apoyar a los pequeños productores de las Unidades Económicas Rurales con servicios de extensión, innovación y capacitación para incrementar la producción agroalimentaria.\n1.2. Alineación programática\nEstado de Guerrero 2016-2021 y al Programa Sectorial de Desarrollo Rural y Pesca 2016-2021, en el eje programático Guerrero Próspero, en el objetivo 2.2 Impulsar la productividad del sector agropecuario y pesquero, para garantizar la seguridad alimentaria, a la estrategia 2.2.3 Aprovechar las áreas de productos y promover asesoría técnica y financiera a los productores de maíz, jamaica, frutas tropicales, cítricos, coco y mango para mejorar su posicionamiento en el mercado nacional e internacional.\nEJERCICIO FISCAL 2020\n1.3. Diagnóstico\nEl Programa de Extensionismo y Desarrollo de Actividades, es de mucha importancia para nuestro\nEstado ya que, con las prácticas de la agricultura de conservación, tendremos alternativas para producir mejor y de mejor calidad, por ser los que elaborarían sus propios productos orgánicos, desde su composta y el manejo agroecológico de plagas. En nuestro Estado existen productores rurales de muy diversa escala de productividad, rentabilidad y competitividad, los que podemos ubicar en tres grandes segmentos: Un primer segmento, con el 91.15%, consiste en productores de alto y muy alto grado de marginación, un segundo estrato, representa el 5.85%, que se ubica en un grado de marginación media, y un tercer segmento de productores que se ubican en un grado de marginación baja ya que en nuestro Estado existen productores rurales de muy diversa escala de productividad, rentabilidad y competitividad, los que podemos ubicar en tres grandes segmentos: un primer segmento, con el 91.15%, consiste en productores de alto y muy alto grado de marginación, un segundo estrato, representa el 5.85%, que se ubica en un grado de marginación media, y un tercer segmento de productores que se ubican en un grado de marginación baja.\nLo anterior obliga a la Secretaría de Agricultura, Ganadería, Pesca y Desarrollo Rural, como cabeza del sector agropecuario, a diseñar políticas diferenciadas; acrecentar los apoyos al segmento de mayor grado de marginación, brindándole servicios de capacitación y asistencia técnica con el fin de seguir adoptando nuevas tecnologías, que les permita incrementar su producción y reducir sus costos de inversión.\nEn este contexto, el Programa de Extensionismo y Desarrollo de Capacidades, financiado con recursos de Inversión Estatal Directa (IED) detalla acciones, conceptos de apoyo y procedimientos operativos para el otorgamiento de apoyos en subsidios para fomentar las actividades agropecuarias y de servicios en el medio rural, aunado los apoyos que el Centro Internacional del Mejoramiento de Maíz y\nTrigo, (CIMMYT) brinda a este Programa.\na) Naturaleza del programa social\nEl Programa de Extensionismo y Desarrollo de Capacidades es un programa social, que otorga subsidios para fomentar las actividades agropecuarias, pesqueras, acuícolas y de servicios en el medio rural de la entidad, a través de la contratación de extensionistas, que brindarán servicios de capacitación y el nivel de vida de la población de las zonas rurales.\nb) El origen y fundamento contratación de extensionistas que brinden servicios de capacitación y asistencia técnica, que en programas federales no son susceptibles de apoyos, pero que los productores en realidad emplean en las labores diarias en sus unidades de producción rural.\nEJERCICIO FISCAL 2020\nLa creación del Programa Extensionismo y Desarrollo de Capacidades, se fundamenta en el Plan\nEstatal de Desarrollo 2016-2021, específicamente en el eje II Guerrero Próspero, el cual mandata promover la diversificación de la economía y aprovechar las potencialidades que existen en nuestro Estado. Para que\nGuerrero tenga un cambio cualitativo en su economía, se contempla impulsar cinco proyectos estratégicos entre los que se encuentra la producción agroindustrial, estableciendo como objetivo construir un sector agropecuario y pesquero productivo que garantice la seguridad alimentaria del Estado.\nActualmente en la Ley Orgánica de la Administración Pública del Estado de Guerrero Número 08, en su artículo 31 contempla a la Secretaría de Agricultura, Ganadería, Pesca y Desarrollo Rural, como el órgano encargado de promover y fomentar el Desarrollo Agrícola, Forestal, Ganadero, Pesquero, así como el manejo de los recursos naturales en el Estado, procurando la participación de las mujeres, en igualdad de condiciones; por lo que tiene como fundamento legal en la:\n1) Constitución Política de los Estados Unidos Mexicanos.\n3) Ley de Desarrollo Rural Sustentable.\n4) Ley Número 814 de Desarrollo Rural Sustentable del Estado de Guerrero.\n6) Ley de Administración de Recursos Materiales del Estado de Guerrero.\n7) Ley Número 207 de Transparencia y Acceso a la Información Pública del Estado de Guerrero.\n8) Decreto Número 196 Plan Estatal de Desarrollo de Guerrero 2016-2021, eje II Guerrero\nPróspero.\n9) Decreto Número 447 del Presupuesto de Egresos del Estado de Guerrero para el Ejercicio\nFiscal 2020.\nc) Objetivos y metas\nFomentar el desarrollo de capacidades de los productores, sus organizaciones, las familias rurales, otros actores que realizan oficios, así como las instituciones especializadas en la capacitación e investigación, en los sectores agropecuarios, acuícolas y pesqueros, facilitar el acceso al conocimiento, información y uso de tecnologías modernas; su interacción en investigación, educación, agronegocios, mercado y el desarrollo de sus propias habilidades y prácticas técnicas, organizacionales y gerenciales.\nLa meta es apoyar a 2,880 productores con servicios de extensionismo y desarrollo de capacidades, para el mejor desarrollo de sus actividades agropecuarias, acuícolas y de servicios.\nEJERCICIO FISCAL 2020\nd) Ubicación geográfica de los proyectos a desarrollar\nEl Programa se implementará en el Estado de Guerrero, abarcando las siete regiones económicas:\n• Tierra Caliente\n• Centro\n• Norte\n• Montaña\n• Costa Grande\n• Costa Chica\n• Acapulco\ne) Actividades a realizar\nRealizar la contratación de extensionistas que brindarán servicios de capacitación y asistencia técnica, que coadyuven a realizar de manera más eficiente las labores agropecuarias y pesqueras, y que agreguen valor a la producción.\nLa Secretaría de Agricultura, Ganadería, Pesca y Desarrollo Rural, elaborará un catálogo de conceptos a apoyar por el Programa Extensionismo y Desarrollo de Capacidades, mismo que se encontrará disponible en la página electrónica www.campoguerrero.gob.mx, que serán cubiertos con la aportación del Gobierno del Estado.\nAsimismo, la Secretaría de Agricultura, Ganadería, Pesca y Desarrollo Rural, de conformidad con la Ley de Administración de Recursos Materiales del Estado y las bases que para tal efecto emita la\nSecretaría de Contraloría y Transparencia Gubernamental, para la adquisición y dotación de los diversos apoyos que comprende el Programa Extensionismo y Desarrollo de Capacidades, en caso de ser necesario.\nLa Secretaría de Agricultura, Ganadería, Pesca y Desarrollo Rural, vigilará que las beneficiarias y\nCapacidades y entregará los apoyos a las personas beneficiarias.\nf) Instancias participantes\nLa ejecución del Programa estará a cargo de la Secretaría de Agricultura, Ganadería, Pesca y\ng) Presupuesto de Inversión\nDirecta (IED) 2020, autorizados en el Decreto Número 447 del Presupuesto de Egresos del Estado de\nEJERCICIO FISCAL 2020 alcance VII del 20 de diciembre del año 2019. Con un monto de $5´252,500.00 (Cinco millones doscientos cincuenta y dos mil quinientos pesos 00/100 M.N.).\nh) Glosario de términos\nCIMMYT: Centro Internacional de Mejoramiento del Maíz y Trigo.\nCONAC: Consejo Nacional de Armonización Contable.\nIED: Inversión Estatal Directa 2020\nPrograma: Programa de Extensionismo y Desarrollo de Capacidades.\nPOA: Programa Operativo Anual.\nReglas de Operación: Reglas de Operación del Programa de Extensionismo y Desarrollo de\nCapacidades.\nSAGADEGRO: Secretaría de Agricultura, Ganadería, Pesca y Desarrollo Rural.\nSEPLADER: Secretaría de Planeación y Desarrollo Regional.\nMisión\nFomentar el desarrollo de capacidades de los productores, sus organizaciones, las familias rurales, otros actores que realizan oficios, de los sectores agropecuarios, acuícolas y pesqueros.\nVisión\nSer la dependencia generadora del desarrollo económico y sociocultural de la población rural de\nGuerrero, brindando servicios de capacitación y asistencia técnica para incrementar la producción agropecuaria, mediante la adopción de nuevas tecnologías.\n2. Secretaría, dependencia o entidad responsable del programa\nLa Secretaría de Agricultura, Ganadería, Pesca y Desarrollo Rural (SAGADEGRO), será la\nCapacidades.\n2.1. En la operación del Programa Extensionismo y Desarrollo de Capacidades participará la\nSubsecretaría de Desarrollo Rural Sustentable, la Subsecretaría de Agricultura e Infraestructura Rural, la\nSubsecretaría de Ganadería y Pesca, y la Delegación Administrativa de la Secretaría de Agricultura, Ganadería, Pesca y Desarrollo Rural.\nEJERCICIO FISCAL 2020\n3. Objetivos y alcances\n3.1. Objetivo general\nFomentar el desarrollo de capacidades de las productoras y productores, sus organizaciones, las familias rurales, otros actores que realizan oficios, así como las instituciones especializadas en la capacitación e investigación, en los sectores agropecuarios, acuícolas y pesqueros, facilitar el acceso al conocimiento, información y uso de tecnologías modernas; su interacción con sus socios estratégicos en investigación, educación, agronegocios, mercado y el desarrollo de sus propias habilidades y prácticas técnicas, organizacionales y gerenciales.\n3.2 Objetivo específico\nApoyar a los pequeños productores de las unidades económicas rurales con servicios de extensión y desarrollo de capacidades, para incrementar la producción agroalimentaria.\n3.3. Alcances\nCon la contratación de 48 extensionistas, que brindarán servicios de capacitación y asistencia técnica buscando la adopción de nuevas tecnologías por parte de los productores y mejorando el nivel de vida de las zonas rurales con la implementación del Programa se busca que productoras y productores continúen trascendiendo en la Agricultura de conservación e implementando las innovaciones en los 81 municipios y lograr que incrementen su producción con menor costo de inversión. Con esto lograríamos que las productoras y productores agropecuarios y pesqueros, sean capaces de buscar mercados para comercializar su excedente para obtener ingresos que mejoren su nivel de vida.\nLa población objetivo del Programa son los productores agropecuarios, pesqueros y acuícolas de escasos ingresos.\n4. Metas físicas\nBeneficiar 2,880 productoras y productores, con servicios de asistencia técnica y capacitación, con les permita aumentar su producción.\n5. Programación presupuestal\nDirecta (IED) 2020, autorizados en el Decreto Número 447 del Presupuesto de Egresos del Estado de\nGuerrero No. 102 alcance VII 20 de diciembre del año 2019. Con un monto de $5´252,500.00 (Cinco millones doscientos cincuenta y dos mil quinientos pesos 00/100 M.N.)\nEJERCICIO FISCAL 2020\nLa Secretaría de Agricultura, Ganadería, Pesca y Desarrollo Rural, recibirá de la Secretaría de provenientes del IED, para el Programa de Extensionismo y Desarrollo de Capacidades.\nSe destinará el recurso para la contratación de 48 extensionistas, el monto mensual para el pago será de $14,985.07 (Catorce mil novecientos ochenta y cinco pesos 07/100 M.N.\nDe los 48 extensionistas están considerados 35 para el sector agrícola con un periodo de seis meses y 13 están considerados para el sector pecuario y pesquero, con un periodo de diez meses.\nCalendario para la radicación de recursos\nConcepto TOTAL\nFebrero Marzo Abril Mayo Junio Julio Agosto Septiembre\nGastos de\n636,865 636,865 636,865 636,866 636,866 636,866 636,866 636,866 5,094,925\nInversión\nGastos de\n19,697 19,697 19,697 19,697 19,697 19,697 19,697 19,697 157,575\nOperación\nTOTAL 656,562 656,562 656,562 656,562 656,563 656,563 656,563 656,563 5,252,500\n6. Requisitos y procedimientos de acceso\nPara la obtención de los apoyos, para el pago de los extensionistas, las productoras o productores agropecuarios, pesqueros y acuícolas, deberán observar que los extensionistas cumplan con los servicios de Capacitación y Asistencia Técnica apegándose a su programa de trabajo que fue elaborado por estos, dándole un seguimiento puntual de sus actividades.\n6.1. Difusión\nLa Secretaría de Agricultura, Ganadería, Pesca y Desarrollo Rural publicará en su página de el Plan Estratégico, para que presenten solicitudes de servicios de extensión y desarrollo de capacidades.\nEn ella se especificará el tipo de servicios que pueden solicitarse, los requisitos de los extensionistas que otorgarán los servicios y las fechas de apertura y cierre de ventanillas.\nLos horarios de atención a las productoras o productores, será de lunes a viernes de 09:00 a 16:00 horas en las instalaciones de la Secretaría de Agricultura, Ganadería, Pesca y Desarrollo Rural, sita en\nEJERCICIO FISCAL 2020\nCarretera Nacional México-Acapulco Km 274.5, Colonia Burócratas, teléfono 01 747 47 1 92 10 de la\nCiudad de Chilpancingo de los Bravo, Guerrero.\nLa cobertura del Programa Extensionismo y Desarrollo de Capacidades será estatal, atendiéndose a las productoras y productores agropecuarios, pesqueros y acuícolas de la entidad.\n6.2. Requisitos de acceso\n6.2.1. Personas morales:\na) Acta constitutiva y, de las modificaciones a ésta y/o a sus estatutos, que en su caso haya tenido a la fecha de la solicitud, debidamente protocolizada ante Fedatario Público.\nb) Acta en la que conste la designación de su representante legal o poder debidamente protocolizado ante fedatario público.\nc) Comprobante de domicilio fiscal (luz, teléfono, predial, agua), con una vigencia no mayor a tres meses anteriores a la fecha de solicitud, dicha vigencia será de hasta seis meses en el Programa de\nComercialización y Desarrollo de Mercados.\nd) Registro Federal de Contribuyentes.\ne) Identificación oficial del representante legal vigente (Credencial para Votar, el Pasaporte, la\nCartilla del Servicio Militar Nacional o la Cédula Profesional).\nf) Clave Única de Registro de Población del representante legal.\ng) Acreditar, en su caso, la legal posesión del predio mediante documento jurídico que corresponda, con las formalidades que exija el marco legal aplicable en la materia.\nh) Listado de las personas productoras integrantes de la persona moral solicitante.\n6.2.2. Grupos de personas:\na) Acta de asamblea constitutiva y de designación de representantes, con la lista de asistencia y firmas correspondientes, certificada por la autoridad municipal.\nb) Identificación oficial del representante vigente (Credencial para Votar, el Pasaporte, la Cartilla del Servicio Militar Nacional o la Cédula Profesional).\nc) Clave Única de Registro de Población del representante. d) Documento escrito con los datos de cada integrante del grupo.\nEJERCICIO FISCAL 2020\nLos productores de comunidades indígenas podrán, en su caso acreditar la legal posesión del predio con el documento expedido por la instancia competente y en su caso, conforme a usos y costumbres.\n6.3. Procedimiento de acceso conocer previamente en la página electrónica de la Secretaría de Agricultura, Ganadería, Pesca y\nDesarrollo Rural, las cuales se presentarán debidamente firmadas y acompañadas de la documentación que demuestre la elegibilidad de las beneficiarias y beneficiarios y el cumplimiento de los requisitos establecidos, para beneficiarse de los apoyos. En caso de que la documentación esté incompleta, se otorgará un plazo de 10 días naturales para completarla; de lo contrario, la solicitud se tendrá como no presentada.\nSe expedirán a los solicitantes, en los términos acostumbrados, un comprobante de presentación de solicitud conforme a lo siguiente:\na) Las solicitudes deben de ir acorde al servicio que requieren los productores, sea de capacitación, asistencia o asesoría técnica, consultoría en temas especializados, demostraciones de campo y otras actividades de apoyo; elaboración, puesta en marcha y ejecución de proyectos productivos, empresariales o territoriales, entre otros. También deben establecer la actividad o proyecto para el cual se solicita el apoyo y si pertenecen a algún sistema-producto, territorio o cadena de valor priorizados; así como la propuesta de los extensionistas conforme a su perfil profesional para que atiendan los servicios requeridos por los productores.\nb) Registro de solicitudes.\nc) Cumplimiento de criterios y requisitos de elegibilidad. Los requisitos que deberán cumplir los solicitantes, personas físicas, grupos de personas productoras y personas morales serán los especificados para cada grupo.\nd) Validación normativa. Por cada una de las solicitudes presentadas, la Secretaría de Agricultura, Ganadería, Pesca y Desarrollo Rural validará el cumplimiento de los criterios de elegibilidad de los solicitantes y de los requisitos para acceder a los apoyos del concepto de extensionismo y desarrollo de ordenamientos vigentes.\nLos incentivos autorizados sean de capacitación, asistencia o asesoría técnica, consultoría en temas especializados, demostraciones de campo y otras actividades de apoyo; elaboración, puesta en marcha y ejecución de proyectos productivos, empresariales o territoriales, entre otros. También deben cadena de valor corresponde.\ne) Análisis y dictamen. La dictaminación, resolución y/o notificación de solicitudes corre a cargo de la Secretaría de Agricultura, Ganadería, Pesca y Desarrollo Rural para lo cual podrán auxiliarse por una\nEJERCICIO FISCAL 2020\nUnidad o Agente Técnico Estatal con el apoyo de las Comisiones Estatales del Programa; este procedimiento es permanente y no se debe esperar al cierre de la ventanilla para realizarlo; las solicitudes deben ser resueltas y/o publicadas, difundidas y notificadas a través de la página de internet de la de 20 días hábiles después de su recepción.\nf) Resolución y notificación. El resultado del dictamen de las solicitudes, sean positivas o negativas, deben hacerse del conocimiento de los solicitantes, para lo cual se publicarán en la página electrónica de la Secretaría de Agricultura, Ganadería, Pesca y Desarrollo Rural en periodos quincenales conforme avance el proceso de análisis y dictaminación de solicitudes, sin esperar al cierre de ventanillas.\n6.4. Requisitos de permanencia, causales de baja o suspensión temporal\n6.4.1. La persona beneficiaria está obligada a:\na) Dar buen uso, conservación y/o mantenimiento de los bienes recibidos.\nb) Otorgar las facilidades y proporcionar la información necesaria a las instancias de coordinación, supervisión y control de los niveles de gobierno facultados para realizar visitas de inspección y monitoreo de los apoyos otorgados.\nc) Seguir las recomendaciones técnico-productivas emitidas por las instancias de gobierno.\nd) Mantener los apoyos por un plazo mínimo de tres años con el fin de que estén disponibles para las supervisiones físicas y documentales de las instancias de control y fiscalización.\n6.5. Modos de entrega del beneficio\nLos pagos a los extensionistas se realizarán mensualmente, de acuerdo a lo establecido en el contrato de prestación de servicios y extenderán recibos por cada uno de los pagos que se les realicen.\n7. Procedimientos de instrumentación\nA partir de las prioridades definidas en el Plan Estratégico, la Secretaría de Agricultura, Ganadería, Pesca y Desarrollo Rural elaborará el Programa Operativo Anual (POA), en el cual se definirán objetivos, actividades, metas y montos de recursos calendarizados a ejercer del Programa; se elaborarán de acuerdo a las necesidades de desarrollo de capacidades de los productores detectados en los territorios, sistemas producto y cadenas de valor a atender. La Secretaría de Agricultura, Ganadería, Pesca y Desarrollo Rural imprevistas con la autorización de la misma unidad responsable.\n7.1. Operación\n7.1.1. Inscripción\nEJERCICIO FISCAL 2020 o desarrollo de capacidades para necesidades específicas, tendrán como requisito que el grupo o la las necesidades específicas a atender y el monto de apoyo requerido, y posteriormente se integrará la documentación necesaria para el expediente que soporte la prestación de los servicios; lo anterior permite generar el padrón de personas beneficiarias del componente de extensionismo y desarrollo de capacidades.\n7.1.2. Registro de solicitudes\nLas solicitudes recibidas serán registradas por la Secretaría Agricultura, Ganadería, Pesca y\nDesarrollo Rural en el Sistema que para tal fin se asigne y de mantener la información actualizada en el proceso de operación.\n7.1.3. Cumplimiento de criterios y requisitos de elegibilidad\nLos requisitos que deberán cumplir las personas solicitantes, grupos productores y personas morales serán los especificados para cada categoría, además de pertenecer a la población objetivo del\nPrograma.\n7.1.4. Validación normativa\nLa Secretaría de Agricultura, Ganadería, Pesca y Desarrollo Rural validará el cumplimiento de los criterios de elegibilidad de los beneficiarios y de los requisitos para acceder a los apoyos del concepto de\nContratación de Extensionistas, con base en la normatividad establecida en las presentes Reglas de\nOperación y otros ordenamientos vigentes. También, elaborarán la propuesta de extensionistas como un proceso de inducción de oferta institucional para atender las necesidades de servicios de las beneficiarias y beneficiarios teniendo en cuenta los requisitos de elegibilidad establecidos en estas Reglas de Operación y su desempeño en la prestación de servicios de ejercicios anteriores y el resultado de la evaluación que para tal propósito establezca. La Secretaría de Agricultura, Ganadería, Pesca y Desarrollo Rural las personas interesadas en participar se deberán registrar en tiempo y forma en el Sistema que se asigne.\n7.1.5. Análisis y dictamen de Capacidades, analiza los perfiles de los extensionistas propuestos tomando como referencia las prioridades nacionales y estatales, así como las prioridades definidas en el Plan Estratégico, el cumplimiento de criterios de elegibilidad y requisitos para la contratación de los extensionistas. Con base en el análisis realizado, validará la contratación.\n7.1.6. Suscripción del documento jurídico para la prestación del servicio\nEJERCICIO FISCAL 2020\nLa Secretaría de Agricultura, Ganadería, Pesca y Desarrollo Rural previene lo necesario para la incentivos; así mismo, asumen las relaciones y obligaciones a que haya lugar. Entre las obligaciones ineludibles de los extensionistas están la presentación de un programa de trabajo y/o intervención orientado a resultados con indicadores de productividad y otros indicadores, aspectos que serán validados por la\nComisión Estatal.\n7.1.7. Pago a extensionistas\nLos pagos a los extensionistas y coordinadores, se realizarán mensualmente de acuerdo a lo establecido en el contrato de prestación de servicios y extenderán recibos por cada uno de los pagos que se les realicen.\n7.1.8. Finiquito\nLas instancias ejecutoras realizarán el finiquito de los contratos con los extensionistas.\nCada extensionista presentará un informe final de resultados del programa de trabajo y/o intervención orientado a resultados, que refleje el cumplimiento de metas de los indicadores definidos; este informe se turnará al coordinador de extensionistas que corresponda para su validación e integración con los demás informes de su equipo de extensionistas. El coordinador elaborará un informe concentrado de su ámbito de atención y lo remitirá a la instancia ejecutora para su integración a nivel estatal y elaboración del informe de resultados del POA o en su caso, del Anexo Técnico o de Ejecución respectivo; este documento se enviará al Comité Estatal de Desarrollo Rural y a la Unidad Responsable previamente validado por la Delegación Estatal a fin de revisar los resultados obtenidos con respecto a la prestación de los servicios de extensionismo y desarrollo de capacidades, conforme a las prioridades establecidas del\nPlan estratégico, que sirva como base para futuros ejercicios de planeación.\n7.1.9. Los datos personales de las personas beneficiarias del Programa Extensionismo y\nDesarrollo de Capacidades, y la información adicional generada y administrada, se regirá por lo establecido en la Ley Número 207 de Transparencia y Acceso a la Información Pública del Estado de Guerrero.\n7.1.10. Los formatos y los trámites a realizar para la obtención del beneficio del Programa\nExtensionismo y Desarrollo de Capacidades, son gratuitos.\n7.2. Gastos de operación\nPara cubrir los gastos ocasionados por la operación, seguimiento, supervisión y verificación de las acciones del Programa Extensionismo y Desarrollo de Capacidades, se dispondrá hasta el 3% de la inversión total de dicho Programa. Estos recursos corresponden al capítulo 4000 de la apertura programática.\nEn la erogación de los gastos de operación se deberán observar los criterios de racionalidad, austeridad presupuestal, propiciando la eficiencia, eficacia y transparencia.\nEJERCICIO FISCAL 2020\n8. Transparencia\n8.1. Difusión\nLa Secretaría de Agricultura, Ganadería, Pesca y Desarrollo Rural, dará amplia difusión al Programa\nExtensionismo y Desarrollo de Capacidades, a nivel estatal a través de la página electrónica www.guerrero.gob.mx. www.campoguerrero.gob.mx, folletos y en reuniones que se organicen por región y/o municipio, así como con organizaciones de productores, y para mayor información acudir a las instalaciones que ocupa la SAGADEGRO, sita en Carretera Nacional México-Acapulco km 274.5\nColonia Burócratas, Chilpancingo de los Bravo, Guerrero, de lunes a viernes en horario de 09:00 a 16:00 horas, o llamar al teléfono 017474719210.\nLa papelería, publicidad y promoción del Programa Extensionismo y Desarrollo de Capacidades incluirá la leyenda descrita en el apartado “Blindaje Electoral”.\nLas copias de los expedientes técnicos del Programa estarán disponibles oportunamente para su consulta de las dependencias.\n8.2. Blindaje electoral\nPara blindar al Programa Extensionismo y Desarrollo de Capacidades del clientelismo y que no sea utilizado para usos partidistas, en la documentación siempre deberán incluir la leyenda siguiente:\n“Este programa es de carácter público, no es patrocinado ni promovido por partido político alguno y sus recursos provienen de los impuestos que pagan todos los contribuyentes. Está prohibido el uso de este programa con fines políticos, electorales, de lucro y otros distintos a los establecidos. Quien haga uso indebido de los recursos de este programa deberá ser denunciado y sancionado de acuerdo con la ley aplicable y ante la autoridad competente”.\n8.3. Supervisión y Control\na) Enviar trimestralmente a la Secretaría de Finanzas y Administración, a la Secretaría de\nPlaneación y Desarrollo Regional, y a la Secretaría de Contraloría y Transparencia Gubernamental, (CONAC) y con base en los indicadores de resultados previstos en las presentes Reglas de Operación. de cada trimestre.\nb) Adicionar a los informes señalados en el inciso anterior, la evaluación de los indicadores determinados en el Programa. Dicha evaluación versará sobre los recursos entregados a las beneficiarias bienestar y la equidad de género.\nEJERCICIO FISCAL 2020\nc) Con el objeto de verificar y validar la entrega de los apoyos a las beneficiarias y beneficiarios del Programa, la Secretaría operadora al inicio del ejercicio fiscal, deberán remitir a la SEPLADER el calendario de entrega de los apoyos, que incluya: Lugar, Fecha y Hora de los eventos, así como la lista o padrón de las beneficiarias y beneficiarios.\nd) Con el objeto de tener precisión del padrón de personas beneficiarias del Programa, y con ello evitar duplicidad en el otorgamiento de otros apoyos, se integrará un Padrón Único de Personas\nBeneficiarias, el cual será coordinado por la SEPLADER.\n8.4. Mecanismos de evaluación e indicadores\n8.4.1. Evaluación\nEl Centro Internacional del Mejoramiento de Maíz y Trigo (CIMMYT) ha venido colaborando con la correspondientes.\n8.4.2. Indicadores\nMatriz de Indicadores para Resultados 2020\nTipo de\nCalculo Medida Verificación Responsable\nEJERCICIO FISCAL 2020\nFin. Contribuir al Fomentar el (No. De El total de De Productores No. De Subsecretaría Disposición desarrollo desarrollo de productores productores eficiencia. beneficiarios productores de Agricultura oportuna y\nGuerrero mediante productores, capacidades el programa capacidades Rural. la realización y el uso de semillas sus promovidas de promovidas operación del mejoradas, control organizaciones, por los extensionismo por los Programa. Y agroecológico de las familias servicios de en el año servicios de que las plagas, fertilización rurales, así extensión e 2020 = 2,880 l extensión e condiciones integral y manejo como las innovación X 100 innovación climatológicas de poscosecha. instituciones rural para =288,000 / rural para sean especializadas incremento la 5,220 incrementar favorables en en la producción de productores la producción el presente\nPropósito Lograr capacitación e alimentos. atendidos en de alimentos, ciclo agrícola que los 2,880 investigación, el año 2018 = informes de P.V. 2020. productores en el sector 55.2% evaluación apliquen las agropecuario, realizados innovaciones de la acuícolas y por instancias agricultura de pesqueros. ejecutoras. conservación. Total de\nComponentes. Se productores apoyará con 48 beneficiados extensionistas con servicios para el logro de los de extensión resultados y desarrollo propuestos. de\nActividades. Se capacidades. realizarán capacitaciones en las parcelas y salones para el mejor entendimiento de las innovaciones.\n8.5. Auditoría\nLos recursos ejercidos en el Programa, podrán ser fiscalizados por la Secretaría de Contraloría y\nTrasparencia Gubernamental y demás instancias que el ámbito de sus respectivas atribuciones resulte competente.\nComo resultado de las acciones de auditoría que se lleven a cabo la Secretaría de Contraloría y\nTrasparencia Gubernamental, mantendrá un seguimiento interno que permita emitir los informes de las revisiones practicadas, dando principal importancia a la atención en tiempo y forma de las irregularidades detectadas, hasta su total solventación.\n8.6. Recursos no devengados hubiese aplicado a los fines autorizados, y los recursos que por cualquier motivo no estuviesen devengados al 31 de diciembre de cada ejercicio fiscal, será reintegrado inmediatamente a la Secretaría de Finanzas y\nAdministración del Estado de Guerrero, instancia normativa del ejercicio y control del gasto público.\n8.7. Contraloría social\nEJERCICIO FISCAL 2020\nSe establecerán acciones de control, vigilancia y evaluación, bajo un esquema de derechos y compromisos ciudadanos, con el propósito de contribuir a que la gestión gubernamental se realice en términos de transparencia, eficacia y honradez.\nEstas actividades estarán a cargo de los miembros de la comunidad, incluidas personas integrantes del comité o instancia asociativa de las beneficiarias y beneficiarios del Programa.\nLa instancia operadora promoverá la contraloría social con base en la normatividad establecida para tal efecto, fomentando acciones que transparenten la operación del Programa en cuestión.\nLas acciones a fomentar serán las siguientes:\na) Informar a la ciudadanía acerca de los apoyos otorgados y su costo a nivel de obra, acción, nombre de los beneficiarios, derechos y obligaciones de los mismos.\nb) Capacitar a las beneficiarias y beneficiarios para que se constituyan en instancias de vigilancia y evaluación social.\nc) Establecer espacios de comunicación (reuniones vecinales, atención directa a las beneficiarias y beneficiarios, etc.).\nd) Promover la integración de organizaciones de la sociedad civil en acciones de contraloría social.\ne) Instrumentar mecanismos de recepción y atención de quejas y denuncias. El Órgano interno de\nControl verificará, en lo correspondiente, la realización de dichas acciones.\n8.8. Formas de participación social\nETAPA EN LA QUE FORMA DE\nPARTICIPANTE MODALIDAD\nPARTICIPA PARTICIPACIÓN\nGrupos de Comités de control y\nImplementación Consulta\nTrabajo seguimiento\n8.9. Procedimiento de queja o inconformidad ciudadana desvío de recursos por parte de las servidoras y servidores públicos, se captarán por la Secretaría de\nContraloría y Transparencia Gubernamental y la Auditoría Superior del Estado, a través de denuncias por escrito, vía internet, vía telefónica y por comparecencia de la persona interesada. El sitio es\nLa persona denunciante o quejosa deberá proporcionar los siguientes datos:\nEJERCICIO FISCAL 2020\na) Nombre de la servidora o servidor público\nb) Dependencia de adscripción\nc) Objeto de la denuncia\nd) Nombre y domicilio de la persona quejosa e) Identificación oficial.\n8.10 Mecanismos de exigibilidad\nLas productoras y productores podrán verificar el estatus de su solicitud en la página electrónica campoguerrero.gob.mx.\nLa beneficiaria o beneficiario al recibir su notificación de autorización del apoyo, se le informará por escrito los requisitos que debe cumplir, para la entrega de los apoyos y el pago de los mismos, tendrá un plazo de 15 días para cumplir con lo anterior, (En los pagos la SAGADEGRO está sujeta a la disponibilidad presupuestal que la Secretaría de Finanzas y Administración asigne a esta Secretaría).\n8.11. Acta de entrega-recepción\nNo aplica en este programa.\n9. Criterios de selección y elegibilidad\n9.1. Método de selección de personas beneficiarias\nSerán susceptibles de apoyos todos los productores, de bajos ingresos del medio rural que se dediquen o quieran dedicarse a realizar actividades agrícolas, pecuarias, pesqueras y forestales.\nDeberán cumplir con presentar la documentación requerida en el numeral 6.2 de las presentes\nReglas de Operación, según sea el caso de solicitar apoyo de manera individual, por grupo u organización.\n10. Mecánica de operación\nLa Secretaría de Agricultura, Ganadería, Pesca y Desarrollo Rural, designará una persona responsable del Programa Extensionismo y Desarrollo de Capacidades y una persona auxiliar referido Programa y presentarán las solicitudes recibidas ante la SAGADEGRO, para que a través de su titular emita la autorización correspondiente, la cual se notificará de manera escrita a las beneficiarias y beneficiarios del Programa Extensionismo y Desarrollo de Capacidades, especificándole el concepto y monto de apoyo a recibir, así como los plazos de tiempo para hacer efectivo el apoyo, esta notificación se realizará a más tardar en 5 días hábiles de haber presentado la solicitud de apoyo. expedientes de las beneficiarias o beneficiarios, incluyendo la factura correspondiente para las revisiones a que haya lugar por parte de la Secretaría de Contraloría y Transparencia Gubernamental.\nEJERCICIO FISCAL 2020\n10.1. Instancia ejecutora\nLa Secretaría de Agricultura, Ganadería, Pesca y Desarrollo Rural, será la que ejercerá los recursos del Programa Extensionismo y Desarrollo de Capacidades, también, tendrá la responsabilidad de verificar que la formulación de los expedientes técnicos del Programa, reúnan los requisitos exigidos por la instancia normativa, tales como apego a la planeación estratégica, programación, presupuestación, calendario de ejecución, ejercicio y control del gasto público.\n10.2. Instancia administrativa y/o normativas\nLa Auditoría Superior del Estado y la Secretaría de Contraloría y Transparencia Gubernamental, vigilarán que la ejecución del Programa Extensionismo y Desarrollo de Capacidades sea con apego a la normatividad para asegurar el cumplimiento de los objetivos y metas trazados.\n10.3. Delimitación de atribuciones\nConforme a la Ley Orgánica de la Administración Pública del Estado de Guerrero, Número 08, en el Artículo 31 establece que SAGADEGRO, es el órgano encargado de promover y fomentar el desarrollo agrícola, forestal, ganadero, pesquero, así como del manejo de los recursos naturales en el Estado, procurando la participación de las mujeres, en igualdad de condiciones en estas actividades de diseño y planeación y cumplimiento correspondiéndole el despacho de los asuntos siguientes:\na) Elaborar los planes, programas y acciones, de corto, mediano y largo plazo, del sector agropecuario, forestal y pesquero, que respondan a un criterio de manejo sustentable de los recursos naturales, con la participación de las dependencias federales y estatales correspondientes, ayuntamientos, organizaciones de productores individuales y campesinos, en el seno de la Secretaría de Planeación y\nDesarrollo Regional del Estado de Guerrero, y coordinar su implementación.\nb) Formular y ejecutar los planes, programas y acciones para el desarrollo integral de las personas que viven y trabajan en zonas rurales del Estado, principalmente aquellos dirigidos a mejorar las condiciones de las mujeres.\nc) Fomentar, formular, supervisar y coordinar la operación de los programas de desarrollo agrícola, ganadero, pesquero con criterios de manejo sustentable de los recursos naturales.\nd) Apoyar la organización para la producción, coordinando con las dependencias federales afines y productores, las acciones para el financiamiento, seguros, insumos, asistencia técnica y administrativa, investigación, capacitación y transferencia de tecnología, en beneficio de mujeres, campesinos, ejidatarios, comuneros, pequeños propietarios y organizaciones de productores legalmente constituidos.\n11. Derechos, obligaciones y sanciones de las personas beneficiarias del programa\n11.1. Derechos\nEJERCICIO FISCAL 2020 de Capacidades, de acuerdo con los principios rectores de desarrollo social, así como a recibir un trato\nMexicanos.\n11.2. Obligaciones\na) Dar buen uso, conservación y/o mantenimiento de los bienes recibidos.\nb) Otorgar las facilidades y proporcionar la información necesaria a las instancias de coordinación, supervisión y control de los niveles de gobierno facultados para realizar visitas de inspección y monitoreo de los apoyos otorgados.\nc) Seguir las recomendaciones técnico-productivas emitidas por las instancias de gobierno.\nd) Mantener los apoyos por un plazo mínimo de tres años con el fin de que estén disponibles para las supervisiones físicas y documentales de las instancias de control y fiscalización.\n11.3. Sanciones\nLas beneficiarias y beneficiarios del Programa Extensionismo y Desarrollo de Capacidades que incumplan con las obligaciones, y/o presenten documentos falsos, la instancia normativa, definirá la sanción a la que se hará acreedora.\n12. Interpretación\nLa interpretación de las presente Reglas de Operación, para efectos administrativos, estará a cargo de la Secretaría de Agricultura, Ganadería, Pesca y Desarrollo Rural y de la Secretaría de Contraloría y Transparencia Gubernamental en el ámbito de sus respectivas competencias.\nPrimero. El presente Acuerdo entrará en vigor al día siguiente de su publicación en el Periódico\nSegundo. Se abroga el Acuerdo por el que se crea el Programa Extensionismo, Desarrollo de\nCapacidades y Asociatividad Productiva y se emiten sus Reglas de Operación para el Ejercicio Fiscal 2019, de 2019.\nTercero. A partir de la entrada en vigor del presente Acuerdo, las Reglas de Operación del\nPrograma Extensionismo y Desarrollo de Capacidades, subsecuentes o sus modificaciones, serán emitidas por la persona titular de la Secretaría de Agricultura, Ganadería, Pesca y Desarrollo Rural, responsable directa de la operación y ejecución de las mismas.\nEJERCICIO FISCAL 2020\nGobierno, Boulevard René Juárez Cisneros No. 62, Colonia Ciudad de los Servicios en la Ciudad de\nChilpancingo de los Bravo, Capital del Estado de Guerrero, a los 31 días del mes de enero del año dos mil veinte.\nEL GOBERNADOR CONSTITUCIONAL DEL ESTADO DE GUERRERO.\nLIC. HÉCTOR ANTONIO ASTUDILLO FLORES\nRúbrica.\nEL SECRETARIO GENERAL DE GOBIERNO.\nLIC. FLORENCIO SALAZAR ADAME.\nRúbrica.\nEL SECRETARIO DE AGRICULTURA, GANADERÍA, PESCA Y DESARROLLO RURAL.\nLIC. JUAN JOSÉ CASTRO JUSTO.\nRúbrica.",
  "ordenamiento": "PROGRAMA",
  "jurisdiccion": "GUERRERO",
  "fuente_oficial": "DIARIO OFICIAL DE LA FEDERACION",
  "Fecha de Publicación": "04 \nde Septiembre de 2020",
  "ULTIMA REFORMA PUBLICADA": null,
  "status": "VIGENTE",
  "es_escaneado": false,
  "tiene_tablas": true,
  "materia": [
    "general"
  ]
}