{
  "titulo": "Acuerdo por el Que Se Crea y Emiten las Reglas de Operación del Programa de Atención A Grupos Priori",
  "Contenido": "TEXTO ORIGINAL. de Marzo de 2024.\nACUERDO POR EL QUE SE CREA Y EMITEN LAS REGLAS DE OPERACIÓN DEL\nPROGRAMA DE ATENCIÓN A GRUPOS PRIORITARIOS.\nGuerrero. - Poder Ejecutivo.\nMAESTRA EVELYN CECIA SALGADO PINEDA, GOBERNADORA CONSTITUCIONAL DEL ESTADO\nDE GUERRERO, CON FUNDAMENTO EN LO DISPUESTO POR LOS ARTÍCULOS 4o PÁRRAFOS\nTERCERO Y NOVENO DE LA CONSTITUCIÓN POLÍTICA DE LOS ESTADOS UNIDOS MEXICANOS;\n167 DE LA LEY GENERAL DE SALUD; 3 DE LA LEY DE ASISTENCIA SOCIAL; 3 FRACCIÓN XVIII\nDEL PRESUPUESTO DE EGRESOS DE LA FEDERACIÓN PARA EL EJERCICIO FISCAL 2023; 40 DE\nLA LEY DE COORDINACIÓN FISCAL; 71, 87, 88, 90 NUMERAL 2 Y 91 FRACCIONES I, IX Y XLVI DE\nEJERCICIO DE LAS FACULTADES QUE ME CONFIEREN LOS ARTÍCULOS 1 PÁRRAFO TERCERO,\n4, 9 Y 46 FRACCIÓN I DE LA LEY ORGÁNICA DE LA ADMINISTRACIÓN PÚBLICA DEL ESTADO DE\nGUERRERO NÚMERO 242; 15 DE LA LEY SOBRE EL SISTEMA ESTATAL DE ASISTENCIA SOCIAL\nNÚMERO 332; EN RELACIÓN CON EL ARTÍCULO 47 Y ANEXOS 23 (P38) Y 23-A DEL DECRETO\nNÚMERO 680 RELATIVO AL PRESUPUESTO DE EGRESOS DEL ESTADO DE GUERRERO PARA EL\nEJERCICIO FISCAL 2024; ESTRATEGIA INTEGRAL DE ASISTENCIA SOCIAL, ALIMENTACIÓN Y\nDESARROLLO COMUNITARIO 2024 Y LOS LINEAMIENTOS PARA LA ELABORACIÓN DE LAS\nREGLAS DE OPERACIÓN DE LOS PROGRAMAS SOCIALES ESTATALES PARA EL PERIODO 2022-\n2027.\nQue el Plan Nacional de Desarrollo 2019-2024 en su Eje Rector Por el Bien de Todos, Primero los\nPobres establece “Así como Benito Juárez consumó la separación entre la Iglesia y el Estado, la Cuarta\nTransformación se ha propuesto separar el poder político del poder económico. La connivencia y la fusión corporativos en detrimento de la población. Pero una sociedad que se desentiende de sus miembros más débiles y desvalidos rompe el principio de empatía que es factor indispensable de cohesión, instaura la ley del más fuerte y acaba en un total envilecimiento”.\nQue el Plan Estatal de Desarrollo 2022-2027, contempla en su eje 1 el bienestar, desarrollo humano y justicia social, con dos objetivos que justifican la creación de este proyecto, los cuales son, mejorar la calidad de vida de la población y disminuir las desigualdades a través de la atención a grupos vulnerables.\nQue la visión de futuro para nuestro Estado es de derechos e inclusión, siendo una de las prioridades contribuir a reducir las carencias sociales, entre las que destacan la educativa con 23.7 por ciento en esta condición, servicios de salud con 13.8 por ciento, carencia de acceso a la seguridad social con 75.6 por ciento y carencia alimentaria con 27.8 por ciento. Por lo que la alimentación, educación, salud, seguridad social y pública son los principales indicadores por mejorar.\nQue en este sentido, el Proyecto de Presupuesto de Egresos para el Ejercicio Fiscal 2024 tiene como objetivo optimizar la ejecución de la planeación, mediante la asignación de presupuesto de forma analítica, considerando las actividades prioritarias del estado de Guerrero, dentro de las que principalmente se encuentran, la disminución de la pobreza y traer paz a las familias guerrerenses.\nEl uso de recursos federales del Fondo Aportaciones Múltiples (Asistencia Social), implica responsabilidades para las Entidades Federativas, de acuerdo con la Ley de Coordinación Fiscal.\nAsimismo, los Sistemas Estatales para el Desarrollo Integral de la Familia como entidad ejecutora, deben publicar las reglas de operación a las que se sujetarán los programas en cada ejercicio fiscal, de acuerdo con el principio de fortalecimiento del pacto federal y del municipio libre establecido en el artículo 2o, fracción V de la Ley de Planeación, en los artículos 134 Constitucional y 1, 2, 4, 5, 75 y 77 de la Ley Federal de Presupuesto y Responsabilidad Hacendaria.\nQue en el artículo 47 del Decreto Número 680 relativo al Presupuesto de Egresos del Estado de Guerrero, para el Ejercicio Fiscal 2024, establece que con el objeto de asegurar la aplicación eficiente, eficaz, oportuna equitativa y transparente de los recursos públicos la Secretaría de Finanzas y Administración y la\nSecretaría de Planeación y Desarrollo Regional emitirán las disposiciones a que deberán sujetarse los programas de inversión sujetos a reglas de operación.\nQue por lo anterior, la Secretaría de Planeación y Desarrollo Regional, expidió los Lineamientos para la\nElaboración de las Reglas de Operación de los Programas Sociales Estatales para el periodo 2022-2027, publicadas en el Periódico Oficial del Gobierno del Estado número 14 de fecha 18 de febrero de 2022. Los cuales tienen la finalidad de ofrecer a las Secretarías, Dependencias y Entidades Paraestatales del\nGobierno del estado un instrumento técnico que guíe la elaboración de los apartados centrales de las reglas de operación, así como los elementos para integrar su contenido. Además, cumple con el mandato señalado en el Decreto Número 680 del Presupuesto de Egresos del Estado de Guerrero para el Ejercicio\n2024, en el Capítulo IV, artículo 47, que establece la obligatoriedad de elaboración de las Reglas de\nOperación de los Programas Sociales.\nQue las personas titulares, dependencias y entidades de la administración pública estatal, así como las de estas, serán responsables de los programas y proyectos que estos realicen, deberán ser sujetos a los criterios de objetividad, equidad, transparencia, publicidad, selectividad y temporalidad.\nEn razón de lo mencionado anteriormente, se pone en marcha a nivel nacional el Programa de Atención\nAlimentaria a Grupos Prioritarios, a través de la Estrategia Integral de Asistencia Social Alimentaria y\nDesarrollo Comunitario 2024 teniendo como objetivo contribuir a modificar las condiciones de vida de las impidan el desarrollo integral de las personas y/o familia. Por lo que este programa sus reglas de operación se sujetan al modelo de esta estrategia.\nPor lo anteriormente expuesto y con fundamento en las disposiciones legales antes citadas, he tenido a bien expedir el siguiente:\nATENCIÓN A GRUPOS PRIORITARIOS.\nArtículo 1. Se crea el programa de atención a Grupos Prioritarios, el cual tiene como objetivo contribuir para mejorar las condiciones de vida de los Grupos de Atención Prioritaria, así como favorecer el envejecimiento activo y saludable, la atención a las personas con discapacidad en materia de\nRehabilitación e Inclusión y la atención a la Primera Infancia.\nArtículo 2. Se emiten las Reglas de Operación del de Atención a Grupos Prioritarios, que establece los principios de eficiencia, eficacia, oportunidad, equitativa y transparencia de los recursos públicos y requisitos que se deben de cumplir para poder acceder ha dicho programa.\nArtículo 3. El Sistema para el Desarrollo Integral de la Familia del Estado de Guerrero, tendrá a cargo la implementación, operación, ejecución, evaluación y administración del de Atención a Grupos Prioritarios, bajo los criterios de objetividad, equidad, transparencia, publicidad, selectividad y temporalidad, con estricto apego a la normatividad aplicable, por lo tanto, será el encargado de la dispersión y asignación de los recursos del Programa apegándose plenamente a las siguientes:\nREGLAS DE OPERACIÓN DEL PROGRAMA DE ATENCIÓN A GRUPOS PRIORITARIOS.\n1. Introducción.\nLa Ley de Asistencia Social (LAS), mandata la garantía de atención de los Grupos de Atención Prioritaria, conformados por mujeres; niñas, niños y adolescentes; personas jóvenes; personas mayores; personas con discapacidad; personas de la diversidad sexual; personas víctimas; personas en situación de calle; personas que residen en instituciones de asistencia social; personas afro-descendientes y personas indígenas. El Sistema Estatal para el Desarrollo Integral de las Familias del Estado de Guerrero fomenta acciones que garanticen su protección a través de los Programa de Atención a Grupos Prioritarios plasmado en la Estrategia Integral de Asistencia Social, Alimentación y Desarrollo Comunitario 2024\n(EIASADC).\nPrioritaria, a consecuencia de los factores sociales que impiden el desarrollo integral del individuo y/o familias, así como favorecer el envejecimiento activo y saludable mediante la atención a las personas mayores en Casas de Día, la atención a las personas con discapacidad en materia de Rehabilitación e\nInclusión, y la atención a la Primera Infancia en los Centros de Atención Infantil en cualquiera de sus modalidades, además de brindar protección, promoción y restitución de los derechos de las niñas, niños y adolescentes.\nPara dar cumplimiento a este objetivo el programa cuenta con 4 componentes para una mejor atención de las necesidades de nuestros Grupos de Atención Prioritaria.\nConsiderando las acciones y/o proyectos asistenciales a ejecutarse por el SEDIF Guerrero, en el Ejercicio\nFiscal 2024 y que serán subsidiados a través del Programa de Atención a Grupos Prioritarios, estos se población objetivo.\nEl programa se alinea al Plan Nacional de Desarrollo 2019-2024, en su Eje Central II. Política Social, en el apartado “Construir un país con Bienestar”, establece que el objetivo más importante es que en 2024 la de Bienestar 2020-2024, como un instrumento que concentra las estrategias, objetivos, prioridades y acciones puntuales necesarias para alcanzar tal objetivo; mismas que deberán regir el desempeño de las funciones de la Administración Pública Federal en dicho sector.\nCOMPONENTE 1: ATENCIÓN E INCLUSIÓN SOCIAL.\nSubprograma de Atención a Personas con Discapacidad:\nAsimismo, se alinea al Eje 1 del Plan Estatal de Desarrollo 2021-2027, Bienestar, Desarrollo Humano y\nJusticia Social. Objetivo 1.3 Disminuir las desigualdades a través de la atención a grupos vulnerables.\nEstrategia 1.3.1 Garantizar el pleno goce de los derechos fundamentales de las niñas, niños y adolescentes; Línea de acción 1.3.1.2 Mejorar la funcionalidad de las niñas y niños con parálisis cerebral y personas con espasticidad mediante la aplicación de toxina botulínica tipo “A”, para disminuir el tono muscular y la rigidez, favoreciendo los resultados de la terapia física y otras modalidades.\nAsimismo, se alinea al Eje 1 del Plan Estatal de Desarrollo 2021-2027, Bienestar, Desarrollo Humano y\nJusticia Social. Objetivo 1.3 Disminuir las desigualdades a través de la atención a grupos vulnerables.\nEstrategia 1.3.2 Atención prioritaria a grupos vulnerables. Línea de acción 1.3.2.1 Implementar acciones de terapias medicinales, jornadas de detección de cáncer mamario y prostático, jornadas de entrega de implantes mamarios post cáncer mamario, jornadas quirúrgicas de implantes, jornadas de lentes (bifocales y monofocales), jornadas de prótesis dental total o parcial removible, atención a personas que sufran de algún tipo de quemadura para su traslado, atención y medicinas la realización de pruebas rápidas para la detección de SARS-CoV-2.\nAsimismo, se alinea al Eje 1 del Plan Estatal de Desarrollo 2021-2027, Bienestar, Desarrollo Humano y\nJusticia Social. Objetivo 1.3 Disminuir las desigualdades a través de la atención a grupos vulnerables.\nEstrategia 1.3.2 Atención prioritaria a grupos vulnerables. Línea de acción 1.3.2.3 Entrega de sillas de ruedas, aparatos funcionales, prótesis y órtesis a personas con discapacidad temporal o permanente para favorecer su rehabilitación y/o inclusión social.\nAsimismo, se alinea al Eje 1 del Plan Estatal de Desarrollo 2021-2027, Bienestar, Desarrollo Humano y\nJusticia Social. Objetivo 1.3 Disminuir las desigualdades a través de la atención a grupos vulnerables.\nEstrategia 1.3.2 Atención prioritaria a grupos vulnerables. Línea de acción 1.3.2.4 Entrega de aparatos auditivos a personas en situación de riesgo o vulnerabilidad que presentan discapacidad auditiva congénita o adquirida de forma parcial o total.\nCOMPONENTE 3: OTROS APOYOS DE ATENCIÓN SOCIAL.\nSubprograma de Otros apoyos de Atención Social.\nEn relación al Plan Estatal de Desarrollo 2022-2027 en su Eje I Bienestar, Desarrollo Humano y Justicia\nSocial; Objetivo 1.1 Reducir la pobreza de los Guerrerenses; Estrategia 1.1.1 Aumento del ingreso económico de la población en situación de pobreza, impulsando su integración al mercado laboral y apoyando su desarrollo integral: Línea de acción 1.1.1.1 Impulsar apoyos para la implementación de familia en situación de vulnerabilidad.\nAsimismo, se alinea al Eje 1 del Plan Estatal de Desarrollo 2021-2027, Bienestar, Desarrollo Humano y\nJusticia Social. Objetivo 1.1 Reducir la pobreza de los Guerrerenses; Estrategia 1.1.1 Aumento del ingreso económico de la población en situación de pobreza, impulsando su integración al mercado laboral y apoyando su desarrollo integral; Línea de acción 1.1.1.3 Entregar apoyos económicos o en especie para atender problemáticas emergentes relacionadas con aspectos de salud, económicos y ante algún desastre natural.\nAsimismo, se alinea al Eje 1 del Plan Estatal de Desarrollo 2021-2027, Bienestar, Desarrollo Humano y\nJusticia Social. Objetivo 1.1 Reducir la pobreza de los Guerrerenses; Estrategia 1.1.1 Aumento del ingreso económico de la población en situación de pobreza, impulsando su integración al mercado laboral y apoyando su desarrollo integral; Línea de acción 1.1.1.4 Distribuir útiles escolares y libros de apoyo.\nAsimismo, se alinea al Eje 1 del Plan Estatal de Desarrollo 2021-2027, Bienestar, Desarrollo Humano y\nJusticia Social. Objetivo 1.2 Mejorar la calidad de vida de la población; Estrategia 1.2.2 Combate al Hambre y aumentar el acceso a una alimentación sana, nutritiva y suficiente, con particular atención a la población más pobre y en situación de vulnerabilidad incluidas niñas y niños; Línea de Acción 1.2.2.1 Incentivar la producción de alimentos sanos y nutritivos para el autoconsumo en escuelas de nivel básico de niñas, niños y adolescentes.\nCOMPONENTE 4: PROTECCIÓN A NIÑAS, NIÑOS Y ADOLESCENTES\nSubprograma de consolidación de modalidades de cuidados alternos.\nAsimismo, se alinea al Eje 1 del Plan Estatal de Desarrollo 2021-2027, Bienestar, Desarrollo Humano y\nJusticia Social. Objetivo 1.3 Disminuir las desigualdades a través de la atención a grupos vulnerables.\nEstrategia 1.3.1 Garantizar el pleno goce de los derechos fundamentales de las niñas, niños y adolescentes; Línea de acción 1.3.1.1 Impulsar proyectos de atención a las niñas, niños y adolescentes para prevenir riesgos psicosociales, mediante la coordinación de acciones integrales.\nAsimismo, se alinea al Eje 1 del Plan Estatal de Desarrollo 2021-2027, Bienestar, Desarrollo Humano y\nJusticia Social. Objetivo 1.3 Disminuir las desigualdades a través de la atención a grupos vulnerables.\nEstrategia 1.3.2 Atención prioritaria a grupos vulnerables. Línea de acción 1.3.2.8 Impulsar acciones que eliminen el abuso sexual infantil, la prevención de la violencia intrafamiliar y otras que afectan de manera particular a los niños, niñas y adolescentes de la entidad.\nLas presentes Reglas del Operación corresponden al Programa de Atención a Grupos Prioritarios, programa que se establece en la EIASADC 2024, estas reglas tendrán vigencia al 31 de diciembre del\n2024.\n2. Antecedentes. ejercicio de sus derechos y son vulnerables en cualquier momento de su ciclo de vida. Entre las personas en situación de vulnerabilidad se ha identificado a las Personas con Discapacidad, las Niñas, Niños y\nAdolescentes en desamparo.\nLa Constitución Política de los Estados Unidos Mexicanos establece en su artículo 1o. que todas las internacionales en los que el Estado Mexicano sea Parte, así como de las garantías para su protección.\nIgualmente determina que todas las autoridades tendrán la obligación de promover, respetar, proteger y garantizar los derechos humanos, de conformidad con los principios de universalidad, interdependencia, indivisibilidad y progresividad.\nPara el SEDIF Guerrero el bienestar de las personas de Atención Prioritaria es de suma importancia, el cual se deriva de los artículos 3° y 4° Constitucionales y, se consolida través de la Ley General de Salud y la Ley de Asistencia Social, que contribuye a garantizar su cumplimiento.\nA nivel nacional el Consejo de Evaluación de la Política de Desarrollo Social (CONEVAL), presentó las estimaciones de pobreza multidimensional 2022 y entre los principales resultados, destaca que:\nEntre 2018 y 2022, el porcentaje de la población en situación de pobreza multidimensional a nivel nacional pasó de 41.9% a 36.3%, en otras palabras, en 2022, 36 de cada 100 personas en México presentaban al menos una privación en sus derechos sociales y tenían un ingreso mensual por persona insuficiente para adquirir una canasta alimentaria, así como bienes y servicios necesarios.\nEl porcentaje de la población con un ingreso inferior a la Línea de Pobreza Extrema por Ingresos (valor monetario de la canasta alimentaria) pasó de 14.0% a 12.1%, entre 2018 y 2022, lo que representó un cambio de 17.3 a 15.5 millones de personas que no tienen el ingreso suficiente para adquirir los productos de la canasta alimentaria. El valor monetario de referencia para la Línea de Pobreza Extrema por Ingreso por persona al mes fue de $2,086.21 y $1,600.18 en zonas urbanas y rurales, respectivamente.\nRespecto a estadísticas estatales, de acuerdo con los resultados de la medición de la pobreza (CONEVAL\n2020) en el 2018, en Guerrero, el 66.5% de la población de la entidad vivía en situación de pobreza, es decir, 2,412,200 personas, aproximadamente. De este universo, el 39.7% (cerca de 1,440,800 personas) estaba en situación de pobreza moderada, mientras que el 26.8% de la población se encontraba en situación de pobreza extrema (alrededor de 971,400 personas). El porcentaje de pobreza es 24.6 puntos porcentuales mayor que el porcentaje nacional (41.9%).\nLa situación de los grupos vulnerables en Guerrero, de acuerdo al CONEVAL 2020:\nEl porcentaje de menores de edad en pobreza fue 23.5 puntos porcentuales mayor que el porcentaje nacional en el mismo año. En 2018, la entidad ocupó el lugar 2 respecto a las demás entidades federativas por su porcentaje de menores de edad en pobreza, con aproximadamente 935,100 menores de edad en esta situación.\nRespecto a los Adultos Mayores el porcentaje en pobreza se situó 23.4 puntos por arriba del porcentaje nacional en el mismo año. En 2018, Guerrero ocupó el lugar 3 respecto a las demás entidades federativas por su porcentaje de adultos mayores en situación de pobreza, con aproximadamente 206,000 adultos mayores.\nEl porcentaje de personas con discapacidad en situación de pobreza estuvo 14.0 puntos porcentuales por arriba del porcentaje nacional en el mismo año. En 2018, el estado ocupó el lugar 5 respecto a las demás entidades federativas por su porcentaje de población con discapacidad en situación de pobreza, lo que equivale a aproximadamente 211,100 personas.\nEn 2018, Guerrero ocupó el lugar 3 respecto a las demás entidades federativas por su porcentaje de mujeres en pobreza, que equivale a aproximadamente 1, 259,700 mujeres en esta situación. las barreras para ejercer sus derechos sociales y la adquisición de una variedad de bienes para la satisfacción de sus necesidades esenciales.\nLa atención a las personas en situación de vulnerabilidad por parte del Sistema Estatal DIF Guerrero, ha sido realizada con el apoyo de los recursos provenientes del Ramo General 33, mediante el Fondo de\nAportaciones Múltiples, en su componente de Asistencia Social (FAM-AS). En este sentido, el seguimiento y la coordinación del Sistema Nacional DIF en esa materia, a pesar de ser el Coordinador del Sistema\nNacional de Asistencia Social Pública y Privada, había sido muy limitada, por lo que a partir del ejercicio\n2019, se comenzó a solicitar información a las Entidades Federativas en la materia; teniendo como resultado la identificación de diversos apoyos de asistencia social, enmarcados en los artículos 4 y 12 de la LAS, tales como, de manera enunciativa y no limitativa, aparatos funcionales para personas con discapacidad; protección y restitución de derechos de niñas, niños y adolescentes; apoyos a centros de asistencia social; atención a la salud; equipamiento de albergues y casas hogar; atención a personas en movilidad; atención a adultos mayores; así como, Centros de Atención Infantil; Capacitaciones para el auto empleo y para el desarrollo comunitario, entre otra.\nDerivado de ello, a partir del Ejercicio Fiscal 2022 se incorpora a la EIASADC el Programa de Asistencia\nSocial a Personas en Situación de Vulnerabilidad que contó con la participación de 26 Sistemas Estatales\nDIF, en 2023, comienza a llamarse, Programa de Atención a Grupos Prioritarios y se establecieron 3\nComponentes de atención de acuerdo a las características de la población objetivo, para este año se contó con la participación de 31 Sistemas Estatales DIF, para este año 2024 se incorpora un cuarto componente que pertenece a la Procuraduría Federal de Protección de Niñas, Niños y Adolescentes y se descarta el subprograma de Niñas, Niños y Adolescentes en situación de movilidad para evitar la duplicidad del recurso.\n3. Glosario de términos.\nAGEB: Es la extensión territorial que corresponde a la subdivisión de las áreas geoestadísticas municipales. Constituye la unidad básica del Marco Geoestadístico Nacional y, dependiendo de sus características, se clasifican en dos tipos: urbana y rural.\nAGEB Urbana: Área geográfica ocupada por un conjunto de manzanas que generalmente va de 1 a 50, preferentemente delimitadas por calles, avenidas, andadores o cualquier otro rasgo de fácil identificación en el terreno y cuyo uso del suelo sea principalmente habitacional, industrial, de servicios, comercial, etcétera, sólo se asignan al interior de las localidades urbanas.\nAGEB Rural: Subdivisión de las áreas geoestadísticas municipales que se ubican en la parte rural, cuya extensión territorial es variable y se caracteriza por el uso del suelo de tipo agropecuario o forestal. Contiene localidades rurales y extensiones naturales como pantanos, lagos, desiertos y otros, delimitada por lo general por rasgos naturales (ríos, arroyos, barrancas, etcétera) y culturales (vías de ferrocarril, líneas de conducción eléctrica, carreteras, brechas, veredas, ductos, límites prediales, etcétera).\nAudición: Constituye los procesos psicofisiológicos que proporcionan al ser humano la capacidad de oír.\nAsistencia Social: Conjunto de acciones tendientes a modificar y mejorar las circunstancias de carácter social que impiden el desarrollo social del individuo, así como la protección física, mental y social de personas en estado de necesidad.\nAparato Funcional: Objeto que ayuda a una persona con discapacidad a realizar cierta tarea.\n(sic)Asistencia Social: Conjunto de acciones tendientes a modificar y mejorar las circunstancias de carácter social que impiden el desarrollo social del individuo, así como la protección física, mental y social de personas en estado de necesidad.\nArticulación: Es la unión entre dos o más huesos, un hueso y cartílago.\nAndadera: Armazón, generalmente montado sobre ruedas, que sirve para sostener a un niño cuando empieza a andar o a un adulto que precisa algo donde sostenerse para andar.\nBeneficiarias y Beneficiarios. Población con características específicas a la que van dirigidas los programas y apoyos de asistencia social.\nBastón: Es un dispositivo para caminar, ayuda a compensar una reducción de fuerza, amplitud de movimiento, estabilidad de las articulaciones, coordinación o resistencia.\nTambién puede reducir la carga en una articulación o un miembro dolorido.\nCataratas: Opacidad del cristalino de los ojos que normalmente es transparente.\nCirugía: Se denomina cirugía a la práctica que implica la manipulación mecánica de las estructuras anatómicas con un fin médico, bien sea diagnóstico, terapéutico o pronóstico.\nComunidad: Personas que en conjunto habitan un espacio geográfico determinado, que generan un sentido de pertenencia e identidad social, que interaccionan entre sí, operando redes de comunicación y apoyo mutuo, para lograr determinados objetivos, intereses, satisfacer necesidades, resolver problemas y desempeñar funciones sociales relevantes para su localidad.\nComité: Grupo de personas con representación de la comunidad o grupo organizado para participar en los programas de los que son beneficiarias o beneficiarios.\nCalidad de Vida: Concepto utilizado para evaluar el bienestar social general de individuos y sociedades por sí mismas, es decir, informalmente la calidad de vida es el grado en que los individuos o sociedades tienen altos valores en los índices de bienestar social.\nDiscapacidad: Alteración funcional permanente, transitoria o prolongada, motora, sensorial o mental que, en relación con su edad y medio social, implique desventajas considerables para su adecuada integración social o laboral.\nDiscapacidad Visual: Se define con base en la agudeza visual y el campo visual. Se habla de discapacidad visual cuando existe una disminución significativa de la agudeza visual aun con el uso de lentes, o bien, una disminución significativa del campo visual.\nGrupos Prioritarios: Persona o grupo que, por sus características de desventaja por edad, sexo, estado civil; nivel educativo, origen étnico, situación o condición física y/o mental; requieren de un esfuerzo adicional para incorporarse al desarrollo y a la convivencia.\nImplante: Colocación de un aparto en el cuerpo de un ser vivo mediante una intervención quirúrgica en sustitución de otro órgano, o de una parte de él, para mejorar su funcionamiento.\nLente monofocal: permite la corrección de cualquier clase de error refractivo, como la presbicia, el astigmatismo, la hipermetropía o la miopía.\nLentes bifocales: son aquellas que cuentan con dos distancias focales distintas. Así, con la parte inferior se facilita lo que es la visión de los elementos que están más cercanos y con la parte superior se permite poder ver correctamente lo que son los objetos que están más lejanos.\nMuletas: Bastón de metal o madera con el extremo superior adaptado para colocar la axila o el antebrazo y la mano, utilizado para apoyarse al andar las personas que tienen alguna dificultad.\nPrótesis: Es una extensión artificial que reemplaza alguna parte del cuerpo.\nPobreza: Una persona se encuentra en situación de pobreza cuando presenta al menos una carencia social y no tiene un ingreso suficiente para satisfacer sus necesidades.\nPobreza Extrema: Una persona se encuentra en situación de pobreza extrema cuando presenta tres o más carencias sociales y no tiene un ingreso suficiente para adquirir una canasta alimentaria.\nRehabilitación: Es un proceso de duración limitada y con un objetivo definido, encaminado a permitir que una persona con deficiencia alcance un nivel físico, mental y/o social funcional óptimo, proporcionándole así los medios de modificar su propia vida.\n(sic)Rehabilitación: Es un proceso de duración limitada y con un objetivo definido, encaminado a permitir que una persona con deficiencia alcance un nivel físico, mental y/o social funcional óptimo, proporcionándole así los medios de modificar su propia vida.\n(sic)Rehabilitación: Es un proceso de duración limitada y con un objetivo definido encaminado a permitir que una persona con deficiencia alcance un nivel físico, mental y/o social funcional optimo, proporcionándole así los medios de modificar su propia vida.\n(sic)Rehabilitación: Es un proceso de duración limitada y con un objetivo definido, encaminado a permitir que una persona con deficiencia alcance un nivel físico, mental y/o social funcional óptimo, proporcionándole así los medios de modificar su propia vida.\nSilla de ruedas: Forman parte de las ayudas técnicas, es decir, de los dispositivos físicos de aplicación que posibilitan o mejoran la realización de actividades del aparato locomotor mermadas por deficiencias, discapacidades de tipo parcial o total.\n4. Objetivo general.\nContribuir para mejorar las condiciones de vida de los Grupos de Atención Prioritaria, a consecuencia de los factores sociales que impiden el desarrollo integral del individuo y/o familias, así como favorecer el envejecimiento activo y saludable mediante la atención a las personas mayores en Casas de Día, la atención a las personas con discapacidad en materia de Rehabilitación e Inclusión, y la atención a la\nPrimera Infancia en los Centros de Atención Infantil en cualquiera de sus modalidades, además de brindar protección, promoción y restitución de los derechos de las niñas, niños y adolescentes.\n4.1 Objetivo Específico.\nCOMPONENTE 1: ATENCIÓN E INCLUSIÓN SOCIAL.\nSubprograma de Atención a Personas con Discapacidad.\n• Fomentar la ejecución de acciones enfocadas a que las personas con atención prioritaria que cuenten con medios que fortalezcan su inclusión social. Acciones cuyos objetivos se vinculen intrínsecamente con el Plan Nacional, Estatal de Desarrollo o con el Programa Nacional de Asistencia Social.\n• Equipamiento a Centros y Unidades de Rehabilitación que se consideren como prioritarios, así como la entrega de apoyos funcionales.\nSubprograma de Atención a Personas Mayores.\n• Fomentar el envejecimiento saludable a través de la participación de las personas mayores favoreciendo su desarrollo psico mental, promover el bienestar físico entorno a un ámbito social que garantice una protección adecuada frente a las situaciones de riesgo.\nCOMPONENTE 3: OTROS APOYOS DE ATENCIÓN SOCIAL.\nSubprograma de Otros Apoyos de Atención Social.\n• Realizar acciones tendientes a modificar y mejorar las circunstancias de carácter social que impidan el desarrollo integral del individuo, así como la protección física, mental y social de personas en estado de necesidad, indefensión, desventaja física y mental hasta lograr su incorporación a una vida plena y productiva.\n• Brindar servicios y apoyos para modificar, mejorar y favorecer las condiciones de vida de los individuos y familias que por sus condiciones físicas, mentales, jurídicas, económicas o sociales previsto en los artículos. 4° y 12° LAS.\nCOMPONENTE 4: PROTECCION A NIÑAS, NIÑOS Y ADOLESCENTES\nSubprograma de Consolidación de Modalidades de Cuidados Alternativos.\n• Apoyar a las PPNNA de las entidades federativas para que avancen en el cumplimiento de las obligaciones derivadas de la Ley General de los Derechos de Niñas, Niños y Adolescentes, así como con los compromisos asumidos en la Conferencia Nacional de Procuradoras y Procuradores de\nProtección de Niñas, Niños y Adolescentes.\n5. Cobertura.\nEl Programa de Atención a Grupos Prioritarios tendrá cobertura estatal priorizando los Municipios y\nLocalidades de alto y muy alto grado de marginación del estado de Guerrero.\n6. Población y focalización.\n6.1 Población potencial.\nLa población potencial de Atención Prioritaria en el Estado de Guerrero está conformada por los siguientes sectores de población:\nGrupo Prioritario Población Total Fuente de Información\nPersonas en situación de Estimaciones de CONAPO con\n1,676,078 vulnerabilidad base en INEGI 2020\n269,092 (7.6% de la población total\nPersonas Mayores de 60 Años INEGI 2020 del estado)\n669,526 (36% de la población total\nPersonas con Discapacidad INEGI 2020 del estado)\n1,2 millones de NNA de 0-17 años\nNiñas, Niños y Adolescentes. INEGI 2020\n(35% de la población)\n6.2. Población objetivo.\nCOMPONENTE 1: ATENCIÓN E INCLUSIÓN SOCIAL.\nSubprograma de Atención a Personas con Discapacidad:\nBeneficiar a 7,247 personas con discapacidad, motriz, visual y auditiva, temporal o permanente, mediante la entrega de los siguientes apoyos:\n• 2264 ‘Silla de Ruedas de 18”.\n• 70 ‘Silla de Ruedas PCI.\n• 70 ‘Silla de Ruedas PCA.\n• 70 ‘Carriola Infantil PCI.\n• 150 ‘Silla de Ruedas Infantil.\n• 200‘Bastón recto.\n• 210 ‘Bastón 4 puntos.\n• 400 ‘Andadera ortopédica.\n• 250 ‘Muletas Axilares.\n• 789 ‘Aparatos Auditivos.\n• 30 ‘Prótesis Transfemoral.\n• 31 ‘Prótesis Transtribial.\n• 2260 ‘Lentes Monofocales Y Lentes Bifocales.\n• 85 ‘Cirugía de Implante de Rodilla.\n• 368 ‘Cirugías de Cataratas.\nSubprograma de Atención a Personas Mayores.\nBeneficiar a 470 personas mayores de 60 años mediante la rehabilitación 2 casas de día.\nCOMPONENTE 3: OTROS APOYOS DE ATENCIÓN SOCIAL.\nSubprograma de Otros apoyos de Atención Social.\nA través de este subprograma se beneficiará a 1199 familias, 45,350 alumnos de nivel prescolar y primaria, 700 personas en situación de vulnerabilidad, 20,680 personas que habiten en la región Montaña y Sierra del Estado de Guerrero, 1,000 personas con discapacidad y 81 personas con necesidades de atención médica, mediante la entrega de los siguientes apoyos.\n• 150 ‘Paquetes de Insumos y Enseres Agrícolas.\n• 899 ‘Estufas Ecológicas.\n• 150 ‘Paneles Solares.\n• 93 ‘Huertos Escolares Pedagógicos (HEP), Familiar o Comunitario.\n• 264 ‘Comedores.\n• 650 ‘Capacitaciones para el autoempleo.\n• 50 ‘Ataúdes y traslados.\n• 5000 ‘Mochilas y útiles escolares.\n• 100 ‘Equipamiento de escuelas.\n• 20,680 ‘Cobertores.\n• 81´Apoyos Médicos para Grupos Prioritarios (Pago de estudios médicos, Insumos médicos, Pruebas Covid-19, Aplicación de Toxina Botulínica Tipo “A”, Medicamentos, Cirugía en general.\n• Equipamiento de 2 playas incluyentes.\nCOMPONENTE 4: PROTECCIÓN A NIÑAS, NIÑOS Y ADOLESCENTES\nSubprograma de consolidación de modalidades de cuidados alternos.\nSe pretende, certificar a 50 familias, de los municipios de Chilpancingo y Acapulco Guerrero, lo anterior de acuerdo al volumen de solicitudes recibidas y beneficiar a 100 Niñas, Niños y Adolescentes entre nacionales y en Contexto de Movilidad Humana que, por diversas circunstancias, tienen restringido su derecho a vivir en familia, integrándolos a un núcleo familiar, que, de acuerdo con su situación particular, se haga cargo de su crianza y desarrollo hasta que la autoridad competente determine una medida definitiva, en consonancia con su interés superior, mismo que debe ser considerado como la modalidad de cuidado idónea para restituir su derecho.\n6.3. Criterios de Focalización.\nEl Programa de Atención a Grupos Prioritarios está enfocado en mejora las condiciones de vida de las personas sujetas de asistencia social, con recursos federales del FAM-AS, en consonancia con lo previsto en la Ley de Coordinación Fiscal y la Ley de Asistencia Social, por lo tanto, para su focalización se debe:\n1. Se debe dar prioridad a las localidades, municipios y Área Geoestadística Básica (AGEB) de alto\n(CONAPO) 2020, y el Consejo Nacional de Evaluación de Políticas de Desarrollo Social\n(CONEVAL) 2020.\n2. Priorizar a las personas y familias que habiten en zonas rurales y urbanas de población mayoritariamente indígena, así como aquellas con mayor índice de violencia.\n3. Dar atención a los sujetos establecidos en el artículo 4° y los servicios previstos en el artículo 12 fracción I incisos a), b), c), f), g), h), i) de la Ley de Asistencia Social.\n4. El programa podrá tener cobertura en todos los municipios de estado, con base en la disponibilidad presupuestal de cada SEDIF y de las condiciones que le permitan operar.\n6.4. Requisitos de selección de beneficiarios presentar. (Obligatorios para solicitar algún apoyo o servicio)\n• Copia fotostática del INE.\n• Copia fotostática del CURP.\n• En caso de ser menor de edad presentar CURP y/o Acta de nacimiento del menor e INE de la madre, padre o tutor.\nEstos requisitos no aplican para NNA DE NACIONALIDAD EXTRANJERA\nEn caso de un desastre natural, se justificará la falta de documentos del beneficiario si no se cuentan con ellos, con fotografía de la entrega del apoyo.\nA continuación, se detallan por subprograma requisitos específicos de acuerdo al apoyo o servicio solicitado, que deberán presentarse adicionales a los requisitos generales mencionados en el párrafo anterior:\nCOMPONENTE 1: ATENCIÓN E INCLUSIÓN SOCIAL.\nSubprograma de Atención a Personas con Discapacidad:\nPara todos los apoyos de este subprograma se deberá integrar los requisitos generales (los que se mencionan al principio de este numeral) y se agregaran los siguientes documentos al expediente de cada beneficiario:\n• Estudio socioeconómico.\n• Certificado medico.\nNota: el certificado médico no aplica para el apoyo de aparatos funcionales\nAparatos Auditivos “OIR BIEN: ESCUCHAR Y VIVIR MEJOR” se deberán integrar los requisitos generales\n(los que se mencionan al principio de este numeral) y se agregara el siguiente documento al expediente de cada beneficiario:\n• Constancia y/o audiometría que especifique el tipo de discapacidad, la cual deberá ser firmado y expedido por un médico con cedula profesional.\nLentes para Débiles Visuales “LETRAS CLARAS”.\n• Certificado de discapacidad emitido por un especialista.\nSubprograma de Atención a Personas Mayores.\nEn el caso de la Rehabilitación para Centros Asistenciales, las personas que soliciten el servicio además de presentar los requisitos generales deberán integrar en su expediente:\n• Estudio Socioeconómico.\n• Historial Clínico.\nCOMPONENTE 3: OTROS APOYOS DE ATENCIÓN SOCIAL.\nSubprograma de Otros apoyos de Atención Social.\nPara la Instalación de Huertos Escolares Pedagógicos, Familiares o Comunitarios y Equipamiento e\nInstalación de Comedor Escolar-Comunitario, se deberá integrar los requisitos generales (los que se mencionan al principio de este numeral) además la institución educativa debe cumplir con el siguiente requisito:\n• Estar inscrititos al Programa de Alimentación Escolar.\nEn el caso de: Insumos y Enseres Agrícolas, Huertos Escolares Pedagógicos, Familiares o Comunitarios, Estufas Ecológicas, Equipamiento e Instalación de Comedor Escolar Comunitario, Paneles Solares y\nApoyos en Especie para Grupos Prioritarios. Deberán integrar además de los requisitos generales:\n• Estudio Socioeconómico.\nApoyos en especie. (ATAÚDES)\n• Acta de defunción o constancia emitida por el comisario de la comunidad.\nApoyos en especie. (MOCHILAS Y UTILES ESCOLARES)\n• Matricula de alumnos.\nApoyos en especie. (KIT PARA ESCUELAS)\n• Matricula de alumnos.\n•\nApoyos Médicos para Grupos Prioritarios “AYUDANDO CON AMOR”, • Receta médica.\nCOMPONENTE 4: PROTECCIÓN A NIÑAS, NIÑOS Y ADOLESCENTES\nSubprograma de consolidación de modalidades de cuidados alternos.\nPara la Certificación de Familias de Acogida, se deberán integrar los requisitos generales (los que se mencionan al principio de este numeral) y se agregaran los siguientes documentos al expediente de cada beneficiario:\n• Datos generales de los integrantes de la familia.\n• Domicilio de la familia.\n• Número de dependientes económicos en la familia.\n• El certificado emitido por la autoridad competente.\n• Los ingresos y egresos mensuales de la familia.\n• El perfil y número de niñas, niños o adolescentes que, en su caso, podrían acoger.\n6.5 Métodos y/o Procedimientos de selección.\nEl SEDIF recibe las solicitudes, mismas que son turnadas a la Dirección a cargo de la entrega de cada apoyo, para su atención y verificar que se cumpla con los requisitos y criterios de focalización del Programa.\nLa Dirección a cargo del apoyo que sea solicitado, aplicará estudio socioeconómico a las personas solicitantes para determinar si serán beneficiadas con el Programa.\nSe dará respuesta a las solicitudes en un plazo no mayor a 30 días hábiles.\nSe realiza la entrega del apoyo de manera directa a la beneficiaria o beneficiario en su municipio o localidad, solicitándole firme acta de donación que acredite la entrega.\n7. Características de los Apoyos.\n7.1. Tipo de Apoyo.\nCOMPONENTE 1: ATENCIÓN E INCLUSIÓN SOCIAL.\nSubprograma de Atención a Personas con Discapacidad:\n• Sillas de Ruedas “TRANSFORMANDO VIDAS”\n• Aparatos Funcionales “TRANSFORMANDO VIDAS”\n• Aparatos Auditivos “OIR BIEN: ESCUCHAR Y VIVIR MEJOR”\n• Aparatos Protésicos de Miembros Inferiores “AMOR TRANSFORMA”\n• Lentes para Débiles Visuales “LETRAS CLARAS”\n• Jornadas de Implante de Rodilla “PASOS CON AMOR”\n• Cirugía de Cataratas “VER BIEN: OBSERVAR Y VIVIR MEJOR”\nSubprograma de Atención a Personas Mayores.\n• Rehabilitación de Centros Asistenciales\nCOMPONENTE 3: OTROS APOYOS DE ATENCIÓN SOCIAL.\nSubprograma de Otros apoyos de Atención Social.\n• Paquetes de Insumos y Enseres Agrícolas para la Producción Primaria\n• Huertos Escolares Pedagógicos, Familiares o Comunitarios\n• Estufas Ecológicas\n• Comedores Escolar-Comunitario\n• Paneles Solares\n• Apoyos en Especie para Grupos Prioritarios\n- Ataúdes y traslados\n- Mochilas y útiles escolares\n- Equipamiento de escuelas\n- Capacitaciones para el autoempleo\n• Cobertores “COBIJANDO GUERRERO”\n• Apoyos Médicos para Grupos Prioritarios “AYUDANDO CON AMOR”\n• Equipamiento para las Playas Incluyentes\nCOMPONENTE 4: PROTECCIÓN A NIÑAS, NIÑOS Y ADOLESCENTES\nSubprograma de consolidación de modalidades de cuidados alternos.\n• Equipamiento de Medidas de Seguridad y Protección Civil en CAS\n• Certificación de Familias de Acogida\n7.2. Unidad y Periodicidad de los Apoyos.\nCOMPONENTE 1: ATENCIÓN E INCLUSIÓN SOCIAL\nPERIODICIDAD DE LA\nENTREGA DEL APOYO Y/O\nTIPO DE APOYO Y/O SERVICIO A SERVICIO\nACCIONES\nENTREGAR (Núm. De veces que se proporcionara por beneficiario al año).\n2264 ‘Silla de Ruedas de 18”\n70 ‘Silla de Ruedas PCI\nSillas de Ruedas\n70 ‘Silla de Ruedas PCA Por única ocasión\n“TRASFORMANDO VIDAS”.\n70 ‘Carriola Infantil PCI\n150 ‘Silla de Ruedas Infantil.\n200 ‘Bastón recto.\nAparatos funcionales 210‘Bastón 4 puntos\nPor única ocasión\n“TRANSFORMANDO VIDAS” 400‘Andadera ortopédica\n250‘Muletas Axilares\nAparatos Auditivos “OIR BIEN:\n789 ‘Aparatos Auditivos. Por única ocasión\nESCUCHAR Y VIVIR MEJOR”\nAparatos Protésicos de\n30 ‘Prótesis Transfemoral.\nMiembros Inferiores “AMOR Por única ocasión\n31 ‘Prótesis Transtribial.\nTRANSFORMA”\nLentes para Débiles Visuales 2260 ‘Lentes Monofocales Y Lentes\nPor única ocasión\n“LETRAS CLARAS” Bifocales.\nImplante de Rodilla “PASOS\n85‘Cirugía de Implante de Rodilla Por única ocasión\nCON AMOR”\nCirugía de Cataratas “VER\nBIEN: OBSERVAR Y VIVIR 368‘Cirugías de Cataratas Por única ocasión\nMEJOR”\nSUBPROGRAMA DE ATENCIÓN A PERSONAS MAYORES\nRehabilitación de 2 Casas de día para\nAdultos Mayores:\nRehabilitación de Centros\n*Casa de Día \"Rositas Salas\". Por Única ocasión\nAsistenciales.\n*Club de la Tercera Edad \"Los Años\nMaravillosos\".\nCOMPONENTE 3: OTROS APOYOS DE ATENCION SOCIAL\nSUBPROGRAMA DE OTROS APOYOS DE ATENCIÓN SOCIAL\nPERIODICIDAD DE\nLAENTREGA DEL\nCANTIDAD Y TIPO DE APOYO Y/O APOYO Y/O SERVICIO.\nACCIONES\nSERVICIO A ENTREGAR (Núm. De veces que se proporcionara por beneficiario al año)\nPaquetes de Insumos y\n150 ‘Paquetes de Insumos y Enseres\nEnseres Agrícolas para la Por Única ocasión\nAgrícolas.\nProducción Primaria.\nInstalación de Huertos\n93 ‘Huertos Escolares Pedagógicos\nEscolares Pedagógicos, Por Única ocasión\n(HEP), Familiar o Comunitario.\nFamiliares o Comunitarios.\nEstufas Ecológicas. 899 ‘Estufas Ecológicas. Por Única ocasión\nEquipamiento e Instalación de\nComedor Escolar- 264 ‘Comedores. Por Única ocasión\nComunitario.\nEnergía Solar Fotovoltaica, 150 ‘Paneles Solares. Por Única ocasión\nMediante Paneles Solares.\nApoyos en Especie para • 650 Capacitaciones para el\nPor Única ocasión.\nGrupos Prioritarios. autoempleo.\n• 50 Ataúdes y traslados.\n• 5000 Mochilas y útiles escolares.\n• 100 Equipamiento de escuelas.\nDonación de Cobertores\n20,680 ‘Cobertores Por Única ocasión.\n“COBIJANDO GUERRERO”.\nPor Única ocasión.\nEquipamiento para las Playas Equipamiento de 2 playas incluyentes.\nIncluyentes.\n81 ‘Apoyos de:\n*Pago de estudios médicos.\nApoyos Médicos para Grupos *Insumos médicos.\nPrioritarios “AYUDANDO *Pruebas Covid-19. Por Única ocasión.\nCON AMOR”. *Aplicación de Toxina Botulínica Tipo “A”.\n*Medicamentos.\n*Cirugía en general.\nCOMPONENETE 4: PROTECCION A NIÑAS, NIÑOS Y ADOLESCENTES\nSUBPROGRAMA DE CONSOLIDACION DE MODALIDADES DE CUIDADOS ALTERNOS.\nPERIODICIDAD DE LA\nENTREGA DEL APOYO\nCANTIDAD Y TIPO DE APOYO Y/O Y/O SERVICIO.\nACCIONES\nSERVICIO A ENTREGAR (Núm. De veces que se proporcionara por beneficiario al año)\nEquipamiento de Medidas de\n2' Equipamientos de Medidas de\nSeguidas y Protección Civil en Por Única ocasión.\nSeguridad de Protección Civil.\nCAS.\nCertificación de Familias de 50 ‘Certificaciones de Familias de\nPor Única ocasión.\nAcogida. Acogida.\n7.3 Criterios de Selección de los Insumos. al área correspondiente para su adquisición.\nSILLAS DE RUEDAS: Para personas con discapacidad motriz.\n• Deberá ser de material de aluminio, además, es importante que la Horquilla sea también de aluminio ya que es un punto bastante susceptible de recibir golpes.\n• Deberá ser cómoda, el reposabrazos debe ser extraíble y abatible para facilitar las transferencias, y debe ser regulable en altura para lograr la mayor comodidad del paciente, Ruedas traseras extraíbles, Tapizados transpirables y suficientemente acolchados.\nAPARATOS FUNCIONALES:\n• Bastones, muletas y andaderas deberán ser fabricados en material antideslizante y de máxima durabilidad, que las hace idóneas para usos prolongados y para aumentar el agarre a todo tipo de superficies, tanto interiores como exteriores, y en condiciones meteorológicas como la lluvia.\n• Deberá ser elaboradas en tamaños y funciones diferentes, que permiten al paciente lograr la máxima comodidad y si es preciso, ampliar la superficie de apoyo para conseguir una estabilidad mejorada que aumente la seguridad.\nAPARATOS AUDITIVOS: Para personas con disminución o pérdida de la capacidad para oír.\n• Deberá contar con algún certificado que avale ante la COFEPRIS o COPRISEG.\n• Deberá contar con un nivel sonoro medio máximo de 100 decibelios.\n(sic)APATARATOS PROTESICOS:\n• Deberán ser prótesis duraderas y resistentes para asegurar una buena movilidad a largo plazo.\n• Las prótesis de rodilla deberán estar hechas de diferentes materiales, como metal, cerámica o polietileno, materiales que sean de buena calidad.\nCIRUGIA RODILLA:\n• Deberá contar con especialistas en ortopedia, traumatología, anestesiólogos y terapia de rehabilitación, que cuenten con título y cedula profesional.\n• Hospital certificado que cuente condiciones adecuadas para los beneficiarios.\n• Quirófano debidamente equipado con las necesidades de cada paciente.\nCIRUGIA DE CATARATAS: Para personas con Ceguera.\n• Deberá contar con un hospital con quirófano y con personal médico suficiente por la demanda de pacientes beneficiados.\n• Los quirófanos deberán contar con el siguiente equipamiento: tomas de oxígeno y aire, electrocauterio, monitores, desfibrilador, negatoscopio, máquina de anestesia y mesa quirúrgica.\n• Deberá contar con oftalmólogos especialistas en cirugía de cataratas que cuenten con título y cedula profesional.\nLENTES: Para personas con Discapacidad Visual\n• Deberán estar hechos de materiales como policarbonato o cristal mineral, que son resistentes a los arañazos y proporcionan una visión clara.\n• Que la graduación esté correctamente adaptada a tus necesidades. optometrista u oftalmólogo debe realizar un examen de la vista y emitir una receta precisa para asegurar una visión óptima.\nSUBPROGRAMA DE OTROS APOYOS DE ATENCION SOCIAL.\nENSERES AGRÍCOLAS\n• Paquete de enseres agrícolas básicos, que complementen las tareas agrícolas propias del estado de Guerrero.\nHUERTOS ESCOLARES PEDAGOGICOS, FAMILIARES Y/O COMUNITARIOS\n• Hortalizas y granos básicos para el complemento de la preparación de alimentos, así como herramientas para su instalación.\n• Capacitación para la implementación y mantenimiento del mismo.\nESTUFAS ECOLÓGICAS\n• Estufa ahorradora de leña con protección de accidentes.\nPANELES SOLARES\n• Paneles solares fotovoltaicos resistentes en condiciones y temperaturas extremas.\nAPOYOS EN ESPECIE (ATAÚD)\n• De madera, forrado en tela, el tamaño depende a las características del finado y lugar al cual será trasladado.\nAPOYOS EN ESPECIE (MOCHILA Y ÚTILES ESCOLARES)\n• Mochila escolar para niña y niño de nivel primaria.\n• Cilindro de agua: Recipiente de PET traslucido en forma cilíndrica, de material resistente, no toxico, con tapa antiderrames.\n• Útiles escolares básicos para que las niñas y niños puedan realizar sus actividades educativas.\nAPOYOS EN ESPECIE (KIT DE MOBILIARIO PARA ESCUELA)\n• Kit de mobiliario para escuelas que brinden espacios adecuados y equipados para que las niñas y niños reciban sus clases con calidad y de manera digna. Lo que les permitirá desarrollarse en un mejor entorno educativo.\nCOBERTORES\n• Cobertor ligero de poliéster, de gran ayuda para las personas vulnerables en las comunidades con temperaturas muy bajas.\nEQUIPAMIENTO DE PLAYAS INCLUYENTES\n• La Playa deberá tener un espacio donde la profundidad oscile entre 1.00m y 1.50m de profundidad, la marea sea tranquila y con poco oleaje.\n• Mobiliario Anfibio deberá cumplir con las normas oficiales establecidas para brindar seguridad y confianza a las personas con discapacidad.\nSUBPROGRAMA DE CONSOLIDACION DE MODALIDADES DE CUIDADOS ALTERNOS.\nEQUIPAMIENTO DE MEDIDAS DE SEGUIDAS Y PROTECCIÓN CIVIL EN CASA.\n• Sistema contra incendios, debe de ser automático, con tecnología en constante innovación, que alerte con luces y sonido, que cumpla con lo que establece la Norma Oficial Mexicana de\nEmergencia NOM-EM-001-SSA3-2010.\n• Extintores automáticos de presión contenida.\n• Lámparas de emergencia.\n• Barras antipánico que permitan abrir rápidamente puertas.\n• Control de Acceso que determine mediante claves quien puede acceder y lista de invitados con aprobación previa.\n8. Acciones Transversales.\n• Protección y promoción de los derechos humanos de los grupos de atención prioritaria. particularmente vulnerable y que enfrentan obstáculos para acceder al derecho a una alimentación nutritiva, suficiente y de calidad, a la salud y el bienestar; así como a un desarrollo integral. Esta línea transversal busca la implementación de acciones en tres sentidos: Empoderamiento, promoción y restitución de derechos que contribuyan a la superación de toda forma de discriminación, violencia y abuso, promoción de la equidad social e integración o reintegración social, con pleno respeto a su dignidad.\n• Organización y Participación Comunitaria.\nPara el SNDIF incorporar la participación social es un eje estratégico a partir del cual las personas se convierten en actores activos de su desarrollo, con capacidad de incidir en el control de los determinantes sociales de la salud. En este sentido, la participación social y comunitaria es un eje imprescindible del desarrollo humano, porque fortalece el sentido de pertenencia a un grupo, a través del cual se facilita el ejercicio de derechos y se fomenta la corresponsabilidad de las personas involucradas, dado que, se promueven acciones para el bien común, se desarrollan capacidades de cooperación, solidaridad y autogestión, fundamentales para lograr la sostenibilidad de la acción comunitaria.\nAsimismo, para lograr la participación hay que considerar una serie de acciones y principios que fomenten la atención a los Grupos Prioritarios, así como la motivación para la transformación de una realidad adversa.\nEsta participación se caracteriza por ser:\n• Voluntaria (no remunerada)\n• Libre (no condicionada)\n• Consciente (sabiendo que implica compromisos)\n• Solidaria (por ayudar a otros)\n• Por niveles (con opciones de participación según interés y posibilidad: desde opinar y asistir, hasta el seguimiento en la utilización de recursos y en la toma de decisiones)\n• Universal (todos pueden participar sin distinción de educación, jerarquía, sexo, edad, religión, grupo étnico, discapacidad, preferencia sexual, etc.)\nLa organización comunitaria implica la reconstrucción del tejido social, que en ocasiones se desgasta en los diversos espacios de convivencia, con impactos cada vez más visibles entre la población en condiciones de pobreza y vulnerabilidad, incrementando riesgos.\n9. Derechos, Obligaciones y Sanciones.\na) Derechos, compromisos y sanciones de las personas beneficiarias.\nDerechos:\n• Recibir la información necesaria de manera clara y oportuna para participar en el Programa.\n• Un trato digno y respetuoso oportuno con calidad y equitativo sin discriminación alguna.\n• Reserva y privacidad de su información personal.\n• Recibir orientación y asesoría.\n• Recibir los apoyos y/o servicios en tiempo y forma.\n• Ser informado de la situación que guarde su solicitud.\n• Ser atendido con equidad, respeto y cordialidad.\nCompromisos\n• Dar cumplimiento a las Reglas de Operación del Programa de Atención a Grupos Prioritarios.\n• Proporcionar la información socioeconómica bajo protesta de decir verdad que les sea requerida por el Sistema DIF Guerrero, en los términos que establezca la normatividad correspondiente.\n• Utilizar los apoyos y/o servicios de manera adecuada y para los fines para los que se le otorgaron y fueron autorizados evitando cualquier uso distinto de la misma.\n• Permitir visita de verificación con la finalidad de validar la información proporcionada en sus expedientes correspondientes.\n• Facilitar los trabajos de supervisión, en cualquier momento después de otorgado el apoyo y/o servicio.\n• Proporcionar la información que el coordinador o la coordinadora del Programa le solicite para la valoración de su solicitud, en forma clara, completa y verídica.\n• Presentar la documentación requerida dentro del tiempo señalado.\n• Aclarar en forma precisa y satisfactoria cualquier duda relativa a la información que proporcionen, o situaciones observadas.\nSanciones:\nEn caso de incumplir en las disposiciones normativas establecidas en las presentes Reglas de Operación para acceder a los beneficios que a través de estos se otorgan, perderán las prerrogativas que dichas disposiciones establecen por parte de la población beneficiada. b. Facultades y Obligaciones del SEDIF.\nFacultades:\n• Suscribir Convenios de Colaboración con los Sistemas DIF Municipales para la operación del\nPrograma de Atención a Grupos Prioritarios.\n• Operar el Programa de Atención a Grupos Prioritarios de forma directa y/o en Coordinación con los Sistemas DIF Municipales.\n• Buscar e impulsar la coordinación institucional para fortalecer la operación del programa.\n• Promover la formación y operación de los Comités de Vigilancia Ciudadana para el seguimiento de los proyectos.\n• Determinar la viabilidad de atención de las solicitudes de acceso al Programa.\nObligaciones:\n• Elaborar los instrumentos para la planeación, operación, seguimiento y evaluación del Programa de Atención a Grupos Prioritarios a nivel estatal y municipal.\n• Elaborar las ROP para el Programa de Atención a Grupos Prioritarios, con el propósito de transparentar y normar la distribución y entrega de los apoyos.\n• Celebrar convenios de colaboración con los SMDIF para la operación de cada uno de los proyectos del Programa de Atención a Grupos Prioritarios.\n• Coordinar la operación del Programa de Atención a Grupos Prioritarios en la entidad federativa con las instancias participantes.\n• Administrar y ejercer los recursos provenientes del Ramo General 33, Fondo de Aportaciones\nMúltiples (i006) de acuerdo con la normatividad vigente.\n• Focalizar la población objetivo de cada proyecto, en coordinación con los SMDIF, priorizando la población en municipios, localidades o Área Geoestadística Básica (AGEB) rural, urbanas o indígenas de alto y muy alto grado de marginación, de acuerdo con los criterios establecidos.\n• Iniciar oportunamente la operación del programa, y entregar de forma continua y sin interrupciones los apoyos y servicios.\n• Fomentar la organización, motivación y continuidad de las actividades realizadas en el marco de los diferentes programas.\n• Capacitar, asesorar y dar seguimiento a los SMDIF en la operación de los proyectos.\n• Buscar e impulsar la coordinación interinstitucional para fortalecer la operación del programa.\n• Dar seguimiento y evaluar la operación de los proyectos.\n• Promover la formación y operación de los comités de vigilancia ciudadana para el seguimiento de los proyectos.\n• De acuerdo con la circular uno del 14 de febrero de 2019, emitida por el C. Presidente\nConstitucional de los Estados Unidos Mexicanos, no podrán transferirse recursos federales del\nFAM-AS a ninguna organización social, sindical o civil en la que alguna de éstas fuera intermediaria para la entrega de los apoyos a los beneficiarios.\n• Proporcionar a la DGADC la información específica que ésta solicite, que puede ser requerida en diferentes situaciones y tiempos, así como la establecida en el Calendario Anual 2024.\n• Entregar a la DGADC la información requerida para la evaluación del Índice de Desempeño, de acuerdo con las indicaciones, formatos y calendario de entrega que en éste se señalan.\n• Determinar la viabilidad de atención a las solicitudes de apoyos y servicios de los proyectos por parte de la ciudadanía, turnadas por la DGADC, así como notificar sobre la respuesta correspondiente.\n• Ejercer el recurso proveniente del FAM-AS, dentro del ejercicio fiscal para el cual fue transferido, evitando su aplicación en ejercicios fiscales posteriores.\n• Concentrar e integrar los padrones de beneficiarios para cada proyecto operado con recurso del\nRamo General 33 FAM-AS.\n• Promover que la selección de beneficiarios de los programas operados con Ramo 33 FAM-AS, se realice tomando en cuenta que no haya duplicidad con otros programas de asistencia social.\n• Aplicar y hacer un uso adecuado de lo dispuesto en la Guía de Imagen Gráfica para los\n2022-2024.\n• Asegurar el correcto almacenamiento y distribución de los insumos, que permita conservar sus características de calidad e inocuidad, desde la selección hasta su entrega al beneficiario.\n• Impulsar la instalación y uso de huertos escolares pedagógicos para promover hábitos alimentarios saludables.\n• Promover la adaptación, instalación, remodelación y equipamiento de espacios alimentarios.\n• Otorgar la orientación alimentaria que requieren los beneficiarios de los Programas de Desarrollo\nComunitario por parte del área alimentaria del SEDIF.\n• Fomentar la conformación de subcomités APCE.\n• Realizar acciones de coordinación interinstitucional con el propósito de obtener apoyos en materia de capacitación.\n• En la contratación de personas proveedoras para el desarrollo de capacitaciones y adquisición de insumos, deberá especificar lo siguiente: declarar bajo protesta de decir verdad, no llevar a cabo acciones de proselitismo hacia persona alguna, partidos políticos, asociación política nacional, sindicato o religión alguna y no tener entre sus directivos/as o representantes a personas funcionarias públicas, representantes de elección popular o miembros del Poder\nJudicial, de cualquiera de los tres órdenes de gobierno.\nObligaciones de SMDIF\nDado que los SMDIF son un elemento fundamental en el proceso de operación de los proyectos del\nPrograma de Atención a Grupos Prioritarios, se definen para estos las siguientes responsabilidades:\n• De acuerdo con la circular uno del 14 de febrero de 2019, emitida por el C. Presidente\nConstitucional de los Estados Unidos Mexicanos, no podrán utilizar recursos federales del FAMAS a ninguna organización social, sindical o civil en la que alguna de éstas fuera intermediaria para la entrega de los apoyos a los beneficiarios.\n• Celebrar el convenio de colaboración con el SEDIF, con el fin de operar los proyectos.\n• Participar de forma conjunta con el SEDIF en el establecimiento de mecanismos y estrategias a seguir para la detección, selección, focalización y atención de beneficiarios.\n• Operar los proyectos, con observancia y apego a las ROP emitidas por el SEDIF y lo establecido en el convenio de colaboración firmado entre ambos.\n• Impulsar la coordinación con las instancias correspondientes del sector público, social o privado para fortalecer la operación de los proyectos.\n• Generar los informes correspondientes sobre la operación de los proyectos para su evaluación y seguimiento.\n• Integrar, actualizar y entregar los padrones de beneficiarios de los proyectos al SEDIF.\n10. Instancias Participantes.\n10.1 Instancias Ejecutoras.\nLa instancia ejecutora será el Sistema DIF Guerrero, a través de las Direcciones a cargo de cada uno de los proyectos integrados en los componentes, en coordinación con los Sistemas DIF Municipales.\n10.2. Instancia Normativa Estatal.\nLa instancia responsable de administrar los recursos provenientes del Ramo General 33 para la ejecución del Programa es el Sistema DIF Guerrero quien deberá realizarlo en apego a los objetivos de la Ley de\nCoordinación Fiscal.\n10.3. Instancia Normativa Federal.\nLa Instancia Normativa Federal es el Sistema Nacional DIF a través de la DGADC, por medio de la\nEIASADC vigente, con fundamento en la estrategia programática del FAM-AS del Presupuesto de Egresos de la Federación para el Ejercicio Fiscal 2024.\n11. Coordinación Institucional.\n11.1. Prevención de Duplicidades.\nEl Sistema DIF Guerrero, establecerá los mecanismos de coordinación necesarios para garantizar que sus programas y acciones no se contrapongan, afecten o presenten duplicidades con otros programas o acciones del gobierno estatal; la coordinación institucional y vinculación de acciones busca potenciar el impacto de los recursos, fortalecer la cobertura de las acciones, detonar la complementariedad y reducir gastos administrativos.\n11.2. Convenios de Colaboración.\nEl Sistema DIF Guerrero celebrará un convenio de colaboración con los H. Ayuntamientos Municipales y con los Sistemas DIF Municipales, según corresponda, por cada uno de los programas de la EIASADC\n2024 que operen con recursos del FAM-AS, de acuerdo con el principio de Fortalecimiento del Pacto\nFederal y del Municipio Libre y la fracción II, inciso a) del artículo 77 de la Ley Federal de Presupuesto y\nResponsabilidad Hacendaria. en beneficio del Programa. Definiendo con claridad el programa, la modalidad y plazos de entrega de los apoyos, así como los compromisos de las partes que sean aplicables. El contenido deberá ser congruente con las Reglas de Operación del Programa.\nLa vigencia del convenio deberá ser al 31 diciembre del 2024 con el fin de cumplir con el principio de anualidad presupuestaria establecido en el Presupuesto de Egresos de la Federación 2024.\n11.3. Colaboración.\nCon la finalidad de fortalecer los objetivos del programa, el Sistema DIF Guerrero establecerá los situaciones de emergencia, respetando la ejecución del presupuesto en razón de su procedencia.\n11.4. Concurrencia.\nLas acciones que se ejecutan con los recursos del Programa de Alimentación Escolar Modalidad Caliente pueden concurrir con otras fuentes de financiamiento (ya sean fondos federales, estatales o municipales) en los términos que la normatividad vigente lo permita, siempre y cuando no se dupliquen los apoyos a la población objetivo.\n12. Mecánica de Operación.\n12.1. Proceso.\nLa incorporación al Programa será a través de una solicitud en formato libre y podrán acceder a este beneficio todas las personas que cumplan con los requisitos de selección de beneficiarias y beneficiarios establecidos en las presentes Reglas de Operación.\nLos requisitos, forma de acceso y criterios de selección establecidos por este programa social son públicos, las personas podrán realizar su trámite a través de los DIF Municipales o podrán entregar su solicitud de manera directa en las oficinas del Sistema Estatal DIF, en un horario de 9:00 a 3:00 pm.\nToda persona solicitante podrá conocer el estado de su trámite de aceptación o no al Proyecto a más tardar en 20 días hábiles desde que su solitud sea remitida a la Dirección correspondiente.\nLos apoyos serán entregados directamente a las y los beneficiarios en puntos cede de cada región del\nEstado, o en su caso podrá acudir a recoger el apoyo a las oficinas del Sistema Estatal DIF.\nUna vez que las personas solicitantes son incorporadas al Proyecto formaran parte del Padrón de beneficiarias y beneficiarios, el cual será de carácter público, siendo reservados sus datos personales, de\nGuerrero.\n12.2. Ejecución.\nPara un adecuado funcionamiento del Programa se establece el proceso del mismo, donde se determinan compromisos y responsabilidades en razón de los Subprogramas y Modalidades que lo integran. La operación de este programa, se realiza a través de la demanda ciudadana y/o peticiones que se reciben\nSistema Estatal, el cual surge por la necesidad de reforzar la economía de las y los beneficiarios que cumplan con los requisitos elegibilidad formando parte de los grupos de atención prioritaria, la integración social de las personas con discapacidad temporal o permanente, personas mayores de 60 años y proteger los derechos de las niñas, niños y adolescentes.\nEl presupuesto otorgado al presente Programa Social que no haya sido aplicado a los fines autorizados, y los recursos que por cualquier motivo no se hayan devengado al 31 de diciembre del presente ejercicio fiscal, serán reintegrados inmediatamente a la instancia normativa del ejercicio y control del gasto público, es decir a la Tesorería de la Federación.\n12.3. Causa de Fuerza Mayor.\nEn caso de ocurrir alguna situación extraordinaria que impida la operación normal del Programa (cambio en la modalidad y lugar de la entrega), el SEDIF; notificará por escrito a SMDIF a fin de brindar alternativas que permitan dar continuidad al mismo.\n13. Evaluación, Seguimiento y Control.\n13.1. Información Presupuestaria.\nDentro de la política de Desarrollo Social, el Sistema para el Desarrollo Integral de la Familia del estado de Guerrero, opera el Programa de Atención a Grupos Prioritarios, el cual es subsidiado a través de recursos provenientes del Ramo 33.- Aportaciones Federales para Entidades Federativas y Municipios, específicamente del Fondo de Aportaciones Múltiples (Asistencia Social), el cual tiene una inversión\n$103,443,139.59 (Ciento tres millones cuatrocientos cuarenta y tres mil ciento treinta y nueve 59/100 m.n.) teniendo como fundamento al Decreto número 680 relativo al Presupuesto de Egresos del Estado de\nGuerrero para el Ejercicio Fiscal 2024.\nSe detalla a continuación el desglose del recurso que se destinara a cada acción.\nCOMPONENTE 1: ATENCIÓN E INCLUSIÓN SOCIAL\nACCIONES MONTO ASIGNADO\nAdquisición y Donación de Sillas de Ruedas\n$13,455,000.00\n“TRANSFORMANDO GUERRERO”\n$724,500.00\n“TRANSFORMANDO VIDAS”\nAdquisición y Donación de Aparatos Auditivos “OIR BIEN:\n$6,210,000.00\nESCUCHAR Y VIVIR MEJOR”\nMiembros Inferiores $4,585,500.00\n“AMOR TRANSFORMA”\nJornadas de Implante de Rodilla “PASOS CON AMOR” $7,245,000.00\nJornadas de Cirugías de Cataratas\n$2,655,000.00\n“VER BIEN: OBSERVAR Y VIVIR MEJOR”\nAdquisición y Donación de Lentes para Débiles Visuales\n$1,552,500.00\n“LETRAS CLARAS”\nSUBPROGRAMA DE ATENCIÓN A PERSONAS MAYORES\nRehabilitación de Centros Asistenciales $3,105,000.00\nCOMPONENTE 3: OTROS APOYOS DE ATENCIÓN SOCIAL\nSUBPROGRAMA DE OTROS APOYOS DE ATENCION SOCIAL\nACCIONES MONTO ASIGNADO\nPaquetes de Insumos y Enseres Agrícolas para la\n$3,467,250.00\nProducción Primaria\nInstalación de Huertos Escolares Pedagógicos, Familiares\n$983,250.00 o Comunitarios\nEstufas Ecológicas $4,968,00.00\nEquipamiento e Instalación de Comedor Escolar$16,364,250.00\nComunitario\nSistema de Energía Solar Fotovoltaica, Mediante Paneles\n$5,865,000.00\nSolares\nApoyos en Especie para Grupos Prioritarios $17,586,000.00\n1. Ataúdes y traslados 1. $900,000.00\n2. Mochilas y Útiles Escolares 2. $7,200,000.00\n3. Equipamiento de Escuelas 3. $7,200,000.00\n4. Capacitaciones para el Autoempleo 4. $2,286,000.00\nAdquisición y Donación de Cobertores “COBIJANDO\n$5,175,000.00\nGUERRERO”\nApoyos Médicos para Grupos Prioritarios “AYUDANDO\n$1,552,500.00\nCON AMOR”\nEquipamiento para las Playas Incluyentes $4,378,639.59\nCOMPONENTE 4: PROTECCIÓN A NIÑAS, NOÑOS(sic) Y ADOLESCENTES\nSUBPROGRAMA DE CONSOLIDACION DE MODALIDADES DE CUIDADOS ALTERNATIVOS\nACCIONES MONTO ASIGNADO\nEquipamiento de Medidas de Seguridad y Protección Civil\n$2,570,750.00 en CAS\nCertificación de Familias de Acogida $1,000,000.00\n13.2. Evaluación.\nCon el objeto de enfocar la gestión al logro de resultados, así como de fortalecer la rendición de cuentas y la transparencia en el ejercicio de los recursos, se evaluará la operación y resultados del Programa a través de la Matriz de Indicadores para Resultados (Numeral 13.4). La evaluación se podrá complementar con un seguimiento de los recursos ejercidos, acciones ejecutadas y metas alcanzadas. utilizados por la instancia normativa como parte de la rendición de cuentas. Se desarrolla a través de la seguimiento.\nEsta información estará disponible para toda la población para su consulta en la página de internet: la mejora de la operación del Programa.\n13.3. Control y Auditoría.\nEl ejercicio del recurso y la operatividad del Programa, están sujetos a las disposiciones estatales aplicables y podrá ser auditado por la Secretaría de Contraloría, así como por la Auditoría Superior del Estado de\nGuerrero y la Auditoria Superior de la Federación, conforme a la legislación vigente y en el ámbito de sus respectivas competencias.\nEl Sistema DIF Guerrero dará todas las facilidades a dichas instancias para realizar, en el momento en que lo juzguen pertinentes, las auditorías que consideren necesarias; asimismo, harán el seguimiento y solventará en tiempo y forma las observaciones realizadas por los órganos de control.\n13.4. Indicadores de Resultados.\nO.P.D. SISTEMA PARA EL DESARROLLO INTEGRAL DE LA FAMILIA\nMatriz de Indicadores de Resultados\nAtención a Personas con Discapacidad y Rehabilitación\nDetalle de la Matriz 2024\nRamo: 5-Sector Paraestatal\nUnidad Responsable:\nP-46 -O.P. D, Sistema para el Desarrollo Integral de la Familia\nClave y Modalidad del\nS- Sujetos a Reglas de Operación\nPp:\nDenominación del Pp: S 01\nClasificación Funcional:\nFinalidad: 1. BIENESTAR, DESARROLLO HUMANO Y JUSTICIA SOCIAL\nFunción: 1.3. Disminuir las desigualdades a través de la atención a grupos vulnerables.\nSubfunción: 1.3.1. Garantizar el pleno goce de los derechos fundamentales de las niñas, niños y adolescentes.\n1.3.2. Atención prioritaria a Grupos Vulnerables.\nResumen narrativo Orden Supuestos\nContribuir a mejorar la calidad de vida de las\nLos Programas Asistenciales benefician a personas personas con discapacidad mediante acciones de 1 con discapacidad.\nAsistencia Social.\nUnidad de Frecuencia de Medios de\nIndicador Método de Cálculo Tipo de Indicador Línea Base Meta 2024\nMedida Medidor Verificación\nPorcentaje de personas con (Número total de personas con\nPadrón de atendidas en el de programas asistenciales en el Porcentaje Anual Estratégico 7% 90%\nBeneficiarios\nEstado a través año/Número total de personas con de Programas discapacidad en el Estado) *100\nAsistenciales\nPropósito\nResumen narrativo Orden Supuestos\nO.P.D. SISTEMA PARA EL DESARROLLO INTEGRAL DE LA FAMILIA\nMatriz de Indicadores de Resultados\nOtorgar a personas apoyos funcionales de acuerdo Mejorar la calidad de vida e inclusión familiar, social y\n1.1 a su tipo de discapacidad. laboral de las personas con discapacidad.\nUnidad de Frecuencia de Tipo de Medios de\nIndicador Método de Cálculo Línea Base Meta 2024\nMedida Medición Indicador Verificación\nPorcentajes de (Número total de personas con personas con discapacidad beneficiadas a discapacidad través de programas asistenciales\nPadrón de beneficiadas a en el año / Número total de Porcentaje Anual Estratégico 57% 100%\nBeneficiarios través de personas con discapacidad\nProgramas programadas para atenderse en\nAsistenciales el año) *100\nComponente\nResumen narrativo Orden Supuestos\nImplementación de Programas Asistenciales en Mejorar la calidad de vida de las personas con\n1.1.1 beneficio de personas con discapacidad. discapacidad.\nUnidad de Frecuencia de Tipo de Medios de\nIndicador Método de Cálculo Línea Base Meta 2024\nMedida Medición Indicador Verificación\nPorcentaje de\n(Programas de atención a\nImplementación personas con discapacidad de Programas implementados en 2022 / Porcentaje Anual Estratégico 78% 100% Oficios de autorización\nAsistenciales\nProgramas implementados en para Personas\n2023) *100 con Discapacidad\nActividades\nResumen narrativo Orden Supuestos\nPersonas con discapacidad temporal o permanente Coadyuvar a la inclusión social, familiar y laboral de beneficiadas a través de la entrega de sillas de 1.1.1.1 las personas con discapacidad. ruedas\nUnidad de Frecuencia de Tipo de Medios de\nIndicador Método de Cálculo Línea Base Meta 2024\nMedida Medición Indicador Verificación\n(Número total de sillas de ruedas\nPorcentaje de entregadas a personas con entrega de sillas discapacidad en el periodo / Avance Físicode ruedas a Porcentaje Trimestral Gestión 120% 100%\nNúmero total de sillas de ruedas Financiero personas con programadas para entrega en el discapacidad periodo) * 100\nResumen narrativo Orden Supuestos\nCoadyuvar a la inclusión social, familiar y laboral de las beneficiadas a través de la entrega de aparatos 1.1.1.2 personas con discapacidad. funcionales\nUnidad de Frecuencia de Medios de\nIndicador Método de Cálculo Tipo de Indicador Línea Base Meta 2024\nMedida Medición Verificación\nO.P.D. SISTEMA PARA EL DESARROLLO INTEGRAL DE LA FAMILIA\nMatriz de Indicadores de Resultados\n(Número total de aparatos\nPorcentaje de funcionales entregados a entrega de personas con discapacidad en el aparatos Avance Físicoperiodo / Número total de Porcentaje Trimestral Gestión 113% 100% funcionales a Financiero aparatos funcionales personas con programados para la entrega en el discapacidad periodo) * 100\nResumen narrativo Orden Supuestos\nPersonas con discapacidad temporal o permanente\nCoadyuvar a la inclusión social, familiar y laboral de las beneficiadas a través de la entrega de aparatos 1.1.1.3 personas con discapacidad. auditivos\nUnidad de Frecuencia de Medios de\nIndicador Método de Cálculo Tipo de Indicador Línea Base Meta 2024\nMedida Medición Verificación\nPorcentaje de (Número total de aparatos entrega de auditivos entregados a personas aparatos con discapacidad en el periodo / Avance Físico\nPorcentaje Trimestral Gestión 130% 100% auditivos a Número total de aparatos Financiero personas con auditivos programados para la discapacidad entrega en el periodo) * 100\nResumen narrativo Orden Supuestos\nPersonas con discapacidad temporal o permanente\nCoadyuvar a la inclusión social, familiar y laboral de las beneficiadas a través de la entrega de aparatos 1.1.1.4 personas con discapacidad. protesicos\nFrecuencia de Medios de\nIndicador Método de Cálculo Unidad de Medida Tipo de Indicador Línea Base Neta 2024\nMedición Verificación\nPorcentaje de (Número total de aparatos entrega de protesicos entregados a personas aparatos con discapacidad en el periodo / Avance FísicoPorcentaje Trimestral Gestión 116% 100% protesicos a Número total de aparatos Financiero personas con protesicos programados para la discapacidad entrega en el periodo) * 100\nResumen narrativo Orden Supuestos\nPersonas con discapacidad temporal o permanente Coadyuvar a la inclusión social, familiar y laboral de las\n1.1.1.5 beneficiadas a través de implantes de rodilla personas con discapacidad.\nUnidad de Frecuencia de Tipo de Medios de\nIndicador Método de Cálculo Línea Base Meta 2024\nMedida Medición Indicador Verificación\n(Número total de cirugías de\nPorcentaje de rodilla, realizadas en el periodo / cirugías de Avance FísicoNúmero total de cirugías de Porcentaje Trimestral Gestión 100% 100% implante rodilla Financiero rodilla programados para realizadas realizarse en el periodo) * 100\nResumen narrativo Orden Supuestos\nPersonas con discapacidad beneficiadas a través Coadyuvar a la inclusión social, familiar y laboral de\n1.1.1.6 de cirugías de cataratas las personas con discapacidad.\nUnidad de Frecuencia de Medios de\nIndicador Método de Cálculo Tipo de Indicador Línea Base Meta 2024\nMedida Medición Verificación\nO.P.D. SISTEMA PARA EL DESARROLLO INTEGRAL DE LA FAMILIA\nMatriz de Indicadores de Resultados\n(Número total de cirugías de\nPorcentaje de cataratas, realizadas en el periodo cirugías de Avance Físico/ Número total de cirugías de Porcentaje Trimestral Gestión 73% 100% cataratas Financiero cataratas programados para realizadas realizarse en el periodo) * 100\nResumen narrativo Orden Supuestos\nPersonas con discapacidad beneficiadas a través de Coadyuvar a la inclusión social, familiar y laboral de las\n1.1.1.7. la entrega de lentes personas con discapacidad.\nUnidad de Frecuencia de Medios de\nIndicador Método de Cálculo Tipo de Indicador Línea Base Meta 2024\nMedida Medición Verificación\n(Número total de lentes\nPorcentaje de entregados en el periodo /\nAvance Físico lentes Número total de lentes Porcentaje Trimestral Gestión 100% 100%\nFinanciero entregados programados para entrega en el periodo) * 100\nResumen narrativo Orden Supuestos\nMejorar la calidad de vida de las personas con\nOtorgar apoyos médicos económicos o en especie\n1.1.1.10 problemas emergentes de salud que no cuentan con a grupos prioritarios el esquema de seguridad social.\nUnidad de Frecuencia de Medios de\nIndicador Método de Cálculo Tipo de Indicador Línea Base Meta 2024\nMedida Medición Verificación\n(Número total de apoyos médicos\nPorcentaje de en especie o económicos apoyos médicos entregadas en el periodo /\nAvance Físicootorgado a Número total de apoyos médicos Porcentaje Trimestral Gestión 4% 100%\nFinanciero grupos en especie-económicos prioritarios programados para entrega en el periodo) * 100\nResumen narrativo Orden Supuestos\nDeterminar la cantidad de servicios de rehabilitación\nBrindar servicios de rehabilitación integral a personas otorgados a las personas con discapacidad a través 1.1.1.11 con discapacidad temporal o permanente. de los Centros Regionales de Rehabilitación\nUnidad de Frecuencia de Medios de\nIndicador Método de Cálculo Tipo de Indicador Línea Base Meta 2024\nMedida Medición Verificación\nPorcentaje de (Número total de servicios de\nServicios de rehabilitación otorgados a\nPorcentaje Trimestral Gestión 167% 100% otorgados a periodo / Número total de Financiero personas con servicios de rehabilitación discapacidad programados) * 100\nO.P.D. SISTEMA PARA EL DESARROLLO INTEGRAL DE LA FAMILIA\nMatriz de Indicadores de Resultados\nAsistencia Jurídica y Bienestar Social\nUnidad de Frecuencia de Medios de\nIndicador Método de Cálculo Tipo de Indicador Línea Base Meta 2024\nMedida Medición Verificación\nPorcentaje de (Número total de personas sujetas personas sujetas de asistencia social que tienen de asistencia acceso a servicios de asistencia social que tienen social/ Número total de personas Porcentaje Anual Estratégico 134% 100% Padrón de Beneficiarios acceso a sujetas de asistencia social que servicios de solicitaron servicio social de asistencia social asistencia social) * 100\nQue las Procuraduría Regionales de Protección de\nMedidas de protección integral en favor de niñas, niñas, niños y adolescentes actúen de conformidad con\n2,1 niños y adolescentes, otorgadas. sus atribuciones para la restitución de los derechos vulnerados sobre este sector de la población.\nUnidad de Frecuencia de Medios de\nIndicador Método de Cálculo Tipo de Indicador Línea Base Meta 2024\nMedida Medición Verificación\nPorcentaje de medidas de\n(Número de medidas de protección protección integral otorgadas en integrales favor de las niñas, niños y otorgadas a adolescentes en el año / Número favor de niñas, Porcentaje Anual Estratégico 100% 100% Padrón de Beneficiarios de medidas de protección integral niños y solicitadas en favor de las niñas, adolescentes niños y adolescentes en el año) * con sus\n100 derechos vulnerados.\nComponente\nResumen narrativo Orden Supuestos\nBrindar a los individuos que por sus condiciones\nServicios otorgados a personas sujetas de asistencia\n1.1.1 físicas, mentales, jurídicas, económicas o sociales, social en los Centros Asistenciales. requieran de servicios de asistencia social.\nUnidad de Frecuencia de Tipo de Medios de\nIndicador Método de Cálculo Línea Base Meta 2024\nMedida Medición Indicador Verificación\n(Número total de servicios\nPorcentaje de otorgados en los Centros de servicios\nAsistencia Social / Número total Avance Físico otorgados en los Porcentaje Semestral Estratégico 100% 100% de servicios programados a Financiero\nCentros otorgar en los Centros de\nAsistenciales\nAsistencia Social) *100\nResumen narrativo Orden Supuestos\nServicios de asesoría y representación jurídica para Que las instancias competentes actúen de la protección y restitución de los derechos de niñas, 2,1.1 conformidad con sus atribuciones para que se protejan niños y adolescentes, otorgados. y restituyan sus derechos.\nUnidad de Frecuencia de Tipo de Medios de\nIndicador Método de Cálculo Línea Base Meta 2024\nMedida Medición Indicador Verificación\nPorcentaje de servicios de (Número de servicios de asesoría y representación otorgados en el periodo / Número Avance Físico\nPorcentaje Semestral Estratégico 100% 100%\nNiñas, Niños y en el periodo) *100\nAdolescentes\nO.P.D. SISTEMA PARA EL DESARROLLO INTEGRAL DE LA FAMILIA\nMatriz de Indicadores de Resultados\nAsistencia Jurídica y Bienestar Social\nActividades\nResumen narrativo Orden Supuestos\nPoblación en situación de vulnerabilidad que\nEntregar apoyos a personas de escasos recursos requiere de algún apoyo en especie para la atención 1.1.1.1 económicos y/o sin esquema de seguridad social. de la salud o bienestar general.\nUnidad de Frecuencia de Tipo de Medios de\nIndicador Método de Cálculo Línea Base Meta 2024\nMedida Medición Indicador Verificación\nPorcentaje de\n(Número total de personas que personas de recibieron apoyos en especie en atención el periodo / Número total de Avance Físicoprioritaria Porcentaje Trimestral Gestión 211% 100% personas programadas para Financiero beneficiadas con recibir apoyos en especie en el\nApoyos en periodo) * 100\nEspecie\nResumen narrativo Orden Supuestos\nEntregar durante la temporada invernal cobertores a la población en condiciones de vulnerabilidad que Mitigar los estragos de las bajas temperatura y\n1.1.1.2 habitan en las regiones de la Montaña y Sierra del disminuir los riesgos de enfermedades respiratorias estado de Guerrero.\nUnidad de Frecuencia de Medios de\nIndicador Método de Cálculo Tipo de Indicador Línea Base Meta 2024\nMedida Medición Verificación\nPorcentaje de\n(Número total de personas personas beneficiadas con la entrega de beneficiadas cobertores / Número total de Porcentaje Anual Gestión 100% 100% Padrón de Beneficiarios mediante la personas programadas para entrega de entrega de cobertores) * 100 cobertores\nResumen narrativo Orden Supuestos\nContribuir a la calidad de vida de los adultos Ofrecer servicios recreativos y de esparcimiento a los\n1.1.1.3\nMayores Atendidos en Centros Asistenciales Adultos Mayores de 60 años.\nUnidad de Frecuencia de Medios de\nIndicador Método de Cálculo Tipo de Indicador Línea Base Meta 2024\nMedida Medición Verificación\n(Número total de adultos Mayores\nPorcentaje de\nAtendidos en Centros atención de\nAsistenciales / Capacidad de adultos Mayores Porcentaje Trimestral Gestión 155% 100% Padrón de Beneficiarios atención de los Centros en los Centros\nAsistenciales para Adultos\nAsistenciales\nMayores) * 100\nResumen narrativo Orden Supuestos menores de 6 años atendidos en los Centros 1.1.1.4 a hijos de padres trabajadores\nInfantiles\nFrecuencia de Medios de\nIndicador Método de Cálculo Unidad de Medida Tipo de Indicador Línea Base Neta 2024\nMedición Verificación\nO.P.D. SISTEMA PARA EL DESARROLLO INTEGRAL DE LA FAMILIA\nMatriz de Indicadores de Resultados\nAsistencia Jurídica y Bienestar Social\nPorcentaje de niñas y niños (Número total de niños y Niñas menores de 6 inscriptos en el CAI en el periodo Padrón de\nPorcentaje Trimestral Gestión 0% 100% años atendidos / Capacidad máxima de atención Beneficiarios en los Centros del CAI) * 100\nInfantiles (CAI)\nResumen narrativo Orden Supuestos\nProporcionar servicios médicos a personas en estado\nOtorgar a Pacientes, trasladados a Hospitales de\n1.1.1.5 de vulnerabilidad que no cuentan con un esquema de\n3er. Nivel en México para recibir atención médica. seguridad social\nUnidad de Frecuencia de Tipo de Medios de\nIndicador Método de Cálculo Línea Base Meta 2024\nMedida Medición Indicador Verificación\nPorcentaje de\nPacientes\n(Número total de Pacientes beneficiados a traslados a Hospitales de tercer través de Avance FísicoNivel en el periodo / Número total Porcentaje Trimestral Gestión 117% 100% traslados a Financiero de pacientes programados para\nHospitales de traslado en el periodo) * 100\n3er. Nivel en\nResumen narrativo Orden Supuestos\nBrindar a personas en estado de vulnerabilidad una red\nMedir el porcentaje de capacitaciones otorgadas por de servicios para su desarrollo integral y el CDC a personas en situación de vulnerabilidad\n1.1.1.6 desenvolvimiento social, mediante la implementación para el desarrollo de habilidades y capacidades para de procesos de formación a través de cursos, talleres la incorporación a la vida laboral. y capacitaciones.\nUnidad de Frecuencia de Medios de\nIndicador Método de Cálculo Tipo de Indicador Línea Base Meta 2024\nMedida Medición Verificación\nPorcentaje de\n(Número total de capacitaciones capacitaciones otorgadas en materia de otorgadas en desarrollo de habilidades y materia de Avance Físicocapacitaciones laborales en el Porcentaje Trimestral Gestión 100% 100% desarrollo de Financiero periodo / Número total de habilidades y capacitaciones programadas en el capacidades periodo) * 100 laborales\nResumen narrativo Orden Supuestos\nOtorgar Asistencias Jurídicas a grupos prioritarios 1..1.1.7.\nUnidad de Frecuencia de Medios de\nIndicador Método de Cálculo Tipo de Indicador Línea Base Meta 2024\nMedida Medición Verificación\nPorcentaje de\n(Número total de asistencias asistencias jurídicas otorgadas en el periodo / jurídicas\nNúmero total de asistencias Porcentaje Trimestral Gestión 202% 100% Padrón de Beneficiarios otorgada a jurídicas solicitadas en el periodo) grupos x 100 prioritarios\nResumen narrativo Orden Supuestos restitución de los derechos humanos de los grupos 1.1.1.8 procedimientos jurisdiccionales y administrativos de\nO.P.D. SISTEMA PARA EL DESARROLLO INTEGRAL DE LA FAMILIA\nMatriz de Indicadores de Resultados\nAsistencia Jurídica y Bienestar Social\nUnidad de Frecuencia de Medios de\nIndicador Método de Cálculo Tipo de Indicador Línea Base Meta 2024\nMedida Medición Verificación\n(Número total de demandas\nPorcentaje de atendidas por violación a los atención de derechos humanos de personas demandas o en estado de vulnerabilidad en el solicitudes por periodo / Número total de Avance Físicovulneración a los Porcentaje Trimestral Gestión 225% 100% demandas programadas para Financiero derechos atención por violación a los humanos de derechos humanos de personas grupos en estado de vulnerabilidad en el prioritarios periodo) * 100\nResumen narrativo Orden Supuestos\nMedir el porcentaje de talleres y conferencias\nPrevenir riesgos psicosociales en niñas, niños y otorgadas a niñas, niños y adolescentes en materia 2.1.1.1 adolescentes. de Riesgos Psicosociales\nUnidad de Frecuencia de Medios de\nIndicador Método de Cálculo Tipo de Indicador Línea Base Meta 2024\nMedida Medición Verificación\nPorcentaje de talleres y\n(Número total de talleres y conferencias conferencias otorgadas a Niñas, otorgadas a\nNiños y Adolescentes en el Avance Físico\nNiñas, Niños y Porcentaje Trimestral Gestión 110% 100% periodo / Número total de talleres Financiero\nAdolescentes en y conferencias programadas para materia de otorgarse en el periodo) * 100 riesgos psicosociales\nResumen narrativo Orden Supuestos\nQue las personas se encuentren interesadas en\nServicios de adopción y de familias de acogida adoptar, así como fungir como familias de acogida a para la restitución del derecho a vivir en familia de 2.1.1.2 niñas, niños y adolescentes institucionalizados en los\nNiñas, Niños y Adolescentes centros de asistencia social.\nUnidad de Frecuencia de Medios de\nIndicador Método de Cálculo Tipo de Indicador Línea Base Meta 2024\nMedida Medición Verificación\nPorcentaje de\n(Número de adopciones adopciones finalizadas y los servicios de finalizadas y acogimiento familiar otorgados en servicios de el periodo / Número de acogimiento Porcentaje Trimestral Gestión 0% 100% Padrón de Beneficiarios adopciones requeridas y los familiar servicios de acogimiento familiar otorgados, a requeridos o solicitados en el niñas, niños y periodo) * 100 adolescentes\nResumen narrativo Orden Supuestos\n2.1.1.3 residencial a niñas, niños y adolescentes sin para contribuir a la protección y restitución de los cuidado parental o familiar. derechos de Niñas, Niños y Adolescentes albergados.\nUnidad de Frecuencia de Medios de\nIndicador Método de Cálculo Tipo de Indicador Línea Base Meta 2024\nMedida Medición Verificación\nO.P.D. SISTEMA PARA EL DESARROLLO INTEGRAL DE LA FAMILIA\nMatriz de Indicadores de Resultados\nDetalle de la Matriz 2024\nRamo: 5-Sector Paraestatal\nUnidad Responsable:\nP-46 -O.P. D, Sistema para el Desarrollo Integral de la Familia\nClave y Modalidad del\nS- Sujetos a Reglas de Operación\nPp:\nDenominación del Pp: I 006 FAM Asistencia Social\nClasificación Funcional:\nFinalidad: 1. BIENESTAR, DESARROLLO HUMANO Y JUSTICIA SOCIAL\n1.1 Reducir la pobreza de los Guerrerenses\nFunción:\n1.3. Disminuir las desigualdades a través de la atención a grupos vulnerables.\nSubfunción: 1.1.1. Aumento del ingreso económico de la población en situación de pobreza, impulsando su integración a mercado laboral y apoyando su desarrollo integral.\n1.3.2. Atención prioritaria a Grupos Vulnerables.\nResumen narrativo Orden Supuestos\nPromover el desarrollo comunitario para la mejora de\nLas comunidades son autogestivas, organizadas y con las condiciones sociales y económicas enfocadas al 2 participación activa. bienestar colectivo.\nUnidad de Frecuencia de Medios de\nIndicador Método de Cálculo Tipo de Indicador Línea Base Meta 2023\nMedida Medidor Verificación\nPorcentaje de\nLocalidades de\n(Número de Localidades de alta y alta y muy alta muy alta marginación con Grupos marginación con de Desarrollo Constituidos en el\nGrupos de año/Número total de Localidades Padrón de\nDesarrollo Porcentaje Anual Estratégico 0% 100% de alta y muy alta marginación Beneficiarios\nConstituidos en programadas para la constitución las que se de Grupos de Desarrollo en el fomenta la salud año) *100 y bienestar comunitario\nResumen narrativo Orden Supuestos\nImpulsar proyectos productivos que fomenten el\nLas familias que habitan en las localidades de alta y desarrollo de las actividades alternativas\n3 muy alta marginación desarrollan actividades productivas, para mejorar el ingreso familiar de la productivas para el auto consumo y la generación de población que\nUnidad de Frecuencia de Medios de\nIndicador Método de Cálculo Tipo de Indicador Línea Base Meta 2023\nMedida Medidor Verificación\n(Número de Localidades de alta y\nCobertura del muy alta marginación con Grupos programa de de Desarrollo Constituidos en el desarrollo año/Número total de Localidades Padrón de comunitario en Porcentaje Anual Estratégico 0% 100% de alta y muy alta marginación Beneficiarios\nLocalidades de programadas para la constitución alta y muy alta de Grupos de Desarrollo en el marginación. año) *100\nPropósito\nResumen narrativo Orden Supuestos\nCoadyuvar a la atención de los determinantes los componentes para el bienestar comunitario, 2.1 marginación articulen procesos tendientes al ejercicio comunitaria.\nUnidad de Frecuencia de Tipo de Medios de\nIndicador Método de Cálculo Línea Base Meta 2024\nMedida Medición Indicador Verificación\nO.P.D. SISTEMA PARA EL DESARROLLO INTEGRAL DE LA FAMILIA\nMatriz de Indicadores de Resultados\nPorcentaje de (Número total de localidades de alta y muy alta Grupos de Desarrollo marginación con Constituidos que han mejorado\nGrupos de alguno de los determinantes\nDesarrollo que sociales de salud Avance Físico\nPorcentaje Anual Estratégico 0% 100% han mejorado en el año / Número total de Financiero algunos de los localidades de alta y muy alta determinantes marginación programadas para la sociales de la constitución de Grupos de salud Desarrollo constituidos en el año)\n*100\nResumen narrativo Orden Supuestos\nContribuir a disminuir los índices de vulnerabilidad de Las familias en situación de vulnerabilidad reciben las familias, en localidades de Alta y Muy Alta apoyo para aumentar la productividad laboral\n3,1\nMarginación prioritariamente: reduciendo la falta de fomentando actividades productivas y de oportunidades por falta de ingresos; autoconsumo.\nUnidad de Frecuencia de Medios de\nIndicador Método de Cálculo Tipo de Indicador Línea Base Meta 2024\nMedida Medidor Verificación\n(Número total de proyectos\nPorcentaje de productivos entregados en proyectos\nLocalidades de alta y muy alta productivos marginación en el año/Número Avance Físico estratégicos en Porcentaje Anual Estratégico 108% 100% total de proyectos productivos Financiero las Localidades programados para entregar en de alta y muy\nLocalidades de alta y muy alta alta marginación marginación en el año) *100\nComponente\nResumen narrativo Orden Supuestos\nImplementar de acciones que garanticen el seguimiento de las capacitaciones, fomentando la Otorgar seguimiento al desarrollo de capacidades en\n2.1.1 practica de acciones para fortalecer la salud y el favor de la salud y bienestar comunitarios bienestar comunitario\nUnidad de Frecuencia de Tipo de Medios de\nIndicador Método de Cálculo Línea Base Meta 2024\nMedida Medición Indicador Verificación\n(Número total de acciones\nPorcentaje de realizadas para brindar acciones para seguimiento a las capacitaciones dar seguimiento a los GD en fortalecimiento a la a las salud y el bienestar comunitario\nPorcentaje Semestral Estratégico 0% 100% capacitaciones en el periodo / Número total de que favorezcan la acciones establecidas para salud y bienestar brindar seguimiento a las comunitario capacitaciones en el periodo)\n*100\nResumen narrativo Orden Supuestos\nMejorar de manera sostenida el bienestar económico La implementación de proyectos productivos\n3.1.1 de las familias en situación de vulnerabilidad coadyuva a mejorar el ingreso familiar.\nUnidad de Frecuencia de Tipo de Medios de\nIndicador Método de Cálculo Línea Base Meta 2024\nMedida Medición Indicador Verificación\nPorcentaje de\n(Número de familias beneficiadas familias mediante la entrega de proyectos beneficiadas productivos en el periodo / Padrón de mediante la Porcentaje Semestral Estratégico 107% 100%\nNúmero de familias programadas Beneficiarios entrega de para la entrega de proyectos proyectos productivos en el periodo) *100 productivos\nO.P.D. SISTEMA PARA EL DESARROLLO INTEGRAL DE LA FAMILIA\nMatriz de Indicadores de Resultados\nActividades\nResumen narrativo Orden Supuestos\nLas personas que habitan en localidades de alta y muy\nMide el porcentaje de capacitaciones otorgadas en alta marginación reciben capacitaciones para materia de determinantes sociales de la salud a desarrollar conocimientos, habilidades y\n2.1.1.1\nGrupos de Desarrollo constituidos en Localidades competencias, a fin de propiciar y fortalecer la de Alta y Muy Alta Marginación organización y participación comunitaria para el bienestar colectivo.\nUnidad de Frecuencia de Tipo de Medios de\nIndicador Método de Cálculo Línea Base Meta 2024\nMedida Medición Indicador Verificación\n(Número total de capacitaciones en materia de los determinantes\nPorcentaje de sociales de la salud otorgadas en capacitaciones el periodo a Grupos de Desarrollo otorgadas en constituidos en localidades de materia de los Alta y Muy Alta Marginación /\nAvance Físicodeterminantes Número total de capacitaciones Porcentaje Trimestral Gestión 0% 100%\nFinanciero sociales de en materia de los determinantes\nSalud a Grupos sociales de la salud programadas de Desarrollo para otorgarse a Grupos de\nConstituidos Desarrollo constituidos en localidades de Alta y Muy Alta\nMarginación) * 100\nResumen narrativo Orden Supuestos\nContribuir a mejorar las condiciones de vida de las personas y/o familias en los municipios o localidades\nEntregar paquetes para la implementación de de alta y muy alta marginación mediante la 3.1.1.1 proyectos productivos implementación de proyectos productivos de economía y traspatio.\nUnidad de Frecuencia de Medios de\nIndicador Método de Cálculo Tipo de Indicador Línea Base Meta 2024\nMedida Medición Verificación\nPorcentaje de entrega de\n(Número total de Paquetes apoyos para la entregados a personas en implementación condición e vulnerabilidad para la Avance Físicode proyectos Porcentaje Anual Gestión 108% 100% implementación de proyectos Financiero productivos en productivos/ Total de paquetes las Localidades programados para entrega) * 100 de alta y muy alta marginación\n14 Transparencia.\n14.1 Difusión.\nDe acuerdo con el Presupuesto de Egresos 2024 y al artículo 70, capítulo II De las Obligaciones de y atribuciones y responsabilidades de las instancias participantes en su ejecución. conocer el Programa. paraestatal/sistema-para-el-desarrollo integral-de-la-familia/, así como el Periódico Oficial del Gobierno del\nEstado.\nPara solicitar información sobre el Programa podrá acudir también al Sistema DIF Guerrero, a las oficinas de la Dirección de Asistencia Alimentaria y Desarrollo Comunitario ubicadas Av. Gabriel Leyva s/n esq.\nRuffo Figueroa, Col. Burócratas, C.P. 39090, Chilpancingo, Guerrero.\n14.2. Padrones de Beneficiarios.\nEl formato de padrón físico y digital (Anexo 3) de personas beneficiarias, será proporcionado por el SEDIF\nGuerrero a los SMDIF quienes tendrán la responsabilidad de llevar a cabo esta actividad a fin de entregar la información en las fechas establecidas por el SEDIF Guerrero.\nUna vez concluido el padrón de personas beneficiarias correspondiente al ejercicio fiscal, los SMDIF remitirán para su revisión y validación al SEDIF Guerrero, en formato físico y en digital la cantidad de beneficiarios capturados de acuerdo a la cantidad de apoyos y/o servicios previamente entregados para los municipios de la entidad, conformando así el Padrón Único del estado de Guerrero.\nEl padrón único del estado de Guerrero deberá llenarse de acuerdo con las primeras 21 variables obligatorias y sus características establecidas en el modelo de datos para personas físicas en el Manual de Operación del Sistema Integral de Información de Padrones de Programas Gubernamentales (SIIPP-\nG), publicado en el Diario Oficial de la Federación el 13 de septiembre del 2018.\nLa Dirección General de Alimentación y Desarrollo Comunitario (DGADC), en coordinación con el enlace interinstitucional del SNDIF ante la SFP para el SIIPP-G, podrá determinar si los padrones de la EIASADC se integrarán al SIIPP-G; así como los mecanismos para hacerlo. la materia y demás normativas aplicables, de acuerdo a lo establecido en los artículos 12 y 14 de la Ley de\nProtección de Datos Personales en Posesión de Sujetos Obligados (particulares) (DOF, 26 enero del 2017).\n14.3. Quejas, Denuncias y Solicitudes de Información.\nLa población beneficiada puede presentar quejas, denuncias y solicitudes de información ante las oficinas del Sistema Estatal DIF Guerrero sobre cualquier hecho, acto u omisión que produzca o pueda producir daños al ejercicio de sus derechos establecidos en las presentes Reglas de Operación, que contravengan sus disposiciones y de la demás normatividad aplicable, en:\na) El SEDIF.\nDomicilio: Centro de Rehabilitación Integral Guerrero. Boulevard Lic. René Juárez Cisneros S/N, Col.\nCiudad de los Servicios. Chilpancingo, Guerrero. C.P. 39095.\nb) La Secretaría de Contraloría.\nTeléfonos: (74-74-71-97-00)\nCorreo electrónico: Domicilio: Recinto de las Oficinas del Poder Ejecutivo, Primer Piso Edificio Norte, Boulevard René Juárez Cisneros 62 Col. Ciudad de los Servicios C.P. 39075.\nLas quejas y denuncias de la ciudadanía derivadas de alguna irregularidad en la operación del Proyecto podrán presentarse por escrito, por comparecencia de la beneficiaria y beneficiario, por correo electrónico o vía telefónica y deberá proporcionar los siguientes datos: nombre de la servidora o servidor público, área de adscripción, objeto de la denuncia, nombre y domicilio de la persona quejosa e identificación oficial.\n14.4. Comités de Vigilancia Ciudadana.\nLa vigilancia ciudadana es el mecanismo de las/los beneficiarias/os considerados en esta Estrategia, para que de manera organizada verifiquen el cumplimiento de las metas y la correcta aplicación de los recursos públicos asignados a cada programa. Es una práctica de transparencia y rendición de cuentas, por lo tanto, todos los programas de la presente Estrategia deberán contar con un Comité de Vigilancia Ciudadana\n(CVC).\nCriterios para formar un comité de vigilancia ciudadana\n• Integrarse con un mínimo de tres personas beneficiarias-usuarias del programa del que se trate.\n• Se conformará a través de un acta constitutiva, en la cual los integrantes deberán aceptar formar ser parte de éste de manera voluntaria, gratuita y libre.\n• Se incluirá nombre, datos de contacto de cada uno de los integrantes del comité, domicilio\n(localidad, código postal y entidad federativa), así como especificar la voluntad de cada uno de ellos para pertenecer a éste. Es importante acotar que, para el caso del Programa de Alimentación\nEscolar, la conformación y funciones del CVC, se realizarán de conformidad con el inciso g), numeral 5.1 Comités, considerado en el Tomo 3 de esta Estrategia.\n• Los integrantes del CVC deberán ser elegidos por mayoría de votos, este mecanismo deberá realizarse por las personas beneficiarias, bajo la coordinación del SMDIF y/o del SEDIF, según sea determinado por el programa que se opere. Se deberá dejar constancia de la elección, a través de una breve leyenda en la que se exprese dicho acto, lo anterior, dentro del acta constitutiva del\nComité de Vigilancia Ciudadana.\n• La vigencia del CVC se determinará por el programa que se opere, el cual deberá considerar como mínimo un ejercicio fiscal y para el caso del Programa de Alimentación Escolar, este deberá de ser acorde al calendario escolar vigente. Y será rotativo.\n• El SEDIF llevará acabo capacitaciones o reuniones con los Comités, en los cuales se realizará una minuta.\n• El comité deberá de renovarse y ser rotativo. El SEDIF o el SMDIF será el responsable de convocar el siguiente CVC.\n• Dentro de la conformación se promoverá la inclusión de mujeres y hombres de manera equitativa.\nANEXO 1. ACTA DE DONACIÓN\nANEXO 2. ESTUDIO SOCIECONOMICO.\nANEXO 3. PADRON DE BENEFICIARIOS.\nPrimero: El presente acuerdo entrara en vigor al día siguiente de su publicación en el Periódico\nSegundo: Se abroga el acuerdo por el que se emiten las Reglas de Operación del Proyecto de\nAdquisición y Donación de Aparatos Funcionales (Alcance I), Proyecto de Adquisición y Donación Aparatos\nAuditivos (Alcance I), Proyecto de Adquisición y Donación de Aparatos Protésicos (Alcance I), Proyecto de\nAdquisición y Donación de Cobertores “Cobijando Guerrero” (Alcance I), Proyecto de Adquisición y\nDonación de Sillas de Ruedas (Alcance II), Proyecto de Adquisición y Donación de Lentes para Débiles\nVisuales (Alcance II), Proyecto de Apoyos Médicos para Grupos Prioritarios (Alcance III), Proyecto de\nApoyos en Especie para Grupos Prioritarios (Alcance III), Proyecto para Paquetes de Insumos y Enseres\nAgrícolas para la Producción Primaria (Alcance VI), Proyecto de Estufas Ecológicas (Alcance IV), Proyecto de Equipamiento e Instalación de Comedor Escolar Comunitario (Alcance IV), Proyecto para Instalación de\nHuertos Escolares y/o Huertos Familiares (Alcance V), Proyecto Jornadas de Implante de Rodilla y Cadera\n(Alcance V), Proyecto de Jornadas de Cirugías de Cataratas (Alcance V), que fueron publicadas en el\nPeriódico Oficial del Estado de Guerrero Número 25 con fecha de 28 de marzo del 2023.\nTercero: A partir de la entrada en vigor del presente acuerdo, las Reglas de Operación del\nPrograma de Atención a Grupos Prioritarios, subsecuente en sus modificaciones serán emitidas por la persona titular del Sistema para el Desarrollo Integral de la Familia del Estado de Guerrero, responsable directo de la operación y ejecución de estos.\nDado en el “Recinto de las Oficinas del Poder Ejecutivo del Estado” inmueble ubicado en el número\n62, Edificio Norte Planta Baja, en el boulevard Rene Juárez Cisneros, Código Postal 39074, colonia Ciudad de los Servicios, Chilpancingo de los Bravo, Capital del estado de Guerrero a los diecinueve días del mes de marzo del dos mil veinticuatro.\nLA GOBERNADORA CONSTITUCIONAL DEL ESTADO DE GUERRERO.\nMTRA. EVELYN CECIA SALGADO PINEDA.\nRúbrica.\nLA ENCARGADA DE DESPACHO DE LA SECRETARÍA GENERAL DE GOBIERNO.\nDRA. ANACLETA LÓPEZ VEGA.\nRúbrica.\nEL DIRECTOR GRAL. DEL SISTEMA PARA EL DESARROLLO INTEGRAL DE LA FAMILIA.\nLIC. ANTELMO MAGDALENO SOLIS.\nRúbrica.",
  "ordenamiento": "PROGRAMA",
  "jurisdiccion": "GUERRERO",
  "fuente_oficial": "DIARIO OFICIAL DE LA FEDERACION",
  "Fecha de Publicación": "21 DE MARZO DE 2025",
  "ULTIMA REFORMA PUBLICADA": null,
  "status": "VIGENTE",
  "es_escaneado": false,
  "tiene_tablas": true,
  "materia": [
    "general"
  ]
}