{
  "titulo": "Acuerdo por el Que Se Crea el Programa Emprende y Transforma Guerrero, y Se Emiten Sus Reglas de Ope",
  "Contenido": "LAS REGLAS DE OPERACIÓN DEL PROGRAMA EMPRENDE Y TRANSFORMA GUERRERO, PUBLICADO EN EL\nTEXTO ORIGINAL. de Abril de 2023.\nACUERDO POR EL QUE SE CREA EL PROGRAMA EMPRENDE Y TRANSFORMA\nGUERRERO, Y SE EMITEN SUS REGLAS DE OPERACIÓN.\nGuerrero. - Poder Ejecutivo.\nMAESTRA EVELYN CECIA SALGADO PINEDA, GOBERNADORA CONSTITUCIONAL DEL\nESTADO DE GUERRERO, CON FUNDAMENTO EN LO DISPUESTO POR LOS ARTÍCULOS 71, 87, 88,\nLOS ARTÍCULOS 2, 4, 8, 9, 14, 22 APARTADO A FRACCIONES I Y X, 23 FRACCIÓN III Y 32 DE LA\nLEY ORGÁNICA DE LA ADMINISTRACIÓN PÚBLICA DEL ESTADO DE GUERRERO NÚMERO 242; 1,\n2 FRACCIÓN I, 18 Y 25 DE LA LEY NÚMERO 454 DE PRESUPUESTO Y DISCIPLINA FISCAL DEL\nESTADO DE GUERRERO; 31, 32, 33, 34 Y 35 DE LA LEY DE FOMENTO ECONÓMICO, INVERSIÓN Y\nDESARROLLO DEL ESTADO DE GUERRERO NÚMERO 487; EN RELACIÓN CON EL ARTÍCULO 47\nY ANEXOS 23 (E10) Y 23-A DEL DECRETO NÚMERO 424 DEL PRESUPUESTO DE EGRESOS DEL\nESTADO DE GUERRERO PARA EL EJERCICIO FISCAL 2023, Y LOS LINEAMIENTOS PARA LA\nELABORACIÓN DE LAS REGLAS DE OPERACIÓN DE LOS PROGRAMAS SOCIALES ESTATALES\nPARA EL PERIODO 2022-2027.\nQue el Plan Nacional de Desarrollo 2019-2024, establece como principio rector la economía para el bienestar, que busca centrar el objetivo de la política económica en el mejoramiento del nivel de vida de la población. Por lo tanto, este documento rector del desarrollo económico y social de nuestro país, constituye el punto de partida para el diseño e implementación del Programa Emprende y Transforma\nGuerrero.\nQue el Plan Estatal de Desarrollo 2022-2027 establece en el Eje II. Desarrollo Económico\nSostenible, y establece en sus estrategias y líneas de acción el implementar acciones que detonen el crecimiento de la actividad productiva, para que las micro, pequeñas y medianas empresas sean económicamente sostenibles en concordancia con la visión de la agenda 2030 de la Organización de las\nNaciones Unidas el cambio climático y que nadie quede rezagado. Desarrollando estrategias y acciones, que conduzcan a la prosperidad y el trabajo conjunto.\nGuerrero, establece que el estado de Guerrero atenderá de manera programática y planificada los derechos económicos, sociales, culturales y ambientales para hacer realidad el progreso y el bienestar de sus habitantes; al efecto, expedirá programas de gobierno y políticas públicas que se requieran.\nQue la política estatal con el lema “Transformando Guerrero”, tiene la firme convicción de combatir de manera frontal los rezagos históricos que ha padecido el estado de Guerrero, bajo los principios de la\nCuarta Transformación. Estos propósitos sólo se pueden lograr, escuchando las voces de los más necesitados; promoviendo y fortaleciendo el desarrollo de capacidades de las y los habitantes que han sobrevivido con grandes carencias.\nQue es objetivo del gobierno del estado, promover el emprendimiento de las mujeres y los hombres, en condiciones de igualdad de oportunidades, mediante apoyos gubernamentales que les permitan emprender iniciativas de negocio a través de microempresas que se sostengan y consoliden en el tiempo para su incorporación a la economía formal, dedicadas a las actividades económicas de los sectores industrial, comercial y de servicios, favoreciendo la generación de empleos.\nQue la Ley de Fomento Económico, Inversión y Desarrollo del Estado de Guerrero Número 487, establece que el gobierno del estado propiciará la acción deliberada y comprometida de los sectores productivos e instancias de gobierno, para que participen en el fomento de las actividades viables para el desarrollo económico del estado, incrementando el empleo y preservando el medio ambiente.\nQue derivado del Decreto Número 424 del Presupuesto de Egresos del Estado de Guerrero para el Ejercicio Fiscal 2023, el cual señala que se ejercitarán los recursos bajo una política de gasto público, que permita dar cumplimiento a lo que globalmente prevén las dimensiones, ejes temáticos, objetivos, estrategias y líneas de acción del Plan Estatal de Desarrollo 2022-2027, orientados a los sectores, municipios y comunidades más desprotegidos del estado.\nQue el citado Decreto Número 424 en su artículo 47, establece que, con el objeto de asegurar la aplicación eficiente, eficaz, oportuna, equitativa y transparente de los recursos públicos, la Secretaría de\nFinanzas y Administración y la Secretaría de Planeación y Desarrollo Regional, emitirán las disposiciones a que deberán sujetarse los programas de inversión sujetos a Reglas de Operación.\nQue la Secretaría de Planeación y Desarrollo Regional, expidió los Lineamientos para la\nElaboración de las Reglas de Operación de los Programas Sociales Estatales para el Periodo 2022-2027, de 2022. Los cuales, tienen la finalidad de ser un instrumento técnico que guie la elaboración de los apartados centrales de las Reglas de Operación, así como los elementos para integrar su contenido.\nQue por consiguiente las personas titulares de las secretarías y/o entidades paraestatales de la administración pública, así como las servidoras y servidores públicos autorizados para ejercer recursos públicos del presupuesto e inversión de los mismos, serán responsables de los programas y/o proyectos de inversión considerando que los apoyos otorgados deberán sujetarse a los criterios de objetividad, equidad, transparencia, publicidad, selectividad y temporalidad.\n242, la Secretaría de Fomento y Desarrollo Económico es el órgano encargado de planear, regular, promover y fomentar el desarrollo económico, industrial, agroindustrial, minero, artesanal, comercial en el estado.\nQue el Programa Emprende y Transforma Guerrero, tiene por objeto apoyar el emprendimiento de las mujeres y los hombres, en condiciones de igualdad de oportunidades, mediante la apertura de microempresas dedicadas a las actividades económicas de los sectores industrial, comercial y de servicios, generando empleo y autoempleo.\nPor lo anteriormente expuesto y con fundamento en las disposiciones legales antes citadas, he tenido a bien expedir el siguiente:\nACUERDO POR EL QUE SE CREA EL PROGRAMA EMPRENDE Y TRANSFORMA GUERRERO, Y SE\nEMITEN SUS REGLAS DE OPERACIÓN.\nArtículo 1. Se crea el Programa Emprende y Transforma Guerrero, el cual tiene como objetivo, fomentar el emprendimiento de mujeres y hombres, mediante la apertura de microempresas que se sostengan y consoliden en el tiempo para su incorporación a la economía formal, favoreciendo el derecho humano al trabajo y la igualdad de género, al promover la generación de empleos en condiciones de igualdad de oportunidades.\nArtículo 2. La Secretaría de Fomento y Desarrollo Económico, tendrá a cargo la implementación, operación, ejecución, evaluación y administración del Programa Emprende, bajo los criterios de objetividad, equidad, transparencia, publicidad, selectividad y temporalidad, con estricto apego a la normatividad aplicable, siendo la encargada de la dispersión y asignación de los recursos del Programa, apegándose plenamente a las Reglas de Operación.\nArtículo 3. Se emiten las Reglas de Operación del Programa Emprende y Transforma Guerrero, que establecen los principios de eficiencia, eficacia, oportunidad, equitativa y transparencia de los recursos públicos y requisitos que se deben de cumplir para poder acceder ha dicho Programa, en los términos siguientes:\nREGLAS DE OPERACIÓN DEL PROGRAMA EMPRENDE Y TRANSFORMA GUERRERO.\n1. Introducción.\n1.1. Antecedentes\nGuerrero, busca incentivar la participación ciudadana y de las instancias de los tres órdenes de gobierno en actividades productivas que impulsen el desarrollo económico sostenible del estado.\nEl Programa Emprende y Transforma Guerrero, se crea con el propósito de impulsar la participación de las mujeres y los hombres en actividades productivas, bajo el principio de igualdad de oportunidades y beneficios, en el proceso del desarrollo económico sostenible, que tiene como último fin el bienestar de la población.\n2. Alineación Programática al PND y/o PED.\nEl Programa, está alineado al Plan Nacional de Desarrollo 2019-2024, específicamente, al Eje III\nEconomía; Objetivo 6, Impulsar la reactivación económica, el mercado interno y el empleo, que establece un objetivo estratégico del gobierno federal, consistente en la reactivación económica nacional mediante la creación de empleos productivos.\nAsimismo, considerando que la propuesta de desarrollo económico, político y social, que promueve el gobierno federal, en el marco de la Cuarta Transformación, se sustenta en principios rectores, el Programa, se alinea al principio de la economía para el bienestar, que considera al crecimiento económico como medio para alcanzar el bienestar de la población.\nCon relación al Plan Estatal de Desarrollo 2022-2027, el Programa, está alineado al siguiente eje, objetivo, estrategia y línea de acción:\nEje 2: Desarrollo Económico Sostenible\nObjetivo 2.34: Aplicar una política de apoyo incluyente a emprendedores y Micro, Pequeñas y\nMedianas Empresas (MIPYMES).\nEstrategia 2.34.1: Promover programas que incluyan capacitación y el otorgamiento de apoyos para emprendedores y Micro, Pequeñas y Medianas Empresas (MIPYMES).\nLínea de acción 2.34.1.2: Gestionar fuentes de financiamiento de los tres niveles de gobierno y el sector privado, para el financiamiento de proyectos de emprendedores y Micro, Pequeñas y Medianas\nEmpresas (MIPYMES).\n2.1. Diagnóstico.\nDatos del INEGI refieren que, en nuestro país en el año 2019, 6 de cada 10 empresas que iniciaron operaciones cerraron antes de cumplir dos años y que el mayor número de cierres, se concentró en las de tamaño micro, que, de acuerdo a la Ley para el Desarrollo de la Competitividad de la Micro, Pequeña y\nMediana Empresa, son aquellas que cuentan con hasta 10 trabajadores y tienen ingresos de hasta 4 millones de pesos anuales.\nPor su parte, datos del Estudio sobre Demografía de los Negocios 2021 del INEGI, muestran que a 27 meses de concluidos los Censos Económicos 2019, en Guerrero cerraron 38,312 establecimientos, de los cuales el 99% se clasificaban como micro, el 76% operaban en la informalidad y el 82.7% realizaban actividades de comercio y servicios.\nEn cuanto a las principales características de las empresas de escala micro que cerraron, el INEGI señala las siguientes: en el rubro de nivel de estudios del personal ocupado, las personas que no tenía instrucción, contaban con estudios básicos y educación media superior, representaron el 84.7%, para las que contaban con educación superior la cifra fue de 15.7%. Asimismo, menos del uno por ciento capacitaba al personal, el7% usaba internet, menos del uno por ciento contaba con ventas por internet y únicamente el 7.8% contaba con financiamiento.\nLos datos sugieren que las empresas de escala micro, presentan mayor riesgo de cierre en los primeros años de operación, como resultado de la falta de capacitación para el desarrollo de habilidades empresariales, con frecuencia no se tiene documentada la idea de negocio, no se incorporan Tecnologías de la Información y las Comunicaciones (TIC), y al operar en su mayoría en la informalidad, no tienen acceso al financiamiento.\nPor otra parte, datos de los Censos Económicos 2019, publicados por el INEGI, refieren que, en\nGuerrero, el 76% de las unidades económicas operan en la informalidad, en tanto que la Encuesta Nacional de Ocupación y Empleo, Nueva Edición (ENOE), correspondiente al tercer trimestre de 2022, reportó que la tasa de informalidad laboral fue del 79.3%, ubicándose en el segundo lugar entre las entidades federativas. La misma encuesta muestra que, el 39% de las mujeres y el 61% de los hombres, de la población ocupada, trabajaron sin prestaciones laborales. Asimismo, la referida encuesta, pone de manifiesto la diferencia de ingresos entre mujeres y hombres de la población ocupada; en el rango, hasta un salario mínimo, el 52% correspondió a mujeres y el 48% a hombres; en los rangos subsecuentes de mayores ingresos, las mujeres participaron, en promedio con el 36% y los hombres con el 64%.\nEn este contexto, el Programa, apoya el emprendimiento de mujeres y hombres, mediante la apertura de microempresas que se sostengan y consoliden en el tiempo para su incorporación a la economía formal, mitigando el riesgo de cierre con capacitación y acompañamiento, y otorgando apoyos económicos para iniciar la idea de negocio; contribuye a la formalización de microempresas y promueve la igualdad económica de mujeres y hombres.\n2.1.1. Población Potencial.\nMujeres y hombres de 18 años de edad y más, interesados en emprender un negocio mediante la apertura de una microempresa que se sostenga y consolide en el tiempo para su incorporación a la economía formal.\n2.1.2. Población objetivo.\nMujeres y hombres de 18 años de edad y más, interesados en emprender un negocio mediante la economía formal, dedicada a actividades de industria, comercio o servicios y con domicilio en el estado de\nGuerrero.\n2.1.3. Población Beneficiaria.\nPersonas consideradas en la población objetivo, que presentaron solicitud de apoyo y fueron atendidas con el otorgamiento de apoyos del Programa.\n2.1.4. Población Indígena.\nEl Programa tiene una cobertura estatal, por lo tanto, podrán participar todas las personas, sin distinción alguna, con domicilio en el estado de Guerrero que forman parte de la población objetivo.\n2.2. Fundamento Legal.\na) Constitución Política de los Estados Unidos Mexicanos;\nb) Plan Nacional de Desarrollo 2019-2024;\nd) Ley de Coordinación Fiscal;\ne) Ley Orgánica de la Administración Pública del Estado de Guerrero Número 242;\nf) Ley de Fomento Económico, Inversión y Desarrollo del Estado de Guerrero Número 487;\ng) Ley Número 454 de Presupuesto y Disciplina Fiscal del Estado de Guerrero;\ni) Ley Número 466 de Protección de Datos Personales en Posesión de Sujetos Obligados del\nEstado de Guerrero;\nj) Ley Número 207 de Transparencia y Acceso a la Información Pública del Estado de Guerrero;\nk) Decreto Número 424 del Presupuesto de Egresos del Estado de Guerrero para el Ejercicio\nFiscal 2023;\nl)Decreto Número 181 por medio del cual la Sexagésima Tercera Legislatura al Honorable\n2022-2027;\nm) Lineamientos para la elaboración de las Reglas de Operación de los Programas Sociales\nEstatales para el periodo 2022-2027, y\nn) Reglamento Interior de la Secretaría de Fomento y Desarrollo Económico.\n2.3. Definiciones y Siglas.\nPara los efectos de las presentes Reglas de Operación se entenderá por:\nDefiniciones:\nGuerrero a través de la Secretaría de Fomento y Desarrollo Económico, a las personas beneficiarias del\nPrograma.\nBeneficiaria y Beneficiario: Persona que ha recibido apoyo y cuyos datos se encuentran registrados en el Padrón de Personas Beneficiarias del Programa.\nComité de Evaluación: Comité de Evaluación del Programa.\nMicroempresa: Unidad económica que opera en los sectores industrial, comercial o de servicios, que cuenta con hasta 10 trabajadores e ingresos hasta por 4 millones de pesos anuales.\nPresupuesto de Egresos 2023: Decreto Número 424 del Presupuesto de Egresos del Estado de\nGuerrero para el Ejercicio Fiscal 2023.\nPadrón de Personas Beneficiarias: Relación de las y los beneficiarios del Programa, integrada conforme a las disposiciones de la Ley Número 207 de Transparencia y Acceso a la Información Pública del Estado de Guerrero.\nPrograma: Programa Emprende y Transforma Guerrero.\nReglas de Operación: Reglas de Operación del Programa Emprende y Transforma Guerrero.\nReporte de Comprobación: Reporte que desglosa por concepto el ejercicio del recurso económico otorgado, firmado bajo protesta de decir verdad.\nSecretaría de Contraloría: Secretaría de Contraloría y Transparencia Gubernamental.\nSolicitud de Apoyo: Formato de solicitud de apoyo del Programa; Anexo 3, de las presentes\nReglas de Operación.\nSiglas:\nCURP: Clave Única de Registro de Población.\nENOE: Encuesta Nacional de Ocupación y Empleo.\nINEGI: Instituto Nacional de Estadística y Geografía.\nSEFINA: Secretaría de Finanzas y Administración.\nSEFODECO: Secretaría de Fomento y Desarrollo Económico.\nSEPLADER: Secretaría de Planeación y Desarrollo Regional.\n3. Objetivos y Alcances.\n3.1. Objetivo General.\nFomentar el emprendimiento de mujeres y hombres, mediante la apertura de microempresas que se sostengan y consoliden en el tiempo para su incorporación a la economía formal, favoreciendo el derecho humano al trabajo y la igualdad de género, al promover la generación de empleos en condiciones de igualdad de oportunidades.\n3.2. Objetivo Específico.\nOtorgar Apoyos a mujeres y hombres contemplados en la población objetivo, de manera directa y sin intermediarios, destinados a capital de trabajo, equipamiento o infraestructura, en el emprendimiento de microempresas que se sostengan y consoliden en el tiempo para su incorporación a la economía formal, dedicadas a actividades de industria, comercio o servicios y domicilio en el estado de Guerrero.\n3.3. Cobertura.\nEl Programa, tendrá una cobertura estatal, por lo tanto, podrán participar las personas contempladas en la población objetivo con domicilio en el estado de Guerrero.\n3.4. Alcances.\nEl Programa contempla el otorgamiento de apoyos, de manera directa y sin intermediarios, a las personas que forman parte de la población objetivo, destinados a capital de trabajo, equipamiento o infraestructura, en el emprendimiento de microempresas que se sostengan y consoliden en el tiempo para su incorporación a la economía formal, dedicadas a actividades de industria, comercio o servicios y domicilio en el estado de Guerrero.\n4. Metas Físicas.\nEn el ejercicio fiscal 2023, se tiene contemplado otorgar 340 apoyos del Programa a las personas de la población objetivo que cumplan con lo dispuesto en las presentes Reglas de Operación.\n5. Programación Presupuestal.\nEl monto aprobado en el presupuesto de egresos 2023, para la implementación del Programa, asciende a $3, 500,000.00 (Tres millones quinientos mil pesos 00/100 m. n.); los recursos provienen de la fuente de financiamiento de Inversión Estatal Directa (IED) y estarán sujetos a la suficiencia presupuestal disponible, conforme a la siguiente calendarización:\nEnero Febrero Marzo Abril Mayo Junio\n0.0 0.0 0.0 0.0 $3,500,000.00 0.0\n0.0 0.0 0.0 0.0 0.0 0.0\n5.1. Gastos de Operación.\nEl Programa contempla gastos de operación, cuyo monto corresponderá hasta un 3% del total de recursos aprobados para el Programa en el Decreto Número 424 de Presupuesto de Egresos del Estado de Guerrero para el Ejercicio Fiscal 2023, y se destinará a diversas acciones asociadas con la planeación, promoción, difusión, operación, supervisión, verificación, fotocopiado e impresión de material promocional; viáticos y pasajes, contraloría social, evaluación y, en su caso, la publicación de las convocatorias del\nPrograma, en dos periódicos de mayor circulación en el estado de Guerrero.\n6. Criterios y Requisitos de Elegibilidad.\nLas personas contempladas en la población objetivo, interesadas en obtener apoyo del Programa, deberán cumplir con los siguientes criterios y requisitos de elegibilidad:\na) Criterios de elegibilidad:\n• Mujeres y hombres mayores de 18 años de edad con interés en emprender un negocio.\n• Con domicilio en el estado de Guerrero.\n• No ser servidora o servidor público en activo de los gobiernos federal, estatal o municipal, ni de los poderes Legislativo y Judicial.\n• Cumplir con los requisitos del Programa, establecidos en las presentes Reglas de Operación y la convocatoria correspondiente.\nb) Requisitos:\nLas personas de la población objetivo, podrán solicitar apoyo del Programa, cumpliendo los siguientes requisitos:\nRequisito Documento\n1). Presentar solicitud de apoyo de Formato de solicitud de apoyo del Programa, Anexo 3 de acuerdo a la convocatoria las Reglas de Operación. correspondiente\n2). Identificación oficial de la Copia de la Credencial para votar, Cédula Profesional o persona solicitante Pasaporte vigente.\n3). Domicilio de la persona Copia del recibo telefónico, recibo del servicio de agua, solicitante en el estado de Guerrero recibo de luz o predial, con fecha no mayor a dos meses de la fecha de expedición.\n4). Contar con cuenta bancaria Copia de la caratula del estado de cuenta bancaria a nombre de la persona solicitante, con clabe interbancaria y con fecha no mayor a dos meses de la fecha de expedición.\n5). Recibo de Apoyo del Programa Formato de recibo de apoyo del Programa, Anexo 4 de las\nEmprende Reglas de Operación.\n6). No duplicar apoyos del gobierno Escrito dirigido a la persona titular de la SEFODECO, del estado firmado bajo protesta de decir verdad, en el que manifieste la persona solicitante que, en el presente ejercicio fiscal, no ha recibido apoyo por parte de otras dependencias del gobierno del estado, para el mismo concepto de apoyo solicitado.\n7).- No encontrarse activo como Escrito dirigido a la persona titular de la SEFODECO, servidor público de los gobiernos firmado bajo protesta de decir verdad, en el que manifieste federal, estatal o municipal, ni la persona solicitante que no es servidora o servidor público tampoco de los poderes Legislativo de los gobiernos federal, estatal o municipal, ni de los y Judicial poderes Legislativo y Judicial.\n7. Tipo, Monto y Periodicidad del Apoyo.\nEl Programa otorgará, por única vez y de manera directa a las y los beneficiarios, un apoyo económico de $10,000.00 (Diez mil pesos 00/100 m.n.), conforme a lo establecido en las presentes Reglas de Operación.\n7.1. Características de los Apoyos.\nLos apoyos del Programa son apoyos económicos que se entregan de manera directa y sin intermediarios, a las y los beneficiarios, a través de transferencia bancaria, destinados a capital de trabajo, equipamiento o infraestructura, en el emprendimiento de microempresas que se sostengan y consoliden en el tiempo para su incorporación a la economía formal, con domicilio en el estado de Guerrero y dedicadas a actividades de industria, comercio o servicios.\n7.2. Recursos no Devengados.\nLos recursos aprobados para el Programa en el presupuesto de egresos 2023, que no sean ejercidos o devengados al 31 de diciembre del presente año, serán reintegrados a la SEFINA.\n7.3 Resguardo de la Documentación.\nLa Dirección General de Fomento Empresarial, perteneciente a la SEFODECO, resguardará la la misma dependencia, efectuará el cierre del ejercicio.\n7.4. Supervisión y Control.\nEmpresarial, responsable de su operación y la verificación del cumplimiento de los objetivos establecidos en las presentes Reglas de Operación, enviando un reporte mensual a la Unidad de Planeación y\nPresupuesto, a partir de la publicación de la convocatoria correspondiente. de Contraloría, informes sobre el presupuesto ejercido, mismos que están establecidos por el Consejo\nNacional de Armonización Contable (CONAC). Dichos informes se deberán presentar a más tardar a los quince días hábiles posteriores a la terminación de cada trimestre.\n8. Criterios de Selección.\nEl Programa tiene como objetivo apoyar a mujeres y hombres de 18 años de edad y más, con interés en emprender un negocio mediante la apertura de una microempresa que se sostenga y consolide en el tiempo para su incorporación a la economía formal, con domicilio en el estado de Guerrero y dedicada a actividades de industria, comercio o servicios.\nCon el propósito de contribuir a la igualdad de oportunidades entre mujeres y hombres y, en consecuencia, al cierre de brechas de desigualdad, en el proceso de selección de las personas beneficiarias del Programa, podrán recibir puntuaciones específicas y/o adicionales en los criterios de elegibilidad de las convocatorias correspondientes, aquellas que se encuentren en condiciones de discapacidad, pertenezcan a pueblos y comunidades indígenas y afromexicanas, personas adultas mayores, mujeres que habiten en municipios con declaración de Alerta de Violencia de Género Contra las\nMujeres, personas desplazadas internamente, o que habiten en localidades, municipios y regiones económicas con mayor rezago o mayor índice de pobreza, y todas aquellas condiciones que impidan el acceso equitativo a los beneficios del desarrollo económico. Asimismo, las personas que en los ejercicios fiscales 2022 y 2023, recibieron capacitación en materia de emprendimiento, podrán recibir puntuaciones específicas y/o adicionales.\nEl proceso de selección de personas beneficiarias del Programa, será conforme al siguiente procedimiento:\na) Publicación de las Reglas de Operación del Programa en el Periódico Oficial del Gobierno del\nEstado de Guerrero.\nb) Instalación del Comité de Evaluación del Programa.\nEl Comité de Evaluación del Programa, es un órgano colegiado que tendrá como objetivo conocer y resolver los asuntos relacionados con el Programa; estará integrado de la siguiente manera:\n• La persona titular de la Secretaría de Fomento y Desarrollo Económico, que fungirá como presidenta o presidente;\n• La persona titular de la Dirección General de Fomento Empresarial, quien fungirá como secretaria o secretario técnico;\n• La persona titular de la Subsecretaría de Fomento Económico;\n• La persona titular de la Unidad de Asuntos Jurídicos, y\n• La persona titular de la Delegación Administrativa.\nc) Publicación de la o las convocatorias del Programa.\nd) Recepción de solicitudes de apoyo y de los documentos establecidos como requisito en las presentes Reglas de Operación.\ne) La solicitud de apoyo y los documentos señalados como requisitos, se podrán presentar en las oficinas de la Dirección General de Fomento Empresarial, ubicadas en el Recinto de las Oficinas del\nPoder Ejecutivo del Estado de Guerrero, Edificio Acapulco, Primer Piso, Boulevard Lic. René Juárez\nCisneros No. 62, Col. Ciudad de los Servicios, Chilpancingo, Gro., en un horario de atención de las 9:00 a las 16:00 horas; enviarse al correo electrónico emprende.sefodeco@guerrero.gob.mx en archivo PDF por cada uno de los documentos enviados o presentarse en la plataforma digital que establezca la SEFODECO para tal fin. En la convocatoria correspondiente la SEFODECO especificará la forma de presentación de las solicitudes de apoyo.\nf) La Dirección General de Fomento Empresarial, dictaminará las solicitudes de apoyo presentadas, y aquellas que obtengan dictamen favorable, en términos de lo dispuesto en las presentes\nReglas de Operación y la convocatoria correspondiente, serán presentadas para su autorización correspondiente, al Comité de Evaluación del Programa, que para tales efectos deberá sesionar con la presencia del cincuenta por ciento más uno de sus integrantes.\ng) Los apoyos del Programa, se autorizarán de acuerdo al mecanismo: primero en tiempo, primero en derecho; estableciendo un orden de prelación, por separado, de las solicitudes de apoyo presentadas por mujeres y hombres, que cuenten con dictamen favorable de la Dirección General de\nFomento Empresarial y, estableciendo un segundo orden, de mayor a menor, de acuerdo a la calificación obtenida en el dictamen que realice la Dirección General mencionada, hasta agotar el monto del recurso presupuestal disponible.\nh) La o el secretario técnico del Comité de Evaluación del Programa, levantará el acta correspondiente de las sesiones, mismas que contendrán, en su caso, el listado de las solicitudes de apoyo autorizadas.\ni) Mediante oficio firmado por la persona titular de la SEFODECO, la Dirección General de\nFomento Empresarial, notificará la autorización de apoyo a las personas solicitantes en un plazo de diez días hábiles contados a partir del día siguiente de la sesión del Comité de Evaluación del Programa.\nEn el oficio de autorización se deberá solicitar la documentación comprobatoria del apoyo, consistente en el Reporte de Comprobación, entendiéndose como tal, al reporte que desglose por concepto el ejercicio del recurso económico recibido, firmado bajo protesta de decir verdad en los medios de presentación que establezca la SEFODECO.\nUna vez notificado el oficio de autorización, la persona solicitante deberá entregar en un plazo de diez días hábiles, contados a partir del día siguiente de la notificación, el recibo de apoyo del Programa, conforme a lo establecido en la convocatoria correspondiente.\nj) La Dirección General de Fomento Empresarial, entregará mediante oficio firmado por la persona titular de la SEFODECO, a la persona titular de la Delegación Administrativa, la relación de las personas que cuenten con oficio de autorización del apoyo del Programa, incluyendo copia de la caratula del estado de cuenta bancario correspondiente, para que en un plazo de diez días hábiles contados a partir de la recepción del citado oficio, efectúe las trasferencias bancarias de los apoyos autorizados.\nk) La persona titular de la Delegación Administrativa, entregará mediante oficio a la persona titular de la Dirección General de Fomento Empresarial, los documentos comprobatorios de las transferencias bancarias realizadas a las y los beneficiarios del Programa, para su integración en los expedientes de las solicitudes de apoyo.\nl) Con la presentación del Reporte de Comprobación, se concluye el proceso del otorgamiento del apoyo del Programa. Sin embargo, podrá ser revisado, verificado o auditado por parte de la\nSEFODECO, la Secretaría de Contraloría y la Auditoría Superior del Estado de Guerrero.\nm) Los requerimientos, dictámenes y resoluciones de las solicitudes de apoyo presentadas, emitidos por la SEFODECO, se notificarán a la persona solicitante en el correo electrónico señalado en el formato de solicitud de apoyo, y\nn) En los requerimientos, las personas solicitantes de apoyo contarán con diez días hábiles, contados a partir del siguiente de la notificación, para cumplir con lo solicitado o subsanar las observaciones correspondientes; de no contestar en el plazo mencionado, se tendrá por desistida la solicitud.\n8.1. Casos Especiales.\nOperación, serán atendidos por el Comité de Evaluación del Programa, que dictará las acciones a seguir y las resoluciones pertinentes.\n8.2. Casos de Emergencia o Desastre.\nEn caso de una declaratoria de emergencia o de desastre, por parte de las instancias competentes, el Comité de Evaluación del Programa analizará la situación y, de afectarse la operación del Programa, deberá emitir el plan de acción que permita dar cumplimiento a sus objetivos, de conformidad con lo establecido en las presentes Reglas de Operación.\n8.3 Suspensión o Cancelación del Programa Social.\nLa SEFODECO podrá suspender o cancelar la operación del Programa, cuando las condiciones sociales y económicas, nos sean favorables para el cumplimiento de los objetivos; en caso de problemas\n8.4. Integración del Padrón de Personas Beneficiarias.\nLas personas que reciban un apoyo del Programa, serán incorporadas por la Dirección General\nFomento Empresarial, al Padrón de Personas Beneficiarias del Programa, conforme a lo establecido en la\nLey Número 207 de Transparencia y Acceso a la Información Pública del Estado de Guerrero y la Ley\nNúmero 466 de Protección de Datos Personales en Posesión de Sujetos Obligados del Estado de Guerrero.\n9. Mecánica Operativa del Programa Social.\n9.1. Instancia Ejecutora y/o Responsable.\nLa instancia ejecutora del Programa será la SEFODECO, a través de la Dirección General de\nFomento Empresarial, emitiendo las Reglas de Operación de acuerdo al marco normativo aplicable.\nCon el objeto de asegurar la aplicación eficiente, eficaz, oportuna, equitativa y transparente de los recursos públicos, la SEFINA, y la SEPLADER, emiten las disposiciones normativas que regulan los programas de inversión sujetos a Reglas de Operación.\nLa SEPLADER, valida y aprueba las Reglas de Operación, mismas que, una vez validadas y aprobadas, serán publicadas en el Periódico Oficial del Gobierno del Estado de Guerrero, previo trámite realizado por la SEFODECO.\nLa SEFINA, efectuará las ministraciones de recursos presupuestales en concordancia con el presupuesto de egresos 2023.\n9.2. Proceso de Incorporación al Programa Social.\nLas personas contempladas en la población objetivo, interesadas en la presentación de solicitud de apoyo del Programa, deberán participar en la convocatoria que para tal efecto emita y publique la oficiales de la SEFODECO: Sefodeco Guerrero (Facebook), @sefodecogro (Twitter); las convocatorias podrán publicarse en dos periódicos de mayor circulación en el estado de Guerrero, en dos días diferentes. publicarán de acuerdo a la disposición presupuestal, conteniendo, entre otros, los siguientes puntos:\n• Objeto;\n• Vigencia de la Convocatoria;\n• Monto presupuestal disponible;\n• Montos de los apoyos;\n• Cobertura;\n• Criterios de Elegibilidad;\n• Requisitos;\n• Criterios de Evaluación, y\n• Contacto de atención.\nLas Reglas de Operación, las convocatorias, la solicitud de apoyo y la información inherente al\nPrograma, estarán a disposición de las personas interesadas en las oficinas de la Dirección General de\nFomento Empresarial, ubicadas en el Recinto de las Oficinas del Poder Ejecutivo del Estado de Guerrero, Edificio Acapulco, Primer Piso, Boulevard Lic. René Juárez Cisneros No. 62, Col. Ciudad de los Servicios, Chilpancingo, Guerrero, en un horario de atención de las 9:00 a las 15:00 horas.\nAdicionalmente, los documentos mencionados estarán disponibles en el Portal Oficial del Gobierno del Estado, www.guerrero.gob.mx y en las redes sociales oficiales de la SEFODECO: Sefodeco Guerrero\n(Facebook) y @sefodecogro (Twitter).\n10. Evaluación.\nLa evaluación del Programa la realizará la SEFODECO por conducto de la Dirección General de\nFomento Empresarial, conforme a los lineamientos que emita al respecto la SEPLADER, el cumplimiento de los indicadores e identificando áreas de oportunidad y alternativas de solución que favorezcan el cumplimiento de los objetivos planteados.\n10.1. Indicadores (Construcción de la Matriz de Indicadores para Resultados –Anexo 1).\nEl gobierno del estado ha adoptado la Metodología de Presupuesto Basado en Resultados (PbR), implementada por el gobierno federal, por lo tanto, el indicador para el seguimiento y la evaluación del\nPrograma, se construyó de acuerdo a la Metodología de Marco Lógico (MML), en este sentido, se adjuntan a las presentes Reglas de Operación la Matriz de indicadores para Resultados (Anexo 1) y la Ficha Técnica de Indicadores (Anexo 2).\n10.2. Seguimiento.\nEl seguimiento del Programa, estará a cargo de la SEFODECO a través de la Dirección General de Fomento Empresarial, generando en el proceso, información que permita un análisis sobre el avance asignados. En el seguimiento se podrá contemplar una visita de verificación considerando una muestra del\n10% de las y los beneficiarios del Programa con el propósito de identificar áreas de mejora que favorezcan una operación eficiente y eficaz del Programa y, en consecuencia, alcanzar los objetivos propuestos.\n10.3. Auditoría.\nPrograma, podrán ser auditados por los entes fiscalizadores como la Secretaría de Contraloría y la\nAuditoría Superior del Estado de Guerrero, conforme a las disposiciones normativas aplicables y en el ámbito de sus respectivas competencias. se plasmen en el informe de auditoría correspondiente.\n11. Mecanismo de Entrega del Apoyo.\nLos apoyos del Programa, se entregarán de manera directa, mediante transferencia bancaria, a las personas de la población objetivo cuya solicitud de apoyo cuente con la autorización del Comité de\nEvaluación del Programa, y se haya emitido el oficio de autorización correspondiente por parte de la persona titular de la SEFODECO.\n12. Derechos y Obligaciones de las Personas Beneficiadas.\nLas personas beneficiarias del Programa, estarán sujetas a los siguientes derechos y obligaciones:\na) Derechos:\n• Recibir el apoyo del Programa y utilizarlo para los fines establecidos en las presentes Reglas de Operación, sin distinción, exclusión o restricción;\n• Recibir asesoría por parte de la SEFODECO, cuando así lo soliciten, para facilitar la correcta aplicación de los recursos recibidos;\n• Recibir un trato digno y respetuoso, por parte de las servidoras y servidores públicos de la\nSEFODECO, y\n• La reserva de su información personal conforme a lo dispuesto en la Ley Número 466 de\nb) Obligaciones:\n• Destinar el apoyo recibido del Programa, para los fines establecidos en las presentes Reglas de Operación y la convocatoria respectiva;\n• Presentar, en tiempo y forma, el reporte de comprobación del Programa en el formato, plazo y medio de presentación que establezca la SEFODECO, y\n• En general, cumplir y observar las disposiciones de las presentes Reglas de Operación, la convocatoria correspondiente y las disposiciones jurídicas aplicables.\n12.1. Causales de Suspensión o Baja de las Personas Beneficiadas.\nLa suspensión o baja de una beneficiaria o beneficiario del Programa, estará determinada por las siguientes causas:\n• Cuando de manera voluntaria la persona beneficiaria lo solicite mediante escrito dirigido a la persona titular de la SEFODECO;\n• Cuando la persona beneficiaria no presente en tiempo y forma el reporte de comprobación del\nPrograma o incumpla lo dispuesto en las presentes Reglas de Operación, la convocatoria correspondiente o las disposiciones jurídicas aplicables.\n12.2. Proceso de Baja.\nEl procedimiento de baja de la persona beneficiaria del Programa, es el siguiente:\na) Cuando la baja del Programa, sea solicitado por la persona beneficiaria, la SEFODECO, mediante oficio firmado por la persona titular de la dependencia, dará respuesta de aceptación de la baja en un término de diez días hábiles, contados a partir del día siguiente de la recepción de la solicitud, indicando los datos bancarios para el reintegro de los recursos públicos otorgados como apoyo.\nb) Cuando la baja del Programa, tenga como causa el incumplimiento, en tiempo y forma, del reporte de comprobación o cualquier incumplimiento a lo establecido en las presentes Reglas de\nOperación, la convocatoria o las disposiciones jurídicas aplicables, la SEFODECO requerirá a la persona beneficiaria la subsanación de las observaciones correspondientes, conforme al siguiente procedimiento:\n• Mediante oficio firmado por la persona titular de la SEFODECO, se notificará a la persona beneficiaria las observaciones o incumplimientos, estableciendo un plazo de diez días hábiles, contados a partir del día siguiente de la notificación del oficio de referencia, para que la persona beneficiaria manifieste lo que a su derecho convenga.\n• Si el requerimiento no es atendido en el plazo establecido o la documentación presentada no subsana las observaciones notificadas, se someterá a consideración del Comité de Evaluación del\nPrograma, la cancelación del apoyo otorgado del Programa y, en consecuencia, solicitar a la persona beneficiaria el reintegro a favor de la SEFODECO de los recursos públicos otorgados.\n• Las personas beneficiarias cuyo apoyo del Programa, le sea cancelado, no podrán ser presente administración gubernamental.\n13. Instancias Participantes.\nEn el Programa, participan las instancias siguientes:\n• La SEPLADER, con la validación y aprobación de las Reglas de Operación;\n• La SEFINA, con la ministración de recursos presupuestales para la operación del Programa;\n• La SEFODECO, es la instancia ejecutora del Programa, a través de la Dirección General de\nFomento Empresarial, y\n• La Secretaría de Contraloría y la Auditoría Superior del Estado de Guerrero, son entes que pueden realizar la fiscalización del Programa.\n13.1. Instancia Normativa.\nLa SEFODECO, es la instancia normativa del Programa, en consecuencia, le corresponde la ejecución de las presentes Reglas de Operación y la publicación de las convocatorias y, en general, la aplicación del marco normativo correspondiente a sus facultades y atribuciones.\n14. Transparencia.\n14.1. Promoción y Difusión del Programa Social.\nLas Reglas de Operación del Programa, se publicarán en el Periódico Oficial del Gobierno del\nEstado de Guerrero y estarán disponibles para su consulta en las oficinas de la SEFODECO, ubicadas en el Recinto de la Oficinas del Poder Ejecutivo del Estado de Guerrero, Edificio Acapulco, Primer Piso, Boulevard Lic. René Juárez Cisneros, Col. Ciudad de los Servicios, en Chilpancingo, Guerrero, en un horario de atención de las 9:00 a las 15:00 horas, así como en el Portal Oficial del Gobierno del Estado, www.guerrero.gob.mx y en las redes sociales oficiales de la SEFODECO: Sefodeco Guerrero (Facebook) y @sefodecogro (Twitter).\n14.2. Contraloría Social.\nEl fundamento legal del Programa, parte del artículo 32 de la Ley Orgánica de la Administración\nPública del Estado de Guerrero Número 242, que establece que a la SEFODECO le corresponde, entre otros temas, planear, regular, promover y fomentar el desarrollo económico del estado de Guerrero, en este sentido, no son aplicables las disposiciones normativas de la Contraloría Social, cuyo fundamento se encuentra en la Ley General de Desarrollo Social.\nSin embargo, el ejercicio de los recursos públicos y la operación del Programa, están sustentados en la transparencia y la rendición de cuentas, en estricto apego al marco normativo aplicable y sujeto a la supervisión, mediante auditorías, de entes fiscalizadores como la Secretaría de Contraloría y la Auditoría\nSuperior del Estado de Guerrero.\nAsimismo, la información del Programa, se encuentra disponible para la ciudadanía, conforme a lo dispuesto en la Ley Número 466 de Protección de Datos Personales en Posesión de Sujetos Obligados\nEstado de Guerrero.\n14.3. Protección de Datos Personales.\nLo(sic) protección de los datos personales de las personas beneficiarias del Programa y la información de las solicitudes de apoyo, se regirán por lo establecido en la Ley Número 466 de Protección de Datos Personales en Posesión de Sujetos Obligados del Estado de Guerrero y la Ley Número 207 de\nTransparencia y Acceso a la Información Pública del Estado de Guerrero.\n14.4. Quejas y Denuncias.\nLa ciudadanía y las personas beneficiarias del Programa, podrán presentar ante la SEFODECO, quejas y denuncias, sobre hechos, actos u omisiones, que afecten sus derechos o el incumplimiento a lo dispuesto en las presentes Reglas de Operación; a través de los siguientes medios de presentación:\n• Presencial: en el domicilio de las oficinas de la SEFODECO, ubicadas en el Recinto de la\nOficinas del Poder Ejecutivo del Estado de Guerrero, Edificio Acapulco, Primer Piso, Boulevard Lic. René\nJuárez Cisneros No. 62, Col. Ciudad de los Servicios, en Chilpancingo, Guerrero, en un horario de atención de las 9:00 a las 15:00 horas.\n• En el Buzón Transparente, instalado en el domicilio de las oficinas de la SEFODECO, señalado en el párrafo anterior.\n• Correo electrónico: sefodeco@guerrero.gob.mx.\n• Telefónica: en el número telefónico 747471928, Extensión 6976.\nPara dar respuesta a las quejas y denuncias, la SEFODECO dispondrá de un plazo de diez días hábiles contados a partir del día siguiente de su fecha de presentación.\nLa ciudadanía y las personas beneficiarias del Programa, también podrán presentar sus quejas y denuncias ante la Secretaría de Contraloría, a través de los medios siguientes:\n• Presencial: en el domicilio de las oficinas de la Secretaría de Contraloría, ubicadas en el Recinto\nJuárez Cisneros No. 62, Col. Ciudad de los Servicios, en Chilpancingo, Gro., en un horario de atención de las 9:00 a las 16:00 horas.\n• Telefónico: en el número telefónico 747471974.\nEn la denuncia o queja la ciudadanía o las personas beneficiarias del Programa, deberán proporcionar los datos siguientes:\n• Nombre de la servidora o servidor público;\n• Secretaría o dependencia de adscripción;\n• Objeto de la denuncia o queja;\n• Nombre y domicilio de la persona quejosa (opcional, para salvaguardar el anonimato y la confidencialidad de las personas denunciantes), e\n• Identificación oficial (opcional, para salvaguardar el anonimato y la confidencialidad de las personas denunciantes).\n14.5. Acciones de Blindaje.\nEn la operación y el ejercicio de los recursos presupuestales aprobados para el Programa, se aplicarán los lineamientos normativos que emitan la Secretaría de Contraloría, el Instituto de Transparencia, Acceso a la Información y Protección de Datos Personales del Estado de Guerrero (ITAIGro), el Instituto\nElectoral y de Participación Ciudadana del Estado de Guerrero (IEPC) y demás instancias federales y estatales competentes, con la finalidad de impedir que los apoyos sean utilizados con fines político electorales.\nComo estrategia de blindaje electoral, la papelería, documentación oficial, así como la publicidad y promoción del Programa, deberán incluir la leyenda siguiente:\n“Este Programa es de carácter público, no es patrocinado ni promovido por partido político alguno y sus recursos provienen de los impuestos que pagan todos los contribuyentes. Está prohibido el uso de este Programa con fines políticos, electorales, de lucro y otros distintos a los establecidos. Quien haga uso indebido de los recursos de este Programa deberá ser denunciado y sancionado de acuerdo con la ley aplicable y ante la autoridad competente”.\nEn cuanto a la publicidad en medios electrónicos, impresos, complementarios o de cualquier otra índole, vinculados con los programas de comunicación social, se deberá incluir la siguiente leyenda:\n“Este Programa es público y queda prohibido su uso con fines partidistas o de promoción personal”.\n14.6. Acta de Donación.\nEl Programa no contempla la figura de donación en el otorgamiento de los apoyos, en consecuencia, no aplica el presente punto de los Lineamientos para la Elaboración de las Reglas de\nOperación de los Programas Sociales Estatales para el Periodo 2022-2027, publicados en el Periódico de apoyo del Programa (Anexo 4) y el reporte de comprobación del Programa, en el formato, plazo y medio de presentación que establezca la SEFODECO.\n15. Perspectiva de Género.\nEl Programa, contribuye al fortalecimiento de la perspectiva de género, al fomentar el emprendimiento de mujeres y hombres, mediante la apertura de microempresas que se sostengan y consoliden en el tiempo para su incorporación a la economía formal, favoreciendo el derecho humano al trabajo y la igualdad de género, al promover la generación de empleos en condiciones de igualdad de oportunidades. En consecuencia, se promoverá que los apoyos programados se otorguen en igual número para mujeres y hombres.\n16. Enfoque de Derechos.\nCon el propósito de generar las condiciones de acceso equitativo de mujeres y hombres a los apoyos del Programa, las presentes Reglas de Operación y la convocatoria respectiva, estarán disponibles de las oficinas de la SEFODECO, ubicadas en el Recinto de la Oficinas del Poder Ejecutivo del Estado de\nGuerrero, Edificio Acapulco, Primer Piso, Boulevard Lic. René Juárez Cisneros No. 62, Col. Ciudad de los\nServicios, en Chilpancingo, Guerrero, en un horario de atención de las 9:00 a las 16:00 horas y se publicarán en el Portal Oficial del Gobierno del estado, www.guerrero.gob.mx, y en las redes sociales oficiales de la SEFODECO: Sefodeco Guerrero (Facebook), @sefodecogro (Twitter).\nEl Programa está diseñado para favorecer los derechos humanos, al trabajo y a la igualdad de oportunidades entre hombres y mujeres, promoviendo al acceso equitativo a los apoyos del Programa, así como contribuir al empoderamiento económico de las mujeres, en términos de lo dispuesto en el artículo 5 fracción X, de la Ley General de Acceso de las Mujeres a una Vida Libre de Violencia.\n17. Acciones Contra el SARS-COV 2.\nLa operación del Programa, se realizará con estricto cumplimiento de las disposiciones que emitan las autoridades sanitarias de los tres órdenes de gobierno, para el control y prevención del SARS-COV 2.\n18. Anexos.\nAnexo 1. Matriz de indicadores para Resultados.\nAnexo 2. Ficha Técnica de Indicadores de Desempeño.\nAnexo 3. Formato de Solicitud de Apoyo del Programa.\nAnexo 4. Formato de Recibo de Apoyo del Programa.\nFormato 4. MIR\nEje: II Desarrollo Económico Sostenible\nObjetivo: 2.34 Aplicar una política de apoyó incluyente a emprendedores y Micro, Pequeñas y Medianas Empresas (MIPYMES)\n_____ 2.34.1 Promover programas que incluyan capacitación y el otorgamiento de apoyos para emprendedores y Micro, Estrategia:\n_____ pequeñas y Medianas Empresas (MlPYMES).\n2.34.1.2. Gestionar fuentes de financiamiento de los tres niveles de gobierno y el sector privado, para el financiamiento\nLínea de Acción: de los proyectos de emprendedores y Micro, Pequeñas y Medianas Empresas (MIPYMES).\nMatriz de Indicadores para Resultados\nResumen Narrativo Indicadores de desempeño Medios de Verificación Supuestos\nContribuir al\nPorcentaje de Informe anual de apoyos emprendimiento de mujeres emprendimientos apoyados económicos otorgados, Las mujeres y los hombres y hombres apoyando sus\nFin (Emprendimientos elaborado por la Dirección aceptan el apoyo económico iniciativas de negocio apoyados/Emprendimientos General de Fomento otorgado mediante la apertura de programados) * 100 Empresarial microempresas\nPorcentaje de\nLas mujeres y los hombres emprendedores Informe anual de apoyos\nLas mujeres y los hombres son apoyados para apoyados/Apoyos económicos otorgados, aceptan emprender un\nPropósito (resultados) emprender iniciativas de otorgados a elaborado por la Dirección negocio aperturando negocio con la apertura de emprendedores/Apoyos General de Fomento microempresas una microempresa programados para Empresarial emprendedores) * 100\nPorcentaje de apoyos\nReporte trimestral de apoyos\nApoyos económicos económicos otorgados Los beneficiarios aplican el económicos otorgados, Componentes (Servicios otorgados para emprender (Apoyos económicos apoyo para emprender un elaborado por la Dirección y Productos) un negocio aperturando otorgados/Apoyos negocio mediante la apertura\nGeneral de Fomento microempresas económicos programados) * de microempresas\nEmpresarial\n100\nPorcentaje de solicitudes de apoyo económico Reporte trimestral de dictaminadas (Solicitudes solicitudes dictaminadas, Las mujeres y los hombres\nSolicitudes de apoyo\nActividades (Procesos) de apoyo económico elaborado por la Dirección presentan solitudes de económico dictaminadas dictaminadas/solicitudes de General de Fomento apoyos apoyo económico recibidas) Empresarial\n¨100\nAnexo 2. Ficha Técnica de Indicadores de Desempeño.\nFicha Técnica\nIndicadores del Desempeño\nPlan Estatal de Desarrollo 2022-2027\nFONDO: Inversión Estatal Directa (IED)\nNOMBRE DEL PROGRAMA. Programa Emprende y Transforma Guerrero\n1 EJE TEMATICO: II Desarrollo Económico Sostenible.\nOBJETIVO: 2.34 Aplicar una política de apoyo incluyente a emprendedores y Micro. Pequeñas y Medianas Empresas (MIPYMES)\nESTRATEGIA 2 34.1 Promover programas que incluyan capacitación y el otorgamiento de apoyos para emprendedores y Micro. Pequeñas y\nMedianas Empresas (MIPYMES).\nLINEA DE ACCION: 2.34.1.2 Gestionar fuentes de financiamiento de los tres niveles de gobierno y el sector privado, para el financiamiento de proyectos de emprendedores y Micro. Pequeñas y Medianas Empresa (MIPYMES)\nDatos de identificación del Indicador\nClave Nombre Fuente\nDirección General del Fomento\n2 1.1.2 Porcentaje de emprendedores apoyados\nEmpresarial\nDefinición Nivel en la MIR Dimensión\nMide el porcentaje de emprendedores apoyados Propósito Eficacia\nMétodo de cálculo Unidad de Medida.\n(Apoyos otorgados a emprendedores/Apoyos programados para emprendedores) * 100 Porcentaje\nFrecuencia de medición Desagregación geográfica Serie de información disponible\nAnual Cobertura Estatal Programa Nuevo\nLínea base\nSentido del indicador\nAño Periodo Valor\nAscendente No aplica No aplica 0%\nParámetros de semaforización Metas\nVerde Amarillo Rojo Año Periodo Valor\nDel 01 de enero al 31 de diciembre. 100%\n95% a 100% 94% a 9º% Menor a 89% 2023\nVariables que conforman el indicador\nNombre Unidad de medida Fuente de información\nReporte Anual elaborado por la\nApoyos otorgados a emprendedores Otorgados Dirección General de Fomento\nEmpresarial\nReporte Anual elaborado por la\nApoyos programados para emprendedores Programados Dirección General de Fomento\nEmpresarial\nObservaciones\nResponsable del indicador\nNombre del Servidor Público Dependencia Área\nSecretaria de Fomento y Dirección General De Fomento\nLic. Víctor Juan Hernández López\nDesarrollo Económico Empresarial\nNombre del puesto, encargo o comisión Teléfono Correo electrónico\nDirector General de Fomento Empresarial 747-4719700 Ext. 6723»\nElaboró Revisó Autorizó\nLic. Víctor Juan Hernández López Lic. Víctor Juan Hernández López Mira Teodora Ramírez Vega\nDirección General do Evaluación\nAnexo 3. Formato de Solicitud de Apoyo del Programa.\nAnexo 4 Formato de Recibo de Apoyo del Programa.\nDirección General de Fomento Empresarial\n(Lugar), Gro., a (Día) de (Mes) de 2023.\nRecibo por $ 10,000.00 la cantidad de $ 10,000.00 (Diez mil pesos 00/100 M. N.) mediante transferencia a la cuenta bancaria con clabe _____________________, como apoyo gubernamental del Programa Emprende y Transforma\nGuerrero, recurso que me comprometo a utilizar para la apertura de una microempresa que se sostenga y consolide en el tiempo para su incorporación a la economía formal.\nC.U.R.P. ___________________\nNombre y firma del beneficiario:\n__________________________________________\nPrimero. El presente Acuerdo entrará en vigor al día siguiente de su publicación en el Periódico\nSegundo. A partir de la entrada en vigor del presente Acuerdo, las Reglas de Operación del\nPrograma Emprende y Transforma Guerrero, subsecuentes o sus modificaciones serán emitidas por la persona titular de la Secretaría de Fomento y Desarrollo Económico, responsable directa de la operación y ejecución de estas.\nDado en el “Recinto de las Oficinas del Poder Ejecutivo del Estado” ubicado en el Interior, Edificio\nNorte Planta Baja, Boulevard René Juárez Cisneros No. 62, colonia Ciudad de los Servicios, en\nChilpancingo de los Bravo, Capital del Estado de Guerrero, a los dieciséis días del mes de marzo del año dos mil veintitrés.\nGOBERNADORA CONSTITUCIONAL DEL ESTADO DE GUERRERO.\nMTRA. EVELYN CECIA SALGADO PINEDA.\nRúbrica.\nSECRETARIO GENERAL DE GOBIERNO.\nMTRO. LUDWIG MARCIAL REYNOSO NÚÑEZ.\nRúbrica.\nSECRETARIA DE FOMENTO Y DESARROLLO ECONOMICO.\nMTRA. TEODORA RAMÍREZ VEGA.\nRúbrica.",
  "ordenamiento": "PROGRAMA",
  "jurisdiccion": "GUERRERO",
  "fuente_oficial": "DIARIO OFICIAL DE LA FEDERACION",
  "Fecha de Publicación": "30 DE ABRIL DE 2024",
  "ULTIMA REFORMA PUBLICADA": null,
  "status": "VIGENTE",
  "es_escaneado": false,
  "tiene_tablas": true,
  "materia": [
    "económico"
  ]
}