{
  "titulo": "Acuerdo por el Que Se Crea el Programa para el Fortalecimiento de la Producción y Comercialización D",
  "Contenido": "EMITEN SUS REGLAS DE OPERACIÓN PARA EL\nEJERCICIO FISCAL 2022\nALCANCE I, EL VIERNES 14 DE ABRIL DE 2023\nTEXTO ORIGINAL.\nAcuerdo publicado en el Periódico Oficial del Gobierno del Estado No. 68 Alcance I, el Viernes 26 de Agosto de 2022.\nACUERDO POR EL QUE SE CREA EL PROGRAMA PARA EL FORTALECIMIENTO DE LA\nPRODUCCIÓN Y COMERCIALIZACIÓN DE LAS ARTESANÍAS Y SE EMITEN SUS REGLAS DE\nOPERACIÓN PARA EL EJERCICIO FISCAL 2022.\nGuerrero.- Poder Ejecutivo.\nMAESTRA EVELYN CECIA SALGADO PINEDA, GOBERNADORA CONSTITUCIONAL DEL\nESTADO DE GUERRERO, CON FUNDAMENTO EN LO DISPUESTO POR LOS ARTÍCULOS 71, 87, 88,\nLOS ARTÍCULOS 2, 3, 6, 7, 10, 11, 18 APARTADO A FRACCIONES I Y X, 20 FRACCIÓN III Y 29 DE\nLA LEY ORGÁNICA DE LA ADMINISTRACIÓN PÚBLICA DEL ESTADO DE GUERRERO NÚMERO 08;\n1, 2 FRACCIÓN I, 18 Y 25 DE LA LEY NÚMERO 454 DE PRESUPUESTO Y DISCIPLINA FISCAL DEL\nESTADO DE GUERRERO; 33, 34 Y 35 FRACCIONES I Y II DE LA LEY DE FOMENTO ECONÓMICO,\nINVERSIÓN Y DESARROLLO DEL ESTADO DE GUERRERO NÚMERO 487; EN RELACIÓN CON EL\nARTÍCULO 57 ANEXOS 21 (E10) Y 21-A (E10) DEL DECRETO NÚMERO 160 DEL PRESUPUESTO DE\nEGRESOS DEL ESTADO DE GUERRERO PARA EL EJERCICIO FISCAL 2022 Y LOS LINEAMIENTOS\nPARA LA ELABORACIÓN DE LAS REGLAS DE OPERACIÓN DE LOS PROGRAMAS SOCIALES\nESTATALES PARA EL PERIODO 2022-2027.\nQue el Plan Nacional de Desarrollo 2019-2024, establece como principio rector la economía para el bienestar, que busca centrar el objetivo de la política económica en el mejoramiento del nivel de vida de la población. Por lo tanto, este documento rector del desarrollo económico y social de nuestro país, Producción y Comercialización de las Artesanías.\nQue el Plan Estatal de Desarrollo 2022-2027, en el Eje 2 Desarrollo Económico Sostenible, emprendedores.\nEMITEN SUS REGLAS DE OPERACIÓN PARA EL\nEJERCICIO FISCAL 2022\nGuerrero, establece que el estado de Guerrero atenderá de manera programática y planificada los derechos económicos, sociales, culturales y ambientales para hacer realidad el progreso y el bienestar de sus habitantes; al efecto, expedirá programas de gobierno y políticas públicas que se requieran.\nQue, en este sentido, resulta de particular importancia atender sectores estratégicos como el comercio, la industria, artesanía y los servicios que operan en nuestra entidad, y es menester hacerlo de manera transparente y ordenada, con estricto apego a la normatividad en materia de ejercicio de gasto público.\nLos recursos aprobados en el Presupuesto de Egresos 2022, para el financiamiento del Programa para el Fortalecimiento de la Producción y Comercialización de las Artesanías, se incluyen en el Fondo de\nInversión Estatal Directa (IED), mismos que, para su aplicación, estarán sujetos a la suficiencia presupuestal disponible.\nQue en el artículo 57 del Decreto Número 160 del Presupuesto de Egresos del Estado de Guerrero para el Ejercicio Fiscal 2022, establece que con el objetivo de asegurar la aplicación eficiente, eficaz, oportuna, equitativa, y transparente de los recursos públicos, la Secretaría de Finanzas y Administración y la Secretaría de Planeación y Desarrollo Regional emitirán las disposiciones a que deberán sujetarse los programas de inversión sujetos a Reglas de Operación.\nQue la Secretaría de Planeación y Desarrollo Regional expidió los Lineamientos para la\nElaboración de las Reglas de Operación de los Programas Sociales Estatales para el Periodo 2022 – 2027 publicados en el Periódico Oficial del Gobierno del Estado número 14 de fecha 18 de febrero de 2022, los cuales tienen la finalidad de ser un instrumento técnico que guie la elaboración de los apartados centrales de las Reglas de Operación, así como los elementos para integrar su contenido.\nQue, por consiguiente, las personas titulares de las secretarías y/o entidades paraestatales de la administración pública, así como las servidoras y servidores públicos autorizados para ejercer recursos públicos del presupuesto de inversión de los mismos, serán responsables de los programas y/o proyectos de inversión que realicen, los apoyos otorgados deberán sujetarse a los criterios de objetividad, equidad, transparencia, publicidad, selectividad y temporalidad.\nQue la Secretaría de Fomento y Desarrollo Económico, entre sus atribuciones tiene la de planear y coordinar las actividades económicas y de inversión, estableciendo y fomentando la ejecución de programas, proyectos y acciones que demanden el interés general, procurando en todo momento la preservación del medio ambiente.\nContribuir a mejorar la productividad de las artesanas y los artesanos del estado, a través de apoyos, teniendo como fin el realizar acciones encaminadas a procurar un mayor ingreso; a conservar el sentido artístico de las artesanías guerrerenses; proporcionando a los mismos, asistencia técnica, administrativa y apoyo económico, así como la promoción y comercialización de sus productos artesanales.\nEMITEN SUS REGLAS DE OPERACIÓN PARA EL\nEJERCICIO FISCAL 2022\nPor lo anteriormente expuesto, he tenido a bien expedir el siguiente:\nOPERACIÓN PARA EL EJERCICIO FISCAL 2022.\nArtículo 1. Se crea el Programa para el Fortalecimiento de la Producción y Comercialización de las Artesanías, el cual tiene por objeto fomentar y aplicar políticas de apoyo al sector artesanal, orientando y organizando a las artesanas y artesanos, implementando nuevas formas de producir y de comercializar sus productos en el mercado nacional e internacional.\nArtículo 2. La Secretaría de Fomento y Desarrollo Económico, tendrá a cargo la implementación, operación, ejecución, evaluación y administración del Programa para el Fortalecimiento de la Producción y\nComercialización de las Artesanías, bajo los criterios de objetividad, equidad, transparencia, publicidad, selectividad y temporalidad, con estricto apego a la normatividad aplicable, por lo tanto, será la encargada de la dispersión y asignación de los recursos del Programa, apegándose plenamente a las Reglas de\nOperación.\nArtículo 3. Se emiten las Reglas de Operación del Programa para el Fortalecimiento de la\nProducción y Comercialización de las Artesanías para el Ejercicio Fiscal 2022 que establece los principios de eficiencia, eficacia, oportunidad, equitativa y transparencia de los recursos públicos y requisitos que se deben de cumplir para poder acceder a dicho Programa; en los términos siguientes:\nREGLAS DE OPERACIÓN DEL PROGRAMA PARA EL FORTALECIMIENTO DE LA\nPRODUCCIÓN Y COMERCIALIZACIÓN DE LAS ARTESANÍAS PARA EL EJERCICIO FISCAL 2022.\n1. Introducción.\n1.1. Antecedentes.\nEl estado de Guerrero cuenta con más de 30 mil artesanas y artesanos que producen obras de orfebrería, lacas, palma, textiles, pirograbados, pintura en papel amate y barro, máscaras de madera, talabartería, muebles esculturales, utensilios de madera y alfarería, hamacas, productos elaborados a base de hoja de maíz, bisutería y mármol, etc.\nSin embargo, las artesanías no tienen una identidad propia marcada y reconocible, tampoco cuenta con diseños que incorporen criterios de mejora. Los canales de comercialización son limitados, siendo ineludible prestarle en la entidad mayor apoyo a este sector.\nPara atender la problemática anterior, es importante promover un programa estatal artesanal para implementar figuras sobre marcas colectivas, asociaciones y cooperativas, fuentes de financiamiento y promoción en el mercado nacional e internacional.\nEMITEN SUS REGLAS DE OPERACIÓN PARA EL\nEJERCICIO FISCAL 2022\nEn ese sentido el Programa, se crea en la administración estatal 2022-2027, con el propósito de dar cumplimiento al compromiso que asumió la Mtra. Evelyn Cecia Salgado Pineda, Gobernadora\nConstitucional del Estado de Guerrero, relativo a impulsar el “Fortalecimiento de la Producción y\nComercialización de las Artesanías”, mediante la creación de obras de orfebrería, lacas, palma, textiles, pirograbados, pintura en papel amate y barro, máscaras de madera, talabartería, muebles esculturales, utensilios de madera y alfarería, hamacas, productos elaborados a base de hoja de maíz, bisutería y mármol, etc., que contribuyan a mejorar el bienestar de estos segmentos de población.\n2. Alineación Programática al PED y/o PND.\nEl Programa, se encuentra establecido en el punto del Eje III. “Detonar el crecimiento” e “Impulsar la reactivación económica, el mercado interno y el empleo” y responde al principio rector “No dejar a nadie atrás, no dejar a nadie fuera”, a través de acciones para que la artesanía sea una de las manifestaciones más visibles de la diversidad cultural de una sociedad, ya que en ella se reflejan tradición, identidad, creatividad y cultura. Por todo esto, es urgente contribuir al reconocimiento de la importancia de las artesanías como un valor que debe ser conservado, enriquecido y proyectado hacia el futuro.\nAsí mismo, contribuye e impulsa la vía enmarcada en el punto del Eje II. “Construir un país con bienestar” y “Cultura para la paz, para el bienestar para todos” y responde al principio rector “No dejar a nadie atrás, no dejar a nadie fuera”, a través de acciones para que la artesanía sea una de las manifestaciones más visibles de la diversidad cultural de una sociedad, ya que en ella se reflejan tradición, identidad, creatividad y cultura. Por todo esto, es urgente contribuir al reconocimiento de la importancia de las artesanías como un valor que debe ser conservado, enriquecido y proyectado hacia el futuro.\n2.1. Diagnóstico.\nLas artesanías, son un producto que suelen venderse siempre en el mercado informal, debido a ello, no existe ninguna clase de protección jurídica que evite su plagio y reproducción indebida. Los bordados de los telares de cintura son un clásico ejemplo de esta problemática. Se han suscitado casos en los cuales, los extranjeros ocupan sus diseños y se apropian de ellos. Para atender lo anterior, es importante promover un programa estatal específico del sector artesanal que implemente figuras como marcas colectivas, esquemas de asociaciones y cooperativas, fuentes de financiamiento y promoción en el mercado nacional e internacional de las artesanías guerrerenses.\nOtro problema que enfrentan es la falta de valor agregado en su producción. Caso concreto los sombreros de la Montaña y Tlapehuala, que están subvaluados por la falta del último proceso de su elaboración, que es el planchado, impidiendo comercializarlos a mejores precios y volúmenes, por lo que, es necesario que tengan una marca colectiva, etiqueta y un código de barras; siendo prioritario que la producción artesanal alcance las denominaciones de origen de Guerrero; un caso emblemático, lo representan las Cajitas de Olinalá, por la calidad de su elaboración y presentación, así mismo en este tenor, podemos encontrar variedad de artesanías, entre ellos huipiles que también han sido copiados por grandes empresas internacionales robándose sus diseños y creatividad.\nEMITEN SUS REGLAS DE OPERACIÓN PARA EL\nEJERCICIO FISCAL 2022\nAhora bien, datos del Censo Económico 2019 de INEGI, refieren que en Guerrero se contaba con más de 32 mil artesanas y artesanos que producen obras de orfebrería, lacas, palma, textiles, pirograbados, pintura en papel amate y barro, máscaras de madera, talabartería, muebles esculturales, utensilios de madera y alfarería, hamacas, productos elaborados a base de hoja de maíz, bisutería, mármol, etc.\nPor otra parte, la información estadística indica también que, es necesario implementar acciones gubernamentales que contribuyan a mejorar la productividad de las artesanas y de los artesanos del país, teniendo como fin el realizar acciones encaminadas a procurar un mayor ingreso; a conservar el sentido artístico de las artesanías guerrerenses; así como la comercialización de los productos artesanales.\n2.1.1. Población Potencial.\nLa población potencial del Programa, de acuerdo con la Encuesta Nacional de Ocupación y\nEmpleo (ENOE) del Instituto Nacional de Estadística y Geografía (INEGI), se estima en más de 32 mil artesanos guerrerenses, que son mujeres y hombres mayores de edad que realizan una actividad artesanal.\n2.1.2. Población Objetivo.\nMujeres y hombres mayores de edad que se dedican a la elaboración y/o producción de artesanías, con domicilio en el estado de Guerrero.\n2.1.3. Población Beneficiaria.\nMujeres y hombres que sean mayores de dieciocho años, se dedican a la elaboración y/o producción de artesanías, que presentaron solicitud de apoyo y fueron atendidas con el otorgamiento de apoyos del Programa.\n2.1.4. Población Indígena.\nEl Programa tiene una cobertura estatal, en consecuencia, podrán participar todas las personas de población mayoritariamente indígena, zonas o municipios con muy alta marginación o municipios indígenas.\n2.2. Fundamento Legal.\na) Constitución Política de los Estados Unidos Mexicanos.\nc) Ley de Coordinación Fiscal.\nEMITEN SUS REGLAS DE OPERACIÓN PARA EL\nEJERCICIO FISCAL 2022\nd) Ley Orgánica de la Administración Pública del Estado de Guerrero Número 08.\nGuerrero.\nf) Ley de Fomento Económico, Inversión y Desarrollo del Estado de Guerrero Número 487.\ng). Ley Número 454 de Presupuesto y Disciplina Fiscal del Estado de Guerrero.\nh) Ley Número 466 de Protección de Datos Personales en Posesión de Sujetos Obligados del\nEstado de Guerrero.\nj) Decreto Número 160 del Presupuesto de Egresos del Estado de Guerrero para el Ejercicio\nFiscal 2022.\nk) Lineamientos para la elaboración de las Reglas de Operación de los Programas Sociales\nEstatales para el periodo 2022-2027.\nl) Reglamento Interior de la Secretaría de Fomento y Desarrollo Económico.\nm) Plan Nacional de Desarrollo 2019-2024. ñ) Y demás ordenamientos jurídicos aplicables.\n2.3 Definiciones y Siglas.\nPara efectos de estas Reglas de Operación se entenderá por:\nDefiniciones:\nApoyos: Asignación de recursos económicos que, bajo la figura de subsidio o en especie, otorga las Artesanías.\nArtesanía: Producto de identidad cultural comunitaria, hecho por procesos manuales continuos, generalmente nativa. El dominio de las técnicas tradicionales de patrimonio comunitario permite a la artesana o artesano crear diferentes objetos de variada calidad y maestría, imprimiéndoles valores simbólicos e ideológicos de la cultura local.\nEMITEN SUS REGLAS DE OPERACIÓN PARA EL\nEJERCICIO FISCAL 2022\nArtesana (o): Persona cuyas habilidades naturales o dominio técnico de un oficio, con capacidades innatas o aprendidas, con conocimientos prácticos o teóricos, elabora bienes u objetos de artesanía, se entenderá que son las(los) artesanas(os) guerrerenses.\nBeneficiarias o Beneficiarios: Personas contempladas en la Población Beneficiaria.\nComité de Evaluación: Comité de Evaluación Programa para el Fortalecimiento de la Producción y Comercialización de las Artesanías.\nDirección General: Dirección General de Promoción Comercial, Abasto y Artesanías.\nPoblación Beneficiaria: Personas de la Población Objetivo, atendidas con el otorgamiento de\nApoyos del Programa para el Fortalecimiento de la Producción y Comercialización de las Artesanías.\nPoblación Objetivo: La Población Potencial interesada en participar en el Programa para el\nFortalecimiento de la Producción y Comercialización de las Artesanías.\nPresupuesto de Egresos 2022: Decreto Número 160 del Presupuesto de Egresos del Estado de\nGuerrero para el Ejercicio Fiscal 2022.\nPrograma: Programa de Fortalecimiento de la Producción y Comercialización de las Artesanías.\nReglas de Operación: Reglas de Operación del Programa de Fortalecimiento de la Producción y\nComercialización de las Artesanías para el Ejercicio Fiscal 2022.\nSolicitud de Apoyo: Formato de Solicitud de Apoyo del Programa para el Fortalecimiento de la\nProducción y Comercialización de las Artesanías, Anexo 1, de las presentes Reglas de Operación\nSiglas:\nCURP: Clave Única de Registro de Población.\nFONART: Fondo Nacional para el Fomento de las Artesanías.\nINEGI: Instituto Nacional de Estadística y Geografía.\nSEFODECO: Secretaría de Fomento y Desarrollo Económico.\n3. Objetivos y Alcances.\nEMITEN SUS REGLAS DE OPERACIÓN PARA EL\nEJERCICIO FISCAL 2022\n3.1. Objetivo General.\nContribuir a mejorar la productividad de las artesanas y los artesanos del estado, a través de apoyos, teniendo como fin el realizar acciones encaminadas a procurar un mayor ingreso; a conservar el sentido artístico de las artesanías guerrerenses; proporcionando a los mismos, asistencia técnica, administrativa y apoyo económico, así como la promoción y comercialización de sus productos artesanales.\n3.2. Objetivo Específico.\nOtorgar apoyos económicos o en especie a beneficiarias y beneficiarios del Programa, que sean utilizados para la creación formal o formalización de una microempresa artesanal, capacitación, equipamiento o infraestructura, participación en concursos y ferias locales, nacionales e internacionales para propiciar su comercialización.\n3.3. Cobertura.\nEl Programa, tendrá una cobertura estatal, por lo tanto, podrán participar las personas contempladas en la población objetivo, con domicilio fiscal en el estado de Guerrero.\n3.4. Alcances.\nEl Programa, contempla el otorgamiento de apoyos que pueden ser en especies o económicos a las personas que forman parte de la población objetivo, para incentivar la comercialización y producción de las artesanías guerrerenses.\n4. Metas Físicas.\nEl Programa pretende beneficiar a 725 artesanas y artesanos de la entidad, que cumplan con lo dispuesto en las presentes Reglas de Operación.\n5. Programación Presupuestal.\nEl monto aprobado para la implementación del Programa, asciende a $2,600,000.00 (Dos millones seiscientos mil pesos 00/100 M.N.), de conformidad con lo dispuesto en el Presupuesto de Egresos 2022; los recursos provienen del Fondo de Financiamiento de Inversión Estatal Directa (IED) y estarán sujetos a la suficiencia presupuestal disponible.\n$2,600,000.00 $2,600,000.00 agosto\n5.1. Gastos de Operación.\nEMITEN SUS REGLAS DE OPERACIÓN PARA EL\nEJERCICIO FISCAL 2022\n3% de los recursos aprobados en el Presupuesto de Egresos 2022, y se destinará a diversas acciones asociadas con la planeación, promoción, difusión, operación, supervisión, verificación, contraloría social, evaluación y la publicación de las convocatorias del Programa.\nLo anterior, de conformidad con los Lineamientos para la elaboración de las Reglas de Operación de los Programas Sociales Estatales para el periodo 2022-2027.\n6. Criterios y Requisitos de Elegibilidad.\nPara seleccionar a las personas beneficiarias de este Programa, primeramente, es que se acredite como artesana o artesano del estado de Guerrero y que sea mayor de dieciocho años, así como que reúna los criterios en base a las convocatorias emitidas para participar en algún rubro del Programa, así mismo deberán cumplir con los siguientes criterios y requisitos de elegibilidad:\na) Criterios de elegibilidad:\nLas beneficiarias o beneficiarios accederán al Programa previamente acreditado como artesanas o artesanos guerrerenses y mediante solicitud de acuerdo a la convocatoria emitida, concursos, ferias y exposición artesanal, así mismo, se elaborará un expediente por persona beneficiaria con todos y cada uno de los requisitos previstos en el apartado correspondiente.\nLa SEFODECO, tomando en cuenta la revisión de la documentación que integre el expediente de la persona beneficiaria, autorizará o rechazará las solicitudes que le sean presentadas y considerando que:\nCumplan con los requisitos previstos en las presentes Reglas de Operación y que sean congruentes con los objetivos del Programa; e incidan en la competitividad y productividad de la población objetivo.\nb) Requisitos:\nLas personas que sean mayores de edad, que se dedique a la actividad artesanal, podrán solicitar apoyos del Programa, cumpliendo los siguientes requisitos:\nRequisito Documento\na). - Presentar Solicitud de Formato de Solicitud de Apoyo del Programa Para el convocatoria Artesanías, Anexo 1 de las Reglas de correspondiente Operación.\nb). - Identificación de la Copia de la identificación oficial con fotografía (Credencial para persona solicitante votar, Cédula Profesional o Pasaporte)\nEMITEN SUS REGLAS DE OPERACIÓN PARA EL\nEJERCICIO FISCAL 2022\nc). -Comprobante de Copia de recibo telefónico, recibo del servicio de agua o recibo\nDomicilio en el estado de de luz, con fecha no mayor a tres meses de la fecha de\nGuerrero expedición, del domicilio fiscal del solicitante.\nd). - Realizar actividades Presentar su producto, el cual estará sujeto a un económicas del sector análisis de Diferenciación entre Artesanía y artesanal. Manualidad.\ne). -No duplicar apoyos del Escrito dirigido a la persona titular de la Secretaría de Fomento\nGobierno del Estado y Desarrollo Económico, firmado bajo protesta de decir verdad, en el que manifieste el solicitante que, en el presente ejercicio fiscal, no ha recibido apoyo por parte de otras dependencias del\nGobierno del Estado, para el mismo concepto de apoyo solicitado.\nf). - Padrón de personas Haber sido registrado como artesana o artesano en el padrón\nCredencial correspondiente.\n{\"tabla_1\":{\"columnas\":[\"Tipo\",\"Monto\",\"Periodicidad\"],\"filas\":[{\"columna_1\":\"1.- Capacitación Integral.\\nEspecie y/o económico\",\"columna_2\":\"Hasta $1,000.00 por beneficiario\",\"columna_3\":\"Hasta 3 cursos\"},{\"columna_1\":\"2.- Apoyos a la Producción.\\nEspecie y/o económico\",\"columna_2\":\"Hasta $3,000.00 por apoyo\",\"columna_3\":\"Única\"},{\"columna_1\":\"3.-Apoyo a la Comercialización.\\nEconómico\",\"columna_2\":\"Hasta $15,000.00 por evento\",\"columna_3\":\"Única\"},{\"columna_1\":\"4.- Concursos artesanales.\\nEconómico\",\"columna_2\":\"Hasta $16,000.00 por ganador\",\"columna_3\":\"Única\"},{\"columna_1\":\"5.- Feria artesanal\\nEspecie\",\"columna_2\":\"Hasta $250,000.00 por feria\",\"columna_3\":\"Única\"}]}}\nEn cada rubro de apoyo, está sujeto a la suficiencia presupuestaria, así como la acreditación como beneficiaria o beneficiario de este Programa.\n7.1. Características de los Apoyos.\nEMITEN SUS REGLAS DE OPERACIÓN PARA EL\nEJERCICIO FISCAL 2022\nLos apoyos que se otorgarán al amparo del Programa, son recursos económicos asignados a las personas solicitantes que forman parte de la población objetivo:\na) Capacitación Integral: (Se otorga capacitación integral o asistencia técnica derivado de un diagnóstico focalizado artesanal que permita el desarrollo de habilidades para el trabajo organizativo, materias primas, proceso productivo y comercialización, la capacitación es impartida por maestras y maestros artesanos, técnicos, profesionistas y especialistas, sabedoras del quehacer artesanal, que tengan las capacidades y dominio de las diferentes ramas artesanales).\nb) Apoyos a la Producción: (apoyo con recursos económicos y/o en especie para fortalecer la adquisición de materia prima y/o herramientas de trabajo destinados a la producción artesanal).\nc) Apoyo a la Comercialización: (apoyo con recursos económicos para la trasportación y alojamiento, para garantizar su participación en ferias, exposiciones y eventos artesanales estatales, nacionales e internacionales, que les permitan promover, exhibir y comercializar sus artesanías).\nd) Concursos artesanales: (Es el reconocimiento para las artesanas y artesanos, que se distinguen por la preservación, rescate o innovación de las artesanías, así como aquellos que mejoran las técnicas de trabajo y recuperan el uso y el aprovechamiento sostenible y sustentable de los materiales en su entorno natural, de las diferentes regiones).\ne) Feria artesanal: (apoyo en especie por el que se brinda un espacio temporal, para la exhibición, difusión, promoción y comercialización de las artesanías guerrerenses).\n7.2. Recursos no Devengados.\nLos recursos aprobados para el Programa, en el Presupuesto de Egresos 2022, que no sean ejercidos o devengados al 31 de diciembre del presente año, serán reintegrados a la Secretaría de\nFinanzas y Administración del Estado de Guerrero.\n7.3. Resguardo de la Documentación.\nLa Dirección General de Promoción Comercial, Abasto y Artesanías, perteneciente a la\nSEFODECO, resguardará la documentación comprobatoria del ejercicio de los recursos del Programa y la\nDelegación Administrativa de la misma dependencia, efectuará el cierre del ejercicio.\n7.4. Supervisión y Control.\nEl Programa, estará a cargo de la SEFODECO a través de la Dirección General de Promoción comercial, Abasto y Artesanías, responsable de su operación y la verificación del cumplimiento de los objetivos establecidos en las presentes Reglas de Operación, enviando un reporte mensual a la Unidad de\nPlaneación y Presupuesto, a partir de la publicación de la convocatoria correspondiente.\nEMITEN SUS REGLAS DE OPERACIÓN PARA EL\nEJERCICIO FISCAL 2022\nAsimismo, la SEFODECO enviará trimestralmente a la Secretaría de Finanzas y Administración, Gubernamental, informes sobre el presupuesto ejercido, mismos que están establecidos por el Consejo\nNacional de Armonización Contable (CONAC). Dichos informes se deberán presentar a más tardar a los quince días hábiles posteriores a la terminación de cada trimestre.\n8. Criterios de Selección.\nSerán beneficiadas y beneficiados con el Programa, las personas solicitantes que acrediten ser artesanas y/o artesanos guerrerenses con la credencial que para tales efectos emite la SEFODECO, que sean mayores de 18 años y que tengan domicilio fiscal en el estado de Guerrero.\n8.1. Casos Especiales.\nLos casos especiales del Programa y aquellos casos no previstos en las presentes Reglas de\nOperación, serán atendidos por el Comité de Evaluación, que dictará las acciones a seguir y las resoluciones pertinentes.\n8.2. Casos de Emergencia o Desastre.\nEn caso de una declaratoria de emergencia o de desastre, el Comité de Evaluación, analizará la situación y, de afectarse la operación del Programa, deberá emitir el plan de acción que permita dar cumplimiento a sus objetivos, de conformidad con lo establecido en las presentes Reglas de Operación.\n8.3. Suspensión o Cancelación del Programa Social.\nLa SEFODECO podrá suspender o cancelar la operación del Programa, cuando las condiciones sociales y económicas, nos sean favorables para el cumplimiento de los objetivos; en caso de problemas de gobernabilidad en la entidad, el Programa podrá ser cancelado por la persona titular del Poder Ejecutivo.\nEl apoyo del Programa, será cancelado por la SEFODECO cuando lo solicite por escrito la persona normativas aplicables.\n8.4. Integración del Padrón de Personas Beneficiarias.\nLas personas que reciban un apoyo del Programa, serán incorporadas por la Dirección General de Promoción Comercial, Abasto y Artesanías, al Padrón Único de Personas Beneficiarias, cuya información será considerada en términos de lo dispuesto en la Ley Número 466 de Protección de Datos\nPersonales en Posesión de Sujetos Obligados del Estado de Guerrero y la Ley Número 207 de\n9. Mecánica Operativa del Programa Social.\nEMITEN SUS REGLAS DE OPERACIÓN PARA EL\nEJERCICIO FISCAL 2022\n9.1. Instancia Ejecutora y/o Responsable.\nLa instancia ejecutora del Programa, será la SEFODECO, a través de la Dirección General de\nPromoción Comercial, Abasto y Artesanías, emitiendo las Reglas de Operación de acuerdo al marco normativo aplicable.\nCon el objeto de asegurar la aplicación eficiente, eficaz, oportuna, equitativa y transparente de los recursos públicos, la Secretaría de Finanzas y Administración, y la Secretaría de Planeación y Desarrollo\nRegional, emiten las disposiciones normativas que regulan los programas de inversión sujetos a Reglas de\nOperación.\nLa Secretaría de Planeación y Desarrollo Regional, valida y aprueba las Reglas de Operación, mismas que, una vez validadas y aprobadas, serán publicadas en el Periódico Oficial del Gobierno del\nEstado de Guerrero, previo trámite realizado por la SEFODECO. La Secretaría de Finanzas y\nAdministración, efectuará las ministraciones de recursos presupuestales en concordancia con el\nPresupuesto de Egresos 2022.\n9.2. Proceso de Incorporación al Programa Social.\nLas personas mayores de edad que se dediquen a la actividad artesanal, podrán presentar su solicitud de apoyo del Programa, una vez que sea emitida la convocatoria, que para tales efectos establezca la SEFODECO, la cual se publicará en el Periódico Oficial del Gobierno del Estado de Guerrero y en dos periódicos de mayor circulación en el estado de Guerrero, en dos días diferentes. Adicionalmente, la convocatoria se publicará en el portal oficial del Gobierno del Estado www.guerrero.gob.mx y en las redes sociales oficiales de la SEFODECO: Sefodeco Guerrero (Facebook), @sefodecogro (Twitter).\nLa convocatoria que emita la SEFODECO del Programa, se sujetará a las presentes Reglas de\nOperación, la cual será autorizada por la persona titular de la SEFODECO y deberá contener, como mínimo lo siguiente:\n● Objeto;\n● Vigencia de la Convocatoria;\n● Monto presupuestal disponible;\n● Montos de los Apoyos;\n● Cobertura;\n● Criterios de Elegibilidad;\n● Requisitos;\n● Criterios Técnicos de Evaluación, y\n● Contacto de atención.\nLa solicitud de apoyo y los documentos señalados, deberán presentarse en las oficinas de la\nDirección General de Promoción Comercial, Abasto y Artesanías. ubicadas en el Recinto de las Oficinas\nEMITEN SUS REGLAS DE OPERACIÓN PARA EL\nEJERCICIO FISCAL 2022\nCisneros No. 62, Col. Ciudad de los Servicios, Chilpancingo, Guerrero, en un horario de atención de las\nPDF por cada uno del documento enviado.\nEl procedimiento de acceso de las personas solicitantes al Programa, será el siguiente:\nPublicadas las Reglas de Operación del Programa, la SEFODECO, recibirá las solicitudes de apoyo.\nLa Dirección General de Promoción Comercial, Abasto y Artesanías, dictaminará las solicitudes de apoyo presentadas y aquellas que obtengan dictamen favorable, en términos de lo dispuesto en las presentes Reglas de Operación, serán presentadas, para su autorización correspondiente, al Comité de\nEvaluación.\nEl Comité de Evaluación, es un órgano colegiado que tendrá como objetivo conocer y resolver los asuntos del Programa, especialmente, la autorización de solicitudes de apoyo; estará integrado de la siguiente manera:\n• La persona titular de la Secretaría de Fomento y Desarrollo Económico, que fungirá como presidenta o presidente;\n• La persona titular de la Dirección General de Fomento Empresarial, quien fungirá como\nSecretaria o Secretario Técnico;\n• La persona titular de la Subsecretaría de Fomento Económico;\n• La persona titular de la Unidad de Asuntos Jurídicos, y\n• La persona titular de la Delegación Administrativa.\nLa autorización de las solicitudes de apoyo se efectuará en sesión del Comité de Evaluación, con la presencia del cincuenta por ciento más uno de sus integrantes, levantándose la minuta correspondiente, misma que deberá contener la relación de las solicitudes de apoyo autorizadas.\nLos apoyos del Programa se autorizarán de acuerdo al mecanismo: primero en tiempo, primero en derecho; estableciendo un orden de prelación, por separado, de las solicitudes de apoyo presentadas\nComercial, Abasto y Artesanías, que se integren al orden de mayor a menor, en la calificación obtenida en correspondiente, por parte del mismo Comité de Evaluación, hasta agotar el monto presupuestal disponible; atendiendo la perspectiva de género, del total de apoyos que se otorgarán al amparo del Programa, cincuenta por ciento se autorizarán para artesanas y cincuenta por ciento para artesanos.\nEMITEN SUS REGLAS DE OPERACIÓN PARA EL\nEJERCICIO FISCAL 2022\nLa Secretaría Técnica del Comité de Evaluación, levantará el acta correspondiente de las sesiones, mismas que contendrás, entre otros puntos, el listado de las solicitudes de apoyo autorizadas.\nMediante oficio firmado por la persona titular de la SEFODECO, se notificará la resolución de autorización de apoyo a las personas solicitantes, en un plazo de cinco días hábiles contados a partir del día siguiente de la sesión del Comité de Evaluación.\nLos oficios de requerimientos y resoluciones de las solicitudes de apoyo presentadas, emitidos por la SEFODECO, se notificarán a la persona solicitante en el correo electrónico señalado en el formato de solicitud de apoyo.\nEn los requerimientos, las personas solicitantes de apoyo contarán con cinco días hábiles, contados a partir del siguiente de la notificación, para cumplir con lo solicitado; de no contestar en el plazo mencionado, se tendrá por desistida la solicitud.\n10. Evaluación.\nLa evaluación del Programa, la realizará la SEFODECO por conducto de la Dirección General de\nPromoción Comercial, Abasto y Artesanías, verificando los avances y el cumplimiento de los indicadores de desempeño e identificando áreas de oportunidad y alternativas de solución que favorezcan el cumplimiento de los objetivos planteados.\n10.1. Indicadores (Construcción de la Matriz de Indicadores para Resultados. - Anexo 1).\nEl gobierno del estado ha adoptado la Metodología de Presupuesto Basado en Resultados (PBR), implementada por el gobierno federal, en este sentido, el indicador para el seguimiento y la evaluación del\nPrograma, se construyó de acuerdo a la Metodología de Marco Lógico (MML), en los siguientes términos en la Ficha Técnica de Indicadores:\nEJE: 3 Desarrollo Económico\nEje:\nImpulsar el desarrollo de las artesanas y los artesanos del estado, a través de apoyos, teniendo como fin el realizar acciones encaminadas a procurar un mayor ingreso; a conservar el sentido artístico de las artesanías guerrerenses; proporcionando a los mismos, asistencia técnica, administrativa y apoyo\nObjetivo: económico, así como la promoción y comercialización de sus productos artesanales.\nFomentar la productividad de las y los artesanos, mediante programas sectoriales y proyectos\nEstrategia: regionales.\nLínea de acción: del estado de guerrero equitativamente en la 7 Regiones del Estado\nDatos de identificación del indicador\nClave Nombre Fuente\nEMITEN SUS REGLAS DE OPERACIÓN PARA EL\nEJERCICIO FISCAL 2022\nEMITEN SUS REGLAS DE OPERACIÓN PARA EL\nEJERCICIO FISCAL 2022\nLic. Gabriela Nájera Mtra. Teodora Ramírez\nServando Nava Cruz\nCisneros Vega\nDirector General de Promoción Titular de la Unidad de Planeación\nSecretaria de Fomento y Desarrollo\nComercial, Abasto y y Presupuesto. Económico\nArtesanías.\n10.2. Seguimiento.\nEl seguimiento del Programa, estará a cargo de la SEFODECO y, particularmente, por la Dirección\nGeneral de Promoción Comercial, Abasto y Artesanías, generando en el proceso, información que permita un análisis sobre el avance del cumplimiento de los objetivos establecidos y sobre el ejercicio de los recursos presupuestales asignados. El seguimiento se llevará a cabo de manera permanente con el propósito de identificar áreas de mejora que favorezcan una operación eficiente y eficaz del Programa, y en consecuencia, alcanzar los objetivos propuestos.\n10.3. Auditoría.\nEl ejercicio de los recursos asignados y la verificación del cumplimiento de los objetivos del\nPrograma, podrán ser auditados por los entes fiscalizadores como la Secretaría de Contraloría y\nTransparencia Gubernamental y la Auditoría Superior del Estado de Guerrero, conforme a las disposiciones normativas aplicables y en el ámbito de sus respectivas competencias.\nLa SEFODECO otorgará todas las facilidades a los entes fiscalizadores para llevar a cabo las auditorías que determinen e implementará las acciones necesarias para solventar las observaciones y no conformidades que se plasmen en el informe de auditoría correspondiente.\n11. Mecanismo de Entrega del Apoyo.\nLos apoyos del Programa, se entregarán de manera directa, mediante cheque nominativo a favor\nSEFODECO.\n12. Derechos y Obligaciones de las Personas Beneficiadas.\nLas personas beneficiarias del Programa, estarán sujetas a los siguientes derechos y obligaciones:\na) Derechos:\n● Recibir el apoyo del Programa para ejercerlo de acuerdo a lo establecido en las presentes\nReglas de Operación, sin distinción, exclusión o restricción;\nEMITEN SUS REGLAS DE OPERACIÓN PARA EL\nEJERCICIO FISCAL 2022\n● Recibir asesoría por parte de la SEFODECO, cuando así lo soliciten, para facilitar la correcta aplicación de los recursos recibidos;\n● Recibir un trato digno y respetuoso, por parte de las servidoras y servidores públicos de la\nSEFODECO, y\n● La reserva de su información personal conforme a lo dispuesto en la Ley Número 466 de\nProtección de Datos Personales en Posesión de Sujetos Obligados del estado de Guerrero y la Ley Número\n207 de Transparencia y Acceso a la Información Pública del Estado de Guerrero.\nb) Obligaciones:\n● Aplicar el apoyo recibido del Programa, conforme a lo establecido en las presentes Reglas de\nOperación y la convocatoria respectiva.\n● Comprobar el apoyo recibido del Programa, para lo cual deberá entregar en un plazo de cinco días hábiles, contados a partir del día siguiente de la notificación del oficio de resolución de autorización del apoyo, el recibo que como anexo 2 se establece en las presentes, a nombre de la Secretaría de\nFinanzas y Administración del Estado de Guerrero, que contenga el concepto y el monto del apoyo recibido.\n● En general, cumplir y observar las disposiciones de las presentes Reglas de Operación y las disposiciones jurídicas aplicables.\n12.1. Causales de Suspensión o Baja de las Personas Beneficiadas.\nDebido a que el Programa está diseñado para otorgar un beneficio de manera temporal a las beneficiarias y beneficiarios, no existe la necesidad de que haya suspensión o baja de las personas beneficiarias, puesto que para acceder al Programa se debe cumplir con todos los requisitos y se hará una revisión exhaustiva de la documentación y el local, para ser beneficiarias y beneficiario, además el apoyo será sólo por una vez para quien cumpla con los requisitos. Por las características del Programa no aplica.\n12.2. Proceso de Baja. beneficiarias y beneficiarios, no existe la necesidad de que haya un proceso de baja, puesto que es anual y el beneficio será sólo por única vez a la persona beneficiaria que cumpla con los requisitos. Por las características del Programa no aplica.\n13. Instancias Participantes.\nLas instancias participantes en el Programa, son las siguientes:\nEMITEN SUS REGLAS DE OPERACIÓN PARA EL\nEJERCICIO FISCAL 2022\n● La Secretaría de Planeación y Desarrollo Regional, con la validación y aprobación de las\nReglas de Operación.\n● La Secretaría de Finanzas y Administración, con la ministración de recursos presupuestales para la operación del Programa Para el Fortalecimiento de la Producción y Comercialización de las\nArtesanías.\n● La Secretaría de Fomento y Desarrollo Económico, es la instancia ejecutora del Programa\nPara el Fortalecimiento de la Producción y Comercialización de las Artesanías, a través de la Dirección\nGeneral de Promoción Comercial, Abasto y Artesanías.\n● La Secretaría de Contraloría y Transparencia Gubernamental y la Auditoría Superior del\nEstado de Guerrero, son entes que pueden realizar la fiscalización del Programa Para el Fortalecimiento de la Producción y Comercialización de las Artesanías.\n13.1. Instancia Normativa.\nLa SEFODECO, es la instancia normativa del Programa en consecuencia, le corresponde la ejecución de emitir las presentes Reglas de Operación, y la emisión de la convocatoria y, en general, la aplicación del marco normativo correspondiente a sus facultades y atribuciones.\n14. Transparencia.\nEn materia de transparencia, en el Programa, se atenderán las siguientes líneas de acción:\n14.1. Promoción y Difusión del Programa Social.\nLas presentes Reglas de Operación del Programa, se publicarán en el Periódico Oficial del\nGobierno del Estado de Guerrero y estarán disponibles para su consulta en las oficinas de la SEFODECO, ubicadas en el Recinto de la Oficinas del Poder Ejecutivo del Estado de Guerrero, Edificio Acapulco, Primer\nPiso, Boulevard Lic. René Juárez Cisneros, Col. Ciudad de los Servicios, en Chilpancingo, Guerrero, en un\n@sefodecogro (Twitter).\n14.2. Contraloría Social.\nEl fundamento legal del Programa, parte del artículo 29 de la Ley Orgánica de la Administración\nPública del Estado de Guerrero Número 08, que establece que a la SEFODECO le corresponde, entre otros temas, planear, regular, promover y fomentar el desarrollo económico del estado de Guerrero, en este sentido, no son aplicables las disposiciones normativas de la Contraloría Social, cuyo fundamento se encuentra en la Ley General de Desarrollo Social.\nEMITEN SUS REGLAS DE OPERACIÓN PARA EL\nEJERCICIO FISCAL 2022\nSin embargo, el ejercicio de los recursos públicos y la operación del Programa, están sustentados en la transparencia y la rendición de cuentas, en estricto apego al marco normativo aplicable y bajo la supervisión, mediante auditorias, de entes fiscalizadores como la Secretaría de Contraloría y\nTransparencia Gubernamental y la Auditoría Superior del Estado de Guerrero.\nAsimismo, la información del Programa, se encuentra disponible para los ciudadanos, conforme a lo dispuesto en la Ley Número 466 de Protección de Datos Personales en Posesión de Sujetos Obligados del Estado de Guerrero y la Ley Número 207 de Transparencia y Acceso a la Información Pública del\nEstado de Guerrero.\n14.3. Protección de Datos Personales.\nLa protección de los datos personales de las personas beneficiarias del Programa y la información de las solicitudes de apoyo, se regirán por lo establecido en la Ley Número 466 de Protección de Datos\nPersonales en Posesión de Sujetos Obligados del Estado de Guerrero y la Ley Número 207 de\nTransparencia y Acceso a la Información Pública del Estado de Guerrero.\n14.4. Quejas y Denuncias.\nLa ciudadanía y las beneficiarias o beneficiarios del Programa, podrán presentar ante la\nSEFODECO, quejas y denuncias, sobre hechos, actos u omisiones, que afecten sus derechos o el incumplimiento de lo dispuesto en las presentes Reglas de Operación; los medios de presentación de las quejas y denuncias, son los siguientes:\na) Presencial: en el domicilio de las oficinas de la SEFODECO, ubicadas en el Recinto de la\nOficinas del Poder Ejecutivo del Estado de Guerrero, Edificio Acapulco, Primer Piso, Boulevard Lic. René\nJuárez Cisneros No. 62, Col. Ciudad de los Servicios, en Chilpancingo, Guerrero, en un horario de atención de las 9:00 a las 16:00 horas.\nc) Telefónica: en el número telefónico 7474719700, Extensión 9955.\nPara dar respuesta a las quejas y denuncias, la SEFODECO dispondrá de un plazo de diez días hábiles contados a partir del día siguiente de su fecha de presentación.\nLa ciudadanía y las personas beneficiarias del Programa, también podrán presentar sus quejas y denuncias ante la Secretaría de Contraloría y Transparencia Gubernamental, a través de los siguientes medios:\na) Presencial: en el domicilio de las oficinas de la Secretaría de Contraloría y Transparencia\nEMITEN SUS REGLAS DE OPERACIÓN PARA EL\nEJERCICIO FISCAL 2022\nNorte, Primer Piso, Boulevard Lic. René Juárez Cisneros No. 62, Col. Ciudad de los Servicios, en\nChilpancingo, Guerrero en un horario de atención de las 9:00 a las 16:00 horas.\nc) Telefónico: en el número telefónico 747471974.\nEn la denuncia o queja la ciudadanía o las personas beneficiarias del Programa, deberán proporcionar los siguientes datos:\n● Nombre de la servidora o servidor público;\n● Secretaría o dependencia de adscripción;\n● Objeto de la denuncia o queja;\n● Nombre y domicilio de la persona quejosa, e\n● Identificación oficial.\n14.5. Acciones de Blindaje.\nEn la operación y el ejercicio de los recursos presupuestales aprobados para el Programa, se aplicarán los lineamientos normativos que emitan la Secretaría de Contraloría y Transparencia\nGubernamental, el Instituto de Transparencia, Acceso a la Información y Protección de Datos Personales del Estado de Guerrero (ITAIG), el Instituto Electoral y de Participación Ciudadana del Estado de Guerrero\n(IEPC) y demás instancias federales y estatales competentes, con la finalidad de impedir que los apoyos sean utilizados con fines político electorales.\nComo estrategia de blindaje electoral, la papelería, documentación oficial, así como la publicidad y promoción del Programa, deberán incluir la siguiente leyenda:\n“Este Programa es de carácter público, no es patrocinado ni promovido por partido político alguno y sus recursos provienen de los impuestos que pagan todos los contribuyentes. Está prohibido el uso de este programa con fines políticos, electorales, de lucro y otros distintos a los establecidos. Quien haga uso indebido de los recursos de este programa deberá ser denunciado y sancionado de acuerdo con la ley aplicable y ante la autoridad competente”.\nEn cuanto a la publicidad en medios electrónicos, impresos, complementarios o de cualquier otra índole, vinculados con los programas de comunicación social, se deberá incluir la siguiente leyenda:\n“Este Programa es público y queda prohibido su uso con fines partidistas o de promoción personal”.\nEMITEN SUS REGLAS DE OPERACIÓN PARA EL\nEJERCICIO FISCAL 2022\n14.6. Acta de Donación. de Operación de los Programas Sociales Estatales para el periodo 2022-2027, publicados en el Periódico\nOficial del Gobierno del Estado de Guerrero, de fecha 18 de febrero de 2022.\n15. Perspectiva de Género.\nEl Programa, contribuye al fortalecimiento de la perspectiva de género, partiendo del reconocimiento de que representa una condición indispensable y fundamental para la igualdad entre las personas, por tanto, se otorgarán el mismo número de apoyos para artesanas y artesanos, de acuerdo al orden de prelación de la presentación de solicitudes de apoyo, y de acuerdo al orden, de mayor a menor, de la calificación obtenida por parte del Comité de Evaluación, y que cuenten con la autorización de apoyo por parte del Comité de Evaluación, hasta agotar el monto presupuestal disponible.\n16. Enfoque de Derechos.\nCon el propósito de generar las condiciones de acceso equitativo de mujeres y jóvenes a los apoyos del Programa, las presentes Reglas de Operación y la convocatoria, estarán disponibles de las oficinas de la SEFODECO, ubicadas en el Recinto de la Oficinas del Poder Ejecutivo del Estado de\nGuerrero, Edificio Acapulco, Primer Piso, Boulevard Lic. René Juárez Cisneros No. 62, Col. Ciudad de los\nServicios, en Chilpancingo, Guerrero, en un horario de atención de las 9:00 a las 16:00 horas y se publicarán en el portal oficial del gobierno del estado www.guerrero.gob.mx y en las redes sociales oficiales de la SEFODECO: Sefodeco Guerrero (Facebook), @sefodecogro (Twitter).\nEl Programa, está diseñado para la atención de artesanas y artesanos, que pertenecen a dos grupos considerados históricamente como vulnerables; los apoyos que se les otorguen tendrán como fundamento exclusivo lo dispuesto en las presentes Reglas de Operación.\nLas servidoras y servidores públicos involucrados en la operación del Programa, brindarán en todo momento un trato digno y respetuoso a las personas que forman parte de la población objetivo.\n17. Acciones Contra el SARS-COV 2.\nLa operación del Programa, se realizará con estricto cumplimiento de las disposiciones que emitan las autoridades sanitarias de los tres niveles de gobierno, para el control y prevención del SARS-COV 2.\n18. Anexos que reflejen la entrega del apoyo (Económico. Especie o Servicios).\nAnexo 1.\nComercialización de las Artesanías.\nAnexo1\nEMITEN SUS REGLAS DE OPERACIÓN PARA EL\nEJERCICIO FISCAL 2022\nSOLICITUD DE APOYO DE LA SEFODECO GRO.\nSolicitud de (marque con una X)\n1 Capacitación Integral\n2 Apoyo a la Producción\n3 Apoyo a la comercialización\n4 Concursos artesanales\n5 Feria Artesanal\nDatos Generales del solicitante o representante de los solicitantes\nNombre(s) Edad:\nApellido paterno: Apellido materno:\nCalle y número. Localidad:\nMunicipio/Delegación Entidad Federativa:\nCódigo postal Grupo étnico:\nSexo: Hombre Mujer Rama artesanal:\nCorreo electrónico: Número telefónico:\nCURP: RFC (En su caso):\n1. Capacitación Integral\n¿Para cuál de estas modalidades solicita el apoyo? [marque con una X]\n[Capacitación Integral [] Asistencia Técnica\n]\nTipo de capacitación:\n2. Apoyo a la Producción\nConcepto Importe Concepto Importe\n[Adquisición de herramientas [] Materias primas\n]\nOtro Otro\n[Cuál [] Cuál\n]\n3. Apoyo a la comercialización\nMarque con una X el tipo de apoyo solicitado\nApoyos Individuales en Ferias y Exposiciones\nNombre la feria o exposición:\nConcepto Importe Importe total\n[Transporte []\n]\n[Alojamiento []\n]\n[Alimentos []\n]\n4. Concursos Artesanales nacionales\nMarque con una X el tipo de apoyo solicitado\nEMITEN SUS REGLAS DE OPERACIÓN PARA EL\nEJERCICIO FISCAL 2022\nConcurso nacional:\nConcepto Importe Importe total\n[Transporte []\n]\n[Alojamiento []\n]\n[Alimentos []\n]\n5. Festival Artesanal\nMarque con una X el tipo de apoyo solicitado\nConcepto Importe Nombre del festival Importe\n[Renta de Espacio []\n]\n[Montaje de Stand\n]\nPromoción y\nPublicidad\n]\nDescriba las especificaciones de lo solicitado:\nEMITEN SUS REGLAS DE OPERACIÓN PARA EL\nEJERCICIO FISCAL 2022\nAnexo 2.\nComercialización de las Artesanías.\nLugar y Fecha ______________________\nRecibo por ……………\nRecibí del Gobierno del Estado de Guerrero, a través de Secretaría de Fomento y Desarrollo\nEconómico la cantidad de $........ como apoyo de la vertiente………………………… mediante el cheque número……………………..recursos que me comprometo a utilizar para y continuar con las actividades artesanales que desempeño.\nNombre del Artesano:\n________________________\nFirma:\nHuella Digital:\n_________________________\nDomicilio:\nComunidad:\nMunicipio:\nEstado de Guerrero.\nCURP:\nAnexo 3\nEMITEN SUS REGLAS DE OPERACIÓN PARA EL\nEJERCICIO FISCAL 2022\nMatriz de Indicadores para Resultados\nH/LOGICA Calculo Indica de Verificaci Responsa\nV dor Medida ón ble\nApoyar a Número de 2.1.1=TEB/TEP Eficacia Porcent SEFODE E10.- Otorgar mejorar la artesanas o *100 aje CO Secretaría apoyos de productividad artesanos de carácter\nFin de las beneficia Fomento y temporal en artesanas y los dos Desarrollo especie o artesanos del Económico económico que estado. mejoren su productividad\nMejorar la Número de 2.1.1=TEB/TEP Eficacia Porcent SEFODE E10.- Apoyos economía del artesanas o *100 aje CO Secretaría directos a\nSector artesanos de quienes\nPropósito Artesanal beneficia Fomento y cumplan con dos Desarrollo los requisitos\nEconómico establecidos por el programa\nC.1. Número de 2.1.1=TEB/TEP Eficacia Porcent SEFODE E10.- Fortalecer\nCapacitación. artesana s *100 aje CO Secretaría capacidades\nC.2. artesano s Fomento y artesanos que\nApoyos a la beneficia Desarrollo permita el\nCompone Producción. dos Económico desarrollo de ntes habilidades\nC.3. para el\nApoyo a la trabajo\nComercializa organizativo, ción. materias primas, proceso\nC.4. productivo, Concursos exhibición, artesanales promoción y comercialización\nC.5.\nFeria\nArtesanal\nA.1. Entregar Número de 2.1.1=TEB/TEP Eficacia Porcent SEFODE E10.- Cumplir con el apoyos artesanas o *100 aje CO Secretaría programa de requeridos. artesanos de capacitación beneficia Fomento y establecido\nActividades dos Desarrollo\nContar con el\nEconómico presupuesto liberado del programa\nContar con el presupuesto liberado del programa\nEMITEN SUS REGLAS DE OPERACIÓN PARA EL\nEJERCICIO FISCAL 2022\nPrimero. El presente Acuerdo entrará en vigor al día siguiente de su publicación en el Periódico Oficial del\nSegundo. Se abrogan todas las disposiciones que contravengan a las presentes Reglas de Operación del\nAcuerdo por el que se crea el Programa Para el Fortalecimiento de la Producción y Comercialización de las Artesanías.\nTercero. A partir de la entrada en vigor del presente Acuerdo, las Reglas de Operación del Programa Para el Fortalecimiento de la Producción y Comercialización de las Artesanías, subsecuentes o sus modificaciones serán emitidos por la persona titular de la Secretaría de Fomento y Desarrollo Económico, responsable directa de la operación y ejecución de las mismas.\nDado en la Oficina de la titular del Poder Ejecutivo, ubicada en el Edificio Centro del Recinto de la Oficinas del Poder Ejecutivo del Estado de Guerrero, Boulevard René Juárez Cisneros No. 62, Ciudad de los\nServicios, en la Ciudad de Chilpancingo Guerrero, Capital del Estado de Guerrero, a los dos días del mes de agosto de dos mil veintidós.\nLA GOBERNADORA CONSTITUCIONAL DEL ESTADO DE GUERRERO.\nMTRA. EVELYN CECIA SALGADO PINEDA.\nRúbrica.\nEL SECRETARIO GENERAL DE GOBIERNO.\nMTRO. LUDWIG MARCIAL REYNOSO NUÑEZ.\nRúbrica.\nLA SECRETARIA DE FOMENTO Y DESARROLLO ECONÓMICO.\nMTRA. TEODORA RAMIREZ VEGA.\nRúbrica.",
  "ordenamiento": "PROGRAMA",
  "jurisdiccion": "GUERRERO",
  "fuente_oficial": "DIARIO OFICIAL DE LA FEDERACION",
  "Fecha de Publicación": "14 DE ABRIL DE 2023",
  "ULTIMA REFORMA PUBLICADA": "14 DE ABRIL DE 2023",
  "status": "ABROGADA",
  "es_escaneado": false,
  "tiene_tablas": true,
  "materia": [
    "económico"
  ]
}