{
  "titulo": "Acuerdo por el Que Se Crea el Programa Adquisición de Aparatos Auditivos E Insumos para Moldes Audit",
  "Contenido": "SUS REGLAS DE OPERACIÓN PARA EL EJERCICIO\nFISCAL 2020\nGUERRERO No EDICIÓN EXTRAORDINARIA II, DE FECHA 03 DE junio DE 2021.\nTEXTO ORIGINAL.\nAcuerdo publicado en el Periódico Oficial del Gobierno del Estado No.74 Alcance I, el Martes 22 de Septiembre de 2020.\nACUERDO POR EL QUE SE CREA EL PROGRAMA ADQUISICIÓN DE APARATOS AUDITIVOS E\nINSUMOS PARA MOLDES AUDITIVOS, Y SE EMITEN SUS REGLAS DE OPERACIÓN PARA EL\nEJERCICIO FISCAL 2020.\nGuerrero. - Poder Ejecutivo.\nLICENCIADO HÉCTOR ANTONIO ASTUDILLO FLORES, GOBERNADOR CONSTITUCIONAL\nDEL ESTADO DE GUERRERO, CON FUNDAMENTO EN LO DISPUESTO POR LOS ARTÍCULOS 4o\nDE LA CONSTITUCIÓN POLÍTICA DE LOS ESTADOS UNIDOS MEXICANOS; 167 DE LA LEY\nGENERAL DE SALUD; 3 DE LA LEY DE ASISTENCIA SOCIAL; 4 FRACCIÓN XVIII DEL\nPRESUPUESTO DE EGRESOS DE LA FEDERACIÓN PARA EL EJERCICIO FISCAL 2020; 40 DE LA\nLEY DE COORDINACIÓN FISCAL; 71, 87, 88, 90 NUMERAL 2 Y 91 FRACCIONES I, IX Y XLVI DE LA\nLAS FACULTADES QUE ME CONFIEREN LOS ARTÍCULOS 2, 3, 6, 7, 10, 18 APARTADO A FRACCIÓN\nI, 20 FRACCIÓN III Y 45 DE LA LEY ORGÁNICA DE LA ADMINISTRACIÓN PÚBLICA DEL ESTADO\nDE GUERRERO NÚMERO 08; 15 DE LA LEY SOBRE EL SISTEMA ESTATAL DE ASISTENCIA SOCIAL\nNÚMERO 332; EN RELACIÓN CON EL ARTÍCULO 55 Y ANEXOS 21 Y 21-A DEL DECRETO NÚMERO\n447 DEL PRESUPUESTO DE EGRESOS DEL ESTADO DE GUERRERO PARA EL EJERCICIO FISCAL\n2020 Y LOS LINEAMIENTOS PARA LA ELABORACIÓN DE LAS REGLAS DE OPERACIÓN DE LOS\nPROGRAMAS SOCIALES ESTATALES PARA EL EJERCICIO FISCAL 2017.\nQue el Plan Estatal de Desarrollo 2016-2021 impulsa entre sus prioridades, un Guerrero que garantice el ejercicio efectivo de los derechos sociales de todos los guerrerenses, que vaya más allá del participación social en las políticas públicas.\nLa Constitución Política de los Estado Unidos Mexicanos establece en su artículo 4o que la mujer y el hombre son iguales ante la ley. Esta protegerá la organización y el desarrollo de la familia. real en la calidad de vida de los guerrerenses, a través de Políticas públicas menos asistencialistas y más\nSUS REGLAS DE OPERACIÓN PARA EL EJERCICIO\nFISCAL 2020 estructurales para garantizar el desarrollo de quienes menos tienen, con una distribución eficiente del presupuesto en rubros y programas que generen cambios profundos en este sector. Uno de los ejes que respaldan esta visión es el Eje 3.- Guerrero Socialmente Comprometido; Objetivo 3.7. Fortalecer la asistencia social a grupos vulnerables; Estrategia 3.7.1. Atender integralmente a los grupos vulnerables y fomentar el acceso a los servicios de protección social que les permita mejorar su calidad de vida.\nLa Ley Número 479 del Sistema para el Desarrollo Integral de la Familia del Estado de Guerrero publicada en el Periódico Oficial del Gobierno del Estado número 61 del 02 de agosto de 1983, creó el\nSistema Estatal para el Desarrollo Integral de la Familia, como un organismo público descentralizado, el cual tiene por objeto I.- Promover el bienestar social y prestar al efecto servicios de asistencia social con apoyo en las normas que dicte la Secretaría de Salubridad y Asistencia y el Sistema Nacional para el\nDesarrollo Integral de la Familia, así como el propio Estado; II.- Apoyar el desarrollo de la familia y de la comunidad; III.- Fomentar la educación, para la integración social; IV.- Impulsar el sano crecimiento físico y mental de la niñez; 2 V.- Atender las funciones de auxilio a las instituciones de asistencia privada que le confíe la dependencia competente, con sujeción a lo que disponga la Ley relativa; VI.- Operar establecimientos de asistencia social en beneficio de menores en estado de abandono, de ancianos y de los minusválidos; VII.- Realizar estudios e investigaciones sobre los problemas de la familia, de los menores, de los ancianos y de los minusválidos; VIII.- Prestar servicios de asistencia jurídica y de orientación social de los menores, ancianos y minusválidos sin recursos; IX.- Intervenir en el ejercicio de la tutela de los menores, que corresponda al Estado, en los términos de la Ley respectiva; X.- Auxiliar al\nMinisterio Público en la protección de incapaces y de los procedimientos civiles y familiares que les afecten, de acuerdo con la Ley; XI.- Procurar permanentemente la adecuación de los objetivos y programas del sistema estatal, a los que lleve a cabo el sistema nacional, a través de decretos, acuerdos, convenios o cualquier figura jurídica encaminada a la obtención de bienestar social, y, XII.- Los demás que les encomienden las Leyes.\nLas personas titulares de las secretarías, dependencias y entidades de la administración pública estatal, así como, las servidoras y servidores públicos autorizados para ejercer recursos públicos del presupuesto de inversión de las mismas, serán responsables de los programas y proyectos de inversión que realicen y que los apoyos otorgados deberán sujetarse a criterios de objetividad, equidad, transparencia, publicidad, selectividad y temporalidad.\nEl Presupuesto de Egresos de la Federación para el Ejercicio Fiscal 2020, contempla en un apartado que las erogaciones para el Ramo General 33 Aportaciones Federales para Entidades\nFederativas y Municipios, serán distribuidos conforme a lo previsto en el Anexo 22 de este Decreto, el cual se precisa en el Fondo de Aportaciones Múltiples erogaciones para asistencia social.\nEl artículo 55 del Decreto Número 447 de Presupuesto de Egresos del Estado de Guerrero para el Ejercicio\nFiscal 2020, establece que con el objeto de asegurar la aplicación eficiente, eficaz, oportuna equitativa y inversión sujetos a reglas de operación.\nSUS REGLAS DE OPERACIÓN PARA EL EJERCICIO\nFISCAL 2020\nCon sustento en lo anterior, la Secretaría de Planeación y Desarrollo Regional, expidió los\nLos objetivos de los programas y/o proyectos deberán desarrollarse de manera eficaz y oportuna a fin de consolidar la política estatal ya que dentro de los objetivos y estrategias que plantea el ejecutivo estatal, está abatir la marginación y el rezago social que enfrentan los grupos sociales vulnerables para proveerles de igualdad en las oportunidades que les permitan desarrollarse con independencia y plenitud; asimismo, plantea elevar la productividad de las personas para que cuenten con mejores opciones de empleo e ingreso, que les permitan reducir sus niveles de pobreza, es por ello que surge este programa con el propósito de mitigar los impactos económicos sociales por las que atraviesan las personas que habiten en zonas rurales, mediante la entrega de proyectos productivos y de servicios.\nEn el Decreto Número 447 del Presupuesto de Egresos del Estado de Guerrero para el Ejercicio\nFiscal 2020, señala que se ejercerán los recursos bajo una política de gasto público, que permita dar cumplimiento a lo que globalmente prevén los ejes rectores del Plan Estatal de Desarrollo 2016-2021.\nEn cumplimiento de lo anterior, se ha tenido a bien expedir el siguiente:\nACUERDO POR EL QUE SE CREA EL PROGRAMA ADQUISICIÓN DE APARATOS\nAUDITIVOS E INSUMOS PARA MOLDES AUDITIVOS, Y SE EMITEN SUS REGLAS DE OPERACIÓN\nPARA EL EJERCICIO FISCAL 2020.\nArtículo 1. Se crea el Programa Adquisición de Aparatos Auditivos e Insumos para Moldes\nAuditivos, el cual tiene por objeto contribuir a disminuir la desigualdad social entre los guerrerenses, respondiendo de manera cabal a sus expectativas de cambio; articuladora de esfuerzos, incluyente, con rostro humano.\nArtículo 2. Se emiten las Reglas de Operación del Programa Adquisición de Aparatos Auditivos e\nInsumos para Moldes Auditivos, en los que se establecen los principios de eficiencia, eficacia, oportunidad, equitativa y transparencia de los recursos públicos, así como se establecerán los criterios y requisitos que se deben de cumplir para poder acceder al Programa.\nAsí mismo, las Reglas de Operación establecen disposiciones que instituyen la ejecución del\nPrograma Adquisición de Aparatos Auditivos e Insumos para Moldes Auditivos, con el objeto de otorgar transparencia y asegurar la aplicación, eficiente, eficaz, oportuno y equitativo de los recursos públicos\nGuerrero.\nArtículo 3. El Sistema para el Desarrollo Integral de la Familia tendrá a cargo la implementación, ejecución, evaluación y administración del Programa Adquisición de Aparatos Auditivos e Insumos para\nMoldes Auditivos, bajo los criterios de objetividad, equidad, transparencia, publicidad, selectividad y\nSUS REGLAS DE OPERACIÓN PARA EL EJERCICIO\nFISCAL 2020 temporalidad, con estricto apego a la normatividad aplicable, por lo tanto será el encargado de la dispersión y asignación de los recursos del Programa apegándose plenamente a las siguientes:\nPARA MOLDES AUDITIVOS PARA EL EJERCICIO FISCAL 2020.\n1. Introducción\n1.1. Antecedentes\nLa discapacidad auditiva es una condición de vida de una persona, la cual puede ser congénita o adquirida en cualquier etapa de la vida, que se manifiesta por limitaciones significativas en el funcionamiento intelectual, motriz, sensorial y en la conducta adaptativa, es decir, en la forma en que se relaciona en el hogar, la escuela y la comunidad, respetando las formas de convivencia de cada ámbito. Y se considera una de las más limitantes ya que priva a la persona que la padece a relacionarse con el medio que le rodea; en el caso de las niñas o niños a desarrollar lenguaje oral, y los adultos que pierden la audición a presentar deterioro del lenguaje y problemas para relacionarse con las personas por la falta de retroalimentación auditiva.\nEl sentido de la audición es muy importante ya que nos permite comunicarnos, desenvolvernos social y laboralmente de forma adecuada e incluso es útil para mantener nuestra seguridad personal.\nCuando existe una pérdida auditiva (sordera) se pueden afectar este tipo de actividades que se realizan de forma cotidiana, además si no se corrige la pérdida auditiva (sordera) pueden aparecer problemas físicos como cansancio o fatiga, dolores de cabeza y estrés.\nEn el Estado de Guerrero de acuerdo al Censo de Población y Vivienda del año 2010, realizado por el INEGI, existe una población de 3´388,768 habitantes de los cuales 129,869 presentan algún tipo de discapacidad, el 56.4% padece discapacidad motriz, 24.4% visual, 11.4% auditiva 10.1% de lenguaje, 4.1% atienden su aseo personal, 9.3% mental y el 34.6% en otras causas no especificadas.\nEn base a estas estadísticas el Sistema para el Desarrollo Integral de la Familia (DIF) se ha dado a la tarea de prevenir, detectar y tratar la discapacidad auditiva a través de la donación de auxiliares auditivos. Mediante el Programa Adquisición de Aparatos Auditivos e Insumos para Moldes Auditivos, ha sido un Programa de continuidad por los resultados y logros obtenidos.\nEn consecuencia, la formulación de un programa de desarrollo social exige conjugar armónicamente todos los elementos que lleven a la materialización de sus objetivos, estrategias, metas y evaluación de resultados, mismo que tiene su origen en la Constitución Política de los Estados Unidos\nGeneral de Salud y Ley de Asistencia Social. Por ello, es un Programa el cual permitirá disminuir el impacto condiciones posibles para prevenir, compensar, disminuir o neutralizar una deficiencia, discapacidad o minusvalía, con el uso de las ayudas técnicas adecuadas permitirá a una persona con movilidad reducida\nSUS REGLAS DE OPERACIÓN PARA EL EJERCICIO\nFISCAL 2020 o persona mayor aumentar su capacidad funcional para la realización de las tareas cotidianas, por lo tanto, discapacidad en su entorno. Con la implementación de este Programa permitirá cumplir con uno de los objetivos del gobierno estatal el cual es abatir la marginación y el rezago social que enfrentan los grupos sociales vulnerables para proveerles de igualdad en las oportunidades que les permitan desarrollarse con independencia y plenitud.\nPor lo que se otorgarán 211 aparatos auditivos a personas en situación de riesgo o vulnerabilidad que presentan discapacidad auditiva total o parcial, que lo requieran para favorecer su rehabilitación e inclusión social, mejorando su calidad de vida y favoreciendo la igualdad de oportunidades, atendiéndose a los 81 municipios que integran el Estado, dando prioridad a los municipios de alta y muy alta marginación.\nGestionándose ante las instancias de Gobierno federales y estatales, los recursos financieros, para llevar a cabo la adquisición de los materiales, insumos y productos necesarios en la operatividad del\nPrograma; así mismo dar a conocer al Sistema Municipal DIF, las Reglas de Operación del programa vigente y proporcionar de forma calendarizada los suministros de los apoyos. Siendo el Sistema para el\nDesarrollo Integral de la Familia, a través de la Dirección de Servicios Médicos Asistenciales, quien se coordinará con los Sistemas Municipales DIF para llevar a cabo la ejecución y seguimiento del Programa.\nPara su operación se tiene contemplado una inversión de $1´238,198.20 (Un millón doscientos treinta y ocho mil ciento noventa y ocho pesos 20/100 M.N.), recursos presupuestales que provienen del Ramo 33.Aportaciones Federales para Entidades y Municipios, específicamente del Fondo de Aportaciones Múltiples\n(Asistencia Social).\nEn estas Reglas de Operación se plasma el siguiente glosario de términos:\nAsistencia Social: Conjunto de acciones tendientes a modificar y mejorar las circunstancias de carácter social que impiden el desarrollo social del individuo, así como la protección física, mental y social de personas en estado de necesidad.\nAparatos Funcionales: Son los instrumentos, dispositivos o herramientas que permiten a las personas con discapacidad temporal o permanente, realizar actividades como desplazarse, obtener movimiento, caminar, trabajar, escuchar, entre otras.\nAudición: Constituye los procesos psico-fisiológicos que proporcionan al ser humano la capacidad de oír.\nAuxiliares Auditivos: Es un dispositivo que recibe, amplifica y envía al oído el sonido que se produce en el ambiente.\nCONEVAL: Consejo Nacional de Evaluación de la Política de Desarrollo Social.\nCRIG: Centro de Rehabilitación Integral Guerrero.\nSUS REGLAS DE OPERACIÓN PARA EL EJERCICIO\nFISCAL 2020\nDiscapacidad: Alteración funcional permanente, transitoria o prolongada, motora, sensorial o mental que, en relación a su edad y medio social, implique desventajas considerables para su adecuada integración social o laboral.\nGrupos Vulnerables: Persona o grupo que por sus características de desventaja por edad, sexo, estado civil; nivel educativo, origen étnico, situación o condición física y/o mental; requieren de un esfuerzo adicional para incorporarse al desarrollo y a la convivencia.\nPobreza: Una persona se encuentra en situación de pobreza cuando presenta al menos una carencia social y no tiene un ingreso suficiente para satisfacer sus necesidades.\nPobreza Extrema: Una persona se encuentra en situación de pobreza extrema cuando presenta tres o más carencias sociales y no tiene un ingreso suficiente para adquirir una canasta alimentaria.\nPrograma: Programa Adquisición de Aparatos Auditivos e Insumos para Moldes Auditivos.\nReglas de Operación: Son un conjunto de disposiciones que precisan la forma de operar un programa, con el propósito de transparentar y normar la distribución y entrega de los apoyos.\nSecretaría de Contraloría: Secretaría de Contraloría y Transparencia Gubernamental.\nSEDIF: Sistema para el Desarrollo Integral de la Familia.\nSEFINA: Secretaría de Finanzas y Administración.\nSEPLADER: Secretaría de Planeación y Desarrollo Regional.\n1.2. Alineación programática\nEn cumplimiento a lo que globalmente prevén los ejes rectores del Plan Estatal de Desarrollo 20162021, Programa Adquisición de Aparatos Auditivos e Insumos para Moldes Auditivos se enmarca en el eje\nIII.- Guerrero Socialmente Comprometido; Objetivo 3.7. Fortalecer la asistencia social a grupos vulnerables;\nEstrategia 3.7.1. Atender integralmente a los grupos vulnerables y fomentar el acceso a los servicios de protección social que les permita mejorar su calidad de vida, a través de las Líneas de acción que vulnerabilidad, la cual mejorarán la atención de la salud a la población en situación de vulnerabilidad.\nDe igual manera se encuentran enmarcadas a lo estipulado en el Programa Sectorial “Desarrollo y Asistencia Social” que tiene como objetivo atender a personas vulnerables con carencias en materia de salud; así mismo se enmarca en el Programa Especial de Niñas, Niños, Adolescentes y Jóvenes 20162021, que contempla dentro de sus objetivos, fortalecer la participación para impulsar el desarrollo comunitario a través de esquemas de inclusión y cohesión social.\nSUS REGLAS DE OPERACIÓN PARA EL EJERCICIO\nFISCAL 2020\n1.3. Diagnóstico\nLos problemas auditivos interfieren con la calidad de vida de las personas, el Programa aparatos auditivos a pacientes menores de edad (lactantes, preescolares, escolares, adolescentes), adultos en edad activa y adultos mayores, identificando la causa de su patología y ofreciendo un tratamiento adecuado según su diagnóstico y si su estado es de vulnerabilidad.\nPocas personas pueden poner en duda que la audición es uno de los más preciados de los sentidos, por lo que algún padecimiento con la audición no solo limita al individuo que lo padece, sino que además altera la dinámica familiar y social. Una persona con disminución de la audición limita su contribución a la familia, y es marginada de actividades que requieran precisión del sentido del oído, evitando su aportación a la productividad en su vida cotidiana.\nEn el año 2010, el INEGI realizo el XIII Censo de Población en el Estado de Guerrero, el cual arrojó que había 31, 724 personas con discapacidad auditiva, lo cual representa el 24.4% respecto al total, en orden de importancia los municipios que tienen más personas con esta limitación física son: Acapulco de\nJuárez con 7,956 personas, Chilpancingo de los Bravo con 1,067 personas, Chilapa de Álvarez con 759 personas y Coyuca de Benítez con 572 discapacitados visuales, respectivamente.\nEn este sentido, el CRIG apertura un módulo de atención a personas que padecen deficiencia en la audición, dicho módulo de atención es representado por un Médico Especialista en Audiología, el cual procede a realizar valoración del paciente, posteriormente se establecerá un diagnostico a través de pruebas audiometricas completas, que nos permitirán proporcionarle un diagnóstico certero y así poder indicar adaptación unilateral o bilateral de aparatos auditivos, atendiendo el grado de afectación auditiva que presente cada paciente.\nEl Programa se lleva a cabo con recursos provenientes del Ramo XXXIII, se pretende donar auxiliares auditivos digitales, tomando como prioridad en nuestro Programa la población infantil, adolescentes, adultos activos y adultos mayores, de escasos recursos económicos.\nCon estas acciones, los beneficiarios se incorporarán nuevamente a sus actividades propias de la vida diaria, favoreciendo su productividad y desempeño, influyendo positivamente en sus relaciones familiares y sociales. Todas las personas, debemos estar seguros de que conservar nuestro sentido de la audición, debe ser una prioridad en cualquier etapa de la vida.\n2. Dependencia o entidad responsable del programa\nSerá el Sistema para el Desarrollo Integral de la Familia (DIF), a través de la Dirección de Servicios\nMoldes Auditivos, en apego a lo dispuesto en las presentes Reglas de Operación y demás normatividad aplicable, el cual tiene como fundamento legal para su creación y operación en:\nSUS REGLAS DE OPERACIÓN PARA EL EJERCICIO\nFISCAL 2020\n• Constitución Política de los Estados Unidos Mexicanos.\n• Ley General de Salud.\n• Ley de Asistencia Social.\n• Ley General para la Inclusión de las Personas con discapacidad.\n• Ley Número 817 para las Personas con Discapacidad del Estado.\n• Ley Número 479 del Sistema para el Desarrollo Integral de la Familia del Estado de Guerrero.\n• Ley Número 454 de Presupuesto y Disciplina Fiscal del Estado de Guerrero.\n• Ley Orgánica de la Administración Pública del Estado de Guerrero Número 08.\n• Ley Número 207 de Transparencia y Acceso a la Información Pública del Estado.\n• Ley sobre el Sistema Estatal de Asistencia Social Número 332.\n• Decreto Número 196 por medio del cual la Sexagésima Primera Legislatura al Honorable\n2016-2021.\n• Programa Sectorial Desarrollo y Asistencia Social 2016-2021.\n• Programa Sectorial “Salud y Seguridad Social” 2016-20121.\n• Decreto Número 447 del Presupuesto de Egresos del Estado de Guerrero para el Ejercicio Fiscal\n2020.\n• Estrategia Local “Guerrero Contigo”.\n• Reglamento Interior del Sistema para el Desarrollo Integral de la Familia del Estado de Guerrero.\n• Manual de Organización del DIF Guerrero.\n• Y todos aquellos ordenamientos normativos aplicables.\n3. Objetivos y alcances\n3.1. Objetivo general\nOtorgar aparatos auditivos a personas en situación de riesgo o vulnerabilidad que presentan discapacidad auditiva total o parcial.\n3.2. Objetivos específicos\n• Coadyuvar a la inclusión social, familiar y laboral de las personas con discapacidad auditiva.\n• Mejorar la funcionalidad auditiva de las personas.\n3.3. Alcances diagnóstico de hipoacusia y que se encuentren en estado de vulnerabilidad, a tendiendo a su derecho de seguridad social, a la no discriminación y derecho a la salud, persiguiendo como objetivo, cubrir las\nSUS REGLAS DE OPERACIÓN PARA EL EJERCICIO\nFISCAL 2020 plazo, en la manifestación de un buen desempeño, de su entorno familiar, social, educativo y laboral, de cada uno de estos pacientes, según la etapa de su vida que se encuentren. Permitiendo entonces que, a través de este programa social, pueda tener una alta repercusión en la No discriminación con estos pacientes, favoreciéndoles su calidad de vida y el derecho a obtener una vida laboral digna, alcanzar un buen desempeño en los ámbitos educativos y sociales.\nLa población objetivo como anteriormente ya se ha mencionado, la constituyen las personas en situación de riesgo o vulnerabilidad que presentan discapacidad auditiva congénita o adquirida de forma parcial o total, considerando el recurso presupuestal para el ejercicio vigente y los criterios de focalización y priorización del Programa.\n4. Metas físicas\nSe beneficiará aproximadamente a 211 personas con auxiliares auditivos digitales, para cubrir una sola campaña de este programa social, el total de población beneficiada quedaría a disposición del médico especialista en audiología. Con respecto a su valoración médica y necesidad del paciente de llevar una o dos adaptaciones de auxiliares auditivos.\n5. Programación presupuestal\nSe designa un presupuesto de acuerdo al Decreto Número 447 del Presupuesto de Egresos del\nEstado para el Ejercicio Fiscal 2019 de $1,238,198.20 (Un millón doscientos treinta y ocho mil ciento noventa y ocho pesos 20/100 M.N.), recursos presupuestales que provienen del Ramo 33.- Aportaciones\nFederales para Entidades y Municipios, específicamente del Fondo de Aportaciones Múltiples (Asistencia\nSocial), el cual permitirá la adquisición de un número aproximado de 211 auxiliares auditivos digitales, con un valor aproximado por cada auxiliar auditivo digital de $5,868.23 (Cinco mil ochocientos sesenta y ocho pesos 23/100 M.N.), recursos que se ejercerán bajo una política de gasto público, que permita dar cumplimiento a lo que globalmente prevén los ejes rectores del Plan Estatal de Desarrollo 2016-2021.\nCALENDARIO DE MINISTRACIÓN\nENERO FEBRERO MARZO ABRIL MAYO\n0.00 0.00 0.00 1,238,198.20 0.00\nNOTA: PUEDE EXISTIR VARIACIÓN EN RELACIÓN A LO APROBADO POR EL DOF. O A LAS PROPIAS\nNECESIDADES DEL SEDIF.\n6. Requisitos y procedimientos de acceso\n6.1. Difusión comunicación y redes sociales da conocer cada uno de los programas y/o proyectos de asistencia social que ejecuta y opera en coordinación con las Direcciones que lo integran; cuyos requisitos se encuentran en las oficinas ubicadas en Boulevard. Rene Juárez Cisneros, Colonia Ciudad de los Servicios y Av. Gabriel\nSUS REGLAS DE OPERACIÓN PARA EL EJERCICIO\nFISCAL 2020\nLeyva s/n esq. Ruffo Figueroa, Col. Burócratas, C.P. 39090, Chilpancingo, Guerrero, con un horario de atención de 8:00 am a 3:00 pm y/o los teléfonos 01(747) 4725595, 01(747)47256 00, 01(747)47 25672 ext.\n1151 y 1159. Así mismo al correo electrónico: alimentariadif@prodigy.net.mx, subdireccionalimentaria@prodigy.net.mx\nLas reglas de operación de los programas son difundidas por personal capacitado de las\nDirecciones y en la página web https://www.guerrero.gob.mx del Portal del Gobierno del Estado. Por otra parte, los programas tienen cobertura Estatal; los interesados deberán presentar oficio de solicitud en las instalaciones del Centro de Rehabilitación Integral Guerrero, ubicado en Boulevard Lic. René Juárez\nCisneros S/N, Col. Ciudad de los Servicios, Chilpancingo, dirigido a la Presidenta del DIF para ser considerado dentro del Programa.\n6.2. Requisitos de acceso\n1 Los interesados deberán acudir a las instalaciones del Centro de Rehabilitación Integral Guerrero\n(CRIG), en los horarios de 7:00 am a 2:00 pm, los cuales se les indicará pasar en primera instancia a la consulta de pre valoración con medicina general y si fuese necesario este mismo, lo remitirá al servicio de audiología, que también se encuentra en el mismo centro, donde se realizará evaluación especializada, para determinar presencia o no de pérdida auditiva y a qué grado de pérdida auditiva se encuentra en ese momento dicho paciente.\n2 Previo a la consulta de la especialista en audiología, se realizará una evaluación socioeconómica por parte del departamento de trabajo social, donde se determinará, el grado de vulnerabilidad económica que presente el paciente el cual determinaría su prioridad para ser beneficiado al Programa Donación de\nAparatos Auditivos Externos (A.A.E.) y si estos son derechohabientes del ISSSTE o Seguro Social, quedarían automáticamente fuera del Programa.\n3 Una vez de haber sido realizada la evaluación clínica especializada por parte del médico especialista en audiología, que integra los estudios audiológicos y en concordancia con el resultado de trabajo social, se determinará si el paciente entra al Programa, el cual se le pedirá de forma inmediata de forma personal la siguiente documentación, en periodos establecidos de precampaña:\n✓ Solicitud dirigida a la Sra. Mercedes Calvo de Astudillo, presidenta del patronato del DIF Guerrero y/o al Director General.\n✓ Copia fotostática de acta de nacimiento (nuevo formato).\n✓ Copia fotostática de CURP (nuevo formato).\n✓ Comprobante de domicilio (actualizado).\n✓ Fotografía a color y reciente de cuerpo completo en tamaño postal.\n✓ Proporcionar 2 números telefónicos, para poder localizar al paciente y citarlo con anticipación para la entrega de su aparato auxiliar.\n✓ Escanear esta documentación y entregar en formato PDF y guardar en un disco.\n✓ Entregar documentación en formato digital y en físico.\nSUS REGLAS DE OPERACIÓN PARA EL EJERCICIO\nFISCAL 2020\n4 El solicitante también puede ser captado en alguna jornada médica o puede ser remitido por un\nDIF Municipal, en ambos casos, deberá presentar la documentación antes referida y posteriormente ser valorado por el médico especialista en audiología.\n5 El solicitante no debe ser derechohabiente del ISSSTE o Seguro Social. Si perteneciera a una de estas dos instituciones de servicio médico, automáticamente quedaría fuera del Programa de beneficiados para la donación de aparatos auditivos. Por lo que se solicitará constancia de no derechohabiencia.\n6 Otro de los requisitos para poder acceder a este programa social, es verificar que el solicitante no haya sido beneficiado con uno o dos auxiliares auditivos, en 6 años anteriores, el cual es el tiempo establecido para volver a realizar una nuevamente la solicitud.\n6.3. Procedimiento de acceso\nLa creación del Programa Adquisición de Aparatos Auditivos e Insumos para Moldes Auditivos, obedece a la demanda ciudadana de la población que presentan problemas auditivos mismos que presenten un alto grado de vulnerabilidad económica y social. Integrando pacientes de todas las edades tales como: adultos mayores, adultos activos, adolescentes, escolares, preescolares y lactantes. Se lanzará convocatoria para ingreso de solicitudes en Periódico Oficial del Gobierno del Estado de Guerrero, en periodos establecidos por parte de la dirección de servicios médicos asistenciales del CRIG.\nLos interesados pueden llevar sus solicitudes en formato libre personalmente al área de servicios médicos asistenciales localizado en las instalaciones del CRIG, también pueden ser remitidos por los DIF de sus respectivos municipios y a través de ellos ingresar su solicitud así como también estos pacientes, pueden ingresar solicitudes por medio de las brigadas médicas o con los representantes de alguna asociación civil; todos los interesados además de cumplir con los procedimientos de acceso, deben cumplir con los siguientes criterios de aceptación y así lograr ser incluidos en el programa social de beneficiarios:\n1. Se incluirá en el padrón de beneficiarios a los pacientes que no sean derechohabientes del\nISSSTE ni Seguro Social. El cual serán valorados por el área de trabajo social del CRIG.\n2. La adaptación del auxiliar auditivo será uní o bilateral, de acuerdo a las necesidades y actividades de cada uno de los pacientes.\n3. Se le incluirá en el padrón de beneficiados a los pacientes que no hayan sido beneficiados durante los últimos 4 o 5 años por el mismo programa social.\n4. La indicación de la adaptación del auxiliar auditivo será una prescripción que quedará bajo la absoluta responsabilidad del médico especialista en audiología, sustentado por un estudio audiológico.\n5. Deberá presentar una pérdida auditiva media, severa, profunda y/o restos auditivos, y con respecto a su diagnóstico podrá ser unilateral o bilateral la adaptación del auxiliar auditivo, siempre y cuando exista perdida y que afecte su calidad de vida.\nSUS REGLAS DE OPERACIÓN PARA EL EJERCICIO\nFISCAL 2020 correspondientes, en el área de audiología localizada en el interior de las instalaciones del CRIG, en candidatos a recibir el beneficio del Programa, para lo cual los aspirantes deberán:\n1) Entregar sus solicitudes y documentación que se menciona anteriormente, en tiempo y forma en periodos de captación de posibles beneficiarios, dichos periodos de recepción de documentos serán establecidos por la dirección de servicios médicos asistenciales.\n2) Priorizaremos a los pacientes que estén inscritos previamente al servicio médico de audiología y que asistan sistemáticamente a sus consultas de valoración y seguimiento por parte del servicio de audiología.\n3) También priorizaremos a los pacientes que no pertenezcan a ninguna institución pública de salud: ISSSTE, Seguro Social, Militar, etc.\n4) Incluiremos como prioridad a los pacientes que no se hayan beneficiado por el mismo programa social en los 4 años anteriores a los que esté realizando la solicitud.\n5) Incluiremos con mayor prioridad a los pacientes que presenten un alto grado de vulnerabilidad económica y social.\n6) Tomaremos en cuenta como prioridad para incluir a los pacientes cuyas edades representen un mayor grado de exigencia de productividad en la sociedad, tales como: lactantes, preescolares, escolares, adolescente y adultos jóvenes.\nSe dará a conocer a través de sus representantes de sus DIF municipales o a sus familiares, si fueron o no aceptados al Programa, en caso de la negativa, se les explicará la razón del porque no fueron aceptados en el programa social. La dirección de servicios médicos asistenciales del DIF-CRIG, entregará un comprobante a cada paciente que haya realizado la solicitud para ingresar al programa social, una vez que haya completado su trámite.\nUna vez que las personas solicitantes son incorporadas al Programa, formarán parte de un Padrón\nÚnico de Beneficiarios, será de carácter público, siendo reservados sus datos personales, de acuerdo con la normatividad vigente; los cuales en ningún caso podrán emplearse para propósitos de proselitismo político, religioso o comercial, ni para ningún otro fin distinto al establecido en las presentes Reglas de\nOperación del Programa. manera diferente por parte de algún servidor público el desarrollo y operación del programa social, si no está sujeto a las Reglas de Operación. Se i\n6.4. Requisitos de permanencia, causales de baja o suspensión temporal. los lineamientos, causan baja o suspensión cuando el paciente no haya entregado su documentación requerida en los lineamientos en forma y tiempo. E incumplan con la asistencia a sus consultas médicas con la especialista en audiología. Los pacientes derechohabientes del ISSSTE y Seguro Social también\nSUS REGLAS DE OPERACIÓN PARA EL EJERCICIO\nFISCAL 2020 serán excluidos del programa social, (según constancia de no derechohabiente), así como también pacientes que hayan sido beneficiados de este programa social 5 o 4 años anteriores.\n6.5. Modos de entrega del beneficio\nEl solicitante deberá acudir al CRIG Guerrero donde se le entregará de manera directa el apoyo el cual puede ser en un evento organizado por la dirección del patronado del DIF Estatal o en el Centro de\nRehabilitación Integral Guerrero (CRIG) y la entrega será por única ocasión.\n7. Procedimientos de instrumentación\n7.1. Operación\n1. Todas las personas interesadas deberán acudir directamente al área de audiología localizada en las instalaciones del CRIG, entregar su documentación requerida según requisitos, establecidos en los numerales 6.2 y 6.3 anteriormente mencionados.\n2. El solicitante también puede ser captado en alguna jornada médica o puede ser remitido por un\nDIF Municipal, en ambos casos, también deberá presentar la documentación antes referida y también poder ser valorado por el médico especialista en audiología.\n3. Acudirá a una consulta de prevaloracion, el cual, le permitirá tener acceso a una consulta con el médico especialista en audiología, para que el mismo pueda realizarle las pruebas audiológicas necesarias y así poder brindarle un diagnóstico certero, dicho diagnóstico, será uno de los principales requisitos a solicitarle al paciente, inmediatamente después de la documentación, para determinar si el paciente es candidato o no a recibir un beneficio de donación de aparatos auditivos por parte del programa social establecido; reiterando que su acceso al Programa también estará determinado por su grado de vulnerabilidad económica y la constancia de no derechohabiente del ISSSTE o Seguro Social.\n4. Para los pacientes que hayan sido aceptados para ser beneficiados por este Programa, deberán presentarse en las instalaciones del CRIG, donde se les entregará de manera directa a través de evento organizado por la dirección del DIF y la entrega será por única ocasión, cuyos datos ministrados y del Estado de Guerrero; por otra parte, los formatos y los tramites a realizar son gratuitos.\n7.2. Gastos de operación\nSubsidiado a través del Ramo 33- del Fondo de Aportaciones Múltiples (FAM-Asistencia Social), destinados al Sistema DIF Guerrero para la operación del Programa, no contempla Gastos de Operación.\nSUS REGLAS DE OPERACIÓN PARA EL EJERCICIO\nFISCAL 2020\n8. Transparencia\n8.1. Difusión\nLa instancia responsable es la Dirección de Servicios Médicos, del CRIG-DIF. Quien difundirá a través de diferentes medios de comunicación; trípticos, periódico, redes sociales en las cuales se dará a conocer la información relacionada con las características del Programa Adquisición de Aparatos Auditivos e Insumos para Moldes Auditivos.\nAsí mismo se dará amplia difusión al Programa a nivel estatal y se promoverán similares acciones por parte de las autoridades locales; la información del Programa se dará a conocer en la página https://www.guerrero.gob.mx de internet del Gobierno del Estado, desagregada por municipio, barrio o zona urbano-marginada; por otra parte las copias de los expedientes de la población beneficiada estará disponible oportunamente para su consulta en las oficinas del Sistema ubicadas en Boulevard. Rene Juárez\nCisneros, Colonia Ciudad de los Servicios C.P. 39090, Chilpancingo, Guerrero; así mismo la papelería, documentación oficial, así como la publicidad y promoción de los programas, deberán incluir la leyenda descrita en el apartado de “Blindaje Electoral”.\nLa información de montos y beneficiarios deberá ser publicada en los términos de la Ley Número\n207 de Transparencia y Acceso a la Información Pública del Estado de Guerrero. El proceso de identificación de la población objetivo, será realizado en consenso con los Sistemas Municipales DIF e involucrando a la Secretaría de Salud que dentro de sus atribuciones les corresponda.\n8.2. Blindaje electoral\nLa operación y ejecución de los recursos destinados al Programa Adquisición de Aparatos\nAuditivos e Insumos para Moldes Auditivos, deberán observar y atender las medidas que emita la\nSecretaría de Contraloría y Transparencia Gubernamental, para coadyuvar a que éstos, no sean utilizados con fines políticos en el desarrollo de procesos electorales federales, estatales y municipales. Como estrategia de blindaje electoral, la papelería, documentación oficial, así como la publicidad y promoción del\nPrograma deberán incluir la siguiente leyenda:\n“Este programa es público, ajeno a cualquier partido político. Queda prohibido el uso para fines distintos a los establecidos en el programa”.\n8.3. Supervisión y control\nPlaneación del DIF Guerrero, las acciones ejercidas y los resultados obtenidos, quien a su vez reportará a la Secretaría de Planeación y Desarrollo Regional (SEPLADER), Secretaría de Finanzas y Administración\n(SEFINA) y a la Secretaría de Contraloría y Transparencia Gubernamental trimestralmente, informes sobre el presupuesto ejercido establecidos por el Consejo Nacional de Armonización Contable (CONAC) y con\nSUS REGLAS DE OPERACIÓN PARA EL EJERCICIO\nFISCAL 2020 base en los indicadores de resultados previstos en las Reglas de Operación; mismos que se deberán presentar a más tardar a los quince días hábiles posteriores a la terminación de cada trimestre.\nLos padrones de los beneficiarios serán requisitados por los Sistemas Municipales DIF, remitiendo para su revisión a este Sistema Estatal DIF en físico y digital para la integración de los padrones de beneficiarios de los 81 municipios de la entidad mismo que serán remitidos a las instancias o dependencias operadoras.\n8.4. Mecanismos de evaluación e indicadores\n8.4.1. Evaluación\nEl instrumento de medición de la evaluación del Programa Adquisición de Aparatos Auditivos e\nInsumos para Moldes Auditivos, se realizará mediante indicadores de acuerdo a la metodología del marco lógico los cuales serán reportados a la Dirección de Planeación para la integración de los informes correspondientes.\n8.4.2. Indicadores\nMATRIZ DE INDICADORES DE RESULTADOS\nLOGICA Objetivo Indicado Formula Tipo de Unidad de Medios de Unidad Supuestos\nH/LOGICA r de Calculo Indicado Medida Verificació Responsabl\nFortalecer la Mr*100/Mp asistencia Avance Dirección de Con la r sonas P a de través de acceso a beneficiadas Eficacia beneficiaria Asistenciales mejorar la fin acciones de los = Total de s Padrón de calidad de servicios servicios metas beneficiarios vida de los médicos de salud realizadas * beneficiarios\n100 / Total de personas programada\nMr*100/Mp\nLograr la\nFavorecer la Porcentaje Avance Dirección de inclusión a inclusión Personas de personas Físico y Servicios la sociedad social, sin beneficiadas Eficacia Personas Financiero Médicos mediante el mejorando la acceso a = Total de beneficiaria Asistenciales otorgamient y la igualdad servicios beneficiarios realizadas * de de salud\n100 / Total oportunidades. de personas programada\nSUS REGLAS DE OPERACIÓN PARA EL EJERCICIO\nFISCAL 2020\n1.ADQUISICIÓN\nY DONACIÓN\nDE SILLAS DE\nRUEDAS\n. AD\nDE APARATOS\n3.\nU NC\nDE APARATOS\n4.\nMr*100/Mp D ro p\nDE TOXINA\n\"\nPersonas P\nEficacia Personas Avance M c iales e acuer sin beneficiaria Físico y\nPERSONAS servicios metas Padrón de beneficiarios\nCON de salud realizadas * beneficiarios\nESPASTICIDAD 100 / Total\n5. JORNADAS de personas programada\nRODILLA s\n6. ADQUISICIÓN\nDE APARATOS\nAUDITIVOS E\nINSUMOS PARA\nMOLDES\nAUDITIVOS\nComponente 7. APOYO A\ns PACIENTES\nQUEMADOS Y/O\nADQUISICIÓN\nMEDICAMENTO\n8. ADQUISICIÓN\nDE PLACAS\nSUS REGLAS DE OPERACIÓN PARA EL EJERCICIO\nFISCAL 2020\nDENTALES\nPARA PERSONAS\nADULTAS\n9. ATENCIÓN A\nDÉBILES\nVISUALES\n(ADQUISICIÓN DE\nLENTES)\n10. ADQUISICIÓN\nDE MATERIAL\nRADIOLÓGICO\nY ANTÍGENO\nPROSTÁTICO\nPARA LA\nDETECCIÓN\nOPORTUNA DE\nCÁNCER\nMAMARIO Y DE\nPRÓSTATA\nSUS REGLAS DE OPERACIÓN PARA EL EJERCICIO\nFISCAL 2020\n1.1 Recepción de documentos\n1.2 Entrega de apoyos\n2.1 Recepción de\n.2 apoyos\n3.1 Recepción de documentos\n3.2 Entrega de apoyos\n4.1 Recepción de\n.2\nActividades apoyos Mr*100/Mp\n5.1 Recepción de documentos\n5.2 Entrega de Porcentaje Concluir apoyos\n6.1 Recepción de de personas Dirección al documentos\nPersonas beneficiada Avance de Servicios 100% las\n6.2 Entrega de apoyos sin s Físico Médicos metas\n7.1 Recepción de documentos acceso a = Total Eficacia Personas y Asistenciales programada\n7.2 Entrega de los de metas beneficiaria Financiero s teniendo apoyos\n8.1 Recepción de servicios realizadas s un documentos\n8.2 Entrega de de salud * Padrón de padrón de apoyos 100 / Total beneficiario beneficiario\n9.1 Recepción de documentos de personas s s\n9.2 Entrega de programada apoyos\n10.1 s\nRecepción de documentos\n10.2 Entrega de apoyos\n8.5. Auditoría\nEl ejercicio del recurso y la operatividad del Programa Adquisición de Aparatos Auditivos e\nInsumos para Moldes Auditivos, están sujetos a las disposiciones estatales aplicables y podrá ser auditado por la Secretaría de Contraloría y Transparencia Gubernamental, así como por la Auditoría Superior del\nEstado y Auditoría Superior de la Federación, conforme a la legislación vigente y en el ámbito de sus respectivas competencias.\nEl Sistema DIF Guerrero dará todas las facilidades a dichas instancias para realizar, en el momento en que lo juzguen pertinente, las auditorías que consideren necesarias; así como el seguimiento y la solventación a las observaciones planteadas por los órganos de control.\n8.6. Recursos no devengados y aquellos que por cualquier motivo no estuviesen devengados al 31 de diciembre del presente ejercicio fiscal.\nSUS REGLAS DE OPERACIÓN PARA EL EJERCICIO\nFISCAL 2020\n8.7. Contraloría social\nCon la finalidad de incrementar la participación ciudadana, se crearán comités de Contraloría\nSocial, como un órgano ciudadano de control, vigilancia y evaluación de las actividades del Programa, conformados por la población beneficiada, los sectores sociales, y los representantes de la localidad, quienes de manera especificas supervisarán la gestión gubernamental, y que el manejo de los recursos públicos se realicen en términos de transparencia, eficacia, legalidad y honradez; los objetivos específicos de este Órgano de Contraloría Social son:\n➢ Hacer más transparentes las decisiones y la ejecución de los recursos.\n➢ Incrementar la participación ciudadana.\n➢ Fomentar la organización social.\n➢ Inhibir los actos de corrupción y de cooptación social, política y electoral.\n➢ Incrementar la eficiencia de los recursos públicos.\n➢ Fortalecer la cultura de la legalidad.\n➢ Mejorar la rendición de cuentas.\n➢ Perfeccionar la democracia e incorporar la evaluación ciudadana.\n8.8. Formas de participación social\nCon apego en lo dispuesto en la Ley Número 684 de Participación Ciudadana del Estado Libre y\nSoberano de Guerrero, se establece que la sociedad podrá participar activamente en la Planeación, Programación, Implementación y Evaluación de los Programas Sociales de Desarrollo Social, por ello las beneficiarias y beneficiarios participarán en la etapa de la implementación y podrán supervisar la gestión gubernamental, que el manejo de los recursos públicos se realicen en términos de transparencia, eficacia, legalidad y honradez del Programa de acuerdo en lo estipulado en estas Reglas de Operación.\nParticipantes Etapa en la que participa Forma de Participación Modalidad\nBeneficiarias/ Beneficiarios Implementación Comités de Contraloría Seguimiento\nCon la finalidad de incrementar la participación ciudadana, se crearán comités de Contraloría\nSocial, como un órgano ciudadano de control, vigilancia y evaluación de las actividades del Programa, conformados por las beneficiarias y beneficiarios, los sectores sociales, y los representantes de la localidad, quienes de manera específica supervisarán la gestión gubernamental, y que el manejo de los recursos públicos se realice en términos de transparencia, eficacia, legalidad y honradez.\n8.9. Procedimiento de queja o inconformidad ciudadana sobre cualquier hecho, acto u omisión que produzca o pueda producir daños al ejercicio de sus derechos normatividad aplicable en:\nSUS REGLAS DE OPERACIÓN PARA EL EJERCICIO\nFISCAL 2020 a. El Sistema DIF Guerrero.\nDomicilio: Centro de Rehabilitación Integral Guerrero, Boulevard Lic. René Juárez Cisneros S/N, Col. Ciudad de los Servicios Chilpancingo, Guerrero; C.P. 39095. b. La Secretaría de Contraloría y Transparencia Gubernamental.\nTeléfonos: (474) 47 1 97 41\nCorreo electrónico: contraloria@guerrero.gob.mx\nDomicilio: Palacio de Gobierno Primer Piso Edificio Norte, Blvd. R. Juárez Cisneros No. 62, Col.\nCiudad de los Servicios, Chilpancingo, Guerrero. C.P. 39075.\nLas quejas y denuncias de la ciudadanía derivadas de alguna irregularidad en la operación del\nPrograma, podrán presentarse:\n• Por escrito.\n• Por comparecencia de la beneficiaria y/o beneficiario.\n• Por correo electrónico o vía telefónica.\nEl denunciante o quejoso deberá proporcionar los siguientes datos: nombre del servidor público, área de adscripción, objeto de la denuncia, nombre y domicilio del quejoso e identificación oficial.\n8.10. Mecanismos de exigibilidad\n1. Los requisitos y procedimientos para ser beneficiados por el Programa podrán ser solicitados en la Dirección de Servicios Médicos Asistenciales del DIF Guerrero ubicado en las instalaciones del CRIG\nChilpancingo, ubicado en Boulevard Rene Juárez Cisneros, Col. Ciudad de los Servicios, Chilpancingo, Guerrero.\n2. Los casos en los que se podrá exigir los derechos por incumplimiento o por violación de los mismos pueden ocurrir en al menos los siguientes casos:\n✓ Cuando una persona solicitante cumpla con los requisitos y criterios de inclusión para acceder a determinado derecho (garantizado por un programa social) y exija a la autoridad administrativa ser derecho habiente del mismo.\n✓ Cuando la persona derechohabiente de alguna instancia medica exija que se cumpla con dicho derecho, de manera integral en tiempo y forma, como lo establece el Programa.\n✓ Cuando no se pueda satisfacer toda la demanda de restricción presupuestal, y éstas exijan que las incorporaciones sean claras, transparentes, equitativas, sin favoritismos, ni discriminación. desarrollo social.\nSUS REGLAS DE OPERACIÓN PARA EL EJERCICIO\nFISCAL 2020\n8.11. Acta de entrega-recepción\nSe elaborará un acta de donación, en la que intervienen las instancias correspondientes; de presentar alguna irregularidad en la obra o acción, quien reciba, podrá firmar el acta de manera condicionada y anotar en ella las razones de dicha inconformidad. Además, se indicará los plazos acordados para solventar las observaciones a que dé lugar dicha inconformidad.\n9. Criterios de selección y elegibilidad\n9.1. Método de selección de beneficiarios\nRecibirán los apoyos, los solicitantes que cumplan con las siguientes características:\n1. Personas en estado de vulnerabilidad con discapacidad auditiva parcial o total.\n2. Cumplir con los requisitos establecidos en las presentes Reglas de Operación. (Reiterando que su acceso al programa social de beneficiarios, también estará determinado por su grado de vulnerabilidad económica y la constancia de no derechohabiente del ISSSTE o Seguro Social).\n10. Mecánica de operación\n10.1. Instancia ejecutora\nLa instancia ejecutora del Programa Adquisición de Aparatos Auditivos e Insumos para Moldes\nAuditivos será el Sistema para el Desarrollo Integral de la Familia a través de la Dirección de Servicios\nMédicos Asistenciales, quien deberá operar con apego a la programación, presupuestación, calendario de ejecución, ejercicio y control del gasto público.\n10.2. Instancia administrativa y/o normativas\nLa instancia administrativa y normativa será la Dirección General del Sistema DIF Guerrero y la objetivos y metas trazadas.\n10.3. Delimitación de atribuciones programas y acciones no se contrapongan, afecten o presenten duplicidades con otros programas o acciones del gobierno estatal; la coordinación institucional y vinculación de acciones busca potenciar el impacto de los recursos, fortalecer la cobertura de las acciones, detonar la complementariedad y reducir gastos administrativos.\nSUS REGLAS DE OPERACIÓN PARA EL EJERCICIO\nFISCAL 2020\n11. Derechos, obligaciones y sanciones de los beneficiarios de programas sociales\n11.1. Derechos\n1. Recibir trato digno, respetuoso y equitativo sin discriminación alguna, por el personal de las distintas áreas que participen dentro del Programa.\n2. Reserva y privacidad de la información personal.\n3. Acceder a la información necesaria del Programa, sus Reglas de Operación, recursos y cobertura.\n4. Solicitar y recibir información sobre el estado que guarda su trámite.\n5. Recibir los servicios y prestación del Programa conforme a las Reglas de Operación, salvo que le sea suspendido el apoyo por alguna razón justificable.\n11.2. Obligaciones\n• Proporcionar la información socioeconómica bajo protesta de decir verdad que les sea requerida por el DIF Guerrero, en los términos que establezca la normatividad correspondiente.\n• Utilizar los apoyos para los fines con que fueron autorizados evitando cualquier uso distinto de la misma.\n• Facilitar los trabajos de verificación, en cualquier momento después de otorgado el apoyo.\n11.3. Sanciones\nAuditivos, que incumplan en las disposiciones normativas establecidas en los numerales 6.2 y 6.3 para acceder a los beneficios que a través de estos se otorgan, perderán las prerrogativas que dichas disposiciones establecen.\n12. Interpretación\nAuditivos e Insumos para Moldes Auditivos, para efectos administrativos, estarán a cargo del DIF Guerrero y de la Secretaría de Contraloría y Transparencia Gubernamental, en el ámbito de sus respectivas competencias.\nSUS REGLAS DE OPERACIÓN PARA EL EJERCICIO\nFISCAL 2020\nSUS REGLAS DE OPERACIÓN PARA EL EJERCICIO\nFISCAL 2020\nPrimero. El presente Acuerdo entrará en vigor al día siguiente de su publicación en el Periódico\nSegundo. Se abroga el Acuerdo por el que se crea el Programa Adquisición de Aparatos Auditivos e Insumos para Moldes Auditivos y se emiten las Reglas de Operación para el Ejercicio Fiscal 2019, publicado en el Periódico Oficial del Gobierno del Estado de Guerrero No. 54 Alcance II, de fecha 05 de julio de\n2019.\nDado en la oficina del titular del Poder Ejecutivo, ubicada en el Edificio Centro de Palacio de\nGobierno, Boulevard René Juárez Cisneros No. 62, Colonia Ciudad de los Servicios en la Ciudad de\nChilpancingo de los Bravo, Capital del Estado de Guerrero, a los veintisiete días del mes de enero del año dos mil veinte.\nEL GOBERNADOR CONSTITUCIONAL DEL ESTADO DE GUERRERO.\nLIC. HÉCTOR ANTONIO ASTUDILLO FLORES.\nRúbrica.\nEL SECRETARIO GENERAL DE GOBIERNO.\nLIC. FLORENCIO SALAZAR ADAME.\nRúbrica.\nESTADO DE GUERRERO.\nLIC. JOSÉ FRANCISCO SOLÍS SOLÍS.\nRúbrica.",
  "ordenamiento": "PROGRAMA",
  "jurisdiccion": "GUERRERO",
  "fuente_oficial": "DIARIO OFICIAL DE LA FEDERACION",
  "Fecha de Publicación": "03 DE junio DE 2021",
  "ULTIMA REFORMA PUBLICADA": "03 DE junio DE 2021",
  "status": "ABROGADA",
  "es_escaneado": false,
  "tiene_tablas": true,
  "materia": [
    "general"
  ]
}