{
  "titulo": "Acuerdo por el Que Se Crea el Proyecto de Paquete de Aves de Doble Propósito, y Se Emiten Sus Reglas",
  "Contenido": "EJERCICIO FISCAL 2020\nPROPÓSITOS PARA EL PERIODO 2022, PUBLICADO EN EL PERIÓDICO OFICIAL DEL GOBIERNO\nTEXTO ORIGINAL.\nAcuerdo publicado en el Periódico Oficial del Gobierno del Estado No.70 Alcance I, el Martes 08 de Septiembre de 2020.\nACUERDO POR EL QUE SE CREA EL PROYECTO DE PAQUETE DE AVES DE DOBLE PROPÓSITO,\nY SE EMITEN SUS REGLAS DE OPERACIÓN PARA EL EJERCICIO FISCAL 2020.\nGuerrero.- Poder Ejecutivo.\nLICENCIADO HÉCTOR ANTONIO ASTUDILLO FLORES, GOBERNADOR CONSTITUCIONAL DEL\nESTADO DE GUERRERO, CON FUNDAMENTO EN LO DISPUESTO POR LOS ARTÍCULOS 4o DE LA\nSALUD; 3 DE LA LEY DE ASISTENCIA SOCIAL; 4 FRACCIÓN XVIII DEL PRESUPUESTO DE\nEGRESOS DE LA FEDERACIÓN PARA EL EJERCICIO FISCAL 2020; 40 DE LA LEY DE\nCOORDINACIÓN FISCAL; 71, 87, 88, 90 NUMERAL 2 Y 91 FRACCIONES I, IX Y XLVI DE LA\nLAS FACULTADES QUE ME CONFIEREN LOS ARTÍCULOS 2, 3, 6, 7, 10, 18 APARTADO A FRACCIÓN\nI, 20 FRACCIÓN III Y 45 DE LA LEY ORGÁNICA DE LA ADMINISTRACIÓN PÚBLICA DEL ESTADO\nDE GUERRERO NÚMERO 08; 15 DE LA LEY SOBRE EL SISTEMA ESTATAL DE ASISTENCIA SOCIAL\nNÚMERO 332; EN RELACIÓN CON EL ARTÍCULO 55 Y ANEXOS 21 Y 21-A DEL DECRETO NÚMERO\n447 DEL PRESUPUESTO DE EGRESOS DEL ESTADO DE GUERRERO PARA EL EJERCICIO FISCAL\n2020 Y LOS LINEAMIENTOS PARA LA ELABORACIÓN DE LAS REGLAS DE OPERACIÓN DE LOS\nPROGRAMAS SOCIALES ESTATALES PARA EL EJERCICIO FISCAL 2017.\nQue el Plan Estatal de Desarrollo 2016-2021 impulsa entre sus prioridades, un Guerrero que garantice el ejercicio efectivo de los derechos sociales de todos los guerrerenses, que vaya más allá del participación social en las políticas públicas.\nLa Constitución Política de los Estado Unidos Mexicanos establece en su artículo 4o que la mujer y el hombre son iguales ante la ley. Esta protegerá la organización y el desarrollo de la familia. asistencialistas y más estructurales para garantizar el desarrollo de quienes menos tienen. Con una\nEJERCICIO FISCAL 2020 en este sector, uno de los ejes que respaldan esta visión es el eje III.- Guerrero Socialmente Comprometido.\nObjetivo 3.7. Fortalecer la asistencia social a grupos vulnerables; Estrategia 3.7.1. Atender integralmente su calidad de vida.\nLa Ley Número 479 del Sistema para el Desarrollo Integral de la Familia del Estado de Guerrero publicada en el Periódico Oficial del Gobierno del Estado número 61 del 02 de agosto de 1983, creó el\nSistema Estatal para el Desarrollo Integral de la Familia, como un organismo público descentralizado, el cual tiene por objeto I.- Promover el bienestar social y prestar al efecto servicios de asistencia social con apoyo en las normas que dicte la Secretaría de Salubridad y Asistencia y el Sistema Nacional para el\nDesarrollo Integral de la Familia, así como el propio Estado; II.- Apoyar el desarrollo de la familia y de la comunidad; III.- Fomentar la educación, para la integración social; IV.- Impulsar el sano crecimiento físico y mental de la niñez; 2 V.- Atender las funciones de auxilio a las instituciones de asistencia privada que le confíe la dependencia competente, con sujeción a lo que disponga la Ley relativa; VI.- Operar establecimientos de asistencia social en beneficio de menores en estado de abandono, de ancianos y de los minusválidos; VII.- Realizar estudios e investigaciones sobre los problemas de la familia, de los menores, de los ancianos y de los minusválidos; VIII.- Prestar servicios de asistencia jurídica y de orientación social de los menores, ancianos y minusválidos sin recursos; IX.- Intervenir en el ejercicio de la tutela de los menores, que corresponda al Estado, en los términos de la Ley respectiva; X.- Auxiliar al\nMinisterio Público en la protección de incapaces y de los procedimientos civiles y familiares que les afecten, de acuerdo con la Ley; XI.- Procurar permanentemente la adecuación de los objetivos y programas del sistema estatal, a los que lleve a cabo el sistema nacional, a través de decretos, acuerdos, convenios o cualquier figura jurídica encaminada a la obtención de bienestar social, y, XII.- Los demás que les encomienden las Leyes.\nLas personas titulares de las secretarías, dependencias y entidades de la administración pública estatal, así como, las servidoras y servidores públicos autorizados para ejercer recursos públicos del presupuesto de inversión de las mismas, serán responsables de los programas y proyectos de inversión que realicen y que los apoyos otorgados deberán sujetarse a criterios de objetividad, equidad, transparencia, publicidad, selectividad y temporalidad.\nEl Presupuesto de Egresos de la Federación para el Ejercicio Fiscal 2020, contempla en un apartado que las erogaciones para el Ramo General 33 Aportaciones Federales para Entidades\nFederativas y Municipios, serán distribuidos conforme a lo previsto en el Anexo 22 de este Decreto, el cual se precisa en el Fondo de Aportaciones Múltiples erogaciones para asistencia social.\nEl artículo 55 del Decreto Número 447 de Presupuesto de Egresos del Estado de Guerrero, para el Ejercicio Fiscal 2020, establece que con el objeto de asegurar la aplicación eficiente, eficaz, oportuna inversión sujetos a reglas de operación.\nEJERCICIO FISCAL 2020\nCon sustento en lo anterior, la Secretaría de Planeación y Desarrollo Regional, expidió los\nLos objetivos del programa y/o proyecto deberán desarrollarse de manera eficaz y oportuna a fin de consolidar la política estatal ya que dentro de los objetivos y estrategias que plantea el ejecutivo estatal, es abatir la marginación y el rezago social que enfrentan los grupos sociales vulnerables para proveerles de igualdad en las oportunidades que les permitan desarrollarse con independencia y plenitud, es por ello que surge este Proyecto con el propósito de mitigar los impactos económicos sociales por las que atraviesan las personas que habiten en zonas rurales, mediante la entrega de proyectos productivos y de servicios.\nEn el Decreto Número 447 del Presupuesto de Egresos del Estado de Guerrero para el Ejercicio\nFiscal 2020, señala que se ejercerán los recursos bajo una política de gasto público, que permita dar cumplimiento a lo que globalmente prevén los ejes rectores del Plan Estatal de Desarrollo 2016-2021.\nEn cumplimiento de lo anterior, se ha tenido a bien expedir el siguiente:\nACUERDO POR EL QUE SE CREA EL PROYECTO DE PAQUETE DE AVES DE DOBLE PROPÓSITO,\nY SE EMITEN SUS REGLAS DE OPERACIÓN PARA EL EJERCICIO FISCAL 2020.\nArtículo 1. Se crea el Proyecto Paquete de Aves de Doble Propósito, el cual tiene por objeto contribuir a disminuir la desigualdad social entré los guerrerenses, respondiendo de manera cabal a sus expectativas de cambio; articuladora de esfuerzos, incluyente, con rostro humano.\nArtículo 2. Se emiten las Reglas de Operación del Proyecto de Paquete de Aves de Doble\nPropósito, en los que se establecen los principios de eficiencia, eficacia, oportunidad, equitativa y transparencia de los recursos públicos y requisitos que se deben de cumplir para poder acceder ha dicho\nProyecto.\nEn las Reglas de Operación se establecen disposiciones que instituyen la ejecución del Proyecto de Paquete de Aves de Doble Propósito, con el objeto de otorgar transparencia y asegurar la aplicación, eficiente, eficaz, oportuno y equitativo de los recursos públicos asignados al mismo, los cuales deberán\nArtículo 3. El Sistema para el Desarrollo Integral de la Familia del Estado de Guerrero tendrá a cargo la implementación, ejecución, evaluación y administración del Proyecto de Paquete de Aves de Doble\nPropósito, bajo los criterios de objetividad, equidad, transparencia, publicidad, selectividad y temporalidad, con estricto apego a la normatividad aplicable, por lo tanto, será el encargado de la dispersión y asignación de los recursos del Proyecto apegándose plenamente a las siguientes:\nEL EJERCICIO FISCAL 2020.\nEJERCICIO FISCAL 2020\n1. Introducción\n1.1. Antecedentes\nEl DIF Guerrero, a través de la Dirección de Asistencia Alimentaría y Desarrollo Comunitario, social, y tiene como intención apoyar y coordinar las acciones de desarrollo comunitario en las que participan los tres niveles de gobierno (Federal, Estatal y Municipal) dentro del ámbito de su competencia, en coordinación con los Sistemas Municipales DIF.\nEn este documento se sustenta la intervención institucional así mismo, se especifica la participación básica de llevar a cabo entre los Sistemas Municipales DIF que desde el ejercicio fiscal 2012 ha venido atendiendo a la población en situaciones de vulnerabilidad, con el objetivo de realizar proyectos productivos y de servicios.\nPor lo que el Proyecto de Paquete de Aves de Doble Propósito tiene como prioridad la atención a aquellas familias en estado de vulnerabilidad social que habiten en localidades de alto y muy alto grado de marginación; cuyo objetivo es, fomentar el autoempleo y consumo como un elemento clave para que las familias que viven en condiciones de desventaja socioeconómica mejoren sus niveles de vida.\nEn consecuencia, la formulación de un proyecto de desarrollo social exige conjugar armónicamente todos los elementos que lleven a la materialización de sus objetivos, estrategias, metas y evaluación de resultados por lo que plantea elevar la productividad de las personas para que cuenten con mejores opciones de empleo e ingreso, que les permitan reducir sus niveles de pobreza, es por ello que surge este Proyecto con el propósito de disminuir el impacto del desempleo temporal ya que brinda a las familias la oportunidad de auto emplearse y/o generar empleo que mitiguen los impactos económicos sociales por las que atraviesan. Para su creación y ejecución tiene como fundamento jurídico a la de Guerrero, última reforma publicada en el Periódico Oficial del Gobierno del Estado número 71, alcance\nI de fecha 04 de septiembre de 2018, Ley General de Salud y Ley de Asistencia Social.\nPara lograr o contribuir con los objetivos que marca el Plan Estatal de Desarrollo, se pretende apoyar a 394 familias para que tengan un negocio propio, así como crear fuentes de empleo y/o autoempleo que coadyuven en su ingreso familiar, como precedente de sustentabilidad laboral, en el que se atenderán a los 81 municipios que integran el Estado, dando prioridad a los municipios de alta y muy alta marginación. llevar a cabo la adquisición de los materiales, insumos y productos necesarios en la operatividad del\nProyecto; así mismo se dará a conocer al Sistema Municipal DIF, las Reglas de Operación del Proyecto y proporcionar de forma calendarizada los suministros de los apoyos.\nLa instancia ejecutora será el Sistema para el Desarrollo Integral de la Familia, a través de la\nDirección de Asistencia Alimentaria y Desarrollo Comunitario, quien se coordinará con los Sistemas\nMunicipales DIF para llevar a cabo la ejecución y seguimiento del Proyecto, el cual tiene contemplado una\nEJERCICIO FISCAL 2020 inversión de $2,076,440.00 (Dos millones setenta y seis mil cuatrocientos cuarenta pesos 00/100 M.N.), recursos presupuestales que provienen del Ramo 33.- Aportaciones Federales para Entidades y\nMunicipios, específicamente del Fondo de Aportaciones Múltiples (Asistencia Social).\nGlosario de términos:\nAsistencia Social: Conjunto de acciones tendientes a modificar y mejorar las circunstancias de carácter social que impiden el desarrollo social del individuo, así como la protección física, mental y social de personas en estado de necesidad.\nDIF Guerrero: Sistema para el Desarrollo Integral de la Familia.\nGrupos Vulnerables: Persona o grupo que, por sus características de desventaja por edad, sexo, estado civil; nivel educativo, origen étnico, situación o condición física y/o mental; requieren de un esfuerzo adicional para incorporarse al desarrollo y a la convivencia.\nProyecto: Proyecto de Paquete de Aves de Doble Propósito.\nReglas de Operación: Reglas de Operación del Proyecto de Paquete de Aves de Doble\nPropósito.\nSecretaría de Contraloría: Secretaría de Contraloría y Transparencia Gubernamental.\nSEDIF: Sistema para el Desarrollo Integral de la Familia.\nSEFINA: Secretaría de Finanzas y Administración.\nSEPLADER: Secretaría de Planeación y Desarrollo Regional.\n1.2. Alineación programática\nEn cumplimiento a lo que globalmente prevén los ejes rectores del Plan Estatal de Desarrollo 20162021, el Proyecto de Paquete de Aves de Doble Propósito, se alinea en el eje III.- Guerrero Socialmente\nComprometido; Objetivos: 3.1. Construir un Estado Garante de los Derechos Sociales de las Personas y\n3.2. Edificar la ruta hacia una sociedad equitativa e incluyente; Estrategias: 3.1.2. Fortalecer el desarrollo de capacidades de los integrantes de una sociedad con carencias, que permitan contribuir a incrementar su capacidad productiva y su calidad de vida y 3.2.1. Generar programas de desarrollo comunitario por medio de procesos de participación social; a través de:\n• Fomentar el acceso efectivo de las familias a sus derechos sociales, particularmente de aquellas en pobreza extrema, mediante políticas públicas coordinadas y concurrentes.\n• Potenciar la inversión conjunta de la sociedad organizada y de los órdenes de Gobierno, invirtiendo en proyectos de infraestructura social básica, complementaria y productiva.\nEJERCICIO FISCAL 2020\nAsí mismo, se alinean a lo estipulado en el Programa Sectorial “Desarrollo y Asistencia Social”\n2016-2021, cuyo objetivo es atender a personas vulnerables, a través de desarrollar capacidades y su calidad de vida y sus núcleos familiares, logrando fortalecer el tejido social en localidades vulnerables.\n1.3. Diagnóstico\nEl alto nivel de informalidad de la economía nacional y la marginación de numerosos municipios y localidades a lo largo de todo el país, provoca que la inestabilidad del empleo sea considerada como uno de los principales motivos de preocupación dentro de los hogares mexicanos; que la pérdida del empleo y la consecuente disminución de los ingresos aún de manera temporal tienen graves consecuencias sobre la pobreza de los hogares, fundamentalmente porque la falta de empleo conduce a una importante disminución del capital económico familiar, mayor presión sobre los recursos naturales, así como el abandono de la educación y el fomento al endeudamiento, estas afectaciones frecuentemente persisten aun cuando sus miembros se reintegran a las actividades productivas y remuneradas.\nQue la oferta laboral puede disminuir en algunas regiones del Estado a lo largo del año debido a emergencias o por efecto de los ciclos productivos, afectando principalmente a la población de escasos recursos que enfrenta periódicamente etapas con una grave disminución en sus ingresos y patrimonio.\nPor ello las políticas de empleo estatal deben considerar además del fomento a la creación de empleos formales e informales, la ejecución de acciones que permitan disminuir el impacto del desempleo temporal; una de las alternativas para enfrentar dicho fenómeno es la implementación del Proyecto que brinden a los hogares auto emplearse y/o generar empleo que mitiguen los impactos económicos sociales.\nQue el diseño del Proyecto de Paquete de Aves de Doble Propósito implica que, los posibles beneficiarios deben participar en proyectos de beneficio familiar o comunitario como corresponsabilidad obligatoria para recibir los apoyos que se les otorgue. Este requisito no solamente promueve la participación activa de los ciudadanos en el desarrollo de sus hogares y comunidades, sino que además genera beneficios adicionales al resto de la sociedad en función de los proyectos ejecutados.\nQue dentro de los objetivos y estrategias que plantea el ejecutivo estatal, está abatir la marginación oportunidades que les permitan desarrollarse con independencia y plenitud; asimismo, plantea elevar la productividad de las personas para que cuenten con mejores opciones de empleo e ingreso, que les permitan reducir sus niveles de pobreza.\nEl trabajo informal en países de economía subdesarrollada como México, está altamente asociada con el autoempleo, la carencia de plazas laborales que brinden una mayor seguridad salarial y mejores condiciones de trabajo orilla a casi el 60% de los buscadores de empleo a resolver por sí mismos su y de servicios.\nEJERCICIO FISCAL 2020\nEn el Estado existen 895, 157 hogares de los cuales 293 086 están conformadas por Jefas de\nFamilias que es el 33% y 602 071, se conforman por Jefes de Familia que en términos porcentuales le corresponde el 67% razón por la cual el Sistema para el Desarrollo Integral de la Familia beneficiará a 394 marginación, considerando la suficiencia presupuestal para el ejercicio vigente y los criterios de focalización y priorización.\nA continuación, se detalla el número de beneficiarios del Proyecto durante el periodo 2016-2019, dando un total de 1685 familias atendidas de acuerdo al cuadro que se desglosa a continuación.\nEjercicio Fiscal Número de Beneficiarios\n2016 400\n2017 461\n2018 410\n2019 414\n2. Dependencia o entidad responsable del proyecto\nLa instancia ejecutora será el Sistema para el Desarrollo Integral de la Familia, a través de la\nDirección de Asistencia Alimentaria y Desarrollo Comunitario quien se coordinará con los Sistemas\nMunicipales DIF para llevar a cabo la ejecución y seguimiento del Proyecto, el cual tiene fundamento legal para su creación y ejecución el siguiente:\n• Constitución Política de los Estados Unidos Mexicanos.\n• Ley General de Salud.\n• Ley de Asistencia Social.\n• Ley General para la Inclusión de las Personas con discapacidad.\n• Ley Número 817 para las Personas con Discapacidad del Estado.\n• Ley Número 479 del Sistema para el Desarrollo Integral de la Familia del Estado de Guerrero.\n• Ley Número 454 de Presupuesto y Disciplina Fiscal del Estado de Guerrero.\n• Ley Orgánica de la Administración Pública del Estado de Guerrero Número 08.\n• Ley Número 207 de Transparencia y Acceso a la Información Pública del Estado.\n• Ley sobre el Sistema Estatal de Asistencia Social Número 332.\n• Decreto Número 196 por medio del cual la Sexagésima Primera Legislatura al Honorable\n2016-2021.\n• Programa Sectorial Desarrollo y Asistencia Social 2016-2021.\n• Decreto Número 447 del Presupuesto de Egresos del Estado de Guerrero para el Ejercicio Fiscal\n2020.\n• Estrategia Local “Guerrero Contigo”.\n• Reglamento Interior del Sistema para el Desarrollo Integral de la Familia del Estado de Guerrero.\nEJERCICIO FISCAL 2020\n• Manual de Organización del DIF Guerrero.\n• Y todos aquellos ordenamientos normativos aplicables.\n3. Objetivos y alcances\n3.1. Objetivo general\nContribuir al gasto de 394 familias de la población que vive en condiciones de pobreza y/o que no cuente con empleo a través de paquete de aves de doble propósito, para que tengan un negocio propio, así como crear fuentes de empleo y autoempleo que coadyuven en su ingreso familiar.\n3.2. Objetivos específicos\n• Generar una alternativa de autoempleo como precedente de sustentabilidad laboral.\n• Incrementar el ingreso familiar.\n• Brindar un servicio básico.\n3.3. Alcances\nLa operación o ejecución del Proyecto surge para mitigar y garantizar el empleo y/o autoempleo atendiendo el derecho al trabajo y a la alimentación de la población que viven en situación de pobreza y/o sin empleo a través de la dotación de 394 paquetes de aves doble propósito para que mejoren su economía familiar y comunitaria.\nLa población objetivo la constituyen las familias que habiten en municipios o localidades con alto o muy alto grado de marginación, considerando la suficiencia presupuestal para el ejercicio vigente y los criterios de focalización y priorización del Proyecto.\n4. Metas físicas\nPara el presente ejercicio fiscal 2020, se espera beneficiar aproximadamente a 394 familias que habiten en municipios y/o localidades de alta y muy alta marginación con vulnerabilidad social.\n5. Programación presupuestal\nEl Decreto Número 447 del Presupuesto de Egresos del Estado de Guerrero para el Ejercicio\nFiscal 2020 señala que se ejercerán los recursos bajo una política de gasto público, que permita dar cumplimiento a lo que globalmente prevén los ejes rectores del Plan Estatal de Desarrollo 2016-2021.\nLos recursos presupuestales provienen del Ramo 33.- Aportaciones Federales para Entidades y\nMunicipios, específicamente del Fondo de Aportaciones Múltiples (Asistencia Social), para la operación del\nProyecto de Paquete de Aves de Doble Propósito se tiene una inversión $2,076,440.00 (Dos millones setenta y seis mil cuatrocientos cuarenta pesos 00/100 M.N.) y un costo promedio de $5,270.15 (Cinco mil doscientos sesenta 15/100 M.N.).\nEJERCICIO FISCAL 2020\nENE FEB MAR ABRIL MAY JUN\n0.00 0.00 0.00 2,076,440.00 0.00 0.00\nNOTA: PUEDE EXISTIR VARIACION EN RELACION A LO APROBADO POR EL DOF Y/O PORLAS NECESIDADES\nPROPIAS DEL SEDIF DE MAYO A DICIEMBRE NO SE SOLICITAN RECURSOS.\n6. Requisitos y procedimientos de acceso\n6.1. Difusión\nEl Sistema para el Desarrollo Integral de la Familia a través de los diferentes medios de comunicación y redes sociales da conocer los diferentes los programas y proyectos de asistencia social que ejecuta y opera en coordinación con las Direcciones que integran el Sistema; cuyos requisitos se encuentran en las oficinas ubicadas en Boulevard. Rene Juárez Cisneros, Colonia Ciudad de los Servicios y en Av. Gabriel Leyva s/n esq. Ruffo Figueroa, Col. Burócratas, C.P. 39090, Chilpancingo, Guerrero, con un horario de atención de 8:00 am a 3:00 pm y/o los teléfonos 01(747) 4725595, 01(747)47256 00, 01(747)47 25672 ext. 1151 y 1159. Así mismo al correo electrónico: alimentariadif@prodigy.net.mx, subdireccionalimentaria@prodigy.net.mx\nLas reglas de operación de los programas y proyectos serán difundidas por personal capacitado, así mismo en la página web https://www.guerrero.gob.mx del Portal del Gobierno del Estado. Por otra parte, los proyectos tienen cobertura estatal.\n6.2. Requisitos de acceso\n• Los interesados deberán presentar oficio de solicitud en las instalaciones del DIF Guerrero con domicilio en el Centro de Rehabilitación Integral Guerrero, Boulevard Lic. René Juárez Cisneros S/N, Col.\nCiudad de los Servicios, Chilpancingo, dirigido a la Presidenta o Director General del DIF para ser considerado dentro del Proyecto, anexando copia fotostática de la siguiente documentación:\n1. Credencial de elector.\n2. CURP.\n3. Comprobante de domicilio.\n• La solicitud es turnada a la Dirección de Asistencia Alimentaria y Desarrollo Comunitario para su atención, quien en un plazo no mayor a 60 días hábiles dará respuesta a la misma.\n• La Dirección de Asistencia Alimentaria y Desarrollo Comunitario aplica estudio socioeconómico al solicitante para determinar si será beneficiario o no.\n• Se realiza la entrega del apoyo de manera personal o en el municipio beneficiado, solicitándole a la población beneficiada firme acta de donación que acredite la entrega.\n6.3. Procedimiento de acceso\nEJERCICIO FISCAL 2020\nSe realiza a través de la demanda ciudadana y/o peticiones que se reciben en las instalaciones del Sistema para el Desarrollo Integral de la Familia o directamente a la Presidenta del Sistema Estatal.\nLa operación del Proyecto de Paquete de Aves de Doble Propósito, surge por la necesidad de atender el problema del desempleo y atendiendo la carencia alimentaria, el cual busca garantizar el derecho a la alimentación a la población vulnerable atendiendo a los 81 municipios que conforman nuestro Estado, dando prioridad a los municipios de alta o muy alta marginación.\nSerán beneficiados con el apoyo del Proyecto, las personas que cumplan con las siguientes características y con la disponibilidad presupuestal del Proyecto:\n1. Familias en estado de vulnerabilidad, mujeres embarazadas, mujeres en periodo de lactancia, adultos mayores y personas vulnerables por ingresos o que presenten alguna discapacidad y no puedan tener un empleo formal.\n2. Habitar en el municipio o localidad de alto, muy alto grado de marginación.\nToda persona podrá conocer el estado de su trámite, y su aceptación o no al Proyecto, de acuerdo con las Reglas de Operación vigentes. La población beneficiada, tendrán derecho a ser tratado con respeto, dignidad y a recibir los servicios que se ofrecen; así como a:\n• Recibir la información necesaria de manera clara y oportuna para participar en el Proyecto.\n• Un trato digno y respetuoso oportuno con calidad y equitativo sin discriminación alguna.\n• Reserva y privacidad de su información personal.\nLa población beneficiada pasará a formar parte del padrón de beneficiarios, el cual será de carácter público, siendo reservados sus datos personales, de acuerdo con la Ley Número 207 de Transparencia y\nAcceso a la Información Pública del Estado de Guerrero.\n6.4. Requisitos de permanencia, causales de baja o suspensión temporal\nVisita de seguimiento a la población beneficiada, con la finalidad de constatar la situación socioeconómica y seguimiento a las necesidades prioritarias, la población sujeta de atención deberá cumplir con:\n• Utilizar los apoyos otorgados de manera adecuada y para los fines a los que se les otorgan y con que fueron autorizados evitando cualquier uso distinto de la misma. Los cuales en ningún caso podrán emplearse para propósitos de proselitismo político, religioso o comercial, ni para ningún otro fin distinto al establecido en las Reglas de Operación del proyecto social.\n• Permitir visita de verificación con la finalidad de validar la información proporcionada en sus expedientes\n• correspondientes.\n• Facilitar los trabajos de supervisión, en cualquier momento después de haber recibido el apoyo.\nEJERCICIO FISCAL 2020\n• La población beneficiaria del Proyecto de Paquetes de Aves Doble Propósito, que incumplan en las disposiciones normativas de estas Reglas de Operación, perderán las prerrogativas que dichas disposiciones establezca.\n6.5. Modos de entrega del beneficio\nLos apoyos serán distribuidos directamente a la población beneficiada en puntos sedes de cada\nRegión del Estado, o en su caso, podrán acudir a recoger el apoyo a las oficinas de la Dirección de\nAsistencia Alimentaria y Desarrollo Comunitario.\nComo objetivo a corto plazo, se dará continuidad a la entrega de cada apoyo solicitado, cubriendo cada uno los requisitos solicitados en las presentes Reglas de Operación, mismos que será otorgado en su municipio de residencia o en su caso en el almacén general del Sistema Estatal a la población vulnerable.\nSe podrá atender de manera inmediata la demanda ciudadana que se genere en las visitas que realicen las autoridades estatales en giras de trabajo en los municipios o comunidades, siempre y cuando cubran cada uno los requisitos solicitados en las presentes Reglas de Operación.\n7. Procedimientos de instrumentación\n7.1. Operación\nEl Sistema Estatal DIF tendrá las siguientes responsabilidades:\na) Gestionar ante las instancias de Gobierno federales y estatales, los recursos financieros, para llevar a cabo la adquisición de los materiales, insumos y productos necesarios en la operatividad del\nProyecto.\nb) Dar a conocer al Sistema Municipal DIF, las Reglas de Operación del Proyecto de Paquete de Aves de Doble Propósito vigentes.\nc) Proporcionar al Sistema Municipal DIF, de forma calendarizada los suministros de productos del Proyecto.\nd) Vigilar y verificar que los apoyos sean otorgados directamente a los beneficiarios.\ne) Proporcionará almacenes regionales, para guarda, custodia de los productos que integran el Proyecto; que contarán con personal capacitado para su manejo y distribución.\nf) Actualizar y profesionalizar los conocimientos del personal operativo del Sistema Estatal DIF y del Sistema Municipal DIF, a través de capacitaciones a fin de contar con las herramientas básicas para la operatividad de los programas y/o proyectos.\ng) Recepcionar de los Sistema Municipal DIF la información requerida para comprobación del\nProyecto con base a las Reglas de Operación vigentes.\nh) Procesará la información a que se refiere el punto anterior y remitirla de acuerdo al calendario de entregas, a fin de comprobar los recursos canalizados al municipio.\nEJERCICIO FISCAL 2020\ni) Elaborar a inicio de cada ejercicio fiscal, el Proyecto que contemplarán la aplicación y operatividad de los proyectos con los importes correspondientes.\nj) Proporcionar cursos de capacitación al personal de Sistema Municipal DIF, relativos a la operatividad de los programas y/o proyectos; así como asesoramiento en la elaboración propuesta de proyectos.\nSerán obligaciones del Sistema Municipal DIF las siguientes: a. El Sistema Municipal DIF se obliga a cumplir con la implementación de las Reglas de Operación del Proyecto que lo regula. b. Determinará de manera conjunta la población potencial de su municipio tomando en consideración el tipo de beneficiario de todos los proyectos a solicitar, con esta información y en coordinación con el Sistema Estatal DIF, atenderá a la población que se encuentre en situación de vulnerabilidad de localidades de alta y muy alta marginación. c. Integrará y enviará los expedientes, así como los padrones físicos de los beneficiarios de los proyectos solicitados a la Subdirección de Desarrollo Comunitario, de igual forma informará a los beneficiarios que los datos personales recabados serán protegidos en términos de los principios de protección de datos personales contenidos en la ley de la materia y demás normativas aplicables. d. Integrará los padrones de los beneficiarios con sus respectivos expedientes del Proyecto objeto de estas Reglas de Operación. Remitiendo al Sistema Estatal DIF el padrón físico, digital y expedientes correspondiente a la comprobación del Proyecto. e. Designar personal del Sistema Municipal DIF que realice las funciones de seguimiento y supervisión de los proyectos. f. Participar en acciones de apoyo logístico para la distribución de los proyectos. g. Es competencia del Sistema Municipal DIF, trasladar los materiales que corresponden a los programas, a las comunidades beneficiadas, en una unidad vehicular. Será responsabilidad del municipio el resguardo y el buen uso de los materiales que se recepcionen, en el entendido que, de existir algún desvío de los mismos, el Sistema Estatal DIF cancelará inmediatamente el suministro del Proyecto e iniciará un procedimiento ante la contraloría interna del sistema estatal, para determinar las sanciones a que sean acreedores.\nPara garantizar la atención completa del beneficiario, se realizan las acciones:\n• Determinar el tipo de proyectos a implementar.\n• Adquisición de los materiales y que cumplan con las Especificaciones Técnicas de Calidad.\n• Asegurar el correcto almacenamiento y distribución de los materiales, hasta su entrega al beneficiario.\n• Focalizar los beneficiarios de los proyectos con base a los indicadores socioeconómicos.\n• Coordinar la entrega de apoyos a la población beneficiada con los Sistemas Municipales DIF, a través de convenios de colaboración y conforme a lo establecido en las Reglas de Operación.\n• Promover la participación social a través de los\nSistema Municipal DIF en la formación de comités entre la población beneficiaria, para la recepción, entrega y vigilancia de los apoyos.\nEJERCICIO FISCAL 2020\n• Promover la formación y operación de grupos de contraloría social para el seguimiento del\nProyecto.\n• Fortalecer la operación de los proyectos promoviendo la inclusión general de la sociedad.\nLos datos de la población beneficiada, así como la información generada y administrada se regirán por la Ley Número 207 de Transparencia y Acceso a la Información Pública del Estado de Guerrero.\nEl presente Proyecto de Paquete de Aves de Doble Propósito, contempla las herramientas necesarias para desempeñar un autoempleo y mejorar la economía familiar y comunitaria mediante el otorgamiento de:\n✓ 15 Aves hembras de 11 a 12 semanas de edad\n✓ 5 Aves machos de 11 a 12 semanas de edad\n✓ 1 Rollo de malla para gallinero de 45 metros.\n✓ 2 Bultos de alimento para crecimiento de 40 kg. c/u\n✓ 2 Comederos con capacidad de 5 kilos en forma de tolva\n✓ 2 Bebederos con capacidad para 5 litros de agua.\nComo objetivo a corto plazo, se dará continuidad a la entrega de cada apoyo solicitado, cubriendo cada uno los requisitos solicitados en las presentes Reglas de Operación, mismos que será otorgado en su municipio de residencia o en su caso en el almacén general del Sistema Estatal a la población vulnerable.\n7.2. Gastos de operación\nEl presupuesto asignado a este Proyecto, es a través del Fondo de Aportaciones Múltiples.Asistencia Social, no contempla Gastos de Operación.\n8. Transparencia\n8.1. Difusión\nLa instancia responsable será el Sistema para el Desarrollo Integral de la Familia a través de la\nDirección de Asistencia Alimentaria y Desarrollo Comunitario, quien difundirá en los diferentes medios de comunicación; trípticos, periódico, redes sociales en las cuales se dará a conocer la información relacionada con las características del Proyecto de Paquete de Aves de Doble Propósito. por parte de las autoridades locales; la información del Proyecto se dará a conocer en la página de internet marginada, proyecto y nombre del beneficiario; las copias de los expedientes estarán disponibles oportunamente para su consulta en las oficinas del Sistema ubicadas en Boulevard. Rene Juárez Cisneros, Colonia Ciudad de los Servicios y en Av. Gabriel Leyva s/n esq. Ruffo Figueroa, Col. Burócratas, C.P.\n39090, Chilpancingo, Guerrero; por otra parte, la papelería, documentación oficial, así como la publicidad y promoción de los proyectos, deberán incluir la leyenda descrita en el apartado de “Blindaje Electoral”.\nEJERCICIO FISCAL 2020 estas Reglas de Operación, por las instancias correspondientes, estarán disponibles para su consulta en las oficinas de la Dirección de Asistencia Alimentaria y Desarrollo Comunitario, y el responsable directo de la ejecución será la Dirección de Asistencia Alimentaria y Desarrollo Comunitario, a través de la\nSubdirección de Desarrollo Comunitario, ubicada Av. Gabriel Leyva s/n esq. Ruffo Figueroa, Col.\nBurócratas, C.P. 39090, Chilpancingo, Guerrero, a los teléfonos (01747) 47 2 55 95, (01747) 47 2 56 00, (01747) 47 2 56 72 ext. 1155. Así mismo al correo electrónico: subdescomdif@prodigy.net.mx Para información sobre el Proyecto. Así como en los medios electrónicos oficiales http://www.dif.guerrero.gob.mx además de su publicación en el Periódico Oficial del Gobierno del\nEstado, estarán disponibles para su consulta en las oficinas de la Dirección de Asistencia y Desarrollo\nComunitario.\n8.2. Blindaje electoral\nLa operación y ejecución de los recursos destinados al Proyecto, deberán observar y atender las medidas que emita la Secretaría de Contraloría y Transparencia Gubernamental, para coadyuvar a que éstos, no sean utilizados con fines políticos por lo que, la papelería, documentación oficial, así como la publicidad y promoción del Proyecto deberán incluir la siguiente leyenda:\n“Este proyecto es público, ajeno a cualquier partido político. Queda prohibido el uso con fines distintos a los fines establecidos del proyecto”.\n8.3. Supervisión y control\nLa Dirección de Asistencia y Desarrollo Comunitario deberá reportar mensualmente a la Dirección de Planeación del DIF Guerrero, las acciones ejercidas y los resultados obtenidos, quien a su vez reportará trimestralmente a la Secretaría de Planeación y Desarrollo Regional (SEPLADER), Secretaría de Finanzas y Administración (SEFINA) y la Secretaría de Contraloría y Transparencia, informes sobre el presupuesto ejercido establecidos por el Consejo Nacional de Armonización Contable (CONAC), dichos informes se deberán presentar a más tardar a los quince días hábiles posteriores a la terminación de cada trimestre.\nLos padrones de los beneficiarios serán requisitados por los Sistemas Municipales DIF, remitiendo de los padrones de beneficiarios de los 81 municipios de la entidad mismo que serán remitidos a las instancias o dependencias operadoras.\n8.4. Mecanismos de evaluación e indicadores\n8.4.1. Evaluación\nEl instrumento de medición de evaluación del Proyecto, se realizará mediante indicadores, los cuales serán reportados a la Dirección de Planeación para la integración de los informes correspondientes.\nEJERCICIO FISCAL 2020\n8.4.2. Indicadores\n8.5. Auditoría\nEl ejercicio del recurso y la operatividad del Proyecto, están sujetos a las disposiciones estatales aplicables y podrá ser auditado por la Secretaría de Contraloría y Transparencia Gubernamental, así como por la Auditoría Superior del Estado y Auditoria Superior de la Federación, conforme a la legislación vigente y en el ámbito de sus respectivas competencias.\nEl Sistema DIF Guerrero dará todas las facilidades a dichas instancias para realizar, en el momento en que lo juzguen pertinente, las auditorías que consideren necesarias; así como el seguimiento y la solventación a las observaciones planteadas por los órganos de control.\n8.6. Recursos no devengados\nEJERCICIO FISCAL 2020 y aquellos que por cualquier motivo no estuviesen devengados al 31 de diciembre del ejercicio fiscal correspondiente.\n8.7. Contraloría social\nCon la finalidad de incrementar la participación ciudadana, se crearán comités de Contraloría\nSocial, como un órgano ciudadano de control, vigilancia y evaluación de las actividades del Proyecto, conformados por las y los beneficiarios, los sectores sociales, y los representantes de la localidad, quienes de manera específica supervisarán la gestión gubernamental, y que los manejos de los recursos públicos se realicen en términos de transparencia, eficacia, legalidad y honradez.\nLos objetivos específicos de este Órgano de Contraloría Social son:\n• Hacer más transparentes las decisiones y la ejecución de los recursos.\n• Incrementar la participación ciudadana.\n• Fomentar la organización social.\n• Inhibir los actos de corrupción y de cooptación social, política y electoral.\n• Incrementar la eficiencia de los recursos públicos.\n• Fortalecer la cultura de la legalidad.\n• Mejorar la rendición de cuentas.\n• Perfeccionar la democracia e incorporar la evaluación ciudadana.\nLas actividades y funciones de los comités de Contraloría Social son:\n• Integración: Los Comités de Contraloría Social se conforman con la representación de la comunidad beneficiada por del Proyecto y fungirán como interlocutores con el DIF Guerrero, en el ejercicio de la contraloría social. El vocal del Comité de Contraloría Social será, el responsable de hacer llegar las quejas o denuncias recibidas al DIF Guerrero, quien dará respuesta en un plazo no mayor de 15 días a partir de la fecha de recepción de la queja o denuncia.\n• Capacitación y asesoría: Para impulsar la realización de las actividades de Contraloría Social se brindará capacitación y asesoría, a las servidoras y servidores públicos que intervienen en la operación del\nProyecto, así como a los integrantes de los comités locales, para que estos realicen adecuadamente sus actividades de seguimiento y vigilancia.\n• Seguimiento: Se deberá integrar un Programa de Trabajo a través del cual se debe incluir la descripción de las actividades, responsables, metas y calendarización de las actividades para su cumplimiento.\nEl Director General o el personal que designe el DIF Guerrero, serán los encargados de conformar los comités de Contraloría Social, asimismo darán acompañamiento durante las actividades de control, seguimiento y vigilancia de los proyectos.\nEJERCICIO FISCAL 2020\nEl Comité de Contraloría Social debe estar constituido por una Presidencia, una Secretaría y una\nVocalía mínimamente, electos de entre la población beneficiada en donde se va a realizar la entrega del\nProyecto, y tendrá que ser vigilado por un solo comité quien deberá controlar, vigilar y dar seguimiento al\nProyecto a través de los formatos que integran el expediente comunitario, integrado por:\n1. Acta de Conformación del Comité de Contraloría Social.\n2. Reunión con beneficiarias y beneficiarios.\n3. Ficha Informativa del Proyecto.\n4. Cédula de Vigilancia del Proyecto.\n5. Actividades de Difusión y Capacitación.\n6. Quejas, Denuncias o Reconocimientos.\n7. Informe Anual.\n8.8. Formas de participación social\nCon apego en lo dispuesto en la Ley Número 684 de Participación Ciudadana del Estado Libre y\nSoberano de Guerrero, se establece que la sociedad podrá participar activamente en la Planeación, Programación, Implementación y Evaluación de los Programas Sociales de Desarrollo Social, por ello las beneficiarias y beneficiarios participarán en la etapa de la implementación y podrán supervisar la gestión gubernamental, que el manejo de los recursos públicos se realicen en términos de transparencia, eficacia, legalidad y honradez del Proyecto de acuerdo en lo estipulado en estas Reglas de Operación.\nParticipantes Etapa en la que participa Forma de Participación Modalidad\nBeneficiarias/ Beneficiarios Implementación Comités de Contraloría Seguimiento\n8.9. Procedimiento de queja o inconformidad ciudadana\nLa población beneficiada puede presentar quejas y denuncias ante las instancias correspondientes sobre cualquier hecho, acto u omisión que produzca o pueda producir daños al ejercicio de sus derechos establecidos en las presentes Reglas de Operación o contravengan sus disposiciones y de la demás normatividad aplicable en: a. El Sistema DIF Guerrero.\nDomicilio: Centro de Rehabilitación Integral Guerrero, Boulevard Lic. René Juárez\nCisneros S/N, Col. Ciudad de los Servicios. Chilpancingo, Guerrero, C.P. 39095. b. La Secretaría de Contraloría y Transparencia Gubernamental.\nTeléfonos: (474) 47 1 97 41\nEJERCICIO FISCAL 2020\nDomicilio: Palacio de Gobierno Primer Piso Edificio Norte, Blvd. R. Juárez Cisneros 62 Col. Ciudad de los Servicios Chilpancingo, Guerrero, C.P. 39075.\nProyecto, podrán presentarse por escrito, por comparecencia, por correo electrónico o vía telefónica debiendo proporcionar los siguientes datos:\n• Nombre del servidor público.\n• Área de adscripción.\n• Objeto de la denuncia.\n• Nombre y domicilio del quejoso.\n• Identificación oficial.\n8.10. Mecanismos de exigibilidad\nLos casos en los que se podrán exigir los derechos por incumplimiento o por violación de los mismos pueden ocurrir en al menos los siguientes casos:\n✓ Cuando una persona solicitante cumpla con los requisitos y criterios de inclusión para acceder a determinado derecho.\n✓ Cuando la persona solicitante exija que se cumpla con dicho derecho de manera integral en tiempo y forma.\n✓ Cuando no se pueda satisfacer toda la demanda de incorporación al Proyecto por restricción presupuestal.\nSerá la Secretaría de Contraloría y Transparencia Gubernamental del Gobierno del Estado quién atenderá las denuncias de violación e incumplimiento de derechos en materia de Desarrollo Social.\n8.11. Acta de entrega-recepción\nLa Dirección de Asistencia Alimentaria y Desarrollo Comunitario conformará y resguardará el expediente de la población beneficiada incluyendo, su acta de donación correspondiente de cada uno de los apoyos otorgados, en estricto apego al control del gasto público.\n9. Criterios de selección y elegibilidad\n9.1. Método de selección de beneficiarios\nSerán beneficiados con el Proyecto, las personas solicitantes que cumplan con las siguientes características:\n• Familias en estado de vulnerabilidad, mujeres embarazadas, mujeres en periodo de lactancia, tener un empleo formal.\nEJERCICIO FISCAL 2020\n• Habitar en el municipio o localidad de alto, muy alto grado de marginación.\n10. Mecánica de operación\n10.1. Instancia ejecutora\nDirección de Asistencia Alimentaria y Desarrollo Comunitario, quien deberá operar con apego a la programación, presupuestación, calendario de ejecución, ejercicio y control del gasto público.\n10.2. Instancia administrativa y/o normativas\nLa instancia administrativa y normativa será la Dirección General del Sistema DIF Guerrero y la\nDirección de Asistencia Alimentaria y Desarrollo Comunitario, la Secretaría Contraloría y Transparencia\nGubernamental y la Auditoría Superior del Estado en el ámbito de sus respectivas competencias, quienes darán seguimiento a los objetivos y metas del Proyecto.\n10.3. Delimitación de atribuciones\nEl DIF Guerrero establecerá los mecanismos de coordinación necesarios para garantizar que sus proyectos y acciones no se contrapongan, afecten o presenten duplicidades con otros programas o acciones del gobierno estatal; la coordinación institucional y vinculación de acciones busca potenciar el impacto de los recursos, fortalecer la cobertura de las acciones, detonar la complementariedad y reducir gastos administrativos.\n11. Derechos, obligaciones y sanciones de los beneficiarios de programas sociales\n11.1. Derechos\n• Recibir trato digno, respetuoso y equitativo sin discriminación alguna, por el personal de las distintas áreas que participen dentro del Proyecto.\n• Reserva y privacidad de la información personal.\n• Acceder a la información necesaria del Proyecto, sus Reglas de Operación, recursos y cobertura.\n• Solicitar y recibir información sobre el estado que guarda su trámite.\n• Recibir los servicios y prestación del Proyecto conforme a las Reglas de Operación, salvo que le sea suspendido el apoyo por alguna razón justificable.\n11.2. Obligaciones\n• Proporcionar la información socioeconómica bajo protesta de decir verdad que les sea requerida por el DIF Guerrero, en los términos que establezca la normatividad correspondiente.\n• Utilizar los apoyos para los fines con que fueron autorizados evitando cualquier uso distinto de la misma.\nEJERCICIO FISCAL 2020\n• Facilitar los trabajos de verificación, en cualquier momento después de otorgado el apoyo.\n11.3. Sanciones las disposiciones normativas para acceder a los beneficios que a través de estos se otorgan, establecidas en los numerales 6.2. y 6.3 perderán las prerrogativas que dichas disposiciones establecen.\n12. Interpretación\nLa interpretación de las presentes Reglas de Operación para efectos administrativos, estarán a cargo del DIF Guerrero, así como de la Secretaría de Contraloría y Transparencia Gubernamental, en el ámbito de sus respectivas competencias.\nEJERCICIO FISCAL 2020\nEJERCICIO FISCAL 2020\nEJERCICIO FISCAL 2020\nEJERCICIO FISCAL 2020\nPrimero. El presente Acuerdo entrará en vigor al día siguiente de su publicación en el Periódico\nSegundo. Se abroga el Acuerdo por el que se crea el Proyecto Adquisición de Paquetes de Aves de Doble Propósito y se emiten las Reglas de Operación para el Ejercicio Fiscal 2019, publicado en el\nPeriódico Oficial del Gobierno del Estado de Guerrero No. 54 Alcance IV, de fecha 05 de julio de 2019.\nDado en la oficina del titular del Poder Ejecutivo, ubicada en el Edificio Centro de Palacio de\nGobierno, Boulevard René Juárez Cisneros No. 62, Colonia Ciudad de los Servicios en la Ciudad de\nChilpancingo de los Bravo, Capital del Estado de Guerrero, a los veintisiete días del mes de enero del año dos mil veinte.\nEL GOBERNADOR CONSTITUCIONAL DEL ESTADO DE GUERRERO.\nLIC. HÉCTOR ANTONIO ASTUDILLO FLORES.\nRúbrica.\nEL SECRETARIO GENERAL DE GOBIERNO.\nLIC. FLORENCIO SALAZAR ADAME.\nRúbrica.\nESTADO DE GUERRERO.\nLIC. JOSÉ FRANCISCO SOLÍS SOLÍS.\nRúbrica.",
  "ordenamiento": "PROGRAMA",
  "jurisdiccion": "GUERRERO",
  "fuente_oficial": "DIARIO OFICIAL DE LA FEDERACION",
  "Fecha de Publicación": "19 DE AGOSTO DE 2022",
  "ULTIMA REFORMA PUBLICADA": null,
  "status": "VIGENTE",
  "es_escaneado": false,
  "tiene_tablas": true,
  "materia": [
    "general"
  ]
}