{
  "titulo": "Acuerdo por el Que Se Crea el Programa de Apoyo A Madres Solteras y Se Emiten Sus Reglas de Operació",
  "Contenido": "CREA EL PROGRAMA PARA EL BIENESTAR Y EMPODERAMIENTO ECONÓMICO DE LAS MUJERES,\nY SE EMITEN SUS REGLAS DE OPERACIÓN, PUBLICADO EN EL PERIÓDICO OFICIAL DEL\nÚLTIMA REFORMA PUBLICADA EN EL PERIÓDICO OFICIAL DEL GOBIERNO DEL ESTADO\nNo. 26, EL VIERNES 31 DE MARZO DE 2023.\nTEXTO ORIGINAL.\nAcuerdo publicado en el Periódico Oficial del Gobierno del Estado No. 67 Alcance II, el martes 23 de agosto 2022.\nACUERDO POR EL QUE SE CREA EL PROGRAMA DE APOYO A MADRES SOLTERAS Y SE EMITEN\nSUS REGLAS DE OPERACIÓN PARA EL EJERCICIO FISCAL 2022.\nPoder Ejecutivo.\nMAESTRA EVELYN CECIA SALGADO PINEDA, GOBERNADORA CONSTITUCIONAL DEL ESTADO\nDE GUERRERO, CON FUNDAMENTO EN LO DISPUESTO POR LOS ARTÍCULOS 71, 87, 88, 90\nLOS ARTÍCULOS 2, 3, 6, 7, 11, 18 APARTADO A FRACCIONES I Y XV, 20 FRACCIÓN III Y 34 DE LA\nLEY ORGÁNICA DE LA ADMINISTRACIÓN PÚBLICA DEL ESTADO DE GUERRERO NÚMERO 08; 1,\n2 FRACCIÓN I, 18 Y 25 DE LA LEY NÚMERO 454 DE PRESUPUESTO Y DISCIPLINA FISCAL DEL\nESTADO DE GUERRERO; 8 FRACCIÓN XVI NUMERAL 9 DE LA LEY NÚMERO 553 PARA EL ACCESO\nDE LAS MUJERES A UNA VIDA LIBRE DE VIOLENCIA DEL ESTADO DE GUERRERO; EN RELACIÓN\nCON EL ARTÍCULO 57 Y ANEXOS 21 (E15) Y 21-A (E15) Y DEL DECRETO NÚMERO 160 DEL\nPRESUPUESTO DE EGRESOS DEL ESTADO DE GUERRERO PARA EL EJERCICIO FISCAL 2022, Y\nLOS LINEAMIENTOS PARA LA ELABORACIÓN DE LAS REGLAS DE OPERACIÓN DE LOS\nPROGRAMAS SOCIALES ESTATALES PARA EL PERIODO 2022-2027.\nQue el Plan Nacional de Desarrollo 2019-2024 en el eje II, Política Social, señala que el objetivo más en un entorno de bienestar. La lucha contra la corrupción y la frivolidad, la construcción de la paz y la orientados a ese propósito sexenal y en alineación a la Agenda 2030 para el Desarrollo Sostenible, objetivos; 1 Fin de la pobreza, 3 Salud y bienestar, 10 Reducción de desigualdades, 17 Alianzas para lograr los objetivos. como Gobernadora Constitucional del estado de Guerrero, de acuerdo a los principios de la cuarta transformación, es garantizar que las mujeres guerrerenses tengan acceso a una vida libre de violencia, y hombres en Guerrero. vulnerables, sobre todo a los encaminados al cuidado, promoción y dignificación de las madres solteras guerrerenses, se ha decidido apoyar a estas, para coadyuvar al mejoramiento de su calidad de vida y de sus menores hijas e hijos mediante el otorgamiento de un incentivo anual, que les permita adquirir productos de la canasta básica, medicamentos e insumos médicos, así como útiles escolares para sus hijas e hijos.\nQue con fecha 10 de marzo de 2017, se publicó en el Periódico Oficial del Gobierno del Estado de Guerrero número 20 Alcance I, el Acuerdo por el que se abroga el diverso que crea la Coordinación General de\nProgramas Sociales, “Guerrero para Todos”, en virtud que venía ejerciendo programas y presupuestos asignados a la Secretaría de Desarrollo Social, Secretaría de la Mujer y Secretaría de Educación Guerrero, lo que dificultaba la depuración y actualización de los padrones de beneficiarias y beneficiarios de los programas sociales, por lo que se consideró necesario transferir los programas de la Coordinación General de Programa Sociales “Guerrero Para Todos” a las secretarías de acuerdo a la materia su competencia, mismos que el Programa, Guerrero nos Necesita y Apoya a Discapacitados, pasó a la Secretaría de\nDesarrollo Social, el Programa Guerrero nos Necesita y Apoya a Mujeres Solteras, pasó a la\nSecretaría de la Mujer, y el Programa Guerrero nos Necesita a todos con Uniformes, pasó a la Secretaría de Educación Guerrero.\nQue de conformidad con el artículo 34 de la Ley Orgánica de la Administración Pública del Estado de\nGuerrero Número 08, la titular del Poder Ejecutivo se auxiliará de la Secretaría de la Mujer, como órgano encargado de establecer y ejecutar las políticas y acciones que favorezcan el bienestar y la incorporación de la mujer al desarrollo integral del estado.\nQue conforme al Decreto Número 160 del Presupuesto de Egresos del Estado de Guerrero para el Ejercicio\nFiscal 2022, publicado en el Periódico Oficial del Gobierno del Estado No. 105 alcance XII, de fecha 31 de diciembre de 2021, establece que las secretarías, dependencias y entidades de la administración pública estatal, podrán ejercer los montos para programas y proyectos de inversión aprobados en este presupuesto, en los términos de las disposiciones emitidas por la Secretaría de Finanzas y Administración del Estado y la Secretaría de Planeación y Desarrollo Regional, en función de la disponibilidad presupuestal y financiera del estado.\nQue derivado de lo anterior la Secretaría de la Mujer tendrá a cargo la implementación, operación, ejecución, evaluación y administración del Programa de Apoyo a Madres Solteras, bajo los criterios de objetividad, equidad, transparencia, publicidad, selectividad y temporalidad, con estricto apego a la normatividad aplicable, por lo tanto, será la encargada de la dispersión y asignación de los recursos del\nPrograma apegándose plenamente a las reglas de operación.\nPor lo anteriormente expuesto, he tenido a bien expedir el siguiente:\nArtículo 1. Se crea el Programa de Apoyo a Madres Solteras para el Ejercicio Fiscal 2022, el cual tiene económicos, que tengan hijas o hijos que se encuentren cursando la educación básica, así mismo, que vivan en zonas rurales o urbanas con mayores índices de pobreza.\nArtículo 2. La Secretaría de la Mujer tendrá a cargo la implementación, operación, ejecución, evaluación y administración del Programa de Apoyo a Madres Solteras, bajo los criterios de objetividad, equidad, transparencia, publicidad, selectividad y temporalidad, con estricto apego a la normatividad aplicable, por lo tanto, será la encargada de la dispersión y asignación de los recursos del Programa apegándose plenamente a las Reglas de Operación.\nArtículo 3. Se emiten las Reglas de Operación del Programa de Apoyo a Madres Solteras para el Ejercicio\nFiscal 2022, en las cuales se establece el procedimiento de ejecución del Programa, los principios, requisitos y condiciones que deben observarse para acceder al mismo, en los términos siguientes.\nREGLAS DE OPERACIÓN DEL PROGRAMA DE APOYO A MADRES SOLTERAS PARA EL\nEJERCICIO FISCAL 2022.\n1. Introducción.\n1.1. Antecedentes.\nEl Programa Nacional para la igualdad entre mujeres y hombres 2020-2024, derivado del Plan Nacional de\nDesarrollo 2019-2024 donde una transversalidad permite agregar valor a las políticas públicas y alcanzar sus objetivos con eficiencia y eficacia; con oportunidad y pertinencia. En este sentido la transversalidad es un proceso activo de transformación en las concepciones y en el abordaje de un problema público. El valor agregado puede ser diverso; derechos humanos, sustentabilidad, intersectorial e igualdad sustantiva.\nComo método, la transversalidad requiere de una planeación coordinada entre agencias, actores y proyectos que comparten objetivos, metas, prioridades y permite generar sinergias para responder con flexibilidad a los problemas. número 20 Alcance I, el Acuerdo por el que se abroga el diverso que crea la Coordinación General de\nProgramas Sociales, “Guerrero para Todos”, en virtud que venía ejerciendo programas y presupuestos asignados a la Secretaría de Desarrollo Social, Secretaría de la Mujer y Secretaría de Educación Guerrero, lo que dificultaba la depuración y actualización de los padrones de beneficiarios de los programas sociales, Sociales “Guerrero Para Todos” a las secretarías de la materia de la manera siguiente:\n• Programa, Guerrero nos Necesita y Apoya a Discapacitados, pasará a la Secretaría de Desarrollo\nSocial del Estado.\n• Programa Guerrero nos Necesita y Apoya a Mujeres Solteras, pasará a la Secretaría de la Mujer.\n• Programa Guerrero nos Necesita a todos con Uniformes, pasará a la Secretaría de Educación\nGuerrero.\nSoberano de Guerrero, la Mtra. Evelyn Cecia Salgado Pineda menciona que, de acuerdo a los principios de la cuarta transformación, refrendó su compromiso con las mujeres guerrerenses, para garantizar el acceso a una vida libre de violencia, así como para diseñar e impulsar políticas públicas tendientes a reducir las brechas de desigualdad entre las mujeres y hombres en Guerrero.\nEl Decreto Número 424 del Presupuesto de Egresos del Estado de Guerrero para el Ejercicio Fiscal 2023, publicado en el Periódico Oficial del Gobierno del Estado de Guerrero el martes 27 de diciembre del 2023, establece como objetivo garantizar recursos para combatir la pobreza y la marginación de diversos grupos de población, con base en el Plan Nacional de Desarrollo 2019-2024, el Plan Estatal de\nDesarrollo 2022-2027 y la Agenda 2030 de Desarrollo Sostenible de la Organización de las Naciones\nUnidas. (REFORMADO, P.O. 26, 31 DE MARZO DE 2023)\n2. Alineación Programática.\nLa ejecutiva estatal actualmente ha reconocido las bondades de los programas de asistencia social a grupos vulnerables sobre todo a los encaminados al cuidado, promoción y dignificación de las mujeres guerrerenses, por lo cual, el Programa de Apoyo a Madres Solteras tendrá continuidad y será manejado con absoluta transparencia, dando siempre prioridad a las mujeres que más lo necesiten para poder realmente coadyuvar así al mejoramiento de sus condiciones de vida mediante el otorgamiento de un incentivo único pero significativo que les permita adquirir productos necesarios para su vida diaria, logrando su bienestar y el de sus menores hijas o hijos.\nEl Programa, está alineado con los principios y prioridades que se señalan en el Plan Estatal de Desarrollo\n2022-2027, en específico con el Eje 1 Bienestar, Desarrollo Humano y Justicia Social, Objetivo 1.3.Disminuir las desigualdades a través de la atención a grupos vulnerables.\nCon el Plan Nacional de Desarrollo 2019-2024 en el eje II, Política Social, señala que el objetivo más importante del gobierno de la Cuarta Transformación es que en 2024 la población de México esté viviendo en un entorno de bienestar. En última instancia, la lucha contra la corrupción y la frivolidad, la construcción de la paz y la seguridad, los proyectos regionales y los programas sectoriales que opera el ejecutivo federal están orientados a ese propósito sexenal.\nEl Programa, está apegado a los lineamientos del Plan Nacional de Desarrollo 2019-2024, específicamente a el lineamiento “Por el bien de todos, primero los pobres” y el “No dejar a nadie atrás, no dejar a nadie fuera” orientado a subsanar y no agudizar las desigualdades en el país.\n(PROIGUALDAD) 2020- 2024, en el objetivo 6.1. Potenciar la autonomía económica de las mujeres para cerrar brechas históricas de desigualdad.\n2.1. Diagnóstico.\nDe acuerdo al informe de pobreza y evaluación del CONEVAL 2020, la pobreza en el Estado de Guerrero, se ha concentrado por número de personas en los municipios de Acapulco de Juárez, Chilpancingo de los\nBravo, Chilapa de Álvarez, Iguala de la Independencia y Taxco de Alarcón, es importante destacar que aunque son más los municipios rurales con la mitad de su población en situación de pobreza, es en los municipios urbanos donde se concentra el mayor número de población pobre. Como ejemplo, Acapulco donde uno de cada dos de sus habitantes era pobre en 2010 y al ser uno de los destinos turísticos más importantes del país es una de las ciudades con una gran desigualdad socioeconómica y con mayor polarización social.\nEl impacto psicosocial que implica vivir en la zona urbana y no tener un ingreso digno es muy elevado.\nSegún la Asociación Mexicana de Psiquiatría crecer en la pobreza expone a las niñas y niños a mayores niveles de estrés. Los adultos que crecieron pobres por lo general tienen niveles más altos de estrés crónico. Según datos del CONEVAL en su estudio realizado en 2018 De acuerdo con los resultados de la medición de la pobreza 2018, el 66.5% de la población de la entidad vivía en situación de pobreza, es decir, 2,412,200 personas, aproximadamente. De este universo, el 39.7% (cerca de 1,440,800 personas) estaba en situación de pobreza moderada, mientras que el 26.8% de la población se encontraba en situación de pobreza extrema (alrededor de 971,400 personas). El porcentaje de pobreza en Guerrero es 24.6% mayor que el porcentaje nacional (41.9%).\nEn cuanto a edad y sexo, podemos ver que en Guerrero la pobreza afecta principalmente a mujeres, niñas y niños, población de entre (5 - 24 años de años de edad), por lo que se deduce que son las mujeres jóvenes y sus menores hijas e hijos las personas con mayor vulnerabilidad, quienes, además, están migrando cada vez con mayor frecuencia a zonas urbanas, formando parte de los cinturones de pobreza. nacional, siendo Cochoapa el Grande el Segundo Municipio más pobre del País según el Consejo Nacional de Evaluación de la Política de Desarrollo Social (CONEVAL), dentro de los Municipios más pobres del\nEstado de Guerrero figuran los municipios de Cochoapa el Grande, Metlatónoc, Acatepec, Atlixtac, Atlamajalcingo del Monte, Alcozauca, Acatepec, entre otros.\n2.1. 1. Población Potencial.\nSegún el CONAPO, en el 20% de hogares en México (5.6 millones) una mujer es la principal o la única contribuyente de los ingresos del hogar.\nDe acuerdo a datos del INEGI, Guerrero es el segundo estado de la república con una mujer al frente de su familia, siendo el 42% de la población económicamente activa.\n2.1.2. Población Objetivo.\nEntendiendo que con este Programa se atienden de manera específica un sector de la población que presenta una limitante económica para poder subsistir tratándose de madres solteras jefas de familia de bajos recursos económicos, que tienen hijas o hijos que se encuentran cursando la educación básica, así mismo, que viven en zonas rurales o urbanas con mayores índices de pobreza, lo que las ubica como personas vulnerables ya que se calcula que el costo de tener una hija o hijo estudiando en educación básica en México, asciende a 56 mil pesos anuales según la organización México Evalúa en su estudio realizado en 2020. Con el otorgamiento de apoyos económicos para madres solteras, se busca amortiguar el fuerte impacto de la pobreza en este sector tan vulnerable, y contribuir a que los niños y niñas permanezcan en la escuela.\n2.1.3. Población Beneficiaria.\nEl Programa, beneficiará a mujeres que no tengan respaldo económico de su pareja y que tengan hijas o hijos que se encuentren cursando la educación básica, así mismo, que vivan en zonas rurales o urbanas con mayores índices de pobreza.\n2.1.4. Población Indígena.\nEn Guerrero, el 5.7% de la población es indígena, de la cual el 51.3% son mujeres. En el caso de las mujeres indígenas, el tamaño de la localidad tiene una fuerte relación con las oportunidades de trabajo como muestra, observamos que en las localidades menores de 2 500 habitantes sólo el 13.2% de las ocupación es de 61.3%, según datos del INPI. Debido a estas circunstancias, las mujeres indígenas que ciudades más grandes, en donde puedan encontrar mayores oportunidades de trabajo. Se identifica que cada vez menos personas viven en localidades menores a 2,500 habitantes, es decir, lo correspondiente a las áreas rurales. Así tenemos que en 2010 las mujeres que vivían en estas áreas geográficas representaban el 41.32%, mientras que en el 2020 representan el 39.83%.\n2.2. Fundamento legal.\na) Constitución Política de los Estados Unidos Mexicanos.\nb) Plan Nacional de Desarrollo 2019-2024.\nd) Ley Orgánica de la Administración Pública del Estado de Guerrero Número 242. (REFORMADO, P.O.\n26, 31 DE MARZO DE 2023)\nf) Ley Número 207 de Transparencia y Acceso a la Información Pública del Estado de Guerrero.\ng) Ley Número 465 de Responsabilidades Administrativas para el Estado de Guerrero.\nh) Ley Número 553 para el Acceso de las Mujeres a una Vida Libre de Violencia del Estado de\nGuerrero.\ni) Ley Número 454 de Presupuesto y Disciplina Fiscal del Estado de Guerrero.\nj) Lineamientos para la Elaboración de las Reglas de Operación de los Programas Sociales Estatales para el Periodo 2022-2027.\nk) Decreto Número 424 del Presupuesto de Egresos del Estado de Guerrero para el Ejercicio Fiscal\n2023 (REFORMADO, P.O. 26, 31 DE MARZO DE 2023)\nl) Ley Número 701 de Reconocimiento, Derechos y Cultura de los Pueblos y Comunidades\nm) Todos aquellos Ordenamientos Normativos Aplicables.\n2.3. Definiciones y siglas.\nDefiniciones:\nApoyo: Será el económico, recibida a través de una tarjeta bancaria.\nBeneficiaria: Madre Soltera Jefa de Familia que cumple con los requisitos establecidos en las Reglas de\nOperación del Programa.\nPrograma: Programa de Apoyo a Madres Solteras.\nReglas de Operación: Conjunto de disposiciones que precisan la forma de operar un programa.\nSolicitante: Persona que de manera formal y siguiendo el procedimiento establecido en las reglas de operación, solicita ser beneficiaria del Programa de Apoyo a Madres Solteras 2023. (REFORMADO, P.O. 26, Siglas:\nCONAPO: Consejo Nacional de Población.\nCONEVAL: Consejo Nacional de Evaluación de la Política de Desarrollo Social.\nINEGI: Instituto Nacional de Estadística, Geografía e Informática.\nINPI: Instituto Nacional de los Pueblos Indígenas.\nSEMUJER: Secretaría de la Mujer.\n3. Objetivos y Alcances.\n3.1. Objetivo General.\nFortalecer la economía familiar de las madres solteras jefas de familia de bajos recursos económicos, que tengan hijas o hijos que se encuentren cursando la educación básica, así mismo, que vivan en zonas rurales o urbanas con mayores índices de pobreza.\n3.2. Objetivos Específicos.\n• Crear un padrón de madres solteras jefas de familia.\n• Impartir a las madres solteras seleccionadas una capacitación sobre autoestima, superación y derechos de la mujer.\n• Proporcionar 895 apoyos económicos a madres solteras jefas de familia de bajos recursos y que tengan hijas o hijos que se encuentren cursando la educación básica, así mismo, que vivan en zonas rurales o urbanas con mayores índices de pobreza. (REFORMADO, P.O. 26, 31 DE MARZO DE 202)\n3.3. Cobertura.\nEl Programa, tiene una cobertura estatal, no obstante pretende privilegiar prioritariamente a las madres mayores índices de pobreza.\n3.4. Alcances.\nEste Programa tiene como fin, tratar de contribuir a suavizar el impacto psicosocial que conlleva la problemática existente ya mencionada en el presente documento. Contribuyendo al bienestar social, a los hogares de las madres solteras y estimular su desarrollo humano, para tal efecto, se les brindará una capacitación con el propósito de promover la superación personal, social y económica, además de conocer sus derechos con el objetivo de empoderarlas no solo de manera económica, sino también intelectual, para sus necesidades básicas de bienestar social y puedan seguir desarrollándose de manera individual, familiar y comunitaria en un marco de derechos sociales.\n4. Metas Físicas.\nEl Programa, busca beneficiar de manera directa a 895 mujeres que sean madres solteras jefas de familia y cumplan con lo establecido en las presentes Reglas de Operación, mediante un apoyo económico único anual de 5 mil pesos a cada una y una capacitación que ayuden a mejorar su calidad de vida. (REFORMADO,\nP.O. 26, 31 DE MARZO DE 2023).\n5. Programación Presupuestal.\nEn el Decreto número 424 del Presupuesto de Egresos del Estado de Guerrero para el Ejercicio Fiscal\n2023, se le asignaron recursos presupuestales al Programa, provenientes de Inversión Estatal Directa por un monto de $4’720,000.00 (cuatro millones setecientos veinte mil pesos 00/100 m.n.). (REFORMADO,\nP.O. 26, 31 DE MARZO DE 2023)\nEn el Programa, se busca beneficiar a 895 mujeres jefas de familia de manera directa mejorando su calidad de vida y la de sus núcleos familiares. (REFORMADO, P.O. 26, 31 DE MARZO DE 2023)\nLa aplicación y ejecución del Programa, será bajo la modalidad de administración directa de la manera siguiente:\nCalendario Financiero\n(REFORMADO, P.O. 26, 31 DE MARZO DE 2023)\nPresupues\nFebre Agost SeptiemOctubr Noviem Diciem\nConceptos to Enero Marzo Abril Mayo Junio Julio Total ro o bre e bre bre autorizado\nApoyos económicos $\n$4,475,000. jefas de familia 2023. 0\nPrograma de $4,720,000 capacitación.00 $- $- $- $103,400.00 $- $- $- $- $- $- $- $- $103,400.00 regional.\nGastos Operativos. $- $- $ $141,600.00 $- $- $- $- $- $- $- $- $141,600.00\n$4,720,000. $4,720,000.\n00 00\nEjecución de recursos del Programa de Apoyo a Madres Solteras 2023\nNo. Concepto Monto %\n1 Apoyo y capacitación a madres solteras jefas de familia $ 4,578,400.00 97%\n2 Gastos Operativos del programa $141,600.00 3%\nTotal $ 4,720,000.00 100%\n5.1. Gastos de Operación.\nEl recurso económico necesario para gastos de operación, destinados a las diversas acciones asociadas con la planeación, operación, supervisión, seguimiento, contraloría social y evaluación o asesoría externa serán hasta de un 3% correspondiente al presupuesto total autorizado del Programa.\n6. Criterios y Requisitos de Elegibilidad.\nPara ser elegible para este apoyo, debe ser mujer, madre soltera jefa de familia de bajos recursos económicos, que tengan hijas o hijos que se encuentren cursando la educación básica, que vivan en zonas rurales o urbanas con mayores índices de pobreza.\n6.1. Requisitos.\nSer madre soltera jefa de familia de bajos recursos económicos, que tengan hijas o hijos que se encuentren cursando la educación básica, así mismo, que vivan en zonas rurales o urbanas con mayores índices de pobreza, además deben presentar los documentos siguientes:\nb) Acta de nacimiento, de las hijas o hijos menores dependientes de la madre.\nc) Clave Única de Registro de Población (CURP) de la madre soltera, nuevo formato (REFORMADO, P.O.\ne) Comprobante de domicilio (recibo de agua, luz, teléfono o constancia de la autoridad local).\nf) Constancia de estudios de educación básica de las hijas o hijos en una institución educativa pública,\ng) Para todos aquellos casos en los que se identifique que las madres solteras tengan en el registro civil algún antecedente de acta de matrimonio, deberán presentar lo siguiente: (REFORMADO, P.O. 26, 31 DE\n● Acta de divorcio;\n● Solicitud de disolución de vínculo matrimonial; o\n● Demanda de alimentos para ella y sus hijas o hijos.\nLos documentos deberán presentarse en original para cotejo y dos copias fotostáticas simples, los documentos deberán ser entregados al personal autorizado en la Dirección General de Apoyos a Proyectos\nProductivos, el trámite se realizará invariablemente de manera personal, en el lugar y en los tiempos que lo requiera el Programa a través de la convocatoria, por lo que no se le dará tramite a los paquetes de documentos enviados por representantes o líderes partidistas; únicamente podrá realizarlo la interesada.\n(REFORMADO, P.O. 26, 31 DE MARZO DE 2023)\n7. Tipo, Monto y Periodicidad del Apoyo.\nEl Programa, beneficiará a 895 mujeres de forma directa, siempre y cuando cumplan con los requisitos de elegibilidad del Programa, con un apoyo único anual de $5,000.00 (cinco mil pesos 00/100 m.n.) y capacitación para su desarrollo personal, social y económico, fortaleciendo con ello su núcleo familiar.\n(REFORMADO, P.O. 26, 31 DE MARZO DE 2023)\nCon relación a lo anterior, la capacitación “Empoderamiento Económico de las Mujeres” se llevará a cabo de la siguiente forma:\nCantidad Región Sede\n2 Tierra Caliente Según convocatoria.\n2 Costa Chica Según convocatoria\n2 Norte Según convocatoria\n4 Centro Según convocatoria\n2 Costa Grande Según convocatoria\n4 Acapulco Según convocatoria\n2 La Montaña Según convocatoria\n7.1. Características de los Apoyos.\nEl Programa, busca beneficiar de manera directa a 895 mujeres que sean madres solteras jefas de familia y cumplan con lo establecido en las presentes Reglas de Operación: (REFORMADO, P.O. 26, 31 DE MARZO DE\n2023)\n● Apoyo económico de $5,000.00 (cinco mil pesos 00/100 M.N.) único anual.\n7.2. Recursos no Devengados.\nEl presupuesto autorizado al Programa que no se hubiese aplicado a los fines autorizados, y los recursos que por cualquier motivo no estuviesen devengados al 31 de diciembre de cada ejercicio fiscal, serán reintegrados inmediatamente a la Secretaría de Finanzas y Administración del estado de Guerrero, instancia normativa del ejercicio y control del gasto público.\n7.3. Resguardo de la Documentación.\nToda la documentación requerida para participar en la convocatoria del Programa, será resguardada por la SEMUJER mediante la Dirección de Apoyo a Proyectos Productivos para fines de comprobación de los recursos ejercidos, así como elaborar el cierre de ejercicio.\n7.4. Supervisión y Control.\nLa supervisión y control se realizará de acuerdo a lo establecido en el Decreto Número 424 del Presupuesto de Egresos del Estado de Guerrero para el Ejercicio Fiscal 2023, artículo 47, que a la letra dice: “Con el objeto de asegurar la aplicación eficiente, oportuna, equitativa y transparente de los recursos públicos, la Secretaría y la Secretaría de Planeación y Desarrollo Regional emitirán las disposiciones a que deberán sujetarse los programas de inversión sujetos a Reglas de Operación”.\nAsí mismo, la SEMUJER, a través de la Dirección General de Apoyo a Proyectos Productivos realizarán las siguientes acciones: (REFORMADO, P.O. 26, 31 DE MARZO DE 2023)\na) Enviar trimestralmente a la Secretaría de Finanzas y Administración, a la Secretaría de Planeación y Desarrollo Regional y a la Secretaría de Contraloría y Transparencia Gubernamental, informes sobre el presupuesto ejercido establecidos por el Consejo Nacional de Armonización Contable\n(CONAC) y con base en los indicadores de resultados previstos en las Reglas de Operación. terminación de cada trimestre.\nb) Adicionar a los informes señalados en el inciso anterior, la evaluación de los indicadores determinados en el Programa. Dicha evaluación versará sobre los recursos entregados a las sobre bienestar y la equidad de género, el área encargada de la supervisión y control del Programa estará a cargo de la Dirección General de Apoyo a Proyectos Productivos de la SEMUJER.\n8. Criterios de Selección.\nSerán acreedoras al Programa, mujeres que sean madres solteras jefas de familia de bajos recursos económicos, que tengan hijas o hijos que se encuentren cursando la educación básica, así mismo, que vivan en zonas rurales o urbanas con mayores índices de pobreza.\nAsí mismo, una vez concluida la fase de depuración y actualización del padrón de beneficiarias\n2022, así como la revisión de documentos de las nuevas aspirantes, se llevará a cabo, a través de un Comité, la selección de las madres solteras que cumplan con todos los requisitos y criterios establecidos en estas Reglas de Operación del Programa y la convocatoria publicada por la\nSecretaría de la Mujer. (ADICIONADO, P.O. 26, 31 DE MARZO DE 2023)\n8.1. Casos Especiales.\nSerán valorados por el comité de selección de la SEMUJER.\n8.2. Casos de Emergencia o Desastre.\nEn caso de desastre natural se cancelará todo tipo de capacitaciones durante esa temporalidad y el apoyo será entregado.\n8.3. Suspensión o Cancelación del Programa Social.\nLa SEMUJER podrá suspender y/o cancelar la operación del Programa, cuando no exista las condiciones sociales - económicas entre las partes, cuando una de las beneficiarias no acate las disposiciones de estos lineamientos y otras señaladas por los ejecutores que afecte la norma estatal o federal, cuando lo determine la persona titular del ejecutivo estatal y por problemas de gobernabilidad.\n8.4. Integración del Padrón de Personas Beneficiarias.\nUna vez que las personas solicitantes son incorporadas al Programa, formarán parte de un Padrón Único de Personas Beneficiarias, el cual será de carácter público, siendo reservados sus datos personales, de acuerdo con la normatividad vigente; los cuales en ningún caso podrán emplearse para propósitos de proselitismo político, religioso o comercial, ni para ningún otro fin distinto al establecido en las presentes\nReglas de Operación.\n9. Mecánica Operativa del Programa Social.\n9.1. Instancia Ejecutora y/o Responsable.\nEl área responsable de ejecutar el Programa será la SEMUJER, a través de su Dirección General de\nProyectos Productivos y en coordinación con la Delegación Administrativa.\n9.2. Proceso de Incorporación al Programa Social.\nLa forma de acceder al Programa será a solicitud de la madre soltera.\nLas madres solteras interesadas en ser beneficiarias del apoyo económico que brinda el programa, deberán acudir de manera personal a inscribirse en los módulos de atención, en los días y horarios que para tal efecto se señalen en la convocatoria que emita y publique la SEMUJER, a través de su página de internet.\nAunado a lo anterior, las madres solteras interesadas deberán entregar los documentos que se precisen en la convocatoria antes referida, esto, con el propósito de crear una base de datos para un mejor control, realizar estudios socioeconómicos que permitan constatar la situación de económica de cada solicitante para así poder evaluar su integración al Programa, lo anterior, toda vez que se pretende beneficiar a las mujeres madres solteras en mayor grado de vulnerabilidad.\nUna vez concluida la fase de recepción de documentos, revisión, estudios socioeconómicos para corroborar su estatus de vulnerabilidad, se llevará a cabo, a través de un Comité, la selección de las madres solteras que cumplan con todos los requisitos y criterios establecidos en las Reglas de Operación del Programa y la Convocatoria correspondiente.\nLa SEMUJER publicará en su página de internet (www.semujer.guerrero.gob.mx) el listado de las madres solteras que hayan sido seleccionadas para recibir el apoyo económico de 5 mil pesos y una capacitación para su desarrollo personal, social y económico, fortaleciendo con ello su núcleo familiar; es importante mencionar, que la capacitación se llevará a cabo en la fecha que se haga la entrega de las tarjetas bancarias a las beneficiarias, es decir, en la fecha establecida en la convocatoria que se emita.\n10. Evaluación.\nAl final del año se analizarán cada uno de los pasos que se siguieron en la aplicación del Programa y se aplicará un cuestionario a las beneficiarias con el objetivo de conocer su opinión acerca del proceso del que formaron parte y se realizará un informe general acerca del impacto obtenido, dando cuenta de las fortalezas formulando sugerencias para su reorientación o fortalecimiento según los resultados obtenidos. a este Programa.\nEl objetivo estratégico es, además de dar un apoyo económico, ayudar a que las mujeres aprendan sobre sus derechos y se empoderen de manera personal y familiar.\n10.1. Indicadores. (Construcción de la Mir.- Anexo 1)\nPara el desarrollo de los indicadores se empleará la Metodología del Marco Lógico, para una buena evaluación del Programa, mismo que se desarrollará en el transcurso de la ejecución del mismo, por lo que se presenta a continuación principal indicador:\n10.2. Seguimiento. llevar un seguimiento detallado de su desarrollo y sus condiciones de vida.\nDicho seguimiento se hará con eficacia, eficiencia, efectividad, imparcialidad, honestidad y apego a la normatividad con la que opera el Programa.\n10.3. Auditoría.\nLa auditoría es una función de fiscalización de los recursos autorizados al Programa, para constatar su correcta aplicación y promover la eficacia y transparencia en sus operaciones y verificar el cumplimiento de los objetivos y metas programados.\nLos recursos ejercidos en el Programa podrán ser fiscalizados por el órgano interno de control y demás instancias que en el ámbito de sus respectivas atribuciones resulten competentes. Como resultado de las acciones de auditoría que se lleven a cabo, el órgano interno de control mantendrá un seguimiento interno que permita emitir los informes de las revisiones practicadas, dando principal importancia a la atención en tiempo y forma, de las irregularidades detectadas, hasta su total solventaciones.\n11. Mecanismo de Entrega del Apoyo.\nLas personas beneficiarias, cuyos datos fueron verificados, validados y revisados por el Comité de\nSelección, recibirán el apoyo económico, por medio de una tarjeta bancaria, el cual será entregado en una sola exhibición.\n12. Derechos y Obligaciones de las Personas Beneficiadas.\nDerechos:\nLas madres solteras beneficiadas recibirán por parte de la SEMUJER:\na) La información necesaria, de manera clara y oportuna, para participar en el Programa;\nb) La relación de beneficiarias a través de medios de comunicación impresos y electrónicos de los que disponga la SEMUJER;\nc) La tarjeta bancaria, una vez que haya sido seleccionada de acuerdo a los requisitos establecidos en estas Reglas de Operación;\nd) Su apoyo de manera puntual que otorga el Programa y en la fecha que se establezca en la convocatoria;\ne) Un trato digno, respetuoso, oportuno y equitativo;\nf) Atención sin costo alguno, y\ng) La reserva y privacidad de su información personal, de acuerdo a la Ley Número 207 de\nObligaciones:\nLas madres solteras beneficiarias deberán:\na) Acudir puntualmente a los lugares en la fecha y hora señalada a recibir su tarjeta bancaria;\nb) Informar los cambios de domicilio y actualizar sus datos y documentación cuando proceda para los efectos que dé lugar;\nc) Renovar la constancia de estudios de las hijas o hijos, al inicio de cada ciclo escolar;\nd) En su caso, recibir la visita del trabajador social o de contraloría social para la verificación de información proporcionada en el llenado de estudio socioeconómico;\ne) Aplicar de manera prioritaria el apoyo en productos de la canasta básica, medicamentos e insumos médicos;\nf) No hacer uso indebido (venta, préstamo o uso con fines partidistas o electorales, entre otros) de la Tarjeta bancaria;\ng) Participar en las acciones de contraloría social para la vigilancia del buen funcionamiento del\nPrograma;\nh) Informar ante la SEMUJER, las fallas o irregularidades que se presenten en el uso del mecanismo electrónico que les impida recibir su apoyo, y\ni) Cumplir con el compromiso de corresponsabilidad.\n12.1. Causales de Suspensión o Baja de las Personas Beneficiadas.\n12.2. Proceso de Baja\na) Cuando la madre beneficiada lo solicite por escrito a la SEMUJER;\nb) Cuando las hijas o hijos a cargo de la beneficiada no cumplan el rango de edad;\nc) Cuando la beneficiaría deje su condición de soltería;\nd) Cuando se detecte mediante las inspecciones periódicas que en la casa habitación cohabita el cónyuge;\ne) Cuando la madre beneficiada proporcione información falsa o altere algún documento que se establezca como requisito para el trámite del apoyo, independientemente de las acciones legales a que se pudiera hacer acreedora;\nf) Cuando haga uso indebido de la tarjeta;\ng) Cuando después de citarla en tres ocasiones diferentes no acuda a recibir su apoyo. Se les citará por vía telefónica, a través de los enlaces municipales o mediante la publicación de las listas de beneficiadas en medios de comunicación como periódico o la página oficial del Gobierno del\nEstado de Guerrero;\nh) Cuando la beneficiaria haya cambiado de domicilio sin notificarlo oportunamente y no se pueda indagar el nuevo domicilio o éste sea fuera del estado de Guerrero;\ni) Por deceso de la beneficiada.\n13. Instancias Participantes.\nLas instancias participantes serán: la SEMUJER y su Dirección General de Apoyos a Proyectos\nProductivos, la Secretaría de Planeación y Desarrollo Regional, la Secretaría de Finanzas y Administración, la Secretaría de Contraloría y Transparencia Gubernamental.\n13.1. Instancia Normativa.\nLa instancia normativa para el Programa será la SEMUJER.\n14. Transparencia.\n14.1. Promoción y Difusión del Programa Social.\nLa Dirección General de Apoyo a Proyectos Productivos difundirá la convocatoria, a través de la página de la SEMUJER (www.semujer.guerrero.gob.mx). Se dará amplia difusión al Programa a nivel estatal y se promoverán similares acciones por parte de las autoridades locales.\n14.2. Contraloría Social.\nA cargo de los miembros de la comunidad, busca incorporar a la ciudadanía en el control, vigilancia y evaluación del Programa. La instancia ejecutora promoverá la contraloría social con base en la normatividad establecida para tal efecto, fomentando acciones que transparenten la operación del\nPrograma. ejecutora de la promoción, difusión y realización de las acciones necesarias para la participación de las información, seguimiento, supervisión, vigilancia y evaluación del cumplimiento de criterios de elegibilidad y derechos de las beneficiarias, obligaciones del Programa y el desempeño de honestidad y calidad de las servidoras o servidores públicos.\n14.3. Protección de Datos Personales.\nLa protección de datos se refiere a los derechos de las personas cuyos datos se recogen, se mantienen y se procesan, así como saber qué datos están siendo retenidos y usados asimismo de corregir las inexactitudes.\n14.4. Quejas y Denuncias.\nCualquier queja o denuncia deberá hacerse llegar por escrito a la SEMUJER, ubicada en el Recinto del\nPoder Ejecutivo, Boulevard René Juárez Cisneros #62, Col. Cd. de los servicios, C.P 39074, Chilpancingo, Guerrero. Edificio Costa Chica 2do. Piso. Dicha queja o denuncia será revisada y respondida por escrito en los 15 días hábiles posteriores a su recepción. En caso de que la SEMUJER responsable del Programa no resuelva la queja, las personas beneficiarias o derechohabientes podrán presentar quejas por considerarse indebidamente excluidos del Programa o por incumplimiento de la garantía de acceso al\nPrograma ante la contraloría social de la Secretaría de Contraloría y Transparencia Gubernamental del\nEstado de Guerrero.\nLas quejas y denuncias de la ciudadanía en general por la presunción de actos de corrupción o desvió de recursos por parte de servidoras o servidores públicos, se captarán por el órgano interno de control.\nLos medios por los cuáles podrán presentarse quejas y denuncias ciudadanas:\na) Por escrito.\nb) Por comparecencia del Interesado.\nc) Por correo electrónico (secretariadelamujer2027@gmail.com).\nd) Vía telefónica (74747 1 98 92).\nLa persona denunciante o quejosa deberá proporcionar los siguientes datos:\na) Nombre de la servidora o servidor público.\nb) Dependencia de adscripción.\nc) Objeto de la denuncia.\nd) Nombre y domicilio de la persona quejosa.\ne) Identificación Oficial.\n14.5. Acciones de Blindaje.\nEn la operación y ejecución de los recursos del Programa sujeto a las presentes Reglas de Operación, se deberán observar y atender las medidas de carácter permanente, contenidas en las leyes federales y/o locales aplicables, las disposiciones emitidas por las autoridades electorales, tanto de carácter federal como local, así como aquellas específicas que sean emitidas de forma previa para los procesos electorales federales, estatales y municipales, por la Unidad del Abogado General y Comisionado para la\nTransparencia, con la finalidad de prevenir que el uso y manejo de los recursos públicos del Programa se vean relacionados con fines partidistas y/o político-electorales; todo ello con la firme intención de garantizar los principios de imparcialidad y equidad durante los comicios.\nComo estrategia de blindaje electoral; la papelería, documentación oficial, así como la publicidad y promoción del Programa deberán incluir la leyenda siguiente:\n“Este programa es público, ajeno a cualquier partido político. Queda prohibido el uso para fines distintos a los establecidos en el programa”\n14.6. Acta de Donación. (Anexo 2)\nEl acta constituye el comprobante de que los recursos se ejercen con transparencia y de acuerdo a las presentes Reglas de Operación.\n15. Perspectiva de Género.\nEl Programa tendrá un padrón únicamente integrado por mujeres.\n16. Enfoque de Derechos.\nCon el objetivo de generar las condiciones necesarias para el acceso equitativo en términos de disponibilidad, accesibilidad y calidad en las acciones que realiza este Programa, se implementarán mecanismos que hagan efectivo el acceso a la información gubernamental, se asegurará que el acceso a los apoyos y servicios se dé únicamente con base en lo establecido en estas Reglas de Operación, sin discriminación alguna.\nTodas las personas servidoras públicas involucradas en la operación del Programa deben promover, respetar, proteger y garantizar el ejercicio efectivo de los derechos humanos de las beneficiarias del\nPrograma, con base en los principios de universalidad, interdependencia, indivisibilidad y progresividad, brindando en todo momento un trato digno y de respeto a la población objetivo, con apego a los criterios de igualdad y no discriminación.\nEn la aplicación del Programa, se harán valer los derechos de las personas beneficiarias tomando en pertenecen a grupos históricamente discriminados, como lo son niñas y niños, jóvenes, personas con discapacidad, personas en situación de calle, en situación de desplazamiento interno, mujeres, personas migrantes, afrodescendientes, y a aquellas pertenecientes a pueblos y comunidades indígenas, entre otros, tomando en consideración sus circunstancias y necesidades, a fin de contribuir a generar conocimiento y acciones que potencien su desarrollo integral e inclusión plena.\n17. Acciones Contra el SARS-COV 2.\nPara la operación del Programa, se seguirán todas las recomendaciones y disposiciones oficiales del\nSector Salud, especialmente las del estado de Guerrero, con la finalidad de contribuir en el cuidado del personal y beneficiadas.\nEn atención a la pandemia por COVID-19, durante la entrega del apoyo y las capacitaciones se usará de manera obligatoria el cubre bocas, se respetará la distancia social y se hará uso de gel antibacterial.\n18. Anexos que reflejen la entrega del apoyo. (Económico. Especie o Servicios)\nAnexo 1.- MIR\n(REFORMADO, P.O. 26, 31 DE MARZO DE 2023)\nNivel de Formula de Tipo de Unidad de Medios de Unidad\nObjetivo Indicador Supuestos objetivo calculo indicador medida verificación responsable\nLas mujeres\nMadres solteras\n(895 mujeres Dirección están informadas\nDisminuir la brecha de\nPorcentaje de beneficiadas/895 General de de los beneficios desigualdad económica\nFin mujeres mujeres Eficacia Mujeres SEMUJER Apoyo a que aportan el entre hombres y\nBeneficiada s programadas a Proyectos programa y los mujeres beneficiar) *100 Productivos requisitos para acceder a él.\nLas mujeres de la entidad tienen\nDirección\nBrindar oportunidades a acceso a la\nTotal de General de madres solteras en Solicitudes igualdad de\nPropósito solicitudes Eficacia Solicitudes SEMUJER Apoyo a estado de atendidas oportunidades y atendidas Proyectos vulnerabilidad una vida libre de\nProductivos violencia\nDepurar, actualizar y complementar padrón de madres solteras jefas de familia de escasos recursos\nDirección económicos y que Se tendrá mayor\nPadrón General de tengan hijas o hijos que Padrón depurado veracidad en las depurado y Eficacia Mujeres SEMUJER Apoyo a se encuentren y actualizado mujeres actualizado. Proyectos cursando la educación beneficiadas\nProductivos\nComponentes básica, así mismo, que vivan en zonas rurales o urbanas con mayores índices de pobreza.\nImpartir a las madres Dirección\nCapacitación Capacitación realizada realizada autoestima, superación Proyectos capacitadas y derechos de la mujer. Productivos\nDepurar, actualizar y\nApoyos complementar padrón proporcionados a de madres solteras madres solteras = jefas de familia de\n(Número de escasos recursos Dirección Los Apoyos son\nPorcentaje de apoyos económicos y que General de entregados y apoyos proporcionados a tengan hijas o hijos que Eficacia Apoyos SEMUJER Apoyo a cobrados por las proporciona madres solteras / se encuentren Proyectos madres solteras dos número de cursando la educación Productivos beneficiadas apoyos básica, así mismo, que programados a vivan en zonas rurales madres solteras) o urbanas con mayores\n*100 índices de pobreza.\nDirección Se establecen\nDocumento\nLa revisión de las reglas Reglas de Publicación de General de reglas de operación\n(reglas de de operación permite operación las reglas de Eficacia SEMUJER Apoyo a claras para acceder operación mejorar el programa publicadas operación Proyectos a los beneficios del\n2023)\nProductivos programa\nSe hace del conocimiento de la población objetivo, el periodo para la recepción de\nDirección\nLa convocatoria permite solicitudes, General de difundir el programa y Convocatoria Publicación de la Documento espacios al padrón\nEficacia SEMUJER Apoyo a da acceso a la publica convocatoria (convocatoria) a cubrir, los\nProyectos población estatal requisitos a cumplir, Productivos la mecánica operativa, así como\nActividades especificaciones particulares del programa.\nCruce de padrón con Porcentaje de (1 número de Dirección Se genera un otras instancias, que cruces de cruces de General de padrón de\nPorcentaje otorguen apoyo a padrones con padrones de año Eficacia SEMUJER Apoyo a beneficiados\nPadrón mujeres, permite no otras anterior/1 cruces Proyectos sustentado y duplicar apoyos instituciones actuales) *100 Productivos confiable\n(número de Las mujeres de la mujeres Dirección Entidad tienen\nCapacitación para el\nPorcentaje de capacitadas General de acceso a la desarrollo personal, mujeres 895/895 número Eficacia Porcentaje SEMUJER Apoyo a igualdad de social y económico de madres solteras programadas) Productivos sociales y\n*100 económicas\nAnexo 2. Acta de Donación. presentes Reglas de Operación.\nPrimero. El presente Acuerdo entrará en vigor al día siguiente de su publicación en el Periódico Oficial del\nSegundo. Se abroga el Acuerdo por el que se emiten las Reglas de Operación del Programa Apoyo a\nGuerrero, No. 38, Alcance I, año C, de fecha 10 de mayo del año 2019.\nTercero. A partir de la entrada en vigor del presente Acuerdo, las Reglas de Operación del Programa Apoyo a Madres Solteras, subsecuentes o sus modificaciones serán emitidas por la persona titular de la Secretaría de la Mujer, responsable directa de la operación y ejecución de estas. del Poder Ejecutivo del Estado, Boulevard René Juárez Cisneros No. 62, Código Postal 39074, colonia\nCiudad de los Servicios en la ciudad de Chilpancingo de los Bravo, Capital del Estado de Guerrero, al primer día del mes de agosto del año dos mil veintidós.\nLA GOBERNADORA CONSTITUCIONAL DEL ESTADO DE GUERRERO.\nMTRA. EVELYN CECIA SALGADO PINEDA.\nRúbrica.\nEL SECRETARIO GENERAL DE GOBIERNO.\nMTRO. LUDWIG MARCIAL REYNOSO NUÑEZ.\nRúbrica.\nLA SECRETARIA DE LA MUJER.\nLIC. VIOLETA PINO GIRON.\nRúbrica.\nN. DE E. A CONTINUACIÓN, SE TRANSCRIBEN LOS ARTÍCULOS TRANSITORIOS DE LOS\nACUERDOS DE MODIFICACIÓN.\nOPERACIÓN DEL PROGRAMA DE APOYO A MADRES SOLTERAS DEL EJERCICIO FISCAL 2022;\nDICHO PROGRAMA.\nPrimero. El presente Acuerdo de Modificación, entrará en vigor al siguiente día de su publicación\nSegundo. Se derogan todas las disposiciones que se opongan al presente Acuerdo de",
  "ordenamiento": "PROGRAMA",
  "jurisdiccion": "GUERRERO",
  "fuente_oficial": "DIARIO OFICIAL DE LA FEDERACION",
  "Fecha de Publicación": "19 DE ABRIL DE 2024",
  "ULTIMA REFORMA PUBLICADA": null,
  "status": "VIGENTE",
  "es_escaneado": false,
  "tiene_tablas": true,
  "materia": [
    "general"
  ]
}