{
  "titulo": "Acuerdo por el Que Se Crea el Programa Fortalecimiento al Campo y Se Emiten Sus Reglas de Operación",
  "Contenido": "TEXTO ORIGINAL. de Junio de 2022.\nACUERDO POR EL QUE SE CREA EL PROGRAMA FORTALECIMIENTO AL CAMPO Y SE\nEMITEN SUS REGLAS DE OPERACIÓN PARA EL EJERCICIO FISCAL 2022.\nGuerrero.- Poder Ejecutivo.\nMAESTRA EVELYN CECIA SALGADO PINEDA, GOBERNADORA CONSTITUCIONAL DEL ESTADO\nDE GUERRERO, CON FUNDAMENTO EN LO DISPUESTO POR LOS ARTÍCULOS 71, 87, 88, 90\nCONFIEREN LOS ARTÍCULOS 2, 3, 6, 7, 10, 11,18 APARTADO A FRACCIONES I Y XII, 20 FRACCIÓN\nIII Y 31 DE LA LEY ORGÁNICA DE LA ADMINISTRACIÓN PÚBLICA DEL ESTADO DE GUERRERO\nNÚMERO 08; 1, 2 FRACCIÓN I, 18 Y 25 DE LA LEY NÚMERO 454 DE PRESUPUESTO Y DISCIPLINA\nFISCAL DEL ESTADO DE GUERRERO; 18 FRACCIÓN I Y 106 DE LA LEY NÚMERO 814 DE\nDESARROLLO RURAL SUSTENTABLE DEL ESTADO DE GUERRERO; EN RELACIÓN CON EL\nARTÍCULO 57 Y ANEXOS 21 (E12) Y 21-A (E12), DEL DECRETO NÚMERO 160 DEL PRESUPUESTO\nDE EGRESOS DEL ESTADO DE GUERRERO PARA EL EJERCICIO FISCAL 2022, Y LOS\nLINEAMIENTOS PARA LA ELABORACIÓN DE LAS REGLAS DE OPERACIÓN DE LOS PROGRAMAS\nSOCIALES ESTATALES PARA EL PERIODO 2022-2027.\nQue en el Plan Nacional de Desarrollo 2019-2024, publicado en el Diario Oficial de la Federación el 12 de julio de 2019, establece que su principal objetivo es lograr el Bienestar de la población.\nQue el citado Plan nacional en su numeral II “Construir un país con bienestar”, como punto\n“Autosuficiencia alimentaria y rescate al campo”, considera que las acciones plasmadas en los foros de consulta ciudadana, integradas en el documento “Sentimientos del Pueblo Guerrerense” y el Plan\nAlternativo de Nación, consiste en continuar con la cuarta transformación del campo a través del Programa\nFortalecimiento al Campo en un programa integral y corresponsable.\nQue uno de los compromisos del ejecutivo estatal con la ciudadanía guerrerense, es lograr un\nGuerrero de tranquilidad, de paz, de justicia, de crecimiento y de empleo, contribuyendo con ello a construir social. vulnerables sobre todo a los encaminados en la producción del campo, para hombres y mujeres en el estado de Guerrero.\nQue el Programa Fortalecimiento al Campo, tiene como objetivo general, apoyar a las personas productoras, con insumos para impulsar la productividad, dotándoles de un Paquete Tecnológico para incrementar su producción.\nQue la Secretaría de Agricultura, Ganadería, Pesca y Desarrollo Rural, tendrá a su cargo la implementación, operación, ejecución, evaluación y administración del Programa Fortalecimiento al\nCampo.\nDe lo anteriormente expuesto, he tenido a bien expedir el siguiente:\nACUERDO POR EL QUE SE CREA EL PROGRAMA FORTALECIMIENTO AL CAMPO Y SE EMITEN\nSUS REGLAS DE OPERACIÓN PARA EL EJERCICIO FISCAL 2022.\nArtículo 1. Se crea el Programa Fortalecimiento al Campo para el Ejercicio Fiscal 2022, el cual tiene por objeto otorgar apoyo con insumos a productoras y productores, para incrementar la producción de alimentos.\nArtículo 2. La Secretaría de Agricultura, Ganadería, Pesca y Desarrollo Rural tendrá a su cargo la implementación, operación, ejecución, evaluación y administración del Programa Fortalecimiento al\nCampo, bajo los criterios de objetividad, equidad, transparencia, publicidad, selectividad y temporalidad, con estricto apego a la normatividad aplicable, por lo tanto, será la encargada de la dispersión y asignación de los recursos del Programa apegándose plenamente a las reglas de operación.\nArtículo 3. Se emiten las Reglas de Operación del Programa Fortalecimiento al Campo para el\nEjercicio Fiscal 2022, en las que se establece el procedimiento de ejecución del Programa, los principios, requisitos y condiciones que deben observarse para acceder al mismo, en los términos siguientes:\nEJERCICIO FISCAL 2022.\n1. Introducción.\n1.1. Antecedentes. desarrollo sustentable del agro guerrerense, en el año 1994 se creó el Programa de subsidio al fertilizante, Programa se incorporaron al financiamiento los ayuntamientos y las y los productores beneficiarios. denominación de “Fertilizantes para el Bienestar”, va dirigido a pequeños agricultores de 1 a 2 ha, para cultivos de maíz, frijol y arroz.\n2. Alineación Programática al PED y/o PND.\nEl presente Programa está alineado al Plan Nacional de Desarrollo 2019–2024, al numeral II\n“Construir un país con bienestar”, asimismo como al punto “Autosuficiencia alimentaria y rescate al campo”, considerando que las acciones plasmadas en los foros de consulta ciudadana, integradas en el documento\n“Sentimientos del Pueblo Guerrerense” y el Plan Alternativo de Nación, que consiste en continuar con la cuarta transformación del campo a través del Programa Fortalecimiento al Campo en un programa integral y corresponsable.\nLas acciones establecidas en el Plan Nacional de Desarrollo 2019–2024; así como que la\nSAGADEGRO cumpla con el compromiso firmado por el Estado Mexicano ante la ONU en materia de igualdad de género, aplicando una política de igualdad sustantiva entre mujeres y hombres para así incorporar al mayor número de mujeres al Programa, es por ello que la atención al sector rural es una prioridad claramente señalada y a través del Programa Fortalecimiento al Campo se contribuye en beneficiar a las y los agricultores con la dotación de fertilizantes químicos y orgánicos, de biofábricas de insumos, certificación de los procesos productivos, para contribuir a la autosuficiencia alimentaria.\nEsto a través de las líneas de acción siguientes:\na) Que la aplicación de los recursos públicos se realice con eficiencia, eficacia, economía, honradez y transparencia.\nb) Entregar de manera correcta y oportuna los insumos estratégicos de nutrición para los cultivos básicos y frutales.\nc) Fomentar el crecimiento económico y el empleo, así como una más justa distribución del ingreso y la riqueza.\nd). Fomentar la actividad agropecuaria para el óptimo uso de la tierra con insumos, créditos, servicios de capacitación y asistencia técnica.\nf) Promover la firma de acuerdos de colaboración con instituciones académicas y de investigación pública y privada encaminadas a la transferencia de tecnología del sector agropecuario.\nf) Promover la inclusión de la mujer en el programa, al incorporarlas a estas actividades productivas podrán generar una fuente de ingreso para ellas y su familia.\n2.1. Diagnóstico.\nEn términos generales, puede afirmarse que la agricultura guerrerense presenta graves deficiencias estructurales y es una de las que registran mayor atraso tecnológico en el país. En el año 2020 se sembró una superficie de 448,880 hectáreas y derivado a la poca tecnología aplicada se tiene bajo rendimiento en la producción y una mínima utilidad financiera.\n2.1.1. Población Potencial.\nLa población potencial de acuerdo al Servicio de Información Agroalimentaria y Pesquera (SIAP) en el año 2020, fue de aproximadamente 350,000 productores para el cultivo de maíz, aguacate, mango, limón y otros siendo esta la principal actividad agrícola del estado de Guerrero.\n2.1.2. Población Objetivo.\nLa población objetivo de este Programa es de 50,000 agricultoras y agricultores.\n2.1.3 Población Beneficiaria.\nLa población beneficiaria que se pretende atender a través del Programa es de apoyar a 5,325 agricultoras y agricultores de bajos ingresos. P.O. 32 ALCANCE II, 21 DE ABRIL DE 2023)\n2.1.4. Población Indígena.\nLa población beneficiaria será principalmente en zonas de alta y muy alta marginación del estado de Guerrero.\n2.2. Fundamento Legal.\nLa SAGADEGRO, es la responsable en la planeación y ejecución del Programa, el cual tiene como fundamento legal, el siguiente:\na) Constitución Política de los Estados Unidos Mexicanos.\nc) Plan Nacional de Desarrollo 2019-2024.\ne) Ley de Desarrollo Rural Sustentable.\nf) Decreto Número 181 por medio del cual la Sexagésima Tercera Legislatura al Honorable\ng) Ley Número 814 de Desarrollo Rural Sustentable del Estado de Guerrero.\ni) Ley de Administración de Recursos Materiales del Estado de Guerrero.\nj) Ley Número 701 de Reconocimiento, Derechos y Cultura de los Pueblos Indígenas y\nComunidades Afromexicanas del Estado de Guerrero. (ADICIONADO, P.O. 32 ALCANCE II, 21 DE ABRIL DE\n2023)\nk) Ley Número 207 de Transparencia y Acceso a la Información Pública del Estado de Guerrero.\nl) Ley Orgánica de la Administración Pública del Estado de Guerrero Número 242.\n(ADICIONADO, P.O. 32 ALCANCE II, 21 DE ABRIL DE 2023)\nm) Ley Número 454 de Presupuesto y Disciplina Fiscal del Estado de Guerrero.\nn) Decreto Número 424 del Presupuesto de Egresos del Estado de Guerrero para el Ejercicio\nFiscal 2023. (ADICIONADO, P.O. 32 ALCANCE II, 21 DE ABRIL DE 2023)\no) Lineamientos para la Elaboración de las Reglas de Operación de los Programas Sociales\nEstatales para el periodo 2022 - 2027.\np) Todos aquellos ordenamientos normativos que sean aplicables.\n2.3. Definiciones y Siglas.\nDefiniciones:\nAyuntamientos: Todos los gobiernos municipales del estado de Guerrero.\nContraloría: La Secretaría de Contraloría y Transparencia Gubernamental del Estado de\nGuerrero.\nPadrón Único de Personas Beneficiarias: Registro nominal de personas beneficiarias del\nProductores: Las y los productores, mujeres y hombres, dedicados al cultivo de maíz y otras\nPrograma: Programa de Fortalecimiento al Campo. (REFORMADO, P.O. 32 ALCANCE II, 21 DE ABRIL DE\n2023)\nReglas de Operación: Reglas de Operación del Programa\nFortalecimiento al Campo. Reglas de Operación del Programa Fortalecimiento al Campo.\nSiglas.\nASE: Auditoría Superior del Estado.\nCAT: Comunidad Agroecológica para la Transformación.\nCONEVAL: Consejo Nacional de Evaluación de la Política de Desarrollo Social. (ADICIONADO, P.O.\n32 ALCANCE II, 21 DE ABRIL DE 2023)\nCOVID-19: Siglas en inglés de la enfermedad por coronavirus 2019. (ADICIONADO, P.O. 32 ALCANCE\nII, 21 DE ABRIL DE 2023)\nCURP: Clave Única de Registro de Población. (ADICIONADO, P.O. 32 ALCANCE II, 21 DE ABRIL DE 2023)\nDOF: Diario Oficial de la Federación. (ADICIONADO, P.O. 32 ALCANCE II, 21 DE ABRIL DE 2023)\nIED: Inversión Estatal Directa. (ADICIONADO, P.O. 32 ALCANCE II, 21 DE ABRIL DE 2023)\nMIR: Matriz de Indicadores de Resultados. (REFORMADO, P.O. 32 ALCANCE II, 21 DE ABRIL DE 2023)\nSAGADEGRO: Secretaría de Agricultura, Ganadería, Pesca y Desarrollo Rural.\nSARS-COV-2: Coronavirus de tipo 2 causante del síndrome respiratorio agudo severo.\n(ADICIONADO, P.O. 32 ALCANCE II, 21 DE ABRIL DE 2023)\nSEFINA: Secretaría de Finanzas y Administración. (REFORMADO, P.O. 32 ALCANCE II, 21 DE ABRIL DE\n2023)\nSEPLADER: Secretaría de Planeación y Desarrollo Regional. (REFORMADO, P.O. 32 ALCANCE II, 21\n3. Objetivos y Alcances.\n3.1. Objetivo General.\nApoyar a 5,325 agricultoras y agricultores de granos básicos y frutales en la adquisición y persona agricultora y el establecimiento de 66 Biofábricas de insumos orgánicos. (REFORMADO, P.O. 32\n3.2. Objetivos Específicos.\n➢ Beneficiar en forma directa a las y los agricultores del estado de Guerrero, que no son\n➢ Entrega de fertilizante.\n➢ Construcción de biofábricas de insumos.\n➢ Certificación de procesos productivos.\n➢ Realizar eventos demostrativos.\n➢ Impulsar la transformación y la reconversión productiva y económica, con un enfoque productivo de desarrollo rural sustentable.\n➢ Garantizar el derecho social de la protección y asistencia a la familia, así como un mejor nivel de vida.\n➢ Cumplir con el compromiso de igualdad de género, incorporando al mayor número de mujeres posibles al Programa.\n3.3. Cobertura.\nLa cobertura del Programa, será destinada a apoyar a todos los municipios del estado de Guerrero.\n3.4. Alcances.\nEl Programa se ejercerá en beneficio de las y los agricultores agrícolas, de granos básicos, frutales y otros que por algún motivo no están inscritos en el padrón del gobierno de México. Asimismo, se atenderá el derecho a la alimentación de la población y el autoconsumo de granos básicos y frutales.\n4. Metas Físicas.\nCon el Programa, se atenderá a 5,325 agricultores, hombres y mujeres, del estado de Guerrero, apoyando con un paquete por cada hectárea y el establecimiento de 66 Biofábricas de insumos.\n5. Programación Presupuestal.\nDirecta (IED) 2023, autorizados en el Decreto Número 424 del Presupuesto de Egresos del Estado de del 27 de diciembre del año 2022. Con un monto de $22’360,000.00 (Veintidós millones trescientos sesenta\nEn la ejecución de los recursos deberá cumplirse con el principio de anualidad, señalado en el mismo presupuesto de egresos.\nConcepto Total\nMarzo Abril Mayo Junio Julio\nAdquisición de paquetes de insumos agrícolas 10,844,600 10,844,600 21,689,200\nGastos de Operación (3%) 335,400 335,400 670,800\n5.1. Gastos de Operación.\nEn el Programa se considera el 3.0% para el concepto de gastos de operación, los cuales serán utilizados en los gastos generados en la entrega de los apoyos a la población beneficiada con una inversión de $1,770,000.00 (Un millón setecientos setenta mil pesos 00/100 M.N.) con recursos estatales provenientes del Programa de Inversión Estatal Directa (IED).\n6. Criterios y Requisitos de Elegibilidad.\nLas personas contempladas en la población objetivo, interesadas en obtener apoyos del\nPrograma, deberán cumplir con los criterios y requisitos de elegibilidad siguientes: (REFORMADO, P.O. 32\nALCANCE II, 21 DE ABRIL DE 2023)\na) Criterios de Elegibilidad:\nLas personas interesadas en la obtención de apoyos del Programa, deberán cumplir los siguientes criterios:\n● Cumplir con los requisitos del Programa.\n● Cumplir con lo establecido en la convocatoria correspondiente del Programa.\nb) Requisitos:\nLas personas pertenecientes a la población objetivo, podrán solicitar apoyos del Programa, cumpliendo los requisitos siguientes:\nDe manera individual:\nRequisito Documento\nFormato de solicitud de apoyo del Programa,\na). Presentar solicitud de apoyo de Anexo 2 de las Reglas de Operación, que será correspondiente página oficial.\nb). Identificación de la persona Copia de la identificación oficial con fotografía solicitante (Credencial para votar, Cédula Profesional o\nPasaporte)\nc). Domicilio en el estado de Guerrero Copia de recibo telefónico, recibo del servicio de agua o recibo de luz, con fecha no mayor a tres meses de la fecha de expedición, del domicilio fiscal de la persona solicitante.\nd). Documento que acredite la actividad - Certificado Parcelario expedido por el productiva del sector agrícola. Registro Agrario Nacional.\n- Escritura pública o privada.\n- Acta Dura del Ejido o de Bienes\nComunales (según caso).\n- Cesión de derechos temporal, duración del ciclo agrícola o el tiempo que acuerden ambas partes (Anexar copia del certificado parcelario y/o escritura pública de propiedad).\n- Contrato de Arrendamiento o usufructo parcelario, avalado por la autoridad Municipal, ejidal y/o comunal (Anexar copia del certificado parcelario y/o escritura pública de propiedad).\n-\ne). No ser beneficiaria o beneficiario de Escrito dirigido a la persona titular de la Secretaría, manifieste la persona solicitante que, en el presente ejercicio fiscal, no recibe apoyo por parte\nLa solicitud de apoyo y los documentos señalados, deberán presentarse en las oficinas de la\nSAGADEGRO, ubicadas en Carretera México - Acapulco Km. 274.5, Col. Burócratas, C.P. 39090.\nChilpancingo de los Bravo, Guerrero, en un horario de atención de las 9:00 a las 15:00 horas, o enviarse los documentos enviados.\n● El tipo de apoyo será en especie con un paquete de fertilizante edáfico y foliar.\n● El monto que representa el paquete es de $4,073.08.\n● El apoyo será otorgado por una sola vez en el ejercicio fiscal del año 2023.\n7.1. Características de los Apoyo. (REFORMADO, P.O. 32 ALCANCE II, 21 DE ABRIL DE 2023)\nEl paquete tecnológico se entregará a la persona agricultora de manera presencial firmando un vale por el insumo recibido.\nEl apoyo será en especie y es un paquete de fertilizante edáfico y foliar consistente en:\n● 3 bultos de fertilizante triple 17 mineralizado.\n● 5 litros de fertilizante foliar con micronutrientes.\nLos conceptos apoyo son indicativos, no limitativos. Estos conceptos pueden variar en función de las necesidades y solicitudes que se presenten en la ejecución del Programa.\n7.2. Recursos No Devengados.\nLos recursos que por algún motivo no se ejerzan al 31 de diciembre del presente ejercicio fiscal, serán reintegrados a la Tesorería de la Secretaría de Finanzas y Administración del Gobierno del Estado.\n7.3. Resguardo de la Documentación.\nEl resguardo de la documentación oficial de los agricultores beneficiados, mujeres y hombres, beneficiados.\n7.4. Supervisión y Control.\nLa SAGADEGRO enviará mensualmente la información correspondiente al avance físico-financiero a la SEPLADER. De igual manera, enviará trimestralmente a la SEFINA y CONTRALORÍA, informes sobre el presupuesto ejercido, dichos informes se deberán presentar a más tardar a los 15 días hábiles posteriores a la terminación de cada trimestre.\n8. Criterios de Selección.\nSerán prioridad las y los agricultores ubicados en localidades de alta, muy alta y media marginación, dando inclusión a la población indígena, mujeres y afrodescendientes, dedicados a actividades del campo.\nSu selección se hará en función de la disponibilidad presupuestal del Programa y la viabilidad social, técnica y productiva de la persona solicitante.\nPara ser beneficiada o beneficiado del Programa, las y los agricultores, deberán presentar la solicitud dirigida a la SAGADEGRO, ubicada en Carretera Nacional México - Acapulco km 274.5, Col. Burócratas, en Chilpancingo, Guerrero, en días hábiles con un horario de 9:00 a 15:00 horas, así mismo deberá cumplir con los requisitos que se enlistan en el numeral 6 Criterios y Requisitos de Elegibilidad, además de:\n- Ser productora o productor agrícola.\n- Aplicar de manera correcta en tiempo y forma el paquete recibido.\n8.1. Casos Especiales.\nEn el dado caso que se presentara u ocurriera alguna situación extraordinaria que impida la operación normal del Programa, la persona titular de la SAGADEGRO o el ejecutivo estatal indicarán las acciones a implementar en la operatividad del Programa.\n8.2. Casos de Emergencia o Desastre.\nEn el dado caso de una emergencia o desastre natural, la SAGADEGRO podrá adelantar la entrega de los apoyos a la población beneficiaria, con el fin de evitar la interrupción de la operación del\nPrograma.\n8.3. Suspensión o Cancelación del Programa Social.\nEn el supuesto de que no se liberen los recursos destinados y aprobados por el Congreso, en el\nDecreto de Presupuesto de Egresos del Estado de Guerrero, para la ejecución de este Programa, por falta de disponibilidad presupuestal, se procederá a la suspensión o cancelación del mismo.\nAsí también por el incumplimiento con las obligaciones de las y los productores, y presenten solicitudes con documentos falsos, se pretenda la desviación de recursos, u otro uso que contravenga, la esencia del Programa, y las y los productores pretendan presionar para la obtención de los recursos, provocando caos social y económico en el entorno local o regional, afectando a las y los beneficiarios que se apegan a la normatividad en la vía de la paz social, estatal o federal, la SAGADEGRO, podrá proponer a la persona titular del Ejecutivo Estatal la cancelación del Programa por problemas de gobernabilidad.\n8.4. Integración del Padrón de Personas Beneficiarias.\nLa población productora beneficiaria, serán incorporadas al Padrón Único de Personas\nBeneficiarias de la SAGADEGRO, siendo reservados sus datos personales en base a la Ley Número 207 emplearse para propósitos de proselitismo político, religioso o comercial, ni para ningún otro distinto al establecido en las presentes Reglas de Operación.\n9. Mecánica Operativa del Programa Social.\n9.1. Instancia Ejecutora y/o Responsable.\nLa instancia ejecutora del Programa será la SAGADEGRO, a través de la Dirección General de los Sistemas Producto y Comercialización, en cumplimiento a las Reglas de Operación y tendrá la responsabilidad de verificar que la formulación de los expedientes técnicos de los proyectos, reúnan los requisitos exigidos por la instancia normativa, tales como apego a la planeación estratégica, programación, presupuesto, calendario de ejecución, ejercicio y control del gasto público. (REFORMADO, P.O. 32 ALCANCE II,\n21 DE ABRIL DE 2023)\nPara la evaluación interna y constante de las acciones a desarrollar en la ejecución del Programa, existirá un Comité de Evaluación; dicho comité es un órgano colegiado que tendrá como objetivo conocer y resolver los asuntos del Programa, especialmente, la autorización de solicitudes de apoyo; el cual estará integrado de la manera siguiente:\na) La persona titular de la Secretaría de Agricultura, Ganadería, Pesca y Desarrollo Rural, que fungirá como presidenta o presidente;\nb) La persona titular de la Dirección General de los Sistemas Producto y Comercialización, quien fungirá como secretaria o secretario técnico;\nc) La persona titular de la Subsecretaría;\nd) La persona titular de la Unidad de Asuntos Jurídicos;\ne) La persona titular de la Unidad de Planeación y Presupuesto, y\nf) La persona titular de la Delegación Administrativa.\n9.2. Proceso de Incorporación al Programa Social.\nLa Dirección General de los Sistemas Producto y Comercialización, atenderá las solicitudes de apoyo de las y los agricultores, que entreguen copia de solicitud en formato libre, así como también copia\n● Credencial de elector.\n● Clave Única de Registro de Población (CURP).\n● Comprobante de domicilio (recibo de agua, luz, teléfono, no mayor a 3 meses).\n● Documento que acredite la propiedad legal del predio o renta de los mismos, los cuales podrán ser los siguientes:\n* Certificado Parcelario expedido por el Registro Agrario Nacional.\n* Escritura pública o privada.\n* Acta Dura del Ejido o de Bienes Comunales (según caso).\n* Cesión de derechos temporal, duración del ciclo agrícola o el tiempo que acuerden ambas partes (anexar copia del certificado parcelario y/o escritura pública de propiedad).\n* Contrato de Arrendamiento o usufructo parcelario, avalado por la autoridad municipal, ejidal y/o comunal\n(anexar copia del certificado parcelario y/o escritura pública de propiedad).\n10. Evaluación.\nEn caso de que se requiera la evaluación del Programa, la SAGADEGRO, podrá convenir con una institución académica de Investigación o algún organismo especializado de carácter nacional, que cuente con reconocimiento y experiencia en la materia, a efecto de realizar una valoración objetiva para la toma oportuna de decisiones en los próximos ejercicios.\n10.1. Indicadores. (construcción de la Matriz de Indicadores para Resultados. Anexo 1)\nEn congruencia con la metodología de Presupuesto Basado en Resultados, empleada a nivel su construcción y la definición de los indicadores, la Metodología de Marco Lógico; señalando los instrumentos de evaluación cuantitativa y/o cualitativa complementarios que se consideren pertinentes, de acuerdo con las necesidades y características del Programa.\n10.2. Seguimiento.\nLa SAGADEGRO a través de la aplicación, operación, seguimiento y evaluación del Programa, estas Reglas de Operación. Caso contrario, podrán ser acreedores a las sanciones administrativas correspondientes a que alude la Ley de Responsabilidades Administrativas el Estado de Guerrero.\n10.3. Auditoría.\nLos recursos ejercidos en el Programa, podrán ser fiscalizados por el Órgano Interno de Control y demás instancias que los ámbitos de sus respectivas atribuciones resulten competentes, así como la\nContraloría.\nComo resultado de las acciones de auditoría que se lleven a cabo, el Órgano Interno de Control mantendrá un seguimiento interno que permita emitir los informes de las revisiones practicadas, dando principal importancia a la atención en tiempo y forma, de las irregularidades detectadas, hasta su total solventación.\n11. Mecanismo de Entrega del Apoyo.\nLas personas beneficiarias, cuyos datos fueron verificados, validados y revisados por el personal de la Dirección General de los Sistemas Producto y Comercialización, que cumplan con los criterios y requisitos de elegibilidad, establecidos en las presentes Reglas de Operación, recibirán el apoyo en especie proporcionado por el Programa por medio del vale de apoyo, por única ocasión. Los apoyos y/o paquetes se entregarán de forma individual y de manera presencial a través de las y los proveedores previo convenio de compra-venta. (REFORMADO, P.O. 32 ALCANCE II, 21 DE ABRIL DE 2023)\n12. Derechos y Obligaciones de las Personas Beneficiadas.\nDerechos.\nEl Programa, está destinado para apoyar a las y los agricultores de bajos recursos; a quienes se apoyará hasta con dos hectáreas de cultivo, siendo responsabilidad de la SAGADEGRO el cumplimiento de esta disposición, efectuando así con lo establecido en la Constitución Política de los Estados Unidos\nMexicanos, de que toda persona tiene derecho a participar y beneficiarse con los programas de desarrollo social.\nObligaciones.\nLa o el productor beneficiado tiene las obligaciones siguientes:\na) Entregar la documentación personal que integra el expediente.\nb) La aplicación del paquete tecnológico y el uso correcto del insumo recibido.\nc) No ser beneficiada o beneficiado con el mismo insumo por otro programa, dependencia o asociación.\nd) No usar el beneficio con fines de lucro.\n12.1. Causales de Suspensión o Baja de las Personas Beneficiadas.\n➢ Que no tenga en usufructo tierras de labor, ni arrenden en su caso.\n➢ Que la o el productor no siembre.\n➢ El fallecimiento de la persona beneficiada.\n➢ Que la o el productor se encuentre registrado en algún otro programa social.\n➢ Que la o el productor sea sorprendido comercializando el insumo.\n12.2. Proceso de Baja.\nLa o el agricultor que sea considerado en los causales de suspensión, será dado de baja del\nPadrón Único de Personas Beneficiarias del Programa.\n13. Instancias Participantes.\nLa ejecución del Programa estará a cargo de la SAGADEGRO en coordinación con las y los productores que sean beneficiados.\n13.1. Instancia Normativa.\nLa instancia administrativa será operada por la SAGADEGRO y la correcta aplicación será supervisada por la ASE y la Contraloría, aplicando de manera estricta la ley en los casos de desvíos, a las servidoras o servidores públicos responsables del Programa.\n14. Transparencia.\nConforme a la Ley Número 207 de Transparencia y Acceso a la Información del Estado de\nGuerrero: i) Trimestralmente se carga a la Plataforma Nacional de Transparencia la información correspondiente a cada trimestre; ii) Información de los programas de subsidios, estímulos y apoyos, en los que se deberá informar respecto de los programas de transferencia, de servicio, de infraestructura social y de subsidio, en los que se deberá de contener: nombre del programa, periodo de actualización trimestral, fecha de ventanillas, fecha de autorización, nombre de la o el beneficiario, monto en especie o efectivo, fecha de pago; iii) Información de los programas que se desarrollaron a lo largo del ejercicio; iv) Periodo de\nConservación de la información del ejercicio de curso y la correspondiente a los dos ejercicios anteriores.\n14.1. Promoción y Difusión del Programa Social. de SAGADEGRO, ubicadas en Carretera Nacional México - Acapulco km 274.5, Col. Burócratas en\nChilpancingo, Guerrero, en un horario de 09:00 a 15:00 horas de lunes a viernes, asimismo a través del número de teléfono 01 (747) 47-1-92-10, así como en las delegaciones regionales de la SAGADEGRO.\nLa papelería, publicidad y promoción del Programa incluirá la leyenda descrita en el apartado\n“Blindaje Electoral”.\n14.2. Contraloría Social.\nComprenden las acciones de control, vigilancia y evaluación que realizan las personas, ya sea de manera organizada o independiente bajo un esquema de derechos y compromisos ciudadanos con el propósito de contribuir a la gestión gubernamental. Estarán a cargo de las y los miembros de la comunidad, las y los integrantes del comité de beneficiarias y beneficiarios del Programa.\nLa instancia operadora promoverá la contraloría social con base en la normatividad establecida para tal efecto, con el propósito de contribuir a que la gestión gubernamental se realice en términos de transparencia, eficacia y honradez.\nLas acciones que fomenta el comité de contraloría social son las siguientes:\n- Informar a la ciudadanía acerca de los apoyos otorgados y su costo a nivel de obra, acción, nombre de las y los beneficiarios, así como sus derechos y obligaciones.\n- Capacitar a las y los beneficiarios para que se constituyan en instancias de vigilancia y evaluación social.\n- Establecer espacios de comunicación como son reuniones vecinales y atención directa a las y los beneficiarios.\n- Promover la integración de organizaciones de la sociedad civil en acciones de contraloría social.\n- Instrumentar mecanismos de recepción y atención de quejas y denuncias. El órgano estatal de control verificará, en lo correspondiente, la realización de dichas acciones.\n14.3. Protección de Datos Personales.\nLas solicitudes dictaminadas como negativas se entregarán al solicitante, si así lo requiere, y las dictaminadas como positivas de apoyo, se incorporarán al Programa, y las que formarán parte de un Padrón\nÚnico de Personas Beneficiarias, será de carácter público, siendo reservados los datos personales, se\nEstado de Guerrero; los cuales en ningún caso podrán emplearse para propósitos de proselitismo político, religioso o comercial, ni para ningún otro fin distinto al establecido en las presentes Reglas de Operación.\n14.4. Quejas y Denuncias.\nAtendiendo el derecho que tienen las y los beneficiarios al cumplir con cada uno de los requisitos, que fueron aceptados en el Programa y que no se les haya entregado el apoyo, podrán presentar las quejas servidoras o servidores públicos, en la Contraloría y la ASE, a través de denuncias por escrito, vía internet, vía telefónica y por comparecencia de la parte interesada, debiendo proporcionar los datos siguientes:\n➢ Nombre de la servidora o servidor público.\n➢ Dependencia de adscripción.\n➢ Objeto de la denuncia.\n➢ Nombre y domicilio de la persona quejosa.\n➢ Identificación oficial de la persona quejosa.\n14.5. Acciones de Blindaje.\nLas autoridades involucradas en la aplicación y operación de la estrategia, asegurarán que en toda la papelería lleve impresa al pie de página de los documentos oficiales la leyenda siguiente:\n“Este Programa es de carácter público, no es patrocinado ni promovido por partido político alguno y sus recursos provienen de los impuestos que pagan todos los contribuyentes. Está prohibido el uso de este programa con fines políticos, electorales, de lucro y otros distintos a los establecidos. Quien haga uso indebido de los recursos de este programa deberá ser denunciado y sancionado de acuerdo con la Ley aplicable y ante la Autoridad competente”.\n14.6. Acta de Donación. (Anexo 2)\nEl Programa no contempla la figura de donación en el otorgamiento de apoyos, en consecuencia, no aplica el presente punto de los Lineamientos para la Elaboración de las Reglas de Operación de los\nProgramas Sociales Estatales para el Periodo 2022-2027, publicados en el Periódico Oficial del Gobierno recepción para comprobar la entrega a las y los beneficiarios. (REFORMADO, P.O. 32 ALCANCE II, 21 DE ABRIL\nDE 2023)\n15. Perspectiva de Género.\nEste Programa es de manera incluyente y con perspectiva de género, procurando la participación de las mujeres, en igualdad de condiciones para mejorar sustancialmente la calidad y condición de vida para posesionar por su valor productivo en la comunidad, evitando que sufran violencia de género y discriminación.\n16. Enfoque de Derechos.\nEl Programa está destinado para apoyar a las personas productoras de bajos recursos, mujeres y hombres; siendo responsabilidad de la SAGADEGRO el cumplimiento de esta disposición, cumpliendo así\nPrimero. El presente Acuerdo entrará en vigor al día siguiente de su publicación en el Periódico\nSegundo. A partir de la entrada en vigor del presente Acuerdo, las Reglas de Operación del\nPrograma Fortalecimiento al Campo, subsecuentes o sus modificaciones serán emitidas por la persona titular de la Secretaría de Agricultura, Ganadería, Pesca y Desarrollo Rural, responsable directo de la operación y ejecución de las mismas.\nDado en el “Recinto de las Oficinas del Poder Ejecutivo del Estado”, el inmueble ubicado en el número 62, Edificio Norte Planta Baja, en Boulevard René Juárez Cisneros, Código Postal 39074, Colonia\nCiudad de los Servicios, en la Ciudad de Chilpancingo de los Bravo, capital del estado de Guerrero, a los treinta días del mes de mayo del año dos mil veintidós.\nLA GOBERNADORA CONSTITUCIONAL DEL ESTADO DE GUERRERO.\nMTRA. EVELYN CECIA SALGADO PINEDA.\nRúbrica.\nEL SECRETARIO GENERAL DE GOBIERNO.\nMTRO. LUDWIG MARCIAL REYNOSO NUÑEZ.\nRúbrica.\nEL SECRETARIO DE AGRICULTURA, GANADERÍA, PESCA Y DESARROLLO RURAL.\nDR. JORGE PETO CALDERÓN.\nRúbrica.\nN. DE E. A CONTINUACIÓN, SE TRANSCRIBEN LOS ARTÍCULOS TRANSITORIOS DE LOS\nACUERDO DE MODIFICACIÓN A LAS PRESENTES REGLAS DE OPERACIÓN.\nFISCAL 2022; PARA QUE SE AMPLIÉ SU VIGENCIA POR EL PERIODO QUE SE ENCUENTRE EN\nAPLICACIÓN DICHO PROGRAMA.\nPrimero. El presente Acuerdo de Modificación, entrará en vigor al siguiente día de su publicación\nSegundo. Se derogan todas las disposiciones que se opongan al presente Acuerdo de",
  "ordenamiento": "PROGRAMA",
  "jurisdiccion": "GUERRERO",
  "fuente_oficial": "DIARIO OFICIAL DE LA FEDERACION",
  "Fecha de Publicación": "21 DE ABRIL DE 2023",
  "ULTIMA REFORMA PUBLICADA": null,
  "status": "VIGENTE",
  "es_escaneado": false,
  "tiene_tablas": true,
  "materia": [
    "agrario"
  ]
}