{
  "titulo": "Acuerdo por el Que Se Crea el Programa Apoyo A Certificación de Mezcal Guerrerense y Se Emiten Sus R",
  "Contenido": "OPERACIÓN PARA EL EJERCICIO FISCAL 2022\nEL PROGRAMA DE APOYO A LA CERTIFICACIÓN DE MEZCALES GUERRERENSES, Y SE EMITEN SUS\nTEXTO ORIGINAL.\nAcuerdo publicado en el Periódico Oficial del Gobierno del Estado No. 68 Alcance II, el Viernes 26 de agosto de 2022.\nACUERDO POR EL QUE SE CREA EL PROGRAMA APOYO A CERTIFICACIÓN DE MEZCAL\nGUERRERENSE Y SE EMITEN SUS REGLAS DE OPERACIÓN PARA EL EJERCICIO FISCAL 2022.\nGuerrero. - Poder Ejecutivo.\nMAESTRA EVELYN CECIA SALGADO PINEDA, GOBERNADORA CONSTITUCIONAL DEL\nESTADO DE GUERRERO, CON FUNDAMENTO EN LO DISPUESTO POR LOS ARTÍCULOS 71, 87, 88,\nLOS ARTÍCULOS 2, 3, 6, 7, 10, 11, 18 APARTADO A FRACCIONES I Y X, 20 FRACCIÓN III Y 29 DE LA\nLEY ORGÁNICA DE LA ADMINISTRACIÓN PÚBLICA DEL ESTADO DE GUERRERO NÚMERO 08; 1,\n2 FRACCIÓN I, 18 Y 25 DE LA LEY NÚMERO 454 DE PRESUPUESTO Y DISCIPLINA FISCAL DEL\nESTADO DE GUERRERO; 33, 34 Y 35 FRACCIONES I Y II DE LA LEY DE FOMENTO ECONÓMICO,\nINVERSIÓN Y DESARROLLO DEL ESTADO DE GUERRERO NÚMERO 487; EN RELACIÓN CON EL\nARTÍCULO 57 ANEXOS 21 (E10) Y 21-A (E10) DEL DECRETO NÚMERO 160 DEL PRESUPUESTO DE\nEGRESOS DEL ESTADO DE GUERRERO PARA EL EJERCICIO FISCAL 2022 Y LOS LINEAMIENTOS\nPARA LA ELABORACIÓN DE LAS REGLAS DE OPERACIÓN DE LOS PROGRAMAS SOCIALES\nESTATALES PARA EL PERIODO 2022-2027.\nQue el Plan Nacional de Desarrollo 2019-2024, en su principio rector de economía para el bienestar, establece que el objetivo de la política económica no es producir cifras y estadísticas armoniosas sino generar bienestar para la población. Por lo tanto, este documento rector del desarrollo económico y social de nuestro país, constituye el punto de partida para el diseño e implementación del Programa Apoyo a Certificación de Mezcal Guerrerense.\nQue el Plan Estatal de Desarrollo 2022-2027, en el Eje 2 Desarrollo Económico Sostenible, y las Micro, Pequeñas y Medianas Empresas (MIPYMES).\nQue la visión para el futuro de nuestro estado es de derechos e inclusión, siendo una de las prioridades contribuir a reducir las carencias sociales, entre las que destacan el rezago educativo con\n26.6%, el acceso a los servicios de salud con un 33.5%, un acceso a la seguridad social de un 73.5%, con calidad y espacios en la vivienda de un 25.9%, accesos a los servicios básicos en la vivienda con un 56.3%\nOPERACIÓN PARA EL EJERCICIO FISCAL 2022 y con un acceso a la alimentación nutritiva y de calidad de un 36.1% según el CONEVAL, 2020; los cuales son los principales indicadores a mejorar para contribuir al bienestar de las familias guerrerenses.\nGuerrero, establece que el estado de Guerrero atenderá de manera programática y planificada los derechos económicos, sociales, culturales y ambientales para hacer realidad el progreso y el bienestar de sus habitantes; al efecto, expedirá programas de gobierno y políticas públicas que se requieran.\nQue en el artículo 57 del Decreto Número 160 del Presupuesto de Egresos del Estado de Guerrero para el Ejercicio Fiscal 2022, establece que con el objetivo de asegurar la aplicación eficiente, eficaz, oportuna, equitativa, y transparente de los recursos públicos, la Secretaría de Finanzas y Administración y la Secretaría de Planeación y Desarrollo Regional emitirán las disposiciones a que deberán sujetarse los programas de inversión sujetos a Reglas de Operación.\nQue la Secretaría de Planeación y Desarrollo Regional expidió los Lineamientos para la\nElaboración de las Reglas de Operación de los Programas Sociales Estatales para el Periodo 2022 – 2027 publicados en el Periódico Oficial del Gobierno del Estado número 14 de fecha 18 de febrero de 2022, los cuales tienen la finalidad de ser un instrumento técnico que guie la elaboración de los apartados centrales de las Reglas de Operación, así como los elementos para integrar su contenido.\nQue, por consiguiente, las personas titulares de las secretarías y/o entidades paraestatales de la administración pública, así como las servidoras y servidores públicos autorizados para ejercer recursos públicos del presupuesto de inversión de los mismos, serán responsables de los programas y/o proyectos de inversión que realicen, los apoyos otorgados deberán sujetarse a los criterios de objetividad, equidad, transparencia, publicidad, selectividad y temporalidad.\nQue la Secretaría de Fomento y Desarrollo Económico, entre sus atribuciones tiene la de planear y coordinar las actividades económicas y de inversión, estableciendo y fomentando la ejecución de programas, proyectos y acciones que demanden el interés general, procurando en todo momento la preservación del medio ambiente.\nQue el Programa Apoyo a Certificación de Mezcal Guerrerense, tiene por objeto incrementar la productividad y la capacidad de comercialización de 20 personas físicas o morales dedicadas a la producción de mezcal, mediante incentivos económicos para certificar sus instalaciones, lotes y actividades de la cadena de valor maguey - mezcal, contribuyendo a la generación de empleos formales que les permitan mejorar su nivel de bienestar.\nPor lo anteriormente expuesto, he tenido a bien expedir el siguiente:\nGUERRERENSE Y SE EMITEN SUS REGLAS DE OPERACIÓN PARA EL EJERCICIO FISCAL 2022.\nOPERACIÓN PARA EL EJERCICIO FISCAL 2022\nArtículo 1. Se crea el Programa Apoyo a Certificación de Mezcal Guerrerense, el cual tiene como propósito implementar acciones que impulsen la competitividad de la producción, certificación, envasado y comercialización de mezcal en Guerrero, al amparo de la Denominación de Origen Mezcal.\nArtículo 2. La Secretaría de Fomento y Desarrollo Económico, tendrá a cargo la implementación, operación, ejecución, evaluación y administración del Programa Apoyo a Certificación de Mezcal\nGuerrerense, bajo los criterios de objetividad, equidad, transparencia, publicidad, selectividad y temporalidad, con estricto apego a la normatividad aplicable, por lo tanto, será la encargada de la dispersión y asignación de los recursos del Programa, apegándose plenamente a las Reglas de Operación.\nArtículo 3. Se emiten las Reglas de Operación del Programa Apoyo a Certificación de Mezcal\nGuerrerense para el Ejercicio Fiscal 2022, en las cuales se establecen los principios de eficiencia, eficacia, oportunidad, equidad y transparencia de los recursos públicos y requisitos que se deben de cumplir para poder acceder a dicho Programa; en los términos siguientes:\nREGLAS DE OPERACIÓN DEL PROGRAMA APOYO A CERTIFICACIÓN DE MEZCAL\nGUERRERENSE PARA EL EJERCICIO FISCAL 2022.\n1. Introducción.\n1.1. Antecedentes.\nUna de las tareas centrales del gobierno del estado es impulsar la reactivación económica y lograr que la economía vuelva a crecer a tasas aceptables. Para ello se requiere, en primer lugar, del fortalecimiento del mercado interno, lo que se conseguirá con una política de recuperación salarial y una estrategia de creación masiva de empleos productivos, permanentes y bien remunerados. Hoy en día más de la mitad de la población económicamente activa permanece en el sector informal, la mayor parte con ingresos por debajo de la línea de pobreza y sin prestaciones laborales. Esa situación resulta inaceptable desde cualquier perspectiva ética y perniciosa para cualquier perspectiva económica: para los propios informales, que viven en un entorno que les niega derechos básicos, para las y los productores, que no pueden colocar sus productos por falta de consumidores, y para el fisco, que no puede considerarlos causantes.\nEl sector público fomentará la creación de empleos mediante programas sectoriales, proyectos regionales y obras de infraestructura, pero también facilitando el acceso al crédito a las pequeñas y medianas empresas (que constituyen el 93 por ciento y que generan la mayor parte de los empleos) y reduciendo y simplificando los requisitos para la creación de empresas nuevas.\nMéxico inició en el periodo prehispánico, principalmente entre las culturas azteca y zapoteca. El estado de\nGuerrero ha sido parte de esta tradición y actualmente sus 81 municipios forman parte del territorio protegido por la Denominación de Origen Mezcal.\nOPERACIÓN PARA EL EJERCICIO FISCAL 2022\nDatos del Consejo Mexicano Regulador de la Calidad del Mezcal, A.C., indican que el estado de\nGuerrero ocupa el tercer lugar en la producción nacional de mezcal, asimismo, información de la Secretaría de Agricultura, Ganadería, Pesca y Desarrollo Rural (SAGADEGRO), señala que en la entidad se producen anualmente más de un millón de litros de mezcal, que en un porcentaje importante se comercializa sin la certificación de la Norma Oficial Mexicana NOM-070-SCFI-2016, Bebidas alcohólicas-MezcalEspecificaciones, cuyo cumplimiento es de carácter obligatorio para que los productores, envasadores y comercializadores, estén en posibilidad de solicitar al Instituto Mexicano de la Propiedad Industrial (IMPI), el uso de la Denominación de Origen Mezcal, situación que impide, por un lado, que las y los productores\nGuerrerenses participen en condiciones competitivas en la producción y comercialización de mezcal, afectando la calidad y los precios de su producto.\nPara atender la problemática anterior, se promueve el Programa Apoyo a Certificación de Mezcal\nGuerrerense, que establece apoyos a las y los productores de mezcal con la constitución de empresas, capacitaciones a pequeños mezcaleros, activos productivos, así como, para que obtengan la certificación de la Norma Oficial Mexicana NOM-070- SCFI-2016, Bebidas alcohólicas-Mezcal-Especificaciones; los apoyos permitirán la producción, envasado y la comercialización de conformidad con las regulaciones establecidas y, en consecuencia, la obtención de mejores precios.\nEl sector público fomentará la creación de empleos mediante programas sectoriales, proyectos regionales y obras de infraestructura, pero también facilitando el acceso al crédito a las pequeñas y medianas empresas (que constituyen el 93 por ciento y que generan la mayor parte de los empleos) y reduciendo y simplificando los requisitos para la creación de empresas nuevas.\nEl estado de Guerrero forma parte del territorio protegido por la denominación de origen mezcal, que incluye también las siguientes entidades federativas: Oaxaca, Durango, San Luis Potosí, Zacatecas, Guanajuato, Tamaulipas, Michoacán y Puebla, constituyendo una actividad económica importante para las y los guerrerenses.\nEn los últimos años se ha incrementado significativamente la demanda de mezcal, tanto en el mercado nacional como en el internacional; cifras del Consejo Mexicano Regulador de la Calidad del\nMezcal, A. C., indican que, en el año 2013, la producción de mezcal en México fue de 980,375 litros, dato que para 2019, se ubicó en 7,145,039 litros. Por otra parte, diferentes estudios indican que el mezcal se ha posicionado entre las cinco bebidas de mayor consumo en nuestro país. Adicionalmente, las exportaciones de mezcal en 2013, ascendieron a 7.5 millones de dólares en tanto que, en 2019, el monto se ubicó en\n74.2 millones de dólares. Los principales países a los que se exporta el mezcal son: Estados Unidos de\nAmérica, España, Países Bajos, Reino Unido de la Gran Bretaña, Francia, Canadá, Alemania, Italia, Australia y Colombia.\n2. Alineación Programática al PED y/o PND.\nQue el eje de “Economía” del Plan Nacional de Desarrollo 2019-2024, una de las tareas centrales tasas aceptables.\nOPERACIÓN PARA EL EJERCICIO FISCAL 2022 objetivos y estrategias siguientes.\nEje: III. Economía.\nObjetivo: Impulsar la reactivación económica, el mercado interno y el empleo.\nAsimismo, se vincula con los objetivos prioritarios, estrategias prioritarias y líneas de acción puntuales del Programa Sectorial de Economía 2020-2024, publicado en el Diario Oficial de la Federación el 24 de junio de 2020.\nObjetivo prioritario 3. Promover la creación y consolidación de las MIPYMES productivas para una mayor inclusión productiva.\nEstrategia prioritaria 3.1. Promover el acceso al capital físico y financiero para ampliar el potencial productivo de las MIPYMES.\nAcción puntual: 3.1.1 Promover el otorgamiento de productos financieros adaptados a las necesidades de las MIPYMES y personas emprendedoras.\nEstrategia prioritaria 3.2. Impulsar la capacitación del capital humano para elevar la capacidad competitiva de las MIPYMES.\nAcción puntual: 3.2.2 Establecer mecanismos para promover equipamiento productivo a las\nMIPYMES.\nEstrategia prioritaria 3.4. Impulsar la capacidad de la innovación y el desarrollo tecnológico para incentivar la competitividad de las MIPYMES.\nAcción puntual: 3.4.4 Impulsar proyectos e iniciativas, en coordinación con diversas instituciones, para incorporar a un mayor número de empresas MIPYMES en cadenas de valor y cadenas de proveeduría.\n2.1. Diagnóstico.\nNuestra entidad es uno de los principales estados productores de mezcal a nivel nacional, sin embargo, gran parte de la producción se comercializa sin la certificación obligatoria de la NOM-070-SCFI2016, por lo tanto, no pueden comercializar el producto con los lineamientos que establece la Denominación de Origen Mezcal. Por ello, es importante que el mezcal guerrerense cumpla con las regulaciones y, en consecuencia, obtengan mejores ingresos.\nLa producción y comercialización de mezcal sin la certificación de la NOM-070-SCFI-2016, ha sido de atención al tema de la sustentabilidad ambiental.\nOPERACIÓN PARA EL EJERCICIO FISCAL 2022 la certificación de la Norma Oficial Mexicana NOM-070-SCFI-2016.\nEl Programa, tendrá como propósito apoyar a las y los productores de mezcal con la constitución de empresas, capacitaciones a pequeños mezcaleros, activos productivos, así como, para que obtengan la certificación de la Norma Oficial Mexicana NOM-070- SCFI-2016, Bebidas alcohólicas-MezcalEspecificaciones, cuyo cumplimiento es de carácter obligatorio para la producción, envasado y comercialización, al amparo de la Denominación de Origen Mezcal, para aprovechar la demanda creciente en el mercado nacional e internacional, en términos de generación empleos y mejores ingresos para las y los productores guerrerenses, la operación, ejecución, evaluación y administración del Programa estará a cargo de la Secretaría de Fomento y Desarrollo Económico.\nLos recursos para financiar el Programa se derivan del Fondo de Financiamiento de Inversión\nEstatal Directa (IED); mismo que el monto estará sujeto a la suficiencia presupuestal disponible para la implementación.\nLa falta de la certificación bajo la NOM-070-SCFI- 2016, al comercializar el mezcal no se puede ostentar en el envase del producto la Denominación de Origen Mezcal que identifica a un producto como originario de un país, estado, región y/o localidad, cuando la calidad representada u otra característica de este sea imputable.\nProducir, envasar y comercializar mezcal que cumpla con los parámetros que establece la\nDenominación de Origen Mezcal y la NOM-070-SCFI-2016, les permitirá a las y los productores guerrerenses comercializar su producto en mejores condiciones competitivas en el mercado nacional e internacional, generando mejores ingresos y posicionando el prestigio del mezcal guerrerense.\nEl Programa no tiene antecedentes, en consecuencia, no se cuenta con información de ejercicios presupuestales anteriores; en el presente año se tiene contemplado apoyar a 20 pequeñas y medianas empresas, sean personas físicas o personas morales legalmente constituidas con domicilio fiscal en el estado de Guerrero, dedicadas a la producción, envasado y comercialización de mezcal.\n2.1.1. Población Potencial.\nLa población potencial son todas las personas físicas o morales legalmente constituidas, y que dentro de sus actividades realicen actividades relacionadas con la cadena de valor maguey- mezcal.\n2.1.2. Población Objetivo.\nLa población objetivo del Programa, está compuesta por micros, pequeñas y medianas empresas, Guerrero que se dedican a la producción, envasado y comercialización de mezcal.\nOPERACIÓN PARA EL EJERCICIO FISCAL 2022\n2.1.3. Población Beneficiaria.\nEstá compuesta por micros, pequeñas y medianas empresas, sean personas físicas o personas producción, envasado y comercialización de mezcal, y que presentaron solicitud de apoyo y fueron atendidas con el otorgamiento de apoyos del Programa.\n2.1.4. Población Indígena.\nSe dará preferencia a personas solicitantes que pertenezcan a grupos o comunidades indígenas y/o afrodescendientes que se dediquen a las actividades productivas; mujeres, personas con discapacidad y solicitantes que viven en zonas de alta y muy alta marginación.\n2.2. Fundamento Legal.\na) Constitución Política de los Estados Unidos Mexicanos.\nc) Ley de Coordinación Fiscal.\nd) Ley Orgánica de la Administración Pública del Estado de Guerrero Número 08.\ne) Ley Número 207 de Transparencia y Acceso a la Información Pública del Estado de Guerrero.\nf) Ley Número 454 de Presupuesto y Disciplina Fiscal del Estado de Guerrero.\ng) Ley Número 466 de Protección de Datos Personales en Posesión de Sujetos Obligados del Estado de Guerrero.\ni) Ley de Fomento Económico, Inversión y Desarrollo del Estado de Guerrero Número 487.\nk) Decreto Número 160 del Presupuesto de Egresos del Estado de Guerrero para el Ejercicio Fiscal\n2022.\nl) Lineamientos para la elaboración de las Reglas de Operación de los Programas Sociales Estatales para el periodo 2022-2027.\nm) Plan Nacional de Desarrollo 2019-2024.\nOPERACIÓN PARA EL EJERCICIO FISCAL 2022\nn) Programa Sectorial de Economía 2020-2024, Programa Sectorial derivado del Plan Nacional de\nDesarrollo 2019-2024. ñ) Reglamento Interior de la Secretaría de Fomento y Desarrollo Económico.\no). Y todos aquellos ordenamientos normativos aplicables.\n2.3. Definiciones y Siglas.\nDefiniciones:\nActa Constitutiva: Documento jurídico fehaciente que establece de forma legal la formación de una organización o sociedad, en el cual se estipulan los aspectos generales de la misma.\nActa de Asamblea: Documento mediante el cual las y los integrantes de una persona moral expresan la voluntad colectiva de la organización y formalizan los acuerdos de su interés bajo los mecanismos legales que los rigen.\nActa Finiquito. Instrumento elaborado por la Unidad Responsable y/o Instancia Ejecutora con la persona beneficiaria en la que se dan por concluidas las acciones del proyecto apoyado en el ejercicio fiscal de que se trate, que avala el cierre físico-financiero, y se establecen de manera enunciativa más no limitativa lo siguiente: objeto de la misma; circunstancias de tiempo, modo y lugar de su elaboración, nombre completo, cargo y firma de los participantes en su elaboración y, documentación que soporte el cierre de las actividades técnicas, operativas y financieras.\nApoyo: Asignación de recursos económicos que, bajo la figura de subsidio, otorga el gobierno del estado de Guerrero a través de la Secretaría de Fomento y Desarrollo Económico, a las personas beneficiarias del Programa Apoyo a Certificación de Mezcal Guerrerense.\nBeneficiaria o beneficiario: Persona física o moral que recibe el apoyo previsto en las presentes\nReglas de Operación y que se encuentra contemplada en la población beneficiaria.\nCadena de Valor Maguey - Mezcal: Todas aquellas actividades agrícolas, industriales y agroindustriales que de forma coordinada y en una región determinada, producen, benefician, transforman de sus modalidades.\nCertificado de Empresa Guerrerense: Validación documental que acredita la inscripción de la empresa en el Registro Empresarial Guerrerense, expedido por la Subsecretaría de Fomento y Desarrollo\nEconómico de la SEFODECO.\nCLABE Interbancaria: Clave Bancaria Estandarizada.\nOPERACIÓN PARA EL EJERCICIO FISCAL 2022\nComité de Evaluación: Comité de Evaluación del Programa Apoyo a Certificación de Mezcal\nGuerrerense.\nComprobante de Domicilio. Documento con el cual se hace constar que una persona física o moral, vive efectivamente en el lugar en el que dice. Serán comprobantes de domicilio válidos para una persona física: recibo de luz, teléfono, predial, agua, constancia de residencia expedida por el ayuntamiento, comisariado municipal, ejidal o de bienes comunales. Las personas morales podrán usar como comprobante de domicilio el documento que acredite el domicilio fiscal del solicitante.\nConstancia de Situación Fiscal: Documento emitido por el Servicio de Administración Tributaria\n(SAT) contiene información del Registro Federal de Contribuyentes y la Cédula de Identificación Fiscal.\nDenominación de Origen Mezcal: Resolución mediante la cual se otorga la protección prevista a la denominación de origen Mezcal, para ser aplicada a la bebida alcohólica del mismo nombre, publicada en el Diario Oficial de la Federación del 28 de noviembre de 1994 y sus modificaciones publicadas en el mismo órgano informativo.\nDocumento que acredite la propiedad o legal posesión: Para este efecto se considerará aquel documento jurídico fehaciente que corresponda, dependiendo de la naturaleza del componente, que cumpla con los requisitos exigidos por el marco legal aplicable en la materia en cada entidad federativa, tales como los que a continuación se enlistan de manera enunciativa más no limitativa: escritura pública debidamente protocolizada ante fedatario público e inscrita en el Registro Público de la Propiedad; contrato de compraventa pasado ante fe de fedatario público; contrato de arrendamiento, comodato, usufructo, donación, permuta, o cesión de derechos, entre otros, los cuales atiendan las formalidades de la legislación civil de la entidad federativa de que se trate; original y/o copia certificada de la adjudicación emitida por autoridad judicial o fedatario público; así como los instrumentos jurídicos reconocidos por la legislación agraria.\nPara el caso de las y los productores de comunidades indígenas, con el documento expedido por la autoridad competente y en su caso, conforme a usos y costumbres.\nFactura Electrónica: La factura electrónica digital (CFDI), compuesta por archivos PDF y XML.\nFolio: Número de registro que se otorga a cada una de las solicitudes de apoyo recibidas en las ventanillas de atención y registradas en Padrón Único de Personas Beneficiarias de la SEFODECO.\nFábrica: Unidad de Producción o vinata: Lugar físico, dotado de maquinaria, herramientas, e instalaciones necesarias para la fabricación de ciertos objetos, obtención de determinados productos o de algún servicio, lugar donde el maestro mezcalero elabora mezcal.\nIdentificación Oficial: Documento oficial vigente, con el que una persona física puede acreditar su identidad; los documentos aceptables son la credencial para votar, cartilla del servicio militar, cédula profesional, pasaporte, emitido por la Secretaría de Relaciones Exteriores, u otras identificaciones oficiales vigentes con fotografía y firma.\nOPERACIÓN PARA EL EJERCICIO FISCAL 2022\nInstancia Dispersora de Recursos: Instancia encargada de realizar el pago de los apoyos de las modalidades y componentes del Programa que así lo dispongan, puede ser la Secretaría de Fomento y\nDesarrollo Económico, una Unidad Administrativa de la estructura de la SEFODECO, o la que la Unidad\nResponsable designe, siempre y cuando se encuentren relacionadas con el sector y cumplan con la normatividad aplicable vigente.\nMaestro mezcalero: Son aquellas personas que por tradición elaboran mezcal y que lo han aprendido de generación en generación y por tanto son portadoras del conocimiento para elaborar mezcal.\nMezcalero: Persona que participa en alguno de los eslabones de la cadena de valor de magueymezcal.\nMezcal: Bebida alcohólica destilada mexicana, 100% de maguey o agave, obtenida por destilación de jugos fermentados con microorganismos espontáneos o cultivados, extraídos de cabezas maduras de magueyes o agaves cocidos, cosechados en el territorio comprendido por la Resolución (Ver 1.0).\nEs un líquido de aroma y sabor derivado de la especie de maguey o agave empleado, así como del proceso de elaboración; diversificando sus cualidades por el tipo de suelo, topografía, clima, agua, productor autorizado, maestro mezcalero, graduación alcohólica, microorganismos, entre otros factores que definen el carácter y las sensaciones organolépticas producidas por cada Mezcal.\nEl mezcal puede ser añadido de edulcorantes, colorantes, aromatizantes y/o saborizantes permitidos por el Acuerdo correspondiente de la Secretaría de Salud (Ver 1.1).\n1.0: Resolución mediante la cual se otorga la protección prevista a la denominación de origen\nMezcal, para ser aplicada a la bebida alcohólica del mismo nombre, publicada el 28 de noviembre de 1994, así como sus modificaciones subsecuentes.\n1.1: Acuerdo por el que se determinan los aditivos y coadyuvantes en alimentos, bebidas y suplementos alimenticios, su uso y disposiciones sanitarias, emitido por la Secretaría de Salud publicado en el Diario Oficial de la Federación el 16 de julio del 2012 y sus subsecuentes modificaciones.\nOrganismo Evaluador de la Conformidad: Es la persona acreditada como organismo de certificación, unidad de verificación o laboratorio de prueba, según corresponda, por una entidad de acreditación para la determinación del cumplimiento de la presente Norma Oficial Mexicana, conforme a lo previsto en la Ley Federal sobre Metrología y Normalización, así como su reglamento.\nPadrón de Mezcaleros de la Secretaría de Fomento y Desarrollo Económico: Registro que previstos en los diferentes programas a cargo de la Secretaría, este se realiza en la SEFODECO.\nPoblación Objetivo: Es aquella a la que será dirigido el apoyo del presente Programa.\nPrograma: Programa Apoyo a Certificación de Mezcal Guerrerense.\nOPERACIÓN PARA EL EJERCICIO FISCAL 2022\nTaller: Espacio en donde de manera práctica las y los beneficiarios pueden aprender, conocer y mediante la asesoría del encargado del espacio, obtener un producto deseado.\nReglas de Operación: Reglas de Operación del Programa Apoyo a Certificación de Mezcal\nGuerrerense para el Ejercicio Fiscal 2022.\nSiglas:\nCURP: Clave Única de Registro de Población, documento expedido por la Secretaría de\nGobernación.\nNOM-070-SCFI-2016: Norma Oficial Mexicana NOM-070-SCFI- 2016, Bebidas alcohólicasMezcal-Especificaciones.\nOEC: Organismo Evaluador de la Conformidad.\nPND: Plan Nacional de Desarrollo.\nSEFINA: La Secretaría de Finanzas y Administración del Gobierno del Estado.\nSEFODECO: La Secretaría de Fomento y Desarrollo Económico del Gobierno del Estado.\nSEPLADER: La Secretaría de Planeación y Desarrollo Regional del Gobierno del Estado.\n3. Objetivos y Alcances.\n3.1. Objetivo General.\nIncrementar la productividad y la capacidad de comercialización de 20 personas físicas o morales dedicadas a la producción de mezcal, mediante incentivos económicos para certificar sus instalaciones, lotes y actividades de la cadena de valor maguey - mezcal, contribuyendo a la generación de empleos formales que les permitan mejorar su nivel de bienestar.\n3.2. Objetivo Específico.\nOtorgar apoyos a beneficiarias y beneficiarios del Programa, que sean utilizados para equipamiento o infraestructura, para que obtengan la certificación de un organismo verificador acreditado, sobre el cumplimiento de la NOM-070-SCFI-2016, en sus procesos de producción, envasado o comercialización.\n3.3. Cobertura.\nEl Programa tendrá cobertura estatal, por lo tanto, podrán participar las personas contempladas en la población objetivo señaladas en el numeral 2.1.2., con domicilio fiscal en el estado de Guerrero.\nOPERACIÓN PARA EL EJERCICIO FISCAL 2022\n3.4. Alcances. objetivo, para la constitución de empresas, capacitaciones a pequeños mezcaleros, activos productivos y la certificación de los procesos de producción de la cadena de valor maguey – mezcal por parte de un\nOrganismo Evaluador de la Conformidad.\nAtendiendo su derecho al trabajo y a la seguridad social, entendiendo esta como actos solidarios e inclusivos de las personas hacia los demás, pues estos actos llevan en sí mismos la búsqueda del bienestar social.\n4. Metas Físicas.\nEn el Programa se tiene contemplado, el otorgamiento de apoyos a 20 personas físicas o morales, que cumplan con lo dispuesto en las presentes Reglas de Operación.\n5. Programación Presupuestal.\nEl monto total aprobado para la implementación del Programa, asciende a $2,000,000.00 (Dos millones de pesos 00/100 M.N.), de conformidad con lo dispuesto en el Presupuesto de Egresos 2022; los recursos provienen del Fondo de Financiamiento de Inversión Estatal Directa (IED) y estarán sujetos a la suficiencia presupuestal disponible.\nEn la ejecución de los recursos deberá cumplirse con el principio de anualidad, señalado en el mismo Presupuesto de Egresos.\nPrograma de ministración de recursos\nMes de julio Totalidad del monto del recurso\n$2,000,000.00 $2,000,000.00\n5.1. Gastos de Operación.\nEl Programa contempla gastos de operación, cuyo monto corresponderá hasta el 3% del monto total aprobado para la implementación del Programa en el Presupuesto de Egresos 2022, y se destinará a diversas acciones asociadas con la planeación, promoción, difusión, operación, supervisión, verificación, contraloría social, evaluación y la publicación de las convocatorias del Programa, en dos periódicos de mayor circulación en el estado de Guerrero.\n6. Criterios y Requisitos de Elegibilidad.\nLas personas contempladas en la población objetivo deberán cumplir con los siguientes criterios:\nOPERACIÓN PARA EL EJERCICIO FISCAL 2022\n1. Ser propietaria o propietario de una fábrica de mezcal en funcionamiento.\n2. Que participen en la cadena de valor maguey – mezcal, en la producción, envasado y comercialización.\n3. Cumplir con lo establecido en la convocatoria correspondiente del Programa, que será publicada en dos periódicos de mayor circulación en el estado de Guerrero, en el portal oficial del Gobierno del\nEstado www.guerrero.gob.mx y en las redes sociales oficiales de la SEFODECO: Sefodeco Guerrero\n(Facebook), @sefodecogro (Twitter).\nLos requisitos de elegibilidad serán los siguientes:\nRequisito Documento\n1.Presentar El o los formatos de solicitud anexados con identificación solicitud de correspondientes a las diferentes modalidades de apoyo de las incorporación presentes Reglas de Operación, que deberá llevar firma autógrafa o al Programa. huella de la persona solicitante.\n1. Constitución de Empresas (anexo 3).\n2. Certificado como Productor de Mezcal (anexo 4).\n3. Certificado como Envasador de Mezcal (anexo 5).\n4. Certificado como Comercializador de Mezcal (anexo 6).\n2.Identificación Persona física: - Copia de la identificación oficial con fotografía de la persona (credencial para votar, cédula profesional o pasaporte). solicitante.\nPersona moral:\n- Copia del acta constitutiva, sus modificaciones.\n- Copia de documento que acredite la personalidad jurídica del representante o apoderado legal.\n- Copia de la identificación oficial con fotografía (credencial para votar, cédula profesional o pasaporte).\n3.CURP de la Clave Única de Registro de Población, documento expedido por la persona Secretaría de Gobernación. solicitante.\n4.Comprobante Persona física: Copia de recibo telefónico, recibo del servicio de agua, de domicilio. recibo de luz, recibo del predial o constancia de residencia con fecha no mayor a tres meses de la fecha de expedición.\nPersona moral: Documento que acredite el domicilio fiscal de la persona solicitante.\n5. Estar Registro que contiene los datos de identificación de las personas físicas inscritos en el o morales que participan en la cadena de valor maguey-mezcal emitido\nPadrón de por la Secretaría de Fomento y Desarrollo Económico.\nMezcaleros de la Secretaría de\nFomento y\nDesarrollo\nEconómico.\nOPERACIÓN PARA EL EJERCICIO FISCAL 2022\n6. Contar con Estado de cuenta bancaria a nombre de la persona solicitante, con bancaria. expedición.\n7. No duplicar Escrito dirigido a la persona titular de la Secretaría de Fomento y apoyos del Desarrollo Económico, firmado bajo protesta de decir verdad, en el que gobierno del manifieste la persona solicitante que, en el presente ejercicio fiscal, no estado. ha recibido apoyo por parte de otras dependencias del Gobierno del estado, para el mismo concepto de apoyo solicitado (anexo 7).\nRequisitos Cumplir con los requisitos específicos en cada una de las modalidades o específicos por conceptos de apoyo, según sea el caso. concepto de apoyo.\nRequisitos específicos del componente 1.1. Constitución de figuras morales por concepto de apoyo serán los siguientes:\n{\"tabla_1\":{\"columnas\":[\"Concepto de apoyo\",\"Requisito específico\",\"Documento\"],\"filas\":[{\"columna_1\":\"1.1.1. Constitución de la\\nfigura jurídica: Persona\\nMoral.\",\"columna_2\":\"8. Acta de Asamblea\\npara la constitución de\\nla sociedad.\",\"columna_3\":\"Presentar copia simple de acta de asamblea\\na protocolizar ante el notario público.\"},{\"columna_1\":\"(sin dato)\",\"columna_2\":\"9. Identificación oficial.\",\"columna_3\":\"Presentar copia simple de todas las\\npersonas integrantes que constituirán la\\nsociedad.\"},{\"columna_1\":\"(sin dato)\",\"columna_2\":\"10. CURP.\",\"columna_3\":\"Presentar copia simple de todas las\\npersonas integrantes que constituirán la\\nsociedad.\"}]}}\n2.1.1. Taller: Buenas 11. Acreditar inscripción de la Presentar el Certificado de prácticas para producir Empresa en el Registro Empresa Guerrerense. mezcal. Empresarial Guerrerense.\nAl concluir satisfactoriamente el taller de 2.1.1. Buenas prácticas para producir Mezcal, el\n– mezcal emitirá un comprobante o constancia de asistencia que será necesario para el concepto de apoyo\n2.1.2 Infraestructura.\nOPERACIÓN PARA EL EJERCICIO FISCAL 2022\n{\"tabla_2\":{\"columnas\":[\"Concepto\\nde\\napoyo\",\"Requisito\\nespecífico\",\"Documento\"],\"filas\":[{\"columna_1\":\"2.1.2.\\nInfraestructura.\",\"columna_2\":\"12. Acreditar\\nasistencia al taller.\",\"columna_3\":\"Comprobante o constancia de asistencia al taller\\nbuenas prácticas para producir mezcal.\"},{\"columna_1\":\"(sin dato)\",\"columna_2\":\"13.Acreditar\\nvolumen (litros) de\\nproducción de\\nmezcal.\",\"columna_3\":\"Suscribir carta de decir verdad en donde\\nespecifique que produce al menos 1500 litros de\\nmezcal por temporada (anexo 8).\"},{\"columna_1\":\"(sin dato)\",\"columna_2\":\"14. Acreditar la\\npropiedad o legal\\nposesión.\",\"columna_3\":\"Presentar documento jurídico que acredite la\\npropiedad o legal posesión de la fábrica.\"},{\"columna_1\":\"(sin dato)\",\"columna_2\":\"15. Dictaminen de\\nun OEC.\",\"columna_3\":\"Presentar comprobante de la visita de inspección y\\ndictamen de un OEC y/o los requerimientos\\nmínimos faltantes respecto a la NOM-070-SCFI-\\n2016.\"},{\"columna_1\":\"(sin dato)\",\"columna_2\":\"16. Presentar\\ncotizaciones.\",\"columna_3\":\"Presentar al menos 3 cotizaciones de lo que solicita\\nreferente al concepto de apoyo infraestructura\\nfaltantes respecto a la NOM-070-SCFI-2016.\"}]}}\nOPERACIÓN PARA EL EJERCICIO FISCAL 2022\nLos recursos destinados en el concepto de apoyo 2.1.3. Equipamiento para fábricas serán empleados para la adquisición tinaco, biodigestor, sanitario, lavabo, bascula electrónica o mecánica, tanque de almacenamiento grado alimenticio, Alcoholímetros, densímetro para alcohol o hidrómetro de alcohol, Termómetro, probeta, Tabla de corrección de grado alcohólico, Bitácora de producción de mezcal, adquirido.\n{\"tabla_4\":{\"columnas\":[\"Concepto de\\napoyo\",\"Requisito específico\",\"Documento.\"],\"filas\":[{\"columna_1\":\"2.1.4.\\nCertificado\\ncomo productor\\nde\\nmezcal\\n. (instalaciones).\",\"columna_2\":\"19. Constancia de\\ncumplimiento con la\\nNOM.\",\"columna_3\":\"Constancia de cumplimiento con la NOM-\\n070- SCFI-2016 emitida por un OEC.\"},{\"columna_1\":\"(sin dato)\",\"columna_2\":\"20. Acta Finiquito.\",\"columna_3\":\"Acta Finiquito de haber concluido\\nsatisfactoriamente el concepto de apoyo 2.1.3.\\nEquipamiento para fábricas.\"}]}}\n25. Acreditar la propiedad. Presentar documento jurídico que acredite la propiedad o legal posesión del área designada para envasado.\nOPERACIÓN PARA EL EJERCICIO FISCAL 2022\n{\"tabla_7\":{\"columnas\":[\"Concepto\\nde\\napoyo\",\"Requisito específico\",\"Documento\"],\"filas\":[{\"columna_1\":\"4.1.1.\\nTaller\\n: Buenas\",\"columna_2\":\"29. Acreditar inscripción de la\\nempresa en el Registro\\nEmpresarial Guerrerense.\",\"columna_3\":\"Presentar el Certificado de Empresa\\nGuerrerense.\"},{\"columna_1\":\"(sin dato)\",\"columna_2\":\"30. Certificado como productor\\nde mezcal.\",\"columna_3\":\"Certificado NOM de productor de Mezcal\\npor un OEC.\"},{\"columna_1\":\"(sin dato)\",\"columna_2\":\"31. Acreditar la propiedad o\\nlegal posesión de la fábrica.\",\"columna_3\":\"Presentar documento jurídico que\\nacredite la propiedad o legal posesión de\\nla fábrica.\"}]}}\nOPERACIÓN PARA EL EJERCICIO FISCAL 2022 para mezcal. Mezcal por un OEC. comercializar 32. Estatus de situación fiscal. Presentar constancia de situación fiscal\nMezcal. emitida por el Servicio de Administración\nTributaria.\n33. Título de marca. Presentar título de la marca a nombre de la persona solicitante.\nAl concluir satisfactoriamente el taller de 4.1.1. Taller: Buenas prácticas para comercializar Mezcal, el Organismo Evaluador de la Conformidad o la instancia con capacidad técnica en la cadena de valor maguey – mezcal emitirá un comprobante o constancia de asistencia que será necesario para el concepto de apoyo 4.1.2. Certificado como comercializador de mezcal.\nConcepto de apoyo Requisito específico Documento\n4.1.2. Certificado como 34. Acreditar asistencia Comprobante o constancia de comercializador de al taller. asistencia al 4.1.1. Taller: Buenas mezcal. prácticas para comercializar Mezcal.\nFinaliza la sección de requisitos específicos para el componente de apoyo 4.1. Comercializador de Mezcal, de la Modalidad 4. Certificado como Comercializador de Mezcal.\nEn los Anexos 10, 10.1 y 10.2 hay un resumen de los requisitos generales y requisitos específicos.\nLa solicitud de apoyo y los documentos señalados, en caso de ser a) presencial deberán presentarse en las oficinas de la Dirección General de Promoción Industrial, Agroindustrial y Minera, ubicadas en el Recinto de las Oficinas del Poder Ejecutivo del Estado de Guerrero, Edificio Acapulco, Primer Piso, Boulevard Lic. René Juárez Cisneros No. 62, Col. Ciudad de los Servicios, Chilpancingo, Guerrero, en un horario de atención de las 9:00 a las 16:00 horas, o en b) registro vía correo electrónico enviarse al correo electrónico mineria.sefodeco@guerrero.gob.mx en archivo PDF por cada uno de los documentos enviados.\nLos requisitos generales y específicos requeridos en las presentes Reglas de Operación, para el caso de enviarlos al correo electrónico deberán cargarse escaneados en PDF, a color, completos, sin tachones ni enmendaduras, en archivos individuales, nombrados en letras mayúsculas, sin espacios, sin acentos y sin caracteres especiales, con el número de trámite, nombre del trámite, y el nombre de la persona beneficiaria, separados por un guion bajo, ejemplo:\nPresentar solicitud de incorporación al Programa.\n1.1. A1 NOMBRE Y APELLIDOS.pdf\n1.2. A2 NOMBRE Y APELLIDOS.pdf\n1.3. A3 NOMBRE Y APELLIDOS.pdf\n1.4. A4 NOMBRE Y APELLIDOS.pdf\nOPERACIÓN PARA EL EJERCICIO FISCAL 2022\nIdentificación de la persona solicitante.\n- Ejemplo: Persona física\n2. IDENTIFICACIÓN NOMBRE Y APELLIDOS.pdf\n- Ejemplo: Persona moral\n2.1. ACTA CONSTITUTIVA NOMBRE FIGURA MORAL.pdf\n2.2. PERSONALIDAD JURÍDICA NOMBRE EMPRESA.pdf\n2.3. IDENTIFICACIÓN NOMBRE EMPRESA.pdf\nCURP de la persona solicitante.\n3. CURP NOMBRE Y APELLIDOS.pdf\nComprobante de domicilio.\n4. COMPROBANTE DOMICILIO NOMBRE Y APELLIDOS.pdf\nEstar inscritos en el Padrón de Mezcaleros de la SEFODECO.\n3. CERTIFICADO MEZCALERO NOMBRE Y APELLIDOS.pdf\nContar con cuenta bancaria.\n4. CUENTA BANCARIA NOMBRE Y APELLIDOS.pdf\nNo duplicar apoyos del gobierno del estado.\n5. NO DUPLICIDAD NOMBRE Y APELLIDOS.pdf\nLos requisitos específicos seguirán el mismo formato.\n6. REQUISITO ESPECIFICO NOMBRE Y APELLIDO.pdf\n7. Tipo, Monto y Periodicidad del Apoyo.\nConcepto de\nModalidad Componente Mont Periodicidad apoyo\nHasta el 100% del\n1.1. Apoyo para 1.1.1. Constitución de costo de la\n1. Constitución de constitución, monto constitución la figura jurídica:\nEmpresas. máximo de figuras Persona moral. morales.\nOPERACIÓN PARA EL EJERCICIO FISCAL 2022\n{\"tabla_8\":{\"columnas\":[\"(sin encabezado)\",\"(sin encabezado)\",\"(sin encabezado)\",\"$12,000.00 (Doce\\nmil pesos 00/100\\nM.N.).\",\"Única\"],\"filas\":[{\"columna_1\":\"2. Certificado como\\nProductor de Mezcal.\",\"columna_2\":\"2.1. Productor\\nde Mezcal.\",\"columna_3\":\"2.1.1. Taller: Buenas\\nprácticas para\\nproducir mezcal.\",\"columna_4\":\"Hasta el 100% del\\ncosto del taller,\\nmonto máximo de\\n$10,000.00 (Diez Mil\\npesos 00/100 M.N.)\\npor\\nperson\\na beneficiaria.\",\"columna_5\":\"(sin dato)\"},{\"columna_1\":\"(sin dato)\",\"columna_2\":\"(sin dato)\",\"columna_3\":\"2.1.2.\\nInfraestructura.\",\"columna_4\":\"Para fábricas:\\nHasta $40,000.00\\n(Cuarenta mil pesos\\n00/100 M.N.) por\\nfábrica.\",\"columna_5\":\"(sin dato)\"},{\"columna_1\":\"(sin dato)\",\"columna_2\":\"(sin dato)\",\"columna_3\":\"2.1.3. Equipamiento\\npara fábricas.\",\"columna_4\":\"Para fábricas:\\nHasta $20,000.00\\n(Veinte mil pesos\\n00/100 M.N.) por\\nfábrica.\",\"columna_5\":\"(sin dato)\"},{\"columna_1\":\"(sin dato)\",\"columna_2\":\"(sin dato)\",\"columna_3\":\"2.1.4. Certificado\\ncomo Productor de\\nMezcal.\\n(instalaciones).\",\"columna_4\":\"Hasta $30,000.00\\n(Treinta mil pesos\\n00/100 M.N.). por\\ncada certificación.\",\"columna_5\":\"(sin dato)\"},{\"columna_1\":\"3. Certificado como\\nEnvasador de Mezcal.\",\"columna_2\":\"3.1.\\nEnvasador de\\nMezcal.\",\"columna_3\":\"3.1.1. Taller: Buenas\\nprácticas para\\nenvasar mezcal.\",\"columna_4\":\"Hasta el 100% del\\ncosto del taller,\\nmonto máximo de\\n$10,000.00 (Diez Mil\\npesos 00/100 M.N.)\\npor beneficiario.\",\"columna_5\":\"(sin dato)\"},{\"columna_1\":\"(sin dato)\",\"columna_2\":\"(sin dato)\",\"columna_3\":\"3.1.2. Equipamiento\\npara envasadores\",\"columna_4\":\"Para envasadores:\\nHasta $20,000.00\\n(Veinte mil\\npesos\\n00/100 M.N.)\\npor\\nenvasadora.\",\"columna_5\":\"(sin dato)\"},{\"columna_1\":\"(sin dato)\",\"columna_2\":\"(sin dato)\",\"columna_3\":\"3.1.3. Certificado\\ncomo Envasador de\\nMezcal.\",\"columna_4\":\"Hasta $30,000.00\\n(Treinta mil pesos\\n00/100 M.N.). por\\ncada certificación.\",\"columna_5\":\"(sin dato)\"}]}}\nOPERACIÓN PARA EL EJERCICIO FISCAL 2022 costo del taller,\n4.1.1. Taller: Buenas monto máximo prácticas para comercializar Mezcal\n4. Certificado 4.1. $10,000.00 (Diez Mil como Comercializad pesos 00/100 M.N.) comercializador de por person\nMezcal. or de Mezcal. beneficiaria.\n4.1.2. Certificado Hasta $30,000.00 como (Treinta mil pesos\nComercializador de 00/100 M.N.). por\nMezcal. cada certificación.\nEl presente programa apoyará con hasta $100,000.00 (Cien mil pesos 00/100 M.N.) por persona beneficiaria. El monto dependerá de la solicitud que ingrese la persona beneficiaria, podrá cada modalidad, en todo momento está supeditado a los conceptos de apoyo, 2.1.4. Certificado como\n{\"tabla_9\":{\"columnas\":[\"Modalidad\",\"Componente\",\"Concepto de apoyo\",\"Periodicidad\"],\"filas\":[{\"columna_1\":\"1. Constitución de\\nEmpresas.\",\"columna_2\":\"1.1. Apoyo para\\nconstitución de figuras\\nmorales.\",\"columna_3\":\"1.1.1. Constitución de la figura\\njurídica: Persona moral.\",\"columna_4\":\"(sin dato)\"},{\"columna_1\":\"2. Certificado como\\nProductor de\\nMezcal.\",\"columna_2\":\"2.1. Productor de\\nMezcal.\",\"columna_3\":\"2.1.1. Taller: Buenas prácticas\\npara producir mezcal.\",\"columna_4\":\"(sin dato)\"},{\"columna_1\":\"(sin dato)\",\"columna_2\":\"(sin dato)\",\"columna_3\":\"2.1.2. Infraestructura.\",\"columna_4\":\"(sin dato)\"},{\"columna_1\":\"(sin dato)\",\"columna_2\":\"(sin dato)\",\"columna_3\":\"2.1.3. Equipamiento para\\nfábricas.\",\"columna_4\":\"(sin dato)\"},{\"columna_1\":\"(sin dato)\",\"columna_2\":\"(sin dato)\",\"columna_3\":\"2.1.4. Certificado como Productor\\nde Mezcal. (instalaciones).\",\"columna_4\":\"(sin dato)\"},{\"columna_1\":\"3. Certificado como\\nEnvasador de\\nMezcal.\",\"columna_2\":\"(sin dato)\",\"columna_3\":\"3.1.1. Taller: Buenas prácticas\\npara envasar mezcal.\",\"columna_4\":\"(sin dato)\"},{\"columna_1\":\"(sin dato)\",\"columna_2\":\"(sin dato)\",\"columna_3\":\"3.1.2. Equipamiento para\\nenvasadores\",\"columna_4\":\"(sin dato)\"}]}}\nOPERACIÓN PARA EL EJERCICIO FISCAL 2022\n4.1.1. Taller: Buenas prácticas\n4. Certificado como\n4.1.Comercializador de para comercializar Mezcal\nComercializador de\nMezcal. 4.1.2. Certificado como\nMezcal.\nComercializador de Mezcal.\n7.2. Recursos no Devengados.\nLos recursos aprobados para el Programa, en el Presupuesto de Egresos 2022, que no sean ejercidos o devengados al 31 de diciembre del presente año, serán reintegrados a la Tesorería General de la\nSecretaría de Finanzas y Administración del Estado de Guerrero.\n7.3. Resguardo de la documentación.\nLa Dirección General de Promoción Industrial, Agroindustrial y Minera, perteneciente a la SEFODECO, resguardará la documentación comprobatoria del ejercicio de los recursos del Programa y la Delegación\nAdministrativa de la misma dependencia, efectuará el cierre del ejercicio.\n7.4. Supervisión y Control.\nEl Programa estará a cargo de la SEFODECO a través de la Dirección General de Promoción\nIndustrial, Agroindustrial y Minera, responsable de su operación y la verificación del cumplimiento de los objetivos establecidos en las presentes Reglas de Operación, enviando un reporte mensual a la Unidad de\nPlaneación y Presupuesto, a partir de la publicación de la convocatoria correspondiente.\nAsimismo, la SEFODECO enviará trimestralmente a la Secretaría de Finanzas y Administración, a la Secretaría de Planeación y Desarrollo Regional y a la Secretaría de Contraloría y Transparencia\nGubernamental, informes sobre el presupuesto ejercido, mismos que están establecidos por el Consejo\nNacional de Armonización Contable (CONAC). Dichos informes se deberán presentar a más tardar a los quince días hábiles posteriores a la terminación de cada trimestre.\n8. Criterios de Selección.\n1. Ser Guerrerense.\n2. Que participen en la cadena de valor maguey – mezcal, en la producción, envasado y comercialización.\nEl Programa, tiene como objetivo incrementar la productividad y comercialización de las unidades económicos, conforme a la Denominación de Origen Mezcal, certificando los procesos de producción, envasado y comercialización, de acuerdo a la norma NOM-070-SCFI-2016; generando empleo, y mejores ingresos para los mezcaleros Guerrerenses.\nOPERACIÓN PARA EL EJERCICIO FISCAL 2022\nLas personas que podrán participar en el Programa, son aquellas contempladas en la población objetivo.\n8.1. Casos Especiales.\nOperación, serán atendidos por el Comité de Evaluación, que dictará las acciones a seguir y las resoluciones pertinentes.\n8.2. Casos de Emergencia o Desastre.\nEn caso de una declaratoria de emergencia o de desastre, el Comité de Evaluación, analizará la situación y, de afectarse la operación del Programa, deberá emitir el plan de acción que permita dar cumplimiento a sus objetivos, de conformidad con lo establecido en las presentes Reglas de Operación.\n8.3. Suspensión o Cancelación del Programa Social.\nLa SEFODECO podrá suspender o cancelar la operación del Programa, cuando las condiciones sociales y económicas, no sean favorables para el cumplimiento de los objetivos; en caso de problemas de gobernabilidad en la entidad, el Programa podrá ser cancelado por la persona titular del Poder Ejecutivo.\nEl apoyo del Programa, será cancelado por la SEFODECO cuando lo solicite por escrito la persona beneficiaria o cuando se incumpla lo dispuesto en las presentes Reglas de Operación y las disposiciones normativas aplicables.\n8.4. Integración del Padrón de Personas Beneficiarias.\nToda vez que las personas que reciban el apoyo del Programa, serán incorporadas por la Dirección\nGeneral de Promoción Industrial, Agroindustrial y Minera, al Padrón Único de Personas Beneficiarias, cuya información será considerada en términos de lo dispuesto en la Ley Número 466 de Protección de Datos\nPersonales en Posesión de Sujetos Obligados del Estado de Guerrero y la Ley Número 207 de\n9. Mecánica Operativa del Programa Social.\n9.1. Instancia Ejecutora y/o Responsable.\nLa instancia ejecutora del Programa será la SEFODECO, a través de la Dirección General de\nPromoción Industrial, Agroindustrial y Minera, emitiendo las Reglas de Operación de acuerdo al marco normativo aplicable.\nProceso de Incorporación al Programa Social.\nEl procedimiento de acceso de las personas solicitantes al Programa, será el siguiente:\nOPERACIÓN PARA EL EJERCICIO FISCAL 2022\nLa SEFODECO emitirá y publicará la convocatoria correspondiente al Programa, que para tal efecto será en dos periódicos de mayor circulación en el estado de Guerrero, en dos días diferentes.\n@sefodecogro (Twitter).\nLa convocatoria que emita la SEFODECO del Programa, será autorizada por la persona titular de la SEFODECO y deberá contener, lo siguiente:\n● Objeto;\n● Vigencia de la Convocatoria;\n● Monto presupuestal disponible;\n● Montos de los apoyos;\n● Cobertura;\n● Criterios de elegibilidad;\n● Requisitos;\n● Criterios Técnicos de Evaluación, y\n● Contacto de atención.\nLos requisitos y los específicos según sea el caso que deberán cumplir las personas interesadas para acceder a los apoyos del Programa, así como los criterios para la selección de las personas beneficiarias, se señalan en el punto 6. Criterios y requisitos de elegibilidad de las presentes Reglas de\nOperación.\nPara la recepción de las solicitudes de ingreso al Programa, la SEFODECO designa a la Dirección\nGeneral de Promoción Industrial, Agroindustrial y Minera, quien tendrá a disposición una ventanilla para el registro de las y los aspirantes al Programa con dos opciones de registro, a) Registro presencial y b)\nRegistro vía correo electrónico como se indica en el Punto 6. Criterios y requisitos de elegibilidad de las presentes Reglas de Operación.\nLa documentación presentada de forma a) Registro presencial o b) Registro vía correo electrónico será analizada por la Dirección General de Promoción Industrial, Agroindustrial y Minera, quien emitirá dos tipos de dictamen:\n1.- Documentación completa: Lo que lo pone a disposición del Comité de Evaluación.\n2.- Documentación incompleta o con inconsistencias: para lo que la Dirección General de\nPromoción Industrial, Agroindustrial y Minera notificará vía correo electrónico para subsanar las inconsistencias y/o faltantes de documentación, para lo que la persona solicitante tendrá 5 días hábiles para cumplir con los requerimientos.\nEn caso de que la persona solicitante no subsane las inconsistencias y/o documentación faltante se tendrá como desistida la solicitud y se dará por finalizado el proceso de registro.\nOPERACIÓN PARA EL EJERCICIO FISCAL 2022\nLos Dictámenes tipo 1.- Documentación completa, serán remitidos a el Comité de Evaluación.\nEl Comité de Evaluación, es un órgano colegiado interno que tendrá como objetivo conocer y resolver los asuntos del Programa, especialmente, la autorización de solicitudes de apoyo; estará integrado de la siguiente manera:\n• La persona titular de la Secretaría de Fomento y Desarrollo Económico, que fungirá como\nPresidenta o Presidente;\n• La persona titular de la Dirección General de Promoción Industrial, Agroindustrial y Minera, quien fungirá como Secretaria o Secretario Técnico;\n• La persona titular de la Subsecretaría de Fomento Económico;\n• La persona titular de la Unidad de Asuntos Jurídicos, y\n• La persona titular de la Delegación Administrativa.\nLa autorización de las solicitudes de apoyo se efectuará en sesión del Comité de Evaluación, con la presencia del cincuenta por ciento más uno de sus integrantes, levantándose la minuta correspondiente, misma que deberá contener la relación de las solicitudes de apoyo autorizadas.\nLos apoyos del Programa se autorizarán de acuerdo al mecanismo: primero en tiempo, primero en derecho; estableciendo un orden de prelación, que cuenten con dictamen 1.- Documentación completa, de la Dirección General de Promoción Industrial, Agroindustrial y Minera, que se integren al orden de mayor a menor, en la calificación obtenida en la solicitud de apoyo, misma que será emitida por el Comité de\nEvaluación y a la autorización correspondiente, por parte del mismo Comité de Evaluación, hasta agotar el monto presupuestal disponible; atendiendo la perspectiva de género, del total de apoyos que se otorgarán al amparo del Programa en el ejercicio fiscal 2022.\nLa Secretaría Técnica del Comité de Evaluación, levantará el acta correspondiente de las sesiones, mismas que contendrán, entre puntos, el listado de las solicitudes de apoyo autorizadas.\nMediante oficio firmado por la persona titular de la SEFODECO, se notificará la resolución de\nGeneral de Promoción Industrial, Agroindustrial y Minera, en un plazo de cinco días hábiles contados a partir del día siguiente de la sesión del Comité de Evaluación.\nEn el oficio de resolución se deberán solicitar la documentación comprobatoria del apoyo, de Guerrero, que contenga el concepto y el monto del apoyo recibido y los comprobantes necesarios por cada modalidad.\nOPERACIÓN PARA EL EJERCICIO FISCAL 2022 de apoyo del Programa, la persona solicitante deberá entregar en un plazo de cinco días hábiles, contados a partir del día siguiente de la notificación del oficio de resolución, la factura electrónica, a nombre de la apoyo recibido. La factura electrónica deberá ser enviada al correo electrónico mineria.sefodeco@guerrero.gob.mx.\nLa Delegación Administrativa de la SEFODECO por orden superior, realizará la transferencia bancaria a las personas solicitantes que cuenten con solicitud de apoyo autorizada por el Comité de\nEvaluación.\nUna vez cumplido con los comprobantes necesarios por cada modalidad, se realizará la firma de un acta finiquito.\nFlujograma del Programa se encuentra establecido en el Anexo 9.\nEl cumplimiento de cada una de las modalidades se comprueba con el acta finiquito, por lo que es necesario cumplir para acceder a otra modalidad de apoyo, sin exceder lo señalado en el punto 7. Tipo, monto y periodicidad del apoyo.\n10. Evaluación.\nLa evaluación del Programa, la realizará la SEFODECO por conducto de la Dirección General de\nPromoción Industrial, Agroindustrial y Minera, verificando los avances y el cumplimiento de los indicadores e identificando áreas de oportunidad y alternativas de solución que favorezcan el cumplimiento de los objetivos planteados.\n10.1. Indicadores (Construcción de la Matriz de Indicadores para Resultados. - Anexo 1).\nEl gobierno del estado ha adoptado la Metodología de Presupuesto Basado en Resultados (PbR), implementada por el gobierno federal, en este sentido, el indicador para el seguimiento y la evaluación del\nPrograma se construyó de acuerdo a la Metodología de Marco Lógico (MML), en los siguientes términos en la Ficha Técnica de Indicadores:\nFicha Técnica de indicadores de desempeño.\nEje: III. Economía\nObjetivo: Impulsar la reactivación económica, el mercado interno y el empleo.\n3.1. Promover el acceso al capital físico y financiero para ampliar el potencial\nEstrategia: productivo de las MIPYMES.\n3.4.4 Impulsar proyectos e iniciativas, en coordinación con diversas instituciones, Línea de acción: para incorporar a un mayor número de empresas MIPYMES en cadenas de valor y cadenas de proveeduría.\nDatos de identificación del indicador\nClave Nombre Fuente\nOPERACIÓN PARA EL EJERCICIO FISCAL 2022\n{\"tabla_10\":{\"columnas\":[\"E10\",\"(sin encabezado)\",\"(sin encabezado)\",\"Productores de Mezcal\\nCertificados.\",\"(sin encabezado)\",\"(sin encabezado)\",\"Secretaría de Fomento y\\nDesarrollo Económico.\",\"(sin encabezado)\"],\"filas\":[{\"columna_1\":\"Definición\",\"columna_2\":\"(sin dato)\",\"columna_3\":\"(sin dato)\",\"columna_4\":\"Tipo\",\"columna_5\":\"(sin dato)\",\"columna_6\":\"(sin dato)\",\"columna_7\":\"Dimensión\",\"columna_8\":\"(sin dato)\"},{\"columna_1\":\"Apoyos para la certificación de\\nfábricas productoras de mezcal\",\"columna_2\":\"(sin dato)\",\"columna_3\":\"(sin dato)\",\"columna_4\":\"(sin dato)\",\"columna_5\":\"(sin dato)\",\"columna_6\":\"(sin dato)\",\"columna_7\":\"Eficacia.\",\"columna_8\":\"(sin dato)\"},{\"columna_1\":\"Método de Calculo\",\"columna_2\":\"(sin dato)\",\"columna_3\":\"(sin dato)\",\"columna_4\":\"(sin dato)\",\"columna_5\":\"(sin dato)\",\"columna_6\":\"(sin dato)\",\"columna_7\":\"(sin dato)\",\"columna_8\":\"Unidad de\\nMedida\"},{\"columna_1\":\"Apoyos Económicos Entregados (AEE)/Apoyos Económicos Programados*100\\n(AEP).\",\"columna_2\":\"(sin dato)\",\"columna_3\":\"(sin dato)\",\"columna_4\":\"(sin dato)\",\"columna_5\":\"(sin dato)\",\"columna_6\":\"(sin dato)\",\"columna_7\":\"(sin dato)\",\"columna_8\":\"Apoyo\\neconómico\\notorgado.\"},{\"columna_1\":\"Frecuencia de Medición\",\"columna_2\":\"(sin dato)\",\"columna_3\":\"(sin dato)\",\"columna_4\":\"(sin dato)\",\"columna_5\":\"Desagregación geográfica\",\"columna_6\":\"(sin dato)\",\"columna_7\":\"(sin dato)\",\"columna_8\":\"Serie de\\ninformación\\ndisponible\"},{\"columna_1\":\"Anual\",\"columna_2\":\"(sin dato)\",\"columna_3\":\"(sin dato)\",\"columna_4\":\"(sin dato)\",\"columna_5\":\"Estatal\",\"columna_6\":\"(sin dato)\",\"columna_7\":\"(sin dato)\",\"columna_8\":\"Ninguna\"},{\"columna_1\":\"Sentido del indicador\",\"columna_2\":\"(sin dato)\",\"columna_3\":\"(sin dato)\",\"columna_4\":\"(sin dato)\",\"columna_5\":\"Línea base\",\"columna_6\":\"(sin dato)\",\"columna_7\":\"(sin dato)\",\"columna_8\":\"(sin dato)\"},{\"columna_1\":\"(sin dato)\",\"columna_2\":\"(sin dato)\",\"columna_3\":\"(sin dato)\",\"columna_4\":\"(sin dato)\",\"columna_5\":\"Año\",\"columna_6\":\"Periodo\",\"columna_7\":\"(sin dato)\",\"columna_8\":\"Valor\"},{\"columna_1\":\"Ascendente\",\"columna_2\":\"(sin dato)\",\"columna_3\":\"(sin dato)\",\"columna_4\":\"(sin dato)\",\"columna_5\":\"2022\",\"columna_6\":\"Anual, 01 de enero al 31 de\\ndiciembre.\",\"columna_7\":\"(sin dato)\",\"columna_8\":\"N/A\"},{\"columna_1\":\"Parámetro de semaforización\",\"columna_2\":\"(sin dato)\",\"columna_3\":\"(sin dato)\",\"columna_4\":\"(sin dato)\",\"columna_5\":\"Metas\",\"columna_6\":\"(sin dato)\",\"columna_7\":\"(sin dato)\",\"columna_8\":\"(sin dato)\"},{\"columna_1\":\"Verde\",\"columna_2\":\"Amarillo\",\"columna_3\":\"Rojo\",\"columna_4\":\"(sin dato)\",\"columna_5\":\"Año\",\"columna_6\":\"Periodo\",\"columna_7\":\"(sin dato)\",\"columna_8\":\"Valor\"},{\"columna_1\":\"(sin dato)\",\"columna_2\":\"(sin dato)\",\"columna_3\":\"(sin dato)\",\"columna_4\":\"(sin dato)\",\"columna_5\":\"2023\",\"columna_6\":\"Anual, 01 de enero al 31 de\\ndiciembre.\",\"columna_7\":\"(sin dato)\",\"columna_8\":\"20\"},{\"columna_1\":\"Variables que conforman el indicador\",\"columna_2\":\"(sin dato)\",\"columna_3\":\"(sin dato)\",\"columna_4\":\"(sin dato)\",\"columna_5\":\"(sin dato)\",\"columna_6\":\"(sin dato)\",\"columna_7\":\"(sin dato)\",\"columna_8\":\"(sin dato)\"},{\"columna_1\":\"Nombre\",\"columna_2\":\"(sin dato)\",\"columna_3\":\"(sin dato)\",\"columna_4\":\"Unidad de Medida\",\"columna_5\":\"(sin dato)\",\"columna_6\":\"(sin dato)\",\"columna_7\":\"Fuente de Información\",\"columna_8\":\"(sin dato)\"},{\"columna_1\":\"Número de constitución de\\nfiguras morales\",\"columna_2\":\"(sin dato)\",\"columna_3\":\"(sin dato)\",\"columna_4\":\"Apoyo económico otorgado\",\"columna_5\":\"(sin dato)\",\"columna_6\":\"(sin dato)\",\"columna_7\":\"Secretaría de Fomento y\\nDesarrollo Económico\",\"columna_8\":\"(sin dato)\"},{\"columna_1\":\"Nombre\",\"columna_2\":\"(sin dato)\",\"columna_3\":\"(sin dato)\",\"columna_4\":\"Unidad de Medida\",\"columna_5\":\"(sin dato)\",\"columna_6\":\"(sin dato)\",\"columna_7\":\"Fuente de Información\",\"columna_8\":\"(sin dato)\"},{\"columna_1\":\"Número de apoyos para\\nproductores de mezcal.\",\"columna_2\":\"(sin dato)\",\"columna_3\":\"(sin dato)\",\"columna_4\":\"Apoyo económico otorgado\",\"columna_5\":\"(sin dato)\",\"columna_6\":\"(sin dato)\",\"columna_7\":\"Secretaría de Fomento y\\nDesarrollo Económico\",\"columna_8\":\"(sin dato)\"},{\"columna_1\":\"Nombre\",\"columna_2\":\"(sin dato)\",\"columna_3\":\"(sin dato)\",\"columna_4\":\"Unidad de Medida\",\"columna_5\":\"(sin dato)\",\"columna_6\":\"(sin dato)\",\"columna_7\":\"Fuente de Información\",\"columna_8\":\"(sin dato)\"},{\"columna_1\":\"Número de apoyos para\\nenvasadores de mezcal\",\"columna_2\":\"(sin dato)\",\"columna_3\":\"(sin dato)\",\"columna_4\":\"Apoyo económico otorgado\",\"columna_5\":\"(sin dato)\",\"columna_6\":\"(sin dato)\",\"columna_7\":\"Secretaría de Fomento y\\nDesarrollo Económico\",\"columna_8\":\"(sin dato)\"},{\"columna_1\":\"Nombre\",\"columna_2\":\"(sin dato)\",\"columna_3\":\"(sin dato)\",\"columna_4\":\"Unidad de Medida\",\"columna_5\":\"(sin dato)\",\"columna_6\":\"(sin dato)\",\"columna_7\":\"Fuente de Información\",\"columna_8\":\"(sin dato)\"},{\"columna_1\":\"Número de apoyos para\\ncomercializadores de mezcal\",\"columna_2\":\"(sin dato)\",\"columna_3\":\"(sin dato)\",\"columna_4\":\"Apoyo económico otorgado\",\"columna_5\":\"(sin dato)\",\"columna_6\":\"(sin dato)\",\"columna_7\":\"Secretaría de Fomento y\\nDesarrollo Económico\",\"columna_8\":\"(sin dato)\"},{\"columna_1\":\"Observaciones\",\"columna_2\":\"(sin dato)\",\"columna_3\":\"(sin dato)\",\"columna_4\":\"(sin dato)\",\"columna_5\":\"(sin dato)\",\"columna_6\":\"(sin dato)\",\"columna_7\":\"(sin dato)\",\"columna_8\":\"(sin dato)\"},{\"columna_1\":\"Responsable del Indicador\",\"columna_2\":\"(sin dato)\",\"columna_3\":\"(sin dato)\",\"columna_4\":\"(sin dato)\",\"columna_5\":\"(sin dato)\",\"columna_6\":\"(sin dato)\",\"columna_7\":\"(sin dato)\",\"columna_8\":\"(sin dato)\"},{\"columna_1\":\"Nombre del servidor público\",\"columna_2\":\"(sin dato)\",\"columna_3\":\"(sin dato)\",\"columna_4\":\"Dependencia\",\"columna_5\":\"(sin dato)\",\"columna_6\":\"(sin dato)\",\"columna_7\":\"Área\",\"columna_8\":\"(sin dato)\"},{\"columna_1\":\"Ing. Aquiles Sánchez Esquivel\",\"columna_2\":\"(sin dato)\",\"columna_3\":\"(sin dato)\",\"columna_4\":\"Secretaría de Fomento y\\nDesarrollo Económico.\",\"columna_5\":\"(sin dato)\",\"columna_6\":\"(sin dato)\",\"columna_7\":\"Dirección General de\\nPromoción Industrial,\\nAgroindustrial y Minera.\",\"columna_8\":\"(sin dato)\"},{\"columna_1\":\"Nombre del puesto, encargo o\\ncomisión\",\"columna_2\":\"(sin dato)\",\"columna_3\":\"(sin dato)\",\"columna_4\":\"Teléfono\",\"columna_5\":\"(sin dato)\",\"columna_6\":\"(sin dato)\",\"columna_7\":\"Correo electrónico\",\"columna_8\":\"(sin dato)\"},{\"columna_1\":\"Director General\",\"columna_2\":\"(sin dato)\",\"columna_3\":\"(sin dato)\",\"columna_4\":\"(+52)7451161491\",\"columna_5\":\"(sin dato)\",\"columna_6\":\"(sin dato)\",\"columna_7\":\"mineria.sefodeco@guerrero.gob\\n.mx\",\"columna_8\":\"(sin dato)\"},{\"columna_1\":\"Elaboró\",\"columna_2\":\"(sin dato)\",\"columna_3\":\"(sin dato)\",\"columna_4\":\"Revisó\",\"columna_5\":\"(sin dato)\",\"columna_6\":\"(sin dato)\",\"columna_7\":\"Autorizó\",\"columna_8\":\"(sin dato)\"}]}}\nOPERACIÓN PARA EL EJERCICIO FISCAL 2022\nIng. Aquiles Sánchez Esquivel Lic. Gabriela Nájera Cisneros Mtra. Teodora Ramírez Vega\nDirector General de Promoción\nIndustrial, Agroindustrial y\nPlaneación y Presupuesto. Desarrollo Económico\nMinera.\n10.2. Seguimiento.\nEl seguimiento del Programa, estará a cargo de la SEFODECO y, particularmente, por la Dirección General de Promoción Industrial, Agroindustrial y Minera, generando en el proceso, información que permita un análisis sobre el avance del cumplimiento de los objetivos establecidos y sobre el ejercicio de los recursos presupuestales asignados. El seguimiento se llevará a cabo de manera permanente con el propósito de identificar áreas de mejora que favorezcan una operación eficiente y eficaz del Programa, y en consecuencia, alcanzar los objetivos propuestos, con base a los indicadores de desempeño.\n10.3. Auditoría.\nEl ejercicio de los recursos asignados y la verificación del cumplimiento de los objetivos del\nPrograma, podrán ser auditados por los entes fiscalizadores como la Secretaría de Contraloría y\nTransparencia Gubernamental y la Auditoría Superior del Estado de Guerrero, conforme a las disposiciones normativas aplicables y en el ámbito de sus respectivas competencias.\nLa SEFODECO otorgará todas las facilidades a los entes fiscalizadores para llevar a cabo las auditorías que determinen e implementará las acciones necesarias para solventar las observaciones y no conformidades que se plasmen en el informe de auditoría correspondiente.\n11. Mecanismo de entrega del Apoyo.\nLos apoyos del Programa, se entregarán de manera directa, mediante transferencia bancaria, a las personas de la población objetivo cuya solicitud de apoyo cuente con la autorización del Comité de\n12. Derechos y Obligaciones de las Personas Beneficiadas.\nLas personas beneficiarias del Programa, estarán sujetas a los siguientes derechos y obligaciones:\na) Derechos:\n• Recibir el apoyo del Programa para ejercerlo de acuerdo a lo establecido en las presentes Reglas de Operación, sin distinción, exclusión o restricción;\n• Recibir asesoría por parte de la SEFODECO, cuando así lo soliciten, para facilitar la correcta aplicación de los recursos recibidos;\nOPERACIÓN PARA EL EJERCICIO FISCAL 2022\n• Recibir un trato digno y respetuoso, por parte de las servidoras y servidores públicos de la\nSEFODECO, y\n• La reserva de su información personal conforme a lo dispuesto en la Ley Número 466 de\nLey Número 207 de Transparencia y Acceso a la Información Pública del Estado de Guerrero.\nb) Obligaciones:\n• Aplicar el apoyo recibido del Programa, conforme a lo establecido en las presentes Reglas de\nOperación y la convocatoria respectiva.\n• Comprobar el apoyo recibido del Programa, para lo cual deberá entregar en un plazo de cinco días hábiles, contados a partir del día siguiente de la notificación del oficio de resolución de autorización del apoyo, la factura electrónica, a nombre de la Secretaría de Finanzas y\nAdministración del Estado de Guerrero, que contenga el concepto y el monto del apoyo recibido.\nLa factura electrónica deberá ser enviada al correo electrónico mineria.sefodeco@guerrero.gob.mx.\n• En general, cumplir y observar las disposiciones de las presentes Reglas de Operación y las disposiciones jurídicas aplicables.\n12.1. Causales de Suspensión o baja de las personas beneficiadas.\nDe acuerdo a la evaluación de los siguientes supuestos, la SEFODECO determinará la suspensión o baja de una beneficiaria o beneficiario del Programa, estará determinada por las siguientes causas:\n• Cuando de manera voluntaria la persona beneficiaria lo solicite mediante escrito dirigido a la persona titular de la SEFODECO;\n• Cuando la persona beneficiaria no presente en tiempo y forma la documentación comprobatoria del apoyo autorizado.\n12. Proceso de Baja.\nEl procedimiento de baja de una persona beneficiaria del Programa, es el siguiente:\nCuando la baja del Programa, obedezca a una solicitud de la persona beneficiaria, la SEFODECO, mediante oficio firmado por la persona titular de la dependencia, dará respuesta de aceptación de la baja, en un término de cinco días hábiles, contados a partir del día siguiente de la recepción de la solicitud, indicando los datos bancarios para el reintegro del apoyo correspondiente.\nOPERACIÓN PARA EL EJERCICIO FISCAL 2022\nCuando la baja del Programa, tenga como causa el incumplimiento, en tiempo y forma, de la comprobación del apoyo autorizado, la SEFODECO mediante oficio firmado por la persona titular de la dependencia, notificará la cancelación del apoyo en un plazo de cinco días hábiles contados a partir del día siguiente del vencimiento del plazo para la presentación de la documentación comprobatoria del apoyo.\nEn los casos de baja de la persona beneficiaria del Programa, para cumplir con las metas y el ejercicio del recurso presupuestal asignado, el Comité de Evaluación autorizará el otorgamiento de apoyos de acuerdo al orden de prelación de las solicitudes de apoyo presentadas por mujeres y jóvenes que forman parte de la población objetivo, y de acuerdo al orden, de mayor a menor, en la calificación obtenida en la solicitud de apoyo, misma que será emitida por el Comité de Evaluación y a la autorización correspondiente, por parte del mismo Comité de Evaluación.\n13. Instancias Participantes.\nLas instancias participantes en el Programa, son las siguientes:\n• La Secretaría de Planeación y Desarrollo Regional, con la validación y aprobación de las Reglas de Operación.\n• La Secretaría de Finanzas y Administración, con la ministración y liberación de los recursos presupuestales para la operación del Programa.\n• La Secretaría de Fomento y Desarrollo Económico, es la instancia ejecutora del Programa, a través de la Dirección General de Promoción Industrial, Agroindustrial y Minera.\n• La Secretaría de Contraloría y Transparencia Gubernamental y la Auditoría Superior del Estado de\nGuerrero, son entes que pueden realizar la fiscalización del Programa.\n13. 1. Instancia Normativa.\nLa SEFODECO, es la instancia normativa del Programa, en consecuencia, le corresponde emitir las presentes Reglas de Operación, la convocatoria y, en general, la aplicación del marco normativo correspondiente a sus facultades y atribuciones.\n14. Transparencia.\nEn materia de transparencia, en el Programa, se atenderán las siguientes líneas de acción:\n14.1. Promoción y Difusión del Programa Social.\nLas presentes Reglas de Operación del Programa, se publicarán en el Periódico Oficial del\nPiso, Boulevard Lic. René Juárez Cisneros, Col. Ciudad de los Servicios, en Chilpancingo, Guerrero, en un\n@sefodecogro (Twitter).\nOPERACIÓN PARA EL EJERCICIO FISCAL 2022\n14.2. Contraloría Social.\nEl fundamento legal del Programa, parte del artículo 29 de la Ley Orgánica de la Administración\nPública del Estado de Guerrero Número 08, que establece que a la SEFODECO le corresponde, entre otros temas, planear, regular, promover y fomentar el desarrollo económico del estado de Guerrero, en este sentido, no son aplicables las disposiciones normativas de la Contraloría Social, cuyo fundamento se encuentra en la Ley General de Desarrollo Social.\nSin embargo, el ejercicio de los recursos públicos y la operación del Programa, están sustentados en la transparencia y la rendición de cuentas, en estricto apego al marco normativo aplicable y bajo la supervisión, mediante auditorías, de entes fiscalizadores como la Secretaría de Contraloría y Transparencia\nGubernamental y la Auditoría Superior del Estado de Guerrero.\nAsimismo, la información del Programa, se encuentra disponible para los ciudadanos, conforme a lo dispuesto en la Ley Número 466 de Protección de Datos Personales en Posesión de Sujetos Obligados del Estado de Guerrero y la Ley Número 207 de Transparencia y Acceso a la Información Pública del\nEstado de Guerrero.\n14.3. Protección de Datos Personales.\nLa protección de los datos personales de la población beneficiaria del Programa y la información de las solicitudes de apoyo, se regirán por lo establecido en la Ley Número 466 de Protección de Datos\nPersonales en Posesión de Sujetos Obligados del Estado de Guerrero y la Ley Número 207 de\nTransparencia y Acceso a la Información Pública del Estado de Guerrero.\n14. 4. Quejas y Denuncias.\nLa ciudadanía y las beneficiarias o beneficiarios del Programa, podrán presentar ante la\nSEFODECO, quejas y denuncias, sobre hechos, actos u omisiones, que afecten sus derechos o el incumplimiento de lo dispuesto en las presentes Reglas de Operación; los medios de presentación de las quejas y denuncias, son los siguientes:\na) Presencial: en el domicilio de las oficinas de la SEFODECO, ubicadas en el Recinto de la Oficinas del\nCisneros No. 62, Col. Ciudad de los Servicios, en Chilpancingo, Guerrero, en un horario de atención de las 9:00 a las 16:00 horas.\nc) Telefónica: en el número telefónico (747)471 99 23 Extensión: 9923.\nPara dar respuesta a las quejas y denuncias, la SEFODECO dispondrá de un plazo de diez días hábiles contados a partir del día siguiente de su fecha de presentación.\nOPERACIÓN PARA EL EJERCICIO FISCAL 2022\nLa ciudadanía y las personas beneficiarias del Programa, también podrán presentar sus quejas y denuncias ante la Secretaría de Contraloría y Transparencia Gubernamental, a través de los siguientes medios:\nd) Presencial: en el domicilio de las oficinas de la Secretaría de Contraloría y Transparencia\nGubernamental, ubicadas en el Recinto de la Oficinas del Poder Ejecutivo del Estado de Guerrero, Edificio Norte, Primer Piso, Boulevard Lic. René Juárez Cisneros No. 62, Col. Ciudad de los Servicios, en Chilpancingo, Guerrero, en un horario de atención de las 9:00 a las 16:00 horas.\ne) Correo electrónico: contraloria@guerrero.gob.mx.\nf) Telefónico: en el número telefónico 747471974.\nEn la denuncia o queja la ciudadanía o las personas beneficiarias del Programa, deberán proporcionar los siguientes datos:\n● Nombre de la servidora o servidor público;\n● Secretaría o dependencia de adscripción;\n● Objeto de la denuncia o queja;\n● Nombre y domicilio de la persona quejosa, e\n● Identificación oficial.\n14.5. Acciones de Blindaje.\nEn la operación y el ejercicio de los recursos presupuestales aprobados para el Programa, se aplicarán los lineamientos normativos que emitan la Secretaría de Contraloría y Transparencia\nGubernamental, el Instituto de Transparencia, Acceso a la Información y Protección de Datos Personales del Estado de Guerrero (ITAIG), el Instituto Electoral y de Participación Ciudadana del Estado de Guerrero\n(IEPC) y demás instancias federales y estatales competentes, con la finalidad de impedir que los apoyos sean utilizados con fines político electorales.\nComo estrategia de blindaje electoral, la papelería, documentación oficial, así como la publicidad y promoción del Programa, deberán incluir la siguiente leyenda:\n“Este Programa es de carácter público, no es patrocinado ni promovido por partido político alguno y sus recursos provienen de los impuestos que pagan todos los contribuyentes. Está prohibido el uso de este programa con fines políticos, electorales, de lucro y otros distintos a los establecidos. Quien haga uso indebido de los recursos de este programa deberá ser denunciado y sancionado de acuerdo con la ley aplicable y ante la autoridad competente”.\nOPERACIÓN PARA EL EJERCICIO FISCAL 2022\nEn cuanto a la publicidad en medios electrónicos, impresos, complementarios o de cualquier otra índole, vinculados con los programas de comunicación social, se deberá incluir la siguiente leyenda:\n“Este Programa es público y queda prohibido su uso con fines partidistas o de promoción personal”.\n14.6. Acta de Donación.\nEl Programa no contempla la figura de donación en el otorgamiento de apoyos, en consecuencia, aplica un acta de finiquito que es el para los componentes, 3.1.1; 3.2.1; 3.3.1 y un acta de entrega recepción para todos los conceptos de apoyos contemplados en las presentes Reglas de Operación.\n15. Perspectiva de Género.\nEl Programa, contribuye al fortalecimiento de la perspectiva de género, partiendo del reconocimiento de que representa una condición indispensable y fundamental para la igualdad entre las personas, por tanto, se otorgarán el mismo número de apoyos para mujeres y hombres, de acuerdo al orden de prelación de la presentación de solicitudes de apoyo, y de acuerdo al orden, de mayor a menor, de la calificación obtenida por parte del Comité de Evaluación, y que cuenten con la autorización de apoyo por parte del Comité de Evaluación, hasta agotar el monto presupuestal disponible.\n16. Enfoque de Derechos.\nEl Programa su aplicación y/o ejecución está orientada a proteger y brindar atención a los derechos humanos, económicos y sociales de toda la población, basándose en las normas y los principios de derechos humanos consagrados en la Constitución Política de los Estados Unidos Mexicanos y la\nEste nuevo enfoque implica que es necesario conocer el contenido de los derechos humanos recogido en los tratados y convenios internacionales e incorporar las dimensiones de disponibilidad, acceso, aceptabilidad, calidad, sostenibilidad, es decir una nueva mirada a las personas a las que se dirigen las acciones, si se parte de un marco de referencia como es el derecho.\n1. A las y los beneficiarios de las acciones pasan a ser titulares de derechos.\n2. Los seres humanos, la familia, comunidad, organizaciones, empresas son titulares de responsabilidades.\n3. El estado (Se incluyen todas las instituciones que lo acompañan) son titulares de obligaciones. circunstancias se encuentran en una situación de mayor riesgo para ejercer sus derechos.\n17. Acciones Contra el SARS-COV 2.\nOPERACIÓN PARA EL EJERCICIO FISCAL 2022\nLa operación del Programa, se realizará con estricto cumplimiento de las disposiciones que emitan las autoridades sanitarias de los tres niveles de gobierno, para el control y prevención del SARS-COV 2.\n18. Anexos que reflejen la entrega del apoyo (Económico, Especie o Servicio).\nAnexo 1.- Matriz de Indicadores para Resultados (MIR).\nAnexo 2.- Acta de Donación. No aplica en el Programa.\nAnexo 3.- Formato de solicitud de apoyo, Modalidad 1. Constitución de empresas.\nAnexo 4.- Formato de solicitud de apoyo, Modalidad 2. Certificado como Productor de Mezcal.\nAnexo 5.- Formato de solicitud de apoyo, Modalidad 3. Certificado como Envasador de Mezcal.\nAnexo 6.- Formato de solicitud de apoyo, Modalidad 4. Certificado como Comercializador de Mezcal.\nAnexo 7.- Carta bajo protesta de decir verdad, no duplicidad de apoyos.\nAnexo 8.- Carta bajo protesta de decir verdad, acreditación de volumen de producción de mezcal.\nAnexo 9.- Flujograma.\nAnexo 10.- Requisitos generales. Anexo 10.1.- Requisitos específicos. Anexo 10.2.- Requisitos específicos.\nOPERACIÓN PARA EL EJERCICIO FISCAL 2022\nAnexo 1\nMatriz de Indicadores para Resultados\nH/LÓGICA V Calculo Indicador Medida Verificación Responsable\nApoyar a Número de Apoyos Eficacia Porcentaje SEFODECO E10.- Consolidar la personas físicas personas Económicos Secretaría cadena de y morales, con físicas y Entregados de Fomento valor la finalidad de morales (AEE)/Apoyos y Desarrollo maguey – incrementar la beneficiadas Económicos Económico. mezcal. productividad. Programados*\nFin y la capacidad 100 (AEP) de producción, envasado y comercializaci ón de mezcal.\nElevar la Número de Apoyos Eficacia Porcentaje SEFODECO E10.- Apoyos competitividad personas Económicos Secretaría directos a de la cadena físicas o Entregados de Fomento quienes\nPropósito de valor morales (AEE)/Apoyos y Desarrollo cumplan maguey – beneficiadas Económicos Económico. con los mezcal.. Programados* requisitos\n100 (AEP) establecidos por el\nPrograma.\nC.1 Número de Apoyar la\nConstitución de apoyos para Constitución empresas. la de figuras constitución morales. de empresas\nC.2 Certificado Número de\nComponentes como apoyos para\nProductor de la\nMezcal. certificación de la producción Apoyos de mezcal. Económicos E10.C.3 Certificado Apoyos Entregados Secretaría\nApoyar la como otorgados (AEE)/Apoyos Eficacia Porcentaje SEFODECO de Fomento\nCertificación\nEnvasador de para la Económicos y Desarrollo de acuerdo\nMezcal. certificación Programados* Económico. con la NOMdel 100 (AEP)\n070-SCFIenvasado de mezcal. 2016.\nC.4 Certificado Apoyos como otorgados\nComercializad para la or de Mezcal. certificación de la comercializa ción de mezcal.\nA.1 Apoyo Incrementar Contar con\nConstitución de el número de la suficiencia figuras morales. figuras presupuestal morales. para integrar\nActividades el componente al programa.\nA.2 Apoyo para Variación certificació ctore\n10\n.\ne taría Encontrar las producción de certificados. Entregados de Fomento mejores mezcal. (AEE)/Apoyos Eficacia Porcentaje SEFODECO y Desarrollo condiciones\nVariación Económicos Económico. de procesos\nA.3 Apoyo para anual de Programados* de la certificación envasadores 100 (AEP) certificación del envasado de mezcal. y costo entre de mezcal. los\nOPERACIÓN PARA EL EJERCICIO FISCAL 2022\nA.4 Apoyo para Variación organismos la certificación anual de certificadore de la comercializa s. comercializaci dores ón de mezcal. certificados.\nOPERACIÓN PARA EL EJERCICIO FISCAL 2022\nAnexo\nDirección General de Promoción Industrial, Agroindustrial y Minera\nModalidad 1. Constitución de empresas\nFolio:\nFecha de recepción\n1. Datos del solicitante\nNombre:\nDirección (calle y número):\nColonia/Localidad:\nMunicipio:\nCódigo\nEstado:\nPostal:\nCorreo electrónico:\nNúmero\nTeléfono fijo: celular\nOPERACIÓN PARA EL EJERCICIO FISCAL 2022\n2. Conceptos de apoyo\nPeriodicidad Marque el\nConcepto de\nModalidad Componente apoyo apoyo solicitado\n1.1. Apoyo\n1.1.1. para\n1. Constitución Constitución de constitución Única de Empresas. la figura jurídica: de figuras\nPersona moral. morales.\n3. Documentos anexos\nMarque con una X los documentos que está anexando\n1) Solicitud de incorporación al Programa.\nIdentificación del solicitante.\nPersona física: - Copia de la identificación oficial con fotografía (credencial para votar, cédula profesional o pasaporte).\n2) Persona moral:\n- Copia del acta constitutiva, sus modificaciones.\n- Copia de documento que acredite la personalidad jurídica del representante o apoderado legal.\nCopia de la identificación oficial con fotografía (credencial para votar, cédula profesional o pasaporte).\n3) Clave Única de Registro de Población del solicitante, documento expedido por la Secretaría de Gobernación (CURP).\nOPERACIÓN PARA EL EJERCICIO FISCAL 2022\nComprobante de domicilio.\nPersona física: Copia de recibo telefónico, recibo del servicio de agua, recibo\n4) de luz, recibo del predial o constancia de residencia con fecha no mayor a tres meses de la fecha de expedición.\nPersona moral: Documento que acredite el domicilio fiscal del solicitante.\nCopia de la inscripción en el Padrón de Mezcaleros de la Secretaría de\nFomento y Desarrollo Económico.\n5)\nRegistro que contiene los datos de identificación de las personas físicas o morales que participan en la cadena de valor maguey-mezcal emitido por la\nSecretaría de Fomento y Desarrollo Económico.\n6) Estado de cuenta bancaria a nombre del solicitante, con CLABE interbancaria y con fecha no mayor a dos meses de la fecha de expedición.\nEscrito dirigido a la persona titular de la Secretaría de Fomento y Desarrollo\nEconómico, firmado bajo protesta de decir verdad, en el que manifieste el\n7) solicitante que, en el presente ejercicio fiscal, no ha recibido apoyo por parte apoyo solicitado.\n8) Presentar copia simple de acta de asamblea a protocolizar ante el notario público.\n9) Copia simple de la identificación oficial de todos los integrantes que constituirán la sociedad.\n10) Copia simple de la CURP de todos los integrantes que constituirán la sociedad.\nOPERACIÓN PARA EL EJERCICIO FISCAL 2022\n4. Consideraciones generales atenderán conforme a lo establecido en las Reglas de Operación del Programa, la convocatoria correspondiente y las disposiciones normativas aplicables.\nLas solicitudes y los documentos anexos deberán de presentarse en el domicilio de la\nSecretaría de Fomento y Desarrollo Económico ubicadas en el Recinto de la Oficinas del Poder Ejecutivo del Estado de Guerrero, Edificio Acapulco, Primer Piso, Boulevard\nLic. René Juárez Cisneros No. 62, Col. Ciudad de los Servicios, en Chilpancingo, Gro., en un horario de atención de las 9:00 a las 16:00 horas, o enviarse al correo electrónico mineria.sefodeco@guerrero.gob.mx; en archivo PDF por cada uno de los documentos enviados.\n“Este Programa es de carácter público, no es patrocinado ni promovido por partido contribuyentes. Está prohibido el uso de este programa con fines políticos, electorales, de lucro y otros distintos a los establecidos. Quien haga uso indebido de los recursos y ante la autoridad competente”. quienes incurran en falsedad de declaraciones o informes ante la autoridad.\nOPERACIÓN PARA EL EJERCICIO FISCAL 2022\nLugar y fecha Nombre y firma del solicitante\nOPERACIÓN PARA EL EJERCICIO FISCAL 2022\nAnexo 4\nDirección General de Promoción Industrial, Agroindustrial y Minera\nModalidad 2. Certificado como Productor de Mezcal.\nFolio:\nFecha de recepción\n1. Datos del solicitante\nNombre:\nDirección (calle y número):\nColonia/Localidad:\nMunicipio:\nCódigo\nEstado:\nPostal:\nCorreo electrónico:\nNúmero\nTeléfono fijo: celular\nOPERACIÓN PARA EL EJERCICIO FISCAL 2022\n2. Conceptos de apoyo\nMarque el solicitado\n2.1.1. Taller: Buenas prácticas para producir mezcal.\n2.\n2.1.2. Infraestructura.\nCertificado\n2.1. Productor como 2.1.3. Equipamiento para Única de Mezcal.\nProductor fábricas. de Mezcal.\n2.1.4. Certificado como\nProductor de Mezcal.\n(instalaciones).\n3. Documentos anexos\nMarque con una X los documentos que está anexando.\n1) Solicitud de incorporación al Programa.\nIdentificación del solicitante.\nPersona física: - Copia de la identificación oficial con fotografía (credencial para votar, cédula profesional o pasaporte).\n2)\nPersona moral:\n- Copia del acta constitutiva, sus modificaciones.\n- Copia de documento que acredite la personalidad jurídica del representante o apoderado legal.\n- Copia de la identificación oficial con fotografía (credencial para votar, cédula profesional o pasaporte).\n3) Clave Única de Registro de Población del solicitante, documento expedido por la Secretaría de Gobernación (CURP).\nOPERACIÓN PARA EL EJERCICIO FISCAL 2022\nComprobante de domicilio.\nPersona física: Copia de recibo telefónico, recibo del servicio de agua, recibo\n4) de luz, recibo del predial o constancia de residencia con fecha no mayor a tres meses de la fecha de expedición.\nPersona moral: Documento que acredite el domicilio fiscal del solicitante.\nCopia de la inscripción en el Padrón de Mezcaleros de la Secretaría de Fomento y Desarrollo Económico.\n5)\nRegistro que contiene los datos de identificación de las personas físicas o morales que participan en la cadena de valor maguey-mezcal emitido por la\nSecretaría de Fomento y Desarrollo Económico.\n6) Estado de cuenta bancaria a nombre del solicitante, con CLABE interbancaria y con fecha no mayor a dos meses de la fecha de expedición.\nEscrito dirigido a la persona titular de la Secretaría de Fomento y Desarrollo\nEconómico, firmado bajo protesta de decir verdad, en el que manifieste el\n7) solicitante que, en el presente ejercicio fiscal, no ha recibido apoyo por parte de otras dependencias del Gobierno del Estado, para el mismo concepto de apoyo solicitado.\n8)\nCopia del Certificado de Empresa Guerrerense.\n9) Comprobante o constancia de asistencia al Taller Buenas Prácticas para\nProducir Mezcal.\n10) Carta de decir verdad en donde especifique que produce al menos 1500 litros de Mezcal por temporada.\n11)\nDocumento jurídico que acredite la propiedad o legal posesión de la fábrica.\n12) Comprobante de la visita de inspección y dictamen de un OEC y/o los requerimientos mínimos faltantes respecto a la NOM-070-SCFI-2016.\nOPERACIÓN PARA EL EJERCICIO FISCAL 2022\n13) Presentar al menos 3 cotizaciones de lo que solicita referente al concepto de apoyo infraestructura faltantes respecto a la NOM-070-SCFI-2016.\n14) Acta Finiquito de haber concluido satisfactoriamente el concepto de apoyo\n2.1.2. Infraestructura.\n15) Presentar al menos 3 cotizaciones de lo que solicita referente a los faltantes respecto a la NOM-070-SCFI-2016.\n16)\nConstancia de cumplimiento con la NOM-070-SCFI-2016 emitida por un OEC.\n17) Acta Finiquito de haber concluido satisfactoriamente el concepto de apoyo\n2.1.3. Equipamiento para fábricas.\n4. Consideraciones generales\nLas solicitudes del Programa Apoyo a Certificación de Mezcal Guerrerense se atenderán conforme a lo establecido en las Reglas de Operación del Programa, la convocatoria correspondiente y las disposiciones normativas aplicables.\nRené Juárez Cisneros No. 62, Col. Ciudad de los Servicios, en Chilpancingo, Gro., en un horario de atención de las 9:00 a las 16:00 horas, o enviarse al correo electrónico uno de los documentos enviados.\nOPERACIÓN PARA EL EJERCICIO FISCAL 2022\n“Este Programa es de carácter público, no es patrocinado ni promovido por partido político alguno y sus recursos provienen de los impuestos que pagan todos los contribuyentes.\nEstá prohibido el uso de este programa con fines políticos, electorales, de lucro y otros distintos a los establecidos. Quien haga uso indebido de los recursos de este programa y ante la autoridad competente”. quienes incurran en falsedad de declaraciones o informes ante la autoridad.\nLugar y fecha Nombre y firma del solicitante\nOPERACIÓN PARA EL EJERCICIO FISCAL 2022\nAnexo 5\nDirección General de Promoción Industrial, Agroindustrial y Minera\nModalidad 3. Certificado como Envasador de Mezcal.\nFolio:\nFecha de recepción\n1. Datos del solicitante\nNombre:\nDirección (calle y número):\nColonia/Localidad:\nMunicipio:\nCódigo\nEstado:\nPostal:\nCorreo electrónico:\nNúmero\nTeléfono fijo: celular\nOPERACIÓN PARA EL EJERCICIO FISCAL 2022\n2. Conceptos de apoyo ad apoyo solicitado\n3.1.1. Taller: Buenas prácticas para envasar\n3. Certificado mezcal.\n3.1. como\n3.1.2. Equipamiento para\nEnvasador de Única\nEnvasador envasadores\nMezcal. de Mezcal.\n3.1.3. Certificado como\nEnvasador de Mezcal.\n3. Documentos anexos\nMarque con una X los documentos que está anexando.\nSolicitud de incorporación al Programa.\n)\nIdentificación del solicitante.\nPersona física: - Copia de la identificación oficial con fotografía (credencial para votar, cédula profesional o pasaporte).\n) Persona moral:\n- Copia del acta constitutiva, sus modificaciones.\n- Copia de documento que acredite la personalidad jurídica del representante o apoderado legal.\n- Copia de la identificación oficial con fotografía (credencial para votar, cédula profesional o pasaporte).\nClave Única de Registro de Población del solicitante, documento expedido por\n) la Secretaría de Gobernación (CURP).\nOPERACIÓN PARA EL EJERCICIO FISCAL 2022\nComprobante de domicilio.\n4 Persona física: Copia de recibo telefónico, recibo del servicio de agua, recibo\n) de luz, recibo del predial o constancia de residencia con fecha no mayor a tres meses de la fecha de expedición.\nPersona moral: Documento que acredite el domicilio fiscal del solicitante.\nOPERACIÓN PARA EL EJERCICIO FISCAL 2022\nFomento y Desarrollo Económico.\n5) morales que participan en la cadena de valor maguey-mezcal emitido por la\nSecretaría de Fomento y Desarrollo Económico.\n- Estado de cuenta bancaria a nombre del solicitante, con CLABE interbancaria y con fecha no mayor a dos meses de la fecha de expedición.\nEscrito dirigido a la persona titular de la Secretaría de Fomento y Desarrollo\n- Económico, firmado bajo protesta de decir verdad, en el que manifieste el solicitante que, en el presente ejercicio fiscal, no ha recibido apoyo por parte de otras dependencias del gobierno del estado, para el mismo concepto de apoyo solicitado.\n- Copia del Certificado de Empresa Guerrerense.\n- Documento jurídico que acredite la propiedad o legal posesión de la fábrica.\n10\n) Certificado NOM de Productor de Mezcal por un OEC.\n11\nConstancia de situación fiscal emitida por el Servicio de Administración\n)\nTributaria.\n12\nDocumento jurídico que acredite la propiedad o legal posesión del área\n) designada para envasado.\n13\nComprobante o constancia de asistencia al Taller Buenas Prácticas para\n)\nProducir Mezcal.\nPresentar al menos 3 cotizaciones de lo que solicita referente al concepto de\n) apoyo de Equipamiento para envasar de mezcal.\n)\n3.1.2. Equipamiento para envasadores.\nOPERACIÓN PARA EL EJERCICIO FISCAL 2022\n4. Consideraciones generales atenderán conforme a lo establecido en las Reglas de Operación del Programa, la convocatoria correspondiente y las disposiciones normativas aplicables.\nLas solicitudes y los documentos anexos deberán de presentarse en el domicilio de la\nSecretaría de Fomento y Desarrollo Económico ubicadas en el Recinto de la Oficinas del Poder Ejecutivo del Estado de Guerrero, Edificio Acapulco, Primer Piso, Boulevard\nLic. René Juárez Cisneros No. 62, Col. Ciudad de los Servicios, en Chilpancingo, Gro., en un horario de atención de las 9:00 a las 16:00 horas, o enviarse al correo electrónico mineria.sefodeco@guerrero.gob.mx; en archivo PDF por cada uno de los documentos enviados.\n“Este Programa es de carácter público, no es patrocinado ni promovido por partido contribuyentes. Está prohibido el uso de este programa con fines políticos, electorales, de lucro y otros distintos a los establecidos. Quien haga uso indebido de los recursos y ante la autoridad competente”. quienes incurran en falsedad de declaraciones o informes ante la autoridad.\nOPERACIÓN PARA EL EJERCICIO FISCAL 2022\nLugar y fecha Nombre y firma del solicitante\nOPERACIÓN PARA EL EJERCICIO FISCAL 2022\nAnexo 6\nDirección General de Promoción Industrial, Agroindustrial y Minera\nModalidad 4. Certificado como Comercializador de Mezcal.\nFolio:\nFecha de recepción\n1. Datos del solicitante\nNombre:\nDirección (calle y número):\nColonia/Localidad:\nMunicipio:\nCódigo\nEstado:\nPostal:\nCorreo electrónico:\nNúmero\nTeléfono fijo: celular\nOPERACIÓN PARA EL EJERCICIO FISCAL 2022\n2. Conceptos de apoyo apoyo solicitado\n4.1.1. Taller: Buenas\n4. Certificado prácticas para como 4.1. comercializar Mezcal.\nComercializa Comercializad Única dor de or de Mezcal. 4.1.2. Certificado\nMezcal. como Comercializador de mezcal.\n3. Documentos anexos\nMarque con una X los documentos que está anexando.\n1) Solicitud de incorporación al Programa.\nIdentificación del solicitante.\nPersona física: - Copia de la identificación oficial con fotografía (credencial para votar, cédula profesional o pasaporte).\n2)\nPersona moral:\n- Copia del acta constitutiva, sus modificaciones.\n- Copia de documento que acredite la personalidad jurídica del representante o apoderado legal.\n- Copia de la identificación oficial con fotografía (credencial para votar, cédula profesional o pasaporte).\n3) Clave Única de Registro de Población del solicitante, documento expedido por la Secretaría de Gobernación (CURP).\nOPERACIÓN PARA EL EJERCICIO FISCAL 2022\nComprobante de domicilio.\nPersona física: Copia de recibo telefónico, recibo del servicio de agua, recibo\n4) de luz, recibo del predial o constancia de residencia con fecha no mayor a tres meses de la fecha de expedición.\nPersona moral: Documento que acredite el domicilio fiscal del solicitante.\nCopia de la inscripción en el Padrón de Mezcaleros de la Secretaría de\nFomento y Desarrollo Económico.\n5)\nRegistro que contiene los datos de identificación de las personas físicas o morales que participan en la cadena de valor maguey-mezcal emitido por la\nSecretaría de Fomento y Desarrollo Económico.\n6) Estado de cuenta bancaria a nombre del solicitante, con CLABE interbancaria y con fecha no mayor a dos meses de la fecha de expedición.\nEscrito dirigido a la persona titular de la Secretaría de Fomento y Desarrollo\nEconómico, firmado bajo protesta de decir verdad, en el que manifieste el\n7) solicitante que, en el presente ejercicio fiscal, no ha recibido apoyo por parte de otras dependencias del Gobierno del Estado, para el mismo concepto de apoyo solicitado.\n8)\nCopia del Certificado de Empresa Guerrerense.\n9)\nCertificado NOM de Productor de Mezcal por un OEC.\n10)\nDocumento jurídico que acredite la propiedad o legal posesión de la fábrica.\n11)\nCertificado NOM de Envasador de Mezcal por un OEC.\n12) Constancia de situación fiscal emitida por el Servicio de Administración\nTributaria.\n13)\nTítulo de la marca a nombre del solicitante.\nOPERACIÓN PARA EL EJERCICIO FISCAL 2022\n14) Comprobante o constancia de asistencia al 4.1.1. Taller: Buenas prácticas para comercializar Mezcal.\n4. Consideraciones generales atenderán conforme a lo establecido en las reglas de operación del programa, la convocatoria correspondiente y las disposiciones normativas aplicables.\nLas solicitudes y los documentos anexos deberán de presentarse en el domicilio de la\nSecretaría de Fomento y Desarrollo Económico ubicadas en el Recinto de la Oficinas del Poder Ejecutivo del Estado de Guerrero, Edificio Acapulco, Primer Piso, Boulevard\nLic. René Juárez Cisneros No. 62, Col. Ciudad de los Servicios, en Chilpancingo, Gro., en un horario de atención de las 9:00 a las 16:00 horas, o enviarse al correo electrónico uno de los documentos enviados.\n“Este Programa es de carácter público, no es patrocinado ni promovido por partido contribuyentes. Está prohibido el uso de este programa con fines políticos, electorales, de lucro y otros distintos a los establecidos. Quien haga uso indebido de los recursos y ante la autoridad competente”.\nOPERACIÓN PARA EL EJERCICIO FISCAL 2022 quienes incurran en falsedad de declaraciones o informes ante la autoridad.\nLugar y fecha Nombre y firma del solicitante\nOPERACIÓN PARA EL EJERCICIO FISCAL 2022\nAnexo 7\nCARTA BAJO PROTESTA DE DECIR VERDAD\n, Guerrero a de de 2022.\nSecretaria de Fomento y Desarrollo Económico. Presente:\nPor medio de la presente el suscrito C., con\n, en pleno uso de mis facultades, manifiesto BAJO PROTESTA\nDE DECIR LA VERDAD que, actualmente no he recibido, no estoy recibiendo en el presente ejercicio fiscal, ni solicitaré apoyo para el mismo (s) concepto (s) solicitado (s) del “Programa\nApoyo a Certificación de Mezcal Guerrerense”, u otros programas de la Administración Pública\nEstatal que impliquen una duplicidad en apoyos o subsidios.\nSin más por el momento, me despido atentamente.\nATENTAMENTE\nNombre y firma\nOPERACIÓN PARA EL EJERCICIO FISCAL 2022\nAnexo 8\nCARTA BAJO PROTESTA DE DECIR VERDAD\n, Guerrero a de de 2022.\nA QUIEN CORRESPONDA\nPRESENTE:\nPor medio de la presente el suscrito C., con número de Clave de Identificación de la Credencial para votar\n, en pleno uso de mis facultades, declaro BAJO PROTESTA DE\nDECIR LA VERDAD que, actualmente realizo actividades dentro de la cadena de valor magueymezcal, como productor de mezcal, cuento con una fábrica ubicada en\n, de la cual se obtiene una producción de más de 1500 litros de mezcal al año.\nProtesto lo anterior, para poder participar en el Programa Apoyo a Certificación del Mezcal.\nSin más por el momento, me despido atentamente.\nATENTAMENTE\nNombre y firma\nOPERACIÓN PARA EL EJERCICIO FISCAL 2022\nOPERACIÓN PARA EL EJERCICIO FISCAL 2022\nOPERACIÓN PARA EL EJERCICIO FISCAL 2022\nAnexo 10.1\nRequisitos específicos\n1.1.1. 2.1.1. Taller: 2.1.4.\nDocumentación a Constitución de Buenas 2.1.3. Certificado entregar la figura prácticas 2.1.2. Equipamiento como para Infraestructura para Productor jurídica: producir fábricas de Mezcal\nPersona moral mezcal (instalaciones)\nActa de\nAsamblea para la constitución de la sociedad.\nIdentificación oficial.\nCURP. X\nAcreditar inscripción de la empresa en el\nRegistro X\nEmpresarial\nGuerrerense.\nAcreditar asistencia al X\nTaller.\nAcreditar volumen (litros) de producción de mezcal.\nAcreditar la o propiedad o ifíc X legal posesión. e\nDictaminen de s un OEC. n es.\nActa Finiquito. q X X\nConstancia de R cumplimiento X con la NOM.\nAcreditar la propiedad o legal posesión de la fábrica.\nCertificado como\nProductor de\nMezcal.\nEstatus de situación fiscal.\nAcreditar la propiedad.\nCertificado como\nEnvasador de\nMezcal.\nTítulo de marca.\nOPERACIÓN PARA EL EJERCICIO FISCAL 2022\nAnexo 10.2\nRequisitos específicos entregar prácticas Equipamiento como prácticas como para para para envasar Envasador Comercializador envasadores comercializar mezcal de Mezcal de Mezcal mezcal\nActa de\nAsamblea para la constitución de la sociedad.\nIdentificación oficial.\nCURP.\nAcreditar inscripción de la empresa en el Registro X X\nEmpresarial\nGuerrerense.\nAcreditar asistencia al X X\nTaller.\nAcreditar volumen (litros) de producción de mezcal.\nAcreditar la s propiedad o c legal posesión. ifíc\nDictaminen de p un OEC. E\nActa Finiquito. iu X\nConstancia de e cumplimiento con la NOM.\nAcreditar la propiedad o legal posesión X X de la fábrica.\nCertificado como\nProductor de X X\nMezcal.\nEstatus de situación fiscal. X X\nAcreditar la propiedad.\nCertificado como\nEnvasador de X\nMezcal.\nTítulo de marca.\nOPERACIÓN PARA EL EJERCICIO FISCAL 2022\nPrimero. El presente Acuerdo entrará en vigor al día siguiente de su publicación en el Periódico\nSegundo. Se abrogan las Reglas de Operación del Programa de Apoyo a Certificación de Mezcal para el Ejercicio Fiscal 2021, publicado en el Periódico Oficial del Gobierno del Estado de Guerrero No. 30\nAlcance I, de fecha 13 de abril del 2021.\nTercero. A partir de la entrada en vigor del presente Acuerdo, las Reglas de Operación del\nPrograma Apoyo a Certificación de Mezcal Guerrerense, subsecuentes o sus modificaciones serán emitidos por la persona titular de la Secretaría de Fomento y Desarrollo Económico, responsable directa de la operación y ejecución de las mismas.\nDado en el “Recinto de las Oficinas del Poder Ejecutivo del Estado”, el inmueble ubicado en el número 62, Edificio Norte Planta Baja, en Boulevard René Juárez Cisneros, Código Postal 39074, Colonia\nCiudad de los Servicios, en la Ciudad de Chilpancingo de los Bravo, Capital del Estado de Guerrero, a los tres días del mes de agosto del año dos mil veintidós.\nLA GOBERNADORA CONSTITUCIONAL DEL ESTADO DE GUERRERO.\nMTRA. EVELYN CECIA SALGADO PINEDA.\nRúbrica.\nEL SECRETARIO GENERAL DE GOBIERNO.\nMTRO. LUDWIG MARCIAL REYNOSO NUÑEZ.\nRúbrica.\nLA SECRETARIA DE FOMENTO Y DESARROLLO ECONÓMICO.\nMTRA. TEODORA RAMIREZ VEGA.\nRúbrica.",
  "ordenamiento": "PROGRAMA",
  "jurisdiccion": "GUERRERO",
  "fuente_oficial": "DIARIO OFICIAL DE LA FEDERACION",
  "Fecha de Publicación": "14 DE ABRIL DE 2023",
  "ULTIMA REFORMA PUBLICADA": null,
  "status": "VIGENTE",
  "es_escaneado": false,
  "tiene_tablas": true,
  "materia": [
    "general"
  ]
}