{
  "titulo": "Acuerdo por el Que Se Crea el Programa de Empleo Temporal y Se Expiden Sus Reglas de Operación para",
  "Contenido": "1. OBJETIVOS....................................................................................................................................... 10\n1.1. Objetivo general.............................................................................................................................. 10\n1.2. Objetivos específicos...................................................................................................................... 10\n2. Misión................................................................................................................................................ 10\n3. Visión................................................................................................................................................. 10\n4. Lineamientos..................................................................................................................................... 11\n4.1. Cobertura........................................................................................................................................ 11\n4.1.1. Fundamento Legal....................................................................................................................... 11\n5. Población objetivo.............................................................................................................................. 11\n6. Criterios y requisitos de elegibilidad................................................................................................... 11\n7. Tipos y montos de apoyo................................................................................................................... 12\n7.1. Apoyo directo.................................................................................................................................. 12\n7.2. Rubros de atención......................................................................................................................... 13\n8. Derechos, obligaciones y causas de suspensión de los apoyos........................................................ 15\n8.1. Derechos........................................................................................................................................ 15\n8.2. Obligaciones................................................................................................................................... 15\n8.3. Causas de suspensión de apoyos................................................................................................... 15\n9. Instancias participantes...................................................................................................................... 16\n10. Instancias ejecutoras....................................................................................................................... 16\n11. Instancia normativa.......................................................................................................................... 16\n12. Coordinación Interinstitucional......................................................................................................... 16\n13. Proceso de operación...................................................................................................................... 17\n14. Gastos de operación........................................................................................................................ 18\n15. Registro de operaciones.................................................................................................................. 18\n16. Evaluación....................................................................................................................................... 19\n16.1. Evaluación interna......................................................................................................................... 19\n16.2. Evaluación externa........................................................................................................................ 19\n17. Indicadores...................................................................................................................................... 19\n18. Seguimiento, control y auditoría....................................................................................................... 20\n18.1. Seguimiento.................................................................................................................................. 20\n18.2. Control y auditoría......................................................................................................................... 20\n19. Transparencia.................................................................................................................................. 20\n19.1. Difusión......................................................................................................................................... 20\n19.2. Contraloría social.......................................................................................................................... 21\n19.3. Confrontas.................................................................................................................................... 21\n19.4. Acciones de blindaje electoral....................................................................................................... 22\n20. Perspectiva de género..................................................................................................................... 22\n21. Quejas, denuncias y solicitud de información................................................................................... 22\n21.1. Quejas y denuncias....................................................................................................................... 22\n22. Glosario de términos........................................................................................................................ 23\nTEXTO ORIGINAL.\nACUERDO POR EL QUE SE CREA. EL PROGRAMA DE EMPLEO TEMPORAL Y SE EXPIDEN SUS\nGuerrero.- Poder Ejecutivo.\nLIC. HÉCTOR ANTONIO ASTUDILLO FLORES, GOBERNADOR DEL ESTADO DE\nGUERRERO, CON FUNDAMENTO EN LOS ARTÍCULOS 90 NUMERAL 2 Y 91 FRACCIONES I, IX Y\n10, 11, 18 APARTADO A FRACCIONES I Y IV DE LA LEY ORGÁNICA DE LA ADMINISTRACIÓN\nPÚBLICA DEL ESTADO NÚMERO 08, 1, 2, 3, 6 Y 8 DE LA LEY NÚM. 102 PARA EL DESARROLLO\nSOCIAL DEL ESTADO DE GUERRERO; EN EL PROGRAMA DE EMPLEO TEMPORAL PREVISTO EN\nEL ARTÍCULO 62 Y EL ANEXO 14-A DEL DECRETO NÚMERO 170 DEL PRESUPUESTO DE\nEGRESOS DEL ESTADO DE GUERRERO PARA EL EJERCICIO FISCAL 2016, ASÍ COMO LAS\nESTRATEGIAS Y OBJETIVOS ESTABLECIDOS EN EL PLAN ESTATAL DE DESARROLLO DE\nGUERRERO 2016-2021;Y\nQue el Plan Estatal de Desarrollo 2016-2021, dentro del objetivo \"Fomentar y generar empleo de calidad, establece como una de sus líneas de acción, fortalecer el Programa de Empleo Temporal e impulsar el autoempleo para dar respuesta en corto plazo a la demanda laboral.\nQue el alto nivel de informalidad de la economía nacional y la marginación de numerosos municipios y localidades a lo largo de todo el país, provoca que la inestabilidad del empleo sea considerada como uno de los principales motivos de preocupación dentro de los hogares mexicanos.\nQue la pérdida del empleo y la consecuente disminución de los ingresos aún de manera temporal tienen graves consecuencias sobre la pobreza de los hogares, fundamentalmente porque la falta de empleo conduce a una importante disminución del capital económico familiar, mayor presión sobre los recursos naturales, así como el abandono de la educación y el fomento al endeudamiento, estas afectaciones remuneradas.\nQue la oferta laboral puede disminuir en algunas regiones del Estado a lo largo del año, debido a emergencias o por efecto de los ciclos productivos, afectando principalmente a la población de escasos recursos que enfrenta periódicamente etapas con una grave disminución en sus ingresos y patrimonio. Por disponibles, la ejecución de acciones que permitan disminuir el impacto del desempleo temporal; una de\n(PET). ingresos, no solo por la ocurrencia de emergencias climatológicas o ambientales, sino también por otras situaciones económicas adversas.\nQue el diseño del Programa de Empleo Temporal (PET) implica que los beneficiarios del mismo, deben participar en proyectos de beneficio familiar o comunitario como corresponsabilidad obligatoria para recibir los apoyos que se les otorguen. Este requisito no solamente promueve la participación activa de los ciudadanos en el desarrollo de sus hogares y comunidades, sino que además genera beneficios adicionales al resto de la sociedad en función de los proyectos ejecutados.\nQue dentro de los objetivos y estrategias que plantea el Ejecutivo Estatal, está abatir la marginación y el rezago social que enfrentan los grupos sociales vulnerables para preverles de igualdad en las oportunidades que les permitan desarrollarse con independencia y plenitud; asimismo, plantea elevar la productividad de las personas para que cuenten con mejores opciones de empleo e ingreso, que les permitan reducir sus niveles de pobreza.\nQue en razón de lo anterior el Programa de Empleo Temporal (PET), estará orientado a apoyar transitoriamente el ingreso de estas familias en el marco de la ejecución de proyectos y acciones de beneficio familiar o comunitario. Respecto al origen de los recursos que integra y aplica el programa, provienen de inversión estatal directa (IED).\nQue en el Decreto número 170 del Presupuesto de Egresos del Estado de Guerrero para el\nEjercicio Fiscal 2016, las dependencias y entidades de la administración pública estatal podrán ejercer los montos para programas y proyectos de inversión aprobados en este presupuesto, en los términos de las disposiciones emitidas por la Secretaría de Finanzas y Administración del Estado y la Secretaría de\nPlaneación y Desarrollo Regional, en función de la disponibilidad presupuestal y financiera del Estado.\nQue las y los titulares de las dependencias y entidades de la administración pública estatal, así como los servidores públicos autorizados para ejercer recursos públicos del presupuesto de inversión de las mismas, serán responsables de los programas y proyectos de inversión que realicen.\nQue de acuerdo a lo anterior, será necesario incrementar la calidad y eficiencia del Programa de\nEmpleo Temporal, que redunde en una mayor atención y satisfacción de la población objetivo, así como de grupos excluidos y marginados, con eficiencia en la productividad de los recursos presupuestales destinados para tal fin, a través del impulso y promoción de la cobertura de las políticas públicas con proyectos productivos cuyos beneficios trasciendan la temporalidad del apoyo, encaminados a fomentar la integración social de las personas, que propicien el arraigo de la población en su lugar de origen, el desarrollo de sus capacidades y el aprovechamiento de las vocaciones regionales, generando alternativa de ocupación temporal y permanente que compensan los costos de productividad e inversión.\nQue los apoyos otorgados deberán sujetarse a criterios de objetividad, equidad, transparencia, publicidad, selectividad y temporalidad.\nQue bajo dicho contexto la Secretaría de Desarrollo Social del Estado de Guerrero, a través de la\nSubsecretaría de Promoción y Vinculación Social y la Dirección General de Desarrollo Comunitario, serán responsables de la aplicación de las Reglas de Operación del Programa de Empleo Temporal, en el presente ejercicio fiscal.\nQue en las reglas de operación se establecen las disposiciones a las que debe sujetarse el\nPrograma de Empleo Temporal, con el objeto de otorgar transparencia y asegurar la aplicación eficiente, eficaz, oportuna y equitativa de los recursos públicos asignados al mismo.\nEn cumplimiento de lo anterior se ha tenido a bien expedir el siguiente:\nACUERDO POR EL QUE SE CREA EL PROGRAMA DE EMPLEO TEMPORAL Y SE EXPIDEN SUS\nREGLAS DE OPERACIÓN PARA EL EJERCICIO FISCAL 2016.\nArtículo 1. Se crea el Programa de Empleo Temporal, y se expiden sus Reglas de Operación para el Ejercicio Fiscal 2016, el Programa tiene por objeto disminuir la problemática de la población de 18 años o más que demandan fuentes de trabajo, a quienes se les entregarán apoyos económicos temporales, por su participación en proyectos y/o acciones de beneficio familiar o comunitario de fácil realización, que habiten en zonas urbanas y suburbanas, preferentemente aquellos que vean disminuidos sus ingresos o patrimonio, ocasionado por situaciones económicas y sociales adversas, emergencias o desastres naturales y/o climatológicas en el Estado de Guerrero.\nArtículo 2. Se emiten las Reglas de Operación del Programa de Empleo Temporal para el Ejercicio\nFiscal 2016, en las que se establecen los principios de eficiencia, eficacia, oportunidad, equitativa y transparencia de los recursos públicos y requisitos que se deben de cumplir para poder acceder ha dicho\nPrograma.\nEn las Reglas de Operación del Programa de Empleo Temporal, se establecerán los criterios y requisitos que se deben cumplir para poder acceder a dicho Programa.\nArtículo 3. La Secretaría de Desarrollo Social, tendrá a cargo la operación, ejecución y evaluación del Programa de Empleo Temporal, bajo los criterios de objetividad, equidad, transparencia, publicidad, selectividad y temporalidad, con estricto apego a la normatividad aplicable.\nPROGRAMA DE EMPLEO TEMPORAL.\nI. Justificación de programa. tienen graves consecuencias sobre la pobreza de los hogares, fundamentalmente porque la falta de empleo conduce a una importante disminución del capital económico familiar, mayor presión sobre los recursos naturales, así como el abandono de la educación y el fomento al endeudamiento; estas afectaciones remuneradas.\nAdemás la oferta laboral puede disminuir en algunas regiones del Estado a lo largo del año, debido a emergencias o por efecto de los ciclos productivos, afectando principalmente a la población de escasos recursos que enfrenta periódicamente etapas con una grave disminución en sus ingresos y patrimonio. Por ello las políticas de empleo estatal deben considerar además del fomento a la creación de empleos formales disponibles, la ejecución de acciones que permitan disminuir el impacto del desempleo temporal, una de las alternativas para enfrentar dicho fenómeno es la implementación del Programa de Empleo Temporal\n(PET), que estará orientado a apoyar transitoriamente el ingreso de estas familias en el marco de la ejecución de proyectos y acciones de beneficio familiar o comunitario.\nII. Objetivos\nObjetivo mediato:\nEjecutar proyectos productivos y/o acciones que contribuyan al mejoramiento de las condiciones familiares o comunitarias y que con su ejecución se obtengan fuentes de ingreso temporal.\nObjetivo inmediato:\nMitigar el impacto económico y social de hombres y mujeres de 18 años de edad o más que vean disminuidos sus ingresos o patrimonio ocasionado por situaciones económicas y sociales adversas, emergencias o desastres.\nIII. Limitación del programa.\n1. Espacio:\nEl programa podrá operar a nivel estatal en los 81 municipios que lo integran, beneficiando principalmente a la población que vive en zonas urbanas y suburbanas en extrema pobreza, marginación y desplazados por la violencia.\n2. Determinación y precisión de actividades:\nEl programa operará por medio de dos vertientes que serán:\na) Mejoramiento de infraestructura local; y\nb) Proyectos productivos.\n3. Mejoramiento de infraestructura local:\n• Mejoramiento de vialidades.\n• Dotación de agua, saneamiento, ampliación de drenaje y alcantarillado, construcción, mejoramiento y rehabilitación de espacios e inmuebles públicos e infraestructura básica en vivienda.\n• Construcción, rehabilitación y mantenimiento de infraestructura educativa.\n• Acciones de construcción y ampliación de infraestructura de electrificación.\n• Proyectos que contribuyan a mejorar la infraestructura local con acciones de rehabilitación y mantenimiento del entorno urbano.\n• Otros proyectos que contribuyan a mejorar la infraestructura local.\n4. Proyectos productivos:\n• Proyectos de naturaleza productiva de tipo agropecuario, forestal, pesquero y agroindustrial según lo establecido en los lineamientos respectivos.\n5. Tiempo y calendario de actividades:\nLos recursos asignados en el Decreto número 170 del Presupuesto de Egresos del Gobierno del\nEstado de Guerrero, para el Ejercicio Fiscal 2016.\n6. Universo de trabajo:\nDos mil mujeres y hombres de 18 años de edad o más que ven afectado su patrimonio o enfrentan sociales y económicas adversas, emergencias o desastres naturales.\nIV. Organización.\n1. Procedimientos:\na) Métodos de las actividades:\nSe otorgará un apoyo económico, consistente en jornales equivalentes al 99% de un salario mínimo general diario vigente en la zona económica en que se desarrolle el proyecto y/o acción conforme a lo establecido en la Comisión Nacional de Salarios Mínimos, mismos que se encuentran vigentes a partir del 1 de enero del 2016 y se podrán dar en un máximo del monto correspondiente a 1 jornal diario y 90 jornales por beneficiarios durante el ejercicio fiscal.\nSe podrán otorgar apoyos económicos para la adquisición o arrendamiento de materiales, herramientas, maquinaria o equipo, incluyendo implementos de protección para las y los beneficiarios de hasta de un 30%.\nb) Dependencias que colaborarán en el programa:\nLa instancia ejecutora del programa será la Secretaría de Desarrollo Social a través de la\nSubsecretaría de Promoción y Vinculación Social y la Dirección General de Desarrollo Comunitario y podrá concertar la participación activa de otras dependencias estatales, los H. Ayuntamientos y las organizaciones de la sociedad civil del Estado de Guerrero.\n2. Financiamiento:\na) Elaboración del presupuesto:\nEl presupuesto aprobado para el Programa Empleo Temporal en el Decreto número 170 del\nPresupuesto de Egresos del Estado para el Ejercicio Fiscal 2016 es de: $18,000,000.00 (Dieciocho millones de pesos 00/ 100 M.N.)\nb) Plan de obtención de fondos:\nLos recursos para la aplicación del programa provienen de Inversión Estatal Directa (IED), por lo cual el estará sujeto a disposición presupuestal.\nV. Evaluación.\nEvaluación interna faciliten tanto la obtención de información como la evaluación de los beneficios económicos y sociales.\nEvaluación externa\nLa Secretaría de Desarrollo Social, podrá realizar una evaluación de resultados de carácter externo del programa sujeto a reglas de operación, para lo cual tendrá la facultad de designar a la instancia que realizará dicho análisis.\nContraloría y Transparencia Gubernamental.\nREGLAS DE OPERACIÓN DEL PROGRAMA DE EMPLEO TEMPORAL PARA EL EJERCICIO\nFISCAL 2016.\n1. OBJETIVOS\n1.1. Objetivo general\nDisminuir la problemática de la población de 18 años o más que demanda el trabajo, mediante la entrega de apoyos temporales a su ingreso por su participación en proyectos y/o acciones de beneficio familiar o comunitario de fácil realización, y que habiten en zonas urbanas y suburbanas que ven disminuidos sus ingresos o patrimonio, ocasionado por situaciones económicas y sociales adversas, emergencias o desastres naturales y/o climatológicas.\n1.2. Objetivos específicos\n• Ejecutar proyectos y/o acciones que contribuyan al mejoramiento de las condiciones familiares o comunitarias y que con su ejecución se obtengan fuentes de ingreso temporal.\n• Mitigar el impacto económico y social de los hombres y mujeres de 18 años de edad o más que vean disminuidos sus ingresos o patrimonio ocasionado por situaciones económicas y sociales adversas, emergencias o desastres.\n2. Misión\nOtorgar seguridad y bienestar social a la población que demanda trabajos, ofreciendo oportunidades de empleo temporal, mediante acciones y/o proyectos de carácter familiar o comunitario de fácil realización que apoyen su ingreso y economía familiar.\n3. Visión positiva en sus necesidades básicas de bienestar social, para que puedan seguir desarrollándose de manera individual, familiar o comunitaria en un marco de derechos sociales.\n4. Lineamientos\n4.1. Cobertura\nEl programa podrá operar a nivel estatal en los 81 municipios que lo integran, beneficiando principalmente a la población que vive en zonas urbanas y suburbanas en extrema pobreza, marginación y desplazados por la violencia.\n4.1.1. Fundamento Legal\na) Constitución Política de los Estados Unidos Mexicanos;\nc) Ley Orgánica de la Administración Pública del Estado de Guerrero número 08;\nd) Ley Núm.102, para el Desarrollo Social del Estado de Guerrero;\ne) Ley número 374 de Transparencia y Acceso a la Información Pública del Estado de Guerrero;\nf) Ley número 695 de Responsabilidades de los Servidores Públicos del Estado y de los Municipios de Guerrero;\ng) Código de Conducta de la Secretaría de Desarrollo Social;\nh) Reglamento de la Ley para el Desarrollo Social del Estado de Guerrero Núm. 102;\ni) Plan Estatal de Desarrollo del Estado de Guerrero 20162021;\nj) Decreto número 170 del Presupuesto de Egresos del Estado de Guerrero para el Ejercicio Fiscal\n2016; y\nk) Todos aquellos ordenamientos normativos que sean aplicables.\n5. Población objetivo\nMujeres y hombres de 18 años de edad o más que ven afectado su patrimonio o enfrentan una sociales y económicas adversas, emergencias o desastres naturales.\n6. Criterios y requisitos de elegibilidad\na) Selectividad: Se atiende de manera específica a un sector de la población que por sus condiciones se le dificulta encontrar una fuente de trabajo en el mercado laboral.\nb) Transparencia: Eje rector en la Secretaría de Desarrollo Social, que dentro del ámbito de su por parte de la ciudadanía de los procedimientos, decisiones y usos de los recursos públicos ejercidos por el programa, a fin de establecer un estricto seguimiento, control y evaluación de los mismos.\nc) Equidad: Está dirigido a hombres y mujeres de 18 años de edad o más, que reúnan los requisitos previstos en las presentes reglas de operación en igualdad de condiciones para todos los municipios.\nd) Corresponsabilidad y sustentabilidad: El programa constituye una responsabilidad constitucional y moral de la administración pública estatal, en beneficio de los sectores de la población marginada y en condiciones de pobreza en la entidad, situación que a su vez obliga a los beneficiarios a asumir la responsabilidad de participar de manera activa en los procesos de ejecución, seguimiento, fiscalización y evaluación para la correcta operación y permanencia del programa.\ne) Objetividad: La selección de beneficiarios se llevará a cabo con imparcialidad y con apego a las reglas de operación que rigen este programa.\nf) Oportunidad: Circunstancia favorable o que se da en un momento adecuado u oportuno para realizar algo que le genere una mejora o algún beneficio.\ng) Temporalidad: Define los tiempos de elegibilidad del programa.\nCriterios Requisitos\nLas y los solicitantes deberán tener 18 Entregar copia legible y presentar original para años de edad o más al inicio de su su cotejo de alguno de los siguientes participación en los proyectos. documentos vigentes que acrediten su edad.\n1. CURP\n2. Acta de nacimiento\n3. Credencial para votar\n4. Cartilla del Servicio Militar Nacional\n5. Pasaporte\n6. Credencial del Instituto Nacional de las\nPersonas Adultas Mayores (INAPAM).\n7. Tipos y montos de apoyo\n7.1. Apoyo directo\nSe otorgará un apoyo económico, consistente en jornales equivalentes al 99% de un salario mínimo general diario vigente en la zona económica en que se desarrolle el proyecto y/o acción conforme a lo establecido en la Comisión Nacional de Salarios Mínimos, mismos que se encuentran vigentes a partir del 1° de enero del 2016 y se podrán dar en un máximo del monto correspondiente a 1 jornal diario y 90 jornales por beneficiarios durante el ejercicio fiscal.\nSe podrán otorgar apoyos económicos para la adquisición o arrendamiento de materiales, herramientas, maquinaria o equipo, incluyendo implementos de protección para las y los beneficiarios de hasta de un 30%. la participación de las y los beneficiarios para el desarrollo personal, familiar y comunitario, implementadas según los reglas de este programa, en congruencia con las particularidades de cada proyecto.\n7.2. Rubros de atención\nEl programa actuará en los rubros de atención siguientes:\n{\"tabla_1\":{\"columnas\":[\"Rubro de Atención\",\"Objetivo\",\"Descripción\"],\"filas\":[{\"columna_1\":\"Mejoramiento de Infraestructura local.\",\"columna_2\":\"Contribuir a mejorar las\",\"columna_3\":\"Desarrollo de proyectos en infraestructura\"},{\"columna_1\":\"(sin dato)\",\"columna_2\":\"condiciones del medio\",\"columna_3\":\"para:\"},{\"columna_1\":\"(sin dato)\",\"columna_2\":\"familiar y comunitario.\",\"columna_3\":\"7. Mejoramiento de vialidades.\"},{\"columna_1\":\"(sin dato)\",\"columna_2\":\"(sin dato)\",\"columna_3\":\"8. Dotación de agua saneamiento,\\n:\"},{\"columna_1\":\"(sin dato)\",\"columna_2\":\"(sin dato)\",\"columna_3\":\"ampliación de drenaje y alcantarillado,\"},{\"columna_1\":\"(sin dato)\",\"columna_2\":\"(sin dato)\",\"columna_3\":\"construcción, mejoramiento y\"},{\"columna_1\":\"(sin dato)\",\"columna_2\":\"(sin dato)\",\"columna_3\":\"rehabilitación de espacios e inmuebles\"},{\"columna_1\":\"(sin dato)\",\"columna_2\":\"(sin dato)\",\"columna_3\":\"públicos e infraestructura básica en\"},{\"columna_1\":\"(sin dato)\",\"columna_2\":\"(sin dato)\",\"columna_3\":\"vivienda.\"},{\"columna_1\":\"(sin dato)\",\"columna_2\":\"(sin dato)\",\"columna_3\":\"9. Construcción, rehabilitación y\"},{\"columna_1\":\"(sin dato)\",\"columna_2\":\"(sin dato)\",\"columna_3\":\"mantenimiento de infraestructura\"},{\"columna_1\":\"(sin dato)\",\"columna_2\":\"(sin dato)\",\"columna_3\":\"educativa.\"},{\"columna_1\":\"(sin dato)\",\"columna_2\":\"(sin dato)\",\"columna_3\":\"10. Acciones de construcción y\"},{\"columna_1\":\"(sin dato)\",\"columna_2\":\"(sin dato)\",\"columna_3\":\"ampliación de infraestructura de\"},{\"columna_1\":\"(sin dato)\",\"columna_2\":\"(sin dato)\",\"columna_3\":\"electrificación.\"},{\"columna_1\":\"(sin dato)\",\"columna_2\":\"(sin dato)\",\"columna_3\":\"11. Proyectos que contribuyan a mejorar\"},{\"columna_1\":\"(sin dato)\",\"columna_2\":\"(sin dato)\",\"columna_3\":\"la infraestructura local con acciones de\"},{\"columna_1\":\"(sin dato)\",\"columna_2\":\"(sin dato)\",\"columna_3\":\"rehabilitación y mantenimiento del entorno\"},{\"columna_1\":\"(sin dato)\",\"columna_2\":\"(sin dato)\",\"columna_3\":\"urbano.\"},{\"columna_1\":\"(sin dato)\",\"columna_2\":\"(sin dato)\",\"columna_3\":\"12. Otros proyectos que contribuyan a\"},{\"columna_1\":\"(sin dato)\",\"columna_2\":\"(sin dato)\",\"columna_3\":\"mejorar la infraestructura local.\"},{\"columna_1\":\"Proyectos Productivos.\",\"columna_2\":\"Contribuir al desarrollo\",\"columna_3\":\"Proyectos de naturaleza productiva de tipo\"},{\"columna_1\":\"(sin dato)\",\"columna_2\":\"de actividades\",\"columna_3\":\"agropecuario, forestal, pesquero y\"},{\"columna_1\":\"(sin dato)\",\"columna_2\":\"productivas que\",\"columna_3\":\"agroindustrial según lo establecido en los\"},{\"columna_1\":\"(sin dato)\",\"columna_2\":\"permitan la\",\"columna_3\":\"lineamientos respectivos.\"},{\"columna_1\":\"(sin dato)\",\"columna_2\":\"sustentabilidad de\",\"columna_3\":\"(sin dato)\"},{\"columna_1\":\"(sin dato)\",\"columna_2\":\"hogares y grupas\",\"columna_3\":\"(sin dato)\"},{\"columna_1\":\"(sin dato)\",\"columna_2\":\"sociales.\",\"columna_3\":\"(sin dato)\"}]}}\nSe podrá considerar la contratación, servicios de asesoría y promotoria, los gastos de movilidad del personal contratado para tales efectos, la difusión, la adquisición de bienes que permitan la ejecución, supervisión, seguimiento y la evaluación del programa. beneficiarias y las instancias participantes o ejecutoras.\n8. Derechos, obligaciones y causas de suspensión de los apoyos.\n8.1. Derechos\nLos beneficiarios tienen derecho a:\na) Información necesaria, de manera clara y oportuna, para participar en el programa;\nb) Un trato digno, respetuoso, oportuno, con calidad y equitativo, sin discriminación alguna;\nc) Atención y apoyos sin costo alguno o condicionamiento no contemplado en las presentes reglas de operación; y\nd) Seguridad sobre la reserva y privacidad de su información personal conforme a la Ley número\n374 de Transparencia y Acceso a la Información Pública del Estado de Guerrero.\n8.2. Obligaciones\na) Proporcionar, bajo protesta de decir verdad, la información que se les requiera de acuerdo a lo establecido en las presentes reglas de operación;\nb) Cumplir con su corresponsabilidad en un proyecto autorizado y estar de acuerdo en no participar simultáneamente en más de un proyecto y/o acción PET y conformar el Comité de Contra-loría Social; y\nc) Nombrar a una persona representante, para que en caso de fallecimiento, imposibilidad física o enfermedad, reciba los jornales que le correspondan.\n8.3. Causas de suspensión de apoyos\nSe suspenderán los apoyos en los casos siguientes:\na) Cuando las y los beneficiarios no cumplan con alguna de las obligaciones estipuladas en las presentes reglas de operación.\nb) Cuando la Secretaría de Desarrollo Social o algún órgano de fiscalización detecte desviaciones beneficiarios o beneficiarias, suspenderán los apoyos y deberán solicitar su reintegro en apego a la normatividad aplicable.\n9. Instancias participantes\nLas instancias participantes serán: Secretaría de Desarrollo Social, Secretaría de Planeación y\nDesarrollo Regional, Secretaría de Finanzas y Administración, Secretaría de Contraloría y Transparencia\n10. Instancias ejecutoras\nLa instancia ejecutora del programa será la Secretaría de Desarrollo Social a través de la\nSubsecretaría de Promoción y Vinculación Social y la Dirección General de Desarrollo Comunitario y podrá concertar la participación activa de otras dependencias estatales, los H. Ayuntamientos y las organizaciones de la sociedad civil del Estado de Guerrero.\n11. Instancia normativa\nSe establecerá un Comité Técnico integrado por las Secretarías de Contraloría y Transparencia\nGubernamental, Planeación y Desarrollo Regional, de Finanzas y Administración, así como por la titular de la Secretaría de Desarrollo Social, quien asumirá la presidencia del Comité, el cual tendrá la facultad de determinar el porcentaje mínimo y máximo del presupuesto anual destinado a los diversos apoyos a que se refieren las presentes reglas de operación, así como emitir los lineamientos en los que se detallará su forma de operación, de la mecánica operativa de los proyectos que le competen y los casos de excepción.\na) El Comité Técnico del PET es el máximo órgano rector del programa, encargado de fortalecer la coordinación interinstitucional y obtener un mayor impacto social del PET.\nDicho Comité es el único facultado para interpretar las presentes reglas y resolver los casos no previstos en las mismas en materia normativa y operativa. Sus facultades estarán determinadas en los lineamientos respectivos, aprobados por sus integrantes.\nb) El grupo permanente de trabajo del PET, es el órgano operativo del Comité Técnico del programa y está integrado por la Subsecretaría de Promoción y Vinculación Social, a través de la Dirección\nGeneral de Desarrollo Comunitario. respectivos.\n12. Coordinación Interinstitucional necesarios para garantizar que sus acciones busquen potenciar el impacto de los recursos, fortalecer la cobertura, detonar la complementariedad y reducir gastos administrativos. Debido a esto, se instrumentarán del PET, por lo que en caso de identificarse duplicidad, la dependencia que inició los trabajos tiene prelación para continuar apoyando al beneficiario, a menos que éste opte por otra dependencia y en tal situación, la primera deberá exceptuarlo de su padrón de beneficiarios del programa.\n13. Proceso de operación\na) Difusión del programa para dar a conocer los requisitos de participación, la corresponsabilidad de las y los beneficiarios y los apoyos a otorgar, establecidos en las presentes reglas de operación.\nb) Presentación de solicitudes\nLa solicitud podrá ser presentada de manera individual o en grupo por parte de los solicitantes para proyectos y/o acciones de beneficio familiar o comunitario, dirigida a la titular de la Secretaría de\nDesarrollo Social, presentando original y copia para acuse de recibo en las oficinas de dicha Secretaría, así como copia de la credencial de elector de la persona que entregue la solicitud, proporcionando un número telefónico y/o correo electrónico, para hacerle llegar la notificación sobre el apoyo solicita- do.\nLa Secretaría de Desarrollo Social del Estado dará respuesta a la solicitud dentro de los treinta\n(30) días hábiles siguientes al ingreso de la misma; en caso de no obtener respuesta en el plazo establecido, se entenderá que dicha solicitud no fue aceptada. Cabe señalar que las solicitudes serán atendidas en base a la disponibilidad presupuestal del programa.\nCuando la solicitud no incluya toda la información requerida o faltara algún documento, la dependencia informará al solicitante en un plazo no mayor a quince (15) días hábiles, mismo que tendrá un plazo hasta de cinco (5) días hábiles a partir de la fecha de haber recibido la notificación, para solventar la omisión.\nLas personas podrán solicitar información sobre el apoyo que otorga el PET en las oficinas de la\nSecretaría de Desarrollo Social del Estado de Guerrero, ubicadas en Edificio Norte Planta Baja, Palacio de\nGobierno, Boulevard René Juárez Cisneros No. 62, Chilpancingo, Gro. C.P. 39074.\nCon los datos que aporten los solicitantes, se integrará el Padrón de Beneficiarios del Programa de Empleo Temporal en cumplimiento a las disposiciones legales vigentes. por los jornales trabajados, será un familiar o representante quien podrá ir en su representación, presentando debidamente una carta poder e identificación para cobrar dicho apoyo. En caso de fallecimiento, presentar acta de defunción.\nc) Elegibilidad de los proyectos\nLa Secretaría de Desarrollo Social será la responsable de verificar la elegibilidad, viabilidad técnica, normativa y social, así como la suficiencia presupuestaria de los proyectos que sean de su competencia de acuerdo a las reglas de operación.\nd) Aprobación de los proyectos\nLa Secretaría de Desarrollo Social definirá los métodos para revisar los proyectos solicitados y emitir en su caso la aprobación correspondiente.\ne) Comité de Contraloría Social\nLos beneficiarios del lugar donde se ejecutará el proyecto, constituirán un Comité de Contraloría\nSocial y elegirán al órgano ejecutivo del mismo en asamblea general, dicho órgano integrado por un\nPresidente, un Secretario, un Tesorero y dos Vocales.\nf) Elaboración de expediente técnico\ng) Entrega de apoyos\nLa instancia ejecutora será la encargada de entregar los apoyos económicos a las y los beneficiarios en los plazos y lugares acordados por la misma instancia.\nEn caso de que la persona beneficiaria migre, presente alguna imposibilidad física, enfermedad o fallezca y no pueda recibir los jornales, el monto del apoyo correspondiente será entregado a algún familiar o representante que cumpla con los requisitos señalados en los lineamientos de estas reglas de operación.\n14. Gastos de operación\nDel total de recursos autorizados al programa, podrá aplicarse hasta un 3% del presupuesto asignado, para gastos de operación, destinados a las diversas acciones asociadas con la planeación, operación, supervisión, contraloría social y evaluación o asesoría externa del programa.\n15. Registro de operaciones\na) Avances físicos-financieros\nRegional, durante los primeros cinco días hábiles del mes inmediato al trimestre que se reporta los avances físicos financieros de los proyectos autorizados.\nb) Recursos no devengados\nLos recursos que al cierre del ejercicio se conserven o que no se hayan devengado al 31 de diciembre del presente ejercicio fiscal, deberán ser reintegrados a la Tesorería General del Estado, dependiente de la Secretaría de Finanzas y Administración del Estado.\nc) Cierre de ejercicio\nLa dependencia ejecutora integrará el cierre de ejercicio y lo remitirá a la Secretaría de Finanzas y Administración del Estado, de manera impresa y en medios magnéticos; asimismo, verificará la congruencia de la información con la cuenta pública.\n16. Evaluación\n16.1. Evaluación interna\nEl Programa de Empleo Temporal estará sujeto a procesos periódicos de seguimiento y evaluación que permitan ajustar su ejecución y garantizar que los mecanismos de funcionamiento y administración faciliten tanto la obtención de información como la evaluación de los beneficios económicos y sociales.\n16.2. Evaluación externa\nLa Secretaría de Desarrollo Social, podrá realizar una evaluación de resultados de carácter externo del programa sujeto a reglas de operación, para lo cual tendrá la facultad de designar a la instancia que realizará dicho análisis.\nContraloría y Transparencia Gubernamental.\n17. Indicadores nivel de propósito detallados a continuación:\n• Número de proyectos y/o acciones ejecutadas.\n• Número de proyectos y/o acciones programadas.\n• Número de beneficiarios que recibieron el apoyo.\n• Número de jornales realizados.\nLa Secretaría de Desarrollo Social, será responsable de compilar e integrar un reporte estatal de resultados tomando como base los proyectos y/o acciones desarrollados por el Programa de Empleo\nTemporal que indiquen el número de beneficiarios atendidos al finalizar el ejercicio fiscal.\n18. Seguimiento, control y auditoría\n18.1. Seguimiento\nLa Secretaría de Desarrollo Social, en operación del Programa de Empleo Temporal y para la mejora de éste, integrará informes a través de la Dirección General de Desarrollo Comunitario y además llevará cabo el seguimiento a los recursos asignados al programa.\n18.2. Control y auditoría\nLa Secretaría de Desarrollo Social, será responsable de la supervisión directa de las obras, proyectos o acciones así como de verificar que en su ejecución cumpla con la normatividad aplicable.\nSu ejercicio estará sujeto a las disposiciones estatales aplicables y podrán ser auditados por las instancias de fiscalización.\nLa Secretaría de Desarrollo Social, dará todas las facilidades a dichas instancias fiscalizadoras para realizar en el momento en que lo juzguen pertinente, las auditorías, revisiones o visitas de inspección que consideren; efectuando las acciones necesarias para dar atención a las recomendaciones planteadas.\n19. Transparencia\n19.1. Difusión\nLas reglas de operación, además de su publicación en el Periódico Oficial del Gobierno del Estado de Guerrero, estarán disponibles en la página electrónica de la Secretaría de Desarrollo Social, acciones conducentes para dar a conocer los requisitos de participación, la corresponsabilidad de los beneficiarios y los apoyos a otorgar.\nEn coordinación con los municipios, éstos serán los encargados de realizar la promoción y difusión del Programa de Empleo Temporal dando a conocer las acciones a realizar.\nInformación Pública del Estado de Guerrero, la Secretaría de Desarrollo Social publicará periódicamente\n19.2. Contraloría social\nCon la finalidad de incrementar la participación ciudadana para cada uno de los proyectos y/o acciones se instalarán Comités de Contraloría Social, los cuales fungirán como un órgano ciudadano de control, vigilancia y evaluación de las actividades del programa, conformado por los beneficiarios y alguna autoridad local, quienes de manera específica supervisarán la gestión gubernamental y que el manejo de los recursos públicos se realicen en términos de eficiencia, eficacia, oportunidad, equidad, transparencia, legalidad y honradez.\nEl Comité de Contraloría Social, deberá vigilar y dar seguimiento al proyecto y/o acciones a través de los formatos que componen el expediente comunitario, integrado por:\na) Acta de conformación del Comité.\nb) Reunión con beneficiarias y beneficiarios.\nc) Ficha informativa del programa.\nd) Cédula de vigilancia del programa.\ne) Acta de difusión y capacitación.\nf) Quejas, denuncias o reclamos.\nEl Comité se conforma con la representación de la comunidad beneficiada, mismos que fungirán como interlocutores con la Secretaría de Desarrollo Social, en el ejercicio de Contraloría Social.\nEl Comité debe estar constituido por un Presidente, un Secretario y un Vocal mínimamente, electos dentro de la población beneficiada, en donde se va a llevar a cabo la entrega del programa y tendrá que ser vigilado, dicho Comité deberá revisar los avances y resultados del programa, así como la detección de cualquier presunta irregularidad.\nDesarrollo Social, quien dará respuesta en un plazo no mayor de 15 días hábiles a partir de la fecha de recepción de la misma.\n19.3. Confrontas\nPara efectos de confrontas entre los programas que ejecuta esta Secretaría y otras dependencias, estas deberán realizarse a través del padrón único de beneficiarios conforme a los lineamientos normativos.\n19.4. Acciones de blindaje electoral\nLa Secretaría de Desarrollo Social, para la operación y ejecución de los recursos estatales que opera el programa, deberá observar y atender las medidas que emita la Secretaría de Contraloría y de Guerrero (ITAIG), el Instituto Electoral y de Participación Ciudadana del Estado de Guerrero (IEPC) y las demás autoridades competentes con la finalidad de impedir que los apoyos sean utilizados con fines políticos electorales.\nLa papelería, documentación oficial, así como la publicidad y promoción de este programa deberán incluir la siguiente leyenda \"Este programa es de carácter público, no es patrocinado ni promovido por partido político alguno y sus recursos provienen de los impuestos que pagan todos los contribuyentes. Está prohibido el uso de este programa con fines políticos, electorales, de lucro y otros distintos a los establecidos. Quien haga uso indebido de los recursos de este programa deberá ser denunciado y sancionado de acuerdo con la ley aplicable y ante la autoridad competente\".\nEn cuanto a la publicidad en medios electrónicos, impresos, complementarios o de cualquier otra índole vinculada con los programas de comunicación social, se deberá incluir la leyenda \"Este programa es público y queda prohibido su uso con fines partidistas o de promoción personal\".\n20. Perspectiva de género\nEn el ámbito de su competencia, el Programa de Empleo Temporal incorporará la perspectiva de género, para lo cual podrá identificar las circunstancias que profundizan las brechas de desigualdad manifiesta en la distribución de recursos, acceso a oportunidades y ejercicio de la ciudadanía entre otros, que genera discriminación y violencia, en particular hacia las mujeres a fin de determinar los mecanismos que incidan en su reducción o eliminación y potenciar la igualdad sustantiva entre mujeres y hombres para alcanzar un desarrollo pleno y garantizar la vigencia, reconocimiento y el ejercicio de sus derechos humanos.\n21. Quejas, denuncias y solicitud de información\n21.1. Quejas y denuncias oficinas de la Secretaría de Desarrollo Social sobre cualquier hecho, acto u omisión que produzca o pueda disposiciones y demás normatividad aplicable.\nEdificio Norte, Planta Baja, Palacio de Gobierno, Boulevard René Juárez Cisneros número 62, Chilpancingo, Guerrero, C.P. 39074.\nEl denunciante o quejoso deberá proporcionar:\na) Nombre del servidor público;\nb) Objeto de la denuncia;\nc) Nombre y domicilio del quejoso e;\nd) Identificación oficial.\n22. Glosario de términos\nBeneficiario: Mujer u hombre de 18 años de edad o más que recibe los apoyos del programa por haber cumplido con su responsabilidad, así como con los requisitos y criterios de elegibilidad establecidos en estas reglas.\nCONEVAL: Consejo Nacional de Evaluación de la Política de Desarrollo Social.\nCorresponsabilidad: Se refiere a la ejecución por parte de los beneficiarios de las actividades que les corresponde de acuerdo a los proyectos o acciones que les fueron aprobados.\nCURP: Clave Única de Registro de Población.\nDisponibilidad presupuestal: Recurso destinado al programa.\nPET: Programa de Empleo Temporal.\nPresupuesto: El contenido en el Decreto número 170 de Presupuesto de Egresos del Gobierno del Estado para el Ejercicio Fiscal 2016.\nRubros de atención: Son ámbitos de acción determinados por cada dependencia de acuerdo a sus atribuciones y competencias.\nSolicitante: Persona que pide participar en el programa de manera formal.\n23. Anexos\nAnexo 1. Solicitud de apoyo.\nAnexo 2. Acta del Comité de Contraloría Social.\nAnexo 3. Lista de Raya.\nAnexo 4. Acta de Entrega-recepción de los trabajos del proyecto, obra o acción.\nAnexo 5. Cuestionario único.\nAnexo 6. Acta de Asamblea Comunitaria.\nAnexo 7. Lista de reuniones de Asamblea.\nAnexo 8. Convocatoria.\nPrimero. El presente Acuerdo entrará en vigor el día siguiente de su publicación en el Periódico\nOficial del Gobierno del Estado de Guerrero.\nSegundo. Quedan abrogadas las Reglas de Operación del Programa de Empleo Temporal, publicadas en el Periódico Oficial del Estado de Guerrero número 57 del día 18 de julio del año 2014.\nTercero. A partir de la entrada en vigor de las presentes Reglas de Operación, la unidad responsable de la operación de las mismas será la Dirección General de Desarrollo Comunitario de la\nSecretaría de Desarrollo Social.\nCuarto. En un plazo de sesenta días, se emitirán los Lineamientos del Comité Técnico.\nQuinto. Se faculta a la titular de la Secretaria de Desarrollo Social del Gobierno del Estado de\nGuerrero, para expedir las Reglas de Operación del Programa Empleo Temporal en los siguientes\nEjercicios Fiscales.\nDado en la Oficina del titular del Poder Ejecutivo, ubicada en el Edificio Centro de Palacio de\nGobierno, Boulevard René Juárez Cisneros No. 62 ciudad de los Servicios en la Ciudad de Chilpancingo de los Bravo, Capital del Estado de Guerrero, a los 29 días del mes de enero del año dos mil quince.\nEL GOBERNADOR CONSTITUCIONAL DEL ESTADO DE GUERRERO.\nEL SECRETARIO GENERAL DE GOBIERNO.\nLIC. HÉCTOR ANTONIO ASTUDILLO FLORES.\nRúbrica.\nEL SECRETARIO GENERAL DE GOBIERNO\nLIC. FLORENCIO SALAZAR ADAME.\nRúbrica.\nLA SECRETARIA DE DESARROLLO SOCIAL.\nLIC. ALICIA ELIZABETH ZAMORA VILLALVA.\nRúbrica.",
  "ordenamiento": "PROGRAMA",
  "jurisdiccion": "GUERRERO",
  "fuente_oficial": "DIARIO OFICIAL DE LA FEDERACION",
  "Fecha de Publicación": "15 \nde Julio de 2016",
  "ULTIMA REFORMA PUBLICADA": null,
  "status": "VIGENTE",
  "es_escaneado": false,
  "tiene_tablas": true,
  "materia": [
    "laboral"
  ]
}