{
  "titulo": "Acuerdo por el Que Se Crea el Proyecto Instalación de Tiendas de Abarrotes para la Población Vulnera",
  "Contenido": "DE OPERACIÓN PARA EL EJERCICIO FISCAL 2021\nTEXTO ORIGINAL.\nPARA LA POBLACIÓN VULNERABLE, Y SE EMITEN SUS REGLAS DE OPERACIÓN PARA EL\nEJERCICIO FISCAL 2021.\nLIC. JOSÉ FRANCISCO SOLÍS SOLÍS, DIRECTOR GENERAL DEL SISTEMA PARA EL DESARROLLO\nINTEGRAL DE LA FAMILIA DEL ESTADO DE GUERRERO, EL CUAL ES UN ORGANISMO PÚBLICO\nDESCENTRALIZADO, CON PERSONALIDAD JURÍDICA Y PATRIMONIO PROPIO CREADO\nMEDIANTE LEY 107 PUBLICADA EN EL PERIÓDICO OFICIAL NÚMERO 10 DEL GOBIERNO DEL\nESTADO CON FECHA 9 DE MARZO DE 1977 Y REGULADO POR LA LEY 479 PUBLICADA EN EL\nPERIÓDICO OFICIAL NÚMERO 61 DEL 02 DE AGOSTO DE 1983, CON FUNDAMENTO EN LA LEY LA\nLEY 690 DE ENTIDADES PARA ESTATALES PARA EL ESTADO DE GUERRERO; EL ARTÍCULO 27\nFRACCIÓN X DEL REGLAMENTO INTERIOR DEL ORGANISMO PÚBLICO DESCENTRALIZADO; 167\nDE LA LEY GENERAL DE SALUD; 3 DE LA LEY DE ASISTENCIA SOCIAL; 4 FRACCIÓN XVIII DEL\nPRESUPUESTO DE EGRESOS DE LA FEDERACIÓN PARA EL EJERCICIO FISCAL 2021; 40 DE LA\nLEY DE COORDINACIÓN FISCAL; 71, 87, 88, 15 DE LA LEY SOBRE EL SISTEMA ESTATAL DE\nASISTENCIA SOCIAL NÚMERO 332 ARTICULO 4, FRACCIONES I A LA XV; ARTICULO II BIS,\nFRACCIÓN I AL IV Y ARTÍCULO 11 TER, ÚLTIMA REFORMA PUBLICADA EN EL PERIÓDICO OFICIAL\nDEL GOBIERNO DEL ESTADO NÚMERO 15 DE FECHA 20 DE FEBRERO DEL 2015; EN RELACIÓN\nCON EL ARTÍCULO 55 Y ANEXOS 21 Y 21-A DEL DECRETO NÚMERO 644 DEL PRESUPUESTO DE\nEGRESOS DEL ESTADO DE GUERRERO PARA EL EJERCICIO FISCAL 2021; Y LOS LINEAMIENTOS\nPARA LA ELABORACIÓN DE LAS REGLAS DE OPERACIÓN DE LOS PROGRAMAS SOCIALES\nESTATALES PARA EL EJERCICIO FISCAL 2017.\nCONSIDERANDO\nEn el Plan Estatal de Desarrollo 2016-2021 impulsa, un Guerrero que garantice el ejercicio efectivo de los derechos sociales de todos los guerrerenses, que vaya más allá del asistencialismo y que conecte al capital humano con las oportunidades que genera la economía, en el marco de una nueva productividad social que disminuya las brechas de desigualdad y promueva la más amplia participación social en las políticas públicas.\nLa Constitución Política de los Estado Unidos Mexicanos establece en su artículo 4o que la mujer y el hombre son iguales ante la ley. Esta protegerá la organización y el desarrollo de la familia. menos asistencialistas y más estructurales para garantizar el desarrollo de quienes menos tienen, a través profundos en este sector. Uno de los ejes que respaldan esta visión y se encuentra en el Plan Estatal de\nDesarrollo 2016-2021 es, el eje III.- Guerrero Socialmente Comprometido. Objetivo 3.7. Fortalecer la\nDE OPERACIÓN PARA EL EJERCICIO FISCAL 2021 asistencia social a grupos vulnerables; implementando la Estrategia 3.7.1. Atender integralmente a los calidad de vida.\nLa Ley Número 479 del Sistema para el Desarrollo Integral de la Familia del Estado de Guerrero publicada en el Periódico Oficial del Gobierno del Estado número 61 del 02 de agosto de 1983, creó el\nSistema Estatal para el Desarrollo Integral de la Familia, como un organismo público descentralizado, el cual tiene por objeto I.- Promover el bienestar social y prestar al efecto servicios de asistencia social con apoyo en las normas que dicte la Secretaría de Salubridad y Asistencia y el Sistema Nacional para el\nDesarrollo Integral de la Familia, así como el propio Estado; II.- Apoyar el desarrollo de la familia y de la comunidad; III.- Fomentar la educación, para la integración social; IV.- Impulsar el sano crecimiento físico y mental de la niñez; 2 V.- Atender las funciones de auxilio a las instituciones de asistencia privada que le confíe la dependencia competente, con sujeción a lo que disponga la Ley relativa; VI.- Operar establecimientos de asistencia social en beneficio de menores en estado de abandono, de ancianos y de los minusválidos; VII.- Realizar estudios e investigaciones sobre los problemas de la familia, de los menores, de los ancianos y de los minusválidos; VIII.- Prestar servicios de asistencia jurídica y de orientación social de los menores, ancianos y minusválidos sin recursos; IX.- Intervenir en el ejercicio de la tutela de los menores, que corresponda al Estado, en los términos de la Ley respectiva; X.- Auxiliar al\nMinisterio Público en la protección de incapaces y de los procedimientos civiles y familiares que les afecten, de acuerdo con la Ley; XI.- Procurar permanentemente la adecuación de los objetivos y programas del sistema estatal, a los que lleve a cabo el sistema nacional, a través de decretos, acuerdos, convenios o cualquier figura jurídica encaminada a la obtención de bienestar social, y, XII.- Los demás que les encomienden las Leyes.\nLas personas titulares de las secretarías, dependencias y entidades de la administración pública estatal, así como, las servidoras y servidores públicos autorizados para ejercer recursos públicos del presupuesto de inversión de estas, serán responsables de los programas y proyectos de inversión que realicen. Que los apoyos otorgados deberán sujetarse a criterios de objetividad, equidad, transparencia, publicidad, selectividad y temporalidad.\nEl Presupuesto de Egresos de la Federación para el Ejercicio Fiscal 2021, contempla en un apartado que las erogaciones para el Ramo General 33 Aportaciones Federales para Entidades\nFederativas y Municipios, serán distribuidos conforme a lo previsto en el Anexo 28 de este Decreto, el cual se precisa en el Fondo de Aportaciones Múltiples erogaciones para asistencia social.\nEl artículo 55 del Decreto Número 644 de Presupuesto de Egresos del Estado de Guerrero, para el Ejercicio Fiscal 2021, establece y con el objeto de asegurar la aplicación eficiente, eficaz, oportuna inversión sujetos a reglas de operación.\nCon sustento en lo anterior, la Secretaría de Planeación y Desarrollo Regional, expidió los\nDE OPERACIÓN PARA EL EJERCICIO FISCAL 2021 la Población Vulnerable, deberán desarrollarse de manera eficaz y oportuna a fin de consolidar la política oportunidades que les permitan desarrollarse con independencia y plenitud, es por ello que surge este proyecto con el propósito de mitigar los impactos económicos sociales por las que atraviesan las personas que habiten en zonas rurales, mediante la entrega de proyectos productivos y de servicios.\nEn el Decreto Número 644 del Presupuesto de Egresos del Estado de Guerrero para el Ejercicio\nFiscal 2021 señala que se ejercerán los recursos bajo una política de gasto público, que permita dar cumplimiento a lo que globalmente prevén los ejes rectores del Plan estatal de Desarrollo 2016-2021.\nEn cumplimiento de lo anterior, se ha tenido a bien expedir el siguiente:\nACUERDO POR EL QUE SE CREA EL PROYECTO INSTALACIÓN DE TIENDAS DE\nABARROTES PARA LA POBLACIÓN VULNERABLE, Y SE EMITEN SUS REGLAS DE OPERACIÓN\nPARA EL EJERCICIO FISCAL 2021.\nArtículo 1. Se crea el Proyecto Instalación de Tiendas de Abarrotes para la Población Vulnerable, el cual tiene por objeto contribuir a disminuir la desigualdad social entré los guerrerenses, respondiendo de manera cabal a sus expectativas de cambio; articuladora de esfuerzos, incluyente, con rostro humano.\nArtículo 2. Se emiten las Reglas de Operación del Proyecto Instalación de Tiendas de Abarrotes para la Población Vulnerable, en los que se establecen los principios de eficiencia, eficacia, oportunidad, equitativa y transparencia de los recursos públicos y requisitos que se deben de cumplir para poder acceder ha dicho Proyecto.\nEn las Reglas de Operación se establecen disposiciones que instituyen la ejecución del Proyecto\nInstalación de Tiendas de Abarrotes para la Población Vulnerable, con el objeto de otorgar transparencia y asegurar la aplicación, eficiente, eficaz, oportuno y equitativo de los recursos públicos asignados al mismo, los cuales deberán publicarse en el Periódico Oficial del Gobierno del Estado de Guerrero.\nArtículo 3. El Sistema para el Desarrollo Integral de la Familia del Estado de Guerrero tendrá a cargo la implementación, ejecución, evaluación y administración del Proyecto Instalación de Tiendas de\nAbarrotes para la Población Vulnerable, bajo los criterios de objetividad, equidad, transparencia, publicidad, selectividad y temporalidad, con estricto apego a la normatividad aplicable, por lo tanto será el encargado de la dispersión y asignación de los recursos del Proyecto apegándose plenamente a las siguientes:\nPARA LA POBLACIÓN VULNERABLE PARA EL EJERCICIO FISCAL 2021.\n1. Introducción.\n1.1. Antecedentes.\nDE OPERACIÓN PARA EL EJERCICIO FISCAL 2021\nEl DIF Guerrero, a través de la Dirección de Asistencia Alimentaría y Desarrollo Comunitario, social, y tiene como Intención apoyar y coordinar las acciones de desarrollo comunitario en las que participan los tres niveles de gobierno (Federal, Estatal y Municipal) dentro del ámbito de su competencia.\nEn este documento se sustenta la intervención institucional que desde el ejercicio 2013 ha venido atendiendo a población en situaciones de vulnerabilidad, así mismo, se especifica la participación básica de llevar a cabo entre los Sistemas Municipales DIF, con el objetivo de realizar proyectos en coordinación, como es el de Instalación de Tiendas de Abarrotes para la Población Vulnerable, focalizando la atención a aquellas familias en estado de vulnerabilidad social que habiten en localidades de alto y muy alto grado de marginación el cual tiene como propósito fomentar el autoempleo y consumo como un elemento clave para que, las familias que viven en condiciones de desventaja socioeconómica mejoren sus niveles de vida, con la Pandemia del SARS-COV 2 que se vive a nivel mundial este proyecto dará prioridad a los municipios costeros con vocación turística y ecoturistica del Estado.\nEn consecuencia, la formulación de un programa y/o proyecto de desarrollo social exige conjugar armónicamente todos los elementos que lleven a la materialización de sus objetivos, estrategias, metas y evaluación de resultados. Por ello, el proyecto Instalación de Tiendas de Abarrotes para la Población\nVulnerable, es un proyecto social que permitirá disminuir el impacto del desempleo temporal, como una de las alternativas para enfrentar dicho fenómeno y brindará a los hogares mitigar los impactos económicos sociales, mismo que tiene su origen en la Constitución Política de los Estados Unidos Mexicanos, Oficial del Gobierno del Estado número 71, alcance I de fecha 04 de septiembre de 2018, Ley General de\nSalud y Ley de Asistencia Social, por lo que busca contribuir al gasto de las familias que habitan en los municipios y localidades de alta y muy alta marginación, por lo que se atenderán a 80 familias, para que tengan un negocio propio, así como crear fuentes de empleo y autoempleo que coadyuven en su ingreso familiar, como precedente de sustentabilidad labora atendiéndose a los 81 municipios que integran el\nEstado, dando prioridad a los municipios de alta y muy alta marginación.\nPara lo cual se gestionará ante las instancias de Gobierno federales y estatales, los recursos financieros, para llevar a cabo la adquisición de los materiales, insumos y productos necesarios en la operatividad del Proyecto; así mismo se dará a conocer al Sistema Municipal DIF, las Reglas de Operación vigentes proporcionándose de forma calendarizada los suministros de los apoyos, para la operación y\nEstado de Guerrero, a través de la Dirección de Asistencia Alimentaria y Desarrollo Comunitario, quien se\nInstalación de Tiendas de Abarrotes para la Población Vulnerable. El cual tiene contemplado una inversión de $2,740,000.00 (Dos millones setecientos cuarenta pesos 00/100 M.N.), recursos presupuestales que provienen del Ramo 33.- Aportaciones Federales para Entidades Federativas y Municipios, específicamente del Fondo de Aportaciones Múltiples (Asistencia Social).\nPara un mejor entendimiento se integra el glosario de términos:\nDE OPERACIÓN PARA EL EJERCICIO FISCAL 2021\nAsistencia Social: Conjunto de acciones tendientes a modificar y mejorar las circunstancias de carácter social que impiden el desarrollo social del individuo, así como la protección física, mental y social de personas en estado de necesidad.\nDIF Guerrero: Sistema para el Desarrollo Integral de la Familia.\nGrupos Vulnerables: Persona o grupo que por sus características de desventaja por edad, sexo, estado civil; nivel educativo, origen étnico, situación o condición física y/o mental; requieren de un esfuerzo adicional para incorporarse al desarrollo y a la convivencia.\nProyecto: Proyecto Instalación de Tiendas de Abarrotes para la Población Vulnerable.\nReglas de Operación: Reglas de Operación del Proyecto de Paquetes de Instalación de Tiendas de Abarrotes para Población Vulnerable.\nSecretaría de Contraloría: Secretaría de Contraloría y Transparencia Gubernamental.\nSEDIF: Sistema para el Desarrollo Integral de la Familia.\nSEFINA: Secretaría de Finanzas y Administración.\nSEPLADER: Secretaría de Planeación y Desarrollo Regional.\n1.2. Alineación programática.\nEn cumplimiento a lo que globalmente prevén los ejes rectores del Plan Estatal de Desarrollo 20162021, este programa se alinea en el eje III.- Guerrero Socialmente Comprometido; Objetivos: 3.1. Construir un Estado Garante de los Derechos Sociales de las Personas, 3.2. Edificar la ruta hacia una sociedad equitativa e incluyente y Estrategias: 3.1.2. Fortalecer el desarrollo de capacidades de los integrantes de una sociedad con carencias, que permitan contribuir a incrementar su capacidad productiva y su calidad de vida y 3.2.1. Generar programas de desarrollo comunitario por medio de procesos de participación social; a través de Fomentar el acceso efectivo de las familias a sus derechos sociales, particularmente de aquellas en pobreza extrema, mediante políticas públicas coordinadas y concurrentes potenciar la inversión conjunta de la sociedad organizada y de los órdenes de Gobierno, invirtiendo en proyectos de infraestructura social básica, complementaria y productiva.\nLas presentes Reglas se alinean a lo estipulado en el Programa Sectorial “Desarrollo y Asistencia\nSocial” 2016-2021, cuyo objetivo es atender a personas vulnerables, a través de desarrollar capacidades su calidad de vida y sus núcleos familiares, logrando fortalecer el tejido social en localidades vulnerables.\n1.3. Diagnostico.\nDE OPERACIÓN PARA EL EJERCICIO FISCAL 2021 localidades a lo largo de todo el país, provoca que la inestabilidad del empleo sea considerada como uno de los principales motivos de preocupación dentro de los hogares mexicanos; que la pérdida del empleo y la pobreza de los hogares, fundamentalmente porque la falta de empleo conduce a una importante disminución del capital económico familiar, mayor presión sobre los recursos naturales, así como el abandono de la educación y el fomento al endeudamiento, estas afectaciones frecuentemente persisten aun cuando sus miembros se reintegran a las actividades productivas y remuneradas.\nQue la oferta laboral puede disminuir en algunas regiones del Estado a lo largo del año debido a emergencias o por efecto de los ciclos productivos, afectando principalmente a la población de escasos recursos que enfrenta periódicamente etapas con una grave disminución en sus ingresos y patrimonio.\nPor ello las políticas de empleo estatal deben considerar además del fomento a la creación de empleos formales e informales, la ejecución de acciones que permitan disminuir el impacto del desempleo temporal; una de las alternativas para enfrentar dicho fenómeno es la implementación del Programas y/o\nProyectos que brinden a los hogares el auto emplearse y/o generar empleo que mitiguen los impactos económicos sociales que viven; el diseño del Programa Instalación de Tiendas de Abarrotes para la\nPoblación Vulnerable implica que la población beneficiada debe participar en proyectos de beneficio familiar o comunitario como corresponsabilidad obligatoria para recibir los apoyos que se les otorgue; dicho requisito no solamente promueve la participación activa de los ciudadanos en el desarrollo de sus hogares y comunidades, sino que además genera beneficios adicionales al resto de la sociedad.\nDentro de los objetivos y estrategias que plantea el Ejecutivo Estatal, es el abatir la marginación y el rezago social que enfrentan los grupos sociales vulnerables para proveerles de igualdad en las oportunidades que les permitan desarrollarse con independencia y plenitud; asimismo, plantea elevar la productividad de las personas para que cuenten con mejores opciones de empleo e ingreso, que les permitan reducir sus niveles de pobreza.\nEl trabajo informal en países de economía subdesarrollada como México, está altamente asociada con el autoempleo, La carencia de plazas laborales que brinden una mayor seguridad salarial y mejores condiciones de trabajo orilla a casi el 60% de los buscadores de empleo a resolver por sí mismos su condición de desempleados y generalmente lo logran mediante pequeñas inversiones en el sector comercio y de servicios.\nEn el estado existen 895, 157 hogares de los cuales 293 086 están conformadas por Jefas de\nFamilias que es un 33% y 602 071, se conforman por Jefes de Familia que en términos porcentuales le corresponde el 67%. Para el presente ejercicio fiscal el Sistema para el Desarrollo Integral de la Familia beneficiará a 80 familias en estado de vulnerabilidad que habiten en Municipios o Localidades con alto o muy alto grado de marginación, considerando la suficiencia presupuestal para el ejercicio vigente y los criterios de focalización y priorización del proyecto, el cual propone, beneficiar a las familias de los municipios y/o localidades costeras con vocación turística y ecoturistica que por la Pandemia del SARSCOV2 a nivel mundial, Nacional y Estatal, están siendo afectados severamente y dar utilidad de estos\nDE OPERACIÓN PARA EL EJERCICIO FISCAL 2021 alternativa más, tanto de ocupación como de alimentación, proporcionando el proyecto Instalación de\nTiendas de Abarrotes para la Población Vulnerable, y sea generador de empleo y / o autoempleo e ingresos a través de la prestación de un servicio el cual busca contribuir a el fortalecimiento de la economía familiar, mismo que ha beneficiado a un total de 254 familias en lo que va de este sexenio. A continuación, se detalla el número de familias beneficiadas durante el periodo de 20162020, de acuerdo con el cuadro que se desglosa a continuación.\nAÑO BENEFICIARIOS\n2016 50\n2017 42\n2018 42\n2019 40\n2020 80\n2. Dependencia o entidad responsable del programa.\nLa instancia ejecutora será el sistema para el Desarrollo Integral de la Familia, a través de la Dirección de\nAsistencia y Desarrollo Comunitario quien se coordinará con los Sistemas Municipales DIF para llevar a cabo la ejecución y seguimiento el cual, tiene como fundamento legal los ordenamientos jurídicos siguientes:\n• Constitución Política de los Estados Unidos Mexicanos.\n• Ley General de Salud.\n• Ley de Asistencia Social.\n• Ley General para la Inclusión de las Personas con discapacidad.\n• Ley Número 817 para las Personas con Discapacidad del Estado.\n• Ley Número 479 del Sistema para el Desarrollo Integral de la Familia del Estado de Guerrero.\n• Ley Número 454 de Presupuesto y Disciplina Fiscal del Estado de Guerrero.\n• Ley Orgánica de la Administración Pública del Estado de Guerrero 08.\n• Ley Número 207 de Transparencia y Acceso a la Información Pública del Estado.\n• Ley 494 para la Igualdad entre Mujeres y Hombres del Estado de Guerrero.\n• Ley sobre el Sistema Estatal de Asistencia Social Número 332.\n2021.\n• Programa Sectorial Desarrollo y Asistencia Social 2016-2021.\n• Decreto Número 644 del Presupuesto de Egresos del Estado de Guerrero para el Ejercicio Fiscal\n2021.\n• Estrategia Local “Guerrero Contigo”.\n•  Reglamento Interior del Sistema para el Desarrollo Integral de la Familia del Estado de Guerrero.\nDE OPERACIÓN PARA EL EJERCICIO FISCAL 2021\n• Manual de Organización del DIF Guerrero.\n• Y todos aquellos ordenamientos normativos aplicables.\n3. Objetivos y alcances.\n3.1. General.\nContribuir al gasto familiar de la población que vive en condiciones de pobreza y / o que no cuente con empleo a través de la Instalación de Tiendas de Abarrotes para la Población Vulnerable, para que tengan un negocio propio, así como crear fuentes de empleo y autoempleo que coadyuven en su ingreso familiar a 80 familias.\n3.2. Específicos.\n• Generar una alternativa de autoempleo como precedente de sustentabilidad laboral.\n• Incrementar el ingreso familiar.\n• Brindar un servicio básico.\n3.3. Alcances.\nLa operación y ejecución del proyecto Instalación de Tiendas de Abarrotes para la Población Vulnerable surge para mitigar y garantizar el empleo y/o autoempleo de las familias que atraviesan por esta situación atendiendo a su derecho al trabajo y a la alimentación a través de la Instalación de 80 Tiendas de Abarrotes, mejorando su economía familiar y comunitaria.\nLa población objetivo la constituyen las familias que habiten en Municipios o Localidades con alto o muy alto grado de marginación, sin embargo por la situación que se vive por la Pandemia se dará prioridad a los municipios y/o localidades costeras con vocación turística y ecoturistica considerando la suficiencia presupuestal para el presente ejercicio y los criterios de focalización y priorización.\n4. Metas físicas.\nSe tiene programado beneficiar aproximadamente a 80 familias que habiten en municipios y / o\nLocalidades de alta y muy alta marginación con vulnerabilidad social, dando prioridad a los municipios y/o beneficiada en puntos sedes ubicados en su Municipio correspondiente.\n5. Programación presupuestal\nEn el Decreto número 644 del Presupuesto de Egresos del Estado de Guerrero para el Ejercicio Fiscal\n2021, señala que se ejercerán los recursos bajo una política de gasto público, que permita dar cumplimiento a lo que globalmente prevén los ejes rectores del Plan Estatal de Desarrollo 2016-2021.\nDE OPERACIÓN PARA EL EJERCICIO FISCAL 2021 recursos presupuestales provenientes del Ramo 33.- Aportaciones Federales para Entidades Federativas y Municipios, específicamente del Fondo de Aportaciones Múltiples (Asistencia Social), el cual tiene una inversión de $ 2´740,000.00 (Dos millones setecientos cuarenta mil pesos 00/100 M.N.), el cual tiene un costo promedio de la población beneficiada de $ 34,250.00 (Treinta y cuatro mil doscientos cincuenta pesos\n00/100 M.N.).\nCRONOGRAMA FINANCIERO\nENERO FEBRER MARZO ABRIL MAYO\n2,740,000.00 0.00 0.00 0.00 0.00\nNOTA: PUEDE EXISTIR VARIACIÓN EN RELACION A LO APROBADO POR EL DOF. Y/O POR\nLAS NECESIDADES ROPIAS DEL SEDIF.\n6. Requisitos y procedimientos de acceso.\n6.1. Difusión.\nEl sistema para el Desarrollo Integral de la Familia a través de los diferentes medios de comunicación y de las redes sociales da conocer los diferentes programas y proyectos de asistencia social que ejecuta y opera en coordinación con las Direcciones que integran el Sistema; cuyos requisitos se encuentran en las oficinas ubicadas en Av. Rene Juárez Cisneros, Colonia Ciudad de los Servicios y en Av. Gabriel Leyva s/n esq.\nRuffo Figueroa, Col. Burócratas, C.P. 39090, Chilpancingo, Guerrero, con un horario de atención de 8:00 am a 3:00 pm y/o los teléfonos 01(747) 4725595, 01(747)47256 00, 01(747)47 25672 ext 1151 Y 1159. Así mismo al correo electrónico: alimentariadif@prodigy.net.mx, subdireccionalimentaria@prodigy.net.mx\nLas reglas de operación de los programas y/o proyectos son difundidas por personal capacitado de las\nDirecciones y en la página web del Portal del Gobierno del Estado, https://www.guerrero.gob.mx Se brinda atención a los 81 municipios del Estado, teniendo una capacidad de atención de niñas, niños y adolescentes, mujeres embarazadas, mujeres en periodo de lactancia, personas con discapacidad, adultos mayores y personas vulnerables por ingresos.\n6.2. Requisitos al acceso.\n1) Los interesados deberán presentar oficio de solicitud en las instalaciones del DIF Guerrero en escrito libre al Centro de Rehabilitación Integral Guerrero, con domicilio en Boulevard Lic. René Juárez Cisneros\nS/N, Col. Ciudad de los Servicios, Chilpancingo, dirigido a la presidenta o Director General del DIF para ser considerado dentro del Proyecto, anexando copia fotostática de la siguiente documentación:\n1. Credencial de elector.\n2. CURP.\n3. Comprobante de Domicilio.\n2) La solicitud es turnada a la Dirección de Asistencia\nDE OPERACIÓN PARA EL EJERCICIO FISCAL 2021\nAlimentaria y Desarrollo Comunitario para su atención, quien en un plazo no mayor a 60 días hábiles dará respuesta a la misma.\n3) La Dirección de Asistencia Alimentaria y Desarrollo Comunitario aplica estudio socioeconómico al solicitante para determinar si será beneficiario del proyecto.\n4) Se realiza la entrega del apoyo de manera personal o en el municipio beneficiado, solicitándole al beneficiario firme acta de donación que acredite la entrega.\n6.3. Procedimiento de acceso.\nLa operación de este, se realiza a través de la demanda ciudadana y / o peticiones que se reciben en las instalaciones del Sistema para el Desarrollo Integral de la Familia o directamente a la Presidenta del\nSistema Estatal, surge por la necesidad de atender el problema del desempleo y atendiendo la carencia alimentaria, el cual busca garantizar el derecho a la alimentación atendiéndose a los 81 municipios que conforman nuestro Estado, dando prioridad a los municipios de alta o muy alta marginación y municipios y/o Localidades con vocación turística y/o ecoturistica.\nSerán beneficiados, los solicitantes que cumplan con las siguientes características:\n1. personas con discapacidad, adultos mayores y personas vulnerables por ingresos.\n2. Habitar en Municipios o Localidades de alto o muy alto grado de marginación.\n3. Habitar en Municipios o Localidades costeras con vocación turística y/o ecoturistica.\nToda persona podrá conocer el estado de su trámite, y su aceptación o no de acuerdo con las reglas de operación vigentes.\nLa población beneficiada será tratada con respeto, dignidad, además:\n• Recibir la información necesaria de manera clara y oportuna para participar en el proyecto.\n• Un trato digno y respetuoso oportuno con calidad y equitativo sin discriminación alguna.\n• Reserva y privacidad de su información personal.\nUna vez que las personas solicitantes son incorporadas al proyecto formaran parte del Padrón de beneficiarios, el cual será de carácter público, siendo reservados sus datos personales, de acuerdo con la\nProyecto podrá ser a solicitud de la persona interesada, asimismo toda persona podrá conocer el estado de su trámite, y su aceptación o no.\n6.4. Requisitos de permanencia, causales de baja o suspensión temporal.\nPermanencia: Visita de seguimiento a los beneficiarios, con la finalidad de constatar la situación socioeconómica y seguimiento a las necesidades prioritarias, la población sujeta de atención deberá cumplir con:\n• Dar cumplimiento a las Reglas de Operación del Programa.\nDE OPERACIÓN PARA EL EJERCICIO FISCAL 2021\n• Utilizar los apoyos otorgados de manera adecuada y para los fines a los que se les otorgan y con que fueron autorizados evitando cualquier uso distinto de la misma, los cuales en ningún caso podrán emplearse para propósitos de proselitismo político, religioso o comercial, ni para ningún otro fin distinto al establecido en las Reglas de operación del programa social.\n• Permitir visita de verificación con la finalidad de validar la información proporcionada en sus expedientes correspondientes.\n• Facilitar los trabajos de supervisión, en cualquier momento después de haber recibido el apoyo.\nLa población beneficiada del proyecto instalación de tiendas de abarrotes para la población vulnerable, que incumplan en la Disposiciones Normativas de estas Reglas de Operación, perderán las prerrogativas establecidas en los numerales 6.2.y 6.3.\n6.5. Modos de entrega del beneficio.\nLos apoyos serán distribuidos directamente a la población beneficiada en puntos sedes de cada Región del Estado, o en su caso, podrán acudir a recoger en las oficinas de la Dirección de Asistencia Alimentaria y Desarrollo Comunitario, dicho apoyo consiste en:\n▪ caja de Huevo con 360 piezas.\n▪ 1 bulto de Azúcar estándar 50 kilo.\n▪ 1 bulto de Frijol negro a granel 50 kilos.\n▪ 1 bulto de Arroz a granel 50 kilos.\n▪ paquetes de Sal de mesa con 20 piezas, en Bolsa de 1 kg.\n▪ 2 cajas con 12 piezas de Aceite Vegetal Comestible de 945 ml.\n▪ 2 caja de Detergente en polvo de 500 grs. con 20 piezas.\n▪ 1 kg. Canela Estándar.\n▪ 1 caja con 24 pzas, de Sardina en salsa de Tomate lata de 425 grs.\n▪ 1 paquete de Cerillos de 50 cajitas\n▪ 1 caja de Jugo de frutas tetra pack de 1/4 con 27 pzas\n▪ 1 caja de Jugo de frutas tetra pack de 1/8 con 27 pzas\n▪ 3 cajas exhibidoras de café de olla\n▪ 2 caja de Jabón en barra de 350 grs. con 25 piezas\n▪ 1 bulto de Harina estándar de 50 kg.\n▪ 1 caja de Mayonesa No. 4 con 24 frascos.\n▪ 2 cajas de Pasta para sopa de sobre de 200 grs. con 20paquetes c/u\n▪ 1 caja de Galletas tipo \"Marías\" con 20 rollos c/u\n▪ 2 cajas de formula láctea tetra pack de 1 lt. con 12 litros c/u\n▪ 2 cajas de Galletas tipo \"Napolitanas\" con 20 rollos c/u\n▪ 1 caja Galletas tipo \"mexicanas\" con 20 rollo c/u\n▪ 1 colchón de Papel higiénico 12 paq c/4 rollos\n▪ 1 caja de blanqueador de 500 ml. Con 20 pzas. c/u\n▪ 2 caja de shampoo en sobre de 900 ml. Con 12 pzas. c/u\n▪ 2 cajas de chile jalapeño en rajas verdes en lata de 105 grs.\n▪ 2 cajas de suavizante de 850 ml. Con 12 pzas.\nDE OPERACIÓN PARA EL EJERCICIO FISCAL 2021\n▪ 2 cajas de limpiador fresco pinol de 500 ml. Con 20 pzas. c/u\n▪ 2caja de Jabón neutro de 180 grs.\n▪ 2 cajas de frascos de mermelada de fresa de 250 grs.\n▪ 2 cajas de lechera de 250 grs. con 24 pzas. c/u\n▪ 2 cajas de servilletas con paquetes de 100 pzas.\n▪ 2 cajas de café soluble regular de 50 grs.\n▪ 2 cajas de atún en aceite de 140 grs.\n▪ 2 cajas de nor suiza\n▪ 2 cajas de espagueti corto de 220 grs.\n▪ 3 cajas de crema dental de 75 ml.\n▪ 2 paquetes de cepillo dental de 35 pzas. c/u\n▪ 2 cajas de toallas femeninas\n▪ 2 cajas de chocolate de mesa de 360 grs.\n▪ 2 cajas de galletas napolitanas con 20 rollos c/u\n▪ 1 caja de galletas mexicanas con 20 rollos c/u\n▪ 1 colchón de papel higiénico en paquetes de 4 rollos /12\n▪ 1 bascula de 5 kg. digital\n▪ 3 anaqueles de 4 entrepaños\n7. Procedimientos de instrumentación.\n7.1. Operación.\nEl Sistema Estatal DIF tendrá las siguientes responsabilidades:\na) Gestionar ante las instancias de Gobierno Federales y Estatales, los recursos financieros, para llevar a cabo la adquisición de los materiales, insumos y productos necesarios en la operatividad de los programas y / o proyectos.\nb) Dar a conocer al Sistema Municipal DIF, Reglas de Operación del proyecto de Instalación de\nTiendas de Abarrotes para la Población Vulnerable, vigentes.\nc) Proporcionar al Sistema Municipal DIF, de forma calendarizada los suministros de productos del proyecto instalación de tiendas de abarrotes para la población vulnerable.\nd) Vigilar y verificar que los proyectos sean otorgados directamente a las y los beneficiarios.\ne) Proporcionará almacenes regionales, para guarda, custodia de los productos que integran los proyectos; que contaran con personal capacitado para su manejo y distribución.\nf) Actualizar y profesionalizar los conocimientos del personal operativo del Sistema Estatal DIF y del Sistema Municipal DIF, a través de capacitaciones a fin de contar con las herramientas básicas para la operatividad de los programas y / o proyectos.\ng) Recepcionar de los Sistema Municipal DIF la información requerida para comprobación de los programas y / o proyectos con base a las Reglas de Operación vigentes.\nh) Procesará la información a que se refiere el punto anterior y remitirla de acuerdo al calendario de entregas, a fin de comprobar los recursos canalizados al municipio.\nDE OPERACIÓN PARA EL EJERCICIO FISCAL 2021\ni) Elaborar a inicio de cada ejercicio fiscal, el Proyecto de los Programas y documentos que contemplarán la aplicación y operatividad con los importes correspondientes.\nSerán obligaciones del Sistema Municipal DIF las siguientes: a. El Sistema Municipal DIF se obliga a cumplir con la implementación de los Proyectos productivos que se tienen establecidos en la Subdirección de Desarrollo Comunitario y en las reglas de operación que regula el programa; salvo la pena de incurrir en responsabilidades administrativas. b. Determinará de manera conjunta la población potencial de su municipio tomando en consideración el tipo de beneficiario de todos los programas a solicitar, con esta información y en coordinación con el Sistema Estatal DIF, atenderá a la población que se encuentre en situación de vulnerabilidad de localidades de alta y muy alta marginación. c. Integrará y enviará los expedientes, así como los padrones físicos de las y los beneficiarios de los Programas y / o Proyectos solicitados a la Subdirección de Desarrollo Comunitario, de igual forma informará a los beneficiarios que los datos personales recabados serán protegidos en términos de los principios de protección de datos personales contenidos en la ley de la materia y demás normativas aplicables. d. Integrará los padrones de los beneficiarios y / o beneficiarias con sus respectivos expedientes de los programas y / o proyectos objeto de estas Reglas. Remitiendo al Sistema Estatal DIF el padrón físico y en digital, así como los expedientes correspondientes y comprobación de estos. e. Designar personal del Sistema Municipal DIF que realice las funciones de seguimiento y supervisión de los Programas y / o Proyecto. f. Participar en acciones de apoyo logístico para la distribución de los programas y / o Proyecto. g. Es competencia del Sistema Municipal DIF, trasladar los materiales que corresponden a los programas, a las comunidades beneficiadas, en una unidad vehicular. Será responsabilidad del municipio el resguardo y el buen uso de los materiales que se recepcionen, en el entendido que, de existir algún desvío de estos, el Sistema Estatal DIF cancelará inmediatamente el suministro del programa y / o Proyecto e iniciará un procedimiento ante la contraloría interna del sistema estatal, para determinar las sanciones a que sean acreedores.\nPara garantizar la atención completa del beneficiario, se realizan las acciones:\n• Determinar el tipo de proyectos a implementar\n• Adquisición de los materiales y que cumplan con las Especificaciones Técnicas de Calidad.\n• Asegurar el correcto almacenamiento y distribución de los materiales, hasta su entrega al beneficiario.\n• Focalizar los beneficiarios de los Programas con base a los indicadores socioeconómicos.\n• Coordinar la entrega de apoyos a la población beneficiada con los Sistemas Municipales DIF, a través de convenios de colaboración y conforme a lo establecido en las Reglas de Operación.\n• Promover la participación social a través de los Sistema Municipal DIF en la formación de comités entre la población beneficiaria, para la recepción, entrega y vigilancia de los apoyos.\n• Promover la formación y operación de grupos de contraloría social para el seguimiento del proyecto.\n• Fortalecer la operación de los programas y / o proyectos promoviendo la inclusión general de la sociedad.\nDE OPERACIÓN PARA EL EJERCICIO FISCAL 2021\nLos datos de la población beneficiada, así como la información generada y administrada se regirán\nAsí mismo el proyecto, contempla las herramientas necesarias para desempeñar el autoempleo, mejorando su economía familiar y comunitaria a través de: caja de Huevo con 360 piezas.\n▪ 1 bulto de Azúcar estándar 50 kilo.\n▪ 1 bulto de Frijol negro a granel 50 kilos.\n▪ 1 bulto de Arroz a granel 50 kilos.\n▪ paquetes de Sal de mesa con 20 piezas, en Bolsa de 1 kg.\n▪ 2 cajas con 12 piezas de Aceite Vegetal Comestible de 945 ml.\n▪ 2 caja de Detergente en polvo de 500 grs. con 20 piezas.\n▪ 1 kg. Canela Estándar.\n▪ 1 caja con 24 pzas, de Sardina en salsa de Tomate lata de 425 grs.\n▪ 1 paquete de Cerillos de 50 cajitas\n▪ 1 caja de Jugo de frutas tetra pack de 1/4 con 27 pzas\n▪ 1 caja de Jugo de frutas tetra pack de 1/8 con 27 pzas\n▪ 3 cajas exhibidoras de café de olla\n▪ 2 caja de Jabón en barra de 350 grs. con 25 piezas\n▪ 1 bulto de Harina estándar de 50 kg.\n▪ 1 caja de Mayonesa No. 4 con 24 frascos.\n▪ 2 cajas de Pasta para sopa de sobre de 200 grs. con 20 paquetes c/u\n▪ 1 caja de Galletas tipo \"Marías\" con 20 rollos c/u\n▪ 2 cajas de formula láctea tetra pack de 1 lt. con 12 litros c/u\n▪ 2 cajas de Galletas tipo \"Napolitanas\" con 20 rollos c/u\n▪ 1 caja Galletas tipo \"mexicanas\" con 20 rollo c/u\n▪ 1 colchón de Papel higiénico 12 paq c/4 rollos\n▪ 1 caja de blanqueador de 500 ml. Con 20 pzas. c/u\n▪ 2 caja de shampoo en sobre de 900 ml. Con 12 pzas. c/u\n▪ 2 cajas de chile jalapeño en rajas verdes en lata de 105 grs.\n▪ 2 cajas de suavizante de 850 ml. Con 12 pzas.\n▪ 2 cajas de limpiador fresco pinol de 500 ml. Con 20 pzas. c/u\n▪ 2caja de Jabón neutro de 180 grs.\n▪ 2 cajas de frascos de mermelada de fresa de 250 grs.\n▪ 2 cajas de lechera de 250 grs. con 24 pzas. c/u\n▪ 2 cajas de servilletas con paquetes de 100 pzas.\n▪ 2 cajas de café soluble regular de 50 grs.\n▪ 2 cajas de atún en aceite de 140 grs.\n▪ 2 cajas de nor suiza\n▪ 2 cajas de espagueti corto de 220 grs.\n▪ 3 cajas de crema dental de 75 ml.\n▪ 2 paquetes de cepillo dental de 35 pzas. c/u\nDE OPERACIÓN PARA EL EJERCICIO FISCAL 2021\n▪ 2 cajas de toallas femeninas\n▪ 2 cajas de chocolate de mesa de 360 grs.\n▪ 2 cajas de galletas napolitanas con 20 rollos c/u\n▪ 1 caja de galletas mexicanas con 20 rollos c/u\n▪ 1 colchón de papel higiénico en paquetes de 4 rollos /12\n▪ 1 bascula de 5 kg. digital\n▪ 3 anaqueles de 4 entrepaños\nComo objetivo a corto plazo, se dará continuidad a la entrega de cada apoyo solicitado, cubriendo cada uno los requisitos solicitados en las presentes reglas de operación, mismo que será otorgado en su municipio de residencia o en su caso en el almacén general del Sistema Estatal; cabe mencionar que los tramites y formatos a realizar son gratuitos.\n7.2. Gastos de operación.\nEl presupuesto asignado al Proyecto Instalación Tiendas de Abarrotes para la Población Vulnerable es a través del Fondo de Aportaciones Múltiples, no contempla Gastos de Operación.\n8. Transparencia.\n8.1. Difusión.\nLa Dirección de Asistencia Alimentaria y Desarrollo Comunitario, quien es la responsable de la operación del Proyecto Instalación Tiendas de Abarrotes para la Población Vulnerable difundirá a través de los diferentes medios de comunicación; trípticos, periódico, redes sociales la información relacionada con las características de este. Así mismo se dará amplia difusión a nivel Estatal promoviéndose similares acciones por parte de las autoridades locales; y dándose a conocer en la página de internet del Gobierno del Estado, https://www.guerrero.gob.mx la información desagregada por municipio, barrio o zona urbanomarginada, proyecto y nombre de la población beneficiada; las copias de los expedientes estarán disponibles oportunamente para su consulta en las oficinas ubicadas en Av. Rene Juárez Cisneros, Colonia\nCiudad de los Servicios y Av. Gabriel Leyva s/n esq. Ruffo Figueroa, Col. Burócratas, C.P. 39090, Chilpancingo, Guerrero; por otra parte la papelería, documentación oficial, así como la publicidad y promoción del Proyecto, deberán incluir la leyenda descrita en el apartado de \"Blindaje Electoral\".\nUna vez autorizadas estas Reglas de Operación, por las instancias correspondientes, estarán\nComunitario, quien es la responsable directo de la ejecución, a través de la Subdirección de Desarrollo\nComunitario, ubicada Av. Gabriel Leyva s/n esq. Ruffo Figueroa, Col. Burócratas, C.P. 39090, Chilpancingo, Guerrero., a los teléfonos (01747) 47 2 55 95, (01747) 47 2 56 00, (01747) 47 2 56 72 ext. 1155. Así mismo\nGuerrero.\nDE OPERACIÓN PARA EL EJERCICIO FISCAL 2021\n8.2. Blindaje electoral.\nElectoral, para coadyuvar a que éstos, no sean utilizados con fines políticos; por lo que la papelería, documentación oficial, así como la publicidad y promoción del Programa deberán incluir la siguiente leyenda:\n\"Este Proyecto es público, ajeno a cualquier partido político. Queda prohibido el uso para fines distintos a los establecidos en el proyecto”\n8.3. Supervisión y control.\nEl Dirección de Asistencia Alimentaria y Desarrollo Comunitario deberá reportar mensualmente a la Dirección de Planeación del DIF Guerrero, las acciones ejercidas y los resultados obtenidos, del proyecto instalación de tiendas de abarrotes para la población vulnerable quien a su vez reportará trimestralmente a la Secretaria de Finanzas y Administración, Secretaria de Planeación y Desarrollo Regional y la Secretaria de Contraloría y Transparencia Gubernamental, informes sobre el presupuesto ejercido establecidos por el\nConsejo Nacional de Armonización Contable (CONAC) dichos informes se deberán presentar a más tardar a los quince días hábiles posteriores a la terminación de cada trimestre.\nLos padrones de los beneficiarios serán requisitados por los Sistemas Municipales DIF, remitiendo para su revisión a este Sistema Estatal DIF el padrón de forma física y digital de la dotación entregada para la integración de los Padrones de Beneficiarios de los 81 municipios de la Entidad mismo que serán remitidos a las instancias o dependencias operadoras.\n8.4. Mecanismos de evaluación e indicadores.\n8.4.1. Evaluación.\nEl instrumento de medición de evaluación del Proyecto se realizará mediante indicadores de desempeño los cuales serán reportados a la Dirección de Planeación para la integración de los informes correspondientes.\n8.4.2. Indicadores.\nMatriz de Indicadores para Resultado\nUNIDAD\nNIVEL FORMULA DE TIPO DE MEDIO DE UNIDAD\nOBJETIVO INDICADOR DE SUPUESTOS\nOBJETIVO CALCULO INDICADOR VERIFICACIÓN RESPONSABLE\nMEDIDA\nGarantizar el\nLas familias ejercicio obtienen efectivo de Porcentaje de (Familias\nSubdirección mejores los familias beneficiadas/familia Familias Padrón de\nFIN Estratégico de desarrollo oportunidades derechos vulnerables s programadas a beneficiadas beneficiarios comunitario para su sociales de beneficiadas beneficiar)x100 desarrollo todos los integral\nGuerrerenses\nMejorar las Porcentaje de (total de solicitudes Familias Solicitudes Subdirección Lograr que\nPROPOSITO Estratégico condiciones solicitudes atendidas/total de beneficiadas autorizadas de desarrollo cada\nDE OPERACIÓN PARA EL EJERCICIO FISCAL 2021\n{\"tabla_1\":{\"columnas\":[\"(sin encabezado)\",\"de vida de\\nquienes viven\\nen\\ncomunidades\\nde alta y muy\\nalta\\nmarginación\\nmediante el\\nimpulso de\\nprocesos de\\ndesarrollo\\ncomunitario,\",\"atendidas\",\"solicitudes\\nrecibidas)x100\",\"(sin encabezado)\",\"(sin encabezado)\",\"(sin encabezado)\",\"comunitario\",\"familia\\nvulnerable\\nbeneficiada\\ntenga un\\ninstrumento de\\nsupervivencia\"],\"filas\":[{\"columna_1\":\"COMPONENTES\",\"columna_2\":\"Proporcionar\\nproyectos\\nproductivos\",\"columna_3\":\"Porcentaje de\\nproyectos\\nproporcionados\",\"columna_4\":\"Apoyos\\nproporcionados/apoyos\\nprogramados *\\n100\",\"columna_5\":\"Estratégico\",\"columna_6\":\"Familias\\nbeneficiadas\",\"columna_7\":\"Avances\\nfísicos\\nfinancieros\",\"columna_8\":\"Subdirección\\nde desarrollo\\ncomunitario\",\"columna_9\":\"Brindar\\nproyectos\\nadecuado a las\\ncondiciones de\\nnuestra región\"},{\"columna_1\":\"ACITIVIDADES\",\"columna_2\":\"La revisión\\nde\\nreglas de\\noperación\\npermite\\nmejorar el\\nprograma\",\"columna_3\":\"Reglas de\\noperación\\npublicadas\",\"columna_4\":\"Publicación delas\\nreglas de operación\",\"columna_5\":\"Estratégico\",\"columna_6\":\"Documentos\",\"columna_7\":\"Avances\\nfísicos\\nfinancieros\",\"columna_8\":\"Subdirección\\nde desarrollo\\ncomunitario\",\"columna_9\":\"Establecer\\nreglas claras\\npara accesar a\\nlos proyectos\"},{\"columna_1\":\"(sin dato)\",\"columna_2\":\"La difusión\\ndel\\nproyecto en\\nlos 81\\nmunicipios\\ndel\\nestado\",\"columna_3\":\"Oficios de\\ninvitación a los\\nmunicipios\",\"columna_4\":\"Convenios de\\ncolaboración\",\"columna_5\":\"Estratégico\",\"columna_6\":\"Documentos\",\"columna_7\":\"Avances\\nfísicos\\nfinancieros\",\"columna_8\":\"Subdirección\\nde desarrollo\\ncomunitario\",\"columna_9\":\"Establecimiento\\nde fechas\\napropiadas\\npara las\\nentregas de los\\nproyectos\"},{\"columna_1\":\"(sin dato)\",\"columna_2\":\"Realizar\\npadrones que\\nservirán para\\nsubir datos\\ndel\\nbeneficiario a\\nplataformas\\nde SIFGE y\\ntransparencia\",\"columna_3\":\"Porcentaje de\\ncruce de\\npadrones\",\"columna_4\":\"Numero de cruces\\nde padrones del año\\npasado/cruce actual\\n*100\",\"columna_5\":\"Estratégico\",\"columna_6\":\"Familias\\nbeneficiadas\",\"columna_7\":\"Padrón de\\nbeneficiarios\",\"columna_8\":\"Subdirección\\nde desarrollo\\ncomunitario\",\"columna_9\":\"Generar un\\npadrón de\\nbeneficiados\\nsustentado y\\nconfiable\"}]}}\n8.5 auditoria podrá ser auditado por la Secretaría de Contraloría y Transparencia Gubernamental, así como por la\nAuditoría Superior del Estado y Auditoria Superior de la Federación, conforme a la legislación vigente y en el ámbito de sus respectivas competencias.\nEl Sistema DIF Guerrero dará todas las facilidades a dichas instancias para realizar, en el momento en que lo juzguen pertinente, las auditorías que consideren necesarias; así como el seguimiento y la solventación a las observaciones planteadas por los órganos de control.\n8.6. Recursos no devengados. y aquellos que por cualquier motivo no estuviesen devengados al 31 de diciembre del presente ejercicio fiscal.\n8.7. Contraloría social\nDE OPERACIÓN PARA EL EJERCICIO FISCAL 2021\nCon la finalidad de incrementar la participación ciudadana, se crearán Comités de Contraloría Social, como un órgano ciudadano de control, vigilancia y evaluación de las actividades del proyecto instalación de tiendas de abarrotes para la población vulnerable, conformados por las y los beneficiarios, los sectores sociales, y los representantes de la localidad, quienes de manera específica supervisarán la gestión gubernamental, y que los manejos de los recursos públicos se realicen en términos de transparencia, eficacia, legalidad y honradez. Los objetivos específicos de este Órgano de Contraloría Social son:\n• Hacer más transparentes las decisiones y la ejecución de los recursos.\n• Incrementar la participación ciudadana.\n• Fomentar la organización social.\n• Inhibir los actos de corrupción y de cooptación social, política y electoral.\n• Incrementar la eficiencia de los recursos públicos.\n• Fortalecer la cultura de la legalidad.\n• Mejorar la rendición de cuentas.\n• Perfeccionar la democracia e incorporar la evaluación ciudadana.\nLas funciones de los Comités de Contraloría Social son:\na) Integración: Se conforman con la representación de la comunidad beneficiada por el Programa, y fungirán como interlocutores con el DIF Guerrero, en el ejercicio de la contraloría social. El vocal será, el responsable de hacer llegar las quejas o denuncias recibidas al DIF Guerrero, quien dará respuesta en un plazo no mayor de 15 días a partir de la fecha de recepción de la queja o denuncia.\nb) Capacitación y asesoría: Para impulsar la realización de las actividades de Contraloría Social se brindará capacitación y asesoría, a los servidores y servidoras públicas que intervienen en la operación del Programa y / o Proyecto, así como a los integrantes de los Comités Locales, para que estos realicen adecuadamente sus actividades de seguimiento y vigilancia.\nc) Seguimiento: Se deberá integrar un Programa de Trabajo a través del cual se debe incluir la descripción de las actividades, responsables, metas y calendarización de las actividades para su cumplimiento.\nEl Director General o el personal que designe el DIF Guerrero, serán los encargados de conformar los Comités de Contraloría Social, asimismo darán acompañamiento durante las actividades de control, seguimiento y vigilancia del programa.\nEl Comité de Contraloría Social debe estar constituido por un presidente, un secretario y un vocal mínimamente, electos de entre la población beneficiada tendrá que ser vigilado por un solo Comité, el cual deberá controlar, vigilar y dar seguimiento a través de los formatos que integran el expediente comunitario, los cuales son:\n1. Acta de Conformación del Comité de Contraloría Social.\n2. Reunión con beneficiarios y beneficiaras.\n3. Ficha Informativa del Programa.\nDE OPERACIÓN PARA EL EJERCICIO FISCAL 2021\n4. Cédula de Vigilancia del Programa.\n5. Actividades de Difusión y Capacitación.\n6. Quejas, Denuncias o Reconocimientos.\n7. Informe Anual.\n8.8. Formas de participación social. de Guerrero, se establece que la sociedad podrá participar activamente en la Planeación, Programación, Implementación y Evaluación del proyecto instalación de tiendas de abarrotes para la población vulnerable, por lo que la población beneficiada participara en la etapa de la implementación y podrán supervisar la gestión gubernamental, y que el manejo de los recursos públicos se realicen en términos de transparencia, eficacia, legalidad y honradez de acuerdo en lo estipulado en estas Reglas de Operación.\nParticipantes Etapa en la que Forma de Modalidad participa participación\nPoblación Implementación Comité de Seguimiento\nBeneficiada Contraloría\n8.9. Procedimiento de queja o inconformidad ciudadana.\nLa población beneficiada podrá presentar quejas y denuncias ante las instancias correspondientes sobre cualquier hecho, acto u omisión que produzca o pueda producir daños al ejercicio de sus derechos establecidos en las presentes reglas o contravengan sus disposiciones y de la demás normatividad aplicable. a. En el Sistema DIF Guerrero\nCorreo electrónico: buzon.dif@guerrero.gob.mx\nDomicilio: Centro de Rehabilitación Integral Guerrero.\nBoulevard Lic. René Juárez Cisneros S/N, Col. Ciudad de los Servicios. Chilpancingo, Guerrero.\nC.P.39095. b. En la Secretaría de Contraloría y Transparencia Gubernamental.\nTeléfonos: (474) 47 1 97 41\nJuárez Cisneros 62 Col. Ciudad de los Servicios. Chilpancingo, Guerrero. C.P. 39075. podrán presentarse por escrito, por comparecencia de la población beneficiada beneficiario y / o beneficiaria, por correo electrónico o vía telefónica y deberá proporcionar los siguientes datos:\n Nombre del servidor público.\n Área de adscripción.\nDE OPERACIÓN PARA EL EJERCICIO FISCAL 2021\n Objeto de la denuncia.\n Nombre y domicilio del quejoso.\n Identificación oficial.\n8.10. Mecanismos de exigibilidad.\nLos casos en los que se podrán exigir los derechos por incumplimiento o por violación de estos pueden ocurrir en al menos los siguientes casos:\n1) Cuando una persona solicitante cumpla con los requisitos y criterios de inclusión para acceder a determinado derecho.\n2) Cuando la persona solicitante exija que se cumpla con dicho derecho de manera integral en tiempo y forma.\n3) Cuando no se pueda satisfacer toda la demanda de incorporación al programa por restricción presupuestal.\nSerá la Secretaría de Contraloría y Transparencia Gubernamental del Gobierno del Estado quién atenderá las denuncias de violación e incumplimiento de derechos en materia de Desarrollo Social.\n8.11. Acta de entrega – recepción.\nLa Dirección de Asistencia Alimentaria y Desarrollo Comunitario y resguardará el expediente de la población beneficiada, incluyendo su acta de donación correspondiente, dada la naturaleza del apoyo otorgado este, se realiza en apego al control del gasto público.\n9. Criterios de selección y elegibilidad.\n9.1. Método de selección de beneficiarios (as).\nSerán beneficiados con el apoyo del proyecto instalación de tiendas de abarrotes para la población, las personas que cumplan con las siguientes características:\n1. Familias en estado de vulnerabilidad, que presenten alguna discapacidad y no puedan tener un empleo formal.\n2. Habitar en los 2 Municipios o Localidades de muy alto grado de marginación.\n10. Mecánica de operación.\n10.1. Instancia ejecutora.\nDirección de Asistencia Alimentaria y Desarrollo Comunitario, quien deberá operar con apego a la programación, presupuestación, calendario de ejecución, ejercicio y control del gasto público.\nDE OPERACIÓN PARA EL EJERCICIO FISCAL 2021\n10.2. Instancia administrativa y/o normativa. de Asistencia Alimentaria y Desarrollo Comunitario, la Secretaría Contraloría y Transparencia\nGubernamental y la Auditoría Superior del Estado en el ámbito de sus respectivas competencias, quienes darán seguimiento a los objetivos y metas del Programa.\n10.3. Delimitación de atribuciones.\nEl DIF Guerrero establecerá los mecanismos de coordinación necesarios para garantizar que sus programas y acciones no se contrapongan, afecten o presenten duplicidades con otros programas o acciones del gobierno estatal; la coordinación institucional y vinculación de acciones busca potenciar el impacto de los recursos, fortalecer la cobertura de las acciones, detonar la complementariedad y reducir gastos administrativos.\n11. Derechos, obligaciones y sanciones de los beneficiarios de programas sociales.\n11.1. Derechos.\n• Recibir trato digno, respetuoso y equitativo sin discriminación alguna, por el personal de las distintas\n• áreas que participen dentro del programa.\n• Reserva y privacidad de la información personal.\n• Acceder a la información necesaria del programa, sus Reglas de Operación, recursos y cobertura.\n• Solicitar y recibir información sobre el estado que guarda su trámite.\n• Recibir los servicios y prestación del programa conforme a las Reglas de Operación, salvo que le sea suspendido el apoyo por alguna razón justificable.\n11.2. Obligaciones.\n• Proporcionar la información socioeconómica bajo protesta de decir verdad que les sea requerida por el DIF Guerrero, en los términos que establezca la normatividad correspondiente.\n• Utilizar los apoyos para los fines con que fueron autorizados evitando cualquier uso distinto de la misma.\n• Facilitar los trabajos de verificación, en cualquier momento después de otorgado el apoyo.\n11.3. Sanciones.\nLa población beneficiada que incumplan en la Disposiciones Normativas establecidas en los numerales 6.2 y 6.3 para acceder a los beneficios que a través de estos se otorgan, perderán las prerrogativas que dichas disposiciones establecen.\nDE OPERACIÓN PARA EL EJERCICIO FISCAL 2021\n12. Interpretación.\nLa interpretación de las presentes Reglas de Operación para efectos administrativos, estarán a cargo del DIF Guerrero, así como de la Secretaría de Contraloría y Transparencia Gubernamental, en el ámbito de sus respectivas competencias.\nDE OPERACIÓN PARA EL EJERCICIO FISCAL 2021\nDE OPERACIÓN PARA EL EJERCICIO FISCAL 2021\nDE OPERACIÓN PARA EL EJERCICIO FISCAL 2021\nTRANSITORIOS\nPrimero: El presente acuerdo entrará en vigor al día siguiente de su publicación en el Periódico\nSegundo: Se abrogan las Reglas de Operación que fueron publicadas en el Periódico Oficial del\nGobierno del Estado número 67 alcance III de fecha 28 de agosto del 2020.\nTercero: A partir de la entrada en vigor del presente acuerdo las Reglas de Operación del Proyecto\nInstalación de Tiendas de Abarrotes para la población Vulnerable, subsecuentes o sus modificaciones serán emitidas por el titular del Sistema para el Desarrollo Integral de la Familia, responsable directo de la operación y ejecución de estas.\nDado en la Oficina del Titular del Sistema para el Desarrollo Integral de la Familia, ubicada en las\nInstalaciones del Centro de Rehabilitación Integral Guerrero, Boulevard René Juárez Cisneros S/N, Ciudad de los Servicios, en la Ciudad de Chilpancingo de los Bravo, Capital del Estado de Guerrero, a los 18 días del mes de enero de dos mil veintiuno.\nESTADO.\nLIC. JOSÉ FRANCISCO SOLIS SOLIS.\nRúbrica.",
  "ordenamiento": "PROGRAMA",
  "jurisdiccion": "GUERRERO",
  "fuente_oficial": "DIARIO OFICIAL DE LA FEDERACION",
  "Fecha de Publicación": "24 de Mayo de 2021",
  "ULTIMA REFORMA PUBLICADA": null,
  "status": "VIGENTE",
  "es_escaneado": false,
  "tiene_tablas": true,
  "materia": [
    "general"
  ]
}