{
  "titulo": "Acuerdo por el Que Se Crea el Programa Fortalecimiento Organizacional y Se Emiten Sus Reglas de Oper",
  "Contenido": "FISCAL 2020\nTEXTO ORIGINAL.\nEMITEN SUS REGLAS DE OPERACIÓN PARA EL EJERCICIO FISCAL 2020.\nPoder Ejecutivo.\nLICENCIADO HÉCTOR ANTONIO ASTUDILLO FLORES, GOBERNADOR CONSTITUCIONAL DEL\nESTADO DE GUERRERO, CON FUNDAMENTO EN LO DISPUESTO POR LOS ARTÍCULOS 71, 87, 88,\nCONFIEREN LOS ARTÍCULOS 2, 3, 6, 7, 10, 11, 18 APARTADO A FRACCIONES I Y XII, 20 FRACCIÓN\nIII Y 31 DE LA LEY ORGÁNICA DE LA ADMINISTRACIÓN PÚBLICA DEL ESTADO DE GUERRERO\nNÚMERO 08; 1, 2 FRACCIÓN I, 18 Y 25 DE LA LEY NÚMERO 454 DE PRESUPUESTO Y DISCIPLINA\nFISCAL DEL ESTADO DE GUERRERO; 18 FRACCIÓN I Y 106 DE LA LEY NÚMERO 814 DE\nDESARROLLO RURAL SUSTENTABLE DEL ESTADO DE GUERRERO; EN RELACIÓN CON EL\nARTÍCULO 55 Y ANEXOS 21 Y 21-A DEL DECRETO NÚMERO 447 DEL PRESUPUESTO DE EGRESOS\nDEL ESTADO DE GUERRERO PARA EL EJERCICIO FISCAL 2020, Y LOS LINEAMIENTOS PARA LA\nELABORACIÓN DE LAS REGLAS DE OPERACIÓN DE LOS PROGRAMAS SOCIALES ESTATALES\nPARA EL EJERCICIO FISCAL 2017.\nEl Plan Estatal de Desarrollo 2016-2021 específicamente en el eje II Guerrero Próspero, mandata promover la diversificación de la economía y aprovechar las potencialidades que existen en nuestro Estado.\nEl Estado de Guerrero cuenta con una superficie potencial susceptible de ser aprovechada con actividades del sector primario, del orden de 6.3 millones de hectáreas; de éstas, para uso forestal son aproximadamente 2 millones de hectáreas; para otros usos le corresponden 0.7 millones de hectáreas; mientras que a la actividad pecuaria se destinan 2.9 millones de hectáreas; y a la agricultura casi 0.8 millones de hectáreas. Es importante mencionar que la superficie agrícola se clasifica, por su condición, de millones de hectáreas. El 91.3% de esta superficie es de propiedad ejidal y el 8.4% es propiedad privada.\nEl sector primario de la economía aporta el 10. % en la conformación del producto interno bruto estatal y absorbe el 26% de la población ocupada. Tanto el campo como la industria no son competitivos en el mercado nacional e internacional, solo el turismo sobresale en este contexto.\nEn esta entidad suriana, la agricultura, representa una de las ramas económicas de mayor relevancia, aun cuando su aportación sea limitada en los indicadores del comercio estatal, nacional e internacional; sin embargo, socialmente, es por excelencia la que mayor aporte hace para la sobrevivencia de un gran número de familias.\nFISCAL 2020\nEl Programa de Fortalecimiento Organizacional, tiene como objetivo general, cumplir con lo establecido en la Ley Número 814 de Desarrollo Rural Sustentable del Estado de Guerrero, así como la homóloga Ley de Desarrollo Rural Sustentable.\nPor lo expuesto y con fundamento en las disposiciones legales antes citadas, he tenido a bien expedir el siguiente:\nACUERDO POR EL QUE SE CREA EL PROGRAMA FORTALECIMIENTO ORGANIZACIONAL Y SE\nEMITEN SUS REGLAS DE OPERACIÓN PARA EL EJERCICIO FISCAL 2020.\nArtículo 1. Se crea el Programa Fortalecimiento Organizacional con inversión estatal directa, el cual tiene por objeto coadyuvar en el fortalecimiento de las cadenas agroalimentarias, organizaciones económicas y campesinas, así como el Consejo Guerrerense para el Desarrollo Rural Sustentable a través de la realización de eventos de intercambio de tecnología, foros, sesiones del Consejo Guerrerense para mejorar las condiciones de infraestructura organizacional.\nArtículo 2. Se emiten las Reglas de Operación del Programa Fortalecimiento Organizacional para el Ejercicio Fiscal 2020, en las que se establecen los principios de eficiencia, eficacia, oportunidad, equitativa y transparencia de los recursos públicos y requisitos que se deben de cumplir para poder acceder a dicho Programa.\nEn las Reglas de Operación del Programa de Fortalecimiento Organizacional, se establecerán los criterios que se deben cumplir para poder acreditar al mencionado Programa.\nArtículo 3. La Secretaría de Agricultura, Ganadería, Pesca y Desarrollo Rural tendrá a cargo la implementación, operación, ejecución, evaluación y administración del Programa Fortalecimiento\nOrganizacional, bajo los criterios de objetividad, equidad, transparencia, publicidad, selectividad y temporalidad, con estricto apego a la normatividad aplicable, por lo tanto, será la encargada de la dispersión y asignación de los recursos del Programa apegándose plenamente a las Reglas de Operación.\nEJERCICIO FISCAL 2020.\n1. Introducción\n1.1. Antecedentes\nLa Ley Orgánica de la Administración Pública del Estado de Guerrero Número 08, publicada el día de Agricultura, Ganadería, Pesca y Desarrollo Rural, es el órgano encargado de promover y fomentar el\nDesarrollo Agrícola, Forestal, Ganadero, Pesquero, así como el manejo de los recursos naturales en el\nEstado, procurando la participación de las mujeres, en igualdad de condiciones.\nFISCAL 2020\nEn el año dos mil diecinueve se crea el Programa Fortalecimiento Organizacional, el cual se contempló en el Presupuesto de Egresos del Estado de Guerrero para el Ejercicio Fiscal 2019, en el artículo dos mil diecinueve, fundamentado en el Plan Estatal de Desarrollo Rural 2016-2021, específicamente en el eje II Guerrero Próspero, el cual mandata promover la diversificación de la economía y aprovechar las potencialidades que existen en nuestro Estado.\nUna de las acciones necesarias para eficientar y diversificar la producción agropecuaria en la entidad radica en el Fortalecimiento Organizacional, cada día los mercados son exigentes y demandantes, por lo que esta línea de trabajo hace necesario el intercambio de nuevos modelos de producción, concertación, comercialización e intercambio de transferencia tecnológica.\nPara que Guerrero tenga un cambio cualitativo en su economía, se contempla seguir impulsando el fortalecimiento organizacional a través de las cadenas agroalimentarias del Estado de Guerrero.\n1.2. Alineación programática\nEl Programa está alineado al Plan Estatal de Desarrollo 2016-2021 y al Programa Sectorial de\nDesarrollo Rural y Pesca 2016-2021, en el eje programático Guerrero Próspero, al objetivo 2.2 Impulsar la productividad del sector agropecuario y pesquero, para garantizar la seguridad alimentaria, a la estrategia\n2.2.1 Fortalecer los sectores agropecuario y pesquero y crear condiciones para aumentar la competitividad y la autosuficiencia para garantizar la seguridad alimentaria en la entidad y las líneas de acción, contemplan la coordinación con productores hacia mercados nacientes como el de la floricultura y plantas ornamentales.\nLa diversificación de productos guerrerenses hace necesario detonar el desarrollo del sector agrícola y promover la producción de ganado bovino, porcino y caprino en la entidad y su presencia en los mercados nacional y extranjero.\n1.3. Diagnóstico\na) Problema social: Las cadenas agroalimentarias, organizaciones económicas y campesinas, requieren permanentemente de asistencia tecnológica, cursos de capacitación e innovación, intercambio de transferencia de tecnología, para incrementar la producción y con ello lograr ingresos más justos y competitivos por las actividades agropecuarias y pesqueras que realizan en sus unidades de producción; por otra parte, el Consejo Guerrerense para el Desarrollo Rural Sustentable, órgano consultivo de agroalimentarias y organizaciones campesinas, requiere para su funcionalidad apoyo logístico para cumplir con lo que establece la Ley Número 814 de Desarrollo Rural Sustentable del Estado de Guerrero, para celebrar cuatro sesiones al año, dos extraordinarias y reuniones de trabajo con las trece comisiones de trabajo.\nb) Causas y efectos observados del problema social: Las causales principales en la debilidad de fortalecimiento organizacional, en gran parte se debe a la falta de recursos financieros que aliente y\nFISCAL 2020 productivas. Por lo anterior existen acciones poco consensuadas y concertadas para mejorar las nuevas formas de producción y comercialización, de los productos de mayor importancia en la entidad.\nc) Resolución del problema identificado: Con el apoyo a las cadenas productivas (sistema producto), organizaciones económicas y campesinas, y al Consejo Guerrerense para fortalecer su estructura organizacional sin duda, tendrá resultados inmediatos para los productores agropecuarios y pesqueros, en el intercambio de transferencia de tecnología, cursos de capacitación e innovación, equipamiento, contratación de personal especializado en la atención de las necesidades que en ese momento presenten las cadenas productivas; el fomento y acceso a financiamientos del sector público y privado y plataformas de información, que coadyuven a realizar de manera eficiente las tareas de las cadenas productivas y del Consejo Guerrerense.\nd) Línea de base: En el año 2020, se programó atender a las cadenas agroalimentarias, organizaciones económicas y campesinas y al Consejo Guerrerense con las comisiones de trabajo, para cumplir con la Ley Número 814 de Desarrollo Rural Sustentable del Estado de Guerrero y el Reglamento del Consejo Guerrerense para el Desarrollo Rural Sustentable.\ne) Población potencial: La población total de la entidad es de 3,388,768, de los cuales, el 42% vive en el sector rural, mismos que por su productividad, rentabilidad y competitividad, las productoras y productores rurales, se ubican en tres segmentos, Productores de Menores Ingresos, en este segmento se encuentra el 78.7% de productoras y productores y está conformado por productores de menores ingresos, con agricultura de temporal y su producción es para autoconsumo; el segundo segmento es el de\nProductores en Transición, a este sector, corresponde el 20.9% de productoras y productores, y está competitividad y el tercer segmento, corresponde a productoras y productores empresariales en los que se encuentran el 0.4% de los productores, estos productores están integrados al mercado nacional e internacional, son altamente eficientes y rentables.\nFISCAL 2020\nf) Población objetivo: La población objetivo para el presente Programa, son las productoras y productores de menores ingresos y que su producción es para autoconsumo.\nPara mejor entendimiento del Programa Fortalecimiento Organizacional, se desarrolla lo siguiente:\na) Naturaleza del programa social\nFortalecimiento Organizacional, es un programa social, de apoyo técnico y logístico a las cadenas agroalimentarias, organizaciones económicas y campesinas, y al Consejo Guerrerense para mejorar sus sistemas de producción, con asistencia técnica especializada, intercambio de modelos de producción, cursos de capacitación, implementación de nuevas tecnologías y apoyos logísticos para el intercambio de experiencias.\nb) El origen y fundamento\nEl Programa tiene su origen y se enfoca a inducir las condiciones suficientes y necesarias para que las cadenas agroalimentarias, organizaciones económicas y campesinas y al Consejo Guerrerense, para que sean atendidas por el proyecto y tenga éxito en el logro de sus objetivos y metas, así como en el cumplimiento de sus compromisos, a fin de asegurar su continuidad existencial y la proyección de perspectivas para su crecimiento y desarrollo. El plan parte de la elaboración de un diagnóstico situacional de cada organización y cadenas agroalimentarias.\nLa creación del Programa, se fundamenta en el Plan Estatal de Desarrollo Rural 2016-2021, específicamente en el eje II Guerrero Próspero, así como en la Ley Número 814 de Desarrollo Rural\nSustentable, y Reglamento del Consejo Guerrerense para el Desarrollo Rural Sustentable; el cual mandata promover la diversificación de las cadenas agroalimentarias, organizaciones económicas y campesinas que existen en nuestro Estado. Para que Guerrero tenga un cambio cualitativo en su economía, se contempla impulsar cinco proyectos estratégicos entre los que se encuentra, estableciendo como objetivo construir un sector agropecuario y pesquero productivo que garantice la seguridad alimentaria del Estado.\nActualmente en la Ley Orgánica de la Administración Pública del Estado de Guerrero Número 08, en su artículo 31 contempla a la Secretaría de Agricultura, Ganadería, Pesca y Desarrollo Rural, como el órgano encargado de promover y fomentar el Desarrollo Agrícola, Forestal, Ganadero, Pesquero, así como el manejo de los recursos naturales en el Estado, procurando la participación de las mujeres, en igualdad de condiciones.\nc) Objetivos y metas\nFomentar la participación de las cadenas agroalimentarias, organizaciones económicas y campesinas, así como el Consejo Guerrerense a través del intercambio de experiencias innovadoras que promueva elevar los ingresos y una mejor calidad de vida.\nFISCAL 2020\nEl universo de atención de 1,200 productores de las cadenas agroalimentarias, organizaciones económicas y campesinas, así como la realización de eventos a realizar para el mejor desarrollo de sus actividades agropecuarias, y de servicios.\nd) Ubicación geográfica de los proyectos a desarrollar\nEl Programa se implementará en el Estado de Guerrero, abarcando las ocho regiones económicas:\nTierra Caliente\n• Norte\n• Centro\n• Montaña\n• Costa Grande\n• Costa Chica\n• Acapulco\n• Sierra\ne) Actividades a realizar\nOtorgar subsidios para la contratación de apoyo logístico en beneficio de las cadenas agroalimentarias, organizaciones económicas, campesinas y el Consejo Guerrerense; plataformas de información y demás actividades inherentes al fortalecimiento organizacional, que coadyuven a realizar de manera más eficiente las labores agropecuarias y pesqueras, y que agreguen valor a la producción.\nAsimismo, la Secretaría de Agricultura, Ganadería, Pesca y Desarrollo Rural, de conformidad con la Ley de Administración de Recursos Materiales del Estado y las bases que para tal efecto emita la\nSecretaría de Contraloría y Transparencia Gubernamental, para la adquisición y dotación de los diversos apoyos que comprende el Programa, en caso de ser necesario.\nLa Secretaría de Agricultura, Ganadería, Pesca y Desarrollo Rural, vigilará que las beneficiarias y beneficiarios cumplan con los requisitos para acceder al Programa y entregará los apoyos a las personas beneficiarias.\nf) Instancias participantes\nLa ejecución del Programa estará a cargo de la Secretaría de Agricultura, Ganadería, Pesca y\nLa Secretaría de Agricultura, Ganadería, Pesca y Desarrollo Rural, a través de la Dirección\nGeneral de la Estructura Regional y la Delegación Administrativa, serán responsables del programa y llevarán un puntual seguimiento a las solicitudes recibidas para ser apoyadas, la Dirección General de la\nEstructura Regional presentará las solicitudes recibidas ante el titular de la Secretaría de Agricultura,\nFISCAL 2020\nGanadería, Pesca y Desarrollo Rural, para su autorización correspondiente, la cual se notificará de manera escrita a las beneficiarias y beneficiarios, especificándole el concepto y monto de apoyo a recibir, así como los plazos de tiempo para hacer efectivo el apoyo, las cuales serán tramitadas ante la Delegación\nAdministrativa para los efectos de liberar los recursos financieros y materiales.\nLa Secretaría de Agricultura, Ganadería, Pesca y Desarrollo Rural, entregará el bien, el subsidio o el apoyo que corresponda y la beneficiaria o beneficiario firmará el acta de entrega recepción correspondiente.\ng) Presupuesto de inversión\nLa inversión por parte del Gobierno del Estado será financiada con la adecuación presupuestal de los recursos de Inversión Estatal Directa (I.E.D.) 2020, y con fundamento al Decreto Número 447 del\nPresupuesto de Egresos del Estado de Guerrero, para el Ejercicio Fiscal 2020, publicado en el Periódico\nOficial del Gobierno del Estado No 102 alcance VII, de fecha 20 de diciembre del año 2019, con una inversión de $6,600,000.00 (Seis millones seiscientos mil pesos 00/100 M.N.).\nh) Glosario de términos\nConsejo Guerrerense: El Consejo Guerrerense para el Desarrollo Rural Sustentable.\nCURP: Clave única de Registro de Población.\nPrograma: Al Programa Fortalecimiento Organizacional.\nReglas de Operación: Las Reglas de Operación del Programa Fortalecimiento Organizacional.\nRFC: Registro Federal de Contribuyentes.\nRNPA: Registro Nacional de Pesca y Acuacultura.\nSAGADEGRO: La Secretaría de Agricultura, Ganadería, Pesca y Desarrollo Rural.\nSEPLADER: La Secretaría de Planeación y Desarrollo Regional.\nUPP: Unidad de Producción Pecuaria.\nMisión\nImpulsar la participación de las cadenas agroalimentarias, así como a las organizaciones económicas y campesinas para que coadyuven a favorecer, analizar, promover consensos, acuerdos y así poder definir y orientar, una mejor política, programas y acciones públicas que impulsen el desarrollo rural sustentable en Guerrero, a fin de mejorar la economía y las condiciones de vida de las familias del medio rural.\nFISCAL 2020\nVisión\nGuerrero, que transforme la pobreza alimentaria y económica, en soluciones y oportunidades a través de políticas públicas rentables, integrales y sustentables, mediante el impulso a las cadenas agroalimentarias así como a las organizaciones económicas y campesinas, logrando el fortalecimiento que es necesario para el sector y así obtener e implementar a través del intercambio de experiencias, mecanismos que repercutan directamente en el bienestar social de los guerrerenses.\n2. Secretaría, dependencia o entidad responsable del programa\n2.1. La Secretaría de Agricultura, Ganadería, Pesca y Desarrollo Rural, será la responsable directa de la ejecución del Programa.\n2.2. En la operación del Programa participará la Dirección General de la Estructura Regional y la\nDelegación Administrativa de la SAGADEGRO.\n2.3. El Programa lo ejercerá la SAGADEGRO.\n2.4. La Dirección General de la Estructura Regional, será la encargada de registrar las solicitudes presentadas por las cadenas agroalimentarias, de las organizaciones económicas y del Consejo\nGuerrerense, presentarlas ante el Secretario de la SAGADEGRO, para su autorización correspondiente, una vez validados se procederá a realizar el trámite de pago ante la Delegación Administrativa.\n2.5. La SAGADEGRO, será la involucrada en la operación del Programa, así como la Dirección\nGeneral de la Estructura Regional y la Delegación Administrativa de la SAGADEGRO.\n2.6. La SAGADEGRO, es la entidad que será la responsable en la planeación y ejecución del\nPrograma; mismo que tiene como fundamento legal en la:\na) Constitución Política de los Estados Unidos Mexicanos.\nc) Ley de Desarrollo Rural Sustentable.\nd) Ley Número 814 de Desarrollo Rural Sustentable del Estado de Guerrero.\nf) Ley de Administración de Recursos Materiales del Estado de Guerrero.\nFISCAL 2020\nh) Ley Orgánica de la Administración Pública del Estado de Guerrero Número 08.\ni) Decreto Número 196, Plan Estatal de Desarrollo 2016-2021, eje II Guerrero Próspero.\nj) Programa Sectorial de Desarrollo Rural y Pesca 2016-2021.\nk) Decreto número 447 del Presupuesto de Egresos del Estado de Guerrero para el Ejercicio Fiscal\n2020.\n3. Objetivos y alcances\n3.1. Objetivo general\nCoadyuvar en el fortalecimiento de las cadenas agroalimentarias, organizaciones económicas y campesinas, así como el Consejo Guerrerense para el desarrollo Rural sustentable a través de la realización de eventos de intercambio de tecnología, foros, sesiones del Consejo Guerrerense para mejorar las condiciones de infraestructura organizacional.\n3.2. Objetivo específico\nSubsidiar en la contratación de apoyo logístico para las cadenas agroalimentarias y del Consejo\nGuerrerense, plataformas de información y demás actividades inherentes al fortalecimiento organizacional, que coadyuven a realizar de manera más eficiente las labores agropecuarias y pesqueras, y que agreguen valor a la producción.\n3.3. Alcances\na) La trascendencia y repercusión del programa social: Con la implementación del Programa, se busca que las cadenas agroalimentarias y organizaciones económicas y campesinas, sean capaces de obtener un fortalecimiento en sus actividades, así como el Consejo Guerrerense para el Desarrollo Rural\nSustentable obtener apoyos que mejoren su nivel de eficiencia, a través del fortalecimiento organizacional,\nb) El tipo de programa social: El Programa otorgará subsidios a las productoras y productores agropecuarios, pesqueros, organizaciones económicas y campesina y al Consejo Guerrerense de la entidad.\nc) La población objetivo del Programa: Son las organizaciones campesinas, económicas y el\nConsejo Guerrerense para el Desarrollo Rural Sustentable.\n4. Metas físicas\nFISCAL 2020\nLa meta es apoyar a las cadenas agroalimentarias, organizaciones económicas y al Consejo\nGuerrerense; así como la realización de 20 eventos para el mejor desarrollo de sus actividades agropecuarias, acuícolas y de servicios.\n5. Programación presupuestal\nEl monto total del presupuesto autorizado por parte del Gobierno del Estado, será financiado con la adecuación presupuestal de los recursos de Inversión Estatal Directa (I.E.D.) 2020, emitida por la\nSecretaría de Planeación y Desarrollo Regional en coordinación con la Secretaría de Finanzas y\nAdministración y con fundamento al Decreto Número 447 del Presupuesto de Egresos del Estado de\nGuerrero para el Ejercicio Fiscal 2020, publicado en el Periódico Oficial del Gobierno del Estado del 20 de diciembre del año 2019, con una inversión de $6,600,000.00 (Seis millones seiscientos mil pesos 00/100\nM.N.).\n5.1. El calendario de gasto es el siguiente:\nCONCEPTO TOTAL\nEnero Febrero Marzo Abril Mayo Junio Julio Agosto Sept. Oct. Nov.\nServicios y\n291,000 640,200 640,200 640,200 640,200 640,200 582,000 582,000 582,000 582,000 582,000 6,402,000 eventos\nGastos de\n9,000 19,800 19,800 19,800 19,800 19,800 19,800 19,800 19,800 19,800 19,800 198,000\nOperación\nTOTAL 300,000 660,000 660,000 660,000 660,000 660,000 600,000 600,000 600,000 600,000 600,000 6,600,000\n6. Requisitos y procedimientos de acceso\nPara la obtención de los apoyos, las cadenas agroalimentarias, organizaciones económicas y campesinas y el Consejo Guerrerense, deberán observar y cumplir con los requisitos:\n6.1. Difusión\nLa Secretaría de Agricultura, Ganadería, Pesca y Desarrollo Rural, dará amplia difusión del\nPrograma que ejecuta y opera en coordinación con las diferentes subsecretarías que la conforman, a través y requisitos del Programa.\nLos horarios de atención a las productoras y productores, será de lunes a viernes de 09:00 a 16:00 horas en las instalaciones de la SAGADEGRO, sita en Carretera Nacional México-Acapulco Km 274.5, Colonia Burócratas, teléfono 01 747 1 92 10.\nEl Programa también será difundido en reuniones por personal de la SAGADEGRO, quienes se que los interesados deben reunir.\nFISCAL 2020\nDesarrollo Rural.\n6.2. Requisitos de acceso\nLas cadenas agroalimentarias, organizaciones económicas y campesinas y el Consejo\nGuerrerense para obtener el beneficio del Programa, deberán presentar en la Oficialía de Partes de la\nSecretaría de Agricultura, Ganadería, Pesca y Desarrollo Rural para que turne lo correspondiente a la\nDirección General de la Estructura Regional, la siguiente documentación:\na) Presentar solicitud de apoyo (formato libre), firmada por la persona que represente la organización campesina.\nb) Comprobante de domicilio con vigencia no mayor a tres meses.\nc) Copia de las identificaciones oficiales vigentes (credencial de elector, pasaporte, cartilla de servicio militar nacional o cédula profesional).\nd) Copia de la CURP.\ne) Acta constitutiva de la organización.\nf) Documento que acredite la actividad productiva.\n6.3. Procedimiento de acceso\n6.3.1. Las cadenas agroalimentarias, organizaciones económicas y campesinas y el Consejo\nGuerrerense deberán presentar la solicitud de apoyo.\n6.3.2. Los criterios para ser beneficiaria o beneficiario, son: presentar su solicitud de apoyo, acompañada de la documentación personal, posteriormente, la SAGADEGRO, analizará la viabilidad de apoyo de la solicitud, con base en la disposición presupuestal del Programa.\n6.3.3. Podrán ser beneficiarias o beneficiarios del Programa todas las cadenas agroalimentarias, organizaciones económicas y campesinas y el Consejo Guerrerense de la entidad.\n6.3.4. La documentación será recepcionada en las instalaciones que ocupa la SAGADEGRO, ubicada en Carretera México Acapulco Km 274.5, Colonia Burócratas, C.P. 39090 Chilpancingo de los\nBravo, Gro., de lunes a viernes en horario de 09:00 a 16:00 horas.\n6.3.5. Las solicitudes de apoyo autorizadas, podrán ser consultadas en la Dirección General de la\nEstructura Regional.\nFISCAL 2020\nSe atenderán las solicitudes de apoyo, hasta en tanto exista disponibilidad presupuestal por el\nPrograma.\nLas productoras y productores conocerán el estado de su trámite, en la Dirección General de la estructura Regional.\nLas solicitudes dictaminadas como positivas de apoyo, se incorporarán al Programa, y formarán parte de un Padrón Único de Personas Beneficiarias, será de carácter público, siendo reservados los datos personales, de acuerdo con la normatividad vigente; los cuales en ningún caso podrán emplearse para propósitos de proselitismo político, religioso o comercial, ni para ningún otro fin distinto al establecido en las presentes Reglas de Operación del Programa.\nEn ningún caso las servidoras o servidores públicos podrán proceder de manera diferente a lo establecido en las presentes Reglas de Operación.\n6.4. Requisitos de permanencia, causales de baja o suspensión temporal\n6.4.1. La beneficiaria o beneficiario está obligado a:\n• Dar buen uso, conservación y/o mantenimiento de los bienes recibidos.\n• Otorgar las facilidades y proporcionar la información necesaria a las instancias de coordinación, supervisión y control de los niveles de gobierno facultados para realizar visitas de inspección y monitoreo de los apoyos otorgados.\n• Las personas beneficiarias del Programa que incumplan con las obligaciones, y/o presenten documentos falsos, la instancia normativa, definirá la sanción a la que se hará acreedor.\n6.5. Modos de entrega del beneficio\nPara las cadenas agroalimentarias, organizaciones económicas y campesinas y el Consejo\nGuerrerense que cumplan con los requisitos antes citados en el numeral 6.2, se procederá al trámite correspondiente ante la delegación administrativa para la entrega del apoyo.\n7. Procedimientos de instrumentación\n7.1. Operación\n7.1.1. Para acceder a los beneficios del Programa, las cadenas agroalimentarias, organizaciones económicas y campesinas y el Consejo Guerrerense presentarán en la SAGADEGRO, la solicitud establecida, misma que será registrada, analizada y dependiendo de la suficiencia presupuestal, se le notificará del resultado del mismo.\nFISCAL 2020\n7.1.2. La Dirección General de la Estructura Regional y la Delegación Administrativa de la\nSAGADEGRO, serán las responsables de coordinar esfuerzos para la operación del programa.\n7.1.3. Los datos personales de las personas beneficiarias del Programa, y la información adicional la Información Pública del Estado de Guerrero.\n7.1.4. Los formatos y los trámites a realizar para la obtención del beneficio del Programa, son gratuitos.\n7.2. Gastos de operación\nPara cubrir los gastos ocasionados por la operación, seguimiento, supervisión y verificación de las acciones del Programa, se dispondrá hasta el 3% de la inversión total del Programa. Estos recursos corresponden al capítulo 4000 de la apertura programática.\nEn la erogación de los gastos de operación se deberán observar los criterios de racionalidad, austeridad presupuestal, propiciando la eficiencia, eficacia y transparencia.\n8. Transparencia\n8.1. Difusión\nLa SAGADEGRO, dará amplia difusión a nivel estatal del programa de fortalecimiento organizacional, a través de reuniones con cadenas agroalimentarias y organizaciones económicas y campesinas.\nLa información del Programa se dará a conocer en la página de internet: campoguerrero.gob.mx, de la Secretaría de Agricultura, Ganadería, Pesca y Desarrollo Rural. instalaciones que ocupa la SAGADEGRO, sita en Carretera Nacional México-Acapulco km 274.5 Colonia\nBurócratas, Chilpancingo de los Bravo, de lunes a viernes en horario de 09:00 a 16:00 horas, o llamar al teléfono 017474719210 ext. 27127.\nLa papelería, documentación oficial, así como la publicidad y promoción del Programa deberá incluir la leyenda descrita en el apartado “Blindaje electoral”.\n8.2. Blindaje electoral\nFISCAL 2020\nPara blindar al Programa del clientelismo y que no sea utilizado para usos partidistas, en la documentación siempre deberán incluir la leyenda siguiente:\n“Este programa es publico ajeno a cualquier partido político. Queda prohibido el uso para fines distinto a los establecidos en el programa”.\n8.3. Supervisión y control\na) Como procedimiento interno de supervisión y control del Programa, se utilizarán informes, trimestrales, semestrales y anuales.\nb) La Dirección General de la Estructura Regional y la Delegación Administrativa de la\nSAGADEGRO, serán las responsables de coordinar esfuerzos para la operación del Programa.\nc) Se enviarán trimestralmente a la Secretaría de Finanzas y Administración, a la Secretaría de\nPlaneación y Desarrollo Regional, y a la Secretaría de Contraloría y Transparencia Gubernamental, informes sobre el Presupuesto ejercido establecidos por el Consejo Nacional de Armonización Contable\n(CONAC) y con base en los indicadores de resultados previstos en las Reglas de Operación.\nDichos informes, se deberán presentar a más tardar a los quince días posteriores de cada trimestre.\nd) Se adicionarán a los informes, la evaluación de los indicadores determinados en el Programa.\ne) La SAGADEGRO, remitirá a la SEPLADER, el calendario de entrega de los apoyos.\nf) La SAGADEGRO integrará un Padrón Único de Personas Beneficiarias del Programa.\n8.4. Mecanismo de evaluación e indicadores\n8.4.1. Evaluación\nCon el propósito de conocer los resultados del Programa, se solicitará sea evaluado por alguna institución académica y de investigación u organismo especializado de carácter nacional, que cuenten con reconocimiento y experiencia en la materia; y en los términos de las disposiciones establecidas por las instancias normativas correspondientes.\nFISCAL 2020\n8.4.2. Indicadores\nContribuir al fortalecimiento de Incremento en la las cadenas participación de\nIngreso en el Dirección condiciones agroalimentarias y las cadenas Evaluación año anterior / General de la macroecon\nFin organizaciones agroalimentarias Eficacia Porcentaje de los\nIngreso del Estructura ómicas se económicas y y organizaciones programas año actual Regional mantienen campesinas; así económicas y estables. como al Consejo campesinas\nGuerrerense\nLas cadenas Numero de eventos agroalimentarias y o\n, / de Guerrero y mantienen financieros estables.\nOtorgar subsidio para la realización de N\n, i arios\n; e ral personal capacitado atendidos / Regional condiciones fortalecimiento físico organizacional mantienen estables.\nPago de apoyos a las A v a nce Presupuesto Dirección General Las organizaciones ejercido Eficiencia Porcentaje financieros macroecon económicas y ómicas se\nActividades campesinas mantienen estables. programados ómicas se mantienen estables.\n8.5. Auditoría\nLos recursos ejercidos en el Programa, podrán ser fiscalizados por el Órgano Interno de Control y demás instancias que en el ámbito de sus respectivas atribuciones resulten competentes.\nFISCAL 2020\nComo resultado de las acciones de auditoría que se lleven a cabo, el Órgano Interno de Control mantendrá un seguimiento interno que permita emitir los informes de las revisiones practicadas, dando principal importancia a la atención en tiempo y forma, de las irregularidades detectadas, hasta su total solventación.\n8.6. Recursos no devengados\nEl presupuesto autorizado que no se aplique a los fines autorizados, y los recursos que por cualquier motivo no estén devengados al 31 de diciembre, serán reintegrados a la Tesorería de la\nSecretaría de Finanzas y Administración del Gobierno del Estado.\n8.7. Contraloría social\nSe establecerán acciones de control, vigilancia y evaluación, bajo un esquema de derechos y compromisos ciudadanos, con el propósito de contribuir a que la gestión gubernamental se realice en términos de transparencia, eficacia y honradez.\nEstas actividades estarán a cargo de los miembros de la comunidad, incluidos los integrantes del comité o instancia asociativa de las beneficiarias o beneficiarios del Programa.\nLa instancia operadora promoverá la contraloría social con base en la normatividad establecida para tal efecto, fomentando acciones que transparenten la operación del Programa en cuestión.\nLas acciones a fomentar serán las siguientes:\na) Informar a la ciudadanía acerca de los apoyos otorgados y su costo a nivel de obra, acción, nombre de las beneficiarias o beneficiarios, derechos y obligaciones de los mismos.\nb) Capacitar a las beneficiarias o beneficiarios para que se constituyan en instancias de vigilancia y evaluación social.\nc) Establecer espacios de comunicación (reuniones vecinales, atención directa a beneficiarias o beneficiarios, etc).\nd) Promover la integración de organizaciones de la sociedad civil en acciones de contraloría social.\ne) Instrumentar mecanismos de recepción y atención de quejas y denuncias. El Órgano Interno de\nControl verificará, en lo correspondiente, la realización de dichas acciones.\n8.8. Forma de participación social\nPara el Programa la SAGADEGRO aplica la Ley Número 814 de Desarrollo Rural Sustentable del\nEstado de Guerrero y el Reglamento del Consejo Guerrerense para el Desarrollo Rural Sustentable, el cual en su artículo 3 establece que para lograr sus objetivos y orientar su funcionamiento, operará con base en\nFISCAL 2020 el Programa Sectorial de Desarrollo Rural Sustentable, Programa Operativo Anual, el Programa Especial\nConcurrente y otros, cuya integración, ejecución, seguimiento y evaluación se realizará mediante procesos participativos en el que involucren tanto sus miembros, como los actores rurales más dinámicos con que operan en la entidad.\nEn su artículo 5, señala además que tendrá las siguientes atribuciones: I. Promover la evaluación participativa de la operación de los distintos programas públicos que se aplican en el medio rural del Estado y, en su caso, impulsar su reorientación, a fin de lograr los mejores resultados en el ámbito económico, social, cultural y ambiental; II. Impulsar a que el presupuesto público y la inversión privada aplicada al desarrollo rural se apruebe y se ejerza bajo principios de justicia, transparencia, oportunidad, equidad, inclusión y suficiencia con atención especial a los sectores sociales vulnerables; III. Auspiciar y vigilar la integración y funcionamiento oficial de la Comisión Intersecretarial en concordancia con la Ley Federal, el Programa Sectorial de Desarrollo Rural y las políticas anuales de concurrencia de acciones y recursos;\nIV. Funcionar como una instancia de contraloría social de los programas públicos y privados para que éstos se apliquen de acuerdo a lo que establecen la Ley Estatal, los convenios suscritos por los distintos niveles de gobierno, las reglas de operación generales y lineamientos específicos.\nEl artículo 6 establece de la integración del Consejo Guerrerense: podrán ser miembros permanentes, los representantes legales o autorizados de los organismos siguientes: I. Las organizaciones sociales y económicas rurales, legalmente constituidas y que tengan presencia en al menos cuatro municipios o dos regiones del Estado de Guerrero; II. Los representantes de los sistemas-producto legalmente constituidos; III. Los representantes de los Consejos Municipales y Distritales de Desarrollo\nRural Sustentable; IV. Las dependencias federales y estatales que forman parte de la Comisión\nIntersecretarial, y aquellas otras vinculadas con el desarrollo rural sustentable; V. Las Comisiones del H.\nCongreso del Estado vinculadas al desarrollo rural, agropecuario y Pesquero y Cuenta Pública, de\nRecursos Naturales y Desarrollo Sustentable, de Desarrollo Social, de Participación Ciudadana, de\nEducación, Ciencia y Tecnología, de Equidad de Género, y de Atención a Migrantes; VI: Las instituciones de Educación, Investigación y Consultoría Técnica; VII. Las Asociaciones o Colegios de Profesionistas vinculados al medio rural; y VIII. Los órganos que presten algún servicio al desarrollo Rural sustentable.\nPor año, se realizan cuatro reuniones trimestrales del Consejo Guerrerense de Desarrollo Rural\nSustentable. La Primera es de Planeación, la Segunda y Tercera de Seguimiento y la Cuarta es de\nEvaluación.\n8.8.2. El Consejo Guerrerense está integrado por consejeros: el 50% proviene de los sectores\nProductivos y el otro 50% del sector Federal; Estatal y Municipal. Tiene la facultad de voz y voto en las propuestas y decisiones que se presentan en el Consejo Guerrerense.\nFISCAL 2020\nParticipa Participación\nSistemas Producto, Organizaciones Planeación, Sociales, Colegio de Seguimiento y Con Voz y Voto Participación\nMVZ, de Agrónomos Evaluación. Directa y demás comisiones del Sector Oficial\n8.9. Procedimiento de queja o inconformidad ciudadana\nLas quejas y denuncias de la ciudadanía en general por la presunción de actos de corrupción o desvío de recursos por parte de servidoras o servidores públicos, se captarán por la Secretaría de\nContraloría y Transparencia Gubernamental, y la Auditoría Superior del Estado, a través de denuncias por escrito, vía internet, vía telefónica y por comparecencia de la persona interesada. El sitio es www.contraloria.guerrero.gob.mx, y al teléfono 01 800 000 7422.\nLa persona denunciante o quejosa deberá proporcionar los datos siguientes:\na) Nombre de la servidora (s) o servidor (es) público\nb) Dependencia de adscripción\nc) Objeto de la denuncia\nd) Nombre y domicilio de la persona quejosa\ne) Identificación oficial de la persona quejosa\n8.10 Mecanismos de exigibilidad\nLas productoras o productores podrán verificar el estatus de su solicitud en la página electrónica: campoguerrero.gob.mx.\nLa beneficiaria o beneficiario al recibir su notificación de autorización del apoyo, se le informará por escrito los requisitos que debe cumplir, para la entrega de los apoyos y el pago de los mismos, tendrá un plazo de 15 días para cumplir con lo anterior, (en los pagos la SAGADEGRO está sujeta a la disponibilidad presupuestal que la Secretaría de Finanzas y Administración asigne a esta Secretaría).\n8.11. Acta de entrega-recepción\nPara cada una de las acciones entregadas, se elaborará un acta de entrega-recepción, en la que participará una persona que represente la Secretaría de Agricultura, Ganadería, Pesca y Desarrollo Rural y una persona que represente la comunidad beneficiada y/o un beneficiario. A dicho acto, se invitará de entrega-recepción, la comunidad o el orden de gobierno que recibe las obras o acciones, deberá hacer\nFISCAL 2020 correspondiente.\nEl acta de entrega recepción, forma parte del expediente de la acción y constituye la prueba documental que certifica la existencia de la acción.\nEs responsabilidad de la Secretaría de Agricultura, Ganadería, Pesca y Desarrollo Rural, resguardar las actas de entrega recepción, así como el expediente de la acción.\n9. Criterios de selección y elegibilidad\n9.1. Método de selección de beneficiarias o beneficiarios\nSerán susceptibles de apoyos todas las cadenas agroalimentarias y organizaciones económicas y campesinas, de bajos ingresos del medio rural que se dediquen o quieran dedicarse a realizar actividades agrícolas, pecuarias, pesqueras y forestales.\nPara ser beneficiaria o beneficiario, deberán cumplir con presentar la documentación requerida en el numeral 6.2 de las presentes Reglas de Operación.\n10. Mecánica de operación\nLa Secretaría de Agricultura Ganadería, Pesca y Desarrollo Rural, designará una persona responsable del Programa y una persona auxiliar administrativa quienes llevarán un puntual seguimiento a las solicitudes recibidas para ser apoyadas por el Programa y presentarán las solicitudes recibidas ante la\nSAGADEGRO, para que a través de su titular emita la autorización correspondiente, la cual se notificará de manera escrita a las beneficiarias o beneficiarios del Programa, especificándole el concepto y monto de apoyo a recibir, así como los plazos de tiempo para hacer efectivo el apoyo, esta notificación se realizará a más tardar en 5 días hábiles de haber presentado la solicitud de apoyo.\nLa SAGADEGRO, entregará el bien, el subsidio o el apoyo que corresponda y la beneficiaria o beneficiario firmará el acta de entrega recepción. beneficiarios, incluyendo el acta de entrega recepción y la factura correspondiente, (Memoria fotográfica del evento, relación de asistencia, copia de INE de los asistentes, acta del evento cuando así lo justifique, copia de la publicidad o convocatoria) para las revisiones a que haya lugar por parte de la Secretaría de\nContraloría y Transparencia Gubernamental.\n10.1. Instancia ejecutora\nLa Secretaría de Agricultura, Ganadería, Pesca y Desarrollo Rural, será quien ejercerá los recursos del Programa, también, tendrá la responsabilidad de verificar que la formulación de los expedientes técnicos de los proyectos, reúnan los requisitos exigidos por la instancia normativa, tales como\nFISCAL 2020 apego a la planeación estratégica, programación, presupuestario, calendario de ejecución, ejercicio y control del gasto público.\n10.2 Instancia administrativa y/o normativas\nLa Auditoría Superior del Estado y la Secretaria de Contraloría y Transparencia Gubernamental, vigilarán que la ejecución del programa sea con apego a la normatividad para asegurar el cumplimiento de los objetivos y metas trazados.\n10.3. Delimitación de atribuciones\nConforme al artículo 31 de la Ley Orgánica de la Administración Pública del Estado de Guerrero\nNúmero 08, establece que la Secretaría de Agricultura, Ganadería, Pesca y Desarrollo Rural, es el órgano encargado de promover y fomentar el desarrollo agrícola, forestal, ganadero, pesquero, así como del manejo de los recursos naturales en el Estado, procurando la participación de las mujeres, en igualdad de condiciones en estas actividades de diseño y planeación y cumplimiento correspondiéndole el despacho de los asuntos siguientes:\na) Elaborar los planes, programas y acciones, de corto, mediano y largo plazo, del sector agropecuario, forestal y pesquero, que respondan a un criterio de manejo sustentable de los recursos naturales, con la participación de las dependencias federales y estatales correspondientes, ayuntamientos, organizaciones de productores individuales y campesinos, en el seno de la Secretaría de Planeación y\nDesarrollo Regional del Estado de Guerrero, y coordinar su implementación.\nb) Formular y ejecutar los planes, programas y acciones para el desarrollo integral de las personas que viven y trabajan en zonas rurales del Estado, principalmente aquellos dirigidos a mejorar las condiciones de las mujeres.\nc) Fomentar, formular, supervisar y coordinar la operación de los programas de desarrollo agrícola, ganadero, pesquero con criterios de manejo sustentable de los recursos naturales.\nd) Apoyar la organización para la producción, coordinando con las dependencias federales afines y productores, las acciones para el financiamiento, seguros, insumos, asistencia técnica y administrativa, investigación, capacitación y transferencia de tecnología, en beneficio de mujeres, campesinos, ejidatarios, comuneros, pequeños propietarios y organizaciones de productores legalmente constituidos.\n11. Derechos, obligaciones y sanciones de las personas beneficiarias del programa\n11.1. Derechos\nToda cadena agroalimentaria y organización económica o campesina, tiene derecho a participar y a beneficiarse del Programa, de acuerdo con los principios rectores de desarrollo social, así como a recibir\nMexicanos.\nFISCAL 2020\n11.2. Obligaciones\na) Dar buen uso, conservación y/o mantenimiento de los bienes recibidos.\nb) Comprobación del apoyo otorgado (Facturación de gastos realizados, memoria fotográfica del evento, relación de asistencia, copia de INE de los asistentes, acta del evento cuando así lo justifique, copia de la publicidad o convocatoria).\nc) Otorgar las facilidades y proporcionar la información necesaria a las instancias de coordinación, supervisión y control de los niveles de gobierno facultados para realizar visitas de inspección y monitoreo de los apoyos otorgados.\nd) Seguir las recomendaciones técnico-productivas emitidas por las instancias de gobierno.\ne) Mantener los apoyos por un plazo mínimo de tres años con el fin de que estén disponibles para las supervisiones físicas y documentales de las instancias de control y fiscalización.\n11.3. Sanciones\nLas persona beneficiarias del Programa que incumplan con las obligaciones, y/o presenten documentos falsos, la instancia normativa, definirá la sanción a la que se hará acreedor.\n12. Interpretación\nLa interpretación de las Reglas de Operación, para efectos administrativos, estará a cargo de la así como de la Secretaría de Contraloría y Transparencia Gubernamental.\nFISCAL 2020\nFISCAL 2020\nFISCAL 2020\nPrimero. El presente Acuerdo entrará en vigor al día siguiente de su publicación en el Periódico\nSegundo. Se abroga el Acuerdo por el que se crea el Programa Fortalecimiento Organizacional y se emiten sus Reglas de Operación para el Ejercicio Fiscal 2019, publicado en el Periódico Oficial del\nGobierno del Estado de Guerrero No. 39, de fecha 14 de mayo de 2019.\nTercero. A partir de la entrada en vigor del presente Acuerdo, las Reglas de Operación del\nPrograma de Fortalecimiento Organizacional, subsecuente a sus modificaciones serán emitidas por la persona titular de la Secretaría de Agricultura, Ganadería, Pesca y Desarrollo Rural, responsable directa de la operación y ejecución de las mismas.\nDado en la oficina del titular del Poder Ejecutivo, ubicada en el Edificio Centro de Palacio de\nGobierno, Boulevard René Juárez Cisneros No. 62, Colonia Ciudad de los Servicios en la Ciudad de\nChilpancingo de los Bravo, Capital del Estado de Guerrero, a los 31 días del mes de enero del año dos mil veinte.\nEL GOBERNADOR CONSTITUCIONAL DEL ESTADO DE GUERRERO.\nLIC. HÉCTOR ANTONIO ASTUDILLO FLORES\nRúbrica.\nEL SECRETARIO GENERAL DE GOBIERNO.\nLIC. FLORENCIO SALAZAR ADAME.\nRúbrica.\nEL SECRETARIO DE AGRICULTURA, GANADERÍA, PESCA Y DESARROLLO RURAL.\nLIC. JUAN JOSÉ CASTRO JUSTO.\nRúbrica.",
  "ordenamiento": "PROGRAMA",
  "jurisdiccion": "GUERRERO",
  "fuente_oficial": "DIARIO OFICIAL DE LA FEDERACION",
  "Fecha de Publicación": "23 de octubre de 2015",
  "ULTIMA REFORMA PUBLICADA": "28 de agosto de 2018",
  "status": "VIGENTE",
  "es_escaneado": false,
  "tiene_tablas": true,
  "materia": [
    "general"
  ]
}