{
  "titulo": "Acuerdo por el Que Se Crea el Programa Fondo de Apoyo A Periodistas y Se Emiten Sus Reglas de Operac",
  "Contenido": "TEXTO ORIGINAL.\nGuerrero.- Poder Ejecutivo.\nMAESTRA EVELYN CECIA SALGADO PINEDA, GOBERNADORA CONSTITUCIONAL DEL\nESTADO DE GUERRERO, CON FUNDAMENTO EN LO DISPUESTO POR LOS ARTÍCULOS 71, 87, 88,\nEN EJERCICIO DE LAS FACULTADES QUE ME CONFIEREN LOS ARTÍCULOS 1, 2, 4, 8, 9, 14, 16, 22\nAPARTADO A FRACCIONES I Y IV, 23 FRACCIÓN III Y 26 DE LA LEY ORGÁNICA DE LA\nADMINISTRACIÓN PÚBLICA DEL ESTADO DE GUERRERO NÚMERO 242; 1, 2 FRACCIÓN I, 18 Y 25\nDE LA LEY NÚMERO 454 DE PRESUPUESTO Y DISCIPLINA FISCAL DEL ESTADO DE GUERRERO;\n1, 2, 3, 5, 6 Y 8 DE LA LEY NÚM. 102, PARA EL DESARROLLO SOCIAL DEL ESTADO DE GUERRERO;\n18 FRACCIÓN I DE LA LEY NÚM. 463, PARA EL BIENESTAR INTEGRAL DE LOS PERIODISTAS DEL\nESTADO DE GUERRERO; 11 Y 12 FRACCIÓN I DEL REGLAMENTO PARA LA OPERACIÓN DEL\nFONDO DE APOYO A LOS PERIODISTAS; EN RELACIÓN CON EL ARTÍCULO 47 Y ANEXOS 23 Y 23A (E04) DEL DECRETO NÚMERO 680 RELATIVO AL PRESUPUESTO DE EGRESOS DEL ESTADO\nDE GUERRERO PARA EL EJERCICIO FISCAL 2024, Y LOS LINEAMIENTOS PARA LA\nELABORACIÓN DE LAS REGLAS DE OPERACIÓN DE LOS PROGRAMAS SOCIALES ESTATALES\nPARA EL PERIODO 2022-2027.\nQue la importancia de la Agenda 2030 y sus Objetivos de Desarrollo Sostenible (ODS) resultan de gran relevancia en la implementación adecuada dentro de las políticas públicas. Es por ello que, alineados al ODS 16 el cual pretende promover sociedades pacíficas e inclusivas, facilitar el acceso a la justicia para toda la población y crear instituciones eficaces, responsables e inclusivas a todos los niveles, reduciendo significativamente todas las formas de violencia y las correspondientes tasas de mortalidad en todo el mundo (meta 16.1), este programa busca hacer lo correspondiente con el grupo focal al cual está dirigido.\nQue el Plan Estatal de Desarrollo 2022-2027, en el Eje 3 Estado de Derecho, Gobernabilidad y\nGobernanzas Democrática, señala que uno de los pilares fundamentales de este gobierno es garantizar el\nEstado de Derecho, en el que se asegure el pleno ejercicio de los intereses particulares en lo individual y colectivo, en un marco de respeto a las leyes que fomenten la cultura de su cumplimiento y así, enaltecer los derechos de la población del estado bajo una visión incluyente y en particular, realizar acciones de prevención, monitoreo de fuentes abiertas de información, reacción inmediata e intervención a favor de encuentran. se ha consolidado en un marco de respeto y cordialidad, apegado a lo dispuesto en los artículos 1o, 6o y\n7o de la Constitución Política de los Estados Unidos Mexicanos. indispensable tarea, toda vez que además de informadores de los aspectos relevantes de la vida nacional y como formadores y orientadores de la opinión pública, son base fundamental de una sociedad democrática. establece que toda persona individual o colectiva, es titular de los derechos humanos, reconociendo la libertad de expresión, en consecuencia recibir y difundir informaciones e ideas de toda índole, salvo las excepciones previstas en la ley de la materia tratándose de los derechos o la reputación de los demás y protección de seguridad nacional, del propio estado de Guerrero, el orden, la salud pública y la moral.\nQue la referida Constitución, en el artículo 88 establece que el Poder Ejecutivo funcionará a través de secretarías y dependencias centralizadas y entidades paraestatales, en los términos señalados en su ley orgánica.\nQue de conformidad con el artículo 26 de la Ley Orgánica de la Administración Pública del Estado de Guerrero Número 242, la titular del Poder Ejecutivo se auxiliará de la Secretaría de Bienestar, como órgano encargado de la política general de desarrollo y bienestar social en la entidad.\nQue la Ley Núm. 463, para el Bienestar Integral de los Periodistas del Estado de Guerrero, establece que corresponde al gobierno del estado a través de la Secretaría de Bienestar vigilar la aplicación y cumplimiento de la presente Ley, así como coordinar, desarrollar y ejecutar programas y acciones que contribuyan a mejorar las condiciones de las y los periodistas en el estado de Guerrero.\nQue el Programa Fondo de Apoyo a Periodistas, contribuye a ser un instrumento de fortalecimiento a la política de libertad de expresión a favor de las personas dedicadas al periodismo, destacando las acciones y apoyos para disminuir sus carencias sociales, sustentos que permitirán elevar su nivel de vida y el de sus familias, además de buscar mecanismos y estrategias que posibiliten el desarrollo y capacitación profesional bajo los principios de eficiencia, eficacia, oportunidad, equidad y transparencia de los recursos públicos. periodismo, así como a apoyar el bienestar de sus hogares en el marco de la ejecución de acciones de beneficio integral familiar. Para el presente ejercicio fiscal se contempla nuevos ingresos al FAP. Respecto al origen de los recursos que integra y aplica el Programa, estos provienen de Inversión Estatal Directa\n(IED) y de las aportaciones de las personas dedicadas al periodismo cuando ingresan.\nQue conforme al Decreto Número 680 relativo al Presupuesto de Egresos del Estado de Guerrero\nI, de fecha 29 de diciembre del 2023, establece que las secretarías, dependencias y entidades de la administración pública estatal, podrán ejercer los montos para programas y proyectos de inversión aprobados en este presupuesto, en los términos de las disposiciones emitidas por la Secretaría de Finanzas y Administración y la Secretaría de Planeación y Desarrollo Regional, en función de la disponibilidad presupuestal y financiera del estado.\nQue el citado Decreto Número 680, establece en su artículo 47 fracción I que las dependencias y entidades de la administración pública serán responsables de emitir las Reglas de Operación o, en su caso, las modificaciones a aquellas que continúen vigentes.\nPor lo anteriormente expuesto y con fundamento en las disposiciones legales antes citadas, he tenido a bien expedir el siguiente:\nACUERDO POR EL QUE SE CREA EL PROGRAMA FONDO DE APOYO A PERIODISTAS Y SE\nEMITEN SUS REGLAS DE OPERACIÓN.\nArtículo 1. Se crea el Programa Fondo de Apoyo a Periodistas, que tiene como objetivo apoyar a las personas del estado de Guerrero dedicadas al periodismo, afiliadas para su atención mediante servicios que contribuyan en materia de salud, educación, protección social, capacitación y profesionalización, vivienda e ingresos.\nArtículo 2. La Secretaría de Bienestar, tendrá a cargo la implementación, ejecución, evaluación y administración del Programa, bajo los criterios de equidad, transparencia, publicidad, selectividad y temporalidad, con estricto apego a la normatividad aplicable, por lo tanto, será la encargada de la dispersión y asignación de los recursos apegándose plenamente a las Reglas de Operación.\nArtículo 3. Se emiten las Reglas de Operación del Programa Fondo de Apoyo a Periodistas, en las que se establece el procedimiento de ejecución del Programa, los principios, requisitos y condiciones que deben observarse para acceder al mismo, en los términos siguientes:\nREGLAS DE OPERACIÓN DEL PROGRAMA FONDO DE APOYO A PERIODISTAS.\n1. Introducción.\n1.1. Antecedentes.\nRuiz Massieu, expidió de la Ley de Fomento a la Actividad de los Periodistas, publicada en el Periódico sus características siendo el único a nivel nacional, tuvo por objetivo el establecimiento de las bases para de vida. del Estado de Guerrero, abrogando la Ley de Fomento a la Actividad de los Periodistas.\nEl Capítulo VI de la Ley vigente destaca el fortalecimiento del Fondo de Apoyo a Periodistas, cuyo condiciones de vida del periodista y su familia.\nEste sector generalmente no cuenta con las garantías de seguridad social, puesto que muchas del periodismo, sus ingresos no les permiten cubrir las necesidades básicas para ellos y sus familias en cuanto a seguridad social, educación, vivienda y salud, como las demandas más sentidas del gremio periodístico.\nEn México y en el estado de Guerrero, el ejercicio del periodismo en los últimos años se ha convertido en una profesión de riesgo, derivado de sus coberturas periodísticas y los diversos temas de interés social.\nLas Reglas de Operación establecen las disposiciones a las que debe sujetarse el Programa, con el objeto de otorgar transparencia y asegurar la aplicación eficiente, eficaz, oportuna y equitativa de los recursos públicos asignados.\n2. Alineación Programática al PED y/o al PND.\nEl Programa responde al Plan Estatal de Desarrollo 2022-2027 en el Eje 3 Estado de Derecho, Gobernabilidad y Gobernanzas Democrática, que señala que uno de los pilares fundamentales de este gobierno es garantizar el Estado de Derecho, corresponde al objetivo 3.3 Garantizar la protección integral de los derechos humanos, en el que se asegure el pleno ejercicio de los intereses particulares en lo individual y colectivo, en un marco de respeto a las leyes que fomenten la cultura de su cumplimiento; a la estrategia 3.3.3 Fortalecer la protección de personas defensoras de derechos humanos y periodistas, enalteciendo los derechos de la población del estado bajo una visión incluyente, y en particular, a la línea de acción 3.3.3.4 Realizar acciones de prevención, monitoreo de fuentes abiertas de información, reacción inmediata e intervención a favor de personas defensoras de derechos humanos y periodistas a efecto de disminuir el riesgo en que se encuentran.\n2.1. Diagnóstico. labor, toda vez que además de informadores de los aspectos relevantes de la vida nacional y como formadores y orientadores de la opinión pública, son base fundamental de una sociedad democrática.\nEl Fondo de Apoyo a Periodistas contó en 2021 con 480 personas periodistas afiliadas, en 2022 con 417, para 2023 hubo un total de 448 personas periodistas afiliadas. Existen solicitudes de personas periodistas que buscan incorporarse al Programa.\nEn el 2024 se pretende beneficiar a 460 personas afiliadas dedicadas al periodismo, que mediante convocatoria pública expresen su voluntad de pertenecer al Fondo de Apoyo a Periodistas (FAP).\nLas causas y efectos observados del problema social son:\n● Inseguridad.\n● Amenazas y coerción.\n● Bajo nivel de actualización profesional.\n● Que las personas periodistas no cuenten con el perfil requerido.\n● Las agencias periodísticas no dan las prestaciones de acuerdo a lo que marca la Ley.\n● El trabajo periodístico es eventual y sin contrato alguno.\nLos efectos de esas causas son:\n● Libertad de expresión limitada y autocensurada.\n● Se incrementa el riesgo de muerte.\n● Bajo índice de personas periodistas profesionalizados.\n● Personas periodistas sin ética y falta del cumplimiento de las normas deontológicas.\n● Personas periodistas sin ningún derecho laboral.\n● La vulnerabilidad social en salud, protección social, educación, vivienda e ingresos.\n2.1. Población Potencial.\nEn México hay 44 364 personas ocupadas como periodistas o en la locución, de acuerdo con datos de la Encuesta Nacional de Ocupación y Empleo.\nDe conformidad a lo establecido en el artículo 3 de la Ley Núm. 463, para el Bienestar Integral de los Periodistas del Estado de Guerrero, las personas que en el ejercicio de la libertad de expresión que otorgan los artículos 6o y 7o de la Constitución Política de los Estados Unidos Mexicanos, se dediquen habitual, profesional o laboralmente a informar a la población a través de la prensa, radio, televisión, o sitios web, y que su principal actividad económica sea el periodismo y vivan en el estado de Guerrero.\n2.1.1. Población Objetivo.\n460 personas dedicadas al periodismo, radicadas en el estado de Guerrero, que conforme al artículo 15 de la Ley Núm. 463, para el Bienestar Integral de los Periodistas del Estado de Guerrero, expresaron su voluntad de pertenecer al Programa, mediante convocatoria pública emitida por el Comité\nTécnico y que su principal actividad económica redunde en las funciones periodísticas; independientemente de los géneros periodísticos como son: reportaje, nota informativa, columna, crónica, foto reportaje, aplicadas en las secciones: policíaca, política, cultural, deportes, sociedad, en un medio de comunicación, que se dedican habitual, profesional o laboralmente a informar a la población a través de diversos medios de comunicación; la prensa, la radio, televisión, sitios web y que su principal actividad económica y laboral sea el periodismo.\n2.1.3. Población Beneficiarla.\nEl Programa, beneficiará a 460 personas dedicadas al periodismo del estado de Guerrero, afiliadas al padrón del Programa y que cumplen con los requisitos de elegibilidad. Asimismo, personas de nuevo ingreso cuya incorporación sea aceptada por el Comité Técnico.\n2.1.4. Población Indígena. afromexicano de conformidad con el artículo 2o, de la Constitución Política de los Estados Unidos\nMexicanos; para apoyar en el mejoramiento de sus condiciones de vida y su bienestar integral.\n2.2. Fundamento Legal.\nLa SBGro, es la responsable de la ejecución del Programa bajo los criterios de objetividad, equidad, transparencia, publicidad, selectividad, temporalidad y confrontación, con estricto apego a la normatividad aplicable, el cual se sustenta en los ordenamientos siguientes:\n● Constitución Política de los Estados Unidos Mexicanos.\n● Ley Orgánica de la Administración Pública del Estado de Guerrero Número 242.\n● Ley Núm. 102, para el Desarrollo Social del Estado de Guerrero.\n● Ley Número 207 de Transparencia y Acceso a la Información Pública del Estado de Guerrero.\n● Ley Número 454 de Presupuesto y Disciplina Fiscal del Estado de Guerrero.\n● Ley Núm. 463, para el Bienestar Integral de los Periodistas del Estado de Guerrero.\n● Ley Número 465 de Responsabilidades Administrativas para el Estado de Guerrero.\n● Ley Número 466 de Protección de Datos Personales en Posesión de Sujetos Obligados del\nEstado de Guerrero.\n● Ley Número 494 para la Igualdad entre Mujeres y Hombres del Estado de Guerrero.\n● Plan Estatal de Desarrollo 2022-2027\n● Decreto Número 680 relativo al Presupuesto de Egresos del Estado de Guerrero para el Ejercicio\nFiscal 2024.\n● Reglamento para la operación del Fondo de Apoyo a los Periodistas.\n● Lineamientos para la Elaboración de las Reglas de Operación de los Programas Sociales\nEstatales para el periodo 2022 - 2027.\n● Todos aquellos ordenamientos normativos que sean aplicables.\n2.3. Definiciones y Siglas.\n● Comité Técnico: Es el órgano colegiado para la aplicación, vigilancia, asignación y autorización de las decisiones del Fondo de Apoyo a Periodistas.\n● Comité de Contraloría Social: Órgano ciudadano de control, vigilancia y evaluación de las actividades del Programa, conformado por las personas dedicadas al periodismo afiliadas y, quienes de manera específica supervisarán la gestión gubernamental y que el manejo de los recursos públicos se realice en términos de eficacia, transparencia y honradez.\n● Padrón Único de Personas Afiliadas: Lista de personas afiliadas que obtienen un beneficio consumado o apoyo del Programa.\n● Personas Afiliadas: Son aquellas dedicadas al periodismo que se encuentran trabajando de manera habitual, profesional en la actividad de informar a través de la prensa, la radio, la televisión o periodismo digital en web, obteniendo su principal ingreso de esa actividad y que hayan expresado voluntad de pertenecer al FAP, cumpliendo con las convocatorias emitidas por el Comité Técnico del Programa.\n● Programa: El Programa Fondo de Apoyo a Periodistas.\n● Reglas de Operación: Las Reglas de Operación del Programa Fondo de Apoyo a Periodistas.\nSiglas:\n● FAP: Fondo de Apoyo a Periodistas.\n● SBGro: Secretaría de Bienestar.\n● SCyTG: Secretaría de la Contraloría y Transparencia Gubernamental.\n● SEFINA: Secretaría de Finanzas y Administración.\n● SEPLADER: Secretaría de Planeación y Desarrollo Regional.\n● SGG: Secretaría General de Gobierno.\n3. Objetivos y Alcances.\n3.1. Objetivo General.\nContribuir a mejorar las condiciones de vida de las y los periodistas de Guerrero, afiliados al\nPrograma Fondo de Apoyo a Periodistas, a través de una serie de beneficios que permitan lograr su bienestar integral.\n3.2. Objetivo Específico.\nFortalecer las medidas y acciones que contribuyan a mejorar de manera integral las condiciones de vida de las y los periodistas y sus familias, con los Apoyos siguientes:\n1. Apoyo social.\n● Un seguro de vida colectivo de cobertura básica por fallecimiento para las y los periodistas afiliados.\n2. Deficiencias en la salud.\n● Apoyos para gastos de maternidad para las mujeres afiliadas.\n● Apoyos para gastos médicos para las personas afiliadas.\n● Apoyos para gastos odontológicos para las personas afiliadas.\n● Apoyo para gastos oftalmológicos para las personas afiliadas.\n3. Deficiencias en las carencias de vivienda.\n● Apoyos para mejoramiento y rehabilitación de vivienda.\n4. Mejorar los ingresos.\n● Apoyos económicos para traslados de las y los integrantes del Comité Técnico.\n● Apoyo para gastos funerarios para familiares directos de las personas afiliadas.\n● Apoyos casos extraordinarios de carácter personal para las personas afiliadas.\n● Apoyos para hijas y/o hijos de nivel preescolar de las personas afiliadas.\n● Apoyo para equipo de trabajo de las personas afiliadas.\n5. Apoyo Jurídico.\n● Celebración de convenios de colaboración con dependencias u órganos del estado de Guerrero, con el fin de brindar apoyo y asesoría legal para las personas afiliadas.\n● Fomentar convenios de colaboración con instituciones públicas y privadas, locales y nacionales, incluyendo las dedicadas a la protección de los derechos humanos para el cumplimiento de su objeto.\n● Profesionalización o educación insuficiente.\n● Cursos de actualización, capacitación y talleres en las nuevas tecnologías de la información a los periodistas afiliados al FAP.\n● Asambleas regionales de periodistas.\n● Certificación oficial del grado de estudios por medio de la firma de convenios con instituciones educativas de todos los niveles, públicos o privados.\n3.3. Cobertura.\nEl Programa operará en todos los municipios del estado de Guerrero, siempre y cuando estén afiliados al FAP, para brindar atención a las personas dedicadas al periodismo afiliadas a este, que se encuentran trabajando de manera habitual, profesional o laboralmente en la actividad de informar a través de la prensa, la radio, la televisión y sitios web obteniendo su principal ingreso de esa actividad.\n3.4. Alcances.\nEl Programa es un instrumento de fortalecimiento integral a la política de libertad de expresión en favor de las personas dedicadas al periodismo en el ejercicio de su profesión, destacando los apoyos para disminuir sus carencias sociales, atendiendo con ello el derecho a la salud, educación, vivienda, deporte y cultura, ingresos, equipo de trabajo, sustentos que permitirán elevar su nivel de vida y el de sus familias; además de buscar mecanismos y estrategias que posibiliten el desarrollo y capacitación profesional.\n4. Metas Físicas.\nSe atenderán hasta 460 personas afiliadas al periodismo dependiendo de la disponibilidad presupuestal del Programa.\nProgramación Presupuestal.\nEl presupuesto autorizado para la operación del Programa es de $5,459,000.00 (Cinco Millones\nCuatrocientos Cincuenta y Nueve Mil Pesos 00/100 M.N.), recurso proveniente de Inversión Estatal\nDirecta, conforme a lo establecido en el Decreto Número 680 relativo al Presupuesto de Egresos del Estado de Guerrero para el Ejercicio Fiscal 2024.\nEl monto unitario por persona beneficiada es variable, el seguro de vida cubrirá al 100% de las personas afiliadas, los demás apoyos están sujetos a la aprobación del Comité Técnico, cabe mencionar la calendarización y metas pueden variar.\nCronograma Financiero, Ejercicio Presupuestal 2024.\n5. Gastos de Operación.\nDel total de los recursos autorizados al Programa, podrá aplicarse hasta un 3% del presupuesto asignado para gastos de operación, a las diversas acciones asociadas con la planeación, operación, supervisión, contraloría social y evaluación o asesoría externa.\nEn los gastos de operación se podrá considerar para la difusión, la adquisición de bienes que permitan la ejecución, supervisión, seguimiento y la evaluación, pudiendo utilizar el recurso solamente para acciones del Programa y la Dirección de Atención a Periodistas.\n6. Criterios y Requisitos de Elegibilidad.\nPara la actualización y las nuevas afiliaciones:\nCriterios: Ser personas dedicadas al periodismo radicadas en el estado de Guerrero y haber expresado su voluntad de participar en el padrón del Programa previa convocatoria y aprobación del Comité\nTécnico.\nPara recibir los diferentes tipos de apoyo:\nCriterios: Estar afiliada o afiliado.\nRequisito para afiliarse: Que su principal actividad económica redunde en las funciones periodísticas; independientemente de los géneros periodísticos como son reportaje, nota informativa, columna, crónica, fotorreportaje, y que son aplicadas en las secciones: policiaca, política, cultural, científica, salud, deportes y social en un medio de comunicación. Que se dediquen habitual, profesional o laboralmente a informar a la población a través de diversos medios de comunicación; la prensa, la radio, sitios web o televisión.\nRequisitos para acceder a algún tipo de apoyo: Para que sean beneficiarias o beneficiarios de algún tipo de apoyo de acuerdo con el numeral 7, deberán cumplir con los requisitos que a continuación se detallan:\n1. Solicitud dirigida al Secretario de Bienestar y presidente del Comité Técnico del FAP\n2. Formato 2024 llenado y firmado por la persona solicitante a descargar de la página de internet oficinas de esta dependencia).\n3. Llenado del Cuestionario (se podrá descargar de la página de internet oficinas de esta dependencia).\n2023) que acrediten el último año de actividad periodística en: radio, prensa escrita, televisión o plataformas digitales de noticias, (Si labora en radio o televisión enviar el fragmento donde aparezca tu información y fecha de la emisión, para plataformas digitales enviar captura de pantalla y link VIGENTE). En el caso de notas periodísticas, estás deben ser de elaboración propia no boletines.\n5. Presentar su currículum vitae en el cual se resalte su actividad periodística. Señalar si cuentan con base o empleo fijo en alguna instancia de los tres niveles de gobierno.\n6. Constancia laboral de antigüedad de la empresa o medio donde labora (membretada, con RFC fiscal (persona moral o física) y de cuanto es su sueldo) o recibo de nómina o pago.\n7. Copia de la Credencial del Instituto Nacional Electoral (INE).\n8. Comprobante de domicilio.\n9. Dos fotografías tamaño infantil, físicas o digitales.\n10. Cubrir el monto de la aportación que determine el Comité Técnico.\nEn caso de ser aprobado por el Comité Técnico, cubrirán el monto de aportación por la cantidad de $1,000 (Mil Pesos 00/100 M.N), para el caso de los periodistas que actualicen su afiliación, deberán contar con su recibo de pago, de conformidad con lo estipulado en los artículos 15 y 19 de la Ley 463, para el Bienestar Integral de los Periodistas del Estado de Guerrero. y artículo 20, numeral 5 del Reglamento para la Operación del FAP.\nLas personas afiliadas que obtengan algún apoyo consumado serán contempladas como afiliadas y estas deberán entregar la documentación requerida de acuerdo al numeral 11 para anexarse a su expediente. También de ser el caso, firmarán un documento donde ratificarán que ejercerán el recurso para lo cual está destinado.\nNo podrán pertenecer al fondo de Apoyo a los Periodistas, aquellas personas que sean propietarias de empresas periodísticas, aun cuando reúnan los requisitos señalados en el artículo 20 del\nReglamento para la Operación del FAP.\nSe dará prioridad a personas que no cuentan con un sueldo base. El Comité Técnico analizará base en alguna instancia de los tres niveles de gobierno o universidades públicas.\nA) Para los seguros de vida de las personas dedicadas al periodismo:\n● Cada persona periodista afiliada al programa FAP debe firmar su póliza con los datos de sus personas beneficiarias en caso de fallecimiento.\n● El procedimiento para hacer efectivo el Seguro de vida o cualquier otro seguro contratado se aseguradora determine. Será necesario que las personas beneficiadas por los seguros, se responsabilicen a entregar la documentación que se requiera.\nTodo concepto contemplado, será establecido en el contrato firmado con la empresa aseguradora.\nB) Para las mujeres periodistas beneficiarias que requieran apoyo de gastos médicos por maternidad deberán cubrir los requisitos siguientes:\n● Solicitud dirigida a la persona titular de la SBGro.\n● Factura o recibo de honorarios del personal médico o institución, con el desglose del IVA o retención del ISR respectivo, a nombre de la SEFINA, con R.F.C. SFA830301- 521, ubicada en el interior del “Recinto de las Oficinas del Poder Ejecutivo del Estado”, el inmueble ubicado en el número 62, en\nBoulevard René Juárez Cisneros, de la Ciudad de los Servicios. La factura, deberá contar con la verificación fiscal ante el Sistema de Administración Tributaria (SAT).\n● Constancia de alumbramiento.\n● Copia de la credencial de elector emitida por el Instituto Nacional Electoral (INE).\n● Clave Única de Registro de Población (CURP).\n● Comprobante de domicilio.\n● Carátula del contrato o similar en el cual se especifique el número de la clabe interbancaria de la persona afiliada (que especifique nombre de la persona y banco).\n● Todos los requisitos de los apoyos solicitados se enviarán en formato digital (PDF).\nTécnico, se otorgará una vez al año y sujeto a disponibilidad financiera del Programa.\nC) Para las personas afiliadas del Programa que requieran el apoyo de gastos médicos para la persona titular, que se cubrirá con Inversión Estatal Directa, deberán cubrir los requisitos siguientes:\n● Solicitud dirigida a la persona titular de la SBGro.\n● Factura o recibo de honorarios del personal médico o institución, con el desglose o retención del\nISR respectivo, a nombre de la SEFINA, con R.F.C. SFA830301-521, ubicada en el “Recinto de las Oficinas de la Ciudad de los Servicios, edificio Norte Planta Baja, C.P. 39074, en Chilpancingo de los Bravo, capital del estado de Guerrero y anexar la verificación fiscal.\n● Diagnóstico del personal médico (en hoja membretada, con sello, firma y cédula profesional) que acredite el padecimiento o enfermedad.\n● Copia de la credencial de elector emitida por el Instituto Nacional Electoral (INE).\n● Clave Única de Registro de Población (CURP).\n● Comprobante de domicilio.\n● Carátula del contrato o similar en el cual se especifique el número de la clabe interbancaria de la persona afiliada (que especifique nombre de la persona y banco).\n● Todos los requisitos de los apoyos solicitados se enviarán en formato digital (PDF).\nDichos apoyos se entregarán en cheque o transferencia bancaria y serán aprobadas por el Comité\nTécnico, se otorgará una vez al año y sujeto a disponibilidad financiera del Programa.\nD) Para las personas afiliadas del Programa que requieran el apoyo de gastos odontológicos.\n● Solicitud dirigida a la persona titular de la SBGro.\n● Factura o recibo de honorarios del personal odontólogo o institución, con el desglose o retención del impuesto sobre la renta (ISR) respectivo, a nombre de la SEFINA, con R.F.C. SFA-830301- 521, ubicada en el interior del “Recinto de las Oficinas del Poder Ejecutivo del Estado”, el inmueble ubicado en el número 62, en Boulevard René Juárez Cisneros, de la Ciudad de los Servicios, C.P. 39074, en\nChilpancingo de los Bravo, capital del estado de Guerrero y anexar la verificación fiscal.\n● Diagnóstico de la persona especialista en original (en hoja membretada, con sello, firma y cédula profesional) que acredite el padecimiento o enfermedad. Este sólo se podrá entregar en Ventanilla Única o vía correo electrónico.\n● Copia de la Credencial de elector emitida por el Instituto Nacional Electoral (INE).\n● Clave Única de Registro de Población (CURP).\n● Comprobante de domicilio.\n● Carátula del contrato o similar en el cual se especifique el número de la clabe interbancaria de la persona afiliada (que especifique nombre de la persona y banco).\n● Todos los requisitos de los apoyos solicitados se enviarán en formato digital (PDF).\nTécnico, se otorgará una vez al año y sujeto a disponibilidad financiera del Programa.\nE) Para las personas afiliadas al Programa que requieran gastos oftalmológicos para la persona titular, deberán cumplir con los requisitos siguientes:\n● Solicitud dirigida a la persona titular de la SBGro.\n● Factura o recibo de honorarios del personal oftalmólogo o institución, con el desglose o retención del impuesto sobre la renta (ISR) respectivo, a nombre de la SEFINA, con R.F.C. SFA-830301- 521, ubicada en el interior del “Recinto de las Oficinas del Poder Ejecutivo del Estado”, el inmueble ubicado en el número 62, en Boulevard René Juárez Cisneros, de la Ciudad de los Servicios, edificio Norte Planta\nBaja, C.P. 39074, en Chilpancingo de los Bravo, capital del estado de Guerrero, y anexar la verificación fiscal.\n● Diagnóstico de la persona especialista en original (en hoja membretada, con sello, firma y cédula profesional) que acredite el padecimiento o enfermedad. Este sólo se podrá entregar en Ventanilla Única o vía correo electrónico.\n● Copia de la Credencial del Instituto Nacional Electoral (INE).\n● Clave Única de Registro de Población (CURP).\n● Comprobante de domicilio.\n● Carátula del contrato o similar en el cual se especifique el número de la clabe interbancaria de la persona afiliada (que especifique nombre de la persona y banco).\n● Una vez presentados estos requisitos, se analizará cada caso por el personal del Comité Técnico para su aprobación. Será el personal del Comité Técnico quien determine el monto máximo por apoyo\n(estos no podrán rebasar el monto máximo de gastos médicos) en base a la disponibilidad financiera del\nPrograma).\n● Todos los requisitos de los apoyos solicitados se enviarán en formato digital (PDF).\nTécnico, se otorgará una vez al año y sujeto a disponibilidad financiera del Programa.\nF) Para las personas afiliadas al Programa que requieran el apoyo para casos extraordinarios de carácter personal, que tienen enfermedades crónicas terminales son los requisitos siguientes:\n● Solicitud dirigida a la persona titular de la SBGro.\n● Copia del expediente médico.\n● Diagnóstico de la persona especialista (en hoja membretada, con sello, firma y cédula profesional) que acredite el padecimiento o enfermedad. Este sólo se podrá entregar en Ventanilla Única o vía correo electrónico.\n● Copia de la Credencial del Instituto Nacional Electoral (INE).\n● Clave Única de Registro de Población (CURP).\n● Comprobante de domicilio.\n● Carátula del contrato o similar en el cual se especifique el número de la clabe interbancaria de la persona afiliada (que especifique nombre de la persona y banco).\n● Todos los requisitos de los apoyos solicitados se enviarán en formato digital (PDF).\nDichos apoyos se entregarán en cheque o transferencia bancaria y serán aprobadas por el Comité\nTécnico, se otorgará una vez al año y sujeto a disponibilidad financiera del Programa.\nG) Procedimiento para apoyos para inscripción o reinscripción en nivel preescolar.\nEstos apoyos podrán ser mediante solicitud para las personas afiliadas del Programa y deberá cubrir los requisitos siguientes:\n● Presentar solicitud por escrito a la persona titular de la SBGro.\n● Adjuntar copia del Acta de Nacimiento del menor en edad preescolar.\n● Boleta y/o Constancia de Inscripción.\n● Copia de la Credencial de elector emitida por el Instituto Nacional Electoral (INE). del afiliado.\n● Clave Única de Registro de Población CURP de la alumna o el alumno.\n● Solo se dará un apoyo por familia.\n● Registro Federal de Contribuyentes (RFC).\n● Clave Única de Registro de Población (CURP) de la persona afiliada.\n● Carátula del contrato o similar en el cual se especifique el número de la clabe interbancaria de la persona afiliada (que especifique nombre de la persona y banco).\n● Todos los requisitos de los apoyos solicitados se enviarán en formato digital (PDF).\nTécnico, se otorgará una vez al año y sujeto a disponibilidad financiera del Programa.\nH) Para el procedimiento para la capacitación y profesionalización (Educativo) son los requisitos siguientes:\nLa SBGro podrá publicar una convocatoria para promover la actualización o la certificación oficial del grado de estudios adquirido o por adquirir en instituciones públicas o privadas con base en los acuerdos o convenios con por la Secretaría de Educación Pública o la Secretaría de Educación Guerrero.\nPara llevar a cabo las capacitaciones y actualizaciones de las personas afiliadas al Programa, las organizaciones podrán hacer llegar sus propuestas en cuanto a temas de interés de sus agremiados.\nLa Dirección de Atención a Periodistas coordinará y/o desarrollará; cursos, conferencias, foros, talleres de capacitación y profesionalización o asambleas regionales, cubriendo las necesidades que de cada acción a realizar se requiera. Los presupuestos y programas, deberán presentarse a los integrantes del Comité Técnico, mismo que analizará el presupuesto de cada evento y en su caso lo aprobará.\nSe realizará la difusión de las actividades de capacitación y profesionalización para las y los integrantes del FAP, por medio de correo electrónico, las redes sociales oficiales de la SBGro o los canales de comunicación existentes con las personas afiliadas al Padrón.\nDichos apoyos se entregarán en cheque o transferencia bancaria a la persona física o moral que imparta el taller y serán aprobadas por el Comité Técnico y sujeto a disponibilidad financiera del Programa.\nI) Los requisitos para el procedimiento para la gestión de apoyos a la vivienda son los siguientes:\nSe publicará una convocatoria, aprobada por el Comité Técnico, para validación de la forma en que se entregarán los apoyos destinados al mejoramiento o rehabilitación de viviendas, pudiéndose realizar un censo de las personas periodistas afiliadas al Programa que se encuentren en condiciones vulnerables, resultaron afectadas tras el paso del Huracán Otis.\nSe podrá solicitar a la Cámara Mexicana de la Industria de la Construcción (CMIC) o cualquier otra asociación externa a esta institución mediante convenio, realicen el dictamen correspondiente de la vivienda. (Con base a la disponibilidad presupuestal que tenga el Programa).\nLa solicitud deberá ser presentada de manera individual, por parte de las personas periodistas afiliadas interesadas en el mejoramiento o rehabilitación de su vivienda, así como la documentación específica que se señala a continuación:\n● Solicitud mediante escrito libre dirigida a la persona titular de la SBGro, presentando original y copia para su acuse de recibido en las oficinas de la misma dependencia.\n● Copia de la Credencial de elector emitida por el Instituto Nacional Electoral (INE).\n● Copia de la CURP ampliada al 200%.\n● Comprobante de domicilio reciente.\n● Croquis de localización que incluya referencia del domicilio.\n● Anexar fotos del espacio de la vivienda a mejorar o rehabilitar.\n● Presentar escritura debidamente notariada, título de propiedad o constancia de posesión, expedida por la autoridad comunal o ejidal competente, que acredite la propiedad de la vivienda de la persona afiliada al FAP (no se aceptan documentos de terceros).\n● En caso de que el inmueble a rehabilitar o mejorar esté a nombre de la pareja de la persona afiliada al FAP, el o la periodista deberá presentar copia del acta de matrimonio o constancia de concubinato, que acredite que dicho bien pertenece a la o él cónyuge o concubino(a) de la persona afiliada al FAP.\n● Carta de responsabilidad disponible en la página\n● Anexar copia de contrato bancario que contenga clabe interbancaria.\nComité Técnico, se otorgará una vez al año y sujeto a disponibilidad financiera del Programa\nJ) Apoyos para gastos funerarios de familiares directos son los requisitos siguientes:\n● Solicitud dirigida a la persona titular de la SBGro.\n● Copia del Acta de Defunción.\n● Acta de Nacimiento o acta de matrimonio o constancia de concubinato.\n● Copia de la Credencial del Instituto Nacional Electoral (INE).\n● Clave Única de Registro de Población.\n● Comprobante de domicilio.\n● Carátula del contrato o similar en el cual se especifique el número de la clabe interbancaria de la persona afiliada (que contenga nombre de la persona y banco).\nTécnico, se otorgará una vez al año y sujeto a disponibilidad financiera del Programa.\nK) Procedimiento de apoyo económico para traslados del personal que integra el Comité\nTécnico.\nPara el personal que integra el Comité Técnico que requiera el apoyo de gastos de traslados, deberán cubrir los requisitos siguientes:\n● Firmar las listas de asistencia a las reuniones del Comité Técnico, de acuerdo a la convocatoria que realice la persona titular de la presidencia del Comité Técnico.\n● Copia de la Credencial de elector emitida por el Instituto Nacional Electoral (INE).\n● Firma del recibo por parte de la Dirección General de Administración y Finanzas de la SBGro.\nEste apoyo solo será para traslados a las reuniones del Comité Técnico.\nL) Apoyos para casos extraordinarios:\n● Solicitud dirigida a la persona titular de la SBGro.\n● Copia de la Credencial del Instituto Nacional Electoral (INE).\n● Clave Única de Registro de Población (CURP).\n● Comprobante de domicilio.\n● Cualquier otro documento que la SBGro determine por cada caso, dada la naturaleza de este apoyo de carácter extraordinario y urgente.\n● Todos los requisitos de los apoyos solicitados se enviarán en formato digital (PDF).\nEste será determinado por la persona titular de la SBGro.\nTécnico, se otorgará una vez al año y sujeto a disponibilidad financiera del Programa.\nM) Requisitos para el procedimiento de apoyo económico para adquisición de equipo de trabajo: este beneficio de acuerdo también, a la disponibilidad financiera del Programa, pudiendo ser el apoyo en efectivo o en especie.\n● Solicitud dirigida a la persona titular de la SBGro donde se justifique la necesidad del equipo de trabajo y de qué tipo de equipo.\n● Copia de la Credencial de elector emitida por el Instituto Nacional Electoral (INE).\n● Clave Única de Registro de Población (CURP).\n● Comprobante de domicilio.\n● Carátula del contrato o similar en el cual se especifique el número de la clabe interbancaria de la persona afiliada (que especifique nombre de la persona y banco).\n● Algún documento (nota o factura) que compruebe la compra del equipo, así como una fotografía digital del equipo adquirido.\nUna vez presentados estos requisitos, se analizará cada caso por el personal del Comité Técnico para su aprobación. El monto máximo por apoyo será de Diez Mil Pesos ($10,000.00 pesos 00/100 m.n.) en caso de ser apoyo económico.\nDichos apoyos se entregarán en cheque o transferencia bancaria y serán aprobadas por el Comité\nTécnico, se otorgará una vez al año y sujeto a disponibilidad financiera del Programa\n7. Tipo, Monto y Periodicidad del Apoyo.\nTipo Monto $\nPeriodicidad\nEconómico Hasta\n10,000.00\nÚnico.\nApoyos para gastos médicos.\nHasta Único.\nApoyos de gastos por maternidad. 25,000.00\n{\"tabla_1\":{\"columnas\":[\"(sin encabezado)\",\"Hasta\",\"Único.\"],\"filas\":[{\"columna_1\":\"Apoyo para gastos odontológicos.\",\"columna_2\":\"10,000.00\",\"columna_3\":\"(sin dato)\"},{\"columna_1\":\"Apoyo para apoyos para gastos\",\"columna_2\":\"Hasta por\",\"columna_3\":\"Único.\"},{\"columna_1\":\"oftalmológicos.\",\"columna_2\":\"5,000.00\",\"columna_3\":\"(sin dato)\"},{\"columna_1\":\"Apoyos de casos extraordinarios,\",\"columna_2\":\"Hasta por\",\"columna_3\":\"Único.\"},{\"columna_1\":\"determinado por la dependencia.\",\"columna_2\":\"15,000.00\",\"columna_3\":\"(sin dato)\"},{\"columna_1\":\"Apoyos para casos extraordinarios de\",\"columna_2\":\"Hasta por\",\"columna_3\":\"Único.\"},{\"columna_1\":\"carácter personal para periodistas que tienen\",\"columna_2\":\"15,000.00\",\"columna_3\":\"(sin dato)\"},{\"columna_1\":\"enfermedades crónicas una vez al año.\",\"columna_2\":\"(sin dato)\",\"columna_3\":\"(sin dato)\"},{\"columna_1\":\"Apoyos para el Mejoramiento de Vivienda.\",\"columna_2\":\"Hasta por\",\"columna_3\":\"Único\"},{\"columna_1\":\"(sin dato)\",\"columna_2\":\"25,000.00\",\"columna_3\":\"(sin dato)\"},{\"columna_1\":\"Apoyos de nivel preescolar.\",\"columna_2\":\"Hasta por\",\"columna_3\":\"Único\"},{\"columna_1\":\"(sin dato)\",\"columna_2\":\"4,000.00\",\"columna_3\":\"(sin dato)\"},{\"columna_1\":\"Apoyos para gastos funerarios de familiares\",\"columna_2\":\"Hasta por\",\"columna_3\":\"Único\"},{\"columna_1\":\"directo (madre, padre, esposa e hijas e hijos).\",\"columna_2\":\"5,000.00\",\"columna_3\":\"(sin dato)\"},{\"columna_1\":\"Apoyos para traslados de las y los miembros\",\"columna_2\":\"Hasta por\",\"columna_3\":\"Único\"},{\"columna_1\":\"del Comité Técnico del Fondo de Apoyo a\",\"columna_2\":\"1,500.00\",\"columna_3\":\"(sin dato)\"},{\"columna_1\":\"Periodistas\",\"columna_2\":\"(sin dato)\",\"columna_3\":\"(sin dato)\"},{\"columna_1\":\"Apoyos para profesionalización\",\"columna_2\":\"Hasta\",\"columna_3\":\"Único\"},{\"columna_1\":\"(sin dato)\",\"columna_2\":\"40,000.00\",\"columna_3\":\"(sin dato)\"},{\"columna_1\":\"Apoyos para equipo de trabajo\",\"columna_2\":\"Hasta por\",\"columna_3\":\"Único\"},{\"columna_1\":\"(sin dato)\",\"columna_2\":\"10,000.00\",\"columna_3\":\"(sin dato)\"}]}}\nTécnico, se otorgarán una vez al año y estarán sujetos a la disponibilidad financiera del Programa. En el caso de Equipo de Trabajo podrá ser el apoyo en especie bajo acuerdo de Comité Técnico.\n7.1. Características de los Apoyos.\nCarencias. Descripción.\nSalud. A) Servicios Médicos:\n● Apoyo para gastos médicos para la persona afiliada (NO contemplados en seguros contratados y una vez al año), hasta por\n$10,000.00 (Diez Mil Pesos 00/100 M.N.). Previa comprobación correspondiente, con documentación fiscal, a solicitud aprobada por el Comité Técnico, se otorgará una vez al año y estará sujeto a disponibilidad financiera del Programa.\n● Apoyo para gastos odontológicos para la persona afiliada. Previa comprobación correspondiente y aprobación del Comité Técnico por cada solicitud con base en la disponibilidad financiera. Monto máximo $10,000.00 (Diez Mil Pesos 00/100 M.N.), a solicitud aprobada por el Comité Técnico, se otorgará una vez al año y estará sujeto a disponibilidad financiera del Programa.\n● Apoyo para gastos oftalmológicos para la persona afiliada. Previa comprobación correspondiente y aprobación del Comité Técnico por cada solicitud en base a disponibilidad financiera. Monto máximo $5,000.00 (Cinco Mil Pesos 00/100 M.N.), a solicitud aprobada por el Comité Técnico, se otorgará una vez al año y estará sujeto a disponibilidad financiera del Programa.\n● Apoyos para gastos médicos por maternidad para las personas afiliadas, hasta por $25,000.00 (Veinticinco Mil Pesos 00/100\nM.N.) Previa comprobación correspondiente, con documentación fiscal, a solicitud aprobada por el Comité Técnico, se otorgará una vez al año y estará sujeto a disponibilidad financiera del Programa.\n● Apoyo para casos extraordinarios de carácter personal, para periodistas que tienen enfermedades crónicas una vez al año, hasta por $15,000.00 (Quince Mil Pesos 00/100 M.N.), a solicitud aprobada por el Comité Técnico, se otorgará una vez al año y estará sujeto a disponibilidad financiera del Programa.\n{\"tabla_2\":{\"columnas\":[\"Apoyo Social\",\"B) Seguros:\\n● Un Seguro de Vida colectivo, anual, de cobertura básica por\\nfallecimiento para las personas afiliadas al Programa.\"],\"filas\":[{\"columna_1\":\"Educación\",\"columna_2\":\"C) Apoyos a la educación:\\n● Apoyos para las hijas e hijos de nivel preescolar de personas\\nperiodistas afiliadas. Se podrá otorgar un apoyo por ciclo escolar,\\nen una sola exhibición, hasta por la cantidad de $4,000.00 (Cuatro\\nMil Pesos 00/100 M.N.) Previa solicitud y estará sujeto a\\ndisponibilidad financiera del Programa.\"},{\"columna_1\":\"Capacitación y\\nmejoramiento\\ntécnico\\nprofesional\\n(será por acuerdo\\na solicitud\\naprobada por el\\nComité Técnico\\ndel Fondo de\\nApoyo a\\nPeriodistas y\\nestará sujeto a\\ndisponibilidad\\nfinanciera del\\nPrograma)\",\"columna_2\":\"D) Profesionalización:\"},{\"columna_1\":\"(sin dato)\",\"columna_2\":\"● Impulsar acciones de capacitación por medio de cursos, talleres,\\nconferencias magisteriales, foros, asambleas regionales,\\ndiplomados de periodismo, entre otros.\\n● Buscar la profesionalización de las y los miembros afiliados al\\nPrograma con la certificación oficial del grado de estudios por\\nmedio de la firma de convenios con instituciones educativas de\\ntodos los niveles, públicas o privadas.\\n● Apoyar con cursos de actualización en las nuevas tecnologías de\\nla información a las personas periodistas afiliadas del Programa.\"},{\"columna_1\":\"Vivienda\",\"columna_2\":\"E) Apoyos:\\n● Se podrán otorgar apoyos para el mejoramiento o rehabilitación\\nde la vivienda de las y los periodistas afiliados al Programa, por\\nhasta $25,000.00 (Veinticinco Mil Pesos 00/100 M.N.), sujeto a\\ndisponibilidad financiera del Programa por sorteo o por acuerdo\\na solicitud aprobada por el Comité Técnico del Fondo de Apoyo\\na Periodistas.\"},{\"columna_1\":\"Otros Apoyos\\n(Ingresos)\\nDependerá de\\nlas reuniones\\nordinarias y\\nextraordinarias y\\nestará sujeto a\\ndisponibilidad\",\"columna_2\":\"F) Apoyos:\\n● Gastos funerarios de familiares directos, hasta por $5,000.00\\n(Cinco Mil Pesos 00/100 M.N.) y estará sujeto a disponibilidad\\nfinanciera del Programa.\\n● Económico, para traslados de las y los miembros del Comité\\nTécnico del Fondo de Apoyo a Periodistas hasta por $1,500.00\"}]}} financiera del (Mil Quinientos Pesos 00/100 M.N.) (se comprobarán a través\nPrograma de minutas de trabajo).\n● Apoyos de casos extraordinarios, determinado por la dependencia hasta por $15,000.00 (Quince Mil Pesos 00/100\nM.N.), a solicitud aprobada por el Comité Técnico, se otorgará una vez al año y estará sujeto a disponibilidad financiera del\nPrograma.\nEquipo de trabajo G) Apoyos para Equipos de Trabajo:\nEstará sujeto a disponibilidad ● Apoyo parcial para adquisición de equipos de trabajo hasta por financiera del $10,000.00 (Diez Mil Pesos 00/100 M.N.), estará sujeto a\nPrograma por disponibilidad financiera del Programa por sorteo o por acuerdo sorteo o por a solicitud aprobada por el Comité Técnico del Fondo de Apoyo acuerdo a a Periodistas quien definirá como se va a adquirir y entregar solicitud dichos equipos de trabajo. Se podrá otorgar el apoyo una vez al aprobada por el año.\nComité Técnico del Fondo de\nApoyo a\nPeriodistas quien definirá como se va a adquirir y entregar dichos equipos de trabajo. Se podrá otorgar el apoyo una vez al año.\nTodos los apoyos, beneficios o acciones del Programa estarán sujetos a disponibilidad financiera.\n7.2. Recursos no Devengados. recursos que al cierre del ejercicio se conserven o que no se hayan devengado al treinta y uno (31) de diciembre del presente ejercicio fiscal, deberán ser reintegrados a la Tesorería General dependiente de la\nSEFINA.\n7.3. Resguardo de la Documentación. de los diferentes apoyos que serán canalizados para su resguardo, revisión y el trámite correspondiente a la Dirección General de Administración y Finanzas de la SBGro, así mismo, será quien haga el cierre correspondiente del ejercicio fiscal.\n7.4. Supervisión y Control. cumplir con los requisitos de información siguientes:\n● Enviar trimestralmente a la SEFINA, SEPLADER, y SCyTG, los informes sobre el presupuesto ejercido establecido por el Consejo Nacional de Armonización Contable (CONAC) y con base en los indicadores de resultados previstos en las presentes Reglas de Operación.\nDichos informes se deberán presentar a más tardar a los quince (15) días hábiles posteriores a la terminación de cada trimestre.\n● Adicionar a los informes señalados en el inciso anterior, la evaluación de los indicadores determinados en cada programa. Dicha evaluación versará sobre los recursos entregados a las personas afiliadas e incorporará un apartado específico sobre el impacto y resultados de los programas sobre el bienestar y la equidad de género.\nCon el objeto de tener precisión del Padrón de Personas Afiliadas de los distintos programas sociales y con ello evitar duplicidad en el otorgamiento de los apoyos, se integrará un Padrón Único de\nPersonas Afiliadas de acuerdo con el numeral 8, de las presentes Reglas de Operación.\nCriterios de Selección.\nPara ser persona afiliada al Programa y poder ser beneficiaria de este, deberán entregar los documentos completos en tiempo y forma que marquen las convocatorias aprobadas por el Comité técnico y emitidas por la SBGro conforme al párrafo dos del numeral 8.4.\nLos requisitos y tiempos que marcarán las convocatorias de nuevo ingreso y de actualización serán aproximadamente en el mes de octubre y podrá ser modificada dicha fecha por acuerdo de Comité\nTécnico del FAP, así como de conformidad al artículo 20 del Reglamento para la Operación del Fondo de\nApoyo a Periodistas.\n8.1. Casos Especiales. disponibilidad financiera.\n8.2. Casos de Emergencia o Desastre.\nLa SBGro, a través de la Presidenta o Presidente del Fondo de Apoyo a Periodistas, tomará las afiliadas y afiliados que se encuentren ante una emergencia o desastre natural en el estado de Guerrero.\n8.3. Suspensión o Cancelación del Programa Social.\n● Por disposición legislativa.\n● Cuando las personas periodistas afiliadas no cumplan con los requisitos establecidos en estas\nReglas de Operación o en Ley Núm. 463, para el Bienestar Integral de los Periodistas del Estado de\nGuerrero y el Reglamento para la operación del Fondo de Apoyo a Periodistas.\n8.4. Integración del Padrón de Personas Afiliadas.\nSe conformará por personas periodistas que hayan sido aceptadas como beneficiadas por el\nComité Técnico del FAP, después de una convocatoria de actualización y nuevo ingreso o en casos especiales que determine el Comité Técnico. El Comité determinará el periodo de renovación del padrón de personas afiliadas.\nSerán reservados sus datos personales, de acuerdo con la Ley 466 de Protección de Datos\nPersonales en Posesión de Sujetos Obligados del Estado de Guerrero y la Ley Número 207 de\nTransparencia y Acceso a la Información Pública del Estado de Guerrero, los cuales en ningún caso podrán emplearse para propósitos de proselitismo político, religioso o comercial, ni para ningún otro fin distinto al establecido en las presentes Reglas de Operación.\n9. Mecánica Operativa del Programa Social.\n9.1. Instancia Ejecutora y/o Responsable.\nLa instancia ejecutora y responsable del Programa será la SBGro a través de la Dirección de\nAtención a Periodistas. En la coordinación administrativa, contable y financiera la responsable será la\nDirección General de Administración y Finanzas, ambas de la SBGro, quien podrá concertar la participación activa de otras instituciones educativas, públicas o privadas, dependencias federales, estatales o los ayuntamientos.\nEl Programa contará con un Comité Técnico que fungirá como Órgano de Gobierno integrado por las personas titulares de: la SBGro, quien lo presidirá; la SGG; la SEFINA; la Secretaría de Educación\nGuerrero; la Secretaría de Salud; la Secretaría de la Mujer, así como personas representantes de\nOrganizaciones Periodísticas legalmente constituidas.\nLas personas representantes de las organizaciones periodísticas legalmente constituidas que busquen ser parte del Comité Técnico, deberán contar como mínimo con 20 personas periodistas, quienes por escrito tras una asamblea formal designarán a sus personas representantes, los cuales fungirán como vocales y durarán en su encargo un año, con posibilidades de ratificarse por un periodo igual, debiendo de Apoyo a Periodistas de su organización; además, deberán de comprobar la legalidad total de la\nAsociación debidamente constituida, actualizada y vigente. organizaciones a las reuniones del Comité Técnico, previa convocatoria de la presidencia, será el enlace\nOperación. Este deberá tener disponibilidad y accesibilidad para acudir a las oficinas centrales previa convocatoria de la SBGro.\nLos cargos de los miembros del Comité Técnico serán honoríficos, por lo que no recibirán remuneración, emolumento ni compensación alguna por su desempeño. Tampoco podrá usarse el cargo honorífico para fines lucrativos.\nLa o el representante de organizaciones ante el Comité Técnico del FAP que terminó su periodo como representante de su organización no podrá volver a postularse hasta dentro de tres años; así mismo, quien representó a una organización no podrá representar a otra hasta pasados tres años.\n9.2. Proceso de Incorporación al Programa Social.\nPara acceder a ser parte del padrón del Programa será mediante convocatoria pública, la cual se dará a conocer en al menos, dos periódicos de mayor circulación en el estado de Guerrero. Además de difundirse en las redes sociales oficiales de la SBGro.\nLas solicitudes deberán ser presentadas de manera individual por parte de las personas solicitantes para acciones de beneficio individual, dirigida a la persona titular de la SBGro, en original y copia para acuse de recibo en las oficinas de la SBGro, así como copia de la credencial de elector de la persona solicitante, proporcionando un número telefónico y/o correo electrónico, para hacerle llegar la notificación sobre el apoyo solicitado.\nLos documentos y archivos digitales señalados en la convocatoria se deberán entregar en la ventanilla única de la SBGro, ubicada en el “Recinto de las Oficinas del Poder Ejecutivo del Estado”, el inmueble ubicado en el número 62, en Boulevard René Juárez Cisneros, de la Ciudad de los Servicios, edificio Norte Planta Baja, C.P. 39074, en Chilpancingo de los Bravo, capital del estado de Guerrero, en un horario de 8:30 am a 4:00 pm de lunes a viernes o podrán enviarse al correo electrónico: fap@guerrero.gob.mx debidamente escaneados y en formato PDF.\nLa SBGro dará respuesta a la solicitud dentro de los treinta días hábiles siguientes al ingreso de esta o bien cuando se cuente con recurso presupuestal; se le notificará vía correo electrónico o por escrito sobre el estado de su solicitud. Cabe señalar que las solicitudes serán atendidas con base en la disponibilidad presupuestal del Programa.\nCuando la solicitud no incluya toda la información requerida o faltará algún documento, la SBGro informará a la persona solicitante en un plazo no mayor a quince (15) días hábiles, se le dará un plazo hasta de cinco (5) días hábiles a partir de la fecha de haber recibido la notificación, para solventar la omisión. acuerdo con el artículo 16 de la Ley Núm. 463, para el Bienestar Integral de los Periodistas del Estado de\nGuerrero, se encuentren afiliadas al Programa. Pudiéndose hacer alguna excepción mediante la aprobación del Comité Técnico. Con posibilidades de ampliar el Padrón Único de Personas Afiliadas hasta el techo presupuestal disponible siempre y cuando, no exista duplicidad de apoyos con otros beneficios.\n10. Evaluación.\nEl Programa, estará sujeto a procesos periódicos de seguimiento y evaluación por parte del Comité\nTécnico, que permitan ajustar su ejecución y garantizar que los mecanismos de funcionamiento y y sociales.\nIndicadores (Construcción de la Matriz de Indicadores para Resultados. - Anexo I).\n10.2. Seguimiento.\nLa SBGro será la responsable de la supervisión directa de las acciones, así como de verificar que en su ejecución se cumpla con la normatividad aplicable.\nLa metodología de evaluación se aplicará en materia de profesionalización, bienestar social, académico, económico, salud, patrimonial. En función de los apoyos y beneficios otorgados, debiendo evaluarse estadísticamente.\nAl final de cada ejercicio se calificará, con cada persona afiliada el impacto social o económico que le haya generado el apoyo otorgado por el Programa.\nLa SBGro a través de la Dirección Administrativa, será la responsable de consolidar la información correspondiente para la debida integración de los informes trimestrales.\n10.3. Auditoría.\nSu ejercicio estará sujeto a las disposiciones estatales aplicables y podrán ser auditados por las instancias de fiscalización. Por la SCyTG, así como por la Auditoría Superior del Estado.\n11. Mecanismo de Entrega del Apoyo.\nPara las personas dedicadas al periodismo afiliadas al Programa que deseen algún tipo de beneficios, aplica lo siguiente:\n● En caso de que cierto apoyo mencionado lo cubra algún seguro contratado, los requisitos se aplicarán de conformidad a la póliza contratada anualmente. Y el apoyo solo se cubrirá por parte de la compañía aseguradora y no por la SBGro.\n● En caso de requerirse factura o recibo de honorarios, la entrega de documentación a la SBGro deberá realizarse dentro del mes de expedición de estos.\n● Todos los beneficios serán dependiendo de la disponibilidad presupuestal y en caso de no recibir respuesta favorable al término del plazo concedido se entenderá que el apoyo no fue aprobado.\nTécnico, se otorgarán una vez al año y estarán sujetos a la disponibilidad financiera del Programa.\n12. Derechos y Obligaciones de las Personas Beneficiadas.\nDerechos:\n● Información necesaria de manera clara y oportuna, para participar en el Programa.\n● Un trato digno, respetuoso, ético, con calidad, igualdad y no discriminatorio.\n● Atención, asesoría y apoyos sin costo alguno contemplado en las presentes Reglas de\nOperación.\n● Seguridad sobre la reserva y privacidad de su información personal conforme a la Ley Número\nObligaciones:\n● Proporcionar bajo protesta de decir verdad, la información que se les requiera de acuerdo con lo establecido en las presentes Reglas de Operación.\n● Cumplir con su corresponsabilidad en la acción autorizada.\n● Estar de acuerdo en no participar simultáneamente en más de un programa similar del gobierno en el presente año.\n● Cumplir con su corresponsabilidad en conformar el Comité de Contraloría Social, y\n● Notificar al Comité Técnico cuando asuman un cargo público, busque un puesto de elección popular, cuente con una base en cualquier nivel de gobierno o universidad pública para notificar su baja temporal o definitiva al Programa.\nAcatar las determinaciones y recomendaciones que les sean proporcionadas en las capacitaciones por la SBGro.\n12.1. Causales de Suspensión o Baja de las Personas Beneficiadas.\nSe dará de baja, cuando las personas dedicadas al periodismo afiliadas no cumplan con alguna de las obligaciones estipuladas en estas Reglas de Operación, y la suspensión de apoyos, en los casos siguientes:\n● Las personas afiliadas que no cumplan con algunas de las obligaciones marcadas en el numeral\n12, establecidas de las presentes Reglas de Operación.\n● Quienes no cumplan con los requisitos de las convocatorias se le suspenderán sus derechos temporalmente hasta que no subsane sus documentos faltantes determinado por el Comité Técnico.\n● Cuando la SBGro o algún órgano de fiscalización detecte desviaciones o incumplimiento en el ejercicio de los recursos y de las presentes Reglas de Operación por parte de las personas afiliadas, se suspenderán los apoyos, debiéndose solicitar su reintegro en apego a la normatividad aplicable.\n● Causará baja del Programa, quien ocupe el dinero para otros fines no establecidos en las presentes Reglas de Operación. provenga de recursos públicos, deberán notificar su baja temporal del Programa. del Programa serán sancionadas de acuerdo con lo dispuesto en la Ley Núm.102 para el Desarrollo Social del Estado de Guerrero y de conformidad con lo establecido en la Ley Número 465 de Responsabilidades\nAdministrativas para el Estado de Guerrero.\n12.2. Proceso de Baja.\nSe pierde la calidad de persona integrante del Fondo de Apoyo a los Periodistas por las siguientes causas:\n● Por fallecimiento.\n● Por voluntad propia.\n● Cuando las personas afiliadas no cumplan con las obligaciones estipuladas en estas Reglas de\nOperación.\n● Cuando hayan dejado de realizar su actividad periodística.\n● Por no cubrir adeudos en los tiempos preestablecidos.\n● Por determinación del Comité Técnico cuando la persona periodista no cumpla con sus obligaciones como persona integrante o realice actos que vayan en contra de la política.\n● Cuando no hayan firmado por dos años consecutivos la póliza del seguro de vida.\n● Cuando no validen y/o actualicen su expediente ante el FAP.\n● Si la persona periodista comete violencia política en razón de género.\n13. Instancia Participante.\nLas instancias participantes serán: la SBGro, la SEPLADER, la SEFINA, la SCyTG, la Auditoría\nSuperior del Estado, la Secretaría de Educación-Guerrero, la Secretaría de Salud, la Secretaría de la Mujer, la SGG y la secretaria o secretario técnico del Programa.\n13.1. Instancia Normativa.\nLas instancias normativas serán: la SBGro, la SEPLADER, la SEFINA, la SCyTG, la Auditoría\nSuperior del Estado y la Secretaría Técnica del Comité Técnico del Fondo de Apoyo a Periodistas.\nOperación, la SBGro a través de la Secretaría Técnica del Comité Técnico.\n14. Transparencia.\n14.1. Promoción y Difusión del Programa Social.\nSe establecerá una estrategia de difusión en la SBGro, pudiéndose solicitar el apoyo de la\nDirección General de Comunicación Social del Gobierno del Estado, y se realizarán las acciones conducentes para dar a conocer los requisitos de participación, la corresponsabilidad de las personas afiliadas y los apoyos a otorgar, establecidos en las presentes Reglas de Operación.\nLas Reglas de Operación se publicarán en el Periódico Oficial del Gobierno del Estado de\nGuerrero; asimismo, se establecerán las estrategias de difusión del Programa y las acciones conducentes para dar a conocer los requisitos de participación, la corresponsabilidad de las personas afiliadas y los apoyos a otorgar, a las personas afiliadas.\nPara dar cumplimiento a lo establecido en la Ley Número 207 de Transparencia y Acceso a la\nInformación Pública del Estado de Guerrero, la SBGro, publicará periódicamente toda la información relativa al Programa en la página electrónica https://www.guerrero.gob.mx/dependencia/sectorcentral/secretaria-del-bienestar/\nTambién se informará en la ventanilla única de la SBGro ubicada en el “Recinto de las Oficinas del Poder Ejecutivo del Estado”, el inmueble ubicado en el número 62, en Boulevard René Juárez Cisneros, de la Ciudad de los Servicios, edificio Norte Planta Baja, C.P. 39074, en Chilpancingo de los Bravo, capital del estado de Guerrero, en un horario de 8:30 am a 4:00 pm de lunes a viernes.\n14.2. Contraloría Social.\nCon la finalidad de incrementar la participación ciudadana, se podrá instalar un Comité de\nContraloría Social, como un órgano ciudadano de control, vigilancia y evaluación de las actividades del\nPrograma, conformado por las personas dedicadas al periodismo afiliadas y, quienes de manera específica eficacia, transparencia y honradez.\nEl Comité de Contraloría Social, deberá vigilar y dar seguimiento a las acciones a través de los formatos que componen el expediente de contraloría social, integrada por:\n● Acta de conformación del Comité de Contraloría Social;\n● Lista de asistencia;\n● Acta de acuerdos;\n● Cédula de Evaluación; y\n● Acta de difusión y capacitación.\nEl Comité de Contraloría Social deberá estar constituido por la presidencia, la secretaría y una vocalía mínimamente, elegidas dentro de la población beneficiada, dicho Comité deberá revisar los avances y resultados del Programa, así como la detección de cualquier presunta irregularidad.\nLa vocalía será responsable de hacer llegar las quejas o denuncias recibidas a la SBGro, quien dará respuesta en un plazo no mayor de quince (15) días hábiles a partir de la fecha de recepción.\n14.3. Protección de Datos Personales.\nCuando una persona afiliada obtenga algún beneficio consumado o apoyo del Programa, formará parte de un Padrón Único de Personas Afiliadas, será de carácter público, siendo reservados sus datos personales, de acuerdo con la normatividad vigente y lo expresado por éste en su aviso de privacidad; los cuales en ningún caso podrán emplearse para propósitos de proselitismo político, religioso o comercial, ni para otro fin distinto a lo establecido en las Reglas de Operación del Programa social.\nEn ningún caso las personas servidoras públicas podrán solicitar o proceder de manera diferente a lo establecido en las presentes Reglas de Operación.\n14.4. Quejas y Denuncias.\nLas personas afiliadas pueden presentar sus quejas o denuncias directamente en las oficinas de la SBGro, sobre cualquier hecho, acto u omisión que produzca o pueda producir daños al ejercicio de sus derechos establecidos en las presentes Reglas de Operación.\nLas quejas y denuncias de la ciudadanía derivadas de alguna irregularidad en la operación del\nPrograma podrán realizarse por escrito y serán entregadas de manera directa en la Unidad de Control de\nGestión y Demanda Ciudadana en el domicilio ubicado en el “Recinto de las Oficinas del Poder Ejecutivo del Estado”, el inmueble ubicado en el número 62, en Boulevard René Juárez Cisneros, de la Ciudad de los Servicios, edificio Norte Planta Baja, C.P. 39074, en Chilpancingo de los Bravo, capital del estado de\nGuerrero, o al correo unidadtecnicasedesol@outlook.com\nLos medios por los cuales podrán presentarse quejas ciudadanas son:\n● Por escrito.\n● Por comparecencia de la persona interesada.\n● Por correo electrónico.\n● Vía telefónica.\nLa persona denunciante o persona quejosa deberá proporcionar los datos siguientes:\n● Nombre de la servidora y/o servidor público;\n● Objeto de la denuncia;\n● Nombre y domicilio de la persona quejosa, e\n● Identificación oficial.\nEn caso de que la SBGro responsable del Programa no resuelva la queja, las personas afiliadas, afiliadas o derechohabientes podrán presentar quejas ante la Contraloría Social de la SCyTG, por considerarse indebidamente excluidas del Programa o por incumplimiento de la garantía de acceso al mismo.\n14.5. Acciones de Blindaje.\nLa SBGro, para la operación y ejecución de los recursos estatales que opera el Programa, deberá observar y atender las medidas que emita la SCyTG, el Instituto de Transparencia Acceso a la Información y Protección de Datos Personales del Estado de Guerrero (ITAIGro), el Instituto Electoral y de Participación\nCiudadana del Estado de Guerrero (IEPC), y las demás autoridades competentes con la finalidad de impedir que los apoyos sean utilizados con fines políticos electorales.\nLa papelería, documentación oficial, así como la publicidad y promoción de este Programa deberán incluir la siguiente leyenda: “Este Programa es público y ajeno a cualquier partido político.\nQueda prohibido el uso para fines distintos a los establecidos en el Programa”.\n14.6. Acta de Donación. (Anexo 2).\nEl acta constituye el comprobante de que los recursos se ejercen con transparencia y de acuerdo a las presentes Reglas de Operación. Se anexa formato (Anexo 2)\n15. Perspectiva de Género.\nEn el ámbito de su competencia, el Programa transversalizará la perspectiva de género, identificando y atendiendo las brechas de desigualdad entre las y los periodistas, de acuerdo a los recursos, el acceso y oportunidades entre ellos, con el afán de determinar los mecanismos que incidan en su reducción o eliminación; potenciando la igualdad sustantiva entre mujeres y hombres para alcanzar un desarrollo pleno. para el ejercicio pleno de todos los derechos de las mujeres, asegurando la participación plena, efectiva y la igualdad de oportunidades de liderazgo a todos los niveles decisorios en la vida política, económica y pública, así como la protección de su integridad abordando cualquier riesgo de género existente, eliminando barreras invisibles que puedan desalentar la participación de mujeres periodistas, estableciendo políticas claras contra el acoso y la discriminación, asegurándose de que se apliquen de manera efectiva.\nEstas acciones deben estar encaminadas a alcanzar los objetivos planteados en la Agenda 2030 para el desarrollo sostenible, ODS 5 y 16.\nEspecíficamente, el Padrón del FAP deberá ser progresivamente equitativo y paritario entre el número de periodistas afiliados hombres con el número de mujeres periodistas afiliadas al Programa.\n16. Enfoque de Derechos.\nEl estado de Guerrero como garante de los derechos humanos que toda persona posee, debe actualizar su marco jurídico, para adecuarlo a las necesidades, en primera instancia de una colectividad en general y segunda a un sector como el periodismo.\n17. Acciones Contra el SARS-CoV-2.\nA fin de cumplir con todos los ordenamientos y protocolos establecidos para prevenir los contagios del SARS-CoV-2; se establecen las medidas sanitarias para que preferentemente los trámites, dispersiones y demás servicios como talleres de profesionalización, conferencias, capacitaciones, reuniones, etc., se realicen de manera virtual según corresponda; así mismo los pagos para las afiliadas o afiliados se realizarán por transferencias bancarias.\n18. Anexos que Reflejen la Entrega del Apoyo (Económico, Especie o Servicios). con:\nAnexo 1.- MIR.\nAnexo 2.- Acta de Donación.\nAnexo 3.- Póliza de cheque/transferencia.\nAnexo 2. Acta de Donación\nAnexo 3.- Póliza de cheque/transferencia\nPrimero. El presente Acuerdo entrará en vigor al día siguiente de su publicación en el\nSegundo. Se obroga (SIC) el Acuerdo por el que se emiten las Reglas de Operación del\nPrograma Fondo de Apoyo a Periodistas para el Ejercicio Fiscal 2022, publicadas en la Edición\nNo. 32 alcance I del periodico Oficial del Gobierno del Estado de Guerrero, de fecha 22 de abril de 2022 y el Acuerdo de modificación al Acuerdo por el que se emiten las Reglas de Operación del Programa Fondo de Apoyo a Periodistas; para que se amplíe su vigencia por el periodo que se encuentre en aplicación dicho Programa, publicadas en la Edición No. 32 alcance I del periodico\nOficial del Gobierno del Estado de Guerrero, de fecha 21 de abril de 2023.\nTercero. A partir de la entrada en vigor del presente Acuerdo, las Reglas de Operación del Programa Fondo de Apoyo a Periodistas, subsecuentes o sus modificaciones serán emitidas por la persona titular de la Secretaría de Bienestar del estado de Guerrero, responsable directa de la operación y ejecución de estas.\nDado en el “Recinto de las oficinas del Poder Ejecutivo del estado”, el inmueble ubicado en el edificio Centro, Boulevard René Juárez Cisneros No. 62, Código Postal 39074, Colonia\nCiudad de los Servicios, en Chilpancingo de los Bravo, capital del estado de Guerrero, a los diecisiete días del mes de junio del año dos mil veinticuatro.\nLA GOBERNADORA CONSTITUCIONAL DEL ESTADO DE GUERRERO.\nMTRA. EVELYN CECIA SALGADO PINEDA.\nRúbrica.\nLA SUBSECRETARIA DE GOBIERNO, ASUNTOS JURÍDICOS Y DERECHOS HUMANOS\nENCARGADA DE DESPACHO DE LA SECRETARÍA GENERAL DE GOBIERNO.\nDRA. ANACLETA LÓPEZ VEGA.\nRúbrica.\nEL SECRETARIO DE BIENESTAR DEL ESTADO DE GUERRERO.\nMTRO. PABLO ANDRE GORDILLO OLIVEROS.\nRúbrica.",
  "ordenamiento": "PROGRAMA",
  "jurisdiccion": "GUERRERO",
  "fuente_oficial": "DIARIO OFICIAL DE LA FEDERACION",
  "Fecha de Publicación": "30 \nde Julio de 2024",
  "ULTIMA REFORMA PUBLICADA": null,
  "status": "VIGENTE",
  "es_escaneado": false,
  "tiene_tablas": true,
  "materia": [
    "comunicación social"
  ]
}