{
  "titulo": "Acuerdo por el Que Se Crea el Proyecto de Suministro de Tinacos y Cemento para Personas Vulnerables,",
  "Contenido": "DE OPERACIÓN PARA EL EJERCICIO FISCAL 2020\nTEXTO ORIGINAL.\nPERSONAS VULNERABLES, Y SE EMITEN SUS REGLAS DE OPERACIÓN PARA EL EJERCICIO\nFISCAL 2020.\nGuerrero. - Poder Ejecutivo.\nLICENCIADO HÉCTOR ANTONIO ASTUDILLO FLORES, GOBERNADOR CONSTITUCIONAL\nDEL ESTADO DE GUERRERO, CON FUNDAMENTO EN LO DISPUESTO POR LOS ARTÍCULOS 4o\nDE LA CONSTITUCIÓN POLÍTICA DE LOS ESTADOS UNIDOS MEXICANOS; 167 DE LA LEY\nGENERAL DE SALUD; 3 DE LA LEY DE ASISTENCIA SOCIAL; 4 FRACCIÓN XVIII DEL\nPRESUPUESTO DE EGRESOS DE LA FEDERACIÓN PARA EL EJERCICIO FISCAL 2020; 40 DE LA\nLEY DE COORDINACIÓN FISCAL; 71, 87, 88, 90 NUMERAL 2 Y 91 FRACCIONES I, IX Y XLVI DE LA\nLAS FACULTADES QUE ME CONFIEREN LOS ARTÍCULOS 2, 3, 6, 7, 10, 18 APARTADO A FRACCIÓN\nI, 20 FRACCIÓN III Y 45 DE LA LEY ORGÁNICA DE LA ADMINISTRACIÓN PÚBLICA DEL ESTADO\nDE GUERRERO NÚMERO 08; 15 DE LA LEY SOBRE EL SISTEMA ESTATAL DE ASISTENCIA SOCIAL\nNÚMERO 332; EN RELACIÓN CON EL ARTÍCULO 55 Y ANEXOS 21 Y 21-A DE L DECRETO NÚMERO\n447 DEL PRESUPUESTO DE EGRESOS DEL ESTADO DE GUERRERO PARA EL EJERCICIO FISCAL\n2020 Y LOS LINEAMIENTOS PARA LA ELABORACIÓN DE LAS REGLAS DE OPERACIÓN DE LOS\nPROGRAMAS SOCIALES ESTATALES PARA EL EJERCICIO FISCAL 2017.\nQue el Plan Estatal de Desarrollo 2016-2021 impulsa entre sus prioridades, un Guerrero que garantice el ejercicio efectivo de los derechos sociales de todos los guerrerenses, que vaya más allá del asistencialismo y que conecte al capital humano con las oportunidades que genera la economía en el marco de una nueva productividad social que disminuya las brechas de desigualdad y promueva la más amplia participación social en las políticas públicas.\nLa Constitución Política de los Estado Unidos Mexicanos establece en su artículo 4o que la mujer y el hombre son iguales ante la ley. Esta protegerá la organización y el desarrollo de la familia. asistencialistas y más estructurales para garantizar el desarrollo de quienes menos tienen. Con una en este sector. Uno de los ejes que respaldan esta visión es el eje III.- Guerrero Socialmente\nComprometido. Objetivo 3.7. Fortalecer la asistencia social a grupos vulnerables; Estrategia 3.7.1. Atender\nDE OPERACIÓN PARA EL EJERCICIO FISCAL 2020 permita mejorar su calidad de vida.\nLa Ley Número 479 del Sistema para el Desarrollo Integral de la Familia del Estado de Guerrero\nSistema Estatal para el Desarrollo Integral de la Familia, como un organismo público descentralizado, el cual tiene por objeto I.- Promover el bienestar social y prestar al efecto servicios de asistencia social con apoyo en las normas que dicte la Secretaría de Salubridad y Asistencia y el Sistema Nacional para el\nDesarrollo Integral de la Familia, así como el propio Estado; II.- Apoyar el desarrollo de la familia y de la comunidad; III.- Fomentar la educación, para la integración social; IV.- Impulsar el sano crecimiento físico y mental de la niñez; 2 V.- Atender las funciones de auxilio a las instituciones de asistencia privada que le confíe la dependencia competente, con sujeción a lo que disponga la Ley relativa; VI.-Operar establecimientos de asistencia social en beneficio de menores en estado de abandono, de ancianos y de los minusválidos; VII.- Realizar estudios e investigaciones sobre los problemas de la familia, de los menores, de los ancianos y de los minusválidos; VIII.- Prestar servicios de asistencia jurídica y de orientación social de los menores, ancianos y minusválidos sin recursos; IX.- Intervenir en el ejercicio de la tutela de los menores, que corresponda al Estado, en los términos de la Ley respectiva; X.- Auxiliar al\nMinisterio Público en la protección de incapaces y de los procedimientos civiles y familiares que les afecten, de acuerdo con la Ley; XI.- Procurar permanentemente la adecuación de los objetivos y programas del sistema estatal, a los que lleve a cabo el sistema nacional, a través de decretos, acuerdos, convenios o cualquier figura jurídica encaminada a la obtención de bienestar social, y, XII.- Los demás que les encomienden las Leyes.\nLas personas titulares de las secretarías, dependencias y entidades de la administración pública estatal, así como, las servidoras y servidores públicos autorizados para ejercer recursos públicos del presupuesto de inversión de las mismas, serán responsables de los programas y proyectos de inversión que realicen. Que los apoyos otorgados deberán sujetarse a criterios de objetividad, equidad, transparencia, publicidad, selectividad y temporalidad.\nEl Presupuesto de Egresos de la Federación para el Ejercicio Fiscal 2020, contempla en un apartado que las erogaciones para el Ramo General 33 Aportaciones Federales para Entidades\nFederativas y Municipios, serán distribuidos conforme a lo previsto en el Anexo 22 de este Decreto, el cual se precisa en el Fondo de Aportaciones Múltiples erogaciones para asistencia social.\nEl artículo 55 del Decreto Número 447 de Presupuesto de Egresos del Estado de Guerrero para el Ejercicio Fiscal 2020, establece que con el objeto de asegurar la aplicación eficiente, eficaz, oportuna inversión sujetos a reglas de operación.\nCon sustento en lo anterior, la Secretaría de Planeación y Desarrollo Regional, expidió los\nDE OPERACIÓN PARA EL EJERCICIO FISCAL 2020\nLos objetivos del programa y/o proyecto deberán desarrollarse de manera eficaz y oportuna a fin de consolidar la política estatal ya que dentro de los objetivos y estrategias que plantea el ejecutivo estatal, de igualdad en las oportunidades que les permitan desarrollarse con independencia y plenitud, es por ello que surge este Proyecto con el propósito de mitigar los impactos económicos sociales por las que atraviesan las personas que habiten en zonas rurales, mediante la entrega de proyectos productivos y de servicios.\nEn el Decreto Número 447 del Presupuesto de Egresos del Estado de Guerrero para el Ejercicio\nFiscal 2020, señala que se ejercerán los recursos bajo una política de gasto público, que permita dar cumplimiento a lo que globalmente prevén los ejes rectores del Plan estatal de Desarrollo 2016-2021.\nEn cumplimiento de lo anterior, se ha tenido a bien expedir el siguiente:\nACUERDO POR EL QUE SE CREA EL PROYECTO DE SUMINISTRO DE TINACOS Y CEMENTO PARA\nPERSONAS VULNERABLES, Y SE EMITEN SUS REGLAS DE OPERACIÓN PARA EL EJERCICIO\nFISCAL 2020.\nArtículo 1. Se crea el Proyecto de Suministro de Tinacos y Cemento para Personas Vulnerables, el cual tiene por objeto contribuir a disminuir la desigualdad social entré los guerrerenses, respondiendo de manera cabal a sus expectativas de cambio; articuladora de esfuerzos, incluyente, con rostro humano.\nArtículo 2. Se emiten las Reglas de Operación del Proyecto de Suministro de Tinacos y Cemento para Personas Vulnerables en los que se establecen los principios de eficiencia, eficacia, oportunidad, equitativa y transparencia de los recursos públicos y requisitos que se deben de cumplir para poder acceder ha dicho Proyecto.\nEn las Reglas de Operación se establecen disposiciones que instituyen la ejecución del Proyecto de Suministro de Tinacos y Cemento para Personas Vulnerables, con el objeto de otorgar transparencia y asegurar la aplicación, eficiente, eficaz, oportuno y equitativo de los recursos públicos asignados al mismo, los cuales deberán publicarse en el Periódico Oficial del Gobierno del Estado de Guerrero.\nArtículo 3. El Sistema para el Desarrollo Integral de la Familia del Estado de Guerrero tendrá a cargo la implementación, ejecución, evaluación y administración del Proyecto de Suministro de Tinacos y\nCemento para Personas Vulnerables, bajo los criterios de objetividad, equidad, transparencia, publicidad, selectividad y temporalidad, con estricto apego a la normatividad aplicable, por lo tanto será el encargado de la dispersión y asignación de los recursos del Proyecto apegándose plenamente a las siguientes:\nPERSONAS VULNERABLES PARA EL EJERCICIO FISCAL 2020.\n1. Introducción\n1.1. Antecedentes\nDE OPERACIÓN PARA EL EJERCICIO FISCAL 2020\nEl Sistema Estatal para el Desarrollo Integral de la Familia, a través de la Dirección de Asistencia\nAlimentaría y Desarrollo Comunitario, fomenta y promueve acciones que mitiguen la vulnerabilidad de las personas que son sujeto de asistencia social, a través de acciones de desarrollo comunitario en las que en coordinación con los Sistemas Municipales DIF.\nEn este documento se sustenta la intervención institucional que da inicio en el ejercicio fiscal 2018, como respuesta a la demanda solicitada por la población partiendo de su propia necesidad, por lo que tiene como prioridad la atención a aquellas familias en estado de vulnerabilidad social y de vivienda que habiten en localides de alto y muy alto grado de marginación, mismo que busca fomentar el trabajo comunitario como un elemento clave para que las familias que viven en condiciones de desventaja socioeconómica y de vivienda mejoren sus niveles de vida.\nEn consecuencia, la formulación de un programa y/o proyecto de desarrollo social exige conjugar armónicamente todos los elementos que lleven a la materialización de sus objetivos, estrategias, metas y evaluación de resultados. Por ello el Suministro de Tinacos y Cemento para Personas Vulnerables es, un proyecto social el cual permitirá disminuir el impacto económico de las personas vulnerables a través de acciones que les permitan habitar en condiciones dignas; dentro de los objetivos del gobierno estatal entre ellos está abatir la marginación y el rezago social que enfrentan los grupos sociales vulnerables para proveerles de igualdad en las oportunidades que les permitan desarrollarse con independencia y plenitud.\nQue para su creación y operación tiene su fundamento en la Constitución Política de los Estados en el Periódico Oficial del Gobierno del Estado número 71, alcance I de fecha 04 de septiembre de 2018, Ley General de Salud y Ley de Asistencia Social.\nEl cual tiene como objetivo contribuir a mejorar la calidad de vida de los grupos vulnerables en condiciones de pobreza, a través del suministro de 230 tinacos y 230 toneladas de cemento que coadyuven en su ingreso familiar, atendiéndose a los 81 municipios que integran el Estado, dando prioridad a los municipios de alta y muy alta marginación.\nSe gestionará ante las instancias de Gobierno federales y estatales, los recursos financieros, para llevar a cabo la adquisición de los materiales, insumos y productos necesarios en la operatividad del\nProyecto; así mismo dar a conocer al Sistema Municipal DIF, las Reglas de Operación del Proyecto vigente y proporcionar de forma calendarizada los suministros de los apoyos.\nEl Sistema para el Desarrollo Integral de la Familia, a través de la Dirección de Asistencia a la\nAlimentaria y Desarrollo Comunitario, quien se coordinará con los Sistemas Municipales DIF para llevar a cabo la ejecución y seguimiento del Proyecto.\nEl presupuesto de inversión se tiene contemplado de $1'346,880.00 (Un millón trescientos cuarenta y seis mil ochocientos ochenta pesos 00/100 M.N.), recursos presupuestales que provienen del\nRamo 33.- Aportaciones Federales para Entidades y Municipios, específicamente del Fondo de\nAportaciones Múltiples (Asistencia Social).\nDE OPERACIÓN PARA EL EJERCICIO FISCAL 2020\nGlosario de términos:\nAsistencia Social: Conjunto de acciones tendientes a modificar y mejorar las circunstancias de carácter social que impiden el desarrollo social del individuo, así como la protección física, mental y social de personas en estado de necesidad.\nDIF Guerrero: Sistema para el Desarrollo Integral de la Familia.\nGrupos Vulnerables: Persona o grupo que por sus características de desventaja por edad, sexo, estado civil; nivel educativo, origen étnico, situación o condición física y/o mental; requieren de un esfuerzo adicional para incorporarse al desarrollo y a la convivencia.\nProyecto: Proyecto de Suministro de Tinacos y Cemento para Personas Vulnerables.\nReglas de Operación: Reglas de Operación del Proyecto de Suministro de Tinacos y Cemento para Personas Vulnerables.\nSecretaría de Contraloría: Secretaría de Contraloría y Transparencia Gubernamental.\nSEDIF: Sistema para el Desarrollo Integral de la Familia.\nSEFINA: Secretaría de Finanzas y Administración.\nSEPLADER: Secretaría de Planeación y Desarrollo Regional.\n1.2. Alineación programática\nEn cumplimiento a lo que globalmente prevén los ejes rectores del Plan Estatal de Desarrollo 20162021, el Proyecto, Suministro de Tinacos y Cemento para Personas Vulnerables se enmarca en el eje III.-\nGuerrero Socialmente Comprometido; Objetivos: 3.1. Construir un Estado Garante pleno de los Derechos\nSociales de las Personas y 3.2. Edificar la ruta hacia una sociedad equitativa e incluyente; Estrategias:\n3.1.2. Fortalecer el desarrollo de capacidades de los integrantes de una sociedad con carencias, que permitan contribuir a incrementar su capacidad productiva y su calidad de vida y 3.2.1. Generar programas de desarrollo comunitario por medio de procesos de participación social, a través de:\nLíneas de Acción\n• Fomentar el acceso efectivo de las familias a sus derechos sociales, particularmente de aquellas en pobreza extrema, mediante políticas públicas coordinadas y concurrentes.\n• Potenciar la inversión conjunta de la sociedad organizada y de los órdenes de Gobierno, invirtiendo en proyectos de infraestructura social básica, complementaria y productiva.\nDE OPERACIÓN PARA EL EJERCICIO FISCAL 2020\nAsí mismo se alinean a lo estipulado en el Programa Sectorial \"Desarrollo y Asistencia Social\"\n2016-2021, cuyo objetivo es atender a personas vulnerables, a través de desarrollar capacidades y su calidad de vida y sus núcleos familiares, logrando fortalecer el tejido social en localidades vulnerables.\n1.3. Diagnóstico\nEl alto nivel de informalidad de la economía nacional y la marginación de numerosos municipios y localidades a lo largo de todo el país, provoca que la inestabilidad del empleo sea considerada como uno de los principales motivos de preocupación dentro de los hogares mexicanos; que la pérdida del empleo y la consecuente disminución de los ingresos aún de manera temporal tienen graves consecuencias sobre la pobreza, fundamentalmente porque la falta de empleo conduce a una importante disminución del capital económico familiar, mayor presión sobre los recursos naturales, así como el abandono de la educación y el fomento al endeudamiento, estas afectaciones frecuentemente persisten aun cuando sus miembros se reintegran a las actividades productivas y remuneradas.\nEl trabajo informal en países de economía subdesarrollada como México, está altamente asociada con el autoempleo, la carencia de plazas laborales que brinden una mayor seguridad salarial y mejores condiciones de trabajo orilla a casi el 60% de los buscadores de empleo a resolver por sí mismos su condición de desempleados y generalmente lo logran mediante pequeñas inversiones en el sector comercio y de servicios.\nEsto mismo aplica para nuestro Estado ya que la oferta laboral puede disminuir en algunas regiones a lo largo del año debido a emergencias o por efecto de los ciclos productivos, afectando principalmente a la población de escasos recursos que enfrenta periódicamente etapas con una grave disminución en sus ingresos y patrimonio.\nPor ello las políticas de empleo estatal deben considerar además del fomento a la creación de empleos formales e informales, la ejecución de acciones que permitan disminuir el impacto del desempleo temporal; una de las alternativas para enfrentar dicho fenómeno es la implementación de proyectos que brinden a los hogares el auto emplearse y/o generen empleo que mitigando los impactos económicos sociales.\nQue dentro de los objetivos y estrategias que plantea el ejecutivo estatal, está abatir la marginación oportunidades que les permitan desarrollarse con independencia y plenitud; asimismo, plantea elevar la productividad de las personas para que cuenten con mejores opciones de empleo e ingreso, que les permitan reducir sus niveles de pobreza.\nAunado a lo anterior el Estado es sumamente montañoso, escarpadas serranías y profundos barrancos lo atraviesan en todas direcciones, el 82% del Estado presenta clima cálido semihúmedo, 9% es seco y semiseco, el 5% templado subhúmedo, el 3% cálido húmedo y el 1% es templado húmedo. La temperatura media anual es de 25°c. La temperatura mínima promedio es de 18°c y la máxima de 32°c.\nDE OPERACIÓN PARA EL EJERCICIO FISCAL 2020\nExisten comunidades con alto y muy alto grado de marginación, las cuales por su situación seriamente afectadas; dañando principalmente las viviendas ya que carecen de las especificaciones mínimas requeridas en su construcción y con pisos de tierra, siendo estas de materiales frágiles y rudimentarios que con el paso del tiempo se deterioran y por consecuencia carecen de depósitos de almacenamiento de agua; por ello el Sistema Estatal diseñó el Proyecto de Suministro de Tinacos y\nCemento para Personas Vulnerables, beneficiando a 460 familias; de un total de 895,157 hogares de los cuales 293 086 están conformadas por Jefas de Familias que es el 33% y 602 071, se conforman por Jefes de Familia que en términos porcentuales le corresponde el 67%; considerando la suficiencia presupuestal para el ejercicio vigente y los criterios de focalización y priorización.\nA continuación, se detalla el número de beneficiarios del Proyecto durante el periodo 2017-2019, de acuerdo al cuadro que se desglosa a continuación.\nEJERCICIO FISCAL NUMERO DE BENEFICIARIOS\n2017 480\n2018 444\n2019 460\n2. Dependencia o entidad responsable del proyecto\nLa instancia ejecutora será el Sistema para el Desarrollo Integral de la Familia, a través de la\nDirección de Asistencia Alimentaria y Desarrollo Comunitario, quien se coordinará con los Sistemas\nMunicipales DIF para llevar a cabo la ejecución y seguimiento del proyecto, mismo que tiene como sustento legal para su creación y ejecución el siguiente:\n• Constitución Política de los Estados Unidos Mexicanos.\n• Ley General de Salud.\n• Ley de Asistencia Social.\n• Ley General para la Inclusión de las Personas con discapacidad.\n• Ley Número 817 para las Personas con Discapacidad del Estado.\n• Ley Número 479 del Sistema para el Desarrollo Integral de la Familia del Estado de Guerrero.\n• Ley Número 454 de Presupuesto y Disciplina Fiscal del Estado de Guerrero.\n• Ley Orgánica de la Administración Pública del Estado de Guerrero Número 08.\n• Ley sobre el Sistema Estatal de Asistencia Social Número 332.\n• Decreto Número 196 por medio del cual la Sexagésima Primera Legislatura al Honorable\n2016-2021.\n• Programa Sectorial Desarrollo y Asistencia Social 2016-2021.\nDE OPERACIÓN PARA EL EJERCICIO FISCAL 2020\n• Decreto Número 447 del Presupuesto de Egresos del Estado de Guerrero para el Ejercicio Fiscal\n2020.\n• Estrategia Local \"Guerrero Contigo\".\n• Reglamento Interior del Sistema para el Desarrollo Integral de la Familia del Estado de Guerrero.\n• Manual de Organización del DIF Guerrero.\n• Y todos aquellos ordenamientos normativos aplicables.\n3. Objetivos y alcances\n3.1. Objetivo general\nContribuir a mejorar la calidad de vida de los grupos vulnerables en condiciones de pobreza, para que cuenten con un espacio que les proporcione mejorar sus carencias sociales en su hogar (calidad de su vivienda) y coadyuven en su ingreso familiar con el suministro de 230 tinacos y 230 toneladas cemento.\n3.2. Objetivo específicos\n• Mejorar la calidad de la vivienda\n3.3. Alcances\nLa operación o ejecución del Proyecto surge para mitigar la carencia de la vivienda y garantizar el derecho a la Seguridad Social y Vivienda de la población que viven en situación de pobreza y/o sin empleo a través del suministro de 230 tinacos y 230 toneladas de cemento coadyuvando mejorando su economía familiar y comunitaria.\nPoblación objetivo: La constituyen las familias en estado de vulnerabilidad que habiten en municipios o localidades con alto o muy alto grado de marginación, considerando la suficiencia presupuestal para el ejercicio vigente y los criterios de focalización y priorización del Proyecto.\n4. Metas físicas\nLa Cobertura del recurso se destina en las localidades y municipios de alta y muy alta marginación con población en estado de vulnerabilidad social beneficiando aproximadamente a 460 familias, dicho apoyo es entregado directamente a la beneficiaria y/o beneficiario en puntos sedes ubicados en su municipio correspondiente.\n5. Programación presupuestal\nSubsidiado a través de recursos presupuéstales que provienen del Ramo 33.- Aportaciones\nFederales para Entidades y Municipios, específicamente del Fondo de Aportaciones Múltiples (Asistencia\nSocial), para el Suministro de Tinacos y Cemento para Personas Vulnerables por un monto de\n$1,346,880.00 (Un millón trescientos cuarenta y seis mil ochocientos ochenta pesos 00/100 M.N.), el cual tiene un costo promedio por beneficiaria y/o beneficiario de $2,928.00 (Dos mil novecientos veintiocho\nDE OPERACIÓN PARA EL EJERCICIO FISCAL 2020 pesos 00/100 M.N.). y en el Decreto Número 447 del Presupuesto de Egresos del Estado de Guerrero para el Ejercicio Fiscal 2020, señala que se ejercerán los recursos bajo una política de gasto público, que permita dar cumplimiento a lo que globalmente prevén los ejes rectores del Plan Estatal de Desarrollo 2016-2021.\nCRONOGRAMA FINANCIERO\nENERO FEBRERO MARZO ABRIL MAYO\n1,346,880.00\n0.00 0.00 0.00 0.00\nNOTA: PUEDE EXISTIR VARIACION EN RELACION A LO APROBADO POR EL DOF. Y/O POR LAS NECESIDADES\nPROPIAS DEL SEDIF.\n6. Requisitos y procedimientos de acceso\n6.1. Difusión\nEl Sistema para el Desarrollo Integral de la Familia a través de los diferentes medios de comunicación y redes sociales da conocer los diferentes programas y/o proyectos de asistencia social, así como los requisitos, que ejecuta y opera en coordinación con las Direcciones que lo integran, se encuentran en las oficinas ubicadas en Boulevard. Rene Juárez Cisneros, Colonia Ciudad de los Servicios y en Av.\nGabriel Leyva s/n esq. Ruffo Figueroa, Col. Burócratas, C.P. 39090, Chilpancingo, Guerrero, con un horario de atención de 8:00 am a 3:00 pm y/o los teléfonos 01(747) 4725595, 01(747)47256 00, 01(747)47 25672 ext 1151 y 1159. Así mismo al correo electrónico: alimentariadif@prodigy.net.mx, subdireccionalimentaria@prodigy.net.mx\nLas reglas de operación de los programas y proyectos son difundidas por personal capacitado de las Direcciones y en la página web https://www.guerrero.gob.mx del Portal del Gobierno del Estado, además de su publicación en el Periódico Oficial del Gobierno del Estado, estarán disponibles para su consulta en las oficinas de la Dirección de Asistencia Alimentaria y Desarrollo Comunitario, así como en la página electrónica del Sistema para el Desarrollo Integral de la Familia http://www.dif.guerrero.gob.mx\nEl responsable directo de la ejecución es la Dirección de Asistencia Alimentaria y Desarrollo\nComunitario, a través de la Subdirección de Desarrollo Comunitario, ubicada Av. Gabriel Leyva s/n esq.\nRuffo Figueroa, Col. Burócratas, C.P. 39090, Chilpancingo Guerrero, a los teléfonos (01747) 47 2 55 95, (01747) 47 2 56 00, (01747) 47 2 56 72 ext. 1155. Así mismo al correo electrónico: subdescomdif@prodigy.net.mx Para información sobre el Proyecto.\n6.2. Requisitos de acceso\n• Los interesados deberán presentar oficio de solicitud en formato libre en las instalaciones del DIF\nGuerrero con domicilio en el Centro de Rehabilitación Integral Guerrero, Boulevard Lic. René Juárez\nCisneros S/N, Col. Ciudad de los Servicios, Chilpancingo, dirigido a la Presidenta o Director General del\nDIF Guerrero para ser considerado dentro del Proyecto, anexando copia fotostática de la siguiente documentación:\nDE OPERACIÓN PARA EL EJERCICIO FISCAL 2020\n✓ Credencial de elector.\n✓ CURP.\n✓ Comprobante de domicilio.\n• La solicitud es turnada a la Dirección de Asistencia Alimentaria y Desarrollo Comunitario para su atención, quien en un plazo no mayor a 60 días hábiles dará respuesta a la misma.\n• La Dirección de Asistencia Alimentaria y Desarrollo Comunitario aplica estudio socioeconómico al solicitante para determinar si será beneficiario del Proyecto.\n• Se realiza la entrega del apoyo de manera personal o en el municipio beneficiado, solicitándole al beneficiario firme acta de donación que acredite la entrega.\n6.3. Procedimiento de acceso\nEl Proyecto Suministro de Tinacos y Cemento para Personas Vulnerables, surge por la necesidad de atender el problema de la vivienda que enfrenta la población vulnerable, a través de la demanda ciudadana y/o peticiones que realiza la población vulnerable con el otorgamiento de estos paquetes, se logrará mejorar las viviendas, logrando así el bienestar de las familias, atendiendo a los 81 municipios que conforman nuestro Estado, dando prioridad a los municipios de alta o muy alta marginación.\nSerán beneficiados con el apoyo, las personas que cumplan con las siguientes características y con la disponibilidad presupuestal del Proyecto:\n1. Familias en estado de vulnerabilidad, mujeres embarazadas, mujeres en periodo de lactancia, adultos mayores y personas vulnerables por ingresos o que presenten alguna discapacidad y no puedan tener un empleo formal.\n2. Habitar en el municipio o localidad de alto, muy alto grado de marginación.\nToda persona podrá conocer el estado de su trámite, y su aceptación o no al proyecto, de acuerdo con las reglas de operación vigentes. Las beneficiarias y/o beneficiarios tendrán derecho a ser tratado con\n• Recibir la información necesaria de manera clara y oportuna para participar en el Proyecto.\n• Un trato digno y respetuoso oportuno con calidad y equitativo sin discriminación alguna.\n• Reserva y privacidad de su información personal.\n• Las beneficiarias y beneficiarios formarán parte del padrón único de beneficiarios, el cual será de carácter público, siendo reservados sus datos personales, de acuerdo con la Ley Número 207 de\n6.4. Requisitos de permanencia, causales de baja o suspensión temporal\n<DE OPERACIÓN PARA EL EJERCICIO FISCAL 2020\nVisita de seguimiento a la población beneficiada, con la finalidad de constatar la situación socioeconómica y seguimiento a las necesidades prioritarias, la población sujeta de atención deberá cumplir con:\n• Las Reglas de Operación del Proyecto.\n• Utilizar los apoyos otorgados de manera adecuada y para los fines a los que les otorgan y con que fueron autorizados evitando cualquier uso distinto de la misma. Los cuales en ningún caso podrán emplearse para propósitos de proselitismo político, religioso o comercial, ni para ningún otro fin distinto al establecido en las Reglas de Operación del proyecto social.\n• Permitir visita de verificación con la finalidad de validar la información proporcionada en sus expedientes correspondientes.\n• Facilitar los trabajos de supervisión, en cualquier momento después de haber recibido el apoyo.\nLa población beneficiada del Proyecto de Suministro de Tinacos y Cemento para Personas\nVulnerables, que incumplan en las disposiciones normativas de estas Reglas de Operación, perderán las prerrogativas que dichas disposiciones establecen.\n6.5. Modos de entrega del beneficio\nLos apoyos serán distribuidos directamente a la población beneficiada en puntos sedes de cada\nRegión del Estado, o en su caso, el beneficiario podrá acudir a recoger el apoyo a las oficinas de la\nDirección de Asistencia Alimentaria y Desarrollo Comunitario. Este Proyecto contempla mejorar las viviendas de las familias mediante el otorgamiento de:\nA) Suministro de Tinacos:\n✓ Un tinaco tricapa de 1100 lts. con filtro estándar, válvula de llenado, multiconector, flotador del No.\n5, jarro de aire.\nB) Suministro de Cemento;\n✓ Un paquete, consta de una tonelada de cemento gris.\nComo objetivo a corto plazo, se dará continuidad a la entrega de cada apoyo solicitado, cubriendo cada uno los requisitos solicitados en las presentes Reglas de Operación, misma que será otorgado en su municipio de residencia o en su caso en el almacén general del SEDIF a la población vulnerable. realicen las autoridades estatales en giras de trabajo en los municipios o comunidades, siempre y cuando cubran los requisitos solicitados en las presentes Reglas de Operación.\n7. Procedimientos de instrumentación\n7.1. Operación\nEl Sistema Estatal DIF tendrá las siguientes responsabilidades:\nDE OPERACIÓN PARA EL EJERCICIO FISCAL 2020 llevar a cabo la adquisición de los materiales, insumos y productos necesarios en la operatividad de los programas y/o proyectos. b. Dar a conocer al Sistema Municipal DIF, las Reglas de Operación del Proyecto proporcionar al\nSistema Municipal DIF, de forma calendarizada los suministros de productos de los programas y/o proyectos. c. Vigilar y verificar que los apoyos sean otorgados directamente a la población beneficiada. d. Proporcionará almacenes regionales, para guarda, custodia de los productos que integran el\nProyecto; que contarán con personal capacitado para su manejo y distribución. e. Actualizar y profesionalizar los conocimientos del personal operativo del Sistema Estatal DIF y del Sistema Municipal DIF, a través de capacitaciones a fin de contar con las herramientas básicas para la operatividad de los programas y/o proyectos. f. Recepcionar de los Sistema Municipal DIF la información requerida para comprobación de los programas y/o proyectos con base a las Reglas de Operación vigentes. g. Procesará la información a que se refiere el punto anterior y remitirla de acuerdo al calendario de entregas, a fin de comprobar los recursos canalizados al municipio. h. Elaborar a inicio de cada ejercicio fiscal, el proyecto de los programas y documentos que contemplarán la aplicación y operatividad de los proyectos con los importes correspondientes. i. Proporcionar cursos de capacitación al personal de Sistema Municipal DIF, relativos a la operatividad de los programas y/o proyectos; así como asesoramiento en la elaboración propuesta de proyectos.\nSerán obligaciones del Sistema Municipal DIF las siguientes: a. El Sistema Municipal DIF se obliga a cumplir con la implementación de los proyectos productivos establecidos en las Reglas de Operación de la subdirección de desarrollo que regula el Proyecto; salvo la pena de incurrir en responsabilidades administrativas. b. Determinará de manera conjunta la población potencial de su municipio tomando en consideración el tipo de beneficiario de todos los programas y/o proyectos a solicitar, con esta información y en coordinación con el Sistema Estatal DIF, atenderá a la población que se encuentre en situación vulnerabilidad de localidades de alta y muy alta marginación. c. Integrará y enviará los expedientes, así como los padrones físicos de los beneficiarios de los programas y/o proyectos solicitados a la Subdirección de Desarrollo Comunitario, de igual forma informará a los beneficiarios que los datos personales recabados serán protegidos en términos de los principios de protección de datos personales contenidos en la ley de la materia y demás normativas aplicables. d. Integrará los padrones de los beneficiarios con sus respectivos expedientes del Proyecto objeto de estas Reglas de Operación. Remitiendo al Sistema Estatal DIF el padrón físico, digital y expedientes correspondiente comprobación de los proyectos. e. Designar personal del Sistema Municipal DIF que realice las funciones de seguimiento y supervisión de los programas y/o proyectos. f. Participar en acciones de apoyo logístico para la distribución de los programas y proyectos. g. Es competencia del Sistema Municipal DIF, trasladar los materiales que corresponden a los programas y/o proyectos, a las comunidades beneficiadas, en una unidad vehicular. Será responsabilidad del municipio el resguardo y el buen uso de los materiales que se recepcionen, en el entendido que, de\nDE OPERACIÓN PARA EL EJERCICIO FISCAL 2020 existir algún desvío de los mismos, el Sistema Estatal DIF cancelará inmediatamente el suministro del programa y/o proyecto e iniciará un procedimiento ante la contraloría interna del sistema estatal, para determinar las sanciones a que sean acreedores.\nPara garantizar la atención completa del beneficiario, se realizarán las siguientes acciones:\n• Adquisición de los materiales que cumplan con las especificaciones técnicas de calidad.\n• Asegurar el correcto almacenamiento y distribución de los materiales, hasta su entrega al beneficiario.\n• Focalizar los beneficiarios de los programas y/o proyectos con base a los indicadores socioeconómicos.\n• Coordinar la entrega de apoyos a la población beneficiada con los Sistemas Municipales DIF, a través de convenios de colaboración y conforme a lo establecido en las Reglas de Operación.\n• Promover la participación social a través de los Sistema Municipal DIF en la formación de comités entre la población beneficiaria, para la recepción, entrega y vigilancia de los apoyos.\n• Promover la formación y operación de grupos de contraloría social para el seguimiento del\nProyecto.\n• Fortalecer la operación de los programas y/o proyectos promoviendo la inclusión general de la sociedad.\nLos datos de los beneficiarios, así como la información generada y administrada se regirán por la\nLey Número 207 de Transparencia y Acceso a la Información Pública del Estado de Guerrero. Este\nProyecto, contempla las herramientas necesarias para desempeñar el autoempleo para mejorar la economía familiar y comunitaria mediante el otorgamiento de:\nA) Suministro de Tinacos:\n✓ Un tinaco tricapa de 1100 lts. con filtro estándar, válvula de llenado, multiconector, flotador del No.\n5, jarro de aire.\nB) Suministro de Cemento;\n✓ Un paquete, consta de una tonelada de cemento gris.\n7.2. Gastos de operación\nEl presupuesto asignado del Proyecto es a través, del Fondo de Aportaciones Múltiples, no contempla Gastos de Operación.\n8. Transparencia\n8.1. Difusión\nLa Dirección de Asistencia Alimentaria y Desarrollo Comunitario, difundirá a través de diferentes medios de comunicación; trípticos, periódico, redes sociales en las cuales se dará a conocer la información relacionada con las características del suministro de tinacos y cemento para personas vulnerables.\nDE OPERACIÓN PARA EL EJERCICIO FISCAL 2020 por parte de las autoridades locales; así mismo se dará a conocer en la página web marginada, proyecto y nombre de la población beneficiada, así como en la página electrónica del Sistema para el Desarrollo Integral de la Familia http://www.dif.guerrero.gob.mx; las copias de los expedientes estarán disponibles oportunamente para su consulta en las oficinas del Sistema ubicadas en Boulevard.\nRene Juárez Cisneros, Colonia Ciudad de los Servicios y en Av. Gabriel Leyva s/n esq. Ruffo Figueroa, Col. Burócratas, C.P. 39090, Chilpancingo, Guerrero; por otra parte, la papelería, documentación oficial, así como la publicidad y promoción de los programas y proyectos, deberán incluir la leyenda descrita en el apartado de \"Blindaje Electoral\".\nLa información de montos y beneficiarios deberá ser publicada en los términos de la Ley Número\n207 de Transparencia y Acceso a la Información Pública del Estado de Guerrero. Una vez autorizadas estas Reglas de Operación, por las instancias correspondientes, estarán disponibles para su consulta en las oficinas de la Dirección de Asistencia Alimentaria y Desarrollo Comunitario, y el responsable directo de la ejecución será a través de la Subdirección de Desarrollo Comunitario, ubicada Av. Gabriel Leyva s/n esq.\nRuffo Figueroa, Col. Burócratas, C.P. 39090, Chilpancingo, Guerrero, a los teléfonos (01747) 47 2 55 95, (01747) 47 2 56 00, (01747) 47 2 56 72 ext. 1155. Así mismo al correo electrónico: subdescomdif@prodigy.net.mx para información sobre el Proyecto.\n8.2. Blindaje electoral\nLa operación y ejecución de los recursos estatales destinados al Proyecto, deberán observar y atender las medidas que emita la Secretaría de Contraloría y Transparencia Gubernamental, para coadyuvar a que éstos, no sean utilizados con fines políticos, por lo que, la papelería, documentación oficial, así como la publicidad y promoción del Proyecto deberán incluir la siguiente leyenda:\n\"Este proyecto es público, ajeno a cualquier partido político. Queda prohibido el uso para fines distintos a los establecidos en el proyecto.\"\n8.3. Supervisión y control\nLa Dirección de Asistencia Alimentaria y Desarrollo Comunitario deberá reportar mensualmente a la Dirección de Planeación del DIF Guerrero, las acciones ejercidas y los resultados obtenidos, quien a su vez reportará a la Secretaría de Planeación y Desarrollo Regional (SEPLADER), Secretaría de Finanzas y\nAdministración (SEFINA) ya la Secretaría de Contraloría y Transparencia Gubernamental trimestralmente, (CONAC) y con base en los indicadores de resultados previstos en las Reglas de Operación; mismos que se deberán presentar a más tardar a los quince días hábiles posteriores a la terminación de cada trimestre.\nLos padrones de la población beneficiada serán requisitados por los Sistemas Municipales DIF, los padrones de beneficiarios de los 81 municipios de la entidad mismo que serán remitidos a las instancias o dependencias operadoras.\nDE OPERACIÓN PARA EL EJERCICIO FISCAL 2020\n8.4. Mecanismos de evaluación e indicadores\n8.4.1. Evaluación cuales serán reportados a la Dirección de Planeación para la integración de los informes correspondientes.\n8.4.2. Indicadores\nTIPO DE UNIDAD MEDIO DE UNIDAD\nNIVEL FORMULA DE SUPUESTO\nOBJETIVO\nOBJETIVO INDICADOR\nCALCULO\nIND ICAD DE VER IFICASI RE SPONSAB\nOR MEDIDA ON LE\nGarantizar el ejercicio Las familias efectivo de obtienen\nPorcentaje de (Familias los Familias Subdirección de mejores\nFIN derechos b les\n/ m ilia E stratégic be neficiad ri os desarrollo oportunid ade sociales de as comunitario s para su beneficiadas beneficiar)x100 todos los desarrollo\nGuerrerens integral\nMejorar las condicione s de vida de quienes Lograr que viven en cada familia comunidad vulnerable\nPorcentaje (total de solicitudes\nPROPOSITO l icitudes\n/ total de E stratégic f ic a da marginació n as comunitario instrumento atendidas recibidas)x100 mediante el de impulso de supervivenci procesos a desarrollo comunitario\nProporcion Porcentaje de Apoyos\nBrindar\nCOMPONENT ar proyectos proporcionados/ap Estratégic\nFamilias Avance s Subdirección de proyectos\nES proyectos proporcionad oyos programados * o as financieros comunitario condiciones de productivos os 100 nuestra región\nDE OPERACIÓN PARA EL EJERCICIO FISCAL 2020\nLa revisión de reglas de Establecer\nReglas de Avances Subdirección de permite operación reglas de operación o os físicos desarrollo para accesar a publicadas financieros comunitario mejorar el los proyectos programa\nLa difusión Establecimie del Oficios de nto de fechas\nAvances Subdirección de proyecto en invitación a Convenios de Estratégic Document apropiadas los 81 los colaboración o os físicos desarrollo para las financieros comunitario municipios municipios entregas de\nA CTIVIDADE del estado los proyectos\nRealizar padrones servirán para Generar un subir datos Porcentaje de\nNumero de cruces\nFamilias Subdirección de padrón de n eficiario\n/ stratégic b e neficiad P ri os r io\n*100 confiable plataforma s de SIFGE y transparen\n8.5. Auditoría\nEl ejercicio del recurso y la operatividad del Proyecto, están sujetos a las disposiciones estatales aplicables y podrá ser auditado por la Secretaría de Contraloría y Transparencia Gubernamental, así como por la Auditoría Superior del Estado y Auditoría Superior de la Federación, conforme a la legislación vigente y en el ámbito de sus respectivas competencias.\nEl Sistema DIF Guerrero dará todas las facilidades a dichas instancias para realizar, en el momento en que lo juzguen pertinente, las auditorías que consideren necesarias; así como el seguimiento y la solventación a las observaciones planteadas por los órganos de control.\n8.6. Recursos no devengados y aquellos que por cualquier motivo no estuviesen devengados al 31 de diciembre del presente ejercicio fiscal.\n8.7. Contraloría social\nCon la finalidad de incrementar la participación ciudadana, se crearán comités de Contraloría\nSocial, como un órgano ciudadano de control, vigilancia y evaluación de las actividades del Proyecto,\nDE OPERACIÓN PARA EL EJERCICIO FISCAL 2020 conformados por las beneficiarias y/o beneficiarios, los sectores sociales, y los representantes de la localidad, quienes de manera específica supervisarán la gestión gubernamental, y que los manejos de los recursos públicos se realicen en términos de transparencia, eficacia, legalidad y honradez.\nLos objetivos específicos de este Órgano de Contraloría Social son:\n• Hacer más transparentes las decisiones y la ejecución de los recursos.\n• Incrementar la participación ciudadana.\n• Fomentar la organización social.\n• Inhibir los actos de corrupción y de cooptación social, política y electoral.\n• Incrementar la eficiencia de los recursos públicos.\n• Fortalecer la cultura de la legalidad.\n• Mejorar la rendición de cuentas.\n• Perfeccionar la democracia e incorporar la evaluación ciudadana.\nLas funciones de los comités de Contraloría Social son:\na) Integración: Se conforman con la representación de la comunidad beneficiada por el Proyecto, y fungirán como interlocutores con el DIF Guerrero, en el ejercicio de la contraloría social. El vocal será, el responsable de hacer llegar las quejas o denuncias recibidas al DIF Guerrero, quien dará respuesta en un plazo no mayor de 15 días a partir de la fecha de recepción de la queja o denuncia.\nb) Capacitación y asesoría: Para impulsar la realización de las actividades de contraloría social se brindará capacitación y asesoría, las servidoras y servidores públicos que intervienen en la operación del\nProyecto, así como a los integrantes de los comités locales, para que estos realicen adecuadamente sus actividades de seguimiento y vigilancia.\nc) Seguimiento: Se deberá integrar un Programa de Trabajo a través del cual se debe incluir la descripción de las actividades, responsables, metas y calendarización de las actividades para su cumplimiento.\nEl Director General o el personal que designe el DIF Guerrero, serán los encargados de conformar los comités de Contraloría Social, asimismo darán acompañamiento durante las actividades de control, seguimiento y vigilancia del Proyecto.\nEl Comité de Contraloría Social debe estar constituido por una Presidencia, una Secretaría y una\nVocalía mínimamente, electos de entre la población beneficiada en donde se va a realizar la entrega del\nProyecto, y tendrá que ser vigilado por un solo comité, el cual deberá controlar, vigilar y dar seguimiento al\nProyecto a través de los formatos que integran el expediente comunitario, integrado por:\n1. Acta de Conformación del Comité de Contraloría Social.\n2. Reunión con beneficiarias y beneficiarios.\n3. Ficha Informativa del Proyecto.\n4. Cédula de Vigilancia del Proyecto.\nDE OPERACIÓN PARA EL EJERCICIO FISCAL 2020\n5. Actividades de Difusión y Capacitación.\n6. Quejas, Denuncias o Reconocimientos.\n7. Informe Anual.\n8.8. Formas de participación social\nCon apego en lo dispuesto en la Ley Número 684 de Participación Ciudadana del Estado Libre y\nSoberano de Guerrero, se establece que la sociedad podrá participar activamente en la Planeación, Programación, Implementación y Evaluación de los Programas Sociales de Desarrollo Social, por ello las beneficiarias y beneficiarios participarán en la etapa de la implementación y podrán supervisar la gestión gubernamental, que el manejo de los recursos públicos se realicen en términos de transparencia, eficacia, legalidad y honradez del Proyecto de acuerdo en lo estipulado en estas Reglas de Operación.\nParticipantes Etapa en la Forma de Modalidad que participa Participación\nBeneficiarias/ Implementación Comités de Seguimiento\nBeneficiarios Contraloría\n8.9. Procedimiento de queja o inconformidad ciudadana\nLa población beneficiada puede presentar quejas y denuncias ante las instancias correspondientes sobre cualquier hecho, acto u omisión que produzca o pueda producir daños al ejercicio de sus derechos establecidos en las presentes Reglas de Operación o contravengan sus disposiciones y de la demás normatividad aplicable en: a. El Sistema DIF Guerrero.\nCorreo electrónico: buzon.dif@guerrero.gob.mx\nDomicilio: Centro de Rehabilitación Integral Guerrero. Boulevard Lic. René Juárez Cisneros S/N, Col. Ciudad de los Servicios. Chilpancingo, Guerrero. C.P. 39095. b. La Secretaria de Contraloría y Transparencia Gubernamental.\nTeléfonos: (474) 47 1 97 41\nDomicilio: Palacio de Gobierno Primer Piso Edificio Norte, Blvd. R. Juárez Cisneros 62 Col. Ciudad de los Servicios. Chilpancingo, Guerrero. C.P. 39075.\nProyecto, podrá presentar por escrito, por comparecencia, por correo electrónico o vía telefónica y deberá proporcionar los siguientes datos:\n•Nombre del servidor público.\n•Área de adscripción.\nDE OPERACIÓN PARA EL EJERCICIO FISCAL 2020\n• Objeto de la denuncia.\n•Nombre y domicilio del quejoso.\n• Identificación oficial.\n8.10. Mecanismos de exigibilidad\nLos casos en los que se podrán exigir los derechos por incumplimiento o por violación de los mismos pueden ocurrir en al menos los siguientes casos:\n✓ Cuando una persona solicitante cumpla con los requisitos y criterios de inclusión para acceder a determinado derecho.\n✓ Cuando la persona solicitante exija que se cumpla con dicho derecho de manera integral en tiempo y forma.\nSerá la Secretaría de Contraloría y Transparencia Gubernamental del Gobierno del Estado quién atenderá las denuncias de violación e incumplimiento de derechos en materia de Desarrollo Social.\n8.11. Acta de entrega-recepción\nLa instancia ejecutora conformará y resguardará el expediente de los beneficiarios incluyendo su acta de donación correspondiente de cada uno, dada la naturaleza del apoyo otorgado, se realiza en apego al control del gasto público.\n9. Criterios de selección y elegibilidad\n9.1. Método de selección de beneficiarios\nSerán beneficiados con el Proyecto, los solicitantes que cumplan con las siguientes características:\n• Familias en estado de vulnerabilidad, mujeres embarazadas, mujeres en periodo de lactancia, tener un empleo formal.\n• Habitar en el municipio o localidad de alto, muy alto grado de marginación.\n10. Mecánica de operación\n10.1. Instancia ejecutora\nDirección de Asistencia Alimentaria y Desarrollo Comunitario, quien deberá operar con apego a la programación, presupuestación, calendario de ejecución, ejercicio y control del gasto público.\n10.2. Instancia administrativa y/o normativas\nDE OPERACIÓN PARA EL EJERCICIO FISCAL 2020\nDirección de Asistencia Alimentaria y Desarrollo Comunitario, la Secretaria Contraloría y Transparencia\nGubernamental y la Auditoria Superior del Estado en el ámbito de sus respectivas competencias, quienes darán seguimiento a los objetivos y metas del Proyecto.\n10.3. Delimitación de atribuciones\nEl DIF Guerrero establecerá los mecanismos de coordinación necesarios para garantizar que sus programas, proyectos y acciones no se contrapongan, afecten o presenten duplicidades con otros programas, proyecto o acciones del gobierno estatal; la coordinación institucional y vinculación de acciones busca potenciar el impacto de los recursos, fortalecer la cobertura de las acciones, detonar la complementariedad y reducir gastos administrativos.\n11. Derechos, obligaciones y sanciones de los beneficiarios de programas sociales\n11.1. Derechos\n• Recibir trato digno, respetuoso y equitativo sin discriminación alguna, por el personal de las distintas áreas que participen dentro del Proyecto.\n• Reserva y privacidad de la información personal.\n• Acceder a la información necesaria del proyecto, sus Reglas de Operación, recursos y cobertura.\n• Solicitar y recibir información sobre el estado que guarda su trámite.\n• Recibir los servicios y prestación del Proyecto conforme a las Reglas de Operación, salvo que le sea suspendido el apoyo por alguna razón justificable.\n11.2. Obligaciones\n• Proporcionar la información socioeconómica bajo protesta de decir verdad que les sea requerida por el DIF Guerrero, en los términos que establezca la normatividad correspondiente.\n• Utilizar los apoyos para los fines con que fueron autorizados evitando cualquier uso distinto de la misma.\n• Facilitar los trabajos de verificación, en cualquier momento después de otorgado el apoyo.\n11.3. Sanciones estos se otorgan, perderán las prerrogativas, establecidas en los numerales 6.2 y 6.3.\n12. Interpretación\nDE OPERACIÓN PARA EL EJERCICIO FISCAL 2020\nLa interpretación de las presentes Reglas de Operación para efectos administrativos, estarán a cargo del DIF Guerrero, así como de la Secretaría de Contraloría y Transparencia Gubernamental, en el ámbito de sus respectivas competencias.\nDE OPERACIÓN PARA EL EJERCICIO FISCAL 2020\nDE OPERACIÓN PARA EL EJERCICIO FISCAL 2020\nPrimero. El presente Acuerdo entrará en vigor al dia siguiente de su publicación en el Periódico\nSegundo. Se abroga el Acuerdo por el que se crea el Proyecto Suministro de Tinacos y Cemento para Personas Vulnerables y se emiten las Reglas de Operación, para el Ejercicio Fiscal 2019, publicado en el Periódico Oficial del Gobierno del Estado de Guerrero No. 54 Alcance IX, de fecha 05 de julio de\n2019.\nDado en la oficina del titular del Poder Ejecutivo, ubicada en el Edificio Centro de Palacio de\nGobierno, Boulevard René Juárez Cisneros No. 62, Colonia Ciudad de los Servicios en la Ciudad de\nChilpancingo de los Bravo, Capital del Estado de Guerrero, a los veintisiete días del mes de enero del año dos mil veinte.\nEL GOBERNADOR CONSTITUCIONAL DEL ESTADO DE GUERRERO.\nLIC. HÉCTOR ANTONIO ASTUDILLO FLORES.\nRúbrica.\nEL SECRETARIO GENERAL DE GOBIERNO.\nLIC. FLORENCIO SALAZAR ADAME.\nRúbrica.\nESTADO DE GUERRERO.\nLIC. JOSÉ FRANCISCO SOLÍS SOLÍS.\nRúbrica.",
  "ordenamiento": "PROGRAMA",
  "jurisdiccion": "GUERRERO",
  "fuente_oficial": "DIARIO OFICIAL DE LA FEDERACION",
  "Fecha de Publicación": "01 \nde septiembre de 2020",
  "ULTIMA REFORMA PUBLICADA": null,
  "status": "VIGENTE",
  "es_escaneado": false,
  "tiene_tablas": true,
  "materia": [
    "desarrollo social"
  ]
}