{
  "titulo": "Acuerdo por el Que Se Crea el Proyecto de Instalación de Panaderías, y Se Emiten Sus Reglas de Opera",
  "Contenido": "TEXTO ORIGINAL\nGuerrero. - Poder Ejecutivo.\nLICENCIADO HÉCTOR ANTONIO ASTUDILLO FLORES, GOBERNADOR CONSTITUCIONAL\nDEL ESTADO DE GUERRERO, CON FUNDAMENTO EN LO DISPUESTO POR LOS ARTÍCULOS 4o\nDE LA CONSTITUCIÓN POLÍTICA DE LOS ESTADOS UNIDOS MEXICANOS; 167 DE LA LEY\nGENERAL DE SALUD; 3 DE LA LEY DE ASISTENCIA SOCIAL; 4 FRACCIÓN XVIII DEL\nPRESUPUESTO DE EGRESOS DE LA FEDERACIÓN PARA EL EJERCICIO FISCAL 2020; 40 DE LA\nLEY DE COORDINACIÓN FISCAL; 71, 87, 88, 90 NUMERAL 2 Y 91 FRACCIONES I, IX Y XLVI DE LA\nLAS FACULTADES QUE ME CONFIEREN LOS ARTÍCULOS 2, 3, 6, 7, 10, 18 APARTADO A FRACCIÓN\nI, 20 FRACCIÓN III Y 45 DE LA LEY ORGÁNICA DE LA ADMINISTRACIÓN PÚBLICA DEL ESTADO\nDE GUERRERO NÚMERO 08; 15 DE LA LEY SOBRE EL SISTEMA ESTATAL DE ASISTENCIA SOCIAL\nNÚMERO 332; EN RELACIÓN CON EL ARTÍCULO 55 Y ANEXOS 21 Y 21-A DEL DECRETO NÚMERO\n447 DEL PRESUPUESTO DE EGRESOS DEL ESTADO DE GUERRERO PARA EL EJERCICIO FISCAL\n2020 Y LOS LINEAMIENTOS PARA LA ELABORACIÓN DE LAS REGLAS DE OPERACIÓN DE LOS\nPROGRAMAS SOCIALES ESTATALES PARA EL EJERCICIO FISCAL 2017.\nQue el Plan Estatal de Desarrollo 2016-2021 impulsa entre sus prioridades, un Guerrero que garantice el ejercicio efectivo de los derechos sociales de todos los guerrerenses, que vaya más allá del asistencialismo y que conecte al capital humano con las oportunidades que genera la economía en el marco de una nueva productividad social que disminuya las brechas de desigualdad y promueva la más amplia participación social en las políticas públicas.\nLa Constitución Política de los Estado Unidos Mexicanos establece en su artículo 4o que la mujer y el hombre son iguales ante la ley. Esta protegerá la organización y el desarrollo de la familia. asistencialistas y más estructurales para garantizar el desarrollo de quienes menos tienen. Con una en este sector. Uno de los ejes que respaldan esta visión es el eje III.- Guerrero Socialmente\nComprometido. Objetivo 3.7. Fortalecer la asistencia social a grupos vulnerables; Estrategia 3.7.1. Atender permita mejorar su calidad de vida.\nLa Ley Número 479 del Sistema para el Desarrollo Integral de la Familia del Estado de Guerrero\nSistema Estatal para el Desarrollo Integral de la Familia, como un organismo público descentralizado, el cual tiene por objeto I.- Promover el bienestar social y prestar al efecto servicios de asistencia social con apoyo en las normas que dicte la Secretaría de Salubridad y Asistencia y el Sistema Nacional para el\nDesarrollo Integral de la Familia, así como el propio Estado; II.- Apoyar el desarrollo de la familia y de la comunidad; III.- Fomentar la educación, para la integración social; IV.- Impulsar el sano crecimiento físico y mental de la niñez; 2 V.- Atender las funciones de auxilio a las instituciones de asistencia privada que le confíe la dependencia competente, con sujeción a lo que disponga la Ley relativa; VI.-Operar establecimientos de asistencia social en beneficio de menores en estado de abandono, de ancianos y de los minusválidos; VII.- Realizar estudios e investigaciones sobre los problemas de la familia, de los menores, de los ancianos y de los minusválidos; VIII.- Prestar servicios de asistencia jurídica y de orientación social de los menores, ancianos y minusválidos sin recursos; IX.- Intervenir en el ejercicio de la tutela de los menores, que corresponda al Estado, en los términos de la Ley respectiva; X.- Auxiliar al\nMinisterio Público en la protección de incapaces y de los procedimientos civiles y familiares que les afecten, de acuerdo con la Ley; XI.- Procurar permanentemente la adecuación de los objetivos y programas del sistema estatal, a los que lleve a cabo el sistema nacional, a través de decretos, acuerdos, convenios o cualquier figura jurídica encaminada a la obtención de bienestar social, y, XII.- Los demás que les encomienden las Leyes.\nLas personas titulares de las secretarías, dependencias y entidades de la administración pública estatal, así como, las servidoras y servidores públicos autorizados para ejercer recursos públicos del presupuesto de inversión de las mismas, serán responsables de los programas y proyectos de inversión que realicen. Que los apoyos otorgados deberán sujetarse a criterios de objetividad, equidad, transparencia, publicidad, selectividad y temporalidad.\nEl Presupuesto de Egresos de la Federación para el Ejercicio Fiscal 2020, contempla en un apartado que las erogaciones para el Ramo General 33 Aportaciones Federales para Entidades\nFederativas y Municipios, serán distribuidos conforme a lo previsto en el Anexo 22 de este Decreto, el cual se precisa en el Fondo de Aportaciones Múltiples erogaciones para asistencia social.\nEl artículo 55 del Decreto Número 447 de Presupuesto de Egresos del Estado de Guerrero para el Ejercicio Fiscal 2020, establece que con el objeto de asegurar la aplicación eficiente, eficaz, oportuna inversión sujetos a reglas de operación.\nCon sustento en lo anterior, la Secretaría de Planeación y Desarrollo Regional, expidió los\nLos objetivos del programa y/o proyecto deberán desarrollarse de manera eficaz y oportuna a fin de consolidar la política estatal ya que dentro de los objetivos y estrategias que plantea el ejecutivo estatal, de igualdad en las oportunidades que les permitan desarrollarse con independencia y plenitud, es por ello atraviesan las personas que habiten en zonas rurales, mediante la entrega de proyectos productivos y de servicios.\nEn el Decreto Número 447 del Presupuesto de Egresos del Estado de Guerrero para el Ejercicio\nFiscal 2020 señala que se ejercerán los recursos bajo una política de gasto público, que permita dar cumplimiento a lo que globalmente prevén los ejes rectores del Plan estatal de Desarrollo 2016-2021.\nEn cumplimiento de lo anterior, se ha tenido a bien expedir el siguiente:\nACUERDO POR EL QUE SE CREA EL PROYECTO DE INSTALACIÓN DE PANADERÍAS, Y\nSE EMITEN SUS REGLAS DE OPERACIÓN PARA EL EJERCICIO FISCAL 2020.\nArtículo 1. Se crea el Proyecto de Instalación de Panaderías, el cual tiene por objeto contribuir a disminuir la desigualdad social entré los guerrerenses, respondiendo de manera cabal a sus expectativas de cambio; articuladora de esfuerzos, incluyente, con rostro humano.\nArtículo 2. Se emiten las Reglas de Operación del Proyecto de Instalación de Panaderías, en los que se establecen los principios de eficiencia, eficacia, oportunidad, equitativa y transparencia de los recursos públicos y requisitos que se deben de cumplir para poder acceder ha dicho Proyecto.\nEn las Reglas de Operación se establecen disposiciones que instituyen la ejecución del Proyecto de Instalación de Panaderías, con el objeto de otorgar transparencia y asegurar la aplicación, eficiente, eficaz, oportuno y equitativo de los recursos públicos asignados al mismo, los cuales deberán publicarse en el Periódico Oficial del Gobierno del Estado de Guerrero.\nArtículo 3. El Sistema para el Desarrollo Integral de la Familia del Estado de Guerrero tendrá a cargo la implementación, ejecución, evaluación y administración del Proyecto de Instalación de\nPanaderías, bajo los criterios de objetividad, equidad, transparencia, publicidad, selectividad y temporalidad, con estricto apego a la normatividad aplicable, por lo tanto, será el encargado de la dispersión y asignación de los recursos del Proyecto apegándose plenamente a las siguientes:\nEJERCICIO FISCAL 2020.\n1. Introducción\n1.1. Antecedentes\nEl Sistema para el Desarrollo Integral para la Familia (SEDIF), a través de la Dirección de\nAsistencia Alimentaría y Desarrollo Comunitario, fomenta y promueve acciones que mitiguen la vulnerabilidad de las personas que son sujeto de asistencia social, y tiene como intención apoyar y coordinar la acciones de desarrollo comunitario en las que participan los tres niveles de gobierno (Federal, Estatal y Municipal) dentro del ámbito de su competencia, en coordinación con los Sistemas Municipales\nDIF; en este Proyecto se realiza el apoyo con herramientas y equipo.\nEn este documento se sustenta la intervención institucional que desde el ejercicio 2012 ha venido atendiendo a población en situaciones de vulnerabilidad, así mismo, se especifica la participación básica de llevar a cabo entre los Sistemas Municipales DIF, con el objetivo de realizar proyectos en coordinación, como el de Instalación de Panaderías\nEste Proyecto tiene como prioridad la atención a aquellas familias en estado de vulnerabilidad social que habiten en localides de alto y muy alto grado de marginación, teniendo el propósito de fomentar el autoempleo y consumo como un elemento clave para que las familias que viven en condiciones de desventaja socioeconómica mejoren sus niveles de vida, para lo cual se les otorgarán mobiliario y equipo para la Instalación de Panaderías.\nDentro de estas Reglas de Operación se desarrollan:\na) Naturaleza del proyecto: Dentro de los objetivos y estrategias que plantea el ejecutivo estatal, está abatir la marginación y el rezago social que enfrentan los grupos sociales vulnerables para proveerles de igualdad en las oportunidades que les permitan desarrollarse con independencia y plenitud; asimismo, plantea elevar la productividad de las personas para que cuenten con mejores opciones de empleo e ingreso, que les permitan reducir sus niveles de pobreza, es por ello que surge este Proyecto con el propósito de disminuir el impacto del desempleo temporal ya que brinda a las familias la oportunidad de auto emplearse y/o generar empleo que mitiguen los impactos económicos sociales por las que atraviesan.\nb) Origen y fundamento: Constitución Política de los Estados Unidos Mexicanos, Constitución\nGobierno del Estado número 71, alcance I de fecha 04 de septiembre de 2018, Ley General de Salud y Ley de Asistencia Social.\n• Ley General de Salud.\n• Ley de Asistencia Social.\n• Ley General para la Inclusión de las Personas con discapacidad.\n• Ley Número 817 para las Personas con Discapacidad del Estado.\n• Ley Número 479 del Sistema para el Desarrollo Integral de la Familia del Estado de Guerrero.\n• Ley Número 454 de Presupuesto y Disciplina Fiscal del Estado de Guerrero.\n• Ley General para la Inclusión de las Personas con discapacidad.\n• Ley Orgánica de la Administración Pública del Estado de Guerrero Número 08.\n• Programa Sectorial Desarrollo y Asistencia Social 2016-2021.\n• Estrategia Local \"Guerrero Contigo\".\n• Reglamento Interior del Sistema para el Desarrollo Integral de la Familia del Estado de Guerrero.\n• Decreto Número 196 por medio del cual la Sexagésima Primera Legislatura al Honorable\n2016-2021.\n• Programa Sectorial Desarrollo y Asistencia Social 2016-2021.\n• Decreto Número 447 del Presupuesto de Egresos del Estado de Guerrero para el Ejercicio Fiscal\n2020.\n• Manual de Organización del DIF Guerrero.\n• Y todos aquellos ordenamientos normativos aplicables.\nc) Objetivos y metas: Contribuir al gasto familiar de los grupos vulnerables en condiciones de pobreza, por lo que se pretende apoyar a 34 familias para que tengan un negocio propio, así como crear fuentes de empleo y/o autoempleo que coadyuven en su ingreso familiar, como precedente de sustentabilidad laboral.\nd) Ubicación geográfica: Se atenderán a los 81 municipios que integran el Estado, dando prioridad a los municipios de alta y muy alta marginación.\ne) Actividades a realizar: Gestionar ante las instancias de Gobierno federales y estatales, los recursos financieros, para llevar a cabo la adquisición de los materiales, insumos y productos necesarios en la operatividad del Proyecto; así mismo dar a conocer al Sistema Municipal DIF, las Reglas de Operación del Proyecto y proporcionar de forma calendarizada los suministros de los apoyos.\nf) Instancias participantes: La instancia ejecutora es el Sistema para el Desarrollo Integral de la\nFamilia del Estado de Guerrero, a través de la Dirección de Asistencia Alimentaria y Desarrollo Comunitario, quien se coordinará con los Sistemas Municipales DIF para llevar a cabo la ejecución y seguimiento del\nProyecto.\ng) Presupuesto de inversión: Se tiene contemplado una inversión de $2,401,200.00 (Dos millones cuatrocientos un mil doscientos pesos 00/100), recursos presupuestales que provienen del Ramo 33.Aportaciones Federales para Entidades y Municipios, específicamente del Fondo de Aportaciones Múltiples\n(Asistencia Social).\nh) Glosario de términos:\nAsistencia Social: Conjunto de acciones tendientes a modificar y mejorar las circunstancias de carácter social que impiden el desarrollo social del individuo, así como la protección física, mental y social de personas en estado de necesidad.\nDIF Guerrero: Sistema para el Desarrollo Integral de la Familia.\nGrupos Vulnerables: Persona o grupo que por sus características de desventaja por edad, sexo, estado civil; nivel educativo, origen étnico, situación o condición física y/o mental; requieren de un esfuerzo\nProyecto: Proyecto de Paquetes de Instalación de Panaderías.\nReglas de Operación: Reglas de Operación del Proyecto de Paquetes de Instalación de\nPanaderías.\nSecretaría de Contraloría: Secretaría de Contraloría y Transparencia Gubernamental.\nSEDIF: Sistema para el Desarrollo Integral de la Familia.\nSEFINA: Secretaría de Finanzas y Administración.\nSEPLADER: Secretaría de Planeación y Desarrollo Regional\n1.2. Alineación programática\nEn cumplimiento a lo que globalmente prevén los ejes rectores del Plan Estatal de Desarrollo 20162021, se alinea en el eje III.- Guerrero Socialmente Comprometido; Objetivos: 3.1. Construir un Estado\nGarante de los Derechos Sociales de las Personas; 3.2. Edificar la ruta hacia una sociedad equitativa e incluyente; Estrategias: 3.1.2. Fortalecer el desarrollo de capacidades de los integrantes de una sociedad con carencias, que permitan contribuir a incrementar su capacidad productiva y su calidad de vida y 3.2.1.\nGenerar programas de desarrollo comunitario por medio de procesos de participación social.\nLíneas de Acción\n• Fomentar el acceso efectivo de las familias a sus derechos sociales, particularmente de aquellas en pobreza extrema, mediante políticas públicas coordinadas y concurrentes.\n• Potenciar la inversión conjunta de la sociedad organizada y de los órdenes de Gobierno, invirtiendo en proyectos de infraestructura social básica, complementaria y productiva.\nAsí mismo se alinean a lo estipulado en el Programa Sectorial \"Desarrollo y Asistencia Social\"\n2016-2021, cuyo objetivo es atender a personas vulnerables, a través de desarrollar capacidades y su calidad de vida y sus núcleos familiares, logrando fortalecer el tejido social en localidades vulnerables.\n1.3. Diagnóstico localidades a lo largo de todo el país, provoca que la inestabilidad del empleo sea considerada como uno de los principales motivos de preocupación dentro de los hogares mexicanos; que la pérdida del empleo y la pobreza de los hogares, fundamentalmente porque la falta de empleo conduce a una importante disminución del capital económico familiar, mayor presión sobre los recursos naturales, así como el abandono de la educación y el fomento al endeudamiento, estas afectaciones frecuentemente persisten aun cuando sus miembros se reintegran a las actividades productivas y remuneradas.\nQue la oferta laboral puede disminuir en algunas regiones del Estado a lo largo del año debido a emergencias o por efecto de los ciclos productivos, afectando principalmente a la población de escasos recursos que enfrenta periódicamente etapas con una grave disminución en sus ingresos y patrimonio.\nPor ello las políticas de empleo estatal deben considerar además del fomento a la creación de empleos formales e informales, la ejecución de acciones que permitan disminuir el impacto del desempleo temporal; una de las alternativas para enfrentar dicho fenómeno es la implementación de programas que brinden a los hogares auto emplearse y/o generar empleo que mitiguen los impactos económicos sociales.\nQue el diseño del Proyecto de Instalación de Panaderías implica que los posibles beneficiarios deben participar en proyectos de beneficio familiar o comunitario como corresponsabilidad obligatoria para recibir los apoyos que se les otorgue. Este requisito no solamente promueve la participación activa de los ciudadanos en el desarrollo de sus hogares y comunidades, sino que además genera beneficios adicionales al resto de la sociedad en función de los proyectos ejecutados.\nQue dentro de los objetivos y estrategias que plantea el ejecutivo estatal, está abatir la marginación y el rezago social que enfrentan los grupos sociales vulnerables para proveerles de igualdad en las oportunidades que les permitan desarrollarse con independencia y plenitud; asimismo, plantea elevar la productividad de las personas para que cuenten con mejores opciones de empleo e ingreso, que les permitan reducir sus niveles de pobreza.\nEl trabajo informal en países de economía subdesarrollada como México, está altamente asociada con el autoempleo, la carencia de plazas laborales que brinden una mayor seguridad salarial y mejores condiciones de trabajo orilla a casi el 60% de los buscadores de empleo a resolver por sí mismos su y de servicios.\nEn el Estado existen 895, 157 hogares de los cuales 293 086 están conformadas por Jefas de\nFamilias que es el 33% y 602 071, se conforman por Jefes de Familia que en términos porcentuales le corresponde el 67% razón por la cual el Sistema para el Desarrollo Integral de la Familia beneficiará a 34 familias que es nuestra población beneficiaria. a través de:\na) Misión. Proporcionar a las familias en desventaja económica el Proyecto de Instalación de\nPanaderías, como generador de autoempleo y/o empleo e ingresos a través de la prestación de un servicio,\nb) visión. Elevar la calidad de vida de la familia mediante el desarrollo de proyectos generadores de autoempleo y/o empleo que coadyuven en el fortalecimiento de la economía familiar.\nA continuación, se detalla el número de beneficiarios del Proyecto durante el periodo 2016-2019, de acuerdo al cuadro que se desglosa a continuación.\n2. Dependencia o entidad responsable del proyecto\nLa instancia ejecutora será el Sistema para el Desarrollo Integral de la Familia, a través de la\nDirección de Asistencia Social y Desarrollo Comunitario, quien se coordinará con los Sistemas Municipales\nDIF para llevar a cabo la ejecución y seguimiento del Proyecto.\n3. Objetivos y alcances\n3.1. Objetivo general\nContribuir al gasto familiar de la población que vive en condiciones de pobreza y/o que no cuente con empleo a través de establecer la instalación y el equipamiento de panaderías, para que tengan un negocio propio, así como crear fuentes de empleo y autoempleo que coadyuven en su ingreso familiar a\n34 familias. La población objetivo la constituyen las familias que habiten en municipios o localidades con alto o muy alto grado de marginación.\n3.2. Objetivos específicos\n• Generar una alternativa de autoempleo como precedente de sustentabilidad laboral.\n• Incrementar el ingreso familiar.\n• Brindar un servicio básico.\n3.3. Alcances\nLa operación o ejecución del Proyecto surge para mitigar y garantizar el empleo y/o autoempleo sin empleo a través de la instalación de 33 panaderías, mejorando su economía familiar y comunitaria. o muy alto grado de marginación, considerando la suficiencia presupuestal para el ejercicio vigente y los criterios de focalización y priorización del Proyecto.\n4. Metas físicas\nEl Proyecto opera de acuerdo a su presupuesto anual autorizado, cuyos recursos provienen del\nFondo de Aportaciones Múltiples (FAM) correspondiente al Ramo XXXIII, para el presente ejercicio fiscal\n2020, por lo que se tiene contemplado atender a 34 familias que habiten en municipios o localidades con alto o muy alto grado de marginación.\n5. Programación presupuestal\nEn el Decreto del Presupuesto de Egresos del Estado de Guerrero para el Ejercicio Fiscal 2020, se señala que se ejercerán los recursos bajo una política de gasto público, que permita dar cumplimiento a lo que globalmente prevén los ejes rectores del Plan Estatal de Desarrollo 2016-2021.\nSubsidiado a través de recursos presupuestales que provienen del Ramo 33.- Aportaciones\nFederales para Entidades y Municipios, específicamente del Fondo de Aportaciones Múltiples (Asistencia\nSocial), destinados al Sistema DIF Guerrero para la operación del Proyecto de Instalación de Panaderías por un monto de $2,401,200.00 (Dos millones cuatrocientos un mil doscientos pesos 00/100 M.N.) y cuyo costo promedio por beneficiaria y/o beneficiario es de $70,623.52 (Sesenta mil seiscientos veinte tres pesos\n52/100 M.N.).\n6. Requisitos y procedimientos de acceso\n6.1. Difusión que ejecuta y opera en coordinación con las diferentes Direcciones que integran el Sistema; cuyos requisitos se encuentran en las oficinas ubicadas en Boulevard Rene Juárez Cisneros, Colonia Ciudad de los Servicios y Av. Gabriel Leyva s/n esq. Ruffo Figueroa, Col. Burócratas, C.P. 39090, Chilpancingo, Guerrero, con un horario de atención de 8:00 am a 3:00 pm y/o los teléfonos 01(747) 4725595, 01(747)47256 00, 01(747)47 25672 ext. 1151 y 1159. Así mismo al correo electrónico: alimentariadif@prodigy.net.mx, subdireccionalimentaria@prodigy.net.mx\nLas Reglas de Operación del Proyecto son difundidas por el personal capacitado de las\nDirecciones y en la página web https://www.guerrero.gob.mx del Portal del Gobierno del Estado. Por otra parte, los proyectos tienen cobertura estatal.\n• Se brinda atención en los 81 municipios del Estado, dando prioridad a adolescentes, mujeres embarazadas, mujeres en periodo de lactancia, personas con discapacidad, adultos mayores y personas vulnerables por ingresos.\n6.2. Requisitos de acceso\n• Los interesados deberán presentar oficio de solicitud, en escrito libre en las instalaciones del DIF\nGuerrero con domicilio en el Centro de Rehabilitación Integral Guerrero, Boulevard Lic. René Juárez\nCisneros S/N, Col. Ciudad de los Servicios, Chilpancingo, de los Bravo, dirigido a la Presidenta o Director\nGeneral del DIF Guerrero para ser considerado dentro del Proyecto, anexando copia fotostática de la siguiente documentación:\n1. Credencial de elector.\n2. CURP.\n3. Comprobante de domicilio\n• La solicitud es turnada a la Dirección de Asistencia Alimentaria y Desarrollo Comunitario para su atención, quien en un plazo no mayor a 60 días hábiles dará respuesta a la misma.\n• La Dirección de Asistencia Alimentaria y Desarrollo Comunitario aplica estudio socioeconómico al solicitante para determinar si será beneficiario del Proyecto.\n6.3. Procedimiento de acceso\nLa operación del Proyecto de Instalación de Panaderías, surge por la necesidad de atender el problema del desempleo y atendiendo la carencia alimentaria, el cual busca garantizar el derecho a la alimentación y al trabajo de la población vulnerable atendiendo a los 81 municipios que conforman nuestro\nEstado, dando prioridad a los municipios de alta o muy alta marginación se operación y/o ejecución obedece a la demanda ciudadana y/o peticiones que se reciben en las instalaciones del Sistema para el\nDesarrollo Integral de la Familia o directamente a la Presidenta del Sistema Estatal.\nSerán beneficiados con el apoyo del Proyecto, los solicitantes que cumplan con las siguientes características y se atenderán de acuerdo a la disponibilidad presupuestal del Proyecto:\n1. Familias en estado de vulnerabilidad, mujeres embarazadas, mujeres en periodo de lactancia, tener un empleo formal.\n2. Habitar en el municipio o localidad de alto, muy alto grado de marginación.\nLos interesados deberán presentar su solicitud en formato libre de ingreso al Proyecto, en las instalaciones del DIF Guerrero, con domicilio en el Centro de Rehabilitación Integral Guerrero, Boulevard\nLic. René Juárez Cisneros S/N, Col. Ciudad de los Servicios, Chilpancingo, Guerrero dirigido a la\nPresidenta del Patronato del DIF Guerrero para ser considerados dentro del Proyecto, con un horario de atención de 8:00 am a 3:00 pm y/o los teléfonos 01(747) 4725595, 01(747)47256 00, 01(747)47 25672 ext\n1151 y 1159. Así mismo al correo electrónico: alimentariadif@prodigy.net.mx.\nDe acuerdo a la disponibilidad presupuestal del Proyecto se dará preferencia a las personas con discapacidad, adultos mayores y personas vulnerables por ingresos; así mismo se entregará un comprobante de acceso al Proyecto que en un plazo no mayor a 30 días hábiles dará respuesta a la solicitud.\nUna vez que son incorporadas al Proyecto las personas que serán beneficiadas, formarán parte de un Padrón Único de Beneficiarios, donde datos personales, e información administrada y/o generada será resguardada de acuerdo con la Ley Número 207 de Transparencia y Acceso a la Información Pública del Estado; los cuales en ningún caso podrán emplearse para propósitos de proselitismo político, religioso o comercial, ni para ningún otro fin distinto al establecido en las Reglas de Operación del proyecto social.\nY en ningún caso las servidoras y los servidores públicos podrán solicitar o proceder de manera diferente a lo establecido en las Reglas de Operación. Las personas que se beneficie con este Proyecto, tendrá derecho a ser tratado con respeto, dignidad y a recibir los servicios que se ofrecen; así como a:\n➢ Recibir la información necesaria de manera clara y oportuna para participar en el Proyecto.\n➢ Un trato digno y respetuoso oportuno con calidad y equitativo sin discriminación alguna.\n➢ Reserva y privacidad de su información personal.\n6.4. Requisitos de permanencia, causales de baja o suspensión temporal\nVisita de seguimiento a los beneficiarios, con la finalidad de constatar la situación socioeconómica y seguimiento a las necesidades prioritarias, la población sujeta de atención deberá cumplir con lo establecido en las Reglas de Operación del Proyecto, así como:\n• Utilizar los apoyos otorgados de manera adecuada y para los fines alos que se les otorgan y con que fueron autorizados evitando cualquier uso distinto de la misma. Los cuales en ningún caso podrán emplearse para propósitos de proselitismo político, religioso o comercial, ni para ningún otro fin distinto al establecido en las Reglas de Operación.\n• Permitir visita de verificación con la finalidad de validar la información proporcionada en sus expedientes correspondientes.\n•Facilitar los trabajos de supervisión, en cualquier momento después de haber recibido el apoyo.\nLas beneficiarias y beneficiarios del Proyecto de Instalación de Panaderías, que incumplan en las disposiciones normativas establecidas en los numerales 6.2 y 6.3 de estas Reglas de Operación, perderán las prerrogativas establecidas se les retirará el apoyo.\n6.5. Modos de entrega del beneficio\nLos apoyos serán distribuidos directamente a los beneficiarios en puntos sedes en cada Región del Estado, o en su caso, el beneficiario podrá acudir a recoger el apoyo a las oficinas de la Dirección de\nAsistencia Alimentaria y Desarrollo Comunitario, el cual otorgará las herramientas necesarias para mejorar la economía familiar y comunitaria.\nComo objetivo a corto plazo, se dará continuidad a la entrega de cada apoyo solicitado, cubriendo cada uno los requisitos solicitados en las presentes Reglas de Operación, mismas que será otorgado en su municipio de residencia o en su caso en el almacén general del Sistema Estatal a la población vulnerable.\nSe atenderá de manera inmediata la demanda ciudadana que se genere en las visitas que realicen las autoridades estatales en giras de trabajo en los municipios o comunidades, cubriendo cada uno los requisitos solicitados en las presentes Reglas de Operación.\n7. Procedimientos de instrumentación\n7.1 Operación\nEl Sistema Estatal DIF tendrá las siguientes responsabilidades: llevar a cabo la adquisición de los materiales, insumos y productos necesarios en la operatividad del\nProyecto.\nb) Dar a conocer al Sistema Municipal DIF, las Reglas de Operación del Proyecto de Instalación de Panaderías, vigentes.\nc) Proporcionar al Sistema Municipal DIF, de forma calendarizada los suministros de productos de los programas.\nd) Vigilar y verificar que los proyectos sean otorgados directamente a los beneficiarios.\ne) Proporcionará almacenes regionales, para guarda, custodia de los productos que integran los proyectos; que contarán con personal capacitado para su manejo y distribución.\nf) Actualizar y profesionalizar los conocimientos del personal operativo del Sistema Estatal DIF y del Sistema Municipal DIF, a través de capacitaciones a fin de contar con las herramientas básicas para la operatividad de los programas.\ng) Recepcionar de los Sistema Municipal DIF la información requerida para comprobación del\nProyecto con base a las Reglas de Operación vigentes.\nh) Procesará la información a que se refiere el punto anterior y remitirla de acuerdo al calendario de entregas, a fin de comprobar los recursos canalizados al municipio.\ni) Elaborar a inicio de cada ejercicio fiscal, el Proyecto de los programas y documentos que contemplarán la aplicación y operatividad de los proyectos con los importes correspondientes.\nj) Proporcionar cursos de capacitación al personal de Sistema Municipal DIF, relativos a la operatividad de los programas; así como asesoramiento en la elaboración de propuestas para proyectos.\nSerán obligaciones del Sistema Municipal DIF las siguientes: a. El Sistema Municipal DIF se obliga a cumplir con la implementación del Proyecto que se tiene establecido en los lineamientos de la subdirección de desarrollo comunitario, así como en las Reglas de\nOperación que regula el Proyecto; salvo la pena de incurrir en responsabilidades administrativas. b. Determinará de manera conjunta la población potencial de su municipio tomando en consideración el tipo de beneficiario de todos los programas a solicitar, con esta información y en coordinación con el Sistema Estatal DIF, atenderá a la población que se encuentre en situación de vulnerabilidad de localidades de alta y muy alta marginación. c. Integrará y enviará los expedientes, así como los padrones físicos de los beneficiarios de los programas solicitados a la Subdirección de Desarrollo Comunitario, de igual forma informará a los beneficiarios que los datos personales recabados serán protegidos en términos de los principios de protección de datos personales contenidos en la ley de la materia y demás normativas aplicables. d. Integrará los padrones de los beneficiarios con sus respectivos expedientes del Proyecto objeto de estas Reglas de Operación. Remitiendo al Sistema Estatal DIF el padrón físico, digital y expedientes correspondiente comprobación del Proyecto. e. Designar personal del Sistema Municipal DIF que realice las funciones de seguimiento y supervisión de los programas. f. Participar en acciones de apoyo logístico para la distribución de los programas y/o proyectos. g. Es competencia del Sistema Municipal DIF, trasladar los materiales que corresponden a los programas y/o proyectos, a las comunidades beneficiadas, en una unidad vehicular. Será responsabilidad del municipio el resguardo y el buen uso de los materiales que se recepcionen, en el entendido que, de existir algún desvío de los mismos, el Sistema Estatal DIF cancelará inmediatamente el suministro del\nProyecto e iniciará un procedimiento ante la contraloría interna del sistema estatal, para determinar las sanciones a que sean acreedores.\nPara garantizar la atención completa del beneficiario, se realizan las acciones siguientes:\n• Adquisición de los materiales y que cumplan con las Especificaciones Técnicas de Calidad.\n• Asegurar el correcto almacenamiento y distribución de los materiales, hasta su entrega al beneficiario.\n• Focalizar los beneficiarios de los programas con base a los indicadores socioeconómicos.\n• Coordinar la entrega de apoyos a la población beneficiada con los Sistemas Municipales DIF, a través de convenios de colaboración y conforme a lo establecido en las Reglas de Operación.\n• Promover la participación social a través de los Sistema Municipal DIF en la formación de comités entre la población beneficiaria, para la recepción, entrega y vigilancia de los apoyos.\n• Promover la formación y operación de grupos de contraloría social para el seguimiento del\nProyecto.\n• Fortalecer la operación del Proyecto promoviendo la inclusión general de la sociedad.\nLos datos de las beneficiarias y/o beneficiarios, así como la información generada y administrada se regirán por la Ley Número 207 de Transparencia y Acceso a la Información Pública del Estado de\nGuerrero.\nEl presente Proyecto de Instalación de Panaderías, contempla las herramientas necesarias para desempeñar un autoempleo y mejorar la economía familiar y comunitaria mediante el otorgamiento de:\n✓ 1 Horno de Gaveta de 4 charolas, medidas de 1.20 x 1.00 x 1.60, para hornear pan, repostería y pizzas.\n✓ 1 Amasadora de araña fija, acabado con pintura de esmalte, cazo de acero inoxidable con globo, 1 paleta y 1 gancho con motor monofásico, sistema planetario de 3 velocidades, con motor de 1 1/2, capacidad para 50kgs.\n✓ 8 Charolas de lámina galvanizada de 45 x 65.\n✓ 1 Espiguero de 18 charolas, con ruedas giratorias reforzadas, acabado en lámina con pintura de esmalte color gris y separación de entrepaños de 10 cms.\n✓ Tanques de gas de 30 kg. (Vacíos), con regulador, conexiones y 5 mts. de manguera.\n✓ 1 Mesas grande de aluminio.\n✓ 1 Cortadora de 36 tantos, especial para bolillo y pan dulce, cuerpo en fierro colado con tambores de aluminio, cuchillas de acero inoxidable.\n✓ 1 Molde redondo para pastel, fabricado de aluminio de alto 10 cms. y 28 cms de diámetro.\n✓ 1 Molde redondo para pastel, fabricado de aluminio de alto 10 cms. y 24 cms de diámetro.\n✓ 1 Molde para mantecadas fabricado de lámina estañada medidas de 45 x 65, de 35 piezas.\n✓ 2 Pinzas para pan de 30 cms.\nComo objetivo a corto plazo, se dará continuidad a la entrega de cada apoyo solicitado.\n7.2. Gastos de operación\nEl presupuesto asignado a este Proyecto, es a través del Fondo de Aportaciones Múltiples, no contempla gastos de operación.\n8. Transparencia\n8.1. Difusión\nLa instancia responsable es la Dirección de Asistencia Alimentaria y Desarrollo Comunitario, quien difundirá a través de diferentes medios de comunicación; trípticos, periódico, redes sociales en la cuales\nPanaderías.\nAsí mismo se dará amplia difusión al Proyecto a nivel estatal y se promoverán similares acciones por parte de las autoridades locales; la información del Proyecto se dará a conocer en la página de internet del Gobierno del Estado, https://www.guerrero.gob.mx desagregada por municipio, barrio o zona urbanomarginada, proyecto y nombre del beneficiario, las copias de los expedientes de las beneficiarias y/o beneficiarios estarán disponibles oportunamente para su consulta en las oficinas del Sistema ubicadas en\nBoulevard Rene Juárez Cisneros, Colonia Ciudad de los Servicios y Av. Gabriel Leyva s/n esq. Ruffo\nFigueroa, Col. Burócratas, C.P. 39090, Chilpancingo, Guerrero; por otra parte la papelería, documentación oficial, así como la publicidad y promoción del Proyecto, deberán incluir la leyenda descrita en el apartado de \"Blindaje Electoral\".\nLa información de montos y beneficiarios deberá ser publicada en los términos de la Ley Número\n207 de Transparencia y Acceso a la Información Pública del Estado de Guerrero.\nUna vez autorizadas estas Reglas de Operación, por las instancias correspondientes, estarán disponibles para su consulta en las oficinas de la Dirección de Asistencia Alimentaria y Desarrollo\nComunitario, y el responsable directo de la ejecución será la Dirección de Asistencia Alimentaria y\nDesarrollo Comunitario, a través de la Subdirección de Desarrollo Comunitario, ubicada Av. Gabriel Leyva s/n esq. Ruffo Figueroa, Col. Burócratas, C.P. 39090, Chilpancingo, Guerrero, a los teléfonos (01747) 47 2\n55 95, (01747) 47 2 56 00, (01747) 47 2 56 72 ext. 1155. Así mismo al correo electrónico: subdescomdif@prodigy.net.mx Para información sobre el Proyecto.\nAsí como en los medios electrónicos oficiales http://www.dif.guerrero.gob.mx información pública de oficio, fracción III Marco Normativo específico. La información de montos y beneficiarios será\nEstado de Guerrero.\nComunitario, así como en la página electrónica del Sistema para el Desarrollo Integral de la Familia\n8.2. Blindaje electoral\nLa operación y ejecución de los recursos estatales destinados al Proyecto, deberán observar y atender las medidas que emita la Secretaría de Contraloría y Transparencia Gubernamental, para coadyuvar a que éstos, no sean utilizados con fines políticos por lo que, la papelería, documentación oficial, así como la publicidad y promoción del Proyecto deberán incluir la siguiente leyenda:\n\"Este proyecto es público, ajeno a cualquier partido político. Queda prohibido el uso para fines distintos a los establecidos en el proyecto\".\n8.3. Supervisión y control\nLa Dirección de Asistencia Alimentaria y Desarrollo Comunitario, deberá reportar mensualmente a la Dirección de Planeación del DIF Guerrero, las acciones ejercidas y los resultados obtenidos, quien a su vez reportará a la Secretaria de Planeación y Desarrollo Regional (SEPLADER), Secretaría de Finanzas y Administración (SEFINA) y la Secretaría de Contraloría y Transparencia Gubernamental los informes trimestrales sobre el presupuesto ejercido establecidos por el Consejo Nacional de Armonización Contable\n(CONAC) que se deberán presentar a más tardar a los quince días hábiles posteriores a la terminación de cada trimestre.\nLos padrones de los beneficiarios serán requisitados por los Sistemas Municipales DIF, remitiendo para su revisión a este Sistema Estatal DIF el padrón físico y digital de la dotación entregada para la integración de los padrones de beneficiarios de los 81 municipios de la entidad misma que serán remitidos a las instancias o dependencias operadoras.\n8.4. Mecanismos de evaluación e indicadores\n8.4.1. Evaluación\nEl instrumento de medición de evaluación del Proyecto se realizará mediante indicadores de desempeño los cuales serán reportados a la Dirección de Planeación para la integración de los informes correspondientes.\n8.4.2. Indicadores\nFORMULA DE TIPO DE UNIDAD DE MEDIO DE UNIDAD\nNIVEL OBJETIVO OBJETIVO INDICADOR RESPONSABL SUPUESTOS\nCALCULO INDICADOR MEDIDA VERIFICASION E\nGarantizar el Las familias ejercicio obtienen\nPorcentaje de (Familias efectivo de familias beneficiadas/famili Familias Padrón de Subdirección mejores sociales de comunitario para su beneficiadas beneficiar)x100 todos los desarrollo\nGuerrerenses integral\nMejorar las condiciones de vida de quienes viven\nLograr que cada familia comunidades (total de solicitudes atendidas comunitario tenga un marginación recibidas)x100 instrumento de mediante el supervivencia impulso de procesos de desarrollo comunitario, Brindar\nPorcentaje de Apoyos\nProporcionar proyectos proporcionados/ap Familias Avances Subdirección proyectos\nCOMPONENTES proyectos Estratégico beneficiada físicos de desarrollo adecuado a las proporcionado oy os programados s productivos financieros comunitario condiciones de nuestra región\nLa revisión de reglas de Establecer\nReglas de Publicación delas Avances Subdirección operación operación reglas de Estratégico D s ocumento físicos de desarrollo reglas claras permite para accesar a publicadas operación financieros comunitario mejorar el los proyectos programa\nEstablecimient\nLa difusión o de fechas del proyecto Oficios de Avances Subdirección en los 81 invitación a los Convenios de Estratégico D s ocumento físicos de desarrollo apropiadas colaboración para las municipios municipios financieros comunitario\nACTIVIDADES entregas de los del estado proyectos\nRealizar padrones que servirán para Generar un\nNumero de cruces subir datos Porcentaje de de padrones del Familias Padrón de Subdirección padrón de del cruce de Estratégico beneficiada de desarrollo beneficiados año pasado/cruce s beneficiarios beneficiario a padrones comunitario sustentado y actual *100 plataformas confiable de SIFGE y transparencia\n8.5. Auditoría\nEl ejercicio del recurso y la operatividad del Proyecto, están sujetos a las disposiciones estatales aplicables y podrá ser auditado por la Secretaría de Contraloría y Transparencia Gubernamental, así como por la Auditoría Superior del Estado y Auditoría Superior de la Federación, conforme a la legislación vigente y en el ámbito de sus respectivas competencias.\nEl Sistema DIF Guerrero dará todas las facilidades a dichas instancias para realizar, en el momento en que lo juzguen pertinente, las auditorías que consideren necesarias; así como el seguimiento y la solventación a las observaciones planteadas por los órganos de control.\n8.6. Recursos no devengados y aquellos que por cualquier motivo no estuviesen devengados al 31 de diciembre del ejercicio fiscal correspondiente.\n8.7. Contraloría social\nCon la finalidad de incrementar la participación ciudadana, se crearán comités de Contraloría\nSocial, como un órgano ciudadano de control, vigilancia y evaluación de las actividades del Proyecto, conformados por los beneficiarios, los sectores sociales, y los representantes de la localidad, quienes de manera específica supervisarán la gestión gubernamental, y que los manejos de los recursos públicos se realicen en términos de transparencia, eficacia, legalidad y honradez.\nLos objetivos específicos de este Órgano de Contraloría Social son:\n• Hacer más transparentes las decisiones y la ejecución de los recursos.\n• Incrementar la participación ciudadana.\n• Fomentar la organización social.\n• Inhibir los actos de corrupción y de cooptación social, política y electoral.\n• Incrementar la eficiencia de los recursos públicos.\n• Fortalecer la cultura de la legalidad.\n• Mejorar la rendición de cuentas.\n• Perfeccionar la democracia e incorporar la evaluación ciudadana.\nLas funciones de los comités de Contraloría Social son:\na) Integración: Se conforman con la representación de la comunidad beneficiada por el Proyecto y fungirán como interlocutores con el DIF Guerrero, en el ejercicio de la contraloría social.\nEl vocal del Comité de Contraloría Social será, el responsable de hacer llegar las quejas o denuncias recibidas al DIF Guerrero, quien dará respuesta en un plazo no mayor de15 días a partir de la fecha de recepción de la queja o denuncia.\nb) Capacitación y asesoría: Para impulsar la realización de las actividades de contraloría social se brindará capacitación y asesoría, a las servidoras y servidores públicos que intervienen en la operación del\nProyecto, así como a los integrantes de los comités locales, para que estos realicen adecuadamente sus actividades de seguimiento y vigilancia.\nc) Seguimiento: Se deberá integrar un Programa de Trabajo a través del cual se debe incluir la descripción de las actividades, responsables, metas y calendarización de las actividades para su cumplimiento.\nEl Director General o el personal que designe el DIF Guerrero, serán los encargados de conformar los comités de Contraloría Social, asimismo darán acompañamiento durante las actividades de control, seguimiento y vigilancia de los proyectos.\nEl Comité de Contraloría Social debe estar constituido por una Presidencia, una Secretaría y una Vocalía mínimamente, electos de entre la población beneficiada en donde se va a realizar la entrega del Proyecto, y tendrá que ser vigilado por un solo comité quien deberá controlar, vigilar y dar seguimiento al proyecto a través de los formatos que integran el expediente comunitario, integrado por:\n1. Acta de Conformación del Comité de Contraloría Social.\n2. Reunión con beneficiarias y beneficiarios.\n3. Ficha Informativa del Proyecto.\n4. Cédula de Vigilancia del Proyecto.\n5. Actividades de Difusión y Capacitación.\n6. Quejas, Denuncias o Reconocimientos.\n7. Informe Anual.\n8.8. Formas de participación social\nCon apego en lo dispuesto en la Ley Número 684 de Participación Ciudadana del Estado Libre y\nSoberano de Guerrero, se establece que la sociedad podrá participar activamente en la Planeación, Programación, Implementación y Evaluación de los Programas Sociales de Desarrollo Social, por ello las gubernamental, que el manejo de los recursos públicos se realicen en términos de transparencia, eficacia, legalidad y honradez del Proyecto de acuerdo en lo estipulado en estas Reglas de Operación.\n8.9. Procedimiento de queja o inconformidad ciudadana sobre cualquier hecho, acto u omisión que produzca o pueda producir daños al ejercicio de sus derechos normatividad aplicable. a. El Sistema DIF Guerrero.\nDomicilio: Centro de Rehabilitación Integral Guerrero. Boulevard Lic. René Juárez Cisneros S/N, Col. Ciudad de los Servicios Chilpancingo, Guerrero, C.P. 39095. b. La Secretaría de Contraloría y Transparencia Gubernamental.\nTeléfonos: (474) 47 1 97 41Correo electrónico: contraloria@guerrero.gob.mx Domicilio: Palacio de\nGobierno Primer Piso Edificio Norte, Blvd. R. Juárez Cisneros 62 Col. Ciudad de los Servicios.\nChilpancingo, Guerrero. C.P. 39075.\nLas quejas y denuncias de la ciudadanía derivadas de alguna irregularidad en la operación del\nProyecto, podrán presentarse por escrito, por comparecencia de la población beneficiada, por correo electrónico o vía telefónica y deberá proporcionar los siguientes datos:\n• Nombre del servidor público.\n• Área de adscripción.\n• Objeto de la denuncia.\n• Nombre y domicilio del quejoso.\n• Identificación oficial.\n8.10. Mecanismos de exigibilidad\nLos casos en los que se podrán exigir los derechos por incumplimiento o por violación de los mismos pueden ocurrir en al menos los siguientes casos:\n✓ Cuando una persona solicitante cumpla con los requisitos y criterios de inclusión para acceder a determinado derecho.\n✓ Cuando la persona solicitante exija que se cumpla con dicho derecho de manera integral en tiempo y forma.\n✓ Cuando no se pueda satisfacer toda la demanda de incorporación al Proyecto por restricción presupuestal. atenderá las denuncias de violación e incumplimiento de derechos en materia de Desarrollo Social.\n8.11. Acta de entrega-recepción de donación correspondiente, dada la naturaleza del apoyo otorgado, en apego al control del gasto público.\n9. Criterios de selección y elegibilidad\n9.1. Método de selección de beneficiarios\nSerán beneficiados con el Proyecto, los solicitantes que cumplan con las siguientes características:\n• Familias en estado de vulnerabilidad, mujeres embarazadas, mujeres en periodo de lactancia, tener un empleo formal.\n• Habitar en el municipio o localidad de alto, muy alto grado de marginación.\n10. Mecánica de operación\n10.1. Instancia ejecutora\nLa Instancia ejecutora será el Sistema para el Desarrollo Integral de la Familia a través de la\nDirección de Asistencia Alimentaria y Desarrollo Comunitario, quien deberá operar con apego a la programación, presupuestación, calendario de ejecución, ejercicio y control del gasto público.\n10.2. Instancia administrativa y/o normativas\nLa instancia administrativa y normativa será la Dirección General del Sistema DIF Guerrero y la\nDirección de Asistencia Alimentaria y Desarrollo Comunitario la Secretaría Contraloría y Transparencia\nGubernamental y la Auditoría Superior del Estado en el ámbito de sus respectivas competencias, quienes darán seguimiento a los objetivos y metas del Proyecto.\n10.3. Delimitación de atribuciones\nEl DIF Guerrero establecerá los mecanismos de coordinación necesarios para garantizar que su proyecto y acciones no se contrapongan, afecten o presenten duplicidades con otros proyectos o acciones del gobierno estatal; la coordinación institucional y vinculación de acciones busca potenciar el impacto de los recursos, fortalecer la cobertura de las acciones, detonar la complementariedad y reducir gastos administrativos.\n11. Derechos, obligaciones y sanciones de los beneficiarios de programas sociales\n11.1. Derechos\n• Recibir trato digno, respetuoso y equitativo sin discriminación alguna, por el personal de las distintas áreas que participen dentro del Proyecto.\n• Reserva y privacidad de la información personal.\n• Acceder a la información necesaria del Proyecto, sus Reglas de Operación, recursos y cobertura.\n• Solicitar y recibir información sobre el estado que guarda su trámite.\n• Recibir los servicios y prestación del Proyecto conforme a las Reglas de Operación, salvo que le sea suspendido el apoyo por alguna razón justificable.\n11.2. Obligaciones\n• Proporcionar la información socioeconómica bajo protesta de decir verdad que les sea requerida por el DIF Guerrero, en los términos que establezca la normatividad correspondiente.\n• Utilizar los apoyos para los fines con que fueron autorizados evitando cualquier uso distinto de la misma.\n• Facilitar los trabajos de verificación, en cualquier momento después de otorgado el apoyo.\n11.3. Sanciones\nLas beneficiarias y/o los beneficiarios del Proyecto que incumplan en las disposiciones normativas para acceder a los beneficios que a través de estos se otorgan, perderán las prerrogativas establecidas en el numeral 6.2 y 6.3 que dichas disposiciones establecen.\n12. Interpretación\nLa interpretación de las presentes Reglas de Operación para efectos administrativos, estarán a cargo del DIF Guerrero, así como de la Secretaría de Contraloría y Transparencia Gubernamental, en el ámbito de sus respectivas competencias.\nPrimero. El presente Acuerdo entrará en vigor al día siguiente de su publicación en el Periódico\nSegundo. Se abroga el Acuerdo por el que se emiten las Reglas de Operación del Proyecto de\nInstalación de Panaderías para el Ejercicio Fiscal 2019, publicado en el Periódico Oficial del Gobierno del\nEstado de Guerrero No. 54 Alcance IX, de fecha 05 de julio de 2019.\nDado en la oficina del titular del Poder Ejecutivo, ubicada en el Edificio Centro de Palacio de\nGobierno, Boulevard René Juárez Cisneros No. 62, Colonia Ciudad de los Servicios en la Ciudad de\nChilpancingo de los Bravo, Capital del Estado de Guerrero, a los veintisiete días del mes de enero del año dos mil veinte.\nEL GOBERNADOR CONSTITUCIONAL DEL ESTADO DE GUERRERO.\nLIC. HÉCTOR ANTONIO ASTUDILLO FLORES\nRúbrica.\nEL SECRETARIO GENERAL DE GOBIERNO.\nLIC. FLORENCIO SALAZAR ADAME.\nRúbrica.\nESTADO DE GUERRERO.\nLIC. JOSÉ FRANCISCO SOLÍS SOLÍS.\nRúbrica.",
  "ordenamiento": "PROGRAMA",
  "jurisdiccion": "GUERRERO",
  "fuente_oficial": "DIARIO OFICIAL DE LA FEDERACION",
  "Fecha de Publicación": "28 de agosto de 2020",
  "ULTIMA REFORMA PUBLICADA": null,
  "status": "VIGENTE",
  "es_escaneado": false,
  "tiene_tablas": true,
  "materia": [
    "general"
  ]
}