{
  "titulo": "Acuerdo por el Que Se Crea el Programa Adquisición y Donación de Sillas de Ruedas y Se Emiten las Re",
  "Contenido": "EJERCICIO FISCAL 2019\nCREA EL PROGRAMA ADQUISICIÓN Y DONACIÓN DE SILLAS DE RUEDAS, Y SE EMITEN SUS\nREGLAS DE OPERACIÓN PARA EL EJERCICIO FISCAL 2020, PUBLICADO EN EL PERIÓDICO\nDE SEPTIEMBRE DE 2020.\nTEXTO ORIGINAL\nAcuerdo publicado en el Periódico Oficial del Gobierno del Estado No. 54 Alcance I, el Viernes 05 de Julio de 2019.\nACUERDO POR EL QUE SE CREA EL PROGRAMA ADQUISICION Y DONACION DE SILLAS DE\nRUEDAS Y SE EMITEN LAS REGLAS DE OPERACIÓN PARA, EL EJERCICIO FISCAL 2019.\nLIC. JOSÉ FRANCISCO SOLÍS SOLÍS, DIRECTOR GENERAL DEL SISTEMA PARA EL DESARROLLO\nINTEGRAL DE LA FAMILIA DEL ESTADO DE GUERRERO, EL CUAL ES UN ORGANISMO PÚBLICO\nDESCENTRALIZADO, CON PERSONALIDAD JURÍDICA Y PATRIMONIO PROPIO CREADO MEDIANTE\nLEY 107 PUBLICADA EN EL PERIÓDICO OFICIAL NÚMERO 10 DEL GOBIERNO DEL ESTADO CON\nFECHA 9 DE MARZO DE 1977 Y REGULADO POR LA LEY 479 PUBLICADA EN EL PERIÓDICO OFICIAL\nNÚMERO 61 DEL 02 DE AGOSTO DE 1983, CON FUNDAMENTO EN LA LEY 690 DE ENTIDADES\nPARAESTATALES PARA EL ESTADO DE GUERRERO; EL ARTÍCULO 27 FRACCIÓN X DEL\nREGLAMENTO INTERIOR DEL ORGANISMO PÚBLICO DESCENTRALIZADO, ASÍ COMO LA LEY\nSOBRE EL SISTEMA ESTATAL DE ASISTENCIA SOCIAL NÚMERO 332, ARTICULO 4, FRACCIONES I\nA LA XV; ARTICULO II BIS, FRACCIÓN I AL IV Y ARTÍCULO 11 TER, ÚLTIMA REFORMA PUBLICADA\nEN EL PERIÓDICO OFICIAL DEL GOBIERNO DEL ESTADO NÚMERO 15 DE FECHA 20 DE FEBRERO\nDEL 2015, Y LOS LINEAMIENTOS PARA LA ELABORACIÓN DE LAS REGLAS DE OPERACIÓN DE LOS\nPROGRAMAS SOCIALES ESTATALES PARA EL EJERCICIO FISCAL 2017, Y\nCONSIDERANDO\nQue en el Dictamen y Decreto Número 182 del Presupuesto de Egresos del Estado de Guerrero para el\nEjercicio Fiscal 2019, señala que se ejercerán los recursos bajo una política de gasto público, que permita dar cumplimiento a lo que globalmente prevén los ejes rectores del Plan Estatal de Desarrollo 20162021, por lo que el Programa Adquisición y Donación de Sillas de Ruedas se enmarca en el Eje: 3\nGuerrero Socialmente\nComprometido; Objetivo: 3.7: Fortalecer la Asistencia Social a Grupos Vulnerables; Estrategia: 3.7.1: que les permita mejorar su calidad de vida.\nDentro de la política de Desarrollo Social, el Sistema para el Desarrollo Integral de la Familia del Estado de\nGuerrero, tendrá a cargo la implementación, ejecución, evaluación y administración del Programa\nAdquisición y Donación de Sillas de Ruedas, bajo los criterios de objetividad, equidad, transparencia, publicidad, selectividad y temporalidad, con estricto apego a la normatividad aplicable, por lo tanto será el\nEJERCICIO FISCAL 2019 de operación.\nPor lo antes expuesto y con fundamento en las disposiciones legales antes citadas, he tenido a bien expedir el siguiente:\nACUERDO POR EL QUE SE CREA EL PROGRAMA ADQUISICIÓN Y DONACIÓN DE SILLAS DE\nRUEDAS Y SE EMITEN LAS REGLAS DE OPERACIÓN PARA, EL EJERCICIO FISCAL 2019.\nÚnico: Se emiten las Reglas de Operación del Programa\nAdquisición y Donación de Sillas de Ruedas, para el Ejercicio Fiscal 2019.\nCONTENIDO\n1. INTRODUCCIÓN\n1.1 Antecedentes\n1.2 Alineación programática\n1.3 Diagnóstico\n2. DEPENDENCIA O ENTIDAD RESPONSABLE DEL PROGRAMA\n3. OBJETIVOS Y ALCANCES\n3.1 General\n3.2 Específicos\n3.3 Alcances\n4. METAS FÍSICAS\n5. PROGRAMACIÓN PRESUPUESTAL\n6. REQUISITOS Y PROCEDIMIENTO DE ACCESO\n6.1 Difusión\n6.2 Requisitos de Acceso\n6.3 Procedimientos de Acceso\n6.4 Requisitos de Permanencia, Causales de Baja o Suspensión Temporal\n6.5 Modos de Entrega del Beneficio\n7. PROCEDIMIENTOS DE INSTRUMENTACIÓN\nEJERCICIO FISCAL 2019\n7.1 Operación\n7.2 Gastos de Operación\n8. TRANSPARENCIA\n8.1 Difusión\n8.2 Blindaje Electoral\n8.3 Supervisión y Control\n8.4 Mecanismos de Evaluación e Indicadores\n8.4.1 Evaluación\n8.4.2 Indicadores\n8.5 Auditoria\n8.6 Recursos no Devengados\n8.7 Contraloría Social\n8.8 Formas de Participación Social\n8.9 Procedimiento de Queja o Inconformidad Ciudadana\n8.10 Mecanismos de Exigibilidad\n8.11 Acta de Entrega-Recepción\n9. CRITERIOS DE SELECCIÓN Y ELEGIBILIDAD\n9.1 Método de Selección de Beneficiarios\n10. MECÁNICA DE OPERACIÓN\n10.1 Instancia Ejecutora\n10.2 Instancia administrativa y/o normativas\n10.3 Delimitación de atribuciones\n11. DERECHOS, OBLIGACIONES Y SANCIONES DE LOS BENEFICIARIOS DE PROGRAMAS\nSOCIALES\n11.1 Derechos\n11.2 Obligaciones\n11.3 Sanciones\n12. INTERPRETACIÓN\nTRANSITORIOS\nANEXOS\n1. INTRODUCCIÓN\nEJERCICIO FISCAL 2019\n1.1. ANTECEDENTES\nLa discapacidad es la condición de vida de una persona, adquirida durante su gestación, nacimiento, infancia o cualquier otra etapa de la vida, que se manifiesta por limitaciones significativas en el funcionamiento intelectual, motriz, sensorial (vista y oído) y en la conducta adaptativa, es decir, en la forma en que se relaciona en el hogar y la comunidad, respetando las formas de convivencia de cada ámbito.\nEl programa tiene su origen desde hace aproximadamente 10 años aplicando el concepto de vulnerabilidad el cual se aplica a aquellos sectores o grupos de la población que por su condición de edad, sexo, estado civil y origen étnico se encuentran en situación de riesgo que les impide incorporarse al desarrollo y acceder a mejores áreas de oportunidad para su bienestar. Teniendo derecho a la asistencia social los individuos y familias que por sus condiciones físicas, mentales, jurídicas, o sociales, requieran de servicios especializados para su protección y su plena integración al bienestar, entre los que encontramos preferentemente: todas las niñas, niños y adolescentes, en especial aquellos que se encuentren en situación de riesgo, las mujeres solas con hijos o maltratadas, Indígenas migrantes, desplazados o en situación vulnerable; Migrantes; Personas adultas mayores, personas con discapacidad, o necesidades especiales.\nEn el marco de la Ley de Asistencia Social, corresponde a este Organismo normar las acciones enfocadas al desarrollo del individuo, la familia y la comunidad. En ese sentido, el Programa Adquisición y Donación de Sillas de Ruedas constituye una de las vertientes a través de la cual se considera lograr un desarrollo integral e incluyente, para las personas y familias que se encuentran en situación de vulnerabilidad social, particularmente, en condiciones de pobreza, entregando a personas que con discapacidad Sillas de\nRuedas, dependiendo de la discapacidad que presente.\nLas sillas de ruedas o dispositivos de apoyo son productos, instrumentos, equipos o sistemas utilizados por una persona con discapacidad, fabricados especialmente para prevenir, compensar, disminuir o neutralizar una deficiencia, discapacidad o minusvalía.\nEl uso de las ayudas técnicas adecuadas permite a una persona con movilidad reducida o persona mayor aumentar su capacidad funcional para la realización de las tareas cotidianas, son, por tanto, objetos muy su entorno.\n1.2. ALINEACIÓN PROGRAMÁTICA\nEn cumplimiento a lo que globalmente prevén los ejes rectores del Plan Estatal de Desarrollo 2016-2021,\nIII.- Guerrero Socialmente Comprometido. Objetivo 3.7. Fortalecer la asistencia social a grupos vulnerables;\nEstrategia 3.7.1. Atender integralmente a los grupos vulnerables y fomentar el acceso a los servicios de protección social que les permita mejorar su calidad de vida a través de las Líneas de acción que:\nEJERCICIO FISCAL 2019\n• Proporcionar asistencia social integral a menores y adultos mayores que se encuentran en situación de vulnerabilidad.\n• Mejorar la atención de la salud a la población en situación de vulnerabilidad.\nAsí mismo se encuentran alineadas a lo estipulado en el Programa Sectorial \"Desarrollo y Asistencia Social\" que tiene como objetivo atender a personas vulnerables con carencias en materia de salud. En consecuencia, la formulación de un programa de desarrollo social exige conjugar armónicamente todos los elementos que lleven a la materialización de sus objetivos, estrategias, metas y evaluación de resultados.\nPor ello, se deben considerar en la introducción, los siguientes rubros:\nNaturaleza del Proyecto: Es un programa social el cual permitirá disminuir el impacto económico de las personas vulnerables a través de acciones que les permitan tener las mejores condiciones posibles para para prevenir, compensar, disminuir o neutralizar una deficiencia, discapacidad o minusvalía, con el uso de las ayudas técnicas adecuadas permitirá a una persona con movilidad reducida o persona mayor aumentar su capacidad funcional para la realización de las tareas cotidianas, por lo tanto, son objetos muy diversos que incrementan el nivel de independencia y autonomía personal del usuario con discapacidad en su entorno. Con la implementación de este programa permitirá cumplir con uno de los objetivos del Gobierno\nEstatal el cual es abatir la marginación y el rezago social que enfrentan los grupos sociales vulnerables para proveerles de igualdad en las oportunidades que les permitan desarrollarse con independencia y plenitud.\nOrigen y Fundamento: Constitución Política de los Estados Unidos Mexicanos Constitución Política del\nEstado número 71, alcance I de fecha 04 de septiembre de 2018, Ley General de Salud y Ley de Asistencia\nSocial.\nObjetivos y Metas: Otorgar Sillas de ruedas a personas con discapacidad temporal o permanente, por lo que se donarán 1,069 piezas para los diferentes tipos de discapacidad, que la requieran para favorecer su rehabilitación e inclusión social, mejorando su calidad de vida y favoreciendo la igualdad de oportunidades.\nUbicación Geográfica: Se atenderán a los 81 municipios que integran el Estado, dando prioridad a los municipios de alta y muy alta marginación. financieros, para llevar a cabo la adquisición de los materiales, insumos y productos necesarios en la operatividad del programa; así mismo dar a conocer al Sistema Municipal DIF, las Reglas de Operación del programa vigente y proporcionar de forma calendarizada los suministros de los apoyos.\nInstancias Participantes: La instancia ejecutora es el Sistema para el Desarrollo Integral de la Familia, a través de la Dirección de Servicios Médicos Asistenciales, quien se coordinará con los Sistemas\nMunicipales DIF para llevar a cabo la ejecución y seguimiento del programa.\nPresupuesto de Inversión: Se tiene contemplado una inversión de $4,310,442.99 (Cuatro millones trescientos diez mil cuatrocientos cuarenta y dos pesos 99/100 M.N.), recursos presupuestales que\nEJERCICIO FISCAL 2019 provienen del Ramo 33.- Aportaciones Federales para Entidades y Municipios, específicamente del Fondo de Aportaciones Múltiples (Asistencia Social).\nGlosario de Términos:\nSEDIF: Sistema para el Desarrollo Integral de la Familia.\nSEFINA: Secretaría de Administración y Finanzas.\nSEPLADER: Secretaría de Planeación y Desarrollo Regional.\nSecretaría de Contraloría: Secretaría de Contraloría y Transparencia Gubernamental.\nAsistencia Social: Conjunto de Acciones Tendientes a Modificar y Mejorar las Circunstancias de Carácter\nSocial que Impiden el Desarrollo Social del Individuo, así como la Protección Física, Mental y Social de\nPersonas en Estado de Necesidad.\nGrupos Vulnerables: Persona o grupo que por sus características de desventaja por edad, sexo, estado civil; nivel educativo, origen étnico, situación o condición física y/o mental; requieren de un esfuerzo adicional para incorporarse al desarrollo y a la convivencia.\nCONEVAL: Consejo Nacional de Evaluación de la Política de Desarrollo Social.\nPOBREZA: Una persona se encuentra en situación de pobreza cuando presenta al menos una carencia social y no tiene un ingreso suficiente para satisfacer sus necesidades.\nPOBREZA EXTREMA: Una persona se encuentra en situación de pobreza extrema cuando presenta tres o más carencias sociales y no tiene un ingreso suficiente para adquirir una canasta alimentaria.\nDiscapacidad.- Alteración funcional permanente, transitoria o prolongada, motora, sensorial o mental que, en relación a su edad y medio social, implique desventajas considerables para su adecuada integración social o laboral.\nAparatos Funcionales: Son los instrumentos, dispositivos o herramientas que permiten a las personas con discapacidad temporal o permanente, realizar actividades como desplazarse, obtener movimiento, caminar, trabajar, escuchar, entre otras.\n1.3. DIAGNOSTICO\nEn el estado de Guerrero como en todo el país, la discapacidad se asocia con bajas condiciones de bienestar tales como la pobreza extrema, la marginación social, la mal nutrición, el analfabetismo, la ignorancia, el aún acelerado crecimiento de la población y su dispersión, lo que restringe la prestación de los servicios sanitarios, limitando la correcta vigilancia prenatal y la adecuada atención del parto, también está asociada con el aumento de las personas de la tercera edad y de las enfermedades crónicodegenerativas no transmisibles, las lesiones por accidentes de todo tipo y la violencia.\nLa prevalencia de la discapacidad motriz es la más alta, alrededor del 40% de los diferentes tipos de discapacidad, de acuerdo con los resultados del XII Censo General de Población y Vivienda, lo que significa que alrededor de 20,000 personas en el año 2000, padecían de estas deficiencias físicas en el Estado de\nGuerrero.\nParticularmente, la prevalencia de la parálisis cerebral infantil se estima entre 2 y 3 casos por cada 1,000 habitantes, nos indica la existencia de entre 6,900 y 10,200 personas con PC, principalmente entre los menores de 15 años de edad. La disposición de impulsar actividades y acciones que permitan que la\nEJERCICIO FISCAL 2019 población de escasos recursos, que requieran de aparatos funcionales, de acuerdo al tipo de discapacidad que presentan (tales como: sillas de ruedas adulto, sillas de ruedas infantiles, sillas de ruedas aluminio infantil), el Sistema para atender esta problemática establece el Programa Adquisición y Donación de Sillas de Ruedas, el cual permitirá a la población beneficiada realizar con mayor facilidad, libertad e independencia sus actividades cotidianas, por lo que se pretende atender el problema detectado en el diagnostico a través de:\nVisión: Mejorar la calidad de vida de las personas con discapacidad logrando su independencia y funcionalidad, así como su integración a la vida social y laboral.\nMisión: Donar con Sillas de ruedas a todas las personas con discapacidad temporal o permanente con el propósito de restablecer sus capacidades de movilidad y auto desempeño, para mejorar su calidad de vida.\n2. DEPENDENCIA O ENTIDAD RESPONSABLE DEL PROGRAMA\nEs el Sistema para el Desarrollo Integral de la Familia a través de la Dirección de Servicios Médicos\nAsistenciales, el cual tiene como fundamento legal a la:\n• Constitución Política de los Estados Unidos Mexicanos, (última reforma publicada en el Diario Oficial de la Federación el 27 de agosto de 2018). periódico oficial del Gobierno del Estado número 71, alcance I de fecha 04 de septiembre de 2018).\n• Ley General de Salud, (última reforma publicada en el Diario Oficial de la Federación de fecha 12 julio de 2018).\n• Ley de Asistencia Social, (última reforma publicada en el Diario Oficial de la Federación de fecha\n24 de abril 2018).\n• Ley General para la Inclusión de las Personas con discapacidad, (última reforma publicada en el\nDiario Oficial de la Federación de fecha 12 de julio 2018).\n• Ley No. 817 para las Personas con Discapacidad del Estado, (última reforma publicada en el\nPeriódico Oficial número 103, de fecha 26 de diciembre de 2014).\n• Ley para el Bienestar e Incorporación Social de las Personas con Discapacidad en el Estado de\nGuerrero, No. 281.\n• Ley 479 del Sistema para el Desarrollo Integral de la Familia, publicada en el periódico Oficial el\nEJERCICIO FISCAL 2019 del 2015).\n• Plan Estatal de Desarrollo 2016 - 2021.\n• Programa Sectorial Desarrollo y Asistencia Social 20162021.\n• Decreto Número 182 del Presupuesto de Egresos del Estado de Guerrero para el ejercicio fiscal\n2019.\n• Estrategia Local \"Guerrero Contigo\"\n• Reglamento Interno del Sistema para el Desarrollo Integral de la Familia del Estado de Guerrero.\n• Manual de Organización del DIF Guerrero.\n• Y todos aquellos Ordenamientos Normativos Aplicables.\n3. OBJETIVOS Y ALCANCES\n3.1. OBJETIVO GENERAL.\nOtorgar 1069 piezas (sillas de ruedas) para los diferentes tipos de discapacidad, temporal o permanente a personas con discapacidad, que lo requieran para favorecer su rehabilitación e inclusión social, mejorando su calidad de vida y favoreciendo la igualdad de oportunidades.\n3.2. OBJETIVO ESPECIFICO.\n• Favorecer la rehabilitación y prevenir discapacidades secundarias.\n• Contribuir a la integración plena de las personas con discapacidad en la sociedad.\n• Favorecer su independencia y funcionalidad.\n3.3. ALCANCES\nEl problema que se atiende a través de este programa es el derecho a la seguridad social, mejorando su calidad de vida, de las personas que presentan algún tipo de discapacidad ya sea temporal o permanente que requieran silla de ruedas, adquiriendo y donando 1,069 a la población de los 81 municipios que integran a nuestro Estado, dando prioridad a los municipios de alta y muy alta marginación, favoreciendo su inclusión e integración a la sociedad.\n4. METAS FÍSICAS\nSe pretende beneficiar a un total de 1,069 personas con discapacidad, procedentes de los 81 municipios del Estado, dando prioridad a la población más vulnerable.\n5. PROGRAMACIÓN PRESUPUESTAL\nSubsidiado a través de recursos presupuéstales provenientes del Ramo 33.- Aportaciones Federales para\nEntidades y Municipios, específicamente del Fondo de Aportaciones Múltiples (Asistencia Social), con una\nEJERCICIO FISCAL 2019 inversión para el Ejercicio Fiscal 2019 de $4, 310,442.99 (Cuatro millones trescientos diez mil cuatrocientos cuarenta y dos pesos 99/100 M.N.), recursos que se ejercerán bajo una política de gasto público, que permita dar cumplimiento a lo que globalmente prevén los ejes rectores del Plan Estatal de Desarrollo 2016-\n2021.\nCALENDARIO DE MINISTRACIÓN\nPRES. AUT. ENERO FEBRERO MARZO ABRIL MAYO\n4,310,442.99 0.00 0.00 4,310,442.99 0.00 0.00\nNOTA: PUEDE EXISTIR VARIACION EN RELACION A LO APROBADO POR EL DPEF Y/O A LAS PROPIAS\nNECESIDADES DEL SISTEMA, LA MINISTRACIÓN DEL RECURSO SE REALIZA EN UNA SOLA EMISIÓN.\n6. REQUISITOS Y PROCEDIMIENTOS DE ACCESO\n6.1. DIFUSION\nEl sistema para el Desarrollo Integral de la Familia a través de los diferentes medios de comunicación y de las redes sociales da conocer cada uno de los requisitos de los diferentes programas y proyectos de asistencia social que ejecuta y opera en coordinación con las diferentes Direcciones que lo integran las cuales son; Programas Alimentarios, Proyectos Asistenciales, de Bienestar Social y Desarrollo\nComunitario; que están ubicadas en Av. Rene Juárez Cisneros, Colonia Ciudad de los Servicios y Av.\nGabriel Leyva s/n esq. Ruffo Figueroa, Col. Burócratas, C.P. 39090, Chilpancingo, Guerrero, con un horario de atención de 8:00 am a 3:00 pm y/o los teléfonos 01(747) 4725595, 01(747)47256 00, 01(747)47 25672 ext. 1151 Y 1159. Así mismo al correo electrónico: alimentariadif@prodigy.net.mx, subdireccionalimentaria@prodigy.net.mx\nLas reglas de operación de cada uno de los programas y proyectos son difundidas por personal capacitado de cada una de las Direcciones y en la página web https://guerrero.gob.mx del Portal del Gobierno del\nEstado, mismos que brindan atención a los 81 municipios del Estado, teniendo una capacidad de atención de niñas, niños y adolescentes, mujeres embarazadas, mujeres en periodo de lactancia, personas con discapacidad, adultos mayores y personas vulnerables por ingresos. Además de su publicación en el en las Oficinas de la Dirección de Servicios Médicos Asistenciales, así como en la página electrónica del\nLeyva s/n esq. Ruffo Figueroa, Col. Burócratas, C.P. 39090, Chilpancingo, Guerrero., a los teléfonos\n(01747) 47 2 55 95, (01747) 47 2 56 00, (01747) 47 2 56 72 ext. 1155. Así mismo para obtener información a través del correo electrónico: subdescomdif@prodigy.net.mx\n6.2. REQUISITOS DE ACCESO\nEJERCICIO FISCAL 2019\n• El interesado deberá presentar oficio de solicitud en formato y escrito libre en las instalaciones del\nDIF Guerrero, con domicilio en el Centro de Rehabilitación Integral Guerrero, Boulevard Lic. René\nJuárez Cisneros S/N, Col. Ciudad de los Servicios, Chilpancingo, Guerrero dirigido al Director\nGeneral o la Presidenta del Patronato del DIF Guerrero para ser considerado en el Programa.\n• La solicitud es turnada a la Dirección de Servicios Médicos Asistenciales para la atención en el\nDepartamento de Ayudas Funcionales, anexando los siguientes requisitos:\n1) Fotografía reciente del solicitante de cuerpo completo en tamaño postal.\n2) Constancia medica que especifique el tipo de discapacidad, la cual deberá ser expedida por el\nC.R.I.G Chilpancingo o una Institución de Salud Pública (SSA, DIF-ESTATAL Y MUNICIPAL), el certificado médico deberá ser firmado y expedido por un médico con cedula profesional.\n3) Copia del acta de nacimiento.\n4) Copia de la CURP al 200% si es el formato anterior.\n5) Copia del comprobante de domicilio reciente.\n6) Copia fotostática de la credencial de elector al 200%\n7) Se aplica el estudio socio económico, al solicitante para determinar la susceptibilidad de ser beneficiario.\n6.3. PROCEDIMIENTOS DE ACCESO\nLa operación del Programa de Adquisición y Donación de sillas de ruedas surge por la necesidad de atender a personas que presentan una Discapacidad temporal o permanente, siendo la población más vulnerable, atiende a los 81 municipios que conforman nuestro Estado, dando prioridad a los municipios de alta o muy alta marginación, mismo que surge por demanda ciudadana y / o peticiones que se reciben en las instalaciones del Sistema para el Desarrollo Integral de la Familia o directamente a la Presidenta del\nSistema Estatal.\nSerán beneficiados con el apoyo del programa, los solicitantes que cumplan con las siguientes características y de acuerdo a la disponibilidad presupuestal del programa:\n✓ Niños, Adolescentes y adultos mayores que tengan una discapacidad temporal o permanente, ya que son los que se encuentran en estado de vulnerabilidad.\n✓ Habitar en uno de los 81 Municipios de nuestro Estado y con más alta marginación, ya que son los más vulnerables.\nLos interesados deberán presentar su solicitud en formato libre de ingreso al programa, en las instalaciones del DIF Guerrero, con domicilio en el Centro de Rehabilitación Integral Guerrero, Boulevard Lic. René\nJuárez Cisneros S/N, Col. Ciudad de los Servicios, Chilpancingo, Guerrero C.P. 39095, dirigido a la\nPresidenta del Patronato del DIF Guerrero para ser considerados dentro del Programa, con un horario de atención de 8:00 am a 3:00 pm y/o los teléfonos 01(747) 47 1 84 90, 01(747) 47 184 98 ext. 1074 Y 1077.\nAsí mismo al correo electrónico: direccionserviciomedico@hotmail.com\nEJERCICIO FISCAL 2019\nDiscapacidad en estado de vulnerabilidad; así mismo se entregara un comprobante de acceso al programa que en un plazo no mayor a 30 días hábiles dará respuesta a la solicitud.\nAdquisición y Donación de sillas de ruedas, formaran parte de un Padrón Único de Beneficiarios, donde sus datos personales, e información administrada y/o generada será resguardada de acuerdo con la Ley\n207 de Transparencia y Acceso a la Información Pública del Estado; los cuales en ningún caso podrán emplearse para propósitos de proselitismo político, religioso o comercial, ni para ningún otro fin distinto al establecido en las Reglas de Operación del programa social.\nY en ningún caso las y los servidores públicos podrán solicitar o proceder de manera diferente a lo establecido en las Reglas de Operación.\n6.4. REQUISITOS DE PERMANENCIA, CAUSALES DE BAJA O SUSPENSION TEMPORAL\nCausaría baja cuando a través del estudio socioeconómico, se comprueba que tiene solvencia económica; lo demás no aplica por la naturaleza propia del programa.\n6.5. MODOS DE ENTREGA DEL BENEFICIO\nEl solicitante deberá acudir al CRIG Guerrero donde se le entregará de manera directa y por única ocasión el apoyo, con el propósito de restablecer sus capacidades de movilidad y auto desempeño.de acuerdo al tipo de discapacidad se le otorgara:\n1.- Carriola para PCI\n2.-Sillas de ruedas Estándar No. 18\n3.- Sillas de ruedas infantiles Estándar No. 14\n4.- Silla de ruedas especial PCI\n5.- Sillas de ruedas de aluminio\n7. PROCEDIMIENTOS DE INSTRUMENTACIÓN\n7.1. OPERACIÓN\na) El paciente, familiar o gestor (DIF-municipales) acuden al Sistema Estatal para el Desarrollo Integral de la Familia, específicamente a la Dirección de Servicios Médicos Asistenciales, a solicitar los requisitos para la incluicion al programa.\nb) Una vez que fue atendido e informado referente a la documentación que esté deberá de entregar al\nDepartamento de Aparatos funcionales, mencionado en el apartado 6.2.\nc) Se presenta el paciente, familiar o gestor, (DIF-MUNICIPAL) al departamento de Aparatos funcionales, reglas de operación del programa.\nEJERCICIO FISCAL 2019\nd) Un vez completo el expediente, se recibe la documentación, se sella de recibido su oficio de petición\n(ACUSE) con el sello correspondiente del Departamento de Aparatos funcionales, agregando la fecha correspondiente de recibido.\ne) Así mismo se le informara vía telefónica en tiempo y forma la entrega.\nf) Dicha entrega se llevará a cabo en gira de trabajo o en evento programado por la Coordinación de giras, de la Presidenta del DIF-Guerrero.\ng) Los tramites y formatos son gratuitos.\n7.2. GASTOS DE OPERACIÓN\nEl presupuesto asignado a este programa, es a través del Fondo de Aportaciones Múltiples, no contempla\nGastos de Operación.\n8. TRANSPARENCIA\n8.1. DIFUSIÓN\nLa instancia responsable es la Dirección de Servicios Médicos Asistenciales, quien difundirá a través de diferentes medios de comunicación; trípticos, periódico, redes sociales en las cuales se dará a conocer la información relacionada con las características del programa de Adquisición y Donación de Sillas de ruedas.\nAsí mismo se dará amplia difusión al Programa a nivel Estatal y se promoverán similares acciones por parte de las autoridades locales; la información del programa se dará a conocer en la página de internet https://www.guerrero.gob.mx del Gobierno del Estado, desagregada por municipio, barrio o zona urbanomarginada, programa y nombre del beneficiario y / o beneficiaria.\nLas copias de los expedientes de los beneficiarios y / o beneficiarias estarán disponibles oportunamente para su consulta en las oficinas del Sistema ubicadas en Av. Rene Juárez Cisneros, Colonia Ciudad de los\nServicios y C.P. 39095, Chilpancingo, Guerrero; por otra parte la papelería, documentación oficial, así como la publicidad y promoción de los Programas, deberán incluir la leyenda descrita en el apartado de \"Blindaje\nElectoral\".\nLa información de montos y beneficiarios será publicada en los términos de la Ley No. 207 de Transparencia y Acceso a la Información Pública del Estado de Guerrero.\nUna vez autorizadas estas Reglas de Operación, por las instancias correspondientes, estarán disponibles para su consulta en las Oficinas de la Dirección de Servicios Médicos Asistenciales, así como en los medios\n8.2. BLINDAJE ELECTORAL\nEJERCICIO FISCAL 2019\nLa operación y ejecución de los recursos estatales destinados al Programa, deberán observar y atender las medidas que emita la Secretaría de Contraloría y Transparencia Gubernamental, para coadyuvar a que éstos, no sean utilizados con fines políticos en el desarrollo de procesos electorales federales, estatales y municipales.\nComo estrategia de blindaje electoral, la papelería, documentación oficial, así como la publicidad y promoción del Programa deberán incluir la siguiente leyenda:\n\"Este Programa es público, ajeno a cualquier partido político. Queda prohibido el uso para fines distintos a los establecidos en el programa\"\n8.3. SUPERVISIÓN Y CONTROL\nLa Dirección de Servicios Médicos Asistenciales deberá reportar mensualmente a la Dirección de\nPlaneación del DIF Guerrero, las acciones ejercidas y los resultados obtenidos, quien a su vez reportará a la Secretaría de Planeación y Desarrollo Regional (SEPLADER), Secretaría de Finanzas y Administración\n(SEFINA) y a la Secretaría de Contraloría y Transparencia Gubernamental trimestralmente, informes sobre el presupuesto ejercido establecidos por el Consejo Nacional de Armonización Contable (CONAC) y con base en los indicadores de resultados previstos en las Reglas de Operación; mismos que se deberán presentar a más tardar a los quince días hábiles posteriores a la terminación de cada trimestre.\nLos padrones de los beneficiarios serán requisitados por los Sistemas Municipales DIF, remitiendo para su revisión a este Sistema Estatal DIF el padrón físico física y digital de la dotación entregada para la integración de los Padrones de Beneficiarios de los 81 municipios de la Entidad mismo que serán remitidos a las instancias o dependencias operadoras.\n8.4. MECANISMOS DE EVALUACIÓN E INDICADORES\n8.4.1. EVALUACION correspondientes.\n8.4. 2. INDICADORES\nMatriz de Indicadores de Resultados\nDetalle de la Matriz 2019\nRamo: 5 - Sector Paraestatal\nUnidad Responsable: P-46 -O.P.D. Sistema para el Desarrollo Integral de la Familia\nClave y Modalidad del Pp: S- Sujetos a Reglas de Operación E- Prestación de Servicios Públicos\nEJERCICIO FISCAL 2019\nS01\nDenominación del Pp:\nE01\nClasificacion Funcional:\nFinalidad: 2. Desarrollo Social\n2.3. SALUD\nFunción: 2.4 RECREACIÓN, CULTURA Y OTRAS MANIFESTACIONES SOCIALES\n2.6. PROTECCIÓN SOCIAL\n2.6.5 Alimentación y Nutrición\n2.3.2. Prestación de Servicios de\n2.6.6 Apoyo Social para la Vivienda\nSalud a la Persona\n2.6.7 Indígenas\n2.4.2. Cultura\n2.6.8 Otros Grupos Vulnerables\nSubfunción: 2.6.1. Enfermedad e Incapacidad\n2.6.9 Otros de Seguridad Social y\n2.6.2. Edad Avanzada\nAsistencia Social\n2.6.3.Familia e Hijos\n2.6.4. Desempleo\nResumen narrativo Orden Supuestos\nContribuir a mejorar el nivel de vida de los Se fortalecen la cobertura grupos vulnerables mediante acciones de Padrón de beneficiarios poblacional de los programas\nAsistencia Social sociales\nUnidad Frecuencia Línea\nTipo de Meta Medios de\nIndicador Método de Cálculo de de Base\nIndicador 2018 Verificación\nMedida Medición 2017\nPorcentaje de (Población población atendida/Total de Padrón de\nPersonas Anual Estratégico 70% 90% vulnerable población beneficiarios atendida vulnerable)*100\nPropósito\nResumen narrativo Orden Supuestos\nLas obras y/o acciones\nFortalecer las acciones de desarrollo Ampliación de cobertura poblacional contribuyen a mejorar la calidad social y Humano de los programas sociales de vida\nUnidad Frecuencia Línea\nTipo de Meta Medios de\nIndicador Método de Cálculo de de Base\nIndicador 2018 Verificación\nMedida Medición 2017\n(Programas\nPorcentaje de implementados en\nOficios de\nProgramas 2017 / Programas Programas Anual Estratégico 70% 90% autorización implementados implementados en\n2018)* 100\nComponente\nResumen narrativo Orden Supuestos\nEJERCICIO FISCAL 2019 marginación, poniendo énfasis en los primaria y prescolar, así como\nAsistencia Social grupos de alto riesgo, a fin de mejorar la implementar Proyectos calidad en la dieta y apoyar el gasto Productivos, de Economía y familiar. Traspatio\nUnidad Frecuencia Línea\nTipo de Meta Medios de\nIndicador Método de Cálculo de de Base\nIndicador 2018 Verificación\nMedida Medición 2017\n(Número de despensasProporción de dotaciones distribuidas despensasen el periodo de dotaciones acuerdo a los criterios Avance Físicoentregadas que Porcentaje Trimestral Estratégico 0% 100% de calidad nutricia de Financiero cumplen con los los Lineamientos de la criterios de calidad\nEIASA / Número total nutricia de apoyos entregados en el periodo) * 100\nPorcentaje de\n(Total de apoyos apoyos de otorgados / total de Avance FísicoDesarrollo Porcentaje Semestral Estratégico 0% 100% apoyos programados) Financiero\nComunitario\n* 100 otorgados\nResumen narrativo Orden Supuestos\nElevar la calidad de vida de las familias y comunidades marginadas, a través de su Beneficiar a los grupos participación activa en programas de Descendente vulnerables para su desarrollo asistencia social y apoyo jurídico, que les físico y mental permita alcanzar su desarrollo integral\nUnidad Frecuencia Línea\nTipo de Meta Medios de\nIndicador Método de Cálculo de de Base\nIndicador 2018 Verificación\nMedida Medición 2017\n(Total de apoyos\nPorcentaje de apoyos otorgados / total de Avance FísicoPorcentaje Semestral Estratégico 0% 100%\nSociales otorgados apoyos programados) * Financiero\n100\nResumen narrativo Orden Supuestos\nAtender y apoyar a las personas con discapacidad, mediante servicios asistenciales Los servicios otorgados contribuyen\nDescendente y de rehabilitación, para lograr su incorporación a la rehabilitación de las personas al entorno social con discapacidad\nUnidad Frecuencia Línea\nTipo de Meta Medios de\nIndicador Método de Cálculo de de Base\nIndicador 2018 Verificación\nMedida Medición 2017\nEJERCICIO FISCAL 2019\n(Total de servicios otorgados / total de\nPorcentaje de Avance Físicoservicios programados) * Porcentaje Semestral Estratégico 0% 100%\nServicios otorgados Financiero\n100\nResumen narrativo Orden Supuestos\nAdministración interna y servicios generales del Se recibe en tiempo las\nDIF comprobaciones por parte de los\nAscendente ejecutores del Gasto.\nUnidad Frecuencia Línea\nTipo de Meta Medios de\nIndicador Método de Cálculo de de Base\nIndicador 2018 Verificación\nMedida Medición 2017\n(Número de\nPorcentaje de comprobaciones comprobaciones entregadas en Porcentaje Semestral Estratégico 0% 100% Avance Físicoentregadas a tiempo/Total de Financiero tiempo. comprobaciones realizadas)*100\nActividades\nResumen narrativo Orden Supuestos\nDeterminar el nivel de atención alimentaria a población en condiciones emergencia afectada Asistencia Social Beneficiar a los grupos vulnerables por Desastres Naturales. para su desarrollo físico y mental\nUnidad Frecuencia Línea\nTipo de Meta Medios de\nIndicador Método de Cálculo de de Base\nIndicador 2018 Verificación\nMedida Medición 2017\nAtención Alimentaria en Mpios. En\nEmergencia = Mpios. con Declaración de\nAcceso Alimentario Avance Físicoemergencia atendidos Personas Anual Estratégico 100 100% en Riesgo Financiero\n/ Total de Mpios. con\nDeclaratoria de emergencia en la\nEntidad.\nResumen narrativo Orden Supuestos\nDeterminar el porcentaje de desnutrición Los menores beneficiados, en los menores beneficiados con insumos Descendente disponen de una alimentación alimentarios. con calidad nutricia\nUnidad Frecuencia Línea\nTipo de Meta Medios de\nIndicador Método de Cálculo de de Base\nIndicador 2018 Verificación\nMedida Medición 2017\n(Menores beneficiados que tienen algún grado de\nDesnutrición Avance FísicoDesnutrición / Total de Menores Anual Estratégico 22% 20%\nInfantil Financiero\nMenores beneficiados con insumos alimentarios) * 100\nResumen narrativo Orden Supuestos\nEJERCICIO FISCAL 2019 alimentarios.\nUnidad Frecuencia Línea\nTipo de Meta Medios de\nIndicador Método de Cálculo de de Base\nIndicador 2018 Verificación\nMedida Medición 2017\nPorcentaje de\nObesidad en Menores\n= Menores\nBeneficiados que\nAvance FísicoObesidad Infantil tienen algún grado de Menores Anual Estratégico 15% 11%\nFinanciero\nObesidad / Total de\nMenores Beneficiados con insumos\nAlimenticios\nResumen narrativo Orden Supuestos\nDeterminar el porcentaje de atención de los menores en la distribución de insumos Ascendente alimentarios.\nUnidad Frecuencia Línea\nTipo de Meta Medios de\nIndicador Método de Cálculo de de Base\nIndicador 2018 Verificación\nMedida Medición 2017\nPorcentaje de\nObesidad en Menores\n= Menores\nAcceso Alimentario Beneficiados que\nAvance Físicoen Menores no tienen algún grado de Menores Anual Estratégico 100% 100%\nFinanciero\nEscolarizados Obesidad / Total de\nMenores Beneficiados con insumos\nAlimenticios\nResumen narrativo Orden Supuestos\nPermite determinar el nivel de atención a municipios con alto índice de carencia La población vulnerable, alimentaria, a fin de propiciar el Descendente dispone de una alimentación mejoramiento alimentario de los grupos con calidad nutricia con mayor vulnerabilidad en la entidad.\nUnidad Frecuencia Línea\nTipo de Meta Medios de\nIndicador Método de Cálculo de de Base\nIndicador 2018 Verificación\nMedida Medición 2017\nMpios con Alto Indice de Carencia\nAlimentaria No\nAcceso a la Avance FísicoAtendidos = Mpios. Municipio Anual Estratégico 0 100%\nAlimentación Financiero con A.I.C.A. no atendidos / Total de\nMpios. en la Entidad.\nResumen narrativo Orden Supuestos\nEJERCICIO FISCAL 2019\nLa población beneficiada recibe apoyos para fortalecer la economía, Conocer la cantidad de personas alimentación y de sus beneficiadas con los Proyectos Ascendente familias\nProductivos de Economía y Traspatio\nUnidad Frecuencia Línea\nTipo de Meta Medios de\nIndicador Método de Cálculo de de Base\nIndicador 2018 Verificación\nMedida Medición 2017\nÍndice de avance (beneficiarios en la entrega de atendidos / Avance FísicoPersonas Anual Estratégico 80% 100%\nProyectos Beneficiarios Financiero\nProductivos programados) * 100\nResumen narrativo Orden Supuestos\nPoblación que requiere algún tipo de La población vulnerable tiene servicio médico y que carece de Ascendente acceso a los servicios de servicio medico salud\nUnidad Frecuencia Línea\nTipo de Meta Medios de\nIndicador Método de Cálculo de de Base\nIndicador 2018 Verificación\nMedida Medición 2017\nPoblación sin acceso\nPoblación sin a los servicios de acceso a los Avance Físicosalud = Población Personas Anual Estratégico 80% 100% servicios de salud Financiero atendida / Población\n(PSASS) programada\nResumen narrativo Orden Supuestos\nConocer los apoyos entregados en la Se entregan todos los temporada invernal (Suéteres y Ascendente apoyos a la población\nCobertores) vulnerable\nUnidad Frecuencia Línea\nTipo de Meta Medios de\nIndicador Método de Cálculo de de Base\nIndicador 2018 Verificación\nMedida Medición 2017\nEntrega de Apoyos =\nApoyos\nTotal de Apoyos Padrón de entregados en la Apoyos Anual Estratégico 0% 100%\nAtendidos / Total de Beneficiarios temporada invernal\nApoyos Programados\nResumen narrativo Orden Supuestos\nLos apoyos entregados, Personas Beneficiadas con Apoyos\nAscendente contribuyen a subsanar las\nEconómicos y en Especie necesidades de la sociedad.\nEJERCICIO FISCAL 2019\nUnidad Frecuencia Línea\nTipo de Meta Medios de\nIndicador Método de Cálculo de de Base\nIndicador 2018 Verificación\nMedida Medición 2017\n(Total de apoyos\nPorcentaje de otorgados / total de Avance Físicoapoyos Sociales Porcentaje Semestral Estratégico 0% 100% apoyos programados) Financiero otorgados\n* 100\n8.5. AUDITORIA\nEl ejercicio del recurso y la operatividad del Proyecto, están sujetos a las disposiciones Estatales aplicables y podrá ser auditado por la Secretaria de Contraloría y Transparencia Gubernamental, así como por la Auditoría Superior del\nEstado y Auditoria Superior de la Federación, conforme a la legislación vigente y en el ámbito de sus respectivas competencias.\nEl Sistema DIF Guerrero dará todas las facilidades a dichas instancias para realizar, en el momento en que lo juzguen pertinente, las auditorías que consideren necesarias; así como el seguimiento y la solventación a las observaciones planteadas por los órganos de control.\n8.6. RECURSOS NO DEVENGADOS\nEl DIF Guerrero deberá reintegrar a la Dirección General de Tesorería de la Secretaría de Finanzas y Administración del Gobierno del Estado los recursos que no se hubiesen destinado a los fines autorizados y aquellos que por cualquier motivo no estuviesen devengados al 31 de diciembre del Ejercicio fiscal correspondiente.\n8.7. CONTRALORÍA SOCIAL\nCon la finalidad de incrementar la participación ciudadana, se crearán Comités de Contraloría Social, como un órgano ciudadano de control, vigilancia y evaluación de las actividades del Programa, conformados por la población beneficiada, los sectores sociales, y los representantes de la localidad, quienes de manera especificas supervisarán la gestión gubernamental, y que el manejo de los recursos públicos se realicen en términos de transparencia, eficacia, legalidad y honradez; los objetivos específicos de este Órgano de Contraloría Social son:\n➢ Hacer más transparentes las decisiones y la ejecución de los recursos.\n➢ Incrementar la participación ciudadana.\n➢ Fomentar la organización social.\n➢ Inhibir los actos de corrupción y de cooptación social, política y electoral.\n➢ Incrementar la eficiencia de los recursos públicos.\n➢ Fortalecer la cultura de la legalidad.\n➢ Mejorar la rendición de cuentas.\n➢ Perfeccionar la democracia e incorporar la evaluación ciudadana.\n8.8. FORMAS DE PARTICIPACIÓN SOCIAL establece que la sociedad podrá participar activamente en la Planeación, Programación, Implementación y Evaluación de los Programas Sociales de Desarrollo Social, por ello los beneficiarios y beneficiarias participaran en la etapa de\nEJERCICIO FISCAL 2019 la implementación y podrán supervisar la gestión gubernamental, que el manejo de los recursos públicos se realicen en términos de transparencia, eficacia, legalidad y honradez del Proyecto de acuerdo en lo estipulado en estas Reglas de Operación.\nBeneficiarios/ Implementación Comités de Contraloría Seguimiento\nBeneficiarias\n8.9. PROCEDIMIENTOS DE QU\nLas personas beneficiadas pueden presentar quejas y denuncias ante las instancias correspondientes sobre cualquier hecho, acto u omisión que produzca o pueda producir daños al ejercicio de sus derechos establecidos en las presentes reglas o contravengan sus disposiciones y de la demás normatividad aplicable, las instancias son: a. En el Sistema DIF Guerrero\nCorreo electrónico: buzon.dif@guerrero.gob.mx\nDomicilio: Centro de Rehabilitación Integral Guerrero.\nBoulevard Lic. René Juárez Cisneros S/N, Col. Ciudad de los Servicios. Chilpancingo, Guerrero. C.P. 39095. b. En la Secretaría de Contraloría y Transparencia Gubernamental.\nTeléfonos: (474) 47 1 97 41\nCorreo electrónico: contraloria@guerrero.gob.mx\nDomicilio: Palacio de Gobierno Primer Piso Edificio Norte, Blvd. R. Juárez Cisneros 62 Col. Ciudad de los Servicios.\nChilpancingo, Guerrero. C.P. 39075.\nLas quejas y denuncias de la ciudadanía derivadas de alguna irregularidad en la operación del Programa, podrán presentarse por escrito, por comparecencia del beneficiario (a), por correo electrónico o vía telefónica y deberá proporcionar los siguientes datos:\n• Nombre del servidor público.\n• Área de adscripción.\n• Objeto de la denuncia.\n• Nombre y domicilio del quejoso.\n• Identificación oficial.\n8.10. MECANISMOS DE EXIGIBILIDAD\nServicios Médicos Asistenciales del DIF Guerrero, ubicado en Boulevard Rene Juárez Cisneros, col. Ciudad de los\nServicios, Chilpancingo, Guerrero; los casos en los que se podrá exigir los derechos por incumplimiento o por violación de los mismos pueden ocurrir en al menos los siguientes casos:\nEJERCICIO FISCAL 2019\na) Cuando una persona solicitante cumpla con los requisitos y criterios de inclusión para acceder a determinado derecho (garantizado por un programa social) y exija a la autoridad administrativa ser derecho habiente del mismo.\nb) Cuando la persona derechohabiente de alguna instancia medica exija que se cumpla con dicho derecho, de manera integral en tiempo y forma, como lo establece el programa.\nc) Cuando no se pueda satisfacer toda la demanda de restricción presupuestal, y estás exijan que las incorporaciones sean claras, transparentes, equitativas, sin favoritismos, ni discriminación.\nLa Secretaría de Contraloría y Transparencia Gubernamental del Gobierno del Estado es el órgano competente para conocer de las denuncias de violación e incumplimiento de derechos en materia de desarrollo social.\n8.11. ACTA ENTREGA RECEPCIÓN\nUna vez entregada la silla de ruedas al paciente, firmara el acta de donación correspondiente, así como la toma de una evidencia fotografía de la persona beneficiada con la silla de ruedas otorgada por el DIF-Guerrero, misma que será anexada al expediente.\n9. CRITERIOS DE SELECCIÓN Y ELEGIBILIDAD\n9.1. DE SELECCIÓN DE BENEFICIARIOS\nSe beneficiaran con este programa las personas que cumplan con la siguiente característica:\n• Personas que presenten alguna discapacidad temporal o permanente.\n10. MECÁNICA DE OPERACIÓN\n10.1. INSTANCIA EJECUTORA\nLa Instancia Ejecutora es el sistema para el Desarrollo Integral de la Familia a través de la Dirección de Servicios\nMédicos Asistenciales, quien deberá operar con apego a la programación, presupuestación, calendario de ejecución, ejercicio y control del gasto público.\n10.2. INSTANCIA ADMINISTRATIVA Y/O NORMATIVA\nMédicos Asistenciales, quienes tendrán la responsabilidad de definir los métodos y procedimientos para normar y regular la operatividad del Programa asegurando el cumplimiento de los objetivos y metas trazadas.\n10.3. DELIMITACIÓN DE ATRIBUCIONES\nEl Sistema Estatal para el Desarrollo Integral de la Familia (DIF Guerrero) establecerá los mecanismos de coordinación necesaria para garantizar que sus programas y acciones no se contrapongan, afecten o presenten duplicidades con otros programas o acciones del Gobierno Estatal; la coordinación institucional y vinculación de acciones busca potenciar el impacto de los recursos, fortalecer la cobertura de las acciones, detonar la complementariedad y reducir gastos administrativos.\nEJERCICIO FISCAL 2019\n11. DERECHOS Y OBLIGACIONES Y SANCIONES DE LOS BENEFICIARIOS DE PROGRAMAS SOCIALES.\n11.1. DERECHOS\n• Recibir trato digno, respetuoso y equitativo sin discriminación alguna por el personal de las distintas áreas que participen.\n• Tener la reserva y privacidad de la información personal.\n• Solicitar y recibir información sobre el estado que guarda su trámite.\n• Recibir los servicios y prestación del programa conforme a las Reglas de Operación, salvo que le sea suspendido su apoyo por alguna razón justificable.\n• Recibir del Sistema Estatal una respuesta en los 30 días hábiles, después de haber entregado sus documentos y haber sido aceptado dentro del programa.\n11.2. OBLIGACIONES\n• Proporcionar la información socioeconómica bajo protesta de decir verdad que les sea requerida por el DIF\nGuerrero, en los términos que establezca la normatividad correspondiente.\n• Utilizar los apoyos para los fines con que fueron autorizados evitando cualquier uso distinto de los mismos.\n• Permitir la visita con la finalidad de validar la información proporcionada en sus expedientes correspondientes.\n• Facilitar los trabajos de verificación, en cualquier momento después de otorgado el apoyo.\n11.3. SANCIONES\nLos beneficiarios y las beneficiarias del programa de Adquisición y Donación de Sillas de ruedas que incumplan en la\nDisposiciones Normativas, establecidas en los numerales 6.2 y 6.3, para acceder a los beneficios que a través de estos se otorgan, perderán las prerrogativas que dichas disposiciones establecen.\n12. INTERPRETACIÓN\nLa interpretación de las presentes Reglas de Operación para efectos administrativos, estarán a cargo del DIF\nGuerrero, así como de la Secretaría de Contraloría y Transparencia Gubernamental, en el ámbito de sus respectivas competencias\nTRANSITORIOS\nPrimero: El presente acuerdo entrará en vigor al día siguiente de su publicación en el Periódico Oficial del Gobierno del Estado de Guerrero.\nSegundo: Las Reglas de Operación del Programa Adquisición y Donación de Sillas de Ruedas para, el Ejercicio\nFiscal 2019, se publican en su totalidad para mejor entendimiento.\nTercero: Quedan abrogadas las Reglas de Operación del Programa Adquisición y Donación de Sillas de Ruedas\n2018.\nEJERCICIO FISCAL 2019\nDado en la Oficina del Titular del Sistema para el Desarrollo Integral de la Familia, ubicada en las Instalaciones del\nCentro de Rehabilitación Guerrero, Boulevard René Juárez Cisneros S/N, Ciudad de los Servicios, No. 62, Col.\nRecursos Hidráulicos, en la Ciudad de Chilpancingo de los Bravo, Capital del Estado de Guerrero, a los 25 días del mes de enero de dos mil diecinueve.\nGUERRERO.\nLic. José Francisco Solís Solís.\nRúbrica.\nEJERCICIO FISCAL 2019\nEJERCICIO FISCAL 2019",
  "ordenamiento": "PROGRAMA",
  "jurisdiccion": "GUERRERO",
  "fuente_oficial": "DIARIO OFICIAL DE LA FEDERACION",
  "Fecha de Publicación": "08 \nDE SEPTIEMBRE DE 2020",
  "ULTIMA REFORMA PUBLICADA": null,
  "status": "VIGENTE",
  "es_escaneado": false,
  "tiene_tablas": true,
  "materia": [
    "general"
  ]
}