{
  "titulo": "Acuerdo por el Que Se Crea el Programa Apoyos A la Producción Agropecuaria y Se Emiten Sus Reglas de",
  "Contenido": "EJERCICIO FISCAL 2020\nTEXTO ORIGINAL.\nY SE EMITEN SUS REGLAS DE OPERACIÓN PARA EL EJERCICIO FISCAL 2020.\nPoder Ejecutivo.\nLICENCIADO HÉCTOR ANTONIO ASTUDILLO FLORES, GOBERNADOR CONSTITUCIONAL DEL\nESTADO DE GUERRERO, CON FUNDAMENTO EN LO DISPUESTO POR LOS ARTÍCULOS 71, 87, 88,\nCONFIEREN LOS ARTÍCULOS 2, 3, 6, 7, 10, 11, 18 APARTADO A FRACCIONES I Y XII, 20 FRACCIÓN\nIII Y 31 DE LA LEY ORGÁNICA DE LA ADMINISTRACIÓN PÚBLICA DEL ESTADO DE GUERRERO\nNÚMERO 08; 1, 2 FRACCIÓN I, 18 Y 25 DE LA LEY NÚMERO 454 DE PRESUPUESTO Y DISCIPLINA\nFISCAL DEL ESTADO DE GUERRERO; 18 FRACCIÓN I Y 106 DE LA LEY NÚMERO 814 DE\nDESARROLLO RURAL SUSTENTABLE DEL ESTADO DE GUERRERO; EN RELACIÓN CON EL\nARTÍCULO 55 Y ANEXOS 21 Y 21-A DEL DECRETO NÚMERO 447 DEL PRESUPUESTO DE EGRESOS\nDEL ESTADO DE GUERRERO PARA EL EJERCICIO FISCAL 2020 Y LOS LINEAMIENTOS PARA LA\nELABORACIÓN DE LAS REGLAS DE OPERACIÓN DE LOS PROGRAMAS SOCIALES ESTATALES\nPARA EL EJERCICIO FISCAL 2017.\nQue en el Plan Estatal de Desarrollo 2016-2021 en su objetivo 3.1. Denominado “Construir un\nEstado garante pleno de los derechos sociales de las personas” en su Estrategia 3.1.2, establece que fortalecerá el desarrollo de capacidades de los integrantes de una sociedad con carencias que permitan contribuir a incrementar su capacidad productiva y su calidad de vida, en el cual se emprenderán programas especiales de asistencia social a grupos vulnerables, con el fin de brindar condiciones mínimas necesarias para el desarrollo humano.\nUno de los compromisos del ejecutivo estatal con la ciudadanía guerrerense, al asumir y tomar protesta como Gobernador Constitucional del Estado, es lograr un Guerrero de tranquilidad, de paz, de justicia, de crecimiento y de empleo, contribuyendo con ello a construir historias de éxitos individuales y colectivos que permitan consolidar el crecimiento económico y estabilidad social.\nGuerrero. actividades del sector primario, del orden de 6.3 millones de hectáreas.\nEJERCICIO FISCAL 2020\nEn esta entidad suriana, la actividad agropecuaria y pesquera, representa una de las ramas económicas de mayor relevancia social en el aporte para la sobrevivencia de un gran número de familias.\nEl Programa Apoyos a la Producción Agropecuaria, tiene como objetivo general, coadyuvar en la rurales a través del apoyo en la adquisición de maquinaria, insumos, especies animales, construcción de obras menores y mejora en las condiciones de infraestructura de caminos para el traslado de cosechas.\nLa Secretaría de Agricultura, Ganadería, Pesca y Desarrollo Rural, tendrá a cargo la implementación, operación, ejecución, evaluación y administración del Programa Apoyos a la Producción\nAgropecuaria.\nEn cumplimiento de lo anterior, he tenido a bien expedir el siguiente:\nACUERDO POR EL QUE SE CREA EL PROGRAMA APOYOS A LA PRODUCCIÓN AGROPECUARIA\nY SE EMITEN SUS REGLAS DE OPERACIÓN PARA EL EJERCICIO FISCAL 2020.\nArtículo 1. Se crea el Programa Apoyos a la Producción Agropecuaria, para el ejercicio fiscal\n2020, el cual tiene por objeto coadyuvar en la capitalización de las unidades de producción rural y mejorar el nivel de vida de los habitantes de las zonas rurales a través del apoyo en la adquisición de maquinaria, insumos, especies animales, construcción de obras menores y mejora en las condiciones de infraestructura de caminos para el traslado de cosechas.\nArtículo 2. Se emiten las Reglas de Operación del Programa Apoyos a la Producción\nAgropecuaria para el ejercicio fiscal 2020, en las que se establecen los principios de eficiencia, eficacia, oportunidad, equitativa y transparencia de los recursos públicos y requisitos que se deben de cumplir para poder acceder a dicho Programa.\nLas Reglas de Operación del Programa Apoyos a la Producción Agropecuaria, para el ejercicio fiscal 2020, establecen los criterios que se deben cumplir para poder acceder a dicho programa.\nArtículo 3. La Secretaría de Agricultura, Ganadería, Pesca y Desarrollo Rural tendrá a su cargo la implementación, operación, ejecución, evaluación y administración del Programa Apoyos a la Producción\nAgropecuaria, bajo los criterios de objetividad, equidad, transparencia, publicidad, selectividad y temporalidad, con estricto apego a la normatividad aplicable, por lo tanto será la encargada de la dispersión y asignación de los recursos del Programa apegándose plenamente a las Reglas de Operación siguientes:\n1. Introducción\n1.1. Antecedentes\nEJERCICIO FISCAL 2020 productores agropecuarios y pesqueros acerca de obtener subsidios para la adquisición de equipos, herramientas, servicios, especies animales y obras agropecuarias, que en programas federales no son susceptibles de apoyos, pero que los productores en realidad utilizan en las labores diarias en sus unidades de producción rural.\nLa creación del Programa, se fundamenta en el Plan Estatal de Desarrollo Rural 2016-2021, específicamente en el eje II Guerrero Próspero, el cual mandata promover la diversificación de la economía y aprovechar las potencialidades que existen en nuestro Estado. Para que Guerrero tenga un cambio cualitativo en su economía, se contempla impulsar cinco proyectos estratégicos entre los que se encuentra la Producción Agroindustrial, estableciendo como objetivo construir un sector agropecuario y pesquero productivo que garantice la seguridad alimentaria del Estado.\nActualmente en la Ley Orgánica de la Administración Pública del Estado de Guerrero Número 08, en su última reforma publicada el día 28 de agosto de 2018, en su artículo 31 contempla a la Secretaría de\nAgricultura, Ganadería, Pesca y Desarrollo Rural, como el órgano encargado de promover y fomentar el\nDesarrollo Agrícola, Forestal, Ganadero, Pesquero, así como el manejo de los recursos naturales en el\nEstado, procurando la participación de las mujeres, en igualdad de condiciones.\n1.2. Alineación programática\nEl Programa Apoyos a la Producción Agropecuaria está alineado al Plan Estatal de Desarrollo\n2016-2021 y al Programa Sectorial de Desarrollo Rural y Pesca 2016-2021, en el eje programático Guerrero\nPróspero, al objetivo 2.2 Impulsar la productividad del sector agropecuario y pesquero, para garantizar la seguridad alimentaria, a la estrategia 2.2.1 Fortalecer los sectores agropecuario y pesquero y crear condiciones para aumentar la competitividad y la autosuficiencia para garantizar la seguridad alimentaria en la entidad y a las líneas de acción apoyar en coordinación con los productores, a mercados nacientes como el de la floricultura y plantas ornamentales. La diversificación de productos guerrerenses es necesaria para detonar el desarrollo del sector agrícola y promover la producción de ganado bovino, porcino y caprino en el Estado y su presencia en los mercados nacional y extranjero.\n1.3. Diagnóstico\na) Problema social: Las productoras y productores agropecuarios y pesqueros, obtienen bajos ingresos por las actividades agropecuarias y pesqueras que realizan en sus unidades de producción.\nb) Causas y efectos observados del problema social: Las causas por las que las productoras y productores obtienen escasos ingresos es derivado de las escasas cosechas agrícolas, escasa producción pecuaria y escasa pesca en sus unidades de producción rural. Los efectos que se observan en la población por los escasos ingresos, se refleja en un bajo poder adquisitivo, alimentación deficiente, bajo nivel educativo, alta incidencia de enfermedades y en general una mala calidad de vida.\nc) Resolución del problema identificado: Con el apoyo a las productoras y productores agropecuarios y pesqueros, en la adquisición de equipos, materiales, especies animales, insumos,\nEJERCICIO FISCAL 2020 maquinaria agrícola, apertura de caminos, e infraestructura, para el fomento y acceso a financiamiento y cultura agropecuaria, plataformas de información, contratación de servicios de asistencia técnica y capacitación, que coadyuven a realizar de manera más eficiente las labores agropecuarias y pesqueras, y que agreguen valor a la producción, contribuyendo a obtener mayor volumen en sus cosechas y obteniendo mejores ingresos por las ventas de los excedentes de sus cosechas.\nd) Línea de base: En el año 2019, se programó subsidiar a 560 productoras y productores agropecuarios y pesqueros.\ne) Población potencial: La población total de la entidad es de 3,388,768 de los cuales, el 42% vive en el sector rural, mismos que por su productividad, rentabilidad y competitividad, las productoras y productores rurales, se ubican en tres segmentos, Productores de Menores Ingresos, en este segmento se encuentra el 78.7% de productoras y productores y está conformado por productores de menores ingresos, temporal y su producción es para autoconsumo, el segundo segmento es el de Productores en Transición, a este sector, corresponde el 20.9% de productoras y productores, y está conformado por productores que se encuentran en proceso de alcanzar mayor productividad y competitividad y el tercer segmento, corresponde a productoras y productores empresariales en los que se encuentran el 0.4% de los productores, estos productores están integrados al mercado nacional e internacional, son altamente eficientes y rentables.\nf) Población objetivo: La población objetivo para el presente Programa, son las productoras y productores de menores ingresos, temporales y que su producción es para autoconsumo.\nPara mejor entendimiento del Programa Apoyos a la Producción Agropecuaria, se desarrolla lo siguiente:\na) Naturaleza del programa social\nEl Programa de Apoyos a la Producción Agropecuaria, es un programa social, que otorga subsidios para fomentar las actividades agropecuarias, pesqueras, acuícolas y de servicios en el medio rural de la entidad, a través de la adquisición de equipos, herramientas, servicios, especies animales y\nEJERCICIO FISCAL 2020 obras agropecuarias, coadyuvando a capitalizar las unidades de producción rural y mejorando el nivel de vida de los habitantes de las zonas rurales.\nb) El origen y fundamento\nEl Programa Apoyos a la Producción Agropecuaria, se origina derivado de la urgente necesidad de atender las demandas de las productoras y productores rurales acerca de obtener subsidios para la adquisición de equipos, herramientas, servicios, especies animales y obras agropecuarias, que en programas federales no son susceptibles de apoyos, pero que las productoras y productores en realidad utilizan en las labores diarias en sus unidades de producción rural.\nLa creación del Programa Apoyos a la Producción Agropecuaria, se fundamenta en el Plan Estatal de Desarrollo 2016-2021, específicamente en el eje II Guerrero Próspero, el cual mandata promover la diversificación de la economía y aprovechar las potencialidades que existen en nuestro Estado. Para que\nGuerrero tenga un cambio cualitativo en su economía, se contempla impulsar cinco proyectos estratégicos entre los que se encuentra la Producción Agroindustrial, estableciendo como objetivo construir un sector agropecuario y pesquero productivo que garantice la seguridad alimentaria del Estado.\nActualmente en la Ley Orgánica de la Administración Pública del Estado de Guerrero Número 08, en su Artículo 31 contempla a la Secretaría de Agricultura, Ganadería, Pesca y Desarrollo Rural, como el órgano encargado de promover y fomentar el Desarrollo Agrícola, Forestal, Ganadero, Pesquero, así como el manejo de los recursos naturales en el Estado, procurando la participación de las mujeres, en igualdad de condiciones.\nc) Objetivos y metas\nEl Programa Apoyos a la Producción Agropecuaria, tiene como objetivo atender a productores agropecuarios, pesqueros y acuícolas, dotándoles de apoyo para la adquisición de maquinaria, insumos, especies pecuarias, construcción de obras y mejora en las condiciones de infraestructura de caminos para el traslado de cosechas.\nLa meta es beneficiar a 583 productores con diversos apoyos para el mejor desarrollo de sus actividades agropecuarias, acuícolas y de servicios.\nd) Ubicación geográfica de los proyectos a desarrollar\nEl Programa se implementará en el Estado de Guerrero, abarcando las siete regiones económicas:\n• Tierra Caliente\n• Norte\n• Centro\n• Montaña\n• Costa Grande\n• Costa Chica\nEJERCICIO FISCAL 2020\n• Acapulco\ne) Actividades a realizar\nOtorgar subsidio para la adquisición de equipos, material vegetativo, especies pecuarias, insumos, maquinaria agrícola, apertura de caminos, e infraestructura, para el fomento y acceso a financiamiento y cultura agropecuaria, plataformas de información, contratación de servicios de asistencia técnica y capacitación, que coadyuven a realizar de manera más eficiente las labores agropecuarias y pesqueras, y que agreguen valor a la producción.\nLa Secretaría de Agricultura, Ganadería, Pesca y Desarrollo Rural, elaborará un catálogo de conceptos a apoyar por el Programa Apoyos a la Producción Agropecuaria, mismo que se encontrará disponible en la página electrónica www.campoguerrero.gob.mx, que serán cubiertos con la aportación del\nGobierno del Estado.\nAsimismo, la Secretaría de Agricultura, Ganadería, Pesca y Desarrollo Rural, de conformidad con la Ley de Administración de Recursos Materiales del Estado y las bases que para tal efecto emita la\nSecretaría de Contraloría y Transparencia Gubernamental, para la adquisición y dotación de los diversos apoyos que comprende el Programa Apoyos a la Producción Agropecuaria, en caso de ser necesario.\nLa Secretaría de Agricultura, Ganadería, Pesca y Desarrollo Rural, vigilará que las beneficiarias o beneficiarios cumplan con los requisitos para acceder al Programa Apoyos a la Producción Agropecuaria y entregará los apoyos a las personas beneficiarias.\nLa aportación que puedan hacer las personas beneficiarias será para complementar el subsidio otorgado por el Gobierno del Estado.\nf) Instancias participantes\nLa ejecución del Programa estará a cargo de la Secretaría de Agricultura, Ganadería, Pesca y\ng) Presupuesto de inversión\nDirecta (IED) 2020, autorizados en el Decreto Número 447 del Presupuesto de Egresos del Estado para el de diciembre del año 2019. Con un monto de $18,031,404.71 (Dieciocho millones treinta y un mil cuatrocientos cuatro pesos 71/100 M.N).\nh) Glosario de términos\nCONEVAL: Consejo Nacional de Evaluación de la Política de Desarrollo Social.\nEJERCICIO FISCAL 2020\nIED: Inversión Estatal Directa.\nPrograma: Programa Apoyos a la Producción Agropecuaria.\nReglas de Operación: Reglas de Operación del Programa Apoyos a la Producción Agropecuaria.\nSAGADEGRO: Secretaría de Agricultura, Ganadería, Pesca y Desarrollo Rural.\nPara mejor entendimiento del programa se desarrolla:\nMisión\nImpulsar la producción de alimentos, mediante el otorgamiento de subsidios a productoras y productores rurales, para la adquisición de maquinaria, insumos, especies animales, construcción de obras y mejora en las condiciones de infraestructura de caminos para el traslado de cosechas, contribuyendo a elevar la productividad, la calidad, la inocuidad y la competitividad de los sectores agropecuarios, pesqueros y acuícolas, privilegiando la autosuficiencia agroalimentaria, así como el incremento al valor agregado y la comercialización de sus productos, a fin de mejorar la economía y las condiciones de vida de las familias del medio rural.\nVisión\nSer el programa generador del desarrollo económico y sociocultural de la población rural de\nGuerrero, que transforme la pobreza alimentaria y económica, en soluciones y oportunidades a través de políticas públicas rentables, integrales y sustentables, mediante el impulso a la producción, la transformación y la comercialización de los productos agropecuarios, pesqueros y acuícolas, obteniendo así productos con potencial competitivo en los mercados regionales, nacional e internacional, que repercutan directamente en el bienestar social de los guerrerenses.\n2. Secretaría, dependencia o entidad responsable del programa\n2.1. La Secretaría de Agricultura, Ganadería, Pesca y Desarrollo Rural (SAGADEGRO), será la responsable directa de la ejecución del Programa Apoyos a la Producción Agropecuaria.\n2.2. En la operación del Programa Apoyos a la Producción Agropecuaria, participará la\nSubsecretaría de Desarrollo Rural Sustentable, la Subsecretaría de Agricultura e Infraestructura Rural, la subsecretaría de Ganadería y Pesca, y la Delegación Administrativa de la SAGADEGRO.\n2.3. El Programa solo lo ejercerá la SAGADEGRO.\n2.4. La Subsecretaría de Desarrollo Rural Sustentable, será la encargada de registrar las solicitudes presentadas por las productoras y productores, presentarlas ante el Secretario de la\nSAGADEGRO, para su autorización correspondiente, posteriormente turnará a las Subsecretarías de\nAgricultura e Infraestructura Rural, y de Ganadería y Pesca, para que revisen e integren las solicitudes en\nEJERCICIO FISCAL 2020 coordinación con las productoras y productores, estas subsecretarías, integrarán el acta de entrega recepción y la factura del bien adquirido, y realizarán el trámite de pago ante la Delegación Administrativa, esta delegación, realizará el pago de los apoyos adquiridos al proveedor.\n2.5. La SAGADEGRO, será la involucrada en la operación del Programa, así como las\nSubsecretarías de Desarrollo Rural Sustentable, la Subsecretaría de Agricultura e Infraestructura Rural, la\nSubsecretaría de Ganadería y Pesca y la Delegación Administrativa.\n2.6. La SAGADEGRO, es la entidad que será la responsable en la planeación y ejecución del programa Apoyos a la Producción Agropecuaria; mismo que tiene como fundamento legal en:\na) Constitución Política de los Estados Unidos Mexicanos.\nc) Ley de Desarrollo Rural Sustentable.\nd) Ley Número 814 de Desarrollo Rural Sustentable del Estado de Guerrero.\nf) Ley de Administración de Recursos Materiales del Estado de Guerrero.\ng) Ley Número 207 de Transparencia y Acceso a la Información Pública del Estado de Guerrero.\nh) Ley Orgánica de la Administración Pública del Estado de Guerrero Número 08.\ni) Decreto Número 196, Plan Estatal de Desarrollo de Guerrero 2016-2021, eje II Guerrero\nPróspero.\nj) Decreto número 447 del Presupuesto de Egresos del Estado de Guerrero para el Ejercicio Fiscal\n2020. productivas en el medio rural.\n3. Objetivos y alcances\n3.1. Objetivo general\nEJERCICIO FISCAL 2020 maquinaria, insumos, especies animales, construcción de obras menores y mejora en las condiciones de infraestructura de caminos para el traslado de cosechas.\n3.2. Objetivo específico\nSubsidiar la adquisición de maquinaria, insumos, material vegetativo, especies pecuarias, construcción de obras menores y mejora en las condiciones de infraestructura de caminos para el traslado de cosechas, para fomentar la producción de alimentos en las zonas rurales de la entidad.\n3.3. Alcances\nBuscando que las productoras y productores agropecuarios y pesqueros, sean capaces de obtener mayor volumen en sus cosechas y los excedentes sean comercializados para obtener ingresos que mejoren su nivel de vida, a través de apoyos o subsidios a este sector; garantizando el derecho al trabajo como lo especifica el CONEVAL (Consejo Nacional de Evaluación de la Política de Desarrollo Social).\n4. Metas físicas\nBeneficiar 583 productores con diversos apoyos para el mejor desarrollo de sus actividades agropecuarias, pesqueras y acuícolas y de servicios.\n5. Programación presupuestal\n5.1. El monto total del presupuesto autorizado para el ejercicio fiscal es de $18,031,404.71 (Dieciocho millones treinta y un mil cuatrocientos cuatro pesos 71/100 M.N).\n5.2. El calendario de gasto es el siguiente:\nCONCEPTO TOTAL\nFebrero Marzo Abril Mayo Junio Julio Agosto Septiembre Octubre\nGastos de\n1,943,384 1,943,384 1,943,384 1,943,384 1,943,384 1,943,384 1,943,384 1,943,384 1,943,390.57 17,490,462.57\nInversión\nGastos de\n60,105 60,105 60,105 60,105 60,105 60,105 60,105 60,105 60,102.14 540,942.14\nOperación\n2,003,489 2,003,489 2,003,489 2,003,489 2,003,489 2,003,489 2,003,489 2,003,489 2,003,492.71 18,031,404.71\n6. Requisitos y procedimientos de acceso\nPara la obtención de los apoyos, las productoras y productores agropecuarios, pesqueros y acuícolas, deberán observar y cumplir con los requisitos establecidos en el numeral 6.2.\n6.1. Difusión\nLa Secretaría de Agricultura, Ganadería, Pesca y Desarrollo Rural, dará amplia difusión del que la población conozca los beneficios y requisitos del Programa.\nEJERCICIO FISCAL 2020 de la Secretaría de Agricultura, Ganadería, Pesca y Desarrollo Rural.\nLos horarios de atención a las productoras y productores, será de lunes a viernes de 09:00 a\n16:00 horas en las instalaciones de la Secretaría de Agricultura, Ganadería, Pesca y Desarrollo Rural, sita en Carretera Nacional México-Acapulco Km 274.5, Colonia Burócratas, teléfono 01 747 1 92 10.\nEl Programa Apoyos a la Producción Agropecuaria, también será difundido en reuniones por personal de la Secretaría de Agricultura, Ganadería, Pesca y Desarrollo Rural, quienes se apoyarán con distintos medios de difusión para dar a conocer los beneficios que se otorgan y los requisitos que los interesados deben reunir.\nLa cobertura del Programa será estatal, ateniéndose a las productoras y productores agropecuarios, pesqueros y acuícolas de la entidad.\n6.2. Requisitos de acceso\nLas productoras y productores interesados en obtener beneficios del Programa, deberán presentar en la ventanilla de la Secretaría de Agricultura, Ganadería, Pesca y Desarrollo Rural, la siguiente documentación:\n6.2.1. Apoyos de manera individual:\na) Solicitud de apoyo en el formato establecido (Anexo a), proporcionado en la Secretaría de\nAgricultura, Ganadería, Pesca y Desarrollo Rural y disponibles en la página www.campoguerrero.gob.mx,\nb) Comprobante de domicilio con vigencia no mayor a tres meses.\nc) Copia de identificación oficial vigente (credencial de elector, pasaporte, cartilla de servicio militar nacional o cédula profesional).\nd) Copia de la Clave Única de Registro Poblacional. e) Documento que acredite la actividad productiva.\n6.2.2. Apoyos a productores organizados en grupos:\na) Presentar solicitud de apoyo en el formato establecido, (Anexo a), firmada por la persona que represente el grupo.\nb) Comprobante de domicilio con vigencia no mayor a tres meses.\nc) Copia de las identificaciones oficiales vigentes (credencial de elector, pasaporte, cartilla de servicio militar nacional o cédula profesional).\nEJERCICIO FISCAL 2020\nd) Copia de la Clave Única de Registro Poblacional. e) Acta constitutiva de grupo de trabajo.\nf) Relación de integrantes del grupo.\ng) Documento que acredite la actividad productiva.\n6.2.3. Para la obtención de garantías líquidas, deberán presentar los siguientes requisitos:\na) Autorización de la línea de crédito.\nb) Contrato del fideicomiso.\nc) CLABE y cuenta para el depósito de la garantía líquida en el fideicomiso.\nd) Oficio donde señalan sesión de derechos para depósito de la garantía líquida al fideicomiso.\ne) Proyecto del crédito.\nf) Acta constitutiva del sujeto de crédito (en caso de personas morales).\ng) Registro Federal de Contribuyentes.\nh) Clave Única de Registro Poblacional. i) Comprobante de domicilio.\n6.3. Procedimiento de acceso\n6.3.1. El Programa Apoyos a la Producción Agropecuaria, surge por la demanda ciudadana específicamente de las productoras y productores agropecuarios y pesquero mismo que deberán presentar la solicitud de apoyo, conforme al anexo a), adjuntando los requisitos establecidos en el numeral 6.2 de estas Reglas de Operación.\n6.3.2. Los criterios para ser beneficiaria o beneficiario son: presentar su solicitud de apoyo, acompañada de la documentación personal, posteriormente, la Secretaría de Agricultura, Ganadería, Pesca y Desarrollo Rural, analizará la viabilidad de apoyo de la solicitud, en base a la disposición presupuestal del Programa.\n6.3.3. La documentación será recepcionada en las instalaciones que ocupa la Secretaría de\nAgriclutura, Ganadería, Pesca y Desarrollo Rural, de lunes a viernes en horario de 09:00 a 16:00 horas.\n6.3.4. Se dará prioridad de atención a las solicitudes de apoyo, dirigidas a cultivos de mayor relevancia para la entidad.\n6.3.5. Las solicitudes de apoyo autorizadas, podrán ser consultadas en la página electrónica\nEJERCICIO FISCAL 2020\n6.3.6. La Secretaría de Agricultura, Ganadería, Pesca y Desarrollo Rural, entregará un comprobante a la productora o productor de haber completado su registro en el Programa.\n6.3.7. Las productoras o productores que sean autorizados con apoyos del Programa, serán incorporados al Padrón Único de Personas Beneficiarias de la Secretaría de Agricultura, Ganadería, Pesca y Desarrollo Rural, siendo reservados sus datos personales en base a la Ley Número 207 de Transparencia y Acceso a la Información Pública del Estado de Guerrero y en ningún caso podrán emplearse para propósitos de proselitismo político, religioso o comercial, ni para ningún otro distinto al establecido en las presentes Reglas de Operación.\n6.3.8. En ningún caso las servidoras y servidores públicos podrán solicitar o proceder de manera diferente a lo establecido en las Reglas de Operación.\nSe atenderán las solicitudes de apoyo hasta en tanto exista disponibilidad presupuestal por el\nPrograma.\nLas productoras o productores conocerán el estado de su trámite, en la página electrónica campoguerrero.gob.mx. (Hasta 30 días hábiles)\n6.4. Requisitos de permanencia, causales de baja o suspensión temporal\n6.4.1. La beneficiaria o beneficiario está obligado a:\n• Dar buen uso, conservación y/o mantenimiento de los bienes recibidos.\n• Otorgar las facilidades y proporcionar la información necesaria a las instancias de coordinación, supervisión y control de los niveles de gobierno facultados para realizar visitas de inspección y monitoreo de los apoyos otorgados.\n• Seguir las recomendaciones técnico-productivas emitidas por las instancias de gobierno.\n• Mantener los apoyos por un plazo mínimo de tres años con el fin de que estén disponibles para las supervisiones físicas y documentales de las instancias de control y fiscalización.\n• Las beneficiarias o beneficiarios del Programa que incumplan con las obligaciones, y/o presenten documentos falsos, la instancia normativa, definirá la sanción a la que se hará acreedor; el incentivo y requerida la devolución del mismo, más los productos financieros generados y será registrado por parte de la instancia Ejecutora o la Unidad Responsable en el directorio de personas físicas y/o morales que pierden su derecho de recibir incentivos, hasta en tanto no se subsane el incumplimiento detectado.\n6.5. Modos de entrega del beneficio entrega de la documentación en los formatos establecidos, se les comunicará los lugares para la entrega\nEJERCICIO FISCAL 2020 de los apoyos, pudiendo ser de hasta el cien por ciento del costo del bien solicitado, y la entrega se realizará\n7. Procedimientos de instrumentación\n7.1. Operación\n7.1.1. Para acceder a los beneficios del Programa Apoyos a la Producción Agropecuaria, las productoras o productores presentarán en la Secretaría de Agricultura, Ganadería, Pesca y Desarrollo\nRural, la solicitud en el formato establecido, misma que será registrada, analizada y dependiendo de la suficiencia presupuestal, se le notificará a la productora o productor que haya sido beneficiado, para que continúe con la adquisición, comprobación y se le tramite el pago del beneficio.\n7.1.2. Las subsecretarías de Agricultura e Infraestructura Rural, Ganadería Pesca y de Desarrollo\nRural Sustentable y la Delegación Administrativa de la Secretaría de Agricultura, Ganadería, Pesca y\nDesarrollo Rural, serán las responsables de coordinar esfuerzos para la operación del Programa.\n7.1.3. Los datos personales de las beneficiarias o beneficiarios del Programa Apoyos a la\nProducción Agropecuaria, y la información adicional generada y administrada, se regirá por lo establecido en la Ley Número 207 de Transparencia y Acceso a la Información Pública del Estado de Guerrero.\n7.1.4. Los formatos y los trámites a realizar para la obtención del beneficio del Programa Apoyos a la Producción Agropecuaria, son gratuitos.\n7.2. Gastos de operación\nPara cubrir los gastos ocasionados por la operación, seguimiento, supervisión y verificación de las acciones del Programa Apoyos a la Producción Agropecuaria, se dispondrá hasta el 3% de la inversión total de dicho Programa. Estos recursos corresponden al capítulo 4000 de la apertura programática.\nEn la erogación de los gastos de operación se deberán observar los criterios de racionalidad, austeridad presupuestal, propiciando la eficiencia, eficacia y transparencia.\n8. Transparencia\n8.1. Difusión\nLa SAGADEGRO, dará amplia difusión al Programa Apoyos a la Producción Agropecuaria, en la organicen por región y/o municipio y para mayor información acudir a las instalaciones que ocupa la\nAcapulco km 274.5 Colonia Burócratas, Chilpancingo de los Bravo, de lunes a viernes en horario de\n09:00 a 16:00 horas, o llamar al teléfono 017474719210.\nEJERCICIO FISCAL 2020\nLa papelería, publicidad y promoción del Programa Apoyos a la Producción Agropecuaria, incluirá la leyenda descrita en el apartado “Blindaje Electoral”.\n8.2. Blindaje electoral\nPara blindar al Programa Apoyos a la Producción Agropecuaria, del clientelismo y que no sea utilizado para usos partidistas, en la documentación siempre deberán incluir la leyenda siguiente:\n“Este programa es público ajeno a cualquier partido político. Queda prohibido el uso para fines distintos a los establecidos en el programa”.\n8.3. Supervisión y control\na) Como procedimiento interno de supervisión y control del programa, se utilizarán informes mensuales, trimestrales, semestrales y anuales.\nb) Las Subsecretarías de Agricultura e Infraestructura Rural, Ganadería y Pesca y de Desarrollo\nRural Sustentable y la Delegación Administrativa de la Secretaría de Agricultura, Ganadería, Pesca y\nDesarrollo Rural, serán las responsables de coordinar esfuerzos para la operación del Programa.\nc) Se enviarán trimestralmente a la Secretaría de Finanzas y Administración, a la Secretaría de\nPlaneación y Desarrollo Regional, y a la Secretaría de Contraloría y Transparencia Gubernamental, informes sobre el Presupuesto ejercido establecidos por el Consejo Nacional de Armonización Contable\n(CONAC) y con base en los indicadores de resultados previstos en las Reglas de Operación.\nd) Se adicionarán a los informes, la evaluación de los indicadores determinados en el Programa.\ne) La Secretaría de Agricultura, Ganadería, Pesca y Desarrollo Rural, remitirá a la Secretaría de\nPlaneación y Desarrollo Regional, el calendario de entrega de los apoyos.\nf) La Secretaría de Agricultura, Ganadería, Pesca y Desarrollo Rural, integrará un Padrón Único de Personas Beneficiarios del Programa.\n8.4. Mecanismo de evaluación e indicadores\n8.4.1. Evaluación\nCon el propósito de conocer los resultados del Programa, se solicitará sea evaluado por alguna institución académica y de investigación u organismo especializado de carácter nacional, que cuenten con reconocimiento y experiencia en la materia; y en los términos de las disposiciones establecidas por las instancias normativas correspondientes.\nEJERCICIO FISCAL 2020\n{\"tabla_1\":{\"columnas\":[\"Nivel de\",\"Objetivo\",\"Indicador\",\"Fórmula de\",\"Tipo de\",\"Unidad\",\"Medios de\",\"Unidad\",\"Supuestos\"],\"filas\":[{\"columna_1\":\"objetivo\",\"columna_2\":\"(sin dato)\",\"columna_3\":\"(sin dato)\",\"columna_4\":\"Cálculo\",\"columna_5\":\"Indicado\",\"columna_6\":\"de\",\"columna_7\":\"Verificació\",\"columna_8\":\"Responsabl\",\"columna_9\":\"(sin dato)\"},{\"columna_1\":\"(sin dato)\",\"columna_2\":\"(sin dato)\",\"columna_3\":\"(sin dato)\",\"columna_4\":\"(sin dato)\",\"columna_5\":\"(sin dato)\",\"columna_6\":\"Medida\",\"columna_7\":\"(sin dato)\",\"columna_8\":\"(sin dato)\",\"columna_9\":\"(sin dato)\"},{\"columna_1\":\"(sin dato)\",\"columna_2\":\"(sin dato)\",\"columna_3\":\"(sin dato)\",\"columna_4\":\"(sin dato)\",\"columna_5\":\"r\",\"columna_6\":\"(sin dato)\",\"columna_7\":\"n\",\"columna_8\":\"e\",\"columna_9\":\"(sin dato)\"},{\"columna_1\":\"Fin\",\"columna_2\":\"Contribuir a\\nmejorar el\\ningreso de\\nlos\\nproductores\\nagropecuario\\ns, pesqueros\\ny acuícolas\",\"columna_3\":\"Incremento\\nen el ingreso\\nde los\\nproductores\\nagropecuario\\ns, pesqueros\\ny acuícolas\",\"columna_4\":\"Ingreso en\\nel año\\nanterior /\\nIngreso del\\naño actual\",\"columna_5\":\"Eficacia\",\"columna_6\":\"Porcentaj\\ne\",\"columna_7\":\"Evaluación\\nde los\\nprogramas\",\"columna_8\":\"Subsecretarí\\nas\",\"columna_9\":\"Las condiciones\\nmacroeconómic\\nas se mantienen\\nestables.\"},{\"columna_1\":\"Propósito\",\"columna_2\":\"Los\\nproductores\\nagropecuario\\ns, pesqueros\\ny acuícolas,\\ntienen sus\\nunidades de\\nproducción\\nequipadas\",\"columna_3\":\"Unidades de\\nproducción\\nagropecuaria\\ns, pesqueras\\ny acuícolas\\napoyadas\",\"columna_4\":\"Unidades de\\nproducción\\napoyadas /\\nUnidades\\nde\\nproducción\\ntotal\",\"columna_5\":\"Eficienci\\na\",\"columna_6\":\"Porcentaj\\ne\",\"columna_7\":\"Avances\\nfísicos y\\nfinancieros\",\"columna_8\":\"Subsecretarí\\nas\",\"columna_9\":\"Las condiciones\\nmacroeconómic\\nas se mantienen\\nestables.\"},{\"columna_1\":\"Component\\nes\",\"columna_2\":\"Otorgar\\nsubsidio para\\nla adquisición\\nde equipos,\\nherramientas\\n, obras\\nagropecuaria\\ns, pesqueras\\ny acuícolas\",\"columna_3\":\"Número de\\nbeneficiarios\\nagropecuario\\ns, pesqueros\\ny acuícolas\",\"columna_4\":\"Beneficiario\\ns atendidos\\n/\\nBeneficiario\\ns\\nprogramad\\nos\",\"columna_5\":\"Eficienci\\na\",\"columna_6\":\"Porcentaj\\ne\",\"columna_7\":\"Avance\\nfísico\",\"columna_8\":\"Subsecretarí\\nas\",\"columna_9\":\"Las condiciones\\nmacroeconómic\\nas se mantienen\\nestables.\"}]}}\n8.5. Auditoría\nLos recursos ejercidos en el Programa, podrán ser fiscalizados por el Órgano Interno de Control y demás instancias que en el ámbito de sus respectivas atribuciones resulten competentes.\nComo resultado de las acciones de auditoría que se lleven a cabo, el Órgano Interno de Control mantendrá un seguimiento interno que permita emitir los informes de las revisiones practicadas, dando principal importancia a la atención en tiempo y forma, de las irregularidades detectadas, hasta su total solventación.\n8.6. Recursos no devengados\nEl presupuesto autorizado que no se aplique a los fines autorizados, y los recursos que por cualquier motivo no estén devengados al 31 de diciembre, serán reintegrados a la Tesorería de la\n8.7. Contraloría social\nEJERCICIO FISCAL 2020\nSe establecerán acciones de control, vigilancia y evaluación, bajo un esquema de derechos y compromisos ciudadanos, con el propósito de contribuir a que la gestión gubernamental se realice en términos de transparencia, eficacia y honradez.\nEstas actividades estarán a cargo de los miembros de la comunidad, incluidos los integrantes del comité o instancia asociativa de las beneficiarias o beneficiarios del Programa Apoyos a la Producción\nAgropecuaria.\nLa instancia operadora promoverá la contraloría social con base en la normatividad establecida para tal efecto, fomentando acciones que transparenten la operación del Programa Apoyos a la Producción\nAgropecuaria.\nLas acciones a fomentar serán las siguientes:\na) Informar a la ciudadanía acerca de los apoyos otorgados y su costo a nivel de obra, acción, nombre de las beneficiarias o beneficiarios, derechos y obligaciones de los mismos.\nb) Capacitar a las beneficiarias o beneficiarios para que se constituyan en instancias de vigilancia y evaluación social.\nc) Establecer espacios de comunicación (reuniones vecinales, atención directa a beneficiarias o beneficiarios, etc.).\nd) Promover la integración de organizaciones de la sociedad civil en acciones de contraloría social.\ne) Instrumentar mecanismos de recepción y atención de quejas y denuncias. El Órgano Interno de\nControl verificará, en lo correspondiente, la realización de dichas acciones.\n8.8. Formas de participación social\nDe acuerdo con las leyes de Desarrollo Social y de Participación Ciudadana del Estado de\nGuerrero, la sociedad podrá participar activamente en la planeación, programación, implementación y evaluación de los programas y acciones de desarrollo social, por lo que para el Programa, será en el seno del Subcomité Sectorial de Desarrollo Rural y Pesca, donde se informará del seguimiento del mismo, este subcomité, está conformado por dependencias federales y estatales.\n8.8.1. En el año, el Subcomité Sectorial de Desarrollo Rural y Pesca, sesiona cuatro ocasiones, para planear, programar, informar de la implementación así como de las evaluaciones de los programas en el sector agropecuario y pesquero.\n8.8.2. La modalidad de participación del Subcomité Sectorial de Desarrollo Rural y Pesca, es de información, consulta, decisión y deliberación de las acciones al sector agropecuario y pesquero, como se describe en el siguiente cuadro.\nEJERCICIO FISCAL 2020 participa Participación\nSubcomité Sectorial Planeación, Planeación, Información, de Desarrollo Rural y Programación. Programación y Consulta y\nPesca evaluación deliberación\n8.9. Procedimiento de queja o inconformidad ciudadana\nLas quejas y denuncias de la ciudadanía en general por la presunción de actos de corrupción o desvío de recursos por parte de servidoras o servidores públicos, se captarán por la Secretaría de\nContraloría y Transparencia Gubernamental y la Auditoría Superior del Estado, a través de denuncias por escrito, vía internet, vía telefónica y por comparecencia de la persona interesada. El sitio es www.contraloria.guerrero.gob.mx, y al teléfono 01 800 000 7422.\nLa persona denunciante o quejosa deberá proporcionar los datos siguientes:\na) Nombre de la servidora (s) o servidor (es) público.\nb) Dependencia de adscripción.\nc) Objeto de la denuncia.\nd) Nombre y domicilio de la persona quejosa.\ne) Identificación oficial de la persona quejosa.\n8.10. Mecanismos de exigibilidad\nLas productoras o productores podrán verificar el estatus de su solicitud en la página electrónica www.campoguerrero.gob.mx.\n8.11. Acta de entrega-recepción\nPara cada una de las acciones entregadas, se elaborará un acta de entrega-recepción, en la que participará una persona que represente la Secretaría de Agricultura, Ganadería, Pesca y Desarrollo Rural y una persona que represente la comunidad beneficiada y/o un beneficiario. A dicho acto, se invitará de entrega-recepción, la comunidad o el orden de gobierno que recibe las obras o acciones, deberá hacer correspondiente.\nEl acta de entrega-recepción forma parte del expediente de la obra y/o acción y que constituye la prueba documental que certifica la existencia de la misma.\nEs responsabilidad de la Secretaría de Agricultura, Ganadería, Pesca y Desarrollo Rural, resguardar las actas de entrega-recepción, así como el expediente de la obra o acción.\nEJERCICIO FISCAL 2020\n9. Criterios de selección y elegibilidad\n9.1. Método de selección de beneficiarias o beneficiarios\nSerán susceptibles de apoyos todas las productoras y/o productores, preferentemente de bajos ingresos del medio rural que se dediquen o quieran dedicarse a realizar actividades agrícolas, pecuarias, pesqueras y acuícolas.\nPara ser beneficiaria o beneficiario, deberán cumplir con presentar la documentación requerida en el numeral 6.2 de las presentes Reglas de Operación, según sea el caso de solicitar apoyo de manera individual o por grupo u organización.\n10. Mecánica de operación\nLa Secretaría de Agricultura Ganadería, Pesca y Desarrollo Rural, designará una persona responsable del Programa Apoyos a la Producción Agropecuaria, y una persona auxiliar administrativa quienes llevarán un puntual seguimiento a las solicitudes recibidas para ser apoyadas por el referido\nPrograma y presentarán las solicitudes recibidas ante la Secretaría de Agricultura, Ganadería, Pesca y\nDesarrollo Rural. La SAGADEGRO entregará el bien en caso de ser procedente, y la beneficiaria o beneficiario firmará el acta de entrega recepción.\nLa persona responsable del Programa Apoyos a la Producción Agropecuaria, integrará los expedientes de las beneficiarias o beneficiarios, incluyendo el acta de entrega-recepción y la factura correspondiente, para las revisiones a que haya lugar por parte de la Secretaría de Contraloría y\nTransparencia Gubernamental.\n10.1. Instancia ejecutora\nLa Secretaría de Agricultura, Ganadería, Pesca y Desarrollo Rural, será quien ejercerá los recursos del Programa Apoyos a la Producción Agropecuaria, también, tendrá la responsabilidad de verificar que la formulación de los expedientes técnicos de los proyectos, reúnan los requisitos exigidos por la instancia normativa, tales como apego a la planeación estratégica, programación, presupuestación, calendario de ejecución, ejercicio y control del gasto público.\n10.2. Instancia administrativa y/o normativas\nLa Auditoría Superior del Estado y la Secretaría de Contraloría y Transparencia Gubernamental, vigilarán que la ejecución del Programa Apoyos a la Producción Agropecuaria, sea con apego a la normatividad para asegurar el cumplimiento de los objetivos y metas trazados.\n10.3. Delimitación de atribuciones\nConforme al artículo 31 de la Ley Orgánica de la Administración Pública del Estado de Guerrero\nNúmero 08, establece que la SAGADEGRO, es el órgano encargado de promover y fomentar el desarrollo\nEJERCICIO FISCAL 2020 agrícola, forestal, ganadero, pesquero, así como del manejo de los recursos naturales en el Estado, procurando la participación de las mujeres, en igualdad de condiciones en estas actividades de diseño y planeación y cumplimiento correspondiéndole el despacho de los asuntos siguientes:\na) Elaborar los planes, programas y acciones, de corto, mediano y largo plazo, del sector agropecuario, forestal y pesquero, que respondan a un criterio de manejo sustentable de los recursos naturales, con la participación de las dependencias federales y estatales correspondientes, ayuntamientos, organizaciones de productores individuales y campesinos, en el seno de la Secretaría de Planeación y\nDesarrollo Regional del Estado de Guerrero, y coordinar su implementación.\nb) Formular y ejecutar los planes, programas y acciones para el desarrollo integral de las personas que viven y trabajan en zonas rurales del Estado, principalmente aquellos dirigidos a mejorar las condiciones de las mujeres.\nc) Fomentar, formular, supervisar y coordinar la operación de los programas de desarrollo agrícola, ganadero, pesquero con criterios de manejo sustentable de los recursos naturales.\nd) Apoyar la organización para la producción, coordinando con las dependencias federales afines y productores, las acciones para el financiamiento, seguros, insumos, asistencia técnica y administrativa, investigación, capacitación y transferencia de tecnología, en beneficio de mujeres, campesinos, ejidatarios, comuneros, pequeños propietarios y organizaciones de productores legalmente constituidos.\n11. Derechos, obligaciones y sanciones de las personas beneficiarias del programa\n11.1. Derechos\nToda persona tiene derecho a participar y a beneficiarse del Programa Apoyos a la Producción\nAgropecuaria, de acuerdo con los principios rectores de desarrollo social, así como a recibir un trato digno y respetuoso en los términos establecidos en la Constitución Política de los Estados Unidos Mexicanos.\n11.2. Obligaciones\na) Dar buen uso, conservación y/o mantenimiento de los bienes recibidos.\nb) Otorgar las facilidades y proporcionar la información necesaria a las instancias de coordinación, de los apoyos otorgados.\nc) Seguir las recomendaciones técnico-productivas emitidas por las instancias de gobierno.\nd) Mantener los apoyos por un plazo mínimo de tres años con el fin de que estén disponibles para las supervisiones físicas y documentales de las instancias de control y fiscalización.\nEJERCICIO FISCAL 2020\n11.3. Sanciones\nLas persona beneficiarias del Programa Apoyos a la Producción Agropecuaria, que incumplan con las obligaciones, y/o presenten documentos falsos, la instancia normativa, definirá la sanción a la que se hará acreedor; requiriendo la devolución del incentivo otorgado, más los productos financieros generados físicas y/o morales que pierden su derecho de recibir incentivos, hasta en tanto no se subsane el incumplimiento detectado.\n12. Interpretación\nLa interpretación de las presentes Reglas de Operación, para efectos administrativos, estará a cargo de la Secretaría de Agricultura, Ganadería, Pesca y Desarrollo Rural y de la Secretaría de Contraloría y Transparencia Gubernamental en el ámbito de sus respectivas competencias.\nEJERCICIO FISCAL 2020\nPrimero. El presente Acuerdo entrará en vigor al día siguiente de su publicación en el Periódico Oficial del\nSegundo. Se abroga el Acuerdo por el que se crea el Programa Apoyos a la Producción Agropecuaria y se emiten sus Reglas de Operación para el Ejercicio Fiscal 2019, publicado en el Periódico Oficial del\nGobierno del Estado de Guerrero No. 35 alcance II, de fecha 30 de abril de 2019.\nTercero. A partir de la entrada en vigor del presente Acuerdo, las Reglas de Operación del Programa\nApoyos a la Producción Agropecuaria, subsecuentes a sus modificaciones serán emitidas por la persona titular de la Secretaría de Agricultura, Ganadería, Pesca y Desarrollo Rural, responsable directa de la operación y ejecución de las mismas.\nDado en la oficina del titular del Poder Ejecutivo, ubicada en el Edificio Centro de Palacio de\nGobierno, Boulevard René Juárez Cisneros No. 62, Colonia Ciudad de los Servicios en la Ciudad de\nChilpancingo de los Bravo, Capital del Estado de Guerrero, a los 31 días del mes de enero del año dos mil veinte.\nEL GOBERNADOR CONSTITUCIONAL DEL ESTADO DE GUERRERO.\nLIC. HÉCTOR ANTONIO ASTUDILLO FLORES\nRúbrica.\nEL SECRETARIO GENERAL DE GOBIERNO.\nLIC. FLORENCIO SALAZAR ADAME.\nRúbrica.\nEL SECRETARIO DE AGRICULTURA, GANADERÍA, PESCA Y DESARROLLO RURAL.\nLIC. JUAN JOSÉ CASTRO JUSTO.\nRúbrica.",
  "ordenamiento": "PROGRAMA",
  "jurisdiccion": "GUERRERO",
  "fuente_oficial": "DIARIO OFICIAL DE LA FEDERACION",
  "Fecha de Publicación": "28 de agosto de 2018",
  "ULTIMA REFORMA PUBLICADA": "28 de agosto de 2018",
  "status": "VIGENTE",
  "es_escaneado": false,
  "tiene_tablas": true,
  "materia": [
    "agrario"
  ]
}