{
  "titulo": "Acuerdo por el Que Se Crea el Programa Fortalecimiento, Preservación y Difusión de la Cultura de los",
  "Contenido": "AFROMEXICANO, Y SE EMITEN SUS REGLAS DE\nOPERACIÓN\nTEXTO ORIGINAL.\nAcuerdo publicado en el Periódico Oficial del Gobierno del Estado No. 32 alcance IV, el viernes 19 de abril de 2024.\nACUERDO POR EL QUE SE CREA EL PROGRAMA FORTALECIMIENTO, PRESERVACIÓN Y\nDIFUSIÓN DE LA CULTURA DE LOS PUEBLOS INDÍGENAS Y AFROMEXICANO, Y SE EMITEN SUS\nREGLAS DE OPERACIÓN.\nGuerrero. - Poder Ejecutivo.\nMAESTRA EVELYN CECIA SALGADO PINEDA, GOBERNADORA CONSTITUCIONAL DEL ESTADO\nDE GUERRERO, CON FUNDAMENTO EN LO DISPUESTO POR LOS ARTÍCULOS 71, 87, 88, 90\nLOS ARTÍCULOS 2, 4, 8, 9, 14, 22 APARTADO A FRACCIONES I Y XIV, 23 FRACCIÓN III Y 35\nFRACCIONES IV Y XII DE LA LEY ORGÁNICA DE LA ADMINISTRACIÓN PÚBLICA DEL ESTADO DE\nGUERRERO NÚMERO 242; 1, 2 FRACCIÓN I, 18 Y 25 DE LA LEY NÚMERO 454 DE PRESUPUESTO\nY DISCIPLINA FISCAL DEL ESTADO DE GUERRERO; 1, 3, 4, 8, 11, 12, 25 Y 26 DE LA DECLARACIÓN\nDE LAS NACIONES UNIDAS SOBRE LOS DERECHOS DE LOS PUEBLOS INDÍGENAS; I, II, III, V, VI,\nVII, IX, XXIX, XXXI, XXXVII Y DEMÁS APLICABLES DE LA DECLARACIÓN AMERICANA SOBRE LOS\nDERECHOS DE LOS PUEBLOS INDÍGENAS; 7 DE LA LEY NÚMERO 701 DE RECONOCIMIENTO,\nDERECHOS Y CULTURA DE LOS PUEBLOS Y COMUNIDADES INDÍGENAS DEL ESTADO DE\nGUERRERO; EN RELACIÓN CON EL ARTÍCULO 47 Y ANEXOS 23 Y 23-A (E14) DEL DECRETO\nNÚMERO 680 RELATIVO AL PRESUPUESTO DE EGRESOS DEL ESTADO DE GUERRERO PARA EL\nEJERCICIO FISCAL 2024, Y LOS LINEAMIENTOS PARA LA ELABORACIÓN DE LAS REGLAS DE\nOPERACIÓN DE LOS PROGRAMAS SOCIALES ESTATALES PARA EL PERIODO 2022-2027.\nQue el Plan Nacional de Desarrollo 2019-2024 en el apartado de Política y Gobierno incluye\nRecuperar el Estado de Derecho y Libertad e Igualdad, la Política Social en Construir con un país de bienestar, y Economía con Proyectos regionales de Autosuficiencia alimentaria y rescate del campo.\nQue el Plan Estatal de Desarrollo 2022-2027 en el apartado de Pueblos Originarios y que todavía hoy mantienen los Pueblos Indígenas y Afromexicanos, requiere de una atención especial que y sustentable de los mismos.\nAFROMEXICANO, Y SE EMITEN SUS REGLAS DE\nOPERACIÓN\nQue la política estatal con el lema “Transformando Guerrero”, tiene la firme convicción de combatir de manera frontal los rezagos históricos que ha padecido el estado de Guerrero, bajo los principios de la cuarta transformación. Estos propósitos sólo se pueden lograr, escuchando las voces de los más necesitados del medio rural; promoviendo y fortaleciendo el desarrollo de capacidades de las y los habitantes que han sobrevivido con grandes carencias. derechos de los pueblos indígenas y afromexicanos.\nQue el gobierno del estado de Guerrero tiene entre sus prioridades impulsar, reconocer, valorar, promover y difundir las culturas indígenas vivas en todas sus expresiones y como parte esencial de la identidad y la cultura, así como fortalecer la difusión entre los jóvenes, de las lenguas originarias de las comunidades indígenas, con el fin de preservar nuestra identidad cultural.\nQue Guerrero es un ejemplo vivo de las desigualdades sociales y económicas prevalecientes en nuestro país, dentro de ellas, la desigualdad de género que es una de las brechas de mayor amplitud.\nMuestra de ello; es la ola de violencia en contra de los derechos de las mujeres. Los feminicidios, el acoso, la discriminación laboral y la exclusividad de los quehaceres del hogar, así como del cuidado familiar, son la evidencia de una sociedad que ve en las mujeres a personas de segunda clase, incapaces de ejercer libremente sus derechos. Por ende, la perspectiva de género es un factor de aplicación transversal en este proyecto de Presupuesto de Egresos. La visión de futuro para nuestro estado es de derechos e inclusión, siendo una de las prioridades contribuir a reducir las carencias sociales, entre las que destacan la educativa con 23.7 por ciento en esta condición, servicios de salud con 13.8 por ciento, carencia de acceso a la seguridad social con 75.6 por ciento y carencia alimentaria con 27.8 por ciento. Por lo que la alimentación, educación, salud, seguridad social son los principales indicadores por mejorar.\nQue como lo establece la Constitución Política de los Estados Unidos Mexicanos la mujer y el hombre son iguales ante la ley; la cual protegerá la organización y el desarrollo de la familia. En este sentido, el Proyecto de Presupuesto de Egresos 2024 tiene como objetivo contribuir a cimentar las bases para la disminución de la pobreza y traer paz a las familias guerrerenses. Pobreza y violencia son, sin duda, el resultado de gobiernos con poca sensibilidad social. Por lo que, la transparencia, la honestidad, la austeridad republicana, el combate a la corrupción y la eficiencia en el ejercicio del gasto son ejes fundamentales que le dan sustento. Por consiguiente, la visión de futuro para nuestro estado es de derechos e inclusión, por lo que una de las prioridades es contribuir a reducir las carencias sociales.\nQue el artículo 35 de la Ley Orgánica de la Administración Pública del Estado de Guerrero Número\n242, establece que la Secretaría para el Desarrollo de las Comunidades y Pueblos Indígenas y\nAfromexicanos, es el órgano encargado de promover, respetar, vigilar y garantizar el reconocimiento pleno y el ejercicio de los derechos de los pueblos y comunidades indígenas y afromexicanas, reconocidos en la\nConstitución Federal, los instrumentos jurídicos internacionales y las leyes locales. Dentro de algunas de sus atribuciones que le confieren se describe que es la encargada de Instrumentar, coordinar y ejecutar programas y acciones, para el desarrollo económico, social y cultural de los pueblos y comunidades indígenas y afromexicanas.\nAFROMEXICANO, Y SE EMITEN SUS REGLAS DE\nOPERACIÓN\nQue las personas titulares de las Secretarías, Dependencias y Entidades de la Administración\nPública Estatal, así como, las servidoras y servidores públicos autorizados para ejercer recursos públicos del presupuesto de inversión de las mismas, serán responsables de los programas y proyectos de inversión que realicen, las cuales deberán sujetarse a criterios de objetividad, equidad, transparencia, publicidad, selectividad y temporalidad.\nQue el artículo 47 del Decreto Número 680 relativo al Presupuesto de Egresos del Estado de\nGuerrero para el Ejercicio Fiscal 2024, establece que, con el objeto de asegurar la aplicación eficiente, eficaz, oportuna, equitativa y transparente de los recursos públicos, la Secretaría de Finanzas y\nAdministración y la Secretaría de Planeación y Desarrollo Regional, emitirán las disposiciones a que deberán sujetarse los programas de inversión sujetos a Reglas de Operación.\nQue la Secretaría de Planeación y Desarrollo Regional, expidió los Lineamientos para la\nElaboración de las Reglas de Operación de los Programas Sociales Estatales, para el periodo 2022-2027, publicadas en el Periódico Oficial del Gobierno del Estado número 14 de fecha 18 de febrero de 2022; los cuales, tienen la finalidad de ser un instrumento técnico que guíe la elaboración de los apartados centrales de las reglas de operación, así como los elementos para integrar su contenido.\nQue el gobierno del estado de Guerrero, a través de la Secretaría para el Desarrollo de las\nComunidades y Pueblos Indígenas y Afromexicanos, ejecutará el Programa Fortalecimiento, Preservación y Difusión de la Cultura de los Pueblos Indígenas y Afromexicano.\nPor lo anteriormente expuesto y con fundamento en las disposiciones legales antes citadas, he tenido a bien expedir el siguiente:\nACUERDO POR EL QUE SE CREA EL PROGRAMA FORTALECIMIENTO, PRESERVACIÓN Y\nDIFUSIÓN DE LA CULTURA DE LOS PUEBLOS INDÍGENAS Y AFROMEXICANO, Y SE EMITEN SUS\nREGLAS DE OPERACIÓN.\nArtículo 1. Se crea el Programa Fortalecimiento, Preservación y Difusión de la Cultura de los\nPueblos Indígenas y Afromexicano, con el objetivo de fortalecer y preservar la identidad cultural de los pueblos, a través de acciones que promuevan y difundan la diversidad cultural tangible e intangible, para la visibilización del patrimonio pluricultural de nuestro estado de Guerrero.\nArtículo 2. La Secretaría para el Desarrollo de las Comunidades y Pueblos Indígenas y\nAfromexicanos, tendrá a su cargo la implementación, ejecución, evaluación y administración del Programa\nFortalecimiento, Preservación y Difusión de la Cultura de los Pueblos Indígenas y Afromexicano, bajo los criterios de objetividad, equidad, transparencia, publicidad, selectividad y temporalidad, con estricto apego a la normatividad aplicable, siendo la encargada de la dispersión y asignación de los recursos del\nPrograma, apegándose plenamente a las Reglas de Operación.\nAFROMEXICANO, Y SE EMITEN SUS REGLAS DE\nOPERACIÓN\nArtículo 3. Se emiten las Reglas de Operación del Programa Fortalecimiento, Preservación y\nDifusión de la Cultura de los Pueblos Indígenas y Afromexicano con los principios de eficiencia, eficacia, oportunidad, equitativa y transparencia de los recursos públicos y requisitos que se deben de cumplir para poder acceder al citado Programa, en los términos siguientes:\nREGLAS DE OPERACIÓN DEL PROGRAMA FORTALECIMIENTO, PRESERVACIÓN Y DIFUSIÓN DE\nLA CULTURA DE LOS PUEBLOS INDÍGENAS Y AFROMEXICANO.\n1. Introducción.\n1.1. Antecedentes.\nEn el año 2006 la Secretaría de Asuntos Indígenas actualmente denominada Secretaría para el\nDesarrollo de las Comunidades y Pueblos Indígenas y Afromexicanos, por primera vez, implementó acciones para la difusión de las culturas, y en el año 2013 se agrega la atención al pueblo afromexicano, de igual manera se prioriza la cultura intangible. Derivado de cuestiones presupuestarias en el año 2019 se retoman acciones con el Programa Fortalecimiento de las Culturas e Identidades Indígenas y\nAfromexicana.\nGuerrero constituye un estado pluricultural donde las lenguas indígenas Nahuatl, Tu´un Savi\n(Mixteco), Me´Pha (Tlapaneco) y Ñomndaa (Amuzgo), son base fundamental de la identidad y la raíz histórica es por ello que en el marco del Decenio Internacional de las Lenguas Indígenas (DILI) 2022-2032, declarado el 18 de diciembre del 2019 por la Asamblea General de las Naciones Unidad (AGNU), para lo cual el presente Programa contempla acciones para el fortalecimiento de las lenguas.\nPor otra parte, respetando los saberes, la cosmovisión y la identidad cultural de los pueblos, en esta nueva visión de este gobierno trasformador y humanista hemos creado el Programa Fortalecimiento, Preservación y Difusión de la Cultura de los Pueblos Indígenas y Afromexicano, que contempla la instrumentación de acciones para preservar la cosmovisión indígena, rasgos ancestrales de la identidad de estos pueblos con un enfoque intercultural, brindando apoyos de fortalecimiento y difusión de las cuatro lenguas indígenas, medicina tradicional indígena, música, danzas, expresiones artísticas y culturales, que impulsen el respeto de sus saberes y costumbres.\n2. Alineación Programática al PED y/o PND. específicas para alcanzarlos, el Programa Fortalecimiento, Preservación y Difusión de la Cultura de los\nPueblos Indígenas y Afromexicano, se encuentra alineado al Plan Estatal de Desarrollo 2022-2027 en su eje 1 Bienestar, Desarrollo Humano y Justicia Social; en los objetivos, estrategias y líneas de acción siguientes: Objetivo 1.6 preservar la identidad de las expresiones culturales de los pueblos guerrerenses, como clave para el desarrollo artístico, económico y la cohesión social. Estrategia 1.6.1 difundir el desarrollo artístico e impulsar el trabajo creativo para el interés ciudadano, mediante mecanismos de segmentación social.\nAFROMEXICANO, Y SE EMITEN SUS REGLAS DE\nOPERACIÓN\nLínea de acción 1.6.1.4 reconocer y fortalecer las culturas indígenas y afromexicanas en sus contextos comunitarios y regionales y al Objetivo 1.10. Preservación de las danzas tradicionales del estado de Guerrero; Estrategias 1.10.1 identificar las danzas consideradas tradicionales del estado de Guerrero que permita asegurar su preservación como patrimonio intangible. Línea de acción 1.10.1.1 impulsar el índice de participación en cada una de las actividades artísticas.\nY de acuerdo al Plan Nacional de Desarrollo 2019-2024 en el apartado I.- Política y Gobierno incluye Recuperar el Estado de Derecho y Libertad e Igualdad, el cual reconocerá y respetará las atribuciones y facultades que el marco legal del país otorga a las comunidades indígenas y a sus instancias de decisión, asimismo, impulsará la igualdad como principio rector, la igualdad efectiva de derechos entre mujeres y hombres, entre indígenas y mestizos, entre jóvenes y adultos, y se comprometerá en la erradicación de las prácticas discriminatorias que han perpetuado la opresión de sectores poblacionales enteros; II. Política Social en Construir un país con bienestar, en México los artículos 3, 27, 123 y otros de la Constitución de 1917 sentaron las bases para un estado de bienestar con características propias en un país predominantemente agrario y de tradiciones indígenas comunitarias; III. Economía con Proyectos regionales Autosuficiencia alimentaria y rescate del campo. El sector agrario ha sido uno de los más devastados por las políticas neoliberales. A partir de 1988 se destruyeron mecanismos que resultaban fundamentales para el desarrollo agrario, se orientó el apoyo público a la manipulación electoral y se propició el vaciamiento poblacional del agro. Las comunidades indígenas, que han vivido desde hace siglos la opresión, el saqueo y la discriminación, padecieron con particular intensidad esta ofensiva.\n2.1. Diagnóstico.\nEn Guerrero se encuentran asentados los pueblos indígenas Nahua, Na’ Savi (mixteco), Me’phaa\n(tlapaneco) y Nn´anncue Ñomdaa (amuzgo), estos pueblos y sus comunidades comparten algunos rasgos culturales, sin embargo, cada uno de ellos guarda su propia cultura e identidad que los define, diferencia y, paralelamente, los hace reconocerse como tales.\nLa trascendencia de los pueblos indígenas y afromexicanos, no sólo se fundamenta en sus aportes culturales e históricos, sino también por su importancia numérica, tal como lo muestra el Censo de\nPoblación y Vivienda 20201:\nGUERRERO 2020\nTotal, de población de Guerrero: 3´540,685\n1 Censo de Población y Vivienda 2020, INEGI\nAFROMEXICANO, Y SE EMITEN SUS REGLAS DE\nOPERACIÓN\nMujeres: 1´840,073\nHombres: 1´700,612\nTotal, Población hablante de lengua indígena: 515,487\nTotal, Población que se autoreconoce indígena: 1’198,362\n303,923\nTotal, Población que se autoreconoce afromexicana:\nLa relevancia demográfica, histórica, cultural y social de los Pueblos Indígenas y Afromexicanos, los sitúan en condiciones de desigualdad social y jurídica, por ello se refrenda el compromiso de fomentar, impulsar y preservar el conocimiento, los valores, el respeto a la cultura e identidad promoviendo su inclusión social, la no discriminación y la igualdad de oportunidades.\nNo obstante, estos pueblos y sus comunidades, históricamente han padecido discriminación, marginación, pobreza y limitación en el ejercicio de sus derechos humanos, lo cual ha afectado su desarrollo individual y colectivo.\nComo uno de los efectos del rezago social y jurídico, las culturas indígenas y afromexicanas enfrentan procesos de debilitamiento de su identidad que se traduce en desvaloración de lo propio, deterioro del patrimonio cultural y resquebrajamiento del tejido social2. A lo anterior habría que agregar la visión distorsionada que aún mantienen diversos sectores de la sociedad, ya que con frecuencia se confunde cultura con folclor y se insiste en mostrar sólo aquellas dimensiones más exóticas y externas de la cultura.\nLos pueblos indígenas y afromexicanos no necesitan que se “rescaten” sus culturas, pues éstas se encuentran vivas; lo que se necesita hacer con urgencia es buscar la forma de coadyuvar efectivamente en la preservación, fortalecimientos y difusión de las mismas. revitalización cultural, puesto que estos procesos sólo pueden ser posibles desde la propia vida de las comunidades que la conforman. En la revitalización cultural la comunidad y los actores sociales comunitarios se constituyen en sujetos sociales, políticos e históricos, lo que permite eliminar la visión de los rescatadores, a quienes sólo les interesa encontrar “piezas” para ser fosilizadas en los museos.\n2 Programa Especial de Pueblos Indígenas 2014-2018. México, CDI, 2014, p. 36\nAFROMEXICANO, Y SE EMITEN SUS REGLAS DE\nOPERACIÓN memoria colectiva, incrementando la experiencia social de la existencia comunitaria, que le permita afirmar los propios recursos culturales que han sido capaces de construir como pueblos.\nEn congruencia con lo anterior, la Secretaría para el Desarrollo de las Comunidades y Pueblos\nIndígenas y Afromexicanos (SEDEPIA), implementa el presente Programa con el objeto de atender las demandas indígenas y afromexicanas en materia cultural.\n2.1.1. Población Potencial.\nLa población total en el estado de Guerrero es de 3,540,685 habitantes de los cuales 515,487 son hablantes de una lengua indígena que representa al 15.48% del total de la población del estado, de acuerdo a las cifras del INEGI 2020, 274,512 son mujeres indígenas y 240,975 son hombres indígenas; de acuerdo al Censo Nacional de Población y Vivienda 2020, 303,923 habitantes se auto reconocen afromexicanos que equivale al 8.6% del total de la población, de las cuales 156,446 son mujeres y 147,477 son hombres que se reconocen como afromexicanos, teniendo como resultado 819,410 mujeres y hombres indígenas y afromexicanos, dando un total de 819,410 personas que constituyen la población potencial.\n2.1.2. Población Objetivo.\nLa población objeto es de 175,382 personas indígenas y afromexicanas del estado de Guerrero, que estén interesadas en fortalecer y preservar la identidad cultural de sus comunidades y cumplan con los requisitos previos para ser beneficiadas o beneficiados en el numeral 6 Criterios y Requisitos de\nElegibilidad de estas Reglas de Operación. (REFORMADO, P.O 23 ALCANCE IX, 21 DE MARZO 2025)\n2.1.3. Población Beneficiaria.\nLa población beneficiada es de 1,485 personas indígenas y afromexicanas que realicen actividades vinculadas con las diferentes expresiones artísticas y culturales, específicamente las relacionadas con las lenguas indígenas, la música, la danza, y medicina tradicional. (REFORMADO, P.O 23\nALCANCE IX, 21 DE MARZO 2025)\n2.1.4. Población Indígena.\nSe tiene programado beneficiar a los cuatro pueblos indígenas Náhuatl, Nà Savi\n(mixteco), Me’phaa (tlapaneco) y Nn´anncue Ñomndaa (amuzgo), así como al pueblo afromexicano que los municipios hablantes de la lengua Indígena y afromexicana. (REFORMADO, P.O 23 ALCANCE IX, 21 DE MARZO\n2025)\n2.2. Fundamento Legal.\nEl Programa tiene como fundamento legal los instrumentos jurídicos siguientes:\nAFROMEXICANO, Y SE EMITEN SUS REGLAS DE\nOPERACIÓN\na). Constitución Política de los Estados Unidos Mexicanos.\nc). Declaración de las Naciones Unidas sobre los Derechos de los Pueblos Indígenas. d). Ley\nGeneral para la Igualdad entre Mujeres y Hombres.\ne). Ley General de Acceso de las Mujeres a una Vida Libre de Violencia. f). Plan Nacional de\nDesarrollo 2019-2024.\ng). Ley Orgánica de la Administración Pública del Estado de Guerrero Número 242.\nh). Ley Número 701 de Reconocimiento, Derechos y Cultura de los Pueblos y Comunidades\nIndígenas y Afromexicanas del Estado de Guerrero.\ni). Ley Número 207 de Transparencia y Acceso a la Información Pública del Estado de Guerrero.\nj) Ley Número 465 de Responsabilidades Administrativas para el Estado de Guerrero.\nk) Ley Número 466 de Protección de Datos Personales en Posesión de Sujetos Obligados del\nEstado de Guerrero.\nl) Ley Número 494 para la Igualdad entre Mujeres y Hombres del Estado de Guerrero.\nm) Ley Número 553 de Acceso de las Mujeres a una Vida Libre de Violencia del Estado Libre y\nSoberano de Guerrero. para el Desarrollo Social del Estado de Guerrero. ñ) Ley Número 026 para el Bienestar del Estado de Guerrero. (REFORMADO, P.O 23 ALCANCE IX, 21\nDE MARZO 2025)\no) Ley Número 427 del Sistema de Coordinación Hacendaria del Estado De Guerrero.\np) Decreto Número 181 por medio del cual la Sexagésima Tercera Legislatura al Honorable\n2022-2027.\nq) Decreto Número 203 del Presupuesto de Egresos del Estado de Guerrero, para el Ejercicio\nFiscal 2025. (REFORMADO, P.O 23 ALCANCE IX, 21 DE MARZO 2025)\nr) Reglamento Interior de la Secretaría de Asuntos Indígenas.\nAFROMEXICANO, Y SE EMITEN SUS REGLAS DE\nOPERACIÓN\ns) Lineamientos para la Elaboración de las Reglas de Operación de los Programas Sociales\nEstatales para el periodo 2022-2027.\nt) Plan Estatal de Desarrollo 2022-2027.\nv) Todos aquellos ordenamientos normativos aplicables.\n2.3. Definiciones y Siglas.\nDefiniciones:\nAgrupación musical: Conjunto, banda de música de viento o grupo musical, compuesto por dos o más personas que, a través de la voz y/o de instrumentos, interpretan obras musicales que conservan la tradición musical de las comunidades indígenas y afromexicanas. Para los fines de estas Reglas de\nOperación, los conjuntos o bandas musicales que interpretan cualquier género de música moderna no están considerados en esta categoría.\nAlienación: Pérdida de la personalidad o de la identidad de una persona o de un colectivo.\nApoyo en especie: Otorgamiento de bienes y servicios, diferente al apoyo monetario.\nAuto adscripción afromexicana: Auto reconocimiento como persona descendiente de población africana que llegó al territorio de México durante la conquista y colonización española, con base en su propia cultura, tradiciones e historia.\nAuto adscripción indígena: Auto reconocimiento como persona indígena con base en su propia cultura, tradiciones e historia, ya sea hablante o no de alguna lengua indígena.\nCarta Compromiso: Carta mediante la cual las personas beneficiarias se comprometen a cumplir con lo estipulado en estas Reglas de Operación, sin necesidad de una notaría o un notario.\nCosmovisión: Es la manera de ver e interpretar el mundo. Conjunto de ideas que nos permite analizar y comprender la realidad, a partir de la propia existencia.\nCultura: Conjunto de conocimientos, creencias, valores, costumbres, conductas, leyes y cualquier otra capacidad y hábitos adquiridos por las personas, que hacen posible la vida, transformación y reproducción de una sociedad.\nCultura intangible: Es el conjunto de manifestaciones no materiales que genera una cultura, como son los saberes y conocimientos, las celebraciones y rituales, las manifestaciones musicales,\nAFROMEXICANO, Y SE EMITEN SUS REGLAS DE\nOPERACIÓN literarias, dancísticas y plásticas entre otros. Este patrimonio se transmite oralmente y se modifica con el transcurso del tiempo, a través de un proceso de recreación colectiva.\nDanzas tradicionales: Bailes típicos propios de las culturas indígenas y afromexicanas, cuyo origen puede o no remontarse a la época colonial, bailadas por hombres y mujeres de las comunidades, principalmente durante acontecimientos sociales y fiestas patronales.\nDiálogo intercultural: Intercambio de opiniones y puntos de vista entre distintas culturas, comunidades y pueblos, basado en la comprensión y el respeto mutuo.\nDiscriminación: Trato diferente y perjudicial que se da a una persona o colectividad por motivos de edad, color, capacidades, etnia, nacionalidad, género, orientación sexual, ideas políticas, religión, entre otras.\nElementos culturales: Son todas las partes que componen la cultura de un pueblo, país o etnia que, junto con los elementos naturales, les dan forma, cohesión e identidad a las sociedades y permiten su identificación y diferenciación respecto a otras.\nExpresiones artísticas y culturales: Conjunto de manifestaciones de una etnia, pueblo o país que incluye la música, danza, arte, diseños, signos, símbolos, interpretaciones, ceremonias, rituales, mitos, saberes, narraciones, artesanías, formas arquitectónicas, entre otras.\nExpresiones lingüísticas: Manifestaciones que pertenecen o están relacionadas con el lenguaje.\nIdentidad: Es el sentido de pertenencia a una colectividad, construido a través de la adopción de elementos culturales comunes a dicha colectividad, y que nos permite diferenciarnos y reafirmarnos ante personas de otras culturas.\nIdeológico: Conjunto de ideas fundamentales que caracteriza el pensamiento de una persona, una colectividad o una época.\nMédicos tradicionales: Personas que se dedican a curar diferentes dolencias físicas y emocionales con medicina tradicional como son: la herbolaria. la partería, los hueseros, los rezanderos, entre otros.\nOrganización social: Grupo de personas que unen actuaciones para alcanzar determinados propósitos.\nPadrón de personas beneficiarias: Relación de beneficiarias y beneficiarios, de obras o de servicios del Programa.\nParteras tradicionales: Son un recurso comunitario de atención a la salud, de amplio reconocimiento y prestigio en sus comunidades; son las personas encargadas de brindar cuidados a las mujeres durante el embarazo, parto y posparto.\nAFROMEXICANO, Y SE EMITEN SUS REGLAS DE\nOPERACIÓN\nPatrimonio cultural: Conjunto de bienes tangibles e intangibles, que constituyen la herencia de un grupo humano, que refuerza su sentido de comunidad e identidad propia. Como producto de la creatividad humana, se hereda, se transmite, se modifica y optimiza de individuo a individuo y de generación a generación.\nPersona beneficiaria: Persona que recibe los bienes y/o servicios, por haber cumplido con los requisitos establecidos en las presentes Reglas de Operación.\nPrograma: Programa Fortalecimiento, Preservación y difusión de la Cultura de los Pueblos\nIndígenas y Afromexicano.\nPromoción cultural: Sistema de acciones que facilita una relación activa entre la población y la cultura.\nPluriculturalidad: Presencia de dos o más culturas en un mismo territorio, donde puede existir la posibilidad que surjan situaciones de interrelación.\nReglas de Operación: Reglas de Operación del Programa Fortalecimiento, Preservación y\nDifusión de Cultura de los Pueblos Indígenas y Afromexicano.\nSaberes ancestrales: Conjunto de saberes y prácticas conservadas a lo largo del tiempo, a través de la tradición oral de los pueblos, y transmitida de generación a generación.\nTejido social: Es la configuración de vínculos sociales e institucionales que favorecen la unión y la reproducción de la vida social.\nSiglas:\nAGNU: Asamblea General de las Naciones Unidas.\nDILI: Decenio Internacional de las Lenguas Indígenas.\nMIR: Matriz de Indicadores para el Resultado.\nSCyTG: Secretaría de Contraloría y Transparencia Gubernamental.\nSEDEPIA: Secretaría para el Desarrollo de las Comunidades y Pueblos Indígenas y\nAfromexicanos.\nSEFINA: Secretaría de Finanzas y Administración.\nSEPLADER: Secretaría de Planeación y Desarrollo Regional.\nAFROMEXICANO, Y SE EMITEN SUS REGLAS DE\nOPERACIÓN\n3. Objetivos y Alcances.\n3.1. Objetivo General.\nFortalecer y preservar la identidad cultural de los pueblos indígenas y afromexicanos, a través de acciones que promuevan y difundan la diversidad cultural tangible e intangible, para la visibilización del patrimonio pluricultural de nuestro estado.\n3.2. Objetivo Específico.\na). Fortalecer las lenguas indígenas a través de acciones que promuevan el uso de estas, para fomentar la enseñanza y aprendizaje bilingüe e intercultural.\nb). Promover la conservación de la medicina tradicional y las parteras tradicionales a través de acciones que fortalezcan sus saberes ancestrales dentro de sus comunidades.\nc). Preservar y difundir las diferentes expresiones artísticas y culturales de los pueblos indígenas y afromexicanos, a través de acciones que fomenten su diversidad cultural y fortaleciendo sus usos y costumbres.\n3.3. Cobertura.\nEl Programa tendrá cobertura estatal en las regiones y municipios identificados y reconocidos con población indígena y afromexicana y será implementado por la SEDEPIA, a través de la Dirección de\nPromoción y Difusión Cultural. Atendiendo a los municipios afectados por el huracán OTIS, dependiendo de la disponibilidad presupuestal del Programa.\n3.4. Alcances.\nLa Ley Número 701 de Reconocimiento, Derechos y Cultura de los Pueblos y Comunidades\nIndígenas y Afromexicanas del Estado de Guerrero, en su artículo 26 fracción IV, mandata que el estado y las instituciones deberán preservar y enriquecer las lenguas indígenas, así como sus conocimientos y todos los elementos que constituyan sus culturas e identidades. Asimismo, bajo los mismos términos este derechos. recogidas en los Foros de Consulta Ciudadana, efectuados para elaborar el Plan Estatal de Desarrollo\n2022-2027, se plantea la necesidad de implementar un programa que cumpla con las políticas públicas afromexicanas, atendiendo a su derecho a la seguridad social.\nAFROMEXICANO, Y SE EMITEN SUS REGLAS DE\nOPERACIÓN de prestaciones que este otorga y no solo a través de la asistencia médica, sino en la totalidad de acciones estado de Guerrero.\n4. Metas Físicas.\nLos servicios y acciones estarán sujetos a la disponibilidad presupuestal del Programa, y son los siguientes:\na) Eventos para el impulso de las culturas e identidades Cuatro festivales culturales de los pueblos indígenas y afromexicano (REFORMADO, P.O 23 ALCANCE IX, 21 DE MARZO 2025)\n• Festival de la identidad afrodescendiente\n• Día internacional de la lengua materna\n• Día internacional de los Pueblos Indígenas\n• Día de la diversidad cultural\n• Cuatro talleres para promover el uso, preservación y difusión de las lenguas maternas.\nb) Promoción y difusión de la música y danzas indígenas y afromexicanas: (REFORMADO, P.O\n23 ALCANCE IX, 21 DE MARZO 2025)\n• 20 instrumentos musicales.\n• 6 paquetes de vestuario para danzas tradicionales.\n• Encuentro estatal de bandas de música de viento.\nc) Capacitaciones para el fortalecimiento de la partería y la medicina tradicional indígena.\n(REFORMADO, P.O 23 ALCANCE IX, 21 DE MARZO 2025)\n• Tres capacitaciones para la preservación y fortalecimiento de las parteras tradicionales y de la medicina tradicional indígena.\n5. Programación Presupuestal.\nLos recursos aprobados en el Decreto Número 203 del Presupuesto de Egresos del Estado de\nGuerrero, para el Ejercicio Fiscal 2025 corresponden a Inversión Estatal Directa que ascienden a\n$3,150,000.00 (Tres Millones Ciento Cincuenta Mil Pesos 00/100 M.N.). No se puede establecer monto de la población beneficiada en virtud que van desde ferias o exposiciones de artesanías, donación de instrumentos musicales, entre otros. (REFORMADO, P.O 23 ALCANCE IX, 21 DE MARZO 2025)\nAFROMEXICANO, Y SE EMITEN SUS REGLAS DE\nOPERACIÓN\nLa disponibilidad del programa dependerá de los ingresos recaudados por la SEFINA, por lo que la calendarización y metas programadas pueden variar. (REFORMADO, P.O 23 ALCANCE IX, 21 DE MARZO 2025)\nCalendario de Ministración.\nFORTALECIMIENTO, PRESERVACION Y DIFUSION DE LA CULTURA DE LOS PUEBLOS INDIGENAS Y AFROMEX1CANO\nCONCEPTO TOTAL ($) ENE FEB MAR ABR MAY JUN JUL AGQ SEP OCTUBRE NOV, DIC.\n1. Eventos para el impulso las culturas $ 1,332,400.00 $ 440,100,00 $ 136,400.00 $ 141,400.00 $ 31,200.00 $ 32,400.00 $ 28,400.00 S 194,000.00 $ $ 328,500,00 e identidades.\nII. Promoción y afromexicana\nTOTAL ($) $ 3,150,000.00 $ 440,100.00 $ 136,400.00 $ 253,400.00 $ 146,800.00 $ 1,332,400.00 S 208,400.00 $ 194,000.00 $ 110,000.00 $ 328,500.00 $ •\nTOTAL TRIMESTRAL $ 3,150,000.00 $ 576,500.00 $ 1,732,600.00 5 512,400.00 S 328,500.00\nCronograma de Actividades\nCONCEPTO ENE FEB MAR ABR MAY JUN JUL AGO SEP OCT NOV DIC\nEventos para el\nImpulso de las\nCulturas e identidades\nPromoción y difusión de la música y danzas indígenas y afromexicanas\n5.1. Gastos de Operación.\nEn cumplimiento al artículo 47 de la Ley de Coordinación Fiscal, podrá aplicarse hasta un 3% del presupuesto total del Programa, a gastos de operación y realización de diversas acciones, asociadas con la planeación, operación, supervisión, seguimiento, contraloría social y evaluación o asesoría externa del\nPrograma, por un monto de $94,500.00 (Noventa y Cuatro Mil Quinientos Pesos 00/100 M.N.). De acuerdo a la tabla siguiente: (REFORMADO, P.O 23 ALCANCE IX, 21 DE MARZO 2025)\nUNIDAD DE\nMEDIDA\n2000 2100 2111 Paquete 2 $5,000.00 $10,000.00\nAFROMEXICANO, Y SE EMITEN SUS REGLAS DE\nOPERACIÓN\n2121 Paquete 2 $5,000.00 $10,000.00\n2600 2611 Litro 600 $26.00 $15,600.00\n3000 3300 3361 Pieza 1900 $1.00 $1,900.00\n3000 3300 3361 Pieza 10 $1,000.00 $10,000.00\n3721 Caseta 10 $1,000.00 $10,000.00\n3000 3700\n3751 Día 37 $1,000.00 $37,000.00\n$94,500.00\n6. Criterios y Requisitos de Elegibilidad.\nLa forma de acceder a los servicios y apoyos que ofrece el Programa, responde a solicitud de las personas que demandan el beneficio, y los criterios serán trasparentes, equitativos y no discrecionales.\nLos requisitos y la forma de acceso estarán determinados por la auto adscripción indígena de la persona solicitante ya sea expresa o tácita, posteriormente se agregará a los criterios de selección establecidos por el Programa; los cuales son públicos y estarán disponibles para las personas solicitantes en las Oficinas\nCentrales y Delegaciones de la SEDEPIA, cuya ubicación y horarios se anotan en el apartado 9.2. de las presentes Reglas de Operación.\na). Ser persona indígena o afromexicana.\nb). Tener domicilio dentro de las comunidades y municipios indígenas y afromexicanos del estado de Guerrero.\nc). Cumplir con los criterios y requisitos de elegibilidad descritos en la Reglas de Operación y convocatorias.\na) Eventos para el impulso de las culturas e identidades (REFORMADO, P.O 23 ALCANCE IX, 21\nDE MARZO 2025)\n• Solicitud por escrito libre, firmada por la persona representante del grupo, dirigida al titular de la SEDEPIA.\n• Identificación oficial vigente.\nb) Promoción y difusión de la música y danzas indígenas y afromexicanas: (REFORMADO,\nP.O 23 ALCANCE IX, 21 DE MARZO 2025)\n• Solicitud por escrito libre, firmada por la persona representante del grupo, dirigida a la persona titular de la SEDEPIA, en la cual deberá contener los siguientes datos: número telefónico y correo electrónico.\n• Constancia emitida por una autoridad municipal que avale que la agrupación presta beneficio a la comunidad.\nAFROMEXICANO, Y SE EMITEN SUS REGLAS DE\nOPERACIÓN\n• Carta compromiso de buen uso.\n• Identificación oficial vigente o pasaporte, (en caso de ser menor de edad presentar CURP) de las y los integrantes de las agrupaciones musicales y grupos de danza.\n• Evidencia fotográfica de la agrupación.\n• No haber sido beneficiado cinco años anterior por las instituciones, (INPI, CULTURAS\nPOPULARES, SEDEPIA y SECULTURA).\nc) Capacitaciones para el fortalecimiento de la medicina tradicional y la partería indígena.\n(REFORMADO, P.O 23 ALCANCE IX, 21 DE MARZO 2025)\n• Solicitud libre dirigido a la persona titular de la Secretaría para el Desarrollo de las Comunidades y Pueblos Indígenas y Afromexicanos.\n• Copia de la credencial para votar emitida por el INE vigente.\n7. Tipo, Monto y Periodicidad del Apoyo. (REFORMADO, P.O 23 ALCANCE IX, 21 DE MARZO 2025)\nHasta por un monto\nApoyo Tipo Periodicidad máximo de:\nFESTIVALES CULTURALES DE LOS\nPUEBLOS INDÍGENAS Y\nEspecie 1,600.00 Único\nAFROMEXICANO\nPROMOCIÓN Y DIFUSIÓN DE LA\nMÚSICA Y DANZA INDÍGENAS Y Especie 65,000.00 Único\nAFROMEXICANAS.\nCAPACITACIONES PARA EL\nFORTALECIMIENTO DE LA PARTERÍA\nServicio 600.00 Único\nY LA MEDICINA TRADICIONAL\nINDÍGENA.\nTALLERES PARA PROMOVER EL\nUSO, PRESERVACIÓN Y DIFUSIÓN DE Servicio 600.00 Único\nLAS LENGUAS MATERNAS\nENCUENTRO ESTATAL DE BANDAS\nDE MÚSICA DE VIENTO Servicio 600.00 Único\n7.1. Características de los apoyos. (REFORMADO, P.O 23 ALCANCE IX, 21 DE MARZO 2025)\nTIPO DE APOYO CONCEPTO MONTO MÁXIMO DE APOYO\nAFROMEXICANO, Y SE EMITEN SUS REGLAS DE\nOPERACIÓN\nAlimentación: hasta por un monto de\n$400.00\n-Pago de alimentación.\nI.FESTIVALES CULTURALES DE LOS\nPasaje: hasta por un monto de\nPUEBLOS INDÍGENAS Y AFROMEXICANO\n-Pago de pasaje. $600.00\n(Por participante)\nDotación de 20 piezas de instrumentos musicales: Hasta por un\nInstrumentos musicales. monto de $65,000.00\nII. PROMOCIÓN Y DIFUSIÓN DE LA MÚSICA\nVestuario para grupos de (Por grupo)\nY DANZA INDÍGENAS Y AFROMEXICANAS. danzas tradicionales.\n6 paquetes: Hasta por un monto de:\n$30,000.00 (Por grupo).\nAlimentación hasta por un monto de\nPago de alimentación.\nIII.CAPACITACIONES PARA EL $400.00\nFORTALECIMIENTO DE LA PARTERÍA Y LA\nMEDICINA TRADICIONAL INDÍGENA. Pasaje: hasta por un monto de\nPago de pasaje.\n$600.00\nAlimentación hasta por un monto de\nPago de alimentación.\nIV. TALLERES PARA PROMOVER EL USO, $400.00\nPRESERVACIÓN Y DIFUSIÓN DE LAS\nLENGUAS MATERNAS Pasaje hasta por un monto de\n-Pago de pasaje.\n$600.00\nAlimentación hasta por un monto de\nPago de alimentación.\n$400.00\nV. ENCUENTRO ESTATAL DE BANDAS DE\nMÚSICA DE VIENTO.\nPasaje hasta por un monto de\n-Pago de pasaje\n$600.00\n7.2. Recursos no Devengados. reintegrado a la Dirección General de Tesorería de la SEFINA. (REFORMADO, P.O 23 ALCANCE IX, 21 DE\nMARZO 2025)\n7.3. Resguardo de la Documentación.\nPrograma asimismo deberán verificar que se cumpla con los requisitos entregando acuse de recibo, una\nAFROMEXICANO, Y SE EMITEN SUS REGLAS DE\nOPERACIÓN de los recursos ejercidos del Programa que desarrolla en las presentes Reglas de Operación.\n7.4. Supervisión y Control.\nLa supervisión, control y evaluación del Programa, será interna y estará a cargo de la Dirección de Promoción y Difusión Cultural, para lo cual se utilizará la Metodología del Marco Lógico y los resultados de la evaluación serán compartidos cada trimestre con la SEPLADER y la SCyTG, mismos que se deberán presentar a más tardar 15 días hábiles posteriores a la terminación de cada trimestre, así como los informes sobre el presupuesto ejercido y con base a los indicadores de resultados previstos en este precepto.\nTodos los gastos generados en cada una de las actividades y acciones estarán soportados con la comprobación respectiva.\n8. Criterios de Selección.\nPertenecer a uno de los pueblos Nahua, Nà Savi (mixteco), Me’phaa (tlapaneco) y Nn´anncue\nÑomndaa (amuzgo), y el pueblo afromexicano, las personas o agrupaciones que solicitan un apoyo deberán cumplir los requisitos de selección y elegibilidad, establecidos en el apartado 6 de las presentes\nReglas de Operación. La aludida pertenencia estará regida por los criterios de auto adscripción establecidas en la Ley Número 701 de Reconocimiento, Derechos y Cultura de los Pueblos y Comunidades\nIndígenas del Estado de Guerrero.\na). Ser persona indígena o afromexicana\nb). Tener domicilio en municipios indígenas o afromexicanos.\nc). Haber sido afectado por el huracán “OTIS”\nd). Ser un grupo de danza tradicional indígena o afromexicano. e). Ser un grupo de música de viento indígena o afromexicano.\nf). Cumplir con los criterios y requisitos de elegibilidad descritos en la Reglas de Operación y en la\nConvocatoria\n8.1. Casos Especiales.\nLos casos especiales del Programa y aquellos no previstos en las Reglas de Operación, serán resueltos por la persona titular de la SEDEPIA.\n8.2. Casos de Emergencia o Desastre.\nPara el caso de emergencia o desastres naturales, la SEDEPIA podrá dar atención de manera inmediata de acuerdo a la disponibilidad financiera y la evaluación de los daños a la población afectada, dicha evaluación deberá contar con la evidencia documental, como galería fotográfica y acta de hechos levantada por personal responsable del Programa y/o autoridad competente, la SEDEPIA facilitará los mecanismos para cumplir con los requisitos establecidos en las presentes Reglas de Operación.\nAFROMEXICANO, Y SE EMITEN SUS REGLAS DE\nOPERACIÓN\n8.3. Suspensión o Cancelación del Programa Social.\nLa SEDEPIA, podrá suspender y/o cancelar la operación del Programa, cuando no exista las condiciones sociales-económicas entre las partes, cuando una de las personas beneficiarias no acate las disposiciones de estas Reglas de Operación, o cuando lo determine la persona titular del ejecutivo estatal y por problemas de gobernabilidad.\n8.4. Integración del Padrón de Personas Beneficiarias.\nLas personas y agrupaciones beneficiarias del Programa, formarán parte de un Padrón de\nPersonas Beneficiarias, el cual será de carácter público, siendo reservados sus datos personales, de acuerdo con la Ley Número 207 de Transparencia y Acceso a la Información Pública del Estado de\nGuerrero y, en ningún caso, podrán emplearse para propósitos de proselitismo político, religioso o comercial, ni para ningún otro fin distinto al establecido en estas Reglas de Operación.\nAnte ningún caso o situación las personas servidoras públicas que ejecuten el Programa podrán solicitar pago alguno por el servicio que prestan, ni procederán de manera diferente a lo establecido en estas Reglas de Operación.\n9. Mecánica Operativa del Programa Social.\nLa SEDEPIA analizará las solicitudes y de acuerdo a la disponibilidad presupuestal del Programa brindará a las personas solicitantes los apoyos a los solicitantes del Diplomado para la formación y certificación de intérpretes traductores en lenguas indígenas, Eventos para el impulso de las culturas e identidades, Promoción y difusión de la música y danza indígenas y afromexicanas, Encuentro Estatal de la Lengua Materna, y que no hayan recibido ningún apoyo de otra institución y mínimo dos años anteriores por la SEDEPIA, y que reúnan los requisitos y criterios de elegibilidad, el cual será en servicios y en especie.\nLa SEDEPIA notificará a los grupos beneficiarios, por vía telefónica o correo electrónico, la aprobación de su solicitud, en un término de sesenta días hábiles, posteriores a la recepción de la misma.\n• Las personas y agrupaciones interesadas en los apoyos arriba señalados, deberán dirigir su solicitud por escrito libre a la persona titular de la SEDEPIA, y entregarla en las oficinas centrales de la\nSEDEPIA, así como en sus delegaciones regionales, en un horario de 9:00 a 15:00 horas.\nPara la ejecución del Programa, la SEDEPIA, a través de la Dirección de Promoción y Difusión\nCultural elaborará las Reglas de Operación y la programación presupuestal.\nLa implementación del Programa estará a cargo de la Dirección de Promoción y Difusión Cultural, la cual será responsable recibir todas las solicitudes de la población indígena y afromexicana, así como vigilar el correcto seguimiento y cumplimiento a los apoyos y servicios prestados.\nAFROMEXICANO, Y SE EMITEN SUS REGLAS DE\nOPERACIÓN\nReglas de Operación y, de acuerdo a las características no previsibles de la demanda ciudadana.\n• Las personas e instancias interesadas deberán entregar, en las unidades administrativas receptoras, la solicitud de apoyo mediante escrito libre en original, en el que se indique, el nombre de la(s) persona(s) solicitante(s), el tipo de apoyo que requiere y sus datos personales para localización, acompañada por los requisitos establecidos.\n• El personal de las unidades administrativas receptoras deberá orientar a las personas solicitantes, en la elaboración y presentación de las solicitudes y la documentación establecida en el\nPrograma.\n• Las unidades administrativas receptoras, al recibir cada solicitud, deberán verificar que el expediente cumpla con los requisitos señalados en estas Reglas de Operación, y deberán entregar el acuse de recibo a quien solicita el apoyo o servicio, señalando los documentos o datos faltantes para que sean entregados en un plazo no mayor de cinco días hábiles.\nUna vez publicados los resultados, la Dirección de cultura se pondrá en contacto con las personas o grupos beneficiados para acordar el proceso de entrega.\nLos datos de las personas beneficiarias del Programa, así como la información que éste genere y administre estará regida por lo que establece la Ley Número 207 de Transparencia y Acceso a la\nInformación Pública del Estado de Guerrero.\nTodos los formatos y papelería que se entregue a las personas solicitantes y personas beneficiarias del Programa, así como los trámites a realizar serán totalmente gratuitos.\n9.1. Instancia Ejecutora y/o Responsable.\nLa SEDEPIA será la instancia ejecutora del Programa, a través de la Dirección de Promoción y\nDifusión Cultural y de sus delegaciones regionales.\n9.2. Proceso de Incorporación al Programa Social.\nPara acceder a los servicios y apoyos del Programa, se deberá cumplir con los requisitos según el tipo de apoyo o servicio solicitado y de acuerdo a los criterios y requisitos que se citan en el apartado 6 de estas Reglas de Operación.\nSe recibirán las solicitudes en la oficina central y de las delegaciones siguientes:\nChilpancingo de los Bravo: Avenida de la Juventud, número 5, Colonia El Centenario.\nC.P. 39090 Tel. (747) 137 0620.\nAFROMEXICANO, Y SE EMITEN SUS REGLAS DE\nOPERACIÓN\nChilapa de Álvarez: Calle 8 norte, número 801, Barrio del Dulce Nombre, Tel. (756) 475 0253.\nOmetepec: Calle Juan Ruiz de Alarcón, número. 32, Barrio la Guadalupe. Tel. (741) 412 0055.\nTlapa de Comonfort: Carretera Tlapa-Puebla km 1, Colonia El Tepeyac, referencia La Choza del\nIndio. (757) 1005159.\n10. Evaluación.\nLa SEDEPIA tendrá la obligación de revisar, de manera interna, la correcta operación y aplicación de las presentes Reglas de Operación y en caso necesario, podrá solicitar una evaluación externa por parte de una instancia con experiencia en el tema. Asimismo, efectuará periódicamente acciones de supervisión y evaluación para garantizar el adecuado desarrollo del Programa, con el objeto de corregir desfases o efectuar reasignaciones financieras, a fin de cubrir rubros prioritarios con recursos de este mismo Programa o de otros que no hayan sido ejercidos en su momento, o bien que provengan de ahorros presupuestales; todo esto de acuerdo al anexo 25 del Decreto Número 203 del Presupuesto de Egresos del Estado de\nGuerrero, para el Ejercicio Fiscal 2025. (REFORMADO, P.O 23 ALCANCE IX, 21 DE MARZO 2025)\n10.1 Indicadores (Construcción de la Matriz de Indicadores para Resultados. – Anexo 1).\n(REFORMADO, P.O 23 ALCANCE IX, 21 DE MARZO 2025)\nAFROMEXICANO, Y SE EMITEN SUS REGLAS DE\nOPERACIÓN\nAFROMEXICANO, Y SE EMITEN SUS REGLAS DE\nOPERACIÓN\nAFROMEXICANO, Y SE EMITEN SUS REGLAS DE\nOPERACIÓN\nAFROMEXICANO, Y SE EMITEN SUS REGLAS DE\nOPERACIÓN\n10.2. Seguimiento.\nAFROMEXICANO, Y SE EMITEN SUS REGLAS DE\nOPERACIÓN\nLas delegaciones regionales y la Dirección de Promoción y Difusión Cultural de la SEDEPIA, llevarán a cabo el seguimiento relacionado con las metas comprometidas, a fin de verificar la aplicación correcta de los recursos otorgados y el cumplimiento de objetivos y metas establecidas. Este seguimiento se realizará a través de la evaluación y acompañamiento de las acciones desarrolladas en campo.\n10.3. Auditoría.\nLa SEDEPIA será la responsable de la supervisión directa de las acciones, así como de verificar que en su ejecución se cumpla con la normatividad aplicable. Los recursos asignados para la operación del Programa, no pierden su carácter estatal, por lo que la SEFINA, la SCyTG y la Auditoría Superior del\nEstado, en el ámbito de sus respectivas competencias, realizarán actividades de fiscalización y auditoría.\nAsimismo, otorgará todas las facilidades a las instancias fiscalizadoras para realizar en el momento que juzguen pertinente, las auditorías necesarias; asimismo, efectuará el seguimiento y la solventación de las observaciones planteadas por los órganos de control. La inobservancia de esta disposición, independientemente de las sanciones a que haya lugar, limitará la ministración de los recursos estatales en el siguiente ejercicio presupuestal.\n11. Mecanismo de Entrega del Apoyo.\nPara el otorgamiento de los apoyos del Programa será de acuerdo al numeral 9.2 de las presentes\nReglas de Operación y la comisión dictaminadora de la SEDEPIA dará prioridad a las personas y agrupaciones que provengan de municipios indígenas y afromexicanos, que radiquen en sus localidades de origen y que enfoquen sus acciones al beneficio comunitario, así como a la protección y difusión de los valores culturales e identitarios de sus pueblos y comunidades.\n12. Derechos y Obligaciones de las Personas Beneficiadas.\nDerechos:\na). Recibir un trato digno, respetuoso, oportuno, equitativo y de calidad.\nb). Acceder a los apoyos que otorga el Programa, de acuerdo con lo establecido en estas Reglas de Operación y con la disponibilidad presupuestal.\nc). Recibir orientación de la SEDEPIA para la presentación de solicitudes de apoyo e integración de expedientes sin costo alguno.\nd). Tener la garantía de privacidad de sus datos personales.\nObligaciones:\na). Conducirse con la verdad en toda la información solicitada.\nb). Emplear el bien o apoyo recibido para los fines por los que fue otorgado.\nc). Entregar la documentación e información requeridas, de acuerdo a las Reglas de Operación.\nd). Comprometerse a conservar los instrumentos musicales en condiciones\nAFROMEXICANO, Y SE EMITEN SUS REGLAS DE\nOPERACIÓN favorables.\ne). Informar a la SEDEPIA, a través de sus oficinas centrales o delegaciones regionales, cuando musicales y de danza.\n12.1. Causales de Suspensión o Baja de las Personas Beneficiadas.\na). Falta a la verdad en toda la información proporcionada.\nb). No emplear el bien o apoyo recibido para los fines por los que fue otorgado.\nc). No entregar la documentación e información requeridas, de acuerdo a las Reglas de Operación.\nd). No conservar los instrumentos musicales en condiciones favorables.\ne). No informar a la SEDEPIA, a través de sus oficinas centrales o delegaciones regionales, cuando se presente algún suceso que evite la correcta aplicación de los apoyos otorgados a las agrupaciones musicales y de danza.\n12.2. Proceso de Baja.\nEl proceso de baja será realizado por la Dirección de Promoción y Difusión Cultural cuando se falsee información o cuando los apoyos sean utilizados con fines partidistas.\n13. Instancias Participantes.\n• La SEDEPIA será ejecutora del Programa.\n• La SEPLADER la cual autoriza los recursos que fueron aprobados en el Decreto\nNúmero 680 relativo al Presupuesto de Egresos del Estado de Guerrero para el Ejercicio\nFiscal 2024.\n• La SEFINA la cual realiza la liberación del recurso correspondiente, de acuerdo al cronograma financiero. l• La SCyTG para realizar las recomendaciones y sanciones pertinentes.\n13.1. Instancia Normativa.\nLa instancia administrativa y/o normativa es la SEDEPIA, así como lo señala en el reglamento interno de la institución. Esto con el objeto de armonizar el correcto desempeño y aplicación de los recursos asignados por el estado para los fines del Programa.\n14. Transparencia.\n14.1. Promoción y Difusión del Programa Social. del Decreto Número 203 del Presupuesto de Egresos del Estado de Guerrero, para el Ejercicio Fiscal 2025,\nAFROMEXICANO, Y SE EMITEN SUS REGLAS DE\nOPERACIÓN será en Avenida de la Juventud número 5, colonia El Centenario, C.P. 39090, Chilpancingo de los Bravo, Guerrero, México y Delegaciones Regionales, así como en las páginas electrónicas: https://www.guerrero.gob.mx/dependencia/sector-central/secretaria-para-el-desarrollo-de-lospueblos-imdigenas-y-afromexicanos/ y en la página de red social Facebook de la SEDEPIA.\n(REFORMADO, P.O 23 ALCANCE IX, 21 DE MARZO 2025)\nAsimismo, a través de las delegaciones regionales ubicadas en las ciudades de Tlapa de\nComonfort, Chilapa y Ometepec, se difundirá la información relativa al Programa, incluyendo a las autoridades municipales y comunitarias de los municipios indígenas y afromexicanos. La papelería, documentación oficial y difusión del Programa, deberá incluir la leyenda de Blindaje Electoral descrita en el apartado 14.5 de las presentes Reglas de Operación.\n14.2. Contraloría Social.\nCon la finalidad de incrementar la participación ciudadana, se crearán Comités de Contraloría\nSocial, como un órgano ciudadano de control, vigilancia y evaluación de las actividades del Programa, conformados por la población beneficiada, los sectores sociales, y las personas representantes de la localidad, quienes de manera específica supervisarán la gestión gubernamental, y que el manejo de los recursos públicos se realicen en términos de transparencia, eficacia, legalidad y honradez; los objetivos específicos de este Órgano de Contraloría Social, son:\n• Hacer más transparentes las decisiones y la ejecución de los recursos.\n• Incrementar la participación ciudadana.\n• Fomentar la organización social.\n• Inhibir los actos de corrupción y de captación social, política y electoral.\n• Incrementar la eficiencia de los recursos públicos.\n• Fortalecer la cultura de la legalidad.\n• Mejorar la rendición de cuentas.\n• Perfeccionar la democracia e incorporar la evaluación ciudadana.\nLas funciones de los Comités de Contraloría Social son:\na). Integración: se conforman con la representación de la comunidad beneficiada por el Programa, y fungirán como interlocutores con la SEDEPIA, en el ejercicio de la contraloría social. La persona designada como vocal será, la responsable de hacer llegar las quejas o denuncias recibidas a la SEDEPIA, quien dará respuesta en un plazo no mayor de 15 días a partir de la fecha de recepción de la queja o denuncia.\nb). Capacitación y asesoría: para impulsar la realización de las actividades de Contraloría Social\nPrograma, para que estos realicen adecuadamente sus actividades de seguimiento y vigilancia.\nAFROMEXICANO, Y SE EMITEN SUS REGLAS DE\nOPERACIÓN\nc). Seguimiento: se deberá integrar un programa de trabajo a través del cual se debe incluir la descripción de las actividades, responsables, metas y calendarización de las actividades para su cumplimiento.\nLa persona titular de la Dirección General o el personal que designe la SEDEPIA, serán las personas encargadas de conformar los Comités de Contraloría Social, asimismo darán acompañamiento durante las actividades de control, seguimiento y vigilancia.\nEl Comité de Contraloría Social debe estar constituido por una o un presidente, una o un secretario y una Vocalía mínimamente, electos de entre la población beneficiada en donde se va a realizar la entrega del Programa, y tendrá que ser vigilado por un solo Comité, el cual deberá controlar, vigilar y dar seguimiento al Programa a través de los formatos que integran el expediente comunitario.\nSe establecerán acciones de control, vigilancia y evaluación bajo un esquema de derechos y compromisos ciudadanos, con el propósito de contribuir a que la gestión gubernamental se realice en términos de transparencia, eficacia y honradez. Estas actividades estarán a cargo de las personas integrantes de la comunidad, incluidas las personas integrantes del comité y las personas beneficiarias del\nPrograma.\nLa instancia operadora promoverá la contraloría social con base en la normatividad establecida para tal efecto, fomentando acciones que transparenten la operación del Programa.\nLas acciones para fomentar serán las siguientes:\n• Informar a la ciudadanía acerca de los apoyos otorgados y su costo a nivel de obra, acción, nombre de la persona beneficiaria, derechos y obligaciones de los mismos.\n• Capacitar a las personas beneficiarias para que se constituyan en instancias de vigilancia y evaluación social.\n• Establecer espacios de comunicación (reuniones vecinales, atención directa a beneficiarias y beneficiarios, etc.).\n14.3. Protección de Datos Personales. de Guerrero y la Ley Número 466 de Protección de Datos Personales en Posesión de Sujetos Obligados del Estado de Guerrero, los datos e información recabada quedan protegidos para los fines del Programa que estas Reglas de Operación detallan.\nEn todo momento la persona beneficiaria podrá ejercer los derechos de alta, acceso, rectificación, cancelación y oposición de datos personales robados.\nLos datos personales recabados serán utilizados con la finalidad siguiente: validar que se cumplan los requisitos de elegibilidad para ser persona beneficiaria de este Programa; que serán integrados de\nAFROMEXICANO, Y SE EMITEN SUS REGLAS DE\nOPERACIÓN acuerdo a las facultades propias, compactibles análogos para la realización de compulsas para la integración del padrón único de personas beneficiarias.\nPor lo tanto, se garantiza la protección de los datos personales que sean recabados y en cumplimiento con las disposiciones en materia de transparencia y acceso a la información pública aplicable.\n14.4. Quejas y Denuncias.\nLas quejas, denuncias, peticiones y sugerencias relativas a este Programa, se realizarán de manera escrita, por comparecencia de la persona interesada, por correo electrónico o vía telefónica, y para aquellas que sean escritas se depositarán en los buzones instalados en las oficinas centrales de la\nSEDEPIA, ubicadas en Avenida de la Juventud número 5, colonia el Centenario, C.P. 39090, Chilpancingo de los Bravo, Guerrero, así como en las delegaciones regionales, situadas en las ciudades de Tlapa de\nComonfort, Chilapa de Álvarez y Ometepec.\nLa persona denunciante deberá proporcionar los siguientes datos: Nombre de la servidora o servidor público, departamento de adscripción, objeto de la denuncia, nombre y domicilio de la persona quejosa e identificación oficial.\nLas quejas, denuncias, peticiones y sugerencias relativas a este Programa, se atenderán a través de la Unidad de Transparencia y Acceso a la Información Pública, la cual dará seguimiento y respuesta en un término máximo de 20 días hábiles.\nEn caso de que la SEDEPIA no resuelva la queja de las personas solicitantes o beneficiarias, éstas podrán presentarla ante la Contraloría Social de la SCyTG.\n14.5. Acciones de Blindaje.\nLa operación y ejecución de los recursos estatales destinados al Programa, deberán observar y atender las medidas que emita la SCyTG, para coadyuvar a que éstos no sean utilizados con fines políticos, por lo que la papelería y documentación oficial, así como la publicidad y promoción del Programa deberá de incluir la leyenda siguiente: “Este Programa es público, ajeno a cualquier partido político. Queda prohibido el uso para fines distintos a los establecidos en el Programa”. Quien haga uso indebido y ante la autoridad competente.\n14.6. Acta de Donación. (Anexo-2) existencia de la acción y es responsabilidad de la SEDEPIA, su resguardo. Quien detecte alguna irregularidad en la acción, podrá firmar el acta de manera condicionada y anotar en ella las razones de dicha inconformidad. Además, se indicará los plazos acordados para solventar las observaciones a que dé lugar. Se anexa formato. (REFORMADO, P.O 23 ALCANCE IX, 21 DE MARZO 2025)\nAFROMEXICANO, Y SE EMITEN SUS REGLAS DE\nOPERACIÓN\n15. Perspectiva de Género.\nLa operación del Programa y su implementación se establece con perspectiva de género, respeto y garantía al ejercicio de los derechos de las mujeres indígenas y afromexicanas, busca mostrar que las diferencias entre mujeres y hombres se dan no sólo por su determinación biológica, sino también por las diferencias culturales asignadas a los seres humanos por lo que la SEDEPIA pondrá especial atención a mujeres para fortalecer sus capacidades y ampliar sus oportunidades y así potenciar la agencia económica en favor de mayores oportunidades para su bienestar y desarrollo.\n16. Enfoque de Derechos.\nLas personas que fungen como servidoras o servidores públicos y participen en la operación del\nPrograma deberán promover, respetar, proteger y garantizar el ejercicio efectivo de los derechos humanos de las personas beneficiarias, de conformidad con los principios de universalidad, interdependencia, indivisibilidad y progresividad. En particular, se fomentará la eficacia y respeto irrestricto a los derechos colectivos de los pueblos indígenas y afromexicanos, reconocidos en la Constitución Política de los Estados\nUnidos Mexicanos e instrumentos internacionales. Con el objetivo de generar las condiciones necesarias para el acceso igualitario, en términos de disponibilidad, accesibilidad y calidad en las acciones que realiza este Programa, se implementarán mecanismos que hagan efectivo el acceso a la información gubernamental y se asegurará que el acceso a los apoyos y servicios se dé únicamente con base en lo establecido en estas Reglas de Operación, sin discriminación o distinción alguna.\n17. Acciones Contra el SARS-COV 2.\nDebido a la contingencia sanitaria originada por el COVID19, se tomarán en consideración las medidas recomendadas por la Secretaría de Salud Federal, como son: la sana distancia, el uso obligatorio de cubre bocas y la aplicación de gel antibacterial al momento de la entrega del apoyo, así como las recomendaciones que se emitan para la veda electoral.\n18. Anexos que reflejen la entrega del apoyo (Económico, Especie o Servicios).\nAnexo 1. MIR (REFORMADO, P.O 23 ALCANCE IX, 21 DE MARZO 2025)\nAnexo 2. Acta de Donación. (REFORMADO, P.O 23 ALCANCE IX, 21 DE MARZO 2025)\nAnexo 3. Apoyo de pasaje. (ADICIONADO, P.O 23 ALCANCE IX, 21 DE MARZO 2025)\nAFROMEXICANO, Y SE EMITEN SUS REGLAS DE\nOPERACIÓN\nAnexo 1. MIR.\nAFROMEXICANO, Y SE EMITEN SUS REGLAS DE\nOPERACIÓN\nAnexo 2. Acta de Donación.\nAFROMEXICANO, Y SE EMITEN SUS REGLAS DE\nOPERACIÓN\nAnexo 3. Apoyo de pasaje.\nINDÍGENAS Y AFROMEXICANOS\nPROGRAMA: FORTALECIMIENTO, PRESERVACIÓN Y DIFUSIÓN DE LA\nCULTURA DE LOS PUEBLOS INDÍGENAS Y AFROMEXICANO.\nACTIVIDAD:\nFolio:\nBUENO POR LA CANTIDAD DE: $\nPOR CONCEPTO DE: APOYO PARA PASAJE\nRECIBI\n(nombre y firma o huella)\nChilpancingo, Guerrero a de de 2025.\nVo. Bo. Autorizó\nDELEGADO ADMINISTRATIVO SECRETARIO\n\"Este programa es de carácter público, no es patrocinado ni promovido por partido político alguno y sus recursos provienen de los impuestos que pagan todos los contribuyentes. Está prohibido el uso de este programa con fines políticos, electorales, de lucro y otros distintos a los establecidos. competente\"\nAFROMEXICANO, Y SE EMITEN SUS REGLAS DE\nOPERACIÓN\nPrimero. El presente Acuerdo entrará en vigor al día siguiente de su publicación en el\nSegundo. Se abroga el Acuerdo por el que se crea el Programa Fortalecimiento de\nCulturas de los Pueblos Indígenas y Afromexicano y se emiten sus Reglas de Operación para el\nEjercicio Fiscal 2023; publicado en Periódico Oficial del Gobierno del Estado Edición No. 33, Alcance II de fecha 25 de abril del 2023.\nTercero. A partir de la entrada en vigor del presente Acuerdo, las Reglas de Operación del Programa Fortalecimiento, Preservación y Difusión de la Cultura de los Pueblos Indígenas y\nAfromexicano, subsecuente o sus modificaciones serán emitidas por la persona titular de la\nSecretaría para el Desarrollo de las Comunidades y Pueblos Indígenas y Afromexicanos, responsable directa de la operación y ejecución de las mismas.\nDado en el “Recinto de las Oficinas del Poder Ejecutivo del Estado”, el inmueble ubicado en Boulevard René Juárez Cisneros, número 62, Edificio Centro Planta Baja, Código Postal 39074, Colonia Ciudad de los Servicios, en la Ciudad de Chilpancingo de los Bravo, capital del estado de\nGuerrero, a los veintidós días del mes de marzo del año dos mil veinticuatro.\nLA GOBERNADORA CONSTITUCIONAL DEL ESTADO DE GUERRERO.\nMTRA. EVELYN CECIA SALGADO PINEDA.\nRúbrica.\nLA ENCARGADA DE DESPACHO DE LA SECRETARÍA GENERAL DE GOBIERNO.\nDRA. ANACLETA LÓPEZ VEGA.\nRúbrica.\nY AFROMEXICANOS.\nLIC. ABEL BRUNO ARRIAGA.\nRúbrica.\nN. DE E. A CONTINUACIÓN, SE TRANSCRIBEN LOS ARTÍCULOS TRANSITORIOS DE LOS\nACUERDO DE MODIFICACIÓN A LAS PRESENTES REGLAS DE OPERACIÓN.\nFORTALECIMIENTO, PRESERVACIÓN Y DIFUSIÓN DE LA CULTURA DE LOS PUEBLOS INDÍGENAS\nY AFROMEXICANO, Y SE EMITEN SUS REGLAS DE OPERACIÓN.\nAFROMEXICANO, Y SE EMITEN SUS REGLAS DE\nOPERACIÓN\nPrimero. El presente Acuerdo de Modificación entrará en vigor al día siguiente de su Publicación\nSegundo. Se derogan todas las disposiciones que se opongan al presente Acuerdo de\nModificación.\nDado en Avenida de la Juventud, número 5, colonia El Centenario, C.P. 39090, en la ciudad de\nChilpancingo de los Bravo, capital del estado de Guerrero, a los veinticinco días del mes de febrero del año dos mil veinticinco.\nAFROMEXICANOS.\nMTRO. ABEL BRUNO ARRIAGA.\nRúbrica.",
  "ordenamiento": "PROGRAMA",
  "jurisdiccion": "GUERRERO",
  "fuente_oficial": "DIARIO OFICIAL DE LA FEDERACION",
  "Fecha de Publicación": "21 DE MARZO DE 2025",
  "ULTIMA REFORMA PUBLICADA": null,
  "status": "VIGENTE",
  "es_escaneado": false,
  "tiene_tablas": true,
  "materia": [
    "cultura"
  ]
}