{
  "titulo": "Acuerdo por el Que Se Crea el Programa Defensa y Asesoría Jurídica A Pueblos Indígenas y Afromexican",
  "Contenido": "REGLAS DE OPERACIÓN PARA EL EJERCICIO FISCAL\nABROGADO POR CONCLUIDA SU VIGENCIA TÁCITAMENTE EL 31 DE DICIEMBRE 2020.\nTEXTO ORIGINAL.\nSeptiembre de 2020.\nACUERDO POR EL QUE SE CREA EL PROGRAMA DEFENSA Y ASESORÍA JURÍDICA A PUEBLOS\nINDÍGENAS Y AFROMEXICANO, Y SE EMITEN SUS REGLAS DE OPERACIÓN PARA EL EJERCICIO\nFISCAL 2020.\nPoder Ejecutivo.\nLICENCIADO HÉCTOR ANTONIO ASTUDILLO FLORES, GOBERNADOR CONSTITUCIONAL DEL\nESTADO DE GUERRERO, CON FUNDAMENTO EN LO DISPUESTO POR LOS ARTÍCULOS 71, 87, 88,\nCONFIEREN LOS ARTÍCULOS 2, 3, 6, 7, 10, 11, 18 APARTADO A FRACCIONES I Y XIV, 20 FRACCIÓN\nIII Y 32 DE LA LEY ORGÁNICA DE LA ADMINISTRACIÓN PÚBLICA DEL ESTADO DE GUERRERO\nNÚMERO 08; 1, 2 FRACCIÓN I, 18 Y 25 DE LA LEY NÚMERO 454 DE PRESUPUESTO Y DISCIPLINA\nFISCAL DEL ESTADO DE GUERRERO; EN RELACIÓN CON EL ARTÍCULO 55 Y ANEXOS 21 Y 21-A\nDEL DECRETO NÚMERO 447 DEL PRESUPUESTO DE EGRESOS DEL ESTADO DE GUERRERO\nPARA EL EJERCICIO FISCAL 2020 Y LOS LINEAMIENTOS PARA LA ELABORACIÓN DE LAS\nREGLAS DE OPERACIÓN DE LOS PROGRAMAS SOCIALES ESTATALES PARA EL EJERCICIO\nFISCAL 2017.\nQue el Plan Estatal de Desarrollo 2016-2021, establece en su Estrategia Transversal 4: Atender a los pueblos originarios y afromexicanos; Estrategia 6.4.1. \"Generar oportunidades para los pueblos originarios y afromexicanos que permitan su desarrollo económico, político y social, respetando las manifestaciones de su cultura y el ejercicio de sus derechos\"; dentro de las Líneas de acción \"Fortalecer y ampliar el marco jurídico en materia de derechos de los pueblos originarios y afromexicanos, así como el reconocimiento y la protección de su patrimonio y su riqueza cultural\".\nEl artículo 2o de la Constitución Política de los Estados Unidos Mexicanos, reconoce y garantiza los derechos de los pueblos indígenas y afromexicanos. como derechos de los pueblos indígenas y afromexicanos, acceder plenamente a la jurisdicción del Estado, tomando en consideración sus usos, costumbres y demás especificidades culturales, bajo la asistencia de traductores, intérpretes y defensores calificados para tales efectos.\nREGLAS DE OPERACIÓN PARA EL EJERCICIO FISCAL\nEn observancia de dicho precepto Constitucional, a través del Programa Defensa y Asesoría vigencia de los derechos de la población indígena y afromexicana, así como su acceso pleno a una administración y procuración de justicia pronta y expedita, mediante la promoción de los derechos, el acompañamiento de procesos legales de personas, organizaciones y comunidades, así como trámites ante el Registro Civil.\nAl respecto, el Programa contempla la capacitación para la formación y certificación de intérpretes traductores y traductoras en las lenguas náhuatl, mixteca, tlapaneca y amuzga. Asimismo, llevar a cabo procesos de capacitación y sensibilización para la prevención y erradicación de la violencia contra las mujeres indígenas y afromexicanas; por lo que la Secretaría de Asuntos Indígenas y Afromexicanos, tendrá a cargo la implementación, operacion, ejecución, evaluación y administración del Programa Defensa y\nAsesoría Jurídica a Pueblos Indígenas y Afromexicano.\nEn la abrogada Ley Orgánica de la Administración Pública del Estado de Guerrero Número 433, publicada en el Periódico Oficial del Gobierno del Estado el 12 de octubre de 1999, se creó la Secretaría de Asuntos Indígenas, con el propósito de proteger y preservar los derechos y cultura de las comunidades indígenas, así como para dar seguimiento a la aplicación y operación de los programas y acciones de las dependencias federales, estatales y municipales, dirigidos a promover el desarrollo integral de los indígenas, correspondiéndole el despacho entre otros asuntos, el de promover el respeto de los derechos, lengua y cultura de las comunidades indígenas.\nCon la reforma a la Ley Orgánica de la Administración Pública del Estado de Guerrero Número\n08, publicada en el Periódico Oficial del Gobierno del Estado el 28 de agosto de 2018, establece que la\nSecretaría de Asuntos Indígenas y Afromexicanos, es la encargada de establecer y conducir las acciones encaminadas a preservar los derechos y cultura de los pueblos y comunidades indígenas y afromexicanas, promoviendo su desarrollo y fomentando el respeto a los derechos humanos, particularmente los de las mujeres, así como de dar seguimiento a la aplicación y operación de los programas y acciones de las dependencias federales, esta tales y municipales, dirigidos a promover su desarrollo integral.\nLos titulares de las secretarías, dependencias y entidades de la administración pública estatal, así como, los servidores públicos autorizados para ejercer recursos públicos del presupuesto de inversión de las mismas, serán responsables de los programas y proyectos de.i nve r s i ón que realicen, y que además deberán administrar los recursos públicos que estén bajo su responsabilidad, sujetándose a los principios de disciplina, legalidad, objetividad, profesionalismo, honradez, lealtad, imparcialidad, integridad, rendición de cuentas, transparencia, eficacia y eficiencia que rigen el servicio público, tal como lo menciona el artículo\n7 de la Ley Número 4 65 de Responsabilidades Administrativas para el Estado de Guerrero.\nLos apoyos otorgados deberán sujetarse a criterios de objetividad, equidad, transparencia, publicidad, selectividad y temporalidad.\nEl Decreto Número 447 del Presupuesto de Egresos del Estado de Guerrero para el Ejercicio\nFiscal 2020, señala que se ejercerán los recursos bajo una política de gasto público, que permita dar cumplimiento a lo que globalmente prevén los ejes rectores del Plan Estatal de Desarrollo 2016-2021.\nREGLAS DE OPERACIÓN PARA EL EJERCICIO FISCAL\nAsí mismo en el artículo 55 del Decreto Número 447 antes citado, establece que con el objeto de asegurar la aplicación eficiente, eficaz, oportuna equitativa y transparente de los recursos públicos, la disposiciones a que deberán sujetarse los programas de inversión sujetos a Reglas de Operación.\nCon sustento en lo anterior, la Secretaría de Planeación y Desarrollo Regional, expidió los\nLineamientos para la Elaboración de las Reglas de Operación de los Programas Sociales Estatales para el ejercicio fiscal 2017, publicados en el Periódico Oficial del Gobierno del Estado de Guerrero No. O 6\nAlcance II, de fecha 20 de enero de 2017.\nPor lo anteriormente expuesto y con fundamento en las he tenido a bien expedir disposiciones legales antes citadas, el siguiente:\nACUERDO POR EL QUE SE CREA EL PROGRAMA DEFENSA Y ASESORÍA JURÍDICA A PUEBLOS\nINDÍGENAS Y AFROMEXICANO, Y SE EMITEN SUS REGLAS DE OPERACIÓN PARA EL EJERCICIO\nFISCAL 2020.\nArtículo 1. Se crea el Programa Defensa y Asesoría Jurídica a Pueblos Indígenas y Afromexicano, el cual tiene por objeto impulsar los derechos y el acceso a la justicia de los pueblos indígenas y afromexicano, a través de la prestación de servicios jurídicos, la prevención de la violencia contra las mujeres y el fortalecimiento de capacidades de la población indígena y afromexicana, que permita el ejercicio de sus derechos humanos.\nArtículo 2. Se emiten las Reglas de Operación del Programa Defensa y Asesoría Jurídica a\nPueblos Indígenas y Afromexicano para el Ejercicio Fiscal 2020, en las que se establecen los principios de eficiencia, eficacia, oportunidad, equitativa y transparencia de los recursos públicos y requisitos que se deben de cumplir para poder acceder a dicho Programa.\nEn las Reglas de Operación del Programa Defensa y Asesoría Jurídica a Pueblos Indígenas y\nAfromexicano, se establecerán las disposiciones que instituyen la ejecución del Programa, con el objeto de otorgar transparencia y asegurar la aplicación eficiente, eficaz, oportuna y equitativa de los recursos de Guerrero.\nArtículo 3. La Secretaría de Asuntos Indígenas y Afromexicanos, tendrá a cargo la implementación, ejecución, evaluación y administración del Programa Defensa y Asesoría Jurídica a\nPueblos Indígenas y Afromexicano, bajo los criterios de objetividad, equidad, transparencia, publicidad, selectividad y temporalidad, con estricto apego a la normatividad aplicable, por lo tanto, será la encargada de la dispersión y asignación de los recursos del Programa, apegándose plenamente a las Reglas de\nOperación siguientes:\nREGLAS DE OPERACIÓN PARA EL EJERCICIO FISCAL\nINDÍGENAS Y AFROMEXICANO PARA EL EJERCICIO FISCAL 2020.\n1. Introducción\nCon el Programa Defensa y Asesoría Jurídica a Pueblos Indígenas y Afromexicano, el Gobierno del Estado impulsa el pleno reconocimiento y vigencia de los derechos de la población indígena y afromexicana, así como su acceso pleno a una administración y procuración de justicia pronta y expedita, mediante la promoción de los derechos, el acompañamiento de procesos legales de personas, organizaciones y comunidades, así como trámites ante el Registro Civil, tal como lo establece el Plan Esta tal de Desarrollo 2 O 16-2 021, en su Estrategia Transversal 6. 4. l. \"Atender a los pueblos originarios y\nAfromexicano\".\nLa ejecución del Programa permite también dar cumplimiento al artículo 11 de la Constitución pueblos indígenas y afromexicano a la jurisdicción del Estado, tomando en consideración sus usos, costumbres y demás especificidades culturales, bajo la asistencia de traductores, intérpretes y defensores calificados para tales efectos. Al respecto, el Programa contempla la capacitación para la formación y certificación de intérpretes traductores y traductoras en las lenguas náhuatl, mixteca, tlapaneca y amuzga.\nAsimismo, se llevan a cabo procesos de capacitación y sensibilización para la prevencion y erradicación de la violencia contra las mujeres indígenas y afromexicanas.\nA través de todas las acciones integradas en el Programa, se busca impulsar los derechos y el acceso a la justicia de los pueblos indígenas y afromexicano, mediante la prestación de servicios jurídicos, la prevención de la violencia contra las mujeres y el fortalecimiento de capacidades de la población indígena y afromexicanas, que permita el ejercicio de sus derechos humanos. De esta manera, las metas se enfocan a brindar servicios de asesorías jurídicas y representación legal; traducciones en las cuatro lenguas indígenas, ante los órganos de procuración, administración e impartición de justicia, y otras instituciones de los tres niveles de gobierno; visitas a los Centros de Readaptación Social (CERESO) del Estado, para realizar un diagnóstico de la situación jurídica de las y los internos indígenas y afromexicanos; realización de trámites administrativos ante la Coordinación Técnica del Sistema Estatal del Registro Civil; ejecución de la Estrategia para Prevenir la Violencia contra las Mujeres Indígenas y Afromexicanas; y, la formación y certificación de intérpretes traductores en lenguas indígenas. y Afromexicanos, a través de la Dirección General de Defensa y Asesoría Jurídica. El presupuesto es de\n$3,000,000.00 (tres millones de pesos 00/100 M.N.), recursos provenientes de Inversión Estatal Directa\n2020.\n1.1. Antecedentes\nGuerrero es un Estado pluricultural, en el que se asientan cuatro pueblos indígenas y el afromexicano. Los pueblos y las comunidades que dan origen y sustento a esta diversidad tienen como\nREGLAS DE OPERACIÓN PARA EL EJERCICIO FISCAL rasgos comunes el uso de lenguas originarias, sentido de pertenencia a una colectividad, así como culturas y sistemas sociales propios, mediante los cuales organizan su vida y toman decisiones. afromexicano, continúa siendo una asignatura pendiente para el Estado mexicano; el cumplimiento de la norma constitucional y los tratados internacionales obligan a respetar y consolidar dicho reconocimiento, lo que implica también hacer efectivos sus derechos culturales y derechos sociales a la alimentación, la salud, la educación, la vivienda, el trabajo, el acceso pleno a la jurisdicción del Estado y al desarrollo pleno de sus capacidades.\nEn el caso particular del Estado de Guerrero, los pueblos indígenas han exigido el reconocimiento de sus derechos colectivos que posibiliten su permanencia y reproducción social, económica y cultural. En respuesta a estas demandas, en los últimos años se han registrado avances importantes en materia de derechos indígenas; así, en febrero de 2011 el Congreso del Estado expide y decreta la Ley Número 701 de Reconocimiento, Derechos y Cultura de los Pueblos y Comunidades Indígenas del Estado de Guerrero reformándose los artículos 8 al 14, en los que se eleva a rango constitucional el reconocimiento de los derechos de los pueblos indígenas, y se incluye el reconocimiento y respeto constitucional del pueblo afromexicano, bajo los mismos términos y beneficios que los pueblos indígenas.\nNo obstante, estos adelantos, aún existen limitaciones jurídicas que generan lagunas legales, propiciando, así, la persistencia de discriminación y exclusión; en consecuencia, los pueblos indígenas y afromexicano continúan enfrentando serias dificultades para acceder a la jurisdicción del Estado. En este sentido, la Secretaría de Asuntos Indígenas y Afromexicanos (SAIA) implementa el Programa Defensa y\nAsesoría Jurídica a Pueblos Indígenas y Afromexicano, el cual se ejecuta desde el año 2001 y el cual busca contribuir al cumplimiento de los derechos de estos pueblos, a través de la prestación de di versos servicios jurídicos y la promoción de sus derechos individuales y colectivos.\n1.2. Alineación programática\nEn cumplimiento a los objetivos de las políticas públicas del Gobierno del Estado y a las acciones específicas para alcanzarlos, el Programa Defensa y Asesoría Jurídica a Pueblos Indígenas y\nAfromexicano se encuentra alineado al Plan Estatal de Desarrollo 2016-2021, específicamente a la\nEstrategia Transversal 4: Atender a los pueblos originarios y Afromexicano; Objetivo: Promover el pueblos indígenas y afromexicanos; Estrategia 6.4.1. \"Generar oportunidades para los pueblos originarios y afromexicano que permita su desarrollo económico, político y social, respetando las manifestaciones de su cultura y el ejercicio de sus derechos\"; Línea de accion \"Fortalecer y ampliar el marco jurídico en materia de derechos de los pueblos originarios y afromexicanos, así como el reconocimiento y la protección de su patrimonio y su riqueza cultural\".\n1.3. Diagnóstico\nREGLAS DE OPERACIÓN PARA EL EJERCICIO FISCAL\nEl Estado de Guerrero posee un carácter mul ticul tural, expresado por los diferentes grupos étnicos que se asientan en su territorio, principalmente por los pueblos indígenas Nahua, Na savi (mixteco), Me'pha (tlapaneco) y Nn'anncue Ñomdaa (amuzgo), y el pueblo afromexicano; estos pueblos y sus comunidades constituyen el cimiento de la identidad y la raíz histórica del Estado, contribuyendo con sus saberes ancestrales, cosmovisiones, organización social y expresiones lingüísticas y artísticas a la riqueza cultural de Guerrero.\nDe acuerdo a la información sociodemográfica del año 20151, en Guerrero se registraron las siguientes cifras básicas:\nPOBLACIÓN TOTAL Y POBLACIÓN INDÍGENA Y\nAFROMEXICANA\nGUERRERO 2015\nTotal de población de Guerrero: 3’533,251\nMujeres: 1´834,192\nHombres: 1´699,059\nTotal Población hablante de lengua indígena: 509,110\nTotal, Población que se autoreconoce\nIndígena: 1´198,362\nTotal Población que se autoreconoce\nAfromexicana: 275,341\nNo obstante, la relevancia demográfica, histórica, cultural y social que conjugan los cuatro pueblos indígenas y el afromexicano, cuya población en conjunto representa el 40% de las y los guerrerenses, continúan enfrentando serios problemas estructurales que los sitúan en condiciones de desventaja y desigualdad social y jurídica con respecto al resto de la sociedad.\nCabe señalar que los rezagos de estos pueblos suelen ser más profundos en los municipios con preponderancia indígena o afromexicana, principalmente aquellos más apartados, ubicados en las regiones\nMontaña y Costa Chica; las brechas de desarrollo social y económico existentes en estos municipios con respecto a los no indígenas, son determinantes para que siga existiendo una marcada desigualdad social y un desarrollo muy heterogéneo en las siete regiones del Estado. vulnerabilidad, como son niños, niñas y personas de la tercera edad y, primordialmente, las mujeres indígenas y afromexicanas de todas las edades, quienes desde su nacimiento padecen más agudamente discriminación, pobreza y violencia física, psicológica, sexual y económica, tanto en el ámbito de las instituciones públicas, como en el familiar y comunitario, a través de prácticas culturales que estimulan la dignas de vida.\n1 Encuesta Intercensal, INEGI\nREGLAS DE OPERACIÓN PARA EL EJERCICIO FISCAL\nAsí, por ejemplo, la Encuesta de Salud y Derechos de las Mujeres Indígenas (ENSADEMI 2008), aplicada a un total de 3,972 mujeres indígenas, con el objeto de conocer sus experiencias de violencia en las diferentes etapas del ciclo de vida, reporta que el 34% de las mujeres aceptaron haber padecido durante su infancia más de una vez algún tipo de mal trato, en especial humillación y golpes, siendo el padre el agresor principal (48%), seguido de la madre (45%). Situación más grave enfrentó el 7% de las encuestadas, ya que sufrió alguna forma de abuso sexual durante la infancia, recayendo la culpa en personas de su familia en el 53% de los casos (ENSADEMI, 2008, p. 73)2. En cuanto a la violencia infligida por la pareja, el 25% de las mujeres reportaron haberla sufrido. La encuesta identificó también diferentes tipos de violencia3 en las proporciones siguientes4:\nInstituto Nacional de Salud Pública - Comisión Nacional para el Desarrollo de los Pueblos Indígenas. Encuesta de salud y derechos de las mujeres indígenas 2008,\n2020)\nLa ENSADEMI 2008 conceptualiza la violencia, como conductas coercitivas que pueden incluir: a) violencia física: empujones, golpes, heridas de arma de fuego o de objeto punzocortante; b) violencia emocional: intimidación, humillaciones verbales, amenazas; c) violencia sexual: forzar física o emocionalmente a la mujer a la relación sexual; d) violencia económica: ejercicio de control a través del dinero (/bid., p. 15). En lo que respecta a la negligencia, se identifica como la falta de proveer las necesidades básicas de un niño o niña por parte de su padre y madre o personas encargadas.\n4 Ibidem. P. 78-79\nREGLAS DE OPERACIÓN PARA EL EJERCICIO FISCAL afromexicanas constituye un severo obstáculo para alcanzar el desarrollo y la dignidad de las personas, de los pueblos y comunidades, además de ser un grave problema que atenta contra sus derechos humanos, su libertad y desarrollo. En este contexto, resulta inaplazable el diseño y ejecución de programas y acciones que contribuyan a abatir los altos índices de violencia contra las mujeres, y acompañen los procesos de las comunidades y organizaciones sociales que pugnan por la eliminación de toda acción o conducta violenta.\nPor otra parte, a pesar que el origen de la difícil situación de los pueblos indígenas y afromexicano es multifactorial, se puede aseverar que la causa más representativa se encuentra en el desconocimiento de sus derechos, el incumplimiento de los mismos y la deficiencia de los procedimientos y recursos que garanticen su acatamiento. A lo anterior debe considerarse también las barreras que enfrenta la población indígena y afromexicana para acceder a los bienes y servicios gubernamentales y a las instancias de procuración y administración de justicia; aunque son de diversa índole los motivos de esta exclusión social, es posible afirmar que los factores lingüísticos y culturales influyen de manera importante en este hecho, por lo que es imperativo adecuar los programas y servicios a los contextos culturales de este sector de la población, y disponer de personas calificadas que funjan como intérpretes-traductoras y defensoras de oficio que acompañen y asesoren a la población indígena sujeta a proceso, bajos los enfoques de interculturalidad e igualdad de género.\nEs importante señalar también que una buena parte de la población indígena que enfrenta asuntos de carácter penal, no cuenta con recursos económicos para solventar los honorarios de una asesoría y representación legal de carácter particular, por lo que tiene que recurrir a la abogacía de oficio, en cuyo ámbito existe demasiado trabajo y sus integrantes generalmente no son hablantes de lengua indígena, además de carecer de una formación y certificación que los califica para prestar sus servicios en contextos multiculturales, en perjuicio de las personas que poseen culturas, idiomas e identidades distintas a la población mayoritaria y mestiza. No obstante estas deficiencias, cada vez son más las personas indígenas que fungen como intérpretes y traductoras, pero enfrentan la falta de pago por sus servicios, lo cual hace necesaria la coordinación de las instancias de procuración, administración e impartición de justicia, así servicios a los pueblos indígenas y afromexicano, para garantizar el acceso a la justicia de todas y todos sus integrantes.\nCon relación al problema señalado en el párrafo anterior, es menester dar cuenta de las personas\nReadaptación Social5 (CERESO) del Estado, las cuales tienen derecho a servicios de asesoría y defensa jurídicas, además de recibir, cuando así sea necesario, el apoyo especializado de traducción:\n5 Secretaría de Asuntos Indígenas y Afromexicanos. Censo de población indígena y afromexicana interna en CERESO del estado 2019 (Información interna, no publicada).\nREGLAS DE OPERACIÓN PARA EL EJERCICIO FISCAL\nNUMERO DE INTERNOS/\nREGION SEXO NUM\nINTERNAS\nACAPULCO 50 HOMBRES 447\nAYUTLA 26 MUJERES 12\nCHILAPA 51\nCHILPANCINGO 55 FILIACIÓN ETNICA NUM\nCOYUCA DE 5 MIXTECA 101\nCATALAN\nIGUALA 34 NAHUA 141\nLA UNION 3 TLAPANECA 116\nOMETEPEC 78 AMUZGA 51\nSAN LUIS 31 AFROMEXICANA 40\nACATLAN\nTAXCO 1 OTRAS 10\nTECPAN 5\nTELOLOAPAN 1 DELITO MAS NUM\nFRECUENTE\nTLAPA 113 HOMICIDIO 249\nZIHUATANEJO 6 SECUESTRO 68\nTOTAL 459 ROBO 12\nVIOLACIÓN 96\nOTROS 34\nLa garantía para acceder a una justicia social y, en consecuencia, reducir las brechas sociales, se encuentra en el cumplimiento de los derechos humanos y de las disposiciones internacionales y constitucionales en la materia, las cuales han sido conquistadas por los movimientos indígenas y afromexicanos en un largo proceso histórico y de lucha.\nEstrechamente ligado a los derechos de acceso a la justica, se ubican aquellos vinculados con la preservación y enriquecimiento de las lenguas, saberes y manifestaciones culturales indígenas y afromexicanas, tal como lo señala el artículo 2° inciso A) fracción IV, B) y C), de la Constitución Política de los Estados Unidos Mexicanos, para la población indígena, así como el artículo 11, fracción V, de la amenazas que se traducen en el debilitamiento de un bagaje cultural tan rico como ancestral, expresado en los saberes, lenguas, identidades y múltiples manifestaciones culturales, cuya merma influye de manera relevante en el resquebrajamiento del tejido social.\nREGLAS DE OPERACIÓN PARA EL EJERCICIO FISCAL\nEn congruencia con este contexto histórico, social, cultural y de derechos, los pueblos indígenas reproducción social, económica y cultural. En respuesta a estas demandas, en los últimos años se han verificado avances importantes en materia de derechos indígenas y afromexicanos; así, en el año 2014 se de incluir los derechos de los pueblos indígenas, así como el reconocimiento constitucional del pueblo afromexicano, bajo los mismos términos y beneficios que aquellos.\nLa Secretaría de Asuntos Indígenas y Afromexicanos, como institución encargada de \"... establecer y conducir las acciones encaminadas a preservar los derechos y cultura de los pueblos y comunidades indígenas y afromexicanas, promoviendo su desarrollo y fomentando el respeto a los derechos humanos, particularmente los de las mujeres... \"6, y asumiendo la responsabilidad de dar cumplimiento a lo dispuesto por el Plan Estatal de Desarrollo 2016-2021, citado en el numeral 1.2. del presente documento, implementa el Programa Defensa y Asesoría Jurídica a Pueblos Indígenas y\nAfromexicano, considerando como población objetivo al total de las personas indígenas y afromexicanas que demanden el ejercicio de sus derechos, principalmente los vinculados al acceso a la justicia y la prevención de la violencia contra las mujeres; de manera específica, la población potencialmente beneficiaria, está representada por cerca de 4,000 personas que podrán acceder a los diferentes servicios que ofrece este Programa, través de:\nMisión\nImpulsar el cumplimiento de los derechos de los pueblos indígenas y afromexicano que propicie su acceso a la jurisdicción del Estado, el fortalecimiento de sus identidades y culturas, así como la reconstrucción del tejido social, con perspectiva intercultural y de género.\nVisión\nSer el programa del Gobierno del Estado que acompañe a los pueblos indígenas y afromexicano en sus procesos de autonomía y libre determinación, realizando acciones conjuntas que fortalezcan sus sistemas normativos, los empodere como sujetos de derecho y detone el desarrollo comunitario.\nPara la interpretación de las presentes Reglas de Operación, se entenderá por:\nPrograma: El Programa Defensa y Asesoría Jurídica a Pueblos Indígenas y Afromexicano.\nReglas de Operación: Las Reglas de Operación del Programa Defensa y Asesoría Jurídica a\nPueblos Indígenas y Afromexicano.\nGuerrero Número 08, Artículo 32.\nREGLAS DE OPERACIÓN PARA EL EJERCICIO FISCAL\nSAIA: La Secretaría de Asuntos Indígenas y Afromexicanos.\n2. Secretaría, dependencia o entidad responsable del programa\nLa ejecución del Programa Defensa y Asesoría Jurídica para Pueblos Indígenas y Afromexicano, está bajo la responsabilidad de la Secretaría de Asuntos Indígenas y Afromexicanos, a través de la\nDirección General de Defensa y Asesoría Jurídica; la ministración de recursos será comprobada por la\nDelegación Administrativa de esta Secretaría. Asimismo, el Programa tiene como fundamento legal para su creación y ejecución, los instrumentos jurídicos siguientes:\na) Constitución Política de los Estados Unidos Mexicanos (artículo 2o).\nc) Ley Orgánica Guerrero Número O 8, agosto de 2018).\nd) Convenio 169 sobre Pueblos Indígenas y Tribales, de la Organización Internacional del Trabajo.\ne) Declaración Universal de las Naciones Unidas sobre los Derechos de los Pueblos Indígenas.\nf) Ley General de los Derechos de las Niñas, Niños y Adolescentes.\ng) Ley General de Derechos Lingüísticos de los Pueblos Indígenas.\nh) Decreto Número 196 por medio del cual la Sexagésima Primera Legislatura al Honorable\n2016-2021.\ni) Programa Especial de Pueblos Indígenas y Afromexicanos 2016-2021.\nj) Decreto Número 447 del Presupuesto de Egresos del Estado de Guerrero para el Ejercicio Fiscal\n2020.\n3. Objetivos y alcances\n3.1. Objetivo general\nImpulsar los derechos y el acceso a la justicia de los pueblos indígenas y afromexicano, a través de la prestación de servicios jurídicos, la prevención de la violencia contra las mujeres y el fortalecimiento de capacidades de la población indígena y afromexicana, que permita el ejercicio de sus derechos humanos.\n3.2. Objetivos específicos\nREGLAS DE OPERACIÓN PARA EL EJERCICIO FISCAL\na) Brindar asesoría, gestoría población indígena y afromexicana procedimientos legales, así como a violencia.\nb) Proporcionar lenguas indígenas en gubernamentales.\nc) Realizar trámites administrativos ante la Coordinación Técnica del Sistema Estatal del Registro\nCivil, para garantizar la identidad y el ejercicio de derechos de la población indígena y afromexicana.\nd) Fortalecer las capacidades de la población indígena y afromexicana, mediante procesos de capacitación y sensibilización, que promuevan el conocimiento y ejercicio de sus derechos, vinculados con las niñas, ninos y adolescentes, así como la no violencia contra las mujeres.\n3.3. Alcances\na) Trascendencia del programa\nCon la ejecución de este Programa de Defensa y Asesoría Jurídica a Pueblos Indígenas y\nAfromexicano, se busca dar cumplimiento a lo dispuesto en el artículo 11 de la Constitución Política del indígenas y afromexicanas vinculadas a procesos legales, tengan acceso a la justicia de manera pronta, expedita, gratuita y adecuada a sus contextos culturales, incluyendo intérpretes traductores en las lenguas náhuatl, mixteca, tlapaneca y amuzga, ante las instancias de procuración y administración de justicia o instituciones de otra índole que así lo soliciten. De igual manera el Programa se orienta a coadyuvar en el cumplimiento de los diversos mandatos de la Ley Número 553 de Acceso de las Mujeres a una Vida Libre fomento de la cultura jurídica y de la legalidad con una sensibilización hacia la violencia de género, y de la norma ti vi dad que proteja a las mujeres de cualquier tipo de violencia, evaluando sus acciones y buscando los cambios estructurales que se requieran.\nAsimismo, se brinda capacitación para la formación y certificación de intérpretes traductores (as) en las cuatro lenguas indígenas; y se realizan acciones de capacitación y sensibilización para la prevención y erradicación de la violencia contra las mujeres indígenas y afromexicanas, todo ello atendiendo al derecho de la carencia a la seguridad social.\nb) Población objetivo\nPoblación indígena y afromexicana que habita en los 81 municipios del Estado.\nc) Población beneficiaria\nPersonas y grupo de personas indígenas y afromexicanas vinculadas a procesos legales, que soliciten asesoría y defensa jurídica, incluyendo traducción de las lenguas náhuatl, mixteca, tlapaneca y amuzga, así como niñas y mujeres víctimas de violencia; personas que necesiten realizar trámites administrativos ante la Coordinación Técnica del Sistema Estatal del Registro Civil.\nREGLAS DE OPERACIÓN PARA EL EJERCICIO FISCAL\nd) Tipos de apoyo\nTIPO DE APOYO CONCEPTO\n✓ Defensoría y asesoría jurídica, y representación legal a personas que enfrentan procesos ante las instancias de procuración y administración de justicia de los fueros común, federal y administrativo.\n✓ Traducción, a través de intérpretestraductores en las lenguas náhuatl, mixteca, tlapaneca y amuzga, ante órganos de procuración, administración e impartición de justicia.\n✓ Visitas a los Centros de Readaptación\nSocial (CERESO) del Estado, para identificar número y situación jurídica de personas indígenas y afromexicanas. l. Servicios de defensa y asesoría jurídica y ✓ Trámites de libertad anticipada de trámites administrativos ante la Coordinación personas sentenciadas por delitos del fuero\nTécnica del Sistema Estatal del Registro Civil. común y federal.\n✓ Gestión para el traslado de personas internas al CERESO más cercano a su lugar de residencia.\n✓ Dotación de materia prima para elaboración de artesanías en favor de personas internas en los CERESO del Estado.\n✓ Trámites administrativos para: expedición de actas de nacimiento, matrimonio y defunción; registro de nacimientos ordinarios o extemporáneos; aclaraciones, rectificaciones y nulidades administrativas; anotaciones marginales; constancias de inexistencia de registro; trámites para la obtención de la Cedula\nÚnica de Registro de Población (CURP).\nII. Capacitación e impulso de los derechos indígenas y afromexicanos.\n✓ Realización de talleres para el impulso de\nII.1. Talleres de capacitación los derechos indígenas y afromexicanos.\nII.2. Estrategia para Prevenir la Violencia contra ✓ Diplomado para la formación y las Mujeres, Adolescentes y Niñas Indígenas y certificación de intérpretes traductores en las\nAfromexicanas. lenguas náhuatl, mixteca, tlapaneca y amuzga.\nREGLAS DE OPERACIÓN PARA EL EJERCICIO FISCAL\n✓ Talleres de capacitación y sensibilización para la prevención de la violencia contra las niñas, adolescentes y mujeres indígenas y afromexicanas.\n✓ Asesoría jurídica y representación legal a mujeres en situación de violencia, así como canalización y acompañamiento ante las instituciones responsables de su tratamiento.\n4. Metas físicas\nLos servicios y acciones estarán sujetos a la disponibilidad presupuestal del Programa, y son los siguientes:\na) Defensa, asesoría jurídica y trámites administrativos ante la Coordinación Técnica del Sistema\nEstatal del Registro Civil.\n• 2500 servicios de asesorías jurídicas y representación legal para personas indígenas y afromexicanas, ante instancias federales y estatales.\n• 800 traducciones en las lenguas náhuatl, mixteca (na' savi), tlapaneca (me'phaa) y amuzga\n(ñomndaa), ante los órganos de procuracion, administración e impartición de justicia, y otras instituciones de los tres niveles de gobierno.\n• 9 visitas de diagnóstico a los Centros de Readaptación Social (CERESO) del Estado, para identificar el número y situación jurídica de las y los internos indígenas y afromexicanos.\n• 50 trámites para la libertad anticipada de personas indígenas y afromexicanas sentenciadas por delitos del fuero común y federal, y para gestión de traslado de internos indígenas y afromexicanos al\nCERESO más cercanos a su lugar de residencia.\n• 25 paquetes de materia prima para personas indígenas y afromexicanas internas en los CERESO de la entidad.\n• 2500 trámites administrativos ante la Coordinación Técnica del Sistema Estatal del Registro Civil.\nb) Capacitación e impulso de los derechos indígenas y afromexicanos.\nII.1. Talleres para el impulso de los derechos indígenas y Afromexicanos.\nII. 2. Estrategia para Prevenir la Violencia contra las Mujeres, Adolescentes y Niñas Indígenas y\nAfromexicanas.\n▪ 1 diplomado para la formación y certificación de 40 intérpretes traductores en lenguas indígenas.\n▪ 13 talleres de capacitación y sensibilización para la prevención de la violencia contra las mujeres, adolescentes y niñas indígenas y afromexicanas.\n▪ Asesoría jurídica y representación legal a mujeres en situación de violencia, así como canalización y acompañamiento ante las instituciones responsables de su tratamiento.\n5. Programación presupuestal\nREGLAS DE OPERACIÓN PARA EL EJERCICIO FISCAL\nCONCEPTO TOTAL N\nMAR ABR MAY JUN JUL AGO SEP OCT NOV IC\nI. Servicios de defensa, asesoría jurídica y tramites administrativo ante 1, 743, 360 573.100 181,665 166,225 126,575 141,454 163,475 137,075 253,700 la Coordinación\nTécnica del\nRegistro Civil.\nII. Capacitación e impulso delos derechos indígenas y afromexicanos.\nII.I. Talleres para el impulso de los derechos 441,040 131,220 145,740 164,080 indígenas afromexicanos\nII.II. Estrategia para Prevenir la\nViolencia contra las Mujeres, adolescentes y niñas Indígenas y\nAfromexicanas.\na) Diplomado para la formación y certificación de\n305,200 89,500 70,500 69,500 75,700 intérpretes traductores en lenguas indígenas\nb) Talleres de capacitación y sensibilización para la prevención\n510,400 135,120 103,370 89,520 87,920 94,470 de la violencia contra las mujeres indígenas y afromexicanas\nTOTAL 3,000,000 573,100 131,220 316,785 359,095 197,075 446,305 327,095 395,625 253,700\nTOTAL\n3,000,000 573,100 807,100 970,475 649,325\nTRIMESTAL\nI. Servicios de defensa y asesoría jurídica, y trámites administrativos ante la\nCoordinación Técnica del\nRegistro Civil\nREGLAS DE OPERACIÓN PARA EL EJERCICIO FISCAL\nII. Capacitación e impulso de los derechos indígenas y afrorrexicanos.\nIII. Talleres para el impulso de los derechos indígenas y afromexicanos.\nII.II Estrategia para Prevenir la\nViolencia contra las Mujeres, adolescentes y niñas indígenas y afromexicanos.\na) Diplomado para la formación y certificación de intérpretes traductores en lenguas indígenas\nb) Talleres de capacitación y sensibilización para la prevención de la violencia contra las mujeres indígenas y afro mexicanas.\n6. Requisitos y procedimientos de acceso\na) Aplica para los apoyos en materia de defensa y asesoría jurídica, traducción en lenguas indígenas y trámites ante la Coordinación Técnica del Sistema Estatal del Registro Civil, los cuales se sujetarán al procedimiento siguiente:\nLa SAIA proporcionará asesoría jurídica y representación legal, a través de:\n• Traducción en las lenguas náhuatl, mixteca (na' savi), tlapaneca (me' phaa) y amuzga (ñomndaa), ante los órganos de procuracion, administración e impartición de justicia, y otras instituciones de los tres niveles de gobierno.\n• Trámites administrativos ante la Coordinación Técnica del Sistema Estatal del Registro Civil.\n• Excarcelaciones de personas indígenas y afromexicanas internas en los distintos centros penitenciarios, en los casos que jurídicamente proceda.\nLas personas interesadas deberán presentar solicitud por escrito libre, en las oficinas centrales de la de 9:30 a 14:30 horas:\n• Chilpancingo: Calle Guillermo Soberón Acevedo, núm. 8, Col. Salubridad. Tel. 01 (747) 137 0620.\n• Chilapa de Álvarez: Calle 3 Norte, núm. 108, Col. Centro. Tel. 01 (7 5 6) 475 0253.\n• Ometepec: Calle Juan Ruiz de Alarcón, núm. 32, Barrio de la Guadalupe. Tel. 01 (741) 412 0055.\n• Tlapa de Comonfort: Calle Morelos, núm. 124, Col Centro. Tel. 01 (757) 476 0377.\nLa solicitud podrá ser presentada por cualquier persona, institución pública u organizacion social. Al recibir la solicitud, las unidades administrativas receptoras deberán verificar que se cumpla con los\nREGLAS DE OPERACIÓN PARA EL EJERCICIO FISCAL requisitos y deberán entregar acuse de recibo y, en su caso, indicarán a la persona interesada los datos faltantes para que sean entregados en un plazo no mayor a cinco días hábiles.\nAl concluir este periodo se le notificará al peticionario la respuesta a su solicitud, para el caso de ser aprobada, las personas solicitantes acudirán a la unidad administrativa receptora para formalizar el apoyo.\nEn el caso de que se requiera el servicio de una traducción e interpretación en una lengua indígena, así como el acompañamiento para realizar un trámite administrativo ante el registro civil, inmediatamente se le otorga el servicio desde su inicio hasta su culminación; y por cuanto hace al servicio de asesoría jurídica en un proceso penal, inmediatamente se realiza un estudio del estado procesal que guarda el asunto que nos ocupa y a partir de ahí inicia nuestra intervención brindándole asesoría jurídica y la representación legal al peticionario el tiempo que dure el proceso penal o hasta que se dicte una sentencia, asimismo se deja de prestar el servicio hasta que el peticionario así lo solicite.\nb) En cuanto a las actividades relacionadas con capacitación, éstas responden a diferentes compromisos |de la SAIA, de acuerdo a los procedimientos siguientes:\n• Diplomado para la formación y certificación de intérpretes traductores en lenguas indígenas.\n• Talleres de capacitación y sensibilización para la prevención de la violencia contra las mujeres, adolescentes y niñas indígenas y afromexicanas.\nEstas dos capacitaciones forman parte de la estrategia que atiende la Alerta de Violencia de Género contra las Mujeres Indígenas y Afromexicanas, por lo que responde a lineamientos Establecidos por la\nSecretaría General de Gobierno y no tiene convocatoria abierta al público; los municipios y personas objetivo han sido determinadas de acuerdo a lo que indica dicha Alerta (municipios: Ayutla de los Libres, Ometepec, Tlapa de Comonfort y Chilapa de Álvarez).\n6.1. Difusión\nConforme a las disposiciones establecidas en el apartado de programas sujetos a Reglas de Operación del Decreto Número 447 el Presupuesto de Egresos del Estado de Guerrero para el Ejercicio Fiscal 2020, Indígenas y Afromexicanos, y en sus delegaciones regionales, cuyas direcciones y horarios aparecen en el apartado 8 del presente documento. De igual manera, la información de los servicios que otorga el\nPrograma y los requisitos para acceder a ellos, estará disponible en los lugares ya señalados. Asimismo, Afromexicanos.\n6.2. Requisitos de acceso\nREGLAS DE OPERACIÓN PARA EL EJERCICIO FISCAL\na) Ser originario de comunidades y municipios indígenas y afromexicanos, o auto adscribirse como tales, independientemente de su sexo, edad y filiación política o religiosa.\nb) Solicitud por escrito, dirigida al titular de la SAIA, especificando el trámite o servicio que se demanda.\nc) Constancias de identidad, expedida por la autoridad comunitaria o municipal del pueblo originario que desciendan, o dependencia que corresponda.\nd) Copia certificada de la declaración preparatoria del procesado en la que se declare hablante de alguna lengua indígena o se auto reconozca como integrante de un pueblo indígena o del afromexicano.\n6.3. Procedimientos de acceso\nLa forma de acceder a los servicios y apoyos que ofrece el programa, responde a solicitud de las personas que demandan el beneficio, y los criterios serán trasparentes, equitativos y no discrecionales.\nLos requisitos, la forma de acceso y criterios de selección establecidos por el Programa son públicos, y estarán a la vista de las personas solicitantes en las oficinas centrales y delegaciones de la SAIA, cuya ubicación y horarios se anotan en el apartado 8 de este documento.\nUna vez que las personas solicitantes hayan cubierto los requisitos establecidos para acceder a los servicios y apoyos del Programa, se entregará el comprobante respectivo y recibirán el beneficio de manera gratuita, rápida y expedita, de acuerdo a la urgencia y complejidad del problema planteado. Asimismo, en los servicios de defensa y asesoría jurídica, se brindará información a las personas beneficiarias sobre el estado que guardan los procedimientos legales, en el momento que lo solicite, dentro de los horarios de atención y en los sitios señalados en el apartado 8 del presente Programa.\nLas personas beneficiarias del Programa, formarán parte de un Padrón de Beneficiarias y Beneficiarios, el cual será de carácter público, siendo reservados sus datos personales, de acuerdo con la Ley Número\n207 de Transparencia y Acceso a la Información Pública del Estado de Guerrero y, en ningún caso, podrán emplearse para propósitos de proselitismo político, religioso o comercial, ni para ningún otro fin distinto al establecido en estas Reglas de Operación.\nAnte ningún caso o situación las servidoras o servidores públicos que ejecutan el Programa podrán solicitar pago alguno por el servicio que prestan, ni procederán de manera diferente a lo establecido en este Programa.\n6.4. Requisitos de permanencia y causales de baja o suspensión temporal\nLa SAIA, a través de la Dirección General de Defensa y Asesoría Jurídica y su equipo de abogados y abogadas, vigilará que se cumplan las Reglas de Operación del Programa Defensa y Asesoría Jurídica a\nPueblos Indígenas y Afromexicano, así como las obligaciones impuestas por la autoridad judicial, tratándose de personas indígenas y afromexicanas procesadas, como principal requisito para obtener los beneficios del Programa.\nSe suspenderá el apoyo, cuando el solicitante incurra en las siguientes faltas:\nREGLAS DE OPERACIÓN PARA EL EJERCICIO FISCAL\na) Incumplir lo establecido en los lineamientos, guías de operación y procedimientos.\nb) Presentar información o documentación alterada o falsa.\nc) Aplicar incorrectamente los recursos recibidos, conforme a los conceptos autorizados.\n6.5. Modos de entrega del beneficio\nLa entrega de los beneficios del Programa, se hará de forma directa a las personas solicitantes; una vez que las personas solicitantes, grupos, organizaciones sociales o comunidades hayan cubierto los requisitos establecidos para recibir los servicios y apoyos descritos, accederán a los beneficios del\nPrograma de manera gratuita, rápida y expedita, de acuerdo a la urgencia y complejidad del asunto planteado, lo cual será responsabilidad del personal del área jurídica de la SAIA, quien estará a cargo del cumplimiento de estas Reglas de Operación.\n7. Procedimientos de instrumentación\n7.1. Operación\na) Para la ejecución del Programa, la SAIA, a través de la Dirección General de Defensa y Asesoría\nJurídica, elaborará las Reglas de Operación y la programación presupuestal.\nb) La implementación del Programa estará a cargo de la Dirección General de Defensa y Asesoría\nJurídica, la cual será responsable de brindar acompañamiento y representación jurídica a la población indígena y afromexicana, así como vigilar el correcto seguimiento y cumplimiento a los servicios prestados.\nc) La vigencia de los servicios se realizará a partir de la entrada en vigor de las presentes Reglas de\nOperación y, de acuerdo a las características no previsibles de la demanda ciudadana de servicios jurídicos, no aplica un calendario definido en la prestación de estos apoyos.\nd) Las personas e instancias interesadas deberán entregar, en las unidades administrativas receptoras, la solicitud de apoyo mediante escrito libre en original, en el que se indique, el nombre de la(s) persona(s) solicitante(s), el tipo de apoyo que requiere y sus datos personales para localización, acompañada por los requisitos establecidos:\n• El personal de las unidades administrativas receptoras deberá orientar a las personas solicitantes, en la elaboración y presentación de las solicitudes y la documentación establecida en el Programa.\n• Las unidades administrativas receptoras, al recibir cada solicitud, deberán verificar que el expediente cumpla con los requisitos señalados en estas Reglas de Operación, y deberán entregar el acuse de recibo a quien solicita el servicio, señalando los documentos o datos faltantes para que sean entregados en un plazo no mayor de cinco días hábiles.\n• Una vez publicados los resultactos, en los casos que aplique según el tipo de apoyo, las instancias\nREGLAS DE OPERACIÓN PARA EL EJERCICIO FISCAL las unidades administrativas receptoras, con el objeto de firmar el convenio o acuerdo en el que se formalizarán los derechos y obligaciones entre las partes, para la ejecución, administración, seguimiento y evaluación.\ne) Los datos de las personas beneficiarias del Programa Defensa y Asesoría Jurídica a Pueblos\nIndígenas y Afromexicano, así como la información que éste genere y administre estará regida por lo que establece la Ley Número 207 de Transparencia y Acceso a la Información Pública del Estado de Guerrero.\nf) Todos los formatos y papelería que se entregue a las personas solicitantes y beneficiarias del\nPrograma, así como los trámites a realizar serán totalmente gratuitos.\n7.2. Gastos de operación\nEn cumplimiento al artículo 47 de la Ley de Coordinación Fiscal, podrá aplicarse hasta un 3% del presupuesto total del Programa, para gastos de operación y realización de diversas acciones, asociadas con la planeación, operación, supervisión, seguimiento, contraloría social y evaluación o asesoría externa del Programa, por un monto de $90,000.00 (noventa mil pesos 00/100 M.N.), de acuerdo a la tabla siguiente:\nUNIDAD DE COSTO\nCAPITULO CONCEPTO PARTIDA CANTIDAD TOTAL\nMEDIDA UNITARIO\n2111 Paquete 2 5,000.00 10,000.00\n2100\n2121 Paquete 2 5,000.00 10,000.00\n2000 2600 2611 Litro 800 20.00 16,000.00\n3721 Viaje 20 500.00 10,000.00\n3700\n3751 Día 44 1,000.00 44,000.00\nTOTAL $90,000.00\n8. Transparencia\n8.1. Difusión\nConforme a las disposiciones establecidas en el apartado del Programa Sujetos a Reglas de Operación del\nDecreto Número 447 del Presupuesto de Egresos del Estado de Guerrero para el Ejercicio Fiscal 2020, SAIA, cuya ubicación se anota en el apartado 8 de las presentes Reglas de Operación, así como en las la red social Facebook: Secretaría de Asuntos indígenas y Afromexicanos.\n8.2. Blindaje electoral\nJurídica a Pueblos Indígenas y Afromexicano, deberán observar y atender las medidas que emita la\nREGLAS DE OPERACIÓN PARA EL EJERCICIO FISCAL con fines políticos, por lo que la papelería y documentación oficial, así como la publicidad y promoción del\nPrograma deberá de incluir la leyenda siguiente:\n“Este programa es público, ajeno a cualquier partido político. Queda prohibido el uso para fines distintos a los establecidos en el programa”.\n8.3. Supervisión y control\nLa supervisión, control y evaluación del Programa Defensa y Asesoría Jurídica a Pueblos\nIndígenas y Afromexicano, será interna y estará a cargo de la Dirección General de Defensa y Asesoría\nJurídica, para lo cual se utilizará la Metodología del Marco Lógico y los resultados de la evaluación serán compartidos cada trimestre con la Secretaría de Planeación y Desarrollo Regional y la Secretaría de\nContralaría y Transparencia Gubernamental, mismos que se deberán presentar a más tardar 15 días hábiles posteriores a la terminación de cada trimestre, así como los informes sobre el presupuesto ejercido y en base a los indicadores de resultados previstos en este precepto.\nTodos los gastos generados en cada una de las actividades y acciones estarán soportados con la comprobación respectiva.\nLas delegaciones regionales y la Dirección General de Defensa y Asesoría Jurídica de la SAIA, llevarán a cabo el seguimiento al trabajo desarrollado por las instancias ejecutoras, con relación a las metas comprometidas, a fin de verificar la aplicación correcta de los recursos otorgados y el cumplimiento de objetivos y metas establecidas.\nEste seguimiento se realizará mediante la revisión de los informes presentados por las instancias ejecutoras, y a través de la evaluación y acompañamiento de las acciones desarrolladas en campo.\n8.4. Mecanismos de evaluación e indicadores\n8.4.1. Evaluación\nLa SAIA tendrá la obligación de revisar, de manera interna, la correcta operación y aplicación de las presentes Reglas de Operación y, en caso necesario, podrá solicitar una evaluación externa por parte de una instancia con experiencia en el tema.\nAsimismo, efectuará periódicamente acciones de supervisión y evaluación para garantizar el adecuado desarrollo del Programa, con el objeto de corregir desfases o efectuar reasignaciones financieras\nAdministración, a fin de cubrir rubros prioritarios con recursos de este mismo programa o de otros que no hayan sido ejercidos en su momento, o bien que provengan de ahorros presupuestales.\nREGLAS DE OPERACIÓN PARA EL EJERCICIO FISCAL\n8.4.2. Indicadores\nMatriz de indicadores para Resultados\nIndicadores de Medios de\nResumen Narrativo Supuestos desempleo Verificación\nContribuir al cumplimiento Porcentaje de 1. Encuesta Nacional Las instituciones de los de los derechos de los población indígena y sobre discriminación tres niveles de pueblos indígenas y afromexicana que ha (ENADIS) 2017 gobierno conocen y afromexicano otorgando sufrido violación de sus CONAPRED dan cumplimiento a los servicios jurídicos y derechos humanos. 2. Encuesta a derechos de los fortaleciendo sus culturas e población indígena y pueblos indígenas identidades. afromexicana afromexicano. realizada SAIA, 2019\nLa población indígena y Porcentaje de 1. Encuesta Nacional Los tribunales y afromexicana tiene acceso a personas indígenas y sobre discriminación órganos de sus garantías afromexicanas (ENADIS) 2017 administración y constitucionales atendidas por el CONAPRED procuración de justicia\nPropósito programa que 2. Encuesta a respetan los derechos\n(resultado) afirmaron tener poco población indígena y indígenas y acceso a la afromexicana afromexicanas y procuración e realizada SAIA, 2019 adecuan impartición de justicia. interculturalmente sus procedimientos\nC.1. Asesoría jurídica y Porcentaje de Registro de Los órganos que representación legal. población indígena y beneficiarios SAIA, defienden el afromexicana que 2019 presupuesto solicita un servicio incrementación el\nComponentes jurídico y los obtiene. financiamiento a\n(Servicios y\nC.2. Impulso a los derechos Número de talleres 1. Registro de programas de acceso a\nProductos) realizados participantes SAIA, la justicia e impulso de\n2019. los derechos de la\n2. Memoria de los población indígena y eventos 2019. afromexicana\n1.1. Diagnósticos socio\nLas personas se jurídicos. 1.4. Porcentaje ele capacitan para prevenir\n1.2. Seguimiento a procesos traducciones en\n1.4. Registro de y erradicar la violencia\nActividades legales. lenguas indígenas ante traducciones SAIA, contra las mujeres, así\n(Procesos) 13. Coadyuvancia en la órganos de\n2019 como para fortalecer procuración de justicia administración y sus culturas e\n1.4. Traducción en las procuración de justicia. identidades cuatro lenguas\nREGLAS DE OPERACIÓN PARA EL EJERCICIO FISCAL\n1.5. Apoyos a internos indígenas de los CERESO del estado\n1.6. Trámites ante la\nCoordinación estatal del\nRegistro Civil.\n2.1. Número de\n2.1. Capacitación y personas que reciben Las personas se\n2.1. Registro de sensibilización para prevenir capacitación para capacitan para prevenir participantes SAIA, la violencia contra las prevenir y erradicar la y erradicar la violencia\n2019 mujeres. violencia contra las contra las mujeres. mujeres.\n8.5. Auditoría\nEste Programa podrá ser auditado, a través de las instancias correspondientes en el ámbito de sus respectivas competencias del Gobierno del Estado, encargadas de vigilar la correcta aplicación de los recursos del erario público. Como resultado de las acciones de auditoría que se llevan a cabo, el Órgano\nInterno de Control mantendrá seguimiento interno que permita emitir los informes de las revisiones practicadas, dando principal importancia a la atención en tiempo y forma de las irregularidades detectadas hasta ser solventadas.\n8.6. Recursos no devengados\nEl presupuesto no ejercido para los fines autorizados al 31 de diciembre de 2020, será reintegrado a la Dirección General de Tesorería, de la Secretaría de Finanzas y Administración del Estado de Guerrero.\n8.7. Contraloría social\nLa SAIA, como instancia ejecutora, promoverá la contraloría social, la cual comprende un conjunto de acciones de control, vigilancia y evaluación que realizan las personas beneficiarias, ya sea de manera organizada o independiente, bajo un esquema de derechos y compromisos ciudadanos con el propósito de contribuir a que la gestión gubernamental se realice en términos de transparencia, eficacia y honradez.\nEntre dichas acciones destacan las siguientes:\na) Informar a la ciudadanía acerca de los apoyos otorgados y su costo.\nb) Capacitar a las beneficiarias y beneficiarios para que se constituyan en instancias de vigilancia y evaluación social.\nc) Establecer espacios de comunicación vecinales, asambleas comunitarias, entre otros).\nd) Promover la integración de organizaciones de la sociedad civil para realizar acciones de contraloría social.\nREGLAS DE OPERACIÓN PARA EL EJERCICIO FISCAL\ne) Instrumentar mecanismos de recepción y atención de quejas y denuncias. El Órgano Interno de\nControl verificará en lo correspondiente la realización de dichas acciones.\n8.8. Formas de participación social\nCon apego en lo dispuesto en la Ley Número 684 de Participación Ciudadana del Estado Libre y\nSoberano de Guerrero, se establece que la sociedad podrá participar activamente en la planeación, programación, implementación y evaluación de los programas de esta Secretaría, ya sea de manera individual o de manera colectiva, tales como consejos, comités vecinales, comités de seguimiento de administración, de supervisión, de control, entre otros, por lo que en cumplimiento de estas disposiciones, la forma de participación para el Programa será a través de un Consejo, cuyos miembros participarán en la etapa de la implementación y podrán supervisar la gestión gubernamental, y que el manejo de los recursos públicos se realicen en términos de transparencia, eficacia, legalidad y honradez del Programa de acuerdo en lo estipulado en estas Reglas de Operación.\n{\"tabla_1\":{\"columnas\":[\"Participante\",\"(sin encabezado)\",\"Etapa en la que\",\"(sin encabezado)\",\"Forma de participación\",\"Modalidad\"],\"filas\":[{\"columna_1\":\"(sin dato)\",\"columna_2\":\"(sin dato)\",\"columna_3\":\"participa\",\"columna_4\":\"(sin dato)\",\"columna_5\":\"(sin dato)\",\"columna_6\":\"(sin dato)\"},{\"columna_1\":\"Consejo Indígena y Afromexicano\\ndel Estado de Guerrero, A.C.\",\"columna_2\":\"Implementación\",\"columna_3\":\"(sin dato)\",\"columna_4\":\"(sin dato)\",\"columna_5\":\"Colectiva\",\"columna_6\":\"Consulta\"}]}}\n8.9. Procedimiento de queja o inconformidad ciudadana\na) Las quejas, denuncias, peticiones y sugerencias relativas a este Programa, se realizarán de manera escrita, por comparecencia del interesado, por correo electrónico o vía telefónica, y para aquellas que sean escritas se depositarán en los buzones instalados en las oficinas centrales de la SAIA, ubicadas en la ciudad de Chilpancingo, así como en las delegaciones regionales, situadas en las ciudades de Tlapa de Comonfort, Chilapa de Álvarez y Ometepec.\nLa persona denunciante o quejosa deberá proporcionar los siguientes datos: Nombre de la servidora o servidor público, departamento de adscripción, objeto de la denuncia, nombre y domicilio de la persona quejosa e identificación oficial.\nb) Las quejas, denuncias, peticiones y sugerencias relativas a este Programa, se atenderán a respuesta en un término máximo de 20 días hábiles.\nc) En caso de que la SAIA no resuelva la queja de las personas aspirantes o beneficiarias estas\nGubernamental del Estado de Guerrero.\n8.10. Mecanismos de exigibilidad\nLa SAIA, a través de sus unidades administrativas, firmarán un convenio o acuerdo en el que se formalizarán los derechos y obligaciones entre las partes para la ejecución del Programa, en donde se\nREGLAS DE OPERACIÓN PARA EL EJERCICIO FISCAL estipulará los lineamientos para el cumplimiento, que obligue a los beneficiados a dar cabal cumplimiento corresponda, generando un antecedente para futuros apoyos que soliciten a la institución.\n8.11. Acta de entrega-recepción\nPor la naturaleza del Programa no aplica; sin embargo, se cuenta con un padrón y expediente para cada beneficiaria y beneficiario.\n9. Criterios de selección y elegibilidad\n9.1. Método de selección de personas beneficiarias\nQuienes soliciten apoyo del Programa, deberán cumplir con los requisitos siguientes:\na) Ser originarios de comunidades y municipios indígenas y afromexicanos, o autoadscribirse como tales, independientemente de su sexo, edad, filiación política y religiosa.\nb) Solicitud por escrito, dirigida al titular de la SAIA, especificando el servicio o trámite que se demanda.\nc) Copia certificada de la declaración preparatoria de la persona procesada, cuando el caso así lo amerite, en la que se auto reconozca como integrante de un pueblo originario o afromexicano.\n10. Mecánica de operación\n10.1. Instancia ejecutora\nLa Secretaría de Asuntos Indígenas y Afromexicanos será la instancia ejecutora del Programa\nDefensa y Asesoría Jurídica a Pueblos Indígenas y Afromexicano, a través de la Dirección General de\nDefensa y Asesoría Jurídica, de acuerdo a estas Reglas de Operación para el ejercicio fiscal 2020.\n10.2. Instancia administrativa y/o normativa\nReglas de Operación.\n10.3. Delimitación de atribuciones\nRespetando las presentes Reglas de Operación, las instancias ejecutoras y administradoras del presente Programa, se limitarán a realizar sus funciones establecidas, así como lo señalado en el\nREGLAS DE OPERACIÓN PARA EL EJERCICIO FISCAL reglamento interno de la institución. Esto con el objeto de armonizar el correcto desempeño y aplicación de los recursos asignados por el Estado para los fines del Programa.\n11. Derechos, obligaciones y sanciones de las personas beneficiarias del programa\n11.1. Derechos\na) Recibir un trato digno, respetuoso, oportuno, equitativo y de calidad.\nb) Acceder a los apoyos que otorga con lo establecido en estas Reglas disponibilidad presupuestal.\nc) Recibir orientación de la SAIA para la presentación de solicitudes de apoyo e integración de expedientes sin costo alguno.\n11.2. Obligaciones\na) Conducirse con verdad y aportar la información personal que la SAIA requiera (edad, sexo, domicilio, grado máximo de estudios, ingreso, dependientes económicos, lugar de nacimiento, lengua indígena que habla, pueblo indígena al que pertenece, CURP, acta de nacimiento, copia de identificación oficial) los cuales estarán protegidos conforme a la legislación en la materia.\nb) Cumplir con los requisitos establecidos en estas Reglas de Operación.\nc) Aportar la información que la SAIA requiera sobre los proyectos o acciones que les fueron financiadas.\n11.3. Sanciones\nSe cancelará el apoyo solicitado, cuando se incurra en los siguientes casos:\na) Presentar información o documentación alterada o falsa.\nb) No aplicar los recursos que se reciban conforme a los conceptos autorizados.\n12. Interpretación\nLas presentes Reglas de Operación se interpretarán de forma unilateral y clara, de acuerdo a su contenido; lo anterior en el sentido que son específicas y entendibles en su contenido y alcance. Cualquier la población indígena y afromexicana, con respecto a la adecuada presentación de sus solicitudes, documentación y requisitos, así como la correcta aplicación de los recursos económicos asignados para el fin propuesto.\nREGLAS DE OPERACIÓN PARA EL EJERCICIO FISCAL\nREGLAS DE OPERACIÓN PARA EL EJERCICIO FISCAL\nREGLAS DE OPERACIÓN PARA EL EJERCICIO FISCAL\nREGLAS DE OPERACIÓN PARA EL EJERCICIO FISCAL\nPrimero. El presente Acuerdo entrará en vigor al día siguiente de su publicación en el Periódico\nSegundo. Se abroga el Acuerdo por el que se crea el Programa Defensa y Asesoría Jurídica a\nPueblos Indígenas Afromexicanos y se emiten sus reglas de Operación para el Ejercicio Fiscal 2019, publicado en el Periódico Oficial del Gobierno del Estado de Guerrero No. 38, de fecha 10 de mayo de\n2019.\nTercero. A partir de la entrada en vigor del presente Acuerdo, las Reglas de Operación del\nPrograma Defensa y Asesoría Jurídica a Pueblos Indígenas y Afromexicano, subsecuentes y sus modificaciones serán emitidas por la persona titular de la Secretaría de Asuntos Indígenas y\nAfromexicanos, responsable directa de la operación y ejecución de las mismas.\nDado en la oficina del titular del Poder Ejecutivo, ubicada en el Edificio Centro de Palacio de\nGobierno, Boulevard René Juárez Cisneros No. 62, Colonia Ciudad de los Servicios en la Ciudad de\nChilpancingo de los Bravo, Capital del Estado de Guerrero, a los dos días del mes de septiembre del año dos mil veinte.\nEL GOBERNADOR CONSTITUCIONAL DEL ESTADO DE GUERRERO.\nLIC. HÉCTOR ANTONIO ASTUDILLO FLORES.\nRúbrica.\nEL SECRETARIO GENERAL DE GOBIERNO LIC.\nFLORENCIO SALAZAR ADAME.\nRúbrica.\nMTRO. JAVIER ROJAS BENITO.\nRúbrica.",
  "ordenamiento": "PROGRAMA",
  "jurisdiccion": "GUERRERO",
  "fuente_oficial": "DIARIO OFICIAL DE LA FEDERACION",
  "Fecha de Publicación": "11 de \nSeptiembre de 2020",
  "ULTIMA REFORMA PUBLICADA": "11 de Septiembre de 2020",
  "status": "ABROGADA",
  "es_escaneado": false,
  "tiene_tablas": true,
  "materia": [
    "indígena"
  ]
}