{
  "titulo": "Acuerdo por el Que Se Crea el Proyecto Instalación de Tiendas de Abarrotes para Población Vulnerable",
  "Contenido": "DE OPERACIÓN, PARA EL EJERCICIO FISCAL 2019\nTEXTO ORIGINAL\nAcuerdo publicado en el Periódico Oficial del Gobierno del Estado No. 54 Alcance VI, el Viernes\n05 de julio de 2019.\nACUERDO POR EL QUE SE CREA EL PROYECTO INSTALACIÓN DE TIENDAS DE ABARROTES\nPARA POBLACIÓN VULNERABLE Y SE EMITEN LAS REGLAS DE OPERACIÓN, PARA EL\nEJERCICIO FISCAL 2019.\nLIC. JOSÉ FRANCISCO SOLÍS SOLÍS, DIRECTOR GENERAL DEL SISTEMA PARA EL DESARROLLO\nINTEGRAL DE LA FAMILIA DEL ESTADO DE GUERRERO, EL CUAL ES UN ORGANISMO PÚBLICO\nDESCENTRALIZADO, CON PERSONALIDAD JURÍDICA Y PATRIMONIO PROPIO CREADO MEDIANTE\nLEY 107 PUBLICADA EN EL PERIÓDICO OFICIAL NÚMERO 10 DEL GOBIERNO DEL ESTADO CON\nFECHA 9 DE MARZO DE 1977 Y REGULADO POR LA LEY 479 PUBLICADA EN EL PERIÓDICO OFICIAL\nNÚMERO 61 DEL 02 DE AGOSTO DE 1983, CON FUNDAMENTO EN LA LEY 690 DE ENTIDADES\nPARAESTATALES PARA EL ESTADO DE GUERRERO; EL ARTÍCULO 27 FRACCIÓN X DEL\nREGLAMENTO INTERIOR DEL ORGANISMO PÚBLICO DESCENTRALIZADO, ASÍ COMO LA LEY\nSOBRE EL SISTEMA ESTATAL DE ASISTENCIA SOCIAL NÚMERO 332, ARTICULO 4, FRACCIONES I\nA LA XV; ARTICULO II BIS, FRACCIÓN I AL IV Y ARTÍCULO 11 TER, ÚLTIMA REFORMA PUBLICADA\nEN EL PERIÓDICO OFICIAL DEL GOBIERNO DEL ESTADO NÚMERO 15 DE FECHA 20 DE FEBRERO\nDEL 2015, Y LOS LINEAMIENTOS PARA LA ELABORACIÓN DE LAS REGLAS DE OPERACIÓN DE LOS\nPROGRAMAS SOCIALES ESTATALES PARA EL EJERCICIO FISCAL 2017, Y\nCONSIDERANDO\nQue en el Dictamen y Decreto Número 182 del Presupuesto de Egresos del Estado de Guerrero para el\nEjercicio Fiscal 2019, se señala que se ejercerán los recursos bajo una política de gasto público, que permita dar cumplimiento a lo que globalmente prevén los ejes rectores del Plan Estatal de Desarrollo\n20162021, por lo que se alinea en el eje III.- Guerrero Socialmente Comprometido. Objetivo 3.2. Edificar la ruta hacia una sociedad equitativa e incluyente; Estrategia 3.2.1. Generar programas de Desarrollo\nComunitario por Medio de Procesos de Participación Social. Dentro de la política de Desarrollo Social, el\nSistema para el Desarrollo Integral de la Familia del Estado de Guerrero, opera Proyectos productivos y de servicios, cuyo objetivo es Fortalecer la economía de las personas que habitan en zonas rurales, mediante la Instalación de Tiendas de Abarrotes para Población Vulnerable, generando auto empleo y/o empleo a personas de grupos vulnerables, a través de los cuales brindaran servicios básicos a bajo costo entre sus habitantes.\nEl Sistema para el Desarrollo Integral de la Familia tendrá a cargo la implementación, ejecución, evaluación y administración del Proyecto Instalación de Tiendas de Abarrotes para Población Vulnerable, bajo los criterios de objetividad, equidad, transparencia, publicidad, selectividad y temporalidad, con estricto apego\nDE OPERACIÓN, PARA EL EJERCICIO FISCAL 2019 a la normatividad aplicable, por lo tanto será el encargado de la dispersión y asignación de los recursos del proyecto, apegándose plenamente a las reglas de operación.\nPor lo expuesto y con fundamento en las disposiciones legales antes citadas, he tenido a bien expedir el siguiente:\nACUERDO POR EL QUE SE CREA EL PROYECTO INSTALACIÓN DE TIENDAS DE ABARROTES\nPARA POBLACIÓN VULNERABLE Y SE EMITEN LAS REGLAS DE OPERACIÓN, PARA EL\nEJERCICIO FISCAL 2019.\nÚnico: Se emiten las Reglas de Operación del Proyecto Instalación de Tiendas de Abarrotes para\nPoblación Vulnerable, para el Ejercicio Fiscal 2019.\nCONTENIDO\n1. INTRODUCCIÓN\n1.1 Antecedentes\n1.2 Alineación programática\n1.3 Diagnóstico\n2. DEPENDENCIA O ENTIDAD RESPONSABLE DEL PROGRAMA\n3. OBJETIVOS Y ALCANCES\n3.1 General\n3.2 Específicos\n3.3 Alcances\n4. METAS FÍSICAS\nPROGRAMACIÓN PRESUPUESTAL\n6 REQUISITOS Y PROCEDIMIENTO DE ACCESO\n6.1 Difusión\n6.2 Requisitos de Acceso\n6.3 Procedimientos de Acceso\n6.4 Requisitos de Permanencia, Causales de Baja o Suspensión Temporal\n6.5 Modos de Entrega del Beneficio\n7 PROCEDIMIENTOS DE INSTRUMENTACIÓN\n7.1 Operación\n7.2 Gastos de Operación\n8. TRANSPARENCIA\nDE OPERACIÓN, PARA EL EJERCICIO FISCAL 2019\n8.1 Difusión\n8.2 Blindaje Electoral\n8.3 Supervisión y Control\n8.4 Mecanismos de Evaluación e Indicadores\n8.4.1 Evaluación\n8.4.2 Indicadores\n8.5 Auditoria\n8.6 Recursos no Devengados\n8.7 Contraloría Social\n8.8 Formas de Participación Social\n8.9 Procedimiento de Queja o Inconformidad Ciudadana\n8.10 Mecanismos de Exigibilidad\n8.11 Acta de Entrega-Recepción\n9. CRITERIOS DE SELECCIÓN Y ELEGIBILIDAD\n9.1 Método de Selección de Beneficiarios y Beneficiarias\n10. MECÁNICA DE OPERACIÓN\n10.1 Instancia Ejecutora\n10.2 Instancia administrativa y/o normativas\n10.3 Delimitación de atribuciones\n11. DERECHOS, OBLIGACIONES Y SANCIONES DE LOS BENEFICIARIOS DE PROGRAMAS\nSOCIALES\n11.1 Derechos\n11.2 Obligaciones\n11.3 Sanciones\n12. INTERPRETACIÓN\nTRANSITORIOS\nANEXOS\n1. INTRODUCCIÓN\n1.1 ANTECEDENTES\nEl DIF Guerrero, a través de la Dirección de Asistencia Alimentaria y Desarrollo Comunitario, fomenta y promueve acciones que mitiguen la vulnerabilidad de las personas que son sujeto de asistencia social, y tres niveles de gobierno (Federal, Estatal y Municipal) dentro del ámbito de su competencia.\nDE OPERACIÓN, PARA EL EJERCICIO FISCAL 2019\nEn este documento se sustenta la intervención institucional que desde el ejercicio 2013 ha venido atendiendo a población en situaciones de vulnerabilidad, asi mismo, se especifica la participación básica de llevar a cabo entre los sistemas DIF municipales, con el objetivo de realizar proyectos en coordinación, como el de Instalación de Tiendas de Abarrotes para la Población Vulnerable, teniendo como prioridad la atención a aquellas familias en estado de vulnerabilidad social que habiten en localides de alto y muy alto grado de marginación que tiene el propósito de fomentar el autoempleo y consumo como un elemento clave para que las familias que viven en condiciones de desventaja socioeconómica mejoren sus niveles de vida.\n1.2 ALINEACIÓN PROGRAMÁTICA\nEn cumplimiento a lo que globalmente prevén los ejes rectores del Plan Estatal de Desarrollo 2016-2021, por lo que se alinea en el eje III.- Guerrero Socialmente Comprometido; Objetivos: 3.1. Construir un Estado\nGarante de los Derechos Sociales de las Personas, 3.2. Edificar la ruta hacia una sociedad equitativa e incluyente y Estrategias: 3.1.2. Fortalecer el desarrollo de capacidades de los integrantes de una sociedad con carencias, que permitan contribuir a incrementar su capacidad productiva y su calidad de vida y 3.2.1.\nGenerar programas de desarrollo comunitario por medio de procesos de participación social.\nLineas de Acción\n• Fomentar el acceso efectivo de las familias a sus derechos sociales, particularmente de aquellas en pobreza extrema, mediante políticas públicas coordinadas y concurrentes.\n• Potenciar la inversión conjunta de la sociedad organizada y de los órdenes de Gobierno, invirtiendo en proyectos de infraestructura social básica, complementaria y productiva.\nLas presentes Reglas se alinean a lo estipulado en el Programa Sectorial \"Desarrollo y Asistencia Social\"\n2016-2021, cuyo objetivo es atender a personas vulnerables, a través de desarrollar capacidades y habilidades de las familias con carencias alimentarias al proporcionar los apoyos necesarios que mejoren su calidad de vida y sus núcleos familiares, logrando fortalecer el tejido social en localidades vulnerables.\nEn consecuencia, la formulación de un programa y / o proyecto de desarrollo social exige conjugar armónicamente todos los elementos que lleven a la materialización de sus objetivos, estrategias, metas y evaluación de resultados. Por ello, se deben considerar en la introducción, los siguientes rubros:\nNaturaleza del Proyecto: Instalación de Tiendas de Abarrotes para Población Vulnerable, es un proyecto social el cual permitirá disminuir el impacto del desempleo temporal, como una de las alternativas para enfrentar dicho fenómeno y brindará a los hogares mitigar los impactos económicos sociales.\nQue dentro de los objetivos y estrategias que plantea el Ejecutivo Estatal, está abatir la marginación y el oportunidades que les permitan desarrollarse con independencia y plenitud; asimismo, plantea elevar la productividad de las personas para que cuenten con mejores opciones de empleo e ingreso, que les permitan reducir sus niveles de pobreza.\nDE OPERACIÓN, PARA EL EJERCICIO FISCAL 2019\nOrigen y Fundamento: Constitución Política de los Estados Unidos Mexicanos Constitución Política del\nSocial.\nObjetivos y Metas: Contribuir al gasto de las familias que habitan en los municipios y localidades de alta y muy alta marginación, por lo que se atenderán a 40 familias, para que tengan un negocio propio, así como crear fuentes de empleo y autoempleo que coadyuven en su ingreso familiar, como precedente de sustentabilidad laboral.\nUbicación Geográfica: Se atenderán a los 81 municipios que integran el Estado, dando prioridad a los municipios de alta y muy alta marginación.\nActividades a Realizar: Gestionar ante las instancias de Gobierno Federales y Estatales, los recursos financieros, para llevar a cabo la adquisición de los materiales, insumos y productos necesarios en la operatividad del proyecto; así mismo dar a conocer al Sistema Municipal DIF, las Reglas de Operación del proyecto vigentes y proporcionar de forma calendarizada los suministros de los apoyos.\nInstancias Participantes: La instancia ejecutora es el Sistema para el Desarrollo Integral de la Familia, a través de la Dirección de Asistencia Alimentaria y Desarrollo Comunitario, quien se coordinará con los\nSistemas Municipales DIF para llevar a cabo la ejecución y seguimiento del proyecto.\nPresupuesto de Inversión: Se tiene contemplado una inversión de $ 1'346,880.00 (Un millón trescientos cuarenta y seis mil ochocientos ochenta pesos 00/100 M.N.), recursos presupuestales que provienen del\nRamo 33.- Aportaciones Federales para Entidades y Municipios, específicamente del Fondo de\nAportaciones Múltiples (Asistencia Social).\nGlosario de Términos:\nSEDIF: Sistema para el Desarrollo Integral de la Familia.\nSEFINA: Secretaria de Administración y Finanzas.\nSEPLADER: Secretaria de Planeación y Desarrollo Regional.\nAsistencia Social: Conjunto de Acciones Tendientes a Modificar y Mejorar las Circunstancias de Carácter\nSocial que Impiden el Desarrollo Social del Individuo, así como la Protección Física, Mental y Social de\nPersonas en Estado de Necesidad.\nGrupos Vulnerables: Persona o grupo que por sus características de desventaja por edad, sexo, estado civil; nivel educativo, origen étnico, situación o condición física y/o mental; requieren de un esfuerzo\n1.3. DIAGNOSTICO\nDE OPERACIÓN, PARA EL EJERCICIO FISCAL 2019 localidades a lo largo de todo el país, provoca que la inestabilidad del empleo sea considerada como uno de los principales motivos de preocupación dentro de los hogares mexicanos; que la pérdida del empleo y la pobreza de los hogares, fundamentalmente porque la falta de empleo conduce a una importante disminución del capital económico familiar, mayor presión sobre los recursos naturales, asi como el abandono de la educación y el fomento al endeudamiento, estas afectaciones frecuentemente persisten aun cuando sus miembros se reintegran a las actividades productivas y remuneradas.\nQue la oferta laboral puede disminuir en algunas regiones del Estado a lo largo del año debido a emergencias o por efecto de los ciclos productivos, afectando principalmente a la población de escasos recursos que enfrenta periódicamente etapas con una grave disminución en sus ingresos y patrimonio.\nPor ello las políticas de empleo estatal deben considerar además del fomento a la creación de empleos formales e informales, la ejecución de acciones que permitan disminuir el impacto del desempleo temporal; una de las alternativas para enfrentar dicho fenómeno es la implementación del Programas y / o Proyectos que brinden a los hogares el auto emplearse y/o generar empleo que mitiguen los impactos económicos sociales que viven. Que el diseño del Proyecto Instalación de Tiendas de Abarrotes para Población\nVulnerable implica que los posibles beneficiarios y / o beneficiarias deben participar en proyectos de beneficio familiar o comunitario como corresponsabilidad obligatoria para recibir los apoyos que se les otorgue; dicho requisito no solamente promueve la participación activa de los ciudadanos en el desarrollo de sus hogares y comunidades, sino que además genera beneficios adicionales al resto de la sociedad.\nQue dentro de los objetivos y estrategias que plantea el Ejecutivo Estatal, está abatir la marginación y el rezago social que enfrentan los grupos sociales vulnerables para proveerles de igualdad en las oportunidades que les permitan desarrollarse con independencia y plenitud; asimismo, plantea elevar la productividad de las personas para que cuenten con mejores opciones de empleo e ingreso, que les permitan reducir sus niveles de pobreza.\nEl trabajo informal en países de economía subdesarrollada como México, está altamente asociada con el autoempleo, La carencia de plazas laborales que brinden una mayor seguridad salarial y mejores condiciones de trabajo orilla a casi el 60% de los buscadores de empleo a resolver por sí mismos su y de servicios.\nEn el estado existen 895, 157 hogares de los cuales el 293 086 están conformadas por Jefas de Familias que es el 33% y 602 071, se conforman por Jefes de Familia que en términos porcentuales le corresponde el 67% razón por la cual el Sistema para el Desarrollo Integral de la Familia beneficiará a 40 familias en estado de vulnerabilidad que habiten en Municipios o Localidades con alto o muy alto grado de marginación, del Proyecto.\nDE OPERACIÓN, PARA EL EJERCICIO FISCAL 2019\nEl proyecto que se propone, pretende dar utilidad a estos recursos para mejorar la situación en la que se encuentran las familias guerrerenses introduciendo una alternativa más, tanto de ocupación como de alimentación, con este se pretende contribuir en la atención de uno de los problemas identificados en este diagnóstico a través de:\nMisión: Proporcionar a las familias en desventaja económica el proyecto de Adquisición de Paquetes de\nAves Doble Propósito, como generador de autoempleo y / o empleo e ingresos a través de la prestación de un servicio.\nVisión: Elevar la calidad de vida de la familia mediante el desarrollo de proyectos generadores de autoempleo que coadyuven en el fortalecimiento de la economía familiar.\n2. DEPENDENCIA O ENTIDAD RESPONSABLE DEL PROGRAMA\nLa instancia ejecutora será el sistema para el Desarrollo Integral de la Familia, a través de la Dirección de\nAsistencia y Desarrollo Comunitario quien se co\n• Constitución Política de los Estados Unidos Mexicanos, (última reforma publicada en el Diario Oficial de la Federación el 27 de agosto de 2018). periódico oficial del Gobierno del Estado número 71, alcance I de fecha 04 de septiembre de 2018).\n• Ley General de Salud, (última reforma publicada en el Diario Oficial de la Federación de fecha 12 julio de 2018).\n• Ley de Asistencia Social, (última reforma publicada en el Diario Oficial de la Federación de fecha\n24 de abril 2018).\n• Ley General para la Inclusión de las Personas con discapacidad, (última reforma publicada en el\nDiario Oficial de la Federación de fecha 12 de julio 2018).\n• Ley No. 817 para las Personas con Discapacidad del Estado, (última reforma publicada en el\nPeriódico Oficial número 103, de fecha 26 de diciembre de 2014).\n• Ley 479 del Sistema para el Desarrollo Integral de la Familia, publicada en el periódico Oficial el martes 02 de agosto de 1983. el Periódico Oficial número 74, alcance I, de fecha 13 de septiembre de 2016). del 2015).\n• Plan Estatal de Desarrollo 2016 - 2021.\n• Programa Sectorial Desarrollo y Asistencia Social 20162021.\nDE OPERACIÓN, PARA EL EJERCICIO FISCAL 2019\n• Decreto Número 182 del Presupuesto de Egresos del Estado de Guerrero para el ejercicio fiscal\n2019.\n• Estrategia Local \"Guerrero Contigo\"\n• Reglamento Interno del Sistema para el Desarrollo Integral de la Familia del Estado de Guerrero.\n• Manual de Organización del DIF Guerrero.\n• Y todos aquellos Ordenamientos Normativos Aplicables.\n3. OBJETIVOS Y ALCANCES\n3.1. GENERAL\nContribuir al gasto familiar de la población que vive en condiciones de pobreza y / o que no cuente con empleo a través de la Instalación de Tiendas de Abarrotes para la Población Vulnerable, para que tengan un negocio propio, así como crear fuentes de empleo y autoempleo que coadyuven en su ingreso familiar a 40 familias, que habiten en Municipios o Localidades con alto o muy alto grado de marginación.\n3.2. ESPECÍFICOS\n• Generar una alternativa de autoempleo como precedente de sustentabilidad laboral.\n• Incrementar el ingreso familiar.\n• Brindar un servicio básico.\n3.3. ALCANCES\nLa operación o ejecución del proyecto surge para mitigar y garantizar el empleo y/o autoempleo atendiendo al derecho al trabajo y a la alimentación de la población que viven en situación de pobreza y/o sin empleo a través de la Instalación de 40 Tiendas de Abarrotes, mejorando su economía familiar y comunitaria. alto grado de marginación, considerando la suficiencia presupuestal para el ejercicio vigente y los criterios de focalización y priorización del Proyecto.\n4. METAS FÍSICAS\nSe beneficiaran aproximadamente a 40 familias que habiten en municipios y / o Localidades de alta y muy alta marginación con vulnerabilidad social; dicho apoyo es entregado directamente al beneficiario en puntos sedes ubicados en su Municipio correspondiente.\n5. PROGRAMACIÓN PRESUPUESTAL\nDE OPERACIÓN, PARA EL EJERCICIO FISCAL 2019\nDictamen y Decreto número 182 del Presupuesto de Egresos del Estado de Guerrero para el Ejercicio\nFiscal 2019, se señala que se ejercerán los recursos bajo una política de gasto público, que permita dar cumplimiento a lo que globalmente prevén los ejes rectores del Plan Estatal de Desarrollo 2016-2021.\nEl proyecto opera de acuerdo a su presupuesto anual autorizado, recursos presupuestales provenientes del Ramo 33.-Aportaciones Federales para Entidades y Municipios, específicamente del Fondo de\nAportaciones Múltiples (Asistencia Social), para Instalación de Tiendas de Abarrotes para la Población\nVulnerable por un monto de $ 1,346,880.00 (un millón trescientos cuarenta y seis mil ochocientos ochenta pesos 00/100 M.N.), el cual tiene un costo promedio por beneficiario y / o beneficiaria de $ 33,672.00\n(Ciento treinta y tres mil seiscientos setenta y dos pesos 00/100 M.N.).\nCRONOGRAMA FINANCIERO\nPRES. AUT. ENERO FEBRERO MARZO ABRIL MAYO\n1,346,880.00 0.00 0.00 0.00 1,346,880.00 0.00\nNOTA: PUEDE EXISTIR VARIACIÓN EN RELACION A LO APROBADO POR EL DOF. Y/O POR LAS NECESIDADES PROPIAS DEL SEDIF, POR OTRA PARTE\nLA MINISTRACIÓN ÚNICAMENTE SE SOLICITA EN EL MES DE ABRIL.\n6. REQUISITOS Y PROCEDIMIENTOS DE ACCESO\n6.1. DIFUSIÓN\nEl sistema para el Desarrollo Integral de la Familia a través de los diferentes medios de comunicación y de las redes sociales da conocer cada uno de los diferentes programas de asistencia social que ejecuta y opera en coordinación con las diferentes Direcciones que integran el Sistema como son; Programas\nAlimentarios, Proyectos Asistenciales, de Bienestar Social y Desarrollo Comunitario; cuyos requisitos se encuentran en las oficinas del Sistema ubicadas en Av. Rene Juárez Cisneros, Colonia Ciudad de los\nServicios y ubicada Av. Gabriel Leyva s/n esq. Ruffo Figueroa, Col. Burócratas, C.P. 39090, Chilpancingo, Guerrero, con un horario de atención de 8:00 am a 3:00 pm y/o los teléfonos 01(747) 4725595, 01(747)47256 00, 01(747)47 25672 ext 1151 Y 1159. Así mismo al correo electrónico: alimentariadif@prodigy.net.mx, subdireccionalimentaria@prodigy.net.mx\nSe brinda atención a los 81 municipios del Estado, teniendo una capacidad de atención de niñas, niños y adolescentes, mujeres embarazadas, mujeres en periodo de lactancia, personas con discapacidad, adultos mayores y personas vulnerables por ingresos.\n6.2. REQUISITOS AL ACCESO\nDE OPERACIÓN, PARA EL EJERCICIO FISCAL 2019\n• Los interesados deberán presentar oficio de solicitud en las instalaciones del DIF Guerrero en escrito libre al Centro de Rehabilitación Integral Guerrero, con domicilio en Boulevard Lic. René\nJuárez Cisneros S/N, Col. Ciudad de los Servicios, Chilpancingo, dirigido a la Presidenta o Director\nGeneral del DIF para ser considerado dentro del Proyecto, anexando copia fotostática de la siguiente documentación:\n1. Credencial de elector.\n2. CURP.\n• La solicitud es turnada a la Dirección de Asistencia Alimentaria y Desarrollo Comunitario para su atención, quien en un plazo no mayor a 60 días hábiles dará respuesta a la misma.\n• La Dirección de Asistencia Alimentaria y Desarrollo Comunitario aplica estudio socioeconómico al solicitante para determinar si será beneficiario del proyecto.\n• Se realiza la entrega del apoyo de manera personal o en el municipio beneficiado, solicitándole al beneficiario firme acta de donación que acredite la entrega\n6.3. PROCEDIMIENTO DE ACCESO\nLa operación se realiza a través de la demanda ciudadana y / o peticiones que se reciben en las instalaciones del Sistema para el Desarrollo Integral de la Familia o directamente a la Presidenta del\nSistema Estatal; el Proyecto, surge por la necesidad de atender el problema del desempleo y atendiendo la carencia alimentaria, el cual busca garantizar el derecho a la alimentación atendiendo a los 81 municipios que conforman nuestro Estado, dando prioridad a los municipios de alta o muy alta marginación\nSerán beneficiados con el Proyecto, los solicitantes que cumplan con las siguientes características:\n1. personas con discapacidad, adultos mayores y personas vulnerables por ingresos.\n2. Habitar en Municipios o Localidades de alto o muy alto grado de marginación.\nToda persona podrá conocer el estado de su trámite, y su aceptación o no al proyecto, de acuerdo con las reglas de operación vigentes. Las beneficiarias y / o beneficiarios tendrán derecho a ser tratado con\n• Recibir la información necesaria de manera clara y oportuna para participar en el programa.\n• Un trato digno y respetuoso o por tuno con calidad y equitativo sin discriminación alguna.\n• Reserva y privacidad de su información personal.\nUna vez hayan sido beneficiados y/o beneficiadas con este apoyo los interesados pasaran a formar parte del Padrón de beneficiarios, el cual será de carácter público, siendo reservados sus datos personales, de acceso al proyecto podrá ser a solicitud de la persona interesada, asimismo toda persona podrá conocer el estado de su trámite, y su aceptación o no al proyecto.\nDE OPERACIÓN, PARA EL EJERCICIO FISCAL 2019\n6.4. REQUISITOS DE PERMANENCIA, CAUSALES DE BAJA O SUSPENSIÓN TEMPORAL.\nPermanencia: Visita de seguimiento a los beneficiarios, con la finalidad de constatar la situación socioeconómica y seguimiento a las necesidades prioritarias, la población sujeta de atención deberá cumplir con:\n• Dar cumplimiento a las Reglas de Operación del Proyecto.\n• Utilizar los apoyos otorgados de manera adecuada y para los fines a los que se les otorgan y con que fueron autorizados evitando cualquier uso distinto de la misma. Los cuales en ningún caso podrán emplearse para propósitos de proselitismo político, religioso o comercial, ni para ningún otro fin distinto al establecido en las Reglas de operación del programa social.\n• Permitir visita de verificación con la finalidad de validar la información proporcionada en sus expedientes correspondientes.\n• Facilitar los trabajos de supervisión, en cualquier momento después de haber recibido el apoyo\nLos beneficiarios del proyecto de instalación de tiendas de abarrotes para la población vulnerable, que incumplan en la Disposiciones Normativas de estas Reglas de Operación, perderán las prerrogativas que dichas disposiciones establecen.\n6.5. MODOS DE ENTREGA DEL BENEFICIO\nLos apoyos serán distribuidos directamente a los beneficiarios y / o beneficiarias en puntos sedes de cada\nRegión del Estado, o en su caso, podrán acudir a recoger el apoyo a las oficinas de la Dirección de\nAsistencia Alimentaria y Desarrollo Comunitario, dicho apoyo consiste en el otorgamiento de:\n✓ caja de Huevo con 360 piezas.\n✓ 1 bulto de Azúcar estándar 50 kilo.\n✓ 1 bulto de Frijol negro a granel 50 kilos.\n✓ 1 bulto de Arroz a granel 50 kilos.\n✓ paquetes de Sal de mesa con 20 piezas, en Bolsa de 1 kg.\n✓ 2 cajas con 12 piezas de Aceite Vegetal Comestible de 945 ml.\n✓ 2 caja de Detergente en polvo de 500 grs. con 20 piezas.\n✓ 1 kg. Canela Estándar.\n✓ 1 caja con 24 pzas, de Sardina en salsa de Tomate lata de 425 grs.\n✓ 1 paquete de Cerillos de 50 cajitas\n✓ 1 caja de Jugo de frutas tetra pack de 1/4 con 27 pzas\n✓ 1 caja de Jugo de frutas tetra pack de 1/8 con 27 pzas\n✓ 3 cajas exhibidoras de café de olla f 2 caja de Jabón en barra de 350 grs. con 25 piezas\n✓ 1 bulto de Harina estándar de 50 kg. f 1 caja de Mayonesa No. 4 con 24 frascos.\n✓ 2 cajas de Pasta para sopa de sobre de 200 grs. con 20 paquetes c/u\n✓ 1 caja de Galletas tipo \"Marías\" con 20 rollos c/u\n✓ 2 cajas de formula láctea tetra pack de 1 lt. con 12 litros c/u\n✓ 2 cajas de Galletas tipo \"Napolitanas\" con 20 rollos c/u\n✓ 1 caja Galletas tipo \"mexicanas\" con 20 rollo c/u\nDE OPERACIÓN, PARA EL EJERCICIO FISCAL 2019\n✓ 1 colchón de Papel higiénico 12 paq c/4 rollos\n✓ 1 caja de blanqueador de 500 ml. Con 20 pzas. c/u\n✓ 2 caja de shampoo en sobre de 900 ml. Con 12 pzas. c/u\n✓ 2 cajas de chile jalapeño en rajas verdes en lata de 105 grs.\n✓ 2 cajas de suavizante de 850 ml. Con 12 pzas.\n✓ f 2 cajas de limpiador fresco pinol de 500 ml. Con 20 pzas. c/u\n✓ 2caja de Jabón neutro de 180 grs.\n✓ 2 cajas de frascos de mermelada de fresa de 250 grs.\n✓ 2 cajas de lechera de 250 grs. con 24 pzas. c/u\n✓ 2 cajas deservilletas con paquetes de 100 pzas.\n✓ 2 cajas de café soluble regular de 50 grs.\n✓ 2 cajas de atún en aceite de 140 grs.\n✓ 2 cajas de nor suiza\n✓ 2 cajas de espagueti corto de 220 grs.\n✓ 3 cajas de crema dental de 75 ml.\n✓ 2 paquetes de cepillo dental de 35 pzas. c/u\n✓ 2 cajas de toallas femeninas\n✓ 2 cajas de chocolate de mesa de 360 grs.\n✓ 2 cajas de galletas napolitanas con 20 rollos c/u\n✓ 1 caja de galletas mexicanas con 20 rollos c/u\n✓ 1 colchón de papel higiénico en paquetes de 4 rollos /12\n✓ 1 Bascula de 5 kg. digital f 3 Anaqueles de 4 entrepaños\n7. PROCEDIMIENTOS DE INSTRUMENTACIÓN\n7.1. OPERACIÓN\nEl Sistema Estatal DIF tendrá las siguientes responsabilidades:\na) Gestionar ante las instancias de Gobierno Federales y Estatales, los recursos financieros, para llevar a cabo la adquisición de los materiales, insumos y productos necesarios en la operatividad de los programas y / o proyectos.\nb) Dar a conocer al Sistema Municipal DIF, Reglas de Operación del proyecto de Instalación de\nTiendas de Abarrotes para la Población Vulnerable, vigentes.\nc) Proporcionar al Sistema Municipal DIF, de forma calendarizada los suministros de productos de los\nProgramas.\nd) Vigilar y verificar que los proyectos sean otorgados directamente a los beneficiarios y / o beneficiarias.\ne) Proporcionará almacenes regionales, para guarda, custodia de los productos que integran los proyectos; que contaran con personal capacitado para su manejo y distribución.\nf) Actualizar y profesionalizar los conocimientos del personal operativo del Sistema Estatal DIF y del\nSistema Municipal DIF, a través de capacitaciones a fin de contar con las herramientas básicas para la operatividad de los programas y / o proyectos.\nDE OPERACIÓN, PARA EL EJERCICIO FISCAL 2019\ng) Recepcionar de los Sistema Municipal DIF la información requerida para comprobación de los programas y / o proyectos con base a las Reglas de Operación vigentes.\nh) Procesará la información a que se refiere el punto anterior y remitirla de acuerdo al calendario de entregas, a fin de comprobar los recursos canalizados al municipio.\ni) Elaborar a inicio de cada ejercicio fiscal, el Proyecto de los Programas y documentos que contemplarán la aplicación y operatividad de los proyectos con los importes correspondientes.\nSerán obligaciones del Sistema Municipal DIF las siguientes: a. El Sistema Municipal DIF se obliga a cumplir con la implementación de los Proyectos productivos que se tienen establecidos en la Subdirección de Desarrollo Comunitario y en las reglas de operación que regula el proyecto; salvo la pena de incurrir en responsabilidades administrativas. b. Determinará de manera conjunta la población potencial de su municipio tomando en consideración el tipo de beneficiario de todos los programas a solicitar, con esta información y en coordinación con el Sistema Estatal DIF, atenderá a la población que se encuentre en situación vulnerabilidad de localidades de alta y muy alta marginación. c. Integrará y enviara los expedientes asi como los padrones físicos de los beneficiarios y / o beneficiarias de los Programas y / o Proyectos solicitados a la Subdirección de Desarrollo\nComunitario, de igual forma informará a los beneficiarios que los datos personales recabados serán protegidos en términos de los principios de protección de datos personales contenidos en la ley de la materia y demás normativas aplicables. d. Integrará los padrones de los beneficiarios y / o beneficiarias con sus respectivos expedientes de los programas y / o proyectos objeto de estas Reglas. Remitiendo al Sistema Estatal DIF el padrón físico, digital y expedientes correspondiente comprobación de los mismos. e. Designar personal del Sistema Municipal DIF que realice las funciones de seguimiento y supervisión de los Programas y / o Proyecto. f. Participar en acciones de apoyo logístico para la distribución de los programas y / o Proyecto. g. Es competencia del Sistema Municipal DIF, trasladar los materiales que corresponden a los programas, a las comunidades beneficiadas, en una unidad vehicular. Será responsabilidad del municipio el resguardo y el buen uso de los materiales que se recepcionen, en el entendido que, de existir algún desvío de los mismos, el Sistema Estatal DIF cancelará inmediatamente el suministro del programa y / o Proyecto e iniciará un procedimiento ante la contraloría interna del sistema estatal, para determinar las sanciones a que sean acreedores.\nPara garantizar la atención completa del beneficiario, se realizan las acciones:\n• Determinar el tipo de proyectos a implementar\n• Adquisición de los materiales y que cumplan con las Especificaciones Técnicas de Calidad.\n• Asegurar el correcto almacenamiento y distribución de los materiales, hasta su entrega al beneficiario.\n• Focalizar los beneficiarios de los Programas con base a los indicadores socioeconómicos.\n• Coordinar la entrega de apoyos a la población beneficiada con los Sistemas Municipales DIF, a través de convenios de colaboración y conforme a lo establecido en las Reglas de Operación.\nDE OPERACIÓN, PARA EL EJERCICIO FISCAL 2019\n• Promover la participación social a través de los Sistema Municipal DIF en la formación de comités entre la población beneficiaria, para la recepción, entrega y vigilancia de los apoyos.\n• Promover la formación y operación de grupos de contraloria social para el seguimiento del proyecto.\n• Fortalecer la operación de los programas y / o proyectos promoviendo la inclusión general de la sociedad.\nLos datos de los beneficiarios, así como la información generada y administrada se regirán por la Ley\nNúmero 207 de Transparencia y Acceso a la Información Pública del Estado de Guerrero.\nAsí mismo el proyecto, contempla las herramientas necesarias para desempeñar el autoempleo, mejorando su economía familiar y comunitaria mediante el otorgamiento de:\n✓ caja de Huevo con 360 piezas.\n✓ 1 bulto de Azúcar estándar 50 kilo.\n✓ 1 bulto de Frijol negro a granel 50 kilos.\n✓ 1 bulto de Arroz a granel 50 kilos.\n✓ paquetes de Sal de mesa con 20 piezas, en Bolsa de 1 kg.\n✓ 2 cajas con 12 piezas de Aceite Vegetal Comestible de 945 ml.\n✓ 2 caja de Detergente en polvo de 500 grs. con 20 piezas.\n✓ 1 kg. Canela Estándar.\n✓ 1 caja con 24 pzas, de Sardina en salsa de Tomate lata de 425 grs.\n✓ 1 paquete de Cerillos de 50 cajitas\n✓ 1 caja de Jugo de frutas tetra pack de 1/4 con 27 pzas\n✓ 1 caja de Jugo de frutas tetra pack de 1/8 con 27 pzas\n✓ 3 cajas exhibidoras de café de olla\n✓ 2 caja de Jabón en barra de 350 grs. con 25 piezas\n✓ 1 bulto de Harina estándar de 50 kg.\n✓ 1 caja de Mayonesa No. 4 con 24 frascos.\n✓ 2 cajas de Pasta para sopa de sobre de 200 grs. con 20 paquetes c/u\n✓ 1 caja de Galletas tipo \"Marías\" con 20 rollos c/u\n✓ 2 cajas de formula láctea tetra pack de 1 lt. con 12 litros c/u\n✓ 2 cajas de Galletas tipo \"Napolitanas\" con 20 rollos c/u\n✓ 1 caja Galletas tipo \"mexicanas\" con 20 rollo c/u\n✓ 1 colchón de Papel higiénico 12 paq c/4 rollos\n✓ 1 caja de blanqueador de 500 ml. Con 20 pzas. c/u\n✓ 2 caja de shampoo en sobre de 900 ml. Con 12 pzas. c/u\n✓ 2 cajas de chile jalapeño en rajas verdes en lata de 105 grs.\n✓ 2 cajas de suavizante de 850 ml. Con 12 pzas.\n✓ 2 cajas de limpiador fresco pinol de 500 ml. Con 20 pzas. c/u\n✓ 2caja de Jabón neutro de 180 grs.\n✓ 2 cajas de frascos de mermelada de fresa de 250 grs.\n✓ 2 cajas de lechera de 250 grs. Con 24 pzas. c/u\nDE OPERACIÓN, PARA EL EJERCICIO FISCAL 2019\n✓ 2cajas de servilletas con paquetes de 100 pzas.\n✓ 2 cajas de café soluble regular de 50 grs.\n✓ 2 cajas de atún en aceite de 140 grs.\n✓ 2 cajas de nor suiza\n✓ 2 cajas de espagueti corto de 220 grs.\n✓ 3 cajas de crema dental de 75 ml.\n✓ 2 paquetes de cepillo dental de 35 pzas. c/u\n✓ cajas de toallas femeninas\n✓ 2 cajas de chocolate de mesa de 360 grs.\n✓ 2 cajas de galletas napolitanas con 20 rollos c/u\n✓ 1 caja de galletas mexicanas con 20 rollos c/u\n✓ 1 colchón de papel higiénico en paquetes de 4 rollos /12\n✓ 1 Bascula de 5 kg. Digital\n✓ 3 Anaqueles de 4 entrepaños\nComo objetivo a corto plazo, se dará continuidad a la entrega de cada apoyo solicitado, cubriendo cada uno los requisitos solicitados en las presentes reglas de operación, mismo que será otorgado en su municipio de residencia o en su caso en el almacén general del Sistema Estatal a la población vulnerable, los tramites y formatos a realizar son gratuitos.\n7.2. GASTOS DE OPERACIÓN\nEl presupuesto asignado a este programa, es a través del Fondo de Aportaciones Múltiples, no contempla\nGastos de Operación.\n8. TRANSPARENCIA\n8.1. DIFUSIÓN\nLa Dirección de Asistencia Alimentaria y Desarrollo Comunitario, quien es la responsable de la operación del proyecto difundirá a través de diferentes medios de comunicación; trípticos, periódico, redes sociales en las cuales se dará a conocer la información relacionada con las características del proyecto Instalación de Tiendas de Abarrotes para la Población Vulnerable. de las autoridades locales; la información del proyecto se dará a conocer en la página de internet del beneficiario; las copias de los expedientes de los beneficiarios y / o beneficiarias estarán disponibles oportunamente para su consulta en las oficinas del Sistema ubicadas en Av. Rene Juárez Cisneros, Colonia\nCiudad de los Servicios y Av. Gabriel Leyva s/n esq. Ruffo Figueroa, Col. Burócratas, C.P. 39090, Chilpancingo, Guerrero; por otra parte la papelería, documentación oficial, así como la publicidad y promoción del Proyecto, deberán incluir la leyenda descrita en el apartado de \"Blindaje Electoral\".\nDE OPERACIÓN, PARA EL EJERCICIO FISCAL 2019\nLa información de montos y beneficiarios deberá ser publicada en los términos de la Ley No. 207 de\nUna vez autorizadas estas Reglas de Operación, por las instancias correspondientes, estarán disponibles para su consulta en las Oficinas de la Dirección de Asistencia Alimentaria y Desarrollo Comunitario, quien es la responsable directo de la ejecución, a través de la Subdirección de Desarrollo Comunitario, ubicada\nAv. Gabriel Leyva s/n esq. Ruffo Figueroa, Col. Burócratas, C.P. 39090, Chilpancingo, Guerrero., a los teléfonos (01747) 47 2 55 95, (01747) 47 2 56 00, (01747) 47 2 56 72 ext. 1155. Así mismo al correo electrónico: subdescomdif@prodigy.net.mx\nEstas Reglas de Operación, además de su publicación en el Periódico Oficial del Gobierno del Estado, estarán disponibles para su consulta en las Oficinas de la Dirección de Asistencia Alimentaria y Desarrollo\nComunitario, así como en la página electrónica del Sistema para el Desarrollo Integral de la Familia http://www.dif.guerrero.gob.mx y en la página web del Portal del Gobierno del Estado, https://www.guerrero.gob.mx\n8.2. BLINDAJE ELECTORAL\nLa operación y ejecución de los recursos estatales destinados al Proyecto, deberán observar y atender las medidas que emita la Secretaría de Contraloría y Transparencia Gubernamental, para coadyuvar a que éstos, no sean utilizados con fines políticos La operación y ejecución de los recursos estatales destinados al Programa, deberán observar y atender las medidas que emita la Secretaría de Contraloría y\nTransparencia Gubernamental, para coadyuvar a que éstos, no sean utilizados con fines políticos, por lo que la papelería, documentación oficial, así como la publicidad y promoción del Programa deberán incluir la siguiente leyenda:\n\"Este Programa es público, ajeno a cualquier partido político. Queda prohibido el uso para fines distintos a los establecidos en el proyecto\"\n8.3. SUPERVISIÓN Y CONTROL\nLa Dirección de Asistencia Alimentaria y Desarrollo Comunitario deberá reportar mensualmente a la\nDirección de Planeación del DIF Guerrero, las acciones ejercidas y los resultados obtenidos, quien a su vez reportará trimestralmente a la Secretaria de Finanzas y Administración, Secretaria de Planeación y\nDesarrollo Regional y la Secretaria de Contraloría y Transparencia Gubernamental, informes sobre el presupuesto ejercido establecidos por el Consejo Nacional de Armonización Contable (CONAC) dichos trimestre.\nLos padrones de los beneficiarios serán requisitados por los Sistemas Municipales DIF, remitiendo para su integración de los Padrones de Beneficiarios de los 81 municipios de la Entidad mismo que serán remitidos a las instancias o dependencias operadoras.\nDE OPERACIÓN, PARA EL EJERCICIO FISCAL 2019\n8.4. MECANISMOS DE EVALUACIÓN E INDICADORES\n8.4.1. EVALUACIÓN correspondientes.\n8.4.2. INDICADORES\nMatriz de Indicadores de Resultados\nDetalle de la Matriz 2019\nRamo: 5 - Sector Paraestatal\nUnidad Responsable: P-46 -O.P.D. Sistema para el Desarrollo Integral de la Familia\nClave y Modalidad del Pp: S- Sujetos a Reglas de Operación E- Prestación de Servicios Públicos\nDenominación del Pp: S01\nE01\nClasificacion Funcional:\nFinalidad: 2. Desarrollo Social\nFunción: 2.3 SALUD\n2.4 RECREACIÓN, CULTURA Y OTRAS MANIFESTACIONES SOCIALES\n2.6. PROTECCIÓN SOCIAL\nSubfunción: 2.3.2 Prestación de Servicios de Salud 2.6.5 Alimentación y Nutrición a la Persona 2.6.6 Apoyo Social para la Vivienda\n2.4.2 Cultura 2.6.7 Indígenas\n2.6.1 Enfermedad e Incapacidad 2.6.8 Otros Grupos Vulnerables\n2.6.2 Edad Avanzada 2.6.9 Otros de Seguridad\n2.6.3 Familia e Hijos Social y Asistencia Social\n2.6.4 Desempleo\nResumen narrativo Orden Supuestos\nAsistencia Social sociales\nFrecuencia Línea\nUnidad de Tipo de Meta Medios de\nIndicador Método de Cálculo de Base\nMedida Indicador 2018 Verificación\nMedición 2017\nDE OPERACIÓN, PARA EL EJERCICIO FISCAL 2019\nPorcentaje de (Población Personas Anual Estratégico 70% 90% Padrón de población atendida/Total de beneficiarios vulnerable atendida población vulnerable)*100\nPropósito\nResumen narrativo Orden Supuestos\nLas obras y/o acciones\nFortalecer las acciones de desarrollo Ampliación de cobertura poblacional contribuyen a mejorar la social y Humano de los programas sociales calidad de vida\nFrecuencia Línea\nUnidad de Tipo de Meta Medios de\nIndicador Método de Cálculo de Base\nMedida Indicador 2018 Verificación\nMedición 2017\n(Programas\nPorcentaje de implementados en\nOficios de\nProgramas 2017 / Programas Programas Anual Estratégico 70% 90% autorización implementados implementados en\n2018)* 100\nComponente\nResumen narrativo Orden Supuestos\nFortalecer el nivel nutricional de la Contribuir a mejorar la dieta de población con mayor índice de las niñas y niños de nivel marginación, poniendo énfasis en los primaria y prescolar, así como\nAsistencia Social grupos de alto riesgo, a fin de mejorar la implementar Proyectos calidad en la dieta y apoyar el gasto Productivos, de Economía y familiar. Traspatio\nFrecuencia Línea\nUnidad de Tipo de Meta Medios de\nIndicador Método de Cálculo de Base\nMedida Indicador 2018 Verificación\nMedición 2017\n(Número de despensasdotaciones\nProporción de distribuidas en el despensasperiodo de acuerdo a dotaciones los criterios de Avance Físicoentregadas que Porcentaje Trimestral Estratégico 0% 100% calidad nutricia de los Financiero cumplen con los\nLineamientos de la criterios de calidad\nEIASA / Número total nutricia de apoyos entregados en el periodo) * 100\nDE OPERACIÓN, PARA EL EJERCICIO FISCAL 2019\nPorcentaje de\n(Total de apoyos apoyos de otorgados / total de Avance FísicoDesarrollo Porcentaje Semestral Estratégico 0% 100% apoyos programados) Financiero\nComunitario\n* 100 otorgados\nResumen narrativo Orden Supuestos\nElevar la calidad de vida de las familias y comunidades marginadas, a través de su Beneficiar a los grupos participación activa en programas de Descendente vulnerables para su desarrollo asistencia social y apoyo jurídico, que les físico y mental permita alcanzar su desarrollo integral\nFrecuencia Línea\nUnidad de Tipo de Meta Medios de\nIndicador Método de Cálculo de Base\nMedida Indicador 2018 Verificación\nMedición 2017\n(Total de apoyos\nPorcentaje de otorgados / total de Avance Físicoapoyos Sociales Porcentaje Semestral Estratégico 0% 100% apoyos programados) Financiero otorgados\n* 100\nResumen narrativo Orden Supuestos\nAtender y apoyar a las personas con Los servicios otorgados discapacidad, mediante servicios contribuyen a la rehabilitación\nDescendente asistenciales y de rehabilitación, para de las personas con lograr su incorporación al entorno social discapacidad\nFrecuencia Línea\nUnidad de Tipo de Meta Medios de\nIndicador Método de Cálculo de Base\nMedida Indicador 2018 Verificación\nMedición 2017\n(Total de servicios\nPorcentaje de otorgados / total de Avance FísicoPorcentaje Semestral Estratégico 0% 100%\nServicios otorgados servicios Financiero programados) * 100\nResumen narrativo Orden Supuestos\nAdministración interna y servicios Se recibe en tiempo las generales del DIF Ascendente comprobaciones por parte de los ejecutores del Gasto.\nComponente\nResumen narrativo Orden Supuestos con mayor índice de marginación, poniendo niñas y niños de nivel primaria y énfasis en los grupos de alto riesgo, a fin de Asistencia Social prescolar, así como implementar\nProyectos Productivos, de familiar. Economía y Traspatio\nDE OPERACIÓN, PARA EL EJERCICIO FISCAL 2019\nFrecuencia Línea\nUnidad de Tipo de Meta Medios de\nIndicador Método de Cálculo de Base\nMedida Indicador 2018 Verificación\nMedición 2017\n(Número de despensasdotaciones\nProporción de distribuidas en el despensasperiodo de acuerdo a dotaciones los criterios de Avance Físicoentregadas que Porcentaje Trimestral Estratégico 0% 100% calidad nutricia de los Financiero cumplen con los\nLineamientos de la criterios de calidad\nEIASA / Número total nutricia de apoyos entregados en el periodo) * 100\nPorcentaje de\n(Total de apoyos apoyos de otorgados / total de Avance FísicoDesarrollo Porcentaje Semestral Estratégico 0% 100% apoyos programados) Financiero\nComunitario\n* 100 otorgados\nResumen narrativo Orden Supuestos\nElevar la calidad de vida de las familias y comunidades marginadas, a través de su Beneficiar a los grupos participación activa en programas de Descendente vulnerables para su desarrollo asistencia social y apoyo jurídico, que les físico y mental permita alcanzar su desarrollo integral\nFrecuencia Línea\nUnidad de Tipo de Meta Medios de\nIndicador Método de Cálculo de Base\nMedida Indicador 2018 Verificación\nMedición 2017\n(Total de apoyos\nPorcentaje de otorgados / total de Avance Físicoapoyos Sociales Porcentaje Semestral Estratégico 0% 100% apoyos programados) Financiero otorgados\n* 100\nResumen narrativo Orden Supuestos\nAtender y apoyar a las personas con Los servicios otorgados discapacidad, mediante servicios contribuyen a la rehabilitación\nDescendente asistenciales y de rehabilitación, para de las personas con lograr su incorporación al entorno social discapacidad\nFrecuencia Línea\nUnidad de Tipo de Meta Medios de\nIndicador Método de Cálculo de Base\nMedida Indicador 2018 Verificación\nMedición 2017\n(Total de servicios\nPorcentaje de otorgados / total de Avance FísicoPorcentaje Semestral Estratégico 0% 100%\nServicios otorgados servicios Financiero programados) * 100\nDE OPERACIÓN, PARA EL EJERCICIO FISCAL 2019\nResumen narrativo Orden Supuestos los ejecutores del Gasto.\nFrecuencia Línea\nUnidad de Tipo de Meta Medios de\nIndicador Método de Cálculo de Base\nMedida Indicador 2018 Verificación\nMedición 2017\n(Numero de\nPorcentaje de comprobaciones comprobaciones entregadas en Avance FísicoPorcentaje Semestral Estratégico 0% 100% entregadas a tiempo/Total de Financiero tiempo. comprobaciones realizadas)*100\nActividades\nResumen narrativo Orden Supuestos\nDeterminar el nivel de atención alimentaria a población en condiciones Beneficiar a los grupos\nAsistencia Social emergencia afectada por Desastres vulnerables para su desarrollo\nNaturales. físico y mental\nFrecuencia Línea\nUnidad de Tipo de Meta Medios de\nIndicador Método de Cálculo de Base\nMedida Indicador 2018 Verificación\nMedición 2017\nAtención\nAlimentaria en Mpios.\nEn Emergencia =\nMpios. con\nDeclaracion de\nAcceso Alimentario Avance Físicoemergencia Personas Anual Estratégico 100 100% en Riesgo Financiero atendidos / Total de\nMpios. con\nDeclaratoria de emergencia en la\nEntidad.\nResumen narrativo Orden Supuestos\nDeterminar el porcentaje de desnutrición Los menores beneficiados, alimentarios. con calidad nutricia\nFrecuencia Línea\nUnidad de Tipo de Meta Medios de\nIndicador Método de Cálculo de Base\nMedida Indicador 2018 Verificación\nMedición 2017\nDE OPERACIÓN, PARA EL EJERCICIO FISCAL 2019\n(Menores beneficiados que tienen algún grado de\nDesnutrición / Total Avance FísicoDesnutrición Infantil Menores Anual Estratégico 22% 20% de Menores Financiero beneficiados con insumos alimentarios) * 100\nResumen narrativo Orden Supuestos\nDeterminar el porcentaje de obesidad en\nDisminuyen los índices de los menores beneficiados con insumos Descendente obesidad infantil alimentarios.\nFrecuencia Línea\nUnidad de Tipo de Meta Medios de\nIndicador Método de Cálculo de Base\nMedida Indicador 2018 Verificación\nMedición 2017\nPorcentaje de\nObesidad en\nMenores = Menores\nBeneficiados que\nAvance FísicoObesidad Infantil tienen algún grado de Menores Anual Estratégico 15% 11%\nFinanciero\nObesidad / Total de\nMenores\nBeneficiados con insumos Alimenticios\nResumen narrativo Orden Supuestos\nDeterminar el porcentaje de atención de los menores en la distribución de insumos Ascendente alimentarios.\nFrecuencia Línea\nUnidad de Tipo de Meta Medios de\nIndicador Método de Cálculo de Base\nMedida Indicador 2018 Verificación\nMedición 2017\nPorcentaje de\nObesidad en\nMenores = Menores\nAcceso Alimentario Beneficiados que\nAvance Físicoen Menores no tienen algún grado de Menores Anual Estratégico 100% 100%\nFinanciero\nEscolarizados Obesidad / Total de\nMenores\nBeneficiados con insumos Alimenticios\nResumen narrativo Orden Supuestos\nDE OPERACIÓN, PARA EL EJERCICIO FISCAL 2019\nPermite determinar el nivel de atención a municipios con alto índice de carencia La población vulnerable, alimentaria, a fin de propiciar el Descendente dispone de una alimentación con mayor vulnerabilidad en la entidad.\nFrecuencia Línea\nUnidad de Tipo de Meta Medios de\nIndicador Método de Cálculo de Base\nMedida Indicador 2018 Verificación\nMedición 2017\nMpios con Alto Indice de Carencia\nAlimentaria No\nAcceso a la Avance FísicoAtendidos = Mpios. Municipio Anual Estratégico 0 100%\nAlimentación Financiero con A.I.C.A. no atendidos / Total de\nMpios. en la Entidad.\nResumen narrativo Orden Supuestos\nLa población beneficiada recibe\nConocer la cantidad de personas apoyos para fortalecer la\nAscendente beneficiadas con los Proyectos economía, alimentación y de\nProductivos de Economía y Traspatio sus familias\nFrecuencia Línea\nUnidad de Tipo de Meta Medios de\nIndicador Método de Cálculo de Base\nMedida Indicador 2018 Verificación\nMedición 2017\nÍndice de avance (beneficiarios en la entrega de atendidos / Avance FísicoPersonas Anual Estratégico 80% 100%\nProyectos Beneficiarios Financiero\nProductivos programados) * 100\nResumen narrativo Orden Supuestos\nPoblación que requiere algún tipo de\nLa población vulnerable tiene servicio médico y que carece de servicio Ascendente acceso a los servicios de salud medico\nFrecuencia Línea\nUnidad de Tipo de Meta Medios de\nIndicador Método de Cálculo de Base\nMedida Indicador 2018 Verificación\nMedición 2017\nPoblación sin acceso\nPoblación sin a los servicios de acceso a los Avance Físicosalud = Población Personas Anual Estratégico 80% 100% servicios de salud Financiero atendida / Población\n(PSASS) programada\nResumen narrativo Orden Supuestos\nConocer los apoyos entregados en la\nSe entregan todos los apoyos a temporada invernal (Suéteres y Ascendente la población vulnerable\nCobertores)\nDE OPERACIÓN, PARA EL EJERCICIO FISCAL 2019\nFrecuencia Línea\nUnidad de Tipo de Meta Medios de\nIndicador Método de Cálculo de Base\nMedida Indicador 2018 Verificación\nMedición 2017\nEntrega de Apoyos =\nApoyos entregados\nTotal de Apoyos Padrón de en la temporada Apoyos Anual Estratégico 0% 100%\nAtendidos / Total de Beneficiarios invernal\nApoyos Programados\nResumen narrativo Orden Supuestos\nLos apoyos entregados, Personas Beneficiadas con Apoyos\nAscendente contribuyen a subsanar las\nEconómicos y en Especie necesidades de la sociedad.\nFrecuencia Línea\nUnidad de Tipo de Meta Medios de\nIndicador Método de Cálculo de Base\nMedida Indicador 2018 Verificación\nMedición 2017\n(Total de apoyos\nPorcentaje de otorgados / total de Avance Físicoapoyos Sociales Porcentaje Semestral Estratégico 0% 100% apoyos programados) Financiero otorgados\n* 100\n8.5 AUDITORIA\nEl ejercicio del recurso y la operatividad del Programa, están sujetos a las disposiciones estatales aplicables y podrá ser auditado por la Secretaría de Contraloría y Transparencia Gubernamental, así como por la\nAuditoría Superior del Estado y Auditoria Superior de la Federación, conforme a la legislación vigente y en el ámbito de sus respectivas competencias.\nEl Sistema DIF Guerrero dará todas las facilidades a dichas instancias para realizar, en el momento en que lo juzguen pertinente, las auditorías que consideren necesarias; así como el seguimiento y la solventación a las observaciones planteadas por los órganos de control.\n8.6. RECURSOS NO DEVENGADOS y aquellos que por cualquier motivo no estuviesen devengados al 31 de diciembre del Ejercicio fiscal correspondiente.\n8.7. CONTRALORÍA SOCIAL\nCon la finalidad de incrementar la participación ciudadana, se crearán Comités de Contraloría Social, como un órgano ciudadano de control, vigilancia y evaluación de las actividades del Programa, conformados por los beneficiarios y beneficiarias, los sectores sociales, y los representantes de la localidad, quienes de\nDE OPERACIÓN, PARA EL EJERCICIO FISCAL 2019 manera específica supervisarán la gestión gubernamental, y que los manejos de los recursos públicos se realicen en términos de transparencia, eficacia, legalidad y honradez.\nLos objetivos específicos de este Órgano de Contraloría Social son:\n• Hacer más transparentes las decisiones y la ejecución de los recursos.\n• Incrementar la participación ciudadana.\n• Fomentar la organización social.\n• Inhibir los actos de corrupción y de cooptación social, política y electoral.\n• Incrementar la eficiencia de los recursos públicos.\n• Fortalecer la cultura de la legalidad.\n• Mejorar la rendición de cuentas.\n• Perfeccionar la democracia e incorporar la evaluación ciudadana.\nLas funciones de los Comités de Contraloría Social son:\na) Integración: Se conforman con la representación de la comunidad beneficiada por el Programa, y fungirán como interlocutores con el DIF Guerrero, en el ejercicio de la contraloría social.\nEl vocal será, el responsable de hacer llegar las quejas o denuncias recibidas al DIF Guerrero, quien dará respuesta en un plazo no mayor de 15 días a partir de la fecha de recepción de la queja o denuncia.\nb) Capacitación y asesoría: Para impulsar la realización de las actividades de Contraloría Social se brindará capacitación y asesoría, a los servidores y servidoras públicas que intervienen en la operación del\nPrograma y / o Proyecto, así como a los integrantes de los Comités Locales, para que estos realicen adecuadamente sus actividades de seguimiento y vigilancia.\nc) Seguimiento: Se deberá integrar un Programa de Trabajo a través del cual se debe incluir la descripción de las actividades, responsables, metas y calendarización de las actividades para su cumplimiento.\nEl Director General o el personal que designe el DIF Guerrero, serán los encargados de conformar los\nComités de Contraloría Social, asimismo darán acompañamiento durante las actividades de control, seguimiento y vigilancia del proyecto.\nEl Comité de Contraloría Social debe estar constituido por un Presidente, un Secretario y un Vocal mínimamente, electos de entre la población beneficiada en donde se va a realizar la entrega del proyecto, y tendrá que ser vigilado por un solo Comité, el cual deberá controlar, vigilar y dar seguimiento al proyecto a través de los formatos que integran el expediente comunitario, integrado por:\n1. Acta de Conformación del Comité de Contraloría Social.\n2. Reunión con beneficiarios y beneficiaras.\nDE OPERACIÓN, PARA EL EJERCICIO FISCAL 2019\n3. Ficha Informativa del Programa.\n4. Cédula de Vigilancia del Programa.\n5. Actividades de Difusión y Capacitación.\n6. Quejas, Denuncias o Reconocimientos.\n7. Informe Anual.\n8.8. FORMAS DE PARTICIPACIÓN SOCIAL\nGuerrero, se establece que la sociedad podrá participar activamente en la Planeación, Programación, Implementación y Evaluación de los Programas Sociales de Desarrollo Social, por ello los beneficiarios y beneficiarias participaran en la etapa de la implementación y podrán supervisar la gestión gubernamental, que el manejo de los recursos públicos se realicen en términos de transparencia, eficacia, legalidad y honradez del Programa de acuerdo en lo estipulado en estas Reglas de Operación.\nParticipantes Etapa en la que participa Forma de Participación Modalidad\nBeneficiarios/ Implementación Comités de Contraloría Seguimiento\nBeneficiarias\n8.9. PROCEDIMIENTO DE QUEJA O INCONFORMIDAD CIUDADANA\nLa población beneficiada pueden presentar quejas y denuncias ante las instancias correspondientes sobre cualquier hecho, acto u omisión que produzca o pueda producir daños al ejercicio de sus derechos establecidos en las presentes reglas o contravengan sus disposiciones y de la demás normatividad aplicable. a. En el Sistema DIF Guerrero\nDomicilio: Centro de Rehabilitación Integral Guerrero.\nBoulevard Lic. René Juárez Cisneros S/N, Col. Ciudad de los Servicios. Chilpancingo, Guerrero.\nC.P. 39095. b. En la Secretaría de Contraloría y Transparencia Gubernamental.\nTeléfonos: (474) 47 1 97 41\nDomicilio: Palacio de Gobierno Primer Piso Edificio Norte, Blvd. R. Juárez Cisneros 62 Col. Ciudad de los\nServicios. Chilpancingo, Guerrero. C.P. 39075.\nDE OPERACIÓN, PARA EL EJERCICIO FISCAL 2019\nLas quejas y denuncias de la ciudadanía derivadas de alguna irregularidad en la operación del Programa, podrán presentarse por escrito, por comparecencia del beneficiario y / o beneficiaria, por correo electrónico o vía telefónica y deberá proporcionar los siguientes datos:\n• Nombre del servidor público.\n• Área de adscripción.\n• Objeto de la denuncia.\n• Nombre y domicilio del quejoso.\n• Identificación oficial.\n8.10. MECANISMOS DE EXIGIBILIDAD\nLos casos en los que se podrán exigir los derechos por incumplimiento o por violación de los mismos pueden ocurrir en al menos los siguientes casos:\n✓ Cuando una persona solicitante cumpla con los requisitos y criterios de inclusión para acceder a determinado derecho.\n✓ Cuando la persona solicitante exija que se cumpla con dicho derecho de manera integral en tiempo y forma.\n✓ Cuando no se pueda satisfacer toda la demanda de incorporación al programa por restricción presupuestal.\nSerá la Secretaria de Contraloria y Transparencia Gubernamental del Gobierno del Estado quién atenderá las denuncias de violación e incumplimiento de derechos en materia de Desarrollo Social.\n8.11. ACTA DE ENTREGA - RECEPCIÓN\nLa Dirección de Asistencia Alimentaria y Desarrollo Comunitario y resguardará el expediente de los beneficiarios y beneficiarias, incluyendo su acta de donación correspondiente, dada la naturaleza del apoyo otorgado, se realiza en apego al control del gasto público.\n9. CRITERIOS DE SELECCIÓN Y ELEGIBILIDAD\n9.1. MÉTODO DE SELECCIÓN DE BENEFICIARIOS (AS)\nSerán beneficiados con el Proyecto, los solicitantes que cumplan con las siguientes caracteristicas:\n✓ Familias en estado de vulnerabilidad, que presenten alguna discapacidad y no puedan tener un empleo formal.\n✓ Habitar en los 2 Municipios o Localidades de muy alto grado de marginación.\n10. MECÁNICA DE OPERACIÓN\nDE OPERACIÓN, PARA EL EJERCICIO FISCAL 2019\n10.1. INSTANCIA EJECUTORA\nAsistencia Alimentaria y Desarrollo Comunitario, quien deberá operar con apego a la programación, presupuestación, calendario de ejecución, ejercicio y control del gasto público.\n10.2. INSTANCIA ADMINISTRATIVA Y/O NORMATIVAS\nLa Instancia Administrativa y Normativa será la Dirección General del Sistema DIF Guerrero y la Dirección de Asistencia Alimentaria y Desarrollo Comunitario la Secretaria Contraloria y Transparencia\nGubernamental y la Auditoria Superior del Estado en el ámbito de sus respectivas competencias, quienes darán seguimiento a los objetivos y metas del Programa.\n10.3. DELIMITACIÓN DE ATRIBUCIONES\nEl DIF Guerrero establecerá los mecanismos de coordinación necesarios para garantizar que sus programas y acciones no se contrapongan, afecten o presenten duplicidades con otros programas o acciones del gobierno estatal; la coordinación institucional y vinculación de acciones busca potenciar el impacto de los recursos, fortalecer la cobertura de las acciones, detonar la complementariedad y reducir gastos administrativos.\n11. DERECHOS, OBLIGACIONES Y SANCIONES DE LOS BENEFICIARIOS DE PROGRAMAS\nSOCIALES.\n11.1. DERECHOS\n• Recibir trato digno, respetuoso y equitativo sin discriminación alguna, por el personal de las distintas áreas que participen dentro del programa.\n• Reserva y privacidad de la información personal.\n• Acceder a la información necesaria del programa, sus Reglas de Operación, recursos y cobertura.\n• Solicitar y recibir información sobre el estado que guarda su trámite.\n• Recibir los servicios y prestación del programa conforme a las Reglas de Operación, salvo que le sea suspendido el apoyo por alguna razón justificable.\n11.2. OBLIGACIONES\n• Proporcionar la información socioeconómica bajo protesta de decir verdad que les sea requerida por el DIF Guerrero, en los términos que establezca la normatividad correspondiente.\n• Utilizar los apoyos para los fines con que fueron autorizados evitando cualquier uso distinto de la misma.\n• Facilitar los trabajos de verificación, en cualquier momento después de otorgado el apoyo.\nDE OPERACIÓN, PARA EL EJERCICIO FISCAL 2019\n11.3. SANCIONES\nLos beneficiarios y / o las beneficiarias del Proyecto que incumplan en la Disposiciones Normativas establecidas en los numerales 6.2 y 6.3 para acceder a los beneficios que a través de estos se otorgan, perderán las prerrogativas que dichas disposiciones establecen.\n12. INTERPRETACIÓN\nLa interpretación de las presentes Reglas de Operación para efectos administrativos, estarán a cargo del\nDIF Guerrero, así como de la Secretaría de Contraloría y Transparencia Gubernamental, en el ámbito de sus respectivas competencias.\nTRANSITORIOS\nPrimero: El presente acuerdo entrará en vigor al día siguiente de su publicación en el Periódico Oficial del\nGobierno del Estado de Guerrero.\nSegundo: Las Reglas de Operación del Proyecto Instalación de Tiendas de Abarrotes para Población\nVulnerable, para el Ejercicio Fiscal 2019, se publican en su totalidad para mejor entendimiento.\nTercero: Quedan abrogadas las Reglas de Operación del Proyecto Instalación de Tiendas de Abarrotes para Población Vulnerable, Publicadas en el periódico Oficial número 28, alcance VIII del Gobierno del\nDado en la Oficina del Titular del Sistema para el Desarrollo Integral de la Familia, ubicada en las\nInstalaciones del Centro de Rehabilitación Guerrero, Boulevard René Juárez Cisneros S/N, Ciudad de los\nServicios, No. 62, Col. Recursos Hidráulicos, en la Ciudad de Chilpancingo de los Bravo, Capital del Estado de Guerrero, a los 25 días del mes de enero de dos mil diecinueve.\nESTADO DE GUERRERO.\nLic. José Francisco Solís Solís.\nRúbrica.\nDE OPERACIÓN, PARA EL EJERCICIO FISCAL 2019\nDE OPERACIÓN, PARA EL EJERCICIO FISCAL 2019\nDE OPERACIÓN, PARA EL EJERCICIO FISCAL 2019\nDE OPERACIÓN, PARA EL EJERCICIO FISCAL 2019",
  "ordenamiento": "PROGRAMA",
  "jurisdiccion": "GUERRERO",
  "fuente_oficial": "DIARIO OFICIAL DE LA FEDERACION",
  "Fecha de Publicación": "28 DE AGOSTO DE 2020",
  "ULTIMA REFORMA PUBLICADA": null,
  "status": "VIGENTE",
  "es_escaneado": false,
  "tiene_tablas": true,
  "materia": [
    "desarrollo social"
  ]
}