{
  "titulo": "Acuerdo por el Que Se Crea el Programa de Inclusión de la Mujer y los Jóvenes en la Economía del Bie",
  "Contenido": "REGLAS DE OPERACIÓN\nTEXTO ORIGINAL.\nEN LA ECONOMÍA DEL BIENESTAR Y SE EMITEN SUS REGLAS DE OPERACIÓN.\nPoder Ejecutivo.\nMAESTRA EVELYN CECIA SALGADO PINEDA, GOBERNADORA CONSTITUCIONAL DEL ESTADO\nDE GUERRERO, CON FUNDAMENTO EN LO DISPUESTO POR LOS ARTÍCULOS 71, 87, 88, 90\nARTÍCULOS 2, 4, 8, 9, 14, 22 APARTADO A FRACCIONES I Y X, 23 FRACCIÓN III Y 32 DE LA LEY\nORGÁNICA DE LA ADMINISTRACIÓN PÚBLICA DEL ESTADO DE GUERRERO NÚMERO 242; 1, 2\nFRACCIÓN I, 18 Y 25 DE LA LEY NÚMERO 454 DE PRESUPUESTO Y DISCIPLINA FISCAL DEL\nESTADO DE GUERRERO; 31, 32, 33, 34 Y 35 DE LA LEY DE FOMENTO ECONÓMICO, INVERSIÓN Y\nDESARROLLO DEL ESTADO DE GUERRERO NÚMERO 487; EN RELACIÓN CON EL ARTÍCULO 47\nY ANEXOS 23 Y 23-A (E10) DEL DECRETO NÚMERO 680 RELATIVO AL PRESUPUESTO DE\nEGRESOS DEL ESTADO DE GUERRERO PARA EL EJERCICIO FISCAL 2024, Y LOS LINEAMIENTOS\nPARA LA ELABORACIÓN DE LAS REGLAS DE OPERACIÓN DE LOS PROGRAMAS SOCIALES\nESTATALES PARA EL PERIODO 2022-2027.\nQue el Plan Nacional de Desarrollo 2019-2024, establece como principio rector la economía para el bienestar, que busca centrar el objetivo de la política económica en el mejoramiento del nivel de vida de la población. Por lo tanto, este documento rector del desarrollo económico y social de nuestro país constituye el punto de partida para el diseño e implementación del Programa de Inclusión de la Mujer y los Jóvenes en la Economía del Bienestar.\nQue el Plan Estatal de Desarrollo 2022-2027, en el Eje 2 Desarrollo Económico Sostenible, establece en sus estrategias y líneas de acción instaurar programas que otorguen apoyos para la creación formal, formalización o reactivación de empresas, con la finalidad de fomentar la inversión y la generación de empleo, contribuyendo al mismo tiempo con los objetivos y las metas de la Agenda 2030 para el Desarrollo\nSostenible, que promueve la Organización de las Naciones Unidas (ONU). derechos económicos, sociales, culturales y ambientales para hacer realidad el progreso y el bienestar de sus habitantes; para tal efecto, expedirá los programas de gobierno y políticas públicas correspondientes que se requieran.\nREGLAS DE OPERACIÓN\nQue la política estatal con el lema “Transformando Guerrero”, tiene la firme convicción de combatir de manera frontal los rezagos históricos que ha padecido el estado de Guerrero, bajo los principios de la\nCuarta Transformación. Estos propósitos sólo se pueden lograr, escuchando las voces de los necesitados del medio rural, promoviendo y fortaleciendo el desarrollo de capacidades de las y los habitantes que han sobrevivido con grandes carencias.\nQue la Ley de Fomento Económico, Inversión y Desarrollo del Estado de Guerrero Número 487, establece que el gobierno del estado propiciará la acción deliberada y comprometida de los sectores productivos e instancias de gobierno, para que participen en el fomento de las actividades viables para el desarrollo económico del estado incrementando el empleo y preservando el medio ambiente.\nQue el Decreto Número 680 relativo al Presupuesto de Egresos del Estado de Guerrero para el Ejercicio\nFiscal 2024, establece que, en el ejercicio del gasto público de las dependencias y entidades, se deberá considerar como referente articulador al Plan Estatal de Desarrollo 2022-2027, sus ejes, objetivos, estrategias y líneas de acción, orientados a los sectores, municipios y comunidades más desprotegidos del estado.\nQue el citado Decreto Número 680 relativo al Presupuesto de Egresos del Estado de Guerrero para el\nEjercicio Fiscal 2024; en su artículo 47, establece que, con el objeto de asegurar la aplicación eficiente, eficaz, oportuna, educativa y transparente de los recursos públicos, la Secretaría de Finanzas y\nAdministración y la Secretaría de Planeación y Desarrollo Rural, emitirán las disposiciones a que deberán sujetarse los programas de inversión sujetos a reglas de operación.\nQue la Secretaría de Planeación y Desarrollo Regional, expidió los Lineamientos para la Elaboración de las Reglas de Operación de los Programas Sociales Estatales para el Periodo 2022-2027, publicados en el Periódico Oficial del Gobierno del Estado de Guerrero número14 de fecha 18 de febrero de 2022. Los cuales, tienen la finalidad de ser un instrumento técnico que guie la elaboración de los apartados centrales de las reglas de operación, así como los elementos para integrar su contenido.\nQue, por consiguiente, las personas titulares de las secretarías y/o entidades paraestatales de la administración pública, así como las servidoras y servidores públicos autorizados para ejercer recursos públicos del presupuesto e inversión de los mismos, serán responsables de los programas y/o proyectos de inversión que aplican, en que los apoyos otorgados deberán sujetarse a los criterios de objetividad, equidad, transparencia, publicidad, selectividad y temporalidad.\nQue conforme a la Ley Orgánica de la Administración Pública del Estado de Guerrero Número 242, la fomentar el desarrollo económico, industrial, agroindustrial, minero, artesanal, comercial en el estado.\nPor lo anteriormente expuesto y con fundamento en las disposiciones legales antes citada, ha tenido a bien expedir el siguiente acuerdo.\nEN LA ECONOMÍA DEL BIENESTAR Y SE EMITEN SUS REGLAS DE OPERACIÓN.\nREGLAS DE OPERACIÓN\nArtículo 1. Se crea el Programa de Inclusión de la Mujer y los Jóvenes en la Economía del Bienestar, el en la economía del bienestar, partiendo del principio de oportunidad, equidad y transparencia de los\nArtículo 2. La Secretaría de fomento y Desarrollo Económico tendrá a cargo la implementación, operación, ejecución, evaluación y administración del “Programa de Inclusión de la Mujer y los Jóvenes en la Economía del Bienestar” bajo los criterios de objetividad, equidad, transparencia, publicidad, selectividad y temporalidad, con estricto apego a la normativa aplicable, por lo tanto será la encargada de la dispersión y asignación de los recursos del Programa apegándose plenamente a las Reglas de Operación.\nArtículo 3. Se emiten las Reglas de Operación del “Programa de Inclusión de la Mujer y los Jóvenes en la\nEconomía del Bienestar”, que establece los principios de eficacia, eficiencia, oportunidad, equitativa y transparencia de los recursos públicos y requisitos que deben cumplir para poder acceder ha dicho\nPrograma en los términos siguientes.\nREGLAS DE OPERACIÓN DEL PROGRAMA DE INCLUSIÓN DE LA MUJER Y LOS JÓVENES EN\nLA ECONOMÍA DEL BIENESTAR.\n1. Introducción.\n1.1. Antecedentes.\nLos programas implementados por la Secretaría de Fomento y Desarrollo Económico representan las políticas públicas mediante las cuales el gobierno del estado de Guerrero, busca incentivar la participación ciudadana y de las instancias de los tres órdenes de gobierno en actividades que impulsen el desarrollo económico sostenible del estado.\nEl Programa, tiene el propósito de impulsar la inclusión productiva de las mujeres y la juventud, mediante la creación formal, formalización o reactivación de microempresas, que contribuyan a mejorar el bienestar de estos segmentos de población.\n2. Alineación Programática al PED y/o PND\nEl Programa, está alineado al Plan Nacional de Desarrollo 2019-2024, específicamente, al Eje III Economía;\nObjetivo 6, Impulsar la reactivación económica, el mercado interno y el empleo, que define una de las tareas de empleos formales, que otorguen seguridad social y bien remunerados.\nAdicionalmente, el Plan Nacional de Desarrollo 2019-2024, establece que la propuesta de desarrollo se sustenta en principios rectores, de los cuales, uno se refiere a la economía para el bienestar, que considera al crecimiento económico, y el incremento de la productividad y la competitividad, como medios\nREGLAS DE OPERACIÓN para alcanzar el bienestar de la población. En este sentido, por su objetivo, el Programa, se encuentra alineado con este principio rector.\nCon relación al Plan Estatal de Desarrollo 2022-2027, el Programa está alineado al siguiente eje, objetivo, estrategia y línea de acción\nEje 2: Desarrollo Económico Sostenible.\nObjetivo 2.22: Promover la creación formal y la formalización de empresas en operación.\nEstrategias 2.22.1: implementar las herramientas de mejora regulatoria en los ámbitos de gobierno estatal y municipal.\nLíneas de acción 2.22.1.3: Promover la formalización de empresas y apoyar los programas gubernamentales impulsados por los tres niveles de gobierno orientados a este fin.\nEn cuanto a los Objetivos de Desarrollo Sostenible de la Agenda 2030, el Programa se encuentra alineado de la siguiente manera:\nObjetivo: 8 Trabajo decente y crecimiento económico.\nMeta: 8.3 Promover políticas orientadas al desarrollo que apoyen las actividades productivas, la creación de puestos de trabajo decentes, el emprendimiento, la creatividad y la innovación, y fomentar la formalización y el crecimiento de las microempresas y las pequeñas y medianas empresas, incluso mediante el acceso a servicios financieros.\n2.1. Diagnóstico.\nSegún el INEGI en su estudio sobre la Demografía de los Negocios (EDN) 20219-2020, durante el impacto de la pandemia por el COVID-19 se suscitaron coyunturas económicas complicadas, y para medir el impacto de la pandemia en cuanto a cierre definitivo y creación de negocio, se analizaron dos periodos: En el primer periodo se identificó que la tasa mensual de establecimientos que cerraron de manera definitiva es de 1.36 % mientras que la tasa de nuevos establecimientos es de 0.71%, lo que significa que de cada\n10,000 establecimientos existentes cerraron 136 y se crearon 71.\nEn el segundo periodo se identificó que la tasa mensual de establecimientos que cerraron es de 1.45 % mientras que la tasa de nuevos establecimientos es de 0.81 %, lo que significa que de cada 10,000 cerraron definitivamente 145 y se crearon 81. La pandemia del COVID- 19 ocasionó el cierre definitivo de una gran cantidad de establecimientos, aunque también se crearon nuevos establecimientos, pero no en la misma proporción.\nDatos del Censo Económico 2019 de INEGI, refieren que en el estado de Guerrero se contaba con un registro de 149,114 unidades económicas, de las cuales, el 97.6% corresponde al estrato de clasificación micro, caracterizadas, de acuerdo con la Ley para el Desarrollo de la Competitividad de la Micro, Pequeña\nREGLAS DE OPERACIÓN y Mediana Empresa, por contar con hasta 10 personas trabajadoras e ingresos de hasta 4 millones de pesos anuales.\nAsimismo, los censos señalados, refieren que el 76% de las unidades económicas operan en la informalidad; con relación a la informalidad laboral la Encuesta Nacional de Ocupación y Empleo (ENOE) del INEGI, correspondiente al tercer trimestre de 2023, indica que se ubicó en 78.2%, ocupando el segundo lugar entre las entidades federativas. Las principales carencias sociales del estado de Guerrero fueron carencia por acceso a la seguridad social, carencia por acceso a los servicios básicos en la vivienda y carencia por acceso a los servicios de salud.\nPara el INEGI en su informe del primer trimestre 2023, según las cifras y resultados del EDN entre 2019 –\n2023 se observó un incremento en la cantidad de establecimientos que sobrevivieron, lo cual se originó, principalmente, por la reactivación de establecimientos después de la pandemia COVID1 – 19. Entre el periodo 2021 y el EDN 2023 en los sectores de comercio y servicios pasaron de 29.88 a 27.45 % y de\n38.16 a 32.19 %, respectivamente.\nLo anterior se debe, principalmente, a la reactivación de establecimientos de estos sectores.\nLa reactivación de establecimientos impactó principalmente a los negocios micro, ya que la proporción de personal ocupado involucrado en el cierre definitivo de estos establecimientos disminuyó de 29.43 % en\n2021 a 28.13 % en 2023.\nLos datos anteriores muestran que, es muy alta la informalidad de las empresas en México.\nEn lo que respecta al estado de Guerrero, la informalidad de las empresas y la informalidad laboral generan un efecto inmediato en la falta de seguridad social y prestaciones laborales para las personas con empleo en estas circunstancias, situación que incide de manera determinante en bajos niveles de vida.\nEn este contexto, se crea el Programa, que busca impulsar las ideas, el talento, la creatividad y el trabajo de las mujeres y la juventud, para desarrollar nuevos productos, nuevos procesos y modelos de negocio, que nos permitan generar más empresas y más empleos.\n2.1.1. Población Potencial.\nEstá conformada por mujeres con 18 años de edad en adelante y la juventud con un rango de edad entre los 18 y los 29 años, con interés en la creación formal, formalización o reactivación de una Microempresa pertenecientes a los sectores industria, comercio o de servicio con domicilio en el estado de Guerrero\n2.1.2. Población Objetivo. industria, comercio o servicio.\n2.1.3. Población Beneficiaria.\nREGLAS DE OPERACIÓN\nPersonas consideradas en la población objetivo, que presentaron solicitud de apoyo y fueron atendidas con el otorgamiento de un apoyo del Programa.\n2.1.4. Población Indígena.\nEl Programa tiene una cobertura estatal, en consecuencia, podrán participar todas las personas con domicilio en el estado de Guerrero que forman parte de la población objetivo, sin distinción, exclusión o restricción de ninguna naturaleza. Dentro de la solicitud de apoyo se consulta si la persona solicitante pertenece a un grupo indígena; otorgando una mayor puntación en el dictamen de su solicitud de apoyo.\n2.2. Fundamento Legal.\na) Constitución Política de los Estados Unidos Mexicanos;\nb) Plan Nacional de Desarrollo 2019-2024;\nd) Decreto Número 181 por medio del cual la Sexagésima Tercera Legislatura al Honorable Congreso del\ne) Ley Orgánica de la Administración Pública del Estado de Guerrero Número 242;\nf) Ley de Fomento Económico, Inversión y Desarrollo del Estado de Guerrero Número 487;\ng) Ley Número 454 de Presupuesto y Disciplina Fiscal del Estado de Guerrero;\ni) Ley Número 466 de Protección de Datos Personales en Posesión de Sujetos Obligados del Estado de\nGuerrero;\nk) Decreto Número 680 relativo al Presupuesto de Egresos del Estado de Guerrero para el Ejercicio Fiscal\n2024;\nl) Lineamientos para la elaboración de las Reglas de Operación de los Programas Sociales Estatales para el periodo 2022-2027;\nm) Reglamento Interior de la Secretaría de Fomento y Desarrollo Económico, y\nn) Programa Sectorial Industria, Comercio, Abasto y Apoyo a MiPymes.\n2.3. Definiciones y Siglas.\nREGLAS DE OPERACIÓN\nPara efectos de estas Reglas de Operación se entenderá por:\nDefiniciones:\nApoyo (s): Asignación de recursos económicos que, bajo la figura de subsidio, otorga el gobierno del estado de Guerrero a través de la Secretaría de Fomento y Desarrollo Económico, a las personas beneficiarias del Programa.\nComité de Evaluación: Comité de Evaluación del Programa.\nFactura Electrónica: La factura electrónica digital (CFDI), compuesta por archivos PDF y XML.\nFormalización: Inscripción o alta en el Registro Federal de Contribuyentes ante el SAT.\nInclusión: Proceso que busca garantizar que todas las personas tengan acceso a los servicios y recursos que les permita lograr un bienestar personal o social.\nJuventud: Personas con rango de edad entre los 18 y los 29 años.\nMicroempresa: Unidad económica que opera en los sectores industrial, comercial o de servicios que cuenta con hasta 10 personas trabajadoras e ingresos de hasta 4 millones de pesos anuales.\nMujeres: Población conformada por Mujeres con 18 años y más.\nPersona Beneficiaria: Persona que ha recibido apoyo y cuyos datos se encuentran registrados en el\nPadrón de Personas Beneficiarias del Programa.\nPadrón de Personas Beneficiarias: Relación de las personas beneficiarias del Programa, integrada conforme a las disposiciones de la Ley Número 207 de Transparencia y Acceso a la Información Pública del Estado de Guerrero.\nPersona Solicitante: Persona que requiere el apoyo del Programa y sigue el procedimiento establecido en sus Reglas de Operación.\nPrograma: Programa de Inclusión de la Mujer y los Jóvenes en la Economía del Bienestar.\nPresupuesto de Egresos 2024: Decreto Número 680 relativo al Presupuesto de Egresos del Estado de\nGuerrero para el Ejercicio Fiscal 2024.\nReglas de Operación: Reglas de Operación del Programa de Inclusión de la Mujer y los Jóvenes en la\nEconomía del Bienestar.\nReporte de Comprobación: Reporte que desglosa por concepto el ejercicio del recurso económico otorgado, firmado bajo protesta de decir verdad.\nREGLAS DE OPERACIÓN\nSolicitud de Apoyo: formato de solicitud de apoyo del Programa y los documentos establecidos como requisitos en las presentes Reglas de Operación.\nSiglas:\nAVGM: Alerta de Violencia de Genero contra las Mujeres.\nENOE: Encuesta Nacional de Ocupación y Empleo.\nINEGI: Instituto Nacional de Estadística y Geografía.\nSAT: Sistema de Administración Tributaria.\nSCyTG: Secretaría de Contraloría y Transparencia Gubernamental.\nSEFINA: Secretaría de Finanzas y Administración.\nSEPLADER: Secretaría de Planeación y Desarrollo Regional.\nSEFODECO: Secretaría de Fomento y Desarrollo Económico.\n3. Objetivos y Alcances.\n3.1. Objetivo General.\nImpulsar la inclusión de las mujeres y la juventud para reducir la brecha de desigualdad, así como, la consolidación de una economía innovadora, dinámica, incluyente y competitiva, mediante la creación, formalización o reactivación de una Microempresa, contribuyendo a la generación de auto empleo y empleos que les permitan mejorar su nivel de bienestar.\n3.2. Objetivo Específico. equipamiento o infraestructura, en la creación, formalización o reactivación ante el SAT de una\nMicroempresa, con domicilio en el estado de Guerrero, en los sectores: industria, comercio o servicio.\n3.3. Cobertura.\nEl Programa tendrá una cobertura estatal, por lo tanto, podrán participar las personas contempladas en la población objetivo, con domicilio fiscal en el estado de Guerrero.\n3.4. Alcances.\nREGLAS DE OPERACIÓN\nEl Programa contempla el otorgamiento de apoyos, de manera directa a las personas que forman parte de la población objetivo, destinados a capital de trabajo, equipamiento o infraestructura, en la creación, fortalecimiento o reactivación de Microempresas, dedicadas a actividades económicas de los sectores industria, comercio o servicios y con domicilio fiscal en el estado de Guerrero, atendiendo a su derecho al trabajo.\n4. Metas Físicas.\nEl Programa tiene contemplado el otorgamiento de 245 apoyos económicos en el ejercicio fiscal 2024, a las personas de la población objetivo que cumplan con lo dispuesto en las presentes Reglas de Operación y las convocatorias que serán emitidas entre agosto y diciembre del presente año de acuerdo a la liberación de los recursos correspondientes.\n5. Programación Presupuestal.\nEl monto aprobado en el Decreto Número 680 relativo al Presupuesto de Egresos para el Ejercicio Fiscal\n2024, para la implementación del Programa, asciende a $5,000,000.00 (Cinco Millones de Pesos 00/100 m. n.); los recursos provienen de la fuente de financiamiento de Inversión Estatal Directa (IED) y la liberación estará sujeta a la disponibilidad de los ingresos recaudados por la SEFINA, por lo que la calendarización y metas pueden variar:\nEnero Febrero Marzo Abril Mayo Junio\nJulio Agosto Septiembre Octubre Noviembre Diciembre\n5.1. Gastos de Operación.\nEl Programa contempla gastos de operación, cuyo monto corresponderá hasta un 3% del total de recursos aprobados para el Programa en el Decreto Número 680 relativo al Presupuesto de Egresos para el Ejercicio\nFiscal 2024, mismo que se destinará a diversas acciones asociadas con la planeación, promoción, difusión, operación, supervisión, verificación, fotocopiado e impresión de material promocional, servicios de apoyos administrativos, equipos menores de oficina, viáticos, hospedaje, pasajes, combustibles, evaluación y, en su caso, la publicación de las convocatorias del Programa, en dos periódicos de mayor circulación en el estado de Guerrero.\n6. Criterios y Requisitos de Elegibilidad.\nLas personas contempladas en la población objetivo, interesadas en obtener apoyos del Programa, deberán cumplir con los criterios y requisitos de elegibilidad siguientes:\na) Criterios de elegibilidad:\nREGLAS DE OPERACIÓN\n● Mujeres con 18 años de edad y más y la juventud con un rango de edad entre 18 a 29 años, propietarios de una Microempresa que opere como persona física.\n● Realizar actividades económicas de los sectores industria, comercio y servicios.\n● Domicilio fiscal de la Microempresa en el estado de Guerrero.\n● No ser persona servidora pública de los Poderes Ejecutivo, Legislativo y Judicial, federal o estatal, o de un municipio.\n● No haber recibido apoyo por parte de otras dependencias del gobierno del estado para el mismo concepto del apoyo solicitado.\n●Cumplir con los requisitos del Programa establecidos en las presentes Reglas de Operación y las convocatorias correspondientes.\nb) Requisitos:\nLas personas pertenecientes a la población objetivo podrán solicitar apoyos del Programa, cumpliendo los siguientes requisitos:\nRequisito Documento\na) solicitud de apoyo del formato de solicitud de apoyo del Programa.\nPrograma. Anexo 2\nb) Identificación oficial con Copia de la credencial para votar o pasaporte, fotografía. vigente.\nc) Comprobante de domicilio de Copia del recibo de servicio telefónico fijo, agua, la Microempresa a crear, luz, servicio de televisión por cable o constancia formalizar o reactivar. de residencia expedida por autoridad local; con fecha de expedición no mayor a dos meses.\nREGLAS DE OPERACIÓN\n{\"tabla_1\":{\"columnas\":[\"d) Inscripción en el Registro\\nFederal de Contribuyentes\\n(RFC).\",\"Constancia de Situación Fiscal con fecha de\\nimpresión no mayor a 30 días.\\nLa Constancia de Situación Fiscal deberá tener\\nfecha de inicio de actividades económicas no\\nmayor a tres meses anteriores a la fecha de\\npublicación de la convocatoria, y podrán participar\\naquellas personas que requieran crear, formalizar\\no reactivar una microempresa.\\nLos regímenes fiscales considerados en el\\nPrograma son:\\n• Régimen de Personas Físicas con Actividades\\nEmpresariales y Profesionales;\\n• Régimen Simplificado de Confianza\\n(RESICO); y\\n• Régimen de Actividades Empresariales con\\ningreso a través de Plataformas Tecnológicas.\"],\"filas\":[{\"columna_1\":\"e) Comprobante de cuenta\\nbancaria\",\"columna_2\":\"Copia de la carátula del estado de cuenta\\nbancaria a nombre de la persona solicitante, con\\nCLABE interbancaria y con fecha no mayor a dos\\nmeses.\"},{\"columna_1\":\"f) Evidencia fotográfica de la\\nMicroempresa en operación.\",\"columna_2\":\"En los casos de formalización o reactivación de\\nuna Microempresa, presentar tres fotografías de\\ncalidad visible a color donde se muestre:\\n1. Fachada de la Microempresa.\\n2. La panorámica de las calles entre las que se\\nubica la Microempresa.\\n3. Fotografía donde se observe la Microempresa\\nen operación y sus productos o la prestación del\\nservicio.\"}]}}\nReglas de Operación y en la convocatoria, la cual no hay que olvidar que sale de estas mismas Reglas de\nOperación, deberán presentarse de la siguiente manera: uno de los documentos requeridos en la convocatoria en archivo PDF.\nb) De manera excepcional el área de Unidad de Género, ubicada en el “Recinto de las Oficinas del Poder\nEjecutivo del Estado” el inmueble ubicado en el número 62, Boulevard\nREGLAS DE OPERACIÓN\nRené Juárez Cisneros, de la Ciudad de los Servicios en Chilpancingo de los Bravo, capital del estado de\nGuerrero., edificio Acapulco, primer piso, en un horario de atención de las 9:00 a las 15:00 horas.\n7. Tipo, Monto y Periodicidad del Apoyo.\nTipo Monto $ Periodicidad\nEconómico. 20,000.00 Único\n7.1. Características de los Apoyos.\nLos apoyos del Programa son recursos económicos que se entregan de manera directa a las personas beneficiarias, a través de transferencia bancaria, destinados a capital de trabajo, equipamiento o infraestructura, para la creación, formalización o reactivación de una Microempresa con domicilio en el estado de Guerrero y dedicada a actividades económicas de los sectores industria, comercio o servicios.\n7.2. Recursos no Devengados.\nLos recursos aprobados para el Programa, en el Decreto Número 680 relativo al Presupuesto de Egresos para el Ejercicio Fiscal 2024, que no sean ejercidos o devengados al 31 de diciembre del presente año, serán reintegrados a la SEFINA.\n7.3. Resguardo de la Documentación.\nLa Unidad de Género, perteneciente a la SEFODECO, resguardará la documentación comprobatoria del ejercicio de los recursos del Programa de y la Delegación Administrativa de la misma dependencia, efectuará el cierre del ejercicio.\n7.4. Supervisión y Control.\nEl Programa estará a cargo de la SEFODECO a través de la Unidad de Género, responsable de su\nOperación, enviando un reporte mensual a la Unidad de Planeación y Presupuesto. sobre el presupuesto ejercido, mismos que se deberán presentar a más tardar a los quince días hábiles posteriores a la terminación de cada trimestre.\n8. Criterios de Selección.\nLa selección de personas beneficiarias del Programa será conforme al siguiente procedimiento:\nREGLAS DE OPERACIÓN de Guerrero.\nb) Instalación del Comité de Evaluación del Programa.\nEl Comité de Evaluación del Programa, es un órgano colegiado que tendrá facultades para conocer y resolver los asuntos relacionados con el Programa, incluyendo aquellos no previstos en las presentes\nReglas de Operación; estará integrado de la manera siguiente:\n● La persona titular de la SEFODECO, que fungirá como presidenta o presidente;\n● La persona titular del área de Unidad de Género de la SEFODECO quien fungirá como secretaria o secretario técnico;\n● La persona titular de la Subsecretaría de Fomento Económico de la SEFODECO;\n● La persona titular de la Unidad de Asuntos Jurídicos de la SEFODECO, y\n● La persona titular de la Delegación Administrativa de la SEFODECO.\na) Publicación de la o las convocatorias del Programa.\nb) Recepción de solicitudes de apoyo y los documentos establecidos en las presentes Reglas de\nOperación.\nc) La solicitud de apoyo y los documentos señalados como requisitos deberán enviarse en archivo PDF, de manera individual para cada documento, al correo electrónico: inclusion.sefodeco@guerrero.gob.mx de manera excepcional las solicitudes se podrán presentar en el área de Unidad de Género de la SEFODECO, ubicadas en el “Recinto de las Oficinas del Poder Ejecutivo del Estado” el inmueble ubicado en el número\n62, Boulevard René Juárez Cisneros, de la Ciudad de los Servicios en Chilpancingo de los Bravo, capital del estado de Guerrero, edificio Acapulco, primer piso, en un horario de atención de las 9:00 a las 15:00 horas.\nd) La Unidad de Género de la SEFODECO dictaminará las solicitudes de apoyo presentadas, y aquellas que obtengan dictamen favorable, en términos de lo dispuesto en las presentes Reglas de Operación y la convocatoria correspondiente, se les asignará un folio que permitirá su identificación y trazabilidad en el proceso de selección, y serán presentadas para su autorización correspondiente al Comité de Evaluación del Programa, que para tales efectos deberá sesionar con la presencia del cincuenta por ciento más uno de sus personas integrantes.\ne) Los apoyos del Programa se autorizarán de acuerdo al mecanismo: primero en tiempo, primero en derecho; estableciendo un orden de prelación de acuerdo con la fecha de presentación de las solicitudes que cuenten con dictamen favorable de la Unidad de Género de la SEFODECO y, estableciendo un\nREGLAS DE OPERACIÓN segundo orden de prelación, de mayor a menor, de acuerdo a la calificación obtenida en el dictamen, hasta agotar el monto del recurso presupuestal disponible.\nLos apoyos del Programa se otorgarán de acuerdo a los criterios técnicos de evaluación siguientes:\nCriterios técnicos de evaluación Ponderación\nSolicitud de apoyo y documentos requeridos. 70 puntos\nMujeres con domicilio en un municipio declarado con AVGM 10 puntos\n10 puntos\nPersonas que realicen actividades económicas del sector industrial\nPersonas indígenas, con alguna discapacidad o adultos mayores. 5 puntos\nPersonas en condición de desplazamiento interno 5 puntos\nTotal 100 puntos\nCabe mencionar que esta ponderación se realiza con base al formato de solicitud del apoyo del Programa.\na) La o el secretario técnico del Comité de Evaluación del Programa, levantará el acta correspondiente de las sesiones, mismas que contendrán, en su caso, el listado de las solicitudes de apoyo autorizadas.\nb) Mediante oficio firmado por la persona titular de la SEFODECO, la Unidad de Género, notificará la resolución de autorización de apoyo a las personas solicitantes en un plazo de diez días hábiles contados a partir del día siguiente de la sesión del Comité de Evaluación del Programa. Para efecto de la comprobación de la entrega del apoyo, en el oficio de resolución se deberá solicitar, con un plazo de diez días hábiles contados a partir del día siguiente de la recepción del oficio, la factura electrónica, a nombre de la SEFINA, que contenga el concepto y monto del apoyo recibido. La factura electrónica deberá ser enviada al correo electrónico inclusion.sefodeco@guerrero.gob.mx asimismo, se deberá solicitar la comprobación de la aplicación del apoyo económico otorgado mediante un Reporte de Comprobación, entendiéndose como tal, al reporte que desglose por concepto el ejercicio del recurso económico recibido, firmado bajo protesta de decir verdad.\nc) La Unidad de Género, entregará mediante oficio firmado por la persona titular de la SEFODECO, a la persona titular de la Delegación Administrativa, la relación de las personas que cuenten con oficio de autorización del apoyo del Programa, incluyendo copia de la carátula del estado de cuenta bancario correspondiente, para que, en un plazo de diez días hábiles contados a partir de la recepción del citado oficio, efectúe las trasferencias bancarias de los apoyos autorizados.\nd) La persona titular de la Delegación Administrativa entregará mediante oficio a la persona titular de la\nUnidad de Género, los documentos comprobatorios de las transferencias bancarias realizadas a las personas beneficiarias del Programa, para su integración en los expedientes de las solicitudes de apoyo.\nREGLAS DE OPERACIÓN\ne) Con la presentación del Reporte de Comprobación, se concluye el proceso del otorgamiento del apoyo del Programa. Sin embargo, podrá ser revisado, verificado o auditado por parte de la SEFODECO, la\nSCyTG y la Auditoría Superior del Estado de Guerrero.\nf) Los requerimientos, dictámenes y resoluciones de las solicitudes de apoyo presentadas, emitidos por la\nSEFODECO, se notificarán a la persona solicitante en el correo electrónico señalado en el formato de solicitud de apoyo, y\ng) Para los requerimientos, las personas solicitantes de apoyo contarán con 5 días hábiles, contados a partir del siguiente de la notificación, para cumplir con lo solicitado o subsanar las observaciones correspondientes; de no contestar en el plazo mencionado, se tendrá por desistida la solicitud.\n8.1. Casos Especiales.\nLos casos especiales del Programa y aquellos casos no previstos en las Presentes Reglas de Operación serán atendidos por el Comité de Evaluación, que dictará las acciones a seguir y las resoluciones pertinentes.\n8.2. Casos de Emergencia o Desastre.\nEn caso de una declaratoria de emergencia o de desastre, por parte de las instancias competentes, el\nComité de Evaluación analizará la situación y, de afectarse la operación del Programa deberá emitir el plan de acción que permita dar cumplimiento a sus objetivos, de conformidad con lo establecido en las presentes\nReglas de Operación.\n8.3. Suspensión o Cancelación del Programa Social.\nLa SEFODECO podrá suspender o cancelar la operación del Programa, cuando las condiciones sociales y económicas, no sean favorables para el cumplimiento de los objetivos; en caso de problemas de\n8.4. Integración del Padrón de Personas Beneficiarias.\nSEFODECO, al Padrón Único de Personas Beneficiarias, cuya información será considerada en términos de lo dispuesto en la Ley Número 466 de Protección de Datos Personales en Posesión de Sujetos del Estado de Guerrero.\n9. Mecánica Operativa del Programa Social.\n9.1. Instancia Ejecutora y/o Responsable.\nREGLAS DE OPERACIÓN\nLa instancia ejecutora del Programa será la SEFODECO, a través de la Unidad de Género, emitiendo las\nReglas de Operación de acuerdo con el marco normativo aplicable.\nCon el propósito de asegurar la aplicación eficiente, eficaz, oportuna, equitativa y transparente de los recursos públicos, la SEFINA, y la SEPLADER, emiten las disposiciones normativas que regulan los programas de inversión sujetos a Reglas de Operación.\nLa SEPLADER, autoriza las Reglas de Operación y los recursos aprobados en el Decreto Número 680 relativo al Presupuesto de Egresos para el Ejercicio Fiscal 2024; mismas que, una vez validadas y aprobadas serán publicadas en el Periódico Oficial del Gobierno del Estado de Guerrero, previo trámite realizado por la SEFODECO.\nLa SEFINA, efectuará las ministraciones de recursos presupuestales en concordancia con el Decreto\nNúmero 680 relativo al Presupuesto de Egresos para el Ejercicio Fiscal 2024.\n9.2. Proceso de Incorporación al Programa Social.\nLas personas contempladas en la población objetivo, interesadas en la presentación de solicitud de apoyo del Programa, podrán participar en la convocatoria que para tal efecto emita y publique la SEFODECO, en dos periódicos de mayor circulación en el estado de Guerrero, en dos días diferentes. Adicionalmente, la convocatoria se publicará en el portal oficial del Gobierno del Estado www.guerrero.gob.mx y en las redes sociales oficiales de la SEFODECO: Sefodeco Guerrero (Facebook), @sefodecogro (Twitter).\nLa convocatoria que emita la SEFODECO del Programa, será autorizada por la persona titular de la\nSEFODECO y deberá contener, lo siguiente:\na) Objeto;\nb) Vigencia de la Convocatoria;\nc) Monto presupuestal disponible;\nd) Montos de los apoyos;\ne) Cobertura;\nf). Criterios de Elegibilidad;\ng) Requisitos;\nh). Criterios Técnicos de Evaluación, y\ni) Contacto de atención.\nLas Reglas de Operación, la convocatoria, la solicitud de apoyo y la información inherente al Programa, estarán a disposición de las personas interesadas en el área de Unidad de Género de la SEFODECO, 62, Boulevard René Juárez Cisneros, de la Ciudad de los Servicios en Chilpancingo de los Bravo, capital del estado de Guerrero., edificio Acapulco, primer piso, en un horario de atención de las 9:00 a las 15:00 horas.\nREGLAS DE OPERACIÓN\nAdicionalmente, los documentos mencionados estarán disponibles en el portal oficial del Gobierno del\n(Facebook), @sefodecogro (Twitter).\n10. Evaluación.\nLa evaluación del Programa, la realizará la SEFODECO por conducto de la Unidad de Género, conforme a los lineamientos que emita al respecto la SEPLADER, verificando los avances y el cumplimiento de los de los objetivos planteados.\n10.1. Indicadores. (Construcción de la Matriz de Indicadores para Resultados- Anexo 1).\nPrograma se construyeron de acuerdo a la Metodología del Marco Lógico (MML), cuya Ficha Técnica de\nIndicadores se muestra a continuación:\nREGLAS DE OPERACIÓN\nREGLAS DE OPERACIÓN\n10.2. Seguimiento.\nEl seguimiento del Programa estará a cargo de la SEFODECO a través de la Unidad de Género, generando en el proceso, información que permita un análisis sobre el avance del cumplimiento de los objetivos establecidos y sobre el ejercicio de los recursos presupuestales asignados. En el seguimiento se podrá contemplar una visita de verificación considerando una muestra del 10% de las y los beneficiarios del\nPrograma con el propósito de identificar áreas de mejora que favorezcan una operación eficiente y eficaz del Programa y, en consecuencia, alcanzar los objetivos propuestos.\n10.3. Auditoría.\nEl ejercicio de los recursos asignados y la verificación del cumplimiento de los objetivos del Programa podrán ser auditados por los entes fiscalizadores como la SCyTG y la Auditoría Superior del Estado de\nGuerrero, conforme a las disposiciones normativas aplicables y en el ámbito de sus respectivas competencias. La SEFODECO otorgará todas las facilidades a los entes fiscalizadores para llevar a cabo las auditorías que determinen e implementará las acciones necesarias para solventar las observaciones y no conformidades que se plasmen en el informe de auditoría correspondiente.\n11. Mecanismo de Entrega del Apoyo.\nLos apoyos del Programa se entregarán de manera directa, mediante transferencia bancaria, a las personas de la población objetivo cuya solicitud de apoyo cuente con la autorización del Comité de\nEvaluación y se haya emitido el oficio de resolución de autorización por parte de la persona titular de la\nSEFODECO.\n12. Derechos y Obligaciones de las Personas Beneficiadas.\nLas personas beneficiarias del Programa estarán sujetas a los siguientes derechos y obligaciones:\na) Derechos:\n● Recibir el apoyo del Programa para ejercerlo de acuerdo a lo establecido en las presentes Reglas de\nOperación, sin distinción, exclusión o restricción;\n● Recibir asesoría por parte de la SEFODECO, cuando así lo soliciten, para facilitar la correcta publicación de los recursos recibidos;\n● Recibir un trato digno y respetuoso, por parte de las servidoras y servidores públicos de la SEFODECO, ● La reserva de su información personal será, conforme a lo dispuesto en la Ley Número 466 de Protección de Datos Personales en Posesión de Sujetos Obligados del Estado de Guerrero y la Ley Número 207 de\nREGLAS DE OPERACIÓN\nb) Obligaciones:\n● Destinar el apoyo recibido del Programa, conforme a lo establecido en las presentes Reglas de Operación y la convocatoria respectiva.\n● Presentar, en tiempo y forma, el reporte de comprobación del apoyo autorizado del Programa en el formato, plazo y medio de presentación que establezca la SEFODECO, y\n● En general, cumplir y observar las disposiciones de las presentes Reglas de Operación, la convocatoria correspondiente y las disposiciones jurídicas aplicables.\n12.1. Causales de Suspensión o Baja de las Personas Beneficiada.\nLa suspensión o baja de una beneficiaria o beneficiario del Programa, estará determinada por las siguientes causas:\n● Cuando de manera voluntaria la persona beneficiaria lo solicite mediante escrito dirigido a la persona titular de la SEFODECO;\n● Cuando la persona beneficiaria no presente en tiempo y forma el reporte de comprobación del apoyo autorizado del Programa o incumpla lo dispuesto en las presentes Reglas de Operación, la convocatoria correspondiente o las disposiciones jurídica aplicables.\n12.2. Proceso de Baja.\nEl procedimiento de baja de la persona beneficiaria del Programa, es el siguiente:\na) Cuando la baja del Programa obedezca a una solicitud de la persona beneficiaria, la SEFODECO, mediante oficio firmado por la persona titular de la dependencia, dará respuesta de aceptación de la baja, en un término de diez días hábiles, contados a partir del día siguiente de la recepción de la solicitud, indicando los datos bancarios para el reintegro de los recursos públicos otorgados como apoyo.\nb) Cuando la baja del Programa tenga como causa el incumplimiento, en tiempo y forma, de la comprobación o cualquier incumplimiento a lo establecido en las presentes Reglas de Operación, la convocatoria o las disposiciones jurídicas aplicables, la SEFODECO, requerirá a la persona beneficiaría la subsanación de las observaciones correspondientes, conforme al procedimiento siguiente:\n● Mediante oficio firmado por la persona titular de la SEFODECO, se notificará a la persona beneficiaria las observaciones o incumplimientos, estableciendo un plazo de cinco días hábiles, contados a partir del día siguiente de la notificación del oficio de referencia, para que la persona beneficiaria manifieste lo que a su derecho convenga.\n● Si el requerimiento no es atendido en el plazo establecido o la documentación presentada no subsana las observaciones notificadas, se someterá a consideración del Comité de Evaluación del Programa, la\nREGLAS DE OPERACIÓN cancelación del apoyo y, en consecuencia, solicitar a la persona beneficiaría el reintegro a favor de la\nSEFODECO de los recursos públicos otorgados.\nLas personas beneficiarias cuyo apoyo del Programa, le sea cancelado, no podrán ser beneficiarias de los gubernamental.\n13. Instancias Participantes.\nLas instancias participantes en el Programa, son las siguientes:\n● La SEPLADER, con la validación y autorización de los recursos asignados al Programa.\n● La SEFINA, con la ministración de recursos presupuestales para la operación del Programa.\n● La SEFODECO, como la instancia ejecutora del Programa, a través de la Unidad de Género.\n● La SCyTG y la Auditoría Superior del Estado de Guerrero, son entes que pueden realizar la fiscalización del Programa.\n13.1. Instancia Normativa.\nLa SEFODECO, es la instancia normativa del Programa, en consecuencia, le corresponde la ejecución de las presentes Reglas de Operación, y la emisión de la convocatoria, y en general, la aplicación del marco normativo correspondiente a sus facultades y atribuciones.\n14. Transparencia.\n14.1. Promoción y Difusión del Programa Social.\nLas presentes Reglas de Operación del Programa, se publicarán en el Periódico Oficial del Gobierno del\nEstado de Guerrero y estarán disponibles para su consulta en las oficinas de la SEFODECO, ubicadas en\nRené Juárez Cisneros, de la Ciudad de los Servicios en Chilpancingo de los Bravo, capital del estado de\nGuerrero., edificio Acapulco, primer piso, en un horario de atención de las 9:00 a las 15:00 horas.\n14.2. Contraloría Social.\nEl fundamento legal del Programa, parte del artículo 32 de la Ley Orgánica de la Administración Pública del Estado de Guerrero Número 242, que establece que a la SEFODECO le corresponde, entre otros temas, planear, regular, promover y fomentar el desarrollo económico del estado de Guerrero, en este sentido, no son aplicables las disposiciones normativas de la Contraloría Social, cuyo fundamento se encuentra en la Ley General de Desarrollo Social.\nREGLAS DE OPERACIÓN\nSin embargo, el ejercicio de los recursos públicos y la operación del Programa, están sustentados en la transparencia y la rendición de cuentas, en estricto apego al marco normativo aplicable y bajo la supervisión, mediante auditorias, de entes fiscalizadores como la SCyTG y la Auditoría Superior del Estado de Guerrero.\nAsimismo, la información del Programa se encuentra disponible para la ciudadanía, conforme a lo dispuesto en la Ley Número 466 de Protección de Datos Personales en Posesión de Sujetos Obligados del Estado de Guerrero y la Ley Número 207 de Transparencia y Acceso a la Información Pública del Estado de\nGuerrero.\n14.3. Protección de Datos Personales.\nLa protección de los datos personales de las personas beneficiarias del Programa y la información de las solicitudes de apoyo, se regirán por lo establecido en la Ley Número 466 de Protección de Datos\nPersonales en Posesión de Sujetos Obligados del Estado de Guerrero y la Ley Número 207 de\nTransparencia y Acceso a la Información Pública del Estado de Guerrero.\n14.4. Quejas y Denuncias.\nLa ciudadanía y las personas beneficiarias del Programa podrán presentar ante la SEFODECO, quejas y denuncias, sobre hechos, actos u omisiones, que afecten sus derechos o el incumplimiento de lo dispuesto en las presentes Reglas de Operación; los medios de presentación de las quejas y denuncias son los siguientes:\n● Presencial: en el domicilio de las oficinas de la SEFODECO, ubicadas en el “Recinto de las Oficinas del\nPoder Ejecutivo del Estado” el inmueble ubicado en el número 62, Boulevard René Juárez Cisneros, de la\nCiudad de los Servicios en Chilpancingo de los Bravo, capital del estado de Guerrero., edificio Acapulco, primer piso, en un horario de atención de las 9:00 a las 15:00 horas.\n● En el Buzón Transparente, instalado en el domicilio de las oficinas de la SEFODECO, señalado en el párrafo anterior.\n● Telefónica: en el número telefónico 7472013019.\nPara dar respuesta a las quejas y denuncias, la SEFODECO dispondrá de un plazo de diez días hábiles contados a partir del día siguiente de su fecha de presentación. ante la SCyTG, a través de los medios siguientes:\n● Presencial: en el domicilio de las oficinas de la SCyTG, ubicadas en el “Recinto de las Oficinas del Poder\nEjecutivo del Estado” el inmueble ubicado en el número 62, Boulevard René Juárez Cisneros, de la Ciudad\nREGLAS DE OPERACIÓN de los Servicios en Chilpancingo de los Bravo, capital del estado de Guerrero., edificio Norte, primer piso, en un horario de atención de las 9:00 a las 15:00 horas.\n● Telefónico: en el número telefónico (800) 990 0990, opción 2;\nEn la denuncia o queja la ciudadanía o las personas beneficiarias del Programa, deberán proporcionar los datos siguientes:\n● Nombre de la servidora o servidor público;\n● Secretaría o dependencia de adscripción;\n● Objeto de la denuncia o queja;\n● Nombre y domicilio de la persona quejosa, (opcional, para salvaguardar el anonimato y la confidencialidad de las personas denunciantes); e\n● Identificación oficial (opcional, para salvaguardar el anonimato y la confidencialidad de las personas denunciantes).\n14.5. Acciones de Blindaje.\nEn la operación y el ejercicio de los recursos presupuestales aprobados para el Programa, se aplicarán los lineamientos normativos que emitan la SCyTG, el Instituto de Transparencia, Acceso a la Información y\nProtección de Datos Personales del Estado de Guerrero (ITAIGRO), el Instituto Electoral y de Participación\nCiudadana del Estado de Guerrero (IEPC) y demás instancias federales y estatales competentes, con la finalidad de impedir que los apoyos sean utilizados con fines político electorales.\nComo estrategia de blindaje electoral, la papelería, documentación oficial, así como la publicidad y promoción del Programa, deberán incluir la siguiente leyenda:\n“Este Programa es de carácter público, no es patrocinado ni promovido por partido político alguno y sus recursos provienen de los impuestos que pagan todas las personas contribuyentes. Está prohibido el uso de este Programa con fines políticos, electorales, de lucro y otros distintos a los establecidos. Quien haga uso indebido de los recursos de este Programa deberá ser denunciado y sancionado de acuerdo con la ley aplicable y ante la autoridad competente”.\nEn cuanto a la publicidad en medios electrónicos, impresos, complementarios o de cualquier otra índole, vinculados con los programas de comunicación social, se deberá incluir la siguiente leyenda:\n“Este Programa es público y queda prohibido su uso con fines partidistas o de promoción personal”.\nREGLAS DE OPERACIÓN\n14.6. Acta de Donación (Anexo 2).\nEl Programa no contempla la figura de donación en el otorgamiento de apoyos, en consecuencia, no aplica, pero se comprueba la entrega del recurso a través del formato de reporte de entrega de apoyo (anexo 5), el cual sustituiría el Acta de Donación.\n15. Perspectiva de Género.\nEl Programa, contribuye al fortalecimiento de la perspectiva de género, al fomentar el emprendimiento de mujeres y la juventud, mediante la apertura de microempresas que se sostengan y consoliden en el tiempo para su incorporación a la economía formal, favoreciendo el derecho humano al trabajo y la igualdad de género, al promover la generación de empleos en condiciones de igualdad de oportunidades.\n16. Enfoque de Derechos.\nCon el propósito de generar las condiciones de acceso equitativo de las mujeres y la juventud a los apoyos del Programa, las presentes Reglas de Operación y la convocatoria respectiva, estarán disponibles de las oficinas de la SEFODECO, ubicadas en el “Recinto de las Oficinas del Poder Ejecutivo del Estado” el inmueble ubicado en el número 62, Boulevard René Juárez Cisneros, de la Ciudad de los Servicios en\nChilpancingo de los Bravo, capital del estado de Guerrero., edificio Acapulco, primer piso, en un horario de atención de las 9:00 a las 15:00 horas y se publicarán en el portal oficial del gobierno del estado www.guerrero.gob.mx y en las redes sociales oficiales de la SEFODECO: Sefodeco Guerrero (Facebook), @sefodecogro (Twitter).\nEl Programa está diseñado para favorecer los derechos humanos, al trabajo y a la igualdad de oportunidades entre mujeres y la juventud, promoviendo al acceso equitativo a los apoyos del Programa, así como contribuir al empoderamiento económico de las mujeres, en términos de lo dispuesto en el artículo\n5 fracción X, de la Ley General de Acceso de las Mujeres a una Vida Libre de Violencia.\n17. Acciones Contra el SARS-COV 2. autoridades sanitarias de los tres niveles de gobierno, para el control y prevención del SARS-COV 2.\n18. Anexos que reflejen la entrega del apoyo (Económico. Especie o Servicios).\nAnexo 1. Matriz de indicadores para Resultados.\nAnexo 2.- Formato de Solicitud de Apoyo del Programa.\nAnexo 3.- Formato de Reporte de Comprobación.\nREGLAS DE OPERACIÓN\nAnexo 1 Matriz de Indicadores para Resultados (MIR).\nREGLAS DE OPERACIÓN\nAnexo 2. Formato de Solicitud de Apoyo del Programa de Inclusión de la Mujer y los Jóvenes en la\nEconomía del Bienestar.\nREGLAS DE OPERACIÓN\nREGLAS DE OPERACIÓN\nREGLAS DE OPERACIÓN\nREGLAS DE OPERACIÓN\nPrimero. El presente Acuerdo entrará en vigor al día siguiente de su publicación en el Periódico Oficial del\nSegundo. Se abroga el Acuerdo por el que se crea el Programa de Inclusión de la Mujer y los Jóvenes en la Economía del Bienestar, publicadas en la Edición No. 52 alcance II del periodico Oficial del Gobierno del\nEstado de Guerrero, de fecha 30 de junio de 2023.\nTercero. A partir de la entrada en vigor del presente Acuerdo, las Reglas de Operación del Programa de\nInclusión de la Mujer y los Jóvenes en la Economía del Bienestar, subsecuentes o sus modificaciones serán emitidas por la persona titular de la Secretaria de Fomento y Desarrollo Económico, responsable directa de la operación y ejecución de estas.\nDado en el “Recinto de las Oficinas del Poder Ejecutivo del Estado” ubicado en el\nInterior, Edificio Norte Planta Baja, Boulevard René Juárez Cisneros No. 62, colonia Ciudad de los\nServicios, en Chilpancingo de los Bravo, Capital del Estado de Guerrero, a los diecisiete días del mes de mayo del año dos mil veinticuatro.\nLA GOBERNADORA CONSTITUCIONAL DEL ESTADO DE GUERRERO.\nMTRA. EVELYN CECIA SALGADO PINEDA.\nRúbrica.\nLA SUBSECRETARIA DE GOBIERNO, ASUNTOS JURÍDICOS Y DERECHOS HUMANOS\nENCARGADA DE DESPACHO DE LA SECRETARÍA GENERAL DE GOBIERNO.\nDRA. ANACLETA LÓPEZ VEGA.\nRúbrica.\nLA SECRETARIA DE FOMENTÓ Y DESARROLLO ECONÓMICO.\nMTRA. TEODORA RAMÍREZ VEGA.\nRúbrica.",
  "ordenamiento": "PROGRAMA",
  "jurisdiccion": "GUERRERO",
  "fuente_oficial": "DIARIO OFICIAL DE LA FEDERACION",
  "Fecha de Publicación": "04 \nde junio de 2024",
  "ULTIMA REFORMA PUBLICADA": null,
  "status": "VIGENTE",
  "es_escaneado": false,
  "tiene_tablas": true,
  "materia": [
    "género"
  ]
}