{
  "titulo": "Acuerdo por el Que Se Crea el Programa Transformando el Desarrollo de las Culturas E Identidades de",
  "Contenido": "Y AFROMEXICANO, Y SE EMITEN SUS REGLAS DE\nOPERACIÓN PARA EL EJERCICIO FISCAL 2022\nEL PROGRAMA FORTALECIMIENTO DE CULTURAS DE LOS PUEBLOS INDÍGENAS Y AFROMEXICANOS, Y SE\nEMITEN SUS REGLAS DE OPERACIÓN PARA EL EJERCICIO FISCAL 2023, PUBLICADO EN EL PERIÓDICO\nOFICIAL DEL GOBIERNO DEL ESTADO No. 33 ALCANCE II, EL MARTES 25 DE ABRIL DE 2023.\nTEXTO ORIGINAL.\nAcuerdo publicado en el Periódico Oficial del Gobierno del Estado Edición Extraordinaria, el\nMiércoles 03 de Agosto de 2022.\nACUERDO POR EL QUE SE CREA EL PROGRAMA TRANSFORMANDO EL DESARROLLO\nDE LAS CULTURAS E IDENTIDADES DE PUEBLOS INDÍGENAS Y AFROMEXICANO, Y SE EMITEN\nSUS REGLAS DE OPERACIÓN PARA EL EJERCICIO FISCAL 2022.\nGuerrero.- Poder Ejecutivo.\nMAESTRA EVELYN CECIA SALGADO PINEDA, GOBERNADORA CONSTITUCIONAL DEL ESTADO\nDE GUERRERO, CON FUNDAMENTO EN LO DISPUESTO POR LOS ARTÍCULOS 71, 87, 88 PÁRRAFO\nPRIMERO, 90 NUMERAL 2 Y 91 FRACCIONES I, VI, IX Y XLVI DE LA CONSTITUCIÓN POLÍTICA DEL\nCONFIEREN LOS ARTÍCULOS 2, 3, 6, 7, 10, 18 APARTADO A FRACCIONES I Y XIV, 20 FRACCIÓN I\nY 32 DE LA LEY ORGÁNICA DE LA ADMINISTRACIÓN PÚBLICA DEL ESTADO DE GUERRERO 08;\n1, 2 FRACCIÓN I, 18 Y 25 DE LA LEY NÚMERO 454 DE PRESUPUESTO Y DISCIPLINA FISCAL DEL\nESTADO DE GUERRERO; 7 DE LA LEY NÚMERO 701 DE RECONOCIMIENTO, DERECHOS Y\nCULTURA DE LOS PUEBLOS Y COMUNIDADES INDÍGENAS DEL ESTADO DE GUERRERO; EN\nRELACIÓN CON EL ARTÍCULO 57 Y ANEXOS 21 (E14) Y 21-A (E14) DEL DECRETO NÚMERO 160\nDEL PRESUPUESTO DE EGRESOS DEL ESTADO DE GUERRERO PARA EL EJERCICIO FISCAL\n2022 Y LOS LINEAMIENTOS PARA LA ELABORACIÓN DE LAS REGLAS DE OPERACIÓN DE LOS\nPROGRAMAS SOCIALES ESTATALES PARA EL PERIODO 2022-2027.\nQue el Plan Nacional de Desarrollo 2019-2024 en el apartado de Política y Gobierno incluye Recuperar el\nEstado de Derecho y Libertad e Igualdad, la Política Social en Construir con un país de bienestar, y\nEconomía con Proyectos regionales de Autosuficiencia alimentaria y rescate del campo. de los pueblos indígenas y afromexicanos. identidad y la cultura, así como fortalecer la difusión entre los jóvenes, de las lenguas originarias de las comunidades indígenas, con el fin de preservar nuestra identidad cultural.\nY AFROMEXICANO, Y SE EMITEN SUS REGLAS DE\nOPERACIÓN PARA EL EJERCICIO FISCAL 2022 país, dentro de ellas, la desigualdad de género que es una de las brechas de mayor amplitud. Muestra de ello; es la ola de violencia en contra de los derechos de las mujeres. Los feminicidios, el acoso, la discriminación laboral y la exclusividad de los quehaceres del hogar, así como del cuidado familiar, son la evidencia de una sociedad que ve en las mujeres a personas de segunda clase, incapaces de ejercer libremente sus derechos. Por ende, la perspectiva de género es un factor de aplicación transversal en este proyecto de Presupuesto de Egresos. La visión de futuro para nuestro estado es de derechos e inclusión, siendo una de las prioridades contribuir a reducir las carencias sociales, entre las que destacan la educativa con 23.7 por ciento en esta condición, servicios de salud con 13.8 por ciento, carencia de acceso a la seguridad social con 75.6 por ciento y carencia alimentaria con 27.8 por ciento. Por lo que la alimentación, educación, salud, seguridad social y pública son los principales indicadores por mejorar.\nQue como lo establece la Constitución Política de los Estados Unidos Mexicanos la mujer y el hombre son iguales ante la ley; la cual protegerá la organización y el desarrollo de la familia. En este sentido, el Proyecto de Presupuesto de Egresos 2022 tiene como objetivo contribuir a cimentar las bases para la disminución de la pobreza y traer paz a las familias guerrerenses. Pobreza y violencia son, sin duda, el resultado de gobiernos con poca sensibilidad social. Por lo que la transparencia, la honestidad, la austeridad republicana, el combate a la corrupción y la eficiencia en el ejercicio del gasto son ejes fundamentales que le dan sustento. Por consiguiente, la visión de futuro para nuestro estado es de derechos e inclusión, por lo que una de las prioridades es contribuir a reducir las carencias sociales.\nQue mediante la Ley Orgánica de la Administración Pública del Estado de Guerrero Número 433, publicada en el Periódico Oficial del Gobierno del Estado el 12 de octubre de 1999, se crea la Secretaría de Asuntos\nIndígenas, con el propósito de proteger y preservar los derechos y cultura de las comunidades indígenas, así como para dar seguimiento a la aplicación y operación de los programas y acciones de las dependencias federales, estatales y municipales, dirigidos a promover el desarrollo integral de las y los indígenas, correspondiéndole el despacho entre otros asuntos, el de promover el respeto de los derechos, lengua y cultura de las comunidades indígenas. De acuerdo al Decreto Número 779, actualmente la secretaría es llamada Secretaría de Asuntos Indígenas y Afromexicanos.\nQue las personas titulares de las Secretarías, Dependencias y Entidades de la Administración Pública\nEstatal, así como, las servidoras y servidores públicos autorizados para ejercer recursos públicos del presupuesto de inversión de las mismas, serán responsables de los programas y proyectos de inversión que realicen, las cuales deberán sujetarse a criterios de objetividad, equidad, transparencia, publicidad, selectividad y temporalidad.\nQue el artículo 57 del Decreto Número 160 del Presupuesto de Egresos del Estado de Guerrero para el\nEjercicio Fiscal 2022, establece que con el objeto de asegurar la aplicación eficiente, eficaz, oportuna equitativa y transparente de los recursos públicos, la Secretaría de Finanzas y Administración y la programas de inversión sujetos a Reglas de Operación.\nY AFROMEXICANO, Y SE EMITEN SUS REGLAS DE\nOPERACIÓN PARA EL EJERCICIO FISCAL 2022\nQue, con sustento en lo anterior, la Secretaría de Planeación y Desarrollo Regional, expidió los fecha 18 de febrero del 2022.\nQue el gobierno del estado de Guerrero, a través de la Secretaría de Asuntos Indígenas y Afromexicanos, ejecutará para este ejercicio fiscal 2022, el Programa Transformando el Desarrollo de las Culturas e\nIdentidades de los Pueblos Indígenas y Afromexicano, con el objetivo de impulsar procesos y acciones que impacten en la creatividad y revitalización del patrimonio cultural y las identidades de los pueblos y comunidades indígenas y afromexicanas, para propiciar el reconocimiento de la diversidad y un diálogo intercultural entre la sociedad Guerrerense.\nPor lo anteriormente expuesto y con fundamento en las disposiciones legales antes citadas, he tenido a bien expedir el siguiente:\nACUERDO POR EL QUE SE CREA EL PROGRAMA TRANSFORMANDO EL DESARROLLO DE LAS\nCULTURAS E IDENTIDADES DE PUEBLOS INDÍGENAS Y AFROMEXICANO, Y SE EMITEN SUS\nREGLAS DE OPERACIÓN PARA EL EJERCICIO FISCAL 2022.\nArtículo 1. Se crea el Programa Transformando el Desarrollo de las Culturas e Identidades de Pueblos\nIndígenas y Afromexicano con el objeto de Impulsar procesos y acciones que impacten en la creatividad y revitalización del patrimonio cultural y las identidades de los pueblos indígenas y afromexicano, para propiciar el reconocimiento de la diversidad y un diálogo intercultural entre la sociedad guerrerense.\nArtículo 2. La Secretaría de Asuntos Indígenas y Afromexicanas, tendrá a cargo la implementación, ejecución, evaluación y administración del Programa Transformando el Desarrollo de las Culturas e\nIdentidades de Pueblos Indígenas y Afromexicano, bajo los criterios de objetividad, equidad, transparencia, publicidad, selectividad y temporalidad, con estricto apego a la normatividad aplicable, por lo tanto, será la encargada de la dispersión y asignación de los recursos del Programa, apegándose plenamente a las\nReglas de Operación.\nArtículo 3. Se emiten las Reglas de Operación del Programa Transformando el Desarrollo de las Culturas e Identidades de Pueblos Indígenas y Afromexicano para el Ejercicio Fiscal 2022, en las que se establece el procedimiento de ejecución del Programa, los principios, requisitos y condiciones que deben observarse para acceder al mismo, en los términos siguientes:\nFISCAL 2022.\n1. Introducción.\n1.1. Antecedentes.\nY AFROMEXICANO, Y SE EMITEN SUS REGLAS DE\nOPERACIÓN PARA EL EJERCICIO FISCAL 2022\nDesde la antigüedad Guerrero ha sido y sigue siendo una amalgama de pueblos, razas, idiomas, culturas y costumbres, en las que han residido y se han desarrollado lo mismo la cultura olmeca y la teotihuacana, que la mixteca, la náhuatl y sobre todo la Cultura Mezcala, la cual ha sido nuestro principal y singular aporte al mundo mesoamericano y a la posteridad. Antes de la conquista, ya habitaban en Guerrero los pueblos\nMixteco, Amuzgo, Náhuatl y los Tlapanecos de Tlapa y Yopitzingo; y desde los primeros tiempos de la\nColonia, los pueblos afromestizos de la Costa, los cuales constituyen nuestra tercera raíz.\nPor naturaleza, historia y destino Guerrero es un estado pluriétnico y multicultural, que se nutre y enriquece de su propia diversidad y de la asimilación crítica de la cultura universal. De ahí, que la resistencia de los pueblos y comunidades indígenas y afromestizas en defensa de sus derechos y libertades, tenga tan hondas raíces en esta suriana entidad. Durante todo el siglo XX se continuó considerando a los pueblos indígenas como objeto de políticas proteccionistas y asistencialistas. Ahora en pleno siglo XXI el Ejecutivo\nFederal, el Congreso de la Unión y una parte de la sociedad nacional esta última, por desconocimiento o indolencia– se niegan a reconocer a los pueblos indígenas como sujetos de derecho público con personalidad jurídica y patrimonio propios y con pleno derecho a la autonomía y la libre determinación, como vivían hasta la reforma.\nLa Constitución Política de los Estados Unidos Mexicanos, precisa en su artículo 2o, que la Nación\nMexicana es única e indivisible; que, asimismo, tiene una composición pluricultural sustentada originalmente en sus pueblos indígenas; y que la conciencia de su identidad indígena deberá ser criterio fundamental para determinar a quienes se aplican las disposiciones sobre pueblos indígenas. La misma\nConstitución, en el artículo en cita, expresa que son comunidades integrantes de un pueblo indígena aquellas que formen una unidad social, económica y cultural, asentadas en un territorio y que reconocen autoridades propias de acuerdo con sus usos y costumbres, y que el derecho de los pueblos indígenas a la libre determinación se ejercerá en un marco constitucional de autonomía que asegure la unidad nacional; reconocimiento que se hará, en las constituciones y leyes de las entidades federativas, en las cuales se establecerán las características que mejor expresen las situaciones y aspiraciones de los pueblos indígenas en cada entidad, así como las normas para su reconocimiento, el establecimiento de las instituciones y las políticas necesarias para garantizar la vigencia de sus derechos y el desarrollo integral de sus pueblos y comunidades como entidades de interés público.\nCon la implementación del Programa Transformando el Desarrollo de las Culturas e Identidades de Pueblos\nIndígenas y afromexicano, el gobierno del estado de Guerrero concreta una política de reconocimiento a los pueblos indígenas y afromexicano, a través del cumplimiento de sus derechos, relacionados con la preservación y revitalización de sus culturas y el fortalecimiento de sus identidades, como fundamento en de Guerrero en su artículo 8, en el que se destaca que el estado sustenta su identidad en los pueblos indígenas nahua, mixteco, tlapaneco y amuzgo, así como en el pueblo afromexicano; asimismo hace posible dar cumplimiento al artículo 11, fracción V, en el que se reconoce como derecho el preservar y enriquecer sus lenguas, conocimientos y todos los elementos que constituyen su cultura e identidad. Bajo estas premisas, el Programa contempla el impulso de diversas expresiones artísticas y culturales, principalmente las relacionadas con la música y danzas tradicionales, así como el fortalecimiento\nY AFROMEXICANO, Y SE EMITEN SUS REGLAS DE\nOPERACIÓN PARA EL EJERCICIO FISCAL 2022 de los saberes de los terapeutas tradicionales y la promoción cultural, a través de la publicación de trípticos, carteles y libros.\nDe esta manera, la Secretaría de Asuntos Indígenas y Afromexicanos (SAIA), como instancia responsable de implementar el Programa, propicia espacios y mecanismos de difusión y participación para impulsar y fortalecer las culturas, las identidades y el tejido social de los pueblos indígenas y afromexicanos conjuntamente con los grupos y promotores culturales interesados en los beneficios de las acciones.\nEs importante señalar que, si bien dentro de las acciones del Programa se propiciará el fortalecimiento cultural e identitarios de los cinco pueblos, se hará un especial énfasis en promover la revitalización cultural indígena y la reafirmación de la identidad afromexicana. Lo anterior en razón de que el pueblo afromexicano, a diferencia de los cuatro pueblos indígenas, recién en los últimos treinta años transita en un proceso de reconocimiento, reivindicación y auto adscripción, cuyos resultados positivos se han reflejado en su inclusión dentro de la Constitución local y en la Encuesta Intercensal 2015 del INEGI, que por primera vez considera en sus registros a la población afromexicana.\nGeneralmente los programas y acciones dirigidos a preservar y rescatar las culturas indígenas se han limitado a promover las expresiones artísticas desde un enfoque folclorista que convierte a estas múltiples manifestaciones culturales en simples piezas de artesanía, danza o música, sin ninguna vinculación con los valores culturales e identitarios que durante siglos se han conservado y transformado gracias a los mecanismos de lucha y preservación de los pueblos indígenas y afromexicanos.\nAnte este panorama, la Secretaría de Asuntos Indígenas Afromexicanos (SAIA) ha procurado aproximarse respetuosamente a las culturas indígenas y afromexicana, a partir del conocimiento de aquello que subyace a esta diversidad de expresiones para evitar, así, corromper, banalizar o folclorizar los atributos culturales que son los componentes esenciales de las identidades de estos pueblos.\nEn este sentido, se prestará una especial atención a los elementos culturales intangibles, como la música, la danza, las lenguas y los saberes y conocimientos tradicionales, que, por un lado, revitalizarán las culturas indígenas, y por el otro contribuirán en el fortalecimiento y reafirmación de la cultura afromexicana, que desde el año 2013 se ha venido atendiendo.\n2. Alineación Programática al PED y/o PND. para alcanzarlos, el Programa Transformando el Desarrollo de las Culturas e Identidades de Pueblos\nIndígenas y Afromexicano se encuentra alineado al Plan Nacional de Desarrollo 2019-2024 en el apartado de I.- Política y Gobierno incluye Recuperar el Estado de Derecho y Libertad e Igualdad, el cual igualdad efectiva de derechos entre mujeres y hombres, entre indígenas y mestizos, entre jóvenes y adultos, y se comprometerá en la erradicación de las prácticas discriminatorias que han perpetuado la opresión de sectores poblacionales enteros; II. Política Social en Construir un país con bienestar, en\nY AFROMEXICANO, Y SE EMITEN SUS REGLAS DE\nOPERACIÓN PARA EL EJERCICIO FISCAL 2022\nMéxico los artículos 3, 27, 123 y otros de la Constitución de 1917 sentaron las bases para un estado de comunitarias; III. Economía con Proyectos regionales Autosuficiencia alimentaria y rescate del campo. El sector agrario ha sido uno de los más devastados por las políticas neoliberales. A partir de 1988 se destruyeron mecanismos que resultaban fundamentales para el desarrollo agrario, se orientó el apoyo público a la manipulación electoral y se propició el vaciamiento poblacional del agro. Las comunidades indígenas, que han vivido desde hace siglos la opresión, el saqueo y la discriminación, padecieron con particular intensidad esta ofensiva.\n2.1. Diagnóstico.\nEl carácter pluricultural del estado de Guerrero se encuentra cimentado por los grupos étnicos que se asientan en su territorio, principalmente por los pueblos indígenas Nahua, Na savi (mixteco), Me’pha\n(tlapaneco) y Nn´anncue Ñomdaa (amuzgo), y el pueblo afromexicano. Además, estos pueblos y sus comunidades son base fundamental de la identidad y la raíz histórica del estado, contribuyendo con sus saberes ancestrales, cosmovisiones, organización social y expresiones lingüísticas y artísticas a la riqueza cultural de Guerrero. Cabe señalar que estos cinco pueblos comparten algunos rasgos culturales, sin embargo, cada uno de ellos guarda su propia cultura e identidad que los define, diferencia y, paralelamente, los hace reconocerse como tales.\nLa trascendencia de los pueblos indígenas y afromexicano, no sólo se fundamenta en sus aportes culturales e históricos, sino también por su importancia numérica, tal como lo muestra Censo de Población y Vivienda 2020:\nGUERRERO 2020\nTotal de población de Guerrero: 3´540,685\nMujeres: 1´840,073\nHombres:1 1´700,612\nTotal Población hablante de lengua indígena: 515,487\nTotal Población que se autoreconoce indígena: 1’198,362\n111 1 Censo de Población y Vivienda 2020, INEGI\n2 Programa Especial de Pueblos Indígenas 2014-2018. México, CDI, 2014, p. 36\nY AFROMEXICANO, Y SE EMITEN SUS REGLAS DE\nOPERACIÓN PARA EL EJERCICIO FISCAL 2022\nTotal, Población que se autoreconoce afromexicana: 303,923\nNo obstante, la significación de estos pueblos y sus comunidades, históricamente han padecido discriminación, marginación, pobreza y limitación en el ejercicio de sus derechos humanos, lo cual ha afectado su desarrollo individual y colectivo.\nComo uno de los efectos del rezago social y jurídico, las culturas indígenas y afromexicana enfrentan procesos de debilitamiento de su identidad que se traduce en desvaloración de lo propio, deterioro del patrimonio cultural y resquebrajamiento del tejido social. A lo anterior habría que agregar la visión distorsionada que aún mantienen diversos sectores de la sociedad, con respecto a las culturas indígenas y afromexicana, ya que con frecuencia se confunde cultura con folclor y se insiste en mostrar sólo aquellas dimensiones más exóticas y externas de la cultura. Al someter a las culturas indígenas y afromexicana a una visión folclórica, se crea un objeto exótico que alimenta las miradas románticas, paternalistas e ilusorias de la cultura, a la que se la quiere despojar de su importancia y trascendencia histórica, pues sólo la ven atada a la nostalgia del pasado.\nAsimismo, los pueblos indígenas y afromexicanos de Guerrero, demandan una mirada más sistémica sobre sus culturas, que no se las reduzca únicamente a los aspectos materiales y a las expresiones exotizantes, ya que no sólo son un cúmulo de cosas a ser observadas, o bienes y patrimonios materiales. En sus culturas se producen procesos de comunicación e interacción entre las personas, lo cual hace posible la construcción de los diversos sentidos de su vida social; en las manifestaciones folclóricas apenas se expresan formas de intercambio que quedan en el nivel más manifiesto, externo y secundario de la cultura.\nAsimismo, los pueblos indígenas y afromexicano no necesitan que se “rescaten” sus culturas, pues éstas se encuentran vivas; la noción de rescate cultural ha conducido y reducido a las culturas en expresiones folclóricas, visión que es comúnmente aceptada en el trabajo cultural, caracterizado por tratar de encontrar restos materiales de la cultura, para mostrarlos como las verdaderas y únicas expresiones de la identidad cultural. El llamado rescate cultural está cargado de un profundo sentido etnocéntrico e ideológico, ya que representa un hecho externo surgido del experto o el rescatador, por lo tanto, desde fuera de las comunidades que son las que construyen la cultura. En el rescate cultural, la comunidad no tiene sino un mero rol de objeto pasivo, lo que contribuye a su alienación y dependencia, pues no se la ve como el sujeto histórico capaz de encargarse de la gestión de sus propias construcciones culturales. cultural, puesto que estos procesos sólo pueden ser posibles desde la propia vida de las comunidades que la construyen. En la revitalización cultural la comunidad y los actores sociales comunitarios se construyen en sujetos sociales, políticos e históricos, lo que permite eliminar la visión de los rescatadores, a quienes sólo les interesa encontrar “piezas” para ser fosilizadas en los museos. Mientras que las personas que revitalizan la cultura lo hacen desde las dimensiones profundas de la memoria colectiva, incrementando la experiencia social de la existencia comunitaria, que le permita afirmar los propios recursos culturales que han sido capaces de construir como pueblos.\nY AFROMEXICANO, Y SE EMITEN SUS REGLAS DE\nOPERACIÓN PARA EL EJERCICIO FISCAL 2022\nEn congruencia con lo anterior, la SAIA implementa el presente Programa con el objeto de atender las demandas indígenas y afromexicanas en materia cultural, e iniciar un proceso que revitalice las culturas e identidades de estos pueblos.\n2.1.1 Población Potencial.\nEn Guerrero la población total es de 3´540,685 habitantes de los cuales 548,098 hablantes de la lengua indígena que representa el 15.48 % y 303,790 habitantes que se auto reconocen afromexicanos que equivale al 8.58 %, el cual da como resultado un total de 852,243 habitantes que constituyen nuestra población potencial que representa el 24.07% de la población total del estado de Guerrero.\n2.1.2. Población Objetivo.\nLa cultura se manifiesta a través del vestido, la gastronomía, la lengua, las formas de comunicación y relación; y reconocer que todas las personas, grupos y comunidades tienen una manera específica de ver al mundo y comprenderlo, hablando de la diversidad cultural. La población objetivo la constituyen a aquellos grupos o familias que se dediquen a la música, danza y/o artesanías que sean indígenas Nahua, Na savi\n(mixteco), Me’pha (tlapaneco) y Nn´anncue Ñomdaa (amuzgo)) o que se auto reconozcan como\nAfromexicanos de los 85 municipios del estado y cumpla con los requisitos previos para ser beneficiadas o beneficiados en el numeral 6 Criterios y Requisitos de Elegibilidad de las presentes Reglas de Operación.\n2.1.3. Población Beneficiaria.\nPersonas y grupo de personas indígenas y afromexicanas que realicen actividades vinculadas con las diferentes expresiones artísticas y culturales, específicamente las relacionadas con la música, la danza y las lenguas indígenas.\n2.1.4. Población Indígena.\nSe tiene programado beneficiar a los cuatro pueblos indígenas (Nahua, Na savi, mixteco, Me’pha\n(tlapaneco) y Nn´anncue Ñomdaa amuzgo), así como a los municipios afromexicanos, que realicen actividades vinculadas con las diferentes expresiones artísticas y culturales que habitan en los 85 municipios del estado, dando prioridad a los municipios de Azoyú, Copala, Cuajinicuilapa, Cuautepec, Florencio Villarreal, Juchitán, Marquelia, Ometepec, San Marcos y Teconapa.\n2.2. Fundamento Legal. ejecución:\na) Constitución Política de los Estados Unidos Mexicanos.\nY AFROMEXICANO, Y SE EMITEN SUS REGLAS DE\nOPERACIÓN PARA EL EJERCICIO FISCAL 2022\nc) Ley General para la Igualdad entre Mujeres y Hombres.\nd) Ley Número 701 de Reconocimiento, Derechos y Cultura de los Pueblos y Comunidades\nIndígenas del Estado de Guerrero.\ne) Ley General de Acceso de las Mujeres a una Vida Libre de Violencia.\nf) Ley Orgánica de la Administración Pública del Estado de Guerrero Número 08.\ng) Ley Número 207 de Transparencia y Acceso a la Información Pública del Estado de\nGuerrero.\nh) Ley Número 465 de Responsabilidades Administrativas para el Estado de Guerrero.\ni) Ley Número 466 de Protección de Datos Personales en Posesión de Sujetos Obligados del\nEstado de Guerrero.\nj) Ley Número 494 para la Igualdad entre Mujeres y Hombres del Estado de Guerrero.\nk) Ley Número 553 de Acceso de las Mujeres a una Vida Libre de Violencia del Estado Libre y\nSoberano de Guerrero.\nm) Declaración Universal de las Naciones Unidas sobre los Derechos de los Pueblos Indígenas.\nn) Convenio 169 sobre Pueblos Indígenas y Tribales, de la Organización Internacional del\nTrabajo.\no) Plan Nacional de Desarrollo 2019-2024.\np) Decreto Número 160 del Presupuesto de Egresos del Estado de Guerrero para el Ejercicio\nFiscal 2022.\nq) Reglamento Interior de la Secretaría de Asuntos Indígenas.\nr) Lineamientos para la Elaboración de las Reglas de Operación de los Programas Sociales\nEstatales para el periodo 2022-2027.\ns) Ley Número 454 de Presupuesto y Disciplina Fiscal del Estado de Guerrero.\nt) Todos aquellos ordenamientos normativos aplicables.\nY AFROMEXICANO, Y SE EMITEN SUS REGLAS DE\nOPERACIÓN PARA EL EJERCICIO FISCAL 2022\n2.3. Definiciones y Siglas.\nDefiniciones:\nAgrupación musical: Conjunto, banda de música de viento o grupo musical, compuestos por dos o más personas que, a través de la voz y/o de instrumentos, interpretan obras musicales que conservan la tradición musical de las comunidades indígenas y afromexicanas. Para los fines de estas Reglas de\nOperación, los conjuntos o bandas musicales que interpretan cualquier género de música moderna no están considerados en esta categoría.\nAlienación: Pérdida de la personalidad o de la identidad de una persona o de un colectivo.\nApoyo en especie: Otorgamiento de bienes y servicios, diferente al apoyo monetario.\nAuto adscripción afromexicana: Autor reconocimiento como persona descendiente de población africana que llegó al territorio de México durante la conquista y colonización española, con base en su propia cultura, tradiciones e historia.\nAuto adscripción indígena: Autor reconocimiento como persona indígena con base en su propia cultura, tradiciones e historia, ya sea hablante o no de alguna lengua indígena.\nCarta Compromiso: carta mediante la cual las personas beneficiarias se comprometen a cumplir con lo estipulado en estas Reglas de Operación, sin necesidad de un notario.\nCosmovisión: Es la manera de ver e interpretar el mundo. Conjunto de ideas que nos permite analizar y comprender la realidad, a partir de la propia existencia.\nCultura: Conjunto de conocimientos, creencias, valores, costumbres, conductas, leyes y cualquier otra capacidad y hábitos adquiridos por las personas, que hacen posible la vida, transformación y reproducción de una sociedad.\nCultura intangible: Es el conjunto de manifestaciones no materiales que genera una cultura, como son los saberes y conocimientos, las celebraciones y rituales, las manifestaciones musicales, literarias, dancísticas y plásticas, entre otros. Este patrimonio se transmite oralmente y se modifica con el transcurso del tiempo, a través de un proceso de recreación colectiva.\nDanzas tradicionales: Bailes típicos propios de las culturas indígenas y afromexicana, cuyo origen puede o no remontarse a la época colonial, bailadas por hombres y mujeres de las comunidades, principalmente durante acontecimientos sociales y fiestas patronales.\nDialogo intercultural: Intercambio de opiniones y puntos de vista entre distintas culturas, comunidades y pueblos, basado en la comprensión y el respeto mutuo.\nY AFROMEXICANO, Y SE EMITEN SUS REGLAS DE\nOPERACIÓN PARA EL EJERCICIO FISCAL 2022\nDiscriminación: Trato diferente y perjudicial que se da a una persona o colectividad por motivos de edad, color, capacidades, etnia, nacionalidad, género, orientación sexual, ideas políticas, religión, entre otras.\nElementos culturales: Son todas las partes que componen la cultura de un pueblo, país o etnia. Junto con los elementos naturales, les dan forma, cohesión e identidad a las sociedades y permiten su identificación y diferenciación respecto a otras.\nEtnocéntrico: Persona o colectividad que considera su propia cultura superior a las demás, y estima sólo válidos sus criterios para interpretar y valorar los comportamientos, costumbres, tradiciones y valores de otras colectividades.\nExótico: Características o condiciones culturales que son muy distintas a las propias, por lo que se consideran “raras”, risibles o novedosas.\nExpresiones artísticas y culturales: Conjunto de manifestaciones de una etnia, pueblo o país que incluye la música, danza, arte, diseños, signos, símbolos, interpretaciones, ceremonias, rituales, mitos, saberes, narraciones, artesanías, formas arquitectónicas, entre otras.\nExpresiones lingüísticas: Manifestaciones que pertenecen o están relacionadas con el lenguaje.\nFolclore: Conjunto de expresiones culturales tradicionales de un pueblo, así como la disciplina que se encarga del estudio de estas materias.\nFolclorizar: Uso de una tradición popular fuera del contexto en que se desarrolló. Significa también distorsionar las culturas de los pueblos y reducirlas a una artesanía que se vende, a un objeto que se oferta y una realidad que no se investiga y no se piensa.\nGrupos étnicos: Grupo humano que comparte instituciones sociales y rasgos culturales como la lengua, valores, costumbres, entre otros elementos. Las mujeres y hombres del grupo están unidos por una consciencia de identidad común establecida históricamente.\nIdentidad: Es el sentido de pertenencia a una colectividad, construido a través de la adopción de elementos culturales comunes a dicha colectividad, y que nos permite diferenciarnos y reafirmarnos ante personas de otras culturas.\nIdeológico: Conjunto de ideas fundamentales que caracteriza el pensamiento de una persona, una colectividad o una época.\nMarginación: Indicador que mide la intensidad de las privaciones padecidas por la población a través de\n9 formas de exclusión agrupadas en 4 dimensiones: educación, vivienda, distribución de la población e ingresos monetarios.\nY AFROMEXICANO, Y SE EMITEN SUS REGLAS DE\nOPERACIÓN PARA EL EJERCICIO FISCAL 2022\nMemoria colectiva: Conjunto de representaciones del pasado que un grupo produce, conserva, elabora y transmite, a través de la relación entre sus miembros.\nOrganización social: Grupo de individuos que unen actuaciones para alcanzar determinados propósitos.\nPadrón de Personas Beneficiarias: Relación de beneficiarias y beneficiarios, de obras o de servicios de un Programa de Desarrollo Social.\nParteras tradicionales: Son un recurso comunitario de atención a la salud, de amplio reconocimiento y prestigio en sus comunidades; son las encargadas de brindar cuidados a las mujeres durante el embarazo, parto y posparto.\nPatrimonio cultural: Conjunto de bienes tangibles e intangibles, que constituyen la herencia de un grupo humano, que refuerza su sentido de comunidad e identidad propia. Como producto de la creatividad humana, se hereda, se transmite, se modifica y optimiza de individuo a individuo y de generación a generación.\nPersona beneficiaria: Persona que recibe los bienes y/o servicios, por haber cumplido con los requisitos establecidos en las presentes Reglas de Operación.\nPromoción cultural: sistema de acciones que facilita una relación activa entre la población y la cultura.\nPluriculturalidad: Presencia de dos o más culturas en un mismo territorio, donde puede existir la posibilidad que surjan situaciones de interrelación.\nRevitalización cultural: Estrategia y acciones tendientes a la activación de las manifestaciones culturales, a partir del fortalecimiento de la vida de las comunidades, la revaloración de la memoria histórica y de las prácticas y saberes comunitarios.\nSaberes ancestrales: Conjunto de saberes y prácticas conservadas a lo largo del tiempo, a través de la tradición oral de los pueblos, y transmitida de generación a generación.\nSujeto histórico: Persona con la capacidad de transformar su realidad y con ello producir acontecimientos históricamente relevantes.\nTerapeutas tradicionales: Conjunto de especialistas de la medicina tradicional que constituye un recurso comunitario de atención a la salud. Son hombres y mujeres reconocidos por sus comunidades como poseedores de los saberes y habilidades para curar.\nTejido social: Es la configuración de vínculos sociales e institucionales que favorecen la unión y la reproducción de la vida social.\nSiglas:\nY AFROMEXICANO, Y SE EMITEN SUS REGLAS DE\nOPERACIÓN PARA EL EJERCICIO FISCAL 2022\nSAIA: Secretaría de Asuntos Indígenas y Afromexicanos.\n3. Objetivos y Alcances.\n3.1. Objetivo General.\nImpulsar procesos y acciones que impacten en la creatividad y revitalización del patrimonio cultural y las identidades de los pueblos indígenas y afromexicano, para propiciar el reconocimiento de la diversidad y un diálogo intercultural entre la sociedad guerrerense.\n3.2. Objetivo Específico.\na) Impulsar y difundir las diferentes expresiones artísticas y culturales de los pueblos indígenas y afromexicano.\nb) Contribuir al fortalecimiento de la identidad afromexicana, a través de estrategias y acciones que propicien la auto adscripción y la revaloración cultural.\n3.3. Cobertura.\nEl Programa tendrá una cobertura estatal y será implementado por la SAIA, a través de la Dirección de\nPromoción y Difusión Cultural.\n3.4. Alcances.\nLa Ley Número 701 de Reconocimiento, Derechos y Cultura de los Pueblos y Comunidades Indígenas del\nEstado de Guerrero, en su artículo 26, fracción IV, mandata que el estado y las instituciones deberán preservar y enriquecer las lenguas indígenas, así como sus conocimientos y todos los elementos que constituyan sus culturas e identidades. Asimismo, bajo los mismos términos este derecho es reconocido en en las que ya se incorpora al pueblo afromexicano al goce de éste y otros derechos.\nAcorde con estos mandatos constitucionales y con las demandas indígenas y afromexicanas recogidas en los Foros de Consulta Ciudadana, efectuados para elaborar el Plan Estatal de Desarrollo 2022-2027, se persona titular del Ejecutivo, destacando las acciones encaminadas a impulsar y promover el uso de las cuatro lenguas indígenas e impulsar las culturas e identidades indígenas y afromexicana, atendiendo a su derecho a la seguridad social.\nLa forma más común de identificar la seguridad social es mediante las prestaciones y la asistencia médica, sin embargo, esas son solo algunas de las formas en las que se presenta en la vida cotidiana. En los hechos, la seguridad social también se encuentra en los actos solidarios e inclusivos de las personas hacia los demás, pues esos actos llevan en sí mismos la búsqueda del bienestar social.\n4. Metas Físicas.\nY AFROMEXICANO, Y SE EMITEN SUS REGLAS DE\nOPERACIÓN PARA EL EJERCICIO FISCAL 2022\nLos servicios y acciones estarán sujetos a la disponibilidad presupuestal del Programa, y son los siguientes:\nI. Exposición de Artesanías de pueblos indígenas y Afromexicanos.\n● 2 exposiciones de artesanías en Chilpancingo de los Bravo, Guerrero.\n● 1 exposición de artesanías en Acapulco de Juárez, Guerrero.\nII. Eventos para el impulso de las culturas e identidades.\n● 6 encuentros y festivales para el impulso cultural e identitario, en los municipios de Iliatenco, Juchitán, Copalillo, Tlapa de Comonfort, Cuajinicuilapa y Chilpancingo de los Bravo.\n● 2 talleres para el fortalecimiento de la medicina indígena tradicional, en los municipios de Tlapa de\nComonfort y Chilapa de Álvarez.\nIII. Promoción y difusión de la música y danzas indígenas y afromexicanas.\n● 5 talleres de capacitación para reparación de instrumentos musicales, en los municipios de Chilapa de\nÁlvarez, Copanatoyac, Atlamajalcingo del Monte, Cochoapa el Grande y Tlacoachistlahuaca.\n● 131 instrumentos donados a agrupaciones musicales tradicionales.\n● 40 grupos de danza con apoyo de vestuario.\n5. Programación Presupuestal.\nLos recursos aprobados en el Decreto Número 160 de Presupuesto de Egresos para el presente ejercicio fiscal para el Programa corresponden a inversión estatal directa que ascienden a$4,000,000.00 (cuatro millones de pesos 00/100 M.N.). No se puede establecer monto de la población beneficiada en virtud que van desde ferias o exposiciones de artesanías, donación de instrumentos musicales etc.\nCalendario de Ministración\nI. Exposición\nCultural Regional 265,000 46,000 72,300 71,300 75,400 de artesanías\nII. Eventos para el impulso de las 529,000 142,200 165,200 111,300 110,300 culturas e identidades\nY AFROMEXICANO, Y SE EMITEN SUS REGLAS DE\nOPERACIÓN PARA EL EJERCICIO FISCAL 2022\nIII. Promoción y difusión de la\n3,206,000 578,000 649,500 452,500 704,000 822,000 música y danzas indígenas y afromexicanas.\nTOTAL ($) 4,000,000 766,200 721,800 617,700 886,600 822,000 185,700\nTOTAL 4,000,000 766,200 2,226,100 1,007,700\nTRIMESTRAL\nCronograma de Actividades\nCONCEPTO ENE FEB MAR ABR MAY JUN JUL AGO SEP OCT NOV DIC\nI. Exposición Cultural\nRegional de Artesanías\nII. Eventos para El Impulso de las\nCulturas e Identidades\nIII. Promoción y Difusión de la\nMúsica y Danzas Indígenas y\nAfromexicanas.\n5.1. Gastos de Operación.\nEn cumplimiento al artículo 47 de la Ley de Coordinación Fiscal, podrá aplicarse hasta un 3% del presupuesto total del Programa, a gastos de operación y realización de diversas acciones, asociadas con la planeación, operación, supervisión, seguimiento, contraloría social y evaluación o asesoría externa del\nPrograma, por un monto de $120,000.00 (ciento veinte mil pesos 00/100 M.N.). de acuerdo a la tabla siguiente:\nUNIDAD DE\nCOSTO\nCAPITULO CONCEPTO PARTIDA MEDIDA CANTIDAD TOTAL\nUNITARIO\n2111 Paquete 2 $5,000.00 $10,000.00\n2000 2100\n2121 Paquete 2 $5,000.00 $10,000.00\n2600 2611 Litro 1500 $22.00 $33,000.00\n3721 Caseta 10 $500.00 $5,000.00\n3000 3700\n3751 Día 62 $1,000.00 $62,000.00\n$120,000.00\nY AFROMEXICANO, Y SE EMITEN SUS REGLAS DE\nOPERACIÓN PARA EL EJERCICIO FISCAL 2022\n6. Criterios y Requisitos de Elegibilidad.\nLa forma de acceder a los servicios y apoyos que ofrece el Programa, responde a solicitud de las personas que demandan el beneficio, y los criterios serán trasparentes, equitativos y no discrecionales. Los requisitos, la forma de acceso y criterios de selección establecidos por el Programa son públicos, y estarán disponibles para las personas solicitantes en las Oficinas Centrales y Delegaciones de la SAIA, cuya ubicación y horarios se anotan en el apartado 9.2 de este documento.\n● Ser originarios y originarias de comunidades y municipios indígenas y afromexicano, o auto adscribirse como tales, independientemente de su sexo, edad y filiación política o religiosa.\n● Solicitud por escrito, dirigida a la persona titular de la SAIA, especificando el tipo de apoyo que se demanda.\n● Constancia expedida por la autoridad comunitaria, en la que se establezca que el grupo musical o de danza cumple con una función cultural, de beneficio para su comunidad y sin fines de lucro.\nUna vez que las personas y agrupaciones hayan cubierto los requisitos establecidos para acceder a los apoyos del Programa, se entregará el comprobante respectivo y, en caso de ser aprobada su solicitud, recibirán el beneficio de manera gratuita, de acuerdo a la disponibilidad presupuestal del Programa.\n7. Tipo, Monto y Periodicidad del Apoyo.\nLos instrumentos musicales y vestuario para grupos de danza, se entregarán solamente en especie de la manera siguiente:\n● La entrega de instrumentos y vestuario se realizará en las comunidades beneficiarias, o en las delegaciones regionales u oficinas centrales de la SAIA.\n● A las y los participantes en los talleres de capacitación, se les proporcionará alimentación y pago de pasajes de su comunidad al lugar sede.\n● A las y los artesanos que participen en las exposiciones culturales, se les proporcionará alimentación y pago de pasaje de su comunidad al lugar de la exposición.\n● Las y los terapeutas tradicionales recibirán capacitación, materiales y utensilios para la preparación de medicamentos herbolarios, los cuales se distribuirán de manera equitativa.\nAfromexicanos con pobreza extrema.\n7.1. Características de los Apoyos.\nY AFROMEXICANO, Y SE EMITEN SUS REGLAS DE\nOPERACIÓN PARA EL EJERCICIO FISCAL 2022\nTIPO DE APOYO CONCEPTO MONTO MÁXIMO DE APOYO\n• Pasajes\nI. EXPOSICIÓN CULTURAL REGIONAL DE Pasaje: hasta por un monto de $ 400.00\nARTESANÍAS • Alimentación\nPara los artesanos que asistan a\nAlimentación: hasta por un monto de $ 300.00 exponer sus artesanías\n• Pago de pasajes.\nPasaje: hasta por un monto de $ 400.00\n• Alimentación.\nAlimentación: hasta por un monto de $ 300.00\nII. EVENTOS PARA EL IMPULSO DE LAS\nCULTURAS E IDENTIDADES • Hospedaje. Hospedaje: hasta por un monto de $ 300.00\n10 paquetes de materia prima hasta por un\n• Paquetes de materia prima. monto de $ 10,000.00\n• Pago de alimentación. Alimentación: hasta por un monto de $ 200.00\n131 Instrumentos musicales hasta por un\n• Donación de monto de $ 20,000.00\nIII. PROMOCIÓN Y DIFUSIÓN DE LA MÚSICA Y instrumentos musicales.\nDANZAS INDÍGENAS Y AFROMEXICANAS.\n40 Grupos de danza hasta un monto de\n• Vestuario a grupos de $10,000.00 danzas.\n7.2. Recursos no Devengados.\nEl presupuesto no ejercido para los fines autorizados al 31 de diciembre de 2022, deberá ser reintegrado a la Dirección General de Tesorería de la Secretaría de Finanzas y Administración del Estado de Guerrero.\n7.3. Resguardo de la Documentación.\nLa SAIA a través de la Dirección de Promoción y Difusión Cultural y las delegaciones regionales serán las responsables del resguardo de la documentación generada por la implementación del Programa asimismo deberán verificar que se cumpla con los requisitos entregando acuse de recibo, una vez concluido cada uno de los apoyos cada uno de los expedientes deberán ser remitidos a la Delegación Administrativa quien se hará cargo de la recepción y resguardo de la documentación comprobatoria para la solventación de los recursos ejercidos del Programa que desarrolla en las presentes Reglas de Operación.\n7.4 Supervisión y Control.\nLa supervisión, control y evaluación del Programa, será interna y estará a cargo de la Dirección de\nPromoción y Difusión Cultural, para lo cual se utilizará la Metodología del Marco Lógico y los resultados de\n15 días hábiles posteriores a la terminación de cada trimestre, así como los informes sobre el presupuesto ejercido y en base a los indicadores de resultados previstos en este precepto. Todos los gastos generados en cada una de las actividades y acciones estarán soportados con la comprobación respectiva.\nY AFROMEXICANO, Y SE EMITEN SUS REGLAS DE\nOPERACIÓN PARA EL EJERCICIO FISCAL 2022\n8. Criterios de Selección.\nPertenecer a uno de los pueblos Nahua, Na savi (mixteco), Me’pha (tlapaneco) y Nn´anncue Ñomdaa\n(amuzgo), y el pueblo afromexicano, las personas o agrupaciones que solicitan un apoyo deberán cumplir los requisitos de selección y elegibilidad, establecidos en el apartado 6 de las presentes Reglas de\nOperación.\n8.1. Casos Especiales.\nSerá la persona titular de la SAIA quien decida cuando se presente una situación en la que el grupo o persona que por su situación de vulnerabilidad aun cuando no sea indígena ni afromexicano o se auto reconozca como tal quien, determine si será beneficiado o beneficiada con lo que oferta el Programa.\n8.2 Casos de Emergencia o Desastre.\nPara el caso de emergencia o desastres naturales, la SAIA podrá dar atención de manera inmediata de acuerdo a la disponibilidad financiera y la evaluación de los daños a la población afectada, dicha evaluación deberá contar con la evidencia documental, como galería fotográfica y acta de hechos levantada por personal responsable del Programa y/o autoridad competente, la SAIA facilitará los mecanismos para cumplir con los requisitos establecidos en las presentes Reglas de Operación.\n8.3. Suspensión o Cancelación del Programa Social.\nLa SAIA, podrá suspender y/o cancelar la operación, del Programa, cuando no exista las condiciones sociales-económicas entre las partes, cuando una de las personas beneficiarias no acate las disposiciones de estas Reglas de Operación y otras señaladas por las o los ejecutores que afecte la norma estatal, federal, cuando lo determine la persona titular del ejecutivo estatal y por problemas de gobernabilidad.\n8.4. Integración del Padrón de Personas Beneficiarias.\nLas personas y agrupaciones beneficiarias del Programa, formarán parte de un Padrón de Personas\nBeneficiarias, el cual será de carácter público, siendo reservados sus datos personales, de acuerdo con ningún caso, podrán emplearse para propósitos de proselitismo político, religioso o comercial, ni para ningún otro fin distinto al establecido en estas Reglas de Operación. alguno por el servicio que prestan, ni procederán de manera diferente a lo establecido en estas Reglas de\nOperación.\n9. Mecánica Operativa del Programa Social.\n9.1. Instancia Ejecutora y/o Responsable.\nY AFROMEXICANO, Y SE EMITEN SUS REGLAS DE\nOPERACIÓN PARA EL EJERCICIO FISCAL 2022\nLa SAIA será la instancia ejecutora del Programa, a través de la Dirección de Promoción y Difusión Cultural y de sus delegaciones regionales.\n9.2. Proceso de Incorporación al Programa Social.\nPara acceder a los servicios y apoyos del Programa, se deberá cumplir con los requisitos y procedimientos que se citan a continuación, según el tipo de apoyo o servicio solicitado:\nI. Exposición Cultural Regional de Artesanías.\nSolicitud por escrito libre, firmada por la persona representante del grupo o la persona interesada, dirigida a la persona titular de la SAIA.\nII. Eventos para el impulso de las culturas e identidades.\nLos encuentros y festivales para el impulso cultural e identitario de los pueblos indígenas y afromexicano, corresponde a diversas actividades que la SAIA realizará en fechas conmemorativas, como Día\nInternacional de los Pueblos Indígenas, Día de la Mujer Indígena, Día Internacional de la Lengua Indígena, entre otros. Las sedes contempladas son los municipios de: Iliatenco, Juchitán, Copalillo, Tlapa de\nComonfort, Cuajinicuilapa y Chilpancingo.\nEn cuanto a los talleres de medicina tradicional, su programación responde a una demanda expresa hecha en 2020 por médicos y parteras tradicionales amuzgos y nahuas, por lo que las sedes de estos talleres serán los municipios de Tlapa de Comonfort y Chilapa de Álvarez. Las y los participantes deberán cubrir los requisitos siguientes:\n● Solicitud por escrito libre, firmada por la persona representante del grupo de médicos y parteras tradicionales.\n● Identificación oficial (copia).\nIII. Promoción y difusión de la música y danzas indígenas y afromexicanas.\na) Talleres de capacitación para reparación de instrumentos musicales.\n● Solicitud por escrito libre, firmada por la persona representante del grupo, dirigida a la persona titular de la SAIA, especificando las comunidades, municipio y número de músicos que requieren la capacitación.\n● Identificación oficial de los participantes (copia).\n● La persona titular de la SAIA dará respuesta por escrito a la solicitud, en un término de treinta días hábiles, posteriores a la recepción de la misma.\nY AFROMEXICANO, Y SE EMITEN SUS REGLAS DE\nOPERACIÓN PARA EL EJERCICIO FISCAL 2022\n● En caso de que la respuesta sea afirmativa, se procederá a establecer, de común acuerdo, la sede y fecha del taller.\n● El grupo beneficiario deberá contribuir con el mobiliario y el local, para la realización del taller.\nb) Donación de instrumentos musicales y vestuario para grupos de danza.\n● Solicitud por escrito libre, firmada por la persona representante del grupo, dirigida a la persona titular de la SAIA, en la que se asiente el tipo de apoyo requerido. La petición podrá presentarse en las oficinas centrales, ubicadas en la ciudad de Chilpancingo, o en las delegaciones regionales situadas en las ciudades de Tlapa, Chilapa y Ometepec.\n● Identificación oficial de las y los integrantes de las agrupaciones musicales y grupos de danza.\n● Las agrupaciones musicales y los grupos de danza deberán demostrar, mediante constancia expedida por la autoridad comunitaria, que el grupo cumple con una función de beneficio para su comunidad.\n● La SAIA analizará las solicitudes y determinará, de acuerdo al presupuesto del Programa, a las agrupaciones musicales y de danza que no hayan recibido ningún apoyo de otra institución, y que reúnan los requisitos de elegibilidad para recibir el apoyo, el cual será en especie.\nLa SAIA notificará a los grupos beneficiarios, por vía telefónica o correo electrónico, la aprobación de su solicitud, en un término de sesenta días hábiles, posteriores a la recepción de la misma.\nLos responsables de los grupos beneficiarios y sus autoridades comunitarias deberán firmar una Carta\nCompromiso, en la que se asiente la obligación de brindar un buen cuidado a los bienes recibidos, participar en las festividades y ceremonias comunitarias, así como reintegrar los bienes a las autoridades locales, en caso de desintegración del grupo, para ser reasignados a otra agrupación.\nLas personas y agrupaciones interesadas en los apoyos arriba señalados, deberán dirigir su solicitud por escrito libre a la persona titular de la SAIA, y entregarla en las oficinas centrales de la SAIA, así como en sus delegaciones regionales, en un horario de 9:00 a 15:00 horas:\nChilpancingo: Calle Guillermo Soberón Acevedo, núm. 8, Col. Salubridad. Tel. 01(747) 137 0620.\nChilapa de Álvarez: Calle 3 Norte, núm. 108, Col. Centro. Tel. 01 (756) 475 0253.\nOmetepec: Calle Juan Ruiz de Alarcón, núm. 32, Barrio de la Guadalupe. Tel. 01 (741) 412 0055.\nTlapa de Comonfort: Calle Morelos, núm. 124, Col Centro. Tel. 01 (757) 476 0377.\n10. Evaluación.\nY AFROMEXICANO, Y SE EMITEN SUS REGLAS DE\nLa SAIA tendrá la obligación de revisar, de manera interna, la correcta operación y aplicación de las presentes Reglas de Operación y, en caso necesario, podrá solicitar una evaluación externa por parte de una instancia con experiencia en el tema. Asimismo, efectuará periódicamente acciones de supervisión y evaluación para garantizar el adecuado desarrollo del Programa, con el objeto de corregir desfases o\nRegional y de la Secretaría de Finanzas y Administración, a fin de cubrir rubros prioritarios con recursos de este mismo programa o de otros que no hayan sido ejercidos en su momento, o bien que provengan de ahorros presupuestales.\n10.1 Indicadores. (Ficha de Indicadores de Desempeño).\nY AFROMEXICANO, Y SE EMITEN SUS REGLAS DE\nOPERACIÓN PARA EL EJERCICIO FISCAL 2022\n10.2 Seguimiento.\nLas delegaciones regionales y la Dirección de Promoción y Difusión Cultural de la SAIA, llevarán a cabo el seguimiento relacionado con las metas comprometidas, a fin de verificar la aplicación correcta de los recursos otorgados y el cumplimiento de objetivos y metas establecidas. Este seguimiento se realizará a través de la evaluación y acompañamiento de las acciones desarrolladas en campo.\n10.3 Auditoría.\nLa SAIA será la responsable de la supervisión directa de las acciones, así como de verificar que en su ejecución se cumpla con la normatividad aplicable. Los recursos asignados para la operación del Programa no pierden su carácter estatal, por lo que la Secretaría de Finanzas y Administración, la Secretaría de\nContraloría y Transparencia Gubernamental y la Auditoría Superior del Estado, en el ámbito de sus respectivas competencias, realizarán actividades de fiscalización y auditoría.\nAsimismo, otorgará todas las facilidades a las instancias fiscalizadoras para realizar en el momento que juzguen pertinente, las auditorías necesarias; asimismo, efectuará el seguimiento y la solventación de las observaciones planteadas por los órganos de control. La inobservancia de esta disposición, independientemente de las sanciones a que haya lugar, limitará la ministración de los recursos estatales en el siguiente ejercicio presupuestal.\n11. Mecanismo de Entrega del Apoyo.\nPara el otorgamiento de los apoyos del Programa será de acuerdo al numeral 9.2 de las presentes Reglas de Operación y la comisión dictaminadora de la SAIA dará prioridad a las personas y agrupaciones que provengan de municipios indígenas y afromexicanos con mayores niveles de pobreza, que radiquen en sus localidades de origen y que enfoquen sus acciones al beneficio comunitario, así como a la protección y difusión de los valores culturales e identitarios de sus pueblos y comunidades.\n12. Derechos y Obligaciones de las Personas Beneficiadas.\nDerechos\na) Recibir un trato digno, respetuoso, oportuno, equitativo y de calidad.\nb) Acceder a los apoyos que otorga el Programa, de acuerdo con lo establecido en estas Reglas de\nOperación y con la disponibilidad presupuestal.\nc) Recibir orientación de la SAIA para la presentación de solicitudes de apoyo e integración de expedientes sin costo alguno.\nObligaciones\nY AFROMEXICANO, Y SE EMITEN SUS REGLAS DE\nOPERACIÓN PARA EL EJERCICIO FISCAL 2022\na) Conducirse con la verdad en toda la información solicitada.\nb) Emplear el bien o apoyo recibido para los fines por los que fue otorgado.\nc) Entregar la documentación e información requeridas, de acuerdo a las Reglas de Operación.\nd) Firmar una Carta-Compromiso con la SAIA, en los casos de instrumentos musicales y vestuario de danza.\ne) Comprometerse a conservar los instrumentos musicales en condiciones favorables.\nf) Informar a la SAIA, a través de sus oficinas centrales o delegaciones regionales, cuando se presente algún suceso que evite la correcta aplicación de los apoyos otorgados a las agrupaciones musicales y de danza.\n12.1. Causales de Suspensión o Baja de las Personas Beneficiadas.\na) Falta a la verdad en toda la información proporcionada.\nb) No emplear el bien o apoyo recibido para los fines por los que fue otorgado.\nc) No entregar la documentación e información requeridas, de acuerdo a las Reglas de Operación.\nd) No firmar la Carta-Compromiso con la SAIA, en los casos de instrumentos musicales y vestuario de danza.\ne) No conservar los instrumentos musicales en condiciones favorables.\nf) No informar a la SAIA, a través de sus oficinas centrales o delegaciones regionales, cuando se musicales y de danza.\n12.2. Proceso de Baja. información o cuando los apoyos sean utilizados con fines partidistas.\n13. Instancias Participantes.\nLa SAIA será ejecutora del Programa, la Secretaría de Planeación y Desarrollo Regional la cual autoriza los recursos que fueron aprobados en el Decreto número 160 de Presupuesto de Egresos y la Secretaría de Finanzas y Administración la cual realiza la liberación del recurso correspondiente, de acuerdo al\nY AFROMEXICANO, Y SE EMITEN SUS REGLAS DE\nOPERACIÓN PARA EL EJERCICIO FISCAL 2022 cronograma financiero, y la Secretaría de Contraloría y Transparencia Gubernamental para realizar las recomendaciones y sanciones pertinentes.\n13.1. Instancia Normativa.\nLa instancia administrativa y/o normativa quien será responsable de la operación es la SAIA, así como lo señala en el reglamento interno de la institución. Esto con el objeto de armonizar el correcto desempeño y aplicación de los recursos asignados por el estado para los fines del Programa.\n14. Transparencia.\n14.1. Promoción y Difusión del Programa Social.\nConforme a las disposiciones establecidas en el apartado de Programas Sujetos a Reglas de Operación del Decreto Número 160 del Presupuesto de Egresos del Estado de Guerrero para el Ejercicio Fiscal 2022, estas Reglas de Operación, además de ser publicadas en el Periódico Oficial del Gobierno del Estado, estarán disponibles para la población en general en las Oficinas Centrales de la SAIA cuya ubicación es en Calle Doctor Guillermo Soberón Acevedo #8 Col. Salubridad 39096 Chilpancingo de los Bravo, México y Delegaciones Regionales, así como en las páginas electrónicas: www.asuntosindígenas.guerrero.gob.mx, www.guerrero.gob.mx, y en la página de red social\nFacebook de la SAIA.\nAsimismo, a través de las delegaciones regionales ubicadas en las ciudades de Tlapa de Comonfort, Chilapa y Ometepec, se difundirá la información relativa al Programa, incluyendo a las autoridades municipales y comunitarias de los municipios indígenas y afromexicanos. La papelería, documentación oficial y difusión del Programa, deberá incluir la leyenda de Blindaje Electoral descrita en el apartado 14.5. de las presentes reglas de operación.\n14.2. Contraloría Social.\nLa SAIA, como instancia ejecutora, promoverá la contraloría social, la cual comprende un conjunto de acciones de control, vigilancia y evaluación que realizan las beneficiarias y beneficiarios, ya sea de manera organizada o independiente, bajo un esquema de derechos y compromisos ciudadanos con el propósito de contribuir a que la gestión gubernamental se realice en términos de transparencia, eficacia y honradez.\nEntre dichas acciones destacan las siguientes:\na) Informar a la ciudadanía acerca de los apoyos otorgados y su costo.\nb) Capacitar a las y los beneficiarios para que se constituyan en instancias de vigilancia y evaluación social.\nc) Establecer espacios de comunicación (reuniones vecinales, asambleas comunitarias, entre otros).\nY AFROMEXICANO, Y SE EMITEN SUS REGLAS DE\nOPERACIÓN PARA EL EJERCICIO FISCAL 2022\nd) Promover la integración de organizaciones de la sociedad civil para realizar acciones de contraloría social.\ne) Instrumentar mecanismos de recepción y atención de quejas y denuncias. El Órgano Interno de Control verificará en lo correspondiente la realización de dichas acciones.\n14.3. Protección de Datos Personales.\nDe a acuerdo a la Ley Número 207 de Transparencia y Acceso a la Información Pública del Estado de\nGuerrero, los datos e información recabada quedan protegidos para los fines del Programa que estas\nReglas de Operación detallan.\n14.4. Quejas y Denuncias.\nLas quejas, denuncias, peticiones y sugerencias relativas a este Programa, se realizarán de manera escrita, por comparecencia de la persona interesada, por correo electrónico o vía telefónica, y para aquellas que sean escritas se depositarán en los buzones instalados en las oficinas centrales de la SAIA, ubicadas ubicada en Calle Doctor Guillermo Soberón Acevedo #8 Col. Salubridad 39096 Chilpancingo de los Bravo, así como en las delegaciones regionales, situadas en las ciudades de Tlapa de Comonfort, Chilapa de Álvarez y Ometepec.\nLa persona denunciante deberá proporcionar los siguientes datos: Nombre de la servidora o servidor público, departamento de adscripción, objeto de la denuncia, nombre y domicilio de la persona quejosa e identificación oficial.\nLas quejas, denuncias, peticiones y sugerencias relativas a este Programa, se atenderán a través de la\nUnidad de Transparencia y Acceso a la Información Pública, la cual dará seguimiento y respuesta en un término máximo de 20 días hábiles.\nEn caso de que la SAIA no resuelva la queja de las personas solicitantes o beneficiarias, éstas podrán presentarla ante la Contraloría Social de la Secretaría de Contraloría y Transparencia Gubernamental del\nEstado de Guerrero.\n14.5. Acciones de Blindaje.\nLa operación y ejecución de los recursos estatales destinados al Programa, deberán observar y atender las medidas que emita la Secretaría de Contraloría y Transparencia Gubernamental, para coadyuvar a que éstos no sean utilizados con fines políticos, por lo que la papelería y documentación oficial, así como la publicidad y promoción del Programa deberá de incluir la leyenda siguiente: “Este Programa es público, ajeno a cualquier partido político. Queda prohibido el uso para fines distintos a los establecidos en el Programa”\n14.6. Acta de Donación. (Anexo-2)\nY AFROMEXICANO, Y SE EMITEN SUS REGLAS DE\nOPERACIÓN PARA EL EJERCICIO FISCAL 2022 la acción y es responsabilidad de la SAIA, su resguardo. Quien detecte alguna irregularidad en la acción, podrá firmar el acta de manera condicionada y anotar en ella las razones de dicha inconformidad. Además, se indicará los plazos acordados para solventar las observaciones a que dé lugar. Se anexa formato.\n15. Perspectiva de Género.\nLa operación del Programa y su implementación se establece con perspectiva de género, respeto y garantía al ejercicio de los derechos de las Mujeres Indígenas y Afromexicanas, busca mostrar que las diferencias entre mujeres y hombres se dan no sólo por su determinación biológica, sino también por las diferencias culturales asignadas a los seres humanos por lo que la SAIA pondrá especial atención a mujeres para fortalecer sus capacidades y ampliar sus oportunidades y así potenciar la agencia económica en favor de mayores oportunidades para su bienestar y desarrollo.\n16. Enfoque de Derechos.\nLas personas que fungen como servidoras o servidores públicos y participen en la operación del Programa deberán promover, respetar, proteger y garantizar el ejercicio efectivo de los derechos humanos de las personas beneficiarias, de conformidad con los principios de universalidad, interdependencia, indivisibilidad y progresividad. En particular, se fomentará la eficacia y respeto irrestricto a los derechos colectivos de los pueblos indígenas y afromexicano, reconocidos en la Constitución Política de los Estados\nUnidos Mexicanos e instrumentos internacionales. Con el objetivo de generar las condiciones necesarias para el acceso igualitario, en términos de disponibilidad, accesibilidad y calidad en las acciones que realiza este Programa, se implementarán mecanismos que hagan efectivo el acceso a la información gubernamental y se asegurará que el acceso a los apoyos y servicios se dé únicamente con base en lo establecido en estas Reglas de Operación, sin discriminación o distinción alguna.\n17. Acciones contra el SARS-COV 2\nEn septiembre de 2019, la Organización Mundial de la Salud (OMS) planteó la urgencia de “prepararse para lo peor: una pandemia causada por un patógeno respiratorio letal y que se propague rápidamente” y sostuvo, además, que “los sistemas y capacidades existentes en materia de preparación y respuesta ante brotes epidemiológicos son insuficientes para hacer frente a la enorme repercusión y rápida propagación de una pandemia altamente mortífera, así como a la conmoción que supondría para los sistemas sanitarios, sociales y económicos” (OMS, 2019,). Pocos meses después, esta alerta se hizo realidad: tras un nuevo brote epidémico provocado por el virus SARS-CoV-2.9, que se había iniciado en China y se disponen de sistemas de salud precarios (OMS, 2020a). Debido a su rápida propagación por todo el mundo, el 11 de marzo la OMS declaró que el COVID-19 constituía una pandemia3, por lo que exhortó a:\ni) “prepararse y estar a punto”; ii) “detectar, proteger y tratar”; iii) “reducir la transmisión”; y iv) “innovar y aprender”. En la medida en que el virus se ha propagado a escala mundial, América se ha transformado\nY AFROMEXICANO, Y SE EMITEN SUS REGLAS DE\nOPERACIÓN PARA EL EJERCICIO FISCAL 2022 en el epicentro de la nueva pandemia. En particular, en la actualidad algunos países latinoamericanos se sitúan entre las 20 naciones que, a nivel global, registran el mayor número de contagiados y fallecidos por el COVID-19 (Brasil, Perú, Colombia, México, Argentina y Chile); además de figurar en la lista de los 20 países con mayor número de casos por millón de habitantes (Panamá, Chile, Perú, Brasil y Colombia).\nEn este contexto, la Organización Panamericana de la Salud (OPS) estima que, para el 1 de octubre, ya se habrán registrado más de 438 000 muertes por COVID-19 en América Latina y el Caribe (DW, 2020).\nJunto con estas cifras alarmantes, la crisis socio sanitaria está exacerbando las ya de por sí amplias desigualdades sociales y económicas que caracterizan al subcontinente y, de no adoptarse medidas oportunas y adecuadas, también recrudecerá la inestabilidad política y social que ya asolaba a varios países de la región antes de la pandemia. Sin embargo, el mayor impacto lo sufrirán aquellos sectores de la sociedad que, históricamente, han quedado excluidos del poder político y económico, en particular, los pueblos indígenas, incluidos las mujeres, los jóvenes, las niñas y niños y las personas mayores indígenas.\n18. Anexos que reflejen la entrega del apoyo (Económico, Especie o Servicios).\nAnexo 1. MIR\nANEXO 2. ACTA DE DONACIÓN\nY AFROMEXICANO, Y SE EMITEN SUS REGLAS DE\nOPERACIÓN PARA EL EJERCICIO FISCAL 2022\nPrimero. El presente Acuerdo entrará en vigor al día siguiente de su publicación en el Periódico Oficial del\nSegundo. Se abroga el Acuerdo por el que se crea el Programa Fortalecimiento de las Culturas e\nIdentidades Indígenas y Afromexicana y emiten sus Reglas de Operación para el Ejercicio Fiscal 2020, publicado en el Periódico Oficial del Gobierno del Estado No. 45 alcance I, de fecha 12 de junio de 2020, así como las Reglas de Operación del Programa Fortalecimiento de las Culturas e Identidades Indígenas y Afromexicana para el Ejercicio Fiscal 2021, publicado en el Periódico Oficial del Gobierno del Estado No.\n76, de fecha 21 de septiembre de 2021.\nTercero. A partir de la entrada en vigor del presente Acuerdo, las Reglas de Operación del Programa\nTransformando el Desarrollo de las Culturas e Identidades de Pueblos Indígenas y Afromexicano, subsecuente o sus modificaciones serán emitidas por la persona titular de la Secretaría de Asuntos\nIndígenas y Afromexicanos, responsable directa de la operación y ejecución de las mismas.\nDado en el “Recinto de las Oficinas del Poder Ejecutivo del Estado”, inmueble ubicado en el número 62, Edificio Norte Planta Baja, en Boulevard René Juárez Cisneros, Código Postal 39074, Colonia Ciudad de los Servicios, en la Ciudad de Chilpancingo de los Bravo, capital del estado de Guerrero, a los trece días del mes de junio del año dos mil veintidós.\nLA GOBERNADORA CONSTITUCIONAL DEL ESTADO DE GUERRERO.\nMTRA. EVELYN CECIA SALGADO PINEDA.\nRúbrica.\nEL SECRETARIO GENERAL DE GOBIERNO.\nMTRO. LUDWIG MARCIAL REYNOSO NÚÑEZ.\nRúbrica.\nLA SECRETARIA DE ASUNTOS INDÍGENAS Y AFROMEXICANOS.\nLIC. REYNA MEJÍA MORALES.\nRúbrica.",
  "ordenamiento": "PROGRAMA",
  "jurisdiccion": "GUERRERO",
  "fuente_oficial": "DIARIO OFICIAL DE LA FEDERACION",
  "Fecha de Publicación": "25 DE ABRIL DE 2023",
  "ULTIMA REFORMA PUBLICADA": null,
  "status": "VIGENTE",
  "es_escaneado": false,
  "tiene_tablas": true,
  "materia": [
    "cultura"
  ]
}