{
  "titulo": "Acuerdo por el Que Se Crea el Programa Acciones Emergentes y Se Emiten Sus Reglas de Operación",
  "Contenido": "TEXTO ORIGINAL.\nACUERDO POR EL QUE SE CREA EL PROGRAMA ACCIONES EMERGENTES Y SE EMITEN SUS\nREGLAS DE OPERACIÓN.\nGuerrero.- Poder Ejecutivo.\nMAESTRA EVELYN CECIA SALGADO PINEDA, GOBERNADORA CONSTITUCIONAL DEL ESTADO\nDE GUERRERO, CON FUNDAMENTO EN LO DISPUESTO POR LOS ARTÍCULOS 71, 87, 88, 90\nLOS ARTÍCULOS 2, 4, 8, 9, 14, 16, 22 APARTADO A FRACCIONES I Y IV, 23 FRACCIÓN III Y 26\nFRACCIÓN III DE LA LEY ORGÁNICA DE LA ADMINISTRACIÓN PÚBLICA DEL ESTADO DE\nGUERRERO NÚMERO 242; 1, 2 FRACCIÓN I, 18 Y 25 DE LA LEY NÚMERO 454 DE PRESUPUESTO\nY DISCIPLINA FISCAL DEL ESTADO DE GUERRERO; 1, 2, 3, 6 Y 8 DE LA LEY NÚM. 102, PARA EL\nDESARROLLO SOCIAL DEL ESTADO DE GUERRERO; EN RELACIÓN CON LOS ARTÍCULOS 42, 69\nY 70 DEL DECRETO NÚMERO 680 RELATIVO AL PRESUPUESTO DE EGRESOS DEL ESTADO DE\nGUERRERO PARA EL EJERCICIO FISCAL 2024, Y LOS LINEAMIENTOS PARA LA ELABORACIÓN\nDE LAS REGLAS DE OPERACIÓN DE LOS PROGRAMAS SOCIALES ESTATALES PARA EL\nPERIODO 2022-2027.\nQue la Agenda 2030 sobre el Desarrollo Sostenible, documento que incluye 17 Objetivos para el\nDesarrollo Sostenible (ODS) y 169 metas de carácter integrado e indivisible que abarcan las esferas económica, social y ambiental. De acuerdo al Objetivo 1. Fin de la pobreza, en todas sus formas y en todo el mundo, tiene como meta lo señalado en el apartado 1.5 De aquí a 2030, fomentar la resiliencia de los sociales y ambientales.\nQue uno de los objetivos del Plan Nacional de Desarrollo 2019-2024 es establecer políticas que garanticen un conjunto básico de derechos humanos para la población a lo largo de su ciclo de vida, poblacionales.\nQue el ejecutivo estatal, está comprometido con ser el principal promotor de acciones y establecer rutas encaminadas a lograr un estado moderno, inteligente y visionario; de ahí que también es necesario\nQue la Ley Núm. 102, para el Desarrollo Social del Estado de Guerrero, tiene como objetivo de la política social del estado para el desarrollo social y superación de la pobreza, fomentar las condiciones para que las personas y la sociedad en su conjunto puedan satisfacer sus necesidades humanas y sociales, para fortalecer el pleno goce de sus derechos y garantías políticas, económicas, sociales y culturales, que les permitan optar por un plan de vida.\nQue las acciones y programas derivadas de la política social del estado se formularán, instrumentarán, ejecutarán y evaluarán con criterio de universalidad, atendiendo las necesidades básicas de las personas en cada etapa de su vida; de integridad, enfocados a todas las dimensiones del desarrollo humano y social; de equidad, para ampliar el acceso a los recursos públicos, privados y sociales, que promuevan condiciones de igualdad de oportunidades para satisfacer el bienestar social.\nQue derivado del Decreto Número 680 relativo al Presupuesto de Egresos del Estado de Guerrero para el Ejercicio Fiscal 2024, en su artículo 47 establece que, con el objeto de asegurar la aplicación eficiente, eficaz, oportuna, equitativa y transparente de los recursos públicos, la Secretaría de Finanzas y\nAdministración y la Secretaría de Planeación y Desarrollo Regional emitirán las disposiciones a que deberán sujetarse los programas de inversión sujetos a Reglas de Operación, de acuerdo a su competencia.\nQue la Secretaría de Planeación y Desarrollo Regional del gobierno del estado de Guerrero, mediante publicación en el Periódico Oficial del Gobierno del Estado de Guerrero, de fecha viernes 18 de febrero del año 2022, emitió los Lineamientos para la Elaboración de las Reglas de Operación de los\nProgramas Sociales Estatales para el período 2022-2027, los cuales instituyen la ejecución del Programa\nAcciones Emergentes, con el objeto de otorgar transparencia y asegurar la aplicación eficiente, eficaz, oportuna y equitativa de los recursos públicos asignados.\nQue conforme a la Ley Orgánica de la Administración Pública del Estado de Guerrero Número\n242, a la Secretaría de Bienestar del estado de Guerrero, le corresponde coordinar las acciones que incidan en el abatimiento de los niveles de pobreza que considere la desigualdad existente entre hombres y mujeres, y fomentar un mejor nivel de vida de la población, que garanticen una mejoría en los niveles de vida de los grupos de población más desprotegidos.\nQue, por lo antes señalado, se hace necesario implementar el Programa Acciones Emergentes, con el objeto de proteger y garantizar a las familias guerrerenses en situación de vulnerabilidad, mediante el mejoramiento de su vivienda, a través del apoyo en especie con láminas y/o tinacos, especialmente para las personas afectadas por fenómenos naturales o atípicos que habiten en áreas rurales, urbanas y conurbadas.\nPor lo anteriormente expuesto y con fundamento en las disposiciones legales antes citadas, he tenido a bien expedir el siguiente:\nArtículo 1. Se crea el Programa Acciones Emergentes, con el objeto de contribuir al bienestar de las familias guerrerenses en situación de vulnerabilidad, mediante el apoyo en especie de láminas y/o tinacos para el mejoramiento de su vivienda, que sean afectadas por fenómenos naturales o sociales, que habiten en áreas rurales, urbanas y conurbadas, contribuyendo a mejorar la calidad y espacios de sus viviendas.\nArtículo 2. La Secretaría de Bienestar, tendrá a su cargo la implementación, ejecución, evaluación y administración del Programa Acciones Emergentes, bajo los criterios de objetividad, equidad, transparencia, publicidad, selectividad y temporalidad, con estricto apego a la normatividad aplicable, siendo la encargada de la dispersión y/o asignación de los recursos, apegándose plenamente a las Reglas de Operación.\nArtículo 3. Se emiten las Reglas de Operación del Programa de Acciones Emergentes, en las que se establece el procedimiento de ejecución del Programa, los principios, requisitos y condiciones que deben observarse para acceder al mismo, en los términos siguientes:\nREGLAS DE OPERACIÓN DEL PROGRAMA ACCIONES EMERGENTES.\n1. Introducción.\nDisponer de una vivienda decorosa y que sea un espacio digno en donde todas las personas habitantes puedan desarrollar sus actividades de descanso, alimentación, higiene y convivencia, es uno de los derechos de los cuales aún está excluido un segmento de la población de la entidad, principalmente las personas en situación de vulnerabilidad o aquellas que por circunstancias ajenas a su voluntad necesitan de forma urgente un apoyo para la construcción o rehabilitación de su vivienda.\nEn este sentido, el Programa que presenta la administración estatal actual a través de la SBGro, contribuirá a disminuir la carencia referente a espacio y calidad de la vivienda de las familias en situación inmediata.\n1.1. Antecedentes. diversos fenómenos hidrometeorológicos, causando severos problemas dentro del territorio, por lo cual, es salud, integridad física y material de la sociedad guerrerense. a través de la Secretaría de Desarrollo Social (SEDESOL), creado en el año 2016 con el fin de apoyar a la población guerrerense de manera individual o colectiva ante cualquier contingencia, siniestro o alguna causa que por su naturaleza necesitara el apoyo de este Programa. medición de indicadores, este Programa tuvo como resultado la atención de 102 familias producto de contingencias climatológicas registradas durante el año 2016, derivado de las 4,247 peticiones que ingresaron a la Dirección General de Gestión Social lo que da como resultado el 5% de la población solicitante.\nEn este contexto la Secretaría de Desarrollo Social del Estado, crea nuevamente en el ejercicio fiscal 2017 el Programa Acciones Emergentes, con la firme intención de brindar atención a la población de manera oportuna, apoyando en varios municipios a las personas afectadas por el sismo del mes de septiembre del 2017 y el incendio del mercado municipal de la ciudad de Iguala de la Independencia, etc., contribuyendo a mitigar las afectaciones por las contingencias, durante las cuales se realizó la inversión de\n$3,492,000.00, logrando beneficiar a 1,188 personas, de los municipios de Iguala de la Independencia, Huitzuco de los Figueroa, Atenango del Rio, Copalillo y Taxco de Alarcón, beneficiando a 297 familias.\nEn el año 2023 la actual Secretaría de Bienestar operó el Programa Acciones Emergentes, el cual estuvo compuesto de tres vertientes, que consisten en construcción de vivienda para familias en situación de vulnerabilidad, rehabilitación de vivienda para familias en situación de vulnerabilidad y apoyos para la adquisición de material de construcción para el mejoramiento de vivienda, con una inversión de $4, 607,549.00, (Cuatro Millones, Seiscientos Siete Mil Quinientos Cuarenta y Nueve Pesos M.N.), atendiendo a 4,109 personas en 21 municipios del estado de Guerrero, por carencias de infraestructura en el espacio de vivienda y/o a los afectados por el huracán Otis el cual afectó principalmente al puerto de Acapulco de\nJuárez, Coyuca de Benítez, y algunas otras áreas.\n2. Alineación Programática al PED y PND.\nEl presente Programa se alinea con el eje 2 Desarrollo Económico Sostenible del Plan Estatal de\nDesarrollo 2022-2027, al Objetivo 2.12 Fortalecer programas de vivienda adecuada a los diferentes sectores de la sociedad guerrerense; Estrategia 2.12.1. Atender a las personas en situación vulnerable; líneas de acción 2.12.1.3 Incrementar las políticas necesarias para generar un programa de vivienda estatal que atienda principalmente a las clases más desprotegidas, que no perciban un salario seguro, no teniendo acceso a seguridad social, ni la adquisición de una vivienda digna.\nAsí mismo, se encuentra alineado con el Plan Nacional de Desarrollo 2019-2024 con el Eje 2\nPolítica Social, Programa 8. Desarrollo Urbano y Vivienda.\n2.1. Diagnóstico.\nSegún datos de CONEVAL en su Informe de pobreza y evaluación 2022 en Guerrero, el 60.4% de la población de la entidad vivía en situación de pobreza, es decir, 2,173,314 personas, aproximadamente.\nDe este universo, el 38.1% que representa 1,372,834 personas, estaba en situación de pobreza moderada, mientras que el 22.2% de la población se encontraba en situación de pobreza extrema es decir\n800,480 personas.\nAdemás, en la entidad el 26.9% de las personas en el estado tienen carencia por calidad y espacio de la vivienda, lo que representa 969, 842 personas en esta condición.\n2.1.1. Población Potencial.\nEl Consejo Nacional de Evaluación de la Política de Desarrollo Social CONEVAL reporta que, en el 2022 en el estado de Guerrero la población en viviendas con techos de material endeble representa el\n1.9% de la población estatal en esta condición, lo que se traduce en 68,650 personas; respecto a las viviendas sin acceso al agua el 26.8% de la población tiene esta carencia lo que equivale a 965,600 personas. Los apoyos tendrán cobertura estatal.\n2.1.2. Población Objetivo.\nLa población objetivo la constituyen aquellas familias guerrerenses que habiten en situación de vulnerabilidad o que hayan sufrido algún siniestro derivado de fenómenos naturales y/o sociales, se dará prioridad a aquella población que se encuentre en alguna Zona de Atención Prioritaria.\n2.1.3. Población Beneficiaria.\nEntendiendo que la finalidad del Programa es responder de manera rápida, eficaz y oportuna, se pretende beneficiar a toda la población que solicite los apoyos otorgados en las presentes Reglas de\nOperación siempre y cuando cumplan con los requisitos requeridos dentro de las mismas, adecuándose a la capacidad presupuestaria del Programa, priorizando a la población que constituyen aquellas familias guerrerenses que habiten en situación de vulnerabilidad o que hayan sufrido algún siniestro derivado de fenómenos naturales (lluvias, sismos y/o incendios) o situaciones atípicas, las cuales ameriten el actuar inmediato.\n2.1.4. Población Indígena.\nDe acuerdo con el Censo de Población y Vivienda 2020 del Instituto Nacional de Estadística y\nGeografía (INEGI), 515 mil 487 personas de 3 años y más habla una lengua indígena, lo que representa el\n14.6% respecto al total de la población de la entidad; 240 mil 975 son hombres (46.8%) y 274 mil 512\n(53.2%) son mujeres.\nOtro sector de la población de nuestro país, significativa por las aportaciones en la conformación nacional, y en particular del estado de Guerrero, es el pueblo afromexicano, conformado por 303 mil 923 personas, según el Censo de Población y Vivienda 2020, cuya población se reconoce como afromexicano y representan el 8.6% de los habitantes de la entidad.\nDebido a que el Programa tiene como objetivo atender a personas en estado de vulnerabilidad y/o habitantes de Zonas de Atención Prioritaria, están incluidos todos los grupos poblacionales del estado.\n2.2. Fundamento Legal.\na) Constitución Política de los Estados Unidos Mexicanos.\nc) Ley General de Desarrollo Social.\nd) Ley Federal de Presupuesto y Responsabilidad Hacendaria.\ne) Ley Núm. 102, para el Desarrollo Social del Estado de Guerrero.\ng) Ley Número 454 de Presupuesto y Disciplina Fiscal del Estado de Guerrero.\nh) Ley número 465 de Responsabilidades Administrativas para el Estado de Guerrero.\ni) Ley Orgánica de la Administración Pública del Estado de Guerrero Número 242.\nj) Ley 494 para la Igualdad entre Mujeres y Hombres del Estado de Guerrero.\nk) Ley Número 207 de Transparencia y Acceso a la Información Pública del Estado de Guerrero.\nl) Decreto Número 203 del Presupuesto de Egresos para el Ejercicio Fiscal 2025. (REFORMADO, P.O\n23 ALCANCE VI, 21 DE MARZO 2025)\nn) Decreto Número 181 por medio del cual la Sexagésima Tercera Legislatura al Honorable\no) Acuerdo que establecen los Compromisos para la Estabilidad y Desarrollo del Estado de\nGuerrero.\np) Plan Nacional de Desarrollo 2019-2024.\nq) Plan Estatal de Desarrollo del Estado de Guerrero 2022-2027.\nr) Y todos aquellos ordenamientos normativos aplicables.\n2.3. Definiciones y Siglas.\nDefiniciones:\nComité Técnico de Validación: Órgano encargado de realizar la validación del proyecto de\nPadrón Único de Personas Beneficiarias, el cual estará integrado por la persona titular de la SBGro, y las personas titulares de la Subsecretaría de Política Social, la Subsecretaría de Vinculación y Promoción\nSocial, la Dirección General de Desarrollo Comunitario y Desarrollo Productivo de Grupos Vulnerables, y la Unidad de Transparencia de la SBGro. (REFORMADO, P.O 23 ALCANCE VI, 21 DE MARZO 2025)\nConvocatoria: Anuncio o publicación en los diferentes medios de comunicación, detallando los requisitos y características específicas del Programa.\nDirección: La Dirección General de Desarrollo Comunitario y Desarrollo Productivo de Grupos\nVulnerables de la SBGro.\nEl Secretario: Persona Titular de la SBGro.\nPersonas Beneficiarias: Aquellas que obtienen un beneficio en especie por parte del Programa.\nPrograma: Programa Acciones Emergentes.\nReglas de Operación: Reglas de Operación del Programa Acciones Emergentes.\nSiglas:\nASE: Auditoria Superior del Estado de Guerrero.\nCONEVAL: Consejo Nacional de Evaluación de la Política de Desarrollo Social.\nCONAC: Consejo Nacional de Armonización Contable.\nCONAPO: Consejo Nacional de Población.\nCURP: Clave Única de Registro de Población.\nDGDCyDPGV: Dirección General de Desarrollo Comunitario y Desarrollo Productivo de Grupos\nVulnerables.\nDGAyF: Dirección General de Administración y Finanzas.\nIED: Inversión Estatal Directa.\nIEPC: Instituto Electoral y de Participación Ciudadana.\nINEGI: Instituto Nacional de Estadística y Geografía.\nITAIGRO: Instituto de Transparencia, Acceso a la Información y Protección de Datos Personales del Estado de Guerrero.\nMIR: Matriz de Indicadores de Resultados.\nPED: Plan Estatal de Desarrollo 2022-2027.\nPND: Plan Nacional de Desarrollo 2019-2024.\nPUPB: Padrón Único de Personas Beneficiarias.\nSBGro: Secretaría de Bienestar.\nSCyTG: Secretaría de la Contraloría y Transparencia Gubernamental.\nSEPLADER: Secretaría de Planeación y Desarrollo Regional.\nSEFINA: Secretaría de Finanzas y Administración.\nSGG: Secretaría General de Gobierno.\nZAP: Zonas de Atención Prioritaria.\n3. Objetivos y Alcances.\n3.1. Objetivo General.\nContribuir al bienestar de las familias guerrerenses en situación de vulnerabilidad, mediante el apoyo en especie de materiales para mejorar la calidad y espacio de la vivienda, afectada por fenómenos naturales o atípicos, que habiten en áreas rurales, urbanas y conurbadas.\n3.2. Objetivo Específico.\n● Disminuir alguna carencia referente a espacio y calidad de la vivienda, dignificando las condiciones de vida de las familias guerrerenses en situación de vulnerabilidad en el estado de Guerrero.\n● Atender a la población que se encuentren en alguna situación de emergencia y que requiera una acción inmediata.\n● Rehabilitar techos de viviendas en situación de emergencia, o entregar un tinaco.\n● Entrega de material de construcción, un apoyo a una persona integrante por cada vivienda que lo solicite.\n3.3. Cobertura.\nCobertura estatal, priorizando a la población guerrerense que se encuentren en situación de vulnerabilidad o que hayan sufrido algún siniestro derivado de fenómenos naturales y/o sociales, tanto del área rural como de las zonas urbanas y conurbadas.\n3.4. Alcances.\nLa implementación del Programa surge por la necesidad de atender de manera inmediata y urgente a personas ciudadanas en situación de vulnerabilidad o que hayan sufrido algún siniestro derivado de fenómenos naturales y/o sociales, tanto del área rural como de las zonas urbanas y conurbadas y de esta forma puedan habitar en un lugar digno, atendiendo el derecho a la vivienda.\n4. Metas Físicas.\nSe tiene programado beneficiar a 1,750 viviendas con materiales de construcción, través de 900 paquetes de 10 láminas galvanizadas y 850 tinacos, un solo tipo de apoyo por vivienda que lo solicite.\n(REFORMADO, P.O 23 ALCANCE VI, 21 DE MARZO 2025)\n5. Programación Presupuestal.\nSe ha programado un monto de $ 5’200,000.00 (Cinco Millones Doscientos Mil Pesos 00/100\nM.N.) de Inversión Estatal Directa (IED), para el Programa, según el Decreto Número 203 del\nPresupuesto de Egresos para el Ejercicio Fiscal 2025. (REFORMADO, P.O 23 ALCANCE VI, 21 DE MARZO 2025)\nResumen General del Presupuesto\nAcción Inversión\na) Apoyos con material de construcción para el $2,522,000.00 (Dos Millones Quinientos mejoramiento de vivienda (láminas galvanizadas). Veintidós Mil Pesos 00/100 M.N.)\nb) Apoyos con material de equipamiento para el $2,522,000.00 (Dos Millones Quinientos mejoramiento de vivienda (tinacos). Veintidós Mil Pesos 00/100 M.N.)\nc) Gastos de Operación. $ 156,000.00 (Ciento Cincuenta y Seis Mil\nPesos M.N.).\nTotal: $5,200.000.00 (Cinco Millones Doscientos Mil de\nPesos M.N.). sujetos a la disponibilidad de ingresos recaudados por la SEFINA.\nPROGRAMA DE\nIED/25 SBGRO ACCIONES $ 5,044,000.00 $ 5,044,000.00 $630,500.00 $ 630,500.00 $ 630,500.00 $ 630,500.00 $ 630,500.00 $ 630,500.00 $ 630,500.00 $ 630,500.00 $ - $ - $ - $ EMERGENTES\nGASTOS DE\nIED/25 SBGRO OPERACIÓN $ 156,000.00 $ 156,000.00 $ 19,500.00 $ 19,500.00 $ 19,500.00 $ 19,500.00 $ 19,500.00 $ 19,500.00 $ 19,500.00 $ 19,500.00 $ - $ - $ - $ 1 TOTAL DEL PROGRAMA $ 5,200,000.00 $ 5,200,000.00 $ 650,000.00 $ 650,000.00 $ 650,000.00 $ 650,000.00 $ 650,000.00 $ 650,000.00 $ 650,000.00 $ 650,000.00 $ - $ - $ - $ -\n(REFORMADO, P.O 23 ALCANCE VI, 21 DE MARZO 2025)\n5.1. Gastos de Operación.\nSe aplicará hasta un 3% para gastos de operación, destinados a las diversas acciones asociadas con la realización de estudios, elaboración y evaluación de proyectos, supervisión y control, observando en todo momento los criterios de racionalidad y austeridad presupuestal, proporcionando la eficiencia, eficacia y transparencia en el ejercicio de los recursos.\n6. Criterios y Requisitos de Elegibilidad.\na) Criterios de elegibilidad:\n● Que las personas solicitantes sean mayores de 18 años, se encuentren en alguna situación de vulnerabilidad y que cumplan con los requisitos establecidos en las presentes Reglas de Operación.\n● Tendrán mayor prioridad las personas que habiten principalmente en Zonas de Atención\nPrioritaria del área rural y urbanas 2025, establecidas en el Decreto por el que se Formula la Declaratoria de las Zonas de Atención Prioritaria para el año 2025, emitido por la Federación en el diario oficial, el día\n24 de diciembre del 2024. (REFORMADO, P.O 23 ALCANCE VI, 21 DE MARZO 2025)\n● Tendrán mayor prioridad la o el representante de la familia que se acredite como jefa o jefe de familia, respetando un apoyo por vivienda.\n● Que hayan sufrido algún siniestro derivado de fenómenos naturales (lluvias, sismos y/o incendios) o situaciones atípicas que presenten evidencia (fotografía de la vivienda).\n● Se considerarán prioritarios los casos de extrema vulnerabilidad resultado de la aplicación del\nProtocolo Violeta, siempre y cuando se cumpla con los requisitos mencionados en estas Reglas de\nOperación.\n● Se considerarán como casos prioritarios aquellas personas que se encuentren consideradas en situación de desplazamiento de la SGG.\n● Se tendrá derecho únicamente a 1 de los 2 apoyos que oferta el Programa.\nb) Requisitos de elegibilidad:\nEl registro de la solicitud y la entrega de la documentación de la persona solicitante, no significa la incorporación al Programa, una vez ingresados los documentos serán revisados para verificar que cumplan del apoyo estará sujeto a la disponibilidad presupuestal.\nLos requisitos a cumplir son los siguientes:\n● Solicitud: dirigida a la persona titular de la SBGro. (Anexo 3). (REFORMADO, P.O 23 ALCANCE VI, 21\nDE MARZO 2025)\n● Estudio socioeconómico (CUIS o CIS) realizado por la SBGro (Anexo4) (REFORMADO, P.O 23\nALCANCE VI, 21 DE MARZO 2025)\n● Ser mayor de 18 años, los casos distintos estarán sujetos a la valoración del Comité Técnico.\n● Credencial de elector de la persona solicitante, o constancia de identidad emitida por la autoridad local.\n● CURP de la persona solicitante y de las y los habitantes de la vivienda.\n● Comprobante de domicilio (no mayor a 3 meses de antigüedad) puede ser constancia de radicación emitida por la autoridad local, recibo de luz, recibo de teléfono, etc.\n● Fotografía de la vivienda antes y después del siniestro en su caso.\n● Para personas con carencia en espacio y/o calidad de la vivienda, deberán presentar evidencia fotográfica de la carencia.\n7. Tipo, Monto y Periodicidad del Apoyo.\nMonto $ Periodicidad\nTipo\nEspecie: Láminas zintro alum 1galvanizadas 2,802.22 Único\nEspecie: Tinaco rotoplas2 tricapa 2,967.06 Único\n(REFORMADO, P.O 23 ALCANCE VI, 21 DE MARZO 2025)\n1 Marca sujeta a disponibilidad y precios del mercado.\n2Marca sujeta a disponibilidad y precios del mercado.\n7.1. Características de los Apoyos. beneficiarias y beneficiarios, tales como lámina galvanizada o tinaco, solo un tipo de apoyo por vivienda.\nCaracterísticas del apoyo Unidades por apoyo\nEspecie: Láminas zintro alum3 galvanizadas (3 metros\n10 calibre 32).\nEspecie: Tinaco rotoplas4 tricapa con capacidad de 1,100 litros de agua\n7.2. Recursos no Devengados.\nCuando existan bajas dentro del PUPB, se determinará el saldo a la fecha y se procederá a incorporar a nuevas personas beneficiarias. Los recursos no ejercidos al término del ejercicio fiscal 2025 serán reintegrados a la Dirección General de Tesorería perteneciente a la SEFINA a más tardar el 31 de diciembre del presente ejercicio fiscal. (REFORMADO, P.O 23 ALCANCE VI, 21 DE MARZO 2025)\n7.3. Resguardo de la Documentación. comprobatoria de los recursos ejercidos del Programa, así como de llevar a cabo el cierre del ejercicio fiscal.\n7.4. Supervisión y Control.\nLa SBGro, en operación del Programa y para la mejora de éste, integrará un informe a través de la DGDCyDPGV y la DGAyF, además llevará cabo el seguimiento a los recursos asignados al Programa.\n3 Marca sujeta a disponibilidad y precios del mercado.\n4 Marca sujeta a disponibilidad y precios del mercado.\n8. Criterios de Selección.\nLas personas susceptibles de ser beneficiarias en el Programa, deberán cubrir los requisitos de selección y elegibilidad previamente establecidos en las presentes Reglas de Operación del Programa.\nCon los criterios siguientes:\n● La ciudadanía en condiciones económicas desfavorables, que requieran de algún el tipo de apoyo estipulado en las presentes Reglas de Operación, siempre y cuando cumplan con los requisitos.\n● Atender de manera inmediata a la población guerrerense que habiten en situación de vulnerabilidad o que hayan sufrido algún siniestro derivado de fenómenos naturales y/o sociales. Tanto del área rural como de las zonas urbanas y conurbadas, con apoyos elementales emergentes, por lo que el\nPrograma otorgará apoyos para la rehabilitación de techos o un depósito de agua para situaciones emergentes, o desfavorables.\n8.1. Casos Especiales.\nEn los casos especiales por emergencia, casos fortuitos y/o de fuerza mayor o aquellos que por cuestiones de seguridad sanitaria o social se requiera efectuar erogaciones anticipadas de los apoyos en especie o su reprogramación, ya sea en una zona geográfica en específico o en todo el estado, o aquellos que estén fuera de los lineamientos establecidos en las presentes Reglas de Operación, será la SBGro quien determinará su procedencia.\n8.2. Casos de Emergencia o Desastre.\nCon el fin de evitar la interrupción de la operación del Programa en caso de que exista una\nDeclaratoria de Emergencia o de Desastre, la SBGro podrá dar atención especial a la población beneficiaria del Programa que se encuentre inmersa en la zona de desastre, pudiendo adelantar la entrega de los apoyos descritos en la presentes Reglas de Operación, así como brindar ayuda humanitaria para mitigar sus necesidades prioritarias por la emergencia social o desastre natural.\n8.3. Suspensión o Cancelación del Programa Social. a los objetivos y lineamientos establecidos en el Programa. Entre las causas que originarán la cancelación se encuentran las siguientes:\n● Proporcionar información falsa.\n● Destinar el apoyo entregado a un uso diferente a lo establecido en las presentes Reglas de\nOperación (colocarlo en lugares diferentes a un cuarto dormitorio, un cuarto comedor o alguno diferente a la convivencia de la familia).\n● Que la SBGro detecte que el predio o vivienda se encuentra en zonas de riesgo o asentamiento irregular, laderas de ríos, laderas de barrancas, zonas federales.\n● Cualquier otra que contravenga lo dispuesto en las presentes Reglas de Operación.\n● Lucrar con los apoyos recibidos, (venta o intercambio del apoyo).\n8.4. Integración del Padrón Único de Personas Beneficiarias.\nUna vez que las personas solicitantes sean incorporadas al Programa, formarán parte de un\nPUPB, el cual será de carácter público, siendo reservados sus datos personales, de acuerdo con la normatividad vigente; los cuales en ningún caso podrán emplearse para propósitos de proselitismo político, religioso o comercial, ni para ningún otro fin distinto al establecido en las presentes Reglas de Operación.\nLa publicación del PUPB se realizará en los diversos medios electrónicos de los que dispone la\nSBGro, en la siguiente página web: https://guerrero.gob.mx/dependencia/sector-central/secretaria-de-bienestar/.\nPortal de Transparencia.\nRedes sociales de la SBGro.\nFacebook.com/BienestarGro/.\nInstagram: https://www.instagram.com/bienestar_gro/?img_index=1.\n9. Mecánica Operativa del Programa.\n9.1. Instancia Ejecutora y/o Responsable. (REFORMADO, P.O 23 ALCANCE VI, 21 DE MARZO 2025)\nEl Comité Técnico de Validación será conformado por:\nEl titular de la SBGro; las personas titulares de la Subsecretaría de Política Social, de la\nSubsecretaría de Vinculación y Promoción Social, de la Dirección General de Desarrollo Comunitario y\nDesarrollo Productivo de Grupos Vulnerables, y de la Unidad de Transparencia de la SBGro.\nLa Presidencia será ocupada por la persona titular de la SBGro; será el o la Presidenta quien nombrará a la persona encargada de Coordinación General y de la Secretaría Técnica, de entre las personas integrantes del comité.\nLas decisiones de dicho Comité, se tomarán por consenso con voz y voto de cada una de las personas integrantes, de ser necesario por mayoría de votos, en caso de empate la Presidencia tendrá el voto decisivo, sesionarán ordinariamente mínimo una vez al año, y de manera extraordinaria las veces que sea necesario, cuando alguno de los miembros lo solicite y serán los encargados de incorporar el PUPB. relacionados a la ejecución del programa, y de manera extraordinaria las veces que sea necesario a convocatoria de cualquiera de sus miembros, con al menos 24 horas de anticipación.\n9.2. Proceso de Incorporación al Programa Social.\nLa SBGro emitirá y publicará las Reglas de Operación y la Convocatoria del Programa para el otorgamiento del apoyo. Cuando se trate de una contingencia por fenómeno social o natural, no será necesario emitir convocatoria, los apoyos podrán ser entregados posterior a una visita de validación y levantamiento de censo por parte del personal de la SBGro.\nLa información referente al Programa se podrá consultar de manera permanente en el portal oficial del gobierno del estado.\nConvocatoria: la convocatoria dará a conocer el objetivo del Programa, los requisitos que deberán cumplir las personas solicitantes, número telefónico para pedir informes, fecha de recepción de solicitudes, fecha y forma de entrega de resultados por conducto de los principales medios de difusión de la SBGro.\nDicha convocatoria será publicada aproximadamente del 12 al 16 de agosto del presente año.\nInformación y difusión:\nSe realiza a través de la publicación de la convocatoria en los diversos medios de comunicación del gobierno del estado, así como en la página web: https://guerrero.gob.mx/dependencia/sector-central/secretaria-de-bienestar/.\nRedes sociales de la SBGro: Facebook.com/BienestarGro/.\nPortal de Transparencia.\nContraloría Social.\n10. Evaluación. supervisar su ejecución, transparencia y garantizando que los mecanismos de funcionamiento y administración, sean apegados al Programa Operativo Anual de la SBGro, con el único fin de alcanzar y beneficios económicos y sociales de su asignación y aplicación.\nAsimismo, podrá realizar una evaluación de resultados de carácter externo del Programa sujeto a\nReglas de Operación, para lo cual, se tendrá la facultad de designar en su caso a la instancia que realice dicho análisis.\nLa evaluación que aplicará la SBGro a través de la DGDCyDPGV, se llevará a cabo al final del\nPrograma, salvo indicaciones de la persona titular de la SBGro podrá ser de manera calendarizada conforme se acuerde, misma que puede ser cuantitativa y cualitativa e interna o externa lo que implicaría erogación de recursos financieros por parte del presupuesto del Programa.\n10.1. Indicadores (Construcción de la Matriz de Indicadores para Resultados. - Anexo 1).\n10.2. Seguimiento.\nLa SBGro en la operación del Programa y para el seguimiento de éste, integrará informes a través de la DGDCyDPGV y además llevará a cabo el seguimiento de los recursos asignados al mismo.\n10.3. Auditoría.\nLa SBGro será la responsable de la supervisión directa de las acciones, así como de verificar que en su ejecución se cumpla con la normatividad aplicable.\nLos recursos asignados para la operación del Programa podrán ser verificados por la SEFINA, la\nSCyTG, el órgano de fiscalización de las entidades paraestatales y la ASE en el ámbito de sus respectivas competencias.\nLa SBGro dará todas las facilidades a las instancias fiscalizadoras para realizar en el momento que juzguen pertinente, las auditorías necesarias; asimismo, efectuará el seguimiento y la solventación de las observaciones planteadas por los Órganos de Control.\nLa inobservancia de esta disposición, independientemente de las sanciones a que hubiere lugar, limitará la ministración de los recursos estatales en el siguiente ejercicio presupuestal.\n11. Mecanismo de Entrega del Apoyo.\nLas personas beneficiarias, cuyos datos e información solicitada fueron verificados, validados y revisados por el personal asignado de la SBGro, que cumplan con los criterios y requisitos de elegibilidad, establecidos en las presentes Reglas de Operación, y una vez que su expediente único este integrado, recibirán el apoyo en especie, proporcionado por el Programa, en una sola exhibición, de acuerdo a la solvencia presupuestal, en las instalaciones de la SBGro.\n12. Derechos y Obligaciones de las Personas Beneficiadas.\nDerechos:\n● Recibir la información necesaria del Programa, de manera clara y oportuna.\n● Recibir un trato digno, respetuoso y sin discriminación.\n● Tener la seguridad sobre la reserva y privacidad de sus datos personales conforme a la legislación en materia de acceso a la información pública y de protección de datos personales.\n● Atención sin costo.\n● Presentar denuncias, quejas o sugerencias ante las instancias correspondientes por el incumplimiento de las presentes Reglas de Operación.\nObligaciones:\n● Conducirse con respeto y trato amable con el personal involucrado en la operación del presente\nPrograma.\n● Informar bajo protesta de decir verdad en relación a sus datos personales y socioeconómicos.\n● Cumplir con la normatividad del programa establecida en las presentes Reglas de Operación.\n● Acudir puntualmente a los lugares en la fecha y hora señalada a recibir su apoyo.\n● Informar los cambios de domicilio y actualizar sus datos y documentación cuando proceda para los efectos a que dé lugar.\n● No hacer uso indebido del apoyo recibido (venta, préstamo o uso con fines partidistas o electorales, entre otros).\n● Participar en las acciones de contraloría social para la vigilancia del buen funcionamiento del\nPrograma.\n● Informar ante la SBGro, las fallas o irregularidades que se presenten en la entrega de los apoyos.\n12.1. Causales de Suspensión o Baja de las Personas Beneficiadas.\nEl incumplimiento de las obligaciones y compromisos establecidos en las presentes Reglas de\nOperación ameritarán la baja del Programa. De igual manera, se consideran causales de baja las siguientes:\n● Falsear la información proporcionada a la SBGro.\n● No presentarse a recibir el apoyo autorizado, en el lugar y fecha especificados por la SBGro.\n● Lucrar con el apoyo.\n● Por fallecimiento.\n12.2. Proceso de Baja.\n● Cuando las personas beneficiarias no cumplan con las obligaciones señaladas en el punto 12 de los incisos del apartado de las presentes Reglas de Operación.\n● Cuando se detecte como beneficiaria o beneficiario de algún otro programa social.\n● Las personas beneficiarias que causen suspensión no podrán solicitar su reincorporación al\nPrograma.\n13. Instancias Participantes.\nLas instancias ejecutoras del Programa serán:\n● La SBGro, ejecutora del Programa.\n● La SEPLADER, dictaminadora de las presentes Reglas de Operación y autoriza los recursos del\nPrograma.\n● La SEFINA, liberará los recursos del Programa de acuerdo a la calendarización.\n● La SCyTG, coadyuvante en las tareas de organización, control y evaluación del Programa.\n13.1. Instancia Normativa.\nLa SBGro, fungirá como la instancia administrativa y normativa del Programa, en caso de requerirlo podrá contar con el apoyo de los organismos e instituciones que considere importantes para el desarrollo exitoso de sus actividades, como pueden ser la SCyTG y la ASE.\n14. Transparencia.\n14.1. Promoción y Difusión del Programa Social.\nLa SBGro, emitirá y publicará la convocatoria del Programa. En ella obligatoriamente, se darán a conocer cuando menos el objetivo del Programa, los requisitos que deberán cumplir las personas aspirantes, la dirección del módulo de información, número telefónico para pedir informes, la fecha de apertura y cierre de la convocatoria, fecha y forma de entrega de resultados, por conducto de la página electrónica y las principales redes sociales de la SBGro.\nLa información referente al Programa será en las Oficinas de la SBGro, sito en el “Recinto de las en Boulevard René Juárez Cisneros, de la Ciudad de los Servicios, en Chilpancingo de los Bravo, capital del estado de Guerrero; México, C.P 39074.\n14.2. Contraloría Social.\nLa SBGro promoverá la Contraloría Social en base a la normatividad establecida para tal efecto, control, vigilancia y evaluación de los programas sociales.\nCon la finalidad de incrementar la participación ciudadana, se crearán Comités de Contraloría\nSocial, como órgano ciudadano de control, vigilancia y evaluación de las actividades del Programa, conformados por la población beneficiaria, los sectores sociales y representantes de los municipios, públicos se realice en términos de transparencia, eficacia, legalidad y honradez. Los objetivos específicos de este órgano de contraloría social son:\n● Hacer más transparentes las decisiones y ejecución de los recursos.\n● Incrementar la participación ciudadana.\n● Fomentar la organización social.\n● Inhibir los actos de corrupción y cooptación social, política y electoral.\n● Incrementar la eficiencia de los recursos públicos.\n● Fortalecer la cultura de la legalidad.\n● Mejorar la rendición de cuentas.\n● Perfeccionar la democracia e incorporar la evaluación ciudadana.\nEn atención a las facultades de la SCyTG será la autoridad competente para llevar a cabo la supervisión y verificación de las acciones a realizar por la instancia ejecutora de la promoción, difusión y realización de las acciones necesarias para la participación de las personas beneficiarias en este Programa social, a través de la integración y operación de comités de contraloría social para dar información, seguimiento, supervisión, vigilancia y evaluación del cumplimiento de criterios de elegibilidad y derechos de las personas beneficiarias, obligaciones del Programa y el desempeño de honestidad y calidad de las personas servidoras públicas.\n14.3. Protección de Datos Personales.\nPública del Estado de Guerrero y Ley Número 466 de Protección de Datos Personales en Posesión de\nSujetos Obligados del Estado de Guerrero.\nEn todo momento la persona beneficiaria podrá ejercer los derechos de alta, acceso, rectificación, cancelación y oposición de datos personales recabados. Estos datos personales recabados serán utilizados con la finalidad siguiente:\n● Validar que se cumplan los requisitos de elegibilidad para ser personas beneficiarias de este\nPrograma, que serán integrados de acuerdo a las facultades propias, compatibles análogos para la realización de compulsas para la integración del PUPB.\nPor lo tanto, se garantiza la protección de datos personales que sean recabados y en cumplimento\n14.4. Quejas y Denuncias.\na) En caso que se presente alguna queja o denuncia, la SBGro, deberá recibirla para turnarla, en su caso y de acuerdo a la gravedad, a la SCyTG.\nb) La persona funcionaria pública que reciba una queja o denuncia deberá indicar a la persona ciudadana su nombre completo, cargo y área de adscripción, además de asentar por escrito la fecha y hora de recepción, con la finalidad de brindarle elementos de referencia para posibles aclaraciones. De igual manera para fines de dar inicio al trámite de la queja o inconformidad, la funcionaria o el funcionario deberá pedir a la persona quejosa: Identificación oficial y domicilio actual.\nc) El funcionariado público que reciba la queja o denuncia deberá realizar el seguimiento para asegurarse, en el ámbito de su competencia, que ésta haya tomado el cauce correspondiente.\nd) Si la queja proviene del trabajo de los Comités de Contraloría Social, estos deberán cumplir los pasos siguientes:\n● Solicitar a la persona que le entregó la queja o denuncia, que le describa detalladamente el asunto que presenta.\n● Preguntar a la persona si tiene pruebas, y en caso afirmativo, deberá solicitarlas para entregarlas junto con la queja o denuncia.\n● Recibir la queja o denuncia y dar un acuse a la persona interesada.\n● Leer la queja y la información que se incluya en la misma.\n● Solicitar información a la autoridad competente, en caso de que así lo requiera, para que cuente con elementos de ambas partes que le permitan analizar el caso.\n● Verificar que realmente la queja sea procedente, es decir, confirmar si tiene sentido o fundamento para que el Comité pueda brindar una respuesta a la persona interesada. de responsabilidades administrativas, civiles o penales relacionadas con los programas sociales, deberá:\n● Presentarla, con la información previamente recopilada, al órgano de control estatal.\n● Solicitar un número de registro con el que le reciben la queja o denuncia, así como preguntar y escribir el nombre de la persona a quien se la entregaron.\n● Acudir, en el plazo establecido por la autoridad competente, para dar seguimiento a la respuesta que emita.\n● Informar a la persona interesada sobre la respuesta que le brinde la autoridad.\nLas quejas o inconformidades de la ciudadanía derivadas de alguna irregularidad en la operación del Programa deberán realizarse por escrito y por comparecencia de la persona quejosa y/o interesada, misma que deberá presentarse en las oficinas de la SBGro, “Recinto de las Oficinas del Poder Ejecutivo del Estado”, edificio Norte, planta baja, el inmueble ubicado en el número 62, en Boulevard René Juárez\nCisneros, de la Ciudad de los Servicios, en Chilpancingo de los Bravo, capital del estado de Guerrero;\nMéxico, C.P 39074.\n14.5. Acciones de Blindaje.\nLa SBGro para la operación y ejecución de los recursos estatales que opera el Programa deberá observar y atender las medidas que emitan la SCyTG, el ITAIGRO, el IEPC y las demás autoridades competentes, con la finalidad de impedir que los apoyos sean utilizados con fines políticos; por lo que la papelería y documentación oficial del programa deberá incluir la leyenda siguiente:\n\"Este Programa es de carácter público, no es patrocinado ni promovido por partido político alguno y sus recursos provienen de los impuestos que pagan todas las personas contribuyentes.\nEstá prohibido el uso de este Programa con fines políticos, electorales, de lucro y otros distintos a los establecidos. Quien haga uso indebido de los recursos de este Programa, será sancionado de acuerdo con la ley aplicable y ante la autoridad competente\".\n14.6. Acta de Donación. (Anexo 2).\nPara la entrega del apoyo, se suscribirá un acta de donación, en la que participará la SBGro a través de la DGDCyDPGV y la persona beneficiaria. (Anexo 2,).\n15. Perspectiva de Género.\nEl reconocimiento de las mujeres desde una visión igualitaria en el acceso a la toma de decisiones, desarrollo y bienestar social; en este sentido, en el presente Programa se impulsará como acción afirmativa y con el propósito de contribuir a la reducción de las desigualdades, dará prioridad a las solicitudes de presentes Reglas de Operación.\n16. Enfoque de Derechos.\nLos derechos humanos abarcan todos los aspectos de la vida: la salud, la educación, la participación política, el bienestar económico, no ser objeto de violencia, por mencionar algunos de los más fundamentales.\nEn la aplicación del Programa, se harán valer los derechos de las personas beneficiarias, tomando en consideración, los factores de desigualdad que pudieran poner en riesgo el acceso al Programa.\n(REFORMADO, P.O 23 ALCANCE VI, 21 DE MARZO 2025)\nSe dará prioridad a personas que pertenecen a grupos históricamente discriminados, excluidos, e invisibilizados, para que a través de la implementación de la presente política pública se reduzcan brechas de desigualdad, exclusión, marginación y pobreza, y se siente las bases de un cambio verdadero desde el ejercicio de pleno de sus derechos. (ADICIONADO, P.O 23 ALCANCE VI, 21 DE MARZO 2025)\n17. Acciones Contra el SARS-COV 2.\nLas medidas sanitarias para la recepción de solicitudes y entrega de apoyos del Programa, estarán en función del “Acuerdo que establece los porcentajes de ocupación y horarios de funcionamiento de diversas actividades esenciales y no esenciales en el Estado de Guerrero”, de acuerdo a la semaforización vigente al momento de la entrega, así como de las demás disposiciones que establezca la Secretaría de\nSalud.\n18. Anexos que reflejen la entrega del apoyo (Económico. Especie o Servicios).\nAnexo 1.- MIR. (REFORMADO, P.O 23 ALCANCE VI, 21 DE MARZO 2025)\nAnexo 2.- Acta de Donación.\nAnexo 3.- Solicitud de Acceso al Programa de Acciones Emergentes (ADICIONADO, P.O 23 ALCANCE\nVI, 21 DE MARZO 2025)\nAnexo 4.- CUIS (ADICIONADO, P.O 23 ALCANCE VI, 21 DE MARZO 2025)\nAnexo 1.- MIR\nMatriz de indicadores para Resultados\nResumen\nNarrativo\nPoblación en estado de vulnerabilidad por Portal oficial de transparencia de\nPorcentaje de paquetes de La persona fenómenos la SBDG lámina galvanizada para techos beneficiaria aporta\nPropósito hidrometereolo https://www.guerrero.gob.m de viviendas afectadas por la información que\n(resultados) gicos, siniestros o x/transparencia/PLATAFORMAfenómenos climatológicos o se requiere para desgaste natural NACIONAL-DEsociales. recibir los apoyos. que afectan sus TRANSPARENCIA-4/ viviendas.\nProductos Verbo Participio\nPorcentaje de apoyos entregados a familias\nPrograma de guerrerenses con viviendas\nComponente Acciones Entregados afectadas por fenómenos\nEmergentes naturales o desgaste natural de sus viviendas.\nPortal oficial de transparencia de la\nLa convocatoria\nA.1.1 Difusión de la SBDG tiene la difusión en convocatoria y Municipios que participan en la https://www.guerrero.gob.m\nCada una de las recepción de convocatoria del Programa. x/transparencia/PLATAFOR MAregiones del solicitudes. NACIONAL-DEestado.\nTRANSPARENCIA-4/\nPortal oficial de transparencia de la\nSBDG Las personas\nActividad A.1.2 Elección de\nPorcentaje de expedientes https://www.guerrero.gob.m aportan\n(Procesos) personas elegibles del Programa. x/transparencia/PLATAFOR MA-información beneficiarias.\nNACIONAL-DE- verídica.\nTRANSPARENCIA-4/\nA.1.3 'Porcentaje de avance en montos Portal oficial de transparencia de\nEl proveedor\nEntrega los entrega de apoyos x/transparencia/PLATAFORMAmateriales en del programa NACIONAL-DEtiempo y forma.\nTRANSPARENCIA-4/\nAnexo 3.- Solicitud de Acceso al Programa de Acciones Emergentes\n__________________Municipio de ___________ estado de Guerrero, a ______del 2025.\nMtro. Pablo Andre Gordillo Oliveros\nTitular de la Secretaría de Bienestar\nSuscribe, el/la C.___________________________________________________________, con domicilio en ______________________________________________________________________, del municipio de ___________________________________________, del estado de Guerrero, me permito solicitar a usted considere mi petición para ingresar en el Programa Acciones Emergentes, del ejercicio fiscal 2025, de la Secretaría de Bienestar del Estado de Guerrero que usted dirige, que consiste en\n_____________________________________________________, como jefe de familia le hago de su conocimiento que en esta vivienda habitamos _______ personas, se anexa la CURP de cada uno de los habitantes.\nPor lo anterior, de ser beneficiado me comprometo a coadyuvar en el seguimiento del programa y brindar los datos necesarios para su comprobación.\nNombre y firma: _______________________________\nTeléfonos: ____________________________________\n“Este programa es público y ajeno a cualquier partido político. Queda prohibido su uso para fines distintos a los establecidos en el programa\nAnexo 4.- CUIS\nPrimero. El presente Acuerdo entrará en vigor al día siguiente de su publicación en el Periódico\nSegundo. Se abroga el Acuerdo por el que se crea el Programa Acciones Emergentes y se emiten\nGuerrero No. 37, alcance I, de fecha 09 de mayo de 2023.\nTercero. A partir de la entrada en vigor del presente Acuerdo, las Reglas de Operación del\nPrograma Acciones Emergentes, subsecuentes o sus modificaciones serán emitidas por la persona titular de la Secretaría de Bienestar, responsable directa de la operación y ejecución de las mismas.\nDado en el “Recinto de las Oficinas del Poder Ejecutivo del Estado”, el inmueble ubicado en el número 62, en Boulevard René Juárez Cisneros, de la Ciudad de los Servicios, edificio centro, en\nChilpancingo de los Bravo, capital del estado de Guerrero; México, C.P 39074, a los veintiocho días del mes de junio del año dos mil veinticuatro.\nLA GOBERNADORA CONSTITUCIONAL DEL ESTADO DE GUERRERO.\nMTRA. EVELYN CECIA SALGADO PINEDA.\nRúbrica.\nLA SUBSECRETARIA DE GOBIERNO, ASUNTOS JURÍDICOS Y DERECHOS HUMANOS\nENCARGADA DE DESPACHO DE LA SECRETARÍA GENERAL DE GOBIERNO.\nDRA. ANACLETA LÓPEZ VEGA.\nRúbrica.\nEL SECRETARIO DE BIENESTAR.\nMTRO. PABLO ANDRE GORDILLO OLIVEROS.\nRúbrica.\nN. DE E. A CONTINUACIÓN, SE TRANSCRIBEN LOS ARTÍCULOS TRANSITORIOS DE LOS\nACUERDO DE MODIFICACIÓN A LAS PRESENTES REGLAS DE OPERACIÓN.\nPrimero. El presente Acuerdo de Modificación entrará en vigor al día siguiente de su publicación\nSegundo. Se abrogan todas las disposiciones que se opongan al presente acuerdo de\nModificación. edificio Norte Planta Baja, Boulevard René Juárez Cisneros No. 62, código postal 39074, colonia Ciudad de los Servicios, en Chilpancingo de los Bravo, capital del estado de Guerrero, a los veintisiete días del mes de enero del año dos mil veinticinco.\nMTRO. PABLO ANDRE GORDILLO OLIVEROS.\nRúbrica.",
  "ordenamiento": "PROGRAMA",
  "jurisdiccion": "GUERRERO",
  "fuente_oficial": "DIARIO OFICIAL DE LA FEDERACION",
  "Fecha de Publicación": "21 DE MARZO DE 2025",
  "ULTIMA REFORMA PUBLICADA": null,
  "status": "VIGENTE",
  "es_escaneado": false,
  "tiene_tablas": true,
  "materia": [
    "general"
  ]
}