{
  "titulo": "Acuerdo por el Que Se Crean y Emiten las Reglas de Operación del Programa Molinos de Mano para Nixta",
  "Contenido": "TORTILLAS PARA EL EJERCICIO FISCAL 2019\nTEXTO ORIGINAL\nMOLINOS DE MANO PARA NIXTAMAL Y PRENSAS PARA HACER TORTILLAS PARA EL EJERCICIO\nFISCAL 2019.\nLIC. JOSÉ FRANCISCO SOLÍS SOLÍS, DIRECTOR GENERAL DEL SISTEMA PARA EL DESARROLLO\nINTEGRAL DE LA FAMILIA DEL ESTADO DE GUERRERO, EL CUAL ES UN ORGANISMO PÚBLICO\nDESCENTRALIZADO, CON PERSONALIDAD JURÍDICA Y PATRIMONIO PROPIO CREADO MEDIANTE\nLEY 107 PUBLICADA EN EL PERIÓDICO OFICIAL NÚMERO 10 DEL GOBIERNO DEL ESTADO CON\nFECHA 9 DE MARZO DE 1977 Y REGULADO POR LA LEY 479 PUBLICADA EN EL PERIÓDICO OFICIAL\nNÚMERO 61 DEL 02 DE AGOSTO DE 1983, CON FUNDAMENTO EN LA LEY 690 DE ENTIDADES\nPARAESTATALES PARA EL ESTADO DE GUERRERO; EL ARTÍCULO 27 FRACCIÓN X DEL\nREGLAMENTO INTERIOR DEL ORGANISMO PÚBLICO DESCENTRALIZADO, ASÍ COMO LA LEY\nSOBRE EL SISTEMA ESTATAL DE ASISTENCIA SOCIAL NÚMERO 332, ARTICULO 4, FRACCIONES I\nA LA XV; ARTICULO II BIS, FRACCIÓN I AL IV Y ARTÍCULO 11 TER, ÚLTIMA REFORMA PUBLICADA\nEN EL PERIÓDICO OFICIAL DEL GOBIERNO DEL ESTADO NÚMERO 15 DE FECHA 20 DE FEBRERO\nDEL 2015, Y\nCONSIDERANDO\nQue el Plan Estatal de Desarrollo 2016-2021 impulsa entre sus prioridades, un Guerrero que garantice el ejercicio efectivo de los derechos sociales de todos los guerrerenses, que vaya más allá del asistencialismo y que conecte al capital humano con las oportunidades que genera la economía en el marco de una nueva productividad social que disminuya las brechas de desigualdad y promueva la más amplia participación social en las políticas públicas.\nQue la visión del Gobierno dentro de sus objetivos, es establecer la planeación y coadyuvar a construir y asegurar un impacto real en la calidad de vida de los guerrerenses.\nQue específicamente en la visión del gobierno en el inciso, 1) Políticas públicas menos asistencialistas y más estructurales para garantizar el desarrollo de quienes menos tienen. Distribución eficiente del presupuesto en rubros y proyectos productivos que generen cambios profundos en este sector. Uno de los ejes que respaldan esta visión es el eje III.- Guerrero Socialmente Comprometido. Objetivo 3.1. Garantizar el ejercicio efectivo de los derechos sociales para la población y Objetivo 3.2. Transitar hacia una sociedad equitativa e incluyente y Objetivo 3.9. Proveer un entorno adecuado para el desarrollo de una vida digna. de 1983, se creó el Sistema Estatal para el Desarrollo Integral de la Familia, como un organismo público descentralizado, el cual tiene por objeto de Promover el bienestar social y prestar al efecto servicios de\nTORTILLAS PARA EL EJERCICIO FISCAL 2019\nNacional para el Desarrollo Integral de la Familia, así como el propio Estado; II.- Apoyar el desarrollo de la familia y de la comunidad; III.- Fomentar la educación, para la integración social; IV.- Impulsar el sano crecimiento físico y mental de la niñez; 2 V.- Atender las funciones de auxilio a las instituciones de asistencia privada que le confíe la dependencia competente, con sujeción a lo que disponga la Ley relativa; VI.- Operar establecimientos de asistencia social en beneficio de menores en estado de abandono, de ancianos y de los minusválidos; VII.- Realizar estudios e investigaciones sobre los problemas de la familia, de los menores, de los ancianos y de los minusválidos; VIII.- Prestar servicios de asistencia jurídica y de orientación social de los menores, ancianos y minusválidos sin recursos; IX.- Intervenir en el ejercicio de la tutela de los menores, que corresponda al Estado, en los términos de la Ley respectiva; X.- Auxiliar al\nMinisterio Público en la protección de incapaces y de los procedimientos civiles y familiares que les afecten, de acuerdo con la Ley; XI.- Procurar permanentemente la adecuación de los objetivos y programas del sistema estatal, a los que lleve a cabo el sistema nacional, a través de decretos, acuerdos, convenios o cualquier figura jurídica encaminada a la obtención de bienestar social, y, XII.- Los demás que les encomienden las Leyes.\nQue los titulares de las Secretarías, Dependencias y Entidades de la Administración Pública Estatal, así como, los servidores públicos autorizados para ejercer recursos públicos del presupuesto de inversión de las mismas, serán responsables de los programas y proyectos de inversión que realicen.\nQue los apoyos otorgados deberán sujetarse a criterios de objetividad, equidad, transparencia, publicidad, selectividad y temporalidad.\nQue el artículo 58 del Decreto de Presupuesto de Egresos del Estado de Guerrero, para el Ejercicio Fiscal\n2019, establece que con el objeto de asegurar la aplicación eficiente, eficaz, oportuna equitativa y transparente de los recursos públicos la Secretaría de Finanzas y Administración y la Secretaría de\nPlaneación y Desarrollo Regional emitirán las disposiciones a que deberán sujetarse los programas de inversión sujetos a reglas de operación.\nQue con sustento en lo anterior, la Secretaría de Planeación y Desarrollo Regional, expidió los\nLineamientos para la Elaboración de las Reglas de Operación de los Programas Sociales Estatales para el política estatal ya que dentro de los objetivos y estrategias que plantea el Ejecutivo Estatal, está abatir la en las oportunidades que les permitan desarrollarse con independencia y plenitud; asimismo, plantea elevar la productividad de las personas para que cuenten con mejores opciones de empleo e ingreso, que les permitan reducir sus niveles de pobreza, es por ello que surge este programa con el propósito de mitigar los impactos económicos sociales por las que atraviesan las personas que habiten en zonas rurales, mediante la entrega de proyectos productivos y de servicios.\nTORTILLAS PARA EL EJERCICIO FISCAL 2019\nQue en el Dictamen y Decreto Número 182 del Presupuesto de Egresos del Estado de Guerrero para el\nEjercicio Fiscal 2019 se señala que se ejercerán los recursos bajo una política de gasto público, que permita dar cumplimiento a lo que globalmente prevén los ejes rectores del Plan Estatal de Desarrollo 20162021\nEn cumplimiento de lo anterior, se ha tenido a bien expedir el siguiente:\nACUERDO POR EL QUE SE CREAN Y EMITEN LAS REGLAS DE OPERACIÓN DEL PROGRAMA\nMOLINOS DE MANO PARA NIXTAMAL Y PRENSAS PARA HACER TORTILLAS PARA EL EJERCICIO\nFISCAL 2019\nArtículo 1. Se emiten las Reglas de Operación del Programa Molinos de Mano para Nixtamal y Prensas para hacer Tortillas, para el Ejercicio Fiscal 2019, en las que se establecen los principios de eficiencia, eficacia, oportunidad, equidad y transparencia de los recursos públicos y requisitos que se deben de cumplir para poder acceder ha dicho programa.\nArtículo 2. El Programa Molinos de Mano para Nixtamal y Prensas para hacer Tortillas, tiene por objeto fomentar el uso de herramientas tecnificadas como un elemento clave para que las familias que viven en condiciones de desventaja socioeconómica mejoren sus niveles de vida.\nArtículo 3. En las Reglas de Operación del Programa Molinos de Mano para Nixtamal y Prensas para hacer Tortillas, se establecen los criterios y requisitos que se deben cumplir para poder acceder a dicho programa.\nCONTENIDO\n1. INTRODUCCIÓN\n1.1 Antecedentes\n1.2 Alineación programática\n1.3 Diagnóstico\n2. DEPENDENCIA O ENTIDAD RESPONSABLE DEL PROGRAMA\n3. OBJETIVOS Y ALCANCES\n3.1 Objetivo General\n3.2 Objetivos Específicos\n3.3 Alcances\n4. METAS FÍSICAS\n5. PROGRAMACIÓN PRESUPUESTAL\nTORTILLAS PARA EL EJERCICIO FISCAL 2019\n6 REQUISITOS Y PROCEDIMIENTO DE ACCESO\n6.1 Difusión\n6.2 Requisitos de Acceso\n6.3 Procedimientos de Acceso\n6.4 Requisitos de Permanencia, Causales de Baja o Suspensión Temporal\n6.5 Modos de Entrega del Beneficio\n7 PROCEDIMIENTOS DE INSTRUMENTACIÓN\n7.1 Operación\n7.2 Gastos de Operación\n8. TRANSPARENCIA\n8.1 Difusión\n8.2 Blindaje Electoral\n8.3 Supervisión y Control\n8.4 Mecanismos de Evaluación e Indicadores\n8.4.1 Evaluación\n8.4.2 Indicadores\n8.5 Auditoria\n8.6 Recursos no Devengados\n8.7 Contraloría Social\n8.8 Formas de Participación Social\n8.9 Procedimiento de Queja o Inconformidad Ciudadana\n8.10 Mecanismos de Exigibilidad\n8.11 Acta de Entrega-Recepción\n9. CRITERIOS DE SELECCIÓN Y ELEGIBILIDAD\n9.1 Método de Selección de Beneficiarios y Beneficiarias\n10. MECÁNICA DE OPERACIÓN\n10.1 Instancia Ejecutora\n10.2 Instancia administrativa y/o normativas\n10.3 Delimitación de atribuciones\n11. DERECHOS, OBLIGACIONES Y SANCIONES DE LOS BENEFICIARIOS DE PROGRAMAS\nSOCIALES\n11.1 Derechos\nTORTILLAS PARA EL EJERCICIO FISCAL 2019\n11.2 Obligaciones\n11.3 Sanciones\n12. INTERPRETACIÓN TRANSITORIOS ANEXOS\n1. INTRODUCCIÓN\n1.1. ANTECEDENTES\nEl DIF Guerrero, a través de la Dirección de Asistencia Alimentaría y Desarrollo Comunitario, fomenta y promueve acciones que mitiguen la vulnerabilidad de las personas que son sujeto de asistencia social, y tiene como Intención apoyar y coordinar las acciones de desarrollo comunitario en las que participan los tres niveles de gobierno (Federal, Estatal y Municipal) dentro del ámbito de su competencia.\nEn este documento se sustenta la intervención institucional que desde el ejercicio 2012 ha venido atendiendo a población en situaciones de vulnerabilidad, así mismo, se especifica la participación básica de llevar a cabo entre los sistemas DIF municipales, con el objetivo de realizar programas en coordinación, como es Molinos de Mano para Nixtamal y Prensas para hacer Tortillas, y tiene como prioridad la atención a aquellas familias en estado de vulnerabilidad social que habiten en localidades de alto y muy alto grado de marginación; cuyo propósito es fomentar el uso de herramientas tecnificadas como un elemento clave para que las familias que viven en condiciones de desventaja socioeconómica mejoren sus niveles de vida.\nDentro de la política de Desarrollo Social, el Sistema para el Desarrollo Integral de la Familia del Estado de\nGuerrero, opera el programa de Proyectos productivos y de servicios, cuyo objetivo es Fortalecer la economía de las personas que habiten en zonas rurales.\n1.2. ALINEACIÓN PROGRAMÁTICA\nEn cumplimiento a lo que globalmente prevén los ejes rectores del Plan Estatal de Desarrollo 2016-2021, por lo que se alinea en el eje III.- Guerrero Socialmente Comprometido; Objetivos: 3.1. Construir un Estado\nGarante de los Derechos Sociales de las Personas, 3.2. Edificar la ruta hacia una sociedad equitativa e incluyente; Estrategias: 3.1.2. Fortalecer el desarrollo de capacidades de los integrantes de una sociedad con carencias, que permitan contribuir a incrementar su capacidad productiva y su calidad de vida y 3.2.1. sustenta en:\nLíneas de Acción\n• Fomentar el acceso efectivo de las familias a sus derechos sociales, particularmente de aquellas en pobreza extrema, mediante políticas públicas coordinadas y concurrentes.\nTORTILLAS PARA EL EJERCICIO FISCAL 2019\n• Potenciar la inversión conjunta de la sociedad organizada y de los órdenes de Gobierno, invirtiendo en proyectos de infraestructura social básica, complementaria y productiva.\nLas presentes Reglas se alinean a lo estipulado en el Programa Sectorial \"Desarrollo y Asistencia Social\"\n2016-2021, cuyo objetivo es atender a personas vulnerables, a través de desarrollar capacidades y habilidades de las familias con carencias alimentarias al proporcionar los apoyos necesarios que mejoren su calidad de vida y sus núcleos familiares, logrando fortalecer el tejido social en localidades vulnerables.\n1.3. DIAGNOSTICO\nEl alto nivel de informalidad de la economía nacional y la marginación de numerosos municipios y localidades a lo largo de todo el país, provoca que la inestabilidad del empleo sea considerada como uno de los principales motivos de preocupación dentro de los hogares mexicanos; que la pérdida del empleo y la consecuente disminución de los ingresos aún de manera temporal tienen graves consecuencias sobre la pobreza de los hogares, fundamentalmente porque la falta de empleo conduce a una importante disminución del capital económico familiar, mayor presión sobre los recursos naturales, así como el abandono de la educación y el fomento al endeudamiento, estas afectaciones frecuentemente persisten aun cuando sus miembros se reintegran a las actividades productivas y remuneradas.\nQue la oferta laboral puede disminuir en algunas regiones del Estado a lo largo del año debido a emergencias o por efecto de los ciclos productivos, afectando principalmente a la población de escasos recursos que enfrenta periódicamente etapas con una grave disminución en sus ingresos y patrimonio.\nPor ello las políticas de empleo estatal deben considerar además del fomento a la creación de empleos formales e informales (se refiere a la actividad laboral de los trabajos independientes), la ejecución de acciones que permitan disminuir el impacto del desempleo temporal; una de las alternativas para enfrentar dicho fenómeno es la implementación del Programas que brinden a los hogares auto emplearse y/o generar empleo que mitiguen los impactos económicos sociales. Que el diseño del Programa Molinos de Mano para Nixtamal y Prensas para Hacer Tortillas, implica que los posibles beneficiarios deben participar en proyectos de beneficio familiar o comunitario como corresponsabilidad obligatoria para recibir los apoyos que se les otorgue. Este requisito no solamente promueve la participación activa de los ciudadanos en el desarrollo de sus hogares y comunidades, sino que además genera beneficios adicionales al resto de la sociedad en función de los proyectos ejecutados.\nQue dentro de los objetivos y estrategias que plantea el Ejecutivo Estatal, está abatir la marginación y el oportunidades que les permitan desarrollarse con independencia y plenitud; asimismo, plantea elevar la productividad de las personas para que cuenten con mejores opciones de empleo e ingreso, que les permitan reducir sus niveles de pobreza.\nEl trabajo informal en países de economía subdesarrollada como México, está altamente asociada con el autoempleo, La carencia de plazas laborales que brinden una mayor seguridad salarial y mejores condiciones de trabajo orilla a casi el 60% de los buscadores de empleo a resolver por sí mismos su\nTORTILLAS PARA EL EJERCICIO FISCAL 2019 y de servicios.\nEn el estado existen 895, 157 hogares de los cuales el 293 086 están conformadas por Jefas de Familias que es el 33% y 602 071, se conforman por Jefes de Familia que en términos porcentuales le corresponde el 67% razón por la cual el Sistema para el Desarrollo Integral de la Familia beneficiará a 842 familias que es nuestra población objetivo y la constituyen las familias en estado de vulnerabilidad dando prioridad a los que habiten en Municipios o Localidades con alto o muy alto grado de marginación, considerando la suficiencia presupuestal para el ejercicio vigente y los criterios de focalización y priorización del Proyecto.\nDentro de estas reglas se desarrolla: a.- Naturaleza del Programa: dentro de los objetivos y estrategias que plantea el Ejecutivo Estatal, está abatir la marginación y el rezago social que enfrentan los grupos sociales vulnerables para proveerles de igualdad en las oportunidades que les permitan desarrollarse con independencia y plenitud; asimismo, plantea elevar la productividad de las personas para que cuenten con mejores opciones de empleo e ingreso, que les permitan reducir sus niveles de pobreza, es por ello que surge este programa con el propósito de mitigar los impactos económicos sociales por las que atraviesan b.- Origen y Fundamento: Constitución Política de los Estados Unidos así como:\n• Ley General de Salud, (última reforma publicada en el Diario Oficial de la Federación de fecha 12 julio de 2018).\n• Ley de Asistencia Social, (última reforma publicada en el Diario Oficial de la Federación de fecha\n24 de abril 2018).\n• Ley General para la Inclusión de las Personas con discapacidad, (última reforma publicada en el\nDiario Oficial de la Federación de fecha 12 de julio 2018).\n• Ley No. 817 para las Personas con Discapacidad del Estado, (última reforma publicada en el\nPeriódico Oficial número 103, de fecha 26 de diciembre de 2014).\n• Ley 479 del Sistema para el Desarrollo Integral de la Familia, publicada en el periódico Oficial el martes 02 de agosto de 1983. el Periódico Oficial número 74, alcance I, de fecha 13 de septiembre de 2016).\n• Ley General para la Inclusión de las Personas con discapacidad.\n• Programa Sectorial Desarrollo y Asistencia Social 2016 - 2021.\n• Estrategia Local \"Guerrero Contigo\"\n• Reglamento Interno del Sistema para el Desarrollo Integral de la Familia del Estado de Guerrero.\nTORTILLAS PARA EL EJERCICIO FISCAL 2019\n• Plan Estatal de Desarrollo 2016 - 2021.\n• Programa Sectorial Desarrollo y Asistencia Social 2016 -2021.\n• Decreto Número 182 del Presupuesto de Egresos del Estado de Guerrero.\n• Reglamento Interno del Sistema para el Desarrollo Integral de la Familia del Estado de Guerrero.\n• Manual de Organización del DIF.\n• Y todos aquellos Ordenamientos Normativos Aplicables. c.- Objetivos y Metas: Contribuir al gasto familiar y a su salud de las familias más desprotegidas, que viven en condiciones de pobreza, para que tengan una mejor calidad de vida, a través de la entrega de Molinos de Mano para Nixtamal y Prensas para Hacer Tortillas a 842 familias. d.- Ubicación Geográfica: Se atenderán a los 81 municipios que integran el Estado, dando prioridad a los municipios de alta y muy alta marginación. e.- Actividades a Realizar: Gestionar ante las instancias de Gobierno Federales y Estatales, los recursos financieros, para llevar a cabo la adquisición de los materiales, insumos y productos necesarios en la operatividad del proyecto; así mismo dar a conocer al Sistema Municipal DIF, las Reglas de Operación del programa y proporcionar de forma calendarizada los suministros de los apoyos. f. - Instancias Participantes: La instancia ejecutora es el Sistema para el Desarrollo Integral de la Familia, a través de la Dirección de Asistencia Alimentaria y Desarrollo Comunitario, quien se coordinará con los\nSistemas Municipales DIF para llevar a cabo la ejecución y seguimiento del proyecto. g.- Presupuesto de Inversión: Se tiene contemplado una inversión de $ 561,200.00 (Quinientos sesenta y un mil doscientos pesos 00/100 M.N.), recursos presupuestales que provienen del Ramo 33.- Aportaciones\nFederales para Entidades y Municipios, específicamente del Fondo de Aportaciones Múltiples (Asistencia\nSocial). h.- Glosario de Términos:\nSEDIF: Sistema para el Desarrollo Integral de la Familia.\nSEFINA: Secretaría de Administración y Finanzas.\nSEPLADER: Secretaría de Planeación y Desarrollo Regional.\nAsistencia Social: Conjunto de Acciones Tendientes a Modificar y Mejorar las Circunstancias de Carácter\nSocial que Impiden el Desarrollo Social del Individuo, así como la Protección Física, Mental y Social de\nPersonas en Estado de Necesidad.\nGrupos Vulnerables: Persona o grupo que por sus características de desventaja por edad, sexo, estado civil; nivel educativo, origen étnico, situación o condición física y/o mental; requieren de un esfuerzo\nTORTILLAS PARA EL EJERCICIO FISCAL 2019\n2. DEPENDENCIA O ENTIDAD RESPONSABLE DEL PROGRAMA\nLa instancia ejecutora será el sistema para el Desarrollo Integral de la Familia, a través de la Dirección de\nAsistencia Alimentaria y Desarrollo Comunitario, quien se coordinará con los Sistemas Municipales DIF para llevar a cabo la ejecución y seguimiento del programa.\n3. OBJETIVOS Y ALCANCES\n3.1. GENERAL\nContribuir al gasto familiar y a su salud de las familias más desprotegidas, que viven en condiciones de pobreza, para que tengan una mejor calidad de vida, a través de beneficiar a 842 familias con la entrega de Molinos de Mano para Nixtamal y Prensas para Hacer Tortillas.\n3.2. ESPECÍFICOS\n• Generar una alternativa de transformación del maíz\n• Incrementar el ingreso familiar.\n• Brindar un servicio básico.\n3.3. ALCANCES\nLa operación o ejecución del programa surge para mitigar y garantizar que las familias que habitan en\nMunicipios y /o Localidades con alto o muy alto grado de marginación aminoren el desgaste físico, que implica moler y hacer tortillas con técnicas ancestrales, por ello se busca nuevos programas que atiendan el derecho a la seguridad social y a la alimentación, como respuesta a ello se apoyaran a 842 familias con la dotación de Molinos de Mano para Nixtamal y Prensas para Hacer Tortillas, mejorando su economía familiar y comunitaria.\nLa población objetivo la constituyen las familias que habiten en los 81 municipios que conforman a nuestro\nEstado dando prioridad a los Municipios o Localidades con alto o muy alto grado de marginación, del Proyecto.\n4. METAS FÍSICAS\nPara este presente ej ercicio fiscal se pretende atender a 842 familias, dando prioridad a los Municipio y\nLocalidades de alta y muy alta marginación, dicho apoyo es entregado directamente al beneficiario en puntos sedes ubicados en sus Municipio correspondientes.\nTORTILLAS PARA EL EJERCICIO FISCAL 2019\n5. PROGRAMACIÓN PRESUPUESTAL\nDictamen y Decreto Número 182 del Presupuesto de Egresos del Estado de Guerrero para el Ejercicio\nFiscal 2019 se señala que se ejercerán los recursos bajo una política de gasto público, que permita dar cumplimiento a lo que globalmente prevén los ejes rectores del Plan Estatal de Desarrollo 2016-2021.\nMismo que es subsidiado a través de recursos provenientes del Ramo 33.- Aportaciones Federales para\nEntidades y Municipios, específicamente del Fondo de Aportaciones Múltiples (Asistencia Social), para el programa Molinos de Mano para Nixtamal y Prensas para Hacer Tortillas por un monto de $ 561,200.00\n(Quinientos sesenta y un mil doscientos pesos 00/100 M.N.) y cuyo costo promedio por beneficiario y / o beneficiaria es de $ 666.51 (Seiscientos sesenta y seis pesos 51/100 M.N.).\nCRONOGRAMA FINANCIERO\nPRES. AUT. ENE FEB MAR ABRIL MAY JUN\n561,200.00 0.00 0.00 0.00 561,200.00 0.00 0.00\nNOTA: PUEDE EXISTIR VARIACION EN RELACION A LO APROBADO POR EL DOF. Y/O POR LAS NECESIDADES PROPIAS DEL SEDIF.\nA PARTIR DEL MES DE MAYO\n6. REQUISITOS Y PROCEDIMIENTOS DE ACCESO\n6.1. DIFUSIÓN\nEl sistema para el Desarrollo Integral de la Familia a través de los diferentes medios de comunicación y de las redes sociales da conocer cada uno de los diferentes programas de asistencia social que ejecuta y opera en coordinación con las diferentes Direcciones que integran el Sistema como son; Programas\nAlimentarios, Proyectos Asistenciales, de Bienestar Social y Desarrollo Comunitario; cuyos requisitos se encuentran en las oficinas del Sistema ubicadas en Boulevard Rene Juárez Cisneros, Colonia Ciudad de los Servicios y ubicada Av. Gabriel Leyva s/n esq. Ruffo Figueroa, Col. Burócratas, C.P. 39090, Chilpancingo, Guerrero, con un horario de atención de 8:00 am a 3:00 pm y/o los teléfonos 01(747)\n4725595, 01(747)47256 00, 01(747)47 25672 ext 1151 Y 1159. Así mismo al correo electrónico:\nSe brinda atención en los 81 municipios del Estado, teniendo una capacidad de atención de niñas, niños y adolescentes, mujeres embarazadas, mujeres en periodo de lactancia, personas con discapacidad, adultos mayores y personas vulnerables por ingresos.\nTORTILLAS PARA EL EJERCICIO FISCAL 2019\n6.2. REQUISITOS AL ACCESO en el Centro de Rehabilitación Integral Guerrero, Boulevard Lic. René Juárez Cisneros S/N, Col. Ciudad de los Servicios, Chilpancingo, dirigido a la Presidenta o Director General del DIF para ser considerado dentro del Programa, anexando copia fotostática de la siguiente documentación: o Credencial de elector. o CURP.\n✓ La solicitud es turnada a la Dirección de Asistencia Alimentaria y Desarrollo Comunitario para su atención, quien en un plazo no mayor a 60 días hábiles dará respuesta a la misma.\n✓ La Dirección de Asistencia Alimentaria y Desarrollo Comunitario aplica estudio socioeconómico al solicitante para determinar si será beneficiario del programa y / o Proyecto.\n✓ Se realiza la entrega del apoyo de manera personal o en el municipio beneficiado, solicitándole al beneficiario firme acta de donación que acredite la entrega.\n6.3. PROCEDIMIENTO DE ACCESO\nLa operación del Proyecto Molinos de Mano para Nixtamal y Prensas para Hacer Tortillas, surge por la necesidad de atender el problema del desempleo y atendiendo la carencia alimentaria, el cual busca garantizar el derecho a la alimentación a la población vulnerable atendiendo a los 81 municipios que conforman nuestro Estado, dando prioridad a los municipios de alta o muy alta marginación se realiza a través de la demanda ciudadana y / o peticiones que se reciben en las instalaciones del Sistema para el\nDesarrollo Integral de la Familia o directamente a la Presidenta del Sistema Estatal.\nSerán beneficiados con el apoyo del proyecto, los solicitantes que cumplan con las siguientes características y con la disponibilidad presupuestal del programa:\n1. personas con discapacidad, adultos mayores y personas vulnerables por ingresos.\n2. Habitar en Municipios o Localidades de alto o muy alto grado de marginación.\nToda persona podrá conocer el estado de su trámite, y su aceptación o no al proyecto, de acuerdo con las reglas de operación vigentes. Las beneficiarias y / o beneficiarios tendrán derecho a ser tratado con\n• Recibir la información necesaria de manera clara y oportuna para participar en el programa.\n• Reserva y privacidad de su información personal.\nLos beneficiarios pasaran a formar parte del Padrón de beneficiarios, el cual será de carácter público, Información Pública.\nTORTILLAS PARA EL EJERCICIO FISCAL 2019\n6.4. REQUISITOS DE PERMANENCIA, CAUSALES DE BAJA O SUSPENSIÓN TEMPORAL.\nVisita de seguimiento a los beneficiarios, con la finalidad de constatar la situación socioeconómica y seguimiento a las necesidades prioritarias, la población sujeta de atención deberá cumplir con:\n• Dar cumplimiento a las Reglas de Operación del Programa.\n• Utilizar los apoyos otorgados de manera adecuada y para los fines a los que se les otorgan y con que fueron autorizados evitando cualquier uso distinto de la misma. Los cuales en ningún caso podrán emplearse para propósitos de proselitismo político, religioso o comercial, ni para ningún otro fin distinto al establecido en las Reglas de operación del programa social.\n• Permitir visita de verificación con la finalidad de validar la información proporcionada en sus expedientes correspondientes.\n• Facilitar los trabajos de supervisión, en cualquier momento después de haber recibido el apoyo\nLos beneficiarios del proyecto de Molinos de Mano para Nixtamal y Prensas para hacer Tortillas que incumplan en la Disposiciones Normativas de estas Reglas de Operación, perderán las prerrogativas que dichas disposiciones establezcan se les retirara el apoyo.\n6.5. MODOS DE ENTREGA DEL BENEFICIO\nLos apoyos serán distribuidos directamente a los beneficiarios en puntos sedes en cada Región del Estado, o en su caso, podrán acudir a recoger el apoyo a las oficinas de la Dirección de Asistencia Alimentaria y\nDesarrollo Comunitario\n7. PROCEDIMIENTOS DE INSTRUMENTACIÓN\n7.1. OPERACIÓN\nEl Sistema Estatal DIF tendrá las siguientes responsabilidades: a. Gestionar ante las instancias de Gobierno Federales y Estatales, los recursos financieros, para llevar a cabo la adquisición de los materiales, insumos y productos necesarios en la operatividad de los programas. b. Dar a conocer al Sistema Municipal DIF, los Lineamientos del programa de Molinos de Mano para c. Proporcionar al Sistema Municipal DIF, de forma calendarizada los suministros de productos de los\nProgramas. d. Vigilar y verificar que los proyectos sean otorgados directamente a los beneficiarios. e. Proporcionará almacenes regionales, para guarda y custodia de los productos que integra el programa; que contaran con personal capacitado para su manejo y distribución.\nTORTILLAS PARA EL EJERCICIO FISCAL 2019 f. Actualizar y profesionalizar los conocimientos del personal operativo del Sistema Estatal DIF y del\nSistema Municipal DIF, a través de capacitaciones a fin de contar con las herramientas básicas para la operatividad de los programas. g. Recepcionar de los Sistema Municipal DIF la información requerida para comprobación de los programas con base a las Reglas de Operación vigentes. h. Procesará la información a que se refiere el punto anterior y remitirla de acuerdo al calendario de entregas, a fin de comprobar los recursos canalizados al municipio. i. Elaborar a inicio de cada ejercicio fiscal, el Proyecto de los Programas y documentos que contemplarán la aplicación y operatividad de los proyectos con los importes correspondientes. j. Proporcionar cursos de capacitación al personal de Sistema Municipal DIF, relativos a la operatividad de los programas; así como asesoramiento en la elaboración propuesta de proyectos. k. Establecer los montos de las cuotas de recuperación de los Proyectos de Molinos de Mano para\nNixtamal y Prensas para hacer Tortillas a partir de criterios como la valoración realizada a través de estudios socioeconómicos arrojando el 20 % del costo real del producto.\nSerán obligaciones del Sistema Municipal DIF las siguientes: a. El Sistema Municipal DIF se obliga a cumplir con la implementación del Programa que se tienen establecidos en las reglas de operación que lo regula; salvo la pena de incurrir en responsabilidades administrativas. b. Determinará de manera conjunta la población potencial de su municipio tomando en consideración el tipo de beneficiario de todos los programas a solicitar, con esta información y en coordinación con el Sistema Estatal DIF, atenderá a la población que se encuentre en situación vulnerabilidad de localidades de alta y muy alta marginación. c. Integrará y enviará los expedientes así como los padrones físicos de los beneficiarios de los\nProgramas solicitados a la Subdirección de Desarrollo Comunitario, de igual forma informará a los beneficiarios que los datos personales recabados serán protegidos en términos de los principios de protección de datos personales contenidos en la ley de la materia y demás normativas aplicables. d. Integrará los padrones de los beneficiarios con sus respectivos expedientes del programa objeto de estas Reglas. Remitiendo al Sistema Estatal DIF el padrón físico, digital y expedientes correspondiente comprobación de los programas. e. Designar personal del Sistema Municipal DIF que realice las funciones de seguimiento y supervisión de los Programas. f. Participar en acciones de apoyo logístico para la distribución de los programas. g. Es competencia del Sistema Municipal DIF, trasladar los materiales que corresponden a los programas, a las comunidades beneficiadas, en una unidad vehicular. Será responsabilidad del municipio el resguardo y el buen uso de los materiales que se recepcionen, en el entendido que, de existir algún desvío de los mismos, el Sistema Estatal DIF cancelará inmediatamente el suministro del programa e iniciará un procedimiento ante la contraloría interna del sistema estatal, para determinar las sanciones a que sean acreedores.\nPara garantizar la atención completa del beneficiario, se realizan las acciones:\nTORTILLAS PARA EL EJERCICIO FISCAL 2019\n• Determinar el tipo de programas a implementar\n• Adquisición de los materiales y que cumplan con las Especificaciones Técnicas de Calidad.\n• Asegurar el correcto almacenamiento y distribución de los materiales, hasta su entrega al beneficiario.\n• Focalizar los beneficiarios del Programa con base a los indicadores socioeconómicos.\n• Coordinar la entrega de apoyos a la población beneficiada con los Sistemas Municipales DIF, a través de convenios de colaboración y conforme a lo establecido en las Reglas de Operación.\n• Promover la participación social a través de los Sistema Municipal DIF en la formación de comités entre la población beneficiaria, para la recepción, entrega y vigilancia de los apoyos.\n• Promover la formación y operación de grupos de contraloría social para el seguimiento del programa.\n• Fortalecer la operación del programa promoviendo la inclusión general de la sociedad.\nLos datos de los beneficiarios, así como la información generada y administrada se regirán por la Ley\nNúmero 207 de Transparencia y Acceso a la Información Pública del Estado de Guerrero.\nEl presente programa de Molinos de Mano para Nixtamal y Prensas para hacer Tortillas, contempla las herramientas necesarias para desempeñar una actividad y mejorar la salud de la familia mediante el otorgamiento de:\n✓ 1 juego de molino para moler Granos en color rojo, en fierro vaciado y tortillera manual de 20 cm\nComo objetivo a corto plazo, se dará continuidad a la entrega de cada apoyo solicitado, cubriendo cada uno los requisitos solicitados, mismo que será otorgado en su municipio de residencia o en su caso en el almacén general del Sistema Estatal a la población vulnerable.\n7.2. GASTOS DE OPERACIÓN\nEl presupuesto asignado a este programa, a través del Fondo de Aportaciones Múltiples, no contempla\nGastos de Operación.\n8. TRANSPARENCIA\n8.1. DIFUSIÓN\nLa instancia responsable es la Dirección de Asistencia Alimentaria y Desarrollo Comunitario, quien difundirá a través de diferentes medios de comunicación; trípticos, periódico, redes sociales en las cuales se dará a y Prensas para Hacer Tortillas. de las autoridades locales; la información del proyecto se dará a conocer en la página de internet del\nTORTILLAS PARA EL EJERCICIO FISCAL 2019 beneficiario; Las copias de los expedientes de los beneficiarios y / o beneficiarias estarán disponibles oportunamente para su consulta en las oficinas del Sistema ubicadas en Av. Rene Juárez Cisneros, Colonia\nCiudad de los Servicios y ubicada Av. Gabriel Leyva s/n esq. Ruffo Figueroa, Col. Burócratas, C.P. 39090, Chilpancingo, Guerrero; por otra parte, la papelería, documentación oficial, así como la publicidad y promoción de los Programas, deberán incluir la leyenda descrita en el apartado de \"Blindaje Electoral\".\nLa información de montos y beneficiarios deberá ser publicada en los términos de la Ley No. 207 de\nTransparencia y Acceso a la Información Pública del Estado de Guerrero.\nUna vez autorizadas estas Reglas de Operación, por las instancias correspondientes, estarán disponibles para su consulta en las Oficinas de la Dirección de Asistencia Alimentaria y Desarrollo Comunitario, y el responsable directo de la ejecución será la Dirección de Asistencia Alimentaria y Desarrollo Comunitario, a través de la Subdirección de Desarrollo Comunitario, ubicada Av. Gabriel Leyva s/n esq. Ruffo Figueroa, Col. Burócratas, C.P. 39090, Chilpancingo, Guerrero., a los teléfonos (01747) 47 2 55 95, (01747) 47 2 56\n00, (01747) 47 2 56 72 ext. 1155. Así mismo al correo electrónico: subdescomdif@prodigy.net.mx\nAsí como en los medios electrónicos oficiales http://www.dif.guerrero.gob.mx información pública de oficio, fracción III Marco Normativo específico. La información de montos y beneficiarios será publicada en los términos de la Ley No. 207 de Transparencia y Acceso a la Información Pública del Estado de Guerrero.\nEstas Reglas de Operación, además de su publicación en el Periódico Oficial del Gobierno del Estado, estarán disponibles para su consulta en las Oficinas de la Dirección de Asistencia Alimentaria y Desarrollo\nComunitario, así como en la página electrónica del Sistema para el Desarrollo Integral de la Familia http://www.dif.guerrero.gob.mx\n8.2. BLINDAJE ELECTORAL\nLa operación y ejecución de los recursos estatales destinados al Programa, deberán observar y atender las medidas que emita la Secretaría de Contraloría y Transparencia Gubernamental, para coadyuvar a que éstos, no sean utilizados con fines políticos, por lo que la papelería, documentación oficial, asi como la publicidad y promoción del Programa deberán incluir la siguiente leyenda:\n\"Este Programa es público, ajeno a cualquier partido político. Queda prohibido el uso para fines distintos a los establecidos en el programa\"\n8.3. SUPERVISIÓN Y CONTROL\nDirección de Planeación del DIF Guerrero, las acciones ejercidas y los resultados obtenidos, quien a su vez reportará a la Secretaria de Planeación y Desarrollo Regional (SEPLADER), Secretaria de Finanzas y\nAdministración (SEFINA) y a la Secretaría de Contraloría y Transparencia Gubernamental trimestralmente,\nTORTILLAS PARA EL EJERCICIO FISCAL 2019\n(CONAC), dichos informes se deberán presentar a más tardar a los quince días hábiles posteriores a la terminación de cada trimestre.\nLos padrones de los beneficiarios serán requisitados por los Sistemas Municipales DIF, remitiendo para su los Padrones de Beneficiarios de los 81 municipios de la Entidad mismo que serán remitidos a las instancias o dependencias operadoras.\n8.4. MECANISMOS DE EVALUACIÓN E INDICADORES\n8.4.1. EVALUACIÓN\nEl instrumento de medición de evaluación del Proyecto se realizará mediante indicadores de desempeño los cuales serán reportados a la Dirección de Planeación para la integración de los informes correspondientes.\n8.4.2. INDICADORES\nMatriz de Indicadores de Resultados\nDetalle de la Matriz 2019\nRamo: 5 - Sector Paraestatal\nUnidad Responsable: P-46 -O.P.D. Sistema para el Desarrollo Integral de la Familia\nS- Sujetos a Reglas de Operación\nClave y Modalidad del Pp:\nE- Prestación de Servicios Públicos\nDenominación del Pp: S01\nE01\nClasificación Funcional:\nFinalidad: 2. Desarrollo Social\nFunción: 2.3. SALUD\n2.4. RECREACIÓN, CULTURA Y OTRAS MANIFESTACIONES SOCIALES\n2.6. PROTECCIÓN SOCIAL\nSubfunción: 2.3.2. Prestación de Servicios de Salud 2.6.5 Alimentación y Nutrición a la Persona 2.6.6 Apoyo Social para la Vivienda\n2.4.2. Cultura 2.6.7 Indígenas\n2.6.1. Enfermedad e Incapacidad 2.6.8 Otros Grupos Vulnerables\n2.6.2. Edad Avanzada 2.6.9 Otros de Seguridad Social y\n2.6.3. Familia e Hijos Asistencia Social\n2.6.4. Desempleo\nResumen narrativo Orden Supuestos\nTORTILLAS PARA EL EJERCICIO FISCAL 2019\nAsistencia Social sociales\nFrecuencia Línea\nUnidad de Tipo de Meta Medios de\nIndicador Método de Cálculo de Base\nMedida Indicador 2018 Verificación\nMedición 2017\n(Población\nPorcentaje de atendida/Total de Padrón de población Personas Anual Estratégico 70% 90% población beneficiarios vulnerable atendida vulnerable)*100\nPropósito\nResumen narrativo Orden Supuestos\nFortalecer las acciones de desarrollo Las obras y/o acciones\nAmpliación de cobertura poblacional social y Humano contribuyen a mejorar la de los programas sociales calidad de vida\nFrecuencia Línea\nUnidad de Tipo de Meta Medios de\nIndicador Método de Cálculo de Base\nMedida Indicador 2018 Verificación\nMedición 2017\n(Programas\nPorcentaje de implementados en\nOficios de\nProgramas 2017 / Programas Programas Anual Estratégico 70% 90% autorización implementados implementados en\n2018)* 100\nComponente\nResumen narrativo Orden Supuestos\nFortalecer el nivel nutricional de la Contribuir a mejorar la dieta de población con mayor índice de las niñas y niños de nivel marginación, poniendo énfasis en los primaria y prescolar, así como\nAsistencia Social grupos de alto riesgo, a fin de mejorar la implementar Proyectos calidad en la dieta y apoyar el gasto Productivos, de Economía y familiar. Traspatio\nFrecuencia Línea\nUnidad de Tipo de Meta Medios de\nIndicador Método de Cálculo de Base\nMedida Indicador 2018 Verificación\nMedición 2017\n(Número de despensasdotaciones\nProporción de distribuidas en el despensasperiodo de acuerdo a dotaciones los criterios de Avance Físicoentregadas que Porcentaje Trimestral Estratégico 0% 100% calidad nutricia de los Financiero cumplen con los\nLineamientos de la criterios de calidad\nEIASA / Número total nutricia de apoyos entregados en el periodo) * 100\nTORTILLAS PARA EL EJERCICIO FISCAL 2019\nPorcentaje de\n(Total de apoyos apoyos de otorgados / total de Avance FísicoDesarrollo Porcentaje Semestral Estratégico 0% 100% apoyos programados) Financiero\nComunitario\n* 100 otorgados\nResumen narrativo Orden Supuestos\nElevar la calidad de vida de las familias y comunidades marginadas, a través de su Beneficiar a los grupos participación activa en programas de Descendente vulnerables para su desarrollo asistencia social y apoyo jurídico, que les físico y mental permita alcanzar su desarrollo integral\nFrecuencia Línea\nUnidad de Tipo de Meta Medios de\nIndicador Método de Cálculo de Base\nMedida Indicador 2018 Verificación\nMedición 2017\n(Total de apoyos\nPorcentaje de otorgados / total de Avance Físicoapoyos Sociales Porcentaje Semestral Estratégico 0% 100% apoyos programados) Financiero otorgados\n* 100\nResumen narrativo Orden Supuestos\nAtender y apoyar a las personas con Los servicios otorgados discapacidad, mediante servicios contribuyen a la rehabilitación\nDescendente asistenciales y de rehabilitación, para de las personas con lograr su incorporación al entorno social discapacidad\nFrecuencia Línea\nUnidad de Tipo de Meta Medios de\nIndicador Método de Cálculo de Base\nMedida Indicador 2018 Verificación\nMedición 2017\n(Total de servicios\nPorcentaje de otorgados / total de Avance FísicoPorcentaje Semestral Estratégico 0% 100%\nServicios otorgados servicios Financiero programados) * 100\nResumen narrativo Orden Supuestos\nAdministración interna y servicios Se recibe en tiempo las generales del DIF Ascendente comprobaciones por parte de los ejecutores del Gasto.\nFrecuencia Línea\nUnidad de Tipo de Meta Medios de\nIndicador Método de Cálculo de Base\nMedida Indicador 2018 Verificación\nMedición 2017\n(Número de\nPorcentaje de comprobaciones comprobaciones entregadas en Avance FísicoPorcentaje Semestral Estratégico 0% 100% entregadas a tiempo/Total de Financiero tiempo. comprobaciones realizadas)*100\nTORTILLAS PARA EL EJERCICIO FISCAL 2019\nActividades\nResumen narrativo Orden Supuestos\nDeterminar el nivel de atención\nAsistencia Social emergencia afectada por Desastres vulnerables para su desarrollo\nNaturales. físico y mental\nFrecuencia Línea\nUnidad de Tipo de Meta Medios de\nIndicador Método de Cálculo de Base\nMedida Indicador 2018 Verificación\nMedición 2017\nAtención\nAlimentaria en Mpios.\nEn Emergencia =\nMpios. con\nDeclaracion de\nAcceso Alimentario Avance Físicoemergencia Personas Anual Estratégico 100 100% en Riesgo Financiero atendidos / Total de\nMpios. con\nDeclaratoria de emergencia en la\nEntidad.\nResumen narrativo Orden Supuestos\nDeterminar el porcentaje de desnutrición Los menores beneficiados, en los menores beneficiados con insumos Descendente disponen de una alimentación alimentarios. con calidad nutricia\nFrecuencia Línea\nUnidad de Tipo de Meta Medios de\nIndicador Método de Cálculo de Base\nMedida Indicador 2018 Verificación\nMedición 2017\n(Menores beneficiados que tienen algún grado de\nDesnutrición / Total Avance FísicoDesnutrición Infantil Menores Anual Estratégico 22% 20% de Menores Financiero beneficiados con insumos alimentarios) * 100\nResumen narrativo Orden Supuestos\nDeterminar el porcentaje de obesidad en\nDisminuyen los índices de obesidad infantil alimentarios.\nFrecuencia Línea\nUnidad de Tipo de Meta Medios de\nIndicador Método de Cálculo de Base\nMedida Indicador 2018 Verificación\nMedición 2017\nTORTILLAS PARA EL EJERCICIO FISCAL 2019\nPorcentaje de\nObesidad en\nMenores = Menores\nBeneficiados que\nAvance FísicoObesidad Infantil tienen algún grado de Menores Anual Estratégico 15% 11%\nFinanciero\nObesidad / Total de\nMenores\nBeneficiados con insumos Alimenticios\nResumen narrativo Orden Supuestos\nDeterminar el porcentaje de atención de los menores en la distribución de insumos Ascendente alimentarios.\nFrecuencia Línea\nUnidad de Tipo de Meta Medios de\nIndicador Método de Cálculo de Base\nMedida Indicador 2018 Verificación\nMedición 2017\nPorcentaje de\nObesidad en\nMenores = Menores\nAcceso Alimentario Beneficiados que\nAvance Físicoen Menores no tienen algún grado de Menores Anual Estratégico 100% 100%\nFinanciero\nEscolarizados Obesidad / Total de\nMenores\nBeneficiados con insumos Alimenticios\nResumen narrativo Orden Supuestos\nPermite determinar el nivel de atención a municipios con alto índice de carencia La población vulnerable, alimentaria, a fin de propiciar el Descendente dispone de una alimentación mejoramiento alimentario de los grupos con calidad nutricia con mayor vulnerabilidad en la entidad.\nFrecuencia Línea\nUnidad de Tipo de Meta Medios de\nIndicador Método de Cálculo de Base\nMedida Indicador 2018 Verificación\nMedición 2017\nMpios con Alto Indice de Carencia\nAlimentaria No\nAcceso a la Avance FísicoAtendidos = Mpios. Municipio Anual Estratégico 0 100%\nAlimentación Financiero con A.I.C.A. no atendidos / Total de\nMpios. en la Entidad.\nResumen narrativo Orden Supuestos\nTORTILLAS PARA EL EJERCICIO FISCAL 2019\nLa población beneficiada recibe\nAscendente beneficiadas con los Proyectos economía, alimentación y de\nProductivos de Economía y Traspatio sus familias\nFrecuencia Línea\nUnidad de Tipo de Meta Medios de\nIndicador Método de Cálculo de Base\nMedida Indicador 2018 Verificación\nMedición 2017\nÍndice de avance (beneficiarios en la entrega de atendidos / Avance FísicoPersonas Anual Estratégico 80% 100%\nProyectos Beneficiarios Financiero\nProductivos programados) * 100\nResumen narrativo Orden Supuestos\nPoblación que requiere algún tipo de\nLa población vulnerable tiene servicio médico y que carece de servicio Ascendente acceso a los servicios de salud medico\nFrecuencia Línea\nUnidad de Tipo de Meta Medios de\nIndicador Método de Cálculo de Base\nMedida Indicador 2018 Verificación\nMedición 2017\nPoblación sin acceso\nPoblación sin a los servicios de acceso a los Avance Físicosalud = Población Personas Anual Estratégico 80% 100% servicios de salud Financiero atendida / Población\n(PSASS) programada\nResumen narrativo Orden Supuestos\nConocer los apoyos entregados en la\nSe entregan todos los apoyos a temporada invernal (Suéteres y Ascendente la población vulnerable\nCobertores)\nFrecuencia Línea\nUnidad de Tipo de Meta Medios de\nIndicador Método de Cálculo de Base\nMedida Indicador 2018 Verificación\nMedición 2017\nEntrega de Apoyos =\nApoyos entregados\nTotal de Apoyos Padrón de en la temporada Apoyos Anual Estratégico 0% 100%\nAtendidos / Total de Beneficiarios invernal\nApoyos Programados\nResumen narrativo Orden Supuestos\nLos apoyos entregados, Económicos y en Especie necesidades de la sociedad.\nFrecuencia Línea\nUnidad de Tipo de Meta Medios de\nIndicador Método de Cálculo de Base\nMedida Indicador 2018 Verificación\nMedición 2017\nTORTILLAS PARA EL EJERCICIO FISCAL 2019\n(Total de apoyos\nPorcentaje de otorgados / total de Avance Físicoapoyos Sociales Porcentaje Semestral Estratégico 0% 100% apoyos programados) Financiero otorgados\n* 100\n8.5. AUDITORIA\nEl ejercicio del recurso y la operatividad del Programa, están sujetos a las disposiciones estatales aplicables y podrá ser auditado por la Secretaría de Contraloría y Transparencia Gubernamental, así como la Auditoría\nSuperior del Estado y Auditoria Superior de la Federación, conforme a la legislación vigente y en el ámbito de sus respectivas competencias.\nEl Sistema DIF Guerrero dará todas las facilidades a dichas instancias para realizar, en el momento en que lo juzguen pertinente, las auditorías que consideren necesarias; así como el seguimiento y la solventación a las observaciones planteadas por los órganos de control.\n8.6. RECURSOS NO DEVENGADOS\nEl DIF Guerrero deberá reintegrar a la Dirección General de Tesorería de la Secretaría de Finanzas y\nAdministración del Gobierno del Estado los recursos que no se hubiesen destinado a los fines autorizados y aquellos que por cualquier motivo no estuviesen devengados al 31 de diciembre del Ejercicio fiscal correspondiente.\n8.7. CONTRALORÍA SOCIAL\nCon la finalidad de incrementar la participación ciudadana, se crearán Comités de Contraloría Social, como un órgano ciudadano de control, vigilancia y evaluación de las actividades del Programa, conformados por los beneficiarios (as), los sectores sociales, y los representantes de la localidad, quienes de manera específica supervisarán la gestión gubernamental, y que los manejos de los recursos públicos se realicen en términos de transparencia, eficacia, legalidad y honradez.\nLos objetivos específicos de este Órgano de Contraloría Social son:\n• Hacer más transparentes las decisiones y la ejecución de los recursos.\n• Incrementar la participación ciudadana.\n• Fomentar la organización social.\n• Inhibir los actos de corrupción y de cooptación social, política y electoral.\n• Incrementar la eficiencia de los recursos públicos.\n• Fortalecer la cultura de la legalidad.\n• Mejorar la rendición de cuentas.\n• Perfeccionar la democracia e incorporar la evaluación ciudadana.\nTORTILLAS PARA EL EJERCICIO FISCAL 2019\nIntegración: Los Comités de Contraloría Social se conforman con la representación de la comunidad beneficiada por el Programa, y fungirán como interlocutores con el DIF Guerrero, en el ejercicio de la contraloría social.\nEl vocal del Comité de Contraloría Social será, el responsable de hacer llegar las quejas o denuncias recibidas al DIF Guerrero, quien dará respuesta en un plazo no mayor de 15 días a partir de la fecha de recepción de la queja o denuncia.\nCapacitación y asesoría: Para impulsar la realización de las actividades de Contraloría Social se brindará capacitación y asesoría, a los servidores y servidoras públicas que intervienen en la operación del\nPrograma, así como a los integrantes de los Comités Locales, para que estos realicen adecuadamente sus actividades de seguimiento y vigilancia.\nSeguimiento: Se deberá integrar un Programa de Trabajo a través del cual se debe incluir la descripción de las actividades, responsables, metas y calendarización de las actividades para su cumplimiento.\nEl personal que designe el DIF Guerrero, serán los encargados de conformar los Comités de Contraloría\nSocial, asimismo darán acompañamiento durante las actividades de control, seguimiento y vigilancia de los proyectos.\nEl Comité de Contraloría Social debe estar constituido por un Presidente, un Secretario y un Vocal mínimamente, electos de entre la población beneficiada en donde se va a realizar la entrega del programa, y tendrá que ser vigilado por un solo Comité, el cual deberá controlar, vigilar y dar seguimiento al programa a través de los formatos que integran el expediente comunitario, integrado por:\n1. Acta de Conformación del Comité de Contraloría Social.\n2. Reunión con beneficiarios y beneficiaras.\n3. Ficha Informativa del Programa.\n4. Cédula de Vigilancia del Programa.\n5. Actividades de Difusión y Capacitación.\n6. Quejas, Denuncias o Reconocimientos.\n7. Informe Anual.\n8.8. FORMAS DE PARTICIPACIÓN SOCIAL\nGuerrero, se establece que la sociedad podrá participar activamente en la Planeación, Programación, Implementación y Evaluación de los Programas Sociales de Desarrollo Social, por ello los beneficiarios y beneficiarias participaran en la etapa de la implementación y podrán supervisar la gestión gubernamental, que el manejo de los recursos públicos se realicen en términos de transparencia, eficacia, legalidad y honradez del Programa de acuerdo en lo estipulado en estas Reglas de Operación.\nTORTILLAS PARA EL EJERCICIO FISCAL 2019\nEtapa en la que participa\nBeneficiarios/\nImplementación Comités de Contraloría Seguimiento\nBeneficiarias\n8.9. PROCEDIMIENTO DE QUEJA O INCONFORMIDAD CIUDADANA\nLos beneficiarios (as) pueden presentar quejas y denuncias ante las instancias correspondientes sobre cualquier hecho, acto u omisión que produzca o pueda producir daños al ejercicio de sus derechos establecidos en las presentes reglas o contravengan sus disposiciones y de la demás normatividad aplicable. a. En el Sistema DIF Guerrero\nCorreo electrónico: buzon.dif@guerrero.gob.mx\nDomicilio: Centro de Rehabilitación Integral Guerrero.\nBoulevard Lic. René Juárez Cisneros S/N, Col. Ciudad de los Servicios. Chilpancingo, Guerrero. C.P.\n39095. b. En la Secretaría de Contraloría y Transparencia Gubernamental.\nTeléfonos: (474) 47 1 97 41\nCorreo electrónico: contraloria@guerrero.gob.mx\nDomicilio: Palacio de Gobierno Primer Piso Edificio Norte, Blvd. R. Juárez Cisneros 62 Col. Ciudad de los\nServicios. Chilpancingo, Guerrero. C.P. 39075.\nLas quejas y denuncias de la ciudadanía derivadas de alguna irregularidad en la operación del Programa, podrán presentarse por escrito, por comparecencia del beneficiario (a), por correo electrónico o vía telefónica y deberá proporcionar los siguientes datos:\n• Nombre del servidor público.\n• Área de adscripción.\n• Objeto de la denuncia.\n• Nombre y domicilio del quejoso.\n• Identificación oficial.\n8.10. MECANISMOS DE EXIGIBILIDAD pueden ocurrir en al menos los siguientes casos:\nTORTILLAS PARA EL EJERCICIO FISCAL 2019\n• Cuando una persona solicitante cumpla con los requisitos y criterios de inclusión para acceder a determinado derecho.\n• Cuando la persona solicitante exija que se cumpla con dicho derecho de manera integral en tiempo y forma.\n• Cuando no se pueda satisfacer toda la demanda de incorporación al programa por restricción presupuestal.\nSerá la Secretaria de Contraloria y Transparencia Gubernamental del Gobierno del Estado quién atenderá las denuncias de violación e incumplimiento de derechos en materia de Desarrollo Social.\n8.11. ACTA DE ENTREGA - RECEPCIÓN\nLa instancia ejecutora conformará y resguardará el expediente de los beneficiarios incluyendo su acta de donación correspondiente de cada uno, dada la naturaleza del apoyo otorgado, se realiza en apego al control del gasto público.\n9. CRITERIOS DE SELECCIÓN Y ELEGIBILIDAD\n9.1. MÉTODO DE SELECCIÓN DE BENEFICIARIOS (AS)\nSerán beneficiados con el Proyecto, los solicitantes que cumplan con las siguientes características:\n• Familias en estado de vulnerabilidad.\n• Habitar preferentemente en Municipios o Localidades de alto o muy alto grado de marginación.\n10. MECÁNICA DE OPERACIÓN\n10.1. INSTANCIA EJECUTORA\nAsistencia Alimentaria y Desarrollo Comunitario, quien deberá operar con apego a la programación, presupuestación, calendario de ejecución, ejercicio y control del gasto público.\n10.2. INSTANCIA ADMINISTRATIVA Y/O NORMATIVAS\nGubernamental y la Auditoría Superior del Estado en el ámbito de sus respectivas competencias, quienes darán seguimiento a los objetivos y metas del Programa.\nTORTILLAS PARA EL EJERCICIO FISCAL 2019\n10.3. DELIMITACIÓN DE ATRIBUCIONES programas y acciones no se contrapongan, afecten o presenten duplicidades con otros programas o acciones del gobierno estatal; la coordinación institucional y vinculación de acciones busca potenciar el impacto de los recursos, fortalecer la cobertura de las acciones, detonar la complementariedad y reducir gastos administrativos.\n11. DERECHOS, OBLIGACIONES Y SANCIONES DE LOS BENEFICIARIOS DE PROGRAMAS\nSOCIALES.\n11.1. DERECHOS\n• Recibir trato digno, respetuoso y equitativo sin discriminación alguna, por el personal de las distintas áreas que participen dentro del programa.\n• Reserva y privacidad de la información personal.\n• Acceder a la información necesaria del programa, sus Reglas de Operación, recursos y cobertura.\n• Solicitar y recibir información sobre el estado que guarda su trámite.\n• Recibir los servicios y prestación del programa conforme a las Reglas de Operación, salvo que le sea suspendido el apoyo por alguna razón justificable.\n11.2. OBLIGACIONES\n• Proporcionar la información socioeconómica bajo protesta de decir verdad que les sea requerida por el DIF Guerrero, en los términos que establezca la normatividad correspondiente.\n• Utilizar los apoyos para los fines con que fueron autorizados evitando cualquier uso distinto de la misma.\n• Facilitar los trabajos de verificación, en cualquier momento después de otorgado el apoyo.\n11.3. SANCIONES\nLos beneficiarios y las beneficiarlas del Proyecto que incumplan en la Disposiciones Normativas, establecidas en los numerales 6.2 y 6.3 para acceder a los beneficios que a través de estos se otorgan, perderán las prerrogativas que dichas disposiciones establecen.\n12. INTERPRETACIÓN\nLa interpretación de las presentes Reglas de Operación para efectos administrativos, estarán a cargo del\nDIF Guerrero, así como de la Secretaría de Contraloría y Transparencia Gubernamental, en el ámbito de sus respectivas competencias.\nTORTILLAS PARA EL EJERCICIO FISCAL 2019\nTRANSITORIOS\nPrimero: El presente acuerdo entrará en vigor al día siguiente de su publicación en el Periódico Oficial del\nSegundo: Las Reglas de Operación del Programa Molinos de Mano para Nixtamal y Prensas para Hacer\nTortillas, para el Ejercicio Fiscal 2019 se publican en su totalidad para mejor entendimiento.\nTercero: Quedan abrogadas las Reglas de Operación del Programa Molinos de Mano para Nixtamal y\nPrensas para Hacer Tortillas, publicadas en el periódico Oficial número 28, alcance VI del Gobierno del\nDado en la Oficina del Titular del Sistema para el Desarrollo Integral de la Familia, ubicada en las\nInstalaciones del Centro de Rehabilitación Guerrero, Boulevard René Juárez Cisneros S/N, Ciudad de los\nServicios, No. 62, Col. Recursos Hidráulicos, en la Ciudad de Chilpancingo de los Bravo, Capital del Estado de Guerrero, a los 25 días del mes de enero de dos mil diecinueve.\nESTADO DE GUERRERO.\nLic. José Francisco Solís Solís.\nRúbrica.\nTORTILLAS PARA EL EJERCICIO FISCAL 2019\nTORTILLAS PARA EL EJERCICIO FISCAL 2019\nTORTILLAS PARA EL EJERCICIO FISCAL 2019",
  "ordenamiento": "PROGRAMA",
  "jurisdiccion": "GUERRERO",
  "fuente_oficial": "DIARIO OFICIAL DE LA FEDERACION",
  "Fecha de Publicación": "05 \nde julio de 2019",
  "ULTIMA REFORMA PUBLICADA": null,
  "status": "VIGENTE",
  "es_escaneado": false,
  "tiene_tablas": true,
  "materia": [
    "general"
  ]
}