{
  "titulo": "Acuerdo por el Que Se Crea el Programa Extensionismo, Desarrollo de Capacidades y Asociatividad Prod",
  "Contenido": "REGLAS DE OPERACIÓN PARA EL EJERCICIO FISCAL\nTEXTO ORIGINAL. de junio 2022.\nACUERDO POR EL QUE SE CREA EL PROGRAMA EXTENSIONISMO, DESARROLLO DE\nCAPACIDADES Y ASOCIATIVIDAD PRODUCTIVA Y SE EMITEN SUS REGLAS DE OPERACIÓN\nPARA EL EJERCICIO FISCAL 2022.\nGuerrero. -Poder Ejecutivo.\nMAESTRA EVELYN CECIA SALGADO PINEDA, GOBERNADORA CONSTITUCIONAL DEL\nESTADO DE GUERRERO, CON FUNDAMENTO EN LO DISPUESTO POR LOS ARTÍCULOS 71, 87, 88,\nCONFIEREN LOS ARTÍCULOS 2, 3, 6, 7, 10, 11,18 APARTADO A FRACCIONES I Y XII, 20 FRACCIÓN\nIII Y 31DE LA LEY ORGÁNICA DE LA ADMINISTRACIÓN PÚBLICA DEL ESTADO DE GUERRERO\nNÚMERO 08;1, 2 FRACCIÓN I, 18 Y 25DE LA LEY NÚMERO 454 DE PRESUPUESTO Y DISCIPLINA\nFISCAL DEL ESTADO DE GUERRERO; 18 FRACCIÓN I Y 106 DE LA LEY NÚMERO 814 DE\nDESARROLLO RURAL SUSTENTABLE DEL ESTADO DE GUERRERO;EN RELACIÓN CON LOS\nARTÍCULOS 30 FRACCIÓN IDE LALEY NÚMERO 535 DE ACUICULTURA Y PESCA SUSTENTABLES\nDEL ESTADO DE GUERRERO; 57 Y ANEXOS 21 (E12)Y 21-A (E12), DEL DECRETO NÚMERO 160\nDEL PRESUPUESTO DE EGRESOS DEL ESTADO DE GUERRERO PARA EL EJERCICIO FISCAL\n2022, Y LOS LINEAMIENTOS PARA LA ELABORACIÓN DE LAS REGLAS DE OPERACIÓN DE LOS\nPROGRAMAS SOCIALES ESTATALES PARA EL PERIODO 2022-2027.\nQue en el Plan Nacional de Desarrollo 2019-2024, publicado en el Diario Oficial de la Federación el 12 de julio de 2019, establece que su principal objetivo es lograr el Bienestar de la población.\nQue en el nuevo gobierno estatal, en base a los acuerdos de los Foros Regionales de construir un su capacidad productiva y su calidad de vida, en el cual se emprenderán programas especiales de asistencia social a grupos vulnerables, con el fin de brindar condiciones mínimas necesarias para el desarrollo humano.\nQue uno de los compromisos del ejecutivo del estado con la ciudadanía guerrerense, es lograr un\nGuerrero de equidad, transparencia, tranquilidad, de paz, de justicia, de crecimiento y de empleo, que permitan consolidar el crecimiento económico y estabilidad con los programas sociales.\nREGLAS DE OPERACIÓN PARA EL EJERCICIO FISCAL de Guerrero.\nQue el Programa Extensionismo, Desarrollo de Capacidades y Asociatividad Productiva, tiene como objetivo general, fomentar en la población rural, la producción de alimentos a través de la contratación de extensionistas para el medio rural, que brindarán servicios de capacitación y asistencia técnica implementando la Agricultura de Conservación, con el fin de que las y los agricultores adopten nuevas innovaciones, que les permita incrementar la producción reduciendo costos de inversión por los productos agroecológicos utilizados.\nQue la Secretaría de Agricultura, Ganadería, Pesca y Desarrollo Rurales el órgano encargado de promover y fomentar el Desarrollo Agrícola, Forestal, Ganadero y Pesquero, así como el manejo de los recursos naturales en el estado, procurando la participación de las mujeres, en igualdad de condiciones, la cual tendrá a su cargo la implementación, operación, ejecución, evaluación y administración del Programa\nExtensionismo, Desarrollo de Capacidades y Asociatividad Productiva.\nPor lo antes expuesto, he tenido a bien expedir el siguiente:\nACUERDO POR EL QUE SE CREA EL PROGRAMA EXTENSIONISMO, DESARROLLO DE\nCAPACIDADES Y ASOCIATIVIDAD PRODUCTIVA Y SE EMITEN SUS REGLAS DE OPERACIÓN\nPARA EL EJERCICIO FISCAL 2022.\nArtículo 1. Se crea el Programa Extensionismo, Desarrollo de Capacidades y Asociatividad\nProductiva, para el Ejercicio Fiscal 2022, el cual tiene por objeto otorgar servicios de capacitación y asistencia técnica con el fin de que las y los agricultores adopten nuevas innovaciones, mismo que permitirá incrementar la producción en reducir los costos de inversión.\nArtículo 2. La Secretaría de Agricultura, Ganadería, Pesca y Desarrollo Rural tendrá a su cargo la implementación, operación, ejecución, evaluación y administración del Programa Extensionismo, Desarrollo de Capacidades y de Asociatividad Productiva, bajo los criterios de objetividad, equidad, transparencia, publicidad, selectividad y temporalidad, con estricto apego a la normatividad aplicable, por plenamente a las reglas de operación.\nArtículo 3. Se emiten las Reglas de Operación del Programa Extensionismo, Desarrollo de\nCapacidades y Asociatividad Productiva para el Ejercicio Fiscal 2022, en las que se establece el procedimiento de ejecución del Programa, los principios, requisitos y condiciones que deben observarse para acceder al mismo, en los términos siguientes:\nREGLAS DE OPERACIÓN PARA EL EJERCICIO FISCAL\nASOCIATIVIDAD PRODUCTIVAPARA EL EJERCICIO FISCAL 2022.\n1 introducción.\n1.1 Antecedentes.\nEl Programa Extensionismo, Desarrollo de Capacidades y Asociatividad Productiva se inició en el año 2012, brindando a las y los agricultores beneficiados con el programa de fertilizante la asistencia técnica en su cultivo de maíz, tomando en cuenta el paquete de fertilizante subsidiado a los auténticos agricultores de maíz y preservando su semilla criolla, a partir del año 2015, se firmó un convenio de coordinación con el Centro Internacional de Mejoramiento del Maíz y Trigo. (CIMMYT) Para capacitar a las y los extensionistas contratados por esta Secretaría y a las y los propios agricultores, sin ningún costo, estableciendo parcelas de extensión y de impacto, para dar a conocer las innovaciones aplicadas para el incremento de su producción y que les permita reducir sus costos de inversión con los métodos de la agricultura de conservación, realizando muestreos de suelo regionales para que el agricultor conozca lo importante que es esta actividad, ya que año con año reciben el fertilizante que antes les daba el municipio, hoy el Gobierno Federal a través de la Secretaría del Bienestar continuará entregándolo gratuitamente sin conocer las condiciones edáficas de su suelo, pero desafortunadamente ya no se continuo con los análisis de suelo porque dejo de colaborar el CIMMYT en el año del 2019.\nEn el año 2019, el Gobierno Federal retira el Programa de Extensionismo, resintiendo el cambio los municipios y localidades que se estaban atendiendo por las innovaciones que dejaron de darle continuidad, como la utilización de Semilla Mejorada, Control Biológico, Fertilización Integral (química y orgánica) y Manejo de Pos-cosecha. Con estas innovaciones la o el agricultor logró incrementar su rendimiento a 8 t/ha. En promedio y con las y los agricultores que recibieron la asistencia técnica. Ya que el Programa se define como el proceso de intervención de carácter educativo y transformador cuyo objetivo es el desarrollo económico y social de las familias rurales, a través de servicios de asistencia técnica, intercambio de tecnología, desarrollo de capacidades e innovación. Ante esta importante tarea, los obstáculos y retos no son menores, por ejemplo: existe un desconocimiento social de las actividades vinculadas a los procesos de extensionismo rural, así como de sus principales actores, lo que impide su reconocimiento y consolidación como instrumento de política pública para promover el desarrollo rural sustentable.\nBajo este panorama, se ha hecho necesario replantear un nuevo modelo de extensionismo en\nMéxico, como uno de los elementos fundamentales para superar las condiciones de pobreza y marginación tal y como lo indica la cuarta trasformación y que padecen muchos de los habitantes del medio rural, así indispensables en sus localidades. gobernadora, establece como plan de acción, promover la diversificación de la economía y aprovechar las potencialidades que existen en nuestro estado. Para que Guerrero tenga un cambio cualitativo en su\nREGLAS DE OPERACIÓN PARA EL EJERCICIO FISCAL economía, en este sentido se definieron cinco proyectos estratégicos, dentro de los que se encuentra impulsar la producción agroindustrial, y como objetivo establece construir un sector agropecuario y pesquero productivo, que garantice la seguridad alimentaria en el estado.\nLa presente administración, emprende y fomenta acciones para dar viabilidad a un proyecto integral de desarrollo que mejore sustancialmente las condiciones de vida de las y los Guerrerenses, por eso es nuestro afán de apoyar a las y los pequeños agricultores de las unidades económicas rurales con servicios de extensión, innovación y capacitación para incrementar la producción agroalimentaria.\nEl Programa se origina derivado de la urgente necesidad de atender las demandas de las y los agricultores agropecuarios rurales acerca de obtener subsidios para la contratación de personas extensionistas que brinden servicios de capacitación y asistencia técnica.\n2. Alineación Programática al PED y/o PND.\nEn cumplimiento a las disposiciones jurídicas, el 12 de julio de 2019 se publicó en el Diario Oficial de la Federación el Plan Nacional de Desarrollo 2019-2024 (PND) el cual define principios, ejes y estrategias de la actual administración, así como los objetivos prioritarios que pretende alcanzar el\nGobierno de México.\nEl Gobierno de México está comprometido a impulsar el desarrollo sostenible, que en la época presente se ha evidenciado como un factor indispensable del bienestar. Se le define como la satisfacción de las necesidades de la generación presente sin comprometer la capacidad de las generaciones futuras para satisfacer sus propias necesidades. Esta fórmula resume insoslayables mandatos éticos, sociales, ambientales y económicos que deben ser aplicados en el presente para garantizar un futuro mínimamente habitable y armónico. El hacer caso omiso de este paradigma no sólo conduce a la gestación de desequilibrios de toda suerte en el corto plazo, sino que conlleva una severa violación a los derechos de quienes no han nacido.\nPor ello, el ejecutivo federal considera en toda circunstancia los impactos que tendrán sus políticas y programas en el tejido social, en la ecología y en los horizontes políticos y económicos del país. Además, se guiará por una idea de desarrollo que subsane las injusticias sociales e impulse el crecimiento económico sin provocar afectaciones a la convivencia pacífica, a los lazos de solidaridad, a la diversidad cultural ni al entorno. Y pesquero, para garantizar la seguridad alimentaria, y aprovechar las áreas de oportunidad en el sector agropecuario, pesquero y acuícola, para impulsar la producción y la comercialización de los productos y promover asesoría técnica.\nGuerrero, participa en concordancia con las directrices definidas en el PND 2019-2024 para lograr el bienestar general de la población, así como con los mandatos constitucionales y legales para el desarrollo rural y el fomento agropecuario, la ejecución de este Programa contribuirá al incremento de la producción en el sector agropecuario y pesquero.\nREGLAS DE OPERACIÓN PARA EL EJERCICIO FISCAL\n2.1. Diagnóstico.\nEn nuestro estado existen agricultoras y agricultores rurales de diversas escalas de productividad, rentabilidad y competitividad, los que podemos ubicar en tres grandes segmentos: Un primero segmento, con el 71.15%, consiste en agricultores de alto y muy alto grado de marginación, un segundo estrato, representa el 10.85%, que se ubica en un grado de marginación media, y un tercer segmento con el18% de agricultoras y agricultores que se ubican en un grado de marginación baja.\nLo anterior obliga a la SAGADEGRO, como cabeza del sector agropecuario, a diseñar políticas diferenciadas; acrecentar los apoyos al segmento de mayor grado de marginación, brindándole servicios de capacitación y asistencia técnica con el fin de seguir adoptando nuevas tecnologías en agricultura de conservación, que les permita incrementar su producción y reducir sus costos de inversión.\nEn este contexto, el Programa, financiado con recursos de Inversión Estatal Directa (IED) detalla acciones, conceptos de apoyo y procedimientos operativos para el otorgamiento de apoyos en subsidios para fomentar las actividades agropecuarias y de servicios en el medio rural.\n2.1.1. Población Potencial.\nSe considera el total de las y los agricultores que son 7,355 que requieran el beneficio del\nPrograma para innovar en sus actividades y lograr un mejoramiento en su economía familiar.\n2.1.2. Población Objetivo.\nLa población objetivo del Programa son las y los agricultores, de escasos ingresos que son 3,289 que corresponde al 40% de la población potencial.\n2.1.3. Población Beneficiaria.\nEs apoyar a 7,355 agricultoras y agricultores con servicios de extensionismo y acompañamiento técnico, para el mejor desarrollo de sus actividades agropecuarias, pesqueras y acuícolas.\n2.1.4 Población Indígena.\nLas regiones de la Montaña y parte de la Región Costa Chica, se apoya con el total de las y los agricultores de los distintos pueblos originarios que se encuentran en nuestro estado, con las innovaciones de la agricultura de conservación, que permitirá ayudar a cuidar el entorno ecológico y mejorar el nivel económico de la población.\n2.2. Fundamento Legal.\na) Constitución Política de los Estados Unidos Mexicanos.\nREGLAS DE OPERACIÓN PARA EL EJERCICIO FISCAL\nb) Plan Nacional de Desarrollo 2019-2024.\nc) Ley de Desarrollo Rural Sustentable.\ne) Ley Orgánica de la Administración Pública del Estado de Guerrero Número 08.\nf) Ley Número 454 de Presupuesto y Disciplina Fiscal del Estado de Guerrero.\ng) Ley Número 814 de Desarrollo Rural Sustentable del Estado de Guerrero.\ni) Ley de Administración de Recursos Materiales del Estado de Guerrero.\nj) Ley Número 207 de Transparencia y Acceso a la Información Pública del Estado de Guerrero.\nk) Decreto Número 160 del Presupuesto de Egresos del Estado de Guerrero para el Ejercicio\nFiscal 2022.\nl) Ley Número 535 de Acuicultura y Pesca Sustentables del Estado de Guerrero.\nm) Lineamientos para la Elaboración de las Reglas de Operación de los Programas Sociales\nEstatales para el periodo 2022-2027.\nn) Todos aquellos ordenamientos normativos que sean aplicables.\n2.3. Definiciones y Siglas.\nDefiniciones:\nAgricultores: Las personas agricultoras dedicadas al cultivo de maíz y otras cadenas.\nContraloría: La Secretaría de Contraloría y Transparencia Gubernamental del Estado de\nGuerrero.\nExtensionista: Persona que lleva el conocimiento agrícola a los productores y los exhortar a adoptar nuevas y mejores formas para trabajar en sus cultivos y ganados.\nPadrón Único de Personas Beneficiarias: El Listado de agricultoras y agricultores beneficiados.\nPrograma: El Programa Extensionismo, Desarrollo de Capacidades y Asociatividad Productiva.\nREGLAS DE OPERACIÓN PARA EL EJERCICIO FISCAL\nReglas de Operación: Son un conjunto de disposiciones que precisan la forma de operar un programa, con el propósito de transparentar y normar la distribución y entrega de los apoyos. Para este caso las Reglas de Operación del Programa Extensionismo, Desarrollo de Capacidades y Asociatividad\nProductiva.\nSiglas:\nASE: Auditoría Superior del Estado.\nSAGADEGRO: Secretaría de Agricultura, Ganadería, Pesca y Desarrollo Rural del Estado de\nGuerrero.\nSEFINA: Secretaría de Finanzas y Administración del Estado de Guerrero.\nSEPLADER: Secretaría de Planeación y Desarrollo Regional del Estado de Guerrero.\nTATA: Técnico de acompañamiento por la Transformación Agroecológica.\nCAT: Comunidad Agroecológica por la Transformación, conformada entre 25 a 35 agricultores.\nUPA: Unidad de Producción Acuícola.\n3. Objetivos y Alcances.\n3.1. Objetivos General.\nFomentar el desarrollo de las capacidades de las y los agricultores, sus organizaciones, las familias rurales, otros actores que realizan oficios, así como las instituciones especializadas en la capacitación e investigación en los sectores agropecuarios, acuícolas y pesqueros, facilitar el acceso al conocimiento, información y uso de tecnologías modernas; su interacción con sus socios estratégicos en investigación, educación, mercado y el desarrollo de sus propias habilidades y prácticas técnicas, organizacionales y gerenciales.\nLa población objetivo, es apoyar a 7,355 campesinas y campesinos y 313 UPA con servicios de\nExtensionismo, Desarrollo de Capacidades y Asociatividad Productiva, para el mejor desarrollo de sus actividades agropecuarias, acuícolas y de servicios.\n3.2. Objetivo Específico. las CAT, para fomentar el desarrollo de sus capacidades, para incrementar la producción agroalimentaria, con equidad de género, mediante técnicas agroecológicas.\nREGLAS DE OPERACIÓN PARA EL EJERCICIO FISCAL\n3.3. Cobertura.\nEl Programa se implementará en el estado de Guerrero, abarcando las siete regiones económicas siguientes:\n• Tierra Caliente;\n• Centro;\n• Norte;\n• Montaña;\n• Costa Grande;\n• Costa Chica, y\n• Acapulco.\n3.4. Alcances.\nCon la contratación de 51 extensionistas, que brindarán servicios de capacitación y asistencia técnica, con cobertura en todo el estado, para enseñarles la adopción de nuevas innovaciones a las y los agricultores, con la implementación del Programa se busca conjugar la tecnologías agroecológicas con los saberes milenarios de las y los campesinos y pueblos indígenas, para logar incrementar la producción de alimentos sanos, inocuos, libres de venenos con menor costo de inversión y en consecuencia, coadyuvar a la autosuficiencia alimentaria.\n4. Metas Físicas.\nBeneficiar a 7,355 agricultoras y agricultores de las CAT, con servicios de asistencia y acompañamiento técnico otorgados por los TATA, así como 3,131 UPA para incrementar sus capacidades y producir agroecológicamente.\n5. Programación Presupuestal.\nLa inversión por parte del Gobierno del estado, será financiada con recursos de Inversión Estatal\nDirecta (I.E.D)2022, autorizados en el Decreto Número 160 del Presupuesto de Egresos del Estado de\nGuerrero para el Ejercicio Fiscal 2022, con un monto total de presupuesto autorizado de $5,389,065.00\n(Cinco millones trescientos ochenta y nueve mil sesenta y cinco pesos 00/100 M.N.).\nCONCEPTO Feb Mar. Abril Mayo junio Julio Agos. Sep. Oct. total\nGastos de\n580,825 580,825 580,825 580,825 580,825 580,825 580,825 580,825 580,793 5,227,393.00\nInversión\nGastos de\n17,963 17,963 17,963 17,963 17,963 17,963 17,963 17,963 17,968 161,672.00\nOperación\nTOTAL 598,788 598,788 598,788 598,788 598,788 598,788 598,788 598,788 598,761 5,389,065\nREGLAS DE OPERACIÓN PARA EL EJERCICIO FISCAL\n5.1. Gastos de Operación.\nDel total de los recursos autorizados al Programa se considera el 3.0% para el concepto de Gastos beneficiada, con una inversión de $161,672.00 (Ciento sesenta y un mil seiscientos setenta y dos pesos\n00/100 M.N.) con recursos estatales provenientes del Programa de Inversión Estatal Directa (IED).\nLos gastos de operación, serán erogados conforme a las necesidades del Programa, en los siguientes rubros: equipamiento, mobiliario, remodelación y mantenimiento de inmuebles, de equipo de cómputo y de equipo de transporte, así como consumibles, herramientas, combustibles, insumos para servicio de cafetería, papelería, mantenimiento de vehículos, alimentación, hospedaje, peaje, pasajes, uniformes, capacitación a extensionistas y todo material análogo que mejore y transforme los espacios de trabajo y la imagen institucional, que beneficie la operación del Programa y/u optimice la calidad de los servicios que se presta a las y los beneficiarios para el cumplimiento de labores y/o comisiones que realice el personal propio de la estructura orgánica del gobierno del estado y el personal contratado por la\nSAGADEGRO, cuyo objetivo incluya operación, seguimiento, supervisión y control por sí solas o en su conjunto, participación en foros para fomento de las actividades del sector y capacitación entre otras.\nPor alimentación debe entenderse todas aquellas erogaciones que de manera extraordinaria realice el personal glosado en el párrafo anterior que mediante autorización de la persona titular de la\nSAGADEGRO realicen en cumplimiento de sus funciones a favor del Programa, incluyendo aquellas erogaciones que deriven de reuniones de trabajo institucionales, con agricultores, organizaciones sociales y/o representantes.\n6. Criterios y Requisitos de Elegibilidad.\nLos requisitos que deberán cumplir las y los solicitantes, grupos de agricultores y personas morales serán los especificados en el numeral 9.2 de las presentes Reglas de Operación para cada uno de ellos según sea el caso, además de pertenecer a la población objetivo del mismo.\n7. Tipo, Monto y Periodicidad del Apoyo.\nDirecta (I.E.D)2022, autorizados por el Decreto Número 160 del Presupuesto de Egresos del Estado para el Ejercicio Fiscal 2022.\nEl tipo de apoyo será económico, el monto a entregar será de $5,389,065.00 (Cinco millones trescientos ochenta y nueve mil sesenta y cinco pesos 00/100 M.N.) contratando a 51 extensionistas con un sueldo mensual que oscila de $16,000.00 (Dieciséis mil pesos 00/100 M.N) a $22 000 (Veintidós mil pesos 00/100 M.N.).\n7.1. Características de los Apoyos.\nREGLAS DE OPERACIÓN PARA EL EJERCICIO FISCAL\nEl apoyo consiste en otorgar a través de los TATA, la asistencia y acompañamiento técnico a diversos cultivos, con innovaciones agroecológicas y saberes milenarios para lograr incrementos en su producción y mejorar su economía familiar.\n7.2. Recursos no Devengados.\nEl presupuesto autorizado al Programas que no se hubiese aplicado a los fines autorizados, y los recursos que por cualquier motivo no estuviesen devengados al 31 de diciembre del ejercicio fiscal2022, serán reintegrados inmediatamente a la instancia normativa del ejercicio y control del gasto público a la\nSecretaría de Finanzas y Administración del estado de Guerrero.\n7.3. Resguardo de la Documentación.\nMantener los apoyos por un plazo mínimo de tres años con el fin de que estén disponibles para las supervisiones físicas y documentales desde el programa de trabajo y los productos generados por los que se hicieron acreedores al pago de salarios, por las instancias de control y fiscalización.\n7.4. Supervisión y Control.\na) Enviar trimestralmente a las Secretarías de Finanzas y Administración, de Planeación y\nDesarrollo Regional y la Contraloría, informes sobre el presupuesto ejercido establecido por el Consejo\nNacional de Armonización Contable (CONAC) y con base en los indicadores de resultados previstos en las\nReglas de Operación. Dichos informes se deberán presentar a más tardar a los quince días hábiles posteriores a la terminación de cada trimestre.\nb) Adicionar a los informes señalados en el inciso anterior, la evaluación de los indicadores determinados en el Programa. Dicha evaluación versará sobre los recursos entregados a las y los beneficiarios e incorporará un apartado específico sobre el impacto y resultados del Programa sobre el bienestar y la equidad de género.\nc) Con el objeto de verificar y validar la entrega de los apoyos a las y los beneficiarios del\nPrograma, las dependencias operadoras al inicio del ejercicio fiscal, deberán remitir a la SEPLADER el calendario de entrega de los apoyos, que incluya: lugar, fecha y hora de los eventos, así como la lista o padrón de las y los beneficiarios.\nb) Con el objeto de tener precisión del padrón de personas beneficiarias del Programa y con ello evitar duplicidad en el otorgamiento de los apoyos, se integrará un Padrón Único de Personas Beneficiarias, el cual será coordinado por la SEPLADER.\n8 criterios de Selección.\nREGLAS DE OPERACIÓN PARA EL EJERCICIO FISCAL\nLos requisitos que deberán cumplir las y los solicitantes, grupos de agricultores y personas morales, serán los especificados para cada uno de ellos en las convocatorias emitidas por la\nSAGADEGRO, además de pertenecer a la población objetivo del mismo.\n8.1. Casos Especiales.\nPara el caso del Programa, el único facultado para decidir sobre un cambio o modificación del desarrollo del Programa es la persona titular de la SAGADEGRO y por indicaciones de la persona titular del Poder Ejecutivo.\n8.2. Casos de Emergencia o Desastre.\nEn caso de existir una declaratoria de emergencia o desastre por algún siniestro climatológico, la\nSAGADEGRO, podrá adelantar la entrega de los apoyos a las y los beneficiarios tengan derecho, en este caso el seguro agrícola catastrófico.\n8.3. Suspensión o Cancelación del Programa Social.\nLa SAGADEGRO podrá suspender y/o cancelar la operación, del Programa, cuando no exista las condiciones sociales-económicas, cuando las personas beneficiarias no acaten las disposiciones de las\nReglas de Operación de los Programas Sociales y/o en caso de insuficiencia presupuestal para cumplir las metas.\n8.4. Integración del Padrón de Personas Beneficiarios.\nSerán susceptibles de apoyos las agricultoras y agricultores, de bajos ingresos del medio rural que se dediquen o quieran dedicarse a realizar actividades agrícolas, pesqueras y acuícolas.\nPara ser personas beneficiarias, deberán cumplir con presentar la documentación requerida por las presentes Reglas de Operación, según sea el caso de solicitar apoyo de manera individual, por grupo u organización. lo ya establecido en las Reglas de Operación del Programa en mención; así como no deberán de recibir ningún pago por los trámites que realicen las agricultoras y agricultores.\n9. Mecánica Operativa del Programa Social.\n9.1. Instancia Ejecutora y/o Responsable.\nLa SAGADEGRO, será la que ejercerá los recursos del Programa, tendrá la responsabilidad de verificar que la integración de los expedientes técnicos de los proyectos, reúnan los requisitos exigidos por\nREGLAS DE OPERACIÓN PARA EL EJERCICIO FISCAL la instancia normativa, tales como apego a la planeación estratégica, programación, presupuestación, calendario de ejecución, ejercicio y control del gasto público.\n9.2. Proceso de Incorporación al Programa Social.\nEl Programa, es para profesionales en: agronomía, agroecología, biología, ecología marina, acuacultura, misma que se da a conocer mediante convocatoria que se publica en la página de la\nSAGADEGRO. www.campoguerrero.gob.mx, además de manera física se les hace llegar a las Instituciones educativas que se relacionan con el sector agropecuario, delegaciones regionales y ayuntamientos. La cobertura del Programa, será estatal, atendiéndose a las y los agricultores agropecuarios, pesqueros y acuícolas de la entidad.\nSerán susceptibles de apoyos todas las agricultoras y/o agricultores, de bajos ingresos del medio rural que se dediquen o quieran dedicarse a realizar actividades agrícolas, pesqueras y acuícolas.\n10. Evaluación.\nEn caso de que se requiera la evaluación del Programa, la SAGADEGRO, podrá convenir con una institución académica, de Investigación o algún organismo especializado de carácter nacional, que cuente con reconocimiento y experiencia en la materia, a efecto de realizar una valoración objetiva para la toma oportuna de decisiones en los próximos ejercicios.\n10.1. Indicadores.\nFicha Técnica Indicadores del\nDesempeño\nEJE: El Plan Estatal de Desarrollo está en proceso de elaboración, por lo que no se puede indicar aún este concepto.\nOBJETIVO:\nESTRATEGIA: Pendiente, debido a que el Plan Estatal de Desarrollo está en proceso.\nLÍNEA DE ACCIÓN: Pendiente, debido a que el Plan Estatal de Desarrollo está en proceso.\nDatos de identificación del indicador\nClave Nombre Fuente\nDefinición Tipo Dimensión\nMétodo de cálculo Unidad de medida\nNo. Prod. Beneficiados con serv. De exten.)°/100 Agricultores\nAnual\nSentido del indicador Línea base\nAño Periodo Valor\nAscendente\nParámetros de semaforización Metas\nVerde Amarillo Rojo Año Periodo Valor\nREGLAS DE OPERACIÓN PARA EL EJERCICIO FISCAL\nVariables que conforman el indicador\nObservaciones\nResponsable del indicador\nNombre del servidor público Dependencia Área\nNombre del puesto, encargo o Teléfono Correo electrónico comisión\nElaboró Revisó Autorizó\nDirección General de Evaluación de Indicadores del Desempeño y de Gestión\n10.2. Seguimiento.\nLa evaluación y monitoreo del Programa requiere de la implementación de mecanismos internos que le permitan a la instancia ejecutora cuantificar los avances físicos y financieros del mismo, detectar las problemáticas con la que se enfrenta y hacer las sugerencias necesarias para la reorientación del gasto, con el propósito fundamental de que se alcancen las metas trazadas.\nPara llevar un mejor control del Programa, se enviarán trimestralmente a la Secretaría de\nFinanzas, a la Secretaría de Planeación y a la Secretaría de Contraloría, informes sobre el Presupuesto ejercido establecidos por el Consejo Nacional de Armonización Contable (CONAC) y con base en los indicadores de resultados previstos en las Reglas de Operación. Dichos informes se deberán presentar a más tardar a los quince días hábiles posteriores a la terminación de cada trimestre.\nAdicionar a los informes señalados en el inciso anterior, la evaluación de los indicadores determinados en cada Programa. Dicha evaluación versará sobre los recursos entregados a las y los bienestar y la equidad de género.\n10.3. Auditoría.\nLos recursos ejercidos en el Programa, podrán ser fiscalizados por el Órgano Interno de Control y demás instancias que en el ámbito de sus respectivas atribuciones resulte competente.\nComo resultado de las acciones de auditoría que se lleven a cabo, el Órgano Interno de Control mantendrá un seguimiento interno que permita emitir los informes de las revisiones practicadas, dando\nREGLAS DE OPERACIÓN PARA EL EJERCICIO FISCAL principal importancia a la atención en tiempo y forma de las irregularidades detectadas, hasta su total solventación.\n11. Mecanismo de Entrega de Apoyos.\nLos apoyos que las y los agricultores reciban por parte de las extensionistas consiste en darles asistencia y acompañamiento técnico, mediante un programa de trabajo definido por la SAGADEGRO, con la finalidad de eficientar los procesos productivos.\n12. Derechos y Obligaciones de las Personas Beneficiadas.\nDerechos.\nToda persona tiene derecho a participar y a beneficiarse del Programa, de acuerdo con los principios rectores de desarrollo social, así como a recibir un trato digno y respetuoso en los términos establecidos en la Constitución Política de los Estados Unidos Mexicanos.\nObligaciones.\na) Dar buen uso, conservación y/o mantenimiento de los bienes recibidos.\nb) Otorgar las facilidades y proporcionar la información necesaria a las instancias de coordinación, supervisión y control de los niveles de gobierno facultados para realizar visitas de inspección y monitoreo de los apoyos otorgados.\nc) Seguir las recomendaciones técnico-productivas emitidas por las instancias de gobierno.\nd) Mantener los apoyos por un plazo mínimo de tres años con el fin de que estén disponibles para las supervisiones físicas y documentales desde el programa de trabajo y los productos generados por los que se hicieron acreedores al pago de salarios, por las instancias de control y fiscalización.\n12.1. Causales de Suspensión o Baja de las Personas Beneficiadas.\nLas causales de baja de una persona agricultora beneficiada por el Programa, será cuando no manejo productivo, además de que el incumplimiento se refleje por su inasistencia a las actividades que se realicen en el campo y aula de capacitación.\n12.2. Proceso de Baja.\nLas y los beneficiarios del Programa, que incumplan con las obligaciones, y/o presenten documentos falsos, la instancia normativa, definirán la sanción a la que se hará acreedor.\nREGLAS DE OPERACIÓN PARA EL EJERCICIO FISCAL\n13. Instancias Participantes.\nLa SAGADEGRO, será la que ejercerá los recursos del Programa, también, tendrá la responsabilidad de verificar que la formulación de los expedientes técnicos de los proyectos, reúnan los requisitos exigidos por la instancia normativa, tales como apego a la planeación estratégica, programación, presupuestación, calendario de ejecución, ejercicio y control del gasto público.\n13.1. Instancia Normativa.\nLa Auditoría Superior del Estado y la Contraloría, vigilarán que la ejecución del Programa, sea con apego a la normatividad para asegurar el cumplimiento de los objetivos y metas trazados.\n14. Transparencia.\n14.1. Promoción y Difusión del Programa Social.\nLa SAGADEGRO, dará amplia difusión al Programa a nivel estatal publicará en su página de internet una convocatoria dirigida a la población objetivo inserta en las prioridades de atención definidas, para que presenten solicitudes de servicios de extensión y desarrollo de capacidades. En ella se especificará el tipo de servicios que pueden solicitarse, los requisitos de las y los extensionistas que otorgarán los servicios y las fechas de apertura y cierre de ventanillas.\nPara dar cumplimiento a lo establecido en la Ley Número 207 de Transparencia y Acceso a la\nInformación Pública del Estado de Guerrero, la información del Programa se dará a conocer a través de la página electrónica www.campoguerrero.gob.mx,de la SAGADEGRO.\nLos horarios de atención a las y los agricultores, será de lunes a viernes de 09:00 a 15:00 horas en las instalaciones de la SAGADEGRO, sito en Carretera Nacional México-Acapulco km 274.5, Colonia\nBurócratas, teléfono 01 747 47 1 92 10 y en las delegaciones regionales.\nLa cobertura del Extensionismo, Desarrollo de Capacidades y Asociatividad Productiva, será estatal, atendiéndose los agricultores agropecuarios, pesqueros y acuícolas de la entidad.\n14.2. Contraloría Social.\nSe establecerán acciones de control, vigilancia y evaluación, bajo un esquema de derechos y compromisos ciudadanos, con el propósito de contribuir a que la gestión gubernamental se realice en términos de transparencia, eficacia y honradez.\nEstas actividades estarán a cargo de las y los agricultores miembros de la comunidad, incluidos los integrantes del comité o instancia asociativa de las y los beneficiarios del Programa.\nREGLAS DE OPERACIÓN PARA EL EJERCICIO FISCAL para tal efecto, fomentando acciones que transparenten la operación del Programa en cuestión.\nLas acciones a fomentar serán las siguientes:\na) Informar a la ciudadanía acerca de los apoyos otorgados y su costo a nivel de obra, acción, nombre de las y los beneficiarios, derechos y obligaciones de los mismos.\nb) Capacitar a las y los beneficiarios para que se constituyan en instancias de vigilancia y evaluación social.\nc) Establecer espacios de comunicación (reuniones vecinales, atención directa a beneficiarias y beneficiarios, etc.).\nd) Promover la integración de organizaciones de la sociedad civil en acciones de contraloría social.\ne) Instrumentar mecanismos de recepción y atención de quejas y denuncias. El Órgano Interno de\nControl verificará, en lo correspondiente, la realización de dichas acciones.\n14.3. Protección de Datos Personales.\nLas personas beneficiadas por el Programa pasarán a formar parte del padrón único de personas beneficiarias siendo reservados sus datos personales de acuerdo a la Ley Número 207 de Transparencia y Acceso a la Información del Estado de Guerrero, los cuales en ningún caso podrán emplearse para propósitos de proselitismo político, religioso o comercial ni para ningún otro fin distinto a lo establecido en las presentes Reglas de Operación.\nLa SAGADEGRO elaborará expediente personal de cada extensionista que preste sus servicios corroborando que dicha información sea verídica y confiable; así mismo se lleva un registro por pago elaborado y validado por las autoridades de cada localidad. Los pagos de las y los extensionistas, deberán cumplir mensualmente con la entrega de productos que programaron, mismos que deberán de ser avalados por las y los beneficiarios y con visto bueno de las autoridades municipales o ejidales del lugar.\n14.4. Quejas y Denuncias.\nLa ASE y la SAGADEGRO, vigilarán que la ejecución del Programa sea con apego a la normatividad para asegurar el cumplimiento de los objetivos y metas trazados.\nA través de denuncias por escrito, vía internet, vía telefónica y por comparecencia de la persona\nLa persona denunciante o quejosa deberá proporcionar los datos siguientes:\nREGLAS DE OPERACIÓN PARA EL EJERCICIO FISCAL\na) Nombre de la servidora o servidor público.\nb) Dependencia de adscripción.\nc) Objeto de la denuncia.\nd) Nombre y domicilio de la persona denunciante o quejosa.\ne) Identificación Oficial.\n14.5. Acciones de Blindaje.\nPara blindar al Programa Extensionismo, Desarrollo de Capacidades y Asociatividad Productiva, del clientelismo y que no sea utilizado para usos partidistas, en la documentación siempre deberán incluir la leyenda siguiente:\n“Este programa es de carácter público, no es patrocinado ni promovido por partido político alguno y sus recursos provienen de los impuestos que pagan todos los contribuyentes. Está prohibido el uso de este programa con fines políticos electorales, de lucro y otros distintos a los establecidos. Quien haga uso indebido de los recursos de este programa deberá ser denunciado y sancionado de acuerdo con la ley aplicable y ante la autoridad competente”.\n14.6. Acta de Donación.\nVer (Anexo 2)\n15. Perspectiva de Género.\nEste Programa es incluyente y con perspectiva de Género, procurando la participación de las mujeres, en igualdad de condiciones para mejorar sustancialmente la calidad y condición de vida ya que las actividades que realiza la mujer son muy importantes.\n16. Enfoque de Derechos.\nEl Programa, está destinado para apoyar a las y los agricultores de bajos recursos, hombres y mujeres; siendo responsabilidad de la SAGADEGRO el cumplimiento de esta disposición, cumpliendo así con lo establecido en la Constitución Política de los Estados Unidos Mexicanos, de que toda persona tiene derecho a participar y beneficiarse con los Programas de Desarrollo Social.\n17. Acciones Contra el SARS-CoV-2.\nDebido a la contingencia sanitaria originada por el COVID-19, se tomarán en consideración las medidas recomendadas por la Secretaría de Salud Federal; como la sana distancia, el uso obligatorio de\nREGLAS DE OPERACIÓN PARA EL EJERCICIO FISCAL cubrebocas y la aplicación de gel antibacterial al momento de la entrega de los apoyos, así como las recomendaciones que se emitan para la veda electoral.\n18. Anexos. con:\n• Anexo 1.-Mir.\n• Anexo 2.-Acta de entrega recepción.\n• Anexo 3.-Solicitud única de apoyo.\nREGLAS DE OPERACIÓN PARA EL EJERCICIO FISCAL\nANEXO I\nMatriz de indicadores\nTipo de\nIndicador\nFrecuencia\nNivel de Resumen Nombre del para Medios de\nMétodo de Calculo de Meta Supuestos objetivo narrativo Indicador resultados Verificación\nMedición estratégicos o de gestión\n. Fomentar el Porcentaje de (No. De agricultores De eficiencia Anual. Por el programa de Disposición desarrollo de agricultores que que aplican las extensionismo oportuna y capacidades de los aplican las capacidades 100% Desarrollo de suficiente de agricultores, sus capacidades promovidas por los agricultores Capacidades y recursos para organizaciones, las promovidas por los servicios de extensión Asociatividad la realización y familias rurales, servicios de extensión e innovación rural, Productiva, 30,000 operación del mediante e innovación rural para para incrementar la agricultores de las Programa. Y innovaciones incremento a la producción de diferentes regiones y que las mediante producción de alimentos / (Total de se realiza una condiciones capacitaciones en alimentos. agricultores evaluación climatológicas las parcelas y aulas beneficiados con semestral por región sean escolares que les servicios de extensión y una estatal. Por la favorables en permita reducir sus 27.4% e innovación misma institución el presente costos de inversión rural)*/100 ejecutora. ciclo agrícola e incrementar su = 27.4% SAGARPA, Hoy P.V. 2022 producción. SADER. No cuenta con dicha información.\nPorcentaje de servicios Los agricultores No aplica Por el programa de profesionales de atendidos por el extensionismo extensión e servicio de extensión Desarrollo de innovación en el desarrollo de 100% Capacidades y Disposición\nEstado fue de capacidades con las De eficiencia. Anual agricultores Asociatividad oportuna y alrededor del 38 % diferentes Productiva, 30,000 suficiente de de un número de innovaciones en el agricultores de las recursos para profesionistas de Estado fue de un 27.4 diferentes regiones y la realización y alrededor de 3000 % se realiza una operación del alumnos de evaluación Programa. Y y media superior y una estatal. Por la condiciones que fueron misma institución climatológicas capacitados con el ejecutora. sean apoyo del CIMMYT. SAGARPA, Hoy favorables en\nSADER. No cuenta el presente con dicha ciclo agrícola información. P.V. 2022\nREGLAS DE OPERACIÓN PARA EL EJERCICIO FISCAL\nREGLAS DE OPERACIÓN PARA EL EJERCICIO FISCAL\nAnexo 3\nREGLAS DE OPERACIÓN PARA EL EJERCICIO FISCAL\nPrimero. El presente Acuerdo entrará en vigor al día siguiente de su publicación en el Periódico\nSegundo. Se abroga el Acuerdo por el que se crea el Programa Extensionismo y Desarrollo de\nCapacidades y Asociatividad Productiva, se emiten sus Reglas de Operación para el Ejercicio Fiscal 2021, publicado en el Periódico Oficial del Gobierno del Estado No. 17 de fecha 26 de febrero de 2021.\nTercero. A partir de la entrada en vigor del presente Acuerdo, las Reglas de Operación del\nPrograma Extensionismo y Desarrollo de Capacidades y Asociatividad Productiva, subsecuentes o sus modificaciones serán emitidas por la persona titular de la Secretaría de Agricultura, Ganadería, Pesca y\nDesarrollo Rural, responsable directa de la operación y ejecución de estas.\nDado en el “Recinto de las Oficinas del Poder Ejecutivo del Estado”, el inmueble ubicado en el número 62, Edificio Norte Planta Baja, en Boulevard René Juárez Cisneros, Código Postal 39074, Colonia\nCiudad de los Servicios, en la Ciudad de Chilpancingo de los Bravo, capital del estado de Guerrero, a los treinta días del mes de mayo del año dos mil veintidós.\nLA GOBERNADORA CONSTITUCIONAL DEL ESTADODEGUERRERO.\nMTRA. EVELYN CECIA SALGADO PINEDA.\nRúbrica.\nEL SECRETARIO GENERAL DE GOBIERNO.\nMTRO. LUDWIG MARCIAL REYNOSO NUÑEZ.\nRúbrica.\nELSECRETARIO DE AGRICULTURA, GANADERÍA, PESCA Y DESARROLLO RURAL.\nDR. JORGE PETO CALDERÓN.\nRúbrica.",
  "ordenamiento": "PROGRAMA",
  "jurisdiccion": "GUERRERO",
  "fuente_oficial": "DIARIO OFICIAL DE LA FEDERACION",
  "Fecha de Publicación": "12 de julio de 2019",
  "ULTIMA REFORMA PUBLICADA": null,
  "status": "VIGENTE",
  "es_escaneado": false,
  "tiene_tablas": true,
  "materia": [
    "general"
  ]
}