{
  "titulo": "Acuerdo por el Que Se Emiten las Reglas de Operación del Programa de Atención Alimentaria A Personas",
  "Contenido": "EMERGENCIA O DESASTRE\nTEXTO ORIGINAL.\nALIMENTARIA A PERSONAS EN SITUACIÓN DE EMERGENCIA O DESASTRE.\nPoder Ejecutivo.\nLIC. ANTELMO MAGDALENO SOLÍS, DIRECTOR GENERAL DEL SISTEMA PARA EL DESARROLLO\nINTEGRAL DE LA FAMILIA DEL ESTADO DE GUERRERO, CON FUNDAMENTO EN LA LEY NÚMERO\n690 DE ENTIDADES PARAESTATALES PARA EL ESTADO DE GUERRERO; LOS ARTÍCULOS 27\nFRACCIÓN IX Y X DEL REGLAMENTO INTERIOR DEL ORGANISMO PÚBLICO DESCENTRALIZADO\nSISTEMA PARA EL DESARROLLO INTEGRAL DE LA FAMILIA DEL ESTADO DE GUERRERO; 167\nDE LA LEY GENERAL DE SALUD; 3 DE LA LEY DE ASISTENCIA SOCIAL; 3 FRACCIÓN XVIII DEL\nPRESUPUESTO DE EGRESOS DE LA FEDERACIÓN PARA EL EJERCICIO FISCAL 2025; 40 DE LA\nLEY DE COORDINACIÓN FISCAL; ARTÍCULOS 4, FRACCIONES II, V Y XIII, 11 TER Y 15 DE LA LEY\nSOBRE EL SISTEMA ESTATAL DE ASISTENCIA SOCIAL NÚMERO 332; EN RELACIÓN CON EL\nARTÍCULO 46 Y ANEXOS 23 Y 23-A (P46) DEL DECRETO NÚMERO 203 DEL PRESUPUESTO DE\nEGRESOS DEL ESTADO DE GUERRERO, PARA EL EJERCICIO FISCAL 2025; ESTRATEGIA\nINTEGRAL DE ASISTENCIA SOCIAL ALIMENTARIA Y DESARROLLO COMUNITARIO 2025 Y LOS\nLINEAMIENTOS PARA LA ELABORACIÓN DE LAS REGLAS DE OPERACIÓN DE LOS PROGRAMAS\nSOCIALES ESTATALES PARA EL PERIODO 2022-2027.\nQue el Plan Estatal de Desarrollo 2022-2027, contempla en su eje 1 el bienestar, desarrollo humano y justicia social, con dos objetivos que justifican la creación de este proyecto, los cuales son, mejorar la calidad de vida de la población y disminuir las desigualdades a través de la atención a grupos vulnerables.\nQue la visión de futuro para nuestro estado es de derechos e inclusión, siendo una de las prioridades contribuir a reducir las carencias sociales, entre las que destacan la educativa con 23.7 por ciento en esta condición, servicios de salud con 13.8 por ciento, carencia de acceso a la seguridad social con 75.6 por ciento y carencia alimentaria con 27.8 por ciento.\nPor lo que la alimentación, educación, salud, seguridad social y pública son los principales indicadores por mejorar.\nQue en este sentido, el Presupuesto de Egresos de la Federación, para el Ejercicio Fiscal 2025, tiene como objetivo optimizar la ejecución de la planeación, mediante la asignación de presupuesto de forma analítica, considerando las actividades prioritarias del estado de Guerrero, dentro de las que principalmente se encuentran, la disminución de la pobreza y traer paz a las familias guerrerenses.\nEMERGENCIA O DESASTRE\nQue el uso de recursos federales del Fondo Aportaciones Múltiples (Asistencia Social), implica responsabilidades para las Entidades Federativas, de acuerdo con la Ley de Coordinación Fiscal.\nAsimismo, los Sistemas Estatales para el Desarrollo Integral de la Familia como entidad ejecutora, deben publicar las reglas de operación a las que se sujetarán los programas en cada ejercicio fiscal, de acuerdo con el principio de fortalecimiento del pacto federal y del municipio libre establecido en el artículo 2o fracción\nV de la Ley de Planeación, en los artículos 134 de la Constitución Política de los Estados Unidos Mexicanos, 1, 2, 4, 5, 75 y 77 de la Ley Federal de Presupuesto y Responsabilidad Hacendaria.\nQue en el artículo 46 del Decreto Número 203 del Presupuesto de Egresos del Estado de Guerrero, para el Ejercicio Fiscal 2025, establece que con el objeto de asegurar la aplicación eficiente, eficaz, oportuna equitativa y transparente de los recursos públicos la Secretaría de Finanzas y Administración y la Secretaría de Planeación y Desarrollo Regional emitirán las disposiciones a que deberán sujetarse los programas de inversión sujetos a Reglas de Operación.\nQue por lo anterior, la Secretaría de Planeación y Desarrollo Regional, expidió los Lineamientos para la\nElaboración de las Reglas de Operación de los Programas Sociales Estatales para el periodo 2022-2027, publicadas en el Periódico Oficial del Gobierno del Estado número 14 de fecha 18 de febrero de 2022. Los cuales tienen la finalidad de ofrecer a las Secretarías, Dependencias y Entidades Paraestatales del\nGobierno del estado un instrumento técnico que guíe la elaboración de los apartados centrales de las reglas de operación, así como los elementos para integrar su contenido. Además, cumple con el mandato señalado en el Decreto Número 203 del Presupuesto de Egresos del Estado de Guerrero, para el Ejercicio\n2025, en el Capítulo V, artículo 46, que establece la obligatoriedad de elaboración de las Reglas de\nOperación de los Programas Sociales.\nEn base al párrafo anterior y considerando que el presente programa se subsidia a través del Fondo de\nAportaciones Múltiples (FAM-AS 33) el cual se rige por la Estrategia Integral de Asistencia Social, Alimentación y Desarrollo Comunitario publicada en el Periódico Oficial de la Federación con fecha 24 de enero de 2025, estrategia que establece el Modelo para la elaboración de las Reglas de Operación del\nPrograma, se homóloga para el cumplimiento de ambos lineamientos el formato de presentación de las\nReglas de Operación del Programa de Atención Alimentaria a Personas en Situación de Emergencia o\nDesastre.\nQue las personas titulares, dependencias y entidades de la administración pública estatal, así como las de estas, serán responsables de los programas y proyectos que estos realicen, deberán ser sujetos a los criterios de objetividad, equidad, transparencia, publicidad, selectividad y temporalidad.\nEn razón de lo mencionado anteriormente, se pone en marcha a nivel nacional el Programa de Atención\nAlimentaria a Personas en Situación de Emergencia o Desastre, a través de la Estrategia Integral de\nAsistencia Social, Alimentación y Desarrollo Comunitario 2025 teniendo como objetivo favorecer el acceso de las personas en condición de emergencia o desastre, a alimentos inocuos y nutritivos.\nPor lo anteriormente expuesto y con fundamento en las disposiciones legales antes citadas, he tenido a bien expedir el siguiente:\nEMERGENCIA O DESASTRE\nArtículo 1. Se emiten las Reglas de Operación del Programa de Atención Alimentaria a Personas en\nSituación de Emergencia o Desastre, que establece los principios de eficiencia, eficacia, oportunidad, equitativa y transparencia de los recursos públicos y requisitos que se deben de cumplir para poder acceder al mismo.\nArtículo 2. El Sistema para el Desarrollo Integral de la Familia del Estado de Guerrero, tendrá a cargo la implementación, operación, ejecución, evaluación y administración del Programa de Atención\nAlimentaria a Personas en Situación de Emergencia o Desastre, bajo los criterios de objetividad, equidad, transparencia, publicidad, selectividad y temporalidad, con estricto apego a la normatividad aplicable, por lo tanto, será el encargado de la dispersión y asignación de los recursos del Programa apegándose plenamente a las siguientes:\nREGLAS DE OPERACIÓN DEL PROGRAMA DE ATENCIÓN ALIMENTARIA A PERSONAS EN\nSITUACIÓN DE EMERGENCIA O DESASTRE.\n1. Introducción.\nEl estado de Guerrero tiene una alta exposición a la ocurrencia de eventos catastróficos y de emergencia; en las últimas décadas los desastres naturales han aumentado considerablemente: sismos, tormentas, huracanes, ciclones, deslizamientos de tierra, crecimiento de ríos,; así como desastres antropogénicos que son consecuencia de una de las fuentes sustanciales de contaminación del aire: incendios forestales, fumigaciones aéreas, en el año 2020 el estado ha sido víctima de la pandemia por el virus SARS - COV\n- 2 (COVID -19), el Huracán “OTIS” en 2023, así como el Huracán “JOHN” más reciente en el 2024 que afectó gravemente al puerto de Acapulco y gran parte del estado de Guerrero; lo que se traduce en un significativo aumento de víctimas, daños materiales, económicos y ecológicos; dichos fenómenos naturales, ocurren de manera inesperada, afectando principalmente a las poblaciones más vulnerables, siendo aquellas que se encuentran ubicadas en territorios denominados de alto riesgo y por tanto, susceptibles al daño.\nEn este precepto, el Sistema Estatal para el Desarrollo Integral de la Familia, a través de la Dirección de\nAsistencia Alimentaria y Desarrollo Comunitario, fomenta y promueve acciones que mitiguen la vulnerabilidad de las personas que son sujeto de asistencia social, ante una situación de riesgo, emergencia o desastre. fenómenos destructivos naturales y/o antropogénicos que, por sus condiciones de vulnerabilidad, requieren apoyo institucional para enfrentarlos; así como a personas migrantes y personas en situación de calle, en cuyo caso se proporcionará el primer alimento en coordinación con las instituciones a cargo, la entrega del de entrega, según el SEDIF lo considere.\nEMERGENCIA O DESASTRE\nEn dado caso de que esté por finalizar el ejercicio fiscal, y no se hubiese presentado alguna condición de emergencia, el SEDIF podrá destinar los recursos o insumos de este Programa a otros de la Estrategia\nIntegral de Asistencia Social, Alimentación y Desarrollo Comunitario. beneficiarias a través de la entrega de canasta alimentaria con calidad nutricia que fortalezcan el desarrollo físico e intelectual de sujetos en situación de emergencia o desastre.\nEste programa se implementó para coadyuvar al cumplimiento de Objetivos Internacionales, Nacionales y\nEstatales alineándose a la Agenda 2030, Plan Nacional de Desarrollo y Plan Estatal.\nA nivel internacional, México se comprometió a contribuir con los Objetivos de Desarrollo Sostenible establecidos en la Agenda 2030 específicamente al Objetivo 2 Hambre Cero “Poner fin al hambre, lograr la seguridad alimentaria y la mejora de la nutrición y Promover la agricultura sostenible”:\nMeta 2.1 De aquí al 2030, poner fin al hambre y asegurar el acceso de todas las personas, en particular los pobres y las personas en situaciones de vulnerabilidad, incluidos los niños menores de 1 año, a una alimentación sana, nutritiva y suficiente durante todo el año a nivel nacional se encuentra alineado a los\n100 Compromisos para el Segundo Piso de la Cuarta Transformación, ubicado en los ejes:\nRepública democrática, justa, honesta, libre, participativa y responsable\nCompromiso 5: Respeto a todos los derechos y combate a la discriminación.\nRepublica Fraterna\nCompromiso 19: Continúan todos los Programas para el Bienestar.\nRepública sana\nCompromiso 43: Programa de cuidados desde los primeros 1,000 días de vida.\nEn relación al Plan Estatal de Desarrollo 2022 – 2027 en su Eje I Bienestar, Desarrollo Humano y Justicia\nSocial; Objetivo 1.2 Mejorar la calidad de vida de la población; Estrategia 1.2.2 Combate al hambre y aumentar el acceso a una alimentación sana, nutritiva y suficiente, con particular atención a la población más pobre y en situación de vulnerabilidad incluidas niñas y niños; Línea de Acción 1.2.2.4 Entrega de apoyos alimentarios directo y temporal a personas en situación de emergencia o desastre.\nSituación de Emergencia o Desastre, programa que se establece en la EIASADC 2025, estas reglas\n(En atención a los numerales 2 y 2.1correspondiente a los Lineamientos para la Elaboración de las Reglas de Operación de los Programas\nSociales Estatales para el Periodo 2022-2027).\n2. Antecedentes.\nEMERGENCIA O DESASTRE\nLa historia de este tipo de apoyo se remonta a 1929 con el “Programa Gota de Leche”, que a fines de los años setenta el DIF retoma con los Programas de Raciones Alimentarias (PRA) y el Programa Asistencia\nSocial Alimentaria a Familias en Desamparo (PASAF).\nHasta 1997 operaron de manera centralizada desde el SNDIF.\nA partir de la descentralización de los programas alimentarios, en 2001 el SNDIF convocó a los SEDIF para desarrollar un proyecto de coordinación de los programas alimentarios, a través de comisiones de trabajo; el resultado fue el desarrollo de la Estrategia Integral de Asistencia Social Alimentaria (EIASA) que reunió una nueva estructura de cuatro programas con actividades de focalización. Uno de los cuatro fue el\nPrograma de Asistencia Alimentaria a Familias en Desamparo (PAAFD), cuyo objetivo primordial fue el de contribuir a la seguridad alimentaria de las familias en situación de desamparo, a través de canasta alimentarias temporales, teniendo dos vertientes, una de atención a familias en pobreza extrema y otra para situación de desastres tanto antropogénicos como naturales.\nEn el año 2007, 20 estados atendieron a familias beneficiarias, el número total de beneficiarios fue de\n878,301, siendo el estado de Guerrero uno de los 20 que trabajaron este Programa, hasta el año 2019.\nA partir del 2020, la nueva estructura de los Programas de la Estrategia Integral de Asistencia Social\nAlimentaria y Desarrollo Comunitario determinó 5 programas, dentro de los cuales se estableció la nueva\nEstrategia Asistencia Social Alimentaria a Personas en Situación de Emergencia o Desastre, cuyo objetivo es la de favorecer el acceso a personas en condición de emergencia o desastre, a alimentos inocuos y nutritivos, a través de canasta alimentarias temporales.\nAnte una situación de emergencia o desastre el SEDIF y los SMDIF, deberán coordinar la entrega de las canastas alimentarias, dependiendo de la gravedad y necesidades tras el fenómeno ocurrido; el apoyo alimentario podrá otorgarse a través de la Entrega de Canasta alimentarias.\nLa última modificación realizada a este Programa fue en relación con el nombre denominándose Programa de Atención Alimentaria a Personas en Situación de Emergencia o Desastres, señalándose en la Estrategia\nIntegral de Asistencia Social, Alimentación y Desarrollo Comunitario 2023. transferir los recursos de los otros programas alimentarios al Programa, para atender a la población que así lo requiera. Esto podrá operarse siempre y cuando exista un acuerdo emitido por la autoridad correspondiente.\nEl programa a lo largo de los años, desde que se creó la Estrategia, ha sufrido modificaciones en su denominación:\nEIASA 2019 Asistencia Alimentaria a Familias en Desamparo.\nEIASADC 2020, 2021 y 2022 Programa de Asistencia Social Alimentaria a Personas en Situación de\nEmergencia o Desastre.\nEMERGENCIA O DESASTRE\nEIASADC 2023, 2024 y 2025 Programa de Atención Alimentaria a Personas en Situación de Emergencia o Desastre. comenzó a operar formalmente en 2001 tras la descentralización de programas alimentarios a nivel nacional, y ha experimentado varias mejoras significativas a lo largo de los años. Sus antecedentes se remontan a 1929 con el “Programa Gota de Leche” y, posteriormente, con los Programas de Raciones\nAlimentarias (PRA) y el Programa de Asistencia Social Alimentaria a Familias en Desamparo (PASAF), que operaron hasta 1997.\nEn 2001, el SNDIF convocó a los SEDIF para desarrollar la Estrategia Integral de Asistencia Social\nAlimentaria (EIASA), mejorando la focalización y la calidad de la entrega de apoyos alimentarios. Entre\n2007 y 2019, Guerrero fue uno de los 20 estados que atendieron a 878,301 familias beneficiarias. En 2020, la nueva estructura de la Estrategia Integral de Asistencia Social Alimentaria y Desarrollo Comunitario incluyó cinco programas, destacando la Estrategia Asistencia Social Alimentaria a Personas en Situación de Emergencia o Desastre para favorecer el acceso a alimentos inocuos y nutritivos. En 2023, se renombró a Programa de Atención Alimentaria a Personas en Situación de Emergencia o Desastre, permitiendo la transferencia de recursos de otros programas en situaciones de emergencia, asegurando que la población vulnerable reciba alimentos nutritivos y de calidad mediante mejoras en la coordinación y la utilización de tecnologías de la información.\n(En atención al numeral 1.1 correspondiente a los Lineamientos para la Elaboración de las Reglas de Operación de los Programas\nSociales Estatales para el Periodo 2022-2027).\n3. Glosario de términos.\nÁcidos Grasos Saturados: Los que carecen de dobles ligaduras. Se recomienda que no excedan más del 7% del valor energético total de la dieta, ya que favorecen la ateroesclerosis. Algunos productos contienen cantidades elevadas de ácidos grasos saturados: la mantequilla y la margarina, las mantecas, el chicharrón de cerdo, el chorizo, la crema, el aceite de coco y los chocolates(cacao).\nÁcidos Grasos Trans: Son isómeros de ácidos grasos mono insaturados. Se pueden producir en la hidrogenación de aceites y grasas vegetales. Un alto consumo en la dieta puede incrementar el riesgo de presentar enfermedades cardiovasculares.\nAditivo: Cualquier sustancia permitida que, sin tener propiedades nutritivas, se incluya en la formulación de los productos y que actúe como estabilizante, conservador o modificador de sus características organolépticas, para favorecer ya su estabilidad, conservación, apariencia o aceptabilidad.\nAdolescentes: Personas que tienen entre 12 años cumplidos y 18 años incumplidos de acuerdo con lo establecido en el Artículo 2 de la Ley para la Protección de los Derechos de Niñas, Niños y Adolescentes.\nAGEB: Es la extensión territorial que corresponde a la subdivisión de las áreas geoestadísticas municipales. Constituye la unidad básica del Marco Geoestadístico Nacional y, dependiendo de sus características, se clasifican en dos tipos: urbana y rural.\nEMERGENCIA O DESASTRE\nAGEB Urbana: Área geográfica ocupada por un conjunto de manzanas que generalmente va de 1 a 50, preferentemente delimitadas por calles, avenidas, andadores o cualquier otro rasgo de fácil identificación en el terreno y cuyo uso del suelo sea principalmente habitacional, industrial, de servicios, comercial, etcétera, sólo se asignan al interior de las localidades urbanas.\nAGEB Rural: Subdivisión de las áreas geoestadísticas municipales que se ubican en la parte rural, cuya extensión territorial es variable y se caracteriza por el uso del suelo de tipo agropecuario o forestal. Contiene localidades rurales y extensiones naturales como pantanos, lagos, desiertos y otros, delimitada por lo general por rasgos naturales (ríos, arroyos, barrancas, etcétera) y culturales (vías de ferrocarril, líneas de conducción eléctrica, carreteras, brechas, veredas, ductos, límites prediales, etcétera).\nAlimentación: Conjunto de procesos biológicos, psicológicos y sociológicos, relacionados con la ingestión de alimentos mediante el cual el organismo obtiene del medio, los nutrimentos que necesita, así como las satisfacciones intelectuales, emocionales, estéticas, socioculturales, que son indispensables para la vida humana plena.\nAlimentación Complementaria: Es el proceso que se inicia con la introducción paulatina de alimentos diferentes a la leche humana, para satisfacer las necesidades nutrimentales de la niña o el niño, se recomienda después de los 6 meses de edad.\nAlimentación Correcta: Hábitos alimentarios que, de acuerdo con los conocimientos reconocidos por la materia, cumple con las necesidades específicas de las diferentes etapas de la vida, promueve en las niñas y los niños el crecimiento y desarrollo adecuado, y en los adultos permite conservar o alcanzar el peso esperado para la talla y previene el desarrollo de enfermedades.\nAseguramiento de la Calidad Alimentaria: Conjunto de acciones planificadas y sistematizadas, necesarias para proporcionar la confianza de que los insumos alimentarios que se entregan a los beneficiarios no afecten su salud.\nAsistencia Social: Conjunto de Acciones Tendientes a Modificar y Mejorar las Circunstancias de Carácter\nSocial que Impiden el Desarrollo Social del Individuo, así como la Protección Física, Mental y Social de\nPersonas en Estado de Necesidad. alimentaria directa, orientación alimentaria, promoción de la salud y vigilancia de la nutrición, para contribuir a mejorar las circunstancias por las que atraviesa esta población.\nBeneficiarias y Beneficiarios: Población con características específicas a la que van dirigidas los programas y apoyos de asistencia social.\nCadena Alimentaria: Secuencia de etapas y operaciones involucradas en la producción, procesamiento, distribución, almacenamiento y manipulación de un alimento y sus ingredientes, desde su producción primaria hasta su consumo.\nEMERGENCIA O DESASTRE\nCalidad: Propiedades y características de un producto o servicio para satisfacer las necesidades específicas o implícitas de los consumidores.\nCapacitación: Proceso de formación destinado a promover, facilitar, fomentar y desarrollar las aptitudes, habilidades o conocimientos de las personas, con el fin de permitirles mejores oportunidades y condiciones de vida.\nComplemento Alimenticio: Producto alimenticio que consiste en fuentes concentradas de nutrientes que se presentan con la finalidad de complementar la ingesta de tales nutrientes de dieta normal.\nComunidad: Personas que en conjunto habitan un espacio geográfico determinado, que generan un sentido de pertenencia e identidad social, que interaccionan entre sí, operando redes de comunicación y apoyo mutuo, para lograr determinados objetivos, intereses, satisfacer necesidades, resolver problemas y desempeñar funciones sociales relevantes para su localidad.\nContaminación: Presencia de materia extraña, sustancias tóxicas o microorganismos, en cantidades que rebasen los límites permisibles establecidos por la Secretaría de Salud o en cantidades tales que representen un riesgo a la salud.\nCriterios de Calidad Nutricia: Nos referimos a una herramienta conceptual, flexible a diferentes contextos, su objetivo es regular la conformación de menús y canastas alimentarias, que así mismo se adecuan a un catálogo de menús, de manera que sirvan para promover una alimentación correcta en congruencia con el objetivo de la EIASADC 2025 del SNDIF.\nComité: Grupo de personas con representación de la comunidad o grupo organizado para participar en los programas de los que son beneficiarias o beneficiarios.\nCultura Alimentaria: Manifestación singular de un grupo social relativa a sus hábitos de consumo de alimentos, con base en su acervo culinario, el cual está conformado por factores geográficos, económicos, sociales, religiosos e históricos.\nDesnutrición: Al estado patológico inespecífico, sistémico y potencialmente reversible que se genera por el aporte insuficiente de nutrimentos, o por una alteración en su utilización por las células del organismo.\nSe acompaña de varias manifestaciones clínicas y reviste diversos grados de intensidad (leve, moderada y grave).\nCanasta Alimentaria: Para efectos de este documento, nos referimos al paquete de insumos conformados de acuerdo con criterios de calidad nutricia, que forman parte de la cultura alimentaria de los beneficiarios, que contribuyen a promover una alimentación correcta, y se otorgan a través de los programas de asistencia social alimentaria.\nEspacio Alimentario: Para efectos de este documento, lugar designado para la preparación y consumo de alimentos mediante la organización y participación social.\nEspecificación: Características o requisitos que debe cumplir un producto o un servicio.\nEMERGENCIA O DESASTRE\nEspecificaciones Técnicas de Calidad: Características o requisitos que deben cumplir los insumos alimentarios de acuerdo con la EIASADC.\nEstado de Nutrición o Estado Nutricio: Es el resultado del equilibrio entre la ingestión de alimentos\n(vehículo de nutrimentos) y las necesidades nutrimentales de los individuos; es asimismo consecuencia de diferentes conjuntos de interacciones de tipo biológico, psicológico y social.\nEstructura Programática: Conjunto de categorías y elementos programáticos ordenados en forma coherente que define las acciones de los ejecutores de gasto para alcanzar sus objetivos y metas. Ordena y clasifica las acciones de los ejecutores de gasto para delimitar su aplicación, y permite conocer el rendimiento esperado del uso de los recursos públicos.\nEtiqueta: Cualquier rótulo, marbete, inscripción, imagen u otra materia descriptiva o gráfica, escrita, impresa, estarcida, marcada, grabada en alto o bajo relieve, adherida, sobrepuesta o fijada al envase del producto preenvasado o, cuando no sea posible por las características del producto, al embalaje.\nEvaluación de la Conformidad: Proceso técnico que permite demostrar el cumplimiento con las Normas\nOficiales Mexicanas, Estándares y Normas Internacionales ahí referidas o de otras disposiciones legales.\nComprende, entre otros, los procedimientos de muestreo, prueba, inspección, evaluación y certificación.\nFibra Dietética: Parte comestible de las plantas o hidratos de carbono que son resistentes a la digestión y a la absorción en el intestino delgado humano y que sufren una fermentación total o parcial en el intestino grueso; se encuentra en leguminosas, cereales integrales, verduras y frutas. La fibra dietética incluye polisacáridos, lignina y otras sustancias asociadas a las plantas y se le divide en solubles e insolubles. Su consumo insuficiente se ha asociado con la aparición de enfermedades crónicas.\nFocalización: Es asegurar que los beneficios de las acciones lleguen a las familias que más requieren las intervenciones públicas, para concentrar la atención sobre un determinado problema o necesidad.\nFrutas y Hortalizas Deshidratadas: Productos frescos, sanos y limpios, enteros o divididos, con madurez apropiada, a los cuales se les ha eliminado parcial o totalmente el agua mediante métodos naturales o artificiales.\nGrupos de Atención Prioritaria: Son Aquellos a quienes se ha identificado que deben ser atendidos de manera preferente, a través de programas especiales y estrategias, con la finalidad de alcanzar un equilibrio social.\nHábitos Alimentarios: Conjunto de conductas adquiridas por un individuo, por la repetición de actos en cuanto a la selección, la preparación y el consumo de alimentos. Los hábitos alimentarios se relacionan principalmente con las características sociales, económicas y culturales de una población o región determinada. Los hábitos generalizados de una comunidad suelen llamarse costumbres.\nInocuo: Concepto que implica que un alimento no causará daño al consumidor cuando se prepara y/o consume de acuerdo con el uso a que se destina.\nEMERGENCIA O DESASTRE\nLocalidad: Todo lugar ocupado con una o más viviendas, las cuales pueden estar habitadas o no, este lugar es reconocido por un nombre dado por la ley o la costumbre, por la cantidad de población, se dividen en urbanas (mayores de 2,500 habitantes) y rurales (menores de 2.500 habitantes), de acuerdo con el\nInstituto Nacional de Estadística y Geografía (INEGI).\nNiñas y Niños: Personas de hasta 12 años incompletos, tal como lo establece el artículo 2 de la Ley para la Protección de los Derechos de Niñas, Niños y Adolescentes.\nObesidad: Enfermedad caracterizada por el exceso de tejido adiposo en el organismo. Se determina la existencia de obesidad en adultos cuando existe un índice de masa corporal mayor de 30 kg/m2. Se debe a la ingestión de energía en cantidades mayores a las que se gastan, acumulándose el exceso en el organismo en forma de grasa.\nOrientación y Educación Alimentaria (OEA): Conjunto de acciones enfocada en transmitir nuevos conocimientos, así como reforzar aquellas buenas prácticas que realiza la comunidad, a través de diferentes actividades que motiven a tener actitudes saludables, mismas que, con el tiempo, se conviertan en acciones cotidianas (hábitos).\nPadrón de Personas beneficiarias: Registro nominal de las y los beneficiarios de un programa.\nParticipación Social: Proceso que permite involucrar a la población, autoridades locales, instituciones públicas y a los sectores social y privado en la planeación, programación, ejecución y evaluación de los programas y acciones de salud, con el propósito de lograr un mayor impacto.\nPersonas de Atención Prioritaria: Son aquellos a quienes se ha identificado que deben ser atendidos de manera preferente, a través de programas especiales y estrategias, con la finalidad de alcanzar un equilibrio social.\nPerspectiva de Género: Considera el papel social y cultural de las mujeres, hombres, niñas, niños y adolescentes, a fin de promover la equidad e igualdad de oportunidades y responsabilidades en un programa determinado.\nPerspectiva de los Pueblos Indígenas: Acción de reconocer que los pueblos indígenas se caracterizan por la relación especial con sus tierras, territorios y recursos naturales, donde han desarrollado culturas, lenguas, artes, medicinas, cosmogonías y formas propias de organización política, económica y social, usos y costumbres, así como principios y valores que rigen la vida comunitaria entre los que destacan: el tequio, la solidaridad, el trabajo comunitario y la ayuda mutua, mismo que deberán tomarse en cuenta para fortalecer los procesos de autonomía y formas de organización propias.\nPerspectiva Regional: Considera la cultura y tradiciones regionales para rescatar y mejorar las prácticas alimentarias de la comunidad, la familia y el individuo, por un lado, y por el otro, incentivar la economía y producción local, así como fomentar el desarrollo regional.\nEMERGENCIA O DESASTRE\nPoblación Objetivo: Población especifica que un programa tiene planeado o programado atender para cubrir la población potencial y que cumple con los criterios de elegibilidad establecidos en su normatividad.\nPoblación Potencial: Población total que presenta la necesidad o problema que justifica la existencia de un programa y que, por lo tanto, pudiera ser elegible para su atención.\nPrácticas de Higiene: Medidas necesarias que se realizan durante las diferentes etapas de la cadena alimentaria, para garantizar su inocuidad.\nPrograma: Programa de Atención Alimentaria a Personas en Situación de Emergencia o Desastre.\nPrograma de Limpieza y Desinfección: Documento que contiene la planeación acerca de los métodos, áreas, implementos y frecuencia con la que se realiza la limpieza y desinfección en espacios alimentarios y almacenes.\nPromoción de la Salud: Proceso que permite fortalecer los conocimientos, aptitudes y actitudes de las personas para participar corresponsablemente en el cuidado de su salud y para optar por estilos de vida saludables, facilitando el logro y conservación de un adecuado estado de salud individual y colectivo mediante actividades de participación social, comunicación educativa y educación para la salud.\nRación Alimentaria: Para efectos de este documento, se refiere al platillo preparado que se ofrece en los espacios alimentarios.\nReglas de Operación (ROP): Son un conjunto de disposiciones que precisan la forma de operar un programa, con el propósito de transparentar y normar la distribución y entrega de las canastas alimentarias.\nSeguridad Alimentaria: Acceso físico y económico de todas las personas, en todo momento, a los alimentos inocuos y nutritivos que se requieren para satisfacer sus necesidades alimenticias y sus preferencias en cuanto a los alimentos, a fin de llevar una vida saludable y activa.\nSituación de Emergencia: Condición que puede causar un daño y propiciar un riesgo excesivo para la seguridad e integridad de la población en general, generada o asociada con la inminencia, alta probabilidad o presencia de un agente perturbador.\nSodio: Nutrimento inorgánico, que constituye el principal catión del espacio extra molecular y su contenido corporal, está regulado a través de la función renal. Regula el volumen, la presión osmótica, y la carga eléctrica del fluido extracelular. Interviene en la contracción muscular, la conducción nerviosa, la absorción de algunos nutrimentos y, en menor grado, en la constitución de los huesos.\nSustentabilidad: Capacidad de satisfacer las necesidades y ejercer los derechos humanos presentes, sin poner en riesgo la sobrevivencia y el desarrollo de las futuras generaciones, realizando acciones familiares y colectivas orientadas al cuidado del medio ambiente para disminuir la huella ecológica. Implica comprender y sensibilizarse con el entorno global, e identificar y resolver los problemas ecológicos a nivel local.\nEMERGENCIA O DESASTRE\nVigilancia del Estado Nutricional: Conjunto de procedimientos sistemáticos que permiten identificar, seguir y evaluar las condiciones de nutrición en forma individual y colectiva, indispensable para la toma de decisiones.\nVulnerabilidad: Fenómeno social que implica la presencia de una condición de riesgo que padece un individuo o una familia, resultado de la acumulación de desventajas sociales, de manera que dicha situación impide que esas condiciones sean superadas por ellos mismos y queden limitados para incorporarse a las oportunidades de desarrollo.\nSIGLAS:\nAGEB: Área Geoestadística Básica.\nAPCE: Atención en Condiciones de Emergencia.\nCE-APCE: Comité Estatal de Atención a Población en Condiciones de Emergencia.\nCENAPRED: Centro Nacional de Prevención de Desastres.\nCNDH: Comisión Nacional de los Derechos Humanos.\nCOFEPRIS: Comisión Federal para la Protección contra Riesgos Sanitarios.\nCONAMER: Comisión Nacional de Mejora Regulatoria.\nCONAPO: Consejo Nacional de Población.\nCONEVAL: Consejo Nacional de Evaluación de la Política de Desarrollo Social.\nDOF: Diario Oficial de la Federación.\nEIASADC: Estrategia Integral de Asistencia Social, Alimentación y Desarrollo Comunitario.\nETA: Enfermedades Transmitidas por Alimentos.\nFAM-AS: Fondo de Aportaciones Múltiples Componente Asistencia Social.\nIPPEA: Informe Parcial del Proyecto Estatal Anual.\nLAS: Ley de Asistencia Social.\nLCF: Ley de Coordinación Fiscal.\nLDFEFM: Ley de Disciplina Financiera de las Entidades Federativas y los Municipios.\nLFPRH: Ley Federal de Presupuesto y Responsabilidad Hacendaria.\nLGS: Ley General de Salud.\nMIR: Matriz de Indicadores de Resultados.\nPEA: Proyecto Estatal Anual.\nPEF: Presupuesto de Egresos de la Federación.\nPP: Programa Presupuestal.\nPTCVC: Programa Estatal de Trabajo de Comité de Vigilancia Ciudadana.\nROP: Reglas de Operación.\nSEDIF: Sistema Estatal para el Desarrollo Integral de la Familia.\nSFP: Secretaría de la Función Pública.\nSIIPP-G: Sistema Integral de Información de Padrones de Programas Gubernamentales de la Secretaría de la Función Pública.\nSMDIF: Sistema Municipal para el Desarrollo Integral de la Familia.\nSNDIF: Sistema Nacional para el Desarrollo Integral de la Familia.\nSRFT: Sistema de Recursos Federales Transferidos de la SHCP.\nSCyTG: Secretaría de Contraloría y Transparencia Gubernamental.\nEMERGENCIA O DESASTRE\nSEFINA: Secretaría de Finanzas y Administración.\nSEPLADER: Secretaría de Planeación y Desarrollo Regional.\n(En atención al numeral 2.3 correspondiente a los Lineamientos para la Elaboración de las Reglas de Operación de los Programas\nSociales Estatales para el Periodo 2022-2027).\n4. Objetivo.\nDe conformidad con la EIASADC, el objetivo del Programa es:\nFavorecer el acceso de las personas en condición de emergencia o desastre, a alimentos inocuos y nutritivos, a través de apoyos alimentarios temporales, diseñado con base en criterios de calidad nutricia y acompañados de acciones de orientación alimentaria y aseguramiento de la calidad para contribuir a que ejerzan su derecho a la alimentación.\n(En atención al numeral 3.1 correspondiente a los Lineamientos para la Elaboración de las Reglas de Operación de los Programas\nSociales Estatales para el Periodo 2022-2027).\n4.1. Objetivos específicos.\n• Entrega de apoyo alimentario directo y temporal, acompañado de acciones formativas, que permitan el fomento de hábitos, desarrollo de habilidades y conocimientos para el mejoramiento sostenible de sus condiciones de vida.\n• Impulsar mecanismos de prevención, organización y participación social, con el propósito de atender oportunamente la emergencia.\n• Promover la correcta alimentación, mediante acciones de orientación y capacitación alimentaria para aprovechar los alimentos disponibles y la cultura culinaria regional.\n• Proporcionar el primer alimento para familias afectadas por desastres naturales.\n(En atención al numeral 3.2 correspondiente a los Lineamientos para la Elaboración de las Reglas de Operación de los Programas\nSociales Estatales para el Periodo 2022-2027).\n5. Cobertura.\nEl Programa tendrá cobertura estatal, priorizando a los municipios y localidades ubicados en las regiones costa chica, costa grande, acapulco y montaña, zona de grandes riesgos en materia de lluvias y alta sismicidad de acuerdo con CONAPO 2020\nLa cobertura del Programa estará en función de la zona, región, municipio o localidad donde se presente la situación de emergencias o desastre natural. a alimentos inocuos y nutritivos, mediante la entrega de canasta alimentarias temporales, en contribución al derecho a alimentación, priorizando a las niñas, niños, adolescentes, personas migrantes y en situación de calle.\n(En atención a los numerales 3.3 y 3.4 correspondiente a los Lineamientos para la Elaboración de las Reglas de Operación de los\nProgramas Sociales Estatales para el Periodo 2022-2027).\nEMERGENCIA O DESASTRE\n6. Población y focalización.\n6.1. Población potencial.\nLa población potencial es de 3,540,685 correspondiente a la población total del estado de Guerrero, de acuerdo con el Censo de Población y Vivienda 2020 de INEGI, que hayan sido afectadas por la ocurrencia de fenómenos naturales destructivos, así como las personas en condición de movilidad humana.\n(En atención al numeral 2.1.1 correspondiente a los Lineamientos para la Elaboración de las Reglas de Operación de los Programas Sociales Estatales para el Periodo 2022-2027).\n6.2. Población objetivo.\na) Personas que han sido afectadas por la ocurrencia de fenómenos destructivos naturales y/o antropogénicos que, por sus condiciones prioritarias, requieren apoyo institucional para enfrentarlos.\nb) Personas migrantes y personas en situación de calle.\n(En atención a los numerales 2.1.2 y 2.1.3 correspondiente a los Lineamientos para la Elaboración de las Reglas de Operación de los Programas Sociales Estatales para el Periodo 2022-2027).\n6.3. Criterios de focalización.\nEl SEDIF, en coordinación con la Secretaría de Protección Civil y en consenso con los SMDIF identificará:\n• Los municipios, localidades y zonas que hayan sido considerados con declaratoria de emergencia, con base en el plan de riesgo municipal.\n• A las personas que se encuentren en situación de desastre.\n• Los SMDIF coadyuvarán en la determinación de las condiciones físicas y psicológicas de las personas que hayan sido afectadas otorgándole protección alimentaria.\n• En el caso específico de la población migrante se deberá priorizar preferentemente la atención a niñas, niños y adolescentes no acompañados.\n(En atención a los numerales 6 y 8 correspondiente a los Lineamientos para la Elaboración de las Reglas de Operación de los Programas\nSociales Estatales para el Periodo 2022-2027).\n6.4. Requisitos de selección de beneficiarios.\n\n• Dictamen sobre el municipio o localidad afectada, así como la cantidad de personas damnificadas, quienes notificarán al SEDIF el acontecimiento de una contingencia.\n• Los SMDIF se encargarán de integrar expediente del Programa, con la siguiente documentación: a. Padrón de personas damnificadas por municipio y localidad. b. Copia fotostática de la Identificación Oficial (INE) al 200%\nEMERGENCIA O DESASTRE c. Copia de la CURP con la (leyenda en impresión oficial “verificada con el registro civil”) expedida en el año 2025. causa de fuerza mayor, sus habitantes no cuenten con los medios para entregar documentación oficial solicitada, los requisitos y padrones del Programa, al momento de la entrega podrían ser exentados, no sin antes consultar al SNDIF a efecto de que sea este quien determine la modalidad de cómo se hará la correspondiente comprobación de los beneficiarios.\n(En atención al numeral 6 correspondiente a los Lineamientos para la Elaboración de las Reglas de Operación de los Programas Sociales\nEstatales para el Periodo 2022-2027).\n6.5. Métodos y/o procedimientos de selección.\nUna vez ocurrida la condición de emergencia o desastre, el SMDIF notifica al SEDIF, quienes acuden a realizar el sondeo de afectación y daño de la zona, verificando que las personas solicitantes cumplan con los criterios y requisitos de selección establecidos en las Reglas de Operación de este Programa. Es importante destacar la colaboración institucional con la Secretaría de Protección Civil de la entidad para la entrega de canasta alimentaria.\n7. Características de los apoyos.\n7.1 Tipo de apoyo.\nEl apoyo alimentario, estará conformada por una canasta alimentaria en especie, de acuerdo con los criterios de calidad nutricia para personas en situación de emergencia o desastre.\nLa cantidad de apoyos por persona beneficiaria será mínima de una canasta alimentaria hasta un máximo de cuatro canastas alimentarias de manera mensual, con un tope de entrega no limitado siempre de acuerdo con la necesidad que considere el SEDIF y las condiciones lo demanden, durante el ejercicio fiscal\n2025.\n(En atención al numeral 7.1 correspondiente a los Lineamientos para la Elaboración de las Reglas de Operación de los Programas Sociales Estatales para el Periodo 2022-2027).\n7.2. Unidad y periodicidad de los apoyos.\nTipo Monto Periodicidad\nCanasta Alimentaria 1 - 4 Entrega aleatoria\n(En atención al numeral 7 correspondiente a los Lineamientos para la Elaboración de las Reglas de Operación de los Programas Sociales\nEstatales para el Periodo 2022-2027).\nEMERGENCIA O DESASTRE\n7.3. Criterios de selección para los insumos.\nLa canasta alimentaria deberá estar conformada por al menos de 7 insumos diferentes con base en estos criterios y que formen parte de la cultura alimentaria de las y los beneficiarios. complementarios:\nAlimentos Básicos:\n• Dos o tres cereales que sean fuente de fibra dietética.\n• Dos alimentos que sean fuente de calcio. En caso de incluir leche, ésta deberá ser semidescremada o descremada, si es deslactosada deberá ser baja en grasas también.\n• Dos o tres variedades de leguminosas (frijol, lenteja, garbanzo, haba, entre otros)\n• Al menos un alimento fuente de proteína de origen animal y/o hierro hemínico.\nAlimentos Complementarios:\n• Verduras (En caso de otorgar mezclas de verduras no deberán contener papa ni elote.)\n• Frutas.\nTambién se deberá considerar lo siguiente:\n• Incluir alimentos de fácil almacenamiento, transportación y preparación, considerando que durante una emergencia no siempre se cuenta con las condiciones para la preparación de alimentos calientes, reconstitución de alimentos deshidratados o conservación de alimentos perecederos.\n• Incluir alimentos que, por su naturaleza, permitan conservar su inocuidad hasta el momento de su consumo.\n• Se permitirá la inclusión de huevo en polvo, pastas para sopas instantáneas (de acuerdo con los límites de sodio establecidos), fruta deshidratada y polvo para preparar gelatina.\n• Para el huevo en polvo se deberá asegurar el abastecimiento o disponibilidad de agua potable o leche para su preparación.\n• Evitar cualquier alimento que contenga 300 g de sodio o más en 100 g de producto.\n8. Acciones transversales.\nLas acciones transversales llevadas a cabo por el Programa son las siguientes: a. Orientación y Educación Alimentaria. la población, se requiere la incorporación de acciones integrales de orientación y educación alimentaria como eje transversal, la cual debe dirigirse a las personas beneficiarias de los programas alimentarios.\nEMERGENCIA O DESASTRE\nSe debe promover la integración de una alimentación correcta conforme a lo establecido en la EIASADC, a través de acciones formativas y participativas con perspectiva familiar, comunidad de género y regional a fin de empoderar a las personas beneficiarias de los programas para la toma de decisiones saludables.\nDebe formar parte del proceso para otorgar asistencia social alimentaria desde el momento de la selección, preparación y consumo de los alimentos. La composición de la canasta alimentaria con criterios de calidad nutricia, durante el diseño de los menús hasta que los insumos son consumidos por las personas beneficiarias.\nSe establecerán informes que incluyan memorias fotográficas como mecanismos que permitan vigilar y corroborar que la orientación alimentaria está siendo recibida por personal del SMDIF y por las y los beneficiarios; los cuales deberán contener:\n• La población a la que va dirigida la Orientación y Educación Alimentaria.\n• El cronograma de actividades.\n• Herramientas o líneas de acción para su logro.\n• Cambios esperados (en materia de conocimiento y/o actitudes y/o prácticas). b. Aseguramiento de la Calidad Alimentaria.\nAsegurar la entrega de alimentos de calidad e inocuo, a través de herramientas de control en cada una de las etapas de la cadena alimentaria, desde la selección y adquisición, hasta la entrega y consumo de las canastas alimentarias a las personas beneficiarias, garantizando la reducción de riesgos de contaminación o deterioro de los insumos, contribuyendo a la prevención de Enfermedades Transmitidas por Alimentos\n(ETA).\nEstablecer capacitaciones que permitan asesorar y promover controles que garanticen la inocuidad de los insumos alimentarios:\n• Antes: Desde la selección de insumos que conformarán las canastas alimentarias.\n• Durante: La implementación de las acciones a favor del aseguramiento de la calidad.\n• Después: Una vez implementada las acciones se dará seguimiento, se evaluará y corregirá si es necesario. c. Especificaciones Técnicas de Calidad (ETC). fundamentadas en las Normas Oficiales Mexicanas y las Normas Mexicanas vigentes, de acuerdo con el tipo de insumo.\nPara la elaboración de las ETC se tomará como guía el Manual ETC vigente, emitido por el SNDIF. Dichas\nETC se entregarán en el PEA, enviando una ETC por cada producto y presentación aprobados. d. Organización y Participación Comunitaria.\nEMERGENCIA O DESASTRE\nLa organización y participación comunitaria son fundamentales como eje transversal en el programa. Se según la EIASADC. Esto implica la creación de comités de vigilancia ciudadana conformado por mismos a efecto de colaborar en la correcta aplicación y meta del programa con sus beneficiarios. La capacitación de la comunidad se considera aspectos clave para asegurar su participación activa y efectiva en la implementación de acciones a favor del correcto ejercicio del programa, es una práctica de transparencia y rendición de cuentas, por lo tanto, es necesario contar con un comité de vigilancia ciudadana. e. Protección y Promoción de los Derechos Humanos.\nCon el objetivo de generar las condiciones necesarias para el acceso equitativo en términos de disponibilidad, accesibilidad y calidad en las acciones que realiza este Programa, se implementarán mecanismos que hagan efectivo el acceso a la información gubernamental, se asegurará que el acceso a los apoyos y servicios se dé únicamente con base en lo establecido en estas Reglas de Operación, sin discriminación alguna.\nBajo el mismo enfoque la Ley General de los Derechos de Niñas, Niños y Adolescentes señala que para garantizar la protección de los derechos de niñas, niños, adolescentes y jóvenes, las autoridades realizarán las acciones y tomarán medidas con un enfoque integral, transversal y con perspectiva de derechos humanos en el diseño y la instrumentación de políticas y programas de gobierno.\nTodas las personas servidoras públicas involucradas en la operación del Programa deben promover, respetar, proteger y garantizar el ejercicio efectivo de los derechos humanos de las y los beneficiarios del\nPrograma, con base en los principios de universalidad, interdependencia, indivisibilidad y progresividad, brindando en todo momento un trato digno y de respeto a la población objetivo, con apego a los criterios de igualdad y no discriminación.\nEn la aplicación del Programa, se harán valer los derechos de las personas beneficiarias tomando en consideración los factores de desigualdad que pudieran poner en riesgo de vulnerabilidad a personas que pertenecen a grupos históricamente discriminados, como lo son niñas y niños, jóvenes, personas con discapacidad, personas en situación de calle, en situación de desplazamiento interno, mujeres, personas migrantes, afrodescendientes, y a aquellas pertenecientes a pueblos y comunidades indígenas, entre otros, tomando en consideración sus circunstancias y necesidades, a fin de contribuir a generar conocimiento y acciones que potencien su desarrollo integral e inclusión plena. f. Inclusión de la población Afromexicana, Indígena e Igualdad de Género\nEl Programa, incluirá a la Población Afromexicana e Indígena del estado de Guerrero que requiera apoyo institucional en caso de ser afectados por la ocurrencia de fenómenos destructivos naturales y/o antropogénicos; promoviendo relaciones de respeto y dialogo que eviten conductas y actitudes de exclusión, discriminación y violencia en concordancia con los estándares de la CNDH.\nEMERGENCIA O DESASTRE a los beneficios de este programa en igualdad de condiciones; privilegiando, en su caso, la inclusión de medidas especiales de carácter temporal (acciones afirmativas), para solucionar las condiciones inmediatas en la vida de las mujeres, y medidas estratégicas que tiendan a la valorización de la posición que las mujeres tienen en la comunidad, modifique los patrones culturales y destierre los estereotipos que ocasionan discriminación y violencia, así como medidas que aceleren el logro de la igualdad sustantiva para el ejercicio pleno de todos los derechos de las mujeres y su participación igualitaria en la inclusión productiva, en la toma de decisiones, en los procesos de implementación del programa social y en general, en el logro de los objetivos planteados en la Agenda 2030 para el desarrollo sostenible.\n(En atención a los numerales 2.1.4, 15 y 16 correspondiente a los Lineamientos para la Elaboración de las Reglas de Operación de los\nProgramas Sociales Estatales para el Periodo 2022-2027).\n9. Derechos, obligaciones y sanciones.\nBeneficiarios\nDerechos:\nLas personas que se beneficien con este Programa tendrán derecho a ser tratados con respeto, dignidad y con calidad, además de:\n• Recibir la información necesaria de manera clara y oportuna para participar en el Programa.\n• Un trato digno y respetuoso oportuno con calidad y equitativo sin discriminación alguna.\n• Reserva y privacidad de su información personal.\n• Recibir orientación y asesoría.\n• Recibir los servicios y apoyos del Programa, sin condicionamiento alguno, salvo los requisitos que se deben cubrir y que están debidamente establecidos en sus reglas de operación\n• Ser informado de la situación que guarde su solicitud.\n• Ser atendida o atendido con equidad, respeto y cordialidad.\n• Que ninguna persona condicione la entrega de apoyos o beneficios del programa.\n•\nObligaciones:\n• Dar cumplimiento a las Reglas de Operación del Programa.\n• Proporcionar la información socioeconómica bajo protesta de decir verdad que les sea requerida por el SEDIF Guerrero, en los términos que establezca la normatividad correspondiente.\n• Utilizar las canastas alimentarias de manera adecuada y para los fines para los que se le otorgaron y fueron autorizados evitando cualquier uso distinto de la misma.\n• Permitir visita de verificación con la finalidad de validar la información proporcionada en sus expedientes correspondientes.\n• Facilitar los trabajos de supervisión, en cualquier momento después de otorgado el apoyo.\n• Proporcionar la información que la coordinadora o el coordinador del Programa le solicite para la valoración de su solicitud, en forma clara, completa y verídica.\nEMERGENCIA O DESASTRE\n• Presentar la documentación requerida dentro del tiempo señalado.\n• Aclarar en forma precisa y satisfactoria cualquier duda relativa a la información que proporcionen, o situaciones observadas.\n• Acudir en los horarios establecidos los cuales son de lunes a viernes de 09:00 a 03:00 del día a efecto de realizar algún trámite o solicitud de apoyo, así como para solicitar información\nSanciones:\nEn caso de incumplir en las disposiciones normativas establecidas en las presentes Reglas de Operación para acceder a los beneficios que a través de estos se otorgan, perderán las prerrogativas que dichas disposiciones establecen por parte de la población beneficiada.\nFacultades y Obligaciones del SEDIF.\nFacultades:\n• Suscribir Convenios de Colaboración (Anexo 5) con los Sistemas DIF Municipales para la operación del Programa.\n• Operar el Programa en coordinación con los Sistemas DIF Municipales.\n• Buscar e impulsar la coordinación institucional para fortalecer la operación del Programa.\n• Promover la formación y operación de los Comités de Vigilancia Ciudadana para el seguimiento de los programas.\n• En caso de ser necesario el SEDIF podrá hacer la entrega directa a los beneficiarios del programa.\n• En caso de ser necesario el SEDIF podrá integrar a beneficiarios directamente al padrón del SMDIF siempre y cuando cumpla con los requisitos, así como con la solicitud para integrarse a dicho programa.\n• El SEDIF tendrá la facultad de solicitar a el SMDIF cuando sea necesario la información correspondiente al programa, así como evidencia fotográfica si se requiriera.\nObligaciones:\n• Elaborar los instrumentos para la planeación, operación, seguimiento y evaluación del Programa a nivel estatal y municipal.\n• Elaborar las Reglas de Operación para el Programa, con el propósito de transparentar y normar la distribución y entrega de los apoyos.\n• Focalizar la población objetivo del Programa, en coordinación con los SMDIF, priorizando la población en municipios, localidades o Área Geoestadística Básica (AGEB) rural, urbanas o indígenas de alto y muy alto grado de marginación, de acuerdo con los criterios establecidos en la\nEIASADC.\n• Iniciar oportunamente la operación del Programa y entregar de forma continua y sin interrupciones los apoyos, servicios y capacitaciones.\n• Fomentar la organización, motivación y continuidad de las actividades realizadas en el marco de este Programa.\nEMERGENCIA O DESASTRE\n• Capacitar, asesorar y dar seguimiento a los SMDIF en la operación del Programa\n• Dar seguimiento a la operación del Programa.\n• Informar trimestralmente a la DGADC el avance en la aplicación del recurso y operación del\nPrograma.\n• Proporcionar a la DGADC la información específica que ésta solicite, que puede ser requerida en diferentes situaciones y tiempos, así como la establecida en el Calendario Anual 2025.\n• Entregar a la DGADC la información requerida para la evaluación del Índice de Desempeño, de acuerdo con las indicaciones, formatos y calendario de entrega que en éste se señalan.\n• Concentrar e integrar los padrones de las personas beneficiarias para el Programa, operado con recurso del Ramo General 33 FAM-AS.\n• Aplicar y hacer un uso adecuado de lo dispuesto en la Guía de Imagen Gráfica para los programas de la Estrategia Integral de Asistencia Social, Alimentación y Desarrollo Comunitario 2022-2025.\n• Determinar la composición de sus canastas alimentarias y menús para este Programa, de acuerdo con los criterios de calidad nutricia establecidos en la EIASADC.\n• Adquirir los insumos alimentarios que cumplan con las Especificaciones Técnicas de Calidad (ETC), establecidas en congruencia con los criterios de la EIASADC.\n• Diseñar y coordinar la implementación de las acciones de orientación alimentaria y aseguramiento de la calidad, a fin de promover una alimentación correcta.\n• Enviar a la DGADC los resultados de los análisis post-licitación, de seguimiento y/o aquellos solicitados por la misma, para verificar el cumplimiento de los parámetros de calidad e inocuidad.\n• En la papelería y documentación oficial del Programa deberá incluir la siguiente leyenda: “Este programa es público, ajeno a cualquier partido político, queda prohibido el uso para fines distintos a los establecidos ene l programa”.\nObligaciones del SMDIF:\n• Celebrar el convenio de colaboración con el SEDIF, con el fin de operar el Programa.\n• Implementar acciones de orientación y educación alimentaria, aseguramiento de la calidad, así como de organización y participación comunitaria.\n• Operar el Programa, con observancia y apego a las ROP emitidas por el SEDIF y lo establecido en el convenio de colaboración firmada entre ambos.\n• Generar los informes correspondientes sobre la operación del Programa.\n• Integrar, actualizar y entregar los padrones de beneficiarios del Programa al SEDIF.\n• El SMDIF se compromete recoger en tiempo y forma los insumos alimentarios en las bodegas regionales que les correspondan, presentando identificación oficial del representante del SMDIF.\nCausales de Suspensión o Baja de las Personas Beneficiadas.\n• Incumplir en las disposiciones normativas establecidas en las Presentes Reglas de Operación para acceder a los beneficios que a través de estos se otorgan, perderán las prerrogativas que dichas disposiciones establecen por parte de la población beneficiada.\n• Presentar documentación alterada.\n• Utilizar el apoyo alimentario para fines distintos a los establecidos en el Programa.\nEMERGENCIA O DESASTRE\nProceso de Baja.\nEn caso de que se presente la suspensión, actualización o baja definitiva de alguna persona beneficiaria pertenecientes al padrón se deberá proceder de la siguiente manera:\n• El SMDIF notificará por escrito al Sistemas Estatal DIF de manera obligatoria, la relación de las personas o persona que cause baja definitiva, los motivos y a partir de que fechas causaran efecto.\n• Los SMDIF notificarán por escrito a la persona, mencionando las causas y fecha de baja.\n• El Sistema Estatal DIF procederá a incorporar a las personas beneficiarias que se encuentren dentro de la base de datos de beneficiarios de la población objetivo, con la finalidad de que las metas sean cumplidas y en consecuencia los recursos sean ejercidos en su totalidad.\n• El SMDIF está obligado a sustituir de manera inmediata al beneficiario que falleciera durante el ejercicio, así como informar al SEDIF de dicha sustitución y anexar la documentación de nuevo beneficiario que ocupara su lugar.\n• Así como el SEDIF tendrá plena autoridad de dar de baja a un beneficiario en caso de que este no cumpla con los requisitos o que viole las reglas de operación de dicho Programa\n(En atención a los numerales 8.3, 12,12.1, 12.2 y 14.5 correspondiente a los Lineamientos para la Elaboración de las Reglas de Operación de los Programas Sociales Estatales para el Periodo 2022-2027).\n10. Instancias participantes.\nSFP. Instancia Normativa Federal.\nSEDIF. Instancia Ejecutora y Normativa.\nSEPLADER. Instancia responsable de autorizar los recursos y Reglas de Operación.\nSEFINA. Instancia responsable de liberar los recursos.\n(En atención al numeral 13 correspondiente a los Lineamientos para la Elaboración de las Reglas de Operación de los Programas Sociales\nEstatales para el Periodo 2022-2027).\n10.1. Instancias ejecutoras.\nLa instancia ejecutora será el Sistema DIF Guerrero, a través de la Dirección de Asistencia Alimentaria y\nDesarrollo Comunitario, en coordinación con los SMDIF, quienes deberán operar el Programa con apego a la programación, presupuestación, calendario de ejecución, ejercicio y control del gasto público.\n(En atención al numeral 9.1 correspondiente a los Lineamientos para la Elaboración de las Reglas de Operación de los Programas\nSociales Estatales para el Periodo 2022-2027).\n10.2. Instancia normativa estatal.\nLa instancia normativa estatal es el SEDIF Guerrero, quien definirá a través de la publicación de las Reglas de Operación los aspectos que regularan la ejecución del Programa.\n(En atención al numeral 13.1 correspondiente a los Lineamientos para la Elaboración de las Reglas de Operación de los Programas\nSociales Estatales para el Periodo 2022-2027).\nEMERGENCIA O DESASTRE\n10.3. Instancia normativa federal.\nAl tratarse de recursos federales transferidos de hacienda federal a hacienda estatal le corresponde, al\nSistema Nacional DIF a través de la DGADC, ser la Instancia Normativa Federal, por medio de la EIASADC vigente, con fundamento en la estructura programática del FAM-AS del Presupuesto de Egresos de la\nFederación para el Ejercicio Fiscal 2025.\n11. Coordinación institucional.\n11.1. Prevención de duplicidades.\nEl SEDIF Guerrero, establecerá los mecanismos de coordinación necesarios para garantizar que sus programas y acciones no se contrapongan, afecten o presenten duplicidades con otros programas o acciones del gobierno estatal; la coordinación institucional y vinculación de acciones busca potenciar el impacto de los recursos, fortalecer la cobertura de las acciones, detonar la complementariedad y reducir gastos administrativos.\n11.2. Convenios de colaboración.\nEl SEDIF Guerrero celebrará un convenio de colaboración con los Ayuntamientos Municipales o con los\nSistemas DIF Municipales, según corresponda, permitiendo manifestar la voluntad y compromiso para desarrollar actividades de cooperación mutua en beneficio del Programa. Definiendo con claridad el programa, la modalidad y plazos de entrega de los apoyos, así como los compromisos de las partes que sean aplicables. El contenido deberá ser congruente con las Reglas de Operación del Programa.\nLa celebración del convenio debe realizarse a más tardar el 30 de abril del 2025, o no más de 30 días naturales después de la publicación de las ROP de este Programa en el Periódico Oficial del Gobierno del\nEstado de Guerrero.\nLa vigencia del convenio deberá ser al 31 diciembre del 2025 con el fin de cumplir con el principio de anualidad presupuestaria establecido en el Presupuesto de Egresos de la Federación 2025.\n11.3. Colaboración.\nCon la finalidad de fortalecer los objetivos del Programa, el SEDIF Guerrero establecerá los mecanismos desarrollen programas y acciones de asistencia alimentaria, respetando la ejecución del presupuesto en razón de su procedencia.\n11.4. Otros recursos distintos al FAM-AS. financiamiento (ya sean fondos federales, estatales o municipales) en los términos que la normatividad vigente lo permita, siempre y cuando no se dupliquen los apoyos a la población objetivo.\nEMERGENCIA O DESASTRE\n12. Mecánica de Operación.\n12.1. Proceso. natural o antropogénico el SEDIF actuará en favor de las personas, por lo que, en virtud de la naturaleza de emergencia ante desastres, no se podrán solicitar mayores documentos a los que posean las personas afectadas.\nAsimismo, las personas que se encuentre vulnerables por la condición de emergencia podrán remitir su solicitud de apoyo en formato libre, a través de los comisarios de las localidades, de los SMDIF; esto en referencia a los requisitos de selección de personas beneficiarias establecidos en las presentes Reglas de\nOperación. disponibilidad presupuestal del Programa. correspondientes y este será entregado a su vez, directamente a las personas beneficiarias en puntos sedes ubicadas en el municipio o localidad correspondiente. en sus responsabilidades de operación, así como cuando la solicitud por de las personas afectadas se generen de manera directa.\nEMERGENCIA O DESASTRE\nLa entrega del apoyo se comprueba mediante Acta de Donación (Anexo 2) donde la o el beneficiario, firma o estampa su huella al momento de recibirlo, así como también se registra en un Padrón de Personas\nBeneficiarias (Anexo 3).\n(En atención a los numerales 9.2, 11 y 14.6 correspondiente a los Lineamientos para la Elaboración de las Reglas de Operación de los\nProgramas Sociales Estatales para el Periodo 2022-2027).\n12.2. Ejecución.\nLa Dirección de Asistencia Alimentaria y Desarrollo Comunitario envía mensualmente los reportes de cobertura y distribución del Programa, así como los reportes trimestrales de recursos ejercidos a la\nDirección General de Alimentación y Desarrollo Comunitario del Sistema Nacional DIF y de manera trimestral se remite a la Dirección de Planeación del DIF Guerrero los Avances Físicos- Financieros de las acciones ejercidas y de los resultados obtenidos del programa, quien a su vez reportará a SEPLADER de manera trimestral y a la ASE de manera semestral.\nEl presupuesto otorgado al presente Programa que no haya sido aplicado a los fines autorizados, y los recursos que por cualquier motivo no se hayan devengado al 31 de diciembre del presente ejercicio fiscal, serán reintegrados inmediatamente a la instancia normativa del ejercicio y control del gasto público, es decir a la Tesorería de la Federación.\nEl SMDIF se obliga a recibir y conservar en sus archivos la documentación comprobatoria de la entrega de los apoyos de los programas alimentarios proporcionados por el SEDIF, documentación que, aunado a lo anterior, también deberá remitir un tanto en tiempo y forma al SEDIF para su comprobación y resguardo correspondiente conforme las disposiciones normativas establecidas en las presentes Reglas de\nOperación. En caso de que el SMDIF incumpla tal disposición, se suspenderá inmediatamente la entrega de la canasta alimentaria, dando vista a las autoridades competentes sobre tal situación, para que se proceda conforme a derecho y deslindar cualquier tipo de responsabilidad. Asimismo, y en lo sucesivo el\nSMDIF no será tomado en cuenta para ser partícipe de los programas alimentarios que otorga el SEDIF.\n(En atención a los numerales 7.2, 7.3 y 7.4 correspondiente a los Lineamientos para la Elaboración de las Reglas de Operación de los\nProgramas Sociales Estatales para el Periodo 2022-2027).\n12.3. Causa de fuerza mayor.\nEn caso de ocurrir alguna situación extraordinaria que impida la operación normal del Programa (cambio en la modalidad y lugar de la entrega), el Sistema Estatal DIF Guerrero notificará a las personas beneficiadas a fin de brindar alternativas que permitan dar continuidad al suministro de alimentos.\nEn caso de que exista una declaratoria de Emergencia o Desastre, el SEDIF adelantará la entrega de desastre natural.\nEn todos los casos, la atención brindada a través de este Programa deberá otorgarse en el marco del principio de protección a la primera infancia y del interés superior de la niñez, contribuyendo a aliviar el dolor y el impacto social, así como psicológico después de un desastre, fortaleciendo la resiliencia en la población afectada.\nEMERGENCIA O DESASTRE\n(En atención a los numerales 8.1 y 8.2 correspondiente a los Lineamientos para la Elaboración de las Reglas de Operación de los Programas Sociales Estatales para el Periodo 2022-2027).\n13. Evaluación, seguimiento y control.\n13.1. Información presupuestaria.\nDentro de la política de desarrollo social, el SEDIF, opera el Programa de Atención Alimentaria a Personas en Situación de Emergencia o Desastre, subsidiado a través de recursos provenientes del Ramo 33.Aportaciones Federales para Entidades Federativas y Municipios, específicamente del Fondo de\nAportaciones Múltiples (Asistencia Social) del cual se destinan $30,928,560.00 (Treinta Millones, Novecientos Veintiocho Mil, Quinientos Sesenta Pesos 00/100 M.N.), de acuerdo con una adecuación presupuestaria compensada con base en el Presupuesto de Egresos para el Ejercicio Fiscal 2025.\nLa meta física para el año 2025 es llegar a entregar 69,000 canastas alimentarias de acuerdo con el presupuesto destinado para este programa.\nRO FEBRERO MARZO ABRIL MAYO JUNIO\n2,577,380 2,577,380 2,577,380 2,577,380 2,577,380 2,577,380\n2,577,380 2,577,380 2,577,380 2,577,380 2,577,380 2,577,380\nDe acuerdo con el artículo 40 de la Ley de Coordinación Fiscal que mandata el uso del FAM-AS para el del 3% del total del recurso asignado para el ejercicio fiscal\n2025.\n(En atención a los numerales 4, 5 y 5.1 correspondiente a los Lineamientos para la Elaboración de las Reglas de Operación de los\nProgramas Sociales Estatales para el Periodo 2022-2027).\nEMERGENCIA O DESASTRE\nEMERGENCIA O DESASTRE\n13.2. Evaluación. de acuerdo con la metodología del marco lógico, los cuales serán realizados por la Dirección de Planeación los informes correspondientes.\n(En atención a los numerales 10 y 10.1 correspondiente a los Lineamientos para la Elaboración de las Reglas de Operación de los\nProgramas Sociales Estatales para el Periodo 2022-2027).\n13.3. Control y auditoría.\nControl.\nEMERGENCIA O DESASTRE programa, de igual manera podrá hacer visitas de supervisión de manera aleatoria a municipios, o por medio de solicitud de visita del comité de vigilancia ciudadana.\n(En atención a los numerales 10.2 correspondiente a los Lineamientos para la Elaboración de las Reglas de Operación de los\nProgramas Sociales Estatales para el Periodo 2022-2027).\nAuditoría. aplicables y podrán ser auditado por la Secretaria Anticorrupción y Buen Gobierno, Auditoría Superior de la Federación como órganos fiscalizadores de la Federación y la SCyTG, así como por la Auditoría Superior del Estado, conforme a la legislación vigente y en el ámbito de sus respectivas competencias.\nEl SEDIF Guerrero, dará todas las facilidades a dichas instancias para realizar, en el momento en que lo juzguen pertinentes, las auditorías que consideren necesarias; asimismo, harán el seguimiento y solventará en tiempo y forma las observaciones realizadas por los órganos de control.\n(En atención a los numerales 10.3 correspondiente a los Lineamientos para la Elaboración de las Reglas de Operación de los Programas\nSociales Estatales para el Periodo 2022-2027).\nEMERGENCIA O DESASTRE\n13.4. Indicadores de Resultados.\nEMERGENCIA O DESASTRE\nEMERGENCIA O DESASTRE\nEMERGENCIA O DESASTRE\nEMERGENCIA O DESASTRE\n14. Transparencia.\n14.1. Difusión.\nDe acuerdo con el artículo 70, capítulo II De las Obligaciones de transparencia comunes, de la Ley General dará a conocer las Reglas de Operación del Programa donde se detallan los requisitos de acceso y atribuciones y responsabilidades de las instancias participantes en su ejecución.\nEstas Reglas de Operación se difundirán para su consulta en el Portal Oficial del DIF Guerrero, así como el Periódico Oficial del Gobierno del Estado de Guerrero.\nDe las cuales sus links son los siguientes:\nPara el DIF Guerrero. https://transparencia.guerrero.gob.mx/transparencia/fraccion-i-el-marco-normativo-aplicable-al-sujetoobligado-20/\nPara el Periódico Oficial del Gobierno del Estado de Guerrero. https://periodicooficial.guerrero.gob.mx/\nPara solicitar información sobre el Programa podrá acudir también al SEDIF Guerrero, a las oficinas de la\nDirección de Asistencia Alimentaria y Desarrollo Comunitario ubicadas en Avenida Gabriel Leyva s/n esq.\nRuffo Figueroa, colonia Burócratas, C.P. 39090, Chilpancingo de los Bravo, Guerrero.\n(En atención al numeral 14.1 correspondiente a los Lineamientos para la Elaboración de las Reglas de Operación de los Programas\nSociales Estatales para el Periodo 2022-2027).\n14.2. Padrones de beneficiarios.\nEl formato de padrón físico y digital (Anexo 3) de personas beneficiarias del Programa, será proporcionado por el Sistema SEDIF a los Sistemas DIF Municipales, para que a su vez lo distribuyan a cada una de las directoras o directores de los planteles escolares beneficiados, los Sistemas DIF Municipales en coordinación con las autoridades educativas recaban la información, en caso de que las autoridades educativas incumplan con lo establecido, los Sistemas DIF Municipales tendrán la responsabilidad de llevar a cabo esta actividad a fin de entregar la información en las fechas establecidas por el SEDIF.\nUna vez concluido el padrón de personas beneficiarias correspondiente al primer mes del ejercicio fiscal, los Sistema DIF Municipales remitirán para su revisión y validación al SEDIF, en formato físico y en digital entregadas para los municipios de la entidad, conformando así el Padrón Único del estado de Guerrero.\nEMERGENCIA O DESASTRE\nEl Sistema DIF Municipales, resguardará los padrones de personas beneficiarias en físico y digital de todos los meses entregados durante el ejercicio presupuestal 2025.\nEl padrón único del estado de Guerrero deberá llenarse de acuerdo con las primeras 21 variables de Operación del Sistema Integral de Información de Padrones de Programas Gubernamentales (SIIPP-\nG), publicado en el Diario Oficial de la Federación el 13 de septiembre del 2018.\nLa Dirección General de Alimentación y Desarrollo Comunitario (DGADC), en coordinación con el enlace interinstitucional del SNDIF ante la SFP para el SIIPP-G, podrá determinar si los padrones de la EIASADC se integrarán al SIIPP-G; así como los mecanismos para hacerlo.\nEl SEDIF y los Sistemas DIF Municipales informarán a las personas beneficiarias que los datos personales recabados serán protegidos en términos de los principios de protección de datos personales contenidos en la ley de la materia y demás normativas aplicables, de acuerdo a lo establecido en los artículos 12 y 14 de la Ley de Protección de Datos Personales en Posesión de Sujetos Obligados (particulares) (DOF, 26 enero del 2017).\n(En atención a los numerales 8.4 y 14.3 correspondiente a los Lineamientos para la Elaboración de las Reglas de Operación de los\nProgramas Sociales Estatales para el Periodo 2022-2027).\n14.3. Quejas, denuncias y solicitudes de información.\nLa población beneficiada puede presentar quejas, denuncias y solicitudes de información ante las instancias correspondientes sobre cualquier hecho, acto u omisión que produzca o pueda producir daños al ejercicio de sus derechos establecidos en las presentes Reglas de Operación o contravengan sus disposiciones y de la demás normatividad aplicable, en:\na). El Sistema DIF Guerrero\nTeléfonos: (747) 47-1-84-90 o 47-1-84-92\nCorreo electrónico: buzon.dif@guerrero.gob.mx\nDomicilio: Centro de Rehabilitación Integral Guerrero, Boulevard René Juárez Cisneros S/N, colonia Ciudad de los Servicios. Chilpancingo de los Bravo, Guerrero.\nC.P. 39095.\nb) La Secretaría de Contraloría y Transparencia Gubernamental. ubicado en el número 62, en Boulevard René Juárez Cisneros de la Ciudad de los Servicios C.P. 39075. podrán presentarse por escrito, por comparecencia de la persona beneficiaria, por correo electrónico o vía telefónica y deberá proporcionar los siguientes datos: nombre del servidor público, área de adscripción, objeto de la denuncia, nombre y domicilio de la persona quejosa e identificación oficial.\nEMERGENCIA O DESASTRE\n(En atención a los numerales 14.4 correspondiente a los Lineamientos para la Elaboración de las Reglas de Operación de los Programas\nSociales Estatales para el Periodo 2022-2027).\n14.4. Comités de Vigilancia Ciudadana.\nDesastre, de acuerdo a la EIASADC 2025, no aplicará el apartado de comités.\n(En atención al numeral 14.2 correspondiente a los Lineamientos para la Elaboración de las Reglas de Operación de los Programas\nSociales Estatales para el Periodo 2022-2027).\n14.5. Mecanismos de Corresponsabilidad.\nEl Programa no aplicará ningún mecanismo de corresponsabilidad otorgándose el apoyo de forma gratuita a los beneficiarios.\nSe adicionan los siguientes numerales en atención a los Lineamientos para la Elaboración de las\nReglas de Operación de los Programas Sociales Estatales para el Periodo 2022-2027.\n15. Acciones Contra el SARS-COV 2.\nEn atención a la pandemia por COVID–19, el SEDIF Guerrero implementará las medidas siguientes:\n• Durante la distribución de insumos se deben mantener las condiciones de inocuidad de estos. Se recomienda que el medio de transporte cuente con la higiene y limpieza adecuada que asegure la calidad de los alimentos.\n• Previo a la entrega de la canasta alimentaria, el personal encargado de la distribución y la persona beneficiaria que recibe, deberán lavarse y/o desinfectarse las manos con gel antibacterial con base de alcohol al 60%, por lo que se recomienda que el personal de campo cuente siempre con gel antibacterial con base de alcohol al 60%.\n• Los apoyos deberán estar previamente empaquetados antes de su entrega.\n(En atención al numeral 17 correspondiente a los Lineamientos para la Elaboración de las Reglas de Operación de los Programas Sociales\nEstatales para el Periodo 2022-2027).\n16. Fundamento Legal.\n• Constitución Política de los Estados Unidos Mexicanos: artículos 1o, 2o apartado B, 3o fracción II inciso e) párrafo segundo, 4o párrafos primero, tercero, cuarto, noveno y décimo primero, así como\n27 fracción XX.\n• Ley General de Alimentación Adecuada y Sostenible.\n• Ley General de Salud: artículos 2 fracción V, 3 fracción XVIII, 6 fracciones X, y XI, 7 fracción XIII\nBis, 27 fracciones IX y X, 111 fracción II, 112 fracción III, 114, 115 fracciones II, IV y VII, 159\n• Ley General de Desarrollo Social: artículos 3, 6, 9, 14 fracción I, 19 fracción V, 30, y 36 fracción VII.\nEMERGENCIA O DESASTRE\n• Ley General de Educación artículo 41.\n• Ley General de los Derechos de Niñas, Niños y Adolescentes: artículos 36, 37 fracción II, 39, 50 fracciones III y VIII, 53 y 116 fracción XIV.\n• Ley General para la Igualdad entre Mujeres y Hombres: artículos 17 fracción XI, 37 fracción II y 38 fracción VI.\n• Ley Federal de Presupuesto y Responsabilidad Hacendaria: artículos 1, 2, 4, 5, 75 y 77, 85, 110,\n111.\n• Ley Federal de las Entidades Paraestatales.\n• Ley de Asistencia Social: artículos 4, 5, 6, 7, 8, 9, 10, 12 fracciones VIII, X y XIII, 14, 15, 17, 18, 20, 28 y 29.\n• Ley de Coordinación Fiscal: artículos 25 fracción V, 40, 41, 48 y 49.\n• Ley de Disciplina Financiera de las Entidades Federativas y los Municipios.\n• Ley de Planeación: artículo 2 fracción V.\n• Agenda 2030 de Naciones Unidas: objetivo 1, meta 1.1, 1.2, 1.3, 1.5, objetivo 2, meta 2.1, 2.2, 2.3, objetivo 3, metas 3.2, objetivo 4, metas 4.2, 4.7, objetivo 5, meta, 5.5, objetivo 10, meta 10.2, objetivo\n12, metas 12.3, 12.8, objetivo 16, metas 16.6, 16.7 y objetivo 17, meta 17.17.\n• Presupuesto de Egresos de la Federación 2025.\n• Estrategia Integral de Asistencia Social, Alimentación y Desarrollo Comunitario 2025.\n• Lineamientos para incorporar la perspectiva de género en las Reglas de Operación de los\nProgramas Presupuestarios Federales.\n• Lineamientos Generales para el Expendio y Distribución de Alimentos y Bebidas.\n• Preparados y Procesados en las Escuelas del Sistema Educativo Nacional.\n• Norma Oficial Mexicana NOM-014-SSA3-2013, para la asistencia social alimentaria a grupos de riesgo.\n• Norma Oficial Mexicana NOM-043-SSA2-2012, Servicios básicos de salud. Promoción y educación para la salud en materia alimentaria. Criterios para brindar orientación.\n• Norma Oficial Mexicana NOM-251-SSA1-2009, Prácticas de higiene para el proceso de alimentos, bebidas o suplementos alimenticios.\n• Norma Oficial Mexicana NOM-051-SCFI/SSA1-2010, especificaciones generales de etiquetado para alimentos y bebidas no alcohólicas pre-envasados información comercial y sanitaria.\n• Ley Número 479 del Sistema para el Desarrollo Integral de la Familia del Estado de Guerrero.\n• Ley sobre el Sistema Estatal de Asistencia Social Número 332.\n• Ley Número 812 para la Protección de los Derechos de Niñas, Niños y Adolescentes del Estado de\nGuerrero.\n• Ley Número 454 de Presupuesto y Disciplina Fiscal del Estado de Guerrero.\n• Ley Número 817 para las Personas con Discapacidad del Estado de Guerrero.\n• Ley Número 427 del Sistema de Coordinación Hacendaria del Estado de Guerrero.\n• Plan Estatal de Desarrollo 2022-2027.\nEMERGENCIA O DESASTRE\n• Decreto Número 203 del Presupuesto de Egresos del Estado de Guerrero, para el Ejercicio Fiscal\n2025.\n• Reglamento Interior del Sistema para el Desarrollo Integral de la Familia del Estado de Guerrero.\n• Manual de Organización del Sistema para el Desarrollo Integral de la Familia del Estado de\nGuerrero.\n• Lineamientos para la Elaboración de las Reglas de Operación de los Programas Sociales Estatales para el periodo 2022-2027.\n• Y todos los ordenamientos normativos aplicables.\n(En atención al numeral 2.2 correspondiente a los Lineamientos para la Elaboración de las Reglas de Operación de los Programas\nSociales Estatales para el Periodo 2022-2027).\nEMERGENCIA O DESASTRE\n17. ANEXOS.\nEn atención al numeral 18 correspondiente a los Lineamientos para la Elaboración de las Reglas de Operación de los Programas\nSociales Estatales para el Periodo 2022-2027).\nACTA DE DONACIÓN.\nSISTEMA ESTATAL PARA EL DESARROLLO\nINTEGRAL DE LA FAMILIA DIF\nFOLIO. _____\nACTA DE DONACION\nCONTRATO DE DONACIÓN QUE CELEBRAN POR UNA PARTE EL SISTEMA PARA EL DESARROLLO\nINTEGRAL DE LA FAMILIA DEL ESTADO DE GUERRERO, REPRESENTADO POR EL DIRECTOR\nGENERAL, A QUIEN EN LO SUCESIVO SE LE DENOMINARÁ “DONANTE” Y POR OTRA PARTE: DIF\nMUNICIPAL\nA QUIEN EN LO SUCESIVO SE LES DENOMINARA \"DONATARIO\", AL TENOR DE LAS SIGUIENTES\nDE ACLARACIONES Y CLÁUSULAS:\n1. EL “DONANTE” DECLARA:\n1.1 QUE EL SISTEMA PARA EL DESARROLLO INTEGRAL DE LA FAMILIA DEL ESTADO DE\nGUERRERO, AL QUE REPRESENTA, ES UN ORGANISMO PUBLICO DESCENTRALIZADO CON\nPERSONALIDAD JURÍDICA Y PATRIMONIO PROPIO, CREADO POR LA LEY 107 DE FECHA 9 DE\nMARZO DE 1977, PUBLICADA EN EL PERIÓDICO OFICIAL DEL ESTADO EL MISMO DIA Y REGULADO\nACTUALMENTE POR LA LEY SOBRE EL SISTEMA ESTATAL DE ASISTENCIA SOCIAL NUMERO\nFECHA 20 DE FEBRERO DEL 2015.\n1.2.- QUE, ENTRE OTRO, TIENE LOS SIGUIENTES OBJETIVOS:\nPROPORCIONAR EN TODOS SUS ASPECTOS LA PROMOCION DE ASISTENCIA SOCIAL.\nPROMOCIONAR EL AUXILIO Y ASISTENCIA A FAMILIAS DESAMPARADAS EN LA ENTIDAD.\n2. EL “DONATARIO” DECLARA:\n2.1 APOYO A PERSONAS DE BAJOS RECURSOS ECONÓMICOS DEL MUNICIPIO DE:\nEMERGENCIA O DESASTRE\nENTERADAS LAS PARTES DE LAS DECLARACIONES ANTERIORES, ES SU LIBRE VOLUNTAD\nOBLIGARSE A LAS SIGUIENTES:\nPRIMERA. LOS DONANTES TRANSFIEREN DE MANERA PURA Υ GRATUITAMENETE AL\nDONATARIO LOS ARTICULOS SIGUIENTES______MODULOS/DESPENSA DEL PROGRAMA\nASISTENCIA ALIMENTARIA Α PERSONAS DE__________ ATENCION PRIORITARIA (MENORES DE 2\nΑ5 AÑOS 11 MESES) DE ACUERDO ΕΝ LO ESPECIFICADO ΕΝ LA SALIDA Νο. ____________CON\nΝΟ. DE LICITACON__________________\nSEGUNDA. EL DONATARIO, ACEPTA LA DONACION HECHA A SU FAVOR POR LOS DONANTES,\nRESPECTO DE LOS ARTICULOS DESCRITOS ΕΝ LA CLASULA PRIMERA.\nTERCERA. AMBAS PARTES MANIFIESTAN SU CONFORMIDAD ΕΝ LA FIRMA DEL PRESENTE\nCONTRATO, POR ΝΟ EXISTIR VIOLENCIA DOLO, MALA FE, LESION Ο CUALQUIER OTRO VICIO\nCONSENTIMIENTO QUE PUDIERA NOTIFICAR Ο INVALIDAR ΕL ACTO QUE AQUI SE CONSIGNA.\nCONSECUENCIA LEGALES, SE FIRMA ΕΝ LA CIUDAD DE CHILPANCINGO, GRO., Α LOS _____DIAS\nDEL ΜES ____DEL ΑÑΟ DOS MIL VEINTITRES.\nEMERGENCIA O DESASTRE\nPadrón de Personas beneficiarias.\nEMERGENCIA O DESASTRE\nConvenio de colaboración.\nCONVENIO DE COLABORACIÓN DEL\nEMERGENCIA O DESASTRE\nCONVENIO DE COLABORACIÓN PARA LA OPERACIÓN DEL PROGRAMA DE ATENCIÓN\nALIMENTARIA A PERSONAS EN SITUACIÓN DE EMERGENCIA O DESASTRE, PARA EL EJERCICIO\n2025, QUE CELEBRAN POR UNA PARTE EL SISTEMA PARA EL DESARROLLO INTEGRAL DE LA\nFAMILIA DEL ESTADO DE GUERRERO, EN LO SUCESIVO “EL SEDIF”, REPRESENTADO POR SU\nDIRECTOR GENERAL, EL C. _______________, ASISTIDO POR LA DIRECTORA DE ASISTENCIA\nALIMENTARIA Y DESARROLLO COMUNITARIO C. __________________Y POR LA OTRA, EL H.\nAYUNTAMIENTO DEL MUNICIPIO DE ___________________, GUERRERO, REPRESENTADO POR SU\nPRESIDENTE(A) MUNICIPAL CONSTITUCIONAL, _______________________ Y ASISTIDO(A) POR EL\nDIRECTOR(A) DEL DIF MUNICIPAL, _____________________, EN LO SUCESIVO “EL SMDIF”, A\nQUIENES CUANDO ACTÚEN DE MANERA CONJUNTA SE LES DENOMINARÁ “LAS PARTES”, DE\nCONFORMIDAD CON LAS SIGUIENTES DECLARACIONES Y CLÁUSULAS:\nQUE LA CONSTITUCIÓN POLÍTICA DE LOS ESTADOS UNIDOS MEXICANOS, EN SU ARTÍCULO\nCUARTO, ESTABLECE QUE TODA PERSONA TIENE DERECHO A LA ALIMENTACIÓN NUTRITIVA,\nSUFICIENTE Y DE CALIDAD.\nQUE EL FONDO DE APORTACIONES MÚLTIPLES COMPONENTE ASISTENCIA SOCIAL (FAM-AS),\nFORMA PARTE DE LAS APORTACIONES FEDERALES PARA ENTIDADES FEDERATIVAS Y\nMUNICIPIOS DEL RAMO GENERAL 33, QUE ES EL MECANISMO PRESUPUESTARIO DISEÑADO\nPARA TRANSFERIR A LOS ESTADOS Y MUNICIPIOS RECURSOS QUE LES PERMITAN\nFORTALECER SU CAPACIDAD DE RESPUESTA Y ATENDER DEMANDAS DE GOBIERNO EN LOS\nRUBROS DE PROGRAMAS ALIMENTARIOS, DE ASISTENCIA SOCIAL E INFRAESTRUCTURA\nEDUCATIVA; Y QUE DICHO FONDO ESTÁ REGULADO POR LA LEY DE COORDINACIÓN FISCAL,\nPOR LA LEY FEDERAL DEL PRESUPUESTO Y RESPONSABILIDAD HACENDARIA Y EL\nPRESUPUESTO DE EGRESOS DE LA FEDERACIÓN 2025.\nESTABLECIDO EN EL ARTÍCULO 2 FRACCIÓN V DE LA LEY DE PLANEACIÓN, BUSCA LOGRAR UN\nDESARROLLO EQUILIBRADO DEL PAÍS, PROMOVIENDO LA DESCENTRALIZACIÓN DE LA VIDA\nNACIONAL.\nCOMUNITARIO (EIASADC) 2025, CAPÍTULO 2 CRITERIOS NORMATIVOS; ESTABLECE EN EL\nAPARTADO 3. CONVENIOS DE COLABORACIÓN, QUE LOS SEDIF DEBEN CELEBRAR CONVENIOS\nDE COLABORACIÓN CON LOS AYUNTAMIENTOS MUNICIPALES Y LOS SMDIF, EN EL MARCO DE\nLA OPERACIÓN DE LOS PROGRAMAS ALIMENTARIOS DERIVADOS DEL FAM-AS.\nEMERGENCIA O DESASTRE\n1. \"EL SEDIF\", DECLARA QUE:\n1.1. QUE ES UN ORGANISMO PÚBLICO DESCENTRALIZADO DE LA ADMINISTRACIÓN PÚBLICA\nESTATAL CON PERSONALIDAD JURÍDICA Y PATRIMONIO PROPIO, CON AUTONOMÍA\nADMINISTRATIVA, PUBLICADA EN EL PERIÓDICO OFICIAL DEL GOBIERNO DEL ESTADO DE\nGUERRERO, EL DÍA 9 DE MARZO DE MIL NOVECIENTOS NOVENTA Y SIETE, Y REGIDO\nACTUALMENTE POR LA LEY SOBRE EL SISTEMA ESTATAL DE ASISTENCIA SOCIAL NÚMERO 332,\nDE FECHA QUINCE DE JULIO DE MIL NOVECIENTOS OCHENTA Y SEIS.\n1.2. QUE TIENE ENTRE SUS OBJETIVOS:\n1. PROMOVER Y PRESTAR SERVICIOS DE ASISTENCIA SOCIAL.\n2. APOYAR EL DESARROLLO DE LA FAMILIA Y DE LA COMUNIDAD.\n3. REALIZAR ACCIONES DE APOYO EDUCATIVO PARA LA INTEGRACIÓN SOCIAL Y\nDE CAPACITACIÓN PARA EL TRABAJO A LOS SUJETOS DE ASISTENCIA SOCIAL.\n4. PROMOVER E IMPULSAR EL SANO CRECIMIENTO, FÍSICO, MENTAL Y SOCIAL DE LA NIÑEZ.\n5. FOMENTAR, APOYAR, COORDINAR Y EVALUAR LAS ACTIVIDADES QUE LLEVEN A CABO LAS\nINSTITUCIONES DE ASISTENCIA SOCIAL O ASOCIACIONES CIVILES Y TODO TIPO DE ENTIDADES\nPRIVADAS CUYO OBJETO SEA LA PRESTACIÓN DE SERVICIOS DE ASISTENCIA SOCIAL, SIN\nPERJUICIO DE LAS ATRIBUCIONES QUE AL EFECTO CORRESPONDAN A OTRAS DEPENDENCIAS.\n1.3. QUE ESTÁ LEGALMENTE REPRESENTADO POR EL C. ______________________, QUIEN\nOSTENTA EL CARGO DE DIRECTOR GENERAL DEL SISTEMA PARA EL DESARROLLO INTEGRAL\nDE LA FAMILIA DEL ESTADO DE GUERRERO, PERSONALIDAD QUE ACREDITA CON EL\nNOMBRAMIENTO DE FECHA QUINCE DE FEBRERO DEL DOS MIL VEINTIDÓS, EXPEDIDO POR LA\nC. GOBERNADORA DEL ESTADO DE GUERRERO, ___________________________, Y SIGNADO POR\nEL ________________________________________________\n1.4. QUE, EN EL EJERCICIO DE SUS FUNCIONES Y ATRIBUCIONES, CUENTA CON LAS\nFACULTADES NECESARIAS PARA SUSCRIBIR EL PRESENTE CONVENIO, DE CONFORMIDAD CON\nLO ESTABLECIDO EN EL ARTÍCULO 30 FRACCIÓN VII, DE LA LEY SOBRE EL SISTEMA ESTATAL DE\nASISTENCIA SOCIAL No. 332, POR LO QUE PUEDE CELEBRAR LOS CONVENIOS, CONTRATOS Y\nDEL SISTEMA PARA EL DESARROLLO INTEGRAL DE LA FAMILIA DEL ESTADO DE GUERRERO.\n1.5. QUE DE CONFORMIDAD CON LA FRACCIÓN I DEL ARTÍCULO 31 DEL REGLAMENTO INTERIOR\nDEL SISTEMA PARA EL DESARROLLO INTEGRAL DE LA FAMILIA DEL ESTADO DE GUERRERO,\nALIMENTARIA, REPRESENTADA EN ESTE ACTO POR LA ___________, DIRECTORA DE ASISTENCIA\nALIMENTARIA Y DESARROLLO COMUNITARIO DE “EL SEDIF” ACREDITA SU PERSONALIDAD CON\nEL NOMBRAMIENTO DE FECHA __________________ EXPEDIDO POR EL C.\nEMERGENCIA O DESASTRE\n_______________________, DIRECTOR GENERAL DEL SISTEMA PARA EL DESARROLLO INTEGRAL\nDE LA FAMILIA DEL ESTADO DE GUERRERO.\n1.6 QUE SEÑALA COMO SU DOMICILIO EL UBICADO EN AV. GABRIEL LEYVA ESQUINA CON RUFFO\nFIGUEROA, SIN NÚMERO, COLONIA BURÓCRATAS, EN CHILPANCINGO DE LOS BRAVO,\nGUERRERO. C.P. 39090.\n2. \"EL SMDIF\", DECLARA QUE:\n2.1. ES LA INSTANCIA QUE ATIENDE LA ASISTENCIA SOCIAL EN EL MUNICIPIO DE ATENANGO DEL\nRÍO, CON APOYO DEL H. AYUNTAMIENTO MUNICIPAL CONSTITUCIONAL.\n2.2. TIENE ENTRE SUS OBJETIVOS: PROMOVER EL BIENESTAR SOCIAL Y PRESTAR SERVICIOS\nDE ASISTENCIA SOCIAL CON APOYO EN LAS NORMAS LEGALES QUE DICTEN LAS SECRETARÍAS\nDE SALUD, DESARROLLO SOCIAL, EDUCACIÓN, DIF NACIONAL, “EL SEDIF” Y LAS QUE EL PROPIO\nMUNICIPIO TENGA ESTABLECIDAS; PROMOVER EL DESARROLLO DE LA FAMILIA EN\nCOMUNIDADES CON MAYOR ÍNDICE DE MARGINACIÓN Y VULNERABILIDAD, IMPULSAR EL SANO\nCRECIMIENTO FÍSICO Y MENTAL DE LA NIÑEZ, DAR CUMPLIMIENTO A LOS DECRETOS,\nACUERDOS, CONVENIOS O CUALQUIER OTRA FIGURA JURÍDICA ENCAMINADA A LA OBTENCIÓN\nDE BIENESTAR SOCIAL Y DEMÁS LEYES APLICABLES, INCLUYENDO LAS ATRIBUCIONES DEL\nPRESIDENTE MUNICIPAL.\n2.3. QUE EL(LA) C. ______________, ACREDITA SU PERSONALIDAD CON LA CONSTANCIA DE\nMAYORÍA Y VALIDEZ EXPEDIDA POR EL INSTITUTO ELECTORAL Y DE PARTICIPACIÓN\nCIUDADANA DEL ESTADO DE GUERRERO CON FECHA 4, LA CUAL LO(LA) DECLARA COMO\nPRESIDENTE(A) MUNICIPAL CONSTITUCIONAL ELECTA(O) DEL MUNICIPIO DE ATENANGO DEL\nRÍO, GUERRERO.\n2.4. QUE EL (LA) ______________, QUIEN OSTENTA EL CARGO DE DIRECTOR(A) DEL SISTEMA\nMUNICIPAL PARA EL DESARROLLO INTEGRAL DE LA FAMILIA DEL MUNICIPIO DE ATENANGO DEL\nRÍO, ACREDITA SU PERSONALIDAD CON EL NOMBRAMIENTO DE FECHA_____________,\nEXPEDIDO POR EL (LA) C. __________________, PRESIDENTE(A) MUNICIPAL CONSTITUCIONAL,\nQUIEN SE ENCUENTRA FACULTADO(A) PARA CELEBRAR EL PRESENTE CONVENIO DE\nCOLABORACIÓN.\n2.5. QUE SEÑALA COMO DOMICILIO EL UBICADO EN ___________, COLONIA _________, H.\nAYUNTAMIENTO DEL MUNICIPIO DE______________, GUERRERO.\n3. “LAS PARTES” DECLARAN QUE:\n3.1. QUE MANIFIESTAN BAJO PROTESTA DE DECIR VERDAD QUE, EN LA ELABORACIÓN\nDEL PRESENTE CONVENIO DE COLABORACIÓN, NO EXISTE DOLO, ERROR, VIOLENCIA\nFÍSICA O MORAL, MALA FE, NI NINGÚN OTRO VICIO DEL CONSENTIMIENTO Y QUE ES SU\nLIBRE VOLUNTAD FORMALIZARLO.\nEMERGENCIA O DESASTRE\n3.2. QUE SE RECONOCEN MUTUAMENTE LA CAPACIDAD LEGAL Y PERSONALIDAD\nMANIFIESTAN SU VOLUNTAD DE OTORGAR Y SOMETERSE AL MISMO.\nEXPUESTO LO ANTERIOR, “LAS PARTES” SE OBLIGAN DE CONFORMIDAD CON LAS\nSIGUIENTES:\nPRIMERA. OBJETO.\nEL PRESENTE CONVENIO TIENE POR OBJETO ESTABLECER LAS BASES DE\nCOLABORACIÓN ENTRE “EL SEDIF” Y “EL SMDIF”, PARA COORDINAR LA OPERACIÓN\nDEL PROGRAMA DE ATENCIÓN ALIMENTARIA A PERSONAS EN SITUACIÓN DE\nEMERGENCIA O DESASTRE, EN ADELANTE DENOMINADO “EL PROGRAMA”, CON BASE\nEN EL RECURSO ASIGNADO A LA ENTIDAD FEDERATIVA DEL RAMO GENERAL 33, FONDO\nDE APORTACIONES MÚLTIPLES COMPONENTE ASISTENCIA SOCIAL PARA EL EJERCICIO\nFISCAL 2025.\nSEGUNDA. OBJETIVO Y POBLACIÓN OBJETIVO DEL PROGRAMA.\nEL OBJETIVO DE “EL PROGRAMA”, ES FAVORECER EL ACCESO DE LAS PERSONAS EN\nCONDICIÓN DE EMERGENCIA O DESASTRE, A ALIMENTOS INOCUOS Y NUTRITIVOS, A\nTRAVÉS DE CANASTA ALIMENTARIAS TEMPORALES, DISEÑADOS CON BASE EN\nCRITERIOS DE CALIDAD NUTRICIA Y ACOMPAÑADOS DE ACCIONES DE ORIENTACIÓN\nALIMENTARIA Y ASEGURAMIENTO DE LA CALIDAD PARA CONTRIBUIR A QUE EJERZAN\nSU DERECHO A LA ALIMENTACIÓN.\nLA POBLACIÓN OBJETIVO A LA CUAL SE DIRIGIRÍAN LAS ACCIONES DE “EL PROGRAMA”\nSERÁ LA QUE ESTABLECE LA ESTRATEGIA INTEGRAL DE ASISTENCIA SOCIAL\nALIMENTARIA Y DESARROLLO COMUNITARIO 2025, ASÍ COMO LAS REGLAS DE\nOPERACIÓN, QUE CORRESPONDE A LA SIGUIENTE:\na). PERSONAS QUE HAN SIDO AFECTADAS POR LA OCURRENCIA DE FENÓMENOS\nDESTRUCTIVOS NATURALES Y/O ANTROPOGÉNICOS QUE, POR SUS CONDICIONES\nPRIORITARIAS, REQUIEREN APOYO INSTITUCIONAL PARA ENFRENTARLOS.\nb). PERSONAS MIGRANTES Y PERSONAS EN SITUACIÓN DE CALLE.\nLA ENTREGA DEL APOYO SERÁ TEMPORAL. EN CASO DE QUE AL ACERCARSE EL FINAL\nEMERGENCIA, “EL SEDIF” PODRÁ DESTINAR LOS RECURSOS O INSUMOS DE ESTE\nPROGRAMA A OTROS PROGRAMAS DE LA EIASADC 2025.\nEMERGENCIA O DESASTRE\nEL APOYO DE “EL PROGRAMA” SE OTORGARÁ EN EL MUNICIPIO DE ATENANGO DEL RÍO,\nGUERRERO, DE ACUERDO CON EL RECURSO ANUAL PROGRAMADO Y CON LOS RESULTADOS\nDE LOS CRITERIOS Y LAS ACTIVIDADES DE FOCALIZACIÓN, QUE CONTEMPLAN LA ATENCIÓN A\nMUY ALTA MARGINACIÓN.\nTERCERA. CONFORMACIÓN DE LOS APOYOS.\nPROGRAMA DE ATENCIÓN ALIMENTARIA A PERSONAS EN SITUACIÓN DE EMERGENCIA O\nDESASTRE\nINTEGRACIÓN DE DESPENSA DEL PROGRAMA\nATENCIÓN ALIMENTARIA A PERSONAS EN SITUACIÓN DE EMERGENCIA O DESASTRE\n(PERSONAS QUE HAN SIDO AFECTADAS POR LA OCURRENCIA DE FENÓMENOS\nDESTRUCTIVOS NATURALES Y/O ANTROPOGÉNICOS, PERSONAS MIGRANTES Y\nPERSONAS EN SITUACIÓN DE CALLE)\nMARCA\nNUM PRODUCTO UNIDAD PRESENTACION CANT\nENTREGADA\n1 Frijol negro kg bolsa de 1 kg Santa Barbara 1\n2 Atún en hojuelas en agua g lata de 140 g Tuny 5\nLeche descremada\n3 ultrapasteurizada sabor natural lt brick de 1lt Lac Del 2\nPasta integral para sopa (variedad\n4 g bolsa de 200 g Millco 3 de figuras)\n5 Avena en hojuelas integral g bolsa de 500 g Dualco 1\nEMERGENCIA O DESASTRE\n6 Arroz súper extra kg bolsa de 1 kg La merced 1\n7 Lenteja g bolsa de 500 g El labrador 1\n8 Ensalada de vegetales(zanahoria) g Lata de 430 g Fresh Label 2\n9 g Lata de 425 g Altamar 1\nSardina en salsa de tomate\nCUARTA. NATURALEZA DE LOS RECURSOS.\nEL RECURSO CON QUE OPERARÁ “EL PROGRAMA” CORRESPONDEN A APORTACIONES\nFEDERALES ESTABLECIDAS EN EL PRESUPUESTO DE EGRESOS DE LA FEDERACIÓN 2025,\nPROVENIENTE DEL RAMO GENERAL 33 FONDO DE APORTACIONES MÚLTIPLES, COMPONENTE\nASISTENCIA SOCIAL (FAM-AS); POR LO QUE SU FISCALIZACIÓN Y CONTROL SERÁ REALIZADA\nPOR LA AUDITORÍA SUPERIOR DE LA FEDERACIÓN, LA SECRETARÍA ANTICORRUPCCIÓN Y BUEN\nGOBIERNO Y POR LA AUDITORÍA GENERAL DEL ESTADO DE GUERRERO, EN ESE SENTIDO, “LAS\nPARTES” SE OBLIGAN A:\na). “EL SMDIF” DESARROLLARÁ LOS SISTEMAS DE CONTROL INTERNO QUE SEAN NECESARIOS\nA EFECTOS DE ASEGURAR QUE LOS PROGRAMAS SEAN EJECUTADOS CON OPORTUNIDAD,\nECONOMÍA, PRODUCTIVIDAD, LEGALIDAD, HONESTIDAD Y TRANSPARENCIA.\nb). “EL SEDIF”, POR CONDUCTO DE SU PERSONAL OPERATIVO, REALIZARÁ LAS VISITAS DE\nSEGUIMIENTO, EVOLUCIÓN Y SI ASÍ LO REQUIERE LA ENTREGA DIRECTA DE LOS INSUMOS, CON\nLA FINALIDAD DE TRANSPARENTAR LOS RECURSOS.\nQUINTA. COMPROMISOS DE “EL SEDIF”.\nPARA LA APLICACIÓN DEL PRESENTE DOCUMENTO, “EL SEDIF”, DE LAS ATRIBUCIONES\nESTABLECIDAS EN EL APARTADO 8.1 SISTEMAS ESTATALES DIF, CAPÍTULO 2 EIASADC 2025\nCRITERIOS NORMATIVOS, TENDRÁN LAS SIGUIENTES RESPONSABILIDADES:\nI. ELABORAR, CONSIDERANDO LO ESTABLECIDO EN LA PRESENTE ESTRATEGIA Y LA DEMÁS\nNORMATIVIDAD APLICABLE, LOS INSTRUMENTOS PARA LA PLANEACIÓN, OPERACIÓN,\nMUNICIPAL.\nII. ELABORAR LAS REGLAS DE OPERACIÓN PARA CADA UNO DE LOS PROGRAMAS DE LA\nEIASADC, CON EL PROPÓSITO DE TRANSPARENTAR Y NORMAR LA DISTRIBUCIÓN Y ENTREGA\nDE LOS APOYOS, CON BASE EN EL (ANEXO T2.A), DE LA EIASADC.\nIII. CELEBRAR CONVENIOS DE COLABORACIÓN CON LOS SMDIF PARA LA OPERACIÓN DE CADA\nUNO DE LOS PROGRAMAS DE LA EIASADC, BASÁNDOSE EN EL (ANEXO T2.B) DE LA EIASADC.\nEMERGENCIA O DESASTRE\nIV. COORDINAR LA OPERACIÓN DE LOS PROGRAMAS DE LA EIASADC EN LA ENTIDAD\nFEDERATIVA CON LAS INSTANCIAS PARTICIPANTES.\nV. ADMINISTRAR Y EJERCER LOS RECURSOS PROVENIENTES DEL RAMO 33, FONDO V.I, DE\nACUERDO CON LA NORMATIVIDAD VIGENTE.\nVI. FOCALIZAR LA POBLACIÓN OBJETIVO DE CADA PROGRAMA, EN COORDINACIÓN CON LOS\nSMDIF, PRIORIZANDO LA POBLACIÓN EN MUNICIPIOS, LOCALIDADES O ÁREA GEOESTADÍSTICA\nBÁSICA (AGEB) RURAL, URBANAS O INDÍGENAS DE ALTO Y MUY ALTO GRADO DE MARGINACIÓN,\nDE ACUERDO CON LOS CRITERIOS ESTABLECIDOS EN LA PRESENTE ESTRATEGIA.\nVII. INICIAR OPORTUNAMENTE LA OPERACIÓN DE LOS PROGRAMAS DE LA EIASADC, Y\nENTREGAR DE FORMA CONTINUA Y SIN INTERRUPCIONES LOS APOYOS, SERVICIOS Y\nCAPACITACIONES.\nVIII. FOMENTAR LA ORGANIZACIÓN, MOTIVACIÓN Y CONTINUIDAD DE LAS ACTIVIDADES\nREALIZADAS EN EL MARCO DE LOS DIFERENTES PROGRAMAS.\nIX. CAPACITAR, ASESORAR Y DAR SEGUIMIENTO A LOS SMDIF EN LA OPERACIÓN DE LOS\nPROGRAMAS DE LA EIASADC ANUALMENTE.\nX. LLEVAR A CABO LOS PROCESOS DE LICITACIÓN PARA ADQUISICIÓN DE LOS INSUMOS\nDURANTE EL PRIMER TRIMESTRE DEL AÑO.\nXI. BUSCAR E IMPULSAR LA COORDINACIÓN INTERINSTITUCIONAL PARA FORTALECER LA\nOPERACIÓN DE LOS PROGRAMAS DE LA EIASADC.\nXII. DAR SEGUIMIENTO Y EVALUAR LA OPERACIÓN DE LOS PROGRAMAS DE LA EIASADC.\nXIII. PROMOVER LA FORMACIÓN Y OPERACIÓN DE LOS COMITÉS DE VIGILANCIA CIUDADANA\nPARA EL SEGUIMIENTO DE LOS PROGRAMAS.\nXIV. DE ACUERDO CON LA CIRCULAR UNO DEL 14 DE FEBRERO DE 2019, EMITIDA POR EL C.\nPRESIDENTE CONSTITUCIONAL DE LOS ESTADOS UNIDOS MEXICANOS, NO PODRÁN\nTRANSFERIRSE RECURSOS FEDERALES DEL FAM-AS A NINGUNA ORGANIZACIÓN SOCIAL,\nSINDICAL O CIVIL EN LA QUE ALGUNA DE ÉSTAS FUERA INTERMEDIARIO PARA LA ENTREGA DE\nLOS APOYOS A LAS Y LOS BENEFICIARIOS.\nXV. INFORMAR A LA DGADC Y A LAS DIVERSAS INSTANCIAS GLOBALIZADORAS EL AVANCE EN\nLA APLICACIÓN DEL RECURSO Y OPERACIÓN DE LOS PROGRAMAS DE LA EIASADC.\nXVI. PROPORCIONAR A LA DGADC LA INFORMACIÓN ESPECÍFICA QUE ÉSTA SOLICITE, QUE\nPUEDE SER REQUERIDA EN DIFERENTES SITUACIONES Y TIEMPOS, ASÍ COMO LA ESTABLECIDA\nEN EL CALENDARIO ANUAL 2025.\nXVII. ENTREGAR A LA DGADC LA INFORMACIÓN REQUERIDA PARA LA EVALUACIÓN DEL ÍNDICE\nDE DESEMPEÑO, DE ACUERDO CON LAS INDICACIONES, FORMATOS Y CALENDARIO DE\nENTREGA QUE EN ESTE SE SEÑALAN.\nXVIII. DETERMINAR LA VIABILIDAD DE ATENCIÓN A LAS SOLICITUDES DE APOYOS Y SERVICIOS\nDE LOS PROGRAMAS DE LA EIASADC POR PARTE DE LA CIUDADANÍA, TURNADAS POR LA\nDGADC, ASÍ COMO NOTIFICAR SOBRE LA RESPUESTA CORRESPONDIENTE.\nXIX. EJERCER EL RECURSO PROVENIENTE DEL FAM-AS, DENTRO DEL EJERCICIO FISCAL PARA\nEL CUAL FUE TRANSFERIDO, EVITANDO SU APLICACIÓN EN EJERCICIOS FISCALES\nPOSTERIORES.\nXX. CONCENTRAR, INTEGRAR, VALIDAR Y AUTORIZAR LOS PADRONES DE PERSONAS\nBENEFICIARIAS PARA CADA PROGRAMA OPERADO CON RECURSO DEL RAMO GENERAL 33 FAMAS.\nEMERGENCIA O DESASTRE\nXXI. PROMOVER QUE LA SELECCIÓN DE BENEFICIARIAS Y BENEFICIARIOS DE LOS PROGRAMAS\nOPERADOS CON RAMO 33 FAM-AS, SE REALICE TOMANDO EN CUENTA QUE NO HAYA\nDUPLICIDAD CON OTROS PROGRAMAS DE ASISTENCIA SOCIAL.\nXXII. APLICAR Y HACER UN USO ADECUADO DE LO DISPUESTO EN LA GUÍA DE IMAGEN GRÁFICA\nPARA LOS PROGRAMAS DE LA EIASADC.\nXXIII. DETERMINAR LA COMPOSICIÓN DE SUS CANASTAS ALIMENTARIAS Y MENÚS PARA LOS\nPROGRAMAS QUE OPERE, DE ACUERDO CON LOS CRITERIOS DE CALIDAD NUTRICIA\nESTABLECIDOS EN ESTA ESTRATEGIA.\nXXIV. ADQUIRIR LOS INSUMOS ALIMENTARIOS QUE CUMPLAN CON LAS ESPECIFICACIONES\nTÉCNICAS DE CALIDAD (ETC), ESTABLECIDAS EN CONGRUENCIA CON LOS CRITERIOS DE LA\nPRESENTE ESTRATEGIA.\nXXV. ASEGURAR EL CORRECTO ALMACENAMIENTO Y DISTRIBUCIÓN DE LOS INSUMOS, QUE\nPERMITA CONSERVAR SUS CARACTERÍSTICAS NUTRICIONALES, DE CALIDAD E INOCUIDAD,\nDESDE LA SELECCIÓN HASTA SU ENTREGA A LA PERSONA BENEFICIARIA.\nXXVI. DISEÑAR Y COORDINAR LA IMPLEMENTACIÓN DE LAS ACCIONES DE ORIENTACIÓN\nALIMENTARIA Y ASEGURAMIENTO DE LA CALIDAD, A FIN DE PROMOVER UNA ALIMENTACIÓN\nCORRECTA.\nXXVII. PROMOVER LA INCLUSIÓN Y CONSUMO DE VERDURA Y FRUTA FRESCA COMO PARTE DE\nLAS CANASTAS ALIMENTARIAS.\nXXVIII. IMPULSAR LA INSTALACIÓN Y USO DE HUERTOS ESCOLARES PEDAGÓGICOS PARA\nPROMOVER HÁBITOS ALIMENTARIOS SALUDABLES.\nXXIX. PROMOVER LA ADAPTACIÓN, INSTALACIÓN, REMODELACIÓN Y EQUIPAMIENTO DE\nESPACIOS ALIMENTARIOS.\nXXX. COORDINAR CON LAS INSTANCIAS CORRESPONDIENTES DEL SECTOR PÚBLICO, SOCIAL O\nPRIVADO, LA REALIZACIÓN DE ACCIONES DE VIGILANCIA NUTRICIONAL QUE COADYUVEN A LA\nATENCIÓN INTEGRAL DE LA POBLACIÓN BENEFICIARIA.\nXXXI. PROMOVER LA LACTANCIA MATERNA EXCLUSIVA (0 A 6 MESES DE VIDA) Y CONTINUA\n(HASTA LOS 2 AÑOS O MÁS DE VIDA), INCLUYENDO A LA POBLACIÓN EN SITUACIÓN DE\nEMERGENCIA O DESASTRE.\nXXXII. REALIZAR EN LABORATORIOS CERTIFICADOS POR ESPECIFICACIONES MEXICANA DE\nACREDITACIÓN (EMA) O COMISIÓN FEDERAL PARA LA PROTECCIÓN CONTRA RIESGOS\nSANITARIOS (COFEPRIS), LOS ANÁLISIS DE LABORATORIO POST-LICITACIÓN, DE SEGUIMIENTO\nY/O AQUELLOS SOLICITADOS POR LA DGADC.\nXXXIII. ENVIAR A LA DGADC LOS RESULTADOS DE LOS ANÁLISIS POST-LICITACIÓN, DE\nSEGUIMIENTO Y/O AQUELLOS SOLICITADOS POR LA MISMA, PARA VERIFICAR EL CUMPLIMIENTO\nDE LOS PARÁMETROS DE CALIDAD E INOCUIDAD.\nXXXIV. CAPACITAR, ASESORAR Y DAR SEGUIMIENTO A “EL SMDIF” EN LA OPERACIÓN DE “EL\nPROGRAMA”.\nXXXV. INFORMAR A “EL SMDIF” OPORTUNAMENTE LOS PERIODOS DE DISTRIBUCIÓN, LOS\nCALENDARIOS DE ENTREGA DE INSUMOS, RELACIÓN DE LOCALIDADES A BENEFICIAR,\nCONTINUA Y SIN INTERRUPCIONES LAS CANASTAS ALIMENTARIAS.\nEMERGENCIA O DESASTRE\nXXXVI. LLEVAR A CABO SESIONES PERIÓDICAS DE COORDINACIÓN CON “EL SMDIF” A FIN DE\nVALORAR LOS AVANCES EN TODOS LOS NIVELES OPERATIVOS DE “EL PROGRAMA”, PARA LA\nTOMA DE DECISIONES QUE PERMITAN EL LOGRO DE LOS MISMOS.\nXXXVII. REALIZAR VISITAS DE SEGUIMIENTO A “EL SMDIF” A FIN DE APOYAR Y BRINDAR\nASESORÍAS EN LA OPERACIÓN DE “EL PROGRAMA” Y VERIFICAR EL DESARROLLO DE LAS\nESTRATEGIAS DE ACUERDO CON LOS PROCEDIMIENTOS ESTABLECIDOS.\nXXXVIII. CONCENTRAR, AUTORIZAR E INTEGRAR LOS PADRONES DE PERSONAS BENEFICIARIAS\nDE “EL PROGRAMA”, ELABORADOS POR “EL SMDIF”, CON BASE EN EL DECRETO POR EL QUE\nSE CREA EL SISTEMA INTEGRAL DE INFORMACIÓN DE PADRONES DE PROGRAMAS\nGUBERNAMENTALES (SIIPP-G), PUBLICADO EN EL DIARIO OFICIAL DE LA FEDERACIÓN (DOF) EL\n12 DE ENERO DE 2006 Y A LAS VARIABLES MÍNIMAS CONSIDERADAS EN EL MANUAL DE\nOPERACIÓN DEL SISTEMA INTEGRAL DE INFORMACIÓN DE PADRONES DE PROGRAMAS\nGUBERNAMENTALES, PUBLICADO EN EL DOF EL 13 DE SEPTIEMBRE 2018.\nXXXIV. AL INICIO DEL EJERCICIO FISCAL, “EL SEDIF” RECEPCIONARÁ LOS PADRONES Y\nEXPEDIENTES DE LAS Y LOS BENEFICIARIOS, REMITIDOS POR “EL SMDIF”, CON EL OBJETIVO\nDE VALIDAR Y/O AUTORIZAR LA FOCALIZACIÓN DE LOS BENEFICIARIOS, TOMANDO COMO BASE\nLAS REGLAS DE OPERACIÓN.\nXXXV. ASÍ MISMO “EL SEDIF” TENDRÁ LA FACULTAD DE HACER LA ENTREGA DIRECTA DE\nCANASTA ALIMENTARIAS A BENEFICIARIAS Y BENEFICIARIOS FOCALIZADOS POR “EL SMDIF”,\nCON LA FINALIDAD DE HACER VISITAS DE SEGUIMIENTO QUE PERMITAN DAR TRANSPARENCIA\nA LA ENTREGA DE CANASTA ALIMENTARIA.\nSEXTA. COMPROMISOS DE “EL SMDIF”.\nPARA LA APLICACIÓN DEL PRESENTE INSTRUMENTO, “EL SMDIF”, DE ACUERDO CON EL\nAPARTADO 8.2 SISTEMAS MUNICIPALES DIF, CAPÍTULO 2 EIASADC 2025 CRITERIOS\nNORMATIVOS, SE COMPROMETE A LO SIGUIENTE:\nI. CELEBRAR EL CONVENIO DE COLABORACIÓN CON EL SEDIF, CON EL FIN DE OPERAR LOS\nPROGRAMAS DE LA EIASADC.\nII. PARTICIPAR DE FORMA CONJUNTA CON “EL SEDIF” EN EL ESTABLECIMIENTO DE\nMECANISMOS Y ESTRATEGIAS A SEGUIR PARA LA DETECCIÓN, SELECCIÓN, FOCALIZACIÓN Y\nATENCIÓN DE BENEFICIARIOS.\nIII. PROMOVER Y COORDINAR LA PARTICIPACIÓN COMUNITARIA EN LA OPERACIÓN DE LOS\nPROGRAMAS, A TRAVÉS DE LA FORMACIÓN DE COMITÉS Y/O GRUPOS DE DESARROLLO SEGÚN\nCORRESPONDA. PARA LOS PROGRAMAS DE ASISTENCIA ALIMENTARIA, LA FORMACIÓN DE\nCOMITÉS SERA PARA LA RECEPCIÓN, PREPARACIÓN, ENTREGA Y VIGILANCIA DE LAS\nCANASTAS ALIMENTARIAS.\nIV. IMPLEMENTAR ACCIONES DE ORIENTACIÓN Y EDUCACIÓN ALIMENTARIA, ASEGURAMIENTO\nDE LA CALIDAD, ASÍ COMO DE ORGANIZACIÓN Y PARTICIPACIÓN COMUNITARIA.\nV. PARTICIPAR, EN COORDINACIÓN CON “EL SEDIF”, EN LA ADQUISICIÓN DE ALIMENTOS\nFRESCOS PARA COMPLEMENTAR LOS MENÚS Y CANASTA ALIMENTARIA.\nEMERGENCIA O DESASTRE\nVI. OPERAR LOS PROGRAMAS DESCRITOS EN LA PRESENTE ESTRATEGIA, CON OBSERVANCIA\nY APEGO A LAS ROP EMITIDAS POR “EL SEDIF” Y LO ESTABLECIDO EN EL CONVENIO DE\nCOLABORACIÓN FIRMADO ENTRE AMBOS.\nVII. IMPULSAR LA COORDINACIÓN CON LAS INSTANCIAS CORRESPONDIENTES DEL SECTOR\nPÚBLICO SOCIAL O PRIVADO PARA FORTALECER LA OPERACIÓN DE LOS PROGRAMAS DE LA\nEIASADC.\nVIII. INTEGRAR, ACTUALIZAR Y ENTREGAR LOS PADRONES DE BENEFICIARIOS DE “EL\nPROGRAMA” EN LAS FECHAS ESTABLECIDAS POR “EL SEDIF” PARA ESTAR EN CONDICIONES\nDE DAR CUMPLIMIENTO A LOS TIEMPOS DEL CALENDARIO ENTREGA DE INFORMACIÓN\nESTABLECIDOS POR EL “SNDIF”.\nIX. EL SMDIF SE OBLIGA A RECIBIR Y CONSERVAR EN SUS ARCHIVOS LA DOCUMENTACIÓN\nCOMPROBATORIA DE LA ENTREGA DE LOS APOYOS DE LOS PROGRAMAS ALIMENTARIOS\nPROPORCIONADOS POR EL SEDIF, DOCUMENTACIÓN QUE, AUNADO A LO ANTERIOR, TAMBIÉN\nDEBERÁ REMITIR UN TANTO EN TIEMPO Y FORMA AL SEDIF PARA SU COMPROBACIÓN Y\nRESGUARDO CORRESPONDIENTE CONFORME LAS DISPOSICIONES NORMATIVAS\nESTABLECIDAS EN LAS PRESENTES REGLAS DE OPERACIÓN. EN CASO DE QUE EL SMDIF\nINCUMPLA TAL DISPOSICIÓN, SE SUSPENDERÁ INMEDIATAMENTE LA ENTREGA DE LAS\nCANASTAS ALIMENTARIAS, DANDO VISTA A LAS AUTORIDADES COMPETENTES SOBRE TAL\nSITUACIÓN, PARA QUE SE PROCEDA CONFORME A DERECHO Y DESLINDAR CUALQUIER TIPO\nDE RESPONSABILIDAD. ASIMISMO, Y EN LO SUCESIVO EL SMDIF NO SERÁ TOMADO EN CUENTA\nPARA SER PARTÍCIPE DE LOS PROGRAMAS ALIMENTARIOS QUE OTORGA EL SEDIF.\nX. EN CASO DE CONTAR CON UN ALMACÉN, ASEGURARSE QUE SEA ADECUADO Y ESTÉ\nDESTINADO EXCLUSIVAMENTE AL ALMACENAMIENTO DE INSUMOS ALIMENTARIOS.\nXI. VERIFICAR, AL MOMENTO DE LA RECEPCIÓN DE INSUMOS ALIMENTICIOS, LA FECHA DE\nCADUCIDAD, PRESENTACIÓN Y CANTIDADES DE LOS INSUMOS, DE MODO QUE CUMPLAN CON\nLO PROGRAMADO POR “EL SEDIF” Y, EN CASO DE EXISTIR ANOMALÍAS, NO RECIBIR LOS\nPRODUCTOS Y NOTIFICAR DE FORMA INMEDIATA A “EL SEDIF”.\nXII. UNA VEZ INICIADA LA ENTREGA DE CANASTA ALIMENTARIA, RECOGER LOS INSUMOS DEL\nPROGRAMA, EN EL ALMACÉN REGIONAL QUE LE CORRESPONDA Y COMPROMETIÉNDOSE A\nRECIBIRLOS, LOS PRIMEROS 5 DÍAS DEL MES.\nPOSTERIOR A LA RECEPCIÓN DE INSUMOS, “EL SMDIF” CONTARÁ CON UN PERIODO DE 10 DÍAS\nNATURALES PARA CUMPLIR CON SU CALENDARIO DE ENTREGAS A LA POBLACIÓN\nBENEFICIARIA.\nXIII. DIFUNDIR LA EXISTENCIA DE LOS PROGRAMAS, PREFERENTEMENTE EN LAS LOCALIDADES\nDE ALTO Y MUY ALTO GRADO DE MARGINACIÓN.\nXIV. EN EL ENTENDIDO QUE DE INCUMPLIR CON LA OBLIGACIÓN DE LA GRATUIDAD DEL\nPROGRAMA ALIMENTARIO, SERÁ SANCIONADO POR LAS AUTORIDADES CORRESPONDIENTES Y\nPROGRAMA.\nXVI. PROMOVER Y VIGILAR EL CUMPLIMIENTO DE LAS REGLAS DE OPERACIÓN DE “EL\nPROGRAMA”, ASÍ COMO DE LOS LINEAMIENTOS DE LA EIASADC 2025, ENTRE LA POBLACIÓN\nBENEFICIARIA.\nEMERGENCIA O DESASTRE\nXVII. ASISTIR A LAS CAPACITACIONES Y REUNIONES QUE CONVOQUE “EL SEDIF” CON EL\nEJECUCIÓN DE “EL PROGRAMA”.\nXVIII. DETERMINAR LA POBLACIÓN POTENCIAL EN SU MUNICIPIO DEL PROGRAMA ALIMENTARIO\nEN BASE A LAS CARACTERÍSTICAS DE LA POBLACIÓN OBJETIVO DETERMINADA POR LA EIASADC\n2025.\nXV. “EL SMDIF” SE COMPROMETE A INTEGRAR, RESGUARDAR Y ACTUALIZAR LOS PADRONES Y\nEXPEDIENTES DE BENEFICIARIAS Y BENEFICIARIOS DEL PROGRAMA ALIMENTARIO DURANTE EL\nPRESENTE AÑO 2025. CONSIDERANDO QUE DURANTE EL PRESENTE EJERCICIO FISCAL,\nPUEDEN LLEGAR A SURGIR BAJAS Y/O ALTAS DE BENEFICIARIOS, LAS CUALES DEBEN SER\nREPORTADAS DE MANERA INMEDIATA AL SEDIF GUERRERO.\nXVI. EL SMDIF, TENDRÁ LA OBLIGACIÓN DE REMITIR DE MANERA DEBIDAMENTE REQUISITADA\nAL SEDIF LOS INFORMES DE RECEPCIÓN DE CANASTAS ALIMENTARIAS PARA GARANTIZAR LA\nVIGILANCIA CIUDADANA, EN LOS TIEMPOS QUE SEA REQUERIDO POR EL SEDIF.\nSÉPTIMA. DIFUSIÓN Y DIVULGACIÓN.\n“LAS PARTES” SE COMPROMETEN A QUE LA DIFUSIÓN Y DIVULGACIÓN QUE SE REALICE POR\nMEDIOS IMPRESOS, ELECTRÓNICOS, ESCRITOS, GRÁFICOS Y DE CUALQUIER OTRA ÍNDOLE\nINHERENTE A “EL PROGRAMA” DEL CUAL DERIVA EL PRESENTE CONVENIO, ASÍ COMO EL\nETIQUETADO DE LOS INSUMOS, DEBERÁ ANUNCIAR LA SIGUIENTE LEYENDA:\n\"ESTE PROGRAMA ES PÚBLICO, AJENO A CUALQUIER PARTIDO POLÍTICO. QUEDA PROHIBIDO EL\nUSO PARA FINES DISTINTOS A LOS ESTABLECIDOS EN EL PROGRAMA\".\nARTÍCULO 28 NUMERAL II, FRACCIÓN A) DEL PRESUPUESTO DE EGRESOS DE LA FEDERACIÓN\nPARA EL EJERCICIO FISCAL 2025.\nASIMISMO, CUMPLIRÁN CON LO ESTABLECIDO EN EL NUMERAL 5 IMAGEN GRÁFICA Y DIFUSIÓN\nDE LA EIASADC 2025 Y SEÑALARÁN EXPRESAMENTE Y EN FORMA IDÉNTICA LA PARTICIPACIÓN\nDEL “EL SEDIF” Y EL APOYO DEL GOBIERNO FEDERAL, A TRAVÉS DEL SISTEMA NACIONAL PARA\nEL DESARROLLO INTEGRAL DE LA FAMILIA.\nOCTAVA. REPRESENTANTES DE LAS PARTES.\nINSTRUMENTO JURÍDICO, “LAS PARTES” DESIGNAN COMO SUS RESPECTIVOS\nREPRESENTANTES A LOS SIGUIENTES FUNCIONARIOS:\nA). POR “EL SEDIF” LA PERSONA ENCARGADA DE LA DIRECCIÓN DE ASISTENCIA\nALIMENTARIA Y DESARROLLO COMUNITARIO.\nB). POR “EL SMDIF” LA PERSONA ENCARGADA DE LA DIRECCIÓN DEL SISTEMA\nMUNICIPAL DIF.\nEMERGENCIA O DESASTRE\nLAS Y LOS REPRESENTANTES TITULARES PODRÁN DESIGNAR SUPLENTES, QUIENES DEBERÁN\nCONTAR CON FACULTADES PARA TOMAR DECISIONES, LOS CUALES DEBERÁN TENER CUANDO\nMENOS, EL NIVEL JERÁRQUICO INFERIOR SIGUIENTE AL DEL REPRESENTANTE TITULAR,\nDECISIONES ADOPTADAS.\nEL CAMBIO DE RESPONSABLE SERÁ COMUNICADO A LA OTRA PARTE POR ESCRITO,\nPREVIO A LA FECHA QUE SE PRETENDA DAR EFECTO A DICHA NOTIFICACIÓN.\nNOVENA. CONTROL Y VIGILANCIA.\nEL CONTROL Y VIGILANCIA DE LOS RECURSOS FEDERALES A QUE SE REFIERE EL PRESENTE\nCONVENIO, CORRESPONDERÁ A LOS ÓRGANOS FISCALIZADORES FEDERALES Y ESTATALES\nCOMPETENTES, ASÍ COMO LA SECRETARÍA DE LA FUNCIÓN PÚBLICA Y LA AUDITORÍA SUPERIOR\nDE LA FEDERACIÓN COMO ÓRGANOS FEDERALES FISCALIZADORES.\nDÉCIMA. TRANSPARENCIA.\n“LAS PARTES” CONVIENEN EN PROMOVER Y FOMENTAR LA TRANSPARENCIA DE LA\nASIGNACIÓN Y EJERCICIO DE LOS RECURSOS A QUE SE REFIERE EL PRESENTE CONVENIO.\nCONSECUENTEMENTE, DEBERÁN LLEVAR A CABO LA INTEGRACIÓN DEL PADRÓN DE\nPERSONAS BENEFICIARIAS, ASÍ COMO DAR A CONOCER SUS AVANCES FÍSICO-FINANCIEROS EN\nLAS PÁGINAS WEB OFICIALES QUE TENGAN DISPONIBLES.\nLOS DATOS PERSONALES DE LAS Y LOS BENEFICIARIOS SERÁN PROTEGIDOS EN TÉRMINOS DE\nLA LEY FEDERAL DE TRANSPARENCIA Y ACCESO A LA INFORMACIÓN PÚBLICA, LEY GENERAL\nDE PROTECCIÓN DE DATOS PERSONALES EN POSESIÓN DE SUJETOS OBLIGADOS Y DEMÁS\nDISPOSICIONES JURÍDICAS APLICABLES.\nASIMISMO, “LAS PARTES” DARÁN CUMPLIMIENTO A LO ESTABLECIDO EN EL ARTÍCULO 40 DE LA\nLEY DE COORDINACIÓN FISCAL, QUE A LA LETRA DICE:\n“LAS ENTIDADES TENDRÁN LA OBLIGACIÓN DE HACER DEL CONOCIMIENTO DE SUS\nHABITANTES, LOS MONTOS QUE RECIBAN, LAS OBRAS Y ACCIONES REALIZADAS, EL COSTO DE\nCADA UNA, SU UBICACIÓN Y BENEFICIARIOS.\nASIMISMO, DEBERÁN INFORMAR A SUS HABITANTES, AL TÉRMINO DE CADA EJERCICIO, SOBRE\nLOS RESULTADOS ALCANZADOS.”\nDÉCIMA PRIMERA. RELACIÓN LABORAL.\nEL PERSONAL DE CADA UNA DE “LAS PARTES” QUE SEA DESIGNADO PARA LA REALIZACIÓN DE\nCUALQUIER ACTIVIDAD RELACIONADA CON ESTE CONVENIO, PERMANECERÁ EN FORMA\nESTABLECIDA SU RELACIÓN LABORAL, MERCANTIL, CIVIL, ADMINISTRATIVA O CUALQUIER\nEMERGENCIA O DESASTRE\nOTRA, POR LO QUE NO SE CREARÁ UNA SUBORDINACIÓN DE NINGUNA ESPECIE CON LA PARTE\nOPUESTA, NI OPERARÁ LA FIGURA JURÍDICA DE PATRÓN SUSTITUTO O SOLIDARIO; LO\nANTERIOR, CON INDEPENDENCIA DE ESTAR PRESTANDO SUS SERVICIOS FUERA DE LAS\nSUPERVISIÓN DE LOS TRABAJOS QUE SE REALICEN.\nDÉCIMA SEGUNDA. MODIFICACIONES.\nEL PRESENTE CONVENIO PODRÁ SER MODIFICADO DURANTE SU VIGENCIA, PREVIO ACUERDO\nDE “LAS PARTES”. LAS MODIFICACIONES O ADICIONES SE HARÁN CONSTAR POR ESCRITO,\nSURTIENDO SUS EFECTOS A PARTIR DEL MOMENTO DE SU SUSCRIPCIÓN.\nDÉCIMA TERCERA. VIGENCIA.\nEL PRESENTE CONVENIO TENDRÁ VIGENCIA A PARTIR DE LA FECHA DE SU FIRMA Y HASTA EL\n31 DE DICIEMBRE DE 2025. EN BASE EN EL PRINCIPIO DE ANUALIDAD PRESUPUESTAL.\nEL INSTRUMENTO PODRÁ DARSE POR TERMINADO CUANDO ASÍ LO DETERMINEN “LAS PARTES”\nPOR MUTUO ACUERDO O CUANDO UNA DE ELLAS SE LO COMUNIQUE A LA OTRA MEDIANTE\nESCRITO, CON TREINTA DÍAS NATURALES DE ANTICIPACIÓN, EN EL ENTENDIDO DE QUE LAS\nACTIVIDADES QUE SE ENCUENTREN EN EJECUCIÓN DEBERÁN SER CONCLUIDAS, SALVO\nACUERDO CONTRARIO.\nDÉCIMA CUARTA. DE LA ADQUISICIÓN Y DISTRIBUCIÓN DE LOS INSUMOS.\n“EL SEDIF” DEBERÁ CONSIDERAR LOS CRITERIOS DE CALIDAD NUTRICIA, REGULANDO LA\nCONFORMACIÓN DE MENÚS Y CANASTA ALIMENTARIAS, DE MANERA QUE SIRVAN PARA UNA\nALIMENTACIÓN CORRECTA. LOS CUALES ESTÁN BASADOS EN LAS CARACTERÍSTICAS DE UNA\nDIETA CORRECTA, DE ACUERDO A LA NORMA OFICIAL MEXICANA NOM-043-SSA2-2012,\nSERVICIOS BÁSICOS DE SALUD, PROMOCIÓN Y EDUCACIÓN PARA LA SALUD EN MATERIA\nALIMENTARIA, CRITERIOS PARA BRINDAR ORIENTACIÓN Y EN LAS DISPOSICIONES\nESTABLECIDAS EN LOS “LINEAMIENTOS GENERALES PARA EL EXPENDIO O DISTRIBUCIÓN DE\nALIMENTOS Y BEBIDAS EN LOS ESTABLECIMIENTOS DE CONSUMO ESCOLAR DE LOS\nPLANTELES DE EDUCACIÓN BÁSICA” EMITIDAS POR LA SECRETARÍA DE EDUCACIÓN PÚBLICA Y\nLA SECRETARÍA DE SALUD. ASÍ MISMO “EL SEDIF” PODRÁ HACER ENTREGA DE INSUMOS\nALIMENTARIOS TEMPORALES, DISEÑADOS CON BASE EN CRITERIOS DE ORIENTACIÓN\nALIMENTARIA Y ASEGURAMIENTO DE LA CALIDAD, EN SUS DISTINTAS MODALIDADES, A LAS\nPERSONAS QUE POR SUS CONDICIONES DE VULNERABILIDAD, REQUIEREN APOYO\nINSTITUCIONAL PARA ENFRENTARLOS, “EL SEDIF” SE RESERVARA EL DERECHO DE OTORGAR\nLOS INSUMOS EN LOS TIEMPOS Y FORMA QUE CONSIDERE NECESARIOS PARA ELLO, SIN\nSOCIAL ALIMENTARIA Y DESARROLLO COMUNITARIO (EIASADC) 2025.\nDÉCIMA QUINTA. DE LOS MECANISMOS DE ENTREGA DE APOYOS.\nEMERGENCIA O DESASTRE\n“EL SMDIF” DEBERÁ ASIGNAR UN LUGAR QUE ESTÉ LIMPIO, EVITAR COLOCAR LAS CANASTAS\nALIMENTARIAS EN EL SUELO Y MANTENER EL ORDEN EN TODO MOMENTO; ASIMISMO DEBERÁ\nESTIBARSE DE MANERA TAL, QUE NO SE MALTRATEN O PROVOQUEN UN ACCIDENTE.\n“LAS PARTES” FOMENTARAN ACCIONES QUE CONTRIBUYAN A CREAR HÁBITOS DE HIGIENE\nENTRE EL PERSONAL OPERATIVO DEL “PROGRAMA”, TALES COMO, EL CORRECTO MANEJO DE\nINSUMOS, LA LIMPIEZA DE LAS UNIDADES VEHICULARES QUE TRANSPORTAN EL INSUMO. EN\nCUANTO A LAS CANASTAS ALIMENTARIAS CONSUMIDAS POR LAS Y LOS BENEFICIARIOS EN SUS\nHOGARES.\n“LAS PARTES” DEBERÁN TENER CORRESPONSABILIDAD EN LOS INVOLUCRADOS EN ESTA\nETAPA, PARA FOMENTAR ACCIONES QUE CONTRIBUYAN A CREAR HÁBITOS DE HIGIENE EN LA\nCOMUNIDAD, TALES COMO LAVADO DE MANOS, ANTES DE CONSUMIRLOS Y DESPUÉS DE IR AL\nBAÑO, ADEMÁS DEL CORRECTO MANEJO DE LOS INSUMOS. SE IMPULSARÁ A TRAVÉS DE\nPLÁTICAS, CAPACITACIONES O MATERIAL IMPRESO, PRÁCTICAS DE HIGIENE EN LA\nPREPARACIÓN Y CONSUMO DE ALIMENTOS, ASÍ COMO INFORMAR SOBRE EL RIESGO QUE\nIMPLICA PARA SU SALUD, NO LLEVARLAS A CABO.\nEL SEDIF AL LLEVAR A CABO LA ENTREGA DE CANASTA ALIMENTARIAS, A TRAVÉS DE LA\nOPERACIÓN DE LOS PROGRAMAS DE LA EIASADC, BAJO LA PREMISA DE COADYUVAR A LA\nSEGURIDAD ALIMENTARIA, DEBEN APLICAR ACCIONES DE ASEGURAMIENTO DE LA CALIDAD,\nQUE PRIVILEGIEN LA PREVENCIÓN Y ASEGUREN LA CALIDAD, INOCUIDAD Y EL MANTENIMIENTO\nDE LAS PROPIEDADES NUTRITIVAS DE TODOS LOS INSUMOS QUE CONFORMEN LAS CANASTAS\nALIMENTARIAS.\nESTO REQUIERE TAMBIÉN DE LA CORRESPONSABILIDAD DE TODOS AQUELLOS AGENTES QUE,\nADEMÁS DEL SEDIF, INTERVIENEN DE MANERA DIRECTA E INDIRECTA EN CADA UNA DE LAS\nETAPAS DE LA CADENA ALIMENTARIA (SMDIF, PRODUCTORES LOCALES, PROVEEDORES,\nBENEFICIARIOS), PARA LO CUAL ES NECESARIO DEFINIR CON CLARIDAD LAS\nRESPONSABILIDADES QUE CORRESPONDEN A CADA UNO, DE ACUERDO CON EL ÁMBITO DE SU\nCOMPETENCIA.\nLAS PARTES” ACUERDAN RESPETAR LOS PLAZOS DE ENTREGA DE LOS APOYOS EN SUS\nDISTINTAS MODALIDADES. QUE EN CASO DE QUE “EL SMDIF” NO ACUDA A RECIBIR SUS\nCANASTAS ALIMENTARIAS EN TIEMPO Y FORMA DE “EL PROGRAMA”, “EL SEDIF” SE RESERVA\nEXTRAORDINARIOS (EVENTOS ESPECIALES, DESASTRES NATURALES, ETC.).\nDÉCIMA SEXTA. DE LOS MECANISMOS DE CORRESPONSABILIDAD.\nEL APOYO DE FORMA GRATUITA A LOS BENEFICIARIOS.\nDÉCIMA SÉPTIMA. DE LAS SANCIONES.\nEMERGENCIA O DESASTRE\n“LAS PARTES” ACUERDAN QUE EN CASO DE SUSCITARSE ALGÚN CONFLICTO O\nCONVENIO.\nADEMÁS DE LO ESTABLECIDO EN EL PÁRRAFO ANTERIOR, “LAS PARTES” TENDRÁN\nRESPONSABILIDAD DE HACER DEL CONOCIMIENTO DE LAS AUTORIDADES COMPETENTES,\nCUALQUIER FALTA ADMINISTRATIVA, ACTO DE CORRUPCIÓN O COMISIÓN DE DELITO ALGUNO,\nPOR PARTE DE CUALQUIERA DE LAS Y LOS SERVIDORES PÚBLICOS RELACIONADOS CON LA\nOPERACIÓN DE “EL PROGRAMA”.\nDÉCIMA OCTAVA. CONFIDENCIALIDAD.\n“LAS PARTES” GUARDARÁN CONFIDENCIALIDAD ESTRICTA RESPECTO DE LA INFORMACIÓN\nCLASIFICADA COMO CONFIDENCIAL O RESERVADA, EN TÉRMINOS DE LA LEY GENERAL DE\nTRANSPARENCIA Y ACCESO A LA INFORMACIÓN PÚBLICA, LA LEY GENERAL DE PROTECCIÓN\nDE DATOS PERSONALES EN POSESIÓN DE SUJETOS OBLIGADOS Y DEMÁS DISPOSICIONES\nAPLICABLES A LA MATERIA, SALVO QUE SE CUENTE CON LA PREVIA AUTORIZACIÓN ESCRITA\nDE QUIEN SEA RESPONSABLE DE DICHA INFORMACIÓN, DEBIENDO ASEGURARSE QUE LA QUE\nSE PROPORCIONE POR EL PERSONAL QUE CADA UNA DESIGNE SEA MANEJADA BAJO ESTRICTA\nCONFIDENCIALIDAD. LAS OBLIGACIONES CONTEMPLADAS EN EL PÁRRAFO ANTERIOR,\nPERMANECERÁN VIGENTES Y SERÁN EXIGIBLES EN EL SUPUESTO DE QUE “LAS PARTES”\nDIERAN POR TERMINADO EL PRESENTE INSTRUMENTO JURÍDICO.\nDÉCIMA NOVENA. PUBLICIDAD DE LOS RESULTADOS.\n“LAS PARTES” POR LOS MEDIOS DE DIFUSIÓN MÁS CONVENIENTES, PROMOVERÁN Y\nDIVULGARÁN ENTRE LAS PERSONAS PROMOTORAS, EJECUTORAS E INTERESADAS EN\nGENERAL, LAS CARACTERÍSTICAS, ALCANCES Y RESULTADOS DE LA COLABORACIÓN PREVISTA\nEN EL PRESENTE CONVENIO, DE ACUERDO CON LA CLÁUSULA DÉCIMA “TRANSPARENCIA” DE\nESTE INSTRUMENTO.\nVIGÉSIMA. COMPETENCIA.\nEN CASO DE SUSCITARSE ALGÚN CONFLICTO O CONTROVERSIA CON MOTIVO DE LA\nINTERPRETACIÓN O CUMPLIMIENTO DEL PRESENTE CONVENIO, “LAS PARTES” LO\nRESOLVERÁN DE COMÚN ACUERDO, DE NO LOGRARLO, ACUERDAN SOMETERSE\nDE GUERRERO, CON SEDE EN ESTA CIUDAD DE CHILPANCINGO DE LOS BRAVO, RENUNCIANDO\nDOMICILIO PRESENTE O FUTURO, O POR CUALQUIER CAUSA.\nENTERADAS “LAS PARTES” DEL CONTENIDO Y ALCANCE LEGAL DEL CONVENIO, LO FIRMAN EN\nCHILPANCINGO DE LOS BRAVO, CAPITAL DEL ESTADO DE GUERRERO, A LOS __________DÍAS\nDEL MES DE _________DE _________________________.\nEMERGENCIA O DESASTRE\nEMERGENCIA O DESASTRE\nSEDIF: Periodicidad de la entrega: Mensual / Bimestral / Trimestral\nPrograma\nModalidad: Canasta Alimentarla\nFecha de la No. de insumos Nombre del beneficiario, padre y/o tutor entrega: Municipio Localidad recibidos Firma/huella digital\n(En atención al numeral 18 correspondiente a los Lineamientos para la Elaboración de las Reglas de Operación de los Programas\nSociales Estatales para el Periodo 2022-2027).\nPrimero: El presente acuerdo entrará en vigor al día siguiente de su publicación en el Periódico\nEMERGENCIA O DESASTRE\nSegundo: Se abroga el Acuerdo por el que se emiten las Reglas de Operación del Programa de\nAtención Alimentaria a Personas en Situación de Emergencia y Desastre, que fueron publicadas en el\nPeriódico Oficial del Estado de Guerrero, Número 25 alcance III con fecha de 26 de marzo del 2024.\nTercero: A partir de la entrada en vigor del presente acuerdo, las Reglas de Operación del\nPrograma de Atención Alimentaria a Personas en Situación de Emergencia y Desastre, subsecuente en del Estado de Guerrero, responsable directo de la operación y ejecución de estos.\nDado en el Centro de Rehabilitación Integral, Boulevard René Juárez Cisneros s/n, Ciudad de los\nServicios, C.P. 39095, Chilpancingo de los Bravo, Guerrero, a los diez días del mes de marzo del dos mil veinticinco.\nEL DIRECTOR GENERAL DEL SISTEMA PARA EL DESARROLLO INTEGRAL DE LA FAMILIA.\nLIC. ANTELMO MAGDALENO SOLÍS.\nRúbrica",
  "ordenamiento": "PROGRAMA",
  "jurisdiccion": "GUERRERO",
  "fuente_oficial": "DIARIO OFICIAL DE LA FEDERACION",
  "Fecha de Publicación": "21 de marzo de 2025",
  "ULTIMA REFORMA PUBLICADA": null,
  "status": "VIGENTE",
  "es_escaneado": false,
  "tiene_tablas": true,
  "materia": [
    "alimentación"
  ]
}