{
  "titulo": "Acuerdo por el Que Se Crea el Programa de Apoyo para el Emprendimiento Productivo para la Comunidad",
  "Contenido": "REGLAS DE OPERACIÓN\nTEXTO ORIGINAL.\n12 de Julio de 2024.\nACUERDO POR EL QUE SE CREA EL PROGRAMA DE APOYO PARA EL EMPRENDIMIENTO\nPRODUCTIVO PARA LA COMUNIDAD LGBTIQ+ Y SE EMITEN SUS REGLAS DE OPERACIÓN.\nGuerrero.- Poder Ejecutivo.\nMAESTRA EVELYN CECIA SALGADO PINEDA, GOBERNADORA CONSTITUCIONAL DEL\nESTADO DE GUERRERO, CON FUNDAMENTO EN LO DISPUESTO POR LOS ARTÍCULOS 71, 87, 88,\nLOS ARTÍCULOS 2, 4, 8, 9, 14, 16, 22 APARTADO A FRACCIONES I Y IV, 23 FRACCIÓN III Y 26\nFRACCIÓN III DE LA LEY ORGÁNICA DE LA ADMINISTRACIÓN PÚBLICA DEL ESTADO DE\nGUERRERO NÚMERO 242; 1, 2 FRACCIÓN I, 18 Y 25 DE LA LEY NÚMERO 454 DE PRESUPUESTO\nY DISCIPLINA FISCAL DEL ESTADO DE GUERRERO; 1, 2, 3, 6 Y 8 DE LA LEY NÚM. 102, PARA EL\nDESARROLLO SOCIAL DEL ESTADO DE GUERRERO; EN RELACIÓN CON EL ARTÍCULO 47 Y\nANEXOS 23 Y 23-A (E04) DEL DECRETO NÚMERO 680 RELATIVO AL PRESUPUESTO DE EGRESOS\nDEL ESTADO DE GUERRERO PARA EL EJERCICIO FISCAL 2024, Y LOS LINEAMIENTOS PARA LA\nELABORACIÓN DE LAS REGLAS DE OPERACIÓN DE LOS PROGRAMAS SOCIALES ESTATALES\nPARA EL PERIODO 2022-2027.\nQue la Agenda 2030 para el Desarrollo Sostenible es un documento que establece en su Objetivo\n1 “Poner fin a la pobreza”, en su meta 1.4 Garantizar que todos los hombres y mujeres, en particular los pobres y los vulnerables, tengan los mismos derechos a los recursos económicos y acceso a los servicios básicos, la propiedad y el control de la tierra y otros bienes, la herencia, los recursos naturales, las nuevas tecnologías apropiadas y los servicios financieros, incluida la micro financiación. Por otro lado, la meta 8.3 del objetivo 8 sobre “Promover el crecimiento económico, inclusivo y sostenible, el empleo y el trabajo decente para todos\" señala el promover políticas orientadas al desarrollo que apoyen las actividades productivas, la creación de puestos de trabajo decentes, el emprendimiento, la creatividad y la innovación, y fomentar la formalización y el crecimiento de las microempresas y las pequeñas y medianas empresas, incluso mediante el acceso a servicios financieros.\nQue el Plan Nacional de Desarrollo 2019-2024 establece en el Eje 2, objetivo, construir un país con bienestar y el Eje 3 Economía, objetivo 1, Detonar el crecimiento local y/o familiar, el cual se pretende que las estrategias, acciones y apoyos planteados en el Plan permitan proteger, mejorar y en su caso\nREGLAS DE OPERACIÓN respecto a sus ingresos.\nQue el Programa Sectorial de Desarrollo y Asistencia Social 2022-2027, el cual contempla en su\nObjetivo 3 Contribuir a mejorar el bienestar económico de los grupos vulnerables de la población históricamente excluidos, con su estrategia 3.2 Atender iniciativas productivas con enfoque de inclusión y respeto a sus derechos humanos, así como su línea de acción 3.2.2 Apoyar el emprendimiento de la comunidad LGBTI+ que permita mejorar su bienestar.\nQue el Plan Estatal de Desarrollo 2022-2027, establece en su Eje Transversal “Igualdad de Género e Inclusión Social”, con la incorporación de principios de igualdad entre mujeres y hombres en la construcción y desempeño de los programas que de manera exclusiva o transversal estén dirigidos a mitigar las brechas de género. Además, implementar metodología para la evaluación y seguimiento que proporcionen información e indicadores de resultados con perspectiva de género.\nQue el ejecutivo estatal, está comprometido con ser el principal promotor de acciones y establecer rutas encaminadas a lograr un estado moderno, inteligente y visionario; de ahí que también es necesario llevar a cabo acciones permanentes que permitan dar cumplimiento a la política del Estado Mexicano orientado al bienestar y a la mejora de la economía de las familias.\nQue como titular del Poder Ejecutivo reconozco que no se le ha dado la importancia que requieren las y los integrantes de la comunidad LGBTI+ y que es necesario e imperante que esté contemplado como prioridad en las políticas públicas de desarrollo. En consecuencia, se busca que los programas contengan acciones encaminadas a resarcir la discriminación a la que se enfrenta esta población, mediante el acceso al trabajo digno y con ello contribuir a la disminución del desempleo.\nQue las acciones y programas derivados de las políticas sociales de estado se formularán, instrumentarán, ejecutarán y evaluarán con criterio de universalidad, atendiendo las necesidades básicas de las personas en cada etapa de su vida; de integridad, enfocados a todas las dimensiones del desarrollo humano y social; de equidad, para ampliar el acceso a los recursos públicos, privados y sociales que promuevan condiciones de igualdad de oportunidades para satisfacer el bienestar social.\nQue conforme a la Ley Núm.102, para el Desarrollo Social del Estado de Guerrero, contempla necesidades humanas y sociales, para fortalecer el pleno goce de sus derechos y garantías políticas, económicas, sociales y culturales, que les permitan optar por un plan de vida.\nQue el Decreto Número 680 relativo al Presupuesto de Egresos del Estado de Guerrero para el\nEjercicio Fiscal 2024 en su artículo 47, establece que con el objeto de asegurar la aplicación eficiente, eficaz, oportuna, equitativa y transparente de los recursos públicos, la Secretaría de Finanzas y\nAdministración y la Secretaría de Planeación y Desarrollo Regional, emitirán las disposiciones a que deberán sujetarse los programas de inversión sujetos a Reglas de Operación, de acuerdo a su competencia.\nREGLAS DE OPERACIÓN febrero del año 2022, emitió los Lineamientos para la Elaboración de las Reglas de Operación de los\nProgramas Sociales Estatales para el período 2022-2027, los cuales establecen disposiciones que instituyen la ejecución de programas, con el objeto de otorgar transparencia y asegurar la aplicación eficiente, eficaz, oportuna y equitativa de los recursos públicos asignados, las cuales deberán publicarse en el Periódico Oficial del Gobierno del Estado de Guerrero.\nQue conforme a la Ley Orgánica de la Administración Pública del Estado de Guerrero Número\n242, a la Secretaría de Bienestar del estado de Guerrero, le corresponde coordinar las acciones que incidan en el abatimiento de los niveles de pobreza que considere la desigualdad existente entre mujeres y hombres, y fomentar un mejor nivel de vida de la población, que garanticen una mejoría en los niveles de vida de los grupos de población más desprotegidos.\nQue las Reglas de Operación establecen disposiciones que instituyen la ejecución del Programa de Apoyo para el Emprendimiento Productivo para la Comunidad LGBTIQ+ (Lesbiana, Gay, Bisexual, Transgénero, Intersexual, Queer y más), con el objeto de otorgar transparencia y asegurar la aplicación eficiente, eficaz, oportuna y equitativa de los recursos públicos asignados, las cuales deberán publicarse en el Periódico Oficial del Gobierno del estado de Guerrero.\nPor lo anteriormente expuesto y con fundamento en las disposiciones legales antes citadas, he tenido a bien expedir el siguiente:\nACUERDO POR EL QUE SE CREA EL PROGRAMA DE APOYO PARA EL EMPRENDIMIENTO\nPRODUCTIVO PARA LA COMUNIDAD LGBTIQ+ Y SE EMITEN SUS REGLAS DE OPERACIÓN.\nArtículo 1. Se crea el Programa de Apoyo para el Emprendimiento Productivo para la Comunidad\nLGBTIQ+ para contribuir a la generación de empleo, ingreso y mejoramiento de las condiciones de vida de las personas integrantes de la comunidad LGBTIQ+ de 18 años hasta 64 años cumplidos, que presenten alguna situación de vulnerabilidad por ingreso o carencia social mediante el otorgamiento un apoyo único en efectivo para la implementación de Proyectos Productivos.\nArtículo 2. La Secretaría de Bienestar, tendrá a cargo la implementación, ejecución, evaluación y administración del Programa de Apoyo para el Emprendimiento Productivo para la Comunidad LGBTIQ+, bajo los criterios de equidad, transparencia, publicidad, selectividad y temporalidad, con estricto apego a la normatividad aplicable, encargada de la dispersión y asignación de los recursos del Programa apegándose plenamente a la Reglas de Operación.\nArtículo 3. Se emiten las Reglas de Operación del Programa de Apoyo para el Emprendimiento\nProductivo para la Comunidad LGBTIQ+ en los que se establecen los principios de eficiencia, eficacia, oportunidad, equidad y transparencia de los recursos públicos y requisitos que se deben cumplir para poder acceder a dicho Programa, conforme a las siguientes:\nREGLAS DE OPERACIÓN\nPRODUCTIVO PARA LA COMUNIDAD LGBTIQ+.\n1. Introducción.\n1.1. Antecedentes.\nDe acuerdo con la CONAPO, la diversidad sexual y de género se refiere a todas las posibilidades que tienen las personas para expresar y vivir su sexualidad, sus preferencias u orientaciones e identidades sexuales y de género. Todas y todos tienen derecho a existir y manifestarse, sin más límites que el respeto a los derechos de los demás.\nLas personas integrantes de la comunidad LGBTIQ+, forman parte de los grupos históricamente discriminados, en el marco del Día Internacional del Orgullo LGBTI+ y, por primera vez, el Instituto Nacional de Estadística y Geografía (INEGI) pone información sobre la población LGBTI+ en México a disposición de la sociedad. Con la finalidad de visibilizar y conocer las principales características de esta población.\nAdemás habían sido excluidos de acciones gubernamentales de bienestar social, fue en el año\n2023, cuando el gobierno del estado de Guerrero, contempló en sus políticas públicas la puesta en marcha del Programa de Apoyo para el Emprendimiento Productivo para la Comunidad LGBTI+, con el cual se buscó promover el emprendimiento de las personas que se identifiquen como lesbianas, gays, bisexuales, trans e intersexuales, tuvieron acceso a un Programa Social creado exclusivamente para este grupo de la población. Además de contribuir a la reactivación económica del estado de Guerrero.\nComo parte de la inclusión y visibilización de los grupos minoritarios, se crea este Programa, que incluye a las personas que se identifican como \"Queer\", definido como personas que rechazan todo tipo de clasificaciones hegemónicas del sistema binario varón/mujer. Este término se refiere a la teoría que rechaza categorías estancas respecto de la sexualidad, la orientación sexual, la identidad de género, etcétera.\n2. Alineación Programática al PED y/o PED.\nEl Programa, se alinea al Plan Estatal de Desarrollo 2022-2027, en su eje temático Transversal B\nIgualdad de género e inclusión social, objetivo B.2 Promover la institucionalización y transversalidad de la igualdad de género, Estrategia B.2.5 Impulsar la participación de la mujeres, las organizaciones sociales, políticas y económicas en el desarrollo de nuestro estado y su Línea de Acción B.2.5.1 Realizar pláticas y talleres para la eliminación de estereotipos de género y discriminación.\nDerivado de lo anterior, se tiene una alineación correspondiente al Programa Sectorial de\nDesarrollo y Asistencia Social 2022-2027, el cual contempla en su Objetivo 3 Contribuir a mejorar el bienestar económico de los grupos vulnerables de la población históricamente excluidos, con su estrategia\n3.2 Atender iniciativas productivas con enfoque de inclusión y respeto a sus derechos humanos, así como su línea de acción 3.2.2 Apoyar el emprendimiento de la comunidad LGBTIQ+ que permita mejorar su bienestar.\nREGLAS DE OPERACIÓN el Programa Sectorial de Bienestar 2020-2024 en el Objetivo 4. Reducir las brechas de desigualdad socioeconómica que enfrentan los grupos poblacionales históricamente excluidos en la estrategia 4.4\nPromover políticas de inclusión, respeto y protección para las personas de la comunidad LGBTIQ+ para mejorar su bienestar y con su línea de acción 4.4.5. Fortalecer e incorporar las bases para el respeto de los derechos humanos de la población LGBTIQ+ en los tres órdenes de gobierno.\nUno de los criterios de esta administración es alinear todos sus programas y acciones a los desafíos internacionales de mediano y largo plazo, que las Naciones de América Latina y el Caribe han suscrito mediante los 17 Objetivos del Desarrollo Sostenible, conocida como Agenda 2030, es por ello que el Programa está alineado al objetivo 10.0 Reducir la desigualdad en y entre los países, que mediante su meta 10.2 en la que se expresa que de aquí a 2030, potenciar y promover la inclusión social, económica y política de todas las personas, independientemente de su edad, sexo, discapacidad, raza, etnia, origen, religión, situación económica u otra condición.\n2.1. Diagnóstico.\nEn 2021 según datos de INEGI, el total de la población de 15 años y más de edad en México se estima en 97.2 millones de personas. De estas, 5.0 millones se autoidentifican LGBTI+, lo que equivale al\n5.1 % de la población de 15 años y más en el país. El 81.8 % se asume parte de esta población por su orientación sexual, 7.6 %, por su identidad de género y 10.6%, por ambas.\nDe la población identificada como LGBTI+, el 11.0% es indígena y el 3.9% se identifica como afromexicana.\nEs importante señalar que la orientación sexual es independiente del sexo biológico o de la identidad de género; puede referirse a la capacidad de cada persona de sentir una profunda atracción emocional, afectiva y sexual por personas de un género diferente al suyo, de su mismo género o de más de un género.\nMientras que la identidad de género es la vivencia interna e individual del género tal como cada persona la experimenta profundamente, la cual podría corresponder o no con el sexo asignado al momento del nacimiento, incluyendo la vivencia personal del cuerpo y otras expresiones de género, incluyendo la vestimenta, el modo de hablar y los modales.\nLa Encuesta Nacional sobre Diversidad Sexual y de Género (ENDISEG) 2021, señaló que las entidades federativas con mayor porcentaje de población LGBTI+ son: Colima, Yucatán, Querétaro y\nGuerrero, que según esta encuesta el 7.4 % de la población guerrerense se identifica como LGBTI+, equivalente a 186,022 personas. de la comunidad LGBTIQ+ en circunstancias de vulnerabilidad por ingreso o por carencia social, que través del auto empleo tengan una oportunidad de mejorar su bienestar económico.\nREGLAS DE OPERACIÓN\nGrafica 1. Actividad Económica según Condición de Auto identificación LGBTI+.\nDistribución porcentual\nLGBTI+ 64.30% 35.70%\n0% 10% 20% 30% 40% 50% 60% 70% 80% 90% 100%\nPoblación económicamente activa (PEA) Población no económicamente activa (PNEA)\n2.1.1. Población Potencial.\nEn el estado de Guerrero, el 7.4 % de la población se identifica como LGBTI+, equivalente a\n186,022 personas, según datos de la Encuesta Nacional sobre Diversidad Sexual y de Género (ENDISEG)\n2021. Sumado a esto, un factor potencial, es el 35.7 % de la población que no se encuentra activa económicamente.\n2.1.2. Población Objetivo.\nLa población objetivo del Programa son las personas que se identifican como parte de la comunidad LGBTIQ+ que residan en zonas de atención prioritaria del estado de Guerrero, con mayor atención aquellas que se encuentre en situación de vulnerabilidad por ingreso o carencia social.\n2.1.3. Población Beneficiaria.\nEl Programa beneficiará hasta 485 personas integrantes de la comunidad LGBTIQ+ en un rango de edad de los 18 años hasta 64 años, que se encuentren en alguna situación de vulnerabilidad y que radiquen dentro del territorio guerrerense, que busquen incentivar sus habilidades y capacidades a través de la generación de emprendimientos.\n2.1.4. Población Indígena.\nSe dará mayor prioridad a las y los integrantes de la comunidad LGBTIQ+, que sean indígenas o afromexicanos (as) y que estén en situación de vulnerabilidad por ingreso o carencia social.\n2.2. Fundamento Legal.\na) Constitución Política de los Estados Unidos Mexicanos.\nREGLAS DE OPERACIÓN\nc) Ley General de Desarrollo Social.\nd) Ley Orgánica de la Administración Pública del estado de Guerrero Número 242.\ne) Ley Núm. 102, para el Desarrollo Social del Estado de Guerrero.\nf) Ley Número 494 para la Igualdad entre Mujeres y Hombres del estado de Guerrero.\ng) Ley Número 553 de Acceso de las Mujeres a Una Vida Libre de Violencia del Estado de\nGuerrero.\nh) Ley Número 207 de Transparencia y Acceso a la Información Pública del estado de Guerrero.\ni) Ley Número 454 de Presupuesto y Disciplina Fiscal del estado de Guerrero.\nj) Ley Número 465 de Responsabilidades Administrativas para el estado de Guerrero.\nk) Ley Número 466 de Protección de Datos Personales en Posesión de Sujetos Obligados del estado de Guerrero.\nl) Ley Número 468 de Fiscalización Superior y Rendición de Cuentas del estado de Guerrero.\nn) Ley Número 427 del Sistema de Coordinación Hacendaria del Estado de Guerrero.\no) Decreto Número 203 del Presupuesto de Egresos del estado de Guerrero para el Ejercicio Fiscal\n2025. (REFORMADO, P.O 23 ALCANCE VI, 21 DE MARZO 2025)\nq) Acuerdo que establecen los Compromisos para la Estabilidad y Desarrollo del estado de\nGuerrero.\nr) Todas aquellas disposiciones normativas aplicables.\n2.3. Definiciones y Siglas.\nDefiniciones:\nComité Dictaminador: Órgano encargado de realizar la validación del proyecto de Padrón de\nPersonas Beneficiarias presentado por el Comité Técnico de Validación, el cual estará integrado por la persona titular de la SBGro, y las personas titulares de la Subsecretaría de Política Social, la Subsecretaría\nREGLAS DE OPERACIÓN de Vinculación y Promoción Social, la Dirección General de Desarrollo Comunitario y Desarrollo Productivo de Grupos Vulnerables, y de la Unidad de Transparencia de la SBGro.\nConvocatoria: Anuncio o publicación en los diferentes medios electrónicos de la SBGro, detallando los requisitos y características específicas para acceder al Programa.\nDirección: La Dirección General de Desarrollo Comunitario y Desarrollo Productivo de Grupos\nVulnerables de la SBGro.\nEl Secretario: Persona Titular de la SBGro.\nPersonas Beneficiarias: Aquellas personas que obtienen el beneficio que otorga el Programa.\nPrograma: Programa de Apoyo para el Emprendimiento Productivo para la Comunidad LGBTIQ+.\nQueer: Personas que rechazan todo tipo de clasificaciones hegemónicas del sistema binario varón/mujer. Este término se refiere a la teoría que rechaza categorías respecto de la sexualidad, la orientación sexual, la identidad de género, etcétera.\nReglas de Operación: Reglas de Operación del Programa de Apoyo para el Emprendimiento\nProductivo para la Comunidad LGBTIQ+.\nSiglas:\nASE: Auditoria Superior del Estado de Guerrero.\nCONEVAL: Consejo Nacional de Evaluación de la Política de Desarrollo Social.\nCONAC: Consejo Nacional de Armonización Contable.\nCONAPO: Consejo Nacional de Población.\nCIS: Cuestionario de Información Socioeconómica.\nCURP: Clave Única de Registro de Población.\nDGDCyDPGV: Dirección General de Desarrollo Comunitario y Desarrollo Productivo de Grupos\nVulnerables.\nDGAyF: Dirección General de Administración y Finanzas.\nIED: Inversión Estatal Directa.\nIEPC: Instituto Electoral de Participación Ciudadana.\nREGLAS DE OPERACIÓN\nENDISEG: Encuesta Nacional sobre Diversidad Sexual y de Género 2021.\nINEGI: Instituto Nacional de Estadística y Geografía.\nITAIGRO: Instituto de Transparencia, Acceso a la Información y Protección de Datos Personales del estado de Guerrero.\nMIR: Matriz de Indicadores de Resultados.\nPED: Plan Estatal de Desarrollo 2021-2027.\nPND: Plan Nacional de Desarrollo.\nPUPB: Padrón Único de Personas Beneficiarias.\nSBGro: Secretaría de Bienestar.\nSCyTG: Secretaría de Contraloría y Transparencia Gubernamental.\nSEPLADER: Secretaría de Planeación y Desarrollo Regional.\nSEFINA: Secretaría de Finanzas y Administración.\nSGG: Secretaría General de Gobierno.\nSICECO: Sistema Central para el Control y Registro de Obras y Acciones del Gobierno del Estado.\nZAP: Zonas de Atención Prioritaria.\n3. Objetivos y Alcances.\n3.1. Objetivo General. personas integrantes de la comunidad LGBTIQ+, en situación de vulnerabilidad y que habiten en las ZAP, mediante el otorgamiento de un apoyo en económico para la implementación de proyectos productivos.\n3.2. Objetivo Específico.\n● Apoyar a las personas integrantes de la comunidad LGBTIQ+, mediante un apoyo económico, para el impulso, desarrollo y/o consolidación de proyectos productivos enmarcados en las actividades económicas, agropecuarias, servicios, artesanales y textiles.\nREGLAS DE OPERACIÓN\n● Incentivar las capacidades y habilidades de la comunidad LGBTIQ+ en los procesos productivos para la obtención y mejoramiento de la seguridad social, el autoempleo y la generación de ingresos.\n● Contribuir a mejorar las condiciones de equidad e igualdad de las y los integrantes de la comunidad LGBTIQ+, con un apoyo económico.\n● Fortalecer la economía de las familias que integran.\n3.3. Cobertura.\nEl Programa tendrá cobertura estatal, beneficiando a las y los integrantes de la comunidad\nLGBTIQ+, mayores de 18 y hasta 64 años, dando prioridad aquellas personas que se ubiquen en las ZAP.\n3.4. Alcances.\nCon el Programa, se busca beneficiar de manera directa con un apoyo económico a la comunidad\nLGBTIQ+ en situación de vulnerabilidad, con el fin de mejorar sus condiciones y calidad de vida, generando autoempleo y obtención de ingresos.\nPor otro lado, con la implementación y puesta en marcha de los proyectos productivos se fomenta la participación e inclusión, de la comunidad LGBTIQ+, así como generar condiciones de igualdad de los derechos humanos mediante un trabajo digno.\n4. Metas Físicas.\nBeneficiar hasta 485 personas integrantes de la comunidad LGBTIQ+, con un apoyo único de $\n6,240.00 (Seis Mil Doscientos Cuarenta Pesos 00/100 M.N.). (REFORMADO, P.O 23 ALCANCE VI, 21 DE MARZO\n2025)\n5. Programación Presupuestal.\nEl Programa está contemplado en el Anexo 23-A del Decreto Número 203 del Presupuesto de\nEgresos del Estado de Guerrero para el Ejercicio Fiscal 2025 con una Inversión Estatal Directa (IED) por un monto aprobado de $3’120,000.00 (Tres Millones Ciento Veinte Mil Pesos 00/100 M.N.).\n(REFORMADO, P.O 23 ALCANCE VI, 21 DE MARZO 2025)\nTabla 1. Resumen General del Presupuesto.\nResumen general del presupuesto\nAcción Inversión\nPresupuesto asignado al Programa de $3’120,000.00 (Tres Millones Ciento\nApoyo para el Emprendimiento Productivo Veinte mil pesos 00/100 M.N.). para la Comunidad LGBTIQ+\nREGLAS DE OPERACIÓN\nMonto de los apoyos por persona Hasta $6,240.00 (Seis Mil Doscientos beneficiaria. Cuarenta pesos 00/100 M.N.)\nGastos Operativos $93,600.00 (Noventa y Tres Mil\nSeiscientos pesos 00/100 M.N.)\nNúmero de personas beneficiarias. Hasta 485 integrantes de la comunidad\nLGBTIQ+.\nAsimismo, cabe mencionar que la calendarización y metas del Programa puede variar en virtud de que el recurso depende de la disponibilidad de los ingresos recaudados por parte de la SEFINA.\nTabla 2. Cronograma Financiero del Programa.\nFUENTE DEPENDENCIA PROGRAMA/ACCIÓN/PROYECTO T A O P T O A Y L O D S E ENERO FEBRERO MARZO ABRIL MAYO JUNIO JULIO AGOSTO SEPTIEMBRE OCTUBRE NOVIEMBRE DICIEMBRE\nPROGRAMA DE APOYO PARA EL\nEMPRENDIMIENTO\nPRODUCTIVO PARA LA\nIED/25 SBGRO COMUNIDAD LGBTIQ+ APOYO $ 3,026,400.00 $ 302,640.00 $ 302,640.00 $ 302,640.00 $ 302,640.00 $ 302,640.00 $ 302,640.00 $ 302,640.00 $ 302,640.00 $ 302,640.00 $ 302,640.00 $ - $ $6,240.00 (SEIS MIL\nDOSCIENTOS CUARENTA\nPESOS 00/100 M.N.)\nIED/25 SBGRO GASTOS DE OPERACIÓN $ 93,600.00 $ 9,360.00 $ 9,360.00 $ 9,360.00 $ 9,360.00 $ 9,360.00 $ 9,360.00 $ 9,360.00 $ 9,360.00 $ 9,360.00 $ 9,360.00 $ - $ TOTAL DEL PROGRAMA $ 3,120,000.00 $ 312,000.00 $ 312,000.00 $ 312,000.00 $ 312,000.00 $ 312,000.00 $ 312,000.00 $ 312,000.00 $ 312,000.00 $ 312,000.00 $ 312,000.00 $ - $ -\n(REFORMADO, P.O 23 ALCANCE VI, 21 DE MARZO 2025)\n5.1. Gastos de Operación.\nSe aplicará hasta un 3% para gastos de operación, destinados a las diversas acciones asociadas con la realización de estudios, elaboración y evaluación de proyectos, supervisión y control, observando en todo momento los criterios de racionalidad y austeridad presupuestal, proporcionando la eficiencia, eficacia y transparencia en el ejercicio de los recursos.\n6. Criterios y Requisitos de Elegibilidad.\na) Criterios.\n● Ser una persona miembro de la comunidad LGBTIQ+ en situación de vulnerabilidad.\n● Ser residente en el estado de Guerrero, dentro de un municipio, localidad o colonia vulnerable.\n● Que el proyecto sea financieramente factible y generador de ingresos.\n● Que no haya ningún riesgo técnico asociado al proyecto.\n● Que sean sostenibles a corto, mediano y largo plazo.\nREGLAS DE OPERACIÓN\n● Que el Comité Técnico de Validación lo apruebe como viable técnicamente y presupuestalmente.\nb) Requisitos de Elegibilidad.\nDesarrollo Productivo de Grupos Vulnerables de la SBGro; el trámite se realizará de manera personal, en las fechas que lo requiera la respectiva convocatoria, por lo que no se le dará tramite a los paquetes de solicitudes enviadas por personas representantes o líderes partidistas o de organizaciones de cualquier índole; únicamente podrá realizarlo la persona solicitante de forma individual.\n● Solicitud de Apoyo dirigida a la persona titular de la SBGro, en la que se expresen los datos generales, así como datos específicos del tipo de proyecto solicitado.\n● Estudio Socioeconómico (CUIS o CIS), realizado por la SBGro al momento de entregar los requisitos.\n● Copia de su Credencial de Elector (INE).\n● Copia de Comprobante de Domicilio o Constancia de Radicación.\n● Copia de la Clave Única de Registro de Población (CURP).\n● No haber sido persona beneficiada en los ejercicios fiscales anteriores con programas similares.\n● No formar parte de la administración pública municipal, estatal o federal.\n● Carta de Autodeterminación como persona miembro de la comunidad LGBTIQ+ (Anexo 2), proporcionado por la SBGro.\n7. Tipo, Monto y Periodicidad del Apoyo.\nTabla 3. Tipo, monto y periodicidad del apoyo.\nTipo Monto Periodicidad\nEconómico $6,240.00 Único\n(REFORMADO, P.O 23 ALCANCE VI, 21 DE MARZO 2025)\n7.1. Características de los Apoyos. presentes Reglas de Operación, estarán condicionadas a la disponibilidad presupuestal y financiera del requisitos señalados. Los tiempos para el proceso de selección serán previstos en la convocatoria.\nREGLAS DE OPERACIÓN\nLos apoyos a entregar serán previa evaluación por parte del Comité Técnico de Validación, mismo que emitirá un listado de los proyectos factibles de realizar. Los proyectos que cumplan los criterios de selección, obtendrán un apoyo económico, será un beneficio personal e intransferible, para el equipamiento y fortalecimiento de las actividades económicas existentes o nuevas, y que estén relacionadas a:\na) Actividades agropecuarias: Apoyos destinados a la producción agropecuaria, así como para dar valor agregado a la producción; mediante el otorgamiento económico para insumos, equipos, materiales, herramientas, etc.\nb) Servicios: Comprende el apoyo económico para insumos, equipo, herramientas y materiales para fortalecer actividades económicas relacionadas con los servicios.\nc) Artesanías y textiles. Comprende el apoyo económico para la adquisición de insumos, equipos, materias primas, herramientas y materiales necesarios para la producción artesanal.\nd) Actividades Comerciales. Apoyo destinado al intercambio económico por productos finales, destinados a personas consumidoras con necesidades específicas.\n7.2. Recursos no Devengados.\nLos recursos no ejercidos al término del ejercicio fiscal 2025, serán reintegrados a la Dirección\nGeneral de Tesorería perteneciente a la SEFINA, a más tardar el 31 de diciembre del presente ejercicio\nfiscal. (REFORMADO, P.O 23 ALCANCE VI, 21 DE MARZO 2025)\n7.3. Resguardo de la Documentación.\nLa SBGro a través de la Dirección General de Desarrollo Comunitario y Desarrollo Productivo de\nGrupos Vulnerables, será la responsable de resguardar la información comprobatoria de los recursos ejercidos del Programa.\n7.4. Supervisión y Control.\nLa persona titular de la Dirección General de Desarrollo Comunitario y Desarrollo Productivo de\nGrupos Vulnerables de la SBGro, será la encargada de la operatividad del Programa y estará en\nAdministración y Finanzas de la SBGro. estado de Guerrero. El Comité de Validación y la SCyTG, también emitirán el visto bueno de esta publicación.\nAsí mismo, se enviarán los reportes de avances físicos financieros trimestrales a la SEFINA, a la\nREGLAS DE OPERACIÓN\nContable (CONAC).\nPara llevar a cabo la comprobación de los recursos de los proyectos productivos, se remitirá a la\nSEFINA, el listado por región y municipio de las personas beneficiadas, se efectuarán compulsa de padrones con las Secretarías y Dependencias que manejen este tipo de programa, evitando la duplicidad, en apego al Decreto Número 203 del Presupuesto de Egresos del Estado de Guerrero para el\nEjercicio Fiscal 2025, Título Tercero de los Lineamientos para el ejercicio del Gasto, Capítulo IV de las\nReglas de Operación para Programas de Inversión, artículo 46 fracción V. (REFORMADO, P.O 23 ALCANCE VI,\n21 DE MARZO 2025)\n8. Criterios de Selección.\nSe establece como prioridad la condición vulnerable y grado de pobreza de las personas integrantes de la comunidad LGBTIQ+, que se definirá con un estudio socioeconómico aplicado al momento del llenado de la solicitud de ingreso, con el fin de conocer si reúnen los criterios y requisitos establecidos en las presentes Reglas de Operación, para ser personas beneficiarias del Programa deberán llenar la solicitud disponible en la página oficial de la SBGro; atendiendo a la Convocatoria que, para tales efectos se publique en los diferentes medios de comunicación del estado, así como en su página de internet www.bienestar.guerrero.gob.mx.\nPodrán ser beneficiarias aquellas personas integrantes de la comunidad LGBTIQ+ que cumplan con los criterios siguientes:\na) Autodeterminarse como persona integrante de la comunidad LGBTIQ+ y estar en condición de vulnerabilidad.\nb) Que cumplan con cada uno de los requisitos establecidos en las presentes Reglas de\nOperación.\nc) Que el Comité Técnico de Validación, lo considere como un proyecto viable.\nd) No formar parte de la administración pública municipal, estatal o federal.\ne) No haber sido beneficiada o beneficiado por el Programa en años anteriores.\n8.1. Casos Especiales.\nEn los casos especiales por emergencia, casos fortuitos y/o de fuerza mayor o aquellos que por económicos o su reprogramación, ya sea en una zona geográfica en específico o en todo el estado, o aquellos que estén fuera de los lineamientos establecidos en las presentes Reglas de Operación, será la\nSBGro quien determinará su procedencia.\nREGLAS DE OPERACIÓN\n8.2. Casos de Emergencia o Desastre.\nDeclaratoria de Emergencia o de Desastre, la SBGro, podrá dar atención especial a la población beneficiaria del Programa que se encuentre inmersa en la zona de desastre, pudiendo adelantar la entrega de apoyos económicos, así como brindar ayuda humanitaria para mitigar sus necesidades prioritarias por la emergencia social o desastre natural.\n8.3. Suspensión o Cancelación del Programa Social.\nLa SBGro, podrá suspender y/o cancelar la operación del Programa, cuando no existan las condiciones sociales-económicas o cuando una de las personas beneficiarias no acate las disposiciones de las presentes Reglas de Operación, o que haga algo que afecte la norma estatal, federal, cuando lo determine la persona titular del Poder Ejecutivo y por problemas de gobernabilidad.\n8.4. Integración del Padrón de Personas Beneficiarias.\nUna vez que las personas solicitantes sean incorporadas a través del Comité Técnico de\nValidación al Programa y una vez aprobado por el Comité Dictaminador, formarán parte de un PUPB, el cual será de carácter público, siendo reservados sus datos personales, de acuerdo con la normatividad vigente; los cuales en ningún caso podrán emplearse para propósitos de proselitismo político, religioso o comercial, ni para ningún otro fin distinto al establecido en las Reglas de Operación del Programa.\nLa publicación del Padrón Único de Personas Beneficiarias, se realizará en los diversos medios electrónicos de los que dispone la SBGro, en las siguientes páginas web:\n9. Mecánica Operativa del Programa Social.\n9.1. Instancia Ejecutora y/o Responsable.\nComunitario y Desarrollo Productivo de Grupos Vulnerables.\nEl Comité Técnico de Validación será conformado por:\nREGLAS DE OPERACIÓN\nEl titular de la SBGro; las personas titulares de la Subsecretaría de Política Social, de la\nSubsecretaría de Vinculación y Promoción Social, de la Dirección General de Desarrollo\nComunitario y Desarrollo Productivo de Grupos Vulnerables, y de la Unidad de Transparencia de la\nSBGro. (REFORMADO, P.O 23 ALCANCE VI, 21 DE MARZO 2025)\nLa Presidencia será ocupada por la persona titular de la SBGro; quien nombrará a la persona encargada de Coordinación General y de la Secretaría Técnica, de entre las personas integrantes del comité. (REFORMADO, P.O 23 ALCANCE VI, 21 DE MARZO 2025)\nLas decisiones de dicho Comité, se tomarán por consenso con voz y voto de cada una de las personas integrantes, de ser necesario por mayoría de votos, en caso de empate la Presidencia tendrá el voto decisivo. (REFORMADO, P.O 23 ALCANCE VI, 21 DE MARZO 2025)\nEl comité sesionará de manera ordinaria por lo menos una vez al año con el fin de tratar temas relacionados a la ejecución del programa, y de manera extraordinaria las veces que sea necesario a convocatoria de cualquiera de sus miembros, con al menos 24 horas de anticipación.\n(REFORMADO, P.O 23 ALCANCE VI, 21 DE MARZO 2025)\n9.2. Proceso de Incorporación al Programa Social.\nLa SBGro emitirá y publicará las Reglas de Operación y Convocatoria del Programa, para el otorgamiento del apoyo a las personas integrantes de la comunidad LGBTIQ+ que demuestren estar en situación de vulnerabilidad a través del estudio socioeconómico (CUIS O CIS).\nConvocatoria: la convocatoria dará a conocer el objetivo del Programa, los requisitos que deberán cumplir las personas solicitantes, número telefónico para pedir informes, fecha de recepción de solicitudes, fecha y forma de entrega de resultados, por conducto de los principales medios de difusión de la SBGro.\nDicha convocatoria será publicada aproximadamente del 5 al 9 de agosto del presente año.\nInformación y difusión: La información y difusión se realizará a través de la publicación de la convocatoria en los diversos medios de difusión social institucionales, así como en las páginas web:\nREGLAS DE OPERACIÓN\nDe igual manera, se puede solicitar información directamente en las oficinas de la SBGro, ubicada ubicado en el número 62, en Boulevard René Juárez Cisneros, de la Ciudad de los Servicios, en\nChilpancingo de los Bravo, capital del estado de Guerrero, C.P. 3907.\n10. Evaluación.\nLa SBGro, podrá realizar una evaluación de resultados de carácter externo del Programa sujeto a las presentes Reglas de Operación, para lo cual tendrá la facultad de designar a la instancia que realizará dicho análisis. Las evaluaciones externas que se realicen al Programa serán coordinadas por la SCyTG.\n10.1. Indicadores (Construcción de la Matriz de Indicadores para Resultados. (Anexo 1). se utilizarán los indicadores que se especifican en la Matriz de Indicadores de Resultados (MIR) para el central/secretaria-del-bienestar/, que son los siguientes: (REFORMADO, P.O 23 ALCANCE VI, 21 DE MARZO 2025)\nREGLAS DE OPERACIÓN\nREGLAS DE OPERACIÓN\n10.2. Seguimiento.\nEl seguimiento al desarrollo de las diferentes fases del Programa, lo realizará la persona titular de la SBGro, para lo cual implementará una estrategia de seguimiento con base a la observancia del cumplimiento de los indicadores establecidos en la Matriz de Indicadores de Resultados (MIR).\n10.3. Auditoría.\nLa SBGro a través de la Dirección General de Administración y Finanzas, serán los responsables de la supervisión directa de las acciones, así como de verificar que en su ejecución se cumpla con la normatividad aplicable.\nLos recursos asignados para la operación del Programa podrán ser verificados por la SEFINA, la\nSCyTG, el Órgano de Fiscalización de las entidades paraestatales y la Auditoría Superior del Estado, en el ámbito de sus respectivas competencias, realizarán actividades de fiscalización y auditoría.\nLa SBGro a través de la Dirección General de Administración y Finanzas, darán todas las facilidades a las instancias fiscalizadoras para realizar en el momento que juzguen pertinente, las auditorías necesarias; asimismo, efectuará el seguimiento y la solventación de las observaciones planteadas por los\nÓrganos de Control.\nLa inobservancia de esta disposición, independientemente de las sanciones a que haya lugar, limitará la ministración de los recursos estatales en el siguiente ejercicio presupuestal.\n11. Mecanismo de Entrega del Apoyo.\nLos expedientes de las personas integrantes de la comunidad LGBTIQ+, cuyos datos e información solicitada fueron verificados, validados y revisados por la Dirección General de Desarrollo\nComunitario y Desarrollo Productivo de Grupos Vulnerables de la SBGro, que cumplan con los criterios y requisitos de elegibilidad establecidos en las presentes Reglas de Operación, serán validados por el Comité\nTécnico y aprobados por el Comité Dictaminador, para integrarlos en el PUPB y así, reciban el apoyo económico proporcionado por el Programa.\nLa entrega será única, personal, e intransferible, en las instalaciones de la SBGro, aproximadamente del 19 al 23 de agosto del presente año.\n12. Derechos y Obligaciones de las Personas Beneficiadas.\nDerechos:\nLas personas integrantes de la comunidad LGBTIQ+, en situación vulnerable que cumplan con los requisitos de elegibilidad y sean consideradas como beneficiarias, recibirán por parte de la SBGro, lo siguiente:\na) La información necesaria, de manera clara y oportuna, para participar en el Programa.\nREGLAS DE OPERACIÓN\nb) La relación de personas beneficiarias a través de medios de difusión social institucional de los que disponga la SBGro.\nc) Un trato digno, respetuoso, oportuno y equitativo.\nd) Atención sin costo alguno.\ne) La reserva y privacidad de su información personal, de acuerdo a la Ley Número 207 de\nTransparencia y Acceso a la Información Pública del Estado de Guerrero y la Ley Número 466 de\nProtección de Datos Personales en Posesión de Sujetos Obligados del Estado de Guerrero.\nObligaciones:\na) Acudir puntualmente al lugar que se establezca en la fecha y hora señalada a recibir su apoyo económico, como lo establecen las presentes Reglas de Operación.\nb) Informar cambio de domicilio y actualizar sus datos y documentación cuando proceda para los efectos a que dé a lugar.\nc) Recibir la visita del personal de la SBGro, si es el caso, para la verificación de información proporcionada en el llenado de estudio socioeconómico.\nd) Aplicar debidamente el apoyo en el proyecto productivo que fue aprobado por la SBGro, así como darle continuidad a las obligaciones que enmarca el Programa.\ne) No hacer uso indebido (venta, préstamo o uso con fines partidistas o electorales, entre otros) del apoyo entregado.\nf) Participar en las acciones de Contraloría Social, para la vigilancia del buen funcionamiento del\nPrograma.\ng) Informar a la SBGro, las fallas o irregularidades que se presenten en la entrega de los apoyos.\nh) Cumplir con el compromiso de corresponsabilidad.\n12.1. Causales de Suspensión o Baja de las Personas Beneficiadas.\nOperación ameritarán la baja del Programa. De igual manera, serán consideradas causales de baja las siguientes:\na) Falsear la información proporcionada a la SBGro.\nb) No presentarse a recibir su apoyo económico autorizado en la fecha y hora que le será señalada.\nREGLAS DE OPERACIÓN\nc) Cambiar el domicilio de residencia a otra entidad federativa.\nd) Aplicar el recurso del proyecto para otros fines distintos a los del proyecto autorizado. En caso de incurrir en esta causa, la persona beneficiaria deberá reintegrar la totalidad de los recursos otorgados, de acuerdo con lo estipulado en la Carta Compromiso suscrita.\ne) Por fallecimiento.\n12.2. Proceso de Baja.\nCuando las personas beneficiarias no cumplan con las obligaciones señaladas en el punto 12 de los incisos del apartado de las presentes Reglas Operación.\n● Cuando se detecte como beneficiaria o beneficiario de algún otro Programa Social.\n● Las personas beneficiarias que causen suspensión no podrán solicitar su reincorporación al\nPrograma.\n13. Instancias Participantes.\nLas instancias participantes del Programa serán:\n● La SBGro, ejecutora del Programa.\n● La SEPLADER, dictaminadora de las presentes Reglas de Operación y es quien autoriza los recursos del Programa.\n● La SEFINA, liberará los recursos del Programa de acuerdo a la calendarización.\n● La SCyTG, coadyuvante en las tareas de organización, control y evaluación del Programa.\n13.1. Instancia Normativa.\nLa SBGro, fungirá como la instancia administrativa y normativa del Programa, en caso de desarrollo exitoso de sus actividades, como pueden ser:\n● La SCyTG.\n● Otras instancias del gobierno estatal o federal\n● Fundaciones o sector privado\nREGLAS DE OPERACIÓN se llevarán a cabo dentro del mismo.\nFunciones del Comité Técnico de Validación.\nEl Comité Técnico de Validación es un órgano de Control Interno de la SBGro, sus personas integrantes no podrán recibir remuneración alguna por su participación.\nSe celebrará como mínimo una sesión ordinaria a convocatoria de la Presidencia, para presentar avances y resultados, informes, toma de decisiones, evaluar la operatividad del Programa, determinar las fechas de las sesiones, firmar las actas correspondientes y demás asuntos relativos al\nmismo. (REFORMADO, P.O 23 ALCANCE VI, 21 DE MARZO 2025)\nPara resolver asuntos importantes no previstos y casos urgentes o especiales, se celebrarán sesiones extraordinarias, las cuales serán convocadas por la SBGro.\nEl Comité Técnico de Validación dará fe y legalidad de las acciones siguientes:\n● Validar la convocatoria que proponga la Dirección General de Desarrollo Comunitario y\nDesarrollo Productivo de Grupos Vulnerables de la SBGro.\n● Solicitar a las diferentes secretarias la compulsa correspondiente de padrones, de los diferentes programas de apoyo que se manejen en las secretarías y dependencias del estado y a las delegaciones del Gobierno de México en el estado de Guerrero, con el fin de no duplicar los conceptos de apoyo.\n● Validar la lista de las personas beneficiarias.\n● Presentar ante el Comité Dictaminador, la propuesta del PUPB, para su aprobación.\nLos casos no previstos en la convocatoria respectiva, serán resueltos en pleno por el Comité\nTécnico de validación.\n14. Transparencia.\n14.1. Promoción y Difusión del Programa Social.\nLa SBGro, emitirá y publicará la convocatoria del Programa que será emitida y aprobada aproximadamente del 5 al 9 de agosto del presente año, para el otorgamiento del apoyo a personas integrantes de la comunidad LGBTIQ+ que demuestren estar en una situación de vulnerabilidad. En ella obligatoriamente, se darán a conocer cuando menos el objetivo del Programa, los requisitos que deberán cumplir las aspirantes, la dirección de los módulos de información, número telefónico para pedir informes, la fecha de recepción de solicitudes, fecha y forma de entrega de resultados, por conducto de los principales medios de difusión.\nREGLAS DE OPERACIÓN\n14.2. Contraloría Social.\nLa SBGro promoverá la Contraloría Social en base a la normatividad establecida para tal efecto, control, vigilancia y avaluación de los programas sociales.\nCon la finalidad de incrementar la participación ciudadana, se crearán Comités de Contraloría\nSocial, como órgano ciudadano de control, vigilancia y evaluación de las actividades del Programa, conformados por la población beneficiaria, los sectores sociales y personas representantes de municipios, quienes de manera específica supervisarán la gestión gubernamental y que el manejo de los recursos públicos se realice en con transparencia, eficacia, legalidad y honradez. Los objetivos específicos de este órgano de contraloría social son:\n● Hacer más transparentes las decisiones y ejecución de los recursos.\n● Incrementar la participación ciudadana.\n● Fomentar la organización social.\n● Inhibir los actos de actos de corrupción y cooptación social, política y electoral.\n● Incrementar la eficiencia de los recursos públicos.\n● Fortalecer la cultura de la legalidad.\n● Mejorar la rendición de cuentas.\n● Perfeccionar la democracia e incorporar la evaluación ciudadana.\nEn atención a las facultades de la SCyTG será la autoridad competente para llevar a cabo la supervisión y verificación de las acciones a realizar por la instancia ejecutora de la promoción, difusión y realización de las acciones necesarias para la participación de las personas beneficiarias en este Programa social, a través de la integración y operación de Comités de Contraloría Social para dar información, seguimiento, supervisión, vigilancia y evaluación del cumplimiento de criterios de elegibilidad y derechos de las personas beneficiarias, obligaciones del Programa y el desempeño de honestidad y calidad de las personas servidoras públicas.\n14.3. Protección de Datos Personales.\nVulnerables de la SBGro, solo podrá ser publicada con previo consentimiento, en los diferentes medios digitales, esto con el fin de checar sus resultados de la solicitud enviada, no se deberá hacer uso de esta información para fines ajenos al Programa, de acuerdo a la Ley Número 466 de Protección de Datos\nREGLAS DE OPERACIÓN\nPersonales en Posesión de Sujetos Obligados del Estado de Guerrero. En todo momento la persona beneficiada podrá ejercer los derechos de alta, acceso, rectificación, cancelación y oposición de datos personales recabados.\nEstos datos personales recabados serán utilizados con la siguiente finalidad:\n● Validar que se cumplan los requisitos de elegibilidad para ser persona beneficiaria de este\nPrograma, que serán integrados de acuerdo a las facultades propias, para la realización de compulsas para la integración del PUPB.\n● Se garantiza la protección de datos personales que serán recabados y en cumplimiento con las disposiciones en materia de transparencia y acceso a la información pública aplicable.\n14.4. Quejas y Denuncias.\n● En caso que se presente alguna queja o denuncia, la SBGro deberá recibirla, en su caso y de acuerdo a la gravedad turnarla a la SCyTG.\n● La persona servidora pública que reciba una queja o denuncia deberá indicar a la persona ciudadana su nombre completo, cargo y área de adscripción, además de asentar por escrito la fecha y hora de recepción, con la finalidad de brindarle elementos de referencia para posibles aclaraciones. De igual manera para fines de dar inicio al trámite de la queja o inconformidad, la persona servidora pública deberá pedir a la persona quejosa: Identificación oficial y domicilio actual.\n● La persona servidora pública que reciba la queja o denuncia deberá realizar el seguimiento para asegurarse, en el ámbito de su competencia, que ésta haya tomado el cauce correspondiente.\nLas quejas o inconformidades de la ciudadanía derivadas de alguna irregularidad en la operación del Programa deberán realizarse en comparecencia de la persona quejosa y/o interesada, deberá presentarse por escrito dirigido a la persona titular de la Presidencia del Comité Técnico de Validación en las oficinas de la SBGro, ubicadas en “Recinto de las Oficinas del poder Ejecutivo del Estado”, edificio Norte planta baja, en el inmueble ubicado en el número 62, en Boulevard René Juárez Cisneros, de la Ciudad de los Servicios, en Chilpancingo de los Bravo, capital del estado de Guerrero, C.P. 3907.\n14.5. Acciones de Blindaje.\nEn la operación y ejecución de los recursos del Programa, se deberán observar y atender las medidas que al efecto emitan la SCyTG, el ITAIGRO, el IEPC y las demás autoridades competentes, con la finalidad de impedir que los apoyos sean utilizados con fines políticos, en cuanto a la publicidad en medios electrónicos, impresos, complementarios o de cualquier otra índole, vinculados con los programas de comunicación social, se deberá incluir la leyenda siguiente:\n“Este programa es público y ajeno a cualquier partido político. Queda prohibido su uso para fines distintos a los establecidos en el programa”.\nREGLAS DE OPERACIÓN\n14.6. Acta de Donación (Anexo 2).\nPara cada uno de las entregas del recurso a las personas beneficiarlas de la comunidad LGBTIQ+, se suscribirá un Acta de Donación, en la que participará la SBGro, a través de la Dirección General de\nDesarrollo Comunitario y Desarrollo Productivo de Grupos Vulnerables, y la persona beneficiaria.\n15. Perspectiva de Género.\nLa mayor parte las personas integrantes de la comunidad LGBTIQ+, necesitan incluir sus voces, cambiar las normas y buscar ser reconocidas como agentes económicos para lograr mayor visibilidad. La perspectiva de género nos permite señalar con claridad que las mujeres lesbianas y trans están situadas en el extremo de la vulnerabilidad y homogeneizadas en lo que se ha constituido como un pensamiento determinado y lineamientos de corrección política para las conductas sexuales alternativas. Desde la causa de la diversidad sexual también criticamos y erosionamos los prejuicios misóginos y machistas, así como los estereotipos de género y roles tradicionales sobre lo que significa ser un hombre o una mujer.\n16. Enfoque de Derechos.\nLos derechos humanos de la comunidad LGBTIQ+ abarca todos los aspectos de la vida: la salud, la educación, la participación política, el bienestar económico, no ser objeto de violencia, por mencionar algunos de los más fundamentales. Las personas integrantes de la comunidad LGBTIQ+ tienen derecho al disfrute pleno y en condiciones de igualdad de todos sus derechos humanos y a vivir libres de todas las formas de discriminación, el empoderamiento económico contribuye a la reducción de los niveles de desigualdad y de pobreza, sobre todo de la comunidad LGBTIQ+ que se encuentra en mayor situación de vulnerabilidad.\nEn este sentido, el presente Programa contribuye a garantizar el acceso a una vida libre de violencia, ya que a través de la independencia económica se reduce este tipo de violencia.\n17. Acciones Contra el SARS-COV-2.\nA fin de cuidar todos los protocolos establecidos por la Secretaría de Salud, se contemplará seguir con los cuidados para prevenir los contagios del SARS COVID-2, por lo cual se han establecido las medidas\nLGBTIQ+.\n18. Anexos que reflejen la entrega del apoyo (económico, especie o servicios).\nAnexo 1.-Mir. (REFORMADO, P.O 23 ALCANCE VI, 21 DE MARZO 2025)\nAnexo 2.- Acta de Donación. (REFORMADO, P.O 23 ALCANCE VI, 21 DE MARZO 2025)\nAnexo 3.- Solicitud de Acceso al Programa de Apoyo para el Emprendimiento Productivo para la Comunidad LGBTIQ+. (ADICIONADO, P.O 23 ALCANCE VI, 21 DE MARZO 2025)\nREGLAS DE OPERACIÓN\nAnexo 4.- Carta de Autodeterminación. (REFORMADO, P.O 23 ALCANCE VI, 21 DE MARZO 2025)\nAnexo 5.- CUIS. (ADICIONADO, P.O 23 ALCANCE VI, 21 DE MARZO 2025)\nREGLAS DE OPERACIÓN\nAnexo 1.- MIR.\nMatriz de indicadores para Resultados\nContribuir al Bienestar\nEconómico de la población\n+ s er\nINEGI/Transparencia inci e la\nLGBTIQ+ vulnerable. activa. ingresos.\nPoblación LGBTIQ+, que o tis\n, + it e\n. ta c\n+\n.\n, (que mejoran su economía. r e) s La SBGro cuenta con recursos\n(la Tra entregados. comunidad LGBTIQ+. Dirección proyectos productivos de la comunidad LGBTIQ+\nPorcentaje de\nInforme de La convocatoria tiene alcance\nDifusión de la convocatoria y municipios que gobierno/Avance Físico en los 85 municipios del recepción de solicitudes. participan en la\nFinanciero. estado de Guerrero.\n) convocatoria. s Porcentaje de personas c beneficiarias que Las personas solicitantes o Validación, Integración del Informe de\n(gobier\n/\n.\nFísico es\n.\nLas personas beneficiarias\nA Informe de\nSupervisión y seguimiento. gobierno/Avance Físico exitosos supervisados. desarrollo de sus actividades\nFinanciero. o emprendimientos.\nREGLAS DE OPERACIÓN\nAnexo 2.- Acta de Donación.\nCOMUNIDAD LGBTIQ+\nEn el municipio de ______________________ de la región: _______________ del estado de Guerrero, siendo las ____________________________ horas del día_______________ de _____ del 2025; reunidos en ___________________________ se lleva a cabo la firma del acto de entrega – recepción del\nPrograma de Apoyo para el Emprendimiento Productivo para la Comunidad LGBTIQ+, el financiamiento para la operación de este programa social, es con recursos de inversión estatal directa (IED).\nEl apoyo se otorga en exhibición única y por la cantidad de _____________________________ para beneficiar a: ________________________________________, con número de CURP\n____________________________________ ____________________________________.\nCLÁUSULA ÚNICA:\nLos recursos serán utilizados para los fines que fueron solicitados en la Solicitud de Apoyo dirigida a la\nSecretaría del Bienestar del Estado de Guerrero.\nFirman de conformidad con las condiciones establecidas, en la fecha y lugar antes mencionados.\nEntrega Recibe\nDirección General de Desarrollo La persona beneficiaria.\nComunitario y Desarrollo Productivo de Grupos Vulnerables.\nNombre completo Nombre completo\n“Este programa es público y ajeno a cualquier partido político. Queda prohibido su uso para fines distintos a los establecidos en el programa”\nREGLAS DE OPERACIÓN\nREGLAS DE OPERACIÓN\nAnexo 4.- Carta de Autodeterminación.\n________, Guerrero., a __ de _________ del 2025.\nMtro. Pablo Andre Gordillo Oliveros\nSecretario de Bienestar\nPRESENTE\nEn términos del artículo 1, párrafo quinto, 4 párrafo octavo de la Constitución Política de los Estados\nUnidos Mexicanos, artículo 2 de la Declaración Universal de Derechos Humanos, artículo 26 del Pacto\nInternacional de Derechos Civiles y Políticos; y del punto 8 de los criterios de selección de “PROGRAMA\nDE APOYO PARA EL EMPRENDIMIENTO PRODUCTIVO PARA LA COMUNIDAD LGBTIQ+ PARA\nEL EJERCICIO FISCAL 2025, bajo protesta de decir verdad declaro que, de acuerdo con mi identidad sexual, ideológica y auto adscripción personal, me reconozco como:\nLesbiana: _____ Gay: ________ Bisexual: __________\nTransexual: ____ Transgénero: ________ Travestí: __________\nIntersexual: ____ Otro: ________\nAsimismo, de conformidad con los artículos 6, Apartado A, fracción II de la Constitución Política de los\nEstados Unidos Mexicanos; 3 fracción X de la Ley General de Protección de Datos Personales de\nGuerrero y demás normatividad vigente, acepto que mis datos personales sean manejados de acuerdo al aviso de privacidad publicado en el portal oficial de la Secretaría de Bienestar.\nATENTAMENTE\nNombre y firma\n“Este programa es público y ajeno a cualquier partido político. Queda prohibido su uso para fines distintos a los establecidos en el programa’’\nREGLAS DE OPERACIÓN\nREGLAS DE OPERACIÓN\nREGLAS DE OPERACIÓN\nREGLAS DE OPERACIÓN\nREGLAS DE OPERACIÓN\nREGLAS DE OPERACIÓN\nREGLAS DE OPERACIÓN\nPrimero. El presente Acuerdo entrará en vigor al día siguiente de su publicación en el Periódico\nSegundo. Se abroga el Acuerdo por el que se crea el Programa de Apoyo para el Emprendimiento\nProductivo para la Comunidad LGBTI+ y se emiten sus Reglas de Operación, que fueron publicados en el\nPeriódico Oficial del Gobierno del Estado No. 32, alcance I, de fecha 21 de abril del 2023.\nTercero. A partir de la entrada en vigor del presente Acuerdo, las Reglas de Operación del\nPrograma de Apoyo para el Emprendimiento Productivo para la Comunidad LGBTIQ+, subsecuentes o sus modificaciones serán emitidas por la persona titular de la SBGro.\nDado en el “Recinto de las oficinas del Poder Ejecutivo del Estado” el inmueble ubicado en el número 62, en Boulevard René Juárez Cisneros, Edificio Centro Planta Baja, de la Ciudad de los Servicios, en Chilpancingo de los Bravo, Capital del estado de Guerrero, Código Postal 39074, a los veintiseis días del mes de junio de dos mil veinticuatro.\nLA GOBERNADORA CONSTITUCIONAL DEL ESTADO DE GUERRERO.\nMTRA. EVELYN CECIA SALGADO PINEDA.\nRúbrica.\nLA SUBSECRETARIA DE GOBIERNO, ASUNTOS JURÍDICOS Y DERECHOS HUMANOS ENCARGADA\nDE DESPACHO DE LA SECRETARÍA GENERAL DE GOBIERNO.\nDRA. ANACLETA LÓPEZ VEGA.\nRúbrica.\nEL SECRETARIO DE BIENESTAR.\nMTRO. PABLO ANDRE GORDILLO OLIVEROS.\nRúbrica.\nREGLAS DE OPERACIÓN\nN. DE E. A CONTINUACIÓN, SE TRANSCRIBEN LOS ARTÍCULOS TRANSITORIOS DE LOS ACUERDO\nDE MODIFICACIÓN A LAS PRESENTES REGLAS DE OPERACIÓN.\nPrimero. El presente Acuerdo de Modificación entrará en vigor al día siguiente de su publicación en el Periódico Oficial del Gobierno del Estado de Guerrero.\nSegundo. Se derogan todas las disposiciones que se opongan al presente Acuerdo de\nModificación.\nPlanta Baja, Boulevard René Juárez Cisneros No. 62, código postal 39074, colonia Ciudad de los Servicios, en Chilpancingo de los Bravo, capital del estado de Guerrero, a los veintisiete días del mes de enero del año dos mil veinticinco.\nMTRO. PABLO ANDRE GORDILLO OLIVEROS.\nRúbrica.",
  "ordenamiento": "PROGRAMA",
  "jurisdiccion": "GUERRERO",
  "fuente_oficial": "DIARIO OFICIAL DE LA FEDERACION",
  "Fecha de Publicación": "21 DE MARZO DE 2025",
  "ULTIMA REFORMA PUBLICADA": null,
  "status": "VIGENTE",
  "es_escaneado": false,
  "tiene_tablas": true,
  "materia": [
    "económico"
  ]
}