{
  "titulo": "Acuerdo por el Que Se Crea el Programa Producción Industrial de Maíz y Se Emiten Sus Reglas de Opera",
  "Contenido": "FISCAL 2022\nTEXTO ORIGINAL.\nAcuerdo publicado en el Periódico Oficial del Gobierno del Estado No. 61 alcance I, el martes 02 de agosto de 2022.\nACUERDO POR EL QUE SE CREA EL PROGRAMA PRODUCCIÓN INDUSTRIAL DE MAÍZ Y SE\nEMITEN SUS REGLAS DE OPERACIÓN PARA EL EJERCICIO FISCAL 2022.\nPoder Ejecutivo.\nMAESTRA EVELYN CECIA SALGADO PINEDA, GOBERNADORA CONSTITUCIONAL DEL ESTADO\nDE GUERRERO, CON FUNDAMENTO EN LO DISPUESTO POR LOS ARTÍCULOS 71, 87, 88, 90\nLOS ARTÍCULOS 2, 3, 6, 7, 10, 11, 18 APARTADO A FRACCIONES I Y X, 20 FRACCIÓN III Y 29 DE LA\nLEY ORGÁNICA DE LA ADMINISTRACIÓN PÚBLICA DEL ESTADO DE GUERRERO NÚMERO 08; 1,\n2 FRACCIÓN I, 18 Y 25 DE LA LEY NÚMERO 454 DE PRESUPUESTO Y DISCIPLINA FISCAL DEL\nESTADO DE GUERRERO; 33, 34 Y 35 FRACCIONES I Y II DE LA LEY DE FOMENTO ECONÓMICO,\nINVERSIÓN Y DESARROLLO DEL ESTADO DE GUERRERO NÚMERO 487; EN RELACIÓN CON EL\nARTÍCULO 57 Y ANEXOS 21(E10) Y 21 A(E10) DEL DECRETO NÚMERO 160 DEL PRESUPUESTO DE\nEGRESOS DEL ESTADO DE GUERRERO PARA EL EJERCICIO FISCAL 2022 Y LOS LINEAMIENTOS\nPARA LA ELABORACIÓN DE LAS REGLAS DE OPERACIÓN DE LOS PROGRAMAS SOCIALES\nESTATALES PARA EL PERIODO 2022-2027.\nQue el Plan Nacional de Desarrollo 2019-2024, establece como principio rector la economía para el bienestar, que busca centrar el objetivo de la política económica en el mejoramiento del nivel de vida de la población. Por lo tanto, este documento rector del desarrollo económico y social de nuestro país constituye el punto de partida para el diseño e implementación del Programa Producción Industrial de Maíz.\nQue el Plan Estatal de Desarrollo 2022-2027, en el Eje 2 Desarrollo Económico Sostenible, establece en sus estragias y líneas de acción promover el acceso al financiamiento de los emprendedores y las Micro, Pequeñas y Medianas Empresas (MIPYMES). económicos, sociales, culturales y ambientales para hacer realidad el progreso y el bienestar de sus habitantes; al efecto, expedirá programas de gobierno y políticas públicas que se requieran.\nFISCAL 2022 contribuyendo al desarrollo de la Micro y Pequeña Empresa del Sector Industrial de Maíz, que permitan mejorar la inocuidad, brindar un servicio de calidad y seguridad al cliente, favoreciendo la generación de oportunidades de autoempleo y empleo, bien remunerados.\nQue los recursos aprobados en el Presupuesto de Egresos 2022, para el financiamiento del Programa\nProducción Industrial de Maíz, se incluyen en el Fondo de Inversión Estatal Directa (IED), mismos que, para su aplicación, estarán sujetos a la suficiencia presupuestal disponible.\nQue Guerrero es un ejemplo vivo de las desigualdades sociales y económicas, la lacerante pobreza y la poca cercanía de las instituciones con el pueblo han desembocado en un contexto de violencia continua, con periodos álgidos en distintas zonas del estado. A nivel nacional, Guerrero se ha caracterizado por ser una entidad con altos índices delincuenciales y presencia de grupos criminales, lo cual vulnera los derechos de la población, arrebatando la paz y la tranquilidad de los hogares guerrerenses.\nQue en este sentido el presupuesto de egresos 2022 tiene como objetivo, contribuir a aumentar las bases para la disminución de la pobreza y traer paz a las familias. Pobreza y violencia son sin duda el resultado de gobiernos con poca sensibilidad social, por lo que la transparencia, la honestidad, la austeridad republicana, el combate a la corrupción y la eficiencia en el ejercicio del gasto son ejes fundamentales que le dan sustento.\nQue, por consiguiente, las personas titulares de las secretarías y/o entidades paraestatales de la administración pública, así como las servidoras y servidores públicos autorizados para ejercer recursos públicos del presupuesto e inversión de los mismos, serán responsables de los programas y/o proyectos de inversión que aplican, en que los apoyos otorgados deberán sujetarse a los criterios de objetividad, equidad, transparencia, publicidad, selectividad y temporalidad.\nQue en el artículo 57 del Decreto Número 160 del Presupuesto de Egresos del Estado de Guerrero para el\nEjercicio Fiscal 2022, establece que, con el objeto de asegurar la aplicación eficiente, eficaz, oportuna, equitativa y transparente de los recursos públicos, la Secretaría de Finanzas y Administración y la\nSecretaría de Planeación y Desarrollo Regional, emitirán las disposiciones a que deberán sujetarse los programas de inversión sujetos a reglas de operación.\nQue la Secretaría de Planeación y Desarrollo Regional, expidió los Lineamientos para la Elaboración de las Reglas de Operación de los Programas Sociales Estatales para el Periodo 2022-2027, publicados en cuales, tienen la finalidad de ser un instrumento técnico que guie la elaboración de los apartados centrales de las reglas de operación, así como los elementos para integrar su contenido.\nQue la Secretaría de Fomento y Desarrollo Económico, entre sus atribuciones tiene la de planear y coordinar las actividades económicas y de inversión, estableciendo y fomentando la ejecución de programas, proyectos y acciones que demanden el interés general, procurando en todo momento la preservación del medio ambiente.\nFISCAL 2022 en el sector industrial de maíz legalmente constituidas, que forman parte de la población potencial, cuya actividad económica esté vinculada al mismo, asentadas en cualquiera de las siete regiones del estado y que cuenten con domicilio fiscal que lo acredite, para que les permitan mejorar la inocuidad, brindar un servicio de calidad y seguridad al cliente.\nPor lo anteriormente expuesto, he tenido a bien expedir el siguiente:\nACUERDO POR EL QUE SE CREA EL PROGRAMA PRODUCCIÓN INDUSTRIAL DE MAÍZ Y SE\nEMITEN SUS REGLAS DE OPERACIÓN PARA EL EJERCICIO FISCAL 2022.\nArtículo 1. Se crea el Programa Producción Industrial de Maíz, para el Ejercicio Fiscal 2022, el cual tiene por objeto contribuir al desarrollo de la Micro y Pequeña Empresa del Sector Industrial de Maíz, que permitan mejorar la inocuidad, brindar un servicio de calidad y seguridad al cliente.\nArtículo 2. La Secretaría de Fomento y Desarrollo Económico, tendrá a cargo la implementación, operación, evaluación y administración del Programa Producción Industrial de Maíz para el ejercicio 2022, bajo los criterios de objetividad, equidad, transparencia, publicidad, selectividad y temporalidad, con estricto apego a la normatividad aplicable, por lo tanto, será la encargada de la dispersión y asignación de los recursos apegándose plenamente a las Reglas de Operación.\nArtículo 3. Se emiten las Reglas de Operación del Programa Producción Industrial de Maíz para el Ejercicio\nFiscal 2022, en las cuales se establece el procedimiento de ejecución del Programa, los principios, requisitos y condiciones que deben observarse para acceder al mismo, en los términos siguientes.\nREGLAS DE OPERACIÓN DEL PROGRAMA PRODUCCIÓN INDUSTRIAL DE MAÍZ PARA EL\nEJERCICIO FISCAL 2022.\n1.1. Introducción.\n1.1. Antecedentes.\nLos programas son los medios por los cuales la administración pública propiciará la acción deliberada y comprometida de los sectores productivos e instancias de gobierno, para que participen en el fomento de las actividades viables para el desarrollo económico del Estado, incrementando el empleo y preservando el medio ambiente.\nEl Programa Producción Industrial de Maíz, es con el propósito de dar cumplimiento al compromiso que asumió la Mtra. Evelyn Cecia Salgado Pineda, Gobernadora Constitucional del Estado de Guerrero, relativo a contribuir al desarrollo de la Micro y Pequeña Empresa del Sector Industrial de Maíz, que permitan mejorar la inocuidad, brindar un servicio de calidad y contribuir a mejorar el bienestar de estos segmentos de población.\n2. Alineación Programática al PED y/o PND.\nFISCAL 2022\nEl Programa Producción Industrial de Maíz, está alineado al Plan Nacional de Desarrollo 2019-2024, específicamente, al Eje III Economía; Objetivo 6, Impulsar la reactivación económica, el mercado interno y económica nacional a través de la creación de empleos formales, que otorguen seguridad social y bien remunerados.\nAdicionalmente, el Plan Nacional de Desarrollo 2019-2024, establece que la propuesta de desarrollo económico, político y social, que promueve el Gobierno Federal, en el marco de la Cuarta Transformación, se sustenta en principios rectores, de los cuales, uno se refiere a la economía para el bienestar, que considera al crecimiento económico, y el incremento de la productividad y la competitividad, como medios para alcanzar el bienestar de la población. En este sentido, por su objetivo, el Programa Producción\nIndustrial de Maíz, se encuentra alineado con este principio rector.\n2.1. Diagnóstico.\nEl sector industrial de maíz en Guerrero está conformado por aproximadamente 6,500 tortillerías, clasificadas como micro y pequeñas empresas, de las cuales más del 90% son empresas familiares. La importancia de este sector radica en que genera a nivel estatal, más de 6,500 empleos y tiene una derrama económica anual al campo guerrerense de aproximadamente 400 Millones de Pesos, según datos proporcionados por los mismos industriales.\nLa pandemia derivada del COVID-19 ha generado un impacto para diversas industrias, sin embargo, este sector se ha visto afectado de manera importante. Factores externos como una contracción del mercado, ha ocasionado inestabilidad en las finanzas y en la economía de la mayoría de las empresas adheridas a este sector. Todo esto, genera que resalten con mayor fuerza las carencias que indudablemente conviven con esta industria, entre las que sobresalen:\n• Escasa liquidez para la compra de maíz estatal y nacional.\n• Oferta limitada de maíz en el estado durante el periodo de abril y noviembre.\n• Nula existencia de infraestructura en bodegas alrededor del estado, las cuales impiden al sector un almacenamiento eficiente de materia prima como el maíz.\nMás del 70% de los agremiados a este sector cuentan con maquinarias de producción obsoletas y herramientas de trabajo limitadas. Estas detienen el desarrollo competitivo y el fortalecimiento de un sector que es importante para la economía guerrerense.\n2.1.1. Población Potencial.\nLa población potencial del Programa serán todas las personas físicas o morales legalmente constituidas, establecidas en el estado de guerrero, cuya actividad económica forme parte del sector industrial del maíz y que, según datos del sector industrial de la industria de la masa y la tortilla de Guerrero, fluctúan aproximadamente en 6,500 tortillerías.\n2.1.2. Población Objetivo.\nFISCAL 2022\nLas personas físicas o morales del sector industrial de maíz legalmente constituidas, que forman parte de la Población Potencial, cuya actividad económica esté vinculada al mismo, asentadas en cualquiera de las siete regiones del estado y que cuenten con domicilio fiscal que lo acredite.\n2.1.3. Población Beneficiaria.\nLas personas físicas o morales legalmente constituidas, cuya actividad económica forme parte del sector industrial del maíz, que tengan el interés de brindar un servicio de calidad y seguridad al cliente, establecidas en cualquiera de las siete regiones del estado y que cuenten con domicilio fiscal en el mismo, que presentaron solicitud de apoyo y fueron atendidas con el otorgamiento de recursos del Programa.\n2.1.4. Población Indígena.\nEl Programa Producción Industrial de Maíz, tiene una cobertura estatal y podrán participar todas las personas físicas o morales legalmente constituidas, cuya actividad económica forme parte del sector industrial del maíz, con domicilio en el estado de Guerrero que forman parte de la Población Objetivo, sin discriminación hacia alguna etnia.\n2.2. Fundamento Legal.\n• Constitución Política de los Estados Unidos Mexicanos.\n• Ley de Coordinación Fiscal.\n• Ley Orgánica de la Administración Pública del Estado de Guerrero Número 08.\n• Ley de Fomento Económico, Inversión y Desarrollo del Estado de Guerrero Número 487.\n• Ley Número 454 de Presupuesto y Disciplina Fiscal del Estado de Guerrero.\n• Ley Número 466 de Protección de Datos Personales en Posesión de Sujetos Obligados del Estado de Guerrero.\n• Decreto Número 160 del Presupuesto de Egresos del Estado de Guerrero para el Ejercicio Fiscal\n2022.\n• Lineamientos para la elaboración de las Reglas de Operación de los Programas Sociales\nEstatales para el periodo 2022- 2027.\nFISCAL 2022\n• Reglamento Interior de la Secretaría de Fomento y Desarrollo Económico.\n2.3. Definiciones y Siglas.\nPara efectos de estas Reglas de Operación se entenderá por:\nDefiniciones:\nApoyo (s): Asignación de recursos económicos que, bajo la figura de subsidio, otorga el gobierno del estado de Guerrero a través de la Secretaría de Fomento y Desarrollo Económico, a las beneficiarias y beneficiarios del Programa Producción Industrial de Maíz.\nBeneficiarias o Beneficiarios: Persona que cumpliendo con los requisitos que contemplan las reglas, recibe el apoyo requerido.\nComité de Evaluación: Comité de Evaluación del Programa Producción Industrial de Maíz.\nDirección General: Dirección General de Promoción Industrial, Agroindustrial y Minería.\nFactura Electrónica: La factura electrónica (CFDI), compuesta por archivos PDF y XML.\nPoblación Beneficiaria: Todas las personas físicas o morales legalmente constituidas, cuya actividad económica forme parte del sector industrial del maíz y que cumpliendo con los requisitos que contemplan las reglas, recibieron el apoyo requerido\nPresupuesto de Egresos 2022: Decreto Número 160 del Presupuesto de Egresos del Estado de Guerrero para el Ejercicio Fiscal 2022.\nPrograma: Programa Producción Industrial de Maíz.\nReglas de Operación: Reglas de Operación del Programa Producción Industrial de Maíz para el Ejercicio\nFiscal 2022.\nSolicitud de Apoyo: Formato de Solicitud de Apoyo del Programa Producción Industrial de Maíz, Anexo\n1, de las presentes Reglas de Operación.\nSiglas:\nCURP: Clave Única de Registro de Población.\nSEFODECO: Secretaría de Fomento y Desarrollo Económico.\n3. Objetivos y Alcances.\n3.1. Objetivo General.\nFISCAL 2022\nContribuir al desarrollo de la Micro y Pequeña Empresa del Sector Industrial de Maíz, a través del otorgamiento de subsidios de carácter temporal, que permitan mejorar la inocuidad, brindar un servicio de calidad y seguridad al cliente.\n3.2. Objetivo Específico.\nOtorgar apoyos a beneficiarias y beneficiarios del Programa, que sean utilizados para equipamiento o infraestructura, como Mostrador Inoxidable y Báscula Electrónica, así como remodelación del local, que contribuya a mejorar el servicio a la población o la formalización de una Microempresa, con domicilio fiscal en el estado de Guerrero del sector industrial de maíz.\n3.3. Cobertura.\nEl Programa tendrá una cobertura estatal, por lo tanto, podrán participar las personas contempladas en la\nPoblación Objetivo, es decir todas las personas físicas o morales legalmente constituidas, cuya actividad económica forme parte del sector industrial del maíz, que tengan el interés de brindar un servicio de calidad y seguridad al cliente, establecidas en cualquiera de las siete regiones del estado y que cuenten con domicilio fiscal en el mismo, dando prioridad a las regiones montaña y costa chica, donde existen mayores índices de pobreza.\n3.4. Alcances.\nEl Programa contempla el otorgamiento de apoyos a las micro y pequeñas empresas del sector industrial de maíz, que forman parte de la Población Objetivo, es decir todas las personas físicas o morales legalmente constituidas, cuya actividad económica forme parte del sector industrial del maíz, que tengan el interés de brindar un servicio de calidad y seguridad al cliente, establecidas en cualquiera de las siete regiones del estado. En este sentido se pretende que este sector formal siga conservando los empleos y quienes no se han formalizado, al cumplir con los requisitos se estarían formalizando, que es uno de los objetivos. Atendiendo el derecho al empleo y seguridad social; entendiéndose como un conjunto de medidas que la sociedad proporciona a sus integrantes, con la finalidad de evitar desequilibrios económicos y sociales, que de no resolverse significarían la reducción o la perdida de los ingresos a consecuencia del desempleo.\n4. Metas Físicas.\nEl Programa está conceptualizado para beneficiar a 77 personas físicas o morales legalmente constituidas, que realicen alguna actividad dentro de la cadena de industrialización de maíz, siempre que cumplan con lo dispuesto en las presentes Reglas de Operación. Los apoyos consisten en la adquisición de equipo, como Mostrador Inoxidable y Báscula Electrónica, además de remodelación del local que mejore su imagen.\n5. Programación Presupuestal.\nEl monto aprobado para la implementación del Programa asciende a $2,000,000.00 (Dos millones de pesos\n00/100 M. N.), de conformidad con lo dispuesto en el Presupuesto de Egresos 2022; los recursos provienen\nFISCAL 2022 del Fondo de Financiamiento de Inversión Estatal Directa (IED) y estarán sujetos a la suficiencia presupuestal disponible.\nEn la ejecución de los recursos deberá cumplirse con el principio de anualidad, señalado en el mismo\nPresupuesto de Egresos, estableciendo la calendarización del recurso en tres ministraciones.\nPrograma de Ministración de Recursos\nMes de Agosto Totalidad del monto del recurso\n$2,000,000.00 $2,000,000.00\n5.1. Gastos de Operación.\nEl Programa contempla gastos de operación, cuyo monto corresponderá hasta el 3% de los recursos aprobados en el Presupuesto de Egresos 2022 y se destinará a diversas acciones asociadas con la planeación, promoción, difusión, operación, supervisión, verificación, contraloría social, evaluación y la publicación de las convocatorias del Programa, en dos periódicos de mayor circulación en el Estado de\nGuerrero.\n6. Criterios y Requisitos de Elegibilidad.\nPara acceder a los beneficios del Programa, serán elegidas las personas físicas o morales legalmente constituidas, cuya actividad económica forme parte del sector industrial del maíz, que tengan el interés de brindar un servicio de calidad y seguridad al cliente, establecidas en cualquiera de las siete regiones del estado y que cuenten con domicilio fiscal en el mismo. Además, que presenten solicitud de apoyo y que cumplan con los requisitos, que el mismo impone, los que se relacionan enseguida.\na). Criterios de elegibilidad.\nLas personas interesadas en la obtención de apoyos del Programa deberán cumplir los siguientes criterios:\n● Cumplir con los requisitos del Programa. Ser micro y/o pequeña empresa del sector industrial de maíz legalmente constituida, que forman parte de la población objetivo y que requiera mejorar su inocuidad, imagen, brindar un servicio de calidad y seguridad al cliente, y que su domicilio fiscal corresponda al estado de Guerrero.\n● Cumplir con lo establecido en la convocatoria correspondiente del Programa y tener domicilio fiscal en\nGuerrero.\nb). Requisitos.\nFISCAL 2022\nPodrán participar todas las personas físicas o morales legalmente constituidas, cuya actividad económica forme parte del sector industrial del maíz, que tengan el interés de brindar un servicio de calidad y seguridad al cliente, establecidas en cualquiera de las siete regiones del estado y que cuenten con domicilio fiscal en el mismo, cumpliendo los siguientes requisitos:\nRequisito Documento\na). - Presentar Solicitud de Apoyo de Formato de Solicitud de Apoyo del acuerdo a la convocatoria Programa. (Se agrega anexo 3) correspondiente\nb). - Identificación del solicitante Copia de la identificación oficial con fotografía (Credencial para votar, Cédula\nProfesional o Pasaporte)\nc). - Domicilio fiscal en el estado de Copia de recibo telefónico, recibo del\nGuerrero servicio de agua o recibo de luz, con fecha no mayor a tres meses de la fecha de expedición, del domicilio fiscal del solicitante.\nd). - Realizar actividades económicas Constancia de Situación Fiscal, con fecha de del sector industrial de maíz. impresión no mayor a un mes, con tributación en cualquiera de los siguientes regímenes fiscales: Régimen de Personas\nFísicas con Actividades Empresariales o\nRégimen Simplificado de Confianza\n(RESICO).\ne). - Contar con cuenta bancaria Estado de cuenta bancaria a nombres del solicitante, con CLABE interbancaria y con fecha no mayor a dos meses de la fecha de expedición.\nFISCAL 2022\nf)-. No duplicar apoyos del gobierno Escrito dirigido a la persona titular de la\nEconómico, firmado bajo protesta de decir verdad, en el que manifieste el solicitante que, en el presente ejercicio fiscal, no ha recibido apoyo por parte de otras dependencias del gobierno del estado, para el mismo concepto de apoyo solicitado.\n7. Tipo, Monto y Periodicidad del Apoyo.\nEl Programa, otorgará por única vez un apoyo que puede ser hasta por un monto de $25,000.00 (Veinticinco mil pesos 00/100 M. N.), por beneficiaria o beneficiario, conforme a lo establecido en las presentes Reglas de Operación y que será utilizado en la adquisición de equipo, como Mostrador Inoxidable y Báscula\nElectrónica, además de remodelación del local que mejore su imagen.\n7.1. Características de los Apoyos.\nLos apoyos que se otorgarán al amparo del Programa, son recursos económicos asignados a las personas solicitantes que forman parte de la población objetivo, es decir todas las personas físicas o morales legalmente constituidas, cuya actividad económica forme parte del sector industrial del maíz, que permitan mejorar la inocuidad, brindar un servicio de calidad y seguridad al cliente, para la creación formal o la formalización, de una Microempresa, con domicilio fiscal en el estado de Guerrero, en el sector industrial de maíz. El apoyo podrá destinarse a equipamiento o infraestructura, consistente en la adquisición de equipo, como Mostrador Inoxidable y Báscula Electrónica, además de remodelación del local que mejore su imagen.\n7.2. Recursos no Devengados.\nLos recursos aprobados para el Programa, en el Presupuesto de Egresos 2022, que no sean ejercidos o devengados al 31 de diciembre del presente año, serán reintegrados de inmediato a la Secretaría de\nFinanzas y Administración del Estado de Guerrero.\n7.3. Resguardo de la Documentación.\nLa Dirección General, perteneciente a la SEFODECO, resguardará la documentación comprobatoria del ejercicio de los recursos del Programa y la Delegación Administrativa de la misma dependencia, efectuará el cierre del ejercicio.\n7.4. Supervisión y Control.\nEl Programa estará a cargo de la SEFODECO a través de la Dirección General de Promoción Industrial, Agroindustrial y Minería, quien será la responsable de su operación y de la verificación del cumplimiento\nFISCAL 2022 de los objetivos establecidos en las presentes Reglas de Operación, y deberá enviar un reporte mensual a la Unidad de Planeación y Presupuesto, a partir de la publicación de la convocatoria correspondiente.\nAsimismo, la SEFODECO enviará trimestralmente a la Secretaría de Finanzas y Administración, a la\nGubernamental, informes sobre el presupuesto ejercido, mismos que están establecidos por el Consejo\nNacional de Armonización Contable (CONAC). Dichos informes se deberán presentar a más tardar a los quince días hábiles posteriores a la terminación de cada trimestre.\n8. Criterios de Selección.\nPara acceder a los beneficios del Programa, se deben cumplir con los requisitos que entre otros son, ser micro y/o pequeña empresa del sector industrial de maíz, que formen parte de la población objetivo es decir todas las personas físicas o morales legalmente constituidas, cuya actividad económica forme parte del sector industrial del maíz, establecidas en cualquiera de las siete regiones del estado y que cuenten con domicilio fiscal en el mismo y que requieran mejorar su inocuidad, imagen, brindar un servicio de calidad y seguridad al cliente, y que su domicilio fiscal corresponda al estado de Guerrero.\nLa selección de beneficiarias o beneficiarios del Programa, será conforme al siguiente procedimiento:\n• Recepción de solicitudes de apoyo y los documentos establecidos en las presentes Reglas de\nOperación.\n• La Dirección General, emitirá el dictamen correspondiente de las solicitudes de apoyo recibidas, conforme a lo establecido en las presentes Reglas de Operación.\n• El Comité de Evaluación del Programa, autorizará las solicitudes de apoyo, que cuenten con dictamen favorable emitido por la Dirección General, conforme al orden de prelación de presentación de las solicitudes y de acuerdo al orden, de mayor a menor, de la calificación obtenida con base al análisis técnico y social realizado a la solicitud de apoyo.\n• La Dirección General, notificará a los solicitantes, mediante oficio de resolución firmado por la persona titular de la SEFODECO, las solicitudes de apoyo autorizadas, por el Comité de\nEvaluación, en un término de tres días hábiles, contados a partir del día siguiente de la sesión donde se analiza la solicitud del demandante y en la cual fue autorizada su solicitud de apoyo.\n• Una vez notificado el oficio de resolución de autorización de la Solicitud de Apoyo del Programa, la persona solicitante deberá entregar en un plazo de tres días hábiles, contados a partir del día siguiente de la notificación del oficio de resolución, la factura electrónica, a nombre de la Secretaría de Finanzas y Administración del Estado de Guerrero, que contenga el concepto y el monto del apoyo recibido. La factura electrónica deberá ser enviada al correo electrónico\nFISCAL 2022\n• La Delegación Administrativa de la SEFODECO, realizará la trasferencia bancaria a las personas solicitantes que cuenten con Solicitud de Apoyo autorizada por el Comité de Evaluación, en un plazo de tres días hábiles, contados a partir del día siguiente del oficio de notificación por parte de la persona titular de la SEFODECO.\nMediante oficio firmado por la persona titular de la SEFODECO, se notificará a las personas que presenten solicitud de Apoyo del Programa, las causas por las que sus solicitudes no cuentan con autorización por parte del Comité de Evaluación, mismas que estarán relacionadas con el incumplimiento a lo establecido en las presentes Reglas de Operación, la convocatoria correspondiente, insuficiencia presupuestal, o por lo dispuesto en el marco normativo que regula el Programa.\n8.1. Casos Especiales.\nLos casos especiales del Programa y aquellos casos no previstos en las presentes Reglas de Operación, serán atendidos por el Comité de Evaluación, que dictará las acciones a seguir y las resoluciones pertinentes.\n8.2. Casos de Emergencia o Desastre.\nEn caso de una declaratoria de emergencia o de desastre, el Comité de Evaluación, analizará la situación y, de afectarse la operación del Programa, deberá emitir el plan de acción que permita dar cumplimiento a sus objetivos, de conformidad con lo establecido en las presentes Reglas de Operación.\n8.3. Suspensión o Cancelación del Programa Social.\nLa SEFODECO podrá suspender o cancelar la operación del Programa, cuando las condiciones sociales y económicas, sean favorables para el cumplimiento de los objetivos; en caso de problemas de gobernabilidad en la entidad, el Programa podrá ser cancelado por la persona titular del Poder Ejecutivo.\nEl apoyo del Programa, será cancelado por la SEFODECO cuando lo solicite por escrito la persona disposiciones normativas aplicables.\n8.4. Integración del Padrón de Personas Beneficiarias.\nLas personas que reciban un apoyo del Programa, serán incorporadas por la Dirección General, al Padrón\nÚnico de Personas Beneficiarias, cuya información será considerada en términos de lo dispuesto en la Ley\nNúmero 466 de Protección de Datos Personales en Posesión de Sujetos Obligados del Estado de Guerrero\n9.Mecánica Operativa del Programa Social.\n9.1 Instancia Ejecutora y/o Responsable.\nFISCAL 2022\nLa instancia ejecutora del Programa será la SEFODECO, a través de la Dirección General de Promoción\nIndustrial, Agroindustrial y Minería, emitiendo las Reglas de Operación de acuerdo al marco normativo aplicable.\nCon el objeto de asegurar la aplicación eficiente, eficaz, oportuna, equitativa y transparente de los recursos públicos, la Secretaría de Finanzas y Administración, y la Secretaría de Planeación y Desarrollo Regional, emiten las disposiciones normativas que regulan los programas de inversión sujetos a Reglas de\nOperación.\nLa Secretaría de Planeación y Desarrollo Regional, valida y aprueba las Reglas de Operación, mismas que, una vez validadas y aprobadas, serán publicadas en el Periódico Oficial del Gobierno del Estado de\nGuerrero, previo trámite realizado por la SEFODECO. La Secretaría de Finanzas y Administración, efectuará las ministraciones de recursos presupuestales en concordancia con el Presupuesto de Egresos\n2022.\nLa solicitud de apoyo y los documentos señalados, deberán presentarse en las oficinas de la Dirección\nGeneral de Promoción Industrial, Agroindustrial y Minería, ubicadas en el Recinto de las Oficinas del Poder\nEjecutivo del Estado de Guerrero, Edificio Acapulco, Primer Piso, Boulevard Lic. René Juárez Cisneros No.\n62, Col. Ciudad de los Servicios, Chilpancingo, Gro., en un horario de atención de las 9:00 a las 16:00 horas, o enviarse al correo electrónico mineria.sefodeco@guerrero. gob.mx en archivo PDF por cada uno del documento enviado.\n9.2. Proceso de Incorporación al Programa Social.\nLas personas contempladas en la población objetivo, interesadas en la presentación de solicitud de apoyo del Programa, podrán participar en la convocatoria que para tal efecto emita y publique la SEFODECO, en dos periódicos de mayor circulación en el estado de Guerrero, en dos días diferentes. Adicionalmente, la convocatoria se publicará en el portal oficial del Gobierno del Estado www.guerrero.gob.mx y en las redes sociales oficiales de la SEFODECO: Sefodeco Guerrero (Facebook), @sefodecogro (Twitter).\nLas Reglas de Operación, la convocatoria, la solicitud de apoyo y la información inherente al Programa, de Guerrero, Edificio Acapulco, Primer Piso, Boulevard Lic. René Juárez Cisneros No. 62, Col. Ciudad de los Servicios, Chilpancingo, Gro., en un horario de atención de las 9:00 a las 16:00 horas.\nAdicionalmente, los documentos mencionados estarán disponibles en el portal oficial del Gobierno del\n(Facebook), @sefodecogro (Twitter).\nEl procedimiento de acceso de los solicitantes al Programa, será el siguiente:\nFISCAL 2022\nGuerrero, la SEFODECO publicará la convocatoria correspondiente, con la cual se abrirá el periodo de recepción de solicitudes de apoyo.\nLa Dirección General, dictaminará las solicitudes de apoyo presentadas y aquellas que obtengan dictamen favorable, en términos de lo dispuesto en las presentes Reglas de Operación, serán presentadas, para su autorización correspondiente, al Comité de Evaluación.\nEl Comité de Evaluación, es un órgano colegiado interno que tendrá como objetivo conocer y resolver los asuntos del Programa, especialmente, la autorización de solicitudes de apoyo; estará integrado de la siguiente manera:\n• La persona titular de la Secretaría de Fomento y Desarrollo Económico, que fungirá como presidenta o presidente;\n• La persona titular de la Dirección General Promoción Industrial, Agroindustrial y Minería, quien fungirá como secretario;\n• La persona titular de la Subsecretaría de Fomento Económico;\n• La persona titular de la Delegación Administrativa, y\n• La persona titular de la Unidad de Asuntos Jurídicos.\n• La autorización de las solicitudes de apoyo se efectuará en sesión del Comité de Evaluación, con la presencia del cincuenta por ciento más uno de sus integrantes, levantándose la minuta correspondiente, misma que deberá contener la relación de las solicitudes de apoyo autorizadas.\nLos apoyos del Programa se autorizarán de acuerdo al mecanismo: primero en tiempo, primero en derecho; estableciendo un orden de prelación, por separado, de las solicitudes de apoyo presentadas, que cuenten con dictamen favorable de la Dirección General, que se integren al orden de mayor a menor, en la calificación obtenida en la solicitud de apoyo, misma que será emitida por el Comité de Evaluación y a la autorización correspondiente, por parte del mismo Comité de Evaluación, hasta agotar el monto presupuestal disponible; atendiendo la perspectiva de género, del total de apoyos que se otorgarán al amparo del Programa en el Ejercicio Fiscal 2022.\nEl secretario técnico del Comité de Evaluación, la Dirección General levantará el acta correspondiente de las sesiones, mismas que contendrá, entre sus puntos, el listado de las solicitudes de apoyo autorizadas.\nMediante oficio firmado por la persona titular de la SEFODECO, se notificará la resolución de autorización de apoyo a las personas solicitantes, en un plazo de tres días hábiles contados a partir del día siguiente a la sesión del Comité de Evaluación. En el oficio de resolución se deberá solicitar la documentación comprobatoria del apoyo, consistente en la factura electrónica a nombre de la Secretaría de Finanzas y\nAdministración del Estado de Guerrero, que contenga el concepto y el monto del apoyo recibido.\nFISCAL 2022\nLa documentación comprobatoria, consistente en la factura electrónica, deberá ser enviada por la persona solicitante a la Dirección General, en un plazo de tres días hábiles, contados a partir del día siguiente de la recepción del oficio de resolución de la autorización del apoyo, al correo electrónico en tiempo y forma por la persona solicitante, se tendrá por desistida la solicitud de apoyo.\nLa documentación comprobatoria, presentada en tiempo y forma, incluyendo los datos de las cuentas bancarias correspondientes, será remitida mediante oficio firmado por la persona titular de la SEFODECO, a la persona titular de la Delegación Administrativa para que, en un plazo de tres días hábiles, contados a partir de la recepción del oficio citado, efectué las transferencias bancarias de los apoyos autorizados.\nLa persona titular de la Delegación Administrativa entregará mediante oficio a la persona titular de la\nDirección General, los documentos comprobatorios de las transferencias bancarias realizadas a las beneficiarias o beneficiarios del Programa, para su integración en los expedientes de las solicitudes de apoyo.\nLos oficios de requerimientos y resoluciones de las solicitudes de apoyo presentadas, emitidos por la\nSEFODECO, se notificarán a la persona solicitante en el correo electrónico señalado en el formato de solicitud de apoyo.\nEn los requerimientos, las personas solicitantes de apoyo contarán con tres días hábiles, contados a partir del siguiente de la notificación, para cumplir con lo solicitado; de no contestar en el plazo mencionado, se tendrá por desistida la solicitud.\n10. Evaluación.\nLa evaluación del Programa, la realizará la SEFODECO por conducto de la Dirección General, verificando los avances y el cumplimiento de los indicadores e identificando áreas de oportunidad y alternativas de solución que favorezcan el cumplimiento de los objetivos planteados.\n10.1. Indicadores (Construcción de la Matriz de Indicadores para Resultados. - Anexo 1).\nEl gobierno del estado ha adoptado la Metodología de Presupuesto Basado en Resultados (PbR), implementada por el gobierno federal, en este sentido, el indicador para el seguimiento y la evaluación del\nPrograma, se construyó de acuerdo a la Metodología de Marco Lógico (MML), en los siguientes términos en la Ficha Técnica de Indicadores:\nFicha Técnica de indicadores de desempeño.\nEJE: 3 Desarrollo Económico\nEje:\nImpulsar el desarrollo de la Micro y Pequeña Empresa del Sector Industrial del Maíz, a\nObjetivo: través del otorgamiento de subsidios de carácter temporal, que permitan, brindar un servicio de calidad y seguridad al cliente.\nFomentar la creación de empleos, mediante programas sectoriales, proyectos regionales\nEstrategia: y obras de infraestructura.\nFISCAL 2022\nBrindar apoyos directos a Mipymes del sector industrial del maíz; Distribuir los beneficios\nLínea de acción: equitativamente en la 7 Regiones del Estado\nDatos de identificación del indicador\nClave Nombre Fuente\nSecretaría de Fomento y Desarrollo\nE10 Número de empresas beneficiadas\nEconómico.\nDefinición Tipo Dimensión\nMide el número de industrias Mide el número de industrias\nEficacia. tortilleras que reciben beneficios tortilleras que reciben beneficios\nMétodo de Calculo Unidad de Medida\n'2.1.1=TEB/TEP*100 Porcentaje\nSerie de\nFrecuencia de Medición Desagregación geográfica información disponible\nResultados anuales\nAnual Estatal a partir de 2022\nLínea base\nSentido del indicador\nAño Periodo Valor\nAnual, 01 de enero al 31 de\nAscendente 2022 0 diciembre.\nParámetro de semaforización Metas\nVerde Amarillo Rojo Año Periodo Valor\nAnual, 01 de enero al 31 de\n2023 100 diciembre.\nVariables que conforman el indicador\nNombre Unidad de Medida Fuente de Información\n'TEB=Total de Empresas Secretaría de Fomento y Desarrollo\n'Empresas\nBeneficiadas Económico\nNombre Unidad de Medida Fuente de Información\nTEP=Total de Empresas Secretaría de Fomento y Desarrollo\n'Empresas\nProgramadas Económico\nObservaciones\nResponsable del Indicador\nNombre del servidor publico Dependencia Área\nSecretaria de Fomento y Desarrollo Dirección General de Promoción\nIng. Aquiles Sánchez Esquivel\nEconómico. Industrial, Agroindustrial y Minera.\nNombre del puesto, encargo o\nTeléfono Correo electrónico comisión mineria.sefodeco@guerrero.gob.m\nDirector General (+52)7451161491 x\nElaboro Reviso Autorizo\nIng. Aquiles Sánchez Esquivel Lic. Gabriela Nájera Cisneros Mtra. Teodora Ramírez Vega\nDirector General de Promoción\nIndustrial, Agroindustrial y\nPlaneación y Presupuesto. Desarrollo Económico\nMinera.\n10.2. Seguimiento.\nFISCAL 2022\nEl seguimiento del Programa, estará a cargo de la SEFODECO, y particularmente, por la Dirección General, generando en el proceso, información que permita un análisis sobre el avance del cumplimiento de los objetivos establecidos y sobre el ejercicio de los recursos presupuestales asignados. El seguimiento se operación eficiente y eficaz del Programa, y en consecuencia, alcanzar los objetivos propuestos.\n10.3. Auditoría.\nEl ejercicio del recurso y la operatividad del Programa, están sujetos a las disposiciones estatales aplicables y podrá ser auditado por la Secretaría de Contraloría y Transparencia Gubernamental, así como por la\nAuditoría Superior del Estado, conforme a la legislación vigente y en el ámbito de sus respectivas competencias.\nLa SEFODECO, otorgará todas las facilidades a dichas instancias para realizar, en el momento en que lo juzguen pertinente, las auditorías que consideren necesarias; así como el seguimiento y la solventación a las observaciones planteadas por los órganos de control.\n11. Mecanismo de Entrega del Apoyo.\nLos apoyos del Programa, se entregarán de manera directa, mediante transferencia bancaria, a las personas de la población objetivo cuya solicitud de apoyo cuente con la autorización del Comité de\nEvaluación y se haya emitido el oficio de resolución de autorización por parte de la persona titular de la misma SEFODECO.\n12. Derechos y Obligaciones de las Personas Beneficiadas.\nLas personas beneficiarias del Programa, estarán sujetas a los siguientes derechos y obligaciones:\na). Derechos.\n• Recibir el apoyo del Programa de inclusión para ejercerlo de acuerdo a lo establecido en las presentes Reglas de Operación, sin distinción, exclusión o restricción;\n• Recibir asesoría por parte de la SEFODECO, cuando así lo soliciten, para facilitar la correcta aplicación de los recursos recibidos;\n• Recibir un trato digno y respetuoso, por parte de las servidoras y servidores públicos de la\nSEFODECO, y\n• La reserva de su información personal conforme a lo dispuesto en la Ley Número 466 de\nGuerrero.\nFISCAL 2022\nb). Obligaciones.\n• Aplicar el apoyo recibido del Programa, conforme a lo establecido en las presentes Reglas de\nOperación y la convocatoria respectiva.\n• Comprobar el apoyo recibido del Programa, para lo cual deberá entregar en un plazo de cinco días hábiles, contados a partir del día siguiente de la notificación del oficio de resolución de autorización del apoyo, la factura electrónica, a nombre de la Secretaría de Finanzas y\nAdministración del Estado de Guerrero, (SFA-830301521) que contenga el concepto y el monto del apoyo recibido.\nLa factura electrónica deberá ser enviada al correo electrónico mineria.sefodeco@guerrero.gob.mx\n• En caso de incumplimiento verificado por la SEFODECO de la incorrecta aplicación del recurso, se sancionará a la beneficiaria beneficiario hasta con cinco años en los que no podrá recibir beneficio de un programa estatal.\n• En general, cumplir y observar las disposiciones de las presentes Reglas de Operación y las disposiciones jurídicas aplicables.\n12.1. Causales de Suspensión o Baja de las Personas Beneficiadas.\nDebido a que el Programa está diseñado para otorgar un beneficio de manera temporal a las a beneficiarias y beneficiarios, no existe la necesidad de que haya suspensión o baja de las personas beneficiarias, puesto que para acceder al Programa se debe cumplir con todos los requisitos y se hará una revisión exhaustiva de la documentación y el local, para ser beneficiaria o beneficiario, además el apoyo será sólo por una vez para quien cumpla con los requisitos. Por las características del Programa no aplica.\n12.2. Proceso de Baja.\nDebido a que el Programa está diseñado para otorgar un beneficio de manera temporal a las a beneficiarias y beneficiarios, no existe la necesidad de que haya un proceso de baja, puesto que es anual y el beneficio será sólo por única vez a la beneficiaria o beneficiario que cumpla con los requisitos. Por las características del programa no aplica.\n13. Instancias Participantes.\nLas instancias participantes en el Programa son las siguientes:\n• La Secretaría de Planeación y Desarrollo Regional, con la validación y aprobación de las Reglas de Operación.\n• La Secretaría de Finanzas y Administración, con la ministración de recursos presupuestales para la operación del Programa.\nFISCAL 2022\n• La Secretaría de Fomento y Desarrollo Económico, es la instancia ejecutora del Programa, a través de la Dirección General de Promoción Industrial, Agroindustrial y Minería.\n• La Secretaría de Contraloría y Transparencia Gubernamental y la Auditoría Superior del Estado de Guerrero, son entes que pueden realizar la fiscalización del Programa.\n13.1. Instancia Normativa.\nLa SEFODECO, es la instancia normativa del Programa, en consecuencia, le corresponde la ejecución de las presentes Reglas de Operación, y la emisión de la convocatoria, y en general, la aplicación del marco normativo correspondiente a sus facultades y atribuciones.\n14. Transparencia.\nEn materia de transparencia, en el Programa, se atenderán las siguientes líneas de acción:\n14.1. Promoción y Difusión del Programa Social.\nLas presentes Reglas de Operación del Programa, se publicarán en el Periódico Oficial del Gobierno del\nEstado de Guerrero y estarán disponibles para su consulta en las oficinas de la SEFODECO, ubicadas en el Recinto de la Oficinas del Poder Ejecutivo del Estado de Guerrero, Edificio Acapulco, Primer Piso, Boulevard Lic. René Juárez Cisneros, Col. Ciudad de los Servicios, en Chilpancingo, Gro., en un horario de atención de las 9:00 a las 16:00 horas, así como en el portal oficial del Gobierno del Estado www.guerrero.gob.mx y en las redes sociales oficiales de la SEFODECO: Sefodeco Guerrero (Facebook), @sefodecogro (Twitter).\n14.2. Contraloría Social.\nEl fundamento legal del Programa, parte del artículo 29 de la Ley Orgánica de la Administración Pública del Estado de Guerrero Número 08, que establece que a la SEFODECO le corresponde, entre otros temas, planear, regular, promover y fomentar el desarrollo económico del estado de Guerrero, en este sentido, no son aplicables las disposiciones normativas de la Contraloría Social, cuyo fundamento se encuentra en la\nLey General de Desarrollo Social.\nSin embargo, el ejercicio de los recursos públicos y la operación del Programa, están sustentados en la transparencia y la rendición de cuentas, en estricto apego al marco normativo aplicable y bajo la supervisión, mediante auditorías, de entes fiscalizadores como la Secretaría de Contraloría y Transparencia\nGubernamental y la Auditoría Superior del Estado de Guerrero.\nAsimismo, la información del Programa, se encuentra disponible para los ciudadanos, conforme a lo dispuesto en la Ley Número 466 de Protección de Datos Personales en Posesión de Sujetos Obligados del de Guerrero.\nFISCAL 2022\n14.3. Protección de Datos Personales. las solicitudes de apoyo, se regirán por lo establecido en la Ley Número 466 de Protección de Datos\nPersonales en Posesión de Sujetos Obligados del Estado de Guerrero y la Ley Número 207 de\nTransparencia y Acceso a la Información Pública del Estado de Guerrero.\n14.4. Quejas y Denuncias.\nLos ciudadanos y las beneficiarias o beneficiarios del Programa, podrán presentar ante la SEFODECO, quejas y denuncias, sobre hechos, actos u omisiones, que afecten sus derechos o el incumplimiento de lo dispuesto en las presentes Reglas de Operación; los medios de presentación de las quejas y denuncias, son los siguientes:\n● Presencial: en el domicilio de las oficinas de la SEFODECO, ubicadas en el Recinto de la Oficinas del\nPoder Ejecutivo del Estado de Guerrero, Edificio Acapulco, Primer Piso, Boulevard Lic. René Juárez\nCisneros No. 62, Col. Ciudad de los Servicios, en Chilpancingo, Gro., en un horario de atención de las\n9:00 a las 16:00 horas.\n● Correo electrónico: sefodeco@guerrero.gob.mx\n● Telefónica: en el número telefónico 7474719700 Extensión 9923\nPara dar respuesta a las quejas y denuncias, la SEFODECO dispondrá de un plazo de diez días hábiles contados a partir del día siguiente de su fecha de presentación.\nLos ciudadanos y las beneficiarias o beneficiarios del Programa, también podrán presentar sus quejas y denuncias ante la Secretaría de Contraloría y Transparencia Gubernamental, a través de los siguientes medios:\n● Presencial: en el domicilio de las oficinas de la Secretaría de Contraloría y Transparencia Gubernamental, ubicadas en el Recinto de la Oficinas del Poder Ejecutivo del Estado de Guerrero, Edificio Norte, Primer\nPiso, Boulevard Lic. René Juárez Cisneros No. 62, Col. Ciudad de los Servicios, en Chilpancingo, Gro., en un horario de atención de las 9:00 a las 16:00 horas.\n● Telefónico: en el número telefónico 747471974.\nEn la denuncia o queja la ciudadanía o las beneficiarias o beneficiarios del Programa, deberán proporcionar los siguientes datos:\na) Nombre de la servidora o servidor público,\nb) Secretaría o dependencia de adscripción,\nc) Objeto de la denuncia o queja,\nFISCAL 2022\na) Nombre y domicilio de la persona quejosa, e\nb) Identificación oficial.\n14.5. Acciones de Blindaje.\nEn la operación y el ejercicio de los recursos presupuestales aprobados para el Programa, se aplicarán los lineamientos normativos que emitan la Secretaría de Contraloría y Transparencia Gubernamental, el\nInstituto de Transparencia, Acceso a la Información y Protección de Datos Personales del Estado de\nGuerrero (ITAIG), el Instituto Electoral y de Participación Ciudadana del Estado de Guerrero (IEPC) y demás instancias federales y estatales competentes, con la finalidad de impedir que los apoyos sean utilizados con fines político electorales.\nComo estrategia de blindaje electoral, la papelería, documentación oficial, así como la publicidad y promoción del Programa, deberán incluir la siguiente leyenda:\n“Este Programa es de carácter público, no es patrocinado ni promovido por partido político alguno y sus recursos provienen de los impuestos que pagan todos los contribuyentes. Está prohibido el uso de este programa con fines políticos, electorales, de lucro y otros distintos a los establecidos.\nQuien haga uso indebido de los recursos de este programa deberá ser denunciado y sancionado de acuerdo con la ley aplicable y ante la autoridad competente”.\nEn cuanto a la publicidad en medios electrónicos, impresos, complementarios o de cualquier otra índole, vinculados con los programas de comunicación social, se deberá incluir la siguiente leyenda:\n“Este Programa es público y queda prohibido su uso con fines partidistas o de promoción personal”.\n14.6. Acta de Donación.\nLos apoyos del Programa se entregarán de manera directa, mediante transferencia bancaria, a las personas de la población objetivo cuya solicitud de apoyo cuente con la autorización del Comité de\nEvaluación y se haya emitido el oficio de resolución de autorización por parte de la persona titular de la misma SEFODECO; sin embargo, la beneficiaria o beneficiario deberá comprobar fehacientemente que cumplió con el cometido del Programa.\n15. Perspectiva de Género.\nEl Programa, contribuye al fortalecimiento de la perspectiva de género, partiendo del reconocimiento de que representa una condición indispensable y fundamental para la igualdad entre las personas, por tanto, se pretende otorgar el mismo número de apoyos para mujeres y hombres, de acuerdo al orden de prelación de la presentación de solicitudes de apoyo, en cada caso, y que cuenten con la autorización de apoyo por parte del Comité de Evaluación.\n16. Enfoque de Derechos.\nFISCAL 2022\nPrograma, las presentes Reglas de Operación y la convocatoria, estarán disponibles de las oficinas de la\nAcapulco, Primer Piso, Boulevard Lic. René Juárez Cisneros No. 62, Col. Ciudad de los Servicios, en\nChilpancingo, Gro., en un horario de atención de las 9:00 a las 16:00 horas y se publicarán en el portal oficial del gobierno del estado www.guerrero.gob.mx y en las redes sociales oficiales de la SEFODECO:\nSefodeco Guerrero (Facebook), @sefodecogro (Twitter).\nEl Programa está diseñado para la atención de todos los grupos considerados históricamente como vulnerables; los apoyos que se les otorguen tendrán como fundamento exclusivo lo dispuesto en las presentes Reglas de Operación.\nLas servidoras y servidores públicos involucrados en la operación del Programa brindarán en todo momento un trato digno y respetuoso a las personas que forman parte de la población objetivo.\n17. Acciones Contra el SARS-COV 2.\nLa operación del Programa, se realizará con estricto cumplimiento de las disposiciones que emitan las autoridades sanitarias de los tres niveles de gobierno, para el control y prevención del SARS-COV 2.\n18. Anexos que reflejen la entrega del apoyo (Económico. Especie o Servicios).\nAnexo 1.- Matriz de Indicadores para Resultados.\nLOGICA Objetivo Indicador Formula de Tipo Unidad Medios Unidad Supuestos\nH/LOGICA Calculo de de de Respons\nV Indica Medida Verificaci able dor ón\nApoyar a Número 2.1.1=TEB/TE Eficaci Porcent SEFODE E10.- Otorgar\nIndustriale de P*100 a aje CO Secretarí subsidios s del Maíz, empresa a de de carácter\nFin con la s Fomento temporal finalidad beneficia y que de mejorar das Desarroll mejoren su la o economía inocuidad Económic e imagen o negocio.\nMejorar la Número 2.1.1=TEB/TE Eficaci Porcent SEFODE E10.- Apoyos economía de P*100 a aje CO Secretarí directos a del Sector empresa a de quienes\nPropósito Industrial s Fomento cumplan del Maíz beneficia y con los das Desarroll requisitos o establecid\nEconómic os por el o programa\nFISCAL 2022\nC.1. Número 2.1.1=TEB/TE Eficaci Porcent SEFODE E10.- Fortalecer\nEquipamie de P*100 a aje CO Secretarí capacidad nto empresa a de es\nEntregado s Fomento empresari\n. beneficia y ales das Desarroll\nDeterminar\nCompone C.2. o necesidad ntes Rehabilita Económic es de ción o equipamie\nEjecutada.\nDetermina ción de necesidad es de rehabilitaci\nA.1. Número 2.1.1=TEB/TE Eficaci Porcent SEFODE E10.- Cumplir\nEntregar de P*100 a aje CO Secretarí con el equipamie empresa a de programa nto s Fomento de\nActividade requerido beneficia y capacitaci s das Desarroll ón o establecid\nA.2. Económic o\nTrabajos o\nContar con de obra realizadas presupuest o liberado programa\nContar con presupuest o liberado programa\nFISCAL 2022\nAnexo 2.- Acta de Donación (no aplica).\nAnexo 3.- Formato de Solicitud de Apoyo del Programa Producción Industrial de Maíz\nANEXO 3\nSecretaria de Fomento y Desarrollo Económico\nFormato de solicitud de apoyo del Programa Producción Industrial de Maíz\nFolio:\nFecha de Recepción:\n*El presente documento será utilizado para registrar los datos de apoyo PPIM, las cuales serán analizadas y en su caso aprobadas por la Secretaría\nUso exclusivo SEFODECO\nId. Beneficiario (a): Fecha del registro:\nConvocatoria núm.: Id Proyecto:\nDatos de Beneficiario (a)\nNombre\nDenominación o Razón social:\nRFC:\nSexo: Edad:\nDomicilio del solicitante\nCódigo postal: Calle:\nNúmero exterior: Número interior:\nColonia: Entre que calles:\nLocalidad y/o Ciudad: Municipio:\nDescripción de la ubicación:\nFISCAL 2022\nDatos del representante legal\nNombre(s):\nPrimer apellido: Segundo apellido:\nCURP:\nTeléfono fijo: Extensión:\nTeléfono móvil: Correo electrónico:\nDatos generales del proyecto\nNombre del proyecto:\nResumen ejecutivo del proyecto\nObjetivo:\nDescripción del proyecto:\nCandelarizarían:\nMetas del Proyecto:\nEmpleos creados:\nConceptos a Apoyar:\nConsideraciones Generales\n*Las solicitudes del Programa Producción Industrial de Maíz, se atenderán conforme a lo establecido en las reglas de operación del programa, la convocatoria correspondiente y las disposiciones normativas aplicables.\nLas solicitudes y documentos anexos, deberán presentarse en el domicilio de la Secretaria de Fomento y Desarrollo Económico, ubicadas en el recinto delas oficinas del poder\nEjecutivo del Estado de Guerrero, Boulevard Rene Juárez Cisneros un 62, edificio\nAcapulco, primer piso colonia ciudad de los servicios, Chilpancingo Guerrero, en un horario de atención de las 9:00a las 16:00 horas también podrán enviarse al correo electrónico documentos que envían.\nFISCAL 2022\n*“Este programa es de carácter público, no es patrocinado ni promovido por partido político alguno y sus recursos provienen de los impuestos que pagan todos los contribuyentes. Está prohibido el uso de este programa con fines políticos, electorales, de lucro y de otros distintos a los establecidos. Quien haga uso indebido de los recursos de este programa deberá ser denunciado y sancionado de acuerdo con la ley aplicable y ante la autoridad competente”\nDocumentos Anexos\nCopia de la identificación oficial con fotografía del solicitante (Credencial para\n1 votar, Cédula Profesional o Pasaporte)\n2 Copia de recibo telefónico, recibo del servicio de agua o recibo de luz, con fecha no mayor a tres meses de la fecha de expedición, del domicilio fiscal del solicitante\n3 Constancia de Situación Fiscal, con fecha de impresión no mayor a un mes, con tributación en cualquiera de los siguientes regímenes fiscales: Régimen de Personas Físicas con Actividades Empresariales o Régimen\nSimplificado de Confianza (RESICO).\n4 Estado de cuenta bancaria a nombres del solicitante, con CLABE interbancaria y con fecha no mayor a dos meses de la fecha de expedición.\n5 Escrito dirigido a la persona titular de la Secretaría de Fomento y Desarrollo Económico, firmado bajo protesta de decir verdad, en el que manifieste el solicitante que, en el presente ejercicio fiscal, no ha solicitado.\nNombre y firma del solicitante\nFISCAL 2022\nPrimero. Se emiten las Reglas de Operación del Programa denominado Programa de Producción Industrial de Maíz para el Ejercicio Fiscal 2022.\nSegundo. Se abroga el Acuerdo por el que se crea el Programa Guerrero Nos Necesita, a la Producción\nIndustrial y Comercialización de Maíz y se emite sus Reglas de Operación para el Ejercicio Fiscal 2020, publicado en el Periódico Oficial del Gobierno del Estado de Guerrero, Edición extraordinaria II, de fecha\n31 de diciembre de 2020; así mismo el Acuerdo por el que se emiten las Reglas de Operación del Programa\nGuerrero Nos Necesita, a la Producción Industrial y Comercialización de Maíz para el Ejercicio Fiscal 2021, publicado en el Periódico Oficial del Gobierno del Estado de Guerrero, Edición No. 30, de fecha\n13 de abril de 2021.\nTercero. A partir de la entrada en vigor del presente Acuerdo, las Reglas de Operación del Programa\nProducción Industrial de Maíz, subsecuentes o sus modificaciones, serán emitidas por la persona titular de la Secretaría de Fomento y desarrollo Económico, responsable directa de la operación y ejecución de las mismas.\nDado en el “Recinto de las Oficinas del Poder Ejecutivo del Estado”, en el inmueble ubicado en el Edificio\nCentro, Interior, Boulevard René Juárez Cisneros No. 62, Ciudad de los Servicios en la Ciudad de\nChilpancingo de los Bravo, Capital del Estado de Guerrero, a los veintisiete días del mes de junio del dos mil veintidós.\nLA GOBERNADORA CONSTITUCIONAL DEL ESTADO DE GUERRERO.\nMTRA. EVELYN CECIA SALGADO PINEDA.\nRúbrica.\nEL SECRETARIO GENERAL DE GOBIERNO.\nMTRO. LUDWIG MARCIAL REYNOSO NUÑEZ.\nRúbrica.\nLA SECRETARIA DE FOMENTO Y DESARROLLO ECONÓMICO.\nMTRA. TEODORA RAMÍREZ VEGA.\nRúbrica.",
  "ordenamiento": "PROGRAMA",
  "jurisdiccion": "GUERRERO",
  "fuente_oficial": "DIARIO OFICIAL DE LA FEDERACION",
  "Fecha de Publicación": "31 DE MARZO DE 2023",
  "ULTIMA REFORMA PUBLICADA": null,
  "status": "VIGENTE",
  "es_escaneado": false,
  "tiene_tablas": true,
  "materia": [
    "agrario",
    "económico"
  ]
}