{
  "titulo": "Acuerdo por el Que Se Crea el Programa Fondo de Apoyo A los Periodistas y Se Expiden Sus Reglas de O",
  "Contenido": "EJERCICIO FISCAL 2016\nÍndice\n1. OBJETIVOS....................................................................................................................................... 11\n1.1. Objetivo general.............................................................................................................................. 11\n1.2. Objetivos específicos...................................................................................................................... 11\n2. Misión................................................................................................................................................ 11\n3. Visión................................................................................................................................................. 11\n4. Lineamientos..................................................................................................................................... 11\n5. Cobertura........................................................................................................................................... 12\n5.1. Fundamento legal........................................................................................................................... 12\n6. Población objetivo.............................................................................................................................. 13\n7. Criterios y requisitos de elegibilidad................................................................................................... 13\n8. Tipos y montos de apoyo................................................................................................................... 14\n8.1. Tipos de apoyo............................................................................................................................... 14\n8.2. Vertientes de atención.................................................................................................................... 14\n8.3. Requisitos y procedimientos para la entrega de apoyos................................................................. 16\n9. Derechos, obligaciones y causas de suspensión de los apoyos........................................................ 19\n9.1. Derechos........................................................................................................................................ 19\n9.2. Obligaciones................................................................................................................................... 19\n9.3. Causas de suspensión del Fondo de Apoyo a Periodistas.............................................................. 20\n10. Instancias participantes.................................................................................................................... 20\n11. Instancia ejecutora........................................................................................................................... 21\n12. Instancia normativa.......................................................................................................................... 21\nEJERCICIO FISCAL 2016\n12.1 Funciones de los integrantes del Comité Técnico.......................................................................... 21\n12.2 Actividades del Comité Técnico..................................................................................................... 22\n13. Coordinación Interinstitucional......................................................................................................... 23\n14. Proceso de operación...................................................................................................................... 23\n15. Gastos de operación........................................................................................................................ 25\n16. Registro de operaciones.................................................................................................................. 25\n17. Evaluación....................................................................................................................................... 26\n17.1. Evaluación interna......................................................................................................................... 26\n17.2. Evaluación externa........................................................................................................................ 26\n18. Indicadores...................................................................................................................................... 26\n19. Seguimiento, control y auditoría....................................................................................................... 27\n19.1. Seguimiento.................................................................................................................................. 27\n19.2. Control y auditoría......................................................................................................................... 27\n20. Transparencia.................................................................................................................................. 27\n20.1. Difusión......................................................................................................................................... 27\n20.2. Comité de Contraloría social......................................................................................................... 27\n20.3. Confrontas.................................................................................................................................... 28\n20.4. Acciones de blindaje electoral....................................................................................................... 28\n21. Perspectiva de género..................................................................................................................... 29\n22. Quejas, denuncias y solicitud de información................................................................................... 29\n22.1. Quejas y denuncias....................................................................................................................... 29\n23. Glosario de términos........................................................................................................................ 30\nEJERCICIO FISCAL 2016\n24. Anexos............................................................................................................................................. 30\nEJERCICIO FISCAL 2016\nREGLAS DE OPERACIÓN DEL PROGRAMA FONDO DE APOYO A PERIÓDISTAS PARA EL EJERCICIO FISCAL 2017,\nTEXTO ORIGINAL.\nAcurdo publicado en el Periódico Oficial del Gobierno del Estado No. 80, el Martes 04 de Octubre de 2016.\nACUERDO POR EL QUE SE CREA EL PROGRAMA FONDO DE APOYO A LOS PERIODISTAS Y SE\nEXPIDEN SUS REGLAS DE OPERACIÓN PARA EL EJERCICIO FISCAL 2016.\nLICENCIADA ALICIA ELIZABETH ZAMORA VILLALVA, SECRETARIA DE DESARROLLO SOCIAL\nDEL GOBIERNO DEL ESTADO DE GUERRERO, CON FUNDAMENTO EN LOS ARTÍCULOS 88 DE LA\nAPARTADO A, FRACCIÓN IV Y 23 DE LA LEY ORGÁNICA DE LA ADMINISTRACIÓN PÚBLICA DEL\nESTADO DE GUERRERO NÚMERO 08; 1, 2, 3, 6, 48, 49 Y 50 DE LA LEY NÚM. 102, PARA EL\nDESARROLLO SOCIAL DEL ESTADO DE GUERRERO; 1, 3, 80, 81 Y 82 DEL REGLAMENTO DE LA\nLEY PARA EL DESARROLLO SOCIAL DEL ESTADO DE GUERRERO NÚM. 102, EL PROGRAMA\nFONDO DE APOYO A PERIODISTAS PREVISTO EN EL ARTÍCULO 62 Y EL ANEXO 14-A DEL\nDECRETO NÚMERO 170 DEL PRESUPUESTO DE EGRESOS DEL ESTADO DE GUERRERO PARA\nEL EJERCICIO FISCAL 2016, 3o, 15, 16 Y 18 DE LA LEY NÚM. 463, PARA EL BIENESTAR INTEGRAL\nDE LOS PERIODISTAS DEL ESTADO DE GUERRERO, 1o, 2o, 4o, 11 y 12 FRACCIÓN I DEL\nREGLAMENTO PARA LA OPERACIÓN DEL FONDO DE APOYO A LOS PERIODISTAS; ASÍ COMO\nLAS ESTRATEGIAS Y OBJETIVOS ESTABLECIDOS EN EL PLAN ESTATAL DE DESARROLLO DE\nGUERRERO 2016-2021, Y\nQue en el Estado de Guerrero, la relación existente entre los medios de comunicación y el\nGobierno del Estado, se ha consolidado en un marco de respeto y cordialidad, apegado siempre a lo previsto en los artículos 6 y 7 de la Constitución Política de los Estados Unidos Mexicanos.\nQue el Plan Estatal de Desarrollo 2016 - 2021, tiene como eje III Promover un Guerrero socialmente comprometido y para contribuir al cumplimiento del objetivo 3.1 Construir un Estado garante de los derechos sociales de las personas y como estrategia 3.1.2 \"Fortalecer el desarrollo de capacidades de los integrantes de una sociedad con carencias, que permitan contribuir a incrementar su capacidad productiva y su calidad de vida\", mediante la línea de acción que especifica ampliar la cobertura de los beneficios de protección social. profesión, toda vez que además de informadores de los aspectos relevantes de la vida nacional y como formadores y orientadores de la opinión pública, son base fundamental de una sociedad democrática.\nQue en el Capítulo I de las \"Disposiciones Generales” de la Ley Núm. 463, para el Bienestar\nIntegral de los Periodistas del Estado de Guerrero, se precisan los objetivos de la Ley, el cual está enfocado integral de los periodistas en el Estado.\nEJERCICIO FISCAL 2016\nQue este sector generalmente no cuenta con las garantías de seguridad social, puesto que periodismo, cuyos ingresos no les permiten cubrir las necesidades básicas para ellos y sus familias en seguridad social, educación, vivienda y salud, como demandas más sentidas del gremio periodístico.\nQue de acuerdo a lo anterior, será necesario incrementar la calidad y eficiencia del Fondo de\nApoyo a Periodistas, que redunde en una mayor atención y bienestar de la población objetivo, con eficiencia en la productividad de los recursos presupuestales destinados para tal fin, a través del impulso y promoción de la cobertura de las políticas públicas cuyos beneficios estén encaminados a su seguridad social y al desarrollo de sus capacidades y su permanente profesionalización.\nQue en razón de lo anterior el Fondo de Apoyo a Periodistas, estará orientado a asegurar la vida del periodista en caso de fallecimiento y apoyar el ingreso económico de sus hogares en el marco de la ejecución con acciones de beneficio integral familiar, respecto al origen de los recursos que integra y aplica el programa, provienen de inversión estatal directa (IED) y de las aportaciones de los propios periodistas cuando ingresan al Fondo.\nQue en el Decreto número 170 del Presupuesto de Egresos del Estado de Guerrero para el\nEjercicio Fiscal 2016, publicado el 29 de diciembre del 2015, las secretarias, dependencias y entidades de la administración pública estatal, podrán ejercer los montos para programas y proyectos de inversión aprobados en este presupuesto, en los términos de las disposiciones emitidas por la Secretaria de Finanzas y Administración del Estado y la Secretaria de Planeación y Desarrollo Regional, en función de la disponibilidad presupuestal y financiera del Estado.\nQue los apoyos otorgados deberán sujetarse a criterios de objetividad, equidad, transparencia, publicidad, selectividad y temporalidad.\nQue las y los titulares de las dependencias y entidades de la administración pública estatal, así como los servidores públicos autorizados para ejercer recursos públicos del presupuesto de inversión de las mismas, serán responsables de los programas y proyectos de inversión que realicen.\nQue en las reglas de operación se establecen las disposiciones a las que debe sujetarse el Fondo de Apoyo a Periodistas, con el objeto de otorgar transparencia y asegurar la aplicación eficiente, eficaz, oportuna y equitativa de los recursos públicos asignados al mismo.\nEn cumplimiento de lo anterior se ha tenido a bien expedir el siguiente:\nEXPIDEN SUS REGLAS DE OPERACIÓN PARA EL EJERCICIO FISCAL 2016.\nArtículo 1. Se crea el Programa Fondo de Apoyo a Periodistas, y se expiden sus Reglas de\nOperación para el Ejercicio Fiscal 2016, en el marco de la Ley Núm. 463, para el Bienestar Integral de los\nPeriodistas del Estado de Guerrero, el cual tiene por objeto ser un instrumento de fortalecimiento a la política de libertad de expresión en favor de los periodistas en el ejercicio de su profesión, destacando las\nEJERCICIO FISCAL 2016 acciones y los apoyos para disminuir sus carencias sociales, sustentos que permitirán elevar su nivel de vida y el de sus familias, además de buscar mecanismos y estrategias que posibiliten el desarrollo y capacitación profesional.\nArtículo 2. Se emiten las Reglas de Operación del Programa Fondo de Apoyo a Periodistas, en la que se establecen los principios de eficiencia, eficacia, oportunidad, equidad y transparencia de los recursos público.\nArtículo 3. En las Reglas de Operación del Programa Fondo de Apoyo a Periodistas, se establecerán los criterios y requisitos que se deben de cumplir para poder acceder a dicho Programa.\nArtículo 4. La Secretaria de Desarrollo Social, tendrá a cargo la operación, ejecución y evaluación del Programa Fondo de Apoyo a Periodistas a través de la Dirección General de Acciones Prioritarias, bajo los criterios de objetividad, equidad, transparencia, publicidad, selectividad y temporalidad, con estricto apego a la normatividad aplicable.\nPROGRAMA FONDO DE APOYO\nA PERIODISTAS.\nI. Justificación del programa.\nQue este sector generalmente no cuenta con las garantías de seguridad social, puesto que muchas veces se desempeñan como prestadores de servicios profesionales independientes dentro del periodismo, cuyos ingresos no les permiten cubrir las necesidades básicas para ellos y sus familias en seguridad social, educación, vivienda y salud, como demandas más sentidas del gremio periodístico.\nQue el Estado de Guerrero como garante de los derechos humanos que toda persona posee por el sólo hecho de serlo, debe actualizar su marco jurídico, para adecuarlo a las necesidades, en primera instancia de una colectividad en general y segunda a un sector como el periodismo.\nQue en México y en Guerrero, el ejercicio del periodismo en los últimos años se ha convertido en una profesión que en diversas ocasiones exponen su integridad física, el gremio periodístico es primordial para este gobierno.\nII. Objetivos\nObjetivo general periodistas en el ejercicio de su profesión, destacando los apoyos para disminuir sus carencias sociales, sustentos que permitirán elevar su nivel de vida y el de sus familias; además de buscar mecanismos y estrategias que posibiliten el desarrollo y capacitación profesional.\nEJERCICIO FISCAL 2016\nObjetivos específicos\n• Coadyuvar con acciones que contribuyan a mejorar el bienestar y las condiciones de vida de manera integral de los periodistas y sus familias.\n• Impulsar la capacitación y actualización profesional de los comunicadores en el Estado.\nIII. Limitación del programa.\n1. Determinación y precisión de actividades:\n2. Tiempo y calendario de actividades:\n3. Universo de trabajo:\nLa meta es de hasta 450 beneficiarios que se pretende alcanzar con las acciones del programa dentro del gremio periodístico afiliado al Fondo de Apoyo a Periodistas y sus familias.\nEJERCICIO FISCAL 2016\nIV. Organización.\n1. Procedimientos:\nPara la entrega acciones y de apoyos estos se encuentran descritos en el numeral 8.1, 8.2 y 8.3 de las presentes reglas de operación.\na) Métodos de las actividades:\nLas actividades se realizaran en apego a la normatividad legal aplicable éstas deberán de estar ejecutadas de acuerdo a los calendarios de actividades y presupuestales.\nb) Las dependencias que integran el Comité del FAP:\n1. La Secretarla de Desarrollo Social, quien asume como Presidente del Comité;\n2. La Secretarla General de Gobierno;\n3. La Secretarla de Finanzas y Administración;\n4. La Secretarla de Educación Guerrero;\n5. La Secretarla de Salud; y,\n6. La Secretarla de la Mujer.\nSon con quienes se tendrá comunicación estrecha en las sesiones ordinarias y extraordinarias de\nComité, por otro lado además se buscará la gestión de otros beneficios para la vivienda en dependencias con quienes se pueda realizar convenios de colaboración.\nc) Material y equipo:\nPara la ejecución del programa se cuenta con un espacio físico, y personal asignado.\nd) Locales:\nPara realizar los cursos, talleres, conferencias, diplomados, etc. se contratará en el Estado.\ne) Instructivos y reglamentación:\nPeriodistas 2016.\nEJERCICIO FISCAL 2016\n2. Personal: a Periodistas y la normativa a cargo de la titular de la Secretaría de Desarrollo Social Estatal.\na) Tipo y número:\nEl número de personas que participan para la ejecución del programa son seis apoyos administrativos.\nb) La determinación de funciones administrativas estará determinada de acuerdo al perfil y experiencia de cada uno.\nLos integrantes del Comité, tendrán derecho a voz y voto.\nPresidente:\nConvocar a reuniones ordinarias y extraordinarias al Comité del Fondo de Apoyo a Periodistas, tiene voto de calidad, es el encargado de administrar y liberar los recursos, presidir las reuniones y designar al Secretario(a) Técnico.\nSecretario Técnico:\nApoyar en las actividades de organización y operación administrativa del Fondo de Apoyo a\nPeriodistas y vigilar el cumplimiento de los acuerdos del Comité Técnico estipulados en las minutas de trabajo de las reuniones ordinarias o extraordinarias.\nRepresentantes de las organizaciones de periodistas:\n• Dictaminar la dispersión presupuestal y la calendarización de actividades.\n• Vigilar la normativa y aplicación del Fondo.\n• Atender las peticiones de los periodistas que pertenecen al Fondo de Apoyo a Periodistas, establecen las presentes Reglas de Operación del Programa.\n• Analizar y dictaminar las propuestas de los bienes y servicios.\n• Proponer y autorizar la realización de cursos talleres y seminarios en beneficio de los afiliados.\n• Designar para cada ejercicio fiscal al representante de las organizaciones para la administración del Fondo.\nEJERCICIO FISCAL 2016\nc) Reclutamiento:\nNo aplica.\nd) Adiestramiento:\nNo aplica\n3. Financiamiento:\nEl recurso presupuestado.\na) Elaboración del presupuesto:\nEl presupuesto autorizado para la operación del programa es de 5'000,000.00 (Cinco millones de pesos 00/100 M.N.)\nb) Plan de obtención de fondos:\nEl recurso aplicable es por inversión estatal directa, conforme a lo establecido en el Decreto de\nPresupuesto de Egresos y las aportaciones que efectúen los periodistas por medio de su fondo acumulado.\nEl Fondo de Apoyo a Periodistas puede ser incrementado, con las aportaciones de nuevos ingresos.\nAsí como las aportaciones que en su favor puedan realizar mediante convenio, las empresas de los medios de comunicación.\nV. Evaluación.\nLa Secretaría de Desarrollo Social del Estado, podrá realizar una evaluación de resultados de carácter externo del programa sujeto a reglas de operación, para lo cual tendrá la facultad de designar a la instancia que realizará dicho análisis.\nContraloría y Transparencia Gubernamental.\nEJERCICIO FISCAL 2016\nEJERCICIO FISCAL 2016.\n1. OBJETIVOS\n1.1. Objetivo general\nSer un instrumento de fortalecimiento integral a la política de libertad de expresión en favor de los periodistas en el ejercicio de su profesión, destacando los apoyos para disminuir sus carencias sociales, sustentos que permitirán elevar su nivel de vida y el de sus familias, además de buscar mecanismos y estrategias que posibiliten el desarrollo y capacitación profesional.\n1.2. Objetivos específicos\n• Coadyuvar con acciones que contribuyan a mejorar el bienestar y las condiciones de vida de manera integral de los periodistas y sus familias.\n• Impulsar la capacitación y actualización profesional de los comunicadores en el Estado.\n2. Misión\nPromover beneficios para los comunicadores afiliados al Fondo de Apoyo a Periodistas (FAP) que contribuyan en el mejoramiento de sus condiciones de vida, impulsar y fortalecer su profesionalización y actualización sobre la práctica profesional y su capacitación en el trabajo periodístico.\n3. Visión\nSer un instrumento institucional de los periodistas del Estado de Guerrero que favorezca su estabilidad económica promoviendo su desarrollo y protección social, con el fin de que cuenten con los mecanismos necesarios para brindar un trabajo periodístico de calidad a la sociedad.\n4. Lineamientos\nPara ingresar al Fondo de Apoyo a Periodistas y poder acceder a los beneficios que este otorga, se requiere:\na) Comprobar que son periodistas en activo, mediante presentación de publicaciones en radio, prensa escrita, televisión o periodismo alternativo que tienen como mínimo un año en esta actividad en forma ininterrumpida;\nb) Llenar el formato de solicitud de manera individual expedida por la Secretaría de Desarrollo\nSocial del Estado y deberá contener el aval de su organización en caso de pertenecer a alguna;\nc) Presentar su currículum vitae en el cual se resalte su actividad periodística;\nEJERCICIO FISCAL 2016\nd) Comprobar que son periodistas de acuerdo a lo establecido en el artículo 2 de la Ley Núm. 463, para el Bienestar Integral de los Periodistas del Estado de Guerrero. Se puede comprobar con: Constancia de Ingresos o de antigüedad del medio donde labora;\ne) Presentar dos fotografías tamaño infantil;\nEn caso de ser aprobado su ingreso por el Comité Técnico del FAP, cubrir el monto de aportación que no será mayor al valor de 14 unidades de medida y actualización vigentes para el año 2016.\n1. Copia de la Credencial de Elector, expedida por el Instituto Nacional Electoral; y,\n2. Entregar los documentos en la ventanilla única de la Secretaría de Desarrollo Social del Estado.\n5. Cobertura\nEl programa podrá operar en los 81 municipios del Estado de Guerrero, es decir que el Fondo de\nApoyo a Periodistas brinda atención a todos los periodistas afiliados al Fondo, que se encuentran trabajando de manera habitual, profesional o laboralmente en la actividad de informar a través de la prensa, la radio, la televisión o periodismo alternativo obteniendo su principal ingreso de esa actividad.\n5.1. Fundamento legal\na) Constitución Política de los Estados Unidos Mexicanos;\nc) Ley Orgánica de la Administración Pública del Estado de Guerrero número 08;\nd) Ley Núm. 102, para el Desarrollo Social del Estado de Guerrero;\nf) Ley número 695 de Responsabilidades de los Servidores Públicos del Estado y de los Municipios de Guerrero;\ng) Código de Conducta de la Secretaría de Desarrollo Social;\ni) Ley Núm. 463, para el Bienestar Integral de los Periodistas del Estado de Guerrero;\nj) Reglamento para la Operación del Fondo de Apoyo a Periodistas;\nk) Plan Estatal de Desarrollo del Estado de Guerrero 2016 - 2021;\nEJERCICIO FISCAL 2016\nl) Decreto número 170 del Presupuesto de Egresos del Estado de Guerrero para el Ejercicio Fiscal\n2016; y,\nm) Todos aquellos ordenamientos normativos que sean aplicables.\n6. Población objetivo\nLos beneficiarios del Programa Fondo de Apoyo a Periodistas, son aquellos ciudadanos que radican en el Estado de Guerrero afiliados al FAP y que su principal actividad económica redunda en las funciones periodísticas independientemente de los géneros periodísticos como son reportaje, nota informativa, columna, crónica, que son aplicadas en las secciones: policíaca, política, cultural, deportes y social en un medio de comunicación; se dedican habitual, profesional o laboralmente a informar a la población a través de la prensa, la radio o la televisión y que su principal actividad sea el periodismo.\n7. Criterios y requisitos de elegibilidad\na) Selectividad:\nSe atiende de manera específica a un sector de la población dedicada al ejercicio periodístico afiliados al FAP.\nb) Transparencia:\nEje rector en la Secretaría de Desarrollo Social, que dentro del ámbito de su competencia está obligada a generar los instrumentos y medios necesarios que garanticen el conocimiento por parte de la ciudadanía de los procedimientos, decisiones y usos de los recursos públicos ejercidos por el programa\nFAP, a fin de establecer un estricto seguimiento, control y evaluación de los mismos.\nc) Equidad: previstos en igualdad de condiciones para todos los comunicólogos.\nd) Corresponsabilidad y sustentabilidad: estatal, en beneficio del sector periodístico en la entidad, situación que a su vez obliga a los beneficiarios a asumir la responsabilidad de participar de manera activa en los procesos de ejecución, seguimiento, fiscalización y evaluación para la correcta operación y permanencia del programa FAP.\nEJERCICIO FISCAL 2016\ne) Objetividad: operación que rigen este programa.\nf) Oportunidad:\nLograr una coordinación eficiente con las instituciones que permitan que los objetivos del programa se cumplan con oportunidad que impacte en el bienestar de los beneficiarios.\ng) Temporalidad:\nEl programa selecciona anualmente a los beneficiarios por medio de la ratificación y la incorporación de nuevos miembros previa convocatoria.\n8. Tipos y montos de apoyo\n8.1. Tipos de apoyo.\nLos tipos de acciones para beneficiar a los afiliados del Fondo de Apoyo a Periodistas y sus familias serán en materia de salud, educación, seguridad social, capacitación y profesionalización, productiva, jurídica, cultural y recreativo; así como diversos beneficios, que se otorgan en función de las solicitudes presentadas, y a la disponibilidad presupuestal.\n8.2. Vertientes de atención\nEl programa actuará en las vertientes de atención siguientes:\nVertientes Objetivo DESCRIPCIÓN\nSalud • Procurar que los - Tramitar y/o ratificar al Seguro Popular para los afiliados que afiliados gocen de no cuenten con servicios médicos. bienestar físico.\n- Apoyo para gastos médicos para titular (de conformidad a las políticas de la compañía de seguros).\n- Apoyos para gastos de maternidad para titular (de conformidad a las políticas de la compañía de seguros)\nSeguridad • Ayudar a mitigar las - Un Seguro de Vida colectivo de cobertura básica por\nSocial carencias de seguridad fallecimiento para los periodistas afiliados al Fondo. social de los periodistas y su familia. - Indemnización por muerte accidental con pérdidas orgánicas\n(de conformidad a las políticas de la compañía de seguros).\nEducación • Mejorar el nivel • Becas: académico y de\nEJERCICIO FISCAL 2016 conocimiento para los ➢ Se otorgarán becas de manera mensual para niños de periodistas y sus nivel preescolar hijos de periodistas hasta por $250.00 familias. (Doscientos cincuenta pesos 00/100 M.N.) durante 10 meses al año.\n➢ Apoyo para inscripción o reinscripción en este nivel de preescolar en escuelas públicas o particulares.\n➢ Otorgar paquetes escolares al inicio de cada ciclo escolar a los niños de nivel preescolar.\nPara recibir cualquiera de estos apoyos en becas deberán de cubrir los requisitos que se indican en las presentes reglas de operación. Todos los apoyos están sujetos a la disponibilidad presupuestal.\n- Profesionalización:\n➢ Recibir capacitación por medio de cursos, talleres, conferencias magistrales, foros y diplomados de periodismo, entre otros.\n➢ Buscar la profesionalización de los miembros afiliados al\nFAP con la certificación oficial del grado de estudios por medio de la firma de convenios con instituciones educativas de todos los niveles pública o privada.\n➢ Apoyar con cursos de actualización en las nuevas tecnologías a los periodistas afiliados al FAP.\nLos periodistas deberán manifestar su participación por medio de una carta de intención.\nVivienda • Impulsar el - Promover a través de los programas institucionales apoyos de mejoramiento, corresponsabilidad para la ampliación, mejora o construcción e condiciones y la calidad introducción de servicios a la vivienda, mediante convenios con periodistas y sus sector privado. familias.\nBeneficios • Mejorar las condiciones - Apoyos: económicas de los periodistas y sus ➢ Seguro de gastos funerarios para familiares directos (de familias. conformidad a la póliza contratada con la compañía de seguros)\nEJERCICIO FISCAL 2016\n➢ Emergentes para familiares directos (cónyuge, hijos y padres), hasta por $5,000.00 (Cinco mil pesos 00/100\nM.N.) por:\n• Fallecimiento.\n• Accidente.\n➢ Apoyo de traslados para los representantes de las organizaciones de periodistas dentro del Comité\nTécnico de Fondo de Apoyo a Periodistas, que asistan a la convocatoria, hasta por $1,500.00 (Mil quinientos pesos 00/100 M.N.)\nProductivo • Procurar el bienestar - Se buscará impulsar convenios y/o acuerdos con instituciones de las familias de los públicas o privadas que permitan mejorar el bienestar de sus periodistas. familias.\nSocial • Fomentar actividades - Se buscará celebrar convenios con instituciones públicas o recreativas y sociales privadas para facilitar actividades socio-culturales y deportivas para los periodistas y para los periodistas y sus familias. sus familias.\nApoyo • Otorgar la asesoría - Se buscará establecer convenios de colaboración con\nJurídico jurídica necesaria para dependencias e instituciones, con el fin de orientar y capacitar los periodistas y sus en materia legal a los periodistas. familias.\nCon cobertura para los periodistas que fueron aprobados, mismos que manifestaron su voluntad de ser afiliados en el Fondo de Apoyo a Periodistas, con posibilidades de ampliar el Padrón hasta el techo presupuestal disponible siempre y cuando no exista duplicidad de apoyos con otros beneficios o instituciones.\nEn los gastos de operación se podrá considerar la contratación de servicios de asesoría, los gastos de movilidad del personal contratado para tales efectos, los gastos indirectos del Programa Fondo de Apoyo a Periodistas, la difusión, la adquisición de bienes que permitan la ejecución, supervisión, seguimiento y la evaluación del programa. Los cuales les corresponde hasta un 3% del presupuesto total asignado al programa de acuerdo al artículo 47 de la Ley de Coordinación Fiscal.\n8.3. Requisitos y procedimientos para la entrega de apoyos.\nProcedimiento para la entrega de vertiente de Salud:\na) El Seguro de vida y de gastos médicos se contrata cada año para todos los integrantes afiliados al FAP.\nEJERCICIO FISCAL 2016\nb) El periodista debe llenar un formato de la aseguradora (Consentimiento del seguro de vida), ahí ellos asientan los porcentajes y nombres de sus beneficiarios.\nc) Cada periodista afiliado al FAP tendrá que presentar la documentación de sus beneficiarios para integrar el expediente y formalizar la entrega de la póliza individual correspondiente.\nd) El procedimiento para hacer efectivo el seguro por accidentes, el seguro de vida o cualquier otro seguro de vida contratado se realiza con el apoyo y gestoría del Secretario (a) Técnico del FAP y el personal que la aseguradora determine. Será necesario que los beneficiarios de los seguros, se responsabilicen a entregar la documentación que se requiera.\ne) Para las mujeres periodistas que requieran el apoyo de gastos de maternidad deberán cubrir los siguientes requisitos: solicitud dirigida a la titular de la Secretaria de Desarrollo Social del Gobierno del\nEstado, factura o recibo de honorarios del médico o institución con el desglose del IVA o retención del ISR respectivo, copia de su credencial de elector, constancia de alumbramiento. En caso de que el apoyo lo cubra algún seguro aplicará de conformidad a la póliza contratada.\nf) Para los integrantes del FAP que requieran el apoyo de gastos médicos deberán cubrir los siguientes requisitos: solicitud dirigida a la titular de la Secretaria de Desarrollo Social del Gobierno del\nEstado, factura o recibo de honorarios del médico o institución con el desglose del IVA o retención del ISR respectivo, copia de su credencial de elector y este deberá contar con cédula profesional. En caso de que el apoyo lo cubra algún seguro aplicará de conformidad a la póliza contratada.\ng) Presentar credencial vigente como integrante del FAP.\nSe dará respuesta a las solicitudes en un plazo de 15 días hábiles, dependiendo de la liberación del recurso por parte de la Secretaría de Finanzas y Administración del Gobierno del Estado de Guerrero.\nPara que el periodista y sus familiares directos, se integren al Seguro Popular.\nEl integrante del FAP deberá informar al Secretario (a) Técnico con detalle los nombres de sus familiares directos (Esposa, hijos, padres) con sus respectivas actas de nacimiento, con el propósito de canalizar su solicitud y la instancia correspondiente pueda darlos de alta. concrete el alta en el seguro popular, deberá proporcionar copia de su póliza de afiliación para su expediente.\nProcedimiento para beca, paquete escolar y apoyos para inscripción o reinscripción en nivel preescolar.\nPara ser beneficiario de la beca para hijos en edad preescolar, el integrante del FAP, deberá cubrir los siguientes requisitos:\nEJERCICIO FISCAL 2016\na) Presentar solicitud por escrito a la titular de la Secretaría de Desarrollo Social del Estado y copia a la Secretaría Técnica del FAP. Anexar copia de la credencial vigente del FAP.\nb) Adjuntar copia del acta de nacimiento de su o sus hijos en edad preescolar.\nc) Constancia y/o Boleta de Inscripción.\nd) El Secretario (a) Técnico del FAP, hará un expediente que será canalizado para su trámite correspondiente a la Dirección de Administración y Finanzas de la Secretaría de Desarrollo Social.\ne) El programa del FAP, solicitará a los periodistas la constancia que acredite que sus hijos beneficiados asisten regularmente cada ciclo escolar y poder determinar que deberán seguir siendo beneficiarios de la beca, paquete escolar y pagos de inscripción y/o reinscripción, con base en la disponibilidad presupuestal, del Programa Fondo Apoyo a Periodistas.\nProcedimiento para la capacitación y profesionalización (Educativo)\nLa Secretaría de Desarrollo Social del Estado, publicará la convocatoria para promover la actualización y también la certificación oficial del grado de estudios adquirido o por adquirir en instituciones públicas o privadas con base en los acuerdos emitidos por la Secretaría de Educación Pública.\nLos cursos, conferencias, foros, talleres de capacitación y profesionalización, donde especificará las fechas a realizarse. Para llevar a cabo las capacitaciones y actualizaciones los integrantes del FAP pueden hacer llegar sus propuestas en cuanto a temas de interés de sus agremiados.\nPrevia convocatoria los interesados deberán llenar la carta de intención mediante escrito libre, para formalizar su participación.\na) El Comité Técnico, analizará el presupuesto de cada evento de capacitación respaldado con las cotizaciones de los lugares sede.\nb) El presupuesto y programa de capacitación deberá presentarse a la Dirección de Administración y Finanzas de la Secretaría de Desarrollo Social por conducto del Secretario Técnico.\nc) Se realizará la difusión del calendario de los eventos de actualización y formación con la convocatoria, que será entregada a los representantes de las organizaciones de periodistas y publicada en\nProcedimiento para la gestión de apoyos a la vivienda:\na) La Secretaría de Desarrollo Social del Estado, realizará a los integrantes de las organizaciones periodísticas e independientes afiliados al Fondo de Apoyo a Periodistas, la aplicación de encuestas para\nEJERCICIO FISCAL 2016 conocer las necesidades de mejoramiento, ampliación y de servicios a la vivienda de los periodistas en todo el Estado.\nb) En función de las solicitudes que se presenten éstas serán canalizadas a la Secretaría de\nDesarrollo Urbano, Obras Públicas y Ordenamiento Territorial del Gobierno Estatal, como lo marca la Ley\nNúm. 463, para el Bienestar Integral de los Periodistas del Estado de Guerrero, esta a su vez, instrumentará mecanismos para la atención en sus programas de vivienda y suelo urbano, además se buscarán mecanismos de coordinación con los demás órdenes de gobierno federal, estatal y municipal.\nc) Con base en la disponibilidad presupuestal del FAP se podrán subsidiar los apoyos de corresponsabilidad para la construcción, ampliación o mejoramiento de viviendas de acuerdo a los ordenamientos normativos respectivos del programa federal, estatal o municipal.\nd) Para ser beneficiario de este subsidio deberá acreditar ser el dueño de la vivienda a nombre del periodista o de su conyugue, mediante la escritura pública o constancia de propiedad certificada.\ne) Se otorgará un apoyo por año por beneficiario y renovable después de tres años, no estar en cartera vencida y al corriente de sus pagos.\n9. Derechos, obligaciones y causas de suspensión de los apoyos.\n9.1. Derechos\nLos beneficiarios tienen derecho a:\na) Información necesaria, de manera clara y oportuna para participar en el programa;\nb) Un trato digno, respetuoso, oportuno, con calidad y equitativo, sin discriminación alguna;\nc) Atención y apoyos sin costo alguno o condicionamiento no contemplado en las presentes reglas de operación; y,\nd) Seguridad sobre la reserva y privacidad de su información personal conforme a la Ley número\n9.2. Obligaciones:\na) Proporcionar, bajo protesta de decir verdad, la información que se les requiera de acuerdo a lo establecido en las presentes reglas de operación;\nb) Mantenerse en activo dentro en los medios de comunicación escritos o electrónicos ejerciendo su labor periodística;\nc) Estar al corriente en sus aportaciones;\nEJERCICIO FISCAL 2016\nd) Acudir a cualquiera de las invitaciones que convoque el Comité Técnico del Fondo de Apoyo a\nPeriodistas, cuando esté lo considere necesario;\ne) Coadyuvar al desarrollo de las actividades de capacitación, actualización y profesionalización que promueva el Comité Técnico del Fondo de Apoyo a Periodistas;\nf) Solventar sus adeudos en los tiempos preestablecidos para su debido cumplimiento, y en caso de incumplir causará baja del FAP;\ng) Conducirse con responsabilidad y honestidad promoviendo el respeto y cordialidad entre los agremiados;\nh) Conformar el Comité Comunitario de Contraloría Social; y,\ni) Realizar los trámites correspondientes con la documentación que se requiera.\n9.3. Causas de suspensión del Fondo de Apoyo a Periodistas.\nSe suspenderán los apoyos en los casos siguientes:\na) Cuando los beneficiarios no cumplan con alguna de las obligaciones estipuladas en estas reglas de operación;\nb) Cuando la Secretaria de Desarrollo Social del Estado o algún órgano de fiscalización detecte desviaciones o incumplimiento en el ejercicio de los recursos y de las presentes reglas de operación por parte de los beneficiarios o beneficiarias, suspenderán los apoyos y deberán solicitar su reintegro en apego a la normatividad aplicable;\nc) Por determinación del Comité Técnico, el periodista que no cumpla con sus obligaciones como miembro o incurra en actos que vayan en contra de la política del Fondo de Apoyo a Periodistas; y,\nd) Cuando hayan dejado de realizar su actividad periodística.\n10. Instancias participantes\nEstado, contará con un Comité Técnico integrado de acuerdo con lo dispuesto por el artículo 18 de la Ley\nNúm. 463, para el Bienestar Integral de los Periodistas del Estado de Guerrero, que fungirá como órgano de gobierno; mismo que tomara sus decisiones de manera colegiada y democrática con la participación correcta operación del Fondo de Apoyo a Periodistas; el cual estará integrado por los titulares de:\n1. La Secretaria de Desarrollo Social, quien asume como Presidente del Comité;\nEJERCICIO FISCAL 2016\n2. La Secretaria General de Gobierno;\n3. La Secretaria de Finanzas y Administración;\n4. La Secretaria de Educación Guerrero;\n5. La Secretaria de Salud;\n6. La Secretaria de la Mujer; y,\n7. Los representantes de organizaciones periodísticas legalmente constituidas, mismas que deberán como mínimo contar con 20 afiliados al Fondo de Apoyo a Periodistas, quienes por escrito designarán a sus representantes, los cuales fungirán como vocales y durarán en su encargo un año, con posibilidades de ratificarse por un periodo igual, debiendo presentar sus actas de asamblea firmadas por la mayoría de los integrantes de su organización.\nLos cargos de los miembros del Comité serán honoríficos, por lo que, no recibirán remuneración, emolumento ni compensación alguna por su desempeño.\n11. Instancia ejecutora\nLa instancia ejecutora del programa será la Secretaría de Desarrollo Social Estatal a través de la\nSubsecretaría de Política Social y el Secretario (a) Técnico del Fondo de Apoyo a Periodistas y podrá concertar la participación activa de otras instituciones educativas públicas o privadas, dependencias federales, estatales o los H. Ayuntamientos.\n12. Instancia normativa\nLas instancias normativas serán: Secretaría de Desarrollo Social, Secretaría de Planeación y\nDesarrollo Regional, Secretaría de Finanzas y Administración, Secretaría de Contraloría y Transparencia\nGubernamental, Auditoría General del Estado y el Secretario (a) Técnico del Fondo de Apoyo a Periodistas.\n12.1 Funciones de los integrantes del Comité Técnico\nTendrán derecho a voz y voto todos los integrantes del Comité.\nPresidente:\na) Convocar a reuniones ordinarias y extraordinarias al Comité del Fondo de Apoyo a Periodistas;\nb) Tiene voto de calidad;\nc) Es el encargado de administrar y liberar los recursos;\nEJERCICIO FISCAL 2016\nd) Preside las reuniones del Comité; y,\ne) Designa al Secretario(a) Técnico.\nSecretario Técnico:\na) Apoyar en las actividades de organización y operación administrativa del Fondo de Apoyo a\nPeriodistas; y,\nb) Vigilar y dar seguimiento a los acuerdos del Comité Técnico.\nRepresentantes de las organizaciones de periodistas:\na) Dictaminar la dispersión presupuestal y la calendarización de actividades;\nb) Vigilar la normativa y aplicación del Fondo;\nc) Atender las peticiones de los periodistas que pertenecen al Fondo de Apoyo a Periodistas, siempre y cuando sus representados lo requieran y las solicitudes cumplan con el marco normativo que establecen las presentes Reglas de Operación del Programa;\nd) Analizar y dictaminar las propuestas de los bienes y servicios;\ne) Proponer y autorizar la realización de cursos talleres y seminarios en beneficio de los afiliados; y,\nf) Designar de conformidad al ejercicio fiscal al representante de las organizaciones para la administración del Fondo.\n12.2 Actividades del Comité Técnico:\na) Sesionar de manera ordenada cada dos meses y en casos extraordinarios cuando las causas lo ameriten;\nb) Aprobar la contratación de la aseguradora que proporcionará el seguro de vida para los periodistas afiliados al Fondo de Apoyo a Periodistas;\nc) Interpretar las presentes reglas de operación y resolver en materia normativa y operativa los casos de excepción a estas reglas de acuerdo a las circunstancias del caso, sus particularidades, los riesgos sociales; y,\nd) Los demás que se establezcan por acuerdo del Comité Técnico.\nEJERCICIO FISCAL 2016\nEl grupo permanente de trabajo del FAP, es el órgano operativo del Comité Técnico del programa y está integrado por la Subsecretaria de Política Social, a través del Secretario Técnico del Fondo de Apoyo a Periodistas.\n13. Coordinación Interinstitucional\nLa Secretaría de Desarrollo Social del Gobierno del Estado, la Secretaría de la Contraloría y\nTransparencia Gubernamental, como instancias normativas establecerán los mecanismos de coordinación y vinculación institucional necesarios para garantizar que sus acciones busquen potenciar el impacto de los recursos, fortalecer la cobertura, detonar la complementariedad y reducir gastos administrativos, cada una en el ámbito de sus respectivas competencias.\nPodrá realizar convenios de concertación, acuerdos de coinversión y/o colaboración con otras dependencias estatales, H. Ayuntamientos, fundaciones, organizaciones de la sociedad civil e instituciones educativas, así como instituciones del gobierno federal y estatal.\nEn caso de contar con recursos de coinversión federal, quedarán sujetos a lo establecido en los acuerdos y convenios concertados, a los ordenamientos federales y a los lineamientos específicos del origen del recurso.\n14. Proceso de operación:\na) Difusión del programa.\nSe establecerá una estrategia de difusión del programa y realizar las acciones conducentes para dar a conocer los requisitos de participación, la corresponsabilidad de las y los beneficiarios y los apoyos a otorgar, establecidos en las presentes reglas de operación.\nb) Presentación de solicitudes.\nLa solicitud deberá ser presentada de manera individual por parte de los solicitantes para acciones de beneficio individual, dirigida a la titular de la Secretaría de Desarrollo Social del Estado, presentando original y copia para acuse de recibo en las oficinas de dicha Secretaría, así como copia de la credencial de elector de la persona solicitante, proporcionando un número telefónico y/o correo electrónico, para hacerle llegar la notificación sobre el apoyo solicitado.\n(30) días hábiles siguientes al ingreso de la misma; en caso de no obtener respuesta en el plazo establecido, se entenderá que dicha solicitud no fue aceptada. Cabe señalar que las solicitudes serán atendidas en base a la disponibilidad presupuestal del programa.\nCuando la solicitud no incluya toda la información requerida o faltara algún documento, la dependencia informará al solicitante en un plazo no mayor a quince (15) días hábiles, mismo que tendrá\nEJERCICIO FISCAL 2016 un plazo hasta de cinco (5) días hábiles a partir de la fecha de haber recibido la notificación, para solventar la omisión.\nGobierno, Boulevard René Juárez Cisneros No. 62, Chilpancingo, Gro. C.P. 39074.\nCon los datos que aporten los solicitantes, se integrará el Padrón de Beneficiarios del Programa\nFondo de Apoyo a Periodistas en cumplimiento a las disposiciones legales vigentes. La información de este\nPadrón será publicada y estará disponible en la página electrónica de la Secretaría de Desarrollo Social del Gobierno del Estado www.sedesol.guerrero.gob.mx\nc) Elegibilidad de los beneficiarios.\nLa Secretaría de Desarrollo Social Estatal, será la responsable de verificar la elegibilidad, viabilidad técnica, normativa y social, así como la suficiencia presupuestaria de las acciones que sean de su competencia de acuerdo a las reglas de operación.\nd) Aprobación de las acciones.\nLa Secretaría de Desarrollo Social del Estado, definirá los métodos para revisar los apoyos y beneficios solicitados y en su caso, emitir la aprobación correspondiente del Fondo de Apoyo a Periodistas, mismos que se ejecutan en función a los recursos que integran el fondo, y se entregan mediante cheques o transferencia electrónica expedidos por la dependencia de la manera siguiente:\n1) El seguro de vida tiene una vigencia de un año, renovable al año próximo siguiente:\nEl afiliado recibe de la aseguradora una copia de la póliza de su seguro de manera individual.\n2) La entrega del apoyo al beneficiario, será a través de cheque o transferencia, expedido o efectuado por la Dirección de Administración y Finanzas de la Secretaría de Desarrollo Social del Estado, mediante la firma de la póliza y recibo, presentando una identificación original y oficial y del beneficiario;\n3) Los gastos de maternidad.\nÉstos se entregarán una vez por año a la mujer periodista que lo solicite con antelación, y repetible dos años después;\n4) En materia de capacitación, actualización y profesionalización el Comité Técnico determinará integrantes del fondo, quedando como determinante la disponibilidad presupuestal del Fondo.\nEJERCICIO FISCAL 2016\ne) Comité de Contraloría Social. mismo en asamblea general, dicho órgano estará integrado por un Presidente, un Secretario, un Tesorero y dos vocales.\nf) Integrar el expediente del beneficiario\nBeneficiarios del Fondo de Apoyo\nRequisitos del expediente a Periodistas.\n1. Los periodistas solicitantes deberán manifestar que se dedican Entregar copia legible y presentar original para su cotejo de los de manera habitual, profesional o documentos siguientes: laboralmente a informar a la población y que desean afiliarse o 2. Formato de solicitud de afiliación al FAP; permanecer en el FAP 3. Curriculum Vitae;\n4. Credencial oficial para votar;\n5. 2 Fotografías tamaño infantil;\n6.- Constancia aval de la organización a la que pertenece; y,\n7.- Constancia de Ingresos o de Antigüedad Laboral.\ng) Entrega de apoyos\nLa Secretaría de Desarrollo Social como instancia ejecutora, será la encargada de entregar los apoyos económicos a las y los beneficiarios en los plazos y lugares acordados por la misma instancia.\n15. Gastos de operación\nDel total de recursos autorizados al programa, podrá aplicarse hasta un 3% del presupuesto asignado, para gastos de operación, destinados a las diversas acciones asociadas con la planeación, operación, supervisión, contraloría social y evaluación o asesoría externa del programa.\n16. Registro de operaciones:\na) Avances físicos - financieros.\nGubernamental, los informes sobre el presupuesto ejercido y en base a los indicadores de resultados financieros de las acciones autorizadas.\nEJERCICIO FISCAL 2016\nb) Recursos no devengados.\nLos recursos que al cierre del ejercicio se conserven o que no se hayan devengado al 31 de diciembre del presente ejercicio fiscal, deberán ser reintegrados a la Tesorería General del Estado, dependiente de la Secretaría de Finanzas y Administración del Estado.\nc) Cierre de ejercicio.\nLa dependencia ejecutora integrará el cierre de ejercicio a través de su la Dirección de\nAdministración y Finanzas y lo remitirá a la Secretaría de Finanzas y Administración del Estado, de manera impresa y en medios magnéticos; asimismo, verificará la congruencia de la información con la cuenta pública.\n17. Evaluación\n17.1. Evaluación interna\nEl Programa Fondo de Apoyo a Periodistas, estará sujeto a procesos periódicos de seguimiento y evaluación que permitan ajustar su ejecución y garantizar que los mecanismos de funcionamiento y administración faciliten tanto la obtención de información como la evaluación de los beneficios económicos y sociales.\n17.2. Evaluación externa\nLa Secretaría de Desarrollo Social del Estado, podrá realizar una evaluación de resultados de carácter externo del programa sujeto a reglas de operación, para lo cual tendrá la facultad de designar a la instancia que realizará dicho análisis.\nLas evaluaciones externas que se realicen al programa serán coordinadas por la Secretaría de\nContraloría y Transparencia Gubernamental.\n18. Indicadores nivel de propósito, detallados a continuación:\n• Número de solicitudes recibidas y/o solicitudes ejecutadas;\n• Número de acciones y/o acciones programadas;\n• Número de beneficiarios que recibieron el apoyo;\n• Número de afiliados con seguro de vida verificados; y, • Número de afiliados sin acceso a la seguridad social incorporadas.\nEJERCICIO FISCAL 2016\nLa Secretaría de Desarrollo Social del Estatal, será responsable de compilar e integrar un reporte\nPeriodistas que indiquen el número de beneficiarios atendidos al finalizar el ejercicio fiscal.\n19. Seguimiento, control y auditoría\n19.1. Seguimiento\nLa Secretaría de Desarrollo Social del Estado, en operación del Programa Fondo de Apoyo a\nPeriodistas y para la mejora de éste, integrará informes a través de la Secretaría Técnica del FAP y además llevará a cabo el seguimiento a los recursos asignados al programa.\n19.2. Control y auditoría\nLa Secretaría de Desarrollo Social del Estado, será responsable de la supervisión directa de las acciones, así como de verificar que en su ejecución cumpla con la normatividad aplicable.\nSu ejercicio estará sujeto a las disposiciones estatales aplicables y podrán ser auditados por las instancias de fiscalización.\nLa Secretaría de Desarrollo Social del Estado, dará todas las facilidades a dichas instancias fiscalizadoras para realizar en el momento en que lo juzguen pertinente, las auditorias, revisiones o visitas de inspección que consideren, efectuando las acciones necesarias para dar atención a las recomendaciones planteadas.\n20. Transparencia\n20.1. Difusión\nLas reglas de operación, además de su publicación en el Periódico Oficial del Gobierno del Estado de Guerrero, estarán disponibles en la página electrónica de la Secretaría de Desarrollo Social del Estado, www.sedesol.guerrero.gob.mx; asimismo, se establecerán las estrategias de difusión del programa y las acciones conducentes para dar a conocer los requisitos de participación, la corresponsabilidad de los beneficiarios y los apoyos a otorgar.\nInformación Pública del Estado de Guerrero, la Secretaría de Desarrollo Social del Estado, publicará\n20.2. Comité de Contraloría social social, los cuales fungirán como contraloría social, como un Órgano Ciudadano de Control, Vigilancia y\nEJERCICIO FISCAL 2016\nEvaluación de las actividades del programa, conformado por los beneficiarios y alguna autoridad local, públicos se realicen en términos de eficiencia, eficacia, oportunidad, equidad, transparencia, legalidad y honradez.\nEl Comité de contraloría Social, deberá vigilar y dar seguimiento al proyecto y/o acciones a través de los formatos que componen el expediente de contraloría social, integrado por:\na) Acta de conformación del Comité;\nb) Reunión con beneficiarias y beneficiarios;\nc) Ficha informativa del programa;\nd) Cédula de vigilancia del programa; y,\ne) Acta de difusión y capacitación.\nEl Comité se conforma con la representación de la comunidad beneficiada, mismos que fungirán como interlocutores con la Secretaría de Desarrollo Social del Estado, en el ejercicio de contraloría social.\nEl Comité debe estar constituido por un Presidente, un Secretario y un Vocal mínimamente, electos dentro de la población beneficiada, en donde se va a llevar a cabo la entrega del programa y tendrá que ser vigilado, dicho comité deberá revisar los avances y resultados del programa, así como la detección de cualquier presunta irregularidad.\nEl vocal será el responsable de hacer llegar las quejas o denuncias recibidas a la Secretaría de\nDesarrollo Social del Estado, quien dará respuesta en un plazo no mayor de 15 días hábiles a partir de la fecha de recepción de la misma.\n20.3. Confrontas\nPara efectos de confrontas entre los programas que ejecuta esta Secretaría y otras dependencias, lineamientos normativos.\n20.4. Acciones de blindaje electoral\nLa Secretaría de Desarrollo Social del Estado, para la operación y ejecución de los recursos estatales que opera el programa, deberá observar y atender las medidas que emita la Secretaría de\nPública del Estado de Guerrero (ITAIG), el Instituto Electoral y de Participación Ciudadana del Estado de\nGuerrero (IEPC) y las demás autoridades competentes con la finalidad de impedir que los apoyos sean utilizados con fines políticos electorales.\nEJERCICIO FISCAL 2016\nLa papelería, documentación oficial, así como la publicidad y promoción de este programa deberán incluir la siguiente leyenda \"Este programa es de carácter público, no es patrocinado ni promovido contribuyentes. Está prohibido el uso de este programa con fines políticos, electorales, de lucro y otros distintos a los establecidos. Quien haga uso indebido de los recursos de este programa deberá ser denunciado y sancionado de acuerdo con la ley aplicable y ante la autoridad competente\".\nEn cuanto a la publicidad en medios electrónicos, impresos, complementarios o de cualquier otra índole vinculada con los programas de comunicación social, se deberá incluir la leyenda \"Este programa es público y queda prohibido su uso con fines partidistas o de promoción personal\".\n21. Perspectiva de género\nEn el ámbito de su competencia, el programa de Fondo de Apoyo a Periodistas incorporará la perspectiva de género, para lo cual podrá identificar las circunstancias que profundizan las brechas de desigualdad manifiesta en la distribución de recursos, acceso a oportunidades y ejercicio de la ciudadanía entre otros, que genera discriminación y violencia, en particular hacia las mujeres a fin de determinar los mecanismos que incidan en su reducción o eliminación y potenciar la igualdad sustantiva entre mujeres y hombres para alcanzar un desarrollo pleno y garantizar la vigencia, reconocimiento y el ejercicio de sus derechos humanos.\n22. Quejas, denuncias y solicitud de información\n22.1. Quejas y denuncias\nLos beneficiarios y beneficiarias pueden presentar sus quejas o denuncias directamente en las oficinas de la Secretaría de Desarrollo Social del Estado, sobre cualquier hecho, acto u omisión que produzca o pueda producir daños al ejercicio de sus derechos establecidos en las presentes reglas o contravengan sus disposiciones y demás normatividad aplicable.\nEdificio Norte, Planta Baja, Palacio de Gobierno, sita en Boulevard René Juárez Cisneros número 62, Chilpancingo, Guerrero, C.P. 39074.\nEl denunciante o quejoso deberá proporcionar:\na) Nombre del servidor público;\nb) Objeto de la denuncia;\nc) Nombre y domicilio del quejoso; y,\nEJERCICIO FISCAL 2016\nd) Identificación oficial.\n23. Glosario de términos\nBeneficiario: Persona dedicada al ejercicio periodístico que recibe los apoyos del programa por haber cumplido con su responsabilidad, así como con los requisitos y criterios de elegibilidad establecidos en estas reglas.\nCorresponsabilidad: Se refiere a la aportación en efectivo o en especie por parte de los beneficiarios de las actividades que les corresponde de acuerdo a las acciones que les fueron aprobados, que será cubierta por el Fondo de Apoyo a Periodistas.\nDisponibilidad presupuestal: Recurso destinado al programa.\nFAP: Programa Fondo de Apoyo a Periodistas.\nIED: Inversión estatal directa.\nPresupuesto: El contenido en el Decreto de Presupuesto de Egresos del Gobierno del Estado para el Ejercicio Fiscal 2016.\nSolicitante: Persona que pide participar en el programa de manera formal.\n24. Anexos\nAnexo 1. Solicitud de apoyo.\nAnexo 2. Acta del Comité de Contraloría Social con lista de asistencia.\nAnexo 3. Recibo por la acción entregada y firmada por el beneficiario.\nAnexo 4. Cuestionario único.\nPrimero. El presente Acuerdo entrará en vigor el día siguiente de su publicación en el Periódico\nSegundo. Quedan abrogadas las Reglas de Operación del Programa Fondo de Apoyo a\nPeriodistas, publicadas en el Periódico Oficial del Estado de Guerrero No. 59 el 25 julio del año 2014.\nTercero. A partir de la entrada en vigor de las presentes Reglas de Operación, el área responsable de Desarrollo Social del Estado de Guerrero.\nEJERCICIO FISCAL 2016\nDado en la Oficina, ubicada en el Edificio Norte Planta Baja de Palacio de Gobierno, Boulevard\nRené Juárez Cisneros No. 62 ciudad de los Servicios en la Ciudad de Chilpancingo de los Bravo, Capital del Estado de Guerrero, a los 29 días del mes de enero del año dos mil dieciséis.\nLA SECRETARIA DE DESARROLLO SOCIAL.\nLIC. ALICIA ELIZABETH ZAMORA VILLALVA.\nRúbrica.",
  "ordenamiento": "PROGRAMA",
  "jurisdiccion": "GUERRERO",
  "fuente_oficial": "DIARIO OFICIAL DE LA FEDERACION",
  "Fecha de Publicación": "14 \nDE JULIO DE 2017",
  "ULTIMA REFORMA PUBLICADA": "14 DE JULIO DE 2017",
  "status": "VIGENTE",
  "es_escaneado": false,
  "tiene_tablas": true,
  "materia": [
    "comunicación social"
  ]
}