{
  "titulo": "Acuerdo por el Que Se Crea el Programa Pensión Guerrero, y Se Emiten Sus Reglas de Operación",
  "Contenido": "TEXTO ORIGINAL.\nAcuerdo publicado en el Periódico Oficial del Gobierno del Estado No. 31 Alcance V, el Martes 18 de Abril de 2023.\nACUERDO POR EL QUE SE CREA EL PROGRAMA PENSIÓN GUERRERO, Y SE EMITEN\nSUS REGLAS DE OPERACIÓN.\nGuerrero. - Poder Ejecutivo.\nMAESTRA EVELYN CECIA SALGADO PINEDA, GOBERNADORA CONSTITUCIONAL DEL ESTADO\nDE GUERRERO, CON FUNDAMENTO EN LO DISPUESTO POR LOS ARTÍCULOS 71, 87, 88 Y 90\nEN EJERCICIO DE LAS FACULTADES QUE ME CONFIEREN LOS ARTÍCULOS 1, 2, 4, 8, 9, 16, 22\nAPARTADO A FRACCIÓN I, 23 FRACCIÓN III Y 46 DE LA LEY ORGÁNICA DE LA ADMINISTRACIÓN\nPÚBLICA DEL ESTADO DE GUERRERO NÚMERO 242; 1, 2 FRACCIÓN I, 18 Y 25 DE LA LEY NÚMERO\n454 DE PRESUPUESTO Y DISCIPLINA FISCAL DEL ESTADO DE GUERRERO; 2, 3, 59 Y 60 DE LA\nLEY NÚMERO 375 DE LOS DERECHOS DE LAS PERSONAS ADULTAS MAYORES DEL ESTADO DE\nGUERRERO; EN RELACIÓN CON EL ARTÍCULO 47 Y ANEXO 23 (P38) Y 23- A DEL DECRETO\nNÚMERO 424 DEL PRESUPUESTO DE EGRESOS DEL ESTADO DE GUERRERO PARA EL\nEJERCICIO FISCAL 2023, Y LOS LINEAMIENTOS PARA LA ELABORACIÓN DE LAS REGLAS DE\nOPERACIÓN DE LOS PROGRAMAS SOCIALES ESTATALES PARA EL PERIODO 2022-2027.\nQue el Plan Estatal de Desarrollo 2022-2027, Eje 1. Bienestar, Desarrollo Humano y Justicia\nSocial, Objetivo 1.3. Disminuir las desigualdades a través de la atención a grupos vulnerables; a la\nEstrategia 1.3.2. Atención prioritaria a grupos vulnerables con la Línea de acción 1.3.2.5. Mejorar el nivel de bienestar y envejecimiento digno de los Adultos Mayores de 63 a 64 años 11 meses a través de apoyos y acciones orientadas a satisfacer sus necesidades básicas.\nQue en la Agenda 2030 para el Desarrollo Sostenible se alinea en el Objetivo 1. “Fin a la pobreza” en su meta 1.1. “Erradicar para todas las personas y en todo el mundo la pobreza extrema. Se considera que sufren pobreza extrema las personas que viven con menos de 1,25 dólares al día” con el indicador\n1.1.1. Proporción de la población que vive por debajo del umbral internacional de la pobreza, desglosada por sexo, edad, situación laboral y ubicación geográfica (urbana o rural).\nQue es responsabilidad de la administración pública estatal, que la planeación y aplicación de las políticas públicas se adecúen a los principios, objetivos y programas, así como a los compromisos internacionales adquiridos por el gobierno mexicano, con respecto a los derechos de las Personas Adultas\nMayores.\nQue uno de los compromisos de la titular del ejecutivo estatal con la ciudadanía guerrerense, al asumir y tomar protesta como Gobernadora Constitucional del Estado es, lograr un Guerrero de tranquilidad, de paz y de justicia, que permitan consolidar el crecimiento económico y estabilidad social de las Personas Adultas Mayores de nuestro estado.\nQue la Ley Número 375 de los Derechos de las Personas Adultas Mayores del estado de Guerrero establece garantizar las condiciones para que las personas adultas mayores gocen de una calidad de vida digna, productiva dentro y fuera del seno familiar.\nQue la citada Ley Número 375 fundamenta la creación del Instituto Guerrerense para la Atención\nIntegral de las Personas Adultas Mayores IGATIPAM, como Organismo Público Descentralizado de la\nAdministración Pública Estatal, con personalidad jurídica y patrimonio propio y autonomía técnica de gestión para el cumplimiento de sus atribuciones, objetivos y fines, con domicilio en la ciudad de\nChilpancingo de los Bravo, Guerrero, misma que en su artículo 38 refiere que el IGATIPAM es rector responsable de la formulación, desarrollo, ejecución, evaluación y vigilancia de la política pública estatal de las y los adultos mayores, que forma parte prioritaria de la política para el Desarrollo Social, cuyo objeto es coordinar, promover, apoyar, vigilar y evaluar las acciones públicas, estrategias y programas que se deriven de ella, y será el enlace con los Organismos Nacionales y Municipales afines en la materia.\nQue el Decreto Número 424 del Presupuesto de Egresos del Estado de Guerrero para el Ejercicio\nFiscal 2023, publicado en el Periódico Oficial del Gobierno del Estado de Guerrero No. 103 de fecha 27 de diciembre del 2022, señala que se ejercitarán los recursos bajo una política de gasto público, que permita dar cumplimiento a lo que globalmente prevén las dimensiones, ejes temáticos, objetivos, estrategias y líneas de acción del Plan Estatal de Desarrollo 2022-2027 orientados a los sectores, municipios y comunidades del estado de Guerrero.\nQue el mencionado Decreto Número 424, en su artículo 47 establece que con el objeto de asegurar la aplicación eficiente, eficaz, oportuna, equitativa y transparente de los recursos públicos, la Secretaría de\nFinanzas y Administración y la Secretaría de Planeación y Desarrollo Regional, emitirán las disposiciones a que deberán sujetarse los programas de inversión sujetos a Reglas de Operación.\nQue la Secretaría de Planeación y Desarrollo Regional, expidió los Lineamientos para la elaboración de las Reglas de Operación de los Programas Sociales Estatales para el periodo 2022-2027, cuales tienen como finalidad de ofrecer a las secretarías, dependencias y entidades paraestatales del de operación, así como los elementos para integrar su contenido.\nQue el Instituto Guerrerense para la Atención Integral de las Personas Adultas Mayores, es rector responsable de la formulación, desarrollo, ejecución, evaluación y vigilancia de la política pública estatal para las Personas Adultas Mayores, que forma parte prioritaria de la política para el Desarrollo Social, cuyo objeto es coordinar, promover, apoyar, vigilar y evaluar las acciones públicas, estrategias y programas de la política pública estatal para las personas adultas mayores.\nQue el Programa Pensión Guerrero, está orientado a atender a las personas adultas mayores en situación de vulnerabilidad que surge por la reducción del ingreso al final de la vida productiva, y con la dependencia como resultado de las enfermedades crónicas, la discapacidad y reducción de la funcionalidad, por lo que es importante eficientar el uso de los recursos asignados para beneficiar a esta población en acelerado crecimiento, de ahí que se establecen para su ejecución reglas de operación, mismas que especifican los criterios para acceder a los beneficios de este programa, acordes a lo establecido en la Ley Número 375 de los Derechos de las Personas Adultas Mayores del estado de\nGuerrero.\nPor lo anteriormente expuesto y con fundamento en las disposiciones legales antes citadas, he tenido a bien expedir el siguiente:\nACUERDO POR EL QUE SE CREA EL PROGRAMA PENSIÓN GUERRERO, Y SE EMITEN SUS\nREGLAS DE OPERACIÓN.\nArtículo 1. Se crea el Programa Pensión Guerrero, el cual tiene como objetivo mejorar la calidad de vida de las y los adultos mayores que radiquen dentro del territorio guerrerense, mediante el otorgamiento de un apoyo económico, y acceso oportuno a servicios de salud, a la educación, apoyo complementario para una nutrición balanceada, apoyo a la vivienda, conferencias, talleres de capacitación, eventos culturales y recreativos, asesoría legal, cursos de computación, manualidades, así como actividades culturales y deportivas.\nArtículo 2. El Instituto Guerrerense para la Atención Integral de las Personas Adultas Mayores tendrá a cargo la implementación, ejecución, evaluación y administración del Programa Pensión Guerrero, bajo los criterios de objetividad, equidad, transparencia, publicidad, selectividad y temporalidad, con estricto apego a la normatividad aplicable, por lo tanto, será el encargado de la asignación de los recursos del\nPrograma apegándose plenamente a las a las Reglas de Operación.\nArtículo 3. Se emiten las Reglas de Operación del Programa Pensión Guerrero, en las cuales se establece el procedimiento de ejecución del Programa, los principios, requisitos que se deben observar para acceder al mismo en los términos siguientes:\nREGLAS DE OPERACIÓN DEL PROGRAMA PENSIÓN GUERRERO.\n1. Introducción.\n1.1. Antecedentes.\nEn 1982 se realizó la Primera Asamblea Mundial sobre el Envejecimiento, convocada y organizada por la\nOrganización de las Naciones Unidas (ONU), resultado de esta Asamblea fue la elaboración del Plan de\nViena, mismo que concentra las recomendaciones que emanaron de los países reunidos y constituyó el marca el futuro del mundo.\nEn México, 20 años después entró en vigor la Ley Federal de los Derechos de las Personas\nAdultas Mayores, que entre sus alcances está el dar impulso a las acciones desde el estado y la sociedad, para promover el desarrollo integral de esta población. En el marco de esta Ley es que se establece el\nPrograma Pensión Guerrero, consistente en otorgar un apoyo económico a las personas adultas mayores en situación de vulnerabilidad, desempleadas, que no cuenten con seguridad social y que radiquen en territorio guerrerense, adicionalmente y para coadyuvar a una mejor calidad de vida se implementan las acciones del anteproyecto de Envejecimiento Digno incluido en el Programa Sectorial Desarrollo y\nAsistencia Social en el Capítulo IV Programas y Proyectos a Desarrollar 2016-2021 y responsables de su ejecución, con el cual se podrá apoyar con subsidios y acciones en materia de salud, alimentación, empleo, apoyo a la vivienda y servicios básicos y la inclusión a la vida productiva y económica; con la visión de mejorar el bienestar emocional y calidad de vida de las personas adultas mayores del estado.\nLa Ley Número 375 de los Derechos de las Personas Adultas Mayores del estado de Guerrero, fundamenta la creación del Instituto Guerrerense para la Atención Integral de las Personas Adultas Mayores e instituye el Programa Pensión Guerrero, respectivamente, como ente responsable de la formulación, desarrollo y ejecución de la política pública estatal de las personas adultas mayores.\nEl Programa Pensión Guerrero, inicia en el año 2003 con un presupuesto de 20 millones de pesos en las 5 ciudades más grandes del estado: Acapulco, Chilpancingo, Iguala, Taxco y Zihuatanejo; en 2005 se extendió a 77 municipios y de 2006 a 2011 se incluyeron todos los municipios con un monto de 245 millones de pesos atendiendo a 50,020 beneficiarias y beneficiarios en todo el estado de Guerrero. A partir del 2012 el presupuesto ha venido reduciéndose considerablemente hasta el año 2022 con 24 millones de pesos, hasta que este año 2023 se inicia con un incremento en el presupuesto de 4 millones más para quedar en 28 millones de pesos, el apoyo es otorgado a partir de los 63 años y hasta los 64 años con 11 meses de edad, en razón de que la estrategia del gobierno federal que a través de la Secretaría del\nBienestar apoya de manera universal a mujeres y hombres mayores de 65 años en todo el país.\n2. Alineación Programática al PED y/o PND.\nEl Programa, se alinea al Plan Nacional de Desarrollo 2019- 2024 en el Eje II Política Social, apartado Programas: 1. El Programa para el Bienestar de las Personas Adultas Mayores que otorga un apoyo universal a mujeres y hombres de más de 65 años en todo el país.\nEn el Plan Estatal de Desarrollo 2022-2027, el Programa está alineado al Eje 1 Bienestar, Desarrollo Humano y Justicia Social, Objetivo 1.3. Disminuir las desigualdades a través de la atención a grupos vulnerables; a la Estrategia 1.3.2. Atención prioritaria a grupos vulnerables con la Línea de acción1.3.2.5. Mejorar el nivel de bienestar y envejecimiento digno de los Adultos Mayores de 63 a 64 años\n11 meses a través de apoyos y acciones orientadas a satisfacer sus necesidades básicas.\nEn la Agenda 2030 para el Desarrollo Sostenible se alinea en el Objetivo 1. “Fin a la pobreza” en su meta 1.1. “Erradicar para todas las personas y en todo el mundo la pobreza extrema. Se considera que sufren pobreza extrema las personas que viven con menos de 1,25 dólares al día” con el indicador 1.1.1.\nProporción de la población que vive por debajo del umbral internacional de la pobreza, desglosada por sexo, edad, situación laboral y ubicación geográfica (urbana o rural).\n2.1. Diagnóstico. biológico, psicológico y social. Cada persona sigue un proceso de envejecimiento particular que depende de las características innatas, de la experiencia y conocimientos adquiridos y de las circunstancias enfrentadas durante la vida. El método más utilizado para identificar a las personas adultas mayores es a través de grupos quinquenales de edad, para dicho propósito se han empleado las edades de 60, 65, 70 años y más, entre otras.\nCausas.\nEl aumento de este grupo poblacional es un tema de mucha importancia para el Instituto, principalmente por la vulnerabilidad que surge por la carencia de servicios para la atención integral de sus necesidades básicas, porque viven en condiciones precarias con una alta incidencia de enfermedades crónicas y dicha vulnerabilidad se agrava debido a que el sistema de pensiones deja fuera a un número importante de las personas adultas mayores quienes no cuentan con acceso a los beneficios que otorgan las instituciones de seguridad social.\nEfectos.\nLa vulnerabilidad de las personas adultas mayores se refleja en mayor dependencia económica y funcional de familiares o terceros, lo cual es un factor que les resta autonomía y podría generar una situación en la que las personas adultas mayores sean consideradas una carga para la familia, su autoestima disminuye provocando un acelerado deterioro en su salud.\nEl hogar es la unidad fundamental de la sociedad, en la que sus miembros resuelven sus necesidades primarias de alimentación y vivienda, por lo que la solidaridad y protección entre los miembros es esencial para alcanzar el bienestar físico y emocional de todos los integrantes del hogar.\nEn 2010 se identificaron 6.4 millones de hogares con al menos una persona adulta mayor, de las cuales 4.5 millones albergaban a las personas adultas mayores sin pensión ni jubilación. Los restantes 1.9 pensión o jubilación.\nEn este diagnóstico se considera el umbral de 60 a 64 años grupo quinquenal que en los últimos\n10 años se ha incrementado en un 30% en nuestro estado (Tabulados del INEGI Censo 2010 y 2020\nPoblación total por entidad federativa y grupo quinquenal de edad según sexo).\n2.1.1. Población Potencial.\nEn Guerrero, se presenta incremento acelerado de la población adulta mayor que se encuentra en situación de vulnerabilidad y no cuenta con un ingreso económico a manera de pensión, la poca o nula solvencia económica y la falta de garantías sociales y laborales, actualmente dentro del rango de 60 a 64 gobierno estatal, especialmente aquellas que se encuentran fuera de los esquemas institucionales de seguridad social.\n2.1.2. Población Objetivo.\nEn nuestro estado existen 47,198 personas adultas mayores dentro del rango de 63 a 64 años con\n11 meses de edad, que representa el 37.23 por ciento de la población potencial.\n2.1.3. Población Beneficiaria.\nEl Programa beneficiará a 3,100 personas adultas mayores que representa el 7 por ciento de la población objetivo, se atenderá a las personas que se encuentran en situación de vulnerabilidad, que radiquen dentro del territorio guerrerense, con una cobertura estatal, y que cumplan los requisitos previstos en los numerales 9.2.1. y 9.2.2., de las presentes Reglas de Operación.\n2.1.4. Población Indígena.\nEl Programa beneficiará a 212 personas adultas mayores de 25 municipios indígenas y 10 de un municipio afromexicano que se encuentran en situación de vulnerabilidad, siempre y cuando radiquen dentro del territorio guerrerense y que cumplan los requisitos previstos en los numerales 9.2.1. y 9.2.2., de las presentes Reglas de Operación.\n2.2. Fundamento Legal.\na) Constitución Política de los Estados Unidos Mexicanos;\nb) Ley General de Desarrollo Social;\nc) Ley de los Derechos de las Personas Adultas Mayores;\nd) Ley General para la Igualdad entre Mujeres y Hombres;\ne) Ley General de Acceso de las Mujeres a una Vida Libre de Violencia;\ng) Ley Orgánica de la Administración Pública del Estado de Guerrero Número 242;\nh) Ley Núm. 102, para el Desarrollo Social del Estado de Guerrero;\nj) Ley Número 375 de los Derechos de las Personas Adultas Mayores del Estado de Guerrero;\nk) Ley Número 454 de Presupuesto y Disciplina Fiscal del Estado de Guerrero;\nl) Ley Número 465 de Responsabilidades Administrativas para el Estado de Guerrero;\nm) Ley Número 466 de Protección de Datos Personales en Posesión de Sujetos Obligados del\nEstado de Guerrero;\nn) Ley Número 468 de Fiscalización Superior y Rendición de Cuentas del Estado de Guerrero;\no) Ley Número 494 para la Igualdad entre Mujeres y Hombres del Estado de Guerrero;\np) Ley Número 553 de Acceso de las Mujeres a una Vida Libre de Violencia del Estado Libre y\nSoberano de Guerrero;\nr) Ley Número 690 de Entidades Paraestatales del Estado De Guerrero;\ns) Reglamento de la Ley para el Desarrollo Social del Estado de Guerrero Núm. 102;\nt) Reglamento Interior del Organismo Público Descentralizado, Instituto Guerrerense para la\nAtención Integral de las Personas Adultas Mayores;\nu) Plan Nacional de Desarrollo 2019-2024;\nv) Decreto Número 181 por medio del cual la Sexagésima Tercera Legislatura al Honorable\n2022-2027;\nw) Acuerdo que establecen los Compromisos para la Estabilidad y Desarrollo del Estado de\nGuerrero;\nx) Decreto por el que se formula la declaratoria de las Zonas de Atención Prioritaria para el año\n2023, y\ny) Todas aquellas disposiciones normativas aplicables.\n2.3. Definiciones y Siglas.\nDefiniciones:\nBeneficiaria o Beneficiario: Persona Adulta Mayor que cumple con los requisitos de la normatividad correspondiente y que está dentro del padrón del Programa Pensión Guerrero.\nComité Técnico de Validación: Órgano que establece las normas que regulan la actuación, vigilancia, control, funcionamiento y que resuelve los casos no previstos en las Reglas de Operación del\nPrograma.\nComprobante de domicilio: Documento con máximo tres meses de antigüedad, recibo de servicio de energía eléctrica, servicio de agua potable o recibo de telefonía fija.\nInstituto: Instituto Guerrerense para la Atención Integral de las Personas Adultas Mayores, Organismo Público Descentralizado.\nMatriz de Indicadores Para Resultados (MIR): Herramienta de planeación que establece con claridad los objetivos e indicadores que miden dichos objetivos del Programa.\nPadrón de beneficiarias o beneficiarios: Relación oficial de personas beneficiarias que incluye a las personas atendidas por el Programa y que su perfil socioeconómico cumple con la normatividad correspondiente.\nPago de marcha: Apoyo económico que se entrega por única ocasión al representante de la persona beneficiaria, cuando ésta haya fallecido.\nPersonas adultas mayores: Personas de 60 años y más que radican en territorio guerrerense.\nPoblación Indígena: Aquellas que forman un pueblo originario, asentado en territorio guerrerense, con autoridades propias de acuerdo con sus usos y costumbres.\nPrograma: Programa Pensión Guerrero.\nReglas de Operación: Conjunto de disposiciones que precisan la forma de operar un programa, con el propósito de transparentar y normar la distribución y entrega de los apoyos.\nSupervivencia: Presentación de la beneficiaria o beneficiario en los lugares y fechas que requiera el Instituto, para verificar que continúa con vida.\nSiglas:\nCONAC: Consejo Nacional de Armonización Contable.\nCURP: Clave única de Registro de Población.\nIEPC: Instituto Electoral y de Participación Ciudadana del Estado de Guerrero.\nIGATIPAM: Instituto Guerrerense para la Atención Integral de las Personas Adultas Mayores.\nINAPAM: Instituto Nacional de las Personas Adultas Mayores.\nINEGI: Instituto Nacional de Estadística y Geografía.\nINE: Instituto Nacional Electoral.\nITAIGro: Instituto de Transparencia, Acceso a la Información y Protección de Datos Personales del Estado de Guerrero.\nROP: Reglas de Operación del Programa Pensión Guerrero.\nSCyTG: Secretaría de Contraloría y Transparencia Gubernamental.\nSEFINA: Secretaría de Finanzas y Administración del Estado de Guerrero.\nSEPLADER: Secretaría de Planeación y Desarrollo Regional del Estado de Guerrero.\n3. Objetivos y Alcances.\n3.1. Objetivo General.\nEl Programa, tiene como objetivo contribuir para que las personas adultas mayores que radican en el estado de Guerrero reciban seguridad social y servicios para un envejecimiento digno que les permita elevar su calidad de vida; mediante el otorgamiento de un apoyo económico, propiciando el acceso a servicios de salud, a la educación, a un apoyo complementario para una nutrición balanceada, subsidios para mejoramiento de la vivienda, conferencias, talleres y cursos de capacitación, asesoría legal, eventos culturales, deportivos y recreativos.\n3.2. Objetivos Específicos.\na) Impulsar la capacitación de las personas adultas mayores para mejorar su calidad de vida al incorporarlos al sector productivo;\nb) Otorgar apoyos económicos a las personas adultas mayores de 63 a 64 años con 11 meses de edad considerando los municipios que conforman las regiones del estado;\nc) Concientizar la corresponsabilidad entre los miembros de la familia, conservando las relaciones personales y el trato directo con ella, aún en los casos de estar separados; se podrán realizar visitas domiciliarias a fin de verificar las condiciones del entorno de la Persona Adulta Mayor, lo anterior en coordinación con instituciones especializadas en la defensa de los derechos de las personas mayores;\nd) Mejorar la situación de la Persona Adulta Mayor que se encuentre en riesgo o desamparo mediante el otorgamiento de un apoyo que coadyuve para su alimentación, salud, educación y mejoramiento de la vivienda;\ne) Promover la gratuidad y descuentos al obtener algún bien o utilizar algún servicio;\nf) Propiciar la capacitación para el trabajo a través de talleres y cursos como son: computación, manualidades y preparación de alimentos; llevar a cabo conferencias, actividades deportivas y culturales para su recreación;\ng) Brindar asesoría legal e información sobre las instituciones que proporcionan servicios de asistencia para su cuidado, y\nh) Promover la atención psicológica a través de la concientización en el cuidado de las personas adultas mayores, mediante capacitaciones y conferencias en gerontología.\n3.3. Cobertura.\nEl Programa opera a nivel estatal en todos los municipios que lo integran, beneficiando a las personas adultas mayores de 63 a 64 años con 11 meses de edad, posibles beneficiarias y beneficiarios de nuevo ingreso o que se reactiven por haber causado baja por algún motivo establecido en el numeral 12.2., del presente ordenamiento y de los beneficios adicionales, mismos que estarán sujetos a la disponibilidad presupuestal del Programa, en la intención de ofrecer una atención integral.\n3.4. Alcances.\nSe beneficiará a 3,100 personas adultas mayores considerando todos los municipios que componentes de Envejecimiento Digno, algunos serán por una sola ocasión, otros serán permanentes y a la seguridad social, entendida como un acto solidario.\nComponentes de Envejecimiento Digno\nEconomía talleres recreación\n{\"tabla_1\":{\"columnas\":[\"Apoyos\",\"(sin encabezado)\",\"Personas\",\"(sin encabezado)\",\"Meta\\nanual\\n(Apoyos)\",\"Tipo\"],\"filas\":[{\"columna_1\":\"(sin dato)\",\"columna_2\":\"(sin dato)\",\"columna_3\":\"Beneficiarias\",\"columna_4\":\"(sin dato)\",\"columna_5\":\"(sin dato)\",\"columna_6\":\"(sin dato)\"},{\"columna_1\":\"(sin dato)\",\"columna_2\":\"(sin dato)\",\"columna_3\":\"(Adulta\",\"columna_4\":\"(sin dato)\",\"columna_5\":\"(sin dato)\",\"columna_6\":\"(sin dato)\"},{\"columna_1\":\"(sin dato)\",\"columna_2\":\"(sin dato)\",\"columna_3\":\"Mayor)\",\"columna_4\":\"(sin dato)\",\"columna_5\":\"(sin dato)\",\"columna_6\":\"(sin dato)\"},{\"columna_1\":\"Pensión\",\"columna_2\":\"2,000\",\"columna_3\":\"(sin dato)\",\"columna_4\":\"(sin dato)\",\"columna_5\":\"12,000\",\"columna_6\":\"Apoyo\\neconómico\"},{\"columna_1\":\"Envejecimiento Digno, consiste en otorgar\\nsubsidios: como apoyo para mejoramiento de la\\nvivienda, llevar a cabo conferencias, talleres y\\ncursos de capacitación como son: computación,\\nmanualidades, preparación de alimentos, eventos\\nculturales, deportivos y recreativos, brindar\\nasesoría legal, propiciar el acceso oportuno a\\nservicios de salud, educación y apoyo\\ncomplementario para una nutrición\\nbalanceada.\",\"columna_2\":\"1,100\",\"columna_3\":\"(sin dato)\",\"columna_4\":\"(sin dato)\",\"columna_5\":\"6,600\",\"columna_6\":\"Apoyo\\neconómico y/o\\nen especie\"}]}}\n5. Programación Presupuestal.\nEl origen de los recursos del Programa proviene de Inversión Estatal Directa (IED), contenidos en el Decreto Número 424 del Presupuesto de Egresos del estado de Guerrero para el Ejercicio Fiscal 2023, diciembre del 2022, el cual contempla un monto autorizado de\n$28'000,000.00 (Veintiocho millones de pesos 00/100 m.n.).\nCronograma financiero, ejercicio presupuestal 2023\nIED/23 IGATIPAM 2000 Gtos. de operación $245,000 $0 $0 $49,000\nIED/23 IGATIPAM 3000 Gtos. de operación $290,000 $0 $0 $58,000\nIED/23 IGATIPAM 4000 Inversión a ejercer $27,160,000 $0 $0 $5,432,000\nIED/23 IGATIPAM 5000 Gtos. de operación $305,000 $0 $0 $61,000\nTotal programa $28,000,000 $0 $0 $5,600,000\nAbr May Jun Jul Ago Sep Oct Nov Dic\n$49,000 $49,000 $0 $49,000 $0 $49,000 $0 $0 $0\n$58,000 $58,000 $0 $58,000 $0 $58,000 $0 $0 $0\n$5,432,000 $5,432,000 $0 $5,432,000 $0 $5,432,000 $0 $0 $0\n$61,000 $61,000 $0 $61,000 $0 $61,000 $0 $0 $0\n$5,600,000 $5,600,000 $0 $5,600,000 $0 $5,600,000 $0 $0 $0\n5.1. Gastos de Operación.\nDe acuerdo al artículo 47 fracción I de la Ley de la Coordinación Fiscal, se aplicará hasta un 3% para gastos de operación, que serán liberados por la SEFINA, mismos que serán destinados a las diversas acciones asociadas con la planeación, operación, supervisión, verificación, seguimiento, evaluación, dichas erogaciones serán congruentes con las partidas presupuestales dispuestas en el Clasificador por Objeto del Gasto para la administración pública estatal en vigor, principalmente para materiales, suministros y servicios, estudios e investigación, contratación de instructores, promotores entre otros servicios y acciones que coadyuven a la operación y cumplimiento de las metas del programa, observando en todo momento los criterios de racionalidad y austeridad presupuestal, propiciando la eficiencia, eficacia y transparencia en el ejercicio de los recursos.\nPara desarrollar las actividades de talleres, cursos y conferencias para las beneficiarias y beneficiarios en los municipios del estado, el IGATIPAM podrá contratar personas instructoras y promotoras, bajo la figura de prestador de servicios independiente inscritos en el SAT, la Dirección de expediente para su pago correspondiente.\nLas personas instructoras y promotoras deberán cumplir con los documentos siguientes:\na) Original y copia para cotejo de identificación oficial (INE, Pasaporte, INAPAM).\nb) Copia de la Clave Única de Registro de Población (CURP).\nc) Original y copia para cotejo del Acta de Nacimiento.\nd) Original y copia para cotejo del comprobante de domicilio de fecha reciente.\ne) Curriculum vitae.\nf) Una fotografía tamaño infantil.\ng) Datos de cuenta bancaria para transferencia electrónica y/o depósito.\nh) Constancia de Situación Fiscal expedida por el SAT.\n6. Criterios y Requisitos de Elegibilidad.\na). Se consideran elegibles para apoyo económico (Pensión) las personas que cubran los requisitos establecidos en el numeral 9.2.1. y de acuerdo con la disponibilidad presupuestal.\nb). Se consideran elegibles para Envejecimiento Digno las personas que cubran los requisitos establecidos en el numeral 9.2.2., y de acuerdo con la disponibilidad presupuestal.\n7. Tipo, Monto y Periodicidad del Apoyo.\nPara el Apoyo económico (Pensión) de $2,000.00 (Dos mil pesos 00/100 m.n.) que se entregarán de forma bimestral a las personas adultas mayores de 63 a 64 años con 11 meses de edad de acuerdo a los requisitos del numeral 9.2.1. necesidades básicas de las personas adultas mayores, podrán ser en especie, forma electrónica (en tarjeta) o en efectivo en esta modalidad, podrá recibir acceso oportuno a servicios de salud, a la educación, apoyo complementario para la nutrición balanceada, subsidios para apoyo a la vivienda, conferencias, talleres de capacitación, eventos culturales y recreativos, asesoría legal, cursos de computación, manualidades, actividades deportivas y culturales de acuerdo a lo establecido en el numeral 9.2.2.\nAlgunos serán proporcionados en una sola ocasión, otros serán permanentes y dependerán de los nuevos lineamientos y de la disponibilidad presupuestal del Programa.\n7.1. Características de los Apoyos.\nEl apoyo económico (Pensión) se entregará mediante transferencia electrónica de forma bimestral a las personas adultas mayores de 63 a 64 años con 11 meses de edad a las personas beneficiarias del\nPrograma o en efectivo cuando las instancias ejecutoras lo consideren pertinente.\nLos componentes de Envejecimiento Digno podrán ser en especie, forma electrónica (en tarjeta) o en efectivo, con esta vertiente se mejorará la atención a las necesidades básicas de las personas adultas mayores proporcionando el acceso oportuno a servicios de salud, a la educación, apoyo complementario para la nutrición balanceada, subsidios para apoyo a la vivienda, conferencias, talleres de capacitación, eventos culturales y recreativos, asesoría legal, cursos de computación, manualidades, actividades deportivas y culturales.\n7.2. Recursos no Devengados.\nEl Instituto podrá reintegrar los recursos que al cierre del ejercicio no se hayan ejercido a más tardar el 31 de diciembre del presente ejercicio fiscal a la SEFINA para su correspondiente comprobación y registro contable.\n7.3. Resguardo de la Documentación.\nEl resguardo de la documentación comprobatoria de los recursos ejercidos del Programa y se informará al comité de validación del Programa las cifras ejecutadas y las no devengadas (si lo hubiera) al cierre del ejercicio.\n7.4. Supervisión y Control.\nCon el propósito de mejorar la operación, supervisión y control del Programa, el IGATIPAM, remitirá de forma trimestral a las SEPLADER, SEFINA y de la SCyTG, los informes de los recursos ejercidos de acuerdo al CONAC a más tardar a los 15 días de haber concluido el trimestre, de esta forma se llevará a cabo el seguimiento al ejercicio de recursos financieros, acciones ejecutadas, resultados, indicadores, metas alcanzadas y se verificará la congruencia de la información presentada en la Cuenta Pública.\n8. Criterios de Selección.\na) Se dará prioridad a la persona solicitante de acuerdo al grado de marginación de su municipio\nPrioritaria para el año 2023.\nb) Se dará prioridad a la persona solicitante cuando se demuestre que vive en situación vulnerabilidad, riesgo o desamparo que le impide alcanzar mejores niveles de vida.\n8.1. Casos Especiales.\nPara resolver casos especiales no previstos, nuevos ingresos sugeridos por la presidenta o el presidente del Comité de Validación del Programa y/o sus integrantes, se plantearán en sesión ordinaria y/o extraordinaria según sea el caso, las cuales serán convocadas por el IGATIPAM en donde se expondrán las situaciones especiales para su respectiva solución, en casos de veda electoral se podrán adelantar la entrega de apoyos económicos o en especie a las personas beneficiarias del Programa.\n8.2. Casos de Emergencia o Desastres.\nCon el fin de evitar la interrupción de la operación del Programa, en caso de que exista una\nDeclaratoria de Emergencia o de Desastre, el IGATIPAM, podrá convocar a una reunión ordinaria y/o extraordinaria al Comité de Validación del Programa y/o sus integrantes para adelantar los apoyos económicos a la población beneficiaria del Programa que se encuentre inmersa en la zona de desastre, así como, ayuda humanitaria para mitigar sus necesidades prioritarias por la emergencia social o desastre natural.\n8.3. Suspensión o Cancelación del Programa Social.\nEl IGATIPAM, podrá suspender la operación del Programa, cuando no existan las condiciones sociales-económicas entre las partes, cuando una o algunas de las personas beneficiarias no acaten las disposiciones de estos lineamientos y otras señaladas por las personas ejecutoras que afecte la norma estatal o por problemas de gobernabilidad o en caso de que algún órgano de fiscalización detecte alguna irregularidad, como el caso de homonimia, duplicidad del beneficio, entre otros.\n8.4. Integración del Padrón de Personas Beneficiarias.\nLas personas beneficiarias incorporadas al Programa formarán parte de un Padrón Único de\nPersonas Beneficiarias, el cual será de carácter público y estará conformado sin distinción alguna de raza, color, sexo, grupo de edad, discapacidad, estado civil, municipio, región, idioma, religión, opinión política, origen nacional o social, indígenas, afromexicanos, posición económica, nacimiento o cualquier otra condición social o de cualquier otra índole, será de carácter público, siendo reservados sus datos personales de acuerdo con la Ley Número 207 de Transparencia y Acceso a la Información Pública del estado de Guerrero, los cuales en ningún caso podrán emplearse para propósitos de proselitismo político, religioso o comercial, ni para ningún otro fin distinto al establecido en las presentes Reglas de Operación.\n9. Mecánica Operativa del Programa Social.\n9.1. Instancia Ejecutora y/o Responsable.\nEl IGATIPAM, será el responsable de la planeación, coordinación, operación y ejecución de los recursos ejercidos a la SEFINA.\nLa SEFINA, liberará los recursos con oportunidad al IGATIPAM, incluido el 3% de gasto operativo de acuerdo al cronograma financiero autorizado y al calendario de entrega de apoyos.\nLa SEPLADER, la SEFINA y la SCyTG serán las instancias encargadas de dar seguimiento a los informes presentados.\n9.2. Proceso de Incorporación al Programa Social.\nPara tener el acceso al Programa, al apoyo económico (Pensión) o a las acciones de los componentes de Envejecimiento Digno, las personas solicitantes deberán acudir a las oficinas ubicadas en\nCalle Madero No. 22, Col. Centro, Chilpancingo, Gro. C.P. 39000, con un horario de atención de 9:00 a\n15:00 horas en días hábiles en Chilpancingo, Guerrero; o llamar a los teléfonos: 747 47 1 42 33; 747 47 2\n58 69.\nCabe informar que por cuestiones presupuestales existe un número reducido de ingresos al\nPrograma, solo habrá ingresos cuando las personas beneficiarias cumplan los 65 años o en caso de fallecimiento de alguna beneficiaria o beneficiario y/o en la causales de los supuestos del numeral el 12.1., es cuando se puede realizar la sustitución, el IGATIPAM, informará a la persona solicitante o a su representante el resultado de su solicitud de incorporación al Programa, vía telefónica a los números telefónicos proporcionados previamente.\nUna vez validado el registro de la beneficiaria o beneficiario, se iniciará el proceso de entrega del apoyo económico mediante tarjeta bancaria en el lugar que previamente el IGATIPAM dio a conocer, la entrega del apoyo económico se realizará de manera directa y sin intermediarios.\nEn el caso de que la documentación entregada tuviese errores o faltase algún documento, la persona solicitante podrá realizar la corrección de datos presentados y/o presentar la faltante en cualquier momento del ejercicio fiscal o cuando el IGATIPAM lo solicite.\nEl Comité Técnico de Validación, verificará y aprobará la integración del padrón de personas beneficiarias de acuerdo a los requisitos de ingreso establecidos en los numerales 9.2.1., 9.2.1.1. y 9.2.2.\n• Requisitos para ingreso al apoyo económico (Pensión).\na) Copia de identificación oficial (INE, INAPAM, Pasaporte).\nb) Copia de Clave Única de Registro de Población (CURP).\nc) Acta de nacimiento, en original y copia (para cotejo).\nd) Copia del comprobante de domicilio (de fecha reciente).\ne) Dos fotografías reciente tamaño infantil.\nf) Tener de 63 a 64 años con 11 meses de edad.\ng) Ser residente en el estado de Guerrero.\ni) No estar inscrito en los programas de Pensión para el Bienestar de las Personas Adultas países.\nj) No contar con ningún esquema institucional de seguridad social.\nk) Solicitud en formato libre, dirigida a la persona titular del IGATIPAM.\nl) Requisitar el cuestionario que será aplicado por personal del Instituto o del Ayuntamiento\nMunicipal.\nm) Nombrar a una persona como su representante, por si sucediera un caso en que la beneficiaria o el beneficiario tenga una enfermedad grave que lo imposibilite acudir a recibir el apoyo, dicha persona\n(con carta poder) pueda asistir en su nombre con copia de su credencial de elector y un número telefónico.\nSe podrán realizar visitas domiciliarias para verificar la situación de la beneficiaria o beneficiario, el estado de salud y las condiciones de vida en que se encuentre.\nLa Persona Adulta Mayor aprobada, será incorporada de acuerdo a la disponibilidad presupuestal y en función de las bajas en el padrón de personas beneficiarias que se presenten.\nEl IGATIPAM, a fin de no duplicar los apoyos del Programa a una misma beneficiaria o beneficiario, hará cruce de padrones en forma bimestral con las diferentes instituciones que otorguen apoyos económicos similares.\n• Requisitos para reactivación.\nPara la reactivación al Programa presentará los requisitos siguientes:\na) Solicitud en formato libre, dirigida a la persona titular del IGATIPAM, explicando el motivo por el cual dejó de pertenecer al Programa.\nb) La solicitud será analizada y autorizada por las instancias facultadas del IGATIPAM, una vez autorizada la reactivación se le notificará vía telefónica para realizar los trámites correspondientes.\nc) Copia de identificación oficial (INE, INAPAM, Pasaporte) y todos los documentos que se señalan en el apartado 9.2.1., de las presentes Reglas de Operación.\n• Requisitos para Envejecimiento Digno.\na) Tener 60 o más años de edad.\nb) Copia de identificación oficial (INE, INAPAM, Pasaporte).\nc) Solicitud en formato libre, dirigida a la titular del IGATIPAM, solicitando el tipo de apoyo.\nd) Dos fotografías tamaño infantil reciente (1 para el componente recreación y economía, para el componente educación, 1 fotografía de cuerpo completo para el componente salud).\ne) Copia del comprobante de domicilio de fecha reciente.\nf) Copia de la Clave Única de Registro de Población (CURP).\ng) Acta de nacimiento, en original y copia (para cotejo).\nh) Ser residente en el estado de Guerrero.\ni) Certificado o constancia médica emitida por institución de salud pública o privada que de constancia del estado de salud, enfermedad o requerimiento de aparatos funcionales.\nj) Acreditar la propiedad del inmueble.\nk) Nombrar a una persona como su representante, para que en caso de que la beneficiaria o beneficiario tenga una enfermedad grave que lo imposibilite acudir a recibir el apoyo, esta persona con carta poder y certificado médico pueda asistir en su nombre con copia de su credencial de elector y un número telefónico.\n• Requisitos de acuerdo a cada componente:\n* Capacitación y Talleres: 1, 2, 4, 7.\n* Deporte y Recreación: 1 y 2.\n* Salud y Nutrición: 1 al 10 y para taller de elaboración de alimentos, yoga y zumba requisitos 1 y 2.\n* Economía: 1 al 8 y para *talleres 1 y 2, gafete de descuentos 1, 2 y 4.\n* Apoyo a la vivienda: 1 al 8 y del 10 al 11.\n* Excepto conferencias, eventos, brigadas médicas, asesorías y trámites.\nEl Comité Técnico de Validación del Programa, verificará y aprobará la integración del Padrón\n9.2.1, 9.2.1.1. y 9.2.2. y a la disponibilidad presupuestal con la que cuente el Programa.\nIGATIPAM, ubicadas en Calle Madero No. 22, Col. Centro, Chilpancingo, Gro. C.P. 39000, con un horario de atención de 9:00 a 15:00 horas en días hábiles en Chilpancingo, Guerrero.\nCubiertos los requisitos y criterios señalados en los numerales 9.2.1. y 9.2.2., se entregará a la beneficiaria o beneficiario una tarjeta bancaria como comprobante de solicitud de acceso al Programa.\n10. Evaluación.\nEl IGATIPAM, como instancia ejecutora del Programa, podrá solicitar la evaluación de carácter interno y/o externo con base en los objetivos estratégicos, metas, indicadores de desempeño relacionados con la eficiencia, eficacia, economía, la calidad de la administración pública y el impacto social del gasto, para garantizar que los mecanismos de funcionamiento y administración del Programa son acordes a la normatividad vigente, y que existe una correcta aplicación de los recursos, o en su defecto ajustar o reorientar su ejecución para el mejoramiento de la operatividad del Programa conforme a los lineamientos que emita la SEPLADER.\nLas evaluaciones internas y/o externas que se realicen al Programa serán coordinadas por la\nSCyTG.\n10.1. Indicadores (Construcción de la Matriz de Indicadores para Resultados. -Anexo 1).\nEn congruencia con la metodología de presupuesto basado en resultados (PBR) empleada a nivel nacional, y adoptada por el gobierno del estado de Guerrero y para el seguimiento y evaluación del\nPrograma se utilizará el indicador de la Matriz de Indicadores de Resultados (MIR) para el ejercicio fiscal\n2023, misma que se publica en la página de internet: https://www.guerrero.gob.mx/dependencia/sectorparaestatal/instituto-guerrerense-para-la-atencion-integral-de-las-personas-adultas-mayores-igatipam/, que son los siguientes:\nIndicador componente 1 apoyo (Pensión).\na) Porcentaje de apoyos entregados a manera de pensión a la población adulta mayor de 63 a\n64 años en el estado de Guerrero.\nFicha Técnica\nIndicadores del Desempeño\nPlan Estatal de Desarrollo 2022-2027\nRAMO: 26 Recurso estatal. FECHA: 18 Enero 2023.\nFONDO: Inversión Estatal Directa.\nNOMBRE DEL PROGRAMA: Pensión Guerrero.\nEJE TEMATICO: 1 Bienestar, Desarrollo Humano y Justicia Socia.\nOBJETIVO: 1.3 Disminuir las desigualdades a través de la atención a grupos vulnerables.\nESTRATEGIA: 1.3.2 Atención prioritaria a grupos vulnerables.\nLÍNEA DE ACCIÓN: 1.3.2.5 Mejorar el nivel de bienestar y envejecimiento digno de los Adultos Mayores de 63 a 64 años 11 meses a través de apoyos y acciones orientadas a satisfacer sus necesidades básicas.\nDatos de identificación del indicador\nClave Nombre Fuente\nDepartamento de Asignación y Control de\n1.3.2.5. Apoyos Económicos del IGATIPAM, Lic.\n63 a 64 años en el Estado de Guerrero.\nGabriel Olguín Trejo. content/uploads/2023/02/Hiper-PensionGuerrero-2023-Lic.-Olguin.pdf\nDefinición Nivel en la MIR Dimensión\nMide el porcentaje de apoyos entregados a los adultos mayores de 63 a 64\nComponente 1 Eficiencia años con 11 meses de edad en el Estado de Guerrero en 2023.\nMétodo de cálculo Unidad de Medida.\n(Apoyos entregados a manera de pensión / Total de apoyos programados a manera de pensión) *\nPorcentaje\n100\nFrecuencia de medición Desagregación geográfica Serie de información disponible\nTrimestral Estatal N/D\nLínea base\nSentido del indicador\nAño Periodo Valor\nAscendente 0 0 0%\nParámetros de semaforización Metas\nVerde Amarillo | Rojo Año Periodo Valor\n100% 80% | 60% 2023 Enero-Diciembre 100%\nVariables que conforman el indicador\nNombre Unidad de medida Fuente de información\nDepartamento de Asignación y Control de\nApoyos Económicos del IGATIPAM, Lic.\nGabriel Olguín Trejo.\nApoyos entregados a manera de pensión. Apoyo https://transparencia.guerrero.gob.mx/wpcontent/uploads/2023/02/Hiper-Pension-\nGuerrero-2023-Lic.-Olguin.pdf\nDepartamento de Asignación y Control de\nApoyos Económicos del IGATIPAM, Lic.\nGabriel Olguín Trejo.\nTotal de apoyos programados a manera de pensión Apoyo https://transparencia.guerrero.gob.mx/wpcontent/uploads/2023/02/Hiper-Pension-\nGuerrero-2023-Lic.-Olguin.pdf\nObservaciones\nCon este indicador se pretende cumplir con las metas establecidas para entrar dentro del parámetro de semaforización cuando menos en color amarillo.\nResponsable del indicador\nNombre del Servidor Público Dependencia Área\nInstituto Guerrerense para la\nLic. Gabriel Olguín Trejo. Atención Integral de las Personas Dirección de Asistencia Social.\nAdultas Mayores\nNombre del puesto, encargo o comisión Teléfono Correo electrónico\nEncargado del Departamento de Asignación y Control de Apoyos\nEconómicos del IGATIPAM.\nElaboró Revisó Autorizó\nLic. Julián Díaz Hernández. Lic. Cutberto Quiñones Flores. Dra. Hilda Ruth Lorenzo Hernández.\nDirectora General del IGATIPAM.\nIGATIPAM. IGATIPAM.\n10.2. Seguimiento.\nPara la mejora permanente del Programa, así como para la integración de informes, el\nDepartamento de Coordinación y Seguimiento de Programas del IGATIPAM, llevará a cabo el monitoreo de los recursos asignados al Programa, conjuntamente con la SEPLADER, dichas instancias participarán normatividad aplicable.\n10.3. Auditoría.\nEl IGATIPAM, será responsable de la supervisión directa de las acciones, así como de verificar que en su ejecución se cumpla con la normatividad aplicable en tiempo y forma.\nLos recursos asignados para la operación del Programa no pierden su carácter estatal, por lo que la SEFINA, la SCyTG, el órgano de fiscalización de las entidades paraestatales y la Auditoría Superior del estado de Guerrero, en el ámbito de sus respectivas competencias, realizarán actividades de fiscalización y auditoría.\nEl IGATIPAM, dará todas las facilidades a las instancias fiscalizadoras para realizar en el momento que juzguen pertinente, las auditorías necesarias; asimismo, efectuará el seguimiento y la solventación de las observaciones por irregularidades planteadas por los órganos de control en tiempo y forma.\nLa inobservancia de esta disposición, independientemente de las sanciones a que haya lugar, limitará la ministración de los recursos estatales en el siguiente ejercicio presupuestal.\n11. Mecanismo de Entrega del Apoyo.\nLas personas beneficiarias, cuyos datos fueron verificados, validados y revisados por el personal asignado por la dependencia u organismo, que cumplan con los criterios y requisitos de elegibilidad, establecidos en las presentes Reglas de Operación, recibirán el apoyo económico, especie o servicio proporcionado por el Programa. El Instituto, como organismo ejecutor, será el encargado de solicitar bimestralmente, el apoyo de acuerdo al numeral 9.2.1., mediante dispersión electrónica o en efectivo cuando así se considere pertinente a las beneficiarias y los beneficiarios de (Pensión) y numeral 9.2.2.\nEnvejecimiento Digno, a través de dispersión electrónica, efectivo, o especie y también se podrán gestionar la celebración de convenios con instituciones privadas, sociales y gubernamentales.\nEn caso de fallecimiento de la beneficiaria o beneficiario, la persona que lo represente podrá recibir un apoyo a través del pago de marcha posterior al último bimestre de vida de la persona beneficiaria, para contribuir a los gastos funerarios, presentando, original y copia (para cotejo) del Certificado de Defunción expedido por la autoridad municipal y/o acta levantada por el personal médico que certificó la defunción, con original y copia (para cotejo) de la credencial de identificación oficial de la persona beneficiaria y de la persona que recibe el apoyo. los cruces de información, para el pago de marcha se considerará como pagado en el bimestre de su fallecimiento y/o cuando es detectado en el cruce.\nPara la operación y ejecución del Programa, la Dirección de Asistencia Social en coordinación con la Dirección de Finanzas y Administración del IGATIPAM, cuantificarán las necesidades de los recursos beneficiarias o los beneficiarios, que incluye la contratación de servicios bancarios, programación de la distribución en especie o electrónica de recursos por municipio, de acuerdo con al numeral 9.2., que se establezca para cada uno de los rubros del Programa.\nLa cuantificación que de estas actividades resulten, se notificará a la SEFINA, quien suministrará y/o dispersará el recurso para abastecer los requerimientos al IGATIPAM y éste será responsable de su ejercicio y comprobación respectiva.\nEl IGATIPAM se coordinará con los ayuntamientos para la ejecución del Programa en su municipio.\nConsiderando las condiciones de cada municipio, para la entrega de apoyos económicos del\nPrograma, se podrán utilizar las modalidades siguientes:\n* Tarjeta Electrónica a través de instituciones bancarias: a los municipios que cuenten con la misma.\n* Efectivo: a aquellos municipios que por su lejanía no cuentan con instituciones bancarias.\n* Especie: a aquellos municipios que en donde previamente se haya cubierto los requisitos establecidos en las presentes Reglas de Operación.\nLa Dirección de Asistencia Social del IGATIPAM, coordinará mediante la designación de responsables, la instalación de módulos regionales y/o municipales, o personal autorizado por el\nIGATIPAM, quienes llevarán el control de ingreso al módulo y recepcionarán la documentación para la identificación de sus respectivas tarjetas, sobres y/o recibos; verificarán la personalidad de la beneficiaria o beneficiario mediante cotejo de documentos de identidad; y realizará la entrega de apoyos de manera directa a la beneficiaria o beneficiario o a su representante en los casos previstos en las presente Reglas de Operación.\nPago de marcha.\nEn caso de fallecimiento de la beneficiaria o beneficiario, la persona que lo represente podrá recibir un apoyo a través del pago de marcha posterior al último bimestre de vida de la persona beneficiaria, para contribuir a los gastos funerarios, presentando, original y copia (para cotejo) del Certificado de Defunción expedido por la autoridad municipal y/o acta levantada por el personal médico que certificó la defunción, con original y copia (para cotejo) de la credencial de identificación oficial de la persona beneficiaria y de la persona que recibe el apoyo. los cruces de información, para el pago de marcha se considerará como pagado en el bimestre de su fallecimiento y/o cuando es detectado en el cruce.\nSupervivencia. en cualquiera de las oficinas del Instituto, o en los lugares que éste señale para tal fin, dicha verificación de supervivencia podrá realizarse una vez al año, en caso de imposibilidad para cumplir con esta obligación y si las condiciones lo permiten, se podrá verificar la supervivencia en el domicilio de la beneficiaria o beneficiario, solo si éste se localiza dentro del estado de Guerrero.\nLa entrega de apoyos a las beneficiarias o los beneficiarios a través de terceras personas mediante carta poder, será validada sólo en el caso de que la persona beneficiaria se encuentre enferma, situación que se comprobará con la carta poder debidamente integrada con los requisitos establecidos en el inciso\n12 del numeral 9.2.1, en su caso la entrega del apoyo se podrá realizar de manera domiciliaria.\nSe considera que la carta poder se encuentra debidamente requisitada, cuando además de los nombres de quienes la suscriben, esté debidamente firmada o con huella digital de la beneficiaria o beneficiario otorgando a una tercera persona el derecho para recibir su apoyo en su nombre y deberá estar certificada por una autoridad municipal.\n12. Derechos y Obligaciones de las Personas Beneficiadas.\na) Derechos de las Personas Beneficiadas.\n* Recibir la información necesaria del Programa de manera clara y oportuna.\n* Trato digno, respetuoso, oportuno, con calidad, equidad y sin discriminación alguna.\n* Atención y entrega de apoyos sin costo alguno.\n* La reserva y privacidad de su información personal.\n* Recibir su apoyo a través de terceras personas (Representante) cumpliendo con los requisitos establecidos.\n* En caso de fallecimiento de la beneficiaria o beneficiario, el representante recibirá el apoyo a través del Pago de Marcha.\n* Para la entrega del apoyo económico, la persona que lo represente deberá presentar, original y copia (para cotejo) del Certificado de Defunción expedido por la autoridad municipal y/o acta levantada por el personal médico que certificó la defunción, con original y copia (para cotejo) de la credencial de identificación oficial de la persona beneficiaria y de la persona que recibe el apoyo.\n* Solicitar y acceder a la información que guarda su trámite y sobre cualquier otra que considere necesaria para transparentar y operar de mejor manera el Programa.\n* Presentar quejas o inconformidades ante el Comité de Contraloría Social, en las oficinas del\nIGATIPAM, referente a faltas o irregularidades que cometan las servidoras o los servidores públicos que familiares y autoridades municipales en la utilización del mismo.\nLa persona que representante a la beneficiaria o beneficiario señalado en el numeral 5 de este inciso, tendrá las obligaciones siguientes:\n* Informar la defunción y proporcionar la documentación que acredite la defunción de la beneficiaria o beneficiario para actualizar la base de datos.\n* Informar al IGATIPAM los cambios de domicilio cuando la beneficiaria o el beneficiario se encuentre imposibilitado para hacerlo.\n* Facilitar el acceso al personal del IGATIPAM para verificar las condiciones de vida de las y los beneficiarios.\nb) Obligaciones de las Personas Beneficiadas.\n* Proporcionar bajo protesta de decir verdad, la información que se les requiera de acuerdo a lo establecido en las presentes reglas de operación.\n* Actualizar su expediente cuando el IGATIPAM lo solicite.\n* Nombrar a un representante para que, en caso de fallecimiento, imposibilidad física o enfermedad, pueda recibir el apoyo que corresponda.\n* Acudir a los lugares en la fecha y hora señalada a recibir su apoyo.\n* Informar al IGATIPAM los cambios de domicilio.\n* Acudir a las reuniones que previamente convoque el IGATIPAM.\n* Acudir a su verificación de supervivencia a las oficinas del IGATIPAM o en las cabeceras municipales que les correspondan cuando así se haya programado.\nc) Sanciones a las Personas Beneficiadas. cumplan con las obligaciones del inciso b) del numeral 12., y cuando incurran en los incisos del numeral\n12.1.\n12.1. Causales de Suspensión o Baja de las Personas Beneficiadas.\na) En caso de que el IGATIPAM, o algún órgano de fiscalización detecte alguna irregularidad, como el caso de homonimia, duplicidad del beneficio, entre otros.\nb) Por no presentarse a recibir su apoyo en dos bimestres consecutivos.\nc) Por no acudir a su verificación de supervivencia.\nd) Por proporcionar información personal falsa.\ne) Por no actualizar su expediente cuando el IGATIPAM lo solicitó.\nf) Cuando la persona beneficiaria o a través de su representante soliciten la baja voluntaria del\nPrograma.\ng) Por cambio de residencia fuera del estado de Guerrero.\nh) Por cumplir 65 años de edad.\ni) Por detectarse alteraciones en su información presentada.\nj) Por encontrarse inscritos en los programas de Pensión para el Bienestar de las Personas\nAdultas Mayores y para el Bienestar de las Personas con Discapacidad del Gobierno Federal, ni en ningún padrón de los programas similares del gobierno estatal y municipal, no estar pensionado por el gobierno de otros países.\nSe podrán realizar visitas domiciliarias para revisar la veracidad de la información proporcionada en el cuestionario, a fin de que exista congruencia con las condiciones y requisitos establecidos ya sea para permanencia, nuevo ingreso o reactivación al Programa.\n12.2. Proceso de Baja.\nCon la finalidad de que los recursos etiquetados para el Programa sean ejercidos en su totalidad el IGATIPAM, realizará cruces de padrones con las instituciones que brinden seguridad social, con la para detectar beneficiarias o beneficiarios que ya tengan una pensión o jubilación, que estén beneficiados por algún programa similar o personas beneficiarias que hayan fallecido, también con base en la información recopilada en la entrega de tarjetas, supervivencia, avisos de fallecimientos por los familiares ingresos y así, cumplir con las metas propuestas al inicio del ejercicio fiscal 2023.\n13. Instancias Participantes.\nLas instancias participantes serán, SEFINA, la SCyTG, el Consejo Directivo, el Comité Técnico de\nValidación del Programa; y el Instituto, quién será el responsable de la operación del Programa de\nNúmero 424 del Presupuesto de Egresos del Estado de Guerrero para el Ejercicio Fiscal 2023, Anexo 23del 2022, el cual contempla un monto autorizado de $28'000,000.00 (Veintiocho millones de pesos 00/100 m.n.). Con las atribuciones siguientes:\na) Coordinar y conducir la operación del Programa de acuerdo a los lineamientos establecidos en las presentes Reglas de Operación.\nb) Administrar a través de la Dirección General del Instituto, los recursos financieros autorizados.\nc) Diseñar los instrumentos técnicos necesarios para evaluar el impacto social del Programa.\nd) La organización del personal técnico y operativo que resulte indispensable para garantizar el funcionamiento del Programa.\ne) Contratar personas instructoras para realizar los talleres, cursos y conferencias.\n13.1. Instancia Normativa.\nLas instancias normativas serán, la SEPLADER, la SEFINA, la SCyTG, el Consejo Directivo y el\nComité Técnico de Validación del Programa.\n14. Transparencia.\n14.1. Promoción y Difusión del Programa Social.\nCon base a lo establecido en la Ley Número 207 de Transparencia y Acceso a la Información\nPública del estado de Guerrero, el IGATIPAM, además de su publicación en el Periódico Oficial del\nGobierno del estado de Guerrero publicará las Reglas de Operación del Programa periódicamente en la página electrónica: https://www.guerrero.gob.mx/dependencia/sector-paraestatal/instituto-guerrerensepara-la-atencion-integral-de-las-personas-adultas-mayores-igatipam/, la información relativa al Programa, Operación, el padrón de personas beneficiarias, los datos personales que se recaben serán protegidos conforme a la normatividad aplicable e incorporados y tratados en el Sistema de Datos Personales, pero se podrán utilizar para dar seguimiento puntual del número de personas beneficiadas y recursos otorgados, además de ser tratados como datos estadísticos, cuya finalidad será contar con un padrón de personas permita rediseñar las políticas públicas encaminadas a este sector vulnerable.\n14.2. Contraloría Social. por el Programa y con apego en lo dispuesto en la Ley Núm. 102, para el Desarrollo Social del Estado de se establece que la sociedad podrá participar activamente en la planeación, implementación, administración, programación, desarrollo y evaluación de los programas y acciones de desarrollo social; por ello, el Instituto por medio del Comité Técnico de Validación del Programa y de acuerdo al artículo 56 de la Ley Número 375 de los Derechos de las Personas Adultas Mayores del Estado de Guerrero, incluye a las ciudadanas y ciudadanos representantes del sector social de las Personas Adultas Mayores para que conjuntamente contribuyan a lograr resultados de impacto en la ciudadanía adulta mayor, dicho Comité verificará y aprobará la integración del padrón de beneficiarias y beneficiarios de acuerdo a los requisitos de ingreso establecidos en las presentes Reglas de Operación en los numerales 9.2.1, 9.2.1.1., y 9.2.2., y a la disponibilidad presupuestal con la que cuente el Programa, realizando las acciones siguientes:\nLa SCyTG, se encargan de promover la contraloría social en los programas de desarrollo social.\nLos objetivos específicos de este órgano de contraloría social son:\na) Dar seguimiento, supervisión, vigilancia y evaluación del cumplimiento de criterios de elegibilidad y derechos de las personas beneficiarias.\nb) Vigilar el desempeño, honestidad y calidad de las servidoras y servidores públicos.\nc) Hacer más transparentes las decisiones y la ejecución de los recursos.\nd) Inhibir los actos de corrupción y de cooptación social, política y electoral.\ne) Incrementar la eficiencia de los recursos públicos.\nf) Participar en las reuniones calendarizadas del Comité Técnico de Validación del Programa.\ng) Mejorar la rendición de cuentas.\nDebe estar constituido mínimamente por una presidencia, una secretaría y una vocalía electos de entre la población beneficiada.\nDicho Comité deberá revisar en conjunto con la población, los avances y resultados del Programa, así como la detección de cualquier irregularidad. inconformidades recibidas al IGATIPAM, quien dará respuesta en un plazo no mayor de 15 días a partir de la fecha de recepción de la queja o inconformidad. asesoría a las servidoras o servidores públicos que intervienen en la operación del Programa, así como a las personas integrantes de los comités locales, para que éstos realicen adecuadamente sus actividades de seguimiento y vigilancia.\nSe deberá integrar un Programa de Trabajo de acuerdo al Programa, que debe incluir la descripción de las actividades, responsables de éstas, metas y calendarización de las actividades para su cumplimiento.\n14.3. Protección de Datos Personales.\nLos datos personales recabados serán utilizados para validar que se cumplan con los requisitos de elegibilidad para ser beneficiaria o beneficiario de este Programa, asimismo serán integrados en los sistemas de datos personales del Instituto y podrán ser transmitidos a otros entes públicos de los tres niveles de gobierno en el ejercicio de las facultades propias, compatibles o análogas, para la realización de compulsas y la integración del padrón de personas beneficiarias. Por lo tanto, se garantiza la protección de datos personales cuyos datos se recogen, se mantienen y se procesan mismos que se regirán por Aviso de Privacidad fundado en los artículos 16,17, 35, 36, 37, 38, 39, 40, 64 y 92 de la Ley Número 466 de\nProtección de Datos Personales en Posesión de Sujetos Obligados del Estado de Guerrero y en la Ley\nNúmero 207 de Transparencia y Acceso a la Información Pública del Estado de Guerrero.\nPara el ejercicio de los derechos de acceso, rectificación, cancelación y oposición de los datos personales recabados, deberán realizarse por escrito y por comparecencia del interesado, mismo que deberá presentarse en las oficinas del IGATIPAM ubicado en Calle Madero No. 22, Colonia Centro, Chilpancingo, Gro. C.P. 39000, o bien vía correo electrónico: igatipam2027@gmail.com o llamar a los teléfonos: 747 47 1 42 33; 747 47 2 58 69; de igual forma lo podrán realizar a través de la dirección electrónica http://www.plataformadetransparencia.org.mx/ y el Aviso de Privacidad se puede consultar en la página:https://www.guerrero.gob.mx/dependencia/sector-paraestatal/instituto-guerrerense-parala-atencion-integral-de-las-personas-adultas-mayores-igatipam/\n14.4. Quejas y Denuncias. irregularidad de cualquier hecho, actos de corrupción u omisión, desvío de recursos que produzca o pueda contravengan sus disposiciones y demás normatividad aplicable en la operación del Programa.\nLos medios por los cuáles podrán presentarse quejas y denuncias ciudadanas son:\na) Por escrito.\nb) Por comparecencia de la persona interesada.\nc) Por correo electrónico.\nd) Vía telefónica.\nEn las oficinas del IGATIPAM ubicado en Calle Madero No. 22, Colonia Centro, Chilpancingo, Gro.\nC.P. 39000, o bien vía correo electrónico: igatipam2027@gmail.com o llamar a los teléfonos: 747 47 1 42 la queja, acompañando los documentos o evidencias que comprueben los actos incurridos acompañado de la información siguiente:\na) Nombre de la servidora o servidor (es) público (s).\nb) Secretaría o dependencia de adscripción.\nc) Objeto de la denuncia.\nd) Nombre y domicilio de la persona quejosa.\ne) Copia de Identificación oficial.\nf) Correo electrónico.\ng) Domicilio para oír y recibir notificaciones.\nh) Número telefónico.\n14.5. Acciones de Blindaje.\nEl Instituto, para la operación y ejecución de los recursos estatales que opera el Programa deberá observar y atender las medidas que emitan la SCyTG, el Instituto de Transparencia, Acceso a la\nInformación y Protección de Datos Personales del Estado de Guerrero (ITAIGro), el IEPC y las demás autoridades competentes, con la finalidad de prevenir que el uso y manejo de los recursos públicos y programas sociales se vean relacionados con fines partidistas y/o político-electorales; todo ello con la firme intención de garantizar los principios de imparcialidad y equidad durante los comicios; por lo que la papelería y documentación oficial del Programa deberá incluir la siguiente leyenda:\n“Este Programa es público y ajeno a cualquier partido político. Queda prohibido el uso para fines distintos a los establecidos en el Programa”.\n14.6. Acta de Donación. (Anexo 2)\nEl Instituto, presentará debidamente requisitada el acta de entrega - recepción de apoyos que formará parte de la transparencia de la ejecución de los recursos del Programa.\n15. Perspectiva de Género.\nDe conformidad con la Ley Número 494 Para la Igualdad entre Mujeres y Hombres del Estado de\nGuerrero, para regular y garantizar la igualdad entre mujeres y hombres se incorpora la perspectiva de los beneficios de este Programa en igualdad de condiciones; privilegiando, en su caso, la inclusión de medidas especiales, para solucionar las condiciones inmediatas en la vida de las mujeres, y medidas estratégicas que tiendan a la valorización de la posición que tienen en la comunidad, modificando los patrones culturales y eliminando los estereotipos que ocasionan discriminación y violencia, así como medidas que aceleren el logro de la igualdad sustantiva para el ejercicio pleno de todos los derechos de las mujeres y su participación igualitaria, atendiendo a los preceptos establecidos en la Convención sobre la eliminación de todas las formas de discriminación contra la mujer.\n16. Enfoque de Derechos.\nEl Programa atiende y cumple con los derechos universales y con base en los principios de universalidad, interdependencia, indivisibilidad y progresividad, brindando en todo momento un trato digno y de respeto, se reconocen a todos los seres humanos sin exclusión alguna, es una obligación del estado velar por su respeto, garantizar la igualdad y la no discriminación, todo ser humano nace libre y en igualdad en cuanto a dignidad y a derecho se refiere, las personas servidoras públicas involucradas en la operación del Programa deben en todo momento promover, respetar, proteger y garantizar el ejercicio efectivo de los derechos humanos de las personas beneficiarias.\nEn la aplicación del Programa, se harán valer los derechos de las personas beneficiarias, tomando en consideración los factores de desigualdad que pudieran poner en riesgo de vulnerabilidad a personas que pertenecen a grupos históricamente discriminados, como lo son las y los adultos mayores, afrodescendientes, y aquellas que son comunidades integrantes de un pueblo indígena, que formen una unidad social, económica y cultural, asentadas en el territorio guerrerense y que reconocen autoridades propias de acuerdo a sus usos y costumbres, entre otros, tomando en consideración sus circunstancias y necesidades, a fin de contribuir a generar conocimiento y acciones que potencien su desarrollo e inclusión plena.\n17. Acciones Contra el SARS-COV 2.\nCOVID-19, el IGATIPAM, aplica las medidas sanitarias en la entrega de apoyos, priorizando las medidas sanitarias tanto del personal operativo como de las y los beneficiarios, en cuanto a trámites, dispersiones y demás servicios del Programa como talleres, cursos, atención psicológica, conferencias, video-consultas estas se realicen de manera electrónica y/o virtual según corresponda.\n18. Anexos que reflejen la entrega del apoyo (Económico. Especie o Servicios).\nAnexo 1.- Matriz de Indicadores para resultados 2023.\nAnexo 2.- Acta de Donación.\nAnexo 1.- MIR\nMATRIZ DE INDICADORES PARA RESULTADOS\nEjercicio presupuestal:\nEje: 1 Bienestar, Desarrollo Humano y Justicia Social.\nObjetivo: 1.3 Disminuir las desigualdades a través de la atención a grupos vulnerables.\nEstrategia: 1.3.2 Atención prioritaria a grupos vulnerables.\nLínea de acción 1.3.2.5 Mejorar el nivel de bienestar y envejecimiento digno de los Adultos Mayores de 63 a 64 años 11 meses a través de apoyos y acciones orientadas a satisfacer sus necesidades básicas.\nEnte público responsable: Instituto Guerrerense para la Atención Integral de las Personas Adultas Mayores (IGATIPAM).\nPrograma presupuestario: Pensión Guerrero\nResumen Narrativo Nombre del Indicador Método de Cálculo Fuentes de verificación Supuestos\nContribuir a reducir las\n(Adultos mayores de 60 carencias en seguridad El INEGI proporciona\nPorcentaje de adultos mayores a 64 años en el Estado Tabulados del censo de social de los adultos información estadística\nGuerrero mediante mayores en el Estado de\nGuerrero. Estado de Guerrero) ramas/ccpv /2020/#Tabulados beneficios del Programa Guerrero.\n*100\nPensión Guerrero.\nMejorar el nivel de\n(Adultos mayores de 63 Portal del Instituto bienestar y a 64 años que cumple Guerrerense para la Atención envejecimiento digno de con los requisitos de Integral de las Personas o los adultos mayores a Porcentaje de la población través de apoyos adulta mayor de 63 a 64 años acceso al Programa Adultas Mayores. Los adultos mayores de ó Pensión Guerrero / https://transparencia.guerrero.63 a 64 años mejoran su p económicos y acciones que podrá ser beneficiada con o Total de adultos gob.mx/wp- nivel de bienestar. sus necesidades básicas años en el Estado) * s-Censo- 2020-Pensionque eleven su calidad de\n100 Guerrero-2023-para-MIR.pdf vida.\nDepartamento de Asignación\nPorcentaje de apoyos (Apoyos entregados a y Control de Apoyos tn entregados a manera de manera de pensión / Económicos del IGATIPAM, Los adultos mayores e n1 Programa Pensión pensión a la población adulta Total de apoyos Lic. Gabriel Olguín Trejo. acuden a recibir su o Guerrero p mayor en el Estado de programados a manera https://transparencia.guerrero.apoyo económico.\nGuerrero. de pensión) * 100 gob.mx/wpcontent/uploads/20\nC 23/02/Hiper-Pension|\nRegistro de información de la\nUnidad Jurídica y Género del\nAsesoría jurídica (Personas adultas\nIGATIPAM. Las personas adultas consistente en materia Porcentaje de acompañamiento mayores asesoradas / https://transparencia.guerrero.mayores acuden a\n1.1 familiar, penal, jurídico a personas adultas Total de solicitudes gob.mx/wpcontent/uploads/20solicitar asesoría s rectificación de actas de mayores. recibidas que solicitan e 23/02/Hiper-Pension- jurídica. d nacimiento y matrimonio. asesoramiento) * 100 a Guerrero-2023-Lic.-Beatriziv 1.pdf\nDirección de Asistencia Social\nA Conferencias en\n(Conferencias del IGATIPAM, Lic. Julián Los adultos mayores cuidados de la salud y\nPorcentaje de conferencias realizadas / Total de Díaz López. asisten a las\n1.2 derechos de las personas adultas programadas) * 100 gob.mx/wp- convocadas. mayores. content/uploads/2023/02/Hipe r-Pension- Guerrero-2023Lic.-Julian.pdf\nDirección de Asistencia Social del IGATIPAM, Lic. Julián\n(Clases de\nClases de alfabetización Díaz López.\nPorcentaje de clases de alfabetización Los adultos mayores para el aprendizaje de https://transparencia.guerrero.\n1.3 alfabetización impartidas a los impartidas / Total de asisten a recibir sus lectura, escritura y gob.mx/wpadultos mayores. clases programadas) * clases de alfabetización conclusión de primaria. content/uploads/2023/02/Hipe\n100 r-Pension- Guerrero-2023Lic.-Julian.pdf\nDirección de Asistencia Social del IGATIPAM, Lic. Julián\nClases de yoga para la activación física por Porcentaje de clases de yoga (Clases de yoga Díaz López. Los adultos mayores impartidas / Total de https://transparencia.guerrero.\n1.4 medio de la corriente impartidas a los adultos asisten a recibir sus clases programadas) * gob.mx/wpIndú, posturas mayores. clases de yoga.\n100 content/uploads/2023/02/Hipe ancestrales del darma. r-Pension- Guerrero-2023Lic.-Julian.pdf\nDirección de Asistencia Social del IGATIPAM, Lic. Julián\n(Clases de Díaz López.\nClases de computación, Porcentaje de clases de Los adultos mayores computación impartidas https://transparencia.guerrero.\n1.5 nivel básico, intermedio y computación impartidas a los asisten a recibir sus\n/ Total de clases gob.mx/wpavanzado. adultos mayores. clases de computación. programadas) * 100 content/uploads/2023/02/Hipe r-Pension- Guerrero-2023Lic.-Julian.pdf\nDirección de Asistencia Social del IGATIPAM, Lic. Julián\nTalleres de elaboración Díaz López.\nPorcentaje de talleres (Talleres impartidos / Los adultos mayores\n1.6 impartidos a los adultos Total de talleres asisten a los talleres flores en 3D y bordado gob.mx/wp mayores. programados) * 100 impartidos. tenango. content/uploads/2023/02/Hipe r-Pension- Guerrero-2023Lic.-Julian.pdf\nAnexo 2.- Acta de Donación.\nPrimero. El presente Acuerdo entrará en vigor al día siguiente de su publicación en el Periódico\nSegundo. Se abroga el Acuerdo por el que se emiten las Reglas de Operación del Programa de Guerrero Edición No. 31 Alcance I, de fecha 19 de abril de 2022.\nTercero. A partir de la entrada en vigor del presente Acuerdo, las Reglas de Operación del\nPrograma, subsecuentes o sus modificaciones, serán emitidas por la persona titular del Instituto\nGuerrerense para la Atención Integral de las Personas Adultas Mayores del Estado de Guerrero, responsable directa de la operación y ejecución de las mismas.\nDado en el “Recinto de las oficinas del Poder Ejecutivo del estado”, el inmueble ubicado en el\nEdificio Centro, Boulevard René Juárez Cisneros No. 62 de la Ciudad de los Servicios en Chilpancingo de los Bravo, capital del estado de Guerrero, a los veintiocho días del mes de febrero del año dos mil veintitrés.\nGOBERNADORA CONSTITUCIONAL DEL ESTADO DE GUERRERO.\nMTRA. EVELYN CECIA SALGADO PINEDA.\nRúbrica.\nSECRETARIO GENERAL DE GOBIERNO.\nMTRO. LUDWIG MARCIAL REYNOSO NÚÑEZ.\nRúbrica.\nPERSONAS ADULTAS MAYORES.\nDRA. HILDA RUTH LORENZO HERNANDEZ.\nRúbrica.",
  "ordenamiento": "PROGRAMA",
  "jurisdiccion": "GUERRERO",
  "fuente_oficial": "DIARIO OFICIAL DE LA FEDERACION",
  "Fecha de Publicación": "23 DE \nABRIL DE 2024",
  "ULTIMA REFORMA PUBLICADA": null,
  "status": "VIGENTE",
  "es_escaneado": false,
  "tiene_tablas": true,
  "materia": [
    "general"
  ]
}