{
  "titulo": "Acuerdo por el Que Se Crea el Programa de Apoyo A la Producción Industrial y Comercialización del Ca",
  "Contenido": "REGLAS DE OPERACIÓN PARA EL EJERCICIO FISCAL\nTEXTO ORIGINAL\nAcuerdo Interior publicado en el Periódico Oficial No. 09 Alcance II, el viernes 31 de enero de\n2020.\nACUERDO POR EL QUE SE CREA EL PROGRAMA DE APOYO A LA PRODUCCION INDUSTRIAL Y\nCOMERCIALIZACIÓN DEL CAFÉ Y SE EMITEN SUS REGLAS DE OPERACIÓN PARA EL EJERCICIO\nFISCAL 2020.\nGuerrero. - Poder Ejecutivo\nLICENCIADO HÉCTOR ANTONIO ASTUDILLO FLORES, GOBERNADOR CONSTITUCIONAL\nDEL ESTADO DE GUERRERO, CON FUNDAMENTO EN LO DISPUESTO POR LOS ARTÍCULOS 71,\n87, 88, 90 NUMERAL 2 Y 91 FRACCIONES I, VI, IX Y XLVI DE LA CONSTITUCIÓN POLÍ TICA DEL\nCONFIEREN LOS ARTÍCULOS 2, 3, 6, 7, 10, 18 APARTADO A FRACCIÓN I Y 20 FRACCIÓN III DE LA\nLEY ORGÁNICA DE LA ADMINISTRACIÓN PÚBLICA DEL ESTADO DE GUERRERO NÚMERO 08; 1,\n2 FRACCIÓN I, 18 Y 25 DE LA LEY NÚMERO 454 DE PRESUPUESTO Y DISCIPLINA FISCAL DEL\nESTADO DE GUERRERO; 18 FRACCIÓN I Y 106 DE LA LEY NÚMERO 814 DE DESARROLLO RURAL\nSUSTENTABLE DEL ESTADO DE GUERRERO; EN RELACIÓN CON EL ARTÍCULO 55 DEL DECRETO\nNÚMERO 447 DEL PRESUPUESTO DE EGRESOS DEL ESTADO DE GUERRERO PARA EL\nEJERCICIO FISCAL 2020; DECRETO NÚM. 47, QUE CREA EL CONSEJO ESTATAL DEL CAFÉ Y LOS\nLINEAMIENTOS PARA LA ELABORACIÓN DE LAS REGLAS DE OPERACIÓN DE LOS PROGRAMAS\nSOCIALES ESTATALES PARA EL EJERCICIO FISCAL 2017.\nQue el Plan Estatal de Desarrollo 2016-2021, tiene como eje III promover un Guerrero Socialmente\nComprometido y con el objetivo 3.1. Construir un Estado garante de los derechos sociales de las personas y como estrategia 3.1.2. Fortalecer el desarrollo de capacidades de los integrantes de una sociedad con carencias, que permitan contribuir a incrementar su capacidad productiva y su calidad de vida, mediante la línea de acción que especifica mejorar las instituciones de desarrollo social y establecer la participación de la sociedad en la vigilancia de la aplicación de los recursos.\nLas secretarias, dependencias, entidades y demás organismos gubernamentales, deberán necesarias para detonar el desarrollo de la entidad y sus regiones, considerando principios básicos de responsabilidad, ética y pluralidad, para lograr la realización de metas estatales en la aspiración de un\nGuerrero próspero y de trabajo. cadenas productivas, desarrollo de clústeres agroalimentarios, inversión en infraestructura, reconversión\nREGLAS DE OPERACIÓN PARA EL EJERCICIO FISCAL productiva, agro insumos, manejo pos cosecha y comercialización, uso eficiente de la energía y uso sustentable de los recursos naturales.\nLa cafeticultura en México representa una actividad fundamental en el sector agrícola, no sólo por el valor de su producción, sino además por ser un importante generador de divisas, por las bondades que ofrece y por ser un cultivo de gran relevancia para la preservación del medio ambiente.\nPor lo que es necesario desarrollar la actividad agroindustrial para mejorar la productividad al impulsar el desarrollo de los sectores agrícola, pesquero y acuícola, fortalecer el desarrollo empresarial de proyectos agroindustriales, propiciar el desarrollo gradual económico, social, productivo y sustentable, aprovechar las potencialidades y las vocaciones productivas agropecuarias del Estado, generar mayor productividad y competitividad que se refleje en mayores ingresos y en la mejora de la economía de las familias.\nEl Estado de Guerrero realiza una Inversión Estatal Directa, donde la agricultura representa un sector importante en la economía y cuenta con la producción de café de altura, de buena calidad, con aroma y sabor de buen perfil, lo que ha permitido posicionar al café guerrerense a nivel nacional e internacional.\nEl Consejo Estatal del Café, será la instancia responsable de definir los métodos y procedimientos para normar y regular la ejecución del Programa de Apoyo a la Producción Industrial y Comercialización del Café y tendrá la responsabilidad de verificar que la formulación de los expedientes técnicos de los proyectos a realizar, reúnan los requisitos solicitados.\nEn cumplimiento a lo anterior he tenido a bien expedir el siguiente:\nACUERDO POR EL QUE SE CREA EL PROGRAMA DE APOYO A LA PRODUCCIÓN INDUSTRIAL Y\nCOMERCIALIZACIÓN DEL CAFÉ Y SE EMITEN SUS REGLAS DE OPERACIÓN PARA EL EJERCICIO\nFISCAL 2020.\nArtículo 1. Se crea el Programa de Apoyo a la Producción Industrial y Comercialización del Café, con inversión estatal directa, el cual tiene por objeto implementar un programa de fortalecimiento de empresas dedicadas a la producción de cafés de especialidad, la industrialización y la comercialización a detalle del café del Estado de Guerrero, generando en un corto y mediano plazo el incremento del valor de la producción y el mejoramiento de la economía de las empresas y de las familias cafetaleras.\nArtículo 2. Se emiten las Reglas de Operación del Programa de Apoyo a la Producción Industrial y\nComercialización del Café, en las que se establecen los principios de eficiencia, eficacia, oportunidad, ha dicho Programa.\nLas Reglas de Operación del Programa de Apoyo a la Producción Industrial y Comercialización del café, establece los criterios y requisitos que se deben de cumplir para poder acceder al mencionado Programa.\nREGLAS DE OPERACIÓN PARA EL EJERCICIO FISCAL\nGuerrero, tendrá a cargo la implementación, operación, ejecución, evaluación y administración del\nPrograma de Apoyo a la Producción Industrial y Comercialización del Café, bajo los criterios de objetividad, equidad, transparencia, publicidad, selectividad y temporalidad, con estricto apego a la normatividad aplicable; por lo tanto, será la encargada de la dispersión y asignación de los recursos del Programa apegándose plenamente a las Reglas de Operación.\nREGLAS DE OPERACIÓN DEL PROGRAMA DE APOYO A LA PRODUCCIÓN INDUSTRIAL Y\nCOMERCIALIZACIÓN DEL CAFÉ PARA EL EJERCICIO FISCAL 2020.\n1.Introducción\n1.1. Antecedentes\nLa producción estatal de café sustenta la economía de ciento treinta y cinco localidades en quince municipios, en cuatro regiones del Estado, según datos de la Secretaría de Desarrollo Social, nueve de éstos municipios están catalogados como de alta y muy alta marginación, sumando más de trescientas mil las personas que en ellos viven en extrema pobreza. Destacan por su mayor pobreza y grado de marginación en el Estado, y en el país, los municipios de Metlatónoc, San Luis Acatlán y Malinaltepec.\nLa superficie con café es de 40,122 hectáreas registradas y georeferenciadas de acuerdo con el\nServicio de Información Agroalimentaria y Pesquera (SIAP, 2010), las cuales se encuentran distribuidas desde los 400 a los 2,800 metros sobre el nivel del mar; sin embargo, por diversos factores y principalmente debido a la crisis de precios en el que ha caído el aromático, buena parte de la superficie ha dejado de ser cultivada por los productores, volviéndose tierras que han servido para la conservación ambiental, ya que el ecosistema al no ser interrumpido se ha fortalecido, albergando especies de flora y fauna. El rendimiento promedio por hectárea hasta el 2011, fue apenas de 3.34 quintales por hectárea, el más bajo en comparación con otros Estados de la República (información obtenida por el Sistema Informático de la\nCafeticultura Nacional y la estimada como comercialización local).\nPor otro lado, a partir del ciclo de cosecha 2015-2016, la enfermedad comúnmente llamada roya del cafeto causó afectaciones en las plantaciones por más del 75 por ciento de la producción, además de del productor. Como estrategia para combatir la roya del cafeto, surge en el 2015 la campaña contra la enfermedad implementada por el Comité Estatal de Sanidad Vegetal de Guerrero (CESAVEGRO), además enfermedad, tales como Oro Azteca, Colombia, Sarchimor y Costa Rica 95, entre las más comunes. Sin embargo, en las zonas con mayor altura no se ha dejado de cultivar las variedades acriolladas, las cuales coinciden con la mejor calidad en taza de las variedades existentes en el mundo.\nA través de la Secretaría de Agricultura y Desarrollo Rural (SADER), se otorgan incentivos al sector cafetalero, a través del Programa Producción para el Bienestar, y los conceptos de apoyo son: adquisición\nREGLAS DE OPERACIÓN PARA EL EJERCICIO FISCAL de plantas de café y paquetes tecnológicos para la nutrición del cultivo del café, además de asistencia técnica y pagos para certificación de las plantaciones.\nSin embargo, es necesario fortalecer la producción actual, conservando la calidad que el entorno climático y regional genera en el grano, generando en ella un mayor grado de industrialización que permita obtener un mayor valor en el mercado, propiciando de esta manera un mayor ingreso para las familias cafetaleras.\n1.2. Alineación programática\nEl Plan Estatal de Desarrollo 2016-2021, Eje II. Programático Guerrero Próspero, Objetivo 2.2.\nImpulsar la productividad del sector agropecuario y pesquero para garantizar la seguridad alimentaria, estrategia 2.2.1. Fortalecer los sectores agropecuario y pesquero y crear condiciones para aumentar la competitividad y la autosuficiencia para garantizar la seguridad alimentaria en la entidad y en la línea de acción implementar políticas públicas diferenciadas, según las características de la región, de la producción y las áreas de oportunidad para potencializar el desarrollo económico.\n1.3. Diagnóstico\nEl café en el Estado de Guerrero es un cultivo estratégico, debido al número de empleos y al ingreso que genera en la población de las zonas de alta y muy alta marginación donde se produce, tomando en consideración la edad de las plantas de café, así como, a las afectaciones que causa la enfermedad denominada roya del café, lo que hace necesario realizar labores culturales encaminadas a recuperar la producción de las plantaciones de café.\nPara mejor entendimiento del Programa de Apoyo a la Producción Industrial y Comercialización del Café, se desarrolla lo siguiente:\na) Naturaleza del programa social\nLa cafeticultura en Guerrero aglutina a 21,000 familias que viven de ella en la entidad y que cultivan alredor de 40, 000 hectáreas, de los 15 municipios 13 están catalogados con alta y muy alta marginalidad, el problema central de esta actividad es la baja rentabilidad, debido principalmente por dos problemas: los bajos rendimientos por hectárea (1.2 quintales por hectárea) los más bajos del país (8.00 promedio nacional) y los bajos precios en el mercado por unidad producida (quintal), los cuales oscilan en $1,840.00 en la entidad, con este programa se busca acopiar un volumen de alrededor de 2,000 quintales de café productores para transformarlo en cafés de alta especialidad y café tostado y molido, los cuales tienen un sobreprecio en el mercado, además se busca la capitalización de las empresas a través de otorgarles apoyo en la adquisición de maquinaria, equipo y llevar a cabo a través del Consejo Estatal del Café, la promoción y difusión de sus marcas de café.\nb) El origen y fundamento\nREGLAS DE OPERACIÓN PARA EL EJERCICIO FISCAL\nDe acuerdo con la medición de la pobreza realizada por el CONEVAL en el 2010, alrededor del\n35% de la población de los municipios cafetaleros del Estado de Guerrero, vive con un ingreso inferior a la línea de bienestar mínimo, por lo tanto las instituciones encargadas en aplicar políticas públicas para los productores de café se han enfocado a elevar la producción en los predios cafetaleros a través de la renovación de las plantaciones y a elevar el valor de la producción, mediante tres estrategias:\n• Producir cafés de especialidad, aplicación de buenas prácticas de cosecha y beneficiado, logrando precios en el mercado superiores de hasta 3 veces más que los precios del café convencional.\n• Incrementar el valor agregado de la producción, para logar un incremento en el valor de la producción de 207%; es decir, por cada peso invertido se obtienen 1.07 pesos de ganancia.\n• Promover las marcas de café en el Estado de Guerrero, para generar una mayor comercialización.\nc) Objetivos y metas\nFomentar la producción de cafés de especialidad, apoyando a los productores a través de sus empresas sociales y beneficiar a 60 familias de las cuales 200 beneficiarias directas son indígenas de los\nMunicipios de San Luis Acatlán, Iliatenco y Malinaltepec.\nd) Ubicación geográfica de los proyectos a desarrollar\nEl Programa se implementará con organizaciones/empresas sociales de los municipios de Atoyac de Álvarez, Coyuca de Benítez, Zihuatanejo de Azueta, San Luis Acatlán e Iliatenco; sin embargo, el impacto en los productores será además en los municipios de Malinaltepec, Acatepec y Tlacoapa.\ne) Actividades a realizar\n• Publicación de la convocatoria del Programa.\n• Recepción de las solicitudes.\n• Análisis de las solicitudes y documentación presentada.\n• Aprobación y notificación a beneficiarias y beneficiarios.\n• Entrega de recursos.\n• Comprobación de recursos y firma de anexos.\nf) Instancias participantes\nREGLAS DE OPERACIÓN PARA EL EJERCICIO FISCAL\nConsejo Estatal del Café O. P. D. a través de la Coordinación General y el Consejo Directivo que es el órgano de Gobierno del organismo, el cual está integrado por: Un Presidente, que será el Gobernador del\nEstado, siendo su suplente el Secretario Agricultura, Ganadería, Pesca y Desarrollo rural, quien funge también como Secretario del Consejo Directivo, el Secretario de Fomento y Desarrollo Económico y el\nSecretario de Contraloría y Transparencia Gubernamental, que tendrán el cargo de vocales y 10 vocales del sector social con cargo de vocales.\ng) Presupuesto de inversión\nCabe destacar que a partir de 2013, las plantaciones de café del Estado han sido devastadas por la enfermedad roya del café, la cual afecta directamente el follaje, causando defoliación de la planta, efecto que ocasiona la alteración del metabolismo de ésta, ocasionándole hasta la muerte si no se realizan acciones contundentes de control.\nLa cosecha a partir del 2014 y el ciclo 2015-2016 bajaron a niveles históricos en el Estado, afectaciones por la roya del cafeto, la producción se ha incrementado, por lo que resulta apremiante\nREGLAS DE OPERACIÓN PARA EL EJERCICIO FISCAL en el mercado, dicho problema se identificó a través de la metodología del Marco Lógico, por lo que se define:\nMisión\nFortalecer las empresas sociales del Estado de Guerrero integradas por socios productores de café dedicadas a la producción de cafés de especialidad, industrialización y comercialización del café en tostado, molido y en taza.\nVisión\nLograr en el corto plazo el incremento en el valor de la producción a través de nuevos procesos post-cosecha, aprovechar los nuevos nichos de mercado, la industrialización y la comercialización a detalle del café de las empresas beneficiadas.\n2. Dependencia o entidad responsable del programa\nEl Consejo Estatal del Café, Organismo Público Descentralizado del Gobierno del Estado de\nGuerrero es el responsable de la operación y ejecución del Programa, el cual tiene como sustento legal, en los ordenamientos jurídicos siguientes:\na) Constitución Política de los Estados Unidos Mexicanos.\nc) Ley de Desarrollo Rural Sustentable.\nd) Ley Número 814 de Desarrollo Rural Sustentable del Estado de Guerrero.\ne) Ley Orgánica de la Administración Pública del Estado de Guerrero Número 08.\nf) Plan Estatal de Desarrollo 2016-2021.\ng) Programa Sectorial de Desarrollo Rural y Pesca.\nj) Ley Número 454 de Presupuesto y Disciplina Fiscal del Estado de Guerrero.\nk) Decreto Número 447 del Presupuesto de Egresos del Estado de Guerrero para el Ejercicio\nFiscal 2020.\nREGLAS DE OPERACIÓN PARA EL EJERCICIO FISCAL\nl) Y todos aquellos ordenamientos aplicables.\n3. Objetivos y alcances\n3.1. Objetivo general\nImplementar un programa de fortalecimiento de empresas dedicadas a la producción de cafés de especialidad, la industrialización y la comercialización a detalle del café del Estado de Guerrero, generando en un corto y mediano plazo el incremento del valor de la producción y el mejoramiento de la economía de las empresas y de las familias cafetaleras.\n3.2. Objetivos específicos\n• Fomentar la producción de cafés de especialidad, apoyando a los productores a través de sus empresas sociales.\n• Promover a través del personal técnico del Consejo Estatal del Café, el procesamiento y obtención de microlotes de cafés de especialidad.\n• Promover la adquisición del café de especialidad y para la agroindustria directamente de las empresas a sus socios.\n• Fomentar la producción industrial del café con empresas dedicadas a la actividad en el Estado, otorgando apoyos para el mejoramiento de maquinaria y equipo.\n• Generar apoyos económicos para el equipamiento tecnológico y la transformación del café.\n• Apoyo económico para el equipamiento de barras de café y fomentar la comercialización del café en taza.\n• Fortalecer a las empresas dedicadas a la producción industrial en la comercialización de su café del CECAFE.\n3.3. Alcances\nEl programa a través de subsidios busca garantizar un ingreso digno a los cafetaleros del Estado, ya que de acuerdo con el CONEVAL en promedio el 67% de la población de los municipios cafetaleros de alimentación, por lo que el Programa busca generar mayor valor de la producción al comercializarse a través de tres estrategias:\nREGLAS DE OPERACIÓN PARA EL EJERCICIO FISCAL\na) Acopio y comercialización de 400 quintales de café de especialidad (11,270 kg), a un precio con un valor de 3 veces más que el que ofrece el mercado local (de $40.00 el kg a $120.00). Además se apoyará a los productores a través de sus organizaciones/empresas con equipo que les permita eficiente los procesos.\nb) Acopio y transformación 4,755 quintales café (218,730 kg), los cuales se transformarán en\n174,984 kg de café tostado y molido, el objetivo es lograr precios mínimos de $140.00 el kg en el mercado, logrando así un incremento en el valor de la producción de 207%.\nc) Promoción y difusión de las marcas de café del estado con el objeto de incrementar los volúmenes de comercialización actual.\nLas empresas a beneficiarse deberán estar conformadas por productoras y productores de café y que además se dedican a la transformación, industrialización y comercialización de café tostado, molido, envasado y en taza, a través de expendios y barras, buscando además generar empleo e incrementar sus ingresos a través de la industrialización y comercialización del café. Por lo que nuestra población objetivo son 60 familias de municipios de Atoyac de Álvarez, Zihuatanejo de Azueta y Coyuca de Benítez en la\nCosta Grande y 200 familias de San Luis Acatlán en la Costa Chica e Iliatenco, Malinaltepec y Acatepec en la Región Montaña, las cuales son población indígena. Las beneficiarias y beneficiarios del Programa en ambas regiones estarán integrados por un 50% de mujeres y 50% hombres, además se integrará el\nPadrón Único de Beneficiarias y Beneficiarios en el que se considerará el sexo, edad, discapacidad, municipio y región.\n4. Metas físicas\na) Beneficiar a 60 familias de las cuales 200 beneficiarias directas son indígenas de los Municipios de San Luis Acatlán, Iliatenco y Malinaltepec.\nb) Otorgar el apoyo económico a 6 empresas dedicadas a la industrialización del café en la entidad, beneficiando a 200 familias.\nc) Otorgar apoyo económico para la adquisición de 560 quintales de café oro convencional y 400 de oro de especialidad, con el objeto de obtener mejores precios.\nd) Apoyar a 6 empresas sociales cafetaleras para la adquisición de equipos para la obtención de cafés de especialidad.\ne) Apoyar a 3 empresas con maquinaria y equipo dedicadas a la transformación de café tostado y molido y lograr la comercialización de 1,300 kg de café tostado y molido anualmente.\nf) Apoyar a 3 empresas con maquinaria y equipo para el expendio de café en taza, logrando la comercialización de 15,000 tazas de café al año.\nREGLAS DE OPERACIÓN PARA EL EJERCICIO FISCAL\n5. Programación presupuestal\n6. Requisitos y procedimientos de acceso\n6.1. Difusión\nAl ser este un programa de apoyo destinado exclusivamente a personas morales/empresas sociales cafetaleras, integradas por socios productores de café dedicadas a la producción de cafés especiales, industrialización y comercialización de café tostado, molido, empacado y en taza, en las regiones de la Costa Grande, Montaña y Costa Chica de la entidad y centralizándose en sólo 6 municipios\n(Atoyac de Álvarez, Coyuca de Benítez, Zihuatanejo de Azueta, San Luis Acatlán, Iliatenco y Malinaltepec); debido a las características propias del programa y al monto del programa autorizado.\nEl Consejo Estatal de Café, Organismo Público Descentralizado, emitirá la convocatoria del\nGuerrero, en donde se establecerán los requisitos, dirección de las oficinas de atención (Costa Grande y\nCosta Chica y Montaña), números telefónicos y correo electrónico que permita brindar la información necesaria y clara del Programa.\nREGLAS DE OPERACIÓN PARA EL EJERCICIO FISCAL\nAdemás, se difundirá en reuniones que lleve e cabo el titular del CECAFE O.P.D., en las cuales se respaldará a través de materiales de apoyo como presentaciones y material de difusión escrito, además se realizará la requerida difusión en el portal oficial de dicho organismo público descentralizado.\n6.2. Requisitos de acceso\nSe atenderán sólo personas morales o empresas cafetaleras que cuenten con:\na) Acta Constitutiva debidamente protocolizada ante notario público actualizada.\nb) Poder Notariado del representante legal (si es que éstos no se definen en el acta constitutiva).\nc) Constancia de Situación Fiscal.\nd) Comprobante de domicilio fiscal actualizado (teléfono, agua, luz) con antigüedad no mayor a 2 meses).\ne) Formato de Opinión de Cumplimiento de Obligaciones Fiscales (Positiva).\nf) Identificación Oficial del representante legal (IFE/INE, Pasaporte).\ng) CURP del representante legal.\nh) Solicitud de Apoyo Formato A1.\ni) Al menos 2 cotizaciones de los materiales o equipos a adquirir.\nj) 3 Imágenes con coordenadas del local donde se localiza la planta industrializadora o expendio de café.\nk) Estado de cuenta donde se pueda observar el número de cuenta y clabe interbancaria.\nl) Para el caso de promoción y difusión se llevará a cabo a través de la Unidad de Promoción y comercialización del café, podrán solicitar en formato libre la promoción y difusión de su producto a través del organismo, quién podrá adquirir a cada empresa hasta 10 kg de café tostado, molido y empacado a cada una de ellas, otorgando un precio base de hasta $140.00 el kilogramo.\n6.3. Procedimientos de acceso cafetaleras durante las reuniones, asambleas y eventos a las que ha acudido el titular del organismo, con el objeto de perfeccionar sus procesos y mejorar sus ingresos. Los subsidios serán otorgados a las\nREGLAS DE OPERACIÓN PARA EL EJERCICIO FISCAL cafetaleras y cafetaleros a través de las personas morales, las cuales deberán estar debidamente actualizadas y deberán cumplir con los requisitos señalados en el punto anterior.\nEl Programa de Apoyo a la Producción Industrial y Comercialización del Café, será operado por el Consejo\nEstatal del Café, Organismo Público Descentralizado del Gobierno del Estado de Guerrero y obedece a la demanda de la ciudadanía y empresas cafetaleras, a través de la Coordinación General, la cual valorará la demanda con mayor prioridad de acuerdo a los criterios siguientes:\na) Empresas con experiencia en la actividad y con comprobantes de ventas (contratos, facturas, locales establecidos de ventas, etc.).\nb) Número de personas a beneficiarse con los subsidios.\nc) Impacto que tendrán los apoyos otorgados en el incremento de ingresos, utilidad y empleos generados.\nLas solicitudes serán dirigidas al titular del organismo (CECAFE) y las que cumplan con los requisitos en su totalidad serán enviadas a la dirección administrativa del CECAFE, con los datos de las personas solicitantes para que se proceda al pago correspondiente del apoyo solicitado, a través de la solicitud de liberación del pago (Formato A2).\nPosteriormente el Coordinador General procederá a la entrega del apoyo a cada una de quien solicite sean personas morales y/o empresas, los cuales al momento de recibirlo deberán firmar y entregar los documentos comprobatorios siguientes:\na) Factura electrónica de los insumos o equipos adquiridos.\nb) Formato de Opinión de Cumplimiento de Obligaciones Fiscales (Positiva) de la persona beneficiaria.\nc) 3 fotografías donde se puedan apreciar los conceptos adquiridos, así como, las personas beneficiarias de la empresa.\nd) Acta de entrega recepción firmada por quien represente legalmente la empresa.\nInformación Pública del Estado de Guerrero.\n6.4. Requisitos de permanencia, causales de baja o suspensión temporal\nDe acuerdo a los objetivos del Programa, no se consideran causales de permanencia, baja o suspensión temporal.\nREGLAS DE OPERACIÓN PARA EL EJERCICIO FISCAL\n6.5. Modos de entrega del beneficio\nEl Consejo Estatal del Café, entregará de manera directa los conceptos de apoyo financiados con el\nPrograma. Una vez firmada el Acta Entrega-Recepción (Formato referido en el apartado de anexos).\n7. Procedimientos de instrumentación\n7.1 Operación\na) Presentar una solicitud con la documentación y requisitos del Programa (la cual se refiere el punto\n6.2 de éstas reglas).\nb) Revisión de la solicitud y documentación y requisitos del Programa.\nc) Se emite oficio de dictaminación positiva o negativa.\nd) Ministración de los recursos por parte de la Dirección Administrativa del CECAFE, a través de transferencias bancarias a las beneficiarias y beneficiarios.\ne) Adquisición de conceptos de apoyo.\nf) Cierre finiquito del Programa entre el CECAFE y las empresas beneficiarias.\n7.2. Gastos de operación\nEl CECAFE, podrá destinar como gastos de operación hasta el 3% del presupuesto asignado para el\nPrograma $75,000.00 (Setenta y cinco mil pesos 00/100 M.N.). Los cuales se podrán utilizar para la adquisición de equipo de cómputo, equipos e insumos de impresión, equipos para la difusión del Programa, así como los gastos que generen las comisiones de personal del CECAFE, referentes al Programa.\n8. Transparencia\n8.1. Difusión del Café y de representantes de las empresas beneficiarias del Programa.\nEn dichas reuniones la difusión se respaldará a través de la convocatoria, materiales de apoyo como presentaciones y material de difusión escrito.\n8.2. Blindaje electoral\nREGLAS DE OPERACIÓN PARA EL EJERCICIO FISCAL\nLas autoridades involucradas en la aplicación y operación del Programa, asegurarán que en toda la papelería lleve impresa al pie de página de los documentos oficiales, la leyenda siguiente:\n\"Este Programa es público ajeno a cualquier partido político. Queda prohibido el uso para fines distintos a los establecidos por el programa\".\n8.3. Supervisión y control\nEl Consejo Estatal del Café, enviará de forma trimestral la información correspondiente al avance físico-financiero a la Secretaría de Planeación y Desarrollo Regional y a la Secretaría de Contraloría y\nTransparencia Gubernamental, informes sobre el presupuesto ejercido y serán las encargadas de supervisar a quienes está dirigido el programa. La Dirección Administrativa y la Subdirección de Asistencia\nTécnica y Capacitación, serán las encargadas de llevar a cabo los informes requeridos.\nPara dar cumplimiento a los indicadores se llevarán a cabo encuestas a las personas beneficiarias para conocer los avances logrados; asimismo, se entregará a la Secretaría de Planeación y Desarrollo\nRegional, el calendario de entrega de los apoyos a las beneficiarias y beneficiarios en donde se incluya:\nLugar, fecha y hora de los eventos, además de la lista de las personas beneficiarias, las cuales se deberá incluir en la conformación de un Padrón Único de Beneficiarias y Beneficiarios coordinado por la Secretaría de Planeación y Desarrollo Regional del Estado, para con ellos evitar duplicidad en el otorgamiento de apoyos.\n8.4. Mecanismos de evaluación de indicadores\n8.4.1. Evaluación\nLa evaluación del Programa, busca efectuar una valoración objetiva del desempeño de la o las dependencias participantes, en relación a indicadores de desempeño relacionados con la eficiencia, eficacia, economía, la calidad de la administración pública y el impacto social del gasto.\nPor lo anterior, la Secretaría de Planeación y Desarrollo Regional, así como, el Consejo Estatal del Café, en el ámbito de sus competencias y responsabilidades, realizará de manera periódica la evaluación de resultados de este Programa, en función de los objetivos y metas aprobadas, por lo que los avances de de los indicadores.\n8.4.2. Indicadores\nREGLAS DE OPERACIÓN PARA EL EJERCICIO FISCAL\nREGLAS DE OPERACIÓN PARA EL EJERCICIO FISCAL\nLas áreas que se indican en la Matriz de Indicadores del Programa, realizarán los informes diseñados.\n8.5. Auditoría\nCon la finalidad de llevar un control real sobre los avances del Programa, así como de corregir posibles retrasos o desvíos en la operación, la Secretaría de Contraloría y Transparencia Gubernamental en el ámbito de sus atribuciones llevará a cabo las acciones que considere necesarias.\nDe igual modo, las servidoras o servidores públicos involucrados en la aplicación, operación, seguimiento y evaluación del Programa, tendrán la responsabilidad de desarrollar sus actividades con estricto apego a las leyes competentes y a estas Reglas de Operación. Caso contrario, podrán ser acreedores a las sanciones administrativas correspondientes a que alude la Ley Número 465 de\nResponsabilidades Administrativas para el Estado de Guerrero y demás leyes aplicables.\n8.6. Recursos no devengados\nLos recursos que por algún motivo no estuviesen devengados al 31 de diciembre del 2020, serán reintegrados inmediatamente a la Secretaría de Finanzas y Administración que es la instancia normativa del ejercicio y control del gasto público.\n8.7. Contraloría social\nComprenden el conjunto de acciones de control, vigilancia y evaluación que realizan las personas, ya sea de manera organizada o independiente, bajo un esquema de derechos y compromisos de la ciudadanía, con el propósito de contribuir a que la gestión gubernamental se realice en término de transparencia, eficacia y honradez. Estarán a cargo de los miembros de las comunidades, incluidos los integrantes del comité o instancia asociativa de personas beneficiarias de los programas sociales. Se deberá promover la contraloría social con base en la normatividad establecida para tal efecto, fomentando gestión gubernamental se realice en términos de transparencia, eficacia y honradez. Las acciones que fomenta el Comité de Contraloría Social son:\na) Informar a la ciudadanía acerca de los apoyos otorgados y su costo a nivel de obra, acción, nombre de las personas beneficiarias, así como, sus derechos y obligaciones.\nb) Capacitar a las personas beneficiarias para que se constituyan en instancias de vigilancia y evaluación social.\nc) Establecer espacios de comunicación como son, reuniones vecinales y atención directa a las personas beneficiarias.\nREGLAS DE OPERACIÓN PARA EL EJERCICIO FISCAL\nd) Promover la integración de organizaciones de la sociedad civil en acciones de contraloría social.\ne) Instrumentar mecanismos de recepción y atención de quejas y denuncias. El órgano estatal de control verificará, en lo correspondiente, la realización de dichas acciones.\n8.8. Formas de participación social\nEl Consejo Directivo del Consejo Estatal del Café es la autoridad suprema de organismo y estará presente en las actividades y dará fe de la entrega de recursos que se lleven a cabo, así como vigilará en las acciones de desarrollo del Programa, y estará conformado por:\na) Un Presidente, que será el Gobernador Constitucional del Estado, siendo su suplente el\nSecretario de Agricultura, Ganadería, Pesca y Desarrollo rural, quien funge también como Secretario del\nConsejo;\nb) El Secretario de Fomento y Desarrollo Económico;\nc) El Secretario de Contraloría y Transparencia Gubernamental;\nd) 10 representantes del sector social, todos con el carácter de vocal, a excepción del Presidente, los cuales son las personas siguientes:\n1) C. Abel Enrique Gómez Ozuna, Representante de la Unión Estatal de Productores de Café;\n2) Profr. Armando Rodríguez Navarrete, representante de la Coalición de Ejidos de la Costa\nGrande;\n3) C. José Reyes Estrada, Presidente de la Unión de Ejidos Alfredo V. Bonfil;\n4) Profr. Casimiro Soto Cantú, Presidente de la Unión de Ejidos Nueva Luz de la Montaña de\nGuerrero;\n5) C. Basilio Moisés Santos, Presidente de Productores Rurales de la Montaña de Guerrero, A.R. de I.C. de R.L. de C.V.;\n6) C. Ubaldo Sanchez Cruz, Presidente del Comisariado Ejidal del Ejido El Paraíso;\n7) C. P. Fidel Téllez Santiago, Representante de los Torrefactores;\n8) C. Félix Aguilar Moya, Presidente de la Sociedad Cooperativa de Producción Agropecuaria La\nPintada;\n9) C. Bruno Velediaz Rayon, Presidente del Comisariado Ejidal de San Vicente de Benítez; y\nREGLAS DE OPERACIÓN PARA EL EJERCICIO FISCAL\n10) Dr. Marco Antonio Galeana Luna, Director Ejecutivo de Cafeco, S. A. De C. V.\n8.8.1. Indicar como participan en la planeación, programación, implementación y evaluación del programa\nLa Coordinación General del Consejo Estatal del Café, solicitará al presidente una sesión del\nConsejo Directivo, donde expondrá a los miembros del órgano de gobierno, el programa para darlo a conocer y fomentar la participación de las empresas y productores. Así mismo, se someterá a consenso la conformación de un comité integrado por los miembros del sector social, para que de forma coordinada con la Coordinación General se lleve a cabo la planeación, programación, implementación y evaluación de los impactos del Programa.\n8.9. Procedimiento de queja o inconformidad ciudadana\nLas quejas y denuncias de la ciudadanía en general por la presunción de actos de corrupción o desvío de recursos por parte de servidoras o servidores públicos, se captarán por la Secretaría de\nContraloría y Transparencia Gubernamental ubicada en Palacio de Gobierno, Boulevard René Juárez\nCisneros No. 62, Edificio Norte Primer Piso, Col. Ciudad de los Servicios, C.P. 39074, Chilpancingo de los\nBravo, Guerrero y la Coordinación General ubicada en Calle Juan N. Alvarez, sur No. 62-A, Colonia Centro, Atoyac de Álvarez, Estado de Guerrero. C. P. 40930, número telefónico 7424233404 y correo electrónico cecafe@guerrero.gob.mx, con un horario de atención de 8:30 AM a 16:00 PM. Los medios por los cuales podrán presentarse quejas y denuncias ciudadanas son las siguientes:\na) Por escrito;\nb) Por comparecencia de la persona interesada;\nc) Por correo electrónico; y\nd) Por Vía telefónica.\nLa persona denunciante o quejosa deberá proporcionar:\na) Nombre de la servidora o servidor público;\nb) Dependencia de adscripción;\nc) Objeto de la denuncia;\nd) Nombre y domicilio de la persona quejosa; e\ne) Identificación oficial de la persona quejosa.\nREGLAS DE OPERACIÓN PARA EL EJERCICIO FISCAL\n8.10. Mecanismos de exigibilidad\nLa Coordinación General del Consejo Estatal del Café, será el operador de los recursos del\nPrograma, quien dará seguimiento a los requisitos, derechos, obligaciones y procedimientos para que las empresas consideradas en el Programa, puedan acceder al apoyo del presente Programa; por lo que está obligado a notificar a las personas que hayan solicitado apoyo del Programa y no se les haya dado un dictamen positivo, en tal notificación se darán detalles de la no autorización.\n8.11. Acta de Entrega-Recepción\nSe firmarán entre el Coordinador General del Consejo Estatal del Café y el representante legal de la empresa beneficiaria, cuando estos reciban el apoyo solicitado, Formato A3.\nPara los eventos de entrega de apoyos a las personas representantes de las empresas beneficiarlas, se realizará una invitación a la Secretaría de Planeación y Desarrollo Regional con al menos\n3 días anticipados del evento.\n9. Criterios de selección y elegibilidad\n9.1. Método de selección de personas beneficiarias\nSe apoyará a empresas cafetaleras, que presenten la solicitud de apoyo correspondiente, adjuntando a esta la documentación respectiva. La autorización del apoyo estará sujeta a la disponibilidad presupuestal del Programa.\nSe atenderán solo a empresas cafetaleras que cuenten con:\na) Acta Constitutiva debidamente protocolizada ante notario público actualizada.\nb) Poder Notariado del representante legal (si es que éstos no se definen en el acta constitutiva).\nc) Constancia de Situación Fiscal.\nd) Comprobante de domicilio fiscal actualizado (teléfono, agua, luz) con antigüedad no mayor a 2 meses).\ne) Formato de Opinión de Cumplimiento de Obligaciones Fiscales (Positiva).\nf) Identificación oficial del representante legal (IFE/INE, Pasaporte).\ng) CURP del representante legal (Formato nuevo).\nh) Solicitud de apoyo Formato A1.\nREGLAS DE OPERACIÓN PARA EL EJERCICIO FISCAL\ni) Al menos 2 cotizaciones de los materiales o equipos a adquirir.\nj) 3 Imágenes con coordenadas del local donde se localiza la planta industrializadora o expendio de café.\nk) Estado de cuenta donde se pueda observar el número de cuenta y clabe interbancaria.\nl) Para el caso de promoción y difusión se llevará a cabo a través de la Unidad de Promoción y\nDifusión del Consejo Estatal del Café y las diferentes empresas dedicadas a la industrialización y comercialización del café, podrán solicitar en formato libre la promoción y difusión de su producto a través del organismo, quién podrá adquirir a cada empresa hasta 10 kg de café tostado, molido y empacado a cada una de ellas, otorgando un precio base de hasta $140.00 el kilogramo.\nLas empresas que hayan sido beneficiarias podrán solicitar ingresar al Programa siempre y cuando sea para ampliar sus niveles de producción, industrialización, acopio y comercialización.\n10. Mecánica de operación\n10.1. Instancia ejecutora\nEl Consejo Estatal del Café, será la instancia ejecutora del Programa y tendrá la responsabilidad de verificar que la formulación de los expedientes técnicos de los proyectos a realizar reúnan los requisitos solicitados.\n10.2. Instancia administrativa y/o normativa\nEl Consejo Estatal del Café, será la instancia responsable de definir los métodos y procedimientos para normar y regular la ejecución del Programa.\n10.3. Delimitación de atribuciones necesarios para garantizar que sus acciones busquen potenciar el impacto del recurso, fortalecer la cobertura, promover la complementariedad y reducir gastos administrativos. Así mismo, instrumentarán una acción del Programa de Apoyo a la Producción Industrial y Comercialización del Café.\n11. Derechos, obligaciones y sanciones de las personas beneficiarias del programa\n11.1. Derechos\nREGLAS DE OPERACIÓN PARA EL EJERCICIO FISCAL comercialización de café tostado, molido y en taza, siendo responsabilidad del CECAFE el cumplimiento de estas disposiciones.\n11.2. Obligaciones\na) Cumplir con los requisitos establecidos para la obtención del apoyo.\nb) Aplicar a los fines autorizados el apoyo recibido.\nc) Aceptar y facilitar auditorías por parte de la Secretaría de Contraloría y Transparencia\nGubernamental o cualquier otra autoridad competente, con el fin de verificar la correcta aplicación del apoyo recibido, así como, la supervisión de parte de las instancias de la Secretaría y las que ésta determine.\nd) Solicitar autorización del Consejo Estatal del Café, de cualquier cambio que implique modificaciones al apoyo recibido.\nf) Presentar el acta de entrega recepción debidamente requisitada.\n11.3. Sanciones\nLa empresa que haga mal uso del apoyo recibido a través de este Programa, será excluido del presente y de programas similares.\n12. Interpretación\nLas autoridades competentes para interpretar y aplicar las Reglas de Operación del presente\nContraloría y Transparencia Gubernamental del Estado de Guerrero.\nPara la interpretación de las presentes Reglas de Operación, se entenderá por:\nCECAFE: El Consejo Estatal del Café.\nCONEVAL: El Consejo Nacional de Evaluación de la Política de Desarrollo Social.\nEmpresas Cafetaleras: Las asociaciones (SPR, sociedades cooperativas, uniones de ejido, SSS, ARIC, sociedad civil), dedicadas a la industrialización y comercialización de café.\nProductores: Aquellas personas dedicadas al cultivo de café.\nPrograma: El Programa de Apoyo a la Producción Industrial y Comercialización del Café.\nREGLAS DE OPERACIÓN PARA EL EJERCICIO FISCAL\nQuintal: La Unidad de medición de peso (Café cereza 245 kg, café capulín 92 kg, café pergamino 57.5 kg, café oro natural o lavado 46 kg y café tostado 38 kg).\nReglas de Operación: Reglas de Operación del Programa de Apoyo a la Producción Industrial y\nComercialización del Café.\nREGLAS DE OPERACIÓN PARA EL EJERCICIO FISCAL\nREGLAS DE OPERACIÓN PARA EL EJERCICIO FISCAL\nREGLAS DE OPERACIÓN PARA EL EJERCICIO FISCAL\nREGLAS DE OPERACIÓN PARA EL EJERCICIO FISCAL\nREGLAS DE OPERACIÓN PARA EL EJERCICIO FISCAL\nPrimero. El presente Acuerdo entrará en vigor al día siguiente de su publicación en el Periódico\nSegundo. A partir de la entrada en vigor del presente Acuerdo por el que se crea el Programa de Apoyo a la Producción Industrial y Comercialización del Café y se emiten sus Reglas de Operación, subsecuentes o sus modificaciones, serán emitidas por la persona titular del Consejo Estatal del Café, Organismo Público Descentralizado del Gobierno del Estado de Guerrero, responsable directo de la operación y ejecución de las mismas.\nDado en la Oficina del titular del Poder Ejecutivo, ubicada en el Edificio Centro de Palacio de\nGobierno, Boulevard René Juárez Cisneros No. 62, Colonia Ciudad de los Servicios en la Ciudad de\nChilpancingo de los Bravo, Capital del Estado de Guerrero, a los 31 días del mes de enero del año dos mil veinte.\nEL GOBERNADOR CONSTITUCIONAL DEL ESTADO DE GUERRERO.\nLIC. HÉCTOR ANTONIO ASTUDILLO FLORES.\nRúbrica.\nEL SECRETARIO GENERAL DE GOBIERNO.\nLIC. FLORENCIO SALAZAR ADAME.\nRúbrica.\nEL COORDINADOR GENERAL DEL CONSEJO ESTATAL DEL CAFÉ.\nC. ERASTO CANO OLIVERA.\nRúbrica.",
  "ordenamiento": "PROGRAMA",
  "jurisdiccion": "GUERRERO",
  "fuente_oficial": "DIARIO OFICIAL DE LA FEDERACION",
  "Fecha de Publicación": "31 de enero de \n2020",
  "ULTIMA REFORMA PUBLICADA": null,
  "status": "VIGENTE",
  "es_escaneado": false,
  "tiene_tablas": false,
  "materia": [
    "económico"
  ]
}