{
  "titulo": "Acuerdo por el Que Se Crea el Programa Adquisición y Donación de Aparatos Funcionales y Se Emiten la",
  "Contenido": "OPERACIÓN PARA, EL EJERCICIO FISCAL 2019\nTEXTO ORIGINAL\nAcuerdo publicado en el Periódico Oficial del Gobierno del Estado No. 54 Alcance I, el Viernes 05 de Julio de 2019.\nACUERDO POR EL QUE SE CREA EL PROGRAMA ADQUISICIÓN Y DONACIÓN DE APARATOS\nFUNCIONALES Y SE EMITEN LAS REGLAS DE OPERACIÓN PARA, EL EJERCICIO FISCAL 2019.\nLIC. JOSÉ FRANCISCO SOLÍS SOLÍS, DIRECTOR GENERAL DEL SISTEMA PARA EL DESARROLLO\nINTEGRAL DE LA FAMILIA DEL ESTADO DE GUERRERO, EL CUAL ES UN ORGANISMO PÚBLICO\nDESCENTRALIZADO, CON PERSONALIDAD JURÍDICA Y PATRIMONIO PROPIO CREADO MEDIANTE\nLEY 107 PUBLICADA EN EL PERIÓDICO OFICIAL NÚMERO 10 DEL GOBIERNO DEL ESTADO CON\nFECHA 9 DE MARZO DE 1977 Y REGULADO POR LA LEY 479 PUBLICADA EN EL PERIÓDICO OFICIAL\nNÚMERO 61 DEL 02 DE AGOSTO DE 1983, CON FUNDAMENTO EN LA LEY 690 DE ENTIDADES\nPARAESTATALES PARA EL ESTADO DE GUERRERO; EL ARTÍCULO 27 FRACCIÓN X DEL\nREGLAMENTO INTERIOR DEL ORGANISMO PÚBLICO DESCENTRALIZADO, ASÍ COMO LA LEY\nSOBRE EL SISTEMA ESTATAL DE ASISTENCIA SOCIAL NÚMERO 332, ARTICULO 4, FRACCIONES I\nA LA XV; ARTICULO II BIS, FRACCIÓN I AL IV Y ARTÍCULO 11 TER, ÚLTIMA REFORMA PUBLICADA\nEN EL PERIÓDICO OFICIAL DEL GOBIERNO DEL ESTADO NÚMERO 15 DE FECHA 20 DE FEBRERO\nDEL 2015, Y LOS LINEAMIENTOS PARA LA ELABORACIÓN DE LAS REGLAS DE OPERACIÓN DE LOS\nPROGRAMAS SOCIALES ESTATALES PARA EL EJERCICIO FISCAL 2017, Y\nCONSIDERANDO\nQue en el Dictamen y Decreto 182 del Presupuesto de Egresos del Estado de Guerrero para el Ejercicio\nFiscal 2019 se señala que se ejercerán los recursos bajo una política de gasto público, que permita dar cumplimiento a lo que globalmente prevén los cinco ejes rectores del Plan Estatal de Desarrollo 2016-2021.\nDentro de la política de Desarrollo Social, el Sistema para el Desarrollo Integral de la Familia del Estado de\nGuerrero, opera el Programa Adquisición y Donación de Aparatos Funcionales a través del cual se otorgan aparatos funcionales a personas con discapacidad temporal o permanente, para favorecer su rehabilitación e inclusión social, mejorando su calidad de vida y favoreciendo la igualdad de oportunidades.\nEl Sistema para el Desarrollo Integral de la Familia tendrá a cargo la implementación, ejecución, evaluación y administración del Programa Adquisición y Donación de Aparatos Funcionales, bajo los criterios de objetividad, equidad, transparencia, publicidad, selectividad y temporalidad, con estricto apego a la normatividad aplicable, por lo tanto será el encargado de la dispersión y asignación de los recursos del proyecto apegándose plenamente a las reglas de operación.\nPor lo antes expuesto y con fundamento en las disposiciones legales antes citadas, he tenido a bien expedir el siguiente:\nOPERACIÓN PARA, EL EJERCICIO FISCAL 2019\nÚnico: Se emiten las Reglas de Operación del Programa Adquisición y Donación de Aparatos Funcionales, para el Ejercicio Fiscal 2019.\nCONTENIDO\n1. INTRODUCCIÓN\n1.1 Antecedentes\n1.2 Alineación programática\n1.3 Diagnóstico\n2. DEPENDENCIA O ENTIDAD RESPONSABLE DEL PROGRAMA\n3. OBJETIVOS Y ALCANCES\n3.1 General\n3.2 Específicos\n3.3 Alcances\n4. METAS FÍSICAS\n5. PROGRAMACIÓN PRESUPUESTAL\n6 REQUISITOS Y PROCEDIMIENTO DE ACCESO\n6.1 Difusión\n6.2 Requisitos de Acceso\n6.3 Procedimientos de Acceso\n6.4 Requisitos de Permanencia, Causales de Baja o Suspensión Temporal\n6.5 Modos de Entrega del Beneficio\n7 PROCEDIMIENTOS DE INSTRUMENTACIÓN\n7.1 Operación\n7.2 Gastos de Operación\n8. TRANSPARENCIA\n8.1 Difusión\n8.2 Blindaje Electoral\n8.3 Supervisión y Control\n8.4 Mecanismos de Evaluación e Indicadores\n8.4.1 Evaluación\n8.4.2 Indicadores\n8.5 Auditoria\n8.6 Recursos no Devengados\n8.7 Contraloría Social\n8.8 Formas de Participación Social\n8.9 Procedimiento de Queja o Inconformidad Ciudadana\n8.10 Mecanismos de Exigibilidad\n8.11 Acta de Entrega-Recepción\nOPERACIÓN PARA, EL EJERCICIO FISCAL 2019\n9. CRITERIOS DE SELECCIÓN Y ELEGIBILIDAD\n9.1 Método de Selección de Beneficiarios\n10. MECÁNICA DE OPERACIÓN\n10.1 Instancia Ejecutora\n10.2 Instancia administrativa y/o normativas\n10.3 Delimitación de atribuciones\n11. DERECHOS, OBLIGACIONES Y SANCIONES DE LOS BENEFICIARIOS DE PROGRAMAS\nSOCIALES\n11.1 Derechos\n11.2 Obligaciones\n11.3 Sanciones\n12. INTERPRETACIÓN\nTRANSITORIOS\nANEXOS\n1. INTRODUCCIÓN\n1.3. ANTECEDENTES\nLa discapacidad es la condición de vida de una persona, adquirida durante su gestación, nacimiento, infancia o cualquier otra etapa de la vida, que se manifiesta por limitaciones significativas en el funcionamiento intelectual, motriz, sensorial (vista y oído) y en la conducta adaptativa, es decir, en la forma en que se relaciona en el hogar y la comunidad, respetando las formas de convivencia de cada ámbito.\nLos aparatos funcionales o dispositivos de apoyo son productos, instrumentos, equipos o sistemas utilizados por una persona con discapacidad, fabricados especialmente para prevenir, compensar, disminuir o neutralizar una deficiencia, discapacidad o minusvalía.\nEl uso de las ayudas técnicas adecuadas permite a una persona con movilidad reducida o persona mayor aumentar su capacidad funcional para la realización de las tareas cotidianas. Son, por tanto, objetos muy diversos que incrementan el nivel de independencia y autonomía personal del usuario con discapacidad en su entorno, por lo que este programa ha sido de continuidad desde años pasados, como parte fundamental de los programas asistenciales que opera el Dif-Guerrero. discapacidad aparatos funcionales de acuerdo a la discapacidad que padece.\nEn el marco de la Ley de Asistencia Social, corresponde a este Organismo normar las acciones enfocadas al desarrollo del individuo, la familia y la comunidad. En ese sentido, el Programa Adquisición y Donación de Aparatos Funcionales, constituye una de las vertientes a través de la cual se considera lograr un desarrollo integral e incluyente, para las personas y familias que se encuentran en situación de\nOPERACIÓN PARA, EL EJERCICIO FISCAL 2019 vulnerabilidad social, particularmente, en condiciones de pobreza, entregando a personas que con discapacidad Aparatos Funcionales, dependiendo de la discapacidad que presente.\n1.2. ALINEACIÓN PROGRAMÁTICA\nEn cumplimiento a lo que globalmente prevén los ejes rectores del Plan Estatal de Desarrollo 2016-2021, el Programa Adquisición y Donación de Aparatos Funcionales se enmarca en el Eje III.- Guerrero\nSocialmente Comprometido. Objetivo 3.7. Fortalecer la Asistencia Social a Grupos Vulnerables; Estrategia\n3.7.1. Atender Integralmente a los Grupos Vulnerables y Fomentar el Acceso a los Servicios de Protección\nSocial que les Permita Mejorar su Calidad de Vida, a través de las Líneas de acción:\n• Proporcionar asistencia social integral a menores y adultos mayores que se encuentran en situación de vulnerabilidad.\n• Mejorar la atención de la salud a la población en situación de vulnerabilidad.\nAsí mismo las presentes Reglas se encuentran enmarcadas a lo estipulado en el Programa Sectorial\n\"Desarrollo y Asistencia Social\" que tiene como objetivo atender a personas vulnerables con carencias en materia de salud.\nEn consecuencia, la formulación de un programa de desarrollo social exige conjugar armónicamente todos los elementos que lleven a la materialización de sus objetivos, estrategias, metas y evaluación de resultados. Por ello, se deben considerar en la introducción, los siguientes rubros:\nNaturaleza del Proyecto: Es un programa social el cual permitirá disminuir el impacto económico de las personas vulnerables a través de acciones que les permitan tener las mejores condiciones posibles para para prevenir, compensar, disminuir o neutralizar una deficiencia, discapacidad o minusvalía, con el uso de las ayudas técnicas adecuadas permitirá a una persona con movilidad reducida o persona mayor aumentar su capacidad funcional para la realización de las tareas cotidianas, por lo tanto, son objetos muy diversos que incrementan el nivel de independencia y autonomía personal del usuario con discapacidad en su entorno. Con la implementación de este programa permitirá cumplir con uno de los objetivos del Gobierno\nEstatal el cual es abatir la marginación y el rezago social que enfrentan los grupos sociales vulnerables plenitud.\nOrigen y Fundamento: Constitución Política de los Estados Unidos Mexicanos Constitución Política del\nSocial.\nObjetivos y Metas: Otorgar aparatos funcionales a personas con discapacidad temporal o permanente, por lo que se donaran 801 piezas para los diferentes tipos de discapacidad, que la requieran para favorecer su rehabilitación e inclusión social, mejorando su calidad de vida y favoreciendo la igualdad de oportunidades.\nOPERACIÓN PARA, EL EJERCICIO FISCAL 2019\nUbicación Geográfica: Se atenderán a los 81 municipios que integran el Estado, dando prioridad a los municipios de alta y muy alta marginación. financieros, para llevar a cabo la adquisición de los materiales, insumos y productos necesarios en la operatividad del programa; así mismo dar a conocer al Sistema Municipal DIF, las Reglas de Operación del programa vigente y proporcionar de forma calendarizada los suministros de los apoyos.\nInstancias Participantes: La instancia ejecutora es el Sistema para el Desarrollo Integral de la Familia, a través de la Dirección de Servicios Médicos Asistenciales, quien se coordinará con los Sistemas\nMunicipales DIF para llevar a cabo la ejecución y seguimiento del programa.\nPresupuesto de Inversión: Se tiene contemplado una inversión de $561,200.00 (Quinientos sesenta y un mil doscientos pesos 99/100 M.N.), recursos presupuestales que provienen del Ramo 33.-Aportaciones\nFederales para Entidades y Municipios, específicamente del Fondo de Aportaciones Múltiples (Asistencia\nSocial).\nGlosario de Términos:\nSEDIF: Sistema para el Desarrollo Integral de la Familia.\nSEFINA: Secretaría de Administración y Finanzas.\nSEPLADER: Secretaría de Planeación y Desarrollo Regional.\nSecretaría de Contraloría: Secretaría de Contraloría y Transparencia Gubernamental.\nAsistencia Social: Conjunto de Acciones Tendientes a Modificar y Mejorar las Circunstancias de Carácter\nSocial que Impiden el Desarrollo Social del Individuo, así como la Protección Física, Mental y Social de\nPersonas en Estado de Necesidad.\nGrupos Vulnerables: Persona o grupo que por sus características de desventaja por edad, sexo, estado civil; nivel educativo, origen étnico, situación o condición física y/o mental; requieren de un esfuerzo adicional para incorporarse al desarrollo y a la convivencia.\nCONEVAL: Consejo Nacional de Evaluación de la Política de Desarrollo Social.\nPOBREZA: Una persona se encuentra en situación de pobreza cuando presenta al menos una carencia social y no tiene un ingreso suficiente para satisfacer sus necesidades.\nPOBREZA EXTREMA: Una persona se encuentra en situación de pobreza extrema cuando presenta tres o más carencias sociales y no tiene un ingreso suficiente para adquirir una canasta alimentaria.\nDiscapacidad.- Alteración funcional permanente, transitoria o prolongada, motora, sensorial o mental que, en relación a su edad y medio social, implique desventajas considerables para su adecuada integración social o laboral.\nAparatos Funcionales: Son los instrumentos, dispositivos o herramientas que permiten a las personas con discapacidad temporal o permanente, realizar actividades como desplazarse, obtener movimiento, caminar, trabajar, escuchar, entre otras.\n1.3 DIAGNOSTICO\nOPERACIÓN PARA, EL EJERCICIO FISCAL 2019\nEn el Estado de Guerrero como en todo el país, la discapacidad se asocia con bajas condiciones de bienestar tales como la pobreza extrema, la marginación social, la mal nutrición, el analfabetismo, la ignorancia, el aún acelerado crecimiento de la población y su dispersión, lo que restringe la prestación de los servicios sanitarios, limitando la correcta vigilancia prenatal y la adecuada atención del parto, también está asociada con el aumento de las personas de la tercera edad y de las enfermedades crónicodegenerativas no transmisibles, las lesiones por accidentes de todo tipo y la violencia.\nLa prevalencia de la discapacidad motriz es la más alta, alrededor del 40% de los diferentes tipos de discapacidad, de acuerdo con los resultados del XII Censo General de Población y Vivienda, lo que significa que alrededor de 20,000 personas en el año 2000, padecían de estas deficiencias físicas en el Estado de\nGuerrero.\nParticularmente, la prevalencia de la parálisis cerebral infantil se estima entre 2 y 3 casos por cada 1,000 habitantes, nos indica la existencia de entre 6,900 y 10,200 personas con Parálisis Cerebral, principalmente entre los menores de 15 años de edad. La disposición de impulsar actividades y acciones que permitan que la población de escasos recursos, que requieran aparatos funcionales tales como bastones, andaderas ortopédicas, muletas infantiles y de adultos, les permitirá a los beneficiarios realizar con mayor facilidad, libertad e independencia sus actividades cotidianas; por lo antes citado se atiende el problema detectado en el diagnostico a través de:\nVisión: donar con diversos aparatos funcionales como son: bastón ortopédico, bastón de 4 apoyos, bastón para invidente, andaderas ortopédicas, andadera Ortopédica con llantas delanteras infantiles, muletas axilares, muletas canadienses, para diferentes tipos de discapacidad, con el propósito de restablecer sus capacidades de movilidad y auto desempeño, para mejorar así su calidad de vida\nVisión: Mejorar la calidad de vida de las personas con discapacidad logrando su independencia y funcionalidad, así como su integración a la vida social y laboral.\n2. DEPENDENCIA O ENTIDAD RESPONSABLE DEL PROGRAMA\nEs el Sistema para el Desarrollo Integral de la Familia a través de la Dirección de Servicios Médicos\nAsistenciales, el cual tiene como sustento jurídico a:\n24 de abril 2018).\nOPERACIÓN PARA, EL EJERCICIO FISCAL 2019\n• Ley para el Bienestar e Incorporación Social de las Personas con Discapacidad en el Estado de\nGuerrero, No. 281.\n• Ley 479 del Sistema para el Desarrollo Integral de la Familia, publicada en el periódico Oficial el martes 02 de agosto de 1983. el Periódico Oficial número 74, alcance I, de fecha 13 de septiembre de 2016).\n• Ley 454 de Presupuesto y Disciplina Fiscal del Estado de Guerrero, (última reforma publicada en el\nPeriódico Oficial número 91, alcance II, de fecha 11 de noviembre de 2016).\n• Ley Orgánica de la Administración Publica 08 (última reforma publicada en el Periódico Oficial del\nEstado número 69 de fecha 28 de agosto de 2018).\n• Ley 207 de Transparencia y Acceso a la Información Pública del Estado.\n• Ley sobre el Sistema Estatal de Asistencia Social 332 (Última reforma publicada el 20 de febrero del 2015).\n• Plan Estatal de Desarrollo 2016 - 2021.\n• Programa Sectorial Desarrollo y Asistencia Social 20162021.\n• Decreto Número 182 del Presupuesto de Egresos del Estado de Guerrero para el ejercicio fiscal\n2019.\n• Estrategia Local \"Guerrero Contigo\"\n• Reglamento Interno del Sistema para el Desarrollo Integral de la Familia del Estado de Guerrero.\n• Manual de Organización del DIF Guerrero.\n• Y todos aquellos Ordenamientos Normativos Aplicables.\n3. OBJETIVOS Y ALCANCES\n3.1. OBJETIVO GENERAL.\nOtorgar aparatos funcionales a personas con discapacidad temporal o permanente, por lo que se donaran\n801 piezas para los diferentes tipos de discapacidad, que la requieran para favorecer su rehabilitación e inclusión social, mejorando su calidad de vida y favoreciendo la igualdad de oportunidades.\n3.2. OBJETIVO ESPECIFICO.\n• Favorecer la rehabilitación y prevenir discapacidades secundarias.\n• Contribuir a la integración plena de las personas con discapacidad en la sociedad.\n• Favorecer su independencia y funcionalidad.\n3.3. ALCANCES\nOPERACIÓN PARA, EL EJERCICIO FISCAL 2019\nEl problema que se atiende en este programa es el derecho a la seguridad social, entendiéndose como un económicos y sociales que, de no resolverse significarían la reducción o la pérdida de los ingresos a causa de contingencias como la enfermedad, los accidentes, la maternidad o el desempleo, entre otras.\nLa forma más común de identificar la seguridad social es mediante las prestaciones y la asistencia médica, sin embargo, esas son solo algunas de las formas en las que se presenta en la vida cotidiana. En los hechos, la seguridad social también se encuentra en los actos solidarios e inclusivos de las personas hacia los demás, pues esos actos llevan en sí mismos la búsqueda del bienestar social.\nPor ello el Sistema para el Desarrollo Integral de la Familia busca apoyar a las personas más vulnerables entre ellas las que padecen algún tipo de discapacidad principalmente a niños y adultos mayores, mejorando su calidad de vida, a través de la adquisición y donación de 801 aparatos funcionales, a la población de los 81 municipios que integran a nuestro Estado, dando prioridad a los municipios de alta y muy alta marginación, favoreciendo su inclusión e integración a la sociedad.\n4. METAS FÍSICAS\nSe pretende beneficiar a un total de 801 personas con discapacidad, procedentes de los 81 municipios del\nEstado, dando prioridad a la población más vulnerable.\n5. PROGRAMACIÓN PRESUPUESTAL\nSubsidiado a través de recursos presupuestales provenientes del Ramo 33.- Aportaciones Federales para\nEntidades y Municipios, específicamente del Fondo de Aportaciones Múltiples (Asistencia Social), con una inversión para el Ejercicio Fiscal 2019 de $561,200.00 (Quinientos Sesenta y Un Mil Doscientos pesos\n00/100 M.N.), mismo que tiene un costo aproximado por beneficiario y beneficiaria de $ 700.62 (Setecientos pesos 62/100 M.N.), recursos que se ejercerán bajo una política de gasto público, que permita dar cumplimiento a lo que globalmente prevén los ejes rectores del Plan Estatal de Desarrollo 2016-2021.\nCALENDARIO DE MINISTRACIÓN\nPRES. AUT. ENERO FEBRERO MARZO ABRIL MAYO\n561.200.00 0.00 0.00 561.200.00 0.00 0.00\nNOTA: PUEDE EXISTIR VARIACION EN RELACION A LO APROBADO POR EL DPEF Y/O A LAS PROPIAS NECESIDADES DEL SISTEMA. ASI\nMISMO SE SOLICITA EL RECURSO EN UNA SOLA MINISTRACIÓN.\n6. REQUSITOS Y PROCEDIMIENTOS DE ACCESO\n6.1. DIFUSION\nOPERACIÓN PARA, EL EJERCICIO FISCAL 2019 cuales son: Programas Alimentarios, Proyectos Asistenciales, de Bienestar Social y Desarrollo\nComunitario; cuyos requisitos se encuentran en las oficinas del Sistema ubicada en Av. Rene Juárez\nCisneros, Colonia Ciudad de los Servicios y Av. Gabriel Leyva s/n esq. Ruffo Figueroa, Col. Burócratas, C.P. 39090, Chilpancingo, Guerrero, con un horario de atención de 8:00 am a 3:00 pm y/o los teléfonos\n01(747) 4725595, 01(747)47256 00, 01(747)47 25672 ext. 1151 Y 1159. Así mismo al correo electrónico: alimentariadif@prodigy.net.mx, subdireccionalimentaria@prodigy.net.mx\nLas reglas de operación de cada uno de los programas y proyectos son difundidas por personal capacitado de cada una de las Direcciones y en la página web https://www.guerrero.gob.mx del Portal del Gobierno del Estado. Brindando atención a los 81 municipios del Estado, teniendo una capacidad de atención de niñas, niños y adolescentes, mujeres embarazadas, mujeres en periodo de lactancia, personas con discapacidad, adultos mayores y personas vulnerables por ingresos.\nEstas Reglas de Operación, además de su publicación en el Periódico Oficial del Gobierno del Estado, estarán disponibles para su consulta en las Oficinas de la Dirección de Servicios Médicos Asistenciales, así como en la página electrónica del Sistema para el Desarrollo Integral de la Familia http://www.dif.guerrero.gob.mx\nSiendo el responsable directo de la ejecución la Dirección de Servicios Médicos Asistenciales ubicada en\nAv. en el Centro de Rehabilitación Integral Guerrero, Boulevard Lic. René Juárez Cisneros S/N, Col.\nCiudad de los Servicios, Chilpancingo, Guerrero., a los teléfonos (01747) 47 2 55 95, (01747) 47 2 56 00.\n(01747) 47 2 56 72 ext. 1155.\n6.2. REQUISITOS DE ACCESO\n1.- El interesado deberá presentar oficio de solicitud en las instalaciones del DIF Guerrero, con domicilio en el Centro de Rehabilitación Integral Guerrero, Boulevard Lic. René Juárez Cisneros S/N, Col. Ciudad de los Servicios, Chilpancingo, Guerrero dirigido al Director General o la Presidenta del Patronato del DIF\nGuerrero para ser considerado en el Programa.\n2.- La solicitud es turnada a la Dirección de Servicios Médicos Asistenciales para la atención en el\nDepartamento de Ayudas Funcionales, anexando los siguientes requisitos:\n1.- Fotografía reciente del solicitante de cuerpo completo en tamaño postal.\n2.- Constancia medica que especifique el tipo de discapacidad, la cual deberá ser expedida por el\nC.R.I.G Chilpancingo o una Institución de Salud Pública (SSA, DIF-ESTATAL Y MUNICIPAL), el certificado médicodeberá ser firmado y expedido por un médico con cedula profesional.\n3.- Copia del acta de nacimiento.\n4.- Copia de la CURP al 200% si es el formato anterior.\n5.- Copia del comprobante de domicilio reciente.\n6.- Copia fotostática de la credencial de elector al 200%\nOPERACIÓN PARA, EL EJERCICIO FISCAL 2019\n7.- Se aplica el estudio socio económico, al solicitante para determinar la susceptibilidad de ser beneficiario.\n3. La solicitud es turnada a la Dirección de Servicios Médicos Asistenciales para la atención correspondiente.\n6.3. PROCEDIMIENTOS DE ACCESO\nLa ejecución del Programa Adquisición y Donación de Aparatos Funcionales, surge por la necesidad de atender el problema de discapacidad de personas ya sea temporal o permanente, el cual busca garantizar el derecho a la seguridad social a la población más vulnerable atendiendo a los 81 municipios que conforman nuestro Estado, dando prioridad a los municipios de alta o muy alta marginación, el cual se realiza a través de la demanda ciudadana y / o peticiones que se reciben en las instalaciones del Sistema para el Desarrollo Integral de la Familia o directamente a la Presidenta del Sistema Estatal.\nSerán beneficiados con el apoyo del programa, los solicitantes que cumplan con las siguientes características y con la disponibilidad presupuestal del programa: a) Niños, Niñas, Adolescentes y adultos mayores que tengan una discapacidad temporal o permanente.\nb) Habitar en uno de los 81 Municipios de nuestro estado y con más alta marginación, ya que son los más vulnerables.\nLos interesados deberán presentar su solicitud en formato libre de ingreso al programa, en las instalaciones del DIF Guerrero, con domicilio en el Centro de Rehabilitación Integral Guerrero, Boulevard Lic. René\nJuárez Cisneros S/N, Col. Ciudad de los Servicios, Chilpancingo, Guerrero C.P. 39095, dirigido a la\nPresidenta del Patronato del DIF Guerrero para ser considerados dentro del Programa, con un horario de atención de 8:00 am a 3:00 pm y/o los teléfonos 01(747) 47 1 84 90, 01(747) 47 184 98 ext. 1074 Y 1077.\nAsí mismo al correo electrónico: direccionserviciomedico@hotmail.com\nDe acuerdo a la disponibilidad presupuestal del programa se dará preferencia a toda aquella persona con\nDiscapacidad en estado de vulnerabilidad; así mismo se entregara un comprobante de acceso al programa que en un plazo no mayor a 30 días hábiles dará respuesta a la solicitud.\nAdquisición y Donación de aparatos funcionales, formaran parte de un Padrón Único de Beneficiarios, donde sus datos personales, e información administrada y/o generada será resguardada de acuerdo con podrán emplearse para propósitos de proselitismo político, religioso o comercial, ni para ningún otro fin distinto al establecido en las Reglas de Operación del programa social.\nReglas de Operación.\n6.4. REQUISITOS DE PERMANENCIA, CAUSALES DE BAJA O SUSPENSION TEMPORAL\nOPERACIÓN PARA, EL EJERCICIO FISCAL 2019\nCausaría baja cuando a través del estudio socioeconómico, se comprueba que tiene solvencia económica.\nLo demás no aplica por la naturaleza propia del programa.\n6.5. MODOS DE ENTREGA DEL BENEFICIO\nEl solicitante deberá acudir al Centro de Rehabilitación Integral Guerrero (CRIG) donde se le entregará de manera directa y por única ocasión el apoyo, de acuerdo al tipo de discapacidad que presente, se le otorgara el aparato funcional que requiera, con el propósito de restablecer sus capacidades de movilidad y auto desempeño.\n1.- Andaderas ortopédicas adulto\n2.- Bastones ortopédicos puño recto\n3.- Bastones de 4 puntos\n4.- Bastones para invidente infantil\n5.- Muletas axilares adulto (mediana)\n6.- Muletas canadienses ergonómicas\n7.- Asiento posicionador mediano\n7. PROCEDIMIENTOS DE INSTRUMENTACIÓN\n7.1. OPERACIÓN\n1) El paciente, familiar o gestor (DIF-municipales) acuden al Sistema Estatal para el Desarrollo Integral de la Familia, a la Dirección de los Servicios Médicos Asistenciales, a solicitar los requisitos para la incluicion al programa de Adquisición y Donación de Aparatos Funcionales\n2) Una vez que fue atendido e informado referente a la documentación que este deberá de entregar al\nDepartamento de Aparatos funcionales, mencionado en el apartado 6.2.\n3) Se presenta el paciente, familiar o gestor, (DIF-MUNICIPAL) al departamento de Aparatos funcionales, se recibe y revisa la documentación que este conforme a los requisitos requeridos de acuerdo a las reglas de operación del programa.\n4) Un vez completo el expediente, se recibe la documentación, se le sella de recibido su oficio de petición\n(ACUSE) con el sello correspondiente del Departamento de Aparatos funcionales, con fecha de recibido.\n5) Así mismo se le informara vía telefónica en tiempo y forma la entrega.\n6) Dicha entrega se llevara a cabo en gira de trabajo o en evento programado por la Coordinación de giras, de la Presidenta del DIF-Guerrero.\n7.2. GASTOS DE OPERACIÓN\nEl presupuesto asignado a este programa, es a través del Fondo de Aportaciones Múltiples, no contempla\nGastos de Operación.\n8. TRANSPARENCIA\nOPERACIÓN PARA, EL EJERCICIO FISCAL 2019\n8.1. DIFUSION\nLa Dirección de Servicios Médicos Asistenciales, difundirá a través de diferentes medios de comunicación; trípticos, periódico, redes sociales en las cuales se dará a conocer la información relacionada con las características del programa de Adquisición y Donación de Aparatos Funcionales.\nAsí mismo se dará amplia difusión al Programa a nivel estatal y se promoverán similares acciones por parte de las autoridades locales; la información del programa se dará a conocer en la página de internet del\nGobierno del Estado, desagregada por municipio, barrio o zona urbano-marginada, proyecto y nombre del beneficiario. Las copias de los expedientes de los beneficiarios y / o beneficiarias estarán disponibles oportunamente para su consulta en las oficinas del Sistema ubicadas en Av. Rene Juárez Cisneros, Colonia\nCiudad de los Servicios C.P. 39095, Chilpancingo, Guerrero; por otra parte la papelería, documentación oficial, así como la publicidad y promoción de los Programas, deberán incluir la leyenda descrita en el apartado de \"Blindaje Electoral\".\nLa información de montos y beneficiarios deberá ser publicada en los términos de la Ley No. 207 de\nTransparencia y Acceso a la Información Pública del Estado de Guerrero.\nUna vez autorizadas estas Reglas de Operación, por las instancias correspondientes, estarán disponibles para su consulta en las Oficinas de la Dirección de Servicios Médicos Asistenciales, así como en los medios electrónicos oficiales http://www.dif.guerrero.gob.mx\n8.2. BLINDAJE ELECTORAL\nLa operación y ejecución de los recursos estatales destinados al Programa, deberán observar y atender las medidas que emita la Secretaría de Contraloría y Transparencia Gubernamental, para coadyuvar a que éstos, no sean utilizados con fines políticos en el desarrollo de procesos electorales federales, estatales y municipales.\nComo estrategia de blindaje electoral, la papelería, documentación oficial, así como la publicidad y promoción del Programa deberán incluir la siguiente leyenda:\n\"Este Programa es público, ajeno a cualquier partido político. Queda prohibido el uso para fines distintos a los establecidos en el programa\"\n8.3. SUPERVISIÓN Y CONTROL\nPlaneación del DIF Guerrero, las acciones ejercidas y los resultados obtenidos, quien a su vez reportará a la Secretaría de Planeación y Desarrollo Regional (SEPLADER), Secretaría de Finanzas y Administración\n(SEFINA) y a la Secretaría de Contraloría y Transparencia Gubernamental trimestralmente, informes sobre el presupuesto ejercido establecidos por el Consejo Nacional de Armonización Contable (CONAC) y con\nOPERACIÓN PARA, EL EJERCICIO FISCAL 2019 base en los indicadores de resultados previstos en las Reglas de Operación; mismos que se deberán presentar a más tardar a los quince días hábiles posteriores a la terminación de cada trimestre.\nLos padrones de los beneficiarios serán requisitados por los Sistemas Municipales DIF, remitiendo para su integración de los Padrones de Beneficiarios de los 81 municipios de la Entidad mismo que serán remitidos a las instancias o dependencias operadoras.\n8.4. MECANISMOS DE EVALUACIÓN E INDICADORES\n8.4.1. EVALUACION\nEl instrumento de medición de la evaluación del Programa se realizará mediante indicadores de desempeño los cuales serán reportados a la Dirección de Planeación para la integración de los informes correspondientes.\n8.4. 2. INDICADORES\nMatriz de Indicadores de resultados\nDetalle de la Matriz 2019\nRamo:\n5 - Sector Paraestatal\nUnidad Responsable:\nP-46 -O.P.D. Sistema para el Desarrollo Integral de la Familia\nClave y Modalidad del Pp:\nS- Sujetos a Reglas de Operación\nE- Prestación de Servicios Públicos\nDenominación del Pp:\nS01\nE01\nClasificacion Funcional:\nFinalidad: 2. Desarrollo Social\nFunción: 2.3. SALUD\n2.4. RECREACIÓN, CULTURA Y OTRAS MANIFESTACIONES SOCIALES\n2.6. PROTECCIÓN SOCIAL\nSubfunción: 2.3.2. Prestación de Servicios de Salud 2.6.5 Alimentación y Nutrición a la Persona 2.6.6 Apoyo Social para la Vivienda\n2.4.2. Cultura 2.6.7 Indígenas\n2.6.1. Enfermedad e Incapacidad 2.6.8 Otros Grupos Vulnerables\n2.6.2. Edad Avanzada 2.6.9 Otros de Seguridad Social y\n2.6.3. Familia e Hijos Asistencia Social\nDesempleo\nResumen narrativo Orden Supuestos\nOPERACIÓN PARA, EL EJERCICIO FISCAL 2019 acciones de Asistencia Social sociales\nUnidad Frecuencia Línea\nTipo de Meta Medios de\nIndicador Método de Cálculo de de Base\nIndicador 2018 Verificación\nMedida Medición 2017\nPorcentaje de (Población población atendida/Total de Padrón de\nPersonas Anual Estratégico 70% 90% vulnerable población beneficiarios atendida vulnerable)*100\nPropósito\nResumen narrativo Orden Supuestos\nLas obras y/o acciones\nFortalecer las acciones de desarrollo Ampliación de cobertura poblacional de contribuyen a mejorar la calidad social y Humano los programas sociales de vida\nUnidad Frecuencia Línea\nTipo de Meta Medios de\nIndicador Método de Cálculo de de Base\nIndicador 2018 Verificación\nMedida Medición 2017\n(Programas\nPorcentaje de implementados en\nOficios de\nProgramas 2017 / Programas Programas Anual Estratégico 70% 90% autorización implementados implementados en\n2018)* 100\nComponente\nResumen narrativo Orden Supuestos\nFortalecer el nivel nutricional de la Contribuir a mejorar la dieta de población con mayor índice de las niñas y niños de nivel primaria marginación, poniendo énfasis en los y prescolar, así como\nAsistencia Social grupos de alto riesgo, a fin de mejorar implementar Proyectos la calidad en la dieta y apoyar el gasto Productivos, de Economía y familiar. Traspatio\nUnidad Frecuencia Línea\nTipo de Meta Medios de\nIndicador Método de Cálculo de de Base\nIndicador 2018 Verificación\nMedida Medición 2017\nOPERACIÓN PARA, EL EJERCICIO FISCAL 2019\n(Número de despensasdotaciones\nProporción de distribuidas en el despensasperiodo de acuerdo dotaciones Avance a los criterios de entregadas que Porcentaje Trimestral Estratégico 0% 100% Físicocalidad nutricia de cumplen con los Financiero los Lineamientos de criterios de calidad la EIASA / Número nutricia total de apoyos entregados en el periodo) * 100\nPorcentaje de\n(Total de apoyos apoyos de Avance otorgados / total de\nDesarrollo Porcentaje Semestral Estratégico 0% 100% Físicoapoyos\nComunitario Financiero programados) * 100 otorgados\nResumen narrativo Orden Supuestos\nElevar la calidad de vida de las familias y comunidades marginadas, a través\nBeneficiar a los grupos de su participación activa en\nDescendente vulnerables para su desarrollo programas de asistencia social y apoyo físico y mental jurídico, que les permita alcanzar su desarrollo integral\nUnidad Frecuencia Línea\nTipo de Meta Medios de\nIndicador Método de Cálculo de de Base\nIndicador 2018 Verificación\nMedida Medición 2017\n(Total de apoyos\nPorcentaje de Avance otorgados / total de apoyos Sociales Porcentaje Semestral Estratégico 0% 100% Físicoapoyos otorgados Financiero programados) * 100\nResumen narrativo Orden Supuestos\nAtender y apoyar a las personas con discapacidad, mediante servicios asistenciales y de rehabilitación, para Descendente Los servicios otorgados social las personas con discapacidad\nUnidad Frecuencia Línea\nTipo de Meta Medios de\nIndicador Método de Cálculo de de Base\nIndicador 2018 Verificación\nMedida Medición 2017\nOPERACIÓN PARA, EL EJERCICIO FISCAL 2019\n(Total de servicios\nPorcentaje de Avance otorgados / total de\nServicios Porcentaje Semestral Estratégico 0% 100% Físicoservicios otorgados Financiero programados) * 100\nResumen narrativo Orden Supuestos\nSe recibe en tiempo las\nAdministración interna y servicios\nAscendente comprobaciones por parte de los generales del DIF ejecutores del Gasto.\nUnidad Frecuencia Línea\nTipo de Meta Medios de\nIndicador Método de Cálculo de de Base\nIndicador 2018 Verificación\nMedida Medición 2017\n(Número de\nPorcentaje de comprobaciones\nAvance comprobaciones entregadas en\nPorcentaje Semestral Estratégico 0% 100% Físicoentregadas a tiempo/Total de\nFinanciero tiempo. comprobaciones realizadas)*100\nActividades\nResumen narrativo Orden Supuestos\nDeterminar el nivel de atención\nBeneficiar a los grupos alimentaria a población en condiciones\nAsistencia Social vulnerables para su desarrollo emergencia afectada por Desastres físico y mental\nNaturales.\nUnidad Frecuencia Línea\nTipo de Meta Medios de\nIndicador Método de Cálculo de de Base\nIndicador 2018 Verificación\nMedida Medición 2017\nAtención\nAlimentaria en\nMpios. En\nEmergencia =\nMpios. con\nAcceso Avance\nDeclaración de\nAlimentario en Personas Anual Estratégico 100 100% Físicoemergencia\nRiesgo Financiero atendidos / Total de\nMpios. con\nDeclaratoria de emergencia en la\nEntidad.\nResumen narrativo Orden Supuestos\nDeterminar el porcentaje de Los menores beneficiados, beneficiados con insumos alimentarios. calidad nutricia\nOPERACIÓN PARA, EL EJERCICIO FISCAL 2019\nUnidad Frecuencia Línea\nTipo de Meta Medios de\nIndicador Método de Cálculo de de Base\nIndicador 2018 Verificación\nMedida Medición 2017\n(Menores beneficiados que tienen algún grado\nAvance\nDesnutrición de Desnutrición /\nMenores Anual Estratégico 22% 20% FísicoInfantil Total de Menores\nFinanciero beneficiados con insumos alimentarios) * 100\nResumen narrativo Orden Supuestos\nDeterminar el porcentaje de obesidad\nDisminuyen los índices de en los menores beneficiados con Descendente obesidad infantil insumos alimentarios.\nUnidad Frecuencia Línea\nTipo de Meta Medios de\nIndicador Método de Cálculo de de Base\nIndicador 2018 Verificación\nMedida Medición 2017\nPorcentaje de\nObesidad en\nMenores = Menores\nBeneficiados que\nAvance tienen algún grado\nObesidad Infantil Menores Anual Estratégico 15% 11% Físicode Obesidad / Total\nFinanciero de Menores\nBeneficiados con insumos\nAlimenticios\nResumen narrativo Orden Supuestos\nDeterminar el porcentaje de atención insumos alimentarios.\nUnidad Frecuencia Línea\nTipo de Meta Medios de\nIndicador Método de Cálculo de de Base\nIndicador 2018 Verificación\nMedida Medición 2017\nOPERACIÓN PARA, EL EJERCICIO FISCAL 2019\nPorcentaje de\nObesidad en\nMenores = Menores\nAcceso Beneficiados que\nAvance\nAlimentario en tienen algún grado\nMenores Anual Estratégico 100% 100% FísicoMenores no de Obesidad / Total\nFinanciero\nEscolarizados de Menores\nBeneficiados con insumos\nAlimenticios\nResumen narrativo Orden Supuestos\nPermite determinar el nivel de atención a municipios con alto índice de\nLa población vulnerable, carencia alimentaria, a fin de propiciar\nDescendente dispone de una alimentación el mejoramiento alimentario de los con calidad nutricia grupos con mayor vulnerabilidad en la entidad.\nUnidad Frecuencia Línea\nTipo de Meta Medios de\nIndicador Método de Cálculo de de Base\nIndicador 2018 Verificación\nMedida Medición 2017\nMpios con Alto\nIndice de Carencia\nAlimentaria No\nAvance\nAcceso a la Atendidos = Mpios.\nMunicipio Anual Estratégico 0 100% FísicoAlimentación con A.I.C.A. no\nFinanciero atendidos / Total de\nMpios. en la\nEntidad.\nResumen narrativo Orden Supuestos\nLa población beneficiada recibe\nConocer la cantidad de personas apoyos para fortalecer la\nAscendente beneficiadas con los Proyectos economía, alimentación y de\nProductivos de Economía y Traspatio sus familias\nUnidad Frecuencia Línea\nTipo de Meta Medios de\nIndicador Método de Cálculo de de Base\nIndicador 2018 Verificación\nMedida Medición 2017\n(beneficiarios\nÍndice de avance atendidos / Avance en la entrega de\nBeneficiarios Personas Anual Estratégico 80% 100% FísicoProyectos programados) * Financiero\nProductivos\nResumen narrativo Orden Supuestos\nPoblación que requiere algún tipo de\nLa población vulnerable tiene servicio médico y que carece de Ascendente acceso a los servicios de salud servicio medico\nOPERACIÓN PARA, EL EJERCICIO FISCAL 2019\nUnidad Frecuencia Línea\nTipo de Meta Medios de\nIndicador Método de Cálculo de de Base\nIndicador 2018 Verificación\nMedida Medición 2017\nPoblación sin\nPoblación sin acceso a los\nAvance acceso a los servicios de salud =\nPersonas Anual Estratégico 80% 100% Físicoservicios de salud Población atendida\nFinanciero\n(PSASS) / Población programada\nResumen narrativo Orden Supuestos\nConocer los apoyos entregados en la\nSe entregan todos los apoyos a temporada invernal (Suéteres y Ascendente la población vulnerable\nCobertores)\nUnidad Frecuencia Línea\nTipo de Meta Medios de\nIndicador Método de Cálculo de de Base\nIndicador 2018 Verificación\nMedida Medición 2017\nEntrega de Apoyos\nApoyos\n= Total de Apoyos entregados en la Padrón de\nAtendidos / Total de Apoyos Anual Estratégico 0% 100% temporada Beneficiarios\nApoyos invernal\nProgramados\nResumen narrativo Orden Supuestos\nLos apoyos entregados, Personas Beneficiadas con Apoyos\nAscendente contribuyen a subsanar las\nEconómicos y en Especie necesidades de la sociedad.\nUnidad Frecuencia Línea\nTipo de Meta Medios de\nIndicador Método de Cálculo de de Base\nIndicador 2018 Verificación\nMedida Medición 2017\n(Total de apoyos\nPorcentaje de Avance otorgados / total de apoyos Sociales Porcentaje Semestral Estratégico 0% 100% Físicoapoyos otorgados Financiero programados) * 100\n8.5. AUDITORIA\nEl ejercicio del recurso y la operatividad del Programa, están sujetos a las disposiciones Estatales aplicables y podrá ser auditado por la Secretaria de Contraloría y Transparencia Gubernamental, asi como por la Auditoria\nSuperior del Estado y Auditoria Superior de la Federación, conforme a la legislación vigente y en el ámbito de sus respectivas competencias.\nOPERACIÓN PARA, EL EJERCICIO FISCAL 2019\nEl Sistema DIF Guerrero dará todas las facilidades a dichas instancias para realizar, en el momento en que lo juzguen pertinente, las auditorias que consideren necesarias; asi como el seguimiento y la solventación a las observaciones planteadas por los órganos de control.\n8.6. RECURSOS NO DEVENGADOS\nEl DIF Guerrero deberá reintegrar a la Dirección General de Tesoreria de la Secretaria de Finanzas y\nAdministración del Gobierno del Estado los recursos que no se hubiesen destinado a los fines autorizados y aquellos que por cualquier motivo no estuviesen devengados al 31 de diciembre del Ejercicio fiscal correspondiente.\n8.7. CONTRALORÍA SOCIAL\nCon la finalidad de incrementar la participación ciudadana, se crearán Comités de Contraloria Social, como un órgano ciudadano de control, vigilancia y evaluación de las actividades del Programa, conformados por la población beneficiada, los sectores sociales, y los representantes de la localidad, quienes de manera especificas supervisarán la gestión gubernamental, y que el manejo de los recursos públicos se realicen en términos de transparencia, eficacia, legalidad y honradez; los objetivos especificos de este Órgano de\nContraloría Social son:\n➢ Hacer más transparentes las decisiones y la ejecución de los recursos.\n➢ Incrementar la participación ciudadana.\n➢ Fomentar la organización social.\n➢ Inhibir los actos de corrupción y de cooptación social, política y electoral.\n➢ Incrementar la eficiencia de los recursos públicos.\n➢ Fortalecer la cultura de la legalidad.\n➢ Mejorar la rendición de cuentas.\n• Perfeccionar la democracia e incorporar la evaluación ciudadana.\n8.8. FORMAS DE PARTICIPACIÓN SOCIAL\nGuerrero, se establece que la sociedad podrá participar activamente en la Planeación, Programación, Implementación y Evaluación de los Programas Sociales de Desarrollo Social, por ello los beneficiarios y beneficiarias participaran en la etapa de la implementación y podrán supervisar la gestión gubernamental, que el manejo de los recursos públicos se realicen en términos de transparencia, eficacia, legalidad y honradez del Proyecto de acuerdo en lo estipulado en estas Reglas de Operación.\nBeneficiarios/ Implementación Comités de Contraloría Seguimiento\nBeneficiarias\nOPERACIÓN PARA, EL EJERCICIO FISCAL 2019\n8.9. PROCEDIMIENTOS DE QUEJA O INCONFORMIDAD CIUDADANA\nLos beneficiarios (as) pueden presentar quejas y denuncias ante las instancias correspondientes sobre cualquier hecho, acto u omisión que produzca o pueda producir daños al ejercicio de sus derechos aplicable. a. En el Sistema DIF Guerrero\nTeléfonos: (747) 47-1-84-98\nCorreo: buzon.dif@guerrero.gob.mx direccionserviciomedico@hotmail.com\nDomicilio: Centro de Rehabilitación Integral Guerrero.\nBoulevard Lic. René Juárez Cisneros S/N, Col. Ciudad de los Servicios. Chilpancingo, Guerrero. C.P.\n39095. b. En la Secretaría de Contraloría y Transparencia Gubernamental.\nTeléfonos: (474) 47 1 97 41\nCorreo electrónico: contraloria@guerrero.gob.mx\nDomicilio: Palacio de Gobierno Primer Piso Edificio Norte, Blvd. R. Juárez Cisneros 62 Col. de los Servicios\nC.P. 39075.\nLas quejas y denuncias de la ciudadanía derivadas de alguna irregularidad en la operación del Programa, podrán presentarse por escrito, por comparecencia del beneficiario y beneficiaria, por correo electrónico o vía telefónica y deberá proporcionar los siguientes datos: nombre del servidor público, área de adscripción, objeto de la denuncia, nombre y domicilio del quejoso e identificación oficial.\n8.10. MECANISMOS DE EXIGIBILIDAD\n1. Los requisitos y procedimientos para ser beneficiados por el programa podrán ser solicitados en la\nDirección de Servicios Médicos Asistenciales del DIF Guerrero ubicado en las instalaciones del\nCRIG Chilpancingo, ubicado en Boulevard Rene Juárez Cisneros, col. Ciudad de los Servicios, Chilpancingo, Guerrero.\n2. Los casos en los que se podrá exigir los derechos por incumplimiento o por violación de los mismos pueden ocurrir en al menos los siguientes casos:\na) Cuando una persona solicitante cumpla con los requisitos y criterios de inclusión para acceder a determinado derecho (garantizado por un programa social) y exija a la autoridad administrativa ser derecho habiente del mismo.\nb) Cuando la persona derechohabiente de alguna instancia medica exija que se cumpla con dicho derecho, de manera integral en tiempo y forma, como lo establece el programa.\nc) Cuando no se pueda satisfacer toda la demanda de restricción presupuestal, y estás exijan que las incorporaciones sean claras, transparentes, equitativas, sin favoritismos, ni discriminación.\nOPERACIÓN PARA, EL EJERCICIO FISCAL 2019 desarrollo social.\n8.11. ACTA ENTREGA RECEPCIÓN\nUna vez entregados los aparatos funcionales al paciente, firmará el acta de donación correspondiente, así como la toma de una evidencia fotografía del beneficiado con el aparato funcional otorgado por el DIFGuerrero, misma que se anexa al expediente.\n9. CRITERIOS DE SELECCIÓN Y ELEGIBILIDAD\n9.1- METODO DE SELECCIÓN DE BENEFICIARIOS\nSe beneficiaran con este programa las personas que cumplan con las siguientes características:\n• Personas con discapacidad temporal o permanente.\n• Que pertenezcan a los municipios que presenten Alta y Muy Alta Marginación.\n10. MECÁNICA DE OPERACIÓN\n10.1. INSTANCIA EJECUTORA\nLa Instancia Ejecutora será el sistema para el Desarrollo Integral de la Familia a través de la Dirección de\nServicios Médicos Asistenciales, quien deberá operar con apego a la programación, presupuestación, calendario de ejecución, ejercicio y control del gasto público.\n10.2. INSTANCIA ADMINISTRATIVA Y/O NORMATIVA\nLa Instancia Administrativa y Normativa es la Dirección General del Sistema DIF Guerrero y la Dirección de Servicios Médicos Asistenciales, quienes tendrán la responsabilidad de definir los métodos y objetivos y metas trazadas.\n10.3. DELIMITACIÓN DE ATRIBUCIONES y acciones no se contrapongan, afecten o presenten duplicidades con otros programas o acciones del\nGobierno Estatal; la coordinación institucional y vinculación de acciones busca potenciar el impacto de los recursos, fortalecer la cobertura de las acciones, detonar la complementariedad y reducir gastos administrativos.\nOPERACIÓN PARA, EL EJERCICIO FISCAL 2019\n11. DERECHOS Y OBLIGACIONES Y SANCIONES DE LOS BENEFICIARIOS DE PROGRAMAS\nSOCIALES.\n11.1. DERECHOS\n• Recibir trato digno, respetuoso y equitativo sin discriminación alguna por el personal de las distintas áreas que participen.\n• Tener la reserva y privacidad de la información personal.\n• Solicitar y recibir información sobre el estado que guarda su trámite.\n• Recibir los servicios y prestación del programa conforme a las Reglas de Operación, salvo que le sea suspendido su apoyo por alguna razón justificable.\n• Recibir del Sistema Estatal una respuesta en los 30 días hábiles, después de haber entregado sus documentos y haber sido aceptado dentro del programa.\n11.2. OBLIGACIONES\n1.- Proporcionar la información socioeconómica bajo protesta de decir verdad que les sea requerida por el\nDIF Guerrero, en los términos que establezca la normatividad correspondiente.\n2.- Utilizar los apoyos para los fines con que fueron autorizados evitando cualquier uso distinto de la misma.\n3.- Permitir la visita con la finalidad de validar la información proporcionada en sus expedientes correspondientes.\n4. - Facilitar los trabajos de verificación, en cualquier momento después de otorgado el apoyo.\n11.3. SANCIONES\nLos beneficiarios y las beneficiarlas del programa de Adquisición y Donación de Sillas de ruedas que incumplan en la Disposiciones Normativas, establecidas en los numerales 6.2 y 6.3, para acceder a los beneficios que a través de estos se otorgan, perderán las prerrogativas que dichas disposiciones establecen.\n12. INTERPRETACIÓN\nLa interpretación de las presentes Reglas de Operación para efectos administrativos, estarán a cargo del\nDIF Guerrero, así como de la Contraloría General del Estado, en el ámbito de sus respectivas competencias\nTRANSITORIOS\nPrimero: El presente acuerdo entrará en vigor al día siguiente de su publicación en el Periódico Oficial del\nOPERACIÓN PARA, EL EJERCICIO FISCAL 2019\nSegundo: Las Reglas de Operación del Programa Adquisición y Donación de Aparatos Funcionales para, el Ejercicio Fiscal 2019, se publican en su totalidad para mejor entendimiento.\nTercero: Quedan abrogadas las Reglas de Operación del Programa Adquisición y Donación de Aparatos\nDado en la Oficina del Titular del Sistema para el Desarrollo Integral de la Familia, ubicada en las\nInstalaciones del Centro de Rehabilitación Guerrero, Boulevard René Juárez Cisneros S/N, Ciudad de los\nServicios, No. 62, Col. Recursos Hidráulicos, en la Ciudad de Chilpancingo de los Bravo, Capital del Estado de Guerrero, a los 25 días del mes de enero de dos mil diecinueve.\nESTADO DE GUERRERO.\nLic. José Francisco Solís Solís.\nRúbrica.\nOPERACIÓN PARA, EL EJERCICIO FISCAL 2019\nOPERACIÓN PARA, EL EJERCICIO FISCAL 2019",
  "ordenamiento": "PROGRAMA",
  "jurisdiccion": "GUERRERO",
  "fuente_oficial": "DIARIO OFICIAL DE LA FEDERACION",
  "Fecha de Publicación": "25 DE SEPTIEMBRE DE 2020",
  "ULTIMA REFORMA PUBLICADA": null,
  "status": "VIGENTE",
  "es_escaneado": false,
  "tiene_tablas": true,
  "materia": [
    "general"
  ]
}