{
  "titulo": "Acuerdo del Licenciado Certificado Arturo Latabán López, Auditor General del Estado, por el Que Se R",
  "Contenido": "EVALUACION DE LA AUDITORÍA GENERAL DEL ESTADO DEL H.\nCONGRESO DEL ESTADO DE GUERRERO, EN SESIÓN DE FECHA\nCATORCE DE AGOSTO DE DOS MIL DOCE, LO ANTERIOR PARA\nNÚMERO 1028 DE FISCALIZACIÓN SUPERIOR Y RENDICION DE\nCUENTAS DEL ESTADO DE GUERRERO\nABROGADO POR EL ARTÍCULO SEGUNDO TRANSITORIO DEL REGLAMENTO INTERIOR DE LA AUDITORÍA\nSUPERIOR DEL ESTADO DE GUERRERO, PUBLICADO EN EL PERIÓDICO OFICIAL DEL GOBIERNO DEL ESTADO No. 78,\nEL VIERNES 28 DE SEPTIEMBRE DE 2018.\nTEXTO ORIGINAL.\nAcuerdo publicado en el Periódico Oficial del Gobierno del Estado No. 86 Alcance I, el Viernes\n26 de Octubre de 2012.\nAUDITORÍA GENERAL\nDEL ESTADO\nACUERDO DEL LICENCIADO CERTIFICADO ARTURO LATABÁN LÓPEZ, AUDITOR GENERAL DEL\nESTADO, POR EL QUE SE REFORMA EL REGLAMENTO INTERIOR DE LA AUDITORIA GENERAL\nAPROBADO POR LA COMISION DE VIGILANCIA Y EVALUACION DE LA AUDITORIA GENERAL\nDEL ESTADO DEL H. CONGRESO DEL ESTADO DE GUERRERO, EN SESION DE FECHA\nCATORCE DE AGOSTO DE DOS MIL DOCE, LO ANTERIOR PARA SU APROBACION EN\nTERMINOS DE LO ESTABLECIDO EN LA LEY NUMERO 1028 DE FISCALIZACION SUPERIOR Y\nRENDICION DE CUENTAS DEL ESTADO DE GUERRERO.\nEL LICENCIADO CERTIFICADO ARTURO LATABÁN LÓPEZ, AUDITOR GENERAL DEL\nESTADO, EN USO DE LAS FACULTADES QUE ME CONFIEREN LOS ARTÍCULOS 107 DE LA\nORGÁNICA DEL PODER LEGISLATIVO DEL ESTADO; 1, 2 FRACCION I, XXII, 78, 90 FRACCIONES XI\ny XII, 91 Y 185 FRACCION VII DE LA LEY NÚMERO 1028 DE FISCALIZACIÓN SUPERIOR Y\nRENDICIÓN DE CUENTAS DEL ESTADO DE GUERRERO; Y:\nPRIMERO.- EN TÉRMINOS DE LO ESTABLECIDO POR LOS ARTÍCULOS 107 FRACCIÓN IV,\nDE GUERRERO Y 11 DE LA LEY DE FISCALIZACIÓN SUPERIOR DEL ESTADO, CON FECHA\nVEINTE DE DICIEMBRE DEL AÑO DOS MIL DIEZ, FUI NOMBRADO AUDITOR GENERAL DE LA\nAUDITORIA GENERAL DEL ESTADO, POR LA QUINCUAGÉSIMA NOVENA LEGISLATURA DEL\nEVALUACION DE LA AUDITORÍA GENERAL DEL ESTADO DEL H.\nCONGRESO DEL ESTADO DE GUERRERO, EN SESIÓN DE FECHA\nCATORCE DE AGOSTO DE DOS MIL DOCE, LO ANTERIOR PARA\nNÚMERO 1028 DE FISCALIZACIÓN SUPERIOR Y RENDICION DE\nCUENTAS DEL ESTADO DE GUERRERO\nSEGUNDO.- QUE EL ARTICULO 2 FRACCIONES I, IV Y XXII DE LA LEY NÚMERO 1028 DE\nFISCALIZACIÓN SUPERIOR Y RENDICIÓN DE CUENTAS DEL ESTADO DE GUERRERO,\nESTABLECEN QUE PARA EFECTO DE DICHA LEY, SE ENTENDERA POR:\n\"... I.- AUDITORIA GENERAL: LA AUDITORIA GENERAL DEL ESTADO;\n... IV.- COMISION DE VIGILANCIA: LA COMISION DE VIGILANCIA Y EVALUACION DE LA\nAUDITORIA GENERAL DEL H. CONGRESO DEL ESTADO;\n... XXII.- REGLAMENTO: EL REGLAMENTO INTERIOR DE LA AUDITORIA GENERAL...\"\nTERCERO.- QUE EL ARTÍCULO 90 FRACCION XI DE LA LEY NÚMERO 1028 DE\nFISCALIZACIÓN SUPERIOR Y RENDICIÓN DE CUENTAS DEL ESTADO DE GUERRERO,\nESTABLECE QUE ES FACULTAD DEL AUDITOR GENERAL, ELABORAR Y SOMETER A LA\nRATIFICACION DE LA COMISION DE VIGILANCIA, EL REGLAMENTO INTERIOR DE LA AUDITORIA\nGENERAL, Y REMITIRLO PARA SU PUBLICACION EN EL PERIODICO OFICIAL DEL GOBIERNO DEL\nESTADO Y EN SU FRACCION XII SE LE FACULTA PARA EMITIR LOS REGLAMENTOS, MANUALES\nDE ORGANIZACIÓN Y DE PROCEDIMIENTOS ADMINISTRATIVOS NECESARIOS PARA EL\nADECUADO FUNCIONAMIENTO DE LA AUDITORIA GENERAL.\nCUARTO.- QUE EL ARTÍCULO 185 FRACCION VII DE LA LEY NÚMERO 1028 DE\nFISCALIZACIÓN SUPERIOR Y RENDICIÓN DE CUENTAS DEL ESTADO DE GUERRERO;\nESTABLECE QUE EN MATERIA DE COORDINACION CON LA AUDITORIA GENERAL, LA COMISION\nDE VIGILANCIA TENDRA LAS ATRIBUCIONES SIGUIENTES:\n\"...VII.- APROBAR EL REGLAMENTO INTERNO DE LA AUDITORIA GENERAL...\"\nQUINTO.- QUE EL ARTICULO CUARTO TRANSITORIO DE LA LEY NUMERO 1028 DE\nFISCALIZACION SUPERIOR Y RENDICION DE CUENTAS DEL ESTADO DE GUERRERO,\nDE LA ENTRADA EN VIGOR DE DICHA LEY.\nSEXTO.- QUE MEDIANTE ACUERDO DE FECHA VEINTIOCHO DE MAYO DE DOS MIL\nDOCE, EL AUDITOR GENERAL DEL ESTADO, EMITIO EL REGLAMENTO INTERIOR DE LA\nAUDITORIA GENERAL DEL ESTADO, LO ANTERIOR PARA QUE PREVIA APROBACION Y\nEN EL PERIODICO OFICIAL DEL ESTADO DE GUERRERO, MISMO QUE FUE PRESENTADO ANTE\nEVALUACION DE LA AUDITORÍA GENERAL DEL ESTADO DEL H.\nCONGRESO DEL ESTADO DE GUERRERO, EN SESIÓN DE FECHA\nCATORCE DE AGOSTO DE DOS MIL DOCE, LO ANTERIOR PARA\nNÚMERO 1028 DE FISCALIZACIÓN SUPERIOR Y RENDICION DE\nCUENTAS DEL ESTADO DE GUERRERO\nDICHA COMISION, EL DIA VEINTINUEVE DE MAYO DEL AÑO EN CURSO EN CUMPLIMIENTO A LO\nESTABLECIDO EN EL ARTICULO CUARTO TRANSITORIO DE LA LEY NUMERO 1028 DE\nFISCALIZACION SUPERIOR Y RENDICION DE CUENTAS DEL ESTADO DE GUERRERO.\nSEPTIMO.- QUE MEDIANTE ACUERDO DE FECHA TREINTA DE JUNIO DE DOS MIL DOCE\nEMITIDO EN ALCANCE AL SEÑALADO EN EL CONSIDERANDO ANTERIOR, SE MODIFICO EL\nREGLAMENTO INTERIOR DE LA AUDITORIA GENERAL DEL ESTADO PRESENTADO PARA SU\nAPROBACION ANTE LA COMISION DE VIGILANCIA Y EVALUACION DE LA AUDITORIA GENERAL\nDEL ESTADO DEL H. CONGRESO DEL ESTADO DE GUERRERO, MISMO QUE QUEDO\nDEBIDAMENTE APROBADO POR DICHA COMISION, EN SESION DE FECHA CATORCE DE\nAGOSTO DEL AÑO EN CURSO, LO QUE FUE COMUNICADO POR LA DIPUTADA LIC. GUADALUPE\nGOMEZ MAGANDA BERMEO, EN SU CARÁCTER DE PRESIDENTA DE LA COMISION DE\nVIGILANCIA Y EVALUACION DE LA AUDITORIA GENERAL DEL ESTADO, MEDIANTE OFICIO DE\nFECHA HCEG/GGMB/130/2012, DE FECHA CATORCE DE AGOSTO DEL AÑO EN CURSO.\nOCTAVO.- QUE MEDIANTE OFICIO NUMERO AGE/0863/2012, DE FECHA DIECISIETE DE\nAGOSTO DE DOS MIL DOCE, EMITIDO POR EL AUDITOR GENERAL DEL ESTADO Y DIRIGIDO AL\nLIC. HUMBERTO SALGADO GOMEZ, SECRETARIO GENERAL DEL GOBIERNO DEL ESTADO, SE\nSOLICITO TUVIERA A BIEN ORDENAR LA PUBLICACION DEL REGLAMENTO INTERIOR DE LA\nAUDITORIA GENERAL DEL ESTADO A QUE SE REFIERE EL CONSIDERANDO ANTERIOR, MISMO\nQUE SE ENCUENTRA PENDIENTE DE PUBLICACION.\nNOVENO.- TOMANDO EN CUENTA, QUE LA EVOLUCIÓN PERMANENTE DE LA\nDEMOCRACIA EN NUESTRO ESTADO, EXIGE EL PERFECCIONAMIENTO DE LOS MECANISMOS\nDE FISCALIZACIÓN, PARA DOTAR A LOS ORGANOS ENCARGADOS DE EJERCER ESA FUNCION,\nLAS FACULTADES NECESARIAS PARA LLEVAR A CABO CON EFICIENCIA Y TRANSPARENCIA, LA\nREVISION Y EVALUACION DEL EJERCICIO DE LA GESTIÓN PÚBLICA POR PARTE DE LOS\nGOBERNANTES, ES INCUESTIONABLE, QUE RESULTA NECESARIO REFORMAR EL\nREGLAMENTO INTERIOR DE LA AUDITORIA GENERAL DEL ESTADO, AL QUE DEBERA\nSUJETARSE LA INTEGRACION, ORGANIZACIÓN Y FUNCIONAMIENTO DE DICHO ORGANO\nFISCALIZACIÓN SUPERIOR, LO ANTERIOR CON EL PROPOSITO PRIMORDIAL DE FORTALECER\nLAS FACULTADES DE LA AUDITORÍA GENERAL DEL ESTADO (AGE), PARA EJERCER DE FORMA\nMANEJO DE LOS RECURSOS PÚBLICOS, ASI COMO PARA EN SU CASO, FINCAR LAS\nRESPONSABILIDADES QUE PROCEDAN A LAS REFERIDAS ENTIDADES, CUANDO INCURRAN EN\nIRREGULARIDADES EN LA APLICACIÓN DE DICHOS RECURSOS.\nEVALUACION DE LA AUDITORÍA GENERAL DEL ESTADO DEL H.\nCONGRESO DEL ESTADO DE GUERRERO, EN SESIÓN DE FECHA\nCATORCE DE AGOSTO DE DOS MIL DOCE, LO ANTERIOR PARA\nNÚMERO 1028 DE FISCALIZACIÓN SUPERIOR Y RENDICION DE\nCUENTAS DEL ESTADO DE GUERRERO\nEN ESE SENTIDO, SIENDO ANTE TODO, LA AUDITORÍA GENERAL DEL ESTADO, UN\nORGANO TECNICO AUXILIAR DEL PODER LEGISLATIVO, QUE SE ENCARGA DE ESTABLECER\nLOS MECANISMOS LEGALES, FINANCIEROS Y TÉCNICOS NECESARIOS PARA LA FUNCION DE\nFISCALIZACIÓN, ES NECESARIO REESTRUCTURAR Y COMPLEMENTAR EL MARCO LEGAL EN EL\nQUE CON LIBERTAD DE GESTIÓN Y CON AUTONOMÍA TÉCNICA LLEVE A CABO DE MANERA\nINDEPENDIENTE LOS TRABAJOS DE FISCALIZACIÓN QUE LA LEY DE LA MATERIA LE ATRIBUYE,\nESPECIFICAMENTE RESPECTO DE LA RENDICION DE CUENTAS DE LOS PODERES DEL ESTADO,\nAYUNTAMIENTOS Y ENTES PÚBLICOS ESTATALES Y MUNICIPALES.\nPOR LAS CONSIDERACIONES ANTERIORES, EL AUDITOR GENERAL DEL ESTADO DE\nGUERRERO, ACUERDA:\nPRIMERO.- EN USO DE LAS FACULTADES QUE ME CONFIEREN LAS FRACCIONES XI Y\nXII DEL ARTICULO 90 DE LA LEY NUMERO 1028 DE FISCALIZACION SUPERIOR Y RENDICION DE\nCUENTAS DEL ESTADO DE GUERRERO Y EN CUMPLIMIENTO A LO ESTABLECIDO EN EL\nARTICULO CUARTO DE DICHA LEY; SE ACUERDA REFORMAR EL REGLAMENTO INTERIOR DE\nLA AUDITORIA GENERAL DEL ESTADO, APROBADO POR LA COMISION DE VIGILANCIA Y\nEVALUACION DEL H. CONGRESO DEL ESTADO DE GUERRERO, EN SESION DE FECHA CATORCE\nDE AGOSTO DEL AÑO EN CURSO, LO ANTERIOR PARA QUEDAR EN LOS SIGUIENTES\nTERMINOS:\n\"REGLAMENTO INTERIOR DE LA\nAUDITORÍA GENERAL DEL\nESTADO DE GUERRERO\nTÍTULO I\nDISPOSICIONES GENERALES\nCAPÍTULO ÚNICO\nDISPOSICIONES GENERALES\nTÍTULO II\nINTEGRACIÓN Y ORGANIZACIÓN\nDE LA AUDITORIA GENERAL\nEVALUACION DE LA AUDITORÍA GENERAL DEL ESTADO DEL H.\nCONGRESO DEL ESTADO DE GUERRERO, EN SESIÓN DE FECHA\nCATORCE DE AGOSTO DE DOS MIL DOCE, LO ANTERIOR PARA\nNÚMERO 1028 DE FISCALIZACIÓN SUPERIOR Y RENDICION DE\nCUENTAS DEL ESTADO DE GUERRERO\nDEL ESTADO\nCAPÍTULO PRIMERO\nINTEGRACIÓN DE LA AUDITORÍA\nGENERAL\nCAPÍTULO SEGUNDO\nORGANIZACIÓN DE LA AUDITORÍA\nGENERAL\nTÍTULO III\nCOMPETENCIAS Y ATRIBUCIONES\nDE LAS UNIDADES ADMINISTRATIVAS\nCAPÍTULO PRIMERO\nATRIBUCIONES DEL AUDITOR\nGENERAL\nCAPÍTULO SEGUNDO\nCOMPETENCIA DE LOS\nAUDITORES ESPECIALES\nCAPÍTULO TERCERO\nATRIBUCIONES GENERALES\nDE LOS AUDITORES ESPECIALES\nCAPÍTULO CUARTO\nATRIBUCIONES ESPECÍFICAS\nDE LOS AUDITORES ESPECIALES\nDEL SECTOR AYUNTAMIENTOS, DEL\nSECTOR GOBIERNO, Y DE\nORGANISMOS PUBLICOS\nDESCENTRALIZADOS\nY ORGANOS AUTONOMOS\nEVALUACION DE LA AUDITORÍA GENERAL DEL ESTADO DEL H.\nCONGRESO DEL ESTADO DE GUERRERO, EN SESIÓN DE FECHA\nCATORCE DE AGOSTO DE DOS MIL DOCE, LO ANTERIOR PARA\nNÚMERO 1028 DE FISCALIZACIÓN SUPERIOR Y RENDICION DE\nCUENTAS DEL ESTADO DE GUERRERO\nCAPÍTULO QUINTO\nATRIBUCIONES ESPECÍFICAS DEL\nAUDITOR ESPECIAL\nDE EVALUACIÓN DEL DESEMPEÑO\nCAPÍTULO SEXTO\nATRIBUCIONES DEL DIRECTOR DE\nASUNTOS JURÍDICOS\nCAPÍTULO SÉPTIMO\nATRIBUCIONES DEL DIRECTOR DE\nADMINISTRACIÓN Y FINANZAS\nTÍTULO IV\nÓRGANOS AUXILIARES DEL AUDITOR\nGENERAL\nCAPÍTULO PRIMERO\nATRIBUCIONES DEL ÓRGANO\nDE CONTROL\nTÍTULO V\nÓRGANOS AUXILIARES DE LAS\nAUDITORIAS ESPECIALES\nCAPÍTULO PRIMERO\nATRIBUCIONES DE LAS DIRECCIONES\nCAPÍTULO SEGUNDO\nATRIBUCIONES DE LAS\nSUBDIRECCIONES\nCAPÍTULO TERCERO\nATRIBUCIONES DE LOS SUPERVISORES\nDE AUDITORÍA\nEVALUACION DE LA AUDITORÍA GENERAL DEL ESTADO DEL H.\nCONGRESO DEL ESTADO DE GUERRERO, EN SESIÓN DE FECHA\nCATORCE DE AGOSTO DE DOS MIL DOCE, LO ANTERIOR PARA\nNÚMERO 1028 DE FISCALIZACIÓN SUPERIOR Y RENDICION DE\nCUENTAS DEL ESTADO DE GUERRERO\nCAPITULO CUARTO\nATRIBUCIONES DEL SUPERVISOR DE\nEVALUACIÓN\nCAPÍTULO QUINTO\nATRIBUCIONES DE LOS AUDITORES\nTÍTULO VI\nSUBDIRECCIONES Y AUXILIARES DEL\nAUDITOR GENERAL\nTÍTULO VII\nSUPLENCIA DE LOS FUNCIONARIOS\nDE LA AUDITORÍA GENERAL\nCAPÍTULO ÚNICO\nDISPOSICIONES GENERALES\nTÍTULO VIII\nINFRACCIONES DE LOS SERVIDORES\nPÚBLICOS\nDE LA AUDITORÍA GENERAL\nCAPÍTULO ÚNICO\nDISPOSICIONES GENERALES\nREGLAMENTO INTERIOR DE LA\nAUDITORIA GENERAL\nDEL ESTADO DE GUERRERO\nTÍTULO I\nDISPOSICIONES GENERALES\nCAPÍTULO ÚNICO\nDISPOSICIONES GENERALES\nEVALUACION DE LA AUDITORÍA GENERAL DEL ESTADO DEL H.\nCONGRESO DEL ESTADO DE GUERRERO, EN SESIÓN DE FECHA\nCATORCE DE AGOSTO DE DOS MIL DOCE, LO ANTERIOR PARA\nNÚMERO 1028 DE FISCALIZACIÓN SUPERIOR Y RENDICION DE\nCUENTAS DEL ESTADO DE GUERRERO\nARTÍCULO 1.- El presente reglamento es de orden público y observancia obligatoria para los servidores públicos de la Auditoría General del Estado Guerrero. Tiene por objeto regular las de Fiscalización Superior y Rendición de Cuentas del Estado de Guerrero y demás ordenamientos legales aplicables, en materia de integración, organización, funcionamiento y atribuciones de los órganos, unidades administrativas y servidores públicos de la Auditoría General.\nARTÍCULO 2.- Para los efectos del presente Reglamento, se entenderá por:\nI. Auditor General: Al Titular de la Auditoría General del Estado;\nII. Auditoría General: A la Auditoría General;\nIII. Comisión de Presupuesto: A la Comisión de Presupuesto y Cuenta Pública del H. Congreso del Estado;\nIV. Comisión de Vigilancia: A la Comisión de Vigilancia y Evaluación de la Auditoría General del\nH. Congreso del Estado;\nV. Entidades Fiscalizables: A las señaladas en el artículo 2 fracción VIII de la Ley 1028 de\nFiscalización Superior y Rendición de Cuentas del Estado de Guerrero;\nVI. Ley de Fiscalización: A la Ley número 1028 de Fiscalización Superior y Rendición de\nCuentas del Estado de Guerrero;\nVII. Ley de Responsabilidades: A la Ley número 564 de Responsabilidades de los Servidores\nPúblicos del Estado de Guerrero;\nVIII. Ley de Transparencia: A la Ley número 374 de Transparencia y Acceso a la Información\nPública del Estado;\nIX. Ley de Trabajo: A la Ley número 248 de Trabajo de los Servidores Públicos del Estado de\nGuerrero; y\nX. Reglamento: Al Reglamento Interior de la Auditoría General.\nTÍTULO II\nINTEGRACIÓN Y ORGANIZACIÓN\nDE LA AUDITORÍA GENERAL\nDEL ESTADO\nCAPÍTULO PRIMERO\nINTEGRACIÓN DE LA AUDITORÍA\nGENERAL\nEVALUACION DE LA AUDITORÍA GENERAL DEL ESTADO DEL H.\nCONGRESO DEL ESTADO DE GUERRERO, EN SESIÓN DE FECHA\nCATORCE DE AGOSTO DE DOS MIL DOCE, LO ANTERIOR PARA\nNÚMERO 1028 DE FISCALIZACIÓN SUPERIOR Y RENDICION DE\nCUENTAS DEL ESTADO DE GUERRERO\nARTÍCULO 3.- Para el ejercicio de sus atribuciones, la Auditoría General se integrará con:\nI. Un Auditor General;\nII. Cuatro Auditores Especiales;\nIII. Un Director de Asuntos Jurídicos;\nIV. Un Director de Administración y Finanzas, y\nV. Los demás órganos auxiliares y servidores públicos necesarios para el adecuado cumplimiento de sus objetivos, de conformidad con lo dispuesto por este Reglamento.\nARTÍCULO 4.- Para el adecuado cumplimiento de sus atribuciones, la Auditoría General se compone por las siguientes Auditorías Especiales:\nI. Auditoría Especial del Sector Ayuntamientos;\nII. Auditoría Especial del Sector Gobierno;\nIII. Auditoría Especial de Organismos Públicos Descentralizados y Órganos Autónomos; y\nIV. Auditoría Especial de Evaluación del Desempeño.\nAl frente de cada una habrá un Auditor Especial, con las competencias establecidas por la Ley de Fiscalización y el presente Reglamento, cuya adscripción se determinará mediante oficio signado por el Auditor General.\nCAPÍTULO SEGUNDO\nORGANIZACIÓN DE LA AUDITORÍA\nGENERAL\nArtículo 5.- Para el despacho de los asuntos que le competen, la Auditoría General se organizará en las Unidades Administrativas siguientes:\nI. Oficina del Auditor General\nI. Órgano de Control.\nII. Auditoría Especial del Sector Ayuntamientos.\nI. Dirección de Auditoría Financiera;\nII. Dirección de Auditoría de Obra Pública;\nIII. Dirección de Solventación;\nEVALUACION DE LA AUDITORÍA GENERAL DEL ESTADO DEL H.\nCONGRESO DEL ESTADO DE GUERRERO, EN SESIÓN DE FECHA\nCATORCE DE AGOSTO DE DOS MIL DOCE, LO ANTERIOR PARA\nNÚMERO 1028 DE FISCALIZACIÓN SUPERIOR Y RENDICION DE\nCUENTAS DEL ESTADO DE GUERRERO\nIV. Subdirección de Auditoría Financiera;\nV. Subdirección de Auditoría a Recursos Federalizados;\nVI. Subdirección de Auditoría de Obra Pública;\nVII. Subdirección de Solventación;\nVIII. Subdirección de informática y tecnologías de la información;\nIX. Jefes de Departamento;\nX. Supervisores; y\nXI. Auditores.\nIII. Auditoría Especial del Sector Gobierno.\nI. Dirección de Auditoría Financiera;\nII. Dirección de Auditoría de Obra Pública;\nIII. Dirección de Solventación;\nIV. Subdirección de Auditoría Financiera;\nV. Subdirección de Auditoría a Recursos Federalizados;\nVI. Subdirección de Auditoría de Obra Pública;\nVII. Subdirección de Solventación;\nVIII. Subdirección de informática y tecnologías de la información;\nIX. Jefes de Departamento;\nX. Supervisores; y\nXI. Auditores.\nIV. Auditoría Especial de Organismos Públicos Descentralizados y Órganos Autónomos.\nI. Dirección de Auditoría Financiera;\nII. Dirección de Auditoría de Obra Pública;\nIII. Dirección de Solventación;\nIV. Subdirección de Auditoría Financiera;\nV. Subdirección de Auditoría a Recursos Federalizados;\nVI. Subdirección de Auditoría de Obra Pública;\nVII. Subdirección de Solventación;\nVIII. Subdirección de informática y tecnologías de la información;\nIX. Jefes de Departamento;\nX. Supervisores; y\nXI. Auditores.\nEVALUACION DE LA AUDITORÍA GENERAL DEL ESTADO DEL H.\nCONGRESO DEL ESTADO DE GUERRERO, EN SESIÓN DE FECHA\nCATORCE DE AGOSTO DE DOS MIL DOCE, LO ANTERIOR PARA\nNÚMERO 1028 DE FISCALIZACIÓN SUPERIOR Y RENDICION DE\nCUENTAS DEL ESTADO DE GUERRERO\nV. Auditoría Especial de Evaluación del Desempeño.\nI. Dirección de auditoria de Evaluación al desempeño a poderes del estado, organismos para estatales y autónomos;\nII. Dirección de Normatividad y Control de Calidad;\nIII. Dirección auditoria de evaluación al desempeño a municipios;\nIV. Subdirección de informática y tecnologías de la información;\nV. Subdirección de Evaluación al Desempeño;\nVI. Subdirección de Control de Calidad a entidades fiscalizables;\nVII. Jefes de departamento;\nVIII. Supervisores; y\nIX. Auditores.\nVI. Dirección de Asuntos Jurídicos.\nI. Subdirección de lo Contencioso Administrativo;\nII. Subdirección de Asuntos Jurídicos;\nIII. Subdirección Jurídica Resarcitoria; y\nIV. Departamento de Notificaciones.\nVII. Dirección de Administración y Finanzas.\nI. Subdirección de Administración;\nII. Subdirector de Recursos Financieros; y\nIII. Subdirector de Recursos Humanos.\nEl Auditor General contará además con el apoyo de las siguientes unidades administrativas:\nCoordinación General Técnica, Coordinación de Asesores, Coordinación de Planeación Estratégica, Coordinación de Relaciones Interinstitucionales, Coordinación de Transparencia, Acceso a la Información\nPública y Rendición de Cuentas, la Coordinación del Servicio Civil de Carrera y la Coordinación de\nInformática y Desarrollo Tecnológico, las cuales realizarán las funciones que se señalen en el correspondiente Manual de Organización.\nARTÍCULO 6.- Los trabajadores que cuenten con nombramiento de base y que sean promovidos a un puesto de confianza, deberán solicitar licencia al nombramiento de base en términos de la Ley de\nTrabajo, por el tiempo en que permanezca en el puesto de confianza.\nEVALUACION DE LA AUDITORÍA GENERAL DEL ESTADO DEL H.\nCONGRESO DEL ESTADO DE GUERRERO, EN SESIÓN DE FECHA\nCATORCE DE AGOSTO DE DOS MIL DOCE, LO ANTERIOR PARA\nNÚMERO 1028 DE FISCALIZACIÓN SUPERIOR Y RENDICION DE\nCUENTAS DEL ESTADO DE GUERRERO\nARTÍCULO 7.- Los servidores públicos de la Auditoría General deberán observar el Código de\nÉtica que al efecto expida el Auditor General.\nARTÍCULO 8.- La Auditoría General conducirá sus actividades en forma planificada y conforme a las políticas que para el logro de los objetivos institucionales establezca el Auditor General, con la supervisión de la Comisión de Vigilancia, conforme a lo dispuesto en los artículos 193 y 194 de la Ley de\nFiscalización.\nARTÍCULO 9.- La Auditoría General tendrá los siguientes comités:\nI. Comité de Administración del Fondo de Afianzamiento para los Servidores Públicos;\nII. Comité de Administración del Fondo para el Fortalecimiento de la Fiscalización;\nIII. Comité de Consulta y Análisis de las Estrategias Institucionales;\nIV. Comité de Adquisiciones, Arrendamientos y Servicios; y\nV. Los demás que estime convenientes para la adecuada coordinación y desarrollo de sus actividades.\nLos comités a que se refieren la fracciones II y IV sesionarán de manera excepcional cuando sea necesario para la atención de los asuntos de su ámbito de competencia.\nARTÍCULO 10.- El Comité de Administración del Fondo de Afianzamiento para los Servidores\nPúblicos se integrará por: el Auditor General, quien lo presidirá; los Auditores Especiales; el Director de\nAsuntos Jurídicos y el Director de Administración y Finanzas de la Auditoría General. Éste último fungirá como Secretario Técnico.\nPor mayoría de votos de sus integrantes, expedirá su reglamento y los acuerdos que estimen convenientes para la correcta administración y destino del patrimonio del Fondo, así como los lineamientos, criterios y montos para el otorgamiento de garantías de los servidores públicos de las entidades fiscalizables.\nEl Comité sesionará por lo menos una vez cada tres meses o en forma extraordinaria, previa convocatoria del Auditor General, para tratar los asuntos relacionados con el ámbito de su competencia.\nLas decisiones del Comité se tomarán por mayoría de votos de sus integrantes.\nArtículo 11.- El Comité de Administración del Fondo para el Fortalecimiento de la Fiscalización se integrará por el Auditor General; los Auditores Especiales; el Director de Asuntos Jurídicos y el\nEVALUACION DE LA AUDITORÍA GENERAL DEL ESTADO DEL H.\nCONGRESO DEL ESTADO DE GUERRERO, EN SESIÓN DE FECHA\nCATORCE DE AGOSTO DE DOS MIL DOCE, LO ANTERIOR PARA\nNÚMERO 1028 DE FISCALIZACIÓN SUPERIOR Y RENDICION DE\nCUENTAS DEL ESTADO DE GUERRERO\nDirector de Administración y Finanzas. Todos ellos con derecho a voz y voto. También participarán con derecho a voz pero sin voto, el Coordinador General Técnico, y el Titular del Órgano de Control de la\nAuditoría General. Este Comité lo presidirá el Auditor General y fungirá como Secretario Técnico el\nDirector de Asuntos Jurídicos.\nPor mayoría de votos de sus integrantes, expedirá su reglamento y los acuerdos, lineamientos y criterios que estimen convenientes para la correcta administración y destino del patrimonio del Fondo.\nEl Comité sesionará por lo menos una vez cada mes o en forma extraordinaria, previa convocatoria del Auditor General, para tratar los asuntos relacionados con el ámbito de su competencia.\nLas decisiones del Comité se tomarán por mayoría de votos de sus integrantes.\nArtículo 12. El Comité de Consulta y Análisis de las Estrategias Institucionales se integrará por: el Auditor General, los Auditores Especiales; el Director de Asuntos Jurídicos, y el Director de\nAdministración y Finanzas. Todos ellos con derecho a voz y voto. También participarán con derecho a voz pero sin voto, el Coordinador General Técnico; el Titular de la Unidad de Planeación Estratégica; el\nTitular de la Unidad de Transparencia, Acceso a la Información Pública y Rendición de Cuentas, y el\nTitular del Órgano de Control. Este Comité lo presidirá el Auditor General y fungirá como Secretario\nTécnico el Titular de la Unidad de Planeación Estratégica.\nPor mayoría de votos de sus integrantes, expedirá su reglamento y los acuerdos, lineamientos y criterios que estimen convenientes para el adecuado cumplimiento de sus atribuciones.\nEl Comité sesionará por lo menos una vez al mes, previa convocatoria del Auditor General, para tratar los asuntos relacionados con el ámbito de su competencia.\nLas decisiones del Comité se tomarán por mayoría de votos de sus integrantes.\nArtículo 13.- El Comité de Adquisiciones, Arrendamientos y Servicios se integrará por: el Auditor\nGeneral; los Auditores Especiales; el Director de Asuntos Jurídicos, y el Director de Administración y\nFinanzas. Todos ellos con derecho a voz y voto. También participarán con derecho a voz pero sin voto, el\nCoordinador General Técnico; el Titular de la Unidad de Transparencia, Acceso a la Información Pública y\nRendición de Cuentas, y el Titular del Órgano de Control. Este Comité lo presidirá el Auditor General y fungirá como Secretario Técnico el Director de Administración y Finanzas.\nEVALUACION DE LA AUDITORÍA GENERAL DEL ESTADO DEL H.\nCONGRESO DEL ESTADO DE GUERRERO, EN SESIÓN DE FECHA\nCATORCE DE AGOSTO DE DOS MIL DOCE, LO ANTERIOR PARA\nNÚMERO 1028 DE FISCALIZACIÓN SUPERIOR Y RENDICION DE\nCUENTAS DEL ESTADO DE GUERRERO\nPor mayoría de votos de sus integrantes, expedirá su reglamento y los acuerdos, lineamientos y criterios que estimen convenientes para el adecuado cumplimiento de sus atribuciones.\nEl Comité sesionará por lo menos una vez cada tres meses o en forma extraordinaria, previa convocatoria del Auditor General, para tratar los asuntos relacionados con el ámbito de su competencia.\nLas decisiones del Comité se tomarán por mayoría de votos de sus integrantes.\nTÍTULO III\nCOMPETENCIAS Y ATRIBUCIONES\nDE LAS UNIDADES\nADMINISTRATIVAS\nCAPÍTULO PRIMERO\nATRIBUCIONES DEL AUDITOR\nGENERAL\nARTÍCULO 14.- El Auditor General tiene las atribuciones establecidas en el artículo 90 de la Ley de Fiscalización. Para el adecuado ejercicio de las mismas y la optimización del trabajo, podrá ejercer sus facultades de manera directa o delegarlas en los servidores públicos de la Auditoría General, previa emisión del acuerdo respectivo, excepto las que la propia Ley de Fiscalización y el presente Reglamento le confieran de forma indelegable.\nARTÍCULO 15.- Son atribuciones indelegables del Auditor General las siguientes:\nI. Presentar el Proyecto de Presupuesto Anual y el Programa Operativo Anual de la Auditoría\nGeneral;\nII. Administrar los bienes y recursos a cargo de la Auditoría General, resolver sobre la adquisición y enajenación de bienes muebles y la prestación de servicios; así como gestionar la incorporación, destino o desincorporación de bienes inmuebles, sujetándose a lo previsto en la Ley de\nFiscalización, el presente Reglamento y demás disposiciones legales aplicables en la materia;\nIII. Ejecutar el Programa Anual de Actividades de la Auditoría General;\nIV. Autorizar las nóminas y movimientos del personal de la Auditoría General;\nV. Verificar que se hayan otorgado las garantías por quienes administren o custodien fondos públicos, y fincar las sanciones administrativas que correspondan por su incumplimiento;\nEVALUACION DE LA AUDITORÍA GENERAL DEL ESTADO DEL H.\nCONGRESO DEL ESTADO DE GUERRERO, EN SESIÓN DE FECHA\nCATORCE DE AGOSTO DE DOS MIL DOCE, LO ANTERIOR PARA\nNÚMERO 1028 DE FISCALIZACIÓN SUPERIOR Y RENDICION DE\nCUENTAS DEL ESTADO DE GUERRERO\nVI. Elaborar y someter a la ratificación de la Comisión de Vigilancia, el Reglamento Interior de la\nAuditoría General, en términos del artículo 185 fracción VII de la Ley de Fiscalización, y remitirlo para su publicación en el Periódico Oficial del Gobierno del Estado;\nVII. Expedir los reglamentos y manuales de organización y de procedimientos administrativos necesarios para el adecuado funcionamiento de la Auditoría General;\nVIII. Proponer a la Comisión de Vigilancia para su aprobación, el nombramiento de los Directores de Asuntos Jurídicos y de Administración y Finanzas de la Auditoría General, y removerlos en los términos señalados por la Ley de Fiscalización;\nIX. Realizar los nombramientos y remociones de los demás servidores públicos de la Auditoría\nGeneral, con excepción de los que pertenezcan al Servicio Civil de Carrera;\nX. Entregar al Congreso del Estado por conducto de la Comisión de Presupuesto y Cuenta\nPública, a más tardar el último día del mes de febrero, la Cuenta Pública del presupuesto ejercido por la\nAuditoría General, correspondiente al ejercicio del año inmediato anterior;\nXI. Remitir al Congreso del Estado, por conducto de la Comisión de Presupuesto y Cuenta\nPública y de Vigilancia, en la segunda quincena posterior al cierre de cada semestre de cada año, un\nInforme sobre la situación que guardan las observaciones, recomendaciones vinculantes, las acciones promovidas y el grado de acatamiento de las entidades fiscalizables;\nXII. Establecer las reglas técnicas, procedimientos, métodos, sistemas de contabilidad y archivo de los libros y documentos justificativos y comprobatorios del ingreso y del Gasto Público, que deberán observar las entidades fiscalizables;\nXIII. Solicitar a las entidades fiscalizables la información y el auxilio que se requiera para el ejercicio de la función de fiscalización superior;\nXIV. Ordenar la práctica de Auditorías, así como la realización de visitas e inspecciones necesarias para la evaluación de los Informes Financieros semestrales y la fiscalización de la Cuenta\nPública;\nXV. Formular y entregar a la Comisión de Presupuesto y Cuenta Pública el Informe Anual de\nResultados de la revisión de las cuentas públicas en la segunda quincena del mes de septiembre del año siguiente al que se revise;\nXVI. Fincar directamente a los responsables, según sea el caso, las indemnizaciones, multas y sanciones por las responsabilidades en que incurran, determinadas con motivo de la fiscalización de las cuentas públicas;\nXVII. Celebrar convenios de coordinación o colaboración para el cumplimiento de sus objetivos con autoridades federales, estatales, municipales, con organismos que agrupen a entidades de fiscalización superior homólogas, y con el sector privado;\nXVIII. Conocer y resolver sobre el recurso de reconsideración que se interponga en contra de los actos o resoluciones de la Auditoría General;\nEVALUACION DE LA AUDITORÍA GENERAL DEL ESTADO DEL H.\nCONGRESO DEL ESTADO DE GUERRERO, EN SESIÓN DE FECHA\nCATORCE DE AGOSTO DE DOS MIL DOCE, LO ANTERIOR PARA\nNÚMERO 1028 DE FISCALIZACIÓN SUPERIOR Y RENDICION DE\nCUENTAS DEL ESTADO DE GUERRERO\nXIX. Solicitar a la autoridad competente la aplicación del procedimiento de ejecución para el cobro de las multas y sanciones administrativas y resarcitorias que se impongan en los términos de la Ley de Fiscalización;\nXX. Promover las acciones de responsabilidad a que se refiere el Título Décimo Tercero de la\nXXI. Presentar, en su caso, denuncias o querellas penales, en los casos de presuntas conductas delictivas de servidores públicos o de particulares, relacionadas con daños o perjuicios ocasionados al patrimonio de la Hacienda Pública del Estado o de los Municipios;\nXXII. Formular denuncias de juicio político, de conformidad con lo señalado en el Título Tercero\nXXIII. Imponer las medidas de apremio establecidas en la Ley de Fiscalización;\nXXIV. Imponer las sanciones administrativas al personal de la Auditoría General, por faltas a la\nLey de Fiscalización, al presente Reglamento, a la Ley de Responsabilidades y demás normatividad aplicable;\nXXV. Remitir a la Comisión de Presupuesto y Cuenta Pública y de Vigilancia, durante la última semana del mes de marzo, un Informe en el que se señalen las entidades fiscalizables que cumplieron en tiempo y forma con la entrega de su Cuenta Pública; y\nXXVI. Presidir los comités internos de la Auditoría General y proveer lo necesario para su adecuado funcionamiento;\nCAPÍTULO SEGUNDO\nCOMPETENCIA DE LOS AUDITORES\nESPECIALES\nARTÍCULO 16.- El Auditor Especial del Sector Ayuntamientos, será competente para fiscalizar los informes semestrales y las cuentas públicas de los ayuntamientos y de las demás personas de derecho público y privado, cuando hayan recibido, administrado, custodiado o aplicado por cualquier título recursos públicos municipales.\nARTÍCULO 17.- El Auditor Especial del Sector Gobierno, será competente para fiscalizar los informes semestrales y las cuentas públicas de los Poderes Ejecutivo, Legislativo, Judicial, y de las demás personas de derecho público y privado, cuando hayan recibido, administrado, custodiado o aplicado por cualquier título recursos públicos de las entidades fiscalizables a que se refiere este artículo.\nARTÍCULO 18.- El Auditor Especial de Organismos Públicos Descentralizados y Órganos\nAutónomos, será competente para fiscalizar los informes semestrales y las cuentas públicas de los órganos constitucional o legalmente autónomos, los organismos públicos descentralizados estatales y\nEVALUACION DE LA AUDITORÍA GENERAL DEL ESTADO DEL H.\nCONGRESO DEL ESTADO DE GUERRERO, EN SESIÓN DE FECHA\nCATORCE DE AGOSTO DE DOS MIL DOCE, LO ANTERIOR PARA\nNÚMERO 1028 DE FISCALIZACIÓN SUPERIOR Y RENDICION DE\nCUENTAS DEL ESTADO DE GUERRERO municipales, fideicomisos públicos, estatales, municipales y de las demás personas de derecho público y privado, cuando hayan recibido, administrado, custodiado o aplicado por cualquier título recursos públicos de las entidades fiscalizables a que se refiere este artículo.\nARTÍCULO 19.- El Auditor Especial de Evaluación del Desempeño, será competente para evaluar la gestión y desempeño de las entidades fiscalizables a que se refiere el artículo 2 fracción VIII de la Ley de Fiscalización.\nCAPÍTULO TERCERO\nATRIBUCIONES GENERALES\nDE LOS AUDITORES ESPECIALES\nARTÍCULO 20.- Son atribuciones generales de los Auditores Especiales, además de las previstas en el artículo 95 de la Ley de Fiscalización, las siguientes:\nI. Planear y programar las actividades correspondientes del área a su cargo para la integración del Programa Operativo Anual y someterlo a la autorización del Auditor General;\nII. Realizar la Planeación, conforme a los programas aprobados por el Auditor General, de las actividades relacionadas con la revisión de las cuentas públicas;\nIII. Elaborar; los análisis y documentos temáticos que sirvan de insumo para la preparación de los informes de resultados;\nIV. Revisar, analizar y evaluar los informes financieros semestrales y las cuentas públicas que rindan las entidades fiscalizables;\nV. Participar en forma directa, o a través del personal a su cargo, en los comités que le solicite el\nAuditor General para el funcionamiento y fortalecimiento de la Auditoría General;\nVI. Designar al personal que participará en el procedimiento de recepción de los informes semestrales y las cuentas públicas de las entidades fiscalizables de conformidad con el área de su competencia;\nVII. Recibir y revisar los oficios de respuesta formulados por las entidades fiscalizables para la solventación de observaciones derivadas de la fiscalización de las cuentas públicas y de las auditorías, revisiones, inspecciones y visitas practicadas por la Auditoría General;\nVIII. Elaborar los lineamientos, normas y circulares que deben cumplir las entidades fiscalizables para la solventación de observaciones y recomendaciones, y someterlas a la aprobación del Auditor\nGeneral;\nIX. Revisar la solventación de los pliegos preventivos, de observaciones y recomendaciones\nAuditoría General;\nEVALUACION DE LA AUDITORÍA GENERAL DEL ESTADO DEL H.\nCONGRESO DEL ESTADO DE GUERRERO, EN SESIÓN DE FECHA\nCATORCE DE AGOSTO DE DOS MIL DOCE, LO ANTERIOR PARA\nNÚMERO 1028 DE FISCALIZACIÓN SUPERIOR Y RENDICION DE\nCUENTAS DEL ESTADO DE GUERRERO\nX. Someter a la consideración del Auditor General, el Informe del Índice de Eficiencia de\nSolventación de los pliegos preventivos, de observaciones y de recomendaciones derivadas de la revisión y fiscalización de los informes semestrales y cuentas públicas de las entidades fiscalizables;\nXI. Dar seguimiento a la atención y solventación de las observaciones, recomendaciones vinculantes y acciones promovidas, derivadas de las revisiones, auditorías, inspecciones, visitas y evaluaciones practicadas por la Auditoría General, a las entidades fiscalizables;\nXII. Atender y asesorar a los servidores públicos y a quienes hayan dejado de serlo, acreditados para solventar las observaciones determinadas por la Auditoría General, y coordinarse para ese efecto con la Dirección de Asuntos Jurídicos, cuando sea necesaria su intervención;\nXIII. Determinar si la documentación y demás elementos presentados por las entidades fiscalizables para dar atención a las observaciones, son o no suficientes para aclararlas, justificarlas o solventarlas y someter al acuerdo del Auditor General lo conducente;\nXIV. Diseñar y operar el sistema de control y seguimiento de las observaciones y recomendaciones de los informes semestrales, cuentas públicas y resultados de auditorías, y elaborar los reportes requeridos, para coadyuvar en su debida atención y solventación;\nXV. Formular los Pliegos de Cargos, en el plazo determinado por la normatividad interna, y turnarlos, previo acuerdo y autorización del Auditor General, a la Dirección de Asuntos Jurídicos con la documentación e información necesaria para la instauración de los procedimientos administrativos correspondientes, relacionadas con las observaciones no aclaradas, justificadas o solventadas, por parte de las entidades fiscalizables;\nXVI. Preparar y someter a consideración del Auditor General el Informe mensual de las observaciones financieras; de evaluación de programas y de obra pública y servicios relacionados con la misma, y de las derivadas de auditorías externas subsistentes de las entidades fiscalizables;\nXVII. Coordinar con la Dirección de Administración y Finanzas, la devolución de la documentación original que haya sido presentada por las entidades fiscalizables para solventar las observaciones determinadas por la Auditoría General;\nXVIII. Llevar a cabo las actividades relacionadas con la Información de la fiscalización de los\nSuperior de la Federación;\nXIX. Coordinar la elaboración de los programas específicos de la materia propuestos por el\nAuditor General;\nXX. Presentar al Auditor General, para su acuerdo, los Informes de auditoría derivados de la fiscalización de los recursos federales;\nXXI. Dar seguimiento a las recomendaciones y acciones promovidas, e informar a la Auditoría\nSuperior de la Federación, previa autorización del Auditor General;\nEVALUACION DE LA AUDITORÍA GENERAL DEL ESTADO DEL H.\nCONGRESO DEL ESTADO DE GUERRERO, EN SESIÓN DE FECHA\nCATORCE DE AGOSTO DE DOS MIL DOCE, LO ANTERIOR PARA\nNÚMERO 1028 DE FISCALIZACIÓN SUPERIOR Y RENDICION DE\nCUENTAS DEL ESTADO DE GUERRERO\nXXII. Someter a la consideración del Auditor General, las propuestas que deban presentarse al\nConsejo Estatal de Armonización Contable, en los términos de la Ley General de Contabilidad\nGubernamental;\nXXIII. Coordinarse en el ámbito de su competencia, con la Unidad de Transparencia y Rendición de Cuentas, para cumplir con las disposiciones jurídicas aplicables en la materia, y en lo relativo a la clasificación, conservación, guarda y custodia de los archivos a su cargo;\nXXIV. Presentar al Auditor General para su acuerdo, los asuntos cuyo trámite se encuentren en el ámbito de su competencia;\nXXV. Desempeñar las comisiones y, en su caso, participar en las auditorías que determine el\nAuditor General;\nXXVI. Evaluar el cumplimiento de los objetivos del PROFIS e informar sus resultados al Auditor\nGeneral;\nXXVII. Proponer los nombramientos y remociones de los servidores públicos de la Auditoría\nEspecial, con excepción de los que pertenezcan al Servicio Civil de Carrera; y\nXXVIII. Las demás que le confieran las disposiciones legales aplicables, o le asigne el Auditor\nGeneral.\nCAPÍTULO CUARTO\nATRIBUCIONES ESPECÍFICAS\nDE LOS AUDITORES ESPECIALES DEL\nSECTOR AYUNTAMIENTOS, DEL\nSECTOR GOBIERNO, Y DE\nORGANISMOS PÚBLICOS\nDESCENTRALIZADOS Y ORGANOS\nAUTÓNOMOS\nARTÍCULO 21.- Son atribuciones específicas de los Auditores Especiales del Sector\nAyuntamientos, del Sector Gobierno, y de Organismos Públicos Descentralizados y Órganos Autónomos, además de las previstas por la Ley de Fiscalización, las siguientes:\nI. Ejecutar y controlar los programas específicos para el adecuado desempeño de las funciones que sean de su competencia;\nII. Acordar con el Auditor General la resolución de los asuntos cuya tramitación se encuentre dentro del ámbito de su competencia;\nIII. Emitir requerimientos por sí mismos, o por acuerdo del Auditor General, para que las atribuciones relativas a su ámbito de competencia;\nEVALUACION DE LA AUDITORÍA GENERAL DEL ESTADO DEL H.\nCONGRESO DEL ESTADO DE GUERRERO, EN SESIÓN DE FECHA\nCATORCE DE AGOSTO DE DOS MIL DOCE, LO ANTERIOR PARA\nNÚMERO 1028 DE FISCALIZACIÓN SUPERIOR Y RENDICION DE\nCUENTAS DEL ESTADO DE GUERRERO\nIV. Formular los estudios, opiniones, informes y demás documentos que les sean requeridos por el Auditor General;\nV. Proporcionar, conforme a sus atribuciones y de acuerdo con las políticas y normas establecidas en la materia, la información, documentación, datos, informes y asesorías o cooperación técnica que le requieran otras áreas de la Auditoría General;\nVI. Integrar y remitir en la forma que determine el Auditor General, el Informe Anual de\nResultados, en lo relativo al ámbito de su competencia;\nVII. Desempeñar las comisiones que determine el Auditor General, así como mantenerlo informado sobre los resultados de sus actividades;\nVIII. Supervisar la aplicación de los mecanismos de control y evaluación para el mejoramiento de la eficiencia operativa y funcional del área a su cargo, de acuerdo con los manuales de organización y de procedimientos;\nIX. Proporcionar la información que les requiera el Auditor General para elaborar el anteproyecto de Presupuesto Anual de la Auditoría General, así como el Informe de los avances del Programa\nOperativo Anual en lo relativo al ámbito de su competencia y de las áreas de su adscripción;\nX. Vigilar el cumplimiento de las disposiciones laborales aplicables al funcionamiento de las áreas a su cargo y, en su caso, promover ante el Auditor General la imposición de las sanciones procedentes;\nXI. Proponer los programas de formación, capacitación y especialización para mejorar la preparación técnica y profesional del personal de las áreas a su cargo;\nXII. Proponer al Auditor General, para su valoración y autorización, los nombramientos y remociones del personal de las áreas a su cargo, en los términos que determine el presente reglamento, con excepción de los que pertenezcan al Servicio Civil de Carrera;\nXIII. Someter a la consideración y autorización del Auditor General los pliegos preventivos y de recomendaciones vinculantes derivados de la fiscalización, las auditorías, visitas e inspecciones que practiquen las unidades administrativas a su cargo;\nXIV. Turnar a la Dirección de Asuntos Jurídicos los pliegos preventivos y de recomendaciones vinculantes para su notificación legal a las entidades fiscalizables, servidores públicos, ex servidores públicos y particulares;\nXV. Concertar la coordinación entre Auditorías Especiales, para el adecuado cumplimiento de sus funciones; y\nXVI. Las demás que señalen las disposiciones legales aplicables, los manuales de organización y de procedimientos que se expidan, o le asigne directamente el Auditor General.\nEVALUACION DE LA AUDITORÍA GENERAL DEL ESTADO DEL H.\nCONGRESO DEL ESTADO DE GUERRERO, EN SESIÓN DE FECHA\nCATORCE DE AGOSTO DE DOS MIL DOCE, LO ANTERIOR PARA\nNÚMERO 1028 DE FISCALIZACIÓN SUPERIOR Y RENDICION DE\nCUENTAS DEL ESTADO DE GUERRERO\nCAPÍTULO QUINTO\nATRIBUCIONES ESPECÍFICAS DEL\nAUDITOR ESPECIAL\nDE EVALUACIÓN DEL DESEMPEÑO\nARTÍCULO 22.- Son atribuciones específicas del Auditor Especial de Evaluación del\nDesempeño, además de las previstas por la Ley de Fiscalización y por las fracciones I a XII del artículo anterior, las siguientes:\nI. Someter a la consideración y autorización del Auditor General los pliegos de recomendaciones vinculantes a las entidades fiscalizables que se deriven de la evaluación, auditorías y visitas que practiquen las Unidades Administrativas a su cargo;\nII. Turnar a la Dirección de Asuntos Jurídicos, los pliegos de recomendaciones vinculantes para su notificación legal a los servidores públicos de las entidades fiscalizables;\nIII. Dar seguimiento al cumplimiento de las recomendaciones realizadas por la Auditoría General hasta su total satisfacción por las entidades fiscalizables;\nIV. Concertar la coordinación entre Auditorías Especiales, para el adecuado cumplimiento de sus funciones; y\nV. Las demás que señalen las disposiciones legales aplicables, los manuales de organización y de procedimientos que se expidan, o le asigne directamente el Auditor General.\nCAPÍTULO SEXTO\nATRIBUCIONES DEL DIRECTOR DE\nASUNTOS JURÍDICOS\nARTÍCULO 23.- Son atribuciones de la Dirección de Asuntos Jurídicos, además de las previstas en el artículo 96 de la Ley de Fiscalización, las siguientes:\nI. Representar jurídicamente a la Auditoría General ante los tribunales y ejercer las acciones inherentes dentro de los procedimientos jurisdiccionales de cualquier índole, que se instauren con motivo que sea requerida su intervención;\nII. Actuar como órgano de consulta, asesoría e investigación en los asuntos que le planteen las demás unidades administrativas, las entidades fiscalizables y los que le sean encomendados por el\nAuditor General;\nIII. Realizar los estudios, proyectos e investigaciones que requieran el adecuado desempeño de sus atribuciones;\nEVALUACION DE LA AUDITORÍA GENERAL DEL ESTADO DEL H.\nCONGRESO DEL ESTADO DE GUERRERO, EN SESIÓN DE FECHA\nCATORCE DE AGOSTO DE DOS MIL DOCE, LO ANTERIOR PARA\nNÚMERO 1028 DE FISCALIZACIÓN SUPERIOR Y RENDICION DE\nCUENTAS DEL ESTADO DE GUERRERO\nIV. Formular los lineamientos jurídicos sobre los procedimientos de fiscalización y competencia de la Auditoría General, y someterlos a consideración del Auditor General;\nV. Sistematizar y unificar los criterios de interpretación de las disposiciones jurídicas que regulen el funcionamiento de la Auditoría General, así como coordinar su difusión;\nVI. Someter a la consideración del Auditor General los proyectos mediante los cuales se promueva el fincamiento de responsabilidades civiles, penales y administrativas;\nVII. Elaborar las denuncias y querellas penales que procedan como consecuencia del cumplimiento de las atribuciones conferidas a la Auditoría General; someterlas a la consideración del\nAuditor General y asistirlo en la presentación, seguimiento y coadyuvar con el Ministerio Público en los procesos penales indagatorios y judiciales en los que participe;\nVIII. Admitir y substanciar los recursos previstos en la Ley de Fiscalización, hasta ponerlos en estado de resolución;\nIX. Supervisar el registro y seguimiento del cobro de los resarcimientos y ejecución de los medios de apremio, impuestos por la Auditoría General y, en su caso, proponer las normas y lineamientos que regulen la integración y actualización de dicho registro;\nX. Compilar y ordenar las leyes, reglamentos, decretos, acuerdos y demás disposiciones legales en materia de fiscalización superior, para establecer el banco de datos respectivo;\nXI. Elaborar los proyectos de acuerdos para la publicación, en el Periódico Oficial del Estado, de las normas, reglas técnicas, procedimientos, métodos, sistemas, así como todas aquellas disposiciones que permitan la práctica idónea de las auditorías y revisiones a las entidades fiscalizables, y someterlos a la aprobación del Auditor General;\nXII. Opinar sobre la procedencia legal de los convenios, acuerdos, contratos y bases de coordinación suscritos por la Auditoría General;\nXIII. Notificar los pliegos, resoluciones y demás actos administrativos que emita la Auditoría\nGeneral y habilitar al personal que deba practicar dichas diligencias;\nXIV. Llevar el control de la Oficialía de Partes;\nXV. Analizar, revisar, formular y someter a la consideración del Auditor General, los estudios, proyectos y propuestas de reformas de leyes, decretos, reglamentos, circulares y demás disposiciones jurídicas competencia de la Auditoría General;\nXVI. Revisar la fundamentación legal de la documentación necesaria para la práctica de visitas, inspecciones, auditorías y revisiones que le requieran las unidades administrativas, para la autorización del Auditor General;\nXVII. Asesorar al Órgano de Control sobre las quejas y denuncias que presenten los particulares u otras autoridades, en contra de servidores públicos sujetos a fiscalización, o de quienes hayan dejado de serlo, en el ámbito de su competencia y, en su caso, acordar lo conducente;\nXVIII. Coadyuvar, en el ámbito de su competencia, en la elaboración y difusión de los manuales de organización, procedimientos y lineamientos jurídicos administrativos a que deberán sujetarse las\nEVALUACION DE LA AUDITORÍA GENERAL DEL ESTADO DEL H.\nCONGRESO DEL ESTADO DE GUERRERO, EN SESIÓN DE FECHA\nCATORCE DE AGOSTO DE DOS MIL DOCE, LO ANTERIOR PARA\nNÚMERO 1028 DE FISCALIZACIÓN SUPERIOR Y RENDICION DE\nCUENTAS DEL ESTADO DE GUERRERO unidades administrativas de la Auditoría General, así como las entidades fiscalizables y auditores externos;\nXIX. Elaborar las actas de aceptación o rechazo de los informes financieros semestrales y las cuentas públicas, previo acuerdo que emita el Auditor General;\nXX. Elaborar y presentar ante el Órgano de Control las denuncias en contra de los servidores públicos de la Auditoría General, previo acuerdo del Auditor General;\nXXI. Apoyar a los Auditores Especiales en la elaboración de denuncias en contra de las entidades fiscalizables que no cumplan con presentar dentro de los plazos de ley, los informes semestrales y su Cuenta Pública, para su presentación ante el Órgano de Control; y\nXXII. Las demás que le señalen las disposiciones legales aplicables, los manuales de organización y de procedimientos que se expidan, o le asigne directamente el Auditor General.\nCAPÍTULO SÉPTIMO\nATRIBUCIONES DEL DIRECTOR DE\nADMINISTRACIÓN Y FINANZAS\nARTÍCULO 24.- Son atribuciones de la Dirección de Administración y Finanzas, además de las previstas por el artículo 97 de la Ley de Fiscalización, las siguientes:\nI. Cuantificar, controlar y administrar los recursos financieros, humanos, técnicos y materiales de la Auditoría General, de conformidad con las disposiciones legales, administrativas y reglamentarias aplicables, y con las políticas y normas que emita la Auditoría General;\nII. Coordinar y supervisar la preparación del anteproyecto de presupuesto anual de la Auditoría\nGeneral, así como controlar el ejercicio presupuestal;\nIII. Tramitar los movimientos del personal de la Auditoría General y los casos de terminación de las relaciones laborales, de acuerdo con las disposiciones jurídicas aplicables;\nIV. Concertar, de acuerdo con las disposiciones normativas aplicables, la contratación de las adquisiciones, los arrendamientos y los servicios que soliciten las áreas de la Auditoría General;\nV. Someter a la consideración del Auditor General los Manuales de Organización y de\nProcedimientos Administrativos de la Auditoría General;\nVI. Recibir el Programa Anual de Trabajo de las diferentes Unidades Administrativas de la\nAuditoría General, con el objeto de integrar el Plan Operativo Anual y el anteproyecto de presupuesto anual respectivo para someterlos a consideración del Auditor General;\nVII. Proponer y tramitar ante el Auditor General, las modificaciones que se requieran a la estructura orgánica autorizada de la Auditoría General;\nEVALUACION DE LA AUDITORÍA GENERAL DEL ESTADO DEL H.\nCONGRESO DEL ESTADO DE GUERRERO, EN SESIÓN DE FECHA\nCATORCE DE AGOSTO DE DOS MIL DOCE, LO ANTERIOR PARA\nNÚMERO 1028 DE FISCALIZACIÓN SUPERIOR Y RENDICION DE\nCUENTAS DEL ESTADO DE GUERRERO\nVIII. Conducir con el apoyo de la Dirección de Asuntos Jurídicos, las relaciones laborales de los servidores públicos de la Auditoría General, y en su caso, proveer a la autoridad competente de la documentación necesaria para el ejercicio de las acciones jurídicas laborales correspondientes;\nIX. Elaborar el Informe Financiero semestral y la Cuenta Pública de la Auditoría General, para su entrega al Honorable Congreso del Estado.\nX. Coordinar y controlar el Programa Interno de Protección Civil;\nXI. Desarrollar las demás funciones inherentes al área de su competencia;\nXII. Reglamentar el acceso y el uso de las instalaciones de la Auditoría General;\nXIII. Proponer al Auditor General las Políticas de Gasto de la Auditoría General; y\nXIV. Las demás que le señalen las disposiciones legales aplicables, los manuales de organización y de procedimientos que se expidan, o le asigne directamente el Auditor General.\nTÍTULO IV\nÓRGANOS AUXILIARES DEL\nAUDITOR GENERAL\nCAPÍTULO PRIMERO\nATRIBUCIONES DEL ÓRGANO\nDE CONTROL\nARTÍCULO 25.- El Órgano de Control, es una Unidad Administrativa dependiente del Auditor\nGeneral. Para el ejercicio de sus funciones contará con las siguientes atribuciones:\nI. Tramitar y resolver los Procedimientos Administrativos Disciplinarios derivados de las quejas y denuncias formuladas con motivo del incumplimiento de las obligaciones de los servidores públicos de la\nAuditoría General y las entidades fiscalizables;\nII. Suscribir las actas administrativas relativas al desahogo de las audiencias, así como las comparecencias que hagan los denunciantes y presuntos responsables en el Procedimiento\nAdministrativo Disciplinario;\nIII. Elaborar y revisar los proyectos de resolución y proponer, en su caso, la imposición de sanciones de acuerdo a lo dispuesto en la Ley de Fiscalización;\nIV. Determinar, previo acuerdo del Auditor General, la suspensión temporal de los presuntos responsables, de sus cargos, empleos o comisiones, si de las constancias se desprenden elementos que hagan necesaria esta medida, y si así conviene para el desahogo de las investigaciones, en los términos establecidos por la Ley;\nV. Mantener actualizados los expedientes administrativos disciplinarios a efecto de evitar el rezago en los trámites señalados en la Ley de fiscalización;\nEVALUACION DE LA AUDITORÍA GENERAL DEL ESTADO DEL H.\nCONGRESO DEL ESTADO DE GUERRERO, EN SESIÓN DE FECHA\nCATORCE DE AGOSTO DE DOS MIL DOCE, LO ANTERIOR PARA\nNÚMERO 1028 DE FISCALIZACIÓN SUPERIOR Y RENDICION DE\nCUENTAS DEL ESTADO DE GUERRERO\nVI. Contestar y hacer la defensa jurídica en los juicios de amparo, demandas de nulidad o cualquier medio de defensa que se interponga en contra de las resoluciones definitivas, interlocutorias, acuerdos, imposición de sanciones o medidas de apremio, y en general cualquier acto de autoridad emitido dentro de los procedimientos administrativos disciplinarios que se tramiten ante el Órgano de\nControl;\nVII. Desarrollar y substanciar en todas y cada una de las etapas el Procedimiento Administrativo\nDisciplinario contenido en el Título Sexto, Capitulo V de la Ley de Fiscalización, previo acuerdo del\nAuditor General;\nVIII. Dictar los acuerdos que recaigan en las promociones de los interesados;\nIX. Dictar los acuerdos que de oficio o en ejercicio de la facultad de investigación le permite la\nLey de Fiscalización;\nX. Dictar los acuerdos necesarios para el cumplimiento de las sanciones impuestas en la resolución definitiva, así como aquél donde se declare ejecutoriada la resolución en términos de la Ley de\nFiscalización;\nXI. Dar el trámite correspondiente a los recursos de reconsideración que se hagan valer en contra de las resoluciones definitivas que se hayan emitido;\nXII. Verificar la aplicación y funcionamiento del Servicio Civil de Carrera en la Auditoría General;\nXIII. Recibir y tramitar las quejas y denuncias que se interpongan en contra de los servidores públicos de la Auditoría General. La procedencia del inicio del proceso de auditoría a dichas quejas deberá ser dictaminada por la Comisión de Vigilancia para que determine lo conducente.\nXIV. Intervenir en la elaboración de las actas o constancias administrativas en las que se describan los hechos o acontecimientos presuntamente irregulares e imputables a los servidores públicos de la Auditoría General, para los efectos legales procedentes;\nXV. Sustanciar los procedimientos administrativos de investigación, así como elaborar y aplicación de las sanciones que correspondan a los servidores públicos de la Auditoría General;\nXVI. Sustanciar los procedimientos administrativos por incumplimiento a la Ley de Fiscalización, al presente reglamento y demás disposiciones legales y normatividad aplicable, en contra de servidores públicos de las entidades fiscalizables, o quienes hayan dejado de serlo y, en su caso, habilitar al personal que intervenga en las actuaciones respectivas y acordar lo conducente, así como elaborar el proyecto de resolución para someterlo a la consideración del Auditor General; y\nXVII. Las demás que le atribuyan expresamente las disposiciones legales y reglamentarias, así como aquellas que le asigne el Auditor General.\nEVALUACION DE LA AUDITORÍA GENERAL DEL ESTADO DEL H.\nCONGRESO DEL ESTADO DE GUERRERO, EN SESIÓN DE FECHA\nCATORCE DE AGOSTO DE DOS MIL DOCE, LO ANTERIOR PARA\nNÚMERO 1028 DE FISCALIZACIÓN SUPERIOR Y RENDICION DE\nCUENTAS DEL ESTADO DE GUERRERO\nTÍTULO V\nÓRGANOS AUXILIARES DE LAS\nAUDITORÍAS ESPECIALES\nCAPÍTULO PRIMERO\nATRIBUCIONES DE LAS\nDIRECCIONES\nArtículo 26.- Para el ejercicio de sus funciones, los Directores adscritos a la Auditoría Especial del Sector Ayuntamientos, Auditoría Especial del Sector Gobierno y Auditoría Especial de Organismos\nPúblicos Descentralizados y Órganos Autónomos, contarán con las siguientes atribuciones:\nI. Evaluar las necesidades de capacitación del personal a su cargo a fin de elevar el nivel técnico y profesional del mismo;\nII. Participar en la evaluación del desempeño del personal a su cargo conforme a las políticas y procedimientos que establezca la Auditoría General;\nIII. Adoptar las medidas necesarias para el cumplimiento de las normas del sistema de gestión de calidad de la Auditoría General y demás ordenamientos aplicables en la materia;\nIV. Planear, coordinar y supervisar las auditorías o revisiones asignadas al personal a su cargo, conforme al programa anual de auditorías;\nV. Proporcionar la información, documentación, datos, informes, asesorías y cooperación técnica que requieran otras áreas;\nVI. Coordinar y supervisar la práctica de visitas y auditorías a las entidades fiscalizables, así como las inspecciones y demás investigaciones necesarias para el cumplimiento de sus funciones; VII.\nExaminar y validar la adecuada integración de los expedientes de auditoría, verificando que contengan la evidencia suficiente para sustentar debidamente las observaciones;\nVIII. Elaborar y acordar con el Auditor Especial de su adscripción, los proyectos de resultados de la fiscalización;\nIX. Supervisar la elaboración y levantamiento de las actas circunstanciadas derivadas de las actuaciones realizadas durante la fiscalización;\nX. Recabar de las entidades fiscalizables la información y documentación necesaria para la adecuada planeación del proceso de fiscalización;\nXI. Requerir a las entidades fiscalizables, la información y documentación específica para el cumplimiento de la función de fiscalización;\nXII. Analizar los informes de situación excepcional, según corresponda, que rindan las entidades fiscalizables sobre los casos específicos o situaciones denunciadas, conforme a lo previsto en la Ley de\nFiscalización;\nEVALUACION DE LA AUDITORÍA GENERAL DEL ESTADO DEL H.\nCONGRESO DEL ESTADO DE GUERRERO, EN SESIÓN DE FECHA\nCATORCE DE AGOSTO DE DOS MIL DOCE, LO ANTERIOR PARA\nNÚMERO 1028 DE FISCALIZACIÓN SUPERIOR Y RENDICION DE\nCUENTAS DEL ESTADO DE GUERRERO\nXIII. Someter a consideración del Auditor Especial de su adscripción, los resultados del análisis de los informes de situación excepcional, y en su caso, las sanciones que proceda imponer o promover;\nXIV. Informar al Auditor Especial de su adscripción, las irregularidades detectadas en las auditorías, visitas e inspecciones que pudieran constituir delitos, responsabilidades administrativas, resarcitorias, o que ameriten la intervención de la instancia de control competente o el ejercicio de la facultad de comprobación fiscal, acompañando en su caso, los elementos necesarios para el ejercicio de las acciones correspondientes;\nXV. Elaborar y someter a consideración del Auditor Especial de su adscripción, los anteproyectos de Informes de Resultados del ámbito de su competencia; y\nXVI. Las demás que les confieran el Reglamento, los Manuales de Organización y\nProcedimientos de la Auditoría General o le sean encomendadas por el Auditor Especial de su adscripción.\nARTÍCULO 27.- Para el ejercicio de sus funciones, los Directores de Auditoría de Obra adscritos a la Auditoría Especial del Sector Ayuntamientos, Auditoría Especial del Sector Gobierno y Auditoría\nEspecial de Organismos Públicos Descentralizados y Órganos Autónomos, contarán con las siguientes atribuciones:\nI. Elaborar el programa anual de auditorías y ponerlo a consideración del Auditor Especial;\nII. Proponer los criterios técnicos para las auditorías y su seguimiento, incluyendo procedimientos, compulsas, investigaciones, encuestas, métodos y sistemas necesarios para la revisión y fiscalización de las cuentas públicas;\nIII. Evaluar las necesidades de capacitación del personal a su cargo a fin de elevar el nivel técnico y profesional del mismo;\nIV. Participar en la evaluación del desempeño del personal a su cargo conforme a las políticas y procedimientos que establezca la Auditoría General;\nV. Adoptar las medidas necesarias para el cumplimiento de las normas del sistema de gestión de calidad de la Auditoría General y demás ordenamientos aplicables en la materia;\nVI. Disponer lo conducente para la integración, actualización y conservación de los archivos de trámite y concentración de su área, llevando a cabo, en el ámbito de su competencia, las acciones para\nVII. Llevar a cabo las inspecciones de obras en proceso o ejecutadas, bienes adquiridos y servicios contratados relacionados con las mismas, para comprobar que las inversiones y gastos autorizados se hayan aplicado legal y eficientemente en las entidades fiscalizables;\nVIII. Proponer a los Auditores Especiales, los procedimientos y técnicas de auditoría para la por parte de las autoridades estatales y municipales;\nEVALUACION DE LA AUDITORÍA GENERAL DEL ESTADO DEL H.\nCONGRESO DEL ESTADO DE GUERRERO, EN SESIÓN DE FECHA\nCATORCE DE AGOSTO DE DOS MIL DOCE, LO ANTERIOR PARA\nNÚMERO 1028 DE FISCALIZACIÓN SUPERIOR Y RENDICION DE\nCUENTAS DEL ESTADO DE GUERRERO\nIX. Analizar los informes de situación excepcional y demás actuaciones relacionadas, y acordar con el Auditor Especial de su adscripción los resultados correspondientes, aportando, en su caso, los elementos necesarios para la imposición de las sanciones y el ejercicio de las acciones que procedan;\nX. Recabar de las entidades fiscalizables la información y documentación necesaria para la adecuada planeación del proceso de fiscalización;\nXI. Elaborar y someter a consideración del Auditor Especial de su adscripción, los resultados de las revisiones practicadas y, en su caso, las observaciones preliminares obtenidas;\nXII. Poner al conocimiento del Auditor Especial de su adscripción, las conductas u omisiones que sean susceptibles de ser sancionadas con multa, acompañando, en su caso, los elementos necesarios para su determinación e imposición en términos de la Ley de Fiscalización y la Ley de\nResponsabilidades;\nXIII. Elaborar y someter a consideración del Auditor Especial de su adscripción, los anteproyectos de Informes de Resultados del ámbito de su competencia; y\nXIV. Las demás que le confieran los manuales de organización y procedimientos de la Auditoría\nGeneral, o le sean encomendadas por el Auditor Especial de su adscripción.\nARTÍCULO 28.- Para el ejercicio de sus funciones, el Director de Evaluación al desempeño a poderes del estado, organismos paraestatales y autónomos, director de normatividad y control de calidad y el director de auditoria evaluación al desempeño a municipios, adscrito a la Auditoría Especial de\nEvaluación del Desempeño, contará con las siguientes atribuciones:\nI. Planear y programar anualmente las actividades correspondientes a la dirección a su cargo y someterlas a la consideración del Auditor Especial de su adscripción;\nII. Evaluar las necesidades de capacitación del personal a su cargo a fin de elevar el nivel técnico y profesional del mismo;\nIII. Proporcionar la información, documentación, datos, informes, asesorías y cooperación técnica que requieran otras áreas;\nIV. Adoptar las medidas necesarias para el cumplimiento de las normas del sistema de gestión de calidad de los entes fiscalizables y demás ordenamientos aplicables en la materia;\nV. Planear, coordinar y supervisar las auditorías sobre el desempeño y demás revisiones asignadas al personal a su cargo, conforme al programa anual de auditorías;\nVI. Coordinar y supervisar la práctica de visitas y auditorías a las entidades fiscalizables, así como las inspecciones y demás investigaciones necesarias para el cumplimiento de sus funciones, previo acuerdo del Auditor Especial de su adscripción;\nVII. Examinar y validar la adecuada integración de los expedientes de las evaluaciones que se realicen, verificando que contengan la evidencia suficiente para sustentar debidamente los resultados;\nEVALUACION DE LA AUDITORÍA GENERAL DEL ESTADO DEL H.\nCONGRESO DEL ESTADO DE GUERRERO, EN SESIÓN DE FECHA\nCATORCE DE AGOSTO DE DOS MIL DOCE, LO ANTERIOR PARA\nNÚMERO 1028 DE FISCALIZACIÓN SUPERIOR Y RENDICION DE\nCUENTAS DEL ESTADO DE GUERRERO\nVIII. Supervisar la elaboración y levantamiento de las actas circunstanciadas derivadas de las actuaciones realizadas durante las visitas e inspecciones que se realicen;\nIX. Recabar de las entidades fiscalizables la información y documentación necesaria para la adecuada planeación del proceso de fiscalización;\nX. Elaborar y someter a consideración del Auditor Especial de su adscripción, los anteproyectos de Informes de Resultados del ámbito de su competencia;\nXI. Dar seguimiento a las recomendaciones vinculantes, deriva-das de la evaluación del desempeño de las entidades fiscalizables;\nXII. Informar y coadyuvar, en el ámbito de su competencia, con la investigación de actos u omisiones que impliquen infracciones o conductas ilícitas de los servidores públicos adscritos a las entidades fiscalizables, a efecto de que se impongan las sanciones que procedan; y\nXIII. Las demás que le confieran los manuales de organización y procedimientos de la Auditoría\nGeneral, o le sean encomendadas por su superior jerárquico.\nCAPÍTULO SEGUNDO\nATRIBUCIONES DE LAS\nSUBDIRECCIONES\nARTÍCULO 29.- Para el ejercicio de sus funciones, los Subdirectores de las Auditorías\nEspeciales, dentro del ámbito de competencia de la Dirección a la que estén adscritos, tendrán las siguientes atribuciones:\nI. Planear y programar anualmente las actividades correspondientes al área a su cargo y someterlas a la consideración de su superior jerárquico de acuerdo a los lineamientos que en esta materia estén establecidos;\nII. Formular los proyectos de estudios, opiniones, dictámenes, informes y demás documentos que les sean requeridos por su superior jerárquico;\nIII. Proporcionar, conforme a sus atribuciones y de acuerdo con las instrucciones de su superior jerárquico, la información, documentación, datos, informes y asesorías, o la cooperación técnica que les requieran otras áreas de la Auditoría General;\nIV. Coordinar y participar en la revisión, análisis y evaluación de la información incluida en los\nInformes semestrales y las Cuentas Públicas, y en la formulación de los proyectos de informes de resultados de la fiscalización de la Cuenta Pública, en el marco de sus respectivos ámbitos de competencia;\nV. Participar, conforme al manual de organización y de procedimientos de la Auditoría General, Informes Financieros Semestrales y las Cuentas Públicas;\nEVALUACION DE LA AUDITORÍA GENERAL DEL ESTADO DEL H.\nCONGRESO DEL ESTADO DE GUERRERO, EN SESIÓN DE FECHA\nCATORCE DE AGOSTO DE DOS MIL DOCE, LO ANTERIOR PARA\nNÚMERO 1028 DE FISCALIZACIÓN SUPERIOR Y RENDICION DE\nCUENTAS DEL ESTADO DE GUERRERO\nVI. Coordinar el desarrollo de las auditorías, sujetándose a la dirección de su superior jerárquico;\nVII. Examinar, en el ámbito de su competencia, los actos u omisiones que impliquen alguna irregularidad;\nVIII. Coordinar y participar en la elaboración de actas circunstanciadas de los auditores comisionados y, en su caso, de los despachos y profesionales independientes habilitados, en presencia de dos testigos en las que se harán constar hechos y omisiones que hubieren encontrado durante sus actuaciones y lo comunicarán a su superior jerárquico;\nIX. Detectar las necesidades de capacitación del personal de la subdirección y presentarlas a la consideración de su superior jerárquico;\nX. Elaborar y proponer a su superior jerárquico y, en su caso, suscribir los requerimientos de información y documentación necesarios para la planeación y ejecución de las auditorías;\nXI. Requerir a las entidades fiscalizables, a las personas físicas o morales, públicas o privadas y a los terceros que hubieren celebrado operaciones con aquellas, la información, documentación y aclaraciones que sean necesarias para la etapa de planeación y ejecución de las auditorías;\nXII. Coordinar y participar en la revisión, análisis y evaluación de la información y documentación proporcionada con motivo de la planeación, desarrollo de las auditorías y seguimiento para la atención de las acciones promovidas;\nXIII. Obtener copia de los documentos originales que tenga a la vista, durante el desarrollo de las auditorías a su cargo, como resultado de la fiscalización de los Informes Semestrales y las Cuentas\nPúblicas.\nXIV. Recabar, integrar y presentar a su superior jerárquico, la documentación necesaria para ejercitar las acciones legales que procedan como resultado de las irregularidades que se detecten en las auditorías que practiquen, la cual deberá certificarse por la entidad fiscalizable cuando así se requiera;\nXV. Coordinar y participar en la integración de los expedientes de las auditorías practicadas, para su archivo y salvaguarda, de acuerdo con las disposiciones jurídicas aplicables, verificando que a través de los papeles de trabajo, cédulas de observaciones y la documentación que se derive de las mismas, se garantice el soporte adecuado de los resultados obtenidos;\nXVI. Coordinar y revisar la elaboración de los proyectos de pliegos preventivos y de observaciones, y vigilar la integración de los expedientes respectivos para tal fin;\nXVII. Coordinar y participar en los trabajos que se requieran para dar cumplimiento a la Ley de\nTransparencia y demás disposiciones jurídicas aplicables, en cuanto a la atención de los requerimientos de información y organización, clasificación, conservación, guarda y custodia de sus archivos;\nXVIII. Elaborar y someter a la consideración de su superior jerárquico, las observaciones, recomendaciones y acciones que, en el ámbito de su competencia, se deban formular a las entidades fiscalizables;\nXIX. Participar en el seguimiento y conclusión de las recomendaciones vinculantes y acciones promovidas; y\nEVALUACION DE LA AUDITORÍA GENERAL DEL ESTADO DEL H.\nCONGRESO DEL ESTADO DE GUERRERO, EN SESIÓN DE FECHA\nCATORCE DE AGOSTO DE DOS MIL DOCE, LO ANTERIOR PARA\nNÚMERO 1028 DE FISCALIZACIÓN SUPERIOR Y RENDICION DE\nCUENTAS DEL ESTADO DE GUERRERO\nXX. Realizar las demás funciones que les confieran los acuerdos delegatorios de facultades correspondientes y las que deriven de las demás disposiciones jurídicas aplicables a las auditorías.\nCAPÍTULO TERCERO\nATRIBUCIONES DE LOS\nSUPERVISORES DE AUDITORÍA\nARTÍCULO 30.- Para el ejercicio de sus funciones, los Supervisores de Auditoría de las\nAuditorías Especiales del Sector Ayuntamientos, Sector Gobierno y Organismos Públicos\nDescentralizados y Órganos Autónomos, tendrán las siguientes atribuciones:\nI. Dar seguimiento a las actividades establecidas en el programa operativo del área a su cargo, con el fin de proponer, en su caso, las medidas correctivas a su superior jerárquico;\nII. Definir de manera conjunta con sus superiores jerárquicos, los formatos y la estructura de los papeles de trabajo a utilizarse en su área, y realizar su evaluación con el fin de mejorarlos;\nIII. Coordinarse con sus superiores jerárquicos para definir los documentos que permitan realizar el seguimiento, control y evaluación de las actividades del proceso de fiscalización de los informes financieros semestrales y las cuentas públicas, a fin de tomar las medidas pertinentes;\nIV. Coordinar y controlar los trabajos de revisión y fiscalización de los informes financieros semestrales y las cuentas públicas anuales;\nV. Dar seguimiento a las actividades y tiempos señalados en las cédulas de control del proceso de recepción, revisión y fiscalización de las cuentas anuales;\nVI. Proporcionar asesoría técnica y capacitación a las entidades fiscalizables en relación a la normatividad aplicable en la captación, custodia y administración de los recursos públicos;\nVII. Proporcionar y promover asesoría técnica y capacitación al personal a su cargo, con el fin de mejorar la calidad de los trabajos de fiscalización;\nVIII. Supervisar que la revisión de los inventarios de bienes patrimoniales y los presupuestos de ingresos y de egresos, se realice de conformidad con los lineamientos correspondientes, verificar las cédulas correspondientes y turnarlas a su superior jerárquico;\nIX. En coordinación con sus superiores jerárquicos, elaborar la propuesta para la asignación de las cargas de trabajo para cada Auditor;\nX. Supervisar que el personal a su cargo cumpla en tiempo y forma con la aplicación de los procedimientos adecuados en las funciones que desempeñen, emitiendo en consecuencia las medidas que considere pertinentes;\nXI. Constatar que los papeles de trabajo contengan la evidencia suficiente y competente para sustentar una opinión sobre la captación, custodia administración y aplicación de los recursos públicos;\nEVALUACION DE LA AUDITORÍA GENERAL DEL ESTADO DEL H.\nCONGRESO DEL ESTADO DE GUERRERO, EN SESIÓN DE FECHA\nCATORCE DE AGOSTO DE DOS MIL DOCE, LO ANTERIOR PARA\nNÚMERO 1028 DE FISCALIZACIÓN SUPERIOR Y RENDICION DE\nCUENTAS DEL ESTADO DE GUERRERO\nXII. Revisar y validar los pliegos preventivos derivados del proceso de fiscalización de las cuentas públicas y enviarlos al Jefe de Departamento para su validación;\nXIII. Controlar el proceso de elaboración del proyecto de informe del resultado de la fiscalización y turnarlo al Jefe de Departamento para su revisión y autorización en su caso;\nXIV. Participar en las visitas domiciliarias con carácter de auditoría con el fin de supervisar los trabajos en campo;\nXV. Elaborar y presentar al Jefe de Departamento los informes, estudios y opiniones que le sean requeridos;\nXVI. Administrar eficazmente los recursos humanos, materiales y financieros a su cargo;\nXVII. Evaluar y reportar al Jefe de Departamento, el desempeño del personal; y\nXVIII. Las demás que le señalen sus superiores jerárquicos.\nCAPÍTULO CUARTO\nATRIBUCIONES DE LOS SUPERVISORES\nDE LA AUDITORIA ESPECIAL DE\nEVALUACIÓN DEL DESEMPEÑO\nARTÍCULO 31.- Los supervisores de la Auditoría Especial Evaluación del Desempeño, tendrán las siguientes atribuciones:\nI. Dar seguimiento a las actividades reflejadas en el programa operativo del área a su cargo, con el fin de proponer, en su caso, las medidas correctivas a su superior jerárquico;\nII. Definir de manera conjunta con sus superiores jerárquicos los formatos o la estructura de los papeles de trabajo a utilizar en su área, y realizar su evaluación con el fin de mejorarlos;\nIII. Coordinarse con sus superiores jerárquicos para definir los documentos que permitan realizar el seguimiento, control y evaluación de las actividades del proceso de fiscalización de los informes financieros semestrales y las cuentas públicas, a fin de tomar las medidas pertinentes;\nIV. Coordinar y controlar los trabajos de evaluación del desempeño de los informes financieros semestrales y las cuentas públicas anuales;\nV. Dar seguimiento a las actividades y tiempos señalados en las cédulas de control del proceso de recepción, revisión y fiscalización de las cuentas anuales;\nVI. Proporcionar la asesoría técnica y capacitación a las entidades fiscalizables en relación a la normatividad aplicable en la captación, custodia y administración de los recursos públicos;\nVII. Proporcionar y promover la asesoría técnica y capacitación al personal a su cargo, con el fin de mejorar la calidad de los trabajos de fiscalización.\nEVALUACION DE LA AUDITORÍA GENERAL DEL ESTADO DEL H.\nCONGRESO DEL ESTADO DE GUERRERO, EN SESIÓN DE FECHA\nCATORCE DE AGOSTO DE DOS MIL DOCE, LO ANTERIOR PARA\nNÚMERO 1028 DE FISCALIZACIÓN SUPERIOR Y RENDICION DE\nCUENTAS DEL ESTADO DE GUERRERO\nVIII. Supervisar que la revisión de los inventarios de bienes patrimoniales y los presupuestos de ingresos y de egresos, se realice de conformidad con los lineamientos correspondientes, verificar las cédulas correspondientes y turnarlas a su superior jerárquico;\nIX. En coordinación con sus superiores jerárquicos elaborar la propuesta para la asignación de las cargas de trabajo para cada Auditor;\nX. Supervisar que el personal a su cargo cumpla en tiempo y forma con la aplicación de los procedimientos adecuados en las funciones que desempeñen, emitiendo en consecuencia las medidas que considere pertinentes;\nXI. Constatar que los papeles de trabajo contengan la evidencia suficiente y competente para sustentar una opinión sobre la captación, custodia administración y aplicación de los recursos públicos;\nXII. Revisar y validar los pliegos de recomendaciones vinculantes, derivados del proceso de fiscalización de las cuentas públicas y enviarlos al Jefe de Departamento para su validación;\nXIII. Controlar el proceso de elaboración del proyecto de informe del resultado de la evaluación del desempeño, y turnarlo al Jefe de Departamento para su revisión y autorización en su caso;\nXIV. Participar en las visitas domiciliarias con carácter de auditoría con el fin de supervisar los trabajos en campo;\nXV. Elaborar y presentar al Jefe de Departamento los informes, estudios y opiniones que le sean requeridos;\nXVI. Administrar eficazmente los recursos humanos, materiales y financieros a su cargo;\nXVII. Evaluar y reportar al Jefe de Departamento, el desempeño del personal; y\nXVIII. Las demás que le señalen sus superiores jerárquicos.\nCAPÍTULO QUINTO\nATRIBUCIONES DE LOS AUDITORES\nARTÍCULO 32.- Los Auditores tendrán las siguientes atribuciones:\nI. Realizar las auditorías, visitas, revisiones e inspecciones para las cuales sean comisionados, sujetándose a las leyes y reglamentos aplicables, al Código de Ética, a los manuales de organización y de procedimientos y demás criterios emitidos por la Auditoría General;\nII. Realizar las notificaciones relativas a los actos de fiscalización en que participen;\nIII. Levantar las actas circunstanciadas en presencia de dos testigos, en las que se harán constar hechos u omisiones que hubieren encontrado durante sus actuaciones;\nIV. Realizar compulsas de la documentación comprobatoria relativa a las obras, bienes o servicios relacionados con los terceros que hubieren contratado con las entidades fiscalizables, dentro de las auditorías, visitas e inspecciones en las cuales sean comisionados;\nEVALUACION DE LA AUDITORÍA GENERAL DEL ESTADO DEL H.\nCONGRESO DEL ESTADO DE GUERRERO, EN SESIÓN DE FECHA\nCATORCE DE AGOSTO DE DOS MIL DOCE, LO ANTERIOR PARA\nNÚMERO 1028 DE FISCALIZACIÓN SUPERIOR Y RENDICION DE\nCUENTAS DEL ESTADO DE GUERRERO\nV. Analizar y evaluar la información y documentación que se les proporcione, en la práctica de las Auditorías, visitas, revisiones e inspecciones;\nVI. Elaborar los papeles de trabajo de sus actos de fiscalización, así como las cédulas de observaciones para integrar los expedientes;\nVII. Elaborar el Informe Final de los actos de fiscalización en que participen;\nVIII. Organizar, clasificar, archivar y guardar la reserva debida, de acuerdo a las disposiciones aplicables, de la información y documentación de que tengan conocimiento; y\nIX. Las demás que se les confieran en los acuerdos delegatorios de facultades y las que deriven de otras disposiciones legales y normativas aplicables.\nTÍTULO VI\nSUBDIRECCIONES Y AUXILIARES\nDEL AUDITOR GENERAL\nCAPÍTULO ÚNICO\nATRIBUCIONES DE LAS\nSUBDIRECCIONES\nARTÍCULO 33.- Son atribuciones de las subdirecciones de la Dirección de Asuntos Jurídicos, Dirección de Administración y Finanzas, y de los auxiliares del Auditor General:\nI. Planear y programar anualmente las actividades correspondientes al área a su cargo y someterlos a la consideración de su superior jerárquico, de acuerdo a los lineamientos que en esta materia estén establecidos;\nII. Formular los estudios, opiniones, dictámenes, informes y demás documentos que les sean requeridos por su superior jerárquico;\nIII. Proporcionar, conforme a sus atribuciones y de acuerdo con las instrucciones de su superior jerárquico, la información, documentación, datos, informes y asesorías, y la cooperación técnica que le requieran otras áreas de la Auditoría General;\nIV. Acordar con su superior jerárquico los asuntos de la unidad administrativa a su cargo que requieran de su atención;\nV. Formular y proponer a su superior jerárquico los anteproyectos de programas anuales de actividades y de presupuesto de la Unidad Administrativa a su cargo;\nVI. Vigilar el cumplimiento de las disposiciones que regulan la organización y el funcionamiento de la Unidad Administrativa a su cargo;\nVII. Suscribir los documentos relativos al ejercicio de sus atribuciones y aquellos que les sean señalados por delegación, o que les correspondan por suplencia;\nEVALUACION DE LA AUDITORÍA GENERAL DEL ESTADO DEL H.\nCONGRESO DEL ESTADO DE GUERRERO, EN SESIÓN DE FECHA\nCATORCE DE AGOSTO DE DOS MIL DOCE, LO ANTERIOR PARA\nNÚMERO 1028 DE FISCALIZACIÓN SUPERIOR Y RENDICION DE\nCUENTAS DEL ESTADO DE GUERRERO\nVIII. Coordinar sus actividades con los titulares de las demás unidades administrativas para el mejor desempeño de sus funciones;\nIX. Proponer a su superior jerárquico las modificaciones jurídicas y administrativas que tiendan a mejorar el desempeño de la Unidad Administrativa a su cargo;\nX. Proponer a su superior jerárquico el ingreso, licencia, promoción, remoción y cese de los titulares de las unidades administrativas bajo su adscripción, con excepción de los que pertenezcan al\nServicio Civil de Carrera;\nXI. Participar, en el ámbito de su competencia, en la elaboración, ejecución y modificación de los reglamentos, manuales administrativos y cualquier otra disposición jurídica o administrativa;\nXII. Proponer a su superior jerárquico la investigación, en el ámbito de su competencia, de los actos u omisiones que impliquen alguna irregularidad o conducta ilícita;\nXIII. Proponer al superior jerárquico, la implantación de programas de formación, capacitación y especialización para mejorar la preparación técnica y profesional del personal a su cargo;\nXIV. Desempeñar las comisiones y actividades encomendadas, y mantener informado a su superior jerárquico sobre su desarrollo; y\nXV. Las demás que le señalen los manuales de organización y procedimientos que expida la\nAuditoría General y demás disposiciones legales aplicables o les asigne directamente el Auditor General.\nTÍTULO VII\nSUPLENCIA DE LOS FUNCIONARIOS\nDE LA AUDITORÍA GENERAL\nCAPÍTULO ÚNICO\nDISPOSICIONES GENERALES\nARTÍCULO 34.- Las ausencias temporales del Auditor General que no excedan de quince días hábiles serán suplidas por los Auditores Especiales en el orden siguiente:\nI. El Auditor Especial del Sector Gobierno;\nII. El Auditor Especial del Sector Ayuntamientos;\nIII. El Auditor Especial de Organismos Públicos Descentralizados y Órganos Autónomos; y\nIV. El Auditor Especial de Evaluación del Desempeño.\nSi exceden del término de quince días, la Comisión de Gobierno del Congreso deberá aprobar la permanencia del Auditor Especial en funciones.\nEVALUACION DE LA AUDITORÍA GENERAL DEL ESTADO DEL H.\nCONGRESO DEL ESTADO DE GUERRERO, EN SESIÓN DE FECHA\nCATORCE DE AGOSTO DE DOS MIL DOCE, LO ANTERIOR PARA\nNÚMERO 1028 DE FISCALIZACIÓN SUPERIOR Y RENDICION DE\nCUENTAS DEL ESTADO DE GUERRERO\nARTÍCULO 35.- En caso de ausencia definitiva del Auditor General y, en tanto se designa un nuevo titular conforme a las disposiciones de la Ley de Fiscalización, la titularidad de la Auditoría General recaerá en un encargado de despacho, en el orden de prelación establecido en el artículo anterior.\nSi la ausencia definitiva se produce en los recesos del Congreso del Estado, corresponderá a la\nComisión Permanente determinar al Auditor Especial que quedará como encargado del despacho de la\nAuditoría, hasta que se produzca el nuevo nombramiento del Auditor.\nARTÍCULO 36.- Las ausencias temporales de los Auditores Especiales serán suplidas en la prelación siguiente:\nI.- De los Auditores Especiales del Sector Gobierno, del Sector Ayuntamientos y del de\nOrganismos Públicos Descentralizados y Órganos Autónomos:\na) El Director de Auditoría Financiera;\nb) El Director de Solventación; y\nc) El Director Auditoría de Obra Pública.\nII.- Del Auditor Especial de Evaluación del Desempeño:\na) Director de Auditoría de Evaluación al Desempeño a Poderes del Estado, Organismos\nParaestatales y Autónomos;\nb) Director de Normatividad y Control de Calidad; y\nc) Director de Auditoría de Evaluación al Desempeño a Municipios.\nEVALUACION DE LA AUDITORÍA GENERAL DEL ESTADO DEL H.\nCONGRESO DEL ESTADO DE GUERRERO, EN SESIÓN DE FECHA\nCATORCE DE AGOSTO DE DOS MIL DOCE, LO ANTERIOR PARA\nNÚMERO 1028 DE FISCALIZACIÓN SUPERIOR Y RENDICION DE\nCUENTAS DEL ESTADO DE GUERRERO\nTÍTULO VIII\nINFRACCIONES DE LOS\nSERVIDORES PÚBLICOS\nDE LA AUDITORÍA GENERAL\nCAPÍTULO ÚNICO\nDISPOSICIONES GENERALES\nARTÍCULO 37.- Constituyen infracciones de los servidores públicos de la Auditoría General, además de las establecidas en la Ley de Fiscalización, las siguientes:\nI. Incurrir en alguno de los supuestos establecidos en el artículo 103 de la Ley de Fiscalización;\nII. Dejar de dar exacto cumplimiento a lo establecido en el presente reglamento;\nIII. No devolver en tiempo y forma la información y documentación proporcionada por las entidades fiscalizables;\nIV. Dejar de promover el fincamiento de responsabilidades a los titulares, servidores, ex servidores públicos de las entidades fiscalizables, auditores externos, los ciudadanos, o cualquier persona física o moral con motivo de la fiscalización de los informes semestrales y las cuentas públicas;\nV. Abstenerse injustificadamente de sancionar a los infractores de la Ley de Fiscalización;\nVI. No denunciar ante su superior jerárquico los hechos que, a su juicio, sean causa de responsabilidad administrativa imputable a servidores públicos sujetos a su dirección;\nVII. Inhibir por sí, o por interpósita persona, que cualquier ciudadano pueda presentar quejas y denuncias con motivo de presuntas violaciones a la normatividad en materia de fiscalización; y\nVIII. Incurrir en la comisión de cualquier falta prevista en la Ley de Fiscalización.\nARTÍCULO 38.- Las infracciones establecidas en el artículo anterior, se sancionarán de conformidad con lo previsto en la Ley de Fiscalización, sin perjuicio de las acciones legales y administrativas conducentes en términos de las disposiciones legales aplicables.\nARTÍCULO PRIMERO.- El presente Reglamento entrará en vigor a partir del día siguiente al de\nARTÍCULO SEGUNDO.- La Auditoría General deberá aprobar y publicar, dentro de los dos meses siguientes a la entrada en vigor del presente ordenamiento, el Reglamento del Servicio Civil de\nEVALUACION DE LA AUDITORÍA GENERAL DEL ESTADO DEL H.\nCONGRESO DEL ESTADO DE GUERRERO, EN SESIÓN DE FECHA\nCATORCE DE AGOSTO DE DOS MIL DOCE, LO ANTERIOR PARA\nNÚMERO 1028 DE FISCALIZACIÓN SUPERIOR Y RENDICION DE\nCUENTAS DEL ESTADO DE GUERRERO\nCarrera. Una vez en vigor, realizará las gestiones necesarias para implementar el Servicio Civil dentro de los dos meses siguientes.\nARTÍCULO TERCERO.- La Auditoría General expedirá, en su caso, los Manuales de\nOrganización y Procedimientos, dentro de los seis meses siguientes a la publicación del presente ordenamiento.\nARTÍCULO CUARTO.- El Código de Ética deberá emitirse dentro de los primeros tres meses a partir de la entrada en vigor de este Reglamento.\nARTÍCULO QUINTO.- Se derogan todas aquellas disposiciones de igual o menor jerarquía que se opongan al presente Reglamento.\nARTICULO SEXTO.- Todos los procesos y procedimientos iniciados con anterioridad a la entrada en vigor de este reglamento, se substanciarán y se concluirán conforme a los lineamientos y disposiciones legales existentes con antelación a su entrada en vigor.\"\nSEGUNDO.- REMITASE UN TANTO DEL PRESENTE ACUERDO A LA COMISION DE\nVIGILANCIA Y EVALUACION DEL H. CONGRESO DEL ESTADO DE GUERRERO, PARA LA\nAPROBACION Y RATIFICACION DE LA REFORMA AL REGLAMENTO INTERIOR DE LA AUDITORIA\nGENERAL DEL ESTADO EN TERMINOS DEL PUNTO PRIMERO QUE ANTECEDE, LO ANTERIOR EN\nCUMPLIMIENTO A LO ESTABLECIDO EN LOS ARTICULOS 90 FRACCION XI Y XII, Y 185 FRACCION\nVII DE LA LEY NUMERO 1028 DE FISCALIZACION SUPERIOR Y RENDICION DE CUENTAS DEL\nESTADO DE GUERRERO.\nPRIMERO.- EL PRESENTE ACUERDO SURTIRA SUS EFECTOS A PARTIR DEL DÍA\nESTADO.\nSEGUNDO.- PREVIA APROBACION Y RATIFICACION DE LA COMISION DE VIGILANCIA Y\nGENERAL DEL ESTADO QUE MEDIANTE ESTE ACUERDO SE EMITE, Y PARA LOS EFECTOS\nESTABLECIDOS EN EL ARTICULO PRIMERO TRANSITORIO DE DICHO REGLAMENTO, SE\nEVALUACION DE LA AUDITORÍA GENERAL DEL ESTADO DEL H.\nCONGRESO DEL ESTADO DE GUERRERO, EN SESIÓN DE FECHA\nCATORCE DE AGOSTO DE DOS MIL DOCE, LO ANTERIOR PARA\nNÚMERO 1028 DE FISCALIZACIÓN SUPERIOR Y RENDICION DE\nCUENTAS DEL ESTADO DE GUERRERO\nGUERRERO.\nLATABÁN LÓPEZ, AUDITOR GENERAL DEL ESTADO DE GUERRERO, EN LA CIUDAD DE\nCHILPANCINGO DE LOS BRAVO, GUERRERO, A LOS SIETE DÍAS DEL MES DE SEPTIEMBRE DEL\nAÑO DOS MIL DOCE.\nPUBLÍQUESE Y CÚMPLASE.",
  "ordenamiento": "REGLAMENTO",
  "jurisdiccion": "GUERRERO",
  "fuente_oficial": "DIARIO OFICIAL DE LA FEDERACION",
  "Fecha de Publicación": "28 DE SEPTIEMBRE DE 2018",
  "ULTIMA REFORMA PUBLICADA": "28 DE SEPTIEMBRE DE 2018",
  "status": "ABROGADA",
  "es_escaneado": false,
  "tiene_tablas": false,
  "materia": [
    "auditoría"
  ]
}