{
  "titulo": "Acuerdo por el Que Se Emiten las Reglas de Operación del Programa de Fortalecimiento del Empleo Juve",
  "Contenido": "EMPRENDEDORES, PUBLICADO EN EL DECRETO NÚMERO\n438 DEL PRESUPUESTO DE EGRESOS DEL ESTADO DE\nGUERRERO PARA EL EJERCICIO FISCAL 2014 DEL\n1. I NTRODUCCIÓN.............................................................................................................................. 7\n1.1 META............................................................................................................................................... 8\n2. OBJETIVO......................................................................................................................................... 8\n2.1 OBJETIVO GENERAL..................................................................................................................... 8\n2.2 OBJETIVOS ESPECÍFICOS............................................................................................................ 8\n2.3 POBLACIÓN OBJETIVO Y BENEFICIARIOS.................................................................................. 8\n3. MISIÓN.............................................................................................................................................. 8\n4. VISIÓN.............................................................................................................................................. 8\n5. REGLAS DE OPERATIVIDAD........................................................................................................... 9\n5.1 LINEAMIENTOS GENERALES........................................................................................................ 9\n5.2 FUNDAMENTO LEGAL................................................................................................................... 11\n5.3 PARTICIPANTES............................................................................................................................ 12\n5.4 PATRIMONIO DEL PROGRAMA..................................................................................................... 13\n5.5 TIPOS DE APOYO........................................................................................................................... 13\n6. INFORMACIÓN DEL PROGRAMA.................................................................................................... 15\n6.1 EXPOSICIÓN DEL PROGRAMA..................................................................................................... 15\n6.2 COBERTURA DEL PROGRAMA..................................................................................................... 15\n6.3 MODOS DE ENTREGA DEL BENEFICIO....................................................................................... 16\n7. TRANSPARENCIA............................................................................................................................ 17\n7.1 APORTACION DE LOS BENEFICIARIOS....................................................................................... 18\nEMPRENDEDORES, PUBLICADO EN EL DECRETO NÚMERO\n438 DEL PRESUPUESTO DE EGRESOS DEL ESTADO DE\nGUERRERO PARA EL EJERCICIO FISCAL 2014 DEL\n7.2 RECURSOS NO DEVENGADOS.................................................................................................... 18\n7.3 AUDITORIA, CONTROL Y SEGUIMIENTO..................................................................................... 19\n7.4 EVALUACIÓN Y SEGUIMIENTO..................................................................................................... 19\n7.5 SEGUIMIENTO DE AVANCES FÍSICOS FINANCIEROS................................................................ 19\n7.6 BLINDAJE ELECTORAL.................................................................................................................. 19\n7.7 CONTRALORÍA SOCIAL................................................................................................................. 20\n7.7.1 INTEGRACIÓN............................................................................................................................. 20\n7.7.2 CAPACITACIÓN Y ASESORÍA..................................................................................................... 21\n7.2.3 SEGUIMIENTO............................................................................................................................. 21\n7.8 QUEJAS Y DENUNCIAS................................................................................................................. 22\n8. CRITERIOS DE SELECCIÓN Y ELEGIBILIDAD................................................................................ 23\n8.1 MÉTODO DE SELECCIÓN DE BENEFICIARIOS............................................................................ 23\n9. MECÁNICA DE OPERACIÓN............................................................................................................ 23\n9.1 INSTANCIA EJECUTORA............................................................................................................... 23\n9.2 INSTANCIA NORMATIVA................................................................................................................ 23\n9.3 EJECUCIÓN.................................................................................................................................... 23\n10. DERECHOS, OBLIGACIONES Y SANCIONES DE LOS BENEFICIARIOS\nDEL PROGRAMA.................................................................................................................................. 24\n10.1 DERECHOS................................................................................................................................... 24\n10.2 OBLIGACIONES............................................................................................................................ 24\nEMPRENDEDORES, PUBLICADO EN EL DECRETO NÚMERO\n438 DEL PRESUPUESTO DE EGRESOS DEL ESTADO DE\nGUERRERO PARA EL EJERCICIO FISCAL 2014 DEL\n10.3 SANCIONES.................................................................................................................................. 24\n22. INTERPRETACIÓN......................................................................................................................... 24\nEMPRENDEDORES, PUBLICADO EN EL DECRETO NÚMERO\n438 DEL PRESUPUESTO DE EGRESOS DEL ESTADO DE\nGUERRERO PARA EL EJERCICIO FISCAL 2014 DEL\nTEXTO ORIGINAL\nAcuerdo Publicado en el Periódico Oficial del Gobierno del Estado No. 37 el día Viernes 09 de\nMayo de 2014.\nACUERDO POR EL QUE SE EMITEN LAS REGLAS DE OPERACIÓN DEL PROGRAMA DE\nFORTALECIMIENTO DEL EMPLEO JUVENIL, DESARROLLO Y FORMACIÓN DE\nEMPRENDEDORES, PUBLICADO EN EL DECRETO NÚMERO 438 DEL PRESUPUESTO DE\nEGRESOS DEL ESTADO DE GUERRERO PARA EL EJERCICIO FISCAL 2014 DEL PERIÓDICO\nOFICIAL DEL GOBIERNO DEL ESTADO DE GUERRERO DEL 27 DE DICIEMBRE DE 2013.\nLic. Eduardo Basilio Melo, Secretario de la Juventud y la Niñez, con fundamento en los artículos\n18 Fracción XV, 19 y 33 de la Ley Orgánica de la Administración Pública del Estado de Guerrero; 1, 2,3 y\n4 del presupuesto de egresos del Estado de Guerrero para el Ejercicio Fiscal del presente Año.\nConsiderando\nQue el decreto y dictamen de presupuesto de egresos del estado de Guerrero para el ejercicio fiscal 2014, refiere que los recursos presupuestados para la ejecución de los programas, constituyen uno de los principales factores para satisfacer en la medida de lo posible, las principales demandas de la ciudadanía y de la población juvenil (18 a 29 años) expresadas en el Plan Estatal de Desarrollo 2011 -\n2015.\nQue la actual administración pone especial atención a la población que presenta problemas y/o necesidades de tipo apremiante social, cultural, deportiva, para el desarrollo humano y productivo de capacitación. Así como las acciones mayormente relevantes, de menor costo, solicitadas por la población de las siete regiones del Estado, caracterizadas por la pobreza extrema.\nQue el programa \"Fortalecimiento del Empleo Juvenil, Desarrollo y Formación de\nEmprendedores\", tiene como principal objetivo proporcionar las condiciones sociales para que las y los jóvenes cuenten con los elementos básicos de infraestructura social, servicios y apoyos asistenciales urgentes, a fin de que en igualdad de oportunidades y respeto a los derechos constitucionales, accedan a los satisfactores mínimos de bienestar social.\nPor lo anteriormente expuesto y fundado tengo a bien expedir el siguiente:\nAcuerdo\nPrimero: Se emiten las reglas de operación del programa \"Fortalecimiento del Empleo\nJuvenil, Desarrollo y Formación de Emprendedores\", para el ejercicio Fiscal 2014 contenidas en el\nEMPRENDEDORES, PUBLICADO EN EL DECRETO NÚMERO\n438 DEL PRESUPUESTO DE EGRESOS DEL ESTADO DE\nGUERRERO PARA EL EJERCICIO FISCAL 2014 DEL anexo del presente instrumento y que para todos los efectos se consideran como parte integrante del mismo. Segundo: Se abrogan las Reglas de operación del programa \"Fortalecimiento del Empleo\nJuvenil, Desarrollo y Formación de Emprendedores\" publicadas en el periódico oficial de Gobierno del Estado de Guerrero, No. 42, de fecha 24 de mayo de 2013.\nTransitorio\nPrimero: Las siguientes reglas de operación entrarán en vigor al día siguiente de su publicación en el periódico oficial del Gobierno del Estado de Guerrero.\nDado en la ciudad de Chilpancingo, Guerrero a los 31 días del mes de enero del año dos mil catorce\nSECRETARIO DE LA JUVENTUD Y LA NIÑEZ.\nLIC. EDUARDO BASILIO MELO\nRúbrica.\nÍNDICE\n1. I NTRODUCCIÓN\n1.1 META\n2. OBJETIVO\n2.1 OBJETIVO GENERAL\n2.2 OBJETIVOS ESPECÍFICOS\n2.3 POBLACIÓN OBJETIVO Y BENEFICIARIOS\n3. MISIÓN.\n4. VISIÓN\n5. REGLAS DE OPERATIVIDAD\n5.1 LINEAMIENTOS GENERALES\nEMPRENDEDORES, PUBLICADO EN EL DECRETO NÚMERO\n438 DEL PRESUPUESTO DE EGRESOS DEL ESTADO DE\nGUERRERO PARA EL EJERCICIO FISCAL 2014 DEL\n5.2 FUNDAMENTO LEGAL\n5.3 PARTICIPANTES\n5.4 PATRIMONIO DEL PROGRAMA\n5.5 TIPOS DE APOYO\n6. INFORMACIÓN DEL PROGRAMA\n6.1 EXPOSICIÓN DEL PROGRAMA\n6.2 COBERTURA DEL PROGRAMA\n6.3 MODOS DE ENTREGA DEL BENEFICIO\n7. TRANSPARENCIA\n7.1 APORTACION DE LOS BENEFICIARIOS\n7.2 RECURSOS NO DEVENGADOS\n7.3 AUDITORIA, CONTROL Y SEGUIMIENTO\n7.4 EVALUACIÓN Y SEGUIMIENTO\n7.5 SEGUIMIENTO DE AVANCES FÍSICOS FINANCIEROS\n7.6 BLINDAJE ELECTORAL\n7.7 CONTRALORÍA SOCIAL\n7.7.1 INTEGRACIÓN\n7.7.2 CAPACITACIÓN Y ASESORÍA\n7.2.3 SEGUIMIENTO\n7.8 QUEJAS Y DENUNCIAS\nEMPRENDEDORES, PUBLICADO EN EL DECRETO NÚMERO\n438 DEL PRESUPUESTO DE EGRESOS DEL ESTADO DE\nGUERRERO PARA EL EJERCICIO FISCAL 2014 DEL\n8. CRITERIOS DE SELECCIÓN Y ELEGIBILIDAD\n8.1 MÉTODO DE SELECCIÓN DE BENEFICIARIOS\n9. MECÁNICA DE OPERACIÓN\n9.1 INSTANCIA EJECUTORA\n9.2 INSTANCIA NORMATIVA\n9.3 EJECUCIÓN\n10. DERECHOS, OBLIGACIONES Y SANCIONES DE LOS BENEFICIARIOS DEL PROGRAMA\n10.1 DERECHOS\n10.2 OBLIGACIONES\n10.3 SANCIONES\n22. INTERPRETACIÓN\nREGLAS DE OPERACIÓN\nPROGRAMA: FORTALECIMIENTO DEL EMPLEO JUVENIL, DESARROLLO Y FORMACIÓN\nDE EMPRENDEDORES\n1. INTRODUCCIÓN\nMediante la aplicación de este programa en el Estado de Guerrero se fomentara el autoempleo entre los jóvenes con edad de 18 a 29 años de edad al 30 de noviembre del 2014 que deseen emprender su propia microempresa; este programa ofertara un apoyo económico, asesorías y las gestiones necesarias y pertinentes para concretar una empresa propia, que permita fortalecer la autosuficiencia del trabajo para sí mismos o en equipo, basada en las oportunidades que en sus comunidades existen y de esta forma propiciar su bienestar económico y social, el de sus comunidades y disminuir su migración. co-inversión con el Instituto Mexicano de la Juventud con el Programa que ellos emplean y el cual se denomina \"Emprendedores Juveniles\" y poder ampliar la bolsa de recursos a utilizar mediante este programa, de ser así entonces nos alinearíamos a las reglas de operación que el IMJUVE o alguna otra\nEMPRENDEDORES, PUBLICADO EN EL DECRETO NÚMERO\n438 DEL PRESUPUESTO DE EGRESOS DEL ESTADO DE\nGUERRERO PARA EL EJERCICIO FISCAL 2014 DEL institución que desee co-invertir en con la Secretaría de la Juventud y la Niñez para la correcta aplicación de los recursos.\n1.1 META\nPara este programa se cuenta con un presupuesto aprobado por parte de Inversión Estatal\nDirecta por $3'000,000.00 (Tres millones de pesos 00/100 M.N.) serán destinados a la capacitación de los jóvenes que deseen mejores sus habilidades administrativas, financieras, manejo de personal, calidad en el servicio y ventas; con esto empoderar a los jóvenes y aumentar la motivación de emprender y/o mejorar las empresas con que cuentan. Con dicho presupuesto se beneficiaran a por lo menos 138 jóvenes emprendedores.\n2. OBJETIVO\n2.1 OBJETIVO GENERAL\nApoyar a jóvenes guerrerenses mediante apoyos económicos y asesoría para la creación de su propia fuente de empleo.\n2.2 OBJETIVOS ESPECÍFICOS\n• Fomentar el trabajo individual y organizado de las y los jóvenes, mediante la promoción y apoyo en la formación de empresas.\n• Promover el arraigo de los jóvenes en sus comunidades mediante actividades productivas.\n2.3 POBLACIÓN OBJETIVO Y BENEFICIARIOS\nJóvenes y grupos de jóvenes de 18 a 29 años de edad (cumplidos al 30 de noviembre del 2013), que ejecuten por si mismos proyectos que les permitan beneficiarse con los recursos producto de este programa y las aportaciones que ellos mismos realicen.\nPodrá beneficiarse a un joven por familia. Se excluye a los familiares directos e indirectos de jóvenes beneficiados en ediciones anteriores del presente programa.\n3. MISIÓN. empresa, lo cual permitirá fomentar el autoempleo entre los jóvenes del Estado de Guerrero.\n4. VISIÓN. emprendedoras se lograra el desarrollo de una cultura empresarial en el Estado de Guerrero.\nEMPRENDEDORES, PUBLICADO EN EL DECRETO NÚMERO\n438 DEL PRESUPUESTO DE EGRESOS DEL ESTADO DE\nGUERRERO PARA EL EJERCICIO FISCAL 2014 DEL\n5. REGLAS DE OPERATIVIDAD\n5.1 Lineamientos generales\nPrimera.- Una vez que las presentes reglas de operación sean validadas y publicadas, se dará a conocer la convocatoria si cumplen con los requisitos, podrán tener acceso a este programa todos los jóvenes de 18 a 29 años de edad (cumplidos al 30 de noviembre del 2014) que ejecuten por si mismos proyectos, mediante la presentación de propuestas productivas que fomenten la creación de empleos. Y deberán inscribirse al correo electrónico de emprendedores. sejuve/2014@gmail. com mediante el formato de registro el cual se encontrara disponible en el portal de la Secretaría de la Juventud y la Niñez en la página de internet de Gobierno del Estado la cual es Http://Guerrero.\nGob.Mx/Dependencias/Secretaria-De-La-Juventud/. Dichas propuestas serán evaluadas por el\nConsejo Técnico Evaluador el cual será creado a partir de la invitación a Instituciones Públicas y\nEmpresas Privadas, Cámaras Empresariales, Centros de Desarrollo de Empresas; Organizaciones\nCiviles; Empresarios locales y Colegios, para que propongan a personas con reconocido prestigio, calidad moral y experiencia en el manejo de empresas, a efecto de integrar el Consejo Técnico\nEvaluador, al que deberán pertenecer integrantes de Cámaras Empresariales, empresarios locales y un representante de la Delegación Estatal/Municipal de la Secretaría de Economía, El Consejo Técnico\nEvaluador, deberá integrarse siempre en número impar.\nSegunda.- El apoyo podrá ser solicitado para desarrollar proyectos de carácter lícito, de tipo tradicional, tecnología intermedia y alta tecnología.\nTercera.- El monto a otorgar, será determinado por el Consejo Técnico Evaluador, de acuerdo a lo anteriormente descrito, características y requerimientos propios de los proyectos participantes.\nCuarta.- La Secretaría de la Juventud y la Niñez recibirá la documentación y propuestas productivas de los jóvenes; integrarán los expedientes de conformidad a estas reglas de operación.\nY verificara que las propuestas y requisitos entregados por los jóvenes participantes, cuenten con los requisitos indicados en las presentes reglas de operación, procediendo a validar aquellas que, integren los requisitos indicados por el Consejo Técnico Evaluador.\nQuinta.- Los jóvenes deberán realizar aportaciones directamente vinculadas al proyecto, tales como inversiones previamente realizadas, consistentes en maquinaria, equipo, mobiliario, artículos de oficina, terreno, lugar donde se opera el proyecto, propio o rentado y en general, todas las inversiones realizadas para el arranque de la empresa o negocio el cual en total deberá de ser del 10%.\nSexta.- Con el fin de incentivar y apoyar el crecimiento y consolidación de la empresa o negocio,\nEMPRENDEDORES, PUBLICADO EN EL DECRETO NÚMERO\n438 DEL PRESUPUESTO DE EGRESOS DEL ESTADO DE\nGUERRERO PARA EL EJERCICIO FISCAL 2014 DEL recibido, en un plazo no mayor a 12 meses, después de un período de gracia de dos meses, para iniciar el reintegro de los recursos, mediante depósitos mensuales en la cuenta bancaria que indicará la\nSecretaría de la Juventud y la Niñez del Estado de Guerrero. Solo se realizara la devolución del capital ya que no se cobraran comisiones por disposición ni tasa de interés.\nSéptima.- Para los jóvenes y grupos de jóvenes que inician nuevas empresas o negocios, que cuenten con Registro Federal de Contribuyentes emitido durante el período enero-noviembre del 2014.\nInscritos en cualquier régimen fiscal que corresponda, de acuerdo a las actividades económicas que realice como persona física o moral. Podrán participar en la categoría \"A\".\nOctava.- Jóvenes en lo individual o en grupo, que cuenten con un negocio o empresa en crecimiento y deseen fortalecerlo y que presenten Registro Federal de Contribuyentes, emitido durante el período enero-diciembre del 2013 inscritos en cualquier régimen fiscal que corresponda, de acuerdo a las actividades económicas que realice, como persona física o moral. Podrá participar en la categoría \"B\".\nNovena.- Los participantes, podrán presentar sus proyectos productivos, de acuerdo al Manual y la guía del Emprendedor (diseñados para tal fin), escritos a máquina o computadora con buena presentación, en letra arial 12, en hojas tamaño carta, en una sola cara, foliadas, engargoladas o en fólder con broche. Los proyectos deberán entregarse en original y copia como se aclara en los siguientes puntos:\n• Estar escritos en forma clara y congruente.\n• Demostrar liquidez y capacidad de pago.\n• Especificar claramente sobre la aplicación del recurso a recibir.\n• Evidenciar la factibilidad y rentabilidad de empresa o negocio.\nDécima.- La Secretaría de la Juventud y la Niñez del Estado de Guerrero. Proporcionará a los jóvenes participantes el Manual del Emprendedor mencionado, así como las asesorías pertinentes, para la conformación del proyecto productivo e integración del expediente, la Secretaría de la Juventud del\nEstado de Guerrero, ubicada en:\nPalacio de Gobierno, Edificio Montaña Planta Baja\nBoulevard René Juárez Cisneros No. 62, Col. Ciudad de los Servicios, C.P. 39075;\nChilpancingo guerrero.\nTeléfono: 01747 4719945\nDécima Primera.- Los proyectos participantes serán evaluados por el Consejo Técnico\nEvaluador de acuerdo a los siguientes criterios:\nEMPRENDEDORES, PUBLICADO EN EL DECRETO NÚMERO\n438 DEL PRESUPUESTO DE EGRESOS DEL ESTADO DE\nGUERRERO PARA EL EJERCICIO FISCAL 2014 DEL\n1. Viabilidad técnica, financiera y comercial del proyecto.\n2. Ser generador de empleo (1 a 3).\n3. Reflejar una adecuada rentabilidad y capacidad de pago.\n4. El fallo del Consejo Técnico Evaluador, será inapelable.\nDécima Segunda.- Los jóvenes beneficiados por esta convocatoria para la generación de empleo, deberán dirigir personalmente la empresa o negocio de que se trate.\nDécima Tercera.- Previo a la recepción del recurso, los jóvenes beneficiarios por la presente convocatoria, deberán asistir a la capacitación para emprendedores en la sede que indique la Secretaría de la Juventud y la Niñez del Estado de Guerrero; con el propósito de proporcionar los elementos y herramientas necesarias para la administración oportuna y eficiente de su empresa o negocio.\nDécima Cuarta.- El plazo máximo de resolución por parte del Consejo Técnico Evaluador será el\n19 de diciembre de 2014. La Secretaría de la Juventud del Estado de Guerrero; notificara los resultados a los jóvenes participantes que resulten beneficiarios.\nDécima Quinta.- Se notificara el resultado a los y las jóvenes que serán beneficiados, vía telefónica pueden llamar al 01(7479 47 1 99 45, o solicitar información al correo electrónico sejuve.guerrero.gob.mx, o revisar los resultados por la publicación en página web la cual es: http://guerrero.gob.mx/ dependencias/secretaria-de-la-juventud/\nDécima Sexta.- La Secretaría de la Juventud y la Niñez del Estado de Guerrero, elaborará pólizas y pagares para que los jóvenes que resulten seleccionados firmen a la entrega de sus recursos.\nDécima Séptima.- La Secretaría de la Juventud del Estado de Guerrero, implementará y realizará acciones de acompañamiento y seguimiento a los proyectos beneficiados por ésta convocatoria, con el propósito de asesorar a los emprendedores durante el periodo de arranque y fortalecimiento de sus empresas.\nDécima octava.- La Secretaría de la Juventud y la Niñez del Estado de Guerrero, mantendrá de los recursos otorgados.\n5. 2 FUNDAMENTO LEGAL\n2014, refiere que los recursos propuestos para la ejecución de los programas, constituyen uno de los principales factores para satisfacer en la medida de lo posible, las principales demandas de la ciudadanía y de la población juvenil (entre 18 a 29 años) expresadas en el Plan Estatal de Desarrollo 2011-2015.\nEMPRENDEDORES, PUBLICADO EN EL DECRETO NÚMERO\n438 DEL PRESUPUESTO DE EGRESOS DEL ESTADO DE\nGUERRERO PARA EL EJERCICIO FISCAL 2014 DEL\nLa actual administración pone especial atención a la población que presenta problemas y/o necesidades de tipo apremiante social, cultural, deportiva, para el desarrollo humano y productivo de capacitación. Así como las acciones mayormente relevantes, de menor costo, solicitadas por la población de las siete regiones del Estado, caracterizadas por la pobreza extrema.\nQue el programa: \"Fortalecimiento del Empleo Juvenil, Desarrollo y Formación de\nEmprendedores\", tiene como principal objetivo proporcionar las condiciones para que los jóvenes tengan acceso a un empleo respetando sus derechos plasmados en la \"Ley de la Juventud del Estado de\nGuerrero 607\".\n5.3 PARTICIPANTES\nLa SEJUVE y todos aquellos jóvenes que cumplan con todos los requisitos estipulados en las presentes reglas de operación así como el IMJUVE (Instituto Mexicano de la Juventud) en concurrencia con la SEJUVE siempre y cuando se firme convenio de co-inversión.\nDe llevarse a cabo la firma de dicho convenio se tendrá que realizar lo siguiente:\nLa Secretaría de la Juventud y la Niñez deberá aperturar una cuenta específica para la administración de los recursos convenidos en co-inversión, para lo cual, el Titular de la Secretaría y/o el responsable de las finanzas, según sea el caso, deberá emitir un oficio de recepción del recurso aportado por el Instituto Mexicano de la Juventud, dirigido al Director de Bienestar y Estímulos a la Juventud, recursos que deberán aplicarse estricta y únicamente para el apoyo de los proyectos de los jóvenes que resulten seleccionados a través de la convocatoria publicada para tal fin.\nLa administración y comprobación de los recursos producto de la co-inversión Secretaría de la\nJuventud-Instituto Mexicano de la Juventud, será responsabilidad de mismas y deberán apegarse a las disposiciones normativas vigentes, aplicables al ejercicio del gasto público federal, sin implicar responsabilidad en este sentido para EL IMJUVE.\nLa Secretaría de la Juventud y la Niñez en co-inversión con el Instituto Mexicano de la Juventud, deberán conservar en resguardo, los documentos inherentes a estas reglas de operación así como los presentes reglas de operación, de conformidad con los criterios, lineamientos y programa de trabajo que se acuerden con el Instituto Mexicano de la Juventud. Los documentos en comento deberán quedar en resguardo por 5 años para cualquier aclaración respecto a la operación del programa, requerida por alguna Instancia Fiscalizadora.\nEMPRENDEDORES, PUBLICADO EN EL DECRETO NÚMERO\n438 DEL PRESUPUESTO DE EGRESOS DEL ESTADO DE\nGUERRERO PARA EL EJERCICIO FISCAL 2014 DEL\n5. 4 PATRIMONIO DEL PROGRAMA\nEl monto aprobado para este programa es de $3'000,000.00 (Tres millones de pesos 00/100\nM.N.), respecto al origen de los recursos que integra y aplica este programa provienen Inversión Estatal\nDirecta para el ejercicio del presente año fiscal.\n5.5 TIPOS DE APOYO\nLos Jóvenes y grupos de jóvenes que deseen iniciar una empresa o fortalecer una recién creada y que cuenten con Registro Federal de Contribuyentes, con alta ante la Secretaría de Hacienda y Crédito\nPúblico, (durante el período enero-octubre de 2014), en cualquier régimen fiscal que corresponda, de acuerdo a las actividades económicas que realice, como persona física o moral, podrá participar en la categoría \"A\" la cual se describe a continuación.\nMonto máximo del Monto máximo de\nCategoría Constitución Legal recurso aportación a cargo de la convocatoria\nJóvenes en lo individual o en grupo, que inicien nuevas empresas o negocios. Que cuenten con Registro Federal de\nContribuyentes emitido durante el período enero\"A\" octubre del 2014. $20,000.00 $18,000.00\nInscritos en cualquier régimen fiscal que corresponda, de acuerdo a las actividades económicas que realice.\nComo persona física o moral.\nJóvenes en lo individual o en grupo, que ya cuenten con un negocio o empresa en crecimiento y deseen fortalecerlo, que presenten Registro Federal de Contribuyentes, registrado ante la Secretaría de corresponda, de acuerdo a las actividades económicas que realice, como persona física o moral. Para aplicar a la categoría \"B\".\nEMPRENDEDORES, PUBLICADO EN EL DECRETO NÚMERO\n438 DEL PRESUPUESTO DE EGRESOS DEL ESTADO DE\nGUERRERO PARA EL EJERCICIO FISCAL 2014 DEL\nMonto\nMonto máximo de\nCategoría Constitución Legal máximo del aportación a recurso cargo de la convocatoria\nJóvenes en lo individual o en grupo, que cuenten con un negocio o empresa en crecimiento y deseen fortalecerlo. Que presenten\nRegistro Federal de\nContribuyentes, emitido\n\"B\" durante el período enero$40,000.00 $36.000.00 diciembre del 2013, inscritos en cualquier régimen fiscal que corresponda, de acuerdo a las actividades económicas que realice, como persona física o moral.\nLas y los jóvenes en lo individual o en grupo, que ya cuenten con un negocio o empresa en crecimiento y deseen fortalecerla, que presenten Registro Federal de Contribuyentes, con alta ante la\n2013, en cualquier régimen fiscal que corresponda, de acuerdo a las actividades económicas que realice, como persona física o moral; lo anterior con el objetivo de demostrar 2 o más años en operación. Para aplicar a la categoría \"C\".\nEMPRENDEDORES, PUBLICADO EN EL DECRETO NÚMERO\n438 DEL PRESUPUESTO DE EGRESOS DEL ESTADO DE\nGUERRERO PARA EL EJERCICIO FISCAL 2014 DEL\nMonto\nMonto máximo de\nCategoría Constitución Legal máximo del aportación a recurso cargo de la convocatoria\nLas y los jóvenes en lo individual o en grupo, que cuenten con un negocio o empresa en crecimiento y deseen fortalecerlo. Que presenten Registro Federal de\n\"C\" $100,000.00 $90,000.00\nContribuyentes, emitido durante el período enero\n2012-diciembre del 2013, como persona física o moral en cualquier régimen fiscal de actividades empresariales.*\n*En el caso de la categoría \"C\" el recurso estará bajo una tasa de crédito no mayor a la tasa inflacionaria promedio del año correspondiente, bajo la administración del intermediario.\n6. INFORMACIÓN DEL PROGRAMA\nLa Secretaría de la Juventud y la Niñez difundirán el \"programa\" en instituciones públicas, privadas y sociales, agrupaciones profesionales, en los municipios a través de los direcciones de la\nJuventud de los Ayuntamientos, colegios, centros de investigación y en el portal de la Secretaría de la\n6. 1 EXPOSICIÓN DEL PROGRAMA información planteados en el punto anterior.\n6.2 COBERTURA DEL PROGRAMA\nLa población joven del estado de Guerrero representa 3.1% de la población joven del país y\n33.5% de la población total del estado. Con 1, 137,287 personas entre 12 y 29 años de edad, Guerrero,\nEMPRENDEDORES, PUBLICADO EN EL DECRETO NÚMERO\n438 DEL PRESUPUESTO DE EGRESOS DEL ESTADO DE\nGUERRERO PARA EL EJERCICIO FISCAL 2014 DEL es el onceavo estado con más jóvenes en la República Mexicana.\nPara caracterizar aún más a los jóvenes del estado es posible desagregarlos por grupos de edad. El primer grupo incluye a los jóvenes de entre 12 y 17 años de edad, el segundo a los de 18 a 23 años de edad y el tercer grupo a los de 24 y 29 años de edad. La Encuesta Nacional de la Juventud 2010 muestra que, 44.0% de los jóvenes de Guerrero tienen entre 12 y 17 años. En el segundo grupo de edad se ubican 30.6% de los jóvenes, y el restante 25.4% pertenece al tercer grupo de edad.\nEstas cifras han variado mínimamente en los últimos diez años. En el año 2000 la distribución porcentual fue la siguiente: 44.3% de los jóvenes pertenecían al primer grupo etario, 31.4% al segundo y\n24.3% al tercero.\nEstas Reglas de operación podrán beneficiar a jóvenes que deseen participar en este programa y se encuentren dentro rango de edad del segundo y tercer grupo etario lo cual representa el 55.7% de la población, en números es un total de 633,468 jóvenes del Estado. Haciendo hincapié en que el monto destinado a este programa solo alcanzaría para apoyar a 139 proyectos con un monto de $18,000.00 en categoría \"A\" o 70 con un monto de hasta $36,000.00 pesos cada uno en la categoría \"B\" y si se apoyaran solo proyectos categoría \"C\" se apoyarían 27 proyectos con un monto máximo de $90,000.00 pesos cada uno. En cada proyecto pueden participar de 1 hasta 5 jóvenes. Por lo tanto el mínimo de jóvenes que se pudieran beneficiar este 2014 será de por lo menos 27 jóvenes. Dicho programa es de cobertura Estatal.\n6.3 MODOS DE ENTREGA DEL BENEFICIO\nPara determinar a los beneficiarios de este programa, se analizarán que los expedientes recibidos cumplan con los siguientes requisitos:\n•Realizar su registro ante la Secretaría de la Juventud.\n•Podrá beneficiarse a un joven por familia\n•Acta de Nacimiento o Certificado de Nacionalidad (copia simple).\n•Clave Única de Registro de Población (CURP), (copia simple).\n•Identificación oficial, (credencial de Elector ó pasaporte, copia simple).\n•Comprobante de domicilio del emprendedor (Recibo telefónico, recibo predial, otros, copia simple)\n•Contar con un tutor solidario del proyecto para su ejecución, entendiéndose como tal a un representante de Institución pública, privada, social o persona física, mayor de edad, no familiar.\n•Carta compromiso del tutor solidario avalando el alcance del proyecto.\n•Identificación oficial del Tutor solidario (credencial de Elector ó pasaporte, copia simple)\n•Presentar tres referencias (no familiares), anexar copia de sus credenciales del IFE, en frente y reverso.\nEMPRENDEDORES, PUBLICADO EN EL DECRETO NÚMERO\n438 DEL PRESUPUESTO DE EGRESOS DEL ESTADO DE\nGUERRERO PARA EL EJERCICIO FISCAL 2014 DEL\n• Copia simple del registro federal de contribuyentes, anexar forma R1 de la SHCP, en donde se especifique el giro y/o actividad económica.\n• Copia simple de la escritura pública constitutiva, en caso de estar constituido legalmente en cualquier figura jurídica asociativa.\n•El emprendedor deberá exhibir el monto de su aportación al proyecto, en especie y en efectivo\n(mediante cuenta bancaria a su nombre).\n• En caso de grupo, cada uno de los integrantes, deberá cumplir con los requisitos generales antes señalados.\n• Todos los solicitantes, deberán declarar bajo protesta de decir verdad, que no reciben otro apoyo federal para el mismo proyecto.\n• En todos los casos, las y los jóvenes aspirantes a participar en el programa, deberán entregar a la Secretaría de la Juventud y la Niñez, la documentación requerida debidamente engargolada, de conformidad al Manual del Emprendedor, entregado previamente por esta secretaría.\n• Presentar el proyecto conforme al Manual del Emprendedor.\nEl apoyo será entregado vía cheque por parte del Titular de la Secretaría de la juventud y la\nNiñez a los beneficiarios que el Consejo Técnico Evaluador designe después de dictaminar los proyectos.\n7. TRANSPARENCIA\nPara garantizar la transparencia en el ejercicio de los recursos, se instrumentarán las siguientes acciones:\n• La Secretaría de la juventud y la Niñez, distribuirá las presentes políticas de operación en\nInstituciones Públicas Estatales y Municipales, en la medida de sus posibilidades, para que sean puestas a disposición de la población juvenil, a fin de que ésta sea informada del modo en que este programa opera.\n• Con basé en lo establecido en la Ley 374 de Transparencia y acceso a la información pública del Estado de Guerrero, la Secretaría de la Juventud presentara presentes reglas de Operación, en la\nInstancias participantes.\n• La información de montos y beneficiarios se dará a conocer en las páginas de Internet de las\nPública Gubernamental. También se pondrá a disposición dicha información a la Contraloría\nGeneral del Estado de Guerrero.\n• Quedan excluidos de participar en este Programa: Partidos Políticos, Agrupaciones Políticas\nNacionales y Locales, Asociaciones o Grupos Religiosos, Organizaciones no Gubernamentales,\nEMPRENDEDORES, PUBLICADO EN EL DECRETO NÚMERO\n438 DEL PRESUPUESTO DE EGRESOS DEL ESTADO DE\nGUERRERO PARA EL EJERCICIO FISCAL 2014 DEL funcionarios de la Secretaría de la Juventud y la Niñez, así como, sus familiares hasta el cuarto grado por afinidad o civil, de acuerdo a la Ley Federal de Responsabilidades administrativas de los Servidores\nPúblicos, familiares de los funcionarios de esta instancia, Organizaciones cuyos miembros formen parte del Consejo Técnico Evaluador y quienes directa o indirectamente estén involucrados en otro proyecto apoyado por la Secretaría de la Juventud y la Niñez.\n7. 1 APORTACION DE LOS BENEFICIARIOS\nLa aportación de los beneficiarios podrá ser en especie (maquinaria, equipo, mobiliario, etc.) o en efectivo, en éste último caso, el emprendedor deberá exhibir el monto de su aportación mediante estado de cuenta bancaria a su nombre, dicha aportación representara el 10% por ciento del monto total del proyecto.\nPara el caso de las aportaciones en especie, los beneficiarios deberán acreditar la propiedad de los bienes, mediante la presentación de las facturas, notas o recibos.\nEn ambos casos, los beneficiarios deberán presentar un escrito, suscrito bajo protesta de decir verdad, en el que se relacionen los bienes y su valor estimado, indicando que los mismos se encuentran vinculados directamente a la operación de la empresa.\nEl monto a otorgar, será determinado por el Consejo Técnico Evaluador, una vez que la instancia participante, realice análisis previo, que le permita determinar la capacidad del emprendedor, para reintegrar el recurso a recibir en tiempo y forma, especificando en la convocatoria que se expida para tal fin, considerando las características y requerimientos propios del proyecto.\n7.2 RECURSOS NO DEVENGADOS\nLos recursos que no se apliquen al apoyo de los proyectos productivos de jóvenes que estén operando el programa al 31 de diciembre del 2014, deberán ser reintegrados inmediatamente a la\nTesorería del Estado.\nEn caso de contar con recursos federales equivalentes al monto de la co-inversión que no apliquen al apoyo de los proyectos productivos de jóvenes que estén operando el programa, deberán ser copia a la Dirección de Bienestar y Estímulos a la Juventud y la Dirección de Finanzas del IMJUVE, donde se especifique el monto reintegrado, anexando copia del depósito bancario, a efecto de que la\nDirección de Finanzas, esté en posibilidades de efectuar el reintegro del recurso a más tardar el 31 de\nEMPRENDEDORES, PUBLICADO EN EL DECRETO NÚMERO\n438 DEL PRESUPUESTO DE EGRESOS DEL ESTADO DE\nGUERRERO PARA EL EJERCICIO FISCAL 2014 DEL señaladas, la Instancia participante deberá cubrir las cargas financieras generadas por la Tesorería de la\nFederación.\n7.3 AUDITORIA, CONTROL Y SEGUIMIENTO\nComo resultado de las acciones de auditoría que se lleven a cabo, por la Contraloría General del\nEstado, la Secretaría de la Juventud y la Niñez mantendrá un seguimiento interno que permita la atención en tiempo y forma de las anomalías detectadas hasta su total solventación.\nSi el Instituto Mexicano de la Juventud u otra instancia federal otorga recursos para este\nPrograma podrán ser revisados por la Secretaría de la Función Pública, a través de la Dirección General de Operación Regional y Contraloría Social y por el Órgano Interno de Control en el Instituto Mexicano de la Juventud, en coordinación con la Secretaría de Hacienda y Crédito Público y demás instancias que en el ámbito de sus respectivas atribuciones resulten competentes.\n7. 4 EVALUACIÓN Y SEGUIMIENTO\nLa evaluación y Seguimiento del Programa, se realizara en coordinación con las siguientes instancias, Comité de \"Planeación para el Desarrollo del Estado de Guerrero COPLADEG, Contraloría\nGeneral del Estado y la Secretaria de Finanzas y Administración del Estado de Guerrero, quienes juntos con la Secretaría de la Juventud y la Niñez verificaran las acciones llevadas a cabo, así como evaluar, de manera calendarizada los avances físico - financieros de este programa. Esto con la finalidad de dar cumplimiento a las metas trazadas y ejercer al 100% el presupuesto autorizado de este programa.\n7.5 SEGUIMIENTO DE AVANCES FÍSICOS FINANCIEROS\nLa Secretaría de la Juventud y la Niñez formulará trimestralmente o con la periocidad que se requiera, el reporte de los avances físicos y financieros de las acciones que se lleven a cabo mediante este programa.\n7.6 BLINDAJE ELECTORAL\n• La papelería, documentación oficial, así como la publicidad y promoción de este programa, deberán incluir la siguiente leyenda siempre y cuando se genera un convenio de Co-inversión con el\nIMJUVE:\n\"Este Programa es de carácter público, producto de una coinversión entre el gobierno federal y local, no es patrocinado ni promovido por partido político alguno y sus recursos provienen de los impuestos que pagan todos los contribuyentes. Está prohibido el uso de este programa con fines políticos, electorales, de lucro y otros distintos a los establecidos. Quien haga uso indebido de los recursos de este Programa, deberá ser denunciado y sancionado, de acuerdo con la Ley aplicable y ante la autoridad competente\".\nEMPRENDEDORES, PUBLICADO EN EL DECRETO NÚMERO\n438 DEL PRESUPUESTO DE EGRESOS DEL ESTADO DE\nGUERRERO PARA EL EJERCICIO FISCAL 2014 DEL\nDe no haber convenio con el IMJUVE la leyenda quedaría de la siguiente forma:\n\"Este Programa es de carácter público, no es patrocinado ni promovido por partido político alguno y sus recursos provienen de los impuestos que pagan todos los contribuyentes.\nEstá prohibido el uso de este programa con fines políticos, electorales, de lucro y otros distintos a los establecidos. Quien haga uso indebido de los recursos de este Programa, deberá ser denunciado y sancionado, de acuerdo con la Ley aplicable y ante la autoridad competente\".\n7.7 CONTRALORÍA SOCIAL\nCon la finalidad de incrementar la participación ciudadana, se crearán Comités de Contraloría\nSocial, como un órgano ciudadano de control, vigilancia y evaluación de las actividades del Programa, conformado por los beneficiarios, los sectores sociales y representantes de la localidad, quienes de manera específica supervisarán la gestión gubernamental y que el manejo de los recursos públicos se realicen en términos de transparencia, eficacia, legalidad y honradez.\nLos objetivos específicos de este órgano de Contraloría Social son:\n• Hacer más trasparentes las decisiones y la ejecución de los recursos;\n• Incrementar la participación ciudadana;\n• Fomentar la organización social;\n• Inhibir los actos de corrupción y de cooptación social, política y electoral;\n• Incrementar la eficiencia de los recursos públicos;\n• Fortalecer la cultura de la legalidad;\n• Mejorar la rendición de cuentas.\n7.7.1 INTEGRACIÓN social.\nEl Comité de Contraloría Social debe estar constituido por un Presidente, un Secretario y un\nVocal mínimamente, electos de entre la población beneficiada en donde se va a realizar la entrega del\nPrograma y tendrá que ser vigilado por un solo comité.\nEMPRENDEDORES, PUBLICADO EN EL DECRETO NÚMERO\n438 DEL PRESUPUESTO DE EGRESOS DEL ESTADO DE\nGUERRERO PARA EL EJERCICIO FISCAL 2014 DEL\nDicho Comité deberá revisar en conjunto con la población, los avances y resultados del programa, así como la detección de cualquier irregularidad.\nEl vocal del Comité de Contraloría Social será el responsable de hacer llegar las quejas o denuncias recibidas a la SEJUVE, quien dará respuesta en un plazo no mayor a 15 días a partir de la fecha de recepción de la queja o denuncia.\n7.7.2 CAPACITACIÓN Y ASESORÍA\nPara impulsar la realización de las actividades de Contralo-ría Social se brindará capacitación y asesoría, a los servidores públicos que intervienen en la operación del Programa, así como a los integrantes de los Comités Locales, para que estos realicen adecuadamente sus actividades de seguimiento y vigilancia.\n7.2.3 SEGUIMIENTO\nSe deberá integrar un Programa de Trabajo el cual debe incluir la descripción de las actividades, responsables de éstas, metas y calendarización de las actividades para su cumplimiento.\nEl personal que designe la Secretaria de la Juventud y la Niñez, para conformar los Comités de\nContraloría Social, así mismo darán acompañamiento durante las actividades de control, seguimiento y vigilancia de los proyectos.\nEl comité de Contraloría Social deberá controlar, vigilar y dar seguimiento a los trabajos de mantenimiento a través de los formatos que integran el expediente de la localidad integrado por:\n1. Acta de Conformación del Comité de Contraloría Social\n2. Reunión con beneficiarios\n3. Ficha informativa del programa\n4. Cédula de Vigilancia del Programa\n5. Actividades de Difusión y Capacitación\n6. Quejas, denuncias o reconocimientos\n7. Informe Anual\nEl personal que designe la Secretaría de la Juventud y la Niñez, será el responsable de integrar los expedientes de las comunidades beneficiadas y hacer entrega de los mismos al área correspondiente.\nSocial, una vez que la Subsecretaría de Política Social, le dé aviso de inicio de dichas actividades.\nEMPRENDEDORES, PUBLICADO EN EL DECRETO NÚMERO\n438 DEL PRESUPUESTO DE EGRESOS DEL ESTADO DE\nGUERRERO PARA EL EJERCICIO FISCAL 2014 DEL\n7.8 QUEJAS Y DENUNCIAS.\nLos beneficiarios pueden presentar quejas y denuncias ante la Secretaría de la Juventud y la\nNiñez, así como a la Contraloría General del Estado, sobre cualquier hecho, acto u omisión que produzca daños al ejercicio de sus derechos establecidos en las presentes reglas de operación. Las quejas se pueden presentar de manera escrita, electrónica y vía telefónica, las cuales se captaran a través de:\nDependencia Teléfono Correo electrónico Domicilio\nPalacio de Gobierno\nEdif. Montaña Planta\nBaja, Blvd. René Juárez\nSecretaria de la\n01 (747) 47 1 99 45 sejuve@guerrero.gob.mx Cisneros Cd. de los\nJuventud y la Niñez\nServicios, Chilpancingo, Gro., C.P.\n39075\nPalacio de Gobierno\nEdif. Norte 1er. Piso\nBlvd. René Juárez\nContraloría General del\n01 800 99 00 990 quejasydenuncias.@guerrero.gob.mx Cisneros Cd. de los\nEstado\nServicios, Chilpancingo, Gro., C.P.\n39075\nEl denunciante o quejoso deberá proporcionar los siguientes datos:\na) Nombre del Servidor (s) Público (s)\nb) Dependencia de adscripción\nc) Objeto de la denuncia\nd) Nombre y domicilio del quejoso\ne) Identificación Oficial oficinas de la Secretaria de la Juventud, la cual se encuentra en el Palacio de Gobierno Edif. Montaña\nPlanta Baja, Blvd. René Juárez Cisneros #62, Cd. de los Servicios, Chilpancingo, Gro.\nEMPRENDEDORES, PUBLICADO EN EL DECRETO NÚMERO\n438 DEL PRESUPUESTO DE EGRESOS DEL ESTADO DE\nGUERRERO PARA EL EJERCICIO FISCAL 2014 DEL\nLa Secretaria de la juventud y la Niñez, de forma conjunta con la Contraloría General del Estado, darán seguimiento a las denuncias recibidas así como evaluar cuantitativamente los resultados de acuerdo al número de beneficiarios y el porcentaje de cobertura, para conocer el cumplimiento de las metas propuestas; en tal sentido y una vez concluida la evaluación del Programa, se atenderá y dará seguimiento a los aspectos susceptibles de mejora.\n8. CRITERIOS DE SELECCIÓN Y ELEGIBILIDAD\n8.1 MÉTODO DE SELECCIÓN DE BENEFICIARIOS\nPara la evaluación de los proyectos, el Consejo Técnico Evaluador se basará en el Manual del\nEmprendedor, diseñado para tal fin, el cual deberá:\n➢ Plantear el proyecto de forma clara y congruente\n➢ Reflejar una adecuada capacidad de pago\n➢ Definir claramente sobre la aplicación del recurso a recibir\n➢ Evidenciar la factibilidad del negocio o empresa.\n9. MECÁNICA DE OPERACIÓN\n9.1 INSTANCIA EJECUTORA\nLa instancia ejecutora de este programa será la Secretaría de la Juventud y la Niñez.\n9.2 INSTANCIA NORMATIVA\nLa instancia normativa para este programa será Secretaría de la Juventud y la Niñez\n9.3 EJECUCIÓN\nLa administración y comprobación de los recursos, será responsabilidad de la Secretaría de la\nJuventud y la Niñez y deberá apegarse a las disposiciones normativas vigentes, aplicables al ejercicio del gasto público Estatal.\nLa Secretaría de la Juventud y la Niñez deberán conservar en resguardo, los documentos administrados en los términos que se establecen en las presentes reglas de operación. Los documentos se deberán quedar en resguardo por 5 años para cualquier aclaración respecto a la operación del programa, requerida por alguna Instancia Fiscalizadora.\nEMPRENDEDORES, PUBLICADO EN EL DECRETO NÚMERO\n438 DEL PRESUPUESTO DE EGRESOS DEL ESTADO DE\nGUERRERO PARA EL EJERCICIO FISCAL 2014 DEL\nLa Secretaría de la Juventud y la Niñez, desarrollara y aplicara estrategias a fin de garantizar la continuidad anual del programa.\n10. DERECHOS, OBLIGACIONES Y SANCIONES DE LOS BENEFICIARIOS DEL\nPROGRAMA\n10.1 DERECHOS\nTodo joven guerrerense que se encuentre en el rango de edad de 18 a 29 años que cuente con una idea de negocio puede participar en este programa el cual busca cumplir con el Plan de la Juventud\n2011 - 2012.\n10.2 OBLIGACIONES\nLos beneficiarios deben de invertir y poner en marcha el proyecto que les fue aprobado en un plazo no mayor a 30 días hábiles.\nTambién el beneficiario deberá reintegrar a la Secretaría de la Juventud del Estado de Guerrero el recurso recibido, en un plazo no mayor a 12 meses, después de un período de gracia de dos meses.\nLlevar a cabo el plan de trabajo acordado con la Secretaría de la Juventud y la Niñez\n10.3 SANCIONES\nLos beneficiarios del programa que incumplan las obligaciones antes mencionadas deberán integrar de inmediato los recursos que les fueron otorgados a la Secretaría de la Juventud y la Niñez y se participar en el programa para el siguiente ejercicio fiscal, en caso de manifestarlo posteriormente.\n22. INTERPRETACIÓN\nLa interpretación de la presentes Reglas de Operación, para efectos administrativos, estarán a cargo de la Secretaría de la Juventud y la Niñez así como de Contraloría General del Estado.\nSECRETARIO DE LA JUVENTUD Y LA NIÑEZ.\nLIC. EDUARDO BASILIO MELO.\nAPROBO.\nRúbrica.",
  "ordenamiento": "REGLA",
  "jurisdiccion": "GUERRERO",
  "fuente_oficial": "DIARIO OFICIAL DE LA FEDERACION",
  "Fecha de Publicación": "27 DE DICIEMBRE DE 2013",
  "ULTIMA REFORMA PUBLICADA": null,
  "status": "VIGENTE",
  "es_escaneado": false,
  "tiene_tablas": true,
  "materia": [
    "laboral"
  ]
}