{
  "titulo": "Acuerdo por el Que Se Emiten las Reglas de Operación del Programa Adquisición y Donación de Aparatos",
  "Contenido": "EJERCICIO FISCAL 2018\nADQUISICIÓN Y DONACIÓN DE APARATOS FUNCIONALES Y SE EMITEN LAS REGLAS DE OPERACIÓN PARA, EL\nTEXTO ORIGINAL\nAcuerdo publicado en el Periódico Oficial del Gobierno del Estado No. 28 Alcance II, el Viernes 06 de abril de 2018.\nACUERDO POR EL QUE SE EMITEN LAS REGLAS DE OPERACIÓN DEL PROGRAMA ADQUISICIÓN\nY DONACIÓN DE APARATOS FUNCIONALES PARA EL EJERCICIO FISCAL 2018.\nLIC. JOSÉ FRANCISCO SOLIS SOLIS, Director General del Sistema para el Desarrollo Integral de la\nFamilia del Estado de Guerrero, con fundamento en el artículo 27 fracción X del Reglamento Interior del\nOrganismo Público Descentralizado Sistema para el Desarrollo Integral de la Familia del Estado de\nGuerrero, así como la Ley que crea al Sistema para el Desarrollo Integral de la Familia del Estado de\nGuerrero número 107 publicada en el Periódico Oficial del Gobierno del Estado el 9 de marzo de 1977 y regido actualmente por la Ley Sobre el Sistema Estatal de Asistencia Social número 332, publicada en el\nPeriódico Oficial del Gobierno del Estado número 56 de fecha 15 de julio de 1986, así como a su última reforma publicada en el Periódico Oficial del Gobierno del Estado Número 15 de fecha 20 de Febrero de\n2015, y\nCONSIDERANDO\nQue en el Dictamen y Decreto 654 del Presupuesto de Egresos del Estado de Guerrero para el Ejercicio\nFiscal 2018 se señala que se ejercerán los recursos bajo una política de gasto público, que permita dar cumplimiento a lo que globalmente prevén los cinco ejes rectores del Plan Estatal de Desarrollo 2016-2021.\nDentro de la política de Desarrollo Social, el Sistema para el Desarrollo Integral de la Familia del Estado de\nGuerrero, opera el Programa Adquisición y Donación de Aparatos Funcionales a través del cual se otorgan aparatos funcionales a personas con discapacidad temporal o permanente, para favorecer su rehabilitación e inclusión social, mejorando su calidad de vida y favoreciendo la igualdad de oportunidades.\nPor lo expuesto y con fundamento en las disposiciones legales antes citadas, he tenido a bien expedir el siguiente:\nY DONACIÓN DE APARATOS FUNCIONALES PARA EL EJERCICIO FISCAL 2018\nACUERDOS\nÚnico: Se emiten las Reglas de Operación del Programa Adquisición y Donación de Aparatos Funcionales, para el Ejercicio Fiscal 2018.\nEJERCICIO FISCAL 2018\nPrimero: El presente acuerdo entrará en vigor al día siguiente de su publicación en el Periódico Oficial del\nSegundo: Las Reglas de Operación del Programa Adquisición y Donación de Aparatos Funcionales, para el Ejercicio Fiscal 2018, se publican en su totalidad para mejor entendimiento.\nDado en la Ciudad de Chilpancingo de los Bravo, Guerrero, a los diecisiete días del mes de enero de dos mil dieciocho.\nDIRECTOR GENERAL DEL SISTEMAPARA EL DESARROLLO INTEGRAL DE LA FAMILIA DEL\nESTADO DE GUERRERO.\nLIC. JOSÉ FRANCISCO SOLÍS SOLÍS.\nRúbrica.\nCONTENIDO\n1. INTRODUCCIÓN\n1.1 Antecedentes\n1.2 Alineación programática\n1.3 Diagnóstico\n2. MISIÓN Y VISIÓN\n2.1 Misión\n2.2 Visión\n3. DEPENDENCIA O ENTIDAD RESPONSABLE DEL PROGRAMA\n4. FUNDAMENTO LEGAL\n5. OBJETIVOS Y ALCANCES\nEJERCICIO FISCAL 2018\n5.1 Objetivo General\n5.2 Objetivos Específicos\n5.3 Alcances\nMETAS FÍSICAS\n6.\n7. PROGRAMACIÓN PRESUPUESTAL\n8. REQUISITOS Y PROCEDIMIENTO DE ACCESO\nDifusión\n8.1\n8.2 Requisitos de Acceso\n8.3 Procedimientos de Acceso\n8.4 Requisitos de Permanencia, Causales de Baja o Suspensión Temporal\n8.5 Modos de Entrega del Beneficio\n9. PROCEDIMIENTOS DE INSTRUMENTACIÓN\n9.1 Operación\n9.2 Gastos de Operación\nTRANSPARENCIA\n10.\nDifusión\n10.1\n10.2 Blindaje Electoral\n10.3 Supervisión y Control\n10.4 Mecanismos de Evaluación e Indicadores\n10.4.1 Evaluación\n10.4.2 Indicadores\n10.5 Auditoria\n10.6 Recursos no Devengados\n10.7 Contraloría Social\n10.8 Procedimiento de Queja o Inconformidad Ciudadana\n10.9 Mecanismos de Exigibilidad\nEJERCICIO FISCAL 2018\n10.10 Acta de Entrega-Recepción\nCRITERIOS DE SELECCIÓN Y ELEGIBILIDAD\n11.\nMétodo de Selección de Beneficiarios\n11.1\nMECÁNICA DE OPERACIÓN\n12.\n12.1 Instancia Ejecutora\n12.2 Instancia administrativa y/o normativas\n12.3 Delimitación de atribuciones\n13. DERECHOS, OBLIGACIONES Y SANCIONES DE LOS BENEFICIARIOS DE\nPROGRAMAS SOCIALES\n13.1 Derechos\n13.2 Obligaciones\n13.3 Sanciones\n14. INTERPRETACIÓN\n15. ANEXOS\n1. INTRODUCCIÓN 1.1. ANTECEDENTES\nLa discapacidad es la condición de vida de una persona, adquirida durante su gestación, nacimiento, infancia o cualquier otra etapa de la vida, que se manifiesta por limitaciones significativas en el funcionamiento intelectual, motriz, sensorial (vista y oído) y en la conducta adaptativa, es decir, en la forma en que se relaciona en el hogar y la comunidad, respetando las formas de convivencia de cada ámbito.\nLos aparatos funcionales o dispositivos de apoyo son productos, instrumentos, equipos o sistemas utilizados por una persona con discapacidad, fabricados especialmente para prevenir, compensar, disminuir o neutralizar una deficiencia, discapacidad o minusvalía. aumentar su capacidad funcional para la realización de las tareas cotidianas. Son, por tanto, objetos muy su entorno. discapacidad aparatos funcionales de acuerdo a la discapacidad que padece.\nEJERCICIO FISCAL 2018\n1.2 ALINEACIÓN PROGRAMÁTICA\nEn cumplimiento a lo que globalmente prevén los ejes rectores del Plan Estatal de Desarrollo 2016-2021\nEje III.- Guerrero Socialmente Comprometido. Objetivo 3.7. Fortalecer la asistencia social a grupos vulnerables.\nEstrategia 3.7.1. Atender integralmente a los grupos vulnerables y fomentar el acceso a los servicios de protección social que les permita mejorar su calidad de vida.\nLíneas de acción.\n• Proporcionar asistencia social integral a menores y adultos mayores que se encuentran en situación de vulnerabilidad.\n• Mejorar la atención de la salud a la población en situación de vulnerabilidad.\nAsí mismo las presentes Reglas se encuentran enmarcadas a lo estipulado en el Programa Sectorial\n“Desarrollo y Asistencia Social” que tiene como objetivo atender a personas vulnerables con carencias en materia de salud.\n1.3 DIAGNOSTICO\nEn el Estado de Guerrero como en todo el país, la discapacidad se asocia con bajas condiciones de bienestar tales como la pobreza extrema, la marginación social, la mal nutrición, el analfabetismo, la ignorancia, el aún acelerado crecimiento de la población y su dispersión, lo que restringe la prestación de los servicios sanitarios, limitando la correcta vigilancia prenatal y la adecuada atención del parto, también está asociada con el aumento de las personas de la tercera edad y de las enfermedades crónicodegenerativas no transmisibles, las lesiones por accidentes de todo tipo y la violencia.\nLa prevalencia de la discapacidad motriz es la más alta, alrededor del 40% de los diferentes tipos de discapacidad, de acuerdo con los resultados del XII Censo General de Población y Vivienda, lo que significa que alrededor de 20,000 personas en el año 2000, padecían de estas deficiencias físicas en el Estado de\nGuerrero.\nParticularmente, la prevalencia de la parálisis cerebral infantil se estima entre 2 y 3 casos por cada 1,000 habitantes, nos indica la existencia de entre 6,900 y 10,200 personas con PC, principalmente entre los menores de 15 años de edad. La disposición de impulsar actividades y acciones que permitan que la población de escasos recursos, que requieran aparatos funcionales tales como bastones, andaderas ortopédicas, muletas infantiles y de adultos, les permitirá a los beneficiarios realizar con mayor facilidad, libertad e independencia sus actividades cotidianas.\nEJERCICIO FISCAL 2018\n2.- MISIÓN Y VISIÓN\nDONAR CON DIVERSOS APARATOS FUNCIONALES COMO SON: bastón ortopédico, bastón de 4 apoyos, bastón para invidente, andaderas ortopédicas, andadera Ortopedica con llantas delanteras, muletas axilares, muletas canadienses, para diferentes tipos de discapacidad.\nA las personas con discapacidad temporal o permanente con el propósito de restablecer sus capacidades de movilidad y auto desempeño.\n2.1 MISIÓN\nDonar con diversos aparatos funcionales a las personas con discapacidad temporal o permanente con el propósito de restablecer sus capacidades de movilidad y auto desempeño, para mejorar su calidad de vida.\n2.2 VISIÓN\nMejorar la calidad de vida de las personas con discapacidad logrando su independencia y funcionalidad, así como su integración a la vida social y laboral.\n3.- DEPENDENCIA O ENTIDAD RESPONSABLE DEL PROGRAMA\nSistema para el Desarrollo Integral de la Familia a través de la Dirección de Servicios Médicos.\n4.- FUNDAMENTO LEGAL\n• Constitución Política de los Estados Unidos Mexicanos\n• Ley General de Salud.\n• Ley de Asistencia Social.\n• Ley General para la Inclusión de las Personas con discapacidad.\n• Ley para el Bienestar e Incorporación Social de las Personas con Dlscapacldad en el Estado de Guerrero, No. 281.\n• Ley No. 817 para las Personas con Discapacidad del Estado.\n• Plan Estatal de Desarrollo 2016-2021.\n• Ley 454 de Presupuesto y Disciplina Fiscal del Estado de Guerrero.\nFebrero del 2015\n• Decreto Número 654 del Presupuesto de Egresos del Estado de Guerrero\n• Plan Estatal de Desarrollo 2016 - 2021\n• Programa Sectorial Desarrollo y Asistencia Social 2016 - 2021\n• Estrategia Local “Guerrero Contigo”\nEJERCICIO FISCAL 2018\n• Reglamento Interno del Sistema para el Desarrollo Integral de la Familia del Estado de Guerrero.\n• Manual de Organización del DIF\n• Y todos Aquellos Ordenamientos Normativos Aplicables\n5.-OBJETIVOS Y ALCANCES\n5.1 OBJETIVO GENERAL.\nOtorgar aparatos funcionales a personas con discapacidad temporal o permanente, por lo que se donaran\n1000 piezas para los diferentes tipos de discapacidad, que la requieran para favorecer su rehabilitación e inclusión social, mejorando su calidad de vida y favoreciendo la igualdad de oportunidades.\n5.2 OBJETIVO ESPECIFICO.\n• Favorecer la rehabilitación y prevenir discapacidades secundarias.\n• Contribuir a la integración plena de las personas con discapacidad en la sociedad.\n• Favorecer su independencia y funcionalidad.\n5.3 ALCANCES\nEl problema que se atiende en este programa es el derecho a la seguridad social, mejorando su calidad de vida, a través de la adquisición y donación de 1000 aparatos funcionales, a la población de los 81 municipios que integran a nuestro Estado, dando prioridad a los municipios de alta y muy alta marginación, favoreciendo su inclusión e integración a la sociedad.\n6.- METAS FÍSICAS\nSe pretende beneficiar a un total de 1000 personas con discapacidad, procedentes de los 81 municipios del Estado, dando prioridad a la población más vulnerable.\n7.- PROGRAMACIÓN PRESUPUESTAL\nSe designa un presupuesto de acuerdo al Decreto número 654 del Presupuesto de Egresos para el ejercicio fiscal 2018 de $500,000.00 (Quinientos mil pesos 00/100 M.N.), recursos que provienen del Fondo de\nAportaciones Múltiples, (Asistencia Social) Ramo 33.- Aportaciones Federales para Entidades Federativas y Municipios.\nEJERCICIO FISCAL 2018\nCALENDARIO DE MINISTRACIÓN\nPROGRAMA PRES. AUT. ENERO FEBRERO MARZO ABRIL MAYO\nAQUISICION Y 500.000.00 500.000.00\nDONACION DE\nAPARATOS\nFUNCIONALES\nJUNIO JULIO AGOSTO SEP. OCT. NOV. DIC.\nNOTA: PUEDE EXISTIR VARIACION EN RELACION A LO APROBADO POR EL DPEF Y/O A LAS PROPIAS NECESIDADES\nDEL SISTEMA.\n8.- REQUSITOS Y PROCEDIMIENTOS DE ACCESO\n8.1 DIFUSION\nEl sistema para el Desarrollo Integral de la Familia a través de los diferentes medios de comunicación y de las redes sociales da conocer cada uno de los diferentes programas de asistencia social que ejecuta y opera en coordinación con las diferentes Direcciones que integran el Sistema como son; Programas\nAlimentarios, Proyectos Asistenciales, de Bienestar Social y Desarrollo Comunitario; cuyos requisitos se encuentran en las oficinas del Sistema ubicadas en Av. Rene Juárez Cisneros, Colonia Ciudad de los\nServicios y ubicada Av. Gabriel Leyva s/n esq. Ruffo Figueroa, Col. Burócratas, C.P. 39090, Chilpancingo, Guerrero, con un horario de atención de 8:00 am a 3:00 pm y/o los teléfonos 01 (747) 4725595, 01\n(747)47256 00, 01 (747)47 25672 ext. 1151 Y 1159. Así mismo al correo electrónico: alimentariadif@prodigy.net.mx, subdireccionalimentaria@prodigy.net.mx\nLas reglas de operación de cada uno de los programas son difundidas por el personal capacitado de cada\nSe brinda atención en los 81 municipios del Estado, teniendo una capacidad de atención de niñas, niños y adolescentes, mujeres embarazadas, mujeres en periodo de lactancia, personas con discapacidad, adultos mayores y personas vulnerables por ingresos.\nComunitario, así como en la página electrónica del Sistema para el Desarrollo Integral de la Familia\nEJERCICIO FISCAL 2018\nEl responsable directo de la ejecución será la Dirección de Asistencia Alimentaria y Desarrollo Comunitario, a través de la Subdirección de Desarrollo Comunitario, ubicada Av. Gabriel Leyva s/n esq. Ruffo Figueroa, Col. Burócratas, C.P. 39090, Chilpancingo, Guerrero., a los teléfonos (01747) 47 2 55 95, (01747) 47 2 56\n00, (01747) 47 2 56 72 ext. 1155. Así mismo al correo electrónico: subdescomdif@prodigy.net.mx Para información sobre el programa.\n8.2 REQUISITOS DE ACCESO\n*El interesado deberá presentar oficio de solicitud en las instalaciones del DIF Guerrero, con domicilio en el Centro de Rehabilitación Integral Guerrero, Boulevard Lic. René Juárez Cisneros S/N, Col. Ciudad de los Servicios, Chilpancingo, Guerrero dirigido al Director General o la Presidenta del Patronato del DIF\nGuerrero para ser considerado en el Programa.\n*La solicitud es turnada a la Dirección de Servicios Médicos Asistenciales para la atención en el\nDepartamento de Ayudas Funcionales, anexando los siguientes requisitos:\n1.- Fotografía reciente del solicitante de cuerpo completo en tamaño postal.\n2.- Constancia medica que especifique el tipo de discapacidad, la cual deberá ser expedida por el C.R.I.G\nChilpancingo o una Institución de Salud Pública (SSA, DIF-ESTATAL Y MUNICIPAL), el certificado médico deberá ser firmado y expedido por un médico con cedula profesional.\n3.- Copia del acta de nacimiento.\n4.- Copia de la CURP al 200% si es el formato anterior.\n5.- Copia del comprobante de domicilio reciente.\n6.- Copia fotostática de la credencial de elector al 200%\n7.- Se aplica el estudio socio económico, al solicitante para determinar la susceptibilidad de ser beneficiario.\n*La solicitud es turnada a la Dirección de Servicios Médicos Asistenciales para la atención correspondiente.\n8.3 PROCEDIMIENTOS DE ACCESO\nLa operación del Programa Adquisición y Donación de Aparatos Funcionales, surge por la necesidad de atender el problema el cual busca garantizar el derecho a la población más vulnerable atendiendo a los 81 municipios que conforman nuestro Estado, dando prioridad a los municipios de alta o muy alta marginación se realiza a través de la demanda ciudadana y / o peticiones que se reciben en las instalaciones del Sistema para el Desarrollo Integral de la Familia o directamente a la Presidenta del Sistema Estatal.\nSerán beneficiados con el apoyo del programa, los solicitantes que cumplan con las siguientes características y con la disponibilidad presupuestal del programa:\nہ Niños, Adolescentes y adultos mayores que tengan una discapacidad temporal o permanente, ya que son los que se encuentran en estado de vulnerabilidad.\nEJERCICIO FISCAL 2018\n* Habitar en uno de los 81 Municipios de nuestro estado y con más alta marginación, ya que son los más vulnerables.\nLos interesados deberán presentar su solicitud en formato libre de ingreso al programa, en las instalaciones del DIF Guerrero, con domicilio en el Centro de Rehabilitación Integral Guerrero, Boulevard Lic. René\nJuárez Cisneros S/N, Col. Ciudad de los Servicios, Chilpancingo, Guerrero C.P. 39095, dirigido a la\nPresidenta del Patronato del DIF Guerrero para ser considerados dentro del Programa, con un horario de atención de 8:00 am a 3:00 pm y/o los teléfonos 01 (747) 47 1 84 90, 01 (747) 47 184 98 ext. 1074 Y 1077.\nAsí mismo al correo electrónico: direccionserviciomedico@hotmail.com\nDe acuerdo a la disponibilidad presupuestal del programa se dará preferencia a toda aquella persona con\nDiscapacidad en estado de vulnerabilidad; así mismo se entregara un comprobante de acceso al programa que en un plazo no mayor a 30 días hábiles dará respuesta a la solicitud.\nUna vez que son incorporadas al programa las personas que serán beneficiadas con el Programa de\nAdquisición y Donación de aparatos funcionales, formaran parte de un Padrón Único de Beneficiarios, donde sus datos personales, e información administrada y/o generada será resguardada de acuerdo con la Ley 207 de Transparencia y Acceso a la Información Pública del Estado; los cuales en ningún caso podrán emplearse para propósitos de proselitismo político, religioso o comercial, ni para ningún otro fin distinto al establecido en las Reglas de Operación del programa social.\nY en ningún caso las y los servidores públicos podrán proceder de manera diferente a lo establecido en las\nReglas de Operación.\n8.4.-REQUISITOS DE PERMANENCIA, CAUSALES DE BAJA O SUSPENSION TEMPORAL\nCausaría baja cuando a través del estudio socioeconómico, se comprueba que tiene solvencia económica.\nLo demás no aplica por la naturaleza propia del programa.\n8.5 MODOS DE ENTREGA DEL BENEFICIO\nEl solicitante deberá acudir al CRIG Guerrero donde se le entregará de manera directa y por única ocasión el apoyo, de acuerdo al tipo de discapacidad se le otorgara el aparato funcional las cuales son:\n1.- Andaderas ortopédicas\n2.- Bastones ortopédicos\n3.- Bastones de 4 puntos\n4.- Bastones para invidente\n5.- Muletas axilares\n6.- Muletas canadienses\nA las personas que presentan una discapacidad motriz, temporal o permanente, con el propósito de restablecer sus capacidades de movilidad y auto desempeño.\nEJERCICIO FISCAL 2018\n9.- PROCEDIMIENTOS DE INSTRUMENTACIÓN\n9.1 OPERACIÓN\na) El paciente, familiar o gestor (DIF-municipales) acuden al Sistema Estatal para el Desarrollo Integral de la Familia, a la Dirección de los Servicios Médicos Asistenciales, a solicitar los requisitos para la incluicion al programa de Adquisición y Donación de Aparatos Funcionales\nb) Una vez que fue atendido e informado referente a la documentación que este deberá de entregar al\nDepartamento de Aparatos funcionales, mencionado en el apartado 8.2.\nc) Se presenta el paciente, familiar o gestor, (DIF-MUNICIPAL) al departamento de Aparatos funcionales, se recibe y revisa la documentación que este conforme a los requisitos requeridos de acuerdo a las reglas de operación del programa.\nd) Un vez completo el expediente, se recibe la documentación, se le sella de recibido su oficio de petición\n(ACUSE) con el sello correspondiente del Departamento de Aparatos funcionales, con fecha de recibido.\ne) Así mismo se le informara vía telefónica en tiempo y forma la entrega.\nf) Dicha entrega se llevara a cabo en gira de trabajo o en evento programado por la Coordinación de giras, de la Presidenta del DIF-Guerrero.\n9.2 GASTOS DE OPERACIÓN\nEl presupuesto asignado a este programa, a través del Fondo de Aportaciones Múltiples, no contempla\nGastos de Operación.\n10.- TRANSPARENCIA\n10.1 DIFUSION\nLa instancia responsable es la Dirección de Los Servicios Médicos, quien difundirá a través de diferentes medios de comunicación; trípticos, periódico, redes sociales en las cuales se dará a conocer la información relacionada con las características del programa de Adquisición y Donación de Aparatos Funcionales.\nAsí mismo se dará amplia difusión al Programa a nivel estatal y se promoverán similares acciones por parte de las autoridades locales; la información del programa se dará a conocer en la página de internet del beneficiario. Las copias de los expedientes de los beneficiarios y / o beneficiarias estarán disponibles oportunamente para su consulta en las oficinas del Sistema ubicadas en Av. Rene Juárez Cisneros, Colonia\nCiudad de los Servicios C.P. 39095, Chilpancingo, Guerrero; por otra parte la papelería, documentación oficial, así como la publicidad y promoción de los Programas, deberán incluir la leyenda descrita en el apartado de \"Blindaje Electoral\".\nLa información de montos y beneficiarios deberá ser publicada en los términos de la Ley No. 207 de\nEJERCICIO FISCAL 2018\nUna vez autorizadas estas Reglas de Operación, por las instancias correspondientes, estarán disponibles para su consulta en las Oficinas de la Dirección de Asistencia Alimentaria y Desarrollo Comunitario, así fracción III Marco Normativo específico. La información de montos y beneficiarios será publicada en los términos de la Ley No. 207 de Transparencia y Acceso a la Información Pública del Estado de Guerrero.\n10.2. BLINDAJE ELECTORAL\nLa operación y ejecución de los recursos estatales destinados al Programa, deberán observar y atender las medidas que emita la Secretaría de Contraloría y Transparencia Gubernamental, para coadyuvar a que éstos, no sean utilizados con fines políticos en el desarrollo de procesos electorales federales, estatales y municipales.\nComo estrategia de blindaje electoral, la papelería, documentación oficial, así como la publicidad y promoción del Programa deberán incluir la siguiente leyenda:\n\"Este Programa es de carácter público, no es patrocinado ni promovido por partido político alguno y sus recursos provienen de los impuestos que pagan todos los contribuyentes. Está prohibido el uso de este programa con fines políticos, electorales, de lucro y otros distintos a los establecidos.\nQuien haga uso indebido de los recursos de este programa deberá ser denunciado y sancionado de acuerdo con la ley aplicable y ante la autoridad competente\".\nEn cuanto a la publicidad en medios electrónicos, impresos, complementarios o de cualquier otra índole, vinculados con los Programas de comunicación social, se deberá incluir la siguiente leyenda:\n“Este Programa es público y queda prohibido su uso con fines partidistas o de promoción personal”.\n10.3 SUPERVISIÓN Y CONTROL\nGuerrero, las acciones ejercidas y los resultados obtenidos, quien a su vez reportará a la\nFinanzas (SEFINA) y a la Auditoria General del Estado (AGE). de Contraloría, informes sobre el Presupuesto ejercido establecidos por el Consejo Nacional de\nArmonización Contable (CONAC) y con base en los indicadores de resultados previstos en las\nReglas de Operación. Dichos informes se deberán presentar a más tardar a los quince días hábiles posteriores a la terminación de cada trimestre.\nEJERCICIO FISCAL 2018\n10.4.- MECANISMOS DE EVALUACION E INDICADORES 10.4.1 EVALUACION correspondientes.\n10.4.2 INDICADORES\nEJERCICIO FISCAL 2018\nEJERCICIO FISCAL 2018\n10.5 AUDITORIA\nEL ejercicio del recurso y la operatividad del Programa, están sujetos a las disposiciones estatales\nEstado, así como por la Auditoría General del Estado, conforme a la legislación vigente y en el ámbito de sus respectivas competencias.\nEl Sistema DIF Guerrero dará todas las facilidades a dichas instancias para realizar, en el momento en que lo juzguen pertinentes, las auditorías que consideren necesarias; así como el seguimiento y la solventación a las observaciones planteadas por los órganos de control.\n106. RECURSOS NO DEVENGADOS\nEl DIF Guerrero deberá reintegrar a la Dirección General de Tesorería de la Secretaría de Finanzas y\nAdministración del Gobierno del Estado los recursos que no se hubiesen destinado a los fines autorizados y aquellos que por cualquier motivo no estuviesen devengados al 31 de diciembre del Ejercicio fiscal correspondiente.\n10.7 CONTRALORIA SOCIAL\nCon la finalidad de incrementar la participación ciudadana, se crearán Comités de Contraloría Social, como un órgano ciudadano de control, vigilancia y evaluación de las actividades del Programa, conformados por los beneficiarios (as), los sectores sociales, y los representantes de la localidad, quienes de manera especificas supervisarán la gestión gubernamental, y que el manejo de los recursos públicos se realicen en términos de transparencia, eficacia, legalidad y honradez.\nLos objetivos específicos de este Órgano de Contraloría Social son:\n*Hacer más transparentes las decisiones y la ejecución de los recursos. incrementar la participación ciudadana.\n*Fomentar la organización social.\n*inhibir los actos de corrupción y de cooptación social, política y electoral. incrementar la eficiencia de los recursos públicos.\n*Fortalecer la cultura de la legalidad.\n*Mejorar la rendición de cuentas.\n*Perfeccionar la democracia e incorporar la evaluación ciudadana.\n10.8 PROCEDIMIENTOS DE QUEJA O INCONFORMIDAD CIUDADANA\nLos beneficiarios (as) pueden presentar quejas y denuncias ante las instancias correspondientes sobre cualquier hecho, acto u omisión que produzca o pueda producir daños al ejercicio de sus derechos aplicable.\nEJERCICIO FISCAL 2018 a. En el Sistema DIF Guerrero direccionserviciomedico@hotmail.com\nDomicilio: Centro de Rehabilitación Integral Guerrero. Boulevard Lic. René Juárez Cisneros S/N, Col. Ciudad de los Servicios. Chilpancingo, Guerrero. C.P. 39095. b. En la Secretaría de Contraloría y Transparencia Gubernamental.\nCorreo electrónico: contraloria@guerrero.gob.mx\nDomicilio: Palacio de Gobierno Primer Piso Edificio Norte, Blvd. R. Juárez Cisneros 62 Col. de los\nServicios C.P. 39075.\nLas quejas y denuncias de la ciudadanía derivadas de alguna irregularidad en la operación del Programa, podrán presentarse por escrito, por comparecencia del beneficiario (a), por correo electrónico o vía telefónica y deberá proporcionar los siguientes datos: nombre del servidor público, área de adscripción, objeto de la denuncia, nombre y domicilio del quejoso e identificación oficial.\n10.9 MECANISMOS DE EXIGIBILIDAD\n*Los requisitos y procedimientos para ser beneficiados por el programa podrán ser solicitados en la\nDirección de Servicios Médicos Asistenciales del DIF Guerrero ubicado en las instalaciones del CRIG\nChilpancingo, ubicado en Boulevard Rene Juárez Cisneros, col. Ciudad de los Servicios, Chilpancingo, Guerrero.\n*Los casos en los que se podrá exigir los derechos por incumplimiento o por violación de los mismos pueden ocurrir en al menos los siguientes casos:\na) Cuando una persona solicitante cumpla con los requisitos y criterios de inclusión para acceder a determinado derecho (garantizado por un programa social) y exija a la autoridad administrativa ser derecho habiente del mismo\nb) Cuando la persona derechohabiente de alguna instancia medica exija que se cumpla con dicho derecho, de manera integral en tiempo y forma, como lo establece el programa.\nc) Cuando no se pueda satisfacer toda la demanda de restricción presupuestal, y estás exijan que las incorporaciones sean claras, transparentes, equitativas, sin favoritismos, ni discriminación. desarrollo social.\n10.10 ACTA ENTREGA RECEPCIÓN\nUna vez entregados los aparatos funcionales al paciente, firmará el acta de donación correspondiente, así como la toma de una evidencia fotografía del beneficiado con el aparato funcional otorgado por el DIFGuerrero, misma que se anexa al expediente.\nEJERCICIO FISCAL 2018\n11.- CRITERIOS DE SELECCIÓN Y ELEGIBILIDAD\n11.1- METODO DE SELECCIÓN DE BENEFICIARIOS\nSe beneficiaran con este programa las personas que cumplan con las siguientes características:\n• Personas con discapacidad temporal o permanente.\n• QUE SE CUENTE CON RECURSOS PRESUPUESTALES\n12.- MECÁNICA DE OPERACIÓN\n12.1 INSTANCIA EJECUTORA\nLa Instancia Ejecutora será el sistema para el Desarrollo Integral de la Familia a través de la Dirección de\nServicios Médicos Asistenciales, quien deberá operar con apego a la programación, presupuestación, calendario de ejecución, ejercicio y control del gasto público.\n12.2. INSTANCIA ADMINISTRATIVA Y/O NORMATIVA\nLa Instancia Administrativa y Normativa será la Dirección General del Sistema DIF Guerrero y la Dirección de Servicios Médicos Asistenciales, quienes tendrán la responsabilidad de definir los métodos y procedimientos para normar y regular la operatividad del Programa asegurando el cumplimiento de los objetivos y metas trazadas.\n12.3. DELIMITACIÓN DE ATRIBUCIONES\nEl DIF Guerrero establecerá los mecanismos de coordinación necesaria para garantizar que sus programas y acciones no se contrapongan, afecten o presenten duplicidades con otros programas o acciones del\nGobierno Estatal; la coordinación institucional y vinculación de acciones busca potenciar el impacto de los recursos, fortalecer la cobertura de las acciones, detonar la complementariedad y reducir gastos administrativos.\n13. - DERECHOS Y OBLIGACIONES Y SANCIONES DE LOS BENEFICIARIOS DE PROGRAMAS\nSOCIALES.\n13.1 DERECHOS\n• Recibir trato digno, respetuoso y equitativo sin discriminación alguna por el personal de las distintas áreas que participen.\n• Tener la reserva y privacidad de la información personal.\n• Solicitar y recibir información sobre el estado que guarda su trámite.\nEJERCICIO FISCAL 2018\n• Recibir los servicios y prestación del programa conforme a las Reglas de Operación, salvo que le sea suspendido su apoyo por alguna razón justificable.\n• Recibir del Sistema Estatal una respuesta en los 30 días hábiles, después de haber entregado sus documentos y haber sido aceptado dentro del programa.\n13.2. OBLIGACIONES\n*Proporcionar la información socioeconómica bajo protesta de decir verdad que les sea requerida por el\nDIF Guerrero, en los términos que establezca la normatividad correspondiente.\n*Utilizar los apoyos para los fines con que fueron autorizados evitando cualquier uso distinto de la misma.\n*Permitir la visita con la finalidad de validar la información proporcionada en sus expedientes correspondientes.\n*Facilitar los trabajos de verificación, en cualquier momento después de otorgado el apoyo.\n13.3. SANCIONES\nLos beneficiarios y las beneficiarias del programa de Adquisición y Donación de Sillas de ruedas que incumplan en la Disposiciones Normativas, ESTABLECIDAS EN LOS NUMERALES 8.2 Y 8.3, para acceder a los beneficios que a través de estos se otorgan, perderán las prerrogativas que dichas disposiciones establezcan.\n14. INTERPRETACIÓN\nLa interpretación de las presentes Reglas de Operación para efectos administrativos, estarán a cargo del\nDIF Guerrero, así como de la Contraloría General del Estado, en el ámbito de sus respectivas competencias\nGLOSARIO\nSe entenderá en las siguientes Reglas de Operación por:\nAGE.- Auditoria General del Estado.\nSEPLADER.- Secretaria de Planeación y Desarrollo Regional de Guerrero.\nDIF Guerrero.- Sistema Estatal para el Desarrollo Integral de la Familia. funcional permanente, transitoria o prolongada, motora, sensorial o mental que, en relación a su edad y medio social, implique desventajas considerables para su adecuada integración social o laboral. Aparatos\nFuncionales: Son los instrumentos, dispositivos o herramientas que permiten a las personas con discapacidad temporal o permanente, realizar actividades como desplazarse, obtener movimiento, caminar, trabajar, escuchar, entre otras.\nDIRECTORA DE SERVICIOS MÉDICOS ASISTENCIALES.\nDRA. PATRICIA ROMERO NERI.\nRúbrica.\nEJERCICIO FISCAL 2018\nDIRECTOR GENERAL DEL DIF GUERRERO.\nLIC. JOSÉ FRANCISCO SOLÍS SOLÍS.\nRúbrica.\nANEXOS\nLa operación y ejecución de los recursos estatales destinados al Programa, deberán observar y atender las medidas que emita la Secretaría de Contraloría y Transparencia Gubernamental, para coadyuvar a que éstos, no sean utilizados con fines políticos en el desarrollo de procesos electorales federales, estatales y municipales.\nComo estrategia de blindaje electoral, la papelería, documentación oficial, así como la publicidad y promoción del Programa deberán incluir la siguiente leyenda:\n\"Este Programa es de carácter público, no es patrocinado ni promovido por partido político alguno y sus recursos provienen de los impuestos que pagan todos los contribuyentes. Está prohibido el uso de este programa con fines políticos, electorales, de lucro y otros distintos a los establecidos. de acuerdo con la ley aplicable y ante la autoridad competente\".\nEJERCICIO FISCAL 2018\nEJERCICIO FISCAL 2018",
  "ordenamiento": "REGLA",
  "jurisdiccion": "GUERRERO",
  "fuente_oficial": "DIARIO OFICIAL DE LA FEDERACION",
  "Fecha de Publicación": "05 DE JULIO DE 2019",
  "ULTIMA REFORMA PUBLICADA": null,
  "status": "VIGENTE",
  "es_escaneado": false,
  "tiene_tablas": true,
  "materia": [
    "general"
  ]
}