{
  "titulo": "Acuerdo por el Que Se Emiten las Reglas de Operación del Programa Aplicación de Toxina Botulínica Ti",
  "Contenido": "CON PARÁLISIS CEREBRAL Y PERSONAS CON\nESPASTICIDAD PARA EL EJERCICIO FISCAL 2018\nORIGINAL\nACUERDO POR EL QUE SE EMITEN LAS REGLAS DE OPERACIÓN DEL PROGRAMA APLICACIÓN\nDE TOXINA BOTULÍNICA TIPO “A” EN NIÑAS Y NIÑOS CON PARÁLISIS CEREBRAL Y PERSONAS\nCON ESPASTICIDAD PARA EL EJERCICIO FISCAL 2018.\nLIC. JOSÉ FRANCISCO SOLÍS SOLÍS, Director General del Sistema para el Desarrollo Integral de la\nFamilia del Estado de Guerrero, con fundamento en el artículo 27 fracción X del Reglamento Interior del\nOrganismo Público Descentralizado Sistema para el Desarrollo Integral de la Familia del Estado de\nGuerrero, así como la Ley que crea al Sistema para el Desarrollo Integral de la Familia del Estado de\nGuerrero número 107 publicada en el Periódico Oficial del Gobierno del Estado el 9 de marzo de 1977 y regido actualmente por la Ley Sobre el Sistema Estatal de Asistencia Social número 332, publicada en el\nPeriódico Oficial del Gobierno del Estado número 56 de fecha 15 de julio de 1986, así como a su última reforma publicada en el Periódico Oficial del Gobierno del Estado Número 15 de fecha 20 de Febrero de\n2015, y\nCONSIDERANDO\nQue en el Dictamen y Decreto 654 del Presupuesto de Egresos del Estado de Guerrero para el Ejercicio\nFiscal 2018, se señala que se ejercerán los recursos bajo una política de gasto público, que permita dar cumplimiento a lo que globalmente prevén los cinco ejes rectores del Plan Estatal de Desarrollo 20162021.\nDentro de la política de Desarrollo Social, el Sistema para el Desarrollo Integral de la Familia del Estado de\nGuerrero, opera el Programa Aplicación de Toxina Botulínica Tipo “A” en Niñas y Niños con Parálisis\nCerebral y Personas con Espasticidad, a través del cual, se contribuye a mejorar las potencialidades funcionales de las niñas y niños con PCI y personas con espasticidad mediante la aplicación de la toxina botulínica tipo “A”, para disminuir el tono muscular y la rigidez, mejorando los resultados de la terapia física y otras modalidades de la rehabilitación en el Estado de Guerrero.\nPor lo expuesto y con fundamento en las disposiciones legales antes citadas, he tenido a bien expedir el siguiente:\nDE TOXINA BOTULÍNICA TIPO “A” EN NIÑAS Y NIÑOS CON PARÁLISIS CEREBRAL Y PERSONAS\nCON ESPASTICIDAD PARA EL EJERCICIO FISCAL 2018.\nÚnico: Se emiten las Reglas de Operación del Programa Aplicación de Toxina Botulínica Tipo “A” en Niñas y Niños con Parálisis Cerebral y Personas con Espasticidad para el Ejercicio Fiscal 2018.\nCON PARÁLISIS CEREBRAL Y PERSONAS CON\nESPASTICIDAD PARA EL EJERCICIO FISCAL 2018\nPrimero: El presente acuerdo entrará en vigor al día siguiente de su publicación en el Periódico Oficial del\nSegundo: Las Reglas de Operación del Programa Aplicación de Toxina Botulínica Tipo “A” en Niñas y\nNiños con Parálisis Cerebral y Personas con Espasticidad, para el Ejercicio Fiscal 2018, se publican en su totalidad para mejor entendimiento.\nDado en la Ciudad de Chilpancingo de los Bravo, Guerrero, a los diecisiete días del mes de enero de dos mil dieciocho.\nDIRECTOR GENERAL DEL SISTEMA PARA EL DESARROLLO INTEGRAL DE LA FAMILIA DEL\nESTADO DE GUERREO.\nLIC. JOSÉ FRANCISCO SOLÍS SOLIS.\nRúbrica.\nDIRECCIÓN DE SERVICIOS MÉDICOS ASISTENCIALES\nPROGRAMA:\nAplicación de Toxina Botulínica Tipo \"A\" en Niñas y Niños con Parálisis Cerebral y Personas con\nEspasticidad\nCONTENIDO\n1. INTRODUCCIÓN\n1.1 Antecedentes\n1.2 Alineación programática\n1.3 Diagnóstico\n2. MISIÓN Y VISIÓN\n2.1 Misión\n2.2 Visión\n3. DEPENDENCIA O ENTIDAD RESPONSABLE DEL PROGRAMA\nCON PARÁLISIS CEREBRAL Y PERSONAS CON\nESPASTICIDAD PARA EL EJERCICIO FISCAL 2018\n4. FUNDAMENTO LEGAL\n5. OBJETIVOS Y ALCANCES\n5.1 Objetivo General\n5.2 Objetivos Específicos\n5.3 Alcances\n6. METAS FÍSICAS\n7. PROGRAMACIÓN PRESUPUESTAL\n8. REQUISITOS Y PROCEDIMIENTO DE ACCESO\n8.1 Difusión\n8.2 Requisitos de Acceso\n8.3 Procedimientos de Acceso\n8.4 Requisitos de Permanencia, Causales de Baja o Suspensión Temporal\n8.5 Modos de Entrega del Beneficio\n9. PROCEDIMIENTOS DE INSTRUMENTACIÓN\n9.1 Operación\n9.2 Gastos de Operación\n10. TRANSPARENCIA\n10.1 Difusión\n10.2 Blindaje Electoral\n10.3 Supervisión y Control\n10.4 Mecanismos de Evaluación e Indicadores\nCON PARÁLISIS CEREBRAL Y PERSONAS CON\nESPASTICIDAD PARA EL EJERCICIO FISCAL 2018\n10.4.1 Evaluación\n10.4.2 Indicadores\n10.5 Auditoria\n10.6 Recursos no Devengados\n10.7 Contraloría Social\n10.8 Procedimiento de Queja o Inconformidad Ciudadana\n10.9 Mecanismos de Exigibilidad\n10.10 Acta de Entrega-Recepción\n11. CRITERIOS DE SELECCIÓN Y ELEGIBILIDAD\n11.1 Método de Selección de Beneficiarios\n12. MECÁNICA DE OPERACIÓN\n12.1 Instancia Ejecutora\n12.2 Instancia administrativa y/o normativas\n12.3 Delimitación de atribuciones\n13. DERECHOS, OBLIGACIONES Y SANCIONES DE LOS BENEFICIARIOS DE PROGRAMAS\nSOCIALES\n13.1 Derechos\n13.2 Obligaciones\n13.3 Sanciones\n14. INTERPRETACIÓN\n15. ANEXOS\nCON PARÁLISIS CEREBRAL Y PERSONAS CON\nESPASTICIDAD PARA EL EJERCICIO FISCAL 2018\n1. INTRODUCCIÓN\n1.1. ANTECEDENTES psicomotricidad del paciente y se acompaña de trastornos asociados como retraso mental, crisis convulsivas, trastornos visuales, auditivos, de lenguaje, conductuales y emocionales, que causan limitación de la actividad de la persona, atribuida a problemas en el desarrollo cerebral de la etapa fetal hasta la edad de seis años, La espasticidad es alteración del tono muscular, causado por daños en el sistema nerviosos central que dificulta y/o imposibilita total o parcialmente el movimiento de los músculos afectados, así como generar contracturas que limitan todavía más la movilidad. La hipertonía muscular, se acompaña reflejos osteotendinosos exagerados reflejos patológicos, como palmomentoniano, Babinski, clunus inagotable, que generan posturas anormales como patrón en tijera.\nLa parálisis cerebral, es causada por fenómenos adversos, durante el embarazo, parto y después del parto, como diabetes gestacional, toxemia gravídica, infección de vías, urinarias, traumatismos, infecciones por toxoplasmosis, citomegalovirus, rubeola, desnutrición, tabaquismo, alcoholismo, uso de drogas durante el embarazo; traumatismos, sufrimiento fetal agudo, hipoxia neonatal, aspiración e meconio, bajo peso, hipoglucemia, crisis convulsivas, durante el nacimiento, traumatismo craneoencefálico, infecciones bacterianas o virales, que puede generar meningoencefalitis.\nDebido a la incidencia de estos padecimientos entre la población infantil y adulta del Estado, el DIF\nGuerrero, implementa el Programa Aplicación de Toxina Botulínica Tipo “A” en Niñas y Niños con Parálisis\nCerebral y Personas con Espasticidad, el cual consiste en la aplicación de una neurotoxina que disminuye la espasticidad y las contracturas, mejorando en la movilidad y favoreciendo el tratamiento de terapia física del paciente.\n1.2. ALINEACIÓN PROGRAMÁTICA\nEn cumplimiento a lo que globalmente prevén los ejes rectores del Plan Estatal de Desarrollo 2016-2021\nEje: III.- Guerrero Socialmente Comprometido; Eje 6: Estrategias Transversales, específicamente en la estrategia 6.1: Atender a Niñas, Niños y Adolescentes, Objetivos: 3.7. Fortalecer la asistencia social a grupos vulnerables; Estrategia: 3.7.1. Atender integralmente a los grupos vulnerables y fomentar el acceso a los servicios de protección social que les permita mejorar su calidad de vida y 6.1.1 Difundir, ejercer, respetar, promover y proteger integralmente los derechos de niñas, niños y adolescentes a través de las\nLíneas de acción.\n1. Proporcionar asistencia social integral a menores, adolescentes y adultos que se encuentran en situación de vulnerabilidad.\nCON PARÁLISIS CEREBRAL Y PERSONAS CON\nESPASTICIDAD PARA EL EJERCICIO FISCAL 2018\n2. Generar mecanismos de participación de niñas, niños y adolescentes en el marco del Sistema Estatal de Protección Integral.\n“Desarrollo y Asistencia Social” que tiene como objetivo atender a personas vulnerables con carencias en materia de salud; así mismo se enmarca en el Programa Especial de Niñas, Niños, Adolescentes y Jóvenes\n2016 - 2021, que contempla como uno de sus objetivos fortalecer la participación para impulsar el desarrollo comunitario a través de esquemas de inclusión y cohesión social.\n1.3. DIAGNÓSTICO\nLa aplicación de Toxina Botulínica Tipo “A” en Niñas y Niños con Parálisis Cerebral y Personas con\nEspasticidad, es un tratamiento que va enfocado a mejorar y contribuir la calidad de vida de las personas que padecen estas enfermedades.\nEl estado de Guerrero de cuerdo al INEGI en el 2015, tiene una población de 3 388 768 y el municipio de\nAcapulco cuenta con una población de 810 669 habitantes, con una base de la pirámide poblacional de los\n0 - 14 años de edad, el estado tiene una población con discapacidad de 166,430 de acuerdo al INEGI, La discapacidad puede afectar a cualquier persona de muchas maneras durante su ciclo de vida, y las causas que la provocan también son diversas. Se puede presentar desde el nacimiento, otras que la adquieren durante su vida, ya sea por accidente, enfermedad, proceso de envejecimiento o un hecho violento. De cada 100 personas con discapacidad 32 la tiene porque sufrieron alguna enfermedad, 23 están afectados por edad avanzada, 19 la adquirieron por herencia, durante el embarazo o al momento de nacer, 18 quedaron con lesión a consecuencia de algún accidente, 8 debido a otras causas o violencia.\nLos tipos de discapacidad son: Motriz. Se refieren a la pérdida o limitación de una persona para moverse, caminar, mantener algunas posturas de todo el cuerpo o de una parte del mismo, Visual. Incluye la pérdida total de la vista, así como la dificultad para ver con uno o ambos ojos, Mental. Abarca las limitaciones para el aprendizaje de nuevas habilidades, alteración de la conciencia y capacidad de las personas para conducirse o comportarse en las actividades de la vida diaria, así como en su relación con otras personas, Auditiva Corresponde a la pérdida o limitación de la capacidad para escuchar, De lenguaje. Limitaciones y problemas para hablar o transmitir un significado entendible.\n1. Caminar o moverse 58.8%, 97, 860 personas\n2. Ver 26%, 43,272 personas\n3. Escuchar 12.7% 21,137 personas\n4. Hablar o comunicarse 8.5% 14.146 personas\nCON PARÁLISIS CEREBRAL Y PERSONAS CON\nESPASTICIDAD PARA EL EJERCICIO FISCAL 2018\n5. Mental 7.9% 13,148 personas\n6. Autocuidado 3.9% 6491 personas\n7. Atención y aprendizaje 3.3% 5492 personas.\nLa discapacidad se asocia con bajas condiciones de bienestar, tales como la pobreza extrema, la marginación social, la malnutrición, el analfabetismo, la ignorancia, el aun acelerado crecimiento de la población y su dispersión, lo que restringe la prestación de los servicios de salud, limitando la correcta vigilancia prenatal y la adecuada atención del parto. También está asociada con el aumento de las personas de la tercera edad y de las enfermedades crónico-degenerativas no transmisibles, las lesiones por accidentes de todo tipo y la violencia.\n2.- MISION Y VISION\n2.1 MISIÓN\nMejorar la funcionalidad de las niñas y niños con parálisis cerebral y de las personas con espasticidad, mediante la aplicación de la Toxina Botulínica tipo “A” que complemente su tratamiento de rehabilitación y coadyuve a la evolución eficiente del paciente.\n2.2 VISIÓN\nMejorar la calidad de vida de niñas, niños y adolescentes con parálisis cerebral y de las personas con espasticidad facilitando su integración al ámbito familiar y social.\n3.- DEPENDENCIA O ENTIDAD RESPONSABLE DEL PROGRAMA\nEl sistema para el Desarrollo Integral de la Familia a través de la Dirección de Servicio Médico\n4.- FUNDAMENTO LEGAL\n• Constitución Política de los Estados Unidos Mexicanos\n• Ley General de Salud.\n• Ley de Asistencia Social.\n• Ley General para la Inclusión de las Personas con discapacidad.\n• Ley para el Bienestar e Incorporación Social de las Personas con Discapacidad en el Estado de Guerrero, No. 281.\n• Ley No. 817 para las Personas con Discapacidad del Estado.\n• Plan Estatal de Desarrollo 2016-2021.\nCON PARÁLISIS CEREBRAL Y PERSONAS CON\nESPASTICIDAD PARA EL EJERCICIO FISCAL 2018\n• Ley 454 de Presupuesto y Disciplina Fiscal del Estado de Guerrero.\n• Ley sobre el Sistema Estatal de Asistencia Social 332 (Última reforma publicada el 20 de\nFebrero del 2015\n• Decreto Número 654 del Presupuesto de Egresos del Estado de Guerrero\n• Plan Estatal de Desarrollo 2016 - 2021\n• Programa Sectorial Desarrollo y Asistencia Social 2016 - 2021\n• Estrategia Local “Guerrero Contigo”\n• Reglamento Interno del Sistema para el Desarrollo Integral de la Familia del Estado de\nGuerrero.\n• Manual de Organización del DIF\n• Y todos los ordenamientos normativos aplicables.\n5.- OBJETIVOS Y ALCANCES\n5.1. OBJETIVO GENERAL.\nMejorar la funcionalidad de las niñas y niños con PCI y personas con espasticidad mediante la aplicación de la toxina botulínica tipo “A”, para disminuir el tono muscular y la rigidez, favoreciendo los resultados de la terapia física y otras modalidades de la rehabilitación.\n5.2. OBJETIVO ESPECIFICO.\n1. Favorecer la rehabilitación y prevenir y delimitar las secuelas en las personas con parálisis cerebral y personas con espasticidad.\n2. Contribuir a mejorar su calidad de vida, a las niñas y niños con Parálisis Cerebral y personas con espasticidad.\n3. Mejorar la funcionalidad motora de las personas.\n4. Facilitar su integración escolar, familiar y social, laboral.\n5.3 ALCANCES\nAtiende el derecho a la salud, sin discriminación por motivos de discapacidad, se adoptaran las medidas prestación de servicios que tengan en cuenta las cuestiones de género, incluidas la rehabilitación relacionada con la salud, Se Proporcionaran a las personas con discapacidad programas y atención de la consecuencia de su discapacidad incluidas la pronta detección e intervención, cuando proceda y servicios destinados a prevenir, y reducir al máximo la aparición de nuevas discapacidades, incluidos los niños y\nCON PARÁLISIS CEREBRAL Y PERSONAS CON\nESPASTICIDAD PARA EL EJERCICIO FISCAL 2018 niñas y las personas mayores. Exigirán a los profesionales de la salud que presten a las personas con libre e informado.\nAl aplicar Toxina Botulínica tipo “A” a las niñas y niños con parálisis cerebral infantil y personas con espasticidad se mejora su funcionalidad motora pueden llegar a ser independientes en sus actividades de la vida diaria, integrarse a los ámbitos familiar, social, escolar, laboral.\n6.- METAS FISICAS\nSe pretende atender un total de 240 beneficiarios procedentes de las regiones del Estado.\n7.- PROGRAMACIÓN PRESUPUESTAL\nSe designa un presupuesto de acuerdo al Decreto número 654 del Presupuesto de Egresos para el ejercicio fiscal 2018 Aplicación de Toxina Botulínica Tipo “A” en Niñas y Niños con Parálisis\nCerebral y Personas con Espasticidad de $500.000.00 (Quinientos Mil pesos 00/100 M.N.), recursos que provienen del Fondo de Aportaciones Múltiples, (Asistencia Social) Ramo 33.-Aportaciones Federales para Entidades Federativas y Municipios\nEl costo unitario por beneficiario es variable, pero aproximadamente es de $ 41,666.65 (Cuarenta y un mil seiscientos sesenta y seis pesos 65/100 M.N.) mensual, ya que las necesidades de cada niño o niña son diferentes así como de las y los adolescentes o mujeres y hombres con espasticidad, es de acuerdo a la dosis/peso y necesidades específicas lo que se espera atender es a 20 pacientes por atender mensualmente con un total de 120 pacientes al año\nCRONOGRAMA FINANCIERO\nPROGRAMA PRES. AUT. ENERO FEBRERO MARZO ABRIL MAYO\nAplicación de 500,000.0 0.00 0.00 0.00 500,000.00 0.00\nToxina Botulínica\nTipo \"A\" en Niñas y Niños con\nParálisis\nCerebral y\nPersonas con\nEspasticidad\nJUNIO JULIO AGOSTO SEP. OCT. NOV. DIC.\n.00 0.00 0.00 0.00 0.00 0.00 0.00\nCON PARÁLISIS CEREBRAL Y PERSONAS CON\nESPASTICIDAD PARA EL EJERCICIO FISCAL 2018\n8.- REQUISITOS Y PROCEDIMIENTOS DE ACCESO\n8.1 DIFUSION las redes sociales da conocer cada uno de los diferentes programas de asistencia social que ejecuta y opera en coordinación con las diferentes direcciones que integran el sistema como son; programas alimentarios, proyectos asistenciales, de bienestar social y desarrollo comunitario; cuyos requisitos se encuentran en las oficinas del sistema ubicadas en av. Rene Juárez Cisneros, colonia Ciudad de los\nServicios y ubicada av. Gabriel Leyva s/n esq. Ruffo Figueroa, Col. Burócratas, C.P. 39090, Chilpancingo, guerrero, con un horario de atención de 8:00 am a 3:00 pm y/o los teléfonos 01 (747) 4725595, 01\n(747)47256 00, 01 (747)47 25672 ext 1151 y 1159.\nAsí mismo al correo electrónicoalimentariadif@prodigy.net.mx, subdireccionalimentaria@prodigy.net.mx\nLas reglas de operación de cada uno de los programas son difundidas por el personal capacitado de cada una de las direcciones que conforman el sistema para el desarrollo integral de la familia y en la página web del portal del gobierno del estado. Por otra parte los programas tienen cobertura estatalSe brinda atención en los 81 municipios del estado, teniendo una capacidad de atención de niñas, niños y adolescentes, mujeres embarazadas, mujeres en periodo de lactancia, personas con discapacidad, adultos mayores y personas vulnerables por ingresos.\n8.2 REQUSITOS DE ACCESO\n1. El paciente debe acudir al CRIG solicitando servicio de rehabilitación, asimismo deberá presentar copia fotostática de la siguiente documentación con la cual se integrará su expediente clínico:\na) Acta de nacimiento\nb) credencial de elector\nc) CURP\nd) Comprobante de domicilio.\ne) Comprobante de ingresos\nf) En el caso de menores, el padre o la madre o tutor deberá presentar copia de su credencial de elector.\n2. El paciente es atendido en primera instancia por un médico general para consulta de pre-valoración, este servicio es gratuito.\n3. El médico general emite su diagnóstico y de acuerdo a este, canaliza al paciente con el médico especialista en rehabilitación.\nCON PARÁLISIS CEREBRAL Y PERSONAS CON\nESPASTICIDAD PARA EL EJERCICIO FISCAL 2018\n4. Para recibir la atención médica de especialidad, se cobrará al paciente por única ocasión una cuota de recuperación, cobrando a los pacientes adultos $64.00 y en el caso de menores de 5 años el servicio será gratuito.\n5. Se integra a su expediente y se realiza estudio socioeconómico al paciente\n6. El paciente es atendido por el médico especialista en rehabilitación o neuro-rehabilitación, quien emite su diagnóstico y prescribe el tipo de terapia que recibirá el paciente, especificando si es candidato, para la aplicación de la toxina botulínica tipo “A”, para lo cual se cita al paciente de forma inmediata de acuerdo a los espacios disponibles y disponibilidad de la toxina botulínica tipo “A”.\n7. En la fecha programada para la aplicación de la toxina botulínica tipo “A”, el paciente solicitará en el área de caja del CRIG su recibo de aplicación de toxina, el cual es sin costo si es menor de 5 años, o se le cobrara de acuerdo a la cuota de recuperación asignada a su Estudio Socioeconómico\n8. El recibo se entrega en el área de archivo clínico y posteriormente el recibo es entregado en el consultorio de rehabilitación para la aplicación de la toxina botulínica, el paciente es considerado beneficiario del programa, para lo cual se integran el expediente de control anual del programa, con la siguiente documentación del paciente:\na) Oficio de solicitud (Dirigido a la Presidenta del Patronato del DIF Guerrero)\nb) Acta de donación.\nc) Solicitud de consentimiento,\nd) Foto de cuerpo entero del paciente.\ne) Copia del acta de nacimiento, credencial de elector (IFE del padre, madre o tutor, tutora si es menor de edad)\nf) CURP (en caso de ser menor de edad anexar copia del tutor)\ng) Comprobante de domicilio.\nh) Nota médica.\ni) Estudio socioeconómico\n8.3- PROCEDIMIENTOS DE ACCESO estarán disponibles para su consulta en las Oficinas de la Dirección de Servicios Médicos Asistenciales, parálisis cerebral y personas con espasticidad, sin distinción de sexo, religión, raza y/o partido político que necesite del apoyo.\nCON PARÁLISIS CEREBRAL Y PERSONAS CON\nESPASTICIDAD PARA EL EJERCICIO FISCAL 2018\n8.4.- REQUISITOS DE PERMANENCIA, CAUSALES DE BAJA O SUSPENSIÓN TEMPORAL\nPermanecen en el Programa de aplicación de toxina tipo “A” siempre que cumplan con los requisitos establecidos en los lineamientos como pacientes del CRIG, causan baja o suspensión cuando el paciente deja de darle seguimiento a las consultas de Rehabilitación, los tratamientos de terapia física prescritos o dejan de asistir al CRIG.\n8.5 MODOS DE ENTREGA DEL BENEFICIO\nEl paciente deberá de ser usuario, acudir a las instalaciones del CRIG Guerrero, para recibir el tratamiento de la aplicación de la toxina botulínica tipo “A”.\n9.- PROCEDIMIENTOS DE INSTRUMENTACIÓN\n9.1 OPERACIÓN\nEl DIF Guerrero será responsable de la ¡mplementaclón del programa, los datos personales de las personas beneficiadas o derecho habiente del programa social, la información adicional generada y administrada se regirá por lo establecido en la ley No. 207 de transparencia y acceso a la información pública del Estado de Guerrero; los formatos y trámites a realizar son gratuitos\n1. El paciente debe acudir al CRIG solicitando servicio de rehabilitación, asimismo deberá presentar copia fotostática de la siguiente documentación con la cual se integrará su expediente clínico: a..-Acta de nacimiento b. credencial de elector.\nc. CURP. d. Comprobante de domicilio. e. comprobante de ingresos f. En el caso de menores, el padre o la madre o tutor deberá presentar copia de su credencial de elector.\n2. El paciente es atendido en primera instancia por un médico general para consulta de prevaloración, este servicio es gratuito.\n3. El médico general emite su diagnóstico y de acuerdo a este, canaliza al paciente con el médico especialista en rehabilitación.\n4. Para recibir la atención médica de especialidad, se cobrará al paciente por única ocasión una cuota de recuperación, cobrando a los pacientes adultos $64.00 y en el caso de menores de 5 años el servicio será gratuito.\nCON PARÁLISIS CEREBRAL Y PERSONAS CON\nESPASTICIDAD PARA EL EJERCICIO FISCAL 2018\n5. se integra a su expediente y se realiza estudio socioeconómico al paciente\n6. El paciente es atendido por el médico especialista en rehabilitación o neuro-rehabilitación, quien emite su diagnóstico y prescribe el tipo de terapia que recibirá el paciente, especificando si es candidato, para la aplicación de la toxina botulínica tipo “A”, para lo cual se cita al paciente de forma inmediata de acuerdo a los espacios disponibles y disponibilidad de la toxina botulínica tipo “A”.\n7. En la fecha programada para la aplicación de la toxina botulínica tipo “A”, el paciente solicitará en el área de caja del CRIG su recibo de aplicación de toxina, el cual es sin costo si es menor de 5 años, o se le cobrara de acuerdo a la cuota de recuperación asignada a su Estudio\nSocioeconómico\n8. El recibo se entrega en el área de archivo clínico y posteriormente el recibo es entregado en el consultorio de rehabilitación para la aplicación de la toxina botulínica, el paciente es considerado beneficiario del programa, para lo cual se integran el expediente de control anual del programa, con la siguiente documentación del paciente: a. Oficio de solicitud (Dirigido a la Presidenta del Patronato del DIF Guerrero) b. Acta de donación. c. Solicitud de consentimiento, d. Foto de cuerpo entero del paciente. e. Copia del acta de nacimiento, credencial de elector (IFE del padre, madre o tutor, tutora si es menor de edad) f. CURP (en caso de ser menor de edad anexar copia del tutor) g. Comprobante de domicilio. h. Nota médica. i. Estudio socioeconómico\n9.2- GASTOS DE OPERACIÓN\nEl presupuesto asignado a este programa, a través del Fondo de Aportaciones Múltiples, no contempla\nGastos de Operación.\n10.- TRANSPARENCIA\n10.1 DIFUSION\nLa aplicación del programa así como la cobertura será aplicada a los 81 municipios del Estado, La información se proporcionará en las instalaciones del CRIG Chilpancingo, ubicado en AV. Rene Juárez\nCisneros Col. Ciudad de los Servicios Chilpancingo, Guerrero con un horario de atención de las 8:00 horas\nCON PARÁLISIS CEREBRAL Y PERSONAS CON\nESPASTICIDAD PARA EL EJERCICIO FISCAL 2018 a las 15:00hrs de lunes a viernes, al número telefónico 01 747 47 1 84 98, al correo electrónico direccionseviciomedico@hotmail.com, y directamente en los DIF Municipales responsable: Dirección de\nServicios Médicos Asistenciales. Una vez autorizadas estas Reglas de Operación, por las instancias correspondientes, estarán disponibles para su consulta en las Oficinas de la Dirección de Servicios Médicos\nAsistenciales, así como en los medios electrónicos oficiales http://www.dif.guerrero.gob.mx información pública de oficio, fracción III Marco Normativo específico.\n10.2 BLINDAJE ELECTORAL\nLa operación y ejecución de los recursos estatales destinados al Programa, deberán observar y atender las medidas que emita la Secretaría de Contraloría y Transparencia Gubernamental, para coadyuvar a que éstos, no sean utilizados con fines políticos en el desarrollo de procesos electorales federales, estatales y municipales.\nComo estrategia de blindaje electoral, la papelería, documentación oficial, así como la publicidad y promoción del Programa deberán incluir la siguiente leyenda:\n\"Este Programa es de carácter público, no es patrocinado ni promovido por partido político alguno y sus recursos provienen de los impuestos que pagan todos los contribuyentes. Está prohibido el uso de este programa con fines políticos, electorales, de lucro y otros distintos a los establecidos.\nQuien haga uso indebido de los recursos de este programa deberá ser denunciado y sancionado de acuerdo con la ley aplicable y ante la autoridad competente\".\nEn cuanto a la publicidad en medios electrónicos, impresos, complementarios o de cualquier otra índole, vinculados con los Programas de comunicación social, se deberá incluir la siguiente leyenda:\n“Este Programa es público y queda prohibido su uso con fines partidistas o de promoción personal”.\n10.3 SUPERVISION Y CONTROL\nEl responsable del Programa deberá reportar mensualmente a la Dirección de Planeación del DIF Guerrero, las acciones ejercidas y los resultados obtenidos, quien a su vez reportará a la Secretaría de Planeación y de Contraloría, informes sobre el Presupuesto ejercido establecidos por el Consejo Nacional de\nArmonización Contable (CONAC) y con base en los indicadores de resultados previstos en las Reglas de\nOperación. Dichos informes se deberán presentar a más tardar a los quince días hábiles posteriores a la terminación de cada trimestre.\nCON PARÁLISIS CEREBRAL Y PERSONAS CON\nESPASTICIDAD PARA EL EJERCICIO FISCAL 2018\n10.4- MECANISMOS DE EVALUACION E INDICADORES\n10.4.1 EVALUACION correspondientes.\n10.4.2 INDICADORES\nCON PARÁLISIS CEREBRAL Y PERSONAS CON\nESPASTICIDAD PARA EL EJERCICIO FISCAL 2018\nCON PARÁLISIS CEREBRAL Y PERSONAS CON\nESPASTICIDAD PARA EL EJERCICIO FISCAL 2018\n10.5 AUDITORIA\nEl ejercicio del recurso y la operatlvldad del Programa, están sujetos a las disposiciones estatales aplicables y podrá ser auditado por la Secretaría de Contraloría y Transparencia Gubernamental del Estado, así como por la Auditoría General del Estado, conforme a la legislación vigente y en el ámbito de sus respectivas competencias.\nEl Sistema DIF Guerrero dará todas las facilidades a dichas instancias para realizar, en el momento en que lo juzguen pertinentes, las auditorías que consideren necesarias; así como el seguimiento y la solventación a las observaciones planteadas por los órganos de control.\n10.6 RECURSOS NO DEVENGADOS\nEl DIF Guerrero deberá reintegrar a la Dirección General de Tesorería de la Secretaría de Finanzas y\nAdministración del Gobierno del Estado los recursos que no se hubiesen destinado a los fines autorizados y aquellos que por cualquier motivo no estuviesen devengados al 31 de diciembre del Ejercicio fiscal correspondiente.\n10.7-CONTRALORIA SOCIAL\nCon la finalidad de incrementar la participación ciudadana, se crearán Comités de Contraloría Social, como un órgano ciudadano de control, vigilancia y evaluación de las actividades del Programa, conformados por los beneficiarios (as), los sectores sociales, y los representantes de la localidad, quienes de manera especificas supervisarán la gestión gubernamental, y que el manejo de los recursos públicos se realicen en términos de transparencia, eficacia, legalidad y honradez.\nLos objetivos específicos de este Órgano de Contraloría Social son:\nCON PARÁLISIS CEREBRAL Y PERSONAS CON\nESPASTICIDAD PARA EL EJERCICIO FISCAL 2018\n1. Hacer más transparentes las decisiones y la ejecución de los recursos.\n2. Incrementar la participación ciudadana.\n3. Fomenta la organización social.\n4. Inhibir los actos de corrupción y de cooptación social, política y electoral.\n5. Incrementar la eficiencia de los recursos públicos.\n6. Fortalecer la cultura de la legalidad.\n7. Mejorar la rendición de cuentas.\n8. Perfeccionar la democracia e incorporar la evaluación ciudadana.\n10.8 PROCEDIMIENTOS DE QUEJA O INCONFORMIDAD CIUDADADANA\nLos beneficiarios (as) pueden presentar quejas y denuncias ante las instancias correspondientes sobre cualquier hecho, acto u omisión que produzca o pueda producir daños al ejercicio de sus derechos establecidos en las presentes reglas o contravengan sus disposiciones y de la demás normatividad aplicable. a. En el Sistema DIF Guerrero\nTeléfonos: (747) 47-1-84-90 o 47-1-84-92\nCorreo electrónico: buzon.dif@guerrero.gob.irix\nDomicilio: Centro de Rehabilitación Integral Guerrero. Boulevard Lic. René Juárez Cisneros S/N, Col.\nCiudad de los Servicios. Chilpancingo, Guerrero. C.P. 39095. b. En la Secretaría de Contraloría y Transparencia Gubernamental del Estado.\nCorreo electrónico: contraloria@guerrero.gob.mx\nDomicilio: Palacio de Gobierno Primer Piso Edificio Norte, Blvd. R. Juárez Cisneros 62 Col. de los Servicios\nC.P. 39075.\nLas quejas y denuncias de la ciudadanía derivadas de alguna irregularidad en la operación del Programa, podrán presentarse por escrito, por comparecencia del beneficiario (a), por correo electrónico o vía telefónica y deberá proporcionar los siguientes datos: nombre del servidor público, área de adscripción, objeto de la denuncia, nombre y domicilio del quejoso e identificación oficial.\n10.9 MECANISMOS DE EXIGIBILIDAD\na) Los requisitos y procedimientos para ser beneficiados por el programa podrán ser solicitados en la\nCRIG Chilpancingo, Av. Rene Juárez Cisneros, col. Ciudad de los Servicios, Chilpancingo Guerrero.\nb) Los casos en los que se podrá exigir los derechos por incumplimiento o por violación de los mismos\nCON PARÁLISIS CEREBRAL Y PERSONAS CON\nESPASTICIDAD PARA EL EJERCICIO FISCAL 2018\nc) Cuando una persona solicitante cumpla con los requisitos y criterios de inclusión para acceder a determinado derecho (garantizado por un programa social) y exija a la autoridad administrativa ser derecho habiente del mismo\nd) Cuando la persona derechohabiente de alguna instancia medica exija que se cumpla con dicho derecho, de manera integral en tiempo y forma, como lo establece el programa\ne) Cuando no se pueda satisfacer toda la demanda de restricción presupuestal, y estás exijan que las incorporaciones sean claras, transparentes, equitativas, sin favoritismos, ni discriminación\nLa Secretaria de Contraloría y transparencia gubernamental del Gobierno del Estado es el órgano competente para conocer de las denuncias de violación e incumplimiento de derechos en materia de desarrollo social.\n10.10 ACTA ENTREGA RECEPCIÓN\nCon la finalidad de llevar un registro de acuerdo a la normatividad vigente, cada usuario del CRIG se le integrará un Expediente Clínico, se le otorgará un\nCarnet de Citas médicas para control de consultas y tratamientos, de igual manera se integrara su expediente anual de aplicación de toxina.\n11. CRITERIOS DE SELECCIÓN Y ELEGIBILIDAD\n11.1. MÉTODO DE SELECCIÓN DE BENEFICIARIOS (AS)\n1. Ser paciente del CRIG\n2. Ser niño, niña, adolescentes o adultos, hombre o mujer, con Parálisis Cerebral Infantil o tener una enfermedad que genere espasticidad\n12. - MECANICA DE OPERACIÓN\n12.1 INSTANCIA EJECUTORA\nServicios Médicos Asistenciales, quien deberá operar con apego a la programación, presupuestación, calendario de ejecución, ejercicio y control del gasto público.\nCON PARÁLISIS CEREBRAL Y PERSONAS CON\nESPASTICIDAD PARA EL EJERCICIO FISCAL 2018\n12.2 INSTANCIA ADMINISTRATIVA Y/O NORMATIVAS procedimientos para normar y regular la operatividad del Programa asegurando el cumplimiento de los objetivos y metas trazadas.\n12.3. DELIMITACIÓN DE ATRIBUCIONES\nEl DIF Guerrero establecerá los mecanismos de coordinación necesaria para garantizar que sus programas y acciones no se contrapongan, afecten o presenten duplicidades con otros programas o acciones del\nGobierno Estatal; la coordinación institucional y vinculación de acciones busca potenciar el impacto de los recursos, fortalecer la cobertura de las acciones, detonar la complementariedad y reducir gastos administrativos.\n13. DERECHOS, OBLIGACIONES Y SANCIONES DE LOS BENEFICIARIOS (AS) DE LOS\nPROGRAMAS SOCIALES\n13.1. DERECHOS\n1. Recibir trato digno, respetuoso y equitativo sin discriminación alguna, por el personal de las distintas áreas que participen dentro del programa.\n2. Tener la reserva y privacidad de la información personal.\n3. Solicitar y recibir información sobre el estado que guarda su trámite.\n4. Recibir los servicios y prestación del programa conforme a las Reglas de Operación, salvo que le sea suspendido su apoyo por alguna razón justificable.\n5. Recibir del Sistema Estatal una respuesta en los 30 días hábiles, después de haber entregado sus documentos y haber sido aceptado dentro del programa.\n13.2. OBLIGACIONES\n1. Proporcionar la información socioeconómica bajo protesta de decir verdad que les sea requerida por el DIF Guerrero, en los términos que establezca la normatividad correspondiente.\n2. Utilizar los apoyos para los fines con que fueron autorizados evitando cualquier uso distinto de la misma.\n3. Permitir la visita con la finalidad de validar la información proporcionada en sus expedientes correspondientes.\n4. Facilitar los trabajos de verificación, en cualquier momento después de otorgado el apoyo.\nCON PARÁLISIS CEREBRAL Y PERSONAS CON\nESPASTICIDAD PARA EL EJERCICIO FISCAL 2018\n13.3. SANCIONES\nNormativas para acceder a los beneficios que a través de estos se otorgan, establecidos en los numerales\n8.2 y 8.3 perderán las prerrogativas que dichas disposiciones establecen\n14. INTERPRETACIÓN\nLa interpretación de las presentes Reglas de Operación para efectos administrativos, estarán a cargo del\nDIF Guerrero, así como de la Secretaría de Contraloría y Transparencia Gubernamental, en el ámbito de sus respectivas competencias.\nGLOSARIO\nSe entenderá en las siguientes Reglas de Operación por: AGE.- Auditoria General del Estado.\nSEPLADER.- Secretaria de Planeación y Desarrollo Regional\nDIF Guerrero.- Sistema Estatal para el Desarrollo Integral de la Familia. SEFINA.- Secretaria de Finanzas y Administración del Gobierno del Estado. CRIG.- Centro de Rehabilitación Integral Guerrero.\nPCI.- Parálisis Cerebral Infantil.\nEspasticidad.- Trastorno motor del sistema nervioso, en el que algunos músculos se mantienen permanentemente contraídos. Dicha contracción provoca la rigidez y acortamiento de los músculos e interfiere sus distintos movimientos y funciones: deambulación, manipulación, equilibrio, habla, deglución, etc.\nParálisis Cerebral.- Trastorno permanente y no progresivo que afecta a la psicomotricidad del paciente.\nToxina Botulínica.- Neurotóxica producida por la bacteria 'Clostridium botulinum'. Actúa inhibiendo la transmisión neuromuscular en las sinapsis nerviosas.\nDIRECTORA DE SERVICIOS MEDICOS ASISTENCIALES. GUERRERO.\nDRA. PATRICIA ROMERO NERI.\nRúbrica.\nDIRECTOR GENERAL DEL DIF.\nLIC. JOSÉ FRANCISCO SOLÍS SOLÍS.\nRúbrica.\nCON PARÁLISIS CEREBRAL Y PERSONAS CON\nESPASTICIDAD PARA EL EJERCICIO FISCAL 2018\nCON PARÁLISIS CEREBRAL Y PERSONAS CON\nESPASTICIDAD PARA EL EJERCICIO FISCAL 2018",
  "ordenamiento": "REGLA",
  "jurisdiccion": "GUERRERO",
  "fuente_oficial": "DIARIO OFICIAL DE LA FEDERACION",
  "Fecha de Publicación": "06 de abril de 2018",
  "ULTIMA REFORMA PUBLICADA": null,
  "status": "VIGENTE",
  "es_escaneado": false,
  "tiene_tablas": true,
  "materia": [
    "general"
  ]
}