{
  "titulo": "Acuerdo por el Que Se Emiten las Reglas de Operación del Programa de Fertilizante y Transferencia de",
  "Contenido": "P.V. 2014\n1. Introducción.............................................................................................................................. 4\n2. OBJETIVO................................................................................................................................ 5\n2.1. General.................................................................................................................................. 5\n2.2. Específico.............................................................................................................................. 5\n2.3. Población Objetivo................................................................................................................. 6\n3. MISIÓN..................................................................................................................................... 6\n4. VISIÓN..................................................................................................................................... 6\n5. REGLAS DE OPERATIVIDAD.................................................................................................. 6\n5.1. Lineamientos Generales........................................................................................................ 6\n5.1.1. Fundamento Legal.............................................................................................................. 7\n5.1.2. Participantes......................................................................................................... 8\n5.1.3. Patrimonio del programa..................................................................................................... 9\n5.1.3. Tipos de apoyo................................................................................................................... 9\n6. INFORMACIÓN DEL PROGRAMA........................................................................................... 12\n6.1. Exposición del Programa....................................................................................................... 12\n6.2. Cobertura............................................................................................................................... 12\n6.3. Modos de entrega del beneficio............................................................................................. 13\n6.4. Gastos de operación.............................................................................................................. 15\n7. TRANSPARENCIA................................................................................................................... 15\n7.1. Difusión.................................................................................................................................. 15\n7.2. Seguimiento de avances físicos y financieros........................................................................ 15\n7.3. Evaluación............................................................................................................................. 15\nP.V. 2014\n7.4. Auditoria................................................................................................................................ 16\n7.5. Recursos no devengados....................................................................................................... 16\n7.6. Blindaje electoral.................................................................................................................... 16\n7.7. Contraloría social................................................................................................................... 17\n7.8. Quejas y Denuncias............................................................................................................... 18\n7.9. Actas de entrega recepción.................................................................................................... 18\n8. CRITERIOS DE SELECCIÓN Y ELEGIBILIDAD....................................................................... 19\n8.1. Método de selección de beneficiarios.................................................................................... 19\n9. MECÁNICA DE OPERACIÓN................................................................................................... 20\n9.1. Instancia ejecutora................................................................................................................. 21\n9.2. Instancia administrativa y / normativa..................................................................................... 21\n9.3. Delimitación de atribuciones.................................................................................................. 22\n10. DERECHOS, OBLIGACIONES Y SANCIONES DE LOS BENEFICIARIOS\nDE PROGRAMAS SOCIALES...................................................................................................... 22\n10.1. Derechos............................................................................................................................. 22\n10.2. Obligaciones........................................................................................................................ 22\n10.3. Sanciones............................................................................................................................ 23\n11. INTERPRETACIÓN................................................................................................................ 23\nP.V. 2014\nTEXTO ORIGINAL.\nFERTILIZANTE Y TRANSFERENCIA DE TECNOLOGÍA, PARA EL CICLO P.V. 2014.\nMVZ. HUMBERTO RAFAEL ZAPATA AÑORVE, Secretario de Desarrollo Rural del Gobierno del Estado de Guerrero, con fundamento en los artículos 1°, 2°, 3°, 4°, 6°, 7° de la Ley de Desarrollo\nRural Sustentable del Estado de Guerrero, publicada en el Periódico Oficial de fecha 21 de octubre del\n2011, así como su homóloga Federal, en los diversos 1°, 2°, 5°, 6°, 7°, 8°, 9° y 32 publicada en el Diario\nOficial de la Federación el 7 de diciembre de 2001, además tomando en consideración lo estipulado en el artículo 56 del Capítulo V (De los subsidios y transferencias) del Presupuesto de Egresos del Estado de\nGuerrero para el ejercicio fiscal 2014, publicado en el Periódico Oficial el 27 de diciembre del 2013, y\nQue el Estado de Guerrero cuenta con una superficie potencial susceptible de ser aprovechada con actividades del sector primario, del orden de 6.3 millones de hectáreas; de éstas, para uso forestal son cerca de 2 millones de hectáreas; para otros usos le corresponden 0.7 millones de hectáreas; mientras que a la actividad pecuaria se destinan 2.9 millones de hectáreas; y a la agricultura casi 0.8 millones de hectáreas. Es importante mencionar que la superficie agrícola se clasifica, por su condición, de temporal y de riego, a la primera pertenecen casi 0.7 millones de hectáreas y a la segunda casi 0.09 millones de hectáreas. El 91.3% de esta superficie es de propiedad ejidal y el 8.4% es propiedad privada.\nEl sector primario de la economía aporta el 10.84 % en la conformación del producto interno bruto estatal y absorbe el 26 % de la población ocupada. Tanto el campo como la industria no son competitivos en el mercado nacional e internacional, solo el turismo sobresale en este contexto.\nQue en esta entidad suriana, la agricultura, representa una de las ramas económicas de mayor relevancia, aún cuando su aportación sea limitada en los indicadores del comercio estatal, nacional e internacional; sin embargo, socialmente, es por excelencia la que mayor aporte hace para la sobrevivencia de un gran número de familias.\nQue el Programa de Fertilizante y Transferencia de Tecnología tiene como objetivo general, cumplir con lo establecido en la Ley de Desarrollo Rural Sustentable del Estado de Guerrero, así como la homóloga Federal, siguiendo los lineamientos establecidos en el Plan Estatal de Desarrollo 2011-2015, incremento a la producción.\nPor lo expuesto y con fundamento en las disposiciones legales antes citadas, he tenido a bien expedir el siguiente:\nP.V. 2014\nÚNICO.- Se expiden las Reglas de Operación del Programa de Fertilizante y Transferencia de\nTecnología, las cuales se anexan al presente.\nTRANSITORIOS\nPRIMERO.- Las presentes reglas de operación, entrarán en vigor al día siguiente de su publicación en el Periódico Oficial del Gobierno del Estado de Guerrero.\nSEGUNDO.- Quedan abrogadas las Reglas de Operación del Programa de Fertilizante y\nTransferencia de Tecnología, publicadas en el Periódico Oficial del Estado de Guerrero, número 15 alcance I, de fecha 09 de febrero de 2013.\nDado en la ciudad de Chilpancingo, Guerrero, a los 27 días del mes de Enero del año dos mil catorce.\nEL SECRETARIO DE DESARROLLO RURAL.\nMVZ. HUMBERTO RAFAEL ZAPATA AÑORVE.\nRúbrica.\nACUERDO por el que se emiten las Reglas de Operación del Programa de Fertilizante y\nTransferencia de Tecnología.\n1. INTRODUCCIÓN.\nEl Gobierno del Estado de Guerrero emprenderá y fomentará acciones para dar viabilidad a un proyecto integral de desarrollo que mejore sustancialmente las condiciones de vida de las y los\nGuerrerenses, por eso es nuestro afán de diversificar la oferta productiva, e incrementar el valor agregado a los productos del campo, mejorar la calidad genética de nuestros maíces y explotar racional y sustentablemente los recursos naturales. Puesto que es deber y obligaciones con las nuevas generaciones proteger la riqueza natural.\nConsiderando que, una de las acciones fundamentales establecidas en el Plan Estatal de\nDesarrollo 2011-2015, consistente en transformar el actual Programa de Fertilizante en un programa integral y corresponsable para la producción de granos básicos; corresponde al Gobierno Estatal apoyar a productores de bajos ingresos, coadyuvando al incremento de la producción y productividad de maíz y otros granos básicos.\nQue el proceso de reorientación del programa, tiene como objetivo: disminuir la superficie de manejo integral. En donde los ejes principales de este proceso son:\nP.V. 2014\na) impulsar la distribución y uso de fertilizantes de origen orgánico, que garanticen la fertilidad del campo guerrerense,\nb) establecer el programa estatal \"Fertilidad y Manejo de suelos\" y\nc) desarrollar un programa intensivo de obras de conservación de suelo y agua.\n2. OBJETIVO\n2.1. General\n➢ Cumplir con lo establecido en el Plan Estatal de Desarrollo 2011-2015, que consiste en recuperar el dinamismo de la actividad productiva, respetando el medio ambiente, con el propósito de elevar el nivel de vida de los guerrerenses, así como garantizar a la población el abasto de los productos alimenticios.\n➢ Disponer del paquete tecnológico en tiempo y forma para su aplicación, coadyuvando con esto al incremento de la producción de maíz, resolviendo la demanda del insumo en el Estado, en apoyo a los productores de bajos ingresos. Consistiendo en transformar el actual programa de fertilizante en un programa integral y corresponsable para la producción de granos básicos.\n2.2. Específico\n➢ Asignar los recursos financieros o el producto en especie a los municipios para la adquisición ó distribución del paquete tecnológico en beneficio de los productores empadronados, para el establecimiento del cultivo de maíz.\n➢ Adecuar la utilización de la nutrición del cultivo, tomando en cuenta el tipo de suelo destinado para el cultivo de maíz, para lograr incrementos reales en la producción durante el Ciclo\nAgrícola Primavera-Verano.\n➢ Instalar parcelas de innovación con las nuevas opciones de fertilización para mejorar los resultados obtenidos en el ciclo P.V. anterior.\n➢ Apoyar a los productores con cursos de capacitación, en las diferentes prácticas agronómicas que se realizan para obtener rendimientos satisfactorios en el cultivo de maíz. Así como la producción de abonos orgánicos, elaboración de compostas y biopesticidas.\n➢ Realizar una evaluación final de los resultados del programa con el fin de observar el impacto social del mismo.\nP.V. 2014\n2.3. Población Objetivo menos tienen y la siembra de productos básicos (maíz y frijol), partiendo del subsidio a insumos necesarios y apoyos a procesos de producción, como lo son el fertilizante y la transferencia de tecnología, respectivamente, en beneficio de productores dedicados a esta actividad primaria. Ejercer recursos en beneficio directo principalmente de los productores de bajos recursos en los 81 municipios del estado.\n3. MISIÓN\nPromover en el Estado de Guerrero el uso racional y adecuado de fertilizantes, así como la conservación del suelo a través de la asistencia técnica, contribuyendo al logro de una agricultura sustentable.\n4. VISIÓN\nMejorar la calidad de los granos básicos sin sacrificar su carácter natural, mejorando la calidad de vida alimentaria lo máximo posible sin dañar el ecosistema agrícola recuperando la agricultura sostenible.\n5. REGLAS DE OPERATIVIDAD\n5.1. Lineamientos generales\nEl presente ordenamiento es de orden público e interés general, sus disposiciones son de observancia obligatoria en el territorio estatal, y tiene por objeto impulsar una estrategia mediante políticas públicas que den una atención integral. Para lo cual en los siguientes cuadros se detallan las acciones que cada uno de los involucrados en este programa deben realizar:\nActividad SEDER Responsable Periodo\nElaboración, aprobación y SEDER, COPLADEG, SEGOB Enero/febrero publicación de reglas de operación\nElaboración de mecánica operativa SEDER 15 al 30 de enero\nElaboración de expediente SEDER 15 de enero/ 28 de febrero\nFirma de convenios SEDER y H. Ayuntamientos 20 de febrero\nP.V. 2014\n{\"tabla_1\":{\"columnas\":[\"Dispersión de recursos financieros\",\"SEDER\",\"15 de febrero/30 de abril\"],\"filas\":[{\"columna_1\":\"y/o insumos\",\"columna_2\":\"(sin dato)\",\"columna_3\":\"(sin dato)\"},{\"columna_1\":\"Recepción y revisión de\",\"columna_2\":\"SEDER\",\"columna_3\":\"30 de agosto\"},{\"columna_1\":\"documentación comprobatoria\",\"columna_2\":\"(sin dato)\",\"columna_3\":\"(sin dato)\"},{\"columna_1\":\"Oficios de liberación\",\"columna_2\":\"SEDER\",\"columna_3\":\"31 de diciembre\"}]}}\n{\"tabla_2\":{\"columnas\":[\"Actividad Municipio\",\"Responsable\",\"Periodo\",\"(sin encabezado)\"],\"filas\":[{\"columna_1\":\"Integración de Comités Locales\",\"columna_2\":\"Ayuntamiento\",\"columna_3\":\"Diciembre 2013/Enero 2014\",\"columna_4\":\"(sin dato)\"},{\"columna_1\":\"Validación de padrón de\",\"columna_2\":\"Comités\",\"columna_3\":\"Enero/Febrero\",\"columna_4\":\"(sin dato)\"},{\"columna_1\":\"productores\",\"columna_2\":\"(sin dato)\",\"columna_3\":\"(sin dato)\",\"columna_4\":\"(sin dato)\"},{\"columna_1\":\"Firma de convenio\",\"columna_2\":\"H. Ayuntamiento y SEDER\",\"columna_3\":\"20 de febrero\",\"columna_4\":\"(sin dato)\"},{\"columna_1\":\"Recuperación de la cuota\",\"columna_2\":\"Ayuntamiento\",\"columna_3\":\"Febrero/Abril\",\"columna_4\":\"(sin dato)\"},{\"columna_1\":\"Licitación\",\"columna_2\":\"Ayuntamiento\",\"columna_3\":\"Marzo\",\"columna_4\":\"(sin dato)\"},{\"columna_1\":\"Elaboración de Expediente Técnico\",\"columna_2\":\"Ayuntamiento y COPLADEG\",\"columna_3\":\"Marzo\",\"columna_4\":\"(sin dato)\"},{\"columna_1\":\"ante el COPLADEG\",\"columna_2\":\"(sin dato)\",\"columna_3\":\"(sin dato)\",\"columna_4\":\"(sin dato)\"},{\"columna_1\":\"Compra del insumo\",\"columna_2\":\"Ayuntamiento\",\"columna_3\":\"Abril\",\"columna_4\":\"(sin dato)\"},{\"columna_1\":\"Entrega de insumos\",\"columna_2\":\"Ayuntamiento\",\"columna_3\":\"31 de mayo\",\"columna_4\":\"(sin dato)\"},{\"columna_1\":\"Comprobación de recursos\",\"columna_2\":\"Ayuntamiento\",\"columna_3\":\"30 de Agosto\",\"columna_4\":\"(sin dato)\"},{\"columna_1\":\"ejercidos\",\"columna_2\":\"(sin dato)\",\"columna_3\":\"(sin dato)\",\"columna_4\":\"(sin dato)\"},{\"columna_1\":\"Actividades Productores\",\"columna_2\":\"Responsable\",\"columna_3\":\"(sin dato)\",\"columna_4\":\"Periodo\"},{\"columna_1\":\"Integración de Comité\",\"columna_2\":\"Productores\",\"columna_3\":\"(sin dato)\",\"columna_4\":\"Enero/Febrero\"},{\"columna_1\":\"Integración y Validación del Padrón\",\"columna_2\":\"Asamblea General de Productores\",\"columna_3\":\"(sin dato)\",\"columna_4\":\"Febrero\"},{\"columna_1\":\"de Beneficiarios\",\"columna_2\":\"(sin dato)\",\"columna_3\":\"(sin dato)\",\"columna_4\":\"(sin dato)\"},{\"columna_1\":\"Solicitud de inscripción en el\",\"columna_2\":\"Productores\",\"columna_3\":\"(sin dato)\",\"columna_4\":\"Febrero\"},{\"columna_1\":\"Programa\",\"columna_2\":\"(sin dato)\",\"columna_3\":\"(sin dato)\",\"columna_4\":\"(sin dato)\"},{\"columna_1\":\"Pago de la cuota por paquete\",\"columna_2\":\"Productores\",\"columna_3\":\"(sin dato)\",\"columna_4\":\"Febrero/Abril\"},{\"columna_1\":\"Recepción de los paquetes\",\"columna_2\":\"Productores\",\"columna_3\":\"(sin dato)\",\"columna_4\":\"Marzo/31 de mayo\"},{\"columna_1\":\"Aplicación del insumo\",\"columna_2\":\"Productores\",\"columna_3\":\"(sin dato)\",\"columna_4\":\"31 de mayo/ 30 de julio\"}]}}\n5.1.1. Fundamento legal\nLeyes\nP.V. 2014\n• Ley Número 814 de Desarrollo Rural Sustentable del Estado de Guerrero, publicada en el\n• Ley Orgánica de la Administración Pública del Estado de Guerrero, publicada en el Periódico\nOficial del Gobierno del Estado de Guerrero de fecha 11 de octubre de 1999, artículos 3; 4 párrafo 1º y\n2º; 7; 11 y artículo 30 en sus fracciones II, IV, V, VI, VII Y XX;\n• Ley de Planeación para el Estado de Guerrero, publicada en el Periódico Oficial del Gobierno del Estado de Guerrero de fecha 9 de marzo de 1991, artículos 1; 2; 3; 4; 5 y 6;\n• Ley 374 de Transparencia y Acceso a la Información Pública del Estado de Guerrero, publicada en el Periódico Oficial del Gobierno del Estado de Guerrero, número 48 de fecha 15 de junio de 2010.\nReglamentos\n• Reglas de operación del Programa de Fertilizante y Transferencia de Tecnología, publicadas en el Periódico Oficial del Gobierno del Estado de Guerrero de fecha 19 de febrero de 2013.\n• Mecánica Operativa del Programa de Subsidio al Fertilizante.\n• Reglas de Operación de la SAGARPA\nDecretos presidenciales y Secretariales\n• Constitución Política de los Estados Unidos Mexicanos, publicada en el Diario Oficial de la\nFederación de fecha 5 de febrero de 1917, artículos 27 fracción XX; 26 inciso A), párrafo 3º, y artículo 25 párrafo 2º.\n• Plan Estatal de Desarrollo 2011-2015, Eje de Desarrollo Económico Sustentable.\n• Decreto 438 del Presupuesto de Egresos del Estado de Guerrero, publicado en el Alcance IV\n2013.\n5.1.2. Participantes\nRural, los H. Ayuntamientos y los productores dedicados a la siembra del maíz.\nP.V. 2014\n5.1.3. Patrimonio del programa\nEl patrimonio del programa para la adquisición de todo el fertilizante que demanda el Estado, se integra de manera tripartita con:\nEstatal Directa (I.E.D.), los cuales son aprobados por el H. Congreso del Estado en el presupuesto de egresos del año respectivo\nb) La aportación de los 81 H. Ayuntamientos\nc) La aportación de los productores\n5.1.3. Tipos de apoyo\nLos tipos de apoyo que otorga el presente Programa son para la adquisición de insumos como el fertilizante químico, el biofertilizante, y capacitación y asistencia técnica a los productores.\nEl Gobierno del Estado a través de la Secretaría, transferirá a los Ayuntamientos los recursos financieros o lo equivalente en insumo, asignados en los convenios de colaboración estado-municipio, a través de los cuales operarán el Programa. Los Ayuntamientos distribuirán los paquetes tecnológicos con un criterio de equidad, determinado por la superficie del Censo Agropecuario realizado por el Instituto\nNacional de Estadística y Geografía (INEGI) y considerando la que resulte una vez que se haya revisado, y en su caso, depurado, el padrón correspondiente por los Ayuntamientos para la producción de granos básicos, obligándose a soportar dicho recurso con los padrones de beneficiarios, de conformidad con lo señalado en el presente instrumento.\nPara eficientar la aplicación del Programa, el Gobierno del Estado y los Municipios, podrán convenir que los recursos del programa puedan ser canalizados a través de instituciones públicas o privadas de financiamiento, que permitan un mayor beneficio respecto a la población objetivo.\nLa transferencia de recursos financieros por el Estado a los Municipios, o lo equivalente en insumo, se realizará, de acuerdo a la disponibilidad presupuestal, a la comprobación documental en\nAyuntamiento; durante el período de los meses de febrero a abril de cada ciclo agrícola, preferentemente.\nEl tipo de paquetes a entregar está en función del pH del suelo de la siguiente manera:\nDiamónico\nP.V. 2014\nLos Ayuntamientos se obligan a requerir a los proveedores que participan en la licitación, las características del fertilizante a distribuir, las cuales se describen:\nCaracterísticas técnicas de calidad y cantidad.\n✓ Fertilizantes químicos: Estos deberán cumplir con lo especificado en la etiqueta, con respecto al peso y al contenido, es decir el porcentaje del elemento en cuestión. (Nitrógeno, Fósforo u otro).\n✓ El Sulfato de Amonio: Deberá contener 20.5% de Nitrógeno y venir envasado en sacos de polipropileno de 50 kilos cada uno.\n✓ El Fosfonitrato: Deberá contener el 33% de Nitrógeno y 3% de fósforo; este fertilizante deberá venir envasado en sacos de polipropileno de 50 kilos netos cada uno, con envase interior de polietileno (plástico), para contribuir a su conservación.\n✓ El Fosfato Diamónico (DAP): Debe contener el 18% de Nitrógeno y 46% de Fósforo; debe estar envasado en sacos de polipropileno de 50 kilos cada uno.\n✓ Biofertilizantes: En el caso de la bacteria (Azospirillum brasilense), fijadora de Nitrógeno, deberá de contener 500 millones de UFC (Unidades Formadoras de Colonias). En el caso de la micorriza debe ser Glomus intrarradices (hongo), el contenido de esporas debe ser al menos de 20 esporas por gramo de suelo. Considerando que la vida útil de ambos organismos es diferente, así como el sustrato para su conservación, y por ende su efectividad. Se recomienda que los Ayuntamientos exijan a los\nProveedores que la presentación del envasado de cada uno de ellos sea por separado.\nLos Ayuntamientos también expresarán en las bases de su licitación la exigencia a los proveedores de que el suministro del Fertilizante tenga las siguientes características:\nProducto Características Generales\nSulfato de amonio: Fórmula química: Fertilizante químico de uso agrícola, con un\n(NH) SO 20.5% de Nitrógeno y 100% soluble en agua.\nPresentación: cristales de color blanco con tamaño de partículas (95%) de 1 a 2 mm.\nLibre de materiales pesados.\nEnvase: Sacos de polipropileno de 50 Kg.\nNetos.\nP.V. 2014\nFertilizante químico de uso agrícola, con un\n18% de Nitrógeno y 46% de Fósforo.\nPresentación: forma granular de color gris, de regular tamaño y presentación homogénea.\nFosfato diamónico (DAP) (NH) HPO\nPresentación: Gránulos esféricos de color café oscuro, grisáceo o negro.\nEnvase: Sacos de polipropileno de 50 Kg.\nProducto Características Generales\nFosfonitrato NH -N0 -P0 Fertilizante químico de uso agrícola, con 33% de Nitrógeno y 3% de Fósforo.\nPresentación: Perlas o granos esféricos color blanco, ligeramente cremoso, de 1.2 a 3.5 mm de tamaño de partícula.\nEnvase: sacos de polipropileno de 50 kilos netos, con envase interior de polietileno\n(plástico).\nBacteria: Azospirillum brasilense 500 millones de Unidades Formadoras de Colonias (UFC).\nBiofertilizantes Hongo: Glomus intrarradices, 20 esporas por gramo de suelo, se recomienda que ambos organismos se presenten envasados por separado en bolsas distintas debido a que la vida útil de ambos organismos es diferente, así como el sustrato en que se conserva cada microorganismo, pues para el caso de la bacteria es de 6 meses y para el hongo micorrízico hasta tres años en buenas condiciones de almacenamiento.\nP.V. 2014\nAsimismo, los Ayuntamientos se obligan a contratar con empresas que no estén boletinadas por contratación con las mismas. de Prestadores de Servicio Profesional, de acuerdo al Componente Extensión e Innovación Productiva\n(CEIP), perteneciente al Programa Integral de Desarrollo Rural (PIDER), de las Reglas de Operación vigentes para este 2014 de la SAGARPA, como una estrategia para apoyar técnicamente el proceso de mejoramiento de la producción de granos básicos. Que tendrán las siguientes funciones:\n1) Coadyuvar en los procesos operativos de la estrategia.\n2) Dar capacitación y asistencia técnica a los productores, en materia de las innovaciones tecnológicas, en la producción de granos básicos.\n3) Instalar parcelas de seguimiento con innovaciones tecnológicas en coordinación con los productores cooperantes.\n4) Dar seguimiento a un conjunto de parcelas representativas de las diferentes condiciones agroecológicas del municipio y registrar su desempeño tecnológico y productivo.\n5) Elaborar un diagnóstico integral de la producción en el municipio y generar un plan de corto y mediano plazo para su mejoramiento, el cual se deberá integrar al Programa Municipal de Desarrollo\nRural Sustentable.\n6) Organizar la estrategia de conservación de las variedades criollas de maíz y otros granos básicos en el municipio, así como el proceso de mejoramiento genético en las parcelas.\n7) Las que asigne la Secretaría en referencia a la estrategia.\n6. INFORMACIÓN DEL PROGRAMA\n6.1. Exposición del Programa y los presidentes municipales, reuniones de los Delegados Regionales de la Secretaría con los presidentes municipales, en las reuniones del Consejo Municipal de Desarrollo Rural Sustentable y\nCOPLADEMUN.\n6.2. Cobertura\nEl Programa tiene una cobertura estatal. Sujeto al padrón de productores, validado en cada una de las Asambleas Generales por localidad.\nP.V. 2014\nRegión Cobertura Estatal\nMunicipios: 81\nLocalidades: 7,193\n6.3. Modos de entrega del beneficio\nEl Ayuntamiento diseñará una logística especial para la distribución del fertilizante en el área de su jurisdicción, debiendo considerar preferentemente las localidades de difícil acceso y la puntualidad en el pago de la aportación de los productores.\nCada localidad participante en el Programa, constituirá su comité local, cuyos directivos serán un\nPresidente, un Secretario y un Tesorero, designados en la Asamblea de productores, pudiendo recaer dichos cargos en los mismos representantes de las autoridades ejidales y/o comunales.\nLos Ayuntamientos integrarán los comités locales con el objeto de dar seguimiento y atención a las actividades establecidas, haciendo llegar a la Secretaría, al término de la entrega del paquete tecnológico, copia certificada de las actas que se levanten con motivo de la formación.\nSerán funciones de los integrantes de los Comités Locales, las siguientes:\nI. Integrar, Actualizar y Depurar, según sea el caso, en coordinación con los H. Ayuntamientos, los padrones de beneficiarios.\nII. Recabar toda la documentación oficial y personal que permita la identificación de los beneficiarios del Programa (credencial de elector). Para la integración del Padrón de Productores deberá considerarse la Clave Única del Registro de Población (CURP).\nIII. Recepcionar los documentos que acrediten la posesión legal de los predios ó renta de los mismos, que comprueben que los productores poseen un predio en su localidad, por tal motivo recabarán una copia fotostática simple de cualquier documento, que a continuación se indican:\na) Certificado Parcelario expedido por el Registro Agrario Nacional.\nb) Escritura pública o privada.\nc) Acta Dura del Ejido ó de Bienes Comunales (según caso).\nd) Cesión de derechos temporal (duración del ciclo agrícola o el tiempo que acuerden ambas partes)\ne) Contrato de Arrendamiento ó usufructo parcelario, avalado por la autoridad Municipal.\nP.V. 2014\nIV. Gestionar por escrito ante los Ayuntamientos el apoyo del fertilizante.\nV. Recibir el fertilizante y distribuirlo en coordinación con el Ayuntamiento, entre los productores debidamente acreditados y empadronados.\nVI. Para ser beneficiario del Programa de Fertilizante y Transferencia de Tecnología, los productores deberán ser integrantes de los Comités Locales y deberán comprometerse a no quemar los residuos de cosecha en sus predios, sino a incorporarlos para contribuir a la recuperación del suelo y agua.\nVII. Los padrones de productores a beneficiar serán validados en Asamblea de Productores, con la presencia e intervención de los Ayuntamientos, la Secretaría y/o por las autoridades Ejidales o\nComunales según el caso.\nEn los Convenios de Colaboración Estado-Municipio, especificarán los paquetes tecnológicos integrales a utilizar con base en el pH del suelo predominante en el municipio y en el potencial productivo de las tierras de labor que le corresponda a los productores de las regiones que integran los municipios, de acuerdo a la clasificación de las provincias agronómicas hechas por el INIFAP.\nLa calidad y cantidad del fertilizante que se entregue, será estrictamente responsabilidad del\nAyuntamiento correspondiente, reservándose el Gobierno del Estado el derecho de supervisar el cumplimiento de las obligaciones contraídas por los proveedores en estos conceptos.\nLa dotación del insumo será estricta y directamente al productor, siempre y cuando haya realizado su aportación respectiva. Se apoyará a los productores, siendo responsabilidad de los\nAyuntamientos, el cumplimiento de esta disposición.\nLos Ayuntamientos serán los responsables de definir puntos estratégicos para la recepción y distribución de los insumos del paquete tecnológico, en coordinación con los Comités Locales. Los costos comunidades, se cubrirá con cargo al productor. incrementar la producción de granos básicos en el Estado. El programa está destinado para apoyar a productores de granos básicos y de bajos recursos económicos.\nSe apoyará a los productores hasta por dos hectáreas por cultivar, siendo responsabilidad de los\nAyuntamientos el cumplimiento de esta disposición.\nLa aportación de los productores será del 25% del costo del paquete tecnológico recomendado por el INIFAP, de acuerdo del pH del suelo predominante en el Municipio.\nP.V. 2014 correspondiente. Con base en ello, los Ayuntamientos aportarán la parte complementaria para dar atención a los productores beneficiados con el programa.\n6.4. Gasto de operación\nLa Secretaría podrá destinar como gastos de operación hasta el 3 por ciento del Presupuesto asignado para el Programa.\n7. TRANSPARENCIA\nLas autoridades y servidores públicos involucrados en la aplicación, operación, seguimiento y evaluación de la estrategia del Programa, tendrán la responsabilidad de desarrollar sus actividades, con estricto apego a las leyes competentes, a estas reglas de operación y a los Convenios de Colaboración\nEstado Municipio. Caso contrario, podrán ser acreedoras a las sanciones administrativas correspondientes a que alude la Ley número 674 de Responsabilidades de los Servidores Públicos del\nEstado de Guerrero.\n7.1. Difusión\nA través de asambleas, reuniones con productores y presidentes municipales, comisariados ejidales y comunales.\n7.2. Seguimiento de avances físicos y financieros\nLa SEDER enviará mensualmente la información correspondiente al avance físico –financiero al\nComité de Planeación para el Desarrollo del Estado de Guerrero (COPLADEG).\nEl Ayuntamiento deberá justificar con posterioridad y con documentos idóneos ante la\nContraloría y a la Auditoría, cuando éstas se lo requieran, los casos concretos de depuración y en su\nSustentable, sea entregada a la Secretaría. ingresos.\n7.3. Evaluación\nLa Secretaría de Desarrollo Rural, conjuntamente con la Secretaría de Finanzas y\nAdministración del Estado, iniciaron con la elaboración de la Matriz de Indicadores por Resultados con la cual se pretende darle un mejor control y seguimiento al Programa, a la fecha dicha matriz está aprobada\nP.V. 2014\nEvaluación y Seguimiento dependiente de la SEFINA. los Ayuntamientos, así como una instancia externa, donde se calificarán variables cuantitativas y cualitativas, tomando en consideración los siguientes aspectos:\nI. Beneficio y Servicio.\nII. Presupuesto de gastos y aportación de productores.\nIII. Aplicación adecuada o inadecuada de fertilizante.\nIV. Encuestas de opinión de los usuarios y productores.\nV. Impacto del programa.\nVI. Otros aspectos o parámetros que la Secretaría considere necesarios.\n7.4. Auditoría\nCon la finalidad de llevar un control real sobre los avances del Programa, así como de corregir posibles retrasos o desvíos en la operación, la Secretaría, la Contraloría y la Auditoria estarán facultadas para realizar visitas periódicas a los Ayuntamientos para revisar:\nI. Volúmenes recepcionadosy entregados a los Comités Locales.\nII. Actas de Comité Locales y Padrón de Beneficiarios.\nIII. La documentación comprobatoria será entregada a la Contraloría y la Auditoría, haciendo llegar a la Secretaría una copia certificada por el Ayuntamiento.\nIV. Especificaciones de fertilizante a entregar o entregado.\n7.5. Recursos no devengados\nLos recursos que por algún motivo no se ejerzan, serán remitidos a la Tesorería de la Secretaría\n7.6. Blindaje electoral\nLas autoridades involucradas en la aplicación y operación de la estrategia, asegurarán que en toda la publicidad en medios electrónicos, impresos, complementarias o de cualquier otra índole\nP.V. 2014 documentos oficiales la siguiente leyenda: \"Este Programa es de carácter público, no es patrocinado ni promovido por ningún partido político, y sus recursos provienen de los impuestos que pagan los contribuyentes. Está prohibido el uso de este programa con fines políticos, de lucro y de otros distintos a lo establecido, quien haga uso indebido de los recursos de este programa será denunciado y sancionado de acuerdo a la Ley y ante la Autoridad competente\".\n7.7. Contraloría social\nComprenden las acciones de control, vigilancia y evaluación que realizan las personas, ya sea de manera organizada o independiente bajo un esquema de derechos y compromisos ciudadanos con el propósito de contribuir a la gestión gubernamental. Estarán a cargo de los miembros de la comunidad, los integrantes del comité de beneficiarios de los programas sociales. La instancia operadora promoverá la contraloría social con base en la normatividad establecida para tal efecto, con el propósito de contribuir a que la gestión gubernamental se realice en términos de transparencia, eficacia y honradez.\nCada localidad participante en el Programa, constituirá su comité local, cuyos directivos serán un\nPresidente, un Secretario y un Tesorero, designados en la Asamblea de productores, pudiendo recaer dichos cargos en los mismos representantes de las autoridades ejidales y/o comunales.\nLos Ayuntamientos integrarán los comités locales con el objeto de dar seguimiento y atención a las actividades establecidas, haciendo llegar a la Secretaría, al término de la entrega del paquete tecnológico, copia certificada de las actas que se levanten con motivo de la formación.\nSerán funciones de los integrantes de los Comités Locales, las siguientes:\nI. Integrar, Actualizar y Depurar, según sea el caso, en coordinación con los H. Ayuntamientos, los padrones de beneficiarios.\nII. Recabar toda la documentación oficial y personal que permita la identificación de los beneficiarios del Programa (credencial de elector). Para la integración del Padrón de Productores deberá considerarse la Clave Única del Registro de Población (CURP).\nIII. Recepcionar los documentos que acrediten la posesión legal de los predios ó renta de los mismos, que comprueben que los productores poseen un predio en su localidad, por tal motivo recabarán una copia fotostática simple de cualquier documento, que a continuación se indican:\na) Certificado Parcelario expedido por el Registro Agrario Nacional.\nb) Escritura pública o privada.\nc) Acta Dura del Ejido ó de Bienes Comunales (según caso).\nd) Cesión de derechos temporal (duración del ciclo agrícola o el tiempo que acuerden ambas partes)\nP.V. 2014\ne) Contrato de Arrendamiento ó usufructo parcelario, avalado por la autoridad Municipal.\nIV. Gestionar por escrito ante los Ayuntamientos el apoyo del fertilizante.\nV. Recibir el fertilizante y distribuirlo en coordinación con el Ayuntamiento, entre los productores debidamente acreditados y empadronados.\nVI. Para ser beneficiario del Programa de Fertilizante y Transferencia de Tecnología, los productores deberán ser integrantes de los Comités Locales y deberán comprometerse a no quemar los residuos de cosecha en sus predios, sino a incorporarlos para contribuir a la recuperación del suelo y agua.\nVII. Los padrones de productores a beneficiar serán validados en Asamblea de Productores, con la presencia e intervención de los Ayuntamientos, la Secretaría y/o por las autoridades Ejidales o\nComunales según el caso.\n7.8. Quejas y denuncias\nLas quejas y denuncias de la ciudadanía en general por la presunción de actos de corrupción o desvío de recursos por parte de servidores públicos, se captarán por la Contraloría General del Estado y la Auditoría, a través de denuncias por escrito, vía internet, vía telefónica y por comparecencia del interesado. El sitio es www.contraloria.guerrero.gob.mx y al teléfono 01 800 000 7422.\n7.9. Actas de entrega recepción\nAl final del Ejercicio, la constancia de liberación, será expedida al Ayuntamiento por la\nSecretaría, una vez que se haya validado el expediente operativo.\nSerá obligación del Ayuntamiento, integrar el expediente operativo del Programa, que debe contener los siguientes documentos:\nI. Actas de los Comités Locales.\nII. Validación del Padrón de beneficiarios en Asamblea Comunitaria.\nIII. Acta de validación del padrón de productores en el Consejo Municipal de Desarrollo Rural\nSustentable.\nIV. Identificación del productor (copia de la credencial de elector y CURP).\nV. Proceso de Licitación del fertilizante.\nVI. Contrato de compraventa.\nP.V. 2014\nVII. Cartas porte del insumo recibido.\nVIII. Facturas de la compra de fertilizante.\nIX. Documentos de posesión de predios.\nX. Recibos de Entrega-Recepción del fertilizante de cada uno de los productores beneficiados, debidamente requisitado.\nXI. Padrón único de productores beneficiarios de acuerdo al formato requerido por la Secretaría, el cual se publicará en el portal de internet del Ayuntamiento, así como en impreso en cada una de las localidades beneficiadas.\nEste expediente quedará en poder del Ayuntamiento y enviará a la Secretaría copia certificada de cada uno de los documentos señalados en el punto 7.9 teniendo como fecha límite el 31 de agosto de cada ciclo agrícola primavera-verano.\n8. CRITERIOS DE SELECCIÓN Y ELEGIBILIDAD\nSe dará preferencia a productores de temporal de escasos recursos económicos, que se dediquen a la producción de granos básicos y que cumplan con los requisitos establecidos en las presentes reglas de operación.\n8.1. Método de selección de beneficiarios\nLos Ayuntamientos y Comités Locales realizarán la depuración y validación del padrón, en\nAsamblea General por localidad, y en la Asamblea del Consejo Municipal de Desarrollo Rural Sustentable se validará el padrón de productores.\nLa inclusión de nuevos productores será responsabilidad de los Ayuntamientos.\nEl procedimiento de actualización se llevará a cabo anualmente, de la siguiente manera:\n1. Los comités locales en coordinación con el Ayuntamiento, serán los responsables de actualizar y validar el padrón de productores.\n2. Para ser beneficiario de los subsidios del Programa, los productores deberán formar parte del padrón, y deberán comprometerse a no quemar los residuos de cosecha en sus predios, sino a incorporarlos para contribuir a la recuperación del suelo y agua.\n3. Los padrones de los productores a beneficiar serán validados en el Consejo Municipal de\nDesarrollo Rural Sustentable.\nP.V. 2014\nAyuntamientos.\n5. Será la Asamblea General por localidad, la que aprobará en primera instancia el Padrón de\nProductores, considerando como criterio general que sea productor y que tenga el derecho sobre el usufructo de la tierra, ya sea por propiedad, posesión o arrendamiento, eliminando cualquier duplicidad o fragmentación de la superficie en propiedad o posesión.\n6. El padrón aprobado en la Asamblea General, será llevado por el Ayuntamiento a la Sesión del\nConsejo Municipal para el Desarrollo Rural Sustentable, para su aprobación ante la Secretaría.\nPosterior al procedimiento de actualización del Padrón de Productores Beneficiados del\nPrograma, a que se refiere el punto anterior, el Ayuntamiento en coordinación con los Comités, será el único facultado para llevar a cabo la inclusión de nuevos beneficiarios al padrón, una vez que se valore su capacidad económica de acuerdo a los criterios establecidos para otorgarle el subsidio, o bien cuando haya que modificarlo en razón de los siguientes casos:\nI. Que alguno de los beneficiados haya fallecido.\nII. Que no tenga en usufructo tierras de labor, ni arrenden en su caso.\nIII. Que el productor se encuentre registrado en más de un padrón comunitario o municipal.\nIV. Que ya no resida en la circunscripción territorial del Ayuntamiento distribuidor.\nV. Aquellos productores que hayan resultado beneficiados con insumos, por medio de otro programa, dependencia o asociación.\nVI. Los que tengan tierra de labor común con otros productores, sean de su familia o no.\nVII. Que se digan representantes de los productores empadronados.\n9. MECÁNICA DE OPERACIÓN incrementar la producción de granos básicos en el Estado. económicos. Se apoyará a los productores hasta por dos hectáreas por cultivar, siendo responsabilidad de los Ayuntamientos el cumplimiento de esta disposición. La aportación de los productores será del 25% del costo del paquete tecnológico recomendado por el INIFAP, de acuerdo del pH del suelo predominante en el Municipio.\nP.V. 2014 correspondiente.\nCon base en ello, los Ayuntamientos aportarán la parte complementaria para dar atención a los productores beneficiados con el programa.\n9.1. Instancia ejecutora\nEl Gobierno del Estado a través de la Secretaría, transferirá a los Ayuntamientos los recursos financieros o lo equivalente en insumo asignados en los convenios de colaboración estado-municipio, a través de los cuales operarán el Programa. Los Ayuntamientos distribuirán los paquetes tecnológicos con un criterio de equidad, determinado por la superficie del Censo Agropecuario realizado por el Instituto\nNacional de Estadística y Geografía (INEGI) y considerando la que resulte una vez que se haya revisado y en su caso, depurado el padrón correspondiente por los Ayuntamientos, para la producción de granos básicos, obligándose a soportar dicho recurso con los padrones de beneficiarios, de conformidad con lo señalado en el presente instrumento.\nPara eficientar la aplicación del Programa, el Gobierno del Estado y los Municipios, podrá convenir que los recursos del programa puedan ser canalizados a través de instituciones públicas o privadas de financiamiento, que permitan un mayor beneficio respecto a la población objetivo.\nPara la adquisición del Fertilizante, los Ayuntamientos tomarán en cuenta las recomendaciones técnicas de calidad y cantidad que se señalan en las presentes reglas y que deberán incorporarse en las bases de la licitación, en observancia a lo establecido en la Ley de Administración de Recursos\nMateriales del Estado y las recomendaciones que dicte la Contraloría. Es decir, los Ayuntamientos tendrán que licitar obligatoriamente, preferentemente con la participación de Síndicos y Regidores; así como representantes de las organizaciones de pequeños productores, que testifiquen las referidas licitaciones. El proceso de licitación puede realizarse regionalmente, para generar compras consolidadas y obtener mejores precios de los productos.\nEn caso de compras consolidadas que implique una licitación ésta podrá ser pública abierta, adjudicación directa, o fundada en antecedentes y méritos, de acuerdo a los montos señalados en el marco legal vigente.\n9.2. Instancia administrativa y / normativa\nLa Auditoría y la Contraloría, dentro de su competencia, vigilarán:\na) que la ejecución de la estrategia operada por la Secretaría, vaya encaminada exclusivamente a elevar la producción de granos básicos y\nb) la aplicación estricta de la Ley, en los casos de desvío por parte de servidores públicos estatales o municipales. Para tal efecto, la Secretaría se coordinará con las Dependencias y Entidades de\nP.V. 2014 la Administración Pública Federal, Estatal y Municipal, con el objeto de fijar políticas y estrategias por cada ciclo agrícola.\n9.3. Delimitación de atribuciones deberán suscribirse los Convenios de Colaboración Estado Municipio durante los meses de febrero y marzo de cada año, siendo éstos los documentos base para el inicio en la aplicación y ejecución del\nPrograma. En dichos Convenios el Gobierno del Estado, participará por conducto de la Secretaría de\nFinanzas y Administración, la Contraloría y la Secretaría.\nEl Ayuntamiento deberá justificar con posterioridad y con documentos idóneos ante la\nContraloría y a la Auditoría, cuando éstas se lo requieran, los casos concretos de depuración y en su caso los nuevos productores para que una vez validada por el Consejo Municipal de Desarrollo Rural\nSustentable, sea entregada a la Secretaría.\nEl Gobierno del Estado a través de la Secretaría, liberará los recursos financieros o realizará la entrega de lo equivalente en insumo, de manera simultánea a los Ayuntamientos de acuerdo a la disponibilidad presupuestal.\n10. DERECHOS, OBLIGACIONES Y SANCIONES DE LOS BENEFICIARIOS DE\nPROGRAMAS SOCIALES.\n10.1. Derechos\nEl programa está destinado para apoyar a productores de granos básicos y de bajos recursos económicos. Se apoyará a los productores hasta por dos hectáreas por cultivar, siendo responsabilidad de los Ayuntamientos el cumplimiento de esta disposición.\n10.2. Obligaciones\nLos Comités Locales, deberán entregar el recurso de su aportación a la Tesorería Municipal de cada Ayuntamiento, misma que deberá extender el recibo oficial correspondiente, teniendo ambos como fecha límite para concluir con este proceso el día 30 de abril de cada año. Asimismo cumplir con lo estipulado en el numeral 7.7 párrafo tercero. los Ayuntamientos, deberá entregarse por el Comité Local, la solicitud de apoyo, padrón de productores por localidad, copia de identificación y demás documentos que acrediten la posesión legal de sus predios de acuerdo al presente reglamento.\nLa aportación de los productores será del 25% del costo del paquete tecnológico recomendado por el INIFAP, de acuerdo del pH del suelo predominante en el Municipio.\nP.V. 2014\n10.3. Sanciones.\nEl productor podrá ser excluido del padrón de beneficiarios en caso de:\n• No asistir a las capacitaciones que se imparten por los Prestadores de Servicios Profesionales.\n• No aplican el paquete tecnológico\n• Si queman los residuos de cosecha, • Que hayan resultado beneficiados con insumos, por medio de otro programa, dependencia o asociación.\n• Usar el beneficio con fines de lucro.\n• Aplicación del insumo en cultivos diferentes a los establecidos en las presentes reglas.\nSi el H. Ayuntamiento no cumple con la aplicación de las presentes reglas, no podrá ser sujeto a los beneficios de este programa.\n11. INTERPRETACIÓN.\nLas autoridades competentes para interpretar y aplicar el presente instrumento, serán el\nGobierno del Estado, a través de la Secretaría de Desarrollo Rural y la Contraloría General del Estado de acuerdo a las presentes reglas de operación.\nAsí, para los efectos del presente ordenamiento, se entenderá por:\nI. Aportaciones.- Contribución o participación económica de las partes involucradas en los\nConvenios de Colaboración.\nII. Ayuntamientos.- Todos los Gobiernos Municipales del Estado.\nIII. Comités Locales.- Grupo de productores empadronados y validados en una asamblea en las localidades, los cuales designan un Presidente, un Secretario y un Tesorero para llevar a cabo las actividades propias del Programa de Fertilizante y Transferencia de Tecnología.\nIV. Recursos.- Capital financiero que servirá para la compra del insumo y acciones de asistencia técnica, autorizado en el presupuesto de egresos correspondiente a cada ejercicio fiscal.\nV. Convenios de Colaboración Estado-Municipio.- Los Convenios oficiales, celebrados entre\nRural, Contraloría General del Estado y los Gobiernos Municipales, donde se signan los acuerdos y\nP.V. 2014\nVI. Distribución de Paquetes.- Entrega del insumo realizada de manera coordinada por las\nAutoridades Municipales y los Comités Locales de cada comunidad.\nVII. Fertilizante.- Producto químico, mineral ú orgánico que contiene uno o más nutrientes concentrados, fácilmente solubles.\nVIII. Biofertilizantes.- Son productos inoculantes que contienen microorganismos benéficos; bacterias y hongos, que se asocian a las raíces de las plantas y favorecen su nutrición, con las características especificas de no contaminar, ni causar daño al suelo, ni al hombre, y hacen posible el incremento en la producción.\nIX. Gobierno del Estado.- Gobierno del Estado de Guerrero.\nX. Granos Básicos.- Aquellos granos que tienen un papel fundamental en la alimentación humana. Para los efectos del presente reglamento se consideran únicamente el maíz y frijol.\nXI. INIFAP.- Instituto Nacional de Investigaciones Forestales Agrícolas y Pecuarias.\nXII. Auditoría.- Auditoría General del Estado.\nXIII. Contraloría.- Contraloría General del Estado.\nXIV. La Secretaría.- Secretaría de Desarrollo Rural del Estado.\nXV. Programa.- Programa de Fertilizante y Transferencia de Tecnología.\nXVI. Productores.- Todos los productores dedicados al cultivo de los siguientes granos básicos: maíz y frijol.\nXVII. Padrón de Productores.- Listado de productores de la cadena maíz, por localidad y\nMunicipio del Estado de Guerrero\nXVIII. Provincias Agronómicas.- Conjunto de tierras con características ecológicas relativamente homogéneas, para la producción de maíz y otros granos.\nXIX. Paquete Tecnológico.- Dotación de fertilizantes y recomendaciones técnicas que serán determinadas en materia de insumos y prácticas productivas, para el logro de una mejor producción de granos básicos.\nP.V. 2014\nXX. pH del suelo.- Es la medida de la concentración de iones de hidrógeno (H+). Según este valor, un suelo puede ser ácido, neutro o alcalino, y tiene influencia en las propiedades físico-químicas y biológicas del suelo; a su vez, condiciona el uso agronómico del suelo.\nXXI. Suelos neutros.- Suelos con un pH de 7 (escala de 0 a 14).\nXXII. Suelos ácidos.- Suelos con un rango de pH, según la escala, de 7 hacia abajo.\nXXIII. Suelos alcalinos.- Suelos con un rango de pH, según la escala, de 7 hacia arriba.\nXXIV. Estrategia.- Conjunto de acciones realizadas por el Gobierno del Estado encaminadas a mejorar la producción de granos básicos.\nTRANSITORIOS\nPRIMERO.- Las presentes reglas de operación, entrarán en vigor al día siguiente de su publicación en el Periódico Oficial del Gobierno del Estado de Guerrero.\nSEGUNDO.- Quedan abrogadas las Reglas de Operación del Programa de Fertilizante y\nTransferencia de Tecnología, publicadas en el Periódico Oficial del Estado de Guerrero, número 15, Alcance I, de fecha 9 de febrero de 2013.\nDado en la ciudad de Chilpancingo, Guerrero, a los 27 días del mes de enero del año dos mil catorce.\nEL SECRETARIO DE DESARROLLO RURAL.\nMVZ. HUMBERTO RAFAEL ZAPATA AÑORVE.\nRúbrica.\nDIRECTOR GENERAL DE FOMENTO TECNOLÓGICO.\nING. JOSÉ ANTONIO CATALÁN LEYVA.\nRúbrica.\nEL JEFE DE LA UNIDAD DE ASUNTOS JURÍDICOS.\nLIC. FIDEL GARCÍA RODRÍGUEZ.\nRúbrica.",
  "ordenamiento": "REGLA",
  "jurisdiccion": "GUERRERO",
  "fuente_oficial": "DIARIO OFICIAL DE LA FEDERACION",
  "Fecha de Publicación": "11 de Abril de 2014",
  "ULTIMA REFORMA PUBLICADA": null,
  "status": "VIGENTE",
  "es_escaneado": false,
  "tiene_tablas": true,
  "materia": [
    "general"
  ]
}