{
  "titulo": "Acuerdo por el Que Se Emiten las Reglas de Operación del Programa Combate A la Pobreza Acciones Prio",
  "Contenido": "EJERCICIO FISCAL 2014\n1. Introducción.............................................................................................................................. 8\n2. Objetivo..................................................................................................................................... 8\n2.1. Objetivo general..................................................................................................................... 8\n2.2. Objetivos Específicos............................................................................................................. 8\n2.3. Población Objetivo................................................................................................................. 9\n3. Misión....................................................................................................................................... 10\n4. Visión........................................................................................................................................ 10\n5. Reglas de Operatividad............................................................................................................. 10\n5.1. Lineamientos Generales........................................................................................................ 10\n5.1.1. Beneficiarios....................................................................................................................... 10\n5.1.2. Requisitos Generales.......................................................................................................... 10\n5.1.3. Giras de trabajo..................................................................................................... 10\n5.2. Perspectiva de Género.......................................................................................................... 11\n5.3. Apoyo económico a los beneficiarios..................................................................................... 11\n5.4. Participantes.......................................................................................................................... 11\n5.5 Patrimonio del Programa........................................................................................................ 11\n5.6. Tipos de Apoyo...................................................................................................................... 12\n6. Información del programa......................................................................................................... 12\n6.1. Exposición del programa........................................................................................................ 13\n6.2. Cobertura............................................................................................................................... 13\n6.3. Modos de entrega del beneficio............................................................................................. 14\n7. Gastos de Operación................................................................................................................ 14\nEJERCICIO FISCAL 2014\n8. Transparencia........................................................................................................................... 14\n8.1 Difusión................................................................................................................................... 14\n8.2 Seguimiento de avances físicos y financieros......................................................................... 14\n8.3 Evaluación.............................................................................................................................. 15\n8.3.1. Evaluación Interna.............................................................................................................. 15\n8.3.1. Evaluación Externa............................................................................................................. 15\n8.4 Auditoria.................................................................................................................................. 15\n8.5 Recursos no devengados....................................................................................................... 16\n8.6 Blindaje electoral..................................................................................................................... 16\n8.7 Contraloría social.................................................................................................................... 16\n8.7.1 Integración de los Comités Comunitarios............................................................................. 17\n8.7.2 Capacitación y Asesoría...................................................................................................... 17\n8.7.3 Seguimiento......................................................................................................................... 17\n8.8 Quejas y denuncias................................................................................................................. 18\n9. Criterios de Selección y elegibilidad.......................................................................................... 18\n9.1 Requisitos específicos............................................................................................................ 18\n9.1.1 Ayudas Apremiantes............................................................................................................ 18\n9.1.2 Acciones Sociales, Culturales, Educativas, Deportivas y Recreativas.............................................................................................................. 20\n9.1.3 Estudios de Capacitación y Evaluación de\nProgramas Sociales...................................................................................................................... 21\n9.1.4 Desarrollo Humano y Productivo.......................................................................................... 21\na) Jornadas Cívicas y Culturales................................................................................................... 22\nEJERCICIO FISCAL 2014\nb) Acciones de Bienestar Comunitario.......................................................................................... 22\nc) Fortalecimiento del Ingreso Familiar......................................................................................... 22\n9.1.5 Apoyos para Obra Pública y\nEquipamiento de Bajo Costo......................................................................................................... 23\n10. Mecánica operativa................................................................................................................. 24\n10.1 Instancia Ejecutora................................................................................................................ 24\n10.2 Instancia Administrativa........................................................................................................ 24\n10.3 Delimitación de atribuciones................................................................................................. 24\n11. Derechos, obligaciones y sanciones de los beneficiarios de programas sociales................................................................................... 25\n11.1 Derechos.............................................................................................................................. 25\n11.2 Obligaciones......................................................................................................................... 25\n11.3 Sanciones............................................................................................................................. 25\n12. Cierre de Ejercicio................................................................................................................... 26\n13. Casos Especiales................................................................................................................... 26\n14. Anexo..................................................................................................................................... 26\nAnexo 1. Glosario de Términos..................................................................................................... 26\nEJERCICIO FISCAL 2014\nTEXTO ORIGINAL\nLA POBREZA ACCIONES PRIORITARIAS PARA EL EJERCICIO FISCAL 2014.\nMtra. Beatriz Mojica Morga, Secretaria de Desarrollo Social, con fundamento en el artículo 117\nLey Orgánica de la Administración Pública del Estado de Guerrero Número 433; 1o., 2o., 3o., y 6o de la\nLey Número 102 para el Desarrollo Social del Estado de Guerrero; 1o., 2o fracción I, 18, 25, de la Ley\nNúmero 454 de Presupuesto y Disciplina Fiscal del Estado de Guerrero; así como las estrategias y objetivos establecidos en el Plan Estatal de Desarrollo de Guerrero 2011-2015; y\nCONSIDERANDO\nQue las Reglas de Operación establecen disposiciones a las que deben sujetarse los programas\nEstatales, con el objeto de otorgar transparencia y asegurar la aplicación eficiente, eficaz, oportuna y equitativa de los recursos públicos asignados al mismo;\nQue en el marco de la Ley Número 454 de Presupuesto y Disciplina Fiscal del Estado de\nGuerrero y el Acuerdo emitido por el titular del Ejecutivo del Estado, el primero de abril del año 2011, se establecen los Lineamientos Generales de legalidad, honestidad, eficiencia, eficacia, economía, racionalidad, austeridad, transparencia, control, rendición de cuentas, equidad de género e impacto social en grupos vulnerables y en la sociedad en general del gasto de la Administración Pública Estatal, para fortalecer el desarrollo.\nQue bajo dicho contexto la Secretaría de Desarrollo Social del Estado de Guerrero, a través de la Dirección General de Acciones Prioritarias será responsable de emitir las Reglas de Operación respecto a su programa, para que inicie la operación en el ejercicio fiscal siguiente o en su caso, las modificaciones a aquéllas que continúen vigentes.\nEn cumplimiento de lo anterior se ha tenido a bien expedir el siguiente:\nLA POBREZA ACCIONES PRIORITARIAS PARA EL EJERCICIO FISCAL 2014.\nÚNICO. - Se emiten las Reglas de Operación del Programa Combate a la Pobreza Acciones\nPrioritarias para el Ejercicio Fiscal 2014.\nTRANSITORIOS\nPRIMERO. - El presente Acuerdo entrará en vigor el dos de enero del año dos mil catorce.\nEJERCICIO FISCAL 2014\nSEGUNDO.- Queda abrogado el Acuerdo por el que se emiten las Reglas de Operación del\nPrograma Combate a la Pobreza Acciones Prioritarias para el Ejercicio Fiscal 2013, mismas que fueron\nDado en la Ciudad de Chilpancingo de los Bravo, Guerrero, a los 15 días del mes de Enero de\n2014.\nSECRETARIA DE DESARROLLO SOCIAL.\nMTRA. BEATRIZ MOJICA MORGA.\nRúbrica\nDIRECTOR GENERAL DE ACCIONES PRIORITARIAS.\nC. JESÚS AURELIO ACROY MENDOZA. DE LA LAMA.\nRúbrica\nDIRECTOR DE LA UNIDAD DE ASUNTOS JURÍDICOS.\nLIC. FIDELMAR FLORES MÉNDEZ.\nRúbrica\nContenido\n1. Introducción\n2. Objetivo\n2.1. Objetivo general\n2.2. Objetivos Específicos\n2.3. Población Objetivo\n3. Misión\n4. Visión\n5. Reglas de Operatividad\n5.1. Lineamientos Generales\n5.1.1. Beneficiarios\n5.1.2. Requisitos Generales\nEJERCICIO FISCAL 2014\n5.1.3. Giras de Trabajo\n5.2. Perspectiva de Género\n5.3. Fundamento Legal\n5.4. Participantes\n5.5. Patrimonio del programa\n5.6. Tipos de apoyo\n6. Información del programa\n6.1. Exposición del programa\n6.2. Cobertura\n6.3. Modos de entrega del beneficio\n7. Gastos de operación\n8. Transparencia\n8.1. Difusión\n8.2. Seguimiento de avances físicos y financieros\n8.3. Evaluación\n8.3.1. Evaluación Interna\n8.3.2. Evaluación Externa\n8.3.3. Indicadores\n8.4. Auditoria\n8.5. Recursos no devengados\n8.6. Blindaje electoral\n8.7. Contraloría social\nEJERCICIO FISCAL 2014\n8.7.1. Integración\n8.7.2. Capacitación y Asesoría\n8.7.3. Seguimiento\n8.8. Quejas y denuncias\n9. Criterios de selección y elegibilidad\n9.1 Requisitos específicos\n9.1.1 Ayudas Apremiantes\n9.1.2 Acciones Sociales, Culturales, Educativas, Deportivas y Recreativas\n9.1.3. Estudios de Capacitación y Evaluación de Programas Sociales\n9.1.4. Desarrollo Humano y Productivo\na) Jornadas Cívicas y Culturales\nb) Acciones de Bienestar Comunitario\nc) Fortalecimiento del Ingreso Familiar\n9.1.5 Apoyos para Obra Pública y Equipamiento de Bajo Costo\n10. Mecánica operativa 10.1 Instancia ejecutora\n10.2 Instancia Administrativa\n10.3 Delimitación de atribuciones\n11. Derechos, obligaciones y sanciones de los beneficiarios de programas sociales\n11.1 Derechos\n11.2 Obligaciones\n11.3 Sanciones\n12. Cierre de Ejercicio\nEJERCICIO FISCAL 2014\n13. Casos Especiales\n14. Anexos\nAnexo 1. Glosario de Términos\n1. Introducción\nCombate a la Pobreza Acciones Prioritarias es un Programa de la Secretaría de Desarrollo\nSocial, que se alinea con los objetivos y estrategias del Plan Estatal de Desarrollo, Plan Nacional de\nDesarrollo, Objetivos de Desarrollo del Milenio de la Naciones Unidas, para contribuir a mejorar las condiciones de vida de la población que vive en situación de pobreza, pobreza extrema, con menor índice de desarrollo humano y a toda población en situación de riesgo social, asimismo a la población vulnerable, además de fortalecer las capacidades y habilidades humanas. El programa de combate a la pobreza de acciones prioritarias cuenta con una serie de sub programas que a continuación se enumeran; 1.Ayudas Apremiantes, 2.Acciones Sociales, Culturales, Educativas, Deportivos y\nRecreativos; 3.Desarrollo Humano y Productivo; 4. Obra Pública de Bajo Costo.\n2. Objetivo\n2.1. Objetivo general\nEstablecer acciones de impacto en beneficio principalmente de los sectores más vulnerables, permitiendo obtener los elementos básicos de infraestructura social, apoyos asistencia-les urgentes, desarrollo de actividades productivas que contribuyan a mejorar las condiciones sociales, además de fortalecer el desarrollo humano. Impulsar la organización y participación social como estrategia de desarrollo para las localidades, así como contribuir a disminuir el rezago social en la población de Zonas de Alta y Muy Alta Marginación, en condiciones de pobreza, pobreza extrema, grupos vulnerables y en situaciones de riesgo social, en el Estado de Guerrero.\n2.2. Objetivos Específicos\n2.2.1. Atender la demanda ciudadana de las personas, de los grupos prioritarios arriba mencionados establecidos en las presentes reglas con el fin de contribuir al bienestar social.\n2.2.2. Fomentar las actividades deportivas, educativas y culturales que permitan el rescate y fortalecimiento de las costumbres y tradiciones de las siete regiones del Estado.\n2.2.3. Proporcionar alternativas de solución inmediata en situaciones de necesidades básicas de vida de la población y en situaciones de riesgo social.\n2.2.4. Coadyuvar en la realización de Eventos Deportivos, Culturales, Conmemorativos y\nEducativos, con el fin de promocionar, difundir y conservar las costumbres de las diferentes regiones del\nEJERCICIO FISCAL 2014\nEstado, así como impulsar el desarrollo comunitario como medio que permita el fortalecimiento del tejido social en localidades vulnerables y en situaciones de inseguridad.\n2.2.5. Contribuir al desarrollo de las actividades productivas y micro proyectos mediante la capacitación y/o proporcionando los insumos y herramientas para el establecimiento de pequeños talleres, que detonen la economía familiar y la generación de recursos económicos en las diferentes localidades del Estado.\n2.2.6. Motivar la Participación Ciudadana mediante la creación de Comités de Desarrollo\nComunitario y Contraloría Social, como mecanismo de fortalecimiento de los programas y acciones de gobierno encaminadas a mejorar los beneficios otorgados a sus localidades.\n2.2.7. Contribuir de manera directa en una relación de corresponsabilidad entre Gobierno y beneficiarios, impulsando la organización social, para la culminación o rehabilitación de obras de infraestructura social básica como: Electrificación, Drenaje, Pavimentación, Agua Entubada y\nMejoramiento de Vivienda a través de programas de subsidio de materiales industrializados de bajo costo para las familias de escasos recursos económicos y grupos organizados de la sociedad civil.\n2.2.8. Diseñar programas y acciones con perspectiva y equidad de género permitiendo avanzar y disminuir la brecha de desigualdad, que se refleja en condiciones de desventaja para las mujeres y personas con capacidades diferentes.\n2.2.9. Que los apoyos otorgados en sus diferentes vertientes del Programa puedan ser me-dibles y objetivos.\n2.2.10. Promover la coordinación interinstitucional para la mezcla de recursos bajo diferentes tipos de esquemas o convenios que permitan la ampliación de metas de la Secretaría de Desarrollo\nSocial, a través de la Dirección General de Acciones Prioritarias.\n2.3. Población Objetivo\nLa población en condiciones de pobreza y pobreza extrema, grupos vulnerables y en situación de riesgo social.\nSujetos sociales de atención:\nI. Serán los ciudadanos organizados o en forma individual, para la realización de acciones, obras, actividades sociales y culturales;\nII. Las personas en condiciones económicas desfavorables; Ciudadanos organizados que requieran de financiamiento para el desarrollo humano integral, para superación personal, para recibir capacitación, etc.\nIII. Los municipios o instituciones que soliciten apoyos relacionados los objetivos del programa privilegiando la coinversión; y\nEJERCICIO FISCAL 2014\nIV. Atender puntualmente a ciudadanos afectados por siniestros o desastres naturales con apoyos elementales emergentes y de primera necesidad.\n3. Misión elementales, que por su naturaleza no son resueltas en tiempo y forma, por la mayoría de los programas de asistencia social existentes.\n4. Visión\nSer un Programa que pase del asistencialismo social, a una alternativa de coparticipación conjunta con los guerrerenses propiciando la organización y participación comunitaria, así como la contraloría social. Por ello el programa encamina su estrategia hacia el fortalecimiento de capacidades, desarrollo de iniciativas económicas, fomento a la salud, educación, cultura con la participación de la sociedad en cada una de las acciones del programa, principalmente de infraestructura social básica.\n5. Reglas de Operatividad\n5.1. Lineamientos Generales\n5.1.1. Beneficiarios\nCiudadanos individuales u organizados en condiciones económicas no favorables.\n5.1.2. Requisitos Generales\na) Solicitud dirigida a la Titular de la Secretaría de Desarrollo Social, la cual deberá contener los siguientes datos: Nombre completo del o los Beneficiarios, Domicilio, Teléfono, correo electrónico y/o redes sociales en su caso, además de los establecidos en cada una de las vertientes del Programa;\nb) La solicitud será entregada en el módulo para recepción de documentos, o en su caso en Gira de Trabajo del o la Titular de la Secretaría. Se le hará saber al solicitante que se recibe la solicitud pero\nReglas de Operación.\nc) Copia legible de alguna Identificación Oficial como son: Credencial de Elector, Pasaporte, Cedula Profesional o Cartilla del Servicio Militar Nacional en original y copia para su cotejo;\nd) CURP.\n5.1.3. Giras de Trabajo\nEJERCICIO FISCAL 2014\nSe podrán otorgar todo tipo de apoyos que instruya el Titular del Ejecutivo y/o la Titular de la\nEstado, recabando como requisito mínimo una copia de alguna identificación oficial del beneficiario.\n5.2. Perspectiva de Género\nLa Secretaría como una institución comprometida con la equidad de género, promoverá que las acciones o programas propios de la Dirección General de Acciones Prioritarias, garanticen la igualdad entre hombres y mujeres, eliminando cualquier forma de discriminación por razón de género, atendiendo en todo momento las recomendaciones de las instituciones y dependencias encargadas de la vigilancia a este principio fundamental, así como los acuerdos que suscriba el titular del Poder Ejecutivo del Estado en este tenor.\n5.3. Fundamento Legal\n1) Constitución Política de los Estados Unidos Mexicanos;\n3) Ley Orgánica de la Administración Pública del Estado de Guerrero Número 433;\n4) Ley Número 102 para el Desarrollo Social del Estado de Guerrero;\n5) Ley Número 374 de Transparencia y Acceso a la Información Pública del Estado de Guerrero;\n6) Ley Número 674 de Responsabilidades de los Servidores Públicos del Estado de Guerrero;\n7) Ley Número 494 para la Igualdad entre Mujeres y Hombres del Estado de Guerrero;\n8) Código de Conducta de la Secretaría de Desarrollo Social;\n9) Reglamento de la Ley para el Desarrollo Social del Estado de Guerrero Número 102;\n10) Plan Estatal de Desarrollo del Estado de Guerrero 20112015;\n11) Decreto Número 438 de Presupuesto de Egresos del Estado de Guerrero para el Ejercicio\nFiscal 2014;\n12) Y todos aquellos ordenamientos normativos que sean aplicables.\n5.4. Participantes\nPara el cumplimiento, ampliación de los objetivos y metas de la Dirección se podrá realizar convenios, acuerdos de coinversión y/o colaboración con otras Secretarías, H. Ayuntamientos, Federal.\nPara el caso de Convenios de Coinversión o aquellos donde exista aportación, estará sujeto a lo establecido los lineamientos y características del programa a coinvertir, de igual forma la aportación de los recursos podrá ser variable.\n5.5. Patrimonio del programa\nEJERCICIO FISCAL 2014\nRespecto al origen de los recursos que integra y aplica el programa, estos provienen de la\nInversión Estatal Directa (IED), y están contenidos en el Decreto de Presupuesto de Egresos del correcta aplicación.\nEn caso de contar con recursos de coinversión federal, quedarán sujetos a lo establecido en los acuerdos y convenios concertados, a los ordenamientos federales y a los lineamientos específicos del origen del recurso.\n5.6. Tipos de apoyo\nLos tipos de apoyos que se pueden entregar se enumeran en el siguiente cuadro:\n{\"tabla_1\":{\"columnas\":[\"SUBPROGRAMAS\",\"MONTO Tipo\",\"(sin encabezado)\",\"(sin encabezado)\"],\"filas\":[{\"columna_1\":\"Ayudas Apremiantes:\",\"columna_2\":\"(sin dato)\",\"columna_3\":\"(sin dato)\",\"columna_4\":\"(sin dato)\"},{\"columna_1\":\"Apoyos para Gastos Funerarios, Médicos, Traslados,\",\"columna_2\":\"(sin dato)\",\"columna_3\":\"Hasta $20,000.00\",\"columna_4\":\"Efectivo o\"},{\"columna_1\":\"siniestros, entre otros.\",\"columna_2\":\"(sin dato)\",\"columna_3\":\"(sin dato)\",\"columna_4\":\"Especie\"},{\"columna_1\":\"Apoyo para Acciones Sociales, Culturales\",\"columna_2\":\"(sin dato)\",\"columna_3\":\"Hasta $20,000.00\",\"columna_4\":\"Efectivo o\"},{\"columna_1\":\"Deportivos, Educativos y Recreativos.\",\"columna_2\":\"(sin dato)\",\"columna_3\":\"(sin dato)\",\"columna_4\":\"Especie\"},{\"columna_1\":\"Desarrollo Humano y Productivo:\",\"columna_2\":\"(sin dato)\",\"columna_3\":\"(sin dato)\",\"columna_4\":\"(sin dato)\"},{\"columna_1\":\"Cursos o talleres de capacitación, maquinaria y/o\",\"columna_2\":\"(sin dato)\",\"columna_3\":\"Hasta $20,000.00\",\"columna_4\":\"Efectivo o\"},{\"columna_1\":\"equipo, fortalecimiento al ingreso familiar, entre otros.\",\"columna_2\":\"(sin dato)\",\"columna_3\":\"(sin dato)\",\"columna_4\":\"Especie\"},{\"columna_1\":\"Apoyo para Obra Pública y Equipamiento de Bajo\",\"columna_2\":\"(sin dato)\",\"columna_3\":\"Hasta $130,000.00\",\"columna_4\":\"Efectivo o\"},{\"columna_1\":\"Costo\",\"columna_2\":\"(sin dato)\",\"columna_3\":\"(sin dato)\",\"columna_4\":\"Especie\"},{\"columna_1\":\"Estudios, Capacitación y Evaluación de Programas\",\"columna_2\":\"(sin dato)\",\"columna_3\":\"$10,000.00\",\"columna_4\":\"Efectivo\"},{\"columna_1\":\"Sociales\",\"columna_2\":\"(sin dato)\",\"columna_3\":\"(sin dato)\",\"columna_4\":\"(sin dato)\"}]}}\nLos montos establecidos en la tabla que antecede, podrán ser superiores por casos extraordinarios, siempre y cuando, estos sean autorizados por la Titular de la Secretaría y/o el Director\nGeneral de Acciones Prioritarias.\nPara el caso de Comités, se podrán otorgar los apoyos por cada miembro del mismo, así como de manera general o individual.\nTodos los apoyos estarán sujetos a la disponibilidad presupuestaria del programa.\n6. Información del programa\nEl Estado de Guerrero ocupa uno de los últimos lugares entre los Estados de la República, respecto al nivel de vida e ingreso familiar disponible; así como por la escases de la infraestructura\nEJERCICIO FISCAL 2014 pública que redunda en la calidad de vida, trayendo consigo el rezago social en que viven las más de 6 mil localidades rurales, sumado a ello la pobreza urbana.\nDe ahí, que 60 de los 81 municipios, estén considerados a nivel nacional en los índices de marginación y alta marginación, por lo que requiere de una atención prioritaria de parte del Estado.\nEn respuesta, el Gobierno del Estado ha instrumentado una serie de Programas Sociales que bajo el esquema de transferencias directas, asistencia social, participación comunitaria y de infraestructura social básica van dando origen a la creación del Programa Acciones Prioritarias bajo un nuevo contexto de dar atención a la población mediante un mecanismo de acciones inmediatas y transparentes.\nEn el Plan Estatal de Desarrollo 2011-2015 se sustenta este Programa, toda vez que el documento rector, contempla entre una de las acciones prioritarias, la atención de la demanda social. A partir de la concurrencia de recursos de los tres órdenes de gobierno, se espera lograr el aumento de manera significativa en las metas, obras y/o acciones emprendidas, evitando con ello la pulverización de recursos y permitiendo que la aplicación de este programa, se sustente en un proceso de participación social, con enfoque de participación ciudadana en obras y acciones, que ayuden a la población vulnerable para que tenga acceso a los satisfactores mínimos de bienestar social.\n6.1. Exposición del programa\nDerivado del gran rezago social que padece la Entidad, los requerimientos de atención social individual o colectivo son de diversos tipos, que requieren una oportunidad de resolverse mediante la gestión individual o grupal, de los pueblos, barrios y colonias, con acciones del Gobierno del Estado a través de este programa. Siendo necesaria la intervención gubernamental para perfilar su desarrollo, es decir, participar en la construcción, mejoramiento y ampliación de obras menores de infraestructura social básica, para la salud, educación, producción, mejoramiento de su hábitat o proteger su patrimonio personal y familiar. Además de invertir prioritariamente en el desarrollo humano y productivo.\nConsecuentemente la demanda de obras sociales a través de la gestión, que por circunstancias diversas no han sido atendidas, requieren atención y respuesta inmediata, ya que muchas veces debido a la insuficiencia presupuestal, a las normas y reglas de operación de las fuentes de financiamiento, o por una definición del gasto público ajeno a la voluntad popular, resulta imposible de obtener respuesta favorable. Es por ello que el Programa está encaminado a atender estas sentidas demandas de la población que a pesar de ser menores, su solución garantiza impactar positivamente en los indicadores de rezago que afectan al Estado.\n6.2. Cobertura\nEstado de Guerrero, priorizan-do a la población con mayor desventaja social y que viven en situaciones\nEJERCICIO FISCAL 2014 de pobreza y pobreza extrema, menor índice de desarrollo humano, rezago social, casos de emergencia, fortuitos, desastres y de fuerza mayor.\n6.3. Modos de entrega del beneficio instancia ejecutora, la cual tendrá a su cargo la entrega de los apoyos a los beneficiarios o beneficiarias, en los plazos y lugares acordados con ellos mismos.\n7. Gastos de operación\nDel total de recursos autorizados al programa, podrán aplicarse hasta un 3% del presupuesto asignado para gastos de operación, destinados a las diversas acciones asociadas con la planeación, operación, supervisión, seguimiento, contraloría social y evaluación o asesoría externa del Programa.\n8. Transparencia\n8.1. Difusión\nEstas Reglas de Operación, además de su publicación en el Periódico Oficial del Gobierno del\nEstado de Guerrero, estarán disponibles en la página de Internet de la Secretaría de Desarrollo Social www.sedesol. guerrero.gob.mx, asimismo se establecerán las estrategias de difusión del Programa y realizarán las acciones conducentes para dar a conocer los requisitos de participación, la corresponsabilidad de los beneficiarios y los apoyos a otorgar.\nLa Secretaría de Desarrollo Social, será la instancia encargada de realizar la promoción y difusión del Programa, con base en lo establecido en la Ley Número 374 de Transparencia y Acceso a la\nInformación Pública del Estado de Guerrero, y publicará periódicamente en la página electrónica http://www.sedesol.guerrero. gob.mx, la información relativa al Programa, incluyendo el avance en el cumplimiento de objetivos y metas respectivos de las presentes Reglas de operación. Para el caso de la publicación del padrón de beneficiarios en la página de internet, los datos personales que se recaben serán protegidos e incorporados y tratados en el Sistema de datos personales. Se podrán utilizar para dar seguimiento puntual del número de beneficiados y recursos otorgados, además de ser tratado como datos estadísticos, cuya finalidad es contar con información que permitan rediseñar las Políticas Públicas de la Secretaría, así como para contar con un padrón de beneficiarios homogéneos para cumplir con la promoción de la equidad de género.\n8.2. Seguimiento de avances físicos y financieros\nCon el propósito de mejorar la operación del programa, la Secretaría de Desarrollo Social, llevará a cabo el seguimiento al ejercicio de recursos fiscales, acciones ejecutadas, resultados, indicadores y metas alcanzadas. Asimismo, realizará el seguimiento en campo de las obras, proyectos y acciones conforme a lo que cada una requiera.\nEJERCICIO FISCAL 2014\nEs responsabilidad de la Dirección General de Acciones Prioritarias, remitir al Departamento de\nPresupuesto y Cuenta Pública de la Dirección General de Administración y Finanzas de la Secretaría, los avances físicos financieros de las obras, con la información requerida por el COPLADEG.\nEn el caso de que el COPLADEG detecte información faltante, se presentará esta y la documentación faltante, en un plazo que no exceda de 10 días hábiles contados a partir de la recepción del comunicado.\n8.3. Evaluación\n8.3.1. Evaluación Interna\nEl Programa de Combate a la Pobreza de Acciones Prioritarias estará sujeto a procesos periódicos de seguimiento y evaluación que permitan supervisar su ejecución y garantizar que los mecanismos de funcionamiento y administración, que faciliten tanto la obtención de información como la evaluación de los beneficios económicos y sociales de su asignación y aplicación.\n8.3.2. Evaluación Externa\nLa Dependencia podrá realizar una evaluación de resultados de carácter externo del programa sujeto a reglas de operación, para lo cual, se tendrá la facultad de designar en su caso a la instancia que realice dicho análisis.\n8.3.3. Indicadores\nPara el seguimiento y evaluación del Programa se utilizarán los indicadores que se especifican en la (MIR)\nLa Dirección de Acciones Prioritarias será responsable de compilar e integrar un reporte estatal de resultados tomando como base los proyectos y/o acciones desarrollados por el Programa Acciones\nPrioritarias, al finalizar el ejercicio fiscal.\n8.4. Auditoria proyectos o acciones, así como de verificar que, en su ejecución se cumpla con la normatividad aplicable.\nLos recursos asignados para la operación del Programa no pierden su carácter estatal, por lo que, la Secretaría de Finanzas y Administración, la Contraloría General del Estado y la Auditoria General del Estado, en el ámbito de sus respectivas competencias, realizarán actividades de fiscalización y auditoría. el momento en que lo juzguen pertinente, las auditorias que consideren necesarias; asimismo, efectuará el seguimiento y solventará las observaciones planteadas por los órganos de control. La inobservancia de\nEJERCICIO FISCAL 2014 esta disposición, independientemente de las sanciones a que hubiere lugar, limitará la ministración de los recursos estatales en el siguiente ejercicio presupuestal.\nAdministrativa de la Secretaría, la elaboración de los cheques y/o pólizas de egresos de los apoyos autorizados, dicha dirección regresará los cheques debidamente elaborados a la Dirección de Acciones\nPrioritarias para su entrega directa a los beneficiarios, siendo su responsabilidad soportar la documentación correspondiente de cada póliza de cheque de los beneficios otorgados.\n8.5. Recursos no devengados\nLos recursos que al cierre del ejercicio se conserven o que no se hayan devengado al 31 de\nDiciembre del presente ejercicio, deberán ser reintegrados a la Secretaría de Finanzas y Administración del Estado. Dentro del mismo plazo, deberán remitir copia del reintegro para su registro correspondiente.\n8.6. Blindaje electoral\nLa Secretaría de Desarrollo Social para la operación y ejecución de los recursos estatales que opera el programa, deberá observar y atender las medidas que emitan la Contraloría General del Estado, el Instituto de Transparencia y Acceso a la Información Pública del Estado de Guerrero (ITAI), el Instituto\nEstatal Electoral del Estado de Guerrero (IEEGRO) y las demás autoridades competentes, con la finalidad de impedir que los apoyos sean utilizados con fines político electorales.\nEn cuanto a la publicidad en medios electrónicos, impresos o de cualquier otra índole vinculada con este Programa, deberá identificarse con el Escudo del Estado de Guerrero e incluir la siguiente leyenda:\n\"Este Programa es de carácter público, no es patrocinado ni promovido por partido político alguno y sus recursos provienen de los impuestos que pagan todos los contribuyentes. Está prohibido el uso de este programa con fines políticos, electorales, de lucro o de promoción personal y otros distintos a los establecidos. Quien haga uso indebido de los recursos de este programa deberá ser denunciado y sancionado de acuerdo con la Ley aplicable y ante la autoridad competente\".\n8.7. Contraloría social\nCon la finalidad de incrementar la participación ciudadana, se crearán Comités Comunitarios de\nContraloría Social, como un órgano ciudadano de control, vigilancia y evaluación de las actividades del\nPrograma, conformado por los beneficiarios, los sectores sociales, y/o los representantes de la localidad, quienes de manera específica supervisarán la gestión gubernamental, y que el manejo de los recursos públicos se realicen en términos corresponsabilidad, transparencia, eficacia, eficiencia, legalidad y honradez.\nLos objetivos específicos de este órgano de Contraloría Social son:\nEJERCICIO FISCAL 2014\na) Hacer más transparentes las decisiones y la ejecución de los recursos;\nb) Incrementar la participación ciudadana;\nc) Fomentar la organización social;\nd) Inhibir los actos de corrupción y de cooptación social, política y electoral;\ne) Incrementar la eficiencia de los recursos públicos;\nf) Fortalecer la cultura de la legalidad;\ng) Mejorar la rendición de cuentas;\nh) Perfeccionar la democracia, e incorporar la evaluación ciudadana;\n8.7.1. Integración\nLos Comités Comunitarios de Contraloría Social se conforman con la representación de la comunidad beneficiada por el Programa y fungirán como interlocutores con la Secretaría de Desarrollo\nSocial en el ejercicio de la contraloría social.\nLos Comités deberán elegir dentro de su estructura interna, Presidente, Secretario, Tesorero y\nVocal mínimamente, electos de entre la población beneficiada en donde se desarrollará el programa, acción o proyecto.\nDichos Comités deberán revisar en conjunto con la población, los avances y resultados del programa, acción o proyecto, así como la detección de cualquier irregularidad.\nEl vocal de los Comités será el responsable de hacer llegar las quejas o denuncias recibidas a la\nSecretaría de Desarrollo Social, quien dará respuesta en un plazo no mayor de 15 días a partir de la fecha de recepción de la queja o denuncia.\n8.7.2. Capacitación y Asesoría\nPara impulsar la realización de las actividades de Contraloría Social se brindará capacitación y asesoría por parte de las Instancias correspondientes, a los servidores públicos que intervienen en la operación del Programa, así como a los integrantes de los Comités Locales, para que éstos realicen adecuadamente sus actividades de seguimiento y vigilancia.\n8.7.3. Seguimiento\nSe deberá integrar un Programa Operativo que deberá incluir la descripción de las actividades, metas y calendarización de las actividades para su cumplimiento.\nLa Dirección General de Acciones Prioritarias o el personal designado, conformará los Comités\nComunitarios de Contraloría Social, así mismo darán acompañamiento durante las actividades que se desarrollen durante la ejecución del programa, acción o proyecto.\nEl Comité Comunitario de Contraloría Social deberá controlar, vigilar y dar seguimiento al proyecto a través de los formatos que integran el expediente comunitario, integrado por:\nEJERCICIO FISCAL 2014\na) Acta de Conformación del Comité Comunitario de Contralo-ría Social;\nb) Reunión con Beneficiarios;\nc) Ficha Informativa de Programa;\nd) Cédula de Vigilancia del Programa;\ne) Actividades de Difusión y Capacitación;\nf) Quejas, Denuncias o Reconocimientos en su caso;\ng) Entrega - Recepción del programa, acción o proyecto; e\nh) Informe.\nLa Dirección General de Acciones Prioritarias o el personal designado, será responsables de integrar los expedientes emitidos por los Comités de los proyectos aprobados y hará entrega de los mismos al área correspondiente.\nLa Dirección General de Contraloría Social de la Contraloría General del Estado podrá dar seguimiento a las actividades señaladas en el Programa de Trabajo de cada Comité.\n8.8. Quejas y denuncias\nLos beneficiarios pueden presentar sus quejas o denuncias directamente en las Oficinas de la\nSecretaría de Desarrollo Social sobre cualquier hecho, acto u omisión que produzca o pueda producir daños al ejercicio de sus derechos establecidos en las presentes Reglas o contravengan sus disposiciones y de la demás normatividad aplicable, debiendo contener como mínimo la narración de los hechos que constituyan la queja, acompañando los documentos o evidencias que comprueben los actos incurridos, presentando como mínimo nombre del quejoso, domicilio para recibir documentos y notificaciones, teléfono o correo electrónico, con la finalidad de dar respuesta a su inconformidad.\nLas quejas y denuncias de la ciudadanía derivadas de alguna irregularidad en la operación del programa deberán realizarse por escrito y ser entregadas de manera directa en el domicilio ubicado en\nEdificio Norte Planta Baja, Palacio de Gobierno, Sito en Boulevard René Juárez Cisneros No. 62, Chilpancingo, Gro. C.P. 039074, o bien podrá presentarse vía correo electrónico a la siguiente dirección:\n9. Criterios de selección y elegibilidad\nEl programa está diseñado para proporcionar apoyo a los ciudadanos del Estado de Guerrero, estableciendo como prioridad su condición de pobreza, marginación y vulnerabilidad en que se encuentre.\n9.1 Requisitos específicos\n9.1.1 Ayudas Apremiantes\nConsiste en apoyos para:\nEJERCICIO FISCAL 2014\na) Gastos Médicos;\nb) Gastos Funerarios;\nc) Siniestros y/o Desastres Naturales;\nd) Apoyos al Programa Integral de Atención al Migrante;\ne) Entre otros apoyos.\na) Gastos Médicos\nAdemás de cumplir con los requisitos del numeral 5.1.2., deberá de cumplir con los siguientes:\n1. Constancia o diagnóstico médico, receta médica actualizada no mayor a 8 días hábiles de emitido dicho documento, con datos legibles en original y copia para su cotejo al momento de presentar la solicitud.\n2. En casos de atenciones y/o apoyos a personas con capacidades diferentes como: sillas de ruedas, bastones, andaderas y muletas deberá presentar: a. Certificado Médico que indique el tipo de discapacidad; b. Fotografía de cuerpo completo. c. En caso de que el beneficiario sea menor de edad adjuntar los requisitos del numeral 5.1.2., de alguno de los padres o tutores;\nSe dará prioridad a toda aquella persona que no cuente con algún tipo de seguridad social.\nb) Gastos Funerarios\nAdemás de cumplir con los requisitos del numeral 5.1.2., deberá de cumplir con los siguientes:\na) Acta de Defunción en original y copia para su cotejo, expedida dentro de los 10 días hábiles posteriores al fallecimiento y de haber presentando la solicitud, en caso de ser beneficiado;\nb) Tendrán prioridad los ciudadanos radicados en el Estado;\nc) Siniestros y/o desastres naturales\nAdemás de cumplir con los requisitos del numeral 5.1.2., deberá cumplir con los siguientes:\na) Presentar constancia o dictamen expedida por la Dirección de Protección Civil o en su defecto de la Autoridad Local competente en original y copia para su cotejo emitida en un plazo no mayor de 10 días hábiles posteriores al suceso;\nEJERCICIO FISCAL 2014\nb) Fotografía de la vivienda siniestrada, o de las afectaciones sufridas durante la contingencia;\nc) Acreditar ser propietario y/o poseedor del inmueble, en caso de no contar con TITULO O\nCERTIFICADO DE PROPIEDAD, se podrá presentar CONSTANCIA emitida por la autoridad local competente.\nLos recursos asignados al Programa de Combate a la Pobreza Acciones Prioritarias, darán atención preferente a la población afectada y/o en situación de riesgo.\nSi por la dimensión del siniestro el afectado no cuenta con la documentación o requisitos anteriormente descritos, podrá recibir el apoyo siempre y cuando la autoridad local inmediata haga constar o reconozca la identidad de la persona y la propiedad, posesión u ocupación del inmueble dañado.\nd) Apoyos al Programa Integral de Atención al Inmigrante\nLa SEDESOL, podrá participar en programas de concurrencia con otras dependencias para la atención a los Migrantes Jornaleros Agrícolas.\nRequisitos\na) Desempeñarse en labores agrícolas al interior del país;\nb) Registrarse antes de su salida con los promotores asignados en las USIS (Unidad de\nServicios Integrales) en Chilapa de Álvarez y Tlapa de Comonfort.\n9.1.2 Acciones Sociales, Culturales, Educativas, Deportivas y Recreativas\nLos apoyos para Acciones Sociales y Culturales serán:\n1) Festividades Tradicionales,\n2) Eventos Deportivos;\n3) Viajes de Estudios y Recreativos;\n4) Material Educativo, Cívico, Deportivo, Equipo de Cómputo y Tecnológico;\n5) Entre otros.\nAdemás de lo requerido en el numeral 5.1.2., deberá de cumplir con los siguientes requisitos:\na) Convocatoria del Evento a realizarse;\nb) Relación de Participantes.\nLa solicitud deberá presentarse en documento oficial con sello original legible de los solicitantes, y contener la firma o huella de cuando menos tres integrantes de la Institución u Organismo solicitante, así como se deberá precisar la población a beneficiar estableciendo la cantidad de hombres y mujeres.\nEJERCICIO FISCAL 2014\nPara el caso del equipo de cómputo y tecnológico, tendrán prioridad los estudiantes de bajos recursos económicos y quienes tengan los mejores promedios en sus Municipios, preferentemente de nivel medio superior y superior.\nLa aportación en este rubro podrá ser en un esquema de 50% el beneficiario y 50% el programa, o en su caso, el programa podrá otorgar hasta del 100% del valor total del equipo, de acuerdo a la suficiencia presupuestal.\nAdemás de lo requerido en el numeral 5.1.2., deberá de cumplir con los siguientes requisitos:\n1. Constancia de Estudios actual;\n2. Boleta de Calificaciones o Kardex Vigente;\nAmbos documentos se entregaran en original y copia para su cotejo\nEl costo del equipo de cómputo, será publicado en la página web de la SEDESOL, así como en las oficinas de la misma, de acuerdo a los Convenios que se logren con los diferentes proveedores.\n9.1.3. Estudios de Capacitación y Evaluación de Programas Sociales\nEn este rubro, se podrán convenir con personas físicas, morales, Asociaciones Civiles, Organizaciones Internacionales, ONG, instancias de gobierno entre otros, para desarrollar programas sociales, consultorías, talleres, cursos, capacitaciones, etc., que coadyuven en el mejoramiento de las capacidades sociales en el Estado.\nEl monto establecido en el punto 5.6 de las presentes Reglas, será el mínimo a otorgar, quedando sujeto a la firma del convenio y a la disponibilidad presupuestal los montos a otorgarse, de acuerdo a las actividades y alcances de los proyectos a desarrollar, para esto será necesario establecer un plan de trabajo con metas y objetivos definidos para medir la eficiencia y eficacia de los resultados.\n9.1.4. Desarrollo Humano y Productivo\nJornadas Cívicas Culturales, Acciones de Bienestar Comunitario y de Fortalecimiento del Ingreso\nFamiliar. realizar tareas donde la SEDESOL lo designe, o si es necesario contar con personal para ayudar en actividades de oficina, debiendo reportar al área de Recursos Humanos la designación de tareas específicas y reportes periódicos según sean solicitados por la Dirección de Acciones Prioritarias.\nLos promotores comunitarios que cumplan con los requisitos, y de acuerdo a la disponibilidad de presupuesto serán elegidos por la titular de la dependencia y/o el Director de Acciones Prioritarias,\nEJERCICIO FISCAL 2014 deberán radicar en el estado, ser mayores de edad, y mínimamente contar con estudios de educación media superior. requisitos:\na) Copia Fotostática de su identificación oficial (IFE, Pasaporte, u otro medio de identificación oficial);\nb) Copia Fotostática de su Clave Única de Registro Poblacional (CURP);\nc) Acta de Nacimiento;\nd) Comprobante de Domicilio no mayor a 3 meses;\ne) Currículum Vítae;\nf) Comprobante de estudios;\ng) 2 Cartas de Recomendación con una antigüedad no mayor a un mes;\nh) 2 Fotografías tamaño infantil, las cuales pueden ser a color o blanco y negro;\ni) Certificado Médico, expedido por institución pública;\nj) Datos de cuenta bancaria para transferencia electrónica y/o depósito; y\nk) Carta de No antecedentes Penales;\nEl lugar de comisión o de acción del Promotor será designado por la titular y/o el Director de\nAcciones Prioritarias, tomando en cuenta el lugar de origen o localidad en dónde radique éste.\na) Jornadas Cívicas y Culturales\nDeberá presentar los requisitos del numeral 5.1.2., además la propuesta de actividades a llevarse a cabo y el presupuesto respectivo, para su revisión y autorización en su caso.\nb) Acciones de Bienestar Comunitario\nLa SEDESOL, como cabeza de sector, a través de la Dirección de Acciones Prioritarias promoverá la realización de acciones de Bienestar Comunitario interinstitucionales, para lo cual, concertará con quienes deseen participar en acciones de beneficio social para los Municipios y/o localidades de todas las regiones del Estado, auxiliándose de promotores comunitarios que coadyuvaran con la SEDESOL, a dar a conocer y operar los programas de la misma y/o acciones requeridas.\nc) Fortalecimiento del Ingreso Familiar incremente el ingreso familiar, Talleres y Cursos de Capacitación que den los elementos y conocimientos básicos a los participantes de la actividad a desarrollar, debiendo cumplir con los requisitos generales del numeral 5.1.2., además la solicitud deberá contener:\na) Descripción detallada del Proyecto; y\nEJERCICIO FISCAL 2014\nb) Presupuesto aproximado. y mujeres cuando se trate de beneficiar a un grupo de personas.\nCapacitación.\nSe buscará la firma de convenios con Dependencias y Organismos relacionados para ampliar las metas del subprograma.\n9.1.5. Apoyos para Obra Pública y Equipamiento de Bajo Costo\nLos materiales que se otorguen serán para construcción, rehabilitación, ampliación y culminación de obras de Infraestructura Social Básica y bienestar comunitario, que consiste en la donación y/o la adquisición de materiales industrializados a bajo costo, contando con la participación organizada de la comunidad a beneficiar.\nAdemás de presentar los requisitos generales del numeral 5.1.2., la solicitud deberá contener:\na) Solicitud de obra;\nb) Ficha técnica;\nc) Fotografías de situación actual de la obra a realizar;\nd) Descripción de la población a beneficiar incluyendo género.\nUna vez revisado el expediente respectivo y en caso de autorizarse la obra solicitada deberá constituirse los Comités de Desarrollo Comunitario y de Contraloría Social.\nSe autorizará la obra siempre y cuando esta sea evaluada positivamente por el área responsable de dictaminar la Ficha técnica y la viabilidad de la ejecución de la obra, así mismo seleccionará al proveedor o proveedores que suministraran los materiales al menor costo posible, sin perder la calidad de los mismos para la ejecución de dicha obra, que serán entregados por personal de la SEDESOL a través de la Dirección General de Acciones Prioritarias en el lugar que se haya convenido.\nEn caso de autorización se hará del conocimiento al solicitante, así como el recurso aprobado y los procedimientos a seguir en inicio, avance, ejecución y comprobación auxiliados por personal de la\nSEDESOL, los Comités estarán obligados a firmar las actas constitutivas y documentos correspondientes anexando copia de la credencial de elector de cada uno de los integrantes de los Comités. Dentro de otras actividades a realizarse deberá suscribir el Convenio de Concertación de Obra con la SEDESOL. inicio, proceso y terminación de la misma, a su vez se compromete el Comité en coordinación con\nEJERCICIO FISCAL 2014 personal de la SEDESOL, a la supervisión de los avances físicos de dicha obra cuando se requiera, a fin de garantizar que los recursos otorgados lleguen con transparencia a la población beneficiada.\nPresidente, Secretario del Comité de Desarrollo Comunitario, y deberán ser entregadas a la Secretaría de\nDesarrollo Social para integrar el expediente unitario de obra y Contraloría Social.\nEn caso de que faltara un integrante de la mesa directiva del Comité, este sesionara en\nAsamblea General para elegir a quien sustituirá al integrante faltante.\nEl Promotor comunitario asignado por la SEDESOL a través de la Dirección, será el encargado del proceso de instalación de comités, supervisión, seguimiento, conclusión y comprobación documental de la obra.\n10. Mecánica operativa\n10.1 Instancia ejecutora\nLa instancia ejecutora del Programa Acciones Prioritarias será la Secretaría de Desarrollo Social del Estado a través de la Dirección General de Acciones Prioritarias.\n10.2 Instancia Administrativa\nLa Instancia Administrativa del programa será la Secretaría de Desarrollo Social del Estado a través de la Dirección General de Acciones Prioritarias.\n10.3 Delimitación de atribuciones\nLa Secretaría de Desarrollo Social a través de la Dirección General de Acciones Prioritarias, de conformidad con las presentes Reglas de Operación y de acuerdo a los recursos autorizados en el\nDecreto de Presupuesto de Egresos del Estado para el Ejercicio Fiscal 2014, tendrá las siguientes atribuciones:\n1. Coordinar y conducir la operación del programa, de acuerdo a los lineamientos establecidos en las presentes reglas;\n2. Administrar a través de la Dirección General de Administración y Finanzas los recursos financieros autorizados;\n3. Diseñar los instrumentos técnicos necesarios para evaluar el impacto social del programa;\n4. La organización del personal técnico y operativo que requiera para garantizar el funcionamiento del programa;\nEJERCICIO FISCAL 2014\n11. Derechos, obligaciones y sanciones de los beneficiarios de programas sociales\n11.1 Derechos\nLos beneficiarios tendrán derecho a recibir:\na) La información necesaria de manera clara y oportuna para participar en el Programa;\nb) Un trato digno, respetuoso, oportuno, con calidad y equitativo, sin discriminación alguna\nc) Atención y trámites sin costo alguno;\nd) Recibir en caso de que sea elegible el apoyo para su proyecto y/o acción establecido en las presentes reglas de operación.\n11.2 Obligaciones\nLos beneficiarios del Programa tendrán las siguientes obligaciones:\na) Proporcionar, bajo protesta de decir verdad, la información que sea requerida de acuerdo a lo establecido en las presentes reglas de operación;\nb) Cumplir con su corresponsabilidad en el proyecto autorizado y estar de acuerdo en conformar el Comité de Desarrollo Comunitario y Contraloría Social (ANEXOS) respectivos para el propósito del proyecto o acción;\nc) No hacer uso indebido (venta, préstamo o uso con fines partidistas o electorales, entre otros) de los apoyos otorgados por parte del Programa; y\nd) Acatar en todo momento las determinaciones de la Secretaría y de la Dirección General de\nAcciones Prioritarias.\n11.3 Sanciones\nSe suspenderán definitivamente los apoyos a los beneficiarios que:\na) No cumplan con alguna de las obligaciones estipuladas en las presentes reglas de operación;\nb) Cuando transcurran 30 días naturales de notificado el apoyo y no se presentara el beneficiario a recibirlo, este se cancelará de manera automática notificándole esta circunstancia al beneficiario reasignándose el recurso;\nc) En el caso de que la Dependencia o algún Órgano de Fiscalización detecte desviaciones o incumplimiento en el ejercicio de los recursos a las presentes Reglas de Operación, información apócrifa\nEJERCICIO FISCAL 2014 por parte del o los beneficiarios, se suspenderán los apoyos, y solicitará su reintegro total, de acuerdo a la normatividad aplicable y;\nd) En caso de detectar que el solicitante ya fue beneficiado por el mismo concepto durante el presente ejercicio fiscal, será eximido de recibir nuevos apoyos.\n12. Cierre de Ejercicio\nLa Dirección Administrativa será la responsable de elaborar y emitir el cierre final del Ejercicio\nFiscal los primeros quince días hábiles del mes de Enero del ejercicio próximo.\n13. Casos Especiales\nEn todos aquellos casos no previstos en las presentes reglas de operación, serán sometidos a consideración de la Titular de la Secretaría y/o el Director General de Acciones Prioritarias, tomando en cuenta las circunstancias del caso, sus particularidades y los riesgos sociales\n14. Anexos\nAnexo 1. Glosario de Términos\nCorresponsabilidad: Se refiere a la ejecución por parte de los beneficiarios de las actividades que les corresponde de acuerdo a los proyectos o acciones que les fueron aprobados.\nCURP: Clave única de Registro de Población.\nSEDESOL: Secretaría de Desarrollo Social del Gobierno del Estado de Guerrero.\nMunicipios de Muy Alta, Alta o Media Marginación (MMAM):Son aquellos municipios identificados por CONAPO como de muy alta, alta y media marginación en la publicación de Índices de\nPerspectiva de género: Es una visión política y social sobre las mujeres y los hombres, que tiene como finalidad eliminar las causas de discriminación o desigualdad pos cuestiones de género, sexo, raza etc., y que promueve la igualdad, la equidad y el bienestar de las mujeres y hombres, proporcionando el mismo valor entres estos.\nPrograma: Programa Acciones Prioritarias\nReglas: las Reglas de Operación del Programa Acciones Prioritarias\nSiniestro: Evento fortuito o de fuerza mayor provocado por fenómenos naturales, (temblores, sismos, lluvias, huracanes etc.,) que perjudican a los habitantes de una zona, región, localidad o entidad,\nEJERCICIO FISCAL 2014 dejando pérdidas y daños graves, dejando en total estado de vulnerabilidad determinado y emitido por una autoridad.\nSolicitante: Persona física o moral que en uso de su derecho de petición, requiere algún tipo de apoyo.\nEL SUSCRITO LICENCIADO FIDELMAR FLORES MÉNDEZ, DIRECTOR DE LA UNIDAD DE\nASUNTOS JURÍDICOS DE LA SECRETARÍA DE DESARROLLO SOCIAL EN EL ESTADO DE\nGUERRERO, QUIEN ACTÚA CON LOS TESTIGOS DE ASISTENCIA QUIENES DAN FE Y LEGALIDAD\nDE LA PRESENTE Y CON FUNDAMENTO ARTÍCULO PRIMERO FRACCIÓN VI DEL ACUERDO\nDELEGATORIO DE FACULTADES PUBLICADO EL DÍA 02 DE JULIO DEL 2013, EN EL PERIÓDICO\nOFICIAL DEL ESTADO DE GUERRERO,\nQUE LAS PRESENTES COPIAS FOTOSTÁTICAS CONSISTENTES EN EL ACUERDO POR\nEL QUE SE EMITEN LAS REGLAS DE OPERACIÓN DEL PROGRAMA COMBATE A LA POBREZA\nACCIONES PRIORITARIAS PARA EL EJERCICIO FISCAL 2014, CONCUERDAN FIELMENTE CON\nTODAS Y CADA UNA DE SUS PARTES DEL ORIGINAL, MISMO QUE TUVE A LA VISTA Y PREVIO\nCOTEJO, SE DEVUELVE A LOS ARCHIVOS DE ORIGEN PARA QUE OBRE EN LOS MISMOS.CONSTE.\nLO QUE CERTIFICO PARA LOS EFECTOS LEGALES A QUE HAYA LUGAR, EN LA CIUDAD\nDE CHILPANCINGO, GUERRERO, EL DÍA DIEZ DEL MES DE ABRIL DEL AÑO DOS MIL CATORCE.\nDESARROLLO SOCIAL DEL ESTADO DE GUERRERO.\nLIC. FIDELMAR FLORES MÉNDEZ.\nRúbrica.\nTESTIGOS DE ASISTENCIA.\nLIC. IRENE CRUZ DOLORES.\nRúbrica.\nLIC. MANUEL MORGA ÁNGEL.\nRúbrica.",
  "ordenamiento": "REGLA",
  "jurisdiccion": "GUERRERO",
  "fuente_oficial": "DIARIO OFICIAL DE LA FEDERACION",
  "Fecha de Publicación": "18 de \njulio de 2014",
  "ULTIMA REFORMA PUBLICADA": null,
  "status": "VIGENTE",
  "es_escaneado": false,
  "tiene_tablas": true,
  "materia": [
    "desarrollo social"
  ]
}