{
  "titulo": "Acuerdo por el Que Se Emiten las Reglas de Operación del Programa de Apoyo A los Discapacitados Guer",
  "Contenido": "EJERCICIO FISCAL 2013\nGUERRERO CUMPLE PARA EL EJERCICIO FISCAL 2014, PUBLICADO EN EL PERIÓDICO OFICIAL\nULTIMA REFORMA PUBLICADA EN EL PERIÓDICO OFICIAL DEL GOBIERNO DEL ESTADO\nNo. 72, EL VIERNES 06 DE SEPTIEMBRE DE 2013.\nTEXTO ORIGINAL.\nAcuerdo publicado en el Periódico Oficial del Gobierno del Estado de Guerrero No. 23, el Martes\n19 de Marzo de 2013.\nACUERDO POR EL QUE SE EMITEN LAS REGLAS DE OPERACIÓN DEL PROGRAMA DE APOYO A\nLOS DISCAPACITADOS GUERRERO CUMPLE PARA EL EJERCICIO FISCAL 2013.\nM.C. MARIANA ITALLITZIN GARCÍA GUILLÉN Coordinadora General de Programas Sociales\nGuerrero Cumple, con fundamento en el artículo 8 fracción I y XVI del Reglamento Interior de Programas\nSociales Guerrero Cumple, así como el Artículo Cuarto del Acuerdo por el que se crea la Coordinación\nGeneral de Programas Sociales Guerrero Cumple, publicado en el Periódico Oficial del Gobierno del\nEstado de Guerrero numero 26 alcance I de fecha 01 de abril de 2011, y\nCONSIDERANDO\nQue en el Dictamen y Decreto del Presupuesto de Egresos del Estado de Guerrero para el ejercicio Fiscal 2013, se señala que se ejercitarán los recursos bajo una política de gasto público, que permita dar cumplimiento a lo que globalmente prevén los cinco ejes rectores del Plan Estatal de\nDesarrollo 2011-2015. Dentro de las políticas de Desarrollo Social, además de los programas ya establecidos, se fortalecerá el Programa de Guerrero Cumple, a través del cual, se seguirán apoyando a las personas mayores con el programa de Pensión Guerrero; Apoyo a madres solteras y a personas con capacidades diferentes, a fin de mejorar la calidad de vida de cada uno de las y los beneficiarios de los programas.\nPor lo expuesto y con fundamento en las disposiciones legales antes citadas, he tenido a bien expedir el siguiente:\nLOS DISCAPACITADOS GUERRERO CUMPLE PARA EL EJERCICIO FISCAL 2013.\nÚnico: Se emiten las Reglas de Operación del Programa de Apoyo a los Discapacitados\nGuerrero Cumple para el Ejercicio Fiscal 2013\nTRANSITORIOS\nPrimero.- El presente Acuerdo entrará en vigor al día siguiente de su publicación en el Periódico\nEJERCICIO FISCAL 2013\nSegundo.- Quedan abrogadas las Reglas de Operación del Programa de Apoyo a los\nDiscapacitados Guerrero Cumple, publicadas en el Periódico Oficial del Estado de Guerrero, número 17\nTercero.- Las Reglas de Operación del Programa de Apoyo a los Discapacitados Guerrero\nCumple, para el ejercicio fiscal 2013, se publican en su totalidad para mejor entendimiento.\nDado en la Ciudad de Chilpancingo de los Bravo, Guerrero a los veintidós días del mes de enero de dos mil trece.\nLA COORDINADORA GENERAL DE PROGRAMAS\nSOCIALES GUERRERO CUMPLE.\nM. en C. MARIANA ITALLITZIN GARCÍA GUILLÉN.\nRúbrica.\nÍNDICE\n1. Introducción\n2. Objetivos\n2.1. Generales\n2.2. Específicos\n2.3. Población Objetivo\n3. Misión\n4. Visión\n5. Reglas de operación\n5.1. Lineamientos generales\n5.1.1. Fundamento legal\n5.1.2. Participantes\n5.1.3. Patrimonio del programa\n5.1.4. Tipos de apoyo\n6. Información del Programa\n6.1. Exposición del Programa\n6.2. Cobertura\n6.3. Modos de entrega del apoyo\n6.4. Gastos de operación\n7. Transparencia\n7.1. Difusión\n7.2. Seguimiento de Avances Físicos y Financieros\nEJERCICIO FISCAL 2013\n7.3. Evaluación\n7.4. Auditoría\n7.5. Recursos no devengados\n7.6. Blindaje electoral\n7.7. Contraloría social\n7.8. Quejas y denuncias\n8. Criterios de selección y elegibilidad\n8.1. Método de selección de beneficiarios\n9. Mecánica de operación\n9.1. Instancia ejecutora\n9.2. Instancia administrativa y normativa\n9.3. Delimitación de atribuciones\n10. Derechos, obligaciones y sanciones de los beneficiarios de programas sociales\n10.1. Derechos\n10.2. Obligaciones\n10.3. Sanciones\n10.3.1. Suspensión\n10.3.2. Terminación\n11. Designación del Tutor\n12. Interpretación\n1. Introducción\nSe considera persona discapacitada a todo ser humano que presente de forma permanente una limitación, pérdida o disminución de sus facultades físicas, intelectuales, para realizar sus actividades connaturales.\nSe reconoce que las personas discapacitada, sufren marginación y discriminación, no sólo por parte de la sociedad, sino también a veces de su familia lo que las orilla a tener además de un problema físico, una baja autoestima.\nEn México como en Guerrero, existen personas que tienen algún tipo de discapacidad, no obstante de ser un sector muy vulnerable, pocos son los programas de apoyo que se ofertan para este segmento de la población.\nPor ello, se tiene la imperiosa necesidad de coadyuvar al mejoramiento de la calidad de vida de este sector de la población, mediante el otorgamiento de una pensión alimenticia mensual.\nObjetivo 2.2.36 del Eje Desarrollo Social con Equidad del Plan Estatal de Desarrollo 2011-2015, el cual\nEJERCICIO FISCAL 2013 establece el combate a la pobreza y la marginación en todas sus expresiones, en las que vive un poco más del 68% de la población del Estado.\nAsí mismo, con la implementación de este Programa, se busca beneficiar a más de 6,000 familias de manera directa mejorando su calidad de vida y la de sus núcleos familiares.\n2. Objetivos\n2.1. General\nFortalecer la economía familiar de las personas discapacitadas de bajos recursos que no cuenten con ningún apoyo económico por parte de la Federación, el Estado o el Municipio.\n2.2. Específicos\n• Mejorar la calidad de vida de las personas discapacitadas de bajos recursos;\n• Cubrir requerimientos relativos a sus necesidades básicas de salud, como puede ser la compra de medicamentos e insumos médicos.\n• Identificar los requerimientos básicos de acuerdo a sus necesidades para correlacionarlas con otras instituciones sociales y brindarles un apoyo adicional.\n2.3. Población objetivo\nEste Programa está dirigido a las personas de bajos recursos que presenta una discapacidad permanente que sea motriz, de lenguaje, auditiva, visual o mental y no cuenten con ningún apoyo económico o en especie, ya sea Federal, Estatal o Municipal.\nPrevio análisis y bajo acuerdo de la Coordinación General de los Programas Sociales Guerrero\nCumple, siempre y cuando la disponibilidad presupuestal lo permita, se podrá otorgar el apoyo, a grupos, y/o sectores de la población con características diferentes o especiales, así como a Programas institucionales específicos, por su condición de ser estratégicos y/o concurrentes con políticas de transversalidad.\n3. Misión\nMejorar la calidad de vida de los discapacitados, estimular el desarrollo humano y favorecer la integración de este grupo vulnerable a la sociedad.\n4. Visión\nContribuir al rompimiento del círculo generacional de la pobreza en Guerrero.\n5. Reglas de operatividad\nEJERCICIO FISCAL 2013\n5.1. Lineamientos Generales\nLas etapas que se deberán seguir en la ejecución del Programa son las Siguientes:\nConvocatoria. Publicación de convocatoria en los diferentes medios de comunicación, detallando los requisitos y características especificas del programa, así como la ubicación de los módulos de atención Guerrero Cumple en los 81 Municipios de forma itinerante.\nInformación y Difusión. La información y difusión se realiza a través de la publicación de la convocatoria en los diversos medios de comunicación estatales, el uso de los espacios en radio y televisión así como en la página web: www.guerrero.gob.mx. y a través de los enlaces municipales de los\nH. Ayuntamientos.\nRegistro. El solicitante deberá de acudir al módulo de atención con su documentación respectiva, con la finalidad de realizarle un estudio socioeconómico que nos permita integrar la totalidad de su expediente.\nIntegración de la Base de Datos. Una vez obtenidos los expedientes de las solicitantes en los diferentes módulos, se capturan y digitalizan en el Sistema de Información de Guerrero Cumple, que permite conformar la Base de Datos de Solicitantes.\nSelección de Beneficiarios. Las candidatos deberán haber realizado su trámite en tiempo y forma, cumplir con los requisitos generales y las características específicas, presentar una situación de pobreza, vulnerabilidad o marginación así como ser afiliada al sistema de protección social en salud\n\"Seguro Popular\" y a los de población abierta. Lo anterior en base a la valoración y el análisis de la información obtenida del cuestionario socioeconómico, que permite determinar los parámetros correspondientes a la inclusión o exclusión de los beneficios del Programa de Apoyo a los Discapacitados\nGuerrero Cumple como es en el caso de los derechohabientes del IMSS y del ISSSTE.\nConfronta. Con la finalidad de verificar si reciben algún apoyo monetario y depurar la base de datos de solicitantes preseleccionados, se confronta con el padrón de otros programas sociales con presencia en el Estado de Guerrero.\nBeneficiarios. Una vez que se cuenta con el expediente completo y el solicitante ha culminado exitosamente su proceso de selección, cumpliendo con los criterios generales y las disposiciones específicas al respecto, establecidas en nuestras Reglas de Operación, se procede a notificarle su condición de beneficiario.\nNotificación. Se realizará a través de la publicación del listado de beneficiarios en los distintos instalaciones de los 81 Ayuntamientos Municipales.\nEntrega. Se realizará la entrega de las Tarjetas Guerrero Cumple o de los Vales de Despensa a cada uno de los beneficiarios, previo aviso oportuno a través de las autoridades de su localidad.\nEJERCICIO FISCAL 2013\nVerificación. Se realizarán las visitas domiciliares, con la finalidad de verificar la existencia del beneficiario y constatar las condiciones de vida del mismo. Este último proceso se hará para mantener actualizado nuestro Padrón y hacerle llegar el beneficio a las personas que más necesitan de él, cumpliendo con el objetivo del programa.\n5.1.1 Fundamento legal\nEl Programa de Apoyo a los Discapacitados Guerrero Cumple se encuentra enmarcado en el\nObjetivo 2.2.36 del Eje Desarrollo Social con Equidad del Plan Estatal de Desarrollo 2011-2015, el cual establece el compromiso del Estado en combatir a la pobreza y la marginación en todas sus expresiones, en las que vive un poco más del 68% de la población del Estado.\nEn el Dictamen y Decreto del Presupuesto de Egresos del Estado de Guerrero para el ejercicio\nFiscal 2013, el Ejecutivo Estatal propone ejercer los recursos consignados en el Proyecto de Presupuesto que se presenta, bajo una política de gasto público, que permita dar cumplimiento a lo que globalmente prevén los ejes rectores del Plan Estatal de Desarrollo 2011-2015. Dentro de las políticas de Desarrollo\nSocial, además de los programas ya establecidos, se fortalecerá el Programa de Guerrero Cumple, a través del cual, se seguirán apoyando a los adultos mayores con el programa de Pensión Guerrero;\nApoyo a madres solteras y a personas con capacidades diferentes, además de canalizar parte de los recursos destinados a éstos, al gasto público en salud con el objeto de impactar en la acreditación de la aportación solidaria estatal; asimismo, la otorgada a través de las entidades que integran el sector paraestatal.\nLa Coordinación General de Programas Sociales Guerrero Cumple tiene por objetivo coordinar y articular la implementación de los Programas Sociales a cargo de las Dependencias y Entidades del\nPoder Ejecutivo del Estado y deberá elabora y ejecutar los programas de operación institucional de acuerdo a lo dispuesto por los artículos séptimo fracción I del Acuerdo por el que se crea la Coordinación\nGeneral de Programas Sociales Guerrero Cumple, como una Dependencia directamente adscrita a la\nOficina del Gobernador y 8 fracción VI del Reglamento Interior de la Coordinación General de Programas\nSociales Guerrero Cumple.\n5.1.2 Participantes\nFederal, Estatal o Municipal al momento de solicitar el apoyo y durante el periodo que reciba el mismo, la\nCoordinación General de los Programas Sociales Guerrero Cumple, confrontará la información de sus operen en Guerrero.\nAsí también se cuenta con la participación de H. Ayuntamientos a través de sus enlaces municipales, quienes apoyan en hacer llegar la información del programa a los beneficiarios de su municipio.\nEJERCICIO FISCAL 2013\nSocial.\n5.1.3 Patrimonio del programa\nFiscal 2013, se le asigno al Programa de Apoyo a los Discapacitados Guerrero Cumple, un monto de 28 millones en Inversión Estatal Directa, mismos que serán coordinados a través de la Coordinación General de Programas Sociales Guerrero Cumple.\nEn lo que respecta al Patrimonio del programa, en Modalidad 70/30 esté se conformará por recurso estatal y municipal, en este sentido, por cada beneficiario el Gobierno Municipal aportará $150.00\n(Ciento Cincuenta Pesos 00/100 M.N.) y el Gobierno Estatal Aportará $350.00 (Trescientos Cincuenta\nPesos 00/100 M.N.). Esta aportación será durante la vigencia del Convenio de Colaboración que para tal efecto signarán. (ADICIONADO PÁRRAFO SEGUNDO, P.O. 06 DE SEPTIEMBRE DE 2013)\nBajo esta mecánica de colaboración las partes toman conocimiento que cuando el municipio decida dar por terminada la relación en el convenio de colaboración y para el Ejercicio Fiscal 2014 no lo renueven, se dará de baja a los beneficiarios del Programa bajo la \"Modalidad 70/30\" y se conservará el padrón operado mediante Inversión Estatal Directa. (ADICIONADO PÁRRAFO TERCERO, P.O. 06 DE\nSEPTIEMBRE DE 2013)\n5.1.4. Tipo de Apoyos\nSe dará una pensión alimenticia individual y directa para las personas discapacitadas que cumplan con los requisitos y características específicas del programa que se otorgará a través de la\nTarjeta Guerrero Cumple, la cual permitirá solo adquirir productos de la canasta básica y medicamentos e insumos médicos (pañales, jeringas, material de curación, etcétera).\nEn aquellos lugares donde la Tarjeta Guerrero Cumple no tenga cobertura, el pago se realizará a través de Vales de Despensa, siempre y cuando exista convenio específico y vigente.\nA través de la Tarjeta Guerrero Cumple:\nPERIODICIDAD DEL APOYO MONTO VIGENCIA\nMensual $500.00 (Quinientos pesos Permanente, siempre y cuando\n00/100 M.N.) los beneficiarios sigan cumpliendo las obligaciones y características especificas del programa.\nA través de Vales Guerrero Cumple:\nPERIODICIDAD DEL APOYO MONTO VIGENCIA\nBimensual $1000.00 (Mil pesos 00/100 Permanente, siempre y cuando\nM.N.) los beneficiarios sigan\nEJERCICIO FISCAL 2013 cumpliendo las obligaciones y características especificas del programa.\n6. Información del Programa.\nLa Coordinación General de Programas Sociales Guerrero Cumple, promoverá el Programa a través de los medios informativos tales como radio, televisión, periódicos, carteles, trípticos, y páginas electrónicas oficiales del Gobierno del Estado.\n6.1. Exposición del Programa\nLas Reglas de Operación del Programa de Apoyo a los Discapacitados Guerrero Cumple se publican en el Periódico Oficial del Gobierno del Estado y están disponibles en la página oficial del\nGobierno del Estado www.guerrero.gob.mx.\nPara dar a conocer los requisitos para ser beneficiado por el programa, status de solicitud de ingreso, los derechos y obligaciones de los beneficiarios, consulta de saldo en su Tarjeta Guerrero\nCumple y todo lo demás referente al Programa, se cuenta con un módulo de información en el lugar que ocupan las oficinas centrales de la Coordinación General de Programas Sociales Guerrero Cumple ubicada en Calle Francisco I. Madero numero 22 Colonia Centro, Chilpancingo Guerrero y con la línea telefónica 01 800 728 6753.\nAsí también, se mantiene estrecha comunicación con los H. Ayuntamientos a través de sus enlaces municipales para que apoyen en difundir con los habitantes de su municipio los requisitos para ser beneficiarios de este programa y los listados de beneficiados.\n6.2. Cobertura.\nEl Programa de Apoyo a los Discapacitados Guerrero Cumple, opera en los 81 municipios del\nEstado, priorizando las regiones indígenas, rurales y urbano marginadas.\n6.3. Modos de Entrega del Beneficio manera directa al momento de acreditar su personalidad el beneficiario.\nCon el fin de obtener un registro dentro del Padrón Único de Beneficiarios, los solicitantes presentarán los siguientes requisitos:\n1. Acta de nacimiento del solicitante;\n2. Clave Única del Registro de Población (CURP) al 200%;\nEJERCICIO FISCAL 2013\n3. Credencial de identificación oficial (IFE, cédula profesional, pasaporte), y en caso de ser madre, padre o tutor;\n4. Comprobante de domicilio (recibo de agua, luz, teléfono o constancia de la autoridad local);\n5. Constancia de ingreso propia si trabaja o en su defecto, de la familia (último comprobante, recibo, sobre o talón de pago) o constancia de pobreza emitida por la autoridad competente;\n6. Original y copia de diagnóstico médico, avalado por la Secretaría de Salud, DIF u otra institución gubernamental especializada, en el que se especifique el tipo de discapacidad y el grado de la misma.\nLos documentos deberán ser entregados a los representantes en los módulos del Programa de\nApoyo a los Discapacitados Guerrero Cumple, el trámite se realizará de manera personal, en lugar y tiempo que lo requiera el Programa, por lo que no se le dará tramite a los paquetes de solicitudes enviadas por representantes o lideres partidistas lo anterior en virtud de que al momento de recibir la documentación se hace el llenado de la solicitud de ingreso y estudio socioeconómico y únicamente podrá realizarlo el solicitante.\nPara los casos en que el solicitante tenga alguna incapacidad que disminuya su inteligencia aunque tenga periodos de lucidez, que no se pueda valer por sí mismo o que sean menores de edad podrán hacer el trámite a través de sus padres o tutores.\nLos solicitantes que hayan cumplido en tiempo y forma con los requisitos establecidos en estas\nReglas de Operación, estarán condicionados a la disponibilidad presupuestal del Programa, así como al dictamen técnico que efectúe la Coordinación General para obtener el beneficio directo.\n7. Transparencia.\nPara garantizar la imparcialidad y transparencia en la entrega de apoyos a los beneficiarios seleccionados, el seguimiento detallado y auditado en la operación del Programa se llevará a cabo por medio de la Dirección de Seguimiento y Evaluación Social de Guerrero Cumple.\nLos datos personales que se recaben con motivo de la operación del presente programa, serán protegidos y serán incorporados y tratados en el Sistema de datos personales el cual se denomina:\nSistema Informático Único Guerrero Cumple, cuya finalidad es contar con un padrón de beneficiarios que se otorgan a través del programa.\nEJERCICIO FISCAL 2013 corresponsabilidad del Gobierno con sus dependencias. El Gobierno Estatal instrumentará el programa impacte en salud y en el bienestar social.\nEl gasto público comprobado que se efectúe con impacto a salud con la compra de medicamentos y/o insumos médicos podrá ser considerado como Aportación Solidaria Estatal conforme lo establece el Artículo 11 del Decreto del Presupuesto de Egresos del Estado para el Ejercicio Fiscal\n2013.\n7.1. Difusión\nLa Coordinación General de los Programas Sociales Guerrero Cumple, a través del Programa de\nApoyo a los Discapacitados Guerrero Cumple, emitirá y publicará la convocatoria para el otorgamiento del apoyo a los beneficiarios que demuestren que están en una situación de desventaja social. En ella, obligatoriamente, se darán a conocer cuando menos el objetivo del Programa, los requisitos que deberán cumplir las aspirantes, la dirección de los módulos de información, número telefónico para pedir informes, la fecha de recepción de solicitudes y la fecha y forma de entrega de resultados, por conducto de los principales medios de difusión.\nLa información referente al Programa se podrá consultar de manera permanente en el portal oficial del Gobierno del Estado, así como el padrón de beneficiarios actualizado.\n7.2. Seguimiento de Avances Físicos Financieros\nLos recursos asignados a éste programa son mediante Inversión Estatal Directa y se asignarán en función de la disponibilidad presupuestal, invariablemente la instancia ejecutora deberá informar y justificar las variaciones entre el presupuesto autorizado, el ejercido y las metas programadas.\nLa Coordinación General de Programas Sociales Guerrero Cumple, deberá presentar a la\nSecretaria de Administración y Finanzas (SEFINA) y al Comité de Planeación para el Desarrollo del\nEstado de Guerrero (COPLADEG) de manera mensual, durante los primeros cinco días hábiles posteriores al cierre de cada mes, la comprobación del recurso asignado al Programa, además la Acreditación de la Aportación Solidaria Estatal, así como los avances físicos-financieros del mismo que también deberá registra en el Sistema Integral de Evaluación y Seguimiento (SIES).\nAdemás del informe mensual, se deberá presentar también al COPLADEG un informe trimestral.\n7.3. Evaluación\nEJERCICIO FISCAL 2013 número de beneficiarios y el porcentaje de cobertura, para conocer el cumplimiento de las metas propuesta; en tal sentido y una vez concluida la evaluación del Programa, se atenderá y dará seguimiento a los aspectos susceptibles de mejora.\n7.4. Auditoria\nEn caso de ser necesario, el recurso asignado a éste programa, será verificado por la\nContraloría General de Estado.\nComo resultado de las acciones de auditoría que se lleven a cabo, la instancia auditora mantendrá un seguimiento interno que le permita emitir informes de las revisiones efectuadas.\nEl control y seguimiento del Programa de Apoyo a Discapacitados Guerrero Cumple se hará a través de la Dirección de Seguimiento y Evaluación Social dependiente de la Coordinación General de\nProgramas Sociales Guerrero Cumple quien será la encargada de validar los criterios de elegibilidad de los solicitantes y beneficiarias, ejecutar las visitas domiciliadas para verificar la veracidad de la información proporcionada por los beneficiarios y dar seguimiento a las denuncias recibidas.\nEn la Modalidad 70/30 tanto la Coordinación General de Programas Sociales como el Gobierno\nMunicipal participante, llevaran a cabo las tareas de control y seguimiento así como la actualización del padrón de beneficiarios, para lograr el cabal cumplimiento de las metas y objetivos planteados en las reglas de operación; de manera conjunta bajo una estrategia de trabajo bien definida coordinarán esfuerzos necesarios para depurar el padrón de beneficiarios a través de la denuncia y realizando visitas domiciliadas a los beneficiarios. (ADICIONADO PÁRRAFO CUARTO, P.O. 06 DE SEPTIEMBRE DE 2013)\n7.5. Recursos no devengados\nCuando existan bajas dentro del Padrón de beneficiarios del Programa de Apoyo a\nDiscapacitados Guerrero Cumple, se determinará el saldo a la fecha de esas beneficiarias y se procederá a solicitar, a la empresa encargada, el reembolso del mismo a la Dirección General de Tesorería perteneciente a la Secretaría de Finanzas y Administración del Estado.\n7.6. Blindaje electoral.\nComo estrategia de blindaje electoral, la papelería, documentación oficial, así como la publicidad y promoción del Programa deberán incluir la siguiente leyenda:\n\"Este programa es de carácter público, no es patrocinado ni promovido por partido político alguno y sus recursos provienen de los impuestos que pagan todos los contribuyentes. Está prohibido el uso de este programa con fines políticos, electorales, de lucro y otros distintos a los establecidos. Quién con la ley aplicable y ante la autoridad competente\".\nEn cuanto a la publicidad en medios electrónicos, impresos, complementarios o de cualquier otra índole, vinculados con los Programas de comunicación social, se deberá incluir la siguiente leyenda:\nEJERCICIO FISCAL 2013\n\"Este Programa es público y queda prohibido su uso con fines partidistas o de promoción personal\".\n7.7. Contraloría social operación de los Comités de Contraloría Social existirá un Comité por cada municipio de la entidad, para el seguimiento, supervisión y vigilancia en el cumplimiento de las metas del Programa, así como para la correcta aplicación de los recursos públicos asignados al mismo.\nLos Comités de Contraloría Social podrán constituirse por beneficiarios en aquellos caso en que su discapacidad no les permita valerse por si solos podrán hacerse representar atreves de sus padres o tutor.\nLos medios que se utilizarán para la propagación y divulgación de los beneficios del programa, como acción de contraloría social serán los siguientes\na) Auditivos.- Radió;\nb) Impresos y escritos.- Diarios, trípticos;\nc) Audiovisuales.- Televisión;\nd) Multimedia.- Internet y televisión digital;\ne) Telecomunicación.- Teléfonos fijos y celulares;\nf) Grupales.- Reuniones informativas.\nPara impulsar la realización de las actividades de Contraloría Social, se brindará capacitación y asesoría a los servidores públicos que intervienen en la operación del programa y a los integrantes de los\nComités de Contraloría Social y beneficiarios del mismo.\nLa Coordinación General a través de la Subdirección de Servicios Regionales con apoyo de la\nContraloría General del Estado a través de la Dirección General de Contraloría Social, serán las encargadas de brindar a los Coordinadores Regionales y enlaces municipales, capacitación en materia de Contraloría Social.\nLos Coordinadores Regionales, serán los que de manera directa asesorarán a los integrantes de supervisión y vigilancia.\nLos integrantes del Comité, tendrán que levantar de manera bimensual cedulas de vigilancia y al final de cada ejercicio fiscal deberán elaborar un informe anual.\n7.8. Quejas y denuncias centrales de la Coordinación General de los Programas Sociales Guerrero Cumple, ubicada en calle\nFrancisco I Madero, Numero 22, Así como en las líneas telefónicas 01 800 728 6753 y el correo\nEJERCICIO FISCAL 2013 funcionamiento del programa, así como las quejas y denuncias sobre cualquier hecho, acto u omisión de Operación.\nLas quejas y denuncias de la ciudadanía en general por la presunción de actos de corrupción o desvío de recursos por parte de servidores públicos de la Coordinación General de Programas Sociales\nGuerrero Cumple, se captarán en la Contraloría General del Estado ubicada en Boulevard René Juárez\nCisneros No. 62 Cd. de los Servicios, C.P. 39074 Palacio de Gobierno número telefónico 01 800 999\n0999. Los medios por los cuales podrán presentarse quejas y denuncias ciudadanas son las siguientes:\na) Por escrito\nb) por comparecencia del interesado\nc) por correo electrónico\nd) Vía telefónica\nEl denúnciate o quejoso deberá proporcionar los siguientes datos:\na) Nombre del Servidor(es) Público(s)\nb) Dependencia de adscripción\nc) Objeto de la denuncia\nd) Nombre y domicilio del quejoso\ne) Identificación oficial\n8. Criterios de selección y elegibilidad\nSe establece como prioridad la condición y grado de pobreza de la persona con discapacidad que se definirá con un estudio socioeconómico aplicado al momento del llenado de la solicitud de ingresos con el fin de conocer si reúnen los criterios establecidos en las presentes Reglas de Operación para ser beneficiarios del programa.\nPodrán ser beneficiarias aquellas personas que cumplan con los siguientes criterios:\na) Tener alguna discapacidad permanente que limite, o disminuya sus facultades físicas y/o intelectuales, para realizar sus actividades connaturales;\nb) No contar con ningún otro apoyo económico por parte de la Federación, el Estado o el\nMunicipio;\nc) Ser ciudadano guerrerense con residencia efectiva en el Estado de por lo menos un año anterior a la fecha en que se realiza la solicitud de incorporación al programa;\nd) Vivir situación de desamparo o pobreza;\ne) Tener un ingreso menor a tres salarios mínimos generales vigentes en el Estado de Guerrero;\nf) Declarar con honestidad sus datos personales incluidos en el cuestionario socioeconómico.\ng) No ser derechohabiente del IMSS ni del ISSSTE\nEJERCICIO FISCAL 2013\n8.1. Método de selección de beneficiarios cuenta con el expediente físico completo, éste se captura y digitaliza en el Sistema de Información de\nGuerrero Cumple, que permite conformar la Base de Datos de Solicitantes y se procede de la siguiente manera:\na) Validación. Se hace una validación del expediente en lo que respecta a los datos y veracidad del estudio socioeconómico a fin de determinar si cumple con los criterios generales y las disposiciones especificas establecidas en las presentes Reglas de Operación, de ser así pasa a la siguiente etapa de lo contrario se desecha esa solicitud;\nb) Confrontación. Con la finalidad de verificar si reciben algún apoyo monetario y depurar la base de datos de solicitantes preseleccionados, se confronta con el padrón de: o Oportunidades o Magisterio Federal y Estatal o Gobierno del Estado o DIF\nSi alguno de los solicitantes disfruta de algún beneficio económico Federal, Estatal o Municipal, automáticamente queda fuera del proceso de selección, por incumplir con lo establecido en las presentes\nReglas de Operación.\nLos seleccionados para recibir el apoyo, quedan sujetos a la disponibilidad presupuestal del programa y mientras tanto permanecen en lista de espera.\n9. Mecánica de operación\n9.1. Instancia ejecutora\nLa Instancia Ejecutora y responsable de este Programa será la Coordinación General de los\nProgramas Sociales Guerrero Cumple, misma que realizar las actividades relacionadas con la gestión, operación, administración, comprobación y ejecución de los recursos designados para éste programa.\n9.2. Instancia administrativa y/o normativa\nLa Coordinación General de los Programas Sociales Guerrero Cumple, fungirá como la instancia administrativa y normativa del Programa de Apoyo a los Discapacitados Guerrero Cumple, en caso de desarrollo de sus actividades.\nCuando exista concurrencia de recursos en “modalidad 70/30” el municipio participante realizara acciones de vigilancia, para cuidar que la administración de los recursos aportados, se ejecuten de\nEJERCICIO FISCAL 2013 manera equitativa y con estricto apego a las Reglas de Operación, en este sentido la Coordinación\nGeneral de Programas Sociales Guerrero Cumple, tendrá en todo momento la operatividad del programa y en ningún caso el ayuntamiento podrá atribuirse esta tarea, sino solo aquellas que estén señaladas en las Reglas de operación del Programa, y el Convenio de Colaboración. (ADICIONADO PÁRRAFO SEGUNDO,\nP.O. 06 DE SEPTIEMBRE DE 2013)\n9.3 Delimitación de atribuciones\nLa Coordinación General de Programas Sociales Guerrero Cumple recibirá las solicitudes de ingreso, aplicará el cuestionario socioeconómico, integrará y validará la bese de datos, seleccionará a los beneficiarios y entregará la tarjeta Guerrero Cumple o Vales Guerrero Cumple.\nLos H. Ayuntamientos a través de sus enlaces municipales, apoyarán en la logística para hacer llegar la información del programa a los beneficiarios de su municipio y en la difusión de requisitos para solicitar el apoyo.\nLa Contraloría General del Estado apoyara en la integración de los Comités de Contraloría\nSocial.\nEl municipio que participe en la “modalidad 70/30” está facultado de proponer de manera objetiva e imparcial a las personas que considere susceptibles de ser beneficiadas con el programa, tomando en consideración que será la Coordinación General la encargada de la selección e incorporación de las personas, de acuerdo a la base de datos existente y en función de su estudio socioeconómico, así como lo marcan las Reglas de Operación. (ADICIONADO PÁRRAFO CUARTO, P.O. 06 DE SEPTIEMBRE DE 2013)\n10. Derechos, obligaciones y sanciones de los beneficiarios del programa social\n10.1. Derechos\nLas personas discapacitadas beneficiadas recibirán por parte de la dependencia:\na) La información necesaria, de manera clara y oportuna, para participar en el Programa;\nb) La relación de beneficiarios a través de medios de comunicación impresos y electrónicos;\nc) La Tarjeta Guerrero Cumple o Vale Guerrero Cumple una vez que haya sido seleccionada de acuerdo a los requisitos establecidos en estas Reglas de Operación;\nd) Su apoyo de manera puntual que otorga el Programa de Apoyo a los Discapacitados Guerrero\nCumple;\ne) Un trato digno, respetuoso, oportuno y equitativo;\nf) Atención sin costo alguno;\nEJERCICIO FISCAL 2013\ng) La reserva y privacidad de su información personal.\n10.2. Obligaciones\na) Acudir puntualmente a los lugares en la fecha y hora señalada a recibir su Tarjeta Guerrero\nCumple o sus Vales de Despensa;\nb) Informar los cambios de domicilio y actualizar sus datos y documentación cuando proceda para los efectos a que dé lugar;\nc) Recibir la visita del trabajador social para la certificación de supervivencia y verificación de información proporcionada en el llenado de estudio socioeconómico;\nd) Aplicar de manera prioritaria el apoyo en productos de la canasta básica, medicamentos e insumos médicos;\ne) No hacer uso indebido (venta, préstamo o uso con fines partidistas o electorales, entre otros) de la Tarjeta Guerrero Cumple o de sus Vales Guerrero Cumple;\nf) Participar en las acciones de Contraloría Social para la vigilancia del cumplimiento de Criterios de Elegibilidad de beneficiarios;\ng) Informar ante la Coordinación General, las fallas o irregularidades que se presenten en el uso del mecanismo electrónico o sus Vales de Despensa que les impida recibir su apoyo.\n10.3. Sanciones\n3.5.4.1 Suspensión\na) Cuando el beneficiado no cumpla con las obligaciones señaladas en los incisos b) y c), del apartado 10.2 de las presentes Reglas de Operación;\nb) Los casos no previstos serán sometidos a la consideración de la Coordinación General de\nProgramas Sociales Guerrero Cumple;\nc) Cuando se le detecte como beneficiario de algún otro programa social.\nLos beneficiarios que causen suspensión podrán solicitar su reincorporación al programa, la cual condición de elegibilidad, siempre que exista capacidad presupuestal.\n3.5.4.2. Terminación\na) Cuando el beneficiado o su tutor lo solicite por escrito a la Coordinación General;\nEJERCICIO FISCAL 2013\nb) Cuando el beneficiario o su tutor proporcione información falsa o altere algún documento que se establezca como requisito para el trámite del apoyo, independientemente de las acciones legales a que se pudiera hacer acreedora;\nc) Cuando haga uso indebido de la Tarjeta Guerrero Cumple o de los Vales Guerrero Cumple así como lo marca el inciso e) del apartado 10.2 de las Obligaciones;\nd) Cuando los ingresos familiares no correspondan a lo establecido en el inciso e) del apartado\n8. Criterios de selección y elegibilidad;\ne) Cuando después de citarlo en tres ocasiones diferentes no acuda a recibir su Tarjeta Guerrero\nCumple o sus Vales Guerrero Cumple;\nf) Cuando el beneficiario haya cambiado de domicilio sin notificarlo oportunamente a la\nCoordinación General de Programas Sociales Guerrero Cumple y no se pueda indagar el nuevo domicilio o éste sea fuera del estado de Guerrero;\ng) Por deceso de la beneficiada.\nh) Por término de la vigencia del convenio de colaboración, “Modalidad 70/30”, cuando el beneficiario se haya incorporado bajo esta mecánica. (ADICIONADO, P.O. 06 DE SEPTIEMBRE DE 2013)\nEn caso de los puntos señalados con anterioridad, el Programa de Apoyo a los Discapacitados\nGuerrero Cumple procederá de la siguiente manera:\nEn caso de baja por fallecimiento o por ser beneficiario de otro programa federal, estatal o municipal, se ingresarán las personas que reúnan los requisitos que marca la normatividad y que se encuentren en el padrón de candidatos elegibles.\nAsí mismo cuando opere la “Modalidad 70/30”, el municipio participante tendrá la garantía de que las bajas por las razones expuestas con antelación, se puedan otorgar como altas a las personas de su mismo municipio con la finalidad de mantener su padrón con el mismo número de beneficiarios.\n11. Designación del Tutor.\nSe nombrara tutor según los siguientes criterios:\n1. Que el discapacitado tenga alguna incapacidad que disminuya su inteligencia aunque tenga periodos de lucidez, que no se pueda valer por sí mismo o que sean menores de edad;\n2. Que el discapacitado no dependa económicamente de alguno de sus padres o no viva con ellos.\nEJERCICIO FISCAL 2013\nEl tutor en ningún caso podrá ser menor de edad, para designarlo se requiere que presente la siguiente documentación:\nOriginal y copia\n1. Credencial de identificación oficial (IFE, cédula profesional, pasaporte);\n2. Constancia de Dependencia Económica, y\n3. Comprobante de Domicilio (recibo de agua, luz, teléfono o constancia de la autoridad local)\nLe corresponderá al tutor, al igual que a los padres del discapacitado cuando no se designe tutor, el cumplimiento de las obligaciones marcadas para el beneficiario en éstas Reglas de Operación.\n12. Interpretación\nLa interpretación de las presente Reglas de Operación para efectos administrativos, estarán a cargo de la Coordinación General de Programas Sociales Guerrero Cumple.\nN. DE E. A CONTINUACIÓN SE TRANSCRIBE EL ACUERDO POR EL QUE SE MODIFICA EL\nLOS DISCAPACITADOS GUERRERO CUMPLE PARA EL EJERCICIO FISCAL 2013.\nPrimero.- El presente Acuerdo entrará en vigor al día siguiente de su publicación en el Periódico\nSegundo.- Se derogan las disposiciones que se opongan al presente acuerdo.\nTercero.- Las Reglas de Operación del Programa de Apoyo a los Discapacitados Guerrero\nCumple, para el Ejercicio Fiscal 2013, se publican en su totalidad para mejor entendimiento. (P.O. No. 76, 06",
  "ordenamiento": "REGLA",
  "jurisdiccion": "GUERRERO",
  "fuente_oficial": "DIARIO OFICIAL DE LA FEDERACION",
  "Fecha de Publicación": "25 DE FEBRERO DE 2014",
  "ULTIMA REFORMA PUBLICADA": null,
  "status": "VIGENTE",
  "es_escaneado": false,
  "tiene_tablas": true,
  "materia": [
    "general"
  ]
}