{
  "titulo": "Acuerdo por el Que Se Emiten las Reglas de Operación del Programa de Apoyo A Discapacitados y Se Exp",
  "Contenido": "OPERACIÓN PARA EL EJERCICIO FISCAL 2017\n1. Introducción....................................................................................................................................... 7\n1.1. Antecedentes.................................................................................................................................. 7\n1.2. Alineación Programática................................................................................................................. 8\n1.3. Diagnóstico..................................................................................................................................... 8\n2. Misión y Visión................................................................................................................................... 8\n2.1. Misión............................................................................................................................................. 8\n2.2. Visión.............................................................................................................................................. 9\n3. Dependencia o Entidad Responsable del Programa.......................................................................... 9\n4. Fundamento Legal............................................................................................................................. 9\n5. Objetivos y Alcances.......................................................................................................................... 10\n5.1. Objetivo General............................................................................................................................. 10\n5.2. Objetivos Específicos...................................................................................................................... 10\n5.3. Alcances......................................................................................................................................... 11\n6. Metas Físicas..................................................................................................................................... 11\n7. Programación Presupuestal............................................................................................................... 11\n8. Requisitos y Procedimiento de Acceso.............................................................................................. 12\n8. 1 Difusión........................................................................................................................................... 13\n8.2. Requisitos de Acceso...................................................................................................................... 13\n8.3. Procedimiento de Acceso................................................................................................................ 14\n8.4. Requisitos de permanencia, causales de baja o suspensión temporal............................................ 17\n8.5. Modos de Entrega del Beneficio...................................................................................................... 18\n9. Procedimientos de Instrumentación................................................................................................... 20\nOPERACIÓN PARA EL EJERCICIO FISCAL 2017\n9.1. Operación....................................................................................................................................... 20\n9.2. Gastos de Operación...................................................................................................................... 22\n10. Transparencia.................................................................................................................................. 22\n10.1. Difusión......................................................................................................................................... 22\n10.2. Blindaje Electoral.......................................................................................................................... 23\n10.3. Supervisión y Control.................................................................................................................... 23\n10.4. Mecanismos de Evaluación e Indicadores.................................................................................... 24\n10.4.1 Evaluación.................................................................................................................................. 24\n10.4.2. Indicadores................................................................................................................................ 24\n10.5. Auditoria........................................................................................................................................ 24\n10.6. Recursos no devengados.............................................................................................................. 25\n10.7. Contraloría social.......................................................................................................................... 25\n10.8. Procedimiento de Queja o Inconformidad Ciudadana................................................................... 26\n10.9. Mecanismos de exigibilidad.......................................................................................................... 27\n10.10. Acta de Entrega-Recepción........................................................................................................ 27\n11. Criterios de selección y elegibilidad................................................................................................. 28\n11.1. Método de selección de las y los beneficiarios.............................................................................. 28\n12. Mecánica de Operación................................................................................................................... 29\n12.1. Instancia ejecutora........................................................................................................................ 30\n12.2 Instancia administrativa y/o normativa............................................................................................ 30\n12.3. Delimitación de atribuciones......................................................................................................... 30\nOPERACIÓN PARA EL EJERCICIO FISCAL 2017\n13. Derechos, obligaciones y sanciones de los beneficiarios de programas sociales............................. 31\n13.1 Derechos....................................................................................................................................... 31\n13.2. Obligaciones................................................................................................................................. 31\n13.3. Sanciones..................................................................................................................................... 32\n14. Interpretación................................................................................................................................... 32\n15. Glosario. de Términos...................................................................................................................... 32\n16. Anexos............................................................................................................................................. 32\nOPERACIÓN PARA EL EJERCICIO FISCAL 2017\nTEXTO ORIGINAL.\nAcuerdo por el que se emiten las Reglas de Operación publicado en el Periódico Oficial del\nGobierno del Estado No. 41, el Martes 23 de Mayo de 2017.\nACUERDO POR EL QUE SE EMITEN LAS REGLAS DE OPERACIÓN DEL PROGRAMA DE APOYO A\nDISCAPACITADOS Y SE EXPIDEN SUS REGLAS DE OPERACIÓN PARA EL EJERCICIO FISCAL\n2017.\nGuerrero.- Poder Ejecutivo.\nLICENCIADO HÉCTOR ANTONIO ASTUDILLO FLORES, GOBERNADOR CONSTITUCIONAL\nDEL ESTADO DE GUERRERO, CON FUNDAMENTO EN LOS ARTÍCULOS 90 NUMERAL 2 Y 91\nGUERRERO; 2, 3, 6, 10, 11, 18 APARTADO A FRACCIONES I Y IV Y 23 DE LA LEY ORGÁNICA DE LA\nADMINISTRACIÓN PÚBLICA DEL ESTADO DE GUERRERO NÚMERO 08; 2, 3, 5 Y 15 FRACCIÓN I DE\nLA LEY NÚMERO 817 PARA LAS PERSONAS CON DISCAPACIDAD DEL ESTADO DE GUERRERO;\nEL ANEXO 20-A DEL PROGRAMA DE APOYO A DISCAPACITADOS Y ARTICULOS 21, 22 Y 60 DEL\nDECRETO NÚMERO 426 DEL PRESUPUESTO DE EGRESOS DEL ESTADO DE GUERRERO PARA\nEL EJERCICIO FISCAL 2017, ASI COMO LAS ESTRATEGIAS Y OBJETIVOS ESTABLECIDOS EN EL\nPLAN ESTATAL DE DESARROLLO 2016 - 2021; Y, La Constitución Política de los Estados Unidos Mexicanos, en concordancia con la Convención sobre los Derechos de las Personas con Discapacidad prevé en su artículo 1o., que todas las autoridades, en el ámbito de sus competencias, tienen la obligación de promover, respetar, proteger y garantizar los derechos humanos de conformidad con los principios de universalidad, interdependencia, indivisibilidad y progresividad, asimismo en su artículo 4o., párrafos cuarto y quinto, establece los derechos humanos que aspiración que el Estado debe materializar y garantizar en beneficio de todos los mexicanos.\nQue en el Plan Estatal de Desarrollo 2016-2021 objetivo 3.7. Denominado \"Fortalecer la asistencia social a grupos vulnerables”, en su Estrategia 3.7.1., establece que atenderá integralmente a los grupos de vida. Una de sus líneas de acción tiene como propósito fortalecer programas de desarrollo social encaminados al cuidado, la promoción y diseños de programas de atención específicos para las personas con capacidades diferentes, atendiendo su derecho a una vida digna.\nOPERACIÓN PARA EL EJERCICIO FISCAL 2017\nQue uno de los compromisos del Ejecutivo Estatal con la ciudadanía guerrerense, al asumir y tomar protesta como Gobernador Constitucional, es lograr un Guerrero de tranquilidad, de paz, de justicia, de crecimiento y de empleo, contribuyendo con ello a construir historias de éxitos individuales y colectivos que permitan consolidar el crecimiento económico y estabilidad social.\nQue el Ejecutivo Estatal, está comprometido con ser el principal promotor de acciones y establecer rutas encaminadas a lograr un Estado moderno, inteligente y visionario; de ahí que también es necesario llevar a cabo acciones permanentes que permitan dar cumplimiento a la política del estado mexicano orientada a la reinserción social y económica de las personas mexicanas repatriadas al territorio nacional y particularmente a nuestra entidad federativa, así como sus vínculos sociales y culturales, en aras de que su regreso a México sea digno, productivo y benéfico, en provecho del bienestar familiar y del desarrollo regional y nacional; ello, de conformidad a lo previsto en el acta de instalación del Grupo de Coordinación\nLocal de la estrategia \"Somos Mexicanos”, que tiene como objetivo fundamental brindar a los mexicanos en retorno, una atención integral a través de un modelo interinstitucional y coordinado, para que contribuyan en el corto plazo al desarrollo estatal y nacional.\nQue el Ejecutivo Estatal actualmente ha reconocido las bondades de dichos programas para fortalecer la asistencia social a grupos vulnerables sobre todo a los encaminados al cuidado, promoción y dignificación de las personas con discapacidad guerrerense, por lo que ha decidido dar continuidad al mismo, para coadyuvar así al mejoramiento de la calidad de vida de dichas personas mediante el otorgamiento de un incentivo mensual que les permita adquirir productos de la canasta básica, medicamentos e insumos médicos.\nQue con fecha 01 de abril del 2011, en el Periódico Oficial Gobierno del Estado de Guerrero, número 26, Alcance I, se publicó el Acuerdo por el cual se crea la Coordinación General de Programas\nSociales Guerrero Cumple, como una dependencia directamente adscrita a la oficina del Gobernador del\nEstado; misma que tiene por objeto el coadyuvar para que el Ejecutivo del Estado y las diversas dependencias y entidades de la administración pública estatal, funcionen y apliquen correctamente las acciones y programas en materia de programas sociales.\nQue en virtud de lo anterior y de acuerdo al presupuesto autorizado por parte del congreso del\nEstado de Guerrero a través del Decreto número 426 del Presupuesto de Egresos del Estado de Guerrero monto de 40' 200, 000,00 (Cuarenta millones doscientos mil pesos 00/00 M.N.) para cubrir y ejecutar el una política de gasto público, que permita dar cumplimiento a lo que globalmente prevén los ejes rectores del Plan Estatal de Desarrollo 2016 - 2021. Las políticas encaminadas al desarrollo social, se orientaron a que se otorguen deben contar con: objetividad, equidad, transparencia, publicidad, selectividad y temporalidad.\nOPERACIÓN PARA EL EJERCICIO FISCAL 2017 sus Reglas de Operación, con el objeto de otorgar transparencia y asegurar la aplicación eficiente, eficaz, oportuna y equitativa de los recursos públicos asignados al mismo.\nEn cumplimiento de lo anterior he tenido a bien expedir el siguiente:\nACUERDO POR EL QUE SE EMITEN LAS REGLAS DE OPERACIÓN DEL PROGRAMA DE APOYO A\nDISCAPACITADOS Y SE EXPIDEN SUS REGLAS DE OPERACIÓN PARA EL EJERCICIO FISCAL\n2017.\nArtículo 1. Se crea el Programa de Apoyo a Discapacitados y se expiden sus Reglas de Operación para el Ejercicio Fiscal 2017, el Programa tiene por objeto fortalecer la economía de las personas discapacitadas de bajos recursos que no cuenten con ningún apoyo económico para pensión alimenticia por parte de la federación, el estado o el municipio.\nArtículo 2. Se emiten las Reglas de Operación del Programa de Apoyo a Discapacitados, en las que se establecen los principios de eficiencia, eficacia, oportunidad, equidad y transparencia de los recursos públicos y requisitos que se deben de cumplir para poder acceder ha dicho programa.\nEn las Reglas de Operación del Programa de Apoyo a Discapacitados, se establecerán los criterios y requisitos que se deben de cumplir para poder acceder a dicho programa.\nArtículo 3. La Secretaría de Desarrollo Social tendrá a cargo la implementación, operación, ejecución, evaluación y administración del Programa de Apoyo a Discapacitados, bajo los criterios de objetividad, equidad, transparencia, publicidad, selectividad y temporalidad con estricto apego a la normatividad aplicable apegándose plenamente a las reglas de operación, que a partir del mes de Febrero deja de ser Programa Guerrero Nos Necesita y Apoya a Discapacitados para ser Programa de Apoyo a\nDiscapacitados en función al presupuesto asignado al programa, según Decreto Número 426 del\nPresupuesto de Egresos del Estado de Guerrero para el Ejercicio Fiscal 2017, articulo 21, 22 y 60 fracciones IV, V y el anexo 20-A.\nACUERDO POR EL QUE SE EMITEN LAS REGLAS DE OPERACIÓN DEL PROGRAMA APOYO A\nDISCAPACITADOS PARA EL EJERCICIO FISCAL 2017.\nJustificación del Programa.\nSe considera persona con discapacidad a aquella que padece alguna deficiencia física, mental o sensorial, ya sea de naturaleza permanente o temporal, que limita la capacidad de ejercer una o más actividades esenciales de la vida diaria, debido a una deficiencia o alteración en las funciones o estructuras corporales, ven limitadas sus actividades restringiendo su participación como consecuencia de las condiciones de su entorno.\nSe reconoce que las personas discapacitadas, sufren marginación y discriminación, no sólo por parte de la sociedad, sino también a veces de su familia lo que las orilla a tener además de su discapacidad una baja autoestima.\nOPERACIÓN PARA EL EJERCICIO FISCAL 2017\nEn el Estado de Guerrero, existen personas que tienen algún tipo de discapacidad, ya sea auditiva, intelectual, física y/o mental, no obstante de ser un sector muy vulnerable, pocos son los programas de apoyo que se ofertan para este segmento de la población.\nPor ello, se tiene la imperiosa necesidad de coadyuvar al mejoramiento de la calidad de vida de este sector de la población, mediante el otorgamiento de un apoyo económico mensual para pensión alimenticia.\nEl Programa actualmente denominado Guerrero Nos Necesita y Apoya a Discapacitados se encuentra enmarcado en el Objetivo 3.7 fortalecer la asistencia social a grupos vulnerables, del Eje\nGuerrero Socialmente Comprometido del Plan Estatal de Desarrollo 2016 - 2021.\nPROGRAMA DE APOYO A DISCAPACITADOS\n1. Introducción.\n1.1. Antecedentes.\nQue con fecha 01 de abril del 2011, se publicó en el Periódico Oficial Gobierno del Estado de\nGuerrero, el Decreto (SIC) número 26, Alcance I, el Acuerdo por el cual se crea la Coordinación General de Programas Sociales \"Guerrero Cumple”, como un órgano auxiliar y de apoyo, como una dependencia directamente adscrita a la oficina del Gobernador del Estado; misma que tiene por objeto el coadyuvar para que el Ejecutivo del Estado y las diversas dependencias y entidades de la administración pública estatal, funcionen y apliquen correctamente las acciones y programas en materia de programas sociales.\nQue con fecha 22 de diciembre de 2015, se publicó el Decreto por el cual se reforma el artículo\nPrimero del Acuerdo por el que se crea la Coordinación General de Programas Sociales \"Guerrero Cumple\", órgano directamente adscrito a la oficina del titular del Poder Ejecutivo del Estado, en el Periódico Oficial del Gobierno del Estado de Guerrero, número 102, Alcance II, para modificar el cambio de nombre de\nCoordinación General de Programas Sociales \"Guerrero Cumple\" a Coordinación General de Programas\nSociales \"Guerrero Para Todos\", como un Organismo Auxiliar del Poder Ejecutivo del Estado de Guerrero.\nQue con fecha 22 de diciembre del 2015, se publicó en el Periódico Oficial del Gobierno del Estado, el Decreto (SIC) número 102, Alcance II, por el cual se reforma el artículo Primero del Acuerdo por el que se crea la Coordinación General de Programas Sociales \"Guerrero Cumple\", órgano directamente adscrito\nGeneral de Programas Sociales \"Guerrero Cumple” a Coordinación General de Programas Sociales\nGuerrero número 37 Alcance II, el Acuerdo por el que se crea la Coordinación General de Programas encargado del control, ejecución, seguimiento y evaluación de los Programas Sociales Federales, Estatales\nOPERACIÓN PARA EL EJERCICIO FISCAL 2017 la normatividad aplicable, el propósito de ampliar las facultades a dicha Coordinación General, otorgándole la atribución específica de ejecutarlos, atribución que sumada a las que ya tenía de control, seguimiento y evaluación, para cumplir con el objeto de modernizar y reestructurar la administración pública estatal, de manera más pronta y expedita con sus objetivos que contribuyen a mejorar el desarrollo de nuestra entidad, mediante instituciones ordenadas, que respondan a las necesidades actuales con la prontitud y oportunidad que demanda la sociedad guerrerense, y más los sectores vulnerables como son a los que se encuentran dirigidos.\n1.2. Alineación Programática.\nQue con fecha 27 de diciembre del 2016, se publicó en el Periódico Oficial Gobierno del Estado de Guerrero, el Decreto número 426, del Presupuesto de Egresos del Estado de Guerrero para el Ejercicio\nFiscal 2017, en el cual se señala que todo gasto destinado a una acción, programa u obra pública tendrá que ser justificado, alineado y respaldado por los objetivos, estrategias e indicadores para resultados contenidos en el Plan Estatal de Desarrollo 2016 - 2021, cuyos ejes son los principales rectores en esta administración, correspondiendo al Eje III. Guerrero Socialmente Comprometido; Objetivo 3.7 Fortalecer la\nAsistencia Social a Grupos Vulnerables; Estrategia 3.7.1 Atender Integralmente los Grupos Vulnerables y\nFomentar el Acceso a los Servicios de Protección Social que les Permita Mejorar su Calidad de Vida por ello las políticas encaminadas al desarrollo social, se orientaran a los sectores desprotegidos del Estado y a Programas Sociales.\nEs fundamental que se reconozca que la ética pública funciona en dos direcciones:\na) En cumplimiento de los deberes y responsabilidades que el gobierno tiene y debería de cumplir con la población; y\nb) En el compromiso de la sociedad de participar en la ejecución de las acciones que el gobierno emprenda en relación a las políticas públicas, en este sentido el Programa de Apoyo a Discapacitados, está orientado al Programa Sectorial Desarrollo y Asistencia Social cuyo objetivo es atender a personas vulnerables como son a los discapacitados a través de un ingreso económico que les permita cubrir sus necesidades básicas de alimentación, medicamentos e insumos médicos para personas que carecen de este tipo de apoyo.\n1.3. Diagnóstico.\nEl Estado de Guerrero, de acuerdo a los datos proporcionados por el Instituto Nacional de\nEstadística y Geografía (INEGI), a través de la Encuesta Intercensal 2015, cuenta con una población de 3, 533,251 habitantes, de estos 129,869 presentan alguna discapacidad ya sea motriz, visual, mental entre otras, los cuales representan el 3.7% de la población total, por lo que nuestra población objetivo es de\n129,869 y nuestra población beneficiaria será de 6,388 discapacitados.\n2. Misión y Visión.\n2.1. Misión.\nOPERACIÓN PARA EL EJERCICIO FISCAL 2017\nOtorgar seguridad y bienestar social a las y los discapacitados, sea permanente o temporal a estimular su desarrollo humano y favorecer la integración de este grupo vulnerable a la sociedad.\nOtorgar un apoyo económico, y/o algún otro apoyo en especie o servicios a los discapacitados, que no cuenten con otro beneficio similar y favorecer la integración de este grupo vulnerable a la sociedad.\n2.2. Visión.\nQue los beneficiarios y las beneficiarios del Programa obtengan un ingreso que les ayude de manera positiva, para que puedan seguir desarrollándose ya sea de manera individual, familiar o comunitaria en un marco de derechos sociales.\n3. Dependencia o Entidad Responsable del Programa.\nLa instancia ejecutora y responsable de este Programa será la Secretaría de Desarrollo Social, a través de la Subsecretaría de Promoción y Vinculación Social y la Dirección General de Gestión Social, mismas que realizarán las actividades relacionadas con la gestión, operación y la administración, comprobación y ejecución de los recursos designados para este Programa, corresponderá a la Dirección general de Administración y Finanzas de la Secretaría de Desarrollo Social realizar ante la Secretaría de\nFinanzas y Administración los tramites respectivos.\n4. Fundamento Legal.\na) Constitución Política de los Estados Unidos Mexicanos;\nc) Ley Orgánica de la Administración Pública del Estado de Guerrero Número 08;\nd) Ley Num. 102, para el Desarrollo Social del Estado de Guerrero;\nf) Ley número 454 de Presupuesto y Disciplina Fiscal del Estado de Guerrero;\ng) Ley número 695 de Responsabilidades de los Servidores Públicos del Estado y de los\nMunicipios de Guerrero;\nh) Ley número 817 para las Personas con Discapacidad del Estado de Guerrero;\nOPERACIÓN PARA EL EJERCICIO FISCAL 2017\nj) Decreto número 196 por medio del cual la Sexagésima Primera Legislatura al Honorable\n2016-2021;\nk) Programa Sectorial Desarrollo y Asistencia Social 2016-2021;\nl) Decreto número 426 del Presupuesto de Egresos del Estado de Guerrero para el Ejercicio Fiscal\n2017;\nm) Código de Conducta de la Secretaría de Desarrollo Social del Estado;\nn) Reglamento de la Ley para el Desarrollo Social del Estado de Guerrero Núm. 102. ñ) Acuerdo que Establece los Compromisos para la Estabilidad y Desarrollo del Estado de\nGuerrero.\no) Acta de Instalación del Grupo de Coordinación Local de la Estrategia \"Somos Mexicanos\";\np) Todos aquellos ordenamientos normativos que sean aplicables.\n5. Objetivos y Alcances.\n5.1. Objetivo General.\nEl Programa tiene como objetivo garantizar el otorgamiento de un apoyo económico a las personas con discapacidad, que no cuenten con ningún apoyo de este tipo ya sea federal, del estado o de los municipios, del sector privado o por el gobierno de otros países; además de otorgar beneficios adicionales previstos en las presentes reglas de operación, mismos que estarán sujetos a la disponibilidad presupuestal del programa, en la intención de ofrecer una atención integral como un acto de justicia social a favor de las personas con discapacidad; así mismo coadyuvar en la economía familiar y así gozar de sus derechos humanos y libertades fundamentales en términos iguales con otros en la sociedad, sin discriminación de ningún tipo.\n5.2. Objetivos Específicos.\n1. Mejorar las condiciones de vida de las personas con discapacidad\n2. Ayudar en sus necesidades básicas de salud, como puede ser la compra de algún medicamento, éstos no se encuentren contemplados dentro de la cobertura que ofertan los servicios de salud, por lo que busca contribuir a su derecho a la salud.\n3. Identificar los requerimientos básicos acorde a su tipo de discapacidad para canalizarlos a otras instituciones sociales y brindarles un apoyo adicional.\nOPERACIÓN PARA EL EJERCICIO FISCAL 2017\nProponer espacios de orientación a la familia y la sociedad, educar, concientizar y sensibilizar acerca de la realidad de las personas con discapacidad.\n5.3. Alcances.\nEl Programa de Apoyo a Discapacitados, podrá operar en los 81 municipios del Estado de\nGuerrero, priorizando las regiones indígenas, rurales y urbano marginadas, busca y/o pretende contribuir a que la población que padece alguna discapacidad ya se temporal o permanente, auditiva, intelectual\n(lenguaje); física y/o mental tenga derecho a la salud y a tener una vida digna.\nPor lo que otorgara de manera mensual o bimensual un apoyo de $ 500.00 (Quinientos pesos\n00/100 M.N.) durante el presente ejercicio fiscal a través de la tarjeta electrónica y/o vales dependiendo de la región y/o municipios que cuenten con instituciones bancarias.\n6. Metas Físicas.\nEn el Programa de Apoyo a Discapacitados se busca beneficiar a 6,388 familias de manera directa mejorando su calidad de vida y la de sus núcleos familiares.\n7. Programación Presupuestal.\nComo se ha señalado el origen del financiamiento para el Programa de Apoyo a Discapacitados es por la Modalidad de Inversión Estatal Directa (IED) y están contenidos en el Decreto número 426 del\nPresupuesto de Egresos del Estado de Guerrero, para el Ejercicio Fiscal 2017, por un monto de $ 40, 200,000,00 (Cuarenta millones doscientos mil pesos 00/00 M.N.) en tanto no se convenga con instancias estatales o federales, instituciones educativas u organizaciones no gubernamentales (ONG) no se estará en la disponibilidad de ampliar metas, por lo que el costo por beneficiario es de $ 6,000.00 Seis mil 00/ 100\nM.N.); durante el ejercicio fiscal.\nCalendario de la ejecución del recurso autorizado para el año 2017 para el Programa de\nApoyo a Discapacitados.\nMINISTRACION\nMENSUAL DEL\nFUENTE DEPENDENCIA ENE FEB MAR ABR MAY JUN\nPROGRAMA\nSOCIAL\nPROGRAMA\nIED/17 SDS\nDISCAPACITADOS 2,883,500.00 3,504,500.00 4,226,500.00 4,226,500.00 4,226,500.00 4,226,500.00\nNUMERO DE\nBENEFICIARIOS\nIED/17 SDS 6388 6388 6388 6388 6388 6388\nOPERACIÓN PARA EL EJERCICIO FISCAL 2017\nMINISTRACIONES\nMENSUALES DEL\nSOCIAL\nPROGRAMA\nIED/17 SDS 0.00 0.00\nDISCAPACITADOS 4,226,500.00 4,226,500.00 4,226,500.00 4,226,500.00\nNUMERO DE\nBENEFICIARIOS\nIED/17 SDS 6388 6388 6388 6388 6388 6388\nMINISTRACION TOTAL DE INVERSION\nFUENTE DEPENDENCIA MENSUAL DEL ANUAL POR\nPROGRAMA SOCIAL PROGRAMA SOCIAL\nPROGRAMA APOYO A\nIED/17 SDS $ 40,200,000.00\nDISCAPACITADOS\nACCIONES INVERSIÓN\nDispersión al padrón de beneficiarios por el monto de 500.00 (Quinientos Pesos 00/100 M.N.)\n38,328.000.00\nMensuales. (6,388 Padrón de beneficiarios al 31 de enero del 2017)\nGasto de Operación 3 % 1,206,000.00\nAmpliación de Cobertura para Beneficiarios del Programa, en padrón o acciones 666,000.00\nTOTAL DEL PRESUPUESTO: 40,200,000.00\n8. Requisitos y Procedimiento de Acceso.\nCon el fin de obtener un registro dentro del Padrón Único de Beneficiarios, las y los solicitantes, presentarán los requisitos siguientes:\nOriginal y copia de los documentos siguientes.\n1. Acta de nacimiento del solicitante;\n2. Clave Única del Registro de Población (CURP) al 200%;\n3. Identificación oficial con fotografía (INE, cédula profesional, pasaporte), y en caso de ser menor de edad o estar limitado en sus capacidades intelectuales presentar identificación oficial de la madre, padre o tutor;\n4. Comprobante de domicilio (recibo de agua, luz, teléfono o constancia de la autoridad local);\nOPERACIÓN PARA EL EJERCICIO FISCAL 2017\n5. Constancia de ingreso propio si trabaja o en su defecto constancia de pobreza emitida por la autoridad competente;\n6. Original y copia de diagnóstico médico, avalado por la Secretaría de Salud, DIF u otra institución gubernamental especializada, en el que se especifique el tipo de discapacidad y el grado de la misma.\nLos documentos deberán ser entregados al personal autorizado en los módulos de atención los cuales estarán asignados en la convocatoria para el Programa de Apoyo a Discapacitados, el trámite se realizará de manera personal, en lugar y tiempo que lo requiera el Programa, por lo que no se le dará tramite a los paquetes de solicitudes enviadas por representantes o líderes partidistas. Lo anterior en virtud que a la entrega de los documentos se realizará el llenado de la solicitud de ingreso y estudio socioeconómico de manera personal. Cabe señalar que cuando el solicitante presente discapacidad física o intelectual, el trámite lo podrán realizar los padres o tutores. En el caso de designar a un tutor este o esta se nombrara según los requisitos establecidos en este precepto, mismos que se les entregará un comprobante de posible beneficiaria y/o beneficiario.\nLas y los solicitantes que hayan cumplido en tiempo y forma con los requisitos establecidos en estas Reglas de Operación, estarán condicionados a la disponibilidad presupuestal del Programa.\n8. 1 Difusión.\nLa Secretaría de Desarrollo Social del Estado de Guerrero, (SEDESOL) a través de la\nSubsecretaría de Promoción y Vinculación Social y la Dirección General de Gestión Social, emitirá y publicará la convocatoria en tiempo y forma del Programa de Apoyo a Discapacitados, para el otorgamiento del apoyo de igual forma todo la información que tenga que ver con el programa, se difundirá a través de los diversos medios de comunicación estatales, el uso de los espacios en prensa, radio y televisión así como en la página web: www.guerrero.gob.mx. y/o en la página www.sedesol.guerrero.gob.mx así como la coordinación con los H. Ayuntamientos Municipales para una mejor difusión, así mismo promoverá el programa a través de los medios informativos tales como: radio, televisión, periódicos, carteles y trípticos.\n8.2. Requisitos de Acceso.\nPara tener acceso al Programa deberán cumplir con lo siguiente:\n1. Original y copia del diagnóstico médico, avalado por alguna institución de salud el cual especifique el tipo de discapacidad que presenta, ya sea auditiva, intelectual, física y/o mental\n2. Original y copia de la credencial del Instituto Nacional Electoral (INE), para su cotejo\n3. Original y Copia de la Clave Única de Registro Poblacional (CURP)\n4. Original y copia del Acta de nacimiento, para su cotejo y en caso de no contar con el acta presentar original y copia para su cotejo de los documentos antes señalados.\nOPERACIÓN PARA EL EJERCICIO FISCAL 2017\n5. Presentar constancia de pobreza avalada por alguna autoridad (presidente municipal, comisario)\n6. Original y copia del comprobante de domicilio (agua, luz, teléfono y/o constancia de radicación) para su cotejo\nSe nombrará tutor según los criterios siguientes:\n1. Que la o cuando el discapacitado tenga alguna discapacidad que disminuya su inteligencia aunque tenga periodos de lucidez, que no se pueda valer por sí mismo o que sea menor de edad; y\n2. Que la o cuando el discapacitado dependa económicamente del tutor nombrado.\nLa o el tutor en ningún caso podrá ser menor de edad, para designarle, se requiere que presente la documentación siguiente:\nOriginal y copia:\n1. Credencial de identificación oficial (INE, cédula profesional, pasaporte);\n2. Constancia de dependencia económica; y\n3. Original y copia del comprobante de domicilio (recibo de agua, luz, teléfono o constancia de la autoridad local).\nLe corresponderá a la o el tutor, al igual que a los padres del discapacitado cuando no se designe tutor, el cumplimiento de las obligaciones marcadas para el beneficiario en éstas Reglas de Operación.\n8.3. Procedimiento de Acceso.\nQue la o el beneficiario cumpla con los criterios y requisitos establecidos en las reglas de operación en tiempo y forma, tal como lo señala previa convocatoria, y para saber cuál es el estado que guarda su\nGestión Social del Palacio de Gobierno, Boulevard René Juárez Cisneros número 62, Edificio Norte Planta\nBaja. Col. Ciudad de los Servicios. C.P. 39074 Chilpancingo Guerrero. se definirá con un estudio socio-económico aplicado al momento del llenado de la solicitud de ingresos con beneficiarias o beneficiarios del Programa. criterios:\nOPERACIÓN PARA EL EJERCICIO FISCAL 2017\n1. Tener alguna discapacidad permanente que limite, o disminuya sus facultades físicas y/o intelectuales, para realizar sus actividades connaturales;\n2. No tener más de sesenta y cinco años de edad;\n3. No contar con ningún otro apoyo económico por parte de la Federación, el Estado o el Municipio;\n4. Ser ciudadana o ciudadano guerrerense con residencia efectiva en el Estado de Guerrero de por lo menos un año anterior a la fecha en que se realiza la solicitud de incorporación al Programa;\n5. Vivir situación de desamparo o pobreza;\n6. Tener un ingreso menor a tres salarios mínimos generales vigentes en el Estado de Guerrero;\n7. Declarar con honestidad sus datos personales incluidos en el cuestionario socioeconómico; y\n8. No ser derechohabiente del IMSS ni del ISSSTE.\nCuando la o el solicitante ha culminado exitosamente su proceso de registro en el Programa y se cuenta con el expediente físico completo, éste se captura y digitaliza en el Sistema de Información de la\nSecretaría de Desarrollo social, que permite conformar la Base de Datos de Solicitantes y se procede de la manera siguiente:\na) Validación. Se hace una validación del expediente en lo que respecta a los datos y veracidad del estudio socioeconómico a fin de determinar si cumple con los criterios generales y las disposiciones específicas establecidas en las presentes Reglas de Operación, los datos personales de las personas beneficiarias del programa y la información generada y administrada, se regirá por lo establecido en la Ley número 207 de Transparencia y Acceso a la Información Pública del Estado de Guerrero de ser así pasa a la siguiente etapa de lo contrario se desecha esa solicitud;\nb) Confrontación. Con la finalidad de verificar si reciben algún apoyo monetario y depurar la base de datos de solicitantes preseleccionados, se confronta con el padrón de:\n• Oportunidades;\n• Magisterio Federal y Estatal;\n• DIF.\n• Municipios\nLa o el (SIC) Los solicitantes que ya disfruten de algún beneficio económico federal, estatal o municipal, automáticamente queda fuera del proceso de selección, por incumplir con lo establecido en las presentes Reglas de Operación.\nOPERACIÓN PARA EL EJERCICIO FISCAL 2017\nLas y los (SIC) Los seleccionados para recibir el apoyo, quedan sujetos a la disponibilidad presupuestal del Programa y mientras tanto permanecen en lista de espera.\nLos criterios bajo los cuales la Secretaría incluirá a las personas beneficiarias son:\na) Selectividad: Entendiendo que con este programa se atienden de manera específica un sector de la población que presenta de forma permanente una limitación, pérdida o disminución de sus facultades físicas y/o intelectuales, para realizar sus actividades connaturales, quedando excluidos del mercado laboral y sin el servicio de algún sistema de seguridad social situación que sumada a condiciones de pobreza y discriminación social los ubica como personas vulnerables.\nb) Equidad: Considerando la igualdad social con la que cuentan tanto hombres como mujeres con discapacidad, en la selección de beneficiarios de este programa se otorgan las mismas condiciones, oportunidades y tratamiento para ambos sexos.\nc) Corresponsabilidad: El Gobierno del Estado de Guerrero, a través de la Secretaría de Desarrollo\nSocial, ejecutan el Programa de Apoyo a Discapacitados, contribuyendo así en la protección de dicho grupo vulnerable de la sociedad, evitando que el beneficiario se encuentre en estado de indefensión.\nd) Sustentabilidad: Con el otorgamiento de apoyos económicos a personas con alguna discapacidad, a través de este programa, se busca ayudar a este núcleo social para que mejoren su ingreso familiar.\ne) Convocatoria: La publicación de la convocatoria se hará en los diferentes medios de comunicación, detallando los requisitos y características específicas del Programa, así como la ubicación de los módulos de atención en los 81 municipios a través de sus enlaces.\nf) Información y difusión: se realizará a través de la publicación de la convocatoria en los diversos medios de comunicación estatales, el uso de los espacios en prensa, radio y televisión con los que cuenta el gobierno del Estado así como en la siguiente página web: www.guerrero.gob.mx. y a través de los enlaces municipales de los H. Ayuntamientos.\ng) Registro: Los solicitantes deberán acudir al módulo de atención con su documentación respectiva, con la finalidad de realizarle un estudio socioeconómico que nos permita integrar la totalidad de su expediente. En el caso en que el o la solicitante tenga alguna incapacidad que disminuya su inteligencia, aunque tenga periodos de lucidez, que no se pueda valer por sí mismo o que sea menor de edad, podrá hacer el trámite a través de su padre, madre o tutor, para tal caso se deberá entregar también la documentación señalada en el numeral 8.2. Requisitos de Acceso de las presentes Reglas de Operación.\nh) Integración de la Base de Datos: Una vez obtenidos los expedientes de los solicitantes en los diferentes módulos, se capturan y digitalizan en el Sistema de Información del Padrón Único, que permita conformar la Base de Datos de Solicitantes.\ni) Selección de Beneficiarios: Los solicitantes deberán haber realizado su trámite en tiempo y forma, cumplir con los requisitos generales y las características específicas, presentar una situación de\nOPERACIÓN PARA EL EJERCICIO FISCAL 2017 pobreza, vulnerabilidad o marginación así como ser afiliado al sistema de protección social en salud\n\"Seguro Popular” y a los de población abierta. Lo anterior en base a la valoración y el análisis de la información obtenida del cuestionario socioeconómico, que permite determinar los parámetros como es en el caso de derechohabientes del IMSS y del ISSSTE.\nj) Confronta: Con la finalidad de verificar si reciben algún apoyo monetario y actualizar la base de datos de solicitantes preseleccionados, se confronta con el padrón de otros programas sociales con presencia en el Estado de Guerrero; ello, en estricto cumplimiento al compromiso número 15 del Acuerdo que Establece los Compromisos para la Estabilidad y Desarrollo del Estado de Guerrero, el cual contempla acciones de ahorro en servicios personales y gasto operativo de la administración estatal, acciones en materia de transporte público y el impulso de las actividades empresariales, para que más guerrerenses en condiciones de pobreza puedan gozar del beneficio de algún programa social.\nk) Beneficiarios: Una vez que se cuenta con el expediente completo, así como la validación del\nConsejo Estatal, y los solicitantes han culminado exitosamente su proceso de selección, cumpliendo con los criterios generales y las disposiciones específicas al respecto, establecidas en estas Reglas de\nOperación, se procede a notificarle su condición de beneficiario o beneficiaria.\nl) Notificación: Se realizará a través de la publicación del listado de beneficiarios en los distintos medios de comunicación de mayor circulación, en la página web: www.guerrero.gob.mx y en las instalaciones de los 81 Ayuntamientos Municipales.\nm) Entrega: Se realizará la entrega del apoyo económico a cada uno de los beneficiarios, previo aviso oportuno a través de las autoridades de su localidad.\nn) Verificación: Se realizarán las visitas domiciliares, con la finalidad de verificar la existencia de los beneficiarios y constatar las condiciones de vida de los mismos, en casos especiales en donde el beneficiario por su condición, tenga dificultad para trasladarse. Este último proceso se hará para mantener actualizado nuestro padrón y hacerle llegar el beneficio a las personas que más necesitan de él, cumpliendo con el objetivo del Programa.\nPública del Estado de Guerrero.\n8.4. Requisitos de permanencia, causales de baja o suspensión temporal.\na) Cuando los beneficiarios no cumplan con las obligaciones señaladas en el apartado 8.2., de las presentes reglas de operación;\nb) Los casos no previstos serán sometidos a consideración del Consejo Estatal y la Secretaría de\nDesarrollo Social.\nOPERACIÓN PARA EL EJERCICIO FISCAL 2017\nc). Cuando se le detecte como beneficiaria o beneficiario de algún otro programa Social.\nLos beneficiarios que causen suspensión podrán solicitar su reincorporación al programa, la cual condición de elegibilidad, siempre que exista capacidad presupuestal y cumplan con la entrega de toda la documentación solicitada\na) Cuando el beneficiario o bien su o (SIC) tutor lo solicite por escrito a la Secretaría de Desarrollo\nSocial;\nb) Cuando el beneficiario tenga más de sesenta y cinco años de edad; tendrá que hacer su trámite correspondiente para ingresar al programa de adultos mayores del Gobierno del Estado;\nc) Cuando el beneficiario no acuda a recibir su pago por más de 2 meses consecutivos;\nd) Cuando el beneficiario o bien su tutor proporcione información falsa o altere algún documento que se establezca como requisito para el trámite del apoyo, independientemente de las acciones legales a que se pudiera hacer acreedor;\ne) Cuando los ingresos familiares no correspondan a lo establecido en el inciso a) del apartado\n11. Criterios de selección y elegibilidad;\ne) Cuando la o el beneficiario haya cambiado de domicilio sin notificarlo oportunamente a la\nSecretaría de Desarrollo Social y no se pueda indagar el nuevo domicilio o éste sea fuera del Estado de\nGuerrero;\ng) Por deceso de la o el beneficiario.\nEn caso de no cumplir con algunos de los puntos señalados con anterioridad, la Secretaría de\nDesarrollo Social, procederá a dar de baja a los beneficiarios de manera definitiva cuando ya no exista capacidad presupuestal, o de lo contrario podrá hacer una reasignación ingresando en su lugar a las candidatos elegibles.\n8.5. Modos de Entrega del Beneficio. personalidad de la o el beneficiario. Dicho apoyo se entregará como se señala a continuación: discapacitadas que cumplan con los requisitos y características específicas del Programa. LA CUAL\nINSUMOS MÉDICOS.\nOPERACIÓN PARA EL EJERCICIO FISCAL 2017\nEN AQUELLOS LUGARES DONDE LA TARJETA NO TENGA COBERTURA, EL PAGO SE\nREALIZARÁ A TRAVÉS DE VALES DE DESPENSA, SIEMPRE Y CUANDO EXISTA CONVENIO\nESPECÍFICO Y VIGENTE CON ALGUNA EMPRESA DEDICADA A LA EMISIÓN DE VALES. LOS\nVALES SOLO PERMITIRÁN ADQUIRIR PRODUCTOS DE LA CANASTA BÁSICA.\nPERIODICIDAD DEL APOYO MONTO VIGENCIA\nPermanente, siempre y cuando la o el\n$500.00 (Quinientos\nMensual beneficiario siga cumpliendo las obligaciones y pesos 00/100 M.N.) características específicas del Programa\nA través de Vales de Despensa:\nPERIODICIDAD DEL APOYO MONTO VIGENCIA\nPermanente, siempre y cuando la o el\n$1000.00(Mil pesos\nBimestral beneficiario siga cumpliendo las obligaciones y\n00/100 M.N.) características específicas del programa.\nCon el fin de obtener un registro dentro del Padrón Único de Beneficiarios, las y los solicitantes, presentarán en original y copia los documentos siguientes:\n1. Acta de nacimiento del solicitante;\n2. Clave Única del Registro de Población (CURP) al 200%;\n3. Identificación oficial con fotografía (INE, cédula profesional, pasaporte), y en caso de ser menor de edad o estar limitado en sus capacidades intelectuales, presentar identificación oficial de la madre, padre o tutor;\n4. Comprobante de domicilio (recibo de agua, luz, teléfono o constancia de la autoridad local);\n5. Constancia de ingreso propia si trabaja o en su defecto constancia de pobreza emitida por la autoridad competente;\n6. Original y copia de certificación de su diagnóstico médico avalado por la Secretaría de Salud, DIF u otra institución gubernamental especializada, en el que se especifique el tipo de discapacidad y el grado de la misma. el programa, el trámite se realizará de manera personal, en lugar y tiempo que lo requiera el programa, por lo que no se le dará tramite a los paquetes de solicitudes enviadas por representantes o líderes partidistas;\nOPERACIÓN PARA EL EJERCICIO FISCAL 2017 lo anterior, en virtud de que al momento de recibir la documentación se hará el llenado de la solicitud de ingreso y estudio socioeconómico y únicamente podrá realizarlo la o el solicitante. aunque tenga periodos de lucidez, que no se pueda valer por sí mismo o que sean menores de edad, podrán hacer el trámite a través de sus padres o tutores.\nLas y los solicitantes que hayan cumplido en tiempo y forma con los requisitos establecidos en estas reglas de operación, estarán condicionados a la disponibilidad presupuestal del programa, así como al dictamen técnico que efectúe la Secretaría de Desarrollo Social para obtener el beneficio directo.\n9. Procedimientos de Instrumentación.\n9.1. Operación.\nSe otorgará un apoyo económico para pensión alimenticia consistente en $500.00 (Quinientos\nPesos 00/100 M.N.) mensuales o $1,000.00 (Mil Pesos 00/100 M.N.) bimestrales de manera individual y directa para las personas con discapacidad que cumplan exitosamente el proceso de selección sujetándose en todo momento a la capacidad presupuestal del programa.\na) Dependencias que colaborarán con el Programa:\n1. Secretaría de Desarrollo Social;\n2. Desarrollo Integral de la Familia Guerrero (DIF);\n3. Secretaría de Salud;\n4. Secretaría de Contraloría y Transparencia Gubernamental;\n5. H. Ayuntamientos;\n6. Consejo Estatal para la Integración Social de las Personas con Discapacidad; y\n7. Consejo Consultivo de las Personas con Discapacidad.\nPara la correcta aplicación del programa, éste se sujeta a las presentes reglas de operación, y de de operación. de Gestión Social.\nOPERACIÓN PARA EL EJERCICIO FISCAL 2017\nCARGO AREA FUNCIONES\n1. Gestionar los recursos económicos para la ejecución del programa.\nSecretarla de 2 Autorizar las tareas operativas para la correcta ejecución del programa.\nDesarrollo 3. Coordinar las estrategias para la correcta aplicación del programa.\nSocial.\n1 Planificar el programa de verificación del Padrón de Beneficiarios.\n2. Planificar el programa de evaluación de resultados\n3. Organizar, dirigir y controlar la operación de los programas sociales, así como los tiempos y modos de entrega de los apoyos a los beneficiarios con la colaboración de las áreas administrativas correspondientes\n4. Propiciar el cumplimiento de las metas, acciones y objetivos de los programas y proyectos ejecutados\n5. Fomentar el aumento de la productividad, eficacia, eficiencia de los mecanismos y herramientas necesarias para la operatividad del programa\n6. Diseñar las acciones de contraloría social que han de Ejecutarse a la par con el programa, bajo la autorización de la Secretaría de Desarrollo\nSocial.\n7. Elaborar los lineamientos de los Comités de Contraloría Social.\nDirección 8. Diseñar y aplicar las acciones y mecanismos que aseguren una\nGeneral de cobertura estatal de inscripción de aspirantes a los beneficios de los\nGestión Social. programas sociales ejecutados.\n9. Efectuar las actividades de trabajo de campo en coordinación con las demás áreas administrativas\n10. Definir estrategias de logística que permitan el correcto desarrollo de las actividades en los 81 municipios de la entidad.\n11. Realizar el estudio socioeconómico e inscribir en los programas sociales de la Secretaría de Desarrollo Social a la población de la entidad que así lo solicite, siempre y cuando se cumpla con los requisitos y criterios de elección de dichos programas.\n12 Coordinar y verificar el buen funcionamiento de los módulos de atención instalados en las diferentes regiones del Estado\n13. Establecer y coordinar un sistema de control interno en lo relacionado a la entrega y recepción de los formatos de solicitud.\n14. Elaborar las reglas de operación del programa\n16. Elaborar los contratos de coordinación que se requieran para la ejecución del programa\n1. Elaborar presupuesto de egresos del año posterior.\n2. Solicitar ante la Secretaría de Planeación y Desarrollo Regional el oficio de autorización de recursos para el Programa de Discapacitados.\nDirección 3. Solicitar la liberación de recurso ante la Secretaría de Finanzas y\nGeneral de Administración para el Programa de Discapacitados.\nAdministración y 4. Elaborar comprobación por el monto ejecutado al programa y\nFinanzas presentarla ante la Dirección General de Contabilidad Gubernamental.\nOPERACIÓN PARA EL EJERCICIO FISCAL 2017\nb) Determinación y precisión de actividades:\nLa Secretaría de Desarrollo Social del Estado de Guerrero, (SEDESOL) llevará a cabo actividades que permitan cristalizar los objetivos del programa, entre las cuales se precisan las siguientes:\na) Participar en el curso de contraloría social en programas sociales impartido por la Secretaría de\nContraloría y Transparencia Gubernamental;\nb) Recepcionar las solicitudes de aspirantes al beneficio social del programa;\nc) Capturar las solicitudes para integrar la demanda ciudadana;\nd) Revisar los requisitos e integración de expedientes de beneficiarios de manera individual;\ne) Autorizar el apoyo;\nf) Generar el padrón de beneficiarios del programa;\ng) Realizar el seguimiento y evaluación del programa;\nh) Realizar las comisiones oficiales e institucionales; y\ni) Se realizarán cruces de padrones con diversas dependencias de los tres niveles de gobierno, con la finalidad de no duplicar apoyos.\nAsí mismo la información adicional generada y administrada, se regirá por lo establecido en la Ley número 207 de Transparencia y Acceso a la Información Pública del Estado de Guerrero, todos los formatos y los trámites a realizar por los posibles beneficiarios son gratuitos.\n9.2. Gastos de Operación.\nDel total de recursos autorizados al Programa de Apoyo a Discapacitados y en base al artículo 47 fracción I de la Ley de Coordinación Fiscal, se aplicara hasta un 3% del presupuesto asignado, para gastos de operación, destinado a las diversas acciones asociadas con la planeación, operación, supervisión, contraloría social y evaluación o asesoría externa del Programa.\n10. Transparencia.\n10.1. Difusión.\nLa Secretaría de Desarrollo Social del Estado de Guerrero, (SEDESOL), a través del Programa, que están en una situación de desventaja social. En ella, obligatoriamente, se darán a conocer cuando menos el objetivo del programa, los requisitos que deberán cumplir las y los aspirantes, la dirección del\nOPERACIÓN PARA EL EJERCICIO FISCAL 2017 módulo de información, es Planta Baja del Edificio Norte ubicado en el Palacio de Gobierno, cita en\nBoulevard René Juárez Cisneros Numero 62, Ciudad de los Servicios C.P. 39075, en Chilpancingo de los\nBravo, Guerrero para solicitar informes, la fecha de recepción de solicitudes, la fecha y forma de entrega\nLa información referente al Programa de Apoyo a Discapacitados, se podrá consultar de manera permanente en el Portal Oficial del Gobierno del Estado de Guerrero, así como el padrón de beneficiarios actualizado y/o en la página http//www. sedesol.guerrero.gob.mx\n10.2. Blindaje Electoral.\nComo estrategia de blindaje electoral, la papelería, documentación oficial, así como la publicidad y promoción del programa deberán incluir alguna de las siguientes leyendas:\n\"Este Programa es de carácter público, no es patrocinado ni promovido por partido político alguno y sus recursos provienen de los impuestos que pagan todos los contribuyentes. Está prohibido el uso de este programa con fines políticos, electorales, de lucro y otros distintos a los establecidos. Quien haga uso indebido de los recursos de este programa, será sancionado de acuerdo con la ley aplicable y ante la autoridad competente\".\nEn cuanto a la publicidad en medios electrónicos, impresos, complementarios o de cualquier otra índole, vinculada a los programas de comunicación social se deberá incluir la siguiente leyenda:\n\"Este Programa es público y queda prohibido su uso con fines partidistas o de promoción personal”.\n10.3. Supervisión y Control.\nSeguimiento.\nCon el propósito de mejorar la operación del programa, la Secretaría de Desarrollo Social y para la mejora de éste, integrará informes a través de la Dirección General de Gestión Social y además llevará a cabo el seguimiento de los recursos asignados al programa.\nControl.\nEl control y seguimiento del programa se hará a través de la Dirección General de Gestión Social, elegibilidad de los solicitantes y beneficiarios, ejecutar las visitas domiciliadas para verificar la veracidad de la información proporcionada por las y los beneficiarios y dar seguimiento a las denuncias recibidas.\nArmonización Contable (CONAC) y con base en los indicadores de resultados previstos en las Reglas de\nOPERACIÓN PARA EL EJERCICIO FISCAL 2017\nOperación. Dichos informes se deberán presentar a más tardar a los quince días hábiles posteriores a la terminación de cada trimestre.\n10.4. Mecanismos de Evaluación e Indicadores.\n10.4.1 Evaluación.\na) Evaluación interna.\nLa evaluación interna del Programa se hará a través de la Dirección General de Gestión Social, dependiente de la Secretaría de Desarrollo Social del Estado de Guerrero (SEDESOL), quien evaluará internamente los resultados de acuerdo al número de beneficiarias y beneficiarios y el porcentaje de cobertura, para conocer el cumplimiento de las metas propuestas.\nb) Evaluación externa.\nLa Secretaría de Desarrollo Social del Estado de Guerrero (SEDESOL), podrá realizar una evaluación de resultados de carácter externo del programa sujeto a las reglas de operación, para lo cual tendrá la facultad de designar a la instancia que realizará dicho análisis.\nLas evaluaciones externas que se realicen al programa serán coordinadas por la Secretaría de\nContraloría y Transparencia Gubernamental.\n10.4.2. Indicadores.\nPara el seguimiento y evaluación del programa se utilizarán los indicadores que corresponde al número de beneficiarias que recibieron el apoyo.\nLa Secretaría de Desarrollo Social del Estado de Guerrero (SEDESOL), a través de la Dirección\nGeneral de Gestión Social será responsable de compilar e integrar un reporte estatal de resultados tomando como base las acciones desarrolladas por el Programa de Apoyo a Discapacitados utilizando la\nMetodología del Marco Lógico (MML), que indiquen el número de beneficiarios atendidas al finalizar el ejercicio fiscal.\n10.5. Auditoria.\nEl ejecutor del programa será el responsable de la supervisión directa de las acciones, así como\nEn caso de ser necesario, el recurso asignado a éste programa, será verificado por la Secretaría de Contraloría y Transparencia Gubernamental. Como resultado de las acciones de auditoría que se lleven a cabo, la instancia auditora mantendrá un seguimiento interno que le permita emitir informes de las revisiones efectuadas.\nOPERACIÓN PARA EL EJERCICIO FISCAL 2017\n10.6. Recursos no devengados.\nEl presupuesto autorizado del programa que no se hubiese aplicado a los fines autorizados, y los recursos que por cualquier motivo no estuviesen devengados al 31 de diciembre de cada ejercicio fiscal, instancia normativa del ejercicio y control del gasto público.\n10.7. Contraloría social.\nCon la finalidad de transparentar, y aplicar de manera clara, el control de los recursos, y así tener una buena vigilancia y evaluación de las actividades del programa, la Secretaría de Contraloría y\nTransparencia Gubernamental, supervisara la gestión, y que el manejo de dicho recurso, se realice en términos de transparencia, eficacia, legalidad y honradez.\n1. Informar a la ciudadanía acerca del apoyo y su costo a nivel de obra, acción, nombre de los beneficiarios, derechos y obligaciones de los mismos;\n2. Capacitar a los beneficiarios para que se constituya una instancia de vigilancia y evaluación social;\n3. Establecer espacios de comunicación (reuniones vecinales, atención directa a beneficiarios, etc.);\n4. Promover la integración de organizaciones de la sociedad civil en acciones de contraloría social;\n5. Instrumentar mecanismos de recepción y atención de quejas y denuncias. El órgano estatal de control verificará en lo correspondiente, la realización de dichas acciones.\nLos Comités de Contraloría Social podrán constituirse por beneficiarios, en aquellos casos en que su discapacidad no les permita valerse por sí solos podrán hacerse representar a través de sus padres o tutor.\nLos medios que se utilizarán para la propagación y divulgación de los beneficios del programa, como acción de contraloría social serán los siguientes:\n• Auditivos.- Radio;\n• Impresos y escritos.- Diarios, trípticos;\n• Audiovisuales.- Televisión;\n• Multimedia.- Internet y televisión digital;\n• Telecomunicación.- Teléfonos fijos y celulares; y\n• Grupales.- Reuniones informativas.\nOPERACIÓN PARA EL EJERCICIO FISCAL 2017\nPara impulsar la realización de las actividades de contraloría social, se brindará capacitación y\nComités de Contraloría Social y beneficiarios del mismo.\nLa Secretaría de Desarrollo Social, a través de la Dirección General de Gestión Social con apoyo de la Secretaría de Contraloría y Transparencia Gubernamental a través de la Dirección General de\nContraloría Social, serán las encargadas de brindar a los Coordinadores Regionales y enlaces municipales, capacitación en materia de Contraloría Social.\nLos Coordinadores Regionales, serán los que de manera directa asesorarán a los integrantes de los Comités de Contraloría Social para promover la participación social y realizar actividades de supervisión y vigilancia.\nLos integrantes del Comité, tendrán que levantar de manera bimensual cédulas de vigilancia y al final de cada ejercicio fiscal deberán elaborar un informe anual.\nLos integrantes de los Comités de Contraloría Social tendrán cargos honoríficos.\n10.8. Procedimiento de Queja o Inconformidad Ciudadana.\nLas y Los solicitantes así como las y los beneficiados pueden acudir en cualquier momento a las oficinas de la Secretaría de Desarrollo Social ubicadas en Palacio de Gobierno, Boulevard René Juárez\nCisneros Núm. 62, Edificio Norte Planta Baja, Col. Ciudad de los Servicios, C.P. 39074. Chilpancingo, Guerrero, para expresar sus comentarios sobre la implementación y funcionamiento del programa, así como las quejas y denuncias sobre cualquier hecho, acto u omisión que produzca o pueda producir daños al ejercicio de sus derechos establecidos en las presentes reglas de operación.\nLas quejas, inconformidades y denuncias de la ciudadanía general derivadas de alguna irregularidad en la operación del programa deberán realizarse por escrito o por comparecencia del interesado por la presunción de actos de corrupción o desvío de recursos por parte de servidores públicos de la Secretaría de Desarrollo Social, se captarán en la Secretaría de Contraloría y Transparencia\nGubernamental ubicada en Boulevard René Juárez Cisneros No. 62 ciudad de los Servicios, C.P. 39074\nPalacio de Gobierno número telefónico 01 800 999 0999. Los medios por los cuales podrán presentarse quejas, y denuncias ciudadanas son las siguientes:\na) Por escrito;\nb) Por comparecencia del interesado;\nc) Por correo electrónico; y,\nd) Vía telefónica.\nLa o El (SIC) denúnciate, o quejoso deberá proporcionar los datos siguientes:\na) Nombre del servidor(es) público(s);\nb) Dependencia de adscripción;\nOPERACIÓN PARA EL EJERCICIO FISCAL 2017\nc) Objeto de la denuncia;\nd) Nombre y domicilio del quejoso; e,\ne) Identificación oficial.\n10.9. Mecanismos de exigibilidad.\nLos casos en los que se podrán exigir los derechos por incumplimiento o por violación de los mismos pueden ocurrir en al menos los casos siguientes:\n1) Cuando una persona solicitante cumpla con los requisitos y criterios de inclusión para acceder a determinado derecho (garantizado por un programa social) y exija a la autoridad administrativa ser derechohabiente del mismo.\n2) Cuando la persona derechohabiente de un programa social exija a la autoridad que se cumpla con dicho derecho de manera integral en tiempo y forma, como lo establece el programa.\n3) Cuando no se pueda satisfacer toda la demanda de incorporación a un programa por restricción presupuestal, y éstas exijan que las incorporaciones sean claras, transparentes, equitativas, sin favoritismos, ni discriminación.\nEn el supuesto que la Secretaría no atendiera dichas situaciones, la Secretaría de Contraloría y\nTransparencia Gubernamental del Gobierno del Estado es el órgano competente para conocer las denuncias de violación, e incumplimiento de derechos en materia de desarrollo social. Así mismo los derechos, obligaciones y sanciones están plasmadas en el numeral 13 de las presentes reglas de operación.\n10.10. Acta de Entrega-Recepción\nPara cada una de las obras o acciones terminadas entregadas por los ejecutores, se elaborará un acta de entrega-recepción, en la que participará la dependencia ejecutora de la obra o acción, el orden de gobierno y/o la comunidad beneficiada.\nA dicho acto, deberán invitarse oportunamente a la Secretaría de Planeación y Desarrollo Regional de entrega-recepción, la comunidad o el orden de gobierno que recibe las o acciones, deberá hacer explícito en el acta el compromiso de vigilar su adecuada operación.\nEn el caso de que la Secretaría de Planeación y Desarrollo Regional (SEPLADER) detecte información faltante, informará a la instancia ejecutora detalladamente y por escrito. En este caso, la la información y documentación faltante, en un plazo que no exceda 10 días hábiles contados a partir de la recepción del comunicado de la Secretaría de Planeación y Desarrollo Regional (SEPLADER).\nOPERACIÓN PARA EL EJERCICIO FISCAL 2017\nDe presentarse alguna irregularidad en las acciones, quien la reciba, podrá firmar el acta de manera condicionada y anotar en ella las razones de dicha inconformidad y además, se indicarán los plazos acordados para solventar las observaciones a que dé lugar dicha inconformidad.\nEl Acta de entrega-Recepción forma parte del expediente de la acción y constituye la prueba documental que certifica la existencia de las acciones que realiza el programa, quedando bajo el resguardo de la Secretaría de Desarrollo Social.\n11. Criterios de selección y elegibilidad\nSe establece como prioridad la condición y grado de pobreza de la persona con discapacidad que se definirá con un estudio socio-económico aplicado al momento del llenado de la solicitud de ingresos con el fin de conocer si reúnen los criterios establecidos en las presentes Reglas de Operación para ser beneficiarias o beneficiarios del Programa.\nPodrán ser beneficiarias aquellas personas que cumplan con los siguientes criterios:\na) Tener alguna discapacidad permanente que limite, o disminuya sus facultades físicas y/o intelectuales, para realizar sus actividades connaturales;\nb) No tener más de 65 años de edad;\nc) No contar con ningún otro apoyo económico por parte de la Federación, el Estado o el Municipio;\nd) Ser ciudadana o ciudadano guerrerense con residencia efectiva en el Estado de Guerrero de por lo menos un año anterior a la fecha en que se realiza la solicitud de incorporación al Programa;\ne) Vivir situación de desamparo o pobreza;\nf) Tener un ingreso menor a tres salarios mínimos generales vigentes en el Estado de Guerrero;\ng) Declarar con honestidad sus datos personales incluidos en el cuestionario socioeconómico; y\nh) No ser derechohabiente del IMSS ni del ISSSTE.\n11.1. Método de selección de las y los beneficiarios. cuenta con el expediente físico completo, éste se captura y digitaliza en el Sistema de Información de la la manera siguiente:\na) Validación. Se hace una validación del expediente en lo que respecta a los datos y veracidad\nOPERACIÓN PARA EL EJERCICIO FISCAL 2017 específicas establecidas en las presentes Reglas de Operación, de ser así pasa a la siguiente etapa de lo contrario se desecha esa solicitud;\nb) Confrontación. Con la finalidad de verificar si reciben algún apoyo monetario y depurar la base de datos de solicitantes preseleccionados, se confronta con el padrón de:\n• Oportunidades;\n• Magisterio Federal y Estatal;\n• Gobierno del Estado;\n• DIF; y\n• H. Ayuntamientos.\nLa o el solicitante que ya disfrute de algún beneficio económico Federal, Estatal o Municipal, automáticamente queda fuera del proceso de selección, por incumplir con lo establecido en las presentes\nReglas de Operación.\nLas y los seleccionados para recibir el apoyo, quedan sujetos a la disponibilidad presupuestal del\nPrograma y mientras tanto permanecen en lista de espera.\n12. Mecánica de Operación.\nMESES\nACTIVIDADES\nEne. Feb. Mar. Abril Mayo Jun. Jul. Ago. Sep. Oct. Nov. Dic.\nCurso de contraloría social\nRecepción de solicitudes.\nCaptura de solicitudes.\nRevisión e integración de expedientes\nAutorización del apoyo.\nCaptura del padrón de\nBeneficiarios\nCruce de Padrón con otros programas\nComisiones oficiales.\nSeguimiento y evaluación. dependiente de la Secretaría de Desarrollo Social del Estado de Guerrero, (SEDESOL), quien evaluará los resultados de acuerdo al número de beneficiarios y el porcentaje de cobertura, para conocer el cumplimiento de las metas propuestas; en tal sentido y una vez concluida la evaluación del programa, se atenderá y dará seguimiento a los aspectos susceptibles de mejora.\nOPERACIÓN PARA EL EJERCICIO FISCAL 2017\nLa Secretaría de Desarrollo Social del Estado de Guerrero, (SEDESOL), fungirá como la instancia administrativa y normativa del programa, en caso de requerirlo podrá contar con el apoyo de los organismos que considere importantes para el exitoso desarrollo de sus actividades. su ejecución y garantizar que los mecanismos de funcionamiento y administración faciliten tanto la obtención de información como la evaluación de los beneficios económicos y sociales.\nLa Secretaría de Desarrollo Social del Estado de Guerrero, (SEDESOL), podrá realizar una evaluación de resultados de carácter externo del programa sujeto a las Reglas de Operación, para lo cual tendrá la facultad de designar a la instancia que realizará dicho análisis.\nLas evaluaciones externas que se realicen al Programa serán coordinadas por la Secretaría de\nContraloría y Transparencia Gubernamental.\n12.1. Instancia ejecutora.\nLa instancia ejecutora y responsable de este Programa será la Secretaría de Desarrollo Social, misma que realizará las actividades relacionadas con la gestión, operación, administración, comprobación y ejecución de los recursos designados para este Programa, así como la selección para altas, bajas y reasignación de beneficiarios.\n12.2 Instancia administrativa y/o normativa.\nLa Secretaría de Desarrollo Social, fungirá como la instancia administrativa y normativa del\nPrograma Guerrero Nos Necesita y apoya (SIC) a Discapacitados, en caso de requerirlo podrá contar con el apoyo de los organismos que considere importantes para el exitoso desarrollo de sus actividades.\n12.3. Delimitación de atribuciones.\nLa Secretaría de Desarrollo Social, recibirá las solicitudes de ingreso, aplicará el cuestionario socioeconómico, integrará y validará la base de datos, seleccionará a los beneficiarios y entregará el apoyo correspondiente al Programa.\nLos H. Ayuntamientos a través de sus enlaces municipales, apoyarán en la logística para hacer para solicitar el apoyo.\nComités de Contraloría Social.\nOPERACIÓN PARA EL EJERCICIO FISCAL 2017\n13. Derechos, obligaciones y sanciones de los beneficiarios de programas sociales.\n13.1 Derechos.\nLas personas discapacitadas beneficiadas recibirán por parte de la dependencia:\na) La información necesaria, de manera clara y oportuna, para participar en el Programa;\nb) La relación de las y los beneficiarios a través de medios de comunicación impresos y electrónicos;\nc) Su apoyo económico del Programa Guerrero Nos Necesita y Apoya a Discapacitados;\nd) Un trato digno, respetuoso, oportuno y equitativo;\ne) Atención sin costo alguno; y\nf) La reserva y privacidad de su información personal.\n13.2. Obligaciones.\nLas personas discapacitadas beneficiarias deberán:\na) Acudir puntualmente a los lugares en la fecha y hora señalada a recibir su apoyo económico;\nb) Informar los cambios de domicilio y actualizar sus datos y documentación cuando proceda para los efectos a que dé lugar;\nc) Recibir la visita de la o el Promotor de Gestión Social para la certificación de supervivencia y verificación de información proporcionada en el llenado de estudio socioeconómico;\nd) Aplicar de manera prioritaria el apoyo en productos de la canasta básica, medicamentos e insumos médicos;\ne) No hacer uso indebido del beneficio del Programa;\nf) Participar en las acciones de contraloría social para la vigilancia del buen funcionamiento del\nPrograma;\ng) Informar ante la Secretaría de Desarrollo Social, las fallas o irregularidades que se presenten en el uso del mecanismo electrónico o sus vales de despensa que les impida recibir su apoyo.\nOPERACIÓN PARA EL EJERCICIO FISCAL 2017\n13.3. Sanciones\na) Cuando las y los beneficiados no cumplan con las obligaciones señaladas en el apartado 8.2. de las presentes Reglas de Operación;\nb) Cuando se detecte como beneficiaria o beneficiario de algún otro programa social.\nc) Los casos no previstos serán sometidos a consideración de la Secretaría de Desarrollo Social.\nLas y Los beneficiarios que causen suspensión podrán solicitar su reincorporación al Programa, la cual estará sujeta a una nueva evaluación de sus condiciones socioeconómicas que permita determinar su condición de elegibilidad, siempre que exista capacidad presupuestal.\n14. Interpretación.\nLa interpretación de las presentes reglas de operación, para efectos administrativos, estará a cargo de la Secretaría de Desarrollo Social como la dependencia responsable así como de la Secretaría de Planeación y Desarrollo Regional y del Órgano Estatal de Control, en el ámbito de sus respectivas competencias.\n15. Glosario. de Términos.\nApoyo: Hace referencia a los $500.00 (Quinientos Pesos 00/ 100 M.N.) mensuales o $1000.00\n(Mil Pesos 00/100 M.N.) bimestrales que de manera individual y directa se otorga a las personas con discapacidad, beneficiarias del Programa.\nBeneficiario: Hombre o mujer que obtiene el apoyo.\nIMSS: Instituto Mexicano de Seguro Social.\nISSSTE: Instituto de Seguridad y Servicios Sociales de los Trabajadores del Estado.\nPrograma: Programa Apoyo a Discapacitados.\nReglas de Operación: Conjunto de disposiciones que precisan la forma de operar un Programa.\nSolicitante. Persona, que de manera formal y siguiendo el procedimiento establecido en las\nReglas de Operación, solicita ser beneficiaría del Programa.\n16. Anexos:\nÚnico. Solicitud de apoyo.\nÚnico. Solicitud de apoyo.\nOPERACIÓN PARA EL EJERCICIO FISCAL 2017\nPrimero. El presente Acuerdo entrará en vigor al día siguiente de su publicación en el Periódico\nSegundo. Quedan abrogadas las Reglas de Operación del Programa Juntos Podemos Apoyando a Discapacitados para el Ejercicio Fiscal 2015, publicadas en el Periódico Oficial del Gobierno del Estado de Guerrero, número 29 de fecha 10 de abril de 2015.\nTercero. A partir de la entrada en vigor de las presentes Reglas de Operación del Programa, la\nSecretaría de Desarrollo Social será responsable directa de la operación y ejecución de las mismas.\nCuarto. En un plazo de sesenta días, se emitirán los Lineamientos de los Comités de Contraloría\nSocial, y existirá un Comité por cada municipio de la entidad integrado por las y los beneficiarios del\nPrograma.\nQuinto. Se Faculta a la Titular de la Secretaria (SIC) de Desarrollo Social del Gobierno del Estado de Guerrero, para expedir las Reglas de Operación del Programa de Apoyo a Discapacitados, en los subsecuentes Ejercicios Fiscales que comprenden del año 2018 al 2021.\nDado en la Oficina del titular del Poder Ejecutivo, ubicada en el Edificio Centro de Palacio de\nGobierno, Boulevard René Juárez Cisneros No. 62 Ciudad de los Servicios en la Ciudad de Chilpancingo de los Bravo, Capital del Estado de Guerrero, a los Treinta y un días del mes de enero de dos mil diecisiete.\nEL GOBERNADOR CONSTITUCIONAL DEL ESTADO DE GUERRERO.\nLIC. HÉCTOR ANTONIO ASTUDILLO FLORES.\nRúbrica.\nEL SECRETARIO GENERAL DE GOBIERNO.\nLIC. FLORENCIO SALAZAR ADAME.\nRúbrica.\nLA SECRETARIA DE DESARROLLO SOCIAL.\nLIC. ALICIA ELIZABETH ZAMORA VILLALVA.\nRúbrica.\nOPERACIÓN PARA EL EJERCICIO FISCAL 2017\nANEXO\nSOLICITUD DE APOYO\nLugar y fecha\nLic. Alicia Elizabeth Zamora Villalva.\nSecretaria de Desarrollo Social del Estado de Guerrero.\nPor medio de este escrito me dirijo a usted para solicitar, se me permita acceder al Programa de promueve, dado que soy una persona con discapacidad y lo hago manifiesto con mi documentación correspondiente.\nEn espera de una respuesta favorable, le envío un cordial saludo.\nAtentamente\nNombre del solicitante",
  "ordenamiento": "REGLA",
  "jurisdiccion": "GUERRERO",
  "fuente_oficial": "DIARIO OFICIAL DE LA FEDERACION",
  "Fecha de Publicación": "27 de diciembre de 2017",
  "ULTIMA REFORMA PUBLICADA": null,
  "status": "VIGENTE",
  "es_escaneado": false,
  "tiene_tablas": true,
  "materia": [
    "general"
  ]
}