{
  "titulo": "Acuerdo por el Que Se Emiten las Reglas de Operación del Programa de Apoyo A Deudos de Guerrerenses",
  "Contenido": "PARA EL EJERCICIO FISCAL 2019\nEJERCICIO FISCAL 2019.\nCHILPANCINGO, GRO., ENERO, 2019.\nPARA EL EJERCICIO FISCAL 2019\nTEXTO ORIGINAL.\nAcuerdo por el que se emiten las Reglas de Operación publicadas en el Periódico Oficial del\nGobierno del Estado No. 18, el viernes 01 de marzo de 2019.\nACUERDO POR EL QUE SE EMITEN LAS REGLAS DE OPERACIÓN DEL PROGRAMA DE APOYO A\nDEUDOS DE GUERRERENSES FALLECIDOS EN EL EXTRANJERO PARA EL EJERCICIO FISCAL\n2019.\nC. Fabián Morales Marchán, Secretario de los Migrantes y Asuntos Internacionales, con fundamento en el artículo 36 de la Ley orgánica de la Administración Pública del Estado de Guerrero número 08, última reforma publicada en el Periódico Oficial del Gobierno del Estado de Guerrero No. 85, de fecha viernes 23 de octubre del 2015, y\nCONSIDERANDO\nQue en el Dictamen y Decreto número 182 del Presupuesto de Egresos del Estado de\nGuerrero para el Ejercicio Fiscal 2019, se señala que se ejercerán los recursos bajo política de gasto público responsable, que permita dar cumplimiento a lo que establecen los seis ejes rectores del Plan\nEstatal de Desarrollo 2016-2021, específicamente el eje VI.- Estrategias Transversales, para la atención a los migrantes guerrerenses y sus familias y que para tales efectos específicamente son objetivos estratégicos para la Secretaría de los Migrantes y Asuntos Internacionales, todas aquellas acciones tendientes a fomentar un desarrollo integral, particularmente en las regiones con mayor expulsión demográfica en la entidad, promoviendo el desarrollo humano de la población en sus lugares de origen, y fortalecer mediante el seguimiento puntual a los programas que atienden las necesidades básicas de los migrantes.\nPor lo anteriormente expuesto y con fundamento en las disposiciones legales antes citadas, he tenido a bien expedir el siguiente:\nACUERDO\nÚNICO.- Se expiden las Reglas de Operación del \"Programa de Apoyo a Deudos de\nGuerrerenses Fallecidos en el Extranjero\", para el Ejercicio Fiscal 2019.\nTRANSITORIOS\nPRIMERO.- Las presentes Reglas de Operación, abrogan las Reglas de Operación del Programa de Apoyo a Deudos de Guerrerenses Fallecidos en el Extranjero, publicadas el Martes 13 de febrero del\nPARA EL EJERCICIO FISCAL 2019\nSEGUNDO.- Las presentes Reglas de Operación entrarán en vigor al día siguiente de su\nTERCERO.- Las Reglas de Operación del Programa de Apoyo a Deudos de Guerrerenses\nFallecidos en el Extranjero para el Ejercicio Fiscal 2019, se publican en su totalidad para mejor entendimiento.\nDado en la Ciudad de Chilpancingo de los Bravo, Guerrero a los once días del mes de enero de dos mil diecinueve.\nC. FABIÁN MORALES MARCHAN.\nSecretario de los Migrantes y Asuntos Internacionales.\nRúbrica.\nÍNDICE\n1.- Introducción.\n1.1. Antecedentes históricos.\n1.2. Alineación Programática.\n1.3. Diagnóstico.\na).- Naturaleza del Programa.\nb).- Origen y fundamento.\nc).- Objetivos y metas.\nd).- Ubicación geográfica.\ne).- Actividades a realizar.\nf).- Instancias participantes.\ng).- Presupuesto de inversión.\nh).- Glosario de términos.\nMisión.\nVisión.\n2.- Dependencia o Entidad Responsable del Programa.\n3. Objetivos y Alcances.\n3.1. Objetivo General.\n3.2. Objetivos Específicos.\n3.3. Alcances.\n4. Metas Físicas.\n5. Programación Presupuestal.\n6. Requisitos y Procedimientos de Acceso.\nPARA EL EJERCICIO FISCAL 2019\n6.1. Difusión.\n6.1.1. - Promoción del Programa.\n6.1.2. - Medios de difusión.\n6.1.3. - Cobertura.\n6.2. Requisitos de Acceso.\n6.2.1. - Requerimientos a cumplir.\n6.2.2. - Documentación necesaria.\n6.2.3. - Casos no previstos.\n6.3. Procedimientos de Acceso.\n6.3.1.- Forma de Acceso al Servicio del Programa.\n6.4. Requisitos de Permanencia, Causales de Baja o\nSuspensión Temporal.\n6.5. Modos de entrega del beneficio.\n7. Procedimientos de Instrumentación.\n7.1. Operación.\n7.1.1. - Actividades que se llevan a cabo.\n7.2. Gastos de Operación.\n8. Transparencia.\n8.1. Difusión.\n8.2. Blindaje electoral.\n8.3. Supervisión y Control.\n8.4. Mecanismos de Evaluación e Indicadores.\n8.4.1. Evaluación.\n8.4.2. Indicadores.\n8.5. Auditoría.\n8.6. Recursos no devengados.\n8.7. Contraloría social.\n8.8. Procedimiento de Queja o Inconformidad Ciudadana.\n8.9. Mecanismos de Exigibilidad.\n8.10. Acta de Entrega-Recepción.\n9. Criterios de selección y elegibilidad.\n9.1 Método de selección de beneficiarios.\n10. Mecánica de Operación.\n10.1. Instancia ejecutora.\n10.2. Instancia administrativa y/o normativa.\n10.3. Delimitación de atribuciones.\n11. Derechos, obligaciones y sanciones de los beneficiarios de programas sociales.\n11.1. Derechos.\n11.2. Obligaciones.\nPARA EL EJERCICIO FISCAL 2019\n11.3. Sanciones.\n12. Interpretación.\n1. - Introducción.\n1.1. Antecedentes históricos\nEl Programa de Apoyo a Deudos de Guerrerenses Fallecidos en el Extranjero, surge por iniciativa de Ley pública, aprobada y publicada en el Periódico Oficial del Gobierno del Estado de Guerrero, no. 36, de fecha 30 de abril de 1991, de la Ley Orgánica de la Administración Pública del Estado de Guerrero no.\n433, Art. 21, fracción VIII, que a la letra dice: establecer, coordinar y operar los programas de atención a la comunidad de guerrerenses que radican en el extranjero, (Estados Unidos de Norteamérica) definiendo vínculos de comunicación y coordinación con los que residen en aquel país.\nAl inicio de operación del Programa se otorgaba el servicio del traslado y se entregaba un apoyo económico para gastos funerarios de $ 5,000.00 (Cinco mil pesos 00/100 M.N.)\nCon fecha 14 de diciembre del año 2000, se reformó la Ley Orgánica de la Administración Pública del Estado de Guerrero, derivada de la dinámica propia y de las transformaciones naturales del Estado, se estableció en el Art. 21 fracción VIII, las facultades de la Secretaría de Desarrollo Social del Gobierno del\nEstado, para atender a los migrantes guerrerenses radicados temporal o permanentemente fuera del\nEstado.\nCon la llegada del C. Gobernador, Carlos Zeferino Torreblanca Galindo, en el año 2005, se deja de otorgar el apoyo económico de $ 5,000.00 (Cinco mil pesos 00/100 M.N.).\nEn el año 2011, se emite el Decreto número 849, por el que se reforman, adicionan y derogan diversas disposiciones de la Ley Orgánica de la Administración Pública del Estado de Guerrero número\n433, el día 21 de octubre del año 2011 se publica en el periódico oficial año XCII n° 84, alcance I, del\nGobierno del Estado de Guerrero, la creación de la Secretaría de los Migrantes y Asuntos Internacionales, teniendo como principal objetivo velar por la comunidad de migrantes y sus familias en las áreas de actos discriminatorios, asistencia en los casos de fallecimientos, en general atender la problemática social al fenómeno de la migración, implementando una política pública desincorporada de la Secretaría de\nDesarrollo Social.\nOrgánica de la Administración Pública n° 433, ahora pasa a ser Ley Orgánica de la Administración Pública funerarios $5,000.00 (Cinco mil pesos 00/100 M.N.), que se otorgaban adicionalmente del servicio de traslado del fallecido.\nPARA EL EJERCICIO FISCAL 2019 atención y protección a migrantes, establecida en el Plan Estatal de Desarrollo 2016-2021 y Decreto número 182 del Presupuesto de Egresos del Estado de Guerrero, para el ejercicio fiscal 2019, publicada en el periódico oficial el día miércoles 09 de enero del año 2019.\nEl programa garantiza el apoyo a los deudos de migrantes guerrerenses en cuanto al traslado de personas fallecidas, para que de manera solidaria se coadyuve en todo lo posible para permitir que haya una colaboración entre personas, grupos sociales y órdenes de Gobierno de manera corresponsable, asegurando que el apoyo a los deudos de migrantes fallecidos se realice en forma segura, digna, humana y con equidad de género.\n1.2.- Alineación Programática\nEl Programa de Apoyo a Deudos de Guerrerenses Fallecidos en el Extranjero, se encuentra alineado al Eje VI. Estrategias Transversales, Objetivo 6.5.- Atender a los Migrantes, en la Estrategia\n6.5.1.- Fomentar la economía estatal como acción estratégica para contener y mitigar el fenómeno de migración, en la línea de acción 6.5.1.3.- Fortalecer y brindar seguimiento a los programas de atención a los migrantes por medio de la Secretaría de los Migrantes y Asuntos Internacionales, del\nPlan Estatal de Desarrollo 2016 - 2021.\nAsimismo, se encuentra inmerso en el Plan Especial Migrantes, capítulo IV.- Programas y\nProyectos a Desarrollar 2016 - 2021, punto número 4., destacando que una de las características principales del Programa, es servir de instrumento de enlace para que de manera solidaria se coadyuve en todo lo posible para permitir que haya colaboración entre personas, grupos sociales y órdenes de gobierno de manera corresponsable, asegurando que el apoyo a los deudos de migrantes realicen en forma segura, digna y humana.\n1.3. Diagnóstico\nLos guerrerenses que viven fuera de nuestras fronteras, que han emigrado en busca de mejores condiciones de vida, también tienen derecho a la prestación de servicios Gubernamentales, por esta razón, el Gobierno del Estado en 1991 decretó la creación del Programa de Atención a Guerrerenses Radicados en el Extranjero, para establecer vínculos de comunicación y cooperación permanente con todos los connacionales que radican en Estados Unidos de Norteamérica y Canadá, con la finalidad de incluirlos al desarrollo económico, social y político de nuestra entidad. Hoy en día, hay más de un millón de guerrerenses radicados en el vecino país del norte y anualmente envían un promedio de 1,277.00 millones de dólares a nuestro Estado de Guerrero.\nLos migrantes son víctimas de una variedad de delitos, desde violación a sus derechos humanos llegando incluso al asesinato. Las muertes registradas más frecuentes, de acuerdo a estadísticas se relacionan con situaciones de enfermedades, accidentes de auto, homicidios, suicidios e intentos por cruzar la frontera.\nPARA EL EJERCICIO FISCAL 2019 autorizado dentro del territorio estadounidense. Esta situación genera que algunos empleadores e incluso, autoridades, violen sus derechos humanos. el Programa de Apoyo a Deudos de Guerrerenses Fallecidos en el Extranjero (Estados Unidos de\nNorteamérica y Canadá).\nLa atención de los migrantes y sus familias, es una prioridad más de este gobierno, aceptando y reconociendo que es un derecho fundamental brindar el apoyo a nuestros connacionales migrantes que provienen de grupos poblacionales en situaciones de pobreza y marginación.\na). - Naturaleza del Programa\nEl Programa está enfocado a beneficiar a las diferentes familias guerrerenses que por diferentes circunstancias han sufrido la partida de algún familiar hacia el extranjero, pero sobre todo apoyar económicamente a las familias, cuando alguno de los familiares llegara a fallecer al encontrarse fuera de nuestro País, específicamente en Estados Unidos de América.\nb). - Origen y fundamento\nEl Programa de Apoyo a Deudos de Guerrerenses Fallecidos en el Extranjero, surge por iniciativa de Ley pública, aprobada y publicada en el Periódico Oficial del Gobierno del Estado de Guerrero, no. 36, de fecha 30 de abril de 1991, de la Ley Orgánica de la Administración Pública del Estado de Guerrero no.\n433, Art. 21, fracción VIII, que a la letra dice: establecer, coordinar y operar los programas de atención a la comunidad de guerrerenses que radican en el extranjero, (Estados Unidos de Norteamérica) definiendo vínculos de comunicación y coordinación con los que residen en aquel país.\nCon fecha 14 de diciembre del año 2000, se reformó la Ley Orgánica de la Administración Pública del Estado de Guerrero, derivada de la dinámica propia y de las transformaciones naturales del Estado, se estableció en el Art. 21 fracción VIII, las facultades de la Secretaría de Desarrollo Social del Gobierno del\nEstado, para atender a los migrantes guerrerenses radicados temporal o permanentemente fuera del\nEstado.\nEn el año 2011, se emite el Decreto número 849, por el que se reforman, adicionan y derogan\n433, el día 21 de octubre del año 2011 se publica en el periódico oficial año XCII n° 84, alcance I, del discriminatorios, asistencia en los casos de fallecimientos, en general atender la problemática social al fenómeno de la migración, implementando una política pública desincorporada de la Secretaría de\nDesarrollo Social.\nOrgánica de la Administración Pública n° 433, ahora pasa a ser Ley Orgánica de la Administración Pública\nPARA EL EJERCICIO FISCAL 2019\nc).- Objetivos y metas\nEl objetivo del programa está enfocado en atender todas las solicitudes de las familias guerrerenses que por desgracia, llegaran a sufrir la pérdida de algún familiar en Estados Unidos de\nAmérica, apoyando su economía al cubrir los gastos que se generan por el traslado de los fallecidos desde el Aeropuerto de la ciudad de México y/o Acapulco, hasta su comunidad de origen.\nDe acuerdo al Presupuesto destinado para el presente ejercicio fiscal, se estima atender 190 solicitudes aproximadamente.\nd).- Ubicación Geográfica\nLa cobertura de este Programa es Estatal, para atender a todas las familias guerrerenses de los\n81 Municipios que llegaran a necesitar y solicitar el apoyo de este servicio al Gobierno del Estado, con la única limitante que se tiene un Presupuesto delimitado.\ne).- Actividades a realizar\nPor la naturaleza del Programa, su operación inicia desde la elaboración y presentación del\nPrograma Operativo Anual que se entrega a la Secretaría de Finanzas y Administración, quien a su vez, al final de cada ejercicio fiscal, presenta ante el Congreso del Estado el Presupuesto de Egresos para el ejercicio siguiente. Una vez aprobado el presupuesto correspondiente, se analizan posibles cambios y a su vez, se elaboran y presentan las Reglas de Operación del Programa, ante la Secretaría de Planeación y\nDesarrollo Regional, para su aprobación correspondiente. Posteriormente, se envían a la Secretaría\nGeneral de Gobierno, para su publicación correspondiente en el Periódico Oficial del Gobierno del Estado.\nEn relación a los apoyos solicitados, se reciben y analizan cada una de las solicitudes de quienes requieren el servicio y puede ser de manera física en nuestras oficinas y/o vía correo electrónico, las cuales, una vez analizadas y complementadas, se transfieren a la Funeraria para que se realice el servicio solicitado.\nf). - Instancias participantes.\nDerivado del giro del Programa, se está en constante coordinación con la Secretaría de Relaciones de Estados Unidos de América, en donde cada instancia realiza sus funciones dentro del ámbito de su competencia y sus alcances presupuestales.\ng). - Presupuesto de inversión\nPARA EL EJERCICIO FISCAL 2019\nUnidos de América, con lo cual, se beneficia a toda la población guerrerense que sufre la pérdida de algún ser querido en aquel País vecino. El número de traslados es variable y depende de las solicitudes que se reciben en la Secretaría de los Migrantes y Asuntos Internacionales, durante el ejercicio fiscal 2017, se atendieron 186 solicitudes de apoyo, para las cuales, se erogaron $ 3,377,293.00 (Tres millones trescientos setenta y siete mil doscientos noventa y tres pesos 00/100 M.N.), lo cual significa un promedio de $ 18,157.49 por traslado. Por su parte, para el ejercicio fiscal 2018, los traslados realizados fueron 160 y se destinaron $ 2,924,946.53 (Dos millones novecientos veinticuatro mil novecientos cuarenta y seis pesos 53/100 M.N.), lo cual significa un promedio de $ 18,280.92 por traslado.\nh). - Glosario de términos\nTraslado Acto de transportar vía aérea y/0 terrestre el cuerpo de los migrantes fallecidos, a sus localidades de origen en el Estado de Guerrero.\nDeudos Personas que han sufrido la pérdida de un integrante de su familia.\nMigrante Persona que vive en un lugar diferente a donde nació.\nConnacional Que pertenece a la misma nación.\nSubsidio Apoyo que brinda el Gobierno a través de la Semai, a los beneficiarios, mediante el pago de servicios funerarios.\nMisión\nOtorgar el apoyo a las familias de migrantes guerrerenses fallecidos en E.U. y Canadá, mediante el servicio de traslado desde el Aeropuerto Internacional de la Ciudad de México y/o del Aeropuerto\nInternacional de Acapulco, hasta su comunidad de origen, contribuyendo de esta manera a reducir el impacto económico en los deudos, así como a brindar certeza respecto al destino final del familiar fallecido, especialmente en aquellas familias que se encuentran en zonas de mayor marginación.\nPara mejor entendimiento se desarrolla:\nVisión\nContribuir al más alto nivel de servicio por la SEMAI, a las familias de migrantes guerrerenses fallecidos en el extranjero, reduciendo el impacto económico en los deudos, así como a brindar certeza respecto al destino final del familiar fallecido, especialmente en aquellas familias que se encuentran en zonas de mayor marginación.\n2. Dependencia o Entidad Responsable del programa\n2.1. La Secretaría de los Migrantes y Asuntos Internacionales, es la Dependencia responsable de la ejecución del Programa de Apoyo a Deudos de Guerrerenses Fallecidos en el Extranjero.\nPARA EL EJERCICIO FISCAL 2019\n2.2. La Dirección General de Asuntos Jurídicos y Derechos Humanos de los Migrantes, apoyada por el Departamento de Protección al Migrante Internacional, dependiente de la Secretaría de los Migrantes\nY Asuntos Internacionales, son las áreas encargadas de la recepción de las solicitudes y verificar que se cumplan los requisitos para poder apoyar a los familiares que requieren del servicio. Por su parte, la\nDelegación Administrativa es la encargada de realizar los pagos al prestador del servicio de traslado, recibir y revisar las facturas de comprobación y a su vez, enviar la comprobación a la Dirección General de\nContabilidad Gubernamental, Dependiente de la Secretaría de Finanzas y Administración para su revisión correspondiente.\nLos preceptos que le dan sustento legal al Programa son:\nLey Orgánica de la Administración Pública del Estado de Guerrero 08. ÚLTIMA REFORMA\nPUBLICADA EN EL PERIÓDICO OFICIAL DEL GOBIERNO DEL ESTADO 69 ALCANCE I, EL MARTES\n28 DE AGOSTO DE 2018.\nLey número 207 de Transparencia y Acceso a la Información Pública del Estado de Guerrero.\nPlan Estatal de Desarrollo 2016-2021.\nPrograma Especial Migrantes 2016 - 2021.\nDecreto número 182 del Presupuesto de Egresos del Estado de Guerrero para el Ejercicio Fiscal\n2019.\n3. Objetivos y Alcances\n3.1. Objetivo General\nApoyar a las familias en la repatriación de guerrerenses fallecidos en el extranjero, cubriendo de fallecidos, asesoría y orientación para realizar el trámite de repatriación, todo en coordinación con los\nConsulados correspondientes.\n3.2. Objetivos Específicos\nPARA EL EJERCICIO FISCAL 2019\n➢Constituir un mecanismo para responder a contingencias que ocurren en la población de familias\nMigrantes Guerrerenses Radicados en el Extranjero, Estados Unidos y Canadá, asumiendo el compromiso de brindar los apoyos apegado a sus derechos humanos y equidad de género con cargo al programa, Asuntos Internacionales; los beneficiarios tienen la obligación de proporcionar datos fidedignos sin faltar a la verdad y apegarse a los tiempos que marcan las normas y reglamentos del país donde ocurran los incidentes y se realicen los trámites del mismo.\n➢Atender a un sector de población, de los deudos de Migrantes Guerrerenses fallecidos, apegado a la equidad de género y derechos humanos, quienes por falta de oportunidades en el país tuvieron la necesidad de emigrar, principalmente a los Estados Unidos de Norteamérica y Canadá.\n3.3. Alcances\nA) Trascendencia y repercusión del Programa Social: El Programa se apega al respeto de los migrantes a gozar de todos los derechos que reconoce la Constitución Política de los Estados Unidos\nMexicanos y los instrumentos internacionales suscritos por el Estado Mexicano, entre ellos, El CONEVAL.\nAnte esto, la población migrante con independencia de su condición jurídica en el país, le son reconocidos todos los derechos que al resto de las personas y por ende, deben serles respetados. De igual manera se debe respetar el derecho a la atención consular y a la dignidad humana, puesto que los migrantes que han fallecido en el extranjero, son miembros de una familia de una comunidad que es atendida por el Gobierno del Estado. El presente Programa está contemplado dentro del rubro de la prestación de servicios y el otorgamiento de subsidio para cubrir el traslado de restos fúnebres de guerrerenses fallecidos en el extranjero.\nB) El tipo de Programa Social: Este Programa está catalogado como Subsidios directos y/o\nAyudas sociales, en virtud de que se apoya a toda la población del Estado de Guerrero, cubriendo los gastos que representa el traslados de los migrantes fallecidos en el extranjero, desde el Aeropuerto\nInternacional de la ciudad de México y/o de la ciudad y Puerto de Acapulco, hasta las comunidades de origen de los fallecidos, sin representar algún costo para los familiares de los deudos.\nC) Población objetivo: La población objetivo a quien se dirige el Programa, son todos aquellos ciudadanos de origen guerrerense que hayan fallecido fuera del País, independientemente de la causa de muerte y cumplan con los documentos de identidad y libre tránsito entre ambos países.\n4. Metas Físicas\n➢Realizar aproximadamente 194 traslados de migrantes fallecidos, atendiendo al mismo número de familias; sin embargo, por la naturaleza del Programa, no es posible establecer metas exactas.\n➢ Apoyar aproximadamente a 194 familias de deudos fallecidos en el extranjero.\n➢Sin embargo, dada la naturaleza de apoyos que cubre este programa, no pueden cuantificar metas físicas específicas.\nPARA EL EJERCICIO FISCAL 2019\n5. Programación Presupuestal\nPara el Programa fueron autorizados $ 4,650,000.00 (Cuatro millones seiscientos mil pesos 00/100\nM.N.), de acuerdo al Decreto número 182 del Presupuesto de Egresos del Estado de Guerrero para\nExtraordinario, del día miércoles 09 de enero del 2019; sin embargo, producto de una transferencia compensada, sólo se ejercerán $ 3,500,000.00 (Tres millones quinientos mil pesos 00/100 M.N.), presupuesto que dependerá de la demanda de solicitudes de las familias migrantes; se estima un costo promedio de $18,300.00 por unidad de traslado.\nLa programación de las erogaciones se plasman en el siguiente Cronograma Financiero que se envía a la Secretaría de Finanzas y Administración al inicio del ejercicio fiscal y está en función de las solicitudes de apoyo que se reciban.\n6. Requisitos y Procedimientos de Acceso\n6.1. Difusión\nAdemás de su publicación en el Periódico Oficial del Estado de Guerrero, se publicará en la página www.guerrero.gob/secretaria-de-los-migrantes.\n6.1.1. Promoción del Programa promoción y divulgación de las acciones realizadas, en las localidades y los resultados e indicadores de gestión cuantitativos y cualitativos obtenidos a través de medios de difusión digital y magnética.\nToda la información necesaria para acceder a los apoyos del programa, se encontrará en las presentes Reglas de Operación, mismas que serán publicadas en el Periódico Oficial del Gobierno del\nEstado de Guerrero y sólo podrán brindarse los apoyos de acuerdo a las condiciones aquí establecidas. de la SEMAI, sujetos a las disposiciones relativas a la información pública o reservada establecidas por la\nLey de Transparencia.\nPARA EL EJERCICIO FISCAL 2019\n6.1.2. Medios de difusión líneas telefónicas a través de las cuales se dará atención al público que solicite el apoyo del Programa, 01\n747 47 1 29 80, 01 747 47 8 30 29 y 01 800 890 9444, en los horarios de 8:30 hrs., hasta las 16:00 hrs., de lunes a viernes; puede ser también, y durante las 24 horas del día los 365 días del año a través del correo electrónico: migrantesguerrero@guerrero. gob.mx. Las áreas encargadas de brindar atención a los solicitantes son el área de recepción de la Secretaría, el Departamento de Protección al Migrante\nInternacional y la Dirección General de Asuntos Jurídicos y Derechos Humanos de los Migrantes.\n6.1.3. Cobertura\nEl Programa operará para los 81 Municipios del Estado de Guerrero; sin embargo, estará en función del Presupuesto destinado para el Programa.\n6.2. Requisitos de Acceso\nLa ayuda se otorgará, Bajo los siguientes requisitos cuando la solicitud sea dirigida a la\nSemai:\n1. Solicitud de apoyo por escrito para el traslado del fallecido, dirigido al titular de la Secretaría de los migrantes y Asuntos internacionales.\n2. Copia de identificación que acredite el parentesco con el fallecido. (Estos pueden ser: INE, pasaporte, licencia de conducir, cartilla militar u otro documento válido como identificación oficial.\n3. Copia del acta de nacimiento del fallecido.\nNota: el solicitante que firma la petición tendrá que ser familiar en línea directa, en caso de ser la esposa (o) deberá adjuntar copia del acta de matrimonio.\nEl tiempo estimado de atención a las solicitudes es variable, puede ser a partir de un día hábil; sin embargo, también está en función del tiempo que tarda la llegada del fallecido procedente de Estados\nAcapulco.\n6.2.1. Requerimientos a cumplir\n1. Disponibilidad por parte de los familiares en línea directa en Estados Unidos y en el Estado de\nGuerrero, para proporcionar toda la información necesaria acerca de la defunción.\nPARA EL EJERCICIO FISCAL 2019\nEn los casos en los que no se cuente con algún familiar, el apoyo podrá proporcionarse a través de una solicitud del consulado correspondiente en Estados Unidos y/o de la Secretaría de Relaciones\nExteriores; Delegación Guerrero.\n2. Disponibilidad por parte de los familiares directos en el Estado de Guerrero para la coordinación en el traslado del cuerpo.\n3. El cuerpo del fallecido será trasladado de acuerdo a la petición hecha por los familiares, en el marco normativo nacional e internacional que corresponda.\n4. En caso de tratarse de un cónyuge, acreditar el parentesco mediante acta de matrimonio, acta de nacimiento de uno de sus hijos o constancia de concubinato.\n6.2.2. Documentación necesaria\n5. Cuando algún migrante guerrerense fallezca en el Extranjero y no cuente con familiar directo alguno en aquel País, el apoyo podrá ser solicitado a la Semai, por la Secretaría de Relaciones Exteriores;\nDelegación Guerrero.\n6. Anexar a la solicitud, la copia de una identificación oficial del solicitante (Credencial del IFE, cartilla militar, carta de identidad u otro documento válido como identificación oficial).\n7. Copia del acta de nacimiento del finado\nNota: Para poder brindar un servicio oportuno a los solicitantes, de preferencia presentar la solicitud correspondiente y cumplir con los requisitos necesarios por lo menos 2 días antes de que el cuerpo del fallecido llegue al aeropuerto de la ciudad de México, y podrán hacerlo de manera directa en la recepción de nuestras oficinas ubicadas en Paseo Alejandro Cervantes Delgado Manzana cinco, Lote 1, Segundo Piso, Esq. Con Baltazar R. Leyva Mancilla, Colonia Universal, C.P. 39080, en la ciudad de\nChilpancingo, en los horarios de 8:30 am. Hasta las 16:00 pm., de lunes a viernes, o enviar los documentos del año.\n6.2.3. - Casos no previstos como casos especiales, serán resueltos a consideración del titular de la Secretaría de los Migrantes y\nAsuntos Internacionales y estarán sujetos a la disponibilidad del presupuesto del Programa.\n6.3. Procedimientos de Acceso\n• Ser ciudadano Guerrerense por nacimiento o radicación en el Estado de Guerrero por más de cuatro años, de acuerdo a las disposiciones legales correspondientes.\nPARA EL EJERCICIO FISCAL 2019\n• Que haya fallecido en el extranjero o intentando cruzar la frontera del vecino país, sin importar la causa.\n6.3.1. Forma de Acceso al Servicio del Programa puntos 8.2.1. Y 8.2.2., la prestación del servicio estará en función del Presupuesto del programa y se le podrá informar al solicitante si recibirá o no el servicio al momento de presentar su solicitud.\n6.4. Requisitos de permanencia y/o causales de baja o suspensión temporal.\nLa Secretaria de los Migrantes y Asuntos Internacionales, a través de la Dirección General de\nAsuntos Jurídicos y Derechos Humanos de los Migrantes, apoyada por el Departamento de Protección al\nMigrante Internacional en el ámbito de su respectiva competencia, cancelarán los apoyos, cuando los solicitantes incumplan en la entrega de documentos solicitados por estas áreas de forma oportuna y/o falta de información relacionada al caso relativo. Se podrá suspender la radicación de los apoyos y beneficios e inclusive solicitar su reintegro, sin prejuicio de lo establecido en las disposiciones aplicables.\n6.5. Modos de Entrega del Beneficio\nSe otorga a través de la realización del servicio de traslado del fallecido, vía terrestre, utilizando como medio de trasporte una carroza, siendo desde el aeropuerto internacional de la Ciudad de México;\nDF. y/o del Puerto de Acapulco; Gro., a la localidad de origen, el servicio funerario para el traslado es contratado con la o las casas funerarias que la Secretaria de los Migrantes y Asuntos Internacionales considere brindarán un servicio eficaz y pertinente.\n7. Procedimientos de Instrumentación\n7.1. Operación consulares, alerta e informa los derechos e intereses de sus connacionales en el Extranjero, asistiendo y encuentren y/o se haya registrado los casos.\n7.1.1. Actividades que se llevan a cabo\nLa Secretaría de los Migrantes y Asuntos Internacionales (SEMAI), intervendrá ante las diferentes oficinas consulares, para poder repatriar a las personas fallecidas, respetando las normas legales y administrativas, así como los tiempos y formas establecidas por los diferentes organismos y/o instituciones\nPARA EL EJERCICIO FISCAL 2019 de los países norteamericanos donde ocurran los hechos. Esto bajo el consentimiento y autorización de los familiares directos.\nGuerrero, quienes solicitan el apoyo por escrito a la Secretaría de los Migrantes y Asuntos Internacionales; la cual se encuentra ubicada en Paseo Alejandro Cervantes Delgado s/n, Manzana 5, Lote 1, 2° Piso, Col.\nUniversal, Chilpancingo, Gro., o comunicándose a los teléfonos (747) 47 830 29 o (747) 47 1 29 80 y al 01\n800 890 9444.\nSe solicitará al familiar o amigo que reporta el caso en E.U.A. acuda al consulado mexicano que le corresponda a fin de respaldar la solicitud de apoyo económico que haya sido realizada ante esta\nSecretaría, (ubicada en Paseo Alejandro Cervantes Delgado S/N, Manzana 5, Lote 1, 2° Piso, Colonia\nUniversal, C.P. 39080, en Chilpancingo de los Bravo Gro.), misma que, para tal efecto deberá presentarse mediante un oficio dirigido al Secretario de los Migrantes y Asuntos Internacionales del Estado de Guerrero, la cual se atenderá en el momento que los familiares envíen por escrito la solicitud en formato libre y los requisitos completos; el periodo en el cual los deudos recibirán a su familiar en la comunidad de origen, el tiempo de espera para realizar el traslado, es de aproximadamente 15 días hábiles cada caso es diferente y dependerá de las leyes y normas de cada Estado, en USA. y/o Canadá, las cuales tenemos que apegarnos, todos los trámites son en coordinación con el Consulado mexicano que tenga competencia y la funeraria designada por la familia en el extranjero.\nSe apoyará cubriendo el costo del traslado del Aeropuerto Internacional de la Ciudad de México y/o Acapulco a su lugar de origen en el Estado de Guerrero, a través de la funeraria designada por la\nSecretaría de los Migrantes y asuntos Internacionales.\nSe enviará vía correo electrónico o vía telefónica a la funeraria en E.U.A., los datos de la funeraria receptora en el Estado de Guerrero que se encargará de trasladar el cuerpo del aeropuerto de la ciudad de México y/o del aeropuerto de Acapulco a su comunidad de origen en Guerrero.\nSe sostendrá constante comunicación telefónica con el encargado de la funeraria en E.U.A. para agilizar el trámite del traslado y conocer el itinerario con el que llegará el difunto a México.\nSe informará a la familia en Guerrero de la fecha, hora, número de vuelo y aerolínea, en que el\nEl tiempo aproximado de la atención a la petición de apoyo es inmediato, el tiempo de espera para repatriar el cuerpo, depende del lugar donde falleció y las causas del deceso.\nUna vez que se tenga la confirmación del Itinerario de viaje del occiso, Se dará aviso a la agencia funeraria en Guerrero para que vaya a liberar el cuerpo del fallecido (a) al Aeropuerto Internacional de la\nLos datos de las personas beneficiarias del Programa, se difundirán de acuerdo a lo establecido\nPARA EL EJERCICIO FISCAL 2019 género, raza o ideología con cobertura estatal.\n7.2. Gastos de Operación\nPara el desarrollo de las diversas acciones asociadas con la planeación, operación, supervisión, seguimiento y evaluación externa del Programa, la Secretaria de los Migrantes y Asuntos Internacionales podrá destinar recursos de hasta el 3.0 % del presupuesto total asignado al Programa, con lo cual, se podrán realizar visitas a algunas comunidades para verificar la entrega de los fallecidos en sus domicilios, así como para la adquisición de mobiliario y equipo de cómputo y/o artículos de papelería.\n8. Transparencia\nLa transparencia es uno de los instrumentos para cumplir con el principio de rendición de cuentas, mediante el cual se informa a la población de las acciones y ejercicio sobre este programa fortaleciendo la cultura de apego a la legalidad.\nPara garantizar la equidad de género y derechos humanos en la entrega de apoyos a los beneficiarios seleccionados, el seguimiento detallado y auditado en la operación del Programa se llevará a cabo por medio de la Dirección General de Asuntos Jurídicos de la Secretaría de los Migrantes y Asuntos\nInternacionales.\nCon base en lo establecido en la Ley Número 207 de Transparencia y Acceso a la Información\nPública del Estado de Guerrero, la SEMAI publicará periódicamente la lista de apoyos otorgados, con las reservas sobre datos personales establecidas por Ley, en la página oficial del Gobierno del\nEstado www. guerrero.gob.mx/dependencias/secretaria-de-los-migrantes, así como información adicional relativa al Programa.\n8.1. Difusión\nAmericana, a los comités \"espejo\" de los clubes de migrantes, los clubes de migrantes, a los enlaces municipales y comisarías municipales.\nInternacionales.\nPARA EL EJERCICIO FISCAL 2019\nLas copias de los expedientes técnicos pueden consultarse, previa solicitud, en el archivo ubicado en la jefatura de protección al migrante internacional, dentro de las instalaciones de la Secretaría.\nGuerrero, la información de los montos y beneficiarios del programa se ha publicado en el Sistema Nacional de Transparencia, acceso a la información Pública y Protección de Datos Personales.\n8.2. Blindaje Electoral\nEste Programa es Público, ajeno a cualquier partido político. Queda prohibido el uso para fines distintos a los establecidos en el Programa.\nLa documentación oficial y la publicidad e información del programa deberá incluir la siguiente leyenda: \"Este programa es de carácter público, no es patrocinado ni promovido por partido político alguno y sus recursos provienen de los impuestos que pagan todos los contribuyentes. Queda prohibido el uso de este programa con fines políticos, electorales, de lucro y otros distintos a los establecidos. Quien haga uso indebido de los recursos de este programa deberá ser denunciado y sancionado de acuerdo con la ley aplicable y ante la autoridad competente\" (Anexo 1).\n8.3. Supervisión y Control\nLa supervisión y Control inicia con la recepción de los requisitos, como son: el oficio donde el familiar solicita el apoyo, la copia del INE de quien solicita el apoyo y copia del Acta de nacimiento del fallecido, que corresponda a las personas indicadas, posteriormente, una vez que se realiza el traslado por parte de la funeraria, se cubre el pago correspondiente y la empresa que presta el servicio nos hace llagar las facturas correspondientes con los documentos que recibe en el aeropuerto, como son: acta de defunción, permisos de sanidad internacional, traducción al español de esos documentos, los cuales son verificados en la Delegación Administrativa que correspondan al servicio respectivo.\nUna vez que se cuenta con las facturas que cubren el importe de la Solicitud de Pago que emite la Secretaría de Finanzas y Administración, de acuerdo a la programación planteada en el cronograma financiero enviado a la Secretaría de Finanzas y Administración, donde se especifican las ministraciones mensuales necesarias, se verifica su autenticidad en la Página de la Secretaría de Hacienda y Crédito\nPúblico, se integra la comprobación total por solicitud de pago y se envía a la Dirección General de\nContabilidad Gubernamental, dependiente de la Secretaría de Finanzas y Administración, para su revisión y descargue de adeudo correspondiente. y Desarrollo Regional, los reportes trimestrales en cumplimiento con lo establecido en los artículos 7, 57, 58 y 67 de la Ley General de Contabilidad Gubernamental en materia de transparencia y difusión de la información Financiera, correspondiente a la Norma \"Montos pagados por Ayudas y Subsidios\", emitida por el Consejo Nacional de Armonización Contable (CONAC).\n8.4. Mecanismos de Evaluación e Indicadores\nPARA EL EJERCICIO FISCAL 2019\nEl esquema de evaluación de impacto contempla el análisis de los efectos de corto, mediano y largo plazos del Programa sobre la población migrante beneficiaria, tanto en la esfera individual, como en la familiar y comunitaria. Con este fin, el enfoque de evaluación integra diversas aproximaciones metodológicas, que incluyen instrumentos cuantitativos y cualitativos, lo que permite generar elementos para un análisis de las sinergias que ocurren entre los componentes del Programa y sus repercusiones sobre las esferas mencionadas. El seguimiento permite contar con información tales como indicadores y bases de datos, sobre los procesos operativos con el objetivo de mejorar su diseño y ejecución, así como su mejora continua.\n8.4.1. Evaluación\nEl Programa permitirá evaluar los resultados a través de indicadores de desempeño relacionados con la eficacia, ya que se podrá medir el grado de cumplimiento de los objetivos y metas programadas.\nAsimismo, se podrán implementar encuestas a las familias beneficiarias con el Programa para conocer el grado de aceptación y cumplimiento del mismo.\n8.4.2. Indicadores\nPara la construcción de indicadores se seguirá la Metodología de Marco Lógico, la cual permitirá suministrar información para la ejecución, monitoreo y evaluación del programa, como se muestra en la siguiente matriz:\nMatriz de Marco Lógico del Programa de Apoyo a Deudos de Guerrerenses Fallecidos en el\nExtranjero.\nIndicador ic a de M n Unidad\nNivel de Objetivo Objetivo Responsable Supuestos\nContribuir en la (Total de Dirección General de El repatriación de Migrantes Asuntos Jurídicos y fenómeno n ses\nEficacia Traslado i gratorio incrementando su Repatriados Migrantes Dirección General de mantiene acceso en el Falle cidos)* Planeación y Política s constante o se\nPrograma 100 Publicas Migratorias incrementa\nLa población migrantes\nInformes Dirección General de migrante de (Total de solicitan el trimestrales Asuntos Jurídicos y escasos recursos Porcentaje de Familias apoyo de la incrementa su familias de Beneficiada s presentados a la Derechos Humanos de\nSecretaría de\nPropósito Eficacia Familias secretaría de los Migrantes y La acceso a Migrantes / Total de\nFinanzas y Dirección General de los Migrantes\n)*\n. ción y P o nale repatriación s para el traslado\nPARA EL EJERCICIO FISCAL 2019\nSoluciones de repatriaciones (Total de Dirección General de través del Porcentaje de Atendidas / Total de Derechos Humanos de todas las\nComponentes Programa de traslados Total de Eficacia Traslado solicitudes los Migrantes y La solicitudes d e\nApoyo a Deudos realizados Solicitudes atendidas Dirección General de repatriació n de Guerrerenses Reci bidas)* Planeación y Política s Recibidas.\nFallecidos en el 100 Publicas Migratorias extranjero\nSe reciben y (Total de Expediente Dirección General de El\nActividades\n/\nEficacia Solicitud\n, a de fallecidos e n el Reci bidas)* familia, copia d ePlaneación y Política s solicitudes extranjero 100 Identificación de Publicas Migratorias recibidas quien hace la solicitud, copia del acta nacimiento del fallec ido, fotos, etc.)\n8.5. Auditoría\nEl ejercicio de los recursos del programa contempla la correcta aplicación y promover la eficacia y transparencia en las operaciones y verificar el cumplimiento de los objetivos y metas programadas, para lo cual, podrá ser auditado por las siguientes instancias, conforme a la legislación vigente y en el ámbito de sus respectivas competencias: la Secretaría de Contraloría y Transparencia Gubernamental y la Auditoría\nSuperior del Estado de Guerrero.\n8.6. Recursos no devengados\nLos recursos no devengados al 31 de diciembre del ejercicio fiscal correspondiente, deberán ser reintegrados a la Tesorería del Estado de la Secretaría de Finanzas y Administración, del Gobierno del\nEstado de Guerrero. de acuerdos, que establezca un listado de solicitudes a atender, así como a los comprometidos con la casa funeraria que realiza los traslados, mediante una carta compromiso, en la que se establezcan la cantidad de casos cuyos traslados habrán de cubrirse con dichos recursos.\n8.7. Contraloría Social\nConsultivo de la Secretaría de los Migrantes y Asuntos Internacionales del Estado de Guerrero.\nPARA EL EJERCICIO FISCAL 2019\nEl Consejo Consultivo de la Secretaría de los Migrantes y Asuntos Internacionales, realizará el seguimiento de la aplicación de los recursos financieros autorizados al programa, llevará el monitoreo cumplimiento de las presentes Reglas de Operación.\n8.8. Procedimiento de Queja o Inconformidad Ciudadana\nLos beneficiarios del programa podrán presentar sus quejas o denuncias relativas a una mala actuación por personal de la Secretaría de los Migrantes y Asuntos Internacionales en relación con este programa, a través de un oficio dirigido al titular de la Secretaría de los Migrantes y Asuntos Internacionales, directamente en el área de recepción de documentos, ubicada dentro de las oficinas, donde especifique:\nNombre del Servidor (es) Público (s), objeto de la denuncia, nombre y domicilio del quejoso e Identificación\nOficial, puede ser también por medio de la página electrónica www.guerrero.gob/secretaria-de-losmigrantes, o bien al teléfono 01 747 47 1 29 80, así como a través del correo electrónico: migrantesguerrero@guerrero.gob.mx.\n8.9. Mecanismos de Exigibilidad\nEl otorgamiento de apoyos para traslado de fallecidos estará en función del Presupuesto del programa y fuera de cualquier juicio de discriminación social, sexo, nivel académico, partido político, creencia religiosa, económica y/o tradición cultural de cada grupo, se le podrá informar al solicitante si recibirá o no el servicio al momento de presentar su solicitud. La población beneficiaria de este Programa tiene derecho a recibir un trato digno, respetuoso y equitativo, tendrá derecho a solicitar y recibir información sobre el estado que guardan las gestiones que hubiere realizado en los términos que señala la Ley Federal y Estatal de Transparencia y Acceso a la Información Pública Gubernamental, y a recibir los apoyos conforme a las disposiciones normativas del Programa.\n8.10. Acta de Entrega - Recepción\nPor el tipo de servicio que se proporciona a través de este Programa, NO APLICA elaborar una\nActa de Entrega - Recepción, sólo se emite un recibo de entrega de apoyo.\n9. Criterios de Selección y elegibilidad que fallecen en el extranjero, Estados Unidos y Canadá, y que por motivo de encontrarse en situación de bajos recursos, no pueden sufragar los gastos para el traslado del cuerpo de su familiar fallecido del en nuestro Estado.\n9.1. Método de Selección de beneficiarios\nSon elegibles todos los deudos de guerrerenses fallecidos en el extranjero (Estados Unidos y\nCanadá), que cubran los requisitos plasmados en las presentes reglas de operación. Este derecho se\nPARA EL EJERCICIO FISCAL 2019 otorga a los ciudadanos guerrerenses por nacimiento y/o radicación en el estado de guerrero por más de cuatro años, de acuerdo a las disposiciones legales.\n10. Mecánica de Operación\nLa Secretaría de los Migrantes y Asuntos Internacionales, en el ámbito de su respectiva competencia, cancelará los apoyos, cuando se detecten faltantes de documentación en la integración de los requisitos para proporcionar el apoyo, por parte de los beneficiarios y/o el consulado, así como desviaciones o incumplimiento en la entrega oportuna de información relativa a la transparencia en la aplicación de los recursos; En estos casos, la SEMAI, podrá suspender la radicación de los apoyos y beneficios, sin perjuicio de lo establecido en las disposiciones aplicables.\nAsimismo, ante el incumplimiento a las presentes Reglas de Operación, la SEMAI, determinará la procedencia de la continuidad o, en su caso, el reintegro de los apoyos otorgados.\n10.1. Instancia Ejecutora\nLa instancia ejecutora del Programa de Apoyo a Deudos de Guerrerenses Fallecidos en el\nExtranjero es la Secretaría de los Migrantes y Asuntos Internacionales del Estado de Guerrero.\n10.2. Instancia administrativa y/o normativa\nLa Secretaría de la Contraloría y Transparencia Gubernamental y la Auditoría Superior del Estado, serán las instituciones que darán seguimiento a la aplicación de los recursos financieros autorizados al programa.\nLa Secretaría de Planeación y Desarrollo Regional, así como la Secretaria de Finanzas y\nAdministración, serán las encargadas de dar seguimiento a la aplicación de los recursos y los alcances de metas entre la población beneficiaria.\nLa Secretaria de los Migrantes y Asuntos Internacionales será la encargada de ejecutar el recurso del Programa de Apoyo a Deudos de Guerrerenses Fallecidos en el Extranjero en los 81 Municipios.\n10.3. Delimitación de atribuciones\nLa Secretaría de los Migrantes y Asuntos Internacionales, tendrá que respetar el tiempo que lleva\nCanadá. guerrerense fallecido:\n• Secretaría de los Migrantes y Asuntos Internacionales\n• Secretaría de Relaciones Exteriores\nPARA EL EJERCICIO FISCAL 2019\n• Consulado Mexicano.\n• Gobierno Municipal.\n• Familiares en Guerrero y en Estados Unidos o Canadá.\n11. Derechos, obligaciones y sanciones de los beneficiarios\n11.1. Derechos\nLa población beneficiarla de este Programa tiene por derecho humano a recibir un trato digno, respetuoso y equitativo, sin distinción de sexo, partido político o religión; tendrá derecho a solicitar y recibir información sobre el estado que guardan las gestiones que hubiere realizado en los términos que señala la Ley Federal de Transparencia y Acceso a la Información Pública Gubernamental, y a recibir los apoyos conforme a las disposiciones normativas del Programa.\n11.2. Obligaciones\nAsimismo, los beneficiarios en general tendrán la obligación de manifestar sin faltar a la verdad y si les fuera requerido, sus datos personales relativos a nombre, edad, sexo, domicilio, situación socioeconómica, Registro Federal de Contribuyentes (RFC), Clave Única de Registro de Población\n(CURP), grado máximo de estudios y número de dependientes económicos; de utilizar los apoyos para los fines con que fueron autorizados y de informar a la SEMAI, si le fuera requerido, sobre la aplicación de los mismos.\n11.3. Sanciones presentes Reglas de Operación, no tendrán el derecho de recibir los apoyos del programa.\nAsimismo, si hicieran mal uso de los apoyos recibidos, se procederá conforme a derecho con base en la normatividad aplicable.\n12. Interpretación\nAnte cualesquier tipo de controversia, las presentes Reglas de Operación serán interpretadas única y exclusivamente por la Secretaría de los Migrantes y Asuntos Internacionales, por la Secretaría de\nPlaneación y Desarrollo Regional y por la Secretaría de Contraloría y Transparencia Gubernamental.\nPARA EL EJERCICIO FISCAL 2019",
  "ordenamiento": "REGLA",
  "jurisdiccion": "GUERRERO",
  "fuente_oficial": "DIARIO OFICIAL DE LA FEDERACION",
  "Fecha de Publicación": "21 DE FEBRERO DE 2020",
  "ULTIMA REFORMA PUBLICADA": null,
  "status": "VIGENTE",
  "es_escaneado": false,
  "tiene_tablas": true,
  "materia": [
    "general"
  ]
}