{
  "titulo": "Acuerdo por el Que Se Emiten las Reglas de Operación del Programa Centro de Desarrollo Comunitario M",
  "Contenido": "JUÁREZ, DE LA LAJA EN ACAPULCO PARA EL\nEJERCICIO FISCAL 2018\nTEXTO ORIGINAL.\nACUERDO POR EL QUE SE EMITEN LAS REGLAS DE OPERACIÓN DEL PROGRAMA CENTRO DE\nDESARROLLO COMUNITARIO MARGARITA MAZA DE JUÁREZ, DE LA LAJA EN ACAPULCO\nPARA EL EJERCICIO FISCAL 2018.\nLIC. JOSÉ FRANCISCO SOLÍS SOLÍS, Director General del Sistema para el Desarrollo Integral de la\nFamilia del Estado de Guerrero, con fundamento en el artículo 27 fracción X del Reglamento Interior del\nOrganismo Público Descentralizado Sistema para el Desarrollo Integral de la Familia del Estado de\nGuerrero, así como la Ley que crea al Sistema para el Desarrollo Integral de la Familia del Estado de\nGuerrero número 107 publicada en el Periódico Oficial del Gobierno del Estado el 9 de marzo de 1977 y regido actualmente por la Ley Sobre el Sistema Estatal de Asistencia Social número 332, de acuerdo a la última reforma publicada en el Periódico Oficial del Gobierno del Estado número 15, de fecha 20 de febrero del 2015, y\nCONSIDERANDO\nQue en el Dictamen y Decreto número 654 del Presupuesto de Egresos del Estado de Guerrero para el\nEjercicio Fiscal 2018, se señala que se ejercerán los recursos bajo una política de gasto público, que permita dar cumplimiento a lo que globalmente prevén los ejes rectores del Plan Estatal de Desarrollo\n2015-2021, por lo que se alinea en el Eje III.- Guerrero Socialmente Comprometido objetivo 3.1. Construir un Estado Garante Pleno de los Derechos Sociales de las Personas. Estrategia: 3.1.2 Fortalecer el\nDesarrollo de Capacidades de los Integrantes de una Sociedad con Carencias, que permitan contribuir a incrementar su capacidad productiva y su calidad de vida.\nDentro de la política de Desarrollo Social, el Sistema para el Desarrollo Integral de la Familia del Estado de Guerrero, opera el Programa Centro de Desarrollo Comunitario Margarita Maza de Juárez, de la Laja en Acapulco, a través del cual, se contribuye a desarrollar las potencialidades individuales y colectivas mediante la implementación de procesos de formación calificada a través de diversas actividades de beneficiadas.\nPor lo expuesto y con fundamento en las disposiciones legales antes citadas, he tenido a bien expedir el siguiente:\nDESARROLLO COMUNITARIO MARGARITA MAZA DE JUÁREZ, DE LA LAJA EN ACAPULCO,\nPARA EL EJERCICIO FISCAL 2018.\nÚnico: Se emiten las Reglas de operación del Programa Centro de Desarrollo Comunitario Margarita\nMaza de Juárez, de la Laja en Acapulco para el Ejercicio Fiscal 2018.\nJUÁREZ, DE LA LAJA EN ACAPULCO PARA EL\nEJERCICIO FISCAL 2018\nPrimero: El presente acuerdo entrará en vigor al día siguiente de su publicación en el Periódico Oficial\nSegundo: Las Reglas de operación del Programa Centro de Desarrollo Comunitario Margarita Maza de\nJuárez, de la Laja en Acapulco, para el Ejercicio Fiscal 2018, se publican en su totalidad para mejor entendimiento.\nDado en la Ciudad de Chilpancingo de los Bravo, Guerrero, a los diecisiete días del mes de enero de dos mil dieciocho.\nDIRECTOR GENERAL DEL SISTEMA PARA EL DESARROLLO INTEGRAL DE LA FAMILIA DEL\nESTADO DE GUERRERO.\nLIC. JOSÉ FRANCISCO SOLÍS SOLÍS.\n(sic)\nCONTENIDO\n1. INTRODUCCIÓN\n1.1 Antecedentes\n1.2 Alineación programática\n1.3 Diagnóstico\n2. MISIÓN Y VISIÓN\n2.1 Misión\n2.2 Visión\n3. DEPENDENCIA O ENTIDAD RESPONSABLE DEL PROGRAMA\n4. FUNDAMENTO LEGAL\n5. OBJETIVOS Y ALCANCES\nJUÁREZ, DE LA LAJA EN ACAPULCO PARA EL\nEJERCICIO FISCAL 2018\n5.1 Objetivo General\n5.2 Objetivos Específicos\n5.3 Alcances\n6. METAS FÍSICAS\n7. PROGRAMACIÓN PRESUPUESTAL\n8. REQUISITOS Y PROCEDIMIENTO DE ACCESO\n8.1 Difusión\n8.2 Requisitos de Acceso\n8.3 Procedimientos de Acceso\n8.4 Requisitos de Permanencia, Causales de Baja o Suspensión Temporal\n8.5 Modos de Entrega del Beneficio\n9. PROCEDIMIENTOS DE INSTRUMENTACIÓN\n9.1 Operación\n9.2 Gastos de Operación\n10. TRANSPARENCIA\n10.1 Difusión\n10.2 Blindaje Electoral\n10.3 Supervisión y Control\n10.4 Mecanismos de Evaluación e Indicadores\n10.4.1 Evaluación\n10.4.2 Indicadores\n10.5 Auditoria\n10.6 Recursos no Devengados\n10.7 Contraloría Social\n10.8 Procedimiento de Queja o Inconformidad Ciudadana\n10.9 Mecanismos de Exigibilidad\n10.10 Acta de Entrega-Recepción\n11. CRITERIOS DE SELECCIÓN Y ELEGIBILIDAD\n11.1 Método de Selección de Beneficiarios\n12. MECÁNICA DE OPERACIÓN\n12.1 Instancia Ejecutora\nJUÁREZ, DE LA LAJA EN ACAPULCO PARA EL\nEJERCICIO FISCAL 2018\n12.2 Instancia administrativa y/o normativas (sic)\n12.3 Delimitación de atribuciones\n13. DERECHOS, OBLIGACIONES Y SANCIONES DE LOS BENEFICIARIOS DE PROGRAMAS\nSOCIALES\n8.1 Derechos\n8.2 Obligaciones\n8.3 Sanciones\n14. INTERPRETACIÓN\n15. ANEXOS\n1. Ficha de inscripción\n2. Credencial de identificación como participante de la capacitación\n3. Estudio socioeconómico\n4. Bitácora de Personas Atendidas\n1. INTRODUCCIÓN\nLos bajos niveles de vida de las personas en situación de vulnerabilidad se reflejan en la falta de acceso a servicios educativos, de salud y capacitación para el trabajo; en este sentido, el Sistema Estatal para el\nDesarrollo Integral de la Familia, reconoce la necesidad de promover la creación de un espacio donde se impulse el desarrollo integral de las familias en colonias, localidades y comunidades de la región\nAcapulco, ofreciendo una red de servicios y actividades socioculturales y deportivas, que representen una oportunidad para mejorar.\nEl Centro Desarrollo Comunitario “Margarita Maza de Juárez”, de la Laja en Acapulco, responde a las demandas de aquellas colonias, localidades y comunidades que concentran un gran número de ciudadanos en zonas de marginación y pobreza; representa una manera de cumplir el objetivo de dotar a los ciudadanos, integrantes de una sociedad con carencias, de un lugar propio para lograr un avance a través de cursos y/o talleres de capacitación, con una cuota de recuperación, y actividades socioculturales y deportivas, mejorando las condiciones de vida de la población menos favorecida. La y convivencia, recreación y encuentro comunitario, prevención y solución de situaciones de riesgo en las familias, al impulsar el desarrollo de sus capacidades y oportunidades para el trabajo.\nEn lo específico, el propósito del Centro de Desarrollo Comunitario “Margarita Maza de Juárez”, de la Laja en Acapulco, es brindar servicios preventivos y atención primaria a grupos de población vulnerable, en aspectos básicos para su desarrollo integral, ya que ofrecen una serie de talleres formativos, recreativos, productivos y culturales, así como servicios que buscan elevar la calidad de vida de la población usuaria y encontrar alternativas productivas que fortalezcan a las familias.\nJUÁREZ, DE LA LAJA EN ACAPULCO PARA EL\nEJERCICIO FISCAL 2018\n1.1 Antecedentes\nEl Centro Desarrollo Comunitario “Margarita Maza de Juárez”, de la Laja en Acapulco, inició operaciones en 1977, bajo la supervisión del Sistema Nacional para el Desarrollo de la Familia, brindando cursos de capacitación a la población; dejó de operar en el año 2008, desconociéndose las razones. En el año\n2012, se reactivan actividades, bajo la directriz del Sistema Estatal para el Desarrollo Integral de la\nFamilia, con el propósito de atender la necesidad de la población en materia de capacitaciones, talleres de oficios y servicios, para brindar conocimientos y habilidades a la comunidad, para que a través de ellos puedan emplearse o auto emplearse en un trabajo formal.\nA partir del año 2015, la operatividad del Centro Desarrollo Comunitario “Margarita Maza de Juárez”, de la\nLaja en Acapulco, se ve acrecentada con los servicios que se brindan a la población de colonias, localidades y comunidades, que buscan elevar la calidad de vida de la población usuaria y encontrar alternativas productivas que fortalezcan a las familias.\nEn el año 2016, se habilitaron las instalaciones para accesibilidad a personas con discapacidad.\nEn 2017, con la innovación de cursos extramuros, son llevados directamente a las colonias, localidades y comunidades.\n1.2 Alineación Programática\nDar cumplimiento a lo que globalmente se establece en los ejes rectores del Plan Estatal de Desarrollo\n2016-2021, por lo que se alinea en el Eje III.- Guerrero Socialmente Comprometido, Objetivo 3.1.\nConstruir un Estado Garante Pleno de los Derechos Sociales de las Personas, Estrategia 3.1.2\nFortalecer el Desarrollo de Capacidades de los Integrantes de una Sociedad con Carencias, que permitan contribuir a incrementar su capacidad productiva y su calidad de vida.\nLínea de Acción\nFomentar el acceso Efectivo de las familias a sus derechos sociales, particularmente de aquellas en pobreza extrema, mediante políticas públicas, coordinadas y concurrentes.\nAsimismo, el programa se enmarca al Programa Sectorial \"Desarrollo y Asistencia Social 2016 - 2021 ”, bienestar socioeconómico de la población, mediante la mitigación del ingreso a través de acciones que generen fuentes de ingresos sostenibles.\n1.3 Diagnóstico\nSegún datos del INEGI 2015, en la encuesta Intercensal que realizó, el Estado de Guerrero cuenta con una población total de 3,533,251. Acapulco, es el municipio más poblado del estado con una población total de 810 669 personas, con una superficie de 1882.60 km2, que representa el 2.6% respecto al\nJUÁREZ, DE LA LAJA EN ACAPULCO PARA EL\nEJERCICIO FISCAL 2018 territorio total del Estado. Acapulco representa el 23% de la población total; en donde el 45.06% vive con al menos tres carencias sociales, es decir 365 287 personas, que junto a la densidad poblacional ha venido acompañado con problemas de desempleo, estrés, problemas psicológicos, etc.\nPor lo anterior, se subraya la importancia de dotar a usuarios de las herramientas y capacidades que comprendan una formación competitiva y mejorar sus posibilidades de inserción en el mercado laboral, a su vez de incluirlos en marcos sociales integradores, con espacios y programas educativos y de capacitación, que permitan mejorar sus perspectivas de vida y laboral en la sociedad, con estas acciones trascendentales en materia de asistencia social.\nRazón por la cual, el Centro de Desarrollo Comunitario “Margarita Maza de Juárez”, de la Laja en\nAcapulco brinda las oportunidades para el trabajo y el autoempleo. La operación de este Centro permite a las familias de las colonias, localidades y comunidades acapulqueñas contar con una gran cantidad de servicios de capacitación y convivencia, recreación y encuentro comunitario, prevención y solución de situaciones de riesgo, al impulsar el desarrollo de sus capacidades y oportunidades.\nLos servicios que brinda el Centro de Desarrollo Comunitario Margarita Maza de Juárez serán proporcionados de acuerdo con la capacidad presupuestal con que se cuente; a la infraestructura, a los instructores y a los recursos humanos existentes. En caso de que se cumpla la meta programada, el\nCentro de Desarrollo Comunitario “Margarita Maza de Juárez” valorará la viabilidad de ampliar la prestación de servicios, de acuerdo al presupuesto, a la infraestructura y al recurso humano con que se cuente.\nLa población inconforme podrá acudir a la Contraloría Interna del Sistema para el Desarrollo Integral de la\nFamilia del Estado de Guerrero, así como a la Secretaría de Contraloría y Transparencia Gubernamental, a efecto de que se aclare la inconformidad presentada, ya que es el Órgano competente para conocer de las denuncias de violación e incumplimiento de los servicios.\nLa población objetivo son niñas y niños, adolescentes, jóvenes, adultos, adultos mayores y personas con discapacidad, que deseen mejorar sus capacidades y calidad de vida a través de servicios y actividades socioculturales y deportivas.\n2. MISIÓN Y VISIÓN\n2.1 Misión\nBrindar una atención integral a la población, ayudando a mantener o recuperar su capacidad productiva, a través de la generación de capacidades productivas y económicas en las colonias, localidades y comunidades, mejorando cada día la calidad del Programa, logrando con ello el bienestar y desarrollo social.\nJUÁREZ, DE LA LAJA EN ACAPULCO PARA EL\nEJERCICIO FISCAL 2018\n2.2 Visión sus capacidades y calidad de vida; promoviendo en ellas el sentido de pertenencia, elevando sus habilidades y potencialidades; así como, una opción de convivencia e integración al entorno social.\n3. DEPENDENCIA O ENTIDAD RESPONSABLE DEL PROGRAMA\nSistema para el Desarrollo Integral para la Familia, a través de la Dirección de Integración y Bienestar\nSocial, por medio del Centro de Desarrollo Comunitario “Margarita Maza de Juárez”, de la Laja en\nAcapulco.\n4. FUNDAMENTO LEGAL\na) Constitución Política de los Estados Unidos Mexicanos\nc) Ley General de Salud\nd) Ley de Asistencia Social\ne) Ley General para la Inclusión de las Personas con discapacidad\nf) Ley General de Prestación de Servicios para la Atención, Cuidado y Desarrollo Integral Infantil\ng) Ley General para la Prevención Social de la Violencia y la Delincuencia\nh) Ley número 817 para las Personas con Discapacidad del Estado\nj) Ley (sic) 454 de Presupuesto y Disciplina Fiscal del Estado de Guerrero\nk) Ley sobre el Sistema Estatal de Asistencia Social (sic) 332 (Última reforma publicada el 20 de\nFebrero del 2015)\nl) Ley (sic) 207 de Transparencia y Acceso a la Información Pública del Estado de Guerrero\nm) Ley de Coordinación Fiscal\nn) Plan Estatal de Desarrollo 2016 - 2021\no) Programa Sectorial “Desarrollo y Asistencia Social” 2016 - 2021\np) Estrategia Local “Guerrero Contigo”\nq) Decreto Número 654 del Presupuesto de Egresos del Estado de Guerrero\nr) Reglamento Interno (sic) del Sistema para el Desarrollo Integral de la Familia del Estado de\nGuerrero\ns) Manual de Organización del DIF Guerrero\nt) Y todos los ordenamientos normativos aplicables\nJUÁREZ, DE LA LAJA EN ACAPULCO PARA EL\nEJERCICIO FISCAL 2018\n5. OBJETIVOS Y ALCANCES\n5.1 Objetivo General.\nContribuir al desarrollo de potencialidades, individuales y colectivas, mediante la implementación de procesos de formación cualificada, a través de diversas actividades de capacitación laboral, orientadas a mejorar la calidad de vida de las personas beneficiadas, así como al desarrollo social.\n5.2 Objetivos específicos.\na) Fortalecer y potenciar procesos de participación ciudadana\nb) Desarrollar procesos formativos y de capacitación dirigidos a los ciudadanos de las colonias, localidades y comunidades de la región Acapulco, con el fin de cualificar habilidades, capacidades y destrezas Desarrollar las aptitudes de los ciudadanos para Ingresar al mercado laboral o proceso de emprendimiento\nc) Ofrecer el mayor número de servicios de calidad, a un costo mínimo, mediante una cuota de recuperación, que contribuyan en el desarrollo de identidad de la comunidad y en su economía\nd) Brindar a los usuarios del Centro de Desarrollo Comunitario, un espacio seguro y de calidad, para desarrollar sus habilidades y potencialidades; así como una opción de convivencia e integración al entorno social\n5.3 Alcances.\nEl Centro de Desarrollo Comunitario “Margarita Maza de Juárez”, de la Laja en Acapulco, surge como una necesidad de abatir el desempleo y fomentar el autoempleo, atendiendo el derecho al empleo, a través de la prestación de servicios, así como de actividades socioculturales y deportivas, a la población interesada en mantener o recuperar su capacidad productiva y/o social.\nLa población objetivo de este programa son niñas, niños, adolescentes, jóvenes, adultos, adultos mayores y personas con discapacidad, que deseen mejorar sus capacidades y calidad de vida.\n6. METAS FÍSICAS\nBrindar 6 250 servicios entre niñas, niños, adolescentes, jóvenes, adultos, adultos mayores y personas con discapacidad.\n7. PROGRAMACIÓN PRESUPUESTAL\nSistema para el Desarrollo Integral de la Familia del Estado de Guerrero, para la operación del Programa, con una inversión de $ 800,000.00 (Ochocientos mil pesos 00/100 M.N.).\nJUÁREZ, DE LA LAJA EN ACAPULCO PARA EL\nEJERCICIO FISCAL 2018\nEl costo - beneficio por servicio es de $128.00 (Un ciento veintiocho pesos 00/100 M.N.)\nA continuación, se agrega el Calendario Presupuestal Anual 2018:\n8. REQUISITOS Y PROCEDIMIENTOS DE ACCESO\n8.1 Difusión\nEl sistema para el Desarrollo Integral de la Familia a través de los diferentes medios de comunicación y de las redes sociales da conocer cada uno de los diferentes programas de asistencia social que ejecuta y opera en coordinación con las diferentes Direcciones que integran el Sistema como son: Programas\nAlimentarios, Proyectos Asistenciales, de Bienestar Social y Desarrollo Comunitario; cuyos requisitos se encuentran en las oficinas del Sistema ubicadas en Av. (sic) René Juárez Cisneros, Colonia Ciudad de los Servicios y en Av. Gabriel Leyva S/N esq. Ruffo Figueroa, Col. Burócratas, C.P. 39090, Chilpancingo, Guerrero, con un horario de atención de 8:00 am a 3:00 pm y/o los teléfonos 01 (747) 4722625, 01 (747)\n4718490 ext. 1108 y 1109. Asimismo, al correo electrónico: dirección.integracionbs@gmail.com o cdcacapulco@gmail.com\nLas reglas de operación de cada uno de los programas son difundidas por el personal capacitado de cada una de las Direcciones que conforman el Sistema para el Desarrollo Integral de la Familia y en la\nPor otra parte, los programas tienen cobertura Estatal. Se brinda atención en los 81 municipios del\nEstado, teniendo una capacidad de atención de niñas, niños y adolescentes, adultos, personas con discapacidad, adultos mayores y personas vulnerables por ingresos.\nLa información del programa Centro de Desarrollo Comunitario “Margarita Maza de Juárez”, de la Laja en\nAcapulco, se brinda en las instalaciones ubicadas en calle Guadalupe Victoria S/N Col. Laja, o bien, al teléfono 01 (744) 488 3061. En horario de atención de lunes a viernes de 9:00 a las 15:00 horas. perfil público es Margarita Maza de Juárez.\nJUÁREZ, DE LA LAJA EN ACAPULCO PARA EL\nEJERCICIO FISCAL 2018\n8.2 Requisitos de Acceso\nPara ser beneficiado por este programa en materia de capacitación para el trabajo, la persona interesada deberá presentar copia de los siguientes documentos personales:\na) Identificación Oficial (del padre o madre, en caso de ser menor de edad)\nb) Comprobante de domicilio (vigente)\nc) Acta de nacimiento\nd) CURP\ne) Certificado de Estudios Máximos (en caso de contar con él)\nf) 2 fotografías tamaño infantil\ng) Cubrir cuota de recuperación correspondiente a la capacitación requerida\nPara recibir el servicio de atención psicológica:\na) Registrarse en la Bitácora de Personas Atendidas\nb) Cubrir la cuota de recuperación\nRequisitos para recibir atención integral al Adulto Mayor:\na) Ser mayor de 60 años\nb) Identificación Oficial\nc) Comprobante de domicilio (vigente)\nd) Acta de nacimiento\ne) CURP\nf) 2 fotografías tamaño infantil\ng) Asistir los martes y los jueves a las actividades de convivencia\nLa documentación referida deberá presentarse en el área administrativa del Centro de Desarrollo\nComunitario “Margarita Maza de Juárez”, de la Laja en Acapulco, sito en calle Guadalupe Victoria S/N\nCol. La Laja, en horario de lunes a viernes de 09:00 a las 15:00 horas.\nLos servicios de atención jurídica, solamente requieren del registro para su obtención. representantes de las colonias, localidades o comunidades, a beneficiar, de la región Acapulco. Se deberá dirigir atenta solicitud, por escrito, a la Presidencia del Patronato DIF Guerrero.\n8.3 Procedimientos de Acceso\nLa manera de acceder al programa es a través de la demanda que existe, en la que se solicita capacitación para generar empleo y/o autoempleo, o bien, el servicio que necesita.\nJUÁREZ, DE LA LAJA EN ACAPULCO PARA EL\nEJERCICIO FISCAL 2018 requerida, establecidas en estas Reglas de Operación, en las instalaciones del Centro de Desarrollo\nComunitario “Margarita Maza de Juárez”, de la Laja en Acapulco, ubicadas en Calle (sic) Victoria s/n, col.\nLa Laja, Acapulco, Guerrero; en un horario de lunes a viernes de las 09:00 a 15:00 horas; llenar una ficha de inscripción (disponible de acuerdo a la capacidad del aula y disponibilidad de instructores). La respuesta a la solicitud se brinda de manera verbal en el momento en que se atiende al peticionario.\nEl beneficiario deberá cubrir la cuota de recuperación correspondiente al servicio a recibir, establecida y aprobada por la Junta de Gobierno, que son las siguientes:\nEl personal del centro de desarrollo comunitario elaborará, de manera digital, una ficha de inscripción por cada persona que ingrese a las capacitaciones y proporcionará, en días posteriores, la credencial de identificación como participante del curso-taller.\nLas personas incorporadas a este programa, formarán parte de un Padrón Único de Beneficiarios, que será de carácter público, siendo reservados sus datos personales, de acuerdo a la Ley (sic) 207 de\n8.4 Requisitos de Permanencia, Causales de Baja o Suspensión Temporal\nRequisitos de Permanencia\nJUÁREZ, DE LA LAJA EN ACAPULCO PARA EL\nEJERCICIO FISCAL 2018\na) Cumplir con un 80% de asistencia\nb) Conservar un buen comportamiento dentro del inmueble\nc) Cubrir en tiempo y forma la cuota correspondiente\nd) Cuidar y proteger los bienes muebles\nCausales de Baja\na) 3 faltas injustificadas consecutivas a las capacitaciones\nb) Pelearse dentro de las instalaciones\nc) Dañar el patrimonio de la Institución\nd) Faltar al respeto a directivos y colaboradores del Sistema\ne) La falta de pago de dos mensualidades consecutivas\nSuspensión Temporal\na) Por enfermedad contagiosa\nb) Presentarse en estado de embriaguez o bajo la influencia de algún narcótico o droga enervante\n8.5 Modos de entrega del beneficio\nEl programa Centro de Desarrollo Comunitario “Margarita Maza de Juárez”, de la Laja en Acapulco, brinda servicios por medio de capacitaciones para el trabajo, atenciones psicológica, jurídica e integral para personas adultos mayores, así como a través de actividades socioculturales y deportivas, a la población de las colonias, localidades y comunidades de la región Acapulco, a solicitud de la persona interesada.\nEl servicio se brindará a la población interesada, de acuerdo a la capacidad presupuestal, infraestructura\nEl inicio de cada curso, se publicita a través de los distintos medios de comunicación, así como en volantes impresos, donde se incorporan los requisitos establecidos en estas Reglas de Operación.\nSe dará el servicio de capacitación a las personas que cumplan en tiempo y forma, con los requisitos establecidos en estas reglas de operación.\nLa capacitación se brinda dentro de un horario, entre las 09:00 y 19:00 horas, en las instalaciones del\nCentro de Desarrollo Comunitario “Margarita Maza de Juárez”, de la Laja en Acapulco y/o en el lugar establecido en los cursos extramuros; otorgando a las personas que cumplen con la capacitación una constancia de participación del conocimiento adquirido.\nLa entrega de la credencial de identificación como participante del curso- taller se hará posterior al inicio de la capacitación.\nJUÁREZ, DE LA LAJA EN ACAPULCO PARA EL\nEJERCICIO FISCAL 2018\n9. PROCEDIMIENTOS DE INSTRUMENTACIÓN.\n9.1 Operación\nEl Centro de Desarrollo Comunitario “Margarita Maza de Juárez” de la Laja en Acapulco, es un establecimiento público que proporciona servicios de capacitación para el trabajo y el autoempleo a la población en general; así como atenciones psicológicas, jurídicas y a personas adulto mayor.\nPara la realización y / o ejecución del programa el sistema para el desarrollo integral de la familia realiza las siguientes actividades:\na) Todos los beneficiarios con el programa Centro de Desarrollo Comunitario “Margarita Maza de\nJuárez” de la Laja en Acapulco, deben de cumplir con todos los requisitos y procedimientos de las reglas de operación.\nb) El recurso proviene de Inversión Estatal Directa (IED) gestionado por el Sistema para el\nDesarrollo Integral de la Familia ante la Secretaría de Finanzas y Administración, una vez solicitado el recurso, Finanzas realiza la transferencia para poner en marcha el programa.\nc) La Dirección de Integración y Bienestar Social se encarga de presentar las Reglas de\nOperación de cada una de sus áreas ante la Dirección de Finanzas del DIF Estatal para asignar el recurso correspondiente.\nd) El Centro de Desarrollo Comunitario “Margarita Maza de Juárez” de la Laja en Acapulco ejecuta el presupuesto asignado mes con mes en los gastos derivados de materiales e insumos que son utilizados para los servicios de capacitación, atenciones psicológicas, jurídicas, a personas adulto mayor y actividades socioculturales y deportivas.\ne) La persona interesada acude al área administrativa del Centro de Desarrollo Comunitario\n“Margarita Maza de Juárez” de la Laja en Acapulco a solicitar información de los servicios.\nf) La persona interesada deberá cumplir con todos los requisitos establecidos en las Reglas de\nOperación.\ng) Se realizan las gestiones necesarias para la designación de instructores (en caso de capacitación) o personal profesional (en caso de atenciones) o personal de apoyo (en caso de actividades socioculturales o deportivas).\nh) Se otorga la atención y servicios establecidos en estas reglas de operación.\nJUÁREZ, DE LA LAJA EN ACAPULCO PARA EL\nEJERCICIO FISCAL 2018\n9.2 Gastos de operación\nPara el desarrollo de las diversas acciones asociadas con la planeación, programación, operación, supervisión, seguimiento y evaluación del Programa, el DIF Guerrero, destinará recursos, en función de la cobertura de atención y de acuerdo al presupuesto total asignado al Programa, se destinará hasta un 3% de la inversión total aprobada de acuerdo a la Ley de Coordinación Fiscal recursos que provienen de\nInversión Estatal Directa.\n10. TRANSPARENCIA\n10.1 Difusión\nLa instancia responsable es el Centro de Desarrollo Comunitario “Margarita Maza de Juárez, de la Laja en Acapulco, quien difundirá a través de diferentes medios de comunicación; trípticos, periódico, redes sociales, en las cuales se dará a conocer la información relacionada con las características del Programa.\nAsimismo, se dará amplia difusión al Programa a nivel regional; la información del programa se dará a conocer en la página de internet del Gobierno del Estado, desagregada por municipio, barrio o zona urbano-marginada, proyecto y nombre del beneficiario; Las copias de los expedientes de los beneficiarios y/o beneficiarias estarán disponibles oportunamente para su consulta en las oficinas del Centro de\nDesarrollo Comunitario “Margarita Maza de Juárez”, de la Laja en Acapulco, ubicadas en calle Guadalupe\nVictoria S/N, Col. La Laja, C.P. 39600, Acapulco, Guerrero; por otra parte, la papelería, documentación oficial, así como la publicidad y promoción de los Programas, deberán incluir la leyenda descrita en el apartado de \"Blindaje Electoral\".\nLa información de montos y beneficiarios deberá ser publicada en los términos de la Ley No. (sic) 207 de\nTransparencia y Acceso a la Información Pública del Estado de Guerrero.\nUna vez autorizadas estas Reglas de Operación, por las instancias correspondientes, estarán disponibles para su consulta en las oficinas de la Dirección de Integración y Bienestar Social.\n10.2 Blindaje Electoral\nLa operación y ejecución de los recursos estatales destinados al Programa, deberán observar y atender las medidas que emita la Secretaría de Contraloría y Transparencia Gubernamental, para coadyuvar a que éstos no sean utilizados con fines políticos en el desarrollo de procesos electorales federales, estatales y municipales.\nEste programa queda sujeto a los lineamientos que en materia de blindaje electoral emita el INE, por lo que una vez publicadas, se darán a conocer en la página oficial del Estado las modificaciones que apliquen a este Programa.\nJUÁREZ, DE LA LAJA EN ACAPULCO PARA EL\nEJERCICIO FISCAL 2018\n\"Este Programa es de carácter público, no es patrocinado ni promovido por partido político alguno y sus recursos provienen de los impuestos que pagan todos los contribuyentes. Está prohibido el uso de este programa con fines políticos, electorales, de lucro y otros distintos a los establecidos. Quien haga uso indebido de los recursos de este programa deberá ser denunciado y sancionado de acuerdo con la ley aplicable y ante la autoridad competente\".\nEn cuanto a la publicidad en medios electrónicos, impresos, complementarlos o de cualquier otra índole, vinculados con los Programas de comunicación social, se deberá incluir la siguiente leyenda:\n“Este Programa es público y queda prohibido su uso con fines partidistas o de promoción personal”.\n10.3 Supervisión y Control\nLa supervisión inicial compete al coordinador del Centro de Desarrollo Comunitario; en forma directa, compete a la Dirección de Integración y Bienestar Social, quienes enviarán trimestralmente a la\nSecretaría de Finanzas, a la Secretaría de Planeación y a la Secretaría de Contraloría, informes sobre el\nPresupuesto ejercido establecidos por el Consejo Nacional de Armonización Contable (CONAC) y con base en los indicadores de resultados previstos en las Reglas de Operación.\nDichos informes se deberán presentar de acuerdo a las reglas de operación de las instancias referidas; así también, a las demás direcciones que conforman el Sistema para el Desarrollo Integral de la Familia ya que se desarrollan procesos en conjunto entre los que destacan los avances Físicos Financieros y requisiciones de equipamiento de material.\nTodos los procesos se controlan a través de la gestión administrativa, ya que no se manejan ni ejecutan los recursos asignados mediante liquidez. Asimismo, con el objetivo de conocer el número de beneficiarios, se elabora un padrón por servicios brindados, de capacitación, atención psicológica, jurídica, integral al adulto mayor, así como por beneficiarios de las actividades socioculturales y deportivas.\n10.4 Mecanismos de Evaluación e Indicadores\n10.4.1 Evaluación\n“Margarita Maza de Juárez”, de la Laja en Acapulco, se realizará mediante indicadores de desempeño, Familia, para la integración de los informes correspondientes.\n10.4.2 Indicadores\nLos indicadores para este programa son los siguientes:\nJUÁREZ, DE LA LAJA EN ACAPULCO PARA EL\nEJERCICIO FISCAL 2018\nFRECUENCIA\nINDICADOR FORMULA OBJETIVO\nDE MEDICIÓN\nNTPND Conocer la cantidad\nCF = porcentual de Presidentas\nNTPCPP x 100 de DIF Municipales que\nCF = Cobertura de la Difusión han sido contempladas a\nNTPND = Número Total de presidentas de participar en los\nCobertura de la\nDIF municipales Notificados de la Difusión. Mensual programas.\nDifusión\nNTPCPP = Número Total de Presidentas\nMunicipales Contempladas a Participar en los Programas.\nNSA Conocer la cantidad\nEAS = porcentual de solicitudes\nNTSR x 100 que han sido atendidas.\nEficacia en la\nEAS = Eficacia en la Atención a\nAtención de las Anual\nSolicitudes.\nSolicitudes\nNSA = Número de Solicitudes Atendidas.\nNTSR = Número Total de Solicitudes\nRecibidas.\nPA Conocer el recurso que\nEPPI= está asignado para su\nEficacia en la PPI x 100 liberación y cuando.\nPresentación EPPI = Eficacia en la Presentación del de la Programa de Inversión. Mensual\nProgramación PA = Presupuesto Asignado. de Inversión PPI = Presupuesto Programado Inicial.\nPM Indicar la aprobación del\nAAPI= recurso y mostrar si hubo\nÍndice de\nPAu x 100 alguna modificación\nAvance en la posterior a la\nAprobación de\nAAPI = Avance en la Aprobación del Mensual autorización.\nPrograma de Inversión.\nProgramación\nPM = Presupuesto Modificado. de la Inversión.\nPAu = Presupuesto Autorizado.\nRPC Conocer la cantidad de\nELR= recurso liberado a la fecha\nPL x 100 para la operatividad del\nEficacia en la programa.\nLiberación de Mensual\nELR = Eficacia en la Liberación de los los Recursos. recursos.\nRPC = Recursos Programados del Calendario.\nPL = Presupuesto Liberado.\nPL Indicar el presupuesto\nALR= liberado y el total de\nÍndice de\nTRLx 100 recursos disponibles.\nAvance en la\nALR = Avance en la Liberación de los Mensual\nLiberación de\nRecursos. los Recursos\nPL = Presupuesto Liberado.\nTRL = Total de Recursos Liberados.\nJUÁREZ, DE LA LAJA EN ACAPULCO PARA EL\nEJERCICIO FISCAL 2018\n{\"tabla_1\":{\"columnas\":[\"(sin encabezado)\",\"NAS\",\"(sin encabezado)\",\"Conocer el\"],\"filas\":[{\"columna_1\":\"(sin dato)\",\"columna_2\":\"ASA=\",\"columna_3\":\"(sin dato)\",\"columna_4\":\"cumplimiento de las\"},{\"columna_1\":\"Índice de\",\"columna_2\":\"NAPx 100\",\"columna_3\":\"(sin dato)\",\"columna_4\":\"acciones programadas.\"},{\"columna_1\":\"Avance en la\",\"columna_2\":\"(sin dato)\",\"columna_3\":\"(sin dato)\",\"columna_4\":\"(sin dato)\"},{\"columna_1\":\"(sin dato)\",\"columna_2\":\"(sin dato)\",\"columna_3\":\"Mensual\",\"columna_4\":\"(sin dato)\"},{\"columna_1\":\"Supervisión de\",\"columna_2\":\"ASA = Avance en la Supervisión de Acciones.\",\"columna_3\":\"(sin dato)\",\"columna_4\":\"(sin dato)\"},{\"columna_1\":\"Acciones.\",\"columna_2\":\"NAS = Numero de Acciones Supervisadas.\",\"columna_3\":\"(sin dato)\",\"columna_4\":\"(sin dato)\"},{\"columna_1\":\"(sin dato)\",\"columna_2\":\"NAP = Numero de Acciones Programadas.\",\"columna_3\":\"(sin dato)\",\"columna_4\":\"(sin dato)\"},{\"columna_1\":\"(sin dato)\",\"columna_2\":\"NBS\",\"columna_3\":\"(sin dato)\",\"columna_4\":\"Conocer el impacto\"},{\"columna_1\":\"(sin dato)\",\"columna_2\":\"ESA=\",\"columna_3\":\"(sin dato)\",\"columna_4\":\"alcanzado al atender a\"},{\"columna_1\":\"(sin dato)\",\"columna_2\":\"NBACS x 100\",\"columna_3\":\"(sin dato)\",\"columna_4\":\"la población vulnerable\"},{\"columna_1\":\"Eficacia en la\",\"columna_2\":\"(sin dato)\",\"columna_3\":\"(sin dato)\",\"columna_4\":\"que requiere los\"},{\"columna_1\":\"Supervisión de\",\"columna_2\":\"ESA = Eficacia en la Supervisión de Acciones.\",\"columna_3\":\"Mensual\",\"columna_4\":\"servicios del programa.\"},{\"columna_1\":\"Acciones.\",\"columna_2\":\"NBS = Número de Beneficiarios Supervisados.\",\"columna_3\":\"(sin dato)\",\"columna_4\":\"(sin dato)\"},{\"columna_1\":\"(sin dato)\",\"columna_2\":\"NBACS = Número de Beneficiarios de Acuerdo al\",\"columna_3\":\"(sin dato)\",\"columna_4\":\"(sin dato)\"},{\"columna_1\":\"(sin dato)\",\"columna_2\":\"Calendario de Supervisión.\",\"columna_3\":\"(sin dato)\",\"columna_4\":\"(sin dato)\"},{\"columna_1\":\"(sin dato)\",\"columna_2\":\"TRC\",\"columna_3\":\"(sin dato)\",\"columna_4\":\"Conocer la cantidad\"},{\"columna_1\":\"(sin dato)\",\"columna_2\":\"ARC=\",\"columna_3\":\"(sin dato)\",\"columna_4\":\"porcentual de recursos\"},{\"columna_1\":\"Índice de\",\"columna_2\":\"TRLx 100\",\"columna_3\":\"(sin dato)\",\"columna_4\":\"que han sido\"},{\"columna_1\":\"Avance de los\",\"columna_2\":\"(sin dato)\",\"columna_3\":\"Mensual\",\"columna_4\":\"comprobados.\"},{\"columna_1\":\"Recursos\",\"columna_2\":\"ARC = Avance de los Recursos Comprobados.\",\"columna_3\":\"(sin dato)\",\"columna_4\":\"(sin dato)\"},{\"columna_1\":\"Comprobados.\",\"columna_2\":\"TRC = Total de Recursos Comprobados.\",\"columna_3\":\"(sin dato)\",\"columna_4\":\"(sin dato)\"},{\"columna_1\":\"(sin dato)\",\"columna_2\":\"TRL = Total de Recursos Liberados.\",\"columna_3\":\"(sin dato)\",\"columna_4\":\"(sin dato)\"},{\"columna_1\":\"(sin dato)\",\"columna_2\":\"TRE\",\"columna_3\":\"(sin dato)\",\"columna_4\":\"Conocer la cantidad\"},{\"columna_1\":\"(sin dato)\",\"columna_2\":\"ARE=\",\"columna_3\":\"(sin dato)\",\"columna_4\":\"porcentual de recursos\"},{\"columna_1\":\"Índice de\",\"columna_2\":\"TRLx 100\",\"columna_3\":\"(sin dato)\",\"columna_4\":\"que han sido ejercidos\"},{\"columna_1\":\"Avance de los\",\"columna_2\":\"ARE = Avance de los Recursos Ejercidos.\",\"columna_3\":\"(sin dato)\",\"columna_4\":\"con respecto al recurso\"},{\"columna_1\":\"(sin dato)\",\"columna_2\":\"(sin dato)\",\"columna_3\":\"Mensual\",\"columna_4\":\"(sin dato)\"},{\"columna_1\":\"Recursos\",\"columna_2\":\"TRE = Total de Recursos Ejercidos.\",\"columna_3\":\"(sin dato)\",\"columna_4\":\"liberado.\"},{\"columna_1\":\"Ejercidos.\",\"columna_2\":\"TRL = Total de Recursos Liberados.\",\"columna_3\":\"(sin dato)\",\"columna_4\":\"(sin dato)\"}]}}\n10.5 Auditoría\nEl ejercicio del recurso y la operatividad del Programa, están sujetos a las disposiciones estatales aplicables y podrá ser auditado por la Secretaría de Contraloría y Transparencia Gubernamental, así como por la Auditoría General del Estado, conforme a la legislación vigente y en el ámbito de sus respectivas competencias. dichas instancias para realizar, en el momento en que lo juzguen pertinentes, las auditorías que consideren necesarias; así como el seguimiento y la solventación a las observaciones planteadas por los órganos de control.\n10.6 Recursos no devengados estuviesen devengados al 31 de diciembre del Ejercicio Fiscal correspondiente.\nJUÁREZ, DE LA LAJA EN ACAPULCO PARA EL\nEJERCICIO FISCAL 2018\n10.7 Contraloría Social\nCon la finalidad de incrementar la participación ciudadana, se crearán Comités de Contraloría Social, como un órgano ciudadano de control, vigilancia y evaluación de las actividades del Programa, conformados por los beneficiarios (as), los sectores sociales, y los representantes de la colonia, localidad o comunidad, quienes de manera específica supervisarán la gestión gubernamental, y que el manejo de los recursos públicos se realicen en términos de transparencia, eficacia, legalidad y honradez.\nLos objetivos específicos de este Órgano de Contraloría Social son:\na) Hacer más transparentes las decisiones y la ejecución de los recursos\nb) Incrementar la participación ciudadana\nc) Fomentar la organización social\nd) Inhibir los actos de corrupción y de cooptación social, política y electoral\ne) Incrementar la eficiencia de los recursos públicos\nf) Fortalecer la cultura de la legalidad\ng) Mejorar la rendición de cuentas\nh) Perfeccionar la democracia e incorporar la evaluación ciudadana\nLos Comités de Contraloría Social se conforman con la representación de la comunidad beneficiada por el Programa, y fungirán como interlocutores con el Sistema para el Desarrollo Integral de la Familia del\nEstado de Guerrero, en el ejercicio de la contraloría social.\nEl vocal del Comité de Contraloría Social, será el responsable de hacer llegar las quejas o denuncias recibidas al Sistema para el Desarrollo Integral de la Familia del Estado de Guerrero, quien dará respuesta en un plazo no mayor de 15 días a partir de la fecha de recepción de la queja o denuncia.\nPara impulsar la realización de las actividades de Contraloría Social se brindará capacitación y asesoría, a los servidores y servidoras públicas que intervienen en la operación del Programa, así como a los integrantes de los Comités Locales, para que estos realicen adecuadamente sus actividades de seguimiento y vigilancia.\nSe deberá integrar un Programa de Trabajo de acuerdo al programa; debe incluir la descripción de las actividades, responsables, metas y calendarización de las actividades para su cumplimiento.\nEstado de Guerrero, serán los encargados de conformar los Comités de Contraloría Social; asimismo, darán acompañamiento durante las actividades de control, seguimiento y vigilancia de los proyectos.\nEl Comité de Contraloría Social debe estar constituido por un Presidente, un Secretario y un Vocal, mínimamente; electos de entre la población beneficiada en donde se va a realizar la entrega del programa, y tendrá que ser vigilado por un solo Comité.\nJUÁREZ, DE LA LAJA EN ACAPULCO PARA EL\nEJERCICIO FISCAL 2018\nEl Comité de Contraloría Social deberá controlar, vigilar y dar seguimiento al proyecto a través de los formatos que integran el expediente comunitario, integrado por:\na) Acta de Conformación del Comité de Contraloría Social\nb) Reunión con beneficiarios y beneficiarias\nc) Ficha Informativa del Programa\nd) Cédula de Vigilancia del Programa\ne) Actividades de Difusión y Capacitación\nf) Quejas, Denuncias o Reconocimientos\ng) Informe Anual\n10.8 Procedimientos de Queja o Inconformidad Ciudadana\nLos beneficiarios (as) pueden presentar quejas y denuncias ante las instancias correspondientes sobre cualquier hecho, acto u omisión que produzca o pueda producir daños al ejercicio de sus derechos establecidos en las presentes reglas de operación o contravengan sus disposiciones y de la demás normatividad aplicable. a. En el Sistema DIF Guerrero\nTeléfonos: (747) 471 8490 o 471 8492\nCorreo electrónico: buzon.dif@guerrero.gob.mx\nDomicilio: Centro de Rehabilitación Integral Guerrero. Boulevard Lic. René Juárez Cisneros S/N, Col. Ciudad de los Servicios, Chilpancingo, Guerrero. C.P. 39095. b. En la Secretaría de Contraloría y Transparencia Gubernamental.\nTeléfonos: (474) 471 9740 o 471 9741\nCorreo electrónico: contraloria@guerrero.gob.mx\nDomicilio: Palacio de Gobierno Primer Piso Edificio Norte, Blvd. R. (sic) Juárez Cisneros No. 62, Col. Ciudad de los Servicios, Chilpancingo, Gro. C.P. 39075.\nLas quejas y denuncias de la ciudadanía derivadas de alguna irregularidad en la operación del Programa, podrán presentarse por escrito, por comparecencia del beneficiario (a), por correo electrónico o vía telefónica y deberá proporcionar los siguientes datos:\na) Nombre del servidor público\nb) Área de adscripción\nc) Objeto de la denuncia\nd) Nombre, domicilio e identificación oficial del quejoso\n10.9 Mecanismo de Exigibilidad\nLos casos en los que se podrán exigir los derechos por incumplimiento o por violación de los mismos, pueden ocurrir en al menos los siguientes casos:\nJUÁREZ, DE LA LAJA EN ACAPULCO PARA EL\nEJERCICIO FISCAL 2018\na) Cuando una persona solicitante cumpla con los requisitos y criterios de inclusión para acceder a determinado derecho.\nb) Cuando la persona solicitante exija que se cumpla con dicho derecho de manera integral en tiempo y forma.\nc) Cuando no se pueda satisfacer toda la demanda de incorporación al programa por restricción presupuestal.\nSerá la Secretaría de Contraloría y Transparencia Gubernamental del Gobierno del Estado quién atenderá las denuncias de violación e incumplimiento de derechos en materia de Desarrollo Social.\n10-10 Acta de Entrega-Recepción\nCuando sea solicitado por las autoridades competentes, se hará entrega de los documentos que demuestran con transparencia que los recursos fueron ejercidos para los fines establecidos del mismo y que son vigilados a través de los mecanismos de participación ciudadana. Entre los que se encuentran los siguientes:\na) Informe Anual\nb) Avances físico - financieros\nc) Bitácora fotográfica por capacitación\nd) Lista de asistencia por capacitación y de asistencia integral al adulto mayor\ne) Registro de beneficiarios por atención psicológica y jurídica\nf) Registro de beneficiarios por actividad sociocultural y deportiva\ng) Padrón General de Beneficiarios\n11. CRITERIOS DE SELECCIÓN Y ELEGIBILIDAD\n11.1 Método de Selección de Beneficiarios\nLa selección de beneficiarios dependerá de la capacidad de asistentes al curso.\nSi el interesado presenta la documentación, pero el curso ya está avanzado, quedará en espera al inicio de la próxima capacitación, por lo que se le estará llamando vía telefónica para comunicarle la fecha respectiva.\n12. MECÁNICA DE OPERACIÓN\n12.1 Instancia Ejecutora\nLa Instancia Ejecutora será el Sistema para el Desarrollo Integral de la Familia del Estado de Guerrero, a través de la Dirección de Integración y Bienestar Social, por medio del Centro de Desarrollo Comunitario\n“Margarita Maza de Juárez”, de la Laja en Acapulco, quien deberá operar con apego a la programación, presupuestación, calendario de ejecución, ejercicio y control del gasto público.\nJUÁREZ, DE LA LAJA EN ACAPULCO PARA EL\nEJERCICIO FISCAL 2018\n12.2 Instancia Administrativa y/o normativa\nLa Instancia Administrativa y/o Normativa será la Dirección General del Sistema para el Desarrollo\nIntegral de la Familia del Estado de Guerrero, por conducto de la Dirección de Integración y Bienestar\nSocial, quien tendrá la responsabilidad de definir los métodos y procedimientos para normar y regular la ejecución del programa, tales como mecanismos de control y seguimiento durante su ejecución, para asegurar el cumplimiento de los objetivos y metas trazadas.\n12.3 Delimitación de atribuciones\nEl DIF Guerrero establecerá los mecanismos de coordinación necesarios para garantizar que el\nPrograma no se contraponga, afecte o presente duplicidad con otros programas o acciones del Gobierno\nEstatal; la coordinación institucional y vinculación de acciones busca potenciar el impacto de los recursos, fortalecer la cobertura de las acciones, detonar la complementariedad y reducir gastos administrativos.\n13. DERECHOS, OBLIGACIONES Y SANCIONES DE LOS BENEFICIARIOS DE PROGRAMAS\nSOCIALES.\n13.1 Derechos\nToda niña, niño, adolescentes, jóvenes, adultos, adultos mayores o persona con discapacidad, que deseen mejorar sus capacidades y calidad de vida, tiene derecho a participar y a beneficiarse de los servicios que ofrece el Centro de Desarrollo Comunitario “Margarita Maza de Juárez”, de la Laja en\nAcapulco, de acuerdo con los principios rectores de asistencia social, siempre y cuando cumpla con los requisitos implementados en estas reglas de operación y en los términos establecidos en la Constitución\nPolítica de los Estados Unidos Mexicanos y en Leyes locales del Estado, así como:\na) Recibir la información necesaria de manera clara fidedigna y oportuna para participar en el\nPrograma.\nb) Un trato digno, respetuoso, oportuno, con calidad y equitativo sin discriminación alguna.\nc) Reserva y privacidad de su información personal.\nd) Recibir el apoyo tal como se establece en estas Reglas de Operación.\n13.2 Obligaciones\nTodo usuario o beneficiario de los servicios que ofrece el Centro de Desarrollo Comunitario “Margarita\nMaza de Juárez”, tienen las obligaciones establecidas en la Constitución Política de los Estados Unidos\nMexicanos y en Leyes locales del Estado, así como:\na) Proporcionar información verídica\nb) Dirigirse con respeto con directivos y personal que presta el servicio\nc) Entregar en tiempo y forma los requisitos establecidos en las Reglas de Operación para ser beneficiario del Programa\nJUÁREZ, DE LA LAJA EN ACAPULCO PARA EL\nEJERCICIO FISCAL 2018\nd) Pagar la cuota de recuperación correspondiente\ne) Dar aviso cuando ya no vaya a asistir a la capacitación\n13.3 Sanciones\nLos beneficiarios (as) de los servicios que ofrece el Centro de Desarrollo Comunitario “Margarita Maza de\nJuárez”, de la Laja en Acapulco, que incumplan en la Disposiciones Normativas establecidas en el numeral 8.4 de estas Reglas de Operación serán acreedores a las sanciones siguientes:\nPara el caso a daños de los bienes muebles, el usuario está obligado a responder del pago y/o reparación del mismo. En caso de incumplimiento, se aplicarán los procedimientos jurídicoadministrativos a que haya lugar (Artículos 370 y 399 del Código Penal Federal).\nUna vez realizado el pago de la cuota de recuperación por servicio solicitado, no se hará devolución del mismo, si por alguna razón requiere no recibir el beneficio adquirido.\n14. INTERPRETACIÓN\nLa interpretación de las presentes Reglas de Operación para efectos administrativos, estarán a cargo del\nSistema DIF Guerrero, así como de la Secretaría de Contraloría y Transparencia Gubernamental, en el ámbito de sus respectivas competencias.\nDIRECTORA DE INTEGRACIÓN Y BIENESTAR SOCIAL.\nC. LETICIA WINTER PÉREZ.\nRúbrica.\nDIRECTOR GENERAL DEL SISTEMA DIF GUERRERO.\nLIC. JOSÉ FRANCISCO SOLÍS SOLÍS.\nRúbrica.\nJUÁREZ, DE LA LAJA EN ACAPULCO PARA EL\nEJERCICIO FISCAL 2018\nANEXOS\nJUÁREZ, DE LA LAJA EN ACAPULCO PARA EL\nEJERCICIO FISCAL 2018\nJUÁREZ, DE LA LAJA EN ACAPULCO PARA EL\nEJERCICIO FISCAL 2018\nJUÁREZ, DE LA LAJA EN ACAPULCO PARA EL\nEJERCICIO FISCAL 2018",
  "ordenamiento": "REGLA",
  "jurisdiccion": "GUERRERO",
  "fuente_oficial": "DIARIO OFICIAL DE LA FEDERACION",
  "Fecha de Publicación": "06 de Abril de 2018",
  "ULTIMA REFORMA PUBLICADA": null,
  "status": "VIGENTE",
  "es_escaneado": false,
  "tiene_tablas": true,
  "materia": [
    "general"
  ]
}