{
  "titulo": "Acuerdo por el Que Se Emiten las Reglas de Operación del Programa de Acciones Prioritarias, para el",
  "Contenido": "PRIORITARIAS PARA EL EJERCICIO FISCAL 2013, PUBLICADO EN EL PERIODICO OFICIAL DEL\nTEXTO ORIGINAL\nAcuerdo publicado en el Periódico Oficial del Gobierno del Estado No. 16 Alcance II, el Viernes\n24 de Febrero de 2012.\nACUERDO POR EL QUE SE EMITEN LAS REGLAS DE OPERACIÓN DEL PROGRAMA DE\nACCIONES PRIORITARIAS, PARA EL EJERCICIO FISCAL 2012.\nM.C. DAVID JIMÉNEZ RUMBO, SECRETARIO DE DESARROLLO SOCIAL, CON\nFUNDAMENTO EN LOS ARTÍCULOS 18 FRACCIÓN II, 19 Y 21 DE LA LEY ORGÁNICA DE LA\nADMINISTRACIÓN PÚBLICA DEL ESTADO DE GUERRERO; 1°, 2° Y 3° DEL DECRETO DEL\nPRESUPUESTO DE EGRESOS DEL ESTADO DE GUERRERO PARA EL EJERCICIO FISCAL DEL\nPRESENTE AÑO.\nQUE EL DECRETO DEL PRESUPUESTO DE EGRESOS DEL ESTADO DE GUERRERO PARA\nEL EJERCICIO FISCAL 2012, REFIERE QUE LOS RECURSOS PROPUESTOS PARA LA EJECUCIÓN\nDE LOS PROGRAMAS, CONSTITUYEN UNO DE LOS PRINCIPALES FACTORES, PARA\nSATISFACER EN LA MEDIDA DE LO POSIBLE, LAS PRINCIPALES DEMANDAS DE LA CIUDADANÍA,\nEXPRESADAS EN EL PLAN ESTATAL DE DESARROLLO 2011-2015.\nQUE LA ACTUAL ADMINISTRACIÓN PONE ESPECIAL ATENCIÓN A LA POBLACIÓN QUE\nPRESENTA PROBLEMAS Y/O NECESIDADES DE TIPO APREMIANTE, SOCIAL, CULTURAL,\nDEPORTIVA, PARA EL DESARROLLO HUMANO Y PRODUCTIVO, DE CAPACITACIÓN, ASÍ COMO\nDE OBRA PÚBLICA DE MENOR COSTO, SOLICITADAS POR LA POBLACIÓN DE LAS SIETE\nREGIONES DEL ESTADO, CARACTERIZADAS POR POBREZA Y POBREZA EXTREMA.\nQUE EL PROGRAMA DE ACCIONES PRIORITARIAS, TIENE COMO PRINCIPAL OBJETIVO\nPROPICIAR LAS CONDICIONES SOCIALES PARA QUE LOS SECTORES MÁS VULNERABLES\nCUENTEN CON LOS ELEMENTOS BÁSICOS DE INFRAESTRUCTURA SOCIAL, SERVICIOS Y\nAPOYOS ASISTENCIALES URGENTES; A FIN DE QUE EN IGUALDAD DE OPORTUNIDADES Y\nRESPETO A LOS DERECHOS CONSTITUCIONALES, ACCEDAN A LOS SATISFACTORES MÍNIMOS\nDE BIENESTAR SOCIAL.\nSIGUIENTE:\nACCIONES PRIORITARIAS, PARA EL EJERCICIO FISCAL 2012.\nÚNICO.- SE EMITEN LAS REGLAS DE OPERACIÓN DEL PROGRAMA DE ACCIONES\nPRIORITARIAS PARA EL EJERCICIO FISCAL 2012, LAS QUE SE CONTIENEN EN EL ANEXO DE\nINTEGRANTE DEL MISMO.\nPRIMERO.- LAS PRESENTES REGLAS DE OPERACIÓN, ENTRARAN EN VIGOR AL DÍA\nGUERRERO.\nSEGUNDO.-QUEDAN ABROGADAS LAS REGLAS DE OPERACIÓN DEL PROGRAMA DE\nACCIONES PRIORITARIAS DE FECHA 2 DE ENERO 2008, PUBLICADAS EN EL PERIÓDICO OFICIAL\nDEL ESTADO DE GUERRERO.\nDADO EN LA CIUDAD DE CHILPANCINGO, GUERRERO, A LOS 26 DÍAS DEL MES DE\nENERO DEL AÑO 2012.\nSECRETARIO DE DESARROLLO SOCIAL.\nM.C. DAVID JIMÉNEZ RUMBO.\nRúbrica.\nEL SUBSECRETARIO DE PROMOCIÓN Y\nVINCULACIÓN SOCIAL.\nLIC. ANTONIO HERNÁNDEZ MARTÍNEZ.\nRúbrica.\nDIRECTOR GENERAL DE ACCIONES PRIORITARIAS.\nLIC. EFRAÍN PEÑA DAMACIO.\nRúbrica.\nREGLAS DE OPERACIÓN DEL\nPROGRAMA DE ACCIONES\nPRIORITARIAS PARA EL EJERCICIO\nFISCAL 2012.\nCONTENIDO\n1.- PRESENTACIÓN\n2.- OBJETIVOS\n2.1 GENERAL\n2.2 ESPECÍFICOS\n3.- LINEAMIENTOS\n3.1 COBERTURA\n3.2 POBLACIÓN OBJETIVO\n3.3 BENEFICIARIOS\n3. 4 CRITERIOS DE ELEGIBILIDAD\n3.4.1 SELECCIÓN DE LOCALIDADES Y/O BEBEFICIARIOS\n4.- CARACTERÍSTICAS DE LOS APOYOS\n4.1 TIPO DE APOYOS\n4.1.1 SUBPROGRAMA DE APOYO A NECESIDADES APREMIANTES\n4.1.2 SUBPROGRAMA DE APOYO PARA ACCIONES O EVENTOS SOCIALES,\nCULTURALES Y DEPORTIVOS.\n4.1.3 SUBPROGRAMA DE APOYO PARA EL DESARROLLO HUMANO Y PRODUCTIVO.\n4.1.4 SUBPROGRAMA DE APOYO PARA OBRA PÚBLICA DE BAJO COSTO.\n4.1.5 SUBPROGRAMA TEMPORADA INVERNAL.\n4.2 MONTOS DE APOYO\n5.- TRANSPARENCIA\n6.- MECÁNICA DE OPERACIÓN.\n6.1 PRESENTACIÓN DE REQUISITOS.\n6.2 AUTORIZACIÓN DEL APOYO.\n6. 3 EVALUACIÓN Y ANÁLISIS DE LA DEMANDA.\n6. 4 COMITÉ DE DESARROLLO COMUNITARIO.\n6.4.1 CONVENIO DE CONCERTACIÓN.\n6. 5 PROGRAMACIÓN Y PRESUPUESTO.\n6. 6 LIBERACIÓN Y ENTREGA DE RECURSO.\n6. 7 INICIO DE EJECUCIÓN DE OBRA O ACCIÓN.\n6.8 EVALUACIÓN Y SEGUIMIENTO DE LAS OBRAS.\n6.9 COMPROBACIÓN FINANCIERA.\n6.10 COMPROBACIÓN DE PAGARÉS DE LIBERACIÓN DE RECURSOS FINANCIEROS\n6.11 EXPEDIENTE UNITARIO.\n6.12 SUSPENSIÓN DE APOYOS\n7.- PRESUPUESTO DE LA DIRECCIÓN GENERAL DE ACCIONES PRIORITARIAS.\n7.1 EJERCICIO DEL GASTO\n8.- EVALUACIÓN\n8.1 EVALUACIÓN OPERATIVA\n8.2 EVALUACIÓN DE DESEMPEÑO\n9.- INFORMACIÓN GENERAL\n1.- PRESENTACIÓN\nLA ESTRATÉGIA APLICABLE EN EL PROGRAMA DE ACCIONES PRIORITARIAS, ESTARÁ\nENFOCADA A BRINDAR APOYOS ECONÓMICOS PARA AYUDAS APREMIANTES, EVENTOS\nSOCIALES, CULTURALES, DEPORTIVOS, DE DESARROLLO HUMANO Y PRODUCTIVO, EN\nMATERIA DE CAPACITACIÓN ASÍ COMO PARA ABATIR EL REZAGO DE OBRAS DE\nINFRAESTRUCTURA DE BAJO COSTO Y DE ALTO IMPACTO COMUNITARIO.\nQUE EL APOYO LOGRE RESOLVER LA PROBLEMÁTICA DE FONDO EVITANDO QUE SEA\nUNA SOLUCIÓN TEMPORAL, QUE SEA EFICÁZ Y CONTUNDENTE, PEQUEÑO PERO\nSIGNIFICATIVO, QUE MEJORE LAS CONDICIONES DE VIDA PRINCIPALMENTE DE LA POBLACIÓN\nQUE VI\\/E EN SITUACIÓN DE POBREZA Y POBREZA EXTREMA, PERMITIENDO EL DESARROLLO Y\nAPROVECHAMIENTO DE LAS CAPACIDADES Y HABILIDADES HUMANAS, DICHOS APOYOS\nSERÁN A FONDO PERDIDO.\nEN ESTE SENTIDO EL PROGRAMA DE ACCIONES PRIORITARIAS CONTEMPLA:\n• ALENTAR LA PARTICIPACIÓN DE LA CIUDADANÍA.\n• OFRECER UNA ALTERNATIVA DE ASISTENCIA SOCIAL HACIA LOS CIUDADANOS QUE\nCONDICIONES BÁSICAS DE VIDA, Y LAS NECESIDADES BASICAS PARA EL DESARROLLO\nFAMILIAR.\n• PROMOVER LA REALIZACIÓN DE EVENTOS DEPORTIVOS, CULTURALES,\nCONMEMORATIVOS, CON EL FIN DE FOMENTAR LA PROMOCIÓN, DIFUSIÓN Y CONSERVACIÓN\nDE LAS COSTUMBRES DE NUESTRO ESTADO.\n• APOYAR EN LA IMPARTICIÓN DE CURSOS DE CAPACITACIÓN PARA FOMENTAR LA\nACTIVIDAD PRODUCTIVA ARTESANAL ENTRE OTROS Y PROPORCIONAR INSUMOS, EQUIPOS Y\nHERRAMIENTAS PARA EL ESTABLECIMIENTO DE TALLERES QUE DETONEN LA ECONOMIA\nFAMILIAR Y COMUNITARIA.\n• APOYAR A LA INFRAESTRUCTURA SOCIAL BÁSICA DE BAJO COSTO.\n• ATENDER CON COBERTORES A LA POBLACIÓN VULNERABLE QUE HABITA EN LAS\nCOMUNIDADES QUE SE ENCUENTRAN A MÁS DE 1,800 MSNM. Y QUE EN TEMPORADA\nINVERNAL PADECEN ENFERMEDADES RESPIRATORIAS, QUE PONEN EN RIESGO SU VIDA.\n2.- OBJETIVOS\n2.1 GENERAL\nPROPICIAR LAS CONDICIONES SOCIALES PARA QUE LOS SECTORES MÁS\nVULNERABLES CUENTEN CON LOS ELEMENTOS BÁSICOS DE INFRAESTRUCTURA SOCIAL,\nSERVICIOS Y APOYOS ASISTENCIALES URGENTES, A FIN QUE EN IGUALDAD DE\nOPORTUNIDADES Y RESPETO A LOS DERECHOS CONSTITUCIONALES ACCEDAN A LOS\nSATISFACTORES MÍNIMOS DE BIENESTAR SOCIAL.\n2.2 ESPECÍFICOS\n• DAR ATENCIÓN A LAS DEMANDAS CIUDADANAS DE GUERRERENSES DE ESCASOS\nRECURSOS ECONÓMICOS, PARA APOYAR EN ACCIONES QUE IMPACTEN DIRECTAMENTE EN EL\nDESARROLLO HUMANO.\n• FOMENTAR LAS ACTIVIDADES ARTÍSTICAS, CULTURALES Y DEPORTIVAS QUE\nRESCATEN LAS RIQUEZAS Y COSTUMBRES DE NUESTRO ESTADO, EN COORDINACION CON\nLOS AYUNTANIENTOS Y DEMAS DEPENDENCIAS.\n• REALIZAR O APOYAR EN CURSOS DE CAPACITACIÓN PARA EL DESARROLLO HUMANO\nY PROYECTOS PRODUCTIVO, ASÍ COMO EN EL OTORGAMIENTO DE EQUIPO Y MATERIA PRIMA\nPARA EL ESTABLECIMIENTO DE TALLERES, ENTRE OTRAS ACTIVIDADES PRODUCTIVAS QUE\nMEJOREN LA ECONOMIA FAMILIAR, LOS CURSOS SERÁN IMPARTIDOS POR PERSONAL\nCAPACITADO CONTRATADO POR ESTA DEPENDENCIA.\n• FOMENTAR LA CORRESPONSABILIDAD ENTRE PUEBLO Y GOBIERNO EN LA ATENCIÓN\nA LAS DEMANDAS DE SERVICIOS PÚBLICOS.\n• APOYAR EN LA CONSTRUCCIÓN, AMPLIACIÓN, REHABILITACIÓN,\nACONDICIONAMIENTO Y EQUIPAMIENTO DE INFRAESTRUCTURA SOCIAL YA EXISTENTE, QUE\nSEAN DE BAJO COSTO.\n• PROPORCIONAR EL BIENESTAR MINIMO A LA POBLACION VULNERABLE EN LA\nTEMPORADA INVERNAL, EN DONDE LAS INCLEMENCIAS DEL TIEMPO PROVOCAN\nENFERMEDADES RESPIRATORIAS, PRINCIPALMENTE EN ZONAS DE ALTA Y MUY ALTA\nMARGINACION ASI COMO ZONAS URBANAS MARGINADAS.\n3. - LINEAMIENTOS\n3.1 COBERTURA\nLA DIRECCIÓN GENERAL DE ACCIONES PRIORITARIAS OPERARÁ EN TODOS LOS\nMUNICIPIOS DEL ESTADO DE GUERRERO, PRIMORDIALMENTE EN ZONAS DONDE LA\nPOBLACIÓN VIVE EN SITUACIONES DE POBREZA Y POBREZA EXTREMA.\n3.2 POBLACIÓN OBJETIVO\nPRIORITARIAMENTE LA POBLACIÓN EN POBREZA Y POBREZA EXTREMA DE\nMUNICIPIOS Y LOCALIDADES EN SITUACIÓN DE MARGINACIÓN Y EXCLUSIÓN SOCIAL.\n3.3 BENEFICIARIOS\n• LAS PERSONAS Y/O CIUDADANOS INDIVIDUALES U ORGANIZADOS EN CONDICIONES\nECONÓMICAS DESFAVORABLES.\n3.4 CRITERIOS DE ELEGIBILIDAD\n• SE ATENDERÁN AQUELLAS DEMANDAS QUE SEAN DE CARÁCTER PRIORITARIO, QUE\nAYUDAN A RESOLVER ALGÚN ACONTECIMIENTO QUE PERJUDIQUE SU ENTORNO, Y SEA LA\nSOLUCIÓN O MEJORA EN LO RELACIONADO CON LA SALUD, EDUCACIÓN, CULTURA, EL\nDEPORTE, QUE AYUDEN AL DESARROLLO HUMANO Y PRODUCTIVO PARA QUE REDUNDE EN\nUN BENEFICIO ECONÓMICO FAMILIAR, ASÍ COMO LAS QUE TENGAN UN IMPACTO SOCIAL EN LA\nPOBLACIÓN.\nSOLICITUD.\n3.4.1 SELECCIÓN DE LOCALIDADES Y/O BENEFICIARIOS\nPRESENTAR PROBLEMAS DE POBREZA O POBREZA EXTREMA Y EXCLUSIÓN SOCIAL, DANDO\nPRIORIDAD A AQUELLOS QUE PRESENTEN CARENCIAS DE INFRAESTRUCTURA Y SERVICIOS,\nSUS HABITANTES O EN SUS FAMILIAS.\n4.- CARACTERÍSTICAS DE LOS APOYOS\n4.1 TIPO DE APOYOS\n4.1.1 SUBPROGRAMA DE APOYO A NECESIDADES APREMIANTES, ATENDERÁ A\nPERSONAS DE BAJOS RECURSOS, QUE REQUIERAN APOYOS Y QUE PRESENTEN ALGUNA\nVULNERABILIDAD QUE AFECTE SU INTEGRIDAD FÍSICA, PATRIMONIAL O FAMILIAR.\n4.1.2 SUBPROGRAMA DE APOYO PARA ACCIONES O EVENTOS SOCIALES,\nCULTURALES Y DEPORTIVOS, ESTARÁN DIRIGIDOS PARA LA REALIZACIÓN DE EVENTOS\nCULTURALES, DEPORTIVOS, RECREATIVOS Y CONMEMORATIVOS PREFERENTEMENTE EN\nCENTRO EDUCATIVOS Y ZONAS DE POBREZA Y POBREZA EXTREMA.\n4.1.3 SUBPROGRAMA DE APOYO PARA EL DESARROLLO HUMANO Y PROYECTOS\nPRODUCTIVOS, CONSISTIRÁ EN LA APLICACIÓN DE RECURSOS EN TODA LAS REGIONES DEL\nESTADO, MEDIANTE LA IMPLEMENTACION DE CURSOS DE CAPACITACIÓN, OTORGAMIENTO DE\nAPOYOS A LA POBLACIÓN EN DESVENTAJA ECONÓMICA Y PROYECTOS DE INVERCIÓN\nPRODUCTIVA A FONDO PERDIDO EN BENEFICIO DE LA POBLACION QUE SE ENCUENTRA EN\nCARACTER DE DESEMPLEADO O SUBEMPLEADO, DICHOS CURSOS SERÁN IMPARTIDOS POR\nPERSONAL CAPACITADO PAGADO POR LA MISMA DEPENDENCIA.\n4.1.4 SUBPROGRAMA APOYO PARA OBRA PÚBLICA DE BAJO COSTO\nSERÁ DIRIGIDA PREFERENTEMENTE A CULMINACIONES, REHABILITACIÓN,\nACONDICIONAMIENTO, EQUIPAMIENTO Y/O AMPLIACIONES DE OBRAS DE INFRAESTRUCTURA\nPARA BENEFICIO COLECTIVO.\n4.1.5 SUBPROGRAMA DE TEMPORADA INVERNAL,\nINVERNAL, ABRIGO A NIÑOS, MUJERES Y ANCIANOS DEL ESTADO DOTANDOLOS DE\nCOBERTORES PARA MITIGAR EL FRIO QUE PADECEN.\n4.2 MONTO DE APOYO\nLA DIRECCIÓN GENERAL DE ACCIONES PRIORITARIAS, ATENDERÁ OBRAS DE BAJO\nCOSTO PERO DE GRAN IMPACTO SOCIAL; CONCLUSIONES, REHABILITACIONES,\nAMPLIACIONES, QUE DE OTRO MODO NO PUEDAN DAR UN SERVICIO ADECUADO A LA\nINFRAESTRUCTURA EXISTENTE EN LAS LOCALIDADES, PERO QUE REPRESENTEN UNA\nDEMANDA SENSIBLE DE LA POBLACIÓN, POR LO\nQUE SÓLO SERÁN OBRAS NO MAYORES A LOS $75,000.00 (SETENTA Y CINCO MIL\nPESOS) COMO MÁXIMO Y QUE ESTAS NO REQUIERAN DE UNA ASISTENCIA ESPECIALIZADA.\nPARA LOS APOYOS ECONÓMICOS DENOMINADOS AYUDAS APREMIANTES LOS\nMONTOS MAYORES DEBERÁN DE SER HASTA $20,000. 00 (VEINTE MIL PESOS) COMO MÁXIMO.\nPARA LOS APOYOS A GRUPOS DE CIUDADANOS UNIFICADOS EN UNA ACCIÓN DE\nCARACTER CULTURAL, SOCIAL, DEPORTIVO U OTRA QUE MARQUE DENTRO DEL DESARROLLO\nSOCIAL SE DESTINARÁ HASTA $20,000.00 (VEINTE MIL PESOS) COMO MÁXIMO.\nPARA LOS APOYOS DENOMINADOS DE DESARROLLO HUMANO Y PRODUCTIVO, SE\nPODRÁN DESTINAR DESDE $25,000.00 (VEINTICINCO MIL PESOS) HASTA $100,000.00 (CIEN MIL\nPESOS) PESOS, DE ACUERDO AL TIPO DE PROYECTO O CAPACITACION Y SERAN A FONDO\nPERDIDO.\nTODOS LOS MONTOS ANTERIORES PODRÁN SER MAYORES, SI POR CIRCUNSTANCIAS\nESPECIALES ASÍ LO AUTORIZA EL EJECUTIVO ESTATAL O EL TITULAR DE LA SECRETARÍA DE\nDESARROLLO SOCIAL.\n5.- TRANSPARENCIA\nLA DIRECCIÓN GENERAL DE ACCIONES PRIORITARIAS, MANTENDRÁ UN PROCESO DE\nEJECUCIÓN Y MECÁNICA DE OPERACIÓN QUE PERMITA TRANSPARENTAR, QUE SEA EFICIENTE\nY EFICAZ EL MANEJO Y APLICACIÓN DE LOS RECURSOS QUE SE LE ASIGNEN EN EL\nPRESUPUESTO DE EGRESOS.\nPOR ELLO ES IMPORTANTE QUE LA POBLACIÓN BENEFICIADA, FORME PARTE ACTIVA\nDEL PROCESO A SEGUIR, EN ESTE SENTIDO ENTRARÁ LA CORRESPONSABILIDAD Y SE\nPUEBLO Y GOBIERNO.\nAPOYADA, NO DEBERÁ DE OLVIDAR EL ASPECTO DE TRASNPARENCIA, OBLIGÁNDOSE A\nVIGILANCIA.\nLOS RECURSOS ASIGNADOS A LA DIRECCIÓN DE ACCIONES PRIORITARIAS, AÚN\nORGANISMOS, ENCARGÁNDOSE DE VERIFICAR Y CONTROLAR, LA AUDITORÍA GENERAL DEL\nCONGRESO DEL ESTADO Y LA CONTRALORÍA GENERAL DEL ESTADO.\nPRIORITARIAS, SERÁN PUBLICADOS TRIMESTRALMENTE VÍA ELECTRONICA E IMPRESA.\n6.- MECÁNICA DE OPERACIÓN\nPARA UNA EFICIENTE OPERACIÓN DE LA DIRECCIÓN GENERAL DE ACCIONES\nPRIORITARIAS, SE TIENE UNA MECÁNICA OPERATIVA, LA QUE REQUERIRÁ DE UN TRÁMITE\nADMINISTRATIVO QUE PERMITA A LA DIRECCIÓN GENERAL, VALORAR LA OBRA O ACCIÓN\nDEMANDADA Y CUBRIR LOS REQUISITOS DOCUMENTALES PARA LA LIBERACIÓN Y ENTREGA\nDE RECURSOS.\n6.1 PRESENTACIÓN DE REQUISITOS\n• LOS SOLICITANTES DE LOS APOYOS ECONÓMICO O EN ESPECIE, DEBERÁN CUBRIR\nLOS SIGUIENTES REQUISITOS:\n• SOLICITUD DE APOYO, DIRIGIDO AL TITULAR DEL EJECUTIVO ESTATAL O AL TITULAR\nDE LA SECRETARÍA DE DESARROLLO SOCIAL.\n• COPIA DE CREDENCIAL DE ELECTOR DEL SOLICITANTE.\n• TELÉFONO (PARA SU LOCALIZACIÓN).\nADEMÁS DE LO ANTERIOR SE DEBERÁN ENTREGAR:\nPARA APOYOS APREMIANTES POR GASTOS MÉDICOS:\n• RECETA MÉDICA.\n• DIAGNÓSTICO MÉDICO.\nPARA APOYOS APREMIANTES POR SINIESTRO:\n• FOTO O CONSTANCIA DE PROTECCIÓN CIVIL, MUNCIPAL Y/O DE LA AUTORIDAD DE LA\nLOCALIDAD.\nPARA APOYOS POR VIAJES DE ESTUDIO:\n• LA SOLICITUD DEBERÁ LLEVAR NOMBRE Y SELLO DE LA INSTITUCIÓN.\nPARA APOYOS DE CARÁCTER SOCIAL, CULTURAL Y DEPORTIVO:\n• DESCRIPCIÓN DEL EVENTO\n• NÚMERO DE BENEFICIARIOS.\n• SELLO DE LA INSTITUCIÓN EN LA SOLICITUD.\nPARA APOYOS DE DESARROLLO HUMANO Y PRODUCTIVO:\n• DESCRIPCIÓN DEL TIPO DE CAPACITACIÓN REQUERIDA.\n• LISTADO DE BENEFICIARIOS Y DOCUMENTACION PRESONAL DE CADA UNO (CURP,\nCRED. DEL IFE, ACTA DE NAC.)\nPARA SOLICITUD DE EQUIPAMIENTO Y/O MATERIA PRIMA:\n• DESCRIPCIÓN DEL EQUIPO Y/O MATERIA PRIMA SOLICITADA, COTIZACION Y CROQUIS\nDE LOCALIZACION DEL TALLER O NEGOCIO.\nPARA SOLICITUD DE OBRA PÚBLICA DE BAJO COSTO, UNA VEZ AUTORIZADO EL\nRECURSO:\n• FORMATO DE ACTA CONSTITUTIVA DEL COMITÉ DE DESARROLLO (SERÁ\nPROPORCIONADO POR LA DIRECCIÓN GENERAL DE ACCIONES PRIORITARIAS), CUANDO EL\nMONTO SEA MAYOR A DIEZ MIL PESOS.\nY FORMATO DE CONVENIO DE CONCERTACIÓN (SERÁ PROPORCIONADO POR LA DIRECCIÓN\nGENERAL DE ACCIONES PRIORITARIAS), CUANDO EL MONTO SEA MAYOR A DIEZ MIL PESOS.\n• COPIA DE CREDENCIAL DE ELECTOR DE LOS INTEGRANTES DEL COMITÉ DE\nDESARROLLO COMUNITARIO.\n• BREVE DESCRIPCIÓN DE LA OBRA, UBICACIÓN Y FICHA TECNICA.\n6.2 AUTORIZACIÓN DEL APOYO\nRECIBOS.\n6.3 EVALUACIÓN Y ANÁLISIS DE LA DEMANDA\nEN LAS NECESIDADES APREMIANTES, SE ANALIZARÁ LA PRIORIDAD DEL CASO DE\nPREGUNTAS DEL CASO.\nDE LOS APOYOS DIRIGIDOS A EVENTOS SOCIALES, CULTURALES, DEPORTIVOS U\nOTROS QUE ENCUADREN, SE ANALIZARÁ LA VIABILIDAD Y EL IMPORTE DEL APOYO DE\nEN LOS APOYOS DE DESARROLLO HUMANO Y PRODUCTIVO, SE ANALIZARÁ QUE EL\nBENEFICIO REALMENTE PERMITA ELEVAR LA CALIDAD DE VIDA, MEJORANDO LA CAPACIDAD\nPRODUCTIVA PARA OBTENER UN INGRESO ECONÓMICO QUE MEJORE LAS CONDICIONES DE\nVIDA EN LAS FAMILIAS GUERRERENSES. EN EL CASO DE OBRAS Y ACCIONES DE\nINFRAESTRUCTURA SOCIAL Y SERVICIOS PÚBLICOS BÁSICOS, INGRESARÁN AL PADRÓN DE LA\nDEMANDA CIUDADANA DE ESTA DIRECCIÓN, A FIN DE QUE SE ANALICE LA VIABILIDAD\nTÉCNICA, FINANCIERA Y PRIMORDIALMENTE EL IMPACTO SOCIAL QUE ÉSTA REPRESENTARÁ\nHACIA LA COMUNIDAD, SE VERIFICARÁN LOS DATOS PROPIOS DE LA OBRA CON LA FINALIDAD\nDE DETECTAR LOS ELEMENTOS, TALES COMO; EL TAMAÑO Y ESTIMACIÓN DEL COSTO DE LA\nMISMA.\nSE LOCALIZARÁ A LOS SOLICITANTES, A FIN DE REALIZAR UNA ENTREVISTA PARA\nCONSTATAR QUE EL BENEFICIO O ACCIÓN TENGA UN IMPACTO GENERAL EN LA COMUNIDAD.\n6. 4 COMITÉ DE DESARROLLO COMUNITARIO\nEL COMITÉ DE DESARROLLO COMUNITARIO, SERÁ LA CÉLULA BÁSICA DE\nINTEGRACIÓN A PARTIR DE LA CUAL LOS MIEMBROS DE UN MUNICIPIO, LOCALIDAD O\nASENTAMIENTO HUMANO SE ORGANIZAN, EN TORNO A UN PROBLEMA O NECESIDAD QUE LOS\nAFECTE.\nPRESIDENTE, UN SECRETARIO, UN TESORERO, TRES VOCALES, UN VOCAL DE CONTROL Y\nVIGILANCIA.\n6.4.1 CONVENIO DE CONCERTACIÓN\nA TRAVES DE ESTE DOCUMENTO LA SECRETARÍA DE DESARROLLO SOCIAL,\nESTABLECE LO SIGUIENTE:\nCONJUNTAR ESFUERZOS Y RECURSOS PARA LLEVAR A CABO LAS OBRAS Y/O\nACCIONES.\nEL ESTADO SE COMPROMETE A CUBRIR LAS APORTACIONES CONVENIDAS.\nEL COMITÉ DE DESARROLLO COMUNITARIO, SE COMPROMETE A LA REALIZACIÓN Y\nTERMINACIÓN DE LA OBRA AL 100%, Y A COMPROBAR LOS RECURSOS Y/O APOYOS DE\nACUERDO A LAS METAS SEÑALADAS Y AUTORIZADAS.\n6. 5 PROGRAMACIÓN Y PRESUPUESTO\nPARA EL CASO DE NECESIDADES APREMIANTES, SÓLO SE REALIZARÁ UN REGISTRO\nDE BENEFICIARIOS Y DE LOS MONTOS OTORGADOS QUE PODRÁ CONSULTARSE AL MOMENTO\nDE DECIDIR SOBRE EL OTORGAMIENTO DE RECURSOS A EFECTO DE EVITAR DUPLICIDAD DE\nAPOYO AL MISMO SOLICITANTE.\n6.6 LIBERACIÓN Y ENTREGA DE RECURSOS\nLA DIRECCIÓN GENERAL DE ACCIONES PRIORITARIAS, SOLICITARÁ MEDIANTE\nREQUERIMIENTO A LA DIRECCIÓN ADMINISTRATIVA DE LA SECRETARÍA DE DESARROLLO\nSOCIAL, LA ELABORACIÓN DE LOS CHEQUES, LOS CUALES SERAN ENTREGADOS A LA\nDIRECCION DE ACCIONES PRIORITARIAS, CON LA FINALIDAD DE QUE ESTA SEA LA\nENCARGADA DE LA ENTREGA DE LOS CHEQUES A LOS BENEFICIARIOS Y A SU VEZ INTEGRARA\nEL EXPEDIENTE UNITARIO PARA LA COMPROBACION CORRESPONDIENTE.\nPARA QUE EL RECURSO SEA ENTREGADO, AL O LOS SOLICITANTES SE DEBERÁ:\n• ENTREGAR FOTOCOPIA DE LA IDENTIFICACIÓN OFICIAL (CREDENCIAL DE ELECTOR,\nCARTILLA MILITAR O PASAPORTE)\n• FIRMAR LA PÓLIZA CHEQUE, Y RECIBO OFICIAL DE LA SECRETARÍA DE DESARROLLO\nSOCIAL.\nLO ANTERIOR DEBERÁ SER INTEGRADO A SU EXPEDIENTE. EN CASO DE PAGO A\nPROVEEDORES QUE SE LLEVEN A CABO POR MEDIO DE DEPÓSITOS, NO SERÁ NECESARIA LA\nFIRMA EN LAS PÓLIZAS Y RECIBOS, BASTARÁ CON LA FICHA DE DEPÓSITO COMO\nCOMPROBANTE Y LA COPIA DE LA CREDENCIAL DE ELECTOR DEL PROVEEDOR.\n6.7 INICIO DE EJECUCIÓN DE OBRA O ACCIÓN\nINSUMOS, INICIARÁ LA EJECUCIÓN DE LA OBRA, CONVOCANDO A TODOS LOS BENEFICIADOS A\nPARTICIPAR CON LAS APORTACIONES Y/O COMPROMISOS, A EFECTO DE CUMPLIR CON LO\nPACTADO EN EL CONVENIO DE CONCERTACIÓN.\nEL COMITÉ DE DESARROLLO COMUNITARIO, ES EL RESPONSABLE DIRECTO DE LA\nAPLICACIÓN DE LOS RECURSOS Y LA EJECUCIÓN DE LA OBRA.\nES IMPORTANTE MENCIONAR QUE LA APLICACIÓN DE LOS RECURSOS, EL CONTROL,\nDESARROLLO COMUNITARIO Y LA MISMA POBLACIÓN.\n6. 8 EVALUACIÓN Y SEGUIMIENTO DE LAS OBRAS\nLA DIRECCIÓN GENERAL DE ACCIONES PRIORITARIAS, SE ENCARGARÁ DE REALIZAR\nVISITAS DE VERIFICACIÓN DE OBRAS QUE SE EJECUTEN CON APOYO DEL PROGRAMA DE\nACUERDO A LA SELECCIÓN DE LAS MISMAS Y LA DISPONIBILIDAD DE LOS RECURSOS, PARA\nELLO REALIZARÁ BRIGADAS DE EVALUACIÓN Y SEGUIMIENTO. LAS BRIGADAS ESTARÁN\nINTEGRADAS POR UN TÉCNICO, EL CUAL SUPERVISARÁ LOS AVANCES FÍSICOS DE LA OBRA O\nACCIÓN, REALIZANDO UNA REUNIÓN CON EL COMITÉ DE DESARROLLO COMUNITARIO PARA\nEVALUAR LOS ALCANCES DE LA MISMA.\n6. 9 COMPROBACIÓN FINANCIERA\nLA SECRETARÍA DE DESARROLLO SOCIAL, RESPALDARÁ MEDIANTE LA DIRECCIÓN\nADMINISTRATIVA, LA EMISIÓN DE LOS CHEQUES APORTADOS A LAS OBRAS O ACCIONES A\nFAVOR DEL MIEMBRO DEL COMITÉ DE DESARROLLO COMUNITARIO QUE\nCORRESPONDA, A TRAVÉS DEL SISTEMA DE PÓLIZA VIGENTE Y LA EXPEDICIÓN DEL\nRECIBO OFICIAL QUE DEBERÁ FIRMAR EL PRESIDENTE DEL COMITÉ O EL BENEFICIARIO DEL\nCHEQUE A MENOS QUE LA CANTIDAD SEA DEPOSITADA DIRECTAMENTE AL PROVEEDOR DEL\nINSUMO, LA FICHA DE DEPÓSITO SERVIRÁ COMO RESPALDO DE LAS FIRMAS EN LOS\nDOCUMENTOS EN MENCIÓN, ASÍ COMO LA COPIA DE LA CREDENCIAL DE ELECTOR DEL\nPROVEEDOR.\nAL CONCLUIR LA OBRA O ACCIÓN LOS BENEFICIARIOS DEBERÁN PRESENTAR LA\nCOMPROBACIÓN DE LOS RECURSOS QUE SE LES LIBERARON, LA CUAL SE REALIZARÁ EN LAS\nOFICINAS DE LA DIRECCIÓN GENERAL DE ACCIONES PRIORITARIAS, MEDIANTE ORIGINAL DE\nLA O LAS FACTURAS QUE DEBERÁN CUMPLIR CON TODOS LOS REQUISITOS FISCALES, ESTAS\nY CORRESPONDER AL PROGRAMA DE LA OBRA O ACCIÓN, ESPECIFICANDO LA CANTIDAD Y\nPRECIOS UNITARIOS DE LOS SERVICIOS O ADQUISICIONES DE LOS MATERIALES O FLETES.\n6.10 COMPROBACIÓN DE PAGARÉS DE LIBERACIÓN DE RECURSOS FINANCIEROS\nLA SECRETARÍA DE DESARROLLO SOCIAL, A TRAVÉS DE LA DIRECCIÓN\nSIDO OTORGADOS A LOS BENEFICIARIOS.\nLOS DOCUMENTOS SERÁN LOS SIGUIENTES:\n• ORIGINAL O COPIA DE LA SOLICITUD.\n• ORIGINAL O COPIA DE PÓLIZA DE CHEQUE DEBIDAMENTE REQUISITADA POR EL\nBENEFICIARIO.\n• ORIGINAL O COPIA DEL RECIBO, SIGNADO POR EL BENEFICIARIO.\n• COPIA DE LA IDENTIFICACION OFICIAL (CARTILLA MILITAR, CREDENCIAL DE ELECTOR\nO PASAPORTE)\n• EN CASO DE QUE LAS PERSONAS HAYAN SIDO VÍCTIMAS DE ALGÚN SINIESTRO,\nDESASTRE NATURAL O ROBO PODRAN PRESENTAR\nCUALQUIER DOCUMENTO DE ALGUNA AUTORIDAD QUE ACREDITE SU IDENTIFICACIÓN.\nPARA EL CASO DE OBRAS SE DEBERÁ ANEXAR ADEMÁS:\n• ORIGINAL O COPIA DEL ACTA CONSTITUTIVA DEL COMITÉ DE DESARROLLO\nCOMUNITARIO.\n• ORIGINAL O COPIA DEL CONVENIO DE CONCERTACIÓN.\nLA SECRETARÍA DE FINANZAS Y ADMINISTRACIÓN, LIBERARÁ A LA SECRETARÍA DE\nDESARROLLO SOCIAL, DEL CARGO DE LOS PAGARÉS DE LIBERACIÓN DE RECURSOS\nFINANCIEROS, PROCEDIENDO A DEVOLVER LOS ORIGINALES A LA SECRETARÍA DE\nDESARROLLO SOCIAL, CUANDO ESTOS SE ENCUENTREN DEBIDAMENTE COMPROBADOS Y\nAMORTIZADOS AL 100% POR LOS ELEMENTOS ANTES SEÑALADOS.\n6.11 EXPEDIENTE UNITARIO\nDEBERÁ CONTENER, ADEMÁS DE LA SOLICITUD, IDENTIFICACIÓN OFICIAL, PÓLIZA\nCHEQUE Y RECIBO, LO SIGUIENTE:\nPARA LAS NECESIDADES APREMIANTES DE GASTOS MÉDICOS, EL EXPEDIENTE SE\nFORMARÁ CON LOS DOCUMENTOS SIGUIENTES:\n• RECETAS MÉDICAS.\n• EXPEDIENTE MÉDICO.\nPARA LAS NECESIDADES APREMIANTES POR SINIESTRO, EL EXPEDIENTE SE\nFORMARÁ CON LOS DOCUMENTOS SIGUIENTES:\n• FOTOS O CONSTANCIA DE PROTECCIÓN CIVIL O DE ALGUNA AUTORIDAD LOCAL.\nPARA EL CASO DE ACCIONES DE CARÁCTER SOCIAL, CULTURAL, DEPORTIVO U OTROS\nEN APOYOS ECONÓMICOS, EL EXPEDIENTE SE INTEGRARÁ CON LOS REQUISITOS\nSIGUIENTES:\n• COMPROBANTE DEL GASTO.\nCADA OBRA PÚBLICA DE BAJO COSTO QUE APOYE LA DIRECCIÓN GENERAL DE\nACCIONES PRIORITARIAS, DEBERÁ CONTAR CON UN EXPEDIENTE UNITARIO DONDE INCLUYA\nLA DOCUMENTACIÓN COMPROBATORIA, GENERADA EN EL EJERCICIO DE LOS RECURSOS Y/O\nINSUMOS, LIBERADOS A LOS COMITES Y/O BENEFICIARIOS.\nLOS DOCUMENTOS QUE INTEGRAN LOS EXPEDIENTES SON:\n• ACTA CONSTITUTIVA DEL COMITÉ DE DESARROLLO COMUNITARIO.\n• CONVENIO DE CONCERTACIÓN.\nLOS EXPEDIENTES UNITARIOS SE GUARDARÁN EN LOS ARCHIVOS DE LA DIRECCIÓN\nGENERAL DE ACCIONES PRIORITARIAS, PARA SU CONTROL Y EVALUACIÓN; PARA REVISIONES\nO AUDITORÍAS POSTERIORES, POR PARTE DE LAS INSTANCIAS DE CONTROL, SUPERVISIÓN Y\nFISCALIZACIÓN SI ASÍ SE REQUIERE.\n6.12 SUSPENSIÓN DE APOYOS\nLA DIRECCIÓN GENERAL DE ACCIONES PRIORITARIAS, ESTARÁ FACULTADA PARA LA\nSUSPENSIÓN DE LOS APOYOS AUTORIZADOS Y PROGRAMADOS O RETIRAR LOS YA\nENTREGADOS DE ACUERDO A LAS CIRCUNSTANCIAS SIGUIENTES:\n• FALTA DE ORGANIZACIÓN.\n• NULA COLABORACIÓN O APORTACIÓN DEL COMITÉ A LA OBRA O ACCIÓN.\n• DESVÍO DE RECURSOS Y/O APOYOS POR EL COMITÉ DE DESARROLLO COMUNITARIO\nA OBRAS O ACCIONES NO AUTORIZADAS.\n• PRESENTAR DIFERENCIAS O PROBLEMAS ENTRE LOS BENEFICIARIOS EN LOS\nTRABAJOS A DESARROLLAR.\n• POR EL ESCASO INTERÉS DEL COMITÉ DE DESARROLLO COMUNITARIO EN LLEVAR A\nCABO LA OBRA Y/O ACCIÓN, LA DIRECCIÓN RETIRARÁ EL APOYO ENTREGADO Y EN CASO DE\nPATRIMONIO DEL ERARIO PÚBLICO DEL ESTADO, SIN MENOSCABO DE APLICAR LA LEY DE LA\nMATERIA A QUIEN O QUIENES RESULTEN RESPONSABLES.\n• POR LA FALTA DE INTERÉS EN LA RECEPCIÓN DEL RECURSO DEL O LOS\nBENEFICIARIOS APOYADOS, PREVIAMENTE INFORMADOS DEL OTORGAMIENTO DEL RECURSO\nMISMO.\n7.- PRESUPUESTO DE LA DIRECCIÓN GENERAL DE ACCIONES PRIORITARIAS.\nDE ACUERDO A LOS DATOS HISTÓRICOS DE RECEPCIÓN DE DEMANDAS, SE\nELABORARÁ EL PROGRAMA OPERATIVO ANUAL (POA), PARA EL EJERCICIO SIGUIENTE EN EL\nCUAL SE ESPECIFICARÁN LOS IMPORTES, NÚMERO DE PROYECTOS, OBRAS O ACCIONES\nPARA ATENDER.\nPARA LOS GASTOS OPERATIVOS DE LA DIRECCIÓN GENERAL DE ACCIONES\nPRIORITARIAS, SE DESTINARÁ EL 3% DEL PRESUPUESTO TOTAL AUTORIZADO; PARA\nSOLVENTAR LOS GASTOS QUE OCASIONAN LAS VISITAS DE CAMPO, PARA LA VERIFICACIÓN\nDE OBRAS Y ACCIONES A REALIZAR Y LA INTEGRACIÓN DE LOS COMITÉS DE DESARROLLO\nCOMUNITARIO, ASÍ COMO PARA LA ENTREGA DE APOYOS A QUIENES POR CUESTIONES\nECONOMIZAS NO LES SEA POSIBLE EL TRASLADO DE LOS MISMOS.\n7.1 EJERCICIO DEL GASTO\nPARA EL EJERCICIO DEL GASTO CORRESPONDIENTE, LA DIRECCIÓN GENERAL DE\nACCIONES PRIORITARIAS, REALIZARA LOS TRÁMITES ADMINISTRATIVOS NECESARIOS PARA\nLA LIBERACIÓN DE RECURSOS DE ACUERDO A LA DISPONIBILIDAD FINANCIERA Y A LA\nCALENDARIZACIÓN PROGRAMADA.\nLA DIRECCIÓN GENERAL DE ACCIONES PRIORITARIAS, SE OBLIGA A ELABORAR EL\nREPORTE DE OBRAS Y ACCIONES QUE ATIENDA EN EL EJERCICIO DEL PRESENTE AÑO.\n8.- EVALUACIÓN.\nLA EVALUACIÓN DE LA DIRECCIÓN GENERAL DE ACCIONES PRIORITARIAS, SERÁ UN\nPROCESO PERMANENTE, CUYAS ACTIVIDADES ESTARÁN DIRIGIDAS AL ANÁLISIS DE LOS\nRESULTADOS E MPACTOS SOCIALES DE LAS OBRAS O ACCIONES ATENDIDAS,\nAJUSTES A ESTA DIRECCIÓN.\n8.1 EVALUACIÓN OPERATIVA\nAL COTEJAR LOS RESULTADOS ALCANZADOS EN LAS METAS, SE EVALÚAN LOS\nALCANCES PROGRAMÁTICOS, A EFECTO DE CUANTIFICAR LA EFICIENCIA DE LA DIRECCIÓN\nGENERAL DE ACCIONES PRIORITARIAS, EN LA PROGRAMACIÓN, LIBERACIÓN DE RECURSOS,\nSEGUIMIENTO, SUPERVISIÓN Y LA CONCLUSIÓN DE LAS\nOPERACIÓN.\n8.2 EVALUACIÓN DE DESEMPEÑO.\nLA DIRECCIÓN GENERAL DE ACCIONES PRIORITARIAS, ESTABLECERÁ MECANISMOS\nDE EVALUACIÓN TRIMESTRALES DE LOS AVANCES CUANTITATIVOS Y CUALITATIVOS DE LAS\nOBRAS O ACCIONES DE ACUERDO A LO ESTABLECIDO EN EL PLAN ESTATAL DE DESARROLLO\n2011-2015 Y EL SISTEMA ESTATAL DE EVALUACIÓN DEL DESEMPEÑO.\nLA FÓRMULA PARA MEDIR LA EFICACIA DE LOS INDICADORES ES:\n• AYUDAS ENTREGADAS/AYUDAS PROGRAMADAS POR 100 (AE/ AP)*100\n• LA FRECUENCIA PARA MEDIR LOS INDICADORES DEL DESEMPEÑO SERÁ:\nTRIMESTRAL.\nNOMBRE DEL INDICADOR 1: AYUDAS APREMIANTES A POBLACIÓN VULNERABLE.\n• OBJETIVO DEL INDICADOR: MEDIR EL PORCENTAJE DE AYUDAS APREMIANTES\nENTREGADAS A POBLACIÓN VULNERABLE RESPECTO DE LAS PROGRAMADAS.\nNOMBRE DEL INDICADOR 2: AYUDAS SOCIALES Y CULTURALES A POBLACIÓN\nVULNERABLE.\n• OBJETIVO DEL INDICADOR: MEDIR EL PORCENTAJE DE AYUDAS SOCIALES Y\nCULTURALES ENTREGADAS A POBLACIÓN VULNERABLE RESPECTO DE LAS PROGRAMADAS.\nNOMBRE DEL INDICADOR 3: AYUDAS PARA EL FORTALECIMIENTO DE CAPACIDADES\nPRODUCTIVAS A POBLACIÓN VULNERABLE.\n• OBJETIVO DEL INDICADOR: MEDIR EL PORCENTAJE DE AYUDAS ENTREGADAS A\nRESPECTO DE LAS PROGRAMADAS.\nNOMBRE DEL INDICADOR 4: AYUDAS DE OBRA PÚBLICA DE BAJO COSTO A POBLACIÓN\nVULNERABLE.\n• OBJETIVO DEL INDICADOR: MEDIR EL PORCENTAJE DE AYUDAS ENTREGADAS DE\nOBRA PÚBLICA DE BAJO COSTO A POBLACIÓN VULNERABLE EN ZONAS MARGINADAS,\nRESPECTO DE LAS PROGRAMADAS.\n9.- INFORMACIÓN GENERAL.\nPARA CUALQUIER ACLARACIÓN, ORIENTACIÓN, QUEJAS Y FUNCIONAMIENTO DE LA\nDIRECCIÓN GENERAL DE ACCIONES PRIORITARIAS, PODRÁ REALIZARLO POR ESCRITO, VÍA\nTELEFONICA O ACUDIR A LAS OFICINAS DE LA SECRETARÍA DE DESARROLLO SOCIAL\n(SEDESOL), CITA EN EL BLV. RENÉ JUÁREZ CISNEROS No. 62, PALACIO DE GOBIERNO, COL. CD.\nDE LOS SERVICIOS, EDIFICIO REGIÓN NORTE, PLANTA BAJA O A LOS TELÉFONOS (01) 747-47-198- 53, FAX (01) 747-47-1-98-13, CORREO ELECTRONICO: acc_prioritmj@live.com.mx\nLEIDO EL PRESENTE, QUEDAN DEROGADAS LAS REGLAS DE OPERACIÓN DEL\nPROGRAMA DE ACCIONES PRIORITARIAS DE FECHA 02 DE ENERO DEL AÑO 2008, DADO EN LA\nCIUDAD DE CHILPANCINGO GUERRERO A LOS 26 DIAS DEL MES DE ENERO DEL AÑO 2012.\nSECRETARIO DE DESARROLLO SOCIAL.\nM.C. DAVID JIMÉNEZ RUMBO.\nRúbrica.\nEL SUBSECRETARIO DE PROMOCIÓN Y\nVINCULACIÓN SOCIAL.\nLIC. ANTONIO HERNÁNDEZ MARTÍNEZ.\nRúbrica.\nDIRECTOR GENERAL DE ACCIONES PRIORITARIAS.\nLIC. EFRAÍN PEÑA DAMACIO.\nRúbrica.",
  "ordenamiento": "REGLA",
  "jurisdiccion": "GUERRERO",
  "fuente_oficial": "DIARIO OFICIAL DE LA FEDERACION",
  "Fecha de Publicación": "24 DE MAYO DE 2013",
  "ULTIMA REFORMA PUBLICADA": "24 DE MAYO DE 2013",
  "status": "ABROGADA",
  "es_escaneado": false,
  "tiene_tablas": false,
  "materia": [
    "general"
  ]
}