{
  "titulo": "Acuerdo de Coordinación para la Concurrencia de Recursos Federales y Estatales para los Programas So",
  "Contenido": "FEDERALES PARA EL DESARROLLO DE ZONAS\nPRIORITARIAS, JORNALEROS AGRÍCOLAS, EMPLEO\nTEMPORAL, OPCIONES PRODUCTIVAS Y 3X1 PARA\nMIGRANTES, TODOS ELLOS DEL RAMO\nADMINISTRATIVO 20 “DESARROLLO SOCIAL” PARA EL\nEJERCICIO FISCAL 2009, QUE SUSCRIBEN POR UNA\nPARTE EL EJECUTIVO FEDERAL, A TRAVÉS DE LA\nSECRETARÍA DE DESARROLLO SOCIAL Y POR LA\nOTRA, EL EJECUTIVO DEL ESTADO DE GUERRERO\nABROGADO POR CONCLUIDA SU VIGENCIA EL 31 DE DICIEMBRE DE 2009.\nTEXTO ORIGINAL.\nAcuerdo de Coordinación publicado en el Periódico Oficial del Gobierno del Estado No.\n68, el Martes 25 de Agosto de 2009.\nACUERDO DE COORDINACIÓN PARA LA CONCURRENCIA DE RECURSOS\nFEDERALES Y ESTATALES PARA LOS PROGRAMAS SOCIALES FEDERALES\nPARA EL DESARROLLO DE ZONAS PRIORITARIAS, JORNALEROS AGRÍCOLAS,\nEMPLEO TEMPORAL, OPCIONES PRODUCTIVAS Y 3X1 PARA MIGRANTES,\nTODOS ELLOS DEL RAMO ADMINISTRATIVO 20 \"DESARROLLO SOCIAL\" PARA\nEL EJERCICIO FISCAL 2009, QUE SUSCRIBEN POR UNA PAR-TE EL EJECUTIVO\nFEDERAL, A TRAVÉS DE LA SECRETARÍA DE DESARROLLO SOCIAL, EN LO\nSUCESIVO \"LA SEDESOL\", REPRESENTADA EN ESTE ACTO POR EL INGENIERO\nLUIS MEJÍA GUZMÁN, EN SU CARÁCTER DE SUBSECRETARIO DE DESARROLLO\nSOCIAL Y HUMANO, Y EL DELEGADO FEDERAL EN EL ESTADO, EL INGENIERO\nLUZ ANTONIO GONZÁLEZ JUSTO, Y POR LA OTRA, EL EJECUTIVO DEL ESTADO\nDE GUERRERO EN LO SUCESIVO EL \"ESTADO\", REPRESENTADO POR EL\nLICENCIADO HUMBERTO SARMIENTO LUEBBERT, COORDINADOR GENERAL\nLICENCIADO ALFONSO BECERRIL ZARCO, COORDINADOR GENERAL ADJUNTO\nDEL COPLADEG, AL TENOR DE LOS SIGUIENTES ANTECEDENTES Y\nCLÁUSULAS:\nI. El Plan Nacional de Desarrollo 2007-2012, establece en su apartado denominado Eje3. \"Igualdad de oportunidades\", que la finalidad de la política social de\nFEDERALES PARA EL DESARROLLO DE ZONAS\nPRIORITARIAS, JORNALEROS AGRÍCOLAS, EMPLEO\nTEMPORAL, OPCIONES PRODUCTIVAS Y 3X1 PARA\nMIGRANTES, TODOS ELLOS DEL RAMO\nADMINISTRATIVO 20 “DESARROLLO SOCIAL” PARA EL\nEJERCICIO FISCAL 2009, QUE SUSCRIBEN POR UNA\nPARTE EL EJECUTIVO FEDERAL, A TRAVÉS DE LA\nSECRETARÍA DE DESARROLLO SOCIAL Y POR LA\nOTRA, EL EJECUTIVO DEL ESTADO DE GUERRERO esta Administración es lograr el desarrollo humano y el bienestar de los mexicanos a través de la igualdad de oportunidades. Para conducir a México hacia un desarrollo económico y social sustentable hay que resolver a fondo las graves diferencias que imperan en el país. Gobierno y sociedad deben ser capaces de mejorar significativamente las condiciones de vida de quienes viven en la pobreza.\nII. El Programa Sectorial de Desarrollo Social 2007-2012, establece entre sus objetivos: Desarrollar las capacidades básicas de las personas en condición de pobreza, disminuir las disparidades regionales a través del ordenamiento territorial e infraestructura social que permita la integración de las regiones marginadas a los procesos de desarrollo y detonar las potencialidades productivas; así como abatir el rezago que enfrentan los grupos sociales vulnerables a través de estrategias de asistencia social que les permitan desarrollar sus potencialidades con independencia y plenitud.\nIII. El artículo 33 de la Ley de Planeación establece que el Ejecutivo Federal podrá convenir con los Gobiernos de las Entidades Federativas, satisfaciendo las formalidades que en cada caso procedan, la coordinación que se requiera a efecto de que los Gobiernos participen en el Plan Nacional de Desarrollo.\nIV. El artículo 29 fracción II del Decreto de Presupuesto de Egresos de la\nFederación para el Ejercicio Fiscal 2009, establece que tratándose de facultades concurrentes, cuando el Ejecutivo Federal por conducto de la dependencia competente\nEntidades Federativas, procurará que estos se celebren en condiciones de oportunidades y certeza para beneficio de la población objetivo.\nFEDERALES PARA EL DESARROLLO DE ZONAS\nPRIORITARIAS, JORNALEROS AGRÍCOLAS, EMPLEO\nTEMPORAL, OPCIONES PRODUCTIVAS Y 3X1 PARA\nMIGRANTES, TODOS ELLOS DEL RAMO\nADMINISTRATIVO 20 “DESARROLLO SOCIAL” PARA EL\nEJERCICIO FISCAL 2009, QUE SUSCRIBEN POR UNA\nPARTE EL EJECUTIVO FEDERAL, A TRAVÉS DE LA\nSECRETARÍA DE DESARROLLO SOCIAL Y POR LA\nOTRA, EL EJECUTIVO DEL ESTADO DE GUERRERO\nV. De acuerdo a lo establecido en el artículo 30 del Decreto de Presupuesto de\nEgresos de la Federación para el Ejercicio Fiscal 2009, los programas de subsidios del\nRamo Administrativo 20 Desarrollo Social se destinarán, en las Entidades Federativas, en los términos de las disposiciones aplicables exclusivamente a la población en condiciones de pobreza y de marginación de acuerdo con los criterios oficiales dados a conocer por la \"SEDESOL\".\nVI. La \"SEDESOL\" manifiesta que la Dirección General de Programación y\nPresupuesto, de la Oficialía Mayor de esta Dependencia, mediante oficio Núm.\nOM/DGPP/410.20/01745/08, de fecha 19 de diciembre de 2008, comunicó la autorización correspondiente a la Subsecretaría de Desarrollo Social y Humano de las asignaciones de recursos que le corresponden, conforme al Decreto de Presupuesto de Egresos de la\nFederación para el Ejercicio Fiscal 2009.\nVII. La \"SEDESOL\" manifiesta que los programas materia del presente Acuerdo de Coordinación se encuentran adscritos a la Subsecretaría de Desarrollo Social y\nHumano.\nCon base en lo expuesto y con fundamento en los artículos 32 de la Ley Orgánica de la Administración Pública Federal; 33 y 34 de la Ley de Planeación; 1, 4, 54 y demás\nReglamento; 17, 24, 29, 32, 39, y 43 de la Ley General de Desarrollo Social y su\nInformación Pública Gubernamental; 29 y 30 del Decreto de Presupuesto de Egresos de\nPrioritaria para el año 2009, publicado en la misma fecha; en los artículos6 fracciones V y\nVI, 7, 12 fracción XII, 17, 22, 23, 24, 25, 33 fracción III, 36 fracción VII, 37, 44 y 45 del\nFEDERALES PARA EL DESARROLLO DE ZONAS\nPRIORITARIAS, JORNALEROS AGRÍCOLAS, EMPLEO\nTEMPORAL, OPCIONES PRODUCTIVAS Y 3X1 PARA\nMIGRANTES, TODOS ELLOS DEL RAMO\nADMINISTRATIVO 20 “DESARROLLO SOCIAL” PARA EL\nEJERCICIO FISCAL 2009, QUE SUSCRIBEN POR UNA\nPARTE EL EJECUTIVO FEDERAL, A TRAVÉS DE LA\nSECRETARÍA DE DESARROLLO SOCIAL Y POR LA\nOTRA, EL EJECUTIVO DEL ESTADO DE GUERRERO\nReglamento Interior de la Secretaría de Desarrollo Social, en las Reglas de Operación de los Programas de Subsidios del Ramo Administrativo 20 Desarrollo Social, así como en\nGuerrero; 1 fracción III, 29, 30 al 35, 60, 61 y 62 de la Ley de Planeación para el Estado de Guerrero; y, Segundo del Acuerdo por el que se crea la Coordinación General del\nEjecutivo del Estado, como una dependencia directamente adscrita a la Oficina del\nGobernador, publicado en el Periódico Oficial del Gobierno del Estado de Guerrero\nNúmero 5 de fecha 16 de enero de 2007, las partes celebran el presente Acuerdo de\nCoordinación en los términos de las siguientes:\nDEL OBJETO.\nPRIMERA. La \"SEDESOL\" y el \"ESTADO\" celebran el presente Acuerdo que\nProgramas para el Desarrollo de Zonas Prioritarias, Atención a Jornaleros Agrícolas, Empleo Temporal, Opciones Productivas y 3x1 para Migrantes, a efecto de atender a la población en condiciones de pobreza y marginación.\nLa \"SEDESOL\" y el \"ESTADO\" se comprometen a adoptar un esquema de programas aquí convenidos.\nTERRITORIOS ESPECÍFICOS.\nFEDERALES PARA EL DESARROLLO DE ZONAS\nPRIORITARIAS, JORNALEROS AGRÍCOLAS, EMPLEO\nTEMPORAL, OPCIONES PRODUCTIVAS Y 3X1 PARA\nMIGRANTES, TODOS ELLOS DEL RAMO\nADMINISTRATIVO 20 “DESARROLLO SOCIAL” PARA EL\nEJERCICIO FISCAL 2009, QUE SUSCRIBEN POR UNA\nPARTE EL EJECUTIVO FEDERAL, A TRAVÉS DE LA\nSECRETARÍA DE DESARROLLO SOCIAL Y POR LA\nOTRA, EL EJECUTIVO DEL ESTADO DE GUERRERO\nSEGUNDA. La \"SEDESOL\" y el \"ESTADO\" promoverán que sus acciones se ejecuten en un marco de concurrencia y articulación de esfuerzos con el fin de propiciar el desarrollo de los territorios y de la población en pobreza y marginación de la entidad de conformidad con lo que establece el artículo 14 de la Ley General de Desarrollo Social y el artículo 30 del Decreto del Presupuesto de Egresos de la Federación para el\nEjercicio fiscal 2009.\nAPORTACIONES PRESUPUESTARIAS.\nTERCERA. En los Programas para el Desarrollo de Zonas Prioritarias, Atención a\nJornaleros Agrícolas, Empleo Temporal y Opciones Productivas, la \"SEDESOL\" aportará\n$2.00 pesos por cada peso aportado por el \"ESTADO\", lo que equivale a un esquema\n66.7% federal y 33.3% estatal.\nEn el caso del Programa 3x1 para Migrantes, la \"SEDESOL\" aportará un peso por cada peso aportado por el \"ESTADO\". A lo anterior se deberán añadir las aportaciones de los Migrantes y de las autoridades municipales, para cumplir el esquema financiero establecido en las Reglas de Operación del programa.\nEn total y en el marco del presente Acuerdo, la \"SEDESOL\" aportará recursos por la cantidad de $ 179,564,528.00 (Ciento setenta y nueve millones quinientos sesenta y cuatro mil quinientos veintiocho pesos 00/100 M.N.). La distribución financiera y programática de dichos recursos se describe en el Anexo 1, que forma parte del presente\nAcuerdo.\nPor su parte, el \"ESTADO\" aportará recursos por la cantidad de $ 95, 575,490\n(Noventa y cinco millones quinientos setenta y cinco mil cuatrocientos noventa pesos\nFEDERALES PARA EL DESARROLLO DE ZONAS\nPRIORITARIAS, JORNALEROS AGRÍCOLAS, EMPLEO\nTEMPORAL, OPCIONES PRODUCTIVAS Y 3X1 PARA\nMIGRANTES, TODOS ELLOS DEL RAMO\nADMINISTRATIVO 20 “DESARROLLO SOCIAL” PARA EL\nEJERCICIO FISCAL 2009, QUE SUSCRIBEN POR UNA\nPARTE EL EJECUTIVO FEDERAL, A TRAVÉS DE LA\nSECRETARÍA DE DESARROLLO SOCIAL Y POR LA\nOTRA, EL EJECUTIVO DEL ESTADO DE GUERRERO\n00/100 M.N.), de conformidad con la distribución financiera y programática que se menciona en el Anexo 2, mismo que forma parte del presente Acuerdo.\nCUARTA. Los recursos federales que ejecute el \"ESTADO\" en los términos del presente Acuerdo, no pierden su carácter de federal.\nLos recursos aportados por ambas partes estarán destinados exclusivamente al otorgamiento de subsidios, y estarán sujetos a las Reglas de Operación de los programas correspondientes.\nQUINTA. La ministración de los recursos aportados por las partes se hará de acuerdo al calendario presupuestario detallado en el Anexo 4, mismo que forma parte del presente Acuerdo.\nSEXTA. La \"SEDESOL\" y el \"ESTADO\" en coordinación planearán las obras prioritarias y acciones a realizar, respecto a los Programas para el Desarrollo de Zonas\nPrioritarias, Atención a Jornaleros Agrícolas, Empleo Temporal y Opciones Productivas tomando en consideración el Anexo 5 de este Acuerdo de Coordinación.\nDE LAS METAS.\nSÉPTIMA. La \"SEDESOL\" y el \"ESTADO\" acuerdan las metas consolidadas que se describen en el Anexo 3, mismo que forma parte integrante del presente Acuerdo.\nDE LAS RESPONSABILIDADES.\nOCTAVA. Los programas objeto de este Acuerdo, se sujetarán en su instrumentación, operación, ejecución, evaluación, medición y seguimiento a lo que establece la Ley Federal de Presupuesto y Responsabilidad Hacendaria; el Decreto de\nFEDERALES PARA EL DESARROLLO DE ZONAS\nPRIORITARIAS, JORNALEROS AGRÍCOLAS, EMPLEO\nTEMPORAL, OPCIONES PRODUCTIVAS Y 3X1 PARA\nMIGRANTES, TODOS ELLOS DEL RAMO\nADMINISTRATIVO 20 “DESARROLLO SOCIAL” PARA EL\nEJERCICIO FISCAL 2009, QUE SUSCRIBEN POR UNA\nPARTE EL EJECUTIVO FEDERAL, A TRAVÉS DE LA\nSECRETARÍA DE DESARROLLO SOCIAL Y POR LA\nOTRA, EL EJECUTIVO DEL ESTADO DE GUERRERO\nPresupuesto de Egresos de la Federación para el Ejercicio Fiscal 2009; a las respectivas\nReglas de Operación, a las demás disposiciones legales federales aplicables y a los instrumentos jurídicos, técnicos y operativos derivados de las Reglas de Operación.\nLa \"SEDESOL\" y el \"ESTADO\" acuerdan que los recursos federales que no hubieren sido ejercidos o comprometidos en proyectos aprobados al 30 de junio de 2009, podrán ser reasignados a otros Estados.\nLas partes se comprometen a realizar sus aportaciones conforme a los tiempos, periodicidades y montos establecidos en el Anexo 4.\nNOVENA. La \"SEDESOL\" y el \"ESTADO\" acuerdan que podrán proponer ampliaciones o modificaciones a la distribución de recursos entre programas, municipios y localidades, siempre y cuando se respete la regla de aportación complementaria prevista en la Cláusula Tercera. Para tal efecto, el \"ESTADO\" y el Delegado Federal de la \"SEDESOL\" deberán remitir a la Unidad Administrativa responsable del programa una propuesta técnicamente justificada; esta última la analizará y en su caso la autorizará.\nAtención Prioritaria, que se definen en el presente documento en el Anexo 5, sin contar\nCentrales de la \"SEDESOL\". presupuestarias transcurridas respecto de los recursos convenidos, por medio de\nFederal de la \"SEDESOL\" en el Estado.\nFEDERALES PARA EL DESARROLLO DE ZONAS\nPRIORITARIAS, JORNALEROS AGRÍCOLAS, EMPLEO\nTEMPORAL, OPCIONES PRODUCTIVAS Y 3X1 PARA\nMIGRANTES, TODOS ELLOS DEL RAMO\nADMINISTRATIVO 20 “DESARROLLO SOCIAL” PARA EL\nEJERCICIO FISCAL 2009, QUE SUSCRIBEN POR UNA\nPARTE EL EJECUTIVO FEDERAL, A TRAVÉS DE LA\nSECRETARÍA DE DESARROLLO SOCIAL Y POR LA\nOTRA, EL EJECUTIVO DEL ESTADO DE GUERRERO\nLa ejecución de los programas de subsidios estará sustentada en propuestas de in-versión, que deberán cumplir con las Reglas de Operación de los respectivos programas.\nDE LOS TRABAJOS DE SEGUIMIENTO, EVALUACIÓN Y CONTROL DE LOS\nRECURSOS.\nDÉCIMA. El \"ESTADO\" asume el compromiso de proporcionar a la \"SEDESOL\", por conducto de su Delegación Federal en el Estado, informes trimestrales de seguimiento de los programas objeto de este Acuerdo, para los proyectos, obras y acciones en que el \"ESTADO\" o alguna de sus dependencias o entidades sea la\nInstancia Ejecutora. La entrega de dichos informes se hará en un plazo no mayor a veinte días naturales por conducto del Comité de Planeación para el Desarrollo del\nEstado de Guerrero (COPLADEG), quien será responsable de validar la información solicitada.\nCuando el responsable ejecutor sea el municipio, éste informará a la \"SEDESOL\" por conducto de la Delegación Federal en el Estado, en un plazo no mayor a veinte días naturales contados a partir de la conclusión de cada trimestre, enviando copia al\n\"ESTADO\".\nLa \"SEDESOL\", por conducto de su Delegación Federal en el Estado, asume el lineamientos necesarios para integrar los informes.\nDÉCIMA PRIMERA. Para dar transparencia en el ejercicio de los recursos que aporten las partes objeto de este Acuerdo, la \"SEDESOL\" y el \"ESTADO\" convienen\nFEDERALES PARA EL DESARROLLO DE ZONAS\nPRIORITARIAS, JORNALEROS AGRÍCOLAS, EMPLEO\nTEMPORAL, OPCIONES PRODUCTIVAS Y 3X1 PARA\nMIGRANTES, TODOS ELLOS DEL RAMO\nADMINISTRATIVO 20 “DESARROLLO SOCIAL” PARA EL\nEJERCICIO FISCAL 2009, QUE SUSCRIBEN POR UNA\nPARTE EL EJECUTIVO FEDERAL, A TRAVÉS DE LA\nSECRETARÍA DE DESARROLLO SOCIAL Y POR LA\nOTRA, EL EJECUTIVO DEL ESTADO DE GUERRERO\nEjecutoras sobre las obras y acciones materia de los programas aquí convenidos, apoyadas parcial o totalmente con subsidios federales, deberán mencionar expresamente dicha aportación de recursos federales así como incluir el logotipo de la\n\"SEDESOL\" y de la Estrategia Vivir Mejor en los impresos y elementos gráficos que sean utilizados para tal efecto, como son letreros, mamparas, templetes, gallardetes, posters, trípticos y otros similares. Los logotipos de la \"SEDESOL\" y de la Estrategia\nVivir Mejor deberán ocupar un área equivalente a la ocupada por los logotipos de las instancias locales participantes.\nLas partes acuerdan que, conforme a la Ley General de Desarrollo Social, así como con el Decreto del Presupuesto de Egresos de la Federación para el ejercicio fiscal\n2009, la publicidad y la información relativa a las acciones realizadas deberá identificarse con el Escudo Nacional en los términos que establece la Ley sobre el Escudo, la\nBandera y el Himno Nacional e incluir la siguiente leyenda \"Este programa es público, ajeno a cualquier partido político. Queda prohibido su uso para fines distintos a los establecidos en el Programa\".\nDÉCIMA SEGUNDA. El \"ESTADO\" y la \"SEDESOL\" deberán cumplir con los transparencia y rendición de cuentas, con la finalidad de favorecer la generación de informes; determinación de acciones, obras y seguimiento a la entrega y comprobación de recursos.\nDÉCIMA TERCERA. El control, vigilancia y evaluación de los recursos federales\n\"SEDESOL\"; al Consejo Nacional de Evaluación de la Política de Desarrollo Social en el ámbito de su competencia; a la Secretaría de Hacienda y Crédito Público; a la Secretaría de la Función Pública (SFP) y a la Auditoria Superior de la Federación, conforme a las\nFEDERALES PARA EL DESARROLLO DE ZONAS\nPRIORITARIAS, JORNALEROS AGRÍCOLAS, EMPLEO\nTEMPORAL, OPCIONES PRODUCTIVAS Y 3X1 PARA\nMIGRANTES, TODOS ELLOS DEL RAMO\nADMINISTRATIVO 20 “DESARROLLO SOCIAL” PARA EL\nEJERCICIO FISCAL 2009, QUE SUSCRIBEN POR UNA\nPARTE EL EJECUTIVO FEDERAL, A TRAVÉS DE LA\nSECRETARÍA DE DESARROLLO SOCIAL Y POR LA\nOTRA, EL EJECUTIVO DEL ESTADO DE GUERRERO atribuciones que les confiere la Ley Orgánica de la Administración Pública Federal, la Ley de Fiscalización Superior de la Federación, la Ley Federal de Presupuesto y\nResponsabilidad Hacendaria y demás disposiciones aplicables, sin perjuicio de las acciones de vigilancia, control y evaluación que en coordinación con la SFP realice la\nContraloría del \"ESTADO\".\nDÉCIMA CUARTA. Con el objeto de asegurar la aplicación y efectividad del presente Acuerdo la \"SEDESOL\" y el \"ESTADO\" se comprometen a revisar periódicamente el cumplimiento de su contenido, así como adoptar las medidas necesarias para establecer el enlace y la comunicación requerida para dar el debido seguimiento a los compromisos asumidos.\nLas partes convienen en que la SFP podrá verificar en cualquier momento el cumplimiento de los compromisos a cargo del \"ESTADO\" en los términos del presente\nAcuerdo.\nESTIPULACIONES FINALES.\nDÉCIMA QUINTA. Las partes acuerdan que los recursos federales aportados en por cualquier motivo, incluyendo los rendimientos que se hayan obtenido, deberán reintegrarse a la Tesorería de la Federación dentro de los 15 días naturales siguientes al cierre del ejercicio.\nDÉCIMA SEXTA. La \"SEDESOL\" y el \"ESTADO\" realizarán las acciones necesarias para cumplir con los compromisos pactados en este Acuerdo. En el evento de pactado, la contraparte quedará liberada del cumplimiento de las obligaciones que le son\nFEDERALES PARA EL DESARROLLO DE ZONAS\nPRIORITARIAS, JORNALEROS AGRÍCOLAS, EMPLEO\nTEMPORAL, OPCIONES PRODUCTIVAS Y 3X1 PARA\nMIGRANTES, TODOS ELLOS DEL RAMO\nADMINISTRATIVO 20 “DESARROLLO SOCIAL” PARA EL\nEJERCICIO FISCAL 2009, QUE SUSCRIBEN POR UNA\nPARTE EL EJECUTIVO FEDERAL, A TRAVÉS DE LA\nSECRETARÍA DE DESARROLLO SOCIAL Y POR LA\nOTRA, EL EJECUTIVO DEL ESTADO DE GUERRERO correlativas, debiendo comunicar a la brevedad dichas circunstancias mediante escrito firmado por la dependencia o entidad estatal que corresponda, y en su caso por la\n\"SEDESOL\" en el ámbito federal.\nDÉCIMA SÉPTIMA. El presente Acuerdo se podrá dar por terminado de manera anticipada por cualquiera de las siguientes causas:\n1. No cumplir en tiempo y forma con los compromisos pactados en este Acuerdo.\n2. La aplicación de los recursos federales a fines distintos de los pactados, y\n3. La falta de entrega de la información, reportes y demás documentación prevista en este Acuerdo.\nDÉCIMA OCTAVA. En caso de incumplimiento de los términos del presente\nAcuerdo, atribuible al \"ESTADO\", la \"SEDESOL\", con fundamento en lo dispuesto en el\nPresupuesto de Egresos de la Federación para el Ejercicio Fiscal 2009 y la legislación federal aplicable de la materia, podrá suspender la ministración de recursos o bien solicitar su reintegro, escuchando previamente la opinión de la dependencia o entidad estatal correspondiente.\nEn el supuesto de que la \"SEDESOL\" incumpla los términos del presente\nAcuerdo, el \"ESTADO\", después de escuchar la opinión de la \"SEDESOL\", podrá suspender sus recursos presupuestarios aportados.\nFEDERALES PARA EL DESARROLLO DE ZONAS\nPRIORITARIAS, JORNALEROS AGRÍCOLAS, EMPLEO\nTEMPORAL, OPCIONES PRODUCTIVAS Y 3X1 PARA\nMIGRANTES, TODOS ELLOS DEL RAMO\nADMINISTRATIVO 20 “DESARROLLO SOCIAL” PARA EL\nEJERCICIO FISCAL 2009, QUE SUSCRIBEN POR UNA\nPARTE EL EJECUTIVO FEDERAL, A TRAVÉS DE LA\nSECRETARÍA DE DESARROLLO SOCIAL Y POR LA\nOTRA, EL EJECUTIVO DEL ESTADO DE GUERRERO\nDÉCIMA NOVENA. Este Acuerdo surte sus efectos desde el día primero de enero hasta el treinta y uno de diciembre del año dos mil nueve, y deberá publicarse, de acuerdo con lo establecido en la Ley de Planeación y en el Presupuesto de Egresos de la\nFederación para el Ejercicio Fiscal 2009, en el Diario Oficial de la Federación y en el órgano oficial de difusión del Gobierno del Estado, con el propósito de que la población conozca las inversiones coordinadas de la Federación con el \"Estado\".\nLeído que fue y debidamente enterados del alcance y contenido legal, se firma el presente Acuerdo en dos ejemplares, en la Ciudad de México, Distrito Federal a los 18 días del mes de enero del año dos mil nueve.\nPOR \"LA SEDESOL\"\nING. LUIS MEJÍA GUZMÁN.\nSUBSECRETARIO FEDERAL DE DESARROLLO SOCIAL Y HUMANO.\nRúbrica.\nING. LUZ ANTONIO GONZÁLEZ JUSTO.\nDELEGADO FEDERAL DE LA \"SEDESOL\" EN EL ESTADO DE GUERRERO.\nRúbrica.\nPOR \"EL ESTADO\"\nLIC. HUMBERTO SARMIENTO LUEBBERT.\nGENERAL DEL COPLADEG.\nRúbrica.\nFEDERALES PARA EL DESARROLLO DE ZONAS\nPRIORITARIAS, JORNALEROS AGRÍCOLAS, EMPLEO\nTEMPORAL, OPCIONES PRODUCTIVAS Y 3X1 PARA\nMIGRANTES, TODOS ELLOS DEL RAMO\nADMINISTRATIVO 20 “DESARROLLO SOCIAL” PARA EL\nEJERCICIO FISCAL 2009, QUE SUSCRIBEN POR UNA\nPARTE EL EJECUTIVO FEDERAL, A TRAVÉS DE LA\nSECRETARÍA DE DESARROLLO SOCIAL Y POR LA\nOTRA, EL EJECUTIVO DEL ESTADO DE GUERRERO\nLIC. ALFONSO BECERRIL ZARCO.\nCOORDINADOR GENERAL ADJUNTO DEL COPLADEG.\nRúbrica.\nSECRETARÍA DE DESARROLLO SOCIAL\nACUERDO DE COORDINACIÓN PARA LA CONCURRENCIA DE RECURSOS FEDERALES Y ESTATALES\nPARA LOS PROGRAMAS SOCIALES FEDERALES DEL RAMO ADMINISTRATIVO 20 \"DESARROLL O SOCIAL\"\nDISTRIBUCIÓN DE LA INVERSIÓN Y METAS FEDERALES EJERCICIO FISCAL 2009\nESTADO DE: GUERRERO ANEXO 1\nREGIONALIZACIÓN D\nIO L x1\nM IGRA\n/\nIN V\nIO NES P\nTOTAL\nMUNICIPIOS Y LOCA LIDADES DE\nALTA Y MUY AL TA 1 00,735,280.00 1 15 9,269,161.00 4 0 6,416,028.00 8 2,972 1 4,285,674.00 2 09,212 1,195 1 7,726,538.00 1 77 7 08 1 48,432,681.00\nMARGINACIÓN\nTOTAL 1 25,919,100.00 1 45 1 1,586,451.00 5 2 6,416,028.00 8 2,972 1 4,285,674.00 2 09,212 1,195 2 1,357,275.00 2 13 8 52 1 79,564,528.00\nOBSERVACIONES\nEn \"Otros Municipios y Localidades\" se incluyen las localidades de alta y muy alta marginación ubicadas en municipios de marginación media, baja y muy baja. Los recursos federales no incluyen gastos de operación de SEDESOL.\nLaSedesolyelEstado,porconductodesusrepresentantes,manifiestanqueunavezsuscritoelpresenteAnexoporlasinstanciasfederalyestatal,podrániniciarelejerciciodelosrecursosparalosprogramasaquíesta blecidos,sin perjuicio de la formalización del Acuerdo de Coordinación para la Concurrencia de Recursos Federales y Estatales para los Programas Sociales del Ramo Administrativo 20 “Desarrollo Social” para el ejercicio fiscal 2009.\nING. LUZ ANTONIO GONZÁLEZ JUSTO LIC. HUMBERTO SARMIENTO LUEBBERT\nRúbrica.\nRúbrica.\nEstosProgramas sondecarácter público, nosonpatrocinados nipromovidos porpartido políticoalgunoysusrecursos provienen delosimpuestos quepagantodosloscontribuyentes. Estáprohibid o el usodeestosProgramas confinespolíticos, electorales, de lucro y otros distintos a los establecidos. Quien haga uso indebido de los recursos de estos Programas deberá ser denunciado y sancionado de acuerdo con la Ley aplicable y ante la autoridad competente.\nFEDERALES PARA EL DESARROLLO DE ZONAS\nPRIORITARIAS, JORNALEROS AGRÍCOLAS, EMPLEO\nTEMPORAL, OPCIONES PRODUCTIVAS Y 3X1 PARA\nMIGRANTES, TODOS ELLOS DEL RAMO\nADMINISTRATIVO 20 “DESARROLLO SOCIAL” PARA EL\nEJERCICIO FISCAL 2009, QUE SUSCRIBEN POR UNA\nPARTE EL EJECUTIVO FEDERAL, A TRAVÉS DE LA\nSECRETARÍA DE DESARROLLO SOCIAL Y POR LA\nOTRA, EL EJECUTIVO DEL ESTADO DE GUERRERO\nSECRETARÍA DE DESARROLLO SOCIAL\nACUERDO DE COORDINACIÓN PARA LA CONCURRENCIA DE RECURSOS FEDERALES Y ESTATAL ES\nPARA LOS PROGRAMAS SOCIALES DEL RAMO ADMINISTRATIVO 20 \"DESARROLLO SO CIAL\"\nDISTRIBUCIÓN DE LA INVERSIÓN Y METAS ESTATALES EJERCICIO FISCAL 2009\nESTADO DE: GUERRERO ANEXO 2\nREGIONALIZACIÓN\n3x\nM IGRA\nP LEO TE\nIO NES P\nTOTAL\nMUNICIPIOS Y LOCA LIDADES DE\nALTA Y MUY AL TA 5 0,367,640.00 5 7 9,269,161.00 4 0 3,208,014.00 4 1,486 7,142,837.00 1 04,606 5 98 8,863,269.00 8 9 3 54 7 8,850,921.00\nMARGINACIÓN\nTOTAL 6 2,959,550.00 7 2 1 1,586,451.00 5 2 3,208,014.00 4 1,486 7,142,837.00 1 04,606 5 98 1 0,678,638.00 1 07 4 26 9 5,575,490.00\nOBSERVACIONES\nEn \"Otros Municipios y Localidades\" se incluyen las localidades de alta y muy alta marginación ubicadas en municipios de marginación media, baja y muy baja.\nLaSedesolyelEstado,porconductodesusrepresentantes,manifiestanqueunavezsuscritoelpresenteAnexoporlasinstanciasfederalyestatal,podrániniciarelejerciciodelosrecursosparalosprogramasaquíestablecidos,sin perjuic io de la formalización del Acuerdo de Coordinación para la Concurrencia de los Recursos Federales y Estatales para los Programas Sociales Federales del Ramo Administrativo 20 “Desarrollo Social” para el ejercicio fiscal\n2009.\nING. LUZ ANTONIO GONZÁLEZ JUSTO LIC. HUMBERTO SARMIENTO LUEBBERT\nRúbrica. Rúbrica.\nEstosProgramas sondecarácter público, nosonpatrocinados nipromovidos porpartidopolíticoalguno ysusrecursos provienen delosimpuestos quepagantodosloscontribuyentes. Estáprohibid o el usodeestosProgramas confinespolíticos, electorales, de lucro y otros distintos a los establecidos. Quien haga uso indebido de los recursos de estos Programas deberá ser denunciado y sancionado de acuerdo con la Ley aplicable y ante la autoridad competente.\nFEDERALES PARA EL DESARROLLO DE ZONAS\nPRIORITARIAS, JORNALEROS AGRÍCOLAS, EMPLEO\nTEMPORAL, OPCIONES PRODUCTIVAS Y 3X1 PARA\nMIGRANTES, TODOS ELLOS DEL RAMO\nADMINISTRATIVO 20 “DESARROLLO SOCIAL” PARA EL\nEJERCICIO FISCAL 2009, QUE SUSCRIBEN POR UNA\nPARTE EL EJECUTIVO FEDERAL, A TRAVÉS DE LA\nSECRETARÍA DE DESARROLLO SOCIAL Y POR LA\nOTRA, EL EJECUTIVO DEL ESTADO DE GUERRERO\nSECRETARÍA DE DESARROLLO SOCIAL\nACUERDO DE COORDINACIÓN PARA CONCURRENCIA DE LOS RECURSOS FEDERALES Y ESTATAL ES\nPARA LOS PROGRAMAS SOCIALES DEL RAMO ADMINISTRATIVO 20 \"DESARROLLO SOCIAL\"\nCONSOLIDADO DE INVERSIÓN Y METAS FEDERALES Y ESTATALES EJERCICIO FISCAL 2009\nESTADO DE: GUERRERO ANEXO 3\nREGIONALIZACIÓN\n3x\nM IGRA\nP LEO TE\nIO NES P\nTOTAL\nMUNICIPIOS Y LOCA LIDADES DE\nALTA Y MUY AL TA 1 51,102,920.00 1 72 1 8,538,322.00 4 0 9,624,042.00 1 24,458 2 1,428,511.00 3 13,818 1,793 2 6,589,807.00 2 66 1,062 2 27,283,602.00\nMARGINACIÓN\nI PIOS Y 3 7,775,730.00 4 5 4,634,580.00 1 2 - - - - - 5,446,106.00 5 4 2 16 4 7,856,416.00\nTOTAL 1 88,878,650.00 2 17 2 3,172,902.00 5 2 9,624,042.00 1 24,458 2 1,428,511.00 3 13,818 1,793 3 2,035,913.00 3 20 1,278 2 75,140,018.00\nOBSERVACIONES\nEn \"Otros Municipios y Localidades\" se incluyen las localidades de alta y muy alta marginación ubicadas en municipios de marginación media, baja y muy baja. Los recursos federales no incluyen gastos de operación de SEDESOL.\nLaSedesolyelEstado,porconductodesusrepresentantes,manifiestanqueunavezsuscritoelpresenteAnexoporlasinstanciasfederalyestatal,podrániniciarelejerciciodelosrecursosparalosprogramasaquíestab lecidos,sin perjuicio de la formalización del Acuerdo de Coordinación para la Concurrencia de Recursos Federales y Estatales para los Programas Sociales del Ramo Administrativo 20 “Desarrollo Social” para el ejercicio fiscal 2009.\nING.LUZ ANTONIO GONZÁLEZ JUSTO LIC. HUMBERTO SARMIENTO LUEBBERT\nRúbrica. Rúbrica.\nEstosProgramas sondecarácter público, nosonpatrocinados nipromovidos porpartidopolíticoalguno ysusrecursos provienen delosimpuestos quepagantodosloscontribuyentes. Estáprohibid o el usodeestosProgramas confinespolíticos, electorales, de lucro y otros distintos a los establecidos. Quien haga uso indebido de los recursos de estos Programas deberá ser denunciado y sancionado de acuerdo con la Ley aplicable y ante la autoridad competente.\nFEDERALES PARA EL DESARROLLO DE ZONAS\nPRIORITARIAS, JORNALEROS AGRÍCOLAS, EMPLEO\nTEMPORAL, OPCIONES PRODUCTIVAS Y 3X1 PARA\nMIGRANTES, TODOS ELLOS DEL RAMO\nADMINISTRATIVO 20 “DESARROLLO SOCIAL” PARA EL\nEJERCICIO FISCAL 2009, QUE SUSCRIBEN POR UNA\nPARTE EL EJECUTIVO FEDERAL, A TRAVÉS DE LA\nSECRETARÍA DE DESARROLLO SOCIAL Y POR LA\nOTRA, EL EJECUTIVO DEL ESTADO DE GUERRERO\nSECRETARÍA DE DESARROLLO SOCIAL\nACUERDO DE COORDINACIÓN PARA LA CONCURRENCIA DE RECURSOS FEDERALES Y ESTATALES\nPARA LOS PROGRAMAS SOCIALES FEDERALES DEL RAMO ADMINISTRATIVO 20 \"DESARR OLLO SOCIAL\"\nCALENDARIO DE MINISTRACIÓN DE RECURSOS FEDERALES Y ESTATALES\nESTADO DE: GUERRERO ANEXO 4\n{\"tabla_1\":{\"columnas\":[\"RECURSOS TOTALE\",\"S ENERO\",\"FEBRERO\",\"MARZO\",\"ABRIL\",\"MAYO\",\"JUNIO\",\"JULIO\",\"AGOSTO\",\"SEPTIEMBRE\",\"OCTUBRE\",\"NOVIEMBRE\",\"DICIEMBRE\",\"TOTAL\"],\"filas\":[{\"columna_1\":\"APORTACION FEDERAL\",\"columna_2\":\"0.00\",\"columna_3\":\"6,295,955.0\",\"columna_4\":\"0 11,108,368.0\",\"columna_5\":\"0 30,432,697.0\",\"columna_6\":\"0 19,705,821.0\",\"columna_7\":\"0 36,996,561.0\",\"columna_8\":\"0 30,183,382.0\",\"columna_9\":\"0 23,993,067.0\",\"columna_10\":\"0 18,848,683.0\",\"columna_11\":\"0 1,999,994.0\",\"columna_12\":\"0 0.00\",\"columna_13\":\"0.00\",\"columna_14\":\"179,564,528.0\"},{\"columna_1\":\"APORTACIÓN ESTATAL\",\"columna_2\":\"0.00\",\"columna_3\":\"3,147,977.0\",\"columna_4\":\"0 5,554,184.0\",\"columna_5\":\"0 15,506,010.0\",\"columna_6\":\"0 10,432,232.0\",\"columna_7\":\"0 20,236,248.0\",\"columna_8\":\"0 16,539,998.0\",\"columna_9\":\"0 13,155,180.0\",\"columna_10\":\"0 10,003,664.0\",\"columna_11\":\"0 999,997.0\",\"columna_12\":\"0 0.00\",\"columna_13\":\"0.00\",\"columna_14\":\"95,575,490.0\"},{\"columna_1\":\"(sin dato)\",\"columna_2\":\"0.00\",\"columna_3\":\"9,443,932.0\",\"columna_4\":\"0 16,662,552.0\",\"columna_5\":\"0 45,938,707.0\",\"columna_6\":\"0 30,138,053.0\",\"columna_7\":\"0 57,232,809.0\",\"columna_8\":\"0 46,723,380.0\",\"columna_9\":\"0 37,148,247.0\",\"columna_10\":\"0 28,852,347.0\",\"columna_11\":\"0 2,999,991.0\",\"columna_12\":\"0 0.00\",\"columna_13\":\"0.00\",\"columna_14\":\"275,140,018.0\"}]}}\nLaSedesolyelEstado,porconductodesusrepresentantesm,anifiestanqueunavezsuscritoelpresenteAnexoporlasinstanciasfederalyestatal,podrániniciarel ejerciciodelosrecursosparalosprogramasaquíestablecidos,sinperjuiciodelaformalizacióndelAcuerdodeCoordinaciónparala\nConcurrencia de Recursos Federales y Estatales para los Programas Sociales del Ramo Administrativo 20 “Desarrollo Social” para el ejercicio fiscal 2009.\n.\n\"\n\"\n.\n\" li c\n,, r ti\n.\n. in e n to n lo s\" l os impuestos que pagan todos los contribuyentes. Está prohibido el uso de estos Programas con fines p o l í t i c o s\n,,. s establecidos. Quien haga uso indebido de los recursos de estos Programas deberá ser denunciado y sancionado de acuerdo con la Ley aplicable y ante la autoridad competente.\nFEDERALES PARA EL DESARROLLO DE ZONAS\nPRIORITARIAS, JORNALEROS AGRÍCOLAS, EMPLEO\nTEMPORAL, OPCIONES PRODUCTIVAS Y 3X1 PARA\nMIGRANTES, TODOS ELLOS DEL RAMO\nADMINISTRATIVO 20 “DESARROLLO SOCIAL” PARA EL\nEJERCICIO FISCAL 2009, QUE SUSCRIBEN POR UNA\nPARTE EL EJECUTIVO FEDERAL, A TRAVÉS DE LA\nSECRETARÍA DE DESARROLLO SOCIAL Y POR LA\nOTRA, EL EJECUTIVO DEL ESTADO DE GUERRERO\nANEXO 5\nEstado: Guerrero\nCriterios para la priorización de las inversiones del Ramo Administrativo 20.\nMunicipios de Muy Alta Marginación\nLugar que\nClave del Población ocupa en el\nNo. Nombre del municipio Región municipio total contexto nacional\n1 12078 Cochoapa el Grande* 15,572 1 Mixteca\n2 12076 Acatepec* 28,525 5 Mixteca\n3 12043 Metlatónoc* 17,398 6 Mixteca\n4 12079 José Joaquín de Herrera* 14,424 9 Centro\n5 12062 Tlacoachistlahuaca* 18,055 16 Mixteca\n6 12010 Atlixtac* 23,371 20 Mixteca\n7 12020 Copanatoyac* 17,337 21 Mixteca\n8 12071 Xochistlahuaca* 25,180 23 Mixteca\n9 12063 Tlacoapa* 8,733 24 Mixteca\n10 12004 Alcozauca de Guerrero* 16,237 25 Mixteca\n11 12016 Coahuayutla de José María Izazaga 13,291 27 Tierra Caliente\n12 12069 Xalpatláhuac* 12,615 28 Mixteca\n13 12047 Pedro Ascencio Alquisiras 6,987 33 Tierra Caliente\n14 12072 Zapotitlán Tablas* 9,601 35 Mixteca\n15 12054 San Miguel Totolapan 27,033 45 Tierra Caliente\n16 12081 Iliatenco* 10,039 47 Mixteca\n17 12019 Copalillo* 13,747 48 Mixteca\n18 12041 Malinaltepec* 26,613 50 Mixteca\n19 12002 Ahuacuotzingo 23,026 51 Centro\n20 12032 General Heliodoro Castillo 34,554 62 Centro\nFEDERALES PARA EL DESARROLLO DE ZONAS\nPRIORITARIAS, JORNALEROS AGRÍCOLAS, EMPLEO\nTEMPORAL, OPCIONES PRODUCTIVAS Y 3X1 PARA\nMIGRANTES, TODOS ELLOS DEL RAMO\nADMINISTRATIVO 20 “DESARROLLO SOCIAL” PARA EL\nEJERCICIO FISCAL 2009, QUE SUSCRIBEN POR UNA\nPARTE EL EJECUTIVO FEDERAL, A TRAVÉS DE LA\nSECRETARÍA DE DESARROLLO SOCIAL Y POR LA\nOTRA, EL EJECUTIVO DEL ESTADO DE GUERRERO\n21 12009 Atlamajalcingo del Monte* 5,143 69 Mixteca\n22 12052 San Luis Acatlán* 41,884 80 Costa Chica\n23 12074 Zitlala* 19,718 94 Centro\n24 12045 Olinalá 22,437 136 Mixteca\n25 12042 Mártir de Cuilapan* 15,272 154 Centro\n26 12012 Ayutla de los Libres 55,974 175 Costa Chica\n27 12028 Chilapa de Álvarez 105,146 180 Centro\n28 12051 Quechultenango 33,367 181 Centro\n29 12073 Zirándaro 20,053 193 Tierra Caliente\n30 12003 Ajuchitlán del Progreso 37,475 227 Tierra Caliente\n31 12036 Igualapa 10,312 251 Costa Chica\n32 12025 Cuautepec 14,554 275 Costa Chica\n33 12080 Juchitán 6,240 290 Costa Chica\n34 12031 General Canuto A. Neri 6,394 307 Tierra Caliente\n35 12024 Cualác 6,816 348 Mixteca\n36 12026 Cuetzala del Progreso 8,876 350 Tierra Caliente\n37 12013 Azoyú 13,448 354 Costa Chica\nANEXO 5\nMunicipios de Alta Marginación\nLugar que ocupa\nClave del Población\nNo. Nombre del municipio en el contexto Región municipio total nacional\n38 12053 San Marcos 44,959 366\n39 12022 Coyuca de Catalán 41,975 382 Tierra Caliente\n40 12056 Tecoanapa 42,619 397\n41 12008 Atenango del Río 7,648 399\n42 12046 Ometepec 55,283 437\n43 12065 Tlalixtaquilla de Maldonado 6,534 470 Mixteca\n44 12060 Tetipac 12,702 512\nFEDERALES PARA EL DESARROLLO DE ZONAS\nPRIORITARIAS, JORNALEROS AGRÍCOLAS, EMPLEO\nTEMPORAL, OPCIONES PRODUCTIVAS Y 3X1 PARA\nMIGRANTES, TODOS ELLOS DEL RAMO\nADMINISTRATIVO 20 “DESARROLLO SOCIAL” PARA EL\nEJERCICIO FISCAL 2009, QUE SUSCRIBEN POR UNA\nPARTE EL EJECUTIVO FEDERAL, A TRAVÉS DE LA\nSECRETARÍA DE DESARROLLO SOCIAL Y POR LA\nOTRA, EL EJECUTIVO DEL ESTADO DE GUERRERO\nLugar que ocupa\nClave del Población\nNo. Nombre del municipio en el contexto Región municipio total nacional\n45 12070 Xochihuehuetlán 7,005 554 Mixteca\n46 12040 Leonardo Bravo 22,982 566\n47 12027 Cutzamala de Pinzón 20,730 598 Tierra Caliente\n48 12023 Cuajinicuilapa 23,537 615\n49 12064 Tlalchapa 11,286 624 Tierra Caliente\n50 12044 Mochitlán 10,709 649\n51 12068 La Unión de Isidoro Montes de Oca 25,230 688\n52 12030 Florencio Villarreal 18,713 714\n53 12066 Tlapa de Comonfort* 65,763 719 Mixteca\n54 12059 Tepecoacuilco de Trujano 28,989 738\n55 12037 Ixcateopan de Cuauhtémoc 6,104 746\n56 12021 Coyuca de Benítez 69,064 780\n57 12077 Marquelia 11,801 796\n58 12058 Teloloapan 51,659 802 Tierra Caliente\n59 12018 Copala 11,896 805\n60 12006 Apaxtla 12,381 917\n61 12011 Atoyac de Álvarez 58,452 932\n62 12017 Cocula 13,884 936\n63 12039 Juan R. Escudero 22,805 953\n64 12075 Eduardo Neri 40,328 990 Centro\n65 12067 Tlapehuala 20,989 997 Tierra Caliente\n66 12005 Alpoyeca 5,848 1006 Mixteca\n67 12049 Pilcaya 11,035 1048\n68 12034 Huitzuco de los Figueroa 35,055 1093\n69 12033 Huamuxtitlán 13,806 1100 Mixteca\n70 12007 Arcelia 31,401 1116 Tierra Caliente\n71 12057 Técpan de Galeana 57,848 1137\n72 12061 Tixtla de Guerrero 37,300 1184\nFEDERALES PARA EL DESARROLLO DE ZONAS\nPRIORITARIAS, JORNALEROS AGRÍCOLAS, EMPLEO\nTEMPORAL, OPCIONES PRODUCTIVAS Y 3X1 PARA\nMIGRANTES, TODOS ELLOS DEL RAMO\nADMINISTRATIVO 20 “DESARROLLO SOCIAL” PARA EL\nEJERCICIO FISCAL 2009, QUE SUSCRIBEN POR UNA\nPARTE EL EJECUTIVO FEDERAL, A TRAVÉS DE LA\nSECRETARÍA DE DESARROLLO SOCIAL Y POR LA\nOTRA, EL EJECUTIVO DEL ESTADO DE GUERRERO\nLugar que ocupa\nClave del Población\nNo. Nombre del municipio en el contexto Región municipio total nacional\n73 12048 Petatlán 44,485 1190\nANEXO 5\nMunicipios de Media Marginación\n{\"tabla_2\":{\"columnas\":[\"No.\",\"Clave del municipio\",\"Nombre del municipio\",\"Población\\ntotal\",\"(sin encabezado)\"],\"filas\":[{\"columna_1\":\"(sin dato)\",\"columna_2\":\"(sin dato)\",\"columna_3\":\"(sin dato)\",\"columna_4\":\"(sin dato)\",\"columna_5\":\"Lugar que ocupa en el contexto nacional\"},{\"columna_1\":\"74\",\"columna_2\":\"12014\",\"columna_3\":\"Benito Juárez\",\"columna_4\":\"14,444\",\"columna_5\":\"1446\"},{\"columna_1\":\"75\",\"columna_2\":\"12055\",\"columna_3\":\"Taxco de Alarcón\",\"columna_4\":\"98,854\",\"columna_5\":\"1601\"},{\"columna_1\":\"76\",\"columna_2\":\"12015\",\"columna_3\":\"Buenavista de Cuéllar\",\"columna_4\":\"12,148\",\"columna_5\":\"1671\"}]}} municipio total\n77 12050 Pungarabato 36,466 1769\n78 12001 Acapulco de Juárez 717,766 1929\n79 12029 Chilpancingo de los Bravo 214,219 1967\n80 12038 José Azueta 104,609 2015\n81 12035 Iguala de la Independencia 128,444 2027\nNotas:\nLas Zonas de Atención Prioritaria 2009 están integradas por los municipios de muy alta y alta marginación\nFEDERALES PARA EL DESARROLLO DE ZONAS\nPRIORITARIAS, JORNALEROS AGRÍCOLAS, EMPLEO\nTEMPORAL, OPCIONES PRODUCTIVAS Y 3X1 PARA\nMIGRANTES, TODOS ELLOS DEL RAMO\nADMINISTRATIVO 20 “DESARROLLO SOCIAL” PARA EL\nEJERCICIO FISCAL 2009, QUE SUSCRIBEN POR UNA\nPARTE EL EJECUTIVO FEDERAL, A TRAVÉS DE LA\nSECRETARÍA DE DESARROLLO SOCIAL Y POR LA\nOTRA, EL EJECUTIVO DEL ESTADO DE GUERRERO publicadas en el Diario Oficial de la Federación el 28 de noviembre del 2008, en cumplimiento con lo dispuesto por el artículo 30 de la Ley General de Desarrollo Social.\nLos municipios que se detallan en el presente anexo han sido ordenados conforme a su grado de marginación y el lugar que ocupan en el contexto nacional -independientemente de si pertenecen o no a las Zonas de Atención\nPrioritaria-, indicativo de las prioridades que deberán observar los diferentes programas de Desarrollo Social y\nHumano del Ramo Administrativo 20 “Desarrollo Social”.\nEn el presente anexo también se indica si los municipios pertenecen a alguna de las 32 regiones, que la Cámara de\nDiputados identifica en su Declaratoria, conformadas por 365 municipios de muy alta marginación y 455 de alta marginación, que dada la situación de pobreza y marginación estructural que las afecta, requieren de proyectos integradores del territorio.\nLos Municipios Predominantemente Indígenas (*) son aquellos que registran una población hablante de lengua indígena igual o superior al 40 por ciento de la población total mayor de cinco años, independientemente de su grado de marginación.\nEl Consejo Nacional de Población (CONAPO) define a la marginación como un “fenómeno estructural que se origina en la modalidad, estilo o patrón histórico de desarrollo; ésta se expresa, por un lado, en la dificultad para propagar el progreso técnico en el conjunto de la estructura productiva y en las regiones del país, y por el otro, en la exclusión de grupos sociales del proceso de desarrollo y del disfrute de sus beneficios”. CONAPO. Índices de\nMarginación, 2005, pág. 11.\nEl CONAPO establece cinco estratificaciones para la marginación municipal, en las que agrupa a la totalidad de los municipios del país: Muy Alta, Alta, Media, Baja y Muy Baja Marginación. Un estado puede presentar los cinco grupos o sólo algunos, lo que dependerá de la situación que tengan cada uno de sus municipios.\nFuentes: Índice de Marginación Municipal 2005. CONAPO 2005, con base en el II Conteo de Población y Vivienda\nINEGI 2005.",
  "ordenamiento": "COORDINACION",
  "jurisdiccion": "GUERRERO",
  "fuente_oficial": "DIARIO OFICIAL DE LA FEDERACION",
  "Fecha de Publicación": "31 DE DICIEMBRE DE 2009",
  "ULTIMA REFORMA PUBLICADA": "25 de Agosto de 2009",
  "status": "ABROGADA",
  "es_escaneado": false,
  "tiene_tablas": true,
  "materia": [
    "general"
  ]
}