{
  "titulo": "Acuerdo Mediante el Cual Se Dan A Conocer los Nombres de los Integrantes de los Jurados para la Entr",
  "Contenido": "ENTREGA DE LAS CONDECORACIONES Y\nPREMIOS CIVILES ESTATALES DEL AÑO\n2006.\nABROGADO POR CONCLUIDA SU VIGENCIA EL 23 DE OCTUBRE DEL 2006.\nTEXTO ORIGINAL\nAcuerdo publicado en el Periódico Oficial del Gobierno del Estado No. 81 Alcance\nI, el Martes 10 de Octubre de 2006.\nACUERDO MEDIANTE EL CUAL SE DAN A CONOCER LOS NOMBRES DE LOS\nINTEGRANTES DE LOS JURADOS PARA LA ENTREGA DE LAS\nCONDECORACIONES Y PREMIOS CIVILES ESTATALES DEL AÑO 2006.\nEn la Ciudad de Chilpancingo, Capital del Estado de Guerrero, a los nueve días del mes de octubre del dos mil seis, el Consejo de Premiación para otorgar las\nCondecoraciones y Premios Civiles Estatales que instituye la Ley de Premios Civiles del\nEstado de Guerrero, Con fundamento en los artículos 1º, 11, 12, 13, 15, fracción III, 18, 19 y 23 de la\nLey de Premios Civiles del Estado de Guerrero, y en cumplimiento a lo previsto en el inciso H) del Procedimiento de Selección de la Convocatoria emitida el día primero de septiembre del año en curso, hágase del conocimiento del público en general que han quedado debidamente integrados los jurados que formularán mediante dictamen, las propuestas de candidatos a recibir las Condecoraciones y Premios Civiles Estatales\n2006, por lo tanto, publíquese los nombres de los integrantes de dichos Jurados en el del conocimiento que por acuerdo del Consejo, se amplía el término para la entrega de propuestas de candidatos para las Condecoraciones y Premios Civiles, hasta el 23 de octubre del año en curso.- Así lo acordó y firma el Presidente del Consejo de Premiación ante el Secretario, que autoriza y da fe.\nEL PRESIDENTE DEL CONSEJO DE PREMIACIÓN.\nLIC. ARMANDO CHAVARRÍA BARRERA.\nRúbrica.\nENTREGA DE LAS CONDECORACIONES Y\nPREMIOS CIVILES ESTATALES DEL AÑO\n2006.\nEL SECRETARIO EL CONSEJO DE PREMIACIÓN.\nLIC. GUILLERMO RAMÍREZ RAMOS.\nRúbrica.\nSECRETARÍA GENERAL DE GOBIERNO\nSUBSECRETARÍA DE GOBIERNO DE DESARROLLO POLÍTICO\nRELACIÓN DE INTEGRANTES DE LOS JURADOS PARA LAS\nCONDECORACIONES Y PREMIOS CIVILES 2006\nCONDECORACIONES:\n“VICENTE GUERRERO”\nCARGO: NOMBRE:\nPRESIDENTE LIC. JUAN PABLO LEYVA Y CÓRDOBA\nSECRETARIO DR. FERNANDO LASSO ECHEVERÍA\nPRIMER VOCAL: C. FÉLIX MANUEL VILLELA HERNÁNDEZ\nSEGUNDA VOCAL: PROFRA. FRANCIS PINO MEMIJE\nTERCERA VOCAL: C. JULIO EFRAÍN ZÚÑIGA CORTÉZ\nENTREGA DE LAS CONDECORACIONES Y\nPREMIOS CIVILES ESTATALES DEL AÑO\n2006.\n“JUAN ÁLVAREZ”\nCARGO: NOMBRE:\nPRESIDENTE MTRO. HERMILO CASTORENA NORIEGA\nSECRETARIO LIC. JOSÉ GUSTAVO DE LA CRUZ LÓPEZ\nPRIMER VOCAL: PROFR. JAIME O. SOLÍS ROBLEDO\nSEGUNDO VOCAL: LIC. ÁNGEL OMAR PARRA GODOY\nTERCER VOCAL: ING. VIRGILIO TORRES GARCÍA\nENTREGA DE LAS CONDECORACIONES Y\nPREMIOS CIVILES ESTATALES DEL AÑO\n2006.\n“IGNACIO MANUEL ALTAMIRANO”\nCARGO: NOMBRE:\nPRESIDENTE LIC. ALFONSO GUILLEN QUEVEDO\nSECRETARIO EMB. EDMUNDO FONT LÓPEZ\nPRIMER VOCAL: LIC. GLORIA OCAMPO ARANDA\nSEGUNDO VOCAL: DR. EPIFANIO MARTÍNEZ BARRERA\nTERCER VOCAL: PROFR. EDUARDO RAÚL ROMÁN ROMÁN\nENTREGA DE LAS CONDECORACIONES Y\nPREMIOS CIVILES ESTATALES DEL AÑO\n2006.\nPREMIOS CIVILES:\nPREMIO AL MÉRITO EN LA DEFENSA DE\nLOS DERECHOS HUMANOS “NICOLÁS BRAVO”\nCARGO: NOMBRE:\nPRESIDENTA LIC. MA. ELENA MEDINA HERNÁNDEZ\nSECRETARIO LIC. ÁNGEL MIGUEL SEBASTIÁN RÍOS\nPRIMERA VOCAL: LIC. ROSALÍA PINTOS RÍOS ROMERO\nSEGUNDO VOCAL: LIC. ADELAIDO MEMIJE MARTÍNEZ\nTERCER VOCAL: MTRO. MIGUEL ÁNGEL PARRA BEDRÁN\nENTREGA DE LAS CONDECORACIONES Y\nPREMIOS CIVILES ESTATALES DEL AÑO\n2006.\nPREMIO ESTATAL AL MÉRITO INDIGENISTA\n“CUAUHTÉMOC”\nCARGO: NOMBRE:\nPRESIDENTE PROFR. CRISPÍN DE LA CRUZ MORALES\nSECRETARIA LIC. BLANCA JIMÉNEZ PADILLA\nPRIMER VOCAL: ING. PEDRO DE JESÚS ALEJANDRO\nSEGUNDO VOCAL: PROFR. ANTONIO VILLEGAS CRUZ\nTERCERA VOCAL: LIC. ROSA MARÍA GÓMEZ SAAVEDRA\nENTREGA DE LAS CONDECORACIONES Y\nPREMIOS CIVILES ESTATALES DEL AÑO\n2006.\nCOMUNITARIO “MOISÉS OCHOA CAMPOS”\nCARGO: NOMBRE:\nPRESIDENTE ARQ. ÁNGEL PÉREZ PALACIOS\nSECRETARIO ARQ. GUILLERMO TORRES MADRID\nPRIMER VOCAL: PROFR. JUAN SÁNCHEZ ANDRACA\nSEGUNDO VOCAL: ARQ. JOSÉ ANTONIO AYALA AYALA\nTERCER VOCAL: DR. FERNANDO LASSO ECHEVERRÍA\nENTREGA DE LAS CONDECORACIONES Y\nPREMIOS CIVILES ESTATALES DEL AÑO\n2006.\nPREMIO ESTATAL AL MÉRITO EN DESARROLLO RURAL\n“MANUEL MEZA ANDRACA”\nCARGO: NOMBRE:\nPRESIDENTE LIC. ARMANDO RÍOS PITER\nSECRETARIO MC. MOISÉS CASTILLO GARCÍA\nPRIMER VOCAL: DR. ÁNGEL ALMAZÁN JUÁREZ\nSEGUNDO VOCAL: ING. JULIO CÉSAR LÓPEZ URIZA\nTERCER VOCAL: DR. ADÁN AGUIRRE BENÍTEZ\nENTREGA DE LAS CONDECORACIONES Y\nPREMIOS CIVILES ESTATALES DEL AÑO\n2006.\nPREMIO ESTATAL AL MÉRITO POLÍTICO\n“JOSÉ FRANCISCO RUIZ MASSIEU”\nCARGO: NOMBRE:\nPRESIDENTE LIC. ISAÍAS SÁNCHEZ NÁJERA\nSECRETARIO LIC. EMILIANO LOZANO CRUZ\nPRIMERA VOCAL: C. ROSA INÉS DE LA O GARCÍA\nSEGUNDO VOCAL: C. ERNESTO ARAUJO CARRANZA\nTERCER VOCAL: C. RAÚL CALVO BARRERA\nENTREGA DE LAS CONDECORACIONES Y\nPREMIOS CIVILES ESTATALES DEL AÑO\n2006.\nPREMIO ESTATAL AL MÉRITO CÍVICO\n“EDUARDO NERI”\nCARGO: NOMBRE:\nPRESIDENTE DIP. HUMBERTO QUINTIL CALVO MEMIJE\nSECRETARIO DR. ARTURO CONTRERAS GÓMEZ\nPRIMER VOCAL: DR. JESÚS MALDONADO DEL MORAL\nSEGUNDO VOCAL: MC. JOSÉ ALFREDO ROMERO OLEA\nTERCER. VOCAL: MC. RAFAEL RUBÍ ALARCÓN\nENTREGA DE LAS CONDECORACIONES Y\nPREMIOS CIVILES ESTATALES DEL AÑO\n2006.\nY SALUD PÚBLICA “EVA SÁMANO DE LÓPEZ MATEOS”\nCARGO: NOMBRE:\nPRESIDENTA DRA. YENI SOLÍS CARMONA\nSECRETARIO DR. ANICETO OJENDÍS ACALCO\nPRIMER VOCAL: DR. TOMÁS PATIÑO CASTRO\nSEGUNDO VOCAL: DR. RAÚL PERALTA CATALÁN\nTERCER VOCAL: OBP. SAMUEL ALONSO CÁSTULO\nENTREGA DE LAS CONDECORACIONES Y\nPREMIOS CIVILES ESTATALES DEL AÑO\n2006.\n“GUILLERMO SOBERÓN”\nCARGO: NOMBRE:\nPRESIDENTA DRA. BERENICE ILLADES AGUIAR\nSECRETARIO MC. JOSÉ LUIS PARRA MIJANGOS\nPRIMER VOCAL: DR. HUMBERTO HERNÁNDEZ HERNÁNDEZ\nSEGUNDO VOCAL: DR. ROBERTO ARROYO MATUS\nTERCER VOCAL: DR. GUILLERMO CARDOSO LANDA\nENTREGA DE LAS CONDECORACIONES Y\nPREMIOS CIVILES ESTATALES DEL AÑO\n2006.\n“JUAN RUIZ DE ALARCÓN”\nCARGO: NOMBRE:\nPRESIDENTA DRA. LAURA OLIVIA LOPEZVICTORIA\nLÓPEZ\nSECRETARIO C. LUIS ZAPATA QUIROZ\nPRIMERA VOCAL: C. ALBA LETICIA ATILANO CABALLERO\nSEGUNDO VOCAL: C. JOSÉ GÓMEZ SANDOVAL\nTERCER VOCAL: C. JAVIER MARIANO SÁNCHEZ\nENTREGA DE LAS CONDECORACIONES Y\nPREMIOS CIVILES ESTATALES DEL AÑO\n2006.\n“IGNACIO CHÁVEZ”\nCARGO: NOMBRE:\nPRESIDENTE MC. SERGIO LEPEZ VELA\nSECRETARIO C. LIC. GENARO REY MENESES\nPRIMER VOCAL: C. JOSÉ ANTONIO CERROS RÍOS\nSEGUNDA VOCAL: C. JULIA MINERVA GUZMÁN BLAS\nTERCERA VOCAL: C. ILA KURI HERNÁNDEZ\nENTREGA DE LAS CONDECORACIONES Y\nPREMIOS CIVILES ESTATALES DEL AÑO\n2006.\n“PLÁCIDO GARCÍA REYNOSO”\nCARGO: NOMBRE:\nPRESIDENTE C.P. JORGE ALFONSO PEÑA SOBERANIS\nSECRETARIO LIC. LEONCIO DOMÍNGUEZ COBARRUBIAS\nPRIMER VOCAL: LIC. ARMANDO HERNÁNDEZ ABARCA\nSEGUNDO VOCAL: LIC. ESTEBAN ESPINOZA PEZA\nTERCER VOCAL: LIC. EDMUNDO MONTALVAN GATICA\nENTREGA DE LAS CONDECORACIONES Y\nPREMIOS CIVILES ESTATALES DEL AÑO\n2006.\nPREMIO ESTATAL AL MÉRITO DEPORTIVO\n“APOLONIO CASTILLO”\nCARGO: NOMBRE:\nPRESIDENTE LIC. CARLOS SERGIO REYES PARIS\nSECRETARIO PROFR. ELISEO DE JESÚS SOLANO\nPRIMER VOCAL: L.E.F. ELEUTERIO F. OCAMPO\nVILLALOBOS\nSEGUNDO VOCAL: LIC. JULIO F. DÍAZ HERRERA\nTERCER VOCAL: C. ADOLFO CHÁVEZ ROMERO\nENTREGA DE LAS CONDECORACIONES Y\nPREMIOS CIVILES ESTATALES DEL AÑO\n2006.\nPREMIO ESTATAL AL MÉRITO JUVENIL\n“JOSÉ AZUETA”\nCARGO: NOMBRE:\nPRESIDENTE LIC. FRANCISCO ARZOLA JARAMILLO\nSECRETARIO LIC. JUAN CARRANZA SORIANO\nPRIMERA VOCAL: LIC. FANNY KARINA OBÉ HERNÁNDEZ\nSEGUNDA VOCAL: C.P. LUCÍA GAYÓN CAMPOS\nTERCERA VOCAL: LIC. YOLANDA VILLASEÑOR LANDA\nENTREGA DE LAS CONDECORACIONES Y\nPREMIOS CIVILES ESTATALES DEL AÑO\n2006.\nPREMIO ESTATAL AL MÉRITO DE LA MUJER\n“ANTONIA NAVA DE CATALÁN”\nCARGO: NOMBRE:\nPRESIDENTA C. ROSA MARÍA GÓMEZ SAAVEDRA\nSECRETARIA LIC. LAMBERTINA GALEANA MARÍN\nPRIMERA VOCAL: LIC. AMELIA GARCÍA PÉREZ\nSEGUNDA VOCAL: LIC. MARÍA VICTORIA ENRÍQUEZ CABRERA\nTERCERA VOCAL: MC. ALEJANDRA CÁRDENAS SANTANA\nENTREGA DE LAS CONDECORACIONES Y\nPREMIOS CIVILES ESTATALES DEL AÑO\n2006.\nPREMIO ESTATAL AL MÉRITO ECOLÓGICO\n“WILFRIDO ÁLVAREZ SOTELO”\nCARGO: NOMBRE:\nPRESIDENTE M.V.Z. ELÍAS DANIEL MONROY OJEDA\nSECRETARIO LIC. MIGUEL ÁNGEL CALZADA ADAME\nPRIMER VOCAL: DIP. ALEJANDRO CARABIAS ICAZA\nSEGUNDO VOCAL: MC. ELOY URROZ JIMÉNEZ\nTERCER VOCAL: ING. JULIO CÉSAR LÓPEZ URIZA",
  "ordenamiento": "ACUERDO",
  "jurisdiccion": "GUERRERO",
  "fuente_oficial": "DIARIO OFICIAL DE LA FEDERACION",
  "Fecha de Publicación": "10 de Octubre de 2006",
  "ULTIMA REFORMA PUBLICADA": "10 de Octubre de 2006",
  "status": "ABROGADA",
  "es_escaneado": false,
  "tiene_tablas": true,
  "materia": [
    "general"
  ]
}