{
  "titulo": "Acuerdo de Coordinación para Establecer las Bases de Elaboración y Ejecución del Programa Estatal de",
  "Contenido": "AHORRO Y APROVECHAMIENTO DE ENERGÍA\nELÉCTRICA, QUE CELEBRAN EL EJECUTIVO\nFEDERAL, POR CONDUCTO DE LA SECRETARÍA\nDE ENERGÍA Y EL EJECUTIVO ESTATAL\nABROGADO POR CONCLUIDA SU VIGENCIA EL 31 DE MARZO DEL 2011,\nSEÑALADO EN SU CLÁUSULA OCTAVA DEL MENCIONADO ACUERDO DE\nCOORDINACIÓN.\nTEXTO ORIGINAL\nAcuerdo de Coordinación publicado en el Periódico Oficial del Gobierno del\nEstado No. 67, el Martes 21 de Agosto de 2007.\nACUERDO DE COORDINACIÓN PARA ESTABLECER LAS BASES DE\nELABORACIÓN Y EJECUCIÓN DEL PROGRAMA ESTATAL DE AHORRO Y\nAPROVECHAMIENTO DE ENERGÍA, EN LO SUCESIVO \"EL PROGRAMA\", QUE\nCELEBRAN, POR UNA PARTE, EL EJECUTIVO FEDERAL POR CONDUCTO DE LA\nSECRETARÍA DE ENERGÍA, A TRAVÉS DE LA COMISIÓN NACIONAL PARA EL\nAHORRO DE ENERGÍA, EN LO SUCESIVO \"LA CONAE\", REPRESENTADA POR SU\nDIRECTOR GENERAL, DOCTOR JUAN CRISTOBAL MATA SANDOVAL, ASISTIDO\nPOR EL DOCTOR JORGE WOLPERT KURI, COORDINADOR DE PROMOCIÓN Y\nPROGRAMAS REGIONALES; Y POR LA OTRA, EL ESTADO DE GUERRERO,\nREPRESENTADO POR EL GOBERNADOR, CONTADOR PÚBLICO CARLOS\nZEFERINO TORREBLANCA GALINDO, AL QUE EN LO SUCESIVO SE LE\nDENOMINARÁ \"EL ESTADO\", ASISTIDO POR LOS LICENCIADOS ARMANDO\nSARMIENTO LUEBBERT, COORDINADOR GENERAL DEL EJECUTIVO ESTATAL Y\nGUERRERO Y POR EL ARQUITECTO ÁNGEL PÉREZ PALACIOS, COORDINADOR\nGENERAL DE FORTALECIMIENTO MUNICIPAL, SECRETARIO TÉCNICO DEL\nCOMITÉ ESTATAL DE ENERGÍA, DE CONFORMIDAD CON LAS DECLARACIONES\nY CLÁUSULAS SIGUIENTES:\n1.- DECLARA \"LA CONAE\":\nAHORRO Y APROVECHAMIENTO DE ENERGÍA\nELÉCTRICA, QUE CELEBRAN EL EJECUTIVO\nFEDERAL, POR CONDUCTO DE LA SECRETARÍA\nDE ENERGÍA Y EL EJECUTIVO ESTATAL\n1.1. Que es un Órgano Administrativo Desconcentrado de la Secretaría de\nEnergía, que goza de autonomía técnica y operativa, creado por el Ejecutivo Federal según consta en el Decreto publicado en el Diario Oficial de la Federación el 20 de septiembre de 1999, que tiene por objeto fungir como órgano técnico de consulta de las dependencias y entidades de la Administración Pública Federal, así como, cuando así lo soliciten, de los gobiernos de las Entidades Federativas, de los Municipios y de los particulares, en materia de ahorro y uso eficiente de la energía y de aprovechamiento de energías renovables; y que tiene las facultades y atribuciones que le confiere el Decreto antes mencionado.\n1.2. Que tiene facultades para fomentar la eficiencia en el uso de energía mediante acciones coordinadas con las diversas dependencias y entidades de la\nAdministración Pública Federal, los Gobiernos de las Entidades Federativas y de los\nMunicipios; y a través de acciones concertadas, con los sectores social y privado, conforme a lo establecido en el artículo 3 fracción II del Decreto de creación de \"LA\nCONAE\", citado en la declaración que antecede.\n1.3. Que el Doctor Juan Cristóbal Mata Sandoval, en su carácter de Director\nGeneral, tiene atribuciones suficientes para la celebración del presente acuerdo conforme a lo establecido en los artículos 1, 2 y 8 fracción VIII del Decreto de creación de\n\"LA CONAE\", así como en el artículo 34 fracción IV del Reglamento Interior de la\n2001.\n1.4. Que para los efectos del presente acuerdo, señala como su domicilio legal el ubicado en Río Lerma número 302, Piso 5, Colonia Cuauhtémoc, Código Postal 06500,\n2. DECLARA \"EL ESTADO\":\n2.1. Que está facultado conforme al artículo 74 fracción XXXVII de la Constitución\nAHORRO Y APROVECHAMIENTO DE ENERGÍA\nELÉCTRICA, QUE CELEBRAN EL EJECUTIVO\nFEDERAL, POR CONDUCTO DE LA SECRETARÍA\nDE ENERGÍA Y EL EJECUTIVO ESTATAL\nAdministración Pública del Estado de Guerrero Número 433, para celebrar convenios con el Gobierno Federal, con los Ayuntamientos de la Entidad y con los Sectores Social y\nPrivado, para la prestación de servicios públicos y la ejecución de obras que favorezcan el desarrollo del Estado.\n2.2. Que dentro de las facultades del Gobernador del Estado, están las de celebrar convenios con el Ejecutivo Federal para integrar organismos de carácter mixto o que presten servicios coordinados o por cooperación, así como la prestación de servicios públicos y la realización de obras.\n2.3. Que para el despacho de los asuntos que le competen, el Gobernador del\nEstado se auxiliará de las dependencias y entidades que señalen la Constitución Política\nLocal, la Ley Orgánica de la Administración Pública, y las demás disposiciones jurídicas vigentes en la entidad.\n2. 4. Que con fecha siete de diciembre del 2006, se instaló el Comité Estatal de\nEnergía en el estado de Guerrero, como un órgano interdisciplinario, cuyo objetivo es realizar programas y proyectos que con-lleven a la racionalización del uso de los recursos energéticos.\n2.5. Que para los efectos del presente acuerdo, señala como su domicilio el ubicado en Palacio de Gobierno, Boulevard Lic. Rene Juárez Cisneros número 62, 2º piso, Edificio Región Centro, Ciudad de los Servicios, C.P. 39075, Chilpancingo\nGuerrero.\n3. DECLARACIÓN CONJUNTA:\nQue es interés mutuo establecer las bases para elaborar y ejecutar \"El\nPROGRAMA\" en el Estado de Guerrero, para promover de manera eficiente el ahorro y uso eficiente de la energía, así como el aprovechamiento de las energías renovables, y en éste marco de actuación, suscribir el presente Acuerdo de Coordinación.\nAHORRO Y APROVECHAMIENTO DE ENERGÍA\nELÉCTRICA, QUE CELEBRAN EL EJECUTIVO\nFEDERAL, POR CONDUCTO DE LA SECRETARÍA\nDE ENERGÍA Y EL EJECUTIVO ESTATAL\nEn virtud de lo anterior, y con fundamento en los artículos 25, 26, 43, 90 y 116, fracción VII de la Constitución Política de los Estados Unidos Mexicanos; 1º, 2º, 22, 26 y\n33, fracción VIII de la Ley Orgánica de la Administración Pública Federal; 1º fracción III, 33, 34, 35, 37, 38 y 39 de la Ley de Planeación; 23, 74 fracción XXXVII, 76 y 117 de la y IX y 28 de la Ley Orgánica de la Administración Pública del Estado de Guerrero\nNúmero 433; 1º, 36, 37, 61, 62 y 63 de la Ley de Planeación para el Estado de Guerrero, las partes han decidido suscribir el presente Acuerdo de Coordinación, sujetándose al tenor de las siguientes:\nPRIMERA.- OBJETO DEL ACUERDO\n\"LA CONAE\" y \"EL ESTADO\" celebran el presente Acuerdo de Coordinación, con el objeto de establecer las bases para elaborar y ejecutar \"EL PROGRAMA\" en el Estado de Guerrero.\nSEGUNDA.- DE LOS OBJETIVOS\n\"El PROGRAMA\" se integra con los siguientes:\n1. OBJETIVOS GENERALES\na) Promover el ahorro y uso eficiente de la energía, así como el aprovechamiento de las energías renovables, en todas sus formas y manifestaciones, abarcando los sectores productores y consumidores de energía, para consolidar una nueva cultura en el uso racional de los recursos.\nb) Fomentar la aplicación de normas que fomenten el ahorro y uso de la energía y de las energías renovables, dentro de un marco de concertación con los sectores productores y consumidores.\nAHORRO Y APROVECHAMIENTO DE ENERGÍA\nELÉCTRICA, QUE CELEBRAN EL EJECUTIVO\nFEDERAL, POR CONDUCTO DE LA SECRETARÍA\nDE ENERGÍA Y EL EJECUTIVO ESTATAL\nc) Instrumentar proyectos integrales de ahorro de energía eléctrica, así como acciones que se refieran al reemplazo y/o rehabilitación de componentes de los sistemas de alumbrado público, de los sistemas de bombeo de agua para uso doméstico y de las instalaciones de los edificios públicos.\nd) Diseñar estrategias de financiamiento que permitan la realización de proyectos que impliquen el ahorro y uso eficiente de energía en los ámbitos estatal y municipal.\ne) Fomentar la capacitación de recursos humanos en las materias relacionadas con la educación, investigación, desarrollo tecnológico y aplicación de medidas de ahorro y uso eficiente de la energía.\n2. OBJETIVOS PARTICULARES\na) Fomentar y asesorar a las dependencias del gobierno del estado y gobiernos municipales para lograr el ahorro y uso eficiente de la energía en los edificios públicos, en los sistemas de servicios municipales y llevar a cabo acciones que se refieran al reemplazo y rehabilitación de componentes del sistema de alumbrado público y bombeo de agua para uso doméstico.\nb) Participar en el diseño de sistemas de información geográfica y en la planeación, integral para el aprovecha-miento de los recursos energéticos del estado de guerrero, allegándose las herramientas que le permitan identificar y analizar las mejores áreas de oportunidad.\n3. COBERTURA\nEn el seno del Comité Estatal de Energía, \"LA CONAE\" y \"EL ESTADO\" coordinarán sus acciones para instrumentar \"EL PROGRAMA\" en el Estado de Guerrero, características y particularidades geográficas y socioeconómicas.\nAHORRO Y APROVECHAMIENTO DE ENERGÍA\nELÉCTRICA, QUE CELEBRAN EL EJECUTIVO\nFEDERAL, POR CONDUCTO DE LA SECRETARÍA\nDE ENERGÍA Y EL EJECUTIVO ESTATAL\n4. GRUPOS DE TRABAJO\nLas partes podrán establecer grupos de trabajo, integrados por personal técnico especializado de los diversos sectores, para difundir estrategias y programas específicos por sector y ámbito geográfico.\n5. UTILIZACIÓN DE RESULTADOS\nLos documentos obtenidos en \"EL PROGRAMA\" objeto del presente Acuerdo, y todos aquellos que resulten de la participación conjunta de las partes, que puedan ser usados para fines académicos o de promoción social, estarán a disposición de las mismas, y compartirán créditos en todos ellos, autorizándose el uso respectivo de los logotipos de las partes. En caso de que los resultados se pretendan comercializar o usar con otros fines, las partes lo acordarán en un convenio por separado cuyas disposiciones no podrán ser contradictorias a lo dispuesto en el presente Acuerdo de Coordinación.\n6. MATERIAS DE COORDINACIÓN\nDe manera enunciativa más no limitativa y en el marco de trabajo del Comité\nEstatal de Energía, las partes señalan como materias de coordinación, las siguientes:\na) Diseñar y establecer las estrategias de promoción y difusión, para fomentar la estado, tanto en sus Municipios y en el Sector Industrial;\nb) Asesorar a los interesados en la obtención y aplicación de fondos provenientes de fuentes de financiamiento relativas al ahorro y uso eficiente de la energía;\nc) Asesorar a los sectores interesados, respecto de la aplicación de esquemas integrales de ahorro de energía, con la finalidad de inducirlos a una mejora sustancial en sus actividades, proyectos y programas al interior de sus instalaciones;\nAHORRO Y APROVECHAMIENTO DE ENERGÍA\nELÉCTRICA, QUE CELEBRAN EL EJECUTIVO\nFEDERAL, POR CONDUCTO DE LA SECRETARÍA\nDE ENERGÍA Y EL EJECUTIVO ESTATAL\nd) Asesorar a consultores locales, interesados en desarrollar acciones y proyectos sobre ahorro y uso eficiente de la energía, con base en los lineamientos de \"LA CONAE\";\ne) Recomendar líneas de acción, basadas en proyectos demostrativos y en experiencias de las propias empresas; y\nf) Desarrollar la capacitación de recursos humanos especializados, mediante la participación de instituciones de educación superior y asociaciones de profesionistas locales, para el fomento de una cultura de eficiencia energética.\ng) El impulso en la celebración de convenios de apoyos y coordinación institucional, para ampliar y mejorar la infraestructura eléctrica de distribución.\nh) La promoción de proyectos de cogeneración, producción independiente y autoabastecimiento y la ejecución de proyectos demostrativos en energía renovables.\nTERCERA.- DE LOS COMPROMISOS Y ATRIBUCIONES\n1. En el contexto del presente Acuerdo de Coordinación y conforme a las atribuciones otorgadas en su decreto de creación, \"LA CONAE\" podrá:\na) Promover la realización de proyectos de ahorro y uso eficiente de la energía a través de cursos de capacitación al Estado de Guerrero, sus municipios y organismos operadores de servicio;\nb) Elaborar los estudios de prefactibilidad de inversión en proyectos de ahorro de energía eléctrica en los rubros de alumbrado público, iluminación en inmuebles y bombeo de agua, con base en la información establecida en las metodologías correspondientes.\nc) Revisar y validar los estudios técnico-económico de ahorro de energía eléctrica elaborados, en su caso, por empresas de consultoría al Estado y los municipios en los rubros de alumbrado público, iluminación en inmuebles y bombeo de agua;\nAHORRO Y APROVECHAMIENTO DE ENERGÍA\nELÉCTRICA, QUE CELEBRAN EL EJECUTIVO\nFEDERAL, POR CONDUCTO DE LA SECRETARÍA\nDE ENERGÍA Y EL EJECUTIVO ESTATAL\nd) Promover y apoyar la investigación científica y tecnológica en materia de ahorro y uso eficiente de energía, así como del aprovechamiento de energías renovables;\ne) Promover, gestionar y, en su caso, apoyar las actividades tendientes a obtener y aplicar los fondos provenientes de fuentes de financiamiento públicas y privadas, para la implementación de acciones para el ahorro y uso eficiente de la energía;\nf) Facilitar, conforme a las bases establecidas, la participación de consultores y empresas especializadas en la realización de las acciones para fomentar la eficiencia en el uso de energía;\ng) Prestar servicios técnicos, de asesoría y otros en materia de ahorro y uso eficiente de energía y aprovechamiento de energías renovables; e\nh) Integrar, analizar y, en su caso, difundir la in-formación sobre ahorro y uso eficiente de energía, que proporcionen, de conformidad con las disposiciones legales aplicables.\n2. En el contexto del presente Acuerdo de Coordinación, \"EL ESTADO\", por conducto del Comité Estatal de Energía, conforme al Acuerdo Administrativo de su creación, tendrá las siguientes atribuciones:\na) Proponer programas de modernización en materia de energía, acorde a las necesidades de cada municipio;\nb) Dar seguimiento y evaluar las acciones concertadas;\nc) Asesorar y capacitar a los municipios sobre los programas y proyectos de energía que elabore el Comité;\nAHORRO Y APROVECHAMIENTO DE ENERGÍA\nELÉCTRICA, QUE CELEBRAN EL EJECUTIVO\nFEDERAL, POR CONDUCTO DE LA SECRETARÍA\nDE ENERGÍA Y EL EJECUTIVO ESTATAL\nd) Promover cursos y talleres en materia de tarifas, leyes y reglamentos del sector eléctrico y de programas de ahorro y uso eficiente de la energía;\ne) Celebrar convenios de apoyo y coordinación institucional, para ampliar y mejorar la infraestructura de distribución eléctrica;\nf) Desarrollar diagnósticos y proyectos de eficiencia en sistemas de bombeo de agua potable y riego en los municipios;\ng) Actuar como promotores de proyectos de cogeneración, producción independiente y autoabastecimiento y la ejecución de proyectos demostrativos en energía renovables;\nh) Fomentar el ahorro y uso eficiente de energía en los edificios públicos del orden Estatal y Municipal;\ni) Levantar y analizar censos municipales del servicio de alumbrado público y verificación de facturas emitidas por la Comisión Federal de Electricidad, cuando existan discrepancias con el gobierno municipal, a petición de parte; y\nj) Elaborar proyectos, diagnósticos y programas de ahorro y modernización en los sistemas de alumbrado público de los municipios.\nCUARTA.- Todas las acciones previstas en el Acuerdo de Coordinación serán cumplidas, en su caso, con cargo a la parte que los realice, sin obligación alguna de reembolsar cantidad alguna a la otra parte.\nQUINTA.- Cada una de las partes será la única responsable de las obligaciones legales en materia de trabajo y seguridad social, o bien en materia de prestación de servicios profesionales, respecto del personal que contraten para la realización de las acciones derivadas del presente acuerdo, en el entendido de que en ningún caso podrá una parte ser considerada como patrón sustituto del personal de la otra.\nAHORRO Y APROVECHAMIENTO DE ENERGÍA\nELÉCTRICA, QUE CELEBRAN EL EJECUTIVO\nFEDERAL, POR CONDUCTO DE LA SECRETARÍA\nDE ENERGÍA Y EL EJECUTIVO ESTATAL\nSEXTA.- La mecánica para ejecutar acciones de coordinación conforme a las bases aquí establecidas será el acuerdo mutuo entre las partes, y la confirmación escrita de los respectivos compromisos, debiendo realizar juntas periódicas por lo menos una vez cada tres meses.\nSÉPTIMA.- Cada una de las partes dará seguimiento a la ejecución de las acciones de coordinación mediante la designación de uno o dos representantes autorizados, mismos que a continuación se mencionan, indicando sus respectivos domicilios y teléfonos:\n\"LA CONAE\" a través del Doctor Jorge Wolpert Kuri, Coordinador de Promoción y\nProgramas Regionales de la Comisión Nacional para el Ahorro de Energía, con domicilio en Río Lerma número 302, Piso 5, Colonia Cuauhtémoc, C.P. 06500 de la Ciudad de\nMéxico, Distrito Federal, y los siguientes números telefónicos: 3000-1007 y fax 3000-\n1003.\n\"EL ESTADO\", a través del Licenciado Humberto Sarmiento Luebbert y del\nArquitecto Ángel Pérez Palacios, Coordinador General del Ejecutivo Estatal y del Comité de Planeación para el Desarrollo del Estado de Guerrero y Coordinador General de\nFortalecimiento Municipal, respectivamente, con domicilio en Palacio de Gobierno, Boulevard Lic. Rene Juárez Cisneros número 62, 2º piso, Edificio Región Centro, Ciudad de los Servicios, C.P. 39075, Chilpancingo, Guerrero y los siguientes números telefónicos: 747 4719877 y 747 4719826, el primero de los mencionados, y el segundo, en Calle Amado Nervo Nº 1, Colonia Centro, de ésta ciudad capital, con números telefónicos 747 4711823 y 747 4710948.\nLas acciones de coordinación que requieran, a juicio de las partes, una planeación y programación de mayor detalle, serán objeto de acuerdos específicos dentro del marco de estas bases generales.\nOCTAVA.- Las partes convienen en que el presente Acuerdo de Coordinación entrará en vigor a partir de su firma hasta el 31 de Marzo del 2011 y podrá darse por\nAHORRO Y APROVECHAMIENTO DE ENERGÍA\nELÉCTRICA, QUE CELEBRAN EL EJECUTIVO\nFEDERAL, POR CONDUCTO DE LA SECRETARÍA\nDE ENERGÍA Y EL EJECUTIVO ESTATAL terminado previo aviso por escrito enviado a la otra parte, con treinta días naturales de anticipación. Asimismo, el presente Acuerdo podrá ser adicionado o modificado de común acuerdo por las partes, y de conformidad con lo establecido en los preceptos y lineamientos que lo originan.\nNOVENA.- El presente Acuerdo de Coordinación, sus modificaciones o terminación deberán publicarse en el Diario Oficial de la Federación y en el Periódico\nOficial del Gobierno del Estado de Guerrero.\nLeído el presente acuerdo y enteradas las partes de su contenido y fuerza legal, lo firman en tres ejemplares, en la ciudad y puerto de Acapulco de Juárez, a los 27 días del mes de Julio del 2007.\nPOR \"LA CONAE\"\nDR. JUAN CRISTOBAL MATA SANDOVAL\nDIRECTOR GENERAL\nRúbrica.\nDR. JORGE WOLPERT KURI\nPOR \"EL ESTADO\"\nC. P. CARLOS ZEFERINO TORRE-BLANCA GALINDO\nDEL COMITÉ ESTATAL DE ENERGÍA\nLIC. ARMANDO CHAVARRÍA BARRERA.\nSECRETARIO GENERAL DE GOBIERNO.\nAHORRO Y APROVECHAMIENTO DE ENERGÍA\nELÉCTRICA, QUE CELEBRAN EL EJECUTIVO\nFEDERAL, POR CONDUCTO DE LA SECRETARÍA\nDE ENERGÍA Y EL EJECUTIVO ESTATAL\nLIC. HUMBERTO SARMIENTO LUEBBERT\nDE PLANEACION PARA EL DESARROLLO DEL ESTADO DE GUERRERO.\nARQ. ÁNGEL PEREZ PALACIOS",
  "ordenamiento": "ACUERDO",
  "jurisdiccion": "GUERRERO",
  "fuente_oficial": "DIARIO OFICIAL DE LA FEDERACION",
  "Fecha de Publicación": "21 de Agosto de 2007",
  "ULTIMA REFORMA PUBLICADA": "21 de Agosto de 2007",
  "status": "ABROGADA",
  "es_escaneado": false,
  "tiene_tablas": false,
  "materia": [
    "general"
  ]
}