{
  "titulo": "Acuerdo del C. Procurador General de Justicia del Estado de Guerrero, por el Que Se Crea la Unidad E",
  "Contenido": "INVESTIGACIÓN Y COMBATE AL DELITO DE\nSECUESTRO, DENOMINADA “FUERZA ANTISECUESTRO” (F.A.S.)\nTEXTO ORIGINAL.\nI, el Viernes 14 de Agosto de 2009.\nACUERDO DEL C. PROCURADOR GENERAL DE JUSTICIA DEL ESTADO DE\nGUERRERO, POR EL QUE SE CREA LA UNIDAD ESPECIALIZADA EN\nINVESTIGACIÓN Y COMBATE AL DELITO DE SECUESTRO, DENOMINADA\n\"FUERZA ANTI-SECUESTRO\"(F.A.S.).\nAl margen un sello con el Escudo Nacional que dice: \"PROCURADURÍA\nGENERAL DE JUSTICIA DEL ESTADO.CHILPANCINGO,GRO.\".\nEL LICENCIADO EDUARDO MURUETA URRUTIA, Procurador General de\nJusticia del Estado de Guerrero, en ejercicio de las facultades que me confieren los artículos 21 de la Constitución Política de los Estados Unidos Mexicanos; 78 párrafo uno de la Constitución Política Local; 10, 11 y 29 fracción X de la Ley Orgánica de la\nProcuraduría; 35 fracción I de la Ley Orgánica de la Administración Pública del Estado, así como 5, 8 y 11 fracción I del Reglamento de la Ley Orgánica de la Procuraduría\nGeneral de Justicia; y\nQue en el Plan Sexenal del Gobierno (2005-2011), se establece el interés que eficaz procuración de justicia, reflejada en la capacidad de la institución encargada de esta elevada responsabilidad, para anular los efectos del fenómeno de la delincuencia, así como resolver con oportunidad y acierto los asuntos que, en particular, fuesen de su que la sociedad se desarrolle en un ambiente de paz, tranquilidad y armonía.\nQue corresponde a la Procuraduría General de Justicia del Estado de Guerrero, a través del Ministerio Público, y por imperativo del nominativo 21 de la Constitución\nPolítica de los Estados Unidos Mexicanos, la investigación y persecución de los delitos,\nINVESTIGACIÓN Y COMBATE AL DELITO DE\nSECUESTRO, DENOMINADA “FUERZA ANTISECUESTRO” (F.A.S.) debiendo prestar sus servicios de acuerdo con los principios de legalidad, objetividad, eficiencia, profesionalismo, honradez y respeto a los derechos humanos.\nQue en la XXIII Sesión Ordinaria del Consejo Nacional de Seguridad Pública celebrada el 21 de agosto del 2008, se suscribió el \"Acuerdo Nacional por la Seguridad, la Justicia y la Legalidad\" entre los tres Poderes de la Unión, los tres órdenes de\nGobierno que conforman el Estado Mexicano, en armonía con los sectores privado y social. Por ende, con la presente resolución el C.P. Zeferino Torreblanca Galindo, Gobernador Constitucional de Guerrero, cumple el compromiso referido en la fracción\nXLVIII del numeral 5 del citado Acuerdo Nacional, que toralmente expone: \"...los titulares de los ejecutivos de las entidades federativas se comprometen a crear unidades integradas a través de la aplicación de mecanismos de evaluación y control de confianza certificados, para desarticular bandas dedicadas al secuestro, y a adscribir un enlace permanente en la Unidad de Coordinación e Intercambio de Información Policial de la\nSecretaría de Seguridad Pública.\".\nQue es necesario implementar nuevas políticas, funciones, facultades, competencias, estrategias, actividades y acciones contra quienes quebranten gravemente la tranquilidad de los habitantes de esta entidad federativa, sobre todo en los delitos en que el bien jurídico a proteger sea el de la libertad personal.\nQue ante la necesidad de mejorar la seguridad pública, y concretamente la procuración de justicia, se deben de tomar medidas determinantes e inmediatas. permitan la profesionalización, la dotación de los equipos tecnológicos avanzados y la delictivos.\nQue en las últimas fechas, se han acrecentado las conductas antisociales de privación ilegal de la libertad en su modalidad de secuestro, acciones que conculcan gravemente la conciencia colectiva; por lo que tenemos que tomar medidas taxativas para contrarrestar estos ilícitos.\nINVESTIGACIÓN Y COMBATE AL DELITO DE\nSECUESTRO, DENOMINADA “FUERZA ANTISECUESTRO” (F.A.S.)\nQue con frecuencia, la tecnología aplicada a la telefonía es utilizada como medio comisivo para ejercer cualquier tipo de violencia con la intención de obtener un lucro, quebrantando la tranquilidad y la estabilidad de las personas mediante la extorsión telefónica.\nPor lo anterior, tengo a bien expedir el siguiente:\nACUERDO DEL C. PROCURADOR GENERAL DE JUSTICIA DEL ESTADO DE\nGUERRERO, POR EL QUE SE CREA LA UNIDAD ESPECIALIZADA EN\nINVESTIGACIÓN Y COMBATE AL DELITO DE SECUESTRO, DENOMINADA\n\"FUERZA ANTI-SECUESTRO\"(F.A.S.).\nARTÍCULO PRIMERO.- Se crea la Unidad Especializada en Investigación y\nCombate al Delito de Secuestro, denominada \"Fuerza Anti-secuestro\" (F.A.S.), adscrita administrativamente a la Subprocuraduría de Control Regional y Procedimientos\nPenales, con directa coordinación, por cuanto hace a la definición de estrategias y rendición de informes, con el C. Procurador.\nARTÍCULO SEGUNDO.- La F.A.S. estará integrada por las siguientes áreas:\nI.- Agencia del Ministerio Público, cuyo Titular será el jefe de:\nII.- Las Dependencias necesarias, entre las que deberán estar:\na).- De Control de Crisis y Negociación;\nb).- De Análisis Táctico;\nc).- De Intervención Operativa Inmediata;\nd).- De Investigación de Campo.\nDichas áreas estarán integradas con personal: policial, pericial, agentes del\nMinisterio Público y administrativo, que permita el erario público.\nINVESTIGACIÓN Y COMBATE AL DELITO DE\nSECUESTRO, DENOMINADA “FUERZA ANTISECUESTRO” (F.A.S.)\nARTÍCULO TERCERO.- La F.A.S. tendrá las siguientes atribuciones:\nI.- Proponer y en su caso ejecutar, políticas públicas en materia de prevención y combate al secuestro.\nII.- Coordinarse con las instituciones del Gobierno Federal, del Distrito Federal y/o las de los Estados, cuando la causa lo amerite.\nIII.- Requerir información relevante sobre la incidencia del delito de secuestro a las dependencias de esta Procuraduría que cuente con ella, así como las de sus homólogas en la República Mexicana.\nEl registro de esta información será sistemático y meticuloso, con la finalidad de contar con una base de datos que permita eficientar sus funciones.\nARTÍCULO CUARTO.- La F.A.S. tendrá competencia para:\nI.- Recibir toda denuncia, querella, noticia o cualquier aviso telefónico, telegráfico, electrónico, etc., que tenga relación con hechos posiblemente constitutivos al secuestro y/o delitos conexos que resulten de este mismo hecho delictivo;\nII.- Investigar el secuestro y los demás delitos que en concurso resulten de este mismo hecho delictivo, con el auxilio de la Policía Ministerial, los Servicios Periciales, demás unidades administrativas a su cargo y otras autoridades competentes, en los términos de las disposiciones legales aplicables; practicando las diligencias necesarias quiénes en él hubieren intervenido, así como determinar el monto de los daños y perjuicios causados;\nIII.- Proponer, en su caso, el no ejercicio de la acción penal, por considerar no responsabilidad del imputado;\nINVESTIGACIÓN Y COMBATE AL DELITO DE\nSECUESTRO, DENOMINADA “FUERZA ANTISECUESTRO” (F.A.S.)\nIV.- Restituir de inmediato y provisionalmente al ofendido en el goce de sus derechos, en los términos de las disposiciones jurídicas aplicables;\nV.- Decretar la detención o la retención de los probables responsables de la comisión del secuestro y los delitos que en concurso resulten de este mismo hecho delictivo, en los términos previstos por el artículo 16 de la Constitución Política de los\nEstados Unidos Mexicanos;\nVI.- Solicitar las medidas precautorias de arraigo y las órdenes de cateo que sean necesarias, conforme a lo dispuesto en la Constitución Federal y demás leyes aplicables;\nVII.- Instruir a los Agentes de la Policía Ministerial y a los Peritos que le estén adscritos, respecto a los elementos o indicios que deban ser investigados o recabados, así como de otras acciones de investigación que fueren necesarias para establecer que se ha cometido ese hecho criminal y/o que exista la probabilidad de que el indiciado lo realizó o participó en la comisión del secuestro y/o demás delitos que en concurso resulten de este mismo hecho delictivo;\nVIII.- Asegurar los bienes, instrumentos, huellas objetos, vestigios o productos relacionados con los hechos delictivos, en los casos que corresponda, para ponerlos a disposición del órgano competente;\nIX.- Recabar de las dependencias y entidades de la Administración Pública\nFederal y del Distrito Federal, así como de los Estados y Municipios de la República, en los términos de las disposiciones aplicables, los informes, documentos, opiniones y sobre el delito de secuestro;\nX.- Requerir informes y documentos de los particulares para el ejercicio de sus atribuciones relacionados con el objeto de esta Unidad;\nXI.- Auxiliar al Ministerio Público Federal y al de las entidades federativas en los términos que determinen las disposiciones jurídicas aplicables;\nINVESTIGACIÓN Y COMBATE AL DELITO DE\nSECUESTRO, DENOMINADA “FUERZA ANTISECUESTRO” (F.A.S.)\nXII.- Solicitar al Ministerio Público Federal o de las entidades federativas, el auxilio o colaboración para la práctica de diligencias en la Averiguación Previa, de conformidad con el artículo 119 de la Constitución Política de los Estados Unidos Mexicanos, en las demás disposiciones aplicables y en los convenios de colaboración que suscriban las respectivas Procuradurías;\nXIII.- Remitir a las autoridades competentes copia autorizada de las\nAveriguaciones Previas que se relacionen con menores o incapaces que se encuentren en situación de daño, peligro o conflicto, cuando se refiera a los delitos contra menores o incapaces;\nXIV.- Remitir a las autoridades correspondientes las investigaciones de los delitos que no sean de su incumbencia;\nXV.- Solicitar el aseguramiento precautorio de bienes, para los efectos del pago de la reparación de los daños y perjuicios;\nXVI.- Ejercitar la Acción Penal por secuestro y/o de los demás delitos que en concurso resulten de este mismo hecho delictivo, formulando a la autoridad judicial competente los pedimentos que legalmente correspondan;\nXVII.- Realizar las demás actividades previstas en el artículo 14 de la Ley\nOrgánica de la Procuraduría General de Justicia, y\nXVIII.- Las consagradas de inmediato en otras leyes u ordenamientos jurídicos.\nARTÍCULO QUINTO.- El Instituto de Formación Profesional de esta Procuraduría, en coordinación con la Subprocuraduría Jurídica y de Atención a Víctimas del Delito, será operativo de la F.A.S. en torno a los ejes temáticos: jurídico penal y política criminal, control de crisis y negociación, análisis táctico, servicios periciales, investigación de campo, e intervención operativa inmediata.\nINVESTIGACIÓN Y COMBATE AL DELITO DE\nSECUESTRO, DENOMINADA “FUERZA ANTISECUESTRO” (F.A.S.)\nAsimismo, el mencionado Instituto, realizará las evaluaciones al personal que ingrese a la F.A.S., conforme a los estándares implementados para el Control de\nConfianza al jaez del Acuerdo Nacional por la Seguridad, la Justicia y la Legalidad, publicado en el Diario Oficial de la Federación el 28 de agosto del 2008, en consonancia con lo que establece la Ley General del Sistema Nacional de Seguridad Pública.\nARTÍCULO SEXTO.- En todo lo aplicable se observará lo establecido en los\nProtocolos del Delito de Secuestro, así como de Atención a la Víctima de Secuestro en la\nAveriguación Previa, instrumentos aprobados por la Asamblea Plenaria de la Conferencia\nNacional de Procuración de Justicia en sesión extraordinaria de 11 de septiembre de\n2008, celebrada en Chihuahua, Chi.\nARTÍCULO SÉPTIMO.- Cualquier Agencia Investigadora del Ministerio Público podrá recibir las denuncias por secuestro y delitos conexos con este hecho delictivo, institución que en su caso, practicará las diligencias urgentes, brindará la atención necesaria a las víctimas, y oportunamente remitirá las actuaciones desahogadas a la\nF.A.S.\nARTÍCULOS TRANSITORIOS\nPRIMERO.- Publíquese en el Periódico Oficial del Gobierno del Estado.\nSEGUNDO.- El presente Acuerdo entrará en vigor al día siguiente de su publicación en el Periódico Oficial del Estado.\nTERCERO.- Desde la entrada en vigor del presente Acuerdo, los\nSubprocuradores instruirán a los Agentes del Ministerio Público, para el efecto de que turnen a la F.A.S., las nuevas Averiguaciones Previas o Constancias de Hechos, relativas al secuestro y de los delitos relacionados con este hecho infausto penal.\nCUARTO.- Se instruye a la Dirección General de Presupuesto y Administración de esta Procuraduría, para que gestione y proporciones los recursos económicos necesarios, equipo e instalaciones para el funcionamiento efectivo de la F.A.S. a que se refiere el presente Acuerdo.\nINVESTIGACIÓN Y COMBATE AL DELITO DE\nSECUESTRO, DENOMINADA “FUERZA ANTISECUESTRO” (F.A.S.)\nQUINTO.- La F.A.S. iniciarán sus actividades en un término no mayor a 45 días hábiles posteriores a la entrada en vigor de este Acuerdo.\nChilpancingo de los Bravo, Guerrero, agosto 13, 2009.\nATENTAMENTE:\n\"2009, AÑO DE LA REFORMA LIBERAL\".\nEL PROCURADOR GENERAL DE JUSTICIA DEL ESTADO.\nLIC. EDUARDO MURUETA URRUTIA.\nRúbrica.",
  "ordenamiento": "ACUERDO",
  "jurisdiccion": "GUERRERO",
  "fuente_oficial": "DIARIO OFICIAL DE LA FEDERACION",
  "Fecha de Publicación": "14 de Agosto de 2009",
  "ULTIMA REFORMA PUBLICADA": null,
  "status": "VIGENTE",
  "es_escaneado": false,
  "tiene_tablas": false,
  "materia": [
    "judicial"
  ]
}