{
  "titulo": "Acuerdo por el Que Se Delega al Director General de Acciones Prioritarias, la Facultad de Firmar en",
  "Contenido": "TITULAR DE LA SECRETARÍA DE DESARROLLO\nSOCIAL, LAS ACTAS DE DONACIÓN, LAS PÓLIZAS Y\nRECIBOS DE EGRESOS, DEL PROGRAMA DE\nACCIONES PRIORITARIAS, CORRESPONDIENTES AL\nEJERCICIO FISCAL 2012\nTEXTO ORIGINAL\nAcuerdo publicado en el Periódico Oficial del Gobierno del Estado No. 96, el Viernes 30 de\nNoviembre de 2012.\nACUERDO POR EL QUE SE DELEGA AL DIRECTOR GENERAL DE ACCIONES PRIORITARIAS, LA\nFACULTAD DE FIRMAR EN AUSENCIA DE LA TITULAR DE LA SECRETARÍA DE DESARROLLO\nSOCIAL, LAS ACTAS DE DONACIÓN, LAS PÓLIZAS Y RECIBOS DE EGRESOS, DEL PROGRAMA\nDE ACCIONES PRIORITARIAS, CORRESPONDIENTES AL EJERCICIO FISCAL 2012.\nMtra. Beatriz Mojica Morga, Secretaria de Desarrollo Social, con fundamento en los artículos\n1o, 10, 11, 18 fracción II y 21 la Ley Orgánica de la Administración Pública del Estado de Guerrero; 2o fracción I, 62, 68 y 99 de la Ley de Presupuesto y Disciplina Fiscal del Estado de Guerrero; y\nQue de conformidad con lo establecido en la Ley Orgánica de la Administración Pública del\nEstado Número 433, la Secretaría de Desarrollo Social como parte integrante de la Administración\nPública Centralizada, cuenta con los recursos etiquetados en el Decreto Número 981 de Presupuesto de\nEgresos del Estado de Guerrero para el Ejercicio Fiscal 2012, mimos que permitirán el desarrollo de la política social que el Gobierno del Estado tiene destinado de acuerdo al Plan Estatal de Desarrollo 2011 -\n2015.\nQue el Presupuesto de Egresos para el Ejercicio Fiscal 2012, contempla los montos de inversión por Programas y Proyectos de acuerdo a las acciones, objetivos y estrategias contempladas en este cuerpo normativo, para que la Administración Pública del Estado, se enfoque en los alcances proyectados en beneficio de la ciudadanía.\nQue el Gasto Público comprende la administración y aplicación de los recursos que realicen las autorizados, observando los principios de responsabilidad, eficiencia, transparencia, economía, racionalidad, control, equidad de género, impacto social y rendición de cuentas.\nQue en atención a lo señalado por los artículos 2o fracción I, 62, 68 y 99 de la Ley Número 454 de Presupuesto y Disciplina Fiscal del Estado de Guerrero; los funcionarios autorizados para ejercer el\nGasto Público, tienen facultades suficientes para realizar los trámites presupuestarios correspondientes, de los trabajos, acciones y recursos de los proyectos que impulsaran el desarrollo comunitario en los\nMunicipios del Estado de Guerrero.\nTITULAR DE LA SECRETARÍA DE DESARROLLO\nSOCIAL, LAS ACTAS DE DONACIÓN, LAS PÓLIZAS Y\nRECIBOS DE EGRESOS, DEL PROGRAMA DE\nACCIONES PRIORITARIAS, CORRESPONDIENTES AL\nEJERCICIO FISCAL 2012\nQue los titulares de las Dependencias y Entidades del Estado, en el ejercicio de su presupuesto, serán los responsables de su exacta aplicación, del cumplimiento de los programas y de sus recursos asignados, así como de la eficiencia y eficacia con que se ejecuten, debiendo integrar los informes de los avances programático presupuestales dentro de los periodos establecidos para la integración de la comprobación respectiva.\nQue con la finalidad de garantizar la calidad, oportunidad y transparencia en la información financiera que esta Secretaría lleva a cabo con motivo del ejercicio de los recursos autorizados en los diversos programas, específicamente en el Programa de Acciones Prioritarias, y con atención a las facultades y atribuciones establecidas por la Ley Orgánica de la Administración Pública del Estado\nNúmero 433, la cual establece la facultad de los titulares de las dependencias de poder delegar facultades a sus subalternos;\nPor lo anteriormente expuesto se expide el siguiente:\nACUERDO POR EL QUE SE DELEGA AL DIRECTOR GENERAL DE ACCIONES PRIORITARIAS, LA\nFACULTAD DE FIRMAR EN AUSENCIA DE LA TITULAR DE LA SECRETARÍA DE DESARROLLO\nSOCIAL, LAS ACTAS DE DONACIÓN, LAS PÓLIZAS Y RECIBOS DE EGRESOS, DEL PROGRAMA\nDE ACCIONES PRIORITARIAS, CORRESPONDIENTES AL EJERCICIO FISCAL 2012.\nArtículo Primero. Se delega la facultad de firmar en ausencia de la titular de la Secretaría de\nDesarrollo Social, los documentos correspondientes a las Actas de Donación, las Pólizas y Recibos de\nEgresos, del Programa de Acciones Prioritarias, para el Ejercicio Fiscal 2012, al Director General de\nAcciones Prioritarias.\nArtículo Segundo. La Secretaria de Desarrollo Social del Estado, reconoce que la aplicación de los recursos se encuentra supeditados a lo establecido en la Ley Número 454 de Presupuesto y\nDisciplina Fiscal; Ley Número 674 de Responsabilidades de los Servidores Públicos del Estado; y en la demás normatividad aplicable.\nTRANSITORIOS\nPrimero. El presente acuerdo entrara en vigor al día siguiente de su publicación en el Periódico conocimiento general y efectos legales conducentes. Dado en la Ciudad de Chilpancingo de los Bravo, Capital del estado de Guerrero, a los Treinta días del mes de Julio del año dos mil doce.\nTITULAR DE LA SECRETARÍA DE DESARROLLO\nSOCIAL, LAS ACTAS DE DONACIÓN, LAS PÓLIZAS Y\nRECIBOS DE EGRESOS, DEL PROGRAMA DE\nACCIONES PRIORITARIAS, CORRESPONDIENTES AL\nEJERCICIO FISCAL 2012\nMTRA. BEATRIZ MOJICA MORGA.\nRúbrica.",
  "ordenamiento": "ACUERDO",
  "jurisdiccion": "GUERRERO",
  "fuente_oficial": "DIARIO OFICIAL DE LA FEDERACION",
  "Fecha de Publicación": "30 de \nNoviembre de 2012",
  "ULTIMA REFORMA PUBLICADA": null,
  "status": "VIGENTE",
  "es_escaneado": false,
  "tiene_tablas": false,
  "materia": [
    "general"
  ]
}