{
  "titulo": "Acuerdo por el Que Se Decreta la Veda Sanitaria Temporal Consistente en la Prohibición de la Captura",
  "Contenido": "COMERCIALIZACIÓN Y CONSUMO DE\nMOLUSCOS BIVALVOS (OSTIONES, ALMEJAS,\nMEJILLONES, CALLO MARGARITA, CALLO DE\nHACHA, CONCHA PERLA, ABULÓN, CALLO DE\nGARRA DE LEÓN)\nTEXTO ORIGINAL\nAcuerdo publicado en el Periódico Oficial del Gobierno del Estado No. 67, el\nViernes 20 de Agosto de 2010.\nACUERDO POR EL QUE SE DECRETA LA VEDA SANITARIA TEMPORAL\nCONSISTENTE EN LA PROHIBICIÓN DE LA CAPTURA, COMERCIALIZACIÓN Y\nCONSUMO DE MOLUSCOS BIVALVOS (OSTIONES, ALMEJAS, MEJILLONES,\nCALLO MARGARITA, CALLO DE HACHA, CONCHA PERLA, ABULÓN, CALLO DE\nGARRA DE LEÓN).\nEn la Ciudad y Puerto de Acapulco Gro, el día 08 de julio del año 2010, se reúne con carácter extraordinario el Comité Estatal Interinstitucional de Sanidad de Moluscos\nBivalvos y otros moluscos expuestos a Florecimientos Algales nocivos. Y acuerda decretar la Veda Sanitaria Temporal de Moluscos Bivalvos (Ostiones, almejas, mejillones, callo margarita, callo de hacha, concha perla, abulón, callo de garra de león).\n\"Consistente en la prohibición temporal de la captura, comercialización y consumo de moluscos bivalvos de consumo humano procedentes del Litoral del Estado de\nGuerrero; zona afectada por la proliferación de algas nocivas, a efecto de proteger la salud de la población. Se considera una medida de seguridad para evitar que se causen en los artículos 404 fracciones VII y XII, y, 411 de la Ley General de Salud\".\nAcción tomada en base a la evidencia de la proliferación a partir del día 7 de Julio de 2010, de algas microscópicas de la especie Pyrodinium bahamense variedad compreseum, productora de toxinas paralizantes del grupo de las saxitoxinas.\nPor ello, se establecen los acuerdos siguientes:\nI.- Se difundirá en los Hospitales, Clínicas y Consultorios médicos del sector público, social y privado una ALERTA SANITARIA que indicará la sintomatología\nCOMERCIALIZACIÓN Y CONSUMO DE\nMOLUSCOS BIVALVOS (OSTIONES, ALMEJAS,\nMEJILLONES, CALLO MARGARITA, CALLO DE\nHACHA, CONCHA PERLA, ABULÓN, CALLO DE\nGARRA DE LEÓN) presentada por intoxicación por la ingesta de moluscos bivalvos contaminados por esta clase de toxinas.\nII.- Se elaborará una comunicado de prensa explícito, indicando las especies que se pueden consumir (pescados, pulpo, camarón, langosta, lagostino, caracol) y que no representan un riesgo para la población consumidora.\nIII.- Se establecerá un programa intensivo de monitoreo de moluscos bivalvos por parte de la Secretaría de Salud durante y después de la veda temporal decretada, hasta que se obtengan resultados dentro de los límites máximos permisibles.\nIV.- Se llevará a cabo la vigilancia de los inventarios de zonas de extracción de moluscos bivalvos, para evitar la violación de la veda. Cuando se comercialice producto procedente de zonas exentas de veda, los introductores solicitarán la emisión de un certificado de inocuidad ante las Coordinaciones Regionales de Regulación Sanitaria, previo análisis del producto en el Laboratorio Estatal.\nV.- Se exhorta a los Presidentes de las Sociedades Pesqueras de Acapulco, Costa Chica y Costa Grande, a ser portavoces de la veda decretada para los moluscos bivalvos.\nPARTICIPANTES:\nDR. SAÚL LÓPEZ SILVA.\nSUBSECRETARIO DE REG. CONTROL Y FOMENTO SANITARIO.\nM. EN C. ZORAIDA LAGUNAS SANTAMARÍA.\nCOFEPRIS.\nCOMERCIALIZACIÓN Y CONSUMO DE\nMOLUSCOS BIVALVOS (OSTIONES, ALMEJAS,\nMEJILLONES, CALLO MARGARITA, CALLO DE\nHACHA, CONCHA PERLA, ABULÓN, CALLO DE\nGARRA DE LEÓN)\nBIÓLOGO VICTOR A. ZAMORA DOMINGUEZ.\nSAGARPA.\nRúbrica.\nQBP- MANUEL CASTILLO DE LA ROSA.\nCOORDINADOR REGIÓN 06.\nPROFR. DANIEL VEGA VILLANUEVA.\nSEMARNAT.\nQBP. ANA YADIRA GALLO SALGADO.\nPROTECCIÓN CIVIL.",
  "ordenamiento": "ACUERDO",
  "jurisdiccion": "GUERRERO",
  "fuente_oficial": "DIARIO OFICIAL DE LA FEDERACION",
  "Fecha de Publicación": "20 de Agosto de 2010",
  "ULTIMA REFORMA PUBLICADA": null,
  "status": "VIGENTE",
  "es_escaneado": false,
  "tiene_tablas": false,
  "materia": [
    "salud"
  ]
}