{
  "titulo": "Acuerdo por el Que Se Concede Un Plazo Adicional para la Presentación de Aviso por Parte de los Cont",
  "Contenido": "OBLIGADOS O QUE OPTEN A DICTAMINAR\nCONTRIBUCIONES SUJETAS A DICTAMEN, ASÍ\nCOMO A LOS QUE EFECTÚEN EL PAGO POR\nCONCEPTO DE CANJE DE PLACAS A VEHÍCULOS\nDEL SERVICIO PARTICULAR O PÚBLICO\nABROGADO POR CONCLUIDA SU VIGENCIA HASTA EL 29 DE MAYO DE\n2009.\nTEXTO ORIGINAL\nAcuerdo publicado en el Periódico Oficial del Gobierno del Estado No. 38 Alcance\nI, el Martes 12 de Mayo de 2009.\nACUERDO POR EL QUE SE CONCEDE UN PLAZO ADICIONAL PARA LA\nPRESENTACIÓN DE AVISO POR PARTE DE LOS CONTRIBUYENTES OBLIGADOS\nO QUE OPTEN A DICTAMINAR CONTRIBUCIONES SUJETAS A DICTAMEN, ASÍ\nCOMO A LOS QUE EFECTÚEN EL PAGO POR CONCEPTO DE CANJE DE PLACAS\nA VEHÍCULOS DEL SERVICIO PARTICULAR O PÚBLICO.\nRICARDO ERNESTO CABRERA MORIN, Secretario de Finanzas y\n22 fracciones I, II, III, IV, XVI y XLI de la Ley Orgánica de la Administración Pública del\nEstado de Guerrero número 433 en vigor, así como en los artículos 11 fracción II, 18, 41, 91-Bis y 92 del Código Fiscal del Estado de Guerrero número 429 en vigor, y\nQue en la fracción VI del artículo 91- Bis del Código Fiscal del Estado de Guerrero número 429 en vigor, se establece que la presentación del aviso para dictaminar\nQue en el Artículo Tercero Transitorio de la Ley Número 1007 de Ingresos del\nEstado para el Ejercicio Fiscal del año 2009, en relación con las reglas 23 y 31 materia fiscal, denominado: Primera Resolución Miscelánea Fiscal, para el Ejercicio 2009 en el Estado de Guerrero, publicada en el Periódico Oficial de la entidad con número 4\nOBLIGADOS O QUE OPTEN A DICTAMINAR\nCONTRIBUCIONES SUJETAS A DICTAMEN, ASÍ\nCOMO A LOS QUE EFECTÚEN EL PAGO POR\nCONCEPTO DE CANJE DE PLACAS A VEHÍCULOS\nDEL SERVICIO PARTICULAR O PÚBLICO alcance I de fecha 13 de enero del 2009, se determina períodos de aplicación de estímulos fiscales, entre los que se otorgan beneficios de un 30% si el contribuyente efectúa el pago por concepto de canje de placas a vehículos del servicio particular y un\n50% en el pago por concepto de canje de placas a vehículos del servicio público de transporte, en ambos casos durante el mes de abril de 2009.\nQue existe la inquietud por parte de Contadores Públicos y Contribuyentes, quienes han externado su preocupación con dichas disposiciones, señalando que no les seria posible cumplir al día 30 de abril del 2009, en presentar el aviso para dictaminar contribuciones o efectuar sus pagos por concepto de canje a placas tanto del servicio particular como público, respectivamente, en virtud de la situación de alerta sanitaria que prevalece en el país por los brotes de la epidemia por influenza, por lo que ante tal situación y con la finalidad de darles facilidades en el cumplimiento de sus obligaciones fiscales de la Hacienda Pública del Estado ha tenido a bien expedir los siguientes:\n1. Por única ocasión se concede un plazo adicional hasta el día 29 de mayo de\n2009, para la presentación del aviso a los contribuyentes obligados que opten a dictaminar contribuciones sujetas a dictamen.\nLos avisos para dictaminar que sean presentados con fecha posterior al día 29 de efectos fiscales.\n2. En observancia a lo dispuesto por el Artículo Tercero Transitorio de la Ley\nNúmero 1007 de Ingresos del Estado para el Ejercicio Fiscal del año 2009, por esta única ocasión se prorroga al mes de mayo, el período de descuento consistente en un 30% de vehículos del servicio de transporte particular.\nOBLIGADOS O QUE OPTEN A DICTAMINAR\nCONTRIBUCIONES SUJETAS A DICTAMEN, ASÍ\nCOMO A LOS QUE EFECTÚEN EL PAGO POR\nCONCEPTO DE CANJE DE PLACAS A VEHÍCULOS\nDEL SERVICIO PARTICULAR O PÚBLICO\n3. En observancia a lo dispuesto por el Artículo Tercero Transitorio de la Ley\nNúmero 1007 de Ingresos del Estado para el Ejercicio Fiscal del año 2009, por esta única ocasión se prorroga al mes de mayo, el período de descuento consistente en un 50% para todo contribuyente que efectúe pago por concepto de derechos por canje de placas de vehículos del servicio de transporte público.\n4. Para los efectos del artículo 60 Bis H fracción I de la Ley de Hacienda del\nEstado de Guerrero, Número 428, los contribuyentes personas físicas podrán presentar su solicitud de inscripción ante la Administración o Agencia Fiscal de su jurisdicción, para empadronarse en el Registro Estatal de Contribuyentes, prorrogándose el término concedido con la regla 84 emitida mediante el Acuerdo por el que se emiten disposiciones de carácter general en materia fiscal, denominado: Primera Resolución\nMiscelánea Fiscal, para el Ejercicio 2009 en el Estado de Guerrero, publicada en el\nPeriódico Oficial de la entidad con número 4 alcance I de fecha 13 de enero del 2009, por lo que mediante el presente se concede término hasta el día 29 de mayo de 2009; advirtiendo que dicho período transcurrirá sin perjuicio de la causación del tributo en los meses previos al vencimiento del período de empadronamiento, bajo el entendido que el impuesto, sólo causará recargos, actualización o cualquier otro accesorio legal, a partir del día 1 de junio de 2009. periódico oficial del Estado de Guerrero.\nATENTAMENTE.\nSUFRAGIO EFECTIVO. NO REELECCIÓN.\nL.A.E. RICARDO ERNESTO CABRERA MORIN.\nRúbrica.",
  "ordenamiento": "ACUERDO",
  "jurisdiccion": "GUERRERO",
  "fuente_oficial": "DIARIO OFICIAL DE LA FEDERACION",
  "Fecha de Publicación": "29 DE MAYO DE \n2009",
  "ULTIMA REFORMA PUBLICADA": "12 de Mayo de 2009",
  "status": "ABROGADA",
  "es_escaneado": false,
  "tiene_tablas": false,
  "materia": [
    "cultura"
  ]
}