{
  "titulo": "Acuerdo por el Que Se Da Conocer A los Municipios del Estado de Guerrero, la Distribución y Calendar",
  "Contenido": "LA MINISTRACIÓN DE LOS RECURSOS\nCORRESPONDIENTES AL FONDO IV DEL RAMO\n33 “FONDO DE APORTACIONES PARA EL\nFORTALECIMIENTO DE LOS MUNICIPIOS Y DE\nLAS DEMARCACIONES TERRITORIALES DEL\nDISTRITO FEDERAL” (FORTAMUN-DF) PARA EL\nEJERCICIO FISCAL DEL 2010\nABROGADO POR CONCLUIDA SU VIGENCIA TÁCITAMENTE EL 31 DE DICIEMBRE 2010\nTEXTO ORIGINAL\nAcuerdo publicado en el Periódico Oficial del Gobierno del Estado No. 09 Alcance\nI, el Viernes 29 de Enero de 2010.\nACUERDO POR EL QUE SE DA CONOCER A LOS MUNICIPIOS DEL ESTADO DE\nGUERRERO, LA DISTRIBUCIÓN Y CALENDARIZACIÓN PARA LA MINISTRACIÓN\nDE LOS RECURSOS CORRESPONDIENTES AL FONDO IV DEL RAMO 33 \"FONDO\nDE APORTACIONES PARA EL FORTALECIMIENTO DE LOS MUNICIPIOS Y DE LAS\nDEMARCACIONES TERRITORIALES DEL DISTRITO FEDERAL\" (FORTAMUN-DF)\nPARA EL EJERCICIO FISCAL DEL 2010.\nAl margen un sello con el Escudo Oficial que dice: Gobierno del Estado Libre y\nSoberano de Guerrero.- Poder Ejecutivo.\nCARLOS ZEFERINO TORREBLANCA GALINDO, GOBERNADOR\nACUERDO A LOS ARTICULOS 26 Y 115 DE LA CONSTITUCION POLITICA DE LOS\nESTADOS UNIDOS MEXICANOS, 27, 31, 32 Y 37 DE LA LEY ORGANICA DE LA\nADMINISTRACION PUBLICA FEDERAL; 33, 34, 35 Y 44 DE LA LEY DE PLANEACION\nFEDERAL; 25, FRACCION IV, 36, 37 Y 38 DE LA LEY DE COORDINACION FISCAL, 8\nEJERCICIO FISCAL DEL 2010 Y EN EJERCICIO DE LAS FACULTADES QUE ME\nCONFIERE EL ARTICULO 74 DE LA CONSTITUCION POLITICA DEL ESTADO LIBRE\nPLANEACIONDEL ESTADO DE GUERRERO, 2°, 4°, 6°, 7° Y 18 FRACCION III Y 22 DE\nLA LEY ORGANICA DE LA ADMINISTRACION PUBLICA DEL ESTADO; Y\nLA MINISTRACIÓN DE LOS RECURSOS\nCORRESPONDIENTES AL FONDO IV DEL RAMO\n33 “FONDO DE APORTACIONES PARA EL\nFORTALECIMIENTO DE LOS MUNICIPIOS Y DE\nLAS DEMARCACIONES TERRITORIALES DEL\nDISTRITO FEDERAL” (FORTAMUN-DF) PARA EL\nEJERCICIO FISCAL DEL 2010\nQue el artículo 8 del Presupuesto de Egresos de la Federación para el ejercicio fiscal del 2010, prevé recursos en el Ramo 33 Aportaciones Federales para Entidades\nFederativas y Municipios, para el Fondo de Aportaciones para el Fortalecimiento de los\nMunicipios y de las Demarcaciones Territoriales del Distrito Federal.\nQue el ejercicio de los recursos que integran el Ramo 33 deberá apegarse a la distribución, condiciones y términos que establece el capítulo V de la Ley de\nCoordinación Fiscal, y no podrán ser erogados con fines distintos a los que ahí se señalan.\nQue la Secretaría de Hacienda y Crédito Público, es la encargada de ministrar a cada entidad federativa, y a través de éstas a los municipios, los montos correspondientes de cada uno de los fondos que conforman el citado ramo 33.\nQue la Ley de Coordinación Fiscal en el capítulo V, artículo 36 establece que \"Los cada Municipio o Demarcación Territorial por concepto de este Fondo, así como el calendario de ministraciones, a más tardar el 31 de enero de cada año\".\nRamo 33, específicamente los del Fondo IV \"Fondo de Aportaciones para el\nUnión para el Estado de Guerrero, he tenido a bien expedir el siguiente:\nLA MINISTRACIÓN DE LOS RECURSOS\nCORRESPONDIENTES AL FONDO IV DEL RAMO\n33 “FONDO DE APORTACIONES PARA EL\nFORTALECIMIENTO DE LOS MUNICIPIOS Y DE\nLAS DEMARCACIONES TERRITORIALES DEL\nDISTRITO FEDERAL” (FORTAMUN-DF) PARA EL\nEJERCICIO FISCAL DEL 2010\nACUERDO POR EL QUE SE DA CONOCER A LOS MUNICIPIOS DEL ESTADO DE\nGUERRERO, LA DISTRIBUCION Y CALENDARIZACION PARA LA MINISTRACION\nDE LOS RECURSOS CORRESPONDIENTES AL FONDO IV DEL RAMO 33 \"FONDO\nDE APORTACIONES PARA EL FORTALECIMIENTO DE LOS MUNICIPIOS Y DE LAS\nDEMARCACIONES TERRITORIALES DEL DISTRITO FEDERAL\" (FORTAMUN-DF)\nPARA EL EJERCICIO FISCAL DEL 2010.\nARTÍCULO PRIMERO. El presente Acuerdo tiene por objeto dar a conocer la fórmula, distribución y la calendarización de las ministraciones de recursos autorizados por el Estado de Guerrero del Fondo IV del Ramo 33 \"Fondo de Aportaciones para el\nFortalecimiento de los Municipios y de las Demarcaciones Territoriales del Distrito\nFederal\" para el ejercicio fiscal del 2009.\nARTÍCULO SEGUNDO. Los recursos del FORTAMUN-DF se distribuyen en proporción directa al número de habitantes con que cuenta cada uno de los municipios.\nLa asignación del FORTAMUN-DF para el iésimo municipio se determina mediante la aplicación de la siguiente fórmula:\nAFFMM = (P M / P EG) X MAFFMEG i 2005 i 2005\nDonde:\nAFFMM = Asignación para el año 2010, del Fondo de Fortalecimiento Municipal para el iésimo municipio.\nP M = Población del año 2005 del iésimo municipio.\n2005 i\nP EG = Población del año 2005 del Estado de Guerrero.\nLA MINISTRACIÓN DE LOS RECURSOS\nCORRESPONDIENTES AL FONDO IV DEL RAMO\n33 “FONDO DE APORTACIONES PARA EL\nFORTALECIMIENTO DE LOS MUNICIPIOS Y DE\nLAS DEMARCACIONES TERRITORIALES DEL\nDISTRITO FEDERAL” (FORTAMUN-DF) PARA EL\nEJERCICIO FISCAL DEL 2010\nMAFFMEG = Monto autorizado del Fortamún al Estado de Guerrero para el ejercicio fiscal 2010.\nARTÍCULO TERCERO.- La Secretaría de Hacienda y Crédito Público, publicó con fecha martes 29 de diciembre del 2009, el Acuerdo mediante el cual da a conocer la distribución y calendarización para la ministración de los recursos correspondientes al\nRamo 33 Aportaciones Federales para Entidades Federativas y Municipios, a que se refiere el Artículo V de la Ley de Coordinación Fiscal.\nAutorizándole al Estado de Guerrero $ 1,236,101,959.00 (mil doscientos treinta y seis millones ciento un mil novecientos cincuenta y nueve pesos 00/100 M. N.) del Fondo de Aportaciones para el Fortalecimiento de Entidades Federativas y Municipios y de las\nDemarcaciones Territoriales del Distrito Federal, recursos que el Estado de Guerrero\nArtículo 38 de la Ley de Coordinación Fiscal.\nARTÍCULO CUARTO.- La información utilizada en la aplicación de las fórmulas establecidas para la distribución del FORTAMUN-DF entre los municipios, es la siguiente:\nCM MUNICIPIO POBLACION 2005\nGUERRERO 3,115,202\n1 ACAPULCO DE JUAREZ 717,766\n2 ACATEPEC 28,525\nLA MINISTRACIÓN DE LOS RECURSOS\nCORRESPONDIENTES AL FONDO IV DEL RAMO\n33 “FONDO DE APORTACIONES PARA EL\nFORTALECIMIENTO DE LOS MUNICIPIOS Y DE\nLAS DEMARCACIONES TERRITORIALES DEL\nDISTRITO FEDERAL” (FORTAMUN-DF) PARA EL\nEJERCICIO FISCAL DEL 2010\n3 AHUACUOTZINGO 23,026\n4 AJUCHITLAN DEL PROGRESO 37,475\n5 ALCOZAUCA DE GUERRERO 16,237\n6 ALPOYECA 5,848\n7 APAXTLA 12,381\n8 ARCELIA 31,401\n9 ATENANGO DEL RIO 7,648\n10 ATLAMAJALCINGO DEL MONTE 5,143\n11 ATLIXTAC 23,371\n12 ATOYAC DE ALVAREZ 58,452\n13 AYUTLA DE LOS LIBRES 55,974\n14 AZOYU 13,448\n15 BENITO JUAREZ 14,444\n16 BUENAVISTA DE CUELLAR 12,148\n17 CHILAPA DE ALVAREZ 105,146\n18 CHILPANCINGO DE LOS BRAVO 214,219\n19 COAHUAYUTLA DE J. MA. IZAZAGA 13,291\n20 COCHOAPA EL GRANDE 15,572\n21 COCULA 13,884\n22 COPALA 11,896\n23 COPALILLO 13,747\n24 COPANATOYAC 17,337\n25 COYUCA DE BENITEZ 69,064\n26 COYUCA DE CATALAN 41,975\n27 CUAJINICUILAPA 23,537\n28 CUALAC 6,816\n29 CUAUTEPEC 14,554\n30 CUETZALA DEL PROGRESO 8,876\nLA MINISTRACIÓN DE LOS RECURSOS\nCORRESPONDIENTES AL FONDO IV DEL RAMO\n33 “FONDO DE APORTACIONES PARA EL\nFORTALECIMIENTO DE LOS MUNICIPIOS Y DE\nLAS DEMARCACIONES TERRITORIALES DEL\nDISTRITO FEDERAL” (FORTAMUN-DF) PARA EL\nEJERCICIO FISCAL DEL 2010\n31 CUTZAMALA DE PINZON 20,730\n32 EDUARDO NERI 40,328\n33 FLORENCIO VILLARREAL 18,713\n34 GENERAL CANUTO A. NERI 6,394\n35 GENERAL HELIODORO CASTILLO 34,554\n36 HUAMUXTITLAN 13,806\n37 HUITZUCO DE LOS FIGUEROA 35,055\n38 IGUALA DE LA INDEPENDENCIA 128,444\n39 IGUALAPA 10,312\n40 ILIATENCO 10,039\n41 IXCATEOPAN DE CUAUHTEMOC 6,104\n42 JOSE AZUETA 104,609\n43 JOSE JOAQUIN DE HERRERA 14,424\n44 JUAN R. ESCUDERO 22,805\n45 JUCHITAN 6,240\n46 LEONARDO BRAVO 22,982\n47 MALINALTEPEC 26,613\n48 MARTIR DE CUILAPAN 15,272\n49 MARQUELIA 11,801\n50 METLATONOC 17,398\n51 MOCHITLAN 10,709\n52 OLINALA 22,437\n53 OMETEPEC 55,283\n54 PEDRO ASCENCIO ALQUISIRAS 6,987\n55 PETATLAN 44,485\n56 PILCAYA 11,035\n57 PUNGARABATO 36,466\n58 QUECHULTENANGO 33,367\nLA MINISTRACIÓN DE LOS RECURSOS\nCORRESPONDIENTES AL FONDO IV DEL RAMO\n33 “FONDO DE APORTACIONES PARA EL\nFORTALECIMIENTO DE LOS MUNICIPIOS Y DE\nLAS DEMARCACIONES TERRITORIALES DEL\nDISTRITO FEDERAL” (FORTAMUN-DF) PARA EL\nEJERCICIO FISCAL DEL 2010\n59 SAN LUIS ACATLAN 41,884\n60 SAN MARCOS 44,959\n61 SAN MIGUEL TOTOLAPAN 27,033\n62 TAXCO DE ALARCON 98,854\n63 TECOANAPA 42,619\n64 TECPAN DE GALEANA 57,848\n65 TELOLOAPAN 51,659\n66 TEPECOACUILCO DE TRUJANO 28,989\n67 TETIPAC 12,702\n68 TIXTLA DE GUERRERO 37,300\n69 TLACOACHISTLAHUACA 18,055\n70 TLACOAPA 8,733\n71 TLALCHAPA 11,286\n72 TLALIXTAQUILLA DE MALDONADO 6,534\n73 TLAPA DE COMONFORT 65,763\n74 TLAPEHUALA 20,989\n75 LA UNION DE I. MONTES DE OCA 25,230\n76 XALPATLAHUAC 12,615\n77 XOCHISTLAHUACA 25,180\n78 XOCHIHUEHUETLAN 7,005\n79 ZAPOTITLAN TABLAS 9,601\n80 ZIRANDARO 20,053\n81 ZITLALA 19,718\nLa fuente de información es: Resultados definitivos del II Conteo de Población y\nVivienda 2005, para el Estado de Guerrero, publicados por el Instituto Nacional de\nEstadística, Geografía e Informática (INEGI).\nLA MINISTRACIÓN DE LOS RECURSOS\nCORRESPONDIENTES AL FONDO IV DEL RAMO\n33 “FONDO DE APORTACIONES PARA EL\nFORTALECIMIENTO DE LOS MUNICIPIOS Y DE\nLAS DEMARCACIONES TERRITORIALES DEL\nDISTRITO FEDERAL” (FORTAMUN-DF) PARA EL\nEJERCICIO FISCAL DEL 2010\nARTÍCULO QUINTO.- El monto autorizado del Fondo de Aportaciones para el\nFortalecimiento de los Municipios y las Demarcaciones Territoriales del Distrito Federal\n(FORTAMUN-DF) es de $ 1,236,101,959.00 (mil doscientos treinta y seis millones ciento un mil novecientos cincuenta y nueve pesos 00/100 M. N.) los cuales se distribuyen conforme a lo establecido en el Artículo Segundo del presente Acuerdo, obteniéndose las asignaciones siguientes:\nASIGNACION\nCM MUNICIPIO (PESOS)\nANUAL MENSUAL\nGUERRERO 1,236,101,959.00 103,008,496.58\n1 ACAPULCO DE JUAREZ 284,807,200.00 23,733,933.33\n2 ACATEPEC 11,318,627.00 943,218.92\n3 AHUACUOTZINGO 9,136,641.00 761,386.75\n4 AJUCHITLAN DEL PROGRESO 14,869,957.00 1,239,163.08\n5 ALCOZAUCA DE GUERRERO 6,442,788.00 536,899.00\n6 ALPOYECA 2,320,467.00 193,372.25\n7 APAXTLA 4,912,740.00 409,395.00\n8 ARCELIA 12,459,814.00 1,038,317.83\n9 ATENANGO DEL RIO 3,034,701.00 252,891.75\n10 ATLAMAJALCINGO DEL MONTE 2,040,726.00 170,060.50\n11 ATLIXTAC 9,273,536.00 772,794.67\n12 ATOYAC DE ALVAREZ 23,193,562.00 1,932,796.83\n13 AYUTLA DE LOS LIBRES 22,210,300.00 1,850,858.33\n14 AZOYU 5,336,122.00 444,676.83\nLA MINISTRACIÓN DE LOS RECURSOS\nCORRESPONDIENTES AL FONDO IV DEL RAMO\n33 “FONDO DE APORTACIONES PARA EL\nFORTALECIMIENTO DE LOS MUNICIPIOS Y DE\nLAS DEMARCACIONES TERRITORIALES DEL\nDISTRITO FEDERAL” (FORTAMUN-DF) PARA EL\nEJERCICIO FISCAL DEL 2010\n15 BENITO JUAREZ 5,731,332.00 477,611.00\n16 BUENAVISTA DE CUELLAR 4,820,287.00 401,690.58\n17 CHILAPA DE ALVAREZ 41,721,589.00 3,476,799.08\n18 CHILPANCINGO DE LOS BRAVO 85,001,398.00 7,083,449.83\n19 COAHUAYUTLA DE J. MA. IZAZAGA 5,273,825.00 439,485.42\n20 COCHOAPA EL GRANDE 6,178,919.00 514,909.92\n21 COCULA 5,509,126.00 459,093.83\n22 COPALA 4,720,294.00 393,357.83\n23 COPALILLO 5,454,765.00 454,563.75\n24 COPANATOYAC 6,879,265.00 573,272.08\n25 COYUCA DE BENITEZ 27,404,369.00 2,283,697.42\n26 COYUCA DE CATALAN 16,655,543.00 1,387,961.92\n27 CUAJINICUILAPA 9,339,405.00 778,283.75\n28 CUALAC 2,704,566.00 225,380.50\n29 CUAUTEPEC 5,774,980.00 481,248.33\n30 CUETZALA DEL PROGRESO 3,521,968.00 293,497.33\n31 CUTZAMALA DE PINZON 8,225,596.00 685,466.33\n32 EDUARDO NERI 16,002,018.00 1,333,501.50\n33 FLORENCIO VILLARREAL 7,425,257.00 618,771.42\n34 GENERAL CANUTO A. NERI 2,537,118.00 211,426.50\n35 GENERAL HELIODORO CASTILLO 13,710,914.00 1,142,576.17\n36 HUAMUXTITLAN 5,478,176.00 456,514.67\n37 HUITZUCO DE LOS FIGUEROA 13,909,709.00 1,159,142.42\n38 IGUALA DE LA INDEPENDENCIA 50,966,159.00 4,247,179.92\n39 IGUALAPA 4,091,768.00 340,980.67\n40 ILIATENCO 3,983,442.00 331,953.50\n41 IXCATEOPAN DE CUAUHTEMOC 2,422,047.00 201,837.25\n42 JOSE JOAQUIN DE HERRERA 5,723,396.00 476,949.67\nLA MINISTRACIÓN DE LOS RECURSOS\nCORRESPONDIENTES AL FONDO IV DEL RAMO\n33 “FONDO DE APORTACIONES PARA EL\nFORTALECIMIENTO DE LOS MUNICIPIOS Y DE\nLAS DEMARCACIONES TERRITORIALES DEL\nDISTRITO FEDERAL” (FORTAMUN-DF) PARA EL\nEJERCICIO FISCAL DEL 2010\n43 JUAN R. ESCUDERO 9,048,949.00 754,079.08\n44 JUCHITAN 2,476,012.00 206,334.33\n45 LA UNION DE I. MONTES DE OCA 10,011,181.00 834,265.08\n46 LEONARDO BRAVO 9,119,182.00 759,931.83\n47 MALINALTEPEC 10,559,951.00 879,995.92\n48 MARQUELIA 4,682,598.00 390,216.50\n49 MARTIR DE CUILAPAN 6,059,880.00 504,990.00\n50 METLATONOC 6,903,469.00 575,289.08\n51 MOCHITLAN 4,249,296.00 354,108.00\n52 OLINALA 8,902,928.00 741,910.67\n53 OMETEPEC 21,936,113.00 1,828,009.42\n54 PEDRO ASCENCIO ALQUISIRAS 2,772,419.00 231,034.92\n55 PETATLAN 17,651,502.00 1,470,958.50\n56 PILCAYA 4,378,652.00 364,887.67\n57 PUNGARABATO 14,469,589.00 1,205,799.08\n58 QUECHULTENANGO 13,239,916.00 1,103,326.33\n59 SAN LUIS ACATLAN 16,619,434.00 1,384,952.83\n60 SAN MARCOS 17,839,584.00 1,486,632.00\n61 SAN MIGUEL TOTOLAPAN 10,726,606.00 893,883.83\n62 TAXCO DE ALARCON 39,224,944.00 3,268,745.33\n63 TECOANAPA 16,911,080.00 1,409,256.67\n64 TECPAN DE GALEANA 22,953,897.00 1,912,824.75\n65 TELOLOAPAN 20,498,122.00 1,708,176.83\n66 TEPECOACUILCO DE TRUJANO 11,502,740.00 958,561.67\n67 TETIPAC 5,040,112.00 420,009.33\n68 TIXTLA DE GUERRERO 14,800,518.00 1,233,376.50\n69 TLACOACHISTLAHUACA 7,164,165.00 597,013.75\n70 TLACOAPA 3,465,226.00 288,768.83\nLA MINISTRACIÓN DE LOS RECURSOS\nCORRESPONDIENTES AL FONDO IV DEL RAMO\n33 “FONDO DE APORTACIONES PARA EL\nFORTALECIMIENTO DE LOS MUNICIPIOS Y DE\nLAS DEMARCACIONES TERRITORIALES DEL\nDISTRITO FEDERAL” (FORTAMUN-DF) PARA EL\nEJERCICIO FISCAL DEL 2010\n71 TLALCHAPA 4,478,248.00 373,187.33\n72 TLALIXTAQUILLA DE MALDONADO 2,592,670.00 216,055.83\n73 TLAPA DE COMONFORT 26,094,543.00 2,174,545.25\n74 TLAPEHUALA 8,328,367.00 694,030.58\n75 XALPATLAHUAC 5,005,591.00 417,132.58\n76 XOCHIHUEHUETLAN 2,779,561.00 231,630.08\n77 XOCHISTLAHUACA 9,991,342.00 832,611.83\n78 ZAPOTITLAN TABLAS 3,809,645.00 317,470.42\n79 ZIHUATANEJO DE AZUETA 41,508,509.00 3,459,042.42\n80 ZIRANDARO 7,956,965.00 663,080.42\n81 ZITLALA 7,824,041.00 652,003.42\nARTÍCULO SEXTO.- Conforme a la Ley de Coordinación Fiscal, el calendario de entrega a los municipios de los recursos del FORTAMUN-DF para el ejercicio fiscal del\n2010 será:\nCalendario de fechas de pago 2010\nMES FORTAMUN\nLA MINISTRACIÓN DE LOS RECURSOS\nCORRESPONDIENTES AL FONDO IV DEL RAMO\n33 “FONDO DE APORTACIONES PARA EL\nFORTALECIMIENTO DE LOS MUNICIPIOS Y DE\nLAS DEMARCACIONES TERRITORIALES DEL\nDISTRITO FEDERAL” (FORTAMUN-DF) PARA EL\nEJERCICIO FISCAL DEL 2010\nOctubre 29-10-10\nNoviembre 30-11-10\nDiciembre 14-12-10\nUNICO. El presente Acuerdo entrará en vigor a partir del día siguiente de su publicación en el Periódico Oficial del Gobierno del Estado.\nDado en al residencia oficial del Poder Ejecutivo estatal en Chilpancingo de los\nBravo, Guerrero, a los quince días del mes de enero del año dos mil diez.\nGOBERNADOR CONSTITUCIONAL DEL ESTADO.\nC.P. ZEFERINO TORREBLANCA GALINDO.\nRúbrica.\nSECRETARIO GENERAL DE GOBIERNO.\nLIC. GUILLERMO RAMIREZ RAMOS.\nRúbrica.\nSECRETARIO DE FINANZAS Y ADMINISTRACIÓN.\nLIC. RICARDO E. CABRERA MORÍN.\nRúbrica.",
  "ordenamiento": "ACUERDO",
  "jurisdiccion": "GUERRERO",
  "fuente_oficial": "DIARIO OFICIAL DE LA FEDERACION",
  "Fecha de Publicación": "29 de Enero de 2010",
  "ULTIMA REFORMA PUBLICADA": "29 de Enero de 2010",
  "status": "ABROGADA",
  "es_escaneado": false,
  "tiene_tablas": true,
  "materia": [
    "municipal"
  ]
}