{
  "titulo": "Acuerdo por el Que Se Crea la Coordinación General del Ejecutivo del Estado, Como Una Dependencia Di",
  "Contenido": "DIRECTAMENTE ADSCRITA A LA OFICINA\nDEL GOBERNADOR.\nTEXTO ORIGINAL\nACUERDO POR EL QUE SE CREA LA COORDINACIÓN GENERAL DEL EJECUTIVO\nDEL ESTADO, COMO UNA DEPENDENCIA DIRECTAMENTE ADSCRITA A LA\nOFICINA DEL GOBERNADOR.\nAl margen un sello con el Escudo Oficial que dice: Gobierno del Estado Libre y\nSoberano de Guerrero.- Poder Ejecutivo.\nCARLOS ZEFERINO TORREBLANCA GALINDO, GOBERNADOR\nLAS FACULTADES QUE ME CONFIEREN LAS FRACCIONES IV Y IX DEL ARTÍCULO\nESTABLECEN LOS ARTÍCULOS 2°, 3°, 4° ÚLTIMO PÁRRAFO, 6°, 7° Y 9° DE LA LEY\nORGÁNICA DE LA ADMINISTRACIÓN PÚBLICA DEL ESTADO DE GUERRERO\nNÚMERO 433; Y, Que conforme al contexto político, económico, social y cultural prevaleciente en el ámbito local, en los últimos veinte años las disposiciones jurídicas relativas a la adecuarse a la situación actual.\nQue al efecto, se considera que el diseño de las instituciones como expresión de la vida política de la sociedad, debe responder a las nuevas demandas de la población en general, en el sentido de que faciliten su interacción y participación en los mecanismos de la toma de decisiones públicas, buscando siempre el logro de sus propósitos para beneficio colectivo.\nDIRECTAMENTE ADSCRITA A LA OFICINA\nDEL GOBERNADOR. plenamente que las demandas actuales de la sociedad, la vida política del Estado y los del Poder Ejecutivo Estatal, para responder mejor a las exigencias de los nuevos tiempos.\nQue el mandato de los guerrerenses derivado del resultado de la elección del 6 de febrero de 2005, es esencialmente el de reorganizar la vida del Estado en función de nuevas prácticas políticas y de gobierno, como condición para la sustentabilidad y el desarrollo de la vida democrática.\nQue el nuevo régimen político de Gobierno debe crear sus propios mecanismos de generación de consensos, toma de decisiones y formulación de políticas públicas, correspondiendo hoy en día a la vigorosa pluralidad política, competencia de partidos y participación ciudadana.\nQue actualmente una de las demandas más sentidas de la sociedad es hacer eficiente y coherente a la Administración Pública Estatal para que el uso de los recursos económicos, materiales y humanos se traduzca en servicios públicos de calidad.\nQue ante la necesidad de generar nuevos consensos para armonizar los esfuerzos de una sociedad y gobiernos más plurales, incluir a una sociedad civil más participativa y responder al reclamo de la ciudadanía de participar en la toma de decisiones, es necesario fortalecer las capacidades gubernamentales de planeación y de construcción de políticas públicas, con el propósito no sólo de hacer más eficaz la inversión pública, sino de encontrar innovadoras formas de alianza entre los recursos públicos y privados, que redunden en obras y acciones para incorporar a nuestro Estado al desarrollo nacional. público del desarrollo, limitándose casi en su totalidad a las aportaciones federales, en tanto que localmente la capacidad de recaudar ingresos propios, aunque se ha hecho más eficiente, no es suficiente para los recursos planteados, lo cual obliga a replantear el ejercicio de la contribución-recaudación y el de la búsqueda de innovadoras fuentes de\nDIRECTAMENTE ADSCRITA A LA OFICINA\nDEL GOBERNADOR. financiamiento, a fin de lograr mayor autonomía financiera estatal en las decisiones del desarrollo.\nAdministración Pública del Estado, se plantea la creación de la Coordinación General del Ejecutivo del Estado, como un instrumento propio del Ejecutivo Estatal para articular las atribuciones actualmente conferidas a diversas oficinas del Jefe del Ejecutivo y de las dependencias de la Administración Pública Estatal; con ello, vendrá a imprimirse un nuevo sello a este Gobierno, pues se consolidará un manejo más eficiente, eficaz y transparente de la acción gubernamental, al reducir el tramo de control y mando del\nGobernador.\nQue acorde a la política de austeridad y manejo eficiente de los recursos con que cuenta el Gobierno del Estado, la creación de esta Coordinación Ejecutiva, no impactará el gasto corriente, ya que a la misma, se le adscribirán recursos humanos ya existentes y que actualmente laboran en las distintas dependencias del Ejecutivo del Estado, con lo que se hará más transparente su funcionamiento.\nPor todo lo anteriormente expuesto y fundado, he tenido a bien expedir el siguiente:\nACUERDO POR EL QUE SE CREA LA COORDINACIÓN GENERAL DEL EJECUTIVO\nDEL ESTADO, COMO UNA DEPENDENCIA DIRECTAMENTE ADSCRITA A LA\nOFICINA DEL GOBERNADOR.\nARTÍCULO PRIMERO.- Se crea la Coordinación General del Ejecutivo del\nEstado, como un órgano de coordinación, planeación, programación, presupuestación, seguimiento y evaluación de las acciones, inversiones y programas que desarrollen el\nSector Privado.\nEstado, las siguientes:\nDIRECTAMENTE ADSCRITA A LA OFICINA\nDEL GOBERNADOR.\nI. Coordinar a las dependencias y entidades de la Administración Pública\nEstatal en la elaboración, ejecución y evaluación de los programas y proyectos sectoriales, regionales y especiales, tendientes a lograr el cumplimiento de los objetivos y acciones plasmados en el Plan Estatal de Desarrollo, así como vigilar que en su formulación sean acordes con los programas y acciones de la Federación y los\nMunicipios de la Entidad, propósito para el cual propondrá al titular del Ejecutivo Estatal la suscripción de los Acuerdos y Convenios respectivos;\nII. Coordinar el proceso de planeación, programación, presupuestación, seguimiento y evaluación de los proyectos e inversiones en sus niveles estatal, sectorial, regional e institucional, para el mejor desempeño de la función pública;\nIII. Conducir, a través del Comité de Planeación para el Desarrollo del Estado de Guerrero, el diseño e instrumentación de estrategias para optimizar el proceso de planeación, programación, presupuestación, ejecución y evaluación de la inversión pública municipal;\nIV. Coordinar la evaluación técnica, económica, ambiental y social de los programas y proyectos de inversión que formulen las dependencias y entidades de la\nAdministración Pública Estatal, así como los sectores social y privado, para determinar su factibilidad;\nV. Diseñar y coordinar la instrumentación, así como la evaluación, de las atribuciones constitucionales;\nVI. Promover la participación de la administración pública y el sector privado, así como de la sociedad civil en general, en el diseño e instrumentación de políticas públicas para el desarrollo de la Entidad;\nVII. Coordinar el proceso de formulación del proyecto anual del presupuesto de inversión del Ejecutivo Estatal, así como los proyectos de prestación de servicio que se llegaren a contratar para la realización de obras en el Estado;\nDIRECTAMENTE ADSCRITA A LA OFICINA\nDEL GOBERNADOR.\nVIII. Coordinar el ejercicio del presupuesto de inversión anual, emitiendo a autorización y las órdenes de pago correspondientes, así como las transferencias de los recursos financieros programados para las entidades paraestatales, con base en los techos financieros y calendarios establecidos;\nIX. Dictaminar las modificaciones programáticas y presupuestarias del gasto de inversión aprobado, con base en la normatividad presupuestal vigente;\nX. Consolidar y dar seguimiento a la ejecución del presupuesto de inversión de los sectores central y paraestatal de la Administración Pública del Estado, evaluando los avances y resultados de cada proyecto, así como de su conjunto, y proponiendo en su caso las modificaciones pertinentes;\nXI. Conducir y regir, a través del Comité de Planeación para el Desarrollo del\nEstado de Guerrero, el ejercicio, seguimiento y evaluación de la inversión pública municipal financiada con recursos provenientes de la federación, así como de la inversión financiada de manera concurrente entre el Estado y los municipios;\nXII. Diseñar y coordinar las estrategias y políticas para el financiamiento de la infraestructura social y productiva en la Entidad, atendiendo las prioridades marcadas en el Plan Estatal de Desarrollo;\nXIII. Coordinar la ejecución, seguimiento y evaluación de los programas y\nXIV. Conducir, a través de la Coordinación General de Fortalecimiento\nMunicipal, las actividades de asesoría, capacitación y apoyo a los Ayuntamientos del\nEstado, en materia financiera, jurídica, técnica y administrativa;\nXV. Conducir la integración y actualización del Sistema Estatal de Información\nGeográfica, Estadística, Población, Histórica, Cultural y Socioeconómica de la Entidad;\nDIRECTAMENTE ADSCRITA A LA OFICINA\nDEL GOBERNADOR.\nXVI. Coordinar la instrumentación de la política de comunicación social del\nXVII. Realizar y coordinar la elaboración del informe anual de gobierno, así como los documentos y medios de apoyo para desahogar las comparecencias y demás intervenciones públicas del Ejecutivo del Estado;\nXVIII. Asistir al titular del Poder Ejecutivo del Estado en el desarrollo y fortalecimiento de las relaciones con gobiernos extranjeros, gobiernos de otras Entidades\nFederativas, con organismos no gubernamentales y con comunidades de guerrerenses radicados en el extranjero;\nXIX. Fungir, en los casos que el titular del Ejecutivo del Estado lo determine, como jefe de sus oficinas de apoyo; y\nXX. Las demás que conforme a sus atribuciones le encomiende o delegue el titular del Poder Ejecutivo Estatal.\nARTÍCULO SEGUNDO.- Para el cumplimiento de las atribuciones mencionadas en el artículo que antecede, la Coordinación General del Ejecutivo del Estado conducirá y regirá el funcionamiento del Comité de Planeación para el Desarrollo del Estado de\nGuerrero; de la Coordinación General de Fortalecimiento Municipal; del Consejo Estatal de Población; de la Dirección General de Comunicación Social; de la Coordinación\nGeneral de Asesores del Gobernador, y de la Oficina de Representación del Gobierno\nARTÍCULO TERCERO.- La coordinación de las entidades del sector paraestatal, para fines de planeación, programación, gasto, financiamiento, control y evaluación, se\nDIRECTAMENTE ADSCRITA A LA OFICINA\nDEL GOBERNADOR.\nEn virtud de lo anterior, el titular de la Coordinación General del Ejecutivo del\nEstado fungirá, en caso de ausencia, como representante del titular del Poder Ejecutivo\nEstatal en los órganos de Gobierno de todas las Entidades del sector paraestatal.\nARTÍCULO CUARTO.- El Coordinador General del Ejecutivo del Estado será el\nCoordinador General del Organismo Administrativo Desconcentrado Comité de\nPlaneación para el Desarrollo del Estado de Guerrero, y será nombrado por el titular del\nPoder Ejecutivo del Estado, quedando adscrito directamente a la Oficina del mismo.\nARTÍCULO QUINTO.- La Coordinación General del Ejecutivo del Estado para el desempeño de sus funciones contará con el apoyo de las Unidades Administrativas que establezca el titular del Poder Ejecutivo del Estado.\nArtículo Primero.- El presente Acuerdo entrará en vigor al día siguiente de su\nArtículo Segundo.- La Coordinación General del Ejecutivo del Estado elaborará, Acuerdo, su proyecto de estructura orgánica, para someterlo a consideración y autorización del Gobernador del Estado.\nChilpancingo de los Bravo, Capital del Estado de Guerrero, al día dos de diciembre del dos mil seis.\nDIRECTAMENTE ADSCRITA A LA OFICINA\nDEL GOBERNADOR.\nEL C. GOBERNADOR CONSTITUCIONAL DEL ESTADO.\nC. P. CARLOS ZEFERINO TORREBLANCA GALINDO.\nEL C. SECRETARIO GENERAL DE GOBIERNO.\nLIC. ARMANDO CHAVARRÍA BARRERA.",
  "ordenamiento": "ACUERDO",
  "jurisdiccion": "GUERRERO",
  "fuente_oficial": "DIARIO OFICIAL DE LA FEDERACION",
  "Fecha de Publicación": "16 de Enero de 2007",
  "ULTIMA REFORMA PUBLICADA": null,
  "status": "VIGENTE",
  "es_escaneado": false,
  "tiene_tablas": false,
  "materia": [
    "general"
  ]
}