{
  "titulo": "Acuerdo por el Que Se Declara Formalmente Instalado el Instituto de Transparencia, Acceso A la Infor",
  "Contenido": "DATOS PERSONALES DEL ESTADO DE GUERRERO,\nDESEMPEÑÁNDOSE COMO CONSEJERO PRESIDENTE\nEL C. ROBERTO RODRÍGUEZ SALDAÑA PARA EL\nTEXTO ORIGINA|L\nAcuerdo publicado en el Periódico Oficial del Gobierno del Estado No. 32, el Martes 21 de Abril de\n2015.\nACUERDO POR EL QUE SE DECLARA FORMALMENTE INSTALADO EL INSTITUTO DE\nTRANSPARENCIA, ACCESO A LA INFORMACIÓN Y PROTECCIÓN DE DATOS PERSONALES DEL\nESTADO DE GUERRERO, DESEMPEÑÁNDOSE COMO CONSEJERO PRESIDENTE EL C. ROBERTO\nRODRÍGUEZ SALDAÑA PARA EL PERÍODO DEL 9 DE FEBRERO DE 2015 AL 8 DE FEBRERO DE\n2016.\nEL PLENO DEL INSTITUTO DE TRANSPARENCIA, ACCESO A LA INFORMACIÓN Y\nPROTECCIÓN DE DATOS PERSONALES DEL ESTADO DE GUERRERO, Y:\nCONSIDERANDO\nQue en Sesión Ordinaria número ITAIG/11/2015 de fecha once de febrero del año dos mil quince, el Pleno de este Instituto, emitió por mayoría de votos un Acuerdo, y entre las consideraciones que lo sustentan, se destaca lo siguiente:\n\"I. Que el artículo quinto transitorio del Decreto número 453 por el que se reforman y adicionan establece: \"Para efecto de lo dispuesto en el numeral anterior, las actuales denominaciones de las instituciones y autoridades establecidas en las leyes del Estado, se atenderá de acuerdo con lo previsto en este Decreto\", atendiendo a dicho ordenamiento, el pleno de este órgano garante, en sesión de fecha de 8 de febrero de 2015, aprobó la denominación de este órgano garante como Instituto de Transparencia, Acceso a la Información y Protección de Datos Personales del Estado de Guerrero.\nII. En esta misma lógica, los artículos transitorios XIV y XV del Decreto número 453 citado señalan:\n\"DÉCIMO CUARTO. A la entrada en vigor del presente Decreto, el personal adscrito, así como los recursos materiales y financieros de las siguientes instituciones, se tendrán por transferidos a aquellas que se crean\nInstituto de Transparencia, Acceso a la Información y Protección de Datos Personales del Estado de\nGuerrero. DÉCIMO QUINTO. Para preservar los derechos adquiridos con anterioridad al presente Decreto, su encargo el tiempo establecido en el decreto de su nombramiento. Al efecto, se modificará la denominación de su encargo, en concordancia con el de la institución a las que pertenecen\".\nDATOS PERSONALES DEL ESTADO DE GUERRERO,\nDESEMPEÑÁNDOSE COMO CONSEJERO PRESIDENTE\nEL C. ROBERTO RODRÍGUEZ SALDAÑA PARA EL\nIII. No es óbice mencionar que en sesión ordinaria de fecha ocho de febrero de dos mil quince, el\nC. ROBERTO RODRÍGUEZ SALDAÑA, tomó protesta como Consejero Presidente de este Órgano\nGarante, pero con el cambio de denominación, era necesario que primero se instalara el pleno Instituto de\nTransparencia, Acceso a la Información y Protección de Datos Personales del Estado de Guerrero, y seguidamente, el presidente fuera ratificado para seguir desempeñando dicho cargo del Instituto con la nueva denominación\".\nEn mérito de lo anterior, y en cumplimiento a las disposiciones establecidas en la Constitución\nGuerrero, en materia de Transparencia, Acceso a la Información y Protección de Datos Personales, el\nPleno de este Instituto, emite el siguiente:\nPRIMERO: Se declara formalmente instalado el Instituto de Transparencia, Acceso a la\nInformación y Protección de Datos Personales del Estado de Guerrero, desempeñándose como Consejero\nPresidente el C. Roberto Rodríguez Saldaña, para el periodo del 09 de febrero de 2015 al 08 de febrero de\n2016.\nSEGUNDO: El personal adscrito, el patrimonio, los recursos materiales y financieros del Instituto de Transparencia y Acceso a la Información Pública del Estado de Guerrero, se transfieren al Instituto de\nTransparencia, Acceso a la Información y Protección de Datos Personales del Estado de Guerrero.\nPara lo anterior procédase hacer los trámites necesarios para los efectos señalados en este acuerdo.\nTRANSITORIOS\nPRIMERO: El presente acuerdo surtirá sus efectos a partir de su aprobación por el pleno Instituto de Transparencia, Acceso a la Información y Protección de Datos Personales del Estado de Guerrero.\nSEGUNDO: Realícense las gestiones necesarias para dar cumplimento al contenido de este acuerdo.\nAsí lo acordó por mayoría, el pleno del Instituto de Transparencia, Acceso a la Información y\nProtección de Datos Personales del Estado de Guerrero, en sesión ordinaria de once de febrero del año dos mil quince, por ante el Secretario Ejecutivo que da fe.\nDATOS PERSONALES DEL ESTADO DE GUERRERO,\nDESEMPEÑÁNDOSE COMO CONSEJERO PRESIDENTE\nEL C. ROBERTO RODRÍGUEZ SALDAÑA PARA EL\nC. Roberto Rodríguez Saldaña.\nConsejero Presidente.\nRúbrica.\nCrescencio Almazán Tolentino.\nConsejero. c. Jesús Antonio Ortiz Sotelo.\nSecretario Ejecutivo.\nRúbrica.\nC. Joaquín Morales Sánchez\nConsejero.\nRúbrica.\nEL SUSCRITO LICENCIADO FELIPE REYES NÁJERA, SECRETARIO DE ACUERDOS DEL\nINSTITUTO DE TRANSPARENCIA, ACCESO A LA INFORMACIÓN Y PROTECCIÓN DE DATOS\nPERSONALES DEL ESTADO DE GUERRERO.\nTRANSPARENCIA, ACCESO A LA INFORMACIÓN Y PROTECCIÓN DE DATOS PERSONALES DEL\nESTADO DE GUERRERO; MISMAS QUE VAN DEBIDAMENTE SELLADAS Y COTEJADAS.\nCERTIFICÁNDOSE EN LA CIUDAD DE CHILPANCINGO DE LOS BRAVO, GUERRERO, A LOS\nVEINTITRÉS DÍAS DEL MES DE MARZO DEL AÑO DOS MIL QUINCE.- DOY FE",
  "ordenamiento": "ACUERDO",
  "jurisdiccion": "GUERRERO",
  "fuente_oficial": "DIARIO OFICIAL DE LA FEDERACION",
  "Fecha de Publicación": "9 DE FEBRERO DE 2015",
  "ULTIMA REFORMA PUBLICADA": null,
  "status": "VIGENTE",
  "es_escaneado": false,
  "tiene_tablas": false,
  "materia": [
    "transparencia"
  ]
}