{
  "titulo": "Acuerdo Delegatorio de Representación Legal y de Facultades, Que Emite el Lic. C. Arturo Lataban Lóp",
  "Contenido": "LÓPEZ, AUDITOR GENERAL DEL ESTADO DE\nGUERRERO, A FAVOR DEL LICENCIADO\nMARCO ANTONIO CRUZ MANJARREZ\nSALGADO, ENCARGADO DE LA DIRECCIÓN\nDE ASUNTOS JURÍDICOS DE LA AUDITORIA\nGENERAL DEL ESTADO\nTEXTO ORIGINAL\nAcuerdo publicado en el Periódico Oficial del Gobierno del Estado No. 29, el\nMartes 12 de Abril de 2011.\nAUDITORIA GENERAL DEL ESTADO DE GUERRERO\nACUERDO DELEGATORIO DE REPRESENTACIÓN LEGAL Y DE FACULTADES,\nQUE EMITE EL LIC. C. ARTURO LATABAN LÓPEZ, AUDITOR GENERAL DEL\nESTADO DE GUERRERO, A FAVOR DEL LICENCIADO MARCO ANTONIO CRUZ\nMANJARREZ SALGADO, ENCARGADO DE LA DIRECCIÓN DE ASUNTOS\nJURÍDICOS DE LA AUDITORIA GENERAL DEL ESTADO.\nEL SUSCRITO LICENCIADO CERTIFICADO ARTURO LATABÁN LÓPEZ,\nAUDITOR GENERAL DEL ESTADO, EN USO DE LAS FACULTADES QUE ME\nCONFIEREN LOS ARTÍCULOS 107 FRACCIÓN IV DE LA CONSTITUCIÓN POLÍTICA\nPODER LEGISLATIVO DEL ESTADO, NÚMERO 286; 1º, 2º FRACCIONES I, II, XII, 6\nFRACCIONES XXXVIII, 7º, 19 FRACCIONES I, II, III, VII, XIX, XX, XXII, XXXIII Y\nDEMÁS RELATIVOS DE LA LEY DE FISCALIZACIÓN SUPERIOR DEL ESTADO DE\nGUERRERO NÚM. 564, Y:\nPRIMERO.- EN TÉRMINOS DE LO ESTABLECIDO POR LOS ARTÍCULOS 107\nDEFISCALIZACIÓN SUPERIOR DEL ESTADO, CON FECHA VEINTE DE DICIEMBRE\nGENERAL DEL ESTADO, POR LA QUINCUAGÉSIMA NOVENA LEGISLATURA DEL\nLÓPEZ, AUDITOR GENERAL DEL ESTADO DE\nGUERRERO, A FAVOR DEL LICENCIADO\nMARCO ANTONIO CRUZ MANJARREZ\nSALGADO, ENCARGADO DE LA DIRECCIÓN\nDE ASUNTOS JURÍDICOS DE LA AUDITORIA\nGENERAL DEL ESTADO\nSEGUNDO.- CON FECHA TRES DE ENERO DEL AÑO DOS MIL ONCE, Y EN\nTÉRMINOS DE LO ESTABLECIDO POR EL ARTÍCULO 14 DE LA LEY DE\nFISCALIZACIÓN SUPERIOR DEL ESTADO DE GUERRERO NÚMERO 564, FUE\nNOMBRADO ENCARGADO DE LA DIRECCIÓN DE ASUNTOS JURÍDICOS DE LA\nAUDITORIA GENERAL DEL ESTADO EL LIC. MARCO ANTONIO CRUZ MANJARREZ\nSALGADO.\nTERCERO.- QUE ATENDIENDO A LA DINÁMICA CON QUE LA AUDITORIA\nGENERAL DEL ESTADO DESARROLLA SUS ACTIVIDADES, CONLLEVA A LA\nEJECUCIÓN DE ACTOS DE NATURALEZA ADMINISTRATIVA Y JURÍDICO-LEGAL,\nEN PRO DE LAS FUNCIONES E INTERESES DE ESTE ÓRGANO TÉCNICO AUXILIAR\nDEL PODER LEGISLATIVO, DEL ESTADO DE GUERRERO.\nCUARTO.- QUE EL ARTICULO 19 DE LA LEY DE FISCALIZACIÓN DEL\nESTADO NÚMERO 564, SEÑALA LAS FACULTADES QUE TENGO EN MI CARÁCTER\nDE AUDITOR GENERAL DEL ESTADO, INDICANDO EN LA FRACCION III, LA\nFACUTAD QUE TENGO PARA EXPEDIR CERTIFICACIONES DE LOS DOCUMENTOS\nQUE OBRAN EN LOS ARCHIVOS DE LA AUDITORIA GENERAL DEL ESTADO A\nQUIENES ACREDITEN INTERESJURIDICO Y QUE DICHA FACULTAD PUEDO\nDELEGARLA AL DIRECTOR DE ASUNTOS JURIDICOS.\nQUINTO.- QUE EL ARTICULO 21 ESTABLECE LAS FACULTADES DEL\nDIRECTOR DE ASUNTOS JURÍDICOS, Y PREVÉ EN LA FRACCIÓN VII, DE LA LEY\nEN COMENTO, QUE EL DIRECTOR DE ASUNTOS JURÍDICOS DE ESTE ÓRGANO,\nTENDRÁ LAS DEMAS FACULTADES QUE SEÑALEN LA LEY, EL REGLAMENTO Y\nOTRAS DISPOSICIONES APLICABLES, ENTRE ESTAS, LA DE EJERCER POR\nDELEGACION DEL AUDITOR GENERAL DEL ESTADO, LA FACULTAD DE EXPEDIR\nJURIDICO.\nLÓPEZ, AUDITOR GENERAL DEL ESTADO DE\nGUERRERO, A FAVOR DEL LICENCIADO\nMARCO ANTONIO CRUZ MANJARREZ\nSALGADO, ENCARGADO DE LA DIRECCIÓN\nDE ASUNTOS JURÍDICOS DE LA AUDITORIA\nGENERAL DEL ESTADO\nSEXTO.- QUE EN CONGRUENCIA CON LO ANTERIOR, A FIN DE DAR\nMAYOR AGILIDAD A LA ATENCIÓN PRONTA Y EXPEDITA DE LOS ACTOS QUE\nEMITE ESTE ÓRGANO TÉCNICO DE FISCALIZACIÓN Y EN GENERAL CON EL\nOBJETO DE DESEMPEÑAR MEJOR LAS FUNCIONES DE LA AUDITORIA GENERAL\nDEL ESTADO, CON FUNDAMENTO EN LO DISPUESTO EN EL ARTICULO 21 DE LA\nLEY DE FISCALIZACION SUPERIOR DEL ESTADO DE GUERRERO NUMERO 564,\nRESULTA PROCEDENTE DELEGAR LA FACULTAD SEÑALADA EN EL\nCONSIDERANDO CUARTO ANTERIOR, AL ENCARGADO DE LA DIRECCIÓN DE\nASUNTOS JURÍDICOS DE LA AUDITORIA GENERAL DEL ESTADO, LICENCIADO\nMARCO ANTONIO CRUZ MANJARREZ SALGADO; POR LO QUE HE TENIDO A BIEN\nEXPEDIRLE EL SIGUIENTE:\nACUERDO DELEGATORIO A FAVOR DEL LICENCIADO MARCO ANTONIO CRUZ\nMANJARREZ SALGADO, ENCARGADO DE LA DIRECCIÓN DE ASUNTOS\nJURÍDICOS DE ESTE ÓRGANO TÉCNICO.\nARTÍCULO PRIMERO.- DE CONFORMIDAD CON LO DISPUESTO EN LA\nFRACCION VII DEL ARTICULO 21 DE LA LEY DE FISCALIZACION SUPERIOR DEL\nESTADO DE GUERRERO NUMERO 564, SE DELEGA A FAVOR DEL LICENCIADO\nMARCO ANTONIO CRUZ MANJARREZ SALGADO, ENCARGADO DE LA DIRECCIÓN\nDE ASUNTOS JURÍDICOS DE LA AUDITORÍA GENERAL DEL ESTADO, LA\nFACULTAD PREVISTA EN LA FRACCION III DEL ARTÍCULO 19 DE LA REFERIDA\nLEY DE FISCALIZACIÓN; EN TÉRMINOS DE LAS DISPOSICIONES LEGALES\nAPLICABLES Y DE LOS CONSIDERANDOS TERCERO, CUARTO, QUINTO Y SEXTO\nDEL PRESENTE ACUERDO; DEBIENDO EJECUTAR EL DELEGADO TODOS LOS\nDELEGADAS, ASEGURANDO LAS MEDIDAS NECESARIAS EL CUMPLIMIENTO DE\nLAS DISPOSICIONES CONTENIDAS EN EL PRESENTE ACUERDO; EXCEPCIONA EL\nACTO INMERSO EN LAS FRACCIÓNES XXXVI Y XXIX DEL ARTÍCULO 21 ANTES\nLÓPEZ, AUDITOR GENERAL DEL ESTADO DE\nGUERRERO, A FAVOR DEL LICENCIADO\nMARCO ANTONIO CRUZ MANJARREZ\nSALGADO, ENCARGADO DE LA DIRECCIÓN\nDE ASUNTOS JURÍDICOS DE LA AUDITORIA\nGENERAL DEL ESTADO\nFINCAMIENTO DE RESPONSABILIDAD ADMINISTRATIVA RESARCITORIA Y EN LOS\nRESPECTIVOS RECURSOS DE RECONSIDERACIÓN, ASI COMO LA RELATIVA A\nFORMULAR DENUNCIAS DE JUICIO POLITICO, QUEDANDO ESTAS ÚLTIMAS\nRESERVADAS AL DELEGANTE.\nARTÍCULO SEGUNDO.- EL EJERCICIO DE LAS FACULTADES QUE SE\nDELEGAN EN EL PRESENTE ACUERDO, SE SUJETARÁ A LAS DISPOSICIONES\nLEGALES Y A LA NORMATIVIDAD APLICABLE.\nARTÍCULO TERCERO.- LA PRESENTE DELEGACIÓN DE FACULTADES SE\nENTIENDE HECHA SIN PERJUICIO DE SU EJERCICIO DIRECTO POR PARTE DEL\nAUDITOR GENERAL DEL ESTADO.\nARTÍCULO CUARTO.- EL DELEGADO DEBERÁ INFORMAR MENSUALMENTE\nAL AUDITOR GENERAL DEL ESTADO O CUANDO ESTE LE SOLICITE, DEL\nEJERCICIO DE LAS FACULTADES QUE SE LE DELEGAN.\nUNICO.- EL PRESENTE ACUERDO ENTRARÁ EN VIGOR AL DÍA SIGUIENTE\nESTADO.\nARTURO LATABÁN LÓPEZ, AUDITOR GENERAL DEL ESTADO DE GUERRERO, EN\nLA CIUDAD DE CHILPANCINGO DE LOS BRAVO, GUERRERO, A LOS TRES DÍAS\nDEL MES DE ENERO DEL AÑO DOS MIL ONCE.\nPUBLÍQUESE Y CÚMPLASE.\nLÓPEZ, AUDITOR GENERAL DEL ESTADO DE\nGUERRERO, A FAVOR DEL LICENCIADO\nMARCO ANTONIO CRUZ MANJARREZ\nSALGADO, ENCARGADO DE LA DIRECCIÓN\nDE ASUNTOS JURÍDICOS DE LA AUDITORIA\nGENERAL DEL ESTADO\nEL SUSCRITO LICENCIADO EN DERECHO CERTIFICADO ARTURO\nLATABÁN LÓPEZ, AUDITOR GENERAL DEL ESTADO,\nQUE LAS PRESENTES COPIAS FOTOSTÁTICAS COMPUESTAS DE TRES\nFOJAS ÚTILES, ENTRESELLADAS, COTEJADAS Y RUBRICADAS, RELATIVAS AL\nACUERDO DELEGATORIO DE REPRESENTACIÓN LEGAL Y DE FACULTADES, QUE\nEMITE EL SUSCRITO A FAVOR DEL LICENCIADO MARCO ANTONIO CRUZ\nMANJARREZ SALGADO, ENCARGADO DE LA DIRECCIÓN DE ASUNTOS\nJURÍDICOS DE LA MISMA AUDITORÍA, EXPEDIDO CON FECHA TRES DE ENERO\nDE DOS MIL ONCE; CONCUERDAN FIELMENTE CON SUS ORIGINALES QUE TUVE\nA LA VISTA Y QUE OBRA EN LOS ARCHIVOS DE ESTA AUDITORÍA, LO QUE\nCERTIFICO PREVIO COTEJO, PARA LOS EFECTOS LEGALES A QUE HAYA LUGAR,\nEN LA CIUDAD DE CHILPANCINGO DE LOS BRAVO, GUERRERO, A LOS QUINCE\nDÍAS DEL MES DE MARZO DEL AÑO DOS MIL ONCE.- DOY FE.\nLIC. C. ARTURO LATABÁN LÓPEZ.\nAUDITOR GENERAL DEL ESTADO.\nRúbrica.",
  "ordenamiento": "ACUERDO",
  "jurisdiccion": "GUERRERO",
  "fuente_oficial": "DIARIO OFICIAL DE LA FEDERACION",
  "Fecha de Publicación": "12 de Abril de 2011",
  "ULTIMA REFORMA PUBLICADA": null,
  "status": "VIGENTE",
  "es_escaneado": false,
  "tiene_tablas": false,
  "materia": [
    "general"
  ]
}