{
  "titulo": "Acuerdo Parlamentario Que Fija las Reglas para el Desahogo de las Comparecencias del Secretario Gene",
  "Contenido": "SECRETARIOS DE DESPACHO Y DEL ENCARGADO\nDEL DESPACHO DE LA PROCURADURÍA GENERAL\nDE JUSTICIA DEL ESTADO\nTEXTO ORIGINAL\nAcuerdo Parlamentario publicado en el Periódico Oficial del Gobierno del Estado No. 32 Alcance\nI, el Viernes 20 de Abril de 2012.\nPODER LEGISLATIVO\nACUERDO PARLAMENTARIO QUE FIJA LAS REGLAS PARA EL DESAHOGO DE LAS\nCOMPARECENCIAS DEL SECRETARIO GENERAL DE GOBIERNO, LOS SECRETARIOS DE\nDESPACHO Y DEL ENCARGADO DEL DESPACHO DE LA PROCURADURÍA GENERAL DE\nJUSTICIA DEL ESTADO.\nGuerrero.- Poder Legislativo.\nLA QUINCUAGÉSIMA NOVENA LEGISLATURA AL HONORABLE CONGRESO DEL\nQue en sesión de fecha 17 de abril del 2012, los suscritos Diputados integrantes de la Comisión de Gobierno, presentaron la Propuesta de Acuerdo Parlamentario por el que la Quincuagésima Novena desahogo de las comparecencias del Secretario General de Gobierno, los Secretarios de Despacho y del\nEncargado del Despacho de la Procuraduría General de Justicia del Estado, en los siguientes términos:\n\"Que en cumplimiento a lo dispuesto por los artículos 43 y 74 fracción VIII de la Constitución\nGobernador Constitucional del Estado de Guerrero, por conducto de su Secretario General de Gobierno, el doce de abril del año en curso hizo entrega a esta Representación Popular del Informe escrito pormenorizado del estado que guarda la Administración Pública Estatal correspondiente al primer año de ejercicio constitucional.\nQue en sesión de esa misma fecha, el Pleno de la Quincuagésima Novena Legislatura al\nGobernador del Estado remite el Informe de Gobierno, ordenándose por el Presidente de la Mesa documento que contiene el Informe de referencia.\nSECRETARIOS DE DESPACHO Y DEL ENCARGADO\nDEL DESPACHO DE LA PROCURADURÍA GENERAL\nDE JUSTICIA DEL ESTADO\nInforme de Gobierno formulen los Diputados integrantes de la Legislatura, en cumplimiento a lo dispuesto expresa del Secretario General de Gobierno, por lo que es preciso tomar los acuerdos necesarios para que se establezcan las reglas que permitan llevar a cabo el desahogo de las comparecencias, en\nQue tomando en cuenta que este último precepto constitucional no prevé la presentación del\nProcurador General de Justicia, se estima absolutamente indispensable la asistencia del encargado de\nDespacho ante esta Alta Representación Popular para que también responda a los planteamientos que formulen los diputados sobre el informe y que sean de su exclusiva competencia, por lo que en los\nTitular del Poder Ejecutivo su anuencia para la comparecencia del mencionado servidor público.\nQue el principal objetivo de la comparecencia en sesión de los servidores públicos, es la de ampliar la información expuesta en el Informe de Gobierno entregado por el Gobernador del Estado, con el propósito de que el Congreso del Estado en uso de su facultad de vigilante de los programas gubernamentales, realice el seguimiento puntual de los asuntos de que se trate y haga las evaluaciones precisas, emitiendo resoluciones pertinentes con aportaciones que impulsen el buen desempeño de la administración pública, buscando siempre el progreso y desarrollo de la sociedad guerrerense.\nQue para poder llevar al cabo el procedimiento establecido en la fracción I del artículo 43 necesario formular las reglas a las que se sujetará la comparecencia del Secretario General de Gobierno, de los Secretarios de Despacho y del Procurador General de Justicia del Estado de Guerrero, que permitan desahogarla conforme a lo establecido en el artículo 158 de la Ley Orgánica del Poder\nLegislativo del Estado de Guerrero número 286\".\nQue vertido lo anterior, en sesión de fecha 17 de abril del 2012, la Quincuagésima Novena\nLegislatura al Honorable Congreso del Estado, aprobó por unanimidad de votos, en todos y cada uno de sus términos, la propuesta de Acuerdo Parlamentario presentada por los integrantes de la Comisión de\nGobierno.\nPor lo anteriormente expuesto y con fundamento en lo dispuesto por los artículos 47 fracción I de expide el siguiente:\nCOMPARECENCIAS DEL SECRETARIO GENERAL DE GOBIERNO, LOS SECRETARIOS DE\nJUSTICIA DEL ESTADO.\nSECRETARIOS DE DESPACHO Y DEL ENCARGADO\nDEL DESPACHO DE LA PROCURADURÍA GENERAL\nDE JUSTICIA DEL ESTADO\nSecretario General de Gobierno, los Secretarios de Despacho y del Encargado del Despacho de la\nProcuraduría General de Justicia del Estado, la apertura para su desahogo se realizará el día 24 de abril del 2012 a las 10:00 horas en las Salas Legislativas José Francisco Ruiz Massieu y José Jorge Bajos\nValverde de este Honorable Congreso del Estado, según corresponda.\nLa duración de las comparecencias será por el tiempo necesario, pudiendo los Presidentes encargados determinar los recesos que estimen pertinentes.\nSEGUNDO. El Secretario General de Gobierno, los Secretarios de Despacho y el encargado del despacho de la Procuraduría General de Justicia del Estado deberán hacer llegar a más tardar a las\n12:00 horas del día 18 de abril del 2012, al Congreso del Estado a través de su Oficialía Mayor, cincuenta tantos del informe por escrito del estado que guardan sus respectivos ramos.\nTERCERO. Las Diputadas y los Diputados integrantes de la Quincuagésima Novena Legislatura al Honorable Congreso del Estado harán llegar a la Comisión de Gobierno por conducto de la Oficialía\nMayor, las preguntas que formulen a los comparecientes, así como la información adicional que requieran, a más tardar el día 19 de abril del 2012.\nLos Diputados integrantes de la Comisión de Gobierno con la finalidad de dar dinamismo a la sesión y evitar repeticiones, clasificarán por Ramos las preguntas formuladas por las Diputadas y los\nDiputados integrantes de la Quincuagésima Novena Legislatura.\nCUARTO. El Presidente de la Comisión de Gobierno con el auxilio de la Oficialía Mayor del H.\nCongreso del Estado, remitirá a los servidores públicos las preguntas que les formularán las Diputadas y los Diputados, así como la información adicional que requieran, a más tardar el 20 de abril del 2012, por conducto del Secretario General de Gobierno.\nLos servidores públicos comparecientes harán llegar a Oficialía Mayor del H. Congreso del\nEstado, las respuestas a las preguntas formuladas, así como la información adicional solicitada, a más tardar a las 10:00 horas del día 23 de abril del 2012. El 23 de abril del 2012, la Oficialía Mayor en auxilio del Presidente de la Comisión de Gobierno, las distribuirá entre las Diputadas y los Diputados de la\nQuincuagésima Novena Legislatura que correspondan.\nQUINTO. Para el desarrollo de las comparecencias, previo acuerdo a su interior las Fracciones y\nRepresentaciones parlamentarias registrarán a más tardar a las 15:00 horas del 23 de abril, a las\nDiputadas y Diputados que participarán en la formulación de preguntas, en el control de registro que para\nEstado, especificando: la Diputada o el Diputado que formulará las preguntas por la Fracción o\nRepresentación Parlamentaria; y la Comisión de Gobierno integrará la relación con el orden de\nSECRETARIOS DE DESPACHO Y DEL ENCARGADO\nDEL DESPACHO DE LA PROCURADURÍA GENERAL\nDE JUSTICIA DEL ESTADO participación de las Diputadas y los Diputados, misma que hará llegar a la Oficialía Mayor en auxilio del\nPresidente de la Mesa Directiva.\nSEXTO. El Presidente de la Mesa Directiva del H. Congreso del Estado auxiliándose de la\nOficialía Mayor, elaborará la logística para el desarrollo de las comparecencias, previendo los espacios para situar a los servidores públicos comparecientes; el número y los lugares para el personal de apoyo de los comparecientes, para el personal de apoyo de las Diputadas y los Diputados.\nSÉPTIMO. El desahogo de las comparecencias se desarrollará bajo los siguientes lineamientos:\nI. El desarrollo de las comparecencias de los servidores públicos se hará en Comisiones\nLegislativas en base a los siguientes bloques y fechas, para desahogarse individualmente cada una de las Secretarías y el encargado de Despacho de la Procuraduría General de Justicia:\n1er bloque. Secretaia General de Gobierno, Secretaría de Seguridad Pública y Protección\nCiudadana y encargado de Despacho de la Procuraduría General de Justicia.\nSala: \"José Francisco Ruiz Massieu\"\nFecha: Martes 24 de abril, a partir de la 10:00 horas\nComisiones: De Gobierno; De Asuntos Políticos y Gobernación; De Estudios Constitucionales y\nJurídicos; De Justicia; De Seguridad Pública; De Protección Civil; De Participación Ciudadana; De\nDerechos Humanos; De Atención a Migrantes; De Transporte; Para la atención del Acceso a la\nInformación Pública y De Cultura.\nFungirá como Moderador el Presidente de la Comisión de Gobierno.\n2do bloque. Secretaría de Finanzas y Administración, Secretaría de Desarrollo Económico y\nSecretaria de Desarrollo Urbano y Obras Públicas.\nSala: \"José Francisco Ruiz Massieu\"\nFecha: Miércoles 25 de abril, a partir de la 10:00 horas\nComisiones: De Presupuesto y Cuenta Pública; De Gobierno; De Hacienda; De Desarrollo\nUrbano y Obras Públicas; De Desarrollo Económico y Trabajo; De Artesanías; De Desarrollo\nAgropecuario y Pesquero y De Vigilancia y Evaluación de la Auditoría General del Estado.\nFungirá como Moderador el Presidente de la Comisión de presupuesto y Cuenta Pública.\n3er bloque. Secretaría de Educación, Secretaría de Desarrollo Social y Secretaría de Salud.\nSala: \"José Jorge Bajos Valverde\"\nFecha: Miércoles 25 de abril, a partir de la 10:00 horas\nComisiones: De Educación, Ciencia y Tecnología; De Desarrollo Social; De Salud; De\nArtesanías; De Desarrollo Agropecuario y Pesquero y De Asuntos Indígenas.\nSECRETARIOS DE DESPACHO Y DEL ENCARGADO\nDEL DESPACHO DE LA PROCURADURÍA GENERAL\nDE JUSTICIA DEL ESTADO\nFungirá como Moderador el Presidente de la Comisión de Educación, Ciencia y\nTecnología.\n4° bloque. Secretaría de Desarrollo Rural, Secretaría de los Migrantes y Asuntos\nInternacionales, Secretaría de Asuntos Indígenas y Secretaría de Medio Ambiente.\nSala: \"José Francisco Ruiz Massieu\"\nFecha: Jueves 26 de abril, a partir de la 10:00 horas\nComisiones: De Desarrollo Agropecuario y Pesquero; De Atención a Migrantes; De Asuntos\nIndígenas y De Recursos Naturales y Desarrollo Sustentable.\nFungirá como Moderador el Presidente de la Comisión de Desarrollo Agropecuario y\nPesquero.\n5° bloque. Secretaría de Turismo, Secretaría de la Mujer y Secretaría de la Juventud.\nSala: \"José Jorge Bajos Valverde\"\nFecha: Jueves 26 de abril, a partir de la 10:00 horas\nComisiones: De Turismo; De Equidad y Género y De Asuntos de la Juventud.\nFungirá como Moderador el Presidente de la Comisión de Turismo.\nII. Cada Secretario de Despacho y el encargado del despacho de la Procuraduría General de\nJusticia en el Estado, darán lectura al documento que contenga la síntesis de sus informes, para lo cual contará hasta con un tiempo de diez minutos;\nIII. Finalizada la lectura, el Presidente Moderador abrirá las Etapas de preguntas y respuestas;\nIV. Se desahogará con la participación de la Diputada o el Diputado registrado para formular preguntas a nombre de su Fracción o Representación Parlamentaria, conforme a los siguientes términos:\na) Las Diputadas y los Diputados contarán con un tiempo de hasta diez minutos para formular sus preguntas a los comparecientes, hasta cinco minutos para su derecho de réplica y hasta tres minutos para su contrarréplica.\nb) Para facilitar el desarrollo de la sesión, las Diputadas y los Diputados deberán especificar a qué servidores públicos serán dirigidas sus preguntas.\nc) Los comparecientes contarán con el tiempo necesario para dar sus respuestas, procurando minutos en la réplica.\nV. Terminadas las etapas de preguntas, respuestas, réplicas y contrarréplicas de las comparecencias por bloque, las Fracciones y Representaciones Parlamentarias, en el orden que hayan acordado previamente al interior de la Comisión de Gobierno, contarán con un tiempo de quince minutos para fijar postura respecto de la comparecencia por Bloque de los servidores públicos.\nSECRETARIOS DE DESPACHO Y DEL ENCARGADO\nDEL DESPACHO DE LA PROCURADURÍA GENERAL\nDE JUSTICIA DEL ESTADO\nPRIMERO. El presente Acuerdo Parlamentario surtirá efectos a partir de la fecha de su expedición.\nSEGUNDO. Comuníquese al Ciudadano Ángel Heladio Aguirre Rivero, Gobernador\nConstitucional del Estado de Guerrero para su conocimiento y efectos procedentes y, en vía de solicitud, para que otorgue su anuencia y comparezca el encargado del despacho de la Procuraduría General de\nTERCERO. Hágase del conocimiento de los servidores públicos dependientes del Poder\nEjecutivo del Estado, a que se refiere este Acuerdo, por conducto del Secretario General de Gobierno.\nCUARTO. Hágase del conocimiento el presente Acuerdo Parlamentario de las Diputadas y los\nDiputados integrantes de la Quincuagésima Novena Legislatura al Honorable Congreso del Estado Libre\nQUINTO. Publíquese en el Periódico Oficial del Gobierno del Estado para su conocimiento general y efectos legales conducentes.\nDado en el Salón de Sesiones del Honorable Poder Legislativo, a los diecisiete días del mes de abril del año dos mil doce.\nDIPUTADO PRESIDENTE.\nEFRAÍN RAMOS RAMÍREZ.\nDIPUTADA SECRETARIA.\nMARÍA ANTONIETA GUZMÁN VISAIRO.\nDIPUTADO SECRETARIO.\nRAMIRO JAIMES GÓMEZ.",
  "ordenamiento": "ACUERDO",
  "jurisdiccion": "GUERRERO",
  "fuente_oficial": "DIARIO OFICIAL DE LA FEDERACION",
  "Fecha de Publicación": "26 DE ABRIL DE 2012",
  "ULTIMA REFORMA PUBLICADA": "20 de Abril de 2012",
  "status": "ABROGADA",
  "es_escaneado": false,
  "tiene_tablas": false,
  "materia": [
    "parlamentario"
  ]
}