{
  "titulo": "Acuerdo por el Que Se Da A Conocer el Factor Aplicable A la Actualización de la Tarifa para los Efec",
  "Contenido": "71 Y 72 DE LA LEY NÚMERO 419 DE HACIENDA DEL\nESTADO DE GUERRERO\nTEXTO ORIGINAL.\nACUERDO POR EL QUE SE DA A CONOCER EL FACTOR APLICABLE A LA ACTUALIZACIÓN DE\nLA TARIFA PARA LOS EFECTOS DE LOS ARTÍCULOS 70, 71 Y 72 DE LA LEY NÚMERO 419 DE\nHACIENDA DEL ESTADO DE GUERRERO.\nGuerrero.- Poder Ejecutivo.\nLICENCIADO HÉCTOR ANTONIO ASTUDILLO FLORES, GOBERNADOR CONSTITUCIONAL\nDEL ESTADO DE GUERRERO, CON FUNDAMENTO EN LOS ARTÍCULOS 90 NUMERAL 2 Y 91\nDE GUERRERO; 1, 2, 3, 6, 10, 11, 18 APARTADO A FRACCIONES I Y III, 20 FRACCIÓN III Y 22\nFRACCIÓN I, DE LA LEY ORGÁNICA DE LA ADMINISTRACIÓN PÚBLICA DEL ESTADO DE\nGUERRERO NÚMERO 08; 1o, 4o FRACCIÓN VIII, 11 FRACCIONES I Y II, 13, 18, 19 DEL CÓDIGO\nFISCAL DEL ESTADO DE GUERRERO NÚMERO 429; 70, 71 Y 72 DE LA LEY NÚMERO 419 DE\nHACIENDA DEL ESTADO DE GUERRERO, 8 DEL REGLAMENTO INTERIOR DE LA SECRETARÍA DE\nFINANZAS Y ADMINISTRACIÓN, Y\nGuerrero, la recaudación de los impuestos, derechos, productos y aprovechamientos, vigilando siempre el cumplimiento de las leyes, reglamentos y demás disposiciones de carácter fiscal vigente en la entidad, sin variar su esencia.\nQue el Código Fiscal del Estado de Guerrero número 429, en su artículo 18 segundo párrafo establece que; “... El Ejecutivo del Estado, por conducto de la Secretaría de Fianzas y Administración, podrá mediante reglas de carácter general establecer disposiciones relativas a la administración, control, formas de pago y procedimientos, sin variar las relativas al objeto, sujeto, base, tasa o tarifa del gravamen, infracciones y sanciones”.\nQue la Ley número 419 de Hacienda del Estado de Guerrero, en su artículo 70 contempla la tarifa en cantidades para el cobro del Impuesto Sobre Tenencia o Uso de Vehículos, para vehículos nuevos como son: automóviles nuevos destinados al transporte de más de 15 pasajeros o de carga, o que cuenten con placas de servicio público de transporte de pasajeros, o cuyo peso bruto vehicular sea de 15 o más toneladas, automóviles y motocicletas eléctricos que además cuenten con motor de combustión interna, embarcaciones, veleros, esquís acuáticos motorizados, motocicletas acuáticas y tablas de oleaje con motor, todos nuevos, mismo que en su penúltimo párrafo señala que dicha tarifa se actualizará en el mes de enero de cada año, aplicando el factor que se obtenga de dividir el Índice Nacional de Precios al\n71 Y 72 DE LA LEY NÚMERO 419 DE HACIENDA DEL\nESTADO DE GUERRERO entre el mes de noviembre de dos años inmediatos anteriores a dicha aplicación, el cual se publicará en el\nQue por su parte los artículos 71 y 72 de la Ley número 419 de Hacienda del Estado de Guerrero, establece tabulares del factor de cobro específicos, a vehículos usados de fabricación nacional o importados de menos o más de quince pasajeros o de carga cuyo peso bruto vehicular sea menor a quince toneladas, así como los destinados al transporte público, embarcaciones, veleros, esquí acuático motorizado, motocicleta acuática, tabla de oleaje con motor, automóviles eléctricos, motocicletas y aeronaves, además establece que las cantidades que resulten de la aplicación de los factores de cada tabla, se actualizarán en el mes de enero de cada año, aplicando el factor que se obtenga de dividir el\nÍndice Nacional de Precios al Consumidor del mes de noviembre del año inmediato anterior a aquel por el que se van aplicar los factores entre el mes de noviembre de dos años inmediatos anteriores a dicha aplicación el cual se publicará en el Periódico Oficial del Gobierno del Estado de Guerrero a más tardar el día diez de enero de cada año.\nQue en razón de lo anterior, es menester dar cumplimiento a las disposiciones en cita, por lo que, tomando en cuenta el Índice Nacional de Precios al Consumidor correspondiente al mes de noviembre de\n2017, publicado en el Diario Oficial de la Federación el 08 de diciembre del mismo año, por el Instituto\nNacional de Estadística y Geografía e Informática (INEGI) que es de 130.0440 puntos y el correspondiente al mes de noviembre de 2016 que fue de 121.9530 puntos, en cumplimiento de lo dispuesto en los artículos\n70, 71 y 72 de la Ley número 419 de Hacienda del Estado de Guerrero, es necesario determinar el factor de actualización correspondientes, aplicando la operación matemática siguiente:\n130.0440/121.9530 = 1.0663\n(Índice Nacional de Precios al Consumidor de noviembre de 2017, entre el Índice Nacional de\nPrecios al Consumidor de noviembre de 2016, da como resultado el Factor de Actualización).\nPor lo anteriormente expuesto y fundado, he tenido a bien expedir el siguiente:\nLA TARIFA PARA LOS EFECTOS DE LOS ARTÍCULOS 70, 71 Y 72 DE LA LEY NÚMERO 419 DE\nHACIENDA DEL ESTADO DE GUERRERO.\nArtículo Primero. Se determina que para el ejercicio fiscal de 2018 el factor aplicable a la que se refiere el artículo 70 de la Ley número 419 de Hacienda del Estado de Guerrero, es de:\n[130.0440/nov17/ 121.9530 nov16] = 1.0663\nDerivado de lo anterior, la tarifa para la determinación del Impuesto Sobre Tenencia o Uso de\nVehículos posterior a la actualización queda de la siguiente manera:\n71 Y 72 DE LA LEY NÚMERO 419 DE HACIENDA DEL\nESTADO DE GUERRERO\nLIMITE LIMITE CUOTA FIJA TASA PARA APLICARSE\nINFERIOR SUPERIOR $ SOBRE EL EXCEDENTE\n$ $ DEL LIMITE INFERIOR\n%\n0.00 608,492.63 0.00 3.0\n608,492.64 1’171,010.27 18,254.76 8.7\n1’171,010.28 1’574,090.63 67,193.80 13.3\n1’574,090.64 1’976,925.00 120,787.13 16.8\n1’976,925.01 En adelante 188,483.96 19.1\nArtículo Segundo. Se determina que el factor de actualización a que se refiere el último párrafo del artículo 71 de la Ley número 419 de Hacienda del Estado de Guerrero, es 1.0663 puntos, para el ejercicio fiscal 2018.\nArtículo Tercero. Se determina que el factor de actualización a que se refiere el último párrafo del artículo 72 de la Ley número 419 de Hacienda del Estado de Guerrero, es 1.0663 puntos, para el ejercicio fiscal 2018.\nPrimero. El presente Acuerdo entrará en vigor al día siguiente de su publicación en el Periódico\nOficial del Gobierno del Estado de Guerrero.\nSegundo. El presente Acuerdo tendrá vigencia del 1 de enero al 31 de diciembre del 2018.\nDado en la oficina del titular del Poder Ejecutivo, ubicada en el Edificio Centro del Palacio de\nGobierno, Boulevard René Juárez Cisneros No. 62, Colonia Ciudad de los Servicios en la Ciudad de\nChilpancingo de los Bravo, Capital del Estado de Guerrero, a los quince días del mes de diciembre del año dos mil diecisiete.\nEL GOBERNADOR CONSTITUCIONAL DEL ESTADO DE GUERRERO.\nLIC. HÉCTOR ANTONIO ASTUDILLO FLORES.\nEL SECRETARIO GENERAL DE GOBIERNO.\nLIC. FLORENCIO SALAZAR ADAME.\nEL SECRETARIO DE FINANZAS Y ADMINISTRACIÓN.\nLIC. HÉCTOR APREZA PATRÓN.",
  "ordenamiento": "ACUERDO",
  "jurisdiccion": "GUERRERO",
  "fuente_oficial": "DIARIO OFICIAL DE LA FEDERACION",
  "Fecha de Publicación": "15 de Diciembre de 2017",
  "ULTIMA REFORMA PUBLICADA": null,
  "status": "VIGENTE",
  "es_escaneado": false,
  "tiene_tablas": true,
  "materia": [
    "general"
  ]
}