{
  "titulo": "Acuerdo Mediante el Cual Se Otorgan las Condecoraciones y Premios Civiles Estatales 2014, A las Pers",
  "Contenido": "HECHO ACREEDORAS A RECIBIRLOS, DE\nCONFORMIDAD CON LA LEY DE PREMIOS CIVILES\nDEL ESTADO DE GUERRERO NÚMERO 434\nTEXTO ORIGINAL.\n07 de Noviembre de 2014.\nACUERDO MEDIANTE EL CUAL SE OTORGAN LAS CONDECORACIONES Y PREMIOS CIVILES\nESTATALES 2014, A LAS PERSONAS QUE SE HAN HECHO ACREEDORAS A RECIBIRLOS, DE\nCONFORMIDAD CON LA LEY DE PREMIOS CIVILES DEL ESTADO DE GUERRERO NÚMERO 434.\nGuerrero.- Poder Ejecutivo.\nDOCTOR SALVADOR ROGELIO ORTEGA MARTÍNEZ, GOBERNADOR DEL ESTADO LIBRE\nCONFIEREN LOS ARTÍCULOS 6o. Y 10 DE LA LEY ORGÁNICA DE LA ADMINISTRACIÓN PÚBLICA\nDEL ESTADO NÚMERO 433 Y 15 FRACCIÓN V Y 26 DE LA LEY DE PREMIOS CIVILES DEL\nESTADO, Y\nLa Ley de Premios Civiles del Estado de Guerrero, publicada en el Periódico Oficial del Gobierno del Estado número 84 de fecha 12 de octubre de 1999, contempla tres condecoraciones y quince premios y tiene por objeto determinar las normas que regulen el reconocimiento público que haga el Gobierno del los premios que en la misma se establecen.\nQue en el marco de los festejos del CLXV Aniversario de la Erección del Estado de Guerrero, los integrantes del Consejo de Premiación de las Condecoraciones y Premios Civiles Estatales 2014, a nombre del Gobierno del Estado, con fecha 1 de septiembre del año en curso, emitieron la Convocatoria a todos los ciudadanos mexicanos y extranjeros, organizaciones sociales y de profesionistas, asociaciones civiles, instituciones de educación superior, Poder Legislativo y Judicial, así como a los\nMunicipios del Estado de Guerrero, para que propusieran las candidaturas de los mejores hombres y mujeres preferentemente guerrerenses, que hubiesen destacado en las ciencias, en las artes, en la administración pública, en la defensa de los derechos humanos, en el desarrollo comunitario, en la política, en asistencia social, salud pública, en la literatura, en las bellas artes, en el deporte, en desarrollo rural y en lo ecológico, entre otros ramos; convocatoria que fue oportunamente difundida en los medios de circulación impresos y electrónicos, estatales y nacionales.\nAsimismo la Ley de Premios Civiles del Estado de Guerrero, establece que el Consejo de\nPremiación de Condecoraciones y Premios Civiles es el órgano colegiado de carácter permanente,\nHECHO ACREEDORAS A RECIBIRLOS, DE\nCONFORMIDAD CON LA LEY DE PREMIOS CIVILES\nDEL ESTADO DE GUERRERO NÚMERO 434 de Justicia del Estado, así como por el Secretario de Desarrollo Social y el Secretario General de\nGobierno, éste último quien lo presidirá.\nAl finalizar la difusión de la Convocatoria los jurados calificadores de cada premio civil, emitieron los dictámenes de los candidatos que resultaron seleccionados para ser condecorados y premiados, por lo que el Consejo de Premiación con fundamento en el artículo 15 fracción V de la Ley de la materia, los elevaron a la consideración del suscrito, para su resolución final a los merecedores de tales distinciones.\nEl día 27 de octubre del año en curso, en la ciudad y puerto de Acapulco, Guerrero, los miembros del Consejo de Premiación otorgaron en ceremonia oficial las condecoraciones y premios civiles 2014, por lo que con fundamento en el artículo 2 6 de la Ley de Premios Civiles del Estado y por lo anteriormente expuesto y fundado, he tenido a bien expedir el siguiente:\nACUERDO MEDIANTE EL CUAL SE OTORGAN LAS CONDECORACIONES Y PREMIOS CIVILES\nESTATALES 2014, A LAS PERSONAS QUE SE HAN HECHO ACREEDORAS A RECIBIRLOS, DE\nCONFORMIDAD CON LA LEY DE PREMIOS CIVILES DEL ESTADO DE GUERRERO NÚMERO 434.\nArtículo Único. Son acreedores a recibir las Condecoraciones: \"Vicente Guerrero\": C. Juan\nSánchez Andraca; Juan Álvarez\": Profra. Magdalena Beatriz Vázquez Martínez; al Mérito Indigenista\n\"Cuauhtémoc\": Mitra. Yolanda Matías García; al Mérito Municipal y Desarrollo Comunitario \"Moisés\nOchoa Campos\": M.A. Joaquín Badillo Escantilla; al Mérito en Desarrollo Rural \"Manuel Meza\nAndraca\": C. Clemencia Guevara Tejedor, al Mérito Político \"José Francisco Ruiz Massieu\": Lic. Miguel\nÁngel Mercado Durán; al Mérito Cívico \"Eduardo Neri\": Lic. Raúl Domingo Miliani Sabido: al Mérito en\nAsistencia Social y Salud Pública \"Eva Sámano de López Mateos\": Dra. Sandra Patricia Duarte\nHernández, al Mérito en Ciencia y Tecnología \"Guillermo Soberón\": Dr. Saúl López Silva; al Mérito en\nLiteratura y Bellas Artes \"Juan Ruiz de Alarcón\": Profr. Daniel Beltrán Vergara, al Mérito en Educación y\nHumanidades \"Ignacio Chávez\": Dr. José Gilberto Garza Grimaldo, al Mérito en Economía Política\n\"Plácido Garcia Reynoso\": Lic. Humberto Arrieta Ávila; al Mérito Deportivo \"Apolonio Castillo\": Atleta\nAurelia Agustín Cruz; al Mérito Juvenil \"José Azueta\": Francisco Javier Durán López; al Mérito de la\nMujer \"Antonia Nava de Catalán\": Dra. Giorgiana Karenina Martínez garnelo y Calvo y al Mérito\nEcológico \"Wilfrido Álvarez Sotelo\": C. Daniel Francisco Morales Pastor.\nPrimero. El presente Acuerdo entrará en vigor el día de su expedición.\nGuerrero, para los efectos legales correspondientes.\nBravo, Capital del Estado de Guerrero, a los tres días del mes de noviembre del año dos mil catorce.\nHECHO ACREEDORAS A RECIBIRLOS, DE\nCONFORMIDAD CON LA LEY DE PREMIOS CIVILES\nDEL ESTADO DE GUERRERO NÚMERO 434\nDR. SALVADOR ROGELIO ORTEGA MARTÍNEZ.\nEL SECRETARIO GENERAL DE GOBIERNO.\nDR. DAVID CIENFUEGOS SALGADO.",
  "ordenamiento": "ACUERDO",
  "jurisdiccion": "GUERRERO",
  "fuente_oficial": "DIARIO OFICIAL DE LA FEDERACION",
  "Fecha de Publicación": "07 de Noviembre de 2014",
  "ULTIMA REFORMA PUBLICADA": null,
  "status": "VIGENTE",
  "es_escaneado": false,
  "tiene_tablas": false,
  "materia": [
    "civil"
  ]
}