{
  "titulo": "Acuerdo de Coordinación para la Concurrencia de Recursos Federales y Estatales para la Operación de",
  "Contenido": "SOCIALES FEDERALES PARA EL DESARROLLO DE\nZONAS PRIORITARIAS, ATENCIÓN A JORNALEROS\nAGRÍCOLAS, EMPLEO TEMPORAL, OPCIONES\nPRODUCTIVAS Y 3X1 PARA MIGRANTES, TODOS\nELLOS DEL RAMO ADMINISTRATIVO 20 DESARROLLO\nSOCIAL PARA EL EJERCICIO FISCAL 2010, QUE\nSUSCRIBEN LA SECRETARÍA DE DESARROLLO SOCIAL\nY EL ESTADO DE GUERRERO\nABROGADO POR CONCLUIDA SU VIGENCIA EL 31 DE DICIEMBRE DEL AÑO\n2010.\nTEXTO ORIGINAL\nAcuerdo de Coordinación publicado en el Periódico Oficial del Gobierno del\nEstado No. 38, el Martes 11 de Mayo de 2010.\nACUERDO DE COORDINACIÓN PARA LA CONCURRENCIA DE RECURSOS\nFEDERALES Y ESTATALES PARA LA OPERACIÓN DE LOS PROGRAMAS\nSOCIALES FEDERALES PARA EL DESARROLLO DE ZONAS PRIORITARIAS,\nATENCIÓN A JORNALEROS AGRÍCOLAS, EMPLEO TEMPORAL, OPCIONES\nPRODUCTIVAS Y 3X1 PARA MIGRANTES, TODOS ELLOS DEL RAMO\nADMINISTRATIVO 20 \"DESARROLLO SOCIAL\" PARA EL EJERCICIO FISCAL 2010,\nQUE SUSCRIBEN POR UNA PARTE EL EJECUTIVO FEDERAL, A TRAVÉS DE LA\nSECRETARÍA DE DESARROLLO SOCIAL, EN LO SUCESIVO LA \"SEDESOL\",\nREPRESENTADA EN ESTE ACTO POR EL INGENIERO LUIS MEJÍA GUZMÁN, EN\nSU CARÁCTER DE SUBSECRETARIO DE DESARROLLO SOCIAL Y HUMANO, Y EL\nDELEGADO FEDERAL EN EL ESTADO, EL LICENCIADO EDDY ALBERTO\nMARTINEZ ALARCON, Y POR LA OTRA, EL EJECUTIVO DEL ESTADO DE\nGUERRERO EN LO SUCESIVO EL \"ESTADO\" REPRESENTADO POR EL\nLICENCIADO HERIBERTO MANUEL PASTRANA CRUZ, SECRETARIO DE\nDESARROLLO SOCIAL; EL LICENCIADO HUMBERTO SARMIENTO LUEBBERT,\nGENERAL DEL COPLADEG Y EL LICENCIADO ALFONSO BECERRIL ZARCO,\nCOORDINADOR GENERAL ADJUNTO DEL COPLADEG, AL TENOR DE LOS\nSIGUIENTES ANTECEDENTES Y CLÁUSULAS:\nSOCIALES FEDERALES PARA EL DESARROLLO DE\nZONAS PRIORITARIAS, ATENCIÓN A JORNALEROS\nAGRÍCOLAS, EMPLEO TEMPORAL, OPCIONES\nPRODUCTIVAS Y 3X1 PARA MIGRANTES, TODOS\nELLOS DEL RAMO ADMINISTRATIVO 20 DESARROLLO\nSOCIAL PARA EL EJERCICIO FISCAL 2010, QUE\nSUSCRIBEN LA SECRETARÍA DE DESARROLLO SOCIAL\nY EL ESTADO DE GUERRERO\nI. El Plan Nacional de Desarrollo 2007-2012, establece en su apartado denominado Eje 3. \"Igualdad de oportunidades\", que la finalidad de la política social de esta Administración es lograr el desarrollo humano y el bienestar de los mexicanos a través de la igualdad de oportunidades. Para conducir a México hacia un desarrollo económico y social sustentable hay que resolver a fondo las graves diferencias que imperan en el país. Gobierno y sociedad deben ser capaces de mejorar significativamente las condiciones de vida de quienes viven en la pobreza.\nII. El Programa Sectorial de Desarrollo Social 2007-2012, establece entre sus objetivos: Desarrollar las capacidades básicas de las personas en condición de pobreza, disminuir las disparidades regionales a través del ordenamiento territorial e infraestructura social que permita la integración de las regiones marginadas a los procesos de desarrollo y detonar las potencialidades productivas; así como abatir el rezago que enfrentan los grupos sociales vulnerables a través de estrategias de asistencia social que les permitan desarrollar sus potencialidades con independencia y plenitud.\nIII. El artículo 33 de la Ley de Planeación establece que el Ejecutivo Federal podrá convenir con los Gobiernos de las entidades federativas, satisfaciendo las formalidades que en cada caso procedan, la coordinación que se requiera a efecto de que los Gobiernos participen en la planeación nacional del desarrollo.\nIV. El artículo 30 fracción II del Decreto de Presupuesto de Egresos de la el 7 de diciembre del 2009, establece que tratándose de facultades concurrentes, cuando\nSOCIALES FEDERALES PARA EL DESARROLLO DE\nZONAS PRIORITARIAS, ATENCIÓN A JORNALEROS\nAGRÍCOLAS, EMPLEO TEMPORAL, OPCIONES\nPRODUCTIVAS Y 3X1 PARA MIGRANTES, TODOS\nELLOS DEL RAMO ADMINISTRATIVO 20 DESARROLLO\nSOCIAL PARA EL EJERCICIO FISCAL 2010, QUE\nSUSCRIBEN LA SECRETARÍA DE DESARROLLO SOCIAL\nY EL ESTADO DE GUERRERO federativas, procurará que estos se celebren en condiciones de oportunidad y certeza para beneficio de la población objetivo.\nV. De acuerdo a lo establecido en el artículo 31 del Decreto de Presupuesto de\nEgresos de la Federación para el Ejercicio Fiscal 2010, los programas de subsidios del\nRamo Administrativo 20 \"Desarrollo Social\" se destinarán, en las entidades federativas, en los términos de las disposiciones aplicables exclusivamente a la población en condiciones de pobreza, de vulnerabilidad, rezago y de marginación de acuerdo con los criterios oficiales dados a conocer por la Secretaría de Desarrollo Social, Consejo\nNacional de Población y a las evaluaciones del Consejo Nacional de Evaluación de la\nPolítica de Desarrollo Social.\nVI. La \"SEDESOL\" manifiesta que los programas sociales materia del presente\nAcuerdo de Coordinación se encuentran a cargo de la Subsecretaría de Desarrollo Social y Humano.\nCon base en lo expuesto y con fundamento en los artículos 40, 41, 43, 90, 115 y\n116 de la Constitución Política de los Estados Unidos Mexicanos; 32 de la Ley Orgánica de la Administración Pública Federal; 33, 34, 36 y 44 de la Ley de Planeación; 1, 4, 45, 54, 74, 75 y 77 de la Ley Federal de Presupuesto y Responsabilidad Hacendaria y 1, 85 y 176 de su Reglamento; 1, 4, 24, 29, 32, 39 y 43 de la Ley General de Desarrollo Social y 3 fracción III, 23, 25, 27, 40 y 41 de su Reglamento; 7 y demás aplicables de la Ley\n31 del Decreto de Presupuesto de Egresos de la Federación para el Ejercicio Fiscal\nDecreto de la Declaratoria de las Zonas de Atención Prioritaria para el año 2010, 6, 7, 17, 22, 24, 25, 36, 37, 44 y 45 del Reglamento Interior de la Secretaría de\nDesarrollo Social, en las Reglas de Operación de los Programas para el Desarrollo de\nSOCIALES FEDERALES PARA EL DESARROLLO DE\nZONAS PRIORITARIAS, ATENCIÓN A JORNALEROS\nAGRÍCOLAS, EMPLEO TEMPORAL, OPCIONES\nPRODUCTIVAS Y 3X1 PARA MIGRANTES, TODOS\nELLOS DEL RAMO ADMINISTRATIVO 20 DESARROLLO\nSOCIAL PARA EL EJERCICIO FISCAL 2010, QUE\nSUSCRIBEN LA SECRETARÍA DE DESARROLLO SOCIAL\nY EL ESTADO DE GUERRERO\nZonas Prioritarias, Atención a Jornaleros Agrícolas, Empleo Temporal, Opciones\nProductivas y 3x1 para Migrantes, así como en lo previsto por el artículo 23 de la\nSegundo del Acuerdo por el que se crea la Coordinación General del Ejecutivo del\nEstado, como una dependencia directamente adscrita a la Oficina del Gobernador, publicado en el Periódico Oficial del Gobierno del Estado de Guerrero, Número 5 de fecha 16 de enero de 2007, las partes celebran el presente Acuerdo de Coordinación en los términos de las siguientes:\nDEL OBJETO.\nPRIMERA. La \"SEDESOL\" y el \"ESTADO\" celebran el presente Acuerdo de\nCoordinación que tiene por objeto la concurrencia de recursos federales y estatales para la operación de los Programas Sociales para el Desarrollo de Zonas Prioritarias, Atención a Jornaleros Agrícolas, Empleo Temporal, Opciones Productivas y 3x1 para Migrantes, a efecto de atender a la población en condiciones de pobreza, vulnerabilidad, rezago y marginación.\nLa \"SEDESOL\" y el \"ESTADO\" se comprometen a adoptar un esquema de programas sociales aquí convenidos.\nTERRITORIOS ESPECÍFICOS.\nSOCIALES FEDERALES PARA EL DESARROLLO DE\nZONAS PRIORITARIAS, ATENCIÓN A JORNALEROS\nAGRÍCOLAS, EMPLEO TEMPORAL, OPCIONES\nPRODUCTIVAS Y 3X1 PARA MIGRANTES, TODOS\nELLOS DEL RAMO ADMINISTRATIVO 20 DESARROLLO\nSOCIAL PARA EL EJERCICIO FISCAL 2010, QUE\nSUSCRIBEN LA SECRETARÍA DE DESARROLLO SOCIAL\nY EL ESTADO DE GUERRERO\nSEGUNDA. La \"SEDESOL\" y el \"ESTADO\" promoverán que sus acciones se ejecuten en un marco de concurrencia y articulación de esfuerzos con el fin de propiciar el desarrollo de los territorios y de la población en pobreza, vulnerabilidad, rezago y marginación de la entidad, de conformidad con lo que establecen la Ley General de\nDesarrollo Social y el Decreto de Presupuesto de Egresos de la Federación para el ejercicio fiscal 2010.\nAPORTACIONES PRESUPUESTARIAS.\nTERCERA. En los Programas Sociales para el Desarrollo de Zonas Prioritarias, Atención a Jornaleros Agrícolas, Empleo Temporal y Opciones Productivas, la\n\"SEDESOL\" aportará $2.00 por cada $1.00 aportado por el \"ESTADO\", lo que equivale a un esquema 66.7% de aportación federal y 33.3% de aportación estatal.\nEn el caso del Programa 3x1 para Migrantes, la \"SEDESOL\" aportará un $1.00 por cada $1.00 aportado por el \"ESTADO\". A lo anterior se deberán añadir las aportaciones de los Migrantes y de las autoridades municipales, para cumplir el esquema financiero establecido en las Reglas de Operación del Programa.\nEn total y en el marco del presente Acuerdo de Coordinación, la \"SEDESOL\" aportará recursos por la cantidad de $129,244,459.00 (Ciento veintinueve millones doscientos cuarenta y cuatro mil cuatrocientos cincuenta y nueve pesos 00/100 M.N.).\nAnexo 1, que forma parte del presente Acuerdo de Coordinación.\nPor su parte, el \"ESTADO\" aportará recursos por la cantidad de $71,156,252.00\n(Setenta y un millones ciento cincuenta y seis mil doscientos cincuenta y dos pesos\nSOCIALES FEDERALES PARA EL DESARROLLO DE\nZONAS PRIORITARIAS, ATENCIÓN A JORNALEROS\nAGRÍCOLAS, EMPLEO TEMPORAL, OPCIONES\nPRODUCTIVAS Y 3X1 PARA MIGRANTES, TODOS\nELLOS DEL RAMO ADMINISTRATIVO 20 DESARROLLO\nSOCIAL PARA EL EJERCICIO FISCAL 2010, QUE\nSUSCRIBEN LA SECRETARÍA DE DESARROLLO SOCIAL\nY EL ESTADO DE GUERRERO\n00/100 M.N.), de conformidad con la distribución financiera y programática que se menciona en el Anexo 2, mismo que forma parte del presente Acuerdo de Coordinación.\nCUARTA. Los recursos federales que ejecute el \"ESTADO\" en los términos del presente Acuerdo de Coordinación, no pierden su carácter de federal.\nLos recursos aportados por ambas partes estarán destinados exclusivamente al otorgamiento de subsidios, y estarán sujetos a las Reglas de Operación de los programas correspondientes.\nQUINTA. La ministración de los recursos aportados por las partes se hará de conformidad al calendario presupuestario detallado en el Anexo 4, mismo que forma parte del presente Acuerdo de Coordinación.\nSEXTA. Podrán ser ejecutores de los recursos aportados por las partes, las instancias ejecutoras señaladas en las Reglas de Operación de los Programas Sociales.\nLa selección de las instancias ejecutoras se sujetará a lo siguiente:\n– En los Programas Sociales para el Desarrollo de Zonas Prioritarias, Atención a\nJornaleros Agrícolas, Empleo Temporal y Opciones Productivas, el \"ESTADO\" podrá seleccionar a las instancias ejecutoras de proyectos por el equivalente a 1.5 veces las aportaciones que efectivamente hubiere realizado. Lo anterior, en el caso de que las partes realicen sus aportaciones de acuerdo al calendario detallado en el Anexo 4, equivale a un esquema de decisión sobre la instancia ejecutora de 50% federal – 50% estatal sobre los recursos aportados conjuntamente. Para los efectos de la presente\nCláusula, se realizarán revisiones de las aportaciones efectivamente realizadas por las partes, al final de cada trimestre transcurrido.\nSOCIALES FEDERALES PARA EL DESARROLLO DE\nZONAS PRIORITARIAS, ATENCIÓN A JORNALEROS\nAGRÍCOLAS, EMPLEO TEMPORAL, OPCIONES\nPRODUCTIVAS Y 3X1 PARA MIGRANTES, TODOS\nELLOS DEL RAMO ADMINISTRATIVO 20 DESARROLLO\nSOCIAL PARA EL EJERCICIO FISCAL 2010, QUE\nSUSCRIBEN LA SECRETARÍA DE DESARROLLO SOCIAL\nY EL ESTADO DE GUERRERO\n– En el Programa 3x1 para Migrantes, se decidirá en el seno del Comité de\nValidación y Atención a Migrantes.\nEste esquema de selección aplicará exclusivamente para los Programas Sociales\nFederales y montos convenidos en el presente Acuerdo de Coordinación.\nDE LAS METAS.\nSÉPTIMA. La \"SEDESOL\" y el \"ESTADO\" acuerdan las metas consolidadas que se describen en el Anexo 3, mismo que forma parte integrante del presente Acuerdo de\nCoordinación.\nDE LAS RESPONSABILIDADES.\nOCTAVA. Los programas sociales objeto de este Acuerdo de Coordinación, se sujetarán en su instrumentación, operación, ejecución, evaluación, medición y seguimiento a lo que establece la Ley Federal de Presupuesto y Responsabilidad\nHacendaria; el Decreto de Presupuesto de Egresos de la Federación para el Ejercicio\nFiscal 2010; a las respectivas Reglas de Operación, a la demás normatividad federal\nOperación.\nLa \"SEDESOL\" y el \"ESTADO\" acuerdan que los recursos federales que no podrán ser reasignados a otros Estados.\nLas partes se comprometen a realizar sus aportaciones conforme a los tiempos, periodicidades y montos establecidos en el Anexo 4.\nSOCIALES FEDERALES PARA EL DESARROLLO DE\nZONAS PRIORITARIAS, ATENCIÓN A JORNALEROS\nAGRÍCOLAS, EMPLEO TEMPORAL, OPCIONES\nPRODUCTIVAS Y 3X1 PARA MIGRANTES, TODOS\nELLOS DEL RAMO ADMINISTRATIVO 20 DESARROLLO\nSOCIAL PARA EL EJERCICIO FISCAL 2010, QUE\nSUSCRIBEN LA SECRETARÍA DE DESARROLLO SOCIAL\nY EL ESTADO DE GUERRERO\nNOVENA. La \"SEDESOL\" y el \"ESTADO\" acuerdan que podrán proponer ampliaciones o modificaciones a la distribución de recursos entre programas, municipios y localidades, siempre y cuando se respete la regla de aportación complementaria prevista en la Cláusula Tercera. Para tal efecto, el \"ESTADO\" y el Delegado Federal de la \"SEDESOL\" deberán remitir a la Unidad Administrativa responsable del programa una propuesta técnicamente justificada; esta última la analizará y en su caso la autorizará.\nEn ningún caso se podrá modificar el monto correspondiente a las Zonas de\nAtención Prioritaria, que se señalan en el Anexo 5, sin contar con la aprobación de la\nUnidad Administrativa responsable del Programa en Oficinas Centrales de la\n\"SEDESOL\".\nAl final del ejercicio fiscal se formalizarán todas las modificaciones presupuestarias transcurridas respecto de los recursos convenidos, por medio de documento a suscribir por las instancias estatales correspondientes y la Delegación\nFederal de la \"SEDESOL\" en el Estado.\nLa ejecución de los programas de subsidios estará sustentada en propuestas de inversión, que deberán cumplir con las Reglas de Operación de los respectivos programas sociales, así como con los Lineamientos de Operación de los Programas de\nDesarrollo Social y Humano vigentes.\nDE LOS TRABAJOS DE SEGUIMIENTO, EVALUACIÓN Y CONTROL DE LOS\nRECURSOS.\nDÉCIMA. El \"ESTADO\" asume el compromiso de proporcionar a la \"SEDESOL\", por conducto de su Delegación Federal en el Estado, informes trimestrales de seguimiento de los programas objeto de este Acuerdo de Coordinación, para los proyectos, obras y acciones en que el \"ESTADO\" o alguna de sus dependencias o\nSOCIALES FEDERALES PARA EL DESARROLLO DE\nZONAS PRIORITARIAS, ATENCIÓN A JORNALEROS\nAGRÍCOLAS, EMPLEO TEMPORAL, OPCIONES\nPRODUCTIVAS Y 3X1 PARA MIGRANTES, TODOS\nELLOS DEL RAMO ADMINISTRATIVO 20 DESARROLLO\nSOCIAL PARA EL EJERCICIO FISCAL 2010, QUE\nSUSCRIBEN LA SECRETARÍA DE DESARROLLO SOCIAL\nY EL ESTADO DE GUERRERO entidades sea la instancia ejecutora. La entrega de dichos informes se hará en un plazo no mayor a veinte días naturales, contados a partir del cierre del trimestre, por conducto del Comité de Planeación para el Desarrollo del Estado de Guerrero (COPLADEG), quien será responsable de validar la información solicitada.\nCuando el responsable ejecutor sea el municipio, éste proporcionará el informe trimestral a la \"SEDESOL\" por conducto de la Delegación Federal en el Estado, en un plazo no mayor a veinte días naturales contados a partir de la conclusión de cada trimestre, enviando copia al \"ESTADO\".\nLa \"SEDESOL\", por conducto de su Delegación Federal en el Estado, asume el compromiso de proporcionar a los ejecutores que en cada caso correspondan, los lineamientos necesarios para integrar los informes.\nDÉCIMA PRIMERA. Para dar transparencia en el ejercicio de los recursos que aporten las partes objeto de este Acuerdo de Coordinación, la \"SEDESOL\" y el\n\"ESTADO\" convienen que en todas las actividades de difusión y publicidad que lleven a cabo las instancias ejecutoras sobre las obras y acciones materia de los programas aquí convenidos, apoyadas parcial o totalmente con subsidios federales, deberán mencionar logotipo de la \"SEDESOL\" y de la Estrategia Vivir Mejor en los impresos, elementos gráficos y cualquier medio de difusión que sea utilizado para tal efecto, como son letreros, mamparas, templetes, gallardetes, posters, trípticos y otros similares. Los logotipos de la \"SEDESOL\" y de la Estrategia Vivir Mejor deberán ocupar al menos, un área equivalente a la ocupada por los logotipos de las instancias locales participantes.\nConforme a la Ley General de Desarrollo Social, así como el Decreto de\nPresupuesto de Egresos de la Federación para el ejercicio fiscal 2010, la publicidad y la\nSOCIALES FEDERALES PARA EL DESARROLLO DE\nZONAS PRIORITARIAS, ATENCIÓN A JORNALEROS\nAGRÍCOLAS, EMPLEO TEMPORAL, OPCIONES\nPRODUCTIVAS Y 3X1 PARA MIGRANTES, TODOS\nELLOS DEL RAMO ADMINISTRATIVO 20 DESARROLLO\nSOCIAL PARA EL EJERCICIO FISCAL 2010, QUE\nSUSCRIBEN LA SECRETARÍA DE DESARROLLO SOCIAL\nY EL ESTADO DE GUERRERO\nNacional en los términos que establece la Ley sobre el Escudo, la Bandera y el Himno\nNacionales e incluir la siguiente leyenda \"Este programa es público, ajeno a cualquier partido político. Queda prohibido su uso para fines distintos al desarrollo social\"\nDÉCIMA SEGUNDA. El \"ESTADO\" y la \"SEDESOL\" deberán cumplir con los procedimientos normativos y fomentar la consolidación de mecanismos que apoyen la transparencia y rendición de cuentas, con la finalidad de favorecer la generación de informes; determinación de acciones, obras y seguimiento a la entrega y comprobación de recursos.\nDÉCIMA TERCERA. El control, vigilancia y evaluación de los subsidios federales a que se refiere la Cláusula Tercera del presente Acuerdo de Coordinación, corresponderá a la \"SEDESOL\"; al Consejo Nacional de Evaluación de la Política de\nDesarrollo Social en el ámbito de su competencia; a la Secretaría de Hacienda y Crédito\nPúblico; a la Secretaría de la Función Pública (SFP) y a la Auditoria Superior de la\nFederación, conforme a las atribuciones que les confiere la Ley Orgánica de la\nAdministración Pública Federal, la Ley de Fiscalización y Rendición de Cuentas de la\nFederación, la Ley Federal de Presupuesto y Responsabilidad Hacendaria y demás normatividad aplicable, sin perjuicio de las acciones de vigilancia, control y evaluación que en coordinación con la SFP realice la Contraloría del \"ESTADO\".\nDÉCIMA CUARTA. La \"SEDESOL\" se compromete a apoyar al ejecutor de cada obra o acción subsidiada por los programas objeto del presente Acuerdo, en la conformación del Comité de Contraloría Social, respectivo, asimismo se compromete a contribuir a realizar la promoción, asignación de registro y capacitación de dichos comités, por conducto de la Delegación Federal de la \"SEDESOL\" en la entidad federativa, de conformidad con lo establecido en la Ley General de Desarrollo Social, su reglamento, las Reglas de Operación del Programa que corresponda y el Acuerdo por el\nSOCIALES FEDERALES PARA EL DESARROLLO DE\nZONAS PRIORITARIAS, ATENCIÓN A JORNALEROS\nAGRÍCOLAS, EMPLEO TEMPORAL, OPCIONES\nPRODUCTIVAS Y 3X1 PARA MIGRANTES, TODOS\nELLOS DEL RAMO ADMINISTRATIVO 20 DESARROLLO\nSOCIAL PARA EL EJERCICIO FISCAL 2010, QUE\nSUSCRIBEN LA SECRETARÍA DE DESARROLLO SOCIAL\nY EL ESTADO DE GUERRERO\nSocial en los Programas Federales de Desarrollo Social, emitidos por la Secretaría de la\nFunción Pública.\nDÉCIMA QUINTA. Con el objeto de asegurar la aplicación y efectividad del presente Acuerdo de Coordinación, la \"SEDESOL\" y el \"ESTADO\" se comprometen a revisar periódicamente el cumplimiento de su contenido, así como adoptar las medidas necesarias para establecer el enlace y la comunicación requerida para dar el debido seguimiento a los compromisos asumidos.\nLas partes convienen en que la SFP podrá verificar en cualquier momento el cumplimiento de los compromisos a cargo del \"ESTADO\" en los términos del presente\nAcuerdo de Coordinación.\nESTIPULACIONES FINALES.\nDÉCIMA SEXTA. Las partes acuerdan que los recursos federales aportados en el marco del presente Acuerdo de Coordinación que al 31 de diciembre de 2010 no se hubieren ejercido por cualquier motivo, incluyendo los rendimientos que se hayan obtenido, deberán reintegrarse a la Tesorería de la Federación dentro de los 15 días naturales siguientes al cierre del ejercicio.\nDÉCIMA SÉPTIMA. La \"SEDESOL\" y el \"ESTADO\" realizarán las acciones\nCoordinación. En el evento de que se presenten casos fortuitos o de fuerza mayor que motiven el incumplimiento a lo pactado, la contraparte quedará liberada del cumplimiento de las obligaciones que le son correlativas, debiendo comunicar a la brevedad posible acuerdo.\nSOCIALES FEDERALES PARA EL DESARROLLO DE\nZONAS PRIORITARIAS, ATENCIÓN A JORNALEROS\nAGRÍCOLAS, EMPLEO TEMPORAL, OPCIONES\nPRODUCTIVAS Y 3X1 PARA MIGRANTES, TODOS\nELLOS DEL RAMO ADMINISTRATIVO 20 DESARROLLO\nSOCIAL PARA EL EJERCICIO FISCAL 2010, QUE\nSUSCRIBEN LA SECRETARÍA DE DESARROLLO SOCIAL\nY EL ESTADO DE GUERRERO\nDÉCIMA OCTAVA. El presente Acuerdo de Coordinación se podrá dar por terminado de manera anticipada por cualquiera de las siguientes causas:\n1. No cumplir en tiempo y forma con los compromisos pactados en este Acuerdo de Coordinación, sus Anexos y lo establecido en el Decreto de Presupuesto de Egresos de la Federación para el ejercicio fiscal 2010, en las Reglas de Operación de los programas respectivos y demás normatividad aplicable.\n2. La aplicación de los recursos federales a fines distintos de los pactados, y\n3. La falta de entrega de la información, reportes y demás documentación prevista en este Acuerdo de Coordinación y en los diversos instrumentos derivados del mismo.\nDÉCIMA NOVENA. En caso de incumplimiento de los términos del presente\nAcuerdo de Coordinación, atribuible al \"ESTADO\", la \"SEDESOL\", con fundamento en lo dispuesto en el Decreto de Presupuesto de Egresos de la Federación para el Ejercicio\nFiscal 2010 y en la normatividad federal aplicable, podrá suspender la ministración de recursos o bien solicitar su reintegro, escuchando previamente la opinión del gobierno del\n\"ESTADO\".\nEn el supuesto de que la \"SEDESOL\" incumpla los términos del presente\nAcuerdo de Coordinación, el \"ESTADO\", después de escuchar la opinión de la\n\"SEDESOL\", podrá suspender la aportación de sus recursos presupuestarios.\nVIGÉSIMA. Las partes manifiestan su conformidad para que, en el caso de que se susciten controversias, con motivo de la operación, la interpretación o el\nSOCIALES FEDERALES PARA EL DESARROLLO DE\nZONAS PRIORITARIAS, ATENCIÓN A JORNALEROS\nAGRÍCOLAS, EMPLEO TEMPORAL, OPCIONES\nPRODUCTIVAS Y 3X1 PARA MIGRANTES, TODOS\nELLOS DEL RAMO ADMINISTRATIVO 20 DESARROLLO\nSOCIAL PARA EL EJERCICIO FISCAL 2010, QUE\nSUSCRIBEN LA SECRETARÍA DE DESARROLLO SOCIAL\nY EL ESTADO DE GUERRERO\nVIGÉSIMA PRIMERA. El presente Acuerdo de Coordinación podrá ser revisado, adicionado o modificado por acuerdo de las partes.\nLas adiciones o modificaciones deberán ser suscritas por la partes para su constancia y validez.\nVIGÉSIMA SEGUNDA. Este Acuerdo de Coordinación y sus anexos surten sus efectos desde el día primero de enero hasta el treinta y uno de diciembre del año dos mil diez, y deberá publicarse, conforme lo establece el artículo 36 de la Ley de Planeación y el Decreto de Presupuesto de Egresos de la Federación para el Ejercicio Fiscal 2010, en el Diario Oficial de la Federación y en el Periódico Oficial del Gobierno del Estado de\nGuerrero, con el propósito de que la población conozca las acciones coordinadas entre la\nFederación y el \"Estado\".\nLeído que fue y debidamente enterados del alcance y contenido legal, se firma el\nFederal a los 15 días del mes de febrero del año dos mil diez.\nPOR \"LA SEDESOL\"\nING. LUIS MEJÍA GUZMÁN.\nSUBSECRETARIO DE DESARROLLO SOCIAL Y HUMANO.\nRúbrica.\nLIC. EDDY ALBERTO MARTINEZ ALARCON.\nDELEGADO FEDERAL DE LA \"SEDESOL\" EN EL ESTADO DE GUERRERO.\nRúbrica.\nSOCIALES FEDERALES PARA EL DESARROLLO DE\nZONAS PRIORITARIAS, ATENCIÓN A JORNALEROS\nAGRÍCOLAS, EMPLEO TEMPORAL, OPCIONES\nPRODUCTIVAS Y 3X1 PARA MIGRANTES, TODOS\nELLOS DEL RAMO ADMINISTRATIVO 20 DESARROLLO\nSOCIAL PARA EL EJERCICIO FISCAL 2010, QUE\nSUSCRIBEN LA SECRETARÍA DE DESARROLLO SOCIAL\nY EL ESTADO DE GUERRERO\nPOR \"EL ESTADO\"\nLIC. HERIBERTO MANUEL PASTRANA CRUZ.\nSECRETARIO DE DESARROLLO SOCIAL.\nRúbrica.\nLIC. HUMBERTO SARMIENTO LUEBBERT.\nCOORDINADOR GENERAL DEL EJECUTIVO DEL ESTADO Y\nCOORDINADOR GENERAL DEL COPLADEG.\nRúbrica.\nLIC. ALFONSO BECERRIL ZARCO.\nCOORDINADOR GENERAL ADJUNTO DEL COPLADEG.\nRúbrica.\n\"Este programa es público, ajeno a cualquier partido político. Queda prohibido el uso para fines distintos al desarrollo social\". Art. 28, Ley General de Desarrollo Social.\n\"Este programa es público, ajeno a cualquier partido político. Queda prohibido el uso para fines distintos a los establecidos en el programa\". Art. 29, fracción III, inciso a), Decreto de Presupuesto de Egresos de la Federación para el Ejercicio Fiscal 2010.\nSOCIALES FEDERALES PARA EL DESARROLLO DE\nZONAS PRIORITARIAS, ATENCIÓN A JORNALEROS\nAGRÍCOLAS, EMPLEO TEMPORAL, OPCIONES\nPRODUCTIVAS Y 3X1 PARA MIGRANTES, TODOS\nELLOS DEL RAMO ADMINISTRATIVO 20 DESARROLLO\nSOCIAL PARA EL EJERCICIO FISCAL 2010, QUE\nSUSCRIBEN LA SECRETARÍA DE DESARROLLO SOCIAL\nY EL ESTADO DE GUERRERO\n15\nM ETAS M ETAS M ETAS M ETAS\nPR O YEC\nM ETAS\nSOCIALES FEDERALES PARA EL DESARROLLO DE\nZONAS PRIORITARIAS, ATENCIÓN A JORNALEROS\nAGRÍCOLAS, EMPLEO TEMPORAL, OPCIONES\nPRODUCTIVAS Y 3X1 PARA MIGRANTES, TODOS\nELLOS DEL RAMO ADMINISTRATIVO 20 DESARROLLO\nSOCIAL PARA EL EJERCICIO FISCAL 2010, QUE\nSUSCRIBEN LA SECRETARÍA DE DESARROLLO SOCIAL\nY EL ESTADO DE GUERRERO\n16\n74,437,822.00 93 10,454,438.00 48 2,354,844.00 34,059 6,299,279.00 81,630 907 9,030,134.00 9 0 3 60 102,576,517.00 M U N IC IPIO S\n18,609,456.00 23 2,613,609.00 12 - 1,574,820.00 20,430 227 3,870,057.00 3 8 1 52 26,667,942.00 O TR O S M U N IC IPIO S/3\nTO TA L 93,047,278.00 116 13,068,047.00 60 2,354,844.00 34,059 7,874,099.00 1 02,060 1,134 12,900,191.00 1 28 512 129,244,459.00\n* Para la aplicación de los recursos Federales y Estatales de los Program as de D esarrollo Social y H um ano, la D elegación de la SED ESO L y G obierno del Estado en coordinación planearán las obras prioritarias y acciones considerando la distribucion regional de recursos propuesta en este anexo.\n1/ Se refiere a los m unicipios de M uy Alta y Alta M arginación (Zonas de Atención Prioritaria), de acuerdo con la clasificación que hace el C onsejo N acional de Población (C O N APO) y conform e los C riterios de R esultados para la D eterm inación de las Zonas de\nAtención Prioritaria, establecidos por el C O N EVAL.\n2/ Los M unicipios Predom inantem ente Indígenas (M PI) se definen com o aquellos que registran 40 % y m ás de población m ayor de cinco años com o hablantes de lengua indígena (H LI). El grupo al que se refiere el apartado son todos aquellos M PI con grados de\nLa S edesol y el E stado, por conducto de sus representantes, m anifiestan que una vez suscrito el presente A nexo por las instancias federal y estatal, podrán iniciar el ejercicio de los recursos para los program as aquí establecidos, sin fiscal 2010.\n“E ste program a es público, ajeno a cualquier partido político. Q ueda prohibido el uso para fines distintos al desarrollo social”. A rt. 28, Ley G eneral de D esarrollo S ocial.\n“E ste program a es público, ajeno a cualquier partido político. Q ueda prohibido el uso para fines distintos a los establecidos en el program a”. A rt. 29, fracción III, inciso a), D ecreto de P resupuesto de E gresos de la Federación para el\nE jercicio Fiscal 2010.\nSOCIALES FEDERALES PARA EL DESARROLLO DE\nZONAS PRIORITARIAS, ATENCIÓN A JORNALEROS\nAGRÍCOLAS, EMPLEO TEMPORAL, OPCIONES\nPRODUCTIVAS Y 3X1 PARA MIGRANTES, TODOS\nELLOS DEL RAMO ADMINISTRATIVO 20 DESARROLLO\nSOCIAL PARA EL EJERCICIO FISCAL 2010, QUE\nSUSCRIBEN LA SECRETARÍA DE DESARROLLO SOCIAL\nY EL ESTADO DE GUERRERO\n17\n37,218,911.00 46 10,454,438.00 48 1,177,422.00 17,029 3,149,639.00 40,860 454 4,515,067.00 4 5 1 80 56,515,477.00 M U N IC IPIO S\n9,304,728.00 12 2,613,609.00 12 - 7 87,410.00 10,170 113 1,935,028.00 1 9 7 6 14,640,775.00 O TR O S M U N IC IPIO S/3\nTO TA L 46,523,639.00 58 13,068,047.00 60 1,177,422.00 17,029 3,937,049.00 51,030 567 6,450,095.00 6 4 256 71,156,252.00\n* Para la aplicación de los recursos Federales y Estatales de los Program as de D esarrollo Social y H um ano, la D elegación de la SED ESO L y G obierno del Estado en coordinación planearán las obras prioritarias y acciones considerando la distribucion regional de recursos propuesta en este anexo.\n1/ Se refiere a los m unicipios de M uy Alta y Alta M arginación (Zonas de Atención Prioritaria), de acuerdo con la clasificación que hace el C onsejo N acional de Población (C O N APO) y conform e los C riterios de R esultados para la D eterm inación de las Zonas de\nAtención Prioritaria, establecidos por el C O N EVAL.\n2/ Los M unicipios Predom inantem ente Indígenas (M PI) se definen com o aquellos que registran 40 % y m ás de población m ayor de cinco años com o hablantes de lengua indígena (H LI). El grupo al que se refiere el apartado son todos aquellos M PI con grados de\nLa S edesol y el E stado, por conducto de sus representantes, m anifiestan que una vez suscrito el presente A nexo por las instancias federal y estatal, podrán iniciar el ejercicio de los recursos para los program as aquí establecidos, sin fiscal 2010.\n“E ste program a es público, ajeno a cualquier partido político. Q ueda prohibido el uso para fines distintos al desarrollo social”. A rt. 28, Ley G eneral de D esarrollo S ocial.\n“E ste program a es público, ajeno a cualquier partido político. Q ueda prohibido el uso para fines distintos a los establecidos en el program a”. A rt. 29, fracción III, inciso a), D ecreto de P resupuesto de E gresos de la Federación para el\nE jercicio Fiscal 2010.\nSOCIALES FEDERALES PARA EL DESARROLLO DE\nZONAS PRIORITARIAS, ATENCIÓN A JORNALEROS\nAGRÍCOLAS, EMPLEO TEMPORAL, OPCIONES\nPRODUCTIVAS Y 3X1 PARA MIGRANTES, TODOS\nELLOS DEL RAMO ADMINISTRATIVO 20 DESARROLLO\nSOCIAL PARA EL EJERCICIO FISCAL 2010, QUE\nSUSCRIBEN LA SECRETARÍA DE DESARROLLO SOCIAL\nY EL ESTADO DE GUERRERO\nSECRETARÍA DE DESARROLLO SOCIAL\nACUERDO DE COORDINACIÓN PARA LA CONCURRENCIA DE RECURSOS FEDERALES Y ESTATALES\nPARA LA OPERACIÓN DE LOS PROGRAMAS SOCIALES FEDERALES DEL RAMO ADMINISTRATIVO 20 “DESARROLLO SOCIAL”\nCONSOLIDADO DE INVERSIÓN Y METAS FEDERALES Y ESTATALES EJERCICIO FISCAL 2010\nESTADO DE: GUERRERO ANEXO 3\nDESARROLLO DE ZONAS\nREGIONALIZACIÓN PRIORITARIAS 3 x 1 PARA MIGRANTES JORNALEROS AGRÍCOLAS EMPLEO TEMPORAL OPCIONES PRODUCTIVAS TOTAL\nINVERSIÓN METAS INVERSIÓN METAS INVERSIÓN METAS INVERSIÓN METAS INVERSIÓN METAS\nPROYECTO PROYECTO PERSONA JORNAL EMPLEO PROYECTO PERSONA\nMUNICIPIOS DE MUY ALTA Y\nALTA MARGINACIÓN/1 Y\nMUNICIPIOS 1 11,656,733.00 139 2 0,908,876.00 48 3,532,266.00 51,088 9,448,918.00 1 22,490 1,361 1 3,545,201.00 1 35 5 40 159,091,994.00\nPREDOMINANTEMENTE\nINDÍGENAS/2\nOTROS MUNICIPIOS/3 2 7,914,184.00 35 5,227,218.00 12 - - 2,362,230.00 30,600 340 5,805,085.00 5 7 2 28 41,308,717.00\nTOTAL 139,570,917.00 174 26,136,094.00 60 3,532,266.00 51,088 11,811,148.00 1 53,090 1,701 19,350,286.00 1 92 768 200,400,711.00\nOBSERVACIONES\n* Para la aplicación de los recursos Federales y Estatales de los Programas de Desarrollo Social y Humano, la Delegación de la SEDESOL y Gobierno del Estado en coordinación planearán las obras prioritarias y acciones considerando la distribucion regional de recursos propuesta en este anexo.\n1/ Se refiere a los municipios de Muy Alta y Alta Marginación (Zonas de Atención Prioritaria), de acuerdo con la clasificación que hace el Consejo Nacional de Población (CONAPO) y conforme los Criterios de Resultados para la Determinación de las Zonas de\nAtención Prioritaria, establecidos por el CONEVAL.\n2/ Los Municipios Predominantemente Indígenas (MPI) se definen como aquellos que registran 40 % y más de población mayor de cinco años como hablantes de lengua indígena (HLI). El grupo al que se refiere el apartado son todos aquellos MPI con grados de marginación diferente a alta y muy alta.\n3/ En \"Otros Municipios\" se incluyen las localidades de alta y muy alta marginación ubicadas en municipios de marginación media, baja y muy baja. Los recursos federales no incluyen gastos de operación de SEDESOL.\nLa Sedesol y el Estado, por conducto de sus representantes, manifiestan que una vez suscrito el presente Anexo por las instancias federal y estatal, podrán iniciar el ejercicio de los recursos para los programas aquí establecidos, sin perjuicio de la formalización del Acuerdo de Coordinación para la Concurrencia de Recursos Federales y Estatales para la operación de los Programas Sociales Federales del Ramo Administrativo 20 “Desarrollo Social” para el ejercicio fiscal 2010.\nLIC. EDDY ALBERTO MARTINEZ ALARCON LIC. ALFONSO BECERRIL ZARCO\n“Este programa es público, ajeno a cualquier partido político. Queda prohibido el uso para fines distintos al desarrollo social”. Art. 28, Ley General de Desarrollo Social.\n“Este programa es público, ajeno a cualquier partido político. Queda prohibido el uso para fines distintos a los establecidos en el programa”. Art. 29, fracción III, inciso a), Decreto de Presupuesto de Egresos de la Federación para el\nEjercicio Fiscal 2010.\nSOCIALES FEDERALES PARA EL DESARROLLO DE\nZONAS PRIORITARIAS, ATENCIÓN A JORNALEROS\nAGRÍCOLAS, EMPLEO TEMPORAL, OPCIONES\nPRODUCTIVAS Y 3X1 PARA MIGRANTES, TODOS\nELLOS DEL RAMO ADMINISTRATIVO 20 DESARROLLO\nSOCIAL PARA EL EJERCICIO FISCAL 2010, QUE\nSUSCRIBEN LA SECRETARÍA DE DESARROLLO SOCIAL\nY EL ESTADO DE GUERRERO\nSECRETARÍA DE DESARROLLO SOCIAL\nACUERDO DE COORDINACIÓN PARA LA CONCURRENCIA DE RECURSOS FEDERALES Y ESTATALES\nPARA LA OPERACIÓN DE LOS PROGRAMAS SOCIALES FEDERALES DEL RAMO ADMINISTRATIVO 20 “DESARROLLO SOCIAL”\nCALENDARIO DE MINISTRACIÓN DE RECURSOS FEDERALES Y ESTATALES - EJERCICIO FISCAL 2010\nESTADO DE: GUERRERO ANEXO 4\nENERO FEBRERO MARZO ABRIL MAYO JUNIO JULIO AGOSTO SEPTIEMBRE OCTUBRE NOVIEMBRE DICIEMBRE TOTAL\nAPORTACIÓN FEDERAL 0.00 7,776,900.20 8,389,824.20 24,692,435.10 13,569,455.45 25,857,284.60 24,968,397.85 12,924,445.90 10,830,231.30 235,484.40 0.00 0.00 129,244,459.00\nAPORTACIÓN ESTATAL 0.00 4,215,151.15 4,194,912.00 13,653,022.10 7,438,129.95 13,908,745.65 13,791,003.45 7,115,625.20 6,721,920.30 117,742.20 0.00 0.00 71,156,252.00\nRECURSOS TOTALES 0.00 11,992,051.35 12,584,736.20 38,345,457.20 21,007,585.40 39,766,030.25 38,759,401.30 20,040,071.10 17,552,151.60 353,226.60 0.00 0.00 200,400,711.00\nDESARROLLO DE ZONAS PRIORITARIAS\nAPORTACIÓN FEDERAL 0.00 4,652,363.90 4,652,363.90 18,609,455.60 9,304,727.80 18,609,455.60 18,609,455.60 9,304,727.80 9,304,727.80 0.00 0.00 0.00 93,047,278.00\nAPORTACIÓN ESTATAL 0.00 2,326,181.95 2,326,181.95 9,304,727.80 4,652,363.90 9,304,727.80 9,304,727.80 4,652,363.90 4,652,363.90 0.00 0.00 0.00 46,523,639.00\nSUBTOTAL PROGRAMA 0.00 6,978,545.85 6,978,545.85 27,914,183.40 13,957,091.70 27,914,183.40 27,914,183.40 13,957,091.70 13,957,091.70 0.00 0.00 0.00 139,570,917.00\n3x1 PARA MIGRANTES\nAPORTACIÓN FEDERAL 0.00 653,402.35 1,306,804.70 2,613,609.40 1,306,804.70 3,267,011.75 2,613,609.40 1,306,804.70 0.00 0.00 0.00 0.00 13,068,047.00\nAPORTACIÓN ESTATAL 0.00 653,402.35 653,402.35 2,613,609.40 1,306,804.70 2,613,609.40 2,613,609.40 1,306,804.70 1,306,804.70 0.00 0.00 0.00 13,068,047.00\nSUBTOTAL PROGRAMA 0.00 1,306,804.70 1,960,207.05 5,227,218.80 2,613,609.40 5,880,621.15 5,227,218.80 2,613,609.40 1,306,804.70 0.00 0.00 0.00 26,136,094.00\nATENCIÓN A JORNALEROS AGRÍCOLAS\nAPORTACIÓN FEDERAL 0.00 0.00 353,226.60 353,226.60 235,484.40 470,968.80 235,484.40 235,484.40 235,484.40 235,484.40 0.00 0.00 2,354,844.00\nAPORTACIÓN ESTATAL 0.00 0.00 176,613.30 176,613.30 117,742.20 235,484.40 117,742.20 117,742.20 117,742.20 117,742.20 0.00 0.00 1,177,422.00\nSUBTOTAL PROGRAMA 0.00 0.00 529,839.90 529,839.90 353,226.60 706,453.20 353,226.60 353,226.60 353,226.60 353,226.60 0.00 0.00 3,532,266.00\nEMPLEO TEMPORAL\nAPORTACIÓN FEDERAL 0.00 1,181,114.85 787,409.90 1,181,114.85 787,409.90 1,574,819.80 1,574,819.80 787,409.90 0.00 0.00 0.00 0.00 7,874,099.00\nAPORTACIÓN ESTATAL 0.00 590,557.35 393,704.90 590,557.35 393,704.90 787,409.80 787,409.80 393,704.90 0.00 0.00 0.00 0.00 3,937,049.00\nSUBTOTAL PROGRAMA 0.00 1,771,672.20 1,181,114.80 1,771,672.20 1,181,114.80 2,362,229.60 2,362,229.60 1,181,114.80 0.00 0.00 0.00 0.00 11,811,148.00\nOPCIONES PRODUCTIVAS\nAPORTACIÓN FEDERAL 0.00 1,290,019.10 1,290,019.10 1,935,028.65 1,935,028.65 1,935,028.65 1,935,028.65 1,290,019.10 1,290,019.10 0.00 0.00 0.00 12,900,191.00\nAPORTACIÓN ESTATAL 0.00 645,009.50 645,009.50 967,514.25 967,514.25 967,514.25 967,514.25 645,009.50 645,009.50 0.00 0.00 0.00 6,450,095.00\nSUBTOTAL PROGRAMA 0.00 1,935,028.60 1,935,028.60 2,902,542.90 2,902,542.90 2,902,542.90 2,902,542.90 1,935,028.60 1,935,028.60 0.00 0.00 0.00 19,350,286.00\nLa Sedesol y el Estado, por conducto de sus representantes, manifiestan que una vez suscrito el presente Anexo por las instancias federal y estatal, podrán iniciar el ejercicio de los recursos para los programas aquí establecidos, sin perjuicio de la formalización del Acuerdo de Coordinación para la\nConcurrencia de Recursos Federales y Estatales para la operación de los Programas Sociales Federales del Ramo Administrativo 20 “Desarrollo Social” para el ejercicio fiscal 2010.\nLIC. EDDY ALBERTO MARTINEZ ALARCON\nLIC. ALFONSO BECERRIL ZARCO\n“Este programa es público, ajeno a cualquier partido político. Queda prohibido el uso para fines distintos al desarrollo social”. Art. 28, Ley General de Desarrollo Social.\n“Este programa es público, ajeno a cualquier partido político. Queda prohibido el uso para fines distintos a los establecidos en el programa”. Art. 29, fracción III, inciso a), Decreto de Presupuesto de Egresos de la Federación para el Ejercicio Fiscal 2010.\nSOCIALES FEDERALES PARA EL DESARROLLO DE\nZONAS PRIORITARIAS, ATENCIÓN A JORNALEROS\nAGRÍCOLAS, EMPLEO TEMPORAL, OPCIONES\nPRODUCTIVAS Y 3X1 PARA MIGRANTES, TODOS\nELLOS DEL RAMO ADMINISTRATIVO 20 DESARROLLO\nSOCIAL PARA EL EJERCICIO FISCAL 2010, QUE\nSUSCRIBEN LA SECRETARÍA DE DESARROLLO SOCIAL\nY EL ESTADO DE GUERRERO\nEstado: Guerrero\nCriterios para la priorización de las inversiones del Ramo Administrativo 20.\nMunicipios de Muy Alta Marginación\n{\"tabla_1\":{\"columnas\":[\"No.\",\"Clave del\\nmunicipio\",\"Nombre del municipio\",\"Población\\ntotal\",\"(sin encabezado)\",\"Lugar que\",\"(sin encabezado)\",\"Región\"],\"filas\":[{\"columna_1\":\"(sin dato)\",\"columna_2\":\"(sin dato)\",\"columna_3\":\"(sin dato)\",\"columna_4\":\"(sin dato)\",\"columna_5\":\"(sin dato)\",\"columna_6\":\"ocupa en el\",\"columna_7\":\"(sin dato)\",\"columna_8\":\"(sin dato)\"},{\"columna_1\":\"(sin dato)\",\"columna_2\":\"(sin dato)\",\"columna_3\":\"(sin dato)\",\"columna_4\":\"(sin dato)\",\"columna_5\":\"(sin dato)\",\"columna_6\":\"contexto\",\"columna_7\":\"(sin dato)\",\"columna_8\":\"(sin dato)\"},{\"columna_1\":\"(sin dato)\",\"columna_2\":\"(sin dato)\",\"columna_3\":\"(sin dato)\",\"columna_4\":\"(sin dato)\",\"columna_5\":\"(sin dato)\",\"columna_6\":\"nacional\",\"columna_7\":\"(sin dato)\",\"columna_8\":\"(sin dato)\"},{\"columna_1\":\"1\",\"columna_2\":\"12078\",\"columna_3\":\"Cochoapa el Grande*\",\"columna_4\":\"15,572\",\"columna_5\":\"1\",\"columna_6\":\"(sin dato)\",\"columna_7\":\"(sin dato)\",\"columna_8\":\"Mixteca\"},{\"columna_1\":\"2\",\"columna_2\":\"12076\",\"columna_3\":\"Acatepec*\",\"columna_4\":\"28,525\",\"columna_5\":\"5\",\"columna_6\":\"(sin dato)\",\"columna_7\":\"(sin dato)\",\"columna_8\":\"Mixteca\"},{\"columna_1\":\"3\",\"columna_2\":\"12043\",\"columna_3\":\"Metlatónoc*\",\"columna_4\":\"17,398\",\"columna_5\":\"6\",\"columna_6\":\"(sin dato)\",\"columna_7\":\"(sin dato)\",\"columna_8\":\"Mixteca\"},{\"columna_1\":\"4\",\"columna_2\":\"12079\",\"columna_3\":\"José Joaquín de Herrera*\",\"columna_4\":\"14,424\",\"columna_5\":\"9\",\"columna_6\":\"(sin dato)\",\"columna_7\":\"(sin dato)\",\"columna_8\":\"Centro\"},{\"columna_1\":\"5\",\"columna_2\":\"12062\",\"columna_3\":\"Tlacoachistlahuaca*\",\"columna_4\":\"18,055\",\"columna_5\":\"16\",\"columna_6\":\"(sin dato)\",\"columna_7\":\"(sin dato)\",\"columna_8\":\"Mixteca\"},{\"columna_1\":\"6\",\"columna_2\":\"12010\",\"columna_3\":\"Atlixtac*\",\"columna_4\":\"23,371\",\"columna_5\":\"20\",\"columna_6\":\"(sin dato)\",\"columna_7\":\"(sin dato)\",\"columna_8\":\"Mixteca\"},{\"columna_1\":\"7\",\"columna_2\":\"12020\",\"columna_3\":\"Copanatoyac*\",\"columna_4\":\"17,337\",\"columna_5\":\"21\",\"columna_6\":\"(sin dato)\",\"columna_7\":\"(sin dato)\",\"columna_8\":\"Mixteca\"},{\"columna_1\":\"8\",\"columna_2\":\"12071\",\"columna_3\":\"Xochistlahuaca*\",\"columna_4\":\"25,180\",\"columna_5\":\"23\",\"columna_6\":\"(sin dato)\",\"columna_7\":\"(sin dato)\",\"columna_8\":\"Mixteca\"},{\"columna_1\":\"9\",\"columna_2\":\"12063\",\"columna_3\":\"Tlacoapa*\",\"columna_4\":\"8,733\",\"columna_5\":\"24\",\"columna_6\":\"(sin dato)\",\"columna_7\":\"(sin dato)\",\"columna_8\":\"Mixteca\"},{\"columna_1\":\"10\",\"columna_2\":\"12004\",\"columna_3\":\"Alcozauca de Guerrero*\",\"columna_4\":\"16,237\",\"columna_5\":\"25\",\"columna_6\":\"(sin dato)\",\"columna_7\":\"(sin dato)\",\"columna_8\":\"Mixteca\"},{\"columna_1\":\"11\",\"columna_2\":\"12016\",\"columna_3\":\"Coahuayutla de José María Izazaga\",\"columna_4\":\"13,291\",\"columna_5\":\"27\",\"columna_6\":\"(sin dato)\",\"columna_7\":\"(sin dato)\",\"columna_8\":\"Tierra Caliente\"},{\"columna_1\":\"12\",\"columna_2\":\"12069\",\"columna_3\":\"Xalpatláhuac*\",\"columna_4\":\"12,615\",\"columna_5\":\"28\",\"columna_6\":\"(sin dato)\",\"columna_7\":\"(sin dato)\",\"columna_8\":\"Mixteca\"},{\"columna_1\":\"13\",\"columna_2\":\"12047\",\"columna_3\":\"Pedro Ascencio Alquisiras\",\"columna_4\":\"6,987\",\"columna_5\":\"33\",\"columna_6\":\"(sin dato)\",\"columna_7\":\"(sin dato)\",\"columna_8\":\"Tierra Caliente\"},{\"columna_1\":\"14\",\"columna_2\":\"12072\",\"columna_3\":\"Zapotitlán Tablas*\",\"columna_4\":\"9,601\",\"columna_5\":\"35\",\"columna_6\":\"(sin dato)\",\"columna_7\":\"(sin dato)\",\"columna_8\":\"Mixteca\"},{\"columna_1\":\"15\",\"columna_2\":\"12054\",\"columna_3\":\"San Miguel Totolapan\",\"columna_4\":\"27,033\",\"columna_5\":\"45\",\"columna_6\":\"(sin dato)\",\"columna_7\":\"(sin dato)\",\"columna_8\":\"Tierra Caliente\"},{\"columna_1\":\"16\",\"columna_2\":\"12081\",\"columna_3\":\"Iliatenco*\",\"columna_4\":\"10,039\",\"columna_5\":\"47\",\"columna_6\":\"(sin dato)\",\"columna_7\":\"(sin dato)\",\"columna_8\":\"Mixteca\"},{\"columna_1\":\"17\",\"columna_2\":\"12019\",\"columna_3\":\"Copalillo*\",\"columna_4\":\"13,747\",\"columna_5\":\"48\",\"columna_6\":\"(sin dato)\",\"columna_7\":\"(sin dato)\",\"columna_8\":\"Mixteca\"},{\"columna_1\":\"18\",\"columna_2\":\"12041\",\"columna_3\":\"Malinaltepec*\",\"columna_4\":\"26,613\",\"columna_5\":\"50\",\"columna_6\":\"(sin dato)\",\"columna_7\":\"(sin dato)\",\"columna_8\":\"Mixteca\"},{\"columna_1\":\"19\",\"columna_2\":\"12002\",\"columna_3\":\"Ahuacuotzingo\",\"columna_4\":\"23,026\",\"columna_5\":\"51\",\"columna_6\":\"(sin dato)\",\"columna_7\":\"(sin dato)\",\"columna_8\":\"Centro\"},{\"columna_1\":\"20\",\"columna_2\":\"12032\",\"columna_3\":\"General Heliodoro Castillo\",\"columna_4\":\"34,554\",\"columna_5\":\"62\",\"columna_6\":\"(sin dato)\",\"columna_7\":\"(sin dato)\",\"columna_8\":\"Centro\"},{\"columna_1\":\"21\",\"columna_2\":\"12009\",\"columna_3\":\"Atlamajalcingo del Monte*\",\"columna_4\":\"5,143\",\"columna_5\":\"69\",\"columna_6\":\"(sin dato)\",\"columna_7\":\"(sin dato)\",\"columna_8\":\"Mixteca\"},{\"columna_1\":\"22\",\"columna_2\":\"12052\",\"columna_3\":\"San Luis Acatlán*\",\"columna_4\":\"41,884\",\"columna_5\":\"80\",\"columna_6\":\"(sin dato)\",\"columna_7\":\"(sin dato)\",\"columna_8\":\"Costa Chica\"}]}}\nSOCIALES FEDERALES PARA EL DESARROLLO DE\nZONAS PRIORITARIAS, ATENCIÓN A JORNALEROS\nAGRÍCOLAS, EMPLEO TEMPORAL, OPCIONES\nPRODUCTIVAS Y 3X1 PARA MIGRANTES, TODOS\nELLOS DEL RAMO ADMINISTRATIVO 20 DESARROLLO\nSOCIAL PARA EL EJERCICIO FISCAL 2010, QUE\nSUSCRIBEN LA SECRETARÍA DE DESARROLLO SOCIAL\nY EL ESTADO DE GUERRERO\n23 12074 Zitlala* 19,718 94 Centro\n24 12045 Olinalá 22,437 136 Mixteca\n25 12042 Mártir de Cuilapan* 15,272 154 Centro\n26 12012 Ayutla de los Libres 55,974 175 Costa Chica\n27 12028 Chilapa de Álvarez 105,146 180 Centro\n28 12051 Quechultenango 33,367 181 Centro\n29 12073 Zirándaro 20,053 193 Tierra Caliente\n30 12003 Ajuchitlán del Progreso 37,475 227 Tierra Caliente\n31 12036 Igualapa 10,312 251 Costa Chica\n32 12025 Cuautepec 14,554 275 Costa Chica\n33 12080 Juchitán 6,240 290 Costa Chica\n34 12031 General Canuto A. Neri 6,394 307 Tierra Caliente\n35 12024 Cualác 6,816 348 Mixteca\n36 12026 Cuetzala del Progreso 8,876 350 Tierra Caliente\n37 12013 Azoyú 13,448 354 Costa Chica\nMunicipios de Alta Marginación\nLugar que\nClave del Población ocupa en el\nNo. Nombre del municipio Región municipio total contexto nacional\n38 12053 San Marcos 44,959 366\n39 12022 Coyuca de Catalán 41,975 382 Tierra Caliente\n40 12056 Tecoanapa 42,619 397\n41 12008 Atenango del Río 7,648 399\n42 12046 Ometepec 55,283 437\n43 12065 Tlalixtaquilla de Maldonado 6,534 470 Mixteca\n44 12060 Tetipac 12,702 512\n45 12070 Xochihuehuetlán 7,005 554 Mixteca\n46 12040 Leonardo Bravo 22,982 566\nSOCIALES FEDERALES PARA EL DESARROLLO DE\nZONAS PRIORITARIAS, ATENCIÓN A JORNALEROS\nAGRÍCOLAS, EMPLEO TEMPORAL, OPCIONES\nPRODUCTIVAS Y 3X1 PARA MIGRANTES, TODOS\nELLOS DEL RAMO ADMINISTRATIVO 20 DESARROLLO\nSOCIAL PARA EL EJERCICIO FISCAL 2010, QUE\nSUSCRIBEN LA SECRETARÍA DE DESARROLLO SOCIAL\nY EL ESTADO DE GUERRERO\nLugar que\nClave del Población ocupa en el\nNo. Nombre del municipio Región municipio total contexto nacional\n47 12027 Cutzamala de Pinzón 20,730 598 Tierra Caliente\n48 12023 Cuajinicuilapa 23,537 615\n49 12064 Tlalchapa 11,286 624 Tierra Caliente\n50 12044 Mochitlán 10,709 649\n51 12068 La Unión de Isidoro Montes de Oca 25,230 688\n52 12030 Florencio Villarreal 18,713 714\n53 12066 Tlapa de Comonfort* 65,763 719 Mixteca\n54 12059 Tepecoacuilco de Trujano 28,989 738\n55 12037 Ixcateopan de Cuauhtémoc 6,104 746\n56 12021 Coyuca de Benítez 69,064 780\n57 12077 Marquelia 11,801 796\n58 12058 Teloloapan 51,659 802 Tierra Caliente\n59 12018 Copala 11,896 805\n60 12006 Apaxtla 12,381 917\n61 12011 Atoyac de Álvarez 58,452 932\n62 12017 Cocula 13,884 936\n63 12039 Juan R. Escudero 22,805 953\n64 12075 Eduardo Neri 40,328 990 Centro\n65 12067 Tlapehuala 20,989 997 Tierra Caliente\n66 12005 Alpoyeca 5,848 1006 Mixteca\n67 12049 Pilcaya 11,035 1048\n68 12034 Huitzuco de los Figueroa 35,055 1093\n69 12033 Huamuxtitlán 13,806 1100 Mixteca\n70 12007 Arcelia 31,401 1116 Tierra Caliente\n71 12057 Técpan de Galeana 57,848 1137\n72 12061 Tixtla de Guerrero 37,300 1184\n73 12048 Petatlán 44,485 1190\nSOCIALES FEDERALES PARA EL DESARROLLO DE\nZONAS PRIORITARIAS, ATENCIÓN A JORNALEROS\nAGRÍCOLAS, EMPLEO TEMPORAL, OPCIONES\nPRODUCTIVAS Y 3X1 PARA MIGRANTES, TODOS\nELLOS DEL RAMO ADMINISTRATIVO 20 DESARROLLO\nSOCIAL PARA EL EJERCICIO FISCAL 2010, QUE\nSUSCRIBEN LA SECRETARÍA DE DESARROLLO SOCIAL\nY EL ESTADO DE GUERRERO\nMunicipios de Media Marginación\n{\"tabla_2\":{\"columnas\":[\"No.\",\"Clave del\\nmunicipio\",\"Nombre del municipio\",\"Población\\ntotal\",\"Lugar que ocupa\\nen el contexto\\nnacional\"],\"filas\":[{\"columna_1\":\"74\",\"columna_2\":\"12014\",\"columna_3\":\"Benito Juárez\",\"columna_4\":\"14,444\",\"columna_5\":\"1446\"},{\"columna_1\":\"75\",\"columna_2\":\"12055\",\"columna_3\":\"Taxco de Alarcón\",\"columna_4\":\"98,854\",\"columna_5\":\"1601\"},{\"columna_1\":\"76\",\"columna_2\":\"12015\",\"columna_3\":\"Buenavista de Cuéllar\",\"columna_4\":\"12,148\",\"columna_5\":\"1671\"}]}}\nSOCIALES FEDERALES PARA EL DESARROLLO DE\nZONAS PRIORITARIAS, ATENCIÓN A JORNALEROS\nAGRÍCOLAS, EMPLEO TEMPORAL, OPCIONES\nPRODUCTIVAS Y 3X1 PARA MIGRANTES, TODOS\nELLOS DEL RAMO ADMINISTRATIVO 20 DESARROLLO\nSOCIAL PARA EL EJERCICIO FISCAL 2010, QUE\nSUSCRIBEN LA SECRETARÍA DE DESARROLLO SOCIAL\nY EL ESTADO DE GUERRERO las Zonas de Atención Prioritarias-, mecanismo indicativo de las prioridades que deberán observar los diferentes programas de Desarrollo Social y Humano del Ramo Administrativo 20 “Desarrollo Social”.\nEn el presente anexo también se indica si los municipios pertenecen a alguna de las 32 regiones, que la\nCámara de Diputados identifica en su Declaratoria, conformadas por 365 municipios de muy alta marginación y 455 de alta marginación, y que dada la situación de pobreza y marginación estructural que las afecta, requieren de proyectos integradores del territorio.\n(*) Los Municipios Predominantemente Indígenas son aquellos que registran una población hablante de lengua indígena igual o superior a 40 por ciento de la población de 5 años y más, independientemente de su grado de marginación.\nEl Consejo Nacional de Población (CONAPO) define a la marginación como un “fenómeno estructural que se origina en la modalidad, estilo o patrón histórico de desarrollo; ésta se expresa, por un lado, en la del país, y por el otro, en la exclusión de grupos sociales del proceso de desarrollo y del disfrute de sus beneficios” (CONAPO, 2005: 11).\nEl CONAPO establece cinco estratificaciones para la marginación municipal, en las que agrupa a la totalidad de los municipios del país: Muy Alta, Alta, Media, Baja y Muy Baja Marginación. Un estado puede presentar los cinco grupos o sólo algunos, lo que dependerá de las condiciones que persisten en cada uno de sus municipios.\nFuente: CONAPO (2005). Índices de Marginación, 2005, con base en INEGI, II Conteo de Población y\nVivienda 2005.",
  "ordenamiento": "ACUERDO",
  "jurisdiccion": "GUERRERO",
  "fuente_oficial": "DIARIO OFICIAL DE LA FEDERACION",
  "Fecha de Publicación": "11 de Mayo de 2010",
  "ULTIMA REFORMA PUBLICADA": "11 de Mayo de 2010",
  "status": "ABROGADA",
  "es_escaneado": false,
  "tiene_tablas": true,
  "materia": [
    "general"
  ]
}