{
  "titulo": "Acuerdo por el Que Se Delega al Titular de la Subsecretaría de Gobierno para Asuntos Jurídicos y Der",
  "Contenido": "DE LA SECRETARÍA GENERAL DE GOBIERNO,\nLA FACULTAD PARA LLEVAR EL REGISTRO DE\nAUTÓGRAFOS, LEGALIZAR Y CERTIFICAR LAS\nFIRMAS DE LOS FUNCIONARIOS ESTATALES,\nDE LOS PRESIDENTES Y SECRETARIOS\nMUNICIPALES Y EN GENERAL, DE AQUELLOS\nSERVIDORES PÚBLICOS A QUIENES ESTÉ\nENCOMENDADA LA FE PÚBLICA\nTEXTO ORIGINAL.\nAcuerdo publicado en el Periódico Oficial del Gobierno del Estado No. 76 Alcance\nI, el Martes 22 de Septiembre de 2009.\nACUERDO POR EL QUE SE DELEGA AL TITULAR DE LA SUBSECRETARÍA DE\nGOBIERNO PARA ASUNTOS JURÍDICOS Y DERECHOS HUMANOS DE LA\nSECRETARÍA GENERAL DE GOBIERNO, LA FACULTAD PARA LLEVAR EL\nREGISTRO DE AUTÓGRAFOS, LEGALIZAR Y CERTIFICAR LAS FIRMAS DE LOS\nFUNCIONARIOS ESTATALES, DE LOS PRESIDENTES Y SECRETARIOS\nMUNICIPALES Y EN GENERAL, DE AQUELLOS SERVIDORES PÚBLICOS A\nQUIÉNES ESTÉ ENCOMENDADA LA FE PÚBLICA.\nGUILLERMO RAMÍREZ RAMOS, SECRETARIO GENERAL DE GOBIERNO,\nCON FUNDAMENTO EN EL ARTÍCULO 58 DE LA CONSTITUCIÓN POLÍTICA DEL\nCONFIEREN LOS ARTÍCULOS 3º; 11; 19 Y 20, FRACCIONES V Y VIII, DE LA LEY\nORGÁNICA DE LA ADMINISTRACIÓN PÚBLICA DEL ESTADO Y 4; 7; 8, FRACCIÓN\nXXXVIII, DEL REGLAMENTO INTERIOR DE LA SECRETARÍA GENERAL DE\nGOBIERNO, Y\nQue uno de los objetivos que contempla el Plan Estatal de Desarrollo 2005-2011 del Estado de Guerrero, dentro de la Modernización Administrativa Integral y\nTransparencia de la Gestión Pública, es lograr que la organización, operación y gestión calidad, eficiencia, confiabilidad y cercanía.\nDE LA SECRETARÍA GENERAL DE GOBIERNO,\nLA FACULTAD PARA LLEVAR EL REGISTRO DE\nAUTÓGRAFOS, LEGALIZAR Y CERTIFICAR LAS\nFIRMAS DE LOS FUNCIONARIOS ESTATALES,\nDE LOS PRESIDENTES Y SECRETARIOS\nMUNICIPALES Y EN GENERAL, DE AQUELLOS\nSERVIDORES PÚBLICOS A QUIENES ESTÉ\nENCOMENDADA LA FE PÚBLICA\nQue los Planes y Programas de Gobierno, relativo a la Modernización y\nSimplificación Administrativa, señalan un proceso continuo y cambiante con proyección a futuro y tienen como propósitos implementar acciones a corto plazo y fortalecer con acciones que impulsen e innoven las formas de organización y funcionalidad del aparato gubernamental.\nAdministración Pública del Estado, señalan que el Titular del Poder Ejecutivo Estatal, para el despacho de los asuntos que le competen, se auxiliará y delegará facultades a las dependencias y entidades que dichos ordenamientos legales le señalan.\nQue de acuerdo con la Ley Orgánica de la Administración Pública del Estado, la\nSecretaría General de Gobierno, es el órgano encargado de conducir, por delegación del\nEjecutivo, la política interna y entre las atribuciones que le confiere, está la de llevar el registro de autógrafos, legalizar y certificar las firmas de funcionarios estatales, de los presidentes y secretarios municipales y, en general, de aquellos servidores públicos a quiénes esté encomendada la fe pública, función que fue delegada a la Dirección\nGeneral de Asuntos Jurídicos, en el Reglamento Interior de dicha Secretaría y en el\nAcuerdo que se describe. Asimismo mediante acuerdo se delegó esta función a los\nDelegados de Gobernación de dicha Secretaría, sin que se haya cumplido con tal disposición.\nEstatal, delegan al titular de la Dirección General de Asuntos Jurídicos de la Secretaría\nGeneral de Gobierno, todas las facultades para llevar el registro de autógrafos, legalizar y certificar las firmas de los funcionarios estatales, de los presidentes y secretarios municipales y de los demás funcionarios a quienes está encomendada la fe pública.\nDE LA SECRETARÍA GENERAL DE GOBIERNO,\nLA FACULTAD PARA LLEVAR EL REGISTRO DE\nAUTÓGRAFOS, LEGALIZAR Y CERTIFICAR LAS\nFIRMAS DE LOS FUNCIONARIOS ESTATALES,\nDE LOS PRESIDENTES Y SECRETARIOS\nMUNICIPALES Y EN GENERAL, DE AQUELLOS\nSERVIDORES PÚBLICOS A QUIENES ESTÉ\nENCOMENDADA LA FE PÚBLICA\nCon fecha 1° de marzo del 2002, se publicó en el Periódico Oficial del Gobierno del Estado, el Reglamento Interior de la Secretaría General de Gobierno, que faculta al\nDirector General de Asuntos Jurídicos, llevar el registro de nombramientos, firmas y rúbricas de funcionarios estatales, de los presidentes y secretarios municipales y en general, de aquellos servidores públicos a quienes esté encomendada la fe pública, así como legalizar y certificar las firmas respectivas, que entró en vigor el día 16 del mismo mes y año.\nQue con fecha 6 de septiembre del 2002, el Secretario General de Gobierno, mediante Acuerdo delegó facultades a los Delegados de Gobernación en Acapulco de\nJuárez y Regiones Costa Grande con sede en Zihuatanejo, Guerrero y Región Norte con sede en Iguala de la Independencia, Guerrero, para llevar el registro de autógrafos, legalizar las firmas de los servidores públicos, de los presidentes y secretarios municipales y de los demás funcionarios e instituciones, a quienes está encomendada la fe pública, el cual fue publicado en el Periódico Oficial del Gobierno del Estado, número\n74 del 13 de septiembre del 2002.\nQue a más de 7 años que se delegó la función anterior al Director General de\nAsuntos Jurídicos, se observa, que cada vez es mayor el número de solicitudes de la expedición de constancias, certificación de documentos y de validación de firmas, sin prestar los servicios mencionados a los usuarios, lo que va en detrimento de su atención in-mediata.\nEn cumplimiento a lo anterior, y debido a la importancia y delicadeza que revisten\nGeneral de Gobierno, a través de la Dirección General de Asuntos Jurídicos y con el objeto de aligerarle la carga de trabajo a esta Dirección, es necesario Delegar al Titular\nDE LA SECRETARÍA GENERAL DE GOBIERNO,\nLA FACULTAD PARA LLEVAR EL REGISTRO DE\nAUTÓGRAFOS, LEGALIZAR Y CERTIFICAR LAS\nFIRMAS DE LOS FUNCIONARIOS ESTATALES,\nDE LOS PRESIDENTES Y SECRETARIOS\nMUNICIPALES Y EN GENERAL, DE AQUELLOS\nSERVIDORES PÚBLICOS A QUIENES ESTÉ\nENCOMENDADA LA FE PÚBLICA de la Subsecretaría de Gobierno para Asuntos Jurídicos y Derechos Humanos, la facultad que señala la fracción V del Artículo 20 de la Ley Orgánica de la Administración\nPública Estatal, sin perjuicio a la facultad conferida a la Dirección General de Asuntos\nJurídicos, en la fracción XVI del Artículo 18 del Reglamento Interior de la Secretaría\nGeneral de Gobierno, a fin de que los trámites y servicios se atiendan con eficiencia, calidad y rapidez, para hacer realidad un gobierno honesto, eficiente y eficaz, con mayor capacidad de respuesta frente a la demanda de la población guerrerense, por lo anteriormente expuesto y fundado, he tenido a bien expedir el siguiente:\nACUERDO POR EL QUE SE DELEGA AL TITULAR DE LA SUBSECRETARÍA DE\nGOBIERNO PARA ASUNTOS JURÍDICOS Y DERECHOS HUMANOS DE LA\nSECRETARÍA GENERAL DE GOBIERNO, LA FACULTAD PARA LLEVAR EL\nREGISTRO DE AUTÓGRAFOS, LEGALIZAR Y CERTIFICAR LAS FIRMAS DE LOS\nFUNCIONARIOS ESTATALES, DE LOS PRESIDENTES Y SECRETARIOS\nMUNICIPALES Y EN GENERAL, DE AQUELLOS SERVIDORES PÚBLICOS A\nQUIÉNES ESTÉ ENCOMENDADA LA FE PÚBLICA.\nARTÍCULO PRIMERO.- Se delega al Titular de la Subsecretaría de Gobierno para Asuntos Jurídicos y Derechos Humanos de la Secretaría General de Gobierno, la facultad para llevar el registro de autógrafos, legalizar y certificar las firmas de los funcionarios estatales, de los presidentes y secretarios municipales y en general, de aquellos servidores públicos a quiénes esté encomendada la fe pública, con el objeto de aligerar la carga de trabajo de la Dirección General de Asuntos Jurídicos.\nARTÍCULO SEGUNDO.- Sin perjuicio de lo dispuesto en el artículo anterior, las\nJurídicos de dicha Secretaría.\nDE LA SECRETARÍA GENERAL DE GOBIERNO,\nLA FACULTAD PARA LLEVAR EL REGISTRO DE\nAUTÓGRAFOS, LEGALIZAR Y CERTIFICAR LAS\nFIRMAS DE LOS FUNCIONARIOS ESTATALES,\nDE LOS PRESIDENTES Y SECRETARIOS\nMUNICIPALES Y EN GENERAL, DE AQUELLOS\nSERVIDORES PÚBLICOS A QUIENES ESTÉ\nENCOMENDADA LA FE PÚBLICA\nARTÍCULO TERCERO.- a efecto de que se registre la firma y sello oficial del\nTitular de la Subsecretaría de Gobierno para Asuntos Jurídicos y Derechos Humanos de la Secretaría General de Gobierno del Estado, gírense los oficios correspondientes a las\nSecretarías de Gobernación; de Educación Pública y de Educación Guerrero, para los efectos legales a que haya lugar.\nARTÍCULO CUARTO.- Para cumplir con el objetivo del presente acuerdo, el\nDirector General de Asuntos Jurídicos de la Secretaría General de Gobierno, deberá poner a disposición de la Subsecretaría de Gobierno para Asuntos Jurídicos y Derechos\nHumanos, al personal que tiene a su cargo el registro de firmas de los funcionarios estatales, municipales y en general de aquellos servidores públicos a quienes este encomendada la fe pública, para poder certificarlas con las que aparecen en los documentos oficiales para verificar su autenticidad y demás documentos que se requiera para cumplir con la función delegada.\nPRIMERO.- El presente Acuerdo entrará en vigor al día siguiente de su\nSEGUNDO.- Gírese los oficios correspondientes a que alude el artículo tercero del citado Acuerdo.\nTERCERO.- El presente Acuerdo estará vigente hasta en tanto se haya logrado su objetivo.\nCUARTO.- Se abrogan los Acuerdos Delegatorios descritos en los considerandos quinto y séptimo de dicho Acuerdo, publicados en los Periódicos Oficiales del Gobierno\nDE LA SECRETARÍA GENERAL DE GOBIERNO,\nLA FACULTAD PARA LLEVAR EL REGISTRO DE\nAUTÓGRAFOS, LEGALIZAR Y CERTIFICAR LAS\nFIRMAS DE LOS FUNCIONARIOS ESTATALES,\nDE LOS PRESIDENTES Y SECRETARIOS\nMUNICIPALES Y EN GENERAL, DE AQUELLOS\nSERVIDORES PÚBLICOS A QUIENES ESTÉ\nENCOMENDADA LA FE PÚBLICA del Estado número 53 de fecha 30 de junio de2000 y el número 74 del 13 de septiembre del 2002.\nDado en la Ciudad de Chilpancingo de los Bravo, Capital del Estado de Guerrero, a los veintiun días del mes de septiembre del año dos mil nueve.\nEL SECRETARIO GENERAL DE GOBIERNO.\nLIC. GUILLERMO RAMÍREZ RAMOS.\nRúbrica.",
  "ordenamiento": "ACUERDO",
  "jurisdiccion": "GUERRERO",
  "fuente_oficial": "DIARIO OFICIAL DE LA FEDERACION",
  "Fecha de Publicación": "22 de Septiembre de 2009",
  "ULTIMA REFORMA PUBLICADA": null,
  "status": "VIGENTE",
  "es_escaneado": false,
  "tiene_tablas": false,
  "materia": [
    "administrativo"
  ]
}