{
  "titulo": "Acuerdo Delegatorio de Facultades Que Emite el Lic. C. Arturo Latabán López, Auditor General del Est",
  "Contenido": "FAVOR DEL MAESTRO EN DERECHO MARIANO\nHANSEL PATRICIO ABARCA, TITULAR DEL ÓRGANO\nDE CONTROL DE LA AUDITORÍA GENERAL DEL\nESTADO\nTEXTO ORIGINAL\nAcuerdo publicado en el Periódico Oficial del Gobierno del Estado No. 58, el Viernes 20 de Julio de 2012.\nPODER LEGISLATIVO\nACUERDO DELEGATORIO DE FACULTADES QUE EMITE EL LIC. C. ARTURO LATABÁN LÓPEZ,\nAUDITOR GENERAL DEL ESTADO DE GUERRERO, A FAVOR DEL MAESTRO EN DERECHO\nMARIANO HANSEL PATRICIO ABARCA, TITULAR DEL ORGANO DE CONTROL DE LA AUDITORIA\nGENERAL DEL ESTADO.\nEL SUSCRITO LICENCIADO CERTIFICADO ARTURO LATABÁN LÓPEZ, AUDITOR\nGENERAL DEL ESTADO, EN USO DE LAS FACULTADES QUE ME CONFIEREN LOS ARTÍCULOS\nGUERRERO; 204 DE LA LEY ORGÁNICA DEL PODER LEGISLATIVO DEL ESTADO NÚMERO 286; I°,\n77, 90 Y DEMÁS RELATIVOS DE LA LEY NUMERO 1028 DE FISCALIZACIÓN SUPERIOR Y\nRENDICION DE CUENTAS DEL ESTADO DE GUERRERO Y:\nPRIMERO.- EN TÉRMINOS DE LO ESTABLECIDO POR LOS ARTÍCULOS 107 FRACCIÓN IV\nSOBERANO DE GUERRERO; 204 DE LA LEY ORGÁNICA DEL PODER LEGISLATIVO DEL ESTADO\nDE GUERRERO Y 11 DE LA LEY DE FISCALIZACIÓN SUPERIOR DEL ESTADO DE GUERRERO\nNUMERO 564, CON FECHA VEINTE DE DICIEMBRE DEL AÑO DOS MIL DIEZ, FUI NOMBRADO\nAUDITOR GENERAL DEL ESTADO, POR LA QUINCUAGÉSIMA NOVENA LEGISLATURA AL\nDE 8 AÑOS CONTADOS A PARTIR DEL DIA PRIMERO DE ENERO DE DOS MIL ONCE.\nSEGUNDO.- CON FECHA VEINTIOCHO DE FEBRERO DE DOS MIL DOCE, SE PUBLICO EN\nEL PERIODICO OFICIAL DEL GOBIERNO DEL ESTADO DE GUERRERO, LA LEY NUMERO 1028 DE\nFISCALIZACION SUPERIOR Y RENDICION DE CUENTAS DEL ESTADO DE GUERRERO, MISMA\nDE SU NOMIBRAMIENTO, ASI COMO EN SU ARTICULO SEXTO TRANSITORIO, ESTABLECE QUE\nLOS PROCEDIMIENTOS CUYO TRAMITE HAYA INICIADO PREVIO A LA VIGENCIA DE DICHA LEY,\nFISCALIZACION SUPERIOR DEL ESTADO DE GUERRERO NUMERO 564.\nTERCERO.- CON FECHA 16 DE ABRIL DE DOS MIL DOCE, EN USO DE LAS FACULTADES\nQUE ME CONFIERE LA FRACCION XIV DEL ARTICULO 90 DE LA LEY NUMERO 1028 DE\nFAVOR DEL MAESTRO EN DERECHO MARIANO\nHANSEL PATRICIO ABARCA, TITULAR DEL ÓRGANO\nDE CONTROL DE LA AUDITORÍA GENERAL DEL\nESTADO\nFISCALIZACION SUPERIOR Y RENDICION DE CUENTAS DEL ESTADO DE GUERRERO, DESIGNE Y\nNOMBRE AL MAESTRO EN DERECHO MARIANO HANSEL PATRICIO ABARCA COMO TITULAR\nDEL ORGANO DE CONTROL DE ESTA AUDITORIA GENERAL DEL ESTADO.\nCUARTO.- QUE EL ARTICULO 90 DE LA LEY NUMERO 1028 DE FISCALIZACIÓN SUPERIOR\nY RENDICION DE CUENTAS DEL ESTADO DE GUERRERO, SEÑALA LAS FACULTADES QUE\nTENGO EN MI CARÁCTER DE AUDITOR GENERAL DEL ESTADO, INDICANDO EN LA FRACCION I\nDEL CITADO PRECEPTO, QUE EL SUSCRITO TIENE FACULTADES DE REPRESENTAR\nLEGALMENTE A LA AUDITORIA GENERAL DEL ESTADO, CON FACULTADES GENERALES Y\nESPECIALES Y CON CAPACIDAD PARA DELEGARLAS DENTRO DE LAS CONTROVERSIAS EN LAS\nQUE LA AUDITORIA GENERAL DEL ESTADO SEA PARTE; EN LA FRACCION II ESTABLECE, QUE\nEL AUDITOR GENERAL DEL ESTADO EJERCERA SUS FACULTADES DE MANERA DIRECTA Y\nEXCEPCIONALMENTE POR DELEGACION DE CONFORMIDAD CON LO ESTABLECIDO EN LAS\nLEYES APLICABLES; ASIMISMO EN EL ARTICULO 137 DE LA LEY NUMERO 1028 DE\nFISCALIZACION SUPERIOR Y RENDICION DE CUENTAS DEL ESTADO DE GUERERO,\nMEDULARMENTE ESTABLECE QUE LA AUDITORIA GENERAL DEL ESTADO CONTARA CON UN\nORGANO DE CONTROL AL QUE CUALQUIER PERSONA TENGA FACIL ACCESO PARA\nPRESENTAR QUEJAS Y DENUNCIAS POR HECHOS PROBABLEMENTE IRREGULARES Y QUE\nTENGAN RELACIÓN INMEDIATA Y DIRECTA CON RECURSOS PÚBLICOS; ASÍ COMO CUALQUIER\nCONDUCTA QUE TRASGREDA LAS OBLIGACIONES ESTABLECIDAS EN ESTA LEY; PRECISANDO\nQUE DICHO ÓRGANO DE CONTROL TENDRÁ ATRIBUCIONES PARA IDENTIFICAR, INVESTIGAR Y\nDETERMINAR RESPONSABILIDADES DENTRO DEL PROCEDIMIENTO ADMINISTRATIVO\nDISCIPLINARIO. ASI TAMBIEN EL ARTICULO 144 DE LA REFERIDA LEY, ESTABLECE EL\nPROCEDIMIENTO PARA LA IMPOSICION DE LAS SANCIONES ADMINISTRATIVAS PREVISTAS EN\nDICHO ORDENAMIENTO LEGAL, MISMO QUE EN SU ARTICULO SEXTO TRANSITORIO\nDETERMINA, QUE LOS PROCEDIMIENTOS CUYO TRAMITE HAYA INICIADO PREVIO A LA\nVIGENCIA DE DICHA LEY, SERAN SUSTANCIADOS POR LA AUDITORIA GENERAL DEL ESTADO\nBAJO EL REGIMEN DE LA LEY DE FISCALIZACION SUPERIOR DEL ESTADO DE GUERRERO\nNUMERO 564 Y QUE LOS PROCEDIMIENTOS QUE SE INICIEN A LA ENTRADA EN VIGOR DE LA\nLEY NUMERO 1023 DE FISCALIZACION SUPERIOR Y RENDICION DE CUENTAS DEL ESTADO DE\nGUERRERO, SE REGIRAN POR ESTA.\nQUINTO.- QUE EN CONGRUENCIA CON LO ANTERIOR, A FIN DE DAR MAYOR AGILIDAD A\nLA AUDITORIA GENERAL DEL ESTADO, CON FUNDAMENTO EN LO DISPUESTO EN LOS\nARTICULOS 90 Y 96 DE LA LEY NUMERO 1028 DE FISCALIZACION SUPERIOR Y RENDICION DE\nCUENTAS DEL ESTADO DE GUERRERO, RESULTA PROCEDENTE DELEGAR LAS FACULTADES\nSEÑALADAS EN El, CONSIDERANDO CUARTO ANTERIOR, AL MAESTRO EN DERECHO MARIANO\nHANSEL PATRICIO ABARCA, EN SU CARÁCTER DE TITULAR DEL ORGANO DE CONTROL DE LA\nAUDITORIA GENERAL DEL ESTADO; POR LO QUE EXPIDO EL SIGUIENTE:\nFAVOR DEL MAESTRO EN DERECHO MARIANO\nHANSEL PATRICIO ABARCA, TITULAR DEL ÓRGANO\nDE CONTROL DE LA AUDITORÍA GENERAL DEL\nESTADO\nACUERDO DELEGATORIO DE FACULTADES, A FAVOR DEL MAESTRO EN DERECHO MARIANO\nHANSEL PATRICIO ABARCA, TITULAR DEL ORGANO DE CONTROL DE LA AUDITORIA GENERAL\nDEL ESTADO, EN LOS SIGUIENTES TERMINOS:\nARTÍCULO PRIMERO.- SE DELEGA A FAVOR DEL MAESTRO EN DERECHO MARIANO\nHANSEL PATRICIO ABARCA, EN SU CARÁCTER DE TITULAR DEL ÓRGANO DE CONTROL Y\nUNIDAD DE QUEJAS Y DENUNCIAS DE LA AUDITORIA GENERAL DEL ESTADO, LAS FACULTADES\nPREVISTAS EN LAS FRACCIONES I Y II DEL ARTÍCULO 90 DE LA LEY NÚMERO 1028 DE\nFISCALIZACIÓN SUPERIOR Y RENDICIÓN DE CUENTAS DEL ESTADO DE GUERRERO, ASÍ COMO\nLAS QUE SE DERIVEN DE LO DISPUESTO EN LOS ARTICULOS 136 AL 151 DEL MISMO\nORDENAMIENTO LEGAL, PARA QUE INICIE, CONOZCA E INSTRUYA EN TODAS SUS ETAPAS EL\nPROCEDIMIENTO ADMINISTRATIVO DISCIPLINARIO PREVISTO EN EL CAPITULO III DEL TÍTULO\nSEXTO DE LA CITADA LEY, Y QUE RESULTEN DE DENUNCIAS O QUEJAS QUE SEAN\nPRESENTADAS O PROMOVIDAS ANTE EL ÓRGANO DE CONTROL DE ESTA AUDITORÍA GENERAL\nDEL ESTADO, TRAMITÁNDOLOS EN TODAS Y CADA UNA DE LAS ETAPAS PROCEDIMENTALES\nQUE EN DERECHO CORRESPONDAN; DE IGUAL MANERA EL DELEGADO REPRESENTARA\nLEGALMENTE AL ÓRGANO DE CONTROL Y UNIDAD DE QUEJAS Y DENUNCIAS DE LA AUDITORIA\nGENERAL DEL ESTADO, EN LAS CONTROVERSIAS DONDE ESTE SEA PARTE, PODRÁ\nCONTESTAR DEMANDAS DE NULIDAD ANTE EL TRIBUNAL DE LO CONTENCIOSO\nADMINISTRATIVO, ASÍ COMO PROMOVER LAS ACCIONES LEGALES QUE PROCEDAN ANTE EL\nCITADO TRIBUNAL; ASÍ COMO REPRESENTAR AL CITADO ÓRGANO ANTE LAS ENTIDADES\nFISCALIZADAS, LAS AUTORIDADES FEDERALES Y LOCALES, LAS ENTIDADES FEDERATIVAS,\nLOS AYUNTAMIENTOS Y DEMÁS PERSONAS FÍSICAS Y MORALES E INTERVENIR Y PROMOVER\nLO CONDUCENTE RESPECTO A LAS INVESTIGACIONES A QUE HACEN ALUSIÓN EL ARTÍCULO\n136 Y 137 DE LA LEY EN CITA, Y EN GENERAL LLEVAR A CABO TODAS AQUELLAS DILIGENCIAS\nY TRÁMITES PARA LA DEBIDA INTEGRACIÓN DE LOS EXPEDIENTES RELATIVOS DE LOS\nPROCEDIMIENTOS EN TÉRMINOS DE LAS DISPOSICIONES LEGALES APLICABLES Y DEL\nPRESENTE ACUERDO; DEBIENDO EJECUTAR, EL DELEGADO TODOS LOS ACTOS Y ACCIONES\nINHERENTES QUE CONLLEVAN LAS FACULTADES DELEGADAS, ASEGURANDO CON LAS\nMEDIDAS NECESARIAS EL CUMPLIMIENTO DE LAS DISPOSICIONES CONTENIDAS EN EL\nPRESENTE ACUERDO; Y SE EXCEPCIONAM, LOS ACTOS INMERSOS EN LAS DEMAS\nFRACCIONES DEL ARTÍCULO 90 DE LA LEY DE LA MATERIA Y EL DICTADO DE CUALQUIER TIPO\nASUNTO Y QUE SE DICTE EN LOS PROCEDIMIENTOS ADMINISTRATIVOS DISCIPLINARIOS,\nQUEDANDO ESTAS ÚLTIMAS RESERVADAS EN FORMA EXCLUSIVA AL DELEGANTE.\nASIMISMO, PARA LOS EFECTOS DE LO DISPUESTO POR EL ARTICULO SEXTO\nTRANSITORIO DE LA LEY NUMERO 1028 DE FISCALIZACION SUPERIOR Y RENDICION DE\nCUENTAS DEL ESTADO DE GUERRERO, EL LICENCIADO CERTIFICADO ARTURO LATABAN\nLOPEZ, AUDITOR GENERAL DEL ESTADO, DELEGA EN EL MAESTRO EN DERECHO MARIANO\nHANSEL PATRICIO ABARCA, TITULAR DEL ORGANO DE CONTROL DE LA AUDITORIA GENERAL\nFAVOR DEL MAESTRO EN DERECHO MARIANO\nHANSEL PATRICIO ABARCA, TITULAR DEL ÓRGANO\nDE CONTROL DE LA AUDITORÍA GENERAL DEL\nESTADO\nLEY DE FISCALIZACION SUPERIOR DEL ESTADO DE GUERRERO NUMERO 564, ASI COMO LAS\nQUE SE DERIVEN DE LO DISPUESTO EN LOS ARTICULOS 74 BIS 1 AL 74 BIS 19 DEL\nORDENAMIENTO LEGAL ANTES CITADO, POR LO QUE PODRA CONTINUAR Y DAR SEGUIMIENTO\nHASTA SU CONCLUSION A LOS PROCEDIMIENTOS ADMINISTRATIVOS DISCIPLINARIOS\nPREVISTOS EN EL CAPITULO III BIS DE LA CITADA LEY DE FISCALIZACION Y QUE SE INICIARON\nANTES DE LA ENTRADA EN VIGOR DE LA LEY NUMERO 1028 DE FISCALIZACION SUPERIOR Y\nRENDICION DE CUENTAS DEL ESTADO DE GUERRERO, Y QUE HAYAN RESULTADO DE\nDENUNCIAS O QUEJAS QUE HUBIESEN SIDO PRESENTADAS O PROMOVIDAS ANTE EL ORGANO\nDE CONTROL Y UNIDAD DE QUEJAS Y DENUNCIAS DE ESTA AUDITORIA GENERAL DEL ESTADO,\nTRAMITANDOLOS EN TODAS Y CADA UNA DE LAS ETAPAS PROCEDIMENTALES QUE EN\nDERECHO CORRESPONDAN; DE IGUAL MANERA EL DELEGADO REPRESENTARA LEGALMENTE\nAL ORGANO DE CONTROL Y UNIDAD DE QUEJAS Y DENUNCIAS DE LA AUDITORIA GENERAL\nDEL ESTADO, EN LAS CONTROVERSIAS DONDE ESTE SEA PARTE, PODRA CONTESTAR\nDEMANDAS DE NULIDAD ANTE EL TRIBUNAL DE LO CONTENCIOSO ADMINISTRATIVO, ASI COMO\nPROMOVER Y TRAMITAR LO INHERENTE A LOS JUICIOS DE AMPARO; INTERPONER EN SU\nCASO, DENUNCIAS O QUERELLAS RESPECTO DE LOS HECHOS EMANADOS DE LOS\nPROCEDIMIENTOS ADMINISTRATIVOS DISCIPLINARIOS, CUANDO ASÍ CORRESPONDA; ASÍ\nCOMO REPRESENTAR AL CITADO ÓRGANO ANTE LAS ENTIDADES FISCALIZADAS, LAS\nAUTORIDADES FEDERALES Y LOCALES, LAS ENTIDADES FEDERATIVAS, LOS AYUNTAMIENTOS\nY DEMÁS PERSONAS FÍSICAS Y MORALES E INTERVENIR Y PROMOVER LO CONDUCENTE\nRESPECTO A LAS INVESTIGACIONES A QUE HACE ALUSIÓN EL ARTÍCULO 74 BIS III DE LA LEY\nDE FISCALIZACIÓN SUPERIOR DEL ESTADO DE GUERRERO NÚMERO 564, Y EN GENERAL\nLLEVAR A CABO TODAS AQUELLAS DILIGENCIAS Y TRÁMITES PARA LA DEBIDA INTEGRACIÓN\nDE LOS EXPEDIENTES RELATIVOS DE LOS PROCEDIMIENTOS EN TÉRMINOS DE LAS\nDISPOSICIONES LEGALES APLICABLES Y DE LOS CONSIDERANDOS DEL PRESENTE ACUERDO;\nDEBIENDO EJECUTAR, EL DELEGADO TODOS LOS ACTOS Y ACCIONES INHERENTES QUE\nCONLLEVAN LAS FACULTADES DELEGADAS, ASEGURANDO CON LAS MEDIDAS NECESARIAS EL\nCUMPLIMIENTO DE LAS DISPOSICIONES CONTENIDAS EN EL PRESENTE ACUERDO; Y SE\nEXCEPCIONAN, LOS ACTOS INMERSOS EN LAS DEMAS FRACCIONES DEL ARTÍCULO 19 DE LA\nLEY DE FISCALIZACIÓN NÚMERO 564, Y EL DICTADO DE CUALQUIER TIPO DE RESOLUCIÓN\nDICTE EN LOS PROCEDIMIENTOS ADMINISTRATIVOS DISCIPLINARIOS, QUEDANDO ESTAS\nÚLTIMAS RESERVADAS EN FORMA EXCLUSIVA AL DELEGANTE.\nARTÍCULO SEGUNDO.- EL EJERCICIO DE LAS FACULTADES QUE SE DELEGAN EN EL\nAPLICABLE.\nFAVOR DEL MAESTRO EN DERECHO MARIANO\nHANSEL PATRICIO ABARCA, TITULAR DEL ÓRGANO\nDE CONTROL DE LA AUDITORÍA GENERAL DEL\nESTADO\nARTÍCULO TERCERO.- LA PRESENTE DELEGACIÓN DE FACULTADES SE ENTIENDE\nHECHA SIN PERJUICIO DE SU EJERCICIO DIRECTO POR PARTE DEL AUDITOR GENERAL DEL\nESTADO.\nARTÍCULO CUARTO.- EL DELEGADO DEBERÁ INFORMAR MENSUALMENTE AL AUDITOR\nGENERAL DEL ESTADO O CUANDO ESTE LE SOLICITE, DEL EJERCICIO DE LAS FACULTADES\nQUE SE LE DELEGAN.\nUNICO.- EL PRESENTE ACUERDO ENTRARÁ EN VIGOR AL DÍA SIGUIENTE AL DE SU\nLATABÁN LÓPEZ, AUDITOR GENERAL DEL ESTADO DE GUERRERO, EN LA CIUDAD DE\nCHILPANCINGO DE LOS BRAVO, GUERRERO, A LOS DIECIOCHO DÍAS DEL MES DE JUNIO DEL\nAÑO DOS MIL DOCE.\nPUBLÍQUESE Y CÚMPLASE.\nRúbrica.",
  "ordenamiento": "ACUERDO",
  "jurisdiccion": "GUERRERO",
  "fuente_oficial": "DIARIO OFICIAL DE LA FEDERACION",
  "Fecha de Publicación": "20 de Julio \nde 2012",
  "ULTIMA REFORMA PUBLICADA": null,
  "status": "VIGENTE",
  "es_escaneado": false,
  "tiene_tablas": false,
  "materia": [
    "auditoría"
  ]
}