{
  "titulo": "Acuerdo por el Que Se Designa al C. P. Jorge Silverio Salgado Leyva, Secretario de Finanzas y Admini",
  "Contenido": "ESTADO, DURANTE EL LAPSO COMPRENDIDO\nENTRE LOS DÍAS 19 Y 30 DEL MES DE JUNIO DEL\nAÑO 2013\nTEXTO ORIGINAL\nAcuerdo publicado en el Periódico Oficial del Gobierno del Estado No. 49 Alcance I, el Martes 18 de Junio de 2013.\nPODER EJECUTIVO\nACUERDO POR EL QUE SE DESIGNA AL C. P. JORGE SILVERIO SALGADO LEYVA, SECRETARIO\nDE FINANZAS Y ADMINISTRACIÓN, COMO ENCARGADO DEL DESPACHO DEL PODER\nEJECUTIVO DEL ESTADO, DURANTE EL LAPSO COMPRENDIDO ENTRE LOS DÍAS 19 Y 30 DEL\nMES DE JUNIO DEL AÑO 2013.\nGuerrero.- Poder Ejecutivo.\nÁNGEL HELADIO AGUIRRE RIVERO, GOBERNADOR CONSTITUCIONAL DEL ESTADO\nME CONFIEREN LOS ARTÍCULOS 3o, 6o Y 20 FRACCIÓN XXIV DE LA LEY ORGÁNICA DE LA\nADMINISTRACIÓN PÚBLICA DEL ESTADO DE GUERRERO NÚMERO 433, Y que en las faltas temporales del Gobernador que no excedan de treinta días, designará un encargado del despacho del Poder Ejecutivo.\nQue de conformidad con el artículo 20 fracción XXIV de la Ley Orgánica de la Administración\nPública del Estado de Guerrero, número 433 y 9 fracción XVI del Reglamento Interior de la Secretaría\nGeneral de Gobierno, corresponde al Secretario General de Gobierno, actuar como encargado del\nDespacho en ausencia del Gobernador, dentro de los límites que establece la Constitución Política de los señale a otro servidor público como responsable. gira de trabajo en el territorio de los Estados Unidos de Norteamérica entre los días 19 y 30 del mes de junio del año 2013, por lo que, he considerado dejar como encargado del mismo al Secretario de\nFinanzas y Administración, C. P. Jorge Silverio Salgado Leyva.\nPor lo anteriormente expuesto y fundado, he tenido a bien expedir el siguiente:\nESTADO, DURANTE EL LAPSO COMPRENDIDO\nENTRE LOS DÍAS 19 Y 30 DEL MES DE JUNIO DEL\nAÑO 2013\nDE FINANZAS Y ADMINISTRACIÓN COMO ENCARGADO DEL DESPACHO DEL PODER\nEJECUTIVO DEL ESTADO.\nArtículo Primero. Se designa al C. P. Jorge Silverio Salgado Leyva, Secretario de Finanzas y\nAdministración, como encargado del Despacho del Poder Ejecutivo del Estado, entre los días 19 y 30 del mes de junio del año 2013.\nArtículo Segundo. Para todos los efectos a que haya lugar, comuníquese oficialmente el presente Acuerdo a los HH. Poderes Legislativo y Judicial del Estado.\nÚnico. El presente Acuerdo entrará en vigor al día siguiente de su publicación en el Periódico los Bravo, capital del Estado de Guerrero, a los dieciocho días del mes de junio del año dos mil trece.\nEL GOBERNADOR CONSTITUCIONAL DEL ESTADO.\nLIC. ÁNGEL HELADIO AGUIRRE RIVERO.\nEL SECRETARIO GENERAL DE GOBIERNO.\nMTRO. FLORENTINO CRUZ RAMÍREZ.",
  "ordenamiento": "ACUERDO",
  "jurisdiccion": "GUERRERO",
  "fuente_oficial": "DIARIO OFICIAL DE LA FEDERACION",
  "Fecha de Publicación": "18 \nde Junio de 2013",
  "ULTIMA REFORMA PUBLICADA": null,
  "status": "VIGENTE",
  "es_escaneado": false,
  "tiene_tablas": false,
  "materia": [
    "general"
  ]
}