{
  "titulo": "Acuerdo por el Que Se Da A Conocer el Monto de las Participaciones Entregadas A los Municipios del E 20",
  "Contenido": "DE GUERRERO, DEL FONDO COMUN, DEL\nFONDO DE FOMENTO MUNICIPAL Y FONDO\nPARA LA INFRAESTRUCTURA MUNICIPAL, EN\nEL CUARTO TRIMESTRE DEL EJERCICIO FISCAL\nABROGADO POR CONCLUIDA SU VIGENCIA EL 31 DE DICIEMBRE DE 2010.\nTEXTO ORIGINAL\nAcuerdo publicado en el Periódico Oficial del Gobierno del Estado No. 14, el\nViernes 18 de Febrero de 2011.\nACUERDO POR EL QUE SE DA A CONOCER EL MONTO DE LAS\nPARTICIPACIONES ENTREGADAS A LOS MUNICIPIOS DEL ESTADO DE\nGUERRERO, DEL FONDO COMUN, DEL FONDO DE FOMENTO MUNICIPAL Y\nFONDO PARA LA INFRAESTRUCTURA MUNICIPAL, EN EL CUARTO TRIMESTRE\nDEL EJERCICIO FISCAL 2010.\nAl margen un sello con el Escudo Oficial que dice: Gobierno del Estado Libre y\nSoberano de Guerrero.- Poder Ejecutivo.\nCARLOS ZEFERINO TORREBLANCA GALINDO, GOBERNADOR\nFUNDAMENTO EN LOS ARTÍCULOS 74, FRACCIÓNES III, IV Y XI DE LA\nORGÁNICA DE LA ADMINISTRACIÓN PÚBLICA DEL ESTADO DE GUERRERO; 21\nDEL DECRETO 277 DEL PRESUPUESTO DE EGRESOS DEL ESTADO DE\nGUERRERO PARA EL EJERCICIO FISCAL 2010 Y 6, FRACCIONES I, II, III, IV, V, VI Y\nVII, 7,7A,8, INCISOS A) Y B), 8A, INCISOS A) Y C), 9 Y 10 DE LA LEY NUMERO 251\nBASES, MONTOS Y PLAZOS A LOS QUE SE SUJETARÁN LAS PARTICIPACIONES\nFEDERALES, Y del 2010, deben ser redistribuidas entre los municipios en los porcentajes que señala el\nDE GUERRERO, DEL FONDO COMUN, DEL\nFONDO DE FOMENTO MUNICIPAL Y FONDO\nPARA LA INFRAESTRUCTURA MUNICIPAL, EN\nEL CUARTO TRIMESTRE DEL EJERCICIO FISCAL establecen en la Ley 251, que crea el Sistema Estatal de Coordinación Fiscal y establece las bases, montos y plazos a los que se sujetarán las Participaciones Federales.\nQue la Ley de Coordinación Fiscal en el Capitulo I, Artículo 6º, último párrafo establece que \"Los Gobiernos de las Entidades, quince días después de que la\nSecretaría de Hacienda y Crédito Público publique en el Diario Oficial de la Federación el calendario de entrega, porcentaje y monto estimado que recibirá cada Entidad Federativa del Fondo General y del Fondo de Fomento Municipal, deberán publicar en el Periódico\nOficial de la Entidad de que se trate, los mismos datos antes referidos de las participaciones estimadas que entregarán a los municipios, derivadas de las participaciones que las Entidades reciban y de las que tengan obligación de participar a sus municipios\". También deberán publicar trimestralmente el importe de las participaciones entregadas y en su caso, el ajuste realizado al término de cada ejercicio fiscal. La Secretaría de Hacienda y Crédito Público publicará en el Diario Oficial de la\nFederación la lista de las Entidades que incumplan con esta disposición.\nPor lo anteriormente expuesto y fundado, he tenido a bien expedir el siguiente:\nACUERDO POR EL QUE SE DA A CONOCER EL MONTO DE LAS\nPARTICIPACIONES ENTREGADAS A LOS MUNICIPIOS DEL ESTADO DE\nGUERRERO, DEL FONDO COMUN, DEL FONDO DE FOMENTO MUNICIPAL Y\nFONDO PARA LA INFRAESTRUCTURA MUNICIPAL, EN EL CUARTO TRIMESTRE\nDEL EJERCICIO FISCAL 2010.\nARTICULO PRIMERO.- El presente Acuerdo tiene por objeto dar a conocer el\nEstado de Guerrero, durante el cuarto trimestre del año 2010.\nARTICULO SEGUNDO.- El monto de las participaciones federales que el\n2010, se determinó de acuerdo a lo establecido en los artículos 2º, 2ºA, 3ºA, 4º, 4ºA y 6º\nDE GUERRERO, DEL FONDO COMUN, DEL\nFONDO DE FOMENTO MUNICIPAL Y FONDO\nPARA LA INFRAESTRUCTURA MUNICIPAL, EN\nEL CUARTO TRIMESTRE DEL EJERCICIO FISCAL de la Ley de Coordinación Fiscal y 6º, 7º, 7ºA, 8º y 8º A de la Ley 251 que crea el\nSistema Estatal de Coordinación Fiscal y establece las bases, montos y plazos a los que se sujetarán las Participaciones Federales.\nARTICULO TERCERO.- Los montos de cada uno de los conceptos que se transfirieron a los municipios, durante el cuarto trimestre del ejercicio fiscal 2010, fueron los siguientes:\nParticipaciones Federales Entregadas a los Municipios (Pesos) octubre-diciembre\nFondo General 384,902,290.80 (1\nTenencia o Uso de Vehículos 4,618,586.00\nImpuesto Especial sobre Producción y Servicios 7,385,937.80 (2\nImpuestos sobre Automóviles Nuevos 2,112,728.60\nCompensación del I.S.A.N. 793,614.20\nFondo de Fiscalización 17,776,042.40 (3\nTotal Fondo Común 417,589,199.80\nFondo de Fomento Municipal 55,569,079.00 (4\nFondo para la Infraestructura Municipal 91,022,343.31 (5\nDE GUERRERO, DEL FONDO COMUN, DEL\nFONDO DE FOMENTO MUNICIPAL Y FONDO\nPARA LA INFRAESTRUCTURA MUNICIPAL, EN\nEL CUARTO TRIMESTRE DEL EJERCICIO FISCAL\nNotas:\n1) Incluye Fondo General octubre-diciembre/10. 368,581,056.80\nMás: 2º Ajuste Cuatrimestral 2010. 16,321,234.00\nTotal 384,902,290.80\n2) Incluye Impuestos Esp. sobre Producción y Servs. octubre-diciembre/10. 7,974,582.20\nMenos: 2º Ajuste Cuatrimestral 2010. -588,644.40\nTotal 7,385,937.80\n3) Incluye el Tercer Trimestre de 2010. 14,798,220.00\nMás: Diferencias a favor del Tercer Trimestre/10. 2,977,822.40\nTotal 17,776,042.40\n4) Incluye Fondo de Fomento Municipal octubre-diciembre/10. 51,239,785.00\nMás: 2º Ajuste Cuatrimestral de 2010. 4,329,294.00\nTotal 55,569,079.00\n5) Importe derivado de los recursos obtenidos de la Recaudación Estatal y del Fondo de Compensación de las cuotas a la venta final de Gasolina y Diesel, se incluye un 30% adicional en cumplimiento a lo establecido en el Artículo 21 del Presupuesto de Egresos del Estado de Guerrero para el ejercicio fiscal\n2010. A continuación se desglosan los importes respectivos:\nArtículo 4º A de la Ley de Coordinación Fiscal (20%) 36,408,937.32\nArtículo 21 del Presupuesto de Egresos del Estado de Gro. 2010 (30%) 54,613,405.99\nTotal 91,022,343.31\nLos montos transferidos a los municipios son los siguientes:\nTOTAL CUARTO FONDO FONDO DE FDO. P/LA\nNo. MUNICIPIO\nTRIMESTRE/10 COMUN FOM. MPAL. INF. MPAL.\nSUMA 564,180,622.11 417,589,199.80 55,569,079.00 91,022,343.31\n1 ACAPULCO DE JUAREZ 153,950,201.10 101,720,463.82 21,084,417.48 31,145,319.80\n2 ACATEPEC 3,993,933.90 3,100,739.62 307,304.12 585,890.16\n3 AHUACUOTZINGO 3,204,601.15 2,468,586.59 254,797.46 481,217.10\n4 AJUCHITLAN DEL PROGRESO 6,100,180.20 4,893,541.39 418,619.87 788,018.94\n5 ALCOZAUCA DE GUERRERO 2,537,983.05 2,013,825.08 181,983.96 342,174.01\n6 ALPOYECA 1,194,673.75 995,730.12 70,103.50 128,840.13\nDE GUERRERO, DEL FONDO COMUN, DEL\nFONDO DE FOMENTO MUNICIPAL Y FONDO\nPARA LA INFRAESTRUCTURA MUNICIPAL, EN\nEL CUARTO TRIMESTRE DEL EJERCICIO FISCAL\n7 APAXTLA 2,167,476.09 1,754,677.90 144,652.65 268,145.54\n8 ARCELIA 6,344,946.56 4,999,630.30 500,758.53 844,557.73\n9 ATENANGO DEL RIO 1,446,969.22 1,192,748.20 89,008.10 165,212.92\n10 ATLAMAJALCINGO DEL MONTE 806,091.66 644,045.03 55,857.48 106,189.15\n11 ATLIXTAC 3,408,040.16 2,664,446.66 257,067.51 486,525.99\n12 ATOYAC DE ALVAREZ 9,800,386.53 7,719,793.13 742,031.75 1,338,561.65\n13 AYUTLA DE LOS LIBRES 8,674,936.07 6,821,526.73 648,209.53 1,205,199.81\n14 AZOYU 2,334,601.01 1,896,446.43 152,533.39 285,621.19\n15 BENITO JUAREZ 3,515,848.82 2,902,522.69 227,873.73 385,452.40\n16 BUENAVISTA DE CUELLAR 2,814,891.20 2,330,126.56 177,710.03 307,054.61\n17 CHILAPA DE ALVAREZ 14,801,891.43 11,244,451.46 1,251,684.01 2,305,755.96\n18 CHILPANCINGO DE LOS BRAVO 33,935,743.57 24,876,084.58 3,363,180.08 5,696,478.91\n19 COAHUAYUTLA DE J. MA. IZAZAGA 2,189,546.29 1,769,778.69 144,797.19 274,970.41\n20 COCHOAPA EL GRANDE 2,107,547.07 1,622,386.55 166,664.33 318,496.19\n21 COCULA 2,540,642.94 2,073,231.86 164,232.58 303,178.50\n22 COPALA 2,548,644.63 2,106,065.62 159,606.01 282,973.00\n23 COPALILLO 2,012,095.85 1,577,061.48 150,153.20 284,881.17\n24 COPANATOYAC 2,466,502.32 1,925,861.10 185,774.88 354,866.34\n25 COYUCA DE BENITEZ 11,236,761.90 8,740,645.09 893,705.77 1,602,411.04\n26 COYUCA DE CATALAN 6,935,311.40 5,530,922.81 492,606.22 911,782.37\n27 CUAJINICUILAPA 3,926,900.58 3,143,108.34 274,561.82 509,230.42\n28 CUALAC 1,338,702.67 1,103,851.64 83,043.32 151,807.71\n29 CUAUTEPEC 2,252,756.87 1,799,313.10 155,768.85 297,674.92\n30 CUETZALA DEL PROGRESO 1,571,759.45 1,283,437.51 100,285.07 188,036.87\n31 CUTZAMALA DE PINZON 3,925,509.54 3,224,004.54 246,837.85 454,667.15\n32 EDUARDO NERI 6,651,155.87 5,219,241.78 510,356.37 921,557.72\n33 FLORENCIO VILLARREAL 3,127,241.32 2,499,978.39 220,134.47 407,128.46\n34 GENERAL CANUTO A. NERI 1,147,270.74 943,670.12 70,403.53 133,197.09\n35 GENERAL HELIODORO CASTILLO 5,342,466.61 4,241,854.74 380,616.85 719,995.02\n36 HUAMUXTITLAN 2,844,991.36 2,324,840.25 188,154.41 331,996.70\n37 HUITZUCO DE LOS FIGUEROA 6,196,196.27 4,875,972.41 477,521.54 842,702.32\n38 IGUALA DE LA INDEPENDENCIA 23,761,687.46 17,083,770.61 2,575,573.97 4,102,342.88\n39 IGUALAPA 1,582,955.66 1,257,997.02 112,018.15 212,940.49\n40 ILIATENCO 1,899,372.31 1,574,919.70 112,685.86 211,766.75\n41 IXCATEOPAN DE CUAUHTEMOC 1,387,028.77 1,174,697.31 75,271.93 137,059.53\nDE GUERRERO, DEL FONDO COMUN, DEL\nFONDO DE FOMENTO MUNICIPAL Y FONDO\nPARA LA INFRAESTRUCTURA MUNICIPAL, EN\nEL CUARTO TRIMESTRE DEL EJERCICIO FISCAL\n42 JOSE JOAQUIN DE HERRERA 2,226,654.94 1,771,892.98 156,786.49 297,975.47\n43 JUAN R. ESCUDERO 3,998,996.79 3,184,817.29 290,596.95 523,582.55\n44 JUCHITAN 1,440,361.30 1,217,553.48 79,527.19 143,280.63\n45 LEONARDO BRAVO 3,631,232.20 2,881,642.96 261,033.08 488,556.16\n46 MALINALTEPEC 3,732,957.89 2,897,968.44 287,453.01 547,536.44\n47 MARQUELIA 1,927,750.24 1,535,589.75 137,293.02 254,867.47\n48 MARTIR DE CUILAPAN 2,308,629.40 1,812,841.92 172,416.30 323,371.18\n49 METLATONOC 2,584,948.00 2,042,623.84 186,330.13 355,994.03\n50 MOCHITLAN 1,915,284.51 1,545,786.54 130,703.03 238,794.94\n51 OLINALA 3,574,332.31 2,838,486.22 256,652.51 479,193.58\n52 OMETEPEC 8,833,561.40 6,752,684.30 752,546.53 1,328,330.57\n53 PEDRO ASCENCIO ALQUISIRAS 1,315,936.48 1,085,545.35 80,481.52 149,909.61\n54 PETATLAN 7,369,760.23 5,803,861.28 556,853.63 1,009,045.32\n55 PILCAYA 3,261,129.73 2,750,259.36 193,072.77 317,797.60\n56 PUNGARABATO 7,843,551.85 6,020,086.14 698,717.09 1,124,748.62\n57 QUECHULTENANGO 5,118,424.69 4,036,267.59 376,226.40 705,930.70\n58 SAN LUIS ACATLAN 5,821,964.59 4,481,224.49 464,343.40 876,396.70\n59 SAN MARCOS 7,601,135.98 6,023,093.31 560,749.19 1,017,293.48\n60 SAN MIGUEL TOTOLAPAN 4,318,524.03 3,453,062.25 299,750.17 565,711.61\n61 TAXCO DE ALARCON 16,552,183.96 12,727,430.97 1,392,260.05 2,432,492.94\n62 TECOANAPA 6,546,781.99 5,198,861.80 465,156.10 882,764.09\n63 TECPAN DE GALEANA 9,112,739.94 7,215,035.95 661,943.26 1,235,760.73\n64 TELOLOAPAN 8,627,075.97 6,799,894.17 650,584.32 1,176,597.48\n65 TEPECOACUILCO DE TRUJANO 4,914,459.93 3,924,889.55 349,030.22 640,540.16\n66 TETIPAC 2,209,699.98 1,786,236.97 148,386.11 275,076.90\n67 TIXTLA DE GUERRERO 6,088,529.49 4,698,870.38 501,320.56 888,338.55\n68 TLACOACHISTLAHUACA 2,517,617.83 1,950,672.57 195,224.84 371,720.42\n69 TLACOAPA 1,362,182.32 1,090,097.33 93,467.75 178,617.24\n70 TLALCHAPA 2,025,801.03 1,656,768.98 128,602.62 240,429.43\n71 TLALIXTAQUILLA DE MALDONADO 1,351,196.53 1,125,153.70 80,015.14 146,027.69\n72 TLAPA DE COMONFORT 9,906,897.91 7,542,245.38 845,533.77 1,519,118.76\n73 TLAPEHUALA 3,464,146.90 2,771,268.81 242,117.69 450,760.40\n74 UNION DE I. MONTES DE OCA, LA 6,514,659.93 5,206,530.96 504,299.00 803,829.97\n75 XALPATLAHUAC 1,886,194.33 1,484,965.93 138,693.92 262,534.48\n76 XOCHIHUEHUETLAN 1,355,493.30 1,122,341.19 81,661.43 151,490.68\nDE GUERRERO, DEL FONDO COMUN, DEL\nFONDO DE FOMENTO MUNICIPAL Y FONDO\nPARA LA INFRAESTRUCTURA MUNICIPAL, EN\nEL CUARTO TRIMESTRE DEL EJERCICIO FISCAL\n77 XOCHISTLAHUACA 3,561,600.75 2,777,093.85 269,497.03 515,009.87\n78 ZAPOTITLAN TABLAS 1,566,075.85 1,262,136.13 104,916.81 199,022.91\n79 ZIHUATANAEJO DE AZUETA 29,541,755.58 18,833,150.73 4,462,399.32 6,246,205.53\n80 ZIRANDARO 3,313,354.11 2,675,207.22 220,626.14 417,520.75\n81 ZITLALA 2,910,594.57 2,269,062.79 223,243.16 418,288.62\nARTICULO UNICO.- Publíquese el presente Acuerdo en el Periódico Oficial del\nGobierno del Estado.\nDado en la residencia oficial del Poder Ejecutivo del Estado, a los once días del mes de enero del año dos mil once.\nEL GOBERNADOR CONSTITUCIONAL DEL ESTADO.\nC.P. CARLOS ZEFERINO TORREBLANCA GALINDO.\nEL SECRETARIO GENERAL DE GOBIERNO.\nC.P. ISRAEL SOBERANIS NOGUEDA.\nEL SECRETARIO DE FINANZAS Y ADMINISTRACIÓN.\nLIC. RICARDO ERNESTO CABRERA MORIN.",
  "ordenamiento": "ACUERDO",
  "jurisdiccion": "GUERRERO",
  "fuente_oficial": "DIARIO OFICIAL DE LA FEDERACION",
  "Fecha de Publicación": "31 DE DICIEMBRE DE 2010",
  "ULTIMA REFORMA PUBLICADA": "18 de Febrero de 2011",
  "status": "ABROGADA",
  "es_escaneado": false,
  "tiene_tablas": true,
  "materia": [
    "municipal"
  ]
}