{
  "titulo": "Acuerdo Mediante el Cual Se Delegan Facultades en el Subsecretario de Regulación, Control y Fomento",
  "Contenido": "SANITARIO DEPENDIENTE DE LA SECRETARÍA\nDE SALUD DEL ESTADO DE GUERRERO\nABROGADO POR EL ARTÍCULO SÉPTIMO TRANSITORIO DEL DECRETO NÚMERO 425\nPOR EL QUE SE RFORMAN Y ADICIONAN DIVERSAS DISPOSICIONES DE LA LEY NÚMERO 1212\nDE SALUD DEL ESTADO DE GUERRERO, PUBLICADO EN EL PERIÓDICO OFICIAL DEL GOBIERNO\nDEL ESTADO No. 103 ALCANCE VIII, DE FECHA 23 DE DICIEMBRE DE 2016.\nTEXTO ORIGINAL.\nAcuerdo publicado en el Periódico Oficial del Gobierno del Estado No. 70, el\nMartes 31 de Agosto de 2010.\nACUERDO MEDIANTE EL CUAL SE DELEGAN FACULTADES EN EL\nSUBSECRETARIO DE REGULACIÓN, CONTROL Y FOMENTO SANITARIO\nDEPENDIENTE DE LA SECRETARÍA DE SALUD DEL ESTADO DE GUERRERO.\nDR. ANTONIO SALVADOR JAIMES HERRERA.- Secretario de Salud en\nGuerrero, con fundamento en lo dispuesto por los artículos 3 fracción II, 4 Bis fracciones\nIV y V, 7 fracción IV, 15, 21, 23 y demás aplicables a la Ley 159 de Salud en la Entidad; numerales 1, 10, 11, 18 fracción VIII y 27 de la Ley Orgánica de la Administración Pública del Estado; así como en el Acuerdo Específico de Coordinación para el Ejercicio de\nFacultades en materia de Control y Fomento Sanitario, suscrito por el Ejecutivo Federal y el Ejecutivo de la Entidad; quien para una mejor organización, vigilancia, trámite y resolución de la operación sanitaria; Tiene a bien expedir el presente: Acuerdo mediante el cual delega facultades en el Subsecretario de Regulación; Control y\nFomento Sanitario.\nQue el programa de acciones inmediatas y la propuesta del Plan Estatal de\nDesarrollo 2006-2011, en congruencia con el Plan Nacional de Salud, señalan dentro de sus objetivos, el establecimiento de condiciones que agilicen la toma de decisiones en materia de Regulación, Control y Fomento Sanitario con el objeto de reducir el periodo necesidad.\nSalud del Estado de Guerrero; señalan al Secretario de Salud como Autoridad Sanitaria, mediante Acuerdos que deberán ser publicados en Periódico Oficial de la Entidad.\nSANITARIO DEPENDIENTE DE LA SECRETARÍA\nDE SALUD DEL ESTADO DE GUERRERO\nQue los artículos 10 y 11 párrafo segundo de la Ley Orgánica de la\nAdministración Publica del Estado de Guerrero, señalan las atribuciones y facultades que corresponde a los titulares de las dependencias y entidades a que se refiere esta Ley; en tal virtud, y para una mejor organización, vigilancia, trámite y resolución de los asuntos de sus dependencias; podrán delegar en sus subalternos cualquiera de sus facultades. Por lo que he tenido a bien expedir el siguiente:\nACUERDO MEDIANTE EL CUAL SE DELEGAN FACULTADES EN EL\nSUBSECRETARIO DE REGULACIÓN, CONTROL Y FOMENTO SANITARIO\nDEPENDIENTE DE LA SECRETARÍA DE SALUD DEL ESTADO DE GUERRERO.\nPRIMERO: Se delegan en el Subsecretario de Regulación, Control y\nFomento Sanitario, el ejercicio de las facultades de Regulación, Control, y Fomento\nSanitario que corresponden a la Secretaría de Salud en Guerrero, en materia de:\nEstablecimientos de salud; Disposición de órganos, tejidos, células de seres humanos y sus componentes; Medicamentos, remedios herbolarios y otros de Insumos para la salud; Alimentos y suplementos alimenticios, bebidas alcohólicas y no alcohólicas;\nProductos de perfumería, belleza y aseo; Tabaco, plaguicidas y fertilizantes, nutrientes vegetales, sustancias toxicas y peligrosas para la salud; Químicos esenciales, precursores químicos; Estupefacientes y psicotrópicos; productos biotecnológicos, materias primas y aditivos; Fuentes de radiación, ionizantes para uso médico; Efectos nocivos de los factores ambientales en la salud humana; Salud ocupacional;\nSaneamiento básico; Importaciones y exportaciones; Publicidad; Sanidad internacional;\nSalubridad local; Así como lo contenido en el Acuerdo Específico.\nQue en términos de los numerales 3 fracción II, 4 Bis, y 7 fracción IV, de la Ley\n159 de Salud en Guerrero, el Subsecretario ejercerá las funciones siguientes:\n1. Expedir órdenes de visitas para la verificación sanitaria;\n2. Suscribir los documentos que se requieren para el trámite de Licencias\nSanitarias, Avisos de Funcionamiento y de Responsables Sanitarios competencia del\nEstado;\nSANITARIO DEPENDIENTE DE LA SECRETARÍA\nDE SALUD DEL ESTADO DE GUERRERO\n3. Vigilar que las herramientas de la vigilancia sanitaria se utilicen de manera adecuada, tal y como lo establece nuestra legislación sanitaria vigente;\n4. Llevar a cabo acciones relativas a la toma, recepción, conservación, manejo y envío de muestras al Laboratorio Estatal de Salud Pública, con estricto apego a los procedimientos establecidos;\n5. Coordinar el proceso de dictamen de las actas de verificación y de resultados de análisis de laboratorio de los establecimientos verificados y productos muestreados en base al procedimiento sanitario vigente;\n6. Emitir y hacer llegar a los particulares los oficios de notificaciones de resultados de los establecimientos verificados y/o productos muestreados;\n7. Citar a los propietarios y/o responsables de los establecimientos verificados a manifestar lo que a su derecho convenga, y ofrezcan pruebas en relación con los hechos controvertidos derivados del acta de verificación;\n8. Dictar medidas de seguridad y otorgar Ordenamientos Plazos para corregir las irregularidades sanitarias, ello de conformidad con los artículos 430 de la Ley General de\nSalud y 313 de la Ley de Salud 159 del estado de Guerrero;\n9. Imponer sanciones administrativas en la esfera de su competencia, ello con sujeción al procedimiento sanitario vigente inmerso en la Ley General de Salud, Ley 159 de Salud en la Entidad, sus Reglamentos, Normas Oficiales Mexicanas y demás disposiciones legales aplicables;\n10. Turnar a la Subdirección Jurídica de la Secretaría de Salud previa preparación: Las Demandas de Amparo, Contencioso Administrativo, Civiles, Penales y ejecute la autoridad sanitaria con motivo de la vigilancia sanitaria;\n11. Promover el establecimiento de mecanismos de coordinación intersectorial y coordinar las actividades con otras unidades administrativas en materia de regulación, control y fomento sanitario;\nSANITARIO DEPENDIENTE DE LA SECRETARÍA\nDE SALUD DEL ESTADO DE GUERRERO\n12. Dar respuestas a consultas y requerimientos de autoridades administrativas y judiciales, así como personas físicas y morales;\n13. Coordinar y supervisar la vigilancia sanitaria de las acciones de saneamiento básico, así como de la salud ambiental y ocupacional;\n14. Promover el establecimiento de mecanismo de coordinación y supervisión en las Coordinaciones Sanitarias en el ámbito de su competencia;\n15. Organizar a nivel estatal la conformación y actualización permanente del padrón de establecimientos, actividades, productos y servicios; referente a la salubridad general, exclusiva, concurrente y local;\n16. Coordinar, supervisar y evaluar las actividades del Laboratorio Estatal de\nSalud Pública, que apoyan la operación sanitaria y fomentar la habilitación y/o certificación de laboratorios privados con el propósito de establecer la red de laboratorios en la Entidad;\n17. Coordinar, supervisar y evaluar las actividades del Centro Estatal de la\nMedicina Transfusional y fomentar la creación de nuevos Bancos de Sangre, Servicios de Transfusión y Puestos de Sangrado debidamente regularizados en el Estado, con el propósito de establecer la red en la Entidad;\n18. Supervisar la cobertura del Servicio Médico Forense; asimismo, mejorar la con el debido soporte técnico;\n19. Establecer los procedimientos administrativos para prestar los servicios de puertos y terminales aéreas del Estado, estableciendo el servicio de control de salud de los ordenamientos en Sanidad Internacional;\nSANITARIO DEPENDIENTE DE LA SECRETARÍA\nDE SALUD DEL ESTADO DE GUERRERO\n20. Establecer las medidas de contingencia sanitarias preventivas y correctivas\nProtección Civil;\n21. Vigilar que las descargas de aguas residuales a cuerpos de agua que se destinen para uso y consumo humano, se realicen previo tratamiento que cumpla con lo establecido por la Norma Oficial Mexicana correspondiente;\n22. Vigilar y certificar la calidad del agua para uso y consumo humano;\n23. Vigilar y supervisar el Control Sanitario del Manejo, Almacenamiento y\nDisposición final de los Residuos Peligrosos, Biológicos Infecciosos. (RPBI).\nSEGUNDO: Las facultades a que se refiere el presente instrumento jurídico se entenderán hechas sin perjuicio del ejercicio directo por parte del Secretario de Salud en el Estado de Guerrero.\nTERCERO: Las facultades contenidas en el primer punto del presente acuerdo y que mediante el procedimiento de delegación de facultades se otorgan al Subsecretario de Regulación, Control y Fomento Sanitario, se entenderán comprendidas dentro del ámbito de competencia del Secretario de Salud en Guerrero.\nCUARTO: El ejercicio de las facultades que el C. Secretario de Salud delega, se sujetarán a las disposiciones legales aplicables, lineamientos y criterios que prevalezcan en la Ley General de Salud; Ley 159 de Salud en el Estado; sus Reglamentos; Normas\nFacultades en Materia de Control y Fomento Sanitario, suscrito por el Ejecutivo Federal y\nQUINTO: Las facultades que el C. Secretario de Salud en Guerrero, delega al C.\nSubsecretario de Regulación, Control y Fomento Sanitario por medio del presente instrumento, deberá informar permanentemente de dicho ejercicio a la superioridad.\nSEXTO: Publíquese el presente Acuerdo en el Periódico Oficial del Gobierno del\nEstado de Guerrero, para que surta los efectos legales conducentes.\nSANITARIO DEPENDIENTE DE LA SECRETARÍA\nDE SALUD DEL ESTADO DE GUERRERO\nEL PRESENTE ACUERDO FUE EMITIDO POR EL C. SECRETARIO DE SALUD\nEN EL ESTADO DE GUERRERO, DADO EN SESIÓN ORDINARIA DE FECHA 02 DE\nAGO, (SIC) DEL AÑO 2010.\nEL SECRETARIO DE SALUD EN EL ESTADO DE GUERRERO.\nDR. ANTONIO SALVADOR JAIMES HERRERA.\nRúbrica.",
  "ordenamiento": "ACUERDO",
  "jurisdiccion": "GUERRERO",
  "fuente_oficial": "DIARIO OFICIAL DE LA FEDERACION",
  "Fecha de Publicación": "23 DE DICIEMBRE DE 2016",
  "ULTIMA REFORMA PUBLICADA": "23 DE DICIEMBRE DE 2016",
  "status": "ABROGADA",
  "es_escaneado": false,
  "tiene_tablas": false,
  "materia": [
    "general"
  ]
}