{
  "titulo": "Acuerdo por el Que Se Da A Conocer A los Municipios del Estado de Guerrero, la Distribución y Calend",
  "Contenido": "MINISTRACIÓN DE LOS RECURSOS\nCORRESPONDIENTES AL FONDO IV DEL RAMO 33\n\"FONDO DE APORTACIONES PARA EL\nFORTALECIMIENTO DE LOS MUNICIPIOS Y DE LAS\nDEMARCACIONES TERRITORIALES DEL DISTRITO\nFEDERAL\" (FORTAMUN-DF) PARA EL EJERCICIO\nFISCAL DE 2018\nTEXTO ORIGINAL\nAcuerdo publicado en el Periódico Oficial del Gobierno del Estado No. 04 Alcance I, el Martes 12 de Enero de 2018.\nACUERDO POR EL QUE SE DA A CONOCER A LOS MUNICIPIOS DEL ESTADO DE GUERRERO, LA\nDISTRIBUCIÓN Y CALENDARIZACIÓN PARA LA MINISTRACIÓN DE LOS RECURSOS\nCORRESPONDIENTES AL FONDO IV DEL RAMO 33 \"FONDO DE APORTACIONES PARA EL\nFORTALECIMIENTO DE LOS MUNICIPIOS Y DE LAS DEMARCACIONES TERRITORIALES DEL\nDISTRITO FEDERAL\" (FORTAMUN-DF) PARA EL EJERCICIO FISCAL DE 2018.\nGuerrero.- Poder Ejecutivo.\nLICENCIADO HÉCTOR ANTONIO ASTUDILLO FLORES, GOBERNADOR CONSTITUCIONAL DEL\nESTADO DE GUERRERO CON FUNDAMENTO EN LO DISPUESTO POR LOS ARTÍCULOS 26 Y 115\nDE LA CONSTITUCIÓN POLÍTICA DE LOS ESTADOS UNIDOS MEXICANOS, 27, 31, 32 Y 37 DE LA\nLEY ORGÁNICA DE LA ADMINISTRACIÓN PÚBLICA FEDERAL; 33, 34, 35 Y 44 DE LA LEY DE\nPLANEACIÓN FEDERAL; 25 FRACCIÓN IV, 36, 37 Y 38 DE LA LEY DE COORDINACIÓN FISCAL; 7 y 8\nDEL PRESUPUESTO DE EGRESOS DE LA FEDERACIÓN PARA EL EJERCICIO FISCAL 2018, 90\nDE GUERRERO, Y EN EJERCICIO DE LAS FACULTADES QUE ME CONFIEREN LOS ARTÍCULOS 1o,\nDE GUERRERO, 2, 4, 6, 7, 18 APARTADO A FRACCIONES I Y III, 20 FRACCIÓN III Y 22 DE LA LEY\nORGÁNICA DE LA ADMINISTRACIÓN PÚBLICA DEL ESTADO DE GUERRERO NÚMERO 08, Y\nQue el artículo 7 del Presupuesto de Egresos de la Federación para el Ejercicio Fiscal 2018, prevé recursos en el Ramo 33 Aportaciones Federales para Entidades Federativas y Municipios, para el Fondo\nFederal.\nQue el ejercicio de los recursos que integran el Ramo 33 deberá apegarse a la distribución, condiciones y términos que establece el Capítulo V de la Ley de Coordinación Fiscal, y no podrán ser erogados con fines distintos a los que ahí se señalan.\nMINISTRACIÓN DE LOS RECURSOS\nCORRESPONDIENTES AL FONDO IV DEL RAMO 33\n\"FONDO DE APORTACIONES PARA EL\nFORTALECIMIENTO DE LOS MUNICIPIOS Y DE LAS\nDEMARCACIONES TERRITORIALES DEL DISTRITO\nFEDERAL\" (FORTAMUN-DF) PARA EL EJERCICIO\nFISCAL DE 2018\nQue la Secretaría de Hacienda y Crédito Público, es la encargada de ministrar a cada entidad federativa, y a través de éstas a los municipios, los montos correspondientes de cada uno de los fondos que conforman el citado ramo 33.\nQue la Ley de Coordinación Fiscal en el Capítulo V, articulo 36 último párrafo establece que \"Los\nGobiernos Estatales y del Distrito Federal deberán publicar en su respectivo periódico oficial las variables y fórmulas utilizadas para determinar los montos que correspondan a cada Municipio o Demarcación\nTerritorial por concepto de este Fondo, así como el calendario de ministraciones, a más tardar el 31 de enero de cada año\".\nQue en virtud de lo antes referido y con el objeto de ministrar los recursos del Ramo 33, específicamente los del Fondo IV \"Fondo de Aportaciones para el Fortalecimiento de los Municipios y de las Demarcaciones Territoriales del Distrito Federal\" conforme al monto autorizado por la Cámara de\nDiputados del Congreso de la Unión para el Estado de Guerrero, he tenido a bien expedir el siguiente:\nACUERDO POR EL QUE SE DA A CONOCER A LOS MUNICIPIOS DEL ESTADO DE\nGUERRERO, LA DISTRIBUCIÓN Y CALENDARIZACIÓN PARA LA MINISTRACIÓN DE LOS\nRECURSOS CORRESPONDIENTES AL FONDO IV DEL RAMO 33 \"FONDO DE APORTACIONES\nPARA EL FORTALECIMIENTO DE LOS MUNICIPIOS Y DE LAS DEMARCACIONES TERRITORIALES\nARTÍCULO PRIMERO. El presente Acuerdo tiene por objeto dar a conocer la fórmula, distribución del Ramo 33 \"Fondo de Aportaciones para el Fortalecimiento de los Municipios y de las Demarcaciones\nTerritoriales del Distrito Federal\" para el ejercicio fiscal 2018.\nARTÍCULO SEGUNDO. Los recursos del FORTAMUN-DF se distribuyen en proporción directa al número de habitantes con que cuenta cada uno de los municipios.\nLa asignación del FORTAMUN-DF para el iésimo municipio se determina mediante la aplicación de la siguiente fórmula:\nMINISTRACIÓN DE LOS RECURSOS\nCORRESPONDIENTES AL FONDO IV DEL RAMO 33\n\"FONDO DE APORTACIONES PARA EL\nFORTALECIMIENTO DE LOS MUNICIPIOS Y DE LAS\nDEMARCACIONES TERRITORIALES DEL DISTRITO\nFEDERAL\" (FORTAMUN-DF) PARA EL EJERCICIO\nFISCAL DE 2018\nDonde:\nAFFMMi = Asignación para el año 2 018, del Fondo de Fortalecimiento Municipal para el iésimo municipio.\nP Mi = Población del año 2015 del iésimo municipio.\n2015\nP EG = Población del año 2015 del Estado de Guerrero.\n2015\nMAFFMEG = Monto autorizado del Fortamún al Estado de Guerrero para el ejercicio fiscal 2018.\nARTÍCULO TERCERO. La Secretaria de Hacienda y Crédito Público, publicó con fecha 20 de diciembre de 2017, el Acuerdo mediante el cual da a conocer la distribución y calendarización para la ministración de los recursos correspondientes al Ramo 33 Aportaciones Federales para Entidades\nFederativas y Municipios, a que se refiere el Capítulo V de la Ley de Coordinación Fiscal.\nAutorizándole al Estado de Guerrero $2,140,336,656.00 (Dos mil ciento cuarenta millones trescientos treinta y seis mil seiscientos cincuenta y seis pesos 00/100 M.N.) del Fondo de Aportaciones\nDistrito Federal, recursos que el Estado de Guerrero debe entregar a los municipios de conformidad a lo establecido en el último párrafo del artículo 38 de la Ley de Coordinación Fiscal.\nARTÍCULO CUARTO. La información utilizada en la aplicación de la fórmula establecida para la distribución del FORTAMUN-DF entre los municipios, es la siguiente:\nMINISTRACIÓN DE LOS RECURSOS\nCORRESPONDIENTES AL FONDO IV DEL RAMO 33\n\"FONDO DE APORTACIONES PARA EL\nMINISTRACIÓN DE LOS RECURSOS\nCORRESPONDIENTES AL FONDO IV DEL RAMO 33\n\"FONDO DE APORTACIONES PARA EL\nMINISTRACIÓN DE LOS RECURSOS\nCORRESPONDIENTES AL FONDO IV DEL RAMO 33\n\"FONDO DE APORTACIONES PARA EL\nFORTALECIMIENTO DE LOS MUNICIPIOS Y DE LAS\nDEMARCACIONES TERRITORIALES DEL DISTRITO\nFEDERAL\" (FORTAMUN-DF) PARA EL EJERCICIO\nLa fuente de información es: Tabulados de la Encuesta Intercensal 2015, para el Estado de\nGuerrero, publicados por el Instituto Nacional de Estadística y Geografía (INEGI) el 08 de diciembre de\n2015.\nARTÍCULO QUINTO. El monto autorizado del Fondo de Aportaciones para el Fortalecimiento de los Municipios y las Demarcaciones Territoriales del Distrito Federal (FORTAMUN-DF) es de $2,140, 336,\n656.00 (Dos mil ciento cuarenta millones trescientos treinta y seis mil seiscientos cincuenta y seis pesos\n00/100 M.N.) los cuales se distribuyen conforme a lo establecido en el artículo segundo del presente\nAcuerdo, obteniéndose las asignaciones siguientes:\nMINISTRACIÓN DE LOS RECURSOS\nCORRESPONDIENTES AL FONDO IV DEL RAMO 33\n\"FONDO DE APORTACIONES PARA EL\nMINISTRACIÓN DE LOS RECURSOS\nCORRESPONDIENTES AL FONDO IV DEL RAMO 33\n\"FONDO DE APORTACIONES PARA EL\nMINISTRACIÓN DE LOS RECURSOS\nCORRESPONDIENTES AL FONDO IV DEL RAMO 33\n\"FONDO DE APORTACIONES PARA EL\nFORTALECIMIENTO DE LOS MUNICIPIOS Y DE LAS\nDEMARCACIONES TERRITORIALES DEL DISTRITO\nFEDERAL\" (FORTAMUN-DF) PARA EL EJERCICIO\nFISCAL DE 2018\nARTÍCULO SEXTO. Conforme a la Ley de Coordinación Fiscal, el calendario de entrega a los municipios de los recursos del FORTAMUN-DF para el ejercicio fiscal de 2018 será:\nMES FORTAMUN\nEnero 31\nFebrero 28\nMarzo 30\nAbril 30\nMayo 31\nJunio 29\nJulio 31\nAgosto 31\nSeptiembre 28\nOctubre 31\nNoviembre 30\nDiciembre 14\nMINISTRACIÓN DE LOS RECURSOS\nCORRESPONDIENTES AL FONDO IV DEL RAMO 33\n\"FONDO DE APORTACIONES PARA EL\nFORTALECIMIENTO DE LOS MUNICIPIOS Y DE LAS\nDEMARCACIONES TERRITORIALES DEL DISTRITO\nFEDERAL\" (FORTAMUN-DF) PARA EL EJERCICIO\nFISCAL DE 2018\nÚNICO. El presente Acuerdo entrará en vigor a partir del día siguiente de su publicación en el\nPeriódico Oficial del Gobierno del Estado de Guerrero.\nDado en la Residencia Oficial del Poder Ejecutivo del Estado, en la Ciudad de Chilpancingo de los Bravo, Guerrero, a los diez días del mes de enero del año dos mil dieciocho.\nEL GOBERNADOR CONSTITUCIONAL DEL ESTADO DE GUERRERO.\nLIC. HÉCTOR ANTONIO ASTUDILLO FLORES.\nRúbrica.\nEL SECRETARIO GENERAL DE GOBIERNO.\nLIC. FLORENCIO SALAZAR ADAME.\nRúbrica.\nEL SECRETARIO DE FINANZAS Y ADMINISTRACIÓN.\nLIC. HÉCTOR APREZA PATRÓN.\nRúbrica.",
  "ordenamiento": "ACUERDO",
  "jurisdiccion": "GUERRERO",
  "fuente_oficial": "DIARIO OFICIAL DE LA FEDERACION",
  "Fecha de Publicación": "12 \nde Enero de 2018",
  "ULTIMA REFORMA PUBLICADA": null,
  "status": "VIGENTE",
  "es_escaneado": false,
  "tiene_tablas": true,
  "materia": [
    "municipal"
  ]
}