{
  "titulo": "Acuerdo por el Que Se Da A Conocer el Calendario de Entrega y Monto Estimado de los Recursos Que Rec",
  "Contenido": "DEL FONDO COMÚN DE PARTICIPACIONES, DEL FONDO DE\nFOMENTO MUNICIPAL, DEL FONDO PARA LA\nINFRAESTRUCTURA A MUNICIPIOS Y DEL FONDO DE\nSOCIAL MUNICIPAL, PARA EL EJERCICIO FISCAL 2014\nTEXTO ORIGINAL.\nAcuerdo publicado en el Periódico Oficial del Gobierno del Estado No. 11 Alcance II, el Viernes\n07 de febrero de 2014.\nACUERDO POR EL QUE SE DA A CONOCER EL CALENDARIO DE ENTREGA Y MONTO\nESTIMADO DE LOS RECURSOS QUE RECIBIRÁN LOS MUNICIPIOS DEL ESTADO DE GUERRERO,\nDEL FONDO COMÚN DE PARTICIPACIONES, DEL FONDO DE FOMENTO MUNICIPAL, DEL FONDO\nPARA LA INFRAESTRUCTURA A MUNICIPIOS Y DEL FONDO DE APORTACIONES ESTATALES\nPARA LA INFRAESTRUCTURA SOCIAL MUNICIPAL, PARA EL EJERCICIO FISCAL 2014.\nGuerrero.- Poder Ejecutivo.\nÁNGEL HELADIO AGUIRRE RIVERO, GOBERNADOR CONSTITUCIONAL DEL ESTADO\nGUERRERO; 6o, 10, 18 FRACCIÓN III, 20 FRACCIÓN III Y 22 DE LA LEY ORGÁNICA DE LA\nADMINISTRACIÓN PÚBLICA DEL ESTADO DE GUERRERO NÚMERO 433; 19 Y 20 DEL DECRETO\nNÚMERO 438 DEL PRESUPUESTO DE EGRESOS DEL ESTADO DE GUERRERO PARA EL\nEJERCICIO FISCAL 2014; Y 26, 27, 28, 29, 30, 31, 32, 33, 34 Y 48 DE LA LEY NUMERO 427 DEL\nSISTEMA DE COORDINACIÓN HACENDARIA DEL ESTADO DE GUERRERO, Y\nQue la Ley de Coordinación Fiscal tiene por objeto coordinar el Sistema Fiscal de la Federación con los Estados, Municipios y Distrito Federal, establecer la participación que corresponda a sus haciendas públicas en los ingresos federales y distribuir entre ellos dichas participaciones.\nQue las participaciones asignadas al Estado de Guerrero para el Ejercicio Fiscal 2014, deben ser\nFiscal y de acuerdo a los criterios y fórmulas que se establecen en la Ley número 427 del Sistema de\nCoordinación Hacendaria del Estado de Guerrero.\nQue la Ley de Coordinación Fiscal en el Capítulo I, artículo 6o penúltimo párrafo, establece que:\n\"Los Gobiernos de las Entidades, a más tardar el 15 de febrero, deberán publicar en su Periódico Oficial, así como en su página oficial de Internet, el calendario de entrega, porcentaje, fórmulas y variables utilizadas, así como los montos, estimados, de las participaciones que las entidades reciban y de las que tengan obligación de participar a sus municipios o demarcaciones territoriales.\nDEL FONDO COMÚN DE PARTICIPACIONES, DEL FONDO DE\nFOMENTO MUNICIPAL, DEL FONDO PARA LA\nINFRAESTRUCTURA A MUNICIPIOS Y DEL FONDO DE\nSOCIAL MUNICIPAL, PARA EL EJERCICIO FISCAL 2014\nPor lo anteriormente expuesto y fundado, he tenido a bien expedir el siguiente:\nACUERDO POR EL QUE SE DA A CONOCER EL CALENDARIO DE ENTREGA Y MONTO\nESTIMADO DE LOS RECURSOS QUE RECIBIRÁN LOS MUNICIPIOSDEL ESTADO DE GUERRERO,\nDEL FONDO COMÚN DE PARTICIPACIONES, DEL FONDO DE FOMENTO MUNICIPAL, DEL FONDO\nPARA LA INFRAESTRUCTURA A MUNICIPIOS Y DEL FONDO DE APORTACIONES ESTATALES\nPARA LA INFRAESTRUCTURA SOCIAL MUNICIPAL, PARA EL EJERCICIO FISCAL 2014.\nARTÍCULO PRIMERO.- El presente Acuerdo tiene por objeto dar a conocer la fórmula, la metodología y los fondos previstos para distribuir entre los Municipios, las participaciones federales que el\nGobierno del Estado de Guerrero tiene la obligación de compartirles para el actual ejercicio fiscal, así como la estimación de los montos que recibirá cada municipio.\nARTÍCULO SEGUNDO.- El monto de las participaciones federales, que el Gobierno del Estado debe entregar a los Municipios, de conformidad con lo previsto por el artículo 27 de la Ley número 427 del Sistema de Coordinación Hacendaria del Estado de Guerrero, se distribuirá en la proporción y conceptos siguientes:\nI.- 20% de los ingresos que perciba el Estado, provenientes del Fondo General de\nParticipaciones.\nII.- 100% de los ingresos que perciba el Estado, correspondientes al Fondo de Fomento\nMunicipal.\nIII.- 20% de los ingresos que correspondan al Estado, derivado de participaciones en el Impuesto\nFederal Sobre Tenencia o Uso de Vehículos.\nIV.- 20% de los ingresos que perciba el Estado, por concepto de participación de la recaudación del Impuesto Especial Sobre la Producción y Servicios, en los términos del artículo 3°-A de la Ley de\nCoordinación Fiscal.\nV.- 20% de los ingresos que correspondan al Estado, derivado de participaciones en el Impuesto\nFederal Sobre Automóviles Nuevos.\nVI.- 20% del Fondo de Fiscalización.\nVII.- 20% del Fondo de Compensación del Impuesto Sobre Automóviles Nuevos.\nVIII.- El 20% del Fondo de Compensación y de la Recaudación Estatal de las Cuotas a la Venta\nFinal de Gasolina y Diesel, de conformidad con lo previsto en el artículo 30 de la Ley número 427 del\nSistema de Coordinación Hacendaria del Estado de Guerrero.\nIX.- El 30% del Fondo de Compensación y la de la Recaudación Estatal de las Cuotas a la Venta\nFinal de Gasolinas y Diesel, a que se refiere el artículo 48 de la Ley número 427 del Sistema de\nCoordinación Hacendaria del Estado de Guerrero.\nDEL FONDO COMÚN DE PARTICIPACIONES, DEL FONDO DE\nFOMENTO MUNICIPAL, DEL FONDO PARA LA\nINFRAESTRUCTURA A MUNICIPIOS Y DEL FONDO DE\nSOCIAL MUNICIPAL, PARA EL EJERCICIO FISCAL 2014\nARTÍCULO TERCERO.- Con las proporciones correspondientes al Fondo General de\nParticipaciones, al Impuesto sobre Tenencia o Uso de Vehículos, al Impuesto Especial Sobre Producción y Servicios, del Impuesto Federal Sobre Automóviles Nuevos, el Fondo de Compensación del Impuesto\nSobre Automóviles Nuevos, el Fondo de Fiscalización, se constituye un Fondo Común de Participaciones a Municipios.\nARTÍCULO CUARTO.- El Fondo Común de Participaciones a Municipios se distribuirá conforme a la fórmula siguiente:\nDonde:\nP es la participación del fondo común del Municipio i en el año t. i,t\nP es la participación del fondo común que el Municipio i recibió en el año 2007. i,07\nΔFC es el crecimiento en el Fondo Común de Participaciones entre el año 2007 y el año t.\n07,t\nC1 es el ingreso propio del iésimo Municipio ponderado por su población dividido por su suma i,t de lo que resulte de cada uno de ellos;\nC2 es la población del iésimo Municipio dividido entre la suma de todos ellos. i,t\nC3 son los ingresos propios per cápita del iésimo Municipio dividido por su suma i,t γ =es la información relativa a los ingresos propios del Municipio i en el año t-1 contenida en la i,t-1 última cuenta pública. α= es la última información oficial de población que hubiere dado a conocer el Instituto Nacional de Estadística, Geografía e Informática para el municipio i.\nDEL FONDO COMÚN DE PARTICIPACIONES, DEL FONDO DE\nFOMENTO MUNICIPAL, DEL FONDO PARA LA\nINFRAESTRUCTURA A MUNICIPIOS Y DEL FONDO DE\nSOCIAL MUNICIPAL, PARA EL EJERCICIO FISCAL 2014\nΣ es la suma sobre todos los Municipios de la variable que le sigue.\nLa conformación de la fórmula de distribución de participaciones a Municipios, está integrada conforme a los porcentajes siguientes:\nGarantía de Participaciones transferidas en el Ejercicio Fiscal 2007 y sobre el excedente:\n60% índice poblacional, 30% ingresos propios per cápita y 10% ingresos propios ponderados por población.\nLa fórmula anterior no será aplicable en el evento de que en el año de cálculo la recaudación federal participable sea menor a la observada en el año 2007. En dicho supuesto la distribución se realizará en función de la cantidad efectivamente generada en el año del cálculo y de acuerdo al coeficiente que cada municipio haya recibido de dicho fondo en el año 2007.\nFormará parte de la distribución de este fondo, el 20% de los recursos que del Fondo de\nFiscalización corresponda al Estado, el cual deberá entregarse a los municipios en forma trimestral de acuerdo a la disposición de la Ley de Coordinación Fiscal.\nARTÍCULO QUINTO.- La Secretaría de Hacienda y Crédito Público, el día viernes 24 de enero del año 2014, publicó en el Diario Oficial de la Federación, el Acuerdo por el que se da a conocer a los\nGobiernos de las Entidades Federativas la distribución y calendarización para la ministración durante el\nEjercicio Fiscal 2014, de los recursos correspondientes al Ramo 28 de Participaciones Federales.\nCorrespondiéndole al Estado de Guerrero las siguientes cantidades: $194’945,714.00 (Ciento noventa y cuatro millones novecientos cuarenta y cinco mil setecientos catorce pesos 00/100 m.n.), de\nImpuestos Especiales Sobre Producción y Servicios, $18’459,046.00 (Dieciocho millones cuatrocientos cincuenta y nueve mil cuarenta y seis pesos 00/100 m.n.), del Fondo de Compensación de Impuestos\nSobre Automóviles Nuevos, $435’439,332.00 (Cuatrocientos treinta y cinco millones cuatrocientos treinta y nueve mil trescientos treinta y dos pesos 00/100 m.n.), del Fondo de compensación de las cuotas a la venta final de Gasolina y Diesel y $512’438,554.00 (Quinientos doce millones cuatrocientos treinta y ocho mil quinientos cincuenta y cuatro pesos 00/100 m.n.), del Fondo de Fiscalización, de dichos montos, el a los Municipios, fueron determinados por la Secretaría de Hacienda y Crédito Público, con base a los coeficientes obtenidos con las fórmulas establecidas en la Ley de Coordinación Fiscal. Estos coeficientes aplicables desde enero del presente ejercicio fiscal.\nDEL FONDO COMÚN DE PARTICIPACIONES, DEL FONDO DE\nFOMENTO MUNICIPAL, DEL FONDO PARA LA\nINFRAESTRUCTURA A MUNICIPIOS Y DEL FONDO DE\nSOCIAL MUNICIPAL, PARA EL EJERCICIO FISCAL 2014\nARTÍCULO SEXTO.- La Secretaría de Hacienda y Crédito Público, el miércoles 29 de enero del año en curso, publicó en el Diario Oficial de la Federación, el Acuerdo mediante el cual da a conocer el calendario de entrega, porcentaje y monto estimado, que recibirá cada Entidad Federativa por el Fondo\nGeneral de Participaciones y por el Fondo de Fomento Municipal durante el Ejercicio Fiscal 2014.\nCorrespondiéndole al Estado de Guerrero las siguientes c a n t i d a d e s: $11,149’230,377.00\n(Once mil ciento cuarenta y nueve millones doscientos treinta mil trecientos setenta y siete pesos 00/100 m.n.), del Fondo General de Participaciones, $397’517,884.00 (Trescientos noventa y siete millones quinientos diecisiete mil ochocientos ochenta y cuatro pesos 00/100 m.n.) del Fondo de Fomento\nMunicipal; de dichos montos, el Gobierno del Estado tiene la obligación de entregar a sus Municipios el\n20% del primer fondo y el 100% del segundo.\nARTÍCULO SÉPTIMO.- La Secretaría de Finanzas y Administración el viernes 27 de diciembre de 2013, publicó en el Periódico Oficial del Gobierno del Estado de Guerrero número 104, la Ley número\n435 de Ingresos del Estado de Guerrero para el Ejercicio Fiscal 2014, en la cual da a conocer los montos estimados de los ingresos por concepto del Impuesto Sobre Tenencia o Uso de Vehículos, del Impuesto\nSobre Automóviles Nuevos y la Recaudación Estatal de las Cuotas a la Venta Final de Gasolina y Diesel.\nSiendo los montos estimados los siguientes: $106’428,800.00 (Ciento seis millones cuatrocientos veintiocho mil ochocientos pesos 00/100 m.n.), del Impuesto sobre Tenencia o Uso de\nVehículos $38’253,500.00 (Treinta y ocho millones doscientos cincuenta y tres mil quinientos pesos\n00/100 m.n.) del Impuesto Sobre Automóviles Nuevos y $258’893,300.00 (Doscientos cincuenta y ocho millones ochocientos noventa y tres mil Trescientos pesos 00/ 100 m.n.), de la Recaudación Estatal de las Cuotas a la Venta Final de Gasolina y Diesel, de dichos montos, el Gobierno del Estado tiene la obligación de entregar a sus Municipios el 20%.\nARTÍCULO OCTAVO.- La información utilizada en la aplicación de las fórmulas establecidas para la distribución tanto del Fondo Común de Participaciones, del Fondo de Fomento Municipal, Fondo\nMunicipal, entre los municipios, es la siguiente:\nMUNICIPIOS VARIABLES\nPOB. 2010(1 ING. PROP. 2012 (2\nTOTAL 3,388,768 1,111,018,731.62\n001 ACAPULCO DE JUÁREZ 789,97 649,069,236.07\n002 ACATEPEC 32,792 742,196.86\nDEL FONDO COMÚN DE PARTICIPACIONES, DEL FONDO DE\nFOMENTO MUNICIPAL, DEL FONDO PARA LA\nINFRAESTRUCTURA A MUNICIPIOS Y DEL FONDO DE\nSOCIAL MUNICIPAL, PARA EL EJERCICIO FISCAL 2014\n003 AHUACUOTZINGO 25,027 208,886.43\n004 AJUCHITLÁN DEL PROGRESO 38,203 123,586.42\n005 ALCOZAUCA DE GUERRERO 18,971 562,761.85\n006 ALPOYECA 6,637 340,034.18\n007 APAXTLA DE CASTREJÓN 12,389 889,602.43\n008 ARCELIA 32,181 16,183,349.82\n009 ATENANGO DEL RÍO 8,390 627,244.06\n010 ATLAMAJALCINGO DEL MONTE 5,706 96,022.66\n011 ATLIXTAC 26,341 488,750.91\n012 ATOYAC DE ÁLVAREZ 61,316 8,029,134.92\n013 AYUTLA DE LOS LIBRES 62,690 2,353,491.37\n014 AZOYÚ 14,429 900,106.60\n015 BENITO JUÁREZ 15,019 4,812,380.54\n016 BUENAVISTA DE CUELLAR 12,688 3,457,520.11\n017 CHILAPA DE ÁLVAREZ 120,79 8,272,056.41\n018 CHILPANCINGO DE LOS BRAVO 241,71 69,282,756.81\n019 COAHUAYUTLA DE JOSÉ MARÍA IZAZAGA 13,025 241,483.88\n020 COCHOAPA EL GRANDE 18,778 136,670.60\n021 COCULA 14,707 1,108,776.83\n022 COPALA 13,636 1,455,854.33\n023 COPALILLO 14,456 82,450.30\n024 COPANATOYAC 18,855 45,331.66\n025 COYUCA DE BENÍTEZ 73,460 7,890,404.97\n026 COYUCA DE CATALÁN 42,069 2,385,468.34\n027 CUAJINICUILAPA 25,922 2,682,651.55\n028 CUALÁC 7,007 345,959.88\n029 CUAUTEPEC 15,115 43,423.70\n030 CUETZALA DEL PROGRESO 9,166 363,947.10\n031 CUTZAMALA DE PINZÓN 21,388 717,358.49\n032 EDUARDO NERI 46,158 4,254,895.47\n033 FLORENCIO VILLARREAL 20,175 1,337,895.06\n034 GENERAL CANUTO A. NERI 6,301 112,208.82\n035 GENERAL HELIODORO CASTILLO 36,586 1,547,836.40\nDEL FONDO COMÚN DE PARTICIPACIONES, DEL FONDO DE\nFOMENTO MUNICIPAL, DEL FONDO PARA LA\nINFRAESTRUCTURA A MUNICIPIOS Y DEL FONDO DE\nSOCIAL MUNICIPAL, PARA EL EJERCICIO FISCAL 2014\n036 HUAMUXTITLÁN 14,393 1,813,260.41\n037 HUITZUCO DE LOS FIGUEROA 37,364 6,900,588.03\n038 IGUALA DE LA INDEPENDENCIA 140,363 62,200,741.39\n039 IGUALAPA 10,815 183,616.06\n040 ILIATENCO 10,522 366,465.97\n041 IXCATEOPAN DE CUAUHTÉMOC 6,603 754,969.97\n042 JOSÉ JOAQUÍN DE HERRERA 15,678 33,225.09\n043 JUAN R. ESCUDERO 24,364 1,450,823.53\n044 JUCHITÁN 7,166 17,708.19\n045 LEONARDO BRAVO 24,720 848,343.76\n046 MALINALTEPEC 29,599 339,253.90\n047 MARQUELIA 12,912 743,621.11\n048 MÁRTIR DE CUILAPAN 17,702 406,985.91\n049 METLATÓNOC 18,976 25,322.50\n050 MOCHITLÁN 11,376 1,003,564.82\n051 OLINALÁ 24,723 1,763,639.40\n052 OMETEPEC 61,306 6,221,345.74\n053 PEDRO ASCENCIO ALQUISIRAS 6,978 216,441.09\n054 PETATLÁN 44,979 6,109,937.81\n055 PILCAYA 11,558 9,465,389.34\n056 PUNGARABATO 37,035 11,389,613.83\n057 QUECHULTENANGO 34,728 1,612,645.33\n058 SAN LUIS ACATLÁN 42,360 853,944.62\n059 SAN MARCOS 48,501 6,424,011.43\n060 SAN MIGUEL TOTOLAPAN 28,009 643,070.05\n061 TAXCO DE ALARCÓN 104,053 20,282,627.36\n062 TECOANAPA 44,079 484,441.46\n063 TÉCPAN DE GALEANA 62,071 4,096,021.76\n064 TELOLOAPAN 53,769 6,170,366.06\n065 TEPECOACUILCO DE TRUJANO 30,470 1,426,614.25\nDEL FONDO COMÚN DE PARTICIPACIONES, DEL FONDO DE\nFOMENTO MUNICIPAL, DEL FONDO PARA LA\nINFRAESTRUCTURA A MUNICIPIOS Y DEL FONDO DE\nSOCIAL MUNICIPAL, PARA EL EJERCICIO FISCAL 2014\n066 TETIPAC 13,128 1,945,977.49\n067 TIXTLA DE GUERRERO 40,058 7,732,754.66\n068 TLACOACHISTLAH UACA 21,306 33,465.22\n069 TLACOAPA 9,967 93,200.38\n070 TLALCHAPA 11,495 391,422.90\n071 TLALIXTAQUILLA DE MALDONADO 7,096 0.00\n072 TLAPA DE COMONFORT 81,419 7,502,000.22\n073 TLAPEHUALA 21,819 3,792,906.91\n074 UNIÓN DE ISIDORO MONTES DE OCA, LA 25,712 8,511,354.02\n075 XALPATLÁHUAC 12,240 147,353.52\n076 XOCHIHUEHUETLÁN 7,079 1,566,638.50\n077 XOCHISTLAHUACA 28,089 0.00\n078 ZAPOTITLÁN TABLAS 10,516 9,180.25\n079 ZIHUATANEJO DE AZUETA 118,211 128,373,305.97\n080 ZIRÁNDARO 18,813 836,400.13\n081 ZITLALA 22,587 4,642,435.45\n1. FUENTE: Censo de población y vivienda 2010, para el Estado de Guerrero, publicado el 07 de julio del 2011, por el Instituto Nacional de\nEstadística, Geografía e Informática (INEGI).\n2 FUENTE: H. Congreso del Estado Auditoría General del Estado. Ingresos reportados por los Ayuntamientos por los conceptos de Impuestos, Derechos, Contribuciones Especiales, Productos y Aprovechamientos durante el Ejercicio Fiscal 2012.\nARTÍCULO NOVENO.- El monto estimado del Fondo Común es de: $2,403'951,198.20 (Dos mil cuatrocientos tres millones novecientos cincuenta y un mil ciento noventa y ocho pesos 20/100 m.n.), el cual se distribuye de acuerdo a lo establecido en el Artículo Cuarto del presente Acuerdo, obteniéndose las asignaciones siguientes:\nMUNICIPIO\nTOTAL FONDO COMUN\nSUMA $2,403'951,198.20\n001 ACAPULCO DE JUÁREZ 591,001,577.64\n002 ACATEPEC 17,773,818.64\n003 AHUACUOTZINGO 13,265,304.84\nDEL FONDO COMÚN DE PARTICIPACIONES, DEL FONDO DE\nFOMENTO MUNICIPAL, DEL FONDO PARA LA\nINFRAESTRUCTURA A MUNICIPIOS Y DEL FONDO DE\nSOCIAL MUNICIPAL, PARA EL EJERCICIO FISCAL 2014\n004 AJUCHITLÁN DEL PROGRESO 24,558,236.75\n005 ALCOZAUCA DE GUERRERO 11,424,563.13\n006 ALPOYECA 5,691,092.48\n007 APAXTLA DE CASTREJÓN 10,463,096.90\n008 ARCELIA 38,202,085.54\n009 ATENANGO DEL RÍO 7,877,184.62\n010 ATLAMAJALCINGO DEL MONTE 3,853,864.13\n011 ATLIXTAC 14,766,036.68\n012 ATOYAC DE ÁLVAREZ 42,499,078.22\n013 AYUTLA DE LOS LIBRES 36,776,559.62\n014 AZOYÚ 11,345,920.38\n015 BENITO JUÁREZ 20,959,940.57\n016 BUENAVISTA DE CUELLAR 17,583,527.90\n017 CHILAPA DE ÁLVAREZ 63,425,052.80\n018 CHILPANCINGO DE LOS BRAVO 141,716,134.28\n019 COAHUAYUTLA DE JOSÉ 9,356,954.40\nMARÍA IZAZAGA\n020 COCHOAPA EL GRANDE 9,429,236.24\n021 COCULA 12,140,690.34\n022 COPALA 11,950,792.97\n023 COPALILLO 8,285,983.33\n024 COPANATOYAC 10,375,168.42\n025 COYUCA DE BENÍTEZ 47,172,821.39\n026 COYUCA DE CATALÁN 29,042,922.24\n027 CUAJINICUILAPA 19,185,685.89\n028 CUALÁC 5,883,841.21\n029 CUAUTEPEC 9,386,707.77\n030 CUETZALA DEL PROGRESO 7,339,416.73\n031 CUTZAMALA DE PINZÓN 16,135,069.29\n032 EDUARDO NERI 29,163,221.69\n033 FLORENCIO VILLARREAL 14,316,839.30\n034 GENERAL CANUTO A. NERI 5,027,431.43\n035 GENERAL HELIODORO 23,307,043.07\nCASTILLO\n036 HUAMUXTITLÁN 13,348,100.84\n037 HUITZUCO DE LOS FIGUEROA 28,920,672.04\nDEL FONDO COMÚN DE PARTICIPACIONES, DEL FONDO DE\nFOMENTO MUNICIPAL, DEL FONDO PARA LA\nINFRAESTRUCTURA A MUNICIPIOS Y DEL FONDO DE\nSOCIAL MUNICIPAL, PARA EL EJERCICIO FISCAL 2014\n038 IGUALA DE LA 96,980,016.05\nINDEPENDENCIA\n039 IGUALAPA 6,994,562.48\n040 ILIATENCO 8,633,935.06\n041 IXCATEOPAN DE 8,392,686.91\nCUAUHTÉMOC\n042 JOSÉ JOAQUÍN DE HERRERA 9,216,881.93\n043 JUAN R. ESCUDERO 16,539,327.72\n044 JUCHITÁN 4,251,509.74\n045 LEONARDO BRAVO 15,649,129.74\n046 MALINALTEPEC 16,020,434.48\n047 MARQUELIA 9,221,823.80\n048 MÁRTIR DE CUILAPAN 10,088,811.02\n049 METLATÓNOC 10,859,371.70\n050 MOCHITLÁN 9,651,480.70\n051 OLINALÁ 16,790,433.98\n052 OMETEPEC 36,745,379.85\n053 PEDRO ASCENCIO 5,725,375.76\nALQUISIRAS\n054 PETATLÁN 32,720,418.80\n055 PILCAYA 36,424,209.44\n056 PUNGARABATO 32,985,020.36\n057 QUECHULTENANGO 22,081,667.60\n058 SAN LUIS ACATLÁN 23,884,826.77\n059 SAN MARCOS 34,250,895.72\n060 SAN MIGUEL TOTOLAPAN 18,183,854.96\n061 TAXCO DE ALARCÓN 69,722,953.63\n062 TECOANAPA 27,052,499.22\n063 TÉCPAN DE GALEANA 39,321,493.23\n064 TELOLOAPAN 37,206,744.56\n065 TEPECOACUILCO DE TRUJANO 20,497,299.57\n066 TETIPAC 13,483,998.38\n067 TIXTLA DE GUERRERO 28,958,973.91\n068 TLACOACHISTLAHUACA 10,786,354.20\n069 TLACOAPA 6,135,109.46\n070 TLALCHAPA 8,871,132.85\n071 TLALIXTAQUILLA DE 4,178,299.89\nMALDONADO\nDEL FONDO COMÚN DE PARTICIPACIONES, DEL FONDO DE\nFOMENTO MUNICIPAL, DEL FONDO PARA LA\nINFRAESTRUCTURA A MUNICIPIOS Y DEL FONDO DE\nSOCIAL MUNICIPAL, PARA EL EJERCICIO FISCAL 2014\n072 TLAPA DE COMONFORT 43,533,721.10\n073 TLAPEHUALA 19,688,418.38\n074 UNION DE ISIDORO MONTES DE OCA, 28,430,522.91\n075 XALPATLÁHUAC 7,721,346.54\n076 XOCHIHUEHUETLÁN 12,659,840.94\n077 XOCHISTLAHUACA 15,016,386.09\n078 ZAPOTITLÁN TABLAS 6,381,795.49\n079 ZIHUATANEJO DE AZUETA 105,330,702.79\n080 ZIRÁNDARO 14,557,609.80\n081 ZITLALA 19,172,266.98\nQue en el marco de la VII Reunión del Grupo de Trabajo de \"Comisión de Vigilancia y\nDistribución de Participaciones\", celebrada con fecha viernes 18 de enero del 2008, en la Ciudad Capital de Chilpancingo, Guerrero, se presentó formalmente el nuevo esquema de la Distribución de las\nParticipaciones Federales a los Municipios que integran el Estado, que fue aprobado por unanimidad.\nQue el Gobierno del Estado de Guerrero, con un espíritu solidario y una visión municipalista impulsado en el seno de los trabajos del Sistema Estatal de Coordinación Fiscal, definió un conjunto de estrategias tendientes a fortalecer las haciendas públicas de sus Municipios, mediante un esfuerzo de la política fiscal que ha venido implementando con la finalidad de garantizar liquidez a las finanzas de los municipios, lo que se refleja en un firme propósito de otorgar anticipos a las participaciones que por concepto del Fondo General de Participaciones reciben los Municipios cada mes.\nQue en los trabajos de la XI Comisión Permanente de Funcionarios Fiscales, celebrada en el\nMunicipio de Alpoyeca, Guerrero, el 21 de enero de 2008, los integrantes de la Comisión en representación de los Municipios del Estado, aprobaron por unanimidad el nuevo esquema de\nDistribución del Fondo Común propuesto en esta reunión, el cual consiste en otorgar durante la primera quincena del mes correspondiente al entero de participaciones, un anticipo de hasta un 50% de la cantidad que por concepto del Fondo General de Participaciones recibieron en el mes inmediato anterior; sujeto a la disponibilidad financiera que por participaciones federales presente la Tesorería del Estado, participaciones federales recibe el Estado al final del mes, los cuales son transferidos a cada municipio en los términos que estipula el artículo 34 de la Ley número 427 del Sistema de Coordinación Hacendaria del Estado de Guerrero.\nARTÍCULO DÉCIMO.- El monto estimado de las participaciones que se liquiden a los Municipios del Fondo Común, así como los montos de los otros conceptos que se establecen en este Acuerdo,\nDEL FONDO COMÚN DE PARTICIPACIONES, DEL FONDO DE\nFOMENTO MUNICIPAL, DEL FONDO PARA LA\nINFRAESTRUCTURA A MUNICIPIOS Y DEL FONDO DE\nSOCIAL MUNICIPAL, PARA EL EJERCICIO FISCAL 2014 tendrán el carácter de provisionales y estarán sujetas al resultado de la recaudación de los conceptos participables, así como a la determinación definitiva mensual, a los ajustes cuatrimestrales y del ejercicio, que efectué la Federación para el Estado, motivo por el cual la estimación no significa compromiso de pago.\nSi como resultado de los ajustes mensuales, cuatrimestrales y del ejercicio que efectué la\nFederación para el Estado, surgieran diferencias a cargo de los municipios en relación con los pagos provisionales, el Estado, retendrá el importe pagado en exceso, en la liquidación provisional del mes siguiente y en caso contrario, realizará el entero correspondiente.\nARTÍCULO DÉCIMO PRIMERO.- El Fondo de Fomento Municipal se distribuye de acuerdo a los siguientes criterios:\na).- 40% en proporción directa a la captación de ingresos propios, aplicando la fórmula:\n(IPMI / ∑IPMI N) X 0.4 X FFM;\nDonde:\nIPMI = Ingresos propios del iesimo Municipio en el año inmediato anterior o la información disponible más reciente.\n∑IPMI\nN = Sumatoria de los ingresos propios del iesimo hasta el enésimo Municipio del año inmediato anterior.\n0.4 = Porcentaje a distribuir del Fondo de Fomento Municipal.\nFFM = Monto en pesos del Fondo de Fomento Municipal.\nb)- 60% en proporción directa al número de habitantes de cada Municipio, aplicando la fórmula:\nDonde:\nPMI = Población del iesimo Municipio.\nDEL FONDO COMÚN DE PARTICIPACIONES, DEL FONDO DE\nFOMENTO MUNICIPAL, DEL FONDO PARA LA\nINFRAESTRUCTURA A MUNICIPIOS Y DEL FONDO DE\nSOCIAL MUNICIPAL, PARA EL EJERCICIO FISCAL 2014\nPE = Población estatal.\n0.6 = Porcentaje a distribuir del Fondo de Fomento Municipal.\nFFM = Monto en pesos del Fondo de Fomento Municipal.\nARTÍCULO DÉCIMO SEGUNDO.- El Fondo de Fomento Municipal por la cantidad de\n$397'517,884.00 (Trescientos noventa y siete millones quinientos diecisiete mil ochocientos ochenta y cuatro pesos 00/100 m.n.), se distribuye de acuerdo al Artículo Décimo Primero del presente Acuerdo, como sigue:\nMUNICIPIO\nFONDO DE FOMENTO MUNICIPAL\nSUMA $397'517,884.00\n001 ACAPULCO DE JUÁREZ 148,494,021.56\n002 ACATEPEC 2,414,212.37\n003 AHUACUOTZINGO 1,791,363.86\n004 AJUCHITLÁN DEL PROGRESO 2,706,518.80\n005 ALCOZAUCA DE GUERRERO 1,415,772.27\n006 ALPOYECA 515,795.36\n007 APAXTLA DE CASTREJÓN 999,290.00\n008 ARCELIA 4,581,120.52\n009 ATENANGO DEL RÍO 680,281.10\n010 ATLAMAJALCINGO DEL MONTE 415,346.56\n011 ATLIXTAC 1,923,900.69\n012 ATOYAC DE ÁLVAREZ 5,464,703.79\n013 AYUTLA DE LOS LIBRES 4,749,120.72\n014 AZOYÚ 1,144,374.09\n015 BENITO JUÁREZ 1,745,818.25\n016 BUENAVISTA DE CUELLAR 1,387,850.61\n017 CHILAPA DE ÁLVAREZ 9,685,412.34\n018 CHILPANCINGO DE LOS BRAVO 26,928,334.51\nDEL FONDO COMÚN DE PARTICIPACIONES, DEL FONDO DE\nFOMENTO MUNICIPAL, DEL FONDO PARA LA\nINFRAESTRUCTURA A MUNICIPIOS Y DEL FONDO DE\nSOCIAL MUNICIPAL, PARA EL EJERCICIO FISCAL 2014\n019 COAHUAYUTLA DE JOSÉ MARÍA IZAZAGA 951,295.68\n020 COCHOAPA EL GRANDE 1,341,207.05\n021 COCULA 1,193,805.04\n022 COPALA 1,168,098.35\n023 COPALILLO 1,029,252.91\n024 COPANATOYAC 1,333,554.04\n025 COYUCA DE BENÍTEZ 6,299,576.82\n026 COYUCA DE CATALÁN 3,302,335.30\n027 CUAJINICUILAPA 2,208,397.49\n028 CUALÁC 542,685.05\n029 CUAUTEPEC 1,070,049.77\n030 CUETZALA DEL PROGRESO 697,215.76\n031 CUTZAMALA DE PINZÓN 1,608,012.71\n032 EDUARDO NERI 3,857,679.31\n033 FLORENCIO VILLARREAL 1,611,448.86\n034 GENERAL CANUTO A. NERI 459,540.61\n035 GENERAL HELIODORO CASTILLO 2,796,546.26\n036 HUAMUXTITLÁN 1,272,529.48\n037 HUITZUCO DE LOS FIGUEROA 3,617,380.94\n038 IGUALA DE LA INDEPENDENCIA 18,781,197.13\n039 IGUALAPA 787,467.82\n040 ILIATENCO 793,015.18\n041 IXCATEOPAN DE CUAUHTÉMOC 572,787.10\n042 JOSÉ JOAQUÍN DE HERRERA 1,108,215.46\n043 JUAN R. ESCUDERO 1,922,444.19\n044 JUCHITÁN 506,896.92\n045 LEONARDO BRAVO 1,861,274.53\n046 MALINALTEPEC 2,131,811.69\n047 MARQUELIA 1,015,207.41\n048 MÁRTIR DE CUILAPAN 1,304,162.36\n049 METLATÓNOC 1,339,206.74\nDEL FONDO COMÚN DE PARTICIPACIONES, DEL FONDO DE\nFOMENTO MUNICIPAL, DEL FONDO PARA LA\nINFRAESTRUCTURA A MUNICIPIOS Y DEL FONDO DE\nSOCIAL MUNICIPAL, PARA EL EJERCICIO FISCAL 2014\n050 MOCHITLÁN 944,302.54\n051 OLINALÁ 1,992,481.28\n052 OMETEPEC 5,205,272.09\n053 PEDRO ASCENCIO ALQUISIRAS 522,107.54\n054 PETATLÁN 4,040,188.91\n055 PILCAYA 2,168,154.37\n056 PUNGARABATO 4,236,686.78\n057 QUECHULTENANGO 2,675,050.49\n058 SAN LUIS ACATLÁN 3,103,627.24\n059 SAN MARCOS 4,333,026.43\n060 SAN MIGUEL TOTOLAPAN 2,063,384.95\n061 TAXCO DE ALARCÓN 10,226,349.90\n062 TECOANAPA 3,171,732.79\n063 TÉCPAN DE GALEANA 4,954,941.96\n064 TELOLOAPAN 4,667,501.15\n065 TEPECOACUILCO DE TRUJANO 2,348,736.41\n066 TETIPAC 1,202,489.61\n067 TIXTLA DE GUERRERO 3,926,090.15\n068 TLACOACHISTLAHUACA 1,504,363.90\n069 TLACOAPA 714,843.29\n070 TLALCHAPA 865,069.28\n071 TLALIXTAQUILLA DE MALDONADO 499,435.90\n072 TLAPA DE COMONFORT 6,804,164.95\n073 TLAPEHUALA 2,078,515.28\n074 UNIÓN DE ISIDORO MONTES DE OCA, LA 3,027,811.44\n075 XALPATLÁHUAC 882,573.58\n076 XOCHIHUEHUETLÁN 722,454.17\n077 XOCHISTLAHUACA 1,976,980.46\n078 ZAPOTITLÁN TABLAS 741,458.71\nDEL FONDO COMÚN DE PARTICIPACIONES, DEL FONDO DE\nFOMENTO MUNICIPAL, DEL FONDO PARA LA\nINFRAESTRUCTURA A MUNICIPIOS Y DEL FONDO DE\nSOCIAL MUNICIPAL, PARA EL EJERCICIO FISCAL 2014\n079 ZIHUATANEJO DE AZUETA 26,692,586.53\n080 ZIRÁNDARO 1,443,814.37\n081 ZITLALA 2,254,152.19\nARTÍCULO DÉCIMO TERCERO.- Conforme a lo establecido en el artículo 3o primer párrafo de la Ley de Coordinación Fiscal, el calendario de entrega a los municipios de las participaciones para el\nEjercicio Fiscal 2014 será:\nFondo General de Fondo de Fomento\nParticipaciones Municipal\n31/ENERO/2014 5/FEBRERO/2014\n28/FEBRERO/2014 5/MARZO/2014\n28/MARZO/2014 4/ABRIL/2014\n30/ABRIL/2014 5/MAYO/2014\n30/MAYO/2014 4/JUNIO/2014\n30/JUNI0/2014 4/JULIO/2014\n30/JULIO/2014 5/AGOSTO/2014\n29/AGOSTO/2014 3/SEPTIEMBRE/2014\n30/SEPTIEMBRE/2014 3/OCTUBRE/2014\n31/OCTUBRE/2014 5/NOVIEMBRE/2014\n28/NOVIEMBRE/2014 3/DICIEMBRE/2014\n31/DICIEMBRE/2014 5/ENERO/2015\nARTÍCULO DÉCIMO CUARTO.- Con el propósito de impulsar a través de los planes de ambiente en el artículo 30 de la Ley número 427 del Sistema de Coordinación Hacendaria del Estado de\nGuerrero, se crea el Fondo para la Infraestructura a Municipios, de conformidad con las reformas al artículo 4o-A de la Ley de Coordinación Fiscal, en las cuales se establece que las participaciones\nCompensación de Gasolina y Diesel, los Municipios y Demarcaciones territoriales recibirán como mínimo el 20% de la recaudación que correspondan a las Entidades Federativas.\nDEL FONDO COMÚN DE PARTICIPACIONES, DEL FONDO DE\nFOMENTO MUNICIPAL, DEL FONDO PARA LA\nINFRAESTRUCTURA A MUNICIPIOS Y DEL FONDO DE\nSOCIAL MUNICIPAL, PARA EL EJERCICIO FISCAL 2014\nLos Municipios, deberán de informar cada seis meses a la Secretaria de Finanzas y\nAdministración, para que ésta a su vez informe a la Secretaria de Hacienda y Crédito Público de la aplicación de los recursos que reciban del Fondo de Infraestructura Municipal, en los términos de lo dispuesto por el artículo 4o-A último párrafo de la Ley de Coordinación Fiscal.\nARTÍCULO DÉCIMO QUINTO.- El Fondo para la Infraestructura a Municipios, se distribuirá conforme a la fórmula siguiente:\nEn donde:\nT es la participación del fondo del Municipio i en el año t\n1, 2 en el año en que se efectúa el cálculo. a es la última información de población del Municipio i dada a conocer por el INEGI.\n¡ β¡ es la recaudación per cápita de ingresos propios expresada en su forma inversa, a su vez ponderada por la población del Municipio i del año t-1.\n∑¡ es la sumatoria de la variable que le sigue.\nARTÍCULO DÉCIMO SEXTO.- El Fondo para la Infraestructura a Municipios se estima la cantidad de $138'866,526.40 (Ciento treinta y ocho millones ochocientos sesenta y seis quinientos veintiséis pesos 40/100 m.n.), y se distribuye de acuerdo al Artículo Décimo Quinto del presente Acuerdo, como sigue:\nDEL FONDO COMÚN DE PARTICIPACIONES, DEL FONDO DE\nFOMENTO MUNICIPAL, DEL FONDO PARA LA\nINFRAESTRUCTURA A MUNICIPIOS Y DEL FONDO DE\nSOCIAL MUNICIPAL, PARA EL EJERCICIO FISCAL 2014\nMUNICIPIO\nFONDO P/LA INFRAESTRUCTURA A MUNICIPIOS\nSUMA $ 138'866,526.40\n001 ACAPULCO DE JUÁREZ 46,998,462.72\n002 ACATEPEC 968,466.40\n003 AHUACUOTZINGO 725,730.35\n004 AJUCHITLÁN DEL PROGRESO 1,100,484.45\n005 ALCOZAUCA DE GUERRERO 565,283.69\n006 ALPOYECA 203,132.15\n007 APAXTLA DE CASTREJÓN 388,735.04\n008 ARCELIA 1,529,938.07\n009 ATENANGO DEL RÍO 264,186.35\n010 ATLAMAJALCINGO DEL MONTE 167,276.81\n011 ATLIXTAC 773,916.48\n012 ATOYAC DE ÁLVAREZ 2,059,914.25\n013 AYUTLA DE LOS LIBRES 1,886,507.18\n014 AZOYÚ 447,646.25\n015 BENITO JUÁREZ 611,269.20\n016 BUENAVISTA DE CUELLAR 493,601.35\n017 CHILAPA DE ÁLVAREZ 3,775,030.56\n018 CHILPANCINGO DE LOS BRAVO 9,531,535.91\n019 COAHUAYUTLA DE JOSÉ MARÍA IZAZAGA 382,676.15\n020 COCHOAPA EL GRANDE 543,770.35\n021 COCULA 463,445.09\n022 COPALA 445,737.94\n023 COPALILLO 417,760.92\n024 COPANATOYAC 542,554.16\n025 COYUCA DE BENÍTEZ 2,403,062.05\n026 COYUCA DE CATALÁN 1,296,194.32\n027 CUAJINICUILAPA 844,162.25\n028 CUALÁC 213,967.77\n029 CUAUTEPEC 435,201.03\n030 CUETZALA DEL PROGRESO 276,572.96\nDEL FONDO COMÚN DE PARTICIPACIONES, DEL FONDO DE\nFOMENTO MUNICIPAL, DEL FONDO PARA LA\nINFRAESTRUCTURA A MUNICIPIOS Y DEL FONDO DE\nSOCIAL MUNICIPAL, PARA EL EJERCICIO FISCAL 2014\n031 CUTZAMALA DE PINZON 640,412.15\n032 EDUARDO NERI 1,483,585.12\n033 FLORENCIO VILLARREAL 628,885.53\n034 GENERAL CANUTO A. NERI 184,951.19\n035 GENERAL HELIODORO CASTILLO 1,107,506.10\n036 HUAMUXTITLÁN 480,854.09\n037 HUITZUCO DE LOS FIGUEROA 1,330,535.60\n038 IGUALA DE LA INDEPENDENCIA 6,358,648.81\n039 IGUALAPA 317,112.54\n040 ILIATENCO 315,564.60\n041 IXCATEOPAN DE CUAUHTÉMOC 217,715.77\n042 JOSÉ JOAQUÍN DE HERRERA 450,968.21\n043 JUAN R. ESCUDERO 753,281.19\n044 JUCHITÁN 206,220.26\n045 LEONARDO BRAVO 740,901.80\n046 MALINALTEPEC 861,766.22\n047 MARQUELIA 398,263.37\n048 MÁRTIR DE CUILAPAN 523,041.33\n049 METLATÓNOC 545,274.69\n050 MOCHITLÁN 363,950.56\n051 OLINALÁ 775,308.76\n052 OMETEPEC 1,991,840.49\n053 PEDRO ASCENCIO ALQUISIRAS 208,279.38\n054 PETATLÁN 1,519,324.22\n055 PILCAYA 686,464.87\n056 PUNGARABATO 1,489,423.62\n057 QUECHULTENANGO 1,056,639.70\n058 SAN LUIS ACATLÁN 1,247,114.03\n059 SAN MARCOS 1,632,129.39\n060 SAN MIGUEL TOTOLAPAN 827,549.37\n061 TAXCO DE ALARCÓN 3,745,292.15\n062 TECOANAPA 1,282,568.04\n063 TÉCPAN DE GALEANA 1,934,091.04\n064 TELOLOAPAN 1,773,730.62\n065 TEPECOACUILCO DE TRUJANO 927,523.69\nDEL FONDO COMÚN DE PARTICIPACIONES, DEL FONDO DE\nFOMENTO MUNICIPAL, DEL FONDO PARA LA\nINFRAESTRUCTURA A MUNICIPIOS Y DEL FONDO DE\nSOCIAL MUNICIPAL, PARA EL EJERCICIO FISCAL 2014\n066 TETIPAC 449,544.27\n067 TIXTLA DE GUERRERO 1,439,016.60\n068 TLACOACHISTLAHUACA 612,415.96\n069 TLACOAPA 289,397.42\n070 TLALCHAPA 344,410.51\n071 TLALIXTAQUILLA DE MALDONADO 203,548.19\n072 TLAPA DE COMONFORT 2,616,801.38\n073 TLAPEHUALA 768,099.36\n074 UNIÓN DE ISIDORO MONTES DE OCA, LA 1,056,697.75\n075 XALPATLÁHUAC 356,628.82\n076 XOCHIHUEHUETLÁN 261,804.92\n077 XOCHISTLAHUACA 805,730.94\n078 ZAPOTITLÁN TABLAS 301,994.98\n079 ZIHUATANEJO DE AZUETA 8,204,498.23\n080 ZIRÁNDARO 571,012.07\n081 ZITLALA 821,984.30\nARTÍCULO DÉCIMO SÉPTIMO.- Conforme a las disposiciones del artículo 48 de la Ley número\n427 del Sistema de Coordinación Hacendaria del Estado de Guerrero, con el 30% del Fondo de compensación y de la Recaudación Estatal de las Cuotas a la Venta final de Gasolina y Diesel a que se refiere el artículo 4o-A de la Ley de Coordinación Fiscal, se constituye el Fondo de Aportaciones\nEstatales para la Infraestructura Social Municipal, mismo que será distribuido en forma mensual. De los recursos que reciban los municipios por este Fondo, deberán destinarse prioritariamente a obras, programas y acciones de infraestructura vial, sea rural o urbana; infraestructura hidráulica; movilidad urbana; producción agrícola y por lo menos un 15% a programas de protección y conservación ambiental.\nEl Fondo de Aportaciones Estatales para la Infraestructura Social Municipal, se distribuirá conforme a la fórmula siguiente:\nFAEIMi,t = es la participación del Fondo de Aportaciones Estatales para la Infraestructura\nMunicipal del Municipio i en el año para el cual se efectúa el cálculo.\nDEL FONDO COMÚN DE PARTICIPACIONES, DEL FONDO DE\nFOMENTO MUNICIPAL, DEL FONDO PARA LA\nINFRAESTRUCTURA A MUNICIPIOS Y DEL FONDO DE\nSOCIAL MUNICIPAL, PARA EL EJERCICIO FISCAL 2014\nC1i,t, y C2i,t son los coeficientes de distribución del Fondo de Aportaciones Estatales para la infraestructura Social Municipal del Municipio i en el año en que se efectúa el cálculo. αi = el número de habitantes del Municipio i. yi,t = la información relativa a la recaudación de Ingresos propios del Municipio i en el año de cálculo contenida en la última cuenta pública.\n∑in= la suma sobre todos los Municipios de la variable que le sigue.\nARTÍCULO DÉCIMO OCTAVO.- El Fondo de Aportaciones Estatales para la Infraestructura\nSocial Municipal, se estima la cantidad de $208'299,789.60 (Doscientos ocho millones doscientos noventa y nueve mil setecientos ochenta y nueve pesos 60/100 m.n.), misma que se distribuye de acuerdo al artículo inmediato anterior del presente Acuerdo, como sigue:\nINF. SOC. MPAL.\nSUMA $208'299,789.60\n001 ACAPULCO DE JUÁREZ 39,393,118.58\n002 ACATEPEC 1,559,782.15\n003 AHUACUOTZINGO 1,131,729.21\n004 AJUCHITLÁN DEL PROGRESO 1,665,047.49\n005 ALCOZAUCA DE GUERRERO 1,011,332.35\n006 ALPOYECA 622,459.55\n007 APAXTLA DE CASTREJÓN 1,005,230.21\n008 ARCELIA 4,691,418.89\n009 ATENANGO DEL RÍO 852,594.99\n010 ATLAMAJALCINGO DEL MONTE 356,170.35\n011 ATLIXTAC 1,255,392.63\n012 ATOYAC DE ÁLVAREZ 3,499,316.90\n013 AYUTLA DE LOS LIBRES 2,944,245.45\n014 AZOYÚ 1,031,037.72\n015 BENITO JUÁREZ 2,753,167.68\n016 BUENAVISTA DE CUELLAR 2,337,793.74\n017 CHILAPA DE ÁLVAREZ 5,647,592.83\n018 CHILPANCINGO DE LOS BRAVO 12,285,190.60\n019 COAHUAYUTLA DE JOSÉ MARÍA IZAZAGA 682,343.03\nDEL FONDO COMÚN DE PARTICIPACIONES, DEL FONDO DE\nFOMENTO MUNICIPAL, DEL FONDO PARA LA\nINFRAESTRUCTURA A MUNICIPIOS Y DEL FONDO DE\nSOCIAL MUNICIPAL, PARA EL EJERCICIO FISCAL 2014\n020 COCHOAPA EL GRANDE 855,826.76\n021 COCULA 1,128,542.85\n022 COPALA 1,288,764.96\n023 COPALILLO 659,507.96\n024 COPANATOYAC 827,090.56\n025 COYUCA DE BENÍTEZ 3,867,079.55\n026 COYUCA DE CATALÁN 2,182,978.25\n027 CUAJINICUILAPA 1,795,857.26\n028 CUALÁC 626,151.46\n029 CUAUTEPEC 669,249.94\n030 CUETZALA DEL PROGRESO 655,479.86\n031 CUTZAMALA DE PINZÓN 1,140,815.87\n032 EDUARDO NERI 2,592,201.31\n033 FLORENCIO VILLARREAL 1,304,132.90\n034 GENERAL CANUTO A. NERI 388,213.94\n035 GENERAL HELIODORO CASTILLO 1,852,391.28\n036 HUAMUXTITLÁN 1,447,696.66\n037 HUITZUCO DE LOS FIGUEROA 2,822,086.79\n038 IGUALA DE LA INDEPENDENCIA 8,953,362.98\n039 IGUALAPA 576,980.63\n040 ILIATENCO 681,751.67\n041 IXCATEOPAN DE CUAUHTÉMOC 1,035,942.97\n042 JOSÉ JOAQUÍN DE HERRERA 688,518.50\n043 JUAN R. ESCUDERO 1,439,880.00\n044 JUCHITÁN 324,583.36\n045 LEONARDO BRAVO 1,289,298.21\n046 MALINALTEPEC 1,348,934.65\n047 MARQUELIA 934,266.22\n048 MÁRTIR DE CUILAPAN 912,849.46\n049 METLATÓNOC 825,262.52\n050 MOCHITLÁN 1,069,560.89\n051 OLINALÁ 1,532,840.66\nDEL FONDO COMÚN DE PARTICIPACIONES, DEL FONDO DE\nFOMENTO MUNICIPAL, DEL FONDO PARA LA\nINFRAESTRUCTURA A MUNICIPIOS Y DEL FONDO DE\nSOCIAL MUNICIPAL, PARA EL EJERCICIO FISCAL 2014\n052 OMETEPEC 3,305,127.13\n053 PEDRO ASCENCIO ALQUISIRAS 504,203.60\n054 PETATLÁN 2,828,552.42\n055 PILCAYA 5,882,349.61\n056 PUNGARABATO 3,615,745.65\n057 QUECHULTENANGO 1,799,601.24\n058 SAN LUIS ACATLÁN 1,955,198.68\n059 SAN MARCOS 2,957,812.44\n060 SAN MIGUEL TOTOLAPAN 1,356,125.37\n061 TAXCO DE ALARCÓN 5,758,877.41\n062 TECOANAPA 1,968,871.90\n063 TÉCPAN DE GALEANA 3,104,670.25\n064 TELOLOAPAN 3,068,131.55\n065 TEPECOACUILCO DE TRUJANO 1,618,914.51\n066 TETIPAC 1,539,566.66\n067 TIXTLA DE GUERRERO 2,992,931.57\n068 TLACOACHISTLAHUACA 927,069.88\n069 TLACOAPA 490,341.45\n070 TLALCHAPA 718,508.25\n071 TLALIXTAQUILLA DE MALDONADO 305,322.29\n072 TLAPA DE COMONFORT 4,109,124.12\n073 TLAPEHUALA 2,081,878.28\n074 UNIÓN DE ISIDORO MONTES DE OCA, LA 3,283,006.73\n075 XALPATLÁHUAC 605,816.40\n076 XOCHIHUEHUETLÁN 1,759,815.15\n077 XOCHISTLAHUACA 1,208,596.41\n078 ZAPOTITLÁN TABLAS 458,216.42\n079 ZIHUATANEJO DE AZUETA 12,227,160.99\n080 ZIRÁNDARO 1,101,814.86\nDEL FONDO COMÚN DE PARTICIPACIONES, DEL FONDO DE\nFOMENTO MUNICIPAL, DEL FONDO PARA LA\nINFRAESTRUCTURA A MUNICIPIOS Y DEL FONDO DE\nSOCIAL MUNICIPAL, PARA EL EJERCICIO FISCAL 2014\n081 ZITLALA 2,323,373.15\nARTÍCULO ÚNICO.- Publíquese el presente Acuerdo en el Periódico Oficial del Gobierno del\nDado en la Residencia Oficial del Poder Ejecutivo del Estado, en la Ciudad de Chilpancingo de los Bravo, Guerrero, a los tres días del mes de febrero del año dos mil catorce.\nEL GOBERNADOR CONSTITUCIONAL DEL ESTADO\nLIC. ÁNGEL HELADIO AGUIRRE RIVERO.\nRúbrica.\nEL SECRETARIO GENERAL DE GOBIERNO.\nDR. JESÚS MARTÍNEZ GARNELO.\nRúbrica.\nEL SECRETARIO DE FINANZAS Y ADMINISTRACIÓN.\nC.P. JORGE SILVERIO SALGADO LEYVA.\nRúbrica.",
  "ordenamiento": "ACUERDO",
  "jurisdiccion": "GUERRERO",
  "fuente_oficial": "DIARIO OFICIAL DE LA FEDERACION",
  "Fecha de Publicación": "07 de febrero de 2014",
  "ULTIMA REFORMA PUBLICADA": null,
  "status": "VIGENTE",
  "es_escaneado": false,
  "tiene_tablas": true,
  "materia": [
    "general"
  ]
}