{
  "titulo": "Acuerdo por el Que Se Crea la Comisión de Bioética del Estado de Guerrero, Como Un Órgano Consultivo",
  "Contenido": "CONSULTIVO, NORMATIVO Y DE\nCOORDINACIÓN ENTRE LAS\nDEPENDENCIAS E INSTITUCIONES\nPRIVADAS.\nTEXTO ORIGINAL.\nAcuerdo publicado en el Periódico Oficial del Gobierno del Estado No. 80, el\nViernes 06 de Octubre de 2006.\nACUERDO POR EL QUE SE CREA LA COMISIÓN DE BIOÉTICA DEL ESTADO DE\nGUERRERO, COMO UN ÓRGANO CONSULTIVO, NORMATIVO Y DE\nCOORDINACIÓN ENTRE LAS DEPENDENCIAS E INSTITUCIONES PRIVADAS.\nAl margen un sello con el Escudo Nacional que dice: Gobierno del Estado Libre y\nSoberano de Guerrero.- Poder Ejecutivo.\nCARLOS ZEFERINO TORREBLANCA GALINDO, GOBERNADOR\nFUNDAMENTO EN EL ARTÍCULO 74 FRACCIÓN IV DE LA CONSTITUCIÓN POLÍTICA\nDEL ESTADO, Y EN USO DE LAS FACULTADES QUE ME CONFIEREN LOS\nARTÍCULOS 6o., 10 Y 12 DE LA LEY ORGÁNICA DE LA ADMINISTRACIÓN PÚBLICA\nESTATAL; 116, 117 FRACCIÓN XIII Y 118 FRACCIÓN V DE LA LEY NÚM. 159, DE\nSALUD DEL ESTADO DE GUERRERO, Y\nQue el Plan Estatal de Desarrollo 2005-2011, plantea como objetivos lograr la equidad, calidad y eficiencia de los servicios de salud, a través de estrategias que procuren garantizar su calidad, una atención integral a los usuarios y la accesibilidad de la población en general, partir de las consolidaciones de la infraestructura y equipamiento que se requiere en esta materia.\nQue el derecho a la protección de la salud, es una garantía social consagrada en el artículo 4o. de la Constitución Política de los Estados Unidos Mexicanos, cuyas finalidades fundamentales, entre otras, son el bienestar físico y mental del hombre, la\nCONSULTIVO, NORMATIVO Y DE\nCOORDINACIÓN ENTRE LAS\nDEPENDENCIAS E INSTITUCIONES\nPRIVADAS. prolongación y mejoramiento de la calidad de la vida humana, así como la protección y acrecentamiento de valores que contribuyan a la creación, conservación y disfrute de condiciones de salud que coadyuven al desarrollo social.\nQue la Bioética como Disciplina que se ocupa del análisis y ponderación de la conducta humana en el campo de las ciencias de la salud, forma parte de un movimiento universal de responsabilidad moral y profesional y de la ética incorporada en el respeto a la vida y al medio ambiente.\nQue reflexivamente la Bioética hace pragmático el derecho a la protección a la salud como garantía social consagrada en la Constitución Política de los Estados Unidos\nMexicanos.\nQue la Bioética es un factor de convivencia y de comprensión celular como concepto moral científico vigilante de la justicia en la transferencia de tecnologías, en el respeto de los derechos y la dignidad humana.\nQue con fundamento en los artículo 4º de la Constitución Política de los Estados\nUnidos Mexicanos, 96; 97; 98; 99; 100; 101; 102 y 103 de la Ley General de Salud, 2º;\n94; 96; 97; 98 y 100 de la Ley Número 159 de Salud del Estado de Guerrero; así como, septiembre del año 2005; y\nPor todo lo anteriormente expuesto y fundado, he tenido a bien expedir el siguiente:\nCONSULTIVO, NORMATIVO Y DE\nCOORDINACIÓN ENTRE LAS\nDEPENDENCIAS E INSTITUCIONES\nPRIVADAS.\nGUERRERO, COMO UN ÓRGANO CONSULTIVO, NORMATIVO Y DE\nCOORDINACIÓN ENTRE LAS DEPENDENCIAS E INSTITUCIONES PRIVADAS.\nARTÍCULO 1.- La Comisión de Bioética del Estado de Guerrero como Órgano\nConsultivo, Normativo y de Coordinación entre las Dependencias, Entidades Públicas e\nInstituciones Privadas, tendrá por objeto promover el estudio y observancia de valores y principios éticos para el ejercicio tanto de la atención médica como de la investigación en salud y fomentar la preservación del medio ambiente.\nARTÍCULO 2.- Para el cumplimiento de su objeto corresponderá a la Comisión de\nBioética del Estado de Guerrero:\nI.- Promover, difundir y salvaguardar los principios generales de la Bioética como beneficencia, con equidad, justicia y respeto a la dignidad humana y al ecosistema;\nII.- Promover la aplicación de las guías de Bioética para la atención médica la salud pública y la investigación;\nIII.- Difundir entre la sociedad y los profesionales, técnicos y auxiliares de la salud, los principios y valores bioéticos que deben regir el ejercicio de su actividad;\nIV.- Emitir en su ámbito de competencia las recomendaciones pertinentes sobre los protocolos de investigación en seres humanos y animales;\nV.- Apoyar el desempeño de los Comités de Bioética de las instituciones de salud, de enseñanza superior y otras instituciones afines;\nVI.- Colaborar con las acciones o temas que solicite la Comisión Nacional de\nBioética;\nCONSULTIVO, NORMATIVO Y DE\nCOORDINACIÓN ENTRE LAS\nDEPENDENCIAS E INSTITUCIONES\nPRIVADAS.\nVII.- Emitir las reglas de operación de la Comisión de Bioética del Estado de\nGuerrero;\nVIII.- Fomentar el respeto y ejercicio de los principios bioéticos en la actividad médica y sanitaria como es la carta de los derechos de los pacientes; así como, el código de bioética y de conducta para el personal de salud;\nIX.- Conocer, opinar y dar seguimiento a los protocolos de investigación con implicaciones bioéticas que se desarrollen en instituciones u organismos públicos y privados; y\nX.- Las demás que le asigne el Ejecutivo Estatal.\nARTÍCULO 3.- La Comisión de Bioética del Estado de Guerrero, estará integrada por:\nI.- Un Presidente cuyo cargo recaerá en el Secretario de Salud y Titular de los Servicios Estatales de Salud del Estado;\nII.- Un Secretario Técnico cuyo cargo recaerá en el Subsecretario de\nPrevención y Control de Enfermedades de la Secretaría de Salud del Estado;\nIII.- Quince Vocales cuyo cargo recaerá en cada uno de los titulares de:\nb) La Delegación Estatal del Instituto Mexicano del Seguro Social;\nc) La Delegación Estatal del Instituto de Seguridad Social al Servicio de los\nTrabajadores del Estado;\nCONSULTIVO, NORMATIVO Y DE\nCOORDINACIÓN ENTRE LAS\nDEPENDENCIAS E INSTITUCIONES\nPRIVADAS.\nd) El Sistema para el Desarrollo Integral de la Familia del Estado de\nGuerrero;\ne) La Secretaría de Educación Guerrero;\nf) La Comisión Estatal de Derechos Humanos;\ng) La Universidad Autónoma de Guerrero;\nh) La Secretaría Estatal del Medio Ambiente y Recursos Naturales;\ni) La Secretaría Estatal de Agricultura, Ganadería, Recursos Naturales, Pesca y Alimentación;\nj) La Comisión Estatal de Arbitraje Médico;\nk) De la VIII Zona Naval Regional;\nl) Dirección General de CECYTEG;\nm) De la Diócesis de Acapulco;\nn) De la Secretaría de la Mujer;\no) De la Secretaría de la Juventud;\nCada vocal podrá designar a un suplente para que acuda a las reuniones, si así lo consideran pertinente.\nLos cargos que se mencionan en este Acuerdo serán honoríficos.\nCONSULTIVO, NORMATIVO Y DE\nCOORDINACIÓN ENTRE LAS\nDEPENDENCIAS E INSTITUCIONES\nPRIVADAS.\nARTÍCULO 4.- Por conducto de su Presidente, serán invitados a formar parte de la misma Comisión en calidad de vocales a los miembros destacados de la sociedad que sean líderes en el ámbito científico y cultural.\nARTÍCULO 5.- El Presidente de la Comisión Bioética del Estado de Guerrero, tendrá las funciones siguientes:\nI.- Presidir las sesiones de la Comisión Bioética del Estado de Guerrero, y representarlo cuando fuere necesario;\nII.- Convocar a los miembros de la Comisión de Bioética del Estado de\nGuerrero, por conducto del Secretario Técnico a la celebración de sesiones de la misma;\nIII.- Ejecutar los acuerdos de la Comisión de Bioética del Estado de Guerrero, así como elaborar y presentar los planes y programas de trabajo a la Comisión;\nIV.- Proponer a la Comisión de Bioética del Estado de Guerrero, la integración de grupos de trabajo;\nVI.-(sic)Las que le señale este ordenamiento, la Comisión de Bioética del Estado de Guerrero, y las demás disposiciones aplicables.\nARTÍCULO 6.- El Secretario Técnico, tendrá las funciones siguientes:\nI.- Convocar por instrucciones del Presidente de la Comisión de Bioética del\nEstado de Guerrero, a sesiones ordinarias o extraordinarias;\nII.- Tomar las medidas pertinentes a fin de que las resoluciones de la\nComisión Bioética del Estado de Guerrero, se cumplan de manera articulada, congruente y eficaz, ya que su ejecución corresponde a la propia comisión o bien a las dependencias, entidades o instituciones participantes en la misma;\nCONSULTIVO, NORMATIVO Y DE\nCOORDINACIÓN ENTRE LAS\nDEPENDENCIAS E INSTITUCIONES\nPRIVADAS.\nIII.- Establecer los sistemas de operación y control necesarios para alcanzar los objetivos propuestos por la Comisión de Bioética del Estado de Guerrero, en coordinación con las demás unidades de la Secretaría de Salud y mantener la coordinación con las dependencias, entidades e instituciones involucradas;\nIV.- Presentar periódicamente a la Comisión de Bioética del Estado de\nGuerrero, un informe de las actividades a su cargo. En el informe y en los documentos de apoyo se cotejarán los objetivos propuestos y los compromisos asumidos con las realizaciones alcanzadas;\nV.- Someter el calendario de sesiones a la consideración de la Comisión de\nBioética del Estado de Guerrero;\nVI.- Auxiliar al Presidente de la Comisión Bioética del Estado de Guerrero, en la elaboración del orden del día;\nVII.- Remitir a los miembros de la Comisión Bioética del Estado de Guerrero, con la debida oportunidad el orden del día, así como la documentación correspondiente;\nVIII.- Turnar las convocatorias y la información de que trata la fracción anterior, con la anticipación que sea posible, en el caso de sesiones extraordinarias;\nIX.- Elaborar las actas de las sesiones de la Comisión Bioética del Estado de\nGuerrero, firmándolas conjuntamente con el Presidente, registrarlas y sistematizar los acuerdos correspondientes;\nX.- Llevar el seguimiento de los acuerdos y medidas adoptadas por la\nComisión Bioética del Estado de Guerrero;\nXI.- Verificar que exista quórum suficiente para llevar a cabo las sesiones de la\nComisión Bioética del Estado de Guerrero;\nCONSULTIVO, NORMATIVO Y DE\nCOORDINACIÓN ENTRE LAS\nDEPENDENCIAS E INSTITUCIONES\nPRIVADAS.\nXII.- Ordenar y clasificar los estudios e investigaciones que se presenten a la\nComisión Bioética del Estado de Guerrero, y proporcionar a sus integrantes la información y materiales que le requieran;\nXIII.- Llevar el registro de los integrantes, propietarios y suplentes de la\nComisión Bioética del Estado de Guerrero; y\nXIV.- Las que le señale este ordenamiento, el Reglamento Interno de la\nComisión de Bioética del Estado de Guerrero, el Presidente y las demás disposiciones aplicables.\nARTÍCULO 7.- Los vocales tendrán las funciones siguientes:\na) Asistir a las reuniones de la Comisión de Bioética del Estado de Guerrero;\nb) Participar en las actividades que acuerde la Comisión de Bioética del\nEstado de Guerrero;\nc) Participar en los grupos de trabajo que se les asigne para el desarrollo de las actividades de la Comisión de Bioética del Estado de Guerrero;\nd) Proponer e impulsar los proyectos dirigidos a garantizar la Bioética en salud pública, la protección social, la prevención de la naturaleza y el desarrollo sustentable, así como en la educación; y\ne) Cumplir con los acuerdos y compromisos adquiridos en el seno de la\nComisión.\nARTÍCULO 8.- El Presidente de la Comisión de Bioética del Estado de Guerrero,\nCONSULTIVO, NORMATIVO Y DE\nCOORDINACIÓN ENTRE LAS\nDEPENDENCIAS E INSTITUCIONES\nPRIVADAS. escrito a los Vocales. En caso de que el Presidente se ausente a alguna sesión de la\nComisión será suplido por el Secretario Técnico.\nARTÍCULO 9.- Los miembros de la Comisión de Bioética del Estado de Guerrero, se reunirán trimestralmente en sesiones ordinarias o en sesiones extraordinarias cuando la urgencia de algún asunto así lo requiera, convocados por su Presidente y una sesión al año deberá ser presidida por el Gobernador del Estado.\nSe considerará quórum para la celebración de las sesiones la asistencia del\nPresidente de la Comisión y la concurrencia de por lo menos la mitad más uno de los miembros del mismo.\nLos acuerdos y recomendaciones se tomarán por mayoría de votos y, en caso de empate, el Presidente tendrá voto de calidad.\nDe no integrarse el quórum a que se refiere el párrafo anterior, se convocará a una segunda sesión que se celebrará con el número de miembros que asistan, entre los que deberá estar siempre el Presidente.\nARTÍCULO 10.- Para el cumplimiento de su objeto, la Comisión de Bioética del\nEstado de Guerrero, podrá constituir los comités y grupos de trabajo que considere necesarios.\nARTÍCULO 11.- Las dependencias y entidades que conforme a lo previsto en el artículo 4 de este Acuerdo, formen parte de la Comisión de Bioética del Estado de\nGuerrero, como Vocales, deberán observar los lineamientos que se establezcan en su propio Reglamento Interno.\nCONSULTIVO, NORMATIVO Y DE\nCOORDINACIÓN ENTRE LAS\nDEPENDENCIAS E INSTITUCIONES\nPRIVADAS.\nPRIMERO.- El presente Acuerdo entrará en vigor al día siguiente de su publicación en el Periódico Oficial del Gobierno del Estado.\nSEGUNDO.- Los miembros de la Comisión de Bioética del Estado de Guerrero, celebrarán sesión plenaria de integración dentro de los cinco días siguientes a la fecha de publicación de este Acuerdo.\nTERCERO.- La Comisión de Bioética del Estado de Guerrero, expedirá dentro de los noventa días siguientes a la fecha en que se celebre la sesión de instalación su\nReglamento Interno.\nCUARTO.- Los casos no previstos en este Acuerdo, serán resueltos por la propia\nComisión de Bioética del Estado de Guerrero.\nChilpancingo de los Bravo, Guerrero, a los dieciséis días del mes de agosto del año dos mil seis.\nEL GOBERNADOR CONSTITUCIONAL DEL ESTADO.\nC.P. CARLOS ZEFERINO TORREBLANCA GALINDO.\nEL SECRETARIO GENERAL DE GOBIERNO.\nLIC. ARMANDO CHAVARRÍA BARRERA.\nCONSULTIVO, NORMATIVO Y DE\nCOORDINACIÓN ENTRE LAS\nDEPENDENCIAS E INSTITUCIONES\nPRIVADAS.\nEL SECRETARIO DE SALUD.\nDR. LUIS RODRÍGO BARRERA RÍOS.",
  "ordenamiento": "ACUERDO",
  "jurisdiccion": "GUERRERO",
  "fuente_oficial": "DIARIO OFICIAL DE LA FEDERACION",
  "Fecha de Publicación": "06 de Octubre de 2006",
  "ULTIMA REFORMA PUBLICADA": null,
  "status": "VIGENTE",
  "es_escaneado": false,
  "tiene_tablas": false,
  "materia": [
    "ética"
  ]
}