{
  "titulo": "Acuerdo por el Que Se Crea la Dirección General de Medidas Cautelares y Ejecución de Sentencias",
  "Contenido": "TEXTO ORIGINAL\nCOMISARIO GENERAL D.M.P. LIC. LEONARDO OCTAVIO VÁZQUEZ PÉREZ, SECRETARIO\nDE SEGURIDAD PÚBLICA Y PROTECCIÓN CIVIL, DEL GOBIERNO DEL ESTADO DE GUERRERO,\nCON FUNDAMENTO EN LO DISPUESTO EN LOS ARTÍCULOS 24 FRACCIÓN XXXVII DE LA LEY\nORGÁNICA DE LA ADMINISTRACIÓN PÚBLICA DEL ESTADO DE GUERRERO NÚMERO 433; 10\nFRACCIONES XII, XXI Y XXII DEL REGLAMENTO INTERIOR DE LA SECRETARÍA DE SEGURIDAD\nPÚBLICA Y PROTECCIÓN CIVIL, Y 1, 2 FRACCIONES I, II INCISOS a), b) y c), III, IV, 11, 12, 13, 14, 19\nAPARTADO A FRACCIONES III, V, VI, VII Y VIII, APARTADO B FRACCIONES I, II, Y III, Y, APARTADO\nC FRACCIONES I, II Y III, 20 FRACCIONES I, II Y III DE LA LEY NUMERO 847 DE EJECUCION PENAL\nDEL ESTADO DE GUERRERO.\nEl 18 de junio de 2008 fue publicado en el Diario Oficial de la Federación el Decreto por el que se reforman los artículos 16, 17, 18, 19, 20, 21 y 22; las fracciones XXI y XXIII del artículo 73; la fracción VII del artículo 115 y la fracción XIII del apartado B del artículo 123, de la Constitución Política de los Estados\nUnidos Mexicanos, lo que hace inaplazable el establecimiento del Nuevo Sistema de Justicia Penal\nAcusatorio, que representa un verdadero cambio de modelo de justicia que todos los actores debemos asumir con responsabilidad y compromiso.\nLos artículos transitorios segundo y tercero del Decreto en mención establecen los lineamientos temporales para la entrada en vigor en el Estado del sistema procesal penal acusatorio, lo que hace inminente su implementación en el Estado de Guerrero; en consecuencia, al ya haberse expedido y puesto en vigor normas relacionadas y modificaciones a los ordenamientos legales necesarios a fin de incorporar el sistema procesal penal acusatorio en nuestro Estado, el presente acuerdo resulta necesario como complemento a las normas existentes, dado que la Secretaria de Seguridad Pública y Protección Civil, con la reforma constitucional de referencia tiene una enorme responsabilidad como es la de vigilar el cumplimiento efectivo de las medidas cautelares impuestas, así como proporcionar información del cautelar, respectivamente.\nEl Plan Estatal de Desarrollo 2011-2015, Eje Estratégico 1, se contempla entre otros objetivos y metas, \"Actualizar permanentemente un marco normativo que obedezca a las necesidades de actuación y reformas constitucionales y legales vigentes en materia de seguridad pública, protección civil y readaptación social\", así como \"fortalecer el Estado de Derecho y la Cultura de la Legalidad, generando solución de conflictos, prevención de delitos y atención ciudadana. Así como al reforzamiento de las acciones de seguridad y vigilancia preventiva\". de marzo del presente año, en materia de medidas cautelares establece en su artículo 153 que corresponderá a las autoridades competentes de la Federación y de las entidades federativas, para medidas cautelares, vigilar que el mandato de la autoridad judicial sea debidamente cumplido, así mismo en el numeral 164 ordena que la evaluación y supervisión de medidas cautelares distintas a la prisión preventiva corresponderá a la autoridad de supervisión de medidas cautelares y de la suspensión condicional del proceso que se regirá por los principios de neutralidad, objetividad, imparcialidad y confidencialidad. La información que se recabe con motivo de la evaluación de riesgo no puede ser usada para la investigación del delito y no podrá ser proporcionada al Ministerio Público. Lo anterior, salvo que se trate de un delito que está en curso o sea inminente su comisión, y peligre la integridad personal o la vida de una persona, el entrevistador quedará relevado del deber de confidencialidad y podrá darlo a conocer a los agentes encargados de la persecución penal. Para decidir sobre la necesidad de la imposición o revisión de las medidas cautelares, la autoridad de supervisión de medidas cautelares y de la suspensión condicional del proceso proporcionará a las partes la información necesaria para ello, de modo que puedan hacer la solicitud correspondiente al Órgano jurisdiccional. Para tal efecto, la autoridad de supervisión de medidas cautelares y de la suspensión condicional del proceso, tendrá acceso a los sistemas y bases de datos del Sistema Nacional de Información y demás de carácter público, y contará con una base de datos para dar seguimiento al cumplimiento de las medidas cautelares distintas a la prisión preventiva. Las partes podrán obtener la información disponible de la autoridad competente cuando así lo solicite, previo a la audiencia para debatir la solicitud de medida cautelar. La supervisión de la prisión preventiva quedará a cargo de la autoridad penitenciaria en los términos de la ley de la materia. Por su parte el numeral 174 párrafo último dispone que en caso de que el imputado incumpla con la medida cautelar impuesta, distinta a la prisión preventiva o garantía económica, la autoridad de supervisión de medidas cautelares y de la suspensión condicional del proceso deberá informar al Ministerio Público para que, en su caso, solicite al\nJuez de control la comparecencia del imputado.\nEl Código Nacional de referencia en su CAPÍTULO V\" DE LA SUPERVISIÓN DE LAS MEDIDAS\nCAUTELARES\" particularmente en los artículos 176 y 177 establece que la Autoridad de Supervisión de\nMedidas Cautelares y de la Suspensión Condicional del Proceso, tiene por objeto proporcionar a las partes información sobre la evaluación de riesgos que representa el imputado y el seguimiento de las medidas cautelares y de la suspensión condicional del proceso, teniendo como obligaciones\nI. Supervisar y dar seguimiento a las medidas cautelares impuestas, distintas a la prisión preventiva, y las condiciones a cargo del imputado en caso de suspensión condicional del proceso, así obligaciones impuestas;\nII. Entrevistar periódicamente a la víctima o testigo del delito, con el objeto de dar seguimiento al y canalizarlos, en su caso, a la autoridad correspondiente;\nIII. Realizar entrevistas así como visitas no anunciadas en el domicilio o en el lugar en donde se encuentre el imputado;\nIV. Verificar la localización del imputado en su domicilio o en el lugar en donde se encuentre, autoridad judicial así lo requiera;\nV. Requerir que el imputado proporcione muestras, sin previo aviso, para detectar el posible uso de alcohol o drogas prohibidas, o el resultado del examen de las mismas en su caso, cuando la modalidad de la suspensión condicional del proceso impuesta por la autoridad judicial así lo requiera;\nVI. Supervisar que las personas e instituciones públicas y privadas a las que la autoridad judicial encargue el cuidado del imputado, cumplan las obligaciones contraídas;\nVII. Solicitar al imputado la información que sea necesaria para verificar el cumplimiento de las medidas y obligaciones impuestas;\nVIII. Revisar y sugerir el cambio de las condiciones de las medidas impuestas al imputado, de oficio o a solicitud de parte, cuando cambien las circunstancias originales que sirvieron de base para imponer la medida;\nIX. Informar a las partes aquellas violaciones a las medidas y obligaciones impuestas que estén debidamente verificadas, y puedan implicar la modificación o revocación de la medida o suspensión y sugerir las modificaciones que estime pertinentes;\nX. Conservar actualizada una base de datos sobre las medidas cautelares y obligaciones impuestas, su seguimiento y conclusión;\nXI. Solicitar y proporcionar información a las oficinas con funciones similares de la Federación o de Entidades federativas dentro de sus respectivos ámbitos de competencia;\nXII. Ejecutar las solicitudes de apoyo para la obtención de información que le requieran las oficinas con funciones similares de la Federación o de las Entidades federativas en sus respectivos ámbitos de competencia;\nXIII. Canalizar al imputado a servicios sociales de asistencia, públicos o privados, en materias de salud, empleo, educación, vivienda y apoyo jurídico, cuando la modalidad de la medida cautelar o de la suspensión condicional del proceso impuesta por la autoridad judicial así lo requiera, y\nXIV. Las demás que establezca la legislación aplicable.\nAsí mismo la norma de mérito en sus artículo 178 y 182, establece que en el supuesto de que la\nAutoridad de Supervisión de Medidas Cautelares y de la Suspensión Condicional del Proceso, advierta que existe un riesgo objetivo e inminente de fuga o de afectación a la integridad personal de los intervinientes, revisión de la medida cautelar, así como llevar un registro de actividades de supervisión.\nSoberano de Guerrero, publicado en el Periódico Oficial del Estado numero 34 alcance 1 del 29 de abril del año dos mil catorce, incorpora en sus artículo 92 y 139 del Sistema acusatorio adversarial y oral, las medidas cautelares y desde luego, los principios rectores que lo rigen previstos en el artículo 20 de la inculpados y víctimas y ofendidos del delito previsto en la Constitución Política de los Estados Unidos\nMexicanos; a los primeros se les impondrá medidas cautelares a solicitud de la víctima, o en su caso, el ofendido, mismas que deberá vigilar la Secretaria de Seguridad Pública y Protección Civil, como actor en el Sistema Acusatorio Adversarial, correspondiéndole la enorme tarea de evaluar y supervisión esas medidas cautelares.\nLa Ley número 847 de Ejecución Penal del Estado de Guerrero, en sus artículos 1, 2, 19, 20, y 23, señalan las atribuciones, facultades y obligaciones en la materia, las cuales son de orden público y de interés social, que los Poderes Judicial y Ejecutivo del Estado vigilarán, en el ámbito de sus respectivas competencias, el cumplimiento y aplicación de esta Ley, así como la organización y funcionamiento de las instituciones destinadas a la ejecución de las penas y medidas de seguridad, teniendo por objeto:\nI. Establecer las atribuciones y obligaciones de las autoridades encargadas o relacionadas con el\nSistema Penitenciario, dedicadas, a la aplicación de la ley respecto de la reinserción de los sentenciados;\nII. Establecer las bases para la coordinación entre autoridades judiciales y administrativas, así como la concertación con entidades de derecho privado, en materia de ejecución y vigilancia de las medidas cautelares, reales y personales decretadas por los jueces de control;\nIII. Supervisar las medidas cautelares personales decretadas por los jueces de juicio oral;\nIV. Verificar las condiciones a cumplir como consecuencia de los acuerdos suscitados en relación con los mecanismos alternativos de solución de controversias y la suspensión condicional del proceso;\nV. Establecer las bases para la coordinación entre autoridades judiciales y administrativas, así como la concertación con entidades de derecho privado, en materia de ejecución y vigilancia de las penas y medidas de seguridad impuestas mediante sentencia que haya causado ejecutoria;\nVI. Establecer la determinación de los medios de prevención y de reinserción social que, en lo conducente, resulten aplicables a la persona sujeta a las penas de prisión previstas en el Código Penal del\nEstado y otras leyes;\nVII. Establecer las bases generales del Sistema Penitenciario, así como de la organización y funcionamiento de los Centros de Reinserción Social en la entidad;\nVIII. Proporcionar los parámetros generales para la prevención especial a través del tratamiento derivado del sistema técnico progresivo, acorde con los instrumentos jurídicos internacionales;\nIX. Establecer los lineamientos generales para el desarrollo de las relaciones entre internos y autoridades penitenciarias, durante el tiempo que permanezcan en prisión, así como el contacto que deberán tener con el exterior;\nX. Establecer el recurso correspondiente contra las determinaciones del Juez de Ejecución Penal.\nSeñala el artículo 19, que corresponde a la Secretaría de Seguridad Pública y Protección Civil, por conducto de las áreas administrativas correspondientes, las atribuciones siguientes:\nA. En materia de reinserción social:\nI. Organizar, supervisar, en el ámbito de sus atribuciones, y administrar los Centros de Reinserción\nSocial del Estado;\nII. Expedir la normatividad de orden interno que la regirá, así como vigilar su estricto cumplimiento;\nIII. Custodiar, trasladar, intercambiar, vigilar y brindar tratamiento a toda persona privada de su libertad, por orden de los Tribunales del Poder Judicial o de la autoridad competente, desde el momento de su ingreso a cualquier centro de reinserción social;\nIV. Proponer los reglamentos interiores de los centros de reinserción social, con estricto apego a los derechos humanos, especialmente al principio de no discriminación, y vigilar su exacta aplicación;\nV. Aplicar los tratamientos adecuados a las personas internas, reglamentando su trabajo, sus actividades educativas, culturales, sociales, deportivas y otras, garantizando que estos tratamientos y reglamentos estén libres de cualquier tipo de discriminación;\nVI. Resolver sobre las modificaciones no esenciales a las medidas impuestas, tomando en cuenta la edad, sexo, salud o constitución física de los internos;\nVII. Asistir a las personas liberadas, organizando patronatos, fomentando la formación de cooperativas, fideicomisos u otros entes similares, y celebrar convenios de coordinación con instituciones de las distintas esferas de gobierno o de la sociedad civil;\nVIII. Coadyuvar en el mantenimiento de la estadística criminal del Estado;\nIX. Prevenir el delito al interior de los centros de reinserción social, y\nX. Las demás que otras leyes establezcan.\nB. En materia de medidas judiciales dictadas durante el proceso:\nI. Ejecutar las medidas cautelares de prisión preventiva, presentación periódica, y en su caso la localización electrónica o por otros medios.\nII. Vigilar y coordinar la ejecución del resto de las medidas cautelares reales y personales, así como el cumplimiento de las condiciones impuestas durante la suspensión del proceso a prueba, y\nIII. Las demás que otras leyes establezcan.\nC. En materia de penas y medidas de seguridad:\nI. Ejecutar las penas de prisión y de relegación, sus modalidades y las resoluciones del Juez de\nEjecución Penal que de ellas deriven;\nII. Vigilar y coordinar la ejecución de las penas y medidas de seguridad, y\nIII. Las demás que otras leyes establezcan.\nPara el cumplimiento de las atribuciones antes señaladas, la Secretaría podrá:\nI. Hacer comparecer a los imputados y sentenciados con fines de notificación, información, registro y control de las medidas cautelares y de seguridad decretadas, así como acudir a los domicilios proporcionados por éstos con el objeto de constatar la información proporcionada;\nII. Requerir la información y documentación a las autoridades auxiliares e integrar un informe técnico para su remisión al juez correspondiente en el que se especifiquen las circunstancias particulares del cumplimiento, incumplimiento o irregularidad en las medidas cautelares y de seguridad decretadas, así como la imposibilidad material para la ejecución de dichas medidas;\nIII. Implementar en coordinación con las autoridades auxiliares, programas y protocolos orientados a la eficacia y cumplimiento de las medidas cautelares y de seguridad a su cargo.\nConsiderando las disposiciones trascritas, resulta urgente y necesaria la creación de la Dirección\nGeneral de Medidas Cautelares y Ejecución de Sentencias, ordenada por los artículos transitorios segundo y tercero del Decreto por el que se reforman los artículos 16, 17, 18, 19, 20, 21 y 22; las fracciones XXI y\nXXIII del artículo 73; la fracción VII del artículo 115 y la fracción XIII del apartado B del artículo 123, de la obligaciones y facultades que le atribuyen las normas citadas, a la Secretaria de Seguridad Pública y\nProtección civil, considerando que como actor en el Nuevo Sistema de Justicia Penal, debe colaborar en el rubro que le corresponde, debido a que las medidas cautelares constituyen una de las más importantes nuevo de Sistema de Justicia Penal, dado que las medidas cautelares en el proceso penal afrontan la difícil tarea de conciliar la necesidad de proteger a la sociedad y en especial, a la víctima u ofendido del delito, con la obligación del mismo Estado de Derecho de respetar los derechos del individuo sujeto a proceso. información de calidad, útil para las partes, relativa a sustituir, modificar, revocar o ampliar una medida cautelar, tomando en consideración la necesidad de cautela y los riesgos procesales que tiene el imputado y en segundo término realizar la vigilancia, dar seguimiento, ejecutar e informar respecto al cumplimiento es decir mantendrá una dualidad: 1) la evaluación, para identificar vínculos y posibles riesgos que permitan recomendar las medidas cautelares más apropiadas, y 2) la supervisión, para asegurar el cumplimento de las condiciones impuestas por el Juez.\nPor lo expuesto y fundado, he tenido a bien expedir el siguiente:\nACUERDO POR EL QUE SE CREA LA DIRECCIÓN GENERAL DE MEDIDAS CAUTELARES Y\nEJECUCIÓN DE SENTENCIAS.\nARTÍCULO PRIMERO. Se crea la Dirección General de Medidas Cautelares y Ejecución de\nSentencias, como una unidad de cumplimiento, ejecución, evaluación, supervisión, suspensión de medidas cautelares distintas a la prisión preventiva; así como de las condiciones pactadas en la suspensión condicional del proceso; además de vigilar las penas y medidas de seguridad impuestas por sentencia que haya causado ejecutoria, en términos de lo dispuesto en las leyes respectivas.\nARTÍCULO SEGUNDO. La Dirección General de Medidas Cautelares y Ejecución de Sentencias, deberá responder a la necesidad de imparcialidad y neutralidad que exige su funcionamiento, como un órgano con autonomía técnica y funcional, en términos de lo dispuesto en el Código Nacional de\nProcedimientos Penales y demás leyes o normas relativas.\nARTÍCULO TERCERO. La Dirección General de Medidas Cautelares y Ejecución de Sentencias, deberán basar su actuación con estricto apego a los siguientes principios:\nI. Presunción de Inocencia. Tratar como inocente a toda persona detenida, evaluada y dado el caso, sujeta a una medida cautelar en libertad cuyas condiciones sean susceptibles de seguimiento.\nII. Imparcialidad. Auxiliar a las partes y al Juez para la toma de decisiones sobre medidas cautelares, la suspensión condicional del proceso y la supervisión de las medidas cautelares, sin inclinarse a favor o en contra de alguna de las partes.\nIII. Objetividad. Los reportes de evaluación y supervisión se basarán en información concreta y actual, sin discriminar a las personas por motivos de raza, discapacidad, religión, origen nacional o étnico, género, orientación sexual, condición social, tipo de delito por el que se le detiene o se sigue proceso o cualquier otro motivo.\nIV. Subsidiariedad. Elaborar sus recomendaciones partiendo de la medida menos restrictiva posible para asegurar que el imputado cumpla con sus obligaciones procesales, protegiendo en todo momento a la víctima, los testigos y terceros, así como la seguridad de la investigación.\nV. Proporcionalidad. Las medidas cautelares deberán ser proporcionales al delito situación del imputado o al daño, para asegurar la comparecencia del imputado en el proceso, y proteger a la víctima, a la sociedad y al proceso.\nVI. Confidencialidad. Proteger la información recabada de los imputados, victimas, testigos y de terceros, evitando que sea utilizada como prueba para otros fines durante el proceso.\nPara efectos de confidencialidad y reserva de datos, serán aplicables los criterios y lineamientos que establece el Código Nacional de Procedimientos Penales y demás normas aplicables. y Ejecución de Sentencias serán confidenciales para terceros, y la información generada no podrá ser utilizada en juicio para acreditar o no la existencia del hecho delictuoso o la participación o intervención del imputado.\nVII. Legalidad. Los reportes y actividades de supervisión se regirán por lo estipulado en las leyes y normas relativas al seguimiento de medidas cautelares.\nVIII. Dignidad. Respetarán en todo momento los derechos esenciales de los imputados, evitando la estigmatización, independientemente del delito por el que estén siendo procesados. Los operadores deberán dirigirse a las personas por su nombre, respetando su dignidad.\nIX. Obligatoriedad y responsabilidad. La Dirección está obligada a reportar al Juez, el incumplimiento por parte del imputado de las condiciones impuestas por el Juez. No hacerlo tendrá consecuencias legales en materia de responsabilidad de los servidores públicos. Igualmente, rendir informes de cumplimiento de las medidas cautelares a petición de las partes.\nX. Inter-institucionalidad. Establecer coordinación y colaboración con todas las instancias e instituciones vinculadas con las medidas cautelares y la ejecución de sentencias.\nARTÍCULO CUARTO. La Dirección General de Medidas Cautelares y Ejecución de Sentencias se integrara con la Dirección de Medidas Cautelares y la Dirección de Ejecución de Sentencias, las cuales participarán dentro de todas las fases que tiene el Nuevo Sistema de Justicia Penal Acusatorio Adversarial y Oral; intervendrá desde el inicio de la investigación, en tratándose de investigaciones con detenido y en el supuesto de que esta se genere sin detenido, su intervención iniciará hasta en tanto alguna de las partes pretenda solicitar ante el juez de control la aplicación de una medida cautelar. proporcional al caso concreto.\nARTÍCULO QUINTO. La Dirección General de Medidas Cautelares y Ejecución de Sentencias durante el proceso, seguirá generando información a las partes que pudieran servir para sustituir, modificar, revocar o ampliar las medidas cautelares inicialmente decretadas.\nUna vez impuesta la medida cautelar por el juez de control, Dirección General de Medidas\nCautelares y Ejecución de Sentencias, se encargara de vigilar el cumplimiento de dicha medida por parte del imputado, dará seguimiento a la medida impuesta e informara al juez de forma periódica sobre el cumplimiento o no de la medida impuesta al imputado.\nLos informes rendidos por la Dirección General de Medidas Cautelares y Ejecución de Sentencias, relativas a las medidas cautelares.\nARTÍCULO SEXTO. La Dirección General de Medidas Cautelares y Ejecución de Sentencias se integrará por un consejo interdisciplinario especializado y profesional en las siguientes áreas: Licenciatura en Derecho, Psicología, Trabajo Social, Criminología, Pedagogía, Administración Publica, Medicina, Dactiloscopia, Psiquiatría, quienes para el desempeño de sus funciones deberán estar capacitados, en el\nNuevo Sistema de Seguridad y Justicia Penal, que comprende las siguientes áreas:\nI. Humanística, en la cual debe conocer sobre Derechos Humanos de las personas detenidas, aprehendidas sujetas a procesos y en ejecución de sentencias, prevaleciendo el respeto a la dignidad humana.\nII. Jurídica, que comprende conocimientos de la Reforma y deberá ser tratado en materia penal, que el Imputado tiene derechos y deberá ser tratado bajo la observancia del principio de presunción de\nInocencia.\nIII. Conocimientos especializados sobre medidas cautelares, ejecución de sentencias, procedimiento abreviado, suspensión condicional del proceso que el nuevo sistema de justicia penal contempla.\nARTÍCULO SEPTIMO. La Dirección General de Medidas Cautelares y Ejecución de Sentencias, como unidad administrativa, quedara adscrita operativa, orgánica y administrativamente a la Subsecretaría del Sistema Penitenciario de la Secretaría de Seguridad Pública y Protección Civil.\nARTÍCULO OCTAVO. El personal que integre la Dirección General de Medidas Cautelares y\nEjecución de Sentencias, deberá cumplir con los requisitos y procedimientos de selección, ingreso, formación, actualización, capacitación, permanencia, evaluación, promoción y reconocimiento, y desde luego acreditar las evaluaciones de control de confianza y competencia profesional, en términos de la Ley número 281 de Seguridad Pública del Estado de Guerrero y la Ley General del Sistema Nacional de\nSeguridad Publica.\nARTÍCULO NOVENO. La Secretaría de Seguridad Pública y Protección Civil, conducirá los procedimientos de reclutamiento, selección, ingreso, formación, certificación, permanencia, evaluación, promoción y reconocimiento; así como la separación o terminación de la relación contractual del personal que integrara la Dirección General de Medidas Cautelares y Ejecución de Sentencias, en términos de la legislación aplicable.\nARTÍCULO DECIMO. La Dirección General de Medidas Cautelares y Ejecución de Sentencias, tendrá al menos y específicamente las atribuciones señaladas en el presente Acuerdo, en el artículo 19 de la Ley número 847 de Ejecución Penal del Estado de Guerrero, Código Nacional de Procedimientos\nPenales, reseñadas en el cuerpo del presente, y las demás que le confieran otras disposiciones jurídicas.\nARTÍCULO DECIMO PRIMERO. La Dirección General de Medidas Cautelares y Ejecución de\nSentencias, orgánicamente quedara conformada por las unidades siguientes:\nMedidas Cautelares:\n1. Dirección de Medidas Cautelares;\n1.1. Control de Gestión.\n1.2. Relaciones Interinstitucionales.\n1.3. Oficina de Seguimiento y Control Regional.\n1.3.1. Subdirecciones Regionales de Medidas Cautelares.\n1.3.1.1. Coordinadores de Evaluación.\n1.3.1.1.1. Evaluadores.\n1.3.1.2. Coordinadores de Seguimiento.\n1.3.1.1.2. Operadores.\nEjecución de Sentencias:\n1. Dirección de Ejecución de Sentencias.\n1.1. Oficina de Control Regional.\n1.1.1. Subdirecciones Regionales de Ejecución de Sentencias.\n1.1.1.1. Jefatura Jurídica.\n1.1.1.2. Jefatura de Seguimiento a Sentencias.\n1.1.1.3. Coordinación Técnica.\n1.2. Subdirección de Libertades Anticipadas y Atención a Preliberados.\n1.3. Subdirección de Tratamiento Técnico e Industria Penitenciaria.\nARTICULO DECIMO SEGUNDO. La Dirección General de Medidas Cautelares y Ejecución de\nSentencias, deberá contar con el equipamiento, recursos, materiales, financieros y humanos necesarios, para el cumplimiento de sus misiones.\nARTICULO DECIMO TERCERO. En las convocatorias que se expidan se establecerán los\nCautelares y Ejecución de Sentencias.\nPRIMERO. El presente Acuerdo entrará en vigor al día siguiente al de su firma, y publíquese en el\nSEGUNDO. La Secretaría de Seguridad Pública y Protección Civil, proveerá e implementará las acciones administrativas y presupuestales, a efecto de dar cumplimiento a este Acuerdo.\nTERCERO. Se derogan todas aquellas disposiciones normativas que se opongan al presente\nAcuerdo.\nDado en la Sala de Juntas de la Secretaria de Seguridad Pública y Protección Civil, ubicado en edificio Acapulco del Palacio de Gobierno, boulevard René Juárez Cisneros número 62, ciudad de los servicios, Chilpancingo de los Bravo, Guerrero, a los 23 días del mes de septiembre del dos mil catorce.\nSECRETARIO DE SEGURIDAD PÚBLICA Y PROTECCIÓN CIVIL.\nCOMISARIO GENERAL D.M.P.\nLIC. LEONARDO OCTAVIO VÁZQUEZ PÉREZ.\nRúbrica.",
  "ordenamiento": "ACUERDO",
  "jurisdiccion": "GUERRERO",
  "fuente_oficial": "DIARIO OFICIAL DE LA FEDERACION",
  "Fecha de Publicación": "03 de octubre de 2014",
  "ULTIMA REFORMA PUBLICADA": null,
  "status": "VIGENTE",
  "es_escaneado": false,
  "tiene_tablas": false,
  "materia": [
    "general"
  ]
}