{
  "titulo": "Acuerdo por el Cual Se Amplía el Plazo para la Presentación de la Declaración de Situación Patrimoni",
  "Contenido": "SERVIDORES PÚBLICOS OBLIGADOS DE LAS\nDEPENDENCIAS DE LA ADMINISTRACIÓN\nCENTRALIZADA Y PARAESTATAL, DEL PODER\nJUDICIAL, DE LOS TRIBUNALES DEL TRABAJO\nY DE LO CONTENCIOSO ADMINISTRATIVO DEL\nESTADO\nABROGADO POR CONCLUIDA SU VIGENCIA EL 30 DE JUNIO DEL 2009.\nTEXTO ORIGINAL\nAcuerdo publicado en el Periódico Oficial del Gobierno del Estado No. 42, el\nMartes 26 de Mayo de 2009.\nACUERDO POR EL CUAL SE AMPLÍA EL PLAZO PARA LA PRESENTACIÓN DE LA\nDECLARACIÓN DE SITUACIÓN PATRIMONIAL PARA AQUELLOS SERVIDORES\nPÚBLICOS OBLIGADOS DE LAS DEPENDENCIAS DE LA ADMINISTRACIÓN\nCENTRALIZADA Y PARAESTATAL, DEL PODER JUDICIAL, DE LOS TRIBUNALES\nDEL TRABAJO Y DE LO CONTENCIOSO ADMINISTRATIVO DEL ESTADO.\nCARLOS ARTURO BÁRCENAS AGUILAR, Contralor General del Estado de\nGuerrero, con fundamento en lo dispuesto por los artículos 34 fracciones V, VIII y XV de la Ley Orgánica de la Administración Pública del Estado de Guerrero; 1o. fracciones II y\nVI, 2o., 3o.fracción II, 46 fracción XIX, 76, 77 fracciones II, III, IV y VII, 79 y demás aplicables de la Ley de Responsabilidades de los Servidores Públicos del Estado de\nGuerrero y 10 fracción XXIV del Reglamento Interior de la Contraloría General del\nEstado; y\nQue esta Contraloría General del Estado, implementó el Sistema Electrónico\nDeclaranet Guerrero, como única vía para la presentación de la Declaración de Situación\nPatrimonial, de los Servidores Públicos obligados de las Dependencias de la artículo 78 de la Ley de Responsabilidades de los Servidores Públicos del Estado de\nGuerrero.\nSERVIDORES PÚBLICOS OBLIGADOS DE LAS\nDEPENDENCIAS DE LA ADMINISTRACIÓN\nCENTRALIZADA Y PARAESTATAL, DEL PODER\nJUDICIAL, DE LOS TRIBUNALES DEL TRABAJO\nY DE LO CONTENCIOSO ADMINISTRATIVO DEL\nESTADO\nQue es facultad de la Contraloría General del Estado, promover lo conducente con el fin de que los servidores públicos obligados, cumplan con la obligación de presentar con oportunidad la declaración de situación patrimonial en los términos que señala la Ley de Responsabilidades de los Servidores Públicos del Estado.\nQue como una medida preventiva y como parte de las acciones que están en materia de salud, y con la finalidad de evitar altas concentraciones de servidores públicos en el Módulo de Atención del Sistema Electrónico Declaranet Guerrero, para prevenir el contagio por el virus A-H1N1, en virtud de que a la fecha existen servidores públicos obligados que aun no tienen su cuenta personal y contraseña en dicho Sistema\nElectrónico, resulta necesario la ampliación del plazo establecido en el artículo 78 fracción II de la Ley de Responsabilidades de los Servidores Públicos del Estado para cumplir con la obligación de presentar la Declaración de Situación Patrimonial.\nPor lo anteriormente expuesto he tenido a bien expedir el siguiente:\nACUERDO POR EL CUAL SE AMPLÍA EL PLAZO PARA LA PRESENTACIÓN DE LA\nDEL TRABAJO Y DE LO CONTENCIOSO ADMINISTRATIVO DEL ESTADO.\nÚNICO.- Se amplía el plazo para la presentación de la Declaración de Situación\nPatrimonial correspondiente al año 2008, hasta el treinta de junio de dos mil nueve.\nPRIMERO.- El presente Acuerdo será publicado en el Periódico Oficial del\nSERVIDORES PÚBLICOS OBLIGADOS DE LAS\nDEPENDENCIAS DE LA ADMINISTRACIÓN\nCENTRALIZADA Y PARAESTATAL, DEL PODER\nJUDICIAL, DE LOS TRIBUNALES DEL TRABAJO\nY DE LO CONTENCIOSO ADMINISTRATIVO DEL\nESTADO\nChilpancingo, Guerrero, Capital del Estado de Guerrero, a los siete días del mes de mayo del año dos mil nueve.\nEL CONTRALOR GENERAL DEL ESTADO.\nC.P. CARLOS ARTURO BÁRCENAS AGUILAR.\nRúbrica.",
  "ordenamiento": "ACUERDO",
  "jurisdiccion": "GUERRERO",
  "fuente_oficial": "DIARIO OFICIAL DE LA FEDERACION",
  "Fecha de Publicación": "26 de Mayo de 2009",
  "ULTIMA REFORMA PUBLICADA": "26 de Mayo de 2009",
  "status": "ABROGADA",
  "es_escaneado": false,
  "tiene_tablas": false,
  "materia": [
    "general"
  ]
}