{
  "titulo": "Acuerdo por el Que Se Autoriza el Cambio de Adscripción al C. Doctor Esaú Tapia Abarca, Quien Funge",
  "Contenido": "NÚMERO UNO DEL DISTRITO NOTARIAL DE\nCUAUHTÉMOC, CON RESIDENCIA EN LA CIUDAD DE\nARCELIA, GUERRERO, PARA QUE SE CONSTITUYA AL\nDISTRITO NOTARIAL DE HIDALGO, CON RESIDENCIA EN\nLA CIUDAD DE IGUALA DE LA INDEPENDENCIA,\nGUERRERO, A OCUPAR LA NOTARÍA PÚBLICA NÚMERO\nTEXTO ORIGINAL.\nAcuerdo publicado en el Periódico Oficial del Gobierno del Estado No. 44 Alcance II, el Martes\n03 de Junio de 2014.\nACUERDO POR EL QUE SE AUTORIZA EL CAMBIO DE ADSCRIPCIÓN AL C. DOCTOR ESAÚ\nTAPIA ABARCA, QUIEN FUNGE ACTUALMENTE COMO NOTARIO PÚBLICO NÚMERO UNO DEL\nDISTRITO NOTARIAL DE CUAUHTÉMOC, CON RESIDENCIA EN LA CIUDAD DE ARCELIA,\nGUERRERO, PARA QUE SE CONSTITUYA AL DISTRITO NOTARIAL DE HIDALGO, CON\nRESIDENCIA EN LA CIUDAD DE IGUALA DE LA INDEPENDENCIA, GUERRERO, A OCUPAR LA\nNOTARÍA PÚBLICA NÚMERO DOS.\nGuerrero.- Poder Ejecutivo.\nCON LA FACULTAD CONFERIDA POR EL C. LICENCIADO ÁNGEL HELADIO AGUIRRE\nAL C. DOCTOR JESÚS MARTÍNEZ GARNELO, SECRETARIO GENERAL DE GOBIERNO, EN EL\nARTÍCULO 20 FRACCIONES VIII Y XXXIX DE LA LEY ORGÁNICA DE LA ADMINISTRACIÓN\nPÚBLICA DEL ESTADO DE GUERRERO NÚMERO 433 Y 149 DE LA LEY NÚMERO 971 DEL\nNOTARIADO DEL ESTADO DE GUERRERO, Y\nPRIMERO.- Que con fecha veintiocho de marzo del dos mil cinco, se extendió al C. Doctor\nESAÚ TAPIA ABARCA, la Patente de Notario Público Número Uno del Distrito Notarial de Cuauhtémoc, con residencia en la Ciudad de Arcelia, Guerrero.\nSEGUNDO.- Que el C. Doctor ESAÚ TAPIA ABARCA, Notario Público Número Uno del Distrito\nNotarial de Cuauhtémoc, con residencia en la Ciudad de Arcelia, Guerrero, solicitó al Secretario General de Gobierno, mediante escrito de fecha seis de enero del dos mil catorce, recibido en la Secretaría\nGeneral de Gobierno el siete de enero del dos mil catorce, se le concediera el cambio de adscripción del\nDistrito Notarial en el que actualmente ejerce sus funciones al Distrito Notarial de Hidalgo, con residencia en la Ciudad de Iguala de la Independencia, Guerrero.\nTERCERO.- Para solicitar dicho cambio el C. Doctor ESAÚ TAPIA ABARCA, se fundamentó en lo establecido por el artículo 149 de la Ley Número 971 del Notariado del Estado de Guerrero en vigor, y toda vez que la Notaría Publica Número Dos del Distrito Notarial de Hidalgo, se encuentra vacante y no\nNÚMERO UNO DEL DISTRITO NOTARIAL DE\nCUAUHTÉMOC, CON RESIDENCIA EN LA CIUDAD DE\nARCELIA, GUERRERO, PARA QUE SE CONSTITUYA AL\nDISTRITO NOTARIAL DE HIDALGO, CON RESIDENCIA EN\nLA CIUDAD DE IGUALA DE LA INDEPENDENCIA,\nGUERRERO, A OCUPAR LA NOTARÍA PÚBLICA NÚMERO se ha expedido la convocatoria para el examen de Notario, a efecto cubrir la vacancia de esa Notaría; en consecuencia, dicha solicitud se encuentra ajustada a derecho, por lo que con fundamento en lo establecido por el artículo 20 fracciones VIII y XXXIX de la Ley Orgánica de la Administración Pública del\nEstado de Guerrero Número 433 y 149 de la Ley Número 971 del Notariado del Estado de Guerrero, he tenido a bien emitir el siguiente:\nACUERDO POR EL QUE SE AUTORIZA EL CAMBIO DE ADSCRIPCIÓN AL C. DOCTOR ESAÚ\nTAPIA ABARCA, QUIEN FUNGE ACTUALMENTE COMO NOTARIO PÚBLICO NÚMERO UNO DEL\nDISTRITO NOTARIAL DE CUAUHTÉMOC, CON RESIDENCIA EN LA CIUDAD DE ARCELIA,\nGUERRERO, PARA QUE SE CONSTITUYA AL DISTRITO NOTARIAL DE HIDALGO, CON\nRESIDENCIA EN LA CIUDAD DE IGUALA DE LA INDEPENDENCIA, GUERRERO, A OCUPAR LA\nNOTARÍA PÚBLICA NÚMERO DOS.\nARTÍCULO PRIMERO.- Se autoriza el cambio de adscripción al C. Doctor ESAÚ TAPIA\nABARCA, quien funge actualmente como Notario Público Número Uno del Distrito Notarial de\nCuauhtémoc, con residencia en la Ciudad de Arcelia, Guerrero, para que se constituya al Distrito Notarial de Hidalgo, con residencia en la Ciudad Iguala de la Independencia, Guerrero, a ocupar la Notaría\nPública Número Dos.\nARTÍCULO SEGUNDO.- Expídase al C. Doctor ESAÚ TAPIA ABARCA, nueva Patente de\nNotario Titular Número Dos del Distrito Notarial de Hidalgo con residencia en la Ciudad de Iguala de la\nIndependencia, Guerrero.\nARTÍCULO TERCERO.- El cambio de adscripción surtirá sus efectos al día siguiente en que el\nC. Doctor ESAÚ TAPIA ABARCA, haga la entrega correspondiente de la Notaría Pública que actualmente ejerce al Archivo General de Notarías del Estado de Guerrero.\nÚNICO.- El presente Acuerdo entrará en vigor al día siguiente de su publicación en el Periódico\nDado en la oficina de la Secretaría General de Gobierno, en la Ciudad de Chilpancingo de los\nBravo, Capital del Estado de Guerrero, a los treinta días del mes de mayo del año dos mil catorce.\nNÚMERO UNO DEL DISTRITO NOTARIAL DE\nCUAUHTÉMOC, CON RESIDENCIA EN LA CIUDAD DE\nARCELIA, GUERRERO, PARA QUE SE CONSTITUYA AL\nDISTRITO NOTARIAL DE HIDALGO, CON RESIDENCIA EN\nLA CIUDAD DE IGUALA DE LA INDEPENDENCIA,\nGUERRERO, A OCUPAR LA NOTARÍA PÚBLICA NÚMERO\nEL SECRETARIO GENERAL DE GOBIERNO.\nDR. JESÚS MARTÍNEZ GARNELO.\nRúbrica.\nEL SUSCRITO LICENCIADO RAÚL EFRAÍN CARDOSO MIRANDA, DIRECTOR GENERAL\nDE ASUNTOS JURÍDICOS DE LA SECRETARÍA GENERAL DE GOBIERNO, CON FUNDAMENTO EN\nLO DISPUESTO POR EL ARTÍCULO 20 FRACCIÓN XIII DEL REGLAMENTO INTERIOR DE LA\nSECRETARÍA GENERAL DE GOBIERNO DEL ESTADO.\nQUE LAS PRESENTES COPIAS FOTOSTÁTICAS COMPUESTAS DE TRES FOJAS ÚTILES,\nDEBIDAMENTE FOLIADAS, SELLADAS Y RUBRICADAS, SON REPRODUCIDAS FIELMENTE DE SU\nORIGINAL, Y CORRESPONDEN AL ACUERDO POR EL QUE SE AUTORIZA EL CAMBIO DE\nADSCRIPCIÓN AL C. DOCTOR ESAÚ TAPIA ABARCA, QUIEN FUNGE ACTUALMENTE COMO\nNOTARIO PÚBLICO NÚMERO UNO DEL DISTRITO NOTARIAL DE CUAUHTÉMOC, CON\nRESIDENCIA EN LA CIUDAD DE ARCELIA, GUERRERO, PARA QUE SE CONSTITUYA AL\nDISTRITO NOTARIAL DE HIDALGO, CON RESIDENCIA EN LA CIUDAD DE IGUALA DE LA\nINDEPENDENCIA, GUERRERO, A OCUPAR LA NOTARÍA PÚBLICA NÚMERO DOS, EL CUAL OBRA\nEN LOS ARCHIVOS DE ESTA DIRECCIÓN GENERAL.\nSE EXTIENDE LA PRESENTE PARA LOS EFECTOS LEGALES A QUE HAYA LUGAR, A\nLOS TREINTA DÍAS DEL MES DE MAYO DEL AÑO DOS MIL CATORCE, EN LA CIUDAD DE\nCHILPANCINGO, CAPITAL DEL ESTADO DE GUERRERO.- CONSTE.- Rúbrica.",
  "ordenamiento": "ACUERDO",
  "jurisdiccion": "GUERRERO",
  "fuente_oficial": "DIARIO OFICIAL DE LA FEDERACION",
  "Fecha de Publicación": "03 de Junio de 2014",
  "ULTIMA REFORMA PUBLICADA": null,
  "status": "VIGENTE",
  "es_escaneado": false,
  "tiene_tablas": false,
  "materia": [
    "general"
  ]
}