{
  "titulo": "Acuerdo por el Que Se Autoriza A la Secretaría de Finanzas y Administración Llevar A Cabo las Adecua",
  "Contenido": "PRESUPUESTARIAS DE LOS ORGANISMOS PÚBLICOS\nDESCENTRALIZADOS DE LA ADMINISTRACIÓN\nPÚBLICA ESTATAL QUE LO REQUIERAN PARA CUBRIR\nLOS ADEUDOS QUE REGISTREN CON EL SECTOR\nCENTRAL, EN LOS TÉRMINOS DE LOS\nPROCEDIMIENTOS QUE PARA ESTOS EFECTOS EMITA\nLA PROPIA SECRETARÍA E INFORME DE ELLO A\nTRAVÉS DE LOS INFORMES CUATRIMESTRALES\nTEXTO ORIGINAL\nAcuerdo publicado en el Periódico Oficial del Gobierno del Estado No. 42, el\nMartes 25 de Mayo de 2010.\nACUERDO POR EL QUE SE AUTORIZA A LA SECRETARÍA DE FINANZAS Y\nADMINISTRACIÓN LLEVAR A CABO LAS ADECUACIONES PRESUPUESTARIAS DE\nLOS ORGANISMOS PÚBLICOS DESCENTRALIZADOS DE LA ADMINISTRACIÓN\nPÚBLICA ESTATAL QUE LO REQUIERAN PARA CUBRIR LOS ADEUDOS QUE\nREGISTREN CON EL SECTOR CENTRAL, EN LOS TÉRMINOS DE LOS\nPROCEDIMIENTOS QUE PARA ESTOS EFECTOS EMITA LA PROPIA SECRETARÍA\nE INFORME DE ELLO A TRAVÉS DE LOS INFORMES CUATRIMESTRALES.\nAl margen un sello con el Escudo Oficial que dice: Gobierno del Estado Libre y\nSoberano de Guerrero.- Poder Ejecutivo.\nCARLOS ZEFERINO TORREBLANCA GALINDO, Gobernador Constitucional del\nSoberano de Guerrero; 2° y 6° de la Ley Orgánica de la Administración Pública del\nEstado de Guerrero número 433; 43 y 52 de la Ley número 690 de Entidades\nParaestatales del Estado de Guerrero; y 25 del Decreto número 277 de Presupuesto de\nEgresos del Estado de Guerrero para el Ejercicio Fiscal 2010; y\nQue el Plan Estatal de Desarrollo recoge la visión, la demanda y peticiones, y la opinión de los distintos grupos que componen la Sociedad Guerrerense. En su estructura\nPRESUPUESTARIAS DE LOS ORGANISMOS PÚBLICOS\nDESCENTRALIZADOS DE LA ADMINISTRACIÓN\nPÚBLICA ESTATAL QUE LO REQUIERAN PARA CUBRIR\nLOS ADEUDOS QUE REGISTREN CON EL SECTOR\nCENTRAL, EN LOS TÉRMINOS DE LOS\nPROCEDIMIENTOS QUE PARA ESTOS EFECTOS EMITA\nLA PROPIA SECRETARÍA E INFORME DE ELLO A\nTRAVÉS DE LOS INFORMES CUATRIMESTRALES en el documento rector de la gestión y el quehacer público del Gobierno del Estado de\nGuerrero, en su periodo 2005-2011.\nQue la planeación cobra mayor importancia en sociedades como la nuestra, en la que nuestras particularidades, complejidades, y el bajo aprovechamiento de los recursos naturales y escasos recursos económicos de su Gobierno, obliga a ser en extremo cuidadosos en la asignación de estos recursos, a fin de acelerar el proceso de desarrollo, abatir los índices de pobreza y reducir las desigualdades de desarrollo entre las regiones.\nEl Plan Estatal de Desarrollo 2005-2011, es complementado con Programas\nSectoriales que realizan las Dependencias y Organismos Públicos Descentralizados en el horizonte de 6 años que cubre la presente Administración y que son detallados en\nProgramas operativos Anuales vinculados al presupuesto que ejercen anualmente cada uno de ellos.\nSoberano de Guerrero, la Administración Pública Estatal será centralizada y paraestatal, administrativo en Dependencias y Organismos, cuyas relaciones entre sí estarán definidas y reguladas por las Leyes y Reglamentos,.así como el artículo 25 del Decreto número 277 de Presupuesto de Egresos del Estado de Guerrero para el Ejercicio Fiscal\n2010, permite las adecuaciones presupuestarias propuestas.\nOrganismos, de los cuales 27 son Descentralizados, 9 Establecimientos Públicos de\nBienestar Social y 7 Fideicomisos, y sólo 33 de ellos reciben subsidio económico por parte del Estado para dar cobertura a su gasto operativo.\nPRESUPUESTARIAS DE LOS ORGANISMOS PÚBLICOS\nDESCENTRALIZADOS DE LA ADMINISTRACIÓN\nPÚBLICA ESTATAL QUE LO REQUIERAN PARA CUBRIR\nLOS ADEUDOS QUE REGISTREN CON EL SECTOR\nCENTRAL, EN LOS TÉRMINOS DE LOS\nPROCEDIMIENTOS QUE PARA ESTOS EFECTOS EMITA\nLA PROPIA SECRETARÍA E INFORME DE ELLO A\nTRAVÉS DE LOS INFORMES CUATRIMESTRALES\nQue en una entidad federativa que se ubica en los últimos lugares de los índices de Desarrollo Humano en el país, resulta operativo destinar y conjuntar los mayores esfuerzos, voluntades y recursos a efecto de lograr en el menor plazo posible de las estrategias de desarrollo económico, se refleje crecientemente en mejores niveles de calidad de vida para sus ciudadanos, haciéndose necesario la reasignación del presupuesto de los organismos públicos del sector paraestatal que registren con el\nSector Central adeudos pasados, para con ello lograr sanear en lo posible sus finanzas.\nPor lo anteriormente expuesto y fundado, tengo a bien expedir el presente:\nACUERDO POR EL QUE SE AUTORIZA A LA SECRETARÍA DE FINANZAS Y\nADMINISTRACIÓN LLEVAR A CABO LAS ADECUACIONES PRESUPUESTARIAS DE\nLOS ORGANISMOS PÚBLICOS DESCENTRALIZADOS DE LA ADMINISTRACIÓN\nPÚBLICA ESTATAL QUE LO REQUIERAN PARA CUBRIR LOS ADEUDOS QUE\nREGISTREN CON EL SECTOR CENTRAL, EN LOS TÉRMINOS DE LOS\nPROCEDIMIENTOS QUE PARA ESTOS EFECTOS EMITA LA PROPIA SECRETARÍA\nE INFORME DE ELLO A TRAVÉS DE LOS INFORMES CUATRIMESTRALES.\nARTÍCULO ÚNICO.- Se autoriza a la Secretaría de Finanzas y Administración, llevar a cabo, las adecuaciones presupuestarias de los Organismos Públicos\nSector Central, en los términos de los procedimientos que para estos efectos emita la propia Secretaría e informe de ello a través de los informes cuatrimestrales.\nÚNICO.- El presente Acuerdo entrará en vigor al día siguiente de su publicación\nPRESUPUESTARIAS DE LOS ORGANISMOS PÚBLICOS\nDESCENTRALIZADOS DE LA ADMINISTRACIÓN\nPÚBLICA ESTATAL QUE LO REQUIERAN PARA CUBRIR\nLOS ADEUDOS QUE REGISTREN CON EL SECTOR\nCENTRAL, EN LOS TÉRMINOS DE LOS\nPROCEDIMIENTOS QUE PARA ESTOS EFECTOS EMITA\nLA PROPIA SECRETARÍA E INFORME DE ELLO A\nTRAVÉS DE LOS INFORMES CUATRIMESTRALES\nDado en la Residencia Oficial del Poder Ejecutivo, en la Ciudad de Chilpancingo, Capital del Estado de Guerrero a los 11 días del mes mayo de 2010.\nEL GOBERNADOR CONSTITUCIONAL DEL ESTADO.\nC.P. CARLOS ZEFERINO TORREBLANCA GALINDO.\nRúbrica.\nEL SECRETARIO GENERAL DE GOBIERNO.\nLIC. GUILLERMO RAMIREZ RAMOS.\nRúbrica.\nEL SECRETARIO DE FINANZASY ADMINISTRACIÓN.\nLIC. RICARDO. ERNESTO CABRERA MORIN.\nEL CONTRALOR GENERAL DEL ESTADO.\nC.P. CARLOS ARTURO BARCENAS AGUILAR.",
  "ordenamiento": "ACUERDO",
  "jurisdiccion": "GUERRERO",
  "fuente_oficial": "DIARIO OFICIAL DE LA FEDERACION",
  "Fecha de Publicación": "25 de Mayo de 2010",
  "ULTIMA REFORMA PUBLICADA": null,
  "status": "VIGENTE",
  "es_escaneado": false,
  "tiene_tablas": false,
  "materia": [
    "general"
  ]
}