{
  "titulo": "Acuerdo Parlamentario por Medio del Cual Se Suspenden las Sesiones Solemnes Que Se Llevarían A Cabo",
  "Contenido": "LOS SENTIMIENTOS DE LA NACIÓN, Y SE SUSPENDE EL\nDE LA PRESEA \"EDUARDO NERI REYNOSO\" Y LA SESIÓN\nSOLEMNE EN LA CUAL SE OTORGARÍA DICHA PRESEA\nTEXTO ORIGINAL\nAcuerdo publicado en el Periódico Oficial del Gobierno del Estado No. 87, el Martes 29 de\nOctubre de 2013.\nACUERDO PARLAMENTARIO POR MEDIO DEL CUAL SE SUSPENDEN LAS SESIONES\nSOLEMNES QUE SE LLEVARÍAN A CABO EN EL MES DE OCTUBRE PARA CONMEMORAR EL\nBICENTENARIO DEL PRIMER CONGRESO DE ANÁHUAC Y DE LOS SENTIMIENTOS DE LA\nNACIÓN, Y SE SUSPENDE EL PROCESO DE SELECCIÓN Y DESIGNACIÓN DEL RECIPIENDARIO\nDE LA PRESEA \"EDUARDO NERI REYNOSO\" Y LA SESIÓN SOLEMNE EN LA CUAL SE\nOTORGARÍA DICHA PRESEA.\nGuerrero.- Poder Legislativo.\nLA SEXAGÉSIMA LEGISLATURA AL HONORABLE CONGRESO DEL ESTADO LIBRE Y\nSOBERANO DE GUERRERO, EN NOMBRE DEL PUEBLO QUE REPRESENTA, Y:\nQue en sesión de fecha 03 de octubre del 2013, los Diputados integrantes de la Comisión de\nGobierno, presentaron la Propuesta de Acuerdo Parlamentario por medio del cual se Suspenden las\nSesiones Solemnes que se llevarían a cabo en el mes de Octubre para conmemorar el Bicentenario del\nPrimer Congreso de Anáhuac y de los Sentimientos de la Nación, y se Suspende el Proceso de selección y designación del recipiendario de la Presea \"Eduardo Neri Reynoso\" y la Sesión Solemne en la cual se otorgaría dicha presea, en los siguientes términos:\n\"Que con motivo de las actividades para conmemorar el Bicentenario del Primer Congreso de\nAnáhuac, la proclama de los Sentimientos de la Nación, y la Declaratoria de Independencia de la América año dos mil trece, aprobó el Decreto por medio del cual se aprueba el calendario de sesiones solemnes en diversas localidades de la Entidad, en el marco de la Conmemoración del Bicentenario del Primer\nCongreso de Anáhuac. reformó los apartados primero, segundo y tercero del similar por medio del cual se aprueba el calendario de sesiones solemnes en diversas localidades de la Entidad, en el marco de la Conmemoración del\nBicentenario del Primer Congreso de Anáhuac.\nLOS SENTIMIENTOS DE LA NACIÓN, Y SE SUSPENDE EL\nDE LA PRESEA \"EDUARDO NERI REYNOSO\" Y LA SESIÓN\nSOLEMNE EN LA CUAL SE OTORGARÍA DICHA PRESEA\nQue el decreto por medio del cual se aprueba el calendario de sesiones solemnes en diversas localidades de la Entidad, en el marco de la Conmemoración del Bicentenario del Primer Congreso de\nAnáhuac, forma parte del programa de actividades que la Comisión Especial del Bicentenario y tienen la finalidad de promover la participación ferviente y patriótica de la ciudadanía en la Conmemoración del\nBicentenario del Primer Congreso de Anáhuac, que por su significado social, jurídico y político, forma parte de la identidad de todas y todos los guerrerenses.\nQue en sesión de fecha veintisiete de agosto del año que transcurre, a propuesta de la Comisión de Gobierno de esta Sexagésima Legislatura, se aprobó el acuerdo parlamentario por el que se designa a la Comisión Especial encargada de expedir la convocatoria y oportunamente, dictaminar sobre las candidaturas que se presenten para elegir al recipiendario de la Presea \"Eduardo Neri Reynoso\".\nQue en términos del acuerdo aprobado, la Comisión Especial designada expidió la convocatoria dirigida a la ciudadanía en general para que presenten las candidaturas de quienes juzguen dignos de recibir y portar la Presea \"Eduardo Neri Reynoso\", misma que fue publicada en el portal de internet del\nPoder Legislativo y en el Periódico el Sur de Guerrero desde el cuatro de septiembre del dos mil trece.\nQue los días 13, 14 y 15 de septiembre del año en curso, el estado de Guerrero, se vio afectado por el paso de la Tormenta tropical Manuel y el Huracán Ingrid, que originaron que la mayoría de los municipios de la Entidad, ante los graves daños a la población y a la infraestructura se emitiera\nDeclaratoria de Desastre Natural por la ocurrencia de lluvia severa del 14 de septiembre del 2013, emitida por la Secretaría de Gobernación y publicada el 23 de septiembre del año en curso en el Diario Oficial de la Federación.\nAnte los daños ocasionados y por el estado en que se encuentra la mayoria de los municipios de la entidad, este Honorable Poder Legislativo, no puede ser ajeno a los hechos ocurridos, motivos y razones suficientes para suspender las actividades programadas con anterioridad para el mes de octubre del año 2013, para el efecto de que los representantes populares y autoridades involucradas en ellos, no se distraigan de actividades apremiantes que requieren una mayor atención.\nAsimismo, es importante hacer notar que para desarrollar y llevar a cabo las Sesiones\nSolemnes, se requiere la coordinación, colaboración y participación de diversas autoridades civiles y militares en las distintas actividades de logistica y preparación de los eventos, tales como la participación del Cuerpo Militar en los Honores a la Bandera, la colaboración y coordinación con el Gobierno del\nEstado para el montaje de los escenarios en los distintos lugares en donde se desarrollan, la colaboración y participación de los H. Ayuntamientos Municipales sedes para llevar a cabo las sesiones solemnes, asi como la participación y colaboración del personal de todas estas dependencias y autoridades involucradas, que actualmente, y ante la contingencia presentada se encuentran\nLOS SENTIMIENTOS DE LA NACIÓN, Y SE SUSPENDE EL\nDE LA PRESEA \"EDUARDO NERI REYNOSO\" Y LA SESIÓN\nSOLEMNE EN LA CUAL SE OTORGARÍA DICHA PRESEA desarrollando otras actividades que requieren mayor atención y prioridad, que impide preparar y llevar a cabo estas actividades conforme a los protocolos y solemnidades se requieren.\nQue vertido lo anterior, en sesión de fecha 03 de octubre del 2013, la Sexagésima Legislatura al\nHonorable Congreso del Estado, aprobó por unanimidad de votos, en todos y cada uno de sus términos, la propuesta de Acuerdo Parlamentario presentada por los Diputados integrantes de la Comisión de\nGobierno.\nPor lo anteriormente expuesto y con fundamento en lo dispuesto por los artículos 47 fracción I de\nLey Orgánica del Poder Legislativo número 286, este Honorable Congreso del Estado de Guerrero, expide el siguiente:\nACUERDO PARLAMENTARIO POR MEDIO DEL CUAL SE SUSPENDEN LAS SESIONES\nSOLEMNES QUE SE LLEVARÍAN A CABO EN EL MES DE OCTUBRE PARA CONMEMORAR EL\nBICENTENARIO DEL PRIMER CONGRESO DE ANÁHUAC Y DE LOS SENTIMIENTOS DE LA\nNACIÓN, Y SE SUSPENDE EL PROCESO DE SELECCIÓN Y DESIGNACIÓN DEL RECIPIENDARIO\nDE LA PRESEA \"EDUARDO NERI REYNOSO\" Y LA SESIÓN SOLEMNE EN LA CUAL SE\nOTORGARÍA DICHA PRESEA.\nGuerrero, por las consideraciones vertidas en el presente acuerdo, suspende las sesiones solemnes programadas para el mes de octubre del año 2013, para conmemorar el Bicentenario del Primer\nCongreso de Anáhuac y de los Sentimientos de la Nación, aprobadas mediante decretos de fecha siete de mayo y su modificación de fecha treinta de julio del año dos mil trece.\nSEGUNDO. Por única ocasión se suspende el proceso de selección y designación del la cual se otorgaría dicha presea.\nPRIMERO. El presente Acuerdo surtirá sus efectos a partir de su aprobación.\nSEGUNDO. Publíquese el presente Acuerdo Parlamentario en el Periódico Oficial del Gobierno del Estado, para los efectos legales conducentes. octubre del año dos mil trece.\nLOS SENTIMIENTOS DE LA NACIÓN, Y SE SUSPENDE EL\nDE LA PRESEA \"EDUARDO NERI REYNOSO\" Y LA SESIÓN\nSOLEMNE EN LA CUAL SE OTORGARÍA DICHA PRESEA\nDIPUTADO PRIMER VICEPRESIDENTE\nEN FUNCIONES DE PRESIDENTE.\nTOMÁS HERNÁNDEZ PALMA.\nDIPUTADA SECRETARIA.\nLAURA ARIZMENDI CAMPOS.\nDIPUTADA SECRETARIA.\nKAREN CASTREJÓN TRUJILLO.",
  "ordenamiento": "ACUERDO",
  "jurisdiccion": "GUERRERO",
  "fuente_oficial": "DIARIO OFICIAL DE LA FEDERACION",
  "Fecha de Publicación": "29 de \nOctubre de 2013",
  "ULTIMA REFORMA PUBLICADA": null,
  "status": "VIGENTE",
  "es_escaneado": false,
  "tiene_tablas": false,
  "materia": [
    "parlamentario"
  ]
}