{
  "titulo": "Acuerdo Mediante el Cual Se Otorgan las Condecoraciones y Premios Civiles Estatales 2013, A las Pers",
  "Contenido": "HECHO ACREEDORAS A RECIBIRLOS, DE\nCONFORMIDAD CON LA LEY DE PREMIOS CIVILES\nDEL ESTADO DE GUERRERO NÚMERO 434\nABROGADO POR CONCLUIDA SU VIGENCIA EL 19 DE OCTUBRE DE EL AÑO 2013,\nTOMANDO EN CUENTA QUE CON FECHA 14 DE OCTUBRE DEL MISMO AÑO, EL CONSEJO DE\nPREMIACIÓN DETERMINÓ PRORROGAR EL PLAZO DE LA CONVOCATORIA QUE FUE LANZADA\nEL DÍA 2 DE SEPTIEMBRE DEL PRESENTE AÑO, HASTA EL DÍA 18 DE OCTUBRE DEL AÑO EN\nCURSO, EL CUAL SE PUBLICÓ EN LOS MEDIOS DE COMUNICACIÓN Y PÁGINA WEB DEL\nGOBIERNO DEL ESTADO DE GUERRERO.\nTEXTO ORIGINAL.\nAcuerdo publicado en el Periódico Oficial del Gobierno del Estado No. 95, el Martes 26 de\nNoviembre de 2013.\nACUERDO MEDIANTE EL CUAL SE OTORGAN LAS CONDECORACIONES Y PREMIOS CIVILES\nESTATALES 2013, A LAS PERSONAS QUE SE HAN HECHO ACREEDORAS A RECIBIRLOS, DE\nCONFORMIDAD CON LA LEY DE PREMIOS CIVILES DEL ESTADO DE GUERRERO NÚMERO 434.\nGuerrero.- Poder Ejecutivo.\nLICENCIADO ÁNGEL HELADIO AGUIRRE RIVERO, GOBERNADOR CONSTITUCIONAL\nFACULTADES QUE ME CONFIEREN LOS ARTÍCULOS 6o y 10 DE LA LEY ORGÁNICA DE LA\nADMINISTRACIÓN PÚBLICA DEL ESTADO DE GUERRERO NÚMERO 433 Y 15 FRACCIÓN V Y 26\nDE LA LEY DE PREMIOS CIVILES DEL ESTADO NÚMERO 434, Y\nQue con fecha 12 de octubre de 1999, fue publicada en el Periódico Oficial del Gobierno del\nEstado número 84, la Ley de Premios Civiles del Estado de Guerrero número 434, la cual contempla tres condecoraciones y quince premios y tiene por objeto determinar las normas que regulen el personas que por su conducta, actos y obras merezcan los premios que en la misma se establecen.\nQue en el marco de los festejos del CLXIV Aniversario de la Erección del Estado de Guerrero, el\nEstatales 2013, con fecha 2 de septiembre del año en curso, emitieron la Convocatoria a todos los ciudadanos mexicanos y extranjeros, poderes Legislativo, Ejecutivo y Judicial, dependencias federales, partidos políticos, asociaciones y organizaciones sociales, barras y colegios y agrupaciones de profesionistas, universidades e instituciones de educación superior, medios de comunicación y Municipios del Estado de Guerrero, para que presentaran las candidaturas de los mejores hombres y mujeres preferentemente guerrerenses que hayan destacado en las ciencias, en las artes, en la administración pública, en la defensa de los derechos humanos, en el desarrollo comunitario, en la política, en la\nHECHO ACREEDORAS A RECIBIRLOS, DE\nCONFORMIDAD CON LA LEY DE PREMIOS CIVILES\nDEL ESTADO DE GUERRERO NÚMERO 434 asistencia social y salud pública, en indigenista, literatura, bellas artes, deportivo, desarrollo rural y lo ecológico, entre otros ramos; Convocatoria que fue oportunamente difundida en los medios de circulación impresos y electrónicos estatales y nacionales.\nQue debido a las consecuencias que dejaron las lluvias de la tormenta tropical \"Manuel\" y por el huracán \"Ingrid\" en la entidad, con fecha 25 de septiembre del 2013, el Consejo de Premiación acordaron por unanimidad de votos suspender temporalmente las actividades de la Ceremonia Oficial de la entrega de Condecoraciones y Premios Civiles 2013, que se realiza para conmemorar la creación del Estado de\nGuerrero, publicándose un boletín de prensa en los periódicos de mayor circulación y Página Web del\nGobierno del Estado.\nQue con fecha 14 de octubre del mismo año, el Consejo de Premiación determinó prorrogar el plazo de la convocatoria que fue lanzada el día 2 de septiembre del presente año, hasta el día 18 de octubre del año en curso, el cual se publicó en los medios de comunicación y Página Web del Gobierno del Estado de Guerrero.\nQue de acuerdo con el artículo 17 de la Ley de Premios Civiles del Estado de Guerrero Número\n434, integran el Consejo de Premiación de Condecoraciones y Premios Civiles 2013, el Dr. Jesús\nMartínez Garnelo, Secretario General de Gobierno y Presidente de dicho Consejo; Diputada María\nVerónica Muñoz Parra, Presidenta de la Mesa Directiva del H. Congreso del Estado; Dr. Alberto López\nCelis, Magistrado Presidente del H. Tribunal Superior de Justicia del Estado y Mtra. Beatriz Mojica Morga, Secretaría de Desarrollo Social.\nQue una vez que se recibieron de los Jurados calificadores los dictámenes (opiniones) de los candidatos que resultaron seleccionados para ser condecorados y premiados, el Consejo de Premiación con fundamento en el artículo 15 fracción V de la Ley de la materia, los elevaron a la consideración del suscrito, para su resolución final correspondiente como merecedores de tales distinciones.\nPor lo anteriormente expuesto y fundado, he tenido a bien expedir el siguiente:\nACUERDO MEDIANTE EL CUAL SE OTORGAN LAS CONDECORACIONES Y PREMIOS CIVILES\nESTATALES 2013, A LAS PERSONAS QUE SE HAN HECHO ACREEDORAS A RECIBIRLOS, DE\nCONFORMIDAD CON LA LEY DE PREMIOS CIVILES DEL ESTADO DE GUERRERO NÚMERO 434.\nArtículo Único. Son acreedores a recibir las Condecoraciones \"Vicente Guerrero\": El Ejército\nAltamirano\": Federación de Clubes de Guerrerenses Radicados en Chicago; los premios al Mérito en la Defensa de los Derechos Humanos \"Nicolás Bravo\": Lic. Juan Alarcón Hernández; al Mérito\nIndigenista \"Cuauhtémoc\": Organización de los Pueblos Indígenas Me’phaa; al Mérito Municipal y\nDesarrollo Comunitario \"Moisés Ochoa Campos\": C. Pedro Abarca Chávez; al Mérito en Desarrollo\nRural \"Manuel Meza Andraca\": Dr. Antonio Cervantes Núñez; al Mérito Político \"José Francisco Ruíz\nMassieu\": Dr. Eduardo López Betancourt; al Mérito Cívico \"Eduardo Neri\": Dr. César Iván Astudillo\nHECHO ACREEDORAS A RECIBIRLOS, DE\nCONFORMIDAD CON LA LEY DE PREMIOS CIVILES\nDEL ESTADO DE GUERRERO NÚMERO 434\nReyes; al Mérito en Asistencia Social y Salud Pública \"Eva Samano de López Mateos\": Programa\nTransformemos Nuestro Entorno; al Mérito en Ciencia y Tecnología \"Guillermo Soberón\": Dra. Luz\nPatricia Ávila Caballero; al Mérito en Literatura y Bellas Artes \"Juan Ruiz de Alarcón\": Orquesta Infantil y Juvenil Renacimiento; al Mérito en Educación y Humanidades \"Ignacio Chávez\": Profr. Jesús\nRomero Guerrero; al Mérito en Economía Política \"Placido García Reynoso\": M.C. Alma Luz Pérez\nLópez; al Mérito Deportivo \"Apolonio Castillo\": C. Antonio Ríos Martínez; al Mérito Juvenil \"José\nAzueta\": C. Wendy Jazmín Pérez Campos y al Mérito de la Mujer \"Antonia Nava de Catalán\": C.\nFlorentina López de Jesús.\nPrimero. El presente Acuerdo entrará en vigor el día de su suscripción.\nSegundo. Publíquese el presente Acuerdo en el Periódico Oficial del Gobierno del Estado de\nGuerrero, para los efectos legales correspondientes.\nBravo, capital del Estado de Guerrero, a los veintisiete días del mes de octubre del año en curso.\nEL GOBERNADOR CONSTITUCIONAL DEL ESTADO\nLIC. ÁNGEL HELADIO AGUIRRE RIVERO.\nEL SECRETARIO GENERAL DE GOBIERNO.\nDR. JESÚS MARTÍNEZ GARNELO.",
  "ordenamiento": "ACUERDO",
  "jurisdiccion": "GUERRERO",
  "fuente_oficial": "DIARIO OFICIAL DE LA FEDERACION",
  "Fecha de Publicación": "26 de \nNoviembre de 2013",
  "ULTIMA REFORMA PUBLICADA": "26 de Noviembre de 2013",
  "status": "ABROGADA",
  "es_escaneado": false,
  "tiene_tablas": false,
  "materia": [
    "civil"
  ]
}