{
  "titulo": "Acuerdo por el Que Se Da A Conocer el Monto de las Participaciones Entregadas A los Municipios del E 11",
  "Contenido": "ESTADO DE GUERRERO, DEL FONDO COMÚN\nDE PARTICIPACIONES, DEL FONDO DE\nFOMENTO MUNICIPAL, DEL FONDO PARA LA\nINFRAESTRUCTURA A MUNICIPIOS Y DEL\nFONDO DE APORTACIONES ESTATALES\nPARA LA INFRAESTRUCTURA SOCIAL\nMUNICIPAL, EN EL SEGUNDO TRIMESTRE\nDEL EJERCICIO FISCAL 2011\nABROGADO POR CONCLUIDA SU VIGENCIA EL 31 DE DICIEMBRE DE 2011.\nTEXTO ORIGINAL\nAcuerdo Publicado en el Periódico Oficial del Gobierno del Estado No. 90, el\nViernes 11 de Noviembre de 2011.\nACUERDO POR EL QUE SE DA A CONOCER EL MONTO DE LAS\nPARTICIPACIONES ENTREGADAS A LOS MUNICIPIOS DEL ESTADO DE\nGUERRERO, DEL FONDO COMÚN DE PARTICIPACIONES, DEL FONDO DE\nFOMENTO MUNICIPAL, DEL FONDO PARA LA INFRAESTRUCTURA A MUNICIPIOS\nY DEL FONDO DE APORTACIONES ESTATALES PARA LA INFRAESTRUCTURA\nSOCIAL MUNICIPAL, EN EL SEGUNDO TRIMESTRE DEL EJERCICIO FISCAL 2011.\nAl margen un sello con el Escudo Oficial que dice: Gobierno del Estado Libre y\nSoberano de Guerrero.- Poder Ejecutivo.\nANGEL HELADIO AGUIRRE RIVERO, GOBERNADOR CONSTITUCIONAL DEL\nARTÍCULOS 74, FRACCIONES III, IV Y XI DE LA CONSTITUCIÓN POLÍTICA DEL\nESTADO DE GUERRERO; 6, 10 Y 22 DE LA LEY ORGÁNICA DE LA\nADMINISTRACIÓN PÚBLICA DEL ESTADO DE GUERRERO; 22 DEL DECRETO 640\nEJERCICIO FISCAL 2011, 27, FRACCIONES I, II, III, IV, V, VI, VII, VIII, 28, 29, 30, 31\nINCISOS A) Y B), 32, INCISOS A) Y B), 33, 34 Y 48 DE LA LEY NÚMERO 427 DEL\nSISTEMA DE COORDINACIÓN HACENDARIA DEL ESTADO DE GUERRERO, Y del 2011, deben ser redistribuidas entre los municipios en los porcentajes que señala el\nESTADO DE GUERRERO, DEL FONDO COMÚN\nDE PARTICIPACIONES, DEL FONDO DE\nFOMENTO MUNICIPAL, DEL FONDO PARA LA\nINFRAESTRUCTURA A MUNICIPIOS Y DEL\nFONDO DE APORTACIONES ESTATALES\nPARA LA INFRAESTRUCTURA SOCIAL\nMUNICIPAL, EN EL SEGUNDO TRIMESTRE\nDEL EJERCICIO FISCAL 2011\nCapitulo I de la Ley de Coordinación Fiscal y de acuerdo a los criterios y fórmulas que se establecen en la Ley 427, del Sistema de Coordinación Hacendaria del Estado de\nGuerrero.\nQue la Ley de Coordinación Fiscal en el Capitulo I, Artículo 6º, último párrafo establece que \"Los Gobiernos de las Entidades, quince días después de que la\nSecretaría de Hacienda y Crédito Público publique en el Diario Oficial de la Federación el calendario de entrega, porcentaje y monto estimado que recibirá cada Entidad Federativa del Fondo General y del Fondo de Fomento Municipal, deberán publicar en el Periódico\nOficial de la Entidad de que se trate, los mismos datos antes referidos de las participaciones estimadas que entregarán a los municipios, derivadas de las participaciones que las Entidades reciban y de las que tengan obligación de participar a sus municipios\". También deberán publicar trimestralmente el importe de las participaciones entregadas y en su caso, el ajuste realizado al término de cada ejercicio\nFederación la lista de las Entidades que incumplan con esta disposición.\nPor lo anteriormente expuesto y fundado, he tenido a bien expedir el siguiente:\nGUERRERO, DEL FONDO COMÚN DE PARTICIPACIONES, DEL FONDO DE\nFOMENTO MUNICIPAL, DEL FONDO PARA LA INFRAESTRUCTURA A MUNICIPIOS\nSOCIAL MUNICIPAL, EN EL SEGUNDO TRIMESTRE DEL EJERCICIO FISCAL 2011.\nESTADO DE GUERRERO, DEL FONDO COMÚN\nDE PARTICIPACIONES, DEL FONDO DE\nFOMENTO MUNICIPAL, DEL FONDO PARA LA\nINFRAESTRUCTURA A MUNICIPIOS Y DEL\nFONDO DE APORTACIONES ESTATALES\nPARA LA INFRAESTRUCTURA SOCIAL\nMUNICIPAL, EN EL SEGUNDO TRIMESTRE\nDEL EJERCICIO FISCAL 2011\nARTICULO PRIMERO.- El presente Acuerdo tiene por objeto dar a conocer el monto de las Participaciones Federales entregadas a cada uno de los Municipios del\nEstado de Guerrero, durante el segundo trimestre del año 2011.\nARTICULO SEGUNDO.- El monto de las participaciones federales que el\nGobierno del Estado entregó a los municipios durante el periodo abril-junio de 2011, se determinó de acuerdo a lo establecido en los artículos 2º, 2ºA, 3ºA, 4º, 4ºA y 6º de la Ley de Coordinación Fiscal y 27º, 28º, 29º, 30º, 31º, 32º, 34º y 48º de la Ley 427, del Sistema de Coordinación Hacendaria del Estado de Guerrero.\nARTICULO TERCERO.- Los montos de cada uno de los conceptos que se transfirieron a los municipios, durante el segundo trimestre del ejercicio fiscal 2011, fueron los siguientes:\nParticipaciones Federales Entregadas a los Municipios (Pesos)\nAbril-junio\nFondo General 461,042,576.60 (1\nTenencia o Uso de Vehículos 20,331,159.00\nImpuesto Especial sobre Producción y Servicios 5,126,110.80 (2\nImpuestos sobre Automóviles Nuevos 2,432,340.60\nCompensación del I.S.A.N. 822,898.20\nFondo de Fiscalización 22,201,977.60 (3\nTotal Fondo Común 511,957,062.80\nESTADO DE GUERRERO, DEL FONDO COMÚN\nDE PARTICIPACIONES, DEL FONDO DE\nFOMENTO MUNICIPAL, DEL FONDO PARA LA\nINFRAESTRUCTURA A MUNICIPIOS Y DEL\nFONDO DE APORTACIONES ESTATALES\nPARA LA INFRAESTRUCTURA SOCIAL\nMUNICIPAL, EN EL SEGUNDO TRIMESTRE\nDEL EJERCICIO FISCAL 2011\nFondo de Fomento Municipal 67,916,857.00 (4\nFondo para la Infraestructura a Municipios 38,100,754.17 (5\nFondo de Aportaciones Estatales Para la Inf. Soc. Mpal. 57,151,131.23 (6\nNotas:\n1) Incluye Fondo General abril-junio/2011. 420,685,682.40\nMás: Ajuste definitivo 2010. 23,617,489.80\nFdo. de Estabilización de los Ing. de las Ent. Federativas (FEIEF) 1er. Trim/11 16,739,404.40\nTotal 461,042,576.60\n2) Incluye Impuestos Esp. sobre Producción y Servs. abril-junio/2011. 6,492,432.80\nMenos: Ajuste definitivo 2010. -1,366,322,00\nTotal 5,126,110.80\n3) Incluye el Primer Trimestre de 2011. 14,798,220.00\nMás: Diferencias del primer Trimestre/11. 6,960,965.20\nAjuste definitivo 2010. 417,920.60\nFdo. de Estabilización de los Ing. de las Ent. Federativas (FEIEF) 1er. Trim/11 24,871.80\nTotal 22,201,977.60\n4) Incluye Fondo de Fomento Municipal abril-junio/11. 63,186,847.00\nMás: Ajuste definitivo 2010. 2,439,376.00\nFdo. de Estabilización de los Ing. de las Ent. Federativas (FEIEF) 1er. Trim/11 2,290,634.00\nTotal 67,916,857.00\n5) En cumplimiento a lo establecido en el Articulo 30, de la Ley 427, del Sistema de Coordinación Hacendaría del Estado de Guerrero, abril-junio/2011.\n6) En cumplimiento a lo establecido en el Articulo 48, de la Ley 427, del Sistema de Coordinación Hacendaría del Estado de Guerrero, abril-junio/2011.\nESTADO DE GUERRERO, DEL FONDO COMÚN\nDE PARTICIPACIONES, DEL FONDO DE\nFOMENTO MUNICIPAL, DEL FONDO PARA LA\nINFRAESTRUCTURA A MUNICIPIOS Y DEL\nFONDO DE APORTACIONES ESTATALES\nPARA LA INFRAESTRUCTURA SOCIAL\nMUNICIPAL, EN EL SEGUNDO TRIMESTRE\nDEL EJERCICIO FISCAL 2011\nLos montos transferidos a los municipios son los siguientes:\nTOTAL 2do. FONDO FONDO FONDO DE FDO. DE APORT. EST.\nMUNICIPIO\nTRIM/2011 COMUN DE FTO. MPAL. INF. A MPIOS. P/INF. SOC. MPAL.\nSUMA 675,125,805.20 511,957,062.80 67,916,857.00 38,100,754.17 57,151,131.23\n00 1 ACAPULCO DE JUAREZ 173,856,323.44 124,355,479.72 25,600,156.59 12,992,926.89 10,907,760.24\n002 ACATEPEC 4,989,170.44 3,901,215.35 407,213.52 263,563.46 417,178.11\n003 AHUACUOTZINGO 3,894,724.92 3,038,778.05 314,906.82 202,889.60 338,150.45\n004 AJUCHITLAN DEL PROGRESO 7,159,647.90 5,882,744.60 478,463.93 308,664.52 489,774.85\n005 ALCOZAUCA DE GUERRERO 3,222,053.91 2,534,963.49 244,045.85 156,143.89 286,900.68\n006 ALPOYECA 1,583,156.22 1,231,482.49 90,752.54 56,875.54 204,045.65\n007 APAXTLA 2,877,599.97 2,290,125.21 174,243.27 108,096.97 305,134.52\n008 ARCELIA 7,782,995.87 5,996,378.58 587,377.92 337,617.03 861,622.34\n009 ATENANGO DEL RIO 1,967,270.73 1,558,186.42 113,160.01 70,879.32 225,044.98\n010 ATLAMAJALCINGO DEL MONTE 1,052,710.73 836,154.44 71,030.98 45,934.09 99,591.22\n011 ATLIXTAC 4,174,387.69 3,291,051.92 327,913.91 212,052.26 343,369.60\n012 ATOYAC DE ALVAREZ 12,111,659.41 9,587,894.14 953,571.42 573,672.78 996,521.07\n013 AYUTLA DE LOS LIBRES 10,671,244.46 8,448,691.29 842,468.87 530,799.92 849,284.38\n014 AZOYU 2,811,766.47 2,286,700.65 183,557.74 117,815.41 223,692.67\n015 BENITO JUAREZ 3,528,487.18 2,780,452.15 222,330.31 135,869.65 389,835.07\n016 BUENAVISTA DE CUELLAR 4,558,573.73 3,425,796.59 249,813.15 140,792.49 742,171.50\n017 CHILAPA DE ALVAREZ 18,295,708.34 14,007,712.36 1,674,879.34 1,044,421.82 1,568,694.82\n018 CHILPANCINGO DE LOS BRAVO 40,542,145.98 30,535,928.77 4,257,149.42 2,468,217.49 3,280,850.30\n019 COAHUAYUTLA DE J. MA. IZAZAGA 2,638,235.11 2,176,918.60 163,021.57 105,138.97 193,155.97\n020 COCHOAPA EL GRANDE 2,717,775.95 2,093,143.22 231,177.16 150,079.83 243,375.74\n021 COCULA 3,470,631.22 2,756,889.88 213,967.64 131,389.23 368,384.47\n022 COPALA 3,104,876.55 2,424,186.15 199,055.62 122,102.89 359,531.89\n023 COPALILLO 2,366,207.81 1,891,160.60 176,354.40 114,849.34 183,843.47\n024 COPANATOYAC 3,005,601.26 2,388,315.72 230,347.22 149,947.20 236,991.12\n025 COYUCA DE BENITEZ 13,640,562.60 10,725,618.43 1,120,291.61 677,963.18 1,116,689.38\n026 COYUCA DE CATALAN 8,230,261.91 6,699,676.38 564,209.93 353,811.94 612,563.66\n027 CUAJINICUILAPA 5,385,240.73 4,223,434.33 389,063.68 236,633.11 536,109.61\n028 CUALAC 1,710,224.05 1,330,927.43 96,913.15 60,482.88 221,900.59\n029 CUAUTEPEC 2,655,468.23 2,176,019.94 181,869.31 119,031.59 178,547.39\n030 CUETZALA DEL PROGRESO 1,880,217.46 1,531,782.06 116,158.13 74,657.99 157,619.28\n031 CUTZAMALA DE PINZON 4,594,272.07 3,803,821.43 279,585.64 177,788.03 333,076.97\n032 EDUARDO NERI 8,079,124.41 6,337,217.20 645,091.02 401,238.17 695,578.02\n033 FLORENCIO VILLARREAL 3,871,724.42 3,077,628.54 272,064.40 171,203.49 350,827.99\n034 GENERAL CANUTO A. NERI 1,451,918.08 1,194,159.17 80,042.27 51,398.98 126,317.66\n035 GENERAL HELIODORO CASTILLO 6,548,984.80 5,267,447.04 474,444.94 302,512.91 504,579.91\n036 HUAMUXTITLAN 4,016,661.10 3,085,040.52 243,104.11 142,767.91 545,748.56\n037 HUITZUCO DE LOS FIGUEROA 7,863,809.62 6,103,663.40 614,224.78 363,495.59 782,425.85\nESTADO DE GUERRERO, DEL FONDO COMÚN\nDE PARTICIPACIONES, DEL FONDO DE\nFOMENTO MUNICIPAL, DEL FONDO PARA LA\nINFRAESTRUCTURA A MUNICIPIOS Y DEL\nFONDO DE APORTACIONES ESTATALES\nPARA LA INFRAESTRUCTURA SOCIAL\nMUNICIPAL, EN EL SEGUNDO TRIMESTRE\nDEL EJERCICIO FISCAL 2011\n038 IGUALA DE LA INDEPENDENCIA 27,365,569.74 20,369,212.86 2,979,505.65 1,647,540.39 2,369,310.84\n039 IGUALAPA 1,825,983.05 1,482,930.87 130,130.12 85,168.82 127,753.24\n040 ILIATENCO 2,383,409.26 1,965,461.92 136,201.49 86,899.18 194,846.67\n041 IXCATEOPAN DE CUAUHTEMOC 1,725,380.72 1,367,993.56 90,722.86 56,744.94 209,919.36\n042 JOSE JOAQUIN DE HERRERA 2,691,391.12 2,170,056.51 192,424.55 125,056.08 203,853.98\n043 JUAN R. ESCUDERO 4,758,996.20 3,763,836.93 341,455.74 212,155.77 441,547.76\n044 JUCHITAN 1,191,940.68 964,485.16 86,236.27 56,437.89 84,781.36\n045 LEONARDO BRAVO 4,322,007.99 3,468,886.92 312,616.12 201,062.37 339,442.58\n046 MALINALTEPEC 4,548,426.25 3,582,127.33 362,942.45 235,953.47 367,403.00\n047 MARQUELIA 2,044,272.20 1,634,673.95 155,365.92 101,684.47 152,547.86\n048 MARTIR DE CUILAPAN 2,830,878.85 2,211,385.38 223,010.57 143,617.49 252,865.41\n049 METLATONOC 3,114,998.97 2,506,194.50 229,805.71 150,160.90 228,837.86\n050 MOCHITLAN 2,545,695.27 1,971,360.08 162,849.47 100,513.10 310,972.62\n051 OLINALA 4,476,963.01 3,550,251.15 328,796.44 207,872.91 390,042.51\n052 OMETEPEC 10,718,589.77 8,227,099.58 941,526.36 568,585.18 981,378.65\n053 PEDRO ASCENCIO ALQUISIRAS 1,652,494.98 1,332,755.12 91,850.48 58,276.88 169,612.50\n054 PETATLAN 8,958,427.78 7,125,706.37 670,470.67 408,597.70 753,653.04\n055 PILCAYA 7,149,275.94 5,182,949.28 336,230.35 173,973.84 1,456,122.47\n056 PUNGARABATO 9,081,488.71 6,826,934.67 753,297.52 421,106.72 1,080,149.80\n057 QUECHULTENANGO 6,204,932.06 4,965,980.18 455,423.95 289,225.22 494,302.71\n058 SAN LUIS ACATLAN 6,899,753.77 5,450,739.29 542,200.38 347,330.35 559,483.75\n059 SAN MARCOS 9,468,080.03 7,500,398.99 725,918.66 441,841.26 799,921.12\n060 SAN MIGUEL TOTOLAPAN 5,137,632.44 4,186,984.34 351,886.20 226,829.72 371,932.18\n061 TAXCO DE ALARCON 20,154,021.19 15,677,982.06 1,795,172.45 1,047,890.83 1,632,975.85\n062 TECOANAPA 7,724,483.00 6,286,959.14 542,777.05 352,362.70 542,384.11\n063 TECPAN DE GALEANA 11,316,734.90 9,017,200.83 870,829.61 540,957.83 887,746.63\n064 TELOLOAPAN 10,362,256.21 8,267,925.68 783,583.74 481,757.97 828,988.82\n065 TEPECOACUILCO DE TRUJANO 5,910,071.33 4,750,493.39 415,285.50 260,369.97 483,922.47\n066 TETIPAC 3,073,236.55 2,422,278.67 190,050.25 116,890.79 344,016.84\n067 TIXTLA DE GUERRERO 7,331,199.98 5,652,978.25 603,771.35 366,814.97 707,635.41\n068 TLACOACHISTLAHUACA 3,085,671.33 2,406,958.95 256,932.94 168,026.42 253,753.02\n069 TLACOAPA 1,752,814.57 1,407,286.19 123,840.62 80,365.36 141,322.40\n070 TLALCHAPA 2,487,313.18 2,029,364.33 149,762.71 95,341.61 212,844.53\n071 TLALIXTAQUILLA DE MALDONADO 1,758,617.83 1,368,928.13 98,739.97 61,501.82 229,447.91\n072 TLAPA DE COMONFORT 12,297,455.22 9,339,057.74 1,138,071.22 708,284.34 1,112,041.92\n073 TLAPEHUALA 4,119,097.62 3,328,761.92 282,309.18 180,143.33 327,883.19\n074 UNION DE I. MONTES DE OCA, LA 9,777,933.99 7,186,756.20 709,950.94 370,969.29 1,510,257.56\n075 XALPATLAHUAC 2,229,458.36 1,796,170.10 153,293.71 98,990.11 181,004.44\n076 XOCHIHUEHUETLAN 2,064,219.26 1,622,451.16 104,474.87 64,280.40 273,012.83\n077 XOCHISTLAHUACA 4,311,184.27 3,417,463.34 338,570.62 221,412.92 333,737.39\n078 ZAPOTITLAN TABLAS 1,835,513.57 1,496,291.26 127,185.18 83,091.60 128,945.53\n079 ZIHUATANAEJO DE AZUETA 32,391,918.37 21,192,032.10 5,012,577.21 2,441,479.68 3,745,829.38\n080 ZIRANDARO 4,077,983.19 3,365,765.79 242,108.78 152,800.45 317,308.17\n081 ZITLALA 3,656,607.72 2,838,766.37 292,679.00 186,660.77 338,501.58\nESTADO DE GUERRERO, DEL FONDO COMÚN\nDE PARTICIPACIONES, DEL FONDO DE\nFOMENTO MUNICIPAL, DEL FONDO PARA LA\nINFRAESTRUCTURA A MUNICIPIOS Y DEL\nFONDO DE APORTACIONES ESTATALES\nPARA LA INFRAESTRUCTURA SOCIAL\nMUNICIPAL, EN EL SEGUNDO TRIMESTRE\nDEL EJERCICIO FISCAL 2011\nARTICULO UNICO.- Publíquese el presente Acuerdo en el Periódico Oficial del\nGobierno del Estado para el conocimiento general y efectos legales procedentes.\nDado en la residencia oficial del Poder Ejecutivo del Estado, a los ocho días del mes de julio del año dos mil once.\nEL GOBERNADOR CONSTITUCIONAL DEL ESTADO.\nLIC. ANGEL HELADIO AGUIRRE RIVERO.\nEL SECRETARIO GENERAL DE GOBIERNO.\nLIC. HUMBERTO SALGADO GÓMEZ.\nEL SECRETARIO DE FINANZAS Y ADMINISTRACIÓN.\nC. P. JORGE SILVERIO SALGADO LEYVA.",
  "ordenamiento": "ACUERDO",
  "jurisdiccion": "GUERRERO",
  "fuente_oficial": "DIARIO OFICIAL DE LA FEDERACION",
  "Fecha de Publicación": "31 DE DICIEMBRE DE 2011",
  "ULTIMA REFORMA PUBLICADA": "11 de Noviembre de 2011",
  "status": "ABROGADA",
  "es_escaneado": false,
  "tiene_tablas": true,
  "materia": [
    "municipal"
  ]
}