{
  "titulo": "Acuerdo por el Que Se Autoriza A la Coordinación Técnica del Sistema Estatal del Registro Civil, Exp",
  "Contenido": "COPIAS CERTIFICADAS DE EXTRACTOS DE\nACTAS DE NACIMIENTO A TRAVÉS DE CAJEROS\nDE SERVICIOS ELECTRÓNICOS\nTEXTO ORIGINAL\nMartes 17 de Junio de 2008.\nACUERDO POR EL QUE SE AUTORIZA A LA COORDINACIÓN TÉCNICA DEL\nSISTEMA ESTATAL DEL REGISTRO CIVIL, EXPEDIR COPIAS CERTIFICADAS DE\nEXTRACTOS DE ACTAS DE NACIMIENTO A TRAVÉS DE CAJEROS DE SERVICIOS\nELECTRÓNICOS.\nARMANDO CHAVARRÍA BARRERA, SECRETARIO GENERAL DE GOBIERNO,\nCON LA FACULTAD QUE ME CONFIEREN LOS ARTÍCULOS 11 Y 20, FRACCIÓN X,\nDE LA LEY ORGÁNICA DE LA ADMINISTRACIÓN PÚBLICA DEL ESTADO; 3, INCISO\nA), DE LA LEY REGLAMENTARIA DEL REGISTRO CIVIL DEL ESTADO; 1, 2, 4, 5, 7, 8\nY 24 DEL REGLAMENTO INTERIOR DE LA SECRETARÍA GENERAL DE GOBIERNO, Que el Plan Estatal de Desarrollo 2005-2011, en el apartado de Modernización\nAdministrativa Integral y Transparencia de la Gestión Pública, establece como uno de los objetivos: Lograr que la organización, operación y gestión gubernamental cumpla con la función primaria de servir plenamente a la ciudadanía, con calidad, eficiencia, confiabilidad y cercanía. Entre las Estrategias y Líneas de Acción, está acercar los determinado.\nQue el Registro Nacional de Población, está coordinando el Programa de\nModernización Integral del Registro Civil, en el que con los avances tecnológicos que existen en la actualidad, se impulsa una nueva generación de servicios, con sistemas modernos, con enfoque ciudadano como es el caso de los Cajeros de Servicios\nCOPIAS CERTIFICADAS DE EXTRACTOS DE\nACTAS DE NACIMIENTO A TRAVÉS DE CAJEROS\nDE SERVICIOS ELECTRÓNICOS regiones del Estado, para que la ciudadanía pueda adquirir copias certificadas de extractos de actas de nacimiento.\nQue una de las necesidades que tiene la sociedad guerrerense, es realizar servicios en horarios fuera de oficina, por lo que el Gobierno del Estado a través de la\nCoordinación Técnica del Sistema Estatal del Registro Civil, ha estimado necesario instalar Cajeros Electrónicos, con el fin de expedir copias certificadas de extractos de actas de nacimiento, y con ello proporcionar un servicio eficiente y eficaz a la población, que les ahorre tiempo, dinero y esfuerzo.\nQue en uso de las facultades que me confiere la Ley Orgánica de la\nAdministración Publica del Estado, como es organizar, dirigir y vigilar el ejercicio de las funciones del Registro Civil, que incluye la implementación y operación de sistemas informáticos, he considerado procedente autorizar a la Coordinación Técnica del Sistema\nEstatal del Registro Civil, para expedir a través de los Cajeros de Servicios Electrónicos, copias certificadas de extractos de actas de nacimiento.\nQue las copias certificadas de extractos de actas de nacimiento contendrán los datos siguientes: lugar y fecha de registro, nombre (s), apellido (s), sexo, fecha, hora y lugar de nacimiento del registrado; Clave Única del Registro de Población (CURP); Clave acta la (CRIP); nombre (s), apellido (s), nacionalidad y edad de los padres; lugar y fecha de certificación, así como nombre y firma del Coordinador Técnico del sistema Estatal del\nRegistro Civil; y sello correspondiente; excluyéndose los datos de los abuelos de\n(RENAPO).\nPor lo anteriormente expuesto y fundado, he tenido a bien expedir el siguiente:\nCOPIAS CERTIFICADAS DE EXTRACTOS DE\nACTAS DE NACIMIENTO A TRAVÉS DE CAJEROS\nDE SERVICIOS ELECTRÓNICOS\nEXTRACTOS DE ACTAS DE NACIMIENTO A TRAVÉS DE CAJEROS DE SERVICIOS\nELECTRÓNICOS.\nARTÍCULO PRIMERO.- Se autoriza a la Coordinación Técnica del Sistema\nEstatal del Registro Civil, expedir copias certificadas de extractos de actas de nacimiento a través de Cajeros de Servicios Electrónicos.\nARTÍCULO SEGUNDO.- Los Cajeros de Servicios Electrónicos, previo el pago correspondiente, expedirán copias certificadas de extractos de actas de nacimiento que tendrá los datos siguientes: lugar y fecha de registro, nombre (s), apellido (s), sexo, fecha, hora y lugar de nacimiento del registrado; Clave Única del Registro de Población\n(CURP); Clave de Registro de Identificación Personal del registro cuando se encuentra asentado en el acta la (CRIP); nombre (s), apellido (s), nacionalidad y edad de los padres; lugar y fecha de certificación, así como nombre y firma del Coordinador Técnico del Sistema Estatal del Registro Civil; y sello correspondiente; excluyéndose los datos de los abuelos de conformidad con el Acuerdo de la Dirección General del Registro Nacional de Población (RENAPO).\nARTÍCULO TERCERO.- La Coordinación Técnica del Sistema Estatal del\nRegistro Civil, realizará los trámites necesarios para la operación de los Cajeros de\nServicios Electrónicos, en coordinación con la Secretaría de Finanzas y Administración\nPRIMERO.- El presente Acuerdo entrará en vigor a partir del día de su expedición.\nSEGUNDO.- Publíquese el presente Acuerdo en el Periódico Oficial del Gobierno del Estado de Guerrero, para los efectos legales procedentes.\nChilpancingo, Guerrero, a los cuatro días del mes de marzo del año dos mil ocho.\nCOPIAS CERTIFICADAS DE EXTRACTOS DE\nACTAS DE NACIMIENTO A TRAVÉS DE CAJEROS\nDE SERVICIOS ELECTRÓNICOS\nEL SECRETARIO GENERAL DE GOBIERNO.\nLIC. ARMANDO CHAVARRÍA BARRERA.\nRúbrica.",
  "ordenamiento": "ACUERDO",
  "jurisdiccion": "GUERRERO",
  "fuente_oficial": "DIARIO OFICIAL DE LA FEDERACION",
  "Fecha de Publicación": "17 de Junio de 2008",
  "ULTIMA REFORMA PUBLICADA": null,
  "status": "VIGENTE",
  "es_escaneado": false,
  "tiene_tablas": false,
  "materia": [
    "civil",
    "registral"
  ]
}