{
  "titulo": "Acuerdo por el Que Se Delega al Director General de Administración y Finanzas y al Director de la Un",
  "Contenido": "JURÍDICOS, LA FACULTAD PARA FIRMAR EN\nREPRESENTACIÓN DEL TITULAR DE LA\nDE DONACIÓN, PÓLIZAS, RECIBOS DE EGRESOS Y\nDEMÁS DOCUMENTOS COMPROBATORIOS DE\nRECURSOS DE LOS DIVERSOS PROGRAMAS\nSOCIALES, CORRESPONDIENTES AL EJERCICIO\nFISCAL 2015\nTEXTO ORIGINAL.\nAcuerdo publicado en el Periódico Oficial del Gobierno del Estado No. 62, el Martes 04 de\nAgosto de 2015.\nACUERDO POR EL QUE SE DELEGA AL DIRECTOR GENERAL ADMINISTRACIÓN Y FINANZAS Y\nAL DIRECTOR DE LA UNIDAD DE ASUNTOS JURÍDICOS, LA FACULTAD PARA FIRMAR EN\nREPRESENTACIÓN DEL TITULAR DE LA SECRETARÍA DE DESARROLLO SOCIAL, LAS ACTAS\nDE DONACIÓN, PÓLIZAS, RECIBOS DE EGRESOS Y DEMÁS DOCUMENTOS COMPROBATORIOS\nDE RECURSOS DE LOS DIVERSOS PROGRAMAS SOCIALES, CORRESPONDIENTES AL\nEJERCICIO FISCAL 2015.\nC. JESÚS AURELIO ACROY MENDOZA DE LA LAMA, ENCARGADO DE DESPACHO DE LA\nSECRETARÍA DE DESARROLLO SOCIAL, CON FUNDAMENTO EN LOS ARTÍCULOS 1o., 11, 18\nFRACCIÓN II Y 21 LA LEY ORGÁNICA DE LA ADMINISTRACIÓN PÚBLICA DEL ESTADO DE\nGUERRERO; 2o., FRACCIÓN I, 62, 68 Y 99 DE LA LEY DE PRESUPUESTO Y DISCIPLINA FISCAL\nDEL ESTADO DE GUERRERO; Y\nQue de conformidad con lo establecido en la Ley Orgánica de la Administración Pública del\nEstado Número 433, la Secretaría de Desarrollo Social como parte integrante de la Administración\nPública Centralizada, cuenta con los recursos etiquetados en el Decreto Número 679 de Presupuesto de\nEgresos del Estado de Guerrero para el Ejercicio Fiscal 2015, los cuales permitirán el desarrollo de la política social que el Gobierno del Estado tiene destinado de acuerdo al Plan Estatal de Desarrollo 2011 -\n2015.\nQue el Presupuesto de Egresos para el Ejercicio Fiscal 2015, contempla los montos de inversión por Programas y Proyectos de acuerdo a las acciones, objetivos y estrategias contempladas en este cuerpo normativo, para que la Administración Pública del Estado, se enfoque en los alcances proyectados en beneficio de la ciudadanía. autorizados, observando los principios de responsabilidad, eficiencia, transparencia, economía, racionalidad, control, equidad de género, impacto social y rendición de cuentas.\nJURÍDICOS, LA FACULTAD PARA FIRMAR EN\nREPRESENTACIÓN DEL TITULAR DE LA\nDE DONACIÓN, PÓLIZAS, RECIBOS DE EGRESOS Y\nDEMÁS DOCUMENTOS COMPROBATORIOS DE\nRECURSOS DE LOS DIVERSOS PROGRAMAS\nSOCIALES, CORRESPONDIENTES AL EJERCICIO\nFISCAL 2015\nQue en atención a lo señalado por los artículos 2o fracción I, 62, 68 y 99 de la Ley Número 454 de Presupuesto y Disciplina Fiscal del Estado de Guerrero; los funcionarios autorizados para ejercer el\nGasto Público, tienen facultades suficientes para realizar los trámites presupuestarios correspondientes, con la finalidad de tener los elementos necesarios que aseguren la plena eficiencia del establecimiento de los trabajos, acciones y recursos de los proyectos que impulsaran el desarrollo comunitario en los municipios del Estado de Guerrero.\nQue los titulares de las Dependencias y Entidades del Estado, en el ejercicio de su presupuesto, serán los responsables de su exacta aplicación, del cumplimiento de los programas y de sus recursos asignados, así como de la eficiencia y eficacia con que se ejecuten, debiendo integrar los informes de los avances programático presupuestales dentro de los periodos establecidos para la integración de la comprobación respectiva.\nQue con la finalidad de lograr una mejor distribución y desahogo del trabajo con un alto sentido de oportunidad, eficacia y transparencia en la información financiera que esta Secretaría lleva a cabo con motivo del ejercicio de los recursos autorizados en los diversos programas, y con atención a las facultades y atribuciones establecidas por la Ley Orgánica de la Administración Pública del Estado\nNúmero 433, la cual establece que los titulares de las dependencias pueden delegar facultades a sus subalternos;\nPor lo anteriormente expuesto se expide el siguiente:\nACUERDO POR EL QUE SE DELEGA AL DIRECTOR GENERAL ADMINISTRACIÓN Y FINANZAS Y\nAL DIRECTOR DE LA UNIDAD DE ASUNTOS JURÍDICOS, LA FACULTAD PARA FIRMAR EN\nREPRESENTACIÓN DEL TITULAR DE LA SECRETARÍA DE DESARROLLO SOCIAL, LAS ACTAS\nDE DONACIÓN, PÓLIZAS, RECIBOS DE EGRESOS Y DEMAS DOCUMENTOS COMPROBATORIOS\nDE RECURSOS DE LOS DIVERSOS PROGRAMAS SOCIALES, CORRESPONDIENTES AL\nEJERCICIO FISCAL 2015.\nPRIMERO. Se delega la facultad de firmar en representación del titular de la Secretaría de\nDesarrollo Social, los documentos correspondientes a las Actas de Donación, Pólizas, Recibos de\nEgresos y demás documentos comprobatorios de recursos de los Diversos Programas Sociales, correspondiente para el Ejercicio Fiscal 2015, al Director General de Administración y Finanzas y al\nDirector de la Unidad de Asuntos Jurídicos de la Secretaría de Desarrollo Social.\nJURÍDICOS, LA FACULTAD PARA FIRMAR EN\nREPRESENTACIÓN DEL TITULAR DE LA\nDE DONACIÓN, PÓLIZAS, RECIBOS DE EGRESOS Y\nDEMÁS DOCUMENTOS COMPROBATORIOS DE\nRECURSOS DE LOS DIVERSOS PROGRAMAS\nSOCIALES, CORRESPONDIENTES AL EJERCICIO\nFISCAL 2015\nSEGUNDO. El ejercicio de las facultades que se delegan en el presente Acuerdo, se sujetará a las disposiciones, lineamientos y criterios establecidos la ley.\nTERCERO. La presente delegación de facultades se entiende hecha sin perjuicio de su ejercicio directo por parte del Titular de la Secretaría de Desarrollo Social del Estado de Guerrero.\nCUARTO. Los servidores públicos delegados deberá informar periódicamente al titular o cuando sea solicitado por éste, el ejercicio de estas facultades.\nTRANSITORIOS\nPrimero. El presente acuerdo entrará en vigor al día siguiente de su publicación en el Periódico\nOficial del Gobierno del Estado.\nSegundo. Publíquese en el Periódico Oficial del Gobierno del Estado de Guerrero, para su conocimiento general y efectos legales conducentes.\nDado en la Ciudad de Chilpancingo de los Bravo, Capital del estado de Guerrero, a los dos días del mes de junio del año dos mil quince.\nENCARGADO DE DESPACHO DE LA\nSECRETARÍA DE DESARROLLO SOCIAL.\nC. JESÚS AURELIO ACROY MENDOZA DE LA LAMA.\nRúbrica.\nDIRECTOR DE LA UNIDAD DE ASUNTOS JURÍDICOS.\nLIC. FIDELMAR FLORES MÉNDEZ.\nEL SUSCRITO LICENCIADO FIDELMAR FLORES MENDEZ, DIRECTOR DE LA UNIDAD DE\nGUERRERO, QUIEN ACTÚA CON LOS TESTIGOS DE ASISTENCIA QUIENES DAN FE Y LEGALIDAD\nDE LA PRESENTE Y CON FUNDAMENTO EN EL ARTICULO 11 DE LA LEY ORGÁNICA DE LA\nADMINISTRACIÓN PÚBLICA DEL ESTADO DE GUERRERO NÚMERO 433 Y; ARTÍCULO PRIMERO\nFRACCIÓN VI DEL ACUERDO DELEGATORIO DE FACULTADES PUBLICADO EL DÍA 2 DE JULIO\nDEL 2013, EN EL PERIÓDICO OFICIAL DEL ESTADO DE GUERRERO,\nJURÍDICOS, LA FACULTAD PARA FIRMAR EN\nREPRESENTACIÓN DEL TITULAR DE LA\nDE DONACIÓN, PÓLIZAS, RECIBOS DE EGRESOS Y\nDEMÁS DOCUMENTOS COMPROBATORIOS DE\nRECURSOS DE LOS DIVERSOS PROGRAMAS\nSOCIALES, CORRESPONDIENTES AL EJERCICIO\nFISCAL 2015\nQUE LAS PRESENTES COPIAS FOTOSTÁTICAS CONSISTENTES EL ACUERDO POR EL\nQUE SE DELEGA AL DIRECTOR GENERAL DE ADMINISTRACIÓN Y FINANZAS Y AL DIRECTOR\nDE LA UNIDAD DE ASUNTOS JURÍDICOS, LA FACULTAD PARA FIRMAR EN REPRESENTACIÓN\nDEL TITULAR DE LA SECRETARÍA DE DESARROLLO SOCIAL, LAS ACTAS DE DONACIÓN, LAS\nPÓLIZA, RECIBOS DE EGRESOS Y DEMÁS DOCUMENTOS COMPROBATORIOS DE RECURSOS\nDE LOS DIVERSOS PROGRAMAS SOCIALES, CORRESPONDIENTE AL EJERCICIO FISCAL 2015,\nCONCUERDA FIELMENTE CON TODAS Y CADA UNA DE SUS PARTES DEL ORIGINAL, MISMO QUE\nTUVE A LA VISTA Y PREVIO COTEJO, SE DEVUELVE A LOS ARCHIVOS DE ORIGEN PARA QUE\nOBREN EN LOS MISMOS.\nCONSTE.- LO QUE CERTIFICO PARA LOS EFECTOS LEGALES A QUE HAYA LUGAR, EN\nLA CIUDAD DE CHILPANCINGO, GUERRERO, EL DÍA VEINTITRES DEL MES DE JUNIO DEL AÑO\nDOS MIL QUINCE.\nTESTIGOS DE ASISTENCIA.\nLIC. LILIANA VALIENTE RENDÓN.\nLIC. MANUEL MORGA ÁNGEL.",
  "ordenamiento": "ACUERDO",
  "jurisdiccion": "GUERRERO",
  "fuente_oficial": "DIARIO OFICIAL DE LA FEDERACION",
  "Fecha de Publicación": "04 de \nAgosto de 2015",
  "ULTIMA REFORMA PUBLICADA": null,
  "status": "VIGENTE",
  "es_escaneado": false,
  "tiene_tablas": false,
  "materia": [
    "general"
  ]
}