{
  "titulo": "Acuerdo por el Que Se Da A Conocer el Monto de las Participaciones Entregadas A los Municipios del E 7",
  "Contenido": "DE FOMENTO MUNICIPAL, DEL FONDO GENERAL, DE\nCOORDINACIÓN EN DERECHOS DEL FONDO\nGENERAL, DEL IMPUESTO SOBRE AUTOMÓVILES\nNUEVOS, DEL IMPUESTO SOBRE TENENCIA O USO DE\nVEHÍCULOS AUTOMOTORES Y DEL IMPUESTO\nESPECIAL SOBRE PRODUCCIÓN Y SERVICIOS EN EL\nTERCER TRIMESTRE DEL EJERCICIO FISCAL 2006.\nABROGADO POR CONCLUIDA SU VIGENCIA EL 30 DE SEPTIEMBRE DE\n2006.\nTEXTO ORIGINAL\nAcuerdo publicado en el Periódico Oficial del Gobierno del Estado No. 89, el\nMartes 7 de Noviembre de 2006.\nACUERDO POR EL QUE SE DA A CONOCER EL MONTO DE LAS\nPARTICIPACIONES ENTREGADAS A LOS MUNICIPIOS DEL ESTADO DE\nGUERRERO, DEL FONDO DE FOMENTO MUNICIPAL, DEL FONDO GENERAL, DE\nCOORDINACIÓN EN DERECHOS DEL FONDO GENERAL, DEL IMPUESTO SOBRE\nAUTOMÓVILES NUEVOS, DEL IMPUESTO SOBRE TENENCIA O USO DE\nVEHÍCULOS AUTOMOTORES Y DEL IMPUESTO ESPECIAL SOBRE PRODUCCIÓN\nY SERVICIOS EN EL TERCER TRIMESTRE DEL EJERCICIO FISCAL 2006.\nAl margen un sello con el Escudo Nacional que dice: Gobierno del Estado Libre y\nSoberano de Guerrero.- Poder Ejecutivo.\nCARLOS ZEFERINO TORREBLANCA GALINDO, GOBERNADOR\nFUNDAMENTO EN LOS ARTÍCULOS 74, FRACCIONES III, IV Y XI DE LA\nORGÁNICA DE LA ADMINISTRACIÓN PÚBLICA DEL ESTADO DE GUERRERO; Y 6,\nFRACCIONES I, II, III, IV Y V, 7, FRACCIONES I, II, III, IV Y V, 8, INCISOS A) Y B), Y 8\nA, INCISOS A), B) Y C) Y 10 DE LA LEY NÚMERO 251 QUE CREA EL SISTEMA\nESTATAL DE COORDINACIÓN FISCAL Y ESTABLECE LAS BASES, MONTOS Y\nPLAZOS A LOS QUE SE SUJETARÁN LAS PARTICIPACIONES FEDERALES, Y del 2006, deben ser redistribuidas entre los municipios en los porcentajes que señala el establecen en la Ley 251, que crea el Sistema Estatal de Coordinación Fiscal y establece las bases, montos y plazos a los que se sujetarán las Participaciones Federales.\nDE FOMENTO MUNICIPAL, DEL FONDO GENERAL, DE\nCOORDINACIÓN EN DERECHOS DEL FONDO\nGENERAL, DEL IMPUESTO SOBRE AUTOMÓVILES\nNUEVOS, DEL IMPUESTO SOBRE TENENCIA O USO DE\nVEHÍCULOS AUTOMOTORES Y DEL IMPUESTO\nESPECIAL SOBRE PRODUCCIÓN Y SERVICIOS EN EL\nTERCER TRIMESTRE DEL EJERCICIO FISCAL 2006.\nQue la Ley de Coordinación Fiscal en el Capítulo I, Artículo 6° establece que “Los\nGobiernos de las Entidades, quince días después de que la Secretaría de Hacienda y\nCrédito Público publique en el Diario Oficial de la Federación el calendario de entrega, porcentaje y monto estimado que recibirá cada Entidad Federativa del Fondo General y del Fondo de Fomento Municipal, deberán publicar en el Periódico Oficial de la Entidad de que se trate, los mismos datos antes referidos de las participaciones estimadas que entregarán a los municipios, derivadas de las participaciones que las Entidades reciban y las que tengan obligación de participar a sus municipios”. También deberán publicar trimestralmente el importe de las participaciones entregadas y en su caso, el ajuste realizado al término de cada ejercicio fiscal. La Secretaría de Hacienda y Crédito Público publicará en el Diario Oficial de la Federación la lista de las Entidades que incumplan con esta disposición.\nPor lo anteriormente expuesto y fundado, he tenido a bien expedir el siguiente:\nACUERDO POR EL QUE SE DA A CONOCER EL MONTO DE LAS\nPARTICIPACIONES ENTREGADAS A LOS MUNICIPIOS DEL ESTADO DE\nGUERRERO, DEL FONDO DE FOMENTO MUNICIPAL, DEL FONDO GENERAL, DE\nCOORDINACIÓN EN DERECHOS DEL FONDO GENERAL, DEL IMPUESTO SOBRE\nAUTOMÓVILES NUEVOS, DEL IMPUESTO SOBRE TENENCIA O USO DE\nVEHÍCULOS AUTOMOTORES Y DEL IMPUESTO ESPECIAL SOBRE PRODUCCIÓN\nY SERVICIOS EN EL TERCER TRIMESTRE DEL EJERCICIO FISCAL 2006.\nARTÍCULO PRIMERO.- El presente Acuerdo tiene por objeto dar a conocer el\nEstado de Guerrero, durante el tercer trimestre del año 2006.\nARTÍCULO SEGUNDO.- El monto de las participaciones federales que el\n2006, se determinó de acuerdo a lo establecido en los artículos 2°, 2°A y 3°A de la Ley de Coordinación Fiscal y 6°, 7°, 8° y 8°A de la Ley 251 que crea el Sistema Estatal de\nCoordinación Fiscal y establece las bases, montos y plazos a los que se sujetarán las\nDE FOMENTO MUNICIPAL, DEL FONDO GENERAL, DE\nCOORDINACIÓN EN DERECHOS DEL FONDO\nGENERAL, DEL IMPUESTO SOBRE AUTOMÓVILES\nNUEVOS, DEL IMPUESTO SOBRE TENENCIA O USO DE\nVEHÍCULOS AUTOMOTORES Y DEL IMPUESTO\nESPECIAL SOBRE PRODUCCIÓN Y SERVICIOS EN EL\nTERCER TRIMESTRE DEL EJERCICIO FISCAL 2006.\nParticipaciones Federales.\nARTÍCULO TERCERO.- Los montos de cada uno de los conceptos que se transfirieron a los municipios, durante el tercer trimestre del ejercicio fiscal 2006, fueron los siguientes:\nParticipaciones Federales Entregadas a los Municipios (Pesos)\nConcepto Periodo\nJulio-Septiembre\nFondo General 324,350,170.60\nTenencia o Uso de Vehículos 4,938,109.60\nImpuesto Especial sobre Producción y Servicios 1,472,924.00\nImpuesto Especial sobre Automóviles Nuevos (1) 2,668,445.00\nCoordinación en Derechos del Fondo General 16,210,086.60\nSubtotal Fondo Común 349,639,735.80\nFondo de Fomento Municipal 42,614,371.00\n(1) Incluye la cantidad de $544,892.40, correspondiente al 20%, de la cantidad de $2,724,462.00 qué por compensación del Impuesto Sobre\nAutomóviles Nuevos, recibió el Gobierno del Estado.\n(2) Incluye el ajuste definitivo del ejercicio fiscal 2005, por un importe total de -$5,673,485.00 (Menos cinco millones seiscientos setenta y tres mil cuatrocientos ochenta y cinco pesos cero centavos), integrado por los siguientes conceptos y montos: Fondo General -$4,555,616.00 (Menos cuatro millones quinientos cincuenta y cinco mil seiscientos dieciséis pesos cero centavos); Impuestos Especiales Sobre Producción y Servicios $910,571.20 (Menos novecientos diez mil quinientos setenta y un pesos, veinte centavos); Coordinación en Derechos -$227,831.80 (Menos doscientos veintisiete mil ochocientos treinta y un pesos ochenta centavos) y Fondo de Fomento Municipal $20,534,00 (Veinte mil quinientos treinta y cuatro pesos, cero centavos). Así como el primer ajuste cuatrimestral del ejercicio fiscal 2006, por un importe total de $21,369,530.80\n(Veintiún millones trescientos sesenta y nueve mil quinientos treinta pesos, ochenta centavos); integrados por los siguientes conceptos y montos:\nFondo General $14,359,637.00 (Catorce millones trescientos cincuenta y nueve mil seiscientos treinta y siete pesos, cero centavos); Impuestos\nEspeciales sobre Producción y Servicios -$1,748,118.00 (Menos un millón setecientos cuarenta y ocho mil ciento dieciocho pesos, cero centavos) y Fondo de Fomento Municipal $8,040,030.00 (Ocho millones cuarenta mil treinta pesos, cero centavos).\nDE FOMENTO MUNICIPAL, DEL FONDO GENERAL, DE\nCOORDINACIÓN EN DERECHOS DEL FONDO\nGENERAL, DEL IMPUESTO SOBRE AUTOMÓVILES\nNUEVOS, DEL IMPUESTO SOBRE TENENCIA O USO DE\nVEHÍCULOS AUTOMOTORES Y DEL IMPUESTO\nESPECIAL SOBRE PRODUCCIÓN Y SERVICIOS EN EL\nTERCER TRIMESTRE DEL EJERCICIO FISCAL 2006.\nLos montos transferidos por el fondo a los municipios son los siguientes:\nTOTAL FONDO DE FONDO\nCM MUNICIPIO\nTERCER FOMENTO COMUN\nTRIMESTRES/06 MUNICIPAL 100%\nTOTAL 392,254,106.80 42,614,371.00 349,639,735.80\n1 ACAPULCO DE JUAREZ 98,346,957.15 15,900,479.86 82,446,477.29\n2 ACATEPEC 3,072,599.21 210,844.48 2,861,754.73\n3 AHUACUOTZINGO 2,360,971.82 169,671.22 2,191,300.60\n4 AJUCHITLAN DEL PROGRESO 4,994,327.65 356,056.23 4,638,271.42\n5 ALCOZAUCA DE GUERRERO 1,952,972.25 146,393.87 1,806,578.38\n6 ALPOYECA 746,043.75 53,794.13 692,249.62\n7 APAXTLA 1,610,953.73 124,125.44 1,486,828.29\n8 ARCELIA 4,030,743.82 313,217.15 3,717,526.67\n9 ATENANGO DEL RIO 1,041,480.74 77,216.99 964,263.75\n10 ATLAMAJALCINGO DEL MONTE 622,958.18 42,843.97 580,114.21\n11 ATLIXTAC 2,613,223.43 181,991.65 2,431,231.78\n12 ATOYAC DE ALVAREZ 7,577,937.71 568,294.22 7,009,643.49\n13 AYUTLA DE LOS LIBRES 6,783,376.21 483,086.35 6,300,289.36\n14 AZOYU 1,843,214.31 131,430.95 1,711,783.36\n15 BENITO JUAREZ 1,912,086.37 159,069.30 1,753,017.07\n16 BUENAVISTA DE CUELLAR 1,577,014.55 147,617.03 1,429,397.52\n17 CHILAPA DE ALVAREZ 10,918,360.16 847,186.86 10,071,173.30\n18 CHILPANCINGO DE LOS BRAVO 24,437,560.03 2,510,128.11 21,927,431.92\n19 COAHUAYUTLA DE J. MA. IZAZAGA 1,810,387.84 130,911.90 1,679,475.94\n20 COCHOAPA EL GRANDE 1,597,716.41 109,283.27 1,488,433.14\n21 COCULA 1,947,628.32 161,610.86 1,786,017.46\n22 COPALA 1,590,652.22 112,626.46 1,478,025.76\n23 COPALILLO 1,550,821.66 120,516.16 1,430,305.50\n24 COPANATOYAC 1,928,955.07 132,880.22 1,796,074.85\n25 COYUCA DE BENITEZ 8,503,846.64 648,363.08 7,855,433.56\n26 COYUCA DE CATALAN 5,541,559.85 417,832.16 5,123,727.69\n27 CUAJINICUILAPA 3,048,800.00 222,700.14 2,826,099.86\n28 CUALAC 805,861.36 62,220.64 743,640.72\n29 CUAUTEPEC 1,854,535.95 126,922.92 1,727,583.03\n30 CUETZALA DEL PROGRESO 1,210,634.54 87,088.63 1,123,565.91\n31 CUTZAMALA DE PINZON 3,181,921.43 241,731.64 2,940,189.79\n32 EDUARDO NERI 4,929,803.40 365,279.39 4,564,524.01\n33 FLORENCIO VILLARREAL 2,342,333.98 169,198.91 2,173,135.07\n34 GENERAL CANUTO A. NERI 930,534.92 67,675.80 862,859.12\n35 GENERAL HELIODORO CASTILLO 4,287,886.38 301,887.44 3,985,998.94\n36 HUAMUXTITLAN 1,765,696.08 135,556.40 1,630,139.68\nDE FOMENTO MUNICIPAL, DEL FONDO GENERAL, DE\nCOORDINACIÓN EN DERECHOS DEL FONDO\nGENERAL, DEL IMPUESTO SOBRE AUTOMÓVILES\nNUEVOS, DEL IMPUESTO SOBRE TENENCIA O USO DE\nVEHÍCULOS AUTOMOTORES Y DEL IMPUESTO\nESPECIAL SOBRE PRODUCCIÓN Y SERVICIOS EN EL\nTERCER TRIMESTRE DEL EJERCICIO FISCAL 2006.\n37 HUITZUCO DE LOS FIGUEROA 4,441,590.70 382,044.69 4,059,546.01\n38 IGUALA DE LA INDEPENDENCIA 16,340,695.59 2,251,392.14 14,089,303.45\n39 IGUALAPA 1,250,924.46 87,614.30 1,163,310.16\n40 ILIATENCO 1,563,605.11 107,724.42 1,455,880.69\n41 IXCATEOPAN DE CUAUHTEMOC 881,549.92 71,104.94 810,444.98\n42 JOSE AZUETA 14,235,016.34 3,402,656.38 10,832,359.96\n43 JOSE JOAQUIN DE HERRERA 1,795,570.65 139,384.93 1,656,185.72\n44 JUAN R. ESCUDERO 2,860,198.23 238,040.76 2,622,157.47\n45 JUCHITAN 809,315.54 56,655.20 752,660.34\n46 LEONARDO BRAVO 2,811,505.57 201,975.67 2,609,129.90\n47 MALINALTEPEC 2,864,499.98 196,885.17 2,667,614.81\n48 MARTIR DE CUILAPAN 1,691,181.30 116,994.54 1,574,187.16\n49 MARQUELIA 1,358,988.47 105,641.26 1,255,347.21\n50 METLATONOC 2,075,941.47 142,346.36 1,934,595.11\n51 MOCHITLAN 1,249,500.54 96,224.35 1,153,376.19\n52 OLINALA 2,757,945.67 205,215.82 252,729.85\n53 OMETEPEC 6,778,708.53 465,042.12 5,713,666.41\n54 PEDRO ASCENCIO ALQUISIRAS 958,306.58 72,989.76 885,316.32\n55 PETATLAN 5,664,789.84 488,522.84 5,176,267.00\n56 PILCAYA 1,347,581.87 115,412.28 1,232,169.59\n57 PUNGARABATO 4,495,031.35 531,674.74 3,963,356.61\n58 QUECHULTENANGO 4,005,947.22 297,216.45 3,308,730.77\n59 SAN LUIS ACATLAN 4,347,754.92 302,938.20 4,044,316.72\n60 SAN MARCOS 5,871,063.17 436,050.87 5,435,012.30\n61 SAN MIGUEL TOTOLAPAN 3,492,951.24 250,474.19 3,242,476.05\n62 TAXCO DE ALARCON 12,618,981.21 1,187,798.16 11,431,183.05\n63 TECOANAPA 5,285,576.08 364,328.28 4,921,247.80\n64 TECPAN DE GALEANA 7,339,611.77 589,160.76 6,750,451.01\n65 TELOLOAPAN 6,702,674.90 566,484.60 6,136,190.30\n66 TEPECOACUILCO DE TRUJANO 3,787,649.14 282,304.15 3,505,344.99\n67 TETIPAC 1,654,481.20 138,883.17 1,515,598.03\n68 TIXTLA DE GUERRERO 4,175,546.16 344,167.72 3,381,378.44\n69 TLACOACHISTLAHUACA 1,911,754.87 131,215.23 1,780,536.64\n70 TLACOAPA 1,126,191.09 77,188.67 1,049,002.42\n71 TLALCHAPA 1,592,297.12 117,583.15 1,474,713.97\n72 TLALIXTAQUILLA DE MALDONADO 820,935.71 59,825.25 761,110.46\n73 TLAPA DE COMONFORT 7,108,714.59 561,604.95 6,547,109.64\n74 TLAPEHUALA 2,699,868.48 210,633.55 2,489,234.93\n75 UNION DE I. MONTES DE OCA, LA 3,470,810.72 359,443.29 3,111,367.43\n76 XALPATLAHUAC 1,435,853.10 101,242.23 1,334,610.87\n77 XOCHISTLAHUACA 2,781,011.08 191,505.44 2,589,505.64\n78 XOCHIHUEHUETLAN 967,634.44 73,830.46 893,903.98\n79 ZAPOTITLAN TABLAS 1,257,590.45 85,710.63 1,171,879.82\n80 ZIRANDARO 2,153,224.79 216,028.74 2,537,196.05\n81 ZITLALA 2,139,979.02 157,426.26 1,982,552.76\nDE FOMENTO MUNICIPAL, DEL FONDO GENERAL, DE\nCOORDINACIÓN EN DERECHOS DEL FONDO\nGENERAL, DEL IMPUESTO SOBRE AUTOMÓVILES\nNUEVOS, DEL IMPUESTO SOBRE TENENCIA O USO DE\nVEHÍCULOS AUTOMOTORES Y DEL IMPUESTO\nESPECIAL SOBRE PRODUCCIÓN Y SERVICIOS EN EL\nTERCER TRIMESTRE DEL EJERCICIO FISCAL 2006.\nEl desglose del Fondo Común por cada uno de los fondos es el siguiente:\nTOTAL COORDINACIÓN IMPUESTO IMPUESTO SOBRE IMPUESTOS\nCM MUNICIPIO FONDO FONDO SOBRE TENENCIA O USO ESPECIALES SOBRE\nEN DERECHOS\nAUTOMOVILES DE VEHICULOS PRODUCCION Y\nCOMUN GENERAL\nDEL FONDO GENERAL NUEVOS AUTOMOTORES SERVICIOS\nTOTAL 349,639,735.80 324,350,170.60 16,210,086.60 2,668,445.00 4,938,109.50 1,472,924.00\n1 ACAPULCO DE JUAREZ 82,446,477.29 76,483,094.55 3,822,404.61 629,230.23 1,164,426.40 347,321.50\n2 ACATEPEC 2,861,754.73 2,654,763.01 132,677.40 21,840.87 40,417.76 12,055.69\n3 AHUACUOTZINGO 2,191,300.60 2,032,563.07 101,593.63 16,723.97 30,948.66 9,231.27\n4 AJUCHITLAN DEL 4,638,271.42 4,302,783.63 215,040.72 35,399.21 65,508.26 19,539.60\nPROGRESO\n5 ALCOZAUCA DE 1,806,578.38 1,675,907.93 83,757.05 13,787.77 25,515.07 7,610.56\nGUERRERO\n6 ALPOYECA 692,249.62 642,178.95 32,094.26 5,283.24 9,776.93 2,916.24\n7 APAXTLA 1,485,828.29 1,379,285.47 68,932.71 11,347.45 20,999.10 6,263.56\n8 ARCELIA 3,717,526.67 3,448,636.64 172,352.92 28,372.11 52,504.21 15,660.79\n9 ATENANGO DEL RIO 964,263.75 894,518.21 44,705.44 7,359.25 13,618.70 4,062.15\n10 ATLAMAJALCINGO DEL 580,114.21 538,154.34 26,895.41 4,427.42 8,193.20 2,443.84\nMONTE\n11 ATLIXTAC 2,431,231.78 2,255,379.94 112,717.39 18,555.11 34,337.32 10,242.02\n12 ATOYAC DE ALVAREZ 7,009,643.49 6,502,633.52 324,982.88 53,497.48 99,000.15 29,529.46\n13 AYUTLA DE LOS LIBRES 6,300,289.86 5,844,587.68 292,095.64 48,083.71 88,981.65 26,541.18\n14 AZOYU 1,711,783.36 1,587,969.47 79,362.14 13,064.30 24,176.24 7,211.21\n15 BENITO JUAREZ 1,753,017.07 1,626,220.73 81,273.82 13,379.00 24,758.60 7,384.92\n16 BUENAVISTA DE 1,429,397.52 1,326,008.70 66,270.09 10,909.14 20,187.99 6,021.61\nCUELLAR\n17 CHILAPA DE ALVAREZ 10,071,173.30 9,342,721.78 466,922.31 76,863.04 142,239.44 42,426.73\n18 CHILPANCINGO DE LOS 21,927,431.92 20,341,413.05 1,016,605.19 167,349.82 309,659.38 92,373.48\nBRAVO\n19 COAHUAYUTLA DE J. MA. 1,679,475.94 1,557,998.86 77,864.29 12,817.73 23,719.95 7,075.11\nIZAZAGA\n20 COCHOAPA EL GRANDE 1,488,433.14 1,380,774.24 66,007.12 11,359.70 21,021.77 6,270.31\n21 COCULA 1,786,017.46 1,656,834.19 82,803.80 13,630.85 25,224.68 7,523.94\n22 COPALA 1,478,025.76 1,371,119.64 68,524.60 11,280.26 20,874.79 6,226.47\n23 COPALILLO 1,430,305.50 1,326,851.02 66,312.19 10,916.06 20,200.88 6,025.43\n24 COPANATOYAC 1,796,074.85 1,666,164.12 83,270.08 13,707.62 25,366.72 7,566.31\n25 COYUCA DE BENITEZ 7,855,483.56 7,287,293.68 364,197.92 59,952.93 110,946.31 33,092.72\n26 COYUCA DE CATALAN 5,123,727.69 4,753,126.66 237,547.57 39,104.21 72,364.57 21,584.68\n27 CUAJINICUILAPA 2,826,099.86 2,621,687.07 131,024.36 21,566.75 39,914.20 11,905.48\n28 CUALAC 743,640.72 689,852.93 34,476.86 5,675.45 10,502.75 3,132.73\n29 CUAUTEPEC 1,727,543.03 1,602,589.22 80,092.79 13,184.59 24,398.82 7,277.61\n30 CUETZALA DEL 1,123,565.91 1,042,297.98 52,091.05 8,575.04 15,866.60 4,733.24\nPROGRESO\n31 CUTZAMALA DE PINZON 2,940,189.79 2,727,524.81 136,313.83 22,439.49 41,525.55 12,386.11\n32 EDUARDO NERI 4,564,524.01 4,234,370.39 211,621.63 34,836.37 64,466.70 19,228.92\n33 FLORENCIO VILLARREAL 2,173,135.07 2,015,951.45 100,751.44 16,585.33 30,692.10 9,154.75\n34 GENERAL CANUTO A. 862,859.12 800,448.21 40,004.10 6,585.33 12,186.52 3,634.96\nNERI\n35 GENERAL HELIODORO 3,985,998.94 3,697,690.23 184,799.90 30,421.08 56,295.95 16,791.78\nCASTILLO\n36 HUAMUXTITLAN 1,630,139.68 1,512,231.10 75,576.95 12,441.20 23,023.16 6,867.27\n37 HUITZUCO DE LOS 4,059,546.01 3,765,917.61 188,209.71 30,982.39 57,334.68 17,101.62\nFIGUEROA\n38 IGUALA DE LA 14,089,303.45 13,070,219.15 653,211.89 107,529.34 198,989.19 59,353.88\nINDEPENDENCIA\n39 IGUALAPA 1,163,310.16 1,079,167.51 53,933.69 8,878.37 16,429.92 4,900.57\n40 ILIATENCO 1,455,880.69 1,350,576.28 67,497.91 11,111.29 20,562.02 6,133.19\nDE FOMENTO MUNICIPAL, DEL FONDO GENERAL, DE\nCOORDINACIÓN EN DERECHOS DEL FONDO\nGENERAL, DEL IMPUESTO SOBRE AUTOMÓVILES\nNUEVOS, DEL IMPUESTO SOBRE TENENCIA O USO DE\nVEHÍCULOS AUTOMOTORES Y DEL IMPUESTO\nESPECIAL SOBRE PRODUCCIÓN Y SERVICIOS EN EL\nTERCER TRIMESTRE DEL EJERCICIO FISCAL 2006.\n41 IXCATEOPAN DE 810,444.98 751,825.21 37,574.06 6,185.31 11,446.25 3,414.15\nCUAUHTEMOC\n42 JOSE AZUETA 10,832,359.96 10,048,851.56 502,212.63 83,672.40 152,989.99 45,633.38\n43 JOSE JOAQUIN DE 1,656,185.72 1,536,393.24 76,784.50 12,639.98 23,391.00 6,977.00\nHERRERA\n44 JUAN R. ESCUDERO 2,622,157.47 2,432,495.89 121,569.13 20,012.27 37,033.84 11,046.38\n45 JUCHITAN 752,660.34 698,220.15 34,895.03 5,744.30 10,630.14 3,170.72\n46 LEONARDO BRAVO 2,609,129.90 2,420,410.61 120,965.14 19,912.85 36,849.84 10,991.46\n47 MALINALTEPEC 2,667,614.81 2,474,665.30 123,676.64 20,359.19 37,675.85 11,237.83\n48 MARTIR DE CUILAPAN 1,574,187.16 1,460,325.66 72,982.87 12,014.17 22,232.90 6,631.56\n49 MARQUELIA 1,255,347.21 1,164,547.50 58,200.73 9,580.79 17,729.80 5,288.39\n50 METLATONOC 1,934,595.11 1,794,665.17 89,692.19 14,764.80 27,323.10 8,149.85\n51 MOCHITLAN 1,153,376.19 1,069,952.08 53,473.12 8,802.55 16,289.63 4,856.81\n52 OLINALA 2,552,729.85 2,368,090.00 118,350.32 19,482.40 36,053.28 10,753.85\n53 OMETEPEC 5,713,666,41 5,300,394.91 264,898.46 43,606.61 80,696.52 24,069.91\n54 PEDRO ASCENCIO 885,816.82 821,745.37 41,068.47 6,760.55 12,510.77 3,731.66\nALQUISIRAS\n55 PETATLAN 5,176,267.00 4,801,865.77 239,983.41 39,505.19 73,106.61 21,806.02\n56 PILCAYA 1,232,169.59 1,143,046.32 57,126.16 9,403.90 17,402.46 5,190.75\n57 PUNGARABATO 3,963,356.61 3,676,685.62 183,750.15 30,248.28 55,976.17 16,696.39\n58 QUECHULTENANGO 3,708,730.77 3,440,476.96 171,945.12 28,304.97 52,379.98 15,623.74\n59 SAN LUIS ACATLAN 4,044,816.72 3,752,253.70 187,526.83 30,869.98 57,126.65 17,039.56\n60 SAN MARCOS 5,435,012.30 5,041,895.94 251,979.43 41,479.93 76,760.98 22,896.02\n61 SAN MIGUEL 3,242,476.05 3,007,946.61 150,328.50 24,746.53 45,794.86 13,659.55\nTOTOLAPAN\n62 TAXCO DE ALARCON 11,431,183.05 10,604,361.56 529,975.42 87,242.61 161,447.42 48,156.04\n63 TECOANAPA 4,921,247.80 4,565,292.23 228,160.15 37,558.88 69,504.85 20,731.69\n64 TECPAN DE GALEANA 6,750,451.01 6,262,188.52 312,966.13 51,519.33 95,339.47 28,437.56\n65 TELOLOAPAN 6,136,190.30 5,692,357.50 284,487.62 46,831.31 86,664.00 25,849.87\n66 TEPECOACUILCO DE 3,505,344.99 3,251,802.15 162,515.69 26,752.74 49,507.47 14,766.94\nTRUJANO\n67 TETIPAC 1,515,598.03 1,405,974.31 70,266.54 11,567.01 21,405.43 6,384.74\n68 TIXTLA DE GUERRERO 3,831,378.44 3,554,253.49 177,631.34 29,241.02 54,112.18 16,140.41\n69 TLACOACHISTLAHUACA 1,780,539.64 1,651,752.60 82,549.83 13,589.04 25,147.31 7,500.86\n70 TLACOAPA 1,049,002.42 973,127.71 48,634.12 8,005.97 14,815.50 4,419.12\n71 TLALCHAPA 1,474,713.97 1,368,047.39 68,371.06 11,255.00 20,828.01 6,212.51\n72 TLALIXTAQUILLA DE 761,110.46 706,059.08 35,286.80 5,808.78 10,749.48 3,206.32\nMALDONADO\n73 TLAPA DE COMONFORT 6,547,109.54 6,073,554.90 303,558.77 49,967.43 92,467.69 27,580.95\n74 TLAPEHUALA 2,489,234.93 2,309,187.68 115,406.55 18,997.80 35,156.52 10,486.38\n75 UNION DE I. MONTES DE 3,111,367.43 2,886,321.13 144,250.01 23,745.91 43,943.16 13,107.22\nOCA, LA\n76 XALPATLAHUAC 1,334,610.87 1,238,078.01 61,875.56 10,185.73 18,849.27 5,622.30\n77 XOCHISTLAHUACA 2,589,505.64 2,402,205.80 120,055.31 19,763.08 36,572.68 10,908.78\n78 XOCHIHUEHUETLAN 893,803.98 829,154.83 41,438.77 6,821.50 12,623.56 3,765.32\n79 ZAPOTITLAN TABLAS 1,171,879.82 1,087,117.34 54,331.00 8,943.77 16,550.95 4,936.76\n80 ZIRANDARO 2,537,196.05 2,353,679.77 117,630.13 19,663.84 35,833.89 10,688.42\n81 ZITLALA 1,982,552.76 1,839.154.01 91,915.62 15,130.81 28,000.44 8,351.88\n*) Incluye la cantidad de $544,892.40, correspondiente al 20%, de la cantidad de $2,724,462.00 que por compensación del Impuesto\nARTÍCULO ÚNICO.- Publíquese el presente Acuerdo en el Periódico Oficial del\nDE FOMENTO MUNICIPAL, DEL FONDO GENERAL, DE\nCOORDINACIÓN EN DERECHOS DEL FONDO\nGENERAL, DEL IMPUESTO SOBRE AUTOMÓVILES\nNUEVOS, DEL IMPUESTO SOBRE TENENCIA O USO DE\nVEHÍCULOS AUTOMOTORES Y DEL IMPUESTO\nESPECIAL SOBRE PRODUCCIÓN Y SERVICIOS EN EL\nTERCER TRIMESTRE DEL EJERCICIO FISCAL 2006.\nDado en la Residencia Oficial del Poder Ejecutivo del Estado, a los tres días del mes de octubre del año dos mil seis.\nEL GOBERNADOR CONSTITUCIONAL DEL ESTADO.\nC. P. CARLOS ZEFERINO TORREBLANCA GALINDO.\nEL SECRETARIO GENERAL DE GOBIERNO.\nLIC. ARMANDO CHAVARRÍA BARRERA\nEL SECRETARIO DE FINANZAS Y ADMINISTRACIÓN.\nC. P. CARLOS ÁLVAREZ REYES.",
  "ordenamiento": "ACUERDO",
  "jurisdiccion": "GUERRERO",
  "fuente_oficial": "DIARIO OFICIAL DE LA FEDERACION",
  "Fecha de Publicación": "30 DE SEPTIEMBRE DE \n2006",
  "ULTIMA REFORMA PUBLICADA": "7 de Noviembre de 2006",
  "status": "ABROGADA",
  "es_escaneado": false,
  "tiene_tablas": true,
  "materia": [
    "municipal"
  ]
}