{
  "titulo": "Acuerdo Parlamentario por el Que Se Exhorta al Ejecutivo Federal, A Través de Sus Delegaciones en el",
  "Contenido": "QUE INTEGRAN EL ESTADO DE GUERRERO, PARA QUE EN SU\nPROGRAMA \"HECHO EN GUERRERO\", ASIMISMO, CONSUMAN\nPOR LAS MICRO, PEQUEÑAS Y MEDIANAS EMPRESAS DE LA\nENTIDAD\nTEXTO ORIGINAL\nAcuerdo Parlamentario publicado en el Periódico Oficial del Gobierno del Estado No. 07, el\nMartes 22 de Enero de 2013.\nPODER LEGISLATIVO\nACUERDO PARLAMENTARIO POR EL QUE SE EXHORTA AL EJECUTIVO FEDERAL, A TRAVÉS\nDE SUS DELEGACIONES EN EL ESTADO, AL EJECUTIVO ESTATAL Y A LOS 81 MUNICIPIOS QUE\nINTEGRAN EL ESTADO DE GUERRERO, PARA QUE EN SU RESPECTIVA COMPETENCIA HAGAN\nSUYO Y PROMOCIONEN EL PROGRAMA \"HECHO EN GUERRERO\", ASIMISMO, CONSUMAN LOS\nPRODUCTOS Y SERVICIOS ELABORADOS Y OFERTADOS POR LAS MICRO, PEQUEÑAS Y\nMEDIANAS EMPRESAS DE LA ENTIDAD.\nGuerrero.- Poder Legislativo.\nLA SEXAGÉSIMA LEGISLATURA AL HONORABLE CONGRESO DEL ESTADO LIBRE Y\nSOBERANO DE GUERRERO, EN NOMBRE DEL PUEBLO QUE REPRESENTA,Y:\nQue en sesión de fecha 11 de diciembre del 2012, los Ciudadanos Diputados integrantes de la\nComisión de Desarrollo Económico y Trabajo, presentaron el dictamen con proyecto de Acuerdo\nParlamentario por el que la Sexagésima Legislatura del Honorable Congreso del Estado de Guerrero, por el que se exhorta al Ejecutivo Federal, a través de sus delegaciones en el estado, al ejecutivo estatal y a los 81 municipios que integran el estado de guerrero, para que en su respectiva competencia hagan suyo y promocionen el Programa \"Hecho en Guerrero\", asimismo, consuman los productos y servicios elaborados y ofertados por las micro, pequeñas y medianas empresas de la entidad, en los siguientes términos:\n\"ANTECEDENTES l.- Haciendo uso de las facultades constitucionales que se contemplan en los artículos 50\nQUE INTEGRAN EL ESTADO DE GUERRERO, PARA QUE EN SU\nPROGRAMA \"HECHO EN GUERRERO\", ASIMISMO, CONSUMAN\nPOR LAS MICRO, PEQUEÑAS Y MEDIANAS EMPRESAS DE LA\nENTIDAD\nFederal, a través de sus delegaciones en el Estado, al Ejecutivo Estatal y a los 81 municipios que integran al Estado de Guerrero para que en su respectiva competencia hagan suyo y promocionen el\nPrograma \"Hecho en Guerrero\", asimismo, consuman los productos y servicios elaborados y ofertados por las micro, pequeñas y medianas empresas de la entidad.\nII.- Con fecha jueves 29 de noviembre de 2012, mediante Oficio No.\nLX/1ER/OM/DPL/0435/2012, signado por el Licenciado Benjamín Gallegos Segura, Oficial Mayor del\nCongreso del Estado, por instrucciones de la Mesa Directiva y del Pleno del Congreso, se turnó el\nAcuerdo Parlamentario en comento a la Comisión de Desarrollo Económico y Trabajo para su análisis y\nDictamen correspondiente, el cual se emite bajo las siguientes:\nCONSIDERACIONES\nLa Propuesta de Acuerdo Parlamentario turnada a esta Comisión en funciones de dictaminadora, contiene una argumentación sólida, convincente y pertinente, debido a que en su exposición de motivos tiene a bien señalar el complejo estado que guarda la economía en la entidad, el preocupante lugar que en cuanto a competitividad ocupa el Estado de Guerrero a nivel nacional y la endeble integración sistémica de las micro, pequeñas y medianas empresas.\nLa exposición de motivos describe las circunstancias que dificultan la instauración de un sistema económico competitivo a nivel local, nacional e internacional; sostienen además los promoventes que, el actual modelo económico ya no es viable y que de no modificarse, no garantizará una mejor calidad de vida para ésta y las futuras generaciones.\nLa Propuesta de Acuerdo Parlamentario señala la urgencia de diseñar e implementar estrategias que permitan el impulso y el fortalecimiento de las actividades económicas y el mercado interno. En concreto, las estrategias que se manifiestan en el Acuerdo emitido por los promoventes son las siguientes:\n\"Se deben defender e impulsar los productos hechos en Guerrero\".\n\"El desarrollo económico no puede ser una estrategia aislada, requiere de la participación integral del pueblo guerrerense\". productos y servicios de la entidad, no sólo porque son de aquí, sino también porque son de calidad.\nManifiesta además que: \"se debe tener claro que consumir lo hecho en Guerrero nos conviene a todos,\nQUE INTEGRAN EL ESTADO DE GUERRERO, PARA QUE EN SU\nPROGRAMA \"HECHO EN GUERRERO\", ASIMISMO, CONSUMAN\nPOR LAS MICRO, PEQUEÑAS Y MEDIANAS EMPRESAS DE LA\nENTIDAD\nEn opinión de esta Comisión dictaminadora, la propuesta de Acuerdo es procedente porque se ajusta a las demandas sociales y económicas de la entidad. Además de que, al analizar la situación de la micro, pequeña y mediana empresa en el Estado de Guerrero, detectamos que La Secretaría de\nDesarrollo Económico tiene registradas más de un centenar de pequeñas y medianas empresas que elaboran y ofertan productos y servicios de diversa índole, los cuales con el apoyo necesario por parte de las autoridades competentes podrían satisfacer las necesidades del pueblo guerrerense. (La expectativa de cobertura sería de un 90% de la población).\nEsta Comisión dictaminadora ha detectado también que las empresas pequeñas son las que menos recursos tienen para promocionar sus productos, pero son las que más empleo generan.\n\"Hecho en Guerrero\" debe ser una oportunidad de venta para los productores estatales. De ahí, que dentro de los objetivos que se persiguen con la estrategia propuesta están los siguientes:\n• Buscar la rentabilidad de las micro, pequeñas y medianas empresas de la entidad.\n• Impulsar la economía estatal a través del fortalecimiento del mercado interno, que incluya no solamente a las principales ciudades, sino también a las medianas en las siete regiones en las que se divide la entidad.\n• Generar conciencia en la sociedad de la gran oportunidad que es conocer y consumir lo hecho en el estado; de la importancia de su participación para el fortalecimiento de la economía en la entidad.\n• Desarrollar empresas competitivas que aumenten el ingreso familiar y generen fuentes de trabajo.\n• Impulsar el desarrollo comercial de las empresas guerrerenses mediante la vinculación de los productos hechos en el estado con los distintos canales de comercialización.\n• Impulsar la promoción comercial de las micro, pequeñas y medianas empresas (MIPyMES) del estado de Guerrero en foros de negocios que les permitan posicionar, desarrollar y consolidar sus marcas en el ámbito de un mercado de alta competencia.\nEl objetivo es claro: generar un entorno en el que la economía interna se fortalezca y sea el principal generador de crecimiento en el mediano y largo plazo. internacional, pero debemos iniciar por la casa, debemos de impulsar lo que se produce en la entidad.\nImpulsar el programa \"Hecho en Guerrero\", es inducir a que cada día se generen más empleos, nuevas empresas que permitan potencializar la economía del estado.\nCon este programa no sólo se espera incrementar el empleo y el mercado interno, sino las unidades económicas formales\".\nQUE INTEGRAN EL ESTADO DE GUERRERO, PARA QUE EN SU\nPROGRAMA \"HECHO EN GUERRERO\", ASIMISMO, CONSUMAN\nPOR LAS MICRO, PEQUEÑAS Y MEDIANAS EMPRESAS DE LA\nENTIDAD\nQue vertido lo anterior, en sesiones de fecha 11 y 18 de diciembre del año en curso, el Dictamen con proyecto de Acuerdo recibió primera lectura y dispensa de la segunda lectura, respectivamente, y que en sesión de esta última fecha la Sexagésima Legislatura al Honorable Congreso del Estado, aprobó por unanimidad de votos, en todos y cada uno de sus términos, el Dictamen con proyecto de Acuerdo presentado por la Comisión de Desarrollo Económico y Trabajo.\nPor lo anteriormente expuesto y con fundamento en lo dispuesto por los artículos 47 fracción I de\nLey Orgánica del Poder Legislativo número 286, este Honorable Congreso del Estado de Guerrero, expide el siguiente:\nACUERDO PARLAMENTARIO POR EL QUE SE EXHORTA AL EJECUTIVO FEDERAL, A TRAVÉS\nDE SUS DELEGACIONES EN EL ESTADO, AL EJECUTIVO ESTATAL Y A LOS 81 MUNICIPIOS QUE\nINTEGRAN EL ESTADO DE GUERRERO, PARA QUE EN SU RESPECTIVA COMPETENCIA HAGAN\nSUYO Y PROMOCIONEN EL PROGRAMA \"HECHO EN GUERRERO\", ASIMISMO, CONSUMAN LOS\nPRODUCTOS Y SERVICIOS ELABORADOS Y OFERTADOS POR LAS MICRO, PEQUEÑAS Y\nMEDIANAS EMPRESAS DE LA ENTIDAD.\nPRIMERO.- La Sexagésima Legislatura del Honorable Congreso del Estado de Guerrero hace un atento exhorto al Ejecutivo Federal, a través de sus Delegaciones en el Estado, para que en su respectiva competencia haga suyo y promocione el Programa \"Hecho en Guerrero\" y, asimismo, consuman los productos elaborados por las micro, pequeñas y medianas empresas de la entidad.\nSEGUNDO.- De la misma atenta manera, se hace un exhorto al Gobierno del Estado, para que a través de la Secretaría de Desarrollo Económico, actúe dentro de sus ámbitos de competencia para desarrollar e impulsar el Programa \"Hecho en Guerrero\" y que las diferentes dependencias y entidades de la entidad.\nTERCERO.- El mismo atento exhorto se hace a los 81 Honorables Ayuntamientos de la entidad, del Programa \"Hecho en Guerrero\" anteriormente señalados. permanente campaña de difusión y promoción del Programa \"Hecho en Guerrero\" y de los productos y servicios guerrerenses en todo el estado y las entidades circunvecinas, a través de las Secretarías de\nDesarrollo Económico, de Desarrollo Rural, de Fomento Turístico, y del Organismo Público\nQUE INTEGRAN EL ESTADO DE GUERRERO, PARA QUE EN SU\nPROGRAMA \"HECHO EN GUERRERO\", ASIMISMO, CONSUMAN\nPOR LAS MICRO, PEQUEÑAS Y MEDIANAS EMPRESAS DE LA\nENTIDAD\nDescentralizado Radio y Televisión de Guerrero (RTG), con la activa participación de las cámaras industriales, de comercio y de servicios, y de los diversos medios de comunicación de la entidad.\nQUINTO.- Esta Sexagésima Legislatura del Honorable Congreso del Estado de Guerrero hace también un atento exhorto al Titular del Poder Ejecutivo del estado, para que instruya a las Secretarías de\nDesarrollo Económico y de Desarrollo Rural, a fin de que impulsen la promoción y venta de los productos guerrerenses en las tiendas de autoservicio y supermercados de la entidad.\nARTÍCULO PRIMERO.- El presente Acuerdo surtirá sus efectos a partir de la fecha de su aprobación.\nARTICULO SEGUNDO.- Comuníquese el presente Acuerdo Parlamentario al Titular del Poder\nEjecutivo Federal, para su conocimiento y efectos procedentes.\nARTÍCULO TERCERO.- Comuníquese el presente Acuerdo Parlamentario al Titular del Poder\nEjecutivo Estatal, para su conocimiento y efectos procedentes.\nARTÍCULO CUARTO.- Comuníquese el presente Acuerdo Parlamentario a cada uno de los\nHonorables Ayuntamientos de la entidad, para su conocimiento y efectos procedentes.\nARTÍCULO QUINTO.- Comuníquese el presente Acuerdo Parlamentario a la Secretaría de\nDesarrollo Económico, a la Secretaría de Desarrollo Rural, a la Secretaría de Fomento Turístico, al\nOrganismo Público Descentralizado Radio y Televisión de Guerrero y a las diversas cámaras empresariales en el estado.\nARTÍCULO SEXTO.- Publíquese el presente Acuerdo Parlamentario en el Periódico Oficial del de comunicación. diciembre del año dos mil doce.\nDIPUTADO PRESIDENTE.\nANTONIO GASPAR BELTRÁN.\nQUE INTEGRAN EL ESTADO DE GUERRERO, PARA QUE EN SU\nPROGRAMA \"HECHO EN GUERRERO\", ASIMISMO, CONSUMAN\nPOR LAS MICRO, PEQUEÑAS Y MEDIANAS EMPRESAS DE LA\nENTIDAD\nDIPUTADA SECRETARIA.\nLAURA ARIZMENDI CAMPOS.\nDIPUTADA SECRETARIA.\nDELFINA CONCEPCIÓN OLIVA HERNÁNDEZ\nRúbrica",
  "ordenamiento": "ACUERDO",
  "jurisdiccion": "GUERRERO",
  "fuente_oficial": "DIARIO OFICIAL DE LA FEDERACION",
  "Fecha de Publicación": "22 de Enero de 2013",
  "ULTIMA REFORMA PUBLICADA": null,
  "status": "VIGENTE",
  "es_escaneado": false,
  "tiene_tablas": false,
  "materia": [
    "parlamentario"
  ]
}