{
  "titulo": "Acuerdo por el Que Se Da A Conocer la Distribución de los Recursos del Fondo para la Infraestructura",
  "Contenido": "DE LAS DEMARCACIONES DEL DISTRITO FEDERAL\nENTRE LOS MUNICIPIOS DEL ESTADO DE\nGUERRERO PARA EL EJERCICIO FISCAL DEL 2014\nTEXTO ORIGINAL\n24 de Enero de 2014.\nACUERDO POR EL QUE SE DA A CONOCER LA DISTRIBUCIÓN DE LOS RECURSOS DEL FONDO\nPARA LA INFRAESTRUCTURA SOCIAL MUNICIPAL Y DE LAS DEMARCACIONES DEL DISTRITO\nFEDERAL ENTRE LOS MUNICIPIOS DEL ESTADO DE GUERRERO PARA EL EJERCICIO FISCAL\nDEL 2014.\nGuerrero.- Poder Ejecutivo.\nÁNGEL HELADIO AGUIRRE RIVERO, GOBERNADOR CONSTITUCIONAL DEL ESTADO\nIV, 23, 25, 26, 43 FRACCIÓN I, 44 Y 45 DE LA LEY NÚMERO 427 DEL SISTEMA DE COORDINACIÓN\nHACENDARIA DEL ESTADO DE GUERRERO; 1o., 3o., 4o., 8o., 18 FRACCIÓN II y III, 21 y 22 DE LA\nLEY ORGÁNICA DE LA ADMINISTRACIÓN PÚBLICA DEL ESTADO NÚMERO 433; Y DE ACUERDO A\nLOS ARTÍCULOS 26 Y 115 DE LA CONSTITUCIÓN POLÍTICA DE LOS ESTADOS UNIDOS\nMEXICANOS; 27, 31 Y 32 DE LA LEY ORGÁNICA DE LA ADMINISTRACIÓN PÚBLICA FEDERAL; 33,\n34, 35 Y 44 DE LA LEY DE PLANEACIÓN; 25, 32, 33, 34 Y 35 DE LA LEY DE COORDINACIÓN\nFISCAL, 9 DEL DECRETO DEL PRESUPUESTO DE EGRESOS DE LA FEDERACIÓN PARA EL\nEJERCICIO FISCAL DEL 2014; Y\nQue el Presupuesto de Egresos de la Federación para el Ejercicio Fiscal de 2014, prevé recursos en el Ramo 33 Aportaciones Federales para Entidades Federativas y Municipios, para el Fondo para la Infraestructura Social Municipal. establecida en el artículo 34 de dicha Ley.\nQue la misma Ley de Coordinación Fiscal establece que los Estados deben publicar antes del 31 de enero de cada ejerció fiscal, previo convenio con la Secretaría de Desarrollo Social, la distribución municipal del Fondo para la Infraestructura Social Municipal, así como la fórmula y metodología aplicada, justificando cada uno de sus elementos. Que la fórmula debe ser igual a la indicada en la mencionada\nLey, con el propósito de enfatizar el carácter redistributivo de estos recursos hacia aquellos Municipios con mayor magnitud y profundidad de pobreza extrema.\nDE LAS DEMARCACIONES DEL DISTRITO FEDERAL\nENTRE LOS MUNICIPIOS DEL ESTADO DE\nGUERRERO PARA EL EJERCICIO FISCAL DEL 2014\nPor lo anteriormente expuesto y fundado, he tenido a bien expedir el siguiente:\nPARA LA INFRAESTRUCTURA SOCIAL MUNICIPAL Y DE LAS DEMARCACIONES DEL DISTRITO\nFEDERAL ENTRE LOS MUNICIPIOS DEL ESTADO DE GUERRERO PARA EL EJERCICIO FISCAL\nDEL 2014.\nARTÍCULO PRIMERO.- El presente Acuerdo tiene por objeto dar a conocer la fórmula y la metodología para la distribución entre los Municipios de las aportaciones federales previstas en el Fondo para la Infraestructura Social Municipal para el Ejercicio Fiscal del 2014, así como las asignaciones presupuestales resultantes de la aplicación de dicha metodología, de conformidad con lo establecido en los artículos 34 y 35 de la Ley de Coordinación Fiscal.\nARTÍCULO SEGUNDO.- Referente a la Publicación de la Secretaría de Hacienda y Crédito\nPúblico realizada en el Diario Oficial de la Federación el día martes 24 de diciembre del 2013, en la que se pública el acuerdo para dar a conocer a las entidades federativas los montos correspondientes al\nRamo General 33. El monto de los recursos asignados para el Estado de Guerrero del Fondo para la\nInfraestructura Social Municipal es por $4,409,534,530.00 (Cuatro mil cuatrocientos nueve millones quinientos treinta y cuatro mil quinientos treinta pesos 00/100 M. N.).\nARTÍCULO TERCERO.- Las aportaciones de este Fondo sólo podrán ser utilizadas en las obras y acciones sociales básicas y en inversiones, que beneficien directamente a sectores de la población que se encuentren en condiciones de rezago social y de pobreza extrema en los siguientes rubros: agua potable, alcantarillado, drenaje y letrinas, urbanización, electrificación rural y de colonias pobres, infraestructura básica del sector salud y educativo, mejoramiento de vivienda, así como mantenimiento de infraestructura, señaladas en el apartado A, fracción I, del artículo 33, Capítulo V de la Ley de interior de los Comités para la Planeación del Desarrollo Municipal.\nARTÍCULO CUARTO.- Para efectos de la aplicación de la fórmula del artículo 34 de la Ley de\nCoordinación Fiscal, se utiliza como fuente de información el Presupuesto de Egresos de la Federación y\nEvaluación de la Política de Desarrollo Social (CONEVAL).\nARTÍCULO QUINTO.- La fórmula para el cálculo del Fondo para la Infraestructura Social\nMunicipal y de las Demarcaciones Territoriales se describe como:\nDE LAS DEMARCACIONES DEL DISTRITO FEDERAL\nENTRE LOS MUNICIPIOS DEL ESTADO DE\nGUERRERO PARA EL EJERCICIO FISCAL DEL 2014\nY las variables de cálculo se definen de la siguiente manera:\nFi,t= Monto del FISMDF del municipio i en el año t.\nFi,2013= Monto del Fondo para la Infraestructura Social Municipal (FISM) del municipio o demarcación territorial i en 2013.\nAF2013,i,t= FISMDFi,t - FISM i2013, donde FISMDFi,t corresponde a los recursos del FISMDF en el año de cálculo t para la entidad i. FISM i,2013 corresponde a los recursos del FISM recibidos por la entidad i en\n2013. zi,t= La participación del municipio o demarcación territorial i en el promedio estatal de las carencias de la población en pobreza extrema más reciente publicada por el Consejo Nacional de Evaluación de la\nPolítica de Desarrollo Social al año t. ei,t = La participación del municipio o demarcación territorial i en la bolsa de recursos asignados por su eficacia en el abatimiento de la pobreza extrema.\nCPPEi= Número de carencias promedio de la población en pobreza extrema en el municipio o\nDesarrollo Social al año t.\nPPEi,T= Población en Pobreza Extrema del municipio o demarcación territorial i, de acuerdo con la\nSocial; y\nDE LAS DEMARCACIONES DEL DISTRITO FEDERAL\nENTRE LOS MUNICIPIOS DEL ESTADO DE\nGUERRERO PARA EL EJERCICIO FISCAL DEL 2014\nPPEi,T-1= Población en Pobreza Extrema del municipio o demarcación territorial i, de acuerdo con la\nPolítica de Desarrollo Social;\nARTÍCULO SEXTO.- Excepción para el caso de ei,t\nConsiderando que sólo existe un corte de medición de la pobreza multidimensional a nivel municipal dado a conocer por el Coneval, la participación ei,t se considerará cero para todos los municipios o demarcaciones territoriales, por lo que el coeficiente zi,t será igual a uno y la fórmula de distribución se definirá de la siguiente manera:\nLo anterior se fundamenta en el Décimo Primer transitorio de la Reforma a la Ley de\nCoordinación Fiscal publicada el 9 de diciembre de 2013.\nARTÍCULO SÉPTIMO.- Fuentes de Información\nComponente Fi;2013\nNombre\nLínea Basal\nDescripción\nSe refiere al monto que los municipios o demarcaciones territoriales recibieron por concepto de FISM en el año\n2013.\nFuente de Información\nPeriódico Oficial del Gobierno del Estado de Guerrero, número 09 Alcance II, de fecha 29 de Enero de 2013.\nDirección General del Periódico Oficial. http://periodicooficial.guerrero.gob.mx/\nComponente Zi,t\nNombre\nPobreza\nDescripción\nSe refiere a la participación de los 81 municipios del Estado en pobreza extrema a nivel estatal, ponderada por las carencias promedio de las personas en pobreza extrema a nivel estatal, ponderada por las carencias promedio de las personas en pobreza extrema del municipio respectivo.\nFuente de Información\nConsejo Nacional de Evaluación de la Política de Desarrollo Social (Coneval)\nSitio Electrónico\nDE LAS DEMARCACIONES DEL DISTRITO FEDERAL\nENTRE LOS MUNICIPIOS DEL ESTADO DE\nGUERRERO PARA EL EJERCICIO FISCAL DEL 2014\nIndicaciones\nEn el sitio electrónico al que direcciona la liga anterior, dar clic en el cuadro de dialogo \"Información concentrada en Excel\" y descargar el archivo \"Concentrado.zip\". El archivo contiene dos documentos: \"3.3 Concentrado, indicadores de pobreza por municipio.xlsx\" y \"3.4 Concentrado, indicadores de pobreza por entidad federativa.xlsx\". Abrir el primero. Para construir el indicador utilice los valores para \"pobreza extrema\", columna \"Personas\" y \"Carencias\" para el Estado de Guerrero.\nComponente e i;t\nNombre\nEficacia\nNota\nPara el ejercicio fiscal 2014 no existe información para medir el componente de eficacia, toda vez que hasta la fecha sólo existe una medición multidimensional de la pobreza a nivel municipal (2010) y se requieren por lo menos dos mediciones para hacer comparaciones. Por tanto, la fórmula que se aplicará para el cálculo de la distribución de recursos a nivel municipal será la siguiente\nComponente AF2013,t\nNombre\nIncremento FAIS\nDescripción\nEs el diferencial del Monto Total asignado al FISM en el año actual, respecto del monto total asignado al FISM en 2013.\nFuente de Información\nPara el Monto FISM 2013, consultar el Presupuesto de Egresos de la Federación 2013.}\nPara el Monto 2014, consultar el Presupuesto de Egresos de la Federación para el Ejercicio Fiscal 2014.\nSitio Electrónico\n• Para el caso del Monto FISM 2013: http://www.apartados.hacienda.gob.mx/presupuesto/temas/pef/2013/temas/tomo\nComponente e i,t s/33/r33 rsfef.pdf\n• Para el caso del Monto FISMDF 2014\nIndicaciones\n• Para el caso del Monto FISM 2013, tomar del archivo descargado del sitio electrónico mencionado el monto correspondiente al FAIS Municipal del Estado de Guerrero.\n• Para el caso del Monto FISMDF 2014, tomar el monto FAIS Municipal y de las Demarcaciones Territoriales del Distrito\nFederal correspondiente al Estado de Guerrero.\nDE LAS DEMARCACIONES DEL DISTRITO FEDERAL\nENTRE LOS MUNICIPIOS DEL ESTADO DE\nGUERRERO PARA EL EJERCICIO FISCAL DEL 2014\nARTÍCULO OCTAVO.- Cálculo de la Distribución del Fondo para la Infraestructura Social\nGuerrero.\nPaso 1. Cálculo del Componente\nAcapulco de Juárez 107,048 4.0 0.09997068 0.40120052 0.09856252\nAhuacuotzingo 14,003 4.1 0.01307721 0.05422343 0.01332101\nAjuchitlán del\n19,364 4.3 0.01808378 0.07793197 0.01914547\nProgreso\nAlcozauca de\n12,677 4.1 0.01183888 0.04832047 0.01187084\nGuerrero\nAlpoyeca 2,203 3.7 0.00205735 0.00766038 0.00188192\nApaxtla 5,132 4.3 0.00479271 0.0206837 0.00508134\nArcelia 6,397 3.9 0.00597407 0.02309874 0.00567464\nAtenango del\n2,955 4.1 0.00275963 0.01123124 0.00275917\nAtlamajalcingo del\n3,012 4.4 0.00281287 0.01250464 0.003072\nMonte\nAtlixtac 16,101 4.2 0.01503651 0.06311277 0.01550485\nAtoyac de Álvarez 20,376 3.9 0.01902887 0.07412439 0.01821006\nAyutla de los Libres 35,713 4.0 0.03335189 0.13420439 0.03296986\nAzoyú 5,421 4.2 0.0050626 0.02113199 0.00519147\nBenito Juárez 3,957 3.9 0.00369539 0.01426057 0.00350338\nBuenavista de Cuellar 2,515 3.8 0.00234872 0.00901416 0.0022145\nCoahuayutla de José\n9,355 4.1 0.00873651 0.03603508 0.0088527\nMaría Izazaga\nCocula 4,369 4.1 0.00408015 0.01662116 0.0040833\nCopala 5,588 3.9 0.00521856 0.02023092 0.00497011\nCopalillo 9,069 4.2 0.00846942 0.03539872 0.00869637\nCopanatoyac 11,129 4.2 0.01039322 0.04411144 0.01083681\nDE LAS DEMARCACIONES DEL DISTRITO FEDERAL\nENTRE LOS MUNICIPIOS DEL ESTADO DE\nGUERRERO PARA EL EJERCICIO FISCAL DEL 2014\n{\"tabla_1\":{\"columnas\":[\"Coyuca de Benítez\",\"25,286\",\"4.0\",\"0.02361425\",\"0.09390212\",\"0.02306884\"],\"filas\":[{\"columna_1\":\"Coyuca de Catalán\",\"columna_2\":\"15,428\",\"columna_3\":\"4.2\",\"columna_4\":\"0.014408\",\"columna_5\":\"0.060093\",\"columna_6\":\"0.01476299\"},{\"columna_1\":\"Cuajinicuilapa\",\"columna_2\":\"11,593\",\"columna_3\":\"3.9\",\"columna_4\":\"0.01082655\",\"columna_5\":\"0.04208899\",\"columna_6\":\"0.01033996\"},{\"columna_1\":\"Cualác\",\"columna_2\":\"3,497\",\"columna_3\":\"4.1\",\"columna_4\":\"0.0032658\",\"columna_5\":\"0.01336315\",\"columna_6\":\"0.00328291\"},{\"columna_1\":\"Cuautepec\",\"columna_2\":\"8,180\",\"columna_3\":\"4.1\",\"columna_4\":\"0.00763919\",\"columna_5\":\"0.03143481\",\"columna_6\":\"0.00772256\"},{\"columna_1\":\"Cuetzala del\",\"columna_2\":\"(sin dato)\",\"columna_3\":\"(sin dato)\",\"columna_4\":\"(sin dato)\",\"columna_5\":\"(sin dato)\",\"columna_6\":\"(sin dato)\"},{\"columna_1\":\"(sin dato)\",\"columna_2\":\"3,718\",\"columna_3\":\"4.1\",\"columna_4\":\"0.00347219\",\"columna_5\":\"0.01418793\",\"columna_6\":\"0.00348553\"},{\"columna_1\":\"Progreso\",\"columna_2\":\"(sin dato)\",\"columna_3\":\"(sin dato)\",\"columna_4\":\"(sin dato)\",\"columna_5\":\"(sin dato)\",\"columna_6\":\"(sin dato)\"},{\"columna_1\":\"Cutzamala de\",\"columna_2\":\"(sin dato)\",\"columna_3\":\"(sin dato)\",\"columna_4\":\"(sin dato)\",\"columna_5\":\"(sin dato)\",\"columna_6\":\"(sin dato)\"},{\"columna_1\":\"(sin dato)\",\"columna_2\":\"6,614\",\"columna_3\":\"3.9\",\"columna_4\":\"0.00617672\",\"columna_5\":\"0.02418449\",\"columna_6\":\"0.00594138\"},{\"columna_1\":\"Pinzón\",\"columna_2\":\"(sin dato)\",\"columna_3\":\"(sin dato)\",\"columna_4\":\"(sin dato)\",\"columna_5\":\"(sin dato)\",\"columna_6\":\"(sin dato)\"},{\"columna_1\":\"Chilapa de\",\"columna_2\":\"(sin dato)\",\"columna_3\":\"(sin dato)\",\"columna_4\":\"(sin dato)\",\"columna_5\":\"(sin dato)\",\"columna_6\":\"(sin dato)\"},{\"columna_1\":\"(sin dato)\",\"columna_2\":\"55,156\",\"columna_3\":\"4.1\",\"columna_4\":\"0.05150944\",\"columna_5\":\"0.21182851\",\"columna_6\":\"0.05203969\"},{\"columna_1\":\"Álvarez\",\"columna_2\":\"(sin dato)\",\"columna_3\":\"(sin dato)\",\"columna_4\":\"(sin dato)\",\"columna_5\":\"(sin dato)\",\"columna_6\":\"(sin dato)\"},{\"columna_1\":\"Chilpancingo de los\",\"columna_2\":\"(sin dato)\",\"columna_3\":\"(sin dato)\",\"columna_4\":\"(sin dato)\",\"columna_5\":\"(sin dato)\",\"columna_6\":\"(sin dato)\"},{\"columna_1\":\"(sin dato)\",\"columna_2\":\"36,201\",\"columna_3\":\"4.1\",\"columna_4\":\"0.03380762\",\"columna_5\":\"0.13884426\",\"columna_6\":\"0.03410973\"},{\"columna_1\":\"Bravo\",\"columna_2\":\"(sin dato)\",\"columna_3\":\"(sin dato)\",\"columna_4\":\"(sin dato)\",\"columna_5\":\"(sin dato)\",\"columna_6\":\"(sin dato)\"},{\"columna_1\":\"Florencio Villarreal\",\"columna_2\":\"7,834\",\"columna_3\":\"3.9\",\"columna_4\":\"0.00731607\",\"columna_5\":\"0.02817235\",\"columna_6\":\"0.00692107\"},{\"columna_1\":\"General Canuto A.\",\"columna_2\":\"3,044\",\"columna_3\":\"4.2\",\"columna_4\":\"0.00284275\",\"columna_5\":\"0.01188736\",\"columna_6\":\"0.00292036\"},{\"columna_1\":\"Neri\",\"columna_2\":\"(sin dato)\",\"columna_3\":\"(sin dato)\",\"columna_4\":\"(sin dato)\",\"columna_5\":\"(sin dato)\",\"columna_6\":\"(sin dato)\"},{\"columna_1\":\"General Heliodoro\",\"columna_2\":\"19,337\",\"columna_3\":\"3.9\",\"columna_4\":\"0.01805856\",\"columna_5\":\"0.07089654\",\"columna_6\":\"0.01741708\"},{\"columna_1\":\"Castillo\",\"columna_2\":\"(sin dato)\",\"columna_3\":\"(sin dato)\",\"columna_4\":\"(sin dato)\",\"columna_5\":\"(sin dato)\",\"columna_6\":\"(sin dato)\"},{\"columna_1\":\"Huamuxtitlán\",\"columna_2\":\"3,482\",\"columna_3\":\"3.6\",\"columna_4\":\"0.00325179\",\"columna_5\":\"0.01171612\",\"columna_6\":\"0.00287829\"},{\"columna_1\":\"Huitzuco de los\",\"columna_2\":\"(sin dato)\",\"columna_3\":\"(sin dato)\",\"columna_4\":\"(sin dato)\",\"columna_5\":\"(sin dato)\",\"columna_6\":\"(sin dato)\"},{\"columna_1\":\"(sin dato)\",\"columna_2\":\"10,780\",\"columna_3\":\"3.8\",\"columna_4\":\"0.0100673\",\"columna_5\":\"0.03783128\",\"columna_6\":\"0.00929397\"},{\"columna_1\":\"Figueroa\",\"columna_2\":\"(sin dato)\",\"columna_3\":\"(sin dato)\",\"columna_4\":\"(sin dato)\",\"columna_5\":\"(sin dato)\",\"columna_6\":\"(sin dato)\"},{\"columna_1\":\"Iguala de la\",\"columna_2\":\"(sin dato)\",\"columna_3\":\"(sin dato)\",\"columna_4\":\"(sin dato)\",\"columna_5\":\"(sin dato)\",\"columna_6\":\"(sin dato)\"},{\"columna_1\":\"(sin dato)\",\"columna_2\":\"13,678\",\"columna_3\":\"3.9\",\"columna_4\":\"0.0127737\",\"columna_5\":\"0.04948906\",\"columna_6\":\"0.01215793\"},{\"columna_1\":\"Independencia\",\"columna_2\":\"(sin dato)\",\"columna_3\":\"(sin dato)\",\"columna_4\":\"(sin dato)\",\"columna_5\":\"(sin dato)\",\"columna_6\":\"(sin dato)\"},{\"columna_1\":\"Igualapa\",\"columna_2\":\"5,197\",\"columna_3\":\"3.9\",\"columna_4\":\"0.00485341\",\"columna_5\":\"0.01908019\",\"columna_6\":\"0.00468741\"},{\"columna_1\":\"Ixcateopan de\",\"columna_2\":\"(sin dato)\",\"columna_3\":\"(sin dato)\",\"columna_4\":\"(sin dato)\",\"columna_5\":\"(sin dato)\",\"columna_6\":\"(sin dato)\"},{\"columna_1\":\"(sin dato)\",\"columna_2\":\"1,831\",\"columna_3\":\"3.9\",\"columna_4\":\"0.00170995\",\"columna_5\":\"0.00664565\",\"columna_6\":\"0.00163263\"},{\"columna_1\":\"Cuauhtémoc\",\"columna_2\":\"(sin dato)\",\"columna_3\":\"(sin dato)\",\"columna_4\":\"(sin dato)\",\"columna_5\":\"(sin dato)\",\"columna_6\":\"(sin dato)\"},{\"columna_1\":\"Zihuatanejo de Azueta\",\"columna_2\":\"16,057\",\"columna_3\":\"3.8\",\"columna_4\":\"0.01499541\",\"columna_5\":\"0.05681968\",\"columna_6\":\"0.01395883\"},{\"columna_1\":\"Juan R. Escudero\",\"columna_2\":\"10,737\",\"columna_3\":\"4.0\",\"columna_4\":\"0.01002714\",\"columna_5\":\"0.04005722\",\"columna_6\":\"0.00984082\"},{\"columna_1\":\"Leonardo Bravo\",\"columna_2\":\"13,337\",\"columna_3\":\"3.9\",\"columna_4\":\"0.01245524\",\"columna_5\":\"0.04829788\",\"columna_6\":\"0.01186529\"},{\"columna_1\":\"Malinaltepec\",\"columna_2\":\"14,809\",\"columna_3\":\"4.3\",\"columna_4\":\"0.01382992\",\"columna_5\":\"0.05891635\",\"columna_6\":\"0.01447392\"},{\"columna_1\":\"Mártir de Cuilapan\",\"columna_2\":\"9,533\",\"columna_3\":\"4.2\",\"columna_4\":\"0.00890274\",\"columna_5\":\"0.03712303\",\"columna_6\":\"0.00911998\"},{\"columna_1\":\"Metlatónoc\",\"columna_2\":\"11,747\",\"columna_3\":\"4.6\",\"columna_4\":\"0.01097036\",\"columna_5\":\"0.05028315\",\"columna_6\":\"0.01235301\"},{\"columna_1\":\"Mochitlán\",\"columna_2\":\"4,513\",\"columna_3\":\"4.0\",\"columna_4\":\"0.00421463\",\"columna_5\":\"0.01686494\",\"columna_6\":\"0.00414319\"},{\"columna_1\":\"Olinalá\",\"columna_2\":\"11,578\",\"columna_3\":\"4.0\",\"columna_4\":\"0.01081254\",\"columna_5\":\"0.04285226\",\"columna_6\":\"0.01052747\"},{\"columna_1\":\"Ometepec\",\"columna_2\":\"28,674\",\"columna_3\":\"4.4\",\"columna_4\":\"0.02677826\",\"columna_5\":\"0.11715933\",\"columna_6\":\"0.02878241\"},{\"columna_1\":\"Pedro Ascencio\",\"columna_2\":\"(sin dato)\",\"columna_3\":\"(sin dato)\",\"columna_4\":\"(sin dato)\",\"columna_5\":\"(sin dato)\",\"columna_6\":\"(sin dato)\"},{\"columna_1\":\"(sin dato)\",\"columna_2\":\"2,784\",\"columna_3\":\"4.2\",\"columna_4\":\"0.00259994\",\"columna_5\":\"0.01097622\",\"columna_6\":\"0.00269652\"},{\"columna_1\":\"Alquisiras\",\"columna_2\":\"(sin dato)\",\"columna_3\":\"(sin dato)\",\"columna_4\":\"(sin dato)\",\"columna_5\":\"(sin dato)\",\"columna_6\":\"(sin dato)\"},{\"columna_1\":\"Petatlán\",\"columna_2\":\"12,464\",\"columna_3\":\"3.9\",\"columna_4\":\"0.01163996\",\"columna_5\":\"0.04494417\",\"columna_6\":\"0.01104139\"},{\"columna_1\":\"Pilcaya\",\"columna_2\":\"2,865\",\"columna_3\":\"3.7\",\"columna_4\":\"0.00267558\",\"columna_5\":\"0.00977521\",\"columna_6\":\"0.00240147\"},{\"columna_1\":\"Pungarabato\",\"columna_2\":\"5,559\",\"columna_3\":\"3.9\",\"columna_4\":\"0.00519147\",\"columna_5\":\"0.0202388\",\"columna_6\":\"0.00497205\"},{\"columna_1\":\"Quechultenango\",\"columna_2\":\"17,892\",\"columna_3\":\"3.9\",\"columna_4\":\"0.0167091\",\"columna_5\":\"0.06563311\",\"columna_6\":\"0.01612402\"}]}}\nDE LAS DEMARCACIONES DEL DISTRITO FEDERAL\nENTRE LOS MUNICIPIOS DEL ESTADO DE\nGUERRERO PARA EL EJERCICIO FISCAL DEL 2014\nSan Luis Acatlán 26,107 4.2 0.02438097 0.10143272 0.02491887\nSan Marcos 22,486 3.9 0.02099937 0.08133386 0.01998121\nSan Miguel Totolapan 13,984 4.5 0.01305947 0.0581701 0.01429059\nTaxco de Alarcón 21,438 4.0 0.02002066 0.07970356 0.01958069\nTecoanapa 21,783 3.8 0.02034285 0.07701471 0.01892012\nTécpan de Galeana 19,438 4.1 0.01815288 0.07442461 0.01828382\nTeloloapan 18,676 4.0 0.01744126 0.0695872 0.01709542\nTepecoacuilco de\n9,223 3.9 0.00861323 0.03367235 0.00827225\nTrujano\nTetipac 5,010 3.7 0.00467877 0.01723993 0.00423532\nTixtla de Guerrero 16,813 4.2 0.01570143 0.06534961 0.01605437\nTlacoachistlahuaca 13,273 4.4 0.01239547 0.05412262 0.01329625\nTlacoapa 4,688 4.6 0.00437806 0.02006454 0.00492923\nTlalchapa 3,410 3.8 0.00318455 0.01205773 0.00296221\nTlalixtaquilla de\n3,626 3.8 0.00338627 0.01282147 0.00314984\nMaldonado\nTlapa de Comonfort 38,122 4.1 0.03560162 0.14722387 0.03616834\nTlapehuala 7,088 4.1 0.00661939 0.02713932 0.00666729\nLa Unión de Isidoro Montes\n9,282 4.0 0.00866833 0.03467151 0.00851771 de Oca\nXalpatláhuac 6,899 4.0 0.00644288 0.02598242 0.00638307\nXochihuehuetlán 2,958 3.6 0.00276244 0.00992276 0.00243772\nXochistlahuaca 20,709 4.1 0.01933985 0.07855903 0.01929952\nZapotitlán Tablas 5,500 4.4 0.00513638 0.02263739 0.00556131\nZirándaro 9,040 4.3 0.00844233 0.03625547 0.00890685\nZitlala 11,547 4.1 0.01078359 0.04427496 0.01087698\nEduardo Neri 12,252 3.9 0.01144198 0.04504808 0.01106692\nAcatepec 21,555 4.1 0.02012992 0.08264726 0.02030387\nMarquelia 4,225 4.0 0.00394567 0.0158472 0.00389316\nCochoapa el Grande 12,425 4.9 0.01160354 0.05689295 0.01397683\nJosé Joaquín de\n11,112 4.3 0.01037735 0.04426258 0.01087394\nHerrera\nJuchitán 2,730 4.1 0.00254951 0.01050079 0.00257972\nIliatenco 5,606 4.0 0.00523537 0.02096956 0.00515157\nTOTAL 1,070,794 1 4 1\nPaso 2. Obtener el componente\nDE LAS DEMARCACIONES DEL DISTRITO FEDERAL\nENTRE LOS MUNICIPIOS DEL ESTADO DE\nGUERRERO PARA EL EJERCICIO FISCAL DEL 2014\nPaso 3. Obtener la asignación monetaria para cada municipio por el concepto Z i,t\n(9) (10) (11)\nMunicipio AF2013,t Zit Asignación por Zit\nAcapulco de Juárez 312,098,513 0.098562521 30,761,216.15\nAhuacuotzingo 312,098,513 0.013321015 4,157,468.82\nAjuchitlán del Progreso 312,098,513 0.019145466 5,975,271.51\nAlcozauca de Guerrero 312,098,513 0.011870839 3,704,871.28\nAlpoyeca 312,098,513 0.001881918 587,343.79\nApaxtla 312,098,513 0.005081342 1,585,879.41\nArcelia 312,098,513 0.005674644 1,771,048.04\nAtenango del Río 312,098,513 0.002759168 861,132.23\nAtlamajalcingo del Monte 312,098,513 0.003072002 958,767.13\nAtlixtac 312,098,513 0.01550485 4,839,040.53\nAtoyac de Álvarez 312,098,513 0.018210064 5,683,333.98\nAyutla de los Libres 312,098,513 0.032969855 10,289,842.74\nAzoyú 312,098,513 0.005191474 1,620,251.39\nBenito Juárez 312,098,513 0.003503379 1,093,399.40\nBuenavista de Cuellar 312,098,513 0.002214498 691,141.63\nCoahuayutla de José\n312,098,513 0.008852701 2,762,914.90\nMaría Izazaga\nCocula 312,098,513 0.004083303 1,274,392.88\nCopala 312,098,513 0.00497011 1,551,163.96\nCopalillo 312,098,513 0.008696368 2,714,123.38\nCopanatoyac 312,098,513 0.010836813 3,382,153.31\nCoyuca de Benítez 312,098,513 0.023068838 7,199,750.17\nCoyuca de Catalán 312,098,513 0.014762986 4,607,506.07\nCuajinicuilapa 312,098,513 0.010339958 3,227,085.57\nCualác 312,098,513 0.003282912 1,024,592.09\nCuautepec 312,098,513 0.007722556 2,410,198.40\nCuetzala del Progreso 312,098,513 0.003485534 1,087,830.06\nDE LAS DEMARCACIONES DEL DISTRITO FEDERAL\nENTRE LOS MUNICIPIOS DEL ESTADO DE\nGUERRERO PARA EL EJERCICIO FISCAL DEL 2014\nCutzamala de Pinzón 312,098,513 0.005941379 1,854,295.59\nChilapa de Álvarez 312,098,513 0.052039692 16,241,510.57\nChilpancingo de los Bravo 312,098,513 0.034109727 10,645,594.95\nFlorencio Villarreal 312,098,513 0.006921072 2,160,056.41\nGeneral Canuto A. Neri 312,098,513 0.002920356 911,438.73\nGeneral Heliodoro Castillo 312,098,513 0.017417081 5,435,845.11\nHuamuxtitlán 312,098,513 0.002878288 898,309.48\nHuitzuco de los Figueroa 312,098,513 0.009293971 2,900,634.57\nIguala de la Independencia 312,098,513 0.012157928 3,794,471.20\nIgualapa 312,098,513 0.004687411 1,462,934.12\nIxcateopan de Cuauhtémoc 312,098,513 0.001632631 509,541.59\nZihuatanejo de Azueta 312,098,513 0.013958833 4,356,530.95\nJuan R. Escudero 312,098,513 0.009840815 3,071,303.82\nLeonardo Bravo 312,098,513 0.011865292 3,703,139.95\nMalinaltepec 312,098,513 0.014473919 4,517,288.65\nMártir de Cuilapan 312,098,513 0.009119978 2,846,331.56\nMetlatónoc 312,098,513 0.012353009 3,855,355.78\nMochitlán 312,098,513 0.004143192 1,293,084.00\nOlinalá 312,098,513 0.01052747 3,285,607.88\nOmetepec 312,098,513 0.028782413 8,982,948.39\nPedro Ascencio Alquisiras 312,098,513 0.002696518 841,579.12\nPetatlán 312,098,513 0.011041388 3,446,000.82\nPilcaya 312,098,513 0.002401467 749,494.21\nPungarabato 312,098,513 0.004972046 1,551,768.20\nQuechultenango 312,098,513 0.01612402 5,032,282.57\nSan Luis Acatlán 312,098,513 0.024918874 7,777,143.40\nSan Marcos 312,098,513 0.019981206 6,236,104.67\nSan Miguel Totolapan 312,098,513 0.014290588 4,460,071.28\nTaxco de Alarcón 312,098,513 0.019580692 6,111,104.81\nTecoanapa 312,098,513 0.018920125 5,904,942.74\nTécpan de Galeana 312,098,513 0.018283818 5,706,352.55\nTeloloapan 312,098,513 0.017095417 5,335,454.32\nTepecoacuilco de Trujano 312,098,513 0.008272251 2,581,757.25\nTetipac 312,098,513 0.004235317 1,321,836.07\nTixtla de Guerrero 312,098,513 0.016054373 5,010,545.92\nTlacoachistlahuaca 312,098,513 0.013296249 4,149,739.58\nDE LAS DEMARCACIONES DEL DISTRITO FEDERAL\nENTRE LOS MUNICIPIOS DEL ESTADO DE\nGUERRERO PARA EL EJERCICIO FISCAL DEL 2014\nTlacoapa 312,098,513 0.004929235 1,538,406.76\nTlalchapa 312,098,513 0.00296221 924,501.36\nTlalixtaquilla de Maldonado 312,098,513 0.003149837 983,059.55\nTlapa de Comonfort 312,098,513 0.036168338 11,288,084.63\nTlapehuala 312,098,513 0.006667288 2,080,850.60\nLa Unión de Isidoro Montes de 312,098,513 0.008517714 2,658,365.75\nXalpatláhuac 312,098,513 0.006383074 1,992,147.98\nXochihuehuetlán 312,098,513 0.002437715 760,807.34\nXochistlahuaca 312,098,513 0.019299517 6,023,350.41\nZapotitlán Tablas 312,098,513 0.005561305 1,735,675.11\nZirándaro 312,098,513 0.008906845 2,779,813.17\nZitlala 312,098,513 0.010876984 3,394,690.52\nEduardo Neri 312,098,513 0.011066916 3,453,967.99\nAcatepec 312,098,513 0.020303868 6,336,807.02\nMarquelia 312,098,513 0.003893165 1,215,050.87\nCochoapa el Grande 312,098,513 0.013976833 4,362,148.94\nJosé Joaquín de Herrera 312,098,513 0.010873942 3,393,741.18\nJuchitán 312,098,513 0.002579719 805,126.58\nIliatenco 312,098,513 0.005151571 1,607,797.65\nTOTAL 1 312,098,513\nMUNICIPIO (12) ASIGNACIÓN 20I3\nACAPULCO DE JUÁREZ 461,526,884\nAHUACUOTZINGO 47,589,201\nAJUCHITLÁN DEL PROGRESO 65,325,901\nALCOZAUCA DE GUERRERO 36,856,907\nALPOYECA 6,136,362\nAPAXTLA 14,418,559\nARCELIA 37,840,376\nATENANGO DEL RÍO 10,124,134\nDE LAS DEMARCACIONES DEL DISTRITO FEDERAL\nENTRE LOS MUNICIPIOS DEL ESTADO DE\nGUERRERO PARA EL EJERCICIO FISCAL DEL 2014\nATLAMAJALCINGO DEL MONTE 11,926,648\nATLIXTAC 59,965,167\nATOYAC DE ÁLVAREZ 68,502,857\nAYUTLA DE LOS LIBRES 134,131,236\nAZOYÚ 21,871,403\nBENITO JUÁREZ 13,810,284\nBUENAVISTA DE CUELLAR 9,509,981\nCOAHUAYUTLA DE JOSÉ MA. I. 35,826,311\nCOCULA 15,316,930\nCOPALA 16,986,829\nCOPALILLO 26,933,498\nCOPANATOYAC 37,578,165\nCOYUCA DE BENÍTEZ 79,577,851\nCOYUCA DE CATALÁN 89,490,404\nCUAJINICUILAPA 34,593,182\nCUALÁC 9,210,767\nCUAUTEPEC 22,926,853\nCUETZALA DEL PROGRESO 12,839,676\nCUTZAMALA DE PINZÓN 32,165,923\nCHILAPA DE ÁLVAREZ 208,747,342\nCHILPANCINGO DE LOS BRAVO 141,119,361\nFLORENCIO VILLARREAL 21,667,826\nGENERAL CANUTO A. NERI 8,812,227\nGENERAL HELIODORO CASTILLO 107,903,847\nHUAMUXTITLÁN 11,885,520\nHUITZUCO DE LOS FIGUEROA 34,868,178\nIGUALA DE LA INDEPENDENCIA 77,150,922\nIGUALAPA 19,547,213\nIXCATEOPAN DE CUAUHTÉMOC 6,749,208\nZIHUATANEJO DE AZUETA 61,846,555\nJUAN R. ESCUDERO 25,095,320\nLEONARDO BRAVO 29,077,452\nMALINALTEPEC 68,711,490\nMÁRTIR DE CUILAPAN 27,899,916\nMETLATÓNOC 50,246,206\nMOCHITLÁN 13,720,044\nOLINALÁ 39,373,456\nDE LAS DEMARCACIONES DEL DISTRITO FEDERAL\nENTRE LOS MUNICIPIOS DEL ESTADO DE\nGUERRERO PARA EL EJERCICIO FISCAL DEL 2014\nOMETEPEC 99,843,796\nPEDRO ASCENCIO ALQUISIRAS 21,909,947\nPETATLÁN 44,945,539\nPILCAYA 10,294,605\nPUNGARABATO 20,880,851\nQUECHULTENANGO 53,766,228\nSAN LUIS ACATLÁN 110,530,148\nSAN MARCOS 64,856,743\nSAN MIGUEL TOTOLAPAN 95,604,910\nTAXCO DE ALARCÓN 94,382,215\nTECOANAPA 73,304,775\nTECPAN DE GALEANA 68,235,530\nTELOLOAPAN 68,672,114\nTEPECOACUILCO DE TRUJANO 35,591,413\nTETIPAC 18,327,094\nTIXTLA DE GUERRERO 44,700,544\nTLACOACHISTLAHUACA 57,841,713\nTLACOAPA 30,686,306\nTLALCHAPA 12,645,242\nTLALIXTAQUILLA DE MALDONADO 12,108,374\nTLAPA DE COMONFORT 95,947,567\nTLAPEHUALA 22,139,308\nUNION DE I. MONTES DE OCA, LA 29,748,033\nXALPATLÁHUAC 22,499,674\nXOCHIHUEHUETLÁN 8,173,837\nXOCHISTLAHUACA 77,782,901\nZAPOTITLÁN TABLAS 25,854,382\nZIRÁNDARO 34,290,013\nZITLALA 39,471,356\nEDUARDO NERI 36,148,210\nACATEPEC 135,211,271\nMARQUELIA 13,221,793\nCOCHOAPA EL GRANDE 70,790,543\nJOSÉ JOAQUÍN DE HERRERA 38,971,270\nJUCHITÁN 10,117,327\nILIATENCO 30,536,073\nTOTAL 4,097,436,017\nDE LAS DEMARCACIONES DEL DISTRITO FEDERAL\nENTRE LOS MUNICIPIOS DEL ESTADO DE\nGUERRERO PARA EL EJERCICIO FISCAL DEL 2014\nPaso 5. Obtener la asignación monetaria correspondiente a cada municipio respecto del Fondo para la Infraestructura Social Municipal y de las Demarcaciones Territoriales del Distrito Federal\nMunicipio (13)\n(14) (15)\nZit Asignación por\nAsignación 2013\nAcapulco de Juárez 461,526,884 30,761,216.15 492,288,100\nAhuacuotzingo 47,589,201 4,157,468.82 51,746,670\nAjuchitlán del Progreso 65,325,901 5,975,271.51 71,301,172\nAlcozauca de Guerrero 36,856,907 3,704,871.28 40,561,778\nAlpoyeca 6,136,362 587,343.79 6,723,706\nApaxtla 14,418,559 1,585,879.41 16,004,438\nArcelia 37,840,376 1,771,048.04 39,611,424\nAtenango del Río 10,124,134 861,132.23 10,985,266\nAtlamajalcingo del Monte 11,926,648 958,767.13 12,885,415\nAtlixtac 59,965,167 4,839,040.53 64,804,207\nAtoyac de Álvarez 68,502,857 5,683,333.98 74,186,191\nAyutla de los Libres 134,131,236 10,289,842.74 144,421,079\nAzoyú 21,871,403 1,620,251.39 23,491,654\nBenito Juárez 13,810,284 1,093,399.40 14,903,683\nBuenavista de Cuellar 9,509,981 691,141.63 10,201,123\nCoahuayutla de José María Izazaga 35,826,311 2,762,914.90 38,589,226\nCocula 15,316,930 1,274,392.88 16,591,323\nCopala 16,986,829 1,551,163.96 18,537,993\nCopalillo 26,933,498 2,714,123.38 29,647,621\nCopanatoyac 37,578,165 3,382,153.31 40,960,318\nCoyuca de Benítez 79,577,851 7,199,750.17 86,777,601\nCoyuca de Catalán 89,490,404 4,607,506.07 94,097,910\nCuajinicuilapa 34,593,182 3,227,085.57 37,820,268\nCualác 9,210,767 1,024,592.09 10,235,359\nCuautepec 22,926,853 2,410,198.40 25,337,051\nDE LAS DEMARCACIONES DEL DISTRITO FEDERAL\nENTRE LOS MUNICIPIOS DEL ESTADO DE\nGUERRERO PARA EL EJERCICIO FISCAL DEL 2014\nCuetzala del Progreso 12,839,676 1,087,830.06 13,927,506\nCutzamala de Pinzón 32,165,923 1,854,295.59 34,020,219\nChilapa de Álvarez 208,747,342 16,241,510.57 224,988,853\nChilpancingo de los Bravo 141,119,361 10,645,594.95 151,764,956\nFlorencio Villarreal 21,667,826 2,160,056.41 23,827,882\nGeneral Canuto A. Neri 8,812,227 911,438.73 9,723,666\nGeneral Heliodoro Castillo 107,903,847 5,435,845.11 113,339,692\nHuamuxtitlán 11,885,520 898,309.48 12,783,829\nHuitzuco de los Figueroa 34,868,178 2,900,634.57 37,768,813\nIguala de la Independencia 77,150,922 3,794,471.20 80,945,393\nIgualapa 19,547,213 1,462,934.12 21,010,147\nIxcateopan de Cuauhtémoc 6,749,208 509,541.59 7,258,750\nZihuatanejo de Azueta 61,846,555 4,356,530.95 66,203,086\nJuan R. Escudero 25,095,320 3,071,303.82 28,166,624\nLeonardo Bravo 29,077,452 3,703,139.95 32,780,592\nMalinaltepec 68,711,490 4,517,288.65 73,228,779\nMártir de Cuilapan 27,899,916 2,846,331.56 30,746,248\nMetlatónoc 50,246,206 3,855,355.78 54,101,562\nMochitlán 13,720,044 1,293,084.00 15,013,128\nOlinalá 39,373,456 3,285,607.88 42,659,064\nOmetepec 99,843,796 8,982,948.39 108,826,744\nPedro Ascencio Alquisiras 21,909,947 841,579.12 22,751,526\nPetatlán 44,945,539 3,446,000.82 48,391,540\nPilcaya 10,294,605 749,494.21 11,044,099\nPungarabato 20,880,851 1,551,768.20 22,432,619\nQuechultenango 53,766,228 5,032,282.57 58,798,511\nSan Luis Acatlán 110,530,148 7,777,143.40 118,307,291\nSan Marcos 64,856,743 6,236,104.67 71,092,848\nSan Miguel Totolapan 95,604,910 4,460,071.28 100,064,981\nTaxco de Alarcón 94,382,215 6,111,104.81 100,493,320\nTecoanapa 73,304,775 5,904,942.74 79,209,718\nTécpan de Galeana 68,235,530 5,706,352.55 73,941,883\nDE LAS DEMARCACIONES DEL DISTRITO FEDERAL\nENTRE LOS MUNICIPIOS DEL ESTADO DE\nGUERRERO PARA EL EJERCICIO FISCAL DEL 2014\nTeloloapan 68,672,114 5,335,454.32 74,007,568\nTepecoacuilco de Trujano 35,591,413 2,581,757.25 38,173,170\nTetipac 18,327,094 1,321,836.07 19,648,930\nTixtla de Guerrero 44,700,544 5,010,545.92 49,711,090\nTlacoachistlahuaca 57,841,713 4,149,739.58 61,991,453\nTlacoapa 30,686,306 1,538,406.76 32,224,713\nTlalchapa 12,645,242 924,501.36 13,569,743\nTlalixtaquilla de Maldonado 12,108,374 983,059.55 13,091,434\nTlapa de Comonfort 95,947,567 11,288,084.63 107,235,652\nTlapehuala 22,139,308 2,080,850.60 24,220,159\nLa Unión de Isidoro Montes\n29,748,033 2,658,365.75 32,406,399 de Oca\nXalpatláhuac 22,499,674 1,992,147.98 24,491,822\nXochihuehuetlán 8,173,837 760,807.34 8,934,644\nXochistlahuaca 77,782,901 6,023,350.41 83,806,251\nZapotitlán Tablas 25,854,382 1,735,675.11 27,590,057\nZirándaro 34,290,013 2,779,813.17 37,069,826\nZitlala 39,471,356 3,394,690.52 42,866,046\nEduardo Neri 36,148,210 3,453,967.99 39,602,178\nAcatepec 135,211,271 6,336,807.02 141,548,078\nMarquelia 13,221,793 1,215,050.87 14,436,844\nCochoapa el Grande 70,790,543 4,362,148.94 75,152,692\nJosé Joaquín de Herrera 38,971,270 3,393,741.18 42,365,011\nJuchitán 10,117,327 805,126.58 10,922,454\nIliatenco 30,536,073 1,607,797.65 32,143,871\nTOTAL 4,097,436,017 312,098,513 4,409,534,530\nARTÍCULO NOVENO.- De acuerdo al monto del Fondo para la Infraestructura Social Municipal asignado al Estado de Guerrero por $4,409,534,530.00 (Cuatro mil cuatrocientos nueve millones quinientos treinta y cuatro mil quinientos treinta pesos 00/100 M. N.), y al aplicar la fórmula establecida por la Secretaría de Desarrollo Social de la Federación, la asignación municipal resultante es la siguiente:\nDE LAS DEMARCACIONES DEL DISTRITO FEDERAL\nENTRE LOS MUNICIPIOS DEL ESTADO DE\nGUERRERO PARA EL EJERCICIO FISCAL DEL 2014\nMunicipio Asignación 2014\nAcapulco de Juárez 492,288,100\nAhuacuotzingo 51,746,670\nAjuchitlán del Progreso 71,301,172\nAlcozauca de Guerrero 40,561,778\nAlpoyeca 6,723,706\nApaxtla 16,004,438\nArcelia 39,611,424\nAtenango del Río 10,985,266\nAtlamajalcingo del Monte 12,885,415\nAtlixtac 64,804,207\nAtoyac de Álvarez 74,186,191\nAyutla de los Libres 144,421,079\nAzoyú 23,491,654\nBenito Juárez 14,903,683\nBuenavista de Cuellar 10,201,123\nCoahuayutla de José María\nIzazaga 38,589,226\nCocula 16,591,323\nCopala 18,537,993\nCopalillo 29,647,621\nCopanatoyac 40,960,318\nCoyuca de Benítez 86,777,601\nCoyuca de Catalán 94,097,910\nCuajinicuilapa 37,820,268\nCualác 10,235,359\nCuautepec 25,337,051\nCuetzala del Progreso 13,927,506\nCutzamala de Pinzón 34,020,219\nChilapa de Álvarez 224,988,853\nChilpancingo de los Bravo 151,764,956\nFlorencio Villarreal 23,827,882\nGeneral Canuto A. Neri 9,723,666\nDE LAS DEMARCACIONES DEL DISTRITO FEDERAL\nENTRE LOS MUNICIPIOS DEL ESTADO DE\nGUERRERO PARA EL EJERCICIO FISCAL DEL 2014\nGeneral Heliodoro Castillo 113,339,692\nHuamuxtitlán 12,783,829\nHuitzuco de los Figueroa 37,768,813\nIguala de la Independencia 80,945,393\nIgualapa 21,010,147\nIxcateopan de Cuauhtémoc 7,258,750\nZihuatanejo de Azueta 66,203,086\nJuan R. Escudero 28,166,624\nLeonardo Bravo 32,780,592\nMalinaltepec 73,228,779\nMártir de Cuilapan 30,746,248\nMetlatónoc 54,101,562\nMochitlán 15,013,128\nOlinalá 42,659,064\nOmetepec 108,826,744\nPedro Ascencio Alquisiras 22,751,526\nPetatlán 48,391,540\nPilcaya 11,044,099\nPungarabato 22,432,619\nQuechultenango 58,798,511\nSan Luis Acatlán 118,307,291\nSan Marcos 71,092,848\nSan Miguel Totolapan 100,064,981\nTaxco de Alarcón 100,493,320\nTecoanapa 79,209,718\nTécpan de Galeana 73,941,883\nTeloloapan 74,007,568\nTepecoacuilco de Trujano 38,173,170\nTetipac 19,648,930\nTixtla de Guerrero 49,711,090\nTlacoachistlahuaca 61,991,453\nTlacoapa 32,224,713\nTlalchapa 13,569,743\nTlalixtaquilla de Maldonado 13,091,434\nTlapa de Comonfort 107,235,652\nTlapehuala 24,220,159\nDE LAS DEMARCACIONES DEL DISTRITO FEDERAL\nENTRE LOS MUNICIPIOS DEL ESTADO DE\nGUERRERO PARA EL EJERCICIO FISCAL DEL 2014\nLa Unión de Isidoro Montes de\nOca 32,406,399\nXalpatláhuac 24,491,822\nXochihuehuetlán 8,934,644\nXochistlahuaca 83,806,251\nZapotitlán Tablas 27,590,057\nZirándaro 37,069,826\nZitlala 42,866,046\nEduardo Neri 39,602,178\nAcatepec 141,548,078\nMarquelia 14,436,844\nCochoapa el Grande 75,152,692\nJosé Joaquín de Herrera 42,365,011\nJuchitán 10,922,454\nIliatenco 32,143,871\nTOTAL 4,409,534,530\nARTÍCULO DÉCIMO.- Con fundamento en el artículo 33 inciso a) fracción II de la Ley de\nCoordinación Fiscal, los Municipios podrán disponer de hasta un dos por ciento del total de los recursos del Fondo para la Infraestructura Social Municipal para la realización de un Programa de Desarrollo\nInstitucional Municipal. Este programa será convenido entre el Ejecutivo Federal a través de la Secretaría de Desarrollo Social, el Gobierno del Estado y cada Municipio.\nLos Municipios podrán destinar hasta un tres por ciento del total de los recursos del Fondo para la Infraestructura Social Municipal asignado a cada uno de ellos para gastos indirectos a las obras señaladas en el mencionado artículo.\nRespecto de las aportaciones de este Fondo, los Municipios deberán:\nI.- Hacer del conocimiento de sus habitantes, los montos que reciban, las obras y acciones a realizar, el costo de cada una, su ubicación, metas y beneficiarios;\nII.- Promover la participación de las comunidades beneficiadas, en su destino, aplicación y vigilancia, así como en la programación, ejecución, control, seguimiento y evaluación de las obras y acciones que se vayan a realizar;\nIII.- Informar a sus habitantes, los avances del ejercicio de los recursos trimestralmente y al término de cada ejercicio, sobre los resultados alcanzados;\nDE LAS DEMARCACIONES DEL DISTRITO FEDERAL\nENTRE LOS MUNICIPIOS DEL ESTADO DE\nGUERRERO PARA EL EJERCICIO FISCAL DEL 2014\nIV.- Proporcionar por conducto del Gobierno Estatal a la Secretaría de Desarrollo Social del Gobierno\nFederal, la información que sobre la utilización del Fondo para la Infraestructura Social Municipal le sea requerida;\nV.- Procurar la preservación y protección del medio ambiente y que impulsen el desarrollo sustentable;\nVI.- Reportar trimestralmente a la Secretaría de Desarrollo Social del Gobierno Federal, a través de sus Delegaciones Estatales o instancia equivalente en el Distrito Federal, así como a la Secretaría de\nHacienda y Crédito Público, el seguimiento sobre el uso de los recursos del Fondo, en los términos que establecen los artículos 48 y 49 de esta Ley, así como con base en el Informe anual sobre la situación de pobreza y rezago social de las entidades y sus respectivos municipios o demarcaciones territoriales.\nAsimismo, las entidades, los municipios y las demarcaciones territoriales, deberán proporcionar la información adicional que solicite dicha Secretaría para la supervisión y seguimiento de los recursos; y\nVII.- Publicar en su página oficial de Internet las obras financiadas con los recursos de este Fondo.\nDichas publicaciones deberán contener, entre otros datos, la información del contrato bajo el cual se celebra, informes trimestrales de los avances y, en su caso, evidencias de conclusión.\nLos municipios que no cuenten con página oficial de Internet, convendrán con el Gobierno del Estado, para que se publique la información correspondiente al municipio\nARTÍCULO DÉCIMO PRIMERO.- La Secretaría de Finanzas y Administración, una vez radicada la asignación mensual federal para la Infraestructura Social Municipal y conforme a la Ley de\nCoordinación Fiscal y la Ley número 427 del Sistema de Coordinación Hacendaria del Estado de\nGuerrero, el Calendario de entrega de los recursos a los Municipios del Fondo para la Infraestructura\nSocial Municipal para el Ejercicio Fiscal 2014 será el siguiente:\nMES FISM\nEnero 31\nFebrero 28\nMarzo 31\nAbril 30\nMayo 30\nJunio 30\nJulio 31\nAgosto 29\nSeptiembre 30\nOctubre 31\nDE LAS DEMARCACIONES DEL DISTRITO FEDERAL\nENTRE LOS MUNICIPIOS DEL ESTADO DE\nGUERRERO PARA EL EJERCICIO FISCAL DEL 2014\nÚNICO.- El presente Acuerdo entrará en vigor a partir del día siguiente de su publicación en el\nPeriódico Oficial del Gobierno del Estado.\nDado en la Residencia Oficial del Poder Ejecutivo Estatal en Chilpancingo de los Bravo, Guerrero, a los veinticuatro días del mes de enero del año dos mil catorce.\nEL GOBERNADOR CONSTITUCIONAL\nLIC. ÁNGEL HELADIO AGUIRRE RIVERO.\nRúbrica.\nEL SECRETARIO GENERAL DE GOBIERNO.\nDR. JESÚS MARTÍNEZ GARNELO.\nRúbrica.\nEL SECRETARIO DE FINANZAS Y ADMINISTRACIÓN.\nC.P. JORGE SILVERIO SALGADO LEYVA.\nRúbrica.\nLA SECRETARIA DE DESARROLLO SOCIAL.\nMTRA. BEATRIZ MOJICA MORGA.\nRúbrica.",
  "ordenamiento": "ACUERDO",
  "jurisdiccion": "GUERRERO",
  "fuente_oficial": "DIARIO OFICIAL DE LA FEDERACION",
  "Fecha de Publicación": "9 de diciembre de 2013",
  "ULTIMA REFORMA PUBLICADA": "9 de diciembre de 2013",
  "status": "VIGENTE",
  "es_escaneado": false,
  "tiene_tablas": true,
  "materia": [
    "general"
  ]
}