{
  "titulo": "Acuerdo General del Pleno del Tribunal Electoral del Estado de Guerrero de Trece de Julio de Dos Mil",
  "Contenido": "CREACIÓN DE LA COMISIÓN REVISORA PARA LA\nELABORACIÓN DEL ANTEPROYECTO DE REFORMAS\nY ADICIONES A LA LEY ORGÁNICA DEL TRIBUNAL\nELECTORAL DEL ESTADO DE GUERRERO\nTEXTO ORIGINAL\nAcuerdo publicado en el Periódico Oficial del Gobierno del Estado No. 69, el\nMartes 30 de Agosto de 2011.\nINSTITUTO ELECTORAL DEL ESTADO DE GUERRERO\nACUERDO GENERAL DEL PLENO DEL TRIBUNAL ELECTORAL DEL ESTADO DE\nGUERRERO DE TRECE DE JULIO DE DOS MIL ONCE; RELATIVO A LA CREACIÓN\nDE LA COMISIÓN REVISORA PARA LA ELABORACIÓN DEL ANTEPROYECTO DE\nREFORMAS Y ADICIONES A LA LEY ORGÁNICA DEL TRIBUNAL ELECTORAL DEL\nESTADO DE GUERRERO.\nGuerrero.- Tribunal Electoral del Estado de Guerrero.- Secretaria General de Acuerdos.\nACUERDO DEL TRIBUNAL EN PLENO DEL\nTRECE DE JULIO DEL DOS MIL ONCE.\nPRIMERO. De conformidad con lo dispuesto por el articulo 25, párrafo XXV, de la\nEstado de Guerrero, es un órgano autónomo, en su funcionamiento e independiente en sus decisiones; con personalidad jurídica y patrimonio propio y máxima autoridad jurisdiccional en la materia; con excepción de lo dispuesto por la fracción IV, del articulo\n99, de la Constitución Política de los Estados Unidos Mexicanos.\nSEGUNDO. Que el articulo 4, fracciones VII y XI de la Ley Orgánica del Tribunal\nElectoral del Estado, establece que, en términos de lo dispuesto por la Constitución Local y las leyes aplicables, el Tribunal Electoral del Estado de Guerrero, es competente para funcionamiento, siendo atribución de este órgano jurisdiccional dictar los acuerdos generales en la materia de su competencia.\nCREACIÓN DE LA COMISIÓN REVISORA PARA LA\nELABORACIÓN DEL ANTEPROYECTO DE REFORMAS\nY ADICIONES A LA LEY ORGÁNICA DEL TRIBUNAL\nELECTORAL DEL ESTADO DE GUERRERO\nTERCERO. Que como parte de una participación sustancial del Tribunal en la política, la democracia, la sociedad y la cultura jurídico-electoral en la entidad, se tiene proyectado elaborar un Anteproyecto de Reformas y Adiciones a la Ley Orgánica del\nTribunal Electoral del Estado de Guerrero, que plantee una reforma amplia a la Ley\nOrgánica del Tribunal.\nCUARTO. Que el objetivo es crear un anteproyecto de reformas y adiciones valioso, que incentive la discusión y sirva como punto de partida, en relación a la pertinencia de reformas y adiciones a la Ley Orgánica del Tribunal Electoral del Estado a instancia de la institución; que incluya todos los puntos de vista, hechos por especialistas en la materia electoral, conducido y dirigido por la propia institución.\nQUINTO. Que la justificación es contar con una reforma constitucional y legal de la Ley Orgánica del Tribunal Electoral del Estado, con impactos de adecuación obligatorios en muchos temas y leyes en las entidades federativas, que en la toma de decisiones, realmente respondan a lo maniatado por la Constitución Federal.\nSEXTO. Que se realizará una convocatoria, que se publicará internamente, dirigida a los magistrados y todo, el personal del Tribunal Electoral del Estado, a efecto de que hagan las propuestas de reformas correspondientes, mismas que entregarán a la\nComisión.\nSEPTIMO. Que la aprobación de los trabajos presentados serán valorados y aprobados por la Comisión Revisora integrada por especialistas del Tribunal. Por lo cual se hace necesario formalizar la integración de dicha comisión.\nOCTAVO. Que la integración del \"Anteproyecto de Reformas y Adiciones a la\nLey Orgánica del Tribunal Electoral del Estado de Guerrero\" contendrá todos los temática de la convocatoria.\nNOVENO. Que la presentación del \"Anteproyecto de Reformas y Adiciones a la Ley Orgánica del Tribunal Electoral del Estado de Guerrero\" se realizará ante el\nCREACIÓN DE LA COMISIÓN REVISORA PARA LA\nELABORACIÓN DEL ANTEPROYECTO DE REFORMAS\nY ADICIONES A LA LEY ORGÁNICA DEL TRIBUNAL\nELECTORAL DEL ESTADO DE GUERRERO\nPleno del Tribunal Electoral del Estado, a más tardar el quince de agosto del año en curso.\nDECIMO. En este sentido, con fundamento en el artículo 25, párrafo veintiocho de numerales 5 y fracción XIII de la Ley Orgánica del Tribunal Electoral del Estado; el Pleno del Tribunal Electoral del Estado de Guerrero, ha determinado emitir el siguiente:\nACUERDO GENERAL\nPRIMERO. Se crea la Comisión Revisora para coordinar los trabajos del\n\"Anteproyecto de Reformas y Adiciones a la Ley Orgánica del Tribunal Electoral del Estado de Guerrero\"\nSEGUNDO. La Comisión Revisora entrará en funciones el día de la aprobación de este acuerdo.\nTERCERO. Que la aprobación de los trabajos presentados serán valorados y aprobados por la Comisión Revisora y el Pleno del Tribunal Electoral de acuerdo a la calendarización que se establecerá.\nCUARTO. En atención a lo expuesto en el punto anterior, se designan a los integrantes de la Comisión Revisora para coordinar los trabajos del \"Anteproyecto de\nGuerrero\", a los siguientes ciudadanos;\nNUM. INTEGRANTE ADSCRIPCIÓN\n1. MTRO. SAUL BARRIOS SAGAL PRIMERA SALA UNITARIA\n2. LIC. ARTURO SOLÍS FELIPE SEGUNDA SALA UNITARIA\n3. LIC. PAULINO JAIMES BERNARDINO TERCERA SALA UNITARIA\n4. LIC. FRANCISCO GUZMAN DÍAZ CUARTA SALA UNITARIA\nCREACIÓN DE LA COMISIÓN REVISORA PARA LA\nELABORACIÓN DEL ANTEPROYECTO DE REFORMAS\nY ADICIONES A LA LEY ORGÁNICA DEL TRIBUNAL\nELECTORAL DEL ESTADO DE GUERRERO\n5. LIC. ALEJANDRO RUIZ MENDIOLA QUINTA SALA UNITARIA\nSECRETARIO TÉCNICO Y\n6. LIC. FRANCISCO JACINTO PINEDA\nCOMPILADOR\nTRANSITORIOS.\nPRIMERO. El presente acuerdo entrará en vigor a partir de su aprobación.\nSEGUNDO. Publíquese en el Periódico Oficial del Gobierno del Estado de\nGuerrero, en los estrados del Tribunal, y en la página que tiene este órgano jurisdiccional en Internet.\nAsí lo aprobaron por UNANIMIDAD de votos, lo acordaron y firman los\nMagistrados integrantes del Pleno del Tribunal Electoral del Estado, por ante el\nSecretario General de Acuerdos que autoriza y da fe.\nJ. JESÚS VILLANUEVA VEGA.\nMAGISTRADO PRESIDENTE.\nRúbrica.\nALMA DELIA EUGENIO ALCARAZ.\nMAGISTRADA.\nJ. FÉLIX VILLAFUERTE REBOLLAR.\nMAGISTRADO\nISAÍAS SÁNCHEZ NÁJERA.\nMAGISTRADO.\nCREACIÓN DE LA COMISIÓN REVISORA PARA LA\nELABORACIÓN DEL ANTEPROYECTO DE REFORMAS\nY ADICIONES A LA LEY ORGÁNICA DEL TRIBUNAL\nELECTORAL DEL ESTADO DE GUERRERO\nREGINO HERNÁNDEZ TRUJILLO.\nMAGISTRADO.\nRúbrica.\nMANUEL ALEJANDRO ARROYO GONZÁLEZ.\nSECRETARIO GENERAL DE ACUERDOS.\nRúbrica.\nEL SUSUCRITO, MAESTRO EN DERECHO MANUEL ALEJANDRO ARROYO\nGONZÁLEZ, SECRETARIO GENERAL DE ACUERDOS DEL TRIBUNAL ELECTORAL\nDEL ESTADO DE GUERRERO.\nQue el presente documento en 4 fojas útiles, debidamente cotejadas y selladas, corresponden íntegramente al Acuerdo General del Pleno del Tribunal Electoral del\nEstado de Guerrero de trece de julio del dos mil once; relativo a la creación de la comisión revisora para la elaboración del anteproyecto de reformas y adiciones a la Ley\nOrgánica del Tribunal Electoral del Estado de Guerrero, aprobado en la quinta sesión ordinaria pública y solemne del Pleno del Tribunal Electoral del Estado de Guerrero, de fecha trece del mes y año en curso, misma que obra en los archivos de la Secretaría\nGeneral de Acuerdos de este órgano jurisdiccional.\nLo que certifico, en ejercicio de las facultades previstas en el artículo 21 fracción\nIV de la Ley Orgánica del Tribunal Electoral del Estado.- Doy Fe.Chilpancingo, Guerrero, a catorce de julio del dos mil once.\nSECRETARIO GENERAL DE ACUERDOS.",
  "ordenamiento": "ACUERDO",
  "jurisdiccion": "GUERRERO",
  "fuente_oficial": "DIARIO OFICIAL DE LA FEDERACION",
  "Fecha de Publicación": "30 de Agosto de 2011",
  "ULTIMA REFORMA PUBLICADA": null,
  "status": "VIGENTE",
  "es_escaneado": false,
  "tiene_tablas": true,
  "materia": [
    "electoral",
    "judicial"
  ]
}