{
  "titulo": "Acuerdo Mediante el Cual Se Concentran los Servicios de Certificación de Preparatoria Abierta y Capt",
  "Contenido": "RECURSOS FINANCIEROS POR EL DEPARTAMENTO\nDE SISTEMAS ABIERTOS DEPENDIENTE DE LA\nSUBSECRETARÍA DE EDUCACIÓN MEDIA SUPERIOR\nY SUPERIOR DE LA SECRETARÍA DE EDUCACIÓN\nGUERRERO\nTEXTO ORIGINAL\nAcuerdo publicado en el Periódico Oficial del Gobierno del Estado No. 74, el Viernes 13 de\nSeptiembre de 2013.\nACUERDO MEDIANTE EL CUAL SE CONCENTRAN LOS SERVICIOS DE CERTIFICACIÓN DE\nPREPARATORIA ABIERTA Y CAPTACIÓN DE LOS RECURSOS FINANCIEROS POR EL\nDEPARTAMENTO DE SISTEMAS ABIERTOS DEPENDIENTE DE LA SUBSECRETARÍA DE\nEDUCACIÓN MEDIA SUPERIOR Y SUPERIOR DE LA SECRETARÍA DE EDUCACIÓN GUERRERO.\nGuerrero.- Poder Legislativo.\nLICENCIADO ÁNGEL HELADIO AGUIRRE RIVERO, GOBERNADOR CONSTITUCIONAL\nDEL ESTADO DE GUERRERO, CON FUNDAMENTO EN LOS ARTÍCULOS 74, FRACCIONES IV Y\nY EN USO DE LAS FACULTADES QUE LE CONFIEREN LOS ARTÍCULOS 2o., 6o., 10 Y 20,\nFRACCIÓN III DE LA LEY ORGÁNICA DE LA ADMINISTRACIÓN PÚBLICA DEL ESTADO DE\nGUERRERO NÚMERO 433 Y 37, PÁRRAFO SEGUNDO DE LA LEY DE EDUCACIÓN DEL ESTADO\nDE GUERRERO NÚM. 158; Y\nQue el Plan Estatal de Desarrollo 2011-2015, establece en sus objetivos: incrementar la cobertura educativa, considerando el principio de equidad, para garantizar el acceso, permanencia y conclusión de los estudios de la población en general, particularmente de niñas, niños y jóvenes de comunidades rurales e indígenas; establecer los acuerdos pertinentes entre los diversos subsistemas de educación media superior en el Estado y el país, para contribuir a la integración del sistema estatal y nacional de bachillerato, con el objeto de contar con una certificación nacional de educación media superior; mejorar la infraestructura física del sector educativo y la orientación de los recursos, a partir de la focalización de prioridades y pertinencias de los proyectos; e identificar necesidades de la infraestructura en las instituciones de educación media superior y superior, para atender las prioridades de este nivel.\nUnidos Mexicanos, en su primer párrafo estipula que: \"Todo individuo tiene derecho a recibir educación.\nEl Estado Federación, Estados, Distrito Federal y Municipios, impartirá educación preescolar, primaria, secundaria y media superior. La educación preescolar, primaria y secundaria conforman la educación básica; esta y la media superior serán obligatorias\".\nRECURSOS FINANCIEROS POR EL DEPARTAMENTO\nDE SISTEMAS ABIERTOS DEPENDIENTE DE LA\nSUBSECRETARÍA DE EDUCACIÓN MEDIA SUPERIOR\nY SUPERIOR DE LA SECRETARÍA DE EDUCACIÓN\nGUERRERO\nQue actualmente el subsistema denominado Preparatoria Abierta es la mejor opción para quienes no pudieron ingresar a los sistemas escolarizados del nivel medio superior mediante examen de selección y para quienes, por diversas circunstancias, truncaron sus estudios.\nQue a excepción de Guerrero, en el resto de la República Mexicana, se administran y ofrecen todos los servicios educativos de preparatoria abierta a través del equivalente al Departamento de\nSistemas Abiertos.\nQue la Educación Media Superior enfrenta desafíos que sólo podrán ser atendidos de ser implementada esta modalidad educativa con una identidad definida que brinde a los usuarios la posibilidad de avanzar ordenadamente hacia la conclusión de sus estudios de nivel Medio Superior.\nQue el Gobierno del Estado de Guerrero, a través de la Secretaría de Educación Guerrero y las diferentes Subsecretarías que la integran, tales como la Subsecretaría de Educación Media Superior y\nSuperior así como la Subsecretaría de Planeación Educativa y la Subsecretaría de Administración y\nFinanzas, conjuntan esfuerzos y acciones para concentrar los servicios de certificación de estudios parciales y totales en Preparatoria Abierta, así como, la captación y administración de los recursos financieros generados por esta modalidad educativa.\nPor lo anteriormente expuesto y fundado, he tenido a bien expedir el siguiente:\nACUERDO MEDIANTE EL CUAL SE CONCENTRAN LOS SERVICIOS DE CERTIFICACIÓN DE\nPREPARATORIA ABIERTA Y CAPTACIÓN DE LOS RECURSOS FINANCIEROS POR EL\nDEPARTAMENTO DE SISTEMAS ABIERTOS DEPENDIENTE DE LA SUBSECRETARÍA DE\nEDUCACIÓN MEDIA SUPERIOR Y SUPERIOR DE LA SECRETARÍA DE EDUCACIÓN GUERRERO.\nCAPÍTULO I\nDel objeto y operación\nArtículo 1. El presente Acuerdo tiene como objeto primordial la autorización de manera indefinida, de concentrar los servicios de certificación de estudios parcial y total del subsistema denominado Preparatoria Abierta, así como la captación de los recursos financieros generados por concepto de pago de derecho a exámenes ordinarios, extemporáneos y duplicados de credencial.\nArtículo 2. Para tales efectos de este Acuerdo se ejecutará a través del convenio de\nRECURSOS FINANCIEROS POR EL DEPARTAMENTO\nDE SISTEMAS ABIERTOS DEPENDIENTE DE LA\nSUBSECRETARÍA DE EDUCACIÓN MEDIA SUPERIOR\nY SUPERIOR DE LA SECRETARÍA DE EDUCACIÓN\nGUERRERO\nArtículo 3. Para la certificación parcial o total de estudios en el subsistema denominado\nPreparatoria Abierta, los estudiantes que se inscriban deberán acreditar en su totalidad las asignaturas que establece el plan de estudios diseñados por la Dirección General de Bachillerato de la Secretaría de\nEducación Pública.\nArtículo 4. Las actividades operativas referentes al procedimiento de certificación serán realizadas por personal de la Secretaría de Educación Guerrero, a través del Departamento de Sistemas\nAbiertos. Éste último será la instancia que realizará el proceso de certificación de los estudios parciales o totales para los estudiantes inscritos en esta modalidad educativa.\nArtículo 5. La vigencia en cuanto a ejecución de los procedimientos operativos correspondientes a la certificación parcial o total de estudios, será por tiempo indefinido y estará concentrada en las instalaciones del Departamento de Sistemas Abiertos.\nArtículo 6. La Secretaría de Educación Guerrero impartirá la capacitación para el personal que llevará a cabo las actividades de trámites o servicios de certificación parcial o total de estudios del subsistema denominado Preparatoria Abierta haciendo uso de las instalaciones del Departamento de\nSistemas Abiertos.\nArtículo 7. La Secretaría de Educación Guerrero, por conducto del Departamento de Sistemas\nAbiertos, será la responsable de la elaboración de los formatos de certificación.\nArtículo 8. La Secretaría de Educación Guerrero, delegará las acciones de validación de estudios al Departamento de Sistemas Abiertos establecidos en el Mapa Curricular de la Dirección\nGeneral de Bachillerato de la Secretaría de Educación Pública.\nArtículo 9. La captación de los recursos generados por conceptos de aplicación de exámenes ordinarios, extemporáneos y duplicados de credencial será vía la Subsecretaría de Administración y\nFinanzas, mismos que se destinarán para ser administrados por la Dirección General de Operación de\nDistancia.\nArtículo 10. Los estudiantes inscritos en el subsistema denominado Preparatoria Abierta, deberán cumplir en su totalidad el plan curricular de Preparatoria Abierta, para poder certificarse en esta modalidad educativa y así continuar su formación académica en el nivel inmediato superior.\nRECURSOS FINANCIEROS POR EL DEPARTAMENTO\nDE SISTEMAS ABIERTOS DEPENDIENTE DE LA\nSUBSECRETARÍA DE EDUCACIÓN MEDIA SUPERIOR\nY SUPERIOR DE LA SECRETARÍA DE EDUCACIÓN\nGUERRERO\nCAPÍTULO II\nDe las facultades del Departamento de Sistemas Abiertos\nArtículo 11. El Departamento de Sistemas Abiertos, tendrá las facultades siguientes:\nI. Llevar a cabo de manera integral la operatividad y logística de los servicios educativos proporcionados desde la preinscripción, inscripción, acreditación y certificación parcial o total de estudios;\nII. Elaborar el diseño de formatos, para realizar la certificación de estudios en la modalidad denominada preparatoria abierta, considerando una demanda promedio anual de 3,000 certificaciones;\nIII. Otorgar en tiempo y forma, el certificado parcial o total de estudios a cada estudiante que acredite en su totalidad el plan de estudios de Preparatoria Abierta;\nIV. Expedir en tiempo y forma duplicados y/o reposición de documentos de acreditación y certificación que obren en los archivos del Departamento de Sistemas Abiertos; y\nV. Solicitar cuando así se requiera los informes de la correcta aplicación de los recursos financieros en estricto apego a los lineamientos establecidos por la Contraloría Interna de la Secretaría de Educación Guerrero.\nArtículo 12. La Secretaría de Educación Guerrero, a través del Departamento de Sistemas\nAbiertos, realizará las gestiones presupuestales necesarias para la operación y cumplimiento del programa.\nArtículo 13. El personal responsable de realizar las actividades operativas referentes al proceso de certificación, se contratará por honorarios y por tiempo determinado, para evitar el mal uso y manejo de información y documentación oficial. La relación laboral y las funciones a realizar, se darán por de Educación Guerrero.\nCAPÍTULO III\nDe la evaluación, acreditación y certificación\nArtículo 14. Las opciones de evaluación, acreditación y certificación se apegarán a lo estipulado en el artículo 60 de la Ley General de Educación, al Acuerdo número 445 por el que se conceptualizan y definen para la Educación Media Superior las opciones educativas en las diferentes modalidades, al\nAcuerdo número 450 por el que se establecen los Lineamientos que regulan los servicios que los\nRECURSOS FINANCIEROS POR EL DEPARTAMENTO\nDE SISTEMAS ABIERTOS DEPENDIENTE DE LA\nSUBSECRETARÍA DE EDUCACIÓN MEDIA SUPERIOR\nY SUPERIOR DE LA SECRETARÍA DE EDUCACIÓN\nGUERRERO particulares brindan en las distintas opciones educativas en el tipo medio superior, al Acuerdo número\n486 por el que se establecen las competencias disciplinares extendidas del Bachillerato General, al\nManual de Identidad Institucional del Gobierno Federal 2006-2012. Presidencia de la República, junio\n2007, al Manual de normas para el análisis y seguimiento de los documentos de certificación y resolución de equivalencias de estudios, Dirección General de Acreditación, Incorporación y Revalidación (DGAIR).\nDirección de Acreditación y Certificación, Marzo de 2009 y Convenios de transferencia de Preparatoria\nAbierta suscritos entre la Secretaría de Educación Pública y los Gobiernos de los Estados de la República\nMexicana.\nArtículo 15. Para regular los servicios a los centros de asesoría particulares que prestan los servicios educativos en esta modalidad, éstos estarán sujetos a los lineamientos establecidos por el\nAcuerdo número 450 por el que se establecen los Lineamientos que regulan los servicios que los particulares brindan en las distintas opciones educativas en el tipo medio superior.\nArtículo 16. Para la vigilancia, seguimiento y evaluación, se creará una Comisión integrada por representantes de la Subsecretaría de Educación Media Superior y Superior, Planeación Educativa y de\nAdministración y Finanzas, de la Secretaría de Educación Guerrero.\nPrimero. El presente Acuerdo entrará en vigor al día siguiente de su publicación en el Periódico\nOficial del Estado de Guerrero.\nSegundo. Para el cumplimiento, del presente Acuerdo se derivarán el Convenio de\nTransferencia y el Convenio Modificatorio de los Servicios Educativos del Nivel Medio Superior no escolarizados denominado Subsistema de Preparatoria Abierta, así como las Normas de Registro y\nControl, para Preparatoria Abierta y cuantos documentos sean necesarios.\nTercero. Los diferendos, acuerdos o desacuerdos y reglas de interpretación aplicables, se someterán a la decisión de los titulares de la Secretaría de Educación Pública, la Secretaría de\nBravo, Capital del Estado de Guerrero, a ocho días del mes de julio del año dos mil trece.\nEL GOBERNADOR CONSTITUCIONAL DEL ESTADO\nLIC. ÁNGEL HELADIO AGUIRRE RIVERO.\nRECURSOS FINANCIEROS POR EL DEPARTAMENTO\nDE SISTEMAS ABIERTOS DEPENDIENTE DE LA\nSUBSECRETARÍA DE EDUCACIÓN MEDIA SUPERIOR\nY SUPERIOR DE LA SECRETARÍA DE EDUCACIÓN\nGUERRERO\nEL SECRETARIO GENERAL DE GOBIERNO.\nDR. JESÚS MARTÍNEZ GARNELO.\nLA SECRETARIA DE EDUCACIÓN GUERRERO.\nPROFRA. SILVIA ROMERO SUÁREZ.",
  "ordenamiento": "ACUERDO",
  "jurisdiccion": "GUERRERO",
  "fuente_oficial": "DIARIO OFICIAL DE LA FEDERACION",
  "Fecha de Publicación": "13 de \nSeptiembre de 2013",
  "ULTIMA REFORMA PUBLICADA": "9 de febrero de 2012",
  "status": "VIGENTE",
  "es_escaneado": false,
  "tiene_tablas": false,
  "materia": [
    "general"
  ]
}