{
  "titulo": "Acuerdo por el Que Se Comisiona, Instruye y Se Delega Facultades A la Consejería Jurídica del Poder",
  "Contenido": "SEA NECESARIO, PROCEDA A REVISAR Y RECIBIR AQUELLOS\nDOCUMENTOS, EXPEDIENTES Y CONSTANCIAS QUE EL GOBERNADOR\nCONSTITUCIONAL SOLICITE PARA EVALUAR LA EFICIENCIA,\nHONORABILIDAD, CAPACIDAD, PROBIDAD, EXPEDITEZ,\nIMPARCIALIDAD, BUENA REPUTACIÓN, RECTITUD, CONSTANCIA,\nEXCELENCIA, PROFESIONALISMO, OBJETIVIDAD, INDEPENDENCIA Y\nANTIGÜEDAD DE SERVICIO DE LOS MAGISTRADOS QUE INTEGRAN EL\nPODER JUDICIAL DEL ESTADO DE GUERRERO Y DEL TRIBUNAL DE LO\nCONTENCIOSO ADMINISTRATIVO, Y DE ESA MANERA EXISTAN LAS\nCONDICIONES PARA QUE EL GOBERNADOR EMITA DICTAMEN\nEVALUATORIO, TENDIENTE A DETERMINAR EN EL MOMENTO\nOPORTUNO, SI PROCEDE RATIFICARLOS O NO EN EL CARGO\nCONFERIDO\nTEXTO ORIGINAL\nAcuerdo publicado en el Periódico Oficial del Gobierno del Estado No. 8, el viernes 27 de Enero de 2006.\nACUERDO POR EL QUE SE COMISIONA, INSTRUYE Y SE DELEGA FACULTADES A LA\nCONSEJERÍA JURÍDICA DEL PODER EJECUTIVO PARA QUE EN FORMA CONTINUA,\nPERMANENTE Y LAS VECES QUE SEA NECESARIO, PROCEDA A REVISAR Y RECIBIR AQUELLOS\nDOCUMENTOS, EXPEDIENTES Y CONSTANCIAS QUE EL GOBERNADOR CONSTITUCIONAL\nSOLICITE PARA EVALUAR LA EFICIENCIA, HONORABILIDAD, CAPACIDAD, PROBIDAD,\nEXPEDITEZ, IMPARCIALIDAD, BUENA REPUTACIÓN, RECTITUD, CONSTANCIA, EXCELENCIA,\nPROFESIONALISMO, OBJETIVIDAD, INDEPENDENCIA Y ANTIGÜEDAD DE SERVICIO DE LOS\nMAGISTRADOS QUE INTEGRAN EL PODER JUDICIAL DEL ESTADO DE GUERRERO Y DEL\nTRIBUNAL DE LO CONTENCIOSO ADMINISTRATIVO, Y DE ESA MANERA EXISTAN LAS\nCONDICIONES PARA QUE EL GOBERNADOR EMITA DICTAMEN EVALUATORIO, TENDIENTE A\nDETERMINAR EN EL MOMENTO OPORTUNO, SI PROCEDE RATIFICARLOS O NO EN EL CARGO\nCONFERIDO.\nGuerrero.- Poder Ejecutivo.\nCARLOS ZEFERINO TORREBLANCA GALINDO, GOBERNADOR CONSTITUCIONAL DEL\nFUNDAMENTO EN EL ARTÍCULO 6o. DE LA LEY ORGÁNICA DE LA ADMINISTRACIÓN PÚBLICA DEL\nESTADO DE GUERRERO NÚMERO 433, Y control y evaluación en el ámbito de la Administración Pública Estatal, que sea instrumento de promoción permanente de honestidad y eficacia de los servidores públicos. Por consiguiente, las actividades del\nSEA NECESARIO, PROCEDA A REVISAR Y RECIBIR AQUELLOS\nDOCUMENTOS, EXPEDIENTES Y CONSTANCIAS QUE EL GOBERNADOR\nCONSTITUCIONAL SOLICITE PARA EVALUAR LA EFICIENCIA,\nHONORABILIDAD, CAPACIDAD, PROBIDAD, EXPEDITEZ,\nIMPARCIALIDAD, BUENA REPUTACIÓN, RECTITUD, CONSTANCIA,\nEXCELENCIA, PROFESIONALISMO, OBJETIVIDAD, INDEPENDENCIA Y\nANTIGÜEDAD DE SERVICIO DE LOS MAGISTRADOS QUE INTEGRAN EL\nPODER JUDICIAL DEL ESTADO DE GUERRERO Y DEL TRIBUNAL DE LO\nCONTENCIOSO ADMINISTRATIVO, Y DE ESA MANERA EXISTAN LAS\nCONDICIONES PARA QUE EL GOBERNADOR EMITA DICTAMEN\nEVALUATORIO, TENDIENTE A DETERMINAR EN EL MOMENTO\nOPORTUNO, SI PROCEDE RATIFICARLOS O NO EN EL CARGO\nCONFERIDO jerárquicamente a partir de la Constitución Política de los Estados Unidos Mexicanos, Constitución Política\nLocal, Ley Orgánica de la Administración Pública del Estado y demás leyes reglamentarias.\n58, 75 y 76 la facultad del Gobernador del Estado, para delegar sus facultades a los titulares de las distintas Secretarías y Dependencias, que auxilian en las diversas tareas que tienen encomendadas.\nQue la Consejería Jurídica del Poder Ejecutivo, es el órgano técnico de asesoría del Gobernador del Estado y le corresponde entre otras facultades, la de dar apoyo técnico jurídico al Gobernador del\nEstado en todos aquellos asuntos que éste le encomiende.\nTomando en consideración la facultad que la fracción XXVI, del artículo 74 de la Constitución el Poder Judicial del Estado de Guerrero, del Consejo de la Judicatura y del Tribunal de lo Contencioso\nAdministrativo, y con la finalidad de llevar a cabo la evaluación en el desempeño de las funciones de los\nMagistrados mencionados, con fundamento en el artículo 116 fracción III de la Constitución Política de los\nEstados Unidos Mexicanos, que determina los requisitos que deben satisfacerse para el nombramiento de los Magistrados, así como para verificar de manera continua el desempeño de la alta función que tienen encomendada, y en atención al procedimiento previsto en el artículo 159 de la Ley Orgánica del Poder\nLegislativo del Estado de Guerrero Núm. 286; artículos 58, 74 fracción XXXIX, 75 y 76 de la Constitución\nLocal; 6o., 8o., 11, 12, 18 fracción I y párrafo quinto, 19, 20 fracción III y 37 fracciones II, IV y XIV de la Ley\nOrgánica de la Administración Pública del Estado de Guerrero Número 433; 7o. y 8o. fracciones II, XIV y\nXXVI del Reglamento Interior de la Consejería Jurídica del Poder Ejecutivo del Estado de Guerrero, comisiono, instruyo y delego facultades a la Consejería Jurídica del Poder Ejecutivo de Guerrero, para que en forma continua, permanente y las veces que sean necesarias, proceda a revisar y recibir aquellos documentos, expedientes y constancias que el suscrito Gobernador Constitucional solicite para evaluar la eficiencia, honorabilidad, capacidad, probidad, expeditez, imparcialidad, buena reputación, rectitud, constancia, excelencia, profesionalismo, objetividad, independencia y antigüedad de servicio de los\nAdministrativo, y de esa manera existan las condiciones para que el Gobernador emita dictamen evaluatorio, tendiente a determinar en el momento oportuno, si procede ratificarlos o no en el cargo conferido.\nPor lo anteriormente expuesto y fundado, he tenido a bien expedir el siguiente:\nSEA NECESARIO, PROCEDA A REVISAR Y RECIBIR AQUELLOS\nDOCUMENTOS, EXPEDIENTES Y CONSTANCIAS QUE EL GOBERNADOR\nCONSTITUCIONAL SOLICITE PARA EVALUAR LA EFICIENCIA,\nHONORABILIDAD, CAPACIDAD, PROBIDAD, EXPEDITEZ,\nIMPARCIALIDAD, BUENA REPUTACIÓN, RECTITUD, CONSTANCIA,\nEXCELENCIA, PROFESIONALISMO, OBJETIVIDAD, INDEPENDENCIA Y\nANTIGÜEDAD DE SERVICIO DE LOS MAGISTRADOS QUE INTEGRAN EL\nPODER JUDICIAL DEL ESTADO DE GUERRERO Y DEL TRIBUNAL DE LO\nCONTENCIOSO ADMINISTRATIVO, Y DE ESA MANERA EXISTAN LAS\nCONDICIONES PARA QUE EL GOBERNADOR EMITA DICTAMEN\nEVALUATORIO, TENDIENTE A DETERMINAR EN EL MOMENTO\nOPORTUNO, SI PROCEDE RATIFICARLOS O NO EN EL CARGO\nCONFERIDO\nACUERDO POR EL QUE SE COMISIONA, INSTRUYE Y SE DELEGA FACULTADES A LA\nCONSEJERÍA JURÍDICA DEL PODER EJECUTIVO PARA QUE EN FORMA CONTINUA,\nPERMANENTE Y LAS VECES QUE SEA NECESARIO, PROCEDA A REVISAR Y RECIBIR AQUELLOS\nDOCUMENTOS, EXPEDIENTES Y CONSTANCIAS QUE EL GOBERNADOR CONSTITUCIONAL\nSOLICITE PARA EVALUAR LA EFICIENCIA, HONORABILIDAD, CAPACIDAD, PROBIDAD,\nEXPEDITEZ, IMPARCIALIDAD, BUENA REPUTACIÓN, RECTITUD, CONSTANCIA, EXCELENCIA,\nPROFESIONALISMO, OBJETIVIDAD, INDEPENDENCIA Y ANTIGÜEDAD DE SERVICIO DE LOS\nMAGISTRADOS QUE INTEGRAN EL PODER JUDICIAL DEL ESTADO DE GUERRERO Y DEL\nTRIBUNAL DE LO CONTENCIOSO ADMINISTRATIVO, Y DE ESA MANERA EXISTAN LAS\nCONDICIONES PARA QUE EL GOBERNADOR EMITA DICTAMEN EVALUATORIO, TENDIENTE A\nDETERMINAR EN EL MOMENTO OPORTUNO, SI PROCEDE RATIFICARLOS O NO EN EL CARGO\nCONFERIDO.\nARTÍCULO ÚNICO.- Se comisiona e instruye a la Consejería Jurídica del Poder Ejecutivo, para que en forma continua, permanente y las veces que sean necesarias, proceda a revisar y recibir aquellos documentos, expedientes y constancias que el suscrito Gobernador Constitucional solicite para evaluar la eficiencia, honorabilidad, capacidad, probidad, expeditez, imparcialidad, buena reputación, rectitud, constancia, excelencia, profesionalismo, objetividad, independencia y antigüedad de servicio de los\nAdministrativo, y de esa manera existan las condiciones para que el Gobernador emita dictamen evaluatorio, tendiente a determinar en el momento oportuno, si procede ratificarlos o no en el cargo conferido.\nPRIMERO.- El presente Acuerdo entrará en vigor a partir de la fecha de su expedición.\nCapital del Estado de Guerrero, a primero del mes de enero del año dos mil seis.\nSEA NECESARIO, PROCEDA A REVISAR Y RECIBIR AQUELLOS\nDOCUMENTOS, EXPEDIENTES Y CONSTANCIAS QUE EL GOBERNADOR\nCONSTITUCIONAL SOLICITE PARA EVALUAR LA EFICIENCIA,\nHONORABILIDAD, CAPACIDAD, PROBIDAD, EXPEDITEZ,\nIMPARCIALIDAD, BUENA REPUTACIÓN, RECTITUD, CONSTANCIA,\nEXCELENCIA, PROFESIONALISMO, OBJETIVIDAD, INDEPENDENCIA Y\nANTIGÜEDAD DE SERVICIO DE LOS MAGISTRADOS QUE INTEGRAN EL\nPODER JUDICIAL DEL ESTADO DE GUERRERO Y DEL TRIBUNAL DE LO\nCONTENCIOSO ADMINISTRATIVO, Y DE ESA MANERA EXISTAN LAS\nCONDICIONES PARA QUE EL GOBERNADOR EMITA DICTAMEN\nEVALUATORIO, TENDIENTE A DETERMINAR EN EL MOMENTO\nOPORTUNO, SI PROCEDE RATIFICARLOS O NO EN EL CARGO\nCONFERIDO\nEL GOBERNADOR CONSTITUCIONAL DEL ESTADO.\nC.P. CARLOS ZEFERINO TORREBLANCA GALINDO.\nEL SECRETARIO GENERAL DE GOBIERNO.\nLIC. ARMANDO CHAVARRÍA BARRERA.",
  "ordenamiento": "ACUERDO",
  "jurisdiccion": "GUERRERO",
  "fuente_oficial": "DIARIO OFICIAL DE LA FEDERACION",
  "Fecha de Publicación": "27 de Enero \nde 2006",
  "ULTIMA REFORMA PUBLICADA": null,
  "status": "VIGENTE",
  "es_escaneado": false,
  "tiene_tablas": false,
  "materia": [
    "general"
  ]
}