{
  "titulo": "Acuerdo del Consejo de Premiación Que Prorroga los Plazos Hasta el Día Veinte de Octubre del Año Dos",
  "Contenido": "ACUERDO DEL CONSEJO DE PREMIACIÓN QUE\nPRORROGA LOS PLAZOS HASTA EL DÍA VEINTE DE\nOCTUBRE DEL AÑO DOS MIL DIECISIETE, PARA LA\nENTREGA DE PROPUESTAS DE CANDIDATOS PARA\nRECIBIR CONDECORACIONES O PREMIOS CIVILES Y\nHASTA EL 24 DE OCTUBRE DEL MISMO AÑO, PARA\nDAR A CONOCER LOS RESULTADOS\nTEXTO ORIGINAL.\nAcuerdo publicado en el Periódico Oficial del Gobierno del Estado No. 82 Alcance I, el Viernes 13 de Octubre de 2017.\nACUERDO DEL CONSEJO DE PREMIACIÓN QUE PRORROGA LOS PLAZOS HASTA EL DÍA VEINTE\nDE OCTUBRE DEL AÑO DOS MIL DIECISIETE, PARA LA ENTREGA DE PROPUESTAS DE\nCANDIDATOS PARA RECIBIR CONDECORACIONES O PREMIOS CIVILES Y HASTA EL 24 DE\nOCTUBRE DEL MISMO AÑO, PARA DAR A CONOCER LOS RESULTADOS.\nEn la Ciudad de Chilpancingo de los Bravo, capital del Estado de Guerrero, a los doce días del mes de octubre del año dos mil diecisiete.\nACUERDO. Con el objeto de brindar más oportunidad a participantes y continuar recepcionando propuestas de candidatos para participar en la entrega de condecoraciones y premios civiles que establece la Ley de Premios Civiles del Estado de Guerrero número 434, el Consejo de Premiación acordó prorrogar el plazo señalado en el inciso G), hasta el día veinte de octubre del presente año. Así como ampliar el plazo de la entrega de resultados señalado en el inciso H), hasta el veinticuatro de octubre del mismo año, de la convocatoria de fecha catorce de septiembre del año dos mil diecisiete; en consecuencia, publíquese el circulación, para conocimiento de la ciudadanía en general. Asimismo, notifíquese el presente Acuerdo a los integrantes del Jurado Calificador de las Condecoraciones y Premios Civiles, para los efectos legales a que haya lugar.\nConsejo que da fe.",
  "ordenamiento": "ACUERDO",
  "jurisdiccion": "GUERRERO",
  "fuente_oficial": "DIARIO OFICIAL DE LA FEDERACION",
  "Fecha de Publicación": "13 \nde Octubre de 2017",
  "ULTIMA REFORMA PUBLICADA": null,
  "status": "VIGENTE",
  "es_escaneado": false,
  "tiene_tablas": false,
  "materia": [
    "general"
  ]
}