{
  "titulo": "Acuerdo por el Que Se Autoriza A la Secretaría de Finanzas y Administración, para Convocar y Contrat",
  "Contenido": "CONTRATAR OBRA PÚBLICA Y SUS SERVICIOS,\nPARA LLEVAR A CABO LA CONSTRUCCIÓN DE\nNUEVAS OFICINAS DE GOBIERNO EN EL\nESTADO DE GUERRERO\nTEXTO ORIGINAL\nAcuerdo publicado en el Periódico Oficial del Gobierno del Estado No. 13 Alcance\nI, el Viernes 12 de Febrero de 2010.\nACUERDO POR EL QUE SE AUTORIZA A LA SECRETARÍA DE FINANZAS Y\nADMINISTRACIÓN, PARA CONVOCAR Y CONTRATAR OBRA PÚBLICA Y SUS\nSERVICIOS, PARA LLEVAR A CABO LA CONSTRUCCIÓN DE NUEVAS OFICINAS\nDE GOBIERNO EN EL ESTADO DE GUERRERO.\nAl margen un sello con el Escudo Oficial que dice: Gobierno del Estado Libre y\nSoberano de Guerrero.- Poder Ejecutivo.\nCARLOS ZEFERINO TORREBLANCA GALINDO, GOBERNADOR\nFUNDAMENTO EN EL ARTÍCULO 74, FRACCIONES IV Y XXXIX, DE LA\nCONFIEREN LOS ARTÍCULOS 2; 3; 6; 7; 10; 20 Y 22 DE LA LEY ORGÁNICA DE LA\nADMINISTRACIÓN PÚBLICA DEL ESTADO Y 1, FRACCIÓN I; 2 FRACCIÓN III; 10 Y\n26 DE LA LEY OBRAS PÚBLICAS Y SUS SERVICIOS DEL ESTADO DE GUERRERO\nNÚMERO 266, Y\nQue el Plan Estatal de Desarrollo 2005-2011, contempla como objetivo, modernizar y agilizar las actividades administrativas y de gestión pública, teniendo como organización, operación y gestión gubernamental cumpla con la función primaria de servir plenamente a la ciudadanía, con calidad, eficiencia, confiabilidad y cercanía.\nCONTRATAR OBRA PÚBLICA Y SUS SERVICIOS,\nPARA LLEVAR A CABO LA CONSTRUCCIÓN DE\nNUEVAS OFICINAS DE GOBIERNO EN EL\nESTADO DE GUERRERO para el despacho de los asuntos que le competen, se auxiliará y delegará facultades a las dependencias y entidades que dichos ordenamientos legales le señalan.\nQue con fecha 23 de julio de 2004, se publicó en el Periódico Oficial del Gobierno del Estado número 61, la Ley de Obras Públicas y sus Servicios del Estado de Guerrero número 266, que tiene como objeto regular las acciones relativas a la planeación, programación, presupuestación, contratación, gasto, ejecución y control de las obras públicas, así como de los servicios relacionados con las mismas que realicen las\nDependencias y Entidades de la Administración Pública Centralizada y Paraestatal.\nQue para cumplir con esta misión, se apoya en instrumentos más consistentes, como lo son las políticas de desarrollo urbano y los ejercicios de la obra pública, con el objeto de promover un desarrollo social más equitativo, propiciar una distribución de las riquezas más justas y alentar la convivencia comunitaria que se traduzca en la participación de todos.\nQue para el éxito de las funciones es materia de obra pública, éstas se contextualizan en el marco de un plano de legalidad y transparencia, condiciones que brindan la observancia y el estricto cumplimiento a lo dispuesto por las leyes, normas, planes y programas que nos rigen en materia de obra pública, mismas que establecen las atribuciones y facultades de las autoridades, sus ámbitos de competencia, las formas de concurrencia y coordinación. infraestructura con la que actualmente opera, por ello autoriza a la Secretaría de\nFinanzas y Administración, para convocar y contratar obra publica y sus servicios, para llevar a cabo la construcción de oficinas de gobierno en lugares estratégicos, que representatividad en los puntos importantes del territorio, contando con sedes de fácil acceso a la comunidad que así lo requiera.\nCONTRATAR OBRA PÚBLICA Y SUS SERVICIOS,\nPARA LLEVAR A CABO LA CONSTRUCCIÓN DE\nNUEVAS OFICINAS DE GOBIERNO EN EL\nESTADO DE GUERRERO\nPor todo lo anteriormente expuesto y fundado, he tenido a bien expedir el siguiente:\nACUERDO POR EL QUE SE AUTORIZA A LA SECRETARÍA DE FINANZAS Y\nADMINISTRACIÓN, PARA CONVOCAR Y CONTRATAR OBRA PÚBLICA Y SUS\nSERVICIOS, PARA LLEVAR A CABO LA CONSTRUCCIÓN DE NUEVAS OFICINAS\nDE GOBIERNO EN EL ESTADO DE GUERRERO.\nARTÍCULO PRIMERO.- Se autoriza a la Secretaría de Finanzas y Administración, para convocar y contratar obra pública y sus servicios, para llevar a cabo la construcción de nuevas oficinas de gobierno en el Estado de Guerrero.\nARTÍCULO SEGUNDO.- Para los efectos del artículo anterior, la Secretaría de\nFinanzas y Administración, se coordinará con la Secretaría de Desarrollo Urbano y Obras\nPúblicas y demás dependencias de gobierno, que tengan relación con el objeto de dicho\nAcuerdo.\nARTÍCULO TERCERO.- La Secretaría de Finanzas y Administración, podrá contratar obra pública y sus servicios, ajustándose a los lineamientos y procedimientos\nEstado de Guerrero.\nÚNICO.- El presente Acuerdo entrará en vigor al día siguiente de su publicación\nChilpancingo, Capital del Estado de Guerrero, a los nueve días del mes de febrero del año dos mil diez.\nCONTRATAR OBRA PÚBLICA Y SUS SERVICIOS,\nPARA LLEVAR A CABO LA CONSTRUCCIÓN DE\nNUEVAS OFICINAS DE GOBIERNO EN EL\nESTADO DE GUERRERO\nEL GOBERNADOR CONSTITUCIONAL DEL ESTADO DE GUERRERO.\nC.P. CARLOS ZEFERINO TORREBLANCA GALINDO.\nEL SECRETARIO GENERAL DE GOBIERNO.\nLIC. GUILLERMO RAMÍREZ RAMOS.\nEL SECRETARIO DE FINANZAS Y ADMINISTRACIÓN.\nL.A.E. RICARDO E. CABRERA MORIN.",
  "ordenamiento": "ACUERDO",
  "jurisdiccion": "GUERRERO",
  "fuente_oficial": "DIARIO OFICIAL DE LA FEDERACION",
  "Fecha de Publicación": "12 de Febrero de 2010",
  "ULTIMA REFORMA PUBLICADA": null,
  "status": "VIGENTE",
  "es_escaneado": false,
  "tiene_tablas": false,
  "materia": [
    "general"
  ]
}