{
  "titulo": "Acuerdo Administrativo por el Cual Se Deja Sin Efecto Legal Alguno el Documento Denominado “título D",
  "Contenido": "A AUTOPISTA DE GUERRERO, S.A. DE C.V. PARA LA\n“CONSTRUCCIÓN, EXPLOTACIÓN Y CONSERVACIÓN\nDEL VIADUCTO LA VENTA-PUNTA DIAMANTE” DE\nADELANTE LA CONCESIÓN SE REGIRÁ ÚNICAMENTE\nY PARA TODOS LOS EFECTOS LEGALES A QUE\nHAYA LUGAR POR EL INSTRUMENTO JURÍDICO\nDENOMINADO “TITULO DE CONCESIÓN” OTORGADO\nA “GRUPO MEXICANO DE DESARROLLO”, S.A.,\nQUIEN LO EJERCE POR CONDUCTO DE SU EMPRESA\nFILIAL AUTOPISTAS DE GUERRERO, S.A. DE C.V.\nTEXTO ORIGINAL\nAcuerdo publicado en el Periódico Oficial del Gobierno del Estado No. 50, el\nViernes 23 de Junio de 2006.\nACUERDO ADMINISTRATIVO POR EL CUAL SE DEJA SIN EFECTO LEGAL\nALGUNO EL DOCUMENTO DENOMINADO “TÍTULO DE CONCESIÓN” OTORGADO\nA AUTOPISTA DE GUERRERO, S.A. DE C.V. PARA LA “CONSTRUCCIÓN,\nEXPLOTACIÓN Y CONSERVACIÓN DEL VIADUCTO LA VENTA-PUNTA DIAMANTE”\nDE FECHA 9 DE OCTUBRE DE 1991, POR LO QUE EN ADELANTE LA CONCESIÓN\nSE REGIRÁ ÚNICAMENTE Y PARA TODOS LOS EFECTOS LEGALES A QUE HAYA\nLUGAR POR EL INSTRUMENTO JURÍDICO DENOMINADO “TÍTULO DE\nCONCESIÓN” OTORGADO A “GRUPO MEXICANO DE DESARROLLO”, S.A., QUIEN\nLO EJERCE POR CONDUCTO DE SU EMPRESA FILIAL AUTOPISTAS DE\nGUERRERO, S.A. DE C.V.\nChilpancingo, Guerrero, a 14 de febrero del año 2006.- El C. Gobernador\nConstitucional del Estado de Guerrero, en mi carácter de Jefe de Estado, Jefe de\nGobierno, Jefe de la Administración Pública y Titular del Ejecutivo del Estado de\nGuerrero, tiene por recibido la solicitud de Cancelación y Extinción del Título de\nConcesión, que piden los CC. Manuel Gómez Daza Rangel y Jorge Eduardo Ballesteros\nZavala como apoderados de Autopistas de Guerrero S.A. de C.V.; así como los CC.\nMexicano de Desarrollo S.A. de C.V. Personalidad que acreditan en los términos de la\nEscritura Pública Número 7,448, de fecha 21 de septiembre del 2004 otorgada ante\nNotario Público No. 231 de Distrito Federal y Escritura Pública Número 7,566, de fecha\nA AUTOPISTA DE GUERRERO, S.A. DE C.V. PARA LA\n“CONSTRUCCIÓN, EXPLOTACIÓN Y CONSERVACIÓN\nDEL VIADUCTO LA VENTA-PUNTA DIAMANTE” DE\nADELANTE LA CONCESIÓN SE REGIRÁ ÚNICAMENTE\nY PARA TODOS LOS EFECTOS LEGALES A QUE\nHAYA LUGAR POR EL INSTRUMENTO JURÍDICO\nDENOMINADO “TITULO DE CONCESIÓN” OTORGADO\nA “GRUPO MEXICANO DE DESARROLLO”, S.A.,\nQUIEN LO EJERCE POR CONDUCTO DE SU EMPRESA\nFILIAL AUTOPISTAS DE GUERRERO, S.A. DE C.V. con copia certificada notarial del documento que contiene las facultades de los representantes de la Empresa Grupo Mexicano de Desarrollo de fecha 20 de enero del\n2005, elaborada para documentar la Escritura Pública 7,770 pasada ante la fe de Notario\nPúblico 231 del Distrito Federal, así como certificación notarial que contiene las facultades de los representantes de la Empresa Autopistas de Guerrero S. A. de C.V., de fecha 26 de enero de 2004, elaborado para documentar la Escritura Pública Número\n6,718 pasa ante la fe del Notario Público 231 del Distrito Federal, y en virtud, de que con dichos documentos acreditan la representación que obstentan, y las facultades para solicitar la extinción de título de concesión otorgado por el Gobierno del Estado de\nGuerrero a Autopistas de Guerrero S.A. de C.V. el 9 de octubre de 1991, para que construya, explote y conserve el Viaducto La Venta-Punta Diamante, y por las razones que se exponen en dicha solicitud, con fundamento en los artículos 74 fracciones XXX y\nOrgánica de la Administración Pública del Estado de Guerrero así como en el Artículo 50 fracción III de la Ley que Establece las Bases para el Régimen de Permisos, Licencias y\nConcesiones para la Prestación de Servicios Públicos y Explotación y Aprovechamiento de Bienes de Dominio del Estado y los Ayuntamientos, procédase a dictar la resolución administrativa de extinción del título que consigna la concesión en comento, otorgada en favor de Autopistas de Guerrero S.A. de C.V. Así lo acordó el C.P. Carlos Zeferino\nTorreblanca Galindo, Gobernador Constitucional del Estado de Guerrero ante la intervención del Lic. Armando Chavarría Barrera, Secretario General del Gobierno del\nEstado de Guerrero. NOTIFIQUESE el presente acuerdo a los solicitantes, Grupo\nMexicano de Desarrollo S.A., y Autopistas de Guerrero S.A. de C.V.- Rúbricas.\nEn la Ciudad de Chilpancingo de los Bravo, Guerrero, Capital del Estado Libre y\nGuerrero procede a dictar la siguiente resolución de extinción, con fundamento en el\nA AUTOPISTA DE GUERRERO, S.A. DE C.V. PARA LA\n“CONSTRUCCIÓN, EXPLOTACIÓN Y CONSERVACIÓN\nDEL VIADUCTO LA VENTA-PUNTA DIAMANTE” DE\nADELANTE LA CONCESIÓN SE REGIRÁ ÚNICAMENTE\nY PARA TODOS LOS EFECTOS LEGALES A QUE\nHAYA LUGAR POR EL INSTRUMENTO JURÍDICO\nDENOMINADO “TITULO DE CONCESIÓN” OTORGADO\nA “GRUPO MEXICANO DE DESARROLLO”, S.A.,\nQUIEN LO EJERCE POR CONDUCTO DE SU EMPRESA\nFILIAL AUTOPISTAS DE GUERRERO, S.A. DE C.V. artículo 50 fracción III de la Ley que Establece las Bases para el Régimen de Permisos, Licencias y Concesiones para la Prestación de Servicios Públicos y Explotación y\nAprovechamiento de Bienes de Dominio del Estado y los Ayuntamientos, en atención a la solicitud formulada por los CC. Manuel Daza Rangel y Jorge Eduardo Ballesteros Zavala, apoderados de Autopista de Guerrero S.A de C.V. Manuel Gómez Daza Rangel y José\nLuis Olvera Caballero apoderados de Grupo Mexicano de Desarrollo, la cual se dicta bajo el siguiente:\nRESULTANDO\n1.- Por escrito de fecha 8 de febrero de 2006, los CC. Manuel Gómez Daza\nRangel y Jorge Eduardo Ballesteros Zavala como apoderados de Autopistas de Guerrero\nS.A. de C.V.; así como los CC. Manuel Gómez Daza Rangel y José Luis Olvera\nCaballero apoderados de Grupo Mexicano de Desarrollo S.A. de C.V. Personalidad que acreditan en los términos de la Escritura Pública número 7,448, de fecha 21 de septiembre del 2004 otorgada ante el Notario Público No. 231 de Distrito Federal y\nEscritura Pública número 7,566, de fecha 27 de octubre de 1994 otorgada ante el Notario\nPúblico 231 del Distrito Federal, así como con copia certificada notarial del documento\nDesarrollo de fecha 20 de enero del 2005, elaborada para documentar la Escritura\nPública No. 7,770 pasada ante la fe de Notario Público 231 del Distrito Federal, así como\nAutopistas de Guerrero S. A. de C.V., de fecha 26 de enero del 2004, elaborado para documentar la Escritura Pública No. 6,718 pasa ante la fe del Notario Público No. 231 del\nDistrito Federal, solicitaron al C. Gobernador Constitucional del Estado de Guerrero, la\nA AUTOPISTA DE GUERRERO, S.A. DE C.V. PARA LA\n“CONSTRUCCIÓN, EXPLOTACIÓN Y CONSERVACIÓN\nDEL VIADUCTO LA VENTA-PUNTA DIAMANTE” DE\nADELANTE LA CONCESIÓN SE REGIRÁ ÚNICAMENTE\nY PARA TODOS LOS EFECTOS LEGALES A QUE\nHAYA LUGAR POR EL INSTRUMENTO JURÍDICO\nDENOMINADO “TITULO DE CONCESIÓN” OTORGADO\nA “GRUPO MEXICANO DE DESARROLLO”, S.A.,\nQUIEN LO EJERCE POR CONDUCTO DE SU EMPRESA\nFILIAL AUTOPISTAS DE GUERRERO, S.A. DE C.V.\nGuerrero a Autopistas de Guerrero S.A. de C. V. el 9 de octubre de 1991, para que construya, explote y conserve el Viaducto La Venta-Punta Diamante.\nPor lo que,\nCONSIDERANDO\nI.- El C. Gobernador del Estado funda su competencia y faculdades para emitir la presente resolución en lo dispuesto por los artículos 58, 74 fracción XX y XXXV\nEstablece las Bases para el Régimen de Permisos, Licencias y Concesiones para la\nPrestación de Servicios Públicos y Explotación y Aprovechamiento de Bienes de Dominio del Estado y los Ayuntamientos.\nII.- El Gobierno del Estado y CICAEG: que la Concesión para la\n“construcción, explotación y conservación del Viaducto La Venta-Punta Diamante” (en correcto cumplimiento de las condiciones establecidas en términos de la construcción, explotación y conservación del Viaducto, conforme fue el propósito establecido para su otorgamiento en beneficio del interés público tutelado y de los usuarios que lo transitan. denominados “Títulos de Concesión” suscritos en la misma fecha, idénticos en sus condiciones y por el mismo objeto (la construcción, explotación y conservación del\nViaducto La Venta-Punta Diamante), otorgados, uno a “Grupo Mexicano de Desarrollo,\nA AUTOPISTA DE GUERRERO, S.A. DE C.V. PARA LA\n“CONSTRUCCIÓN, EXPLOTACIÓN Y CONSERVACIÓN\nDEL VIADUCTO LA VENTA-PUNTA DIAMANTE” DE\nADELANTE LA CONCESIÓN SE REGIRÁ ÚNICAMENTE\nY PARA TODOS LOS EFECTOS LEGALES A QUE\nHAYA LUGAR POR EL INSTRUMENTO JURÍDICO\nDENOMINADO “TITULO DE CONCESIÓN” OTORGADO\nA “GRUPO MEXICANO DE DESARROLLO”, S.A.,\nQUIEN LO EJERCE POR CONDUCTO DE SU EMPRESA\nFILIAL AUTOPISTAS DE GUERRERO, S.A. DE C.V.\nS.A., quien la ejerce por conducto de su empresa filial Autopistas de Guerrero, S.A. de\nC.V.” (Anexo Uno), y otro expedido en favor de la misma “Autopistas de Guerrero, S.A. de C.V.” (Anexo Dos), ambos otorgados por las mismas autoridades concedentes y a un mismo efecto.\nIV.- El Gobierno del Estado y CICAEG: que AGSA, como la sociedad del proyecto y en consecución de su objeto social, es quien ha dado cumplimiento a la totalidad de los términos y condiciones de la Concesión, y en esa circunstancia fue quien obtuvo los créditos al proyecto y aportó el capital de riesgo y así mismo, resulta ser la responsable de la operación y conservación del Viaducto concesionado.\nV.- El Gobierno del Estado, GMD y AGSA: que la economía financiera de la\nConcesión es una sola y ésta ha recaído y recae únicamente en AGSA, lo que ha permitido que a su única solicitud se haya otorgado por el Gobierno del Estado en fecha 16 de junio de 2004, contando para ello con la aprobación del H. Congreso del\nEstado, un “Adendum” al Título de Concesión para la Construcción, Explotación y\nConservación del Viaducto La Venta-Punta Diamante”, a GMD para ser ejercido por su filial AGSA, lo que en sí es un refrendo que convalida su existencia y como el documento por el que se rige la Concesión y los actos que le son inherentes y los que le derivan. única e indivisible, que la ha ejercido y ejerce AGSA a título de concesionaria así y ha sido reconocida por las autoridades concedentes. GMD no ha ejercido por sí ningún ella frente a terceros.\nA AUTOPISTA DE GUERRERO, S.A. DE C.V. PARA LA\n“CONSTRUCCIÓN, EXPLOTACIÓN Y CONSERVACIÓN\nDEL VIADUCTO LA VENTA-PUNTA DIAMANTE” DE\nADELANTE LA CONCESIÓN SE REGIRÁ ÚNICAMENTE\nY PARA TODOS LOS EFECTOS LEGALES A QUE\nHAYA LUGAR POR EL INSTRUMENTO JURÍDICO\nDENOMINADO “TITULO DE CONCESIÓN” OTORGADO\nA “GRUPO MEXICANO DE DESARROLLO”, S.A.,\nQUIEN LO EJERCE POR CONDUCTO DE SU EMPRESA\nFILIAL AUTOPISTAS DE GUERRERO, S.A. DE C.V.\nVII.- GMD y AGSA: que consideran conveniente que el Gobierno del Estado, mediante acto de autoridad debidamente fundado y motivado, resuelva la duplicidad de instrumentos jurídicos que son a un mismo efecto, dejando intocada la Concesión, de manera que en adelante a ésta se le relacione únicamente con el Título de Concesión otorgado a GMD para ser ejercido por AGSA.\nVIII.- El Gobierno del Estado: que cuenta con facultades conforme a la Ley de la materia, en la especie la “Ley que Establece las Bases para el Régimen de Permisos, Licencias y Concesiones para la Prestación de Servicios Públicos y la Explotación y\nAprovechamiento de Bienes de Dominio Público del Estado y los Ayuntamientos”, en adelante y para efectos del presente instrumento, la Ley en la materia.\nGuerrero, faculta al C. Gobernador Constitucional para otorgar y cancelar concesión de\nServicios Públicos Estatales; y el artículo 50 fracción III permite la extinción de un Título que consigna una concesión, por consentimiento expreso del concesionante (Gobierno del Estado de Guerrero) y la Concesionaria (Autopistas de Guerrero S.A. de C.V.,) al acuerdo administrativo del C. Gobernador extinguir el título de concesión de referencia, bajo el siguiente: que expresamente le atribuye el Artículo 49 Fracción I de la Ley en la materia, en este\nA AUTOPISTA DE GUERRERO, S.A. DE C.V. PARA LA\n“CONSTRUCCIÓN, EXPLOTACIÓN Y CONSERVACIÓN\nDEL VIADUCTO LA VENTA-PUNTA DIAMANTE” DE\nADELANTE LA CONCESIÓN SE REGIRÁ ÚNICAMENTE\nY PARA TODOS LOS EFECTOS LEGALES A QUE\nHAYA LUGAR POR EL INSTRUMENTO JURÍDICO\nDENOMINADO “TITULO DE CONCESIÓN” OTORGADO\nA “GRUPO MEXICANO DE DESARROLLO”, S.A.,\nQUIEN LO EJERCE POR CONDUCTO DE SU EMPRESA\nFILIAL AUTOPISTAS DE GUERRERO, S.A. DE C.V.\nACUERDO ADMINISTRATIVO\nÚNICO: A fin de otorgar estabilidad y certeza jurídica en la ejecución de la\nConcesión y respecto de los actos que le derivan frente a terceros y con el consentimiento de Grupo Mexicano de Desarrollo S.A. y Autopistas de Guerrero S.A. de\nC.V. en este acto se extingue y deja sin efecto legal alguno el documento denominado\n“Título de Concesión” otorgado a Autopista de Guerrero S.A. de C.V. para la\n“Construcción, Explotación y Conservación del Viaducto La Venta-Punta Diamante” de fecha 9 de octubre de 1991, por lo que en adelante la Concesión se regirá únicamente y para todos los efectos legales a que haya lugar por el instrumento jurídico denominado\n“Título de Concesión” otorgado a “Grupo Mexicano de Desarrollo, S.A., quien la ejerce por conducto de su empresa filial Autopistas de Guerrero, S.A. de C.V., a quien se le denominará “la Concesionaria” y cualquier referencia en el pasado al documento que por este acto se extingue, se entenderá realizado y conferido en el denominado “Título de\nConcesión” otorgado a “Grupo Mexicano de Desarrollo, S.A., quien la ejerce por conducto de su empresa filial Autopistas de Guerrero, S.A. de C.V., a quien se le denominará “la Concesionaria”, el que permanece intocado en sus condiciones, surtiendo\nAsí lo resolvió administrativamente el C.P. Carlos Zeferino Torreblanca Galindo\nLic. Armando Chavarría Barrera, Secretario General del Estado de Guerrero, quien da fe y refrenda a los veintitrés días del mes de febrero del año 2006, Chilpancingo, Guerrero, en Palacio de Gobierno.\nA AUTOPISTA DE GUERRERO, S.A. DE C.V. PARA LA\n“CONSTRUCCIÓN, EXPLOTACIÓN Y CONSERVACIÓN\nDEL VIADUCTO LA VENTA-PUNTA DIAMANTE” DE\nADELANTE LA CONCESIÓN SE REGIRÁ ÚNICAMENTE\nY PARA TODOS LOS EFECTOS LEGALES A QUE\nHAYA LUGAR POR EL INSTRUMENTO JURÍDICO\nDENOMINADO “TITULO DE CONCESIÓN” OTORGADO\nA “GRUPO MEXICANO DE DESARROLLO”, S.A.,\nQUIEN LO EJERCE POR CONDUCTO DE SU EMPRESA\nFILIAL AUTOPISTAS DE GUERRERO, S.A. DE C.V.\nC.P. Carlos Zeferino Torreblanca Galindo.\nGobernador Constitucional del Estado de Guerrero.\nLic. Armando Chavarría Barrera.\nSecretario General de Gobierno.",
  "ordenamiento": "ACUERDO",
  "jurisdiccion": "GUERRERO",
  "fuente_oficial": "DIARIO OFICIAL DE LA FEDERACION",
  "Fecha de Publicación": "9 DE OCTUBRE DE 1991",
  "ULTIMA REFORMA PUBLICADA": null,
  "status": "VIGENTE",
  "es_escaneado": false,
  "tiene_tablas": false,
  "materia": [
    "administrativo"
  ]
}