{
  "titulo": "Acuerdo por el Que Se Da A Conocer la Distribución de los Recursos del Fondo de Aportaciones para la",
  "Contenido": "MUNICIPAL, ENTRE LOS MUNICIPIOS DEL ESTADO DE\nGUERRERO PARA EL EJERCICIO FISCAL 2018\nTEXTO ORIGINAL\nACUERDO POR EL QUE SE DA A CONOCER LA DISTRIBUCION DE LOS RECURSOS DEL FONDO\nDE APORTACIONES PARA LA INFRAESTRUCTURA SOCIAL MUNICIPAL, ENTRE LOS MUNICIPIOS\nDEL ESTADO DE GUERRERO PARA EL EJERCICIO FISCAL 2018.\nPoder Ejecutivo.\nLICENCIADO HÉCTOR ANTONIO ASTUDILLO FLORES, GOBERNADOR CONSTITUCIONAL DEL\nESTADO DE GUERRERO, CON FUNDAMENTO EN LO DISPUESTO POR LOS ARTÍCULOS 90\nNUMERAL 2 Y 91 FRACCIONES XXIII, XXIX, XLIV Y XLVI DE LA CONSTITUCION POLÍTICA DEL\nCONFIEREN LOS ARTÍCULOS 1, 3, 4 PÁRRAFO SEGUNDO, 8, 18 APARTADO A FRACCIONES I, II,\nIII y IV, 20, 21, 22 y 23 DE LA LEY ORGÁNICA DE LA ADMINISTRACIÓN PÚBLICA DEL ESTADO DE\nGUERRERO NÚMERO 08; 1, 12, 13, 14, 27 FRACCIÓN VII, 30, 34 Y 35 DE LA LEY NÚMERO 994 DE\nFRACCIÓN I, 44 Y 45 DE LA LEY NÚMERO 427 DEL SISTEMA DE COORDINACIÓN HACENDARIA\nDEL ESTADO DE GUERRERO; EN CONCORDANCIA CON LO DISPUESTO POR LOS ARTÍCULOS 25,\n26 Y 115 DE LA CONSTITUCIÓN POLÍTICA DE LOS ESTADOS UNIDOS MEXICANOS; 27, 31 Y 32 DE\nLA LEY ORGÁNICA DE LA ADMINISTRACIÓN PÚBLICA FEDERAL; 33, 34, 35 Y 44 DE LA LEY DE\nPLANEACIÓN; 25, 32, 33, 34 Y 35 DE LA LEY DE COORDINACIÓN FISCAL Y 9 DEL PRESUPUESTO\nDE EGRESOS DE LA FEDERACIÓN PARA EL EJERCICIO FISCAL 2018; Y\nQue el Presupuesto de Egresos de la Federación para el Ejercicio Fiscal 2018, prevé recursos en el Ramo\n33 Aportaciones Federales para Entidades Federativas y Municipios, para el Fondo de Aportaciones para la Infraestructura Social Municipal. establecida en el artículo 34 de dicha Ley.\nQue la misma Ley de Coordinación Fiscal establece que los Estados deben publicar antes del 31 de enero de cada ejercicio fiscal, previo convenio con la Secretaría de Desarrollo Social, la distribución municipal del\nFondo de Aportaciones para la Infraestructura Social Municipal, así como la fórmula y metodología aplicada, justificando cada uno de sus elementos.\nMUNICIPAL, ENTRE LOS MUNICIPIOS DEL ESTADO DE\nGUERRERO PARA EL EJERCICIO FISCAL 2018\nQue la fórmula debe ser igual a la indicada en la mencionada Ley, con el propósito de enfatizar el carácter extrema.\nPor lo anteriormente expuesto y fundado, he tenido a bien expedir el siguiente:\nACUERDO POR EL QUE SE DA A CONOCER LA DISTRIBUCIÓN DE LOS RECURSOS DEL FONDO\nDE APORTACIONES PARA LA INFRAESTRUCTURA SOCIAL MUNICIPAL, ENTRE LOS MUNICIPIOS\nDEL ESTADO DE GUERRERO PARA EL EJERCICIO FISCAL 2018.\nARTÍCULO PRIMERO. El presente Acuerdo tiene por objeto dar a conocer la fórmula y la metodología para la distribución entre los Municipios de las aportaciones federales previstas en el Fondo de\nAportaciones para la Infraestructura Social Municipal para el Ejercicio Fiscal del 2018, así como las asignaciones presupuestales resultantes de la aplicación de dicha metodología, de conformidad con lo establecido en los artículos 34 y 35 de la Ley de Coordinación Fiscal.\nARTÍCULO SEGUNDO. Referente a la publicación de la Secretaría de Hacienda y Crédito Público realizada en el Diario Oficial de la Federación el día miércoles 20 de diciembre del 2017, en la que se pública el acuerdo para dar a conocer a las entidades federativas los montos correspondientes al Ramo\nGeneral 33. El monto de los recursos asignados para el Estado de Guerrero del Fondo de Aportaciones para la Infraestructura Social Municipal es por $5,408,503,251.00 (Cinco mil Cuatrocientos Ocho\nMillones Quinientos Tres Mil Doscientos Cimienta y un Mil pesos 00/100 M. N.).\nARTÍCULO TERCERO. Las aportaciones de este Fondo sólo podrán ser utilizadas en el financiamiento de obras, acciones sociales básicas y a inversiones que beneficien directamente a población en pobreza extrema, localidades con alto o muy alto nivel de rezago social conforme a lo previsto en la Ley General de\nDesarrollo Social, y en las zonas de atención prioritaria señaladas en el artículo 33 del Capítulo V de la Ley de Coordinación Fiscal.\nARTÍCULO CUARTO. Para efectos de la aplicación de la fórmula del artículo 34 de la Ley de Coordinación\nFiscal, se utiliza como fuente de información el Presupuesto de Egresos de la Federación y los informes la Política de Desarrollo Social (CONEVAL).\nARTÍCULO QUINTO. La fórmula para el cálculo del Fondo de Aportaciones para la Infraestructura Social\nMunicipal y de las Demarcaciones Territoriales se describe como:\nMUNICIPAL, ENTRE LOS MUNICIPIOS DEL ESTADO DE\nGUERRERO PARA EL EJERCICIO FISCAL 2018\nY las variables de cálculo se definen de la siguiente manera:\nFi,t= Monto del FISMDF del municipio i en el año t.\nFi,2013= Monto del Fondo para la Infraestructura Social Municipal (FISM) del municipio o demarcación territorial i en 2013.\nΔF2013,,= FISMDFi,t - FISM i,2013, donde FISMDFi,t corresponde a los recursos del FISMDF en el año de cálculo t para la entidad i. FISM i,2013 corresponde a los recursos del FISM recibidos por la entidad i en 2013. z = La participación del municipio o demarcación territorial i en el promedio estatal de las carencias de la i,t de Desarrollo Social al año t. e = La participación del municipio o demarcación territorial i en la bolsa de recursos asignados por su i,t eficacia en el abatimiento de la pobreza extrema.\nCPPE= Número de carencias promedio de la población en pobreza extrema en el municipio o demarcación al año t.\nMUNICIPAL, ENTRE LOS MUNICIPIOS DEL ESTADO DE\nGUERRERO PARA EL EJERCICIO FISCAL 2018\nPPE = Población en Pobreza Extrema del municipio o demarcación territorial i, de acuerdo con la í,T información más reciente provista por el Consejo Nacional de Evaluación de la Política de Desarrollo Social;\nPPE = Población en Pobreza Extrema del municipio o demarcación territorial i, de acuerdo con la í,T-i información inmediata anterior a la más reciente provista por el Consejo Nacional de Evaluación de la\nPolítica de Desarrollo Social;\nARTICULO SEXTO.- Excepción para el caso de e i,t\nConsiderando que actualmente se dispone de los cortes 2010 y 2015 de la medición multidimensional de la pobreza a nivel municipal dados a conocer por el Consejo Nacional de Evaluación de la Política de\nDesarrollo Social, el coeficiente ei,t para la distribución del FISMDF ya puede calcularse con base en la fórmula descrita en el artículo 34 de la Ley de Coordinación Fiscal, por lo que a partir de 2018 ya no aplica el criterio de excepción descrito en el Décimo Primero Transitorio de la reforma a la Ley de Coordinación\nFiscal publicada en el Diario Oficial de la Federación el 9 de diciembre de 2013.\nARTICULO SEPTIMO.- Fuentes de Información\nComponente F¡,2013\nNombre\nLínea Basal\nDescripción concepto de FISM en el año 2013.\nFuente de Información content/uploads/2013/02/PERIODICO-09-ALCANCE-II.pdf\nMUNICIPAL, ENTRE LOS MUNICIPIOS DEL ESTADO DE\nGUERRERO PARA EL EJERCICIO FISCAL 2018\nComponente Z¡,t\nNombre\nPobreza\nDescripción\nSe refiere a la participación de los municipios en pobreza extrema de la Entidad, ponderada por las carencias promedio de las personas en pobreza extrema del municipio correspondiente.\nFuente de Información\nConsejo Nacional de Evaluación de la Política de Desarrollo Social (Coneval).\nSitio Electrónico http://coneval.org.mx/Medicion/Paginas/AE_pobreza_municipal.aspx\n(fecha de consulta 14 de diciembre de 2017)\nIndicaciones\nEn el sitio electrónico al que direcciona la liga anterior, dar clic en el cuadro de diálogo “Anexo estadístico de pobreza a nivel municipal 2010 y 2015” y descargar el archivo “Concentrado_indicadores_de_pobreza.zip”. El archivo contiene el documento “Concentrado, indicadores de pobreza.xlsx”. Abrir el archivo y seleccionar la hoja de trabajo “Concentrado municipal”. Para construir el indicador utilice los valores para “pobreza extrema”, columnas “Personas” y “Carencias promedio” correspondientes al año 2015.\nComponente ei,t\nNombre\nEficacia\nDescripción en un periodo determinado. Para el caso del FISMDF, se compara el número de\nConsejo Nacional de Evaluación de la Política de Desarrollo Social, respecto de la misma medición inmediata anterior a la vigente. La medición de pobreza multidimensional municipal más reciente es la 2015 y la inmediata anterior es la 2010.\nMUNICIPAL, ENTRE LOS MUNICIPIOS DEL ESTADO DE\nGUERRERO PARA EL EJERCICIO FISCAL 2018\nFuente de Información\nConsejo Nacional de Evaluación de la Política de Desarrollo Social (Coneval).\nSitio Electrónico http://coneval.org.mx/Medicion/Paginas/AE_pobreza_municipal.aspx (fecha de consulta 14 de diciembre de 2017)\nIndicaciones\nEn el sitio electrónico al que direcciona la liga anterior, dar clic en el cuadro de diálogo “Anexo estadístico de pobreza a nivel municipal 2010 y 2015” y descargar el archivo “Concentrado_indicadores_de_pobreza.zip”. El archivo contiene el documento “Concentrado, indicadores de pobreza.xlsx”. Abrir el archivo y seleccionar la hoja de cálculo “Concentrado municipal”. Para construir el indicador utilice los valores para “pobreza extrema”, columnas “Personas” correspondientes a los años\n2010 y 2015.\nComponente AF20i3,t\nNombre\nIncremento FAIS\nDescripción\nEs el diferencial del Monto Total asignado al FISMDF en el año actual, respecto del monto total asignado al FISMDF en 2013.\nFuente de Información\n• Para el Monto FISM 2013, consultar el Presupuesto de Egresos de la Federación\n2013\n• Para el Monto FISMDF 2018, consultar el Presupuesto de Egresos de la Federación\nSitio Electrónico\n• Para el caso del Monto FISM 2013, consultar el PEF 2013:\n• Para el caso del Monto FISMDF 2018, consultar el PEF 2018\nMUNICIPAL, ENTRE LOS MUNICIPIOS DEL ESTADO DE\nGUERRERO PARA EL EJERCICIO FISCAL 2018\nIndicaciones\n• Para el caso del Monto FISMDF 2013, tomar del archivo descargado del sitio electrónico mencionado el monto correspondiente al FAIS Municipal para cada estado.\n• Para el caso del Monto FISMDF 2018, tomar el monto FAIS Municipal y de las\nDemarcaciones Territoriales del Distrito Federal correspondiente a cada entidad.\nARTICULO OCTAVO.- Cálculo de la Distribución del Fondo para la Infraestructura Social Municipal y de\n{\"tabla_1\":{\"columnas\":[\"(sin encabezado)\",\"Información Coneval 2015\",\"(sin encabezado)\",\"Desarrollo de la fórmula\",\"(sin encabezado)\",\"(sin encabezado)\"],\"filas\":[{\"columna_1\":\"Municipio\",\"columna_2\":\"PPE\\nit\",\"columna_3\":\"CPPE\\nit\",\"columna_4\":\"(3)\",\"columna_5\":\"(4)\",\"columna_6\":\"(5)\"},{\"columna_1\":\"(sin dato)\",\"columna_2\":\"(1)\",\"columna_3\":\"(2)\",\"columna_4\":\"PPE\\nit\",\"columna_5\":\"PPE¡t\",\"columna_6\":\"= xu SiX\\nU\"},{\"columna_1\":\"(sin dato)\",\"columna_2\":\"Personas en\",\"columna_3\":\"Carencias\",\"columna_4\":\"LPPE\\nW\",\"columna_5\":\"x = CPPE¡ * >,1 1,T S¡\\nit T\",\"columna_6\":\"(sin dato)\"},{\"columna_1\":\"(sin dato)\",\"columna_2\":\"Pobreza\",\"columna_3\":\"Promedio de\",\"columna_4\":\"(sin dato)\",\"columna_5\":\"PPE\\nit\",\"columna_6\":\"(sin dato)\"},{\"columna_1\":\"(sin dato)\",\"columna_2\":\"Extrema 2015\",\"columna_3\":\"personas en\",\"columna_4\":\"(sin dato)\",\"columna_5\":\"(sin dato)\",\"columna_6\":\"(sin dato)\"},{\"columna_1\":\"(sin dato)\",\"columna_2\":\"(Personas)\",\"columna_3\":\"pobreza\",\"columna_4\":\"(sin dato)\",\"columna_5\":\"(sin dato)\",\"columna_6\":\"(sin dato)\"},{\"columna_1\":\"(sin dato)\",\"columna_2\":\"(sin dato)\",\"columna_3\":\"extrema 2015\",\"columna_4\":\"(sin dato)\",\"columna_5\":\"(sin dato)\",\"columna_6\":\"(sin dato)\"},{\"columna_1\":\"(sin dato)\",\"columna_2\":\"(sin dato)\",\"columna_3\":\"(Carencias)\",\"columna_4\":\"(sin dato)\",\"columna_5\":\"(sin dato)\",\"columna_6\":\"(sin dato)\"},{\"columna_1\":\"Acapulco de\",\"columna_2\":\"93,513\",\"columna_3\":\"3.7979041\",\"columna_4\":\"0.1137377\",\"columna_5\":\"0.4319650\",\"columna_6\":\"0.1151486\"},{\"columna_1\":\"Juárez\",\"columna_2\":\"(sin dato)\",\"columna_3\":\"(sin dato)\",\"columna_4\":\"(sin dato)\",\"columna_5\":\"(sin dato)\",\"columna_6\":\"(sin dato)\"},{\"columna_1\":\"Ahuacuotzingo\",\"columna_2\":\"8,290\",\"columna_3\":\"3.6935811\",\"columna_4\":\"0.0100829\",\"columna_5\":\"0.0372422\",\"columna_6\":\"0.0099276\"},{\"columna_1\":\"Ajuchitlán del\",\"columna_2\":\"13,501\",\"columna_3\":\"3.9222437\",\"columna_4\":\"0.0164210\",\"columna_5\":\"0.0644070\",\"columna_6\":\"0.0171689\"},{\"columna_1\":\"Progreso\",\"columna_2\":\"(sin dato)\",\"columna_3\":\"(sin dato)\",\"columna_4\":\"(sin dato)\",\"columna_5\":\"(sin dato)\",\"columna_6\":\"(sin dato)\"},{\"columna_1\":\"Alcozauca de\",\"columna_2\":\"13,639\",\"columna_3\":\"3.7884742\",\"columna_4\":\"0.0165888\",\"columna_5\":\"0.0628463\",\"columna_6\":\"0.0167529\"},{\"columna_1\":\"Guerrero\",\"columna_2\":\"(sin dato)\",\"columna_3\":\"(sin dato)\",\"columna_4\":\"(sin dato)\",\"columna_5\":\"(sin dato)\",\"columna_6\":\"(sin dato)\"},{\"columna_1\":\"Alpoyeca\",\"columna_2\":\"1,625\",\"columna_3\":\"3.6165922\",\"columna_4\":\"0.0019765\",\"columna_5\":\"0.0071480\",\"columna_6\":\"0.0019054\"},{\"columna_1\":\"Apaxtla\",\"columna_2\":\"2,280\",\"columna_3\":\"3.5945622\",\"columna_4\":\"0.0027731\",\"columna_5\":\"0.0099681\",\"columna_6\":\"0.0026572\"},{\"columna_1\":\"Arcelia\",\"columna_2\":\"4,994\",\"columna_3\":\"3.5698739\",\"columna_4\":\"0.0060741\",\"columna_5\":\"0.0216837\",\"columna_6\":\"0.0057802\"},{\"columna_1\":\"Atenango del Río\",\"columna_2\":\"3,048\",\"columna_3\":\"3.6509627\",\"columna_4\":\"0.0037072\",\"columna_5\":\"0.0135349\",\"columna_6\":\"0.0036080\"},{\"columna_1\":\"Atlamajalcingo del\",\"columna_2\":\"3,964\",\"columna_3\":\"3.8728935\",\"columna_4\":\"0.0048213\",\"columna_5\":\"0.0186725\",\"columna_6\":\"0.0049775\"},{\"columna_1\":\"Monte\",\"columna_2\":\"(sin dato)\",\"columna_3\":\"(sin dato)\",\"columna_4\":\"(sin dato)\",\"columna_5\":\"(sin dato)\",\"columna_6\":\"(sin dato)\"},{\"columna_1\":\"Atlixtac\",\"columna_2\":\"16,275\",\"columna_3\":\"3.6575523\",\"columna_4\":\"0.0197949\",\"columna_5\":\"0.0724009\",\"columna_6\":\"0.0192999\"},{\"columna_1\":\"Atoyac de Álvarez\",\"columna_2\":\"9,657\",\"columna_3\":\"3.6273820\",\"columna_4\":\"0.0117456\",\"columna_5\":\"0.0426057\",\"columna_6\":\"0.0113574\"},{\"columna_1\":\"Ayutla de los\",\"columna_2\":\"25,093\",\"columna_3\":\"3.7644800\",\"columna_4\":\"0.0305200\",\"columna_5\":\"0.1148921\",\"columna_6\":\"0.0306267\"},{\"columna_1\":\"Libres\",\"columna_2\":\"(sin dato)\",\"columna_3\":\"(sin dato)\",\"columna_4\":\"(sin dato)\",\"columna_5\":\"(sin dato)\",\"columna_6\":\"(sin dato)\"},{\"columna_1\":\"Azoyú\",\"columna_2\":\"4,590\",\"columna_3\":\"3.7193753\",\"columna_4\":\"0.0055827\",\"columna_5\":\"0.0207642\",\"columna_6\":\"0.0055351\"},{\"columna_1\":\"Benito Juárez\",\"columna_2\":\"1,863\",\"columna_3\":\"3.5903978\",\"columna_4\":\"0.0022659\",\"columna_5\":\"0.0081356\",\"columna_6\":\"0.0021687\"},{\"columna_1\":\"Buenavista de\",\"columna_2\":\"1,317\",\"columna_3\":\"3.5535374\",\"columna_4\":\"0.0016018\",\"columna_5\":\"0.0056922\",\"columna_6\":\"0.0015174\"},{\"columna_1\":\"Cuéllar\",\"columna_2\":\"(sin dato)\",\"columna_3\":\"(sin dato)\",\"columna_4\":\"(sin dato)\",\"columna_5\":\"(sin dato)\",\"columna_6\":\"(sin dato)\"}]}}\nMUNICIPAL, ENTRE LOS MUNICIPIOS DEL ESTADO DE\nGUERRERO PARA EL EJERCICIO FISCAL 2018\n{\"tabla_2\":{\"columnas\":[\"Coahuayutla de\",\"4,401\",\"3.6029368\",\"0.0053528\",\"0.0192859\",\"0.0051410\"],\"filas\":[{\"columna_1\":\"José María\",\"columna_2\":\"(sin dato)\",\"columna_3\":\"(sin dato)\",\"columna_4\":\"(sin dato)\",\"columna_5\":\"(sin dato)\",\"columna_6\":\"(sin dato)\"},{\"columna_1\":\"Izazaga\",\"columna_2\":\"(sin dato)\",\"columna_3\":\"(sin dato)\",\"columna_4\":\"(sin dato)\",\"columna_5\":\"(sin dato)\",\"columna_6\":\"(sin dato)\"},{\"columna_1\":\"Cocula\",\"columna_2\":\"2,126\",\"columna_3\":\"3.6584405\",\"columna_4\":\"0.0025858\",\"columna_5\":\"0.0094600\",\"columna_6\":\"0.0025218\"},{\"columna_1\":\"Copala\",\"columna_2\":\"3,022\",\"columna_3\":\"3.6571456\",\"columna_4\":\"0.0036756\",\"columna_5\":\"0.0134422\",\"columna_6\":\"0.0035833\"},{\"columna_1\":\"Copalillo\",\"columna_2\":\"9,364\",\"columna_3\":\"3.6980192\",\"columna_4\":\"0.0113892\",\"columna_5\":\"0.0421176\",\"columna_6\":\"0.0112272\"},{\"columna_1\":\"Copanatoyac\",\"columna_2\":\"12,885\",\"columna_3\":\"3.8224403\",\"columna_4\":\"0.0156717\",\"columna_5\":\"0.0599043\",\"columna_6\":\"0.0159686\"},{\"columna_1\":\"Coyuca de Benítez\",\"columna_2\":\"14,994\",\"columna_3\":\"3.7790213\",\"columna_4\":\"0.0182369\",\"columna_5\":\"0.0689175\",\"columna_6\":\"0.0183713\"},{\"columna_1\":\"Coyuca de Catalán\",\"columna_2\":\"10,223\",\"columna_3\":\"3.8559928\",\"columna_4\":\"0.0124340\",\"columna_5\":\"0.0479454\",\"columna_6\":\"0.0127808\"},{\"columna_1\":\"Cuajinicuilapa\",\"columna_2\":\"6,456\",\"columna_3\":\"3.8066905\",\"columna_4\":\"0.0078523\",\"columna_5\":\"0.0298912\",\"columna_6\":\"0.0079681\"},{\"columna_1\":\"Cualác\",\"columna_2\":\"2,975\",\"columna_3\":\"3.7144581\",\"columna_4\":\"0.0036184\",\"columna_5\":\"0.0134405\",\"columna_6\":\"0.0035828\"},{\"columna_1\":\"Cuautepec\",\"columna_2\":\"6,356\",\"columna_3\":\"3.6592923\",\"columna_4\":\"0.0077307\",\"columna_5\":\"0.0282887\",\"columna_6\":\"0.0075409\"},{\"columna_1\":\"Cuetzala del\",\"columna_2\":\"3,315\",\"columna_3\":\"3.6300803\",\"columna_4\":\"0.0040320\",\"columna_5\":\"0.0146363\",\"columna_6\":\"0.0039016\"},{\"columna_1\":\"Progreso\",\"columna_2\":\"(sin dato)\",\"columna_3\":\"(sin dato)\",\"columna_4\":\"(sin dato)\",\"columna_5\":\"(sin dato)\",\"columna_6\":\"(sin dato)\"},{\"columna_1\":\"Cutzamala de\",\"columna_2\":\"4,846\",\"columna_3\":\"3.9080223\",\"columna_4\":\"0.0058941\",\"columna_5\":\"0.0230342\",\"columna_6\":\"0.0061402\"},{\"columna_1\":\"Pinzón\",\"columna_2\":\"(sin dato)\",\"columna_3\":\"(sin dato)\",\"columna_4\":\"(sin dato)\",\"columna_5\":\"(sin dato)\",\"columna_6\":\"(sin dato)\"},{\"columna_1\":\"Chilapa de Álvarez\",\"columna_2\":\"41,186\",\"columna_3\":\"3.7690222\",\"columna_4\":\"0.0500936\",\"columna_5\":\"0.1888039\",\"columna_6\":\"0.0503293\"},{\"columna_1\":\"Chilpancingo de\",\"columna_2\":\"33,680\",\"columna_3\":\"3.7960158\",\"columna_4\":\"0.0409642\",\"columna_5\":\"0.1555008\",\"columna_6\":\"0.0414517\"},{\"columna_1\":\"los Bravo\",\"columna_2\":\"(sin dato)\",\"columna_3\":\"(sin dato)\",\"columna_4\":\"(sin dato)\",\"columna_5\":\"(sin dato)\",\"columna_6\":\"(sin dato)\"},{\"columna_1\":\"Florencio Villarreal\",\"columna_2\":\"5,499\",\"columna_3\":\"3.7198334\",\"columna_4\":\"0.0066883\",\"columna_5\":\"0.0248794\",\"columna_6\":\"0.0066321\"}]}}\nInformación Coneval 2015 Desarrollo de la fórmula\nCPPE\n(2)\n(1) it Carencias (4)\nPersonas en Promedio de (3) PPE¡t (5)\nMunicipio Pobreza personas en PPE it Si x = CPPE¡>,1 lT Si = xu SiX\nExtrema 2015 pobreza extrema PPEit\n(Personas) 2015\n(Carencias)\nGeneral Canuto A.\n1,980 3.6399220 0.0024082 0.0087658 0.0023367\nNeri\nGeneral Heliodoro\n12,296 3.7907424 0.0149553 0.0566919 0.0151123\nCastillo\nHuamuxtitlán 2,685 3.5260165 0.0032657 0.0115149 0.0030695\nHuitzuco de los\n6,910 3.5536012 0.0084045 0.0298662 0.0079614\nFigueroa\nMUNICIPAL, ENTRE LOS MUNICIPIOS DEL ESTADO DE\nGUERRERO PARA EL EJERCICIO FISCAL 2018\nIguala de la\n17,168 3.7509428 0.0208811 0.0783236 0.0208787\nIndependencia\nIgualapa 5,214 3.9138988 0.0063417 0.0248207 0.0066164\nIxcateopan de\n1,965 3.5058957 0.0023900 0.0083790 0.0022336\nCuauhtémoc\nZihuatanejo de\n11,135 3.7478841 0.0135433 0.0507585 0.0135307\nAzueta\nJuan R. Escudero 6,252 3.6775472 0.0076042 0.0279647 0.0074545\nLeonardo Bravo 7,076 3.6584991 0.0086064 0.0314864 0.0083933\nMalinaltepec 14,269 3.6025599 0.0173551 0.0625226 0.0166666\nMártir de Cuilapan 5,848 3.8274258 0.0071128 0.0272237 0.0072570\nMetlatónoc 15,145 3.6595881 0.0184205 0.0674115 0.0179698\nMochitlán 2,852 3.6007987 0.0034688 0.0124905 0.0033296\nOlinalá 8,247 3.7105676 0.0100306 0.0372194 0.0099215\nOmetepec 18,981 3.8504694 0.0230862 0.0888925 0.0236960\nPedro Ascencio\n3,764 3.7005601 0.0045781 0.0169414 0.0045161\nAlquisiras\nPetatlán 6,428 3.7749049 0.0078182 0.0295131 0.0078673\nPilcaya 1,204 3.4905228 0.0014644 0.0051115 0.0013626\nPungarabato 5,507 3.7851456 0.0066980 0.0253531 0.0067583\nQuechultenango 10,561 3.6753285 0.0128451 0.0472100 0.0125847\nSan Luis Acatlán 18,896 3.9168897 0.0229828 0.0900210 0.0239968\nSan Marcos 9,804 3.7561738 0.0119244 0.0447901 0.0119397\nSan Miguel\n18,654 3.9132158 0.0226884 0.0887847 0.0236673\nTotolapan\nTaxco de Alarcón 16,981 3.6411642 0.0206536 0.0752032 0.0200469\nTecoanapa 12,225 3.6364102 0.0148690 0.0540697 0.0144133\nTécpan de Galeana 9,332 3.7743972 0.0113503 0.0428405 0.0114200\nTeloloapan 13,757 3.5937560 0.0167323 0.0601319 0.0160293\nTepecoacuilco de\n5,922 3.7072768 0.0072028 0.0267028 0.0071181\nTrujano\nTetipac 3,911 3.5781578 0.0047569 0.0170208 0.0045372\nMUNICIPAL, ENTRE LOS MUNICIPIOS DEL ESTADO DE\nGUERRERO PARA EL EJERCICIO FISCAL 2018\nTixtla de Guerrero 9,393 3.7180916 0.0114245 0.0424773 0.0113231\nInformación Coneval 2015 Desarrollo de la fórmula\nCPPE\nMunicipio\n()\n01\n()\n()\n()\n=\n¡\nPPE¡ T>,1 lT Si\n(=\n)\n(Personas) 2015\n(Carencias)\nTlacoachistlahuaca 15,059 4.1958694 0.0183159 0.0768512 0.0204862\nTlacoapa 4,859 3.3954612 0.0059099 0.0200668 0.0053492\nTlalchapa 2,023 3.5967948 0.0024605 0.0088500 0.0023591 lla de\n2,547 3.6872455 0.0030979 0.0114226 0.0030449\nTlapa de Comonfort 23,750 3.7682057 0.0288866 0.1088506 0.0290162\nTlapehuala 3,029 3.7378630 0.0036841 0.0137707 0.0036708 id oro\n5,856 3.8012078 0.0071225 0.0270742 0.0072171\nXalpatláhuac 6,742 3.6706589 0.0082001 0.0300999 0.0080237\nXochihuehuetlán 1,830 3.5016841 0.0022258 0.0077940 0.0020776\nXochistlahuaca 15,732 3.7534716 0.0191345 0.0718207 0.0191452\nZapotitlán Tablas 7,317 3.7984219 0.0088995 0.0338041 0.0090111\nZirándaro 4,402 3.9189420 0.0053541 0.0209822 0.0055932\nZitlala 7,193 3.6353561 0.0087487 0.0318046 0.0084781\nEduardo Neri 11,029 3.7357530 0.0134143 0.0501126 0.0133585\nAcatepec 25,427 3.5790507 0.0309263 0.1106867 0.0295057\nMarquelia 3,530 3.7645100 0.0042935 0.0161628 0.0043085\n16,384 3.9237346 0.0199275 0.0781902 0.0208431 o aquín de\n10,515 3.5833684 0.0127892 0.0458283 0.0122164\nJuchitán 2,571 3.8015238 0.0031271 0.0118876 0.0031689\nIliatenco 3,047 3.5892717 0.0037060 0.0133018 0.0035459\nTotal 822,181 1 3.75 1\nMUNICIPAL, ENTRE LOS MUNICIPIOS DEL ESTADO DE\nGUERRERO PARA EL EJERCICIO FISCAL 2018\nPaso 2. Obtener el componente ΔF\n2013.t\n(6) (7) (8)\nFISM 2013 de (Guerrero) FISMDF 2018 de (Guerrero) Incremento\nAF2013,t\n4,097,436,017 5,408,503,251 1,311,067,234\nPaso 3. Obtener la asignación monetaria para cada municipio por el concepto Z\nMunicipio\n(9) (10) (11)\nAF2013,t Zit Asignación por Z\nAcapulco de Juárez 1,311,067,234 0.11514858 120,774,025.72\nAhuacuotzingo 1,311,067,234 0.00992761 10,412,613.05\nAjuchitlán del Progreso 1,311,067,234 0.01716893 18,007,692.69\nAlcozauca de Guerrero 1,311,067,234 0.01675288 17,571,321.35\nAlpoyeca 1,311,067,234 0.00190544 1,998,529.04\nApaxtla 1,311,067,234 0.00265720 2,787,009.19\nArcelia 1,311,067,234 0.00578022 6,062,600.70\nAtenango del Río 1,311,067,234 0.00360799 3,784,250.80\nAtlamajalcingo del Monte 1,311,067,234 0.00497751 5,220,676.21\nAtlixtac 1,311,067,234 0.01929986 20,242,730.71\nAtoyac de Álvarez 1,311,067,234 0.01135738 11,912,230.24\nAyutla de los Libres 1,311,067,234 0.03062670 32,122,928.88\nAzoyú 1,311,067,234 0.00553510 5,805,508.28\nBenito Juárez 1,311,067,234 0.00216869 2,274,641.62\nBuenavista de Cuéllar 1,311,067,234 0.00151736 1,591,491.14\nCoahuayutla de José María\n1,311,067,234 0.00514104 5,392,194.80\nIzazaga\nCocula 1,311,067,234 0.00252175 2,644,945.99\nCopala 1,311,067,234 0.00358327 3,758,324.40\nCopalillo 1,311,067,234 0.01122724 11,775,737.71\nCopanatoyac 1,311,067,234 0.01596863 16,748,761.26\nMUNICIPAL, ENTRE LOS MUNICIPIOS DEL ESTADO DE\nGUERRERO PARA EL EJERCICIO FISCAL 2018\nCoyuca de Benítez 1,311,067,234 0.01837128 19,268,788.13\nCoyuca de Catalán 1,311,067,234 0.01278077 13,405,164.08\nCuajinicuilapa 1,311,067,234 0.00796808 8,357,351.03\nCualác 1,311,067,234 0.00358282 3,757,854.79\nCuautepec 1,311,067,234 0.00754091 7,909,308.97\nCuetzala del Progreso 1,311,067,234 0.00390160 4,092,204.41\nCutzamala de Pinzón 1,311,067,234 0.00614021 6,440,179.88\nChilapa de Álvarez 1,311,067,234 0.05032930 52,788,080.03\nChilpancingo de los Bravo 1,311,067,234 0.04145173 43,476,807.53\nFlorencio Villarreal 1,311,067,234 0.00663208 6,956,083.07\nGeneral Canuto A. Neri 1,311,067,234 0.00233668 2,450,839.21\nGeneral Heliodoro Castillo 1,311,067,234 0.01511231 15,850,599.11\nMunicipio\n(9) (1Q) (11)\nAF2Q13,t Zit Asignación por Z\nHuamuxtitlán 1,311,067,234 0.00306953 3,219,483.35\nHuitzuco de los Figueroa 1,311,067,234 0.00796140 8,350,342.43\nIguala de la Independencia 1,311,067,234 0.02087867 21,898,668.24\nIgualapa 1,311,067,234 0.00661642 6,939,659.75\nIxcateopan de Cuauhtémoc 1,311,067,234 0.00223359 2,342,713.09\nZihuatanejo de Azueta 1,311,067,234 0.01353066 14,191,683.74\nJuan R. Escudero 1,311,067,234 0.00745452 7,818,704.09\nLeonardo Bravo 1,311,067,234 0.00839331 8,803,357.29\nMalinaltepec 1,311,067,234 0.01666661 17,480,840.22\nMártir de Cuilapan 1,311,067,234 0.00725699 7,611,525.34\nMetlatónoc 1,311,067,234 0.01796983 18,847,729.30\nMochitlán 1,311,067,234 0.00332959 3,492,254.75\nOlinalá 1,311,067,234 0.00992154 10,406,241.37\nOmetepec 1,311,067,234 0.02369602 24,853,658.54\nMUNICIPAL, ENTRE LOS MUNICIPIOS DEL ESTADO DE\nGUERRERO PARA EL EJERCICIO FISCAL 2018\nPedro Ascencio Alquisiras 1,311,067,234 0.00451606 4,736,686.43\nPetatlán 1,311,067,234 0.00786728 8,251,624.06\nPilcaya 1,311,067,234 0.00136257 1,429,139.18\nPungarabato 1,311,067,234 0.00675834 7,088,514.39\nQuechultenango 1,311,067,234 0.01258473 13,199,538.85\nSan Luis Acatlán 1,311,067,234 0.02399683 25,169,163.30\nSan Marcos 1,311,067,234 0.01193965 12,522,946.90\nSan Miguel Totolapan 1,311,067,234 0.02366728 24,823,517.56\nTaxco de Alarcón 1,311,067,234 0.02004685 21,026,213.86\nTecoanapa 1,311,067,234 0.01441333 15,117,476.15\nTécpan de Galeana 1,311,067,234 0.01141997 11,977,878.22\nTeloloapan 1,311,067,234 0.01602931 16,812,406.56\nTepecoacuilco de Trujano 1,311,067,234 0.00711813 7,465,879.41\nTetipac 1,311,067,234 0.00453722 4,758,881.17\nTixtla de Guerrero 1,311,067,234 0.01132314 11,876,321.86\nTlacoachistlahuaca 1,311,067,234 0.02048617 21,486,993.47\nTlacoapa 1,311,067,234 0.00534919 5,610,521.48\nTlalchapa 1,311,067,234 0.00235914 2,474,395.39\nTlalixtaquilla de Maldonado 1,311,067,234 0.00304490 3,193,659.10\nTlapa de Comonfort 1,311,067,234 0.02901622 30,433,771.07\nTlapehuala 1,311,067,234 0.00367084 3,850,172.64\nMunicipio\nAF2\n(9)\n1 3,t\n(1\n)\nAsignac\n(1\n) por Zit\nU nión de Isidoro Montes de\n1,311,067,234 0.00721714 7,569,727.40\nXalpatláhuac 1,311,067,234 0.00802371 8,415,701.61\nXochihuehuetlán 1,311,067,234 0.00207764 2,179,142.41\nXochistlahuaca 1,311,067,234 0.01914519 20,080,504.87\nZapotitlán Tablas 1,311,067,234 0.00901112 9,451,349.20\nZirándaro 1,311,067,234 0.00559321 5,866,464.33\nMUNICIPAL, ENTRE LOS MUNICIPIOS DEL ESTADO DE\nGUERRERO PARA EL EJERCICIO FISCAL 2018\nZitlala 1,311,067,234 0.00847812 8,892,309.61\nEduardo Neri 1,311,067,234 0.01335848 14,011,087.67\nAcatepec 1,311,067,234 0.02950568 30,947,140.65\nMarquelia 1,311,067,234 0.00430851 4,518,992.72\nCochoapa el Grande 1,311,067,234 0.02084309 21,861,357.14\nJosé Joaquín de Herrera 1,311,067,234 0.01221640 12,813,220.13\nJuchitán 1,311,067,234 0.00316886 3,323,665.81\nIliatenco 1,311,067,234 0.00354586 3,719,087.10\nTotal 1.00 1,048,853,787.20\nPaso 4. Cálculo del Componente\nPPE -i PPE (14) (15) iT iT\nMunicipio\n(12) (13) PPE 1 PPE PPE 1 PPE\nÍT- iT iT- ÍT\nPersonas en Carencias Promedio e“ PPE ¡T-I L ' PPE¡ T\nPobreza de personas en\nExtrema pobreza extrema\n2010 2015\nAcapulco de Juárez\n108,841 93,513 1.16391304 0.01031943\nAhuacuotzingo 14,219 8,290 1.71519903 0.01520722\n19,960 13,501 1.47840901 0.01310780\nAjuchitlán del\nProgreso\n13,067 13,639 0.95806144 0.00849432\nAlcozauca de\nGuerrero\nAlpoyeca 1,636 1,625 1.00676923 0.00892617\nApaxtla 3,709 2,280 1.62675439 0.01442306\nArcelia 6,396 4,994 1.28073688 0.01135521\nAtenango del Río 2,899 3,048 0.95111549 0.00843274\n4,738 3,964 1.19525732 0.01059734\nAtlamajalcingo del\nMonte\nAtlixtac 21,905 16,275 1.34592934 0.01193322\nAtoyac de Álvarez 16,072 9,657 1.66428497 0.01475581\nMUNICIPAL, ENTRE LOS MUNICIPIOS DEL ESTADO DE\nGUERRERO PARA EL EJERCICIO FISCAL 2018\n{\"tabla_3\":{\"columnas\":[\"Ayutla de los\",\"43,944\",\"25,093\",\"1.75124537\",\"0.01552681\"],\"filas\":[{\"columna_1\":\"Libres\",\"columna_2\":\"(sin dato)\",\"columna_3\":\"(sin dato)\",\"columna_4\":\"(sin dato)\",\"columna_5\":\"(sin dato)\"},{\"columna_1\":\"Azoyú\",\"columna_2\":\"4,986\",\"columna_3\":\"4,590\",\"columna_4\":\"1.08627451\",\"columna_5\":\"0.00963108\"},{\"columna_1\":\"Benito Juárez\",\"columna_2\":\"3,011\",\"columna_3\":\"1,863\",\"columna_4\":\"1.61621041\",\"columna_5\":\"0.01432957\"}]}}\nPPEjj-i PPE (14) (15)\n(12) (13)\nMunicipio Personas en Carencias Promedio\nPobreza de personas en\nExtrema pobreza extrema\n2010 2015\nBuenavista de\n1,594 1,317 1.21032650 0.01073094\nCuéllar\nCoahuayutla de\n8,897 4,401 2.02158600 0.01792370\nJosé María Izazaga\nCocula\n3,059 2,126 1.43885230 0.01275709\nCopala\n4,191 3,022 1.38682991 0.01229585\nCopalillo\n9,323 9,364 0.99562153 0.00882734\nCopanatoyac\n14,438 12,885 1.12052775 0.00993477\nCoyuca de Benítez\n22,611 14,994 1.50800320 0.01337019\nCoyuca de Catalán\n18,009 10,223 1.76161596 0.01561876\nCuajinicuilapa\n9,561 6,456 1.48094796 0.01313031\nCualác\n4,209 2,975 1.41478992 0.01254375\nCuautepec\n6,939 6,356 1.09172435 0.00967940\nCuetzala del\n5,055 3,315 1.52488688 0.01351988\nProgreso\nCutzamala de\n6,466 4,846 1.33429633 0.01183008\nPinzón\nChilapa de Álvarez\n54,630 41,186 1.32642160 0.01176026\nChilpancingo de\n36,006 33,680 1.06906176 0.00947847 los Bravo\nFlorencio Villarreal\n7,240 5,499 1.31660302 0.01167321\nGeneral Canuto A.\n5,347 1,980 2.70050505 0.02394310\nNeri\nMUNICIPAL, ENTRE LOS MUNICIPIOS DEL ESTADO DE\nGUERRERO PARA EL EJERCICIO FISCAL 2018\nGeneral Heliodoro\n22,702 12,296 1.84629148 0.01636951\nCastillo\nHuamuxtitlán\n2,710 2,685 1.00931099 0.00894871\nHuitzuco de los\n13,813 6,910 1.99898698 0.01772333\nFigueroa\nIguala de la\n14,303 17,168 0.83311976 0.00738657\nIndependencia\nIgualapa\n4,482 5,214 0.85960875 0.00762142\nIxcateopan de\n2,112 1,965 1.07480916 0.00952943\nCuauhtémoc\nZihuatanejo de\n12,526 11,135 1.12492142 0.00997373\nAzueta\nJuan R. Escudero\n6,319 6,252 1.01071657 0.00896117\nLeonardo Bravo\n11,016 7,076 1.55681176 0.01380294\nMalinaltepec\n23,746 14,269 1.66416708 0.01475476\nMártir de Cuilapan\n8,891 5,848 1.52034884 0.01347965\nMetlatónoc\n16,649 15,145 1.09930670 0.00974662\nMochitlán\n3,388 2,852 1.18793829 0.01053245\nOlinalá\n15,364 8,247 1.86298048 0.01651747\nOmetepec\n23,528 18,981 1.23955534 0.01099009\nPedro Ascencio\n4,454 3,764 1.18331562 0.01049146\nAlquisiras\nPetatlán\n11,403 6,428 1.77395769 0.01572818\nPPEjj-i PPE (14) (15)\n(12) (13)\nMunicipio Personas en Carencias Promedio\nPobreza de personas en\nExtrema pobreza extrema\n2010 2015\nPilcaya 2,716 1,204 2.25581395 0.02000040\nPungarabato 4,107 5,507 0.74577810 0.00661218\nQuechultenango 19,089 10,561 1.80749929 0.01602557\nSan Luis Acatlán 31,694 18,896 1.67728620 0.01487108\nMUNICIPAL, ENTRE LOS MUNICIPIOS DEL ESTADO DE\nGUERRERO PARA EL EJERCICIO FISCAL 2018\nSan Marcos 19,842 9,804 2.02386781 0.01794393\nSan Miguel\nTotolapan 18,440 18,654 0.98852793 0.00876444\nTaxco de Alarcón 22,236 16,981 1.30946352 0.01160991\nTecoanapa 21,845 12,225 1.78691207 0.01584304\nTécpan de Galeana\n15,340 9,332 1.64380626 0.01457424\nTeloloapan 17,797 13,757 1.29366868 0.01146987\nTepecoacuilco de\nTrujano 8,552 5,922 1.44410672 0.01280367\nTetipac 4,686 3,911 1.19815904 0.01062306\nTixtla de Guerrero 13,723 9,393 1.46098158 0.01295329\nTlacoachistlahuac a 12,555 15,059 0.83372070 0.00739190\nTlacoapa 8,249 4,859 1.69767442 0.01505185\nTlalchapa 3,021 2,023 1.49332674 0.01324007\nTlalixtaquilla de\nMaldonado 2,358 2,547 0.92579505 0.00820824\nTlapa de\nComonfort 39,836 23,750 1.67730526 0.01487125\nTlapehuala 5,331 3,029 1.75998679 0.01560432\nLa Unión de\nIsidoro Montes de 6,675 5,856 1.13985656 0.01010615\nXalpatláhuac 9,342 6,742 1.38564224 0.01228532\nXochihuehuetlán 2,432 1,830 1.32896175 0.01178278\nXochistlahuaca 16,710 15,732 1.06216629 0.00941733\nZapotitlán Tablas 7,419 7,317 1.01394014 0.00898975\nZirándaro 8,414 4,402 1.91140391 0.01694680\nZitlala 13,576 7,193 1.88739052 0.01673390\nEduardo Neri 13,428 11,029 1.21751745 0.01079470\nAcatepec 26,095 25,427 1.02627129 0.00909908\nMarquelia 3,533 3,530 1.00084986 0.00887369\nCochoapa el\nGrande 16,504 16,384 1.00732422 0.00893109\nMUNICIPAL, ENTRE LOS MUNICIPIOS DEL ESTADO DE\nGUERRERO PARA EL EJERCICIO FISCAL 2018\nJosé Joaquín de\nHerrera 12,416 10,515 1.18078935 0.01046906\nJuchitán 3,048 2,571 1.18553092 0.01051110\nIliatenco 6,180 3,047 2.02822448 0.01798255\nTotal 112.78845641 1.00000000\nPaso 5. Obtener la asignación monetaria para cada municipio por concepto de e\nMunicipio\n()\n3,t\n(¡\n)\nAsigna\n() por e\nAcapulco de Juárez 1,311,067,234 0.01031943 2,705,894.37\nAhuacuotzingo 1,311,067,234 0.01520722 3,987,537.96\nAjuchitlán del Progreso 1,311,067,234 0.01310780 3,437,042.53\nAlcozauca de Guerrero 1,311,067,234 0.00849432 2,227,325.39\nAlpoyeca 1,311,067,234 0.00892617 2,340,562.49\nApaxtla 1,311,067,234 0.01442306 3,781,919.61\nArcelia 1,311,067,234 0.01135521 2,977,489.40\nAtenango del Río 1,311,067,234 0.00843274 2,211,177.26\nAtlamajalcingo del Monte 1,311,067,234 0.01059734 2,778,764.34\nAtlixtac 1,311,067,234 0.01193322 3,129,050.46\nAtoyac de Álvarez 1,311,067,234 0.01475581 3,869,171.66\nAyutla de los Libres 1,311,067,234 0.01552681 4,071,339.38\nAzoyú 1,311,067,234 0.00963108 2,525,398.36\nBenito Juárez 1,311,067,234 0.01432957 3,757,406.71\nBuenavista de Cuéllar 1,311,067,234 0.01073094 2,813,797.56\nCoahuayutla de José María 1,311,067,234 0.01792370 4,699,834.10\nIzazaga\nCocula 1,311,067,234 0.01275709 3,345,080.11\nCopala 1,311,067,234 0.01229585 3,224,137.15\nCopalillo 1,311,067,234 0.00882734 2,314,646.03\nCopanatoyac 1,311,067,234 0.00993477 2,605,031.15\nCoyuca de Benítez 1,311,067,234 0.01337019 3,505,843.86\nCoyuca de Catalán 1,311,067,234 0.01561876 4,095,449.20\nMUNICIPAL, ENTRE LOS MUNICIPIOS DEL ESTADO DE\nGUERRERO PARA EL EJERCICIO FISCAL 2018\nCuajinicuilapa 1,311,067,234 0.01313031 3,442,945.14\nCualác 1,311,067,234 0.01254375 3,289,139.26\nCuautepec 1,311,067,234 0.00967940 2,538,068.30\nCuetzala del Progreso 1,311,067,234 0.01351988 3,545,095.46\nCutzamala de Pinzón 1,311,067,234 0.01183008 3,102,005.74\nChilapa de Álvarez 1,311,067,234 0.01176026 3,083,698.37\nChilpancingo de los Bravo 1,311,067,234 0.00947847 2,485,381.72\nFlorencio Villarreal 1,311,067,234 0.01167321 3,060,871.89\nGeneral Canuto A. Neri 1,311,067,234 0.02394310 6,278,202.22\nGeneral Heliodoro Castillo 1,311,067,234 0.01636951 4,292,304.97\nHuamuxtitlán 1,311,067,234 0.00894871 2,346,471.63\nHuitzuco de los Figueroa 1,311,067,234 0.01772333 4,647,295.31\nIguala de la Independencia 1,311,067,234 0.00738657 1,936,857.82\nIgualapa 1,311,067,234 0.00762142 1,998,440.08\nMunicipio\n()\n3,t\n(¡\n)\nAsigna\n() por e\nIxcateopan de Cuauhtémoc\n1,311,067,234 0.00952943 2,498,743.43\nZihuatanejo de Azueta\n1,311,067,234 0.00997373 2,615,245.67\nJuan R. Escudero\n1,311,067,234 0.00896117 2,349,739.36\nLeonardo Bravo\n1,311,067,234 0.01380294 3,619,315.22\nMalinaltepec\n1,311,067,234 0.01475476 3,868,897.57\nMártir de Cuilapan\n1,311,067,234 0.01347965 3,534,545.30\nMetlatónoc\n1,311,067,234 0.00974662 2,555,695.93\nMochitlán\n1,311,067,234 0.01053245 2,761,748.88\nOlinalá\n1,311,067,234 0.01651747 4,331,103.98\nOmetepec\n1,311,067,234 0.01099009 2,881,749.51\nPedro Ascencio Alquisiras\n1,311,067,234 0.01049146 2,751,001.99\nPetatlán\n1,311,067,234 0.01572818 4,124,141.55\nPilcaya\n1,311,067,234 0.02000040 5,244,373.15\nMUNICIPAL, ENTRE LOS MUNICIPIOS DEL ESTADO DE\nGUERRERO PARA EL EJERCICIO FISCAL 2018\nPungarabato\n1,311,067,234 0.00661218 1,733,803.73\nQuechultenango\n1,311,067,234 0.01602557 4,202,119.92\nSan Luis Acatlán\n1,311,067,234 0.01487108 3,899,397.24\nSan Marcos\n1,311,067,234 0.01794393 4,705,138.90\nSan Miguel Totolapan\n1,311,067,234 0.00876444 2,298,154.65\nTaxco de Alarcón\n1,311,067,234 0.01160991 3,044,273.80\nTecoanapa\n1,311,067,234 0.01584304 4,154,258.22\nTécpan de Galeana\n1,311,067,234 0.01457424 3,821,562.23\nTeloloapan\n1,311,067,234 0.01146987 3,007,553.55\nTepecoacuilco de Trujano\n1,311,067,234 0.01280367 3,357,295.71\nTetipac\n1,311,067,234 0.01062306 2,785,510.34\nTixtla de Guerrero\n1,311,067,234 0.01295329 3,396,526.81\nTlacoachistlahuaca\n1,311,067,234 0.00739190 1,938,254.90\nTlacoapa\n1,311,067,234 0.01505185 3,946,796.29\nTlalchapa\n1,311,067,234 0.01324007 3,471,723.66\nTlalixtaquilla de Maldonado\n1,311,067,234 0.00820824 2,152,311.68\nTlapa de Comonfort\n1,311,067,234 0.01487125 3,899,441.56\nTlapehuala\n1,311,067,234 0.01560432 4,091,661.67\nU nión de Isidoro Montes de\n1,311,067,234 0.01010615 2,649,967.26\nXalpatláhuac\n1,311,067,234 0.01228532 3,221,376.02\nXochihuehuetlán\n1,311,067,234 0.01178278 3,089,603.78\nXochistlahuaca\n1,311,067,234 0.00941733 2,469,350.96\nZapotitlán Tablas\n1,311,067,234 0.00898975 2,357,233.60\nZirándaro\n1,311,067,234 0.01694680 4,443,679.99\nZitlala\n1,311,067,234 0.01673390 4,387,853.06\nEduardo Neri\n1,311,067,234 0.01079470 2,830,515.27\nAcatepec\n1,311,067,234 0.00909908 2,385,901.36\nMunicipio\n()\n3,t\n()\nAsigna\n() por e\nMarquelia 1,311,067,234 0.00887369 2,326,800.98\nCochoapa el Grande 1,311,067,234 0.00893109 2,341,852.74\nMUNICIPAL, ENTRE LOS MUNICIPIOS DEL ESTADO DE\nGUERRERO PARA EL EJERCICIO FISCAL 2018\nJosé Joaquín de Herrera 1,311,067,234 0.01046906 2,745,128.84\nJuchitán 1,311,067,234 0.01051110 2,756,152.17\nIliatenco 1,311,067,234 0.01798255 4,715,267.41\nTotal 1.00000000 262,213,446.80\nPaso 6. Linea Basal 2013. Componente F i,2013\nFondo para la Infraestructura Social Municipal 2013 de Guerrero\nMunicipio\nAsigna\n() n 2013\nAcapulco de Juárez 461,526,884.00\nAhuacuotzingo 47,589,201.00\nAjuchitlán del Progreso 65,325,901.00\nAlcozauca de Guerrero 36,856,907.00\nAlpoyeca 6,136,362.00\nApaxtla 14,418,559.00\nArcelia 37,840,376.00\nAtenango del Río 10,124,134.00\nAtlamajalcingo del Monte 11,926,648.00\nAtlixtac 59,965,167.00\nAtoyac de Álvarez 68,502,857.00\nAyutla de los Libres 134,131,236.00\nAzoyú 21,871,403.00\nBenito Juárez 13,810,284.00\nBuenavista de Cuéllar 9,509,981.00\nCoahuayutla de José María 35,826,311.00\nIzazaga\nCocula 15,316,930.00\nCopala 16,986,829.00\nCopalillo 26,933,498.00\nCopanatoyac 37,578,165.00\nMUNICIPAL, ENTRE LOS MUNICIPIOS DEL ESTADO DE\nGUERRERO PARA EL EJERCICIO FISCAL 2018\nCoyuca de Benítez 79,577,851.00\nCoyuca de Catalán 89,490,404.00\nCuajinicuilapa 34,593,182.00\nCualác 9,210,767.00\nCuautepec 22,926,853.00\nFondo para la Infraestructura Social Municipal 2013 de Guerrero\nMunicipio\nAsigna\n() n 2013\nCuetzala del Progreso 12,839,676.00\nCutzamala de Pinzón 32,165,923.00\nChilapa de Álvarez 208,747,342.00\nChilpancingo de los Bravo 141,119,361.00\nFlorencio Villarreal 21,667,826.00\nGeneral Canuto A. Neri 8,812,227.00\nGeneral Heliodoro Castillo 107,903,847.00\nHuamuxtitlán 11,885,520.00\nHuitzuco de los Figueroa 34,868,178.00\nIguala de la Independencia 77,150,922.00\nIgualapa 19,547,213.00\nIxcateopan de Cuauhtémoc 6,749,208.00\nZihuatanejo de Azueta 61,846,555.00\nJuan R. Escudero 25,095,320.00\nLeonardo Bravo 29,077,452.00\nMalinaltepec 68,711,490.00\nMártir de Cuilapan 27,899,916.00\nMetlatónoc 50,246,206.00\nMochitlán 13,720,044.00\nMUNICIPAL, ENTRE LOS MUNICIPIOS DEL ESTADO DE\nGUERRERO PARA EL EJERCICIO FISCAL 2018\nOlinalá 39,373,456.00\nOmetepec 99,843,796.00\nPedro Ascencio Alquisiras 21,909,947.00\nPetatlán 44,945,539.00\nPilcaya 10,294,605.00\nPungarabato 20,880,851.00\nQuechultenango 53,766,228.00\nSan Luis Acatlán 110,530,148.00\nSan Marcos 64,856,743.00\nSan Miguel Totolapan 95,604,910.00\nTaxco de Alarcón 94,382,215.00\nTecoanapa 73,304,775.00\nTécpan de Galeana 68,235,530.00\nTeloloapan 68,672,114.00\nTepecoacuilco de Trujano 35,591,413.00\nFondo para la Infraestructura Social Municipal 2013 de Guerrero\n{\"tabla_4\":{\"columnas\":[\"Municipio\",\"(19)\"],\"filas\":[{\"columna_1\":\"(sin dato)\",\"columna_2\":\"Asignación 2013\"},{\"columna_1\":\"Tetipac\",\"columna_2\":\"(sin dato)\"},{\"columna_1\":\"(sin dato)\",\"columna_2\":\"18,327,094.00\"},{\"columna_1\":\"Tixtla de Guerrero\",\"columna_2\":\"(sin dato)\"},{\"columna_1\":\"(sin dato)\",\"columna_2\":\"44,700,544.00\"},{\"columna_1\":\"Tlacoachistlahuaca\",\"columna_2\":\"57,841,713.00\"},{\"columna_1\":\"Tlacoapa\",\"columna_2\":\"30,686,306.00\"},{\"columna_1\":\"Tlalchapa\",\"columna_2\":\"12,645,242.00\"},{\"columna_1\":\"Tlalixtaquilla de Maldonado\",\"columna_2\":\"12,108,374.00\"},{\"columna_1\":\"Tlapa de Comonfort\",\"columna_2\":\"95,947,567.00\"},{\"columna_1\":\"Tlapehuala\",\"columna_2\":\"22,139,308.00\"},{\"columna_1\":\"La Unión de Isidoro Montes de\",\"columna_2\":\"(sin dato)\"},{\"columna_1\":\"(sin dato)\",\"columna_2\":\"29,748,033.00\"},{\"columna_1\":\"Oca\",\"columna_2\":\"(sin dato)\"},{\"columna_1\":\"Xalpatláhuac\",\"columna_2\":\"(sin dato)\"},{\"columna_1\":\"(sin dato)\",\"columna_2\":\"22,499,674.00\"},{\"columna_1\":\"Xochihuehuetlán\",\"columna_2\":\"8,173,837.00\"}]}}\nMUNICIPAL, ENTRE LOS MUNICIPIOS DEL ESTADO DE\nGUERRERO PARA EL EJERCICIO FISCAL 2018\n{\"tabla_5\":{\"columnas\":[\"Xochistlahuaca\",\"77,782,901.00\"],\"filas\":[{\"columna_1\":\"Zapotitlán Tablas\",\"columna_2\":\"25,854,382.00\"},{\"columna_1\":\"Zirándaro\",\"columna_2\":\"34,290,013.00\"},{\"columna_1\":\"Zitlala\",\"columna_2\":\"(sin dato)\"},{\"columna_1\":\"(sin dato)\",\"columna_2\":\"39,471,356.00\"},{\"columna_1\":\"Eduardo Neri\",\"columna_2\":\"36,148,210.00\"},{\"columna_1\":\"Acatepec\",\"columna_2\":\"135,211,271.00\"},{\"columna_1\":\"Marquelia\",\"columna_2\":\"13,221,793.00\"},{\"columna_1\":\"Cochoapa el Grande\",\"columna_2\":\"70,790,543.00\"},{\"columna_1\":\"José Joaquín de Herrera\",\"columna_2\":\"38,971,270.00\"},{\"columna_1\":\"Juchitán\",\"columna_2\":\"10,117,327.00\"},{\"columna_1\":\"Iliatenco\",\"columna_2\":\"(sin dato)\"},{\"columna_1\":\"(sin dato)\",\"columna_2\":\"30,536,073.00\"},{\"columna_1\":\"Total\",\"columna_2\":\"(sin dato)\"},{\"columna_1\":\"(sin dato)\",\"columna_2\":\"4,097,436,017.00\"}]}} del 2013. Secretaría General de Gobierno, Dirección General del Periódico Oficial. http://periodicooficial.guerrero.gob.mx/wp-content/uploads/2013/02/PERIODICO-09-ALCANCE-N.pdf.\nPaso 7. Obtener la asignación monetaria correspondiente a cada municipio respecto del Fondo para la\nInfraestructura Social Municipal y de las Demarcaciones Territoriales del Distrito Federal\nCve_ Municipio (20) (21) (22)\n(23) mun Asignación 2013 Zit e¡t\nAsignación FISMDF\n2018\n001 Acapulco de Juárez 461,526,884.00 120,774,025.72 2,705,894.37 585,006,804.09\n002 Ahuacuotzingo 47,589,201.00 10,412,613.05 3,987,537.96 61,989,352.01\n003 65,325,901.00 18,007,692.69 3,437,042.53 86,770,636.22\nAjuchitlán del\nProgreso\n(23)\n_\nMunicipio\nAsigna\n() n 2013\n(¡\n)\nAsignación FISMDF\nAlcozauca de\n004 Guerrero 36,856,907.00 17,571,321.35 2,227,325.39 56,655,553.74\n005 Alpoyeca 6,136,362.00 1,998,529.04 2,340,562.49 10,475,453.53\n006 Apaxtla 14,418,559.00 2,787,009.19 3,781,919.61 20,987,487.79\n007 Arcelia 37,840,376.00 6,062,600.70 2,977,489.40 46,880,466.10\nMUNICIPAL, ENTRE LOS MUNICIPIOS DEL ESTADO DE\nGUERRERO PARA EL EJERCICIO FISCAL 2018\n008 Atenango del Río 10,124,134.00 3,784,250.80 2,211,177.26 16,119,562.06\nAtlamajalcingo del\n009 11,926,648.00 5,220,676.21 2,778,764.34 19,926,088.55\nMonte\n010 Atlixtac 59,965,167.00 20,242,730.71 3,129,050.46 83,336,948.17\n011 Atoyac de Álvarez 68,502,857.00 11,912,230.24 3,869,171.66 84,284,258.91\n012 Ayutla de los Libres 134,131,236.00 32,122,928.88 4,071,339.38 170,325,504.26\n013 Azoyú 21,871,403.00 5,805,508.28 2,525,398.36 30,202,309.65\n014 Benito Juárez 13,810,284.00 2,274,641.62 3,757,406.71 19,842,332.33\nBuenavista de\n015 9,509,981.00 1,591,491.14 2,813,797.56 13,915,269.70\nCuéllar\nCoahuayutla de José\n016 35,826,311.00 5,392,194.80 4,699,834.10 45,918,339.90\nMaría Izazaga\n017 Cocula 15,316,930.00 2,644,945.99 3,345,080.11 21,306,956.10\n018 Copala 16,986,829.00 3,758,324.40 3,224,137.15 23,969,290.54\n019 Copalillo 26,933,498.00 11,775,737.71 2,314,646.03 41,023,881.74\n020 Copanatoyac 37,578,165.00 16,748,761.26 2,605,031.15 56,931,957.41\n021 Coyuca de Benítez 79,577,851.00 19,268,788.13 3,505,843.86 102,352,482.99\n022 Coyuca de Catalán 89,490,404.00 13,405,164.08 4,095,449.20 106,991,017.28\n023 Cuajinicuilapa 34,593,182.00 8,357,351.03 3,442,945.14 46,393,478.17\n024 Cualác 9,210,767.00 3,757,854.79 3,289,139.26 16,257,761.06\n025 Cuautepec 22,926,853.00 7,909,308.97 2,538,068.30 33,374,230.27\nCuetzala del\n026 12,839,676.00 4,092,204.41 3,545,095.46 20,476,975.86\nProgreso\n027 Cutzamala de Pinzón 32,165,923.00 6,440,179.88 3,102,005.74 41,708,108.61\n028 Chilapa de Álvarez 208,747,342.00 52,788,080.03 3,083,698.37 264,619,120.40\n029\nChilpancingo de los\n141,119,361.00 43,476,807.53 2,485,381.72 187,081,550.26\nBravo\n030 21,667,826.00 6,956,083.07 3,060,871.89 31,684,780.96\nFlorencio Villarreal\nGeneral Canuto A.\n031 8,812,227.00 2,450,839.21 6,278,202.22 17,541,268.43\nNeri\n032 General Heliodoro 107,903,847.00 15,850,599.11 4,292,304.97 128,046,751.08\nCastillo\nMUNICIPAL, ENTRE LOS MUNICIPIOS DEL ESTADO DE\nGUERRERO PARA EL EJERCICIO FISCAL 2018\n033 Huamuxtitlán 11,885,520.00 3,219,483.35 2,346,471.63 17,451,474.98\nHuitzuco de los\n034 34,868,178.00 8,350,342.43 4,647,295.31 47,865,815.74\nFigueroa\nIguala de la\n035 77,150,922.00 21,898,668.24 1,936,857.82 100,986,448.05\nIndependencia\n036 Igualapa 19,547,213.00 6,939,659.75 1,998,440.08 28,485,312.83\nIxcateopan de\n037 6,749,208.00 2,342,713.09 2,498,743.43 11,590,664.52\nCuauhtémoc\nZihuatanejo de\n038 61,846,555.00 14,191,683.74 2,615,245.67 78,653,484.41\nAzueta\n(23)\n_\nMunicipio\nAsigna\n() n 2013\n(¡\n)\nAsignación FISMDF\n2018\n039 Juan R. Escudero 25,095,320.00 7,818,704.09 2,349,739.36 35,263,763.46\n040 Leonardo Bravo 29,077,452.00 8,803,357.29 3,619,315.22 41,500,124.51\n041 Malinaltepec 68,711,490.00 17,480,840.22 3,868,897.57 90,061,227.79\n042 Mártir de Cuilapan 27,899,916.00 7,611,525.34 3,534,545.30 39,045,986.64\n043 Metlatónoc 50,246,206.00 18,847,729.30 2,555,695.93 71,649,631.24\n044 Mochitlán 13,720,044.00 3,492,254.75 2,761,748.88 19,974,047.63\n045 Olinalá 39,373,456.00 10,406,241.37 4,331,103.98 54,110,801.35\n046 Ometepec 99,843,796.00 24,853,658.54 2,881,749.51 127,579,204.05\nPedro Ascencio\n047 21,909,947.00 4,736,686.43 2,751,001.99 29,397,635.42\nAlquisiras\n048 Petatlán 44,945,539.00 8,251,624.06 4,124,141.55 57,321,304.61\n049 Pilcaya 10,294,605.00 1,429,139.18 5,244,373.15 16,968,117.32\n050 Pungarabato 20,880,851.00 7,088,514.39 1,733,803.73 29,703,169.12\n051 Quechultenango 53,766,228.00 13,199,538.85 4,202,119.92 71,167,886.77\n052 San Luis Acatlán 110,530,148.00 25,169,163.30 3,899,397.24 139,598,708.53\n053 San Marcos 64,856,743.00 12,522,946.90 4,705,138.90 82,084,828.80\nSan Miguel\n054 Totolapan 95,604,910.00 24,823,517.56 2,298,154.65 122,726,582.22\n055 Taxco de Alarcón 94,382,215.00 21,026,213.86 3,044,273.80 118,452,702.65\nMUNICIPAL, ENTRE LOS MUNICIPIOS DEL ESTADO DE\nGUERRERO PARA EL EJERCICIO FISCAL 2018\n056 Tecoanapa 73,304,775.00 15,117,476.15 4,154,258.22 92,576,509.37\n057 Técpan de Galeana 68,235,530.00 11,977,878.22 3,821,562.23 84,034,970.45\n058 Teloloapan 68,672,114.00 16,812,406.56 3,007,553.55 88,492,074.12\nTepecoacuilco de\n059 35,591,413.00 7,465,879.41 3,357,295.71 46,414,588.12\nTrujano\n060 Tetipac 18,327,094.00 4,758,881.17 2,785,510.34 25,871,485.50\n061 Tixtla de Guerrero 44,700,544.00 11,876,321.86 3,396,526.81 59,973,392.67\n062 Tlacoachistlahuaca 57,841,713.00 21,486,993.47 1,938,254.90 81,266,961.37\n063 Tlacoapa 30,686,306.00 5,610,521.48 3,946,796.29 40,243,623.77\n064 Tlalchapa 12,645,242.00 2,474,395.39 3,471,723.66 18,591,361.04\nTlalixtaquilla de\n065 12,108,374.00 3,193,659.10 2,152,311.68 17,454,344.78\nMaldonado\n066 Tlapa de Comonfort 95,947,567.00 30,433,771.07 3,899,441.56 130,280,779.63\n067 Tlapehuala 22,139,308.00 3,850,172.64 4,091,661.67 30,081,142.31\nLa Unión de Isidoro\n068 29,748,033.00 7,569,727.40 2,649,967.26 39,967,727.66\nMontes de Oca\n069 Xalpatláhuac 22,499,674.00 8,415,701.61 3,221,376.02 34,136,751.63\n070 Xochihuehuetlán 8,173,837.00 2,179,142.41 3,089,603.78 13,442,583.18\n071 Xochistlahuaca 77,782,901.00 20,080,504.87 2,469,350.96 100,332,756.83\n072 Zapotitlán Tablas 25,854,382.00 9,451,349.20 2,357,233.60 37,662,964.80\n073 Zirándaro 34,290,013.00 5,866,464.33 4,443,679.99 44,600,157.32\n074 Zitlala 39,471,356.00 8,892,309.61 4,387,853.06 52,751,518.67\n075 Eduardo Neri 36,148,210.00 14,011,087.67 2,830,515.27 52,989,812.94\n076 Acatepec 135,211,271.00 30,947,140.65 2,385,901.36 168,544,313.00\n077 Marquelia 13,221,793.00 4,518,992.72 2,326,800.98 20,067,586.70\n078 Cochoapa el Grande 70,790,543.00 21,861,357.14 2,341,852.74 94,993,752.87\n_\nMunicipio\nAsigna\n() n 2013\n(21\n¡\n)\nAsignac\n()\nFISMDF\nJosé Joaquín de\n079 38,971,270.00 12,813,220.13 2,745,128.84 54,529,618.97\nHerrera\n080 Juchitán 10,117,327.00 3,323,665.81 2,756,152.17 16,197,144.99\n081 Iliatenco 30,536,073.00 3,719,087.10 4,715,267.41 38,970,427.50\nTotal 4,097,436,017.00 1,048,853,787.20 262,213,446.80 5,408,503,251.00\nMUNICIPAL, ENTRE LOS MUNICIPIOS DEL ESTADO DE\nGUERRERO PARA EL EJERCICIO FISCAL 2018\nARTICULO NOVENO. De acuerdo al monto del Fondo de Aportaciones para la Infraestructura Social\nMunicipal, asignado al Estado de Guerrero por $5,408,503,251.00 (Cinco Mil Cuatrocientos Ocho Millones\nQuinientos Tres Mil Doscientos Cincuenta y Un pesos 00/100 M. N.) y al aplicar la fórmula establecida por la Secretaría de Desarrollo Social de la Federación, la asignación municipal resultante es la siguiente:\nFONDO DE APORTACIONES PARA LA\nINFRAESTRUCTURA SOCIAL MUNICIPAL 2018\nDEL ESTADO DE GUERRERO\nMunicipio Asignación 2018\nAcapulco de Juárez 585,006,804.09\nAhuacuotzingo 61,989,352.01\nAjuchitlán del Progreso 86,770,636.22\nAlcozauca de Guerrero 56,655,553.74\nAlpoyeca 10,475,453.53\nApaxtla 20,987,487.79\nArcelia 46,880,466.10\nAtenango del Río 16,119,562.06\nAtlamajalcingo del Monte 19,926,088.55\nAtlixtac 83,336,948.17\nAtoyac de Álvarez 84,284,258.91\nAyutla de los Libres 170,325,504.26\nAzoyú 30,202,309.65\nBenito Juárez 19,842,332.33\nBuenavista de Cuéllar 13,915,269.70\n45,918,339.90\nCoahuayutla de José María Izazaga\nCocula 21,306,956.10\nCopala 23,969,290.54\nCopalillo 41,023,881.74\nMUNICIPAL, ENTRE LOS MUNICIPIOS DEL ESTADO DE\nGUERRERO PARA EL EJERCICIO FISCAL 2018\nCopanatoyac 56,931,957.41\nCoyuca de Benítez 102,352,482.99\nCoyuca de Catalán 106,991,017.28\nCuajinicuilapa 46,393,478.17\nCualác 16,257,761.06\nCuautepec 33,374,230.27\nCuetzala del Progreso 20,476,975.86\nCutzamala de Pinzón 41,708,108.61\nChilapa de Álvarez 264,619,120.40\nChilpancingo de los Bravo 187,081,550.26\nFlorencio Villarreal 31,684,780.96\nGeneral Canuto A. Neri 17,541,268.43\nGeneral Heliodoro Castillo 128,046,751.08\nHuamuxtitlán 17,451,474.98\nMunicipio Asignación 2018\nHuitzuco de los Figueroa 47,865,815.74\nIguala de la Independencia 100,986,448.05\nIgualapa 28,485,312.83\nIxcateopan de Cuauhtémoc 11,590,664.52\nZihuatanejo de Azueta 78,653,484.41\nJuan R. Escudero 35,263,763.46\nLeonardo Bravo 41,500,124.51\nMalinaltepec 90,061,227.79\nMártir de Cuilapan 39,045,986.64\nMetlatónoc 71,649,631.24\nMochitlán 19,974,047.63\nOlinalá 54,110,801.35\nOmetepec 127,579,204.05\nPedro Ascencio Alquisiras 29,397,635.42\nPetatlán 57,321,304.61\nPilcaya 16,968,117.32\nMUNICIPAL, ENTRE LOS MUNICIPIOS DEL ESTADO DE\nGUERRERO PARA EL EJERCICIO FISCAL 2018\nPungarabato 29,703,169.12\nQuechultenango 71,167,886.77\nSan Luis Acatlán 139,598,708.53\nSan Marcos 82,084,828.80\nSan Miguel Totolapan 122,726,582.22\nTaxco de Alarcón 118,452,702.65\nTecoanapa 92,576,509.37\nTécpan de Galeana 84,034,970.45\nTeloloapan 88,492,074.12\nTepecoacuilco de Trujano 46,414,588.12\nTetipac 25,871,485.50\nTixtla de Guerrero 59,973,392.67\nTlacoachistlahuaca 81,266,961.37\nTlacoapa 40,243,623.77\nTlalchapa 18,591,361.04\nTlalixtaquilla de Maldonado 17,454,344.78\nTlapa de Comonfort 130,280,779.63\nTlapehuala 30,081,142.31\nLa Unión de Isidoro Montes de Oca 39,967,727.66\nXalpatláhuac 34,136,751.63\nXochihuehuetlán 13,442,583.18\nXochistlahuaca 100,332,756.83\nZapotitlán Tablas 37,662,964.80\nMunicipio Asignación 2018\nZirándaro 44,600,157.32\nZitlala 52,751,518.67\nEduardo Neri 52,989,812.94\nAcatepec 168,544,313.00\nMarquelia 20,067,586.70\nCochoapa el Grande 94,993,752.87\nJosé Joaquín de Herrera 54,529,618.97\nMUNICIPAL, ENTRE LOS MUNICIPIOS DEL ESTADO DE\nGUERRERO PARA EL EJERCICIO FISCAL 2018\nJuchitán 16,197,144.99\nIliatenco 38,970,427.50\nTotal 5,408,503,251.00\nARTICULO DECIMO. Con fundamento en el articulo 33 inciso A fracción II de la Ley de Coordinación\nFiscal, los Municipios podrán disponer de hasta un dos por ciento del total de recursos del Fondo para la\nInfraestructura Social Municipal y de las Demarcaciones Territoriales del Distrito Federal que les correspondan para la realización de un Programa de Desarrollo Institucional Municipal y de las\nDemarcaciones Territoriales del Distrito Federal. Este programa será convenido entre el Ejecutivo Federal a través de la Secretaria de Desarrollo Social, el Gobierno de la Entidad correspondiente y el Municipio o\nDemarcación Territorial de que se trate. Los recursos de este programa podrán utilizarse para la elaboración de proyectos con la finalidad de fortalecer las capacidades de gestión del Municipio o\nDemarcación Territorial, de acuerdo con lo señalado en el catálogo de acciones establecido en los\nLineamientos del Fondo que emita la Secretaria de Desarrollo Social.\nLos Municipios podrán destinar hasta un tres por ciento del total de los recursos del Fondo de Aportaciones para la Infraestructura Social Municipal, asignado a cada uno de ellos para gastos indirectos de las obras a que hace referencia en el mencionado artículo.\nRespecto de las aportaciones de este Fondo, con fundamento en artículo 33 inciso B fracción II, los\nMunicipios y demarcaciones Territoriales, deberán:\nI. Hacer del conocimiento de sus habitantes, los montos que reciban, las obras y acciones a realizar, el costo de cada una, su ubicación, metas y beneficiarios;\nII. Promover la participación de las comunidades beneficiadas, en su destino, aplicación y vigilancia, así como en la programación, ejecución, control, seguimiento y evaluación de las obras y acciones que se vayan a realizar;\nIII. Informar a sus habitantes, los avances del ejercicio de los recursos trimestralmente y al término de cada ejercicio, sobre los resultados alcanzados;\nIV. Proporcionar por conducto del Gobierno Estatal a la Secretaría de Desarrollo Social del Gobierno\nFederal, la información que sobre la utilización del Fondo de Aportaciones de Infraestructura Social\nMunicipal, le sea requerida;\nV. Procurar la preservación y protección del medio ambiente y que impulsen el desarrollo sostenible;\nDelegaciones Estatales o instancia equivalente en el Distrito Federal, así como a la Secretaría de Hacienda\nMUNICIPAL, ENTRE LOS MUNICIPIOS DEL ESTADO DE\nGUERRERO PARA EL EJERCICIO FISCAL 2018 y Crédito Público, el seguimiento sobre el uso de los recursos del Fondo, en los términos que establecen los artículos 48 y 49 de esta Ley, así como con base en el informe anual sobre la situación de pobreza y rezago social de las entidades y sus respectivos municipios o demarcaciones territoriales. Asimismo, las entidades, los municipios y las demarcaciones territoriales, deberán proporcionar la información adicional que solicite dicha Secretaría para la supervisión y seguimiento de los recursos; y,\nVII. Publicar en su página oficial de Internet las obras financiadas con los recursos de este Fondo. Dichas publicaciones deberán contener, entre otros datos, la información del contrato bajo el cual se celebra, informes trimestrales de los avances y, en su caso, evidencias de conclusión.\nLos municipios que no cuenten con página oficial de Internet, convendrán con el Gobierno del Estado, para que se publique la información correspondiente al municipio.\nARTÍCULO DÉCIMO PRIMERO. La Secretaría de Finanzas y Administración, una vez radicada la asignación mensual federal para la Infraestructura Social Municipal y conforme a la Ley de Coordinación\nFiscal y la Ley número 427 del Sistema de Coordinación Hacendaria del Estado de Guerrero, el Calendario de entrega de los recursos a los Municipios del Fondo de Aportaciones para la Infraestructura Social\nMunicipal para el Ejercicio Fiscal 2018 será el siguiente:\nMES FISM\nEnero 31\nFebrero\n28\nMarzo 30\nAbril 30\nMayo 31\nJunio 29\nJulio 31\nAgosto 31\nSeptiembre\nOctubre 31\nÚNICO. El presente Acuerdo entrará en vigor a partir del día siguiente de su publicación en el Periódico\nMUNICIPAL, ENTRE LOS MUNICIPIOS DEL ESTADO DE\nGUERRERO PARA EL EJERCICIO FISCAL 2018\nBoulevard René Juárez Cisneros No. 62, Ciudad de los Servicios en la Ciudad de Chilpancingo de los\nBravo, capital del Estado de Guerrero, a los veintidós días del mes de enero del año dos mil dieciocho.\nEL GOBERNADOR CONSTITUCIONAL DEL ESTADO DE GUERRERO.\nLIC. HÉCTOR ANTONIO ASTUDILLO FLORES.\nRúbrica.\nEL SECRETARIO GENERAL DE GOBIERNO.\nLIC. FLORENCIO SALAZAR ADAME.\nRúbrica.\nEL SECRETARIO DE FINANZAS Y ADMINISTRACIÓN.\nLIC. HÉCTOR APREZA PATRÓN.\nRúbrica.\nEL SECRETARIO DE PLANEACIÓN Y DESARROLLO REGIONAL.\nM.A.P. DAVID GUZMÁN MALDONADO.\nRúbrica.",
  "ordenamiento": "ACUERDO",
  "jurisdiccion": "GUERRERO",
  "fuente_oficial": "DIARIO OFICIAL DE LA FEDERACION",
  "Fecha de Publicación": "30 \nde Enero de 2018",
  "ULTIMA REFORMA PUBLICADA": null,
  "status": "VIGENTE",
  "es_escaneado": false,
  "tiene_tablas": true,
  "materia": [
    "general"
  ]
}