{
  "titulo": "Acuerdo Delegatorio de Facultades y de Representación Legal Que Emite el Lic. C. Arturo Latabán Lópe",
  "Contenido": "ESTADO DE GUERRERO, A FAVOR DEL LICENCIADO\nMARCO ANTONIO CRUZ MANJARREZ SALGADO,\nDIRECTOR DE ASUNTOS JURÍDICOS DE LA\nAUDITORÍA GENERAL DEL ESTADO\nTEXTO ORIGINAL\nAcuerdo publicado en el Periódico Oficial del Gobierno del Estado No. 58, el Viernes 20 de Julio de 2012.\nACUERDO DELEGATORIO DE FACULTADES Y DE REPRESENTACIÓN LEGAL QUE EMITE EL LIC.\nC. ARTURO LATABÁN LÓPEZ, AUDITOR GENERAL DEL ESTADO DE GUERRERO, A FAVOR DEL\nLICENCIADO MARCO ANTONIO CRUZ MANJARREZ SALGADO, DIRECTOR DE ASUNTOS\nJURÍDICOS DE LA AUDITORIA GENERAL DEL ESTADO.\nEL SUSCRITO LICENCIADO CERTIFICADO ARTURO LATABÁN LÓPEZ, AUDITOR\nGENERAL DEL ESTADO, EN USO DE LAS FACULTADES QUE ME CONFIEREN LOS ARTÍCULOS\nGUERRERO; 2 04 DE LA LEY ORGÁNICA DEL PODER LEGISLATIVO DEL ESTADO NÚMERO 286; I°,\n77, 90 Y DEMÁS RELATIVOS DE LA LEY NUMERO 1028 DE FISCALIZACIÓN SUPERIOR Y\nRENDICION DE CUENTAS DEL ESTADO DE GUERRERO Y:\nPRIMERO.- EN TÉRMINOS DE LO ESTABLECIDO POR LOS ARTÍCULOS 107 FRACCIÓN IV\nSOBERANO DE GUERRERO; 204 DE LA LEY ORGÁNICA DEL PODER LEGISLATIVO DEL ESTADO\nDE GUERRERO Y 11 DE LA LEY DE FISCALIZACIÓN SUPERIOR DEL ESTADO DE GUERRERO\nNUMERO 564, CON FECHA VEINTE DE DICIEMBRE DEL AÑO DOS MIL DIEZ, FUI NOMBRADO\nAUDITOR GENERAL DEL ESTADO, POR LA QUINCUAGÉSIMA NOVENA LEGISLATURA AL\nDE 8 AÑOS CONTADOS A PARTIR DEL DIA PRIMERO DE ENERO DE DOS MIL ONCE.\nSEGUNDO.- CON FECHA VEINTIOCHO DE FEBRERO DE DOS MIL DOCE, SE PUBLICO EN\nEL PERIODICO OFICIAL DEL GOBIERNO DEL ESTADO DE GUERRERO, LA LEY NUMERO 1028 DE\nFISCALIZACION SUPERIOR Y RENDICION DE CUENTAS DEL ESTADO DE GUERRERO, MISMA\nQUE EN SU ARTICULO TERCERO TRANSITORIO DISPONE QUE EL AUDITOR GENERAL DEL\nDE SU NOMIBRAMIENTO, ASI COMO EN SU ARTICULO SEXTO TRANSITORIO, ESTABLECE QUE\nLOS PROCEDIMIENTOS CUYO TRAMITE HAYA INICIADO PREVIO A LA VIGENCIA DE DICHA LEY,\nFISCALIZACION SUPERIOR DEL ESTADO DE GUERRERO NUMERO 564.\nTERCERO.- CON FEHA DOS DE MAYO DE DOS MIL DOCE, PREVIA APROBACION DE LA\nCOMISION DE VIGILANCIA Y EVALUACION DE LA QUINCUAGESIMA NOVENA LEGISTURA AL H.\nCONGRESO DEL ESTADO, OTORGADA EN SESION DE FECHA 25 DE ABRIL DEL AÑO EN CURSO\nY COMUNICADA AL AUDITOR GENERAL DEL ESTADO, MEDIANTE OFICIO NUMERO\nESTADO DE GUERRERO, A FAVOR DEL LICENCIADO\nMARCO ANTONIO CRUZ MANJARREZ SALGADO,\nDIRECTOR DE ASUNTOS JURÍDICOS DE LA\nAUDITORÍA GENERAL DEL ESTADO\nHCEG/GGMB/064/2012, DE FECHA 30 DEL MISMO MES Y AÑO, SE NOMBRO AL LICENCIADO\nMARCO ANTONIO CRUZ MANJARREZ SALGADO COMO DIRECTOR DE ASUNTOS JURIDICOS DE\nLA AUDITORIA GENERAL DEL ESTADO.\nCUARTO.- QUE EL ARTICULO 90 DE LA LEY NUMERO 1028 DE FISCALIZACIÓN SUPERIOR\nY RENDICION DE CUENTAS DEL ESTADO DE GUERRERO, SEÑALA LAS FACULTADES QUE\nTENGO EN MI CARÁCTER DE AUDITOR GENERAL DEL ESTADO, INDICANDO EN LA FRACCION I\nDEL CITADO PRECEPTO, QUE EL SUSCRITO TIENE FACULTADES DE REPRESENTAR\nLEGALMENTE A LA AUDITORIA GENERAL DEL ESTADO, CON FACULTADES GENERALES Y\nESPECIALES Y CON CAPACIDAD PARA DELEGARLAS DENTRO DE LAS CONTROVERSIAS EN LAS\nQUE LA AUDITORIA GENERAL DEL ESTADO SEA PARTE; EN LA FRACCION II ESTABLECE, QUE\nEL AUDITOR GENERAL DEL ESTADO EJERCERA SUS FACULTADES DE MANERA DIRECTA Y\nEXCEPCIONALMENTE POR DELEGACION DE CONFORMIDAD CON LO ESTABLECIDO EN LAS\nLEYES APLICABLES; EN SU FRACCION III, SE DETERMINA QUE ES FACUTAD DEL AUDITOR\nGENERAL DEL ESTADO EXPEDIR POR SI O A TRAVES DEL DIRECTOR DE ASUNTOS JURIDICOS,\nCERTIFICACIONES DE LOS DOCUMENTOS QUE OBREN EN LOS ARCHIVOS DE LA AUDITORIA\nGENERAL A QUIENES ACREDITEN SU INTERES JURIDICO; ASI TAMBIEN QUE EL ARTICULO 96\nDEL REFERIDO ORDENAMIENTO LEGAL, ESTABLECE EN SU FRACCION II, QUE EL DIRECTOR DE\nASUNTOS JURIDICOS TENDRA LA FACULTAD DE INSTRUIR LOS PROCEDIMIENTOS\nADMINISTRATIVOS PARA EL FINCAMIENTO DE LAS RESPONSABILIDADES RESARCITORIAS A\nQUE SE REFIERE DICHA LEY, POR ACUERDO DEL AUDITOR GENERAL; EN SU FRACCION III, QUE\nEL MENCIONADO DIRECTOR DE ASUNTOS JURIDICOS PREVIO ACUERDO DELEGATORIO DEL\nAUDITOR GENERAL, TENDRA LA FACULTAD DE EXPEDIR LAS COPIAS CERTIFICADAS DE LA\nDOCUMENTACION QUE OBRE EN LOS ARCHIVOS DE LA AUDITORIA GENERAL DEL ESTADO,\nPREVIA SOLICITUD DE PERSONA LEGITIMADA PARA ELLO; Y EN SU FRACCION IV, QUE SERA\nFACULTAD DEL DIRECTOR DE ASUNTOS JURIDICOS, INSTRUIR EL RECURSO DE\nRECONSIDERACION PREVISTO EN DICHA LEY, POR ACUERDO DEL AUDITOR GENERAL DEL\nESTADO\".\nQUINTO.- QUE EN CONGRUENCIA CON LO ANTERIOR, A FIN DE DAR MAYOR AGILIDAD A\nLA AUDITORIA GENERAL DEL ESTADO, CON FUNDAMENTO EN LO DISPUESTO EN LOS\nARTICULOS 1, 77, 90 Y 96 DE LA LEY NUMERO 1028 DE FISCALIZACION SUPERIOR Y RENDICION\nDE CUENTAS DEL ESTADO DE GUERRERO, RESULTA PROCEDENTE DELEGAR LA\nANTERIOR, AL LICENCIADO MARCO ANTONIO CRUZ MANJARREZ SALGADO EN SU CARÁCTER\nDE DIRECTOR DE ASUNTOS JURÍDICOS DE LA AUDITORIA GENERAL DEL ESTADO; POR LO QUE\nEXPIDO EL SIGUIENTE:\nESTADO DE GUERRERO, A FAVOR DEL LICENCIADO\nMARCO ANTONIO CRUZ MANJARREZ SALGADO,\nDIRECTOR DE ASUNTOS JURÍDICOS DE LA\nAUDITORÍA GENERAL DEL ESTADO\nACUERDO DELEGATORIO DE REPRESENTACIÓN LEGAL Y DE FACULTADES, A FAVOR DEL\nLICENCIADO MARCO ANTONIO CRUZ MANJARREZ SALGADO, DIRECTOR DE ASUNTOS\nJURÍDICOS DE LA AUDITORIA GENERAL DEL ESTADO, EN LOS SIGUIENTES TERMINOS:\nARTÍCULO PRIMERO.- EN VIRTUD DE LAS CONSIDERACIONES ANTES SEÑALADAS, SE\nDELEGA A FAVOR DEL LICENCIADO MARCO ANTONIO CRUZ MANJARREZ SALGADO, EN SU\nCARÁCTER DE DIRECTOR DE ASUNTOS JURÍDICOS DE LA AUDITORÍA GENERAL DEL ESTADO,\nLAS FACULTADES PREVISTAS EN LAS FRACCIONES I, II Y III DEL ARTÍCULO 90 DE LA LEY\nNUMERO 1028 DE FISCALIZACION SUPERIOR Y RENDICION DE CUENTAS DEL ESTADO DE\nGUERRERO, LO ANTERIOR EN TERMINOS DE LAS DISPOSICIONES LEGALES EN VIGOR EN EL\nESTADO DE GUERRERO Y PARA EFECTOS DE LO ESTABLECIDO EN LAS FRACCIONES II, III Y IV\nDEL ARTICULO 96 DE LA REFERIDA LEY NUMERO 1028 DE FISCALIZACION SUPERIOR Y\nRENDICION DE CUENTAS DEL ESTADO DE GUERRERO; ASÍ COMO LAS QUE SE DERIVEN DE LO\nDISPUESTO EN LOS ARTICULO DEL 63 AL 68 DE DICHA LEY, PARA QUE INICIE, CONOZCA E\nINSTRUYA EN TODAS SUS ETAPAS EL PROCEDIMIENTO PARA EL FINCAMIENTO DE LA\nRESPONSABILIDAD RESARCITORIA PREVISTO EN EL CAPITULO IV DEL TÍTULO TERCERO DE LA\nCITADA LEY, TRAMITÁNDOLOS EN TODAS Y CADA UNA DE LAS ETAPAS PROCEDIMENTALES\nQUE EN DERECHO CORRESPONDAN Y DE LOS RECURSOS DE RECONSIDERACION QUE SE\nHAGAN VALER ANTE LA AUDITORIA GENERAL DEL ESTADO; DE IGUAL MANERA EL DELEGADO\nREPRESENTARA LEGALMENTE A LA AUDITORIA GENERAL DEL ESTADO, EN LAS\nCONTROVERSIAS DONDE ESTE SEA PARTE, PODRÁ CONTESTAR DEMANDAS DE NULIDAD\nANTE EL TRIBUNAL DE LO CONTENCIOSO ADMINISTRATIVO, ASÍ COMO PROMOVER LAS\nACCIONES LEGALES QUE PROCEDAN ANTE EL CITADO TRIBUNAL; INTERPONER, PROMOVER, Y\nTRAMITAR LO INHERENTE A LOS JUICIOS DE AMPARO; ASÍ COMO REPRESENTAR A LA\nAUDITORÍA GENERAL DEL ESTADO ANTE LAS ENTIDADES FISCALIZADAS, LAS AUTORIDADES\nFEDERALES Y LOCALES, LAS ENTIDADES FEDERATIVAS, LOS AYUNTAMIENTOS Y DEMÁS\nPERSONAS FÍSICAS Y MORALES E INTERVENIR Y PROVEER LO CONDUCENTE RESPECTO DE\nLOS MEDIOS DE DEFENSA PREVISTOS EN CAPITULO UNICO DEL TITULO SEPTIMO DE LA\nREFERIDA LEY DE FISCALIZACION SUPERIOR Y RENDICION DE CUENTAS DEL ESTADO DE\nGUERRERO; DEBIENDO EJECUTAR EL DELEGADO TODOS LOS ACTOS Y ACCIONES\nINHERENTES QUE CONLLEVAN LAS FACULTADES DELEGADAS, ASEGURANDO LAS MEDIDAS\nACUERDO; SE EXCEPCIONAN LOS ACTOS INMERSOS EN LAS DEMAS FRACCIONES DEL\nARTÍCULO 90 DESCRITO Y EL DICTADO DE CUALQUIER TIPO DE RESOLUCIÓN QUE RESUELVA\nRECONSIDERACIÓN, ASI COMO LA RELATIVA A FORMULAR DENUNCIAS DE JUICIO POLITICO,\nQUEDANDO ESTAS ÚLTIMAS RESERVADAS AL DELEGANTE.\nASIMISMO, PARA LOS EFECTOS DE LO DISPUESTO POR EL ARTICULO SEXTO\nTRANSITORIO DE LA LEY NUMERO 1028 DE FISCALIZACION SUPERIOR Y RENDICION DE\nESTADO DE GUERRERO, A FAVOR DEL LICENCIADO\nMARCO ANTONIO CRUZ MANJARREZ SALGADO,\nDIRECTOR DE ASUNTOS JURÍDICOS DE LA\nAUDITORÍA GENERAL DEL ESTADO\nCUENTAS DEL ESTADO DE GUERRERO, EL LICENCIADO CERTIFICADO ARTURO LATABAN\nLOPEZ, AUDITOR GENERAL DEL ESTADO, DELEGA EN EL LICENCIADO MARCO ANTONIO CRUZ\nMANJARREZ SALGADO, DIRECTOR DE ASUNTOS JURIDICOS DE LA AUDITORIA GENERAL DEL\nESTADO, LAS FACULTADES PREVISTAS EN LAS FRACCIONES I, II Y III DEL ARTICULO 19 DE LA\nLEY DE FISCALIZACION SUPERIOR DEL ESTADO DE GUERRERO NUMERO 564; ASI COMO LAS\nQUE SE DERIVEN DE LOS ARTICULOS 66 AL 74 DEL ORDENAMIENTO LEGAL ANTES SEÑALADO,\nPARA QUE INICIE O CONTINUE Y DE SEGUIMIENTO HASTA SU CONCLUSION A LOS\nPROCEDIMIENTOS ADMINISTRATIVOS PARA EL FINCAMIENTO DE RESPONSABILIDAD\nRESARCITORIA PREVISTO EN EL CAPITULO III DEL TITULO SEPTIMO DE LA CITADA LEY DE\nFISCALIZACION NUMERO 564 Y QUE SE INICIARON ANTES DE LA ENTRADA EN VIGOR DE LA LEY\nNUMERO 1028 DE FISCALIZACION SUPERIOR Y RENDICION DE CUENTAS DEL ESTADO DE\nGUERRERO, TRAMITANDOLOS EN TODAS Y CADA UNA DE LAS ETAPAS PROCEDIMENTALES\nQUE EN DERECHO CORRESPONDAN; DE IGUAL MANERA EL DELEGADO REPRESENTARA\nLEGALMENTE A LA AUDITORIA GENERAL DEL ESTADO, EN LAS CONTROVERSIAS DONDE ESTE\nSEA PARTE, PODRA CONTESTAR DEMANDAS DE NULIDAD ANTE EL TRIBUNAL DE LO\nCONTENCIOSO ADMINISTRATIVO, ASI COMO PROMOVER Y TRAMITAR LO INHERENTE A LOS\nJUICIOS DE AMPARO; INTERPONER EN SU CASO, DENUNCIAS O QUERELLAS RESPECTO DE\nLOS HECHOS EMANADOS DE LOS PROCEDIMIENTOS ADMINISTRATIVOS PARA EL FINCAMIENTO\nDE RESPONSABILIDAD RESARCITORIA; ASÍ COMO REPRESENTAR A LA CITADA AUDITORIA\nGENERAL DEL ESTADO ANTE LAS ENTIDADES FISCALIZADAS, LAS AUTORIDADES FEDERALES Y\nLOCALES, LAS ENTIDADES FEDERATIVAS, LOS AYUNTAMIENTOS Y DEMÁS PERSONAS FÍSICAS\nY MORALES E INTERVENIR Y PROVEER LO CONDUCENTE, Y EN GENERAL LLEVAR A CABO\nTODAS AQUELLAS DILIGENCIAS Y TRÁMITES PARA LA DEBIDA INTEGRACIÓN DE LOS\nEXPEDIENTES RELATIVOS DE LOS PROCEDIMIENTOS EN TÉRMINOS DE LAS DISPOSICIONES\nLEGALES APLICABLES Y DEL PRESENTE ACUERDO; DEBIENDO EJECUTAR, EL DELEGADO\nTODOS LOS ACTOS Y ACCIONES INHERENTES QUE CONLLEVAN LAS FACULTADES\nDELEGADAS, ASEGURANDO CON LAS MEDIDAS NECESARIAS EL CUMPLIMIENTO DE LAS\nDISPOSICIONES CONTENIDAS EN EL PRESENTE ACUERDO; Y SE EXCEPCIONAN, LOS ACTOS\nINMERSOS EN LAS DEMAS FRACCIONES DEL ARTÍCULO 19 DE LA LEY DE FISCALIZACIÓN\nNÚMERO. 564, Y EL DICTADO DE CUALQUIER TIPO DE RESOLUCIÓN INTERLOCUTORIA Y\nRESPECTIVOS RECURSOS DE RECONSIDERACIÓN, QUEDANDO ESTAS ÚLTIMAS RESERVADAS\nEN FORMA EXCLUSIVA AL DELEGANTE.\nARTÍCULO SEGUNDO.- EL EJERCICIO DE LAS FACULTADES QUE SE DELEGAN EN EL\nAPLICABLE.\nESTADO DE GUERRERO, A FAVOR DEL LICENCIADO\nMARCO ANTONIO CRUZ MANJARREZ SALGADO,\nDIRECTOR DE ASUNTOS JURÍDICOS DE LA\nAUDITORÍA GENERAL DEL ESTADO\nARTÍCULO TERCERO.- LA PRESENTE DELEGACIÓN DE FACULTADES SE ENTIENDE\nHECHA SIN PERJUICIO DE SU EJERCICIO DIRECTO POR PARTE DEL AUDITOR GENERAL DEL\nESTADO.\nARTÍCULO CUARTO.- EL DELEGADO DEBERÁ INFORMAR MENSUALMENTE AL AUDITOR\nGENERAL DEL ESTADO O CUANDO ESTE LE SOLICITE, DEL EJERCICIO DE LAS FACULTADES\nQUE SE LE DELEGAN.\nUNICO.- EL PRESENTE ACUERDO ENTRARÁ EN VIGOR AL DÍA SIGUIENTE AL DE SU\nLATABÁN LÓPEZ, AUDITOR GENERAL DEL ESTADO DE GUERRERO, EN LA CIUDAD DE\nCHILPANCINGO DE LOS BRAVO, GUERRERO, A LOS DIECIOCHO DÍAS DEL MES DE JUNIO DEL\nAÑO DOS MIL DOCE.\nPUBLÍQUESE Y CÚMPLASE.\nRúbrica.",
  "ordenamiento": "ACUERDO",
  "jurisdiccion": "GUERRERO",
  "fuente_oficial": "DIARIO OFICIAL DE LA FEDERACION",
  "Fecha de Publicación": "20 de Julio \nde 2012",
  "ULTIMA REFORMA PUBLICADA": null,
  "status": "VIGENTE",
  "es_escaneado": false,
  "tiene_tablas": false,
  "materia": [
    "general"
  ]
}