{
  "titulo": "Acuerdo de Colaboración Que Celebran el Instituto Federal Electoral, Representado por el M.c.c. Luis",
  "Contenido": "EL QUE SE ESTABLECEN ACCIONES Y\nCOMPROMISOS PARA PROPICIAR\nCONDICIONES DE SEGURIDAD DURANTE EL\nPROCESO ELECTORAL FEDERAL 2008-2009\nABROGADO POR CONCLUIDA SU VIGENCIA EL 5 DE JULIO DEL 2009.\nTEXTO ORIGINAL\nAcuerdo Publicado en el Periódico Oficial del Gobierno del Estado No. 43 Alcance\nI, el Viernes 29 de Mayo de 2009.\nACUERDO DE COLABORACIÓN QUE CELEBRAN EL INSTITUTO FEDERAL\nELECTORAL, REPRESENTADO POR EL M.C.c. LUIS ZAMORA COBIÁN, VOCAL\nEJECUTIVO DE LA JUNTA LOCAL EJECUTIVA EN GUERRERO Y EL GOBIERNO\nDEL ESTADO DE GUERRERO, REPRESENTADO POR EL LIC. GUILLERMO\nRAMÍREZ RAMOS, SECRETARIO GENERAL DE GOBIERNO, POR EL QUE SE\nESTABLECEN ACCIONES Y COMPROMISOS PARA PROPICIAR CONDICIONES DE\nSEGURIDAD DURANTE EL PROCESO ELECTORAL FEDERAL 2008-2009.\nANTECEDENTES Y FUNDAMENTACIÓN\n1. La Constitución Política de los Estado Unidos Mexicanos en su artículo 21 párrafo noveno dispone que la seguridad pública es una función a cargo de la federación, los estados y los municipios, que comprende la prevención de los delitos; su investigación, persecución y sanción de acuerdo con las competencias que la propia\nConstitución señala para cada nivel de gobierno.\n2. Por otra parte, el artículo 41 base V de la misma ley suprema del país, realiza a través del Instituto Federal Electoral que es un organismo público, autónomo, con personalidad jurídica y patrimonio propios, cuyo órgano máximo de dirección es el\nConsejo General. Dicho órgano tiene entre sus atribuciones, dictar los acuerdos necesarios para garantizar la celebración pacífica de las elecciones federales.\n3. En consonancia con las disposiciones constitucionales invocadas, el Código\nFederal de Instituciones y Procedimientos Electorales en su artículo 2 párrafo 1 dispone que, para el desempeño de sus funciones las autoridades electorales establecidas por la\nEL QUE SE ESTABLECEN ACCIONES Y\nCOMPROMISOS PARA PROPICIAR\nCONDICIONES DE SEGURIDAD DURANTE EL\nPROCESO ELECTORAL FEDERAL 2008-2009 constitución y el propio código, contarán con el apoyo y colaboración de las autoridades federales, estatales y municipales.\n4. Con base en sus facultades legales, el 22 de diciembre del 2008 el Consejo\nGeneral del Instituto Federal Electoral aprobó el Acuerdo CG959/2008, por el que se establecen medidas y compromisos de los Partidos Políticos Nacionales y del propio\nInstituto para propiciar condiciones de seguridad, legalidad y transparencia durante el proceso electoral federal 2008-2009.\nCon base en las disposiciones constitucionales y legales anteriores, y para dar cumplimiento a lo establecido en el acuerdo CG959/2008 aprobado por el Consejo\nGeneral del Instituto Federal Electoral el 22 de diciembre de 2008, el Gobierno del\nEstado de Guerrero y la Junta Ejecutiva Local del Instituto Federal Electoral en la entidad, establecen el siguiente:\nPRIMERO: El Gobierno del Estado de Guerrero instrumentará a través de sus cuerpos de seguridad pública estatal, las medidas y acciones pertinentes para garantizar el desarrollo e integridad de las actividades que el Instituto Federal Electoral lleve a cabo en el marco del Proceso Electoral Federal 2008-2009 en el territorio guerrerense.\nNacionales, brindará protección y seguridad a Candidatos a Diputados Federales debidamente registrados ante el Instituto, siempre y cuando medie solicitud por escrito de los Candidatos interesados, tal como lo dispone el artículo 230 párrafo 3 del Código\nFederal de Instituciones y Procedimientos Electorales, así como el punto segundo, TERCERO: Las medidas logísticas y las acciones específicas para la seguridad de los Candidatos a lo largo de las Campañas Electorales, serán definidas por el\nEL QUE SE ESTABLECEN ACCIONES Y\nCOMPROMISOS PARA PROPICIAR\nCONDICIONES DE SEGURIDAD DURANTE EL\nPROCESO ELECTORAL FEDERAL 2008-2009\nCoaliciones que los postulen.\nCUARTO: Para que el Gobierno del Estado cumpla adecuadamente los compromisos a que se refiere el presente acuerdo, la Junta Local del Instituto Federal\nElectoral, los Partidos Políticos y Candidatos aportarán oportunamente la información necesaria a efecto de que los cuerpos de seguridad adopten e instrumenten las medidas y acciones viables y pertinentes, respetando en todo momento la autonomía del Instituto y sus Órganos, así como la vida interna de los Partidos Políticos.\nQUINTO: La Junta Ejecutiva Local del Instituto Federal Electoral en Guerrero notificará el contenido del presente acuerdo de colaboración a las autoridades centrales del propio Instituto, así como a los Partidos Políticos representados en el Consejo Local de esta Entidad.\nSEXTO: Para el correcto y oportuno cumplimiento de este instrumento, el\nGobierno del Estado y la Junta Local Ejecutiva, mantendrán permanente comunicación y colaboración a través de las instancias que cada una de las partes determine.\nSÉPTIMO: Publíquese el presente Acuerdo en el Periódico Oficial del Gobierno del Estado de Guerrero.\nDado en la ciudad de Chilpancingo, capital del Estado de Guerrero, a los veintiséis días del mes de mayo de año dos mil nueve.\nPOR EL INSTITUTO FEDERAL ELECTORAL.\nM.C.c. LUIS ZAMORA COBIÁN.\nVOCAL EJECUTIVO DE LA JUNTA EJECUTIVA LOCAL\nEN EL ESTADO DE GUERRERO.\nEL QUE SE ESTABLECEN ACCIONES Y\nCOMPROMISOS PARA PROPICIAR\nCONDICIONES DE SEGURIDAD DURANTE EL\nPROCESO ELECTORAL FEDERAL 2008-2009\nLIC. GUILLERMO RAMÍREZ RAMOS.\nSECRETARIO GENERAL DE GOBIERNO.",
  "ordenamiento": "ACUERDO",
  "jurisdiccion": "GUERRERO",
  "fuente_oficial": "DIARIO OFICIAL DE LA FEDERACION",
  "Fecha de Publicación": "29 de Mayo de 2009",
  "ULTIMA REFORMA PUBLICADA": "29 de Mayo de 2009",
  "status": "ABROGADA",
  "es_escaneado": false,
  "tiene_tablas": false,
  "materia": [
    "electoral"
  ]
}