{
  "titulo": "Acuerdo de Coordinación para el Ejercicio de Facultades en Materia de Control Sanitario de Productos",
  "Contenido": "TABACO, QUE CELEBRAN POR UNA PARTE, EL\nEJECUTIVO FEDERAL, A TRAVÉS DE LA\nTEXTO ORIGINAL\nAcuerdo de Coordinación publicado en el Periódico Oficial del Gobierno del\nEstado No. 15, el Martes 22 de Febrero de 2011.\nACUERDO DE COORDINACIÓN PARA EL EJERCICIO DE FACULTADES EN\nMATERIA DE CONTROL SANITARIO DE PRODUCTOS DEL TABACO QUE\nCELEBRAN, POR UNA PARTE, EL EJECUTIVO FEDERAL, A TRAVÉS DE LA\nSECRETARÍA DE SALUD, EN LO SUCESIVO \"LA SECRETARÍA\", REPRESENTADA\nPOR SU TITULAR, DR. JOSÉ ÁNGEL CÓRDOVA VILLALOBOS, CON LA\nPARTICIPACIÓN DE LA COMISIÓN FEDERAL PARA LA PROTECCIÓN CONTRA\nRIESGOS SANITARIOS, EN LO SUCESIVO \"LA COMISIÓN\", REPRESENTADA POR\nSU TITULAR, LIC. MIGUEL ÁNGEL TOSCANO VELASCO Y, POR LA OTRA, EL\n\"EL EJECUTIVO ESTATAL\", REPRESENTADO POR EL GOBERNADOR\nCONSTITUCIONAL, C.P. CARLOS ZEFERINO TORREBLANCA GALINDO, CON LA\nINTERVENCIÓN DEL SECRETARIO GENERAL DE GOBIERNO, C.P. ISRAEL\nSOBERANIS NOGUEDA, DEL SECRETARIO DE SALUD EN EL ESTADO DE\nGUERRERO, DR. ANTONIO SALVADOR JAIMES HERRERA, EL SUBSECRETARIO\nDE REGULACIÓN, CONTROL Y FOMENTO SANITARIO, DR. SAÚL LÓPEZ SILVA,\nAL TENOR DE LOS SIGUIENTES ANTECEDENTES, DECLARACIONES Y\nCLÁUSULAS:\nI. Conforme a los artículos 26 de la Constitución Política de los Estados Unidos desarrolla el Plan Nacional de Desarrollo y los programas sectoriales, institucionales, regionales, especiales; en los que se precisan los objetivos nacionales, estrategias y y responsables de su ejecución.\nTABACO, QUE CELEBRAN POR UNA PARTE, EL\nEJECUTIVO FEDERAL, A TRAVÉS DE LA de la Federación, la Ley General para el Control del Tabaco y el Reglamento de la Ley\nGeneral para el Control del Tabaco, respectivamente. Este último ordenamiento legal, en sus artículos 3 y 71 establece que corresponde a \"LA SECRETARÍA\", así como a los gobiernos de las entidades federativas, en sus respectivos ámbitos de competencia, aplicar las disposiciones en materia del control sanitario de productos del tabaco.\nIII. El 20 de agosto de 1996, el Ejecutivo Federal y el Gobierno del Estado de\nGuerrero suscribieron el Acuerdo Nacional para la Descentralización de los Servicios de\nSalud, en el que se comprometieron a realizar las acciones necesarias para concretar sus respectivas responsabilidades en la conducción y operación de los servicios de salud.\nExpuesto lo anterior, y con fundamento en los artículos 4º, párrafo tercero, 26 y\n116, fracción VII, de la Constitución Política de los Estados Unidos Mexicanos; 39 de la\nLey Orgánica de la Administración Pública Federal; 33, 34, 35, 36 y 44 de la Ley de\nPlaneación; 17 bis, 18, 21, 287 de la Ley General de Salud; 1º, 2º, inciso C, fracción X, 6°, 7° fracción XXII del Reglamento Interior de la Secretaría de Salud; 3, 12, 30 y 36 de la\nLey General para el Control del Tabaco; 3° del Reglamento de la Ley General para el\nControl del Tabaco; 3° fracciones I, inciso f) y III del Reglamento de la Comisión Federal para la Protección Contra Riesgos Sanitarios; así como en los artículos el artículo 74, 4o, 11, 18, fracciones I, VIII, 20, fracción III y 27 de la Ley Orgánica de la Administración\nPública del Estado de Guerrero Número 433; 1o, 3o, fracción II, 4o, 4 Bis, 7, 15, inciso\nA), 171 y demás relativos aplicables de la Ley Núm. 159, de Salud del Estado de\nGuerrero, \"LA SECRETARÍA\" y \"EL EJECUTIVO ESTATAL\" convienen en suscribir el presente Acuerdo de Coordinación, cuya ejecución se realizará al tenor de las siguientes:\nI. Declara \"LA SECRETARÍA\" por conducto de su representante que:\nTABACO, QUE CELEBRAN POR UNA PARTE, EL\nEJECUTIVO FEDERAL, A TRAVÉS DE LA\nI.1 Es una Dependencia de la Administración Pública Centralizada del Poder\nEjecutivo Federal, según lo dispuesto por los artículos 2 y 26 de la Ley Orgánica de la\nAdministración Pública Federal, cuyas atribuciones para la protección de la salud de la población están previstas por el artículo 39 de la misma Ley, así como por los artículos 1, 5, y 8 de la Ley General para el Control del Tabaco, y artículos 1º, 2º y 3º de la Ley\nGeneral de Salud.\nI.2 El Secretario de Salud fue designado, mediante nombramiento de fecha 1° de diciembre de 2006, expedido por el Presidente de los Estados Unidos Mexicanos, Lic.\nFelipe de Jesús Calderón Hinojosa, y quien cuenta con facultades para suscribir el\nAcuerdo de Coordinación con fundamento en los artículos 6° y 7°, fracciones XVII y XXII del Reglamento Interior de la Secretaría de Salud.\nI.3 Cuenta con un órgano desconcentrado denominado Comisión Federal para la\nProtección contra Riesgos Sanitarios, el cual goza de autonomía técnica, administrativa y operativa, que tiene por objeto el ejercicio de las atribuciones que en materia de control sanitario de productos del tabaco, conforme a la Ley General de Salud, Ley General para el Control del Tabaco y demás ordenamientos aplicables le corresponden a \"LA\nSECRETARÍA\", en los términos de su Reglamento y por conducto de las unidades administrativas que integran dicha Comisión.\nI.4 \"LA COMISIÓN\" se encuentra debidamente representada por su titular el Lic.\nFelipe de Jesús Calderón Hinojosa, Presidente de los Estados Unidos Mexicanos.\nI.5 De conformidad con lo establecido en el artículo 10, fracciones III, VII, IX y XVI del Reglamento de la Comisión Federal para la Protección contra Riesgos Sanitarios, su titular está facultado para suscribir el presente instrumento.\nI.6 Para efectos del presente Acuerdo de Coordinación señala como su domicilio el ubicado en Lieja No. 7, 1er. Piso, Col. Juárez, Delegación Cuauhtémoc, C.P. 06696, México, Distrito Federal.\nTABACO, QUE CELEBRAN POR UNA PARTE, EL\nEJECUTIVO FEDERAL, A TRAVÉS DE LA\nII. \"EL EJECUTIVO ESTATAL\" por conducto de su representante declara:\nII.1 Que es parte integrante de la Federación, Libre y Soberano de conformidad a lo establecido por los artículos 40, 41 y 43 de la Constitución Política de los Estados\nGuerrero.\nII.2 Que el Gobernador del Estado de Guerrero, C.P. Carlos Zeferino Torreblanca\nGalindo, está facultado para celebrar el presente Acuerdo de Coordinación, de conformidad con lo establecido en el artículo 74, fracción XXXVII de la Constitución\nSecretario General de Gobierno interviene en términos del artículo 20, fracción III de la\nLey Orgánica de la Administración Pública del Estado de Guerrero Número 433.\nII.3 La Secretaria de Salud en Guerrero, es una Dependencia de la\nAdministración Pública Centralizada del Ejecutivo Estatal, acorde a lo dispuesto por los artículos 1, 11, 18, Fracción VIII y 27 de la Ley Orgánica de la Administración Pública del\nEstado de Guerrero, cuyas atribuciones para la protección de la Salud de la población, están previstas en la citada Ley, así como en la Ley Número 159 de Salud del Estado de\nGuerrero.\nII.4 Que el Dr. Antonio Salvador Jaimes Herrera, acredita su carácter de expedido por el Gobernador Constitucional del Estado de Guerrero, C.P. Carlos Zeferino\nTorreblanca Galindo, y cuenta con facultades de conformidad con lo dispuesto por el artículo 3°, fracción II, 23 de la Ley Número 159 de Salud del Estado de Guerrero.\nII.5 Que la Secretaría de Salud de Guerrero, cuenta con una Unidad\nAdministrativa a nivel Subsecretaría denominada Subsecretaría de Regulación, Control y\nFomento Sanitario, que tiene por objeto el ejercicio de las atribuciones en materia de para el Control del Tabaco, Ley General de Salud y la Ley Número 159 de Salud del\nTABACO, QUE CELEBRAN POR UNA PARTE, EL\nEJECUTIVO FEDERAL, A TRAVÉS DE LA\nGuerrero.\nII.6 La Subsecretaría de Regulación, Control y Fomento Sanitario, se encuentra debidamente representada por el Dr. Saul López Silva, quien fue designado por el C. P.\nCarlos Zeferino Torreblanca Galindo, Gobernador Constitucional del Estado de Guerrero, en fecha 1 de Diciembre de 2009 y participa en la suscripción del presente documento en términos de los artículo 7°, fracción IV de la Ley Número 159 de Salud del Estado de\nGuerrero.\nII.7 Que para los efectos del presente instrumento señala como su domicilio el ubicado en el Edificio No. 62 del Boulevard Rene Juárez Cisneros, colonia Ciudad de los\nServicios, C. P. 39074, Chilpancingo, Guerrero.\nIII. Declaran las Partes que:\nIII.1 Están interesadas en celebrar el presente Acuerdo de Coordinación y que una vez reconocida plenamente la capacidad jurídica con que comparecen cada una de las partes y vistas las declaraciones que anteceden, es su voluntad celebrar el presente instrumento jurídico para lo cual acuerdan en sujetarse a las siguientes:\nPRIMERA. Objeto. condiciones de la coordinación entre \"EL EJECUTIVO ESTATAL\" y \"LA SECRETARÍA\"\n\"LA COMISIÓN\", para el control sanitario de productos del tabaco, según lo dispuesto por la Ley General para el Control del Tabaco, Ley General de Salud, el Reglamento de la Ley General para el Control del Tabaco, el Reglamento de la Comisión Federal para la\nTABACO, QUE CELEBRAN POR UNA PARTE, EL\nEJECUTIVO FEDERAL, A TRAVÉS DE LA aplicables.\nLo anterior, con la finalidad de dar agilidad, transparencia y eficiencia al desarrollo de dichas actividades en el ámbito estatal.\nSEGUNDA. Disposiciones Generales.\nPor virtud y como consecuencia de este Acuerdo de Coordinación, \"EL\nEJECUTIVO ESTATAL\" ejercerá las facultades referidas al control sanitario de productos del tabaco, que corresponde a \"LA SECRETARÍA\" en los términos definidos en las leyes y reglamentos, salvo las reservadas expresamente a \"LA COMISIÓN\" conforme al presente Acuerdo de Coordinación y a la legislación aplicable.\nEl ejercicio de las facultades a que este Acuerdo de Coordinación se refiere, prevé la participación de \"EL EJECUTIVO ESTATAL\" bajo los esquemas que se describen en los Anexos 1 y 2, los cuales firmados por las instancias que celebran el presente Acuerdo de Coordinación, forman parte integrante de su contexto.\nEl Anexo 1 enuncia los establecimientos cuyo control sanitario es competencia de la Federación y que ésta ejerce por conducto de \"LA COMISIÓN\", respecto de los cuales\n\"EL EJECUTIVO ESTATAL\" participará de conformidad con los criterios descritos en el mismo Anexo.\nEl Anexo 2 determina los trámites relacionados con el control sanitario de los\n\"LA COMISIÓN\", respecto de los cuales \"EL EJECUTIVO ESTATAL\" participará de conformidad con los criterios establecidos en el mismo Anexo.\nAmbos Anexos se sujetarán al \"ACUERDO por el que se dan a conocer los trámites y formatos que aplica la Secretaría de Salud, a través de la Comisión Federal para la Protección contra Riesgos Sanitarios, respecto de los productos del tabaco,\nTABACO, QUE CELEBRAN POR UNA PARTE, EL\nEJECUTIVO FEDERAL, A TRAVÉS DE LA\nRegulatoria\", publicado en el Diario Oficial de la Federación el 28 de julio de 2010.\n\"EL EJECUTIVO ESTATAL\" ejercerá, conforme a lo dispuesto en la presente cláusula, las facultades en materia de control sanitario de los productos del tabaco incluidas en los Anexos 1 y 2 que sean competencia de la Federación, de conformidad con los criterios de atención establecidos en los mismos.\nTERCERA. Compromisos de \"LA SECRETARÍA\" a través de \"LA\nCOMISIÓN\":\nPara el cumplimiento del objeto del presente Acuerdo de Coordinación, \"LA\nSECRETARÍA\", por conducto de \"LA COMISIÓN\":\nI. Actualizará los criterios y procedimientos que debe observar \"EL EJECUTIVO\nESTATAL\", los cuales se encuentran establecidos en los Anexos 1 y 2 del presente\nAcuerdo de Coordinación.\nII. Autorizará a \"EL EJECUTIVO ESTATAL\" la utilización de las aplicaciones informáticas que se desarrollen en \"LA COMISIÓN\" que tengan como objetivo específico apoyar las tareas de atención de trámites y control sanitario de los productos del tabaco;\nIII. Absorberá en materia de control sanitario de productos del tabaco, el costo de la capacitación, desarrollo, entrenamiento y actualización del personal para realizar las visitas de verificación sanitarias, el dictamen y el procedimiento de resolución correspondiente, así como la operación de las aplicaciones informáticas que se desarrollen en \"LA COMISIÓN\" que tengan como objetivo específico apoyar las tareas de atención de trámites y control sanitario de los productos del tabaco, conforme al programa anual que \"LAS PARTES\" aprueben en el tercer y cuarto trimestre del ejercicio fiscal anterior al que vaya a presupuestarse, considerando las facultades que \"EL\nEJECUTIVO ESTATAL\", asume en los Anexos 1 y 2 que forman parte del presente\nAcuerdo de Coordinación;\nTABACO, QUE CELEBRAN POR UNA PARTE, EL\nEJECUTIVO FEDERAL, A TRAVÉS DE LA\nIV. Establecerá, de común acuerdo con \"EL EJECUTIVO ESTATAL\", los formatos en los que este último proporcionará información a \"LA COMISIÓN\" sobre el ejercicio de las facultades objeto del presente instrumento;\nV. Informará a \"EL EJECUTIVO ESTATAL\" sobre aquellas acciones que derivaron del control y regulación sanitarios;\nVI. Realizará la supervisión y vigilancia técnicas dela ejecución y desarrollo de las facultades previstas en el presente Acuerdo de Coordinación y;\nVII. Participará con \"EL EJECUTIVO ESTATAL\" en los eventos de fomento sanitario, como foros estatales y regionales cuyo objetivo sea la difusión de la normatividad inherente al control sanitario de productos del tabaco.\nLo anterior, quedará sujeto a la disponibilidad presupuestal, a la afectación de recursos y a la normatividad aplicable.\nCUARTA. Compromisos de \"EL EJECUTIVO ESTATAL\".\nPara el cumplimiento del objeto del presente Acuerdo de Coordinación, \"EL\nEJECUTIVO ESTATAL\":\nI. Ejercerá las facultades materia del presente Acuerdo de Coordinación de conformidad con lo dispuesto por la cláusula segunda del presente instrumento, las disposiciones aplicables y los criterios y procedimientos establecidos en los Anexos 1 y 2 del presente Acuerdo de Coordinación.\nII. Remitirá a \"LA COMISIÓN\", en un plazo no mayor de 5 días hábiles, los trámites considerados dentro del criterio 1 de los Anexos 1 y 2 que llegase a recibir, ser turnada a \"LA COMISIÓN\" y de que el plazo para resolver comenzará a correr una\nTABACO, QUE CELEBRAN POR UNA PARTE, EL\nEJECUTIVO FEDERAL, A TRAVÉS DE LA vez que ésta lo reciba, de lo cual dejará constancia por escrito en el propio documento y en la copia sellada que exhiba;\nIII. Aplicará los recursos que reciba de \"LA SECRETARÍA\" por conducto de \"LA\nCOMISIÓN\" en el marco del presente Acuerdo de Coordinación, en términos de los instrumentos jurídicos que al efecto se suscriban.\nIV. Proporcionará mensualmente a \"LA COMISIÓN\", en los formatos que establezca de común acuerdo con ésta, información sobre el ejercicio de las facultades objeto del presente instrumento;\nV. Se incorporará al sistema de información que convenga con \"LA COMISIÓN\" y, a través del portal electrónico de la misma, se pondrá a consulta del público interesado la información relativa a trámites, requisitos, plazos y situación que guardan los trámites ingresados;\nVI. Efectuará, de conformidad con la suficiencia presupuestaria correspondiente, las adecuaciones o modificaciones que necesite para la implementación de estructuras administrativas correspondientes, determinando sus modalidades orgánicas y funcionales conforme a su legislación aplicable;\nVII. Permitirá la supervisión técnica por parte de \"LA COMISIÓN\" para evaluar el cumplimiento del presente Acuerdo de Coordinación;\nVIII. Informará periódicamente a \"LA COMISIÓN\" sobre las acciones que deriven del control sanitario de productos del tabaco y;\nIX. Vigilará el cumplimiento de las disposiciones jurídicas y administrativas presente Acuerdo de Coordinación.\nQUINTA. Compromisos de ambas partes.\nTABACO, QUE CELEBRAN POR UNA PARTE, EL\nEJECUTIVO FEDERAL, A TRAVÉS DE LA\nAcuerdo de Coordinación las partes consienten sujetarse a los principios de actuación siguientes:\nI. Promover la realización de estudios de evaluación y análisis de riesgos a la salud y apoyar sus decisiones en los mejores criterios técnicos y científicos;\nII. Impulsar la modernización, simplificación y mejora regulatoria, en el ámbito de sus respectivas competencias;\nIII. Orientar sus sistemas de trabajo a la optimización de recursos, la estandarización y simplificación de procesos, así como a la coordinación eficaz de sus atribuciones y a la profesionalización y especialización de su personal y;\nIV. Actuar bajo criterios de agilidad y transparencia en la realización de sus actividades.\nSEXTA. Facultad de atracción de \"LA SECRETARÍA\".\n\"LA SECRETARÍA\", por conducto de \"LA COMISIÓN\", se reserva expresamente el derecho de reasumir las facultades objeto del presente Acuerdo de Coordinación, en aquellos asuntos y materias cuya magnitud, por el riesgo sanitario que representa, su impacto o importancia, ameriten su intervención. \"LA SECRETARÍA\", a través de \"LA\nCOMISIÓN\", informará por escrito a \"EL EJECUTIVO ESTATAL\" el ejercicio de esta facultad de atracción.\n\"EL EJECUTIVO ESTATAL\" se compromete a colaborar con \"LA\nSECRETARÍA\", por conducto de \"LA COMISIÓN\", en el ejercicio de las facultades atraídas y, en su caso, participará nuevamente en su ejercicio cuando así le fuere expresamente informado.\nTABACO, QUE CELEBRAN POR UNA PARTE, EL\nEJECUTIVO FEDERAL, A TRAVÉS DE LA\nSÉPTIMA. Servidores públicos designados para dar cumplimiento al\nAcuerdo de Coordinación.\n\"LA SECRETARÍA\" por conducto de \"LA COMISIÓN\" dará cumplimiento al objeto del presente Acuerdo de Coordinación en términos de la Ley General para el Control del\nTabaco, la Ley General de Salud, el Reglamento Interior de la Secretaría de Salud y el\nAcuerdo por el que se delegan las facultades que se señalan, en los órganos administrativos que en el mismo se indican de la Comisión Federal para la Protección contra Riesgos Sanitarios, publicado en el Diario Oficial de la Federación el 27 de diciembre de 2005.\nPara la efectiva coordinación de acciones, queda facultada la Secretaría de Salud del Estado de Guerrero, a través del Secretario de Salud del Estado de Guerrero o en su caso del Subsecretario de Regulación, Control y Fomento Sanitario, a efecto de dar cumplimiento a lo dispuesto en el presente Acuerdo Específico de Coordinación y sus anexos.\nOCTAVA. Evaluación y seguimiento.\n\"LA SECRETARÍA\", a través de \"LA COMISIÓN\", efectuará anualmente, con la ejercicio de las facultades previstas en el presente Acuerdo de Coordinación, por lo que podrá realizar supervisiones y determinar, con base en los resultados de la evaluación, las acciones correctivas a instrumentar por parte de \"EL EJECUTIVO ESTATAL\".\n\"LA SECRETARÍA\", por conducto de \"LA COMISIÓN\", elaborará el sistema de indicadores, variables y parámetros con los que se evaluará la productividad, eficiencia y desempeño del ejercicio de las facultades objeto del presente instrumento, así como el\nCoordinación.\nTABACO, QUE CELEBRAN POR UNA PARTE, EL\nEJECUTIVO FEDERAL, A TRAVÉS DE LA\nCoordinación será congruente con las metas establecidas en el Plan Nacional de\nDesarrollo, el Programa Sectorial de Salud y/o los programas específicos que se establezcan.\nNOVENA. Relación laboral.\nEl personal de cada una de las partes que intervenga en la realización de las acciones materia del presente Acuerdo de Coordinación, mantendrá su relación laboral y estará bajo la dirección y dependencia de la parte respectiva, por lo que no se crearán relaciones de carácter laboral con la contraparte, a la que en ningún caso se le considerará como patrón sustituto o solidario y cada una de ellas asumirá las responsabilidades que de tal relación les correspondan.\nLas plazas de enlace de alto nivel de responsabilidad que han sido asignadas a las entidades federativas seguirán perteneciendo a \"LA COMISIÓN\", y quienes las ocupen deberán realizar funciones de enlace vinculadas con las acciones y proyectos objeto del presente Acuerdo de Coordinación.\nDÉCIMA. Vigencia de otros acuerdos y convenios en la materia.\nUna vez que el presente Acuerdo de Coordinación entre en vigor, las disposiciones de los acuerdos y convenios celebrados por \"EL EJECUTIVO ESTATAL\" y materia de control sanitario de productos del tabaco, quedarán sin efectos.\nDÉCIMA PRIMERA. Solución de controversias. presente Acuerdo de Coordinación, serán resueltas a través de una Comisión Paritaria, que corresponda a sus órganos de control.\nTABACO, QUE CELEBRAN POR UNA PARTE, EL\nEJECUTIVO FEDERAL, A TRAVÉS DE LA\nEn caso de que dicha Comisión Paritaria no llegase a ninguna solución amigable, las dudas o controversias que resulten de la ejecución e interpretación del presente\nAcuerdo de Coordinación, serán resueltas por los Tribunales Federales de la Ciudad de\nMéxico, Distrito Federal.\nDÉCIMA SEGUNDA. Revisión y Modificación del Acuerdo de Coordinación.\nEl presente instrumento será objeto de una revisión bianual que podrá tener como resultado su adición o modificación, tomando como base las exigencias presentadas en la operación de los servicios y la evaluación en el cumplimiento de los objetivos establecidos en el mismo.\nNo obstante lo anterior, el presente Acuerdo de Coordinación podrá, en cualquier momento, ser adicionado o modificado por acuerdo de las partes de forma escrita cuando éstas lo consideren necesario.\nDÉCIMA TERCERA. Acceso a la Información.\nLas partes Acuerdan respetar el principio de confidencialidad y reserva establecido en la Ley Federal de Transparencia y Acceso a la información Pública\nGubernamental y su Reglamento, en lo que concierne al presente Acuerdo de\nCoordinación.\nDÉCIMA CUARTA. Vigencia. hábiles siguientes y tendrá una vigencia indefinida. Se publicará acompañado de los\nEstado de Guerrero.\nDÉCIMA QUINTA. Terminación Anticipada.\nTABACO, QUE CELEBRAN POR UNA PARTE, EL\nEJECUTIVO FEDERAL, A TRAVÉS DE LA tiempo a solicitud de cualquiera de las partes, previa notificación por escrito realizada a las otras partes con, por lo menos, treinta días hábiles de anticipación, en cuyo caso se tomarán las medidas necesarias para concluir las acciones que se hubieren iniciado en el presente instrumento, a efecto de evitarse daños mutuos o a terceros.\nDÉCIMA SEXTA. Caso fortuito o fuerza mayor.\nLas partes no tendrán responsabilidad por los daños y perjuicios que pudieran ocasionarse por causas de fuerza mayor o caso fortuito que impidan, la ejecución total o parcial de las obligaciones del objeto del presente instrumento.\nUna vez superados dichos eventos se reanudarán las actividades en la forma y términos que señalen las partes.\nLeído que fue el presente Acuerdo de Coordinación constante de 11 fojas, y enteradas las partes de su valor y consecuencias legales, lo firman por quintuplicado en la Ciudad de Chilpancingo, Gro. a los 30 días del mes de agosto de dos mil diez.\nPOR EL EJECUTIVO FEDERAL\nEL SECRETARIO DE SALUD.\nDR. JOSÉ ÁNGEL CÓRDOVA VILLALOBOS.\nRúbrica.\nEL COMISIONADO FEDERAL PARA LA PROTECCIÓN\nCONTRA RIESGOS SANITARIOS.\nLIC. MIGUEL ÁNGEL TOSCANO VELASCO.\nRúbrica.\nPOR \"EL EJECUTIVO ESTATAL\"\nTABACO, QUE CELEBRAN POR UNA PARTE, EL\nEJECUTIVO FEDERAL, A TRAVÉS DE LA\nEL GOBERNADOR CONSTITUCIONAL.\nC.P. CARLOS ZEFERINO TORREBLANCA GALINDO.\nRúbrica.\nEL SECRETARIO GENERAL DE GOBIERNO.\nC.P. ISRAEL SOBERANIS NOGUEDA.\nRúbrica.\nEL SECRETARIO DE SALUD.\nDR. ANTONIO SALVADOR JAIMES HERRERA.\nRúbrica.\nEL SUBSECRETARIO DE REGULACIÓN, CONTROL Y FOMENTO SANITARIO.\nDR. SAÚL LÓPEZ SILVA.\nRúbrica.\nTABACO, QUE CELEBRAN POR UNA PARTE, EL\nEJECUTIVO FEDERAL, A TRAVÉS DE LA\n1.2.-\nAQRCLGCS\nTABACO, QUE CELEBRAN POR UNA PARTE, EL\nEJECUTIVO FEDERAL, A TRAVÉS DE LA\nANEXO 1\nANEXO 1 DEL ACUERDO DE COORDINACIÓN PARA EL EJERCICIO DE FACULTADES EN MATERIA DE CONTROL SANITARIO DE PRODUCTOS DEL TABACO\nQUE CELEBRAN, POR UNA PARTE, EL EJECUTIVO FEDERAL, A TRAVÉS DE LA SECRETARÍA DE SALUD, EN LO SUCESIVO “LA SECRETARÍA”,\nREPRESENTADA POR SU TITULAR, DR. JOSÉ ÁNGEL CÓRDOVA VILLALOBOS, CON LA PARTICIPACIÓN DE LA COMISIÓN FEDERAL PARA LA PROTECCIÓN\nCONTRA RIESGOS SANITARIOS, EN LO SUCESIVO “LA COMISIÓN”, REPRESENTADA POR SU TITULAR, LIC. MIGUEL ÁNGEL TOSCANO VELASCO Y, POR\nGOBERNADOR CONSTITUCIONAL, C.P. CARLOS ZEFERINO TORREBLANCA GALINDO, CON LA INTERVENCIÓN DEL SECRETARIO GENERAL DE GOBIERNO,\nC.P. ISRAEL SOBERANIS NOGUEDA, DEL SECRETARIO DE SALUD EN EL ESTADO DE GUERRERO, DR. ANTONIO SALVADOR JAIMES HERRERA, EL\nSUBSECRETARIO DE REGULACIÓN, CONTROL Y FOMENTO SANITARIO, DR. SAÚL LÓPEZ SILVA.\nESTABLECIMIENTOS\nEn cuanto a la vigilancia sanitaria regular:\n• Las visitas de verificación y seguimiento de corrección de irregularidades las realizarán las entidades federativas bajo las políticas, lineamientos y procedimientos que emita la\nCOFEPRIS.\n• El dictamen, notificación, resolución y en su caso seguimiento jurídico lo realizará la\nCOFEPRIS.\n3.- EJERCICIO EN CONCURRENCIA\nRespecto al trámite:\n• La recepción, verificación, dictamen y resolución del mismo, lo realizarán en su totalidad las entidades federativas de acuerdo con las políticas, lineamientos y procedimientos que le notifique la COFEPRIS, en términos de las disposiciones legales aplicables.\n• En cuanto a la vigilancia sanitaria regular:\nLas visitas de verificación, dictamen, notificación, seguimiento de corrección de irregularidades, resolución y en su caso seguimiento jurídico, lo realizarán las entidades federativas, de acuerdo con las políticas, lineamientos y procedimientos que le notifique la\nCOFEPRIS, en términos de las disposiciones legales aplicables.\nAmbas partes asumen el compromiso de informarse y retroalimentarse periódicamente.\nTABACO, QUE CELEBRAN POR UNA PARTE, EL\nEJECUTIVO FEDERAL, A TRAVÉS DE LA\nANEXO 1\nANEXO 1 DEL ACUERDO DE COORDINACIÓN PARA EL EJERCICIO DE FACULTADES EN MATERIA DE CONTROL SANITARIO DE PRODUCTOS DEL TABACO QUE\nCELEBRAN, POR UNA PARTE, EL EJECUTIVO FEDERAL, A TRAVÉS DE LA SECRETARÍA DE SALUD, EN LO SUCESIVO “LA SECRETARÍA”, REPRESENTADA POR SU\nTITULAR, DR. JOSÉ ÁNGEL CÓRDOVA VILLALOBOS, CON LA PARTICIPACIÓN DE LA COMISIÓN FEDERAL PARA LA PROTECCIÓN CONTRA RIESGOS\nSANITARIOS, EN LO SUCESIVO “LA COMISIÓN”, REPRESENTADA POR SU TITULAR, LIC. MIGUEL ÁNGEL TOSCANO VELASCO Y, POR LA OTRA, EL GOBIERNO\nCARLOS ZEFERINO TORREBLANCA GALINDO, CON LA INTERVENCIÓN DEL SECRETARIO GENERAL DE GOBIERNO, C.P. ISRAEL SOBERANIS NOGUEDA, DEL\nSECRETARIO DE SALUD EN EL ESTADO DE GUERRERO, DR. ANTONIO SALVADOR JAIMES HERRERA, EL SUBSECRETARIO DE REGULACIÓN, CONTROL Y\nFOMENTO SANITARIO, DR. SAÚL LÓPEZ SILVA.\nESTABLECIMIENTOS\nPOR EL EJECUTIVO FEDERAL POR “EL EJECUTIVO ESTATAL”\n_____________________ _______________________\nDR. JOSÉ ÁNGEL CÓRDOVA VILLALOBOS C.P. CARLOS ZEFERINO TORREBLANCA\nGALINDO\nRúbrica Rúbr ica\nTABACO, QUE CELEBRAN POR UNA PARTE, EL\nEJECUTIVO FEDERAL, A TRAVÉS DE LA\nANEXO 1\nANEXO 1 DEL ACUERDO DE COORDINACIÓN PARA EL EJERCICIO DE FACULTADES EN MATERIA DE CONTROL SANITARIO DE PRODUCTOS DEL TABACO QUE\nCELEBRAN, POR UNA PARTE, EL EJECUTIVO FEDERAL, A TRAVÉS DE LA SECRETARÍA DE SALUD, EN LO SUCESIVO “LA SECRETARÍA”, REPRESENTADA POR SU\nTITULAR, DR. JOSÉ ÁNGEL CÓRDOVA VILLALOBOS, CON LA PARTICIPACIÓN DE LA COMISIÓN FEDERAL PARA LA PROTECCIÓN CONTRA RIESGOS\nSANITARIOS, EN LO SUCESIVO “LA COMISIÓN”, REPRESENTADA POR SU TITULAR, LIC. MIGUEL ÁNGEL TOSCANO VELASCO Y, POR LA OTRA, EL GOBIERNO\nCARLOS ZEFERINO TORREBLANCA GALINDO, CON LA INTERVENCIÓN DEL SECRETARIO GENERAL DE GOBIERNO, C.P. ISRAEL SOBERANIS NOGUEDA, DEL\nSECRETARIO DE SALUD EN EL ESTADO DE GUERRERO, DR. ANTONIO SALVADOR JAIMES HERRERA, EL SUBSECRETARIO DE REGULACIÓN, CONTROL Y\nFOMENTO SANITARIO, DR. SAÚL LÓPEZ SILVA.\nESTABLECIMIENTOS\n19\nIS I\nRúbrica\nRúbrica\nRúbrica\nRúbrica\nTABACO, QUE CELEBRAN POR UNA PARTE, EL\nEJECUTIVO FEDERAL, A TRAVÉS DE LA\nTABACO, QUE CELEBRAN POR UNA PARTE, EL\nEJECUTIVO FEDERAL, A TRAVÉS DE LA brevedad posible a la Comisión el resultado de las visitas considerando el plazo que tiene la autoridad para emitir la resolución en los términos que establecen las disposiciones legales aplicables.\n3 EJERCICIO EN CONCURRENCIA\nRespecto al trámite:\nLa recepción y resolución y, en su caso, la verificación sanitaria previa del producto, estará a cargo de las entidades federativas, bajo las políticas. Lineamientos y procedimientos que emita la COFEPRIS.\nOBSERVACIONES\nAmbas partes asumen el compromiso de informarse y retroalimentarse periódicamente.\nLos criterios para la evaluación, dictaminación y emisión de las autorizaciones, serán determinados por la COFEPRIS, así de comercio internacional, considerando su capacidad técnica e infraestructura.\nEn cualquier momento que se requiera o en caso que se considere oportuno, ambas partes se podrán consultar a fin de procedimientos que emita la Comisión Federal.\nTABACO, QUE CELEBRAN POR UNA PARTE, EL\nEJECUTIVO FEDERAL, A TRAVÉS DE LA\nTABACO, QUE CELEBRAN POR UNA PARTE, EL\nEJECUTIVO FEDERAL, A TRAVÉS DE LA\nRúbrica\nRúbrica\nTABACO, QUE CELEBRAN POR UNA PARTE, EL\nEJECUTIVO FEDERAL, A TRAVÉS DE LA\nEL COMISIONADO FEDERAL PARA LA EL SECRETARIO GENERAL DE GOBIERNO\nPROTECCIÓN CONTRA RIESGOS SANITARIOS\n________________________ ______________________\nLIC. MIGUEL ÁNGEL TOSCANO VELASCO C.P. ISRAEL SOBERANIS NOGUEDA\nRúbrica Rúb rica\nEL SECRETARIO DE SALUD EN EL ESTADO DE\nGUERRERO\n___________________\nDR. ANTONIO SALVADOR JAIMES HERRERA\nRúb rica\nEL SUBSECRETARIO DE REGULACIÓN,\nCONTROL Y FOMENTO SANITARIO\n________________\nDR. SAÚL LÓPEZ SILVA\nRúb rica\nEL SUSCRITO LICENCIADO JOSÉ MARÍA MURILLO SILVA, SUBDIRECTOR\nJURÍDICO DE LA SECRETARÍA DE SALUD EN EL ESTADO DE GUERRERO, QUIEN\nLA PRESENTE Y CON FUNDAMENTO EN EL ACUERDO SSA/SJ/001/2005,\nPUBLICADO EL DÍA 11 DE OCTUBRE DEL 2005, EN EL PERIÓDICO OFICIAL DEL\nCON TODAS Y CADA UNA DE SUS PARTES, CON EL ACUERDO DE\nTABACO, QUE CELEBRAN POR UNA PARTE, EL\nEJECUTIVO FEDERAL, A TRAVÉS DE LA\nSANITARIO DEL PRODUCTO DEL TABACO, QUE CELEBRAN POR UNA PARTE EL\nEJECUTIVO FEDERAL, A TRAVÉZ DE LA SECRETARÍA DE SALUD Y POR LA OTRA\nCONSTA DE VEINTE FOJAS ÚTILES, MISMO QUE TUVE A LA VISTA Y PREVIO\nCOTEJO, SE DEVUELVE AL ARCHIVO DE ESTA OFICINA, PARA QUE OBRE EN EL\nMISMO.\nCONSTE.- LO QUE CERTIFICO PARA LOS EFECTOS LEGALES A QUE HAYA\nLUGAR, EN LA CIUDAD DE CHILPANCINGO, GUERRERO; A LAS ONCE HORAS DEL\nDÍA VEINTE DEL MES DE ENERO DEL AÑO DOS MIL ONCE.\nEL SUBDIRECTOR JURÍDICO DE LA SECRETARÍA DE SALUD.\nLIC. JOSÉ MARÍA MURILLO SILVA.\nRúbrica.\nTESTIGOS DE ASISTENCIA.\nLIC. JOSE ANTONIO PANTALEÓN ZUMUDIO.\nRúbrica.\nLIC. ADAN TOVAR LEÓN.\nRúbrica.",
  "ordenamiento": "ACUERDO",
  "jurisdiccion": "GUERRERO",
  "fuente_oficial": "DIARIO OFICIAL DE LA FEDERACION",
  "Fecha de Publicación": "22 de Febrero de 2011",
  "ULTIMA REFORMA PUBLICADA": null,
  "status": "VIGENTE",
  "es_escaneado": false,
  "tiene_tablas": false,
  "materia": [
    "salud"
  ]
}