{
  "titulo": "Acuerdo por el Que Se Crea el Comité de Adquisiciones y Obra Pública del Poder Judicial del Estado D",
  "Contenido": "TEXTO ORIGINAL de 2012.\nPODER JUDICIAL\nACUERDO POR EL QUE SE CREA EL COMITÉ DE ADQUISICIONES Y OBRA PÚBLICA DEL\nPODER JUDICIAL DEL ESTADO DE GUERRERO.\nACUERDO DEL PLENO DEL CONSEJO DE LA JUDICATURA DEL ESTADO\nSe aprueba el acuerdo que crea el Comité de Adquisiciones y Obra Pública del Poder Judicial del Estado de Guerrero, que presenta al Pleno de este Consejo el Doctor Jesús Martínez Garnelo, Magistrado Presidente del Tribunal Superior de Justicia y del Consejo de la Judicatura, en los términos siguientes:\n\"…ACUERDO POR EL QUE SE CREA EL COMITÉ DE ADQUISICIONES Y OBRA PÚBLICA\nDEL PODER JUDICIAL DEL ESTADO DE GUERRERO.\nPleno del Consejo de la Judicatura Estatal. Chilpancingo, Guerrero, a 08 de febrero de 2012.\nCONSIDERANDO\nPRIMERO. Que el artículo 134 de la Constitución Política de los Estados Unidos Mexicanos prescribe que los recursos económicos de que dispongan los estados, entre otras entidades públicas, se administrarán con eficiencia, eficacia, economía, transparencia y honradez, para satisfacer los objetivos a los que estén destinados. Asimismo, que las adquisiciones, arrendamientos y enajenaciones de todo tipo de bienes, prestación de servicios de cualquier naturaleza, y la contratación de obra que realicen, se adjudicarán o llevarán a cabo a través de licitaciones públicas.\nEstado, con excepción del Tribunal Superior de Justicia, estarán a cargo del Consejo de la Judicatura\nEstatal, en los términos que, conforme a las bases que señala la propia Constitución, establezcan las leyes.\nTERCERO. Que de acuerdo con los artículos 76 y 79, fracción IV, de la Ley Orgánica del Poder\nJudicial del Estado de Guerrero, el Consejo de la Judicatura Estatal tiene a su cargo la administración, ejercer, a través de la Dirección General de Administración y Finanzas, el presupuesto de egresos del\nCUARTO. Que el artículo 87 del ordenamiento orgánico señalado, dispone que corresponde a la Dirección General de Administración y Finanzas: \"...IV.- Ejercer el presupuesto de egresos del Poder\nJudicial, bajo la supervisión del Consejo de la Judicatura Estatal, dando éste cuenta de ello al Pleno del\nTribunal Superior de Justicia…\". En tanto que el diverso artículo 89 de la ley citada, establece que \"Los asuntos de carácter administrativo y financiero del Poder Judicial, quedarán a cargo de la Dirección\nGeneral de Administración y Finanzas, la que dependerá del Consejo de la Judicatura Estatal…\"\nQUINTO. Que el artículo 100, fracciones I y IV, de la misma Ley Orgánica del Poder Judicial del\nEstado, establece que la Unidad de Auditoría Interna tendrá, entre otras facultades, las de \"... Vigilar el cumplimiento de las normas de control establecidas por el Consejo de la Judicatura Estatal...\", así como\n\"... Inspeccionar el cumplimiento de las normas y disposiciones relativas a los sistemas de registro, contabilidad, contratación y pago de personal, contratación y adquisición de recursos materiales del\nPoder Judicial...\".\nSEXTO. Que el articulo 3° de la multicitada Ley Orgánica, señala que \"El Poder Judicial del\nEstado, tiene plena autonomía para el ejercicio de sus funciones y atribuciones, así como para el ejercicio de su presupuesto de egresos\".\nSÉPTIMO. Que el artículo 17, fracción XIX, de la misma Ley Orgánica del Poder Judicial, establece que es atribución del Presidente del Tribunal Superior de Justicia, \"Representar al Poder\nJudicial en las adquisiciones y enajenaciones de bienes y servicios, y proveer la administración de bienes y derechos que componen el patrimonio del Poder Judicial\"; atribución ésta qué debe entenderse conferida al Presidente del Consejo de la Judicatura Estatal, en tanto que es este órgano el responsable de toda la administración del Poder Judicial, y, por cuanto su presidente, lo es también el Presidente del\nTribunal Superior de Justicia del Estado. Sin embargo, esta facultad, evidentemente; también puede ejercerla el Pleno del Consejo de la Judicatura, atentos al elemental principio de derecho que dice que el que puede lo más, puede lo menos.\nOCTAVO. Que la cada vez más compleja agenda de trabajo que debe atender el Presidente del Tribunal Superior de Justicia y del Consejo de la Judicatura Estatal, dificultan sobremanera que éste pública. En este sentido, es conveniente que las acciones relacionadas con la adquisición de bienes y servicios y la contratación de obra pública, se deleguen en un comité interno conformado por los vigilancia de su correcta administración.\nNOVENO. Que en las circunstancias señaladas, y teniendo todos los servidores públicos la obligación de aplicar con imparcialidad los recursos públicos que estén bajo su responsabilidad, y que de acuerdo con la normativa federal y estatal para la adquisición de bienes y servicios, así como obra pública, debe intervenir un comité, se hace necesario crear un Comité de Adquisiciones y Obra Pública, que tenga a su cargo los procedimientos de adquisición, arrendamientos y contratación de servicios y la obra pública.\nPor los motivos expuestos, y con fundamento en lo previsto por el artículo 81 de la Constitución\nEstado de Guerrero, se expide el siguiente:\nPRIMERO. Se crea el Comité de Adquisiciones y Obra Pública del Poder Judicial del Estado de\nGuerrero. Este Comité estará integrado por: (REFORMADO ARTÍCULO PRIMERO, P.O. 22 DE AGOSTO DE 2014)\nI. El Magistrado del Tribunal Superior de Justicia integrante del Consejo de la Judicatura\nEstatal, quien lo presidirá;\nII. El Secretario General del Consejo de la Judicatura, quien fungirá como Secretario\nEjecutivo;\nIII. Los vocales siguientes\na) El Director General de Administración y Finanzas del Consejo de la Judicatura Estatal;\nb) El Jefe de la Oficina de Control Patrimonial, y\nc) El Jefe de la Oficina de Obras Públicas y Mantenimiento.\nSEGUNDO. El Comité de Adquisiciones y Obra Pública del Poder Judicial del Estado de\nGuerrero tendrá las siguientes atribuciones: (REFORMADO ARTÍCULO SEGUNDO, P.O. 22 DE AGOSTO DE 2014)\nI. Elaborar las normas, programas y presupuestos de adquisiciones, arrendamientos y servicios, y obra pública, así como formular las observaciones y recomendaciones pertinentes;\nII. Aprobar las bases y convocatorias para la celebración de licitaciones públicas en materia de adquisiciones, contratación de servicios, administración de bienes y obra pública;\nIII. Proponer las políticas, bases y lineamientos en materia de adquisiciones, arrendamientos y servicios y obra pública, así como autorizar los supuestos no previstos en éstos, sometiéndolos a la consideración del Pleno del Consejo de la Judicatura, por conducto de su Presidente;\nIV. Acordar los procesos de licitación pública, de invitación restringida y de adjudicación directa, y, en su caso, dictaminar, previamente a la iniciación del procedimiento de adquisición, sobre la procedencia de no celebrar licitaciones públicas por encontrarse en alguno de los supuestos de excepción previstos en la Ley;\nV. Validar el dictamen que le sea presentado por el Secretario Ejecutivo del Comité;\nVI. Autorizar la adquisición de bienes y servicios, fuera de los casos previstos en las leyes de la materia, cuyo monto exceda de cien mil pesos, privilegiando en todo caso criterios de economía, eficacia, eficiencia, imparcialidad, honradez y transparencia, que resulten\nVII. Las demás que se deriven del presente Acuerdo o de otras disposiciones normativas.\nTERCERO. El Reglamento que apruebe el Consejo de la Judicatura, desarrollará las políticas, bases y lineamientos contenidos en este acuerdo.\nTRANSITORIO\nPRIMERO. El presente acuerdo entrará en vigor al día siguiente de su publicación en el\nSEGUNDO. Comuníquese el presente acuerdo al Pleno del Tribunal Superior de Justicia del\nEstado de Guerrero, para su conocimiento y efectos administrativos y legales a que hubiese lugar.\nAsí lo acordaron y firman los integrantes del Pleno del Consejo de la Judicatura del Poder\nJudicial del Estado de Guerrero, DR. JESÚS MARTÍNEZ GARNELO, DR. ALBERTO LÓPEZ CELIS, M.\nC. GLORIA GARCÍA LEMUS, LIC. ARTURO ESTRADA BÁRCENAS y LIC. AVIMAEL RODRÍGUEZ\nNAVA, ante el LIC. BARTOLO CURRICHI MEZA, Secretario General de Acuerdos del Consejo, que autoriza y da fe. Cúmplase.\nATENTAMENTE.\nSUFRAGIO EFECTIVO. NO REELECCIÓN.\nEL SECRETARIO GENERAL DEL CONSEJO\nDE LA JUDICATURA DEL ESTADO.\nLIC. BARTOLO CURRICHI MEZA.\nRúbrica.\nACUERDO QUE REFORMA EL DIVERSO ACUERDO POR EL QUE SE CREA EL COMITÉ\nDE ADQUISICIONES Y OBRA PÚBLICA DEL PODER JUDICIAL DEL ESTADO DE GUERRERO.\nPRIMERO. El presente acuerdo entrará en vigor al día siguiente de su aprobación por parte del\nConsejo de la Judicatura Estatal. conocimiento general.\nTERCERO. Comuníquese el presente acuerdo al Pleno del Tribunal Superior de Justicia del\nEstado de Guerrero, para su conocimiento y efectos administrativos y legales a que hubiese lugar.\nCUARTO. Se declara insubsistente el diverso acuerdo de quince de enero de dos mil catorce, emitido por este Consejo de la Judicatura Estatal, que modificó el acuerdo de creación del Comité de",
  "ordenamiento": "ACUERDO",
  "jurisdiccion": "GUERRERO",
  "fuente_oficial": "DIARIO OFICIAL DE LA FEDERACION",
  "Fecha de Publicación": "22 DE AGOSTO DE 2014",
  "ULTIMA REFORMA PUBLICADA": "22 DE AGOSTO DE 2014",
  "status": "VIGENTE",
  "es_escaneado": false,
  "tiene_tablas": false,
  "materia": [
    "judicial"
  ]
}