{
  "titulo": "Acuerdo por el Que Se Amplía el Periodo para el Otorgamiento de Estímulos Fiscales Correspondiente A",
  "Contenido": "BENEFICIO DE LOS CONCESIONARIOS DEL\nSERVICIO PÚBLICO DE TRANSPORTE EN SUS\nDIVERSAS MODALIDADES, POR CONCEPTO DE\nEXPEDICIÓN INICIAL DE CONCESIÓN\nTEXTO ORIGINAL.\nAcuerdo publicado en el Periódico Oficial del Gobierno del Estado No. 35 Alcance II, el Viernes 29 de Abril de 2016.\nACUERDO POR EL QUE SE AMPLÍA EL PERIODO PARA EL OTORGAMIENTO DE\nESTÍMULOS FISCALES CORRESPONDIENTE AL EJERCICIO FISCAL 2016, EN BENEFICIO DE LOS\nCONCESIONARIOS DEL SERVICIO PÚBLICO DE TRANSPORTE EN SUS DIVERSAS MODALIDADES,\nPOR CONCEPTO DE EXPEDICIÓN INICIAL DE CONCESIÓN.\nGuerrero.- Poder Ejecutivo.\nLICENCIADO HÉCTOR ANTONIO ASTUDILLO FLORES, GOBERNADOR CONSTITUCIONAL\nDEL ESTADO DE GUERRERO, CON FUNDAMENTO EN LOS ARTÍCULOS 71, 90 NUMERAL 2 Y 91\nGUERRERO; 1, 2, 3, 6, 10, 18 APARTADO A FRACCIONES I Y III, 20 FRACCIÓN III Y 22 FRACCIÓN I\nDE LA LEY ORGÁNICA DE LA ADMINISTRACIÓN PÚBLICA DEL ESTADO DE GUERRERO NÚMERO\n08; 1o, 4o FRACCIÓN VIII, 11 FRACCIONES I Y II, 13, 18, 19 Y 44 DEL CÓDIGO FISCAL DEL ESTADO\nDE GUERRERO NÚMERO 429; 1o Y 2o DEL REGLAMENTO INTERIOR DE LA SECRETARÍA DE\nFINANZAS Y ADMINISTRACIÓN, Y\nQue en fecha 28 de enero del 2016, se suscribió el acuerdo por el que se otorgan estímulos fiscales durante el periodo del primero de febrero al treinta de abril del ejercicio fiscal 2016, en beneficio de los concesionarios del servicio público de transporte en sus diversas modalidades, por concepto de expedición inicial de concesión.\nQue dicho acuerdo fue publicado en el Periódico Oficial del Gobierno del Estado de Guerrero\nTransporte, se les concedió un descuento a fin de regularizar la situación fiscal y tránsito de su vehículo, lo en la materia. fiscales de los contribuyentes que tributan en el Estado, concretamente aquellos que cuentan con vehículos destinados al Servicio Público de Transporte.\nBENEFICIO DE LOS CONCESIONARIOS DEL\nSERVICIO PÚBLICO DE TRANSPORTE EN SUS\nDIVERSAS MODALIDADES, POR CONCEPTO DE\nEXPEDICIÓN INICIAL DE CONCESIÓN\nQue por lo anterior, para efecto de continuar apoyando a los guerrerenses, el titular del Poder\nEjecutivo, ha determinado ampliar el plazo para el pago de expedición inicial de concesión correspondiente al Ejercicio Fiscal 2016, en beneficio de los concesionarios del servicio público de transporte en todas sus modalidades.\nPor lo anteriormente expuesto y fundado, he tenido a bien expedir el siguiente:\nACUERDO POR EL QUE SE AMPLÍA. EL PERIODO PARA EL OTORGAMIENTO DE ESTÍMULOS\nFISCALES CORRESPONDIENTE AL EJERCICIO FISCAL 2016, EN BENEFICIO DE LOS\nCONCESIONARIOS DEL SERVICIO PÚBLICO DE TRANSPORTE EN SUS DIVERSAS MODALIDADES,\nPOR CONCEPTO DE EXPEDICIÓN INICIAL DE CONCESIÓN.\nArtículo Primero. Se amplía el plazo que señala el Acuerdo por el que se otorgan estímulos fiscales durante el periodo del primero de febrero al treinta de abril del ejercicio fiscal 2016, en beneficio de los concesionarios del servicio público de transporte en sus diversas modalidades, por concepto de expedición inicial de concesión, publicado en el Periódico Oficial del Gobierno del Estado de Guerrero número 09 Alcance III de fecha 29 de enero de 2016.\nArtículo Segundo. El plazo para otorgar estímulos a los concesionarios del servicio público de transporte en sus diversas modalidades, por concepto de expedición inicial de concesión, se amplía para el periodo que comprende del primero de mayo al treinta y uno de diciembre del Ejercicio Fiscal 2016.\nÚnico. El presente Acuerdo entrará en vigor el día siguiente al de su publicación en el Periódico\nOficial del Gobierno del Estado de Guerrero.\nDado en la oficina del titular del Poder Ejecutivo, ubicada en el Edificio Centro de Palacio de\nGobierno, Boulevard René Juárez Cisneros No. 62 ciudad de los Servicios en la Ciudad de Chilpancingo de los Bravo, Capital del Estado de Guerrero a los veintiocho días del mes de abril del dos mil dieciséis.\nEL GOBERNADOR CONSTITUCIONAL DEL\nESTADO DE GUERRERO.\nLIC. HÉCTOR ANTONIO ASTUDILLO FLORES.\nEL SECRETARIO GENERAL DE GOBIERNO.\nLIC. FLORENCIO SALAZAR ADAME.\nBENEFICIO DE LOS CONCESIONARIOS DEL\nSERVICIO PÚBLICO DE TRANSPORTE EN SUS\nDIVERSAS MODALIDADES, POR CONCEPTO DE\nEXPEDICIÓN INICIAL DE CONCESIÓN\nEL SECRETARIO DE FINANZAS Y ADMINISTRACIÓN.\nLIC. HÉCTOR APREZA PATRÓN.",
  "ordenamiento": "ACUERDO",
  "jurisdiccion": "GUERRERO",
  "fuente_oficial": "DIARIO OFICIAL DE LA FEDERACION",
  "Fecha de Publicación": "29 \nde Abril de 2016",
  "ULTIMA REFORMA PUBLICADA": null,
  "status": "VIGENTE",
  "es_escaneado": false,
  "tiene_tablas": false,
  "materia": [
    "fiscal"
  ]
}