{
  "titulo": "Acuerdo Delegatorio Que Emite el Lic. C. Arturo Latabán López, Auditor General del Estado de Guerrer",
  "Contenido": "MANUEL LOZANO GARIN, AUDITOR ESPECIAL DEL\nSECTOR ORGANISMOS PUBLICOS\nDESCENTRALIZADOS Y ORGANOS AUTONOMOS,\nAMBOS DE LA AUDITORIA GENERAL DEL ESTADO\nTEXTO ORIGINAL.\nAcuerdo publicado en el Periódico Oficial del Gobierno del Estado de Guerrero No 63, el Martes\n06 de Agosto de 2013.\nPODER LEGISLATIVO\nAUDITORÍA GENERAL DEL ESTADO\nACUERDO DELEGATORIO QUE EMITE EL LIC. C. ARTURO LATABÁN LÓPEZ, AUDITOR GENERAL\nDEL ESTADO DE GUERRERO, A FAVOR DEL C.P. VICTOR MANUEL LOZANO GARIN, AUDITOR\nESPECIAL DEL SECTOR ORGANISMOS PUBLICOS DESCENTRALIZADOS Y ORGANOS\nAUTONOMOS, AMBOS DE LA AUDITORIA GENERAL DEL ESTADO.\nEL SUSCRITO LICENCIADO CERTIFICADO ARTURO LATABÁN LÓPEZ, AUDITOR\nGENERAL DEL ESTADO, EN USO DE LAS FACULTADES QUE ME CONFIEREN LOS ARTÍCULOS\nGUERRERO; 204 DE LA LEY ORGÁNICA DEL PODER LEGISLATIVO DEL ESTADO NÚMERO 286; I°,\n2 FRACCION I, V, VIII, XVIII, 26, 27, 28, 29, 77 FRACCIONES I, II, III, IV, VI, X, XVI, XXXIX, 90\nFRACCIONES II, XII, 95 FRACCIONES III, IV, V, VII DE LA LEY NUMERO 1028 DE FISCALIZACIÓN\nSUPERIOR Y RENDICION DE CUENTAS DEL ESTADO DE GUERRERO; 1, 3, 4, 5, 8, 14, 18, 20\nFRACCIONES IV Y VII, y 21 FRACCIONES II Y XIII DEL REGLAMENTO INTERIOR DE LA AUDITORIA\nGENERAL DEL ESTADO; Y:\nPRIMERO.- EN TÉRMINOS DE LO ESTABLECIDO POR LOS ARTÍCULOS 107 FRACCIÓN IV\nSOBERANO DE GUERRERO; 204 DE LA LEY ORGÁNICA DEL PODER LEGISLATIVO DEL ESTADO\nDE GUERRERO Y 11 DE LA LEY DE FISCALIZACIÓN SUPERIOR DEL ESTADO DE GUERRERO\nNUMERO 564, CON FECHA VEINTE DE DICIEMBRE DEL AÑO DOS MIL DIEZ, EL LICENCIADO\nCERTIFICADO ARTURO LATABÁN LÓPEZ, FUE NOMBRADO AUDITOR GENERAL DEL ESTADO,\nDIA PRIMERO DE ENERO DE DOS MIL ONCE.\nSEGUNDO.- CON FECHA VEINTIOCHO DE FEBRERO DE DOS MIL DOCE, SE PUBLICO EN\nFISCALIZACION SUPERIOR Y RENDICION DE CUENTAS DEL ESTADO DE GUERRERO, MISMA\nQUE EN SUS ARTICULOS I°, 2 FRACCION I, V, VIII, XVIII, 26, 27, 28, 29, 77 FRACCIONES I, II, III, IV,\nVI, X, XVI, XXXIX, 90 FRACCIONES II, XII, 95 FRACCIONES III, IV, V, \"VII, Y TRANSITORIOS\nSEGUNDO, TERCERO Y SEXTO DISPONE LO SIGUIENTE:\nMANUEL LOZANO GARIN, AUDITOR ESPECIAL DEL\nSECTOR ORGANISMOS PUBLICOS\nDESCENTRALIZADOS Y ORGANOS AUTONOMOS,\nAMBOS DE LA AUDITORIA GENERAL DEL ESTADO\n\"(...) ARTÍCULO 1.- LA PRESENTE LEY ES DE ORDEN PÚBLICO Y DE OBSERVANCIA\nOBLIGATORIA; REGULA LA FUNCIÓN DE FISCALIZACIÓN SUPERIOR QUE REALIZA EL PODER\nLEGISLATIVO DEL ESTADO DE GUERRERO A TRAVÉS DE LA AUDITORIA GENERAL DEL ESTADO,\nY TIENE POR OBJETO:\nI. REGULAR LA FUNCIÓN DE FISCALIZACIÓN DE LA AUDITORIA GENERAL SOBRE LAS\nCUENTAS PÚBLICAS DE LAS ENTIDADES FISCALIZABLES.\nII. REGLAMENTAR LA FUNCIÓN DE INVESTIGACIÓN DE ACTOS U OMISIONES SOBRE\nIRREGULARIDADES O CONDUCTAS ILÍCITAS EN EL INGRESO, EGRESO, MANEJO, CUSTODIA Y\nAPLICACIÓN DE FONDOS Y RECURSOS PÚBLICOS.\nIII. ESTABLECER LOS PROCEDIMIENTOS PARA DETERMINAR LOS DAÑOS Y PERJUICIOS\nQUE AFECTEN AL PATRIMONIO O A LA HACIENDA PÚBLICA ESTATAL Y MUNICIPAL, Y LOS\nMECANISMOS PARA FINCAR LAS RESPONSABILIDADES PREVISTAS POR ESTA LEY, DERIVADAS\nDE LA FISCALIZACIÓN SUPERIOR.\nIV. INSTITUIR LAS INFRACCIONES Y SANCIONES EN QUE PUEDEN INCURRIR LAS\nENTIDADES FISCALIZABLES, LOS MECANISMOS PARA IMPONERLAS Y LOS MEDIOS DE\nDEFENSA CORRESPONDIENTES.\nV. ESTABLECER LA INTEGRACIÓN, COMPETENCIA, ORGANIZACIÓN, FUNCIONAMIENTO,\nPROCEDIMIENTOS Y DECISIONES DE LA AUDITORIA GENERAL.\nVI. SENTAR LAS BASES DE COORDINACIÓN, VIGILANCIA Y EVALUACIÓN DE LA\nAUDITORIA GENERAL.\nARTÍCULO 2.- PARA EFECTOS DE LA PRESENTE LEY SE ENTENDERÁ POR:\nI.- AUDITORIA GENERAL: LA AUDITORIA GENERAL DEL ESTADO; (...)\nV.- CUENTAS PÚBLICAS: LOS INFORMES QUE LAS ENTIDADES FISCALIZARLES DEBEN\nDURANTE CADA EJERCICIO FISCAL, A EFECTO DE COMPROBAR SI SE AJUSTARON A LOS\nOBJETIVOS CONTENIDOS EN LOS PLANES Y PROGRAMAS DE GOBIERNO; (...)\nVIII.- ENTIDADES FISCALIZABLES: LOS PODERES DEL ESTADO Y LOS AYUNTAMIENTOS;\nLOS ÓRGANOS CONSTITUCIONAL O LEGALMENTE AUTÓNOMOS, ORGANISMOS PÚBLICOS\nDESCENTRALIZADOS, EMPRESAS DE PARTICIPACIÓN ESTATAL Y FIDEICOMISOS PÚBLICOS,\nESTATALES Y MUNICIPALES; LAS DEMÁS PERSONAS DE DERECHO PÚBLICO Y PRIVADO,\nMANUEL LOZANO GARIN, AUDITOR ESPECIAL DEL\nSECTOR ORGANISMOS PUBLICOS\nDESCENTRALIZADOS Y ORGANOS AUTONOMOS,\nAMBOS DE LA AUDITORIA GENERAL DEL ESTADO\nCUANDO HAYAN RECIBIDO, ADMINISTRADO, CUSTODIADO O APLICADO POR CUALQUIER\nTÍTULO RECURSOS PÚBLICOS;(...)\nXVIII.- PLIEGO PREVENTIVO: EL DOCUMENTO EN EL QUE SE PLASMAN LAS\nIRREGULARIDADES DETECTADAS EN LAS OPERACIONES CONTABLES, FINANCIERAS,\nPRESUPUESTARIAS, PROGRAMÁTICAS, DE OBRA PÚBLICA Y DE CONTROL INTERNO,\nDERIVADAS DE LA FISCALIZACIÓN, Y QUE DEBEN SER ATENDIDAS DENTRO DEL MISMO\nPROCESO;(...)\nARTÍCULO 26.- EL PROCESO DE FISCALIZACIÓN SUPERIOR DEBERÁ DOCUMENTARSE\nEN SU TOTALIDAD.\nARTÍCULO 27.- LAS OBSERVACIONES QUE SE GENEREN DURANTE EL PROCESO DE\nFISCALIZACIÓN, SE DARÁN A CONOCER A LAS ENTIDADES FISCALIZABLES A TRAVÉS DEL\nPLIEGO PREVENTIVO, PARA QUE SEAN ATENDIDAS DURANTE EL MISMO PROCESO Y HASTA\nANTES DE CONCLUIR EL INFORME ANUAL DE RESULTADOS; EN CUALQUIER CASO, SE\nPROCURARÁ AGOTAR LAS ACCIONES DE FISCALIZACIÓN QUE SEAN NECESARIAS PARA QUE\nSE ATIENDAN O CORRIJAN LAS IRREGULARIDADES DETECTADAS O LOS DEFECTOS DE LA\nINFORMACIÓN SOBRE EL USO DE LOS RECURSOS PÚBLICOS.\nARTÍCULO 28.- LA SOLVENTACIÓN DEL PLIEGO PREVENTIVO POR LAS ENTIDADES\nFISCALIZABLES NO PODRÁ EXCEDER DE 15 DÍAS HÁBILES POSTERIORES A LA FECHA EN QUE\nSURTA EFECTO LA NOTIFICACIÓN DEL MISMO.\nARTÍCULO 29.- LA FISCALIZACIÓN SUPERIOR DE LAS CUENTAS PÚBLICAS TIENE POR\nOBJETO:\nI.- REVISAR LOS INFORMES SEMESTRALES Y LAS CUENTAS PÚBLICAS PARA VERIFICAR\nQUE:\nA) SE HAYAN CUMPLIDO CON LAS DISPOSICIONES JURÍDICAS, ADMINISTRATIVAS Y\nREGLAMENTARIAS APLICABLES AL EJERCICIO DEL PRESUPUESTO EN MATERIA DE REGISTRO,\nCONTRATACIÓN DE SERVICIOS, OBRA PÚBLICA, ADQUISICIONES, ARRENDAMIENTOS,\nCONSERVACIÓN, USO, DESTINO, AFECTACIÓN, ENAJENACIÓN, BAJA DE BIENES MUEBLES E\nINMUEBLES, ALMACENES Y DEMÁS ACTIVOS Y RECURSOS MATERIALES; Y EN GENERAL, CON\nLO ESTABLECIDO EN MATERIA DE CONTABILIDAD GUBERNAMENTAL;\nB) LA RECAUDACIÓN, ADMINISTRACIÓN, CUSTODIA, MANEJO, EJERCICIO Y APLICACIÓN\nDE RECURSOS MUNICIPALES, ESTATALES O EN SU CASO FEDERALES, INCLUYENDO,\nSUBSIDIOS, TRANSFERENCIAS Y DONATIVOS, Y SI LOS ACTOS, CONTRATOS, CONVENIOS,\nCONCESIONES, MANDATOS, FONDOS, FIDEICOMISOS, PRESTACIÓN DE SERVICIOS PÚBLICOS,\nMANUEL LOZANO GARIN, AUDITOR ESPECIAL DEL\nSECTOR ORGANISMOS PUBLICOS\nDESCENTRALIZADOS Y ORGANOS AUTONOMOS,\nAMBOS DE LA AUDITORIA GENERAL DEL ESTADO\nREALICEN, SE AJUSTARON AL PRINCIPIO DE LEGALIDAD, Y SI NO HAN CAUSADO DAÑOS O\nPERJUICIOS, O AMBOS, EN CONTRA DE LAS HACIENDAS PÚBLICAS O, EN SU CASO, AL\nPATRIMONIO DE LAS PROPIAS ENTIDADES FISCALIZABLES.\nII.- CONSTATAR LA CORRECTA APLICACIÓN DE LAS LEYES Y PRESUPUESTOS DE\nINGRESOS Y DE EGRESOS QUE DEBEN OBSERVAR LAS ENTIDADES FISCALIZABLES, Y QUE SE\nHAYAN AJUSTADO A LOS CRITERIOS SEÑALADOS EN LOS MISMOS, PARA:\nA) COMPROBAR SI LAS CANTIDADES CORRESPONDIENTES A LOS INGRESOS Y A LOS\nEGRESOS, SE AJUSTARON O CORRESPONDEN A LOS CONCEPTOS Y A LAS PARTIDAS\nRESPECTIVAS;\nB) CONSTATAR SI LOS PROGRAMAS Y SU EJECUCIÓN SE AJUSTARON A LO\nESTABLECIDO EN LAS LEYES Y PRESUPUESTOS DE INGRESOS Y EGRESOS; Y\nC) DETERMINAR SI LOS RECURSOS PROVENIENTES DE FINANCIAMIENTOS Y DEUDA\nPÚBLICA SE OBTUVIERON EN LOS TÉRMINOS AUTORIZADOS Y SE APLICARON CON LA\nPERIODICIDAD Y FORMA ESTABLECIDAS POR LAS LEYES, PRESUPUESTOS Y DEMÁS\nDISPOSICIONES APLICABLES Y SI SE CUMPLIERON LOS COMPROMISOS ADQUIRIDOS EN LOS\nACTOS RESPECTIVOS.\nIII.- VERIFICAR SI LOS FIDEICOMISOS PRIVADOS, CUANDO HAYAN RECIBIDO POR\nCUALQUIER TÍTULO RECURSOS PÚBLICOS MUNICIPALES, ESTATALES O EN SU CASO\nFEDERALES Y, EN GENERAL, CUALQUIER ENTIDAD, PERSONA FÍSICA O JURÍDICA, PÚBLICA O\nPRIVADA, MANDATO, FONDO U OTRA FIGURA JURÍDICA ANÁLOGA, QUE POR CUALQUIER\nRAZÓN, CAPTE, RECAUDE, MANEJE, ADMINISTRE, CONTROLE, RESGUARDE, CUSTODIE,\nEJERZA O APLIQUE RECURSOS, FONDOS, BIENES O VALORES PÚBLICOS MUNICIPALES,\nESTATALES O EN SU CASO FEDERALES, TANTO EN EL PAÍS COMO EN EL EXTRANJERO, SE\nAJUSTARON A LO ESTABLECIDO EN LAS LEYES Y PRESUPUESTOS DE INGRESOS Y EGRESOS,\nAPLICABLES;\nIV.- DETERMINAR LOS ACTOS U OMISIONES QUE PUDIERAN CONFIGURAR ALGUNA\nIRREGULARIDAD EN EL INGRESO, EGRESO, CONTROL, ADMINISTRACIÓN, MANEJO, CUSTODIA\nY APLICACIÓN DE FONDOS, BIENES Y RECURSOS PÚBLICOS MUNICIPALES, ESTATALES O EN\nSU CASO, FEDERALES DE LAS ENTIDADES FISCALIZABLES; ASÍ COMO LAS\nRESPONSABILIDADES ADMINISTRATIVAS A QUE HAYA LUGAR Y LA IMPOSICIÓN DE MULTAS,\nSANCIONES Y RESARCIMIENTOS A LA HACIENDA PÚBLICA, EN LOS TÉRMINOS DE ESTA LEY; Y\nPROMOVER ANTE LAS AUTORIDADES COMPETENTES, EL FINCAMIENTO DE OTRAS\nMANUEL LOZANO GARIN, AUDITOR ESPECIAL DEL\nSECTOR ORGANISMOS PUBLICOS\nDESCENTRALIZADOS Y ORGANOS AUTONOMOS,\nAMBOS DE LA AUDITORIA GENERAL DEL ESTADO\nRESPONSABILIDADES O EN SU CASO, LAS DENUNCIAS PENALES CORRESPONDIENTES, EN\nTÉRMINOS DE LA LEGISLACIÓN APLICABLE;\nV.- EVALUAR EL DESEMPEÑO Y LA GESTIÓN PÚBLICA PARA VERIFICAR:\nA) QUE EN LA ADMINISTRACIÓN DE RECURSOS PÚBLICOS SE HAYAN ATENDIDO A LOS\nPRINCIPIOS DE EFICACIA, EFICIENCIA, ECONOMÍA, TRANSPARENCIA Y HONRADEZ;\nB) SI EN EL EJERCICIO DE LOS RECURSOS PÚBLICOS SE CUMPLIERON CON LOS\nOBJETIVOS, METAS E INDICADORES FIJADOS EN LOS PLANES Y PROGRAMAS APROBADOS;\nC) LA EXISTENCIA DE MECANISMOS DE CONTROL INTERNO; Y\nD) QUE LOS INFORMES QUE SE RINDAN ANTE LA AUDITORIA GENERAL ESTÉN\nRELACIONADOS CON LOS PLANES, PROGRAMAS, Y PRESUPUESTOS, DE ACUERDO A LO QUE\nESTABLECEN LAS DISPOSICIONES APLICABLES.\nVI. DETERMINAR LAS ACCIONES A IMPLEMENTAR PARA MEJORAR LA GESTIÓN\nFINANCIERA DE LAS ENTIDADES FISCALIZABLES DENTRO DEL EJERCICIO FISCAL EN CURSO\nPARA QUE SEAN ATENDIDAS ANTES DE QUE AQUEL FINALICE, EN EL CASO DE LOS INFORMES\nSEMESTRALES O EN EL SIGUIENTE EJERCICIO FISCAL PARA EL CASO DE LA REVISIÓN DE LA\nCUENTA PÚBLICA.\nARTÍCULO 77.- LA AUDITORIA GENERAL SERÁ COMPETENTE PARA:\nI.- EVALUAR LOS INFORMES FINANCIEROS Y FISCALIZAR LAS CUENTAS PÚBLICAS DE\nLAS ENTIDADES FISCALIZABLES;\nII.- FISCALIZAR EN FORMA POSTERIOR LOS INGRESOS Y EGRESOS; LOS ACTIVOS,\nPASIVOS, Y EL PATRIMONIO; EL MANEJO, LA CUSTODIA Y LA APLICACIÓN DE FONDOS Y\nRECURSOS DE LAS ENTIDADES FISCALIZABLES;\nIII.- REALIZAR AUDITORIAS SOBRE EL DESEMPEÑO EN EL CUMPLIMIENTO DE LOS\nMUNICIPALES, Y EN LOS PROGRAMAS GUBERNAMENTALES QUE DERIVAN DE ÉSTOS;\nIV.- FISCALIZAR, DE CONFORMIDAD CON LAS LEYES FEDERALES Y LOS CONVENIOS DE\nCOLABORACIÓN RESPECTIVOS, LAS APORTACIONES FEDERALES Y LOS RECURSOS DE LA\nFEDERACIÓN QUE SE ADMINISTREN O EJERZAN POR EL ESTADO, LOS MUNICIPIOS Y LOS\nPARTICULARES; (...)\nMANUEL LOZANO GARIN, AUDITOR ESPECIAL DEL\nSECTOR ORGANISMOS PUBLICOS\nDESCENTRALIZADOS Y ORGANOS AUTONOMOS,\nAMBOS DE LA AUDITORIA GENERAL DEL ESTADO\nVI.- REALIZAR AUDITORIAS A TRAVÉS DE LOS PRINCIPIOS, CRITERIOS,\nPROCEDIMIENTOS, MÉTODOS Y SISTEMAS ADECUADOS PARA LA FISCALIZACIÓN SUPERIOR\nDE LAS CUENTAS PÚBLICAS; (...)\nX.- FISCALIZAR.LA CUENTA PÚBLICA MEDIANTE VISITAS DE INSPECCIÓN Y LA\nAPLICACIÓN DE PROCEDIMIENTOS DE AUDITORIA, GENERANDO LOS INFORMES\nCORRESPONDIENTES EN LOS TÉRMINOS ESTABLECIDOS POR ESTA LEY; (...)\nXVI.- EMITIR RECOMENDACIONES VINCULANTES, PLIEGOS DE OBSERVACIONES Y\nPLIEGOS DE CARGOS DERIVADOS DE LA FISCALIZACIÓN DE LA CUENTA ANUAL DE LA\nHACIENDA PÚBLICA ESTATAL Y MUNICIPALES, ASÍ COMO LOS INFORMES DE RESULTADOS Y\nDICTÁMENES DE LAS AUDITORIAS PRACTICADAS; (...)\nXXXIX.- LAS DEMÁS QUE LE CORRESPONDAN DE ACUERDO CON ESTA LEY Y SU\nREGLAMENTO.\nARTÍCULO 90.- EL AUDITOR GENERAL TENDRÁ LAS FACULTADES SIGUIENTES:\n(...) II.- EJERCER SUS FACULTADES DE MANERA DIRECTA, Y EXCEPCIONALMENTE POR\nDELEGACIÓN, DE CONFORMIDAD CON LO ESTABLECIDO EN LAS LEYES APLICABLES;\n(...) XII.- EXPEDIR LOS REGLAMENTOS, MANUALES DE ORGANIZACIÓN Y DE\nPROCEDIMIENTOS ADMINISTRATIVOS NECESARIOS PARA EL ADECUADO FUNCIONAMIENTO DE\nLA AUDITORIA GENERAL;\nARTÍCULO 95.- LOS AUDITORES ESPECIALES TENDRÁN LAS FACULTADES SIGUIENTES:\n(...)\nIII.- REVISAR, ANALIZAR Y EVALUAR LOS INFORMES FINANCIEROS SEMESTRALES Y\nLAS CUENTAS PÚBLICAS QUE RINDAN LAS ENTIDADES FISCALIZABLES;(...)\nCELEBRADO OPERACIONES CON AQUÉLLAS, LA INFORMACIÓN Y DOCUMENTACIÓN QUE SEAN\nNECESARIAS PARA EJERCER LA FUNCIÓN DE FISCALIZACIÓN; (...)\nV.- ORDENAR Y REALIZAR AUDITORIAS, VISITAS E INSPECCIONES A LAS ENTIDADES\nFISCALIZABLES, CONFORME AL PROGRAMA APROBADO POR EL AUDITOR GENERAL; (...)\nVII.- FORMULAR Y SOMETER AL ACUERDO DEL AUDITOR GENERAL LAS\nLOS RESULTADOS DE SU REVISIÓN DE LAS AUDITORIAS, VISITAS O INVESTIGACIONES; (...)\nMANUEL LOZANO GARIN, AUDITOR ESPECIAL DEL\nSECTOR ORGANISMOS PUBLICOS\nDESCENTRALIZADOS Y ORGANOS AUTONOMOS,\nAMBOS DE LA AUDITORIA GENERAL DEL ESTADO\n(...) SEGUNDO. LAS FORMALIDADES PARA LA PRESENTACIÓN DE LAS CUENTAS\nPÚBLICAS DEL 2011 SE REGIRÁN POR LO DISPUESTO EN LA LEY DE FISCALIZACIÓN SUPERIOR\nDEL ESTADO DE GUERRERO, NÚMERO 564. SU FISCALIZACIÓN SE LLEVARÁ A CABO\nCONFORME A LO SEÑALADO POR LA PRESENTE LEY.\nLAS CUENTAS PÚBLICAS DEL 2012 SE PRESENTARÁN Y FISCALIZARÁN DE\nCONFORMIDAD CON LAS DISPOSICIONES ESTABLECIDAS EN ESTA LEY.\nTERCERO. EL AUDITOR GENERAL DEL ESTADO EN FUNCIONES DURARÁ EN SU\nENCARGO EL TIEMPO ESTABLECIDO EN EL DECRETO DE SU NOMBRAMIENTO. (...)\nSEXTO. LOS PROCEDIMIENTOS CUYO TRÁMITE HAYA INICIADO PREVIO A LA VIGENCIA\nDE LA PRESENTE LEY, SERÁN SUSTANCIADOS POR LA AUDITORIA GENERAL BAJO EL RÉGIMEN\nDE LA LEY DE FISCALIZACIÓN SUPERIOR DEL ESTADO DE GUERRERO, NÚMERO 564. LOS\nPROCEDIMIENTOS QUE SE INICIEN A LA ENTRADA EN VIGOR DE LA PRESENTE LEY, SE\nREGIRÁN POR ÉSTA.\nSÉPTIMO. SE ABROGA LA LEY DE FISCALIZACIÓN SUPERIOR DEL ESTADO DE\nGUERRERO, NÚMERO 564.\"\nTERCERO.- CON FECHA 17 DE ABRIL DE DOS MIL DOCE, LA QUINCUAGESIMA NOVENA\nLEGISTURA AL H. CONGRESO DEL ESTADO DE GUERRERO, EN TERMINOS DE LO DISPUESTO\nEN EL ARTICULO 92 DE LA LEY NUMERO 1028 DE FISCALIZACION SUPERIOR Y RENDICION DE\nCUENTAS DEL ESTADO DE GUERRERO, DESIGNO Y NOMBRO AL CONTADOR PUBLICO VICTOR\nMANUEL LOZANO GARIN, COMO AUDITOR ESPECIAL DE LA AUDITORIA GENERAL DEL ESTADO,\nQUIEN AL EFECTO ACEPTO Y PROTESTO EL CARGO QUE LE FUE CONFERIDO.\nCUARTO.- QUE EN VIRTUD DE LO ANTERIOR, EL LICENCIADO CERTIFICADO ARTURO\nLATABÁN LÓPEZ, AUDITOR GENERAL DEL ESTADO, EN TERMINOS DE LO ESTABLECIDO EN LA\nFRACCION VIII DEL ARTICULO 90 DE LA LEY NUMERO 1028 DE FISCALIZACIÓN SUPERIOR Y\nRENDICION DE CUENTAS DEL ESTADO DE GUERRERO, ASIGNO AL CONTADOR PUBLICO\nVICTOR MANUEL LOZANO GARIN, LA TITULARIDAD DE LA AUDITORIA ESPECIAL DEL SECTOR\nENTES PUBLICOS ESTATALES Y MUNICIPALES (ACTUALMENTE AUDITORIA ESPECIAL DE\nORGANISMOS PUBLICOS DESCENTRALIZADOS Y ORGANOS AUTONOMOS) EXISTENTE EN LA\nAUDITORIA GENERAL DEL ESTADO.\nCONGRESO DEL ESTADO DE GUERRERO, EN SESIÓN DE FECHA 14 DE JUNIO DEL AÑO EN\nMANUEL LOZANO GARIN, AUDITOR ESPECIAL DEL\nSECTOR ORGANISMOS PUBLICOS\nDESCENTRALIZADOS Y ORGANOS AUTONOMOS,\nAMBOS DE LA AUDITORIA GENERAL DEL ESTADO\nCURSO, EN EL QUE APROBÓ REFORMAR EL ARTÍCULO SEGUNDO TRANSITORIO DE LA LEY\nNÚMERO 1028 DE FISCALIZACIÓN SUPERIOR Y RENDICIÓN DE CUENTAS DEL ESTADO DE\nGUERRERO, PARA QUEDAR DE LA SIGUIENTE FORMA:\n\"... SEGUNDO. - LAS FORMALIDADES PARA LA PRESENTACIÓN DE LAS CUENTAS\nPÚBLICAS DEL 2011 Y DE LOS EJERCICIOS ANTERIORES SE REGIRÁN POR LO DISPUESTO EN\nLA LEY DE FISCALIZACIÓN SUPERIOR DEL ESTADO DE GUERRERO, NÚMERO 564. LA\nFISCALIZACIÓN DE LAS CUENTAS PÚBLICAS ANTERIORES A LAS DEL 2011 SE REGIRÁN EN LO\nQUE NO SE OPONGA EN LA PRESENTE LEY, POR LO DISPUESTO EN LA LEY DE FISCALIZACIÓN\nSUPERIOR DEL ESTADO DE GUERRERO, NÚMERO 564.\nPOR ÚNICA OCASIÓN Y RESPECTO AL EJERCICIO FISCAL 2011, LA AUDITORÍA GENERAL\nDEL ESTADO PODRÁ EMITIR INFORMES DE RESULTADOS DE LA REVISIÓN Y FISCALIZACIÓN DE\nLAS CUENTAS PÚBLICAS DE LAS ENTIDADES FISCALIZABLES, SIGUIENDO LAS FORMALIDADES\nPREVISTAS EN LA LEY DE FISCALIZACIÓN SUPERIOR DEL ESTADO DE GUERRERO, NÚMERO\n564, LOS QUE, EN SU CASO, SERÁN EXCLUIDOS DEL INFORME QUE HABRÁ DE REMITIR AL\nHONORABLE CONGRESO DEL ESTADO EN EL MES DE SEPTIEMBRE DEL 2012, PARA SU\nTRÁMITE CONFORME A LA PRESENTE LEY.\nLAS CUENTAS PÚBLICAS DEL 2012 SE PRESENTARÁN Y FISCALIZARÁN DE\nCONFORMIDAD CON LAS DISPOSICIONES ESTABLECIDAS EN ESTA LEY....\"\nSEXTO.- QUE CON FECHA 26 DE AGOSTO DEL DOS MIL DOCE, FUE PUBLICADO EN EL\nPERIODICO OFICIAL DEL GOBIERNO DEL ESTADO DE GUERRERO, EL REGLAMENTO INTERIOR\nDE LA AUDITORIA GENERAL DEL ESTADO, MISMO QUE EN SUS ARTICULOS 1, 3, 4, 5, 8, 14, 18, 20\nFRACCIONES IV Y VII, y 21 FRACCIONES II Y XIII, ESTABLECE LO SIGUIENTE:\n“ARTÍCULO 1.- EL PRESENTE REGLAMENTO ES DE ORDEN PÚBLICO Y OBSERVANCIA\nOBLIGATORIA PARA LOS SERVIDORES PÚBLICOS DE LA AUDITORÍA GENERAL DEL ESTADO\nGUERRERO. TIENE POR OBJETO REGULAR LAS DISPOSICIONES DE LA CONSTITUCIÓN\nORDENAMIENTOS LEGALES APLICABLES, EN MATERIA DE INTEGRACIÓN, ORGANIZACIÓN,\nFUNCIONAMIENTO Y ATRIBUCIONES DE LOS ÓRGANOS, UNIDADES ADMINISTRATIVAS Y\nSERVIDORES PÚBLICOS DE LA AUDITORÍA GENERAL.(...)\nARTÍCULO 3.- PARA EL EJERCICIO DE SUS ATRIBUCIONES, LA AUDITORÍA GENERAL SE\nINTEGRARÁ CON:\nI.- UN AUDITOR GENERAL;\nMANUEL LOZANO GARIN, AUDITOR ESPECIAL DEL\nSECTOR ORGANISMOS PUBLICOS\nDESCENTRALIZADOS Y ORGANOS AUTONOMOS,\nAMBOS DE LA AUDITORIA GENERAL DEL ESTADO\nII.- CUATRO AUDITORES ESPECIALES;\nIII.- UN DIRECTOR DE ASUNTOS JURÍDICOS;\nIV.-UN DIRECTOR DE ADMINISTRACIÓN Y FINANZAS, Y\nV.-LOS DEMÁS ÓRGANOS AUXILIARES Y SERVIDORES PÚBLICOS NECESARIOS PARA EL\nADECUADO CUMPLIMIENTO DE SUS OBJETIVOS, DE CONFORMIDAD CON LO DISPUESTO POR\nESTE REGLAMENTO.\nARTÍCULO 4.- PARA EL ADECUADO CUMPLIMIENTO DE SUS ATRIBUCIONES, LA\nAUDITORÍA GENERAL SE COMPONE POR LAS SIGUIENTES\nAUDITORÍAS ESPECIALES:\n(...*)\nIII.- AUDITORÍA ESPECIAL DE ORGANISMOS PÚBLICOS DESCENTRALIZADOS Y\nÓRGANOS AUTÓNOMOS; (...)\nAL FRENTE DE CADA UNA HABRÁ UN AUDITOR ESPECIAL, CON LAS COMPETENCIAS\nESTABLECIDAS POR LA LEY DE FISCALIZACIÓN Y EL PRESENTE REGLAMENTO, CUYA\nADSCRIPCIÓN SE DETERMINARÁ MEDIANTE OFICIO SIGNADO POR EL AUDITOR GENERAL.\nARTÍCULO 5.- PARA EL DESPACHO DE LOS ASUNTOS QUE LE COMPETEN, LA\nAUDITORÍA GENERAL SE ORGANIZARÁ MEDIANTE LAS UNIDADES ADMINISTRATIVAS\nSIGUIENTES: (...)\nIV.- AUDITORÍA ESPECIAL DE ORGANISMOS PÚBLICOS DESCENTRALIZADOS Y\nÓRGANOS AUTONOMOS\nI.-DIRECCIÓN DE AUDITORÍA FINANCIERA.\nII.- DIRECCIÓN DE AUDITORÍA DE OBRA PÚBLICA;\nIII.-DIRECCIÓN DE SOLVENTACIÓN.\nIV.-SUBDIRECCIÓN DE AUDITORÍA FINANCIERA.\nV.-SUBDIRECCIÓN DE AUDITORÍA A RECURSOS FEDERALIZADOS\nVI.-SUBDIRECCIÓN DE AUDITORÍA DE OBRA PÚBLICA\nVII.- SUBDIRECCIÓN DE SOLVENTACIÓN\nVIII.- SUBDIRECCIÓN DE INFORMÁTICA Y TECNOLOGÍAS DE LA INFORMACIÓN.\nIX.- JEFES DE DEPARTAMENTO\nX.- SUPERVISORES\nXI.- AUDITORES\nARTÍCULO 8.- LA AUDITORÍA GENERAL CONDUCIRÁ SUS ACTIVIDADES EN FORMA\nMANUEL LOZANO GARIN, AUDITOR ESPECIAL DEL\nSECTOR ORGANISMOS PUBLICOS\nDESCENTRALIZADOS Y ORGANOS AUTONOMOS,\nAMBOS DE LA AUDITORIA GENERAL DEL ESTADO\nINSTITUCIONALES ESTABLEZCA EL AUDITOR GENERAL, CON LA SUPERVISIÓN DE LA COMISIÓN\nDE VIGILANCIA, CONFORME A LO DISPUESTO EN LOS ARTÍCULOS 193 Y 194 DE LA LEY DE\nFISCALIZACIÓN. (...)\nARTÍCULO 14.- EL AUDITOR GENERAL TIENE LAS ATRIBUCIONES ESTABLECIDAS EN EL\nARTÍCULO 90 DE LA LEY DE FISCALIZACIÓN. PARA EL ADECUADO EJERCICIO DE LAS MISMAS Y\nLA OPTIMIZACIÓN DEL TRABAJO, PODRÁ EJERCER SUS FACULTADES DE MANERA DIRECTA 0\nDELEGARLAS EN LOS SERVIDORES PÚBLICOS DE LA AUDITORÍA GENERAL, PREVIA EMISIÓN\nDEL ACUERDO RESPECTIVO, EXCEPTO LAS QUE LA PROPIA LEY DE FISCALIZACIÓN Y EL\nPRESENTE REGLAMENTO LE CONFIERAN DE FORMA INDELEGABLE. (...)\nARTÍCULO 18.- EL AUDITOR ESPECIAL DE ORGANISMOS PÚBLICOS\nDESCENTRALIZADOS Y ÓRGANOS AUTÓNOMOS, SERÁ COMPETENTE PARA FISCALIZAR LOS\nINFORMES SEMESTRALES Y LAS CUENTAS PÚBLICAS DE LOS ÓRGANOS CONSTITUCIONAL O\nLEGALMENTE AUTÓNOMOS, LOS ORGANISMOS PÚBLICOS DESCENTRALIZADOS ESTATALES Y\nMUNICIPALES, FIDEICOMISOS PÚBLICOS, ESTATALES, MUNICIPALES Y DE LAS DEMÁS\nPERSONAS DE DERECHO PÚBLICO Y PRIVADO, CUANDO HAYAN RECIBIDO, ADMINISTRADO,\nCUSTODIADO O APLICADO POR CUALQUIER TÍTULO RECURSOS PÚBLICOS DE LAS ENTIDADES\nFISCALIZABLES A QUE SE REFIERE ESTE ARTÍCULO.(...)\nARTÍCULO 20.- SON ATRIBUCIONES GENERALES DE LOS AUDITORES ESPECIALES,\nADEMÁS DE LAS PREVISTAS EN EL ARTÍCULO 95 DE LA LEY DE FISCALIZACIÓN, LAS\nSIGUIENTES: (...)\nX.- SOMETER A LA CONSIDERACIÓN DEL AUDITOR GENERAL, EL INFORME DEL ÍNDICE\nDE EFICIENCIA DE SOLVENTACIÓN DE LOS PLIEGOS PREVENTIVOS, DE OBSERVACIONES Y DE\nRECOMENDACIONES DERIVADAS DE LA REVISIÓN Y FISCALIZACIÓN DE LOS INFORMES\nSEMESTRALES Y CUENTAS PÚBLICAS DE LAS ENTIDADES FISCALIZABLES;\nXIII.- DETERMINAR SI LA DOCUMENTACIÓN Y DEMÁS ELEMENTOS PRESENTADOS POR\nLAS ENTIDADES FISCALIZABLES PARA DAR ATENCIÓN A LAS OBSERVACIONES, SON O NO\nSUFICIENTES PARA ACLARARLAS, JUSTIFICARLAS O SOLVENTARLAS Y SOMETER AL ACUERDO\nDEL AUDITOR GENERAL LO CONDUCENTE;\nXIV.- DISEÑAR Y OPERAR EL SISTEMA DE CONTROL Y SEGUIMIENTO DE LAS\nOBSERVACIONES Y RECOMENDACIONES DE LOS INFORMES SEMESTRALES, CUENTAS\nPÚBLICAS Y RESULTADOS DE AUDITORÍAS, Y ELABORAR LOS REPORTES REQUERIDOS, PARA\nCOADYUVAR EN SU DEBIDA ATENCIÓN Y SOLVENTACIÓN (...)\"\nMANUEL LOZANO GARIN, AUDITOR ESPECIAL DEL\nSECTOR ORGANISMOS PUBLICOS\nDESCENTRALIZADOS Y ORGANOS AUTONOMOS,\nAMBOS DE LA AUDITORIA GENERAL DEL ESTADO\nARTÍCULO 21.- Son atribuciones específicas de los Auditores Especiales del Sector\nAyuntamientos, del Sector Gobierno, y de Organismos Públicos Descentralizados y Órganos Autónomos, además de las previstas por la Ley de Fiscalización, las siguientes:\n(...)\nII.- ACORDAR CON EL AUDITOR GENERAL LA RESOLUCIÓN DE LOS ASUNTOS CUYA\nTRAMITACIÓN SE ENCUENTRE DENTRO DEL ÁMBITO DE SU COMPETENCIA;\n(...)\nV.- PROPORCIONAR, CONFORME A SUS ATRIBUCIONES Y DE ACUERDO CON LAS\nPOLÍTICAS Y NORMAS ESTABLECIDAS EN LA MATERIA, LA INFORMACIÓN, DOCUMENTACIÓN,\nDATOS, INFORMES Y ASESORÍAS O COOPERACIÓN TÉCNICA QUE LE REQUIERAN OTRAS\nÁREAS DE LA AUDITORÍA GENERAL (...)\"\nOCTAVO.- QUE MEDIANTE OFICIO NUMERO AGE/AE-OPD'S Y AO/ 093/2013, DE FECHA 21\nDE MAYO DE 2013, DIRIGIDO AL AUDITOR GENERAL DEL ESTADO POR EL C.P. VICTOR MANUEL\nLOZANO GARIN, AUDITOR ESPECIAL DEL SECTOR ORGANISMOS PUBLICOS\nDESCENTRALIZADOS Y ORGANOS AUTONOMOS, POR EL QUE LE REMITIE LOS PLIEGOS\nPREVENTIVOS DERIVADOS DE LA REVISION Y EVALUACION A LOS INFORMES FINANCIERSOS\nSEMESTRALES CORRESPONDIENTES AL EJERCICIO FISCAL 2012 RESPECTO DE LOS\nORGANISMOS: SISTEMA PARA EL DESARROLLO INTEGRAL DE LA FAMILIA; COMISION DE\nINFRAESTRUCTURA CARRETERA Y AEROPORTUARIA DEL ESTADO DE GUERRERO; HOPITAL\nDE LA MADRE Y EL NIÑO GUERRERENSE; INSTITUTO GERRERENSE DE LA CULTURA;\nCOMISION DE AGUA POTABLE Y ALCANTARILLADO DEL ESTADO DE GUERRERO; INSTITUTO\nESTATAL DE OFTALMOLOGIA; HOSPITAL DE LA MADRE Y EL NIÑO INDIGENA GUERRERENSE;\nINSTITUTO GUERRERENSE DE INFRAESTRUCTURA FISICA EDUCATIVA; COMISION DE LA\nDEFENSA DE LOS DERECHOS HUMANOS DEL ESTADO DE GUERRERO; E INSTITUTO DE\nTRANSPARENCIA Y ACCESO A LA INFORMACION PUBLICA, LO ANTERIOR PARA LA\nAUTOIZACION Y FIRMA DEL AUDITOR GENERAL DEL ESTADO Y SE PROCEDA A LA\nNOTIFICACION DE LOS REFERIDOS PLIEGOS, TOMANDO EN CUENTA LOS PLAZOS\nESTABLECIDOS POR LA LEY NUMERO 1028 DE FISCALIZACION SUPERIOR Y RENDICION DE\nCUENTAS.\nESTADO, SE REQUIERE DE MANERA PREVIA LLEVAR A CABO SU VALORACION\nCORRESPONDIENTE, LO QUE PODRIA GENERAR RETRASOS EN LA EMISIÓN, FIRMA Y\nDEL SECTOR ORGANISMOS PUBLICOS DESCENTRALIZADOS Y ORGANOS AUTONOMOS, YA\nTAL MOTIVO, PUDIERA PONERSE EN RIESGO EL EMITIR Y NOTIFICAR LOS REFERIDOS PLIEGOS\nMANUEL LOZANO GARIN, AUDITOR ESPECIAL DEL\nSECTOR ORGANISMOS PUBLICOS\nDESCENTRALIZADOS Y ORGANOS AUTONOMOS,\nAMBOS DE LA AUDITORIA GENERAL DEL ESTADO\nCON LOS TIEMPOS ESTABLECIDOS EN LA LEY QUE SE INDICA, EN EL CASO, TOMANDO EN\nCUENTA, QUE EN LAS FRACCIONES III, IV, V Y VII DEL ARTICULO 95 DE LA LEY NUMERO 1028 DE\nFISCALIZACION SUPERIOR Y RENDICION DE CUENTAS DEL ESTADO DE GUERRERO, FACULTA A\nLOS AUDITORES ESPECIALES PARA REVISAR, ANALIZAR Y EVALUAR LOS INFORMES\nFINANCIEROS SEMESTRALES Y LAS CUENTAS PUBLICAS QUE RINDAN LAS ENTIDADES FISCALIZABLES; ASI COMO TAMBIEN PARA REQUERIR A LAS ENTIDADES FISCALIZARLES Y A\nTERCEROS QUE HUBIEREN REALIZADO OPERACIONES CON AQUELLAS, LA INFORMACION Y\nDOCUMENTACION QUE SEAN NECESARIAS PARA EJERCER LA FUNCION DE FISCALIZACION; Y\nPARA EN SU CASO, ORDENAR Y REALIZAR AUDITORIAS, VISITAS E INSPECCIONES A LAS\nENTIDADES FISCALIZABLES Y POR ULTIMO, PARA FORMULAR Y SOMETER AL ACUERDO DEL\nAUDITOR GENERAL DEL ESTADO, LAS RECOMENDACIONES Y LOS PLIEGOS DE\nOBSERVACIONES QUE DERIVEN DE LOS RESULTADOS DE LA REVISION DE LAS AUDITORIAS,\nVISITAS O INVESTIGACIONES QUE REALICEN, LO QUE REPRESENTA CUMPLIR CON UNA SERIE\nDE PROCESOS Y ACCIONES QUE SE DEBEN DE EJECUTAR CON TODA OPORTUNIDAD Y\nANTICIPACION A LA FECHA EN QUE LA AUDITORIA GENERAL DEL ESTADO DEBE RENDIR EL\nINFORME ANUAL DE RESULTADOS DE LA REVISION DE LA CUENTA PUBLICA AL H. CONGRESO\nDEL ESTADO DE GUERRERO, EN TERMINOS DE LO DISPUESTO EN LOS ARTICULOS 27, 28 Y 38\nDE LA LEY NUMERO 1028 DE FISCALIZACION SUPERIOR Y RENDICION DE CUENTAS DEL\nESTADO DE GUERRERO, LO QUE IMPLICA DAR A CONOCER CON CELERIDAD A LAS ENTIDADES\nFISCALIZABLES LAS OBSERVACIONES QUE SE GENEREN DURANTE EL PROCESO DE\nFISCALIZACION, PARA NO VULNERAR EL DERECHO QUE A LAS ENTIDADES FISCALIZABLES LES\nASISTE PARA ACLARARLAS CON ANTICIPACION AL VENCIMIENTO DEL TERMINO PARA LA\nPRESENTACIÓN DEL REFERIDO INFORME ANUAL DE RESULTADOS, RAZON POR LO QUE SE\nCONSIDERA CONVENIENTE PARA TENER UNA MEJOR ATENCION DE ESTOS PROCESOS,\nDELEGAR EN EL MENCIONADO AUDITOR ESPECIAL DEL SECTOR ORGANISMOS PUBLICOS\nDESCENTRALIZADOS Y ORGANOS AUTONOMOS, LA POSIBILIDAD DE QUE DE MANERA\nEXCEPCIONAL Y POR UNICA OCASIÓN, PROCEDA A EMITIR Y SIGNAR CON PLENITUD DE\nFACULTADES Y BAJO SU DIRECTRIZ Y RESPONSABILIDAD, LOS PLIEGOS PREVENTIVOS DE LAS\nENTIDADES FISCALIZABLES A LAS QUE SE HACE REFERENCIA EN EL PRESENTE ACUERDO,\nDEBERAN INFORMAR AL AUDITOR GENERAL DEL ESTADO, LOS RESULTADOS DEL EJERCICIO\nDE LAS FACULTADES QUE SE LE DELEGAN.\nEN VIRTUD DE LAS CONSIDERACIONES ANTERIORES, EL AUDITOR GENERAL DEL\nESTADO ACUERDA:\nPRIMERO. - EN TERMINOS DE LO DISPUESTO EN LOS ARTICULOS I°, 2 FRACCION I, V,\nVIII, XVIII, 26, 27, 29, 77 FRACCIONES I, II, III, IV, VI, X, XVI, XXXIX, 90 FRACCIONES II, XII, 95\nFRACCIONES III, IV, V, VII DE LA LEY NUMERO 1028 DE FISCALIZACIÓN SUPERIOR Y RENDICION\nDE CUENTAS DEL ESTADO DE GUERRERO; 1, 3, 4, 5, 8, 14, 18, 20 FRACCIONES IV Y VII, y 21 DEL\nMANUEL LOZANO GARIN, AUDITOR ESPECIAL DEL\nSECTOR ORGANISMOS PUBLICOS\nDESCENTRALIZADOS Y ORGANOS AUTONOMOS,\nAMBOS DE LA AUDITORIA GENERAL DEL ESTADO\nREGLAMENTO INTERIOR DE LA AUDITORIA GENERAL DEL ESTADO, EL AUDITOR GENERAL DEL\nESTADO DELEGA A FAVOR DEL CONTADOR PUBLICO VICTOR MANUEL LOZANO GARIN,\nAUDITOR ESPECIAL DEL SECTOR ORGANISMOS PUBLICOS DESCENTRALIZADOS Y ORGANOS\nAUTONOMOS DE ESTA AUDITORIA GENERAL DEL ESTADO, LA FACULTAD PARA QUE DE\nMANERA EXCEPCIONAL Y POR UNICA OCASIÓN, OBSERVANDO LOS PRINCIPIOS DE\nLEGALIDAD, EFICACIA, HONRADEZ, IMPARCIALIDAD Y PROFESIONALISMO, EMITA Y FIRME LOS\nPLIEGOS PREVENTIVOS DERIVADOS DE LA REVISION Y EVALUACION A LOS INFORMES\nFINANCIERSOS SEMESTRALES CORRESPONDIENTES AL EJERCICIO FISCAL 2012, RESPECTO\nDE LOS ORGANISMOS: SISTEMA PARA EL DESARROLLO INTEGRAL DE LA FAMILIA; COMISION\nDE INFRAESTRUCTURA CARRETERA Y AEROPORTUARIA DEL ESTADO DE GUERRERO;\nHOPITAL DE LA MADRE Y EL NIÑO GUERRERENSE; INSTITUTO GERRERENSE DE LA CULTURA;\nCOMISION DE AGUA POTABLE Y ALCANTARILLADO DEL ESTADO DE GUERRERO; INSTITUTO\nESTATAL DE OFTALMOLOGIA; HOSPITAL DE LA MADRE Y EL NIÑO INDIGENA GUERRERENSE;\nINSTITUTO GUERRERENSE DE INFRAESTRUCTURA FISICA EDUCATIVA; COMISION DE LA\nDEFENSA DE LOS DERECHOS HUMANOS DEL ESTADO DE GUERRERO; E INSTITUTO DE\nTRANSPARENCIA Y ACCESO A LA INFORMACION PUBLICA, ASI COMO PARA QUE PROCEDA A\nNOTIFICAR MEDIANTE OFICIO LOS REFERIDOS PLIEGOS PREVENTIVOS A LAS ENTIDADES\nFISCALIZABLES ANTES SEÑALADAS, PUDIENDO PARA ESOS EFECTOS, HABILITAR AL\nPERSONAL ADSCRITO A LA AUDITORIA ESPECIAL A SU CARGO, EN EL ENTENDIDO QUE EL\nDELEGATARIO, UNA VEZ NOTIFICADOS LOS CITADOS PLIEGOS, LOS ENVIARA AL AUDITOR\nGENERAL DEL ESTADO, ACOMPAÑANDO AL EFECTO, LOS ANEXOS QUE SIRVIERON PARA LA\nEMISION DE LOS CITADOS PLIEGOS.\nSEGUNDO.- EL EJERCICIO DE LAS FACULTADES QUE SE DELEGAN EN EL PRESENTE\nACUERDO, SE SUJETARÁ A LAS DISPOSICIONES LEGALES Y A LA NORMATIVIDAD APLICABLE.\nTERCERO.- LA PRESENTE DELEGACIÓN DE FACULTADES SE ENTIENDE HECHA, SIN\nPERJUICIO DE SU EJERCICIO DIRECTO POR PARTE DEL AUDITOR GENERAL DEL ESTADO.\nCUARTO.- EL DELEGATARIO DEBERÁ INFORMAR AL AUDITOR GENERAL DEL ESTADO,\nDELEGAN.\nQUINTO.- NOTIFIQUESE MEDIANTE OFICIO LOS TERMINOS DEL PRESENTE ACUERDO\nORGANOS AUTONOMOS, ASI COMO AL DIRECTOR DE ASUNTOS JURIDICOS, TODOS DE LA\nAUDITORIA GENERAL DEL ESTADO, PARA SU DEBIDO CUMPLIMIENTO, ASI COMO PARA LOS\nMANUEL LOZANO GARIN, AUDITOR ESPECIAL DEL\nSECTOR ORGANISMOS PUBLICOS\nDESCENTRALIZADOS Y ORGANOS AUTONOMOS,\nAMBOS DE LA AUDITORIA GENERAL DEL ESTADO\nUNICO. - EL PRESENTE ACUERDO ENTRARÁ EN VIGOR AL DÍA SIGUIENTE AL DE SU\nPUBLICACION EN LOS ESTRADOS DE LA AUDITORIA GENERAL DEL ESTADO Y DEBERA\nPUBLICARSE EN EL PERIÓDICO OFICIAL DEL GOBIERNO DEL ESTADO DE GUERRERO, TAL Y\nCOMO SE DISPONE EN EL ARTICULO 91 DE LA LEY NUMERO 1028 DE FISCALIZACION SUPERIOR\nY RENDICION DE CUENTAS DEL ESTADO DE GUERRERO.\nASÍ LO ACORDÓ Y FIRMA EL CIUDADANO LICENCIADO CERTIFICADO ARTURO\nLATABÁN LÓPEZ, AUDITOR GENERAL DEL ESTADO DE GUERRERO, EN LA CIUDAD DE\nCHILPANCINGO DE LOS BRAVO, GUERRERO, A LOS VEINTIDOS DÍAS DEL MES DE MAYO DEL\nAÑO DOS MIL TRECE.\nPUBLÍQUESE Y CÚMPLASE.\nRúbrica.\nLA SUSCRITA LICENCIADA XOCHILTL VALDEZ OJEDA, ACTUARIA HABILITADA DE LA\nAUDITORIA GENERAL DEL ESTADO, HACE CONSTAR QUE EL PRESENTE ACUERDO SE\nNOTIFICO POR LISTA PUBLICADA EN LOS ESTRADOS DE ESTE ORGANO DE FISCALIZACION\nSUPERIOR, A LAS 14:00 HORAS DEL DIA VEINTIDOS DE MAYO DEL AÑO DOS MIL TRECE.\nCERTIFICACIÓN.- EL SUSCRITO LICENCIADO MARCO ANTONIO CRUZ MANJARREZ\nSALGADO, DIRECTOR DE ASUSNTOS JURÍDICOS, EN EJERCICIO DE LA FACULTAD QUE ME\nCONFIEREN LOS ARTÍCULOS 90 FRACCIÓN III Y 96 FRACCIÓN III DE LA LEY NÚMERO 1028, DE\nFISCALIZACIÓN SUPERIOR Y RENDICIÓN DE CUENTAS DEL ESTADO DE GUERRERO, POR\nDELEGACIÓN EXPRESA DEL C. LICENCIADO CERTIFICADO ARTURO LATABÁN LÓPEZ, AUDITOR\nGENERAL DEL ESTADO, REALIZADA EN ACUERDO DE FECHA DIECIOCHO DE JUNIO DEL AÑO\nDOS MIL DOCE, Y PUBLICADO EN EL PERIÓDICO OFICIAL DEL GOBIERNO DEL ESTADO DE\nGUERRERO EL DÍA VEINTE DE JULIO DEL MISMO AÑO.\nQUE LAS PRESENTES COPIAS FOTOSTÁTICAS COMPUESTAS DE DOCE FOJAS ÚTILES,\nARCHIVOS DE LA AUDITORÍA GENERAL DEL ESTADO; LO QUE CERTIFICO PREVIO COTEJO,\nPARA LOS EFECTOS LEGALES A QUE HAYA LUGAR, EN LA CIUDAD DE CHILPANCINGO DE LOS\nBRAVO, GUERRERO, A LOS VEINTICINCO DÍAS DEL MES DE JUNIO DEL AÑO DOS MIL TRECE.\nCONSTE.\nRúbrica.",
  "ordenamiento": "ACUERDO",
  "jurisdiccion": "GUERRERO",
  "fuente_oficial": "DIARIO OFICIAL DE LA FEDERACION",
  "Fecha de Publicación": "06 de Agosto de 2013",
  "ULTIMA REFORMA PUBLICADA": null,
  "status": "VIGENTE",
  "es_escaneado": false,
  "tiene_tablas": false,
  "materia": [
    "auditoría"
  ]
}