{
  "titulo": "Acuerdo Mediante el Cual Se Crea el Fondo Auxiliar del Instituto de Transparencia, Acceso A la Infor",
  "Contenido": "DATOS PERSONALES DEL ESTADO DE GUERRERO\nTEXTO ORIGINAL. de 2015.\nINSTITUTO DE\nTRANSPARENCIA,\nACCESO A LA\nINFORMACIÓN Y\nPROTECCIÓN DE DATOS\nPERSONALES DEL\nESTADO DE GUERRERO\nACUERDO MEDIANTE EL CUAL SE CREA EL FONDO AUXILIAR DEL INSTITUTO DE\nTRANSPARENCIA, ACCESO A LA INFORMACIÓN Y PROTECCIÓN DE DATOS PERSONALES DEL\nESTADO DE GUERRERO.\nEL PLENO DEL INSTITUTO DE TRANSPARENCIA, ACCESO A LA INFORMACIÓN Y\nPROTECCIÓN DE DATOS PERSONALES DEL ESTADO DE GUERRERO, Y:\nCONSIDERANDO\nQue en Sesión Ordinaria número ITAIG/10/2015, de fecha catorce de abril del año dos mil quince, el Pleno de este Instituto a propuesta de los Consejeros Roberto Rodríguez Saldaña y Joaquín Morales\nSánchez, emitió por unanimidad un Acuerdo, y entre las consideraciones que lo sustentan, se destaca lo siguiente: octavo, capítulo II, artículos 120 al 123, aluden al Instituto de Transparencia, Acceso a la Información y\nProtección de Datos Personales del Estado de Guerrero, como un órgano autónomo del Estado, cuya función es promover, proteger, garantizar, difundir y transparentar los actos de las autoridades estatales y municipales, así como de las personas físicas o morales, públicas o privadas que ejerzan recursos públicos, el derecho a la información de las personas y sus datos personales, además se establecen los principios sobre los que se rige, su integración, nombramiento y atribuciones, dichas características, hacen que el órgano garante tenga un rango constitucional.\nGuerrero vigente, se establece expresamente: \"Artículo 123. El Instituto de Transparencia, Acceso a la\nInformación y Protección de Datos Personales del Estado de Guerrero tiene las atribuciones siguientes: (...\n) IX. Sancionar la inobservancia a las disposiciones en materia de acceso a la información pública en los términos que disponga la ley.\"\nIII. Que en este tenor, la fracción IV y último párrafo del artículo 96 de la Ley número 374 de\nDATOS PERSONALES DEL ESTADO DE GUERRERO el cumplimiento de las atribuciones que le confiere esta Ley, el Instituto podrá aplicar las medidas de apremio siguientes: (...) IV. Multa de veinte a doscientos días de salario mínimo general vigente en la zona económica correspondiente. El cobro de la multa se efectuará por la Secretaría de\nFinanzas y Administración a través del procedimiento económico coactivo.\"\nIV. Que para efectos de ejercer las facultades previstas en la Constitución Local y la Ley número\n374 de Transparencia y Acceso a la Información, e imponer las sanciones derivadas de la inobservancia a las disposiciones en materia de transparencia y acceso a la información, específicamente aquellas consistentes en multas económicas, es pertinente implementar un mecanismo que garantice el cobro y pago de las mismas. En mérito de estas consideraciones es necesario crear un Fondo Auxiliar del\nInstituto de Transparencia, Acceso a la Información y Protección de Datos Personales del Estado de Guerrero, que tenga como finalidad la administración de los recursos obtenidos por concepto de multas impuestas a los sujetos obligados, donaciones, entre otros. Para lo anterior, será la Secretaría de Finanzas y Administración del Gobierno del Estado de Guerrero, quien haga efectivo el cobro de las multas económicas impuestas por el Instituto sujetándose al procedimiento legal correspondiente, posteriormente, depositará los recursos a la cuenta concentradora del Fondo.\nV. Que para ejercitar el cúmulo de atribuciones adquiridas a través de la reformas a la Constitución\nFederal y la del Estado, y cumplir con los objetivos y alcances de las mismas, este Instituto debe realizar las acciones necesarias tendientes a garantizar plenamente el ejercicio de acceso a la información pública, siendo una de ellas, el de allegarse de recursos económicos para solventar los gastos sustanciales de este\nOrganismo, y acrecentar los programas de difusión, capacitación y conocimiento sobre la transparencia, el acceso a la Información y la protección de datos personales.\nVI. Que las actividades a realizar dentro del marco de las atribuciones del Instituto, rebasan las asignaciones presupuestales que son insuficientes para atender las nuevas exigencias de las reformas constitucionales inherentes a las funciones sustanciales de este órgano garante, justificándose así la creación del Fondo Auxiliar del Instituto de Transparencia, Acceso a la Información y Protección de Datos\nPersonales del Estado de Guerrero. Los recursos que constituyan el fondo se destinarán a cumplir o\nEn virtud de las consideraciones expuestas, y con la finalidad de dar cumplimiento eficaz a las\nAcceso a la Información Pública del Estado de Guerrero, en materia de Transparencia, Acceso a la\nInformación y Protección de Datos Personales, el Pleno de este Instituto, emite el siguiente:\nPrimero. Se crea el Fondo Auxiliar del Instituto de Transparencia, Acceso a la Información y\nProtección de Datos Personales del Estado de Guerrero, como un órgano administrativo dependiente del\nInstituto de Transparencia, Acceso a la Información, y Protección de Datos Personales del Estado de\nGuerrero.\nDATOS PERSONALES DEL ESTADO DE GUERRERO\nSegundo. El Fondo tendrá por objeto allegarse recursos económicos para aplicarlos a alguna de\nGuerrero.\nTercero. El patrimonio del Fondo Auxiliar del Instituto de Transparencia, Acceso a la Información y Protección de Datos Personales del Estado de Guerrero, se integrará con:\nI. El importe de los depósitos efectuados por la Secretaría de Finanzas y Administración del\nGobierno del Estado de Guerrero, por concepto del cobro de las multas impuestas a los Sujetos Obligados por la inobservancia a las disposiciones en materia de acceso a la información y protección de datos personales.\nII. Las donaciones o aportaciones que por cualquier concepto se hagan a favor del Fondo.\nIII. Las cantidades que se le asignen por disposición de la Ley de egresos o por acuerdo del\nEjecutivo del Estado.\nIV. Los demás bienes que el Fondo adquiera.\nCuarto. El Pleno del Instituto de Transparencia, Acceso a la Información y Protección de Datos\nPersonales del Estado de Guerrero, constituirá el Consejo de Administración del Fondo y tendrá las siguientes atribuciones:\nI. Administrar los recursos que constituyan el patrimonio del Fondo.\nII. Autorizar las erogaciones del Fondo.\nIII. Aceptar las donaciones o aportaciones a favor del Fondo provenientes de Instituciones públicas y privadas.\nIV.- Dictar los acuerdos que estime convenientes para la correcta administración y destino del patrimonio del Fondo.\nEl Consejo de Administración sesionará por lo menos una vez al mes, para tratar todos los asuntos que se relacionen con el Fondo. cargo la elaboración de las actas respectivas, así como la expedición de toda clase de certificaciones relacionadas con el Fondo.\nQuinto. Las multas impuestas a los Sujetos Obligados se mandarán hacer efectivas a través de a la Información Pública del Estado de Guerrero. Para lo anterior se podrán celebrar convenios con la multas.\nDATOS PERSONALES DEL ESTADO DE GUERRERO\nTRANSITORIOS\nPrimero. El presente Acuerdo entrará en vigor al día siguiente de su aprobación\nGuerrero, en los estrados y en la página electrónica oficial del Instituto de Transparencia, Acceso a la\nInformación y Protección de Datos Personales del Estado de Guerrero.\nTercero. Realícense las gestiones necesarias para dar cumplimento al contenido de este acuerdo.\nAsí lo acordó por unanimidad, el pleno del Instituto de Transparencia, Acceso a la Información y\nProtección de Datos Personales del Estado de Guerrero, en sesión ordinaria de fecha catorce de abril del año dos mil quince, por ante el Secretario Ejecutivo que da fe.\nC. Roberto Rodríguez Saldaña.\nConsejero Presidente.\nRúbrica.\nC. Crescencio Almazán Tolentino.\nConsejero.\nRúbrica.\nC. Joaquín Morales Sánchez.\nConsejero.\nRúbrica.\nC. Rene Pérez Alcaraz.\nSecretario Ejecutivo.\nRúbrica.\nSe publicó el correspondiente acuerdo el día 14 de abril de 2015.\nEL SUSCRITO LICENCIADO FELIPE REYES NÁJERA, SECRETARIO DE ACUERDOS DEL\nINSTITUTO DE TRANSPARENCIA, ACCESO A LA INFORMACIÓN Y PROTECCIÓN DE DATOS\nPERSONALES DEL ESTADO DE GUERRERO\nAMBOS LADOS, RELATIVAS AL ACUERDO EMITIDO POR EL PLENO DEL INSTITUTO DE\nTRANSPARENCIA, ACCESO A LA INFORMACIÓN Y PROTECCIÓN DE DATOS PERSONALES DEL\nESTADO DE GUERRERO, EN SESIÓN ORDINARIA NÚMERO ITAIG/10/2015, DE FECHA CATORCE\nDE ABRIL DEL AÑO EN CURSO, CONCUERDAN FIEL E ÍNTEGRAMENTE EN TODAS Y CADA UNA DE\nDATOS PERSONALES DEL ESTADO DE GUERRERO\nPERSONALES DEL ESTADO DE GUERRERO; MISMAS QUE VAN DEBIDAMENTE SELLADAS Y\nCOTEJADAS. CERTIFICÁNDOSE EN LA CIUDAD DE CHILPANCINGO DE LOS BRAVO, GUERRERO,\nA LOS VEINTITRES DÍAS DEL MES DE ABRIL DEL AÑO DOS MIL QUINCE.- DOY FE.\nRúbrica.",
  "ordenamiento": "ACUERDO",
  "jurisdiccion": "GUERRERO",
  "fuente_oficial": "DIARIO OFICIAL DE LA FEDERACION",
  "Fecha de Publicación": "03 de Julio \nde 2015",
  "ULTIMA REFORMA PUBLICADA": null,
  "status": "VIGENTE",
  "es_escaneado": false,
  "tiene_tablas": false,
  "materia": [
    "transparencia"
  ]
}