{
  "titulo": "Acuerdo por el Que Se Aprueba el Tabulador para la Imposición de Multas Económicas por Parte del Ins",
  "Contenido": "ACCESO A LA INFORMACIÓN Y PROTECCIÓN DE\nDATOS PERSONALES DEL ESTADO DE GUERRERO\nTEXTO ORIGINAL. de 2015.\nACUERDO POR EL QUE SE APRUEBA EL TABULADOR PARA LA IMPOSICIÓN DE MULTAS\nECONÓMICAS POR PARTE DEL INSTITUTO DE TRANSPARENCIA, ACCESO A LA INFORMACIÓN Y\nPROTECCIÓN DE DATOS PERSONALES DEL ESTADO DE GUERRERO.\nEL PLENO DEL INSTITUTO DE TRANSPARENCIA, ACCESO A LA INFORMACIÓN Y\nPROTECCIÓN DE DATOS PERSONALES DEL ESTADO DE GUERRERO, Y:\nCONSIDERANDO\nQue en Sesión Ordinaria número ITAIG/10/2015, de fecha catorce de abril del año dos mil quince, el Pleno de este Instituto a propuesta de los Consejeros Roberto Rodríguez Saldaña y Joaquín Morales\nSánchez, emitió por unanimidad un Acuerdo, y entre las consideraciones que lo sustentan, se destaca lo siguiente: octavo, capítulo II, artículos 120 al 123, aluden al Instituto de Transparencia, Acceso a la Información y\nProtección de Datos Personales del Estado de Guerrero, como un órgano autónomo del Estado, cuya función es promover, proteger, garantizar, difundir y transparentar los actos de las autoridades estatales y municipales, así como de las personas físicas o morales, públicas o privadas que ejerzan recursos públicos, el derecho a la información de las personas y sus datos personales, además se establecen los principios sobre los que se rige, su integración, nombramiento y atribuciones, dichas características, hacen que el órgano garante tenga un rango constitucional.\nGuerrero vigente, se establece expresamente: \"Artículo 123. El Instituto de Transparencia, Acceso a la\nInformación y Protección de Datos Personales del Estado de Guerrero tiene las atribuciones siguientes:\n(...) IX. Sancionar la inobservancia a las disposiciones en materia de acceso a la información pública en los términos que disponga la ley.\"\nIII. Que en este tenor, la fracción IV y último párrafo del artículo 96 de la Ley número 374 de el cumplimiento de las atribuciones que le confiere esta Ley, el Instituto podrá aplicar las medidas de apremio siguientes: (...) IV. Multa de veinte a doscientos días de salario mínimo general vigente en la zona económica correspondiente. del procedimiento económico coactivo. \"\nIV. Que para efectos de llevar a cabo la cuantificación e imposición de las sanciones económicas previstas en la Constitución Local y la Ley de la materia, es necesario contar con un Tabulador en donde\nACCESO A LA INFORMACIÓN Y PROTECCIÓN DE\nDATOS PERSONALES DEL ESTADO DE GUERRERO se establezcan con precisión los conceptos, montos y fundamentos de las mismas, que además sirva como base para los apercibimientos que realice el Instituto en este rubro, y los Sujetos Obligados tengan certeza disposiciones en materia de acceso a la información y protección de datos personales.\"\nEn virtud de las consideraciones expuestas, y con la finalidad de dar cumplimiento eficaz a las disposiciones establecidas en la Constitución Política de los Estados Unidos Mexicanos y la Constitución\nAcceso a la Información Pública del Estado de Guerrero, en materia de Transparencia, Acceso a la\nInformación y Protección de Datos Personales, el Pleno de este Instituto, emite el siguiente:\nÚnico. Se aprueba el Tabulador para la Imposición de Multas económicas por parte del Instituto de Transparencia, Acceso a la Información y Protección de Datos Personales del Estado de Guerrero, que a continuación se describe:\nCONCEPTO MONTO FUNDAMENTO\n1. Por no rendir los informes relativos a los Cien días de salario mínimo general Artículo 130 fracción II de la Ley Número 374\nRecursos de Revisión tramitados en el Instituto, vigente en la región que corresponda. de Transparencia y Acceso a la Información o presentarlos de manera extemporánea. Pública del Estado de Guerrero.\n2. Por la omisión de difundir la información Ciento cincuenta días de salario mínimo Artículo 13 y 7 fracción III de la Ley Número pública de oficio en los portales de internet general vigente en la región que 374 de Transparencia y Acceso a la oficiales de manera permanente y actualizada. corresponda. Información Pública del Estado de Guerrero.\n3. Por no rendir los Informes Anuales de Doscientos días de salario mínimo general Artículo 100 de la Ley Número 374 de\nSolicitudes de Información, o presentarlos de vigente en la región que corresponda. Transparencia y Acceso a la Información manera extemporánea. Pública del Estado de Guerrero.\n4. Por el incumplimiento a las resoluciones Doscientos días de salario mínimo general Artículo 144 de la Ley Número 374 de\nPública del Estado de Guerrero.\nTRANSITORIOS\nPrimero. El presente Acuerdo entrará en vigor al día siguiente de su aprobación\nGuerrero, en los estrados y en la página electrónica oficial del Instituto de Transparencia, Acceso a la\nInformación y Protección de Datos Personales del Estado de Guerrero.\nACCESO A LA INFORMACIÓN Y PROTECCIÓN DE\nDATOS PERSONALES DEL ESTADO DE GUERRERO\nTercero. Realícense las gestiones necesarias para dar cumplimento al contenido de este acuerdo.\nAsí lo acordó por unanimidad, el pleno del Instituto de Transparencia, Acceso a la Información y\nProtección de Datos Personales del Estado de Guerrero, en sesión ordinaria de fecha catorce de abril del año dos mil quince, por ante el Secretario Ejecutivo que da fe.\nC. Roberto Rodríguez Saldaña.\nConsejero Presidente.\nRúbrica.\nC. Crescencio Almazán Tolentino.\nConsejero.\nRúbrica.\nC. Joaquín Morales Sánchez.\nConsejero.\nRúbrica.\nC. Rene Pérez Alcaraz.\nSecretario Ejecutivo.\nRúbrica.\nSe publicó el correspondiente acuerdo el día 14 de abril de 2015.\nEL SUSCRITO LICENCIADO FELIPE REYES NÁJERA, SECRETARIO DE ACUERDOS DEL\nINSTITUTO DE TRANSPARENCIA, ACCESO A LA INFORMACIÓN Y PROTECCIÓN DE DATOS\nPERSONALES DEL ESTADO DE GUERRERO\nQUE LAS PRESENTES COPIAS FOTOSTÁTICAS COMPUESTAS DE DOS FOJAS ÚTILES,\nTRANSPARENCIA, ACCESO A LA INFORMACIÓN Y PROTECCIÓN DE DATOS PERSONALES DEL\nESTADO DE GUERRERO; MISMAS QUE VAN DEBIDAMENTE SELLADAS Y COTEJADAS.\nCERTIFICÁNDOSE EN LA CIUDAD DE CHILPANCINGO DE LOS BRAVO, GUERRERO, A LOS\nVEINTITRES DÍAS DEL MES DE ABRIL DEL AÑO DOS MIL QUINCE.- DOY FE.\nRúbrica.",
  "ordenamiento": "ACUERDO",
  "jurisdiccion": "GUERRERO",
  "fuente_oficial": "DIARIO OFICIAL DE LA FEDERACION",
  "Fecha de Publicación": "03 de Julio \nde 2015",
  "ULTIMA REFORMA PUBLICADA": null,
  "status": "VIGENTE",
  "es_escaneado": false,
  "tiene_tablas": true,
  "materia": [
    "cultura",
    "económico"
  ]
}