{
  "titulo": "Acuerdo por el Que Se Da A Conocer, el Calendario de Entrega y Monto Estimado de los Recursos Que Re",
  "Contenido": "ESTADO DE GUERRERO, DEL FONDO COMÚN DE\nPARTICIPACIONES, DEL FONDO DE FOMENTO\nMUNICIPAL, DEL FONDO PARA LA INFRAESTRUCTURA A\nMUNICIPIOS Y DEL FONDO DE APORTACIONES\nESTATALES PARA LA INFRAESTRUCTURA SOCIAL\nMUNICIPAL, PARA EL EJERCICIO FISCAL 2012\nABROGADO TÁCITAMENTE EL 31 DE DICIEMBRE DE 2012.\nTEXTO ORIGINAL\nAcuerdo publicado en el Periódico Oficial del Gobierno del Estado No. 11 Alcance I, el Martes 07 de Febrero de 2012.\nACUERDO POR EL QUE SE DA A CONOCER, EL CALENDARIO DE ENTREGA Y MONTO\nESTIMADO DE LOS RECURSOS QUE RECIBIRÁN LOS MUNICIPIOS DEL ESTADO DE GUERRERO,\nDEL FONDO COMÚN DE PARTICIPACIONES, DEL FONDO DE FOMENTO MUNICIPAL, DEL FONDO\nPARA LA INFRAESTRUCTURA A MUNICIPIOS Y DEL FONDO DE APORTACIONES ESTATALES\nPARA LA INFRAESTRUCTURA SOCIAL MUÑICIPAL, PARA EL EJERCICIO FISCAL 2012.\nGuerrero.- Poder Ejecutivo.\nANGEL HELADIO AGUIRRE RIVERO, GOBERNADOR CONSTITUCIONAL DEL ESTADO\nORGÁNICA DE LA ADMINISTRACIÓN PÚBLICA DEL ESTADO DE GUERRERO; 21 PÁRRAFO\nSEGUNDO Y 22 DEL DECRETO 981 DEL PRESUPUESTO DE EGRESOS DEL ESTADO DE\nGUERRERO PARA EL EJERCICIO FISCAL 2012 Y 26, 27, FRACCIONES I, II, III, IV, V, VI, VII Y VIII, 28\nFRACCIONES I Y II, 29, 30, 31 INCISO A Y B, 32, 33, 34 Y 48 DE LA LEY NUMERO 427 DEL SISTEMA\nDE COORDINACIÓN HACENDARIA DEL ESTADO DE GUERRERO, Y\nCONSIDERANDO\nQue la Ley de Coordinación Fiscal tiene por objeto coordinar el Sistema Fiscal de la Federación con los Estados, Municipios y Distrito Federal, establecer la participación que corresponda a sus haciendas públicas en los ingresos federales y distribuir entre ellos dichas participaciones.\nQue las participaciones asignadas al Estado de Guerrero para el Ejercicio Fiscal 2012, deben ser\nFiscal y de acuerdo a los criterios y fórmulas que se establecen en la Ley número 427 del Sistema de\nCoordinación Hacendaría del Estado de Guerrero.\nQue la Ley de Coordinación Fiscal en el Capítulo I, artículo 6° último párrafo, establece que: \"Los\nGobiernos de las Entidades, quince días después de que la Secretaría de Hacienda y Crédito Público utilizadas, así como el monto, estimados, a que está obligada conforme al primer párrafo del artículo 3°de\nESTADO DE GUERRERO, DEL FONDO COMÚN DE\nPARTICIPACIONES, DEL FONDO DE FOMENTO\nMUNICIPAL, DEL FONDO PARA LA INFRAESTRUCTURA A\nMUNICIPIOS Y DEL FONDO DE APORTACIONES\nESTATALES PARA LA INFRAESTRUCTURA SOCIAL\nMUNICIPAL, PARA EL EJERCICIO FISCAL 2012\nLey en cita, deberán publicar en el Periódico Oficial de la Entidad los mismos datos antes referidos, de las participaciones que las Entidades reciban y de las que tengan obligación de participar a sus municipios o\nDemarcaciones Territoriales\".\nPor lo anteriormente expuesto y fundado, he tenido a bien expedir el siguiente:\nACUERDO POR EL QUE SE DA A CONOCER, EL CALENDARIO DE ENTREGA Y MONTO\nESTIMADO DE LOS RECURSOS QUE RECIBIRÁN LOS MUNICIPIOS DEL ESTADO DE GUERRERO,\nDEL FONDO COMÚN DE PARTICIPACIONES, DEL FONDO DE FOMENTO MUNICIPAL, DEL FONDO\nPARA LA INFRAESTRUCTURA A MUNICIPIOS Y DEL FONDO DE APORTACIONES ESTATALES\nPARA LA INFRAESTRUCTURA SOCIAL MUNICIPAL, PARA EL EJERCICIO FISCAL 2012.\nARTÍCULO PRIMERO.- El presente Acuerdo tiene por objeto dar a conocer la fórmula, la metodología y los fondos previstos para distribuir entre los Municipios, las participaciones federales que el\nGobierno del Estado de Guerrero tiene la obligación de compartirles para el actual ejercicio fiscal, así como la estimación de los montos que recibirá cada municipio.\nARTÍCULO SEGUNDO.- El monto de las participaciones federales, que el Gobierno del Estado debe entregar a los Municipios, de conformidad con lo previsto por el artículo 27 de la Ley número 427 del Sistema de Coordinación Hacendaría del Estado de Guerrero, se distribuirá en la proporción y conceptos siguientes:\nI.- 20% de los ingresos que perciba el Estado, provenientes del Fondo General de\nParticipaciones.\nII.- 100% de los ingresos que perciba el Estado, correspondientes al Fondo de Fomento\nMunicipal.\nIII.- 20% de los ingresos que correspondan al Estado, derivado de participaciones en el Impuesto\nFederal Sobre Tenencia o Uso de Vehículos.\nIV.- 20% de los ingresos que perciba el Estado, por concepto de participación de la recaudación del Impuesto Especial Sobre la Producción y Servicios, en los términos del artículo 3°-A de la Ley de\nCoordinación Fiscal.\nV.- 20% de los ingresos que correspondan al Estado, derivado de participaciones en el Impuesto\nFederal Sobre Automóviles Nuevos.\nESTADO DE GUERRERO, DEL FONDO COMÚN DE\nPARTICIPACIONES, DEL FONDO DE FOMENTO\nMUNICIPAL, DEL FONDO PARA LA INFRAESTRUCTURA A\nMUNICIPIOS Y DEL FONDO DE APORTACIONES\nESTATALES PARA LA INFRAESTRUCTURA SOCIAL\nMUNICIPAL, PARA EL EJERCICIO FISCAL 2012\nVI.- 20% del Fondo de Fiscalización.\nVII.- 20% del Fondo de Compensación del Impuesto Sobre Automóviles Nuevos.\nVIII.- El 20% del Fondo de Compensación y de la Recaudación Estatal de las Cuotas a la Venta\nFinal de Gasolina y Diesel, de conformidad con lo previsto en el artículo 30 de la Ley número 427 del\nSistema de Coordinación Hacendaria del Estado de Guerrero.\nIX.- El 30% del Fondo de Compensación y la de la Recaudación Estatal de las Cuotas a la Venta\nFinal de Gasolinas y Diesel, a que se refiere el artículo 48 de la Ley número 427 del Sistema de\nCoordinación Hacendaría del Estado de Guerrero.\nARTÍCULO TERCERO.- Con las proporciones correspondientes al Fondo General de\nParticipaciones, al Impuesto sobre Tenencia o Uso de Vehículos, al Impuesto Especial Sobre Producción y Servicios, del Impuesto Federal Sobre Automóviles Nuevos, el Fondo de Compensación del Impuesto\nSobre Automóviles Nuevos, el Fondo de Fiscalización, se constituye un Fondo Común de Participaciones a Municipios.\nARTÍCULO CUARTO.- El Fondo Común de Participaciones a Municipios se distribuirá conforme a la fórmula siguiente:\nDonde:\nP es la participación del fondo común del Municipio i en el año t. i,t\nP es la participación del fondo común que el Municipio i recibió en el año 2007. i,07\n∆FC es el crecimiento en el Fondo Común de Participaciones entre el año 2007 y el año t.\n07,t\nESTADO DE GUERRERO, DEL FONDO COMÚN DE\nPARTICIPACIONES, DEL FONDO DE FOMENTO\nMUNICIPAL, DEL FONDO PARA LA INFRAESTRUCTURA A\nMUNICIPIOS Y DEL FONDO DE APORTACIONES\nESTATALES PARA LA INFRAESTRUCTURA SOCIAL\nMUNICIPAL, PARA EL EJERCICIO FISCAL 2012\nC1 es el ingreso propio del iésimo Municipio ponderado por su población dividido por su suma de lo que i,t resulte de cada uno de ellos;\nC2 es la población del iésimo Municipio dividido entre la suma de todos ellos. i,t\nC3 son los ingresos propios per cápita del iésimo Municipio dividido por su suma. i,t\nY = es la información relativa a los ingresos propios del Municipio i en el año t-1 contenida en la última i,t-1 cuenta pública. α= es la última información oficial de población que hubiere dado a conocer el Instituto Nacional de\nEstadística, Geografía e Informática para el municipio i.\n∑ es la suma sobre todos los Municipios de la variable que le sigue.\nLa conformación de la fórmula de distribución de participaciones a Municipios, está integrada conforme a los porcentajes siguientes: Garantía de Participaciones transferidas en el Ejercicio Fiscal\n2007 y sobre el excedente: 60% índice poblacional, 30% ingresos propios per cápita y 10% ingresos propios ponderados por población.\nLa fórmula anterior no será aplicable en el evento de que en el año de cálculo la recaudación federal participable sea menor a la observada en el año 2007. En dicho supuesto la distribución se realizará en función de la cantidad efectivamente generada en el año del cálculo y de acuerdo al coeficiente que cada municipio haya recibido de dicho fondo en el año 2007.\nFormará parte de la distribución de este fondo, el 20% de los recursos que del Fondo de\nFiscalización corresponda al Estado, el cual deberá entregarse a los municipios en forma trimestral de acuerdo a la disposición de la Ley de Coordinación Fiscal.\nARTÍCULO QUINTO.- La Secretaría de Hacienda y Crédito Público, el miércoles 28 de ministración durante el Ejercicio Fiscal 2012, de los recursos correspondientes al Ramo 28 de\nParticipaciones Federales.\nCorrespondiéndole al Estado de Guerrero las siguientes cantidades: $147,161,111.00 (Ciento cuarenta y siete millones ciento sesenta y un mil ciento once pesos, cero centavos), de Impuestos\nESTADO DE GUERRERO, DEL FONDO COMÚN DE\nPARTICIPACIONES, DEL FONDO DE FOMENTO\nMUNICIPAL, DEL FONDO PARA LA INFRAESTRUCTURA A\nMUNICIPIOS Y DEL FONDO DE APORTACIONES\nESTATALES PARA LA INFRAESTRUCTURA SOCIAL\nMUNICIPAL, PARA EL EJERCICIO FISCAL 2012\nEspeciales Sobre Producción y Servicios, $16,997,206.00 (Dieciséis millones novecientos noventa y siete mil doscientos seis pesos, cero centavos), del Fondo de Compensación de Impuestos Sobre Automóviles\nNuevos, $510,733,741.00 (Quinientos diez millones setecientos treinta y tres mil setecientos cuarenta y un pesos, cero centavos), del Fondo de compensación de las cuotas a la venta final de Gasolina y Diesel y $460,956,676.00 (Cuatrocientos sesenta millones novecientos cincuenta y seis mil seiscientos setenta y seis pesos, cero centavos), del Fondo de Fiscalización, de dichos montos, el Gobierno del Estado tiene la obligación de entregar a sus municipios el 20%.\nLa distribución por fondo que reciba el Estado de la cual transferirá el porcentaje correspondiente a los Municipios, fueron determinados por la Secretaría de Hacienda y Crédito Público, con base a los coeficientes obtenidos con las fórmulas establecidas en la Ley de Coordinación Fiscal. Estos coeficientes serán modificados en junio de 2012, una vez que se cuente con la información correspondiente, y serán aplicables desde enero del presente ejercicio fiscal.\nARTÍCULO SEXTO.- La Secretaría de Hacienda y Crédito Público, el martes 31 de enero del año en curso, publicó en el Diario Oficial de la Federación, el Acuerdo mediante el cual da a conocer el calendario de entrega, porcentaje y monto estimado, que recibirá cada Entidad Federativa por el Fondo\nGeneral de Participaciones y por el Fondo de Fomento Municipal durante el Ejercicio Fiscal 2012.\nCorrespondiéndole al Estado de Guerrero las siguientes cantidades: $9,701,667,391.00 (Nueve mil setecientos un millones seiscientos sesenta y siete mil trescientos noventa y un pesos, cero centavos), del Fondo General de Participaciones, $328,526,379.00 (Trescientos veintiocho millones quinientos veintiséis mil trescientos setenta y nueve pesos, cero centavos) del Fondo de Fomento\nMunicipal; de dichos montos, el Gobierno del Estado tiene la obligación de entregar a sus Municipios el\n20% del primer fondo y el 100% del segundo.\nARTÍCULO SÉPTIMO.- La Secretaría de Finanzas y Administración el viernes 30 de diciembre del Estado de Guerrero, para el ejercicio Fiscal 2012, en la cual da a conocer los montos estimados de los ingresos por concepto del Impuesto Sobre Tenencia o Uso de Vehículos, del Impuesto Sobre\nAutomóviles Nuevos y la Recaudación Estatal de las Cuotas a la Venta Final de Gasolina y Diesel.\nSiendo los montos estimados los siguientes: $150,907,500.00 (Ciento cincuenta millones novecientos siete mil quinientos pesos, cero centavos) del Impuesto sobre Tenencia o Uso de Vehículos\n$39,793,600.00 (Treinta y nueve millones setecientos noventa y tres mil seiscientos pesos, cero centavos) del Impuesto Sobre Automóviles Nuevos y $295,292,700.00 (Doscientos noventa y cinco millones doscientos noventa y dos mil setecientos pesos, cero centavos) de la Recaudación Estatal de las\nESTADO DE GUERRERO, DEL FONDO COMÚN DE\nPARTICIPACIONES, DEL FONDO DE FOMENTO\nMUNICIPAL, DEL FONDO PARA LA INFRAESTRUCTURA A\nMUNICIPIOS Y DEL FONDO DE APORTACIONES\nESTATALES PARA LA INFRAESTRUCTURA SOCIAL\nMUNICIPAL, PARA EL EJERCICIO FISCAL 2012\nCuotas a la Venta Final de Gasolina y Diesel, de dichos montos, el Gobierno del Estado tiene la obligación de entregar a sus Municipios el 20%.\nARTÍCULO OCTAVO.- La información utilizada en la aplicación de las fórmulas establecidas para la distribución tanto del Fondo Común de Participaciones, del Fondo de Fomento Municipal, Fondo para la Infraestructura a Municipios y el Fondo de Aportaciones Estatales para la Infraestructura Social\nMunicipal, entre los municipios, es la siguiente:\nMUNICIPIOS VARIABLES\nPOB. 2010(1 ING. PROP. 2010(2\nTOTAL 3,388,768 1,161,086,448.71\n001 ACAPULCO DE JUAREZ 789,971 714,329,242.56\n002 ACATEPEC 32,792 433,758.48\n003 AHUACUOTZINGO 25,027 536,191.41\n004 AJUCHITLAN DEL PROGRESO 38,203 931,944.97\n005 ALCOZAUCA DE GUERRERO 18,971 751,865.92\n006 ALPOYECA 6,637 436,194.53\n007 APAXTLA 12,389 695,428.09\n008 ARCELIA 32,181 6,080,718.79\n009 ATENANGO DEL RIO 8,390 652,270.31\n010 ATLAMAJALCINGO DEL MONTE 5,706 96,022.62\n011 ATLIXTAC 26,341 488,750.91\n012 ATOYAC DE ALVAREZ 61,316 9,273,954.72\n013 AYUTLA DE LOS LIBRES 62,690 2,589,510.87\n014 AZOYU 14,429 390,646.31\n015 BENITO JUAREZ 15,019 2,082,901.93\n016 BUENAVISTA DE CUELLAR 12,688 3,326,431.93\n017 CHILAPA DE ALVAREZ 120,790 9,686,200.05\n018 CHILPANCINGO DE LOS BRAVO 241,717 59,224,041.39\n019 COAHUAYUTLA DE J. MA. IZAZAGA 13,025 189,080.23\n020 COCHOAPA EL GRANDE 18,778 138,311.30\n021 COCULA 14,707 1,407,040.98\n022 COPALA 13,636 1,465,758.13\nESTADO DE GUERRERO, DEL FONDO COMÚN DE\nPARTICIPACIONES, DEL FONDO DE FOMENTO\nMUNICIPAL, DEL FONDO PARA LA INFRAESTRUCTURA A\nMUNICIPIOS Y DEL FONDO DE APORTACIONES\nESTATALES PARA LA INFRAESTRUCTURA SOCIAL\nMUNICIPAL, PARA EL EJERCICIO FISCAL 2012\n023 COPALILLO 14,456 99,106.33\n024 COPANATOYAC 18,855 145,031.14\n025 COYUCA DE BENITEZ 73,460 6,825,466.53\n026 COYUCA DE CATALAN.42,069 2,486,577.88\n027 CUAJINICUILAPA 25,922 2,864,495.15\n028 CUALAC 7,007 500,742.92\n029 CUAUTEPEC 15,115 5,575.00\n030 CUETZALA DEL PROGRESO 9,166 363,947.10\n031 CUTZAMALA DE PINZON 21,388 717,364.36\n032 EDUARDO NERI 46,158 3,553,297.07\n033 FLORENCIO VILLARREAL 20,175 1,344,215.48\n034 GENERAL CANUTO A. NERI 6,301 176,230.41\n035 GENERAL HELIODORO CASTILLO 36,586 1,424,937.35\n036 HUAMUXTITLAN 14,393 2,297,620.59\n037 HUITZUCO DE LOS FIGUEROA 37,364 5,957,025.39\n038 IGUALA DE LA INDEPENDENCIA 140,363 55,033,197.19\n039 IGUALAPA 10,815 986.00\n040 ILIATENCO 10,522 454,087.20\n041 IXCATEOPAN DE CUAUHTEMOC 6,603 427,161.37\n042 JOSE JOAQUIN DE HERRERA 15,678 99,250.00\n043 JUAN R. ESCUDERO 24,364 1,908,062.63\n044 JUCHITAN 7,166 0.00\n045 LEONARDO BRAVO 24,720 534,849.81\n046 MALINALTEPEC 29,599 351,818.86\n047 MARQUELIA 12,912 743,621.11\n048 MARTIR DE CUILAPAN 17,702 545,292.56\n049 METLATONOC 18,976 186,227.66\n050 MOCHITLAN 11,376 1,050,273.97\n051 OLINALA 24,723 1,526,210.83\n052 OMETEPEC 61,306 6,458,996.68\n053 PEDRO ASCENCIO ALQUISIRAS 6,978 295,026.96\n054 PETATLAN 44,979 9,800,124.31\nESTADO DE GUERRERO, DEL FONDO COMÚN DE\nPARTICIPACIONES, DEL FONDO DE FOMENTO\nMUNICIPAL, DEL FONDO PARA LA INFRAESTRUCTURA A\nMUNICIPIOS Y DEL FONDO DE APORTACIONES\nESTATALES PARA LA INFRAESTRUCTURA SOCIAL\nMUNICIPAL, PARA EL EJERCICIO FISCAL 2012\n055 PILCAYA 11,558 8,317,083.18\n056 PUNGARABATO 37,035 12,904,744.51\n057 QUECHULTENANGO 34,728 1,477,736.00\n058 SAN LUIS ACATLAN 42,360 1,521,136.08\n059 SAN MARCOS 48,501 5,432,925.02\n060 SAN MIGUEL TOTOLAPAN 28,009 639,209.67\n061 TAXCO DEALARCON 104,053 20,886,660.60\n062 TECOANAPA 44,079 594,689.39\n063 TECPAN DE GALEANA 62,071 7,033,440.80\n064 TELOLOAPAN 53,769 5,845,392.69\n065 TEPECOACUILCO DE TRUJANO 30,470 1,636,620.21\n066 TETIPAC 13,128 1,321,293.12\n067 TIXTLA DE GUERRERO 40,058 4,650,124.79\n068 TLACOACHISTLAHUACA 21,306 0.00\n069 TLACOAPA 9,967 151,037.73\n070 TLALCHAPA 11,495 617,589.62\n071 TLALIXTAQUILLA DE MALDONADO 7,096 625,506.16\n072 TLAPA DE COMONFORT 81,419 6,864,201.71\n073 TLAPEHUALA 21,819 733,921.64\n074 UNION DE I. MONTES DE OCA, LA 25,712 8,042,702.27\n075 XALPATLAHUAC 12,240 194,284.77\n076 XOCHIHUEHUETLAN 7,079 692,141.81\n077 XOCHISTLAHUACA 28,089 0.00\n078 ZAPOTITLAN TABLAS 10,516 9,306.29\n079 ZIHUATANEJO DE AZUETA 118,211 145,400,652.44\n080 ZIRANDARO 18,813 1,002,516.75\n081 ZITLALA 22,587 1,108,445.19\n1 FUENTE: Censo de población y vivienda 2010, para el Estado de Guerrero, publicado el 07 de julio del 2011, por el Instituto Nacional de Estadística, Geografía e Informática (INEGI). los conceptos de Impuestos, Derechos, Contribuciones Especiales, Productos y Aprovechamientos durante el\nEjercicio Fiscal 2010.\nESTADO DE GUERRERO, DEL FONDO COMÚN DE\nPARTICIPACIONES, DEL FONDO DE FOMENTO\nMUNICIPAL, DEL FONDO PARA LA INFRAESTRUCTURA A\nMUNICIPIOS Y DEL FONDO DE APORTACIONES\nESTATALES PARA LA INFRAESTRUCTURA SOCIAL\nMUNICIPAL, PARA EL EJERCICIO FISCAL 2012\nARTÍCULO NOVENO.- El monto estimado del Fondo Común es de: $2,103,496,696.80 (Dos mil ciento tres millones cuatrocientos noventa y seis mil seiscientos noventa y seis pesos, ochenta centavos), el cual se distribuye de acuerdo a lo establecido en el Artículo Cuarto del presente Acuerdo, obteniéndose las asignaciones siguientes:\nTOTAL\nMUNICIPIO\nFONDO COMUN\nSUMA 2,103,496,696.80\n001 ACAPULCO DE JUAREZ 518,760,872.48\n002 ACATEPEC 15,588,560.45\n003 AHUACUOTZINGO 12,249,727.82\n004 AJUCHITLAN DEL PROGRESO 23,115,311.65\n005 ALCOZAUCA DE GUERRERO 10,483,323.32\n006 ALPOYECA 5,377,165.30\n007 APAXTLA 8,821,90641\n008 ARCELIA 23,661,366.39\n009 ATENANGO DEL RIO 6,964,860.71\n010 ATLAMAJALCINGO DEL MONTE 3,426,128.69\n011 ATLIXTAC 13,227,032.19\n012 ATOYAC DE ALVAREZ 38,833,942.45\n013 AYUTLA DE LOS LIBRES 33,265,422.99\n014 AZOYU 9,099,543.96\n015 BENITO JUAREZ 12,553,562.59\n016 BUENAVISTA DE CUELLAR 14,597,469.61\n017 CHILAPA DE ALVAREZ 56.789,223.73\n018 CHILPANCINGO DE LOS BRAVO 124,110,462.15\n019 COAHUAYUTLA DE J. MA. IZAZAGA 8,411,126.06\n020 COCHOAPA EL GRANDE 8,378,954.09\n021 COCULA 11,385,599.11\n022 COPALA 10,457,326.33\n023 COPALILLO 7,508,017.83\n024 COPANATOYAC 9,506,859.61\n025 COYUCA DE BENITEZ 42,006,247.72\n026 COYUCA DE CATALAN 26,449,828.41\nESTADO DE GUERRERO, DEL FONDO COMÚN DE\nPARTICIPACIONES, DEL FONDO DE FOMENTO\nMUNICIPAL, DEL FONDO PARA LA INFRAESTRUCTURA A\nMUNICIPIOS Y DEL FONDO DE APORTACIONES\nESTATALES PARA LA INFRAESTRUCTURA SOCIAL\nMUNICIPAL, PARA EL EJERCICIO FISCAL 2012\n027 CUAJINICUILAPA 17,241,263.91\n028 CUALAC 5,782,877.25\n029 CUAUTEPEC 8,489,212.23\n030 CUETZALA DEL PROGRESO 6,558,646.05\n031 CUTZAMALA DE PINZON 14,748,835.90\n032 EDUARDO NERI 25,572,621.14\n033 FLORENCIO VILLARREAL 12,761,595.82\n034 GENERAL CANUTO A. NERI 4.853,429.55\n035 GENERAL HELIODORO CASTILLO 20,947,577.46\n036 HUAMUXTITLAN 12,621,219.35\n037 HUITZUCO DE LOS FIGUEROA 24,821,493.96\n038 IGUALA DE LA INDEPENDENCIA 84,061,715.44\n039 IGUALAPA 5,807,323.63\n040 ILIATENCO 8,056,893.83\n041 IXCATEOPAN DE CUAUHTEMOC 5,767,711.35\n042 JOSE JOAQUIN DE HERRERA 8,488,593.92\n043 JUAN R. ESCUDERO 15,343,504.37\n044 JUCHITAN 3,780,885.76\n045 LEONARDO BRAVO 13,713,289.60\n046 MALINALTEPEC 14,372,906.20\n047 MARQUELIA 8,109,410.31\n048 MARTIR DE CUILAPAN 9,202,330.60\n049 METLATONOC 10,084,609.27\n050 MOCHITLAN 8,513,005.68\n051 OLINALA 14,668,734.14\n052 OMETEPEC 32,823,977.64\n053 PEDRO ASCENCIO ALQUISIRAS 5,449,583.55\n054 PETATLAN 31,692,703.59\n055 PILCAYA 26,897,477.04\n056 PUNGARABATO 29,903,981.09\n057 QUECHULTENANGO 19,775,456.59\n058 SAN LUIS ACATLAN 21,937,720.13\n059 SAN MARCOS 30,078,104.92\n060 SAN MIGUEL TOTOLAPAN 16,519,300.79\n061 TAXCO DE ALARCON 62,786,848.04\nESTADO DE GUERRERO, DEL FONDO COMÚN DE\nPARTICIPACIONES, DEL FONDO DE FOMENTO\nMUNICIPAL, DEL FONDO PARA LA INFRAESTRUCTURA A\nMUNICIPIOS Y DEL FONDO DE APORTACIONES\nESTATALES PARA LA INFRAESTRUCTURA SOCIAL\nMUNICIPAL, PARA EL EJERCICIO FISCAL 2012\n062 TECOANAPA 24,697. 17.80\n063 TECPAN DE GALEANA 36,903,763.70\n064 TELOLOAPAN 33,301,518.09\n065 TEPECOACUILCO DE TRUJANO 18,727,440.48\n066 TETIPAC 10,319,020.98\n067 TIXTLA DE GUERRERO 23,150,566.08\n068 TLACOACHISTLAHUACA 9,595,975.32\n069 TLACOAPA 5,703,015.10\n070 TLALCHAPA 8,575,010.68\n071 TLALIXTAQUILLA DE MALDONADO 6,339,653.06\n072 TLAPA DE COMONFORT 38,249,862.30\n073 TLAPEHUALA 13,193,579.95\n074 UNION DE I. MONTES DE OCA, LA 24,079,593.18\n075 XALPATLAHUAC 7,091,761.34\n076 XOCHIHUEHUETLAN 7,091,776.64\n077 XOCHISTLAHUACA 13,522,132.12\n078 ZAPOTITLAN TABLAS 5,816,272.27\n079 ZIHUATANEJO DE AZUETA 94,459,641.11\n080 ZIRANDARO 13,482,456.22\n081 ZITLALA 11,931,148.23\nQue en el marco de la VII Reunión del Grupo de Trabajo de Comisión de Vigilancia y Distribución de Participaciones\", celebrada con fecha viernes 18 de enero del 2008, en la Ciudad Capital de\nChilpancingo, Guerrero, se presentó formalmente el nuevo esquema de la Distribución de las\nParticipaciones Federales a los Municipios que integran el Estado, que fue aprobado por unanimidad. impulsado en el seno de los trabajos del Sistema Estatal de Coordinación Fiscal, definió un conjunto de estrategias tendientes a fortalecer las haciendas públicas de sus Municipios, mediante un esfuerzo de la municipios, lo que se refleja en un firme propósito de otorgar anticipos a las participaciones que por concepto del Fondo General de Participaciones reciben los Municipios cada mes.\nQue en los trabajos de la XI Comisión Permanente de Funcionarios Fiscales, celebrada en el\nESTADO DE GUERRERO, DEL FONDO COMÚN DE\nPARTICIPACIONES, DEL FONDO DE FOMENTO\nMUNICIPAL, DEL FONDO PARA LA INFRAESTRUCTURA A\nMUNICIPIOS Y DEL FONDO DE APORTACIONES\nESTATALES PARA LA INFRAESTRUCTURA SOCIAL\nMUNICIPAL, PARA EL EJERCICIO FISCAL 2012 representación de los Municipios del Estado, aprobaron por unanimidad el nuevo esquema de\nDistribución del Fondo Común propuesto en esta reunión, el cual consiste en otorgar durante la primera quincena del mes correspondiente al entero de participaciones, un anticipo de hasta un 50% de la cantidad que por concepto del Fondo General de Participaciones recibieron en el mes inmediato anterior; sujeto a la disponibilidad financiera que por participaciones federales presente la Tesorería del Estado, dicho anticipo será compensado con los recursos correspondientes a los municipios que por participaciones federales recibe el Estado al final del mes, los cuales son transferidos a cada municipios que por participaciones federales recibe el Estado al final del mes, los cuales son transferidos a cada municipio en los términos que estipula el artículo 34 de la Ley Número 427 del Sistema de Coordinación\nHacendaría del Estado de Guerrero.\nARTÍCULO DÉCIMO.- El monto estimado de las participaciones que se liquiden a los Municipios del Fondo Común, así como los montos de los otros conceptos que se establecen en este Acuerdo, tendrán el carácter de provisionales y estarán sujetas al resultado de la recaudación de los conceptos participables, así como a la determinación definitiva mensual, a los ajustes cuatrimestrales y del ejercicio, que efectué la Federación para el Estado, motivo por el cual la estimación no significa compromiso de pago.\nSi como resultado de los ajustes mensuales, cuatrimestrales y del ejercicio que efectué la\nFederación para el Estado, surgieran diferencias a cargo de los municipios en relación con los pagos provisionales, el Estado, retendrá el importe pagado en exceso, en la liquidación provisional del mes siguiente y en caso contrario, realizará el entero correspondiente.\nARTÍCULO DÉCIMO PRIMERO.- El Fondo de Fomento Municipal se distribuye de acuerdo a los siguientes criterios:\na).- 40% en proporción directa a la captación de ingresos propios, aplicando la fórmula:\n(IPMI / ∑IPMI N) X 0.4 X FFM;\nDonde:\nIPMI = Ingresos propios del iesimo Municipio en el año inmediato anterior o la información disponible más reciente.\n∑lPMI\nESTADO DE GUERRERO, DEL FONDO COMÚN DE\nPARTICIPACIONES, DEL FONDO DE FOMENTO\nMUNICIPAL, DEL FONDO PARA LA INFRAESTRUCTURA A\nMUNICIPIOS Y DEL FONDO DE APORTACIONES\nESTATALES PARA LA INFRAESTRUCTURA SOCIAL\nMUNICIPAL, PARA EL EJERCICIO FISCAL 2012\nN= Sumatoria de los ingresos propios del iesimo hasta el enésimo Municipio del año inmediato anterior.\n0.4 = Porcentaje a distribuir del Fondo de Fomento Municipal.\nFFM = Monto en pesos del Fondo de Fomento Municipal.\nb).- 60% en proporción directa al número de habitantes de cada Municipio, aplicando la fórmula:\n(PMI / PE) X 0.6 X FFM\nDonde:\nPMI = Población del iesimo Municipio.\nPE = Población estatal.\n0.6 = Porcentaje a distribuir del Fondo de Fomento Municipal.\nFFM = Monto en pesos del Fondo de Fomento Municipal.\nARTÍCULO DÉCIMO SEGUNDO.- El Fondo de Fomento Municipal por la cantidad de\n$328,526,379.00 (Trescientos veintiocho millones quinientos veintiséis mil trescientos setenta y nueve pesos, cero centavos), se distribuye de acuerdo al Artículo Décimo Primero del presente Acuerdo, como sigue:\nMUNICIPIO FONDO DE FOMENTO\nMUNICIPAL\nSUMA 328,526,379.00\n001 ACAPULCO DE JUAREZ 126,7.97,597.79\n002 ACATEPEC 1,956,517.82\n003 AHUACUOTZINGO 1,516,440.97\n004 AJUCHITLAN DEL PROGRESO 2,327,645.86\nESTADO DE GUERRERO, DEL FONDO COMÚN DE\nPARTICIPACIONES, DEL FONDO DE FOMENTO\nMUNICIPAL, DEL FONDO PARA LA INFRAESTRUCTURA A\nMUNICIPIOS Y DEL FONDO DE APORTACIONES\nESTATALES PARA LA INFRAESTRUCTURA SOCIAL\nMUNICIPAL, PARA EL EJERCICIO FISCAL 2012\n005 ALCOZAUCA DE GUERRERO 1,188,589.06\n006 ALPOYECA 435,424.92\n007 APAXTLA 799,343.77\n008 ARCELIA 2,560,094.37\n009 ATENANGO DEL RIO 561,847.78\n010 ATLAMAJALCINGO DEL MONTE 342,770.95\n011 ATLIXTAC 1,587,503.85\n012 ATOYAC DE ALVAREZ 4,616,208.91\n013 AYUTLA DE LOS LIBRES 3,939,592.41\n014 AZOYU 883,510.26\n015 BENITO JUAREZ 1,109,356.71\n016 BUENAVISTA DE CUELLAR 1,114,509.97\n017 CHILAPA DE ALVAREZ 8,122,314.38\n018 CHILPANCINGO DE LOS BRAVO 20,762,964.73\n019 COAHUAYUTLA DE J. MA. IZAZAGA 779,030.33\n020 COCHOAPA EL GRANDE 1,107,921.37\n021 COCULA 1,014,715.48\n022 COPALA 959,063.77\n023 COPALILLO 852,084.74\n024 COPANATOYAC 1,113,160.71\n025 COYUCA DE BENITEZ 5,045,476.59\n026 COYUCA DE CATALAN 2,728,472.68\n027 CUAJINICUILAPA 1,832,015.85\n028 CUALAC 464,252.45\n029 CUAUTEPEC 879,831.09\n030 CUETZALA DEL PROGRESO 574,353.47\n031 CUTZAMALA DE PINZON 1,325,275.08\n032 EDUARDO NERI 3,087,049.37\n033 FLORENCIO VILLARREAL 1,325,664.06\n034 GENERAL CANUTO A. NERI 386,458.39\n035 GENERAL HELIODORO CASTILLO 2,289,385.35\nESTADO DE GUERRERO, DEL FONDO COMÚN DE\nPARTICIPACIONES, DEL FONDO DE FOMENTO\nMUNICIPAL, DEL FONDO PARA LA INFRAESTRUCTURA A\nMUNICIPIOS Y DEL FONDO DE APORTACIONES\nESTATALES PARA LA INFRAESTRUCTURA SOCIAL\nMUNICIPAL, PARA EL EJERCICIO FISCAL 2012\n036 HUAMUXTITLAN 1,097,245.58\n037 HUITZUCO DE LOS FIGUEROA 2,847,576.64\n038 IGUALA DE LA INDEPENDENCIA 14,393,150.66\n039 IGUALAPA 629,192.08\n040 ILIATENCO 663,431.75\n041 IXCATEOPAN DE CUAUHTEMOC 432,425.15\n042 JOSE JOAQUIN DE HERRERA 923,181.46\n043 JUAN R. ESCUDERO 1,633,143.07\n044 JUCHITAN 416,827.70\n045 LEONARDO BRAVO 1,498,431.81\n046 MALINALTEPEC 1,761,515.41\n047 MARQUELIA 835,219.84\n048 MARTIR DE CUILAPAN 1,091,394.86\n049 METLATONOC 1,124,861.51\n050 MOCHITLAN 780,581.30\n051 OLINALA 1,610,807.54\n052 OMETEPEC 4,297,033.05\n053 PEDRO ASCENCIO ALQUISIRAS 439,282.81\n054 PETATLAN 3,725,479.28\n055 PILCAYA 1,613,617.76\n056 PUNGARABATO 3.614,775.09\n057 QUECHULTENANGO 2,187,286.25\n058 SAN LUIS ACATLAN 2,636,131.80\n059 SAN MARCOS 3,436,069.88\n060 SAN MIGUEL TOTOLAPAN 1,701,555.73\n061 TAXCODEALARCON 8,416,423.02\n062 TECOANAPA 2,631,267.31\n063 TECPAN DE GALEANA 4,406,546.33\n064 TELOLOAPAN 3,789,178.58\n065 TEPECOACUILCO DE TRUJANO 1,957,591.78\n066 TETIPAC 913,164.37\nESTADO DE GUERRERO, DEL FONDO COMÚN DE\nPARTICIPACIONES, DEL FONDO DE FOMENTO\nMUNICIPAL, DEL FONDO PARA LA INFRAESTRUCTURA A\nMUNICIPIOS Y DEL FONDO DE APORTACIONES\nESTATALES PARA LA INFRAESTRUCTURA SOCIAL\nMUNICIPAL, PARA EL EJERCICIO FISCAL 2012\n067 TIXTLA DE GUERRERO 2,856,366.03\n068 TLACOACHISTLAHUACA 1,239,314.51\n069 TLACOAPA 596,848.66\n070 TLALCHAPA 738,532.56\n071 TLAUXTAQUILLA DE MALDONADO 483,550.09\n072 TLAPA DE COMONFORT i,512,814.89\n073 TLAPEHUALA 1,352,218.85\n074 UNION DE I. MONTES DE OCA, LA 2,405,864.71\n075 XALPATLAHUAC 733,957.83\n076 XOCHIHUEHUETLAN 490,102.88\n077 XOCHISTLAHUACA 1,633,864.18\n078 ZAPOTITLAN TABLAS 612,741.78\n079 ZIHUATANEJO DE AZUETA 23,332,320.58\n080 ZIRANDARO 1,207,767.11\n081 ZITLALA 1,439,279.65\nARTÍCULO DÉCIMO TERCERO.- Conforme a lo establecido en el Artículo 3° Primer Párrafo de la Ley de Coordinación Fiscal, el calendario de entrega a los municipios de las participaciones para el\nEjercicio Fiscal 2012 será:\nFondo General de Fondo de Fomento\nParticipaciones Municipal\n30/ENERO/2012 3/FEBRERO/2012\n29/FEBRERO/2012 5/MAR20/2012\n30/MARZO/2012 4/ABRIL/2012\n30/ABRIL/2012 4/MAYO/2012\n30/MAYC)/2012 5/JUNIO/2012\n29/JUNIO/2012 4/JULIO/2012\n30/JULIO/2012 3/AGOSTO/2012\n31/AGOSTO/2012 5/SEPTIEMBRE/2012\n28/SEPTIEMBRE/2012 3/OCTUBRE/2012\n30/OCTUBRE/2012 5/NOVIEMBRE/2012\nESTADO DE GUERRERO, DEL FONDO COMÚN DE\nPARTICIPACIONES, DEL FONDO DE FOMENTO\nMUNICIPAL, DEL FONDO PARA LA INFRAESTRUCTURA A\nMUNICIPIOS Y DEL FONDO DE APORTACIONES\nESTATALES PARA LA INFRAESTRUCTURA SOCIAL\nMUNICIPAL, PARA EL EJERCICIO FISCAL 2012\n30/NOVIEMBRE/2012 5/DICIEMBRE/2012\n31/DICIEMBRE/2012 ' 2/ENERO/2013\nARTÍCULO DECIMO CUARTO.- Con el propósito de impulsar a través de los planes de gobierno municipales el desarrollo de la infraestructura de los municipios y la conservación del medio ambienten en el Articulo 30 de la Ley 427 del Sistema de Coordinación Hacendaría del Estado de\nGuerrero, se crea el Fondo para la Infraestructura a Municipios, de conformidad con las reformas al artículo 4°-A de la Ley de Coordinación Fiscal, en las cuales se establece que las participaciones derivadas de la recaudación estatal de las Cuotas a la Venta Final de Gasolina y Diesel y del Fondo de\nCompensación de Gasolina y Diesel, los Municipios y Demarcaciones territoriales recibirán como mínimo el 20% de la recaudación que correspondan a las Entidades Federativas.\nLos Municipios, deberán de informar cada seis meses a la Secretaría de Finanzas y\nAdministración, para que ésta a su vez informe a la Secretaría de Hacienda y Crédito Público de la aplicación de los recursos que reciban del Fondo de Infraestructura Municipal, en los términos de lo dispuesto por el artículo 4°-A último párrafo de la Ley de Coordinación Fiscal.\nARTÍCULO DÉCIMO QUINTO.- El Fondo para la Infraestructura a Municipios, se distribuirá conforme a la fórmula siguiente:\nEn donde: i,t\nC, C son los coeficientes de distribución del Fondo de Infraestructura Municipal del Municipio i en el año en que se efectúa el cálculo.\nESTADO DE GUERRERO, DEL FONDO COMÚN DE\nPARTICIPACIONES, DEL FONDO DE FOMENTO\nMUNICIPAL, DEL FONDO PARA LA INFRAESTRUCTURA A\nMUNICIPIOS Y DEL FONDO DE APORTACIONES\nESTATALES PARA LA INFRAESTRUCTURA SOCIAL\nMUNICIPAL, PARA EL EJERCICIO FISCAL 2012 α es la última información de población del Municipio i dada a conocer por el INEGI.\nẞ es la recaudación per cápita de ingresos propios expresada en su forma inversa, a su vez ponderada por la población del Municipio i del año t-1.\n∑ es la sumatoria de la variable que le sigue.\nARTÍCULO DÉCIMO SEXTO.- El Fondo para la Infraestructura a Municipios se estima la cantidad de $161,205,288.20 (Ciento sesenta y un millones doscientos cinco mil doscientos ochenta y ocho pesos, veinte centavos), y se distribuye de acuerdo al Artículo Décimo Quinto del presente Acuerdo, como sigue:\nMUNICIPIO FONDO PARA LA\nINFRAESTRUCTURA A MUNICIPIOS\nSUMA 161,205,288.20\n001 ACAPULCO DE JUAREZ 56,058,754.47\n002 ACATEPEC 1,110,018.51\n003 AHUACUOTZINGO 855,715.71\n004 AJUCHITLAN DEL PROGRESO 1,310,951.71\n005 ALCOZAUCA DE GUERRERO 663.038.32\n006 ALPOYECA 239,176.09\n007 APAXTLA 441,511.30\n008 ARCELIA 1,324,879.85\n009 ATENANGO DEL RIO 306,549.75\n010 ATLAMAJALCINGO DEL MONTE 194,005.57\n011 ATLIXTAC 897.495.13\n012 ATOYAC DE ALVAREZ 2,428,060.51\n013 AYUTLA DE LOS LIBRES 2,195,393.24\n014 AZOYU 496,747.16\n015 BENITO JUAREZ 586,879.62\n016 BUENAVISTA DE CUELLAR 561,054.53\n017 CHILAPA DE ALVAREZ 4,425,675.66\n018 CHILPANCINGO DE LOS BRAVO 10,515,814.45\n019 COAHUAYUTLA DE J. MA. IZAZAGA 441,599.32\n020 COCHOAPA EL GRANDE 631,055.67\nESTADO DE GUERRERO, DEL FONDO COMÚN DE\nPARTICIPACIONES, DEL FONDO DE FOMENTO\nMUNICIPAL, DEL FONDO PARA LA INFRAESTRUCTURA A\nMUNICIPIOS Y DEL FONDO DE APORTACIONES\nESTATALES PARA LA INFRAESTRUCTURA SOCIAL\nMUNICIPAL, PARA EL EJERCICIO FISCAL 2012\n021 COCULA 548,339.30\n022 COPALA 515,121.50\n023 COPALILLO 485,503.09\n024 COPANATOYAC 633,899.66\n025 COYUCA DE BENITEZ 2,730,463.09\n026 COYUCA DE CATALAN 1,504,440.45\n027 CUAJINICUILAPA 982,497.23\n028 CUALAC 254,185.27\n029 CUAUTEPEC 503,551.64\n030 CUETZALA DEL PROGRESO 320,380.84\n031 CUTZAMALA DE PINZON 742,085.65\n032 EDUARDO NERI 1,685,032.45\n033 FLORENCIO VILLARREAL 727,803.19\n034 GENERAL CANUTO A. NERI 217,159.48\n035 GENERAL HELIODORO CASTILLO 1,277,640.73\n036 HUAMUXTITLAN 574,977.83\n037 HUITZUCO DE LOS FIGUEROA 1,492,318.30\n038 IGUALA DE LA INDEPENDENCIA 6,966,237.14\n039 IGUALAPA 360,173.24\n040 ILIATENCO 369,289.40\n041 IXCATEOPAN DE CUAUHTEMOC 237,667.54\n042 JOSE JOAQUIN DE HERRERA 526,200.82\n043 JUAN R. ESCUDERO 890,779.48\n044 JUCHITAN 238,623.00\n045 LEONARDO BRAVO 845,436.94\n046 MALINALTEPEC 1,000,280.75\n047 MARQUELIA 460,934.28\n048 MARTIR DE CUILAPAN 612,177.24\n049 METLATONOC 639,644.85\n050 MOCHITLAN 422,559.20\n051 OLI N ALA 886,829.14\n052 OMETEPEC 2,310,478.82\n053 PEDRO ASCENCIO ALQUISIRAS 244,651.11\n054 PETATLAN 1,905,965.43\n055 PILCAYA 731,296.83\nESTADO DE GUERRERO, DEL FONDO COMÚN DE\nPARTICIPACIONES, DEL FONDO DE FOMENTO\nMUNICIPAL, DEL FONDO PARA LA INFRAESTRUCTURA A\nMUNICIPIOS Y DEL FONDO DE APORTACIONES\nESTATALES PARA LA INFRAESTRUCTURA SOCIAL\nMUNICIPAL, PARA EL EJERCICIO FISCAL 2012\n056 PUNGARABAT0 1,770,749.17\n057 QUECHULTENANGO 1,217,969.79\n058 SAN LUIS ACATLAN 1,473,918.01\n059 SAN MARCOS 1,841,343.06\n060 SAN MIGUEL TOTOLAPAN 959,305.27\n061 TAXCO DE ALARCON 4,334,866.62\n062 TECOANAPA 1,492,571.07\n063 TECPAN DE GALEANA 2,359,879.70\n064 TELOLOAPAN 2,033,944.05\n065 TEPECOACUILCO DE TRUJANO 1,082,799.16\n066 TETIPAC 492,188.12\n067 TIXTLA DE GUERRERO 1,527,591.63\n068 TLACOACHISTLAHUACA 709,475.44\n069 TLACOAPA 338,185.48\n070 TLALCHAPA 408,499.68\n071 TLALIXTAQUILLA DE MALDONADO 262,345.65\n072 TLAPA DE COMONFORT 2,997,105.83\n073 TLAPEHUALA 757,127.40\n074 UNION DE I. MONTES DE OCA, LA 1,191,187.14\n075 XALPATLAHUAC 415,676.22\n076 XOCHIHUEHUETLAN 264,555.13\n077 XOCHISTLAHUACA 935,344.84\n078 ZAPOTITLAN TABLAS 350,563.31\n079 ZIHUATANEJO DE AZUETA 9,992,576.75\n080 ZIRANDARO 668.217.20\n081 ZITLALA 798,301.00\nARTÍCULO DÉCIMO SÉPTIMO.- Conforme a las disposiciones del Articulo 48 de la Ley No.\n427, del Sistema de coordinación Hacendaría del Estado de Guerrero, con el 30% del Fondo de refiere el Articulo 4°-A de la Ley de Coordinación Fiscal, se constituye el Fondo de Aportaciones Estatales para la Infraestructura Social Municipal, mismo que será distribuido en forma mensual. De los recursos que reciban los municipios por este Fondo, deberán destinarse prioritariamente a obras, programas y acciones de infraestructura vial, sea rural o urbana; infraestructura hidráulica; movilidad urbana; producción agrícola y por lo menos un 15% a programas de protección y conservación ambiental.\nESTADO DE GUERRERO, DEL FONDO COMÚN DE\nPARTICIPACIONES, DEL FONDO DE FOMENTO\nMUNICIPAL, DEL FONDO PARA LA INFRAESTRUCTURA A\nMUNICIPIOS Y DEL FONDO DE APORTACIONES\nESTATALES PARA LA INFRAESTRUCTURA SOCIAL\nMUNICIPAL, PARA EL EJERCICIO FISCAL 2012\nEl Fondo de Aportaciones Estatales para la Infraestructura Social Municipal, se distribuirá conforme a la fórmula siguiente:\nFAEIM,t = es la participación del Fondo de Aportaciones Estatales para la Infraestructura\nMunicipal del Municipio i en el año para el cual se efectúa el cálculo.\nC1,t, y C2,t son los coeficientes de distribución del Fondo de Aportaciones Estatales para la\nInfraestructura Social Municipal del Municipio i en el año en que se efectúa el cálculo. α = el número de habitantes del Municipio i.\nY,t = la información relativa a la recaudación de Ingresos propios del Municipio i en el año de cálculo contenida en la última cuenta pública.\n∑n = la suma sobre todos los Municipios de la variable que le sigue.\nARTÍCULO DÉCIMO OCTAVO.- El Fondo de Aportaciones Estatales para la Infraestructura\nSocial Municipal, se estima la cantidad de $241,807,932.30 (Doscientos cuarenta y un millones ochocientos siete mil novecientos treinta y dos pesos, treinta centavos), misma que se distribuye de acuerdo al artículo inmediato anterior del presente Acuerdo, como sigue:\nESTADO DE GUERRERO, DEL FONDO COMÚN DE\nPARTICIPACIONES, DEL FONDO DE FOMENTO\nMUNICIPAL, DEL FONDO PARA LA INFRAESTRUCTURA A\nMUNICIPIOS Y DEL FONDO DE APORTACIONES\nESTATALES PARA LA INFRAESTRUCTURA SOCIAL\nMUNICIPAL, PARA EL EJERCICIO FISCAL 2012\nMUNICIPIO FONDO DE APORTS. ESTATALES\nPARA LA INF. SOC. MPAL.\nSUMA 241,807,932.30\n001 ACAPULCO DE JUAREZ 46,905,588.88\n002 ACATEPEC 1,746,868.86\n003 AHUACUOTZINGO 1,426,524.62\n004 AJUCHITLAN DEL PROGRESO 2,109,113.59\n005 ALCOZAUCA DE GUERRERO 1,273,992.42\n006 ALPOYECA 872,791.22\n007 APAXTLA 1,081,123.99\n008 ARCELIA 3,163,620.81\n009 ATENANGO DEL RIO 1,059,365.63\n010 ATLAMAJALCINGO DEL MONTE 423,606.39\n011 ATLIXTAC 1,468,522.54\n012 ATOYAC DE ALVAREZ 4,308,347.06\n013 AYUTLA DE LOS LIBRES 3,471,501.31\n014 AZOYU 943,691.49\n015 BENITO JUAREZ 1,892,381.62\n016 BUENA VISTA DE CUELLAR 2,792,982.94\n017 CHILAPA DE ALVAREZ 6,693,782.80\n018 CHILPANCINGO DE LOS BRAVO 14,091,442.61\n019 COAHUAYUTLA DE J. MA. IZAZAGA 770,144.48\n020 COCHOAPA EL GRANDE 998,604.86\n021 COCULA 1,522,545.10\n022 COPALA 1,566,401.08\n023 COPALILLO 778,526.03\n024 COPANATOYAC 1,005,138.51\n025 COYUCA DE BENITEZ 4,434,488.10\n026 COYUCA DE CATALAN 2,588,107.30\n027 CUAJINICUILAPA 2,204,885.97\n028 CUALAC 938,559.84\n029 CUAUTEPEC 758,016.85\n030 CUETZALA DEL PROGRESO 784,850.51\n031 CUTZAMALA DE PINZON 1,344,546.89\nESTADO DE GUERRERO, DEL FONDO COMÚN DE\nPARTICIPACIONES, DEL FONDO DE FOMENTO\nMUNICIPAL, DEL FONDO PARA LA INFRAESTRUCTURA A\nMUNICIPIOS Y DEL FONDO DE APORTACIONES\nESTATALES PARA LA INFRAESTRUCTURA SOCIAL\nMUNICIPAL, PARA EL EJERCICIO FISCAL 2012\n032 EDUARDO NERI 2,939,558.44\n033 FLORENCIO VILLARREAL 1,556,463.74\n034 GENERAL CANUTO A. NERI 545,076.91\n035 GENERAL HELIODORO CASTILLO 2,148,204.26\n036 HUAMUXTITLAN 2,033,657.42\n037 HUITZUCO DE LOS FIGUEROA 3,179,369.28\n038 IGUALA DE LA INDEPENDENCIA 10,240,120.76\n039 IGUALAPA 540,949.25\n040 ILIATENCO 880,993.83\n041 IXCATEOPAN DE CUAUHTEMOC 862,613.04\n042 JOSE JOAQUIN DE HERRERA 835,238.21\n043 JUAN R. ESCUDERO 1,861,953.96\n044 JUCHITAN 357,934.50\n045 LEONARDO BRAVO 1,412,934.77\n046 MALINALTEPEC 1,576,334.06\n047 MARQUELIA 1,119,261.70\n048 MARTIR DE CUILAPAN 1,137,897.11\n049 METLATONOC 1,028,658.44\n050 MOCHITLAN 1,328,592.40\n051 OLINALA 1,743,313.80\n052 OMETEPEC 3,929,884.76\n053 PEDRO ASCENCIO ALOUISIRAS 696,756.50\n054 PETATLAN 4,041,121.73\n055 PILCAYA 6,503,858.38\n056 PUNGARABATO 4,719,653.65\n057 QUECHULTENANGO 2,085,082.23\n058 SAN LUIS ACATLAN 2,411,589.92\n059 SAN MARCOS 3,345,139.98\n060 SAN MIGUEL TOTOLAPAN 1,586,978.69\n061 TAXCO DE ALARCON 6,850,551.96\n062 TECOANAPA 2,312,816.46\n063 TECPAN DÉ GALEANA 4.033,622.30\n064 TELOLOAPAN 3,581,062.31\n065 TEPECOACUILCO DE TRUJANO 1,964,319.24\n066 TETIPAC 1,484,653,07\nESTADO DE GUERRERO, DEL FONDO COMÚN DE\nPARTICIPACIONES, DEL FONDO DE FOMENTO\nMUNICIPAL, DEL FONDO PARA LA INFRAESTRUCTURA A\nMUNICIPIOS Y DEL FONDO DE APORTACIONES\nESTATALES PARA LA INFRAESTRUCTURA SOCIAL\nMUNICIPAL, PARA EL EJERCICIO FISCAL 2012\n067 TIXTLA DE GUERRERO 2,956,924.84\n068 TLACOACHISTLAHUACA 1,064,213.15\n069 TLACOAPA 622,647.45\n070 TLALCHAPA 1,016,654.61\n071 TLALIXTAQUILLA DE MALDONADO 1,080,429.28\n072 TLAPA DE COMONFORT 4,761,145.96\n073 TLAPEHUALA 1,366,867.94\n074 UNION DE I. MONTES DE OCA, LA 3,860,488.55\n075 XALPATLAHUAC 742,104.43\n076 XOCHIHUEHUETLAN 1,158,849.77\n077 XOCHISTLAHUACA 1,403,017.26\n078 ZAPOTITLAN TABLAS 532,552.23\n079 ZIHUATANEJO DE AZUETA 16,034,811.13\n080 ZIRANDARO 1,378,571.69\n081 ZITLALA 1,532,372.65\nARTÍCULO ÚNICO.- Publíquese el presente Acuerdo en el Periódico Oficial del Gobierno del\nEstado.\nDado en la residencia oficial del Poder Ejecutivo del Estado, el día tres del mes febrero del año dos mil doce.\nEL GOBERNADOR CONSTITUCIONAL DEL ESTADO.\nLIC. ANGEL HELADIO AGUIRRE RIVERO.\nRúbrica.\nEL SECRETARIO GENERAL DE GOBIERNO.\nLIC. HUMBERTO SALGADO GOMEZ.\nRúbrica.\nEL SECRETARIO DE FINANZAS Y ADMINISTRACIÓN.\nC.P. JORGE SILVERIO SALGADO LEYVA.\nRúbrica.",
  "ordenamiento": "ACUERDO",
  "jurisdiccion": "GUERRERO",
  "fuente_oficial": "DIARIO OFICIAL DE LA FEDERACION",
  "Fecha de Publicación": "31 DE DICIEMBRE DE 2012",
  "ULTIMA REFORMA PUBLICADA": null,
  "status": "ABROGADA",
  "es_escaneado": false,
  "tiene_tablas": true,
  "materia": [
    "general"
  ]
}