{
  "titulo": "Acuerdo de la Comisión Ejecutiva del Sistema Estatal Anticorrupción de Guerrero, por el Que Se Estab",
  "Contenido": "Año CI Edición No. 37\nCONTENIDO\nDECRETO POR EL QUE SE REFORMAN Y\nADICIONAN DIVERSAS DISPOSICIONES DEL\nDE GUERRERO.\nACUERDO DE LA COMISIÓN EJECUTIVA DEL\nSISTEMA ESTATAL ANTICORRUPCIÓN DE\nGUERRERO, POR EL QUE SE ESTABLECE LA\nCELEBRACIÓN A TRAVÉS DE HERRAMIENTAS\nTECNOLÓGICAS, DE SESIONES VIRTUALES O A\nDISTANCIA, ORDINARIAS O EXTRAORDINARIAS,\nDE LA COMISIÓN EJECUTIVA DEL SISTEMA\nESTATAL ANTICORRUPCIÓN DE GUERRERO,\nDURANTE EL PERIODO DE MEDIDAS SANITARIAS\nDERIVADO DE LA EPIDEMIA DE ENFERMEDAD\nGENERADA POR EL VIRUS SARS-CoV2 6\n(COVID-19)..........................\nPrecio del ejemplar 18.40\nANTICORRUPCIÓN DE GUERRERO, POR EL QUE SE ESTABLECE LA\nCELEBRACIÓN A TRAVÉS DE HERRAMIENTAS TECNOLÓGICAS, DE SESIONES\nGUERRERO, DURANTE EL PERIODO DE MEDIDAS SANITARIAS DERIVADO DE\nLA EPIDEMIA DE ENFERMEDAD GENERADA POR EL VIRUS SARS-CoV2\n(COVID-19).\nANTECEDENTES\nI.- En diciembre del dos mil diecinueve, en la ciudad de Wuhan de la República Popular de China, inicio un brote de neumonía denominado COVID-19 (coronavirus) que se ha expandido, afectando diversos países, entre los que se encuentran México, ello conforme a la información oficial emitida por la\nOrganización Mundial de la Salud. Se ha dado a conocer que dicho virus, es una enfermedad infecciosa que pone en riesgo la salud y por consecuencia la integridad de la población en general, debido a su fácil propagación por contacto con personas infectadas por el virus o por tocar o bjetos o superficies que rodean a dichas personas y llevarse las manos a los ojos, nariz o boca.\nII.- Con fecha 11 de marzo de dos mil veinte, la Organización\nMundial de la Salud declaró pandemia el brote de COVID-19\n(coronavirus) en el mundo, esto en relación a la cantidad de casos de contagio y de países involucrados.\nIII.- Atendiendo las recomendaciones y con el fin de tomar medidas preventivas, con fecha 18 de marzo del presente año la\nEstatal Anticorrupción de Guerrero, con el fin de mitigar el riesgo de contagio entre el personal de la Secretaría, estableciéndose las guardias respectivas.\nIV.- Con fecha 23 de marzo del año en curso, se publicó en el enfermedad por el virus SARS-CoV2 (COVID-19) en México, como una enfermedad grave de atención prioritaria, estableciendo actividades de preparación y respuesta para esta epidemia.\nV.- El 24 de marzo de dos mil veinte, el Subsecretario de fase 2 originada por la pandemia COVID-19 (coronavirus) lo que implica que existe contagio local, muy contrario a la fase 1 que solo consistía únicamente en casos importados.\nVI.- Mediante decreto de fecha 27 de marzo del año en curso, declaración por parte del Titular del Poder Ejecutivo Federal, sobre las acciones extraordinarias en las regiones afectadas de todo el territorio nacional en materia de salubridad general, esto, para combatir la enfermedad grave de atención prioritaria generada por el virus SARS-CoV2 (COVID-19).\nVII.- Por su parte, mediante Acuerdo publicado el 30 de marzo de la presente anualidad en el Diario Oficial de la\nFederación, el Consejo de Salubridad General declaro emergencia sanitaria por causa de fuerza mayor, con motivo de la epidemia de enfermedad generada por el virus SARS-CoV2\n(COVID-19).\nVIII.- Seguidamente, con fecha 31 de marzo, se publicaron en el Diario Oficial de la Federación, las medidas determinadas por la Secretaría de Salud del Gobierno Federal, que como acción extraordinaria para atender la emergencia sanitaria generada por el virus SARS-CoV2 (COVID-19), deberán implementar los sectores público, social y privado; señalando el artículo primero del decreto como medidas necesarias:\nI. Se ordena la suspensión inmediata del 30 de marzo al\n30 de abril de 2020, de las actividades no esenciales, del virus SARS-CoV2 en la comunidad, para disminuir la carga de enfermedad, sus complicaciones y la muerte por\nCOVID-19 en la población residente en el territorio nacional;\n(...)\nIII. En todos los lugares y recintos en los que se realizan las actividades definidas como esenciales, se deberán observar, de manera obligatoria, las siguientes practicas:\na) No se podrá realizar reuniones o congregaciones de mas de 50 personas;\nIV. Se exhorta a toda la población residente en el territorio mexicano, incluida la que arribe al mismo actividades laborales esenciales, a cumplir resguardo domiciliario corresponsable del 30 de marzo al 30 de corresponsable a la limitación voluntaria de movilidad, permaneciendo en el domicilio particular o sitio distinto al espacio público, el mayor tiempo posible;\n(...)\nVI. Una vez terminado el periodo de vigencia de las medidas establecidas en el presente Acuerdo, la\nSecretaría de Salud, en coordinación con la Secretaría de Economía y la Secretaría del Trabajo y Previsión\nSocial, emitirán los lineamientos para un regreso, ordenado, escalonado y regionalizado a las actividades laborales, económicas y sociales de toda la población en México;\nIX. Dadas las circunstancias, el Titular del Poder Ejecutivo del Estado de Guerrero, con fecha 03 de abril del presente año a través del Periódico Oficial del Estado emitió el “Aviso por el que se da a conocer la declaratoria de emergencia sanitaria por causa de fuerza mayor del consejo estatal de salud, en cumplimiento con la emergencia sanitaria declarada por el consejo de salubridad general, para controlar, mitigar y evitar la propagación del covid-19”; mediante el cual da a conocer que el Estado de Guerrero se adhiere y acatará las acciones establecidas en la Declaratoria de Emergencia\nMéxico.\nFederación, el acuerdo de la Secretaría de Salud del Gobierno\nFederal, por el que se modifica el homónimo por el que se sanitaria generada por el virus SARS-CoV2, publicado el 31 de marzo del presente año; acuerdo que señala lo siguiente:\nArtículo Primero. - Se modifica la fracción I, del sanitaria generada por el virus SARS-CoV2, publicado en\n2020, para quedar como sigue:\n\"ARTÍCULO PRIMERO. [...]\nI. Se ordena la suspensión inmediata, del 30 de marzo al virus SARS-CoV2 en la comunidad, para disminuir la carga de enfermedad, sus complicaciones y la muerte por COVID19 en la población residente en el territorio nacional;\nII. a VIII. [...]\nXI. La Secretaría de Salud Federal, a través de la Dirección\nGeneral de Epidemiología emite el siguiente informe técnico referente a Coronavirus (COVID-19), y en la parte correspondiente a nuestra entidad encontramos lo siguiente: o En el país, hasta el día 28 de abril, se han registrado 16,752 casos positivos y 1569 defunciones por COVID-19. o En el Estado de Guerrero, hasta la fecha se tienen registrados 441 casos positivos, 749 negativos, 323 casos sospechosos y 59 defunciones.\nCONSIDERANDOS\n1. En este sentido constituyen un hecho público y notorio los llamados que, diferentes instituciones del Gobierno Federal y\nEstatal vienen haciendo a la población en general, a fin de robustecer las medidas de prevención, que incluso han implicado la suspensión de clases, suspensión temporal de personas, disminuir drásticamente la movilidad de personas, suspensión de actividades gubernamentales no esenciales, así como una invitación clara a quedarse, de ser posible, en casa, a fin de mitigar y evitar el contagio y dispersión del virus.\n2. Ante tales condiciones, se hace necesario implementar la Secretaría, como por las autoridades sanitarias tendentes a quienes integran la Secretaría Ejecutiva Anticorrupción, de sus familias, de quien tiene relación con este organismo, y en general con la sociedad, y al mismo tiempo, dar continuidad a\nComisión Ejecutiva.\n3. De conformidad con el artículo 1º de la Constitución\nPolítica de los Estados Unidos Mexicanos, todas las personas\nMexicano sea parte, así como de las garantías para su protección, cuyo ejercicio no podrá restringirse ni suspenderse, salvo en los casos y bajo las condiciones que la propia Constitución establece.\nEn términos del articulo 4, párrafo cuarto, de la Constitución\nPolítica de los Estados Unidos Mexicanos, toda persona tiene derecho a la protección de la salud. La Ley definirá las bases y modalidades para el acceso a los servicios de salud y establecerá la concurrencia de la Federación y las entidades federativas en materia de salubridad general, conforme a lo que dispone la fracción XVI del artículo 73 de la\nConstitución, bases 2ª y 3·ª que establece, en caso de epidemias de carácter grave o peligro de invasión de enfermedades exóticas en el país, la Secretaría de Salud tendrá la obligación de dictar inmediatamente las medidas preventivas indispensables.\nEn ese contexto, la Ley General de Salud reglamenta que el derecho a la salud que tiene toda persona es de observancia obligatoria en toda la República y sus disposiciones son de orden público e interés general, y conforme a su artículo 140, las autoridades no sanitarias cooperarán en el ejercicio de las acciones para combatir las enfermedades transmisibles, estableciendo las medidas que estimen necesarias, sin contravenir las disposiciones de la propia ley, las que\nOficiales Mexicanas que dicte la Secretaría de Salud.\nPor su parte, los artículos 181, 402 y 404, fracciones I, II, III, IV, VII, XI y XIII, disponen en lo conveniente, que se disposiciones que dicte la autoridad sanitaria competente, para proteger la salud de la población; que se aplicarán sin perjuicio de las sanciones que, en su caso, correspondieren, y entre otras se encuentran, el aislamiento, la cuarentena, la observación personal, la vacunación de personas, la suspensión de trabajos o servicios, la desocupación o desalojo de casas, edificios, establecimientos y, en general, de cualquier predio sanitarias competentes, que pueden evitar que se causen o continúen causando riesgos o daños a la salud.\nEn este orden de ideas, se tiene que, la Comisión Ejecutiva, Sistema Estatal Anticorrupción de Guerrero, y que esta, es del Sistema Estatal Anticorrupción, y el Comité de\nParticipación Ciudadana, con excepción del miembro que funja en ese momento como presidente del mismo, como lo establece el artículo 30 de la Ley Número 464 del Sistema Estatal\nAnticorrupción vigente en la entidad. Siendo un órgano colegiado que para la ejecución de los fines que persigue, es necesario llevar a cabo reuniones en las que se establezcan el inicio y desarrollo de actividades propias.\n4. Así, esta Comisión Ejecutiva de la Secretaría Ejecutiva del\nSistema Estatal Anticorrupción, a través del presente acuerdo, busca un marco de actuación sobre la validez de sus sesiones ordinarias y extraordinarias, a las que eventualmente se pudieran convocar, llevadas a cabo de manera virtual o a distancia, con el uso de herramientas tecnológicas, durante el periodo de duración de las multicitadas medidas sanitarias derivadas de la epidemia COVID-19, con la finalidad de darle el curso adecuado a las actividades y procedimientos propios, atendiendo la situación extraordinaria que actualmente se presenta en el mundo, en el País y en nuestro Estado. Lo anterior, tomando en consideración que las sesiones son primordialmente para atender temas urgentes, necesarios o elementales.\n5. En esta tesitura, cabe destacar que la celebración de sesiones de que se traten y que sean propias de la Comisión\nEjecutiva, atendidas de manera virtual o a distancia, serán apegadas a lo que legalmente establece la Ley Número 464 del\nSistema Estatal Anticorrupción de Guerrero, por lo que de presenciales, como son la formalidad de la emisión de convocatorias, orden del día y envío de la documentación atinente, quórum legal, participación de las y los integrantes, orden de las sesiones, votación y publicación, así como la elaboración de las actas respectivas.\nDebiendo para tales efectos, indicar en la convocatoria cual se podrá llevar a cabo la sesión correspondiente; cuya notificación y atendiendo el tiempo de contingencia, habrá de acusar su recibo; tomando la Secretaria Técnica las debidas la correspondiente notificación de los acuerdos, que es su caso sean aprobados o emitidos.\nCon estas medidas, la actuación de este organismo y en específico de la Comisión Ejecutiva, busca salvaguardar y garantizar las medidas sanitarias que eviten la dispersión y transmisión del virus, y proteger los derechos a la salud y la vida, de quienes tienen relación con este organismo, de sus familias, y en general con la sociedad, y al mismo tiempo, dar continuidad a la operación de las actividades que tiene a su cargo esta Comisión Ejecutiva, así como garantizar los principios de legalidad, objetividad, profesionalismo, honradez, lealtad, imparcialidad, eficiencia, eficacia, equidad, transparencia y economía, integridad y competencia de mérito.\nPor último se hace referencia, que durante el tiempo que dure la contingencia se deberá optar por la realización de sesiones virtuales o a distancia, y solo de manera excepcional o justificada podrán llevarse a cabo las sesiones presenciales, tomando en consideración las medidas preventivas que se lleguen y deban implementar.\nEn razón de lo anterior, la Comisión Ejecutiva de la\nSecretaría Ejecutiva del Sistema Estatal Anticorrupción de\nGuerrero, emite el presente:\nACUERDO\nPRIMERO.- Tomando en consideración la importancia y necesidad adecuado a las actividades y procedimientos propios, durante generada por el virus SARS-CoV2 (COVID-19), se autoriza la celebración a través de herramientas tecnológicas, de las\nSistema Estatal Anticorrupción de Guerrero.\nSEGUNDO.- La Secretaria Técnica, deberá para tal efecto, con las sesiones de la Comisión Ejecutiva, así como aquellas\nTERCERO.- La realización de las sesiones virtuales o a distancia, únicamente de manera excepcional y justificada, autoridades de salud en el ámbito Federal y Estatal, hayan declarado o declaren, emergencia sanitaria por causa de fuerza mayor para controlar, mitigar y evitar la propagación del\nCOVID-19.\nTRANSITORIOS\nPRIMERO.- El presente acuerdo entrará en vigor al día siguiente de su aprobación.\nSEGUNDO.- Infórmese el presente acuerdo, de manera electrónica, a través de la Secretaria Técnica de la\nSecretaría Ejecutiva, al Comité Coordinador del Sistema\nEstatal Anticorrupción de Guerrero, con fundamento en el artículo\n32 de la Ley Número 464 del Sistema Estatal Anticorrupción de\nGuerrero vigente en la entidad.\nTERCERO.- Publíquese el presente acuerdo en el Periódico\nOficial del Gobierno del Estado de Guerrero.\nAsí lo aprobó por unanimidad de votos, en sesión extraordinaria el 08 de mayo de dos mil veinte, la Comisión\nEjecutiva del Sistema Estatal Anticorrupción de Guerrero.\nLic. ITZEL FIGUEROA SALAZAR Secretaria Técnica de la\nGuerrero.\nRúbrica\nMtra. BRENDA IXCHEL ROMERO MÉNDEZ Integrante de la Comisión\nEjecutiva del Sistema Estatal Anticorrupción de Guerrero.\nRúbrica\nDr. IGNACIO RENDÓN ROMERO Integrante de la Comisión Ejecutiva del Sistema Estatal Anticorrupción de Guerrero.\nRúbrica\nMtro. CÉSAR GONZÁLEZ ARCOS Integrante de la Comisión Ejecutiva del Sistema Estatal Anticorrupción de Guerrero.\nRúbrica\nDr. CARLOS MORILLÓN LÓPEZ Integrante de la Comisión Ejecutiva del Sistema Estatal Anticorrupción de Guerrero.\nRúbrica\nLA QUE SUSCRIBE LICNEIDAD ITZEL FIGUEROA SALAZAR, SECRETARIA\nANTICORRUPCIÓN DE GUERRERO.\nQUE LA PRESENTE COPIA FOTOSTÁTICA, COTEJA, ENTRESELLADA Y CON\nMI RUBRICA, CONCUERDA FIELMENTE CON SU ORIGINAL, EL ACUERDO DE\nLA COMISIÓN EJECUTIVA DEL SISTEMA ESTATAL ANTICORRUPCIÓN DE\nGUERRERO, POR EL QUE SE ESTABLECE LA CELEBRACIÓN A TRAVÉS DE\nHERRAMIENTAS TECNOLÓGICAS, DE SESIONES VIRTUALES O A\nDISTANCIA, ORDINARIAS O EXTRAORDINARIAS, DE LA COMISIÓN\nEJECUTIVA DEL SISTEMA ESTATAL ANTICORRUPCIÓN DE GUERRERO,\nEPIDEMIA DE ENFERMEDAD GENERADA POR EL VIRUS SAR-COV2 (COVID-\n19), APROBADO EN SESIÓN EXTRAORDINARIA POR LA COMISIÓN\nFECHA 08 DE MAYO DEL PRESENTE AÑO, MISMA QUE TENGO A LA VISTA,\nCONSISTE DE SIETE FOJAS ÚTILES, LO ANTERIOR PARA LOS EFECTOS\nLEGALES CORRESPONDIENTES.\nCHILPANCINGO DE LOS BRAVO, GUERRERO, A LOS DOCE DÍAS DEL MES\nDE MAYO DEL AÑO DOS IL VEINTE.- DOY FE.\nRúbrica.\nEFÉMERIDES JURÍDICO-HISTÓRICAS\n22 DE MAYO\nDurango como parte de la Federación, cuya primera constitución política se sancionaría el\n1834. Se expide la Ley de los Tribunales de Circuito y Juzgados de Distrito, que funcionamiento de los tribunales federales.\n1856. Nace en Ocozocoautla, Chiapas, Emilio Rabasa Estebanell; impartió la cátedra de\nDerecho Constitucional en la Escuela Nacional de Jurisprudencia; fundó la Escuela Libre de Derecho, en la que se desempeñó como rector. Fue uno de los más importantes constitucionalistas del país. Entre otros cargos, se desempeñó como gobernador del Estado de Chiapas y senador de la República. Entre sus obras se encuentran: \"El artículo 14\", \"Estudio constitucional\", \"La constitución y la dictadura\".\n1783. Con el fin de incrementar la recaudación fiscal, el rey Carlos III de España expide en\nAranjuez las Reales Ordenanzas para la Minería de la Nueva España; en estas disposiciones se establece que las minas son propiedad de la Corona.\n1900. Es reformado el artículo 91 de la Constitución de 1857, para disponer que el Alto\nTribunal se integrara con quince Ministros; se sustrajo al fiscal y al Procurador General del ámbito de la Suprema Corte de Justicia de la Nación y se sujetó al segundo al Poder\nEjecutivo Federal. Se emplea por primera vez la expresión “Ministerio Público” en el texto constitucional.\n1902. Muere en la Ciudad de México el general Mariano Escobedo, quien fuera político de ideas liberales, gobernador de San Luis Potosí y de Nuevo León, senador y ministro de\nGuerra durante el gobierno de Sebastián Lerdo de Tejada.\n1912. El presidente Francisco Y. Madero expide el decreto de Reformas a la Ley Electoral junio; al mismo tiempo se haría la designación de electores para Ministros de la Suprema\nCorte de Justicia de la Nación.\nPERIODICO OFICIAL DEL ESTADO DE GUERRERO.\nLIC. DANIELA GUILLEN VALLE.\nDIRECTORA GENERAL.\nDirección Electrónica.",
  "ordenamiento": "ACUERDO",
  "jurisdiccion": "GUERRERO",
  "fuente_oficial": "DIARIO OFICIAL DE LA FEDERACION",
  "Fecha de Publicación": "22 de Mayo de 2020",
  "ULTIMA REFORMA PUBLICADA": null,
  "status": "VIGENTE",
  "es_escaneado": false,
  "tiene_tablas": true,
  "materia": [
    "anticorrupción"
  ]
}