{
  "titulo": "Acuerdo del Pleno del Tribunal Electoral del Estado de Guerrero, de Uno de Febrero de Dos Mil Doce,",
  "Contenido": "EL QUE SE DECLARA FORMALMENTE LA\nSEGUNDA INSTANCIA DE ESTE ORGANO\nJURISDICCIONAL, DEL MAGISTRADO\nPROPIETARIO FERNANDO XOCHIHUA SAN\nMARTIN, TITULAR DE LA CUARTA SALA\nUNITARIA\nTEXTO ORIGINAL\nAcuerdo publicado en el Periódico Oficial del Gobierno del Estado No. 15, el\nMartes 21 de Febrero de 2012.\nTRIBUNAL ELECTORAL DEL ESTADO DE GUERRERO\nACUERDO DEL PLENO DEL TRIBUNAL ELECTORAL DEL ESTADO DE\nGUERRERO, DE UNO DE FEBRERO DE DOS MIL DOCE, POR EL QUE SE\nDECLARA FORMALMENTE LA INCORPORACIÓN AL PLENO Y A LA SALA DE\nSEGUNDA INSTANCIA DE ESTE ORGANO JURISDICCIONAL, DEL MAGISTRADO\nPROPIETARIO FERNANDO XOCHIHUA SAN MARTIN, TITULAR DE LA CUARTA\nSALA UNITARIA.\nGuerrero.- Tribunal Electoral del Estado de Guerrero.- Secretaría General de Acuerdos.\nACUERDO DEL TRIBUNAL EN\nPLENO DE UNO DE FEBRERO DEL\nDOS MIL DOCE.\nPRIMERO. De conformidad con lo dispuesto por el artículo 25, párrafo XXV, de la\nEstado de Guerrero, es un órgano autónomo en su funcionamiento e independiente en sus decisiones; con personalidad jurídica y patrimonio propio y máxima autoridad jurisdiccional en la materia; con excepción de lo dispuesto por la fracción IV, del artículo\n99, de la Constitución Política de los Estados Unidos Mexicanos.\nEL QUE SE DECLARA FORMALMENTE LA\nSEGUNDA INSTANCIA DE ESTE ORGANO\nJURISDICCIONAL, DEL MAGISTRADO\nPROPIETARIO FERNANDO XOCHIHUA SAN\nMARTIN, TITULAR DE LA CUARTA SALA\nUNITARIA\nSEGUNDO. Que el artículo 4, fracciones VII y XI de la Ley Orgánica del Tribunal\nElectoral del Estado, establece que, en términos de lo dispuesto por la Constitución Local y las leyes aplicables, el Tribunal Electoral del Estado de Guerrero, a través del pleno, es competente para expedir su Reglamento Interno y los acuerdos generales necesarios para su adecuado funcionamiento.\nTERCERO. De conformidad con los nombramientos expedidos por la Mesa\nDirectiva del Pleno de la Quincuagésima Octava Legislatura al Honorable Congreso del\nSoberano de Guerrero, en uso de sus facultades conferidas por el artículo 47, fracción dieciséis de mayo de dos mil ocho, ratificó como magistrados numerarios a los ciudadanos licenciados Alma Delia Eugenio Alcaraz, como titular de la Primera Sala\nUnitaria; J. Jesús Villanueva Vega, como titular de la Segunda Sala Unitaria; Isaías\nSánchez Nájera, como titular de la Tercera Sala Unitaria; J. Félix Villafuerte Rebollar, como titular de la Cuarta Sala Unitaria, y Regino Hernández Trujillo, como titular de la\nQuinta Sala Unitaria; y a Fernando Xochihua San Martín y elegido David Terrones\nBacilio, como magistrados supernumerarios primero y segundo respectivamente.\nCUARTO. Derivado de los decretos 811 y 813, de fecha nueve de septiembre del\nGuerrero, por que se reformaron el artículo décimo transitorio de la Constitución Política y segundo transitorio de la Ley Orgánica del Tribunal Electoral del Estado, prorrogándose electoral, por el periodo del veintinueve de mayo del dos mil ocho al quince de noviembre del dos mil doce.\nQUINTO. Que con fecha trece de diciembre del dos mil once, la presidencia de la\nSala de Segunda Instancia y del Tribunal Electoral del Estado, de conformidad con lo\nEL QUE SE DECLARA FORMALMENTE LA\nSEGUNDA INSTANCIA DE ESTE ORGANO\nJURISDICCIONAL, DEL MAGISTRADO\nPROPIETARIO FERNANDO XOCHIHUA SAN\nMARTIN, TITULAR DE LA CUARTA SALA\nUNITARIA establecido por el artículo 8 de su Ley Orgánica, mediante oficio numero PRE-670/ 2011, comunicó al Diputado Efraín Ramos Ramírez, Presidente de la Mesa Directiva del\nHonorable Congreso del Estado de Guerrero, sobre el sensible fallecimiento del magistrado numerario J. Félix Villafuerte Rebollar, titular de la Cuarta Sala Unitaria de este órgano jurisdiccional, y como consecuencia de su ausencia definitiva; para los efectos procedentes, de conformidad con las disposiciones constitucionales y legales aplicables.\nSEXTO. La Presidencia de la Mesa Directiva de la Quincuagésima Novena oficio numero LIX/ 4TO/OM/DPM/0412/2012, de fecha veintiséis de enero del dos mil doce, notificó el decreto numero 983, por medio del cual se llama al ciudadano\nFERNANDO XOCHIHUA SAN MARTIN, Magistrado Supernumerario del Tribunal\nElectoral del Estado, como primero en la lista de prelación, para asumir las funciones y atribuciones de magistrado numerario titular de la Cuarta Sala Unitaria, por ausencia definitiva del ciudadano J. Félix Villafuerte Rebollar, las que concluirá el día quince de noviembre del dos mil doce, conforme a los decretos 811 y 813, publicados en el once.\nEn este sentido, con fundamento en el artículo.6 fracción XII de la Ley Orgánica del Tribunal Electoral del Estado, el Pleno del Tribunal Electoral del Estado de Guerrero, expide el siguiente:\nÚNICO. Se le tiene al magistrado FERNANDO XOCHIHUA SAN MARTIN, Titular del Tribunal Electoral del Estado de Guerrero, con las atribuciones que la ley le confiere.\nEL QUE SE DECLARA FORMALMENTE LA\nSEGUNDA INSTANCIA DE ESTE ORGANO\nJURISDICCIONAL, DEL MAGISTRADO\nPROPIETARIO FERNANDO XOCHIHUA SAN\nMARTIN, TITULAR DE LA CUARTA SALA\nUNITARIA\nPRIMERO. El presente Acuerdo entrará en vigor el día de su aprobación.\nSEGUNDO. Para su conocimiento, publíquese en los estrados y página electrónica que tiene este órgano jurisdiccional en Internet, y en el Periódico Oficial del\nGobierno del Estado de Guerrero.\nAsí lo acordaron y firman los magistrados integrantes del Pleno del Tribunal\nElectoral del Estado por ante el Secretario General de Acuerdos que autoriza y da fe.\nC. J. JESÚS VILLANUEVA VEGA.\nMAGISTRADO PRESIDENTE.\nRúbrica.\nC. ALMA DELIA EUGENIO ALCARAZ.\nMAGISTRADA.\nRúbrica.\nC. FERNANDO XOCHIHUA SAN MARTIN.\nMAGISTRADO.\nC. ISAÍAS SÁNCHEZ NÁJERA.\nMAGISTRADO.\nC. REGINO HERNÁNDEZ TRUJILLO.\nMAGISTRADO.\nEL QUE SE DECLARA FORMALMENTE LA\nSEGUNDA INSTANCIA DE ESTE ORGANO\nJURISDICCIONAL, DEL MAGISTRADO\nPROPIETARIO FERNANDO XOCHIHUA SAN\nMARTIN, TITULAR DE LA CUARTA SALA\nUNITARIA\nC. MANUEL ALEJANDRO ARROYO GONZÁLEZ.\nSECRETARIO GENERAL DE ACUERDOS.\nRúbrica.\nEL SUSCRITO, MAESTRO EN DERECHO MANUEL ALEJANDRO ARROYO\nGONZÁLEZ, SECRETARIO GENERAL DE ACUERDOS DEL TRIBUNAL ELECTORAL\nDEL ESTADO DE GUERRERO.\nQue las presentes copias fotostáticas constantes en 4 fojas útiles debidamente cotejadas y selladas, corresponden al acuerdo del pleno del Tribunal Electoral del Estado de Guerrero, de uno de febrero de dos mil doce, por el que se declara formalmente la incorporación al Pleno y a la Sala De Segunda Instancia de este órgano jurisdiccional, del magistrado propietario Fernando Xochihua San Martin, titular de la Cuarta Sala\nUnitaria, mismo que fue aprobado en la segunda sesión ordinaria celebrada el uno del mes y año en curso, el cual obra en la Secretaría General de Acuerdos de este órgano jurisdiccional.\nLo que certifico, en ejercicio de las facultades previstas en el artículo 21 fracción\nIV de la Ley Orgánica del Tribunal Electoral del Estado, y a lo ordenado en el segundo punto transitorio del referido acuerdo. DOY FE.\nChilpancingo, Guerrero, a dos de febrero del dos mil doce.\nSECRETARIO GENERAL DE ACUERDOS.",
  "ordenamiento": "ACUERDO",
  "jurisdiccion": "GUERRERO",
  "fuente_oficial": "DIARIO OFICIAL DE LA FEDERACION",
  "Fecha de Publicación": "21 de Febrero de 2012",
  "ULTIMA REFORMA PUBLICADA": null,
  "status": "VIGENTE",
  "es_escaneado": false,
  "tiene_tablas": false,
  "materia": [
    "electoral",
    "judicial"
  ]
}