{
  "titulo": "Acuerdo Mediante el Cual Se Publica el Plan Integral de Reparación del Daño para las Víctimas de los",
  "Contenido": "EN LA CIUDAD DE IGUALA DE LA INDEPENDENCIA,\nGUERRERO LOS DÍAS 26 Y 27 DE SEPTIEMBRE DEL\nTEXTO ORIGINAL.\n11 de octubre de 2014.\nACUERDO MEDIANTE EL CUAL SE PUBLICA EL PLAN INTEGRAL DE REPARACIÓN DEL DAÑO\nPARA LAS VÍCTIMAS DE LOS ACONTECIMIENTOS SUSCITADOS EN LA CIUDAD DE IGUALA DE LA\nINDEPENDENCIA, GUERRERO LOS DÍAS 26 Y 27 DE SEPTIEMBRE DEL 2014.\nGuerrero.- Poder Ejecutivo.\nÁNGEL HELADIO AGUIRRE RIVERO, GOBERNADOR CONSTITUCIONAL DEL ESTADO\nARTÍCULOS lo PÁRRAFO TERCERO DE LA CONSTITUCIÓN POLÍTICA DE LOS ESTADOS UNIDOS\nCONVENCIÓN AMERICANA SOBRE DERECHOS HUMANOS; 2 Y 3 DEL PACTO INTERNACIONAL DE\nDERECHOS CIVILES Y POLÍTICOS; Y EN USO DE LAS FACULTADES QUE ME CONFIEREN LOS\nARTÍCULOS 6o., 7o., 20 FRACCIÓN III, 21 Y 22 DE LA LEY ORGÁNICA DE LA ADMINISTRACIÓN\nPÚBLICA DEL ESTADO DE GUERRERO NÚMERO 433; Y\nCONSIDERANDO\nQue el Gobierno del Estado de Guerrero ha manifestado un compromiso irrestricto con los derechos humanos en todos sus programas y acciones de gobierno, atendiendo a las recomendaciones, sentencias y estándares internacionales que sobre la materia se le han formulado.\nQue el marco jurídico estatal, se encuentra en constante renovación y actualización a efecto de garantizar de la mejor manera el pleno goce de todos los derechos para las y los guerrerenses.\nQue a pesar de los esfuerzos constantes por respetar y garantizar los derechos humanos, los días\n26 y 27 de septiembre se cometieron en contra de un número importante de personas diversos delitos por parte de servidores públicos pertenecientes al Municipio de Iguala de la Independencia, resultando 6 personas fallecidas, 25 heridas y 43 más desaparecidas.\nQue en esos lamentables hechos tuvieron participación distintos servidores públicos perlos derechos humanos, en particular la violación al derecho a la vida, la integridad personal, y la libertad personal, resultando de ello además otras graves violaciones a los derechos humanos. penales contra 26 servidores públicos que participaron en esos hechos y que mantiene las investigaciones ministeriales pertinentes para sancionar a todos aquellos servidores públicos y/o civiles que cometieron\nEN LA CIUDAD DE IGUALA DE LA INDEPENDENCIA,\nGUERRERO LOS DÍAS 26 Y 27 DE SEPTIEMBRE DEL esos terribles actos de violencia, asegurando que los hechos sean castigados conforme a la gravedad de los mismos.\nQue se han mantenido las acciones de búsqueda y localización de los jóvenes desaparecidos de manera permanente, contando con la participación de todas las instancias del Gobierno, particularmente de la Fiscalía General del Estado y de la Secretaria de Seguridad Pública y Protección Civil y que dichas acciones se seguirán desarrollando ininterrumpidamente hasta localizar y dar con el paradero de todos los jóvenes desaparecidos.\nQue el Gobierno del Estado de Guerrero ha asumido públicamente que estos hechos aunque no son imputables a ningún servidor público del orden estatal, representan una afrenta a las responsabilidades que el Estado mexicano ha adoptado a nivel internacional y que como parte de esas responsabilidades este Gobierno actuará de manera integral avanzando en las acciones para que se acceda a la justicia, se garantice la reparación del daño y se conozca la verdad de lo sucedido.\nQue para atender a las víctimas de los hechos es necesario que las diversas instancias estatales garanticen los servicios médicos, psicológicos, jurídicos y sociales que sean necesarios, así como que sean estimadas y entregadas las indemnizaciones correspondientes, de conformidad con los estándares internacionales en la materia y como parte de la reparación del daño a que tienen derecho.\nQue para garantizar la atención y reparación del daño de las víctimas, para indemnizarlas adecuadamente y para evitar que hechos semejantes vuelvan a repetirse, se estima conveniente un acuerdo mediante el cual se publica el Plan Integral de Reparación del Daño para las Victimas de los acontecimientos suscitados en la ciudad de Iguala de la Independencia los días 26 y 27 de septiembre de\n2014.\nPor lo anteriormente expuesto y fundado, he tenido a bien expedir el siguiente:\nINDEPENDENCIA, GUERRERO LOS DÍAS 26 Y 27 DE SEPTIEMBRE DEL 2014.\nArtículo Único. Se emite y ordena sea publicado el PLAN INTEGRAL DE REPARACIÓN DEL\nDE LA INDEPENDENCIA GUERRERO LOS DÍAS 26 Y 27 DE SEPTIEMBRE DEL 2014, mismo que se anexa y forma parte del presente Acuerdo.\nTRANSITORIOS\nEN LA CIUDAD DE IGUALA DE LA INDEPENDENCIA,\nGUERRERO LOS DÍAS 26 Y 27 DE SEPTIEMBRE DEL\nSegundo. El presente Acuerdo entrará en vigor al día siguiente de su publicación en el Periódico\nBravo, capital del Estado de Guerrero, a los once días del mes de octubre del dos mil catorce.\nLIC. ÁNGEL HELADIO AGUIRRE RIVERO.\nEL SECRETARIO GENERAL DE GOBIERNO.\nDR. JESÚS MARTÍNEZ GARNELO.\nEN LA CIUDAD DE IGUALA DE LA INDEPENDENCIA,\nGUERRERO LOS DÍAS 26 Y 27 DE SEPTIEMBRE DEL\nSUSCITADOS EN LA CIUDAD DE IGUALA DE LA INDEPENDENCIA, GUERRERO LOS DÍAS 26 Y 27\nDE SEPTIEMBRE DEL 2014\nJustificación\nLos días 26 y 27 de septiembre en la Ciudad de Iguala de la Independencia, Guerrero, se suscitaron varios hechos de violencia en contra de la población y en contra de estudiantes de la Escuela\nNormal Rural \"Raúl Isidro Burgos\" de Ayotzinapa quienes se encontraban en ese momento en la ciudad, la actuación de algunos servidores públicos municipales derivó en la comisión de diversos delitos y en la comisión de graves violaciones a los derechos humanos que no pueden permitirse en una sociedad como la nuestra, ya que representan acciones reprobables en toda nuestra comunidad que contravienen los instrumentos internacionales en materia de derechos humanos.\nEl Gobierno del Estado ha reconocido públicamente que asume su responsabilidad por la gravedad de estos hechos, aunque los agentes del Estado que cometieron esas graves violaciones correspondan al Gobierno Municipal de Iguala de la Independencia, ya que como parte del Estado\nMexicano el Gobierno del Estado de Guerrero ha asumido que es su responsabilidad investigar los hechos, sancionar a los responsables, atender a las víctimas y brindarles seguridad, así como mantener todas las acciones necesarias para asegurar que se conozca la verdad de los hechos y que se localicen a los jóvenes desaparecidos.\nDe igual manera este Gobierno asume que le corresponde como parte de sus deberes de protección y garantía, la implementación de medidas de no repetición y de prevención efectivas que eviten que actos semejantes vuelvan a repetirse.\nAdicional a este reconocimiento, es necesaria una intervención extraordinaria del Estado, que confirme que el compromiso para reparar a las víctimas se traduzca en acciones concretas de atención médica, psicológica, jurídica y de indemnización, asegurándoles un trato digno y respetuoso en todo momento. de estos lamentables hechos, es necesario contar con mecanismos de coordinación interinstitucional gobierno bajo una visión y perspectiva de derechos humanos. y de que es indispensable mandar un mensaje claro a la sociedad local, nacional e internacional de que\nEN LA CIUDAD DE IGUALA DE LA INDEPENDENCIA,\nGUERRERO LOS DÍAS 26 Y 27 DE SEPTIEMBRE DEL al día de hoy se encuentran desaparecidos, asegurando en todo momento los derechos de las víctimas de conformidad con los estándares internacionales en materia de derechos humanos.\nII. Contenido y Estrategia del Plan\n1. Población Objetivo\nLa población a la que está dirigido el presente Plan lo constituyen las víctimas y los familiares de las personas fallecidas, así como aquellas que resultaron afectadas en sus derechos de libertad personal o integridad personal por los hechos ocurridos los días 26 y 27 de septiembre de 2014 en la ciudad de\nIguala de la Independencia, así como aquellos familiares de los jóvenes desaparecidos al momento de la publicación de este Acuerdo. Las medidas dirigidas a cada víctima consideraran cada caso en particular y a la afectación que hayan sufrido en sus derechos.\nLas medidas de atención que se integran en este Plan, serán de carácter permanente salvo la indemnización, misma que será entregada en una sola ocasión.\nLas medidas de no repetición en materia legislativa y normativa que implementará el Gobierno de\nGuerrero, a partir de las acciones de este Plan estarán dirigidas a la sociedad guerrerense en su conjunto.\n2. Autoridades responsables\nLa coordinación e implementación del presente Plan estará a cargo del Comité de Atención\nIntegral, mismo que será integrado a partir de la publicación del presente Acuerdo, y será coordinado por la Secretaria de Desarrollo Social, con la participación de la Secretaria General de Gobierno a través de la\nSubsecretaría de Gobierno para Asuntos Jurídicos y Derechos Humanos, de la Fiscalía General del Estado a través de la Dirección General de Atención a Víctimas del Delito y Servicios a la Comunidad, de la\nSecretaria de Salud, de la Secretaria de Educación Guerrero, de la Secretaria de la Juventud y la Niñez y del Sistema para el Desarrollo Integral de la Familia DIF-Guerrero, como integrantes permanentes, y por la\nSecretaria de Finanzas y Administración, el Instituto del Deporte como integrantes invitados.\nLas dependencias que por disposición legal, tengan encomendada la realización de actividades relacionadas con el objeto de este Plan, se coordinarán para su ejecución, con la Secretaria de Desarrollo\nSocial como instancia coordinadora del Comité de Atención Integral.\n3. Criterios para la elaboración e integración del Padrón de victimas\nEl padrón de victimas que se utilizará para efectos del cumplimiento de los objetivos de este Plan, será integrado por la Secretaria de Desarrollo Social, a partir de la información proporcionada por la Fiscalía de Gobierno.\nEN LA CIUDAD DE IGUALA DE LA INDEPENDENCIA,\nGUERRERO LOS DÍAS 26 Y 27 DE SEPTIEMBRE DEL derecho, afectación en su integridad física o psicológica de manera directa e indirecta como consecuencia de las graves violaciones a los derechos humanos cometidas los días 26 y 27 de septiembre de 2014 en la ciudad de Iguala de la Independencia, así como los familiares directos de las personas que resultaron fallecidas o que al día hoy se encuentren desaparecidas.\nA) Medidas que integran del Plan\nEl Comité de Atención Integral elaborará y entregará a las victimas una Tarjeta de Atención\nIntegral, con la cual podrán acceder de manera prioritaria a los servicios que se mencionan en este apartado.\nEl Comité de Atención Integral a través de las instancias que lo integran y de aquéllas que tengan por mandato de ley brindar los servicios que se enuncian, deberán:\n1. Proporcionar asesoría jurídica gratuita respecto de sus denuncias o querellas;\n2. Brindar la atención médica y psicológica;\n3. Integrar a las víctimas a los programas sociales, en aquellos casos que así lo determine el\nComité.\nB) Programa de indemnizaciones\nComo parte de la reparación integral del daño, el Gobierno del Estado de Guerrero entregará apoyos económicos extraordinarios por concepto de indemnización para las víctimas de los hechos de los días 26 y 27 de septiembre de 2014.\nEl Comité de Atención Integral, a partir del padrón de victimas que haya integrado, sesionará para estudiar los casos en particular y determinar a partir de los estándares internacionales en materia de reparación del daño, los montos que le serán entregados a cada víctima por este concepto.\nLa indemnización deberá de cubrir necesariamente los gastos o erogaciones en que pudiera incurrir la víctima para atender las necesidades derivadas de los hechos en materia de salud, rehabilitación y atención psicológica, sin menoscabo de que estos mismos servicios puedan ser brindados por las\nC) Difusión y acercamiento con las victimas\nEN LA CIUDAD DE IGUALA DE LA INDEPENDENCIA,\nGUERRERO LOS DÍAS 26 Y 27 DE SEPTIEMBRE DEL en cuanto a servicios e indemnizaciones.\nCon las víctimas que ya se haya tenido contacto o que incluso reciban alguno de los servicios o programas del Gobierno del Estado se dispondrá un contacto inmediato a efecto de darles a conocer los alcances del Plan Integral.\nEl Comité designará a un equipo que fungirá como enlaces con la finalidad de poder atender, informar, canalizar, orientar y tramitar las peticiones de las víctimas, así como de iniciar los procedimientos para las indemnizaciones y la atención integral.\n4. Documentación requerida\nPara acceder a las medidas establecidas en el presente Plan, las personas deberán:\na) Acudir con los enlaces que designará el Comité de Atención Integral para manifestar bajo protesta de decir verdad, que se encontraba presente en el lugar de los hechos, y que resultaron afectados en sus derechos, información que será corroborada con aquella contenida de manera oficial en las distintas áreas del Gobierno;\nb) Exhibir en su caso, documentación con la que se acredite el tipo de parentesco que el solicitante tiene con la victima; en los casos de las personas que resultaron fallecidas; y\nc) Exhibir en su caso, documentación con la que acredite el tipo de parentesco que el solicitante tiene con la persona que se encuentra desaparecida.\nEstos requisitos resultan indispensables para la tramitación y obtención de las respectivas indemnizaciones, no así, para acceder y recibir la atención integral médica, psicológica y jurídica que corresponda.\n5. Supervisión del Plan\nLa Supervisión relacionada con el cumplimiento de las acciones de este Plan, estará a cargo de\nProyectos Estratégicos del Ejecutivo.\n6. Seguimiento del Plan del Comité de Atención Integral, quien periódicamente entregará un informe al Gobernador del Estado sobre el avance y el nivel de cobertura de las acciones aquí contenidas.\nEN LA CIUDAD DE IGUALA DE LA INDEPENDENCIA,\nGUERRERO LOS DÍAS 26 Y 27 DE SEPTIEMBRE DEL\n7. Recursos financieros de Finanzas y Administración del Gobierno del Estado de Guerrero, de conformidad con lo establecido en su normatividad, en el presupuesto de egresos y en las demás disposiciones aplicables.\n8. Vigencia\nEste Plan dará inicio de manera simultánea a la entrada en vigor del Acuerdo mediante el cual se da a conocer y tendrá una vigencia indeterminada.\n9. Procedimiento de queja o inconformidad ciudadana cuando considere que se excluye, incumple o contraviene por parte de servidores públicos, las disposiciones previstas en este Acuerdo o en otras disposiciones aplicables.\nUna vez que se presente la queja o inconformidad, la Contraloría General del Estado, turnará la misma al coordinador del Comité de Atención Integral, a efecto de dar contestación a la misma en un plazo no mayor a 10 días hábiles, una vez remitida la respuesta, la Contraloría determinará la procedencia de la a efecto de dar atención y cumplimiento al contenido de este Acuerdo.",
  "ordenamiento": "ACUERDO",
  "jurisdiccion": "GUERRERO",
  "fuente_oficial": "DIARIO OFICIAL DE LA FEDERACION",
  "Fecha de Publicación": "11 de octubre de 2014",
  "ULTIMA REFORMA PUBLICADA": null,
  "status": "VIGENTE",
  "es_escaneado": false,
  "tiene_tablas": false,
  "materia": [
    "penal"
  ]
}