{
  "titulo": "Acuerdo por el Que Se Autoriza el Cambio de Adscripción al C. Licenciado Arturo Eduardo Nozari Arcos",
  "Contenido": "DE ALLENDE, CON RESIDENCIA EN LA CIUDAD DE AYUTLA\nDE LOS LIBRES, GUERRERO, PARA QUE SE CONSTITUYA AL\nDISTRITO NOTARIAL DE TABARES, CON RESIDENCIA EN LA\nCIUDAD Y PUERTO DE ACAPULCO, GUERRERO, A OCUPAR\nLA NOTARÍA PÚBLICA NÚMERO ONCE\nTEXTO ORIGINAL.\nAcuerdo publicado en el Periódico Oficial del Gobierno del Estado No. 44 Alcance II, el Martes\n03 de Junio de 2014.\nACUERDO POR EL QUE SE AUTORIZA EL CAMBIO DE ADSCRIPCIÓN AL C. LICENCIADO\nARTURO EDUARDO NOZARI ARCOS, QUIEN FUNGE ACTUALMENTE COMO NOTARIO PÚBLICO\nNÚMERO UNO DEL DISTRITO NOTARIAL DE ALLENDE, CON RESIDENCIA EN LA CIUDAD DE\nAYUTLA DE LOS LIBRES, GUERRERO, PARA QUE SE CONSTITUYA AL DISTRITO NOTARIAL DE\nTABARES, CON RESIDENCIA EN LA CIUDAD Y PUERTO DE ACAPULCO, GUERRERO, A OCUPAR\nLA NOTARÍA PÚBLICA NÚMERO ONCE.\nGuerrero.- Poder Ejecutivo.\nCON LA FACULTAD CONFERIDA POR EL C. LICENCIADO ÁNGEL HELADIO AGUIRRE\nAL C. DOCTOR JESÚS MARTÍNEZ GARNELO, SECRETARIO GENERAL DE GOBIERNO, EN EL\nARTÍCULO 20 FRACCIONES VIII Y XXXIX DE LA LEY ORGÁNICA DE LA ADMINISTRACIÓN\nPÚBLICA DEL ESTADO DE GUERRERO NÚMERO 433 Y 149 DE LA LEY NÚMERO 971 DEL\nNOTARIADO DEL ESTADO DE GUERRERO, Y\nPRIMERO.- Que con fecha tres de enero del dos mil cinco, se extendió al C. Licenciado\nARTURO EDUARDO NOZARI ARCOS, la Patente de Notario Público Número Uno del Distrito Notarial de\nAllende, con residencia en la Ciudad de Ayutla de los Libres, Guerrero.\nSEGUNDO.- Que el C. Licenciado ARTURO EDUARDO NOZARI ARCOS, Notario Público\nNúmero Uno del Distrito Notarial de Allende, con residencia en la Ciudad de Ayutla de los Libres, Guerrero, solicitó al Ejecutivo del Estado, mediante escrito de fecha seis de enero del dos mil catorce, recibido en la Secretaría General de Gobierno el siete de enero del dos mil catorce, se le concediera el de Tabares, con residencia en la Ciudad y Puerto de Acapulco, Guerrero.\nTERCERO.- Para solicitar dicho cambio el C. Licenciado ARTURO EDUARDO NOZARI ARCOS, se fundamentó en lo establecido por el artículo 149 de la Ley Número 971 del Notariado del Estado de\nGuerrero en vigor, y toda vez que la Notaría Publica Número Once del Distrito Notarial de Tabares, se encuentra vacante y no se ha expedido la convocatoria para el examen de Notario, a efecto cubrir la\nDE ALLENDE, CON RESIDENCIA EN LA CIUDAD DE AYUTLA\nDE LOS LIBRES, GUERRERO, PARA QUE SE CONSTITUYA AL\nDISTRITO NOTARIAL DE TABARES, CON RESIDENCIA EN LA\nCIUDAD Y PUERTO DE ACAPULCO, GUERRERO, A OCUPAR\nLA NOTARÍA PÚBLICA NÚMERO ONCE vacancia de esa Notaría; en consecuencia, dicha solicitud se encuentra ajustada a derecho, por lo que con fundamento en lo establecido por el artículo 20 fracciones VIII y XXXIX de la Ley Orgánica de la\nAdministración Pública del Estado de Guerrero Número 433 y 149 de la Ley Número 971 del Notariado del Estado de Guerrero, he tenido a bien emitir el siguiente:\nACUERDO POR EL QUE SE AUTORIZA EL CAMBIO DE ADSCRIPCIÓN AL C. LICENCIADO\nARTURO EDUARDO NOZARI ARCOS, QUIEN FUNGE ACTUALMENTE COMO NOTARIO PÚBLICO\nNÚMERO UNO DEL DISTRITO NOTARIAL DE ALLENDE, CON RESIDENCIA EN LA CIUDAD DE\nAYUTLA DE LOS LIBRES, GUERRERO, PARA QUE SE CONSTITUYA AL DISTRITO NOTARIAL DE\nTABARES, CON RESIDENCIA EN LA CIUDAD Y PUERTO DE ACAPULCO, GUERRERO, A OCUPAR\nLA NOTARÍA PÚBLICA NÚMERO ONCE.\nARTÍCULO PRIMERO.- Se autoriza el cambio de adscripción al C. Licenciado ARTURO\nEDUARDO NOZARI ARCOS, quien funge actualmente como Notario Público Número Uno del Distrito\nNotarial de Allende, con residencia en la Ciudad de Ayutla de los Libres, Guerrero, para que se constituya al Distrito Notarial de Tabares, con residencia en la Ciudad y Puerto de Acapulco, Guerrero, a ocupar la\nNotaría Pública Número Once.\nARTÍCULO SEGUNDO.- Expídase al C. Licenciado ARTURO EDUARDO NOZARI ARCOS, nueva patente de Notario Titular Número Once del Distrito Notarial de Tabares con residencia en la\nCiudad y Puerto de Acapulco, Guerrero.\nARTÍCULO TERCERO.- El cambio de adscripción surtirá sus efectos al día siguiente en que el\nC. Licenciado ARTURO EDUARDO NOZARI ARCOS, haga la entrega correspondiente de la Notaría\nPública que actualmente ejerce al Archivo General de Notarías del Estado de Guerrero.\nÚNICO.- El presente Acuerdo entrará en vigor al día siguiente de su publicación en el Periódico\nDado en la oficina de la Secretaría General de Gobierno, en la Ciudad de Chilpancingo de los\nBravo, Capital del Estado de Guerrero, a los treinta días del mes de mayo del año dos mil catorce.\nEL SECRETARIO GENERAL DE GOBIERNO.\nDR. JESÚS MARTÍNEZ GARNELO.\nRúbrica.\nDE ALLENDE, CON RESIDENCIA EN LA CIUDAD DE AYUTLA\nDE LOS LIBRES, GUERRERO, PARA QUE SE CONSTITUYA AL\nDISTRITO NOTARIAL DE TABARES, CON RESIDENCIA EN LA\nCIUDAD Y PUERTO DE ACAPULCO, GUERRERO, A OCUPAR\nLA NOTARÍA PÚBLICA NÚMERO ONCE\nEL SUSCRITO LICENCIADO RAÚL EFRAÍN CARDOSO MIRANDA, DIRECTOR GENERAL\nDE ASUNTOS JURÍDICOS DE LA SECRETARÍA GENERAL DE GOBIERNO, CON FUNDAMENTO EN\nLO DISPUESTO POR EL ARTÍCULO 20 FRACCIÓN XIII DEL REGLAMENTO INTERIOR DE LA\nSECRETARÍA GENERAL DE GOBIERNO DEL ESTADO.\nQUE LAS PRESENTES COPIAS FOTOSTÁTICAS COMPUESTAS DE TRES FOJAS ÚTILES,\nDEBIDAMENTE FOLIADAS, SELLADAS Y RUBRICADAS, SON REPRODUCIDAS FIELMENTE DE SU\nORIGINAL, Y CORRESPONDEN AL ACUERDO POR EL QUE SE AUTORIZA EL CAMBIO DE\nADSCRIPCIÓN AL C. LICENCIADO ARTURO EDUARDO NOZARI ARCOS, QUIEN FUNGE\nALLENDE, CON RESIDENCIA EN LA CIUDAD DE AYUTLA DE LOS LIBRES, GUERRERO, PARA\nQUE SE CONSTITUYA AL DISTRITO NOTARIAL DE TABARES, CON RESIDENCIA EN LA CIUDAD Y\nPUERTO DE ACAPULCO, GUERRERO, A OCUPAR LA NOTARÍA PÚBLICA NÚMERO ONCE, EL\nCUAL OBRA EN LOS ARCHIVOS DE ESTA DIRECCIÓN GENERAL.\nSE EXTIENDE LA PRESENTE PARA LOS EFECTOS LEGALES A QUE HAYA LUGAR, A\nLOS TREINTA DÍAS DEL MES DE MAYO DEL AÑO DOS MIL CATORCE, EN LA CIUDAD DE\nCHILPANCINGO, CAPITAL DEL ESTADO DE GUERRERO.- CONSTE.- Rúbrica.",
  "ordenamiento": "ACUERDO",
  "jurisdiccion": "GUERRERO",
  "fuente_oficial": "DIARIO OFICIAL DE LA FEDERACION",
  "Fecha de Publicación": "03 de Junio de 2014",
  "ULTIMA REFORMA PUBLICADA": null,
  "status": "VIGENTE",
  "es_escaneado": false,
  "tiene_tablas": false,
  "materia": [
    "general"
  ]
}