{
  "titulo": "Acuerdo por el Que Se Delega al Director General Jurídico Consultivo de la Procuraduría General de J",
  "Contenido": "ESTADO, LA FACULTAD PARA FIRMAR LAS\nRESOLUCIONES DE EJERCICIO DE LA ACCIÓN\nPENAL, NO EJERCICIO DE LA ACCIÓN PENAL Y SU\nARCHIVO DEFINITIVO, RESPECTO DE LAS\nCONSULTAS QUE REALICEN LOS AGENTES DEL\nMINISTERIO PÚBLICO DEL ESTADO.\nTEXTO ORIGINAL\nAcuerdo publicado en el Periódico Oficial del Gobierno del Estado No. 20, el\nViernes 9 de Marzo de 2007.\nACUERDO POR EL QUE SE DELEGA AL DIRECTOR GENERAL JURÍDICO\nCONSULTIVO DE LA PROCURADURÍA GENERAL DE JUSTICIA DEL ESTADO, LA\nFACULTAD PARA FIRMAR LAS RESOLUCIONES DE EJERCICIO DE LA ACCIÓN\nPENAL, NO EJERCICIO DE LA ACCIÓN PENAL Y SU ARCHIVO DEFINITIVO,\nRESPECTO DE LAS CONSULTAS QUE REALICEN LOS AGENTES DEL MINISTERIO\nPÚBLICO DEL ESTADO.\nLICENCIADO EDUARDO MURRUETA URRUTIA, PROCURADOR GENERAL\nDE JUSTICIA DEL ESTADO, EN EJERCICIO DE LAS FACULTADES QUE ME\nGUERRERO; 29 FRACCIÓN XVIII DE LA LEY ORGÁNICA DE LA PROCURADURÍA\nGENERAL DE JUSTICIA DEL ESTADO NÚMERO 193 Y 5 DEL REGLAMENTO DE\nDICHA LEY, Y\nQue de conformidad con lo dispuesto en el artículo 78 de la Constitución Política\nGeneral de Justicia del Estado Número 193 y el 8 del Reglamento de dicha Ley, se establece que el Procurador es el titular de la Institución del Ministerio Público.\nQue el artículo 11 fracciones IX y XIII de la Ley Orgánica de la Procuraduría\nGeneral de Justicia del Estado Número 193, y 11 fracciones VI y VII Del Reglamento de la Ley antes aludida; disponen como atribución del Ministerio Público determinar los requisitos del artículo 16 Constitucional y los previstos en las leyes de la materia, disponiendo el archivo de la averiguación.\nESTADO, LA FACULTAD PARA FIRMAR LAS\nRESOLUCIONES DE EJERCICIO DE LA ACCIÓN\nPENAL, NO EJERCICIO DE LA ACCIÓN PENAL Y SU\nARCHIVO DEFINITIVO, RESPECTO DE LAS\nCONSULTAS QUE REALICEN LOS AGENTES DEL\nMINISTERIO PÚBLICO DEL ESTADO.\nQue conforme a los artículos 6 y 9 del Reglamento de la Ley de la Procuraduría\nGeneral de Justicia del Estado Número 193, la representación, trámite y resolución de los asuntos recompetencia de esta Institución, corresponden al Procurador General; asimismo la Ley Orgánica de la Procuraduría General de Justicia del Estado Número\n193, establece en su numeral 30 que el Procurador, para el desempeño y despacho de los asuntos de sus competencia, se auxiliará de diversas unidades administrativas, entre ellas la Dirección General Jurídica Consultiva, con el objeto de obtener una mejor distribución y desarrollo del trabajo; mientras que el diverso numeral 49 del mismo ordenamiento establece que podrá delegar sus funciones en los servidores públicos a cargo de dichas unidades, excepto aquellas indelegables mencionadas en el artículo 29 de esa misma Ley.\nQue el artículo 44 fracciones V y XIII del Reglamento de la Ley Orgánica de la\nProcuraduría General de Justicia del Estado Número 193, dispone que la Dirección\nGeneral Jurídica Consultiva, tiene atribuciones para dictaminar en materia de no ejercicio de la acción penal, archivo de la Averiguación Previa y procedencia solo respecto del delito de despojo.\nPor lo anterior, y considerando que dicha atribución de la Dirección citada es limitada, he tenido a bien dictar el siguiente:\nPRIMERO.- Se delega en el Director General Jurídico Consultivo, la facultad que le confiere al suscrito el artículo 11 fracciones IX y XIII de la Ley Orgánica de la\nProcuraduría General de Justicia del Estado Número 193, y 11 fracciones VI y VII del ejercicio de la acción penal, no ejercicio de la acción penal y su archivo definitivo, respecto de las consultas que realicen los Agentes del Ministerio Público del Estado.\nESTADO, LA FACULTAD PARA FIRMAR LAS\nRESOLUCIONES DE EJERCICIO DE LA ACCIÓN\nPENAL, NO EJERCICIO DE LA ACCIÓN PENAL Y SU\nARCHIVO DEFINITIVO, RESPECTO DE LAS\nCONSULTAS QUE REALICEN LOS AGENTES DEL\nMINISTERIO PÚBLICO DEL ESTADO.\nSEGUNDO.- Se le faculta también a firmar las resoluciones de prescripción, cumplimentación, reserva e incompetencia.\nTERCERO.- De las resoluciones que firme, deberá dar debida cuenta al suscrito en sus acuerdos previos inmediatos a la firma de las mismas, o antes en casos relevantes.\nPRIMERO.- Publíquese el presente en el Periódico Oficial del Gobierno del la Procuraduría General de Justicia del Estado Número 193.\nSEGUNDO.- Este Acuerdo entrará en vigor al día siguiente de su publicación.\nDado en la Ciudad de Chilpancingo, Capital del Estado de Guerrero, a los veintidós días del mes de febrero del dos mil siete.\nEL PROCURADOR GENERAL DE JUSTICIA DEL ESTADO.\nC. LIC. EDUARDO MURUETA URRUTIA.\nRúbrica.",
  "ordenamiento": "ACUERDO",
  "jurisdiccion": "GUERRERO",
  "fuente_oficial": "DIARIO OFICIAL DE LA FEDERACION",
  "Fecha de Publicación": "9 de Marzo de 2007",
  "ULTIMA REFORMA PUBLICADA": null,
  "status": "VIGENTE",
  "es_escaneado": false,
  "tiene_tablas": false,
  "materia": [
    "penal"
  ]
}