{
  "titulo": "Acuerdo General del H. Pleno del Consejo de la Judicatura del Poder Judicial del Estado de Guerrero,",
  "Contenido": "MEDIO DEL CUAL SE INSTITUYE EL “DÍA DEL\nSERVIDOR PÚBLICO JUDICIAL DEL ESTADO”\nTEXTO ORIGINAL\nACUERDO GENERAL DEL H. PLENO DEL CONSEJO DE LA JUDICATURA DEL\nPODER JUDICIAL DEL ESTADO DE GUERRERO, POR MEDIO DEL CUAL SE\nINSTITUYE EL \"DÍA DEL SERVIDOR PÚBLICO JUDICIAL DEL ESTADO\" y, PRIMERO.- Que el Estado de Guerrero se erigió el 27 de octubre de 1849, gracias a la insistencia del General Juan Álvarez Hurtado y al entonces Presidente de la\nRepublica, Don José Joaquín De Herrera, quien expidió el decreto de creación el 15 de mayo de ese año;\nSEGUNDO.- Que el primer Gobernador del Estado, fue el General Juan Álvarez\nHurtado, quien el 16 de marzo de 1850, expide la Ley Orgánica Provisional para el\nArreglo Interior del Estado;\nTERCERO.- Que en dicha Ley Orgánica se señalaba que hasta en tanto el\nCongreso del Estado expidiera \"Leyes Particulares\" que debían regirlo, cada territorio\n(Distrito Judicial) se arreglaría, para la Administración de Justicia, a las que estaban vigentes en el Estado a que pertenecían al tiempo de declarase el Estado de Guerrero;\nCUARTO.- Que el 22 de marzo de 1852, se propone y se aprueban los primeros nombramientos de los Magistrados que integrarían el H. Tribunal Superior de Justicia de la Entidad, los cuales recayeron en los Lics. Rafael Solares, José N. Lavin, Antonio\nNoriega Miguel Quiñónez, como Primer, Segundo y Tercer Ministro y Fiscal, respectivamente.\nSuperior de Justicia, el Consejo de la Judicatura, los Juzgados de Primera Instancia, establece esta Ley; además de que cuenta con plena autonomía para el ejercicio de sus funciones y atribuciones, así como para el ejercicio de su presupuesto de egresos.\nMEDIO DEL CUAL SE INSTITUYE EL “DÍA DEL\nSERVIDOR PÚBLICO JUDICIAL DEL ESTADO”\nSEXTO.- Que dentro de las atribuciones del Consejo de la Judicatura, se encuentran las fundamentadas en el artículo 83 párrafo décimo de la Constitución\nPoder Judicial del Estado, facultando a este Órgano Colegiado, a expedir acuerdos generales para el adecuado ejercicio de las funciones jurisdiccionales, por lo que, en base a ello, resulta de suma importancia realizar el presente acuerdo general.\nPor lo anteriormente expuesto y fundado, el Pleno del Consejo de la Judicatura del Poder Judicial del Estado de Guerrero, expide el siguiente;\nACUERDO GENERAL DEL H. PLENO DEL CONSEJO DE LA JUDICATURA DEL\nPODER JUDICIAL DEL ESTADO DE GUERRERO, POR MEDIO DEL CUAL SE\nINSTITUYE EL \"DÍA DEL SERVIDOR PUBLICO JUDICIAL DEL ESTADO\".\nPRIMERO.- Se instituye el \"DÍA DEL SERVIDOR PUBLICO JUDICIAL DEL\nESTADO\", para conmemorar la instalación formal del Poder Judicial del Estado de\nGuerrero.\nSEGUNDO.- El \"DÍA DEL SERVIDOR PUBLICO JUDICIAL DEL ESTADO\", se conmemorará el \"22 de marzo\" de cada año, en un acto publico y solemne, presidido por los HH. Plenos del Tribunal Superior de Justicia y del Consejo de la Judicatura del\nEstado.\nTERCERO.- Para celebrar el \"DÍA DEL SERVIDOR PUBLICO JUDICIAL DEL\nESTADO\", se realizarán diversas actividades de producción, edición, difusión, exposiciones, conferencias, cursos, entrega de reconocimientos, estímulos y demás\nJudicial.\nCUARTO.- Los reconocimientos, estímulos y premios en su caso, se entregaran a\nPRIMERO.- Este acuerdo entrará en vigor el día de su aprobación.\nMEDIO DEL CUAL SE INSTITUYE EL “DÍA DEL\nSERVIDOR PÚBLICO JUDICIAL DEL ESTADO”\nSEGUNDO.- Remítase al Pleno del Tribunal Superior de Justicia del Estado, para su conocimiento y efectos.\nTERCERO.- El Tribunal Superior de Justicia y el Consejo de la Judicatura del\nEstado, previo informe rendido por las respectivas Secretarias Generales, resolverán cualquier cuestión que pudiera suscitarse.\nCUARTO.- Publíquese este acuerdo en el Periódico Oficial del Gobierno del\nEstado, para difusión del publico en general; y hágase del conocimiento de los\nMagistrados, Jueces de Primera Instancia, de Paz y demás personal del poder Judicial para su conocimiento.\nACUERDO APROBADO POR UNANIMIDAD DEL PLENO DEL CONSEJO DE LA\nJUDICATRURA DEL PODER JUDICIAL DEL ESTADO DE GUERRERO, EN SESIÓN\nORDINARIA DEL DÍA DIECISIETE DE MARZO DEL DOS MIL DIEZ.\nEL MAGISTRADO PRESIDENTE.\nDR. EDMUNDO ROMÁN PINZÓN.\nRúbrica.\nEL SECRETARIO GENERAL DEL CONSEJO.\nLIC. GOZALO SANTOS SALAZAR.\nRúbrica.\nEL SUSCRITO LICENCIADO GONZALO SANTOS SALAZAR, SECRETARIO\nGENERAL DEL CONSEJO DE LA JUDICATURA DEL ESTADO.\nQue la presente copia fotostática, constante de cuatro fojas útiles, concuerda fielmente con su original que tuve a la vista, y que obra en esta Secretaría General, relativo al acuerdo general emitido por el Pleno del Consejo de la Judicatura del Estado, en sesión ordinaria de diecisiete de marzo de dos mil diez, por el que se instituye el veintidós de marzo, como día del Servidor Público Judicial del Estado. Lo que certifico\nMEDIO DEL CUAL SE INSTITUYE EL “DÍA DEL\nSERVIDOR PÚBLICO JUDICIAL DEL ESTADO” para todos los efectos legales a que haya lugar, en la Ciudad de Chilpancigo, Guerrero, a los siete días del mes de abril de dos mil diez.- Doy Fe.Rúbrica.",
  "ordenamiento": "ACUERDO",
  "jurisdiccion": "GUERRERO",
  "fuente_oficial": "DIARIO OFICIAL DE LA FEDERACION",
  "Fecha de Publicación": "27 de Abril de 2010",
  "ULTIMA REFORMA PUBLICADA": null,
  "status": "VIGENTE",
  "es_escaneado": false,
  "tiene_tablas": false,
  "materia": [
    "judicial"
  ]
}