{
  "titulo": "Acuerdo por el Que Se Da A Conocer la Distribución y Calendarización de los Recursos del Fondo IV de",
  "Contenido": "LA MINISTRACIÓN DE LOS RECURSOS\nCORRESPONDIENTES AL FONDO IV DEL RAMO\n33 “FONDO DE APORTACIONES PARA EL\nFORTALECIMIENTO DE LOS MUNICIPIOS Y DE\nLAS DEMARCACIONES TERRITORIALES DEL\nDISTRITO FEDERAL” (FORTAMUN-DF) PARA EL\nEJERCICIO FISCAL DEL 2006.\nABROGADO POR CONCLUIDA SU VIGENCIA HASTA EL 31 DE DICIEMBRE\nDE 2006.\nTEXTO ORIGINAL.\nAcuerdo publicado en el Periódico Oficial del Gobierno del Estado No. 9, el\nMartes 31 de Enero de 2006.\nACUERDO POR EL QUE SE DA A CONOCER LA DISTRIBUCIÓN Y\nCALENDARIZACIÓN DE LOS RECURSOS DEL FONDO IV DEL RAMO 33 “FONDO\nDE APORTACIONES PARA EL FORTALECIMIENTO DE LOS MUNICIPIOS Y DE LAS\nDEMARCACIONES TERRITORIALES DEL DISTRITO FEDERAL” (FORTAMUN-DF)\nPARA EL EJERCICIO FISCAL DEL 2006.\nAl margen un sello con el Escudo Nacional que dice: Gobierno del Estado Libre y\nSoberano de Guerrero.- Poder Ejecutivo.\nCARLOS ZEFERINO TORREBLANCA GALINDO, GOBERNADOR\nEJERCICIO DE LAS FACULTADES QUE ME CONFIERE EL ARTÍCULO 74 DE LA\n3, 4, 10, 12 Y 13 DE LA LEY DE PLANEACIÓN DEL ESTADO DE GUERRERO, 4, 6, 7 Y\n18 FRACCIÓN II Y 21 DE LA LEY ORGÁNICA DE LA ADMINISTRACIÓN PÚBLICA DEL\nESTADO; Y DE ACUERDO A LOS ARTÍCULOS 26 Y 115 DE LA CONSTITUCIÓN\nPOLÍTICA DE LOS ESTADOS UNIDOS MEXICANOS, 27, 31, 32 Y 37 DE LA LEY\nORGÁNICA DE LA ADMINISTRACIÓN PÚBLICA FEDERAL; 33, 34, 35 Y 44 DE LA LEY\nDE PLANEACIÓN; 25, 36, 37 Y 38 DE LA LEY DE COORDINACIÓN FISCAL, 13 DEL\nEJERCICIO FISCAL DEL 2006; Y\nLA MINISTRACIÓN DE LOS RECURSOS\nCORRESPONDIENTES AL FONDO IV DEL RAMO\n33 “FONDO DE APORTACIONES PARA EL\nFORTALECIMIENTO DE LOS MUNICIPIOS Y DE\nLAS DEMARCACIONES TERRITORIALES DEL\nDISTRITO FEDERAL” (FORTAMUN-DF) PARA EL\nEJERCICIO FISCAL DEL 2006.\nQue el artículo 13 del Presupuesto de Egresos de la Federación para el ejercicio fiscal 2006, prevé recursos en el Ramo 33 Aportaciones Federales para Entidades\nFederativas y Municipios, para el Fondo de Aportaciones para el Fortalecimiento de los\nMunicipios y de las Demarcaciones Territoriales del Distrito Federal.\nQue el ejercicio de los recursos que integran el Ramo 33 deberá apegarse a la distribución, condiciones y términos que establece el capítulo V de la Ley de\nCoordinación Fiscal, y no podrán ser erogados con fines distintos a los que ahí se señalan.\nQue la Secretaría de Hacienda y Crédito Público, es la encargada de ministrar a cada entidad federativa, y a través de éstas a los municipios, los montos correspondientes de cada uno de los fondos que conforman el citado Ramo 33.\nQue Ley de Coordinación Fiscal en el capítulo V, artículo 36 establece que “Los cada Municipio o Demarcación Territorial por concepto de este Fondo, así como el calendario de ministraciones, a más tardar el 31 de enero de cada año”.\nRamo 33, específicamente los del Fondo IV “Fondo de Aportaciones para el\nEstado de Guerrero, he tenido a bien expedir el siguiente:\nLA MINISTRACIÓN DE LOS RECURSOS\nCORRESPONDIENTES AL FONDO IV DEL RAMO\n33 “FONDO DE APORTACIONES PARA EL\nFORTALECIMIENTO DE LOS MUNICIPIOS Y DE\nLAS DEMARCACIONES TERRITORIALES DEL\nDISTRITO FEDERAL” (FORTAMUN-DF) PARA EL\nEJERCICIO FISCAL DEL 2006.\nACUERDO POR EL QUE SE DA CONOCER A LOS MUNICIPIOS DEL ESTADO DE\nGUERRERO, LA DISTRIBUCIÓN Y CALENDARIZACIÓN PARA LA MINISTRACIÓN\nDE LOS RECURSOS CORRESPONDIENTES AL FONDO IV DEL RAMO 33 “FONDO\nDE APORTACIONES PARA EL FORTALECIMIENTO DE LOS MUNICIPIOS Y DE LAS\nDEMARCACIONES TERRITORIALES DEL DISTRITO FEDERAL” (FORTAMUN-DF)\nPARA EL EJERCICIO FISCAL DEL 2006.\nARTÍCULO PRIMERO.- El presente Acuerdo tiene por objeto dar a conocer la fórmula, la distribución y calendarización de las ministraciones de recursos autorizados por el Estado de Guerrero del Fondo IV del Ramo 33 “Fondo de Aportaciones para el\nFortalecimiento de los Municipios y de las Demarcaciones Territoriales del Distrito\nFederal” para el ejercicio fiscal del 2006.\nARTÍCULO SEGUNDO.- Los recursos del FORTAMUN-DF se distribuyen en proporción directa al número de habitantes con que cuenta cada uno de los municipios.\nLa asignación del FORTAMUN-DF para el iésimo municipio se determina mediante la aplicación de la siguiente fórmula: i 2000 i 2000\nX MAFFMEG\nDonde:\nAFFMM…=…Asignación para el año 2006, del Fondo de Fortalecimiento\nMunicipal para el iésimo municipio.\nP M = Población del año 2000 del iésimo municipio.\n2000 i\nP EG = Población del año 2000 del Estado de Guerrero.\nLA MINISTRACIÓN DE LOS RECURSOS\nCORRESPONDIENTES AL FONDO IV DEL RAMO\n33 “FONDO DE APORTACIONES PARA EL\nFORTALECIMIENTO DE LOS MUNICIPIOS Y DE\nLAS DEMARCACIONES TERRITORIALES DEL\nDISTRITO FEDERAL” (FORTAMUN-DF) PARA EL\nEJERCICIO FISCAL DEL 2006.\nMAFFMEG…=…Monto autorizado del Fortamun al Estado de Guerrero para el ejercicio fiscal 2006.\nARTÍCULO TERCERO.- La Secretaría de Hacienda y Crédito Público, publicó el\nAcuerdo mediante el cual se da a conocer la distribución y calendarización para la ministración de los recursos correspondientes al Ramo 33 Aportaciones Federales para\nEntidades Federativas y Municipios, a que se refiere el Artículo V de la Ley de\nCoordinación Fiscal.\nAutorizándole al Estado de Guerrero $901,904,306.00 (Novecientos un millones novecientos cuatro mil trescientos seis pesos 00/100 M. N.) del Fondo de Aportaciones para el Fortalecimiento de Entidades Federativas y Municipios y de las Demarcaciones\nTerritoriales del Distrito Federal, recursos que el Estado de Guerrero debe entregar a los municipios de conformidad a lo establecido en el último párrafo del Artículo 38 de la Ley de Coordinación Fiscal.\nARTÍCULO CUARTO.- La información utilizada en la aplicación de las fórmulas establecidas para la distribución del FORTAMUN-DF entre los municipios, es la siguiente:\nCM MUNICIPIO POBLACION 2000\nGUERRERO 3,079,649\n1 ACAPULCO DE JUAREZ 722,499\n2 ACATEPEC 25,060\n3 AHUACUOTZINGO 19,388\n4 AJUCHITLAN DEL PROGRESO 41,266\n5 ALCOZAUCA DE GUERRERO 15,828\n6 ALPOYECA 6,062\n7 APAXTLA 13,146\n8 ARCELIA 32,818\nLA MINISTRACIÓN DE LOS RECURSOS\nCORRESPONDIENTES AL FONDO IV DEL RAMO\n33 “FONDO DE APORTACIONES PARA EL\nFORTALECIMIENTO DE LOS MUNICIPIOS Y DE\nLAS DEMARCACIONES TERRITORIALES DEL\nDISTRITO FEDERAL” (FORTAMUN-DF) PARA EL\nEJERCICIO FISCAL DEL 2006.\n9 ATENANGO DEL RIO 8,504\n10 ATLAMAJALCINGO DEL MONTE 5,080\n11 ATLIXTAC 21,407\n12 ATOYAC DE ALVAREZ 61,736\n13 AYUTLA DE LOS LIBRES 55,350\n14 AZOYU 15,290\n15 BENITO JUAREZ 15,448\n16 BUENA VISTA DE CUELLAR 12,619\n17 CHILAPA DE ALVAREZ 88,322\n18 CHILPANCINGO DE LOS BRAVO 192,947\n19 COAHUAYUTLA DE J. MA. IZAZAGA 15,372\n20 COCHOAPA EL GRANDE 13,046\n21 COCULA 15,666\n22 COPALA 13,060\n23 COPALILLO 12,730\n24 COPANATOYAC 15,753\n25 COYUCA DE BENITEZ 69,059\n26 COYUCA DE CATALAN 46,172\n27 CUAJINICUILAPA 25,167\n28 CUALAC 6,575\n29 CUATEPEC 15,156\n30 CUETZALA DEL PROGRESO 9,869\n31 CUTZAMALA DE PINZON 26,166\n32 EDUARDO NERI 40,064\n33 FLORENCIO VILLARREAL 19,061\n34 GENERAL CANUTO A. NERI 7,687\n35 GENERAL HELIODORO CASTILLO 35,625\n36 HUAMUXTITLAN 14,291\n37 HUITZUCO DE LOS FIGUEROA 35,668\n38 IGUALA DE LA INDEPENDENCIA 123,960\nLA MINISTRACIÓN DE LOS RECURSOS\nCORRESPONDIENTES AL FONDO IV DEL RAMO\n33 “FONDO DE APORTACIONES PARA EL\nFORTALECIMIENTO DE LOS MUNICIPIOS Y DE\nLAS DEMARCACIONES TERRITORIALES DEL\nDISTRITO FEDERAL” (FORTAMUN-DF) PARA EL\nEJERCICIO FISCAL DEL 2006.\n39 IGUALAPA 10,192\n40 ILIATENCO 12,770\n41 IXCATEOPAN DE CUAUHTEMOC 7,119\n42 JOSE AZUETA 95,548\n43 JOSE JOAQUIN DE HERRERA 14,531\n44 JUAN R. ESCUDERO 23,012\n45 JUCHITAN 6,591\n46 LEONARDO BRAVO 22,906\n47 MALINALTEPEC 23,360\n48 MARTIR DE CUILAPAN 13,801\n49 MARQUELIA 10,993\n50 METLATONOC 16,993\n51 MOCHITLAN 10,133\n52 OLINALA 22,645\n53 OMETEPEC 50,356\n54 PEDRO ASCENCIO ALQUISIRAS 7,852\n55 PETATLAN 46,328\n56 PILCAYA 10,851\n57 PUNGARABATO 34,740\n58 QUECHULTENANGO 32,541\n59 SAN LUIS ACATLAN 35,608\n60 SAN MARCOS 47,764\n61 SAN MIGUEL TOTOLAPAN 28,986\n62 TAXCO DE ALARCON 100,245\n63 TECOANAPA 43,128\n64 TECPAN DE GALEANA 60,313\n65 TELOLOAPAN 53,950\n66 TEPECOACUILCO DE TRUJANO 30,838\n67 TETIPAC 13,318\n68 TIXTLA DE GUERRERO 33,620\nLA MINISTRACIÓN DE LOS RECURSOS\nCORRESPONDIENTES AL FONDO IV DEL RAMO\n33 “FONDO DE APORTACIONES PARA EL\nFORTALECIMIENTO DE LOS MUNICIPIOS Y DE\nLAS DEMARCACIONES TERRITORIALES DEL\nDISTRITO FEDERAL” (FORTAMUN-DF) PARA EL\nEJERCICIO FISCAL DEL 2006.\n69 TLACOACHISTLAHUACA 15,696\n70 TLACOAPA 9,195\n71 TLALCHAPA 12,942\n72 TLALIXTAQUILLA DE MALDONADO 6,699\n73 TLAPA DE COMONFORT 57,346\n74 TLAPEHUALA 22,677\n75 UNION DE I. MONTES DE OCA, LA 27,619\n76 XALPATLAHUAC 11,687\n77 XOCHISTLAHUACA 22,781\n78 XOCHIHUEHUETLAN 7,863\n79 ZAPOTITLAN TABLAS 10,271\n80 ZIRANDARO 23,563\n81 ZITLALA 17,361\nLa fuente de información es: Tabulados Básicos Nacionales y por Entidad\nFederativa, Base de Datos y Tabulados de la Muestra Censal. XII Censo General de\nPoblación y Vivienda 2000. Instituto Nacional de Estadística, Geografía e Informática\n(INEGI). Aguascalientes, Aguascalientes 2001.\nIliatenco, a la población registrada por el XII Censo General de Población y Vivienda\n2000 de los municipios de Malinaltepec y San Luis Acatlán, se les restó la población de las localidades que conformarán el nuevo municipio.\nARTÍCULO QUINTO.- El monto autorizado del Fondo de Aportaciones para el\n(FORTAMUN-DF) es de $901,904,306.00 (Novecientos un millones novecientos cuatro mil trescientos seis pesos 00/100 M. N.) los cuales se distribuyen conforme a lo\nLA MINISTRACIÓN DE LOS RECURSOS\nCORRESPONDIENTES AL FONDO IV DEL RAMO\n33 “FONDO DE APORTACIONES PARA EL\nFORTALECIMIENTO DE LOS MUNICIPIOS Y DE\nLAS DEMARCACIONES TERRITORIALES DEL\nDISTRITO FEDERAL” (FORTAMUN-DF) PARA EL\nEJERCICIO FISCAL DEL 2006. establecido en el Artículo Segundo del presente Acuerdo, obteniéndose las asignaciones siguientes:\nCM MUNICIPIO ASIGNACION (PESOS)\nANUAL MENSUAL\nGUERRERO 901,904,306.00 75,158,692.17\n1 ACAPULCO DE JUAREZ 211,590,658.28 17,632,554.86\n2 ACATEPEC 7,339,057.77 611,588.15\n3 AHUACUOTZINGO 5,677,958.98 473,163.25\n4 AJUCHITLAN DEL PROGRESO 12,085,137.98 1,007,094.83\n5 ALCOZAUCA DE GUERRERO 4,635,379.34 386,281.61\n6 ALPOYECA 1,775,313.97 147,942.83\n7 APAXTLA 3,849,930.30 320,827.53\n8 ARCELIA 9,611,061.36 800,921.78\n9 ATENANGO DEL RIO 2,490,476.75 207,539.73\n10 ATLAMAJALCINGO DEL MONTE 1,487,726.00 123,977.17\n11 ATLIXTAC 6,269,242.20 522,436.85\n12 ATOYAC DE ALVAREZ 18,079,970.88 1,506,664.24\n13 AYUTLA DE LOS LIBRES 16,209,770.44 1,350,814.20\n14 AZOYU 4,477,820.96 373,151.75\n15 BENITO JUAREZ 4,524,092.75 377,007.73\n16 BUENA VISTA DE CUELLAR 3,695,593.37 307,966.11\n17 CHILAPA DE ALVAREZ 25,865,932.16 2,155,494.35\n18 CHILPANCINGO DE LOS BRAVO 56,506,351.90 4,708,862.66\n19 COAHUAYUTLA DE J. MA. IZAZAGA 4,501,835.43 375,152.95\n20 COCHOAPA EL GRANDE 3,820,644.36 318,387.03\n21 COCULA 4,587,936.11 382,328.01\n22 COPALA 3,824,744.39 318,728.70\n23 COPALILLO 3,728,100.77 310,675.06\n24 COPANATOYAC 4,613,414.88 384,451.24\nLA MINISTRACIÓN DE LOS RECURSOS\nCORRESPONDIENTES AL FONDO IV DEL RAMO\n33 “FONDO DE APORTACIONES PARA EL\nFORTALECIMIENTO DE LOS MUNICIPIOS Y DE\nLAS DEMARCACIONES TERRITORIALES DEL\nDISTRITO FEDERAL” (FORTAMUN-DF) PARA EL\nEJERCICIO FISCAL DEL 2006.\n25 COYUCA DE BENITEZ 20,224,580.62 1,685,381.72\n26 COYUCA DE CATALAN 13,521,906.43 1,126,825.54\n27 CUAJINICUILAPA 7,370,393.73 614,199.48\n28 CUALAC 1,925,550.87 160,462.57\n29 CUATEPEC 4,438,577.79 369,881.48\n30 CUETZALA DEL PROGRESO 2,890,229.89 240,852.49\n31 CUTZAMALA DE PINZON 7,662,960.31 638,580.03\n32 EDUARDO NERI 11,733,120.92 977,760.08\n33 FLORENCIO VILLARREAL 5,582,193.94 465,182.83\n34 GENERAL CANUTO A. NERI 2,251,210.58 187,600.88\n35 GENERAL HELIODORO CASTILLO 10,433,117.83 869,426.49\n36 HUAMUXTITLAN 4,185,254.37 348,771.20\n37 HUITZUCO DE LOS FIGUEROA 10,445,710.79 870,475.90\n38 IGUALA DE LA INDEPENDENCIA 36,302,857.17 3,025,238.10\n39 IGUALAPA 2,984,823.49 248,735.29\n40 ILIATENCO 3,739,815.15 311,651.26\n41 IXCATEOPAN DE CUAUHTEMOC 2,084,866.41 173,738.87\n42 JOSE AZUETA 27,982,134.53 2,331,844.54\n43 JOSE JOAQUIN DE HERRERA 4,255,540.64 354,628.39\n44 JUAN R. ESCUDERO 6,739,281.62 561,606.80\n45 JUCHITAN 1,930,236.62 160,853.05\n46 LEONARDO BRAVO 6,708,238.51 559,019.88\n47 MALINALTEPEC 6,841,196.70 570,099.73\n48 MARTIR DE CUILAPAN 4,041,753.24 336,812.77\n49 MARQUELIA 3,219,403.91 268,283.66\n50 METLATONOC 4,976,560.60 414,713.38\n51 MOCHITLAN 2,967,544.79 247,295.40\n52 OLINALA 6,631,802.20 552,650.18\n53 OMETEPEC 14,747,230.36 1,228,935.86\n54 PEDRO ASCENCIO ALQUISIRAS 2,299,532.39 191,627.70\nLA MINISTRACIÓN DE LOS RECURSOS\nCORRESPONDIENTES AL FONDO IV DEL RAMO\n33 “FONDO DE APORTACIONES PARA EL\nFORTALECIMIENTO DE LOS MUNICIPIOS Y DE\nLAS DEMARCACIONES TERRITORIALES DEL\nDISTRITO FEDERAL” (FORTAMUN-DF) PARA EL\nEJERCICIO FISCAL DEL 2006.\n55 PETATLAN 13,567,592.50 1,130,632.71\n56 PILCAYA 3,177,817.87 264,818.16\n57 PUNGARABATO 10,173,937.22 847,828.10\n58 QUECHULTENANGO 9,529,939.30 794,161.61\n59 SAN LUIS ACATLAN 10,428,139.22 869,011.60\n60 SAN MARCOS 13,988,138.67 1,165,678.22\n61 SAN MIGUEL TOTOLAPAN 8,488,823.96 707,402.00\n62 TAXCO DE ALARCON 29,357,695.36 2,446,474.61\n63 TECOANAPA 12,630,442.27 1,052,536.86\n64 TECPAN DE GALEANA 17,663,231.88 1,471,935.99\n65 TELOLOAPAN 15,799.767.22 1,316,647.27\n66 TEPECOACUILCO DE TRUJANO 9.031,199.66 752,599.97\n67 TETIPAC 3,900,302.13 325,025.18\n68 TIXTLA DE GUERRERO 9,845,934.64 820,494.55\n69 TLACOACHISTLAHUACA 4,596,721.89 383,060.16\n70 TLACOAPA 2,692,842.62 224,403.55\n71 TLALCHAPA 3,790,186.98 315,848.91\n72 TLALIXTAQUILLA DE MALDONADO 1,961,865.44 163,488.79\n73 TLAPA DE COMONFORT 16,794,317.90 1,399,526.49\n74 TLAPEHUALA 6,641,173.70 553,431.14\n75 UNION DE I. MONTES DE OCA, LA 8,088,485.09 674,040.42\n76 XALPATLAHUAC 3,422,648.37 285,220.70\n77 XOCHISTLAHUACA 6,671,631.08 555,969.26\n78 XOCHIHUEHUETLAN 2,302,753.84 191,896.15\n79 ZAPOTITLAN TABLAS 3,007,959.39 250,663.28\n80 ZIRANDARO 6,900,647.17 575,053.93\n81 ZITLALA 5,084,332.88 423,694.41\nLA MINISTRACIÓN DE LOS RECURSOS\nCORRESPONDIENTES AL FONDO IV DEL RAMO\n33 “FONDO DE APORTACIONES PARA EL\nFORTALECIMIENTO DE LOS MUNICIPIOS Y DE\nLAS DEMARCACIONES TERRITORIALES DEL\nDISTRITO FEDERAL” (FORTAMUN-DF) PARA EL\nEJERCICIO FISCAL DEL 2006.\nARTÍCULO SEXTO.- Conforme a la Ley de Coordinación Fiscal, el calendario de entrega a los municipios de los recursos del FORTAMUN-DF para el ejercicio fiscal 2006 será:\nCalendario de fechas de pago 2006\nMES FORTAMUN\nEnero 31-01-06\nFebrero 28-02-06\nMarzo 31-03-06\nAbril 28-04-06\nMayo 31-05-06\nJunio 30-06-06\nJulio 31-07-06\nAgosto 31-08-06\nÚNICO.- El presente Acuerdo entrará en vigor a partir del día siguiente de su\nBravo, Guerrero, a los treinta y un días del mes de enero del año dos mil seis.\nLA MINISTRACIÓN DE LOS RECURSOS\nCORRESPONDIENTES AL FONDO IV DEL RAMO\n33 “FONDO DE APORTACIONES PARA EL\nFORTALECIMIENTO DE LOS MUNICIPIOS Y DE\nLAS DEMARCACIONES TERRITORIALES DEL\nDISTRITO FEDERAL” (FORTAMUN-DF) PARA EL\nEJERCICIO FISCAL DEL 2006.\nGOBERNADOR CONSTITUCIONAL DEL ESTADO.\nC.P. CARLOS ZEFERINO TORREBLANCA GALINDO.\nRúbrica.\nSECRETARIO GENERAL DE GOBIERNO.\nLIC. ARMANDO CHAVARRÍA BARRERA.\nRúbrica.\nSECRETARIO DE FINANZAS Y ADMINISTRACIÓN.\nC.P. CARLOS ÁLVAREZ REYES.\nRúbrica.",
  "ordenamiento": "ACUERDO",
  "jurisdiccion": "GUERRERO",
  "fuente_oficial": "DIARIO OFICIAL DE LA FEDERACION",
  "Fecha de Publicación": "25 de Noviembre de 2005",
  "ULTIMA REFORMA PUBLICADA": "31 de Enero de 2006",
  "status": "ABROGADA",
  "es_escaneado": false,
  "tiene_tablas": true,
  "materia": [
    "general"
  ]
}