{
  "titulo": "Acuerdo por el Que Se Emite el Catálogo General de Puestos de la Administración Pública Centralizada",
  "Contenido": "GUERRERO\nTEXTO ORIGINAL.\nADMINISTRACIÓN PÚBLICA CENTRALIZADA DEL ESTADO DE GUERRERO.\nGuerrero.- Poder Ejecutivo.\nLICENCIADO TULIO SAMUEL PÉREZ CALVO, SECRETARIO DE FINANZAS Y\nADMINISTRACIÓN DEL ESTADO DE GUERRERO Y MTRO. EDUARDO GERARDO LORIA\nCASANOVA, SECRETARIO DE CONTRALORÍA Y TRANSPARENCIA GUBERNAMENTAL, CON\nFUNDAMENTO EN LO DISPUESTO POR LOS ARTÍCULOS 87 Y 88 DE LA CONSTITUCIÓN\nFACULTADES QUE NOS CONFIEREN LOS ARTÍCULOS 3, 7, 10, 11, 18 APARTADO A\nFRACCIÓN III, 22 FRACCIÓN I Y 39 FRACCIONES VIII Y IX DE LA LEY ORGÁNICA DE LA\nADMINISTRACIÓN PÚBLICA DEL ESTADO DE GUERRERO NÚMERO 08; ASÍ COMO EN LO\nPARTICULAR DE LOS ARTÍCULOS 4, 9 Y 45 DEL REGLAMENTO INTERIOR DE LA\nSECRETARÍA DE FINANZAS Y ADMINISTRACIÓN Y EL ARTÍCULO 2 DEL REGLAMENTO\nINTERIOR DE LA SECRETARÍA DE LA CONTRALORÍA Y TRANSPARENCIA\nGUBERNAMENTAL.\nQue el Plan Estatal de Desarrollo 2016-2021, establece en el Eje I. Guerrero Seguro y de\nLeyes bajo el marco de Derechos Humanos; objetivo 1.2. Lograr una administración moderna, eficiente y con igualdad de género; asimismo, dentro de sus estrategias ejercer las finanzas públicas de forma responsable como política estratégica de una administración eficiente e implementar nuevas tecnologías y capacidades humanas que respondan con oportunidad y eficiencia a las demandas de la ciudadanía, y dentro de sus líneas de acción señala la de eficientar la administración pública. Por su parte el Eje 5. Guerrero con Gobierno Abierto y Transparente, puntualiza combatir la corrupción y la ineficiencia administrativa.\nLa Ley Orgánica de la Administración Pública del Estado de Guerrero número 08, en el artículo 22 establece que la Secretaría de Finanzas y Administración, es el órgano encargado de la\nAdministración, Capacitación y Desarrollo de Personal de la Administración Pública Estatal con perspectiva de género, incluido lo relativo a las relaciones laborales.\nPor su parte el artículo 39 de la misma Ley en cita, señala que la Secretaría de Contraloría y\nTransparencia Gubernamental, le corresponde organizar y coordinar el desarrollo administrativo integral, recursos humanos y patrimoniales de las secretarías, dependencias y entidades de la\nGUERRERO\nAdministración Pública Estatal, para que sean aprovechados y aplicados con criterios de eficacia, legalidad, eficiencia, transparencia y simplificación administrativa; así como emitir las normas y los procedimientos técnicos para tales efectos, realizar o encomendar las investigaciones, estudios y análisis necesarios sobre estas materias.\nEn razón de lo anterior considerando que el Lic. Héctor Antonio Astudillo Flores, Gobernador\nConstitucional, ha considerado como uno de los elementos estratégicos más importantes el desarrollo del personal al servicio de la ciudadanía, es necesario contar con un Catálogo de Puestos\nGenéricos de la Administración Pública Centralizada del Estado de Guerrero, actualizado que permite de dar certeza laboral a las servidoras y servidores públicos, en el que se describen, de forma clara y precisa, los perfiles genéricos que comparten todos los puestos en sus respectivos niveles de gestión y categorías administrativas, así mismo, se adicionan puestos y modifican algunos en su nombre lo que permitirá ubicar a las servidoras y servidores públicos de acuerdo a las funciones que desarrolla en su área de trabajo, al tiempo que facilitará la operación de los movimientos de personal.\nEl Catalogo tiene la finalidad de contribuir a hacer más eficiente la administración de los recursos humanos y estandarizar la denominación de las plazas presupuestadas y autorizadas previamente, con las estructuras ocupacionales, los puestos registrados en las nóminas, así como, los reglamentos interiores y manuales de organización de cada una de las secretarías y dependencias del sector central del Gobierno del Estado, el cual por su complejidad se divide en:\nA). Catálogo de Puestos de la Administración Pública Centralizada por Tipo de Plaza y B). Catálogo de Puestos Operativos de Seguridad Pública y Protección Civil.\nPor lo expuesto y fundado, hemos tenido a bien expedir el siguiente:\nACUERDO POR EL QUE SE EMITE EL CATÁLOGO GENERAL DE PUESTOS DE LA\nADMINISTRACIÓN PÚBLICA CENTRALIZADA DEL ESTADO DE GUERRERO.\nArtículo 1. Se emite el Catálogo General de Puestos de la Administración Pública\nCentralizada del Estado De Guerrero, que tiene por objeto contribuir a hacer más eficiente la administración de los recursos humanos y estandarizar la denominación de las plazas presupuestadas y autorizadas previamente, dividido por su complejidad en A). Catálogo de Puestos de la Administración Pública Centralizada por Tipo de Plaza y B). Catálogo de Puestos Operativos de Seguridad Pública y Protección Civil.\nArtículo 2. La Secretaría de Finanzas y Administración tendrá a cargo la implementación, operación, ejecución y administración del Catálogo General de Puestos de la Administración Pública\nCentralizada del Estado de Guerrero, bajo los criterios de objetividad, equidad, género, transparencia, publicidad y selectividad, con estricto apego a la normatividad aplicable, por su parte, Catálogo con el fin de fortalecer el desarrollo administrativo integral de los recursos humanos, para\nGUERRERO que sean aprovechados y aplicados con criterios de eficacia, legalidad, eficiencia y transparencia.\nDEL ESTADO DE GUERRERO.\nPRESENTACIÓN.\nEl capital humano es uno de los pilares para el desarrollo de cualquier organización, sobre todo para las instituciones públicas comprometidas con una dinámica de mejora continua de sus procesos y procedimientos.\nEn ese sentido, la administración del Lic. Héctor Antonio Astudillo Flores, Gobernador\nConstitucional, ha considerado como uno de los elementos estratégicos en el Plan Estatal de\nDesarrollo el desarrollo del personal al servicio de la ciudadanía.\nEn cumplimiento de las atribuciones conferidas por la normatividad vigente y con el fin de dar certeza laboral a las y los servidores públicos, la Secretaría de Finanzas y Administración y la\nSecretaría de la Contraloría y Transparencia Gubernamental elaboraron el Catálogo de Puestos\nGenéricos de la Administración Pública Centralizada del Estado de Guerrero.\nEl Catálogo contribuirá a hacer más eficiente la administración de los recursos humanos, al estandarizar la denominación de las plazas presupuestadas y autorizadas previamente, con las estructuras ocupacionales, los puestos registrados en las nóminas, así como los reglamentos interiores y manuales de organización de cada una de las secretarías y dependencias del sector central Gobierno del Estado.\nLa Secretaría de Finanzas y Administración tendrá a cargo la implementación, operación, ejecución y administración del Catálogo, bajo los criterios de objetividad, equidad, género, transparencia, publicidad y selectividad, con estricto apego a la normatividad aplicable.\nPor su parte, la Secretaría de Contraloría y Transparencia Gubernamental vigilará la recursos humanos, para que sean aprovechados y aplicados con criterios de eficacia, legalidad, eficiencia y transparencia.\nEs conveniente señalar que, en cumplimiento de lo establecido en la Ley Orgánica de la\nAdministración Pública del Estado de Guerrero número 08, en sus artículos 22 y 39, estos\nLineamientos aplican solamente a la Administración Pública Descentralizada, respetando la autonomía de gestión de los poderes Legislativo y Judicial, así como de los órganos autónomos, para que, en el cumplimiento de sus atribuciones conferidas por la normatividad vigente, puedan determinar sus instrumentos correspondientes.\nGUERRERO\nINTRODUCCIÓN.\nEl Catálogo General de Puestos de la Administración Pública Centralizada, es un instrumento técnico-administrativo en el cual se describen, de forma clara y precisa, los perfiles genéricos que comparten todos los puestos en sus respectivos niveles de gestión y categorías administrativas, se adicionan puestos y modifican algunos en su nombre lo que permitirá ubicar a las servidoras y servidores públicos de acuerdo a las funciones que desarrolla en su área de trabajo, al tiempo que facilitará la operación de los movimientos de personal.\nLos perfiles genéricos descritos en la “Cédula de identificación del puesto” se basan en una descripción de elementos comunes que determinan un estándar mínimo de atributos funcionales y ubicación orgánica en las estructuras organizacionales, desde mandos superiores, mandos medios, administrativos y personal operativo, se clasifican de la manera siguiente:\n• Personal de Base;\n• Personal Supernumerario;\n• Personal de Confianza.\nEn un apartado específico se consideran los puestos operativos del personal adscrito a funciones de seguridad pública y protección civil, conforme lo establecido en la normatividad aplicable.\nMARCO NORMATIVO.\nLey General del Sistema Nacional de Seguridad Pública;\nLey Orgánica de la Administración Pública del Estado de Guerrero Número 08;\nLey de Trabajo de los Servidores Públicos del Estado de Guerrero Número 248;\nLey Número 18 de Remuneraciones de los Servidores Públicos del Estado de Guerrero;\nLey Número 465 de Responsabilidades Administrativas para el Estado de Guerrero;\nLey Número 207 de Transparencia y Acceso a la Información Pública del Estado de Guerrero;\nLey Número 912 de Seguridad Social de los Servidores Públicos del Estado de Guerrero;\nReglamento de las Condiciones Generales de Trabajo que regirán para los Trabajadores de\nCoordinados y Descentralizados del Estado de Guerrero.\nCentralizada;\nAcuerdo para la Implementación del Programa Estatal de Ética, Transparencia y Combate a la Corrupción;\nCódigo de Ética, para los Servidores Públicos de la Administración Pública Centralizada y\nParaestatal del Estado de Guerrero;\nManuales de Organización de las instituciones de la Administración Pública Estatal;\nGUERRERO\nOrganogramas de las secretarías y dependencias; del Estado de Guerrero para el Ejercicio Fiscal que corresponda; y\nNóminas emitidas durante el ejercicio fiscal que corresponda.\nGLOSARIO.\nPara los efectos de este Catálogo de Puestos, se entiende por:\nCategorías: Considera los puestos homólogos, equivalente, vigente o específico).\nConstitución Federal: Constitución Política de los Estados Unidos Mexicanos.\nDenominación del puesto. Nombre oficial del puesto, equivalente al establecido en el\nTabulador de Sueldos de Poder Ejecutivo.\nEscala de gestión: Sistema de jerarquización del trabajo del sector público de conformidad con la naturaleza del puesto; el grado de autoridad que despliega en un determinado nivel de la cadena de mando; la responsabilidad atribuida en dicha posición; y el tipo de gestión que desempeña desde el mismo. La escala de gestión se equipará también en la pirámide o jerarquías en relación al mando-subordinado.\nEstructura ocupacional: Sistema de clasificación de puestos con niveles de gestión, ramas y grupos de especialidad.\nProceso Administrativo: Flujo continuo e interrelacionado de las actividades de planeación, organización, integración, desarrollo, prevención, ejecución, control, operación y documentación.\nServidor(a) público (a): Todo aquel funcionario, empleado y en general toda persona que desempeñe un empleo, cargo o comisión de cualquier naturaleza en la Administración Pública\nCentralizada del Estado.\nSistema de Control Interno: Está diseñado con procedimientos, lineamientos, políticas de operación orientadas a prevenir actos de corrupción de cualquier naturaleza.\nOBJETIVOS.\nObjetivo genérico.\nDisponer de un instrumento técnico-administrativo de identificación, categorización y control\nGUERRERO del Estado de Guerrero, para una mejor administración del capital humano y armonización de los organogramas y estructuras ocupacionales de la Administración Pública Centralizada.\nObjetivos específicos\n1. Establecer una base técnico-administrativa para que las dependencias de la\nAdministración Pública Centralizada armonicen sus estructuras ocupacionales y organogramas.\n2. Contar con un mecanismo de consulta que permita a los responsables de cada una de las dependencias de la Administración Pública Centralizada mejorar la toma de decisiones en forma eficiente sobre el capital humano que les corresponda.\n3. Definir los criterios para la contratación ordenada de nuevo personal, relacionada con las funciones, grado de estudios, experiencia y requisitos, entre otros.\nCRITERIOS DE APLICACIÓN.\nLa aplicación del Catálogo General de Puestos es obligatoria para la totalidad de procesos de gestión de recursos humanos a nivel de la definición de políticas de empleo y se apegará a los siguientes criterios:\n1. El Catálogo General de Puestos establece categorías administrativas y funciones primarias asociadas a las mismas. La asignación de plazas deberá realizarse para el cumplimiento de dichas funciones.\n2. Los puestos considerados en el presente Catálogo son los únicos que se reconocen de manera oficial por la Secretaría de Finanzas y Administración del Poder Ejecutivo del Estado de\nGuerrero.\n3. Las denominaciones convencionales no tienen una acreditación para promover ningún tipo de condición o especificación laboral particular, ya que comparten atributos genéricos a nivel de sus características funcionales y ubicación en las escalas de las estructuras de organización y ocupacionales con sus respectivas categorías.\n4. Las dependencias de la Administración Pública Centralizada deberán tener armonizados presente Catálogo. Las funciones de los puestos específicas que agreguen estarán enfocadas al cumplimiento de sus atribuciones institucionales.\n5. La creación de nuevos puestos se sujetará a los siguientes principios:\n5.1. La estricta necesidad de crear posiciones funcionales para atender materias o especialidades no cubiertas, o con requerimientos de algún nuevo componente en su gestión y que no pueda ser atendida por los puestos vigentes;\nGUERRERO\n5.2. La congruencia del tipo de puesto (nivel de gestión), con el grado de especialidad y trabajo;\n5.3. La correspondencia idónea entre el perfil genérico de puestos disponibles en el Catálogo y las funciones específicas del nuevo puesto, evitándose que se determinen requisitos específicos de manera innecesaria o aislada de la lógica funcional de los desempeños en la Administración\nPública Estatal;\n5.4. Evitar la asignación de denominaciones idénticas a puestos de base, supernumerarios y de confianza, y\n5.5. En los puestos de confianza establecer con precisión las funciones que sean inherentes a esa modalidad de puestos.\n6. La actualización de denominación de puestos o cambio de adscripción no implicará su recategorización automática; en estos casos, se deberá justificar bajo principios equivalentes a los que operan para un nuevo puesto.\n7. Las dependencias de la Administración Pública Centralizada deberán observar sin variación alguna, las funciones establecidas en este Catálogo para cada puesto.\n8. Las funciones de los puestos establecidos en el Catálogo deberán utilizarse, sin excepción, en los sistemas de evaluación del desempeño que se establezcan.\n9. El empleo inadecuado u omisión del Catálogo, la suplantación de los perfiles señalados en él o su aplicación parcial para favorecer determinados actos de reclutamiento, selección, promoción, ascenso, evaluación del desempeño o el otorgamiento de estímulos y reconocimientos, propicios o ventajosos para una determinada persona, será objeto de responsabilidad administrativa por parte de quienes lleven a cabo dichas prácticas conforme a la normatividad aplicable.\nA). CATÁLOGO DE PUESTOS DE LA ADMINISTRACIÓN PÚBLICA CENTRALIZADA\nPOR TIPO DE PLAZA.\nRAMA: DE CONFIANZA.\nNÚMERO CATEGORÍAS\nCONSECUTIV PUESTO\n001 Gobernador (a) Gobernador (a) del Estado.\n002 Secretario (a) de Despacho Secretario (a) de Despacho.\n003 Subsecretario (a) de Despacho Subsecretario (a) de Despacho.\nGUERRERO\nNÚMERO CATEGORÍAS\nCONSECUTIV PUESTO\nDirector (a) General, Piloto Aviador, 004 Director (a) General\nPresidente A.\nDirector (a) de Área, Defensor Público, Mecánico, Escolta A, Mecánico de\n005 Director (a) de Área\nHelicóptero, Principal, Concertino (a), Secretario (a) General.\nSubdirector (a), Escolta “B”, Filarmónico\n(a), Asistente, Actuario (a), Secretario (a)\n006 Subdirector (a) de Acuerdos, Auxiliar de Juntas, Secretario (a) de Audiencia.\nJefe (a) de Departamento, Representante Obrero, Representante\n007 Jefe (a) de Departamento\nPatronal, Conciliador (a), Dictaminador\n(a).\nRAMA: SUPERNUMERARIO.\nNÚM. CATEGORÍAS\nCONSECUTIV PUESTO\nEspecialista/Jefe (a) de Área, Auxiliar\nAdministrativo, Técnico Administrativo, 008 Especialista / Jefe (a) de Área\nTécnico Calificado, Profesionista\nEspecializado, Jefe de Oficina/ Área.\n009 Analista Profesional Analista Profesional\n010 Analista Técnico (a) Analista Técnico\n011 Operativo (a) Calificado (a) Operativo (a) Calificado\n012 Auxiliar Especializado (a) Auxiliar Especializado (a)\nAuxiliar/Maestro (a) de Oficio, Maestro de\n013 Auxiliar / Maestro (a) de Oficio\nOficio\nServicios Administrativos, Capturista\n014 Servicios Administrativos\nMecanógrafa General.\nRAMA: DE BASE.\nNÚMERO CATEGORÍAS\nCONSECUTIV PUESTO\n015 Apoyo General Apoyo General\nGUERRERO\nNÚMERO CATEGORÍAS\nCONSECUTIV PUESTO\nServicios Generales, Trabajos Generales, 016 Servicios Generales\nIntendencia.\nB). CATÁLOGO DE PUESTOS OPERATIVOS DE SEGURIDAD PÚBLICA Y\nPROTECCIÓN CIVIL.\nNÚMERO\nCATEGORÍAS TIPO DE PLAZA\nCONSECUTIVO\nB01 Comisario Acreditable Análisis Táctico Confianza\nB02 Comisario Acreditable Investigación Confianza\nB03 Comisario Acreditable Operaciones Confianza\nB04 Inspector Confianza\nB05 Inspector Acreditable Análisis Táctico Confianza\nB06 Inspector Acreditable Investigación Confianza\nB07 Inspector Acreditable Operaciones Confianza\nB08 Investigador (a) Socio-Económico (a) Confianza\nB09 Oficial Confianza\nB10 Oficial Acreditable Análisis Táctico Confianza\nB11 Oficial Acreditable Investigación Confianza\nB12 Oficial Acreditable Operaciones Confianza\nB13 Oficial Penitenciario Acreditable Confianza\nB14 Policía Confianza\nB15 Policía 1 Confianza\nB16 Policía 2 Confianza\nB17 Policía 3 Confianza\nB18 Policía Acreditable Análisis Táctico Confianza\nB19 Policía Primero Acreditable Análisis Táctico Confianza\nB20 Policía Segundo Acreditable Análisis Táctico Confianza\nB21 Policía Tercero Acreditable Análisis Táctico Confianza\nB22 Policía Acreditable Investigación Confianza\nB23 Policía Primero Acreditable Investigación Confianza\nB24 Policía Segundo Acreditable Investigación Confianza\nB25 Policía Tercero Acreditable Investigación Confianza\nB26 Policía Acreditable Operaciones Confianza\nB27 Policía Primero Acreditable Operaciones Confianza\nB28 Policía Segundo Acreditable Operaciones Confianza\nB29 Policía Tercero Acreditable Operaciones Confianza\nB30 Policía Penitenciario Acreditable Confianza\nB31 Policía Primero Penitenciario Acreditable Confianza\nGUERRERO\nNÚMERO\nCATEGORÍAS TIPO DE PLAZA\nCONSECUTIVO\nB32 Policía Segundo Penitenciario Acreditable Confianza\nB33 Policía Tercero Penitenciario Acreditable Confianza\nB34 Policía Estatal Rural Confianza\nB35 Subinspector Confianza\nB36 Subinspector Acreditable Análisis Táctico Confianza\nB37 Subinspector Acreditable Investigación Confianza\nB38 Subinspector Acreditable Operaciones Confianza\nB39 Suboficial Confianza\nB40 Suboficial Acreditable Análisis Táctico Confianza\nB41 Suboficial Acreditable Investigación Confianza\nB42 Suboficial Acreditable Operaciones Confianza\nB43 Suboficial Penitenciario Acreditable Confianza\nB44 Médico Confianza\nB45 Poligrafista Confianza\nB46 Psicólogo (a) Confianza\nB47 Químico Confianza\nC01 Brigadista Confianza\nC02 Jefe (a) de Equipo Confianza\nC03 Jefe (a) de Grupo Confianza\nACUERDO A LOS PUESTOS GENÉRICOS.\n{\"tabla_1\":{\"columnas\":[\"(sin encabezado)\",\"Puesto Genérico\",\"(sin encabezado)\",\"Categorías\",\"(sin encabezado)\"],\"filas\":[{\"columna_1\":\"Director (a) de Área\",\"columna_2\":\"(sin dato)\",\"columna_3\":\"(sin dato)\",\"columna_4\":\"Poligrafista en Jefe, Poligrafista.\",\"columna_5\":\"(sin dato)\"},{\"columna_1\":\"Subdirector (a)\",\"columna_2\":\"(sin dato)\",\"columna_3\":\"(sin dato)\",\"columna_4\":\"Medico en Jefe, Medico, Químico en Jefe, Químico, Psicóloga (a) en Jefe,\\nPsicóloga (a), Investigador Socio-Económico en jefe, Investigador Socio-\\nEconómico.\",\"columna_5\":\"(sin dato)\"},{\"columna_1\":\"Comisario\",\"columna_2\":\"(sin dato)\",\"columna_3\":\"(sin dato)\",\"columna_4\":\"Comisario Acreditable Análisis Táctico, Comisario Acreditable Investigación,\\nComisario Acreditable Operaciones.\",\"columna_5\":\"(sin dato)\"},{\"columna_1\":\"Inspector\",\"columna_2\":\"(sin dato)\",\"columna_3\":\"(sin dato)\",\"columna_4\":\"Inspector, Inspector Acreditable Análisis Táctico, Inspector Acreditable\\nInvestigación, Inspector Acreditable Operaciones.\",\"columna_5\":\"(sin dato)\"},{\"columna_1\":\"Subinspector\",\"columna_2\":\"(sin dato)\",\"columna_3\":\"(sin dato)\",\"columna_4\":\"Subinspector Acreditable Análisis Táctico, Subinspector Acreditable\\nInvestigación, Subinspector Acreditable Operaciones.\",\"columna_5\":\"(sin dato)\"},{\"columna_1\":\"Oficial\",\"columna_2\":\"(sin dato)\",\"columna_3\":\"(sin dato)\",\"columna_4\":\"Oficial, Oficial Acreditable Análisis Táctico, Oficial Acreditable Investigación,\\nOficial Acreditable Operaciones.\",\"columna_5\":\"(sin dato)\"},{\"columna_1\":\"Suboficial\",\"columna_2\":\"(sin dato)\",\"columna_3\":\"(sin dato)\",\"columna_4\":\"Suboficial, Suboficial Acreditable Análisis Táctico, Suboficial Acreditable\\nInvestigación, Suboficial Acreditable Operaciones.\",\"columna_5\":\"(sin dato)\"},{\"columna_1\":\"Policía\",\"columna_2\":\"(sin dato)\",\"columna_3\":\"(sin dato)\",\"columna_4\":\"Policía, Policía 1, Policía 2, Policía 3, Policía Estatal Rural, Policía\\nAcreditable Análisis Táctico, Policía 1ro, 2do, 3ro. Acreditable Análisis\\nTáctico, Policía Acreditable Investigación, Policía 1ro, 2do, 3ro. Acreditable\",\"columna_5\":\"(sin dato)\"}]}}\nGUERRERO\nInvestigación, Policía Acreditable Operaciones, Policía 1ro, 2do, 3ro.\nAcreditable Operaciones, Policía Penitenciario Acreditable, Policía 1ro, 2do, 3ro. Penitenciario Acreditable.\nJefe de Grupo, Jefe de Equipo, Brigadista, Brigadista 1, Brigadista 2, Jefe de Grupo\nBrigadista 3.\nCÉDULAS DE IDENTIFICACIÓN DE PUESTOS\nGUERRERO\nCATÁLOGO DE PUESTOS RAMA: DE CONFIANZA\nCÉDULA DE IDENTIFICACIÓN DE PUESTO\nDENOMINACIÓN DEL PUESTO: 01. GOBERNADOR (A)\nCÓDIGOS DE CATEGORÍAS ÁREAS DE ADSCRIPCIÓN\n22 Oficina del Ejecutivo.\nNIVEL DE GESTIÓN SUPERVISIÓN EJERCIDA\nA las personas titulares de las secretarías, dependencias y entidades paraestatales del\nPoder Ejecutivo y demás servidoras y servidores públicos de la Administración Pública Estatal\nUBICACIÓN EN LA ESTRUCTURA\nGRADO DE ESTUDIOS\nOCUPACIONAL\nEjecutivo del\nConforme lo establecido en el artículo 75 de la\nEstado…………………………………….…………….. ✓\nSecretarías de de Guerrero.\nDespacho……………………………………………\nRESULTADOS ESPERADOS\nSubsecretarías…………………..………………………\n……….\nDirecciones\nGenerales…………………….…………..............\nDirecciones de\nÁrea……..……….…………..………...….\nSubdirecciones……….………….....…….….………....\nCumplir y hacer cumplir con los principios emanados de las Constituciones tanto Federal\nDepartamentos………………...................................... como Estatal, así como, las demás leyes vigentes\nJefaturas de en el Estado de Guerrero. oficina……….......................................\nJefaturas de área especializada………………..\nOperativo…….................................................\nAdministrativo…………………….……\nGUERRERO\nPRINCIPALES FUNCIONES\n- Cumplir y hacer cumplir la Constitución Política de los Estados Unidos Mexicanos y la Constitución Política internacionales en los que México sea parte;\nGuerrero\n- Las establecidas en la Ley número 08 de la Administración Pública del Estado de Guerrero, así como aquellas específicas que sean señaladas en leyes reglamentarias.\nGUERRERO\nCATÁLOGO DE PUESTOS RAMA: DE CONFIANZA\nCÉDULA DE IDENTIFICACIÓN DE PUESTO\nDENOMINACIÓN DEL PUESTO: 02. SECRETARIO (A) DE DESPACHO\nCÓDIGOS DE CATEGORÍAS ÁREAS DE ADSCRIPCIÓN\n19B, 20A, 21A, Oficina del titular de la Secretaría\nNIVEL DE GESTIÓN SUPERVISIÓN EJERCIDA\nA las personas titulares de las Subsecretarías, direcciones generales, direcciones de área, N 2 unidades de staff y demás servidoras y servidores públicos de la Administración Pública\nEstatal adscritos a su dependencia.\nUBICACIÓN EN LA ESTRUCTURA\nGRADO DE ESTUDIOS\nOCUPACIONAL\nEjecutivo del\nConforme a lo establecido en el artículo 15 de la\nEstado…………………………………………………....\nLey número 08 de la Administración Pública del\nSecretarías de\nEstado de Guerrero.\nDespacho……………………………..………………✓\nSubsecretarías…………………..………………………\nRESULTADOS ESPERADOS\n……….\nDirecciones\nGenerales…………………….…………..............\nDirecciones de\nÁrea……..……….…………..………...….\nSubdirecciones……….………….....…….….……….....\nConforme lo establecido en los artículos 7 y 8 de\nDepartamentos………………...................................... la Ley número 08 de la Administración Pública del\nJefaturas de Estado de Guerrero. oficina……….......................................\nJefaturas de área especializada………………...\nOperativo…….................................................\nAdministrativo…………………….……\nCATEGORÍAS\nGUERRERO\nSecretario (a) de despacho\nPRINCIPALES FUNCIONES\n- Las establecidas en los artículos 10 y 11 de la Ley número 08 de la Administración Pública del Estado de\nGuerrero\n- Planear, organizar y dirigir el proceso de programación y presupuestación del sector a su cargo para la operación de las políticas aprobadas por el Poder Ejecutivo en términos del Plan Estatal de Desarrollo;\n- Planear, operar y supervisar la gestión de los recursos institucionales asignados a su sector y autorizar los sistemas y procedimientos propios para su adecuada administración;\n- Impulsar el Plan Estatal de Desarrollo mediante el “diseño y planeación” de acciones como parte del proceso administrativo vinculando en todo momento a los recursos humanos, materiales, técnicos y financieros que dispone su organización en el ámbito de su competencia;\n- Dirigir el desarrollo y operación de programas, proyectos y acciones del sector y ejecutar la toma de decisiones que sea requerida para la adecuada provisión de los bienes y servicios que estén bajo la responsabilidad de su dependencia;\n- Dirigir, organizar y controlar la gestión de las especialidades del sector a su cargo para su adecuado funcionamiento y productividad pública;\n- Gestionar con las autoridades competentes el financiamiento de los programas, proyectos y actividades requeridas para la adecuada operación del ramo a su cargo;\n- Tomar decisiones, disponer de los medios institucionales y ejecutar los actos de autoridad que sean necesarios, para asegurar la observancia del marco jurídico del sector y la representatividad institucional del despacho a su cargo;\n- Autorizar, formalizar y supervisar a los convenios y demás instrumentos jurídicos que suscriba la dependencia desde su despacho para asegurar el interés de la misma;\n- Controlar la aplicación de las normas institucionales de la administración de recursos y acreditar su observancia ante las autoridades de control de gestión competentes en la administración central;\n- Dirigir y controlar la administración del presupuesto de operación propio del sector para asegurar el cumplimiento de los fines institucionales;\n- Informar oportunamente al Ejecutivo del Estado, la situación real de cómo se encuentran los procesos administrativos y operativos del área bajo su responsabilidad;\n- Interpretar correctamente y desarrollar los planes y acciones registrados en el Plan Estatal de Desarrollo vinculados al ámbito de su competencia;\n- Desempeñar Cumplir con eficiencia y eficacia los objetivos y metas que le correspondan mediante la acciones y actividades;\nGUERRERO\nEstado de Guerrero, así como, con el Programa Estatal de Ética, Transparencia y Combate a la\n- Inducir que las acciones administrativas y operativas de su incumbencia se orienten a los sistemas de gestión para la calidad, así como los sistemas de control interno, desarrollados con procedimientos y lineamientos orientados a prevenir actos de corrupción de cualquier naturaleza; y\n- Las demás que las disposiciones legales le atribuyan, así como, aquéllas que le confiera su superior\nGUERRERO\nCATÁLOGO DE PUESTOS RAMA: CONFIANZA\nCÉDULA DE IDENTIFICACIÓN DE PUESTO\n03. SUBSECRETARIO (A) DE\nDENOMINACIÓN DEL PUESTO:\nDESPACHO\nCÓDIGOS DE CATEGORÍAS ÁREAS DE ADSCRIPCIÓN\n16C, 17A, 17B, 17C, 18A, 18B, 18C Secretarías de Despacho.\nNIVEL DE GESTIÓN SUPERVISIÓN EJERCIDA\nA las personas titulares de las direcciones generales, direcciones de área y demás\nN 3 servidoras y servidores públicos de la\nAdministración Pública Estatal adscritos a su dependencia.\nUBICACIÓN EN LA ESTRUCTURA\nGRADO DE ESTUDIOS\nOCUPACIONAL\nEjecutivo del De acuerdo a la normatividad específica que\nEstado……………………………………….……………. aplique a la dependencia que esté asignado.\nSecretarías de\nDespacho………………………………...……………\nRESULTADOS ESPERADOS\nSubsecretarías………………………………..…….……\n………... ✓\nDirecciones\nGenerales………………...………….......................\nDirecciones de\nÁrea……..……….…….…………...……….\nSubdirecciones……….…………....……...………...........\nCumplir y hacer cumplir las atribuciones y\n. facultades conferidas por las leyes, reglamentos, manuales y demás normatividad vigente en el\nDepartamentos……………….........................................\nEstado de Guerrero.\nJefaturas de oficina………..........................................\nJefaturas de área especializada…………………..\nOperativo………...............................................\nAdministrativo………………..……..…..\nGUERRERO\nCATEGORÍAS\nSubsecretario (a) de despacho\nPRINCIPALES FUNCIONES\n- Formular las estrategias de gestión a las que debe sujetarse la acción pública de las ramas de especialidad, las direcciones y áreas a su cargo, en términos de lo estipulado en el Plan Estatal de\nDesarrollo;\n- Proporcionar los medios de decisión, dirección y coordinación necesarios para la adecuada organización y funcionamiento de las especialidades y operación de dirección o áreas a su cargo;\n- Organizar los programas, proyectos y actividades que estén vinculados al cumplimiento de normas, términos jurídicos y demás medios de control institucional, para asegurar el cumplimiento del marco normativo de las especialidades a su cargo;\n- Llevar a cabo la “organización e integración” de los planes y acciones programados en términos de los recursos disponibles;\n- Inducir a sus subalternos la cultura del trabajo y responsabilidad para que puedan cumplir con eficiencia y eficacia con sus responsabilidades;\n- Pregonar con el ejemplo a sus subalternos los principios del Programa Estatal de Ética, Transparencia y\nCombate a la Corrupción;\n- Aplicar los mecanismos, necesarios para lograr la implementación de sistemas de gestión para la calidad, así como, los de “control interno”, orientados a “prevenir actos de corrupción de cualquier naturaleza”;\n- Dirigir en forma estratégica la operación de programas, proyectos y acciones para lograr la sistematización de procesos y el avance programático previsto;\n- Cumplir los convenios y demás instrumentos jurídicos que suscriba la dependencia, para asegurar que rindan los beneficios previstos;\n- Dirigir y ordenar el desarrollo, implantación y operación de los métodos, sistemas y procesos propios de las áreas de especialidad a su cargo, con objeto de lograr la sistematización y estandarización de las mismas;\n- Orientar la operación de los sistemas de control y evaluación establecidos para garantizar el adecuado suministro de los bienes y servicios requeridos para el desarrollo de las tareas y especialidades a su cargo;\n- Dirigir y controlar la administración del presupuesto de operación autorizado para cada uno de los programas y especialidades a su cargo;\n- Planear los modelos de gestión operativa propios de las especialidades a su cargo y dictaminar la adaptación de las tecnologías requeridas en sus áreas de gestión;\n- Planear y organizar los sistemas de ingeniería programática y financiera para el respaldo de recursos de sus programas y especialidades;\nGUERRERO\n- Planear, organizar y dirigir la gestión de los programas que proveen bienes y servicios a la población para asegurar que cumplan con sus necesidades, bajo normas y estándares de gestión y calidad establecidas;\n- Planear los programas de especialización del personal de cada una de sus áreas para lograr la mayor calificación de su gestión;\n- Participar en el diseño de proyectos de desarrollo e innovación propios para el mejoramiento de las áreas y especialidades a su cargo;\n- Diagnosticar, evaluar y emitir opiniones calificadas relacionadas con las medidas que tiendan a la innovación y desarrollo de las responsabilidades a su cargo; y\n- Las demás que las disposiciones legales le atribuyan, así como, aquéllas que le confiera su superior\nGUERRERO\nCATÁLOGO DE PUESTOS RAMA: CONFIANZA\nCÉDULA DE IDENTIFICACIÓN DE PUESTO\nDENOMINACIÓN DEL PUESTO: 04. DIRECTOR (A) GENERAL\nCÓDIGOS DE CATEGORÍAS ÁREAS DE ADSCRIPCIÓN\n12A, 12B, 12C, 13A, 13B, 13C, 14A, 14B 14C, 15A, Secretarías de Despacho o Subsecretarías.\n15B, 15C, 13B, 14B, 17C\nNIVEL DE GESTIÓN SUPERVISIÓN EJERCIDA\nA las personas titulares de las direcciones de área, departamentos y/o Jefaturas de área, así\nN 4 como a las demás servidoras y servidores públicos de la Administración Pública Estatal adscritos a su área.\nUBICACIÓN EN LA ESTRUCTURA\nGRADO DE ESTUDIOS\nOCUPACIONAL\nEjecutivo del\nDe acuerdo a la normatividad específica que\nEstado…………………………………………………… aplique a la dependencia que esté asignado.\nSecretarías de\nDespacho……………………………………………..\nRESULTADOS ESPERADOS\nSubsecretarías……………………………………………\n…..…...\nDirecciones\nGenerales…………………...………....................... ✓\nDirecciones de\nÁrea……..……….…………………..…….\nSubdirecciones……….…………....…….…………....... Cumplir y hacer cumplir las atribuciones y facultades conferidas por las leyes, reglamentos, Departamentos………………...................................... manuales y demás normatividad vigente en el\nJefaturas de Estado de Guerrero. oficina……….......................................\nJefaturas de área especializada…………………\nOperativo………............................................\nAdministrativo…………….…………..\nCATEGORÍAS\nGUERRERO\nDirector (a) General, Piloto aviador, Presidente A\nPRINCIPALES FUNCIONES\n- Organizar los programas, proyectos y actividades que estén vinculados al cumplimiento de normas, términos jurídicos y demás medios de control institucional, para asegurar el cumplimiento del marco normativo de las responsabilidades a su cargo;\n- Proporcionar los mecanismos de decisión, dirección y coordinación necesarios para la adecuada organización y funcionamiento de las labores de su especialidad, así como para la operación de las áreas a su cargo;\n- Desarrollar la planeación de programas, proyectos y actividades, previamente establecida a través de la calendarización de acciones y actividades, determinando en todo momento su viabilidad y factibilidad de realización;\n- Investigar, analizar, diseñar e implementar los mecanismos de gestión y de control, que permitan garantizar una administración de calidad, transparente y honesta;\n- Monitorear continua y permanentemente las acciones que realiza el personal a su cargo, para cumplir en el ámbito de su competencia con el Plan Estatal de Desarrollo;\n- Evaluar periódicamente, si se está cumpliendo con el Programa Estatal de Ética, Transparencia y\nCombate a la Corrupción, con el firme propósito de fortalecer la imagen institucional;\n- Informar continuamente sobre la situación que guarda cada una de las metas y objetivos de su competencia, así como aquéllos en los que se consideró conveniente ajustarlos para su cumplimiento;\n- Dirigir estratégicamente la operación de programas, proyectos y acciones para lograr la sistematización de procesos y el avance programático previsto;\n- Dirigir el cumplimiento de compromisos establecidos en los convenios y demás instrumentos jurídicos que suscriba la dependencia para asegurar que rinda los beneficios previstos;\n- Dirigir la operación de los sistemas de control y evaluación establecidos para garantizar el adecuado suministro de los bienes y servicios de las áreas y especialidades a su cargo;\n- Dirigir la implantación, desarrollo y operación de los métodos, sistemas y procesos propios de las áreas a su cargo para lograr la sistematización y estandarización de las mismas;\n- Planear los modelos de gestión operativa propios de las especialidades a su cargo y dictaminar la adaptación de tecnologías en sus áreas de gestión;\n- Planear, organizar y dirigir la gestión de los programas que proporcionen bienes y servicios a la sociedad estatal para asegurar que cumplan con sus necesidades, bajo normas y estándares de gestión y calidad establecidos;\n- Planear y organizar los sistemas de ingeniería programática, presupuestal y financiera para el respaldo de recursos para sus programas y tareas asignadas a las áreas bajo su responsabilidad;\nGUERRERO\n- Planear los programas de especialización del personal de sus áreas para lograr la mayor calificación de su gestión;\n- Participar activamente en la investigación, análisis y diseño de proyectos de desarrollo e innovación, orientados al mejoramiento de las áreas y especialidades a su cargo; y\n- Las demás que las disposiciones legales le atribuyan, así como, aquéllas que le confiera su superior\nGUERRERO\nCATÁLOGO DE PUESTOS RAMA: CONFIANZA\nCÉDULA DE IDENTIFICACIÓN DE PUESTO\nDENOMINACIÓN DEL PUESTO: 05. DIRECTOR (A) DE ÁREA\nCÓDIGOS DE CATEGORÍAS ÁREAS DE ADSCRIPCIÓN\n5A, 7A, 7B, 7C, 8A, 8B, 8C, 9A, 9B, 9C Subsecretaría, Dirección General.\nNIVEL DE GESTIÓN SUPERVISIÓN EJERCIDA\nA las personas titulares de las jefaturas de departamento y/o jefaturas de área, así como a\nN 5 las demás servidoras y servidores públicos de la\nAdministración Pública Estatal adscritos a su área.\nUBICACIÓN EN LA ESTRUCTURA\nGRADO DE ESTUDIOS\nOCUPACIONAL\nEjecutivo del\nDe acuerdo a la normatividad específica que\nEstado……………………………………….……..……. aplique a la dependencia que esté asignado.\nSecretarías de\nDespacho…………………………………………..…\nRESULTADOS ESPERADOS\nSubsecretarías……………………………………………\n……...\nDirecciones\nGenerales…………………...…………................\nDirecciones de\nÁrea……..……….…………...…………. ✓\nSubdirecciones……….…………....…….…………...... Cumplir y hacer cumplir las atribuciones y facultades conferidas por las leyes, reglamentos, Departamentos………………..................................... manuales y demás normatividad vigente en el\nJefaturas de Estado de Guerrero. oficina………....................................\nJefaturas de área especializada……………...\nOperativo……….........................................\nAdministrativo…………….…………\nCATEGORÍAS\nGUERRERO\nDirector de área, Defensor Público, Mecánico, Escolta A, Mecánico de Helicóptero, Principal, Concertino\n(a), Secretario (a) General\nPRINCIPALES FUNCIONES\n- Operar y controlar los programas específicos asignados su superior jerárquico y las áreas bajo su responsabilidad;\n- Gestionar en forma oportuna los recursos administrativos propios de los programas a su cargo;\n- Dirigir los planes, proyectos y acciones determinados por las autoridades, superiores, previendo en todo momento, respetar techos financieros presupuestales;\n- Determinar y proponer las medidas técnicas y organizativas necesarias para la gestión del área bajo su responsabilidad, con objeto de que sean consideradas sus necesidades en los anteproyectos de presupuesto institucional;\n- Desarrollar e impulsar los programas de capacitación y especialización del personal del área bajo su responsabilidad con el objeto de lograr la mayor calificación de su gestión;\n- Impulsar en forma estratégica la operación de programas, proyectos y acciones para lograr la sistematización de procesos, así como la certificación de los mismos a través de la norma ISO-9001;\n- Controlar y supervisar la operación de programas, proyectos y acciones de su área de responsabilidad y ejecutar la toma de decisiones estratégicas que sean requeridas para el adecuado suministro de los bienes y servicios que le correspondan;\n- Investigar, analizar y desarrollar los métodos, sistemas y procedimientos propios de su área de responsabilidad, para lograr la sistematización y estandarización operativa e institucional;\n- Evaluar y dictaminar la funcionalidad de los procesos establecidos para la gestión del área bajo su responsabilidad, así como, de sus procesos de control interno;\n- Coordinar y supervisar la operación de los procesos productivos, la generación de bienes y el suministro de los servicios a su cargo;\n- Investigar, analizar, diseñar e implementar proyectos de desarrollo e innovación propios para el mejoramiento del área bajo su responsabilidad;\n- Diagnosticar, evaluar y emitir opiniones calificadas vinculadas a las medidas que tiendan a la innovación y desarrollo del área bajo su responsabilidad;\n- Orientar los procesos de gestión programática de conformidad con las normas, procedimientos y disposiciones establecidas en el marco normativo aplicable al área bajo su responsabilidad, cuidando en todo momento su vinculación al Plan Estatal de Desarrollo;\n- Analizar que los datos e información que se integran periódicamente a los prontuarios estadísticos cumplan con la calidad requerida, para su difusión oportuna;\n- Inducir al personal a los procesos de actualización y especialización en tecnologías de la información y comunicaciones que permita el desarrollo de aplicaciones de calidad;\nGUERRERO\n- Coadyuvar al cumplimiento de compromisos calendarizados en términos de sus responsabilidades;\n- Implementar los sistemas de gestión para la calidad necesarios así, como los de Control Interno requeridos; y\nGUERRERO\nCATÁLOGO DE PUESTOS RAMA: CONFIANZA\nCÉDULA DE IDENTIFICACIÓN DE PUESTO\nDENOMINACIÓN DEL PUESTO: 06. SUBDIRECTOR (A)\nCÓDIGOS DE CATEGORÍAS ÁREAS DE ADSCRIPCIÓN\n4A, 4B, 4C,5A, 5B, 5C, 6A, 6B, 6C, Direcciones de Área.\nNIVEL DE GESTIÓN SUPERVISIÓN EJERCIDA\nA las personas titulares de las jefaturas de departamento y/o jefaturas de área, así como a las demás servidoras y servidores públicos de la\nAdministración Pública Estatal adscritos a área.\nUBICACIÓN EN LA ESTRUCTURA\nGRADO DE ESTUDIOS\nOCUPACIONAL\nEjecutivo del\nDe acuerdo a la normatividad específica que\nEstado……………………………………………………. aplique a la dependencia que esté asignado.\nSecretarías de\nDespacho……………………………………….……..\nRESULTADOS ESPERADOS\nSubsecretarías……………………………………………\n………..\nDirecciones\nGenerales…………………...………….................\nDirecciones de\nÁrea……..……….……………………......\nSubdirecciones……….…………....…….………..........\nCumplir y hacer cumplir las atribuciones y\n✓ facultades conferidas por las leyes, reglamentos, manuales y demás normatividad vigente en el\nDepartamentos……………….......................................\nEstado de Guerrero.\nJefaturas de oficina……….......................................\nJefaturas de área especializada………………..\nOperativo………............................................\nAdministrativo…………….……………\nCATEGORÍAS\nGUERRERO\nSubdirector (a), Escola B. Asistente, Actuario (a) Secretario (a) de Acuerdos, Auxiliar de Juntas, Filarmónico (a) Secretario (a) de Audiencia\nPRINCIPALES FUNCIONES\n- Planificar, coordinar y controlar los trabajos de los equipos técnicos, operativos y de gestión, para la realización de las actividades previamente programadas;\n- Difundir las instrucciones y medidas necesarias para que los diferentes equipos de trabajo se apeguen estrictamente a los lineamientos, procedimientos, normas y sistemas establecidos para el área bajo su responsabilidad;\n- Ejecutar los planes y acciones oficializadas al área bajo su responsabilidad, respetando en todo momento la calendarización y recursos presupuestales autorizados para tal fin;\n- Implementar e implantar los sistemas de gestión, así como los de control interno, previamente diseñados para incrementar la calidad de los servicios que proporcionan además de fortalecer los mecanismos de control para prevenir actos de corrupción de cualquier naturaleza;\n- Supervisar la corrección de los resultados generados en el avance programático, evaluando la congruencia entre avance físico y avance financiero;\n- Impulsar y dirigir la implantación, desarrollo y operación de los métodos, sistemas y procesos de control de calidad inherentes al área bajo su responsabilidad;\n- Proponer mejoras a los procedimientos, procesos y sistemas aplicables a la gestión del área bajo su responsabilidad;\n- Investigar, analizar, diseñar y proponer proyectos y actividades programáticas para su incorporación a los programas y presupuestos institucionales;\n- Elaborar y actualizar periódicamente los prontuarios estadísticos de la subdirección con objeto de contar con información de calidad y oportuna;\n- Administrar en forma adecuada y transparente los recursos administrativos asignados a cada uno de los programas bajo su cargo;\n- Prevenir y corregir si fuera el caso el incumplimiento del Programa Estatal de Ética, Transparencia y\nCombate la Corrupción por parte de algún subordinado;\n- Diseñar, implementar y proponer programas de capacitación y actualización al personal del área bajo su cargo;\n- Aplicar los parámetros de eficiencia y eficacia a cada uno de los procesos estratégicos, desarrollados en el área bajo su cargo, con objeto de orientarlos a su certificación a través de la norma ISO 9001; y\nCATÁLOGO DE PUESTOS RAMA: CONFIANZA\nCÉDULA DE IDENTIFICACIÓN DE PUESTO\nGUERRERO\nDENOMINACIÓN DEL PUESTO: 07. JEFE(A) DE DEPARTAMENTO\nCÓDIGOS DE CATEGORÍAS ÁREAS DE ADSCRIPCIÓN\nDirección General, Dirección de Área y/o\n1A, 1B, 1C, 2A, 2B, 2C, 3A, 3B, 3C, Subdirección.\nNIVEL DE GESTIÓN SUPERVISIÓN EJERCIDA\nA las personas titulares de las jefaturas de área, de unidad, especialistas, así como a las demás\nN 7 servidoras y servidores públicos de la\nAdministración Pública Estatal adscritos a su área.\nUBICACIÓN EN LA ESTRUCTURA\nGRADO DE ESTUDIOS\nOCUPACIONAL\nEjecutivo del\nDe acuerdo a la normatividad específica que\nEstado………………………………………………….... aplique a la dependencia que esté asignado.\nSecretarías de\nDespacho……………………………..………………\nRESULTADOS ESPERADOS\nSubsecretarías…………………..………………………\n……….\nDirecciones\nGenerales…………………….…………..............\nDirecciones de\nÁrea……..……….…………..………...….\nSubdirecciones……….………….....…….….……….....\nCumplir y hacer cumplir las atribuciones y facultades conferidas por las leyes, reglamentos, Departamentos………………...................................... ✓ manuales y demás normatividad vigente en el\nJefaturas de\nEstado de Guerrero. oficina……….......................................\nJefaturas de área especializada………………...\nOperativo…….................................................\nAdministrativo…………………….……\nCATEGORÍAS\nGUERRERO\nJefe (a) de Departamento, Representante Obrero, Representante Patronal, Dictaminador (a), Conciliador\n(a)\nPRINCIPALES FUNCIONES\n- Administrar, coordinar y supervisar las tareas de trabajo asignadas a cada uno de los equipos técnicos, operativos y de gestión, con el objeto de que las actividades programadas en el área de su competencia se realicen con eficiencia y eficacia;\n- Aplicar los manuales de organización y de procedimientos, previamente desarrollados y autorizados para el área bajo su responsabilidad, con objeto de que los equipos de trabajo se apeguen estrictamente a las normas, lineamientos, sistemas y procedimientos establecidos;\n- Administrar en forma eficiente, eficaz y transparente los recursos presupuestales asignados a cada uno de los programas bajo su cargo;\n- Ejecutar la administración operativa de los recursos del área y gestionar los suministros de apoyo a los servicios correspondientes;\n- Supervisar la operación del servicio técnico y especializado evaluando la calidad de los resultados programáticos obtenidos, pudiendo ajustarlos si fuera el caso, tomando las decisiones operativas requeridas para la adecuación y mejora de los mismos;\n- Evaluar los resultados de los trabajos de la actividad programática establecida y ordenar la corrección de aquéllos que no cumplan con los lineamientos, estándares y parámetros establecidos;\n- Evaluar la eficiencia y eficacia de los resultados obtenidos en la realización del trabajo programático, proponiendo en caso de ser necesario medidas para su optimización;\n- Controlar las bases de datos obtenidas en el levantamiento de información de campo, integrando los registros de avances programáticos que correspondan a los equipos a su cargo;\n- Sistematizar y automatizar las actividades de monitoreo, indicadores y reportes de cumplimientos físicofinanciero de los programas;\n- Orientar los planes, proyectos y acciones y en general todas las actividades programáticas al cumplimiento de las metas establecidas en el Plan Estatal de Desarrollo;\n- Obtener datos sobre costos y consumo de recursos de trabajo programático y generar indicadores del comportamiento en el uso y aprovechamiento de recursos institucionales;\n- Administrar en forma adecuada y transparente los recursos administrativos asignados a cada uno de los programas bajo su cargo;\n- Impulsar los planes de capacitación, especialización y orientación de todos los servidores públicos del área de su competencia;\n- Investigar, analizar, diseñar e implementar en todas sus acciones programáticas los sistemas de gestión para la calidad, así como los de control interno que permitan prevenir actos de corrupción de cualquier naturaleza; y\nGUERRERO\nGUERRERO\nCATÁLOGO DE PUESTOS RAMA: SUPERNUMERARIO\nCÉDULA DE IDENTIFICACIÓN DE PUESTO\nDENOMINACIÓN DEL\n08. ESPECIALISTA / JEFE (A) DE ÁREA\nPUESTO:\nCÓDIGOS DE CATEGORÍAS ÁREAS DE ADSCRIPCIÓN\nE3A, E3B, E3C, SJOA, SJOB SJOC, SPEA, SPEB, SPEC, AAA, AAR, TAR, TAA, STAA, STAB, STAC, Subdirección, Jefatura de Departamento.\nTCA, TCR\nNIVEL DE GESTIÓN SUPERVISIÓN EJERCIDA\nA las personas analistas, administrativas, auxiliares y demás servidoras y servidores públicos de la Administración Pública Estatal adscritos a su área.\nUBICACIÓN EN LA ESTRUCTURA\nGRADO DE ESTUDIOS\nOCUPACIONAL\nEjecutivo del Estado…………………..……….…………\nDe acuerdo a la normatividad específica que\nSecretarías de Despacho……………………………… aplique a la dependencia que esté asignado.\nSubsecretarías…………..…………………………….\nDirecciones Generales…………….…….................\nDirecciones de Área……..………………………... RESULTADOS ESPERADOS\nSubdirecciones……….………….....…….….......\nDepartamentos……………….......................... Cumplir y hacer cumplir las atribuciones y\nJefaturas de oficina...................................... facultades conferidas por las leyes, reglamentos, Jefaturas de área especializada……….. ✓ manuales y demás normatividad vigente en el\nOperativo……........................................... Estado de Guerrero.\nAdministrativo…………….………..........\nCATEGORÍAS\nEspecialista, Jefe (a) de Área, Jefe (a) de Oficina. Auxiliar Administrativo, Técnico Administrativo, Técnico\nCalificado, Profesionista Especializado, Jefe de Oficina/Área.\nPRINCIPALES FUNCIONES\n- Atender y gestionar los asuntos administrativos que requieran su participación como profesional adscrito;\n- Establecer procesos y rutinas de trabajo apegados a los principios del método aplicable a la profesión y materias de su especialidad;\n- Mantener al día, en tiempo y forma los dictámenes, fundamentos legales que permitan el desahogo de trámites y asuntos propios de su área;\nGUERRERO\n- Recopilar datos e información y proceder a su sistematización e interpretación para generar reportes e informes específicos;\n- Proponer elementos de tipo científico, técnico y administrativo sobre asuntos que le sean encomendados y orientar la toma de decisiones sobre los mismos;\n- Investigar, analizar e integrar propuestas técnicas de solución a problemas que requieren un tratamiento profesional;\n- Realizar estudios y trabajo de análisis especializado sujeto a la visión profesional y a la fundamentación técnica de resultados;\n- Integrar y desarrollar dictámenes con sustento propio de enfoque profesional, vinculados a la especialidad de su competencia y responsabilidad;\n- Orientar todos los procesos estratégicos del área de su competencia hacia su certificación con el objeto de lograr la norma ISO 9001;\n- Aplicar íntegramente el Programa Estatal de Ética, Transparencia y Combate a la Corrupción y el Código de Ética, para los Servidores Públicos de la Administración Pública Centralizada y Paraestatal del Estado de Guerrero con todos los miembros del área bajo su responsabilidad predicando para ello con el ejemplo;\n- Las demás que las disposiciones legales le atribuyan, así como, aquéllas que le confiera su superior jerárquico\nGUERRERO\nCATÁLOGO DE PUESTOS RAMA: SUPERNUMERARIO\nCÉDULA DE IDENTIFICACIÓN DE PUESTO\nDENOMINACIÓN DEL\n09. ANALISTA PROFESIONAL\nPUESTO:\nCÓDIGOS DE CATEGORÍAS ÁREAS DE ADSCRIPCIÓN\nDirecciones Generales y/o Jefaturas de Área y/o\nSAPA, SAPB, SAPC, E2A, E2B, E2C\nDepartamentos\nNIVEL DE GESTIÓN SUPERVISIÓN EJERCIDA\nA las personas auxiliares administrativos, auxiliares Operativos y a las demás servidoras y\nN 11 servidores públicos de la Administración Pública\nEstatal adscritos a su área.\nUBICACIÓN EN LA ESTRUCTURA\nGRADO DE ESTUDIOS\nOCUPACIONAL\nEjecutivo del Estado…………………..……….…………\nDe acuerdo a la normatividad específica que\nSecretarías de Despacho……………………………… aplique a la dependencia que esté asignado.\nSubsecretarías…………..…………………………….\nDirecciones Generales…………….…….................\nRESULTADOS ESPERADOS\nDirecciones de Área……..………………………...\nSubdirecciones……….………….....…….….......\nDepartamentos……………….......................... Cumplir y hacer cumplir las atribuciones y\nJefaturas de oficina...................................... facultades conferidas por las leyes, reglamentos, Jefaturas de área especializada…………. manuales y demás normatividad vigente en el\nOperativo……........................................... Estado de Guerrero.\nAdministrativo…………….……........✓\nCATEGORÍAS\nAnalista Profesional.\nPRINCIPALES FUNCIONES\n- Investigar, compilar, comparar, clasificar, analizar y dictaminar información bajo parámetros del conocimiento en áreas afines a las materias que les sean encomendadas;\n- Diseñar, implementar y probar modelos paramétricos o logísticos, para su ejecución en la resolución de problemas de asuntos de tipo técnico de los cuales tenga conocimiento;\n- Evaluar, integrar y desarrollar dictámenes con sustento propio del enfoque profesional;\n- Investigar, analizar, diseñar e integrar propuestas técnicas de solución a problemas que requieren un tratamiento profesional;\nGUERRERO\n- Integrar datos e información y proceder a su sistematización de interpretación para generar reportes e informes específicos;\n- Mantener al día, en tiempo y forma los dictámenes, fundamentos legales, técnicas administrativas que permitan el desahogo de trámites y asuntos propios de su área;\n- Realizar estudios comparados, prospectivas, estimaciones de factibilidad y demás aproximaciones metodológicas que permitan sustentar la viabilidad de proyectos y programas de su área de materia de dominio cognoscitivo;\n- Establecer técnicas y rutinas de trabajo apegados a los principios del método aplicable a la profesión y materias de su dominio;\n- Atender y gestionar los asuntos administrativos que requieran su participación como profesional adscrito a la administración pública;\n- Integrar y analizar datos e información, utilizando tecnologías de la información identificando prioridades y planificando actividades orientados a cumplir con los plazos establecidos;\n- Aportar ideas para la investigación, análisis y diseño de sistemas de gestión para la calidad, así como del sistema de control interno para prevenir actos de corrupción de cualquier naturaleza;\n- Participar en el diseño y desarrollo de políticas para la incorporación de sistemas seguros y funcionales que garanticen la eficiencia y eficacia de todas las acciones de su ámbito de competencia;\n- Planificar, recopilar, organizar, sistematizar y automatizar los datos e información que genera el área de su especialidad;\n- Elaborar informes calendarizados de sus actividades concluidas o en proceso, así como aquéllas que no generan los resultados planeados presentándolos a su superior jerárquico;\n- Atender y gestionar los asuntos administrativos que requieran su participación como profesional adscrito a la administración pública;\n- Contribuir activamente a la capacitación, actualización y especialización del personal adscrito a la dependencia donde presta sus servicios; y\nGUERRERO\nCATÁLOGO DE PUESTOS RAMA: SUPERNUMERARIO\nCÉDULA DE IDENTIFICACIÓN DE PUESTO\nDENOMINACIÓN DEL\n10. ANALISTA TÉCNICO (A)\nPUESTO:\nCÓDIGOS DE CATEGORÍAS ÁREAS DE ADSCRIPCIÓN\nDirecciones Generales Y/o Jefatura de Área y/o\nE1A, E1B, E1C, SATA, SATB, SATC\nJefatura de Departamentos.\nNIVEL DE GESTIÓN SUPERVISIÓN EJERCIDA\nN 11\nUBICACIÓN EN LA ESTRUCTURA\nGRADO DE ESTUDIOS\nOCUPACIONAL\nEjecutivo del Estado…………………..……….………… De acuerdo a la normatividad específica que\nSecretarías de Despacho……………………………… aplique a la dependencia que esté asignado.\nSubsecretarías…………..…………………………….\nDirecciones Generales…………….…….................\nRESULTADOS ESPERADOS\nDirecciones de Área……..………………………...\nSubdirecciones……….………….....…….….......\nDepartamentos……………….......................... Cumplir y hacer cumplir las atribuciones y\nJefaturas de oficina...................................... facultades conferidas por las leyes, reglamentos, Jefaturas de área especializada…………. manuales y demás normatividad vigente en el\nOperativo……........................................... Estado de Guerrero.\nAdministrativo…………….……….......✓\nCATEGORÍAS\nAnalista Técnico\nPRINCIPALES FUNCIONES\n- Establecer métodos y rutinas de trabajo apegados a las técnicas aplicables a los asuntos propios de sus conocimientos;\n- Integración y desarrollo de diagnósticos operativos vinculados a las materias de su capacidad técnica;\n- Aplicar métodos, sistemas de trabajo, prácticas operativas y conocimientos técnicos para el manejo de la información y datos que le sean encomendados;\n- Aplicar las técnicas de análisis financiero y de previsión financiera a los presupuestos autorizados y ejercidos por el área para la cual labora;\nGUERRERO\n- Revisar estudios comparativos, prospectivas, estimación de factibilidad y demás aproximaciones dominio cognoscitivo;\n- Coadyuvar en la aplicación de medidas de disciplina presupuestal considerando para ello los mecanismos de austeridad y racionalidad impulsados por el Ejecutivo del Estado;\n- Impulsar el uso de tecnologías de punta para el desarrollo de sus actividades, sobre todo, en el manejo de información de volumen;\n- Vincular las actividades a desarrollar en su dependencia de adscripción con el Plan Estatal de Desarrollo;\n- Desarrollar las actividades y proyectos que le sean encomendados;\n- Detectar necesidades existentes en el área, y proponer mecanismos de solución a corto mediano y largo plazo;\n- Brindar asistencia técnica a los usuarios en lo referente a su área;\n- Aplicar sus conocimientos a los procesos de capacitación, actualización y especialización del personal que labora en el área de su especialidad; y\nGUERRERO\nCATÁLOGO DE PUESTOS RAMA: SUPERNUMERARIO\nCÉDULA DE IDENTIFICACIÓN DE PUESTO\nDENOMINACIÓN DEL PUESTO: 11. OPERATIVO (A) CALIFICADO (A)\nCÓDIGOS DE CATEGORÍAS ÁREAS DE ADSCRIPCIÓN\nDirecciones Generales o de Área y/o\nO9A, O9B, O9C SES2, BES3, SES1, BES6\nDepartamentos.\nNIVEL DE GESTIÓN SUPERVISIÓN EJERCIDA\nN 10\nUBICACIÓN EN LA ESTRUCTURA\nGRADO DE ESTUDIOS\nOCUPACIONAL\nEjecutivo del Estado…………………..……….………… De acuerdo a la normatividad específica que\nSecretarías de Despacho……………………………… aplique a la dependencia que esté asignado.\nSubsecretarías…………..…………………………….\nDirecciones Generales…………….…….................\nRESULTADOS ESPERADOS\nDirecciones de Área……..………………………...\nSubdirecciones……….………….....…….….......\nDepartamentos……………….......................... Cumplir y hacer cumplir las atribuciones y\nJefaturas de oficina...................................... facultades conferidas por las leyes, reglamentos, Jefaturas de área especializada…………. manuales y demás normatividad vigente en el\nOperativo……........................................... Estado de Guerrero.\nAdministrativo…………….……..........✓\nCATEGORÍAS\nOperativo (a) Calificado (a)\nPRINCIPALES FUNCIONES\n- Desarrollar trabajos vinculados al análisis técnico de procesos operativos que requieran implementos o medios de una ingeniería determinada;\n- Realizar revisiones y formular diagnósticos acerca de materias propias de su especialidad;\n- Realizar diagnósticos técnicos y generar la información necesaria para prevenir disfuncionalidades en las materias o asuntos a su cargo;\nGUERRERO\n- Establecer métodos y rutinas de trabajo apegados a los principios, a las técnicas aplicables a los asuntos propios de sus conocimientos;\n- Recopilar, recibir, revisar, actualizar e integrar formatos, documentos e información de toda clase para la operación, registro, captura y consulta de datos en sistemas manuales, automáticos y/o computarizados relativos a procesos administrativos, técnicos o de cualquier otra índole, de acuerdo a la especialidad y área de asignación;\n- Desarrollar las actividades de digitalización de datos e informes, creando su base de datos correspondiente;\n- Crear, organizar, consultar, modificar y actualizar los archivos para realizar los procesos de trabajo del área;\n- Apoyar la preparación de informes de actividades del área para la cual labora;\n- Registrar, elaborar contestaciones y controlar la solicitud de información pública;\n- Intervenir en el desarrollo de los programas de mejoramiento organizacional de la función administrativa;\nGUERRERO\nCATÁLOGO DE PUESTOS RAMA: SUPERNUMERARIO\nCÉDULA DE IDENTIFICACIÓN DE PUESTO\nDENOMINACIÓN DEL PUESTO: 12. AUXILIAR ESPECIALIZADO (A)\nCÓDIGOS DE CATEGORÍAS ÁREAS DE ADSCRIPCIÓN\nO8A, O8B, O8C Jefaturas de Departamento y/o de Área.\nNIVEL DE GESTIÓN SUPERVISIÓN EJERCIDA\nN 11\nUBICACIÓN EN LA ESTRUCTURA\nGRADO DE ESTUDIOS\nOCUPACIONAL\nEjecutivo del Estado…………………..……….…………\nDe acuerdo a la normatividad específica que\nSecretarías de Despacho……………………………… aplique a la dependencia que esté asignado.\nSubsecretarías…………..…………………………….\nDirecciones Generales…………….…….................\nRESULTADOS ESPERADOS\nDirecciones de Área……..………………………...\nSubdirecciones……….………….....…….….......\nDepartamentos……………….......................... Cumplir y hacer cumplir las atribuciones y\nJefaturas de oficina...................................... facultades conferidas por las leyes, reglamentos, Jefaturas de área especializada…………. manuales y demás normatividad vigente en el\nOperativo……........................................... Estado de Guerrero.\nAdministrativo…………….……........✓\nCATEGORÍAS\nAuxiliar Especializado (a)\nPRINCIPALES FUNCIONES\n- Ejecutar las órdenes de trabajo programadas de conformidad con los procedimientos de mantenimiento establecidos;\n- Operar los procedimientos de recepción de insumos de información y datos; asimismo dar el trámite que indiquen los mismos;\n- Mantener de manera responsable el equipo al que tenga acceso reportando a sus superiores cualquier falla o anomalía del mismo;\nGUERRERO\n- Atender los procedimientos de reparación y resguardo del equipo a su cargo;\n- Aplicar técnicas de operación de equipo, sistemas, procedimientos y demás componentes de operación de los procesos a su cargo;\n- Atender y proveer los insumos técnicos de su especialidad al personal de su área, y en su caso a los usuarios de servicios de la misma;\n- Resolver problemas de operación técnica de los procedimientos del área de trabajo;\n- Verificar la operación adecuada del equipo objeto de su intervención de mantenimiento y asegurarse de su buen funcionamiento;\n- Participar en el buen funcionamiento de su área de adscripción mediante el adecuado aprovechamiento de los insumos institucionales y la correcta operación al que tenga acceso;\n- Cumplir con los programas de mantenimiento preventivo y correctivo, además apoyar mediante operaciones del análisis básico; y\n- Las demás que las disposiciones legales le atribuyan, así como, aquéllas que le confiera su superior\nGUERRERO\nCATÁLOGO DE PUESTOS RAMA: SUPERNUMERARIO\nCÉDULA DE IDENTIFICACIÓN DE PUESTO\nDENOMINACIÓN DEL\n13. AUXILIAR / MAESTRO (A) DE OFICIO\nPUESTO:\nCÓDIGOS DE CATEGORÍAS ÁREAS DE ADSCRIPCIÓN\n07A, O7B, O7C, SMOA, SMOB, SMOC Jefaturas de Departamento y/o de Área\nNIVEL DE GESTIÓN SUPERVISIÓN EJERCIDA\nN 10\nUBICACIÓN EN LA ESTRUCTURA\nGRADO DE ESTUDIOS\nOCUPACIONAL\nEjecutivo del Estado…………………..……….…………\nDe acuerdo a la normatividad específica que\nSecretarías de Despacho……………………………… aplique a la dependencia que esté asignado.\nSubsecretarías…………..…………………………….\nDirecciones Generales…………….…….................\nDirecciones de Área……..………………………... RESULTADOS ESPERADOS\nSubdirecciones……….………….....…….….......\nDepartamentos……………….......................... Cumplir y hacer cumplir las atribuciones y\nJefaturas de oficina...................................... facultades conferidas por las leyes, reglamentos, Jefaturas de área especializada…………. manuales y demás normatividad vigente en el\nOperativo……........................................✓ Estado de Guerrero.\nAdministrativo…………….…….............\nCATEGORÍA\nAuxiliar / Maestro (a) de Oficio, Maestro de Oficio\nPRINCIPALES FUNCIONES\n- Realizar los trabajos y asistencias técnicas que formen parte de sus responsabilidades de trabajo y de las órdenes de servicio programadas, que reciba de su superior jerárquico;\n- Diseñar e implementar el programa de mantenimiento preventivo del equipo, maquinaria e instalaciones de las diferentes áreas que conforman la administración central;\n- Aplicar técnicas de operación de equipos, sistemas, procedimientos y demás componentes de operación de los procesos a su cargo;\n- Atender y proveer los insumos técnicos de su especialidad al personal de su área y en su caso a los usuarios de servicios de la misma;\n- Vigilar y corregir los diferentes equipos y sistemas que se utilizan en las secretarias y dependencias y sus áreas de trabajo tales como sistema eléctrico, red de telefonía local, servicios de agua potable, plomería, albañilería, carpintería, etc.;\nGUERRERO\n- Realizar diagnósticos, verificaciones e inspecciones físicas sobre la operación de los procesos técnicos a su cargo así como los del área que tengan relación con las funciones de su puesto;\n- Integrar y proponer soluciones de adecuación, ajuste, corrección que proceda que sean aplicables a los procesos técnicos a su cargo;\n- Organizar las órdenes de trabajo o servicios a su cargo y atenderlos de conformidad con las normas técnicas aplicables a su ramo de actividad;\n- Resolver los problemas, asuntos, trámites, verificaciones y demás situaciones que se planteen por parte de los usuarios de los servicios a su cargo;\n- Elaborar reportes, informes, actas sobre las actividades realizadas de su especialidad y del área donde presta sus servicios;\n- Llenar la bitácora diaria de servicios, orientado a la prevención para el buen funcionamiento del área de su especialidad;\n- Realizar las diferentes labores que le sean encomendadas, de su especialidad y responsabilidad por su superior jerárquico;\n- Participar activamente en los cursos de capacitación, actualización y especialización que proponga el área de capacitación institucional, con objeto de permanecer continua y permanentemente preparado; y\n- Las demás que las disposiciones legales le atribuyan, así como, aquéllas que le confiera su superior\nGUERRERO\nCATÁLOGO DE PUESTOS RAMA: BASE\nCÉDULA DE IDENTIFICACIÓN DE PUESTO\nDENOMINACIÓN DEL PUESTO: 14. SERVICIOS ADMINISTRATIVOS\nCÓDIGOS DE CATEGORÍAS ÁREAS DE ADSCRIPCIÓN\nO6A, O6B, O6C, SCMGA, SCMGB, SCMGC Jefaturas de Departamento\nNIVEL DE GESTIÓN SUPERVISIÓN EJERCIDA\nN 11\nUBICACIÓN EN LA ESTRUCTURA\nGRADO DE ESTUDIOS\nOCUPACIONAL\nEjecutivo del Estado…………………..……….…………\nDe acuerdo a la normatividad específica que\nSecretarías de Despacho……………………………… aplique a la dependencia que esté asignado.\nSubsecretarías…………..…………………………….\nDirecciones Generales…………….…….................\nDirecciones de Área……..………………………... RESULTADOS ESPERADOS\nSubdirecciones……….………….....…….….......\nDepartamentos……………….......................... Cumplir y hacer cumplir las atribuciones y\nJefaturas de oficina...................................... facultades conferidas por las leyes, reglamentos, Jefaturas de área especializada…………. manuales y demás normatividad vigente en el\nOperativo……........................................ Estado de Guerrero.\nAdministrativo…………….……..........✓\nCATEGORÍAS\nServicios Administrativos, Capturista Mecanógrafa General.\nPRINCIPALES FUNCIONES\n- Atender la gestoría o realizar trámite de los asuntos que le encomiende su jefe inmediato;\n- Realizar prácticas de registro, clasificación y demás operaciones propias del trabajo administrativo;\n- Atender y orientar a los usuarios del área sobre los asuntos que se manejan en la oficina;\n- Atención del área de fotocopiado, líneas telefónicas, atención a usuarios y las demás que se encuentren en la logística de los servicios del área;\nGUERRERO\n- Elaborar e integrar los informes que se requieran, en el ámbito de su competencia;\n- Organizar las actividades y los recursos del servicio, así como fijar los calendarios de trabajo, para el área donde presta sus servicios;\n- Coadyuvar en los eventos relacionados con las festividades organizados por la institución; y\nGUERRERO\nCATÁLOGO DE PUESTOS RAMA: SUPERNUMERARIO\nCÉDULA DE IDENTIFICACIÓN DE PUESTO\nDENOMINACIÓN DEL\n15. APOYO GENERAL\nPUESTO:\nCÓDIGOS DE CATEGORÍAS ÁREAS DE ADSCRIPCIÓN\nDirecciones Generales Y/o Jefatura de Área y/o\nO5A, O5B, O5C, SAGA, SAGB, SAGC\nJefatura de Departamentos.\nNIVEL DE GESTIÓN SUPERVISIÓN EJERCIDA\nN 10\nUBICACIÓN EN LA ESTRUCTURA\nGRADO DE ESTUDIOS\nOCUPACIONAL\nEjecutivo del Estado…………………..……….………… De acuerdo a la normatividad específica que\nSecretarías de Despacho……………………………… aplique a la dependencia que esté asignado.\nSubsecretarías…………..…………………………….\nDirecciones Generales…………….…….................\nRESULTADOS ESPERADOS\nDirecciones de Área……..………………………...\nSubdirecciones……….………….....…….….......\nDepartamentos……………….......................... Cumplir y hacer cumplir las atribuciones y\nJefaturas de oficina...................................... facultades conferidas por las leyes, reglamentos, Jefaturas de área especializada…………. manuales y demás normatividad vigente en el\nOperativo……........................................✓ Estado de Guerrero.\nAdministrativo…………….……..........\nCATEGORÍAS\nApoyo General\nPRINCIPALES FUNCIONES\n- Disponer preventivamente de los insumos, materiales, herramientas e implementos de trabajo, así como, las utilerías requeridas en la realización de un trabajo técnico que se deba atender en ese momento;\n- Tener organizada el área de trabajo y disponer en orden los materiales, herramientas e insumos utilizables, en el desarrollo de su trabajo para que coadyuven al cumplimiento de las funciones del técnico profesional o maestro de oficio del cual depende;\n- Establecer métodos y rutinas de trabajo apegados a los principios, las técnicas aplicables a los asuntos propios de sus conocimientos;\nGUERRERO\n- Sistematizar la localización y organización de los instructivos, órdenes de trabajo, datos o referencias e información técnica de los trabajos a realizar, de conformidad con las órdenes de trabajo;\n- Programar diariamente sus actividades y confirmar el orden o prioridad asignado por el profesional técnico o maestro de oficio responsable de los trabajos ordenados;\n- Operar los procesos laborales a su cargo con eficiencia y mediante el uso adecuado de los materiales, insumos y herramientas destinadas ha dicho fin;\n- Ejecutar las diferentes órdenes de trabajo utilizando las herramientas a su cargo y observando en todo momento las normas de seguridad e higiene establecidas;\n- Integrar y proponer soluciones de adecuación, ajuste, corrección y demás que procedan para que sean aplicables a los procesos técnicos a su cargo;\n- Reportar trabajos y operaciones concluidas a efecto de que sean supervisadas por el técnico profesional o maestro de oficio responsable;\n- Revisar diagnósticos técnicos y generar la información necesaria para prevenir disfuncionalidades en las especialidades técnicas a su cargo;\n- Apoyar en la preparación de los informes de las actividades realizadas del área para la cual labora; y\nGUERRERO\nCATÁLOGO DE PUESTOS RAMA: SUPERNUMERARIO\nCÉDULA DE IDENTIFICACIÓN DE PUESTO\nDENOMINACIÓN DEL PUESTO: 16. SERVICIOS GENERALES\nCÓDIGOS DE CATEGORÍAS ÁREAS DE ADSCRIPCIÓN\nSTGA, STGB, STGC, INR, INA, INR1, INA1, INR2, Direcciones Generales o de Área y/o\nINA2 Departamentos.\nNIVEL DE GESTIÓN SUPERVISIÓN EJERCIDA\nN 10\nUBICACIÓN EN LA ESTRUCTURA\nGRADO DE ESTUDIOS\nOCUPACIONAL\nEjecutivo del Estado………………..……….…………..\nDe acuerdo a la normatividad específica que\nSecretarías de Despacho……………………………. aplique a la dependencia que esté asignado.\nSubsecretarías…………..…………………………..\nDirecciones Generales…………….……...............\nDirecciones de Área……..…………………….... RESULTADOS ESPERADOS\nSubdirecciones……….………….....…….….....\nDepartamentos………………......................... Cumplir y hacer cumplir las atribuciones y\nJefaturas de oficina...................................... facultades conferidas por las leyes, reglamentos, Jefaturas de área especializada…………. manuales y demás normatividad vigente en el\nOperativo…….......................................✓ Estado de Guerrero.\nAdministrativo…………….……..........\nCATEGORÍAS\nServicios Generales, Trabajos Generales, Intendencia.\nPRINCIPALES FUNCIONES\n- Trasladar equipo de oficina en las diferentes direcciones, dentro y fuera del área de la institución:\n- Trasladar y ubicar equipo de oficina de una unidad administrativa a otra;\n- Colaborar con el mantenimiento general de la institución;\n- Colaborar con la limpieza de las áreas verdes y vías de la institución;\n- Limpiar las cunetas, alcantarillados, marquesinas y azoteas;\nGUERRERO\n- Pintar la base de los árboles para contribuir al embellecimiento de las áreas verdes;\n- Limpiar las ventanas, pisos y paredes de edificios de la institución;\n- Lavar, por fuera y por dentro, los vidrios de las ventanas de los edificios;\n- Lavar las paredes y pisos según instrucciones;\n- Colaborar en la realización de proyectos de construcción que se realice en la institución.\n- Derribar paredes, pisos, etc., según instrucciones;\n- Recoger el caliche y demás desperdicios, dejando el área de trabajo limpia;\n- Colaborar en el Almacén General cuando el volumen de trabajo lo requiere;\n- Cargar cajas y equipos de oficina y otros materiales;\n- Realizar otras tareas según las funciones de la unidad donde labora; y\nGUERRERO\nCÉDULAS DE IDENTIFICACIÓN DE PUESTOS SEGURIDAD PÚBLICA Y PROTECCIÓN CIVIL.\nGUERRERO\nCATÁLOGO DE PUESTOS RAMA: SEGURIDAD PÚBLICA OPERATIVO\nCÉDULA DE IDENTIFICACIÓN DE PUESTO\nDENOMINACIÓN DEL\nB01. COMISARIO ACREDITABLE ANÁLISIS TÁCTICO\nPUESTO:\nCÓDIGOS DE CATEGORÍAS ÁREAS DE ADSCRIPCIÓN\nT80001 Subsecretaría de Prevención y Operación Policial.\nNIVEL DE GESTIÓN SUPERVISIÓN EJERCIDA\nA las servidoras y servidores públicos de la\nN 10 Administración Pública Estatal adscritos a su mando.\nUBICACIÓN EN LA ESTRUCTURA\nGRADO DE ESTUDIOS\nOCUPACIONAL\nEjecutivo del Estado……………………..……….……… De acuerdo a la normatividad específica que\nSecretarías de Despacho……………………….…… aplique a la dependencia que esté asignado.\nSubsecretarías…………..……………………..….\nDirecciones Generales………………..............\nRESULTADOS ESPERADOS\nDirecciones de Área……..……….……...….\nSubdirecciones……...…….….………....\nCumplir y hacer cumplir las atribuciones y\nDepartamentos…….......................... facultades conferidas por las leyes, reglamentos, Jefaturas de oficina………........... manuales y demás normatividad vigente en el\nJefaturas de área especializada…\nEstado de Guerrero.\nOperativo….............................. ✓\nAdministrativo……………….....\nPRINCIPALES FUNCIONES\n- Dirigir la Unidad de Análisis Táctico;\n- Dotar al Secretario de Seguridad Pública de información que le permita realizar la toma de decisiones;\n- Dirigir la planeación, obtención, procesamiento y aprovechamiento de los productos obtenidos de la recolección de información encaminada a contrarrestar altos niveles de índices delincuenciales;\n- Crear políticas tendientes a la protección de la información concentrada en las bases de datos del área bajo su mando;\n- Establecer lineamientos para realizar el cruce de información con otras corporaciones policiacas;\nGUERRERO\n- Crear lineamientos que permitan homologar la recolección, clasificación, registro, análisis, evaluación y explotación de información en las regiones operativas que integran la Secretaría de Seguridad Pública;\n- Dirigir la actualización de información y estadísticas que servirán a la Secretaría de Seguridad Pública para la implementación de acciones operativas en las zonas geográficas que así lo requieran; y\n- Las demás que las disposiciones legales le atribuyan, así como, aquéllas que le confiera su superior\nGUERRERO\nCATÁLOGO DE PUESTOS RAMA: SEGURIDAD PÚBLICA OPERATIVO\nCÉDULA DE IDENTIFICACIÓN DE PUESTO\nDENOMINACIÓN DEL\nB02. COMISARIO ACREDITABLE INVESTIGACIÓN\nPUESTO:\nCÓDIGOS DE CATEGORÍAS ÁREAS DE ADSCRIPCIÓN\nI80011 Subsecretaría de Prevención y Operación Policial.\nNIVEL DE GESTIÓN SUPERVISIÓN EJERCIDA\nA las servidoras y servidores públicos de la\nN 10 Administración Pública Estatal adscritos a su mando.\nUBICACIÓN EN LA ESTRUCTURA\nGRADO DE ESTUDIOS\nOCUPACIONAL\nEjecutivo del Estado……………………..……….……… De acuerdo a la normatividad específica que\nSecretarías de Despacho……………………….…… aplique a la dependencia que esté asignado.\nSubsecretarías…………..……………………..….\nDirecciones Generales………………..............\nRESULTADOS ESPERADOS\nDirecciones de Área……..……….……...….\nSubdirecciones……...…….….………....\nCumplir y hacer cumplir las atribuciones y\nDepartamentos……..........................\nJefaturas de oficina………........... facultades conferidas por las leyes, reglamentos, manuales y demás normatividad vigente en el\nJefaturas de área especializada…\nOperativo….............................. ✓ Estado de Guerrero.\nAdministrativo……………….....\nPRINCIPALES FUNCIONES\n- Dirigir la Unidad de Investigaciones;\n- Elaborar y planear métodos para la implementación de acciones encubiertas;\n- Establecer estrategias de protección de documentos e información relacionados con las investigaciones, a fin de evitar la fuga de información;\n- Coordinar las investigaciones que lleven a la ubicación de personas o grupos delictivos con el objeto de evitar la comisión de delitos;\n- Coordinar las entrevistas de las personas que pudieran aportar información de lugares o personas relacionados con delitos;\nGUERRERO\n- Dirigir la investigación que permita recopilar e integrar información encaminada a la prevención y combate de grupos delincuenciales;\n- Coordinar operativos de vigilancia, seguimientos, coberturas e infiltraciones que permitan la recopilación de información con la finalidad de desarticular organizaciones o grupos delictivos; y\n- Las demás que las disposiciones legales le atribuyan, así como, aquéllas que le confiera su superior\nGUERRERO\nCATÁLOGO DE PUESTOS RAMA: SEGURIDAD PÚBLICA OPERATIVO\nCÉDULA DE IDENTIFICACIÓN DE PUESTO\nDENOMINACIÓN DEL\nB03. COMISARIO ACREDITABLE OPERACIONES\nPUESTO:\nCÓDIGOS DE CATEGORÍAS ÁREAS DE ADSCRIPCIÓN\nO80021 Subsecretaría de Prevención y Operación Policial.\nNIVEL DE GESTIÓN SUPERVISIÓN EJERCIDA\nA las servidoras y servidores públicos de la\nN 10 Administración Pública Estatal adscritos a su mando.\nUBICACIÓN EN LA ESTRUCTURA\nGRADO DE ESTUDIOS\nOCUPACIONAL\nEjecutivo del Estado……………………..……….……… De acuerdo a la normatividad específica que\nSecretarías de Despacho……………………….…… aplique a la dependencia que esté asignado.\nSubsecretarías…………..……………………..….\nDirecciones Generales………………..............\nRESULTADOS ESPERADOS\nDirecciones de Área……..……….……..….\nSubdirecciones……...…….….………....\nDepartamentos…….......................... Cumplir y hacer cumplir las atribuciones y\nJefaturas de oficina………........... facultades conferidas por las leyes, reglamentos, Jefaturas de área especializada.. manuales y demás normatividad vigente en el\nOperativo….............................. ✓ Estado de Guerrero.\nAdministrativo……………….....\nPRINCIPALES FUNCIONES\n- Proponer al Secretario de Seguridad Pública las estrategias y líneas acción que conduzcan al debido cumplimiento de las misiones y objetivos de la Policía Estatal;\n- Coordinar y establecer enlaces con las Secretarías de Seguridad Pública de otros estados;\n- Planear acciones operativas en coordinación con otros estados que tengan límites territoriales en nuestra entidad;\n- Coordinar operativos inter-regionales;\n- Establecer estrategias de apoyo a la seguridad pública de los municipios;\n- Coordinar apoyos logísticos para los operativos previamente planeados;\nGUERRERO\n- Fortalecer la prevención de los delitos mediante la implementación de operativos tendientes a inhibir la comisión de los mismos;\n- Coordinar juntas ejecutivas de trabajo;\n- Establecer protocolos de seguridad a instalaciones estratégicas del estado;\n- Dirigir operativos de intervenciones especiales;\n- Autorizar los sectores de patrullaje en zonas urbanas y rurales que permitan inhibir la comisión de delitos;\n- Las demás que las disposiciones legales le atribuyan, así como aquéllas que le confiera superior\nGUERRERO\nCATÁLOGO DE PUESTOS RAMA: SEGURIDAD PÚBLICA OPERATIVO\nCÉDULA DE IDENTIFICACIÓN DE PUESTO\nDENOMINACIÓN DEL PUESTO: B04. INSPECTOR\nCÓDIGOS DE CATEGORÍAS ÁREAS DE ADSCRIPCIÓN\nSubsecretaría de Prevención y Operación Policial, 70102, BE3A, BE2C, O6B, O6C Secretaría del Trabajo y Previsión Social o\nComisión Técnica de Transporte y Vialidad\nNIVEL DE GESTIÓN SUPERVISIÓN EJERCIDA\nA las servidoras y servidores públicos de la\nN 10 Administración Pública Estatal adscritos a su mando.\nUBICACIÓN EN LA ESTRUCTURA\nGRADO DE ESTUDIOS\nOCUPACIONAL\nEjecutivo del Estado……………………..……….……\nDe acuerdo a la normatividad específica que\nSecretarías de Despacho……………………….… aplique a la dependencia que esté asignado.\nSubsecretarías…………..……………………..\nDirecciones Generales………………............\nDirecciones de Área……..……….……..\nRESULTADOS ESPERADOS\nSubdirecciones……...…….….………..\nDepartamentos……........................\nCumplir y hacer cumplir las atribuciones y\nJefaturas de oficina………......... facultades conferidas por las leyes, reglamentos, Jefaturas de área especializada. manuales y demás normatividad vigente en el\nOperativo…............................ ✓\nEstado de Guerrero.\nAdministrativo………………...\nPRINCIPALES FUNCIONES\n- Ejecutar acciones de verificación, supervisión de procedimientos y actividades sujetas a control normativo y operativo;\n- Visitar, inspeccionar o cualquier otra diligencia que considere pertinente;\n- Realimentar los procesos de autoridad, mando y dirección mediante los reportes y dictámenes de supervisión;\n- Coordinar las actividades extra-programáticas y que se desarrollen en la institución con respecto a sus deberes;\n- Determinar las acciones necesarias, para la ejecución de estrategias operativas a fin de proteger su integridad y la de terceros, conforme a las disposiciones legales aplicables;\nGUERRERO\n- Fomentar la disciplina con el personal a su cargo;\n- Coordinar y establecer enlaces con las Secretarías de Seguridad Pública de otros estados;\n- Planear acciones operativas en coordinación con otros estados que tengan límites territoriales en nuestra entidad;\n- Coordinar los apoyos logísticos para los operativos previamente planeados;\n- Coordinar juntas ejecutivas de trabajo;\n- Dirigir operativos de intervenciones especiales; y\n- Las demás que las disposiciones legales le atribuyan, así como, aquéllas que le confiera su superior\nGUERRERO\nCATÁLOGO DE PUESTOS RAMA: SEGURIDAD PÚBLICA OPERATIVO\nCÉDULA DE IDENTIFICACIÓN DE PUESTO\nDENOMINACIÓN DEL\nB05. INSPECTOR ACREDITABLE ANÁLISIS TÁCTICO\nPUESTO:\nCÓDIGOS DE CATEGORÍAS ÁREAS DE ADSCRIPCIÓN\nT80002 Subsecretaría de Prevención y Operación Policial.\nNIVEL DE GESTIÓN SUPERVISIÓN EJERCIDA\nA las servidoras y servidores públicos de la\nN 10 Administración Pública Estatal adscritos a su mando.\nUBICACIÓN EN LA ESTRUCTURA\nGRADO DE ESTUDIOS\nOCUPACIONAL\nEjecutivo del Estado……………………………………\nDe acuerdo a la normatividad específica que\nSecretarías de Despacho………………………...… aplique a la dependencia que esté asignado.\nSubsecretarías…………………..……………..….\nDirecciones Generales………..……................\nDirecciones de Área……..……….…....….\nRESULTADOS ESPERADOS\nSubdirecciones……….…………........….\nDepartamentos………………..............\nCumplir y hacer cumplir las atribuciones y\nJefaturas de oficina………................ facultades conferidas por las leyes, reglamentos, Jefaturas de área especializada ….. manuales y demás normatividad vigente en el\nOperativo…................................. ✓\nEstado de Guerrero.\nAdministrativo ……………….......\nPRINCIPALES FUNCIONES\n- Dirigir la planeación, obtención, procesamiento y aprovechamiento de los productos obtenidos de la recolección de información encaminada a contrarrestar altos niveles de índices delincuenciales;\n- Crear políticas tendientes a la protección de la información concentrada en las bases de datos del área bajo su mando;\n- Establecer lineamientos para realizar el cruce de información con otras corporaciones policiacas;\nGUERRERO\n- Crear lineamientos que permitan homologar la recolección, clasificación, registro, análisis, evaluación\nPública;\n- Dirigir la actualización de información y estadísticas que servirán a la Secretaría de Seguridad Pública para la implementación de acciones operativas en las zonas geográficas que así lo requieran; y\nGUERRERO\nCATÁLOGO DE PUESTOS RAMA: SEGURIDAD PÚBLICA OPERATIVO\nCÉDULA DE IDENTIFICACIÓN DE PUESTO\nDENOMINACIÓN DEL\nB06. INSPECTOR ACREDITABLE INVESTIGACIÓN\nPUESTO:\nCÓDIGOS DE CATEGORÍAS ÁREAS DE ADSCRIPCIÓN\nT80012 Subsecretaría de Prevención y Operación Policial.\nNIVEL DE GESTIÓN SUPERVISIÓN EJERCIDA\nA las servidoras y servidores públicos de la\nN 10 Administración Pública Estatal adscritos a su mando.\nUBICACIÓN EN LA ESTRUCTURA\nGRADO DE ESTUDIOS\nOCUPACIONAL\nEjecutivo del\nEstado…………………………………..……….……… De acuerdo a la normatividad específica que\nSecretarías de aplique a la dependencia que esté asignado.\nDespacho……………………………………………\nRESULTADOS ESPERADOS\nSubsecretarías…………………..………………………\n……….\nDirecciones\nGenerales…………………….…………..............\nDirecciones de\nÁrea……..……….…………..………...….\nSubdirecciones……….………….....…….….………....\nCumplir y hacer cumplir las atribuciones y facultades conferidas por las leyes, reglamentos, Departamentos………………...................................... manuales y demás normatividad vigente en el\nJefaturas de\nEstado de Guerrero. oficina……….......................................\nJefaturas de área especializada………………..\nOperativo……................................................. ✓\nAdministrativo……………….……….....\nGUERRERO\nPRINCIPALES FUNCIONES\n- Elaborar y planear métodos para la implementación de acciones encubiertas;\n- Establecer estrategias de protección de documentos e información relacionados con las investigaciones, a fin de evitar la fuga de información;\n- Coordinar las investigaciones que lleven a la ubicación de personas o grupos delictivos con el objeto de evitar la comisión de delitos;\n- Coordinar las entrevistas de las personas que pudieran aportar información de lugares o personas relacionados con delitos;\n- Dirigir la investigación que permita recopilar e integrar información encaminada a la prevención y combate de grupos delincuenciales;\n- Coordinar operativos de vigilancia, seguimientos, coberturas e infiltraciones que permitan la recopilación de información con la finalidad de desarticular organizaciones o grupos delictivos; y\nGUERRERO\nCATÁLOGO DE PUESTOS RAMA: SEGURIDAD PÚBLICA OPERATIVO\nCÉDULA DE IDENTIFICACIÓN DE PUESTO\nDENOMINACIÓN DEL PUESTO: B07. INSPECTOR ACREDITABLE OPERACIONES\nCÓDIGOS DE CATEGORÍAS ÁREAS DE ADSCRIPCIÓN\nT80022 Subsecretaría de Prevención y Operación Policial.\nNIVEL DE GESTIÓN SUPERVISIÓN EJERCIDA\nA las servidoras y servidores públicos de la\nN 10 Administración Pública Estatal adscritos a su mando.\nUBICACIÓN EN LA ESTRUCTURA\nGRADO DE ESTUDIOS\nOCUPACIONAL\nEjecutivo del\nDe acuerdo a la normatividad específica que\nEstado…………………………………..……….……… aplique a la dependencia que esté asignado.\nSecretarías de\nDespacho……………………………………………\nRESULTADOS ESPERADOS\nSubsecretarías…………………..………………………\n……….\nDirecciones\nGenerales…………………….…………..............\nDirecciones de\nÁrea……..……….…………..………...….\nSubdirecciones……….………….....…….….……….... Cumplir y hacer cumplir las atribuciones y facultades conferidas por las leyes, reglamentos, Departamentos………………...................................... manuales y demás normatividad vigente en el\nJefaturas de Estado de Guerrero. oficina……….......................................\nJefaturas de área especializada………………..\nOperativo……................................................. ✓\nAdministrativo……………….……….....\nGUERRERO\nPRINCIPALES FUNCIONES\n- Coordinar y establecer enlaces con las Secretarías de Seguridad Pública de otros estados;\n- Planear acciones operativas en coordinación con otros estados que tengan límites territoriales en nuestra entidad;\n- Coordinar operativos inter-regionales;\n- Establecer estrategias de apoyo a la seguridad pública de los municipios;\n- Coordinar apoyos logísticos para los operativos previamente planeados;\n- Fortalecer la prevención de los delitos mediante la implementación de operativos tendientes a inhibir la comisión de los mismos;\n- Coordinar juntas ejecutivas de trabajo;\n- Establecer protocolos de seguridad a instalaciones estratégicas del Estado;\n- Dirigir operativos de intervenciones especiales;\n- Autorizar los sectores de patrullaje en zonas urbanas y rurales que permitan inhibir la comisión de delitos; y\nGUERRERO\nCATÁLOGO DE PUESTOS RAMA: SEGURIDAD PÚBLICA OPERATIVO\nCÉDULA DE IDENTIFICACIÓN DE PUESTO\nDENOMINACIÓN DEL\nB08. INVESTIGADOR(A) SOCIO-ECONÓMICO(A)\nPUESTO:\nCÓDIGOS DE CATEGORÍAS ÁREAS DE ADSCRIPCIÓN\n30713, 30714 Subsecretaría de Prevención y Operación Policial.\nNIVEL DE GESTIÓN SUPERVISIÓN EJERCIDA\nA las servidoras y servidores públicos de la\nN 10 Administración Pública Estatal adscritos a su mando.\nUBICACIÓN EN LA ESTRUCTURA\nGRADO DE ESTUDIOS\nOCUPACIONAL\nEjecutivo del\nEstado…………………………………..……….………\nDe acuerdo a la normatividad específica que\nSecretarías de aplique a la dependencia que esté asignado.\nDespacho……………………………………………\nSubsecretarías…………………..………………………\nRESULTADOS ESPERADOS\n……….\nDirecciones\nGenerales…………………….…………..............\nDirecciones de\nÁrea……..……….…………..………...….\nSubdirecciones……….………….....…….….………....\nCumplir y hacer cumplir las atribuciones y\nDepartamentos………………...................................... facultades conferidas por las leyes, Jefaturas de reglamentos, manuales y demás normatividad oficina………....................................... vigente en el Estado de Guerrero.\nJefaturas de área especializada………………..\nOperativo……................................................. ✓\nAdministrativo……………….……….....\nGUERRERO\nPRINCIPALES FUNCIONES\n- Hacer visitas domiciliarias eventuales;\n- Programar estudios socioeconómicos;\n- Realizar cuestionarios/entrevistas;\n- Revisar documentos;\n- Recabar información, documentación y referencias;\n- Realizar toma de fotografías;\n- Investigar antecedentes laborales, administrativos, económicos y patrimoniales;\n- Sistematizar y automatizar la base de datos creada para la integración de los datos e información que continua y permanentemente obtienen, con objeto de informar con la mayor precisión posible a su jefe inmediato superior; y\nGUERRERO\nCATÁLOGO DE PUESTOS RAMA: SEGURIDAD PÚBLICA OPERATIVO\nCÉDULA DE IDENTIFICACIÓN DE PUESTO\nDENOMINACIÓN DEL PUESTO: B09. OFICIAL\nCÓDIGOS DE CATEGORÍAS ÁREAS DE ADSCRIPCIÓN\nSMT2, 70103 Subsecretaría de Prevención y Operación Policial.\nNIVEL DE GESTIÓN SUPERVISIÓN EJERCIDA\nN 10\nUBICACIÓN EN LA ESTRUCTURA\nGRADO DE ESTUDIOS\nOCUPACIONAL\nEjecutivo del\nEstado…………………………………..……….……… De acuerdo a la normatividad específica que\nSecretarías de aplique a la dependencia que esté asignado.\nDespacho……………………………………………\nSubsecretarías…………………..……………………… RESULTADOS ESPERADOS\n……….\nDirecciones\nGenerales…………………….…………..............\nDirecciones de\nÁrea……..……….…………..………...….\nSubdirecciones……….………….....…….….………....\nCumplir y hacer cumplir las atribuciones y facultades conferidas por las leyes, reglamentos, Departamentos………………...................................... manuales y demás normatividad vigente en el\nJefaturas de\nEstado de Guerrero. oficina……….......................................\nJefaturas de área especializada………………..\nOperativo……................................................. ✓\nAdministrativo……………….……….....\nPRINCIPALES FUNCIONES\nGUERRERO\n- Tener la capacidad para tomar el mando de un grupo operativo, un sector, una comandancia regional o una coordinación regional;\n- Supervisar los servicios asignados del personal subalterno, para el debido y estricto cumplimiento del servicio encomendado;\n- Coordinar la elaboración de despliegues operativos a implementarse en diversas actividades, eventos y situaciones de riesgo o donde haya concentración masiva de personas y pudiera estar en riesgo su integridad física y el orden público;\n- Coordinar operativos intermunicipales e interregionales;\n- Elaborar informes de las actividades y misiones encomendadas, para notificar los resultados derivados de las mismas;\n- Auxiliar de forma inmediata a la población en caso de siniestros y desastres naturales, a fin de proteger su integridad y la de terceros, conforme a las disposiciones legales aplicables;\n- Aplicar estrategias de reacción en situaciones de disturbios civiles que pongan en riesgo la integridad física y patrimonial de la población;\n- Proteger las áreas estratégicas del estado a fin de evitar que se altere el orden y la paz pública;\n- Llevar a cabo patrullajes de seguridad en espacios públicos, con la finalidad de prevenir e inhibir la comisión de delitos que vulneren la integridad física y patrimonial de la ciudadanía;\n- Preservar el lugar de los hechos, para evitar que se contamine;\n- Prestar los servicios de seguridad y vigilancia que se le encomiende, uniformado o de civil cuando en apoyo de corporaciones o autoridades se le asigne por orden escrita de autoridad superior;\n- Proteger la integridad física de las personas detenidas por la comisión de algún delito, en tanto se ponen a disposición de la autoridad competente;\n- Realizar detenciones en flagrancia y poner al detenido de inmediato ante la autoridad competente;\n- Realizar labores de proximidad social atendiendo de manera oportuna e inmediata las quejas que le exponga la ciudadanía y que estén en su ámbito de competencia;\n- Aplicar de manera correcta y conforme a derecho el uso legítimo de la fuerza;\n- Brindar seguridad en el traslado de internos en base a la petición de la unidad de traslados;\n- Informar al superior jerárquico de manera inmediata los acontecimientos relevantes que se generan dentro de su servicio de seguridad y vigilancia;\n- Explotar los productos proporcionados por la Unidad de Análisis Táctico;\n- Obedecer y ejecutar estrictamente la orden superior conforme a la ley, tener la capacidad de comandar a su unidad en los servicios y operaciones encomendadas;\nGUERRERO\n- Aplicar de manera imparcial las leyes y reglamentos que rigen la función policial; y\nGUERRERO\nCATÁLOGO DE PUESTOS RAMA: SEGURIDAD PÚBLICA OPERATIVO\nCÉDULA DE IDENTIFICACIÓN DE PUESTO\nDENOMINACIÓN DEL PUESTO: B10. OFICIAL ACREDITABLE ANÁLISIS TÁCTICO\nCÓDIGOS DE CATEGORÍAS ÁREAS DE ADSCRIPCIÓN\nT80004 Subsecretaría de Prevención y Operación Policial.\nNIVEL DE GESTIÓN SUPERVISIÓN EJERCIDA\nN 10\nUBICACIÓN EN LA ESTRUCTURA OCUPACIONAL GRADO DE ESTUDIOS\nEjecutivo del\nDe acuerdo a la normatividad específica que\nEstado…………………………………..……….……… aplique a la dependencia que esté asignado.\nSecretarías de\nDespacho……………………………………………\nRESULTADOS ESPERADOS\nSubsecretarías…………………..……………………………\n….\nDirecciones\nGenerales…………………….…………..............\nDirecciones de\nÁrea……..……….…………..………...….\nSubdirecciones……….………….....…….….……….... Cumplir y hacer cumplir las atribuciones y facultades conferidas por las leyes, reglamentos, Departamentos………………...................................... manuales y demás normatividad vigente en el\nJefaturas de Estado de Guerrero. oficina……….......................................\nJefaturas de área especializada………………..\nOperativo……................................................. ✓\nAdministrativo……………….……….....\nPRINCIPALES FUNCIONES\nGUERRERO\n- Cumplir con las medidas de disciplina y línea de mando que rige al Cuerpo de la Policía Estatal;\n- Tener la capacidad para tomar el mando de un grupo operativo, un sector, una comandancia regional o una coordinación regional;\n- Supervisar los servicios asignados al personal subalterno, para el debido y estricto cumplimiento del servicio encomendado;\n- Coordinar la elaboración de despliegues operativos a implementarse en diversas actividades, eventos y situaciones de riesgo o donde haya concentración masiva de personas y pudiera estar en riesgo su integridad física y el orden público;\n- Coordinar operativos intermunicipales e interregionales;\n- Elaborar informes de las actividades y misiones encomendadas, para notificar los resultados derivados de las mismas;\n- Sujetarse a la disciplina que rige el Cuerpo de Policía Estatal y tener la capacidad para comandar la unidad a su cargo;\n- Auxiliar de forma inmediata a la población en caso de siniestros y desastres naturales, a fin de proteger su integridad, conforme a las disposiciones legales aplicables;\n- Aplicar estrategias de reacción en situaciones de disturbios civiles que pongan en riesgo la integridad física y patrimonial de la población;\n- Proteger las áreas estratégicas del estado a fin de evitar que se alteren el orden y la paz pública;\n- Llevar a cabo patrullajes de seguridad en espacios públicos, con la finalidad de prevenir e inhibir la comisión de delitos que vulneren la integridad física y patrimonial de la ciudadanía;\n- Preservar el lugar de los hechos, para evitar que se contamine;\n- Prestar los servicios de seguridad y vigilancia que se le encomiende, uniformado o de civil cuando en apoyo de corporaciones o autoridades se le asigne por orden escrita de autoridad superior;\n- Proteger la integridad física de las personas detenidas por la comisión de algún delito, en tanto se ponen a disposición de la autoridad competente;\n- Realizar detenciones en flagrancia y poner al detenido de inmediato a disposición ante la autoridad competente;\n- Realizar labores de proximidad social atendiendo de manera oportuna e inmediata las quejas que le exponga la ciudadanía y que estén en su ámbito de competencia;\n- Aplicar de manera correcta y conforme a derecho el uso legítimo de la fuerza;\n- Brindar seguridad en el traslado de internos en base a la petición de la unidad de traslados;\n- Informar al superior jerárquico de manera inmediata los acontecimientos relevantes que se generan dentro de su servicio de seguridad y vigilancia;\n- Explotar los productos proporcionados por la Unidad de Análisis Táctico;\nGUERRERO\n- Obedecer y ejecutar estrictamente una orden superior, siempre y cuando no contravenga a la ley;\n- Aplicar de manera imparcial las leyes y reglamentos que rigen la función policial; y\nGUERRERO\nCATÁLOGO DE PUESTOS RAMA: SEGURIDAD PÚBLICA OPERATIVO\nCÉDULA DE IDENTIFICACIÓN DE PUESTO\nDENOMINACIÓN DEL PUESTO: B11. OFICIAL ACREDITABLE INVESTIGACIÓN\nCÓDIGOS DE CATEGORÍAS ÁREAS DE ADSCRIPCIÓN\nI80014 Subsecretaría de Prevención y Operación Policial.\nNIVEL DE GESTIÓN SUPERVISIÓN EJERCIDA\nN 10\nUBICACIÓN EN LA ESTRUCTURA\nGRADO DE ESTUDIOS\nOCUPACIONAL\nEjecutivo del\nDe acuerdo a la normatividad específica que\nEstado…………………………………..……….……… aplique a la dependencia que esté asignado.\nSecretarías de\nDespacho……………………………………………\nRESULTADOS ESPERADOS\nSubsecretarías…………………..………………………\n……….\nDirecciones\nGenerales…………………….…………..............\nDirecciones de\nÁrea……..……….…………..………...….\nSubdirecciones……….………….....…….….……….... Cumplir y hacer cumplir las atribuciones y facultades conferidas por las leyes, reglamentos, Departamentos………………...................................... manuales y demás normatividad vigente en el\nJefaturas de Estado de Guerrero. oficina……….......................................\nJefaturas de área especializada………………..\nOperativo……................................................. ✓\nAdministrativo……………….……….....\nPRINCIPALES FUNCIONES\n- Elaborar y planear métodos para la implementación de acciones encubiertas;\n- Coordinar las funciones de investigación en ausencia de algún mando de mayor jerarquía;\n- Coordinar operaciones encubiertas, con el fin de obtener información requerida;\n- Dirigir la investigación que permita recopilar e integrar información encaminada a la prevención y combate de grupos delincuenciales;\nGUERRERO\n- Coordinar tareas de vigilancia “fijas y móviles” a personas identificadas con la finalidad de conocer sus actividades;\n- Coordinar las investigaciones que lleven a la ubicación de personas o grupos delictivos con el objeto de evitar la comisión de delitos;\n- Realizar informes de los resultados obtenidos al superior inmediato, para determinar acciones conducentes;\n- Relacionar información de personas involucradas en algún hecho delictivo;\n- Desarrollar técnicas de entrevista e interrogatorios a personas previamente identificadas para obtener mayor información requerida;\n- Infiltrarse dentro de un grupo que se requiera investigar, para conocer sus actividades si éstas se consideran un riesgo para la seguridad del estado;\n- Tener la capacidad adecuada para manejar un perfil acorde al grupo al que se va a infiltrar;\n- Tener habilidades para el manejo y uso correcto de tecnología de punta que se utiliza en el proceso de la investigación;\n- Prestar los servicios de seguridad y vigilancia que se le encomiende, uniformado o de civil cuando en apoyo de corporaciones o autoridades se le asigne por orden escrita de autoridad superior;\n- Realizar investigaciones tendientes a la prevención de delitos en determinadas áreas geográficas;\n- Realizar acciones tendientes a bajar los índices delincuenciales;\n- Llevar a cabo labores de inteligencia social, con la finalidad de conocer los niveles de incidencia delictiva en diversas áreas geográficas;\n- Proponer al mando la implementación de algún operativo que considere pertinente en las áreas que de acuerdo a su investigación considere como focos rojos;\n- Establecer estrategias de protección de documentos e información relacionados con las investigaciones, a fin de evitar la fuga de información;\n- Coordinar operativos de vigilancia, seguimientos, coberturas e infiltraciones que permitan la recopilación de información con la finalidad de desarticular organizaciones o grupos delictivos; y\nGUERRERO\nCATÁLOGO DE PUESTOS RAMA: SEGURIDAD PÚBLICA OPERATIVO\nCÉDULA DE IDENTIFICACIÓN DE PUESTO\nDENOMINACIÓN DEL PUESTO: B12. OFICIAL ACREDITABLE OPERACIONES\nCÓDIGOS DE CATEGORÍAS ÁREAS DE ADSCRIPCIÓN\nO80024 Subsecretaría de Prevención y Operación Policial.\nNIVEL DE GESTIÓN SUPERVISIÓN EJERCIDA\nN 10\nUBICACIÓN EN LA ESTRUCTURA\nGRADO DE ESTUDIOS\nOCUPACIONAL\nEjecutivo del\nDe acuerdo a la normatividad específica que\nEstado…………………………………..……….……… aplique a la dependencia que esté asignado.\nSecretarías de\nDespacho……………………………………………\nRESULTADOS ESPERADOS\nSubsecretarías…………………..………………………\n……….\nDirecciones\nGenerales…………………….…………..............\nDirecciones de\nÁrea……..……….…………..………...….\nSubdirecciones……….………….....…….….……….... Cumplir y hacer cumplir las atribuciones y facultades conferidas por las leyes, reglamentos, Departamentos………………...................................... manuales y demás normatividad vigente en el\nJefaturas de Estado de Guerrero. oficina……….......................................\nJefaturas de área especializada………………..\nOperativo……................................................. ✓\nAdministrativo……………….……….....\nPRINCIPALES FUNCIONES\n- Cumplir con las medidas de disciplina y línea de mando que rige al Cuerpo de la Policía Estatal;\n- Tener la capacidad para tomar el mando de un grupo operativo, un sector, una comandancia regional o una coordinación regional;\n- Supervisar los servicios asignados al personal subalterno, para el debido y estricto cumplimiento del servicio encomendado;\nGUERRERO\n- Coordinar la elaboración de despliegues operativos a implementarse en diversas actividades, eventos y integridad física y el orden público;\n- Coordinar operativos intermunicipales e interregionales;\n- Elaborar informes de las actividades y misiones encomendadas, para notificar los resultados derivados de las mismas;\n- Auxiliar de forma inmediata a la población en caso de siniestros y desastres naturales, a fin de proteger su integridad, conforme a las disposiciones legales aplicables;\n- Aplicar estrategias de reacción en situaciones de disturbios civiles que pongan en riesgo la integridad física y patrimonial de la población;\n- Proteger las áreas estratégicas del Estado a fin de evitar que se alteren el orden y la paz pública;\n- Llevar a cabo patrullajes de seguridad en espacios públicos, con la finalidad de prevenir e inhibir la comisión de delitos que vulneren la integridad física y patrimonial de la ciudadanía;\n- Preservar el lugar de los hechos, para evitar que se contamine;\n- Prestar los servicios de seguridad y vigilancia que se le encomiende, uniformado o de civil cuando en apoyo de corporaciones o autoridades se le asigne por orden escrita de autoridad superior;\n- Proteger la integridad física de las personas detenidas por la comisión de algún delito, en tanto se ponen a disposición de la autoridad competente;\n- Realizar detenciones en flagrancia y poner al detenido de inmediato a disposición ante la autoridad competente;\n- Realizar labores de proximidad social atendiendo de manera oportuna e inmediata las quejas que le exponga la ciudadanía y que estén en su ámbito de competencia;\n- Aplicar de manera correcta y conforme a derecho el uso legítimo de la fuerza;\n- Brindar seguridad en el traslado de internos en base a la petición de la unidad de traslados;\n- Informar al superior jerárquico de manera inmediata los acontecimientos relevantes que se generen dentro de su servicio de seguridad y vigilancia;\n- Explotar los productos proporcionados por la Unidad de Análisis Táctico;\n- Obedecer y ejecutar estrictamente una orden, siempre y cuando no contravenga la ley;\n- Aplicar de manera imparcial las leyes y reglamentos que rigen la función policial; y\nGUERRERO\nCATÁLOGO DE PUESTOS RAMA: SEGURIDAD PÚBLICA OPERATIVO\nCÉDULA DE IDENTIFICACIÓN DE PUESTO\nDENOMINACIÓN DEL PUESTO: B13. OFICIAL PENITENCIARIO ACREDITABLE\nCÓDIGOS DE CATEGORÍAS ÁREAS DE ADSCRIPCIÓN\nO80035 Subsecretaría del Sistema Penitenciario.\nNIVEL DE GESTIÓN SUPERVISIÓN EJERCIDA\nN 10\nUBICACIÓN EN LA ESTRUCTURA\nGRADO DE ESTUDIOS\nOCUPACIONAL\nEjecutivo del\nEstado…………………………………..……….……… De acuerdo a la normatividad específica que\nSecretarías de aplique a la dependencia que esté asignado.\nDespacho……………………………………………\nRESULTADOS ESPERADOS\nSubsecretarías…………………..………………………\n……….\nDirecciones\nGenerales…………………….…………..............\nDirecciones de\nÁrea……..……….…………..………...….\nSubdirecciones……….………….....…….….………....\nCumplir y hacer cumplir las atribuciones y facultades conferidas por las leyes, reglamentos, Departamentos………………...................................... manuales y demás normatividad vigente en el\nJefaturas de\nEstado de Guerrero. oficina……….......................................\nJefaturas de área especializada………………..\nOperativo……................................................. ✓\nAdministrativo……………….……….....\nPRINCIPALES FUNCIONES\n- Coordinar los planes sistemáticos de operaciones y planes de defensa que tengan como objetivo mantener el orden dentro de la población penitenciaria;\nGUERRERO\n- Supervisar que el personal operativo bajo su mando brinde un trato digno y respetuoso a la población interna, protegiendo en todo momento sus derechos humanos;\n- Informar de inmediato a su superior de las novedades relevantes que se presenten durante el servicio;\n- Gestionar que el personal bajo su mando cuente con el equipo adecuado para el desempeño de sus funciones;\n- Por su jerarquía deberá conocer las atribuciones y responsabilidades de su grado, a fin de estar en condiciones de sustituir a un superior;\n- Supervisar las labores del personal operativo bajo su mando;\n- Coordinar las labores asignadas a su unidad;\n- Coordinar los operativos y planes de defensa de las instalaciones;\n- Coordinar los operativos de control de disturbios en el interior del centro penitenciario;\n- Informar de manera inmediata a su superior del ingreso y egreso al centro penitenciario de toda persona privada de su libertad;\n- Coordinar revisiones a las instalaciones penitenciarias en áreas específicas internas o externas consideradas vulnerables;\n- Coadyuvar con los diferentes niveles de gobierno para el desarrollo de operativos dentro de los Centros de Reinserción Social;\n- Supervisar el cumplimiento de las consignas y protocolos de actuación establecidos como el reglamento de la institución;\n- Obedecer y ejecutar órdenes superiores que no se contrapongan a lo establecido conforme a la ley;\n- Supervisar que el personal bajo su mando mantenga la tranquilidad, el orden y la paz en el interior y exterior de los Centros de Reinserción Social del Estado;\n- Supervisar que el personal bajo su mando brinde un buen servicio de seguridad a la población interna y a las personas que realizan visitas al interior de los Centros de Reinserción del Estado;\n- Vigilar que el personal bajo su mando realice debidamente la revisión de personas, vehículos, objetos y alimentos que ingresan al interior de los Centros de Reinserción Social;\n- Vigilar que se preserve la integridad física de la población interna, dando un trato especial a las personas con capacidades diferentes o con alguna complicación médica según el caso;\n- Coordinar los protocolos de registro de ingreso y el egreso de toda persona privada de su libertad que entre a los centros penitenciarios;\n- Coordinar los protocolos de registro de entrada y salida de personal operativo y administrativo;\n- Coordinar operativos de inspecciones y requisas en el área de población penitenciaria;\n- Supervisión de la elaboración y control del inventario de las herramientas de trabajo que se utilizan en los diferentes talleres establecidos en el interior de los Centros de Reinserción Social, especialmente objetos\nGUERRERO que pongan en riesgo la integridad física de los internos, así como, la estabilidad y la paz en el interior de los mismos;\n- Coordinar operaciones de seguridad y vigilancia especial a internos considerados de alta peligrosidad; y\nGUERRERO\nCATÁLOGO DE PUESTOS RAMA: SEGURIDAD PÚBLICA OPERATIVO\nCÉDULA DE IDENTIFICACIÓN DE PUESTO\nDENOMINACIÓN DEL PUESTO: B14. POLICÍA\nCÓDIGOS DE CATEGORÍAS ÁREAS DE ADSCRIPCIÓN\nSMT1, 60611 Subsecretaría de Prevención y Operación Policial.\nNIVEL DE GESTIÓN SUPERVISIÓN EJERCIDA\nN 10\nUBICACIÓN EN LA ESTRUCTURA\nGRADO DE ESTUDIOS\nOCUPACIONAL\nEjecutivo del\nDe acuerdo a la normatividad específica que\nEstado…………………………………..……….……… aplique a la dependencia que esté asignado.\nSecretarías de\nDespacho……………………………………………\nRESULTADOS ESPERADOS\nSubsecretarías…………………..………………………\n……….\nDirecciones\nGenerales…………………….…………..............\nDirecciones de\nÁrea……..……….…………..………...….\nSubdirecciones……….………….....…….….……….... Cumplir y hacer cumplir las atribuciones y facultades conferidas por las leyes, reglamentos, Departamentos………………...................................... manuales y demás normatividad vigente en el\nJefaturas de Estado de Guerrero. oficina……….......................................\nJefaturas de área especializada………………..\nOperativo……................................................. ✓\nAdministrativo……………….……….....\nPRINCIPALES FUNCIONES\n- Obedecer y sujetarse a la disciplina y línea de mando que rige al Cuerpo de la Policía Estatal;\nGUERRERO\n- Auxiliar de forma inmediata a la población en caso de siniestros y desastres naturales, a fin de proteger su integridad, conforme a las disposiciones legales aplicables;\n- Aplicar estrategias de reacción en situaciones de disturbios civiles que pongan en riesgo la integridad física y patrimonial de la población;\n- Proteger las áreas estratégicas del estado, a fin de evitar que se alteren el orden y la paz pública;\n- Llevar a cabo patrullajes de seguridad en espacios públicos, con la finalidad de prevenir e inhibir la comisión de delitos que vulneren la integridad física y patrimonial de la ciudadanía;\n- Preservar el lugar de los hechos, para evitar que se contamine;\n- Prestar los servicios de seguridad y vigilancia que se le encomiende, uniformado o de civil cuando en apoyo de corporaciones o autoridades se le asigne por orden escrita de autoridad superior;\n- Proteger la integridad física de las personas detenidas por la comisión de algún delito, en tanto se ponen a disposición de la autoridad competente;\n- Realizar detenciones en flagrancia y poner de inmediato al detenido a disposición de la autoridad competente;\n- Realizar labores de proximidad social atendiendo de manera oportuna e inmediata las quejas que le exponga la ciudadanía y que estén en su ámbito de competencia;\n- Informar al superior jerárquico de manera inmediata los acontecimientos relevantes que se generen dentro de su servicio de seguridad y vigilancia;\n- Brindar seguridad en el traslado de internos en base a la petición de la unidad de traslados;\n- Aplicar de manera correcta y conforme a derecho el uso legítimo de la fuerza; y\nGUERRERO\nCATÁLOGO DE PUESTOS RAMA: SEGURIDAD PÚBLICA OPERATIVO\nCÉDULA DE IDENTIFICACIÓN DE PUESTO\nDENOMINACIÓN DEL PUESTO: B15. POLICÍA 1\nCÓDIGOS DE CATEGORÍAS ÁREAS DE ADSCRIPCIÓN\n70104 Subsecretaría de Prevención y Operación Policial.\nNIVEL DE GESTIÓN SUPERVISIÓN EJERCIDA\nN 10\nUBICACIÓN EN LA ESTRUCTURA\nGRADO DE ESTUDIOS\nOCUPACIONAL\nEjecutivo del\nDe acuerdo a la normatividad específica que\nEstado…………………………………..……….……… aplique a la dependencia que esté asignado.\nSecretarías de\nDespacho……………………………………………\nRESULTADOS ESPERADOS\nSubsecretarías…………………..………………………\n……….\nDirecciones\nGenerales…………………….…………..............\nDirecciones de\nÁrea……..……….…………..………...….\nSubdirecciones……….………….....…….….……….... Cumplir y hacer cumplir las atribuciones y facultades conferidas por las leyes, reglamentos, Departamentos………………...................................... manuales y demás normatividad vigente en el\nJefaturas de Estado de Guerrero. oficina……….......................................\nJefaturas de área especializada………………..\nOperativo……................................................. ✓\nAdministrativo……………….……….....\nPRINCIPALES FUNCIONES\n- Tener la capacidad para comandar la unidad a su cargo;\n- Obedecer y sujetarse a la disciplina y línea de mando que rige al Cuerpo de la Policía Estatal;\n- Supervisar los servicios asignados del personal subalterno, para el debido y estricto cumplimiento del servicio encomendado;\nGUERRERO\n- Elaborar informes de las actividades y misiones encomendadas, para notificar los resultados derivados de las mismas;\n- Auxiliar de forma inmediata a la población en caso de siniestros y desastres naturales, a fin de proteger su integridad y la de terceros, conforme a las disposiciones legales aplicables;\n- Aplicar estrategias de reacción en situaciones de disturbios civiles que pongan en riesgo la integridad física y patrimonial de la población;\n- Proteger las áreas estratégicas del estado a fin de evitar que se alteren el orden y la paz pública;\n- Llevar a cabo patrullajes de seguridad en espacios públicos, con la finalidad de prevenir e inhibir la comisión de delitos que vulneren la integridad física y patrimonial de la ciudadanía;\n- Preservar el lugar de los hechos, para evitar que se contamine y se ponga en riesgo la integridad de los indicios;\n- Prestar los servicios de seguridad y vigilancia que se le encomiende, uniformado o de civil cuando en apoyo de corporaciones o autoridades se le asigne por orden escrita de autoridad superior;\n- Proteger la integridad física de las personas detenidas por la comisión de algún delito, en tanto se ponen a disposición de la autoridad competente;\n- Preservar las pruebas e indicios de fracciones cívicas y de hechos probablemente delictivos, de forma que no pierdan su calidad probatoria y se facilite la correcta tramitación del procedimiento correspondiente;\n- Realizar detenciones en flagrancia y poner al detenido de inmediato ante la autoridad competente;\n- Realizar labores de proximidad social atendiendo de manera oportuna e inmediata las quejas que le exponga la ciudadanía y que estén en su ámbito de competencia;\n- Aplicar de manera correcta y conforme a derecho el uso legítimo de la fuerza;\n- Brindar seguridad en el traslado de internos en base a la petición de la unidad de traslados;\n- Informar al superior jerárquico de manera inmediata los acontecimientos relevantes que se generan dentro de su servicio de seguridad y vigilancia;\n- Explotar los productos proporcionados por la Unidad de Análisis Táctico; y\nGUERRERO\nCATÁLOGO DE PUESTOS RAMA: SEGURIDAD PÚBLICA OPERATIVO\nCÉDULA DE IDENTIFICACIÓN DE PUESTO\nDENOMINACIÓN DEL PUESTO: B16. POLICÍA 2\nCÓDIGOS DE CATEGORÍAS ÁREAS DE ADSCRIPCIÓN\n70105 Subsecretaría de Prevención y Operación Policial.\nNIVEL DE GESTIÓN SUPERVISIÓN EJERCIDA\nN 10\nUBICACIÓN EN LA ESTRUCTURA\nGRADO DE ESTUDIOS\nOCUPACIONAL\nEjecutivo del\nDe acuerdo a la normatividad específica que\nEstado…………………………………..……….……… aplique a la dependencia que esté asignado.\nSecretarías de\nDespacho……………………………………………\nRESULTADOS ESPERADOS\nSubsecretarías…………………..………………………\n……….\nDirecciones\nGenerales…………………….…………..............\nDirecciones de\nÁrea……..……….…………..………...….\nSubdirecciones……….………….....…….….………....\nCumplir y hacer cumplir las atribuciones y facultades conferidas por las leyes, reglamentos, Departamentos………………...................................... manuales y demás normatividad vigente en el\nJefaturas de\nEstado de Guerrero. oficina……….......................................\nJefaturas de área especializada………………..\nOperativo……................................................ ✓\nAdministrativo……………….……….....\nPRINCIPALES FUNCIONES\n- Tener la capacidad para comandar la unidad a su cargo;\n- Obedecer y sujetarse a la disciplina y línea de mando que rige al Cuerpo de la Policía Estatal;\n- Elaborar informes de las actividades y misiones encomendadas, para notificar los resultados derivados de las mismas;\nGUERRERO\n- Auxiliar de forma inmediata a la población en caso de siniestros y desastres naturales, a fin de proteger su integridad y la de terceros, conforme a las disposiciones legales aplicables;\n- Aplicar estrategias de reacción en situaciones de disturbios civiles que pongan en riesgo la integridad física y patrimonial de la población;\n- Proteger las áreas estratégicas del estado a fin de evitar que se alteren el orden y la paz pública;\n- Llevar a cabo patrullajes de seguridad en espacios públicos, con la finalidad de prevenir e inhibir la comisión de delitos que vulneren la integridad física y patrimonial de la ciudadanía;\n- Preservar el lugar de los hechos, para evitar que se contamine y se ponga en riesgo la integridad de los indicios;\n- Prestar los servicios de seguridad y vigilancia que se le encomiende, uniformado o de civil cuando en apoyo de corporaciones o autoridades se le asigne por orden escrita de autoridad superior;\n- Proteger la integridad física de las personas detenidas por la comisión de algún delito, en tanto se ponen a disposición de la autoridad competente;\n- Preservar las pruebas e indicios de fracciones cívicas y de hechos probablemente delictivos, de forma que no pierdan su calidad probatoria y se facilite la correcta tramitación del procedimiento correspondiente;\n- Realizar detenciones en flagrancia y poner al detenido de inmediato ante la autoridad competente;\n- Realizar labores de proximidad social atendiendo de manera oportuna e inmediata las quejas que le exponga la ciudadanía y que estén en su ámbito de competencia;\n- Aplicar de manera correcta y conforme a derecho el uso legítimo de la fuerza;\n- Brindar seguridad en el traslado de internos en base a la petición de la unidad de traslados;\n- Informar al superior jerárquico de manera inmediata los acontecimientos relevantes que se generan dentro de su servicio de seguridad y vigilancia;\n- Explotar los productos proporcionados por la Unidad de Análisis Táctico; y\nGUERRERO\nCATÁLOGO DE PUESTOS RAMA: SEGURIDAD PÚBLICA OPERATIVO\nCÉDULA DE IDENTIFICACIÓN DE PUESTO\nDENOMINACIÓN DEL PUESTO: B17. POLICÍA 3\nCÓDIGOS DE CATEGORÍAS ÁREAS DE ADSCRIPCIÓN\n70106 Subsecretaría de Prevención y Operación Policial\nNIVEL DE GESTIÓN SUPERVISIÓN EJERCIDA\nN 10\nUBICACIÓN EN LA ESTRUCTURA\nGRADO DE ESTUDIOS\nOCUPACIONAL\nEjecutivo del\nDe acuerdo a la normatividad específica que\nEstado…………………………………..……….……… aplique a la dependencia que esté asignado.\nSecretarías de\nDespacho……………………………………………\nRESULTADOS ESPERADOS\nSubsecretarías…………………..………………………\n……….\nDirecciones\nGenerales…………………….…………..............\nDirecciones de\nÁrea……..……….…………..………...….\nSubdirecciones……….………….....…….….……….... Cumplir y hacer cumplir las atribuciones y facultades conferidas por las leyes, reglamentos, Departamentos………………...................................... manuales y demás normatividad vigente en el\nJefaturas de Estado de Guerrero. oficina……….......................................\nJefaturas de área especializada………………..\nOperativo……................................................. ✓\nAdministrativo……………….……….....\nPRINCIPALES FUNCIONES\n- Tener la capacidad para comandar la unidad a su cargo;\n- Obedecer y sujetarse a la disciplina y línea de mando que rige al Cuerpo de la Policía Estatal;\n- Elaborar informes de las actividades y misiones encomendadas, para notificar los resultados derivados de las mismas;\nGUERRERO\n- Auxiliar de forma inmediata a la población en caso de siniestros y desastres naturales, a fin de proteger su integridad y la de terceros, conforme a las disposiciones legales aplicables;\n- Aplicar estrategias de reacción en situaciones de disturbios civiles que pongan en riesgo la integridad física y patrimonial de la población;\n- Proteger las áreas estratégicas del estado a fin de evitar que se alteren el orden y la paz pública;\n- Llevar a cabo patrullajes de seguridad en espacios públicos, con la finalidad de prevenir e inhibir la comisión de delitos que vulneren la integridad física y patrimonial de la ciudadanía;\n- Preservar el lugar de los hechos, para evitar que se contamine y se ponga en riesgo la integridad de los indicios;\n- Prestar los servicios de seguridad y vigilancia que se le encomiende, uniformado o de civil cuando en apoyo de corporaciones o autoridades se le asigne por orden escrita de autoridad superior;\n- Proteger la integridad física de las personas detenidas por la comisión de algún delito, en tanto se ponen a disposición de la autoridad competente;\n- Preservar las pruebas e indicios de fracciones cívicas y de hechos probablemente delictivos, de forma que no pierdan su calidad probatoria y se facilite la correcta tramitación del procedimiento correspondiente;\n- Realizar detenciones en flagrancia y poner al detenido de inmediato ante la autoridad competente;\n- Realizar labores de proximidad social atendiendo de manera oportuna e inmediata las quejas que le exponga la ciudadanía y que estén en su ámbito de competencia;\n- Aplicar de manera correcta y conforme a derecho el uso legítimo de la fuerza;\n- Brindar seguridad en el traslado de internos en base a la petición de la unidad de traslados;\n- Informar al superior jerárquico de manera inmediata los acontecimientos relevantes que se generan dentro de su servicio de seguridad y vigilancia;\n- Explotar los productos proporcionados por la Unidad de Análisis Táctico; y\nGUERRERO\nCATÁLOGO DE PUESTOS RAMA: SEGURIDAD PÚBLICA OPERATIVO\nCÉDULA DE IDENTIFICACIÓN DE PUESTO\nDENOMINACIÓN DEL\nB18. POLICÍA ACREDITABLE ANÁLISIS TÁCTICO\nPUESTO:\nCÓDIGOS DE CATEGORÍAS ÁREAS DE ADSCRIPCIÓN\nT80009 Subsecretaría de Prevención y Operación Policial\nNIVEL DE GESTIÓN SUPERVISIÓN EJERCIDA\nN 10\nUBICACIÓN EN LA ESTRUCTURA\nGRADO DE ESTUDIOS\nOCUPACIONAL\nEjecutivo del\nEstado…………………………………..……….……… De acuerdo a la normatividad específica que\nSecretarías de aplique a la dependencia que esté asignado.\nDespacho……………………………………………\nSubsecretarías…………………..……………………… RESULTADOS ESPERADOS\n……….\nDirecciones\nGenerales…………………….…………..............\nDirecciones de\nÁrea……..……….…………..………...….\nSubdirecciones……….………….....…….….………....\nCumplir y hacer cumplir las atribuciones y facultades conferidas por las leyes, reglamentos, Departamentos………………...................................... manuales y demás normatividad vigente en el\nJefaturas de\nEstado de Guerrero. oficina……….......................................\nJefaturas de área especializada………………..\nOperativo……................................................. ✓\nAdministrativo……………….……….....\nPRINCIPALES FUNCIONES\n- Realizar investigaciones de gabinete utilizando herramientas estratégicas;\nGUERRERO\n- Llevar a cabo la recolección de información de gabinete que se genere en su ámbito de competencia;\n- Analizar la información recabada y corroborar su veracidad;\n- Procesar información e informar al mando inmediato de la situación que acontece;\n- Realizar mapeo utilizando la información obtenida;\n- Elaborar estadísticas de la incidencia delictiva estatal, regional y municipal;\n- Realizar informes de los resultados obtenidos al superior inmediato de la información proporcionada por la Unidad de Investigación, para determinar acciones conducentes;\n- Analizar información de personas involucradas en algún hecho delictivo;\n- Desarrollar técnicas de entrevista e interrogatorios a personas previamente identificadas en coordinación con la Unidad de Investigación;\n- Manejo y uso correcto de tecnología de punta que se utiliza en el proceso del ciclo de información;\n- Realizar investigaciones de gabinete tendientes a la prevención de delitos en determinadas áreas geográficas;\n- Realizar propuestas de acciones tendientes a bajar los índices delincuenciales, en base a los resultados del proceso del ciclo de información;\n- Procesar los resultados de las labores de inteligencia social, realizados por la Unidad de Investigación, posteriormente sugerir al mando acciones a realizar en dichas áreas; y\nGUERRERO\nCATÁLOGO DE PUESTOS RAMA: SEGURIDAD PÚBLICA OPERATIVO\nCÉDULA DE IDENTIFICACIÓN DE PUESTO\nDENOMINACIÓN DEL\nB19. POLICÍA PRIMERO ACREDITABLE ANÁLISIS TÁCTICO\nPUESTO:\nCÓDIGOS DE CATEGORÍAS ÁREAS DE ADSCRIPCIÓN\nT80006 Subsecretaría de Prevención y Operación Policial\nNIVEL DE GESTIÓN SUPERVISIÓN EJERCIDA\nN 10\nUBICACIÓN EN LA ESTRUCTURA\nGRADO DE ESTUDIOS\nOCUPACIONAL\nEjecutivo del\nEstado…………………………………..……….……… De acuerdo a la normatividad específica que aplique a la dependencia que esté asignado.\nSecretarías de\nDespacho……………………………………………\nRESULTADOS ESPERADOS\nSubsecretarías…………………..………………………\n……….\nDirecciones\nGenerales…………………….…………..............\nDirecciones de\nÁrea……..……….…………..………...….\nSubdirecciones……….………….....…….….………....\nCumplir y hacer cumplir las atribuciones y facultades conferidas por las leyes, reglamentos, Departamentos………………...................................... manuales y demás normatividad vigente en el\nJefaturas de\nEstado de Guerrero. oficina……….......................................\nJefaturas de área especializada………………..\nOperativo……................................................. ✓\nAdministrativo……………….……….....\nPRINCIPALES FUNCIONES\n- Informar al mando inmediato los resultados obtenidos de la información analizada;\n- Fungir como enlace para el cruce de información con diferentes corporaciones policiales;\nGUERRERO\n- Realizar investigaciones de gabinete utilizando herramientas estratégicas;\n- Llevar a cabo la recolección de información de gabinete que se genere en su ámbito de competencia;\n- Analizar la información recabada y corroborar su veracidad;\n- Procesar información e informar al mando inmediato de la situación que acontece;\n- Realizar mapeo utilizando la información obtenida;\n- Elaborar estadísticas de la incidencia delictiva estatal, regional y municipal;\n- Realizar informes de los resultados obtenidos al superior inmediato de la información proporcionada por la Unidad de Investigación, para determinar acciones conducentes;\n- Analizar información de personas involucradas en algún hecho delictivo;\n- Desarrollar técnicas de entrevista e interrogatorios a personas previamente identificadas en coordinación con la Unidad de Investigación;\n- Tener habilidades para el manejo y uso correcto de tecnología de punta que se utiliza en el proceso del manejo de información;\n- Realizar investigaciones de gabinete tendientes a la prevención de delitos en determinadas áreas geográficas;\n- Realizar propuestas de acciones tendientes a bajar los índices delincuenciales en base a los resultados del proceso del ciclo de información;\n- Procesar los resultados de las labores de inteligencia social, realizados por la Unidad de Investigación, posteriormente sugerir al mando acciones a realizar en dichas áreas; y\nGUERRERO\nCATÁLOGO DE PUESTOS RAMA: SEGURIDAD PÚBLICA OPERATIVO\nCÉDULA DE IDENTIFICACIÓN DE PUESTO\nDENOMINACIÓN DEL\nB20. POLICÍA SEGUNDO ACREDITABLE ANÁLISIS TÁCTICO\nPUESTO:\nCÓDIGOS DE CATEGORÍAS ÁREAS DE ADSCRIPCIÓN\nT80007 Subsecretaría de Prevención y Operación Policial\nNIVEL DE GESTIÓN SUPERVISIÓN EJERCIDA\nN 10\nUBICACIÓN EN LA ESTRUCTURA\nGRADO DE ESTUDIOS\nOCUPACIONAL\nEjecutivo del\nEstado…………………………………..……….……… De acuerdo a la normatividad específica que\nSecretarías de aplique a la dependencia que esté asignado.\nDespacho……………………………………………\nRESULTADOS ESPERADOS\nSubsecretarías…………………..………………………\n……….\nDirecciones\nGenerales…………………….…………..............\nDirecciones de\nÁrea……..……….…………..………...….\nSubdirecciones……….………….....…….….………....\nCumplir y hacer cumplir las atribuciones y facultades conferidas por las leyes, reglamentos, Departamentos………………...................................... manuales y demás normatividad vigente en el\nJefaturas de\nEstado de Guerrero. oficina……….......................................\nJefaturas de área especializada………………..\nOperativo……................................................. ✓\nAdministrativo……………….……….....\nPRINCIPALES FUNCIONES\n- Informar al mando inmediato los resultados obtenidos de la información analizada;\nGUERRERO\n- Realizar investigaciones de gabinete utilizando herramientas estratégicas;\n- Llevar a cabo la recolección de información de gabinete que se genere en su ámbito de competencia;\n- Analizar la información recabada y corroborar su veracidad;\n- Procesar información e informar al mando inmediato de la situación que acontece;\n- Realizar mapeo utilizando la información obtenida;\n- Elaborar estadísticas de la incidencia delictiva estatal, regional y municipal;\n- Realizar informes de los resultados obtenidos al superior inmediato de la información proporcionada por la Unidad de Investigación, para determinar acciones conducentes;\n- Analizar información de personas involucradas en algún hecho delictivo;\n- Desarrollar técnicas de entrevista e interrogatorios a personas previamente identificadas en coordinación con la Unidad de Investigación;\n- Tener habilidades para el manejo y uso correcto de tecnología de punta que se utiliza en el proceso del manejo de información;\n- Realizar investigaciones de gabinete tendientes a la prevención de delitos en determinadas áreas geográficas;\n- Proponer acciones tendientes a bajar los índices delincuenciales en base a los resultados del proceso del ciclo de información;\n- Procesar los resultados de las labores de inteligencia social, realizados por la Unidad de Investigación, posteriormente sugerir al mando acciones a realizar en dichas áreas; y\nGUERRERO\nCATÁLOGO DE PUESTOS RAMA: SEGURIDAD PÚBLICA OPERATIVO\nCÉDULA DE IDENTIFICACIÓN DE PUESTO\nDENOMINACIÓN DEL\nB21. POLICÍA TERCERO ACREDITABLE ANÁLISIS TÁCTICO\nPUESTO:\nCÓDIGOS DE CATEGORÍAS ÁREAS DE ADSCRIPCIÓN\nT80008 Subsecretaría de Prevención y Operación Policial\nNIVEL DE GESTIÓN SUPERVISIÓN EJERCIDA\nN 10\nUBICACIÓN EN LA ESTRUCTURA\nGRADO DE ESTUDIOS\nOCUPACIONAL\nEjecutivo del\nEstado…………………………………..……….……… De acuerdo a la normatividad específica que\nSecretarías de aplique a la dependencia que esté asignado.\nDespacho……………………………………………\nRESULTADOS ESPERADOS\nSubsecretarías…………………..………………………\n……….\nDirecciones\nGenerales…………………….…………..............\nDirecciones de\nÁrea……..……….…………..………...….\nSubdirecciones……….………….....…….….………....\nCumplir y hacer cumplir las atribuciones y facultades conferidas por las leyes, reglamentos, Departamentos………………...................................... manuales y demás normatividad vigente en el\nJefaturas de\nEstado de Guerrero. oficina……….......................................\nJefaturas de área especializada………………..\nOperativo……................................................. ✓\nAdministrativo……………….……….....\nPRINCIPALES FUNCIONES\n- Realizar investigaciones de gabinete utilizando herramientas estratégicas;\nGUERRERO\n- Llevar a cabo la recolección de información de gabinete que se genere en su ámbito de competencia;\n- Analizar la información recabada y corroborar su veracidad;\n- Procesar información e informar al mando inmediato de la situación que acontece;\n- Realizar mapeo utilizando la información obtenida;\n- Elaborar estadísticas de la incidencia delictiva estatal, regional y municipal;\n- Realizar informes de los resultados obtenidos al superior inmediato de la información proporcionada por la Unidad de Investigación, para determinar acciones conducentes;\n- Analizar información de personas involucradas en algún hecho delictivo;\n- Desarrollar técnicas de entrevista e interrogatorios a personas previamente identificadas en coordinación con la Unidad de Investigación;\n- Tener habilidades para el manejo y uso correcto de tecnología de punta que se utiliza en el proceso del manejo de información;\n- Realizar investigaciones de gabinete tendientes a la prevención de delitos en determinadas áreas geográficas;\n- Proponer acciones tendientes a bajar los índices delincuenciales en base a los resultados del proceso del ciclo de información;\n- Procesar los resultados de las labores de inteligencia social, realizados por la Unidad de Investigación, posteriormente sugerir al mando acciones a realizar en dichas áreas; y\nGUERRERO\nCATÁLOGO DE PUESTOS RAMA: SEGURIDAD PÚBLICA OPERATIVO\nCÉDULA DE IDENTIFICACIÓN DE PUESTO\nDENOMINACIÓN DEL PUESTO: B22. POLICÍA ACREDITABLE INVESTIGACIÓN\nCÓDIGOS DE CATEGORÍAS ÁREAS DE ADSCRIPCIÓN\nI80019 Subsecretaría de Prevención y Operación Policial\nNIVEL DE GESTIÓN SUPERVISIÓN EJERCIDA\nN 10\nUBICACIÓN EN LA ESTRUCTURA\nGRADO DE ESTUDIOS\nOCUPACIONAL\nEjecutivo del\nEstado…………………………………..……….……… De acuerdo a la normatividad específica que\nSecretarías de aplique a la dependencia que esté asignado.\nDespacho……………………………………………\nSubsecretarías…………………..………………………\nRESULTADOS ESPERADOS\n……….\nDirecciones\nGenerales…………………….…………..............\nDirecciones de\nÁrea……..……….…………..………...….\nSubdirecciones……….………….....…….….………....\nCumplir y hacer cumplir las atribuciones y\nDepartamentos………………...................................... facultades conferidas por las leyes, reglamentos, manuales y demás normatividad vigente en el\nJefaturas de oficina………....................................... Estado de Guerrero.\nJefaturas de área especializada………………..\nOperativo……................................................. ✓\nAdministrativo……………….……….....\nGUERRERO\nPRINCIPALES FUNCIONES\n- Realizar operaciones encubiertas, con el fin de obtener información requerida;\n- Desarrollar tareas de vigilancia “fijas y móviles” a personas identificadas con la finalidad de conocer sus actividades;\n- Realizar informes de los resultados obtenidos al superior inmediato, para determinar acciones conducentes;\n- Relacionar información de personas involucradas en algún hecho delictivo;\n- Desarrollar técnicas de entrevista a personas previamente identificadas para obtener mayor información requerida;\n- Formar parte de un grupo que se requiera investigar, para conocer sus actividades a realizar;\n- Manejar un perfil acorde a las situaciones a investigar;\n- Tener habilidades para el uso correcto de la tecnología (fotografía y video);\n- Prestar los servicios de seguridad y vigilancia que se le encomiende, uniformado o de civil cuando en apoyo de corporaciones o autoridades se le asigne por orden escrita de autoridad superior; y\n- Las demás que las disposiciones legales le atribuyan, así como, aquéllas que le confiera su superior\nGUERRERO\nCATÁLOGO DE PUESTOS RAMA: SEGURIDAD PÚBLICA OPERATIVO\nCÉDULA DE IDENTIFICACIÓN DE PUESTO\nDENOMINACIÓN DEL\nB23. POLICÍA PRIMERO ACREDITABLE INVESTIGACIÓN\nPUESTO:\nCÓDIGOS DE CATEGORÍAS ÁREAS DE ADSCRIPCIÓN\nI80016 Subsecretaría de Prevención y Operación Policial\nNIVEL DE GESTIÓN SUPERVISIÓN EJERCIDA\nN 10\nUBICACIÓN EN LA ESTRUCTURA\nGRADO DE ESTUDIOS\nOCUPACIONAL\nEjecutivo del\nEstado…………………………………..……….……… De acuerdo a la normatividad específica que\nSecretarías de aplique a la dependencia que esté asignado.\nDespacho……………………………………………\nRESULTADOS ESPERADOS\nSubsecretarías…………………..………………………\n……….\nDirecciones\nGenerales…………………….…………..............\nDirecciones de\nÁrea……..……….…………..………...….\nSubdirecciones……….………….....…….….………....\nCumplir y hacer cumplir las atribuciones y facultades conferidas por las leyes, reglamentos, Departamentos………………...................................... manuales y demás normatividad vigente en el\nJefaturas de\nEstado de Guerrero. oficina……….......................................\nJefaturas de área especializada………………..\nOperativo……................................................. ✓\nAdministrativo……………….……….....\nPRINCIPALES FUNCIONES\n- Coordinar las funciones de investigación en ausencia de un suboficial o de algún mando de mayor jerarquía;\nGUERRERO\n- Realizar operaciones encubiertas, con el fin de obtener información requerida;\n- Realizar tareas de vigilancia “fijas y móviles” a personas identificadas con la finalidad de conocer sus actividades;\n- Realizar informes de los resultados obtenidos al superior inmediato, para determinar acciones conducentes;\n- Relacionar información de personas involucradas en algún hecho delictivo;\n- Desarrollar técnicas de entrevista e interrogatorios a personas previamente identificadas para obtener mayor información requerida;\n- Infiltrarse dentro de un grupo que se requiera investigar, para conocer sus actividades si éstas se consideran un riesgo para la seguridad del estado;\n- Tener la capacidad adecuada para manejar un perfil acorde al grupo al que se va a infiltrar;\n- Contar con habilidades para el manejo y uso correcto de tecnología de punta que se utiliza en el proceso de la investigación;\n- Realizar investigaciones tendientes a la prevención de delitos en determinadas áreas geográficas;\n- Llevar a cabo labores de inteligencia social, con la finalidad de conocer los niveles de incidencia delictiva en diversas áreas geográficas;\n- Prestar los servicios de seguridad y vigilancia que se le encomiende, uniformado o de civil cuando en apoyo de corporaciones o autoridades se le asigne por orden escrita de autoridad superior; y\n- Las demás que las disposiciones legales le atribuyan, así como, aquéllas que le confiera su superior\nGUERRERO\nCATÁLOGO DE PUESTOS RAMA: SEGURIDAD PÚBLICA OPERATIVO\nCÉDULA DE IDENTIFICACIÓN DE PUESTO\nDENOMINACIÓN DEL\nB24. POLICÍA SEGUNDO ACREDITABLE INVESTIGACIÓN\nPUESTO:\nCÓDIGOS DE CATEGORÍAS ÁREAS DE ADSCRIPCIÓN\nI80017 Subsecretaría de Prevención y Operación Policial\nNIVEL DE GESTIÓN SUPERVISIÓN EJERCIDA\nN 10\nUBICACIÓN EN LA ESTRUCTURA\nGRADO DE ESTUDIOS\nOCUPACIONAL\nEjecutivo del\nEstado…………………………………..……….………\nDe acuerdo a la normatividad específica que\nSecretarías de aplique a la dependencia que esté asignado.\nDespacho……………………………………………\nSubsecretarías…………………..………………………\n………. RESULTADOS ESPERADOS\nDirecciones\nGenerales…………………….…………..............\nDirecciones de\nÁrea……..……….…………..………...….\nSubdirecciones……….………….....…….….………....\nCumplir y hacer cumplir las atribuciones y\nDepartamentos………………...................................... facultades conferidas por las leyes, reglamentos, oficina………....................................... Estado de Guerrero.\nJefaturas de área especializada………………..\nOperativo……................................................. ✓\nAdministrativo……………….……….....\nPRINCIPALES FUNCIONES\nGUERRERO\n- Realizar operaciones encubiertas, con el fin de obtener información requerida;\n- Desarrollar tareas de vigilancia “fijas y móviles” a personas identificadas con la finalidad de conocer sus actividades;\n- Realizar informes de los resultados obtenidos al superior inmediato, para determinar acciones conducentes;\n- Relacionar información de personas involucradas en algún hecho delictivo;\n- Desarrollar técnicas de entrevista e interrogatorios a personas previamente identificadas para obtener mayor información requerida;\n- Infiltrarse dentro de un grupo que se requiera investigar, para conocer sus actividades si éstas se consideran un riesgo para la seguridad del estado;\n- Tener la capacidad adecuada para manejar un perfil acorde al grupo al que se va a infiltrar;\n- Contar con habilidades para el manejo y uso correcto de tecnología de punta que se utiliza en el proceso de la investigación;\n- Realizar investigaciones tendientes a la prevención de delitos en determinadas áreas geográficas; y\n- Prestar los servicios de seguridad y vigilancia que se le encomiende, uniformado o de civil cuando en apoyo de corporaciones o autoridades se le asigne por orden escrita de autoridad superior; y\n- Las demás que las disposiciones legales le atribuyan, así como, aquéllas que le confiera su superior\nGUERRERO\nCATÁLOGO DE PUESTOS RAMA: SEGURIDAD PÚBLICA OPERATIVO\nCÉDULA DE IDENTIFICACIÓN DE PUESTO\nDENOMINACIÓN DEL\nB25. POLICÍA TERCERO ACREDITABLE INVESTIGACIÓN\nPUESTO:\nCÓDIGOS DE CATEGORÍAS ÁREAS DE ADSCRIPCIÓN\nI80018 Subsecretaría de Prevención y Operación Policial\nNIVEL DE GESTIÓN SUPERVISIÓN EJERCIDA\nN 10\nUBICACIÓN EN LA ESTRUCTURA\nGRADO DE ESTUDIOS\nOCUPACIONAL\nEjecutivo del\nEstado…………………………………..……….……… De acuerdo a la normatividad específica que\nSecretarías de aplique a la dependencia que esté asignado.\nDespacho……………………………………………\nSubsecretarías…………………..………………………\nRESULTADOS ESPERADOS\n……….\nDirecciones\nGenerales…………………….…………..............\nDirecciones de\nÁrea……..……….…………..………...….\nSubdirecciones……….………….....…….….………....\nCumplir y hacer cumplir las atribuciones y facultades conferidas por las leyes, reglamentos, Departamentos………………...................................... manuales y demás normatividad vigente en el\nJefaturas de\nEstado de Guerrero. oficina……….......................................\nJefaturas de área especializada………………..\nOperativo……................................................. ✓\nAdministrativo……………….……….....\nPRINCIPALES FUNCIONES\nGUERRERO\n- Realizar operaciones encubiertas, con el fin de obtener información requerida;\n- Realizar tareas de vigilancia “fijas y móviles” a personas identificadas con la finalidad de conocer sus actividades;\n- Realizar informes de los resultados obtenidos al superior inmediato, para determinar acciones conducentes;\n- Relacionar información de personas involucradas en algún hecho delictivo;\n- Desarrollar técnicas de entrevista e interrogatorios a personas previamente identificadas para obtener mayor información requerida;\n- Formar parte de un grupo que se requiera investigar, para conocer sus actividades a realizar;\n- Manejar un perfil económico acorde a las situaciones a investigar;\n- Contar con habilidades para el uso correcto de la tecnología (fotografía y video);\n- Coordinar actividades encomendadas en el área de investigación;\n- Prestar los servicios de seguridad y vigilancia que se le encomiende, uniformado o de civil cuando en apoyo de corporaciones o autoridades se le asigne por orden escrita de autoridad superior; y\n- Las demás que las disposiciones legales le atribuyan, así como, aquéllas que le confiera su superior\nGUERRERO\nCATÁLOGO DE PUESTOS RAMA: SEGURIDAD PÚBLICA OPERATIVO\nCÉDULA DE IDENTIFICACIÓN DE PUESTO\nDENOMINACIÓN DEL PUESTO: B26. POLICÍA ACREDITABLE OPERACIONES\nCÓDIGOS DE CATEGORÍAS ÁREAS DE ADSCRIPCIÓN\nO80029 Subsecretaría de Prevención y Operación Policial\nNIVEL DE GESTIÓN SUPERVISIÓN EJERCIDA\nN 10\nUBICACIÓN EN LA ESTRUCTURA\nGRADO DE ESTUDIOS\nOCUPACIONAL\nEjecutivo del\nEstado…………………………………..……….……… De acuerdo a la normatividad específica que\nSecretarías de aplique a la dependencia que esté asignado.\nDespacho……………………………………………\nSubsecretarías…………………..………………………\nRESULTADOS ESPERADOS\n……….\nDirecciones\nGenerales…………………….…………..............\nDirecciones de\nÁrea……..……….…………..………...….\nSubdirecciones……….………….....…….….………....\nCumplir y hacer cumplir las atribuciones y facultades conferidas por las leyes, reglamentos, Departamentos………………...................................... manuales y demás normatividad vigente en el\nJefaturas de\nEstado de Guerrero. oficina……….......................................\nJefaturas de área especializada………………..\nOperativo……................................................. ✓\nAdministrativo……………….……….....\nPRINCIPALES FUNCIONES\n- Obedecer y sujetarse a la disciplina y línea de mando que rige al Cuerpo de la Policía Estatal;\n- Auxiliar de forma inmediata a la población en caso de siniestros y desastres naturales, a fin de proteger su integridad, conforme a las disposiciones legales aplicables;\nGUERRERO\n- Aplicar estrategias de reacción en situaciones de disturbios civiles que pongan en riesgo la integridad física y patrimonial de la población;\n- Proteger las áreas estratégicas del estado a fin de evitar que se alteren el orden y la paz pública;\n- Llevar a cabo patrullajes de seguridad en espacios públicos, con la finalidad de prevenir e inhibir la comisión de delitos que vulneren la integridad física y patrimonial de la ciudadanía;\n- Preservar el lugar de los hechos, para evitar que se contamine;\n- Proteger la integridad física de las personas detenidas por la comisión de algún delito, en tanto se ponen a disposición de la autoridad competente;\n- Realizar detenciones en flagrancia y poner de inmediato al detenido a disposición de la autoridad competente;\n- Realizar labores de proximidad social atendiendo de manera oportuna e inmediata las quejas que le exponga la ciudadanía y que estén en su ámbito de competencia;\n- Aplicar de manera correcta y conforme a derecho el uso legítimo de la fuerza;\n- Brindar seguridad en el traslado de internos en base a la petición de la unidad de traslados;\n- Explotar los productos proporcionados por la Unidad de Análisis Táctico;\n- Ejecutar operativos en coordinación con la unidad de investigaciones;\n- Informar al superior jerárquico de manera inmediata los acontecimientos relevantes que se generen dentro de su servicio de seguridad y vigilancia;\n- Prestar los servicios de seguridad y vigilancia que se le encomiende, uniformado o de civil cuando en apoyo de corporaciones o autoridades se le asigne por orden escrita de autoridad superior; y\nGUERRERO\nCATÁLOGO DE PUESTOS RAMA:\nSEGURIDAD PÚBLICA OPERATIVO\nCÉDULA DE IDENTIFICACIÓN DE PUESTO\nDENOMINACIÓN DEL PUESTO: B27. POLICÍA PRIMERO ACREDITABLE OPERACIONES\nCÓDIGOS DE CATEGORÍAS ÁREAS DE ADSCRIPCIÓN\nO80026 Subsecretaría de Prevención y Operación Policial\nNIVEL DE GESTIÓN SUPERVISIÓN EJERCIDA\nN 10\nUBICACIÓN EN LA ESTRUCTURA\nGRADO DE ESTUDIOS\nOCUPACIONAL\nEjecutivo del\nEstado…………………………………..……….……… De acuerdo a la normatividad específica que\nSecretarías de aplique a la dependencia que esté asignado.\nDespacho……………………………………………\nSubsecretarías…………………..………………………\nRESULTADOS ESPERADOS\n……….\nDirecciones\nGenerales…………………….…………..............\nDirecciones de\nÁrea……..……….…………..………...….\nSubdirecciones……….………….....…….….………....\nCumplir y hacer cumplir las atribuciones y facultades conferidas por las leyes, reglamentos, Departamentos………………...................................... manuales y demás normatividad vigente en el\nJefaturas de\nEstado de Guerrero. oficina……….......................................\nJefaturas de área especializada………………..\nOperativo……................................................. ✓\nAdministrativo……………….……….....\nPRINCIPALES FUNCIONES\nGUERRERO\n- Tener la capacidad para comandar la unidad a su cargo;\n- Obedecer y sujetarse a la disciplina y línea de mando que rige al Cuerpo de Policía Estatal;\n- Supervisar los servicios asignados del personal subalterno, para el debido y estricto cumplimiento del servicio encomendado;\n- Elaborar informes de las actividades y misiones encomendadas, para notificar los resultados derivados de las mismas;\n- Auxiliar de forma inmediata a la población en caso de siniestros y desastres naturales, a fin de proteger su integridad y la de terceros, conforme a las disposiciones legales aplicables;\n- Aplicar estrategias de reacción en situaciones de disturbios civiles que pongan en riesgo la integridad física y patrimonial de la población;\n- Proteger las áreas estratégicas del Estado, a fin de evitar que se alteren el orden y la paz pública;\n- Llevar a cabo patrullajes de seguridad en espacios públicos, con la finalidad de prevenir e inhibir la comisión de delitos que vulneren la integridad física y patrimonial de la ciudadanía;\n- Preservar el lugar de los hechos, para evitar que se contamine y se ponga en riesgo la integridad de los indicios;\n- Proteger la integridad física de las personas detenidas por la comisión de algún delito, en tanto se ponen a disposición de la autoridad competente;\n- Preservar las pruebas e indicios de fracciones cívicas y de hechos probablemente delictivos, de forma que no pierdan su calidad probatoria y se facilite la correcta tramitación del procedimiento correspondiente;\n- Realizar detenciones en flagrancia y poner al detenido de inmediato ante la autoridad competente;\n- Realizar labores de proximidad social atendiendo de manera oportuna e inmediata las quejas que le exponga la ciudadanía y que estén en su ámbito de competencia;\n- Aplicar de manera correcta y conforme a derecho el uso legítimo de la fuerza;\n- Brindar seguridad en el traslado de internos en base a la petición de la unidad de traslados;\n- Explotar los productos proporcionados por la Unidad de Análisis Táctico;\n- Informar al superior jerárquico de manera inmediata los acontecimientos relevantes que se generan dentro de su servicio de seguridad y vigilancia;\n- Prestar los servicios de seguridad y vigilancia que se le encomiende, uniformado o de civil cuando en apoyo de corporaciones o autoridades se le asigne por orden escrita de autoridad superior; y\nGUERRERO\nCATÁLOGO DE PUESTOS RAMA: SEGURIDAD PÚBLICA OPERATIVO\nCÉDULA DE IDENTIFICACIÓN DE PUESTO\nDENOMINACIÓN DEL PUESTO: B28. POLICÍA SEGUNDO ACREDITABLE OPERACIONES\nCÓDIGOS DE CATEGORÍAS ÁREAS DE ADSCRIPCIÓN\nO80027 Subsecretaría de Prevención y Operación Policial\nNIVEL DE GESTIÓN SUPERVISIÓN EJERCIDA\nN 10\nUBICACIÓN EN LA ESTRUCTURA\nGRADO DE ESTUDIOS\nOCUPACIONAL\nEjecutivo del\nEstado…………………………………..……….……… De acuerdo a la normatividad específica que\nSecretarías de aplique a la dependencia que esté asignado.\nDespacho……………………………………………\nSubsecretarías…………………..……………………… RESULTADOS ESPERADOS\n……….\nDirecciones\nGenerales…………………….…………..............\nDirecciones de\nÁrea……..……….…………..………...….\nSubdirecciones……….………….....…….….………....\nCumplir y hacer cumplir las atribuciones y facultades conferidas por las leyes, reglamentos, Departamentos………………...................................... manuales y demás normatividad vigente en el\nJefaturas de\nEstado de Guerrero. oficina……….......................................\nJefaturas de área especializada………………..\nOperativo……................................................. ✓\nAdministrativo……………….……….....\nPRINCIPALES FUNCIONES\n- Obedecer y sujetarse a la disciplina y línea de mando que rige al Cuerpo de Policía Estatal;\n- Elaborar informes de las actividades y misiones encomendadas, para notificar los resultados derivados de las mismas;\n- Auxiliar de forma inmediata a la población en caso de siniestros y desastres naturales, a fin de proteger su integridad y la de terceros, conforme a las disposiciones legales aplicables;\nGUERRERO\n- Aplicar estrategias de reacción en situaciones de disturbios civiles que pongan en riesgo la integridad física y patrimonial de la población;\n- Proteger las áreas estratégicas del estado a fin de evitar que se alteren el orden y la paz pública;\n- Llevar a cabo patrullajes de seguridad en espacios públicos, con la finalidad de prevenir e inhibir la comisión de delitos que vulneren la integridad física y patrimonial de la ciudadanía;\n- Preservar el lugar de los hechos, para evitar que se contamine y se ponga en riesgo la integridad de los indicios;\n- Proteger la integridad física de las personas detenidas por la comisión de algún delito, en tanto se ponen a disposición de la autoridad competente;\n- Preservar las pruebas e indicios de fracciones cívicas y de hechos probablemente delictivos, de forma que no pierdan su calidad probatoria y se facilite la correcta tramitación del procedimiento correspondiente;\n- Realizar detenciones en flagrancia y poner al detenido de inmediato ante la autoridad competente;\n- Realizar labores de proximidad social atendiendo de manera oportuna e inmediata las quejas que le exponga la ciudadanía y que estén en su ámbito de competencia;\n- Aplicar de manera correcta y conforme a derecho el uso legítimo de la fuerza;\n- Brindar seguridad en el traslado de internos en base a la petición de la unidad de traslados;\n- Explotar los productos proporcionados por la Unidad de Análisis Táctico;\n- Informar al superior jerárquico de manera inmediata los acontecimientos relevantes que se generan dentro de su servicio de seguridad y vigilancia;\n- Prestar los servicios de seguridad y vigilancia que se le encomiende, uniformado o de civil cuando en apoyo de corporaciones o autoridades se le asigne por orden escrita de autoridad superior; y\nGUERRERO\nCATÁLOGO DE PUESTOS RAMA: SEGURIDAD PÚBLICA OPERATIVO\nCÉDULA DE IDENTIFICACIÓN DE PUESTO\nDENOMINACIÓN DEL PUESTO: B29. POLICÍA TERCERO ACREDITABLE OPERACIONES\nCÓDIGOS DE CATEGORÍAS ÁREAS DE ADSCRIPCIÓN\nO80028 Subsecretaría de Prevención y Operación Policial\nNIVEL DE GESTIÓN SUPERVISIÓN EJERCIDA\nN 10\nUBICACIÓN EN LA ESTRUCTURA\nGRADO DE ESTUDIOS\nOCUPACIONAL\nEjecutivo del\nDe acuerdo a la normatividad específica que\nEstado…………………………………..……….……… aplique a la dependencia que esté asignado.\nSecretarías de\nDespacho……………………………………………\nRESULTADOS ESPERADOS\nSubsecretarías…………………..………………………\n……….\nDirecciones\nGenerales…………………….…………..............\nDirecciones de\nÁrea……..……….…………..………...….\nSubdirecciones……….………….....…….….……….... Cumplir y hacer cumplir las atribuciones y facultades conferidas por las leyes, reglamentos, Departamentos………………...................................... manuales y demás normatividad vigente en el\nJefaturas de Estado de Guerrero. oficina……….......................................\nJefaturas de área especializada………………..\nOperativo……................................................. ✓\nAdministrativo……………….……….....\nPRINCIPALES FUNCIONES\n- Obedecer y sujetarse a la disciplina y línea de mando que rige al Cuerpo de Policía Estatal;\n- Elaborar informes de las actividades y misiones encomendadas, para notificar los resultados derivados de las mismas;\nGUERRERO\n- Auxiliar de forma inmediata a la población en caso de siniestros y desastres naturales, a fin de proteger su integridad y la de terceros, conforme a las disposiciones legales aplicables;\n- Aplicar estrategias de reacción en situaciones de disturbios civiles que pongan en riesgo la integridad física y patrimonial de la población;\n- Proteger las áreas estratégicas del estado a fin de evitar que se alteren el orden y la paz pública;\n- Llevar a cabo patrullajes de seguridad en espacios públicos, con la finalidad de prevenir e inhibir la comisión de delitos que vulneren la integridad física y patrimonial de la ciudadanía;\n- Preservar el lugar de los hechos, para evitar que se contamine y se ponga en riesgo la integridad de los indicios;\n- Proteger la integridad física de las personas detenidas por la comisión de algún delito, en tanto se ponen a disposición de la autoridad competente;\n- Preservar las pruebas e indicios de fracciones cívicas y de hechos probablemente delictivos, de forma que no pierdan su calidad probatoria y se facilite la correcta tramitación del procedimiento correspondiente;\n- Realizar detenciones en flagrancia y poner al detenido de inmediato ante la autoridad competente;\n- Realizar labores de proximidad social atendiendo de manera oportuna e inmediata las quejas que le exponga la ciudadanía y que estén en su ámbito de competencia;\n- Aplicar de manera correcta y conforme a derecho el uso legítimo de la fuerza;\n- Brindar seguridad en el traslado de internos en base a la petición de la unidad de traslados;\n- Explotar los productos proporcionados por la Unidad de Análisis Táctico;\n- Informar al superior jerárquico de manera inmediata los acontecimientos relevantes que se generan dentro de su servicio de seguridad y vigilancia;\n- Prestar los servicios de seguridad y vigilancia que se le encomiende, uniformado o de civil cuando en apoyo de corporaciones o autoridades se le asigne por orden escrita de autoridad superior; y\nGUERRERO\nCATÁLOGO DE PUESTOS RAMA: SEGURIDAD PÚBLICA OPERATIVO\nCÉDULA DE IDENTIFICACIÓN DE PUESTO\nB30. POLICÍA PENITENCIARIO\nDENOMINACIÓN DEL PUESTO:\nACREDITABLE\nCÓDIGOS DE CATEGORÍAS ÁREAS DE ADSCRIPCIÓN\nO80030 Subsecretaría del Sistema Penitenciario\nNIVEL DE GESTIÓN SUPERVISIÓN EJERCIDA\nN 10\nUBICACIÓN EN LA ESTRUCTURA\nGRADO DE ESTUDIOS\nOCUPACIONAL\nEjecutivo del\nDe acuerdo a la normatividad específica que\nEstado…………………………………..……….……… aplique a la dependencia que esté asignado.\nSecretarías de\nDespacho……………………………………………\nRESULTADOS ESPERADOS\nSubsecretarías…………………..………………………\n……….\nDirecciones\nGenerales…………………….…………..............\nDirecciones de\nÁrea……..……….…………..………...….\nSubdirecciones……….………….....…….….……….... Cumplir y hacer cumplir las atribuciones y facultades conferidas por las leyes, reglamentos, Departamentos………………...................................... manuales y demás normatividad vigente en el\nJefaturas de Estado de Guerrero. oficina……….......................................\nJefaturas de área especializada………………..\nOperativo……................................................. ✓\nAdministrativo……………….……….....\nPRINCIPALES FUNCIONES\n- Dar cumplimiento a las consignas y protocolos de actuación establecidos como reglamento de la institución;\n- Obedecer y ejecutar órdenes superiores que no se contrapongan a lo establecido por la ley;\nGUERRERO\n- Mantener la tranquilidad, el orden y la paz en el interior y exterior de los Centros de Reinserción Social; de Reinserción;\n- Revisión de personas, vehículos, objetos y alimentos que ingresan al interior de los Centros de\nReinserción Social;\n- Preservar la integridad física de la población interna, dando un trato especial a las personas con capacidades diferentes o con alguna complicación médica según el caso;\n- Ejecutar los protocolos de registro de ingresos y egresos de toda persona privada de su libertad que entre a los centros penitenciarios;\n- Ejecutar los protocolos de registro de entrada y salida de personal operativo y administrativo;\n- Ejecutar operativos de inspecciones y requisas en el área de población penitenciaria;\n- Brindar información a la población referente al reglamento para el ingreso como visitante al centro penitenciario;\n- Elaborar y controlar un inventario de las herramientas de trabajo que se utilizan en los diferentes talleres establecidos en el interior de los Centros de Reinserción Social, especialmente objetos que pongan en riesgo la integridad física de los internos, así como la estabilidad y la paz en el interior de los mismos; y\nGUERRERO\nCATÁLOGO DE PUESTOS RAMA: SEGURIDAD PÚBLICA OPERATIVO\nCÉDULA DE IDENTIFICACIÓN DE PUESTO\nDENOMINACIÓN DEL PUESTO: B31. POLICÍA PRIMERO PENITENCIARIO ACREDITABLE\nCÓDIGOS DE CATEGORÍAS ÁREAS DE ADSCRIPCIÓN\nO80033 Subsecretaría del Sistema Penitenciario\nNIVEL DE GESTIÓN SUPERVISIÓN EJERCIDA\nN 10\nUBICACIÓN EN LA ESTRUCTURA\nGRADO DE ESTUDIOS\nOCUPACIONAL\nEjecutivo del\nDe acuerdo a la normatividad específica que\nEstado…………………………………..……….……… aplique a la dependencia que esté asignado.\nSecretarías de\nDespacho……………………………………………\nRESULTADOS ESPERADOS\nSubsecretarías…………………..………………………\n……….\nDirecciones\nGenerales…………………….…………..............\nDirecciones de\nÁrea……..……….…………..………...….\nSubdirecciones……….………….....…….….……….... Cumplir y hacer cumplir las atribuciones y facultades conferidas por las leyes, reglamentos, Departamentos………………...................................... manuales y demás normatividad vigente en el\nJefaturas de Estado de Guerrero. oficina……….......................................\nJefaturas de área especializada………………..\nOperativo……................................................. ✓\nAdministrativo……………….……….....\nPRINCIPALES FUNCIONES\n- Por su jerarquía deberá conocer las atribuciones y responsabilidades de su grado, a fin de estar en condiciones de sustituir a un superior;\n- Supervisar las labores del personal operativo bajo su mando;\n- Ejecutar las labores asignadas a su unidad;\nGUERRERO\n- Ejecutar los operativos y planes de defensa de las instalaciones;\n- Ejecutar operativos de control de disturbios en el interior del centro penitenciario;\n- Informar de manera inmediata a la superioridad del ingreso y egreso al centro penitenciario de toda persona privada de su libertad;\n- Revisar las instalaciones penitenciarias en áreas específicas consideradas vulnerables;\n- Coadyuvar con los diferentes niveles de gobierno para el desarrollo de operativos dentro de los Centros de Reinserción Social;\n- Dar cumplimiento a las consignas y protocolos de actuación establecidos como reglamento de la institución;\n- Obedecer y ejecutar órdenes superiores que no se contrapongan a lo establecido conforme a la ley;\n- Mantener la tranquilidad, el orden y la paz en el interior y exterior de los Centros de Reinserción Social;\n- Proporcionar seguridad a la población interna y a las personas que realizan visitas al interior de los Centros de Reinserción Social;\n- Revisión de personas, vehículos, objetos y alimentos que ingresan al interior de los Centros de\nReinserción Social;\n- Preservar la integridad física de la población interna, dando un trato especial a las personas con capacidades diferentes o con alguna complicación medica según el caso;\n- Ejecutar los protocolos de registro de ingreso y egreso de toda persona privada de su libertad que entre a los centros penitenciarios;\n- Ejecutar los protocolos de registro de entrada y salida de personal operativo y administrativo;\n- Ejecutar operativos de inspecciones y requisas en el área de población penitenciaria;\n- Supervisión de la elaboración y control del inventario de las herramientas de trabajo que se utilizan en los diferentes talleres establecidos en el interior de los Centros de Reinserción Social, especialmente objetos que pongan en riesgo la integridad física de los internos, así como la estabilidad y la paz en el interior de los mismos; y\nGUERRERO\nCATÁLOGO DE PUESTOS RAMA: SEGURIDAD PÚBLICA OPERATIVO\nCEDULA DE IDENTIFICACIÓN DE PUESTO\nDENOMINACIÓN DEL PUESTO: B32. POLICÍA SEGUNDO PENITENCIARIO ACREDITABLE\nCÓDIGOS DE CATEGORÍAS ÁREAS DE ADSCRIPCIÓN\nO80032 Subsecretaría del Sistema Penitenciario\nNIVEL DE GESTIÓN SUPERVISIÓN EJERCIDA\nN 10\nUBICACIÓN EN LA ESTRUCTURA\nGRADO DE ESTUDIOS\nOCUPACIONAL\nEjecutivo del\nDe acuerdo a la normatividad específica que\nEstado…………………………………..……….……… aplique a la dependencia que esté asignado.\nSecretarías de\nDespacho……………………………………………\nRESULTADOS ESPERADOS\nSubsecretarías…………………..………………………\n……….\nDirecciones\nGenerales…………………….…………..............\nDirecciones de\nÁrea……..……….…………..………...….\nSubdirecciones……….………….....…….….……….... Cumplir y hacer cumplir las atribuciones y facultades conferidas por las leyes, reglamentos, Departamentos………………...................................... manuales y demás normatividad vigente en el\nJefaturas de Estado de Guerrero. oficina……….......................................\nJefaturas de área especializada………………..\nOperativo……................................................. ✓\nAdministrativo……………….……….....\nPRINCIPALES FUNCIONES\n- Dar cumplimiento a las consignas y protocolos de actuación establecidos como el reglamento de la institución;\n- Obedecer y ejecutar órdenes superiores que no se contrapongan a lo establecido conforme a la ley;\nGUERRERO\n- Mantener la tranquilidad, el orden y la paz en el interior y exterior de los Centros de Reinserción Social; de Reinserción Social;\n- Revisión de personas, vehículos, objetos y alimentos que ingresan al interior de los Centros de Reinserción\nSocial;\n- Preservar la integridad física de la población interna, dando un trato especial a las personas con capacidades diferentes o con alguna complicación medica según el caso;\n- Ejecutar los protocolos de registro de ingreso y egreso de toda persona privada de su libertad que entre a los centros penitenciarios;\n- Ejecutar los protocolos de registro de entrada y salida de personal operativo y administrativo;\n- Ejecutar operativos de inspecciones y requisas en el área de población penitenciaria;\n- Elaborar y controlar un inventario de las herramientas de trabajo que se utilizan en los diferentes talleres establecidos en el interior de los Centros de Reinserción Social, especialmente objetos que pongan en riesgo la integridad física de los internos, así como la estabilidad y la paz en el interior de los mismos;\n- Brindar información a la población referente al reglamento para el ingreso como visitante al centro penitenciario; y\nGUERRERO\nCATÁLOGO DE PUESTOS RAMA: SEGURIDAD PÚBLICA OPERATIVO\nCÉDULA DE IDENTIFICACIÓN DE PUESTO\nDENOMINACIÓN DEL PUESTO: B33. POLICÍA TERCERO PENITENCIARIO ACREDITABLE\nCÓDIGOS DE CATEGORÍAS ÁREAS DE ADSCRIPCIÓN\nO80031 Subsecretaría del Sistema Penitenciario\nNIVEL DE GESTIÓN SUPERVISIÓN EJERCIDA\nN 10\nUBICACIÓN EN LA ESTRUCTURA\nGRADO DE ESTUDIOS\nOCUPACIONAL\nEjecutivo del\nEstado…………………………………..……….……… De acuerdo a la normatividad específica que\nSecretarías de aplique a la dependencia que esté asignado.\nDespacho……………………………………………\nSubsecretarías…………………..……………………… RESULTADOS ESPERADOS\n……….\nDirecciones\nGenerales…………………….…………..............\nDirecciones de\nÁrea……..……….…………..………...….\nSubdirecciones……….………….....…….….………....\nCumplir y hacer cumplir las atribuciones y facultades conferidas por las leyes, reglamentos, Departamentos………………...................................... manuales y demás normatividad vigente en el\nJefaturas de\nEstado de Guerrero. oficina……….......................................\nJefaturas de área especializada………………..\nOperativo……................................................. ✓\nAdministrativo……………….……….....\nPRINCIPALES FUNCIONES\n- Dar cumplimiento a las consignas y protocolos de actuación establecidos como reglamento de la institución;\nGUERRERO\n- Obedecer y ejecutar órdenes superiores que no se contrapongan a lo establecido conforme a la ley;\n- Mantener la tranquilidad, el orden y la paz en el interior y exterior de los Centros de Reinserción Social; de Reinserción Social;\n- Revisión de personas, vehículos, objetos y alimentos que ingresan al interior de los Centros de\nReinserción Social;\n- Preservar la integridad física de la población interna, dando un trato especial a las personas con capacidades diferentes o con alguna complicación medica según el caso;\n- Ejecutar los protocolos de registro de ingreso y egreso de toda persona privada de su libertad que entre a los centros penitenciarios;\n- Ejecutar los protocolos de registro de entrada y salida de personal operativo y administrativo;\n- Ejecutar operativos de inspecciones y requisas en el área de población penitenciaria;\n- Elaborar y controlar un inventario de las herramientas de trabajo que se utilizan en los diferentes talleres establecidos en el interior de los Centros de Reinserción Social, especialmente objetos que pongan en riesgo la integridad física de los internos, así como la estabilidad y la paz en el interior de los mismos;\n- Brindar información a la población referente al reglamento para el ingreso como visitante al centro penitenciario; y\nGUERRERO\nCATÁLOGO DE PUESTOS RAMA: SEGURIDAD PÚBLICA OPERATIVO\nCÉDULA DE IDENTIFICACIÓN DE PUESTO\nDENOMINACIÓN DEL PUESTO: B34. POLICÍA ESTATAL RURAL\nCÓDIGOS DE CATEGORÍAS ÁREAS DE ADSCRIPCIÓN\nSubsecretaría de Prevención y Operación\nPR1\nPolicial\nNIVEL DE GESTIÓN SUPERVISIÓN EJERCIDA\nN 10\nUBICACIÓN EN LA ESTRUCTURA\nGRADO DE ESTUDIOS\nOCUPACIONAL\nEjecutivo del\nDe acuerdo a la normatividad específica que\nEstado…………………………………..……….……… aplique a la dependencia que esté asignado.\nSecretarías de\nDespacho……………………………………………\nRESULTADOS ESPERADOS\nSubsecretarías…………………..………………………\n……….\nDirecciones\nGenerales…………………….…………..............\nDirecciones de\nÁrea……..……….…………..………...….\nSubdirecciones……….………….....…….….……….... Cumplir y hacer cumplir las atribuciones y facultades conferidas por las leyes, reglamentos, Departamentos………………...................................... manuales y demás normatividad vigente en el\nJefaturas de Estado de Guerrero. oficina……….......................................\nJefaturas de área especializada………………..\nOperativo……................................................. ✓\nAdministrativo……………….……….....\nPRINCIPALES FUNCIONES\nGUERRERO\n- Mantener la seguridad, tranquilidad y el orden público de los habitantes de las comunidades, de los la materia en el ámbito de su competencia;\n- Hacer del conocimiento de las autoridades correspondientes de aquellos asuntos que no estén dentro de su esfera de su competencia y, en su caso, poner a disposición de las mismas a los probables responsables;\n- Realizar continua y permanentemente la prevención, protección y vigilancia del pueblo, comunidad, zona o región que esté bajo su responsabilidad;\n- Auxiliar y apoyar a las instituciones de seguridad pública federal, estatal y municipal;\n- Aprobar las evaluaciones de control de confianza, en el ámbito de su competencia, de acuerdo con los lineamientos y procedimientos del Sistema Nacional de Seguridad Pública;\n- Rendir a la Secretaría de Seguridad Pública los informes mensuales de las actividades desarrolladas y las demás que confieran otras disposiciones legales de la materia;\n- Tomar los cursos de capacitación y especialización necesarios con objeto de ser considerados para el servicio profesional de carrera policial;\n- Respetar en todas sus acciones los derechos humanos de las y los ciudadanos con objeto de fortalecer su participación activa en la realización de los juicios orales que le correspondan; y\nGUERRERO\nCATÁLOGO DE PUESTOS RAMA: SEGURIDAD PÚBLICA OPERATIVO\nCÉDULA DE IDENTIFICACIÓN DE PUESTO\nDENOMINACIÓN DEL PUESTO: B35. SUBINSPECTOR\nCÓDIGOS DE CATEGORÍAS ÁREAS DE ADSCRIPCIÓN\nSubsecretaría de Prevención y Operación\n70102-A\nPolicial\nNIVEL DE GESTIÓN SUPERVISIÓN EJERCIDA\nN 10\nUBICACIÓN EN LA ESTRUCTURA\nGRADO DE ESTUDIOS\nOCUPACIONAL\nEjecutivo del\nEstado…………………………………..……….……… De acuerdo a la normatividad específica que\nSecretarías de aplique a la dependencia que esté asignado.\nDespacho……………………………………………\nRESULTADOS ESPERADOS\nSubsecretarías…………………..………………………\n……….\nDirecciones\nGenerales…………………….…………..............\nDirecciones de\nÁrea……..……….…………..………...….\nSubdirecciones……….………….....…….….………....\nCumplir y hacer cumplir las atribuciones y facultades conferidas por las leyes, reglamentos, Departamentos………………...................................... manuales y demás normatividad vigente en el\nJefaturas de\nEstado de Guerrero. oficina……….......................................\nJefaturas de área especializada………………..\nOperativo……................................................. ✓\nAdministrativo……………….……….....\nPRINCIPALES FUNCIONES\nGUERRERO\n- Planear acciones operativas en coordinación con otros estados que tengan límites territoriales en nuestra entidad;\n- Coordinar operativos inter-regionales;\n- Establecer estrategias de apoyo a la seguridad pública de los municipios;\n- Coordinar apoyos logísticos para los operativos previamente planeados;\n- Fortalecer la prevención de los delitos mediante la implementación de operativos tendientes a inhibir la comisión de los mismos;\n- Coordinar juntas ejecutivas de trabajo;\n- Establecer protocolos de seguridad a instalaciones estratégicas del estado;\n- Dirigir operativos de intervenciones especiales;\n- Autorizar los sectores de patrullaje en zonas urbanas y rurales que permitan inhibir la comisión de delitos;\nGUERRERO\nCATÁLOGO DE PUESTOS RAMA: SEGURIDAD PÚBLICA OPERATIVO\nCÉDULA DE IDENTIFICACIÓN DE PUESTO\nDENOMINACIÓN DEL\nB36. SUBINSPECTOR ACREDITABLE ANÁLISIS TÁCTICO\nPUESTO:\nCÓDIGOS DE CATEGORÍAS ÁREAS DE ADSCRIPCIÓN\nSubsecretaría de Prevención y Operación\nT80003\nPolicial\nNIVEL DE GESTIÓN SUPERVISIÓN EJERCIDA\nN 10\nUBICACIÓN EN LA ESTRUCTURA\nGRADO DE ESTUDIOS\nOCUPACIONAL\nEjecutivo del\nEstado…………………………………..……….……… De acuerdo a la normatividad específica que\nSecretarías de aplique a la dependencia que esté asignado.\nDespacho……………………………………………\nRESULTADOS ESPERADOS\nSubsecretarías…………………..………………………\n……….\nDirecciones\nGenerales…………………….…………..............\nDirecciones de\nÁrea……..……….…………..………...….\nSubdirecciones……….………….....…….….………....\nCumplir y hacer cumplir las atribuciones y facultades conferidas por las leyes, reglamentos, Departamentos………………...................................... manuales y demás normatividad vigente en el\nJefaturas de\nEstado de Guerrero. oficina……….......................................\nJefaturas de área especializada………………..\nOperativo……................................................. ✓\nAdministrativo……………….……….....\nPRINCIPALES FUNCIONES\nGUERRERO\n- Dirigir la planeación, obtención, procesamiento y aprovechamiento de los productos obtenidos de la recolección de información encaminada a contrarrestar altos niveles de índices delincuenciales;\n- Crear políticas tendientes a la protección de la información concentrada en las bases de datos del área bajo su mando;\n- Establecer lineamientos para realizar el cruce de información con otras corporaciones policiacas;\n- Crear lineamientos que permitan homologar la recolección, clasificación, registro, análisis, evaluación y explotación de información en las regiones operativas que integran la Secretaría de Seguridad Pública;\n- Dirigir la actualización de información y estadísticas que servirán a la Secretaría de Seguridad Pública para la implementación de acciones operativas en las zonas geográficas que así lo requieran; y\nGUERRERO\nCATÁLOGO DE PUESTOS RAMA: SEGURIDAD PÚBLICA OPERATIVO\nCÉDULA DE IDENTIFICACIÓN DE PUESTO\nDENOMINACIÓN DEL\nB37. SUBINSPECTOR ACREDITABLE INVESTIGACIÓN\nPUESTO:\nCÓDIGOS DE CATEGORÍAS ÁREAS DE ADSCRIPCIÓN\nSubsecretaría de Prevención y Operación\nI80013\nPolicial\nNIVEL DE GESTIÓN SUPERVISIÓN EJERCIDA\nA las servidoras y servidores públicos de la\nN 10 Administración Pública Estatal adscritos a su mando.\nUBICACIÓN EN LA ESTRUCTURA\nGRADO DE ESTUDIOS\nOCUPACIONAL\nEjecutivo del\nDe acuerdo a la normatividad específica que\nEstado…………………………………..……….……… aplique a la dependencia que esté asignado.\nSecretarías de\nDespacho……………………………………………\nRESULTADOS ESPERADOS\nSubsecretarías…………………..………………………\n……….\nDirecciones\nGenerales…………………….…………..............\nDirecciones de\nÁrea……..……….…………..………...….\nSubdirecciones……….………….....…….….……….... Cumplir y hacer cumplir las atribuciones y facultades conferidas por las leyes, reglamentos, Departamentos………………...................................... manuales y demás normatividad vigente en el\nJefaturas de Estado de Guerrero. oficina……….......................................\nJefaturas de área especializada………………..\nOperativo……................................................. ✓\nAdministrativo……………….……….....\nGUERRERO\nPRINCIPALES FUNCIONES\n- Elaborar y planear métodos para la implementación de acciones encubiertas;\n- Establecer estrategias de protección de documentos e información relacionados con las investigaciones, a fin de evitar la fuga de información;\n- Coordinar las investigaciones que lleven a la ubicación de personas o grupos delictivos con el objeto de evitar la comisión de delitos;\n- Coordinar las entrevistas de las personas que pudieran aportar información de lugares o personas relacionados con delitos;\n- Dirigir la investigación que permita recopilar e integrar información encaminada a la prevención y combate de grupos delincuenciales;\n- Coordinar operativos de vigilancia, seguimientos, coberturas e infiltraciones que permitan la recopilación de información con la finalidad de desarticular organizaciones o grupos delictivos; y\nGUERRERO\nCATÁLOGO DE PUESTOS RAMA:\nSEGURIDAD PÚBLICA OPERATIVO\nCÉDULA DE IDENTIFICACIÓN DE\nPUESTO\nDENOMINACIÓN DEL PUESTO: B38. SUBINSPECTOR ACREDITABLE OPERACIONES\nCÓDIGOS DE CATEGORÍAS ÁREAS DE ADSCRIPCIÓN\nSubsecretaría de Prevención y Operación\nO80023\nPolicial\nNIVEL DE GESTIÓN SUPERVISIÓN EJERCIDA\nA las servidoras y servidores públicos de la\nN 10 Administración Pública Estatal adscritos a su mando.\nUBICACIÓN EN LA ESTRUCTURA\nGRADO DE ESTUDIOS\nOCUPACIONAL\nEjecutivo del\nEstado…………………………………..……….……… De acuerdo a la normatividad específica que\nSecretarías de aplique a la dependencia que esté asignado.\nDespacho……………………………………………\nSubsecretarías…………………..……………………… RESULTADOS ESPERADOS\n……….\nDirecciones\nGenerales…………………….…………..............\nDirecciones de\nÁrea……..……….…………..………...….\nSubdirecciones……….………….....…….….………....\nCumplir y hacer cumplir las atribuciones y facultades conferidas por las leyes, reglamentos, Departamentos………………...................................... manuales y demás normatividad vigente en el\nJefaturas de\nEstado de Guerrero. oficina……….......................................\nJefaturas de área especializada………………..\nOperativo……................................................. ✓\nAdministrativo……………….……….....\nPRINCIPALES FUNCIONES\nGUERRERO\n- Planear acciones operativas en coordinación con otros estados que tengan límites territoriales en nuestra entidad;\n- Coordinar operativos inter-regionales;\n- Establecer estrategias de apoyo a la seguridad pública de los municipios;\n- Coordinar apoyos logísticos para los operativos previamente planeados;\n- Fortalecer la prevención de los delitos mediante la implementación de operativos tendientes a inhibir la comisión de los mismos;\n- Coordinar juntas ejecutivas de trabajo;\n- Establecer protocolos de seguridad a instalaciones estratégicas del estado;\n- Dirigir operativos de intervenciones especiales;\n- Autorizar los sectores de patrullaje en zonas urbanas y rurales que permitan inhibir la comisión de delitos; y\nGUERRERO\nCATÁLOGO DE PUESTOS RAMA: SEGURIDAD PÚBLICA OPERATIVO\nCÉDULA DE IDENTIFICACIÓN DE PUESTO\nDENOMINACIÓN DEL PUESTO: B39. SUBOFICIAL\nCÓDIGOS DE CATEGORÍAS ÁREAS DE ADSCRIPCIÓN\nSubsecretaría de Prevención y Operación\n70107, SMT3\nPolicial.\nNIVEL DE GESTIÓN SUPERVISIÓN EJERCIDA\nA las servidoras y servidores públicos de la\nN 10 Administración Pública Estatal adscritos a su mando.\nUBICACIÓN EN LA ESTRUCTURA\nGRADO DE ESTUDIOS\nOCUPACIONAL\nEjecutivo del De acuerdo a la normatividad específica que\nEstado…………………………………..……….……… aplique a la dependencia que esté asignado.\nSecretarías de\nDespacho……………………………………………\nRESULTADOS ESPERADOS\nSubsecretarías…………………..………………………\n……….\nDirecciones\nGenerales…………………….…………..............\nDirecciones de\nÁrea……..……….…………..………...….\nSubdirecciones……….………….....…….….………....\nCumplir y hacer cumplir las atribuciones y facultades conferidas por las leyes, reglamentos, Departamentos………………...................................... manuales y demás normatividad vigente en el\nJefaturas de\nEstado de Guerrero. oficina……….......................................\nJefaturas de área especializada………………..\nOperativo……................................................. ✓\nAdministrativo……………….……….....\nPRINCIPALES FUNCIONES\nGUERRERO\n- Obedecer y sujetarse a la disciplina y línea de mando que rige al Cuerpo de la Policía Estatal;\n- Tener la capacidad para tomar el mando de un grupo operativo, un sector, una comandancia regional o una coordinación regional;\n- Supervisar los servicios asignados al personal subalterno, para el debido y estricto cumplimiento del servicio encomendado;\n- Elaborar informes de las actividades y misiones encomendadas, para notificar los resultados derivados de las mismas;\n- Auxiliar de forma inmediata a la población en caso de siniestros y desastres naturales, a fin de proteger su integridad conforme a las disposiciones legales aplicables;\n- Aplicar estrategias de reacción en situaciones de disturbios civiles que pongan en riesgo la integridad física y patrimonial de la población;\n- Proteger las áreas estratégicas del estado a fin de evitar que se altere el orden y la paz pública;\n- Llevar a cabo patrullajes de seguridad en espacios públicos, con la finalidad de prevenir e inhibir la comisión de delitos que vulneren la integridad física y patrimonial de la ciudadanía;\n- Preservar el lugar de los hechos, para evitar que se contamine;\n- Prestar los servicios de seguridad y vigilancia que se le encomiende, uniformado o de civil cuando en apoyo de corporaciones o autoridades se le asigne por orden escrita de autoridad superior;\n- Proteger la integridad física de las personas detenidas por la comisión de algún delito, en tanto se ponen a disposición de la autoridad competente;\n- Realizar detenciones en flagrancia y poner al detenido de inmediato a disposición ante la autoridad competente;\n- Realizar labores de proximidad social atendiendo de manera oportuna e inmediata las quejas que le exponga la ciudadanía y que estén en su ámbito de competencia;\n- Aplicar de manera correcta y conforme a derecho el uso legítimo de la fuerza;\n- Brindar seguridad en el traslado de internos en base a la petición de la unidad de traslados;\n- Informar al superior jerárquico de manera inmediata los acontecimientos relevantes que se generen dentro de su servicio de seguridad y vigilancia;\n- Explotar los productos proporcionados por la Unidad de Análisis Táctico;\n- Obedecer y ejecutar estrictamente una orden superior, siempre y cuando no contravenga la ley; y\nGUERRERO\nCATÁLOGO DE PUESTOS RAMA: SEGURIDAD PÚBLICA OPERATIVO\nCÉDULA DE IDENTIFICACIÓN DE PUESTO\nDENOMINACIÓN DEL\nB40. SUBOFICIAL ACREDITABLE ANÁLISIS TÁCTICO\nPUESTO:\nCÓDIGOS DE CATEGORÍAS ÁREAS DE ADSCRIPCIÓN\nSubsecretaría de Prevención y Operación\nT80005\nPolicial\nNIVEL DE GESTIÓN SUPERVISIÓN EJERCIDA\nA las servidoras y servidores públicos de la\nN 10 Administración Pública Estatal adscritos a su mando.\nUBICACIÓN EN LA ESTRUCTURA\nGRADO DE ESTUDIOS\nOCUPACIONAL\nEjecutivo del\nEstado…………………………………..……….……… De acuerdo a la normatividad específica que\nSecretarías de aplique a la dependencia que esté asignado.\nDespacho……………………………………………\nRESULTADOS ESPERADOS\nSubsecretarías…………………..………………………\n……….\nDirecciones\nGenerales…………………….…………..............\nDirecciones de\nÁrea……..……….…………..………...….\nSubdirecciones……….………….....…….….………....\nCumplir y hacer cumplir las atribuciones y facultades conferidas por las leyes, reglamentos, Departamentos………………...................................... manuales y demás normatividad vigente en el\nJefaturas de\nEstado de Guerrero. oficina……….......................................\nJefaturas de área especializada………………..\nOperativo……................................................. ✓\nAdministrativo……………….……….....\nPRINCIPALES FUNCIONES\n- Informar al mando inmediato los resultados obtenidos de la información analizada;\nGUERRERO\n- Coordinar los procesos de cruce de información con las diferentes corporaciones policiales;\n- Analizar la información obtenida a través del cruce de información proporcionada por diversas corporaciones policiacas;\n- Realizar investigaciones de gabinete utilizando herramientas estratégicas;\n- Llevar a cabo la recolección de información de gabinete que se genere en su ámbito de competencia;\n- Analizar la información recabada y corroborar su veracidad;\n- Procesar información e informar al mando inmediato de la situación que acontece;\n- Realizar mapeo utilizando la información obtenida;\n- Elaborar estadísticas de la incidencia delictiva estatal, regional y municipal;\n- Realizar informes de los resultados obtenidos al superior inmediato de la información proporcionada por la Unidad de Investigación, para determinar acciones conducentes;\n- Analizar información de personas involucradas en algún hecho delictivo;\n- Desarrollar técnicas de entrevista e interrogatorios a personas previamente identificadas en coordinación con la Unidad de Investigación;\n- Tener habilidades para el manejo y uso correcto de tecnología de punta que se utiliza en el proceso del manejo de información;\n- Realizar investigaciones de gabinete tendientes a la prevención de delitos en determinadas áreas geográficas;\n- Realizar propuestas de acciones tendientes a bajar los índices delincuenciales en base a los resultados del proceso del ciclo de información;\n- Procesar los resultados de las labores de inteligencia social, realizados por la Unidad de Investigación, posteriormente sugerir al mando acciones a realizar en dichas áreas; y\nGUERRERO\nCATÁLOGO DE PUESTOS RAMA: SEGURIDAD PÚBLICA OPERATIVO\nCÉDULA DE IDENTIFICACIÓN DE PUESTO\nDENOMINACIÓN DEL PUESTO: B41. SUBOFICIAL ACREDITABLE INVESTIGACIÓN\nCÓDIGOS DE CATEGORÍAS ÁREAS DE ADSCRIPCIÓN\nSubsecretaría de Prevención y Operación\nI80015\nPolicial.\nNIVEL DE GESTIÓN SUPERVISIÓN EJERCIDA\nA las servidoras y servidores públicos de la\nN 10 Administración Pública Estatal adscritos a su mando.\nUBICACIÓN EN LA ESTRUCTURA\nGRADO DE ESTUDIOS\nOCUPACIONAL\nEjecutivo del\nDe acuerdo a la normatividad específica que\nEstado…………………………………..……….……… aplique a la dependencia que esté asignado.\nSecretarías de\nDespacho……………………………………………\nRESULTADOS ESPERADOS\nSubsecretarías…………………..………………………\n……….\nDirecciones\nGenerales…………………….…………..............\nDirecciones de\nÁrea……..……….…………..………...….\nSubdirecciones……….………….....…….….………....\nCumplir y hacer cumplir las atribuciones y facultades conferidas por las leyes, reglamentos, Departamentos………………...................................... manuales y demás normatividad vigente en el\nJefaturas de\nEstado de Guerrero. oficina……….......................................\nJefaturas de área especializada………………..\nOperativo……................................................. ✓\nAdministrativo……………….……….....\nPRINCIPALES FUNCIONES\n- Coordinar las funciones de investigación en ausencia de algún mando de mayor jerarquía;\nGUERRERO\n- Coordinar operaciones encubiertas, con el fin de obtener información requerida;\n- Coordinar tareas de vigilancia “fijas y móviles” a personas identificadas con la finalidad de conocer sus actividades;\n- Realizar informes de los resultados obtenidos al superior inmediato, para determinar acciones conducentes;\n- Relacionar información de personas involucradas en algún hecho delictivo;\n- Desarrollar técnicas de entrevista e interrogatorios a personas previamente identificadas para obtener mayor información requerida;\n- Infiltrarse dentro de un grupo que se requiera investigar, para conocer sus actividades si estas se consideran un riesgo para la seguridad del estado;\n- Tener la capacidad adecuada para manejar un perfil acorde al grupo al que se va a infiltrar;\n- Tener habilidades para el manejo y uso correcto de tecnología de punta que se utiliza en el proceso de la investigación;\n- Prestar los servicios de seguridad y vigilancia que se le encomiende, uniformado o de civil cuando en apoyo de corporaciones o autoridades se le asigne por orden escrita de autoridad superior;\n- Realizar investigaciones tendientes a la prevención de delitos en determinadas áreas geográficas;\n- Realizar acciones tendientes a bajar los índices delincuenciales;\n- Llevar a cabo labores de inteligencia social, con la finalidad de conocer los niveles de incidencia delictiva en diversas áreas geográficas;\n- Proponer al mando la implementación de algún operativo que considere pertinente en las áreas que de acuerdo a su investigación considere como focos rojos; y\nGUERRERO\nCATÁLOGO DE PUESTOS RAMA: SEGURIDAD PÚBLICA OPERATIVO\nCÉDULA DE IDENTIFICACIÓN DE PUESTO\nDENOMINACIÓN DEL PUESTO: B42. SUBOFICIAL ACREDITABLE OPERACIONES\nCÓDIGOS DE CATEGORÍAS ÁREAS DE ADSCRIPCIÓN\nSubsecretaría de Prevención y Operación\nO80025\nPolicial.\nNIVEL DE GESTIÓN SUPERVISIÓN EJERCIDA\nA las servidoras y servidores públicos de la\nN 10 Administración Pública Estatal adscritos a su mando.\nUBICACIÓN EN LA ESTRUCTURA\nGRADO DE ESTUDIOS\nOCUPACIONAL\nEjecutivo del\nEstado…………………………………..……….……… De acuerdo a la normatividad específica que\nSecretarías de aplique a la dependencia que esté asignado.\nDespacho……………………………………………\nRESULTADOS ESPERADOS\nSubsecretarías…………………..………………………\n……….\nDirecciones\nGenerales…………………….…………..............\nDirecciones de\nÁrea……..……….…………..………...….\nSubdirecciones……….………….....…….….………....\nCumplir y hacer cumplir las atribuciones y facultades conferidas por las leyes, reglamentos, Departamentos………………...................................... manuales y demás normatividad vigente en el\nJefaturas de\nEstado de Guerrero. oficina……….......................................\nJefaturas de área especializada………………..\nOperativo……................................................. ✓\nAdministrativo……………….……….....\nPRINCIPALES FUNCIONES\n- Obedecer y sujetarse a la disciplina y línea de mando que rige al Cuerpo de la Policía Estatal;\nGUERRERO\n- Tener la capacidad para tomar el mando de un grupo operativo, un sector, una comandancia regional o una coordinación regional;\n- Supervisar los servicios asignados al personal subalterno, para el debido y estricto cumplimiento del servicio encomendado;\n- Elaborar informes de las actividades y misiones encomendadas, para notificar los resultados derivados de las mismas;\n- Auxiliar de forma inmediata a la población en caso de siniestros y desastres naturales, a fin de proteger su integridad, conforme a las disposiciones legales aplicables;\n- Aplicar estrategias de reacción en situaciones de disturbios civiles que pongan en riesgo la integridad física y patrimonial de la población;\n- Proteger las áreas estratégicas del estado a fin de evitar que se alteren el orden y la paz pública;\n- Llevar a cabo patrullajes de seguridad en espacios públicos, con la finalidad de prevenir e inhibir la comisión de delitos que vulneren la integridad física y patrimonial de la ciudadanía;\n- Preservar el lugar de los hechos, para evitar que se contamine;\n- Prestar los servicios de seguridad y vigilancia que se le encomiende, uniformado o de civil cuando en apoyo de corporaciones o autoridades se le asigne por orden escrita de autoridad superior;\n- Proteger la integridad física de las personas detenidas por la comisión de algún delito, en tanto se ponen a disposición de la autoridad competente;\n- Realizar detenciones en flagrancia y poner al detenido de inmediato a disposición ante la autoridad competente;\n- Realizar labores de proximidad social atendiendo de manera oportuna e inmediata las quejas que le exponga la ciudadanía y que estén en su ámbito de competencia;\n- Aplicar de manera correcta y conforme a derecho el uso legítimo de la fuerza;\n- Brindar seguridad en el traslado de internos en base a la petición de la unidad de traslados;\n- Informar al superior jerárquico de manera inmediata los acontecimientos relevantes que se generen dentro de su servicio de seguridad y vigilancia;\n- Explotar los productos proporcionados por la Unidad de Análisis Táctico;\n- Obedecer y ejecutar estrictamente una orden superior conforme siempre y cuando no contravenga a la ley; y\nGUERRERO\nCATÁLOGO DE PUESTOS RAMA: SEGURIDAD PÚBLICA OPERATIVO\nCÉDULA DE IDENTIFICACIÓN DE PUESTO\nDENOMINACIÓN DEL PUESTO: B43. SUBOFICIAL PENITENCIARIO ACREDITABLE\nCÓDIGOS DE CATEGORÍAS ÁREAS DE ADSCRIPCIÓN\nO80034 Subsecretaría del Sistema Penitenciario.\nNIVEL DE GESTIÓN SUPERVISIÓN EJERCIDA\nA las servidoras y servidores públicos de la\nN 10 Administración Pública Estatal adscritos a su mando.\nUBICACIÓN EN LA ESTRUCTURA\nGRADO DE ESTUDIOS\nOCUPACIONAL\nEjecutivo del De acuerdo a la normatividad específica que\nEstado…………………………………..……….……… aplique a la dependencia que esté asignado.\nSecretarías de\nDespacho…………………………………………… RESULTADOS ESPERADOS\nSubsecretarías…………………..………………………\n……….\nDirecciones\nGenerales…………………….…………..............\nDirecciones de\nÁrea……..……….…………..………...….\nCumplir y hacer cumplir las atribuciones y\nSubdirecciones……….………….....…….….……….... facultades conferidas por las leyes, reglamentos, manuales y demás normatividad vigente en el\nDepartamentos………………......................................\nEstado de Guerrero.\nJefaturas de oficina……….......................................\nJefaturas de área especializada………………..\nOperativo……................................................. ✓\nAdministrativo……………….……….....\nPRINCIPALES FUNCIONES\n- Conocer las funciones y responsabilidades de su grado, a fin de estar en condiciones de sustituir a un superior;\n- Supervisar las labores del personal operativo bajo su mando;\nGUERRERO\n- Ejecutar las labores asignadas a su unidad;\n- Ejecutar los operativos y planes de defensa de las instalaciones;\n- Ejecutar operativos de control de disturbios en el interior del centro penitenciario;\n- Informar de manera inmediata a su superior del ingreso y egreso al centro penitenciario de toda persona privada de su libertad;\n- Revisar las instalaciones penitenciarias en áreas específicas consideradas vulnerables;\n- Coadyuvar con los diferentes niveles de gobierno para el desarrollo de operativos dentro de los Centros de Reinserción Social;\n- Dar cumplimiento a las consignas y protocolos de actuación establecidos como reglamento de la institución;\n- Obedecer y ejecutar órdenes superiores que no se contrapongan a lo establecido conforme a la ley;\n- Mantener la tranquilidad, el orden y la paz en el interior y exterior de los Centros de Reinserción Social;\n- Proporcionar seguridad a la población interna y a las personas que realizan visitas al interior de los Centros de Reinserción Social;\n- Revisión de personas, vehículos, objetos y alimentos que ingresan al interior de los Centros de\nReinserción Social;\n- Preservar la integridad física de la población interna, dando un trato especial a las personas con capacidades diferentes o con alguna complicación médica según el caso;\n- Ejecutar los protocolos de registro de ingreso y el egreso de toda persona privada de su libertad que entre a los centros penitenciarios;\n- Ejecutar los protocolos de registro de entrada y salida de personal operativo y administrativo;\n- Ejecutar operativos de inspecciones y requisas en el área de población penitenciaria;\n- Supervisión de la elaboración y control del inventario de las herramientas de trabajo que se utilizan en los diferentes talleres establecidos en el interior de los Centros de Reinserción Social, especialmente objetos que pongan en riesgo la integridad física de los internos, así como la estabilidad y la paz en el interior de los mismos; y\nGUERRERO\nCATÁLOGO DE PUESTOS RAMA: SEGURIDAD PÚBLICA OPERATIVO\nCÉDULA DE IDENTIFICACIÓN DE PUESTO\nDENOMINACIÓN DEL PUESTO: B44. MÉDICO\nCÓDIGOS DE CATEGORÍAS ÁREAS DE ADSCRIPCIÓN\nSecretariado Ejecutivo del Sistema Estatal de\n30706, 30705\nSeguridad Pública.\nNIVEL DE GESTIÓN SUPERVISIÓN EJERCIDA\nN 06\nUBICACIÓN EN LA ESTRUCTURA\nGRADO DE ESTUDIOS\nOCUPACIONAL\nEjecutivo del\nDe acuerdo a la normatividad específica que\nEstado…………………………………..……….……… aplique a la dependencia que esté asignado.\nSecretarías de\nDespacho……………………………………………\nRESULTADOS ESPERADOS\nSubsecretarías…………………..………………………\n……….\nDirecciones\nGenerales…………………….…………..............\nDirecciones de\nÁrea……..……….…………..………...….\nSubdirecciones……….………….....…….….………....\nCumplir y hacer cumplir las atribuciones y\n✓ facultades conferidas por las leyes, reglamentos, Departamentos………………...................................... manuales y demás normatividad vigente en el\nJefaturas de Estado de Guerrero. oficina……….......................................\nJefaturas de área especializada………………..\nOperativo…….................................................\nAdministrativo……………….……….....\nPRINCIPALES FUNCIONES\nGUERRERO\n- Aplicar las estrategias para el primer nivel de atención de la salud;\n- Integrar el equipo interdisciplinario;\n- Planificar las acciones en salud;\n- Realizar un diagnóstico de situación basado en un enfoque crítico de riesgo, teniendo en cuenta los factores demográficos, sanitarios, socio-culturales, económicos y epidemiológicos obtenidos en el área; en forma permanente;\n- Realizar acciones de administración;\n- Enfatizar las tareas de evaluación continua de las acciones de salud;\n- Registrar todas las prestaciones que realiza;\n- Efectuar la práctica asistencial según normas, adaptadas con la participación de los actores locales a su realidad cotidiana;\n- Indicar la internación y/o traslado del paciente;\n- Cumplir con Programas de Formación Continua:\n- Asesorar en temas de salud a instituciones y grupos del área:\n- Identificar factores de riesgo en la salud del evaluado, en un marco de seguridad personal e institucional y proponer medidas preventivas y correctivas;\n- Verificar que el estado de salud e integridad física del evaluado permita el cumplimiento de las funciones del puesto; y\n- Las demás que las disposiciones legales le atribuyan, así como, aquéllas que le confiera su superior\nGUERRERO\nCATÁLOGO DE PUESTOS RAMA: SEGURIDAD PÚBLICA OPERATIVO\nCÉDULA DE IDENTIFICACIÓN DE PUESTO\nDENOMINACIÓN DEL PUESTO: B45. POLIGRAFISTA\nCÓDIGOS DE CATEGORÍAS ÁREAS DE ADSCRIPCIÓN\nSecretariado Ejecutivo del Sistema Estatal de\n30709, 30710\nSeguridad Pública.\nNIVEL DE GESTIÓN SUPERVISIÓN EJERCIDA\nN 05\nUBICACIÓN EN LA ESTRUCTURA\nGRADO DE ESTUDIOS\nOCUPACIONAL\nEjecutivo del\nDe acuerdo a la normatividad específica que\nEstado…………………………………..……….……… aplique a la dependencia que esté asignado.\nSecretarías de\nDespacho……………………………………………\nRESULTADOS ESPERADOS\nSubsecretarías…………………..………………………\n……….\nDirecciones\nGenerales…………………….…………..............\nDirecciones de\nÁrea……..……….…………..………...…. ✓\nSubdirecciones……….………….....…….….……….... Cumplir y hacer cumplir las atribuciones y facultades conferidas por las leyes, reglamentos, Departamentos………………...................................... manuales y demás normatividad vigente en el\nJefaturas de Estado de Guerrero. oficina……….......................................\nJefaturas de área especializada………………..\nOperativo…….................................................\nAdministrativo……………….……….....\nPRINCIPALES FUNCIONES\nGUERRERO\n- Verificar antecedentes de evaluación o personales; perfil del puesto y en su caso especificaciones del área; previa recepción del evaluado;\n- Verificar el adecuado funcionamiento del instrumento poligráfico;\n- Entregar al evaluado el folleto con su información referente a la evaluación poligráfica;\n- Solicitar al evaluado llene el formato de datos generales;\n- Explicar al evaluado el funcionamiento del polígrafo y procedimiento de evaluación;\n- Solicitar al evaluado su autorización por escrito para llevar a cabo la evaluación poligráfica y temas a profundizar;\n- Revisar los antecedentes personales del evaluado y verificar que se encuentre en condiciones de presentar el examen;\n- Aplicar prueba de ajuste y verificar capacidad de respuesta fisiológica del evaluado;\n- Aplicar los exámenes poligráficos;\n- Elaborar reporte de evaluación poligráfica de acuerdo a los criterios establecidos;\n- Verificar en apego a principios, normas y valores institucionales;\n- Identificar y prevenir riesgos que dañen la operación, seguridad y cumplimiento de los objetivos institucionales;\n- Fortalecer niveles de confiabilidad y seguridad, mediante la identificación de candidatos cuyas conductas, principios y valores sean acordes a las instituciones; y\n- Las demás que las disposiciones legales le atribuyan, así como, aquéllas que le confiera su superior\nGUERRERO\nCATÁLOGO DE PUESTOS RAMA: SEGURIDAD PÚBLICA OPERATIVO\nCÉDULA DE IDENTIFICACIÓN DE PUESTO\nDENOMINACIÓN DEL PUESTO: B46. PSICÓLOGO (A)\nCÓDIGOS DE CATEGORÍAS ÁREAS DE ADSCRIPCIÓN\nSecretariado Ejecutivo del Sistema Estatal de\n30711, 30712\nSeguridad Pública.\nNIVEL DE GESTIÓN SUPERVISIÓN EJERCIDA\nN 06\nUBICACIÓN EN LA ESTRUCTURA\nGRADO DE ESTUDIOS\nOCUPACIONAL\nEjecutivo del\nDe acuerdo a la normatividad específica que\nEstado…………………………………..……….……… aplique a la dependencia que esté asignado.\nSecretarías de\nDespacho……………………………………………\nRESULTADOS ESPERADOS\nSubsecretarías…………………..………………………\n……….\nDirecciones\nGenerales…………………….…………..............\nDirecciones de\nÁrea……..……….…………..………...….\nSubdirecciones……….………….....…….….………....\n✓ Cumplir y hacer cumplir las atribuciones y facultades conferidas por las leyes, reglamentos, Departamentos………………...................................... manuales y demás normatividad vigente en el\nJefaturas de Estado de Guerrero. oficina……….......................................\nJefaturas de área especializada………………..\nOperativo…….................................................\nAdministrativo……………….……….....\nPRINCIPALES FUNCIONES\nGUERRERO\n- Entrevistar a pacientes con problemas psicológicos;\n- Planificar, coordinar las actividades que se realizan en la unidad a su cargo;\n- Administrar y corregir las pruebas psicológicas individuales y/o de grupos;\n- Supervisar las actividades que se realizan en la unidad a su cargo;\n- Analizar y evaluar las pruebas psicológicas y psicotécnicas;\n- Aplicar pruebas psicotécnicas a los pacientes, evaluando sus aptitudes, intereses y aspectos de la personalidad;\n- Elaborar informes de los resultados de las pruebas, diagnósticos y tratamiento a seguir;\n- Aplicar psicoterapia individual y/o de grupo;\n- Suministrar orientación vocacional y profesional a los usuarios;\n- Coordinar la elaboración de perfiles de aptitudes en lo concerniente a orientación y selección profesional;\n- Realizar talleres técnicos para modificar conductas;\n- Participar en reuniones periódicas con el equipo de trabajo a fin de discernir sobre los problemas críticos observados en los pacientes y obtener o suministrar sugerencias de solución;\n- Participar en la planificación, desarrollo y evaluación de campañas educacionales diversas;\n- Participar en la elaboración de programas de evaluación motivacional y desarrollo personal;\n- Presentar informes técnicos;\n- Cumplir con las normas y procedimientos en materia de seguridad integral, establecidos por la organización;\n- Mantener en orden equipo y sitio de trabajo, reportando cualquier anomalía;\n- Elaborar informes periódicos de las actividades realizadas;\n- Evaluar a través del proceso de aplicación de una batería de pruebas específicas y entrevista profunda, si las características de personalidad, valores, competencias y capacidades del candidato coinciden con el perfil del puesto vacante;\n- Identificar perfiles de riesgo en función de la entidad y cargo a desempeñar;\n- Realizar cualquier otra tarea afín que le sea asignada; y\nGUERRERO\nCATÁLOGO DE PUESTOS RAMA: SEGURIDAD PÚBLICA OPERATIVO\nCÉDULA DE IDENTIFICACIÓN DE PUESTO\nDENOMINACIÓN DEL PUESTO: B47. QUÍMICO\nCÓDIGOS DE CATEGORÍAS ÁREAS DE ADSCRIPCIÓN\nSecretariado Ejecutivo del Sistema Estatal de\n30708, 30707\nSeguridad Pública.\nNIVEL DE GESTIÓN SUPERVISIÓN EJERCIDA\nN 06\nUBICACIÓN EN LA ESTRUCTURA\nGRADO DE ESTUDIOS\nOCUPACIONAL\nEjecutivo del\nDe acuerdo a la normatividad específica que\nEstado…………………………………..……….……… aplique a la dependencia que esté asignado.\nSecretarías de\nDespacho……………………………………………\nRESULTADOS ESPERADOS\nSubsecretarías…………………..………………………\n……….\nDirecciones\nGenerales…………………….…………..............\nDirecciones de\nÁrea……..……….…………..………...….\nSubdirecciones……….………….....…….….………....\n✓ Cumplir y hacer cumplir las atribuciones y facultades conferidas por las leyes, reglamentos, Departamentos………………...................................... manuales y demás normatividad vigente en el\nJefaturas de Estado de Guerrero. oficina……….......................................\nJefaturas de área especializada………………..\nOperativo…….................................................\nAdministrativo……………….……….....\nPRINCIPALES FUNCIONES\n- Realizar diversos análisis físico-químicos y microbiológicos de productos;\n- Recibir del jefe inmediato los productos para su análisis, entre éstos: medicamentos, cosméticos y alimentos;\nGUERRERO\n- Utilizar técnicas de análisis especializadas;\n- Entregar informes de resultados al jefe inmediato;\n- Consultar en los libros de trabajo (USP, AOAC, etc.) la preparación de los reactivos;\n- Determinar a través de la valoración si los reactivos utilizados tienen el título adecuado y si son de importancia, pues de esto depende los resultados de los análisis;\n- Preparar los reactivos y materiales químicos para los análisis de los productos;\n- Calibrar los equipos utilizados en la sección;\n- Revisar los manuales de los equipos de laboratorio;\n- Calibrar el equipo e instrumentos de laboratorio para cumplir con las normas oficiales;\n- Revisar literatura nueva, relacionada con el análisis químico;\n- Realizar protocolos adecuados al laboratorio para modificar algún factor que interfiera en el análisis;\n- Revisar nuevas tecnologías a través de diversas fuentes e internet y adecuarlas a la realidad e implantarlas;\n- Diseñar e implementar investigaciones concernientes al área química, farmacéutica o microbiológica;\n- Diseñar el protocolo de investigación;\n- Entregar el protocolo de investigación al jefe inmediato;\n- Revisar las modificaciones efectuadas por el jefe inmediato al protocolo de investigación;\n- Corregir las modificaciones efectuadas;\n- Participa en programas de actualización concernientes al análisis físico-químico, microbiológico y de avances tecnológicos;\n- Recibir notificación del jefe inmediato para la asistencia a seminarios, cursos, talleres, programas de postgrado;\n- Asistir a las actividades de capacitación continua;\n- Confeccionar informes técnicos de los productos analizados;\n- Realizar otras tareas relacionadas con las funciones de la unidad; y\nGUERRERO\nCATÁLOGO DE PUESTOS RAMA: PROTECCIÓN CIVIL OPERATIVO\nCÉDULA DE IDENTIFICACIÓN DE PUESTOS\nDENOMINACIÓN DEL PUESTO: C01. BRIGADISTA\nCÓDIGOS DE CATEGORÍAS ÁREAS DE ADSCRIPCIÓN\nDirección General de Atención a Emergencias y\nPC90003, PC9004, PC90005, PC90006\nDesastres.\nNIVEL DE GESTIÓN SUPERVISIÓN EJERCIDA\nN 10\nUBICACIÓN EN LA ESTRUCTURA\nGRADO DE ESTUDIOS\nOCUPACIONAL\nEjecutivo del\nDe acuerdo a la normatividad específica que\nEstado…………………………………..……….……… aplique a la dependencia que esté asignado.\nSecretarías de\nDespacho……………………………………………\nRESULTADOS ESPERADOS\nSubsecretarías…………………..………………………\n……….\nDirecciones\nGenerales…………………….…………..............\nDirecciones de\nÁrea……..……….…………..………...….\nSubdirecciones……….………….....…….….……….... Cumplir y hacer cumplir las atribuciones y facultades conferidas por las leyes, reglamentos, Departamentos………………...................................... manuales y demás normatividad vigente en el\nJefaturas de Estado de Guerrero. oficina……….......................................\nJefaturas de área especializada………………..\nOperativo……................................................. ✓\nAdministrativo……………….……….....\nPRINCIPALES FUNCIONES\n- Identificar los riesgos a los que está sujeto su centro de trabajo, reportar cualquier anomalía, para establecer medidas que disminuyan la probabilidad de ocurrencia de un siniestro o desastre;\nGUERRERO\n- Recibir capacitación en la especialidad de la brigada, para garantizar la eficiencia de su función;\n- Brindar auxilio y apoyo al personal en general en forma planeada ante una situación de emergencia;\n- Participar en los ejercicios de simulación de evacuación que se programen en su centro de trabajo;\n- Sensibilizar a los ciudadanos para mantener la calma, cuando se presente una emergencia;\n- Coordinar sus actividades con las autoridades de protección civil, para conocer y revisar los planes de emergencia de todos los centros de trabajo diseñados con antelación como mecanismo preventivo;\n- Apoyar a los responsables de protección civil encargados de la verificación periódica del funcionamiento óptimo de la señal de alarma, para asegurar, en el caso de que se trate de una sirena, de que ésta sea escuchada por absolutamente todo el personal, así como por la población en donde esté instalada;\n- Asistir con el personal capacitado para diagnosticar si las instalaciones industriales, comerciales y de servicio por apresurarse cumplen con las normas establecidas para la seguridad de la población; y\nGUERRERO\nCATÁLOGO DE PUESTOS RAMA: PROTECCIÓN CIVIL OPERATIVO\nCÉDULA DE IDENTIFICACIÓN DE PUESTO\nDENOMINACIÓN DEL PUESTO: C02. JEFE(A) DE EQUIPO\nCÓDIGOS DE CATEGORÍAS ÁREAS DE ADSCRIPCIÓN\nDirección General de Atención a Emergencias y\nPC90002\nDesastres.\nNIVEL DE GESTIÓN SUPERVISIÓN EJERCIDA\nA las servidoras y servidores públicos de la\nN 10 Administración Pública Estatal adscritos a su mando.\nUBICACIÓN EN LA ESTRUCTURA\nGRADO DE ESTUDIOS\nOCUPACIONAL\nEjecutivo del\nDe acuerdo a la normatividad específica que\nEstado…………………………………..……….……… aplique a la dependencia que esté asignado.\nSecretarías de\nDespacho……………………………………………\nRESULTADOS ESPERADOS\nSubsecretarías…………………..………………………\n……….\nDirecciones\nGenerales…………………….…………..............\nDirecciones de\nÁrea……..……….…………..………...….\nSubdirecciones……….………….....…….….……….... Cumplir y hacer cumplir las atribuciones y facultades conferidas por las leyes, reglamentos, Departamentos………………...................................... manuales y demás normatividad vigente en el\nJefaturas de Estado de Guerrero. oficina……….......................................\nJefaturas de área especializada………………..\nOperativo……................................................. ✓\nAdministrativo……………….……….....\nPRINCIPALES FUNCIONES\nGUERRERO\n- Elaborar y desarrollar con eficiencia y eficacia los programas de trabajo asignados su área de responsabilidad;\n- Coordinar y supervisar las labores asignadas al personal a su cargo y presentar los informes correspondientes con la oportunidad debida;\n- Elaborar, diseñar, implantar y actualizar formatos de control interno, que les permita la armonización de información de las bases de datos integradas a las tareas de protección civil;\n- Desarrollar un plan de acciones, que contribuyan a concientizar a la población, prevenir y minimizar las consecuencias de una calamidad o peligro;\n- Brindar auxilio a la ciudadanía en general, de manera organizada y planeada, en una situación de emergencia;\n- Identificar los peligros, vulnerabilidades y riesgos a los que está sujeto el edificio y/o centro de trabajo, así como del personal en general, para establecer las medidas, acciones y obras, que disminuyan la probabilidad de un accidente, siniestro y/o desastre;\n- Promover una cultura de prevención de emergencias, a través de una línea formativa, así como a través de conferencias presentadas a estudiantes, trabajadores y público en general;\n- Mantener permanentemente un inventario del equipo que se les proporciona para la realización de sus tareas debiendo estar siempre en las mejores condiciones de funcionamiento; y\nGUERRERO\nCATÁLOGO DE PUESTOS RAMA: PROTECCIÓN CIVIL OPERATIVO\nCÉDULA DE IDENTIFICACIÓN DE PUESTO\nDENOMINACIÓN DEL PUESTO: C03. JEFE(A) DE GRUPO\nCÓDIGOS DE CATEGORÍAS ÁREAS DE ADSCRIPCIÓN\nDirección General de Atención a Emergencias y\nPC90001\nDesastres.\nNIVEL DE GESTIÓN SUPERVISIÓN EJERCIDA\nA las servidoras y servidores públicos de la\nN 10 Administración Pública Estatal adscritos a su mando.\nUBICACIÓN EN LA ESTRUCTURA\nGRADO DE ESTUDIOS\nOCUPACIONAL\nEjecutivo del\nDe acuerdo a la normatividad específica que\nEstado…………………………………..……….……… aplique a la dependencia que esté asignado.\nSecretarías de\nDespacho……………………………………………\nRESULTADOS ESPERADOS\nSubsecretarías…………………..………………………\n……….\nDirecciones\nGenerales…………………….…………..............\nDirecciones de\nÁrea……..……….…………..………...….\nSubdirecciones……….………….....…….….……….... Cumplir y hacer cumplir las atribuciones y facultades conferidas por las leyes, reglamentos, Departamentos………………...................................... manuales y demás normatividad vigente en el\nJefaturas de Estado de Guerrero. oficina……….......................................\nJefaturas de área especializada………………..\nOperativo……................................................. ✓\nAdministrativo……………….……….....\nPRINCIPALES FUNCIONES\nGUERRERO\n- Gestionar, obtener y procesar información científico-técnica que permita generar conocimientos, elaborar estudios y aplicar modelos de diagnóstico de riesgos;\n- Coordinar y supervisar las labores asignadas al personal a su cargo y presentar informes oportunos y veraces de las acciones atendidas, vinculadas a las emergencias presentadas por la ciudadanía;\n- Elaborar, diseñar, implantar y actualizar formatos de control interno que les permita la armonización de información de las bases de datos integradas a las tareas de protección civil;\n- Desarrollar un plan de acciones, que contribuyan a concientizar a la población, prevenir y minimizar las consecuencias de una calamidad o peligro;\n- Brindar auxilio al personal en general, de manera organizada y planeada, en una situación de emergencia;\n- Identificar los peligros, vulnerabilidades y riesgos a los que está sujeto el edificio y/o centro de trabajo, así como el personal en general, para establecer las medidas, acciones y obras, que disminuyan la probabilidad de un accidente, siniestro y/o desastre;\n- Mantener permanentemente un inventario del equipo que se les proporciona para la realización de sus tareas debiendo estar siempre en las mejores condiciones de funcionamiento;\n- Promover una cultura de prevención de emergencias, a través de una línea formativa, así como a través de conferencias presentadas a estudiantes, trabajadores y público en general; y\nGUERRERO\nPrimero. El presente Acuerdo por el que se emite el Catálogo General de Puestos de la\nAdministración Pública Centralizadadel Estado de Guerrero, entrará en vigor al día siguiente de su\nSegundo. Se abroga el Catálogo de Puestos Genéricos del Gobierno del Estado, publicado en el Periódico Oficial del Gobierno del Estado de Guerrero, número 91 Alcance I, de fecha 14 de noviembre de 2017; así como, todas las disposiciones que se opongan al presente Acuerdo.\nDado en Palacio de Gobierno, ubicado en Boulevard René Juárez Cisneros No. 62, Colonia\nCiudad de los Servicios en la Ciudad de Chilpancingo de los Bravo, Capital del Estado de Guerrero, a los 23 días del mes de diciembre del año dos mil veinte.\nEL SECRETARIO DE FINANZAS Y ADMINISTRACIÓN DEL ESTADO DE GUERRERO.\nLIC. TULIO SAMUEL PÉREZ CALVO.\nRúbrica.\nMTRO. EDUARDO GERARDO LORIA CASANOVA.\nRúbrica.",
  "ordenamiento": "ACUERDO",
  "jurisdiccion": "GUERRERO",
  "fuente_oficial": "DIARIO OFICIAL DE LA FEDERACION",
  "Fecha de Publicación": "08 de Enero de 2021",
  "ULTIMA REFORMA PUBLICADA": null,
  "status": "VIGENTE",
  "es_escaneado": false,
  "tiene_tablas": true,
  "materia": [
    "general"
  ]
}