{
  "titulo": "Acuerdo por el Que Se Emite la Clasificación Administrativa",
  "Contenido": "TEXTO ORIGINAL\nANTECEDENTES\nGeneral de Contabilidad Gubernamental (Ley de Contabilidad), que tiene como objeto establecer los criterios generales que regirán la Contabilidad Gubernamental y la emisión de información financiera de los entes públicos, con el fin de lograr su adecuada armonización, para facilitar a los entes públicos el registro y la fiscalización de los activos, pasivos, ingresos y gastos y, en general, contribuir a medir la eficacia, economía y eficiencia del gasto e ingreso públicos.\nLa Ley de Contabilidad es de observancia obligatoria para los poderes Ejecutivo, Legislativo y Judicial de la Federación, entidades federativas; los ayuntamientos de los municipios; los órganos político-administrativos de las demarcaciones territoriales del\nDistrito Federal; las entidades de la administración pública paraestatal, ya sean federales, estatales o municipales y los órganos autónomos federales y estatales.\nEl órgano de coordinación para la armonización de la Contabilidad\nGubernamental es el Consejo Nacional de Armonización Contable (CONAC), el cual tiene por objeto la emisión de las normas contables y lineamientos para la generación de información financiera que aplicarán los entes públicos, previamente formuladas y propuestas por el Secretario Técnico. normativos, contables, económicos y financieros que emite deben ser implementados por los entes públicos, a través de las modificaciones, adiciones o reformas a su marco jurídico, lo cual podría consistir en la eventual modificación o expedición de leyes y disposiciones administrativas de carácter local, según sea el caso.\nPor lo anterior, el CONAC, en el marco de la Ley de Contabilidad está obligado a cumplimiento de las decisiones de dicho cuerpo colegiado. El Secretario Técnico del\nCONAC realizará el registro de los actos que los gobiernos de las entidades federativas, competencia.\nEl Secretario Técnico será el encargado de publicar dicha información, asegurándose que cualquier persona pueda tener fácil acceso a la misma. Lo anterior cumple con la finalidad de proporcionar a la población una herramienta de seguimiento, mediante la cual se dé cuenta sobre el grado de cumplimiento de las entidades federativas y municipios. No se omite mencionar que la propia Ley de Contabilidad establece que las entidades federativas que no estén al corriente en sus obligaciones, no podrán inscribir obligaciones en el Registro de Obligaciones y Empréstitos.\nEn el marco de la Ley de Contabilidad, las entidades federativas deberán asumir una posición estratégica en las actividades de armonización para que cada uno de sus municipios logre cumplir con los objetivos que dicha ley ordena. Los gobiernos de las\nEntidades Federativas deben brindar la cooperación y asistencia necesarias a los gobiernos de sus municipios, para que éstos logren armonizar su contabilidad, con base en las decisiones que alcance el CONAC.\nAsimismo, es necesario considerar que el presente acuerdo se emite con el fin de establecer las bases para que los gobiernos: federal, de las entidades federativas y municipales, cumplan con las obligaciones que les impone el artículo cuarto transitorio de la Ley de Contabilidad. Lo anterior en el entendido de que los entes públicos de cada nivel de gobierno deberán realizar las acciones necesarias para cumplir con dichas obligaciones.\nEl presente acuerdo elaborado por el Secretariado Técnico, fue sometido a opinión del Comité Consultivo, el cual examinó la Clasificación Administrativa, contando con la participación de entidades federativas, municipios, la Auditoría Superior de la\nFederación, las entidades estatales de Fiscalización, el Instituto para el Desarrollo\nTécnico de las Haciendas Públicas, el Instituto Mexicano de Contadores Públicos, la\nPermanente de Contralores Estados-Federación. Así como, los grupos que integran la\nComisión Permanente de Funcionarios Fiscales.\nSecretario Técnico la opinión y complemento a la misma, respectivamente, sobre el proyecto de Acuerdo por el que se emite la Clasificación Administrativa.\nEn virtud de lo anterior, y con fundamento en los artículos 6 y 9, Fracción I, de la\nLey de Contabilidad, el CONAC ha decidido lo siguiente:\nPRIMERO.- Se emite la Clasificación Administrativa a que hace referencia la Ley de Contabilidad.\nÍNDICE\nI. INTRODUCCIÓN\nII. BASE LEGAL\nIII. OBJETIVOS\nIV. CONTEXTO CONCEPTUAL Y METODOLÓGICO\nV. ASPECTOS GENERALES DE LA ORGANIZACIÓN TERRITORIAL, POLÍTICA\nY ADMINISTRATIVA DE MÉXICO\nVI. ESTRUCTURA BÁSICA\nVII. DESCRIPCIÓN DE LAS PRINCIPALES CUENTAS COMPONENTES\nANEXO I: MODELO ALTERNATIVO PARA PRESENTAR LA ESTRUCTURA DEL\nI. INTRODUCCIÓN\nClasificación Administrativa1 de las transacciones financieras que aplicarán los tres órdenes de gobierno para clasificar los entes públicos de su ámbito institucional, y a partir de ésta, cada uno de ellos aplicarán las subclasificaciones que estimen\n1 En varios países de la región, tales como Argentina, Bolivia, Costa Rica, Guatemala, Paraguay, Perú y Venezuela, entre otros, a la definida y establecida legalmente en México como Clasificación Administrativa, se la denomina y conoce como Clasificación Institucional. convenientes, atendiendo a su estructura organizacional y requerimientos de información. unidades administrativas a través de las cuales se realiza la asignación, gestión y rendición de los recursos financieros públicos, así como establecer las bases institucionales y sectoriales para la elaboración y análisis de las estadísticas fiscales, organizadas y agregadas, mediante su integración y consolidación, tal como lo requieren las mejores prácticas y los modelos universales establecidos en la materia. Esta clasificación además permite delimitar con precisión el ámbito de Sector Público de cada orden de gobierno y por ende los alcances de su probable responsabilidad fiscal y cuasi fiscal.\nEn calidad de modelos universales y mejores prácticas internacionales aplicables en materia de clasificación de las unidades institucionales de los gobiernos son reconocidos los criterios, conceptos y métodos que han establecido sobre el particular los organismos multilaterales que se ocuparon de éstos, tales como: la Comunidad Europea\n(CE), la Organización para la Cooperación y el Desarrollo Económicos (OCDE), la\nOrganización de las Naciones Unidas (ONU), el Banco Mundial (BM) y el Fondo\nMonetario Internacional (FMI) y, en el orden nacional, el Instituto Nacional de Estadística y Geografía (INEGI). Los referidos aspectos están básicamente desarrollados en los textos del \"Sistema de Cuentas Nacionales 2008\" (SCN) preparado y editado por las instituciones recién referidas y en los del \"Manual de Estadísticas de las Finanzas\nPúblicas 2001\" (MEFP), publicado por el FMI. En la elaboración de la Clasificación\nAdministrativa, se han utilizado, con el mayor rigor posible, definiciones y aspectos conceptuales y metodológicos establecidos en el SCN y en el MEFP ya referidos.\nEsta Clasificación Administrativa a nivel agregado, muestra la estructura organizativa del Sector Público desde un punto de vista puramente económico, por ello de los alcances institucionales del Presupuesto de Egresos. A nivel analítico, se\nGubernamental (Ley de Contabilidad), en lo que respecta a la identificación de los entes\nEl documento que se está aprobando consta de seis capítulos, que en función de la temática que abarcan, pueden ser agrupados en los siguientes tres grandes segmentos:\nEn el primer segmento, que consta de los Capítulos II y III se señala la base legal la Clasificación Administrativa.\nEn el segundo segmento, constituido exclusivamente por el Capítulo IV, se desarrollan, basados estrictamente en el SCN y en el MEFP, los aspectos teóricos, conceptuales y metodológicos que enmarcan la Clasificación Administrativa de las transacciones financieras públicas.\nPor último en el tercer segmento, constituido por los Capítulos V, VI y VII se exponen aspectos de la organización territorial, política y administrativa de los Estados\nUnidos Mexicanos relacionados con el tema, así como la estructura básica de las cuentas y la correspondiente descripción de la Clasificación Administrativa armonizada a aplicar por sus tres órdenes de gobierno.\nII. BASE LEGAL\nLa Ley General de Contabilidad Gubernamental (Ley de Contabilidad) en su\nTercero Transitorio establece la responsabilidad del CONAC de emitir los clasificadores presupuestarios armonizados para ser utilizados por los tres órdenes de gobierno.\nEn dicho contexto y de acuerdo con lo establecido en los artículos 46, 47 y 48 y en el Cuarto Transitorio de la Ley, los clasificadores presupuestarios armonizados a corresponden a la Clasificación Administrativa, Económica, por Objeto del Gasto y\nFuncional-Programática.\nA la fecha el CONAC ha emitido el Clasificador por Rubro de Ingresos, el\nClasificador por Objeto del Gasto, el Clasificador por Tipo de Gasto y la Clasificación\nFuncional y, en esta oportunidad, se realiza con la Clasificación Administrativa.\nPor su parte el Cuarto Transitorio de la Ley de Contabilidad, establece la administrativa, económica y funcional-programática en los plazos que la misma señala.\nIII. OBJETIVOS\nEntre los principales objetivos de la Clasificación Administrativa, se destacan los siguientes:\n• Delimitar con precisión el Sector Público de cada orden de gobierno, universo a través del cual se podrán aplicar políticas públicas.\n• Distinguir los diferentes sectores, subsectores y unidades institucionales a través de los cuales se realiza la provisión de bienes y servicios a la comunidad y la redistribución del ingreso, así como la inversión pública.\n• Identificar los sectores, subsectores y unidades institucionales a las cuales se realiza la asignación de recursos financieros públicos, mediante el presupuesto.\n• Coadyuvar a establecer la orientación del gasto público en función de la distribución institucional que se realiza de los recursos financieros.\n• Realizar el seguimiento del ejercicio del Presupuesto de Egresos de cada ente público a partir de la realización de registros sistemáticos y normalizados de las respectivas transacciones.\n• Posibilitar la evaluación del desempeño institucional y la determinación de responsabilidades asociadas con la gestión del ente.\n• Determinar y analizar la interacción entre los sectores, subsectores y unidades que la integran.\n• Posibilitar la consolidación automática de las transacciones financieras intra e intergubernamentales y entre los sectores públicos de los distintos órdenes de gobierno.\n• Establecer un sistema de estadísticas fiscales basado en las mejores prácticas sobre la materia, que genere resultados en tiempo real y facilite la toma de medidas correctivas con oportunidad.\nIV. CONTEXTO CONCEPTUAL Y METODOLÓGICO\nLas principales funciones económicas de los gobiernos, pueden señalarse como: con su valor en el mercado ni con su costo de producción o adquisición; la redistribución del ingreso y la riqueza por medio del pago de transferencias corrientes o de capital; la captación de ingresos para financiar dichas actividades, ya sea, a través de impuestos o transferencias obligatorias o voluntarias u otros ingresos provenientes de ventas incidentales de bienes y servicios, intereses o arrendamiento de activos. Un gobierno también puede financiar una parte de sus actividades durante un determinado período, endeudándose dentro de límites que aseguren la sustentabilidad de su deuda.\nAsimismo, debe señalarse que un gobierno puede ejecutar parte sus funciones a través de empresas que le pertenecen o que controla y cuyo propósito es realizar básicamente actividades comerciales. Los gobiernos cumplen sus funciones mediante unidades institucionales que es preciso identificar, clasificar, codificar y agregar de acuerdo con su tipología económica de tal forma que se facilite la consolidación y el análisis económico y fiscal respectivo.\nEn este tenor, tanto el Sistema de Cuentas Nacionales (SCN) como el Manual de\nEstadísticas de las Finanzas Públicas (MEFP), reconocen como componentes básicos de la economía total de un país a las unidades institucionales residentes2\n1. Unidades Institucionales\nEn el contexto anterior, se define que una unidad institucional es una entidad económica que tiene capacidad, por derecho propio, de poseer activos, incurrir en pasivos, de suscribir contratos y de realizar actividades económicas y transacciones con otras entidades públicas o privadas. siguientes:\n• Es propietaria de bienes o activos y tiene facultades para intercambiar su posesión mediante transacciones con otras unidades institucionales.\n2 En varios países de la región a la llamada en México, Clasificación Administrativa se la denomina como Clasificación Institucional.\n• Tiene capacidad de tomar decisiones y realizar actividades económicas de las que es directamente responsable ante la ley.\n• Tiene capacidad para contraer pasivos en nombre propio, de aceptar otras obligaciones o compromisos futuros y de suscribir contratos, en el marco de la normativa vigente.\n• Utiliza un conjunto completo de cuentas contables y generará un balance de activos, pasivos y patrimonio neto, o bien, poder compilar información financiera en un conjunto de cuentas siempre que se le requiera.\n2. Sectores Institucionales\nA su vez, las unidades institucionales residentes se agrupan en cinco sectores institucionales mutuamente excluyentes, de acuerdo con la naturaleza de la actividad económica que realizan.\nLos cinco sectores institucionales, que configuran la economía total del país, son los siguientes:\n• Gobierno General\n• Sociedades / Corporaciones / Empresas No Financieras\n• Sociedades / Corporaciones / Empresas Financieras\n• Instituciones Sin Fines de Lucro que Sirven a los Hogares (ISFL)\n• Hogares\nEl Sector Gobierno General, que comprende principalmente a las unidades gubernamentales centrales, estatales y locales junto con los fondos de seguridad social.\nAdicionalmente, incluye a las ISFL dedicadas a la producción de bienes y servicios no de mercado y controladas por el gobierno o por fondos de seguridad social.\nEl Sector de Sociedades/Corporaciones/Empresas No Financieras3, que\n3En este documento se adopta la denominación de \"sociedades\" tal como lo hace en el SCN. Esta denominación incluye a las \"corporaciones\" por el MEFP y como \"empresas\" en forma genérica. En términos jurídicos, las \"sociedades\" pueden recibir diferentes nombres: sociedades, empresas constituidas en sociedad, empresas públicas, sociedades públicas, sociedades o empresas públicas de responsabilidad limitada, compañías privadas, sociedades anónimas, compañías de responsabilidad limitada, sociedades de responsabilidad limitada, etc. En el sistema algunas entidades jurídicas que son instituciones sin fines de lucro pueden algunas veces considerarse como \"sociedades\". El estatus de una unidad institucional no siempre puede ser inferido por su denominación legal, por lo que es necesario examinar sus objetivos y funciones. En financieros para el mercado4. El sector de las sociedades no financieras se divide, con base en los tipos de unidades institucionales que ejercen control, en dos subsectores mutuamente excluyentes: Subsector de Sociedades No Financieras Públicas y Subsector de Sociedades No Financieras Privadas5\nEl Sector de Sociedades/Corporaciones/Empresas Financieras, que financieros incluyendo servicios de intermediación financiera, de seguros y de fondos de pensiones, así como, las unidades que prestan servicios que facilitan la intermediación financiera. Al igual que el sector anterior y por la misma razón, éste se divide en subsector de sociedades financieras públicas y subsector de sociedades financieras privadas.\nEl Sector de Instituciones Sin Fines de Lucro que Sirven a los Hogares\n(ISFL), está constituido por todas las entidades jurídicas o sociales creadas para producir bienes y servicios, cuyo estatuto jurídico no les permite ser fuente de ingresos de mercado, beneficios u otras ganancias financieras para las unidades que las establecen, controlan o financian, excepto las controladas y financiadas principalmente por el gobierno, que proporcionan bienes y servicios a los hogares en forma no de mercado. El sector de las ISFL no incluye aquellas que venden bienes y servicios a precios económicamente significativos, en este caso, éstas deben tratarse como sociedades. definitiva, el término \"sociedades\" incluye a las sociedades legalmente constituidas de tal forma y a otras unidades institucionales que cumplen con sus características económicas, cualquiera que sea su carácter jurídico, en la medida que produzcan bienes y servicios para el mercado. 4.7.\n4 Para que se le considere productor de mercado, una unidad debe suministrar a otras unidades la totalidad o la mayor parte de su producción a precios económicamente significativos. Los precios económicamente significativos son aquéllos que tienen una incidencia significativa sobre las cantidades que los productores están dispuestos a suministrar y sobre las cantidades que los compradores desean comprar. Estos precios normalmente se obtienen cuando: a. El productor tiene un incentivo para ajustar la oferta con el objetivo de ganar utilidades a largo plazo, o como mínimo, para cubrir el costo de inversión y otros costos; y b. Los consumidores tienen la libertad de comprar o no y realizan su elección con base en el precio que se cobra. SCN 22.28\nEstas condiciones generalmente significan que los precios son económicamente significativos si las ventas cubren la mayoría de los costos del productor (el promedio del valor de los bienes y servicios vendidos sea al menos igual a la mitad de los costos de producción durante un período sostenido de varios años) y los consumidores son libres de escoger si compran o no y qué cantidad comprar sobre la base del precio que se cobra. 22.29\nEs probable que las sociedades que reciben apoyo financiero sustancial del Gobierno o que disfrutan de otros factores que reducen los riesgos como son las garantías gubernamentales, actúen distinto a las empresas que no cuentan con esas ventajas porque sus restricciones presupuestarias son menos rígidas. Un productor de no mercado es un productor que enfrenta una restricción presupuestaria muy poco rígida, de mercado. 22.32\nLa distinción fundamental entre sociedades y gobierno se centra en la forma como se realiza la producción. Las sociedades producen para el mercado y apuntan a vender sus productos a precios económicamente significativos. La producción del Gobierno es de \"no mercado\".\n5Una sectorización muy común consiste en identificar las sociedades financieras y no financieras que son controladas por el Gobierno, denominadas sociedades públicas y aquellas controladas por sector privado. Las controladas por el sector privado, pueden a su vez subsectorizarse en controladas por el sector privado nacional o por el sector extranjero. 4.34\nEl Sector de Hogares, que comprende pequeños grupos de personas que comparten la misma vivienda o residencia durante períodos prolongados de tiempo, que mancomunan, total o parcialmente, sus ingresos y su riqueza y que consumen colectivamente ciertos tipos de bienes y servicios.\nLa división de la economía en sectores, aumenta la utilidad de la información para comportamientos similares.\nTambién, se requiere la desagregación de la economía en sectores y subsectores con el fin de seguir y monitorear grupos particulares de unidades institucionales para propósitos de política pública.\nEl SCN considera que los cinco sectores enunciados ejecutan las tres actividades económicas básicas de un país, a saber:\n• La producción de bienes y servicios, • el consumo final para satisfacer los deseos y necesidades de la población, y\n• la acumulación de capital.\nLas sociedades desarrollan actividades de producción o acumulación –o ambas– pero no realizan por sí mismas gastos de consumo final. El gobierno realiza actividades de producción -pero de un tipo completamente diferente al de las sociedades – así como, de acumulación y consumo final en nombre de la población. Los hogares realizan producción y acumulación. Las ISFL son de naturaleza variada.\nAlgunas se comportan como sociedades, otras forman evidentemente parte del gobierno y otras cumplen actividades similares a las del gobierno, pero independientemente de él. como se organiza y comercializa la producción de las unidades institucionales, es decir, si es de mercado o no de mercado.\n3. Unidades Gubernamentales\nSon unidades institucionales controladas por los gobiernos, que tienen como característica principal, la de constituir entidades económicas con capacidad, por derecho propio, de poseer activos, incurrir en pasivos y realizar actividades económicas y transacciones con otras entidades. riqueza, asumen en dicho marco la responsabilidad de organizar y financiar el suministro de bienes y servicios a la comunidad en su conjunto o a los hogares individualmente en términos no de mercado y tienen la capacidad de captar ingresos mediante la recaudación de impuestos, contribuciones sociales y transferencias de otras unidades institucionales, excepcionalmente por un plazo y monto limitado, pudiendo financiarse también a través de endeudamiento.\nLas unidades gubernamentales son clases únicas de entidades jurídicas creadas por un ordenamiento legal para ejercer una potestad de Poder Ejecutivo, Legislativo y\nJudicial sobre otras unidades institucionales en un área determinada. Por definición, todas las unidades gubernamentales forman parte del sector Gobierno General.\n4. Gobierno General\n4.1. Concepto y Alcances\nEl sector del Gobierno General, cuya función principal es suministrar bienes y servicios no de mercado tanto para los individuos como para el consumo colectivo de la comunidad, está constituido por las siguientes unidades institucionales residentes:\na) Todas las unidades gubernamentales;\nb) todas las ISFL no de mercado controladas y financiadas por unidades gubernamentales (organismos descentralizados no empresariales y no financieros), y\nc) los fondos de seguridad social.\nEn el sector no se incluyen las sociedades públicas, aunque todo su capital sea propiedad de las unidades del gobierno. Tampoco se incluyen las cuasisociedades6 que\n6 Las cuasi sociedades son entidades que si bien no están constituidas como tales, funcionan como si lo estuvieran, producen bienes y servicios de mercado y pueden ser fuente de utilidades u otras ganancias financieras. Para que exista una cuasisociedad pública, el Gobierno debe dotar a la dirección de la empresa de discrecionalidad suficiente en lo que respecta a la gestión del proceso de producción y el uso de sus fondos.\nUna unidad gubernamental, debe tratarse como una cuasi sociedad si se cumplen los siguientes tres criterios: a. la unidad cobra por sus producciones precios económicamente significativos, b. es dirigido y gestionado de manera similar a una sociedad, y son propiedad y están controladas por unidades gubernamentales. En cambio, las tengan la condición de cuasisociedades, siguen formando parte de dichas unidades y, por tanto, han de incluirse en el sector del Gobierno General. normalmente consisten en servicios tales como administración pública, defensa y aplicación de la ley. Por definición, los servicios colectivos siempre se suministran gratuitamente. Los bienes y servicios que típicamente se proveen para consumo individual son los de educación, salud, vivienda, recreación y cultura. Estos pueden proporcionarse en forma gratuita o bien el gobierno puede imponer un cargo por ellos.\nLos bienes y servicios proporcionados a la comunidad en su conjunto o a individuos pueden ser producidos por el propio gobierno o adquiridos por éste a un tercero.\nEl hecho de que los gobiernos prefieran ofrecer a los hogares o a otras unidades no sólo servicios colectivos, sino también muchos bienes y servicios individuales, gratuitamente o a precios económicamente no significativos, no los obliga a producirlos por sí mismos. Aún en el caso de la mayoría de los servicios colectivos, los denominados\n\"bienes públicos\", en los que falla el mercado, los gobiernos sólo están obligados a asumir la responsabilidad de organizar y financiar su producción; no están obligados a producirlos. No obstante, las unidades gubernamentales llevan a cabo habitualmente una amplia gama de actividades productivas que en la práctica abarcan, no sólo los servicios colectivos, sino también otros muchos bienes y servicios individuales.\nCuando una unidad gubernamental decide intervenir en la esfera de la producción, cuenta con tres opciones:\na) Crear una sociedad pública cuya política, incluida la determinación de los precios y de la inversión, esté en condiciones de controlar;\nb) crear una ISFL controlada y financiada, totalmente o en su mayor parte, por ella, y\nc) producir los bienes y servicios por sí misma en un establecimiento del que es gubernamental. c. dispone de un conjunto completo de cuentas que permiten identificar y medir por separado sus excedentes de explotación, sus ahorros, sus activos y pasivos, etc.\nTales cuasi sociedades se tratan como unidades institucionales separadas de las unidades del Gobierno que son sus propietarias. Se clasifican, sectorizan y subsectorizan de la misma manera que las sociedades públicas.\n4.2. Las Instituciones Sin Fines de Lucro que sirven a los hogares controladas por el Gobierno General\nLas Instituciones Sin Fines de Lucro (ISFL) no de mercado que son controladas y gubernamentales desde un punto de vista jurídico, pero se considera que llevan adelante las políticas gubernamentales y son efectivamente parte del gobierno. Los gobiernos pueden recurrir a Instituciones Sin Fines de Lucro en lugar de organismos gubernamentales para llevar adelante determinadas políticas gubernamentales debido a que las ISFL pueden ser vistas como independientes, objetivas y no sujetas a determinadas presiones.\nPor ejemplo, las actividades de investigación y desarrollo y el establecimiento y mantenimiento de normas en campos como la salud, la seguridad, el medio ambiente y la educación son esferas en que las ISFL pueden ser más efectivas que los órganos gubernamentales. Una unidad del gobierno controla a una ISFL no de mercado cuando tiene la capacidad de determinar la política o el programa general de la ISFL.\nPara determinar si una ISFL es controlada por el gobierno, deben considerarse los siguientes cinco indicadores:\na) El nombramiento de los directivos compete a las unidades gubernamentales;\nb) Otras disposiciones del reglamento que prevean adicionalmente del nombramiento de los directivos, que las unidades gubernamentales puedan determinar aspectos significativos de la política general o el programa de la ISFL;\nc) Arreglos contractuales irreversibles que permitan al gobierno determinar aspectos claves de la política general o programática de la ISFL;\nd) El grado de financiamiento puede determinar que una ISFL sea controlada por el gobierno,\ne) En caso de existir un arreglo contractual por el cual el riesgo institucional por una unidad gubernamental. casos, pero en otros, la indicación de control puede derivarse de la existencia simultánea de un número de indicadores separados.\n4.3. Fondos de Seguridad Social cubren a la comunidad en su conjunto, o a grandes sectores de la misma y que son impuestos y controlados por unidades del gobierno. Los sistemas abarcan una gran variedad de programas y ofrecen prestaciones en dinero o en especie para la vejez, invalidez, cesantía o muerte, supervivencia, enfermedad y maternidad, por accidentes de trabajo, por desempleo, de ayuda familiar, de asistencia sanitaria, etc. No existe necesariamente una relación entre la cuantía de la contribución individual y los beneficios que pueda recibir.\nUn fondo de seguridad social es un tipo particular de unidad gubernamental que se ocupa de la operación de uno o más sistemas de seguridad social. Los fondos de seguridad social se organizan por separado de las demás actividades de las unidades del gobierno y deben reunir los requisitos generales de toda unidad institucional, es decir, mantener sus activos y pasivos separados de estas últimas y realizar transacciones financieras en nombre propio.\nLas cantidades recaudadas y pagadas por contribuciones y prestaciones para la seguridad social pueden modificarse deliberadamente con el fin de alcanzar determinados objetivos de la política del gobierno, que no tengan relación directa con el concepto de la seguridad social como sistema destinado a ofrecer prestaciones sociales a los miembros de la comunidad. Pueden aumentarse o disminuirse, por ejemplo, con el fin de influir en el nivel de la demanda agregada de la economía. No obstante, en tanto se mantengan como fondos constituidos por separado, han de ser tratados, en el\nSistema, como unidades institucionales diferentes.\n4.4. Niveles del Gobierno General\nSe prevén tres niveles de gobierno: Central, Estatal, y Local. No todos los países tienen los tres niveles, en algunos sólo hay un gobierno central y gobierno locales. En los comúnmente se presentan los tres niveles referidos. Además, en los distintos niveles de gobierno, existen fondos de seguridad social y su rol en la política fiscal puede aconsejar separado del sector Gobierno General. a dos niveles de éste. La decisión en cuanto a la clasificación puede ser especialmente difícil si el organismo tiene su propia fuente de financiamiento, por ejemplo, impuestos asignados para tal fin. En general, las unidades del Gobierno General sujetas a control financiamiento o el control de sus operaciones, pero no pueden establecerse reglas precisas que puedan aplicarse a todas las situaciones posibles.\nSimilarmente, la ISFL puede estar controlada o financiada principalmente por dos o más unidades gubernamentales que pertenezcan a diferentes niveles de gobierno. Por ejemplo, una unidad del Gobierno Estatal podría tener el derecho a designar a la mayoría de los directivos de una ISFL, pero el financiamiento podría ser suministrado principalmente por el Gobierno Central. Las unidades del Gobierno General sujetas a control por dos niveles de gobierno deberían clasificarse en el nivel de gobierno que predomina en el financiamiento o el control de sus operaciones, pero no pueden establecerse reglas precisas que puedan aplicarse a todos los casos posibles.\nA continuación, se definen los niveles de gobierno aplicando los criterios establecidos en los modelos macroeconómicos citados, mismos que se aplican independientemente del tratamiento específico de los fondos de seguridad social.\n4.4.1. Gobierno Central\nEl subsector del Gobierno Central está constituido por la unidad o unidades institucionales que lo conforman más las ISFL controladas y financiadas principalmente por él. un subsector amplio y complejo. Por lo general, está constituido por los Poderes\nEjecutivo, Legislativo y Judicial y los Órganos Autónomos de origen constitucional, cada uno de los cuales es una unidad institucional independiente (entes públicos). A su vez, el administrativos desconcentrados los que, en conjunto, conforman una sola unidad institucional (ente público). Las dependencias pueden ser responsables de montos de gastos importantes dentro del marco del presupuesto general del gobierno, pero no son, a menudo, unidades institucionales separadas, con capacidad para ser propietarias de activos, contraer pasivos, realizar operaciones, etc., en nombre propio, es decir, con independencia del Gobierno Central en conjunto. En otros países existen unidades\nGobierno Central, pero para ello tienen personalidad jurídica propia, autonomía suficiente y las demás características que se identificaron para constituir tal agregado.\nLas características básicas del Gobierno Central de un país son:\n• Su autoridad política se extiende a todo el territorio del país;\n• tiene atribuciones para aplicar impuestos sobre todas las unidades institucionales residentes y sobre las unidades no residentes que realizan actividades económicas dentro del país;\n• tiene la autoridad para incurrir en pasivos mediante la obtención de empréstitos por cuenta propia, dentro de límites marcados por la sustentabilidad de la deuda;\n• suele encargarse de prestar servicios colectivos en beneficio de la comunidad en conjunto, tales como la defensa nacional, las relaciones con otros países, la seguridad pública;\n• es responsable del funcionamiento eficiente del sistema socioeconómico del país mediante la adopción de las disposiciones legales y reglamentarias apropiadas;\n• puede incurrir en gastos para la prestación de servicios, como la educación o la salud, fundamentalmente en beneficio de hogares individuales, y\n• puede realizar transferencias a otras unidades institucionales, incluidos otros niveles de gobierno.\nLas unidades institucionales del Gobierno General Central diferentes de la unidad gubernamental central, tales como las ISFL, deben tener capacidad de poseer sus propios activos, generar fondos o recibir transferencias e incurrir en obligaciones por ingresos generados conforme a sus propias políticas. debido a la función especial que éste desempeña en el análisis económico y monetario.\nPor lo general, es a nivel del Gobierno Central exclusivamente que un órgano con económicos de alcance nacional. Otros niveles de gobierno no tienen por objetivo políticas económicas nacionales.\n4.4.2. Gobierno Estatal\nUn estado o una región, es la mayor zona geográfica en la que suele dividirse un país con fines políticos o administrativos en los países de organización federal. El subsector del Gobierno Estatal está constituido por los Poderes Ejecutivo, Legislativo y\nJudicial, los Órganos Autónomos creados por las respectivas constituciones y las ISFL controladas por ellos. Cada poder, cada órgano autónomo y cada ISFL conforman una unidad institucional (ente público). Son unidades institucionales cuya potestad fiscal, legislativa, judicial y ejecutiva se extiende únicamente al territorio del Estado pero no se extiende a otros estados. Los Gobiernos Estatales desempeñan algunas de las funciones de gobierno en un nivel inferior al del Gobierno Central y superior al de las unidades institucionales de los Gobiernos Locales.\nNormalmente, en una organización federal, el Gobierno Estatal tiene la autoridad política para aplicar impuestos sobre las unidades institucionales que son residentes o que realizan actividades económicas en el ámbito de su competencia. Para que una entidad estatal sea reconocida como unidad del gobierno debe poder poseer sus propios activos, recaudar fondos e incurrir en obligaciones por cuenta propia y también debe tener derecho a utilizar o asignar por lo menos una parte de los impuestos u otros ingresos recaudados conforme a sus propias políticas. Sin embargo, la entidad puede recibir transferencias del Gobierno Central que pueden estar asignadas o no a algún fin específico.\nUn Gobierno Estatal también debe tener atribuciones para nombrar a sus propios funcionarios, independientemente de cualquier control administrativo externo. En cambio, si una unidad estatal depende completamente de fondos provenientes del Gobierno\nCentral y éste dicta la forma en que han de gastarse dichos fondos a escala regional, institucional separada.\nSi existe un Gobierno Estatal, sus dependencias principales constituirán una sola unidad institucional, de manera similar a la unidad básica del Gobierno Central. Pueden existir órganos que realicen actividades bajo su autoridad, pero tienen personalidad jurídica propia y autonomía suficiente como para constituir otras unidades institucionales.\nAsimismo, pueden existir unidades institucionales cuya autoridad se extienda a dos o más estados, pero que deben rendir cuentas ante los gobiernos estatales respectivos.\n4.4.3. Gobierno Local más pequeñas en las que puede dividirse un país con fines políticos o administrativos. El condición de unidades institucionales separadas, más las ISFL controladas y financiadas principalmente por ellos. En principio, las unidades que integran el subsector son unidades institucionales cuya potestad fiscal, legislativa y ejecutiva se extiende a las zonas geográficas de menor dimensión establecidas a efectos administrativos y políticos.\nEl ámbito de su autoridad es, generalmente, mucho menor que el del gobierno central o de los estatales y pueden tener o no potestad fiscal sobre las unidades institucionales residentes en sus zonas. Suelen depender en gran parte de transferencias de niveles de gobierno superiores y también pueden desempeñar en cierta medida funciones de agente del Gobierno Central o Estatal. El hecho de que puedan actuar, hasta cierto punto, como agentes de los gobiernos centrales o estatales no les impide ser consideradas como unidades institucionales separadas.\nPara que los gobiernos locales sean consideradas como unidades institucionales han de tener derecho a ser propietarias de activos, a recaudar algunos fondos por iniciativa propia y a contraer pasivos en nombre propio dentro de determinados límites; análogamente, tienen que disfrutar de alguna discrecionalidad sobre la forma de gastar los fondos recaudados o que reciban mediante transferencias. Igualmente, deben tener capacidad para nombrar a sus propios funcionarios con independencia de cualquier control administrativo externo.\nLos Gobiernos Locales son las unidades gubernamentales que están más en de bienes y servicios a los residentes locales, algunos de los cuales se financian mediante transferencias de niveles de gobierno superiores. En lo que se refiere a la producción de bienes y servicios por las unidades de los gobiernos locales, su centrales y estatales.\nEntre las funciones más típicas de los gobiernos locales cabe señalar:\na) Los establecimientos educativos en que la matrícula que pagan los usuarios representa una pequeña proporción de los costos sufragados por el Gobierno Local;\nb) los hospitales y establecimientos de bienestar social, como los jardines de niños, las guarderías y los asilos;\nc) los establecimientos de salubridad pública y entidades relacionadas, como los sistemas de recolección y disposición de basura, los rastros, los cementerios y los crematorios, y\nd) los locales culturales, de esparcimiento y deportivos, como los teatros, las salas de conciertos, los auditorios de música, los museos, las galerías de arte, las bibliotecas, los parques y los espacios abiertos.\nLos gobiernos locales, pueden a su vez, abarcar una gran variedad de unidades del gobierno, como municipios, ciudades, pueblos, delegaciones, etc.\nLas unidades del gobierno que prestan servicios a un Gobierno Estatal y a uno o más gobiernos locales se incluirán en el nivel de gobierno que predomina en sus operaciones y finanzas.\n4.5. Métodos de Subsectorización del Gobierno General\nEn los sistemas de cuentas macroeconómicas referidas se presentan dos métodos para determinar los subsectores del Gobierno General. La diferencia entre ambos es el resultado de aplicar distintos tratamientos a los fondos de seguridad social.\nEn el primer método se presenta a los Fondos de Seguridad Social como un subsector del Gobierno General en forma independiente de los niveles de gobierno del respectivo país. En el segundo método se presentan como parte del nivel de gobierno correspondiente, al igual que las ISFL.\nLa decisión sobre cuál de ellos es el más adecuado para un determinado país no puede tomarse a priori. Depende de la importancia de los fondos de seguridad social, así como, del grado de independencia en la gestión que tengan en relación con las unidades gubernamentales con las que se hayan asociado. Si la gestión de los fondos de la política económica general del gobierno, de modo que las contribuciones y las prestaciones se ajustan deliberadamente a los intereses de la política económica, resulta difícil establecer, a nivel conceptual una distinción clara entre la gestión de la seguridad social y otras funciones económicas del gobierno. Alternativamente, en algunos países los fondos de seguridad social son de carácter muy rudimentario. En ambas subsector separado en el mismo nivel que los gobiernos central, estatal y local, por lo cada uno de los niveles considerados.\n5. Sociedades\nComo ya se indicó, las sociedades son unidades institucionales que se dedican a la producción para el mercado. Las cuasisociedades que no están constituidas como sociedades, pero que funcionan como si fueran tales, y se incluyen en las mismas. Las\nISFL de mercado también se clasifican como sociedades.\nSegún la índole de su actividad primaria y a efectos del procesamiento y análisis de la información económica y financiera, a las sociedades se les clasifica en dos grandes grupos o subsectores, sociedades no financieras y sociedades financieras y, a su vez a éstas últimas, se las desagrega en Banco Central, sociedades financieras monetarias y sociedades financieras no monetarias.\nLas sociedades pueden estar controladas por el sector privado o por el sector público y, en función de ello a las primeras se la denomina como sociedades privadas y a las segundas como sociedades públicas7\n7 7 CONTROL GUBERNAMENTAL DE LAS SOCIEDADES\nUna sociedad es una sociedad pública si una unidad del Gobierno, otra sociedad pública, o alguna combinación de unidades gubernamentales y sociedades públicas controla la entidad, siendo el control definido como la capacidad de determinar la política general de la sociedad. La expresión \"política general de la sociedad\" debe entenderse en su más amplio sentido y significa establecer las políticas claves en materia financiera y operativa en relación con los objetivos estratégicos de la sociedad como productor de mercado. 4.77\nYa que el Gobierno ejerce poderes soberanos a través de la legislación, las regulaciones, órdenes y similares, hay que ser cuidadosos para determinar si el ejercicio de tales poderes conlleva la determinación de la política general de una determinada empresa y por consiguiente el control de la sociedad. Las leyes y regulaciones aplicables a todas las unidades de una clase determinada o a industrias particulares no deben considerarse como muestras de control sobre estas unidades. 4.78\nLa capacidad para determinar la política general de una sociedad no incluye necesariamente el control directo de las actividades u operaciones cotidianas de una sociedad particular. Los directivos de tales sociedades deberían estar en condiciones de ocuparse de su administración de forma consistente con base en los objetivos generales de la empresa en cuestión. 4.79\nYa que los mecanismos para controlar las sociedades pueden variar considerablemente, no es deseable ni posible establecer una lista definitiva de los factores a tomar en cuenta. Sin embargo, los indicadores más importantes y más probables a considerar son los ocho siguientes: a. Propiedad de la mayoría de los votantes activos. b. Control del directorio o de otro cuerpo directivo. c. Control del nombramiento y remoción del personal clave. d. Control de los comités claves de la entidad. e. Acciones preferentes y opciones. El Gobierno puede poseer una \"acción preferente\", particularmente en las sociedades que han sido privatizadas. En ciertos casos, estas acciones conceden al Gobierno derechos residuales para proteger los intereses del público; g. Control por un cliente dominante. h. Control asociado con las garantías o préstamos del Gobierno. 4.80.\nLas sociedades públicas, a diferencia de las unidades gubernamentales, pueden o controlan. En algunos casos, la sociedad emite títulos de participación en el capital, de modo que la ganancia o pérdida financiera se asigna claramente a su(s) propietario(s).\nEn otros casos, no se emiten títulos de participación en el capital pero es evidente que financieramente responsable de ella. En tales casos, se supone que la unidad gubernamental responsable es implícitamente propietaria de los títulos de participación en el capital emitidos.\nLas sociedades públicas pueden también realizar operaciones del gobierno bajo mandato de las unidades del gobierno a las que pertenecen. Estas actividades pueden revestir varias formas. Por ejemplo, una sociedad pública puede realizar transacciones específicas, como otorgar un préstamo a particulares a una tasa de interés inferior a la del mercado o vender energía eléctrica a algunos clientes a precios reducidos. A nivel más general, una sociedad pública puede llevar a cabo actividades de política fiscal empleando a más funcionarios de los requeridos, comprando insumos en exceso, pagando por encima de los precios de mercado por los insumos o vendiendo una proporción importante de su producción a precios inferiores a los precios de mercado que regirían si únicamente los productores privados realizaran estas transacciones.\nAunque las sociedades públicas se dedican principalmente a actividades de mercado, las razones de su existencia son numerosas: por ejemplo, pueden existir para servir de instrumento de la política pública (o fiscal), generar utilidades para el Gobierno\nGeneral, proteger recursos críticos, estimular la competencia si las barreras de ingreso al mercado son fuertes y proporcionar servicios básicos si los costos son prohibitivos. Las numerosas y tienen un impacto fiscal importante. Por ejemplo:\n• Muchas sociedades públicas participan en operaciones cuasifiscales (es decir, controlan), además de las actividades de mercado que llevan a cabo normalmente como productores. Si estas actividades cuasifiscales son extensas, las estadísticas sobre el la formulación de la política fiscal. Además, como las actividades cuasifiscales suelen tener un efecto redistributivo, es importante que estén sujetas a escrutinio público.\n• A menudo, el endeudamiento de las sociedades públicas es una fuente de pasivos contingentes para el gobierno; por ejemplo, cuando una sociedad pública toma un préstamo en el extranjero y el préstamo está garantizado por el gobierno.\n• Muchas transacciones (subsidios, transferencias de capital, impuestos, acciones y otras participaciones de capital, dividendos y préstamos) entre unidades del gobierno y sociedades públicas, o entre ellas, son significativas. Esas transacciones pueden ser difíciles de caracterizar, ya que la designación jurídica de un flujo no refleja necesariamente su esencia económica. Por ejemplo, las transacciones consideradas jurídicamente como préstamos muchas veces son en realidad subsidios.\n• Las cuentas de las sociedades públicas muestran el origen de las variaciones del patrimonio neto, que influyen en las acciones o las participaciones de capital (activos financieros) que el Gobierno General tiene en el capital de las sociedades públicas.\n• De los estados financieros de las sociedades públicas se pueden derivar relaciones e indicadores fundamentales con respecto al sector y a la totalidad de la economía. Esta información es útil para el análisis de la sostenibilidad y otros aspectos del análisis fiscal.\n• Las sociedades públicas también pueden revestir importancia para el gobierno debido a los efectos que su magnitud o posición estratégica puede tener en los objetivos macroeconómicos, como el crédito bancario, la demanda agregada, el endeudamiento en el extranjero y la balanza de pagos.\n• Muchas sociedades públicas también pueden representar una inversión cuantiosa de los recursos nacionales, a un costo de oportunidad considerable. Como los recursos provienen principalmente del gobierno, y no de inversionistas privados, estas rentabilidad del capital que generalmente realizan los mercados financieros.\n• Las sociedades públicas no sólo tienen un impacto macroeconómico, sino que también pueden ser fuente de riesgo fiscal. Por eso es particularmente importante que el gobierno reciba con regularidad datos actualizados sobre sus actividades, para poder supervisarlas debidamente. Los datos deben estar agrupados según la índole de las actividades de la corporación pública en cuestión, es decir, según si es financiera o no financiera.\n5.1. Sociedades Públicas No Financieras unidades gubernamentales. La cobertura de las sociedades públicas comprende entidades con distinta naturaleza jurídico-administrativa, como las cuasisociedades y las\nISFL pertenecientes a unidades gubernamentales pero que, al ser analizadas desde el punto de vista de su actividad productiva y relación con el mercado, cumplen con los criterios del SCN para clasificarse como tales.\nLa función principal de este sector es la de producir bienes y servicios no financieros para el mercado. La producción de estos entes se realiza generalmente en condiciones técnicas y de organización que son semejantes a las de las sociedades privadas y financian sus actividades con recursos que provienen principalmente de la venta de sus mercancías; en algunos casos no se alcanza a cubrir los costos de producción en los que se incurre y por ello pueden recibir subsidios y/o subvenciones del gobierno. Estas características hacen que las sociedades públicas además de su carácter de unidades económicas tengan la calidad de instrumentos de política económica.\nLa gama de los bienes y servicios a producir por las sociedades públicas no financieras es muy amplia y depende fundamentalmente de las políticas públicas de cada país sobre la materia.\n5.2. Sociedades Públicas Financieras\nLas Sociedades Públicas Financieras, son sociedades residentes controladas por siguientes subsectores: Banco Central, otras sociedades públicas de depósito (o monetarias) y sociedades financieras no monetarias. A su vez, éstas últimas se clasifican en: otros intermediarios financieros públicos, auxiliares financieros y sociedades públicas de seguros y de fondos de pensiones financieras denominadas: intermediarios financieros, auxiliares financieros y otras sociedades financieras. transacciones financieras en el mercado. Incluyen las sociedades de seguros y los fondos de pensiones. al servicio de los mercados financieros, pero que no asumen la propiedad de los activos y pasivos financieros que administran.\nLas otras sociedades financieras son las unidades institucionales que prestan servicios financieros, donde la mayoría de sus activos o pasivos no están disponibles en los mercados financieros abiertos.\nEl sector de las sociedades financieras se subdividen en los siguientes nueve subsectores, teniendo en cuenta su actividad en el mercado y la liquidez de sus pasivos.\n5.2.1 Banco Central\nEl Banco Central es la institución financiera nacional que ejerce el control sobre los aspectos claves del sistema financiero. En general, los siguientes intermediarios financieros se clasifican en este subsector: a. El Banco Central de cada país, incluido el caso donde es parte de un sistema de bancos centrales; b. Las juntas monetarias o autoridades monetarias independientes que emiten moneda nacional y que se encargan de las reservas en moneda extranjera; c. Las agencias monetarias centrales esencialmente de origen público – por ejemplo, agencias que manejan las reservas internacionales o que emiten billetes de banco y monedas – que llevan un conjunto completo de cuentas pero que no son clasificadas como parte del Gobierno Central. Las autoridades de supervisión son unidades institucionales separadas y no forman parte del Banco Central, por lo que se consideran auxiliares financieros.\nMientras constituya una unidad institucional separada, el Banco Central siempre se asigna al sector de las sociedades financieras, aún si es primordialmente un productor no de mercado.\n5.2.2 Las Sociedades Públicas de Depósitos, excepto el Banco Central\nSon sociedades públicas8 que tienen como actividad principal la intermediación financiera. Con este fin, estas sociedades contraen pasivos en forma de depósitos o instrumentos financieros que son sustitutos cercanos de los depósitos (por ejemplo, certificados de depósito a corto plazo). Los pasivos de estas sociedades se incluyen en la definición del dinero en sentido amplio.\n5.2.3 Fondos del Mercado Monetario (FMM)\nLos Fondos del Mercado Monetario (FMM) son sistemas de inversión colectiva que captan fondos mediante la emisión de acciones o unidades del público. Los recursos captados se invierten principalmente en instrumentos del mercado monetario, participaciones/unidades de los FMM, instrumentos de deuda transferibles con un vencimiento residual inferior o igual a un año, depósitos bancarios e instrumentos que persiguen una tasa de retorno cercana a la tasa de interés de los instrumentos del mercado monetario. Las acciones de los FMM pueden transferirse por cheques u otros medios de pago directo a terceros. Dada la naturaleza de los instrumentos de este sistema de inversión, sus acciones o unidades pueden verse como sustitutos próximos de los depósitos.\n5.2.4 Fondos de Inversión Distintos a los del Mercado Monetario\nLos fondos de inversión distintos a los del mercado monetario son sistemas de inversión colectiva que captan fondos a través de la emisión de acciones o unidades del público. Los recursos captados se invierten predominantemente en activos financieros, distintos de los de corto plazo, y en activos no financieros (usualmente inmuebles). Las depósitos ni transferibles por medio de cheques o pagos directos de terceros.\n8 En general, los siguientes intermediarios financieros se clasifican dentro de este subsector: a. Los bancos comerciales, los bancos \"universales\", los bancos de \"propósitos múltiples\"; b. Las cajas de ahorro – incluidos las cajas de ahorro y las asociaciones de ahorro y préstamo; c. Las instituciones de giro postal, los bancos postales y los bancos de giro; d. Los bancos de crédito rural y los bancos de crédito agrícola; e. Los bancos de crédito cooperativo y las uniones de crédito; y f. Los bancos especializados u otras sociedades financieras que aceptan depósitos o emiten sustitutos próximos de los depósitos.\n5.2.5 Otros intermediarios financieros excepto sociedades de seguros y fondos de pensiones dinero legal, ni depósitos ni sustitutos cercanos de los depósitos, con el propósito de adquirir activos financieros mediante transacciones financieras en el mercado9. Es característico de los intermediarios financieros que sus transacciones en ambos lados del balance sean realizadas en mercados abiertos.\n5.2.6 Auxiliares financieros\nLos auxiliares financieros son sociedades financieras de dicadas principalmente a realizar actividades relacionadas con transacciones de activos y pasivos financieros o que proveen un marco regulatorio para estas transacciones, pero en circunstancias que no involucran que el auxiliar asuma la propiedad de los activos y pasivos financieros objetos de la transacción.10\n5.2.7 Instituciones Financieras Cautivas y Prestamistas de Dinero\n9 En general, se clasifican dentro de este subsector los siguientes intermediarios financieros: a. Sociedades financieras dedicadas a titularización de activos; b. Operadores de valores y derivados (que operan por cuenta propia) c. Sociedades financieras dedicadas a prestar, incluidos los asociados financieros de comerciantes minoristas, quienes pueden ser responsables de arrendamiento financiero y financiamientos tanto de particulares como comerciales; d. Organizaciones centrales de compensación. e. Sociedades financieras especializadas 4.110\n10Se clasifican dentro de este subsector los siguientes auxiliares financieros: a. Corredores de seguros, arbitradores de salvamento y reclamos, consultores de seguros y pensiones; b. Corredores de préstamos, corredores de valores, asesores de inversión, etc.; c. Sociedades de flotación que administran la emisión de valores; d. Sociedades cuya función principal es garantizar, por endoso, facturas e instrumentos similares; e. Sociedades que desarrollan instrumentos derivados y de cobertura, tales como operaciones de pases (swaps), opciones y futuros (sin expedirlos), f. Sociedades que proveen infraestructura para los mercados financieros; g. Administradores de fondos de pensiones, fondos mutuos, etc. (excluyendo los fondos que administran); h. Sociedades que proveen bolsas de valores y de seguros; i. Oficinas de cambio de divisas; j. Instituciones sin fines de lucro reconocidas como jurídicamente independientes al servicio de las sociedades financieras; k. Oficina principal de sociedades financieras dedicada principalmente a controlar sociedades financieras o grupos de sociedades financieras, sin estar involucrada por su propia cuenta en una actividad de sociedad financiera. l. Autoridades centrales de supervisión de los intermediarios y mercados financieros cuando se trata de unidades institucionales separadas.\n4.112\nSon unidades institucionales que proveen servicios financieros, en donde la mayoría de sus activos o pasivos no figuran en los mercados financieros abiertos11. En partir de recursos\n5.2.8 Sociedades de Seguros\nLas sociedades de seguros son empresas constituidas en sociedad, mutualidades y otras entidades, cuya función principal es ofrecer seguros de vida, accidentes, enfermedad, incendio o de otro tipo para las unidades institucionales individuales o a grupos de unidades o servicios de reaseguro a otras sociedades de seguros. Se incluyen las sociedades cautivas, es decir, compañías de seguros que sólo sirve a sus propietarios. Seguros de depósitos, emisores de garantía de depósitos y otros emisores de garantías estandarizadas que son entidades separadas y actúan como aseguradores recibiendo primas y que constituyen reservas, se clasifican como sociedades de seguros.\n5.2.9 Fondos de Pensiones\nLos pasivos de pensiones aparecen cuando un empleador o el gobierno obligan o estimulan a miembros de los hogares a participar en un sistema de seguros sociales que proporcionará un ingreso al momento del retiro. Los sistemas de seguros sociales pueden ser organizados por los empleadores o por el gobierno, pueden ser organizados por sociedades de seguros en nombre de los asalariados o por unidades institucionales separadas constituidas para poseer y administrar los activos que se usarán para conocer y distribuir las pensiones. El subsector de los fondos de pensiones está constituido solamente por aquellos fondos de pensiones de los seguros sociales que son unidades institucionales separadas de las unidades que los crean.\n11 En general, se clasifican dentro de este subsector las siguientes sociedades financieras: a. Unidades que son entidades jurídicas tales como fideicomisos, fondos, cuentas de agencias o compañías de fachada. b. Sociedades de cartera que solo poseen los activos (o que poseen suficientes acciones que les permiten controlar el capital social) de un grupo de sociedades filiales y cuya principal actividad es poseer el grupo sin proveer ningún otro servicio a las empresas en las que poseen el capital, es decir, no administran ni realizan la gestión de otras unidades. c. EPEs o \"conduits\" que califican como unidades institucionales y captan fondos en mercados abiertos para ser utilizados por la sociedad matriz. d. Unidades que proveen servicios financieros únicamente con sus propios recursos, o fondos provenientes de un solo origen a un rango de clientes e incurre en los riesgos financieros asociados con la cesación de pagos del deudor, incluyendo\n- Prestamistas de dinero.\n- Sociedades dedicadas a prestar – por ejemplo préstamos a estudiantes, prestamos para el comercio exterior – de fondos recibidos de un solo origen tales como unidades del gobierno o instituciones sin fines de lucro.\n- Casas de empeño dedicadas predominantemente a prestar. 4.114 unidades del Gobierno General se les califica como sociedades públicas financieras.\n6.- Sector Público\nEl \"Sector Público\", en términos económicos, abarca todas las unidades institucionales residentes controladas directa o indirectamente por unidades del gobierno, es decir, todas las unidades del sector Gobierno General y las sociedades públicas residentes. El gráfico siguiente muestra esquemáticamente el ámbito del Sector Público de acuerdo con los cinco sectores institucionales del total de la economía ya mencionados.\n28\nFuentes:\n-System of National Accounts 2008.\nFigure 22.1: The public sector and its relation to institutional sectors. Traducción Cepal.\n-Manual de estadísticas de finanzas públicas 2001. Material suplementario. Consolidación de las estadísticas del sector público no financiero. públicas no financieras y sociedades públicas financieras, tal como fueron categorizadas en el punto anterior, puede crearse distintas clasificaciones del Sector Público, tales como las siguientes:\nSociedades Públicas No Financieras.\nSociedades Públicas No Monetarias.\n• Sector Público Total: que incluye al sector Gobierno General, a las Sociedades ejecutar por sus propias estructuras organizativas. Esta delimitación, con relación a este propósito, tiene que ver con la capacidad de los gobiernos para controlar a las instituciones productoras de bienes y servicios. En este contexto el control, como se ha visto, se interpreta como la capacidad de determinar la política general de las instituciones gubernamentales, es decir, de las principales políticas operativas, de inversión y financieras.\nUn indicador primario de cómo rinde cuentas el gobierno ante la ciudadanía, es la formulación e implementación de la política fiscal. Sus resultados (y consecuencias) aparecen reflejados en las estadísticas del Sector Público, mismas que, proporcionan información sobre el total de recursos que controla el gobierno y sobre el uso que les da.\nEl sistema del MEFP 2001 se puede aplicar para analizar y evaluar las actividades tanto de las corporaciones públicas como del Sector Público (o uno de sus subsectores).\nEl delimitar con precisión el Sector Público de un país tiene también por finalidad medir el impacto macroeconómico del conjunto del gobierno y sus sociedades públicas y todas las fuentes de riesgo fiscal potencial en el Sector Público.\nUn indicador útil del impacto del Sector Público no financiero en la economía son las estadísticas sobre sus transacciones (y saldos) de activos financieros y pasivos, es decir, sus actividades de financiamiento y su patrimonio financiero neto. Revisten por el Banco Central y otras sociedades públicas monetarias, principalmente porque ese públicas financieras. las estadísticas financieras utilizadas en la formulación y el análisis de la política fiscal.\nSin embargo, cabe señalar que al excluir las sociedades públicas financieras del Sector\nPúblico en las mediciones descritas en este documento, se excluyen también los ahorros y las inversiones de estas instituciones. del sector Gobierno General promueve la transparencia y rendición de cuentas, ayuda a detectar problemas incipientes en Sector Público.\nV. ASPECTOS GENERALES DE LA ORGANIZACIÓN TERRITORIAL,\nPOLÍTICA Y ADMINISTRATIVA DE MÉXICO\nEs este inciso se identifican las principales disposiciones constitucionales que tienen que ver con la organización territorial, política y administrativa de los Estados\nUnidos Mexicanos, así como, otras que enmarcan la Clasificación Administrativa de las transacciones financieras públicas.\nDe acuerdo con el artículo 40 de la Constitución Política de los Estados Unidos\nMexicanos (CPEUM), la forma de organización política y territorial de México es la de una \"República representativa, democrática, federal, compuesta de Estados libres y soberanos en todo lo concerniente a su régimen interior, unidos en una Federación\". La organización institucional de la Unión se basa en un supremo poder que se divide para su ejercicio en los Poderes Legislativo, Ejecutivo y Judicial, así como en Órganos\nAutónomos constitucionales. A su vez, el artículo 115 de la CPEUM establece que \"los\nEstados adoptarán, para su régimen interior, la forma de gobierno republicano, representativo, popular, teniendo como base de su división territorial y de su organización política y administrativa el Municipio Libre\". La organización institucional básica de la\nUnión, se repite en cada uno de los estados de acuerdo con lo que establecen sus respectivas Constituciones locales.\nLos Estados que integran la Federación son: Aguascalientes, Baja California, Baja California Sur, Campeche, Coahuila, Colima, Chiapas, Chihuahua, Durango, Guanajuato, Guerrero, Hidalgo, Jalisco, México, Michoacán, Morelos, Nayarit, Nuevo\nLeón, Oaxaca, Puebla, Querétaro, Quintana Roo, San Luis Potosí, Sinaloa, Sonora, Tabasco, Tamaulipas, Tlaxcala, Veracruz, Yucatán, Zacatecas y el Distrito Federal. Los estados de la Federación y el Distrito Federal, conforman las entidades federativas. de participaciones, aportaciones o convenios que pueden o no estar asignadas a algún fin específico.\nOrgánicas Municipales respectivas, están investidos de personalidad jurídica y manejan su patrimonio conforme a la Ley.\nCada municipio será gobernado por un Ayuntamiento integrado por un Presidente\nMunicipal y los síndicos y regidores que, en cada caso, la Ley determine.\nLos Municipios reciben transferencias del Gobierno Central y de los respectivos gobiernos estatales en forma de participaciones, aportaciones o convenios que pueden o no estar asignadas a algún fin específico. Conforme a las citadas disposiciones, y a lo establecido en la Ley de Contabilidad sobre el ámbito y alcances de la misma y, de acuerdo con los conceptos y criterios metodológicos vistos en el anteriormente, el\nGobierno General de México, como categoría económica, está compuesto por los siguientes tres niveles de Gobierno:\n• Gobierno General Central\n• Gobierno General Estatal\n• Gobierno General Municipal\nEn el caso del la Administración Pública Federal su organización básica está regida por el artículo 90 de la CPEUM, la Ley Orgánica de la Administración Pública\nFederal y por la Ley Federal de las Entidades Paraestatales. Tanto la Constitución como las leyes enunciadas, se replican en términos generales en todos los Estados, estableciendo que la Administración Pública será centralizada y paraestatal.\nLa Ley Orgánica de la Administración Pública Federal establece en su artículo 1° que \"La Presidencia de la República, las Secretarías de Estado, los Departamentos\nAdministrativos y la Consejería Jurídica del Ejecutivo Federal, integran la Administración\nPública Centralizada.\" Por su parte, en su artículo tercero, dicha ley dispone que \"El correspondientes, de las siguientes entidades de la administración pública paraestatal:\nI. Organismos descentralizados;\nII. empresas de participación estatal, instituciones nacionales de crédito, de fianzas y\nIII. fideicomisos.\nDichas entidades son definidas también por la Ley, de acuerdo con lo siguiente:\nA. \"Son organismos descentralizados: las entidades creadas por ley o decreto del\nCongreso de la Unión o por decreto del Ejecutivo Federal, con personalidad jurídica y patrimonio propio, cualquiera que sea la estructura legal que adopten.\" (LOAPF Art. 45).\nB. \"Son empresas de participación estatal mayoritaria las siguientes:\nI.- Las sociedades nacionales de crédito constituidas en los términos de su legislación específica;\nII.- Las sociedades de cualquier otra naturaleza... en que se satisfagan alguno o varios de los siguientes requisitos:\na) Que el Gobierno Federal o una o más entidades paraestatales, conjunta o separadamente, aporten o sean propietarios de más del 50% del capital social.\nb) Que en la constitución de su capital se hagan figurar títulos representativos de capital social de serie especial que sólo puedan ser suscritas por el Gobierno Federal; o\nc) Que al Gobierno Federal le corresponda la facultad de nombrar a la mayoría de los miembros del órgano de gobierno o su equivalente, o bien designar al presidente o director general, o cuando tenga facultades para vetar los acuerdos del propio órgano de gobierno.\" (LOAPF Art. 46). las demás entidades paraestatales constituyen, con el propósito de auxiliar al Ejecutivo\nFederal en las atribuciones del Estado para impulsar las áreas prioritarias del desarrollo, comités técnicos.\" (LOAPF Art. 47).\nSobre los conceptos anteriores, la Ley Federal de las Entidades Paraestatales agrega en su artículo 14 que los organismos descentralizados son \"las personas jurídicas\nFederal y cuyo objeto sea:\n• La realización de actividades correspondientes a las áreas estratégicas o prioritarias;\n• La prestación de un servicio público o social, o\n• La obtención o aplicación de recursos para fines de asistencia o seguridad social.\nA partir de las referidas normas básicas, se desglosa toda la normatividad en materia de organización de la Administración Pública Federal.\nAplicando aspectos de los conceptos básicos relacionados que rigen la estructura administrativa federal y el modelo organizativo en general, también vigente para el caso de las entidades federativas y, los criterios, términos, estructura y composición del Sector\nPúblico como categoría económica se desarrolla la Clasificación Administrativa que se muestra en el punto siguiente.\nPrevio a dicha presentación deben explicitarse las aclaraciones adicionales sobre la estructura institucional pública que se formula a continuación:\na) Desde el punto de vista económico y fiscal, se considera irrelevante que una entidad sea considerada como de control presupuestario directo o de control presupuestario indirecto, todas ellas conforman el Sector Público en la medida que estén sujetas al control estatal.\nb) Cada nivel u orden de gobierno, dispone de una administración pública centralizada y otra paraestatal.\nc) Para la identificación, codificación y consolidación de entidades federativas y municipios se utilizará la \"Clasificación de entidades, municipios y países, preparado y editado por el INEGI.\nVI. ESTRUCTURA BÁSICA tres órdenes de gobierno que integran los Estados Unidos Mexicanos, su estructura y codificación se ha diseñado siguiendo las mejores prácticas en la materia.\nLa estructura diseñada per-mite una clara identificación del nivel y del gobierno responsable de la gestión y situación fiscal que se pretenda mostrar y analizar. Hace en el artículo 50° de la Ley de Contabilidad. La estructura homogénea de la información disponer de estadísticas fiscales armonizadas y realizar un análisis de sus magnitudes y resultados aplicando parámetros similares.\nPara el ordenamiento institucional del agregado económico Sector Público de\nMéxico, se ha adoptado una codificación básica de cinco (5) dígitos numéricos estructurados según los siguientes criterios:\n• El primer dígito, identifica al Sector Público de cada orden de gobierno.\n• El segundo dígito identifica al Sector Público no Financiero y al Sector Publico\nFinanciero de cada orden de gobierno.\n• El tercer dígito, identifica a los principales sectores de la economía relacionados con el Sector Público.\n• El cuarto dígito, identifica a los subsectores de la economía relacionados con el\nSector Público.\n• El quinto dígito se asignará para identificar y codificar a los entes públicos que forman parte de cada subsector y sector de la economía, tal como define a estos la Ley de Contabilidad.\nA partir del quinto dígito, excepto por la clasificación que se presenta del\nGobierno General Central, Estatal o del Distrito Federal y Municipal, la autoridad de cada subsector y sector de la economía que estime conveniente, de acuerdo con sus prácticas y metodologías habituales. la Federación, realizará dicha apertura por Ramo y Unidad Ejecutora, de acuerdo con su metodología específica de codificación institucional. correspondientes a los Gobiernos Municipales, será de conformidad a la ley orgánica respectiva, siendo deseable la armonización en estructura y denominación, respetando lo señalado en el art. 115 de la Constitución Política de los Estados Unidos Mexicanos\n(CPEUM).\n1.0.0.0.0 SECTOR PÚBLICO DE LA FEDERACIÓN\n1.1.0.0.0 SECTOR PÚBLICO NO FINANCIERO\n1.1.1.0.0 GOBIERNO GENERAL CENTRAL\n1.1.1.1.0 Gobierno Federal\n1.1.1.1.1 Poder Ejecutivo\n1.1.1.1.2 Poder Legislativo\n1.1.1.1.3 Poder Judicial\n1.1.1.1.4 Órganos Autónomos*\n*Se incluirán a nivel del quinto dígito en forma consecutiva, los órganos autónomos constitucionales existentes y aquellos que posteriormente se constituyan.\n1.1.1.2.0 Entidades Paraestatales y Fideicomisos No Empresariales y No Financieros\n1.1.1.3.0 Instituciones Públicas de la Seguridad Social\n1.1.2.0.0 ENTIDADES PARAESTATALES EMPRESARIALES NO FINANCIERAS CON\nPARTICIPACIÓN ESTATAL MAYORITARIA\n1.1.2.1.0 Entidades Paraestatales Empresariales No Financieras con Participación\nEstatal Mayoritaria\n1.1.2.2.0 Fideicomisos Empresariales No Financieros con Participación Estatal\nMayoritaria\n1.2.0.0.0 SECTOR PÚBLICO FINANCIERO\n1.2.2.0.0 ENTIDADES PARAESTATALES EMPRESARIALES FINANCIERAS\n1.2.2.1.0 Bancos de Inversión y Desarrollo\n1.2.2.2.0 Bancos Comerciales\n1.2.2.3.0 Otros Bancos\n1.2.2.4.0 Fondos del Mercado de Dinero\n1.2.3.0.0 ENTIDADES PARAESTATALES EMPRESARIALES FINANCIERAS NO\nMONETARIAS CON PARTICIPACIÓN ESTATAL MAYORITARIA\n1.2.3.1.0 Fondos de Inversión fuera del Mercado de Dinero\n1.2.3.2.0 Otros Intermediarios Financieros, excepto Sociedades de Seguros y Fondos de\nPensiones\n1.2.3.3.0 Auxiliares Financieros\n1.2.3.4.0 Instituciones Financieras Cautivas y Prestamistas de Dinero\n1.2.3.5.0 Sociedades de Seguros (SS) y Fondos de Pensiones (FP)\n1.2.4.0.0 FIDEICOMISOS FINANCIEROS PÚBLICOS CON PARTICIPACIÓN ESTATAL\nMAYORITARIA\n1.2.4.1.0 Fondos de Inversión fuera del Mercado de Dinero\n1.2.4.2.0 Otros Intermediarios Financieros, excepto Sociedades de Seguros y Fondos de\nPensiones\n1.2.4.3.0 Auxiliares Financieros\n1.2.4.4.0 Instituciones Financieras Cautivas y Prestamistas de Dinero\n1.2.4.5.0 Sociedades de Seguros (SS) y Fondos de Pensiones (FP)\n2.0.0.0.0 SECTOR PÚBLICO DE LAS ENTIDADES FEDERATIVAS\n2.1.0.0.0 SECTOR PÚBLICO NO FINANCIERO\n2.1.1.0.0 GOBIERNO GENERAL ESTATAL O DEL DISTRITO FEDERAL\n2.1.1.1.0 Gobierno Estatal o del Distrito Federal\n2.1.1.1.4 Órganos Autónomos*\n*Se incluirán a nivel del quinto dígito en forma consecutiva, los órganos autónomos creados por la Constitución de cada entidad federativa, según corresponda.\n2.1.1.2.0 Entidades Paraestatales y Fideicomisos No Empresariales y No Financieros\n2.1.1.3.0 Instituciones Públicas de Seguridad Social\n2.1.2.0.0 ENTIDADES PARAESTATALES EMPRESARIALES NO FINANCIERAS CON\nPARTICIPACIÓN ESTATAL MAYORITARIA\n2.1.2.1.0 Entidades Paraestatales Empresariales No Financieras con Participación\nEstatal Mayoritaria\n2.1.2.2.0 Fideicomisos Empresariales No Financieros con Participación Estatal\nMayoritaria\n2.2.0.0.0 SECTOR PÚBLICO FINANCIERO\n(El 2.2.1. Queda libre dado que no poseen ni pueden poseer Banco Central)\n2.2.2.0.0 ENTIDADES PARAESTATALES EMPRESARIALES FINANCIERAS\nMONETARIAS CON PARTICIPACIÓN ESTATAL MAYORITARIA\n2.2.2.1.0 Bancos de Inversión y Desarrollo\n2.2.2.2.0 Bancos Comerciales\n2.2.2.3.0 Otros Bancos\n2.2.2.4.0 Fondos del Mercado de Dinero\n2.2.3.0.0 ENTIDADES PARAESTATALES FINANCIERAS NO MONETARIAS CON\nPARTICIPACIÓN ESTATAL MAYORITARIA\n2.2.3.1.0 Fondos de Inversión Fuera del Mercado de Dinero\n2.2.3.2.0 Otros Intermediarios Financieros, excepto Sociedades de Seguros y Fondos de\nPensiones\n2.2.3.3.0 Auxiliares Financieros\n2.2.3.4.0 Instituciones Financieras Cautivas y Prestamistas de Dinero\n2.2.3.5.0 Sociedades de Seguros (SS) y Fondos de Pensiones (FP)\n2.2.4.0.0 FIDEICOMISOS FINANCIEROS PÚBLICOS CON PARTICIPACIÓN ESTATAL\nMAYORITARIA\n2.2.4.1.0 Fondos de Inversión Fuera del Mercado de Dinero\n2.2.4.2.0 Otros Intermediarios Financieros, excepto Sociedades de Seguros y Fondos de Pensiones\n2.2.4.3.0 Auxiliares Financieros\n2.2.4.4.0 Instituciones Financieras Cautivas y Prestamistas de Dinero\n2.2.4.5.0 Sociedades de Seguros (SS) y Fondos de Pensiones (FP)\n3.0.0.0.0 SECTOR PÚBLICO MUNICIPAL\n3.1.0.0.0 SECTOR PÚBLICO NO FINANCIERO\n3.1.1.0.0 GOBIERNO GENERAL MUNICIPAL\n3.1.1.1.0 Gobierno Municipal\n3.1.1.1.1 Órgano Ejecutivo Municipal (Ayuntamiento) 3.1.1.2.0 Entidades Paraestatales y\n3.1.2.0.0 ENTIDADES PARAMUNICIPALES EMPRESARIALES NO FINANCIERAS\nCON PARTICIPACIÓN ESTATAL MAYORITARIA\n3.1.2.1.0 Entidades Paramunicipales Empresariales No Financieras con Participación\nEstatal Mayoritaria\n3.1.2.2.0 Fideicomisos Paramunicipales Empresariales No Financieros con Participación\nEstatal Mayoritaria\n3.2.0.0.0 SECTOR PÚBLICO FINANCIERO\n3.2.1 (Queda libre dado que no poseen ni pueden poseer Banco Central)\n3.2.2.0.0 ENTIDADES PARAMUNICIPALES EMPRESARIALES FINANCIERAS\n3.2.2.1.0 Bancos de Inversión y Desarrollo\n3.2.2.2.0 Bancos Comerciales\n3.2.2.3.0 Otros Bancos\n3.2.2.4.0 Fondos del Mercado de Dinero\n3.2.3.0.0 ENTIDADES PARAESTATALES EMPRESARIALES FINANCIERAS NO\nMONETARIAS CON PARTICIPACIÓN ESTATAL MAYORITARIA\n3.2.3.1.0 Fondos de Inversión fuera del Mercado de Dinero\n3.2.3.2.0 Otros Intermediarios Financieros, excepto Sociedades de Seguros y Fondos de\nPensiones\n3.2.3.3.0 Auxiliares Financieros\n3.2.3.4.0 Instituciones Financieras Cautivas y Prestamistas de Dinero\n3.2.3.5.0 Sociedades de Seguros (SS) y Fondos de Pensiones (FP)\n3.2.4.0.0 FIDEICOMISOS FINANCIEROS PÚBLICOS CON PARTICIPACIÓN ESTATAL\nMAYORITARIA\n3.2.4.1.0 Fondos de Inversión fuera del Mercado de Dinero\n3.2.4.2.0 Otros Intermediarios Financieros, excepto Sociedades de Seguros y Fondos de\nPensiones\n3.2.4.3.0 Auxiliares Financieros\n3.2.4.4.0 Instituciones Financieras Cautivas y Prestamistas de Dinero\n3.2.4.5.0 Sociedades de Seguros (SS) y Fondos de Pensiones (FP)\nVII. DESCRIPCIÓN DE LAS PRINCIPALES CUENTAS COMPONENTES\nPara que los métodos de procesamiento, agregación, consolidación y análisis de armonización, se requiere una previa caracterización, comprensión y aplicación uniforme conforman.\nEn México, se adoptaron los mismos cinco sectores institucionales básicos que utilizan los macromodelos de cuentas económicas internacionales, todos ellos excluyentes entre sí, más su interacción con el resto del mundo.\n1. Sociedades No Financieras\n2. Sociedades Financieras\n3. Gobierno General\n4. Hogares\n5. Instituciones Sin Fines de Lucro que Sirven a los Hogares (ISFLSH)\n6. Resto del Mundo\n1. Gobierno General\nEl sector del Gobierno General, tiene como función principal el producir y suministrar bienes y servicios no de mercado tanto para los individuos como para el consumo colectivo de la comunidad, ocupándose también de la distribución y redistribución del ingreso y la riqueza. Sus actividades se financian principalmente con ingresos provenientes de los impuestos, derechos, productos, aprovechamientos, transferencias, créditos y está constituido por las siguientes unidades institucionales del\nSector Público:\na) Todas las unidades gubernamentales\nb) Todas las entidades paraestatales no empresariales (no de mercado) y no financieras (organismos descentralizados no empresariales y no financieros).\nc) Todas las instituciones públicas de Seguridad Social empresariales públicas, aunque todo su capital sea propiedad de unidades del gobierno. unidades gubernamentales. En cambio, se incluyen aquellas unidades propiedad del mercado.\nEl sistema constitucional mexicano, instituye tres órdenes de gobierno: el federal, el estatal y el municipal. En el marco de dicho ordenamiento, la categoría económica\nGobierno General se manifiesta en los tres órdenes de Gobierno: la Federación, las\nEntidades Federativas y Municipios, independientemente del tratamiento que se le otorgue al subsector Seguridad Social. ejerce la soberanía nacional y representa jurídicamente a la Nación. Su fin es el de ejecutar los ordenamientos que la Constitución Política confiere a la Federación a través de los tres Poderes de la Unión: Legislativo, Ejecutivo y Judicial Federal, asimismo, funge como ente rector y orientador de la actividad económica social a la población, en general, es financiado mediante impuestos, derechos, productos, aprovechamientos y créditos, parte de los cuales puede ser transferidos de uno a otro nivel gubernamental. El\nGobierno Federal, como categoría económica, incluye al Poder Ejecutivo, sus secretarías de estado, departamentos administrativos, el Poder Legislativo, el Poder Judicial y los\nÓrganos Autónomos Constitucionales de la Federación.\n3. Gobierno Estatal\nLos Gobiernos Estatales se organizan de manera soberana e independiente bajo una forma de gobierno republicana, representativa, popular y teniendo como base de su división territorial y organización política y administrativa, el Municipio Libre.\nEste subsector incluye al gobierno de las entidades federativas, es decir al Poder\nEjecutivo, al Poder Legislativo, Poder Judicial y a los Órganos Autónomos constitucionales de los mismos. En torno a dichos poderes y órganos se desarrolla una tales como las Secretarías de Finanzas, Educación, Comunicaciones, Trabajo, Ecología, dependencias.\n4. Gobierno Municipal\nLos Gobiernos Municipales (Locales) son la base o célula soberana de la división\n(Ayuntamiento) y a las dependencias. Se dedican a la producción de servicios sociales y comunales, dentro de los cuales se destacan aquellos que atienden las necesidades públicas básicas de la población, como son los servicios de alumbrado público, agua potable, drenaje y limpieza, entre otros.\n5. Entidades Paraestatales No Empresariales y No Financieras dispuesto por la Ley Orgánica de la Administración Pública Federal, controladas por los gobiernos y que no operen como empresas, cuyo objeto es:\n• La realización de actividades correspondientes a las áreas estratégicas o prioritarias;\n• la prestación de un servicio público o social; o\n• la obtención o aplicación de recursos para fines de asistencia o seguridad social.\nEstas entidades financian sus actividades básicamente con transferencias y subsidios de los Gobiernos Centrales respectivos, aunque pueden disponer de ingresos propios limitados con relación al costo de su producción o prestación de servicio.\n6. Fideicomisos No Empresariales y No Financieras\nFideicomisos creados por los gobiernos o por sus entidades paraestatales en el marco de la legislación vigente en cada caso, con el propósito de auxiliar al Poder desarrollo, que cuenten con una estructura orgánica análoga a las otras entidades y que empresariales y no financieras.\n7. Instituciones Públicas de Seguridad Social social el Instituto Mexicano del Seguro Social, el Instituto de Seguridad y Servicio\nArmadas. Sus fuentes de financiamiento son las cuotas obrero-patronales y las transferencias gubernamentales. seguridad social y de servicios médicos, que son promovidos por las autoridades públicas; cuentan con financiamiento del Estado, de los asalariados y de los empleadores, ofreciendo sus servicios a amplios grupos de la población, que se adhieren en forma institucional o voluntaria.\nEl Instituto Mexicano del Seguro Social es un régimen de financiamiento tripartita, en donde participan el Estado, los trabajadores y los empresarios; ampara a un gran número de asalariados principalmente de establecimientos productores de mercancías y trabajadores que se incorporan voluntariamente. En términos generales, sus actividades comprenden la prestación de servicios de seguridad social, identificados con las prestaciones en dinero; los servicios recreativos, culturales y el servicio médico.\nEl Instituto de Seguridad y Servicios Sociales de los Trabajadores del Estado es un régimen de financiamiento bipartito entre el gobierno y sus trabajadores, que ampara al personal que posee una plaza federal y en algunos casos estatal y municipal. Presta servicios tradicionales de seguridad social, además de actividades comerciales, otorgamiento de crédito, construcción de unidades habitacionales, velatorios, servicios de capacitación, culturales, deportivos, turísticos, así como la prestación de los servicios médicos.\nEl Instituto de Seguridad Social para las Fuerzas Armadas Mexicanas es un organismo descentralizado con personalidad jurídica y patrimonio propios, que fue\nInstituto encomienda en favor de los miembros de las Fuerzas Armadas Mexicanas.\n8. Entidades Paraestatales Empresariales No Financieras con Participación\nEstatal Mayoritaria\nEl subsector de las entidades paraestatales empresariales no financieras, está constituido por las empresas públicas residentes en el país, cuya función principal es la significativos (de mercado) y que están controladas directa o indirectamente por unidades gubernamentales. También pertenecen a este sector las unidades que funcionan como tal, es decir, su operación se realiza en forma autónoma e independiente de sus unidades propietarias. Igualmente pertenecen al sector, las entidades creadas como no empresariales y no financieras (organismos descentralizados) pero que, al ser analizadas desde el punto de vista de su actividad productiva y relación con el mercado, cumplen con los criterios para clasificarlas como tales. En general, este subsector incluye a todas las empresas paraestatales no financieras, de cualquier naturaleza en las que unidades del Gobierno Federal, Estatal o\nMunicipal o una o más de sus entidades paraestatales, conjunta o separadamente, aporten o sean propietarios de más de 50% del Capital Social, nombren a la mayoría de los miembros de su Consejo de Administración, Junta Directiva u Órgano de Gobierno, o bien designen al Presidente o Director General con facultades para vetar acuerdos del propio órgano directivo.\nExcepcionalmente, por razones de política económica este tipo de entidades paraestatales pueden recibir transferencias, aportaciones y/o subsidios del Gobierno\nGeneral, cuando sus ingresos por precios o tarifas no alcanzan para cubrir sus costos de producción o bien para realizar inversiones físicas o financieras. Estas características hacen que las empresas públicas, además de su carácter de unidades económicas tengan la calidad de instrumentos de política económica.\n9. Fideicomisos Públicos Empresariales No Financieros\nFideicomisos creados por los gobiernos o por sus entidades paraestatales en el marco de la legislación vigente en cada caso, con el propósito de auxiliar al Poder\nEjecutivo en las atribuciones del Estado para impulsar las áreas prioritarias del desarrollo, que cuenten con una estructura orgánica análoga a las otras entidades y que empresariales no financieras.\n10. Entidades Paraestatales Empresariales Financieras con Participación\nEstatal Mayoritaria (Sociedades Financieras Públicas) resto de las instituciones públicas financieras. Estas unidades institucionales contraen pasivos por cuenta propia con el fin de adquirir activos financieros, es decir que operan modo tal que se adapten a las demandas de los prestatarios. Por su naturaleza, la productiva; si a ello se agrega su importancia dentro de la economía se podrán de primer nivel dentro del Sistema. Incluye también a los auxiliares que tienen por propósito facilitar la realización de las mencionadas transacciones.\nPara el caso de México, los agentes pertenecientes al sector Sociedades\nFinancieras, el INEGI los agrupó en ocho subsectores, dependiendo del tipo de intermediación que cada agente realiza o auxilia dentro del sistema de pagos mexicano, el cual se encuentra en rápida y constante modernización.\n11. Banco de México\nEl Banco Central es la institución financiera nacional que ejerce el control sobre los aspectos claves del sistema financiero de la Unión. Tiene su origen en el artículo 28 de la Constitución Política de los Estados Unidos Mexicanos que dice: \"...El Estado tendrá un banco central que será autónomo en el ejercicio de sus funciones y en su administración. Su objetivo prioritario será procurar la estabilidad del poder adquisitivo de la moneda nacional, fortaleciendo con ello la rectoría del desarrollo nacional que corresponde al Estado. Ninguna autoridad podrá ordenar al Banco conceder financiamiento.\n...El Banco Central, en los términos que establezcan las leyes y con la intervención que corresponda a las autoridades competentes, regulará los cambios, así como la intermediación y los servicios financieros, contando con las atribuciones de autoridad necesarias para llevar a cabo dicha regulación y proveer a su observancia...\".\nEn el contexto constitucional anterior, la ley establece que el Banco Central será\n• Proveer a la economía del país de moneda nacional. En la consecución de esta dicha moneda;\n• promover el sano desarrollo del sistema financiero, y\n• propiciar el buen funcionamiento de los sistemas de pagos.\nPara ello, el Banco desempeñará las funciones siguientes:\nI. Regular la emisión y circulación de la moneda, los cambios, la intermediación y los servicios financieros, así como, los sistemas de pagos;\nII. operar con las instituciones de crédito como banco de reserva y acreditante de última instancia;\nIII. prestar servicios de tesorería al Gobierno Federal y actuar como agente financiero del mismo;\nIV. fungir como asesor del Gobierno Federal en materia económica y, particularmente, financiera;\nV. participar en el Fondo Monetario Internacional y en otros organismos de cooperación financiera internacional o que agrupen a bancos centrales, y\nVI. operar con los organismos a que se refiere la fracción V anterior, con bancos centrales y con otras personas morales extranjeras que ejerzan funciones de autoridad en materia financiera.\n12. Entidades Paraestatales Financieras Monetarias Con Participación\nEstatal Mayoritaria\nLas entidades paraestatales financieras monetarias o de depósito con participación estatal mayoritaria, excepto el Banco Central, tienen como actividad principal la intermediación de recursos financieros en mercados organizados, y transforman los recursos que captan en formas de financiamiento para actividades productivas o gastos de consumo, lo que se lleva a cabo bajo marcos regulatorios específicos. Con este fin, estas entidades contraen pasivos en forma de depósitos o instrumentos financieros que son sustitutos cercanos de los depósitos (por ejemplo certificados de depósito a corto plazo). Los pasivos de estas sociedades se incluyen en la definición del dinero en sentido amplio. segmentos de mercado por ejemplo: inmobiliario, bienes de consumo, sectores productivos, apoyo a proyectos a través del otorgamiento de créditos preferenciales conocidos como banca de segundo piso o banca de desarrollo, así como, instituciones que se dedican al fomento del ahorro nacional. Los siguientes intermediarios financieros se clasifican dentro de este subsector: Bancos de Inversión y Desarrollo, Bancos\nComerciales, Otros Bancos y Fondos del Mercado de Dinero.\n13. Fondos del Mercado de Dinero inversionista en el mercado bursátil por medio de inversiones en valores de renta fija, a través de una casa de bolsa o una institución bancaria. La forma en que desarrollan sus actividades es mediante los recursos que son invertidos principalmente en instrumentos del mercado de dinero, acciones, instrumentos de transferencia de deuda con vencimiento menor a un año, bancos de depósito e instrumentos que siguen una tasa de interés que se acerca a las tasas de interés de los instrumentos del mercado de dinero.\nDebido a que la naturaleza de los instrumentos de los esquemas de inversión en sus acciones, estos pueden ser considerados como cercanos substitutos de los depósitos.\nSe incluyen las Sociedades de Inversión en instrumentos de deuda para personas físicas, las Sociedades de Inversión en instrumentos de deuda para personas morales y las Sociedades de Inversión especializada en fondos para el retiro.\n14. Fondos de Inversión Fuera del Mercado de Dinero\nSociedades dedicadas principalmente a la colocación de recursos del público inversionista en el mercado bursátil por medio de inversiones en valores de renta variable e inversión de capitales. La forma en que desarrollan sus actividades es a través de una casa de bolsa o una institución bancaria, para ello se agrupan en dos tipos de sociedad de inversión: Sociedades de Inversión de Renta Variable, cuyas inversiones se realizan en acciones, obligaciones, valores y demás títulos o documentos representativos de una acciones o partes sociales, obligaciones y bonos a cargo de empresas que promueven financiamiento de mediano y largo plazo. Incluye las Sociedades de Inversión de Renta\nVariable (común) y las Sociedades de Inversión de Capitales.\n15. Otros Intermediarios Financieros Públicos, excepto Sociedades de\nSeguros y Fondos de Pensión la captación de fondos en los mercados financieros, pero no en forma de moneda, activos financieros, vía arrendamiento, factoraje, operación y promoción de tarjetas de crédito no bancarias, y al financiamiento de artículos duraderos, colocación, compra y venta de acciones y valores de empresas suscritas en el mercado de valores, entre el público inversionista. Seguidamente, se incluyen ejemplos de las unidades clasificadas como \"otros intermediarios financieros\":\n• Entidades paraestatales que se dedican principalmente a la concesión de crédito a sociedades no financieras y hogares.\n• Entidades paraestatales de arrendamiento financiero\n• Entidades paraestatales suscriptoras y operadoras de valores\n• Entidades paraestatales que operan como intermediarios en derivados financieros\n• Entidades paraestatales que operan como intermediarios financieros especializados\n16. Auxiliares Financieros Públicos\nLos auxiliares financieros son las instituciones financieras que se dedican principalmente a las actividades asociadas a transacciones de activos financieros y pasivos, además de proporcionar el contexto regulador y asesoría para la realización de las transacciones, pero en circunstancias que no implican la propiedad de los activos y pasivos de los cuales facilita su operación. Las denominaciones más comunes de las entidades paraestatales dedicadas a este tipo de actividades son:\n• Bolsas y mercados de valores\n• Corredores y agentes\n• Casas de cambio\n• Centros cambiarios\n• Sociedades de garantía financiera\n• Asesoría en inversiones\n• Agentes ajustadores y gestores de seguros y fianzas\n• Otros servicios relacionados con la intermediación\n17. Instituciones Financieras Cautivas y Prestamistas de Dinero\nEs conformado por las unidades económicas que proveen servicios financieros, financieros abiertos. La forma en que desarrollan sus actividades es mediante la para estimular las actividades sociales, de producción y mediante el otorgamiento de préstamos prendarios. Esto incluye las entidades que proveen préstamos con sus propios fondos suministrados sólo por un patrocinador.\n18. Sociedades de Seguros y Fondos de Pensión\nCompañías especializadas en seguros de vida (tanto individuales como colectivos) y las compañías de seguros dedicadas principalmente al aseguramiento no especializado en seguros de vida, es decir, suscriben pólizas de seguros tanto de vida como de accidentes, robo, y daños. El tratamiento que se le da es conjunto, e incluye a las unidades económicas dedicadas principalmente al reaseguramiento, aseguramiento de la vida de los campesinos y de sus propiedades, ya sean éstas agrícolas, ganaderas o forestales, avalan y responden a títulos onerosos por acciones de responsabilidad penal o civil.\nEl subsector de fondos de pensión consiste solamente en fondos de pensión del seguro social que sean unidades institucionales aparte de las unidades que los crean.\nEste subsector incluye compañías especializadas en seguros de vida y compañías de seguros no especializadas en seguros; fondos de aseguramiento campesino y compañías afianzadoras, entre otras de tipo similar.\n19. Fideicomisos Públicos Empresariales Financieros\nFideicomisos creados por los gobiernos o por sus entidades paraestatales en el marco de la legislación vigente en cada caso, con el propósito de auxiliar al Poder desarrollo, que cuenten con una estructura orgánica análoga a las otras entidades y que empresariales financieras. Estos fideicomisos públicos, de acuerdo con el objeto de su creación, pueden actuar en calidad de entidades bancarias (de fomento), Fondos de mercado de dinero, Fondos de inversión distintos a los del mercado monetario, Otros\nIntermediarios Financieros, excepto Sociedades de Seguros y Fondos de Pensiones, Auxiliares financieros, Instituciones Financieras Cautivas y Prestamistas de Dinero, Sociedades de Seguros y Fondos de Pensiones.\n20. Sector Público No Financiero\nEl Sector Público No Financiero de la Federación, de las entidades federativas y de los municipios, que constituye el agrupamiento institucional más importante desde el punto de vista de las estadísticas de las finanzas públicas, está conformado por el participación estatal mayoritaria.\n21. Sector Público No Monetario\nEl Sector Público No Monetario Financiero de la Federación, de las entidades federativas y de los municipios, está conformado por el Gobierno General y las entidades paraestatales empresariales no financieras con participación estatal mayoritaria y las entidades paraestatales empresariales financieras con participación estatal mayoritaria no monetarias. Se excluyen expresamente de este agregado a las instituciones, tales como el Banco de México, otros bancos públicos y los fondos del mercado de dinero.\n22. Sector Público\nEl Sector Público de la Federación, de cada una de las entidades federativas y de cada uno de los municipios está conformado por sus unidades de gobierno y por todas las entidades paraestatales y fideicomisos que controla directa o indirectamente. Incluye al Gobierno General, a las entidades paraestatales empresariales no financieras con participación estatal mayoritaria y las entidades paraestatales empresariales financieras con participación estatal mayoritaria y sus respectivos fideicomisos.\nFederación, de las entidades federativas y de los municipios. Estructurado en Gobierno\nGeneral (Gobiernos y Entidades Paraestatales No Empresariales y No Financieras), las estatal mayoritaria, así como, los respectivos fideicomisos de cada uno de estos agrupamientos.\nANEXO I: MODELO ALTERNATIVO PARA PRESENTAR LA ESTRUCTURA DEL\nSECTOR PÚBLICO MEXICANO PARA FINES ESTADÍSTICOS.\nLa estructura y codificación del Sector Público por orden de Gobierno, tal como fue desarrollada en el Capítulo VI anterior, permite generar en forma automática el que habitualmente es reclamada por sus analistas y usuarios, tal como se muestra a continuación:\n-> GOBIERNO GENERAL CENTRAL\nSECTOR SECTOR GOBIERNO (De la Federación)\nPÚBLICO PÚBLICO GENERAL\nDE NO -> GOBIERNO GENERAL ESTATAL\nMÉXICO FINANCIERO (De Entidades Federativas)\n-> GOBIERNO GENERAL LOCAL\n(De los Municipios)\n-> INSTITUTOS DE SEGURIDAD\nSOCIAL\nENTIDADES -> DE LA FEDERACIÓN\nPARAESTATALES\nEMPRESARIALES -> DE ENTIDADES FEDERATIVAS\nFINANCIERAS -> DE LOS MUNICIPIOS\n-> DE LA FEDERACIÓN\nSECTOR\nPÚBLICO\nMONETARIO -> DE ENTIDADES FEDERATIVAS\nFINANCIERO\n-> DE LOS MUNICIPIOS\n-> DE LA FEDERACIÓN\nNO MONETARIO -> DE ENTIDADES FEDERATIVAS\n-> DE LOS MUNICIPIOS\nSEGUNDO: En cumplimiento con los artículos 7 y cuarto transitorio de la Ley de\nContabilidad, los poderes Ejecutivo, Legislativo y Judicial de la Federación y entidades federativas; las entidades y los órganos autónomos deberán adoptar e implementar, con carácter obligatorio, el Acuerdo por el que se emite la Clasificación Administrativa a más presente documento. Lo anterior, a efecto de estar en posibilidad de cumplir con lo señalado en el cuarto transitorio de la Ley de Contabilidad, sobre la emisión de información contable y presupuestaria en forma periódica bajo la clasificación administrativa, económica, funcional programática.\nTERCERO.- Al adoptar e implementar lo previsto en la presente Clasificación\nAdministrativa, las autoridades en materia de Contabilidad Gubernamental y\nPresupuestal que corresponda en los poderes ejecutivos federal, locales y municipales establecerán la forma en que las entidades paraestatales y paramunicipales, respectivamente atendiendo a su naturaleza, se ajustarán al mismo. Lo anterior, en tanto el CONAC emite lo conducente.\nCUARTO.-. En cumplimiento con los artículos 7 y quinto transitorio de la Ley de\nContabilidad, los ayuntamientos de los municipios y los órganos político-administrativos de las demarcaciones territoriales del Distrito Federal deberán adoptar e implementar, con carácter obligatorio, el Acuerdo por el que se emite la Clasificación Administrativa a más tardar, el 31 de diciembre de 2011. Lo anterior, a efecto de estar en posibilidad de cumplir con lo señalado en el quinto transitorio de la Ley de Contabilidad.\nQUINTO.- De conformidad con los artículos 1 y 7 de la Ley de Contabilidad, los gobiernos de las entidades federativas deberán adoptar e implementar las decisiones del\nCONAC, vía la adecuación de sus marcos jurídicos, lo cual podría consistir en la eventual modificación o formulación de leyes o disposiciones administrativas de carácter local, según sea el caso.\nSEXTO.- De acuerdo con lo previsto en el artículo 1 de la Ley de Contabilidad, los municipales para que logren contar con un marco contable armonizado, a través del intercambio de información y experiencias entre ambos órdenes de gobierno.\nSÉPTIMO.- En términos de los artículos 7 y 15 de la Ley de Contabilidad, el los gobiernos de las entidades federativas, municipios y demarcaciones territoriales del\nDistrito Federal realicen para la adopción e implementación del presente acuerdo. Para tales efectos, los gobiernos de las entidades federativas, los municipios y las información relacionada con dichos actos. Dicha información deberá ser enviada a la días hábiles contados a partir de la conclusión del plazo fijado por el CONAC.\nOCTAVO.- En términos del artículo 15 de la Ley de Contabilidad, las entidades federativas y municipios sólo podrán inscribir sus obligaciones en el Registro de\nObligaciones y Empréstitos si se encuentran al corriente con las obligaciones contenidas en la Ley de Contabilidad.\nNOVENO.- En cumplimiento a lo dispuesto por el artículo 7, segundo párrafo de la\nLey de Contabilidad, la Clasificación Administrativa será publicada en el Diario Oficial de la Federación, así como en los medios oficiales de difusión escritos y electrónicos de las entidades federativas, municipios y demarcaciones territoriales del Distrito Federal.\nEn la Ciudad de México, Distrito Federal, siendo las 13:30 horas del día 23 de junio del año dos mil once, el Titular de la Unidad de Contabilidad Gubernamental e\nInformes sobre la Gestión Pública de la Secretaría de Hacienda y Crédito Público, en mi calidad de Secretario Técnico del Consejo Nacional de Armonización Contable, HACE\nCONSTAR que el documento consistente de 23 fojas útiles denominado Clasificación\nAdministrativa, corresponde con los textos aprobados por el Consejo Nacional de\nArmonización Contable, mismos que estuvieron a la vista de los integrantes de dicho\nConsejo en su primera reunión celebrada el pasado 23 de junio del presente año. Lo anterior para los efectos legales conducentes, con fundamento en el artículo 7 de la Ley\nGeneral de Contabilidad Gubernamental y en la regla 20 de las Reglas de Operación del\nConsejo Nacional de Armonización Contable. El Secretario Técnico del Consejo Nacional de Armonización Contable, Moisés Alcalde Virgen.- Rúbrica.",
  "ordenamiento": "ACUERDO",
  "jurisdiccion": "GUERRERO",
  "fuente_oficial": "DIARIO OFICIAL DE LA FEDERACION",
  "Fecha de Publicación": "12 de Agosto de 2011",
  "ULTIMA REFORMA PUBLICADA": null,
  "status": "VIGENTE",
  "es_escaneado": false,
  "tiene_tablas": false,
  "materia": [
    "administrativo"
  ]
}