{
  "titulo": "Acuerdo por el Que Se Determinan los Factores de Actualización para los Efectos de los Artículos 60,",
  "Contenido": "HACIENDA DEL ESTADO DE GUERRERO NÚMERO\nTEXTO ORIGINAL.\nACUERDO POR EL QUE SE DETERMINAN LOS FACTORES DE ACTUALIZACIÓN PARA LOS\nEFECTOS DE LOS ARTÍCULOS 60, 60 A Y 60 B DE LA LEY DE HACIENDA DEL ESTADO DE\nGUERRERO NÚMERO 428.\nGuerrero.- Poder Ejecutivo.\nLICENCIADO HECTOR ANTONIO ASTUDILLO FLORES, GOBERNADOR CONSTITUCIONAL\nDEL ESTADO DE GUERRERO CON FUNDAMENTO EN LOS ARTÍCULOS 90 NUMERAL 2 Y 91\nDE GUERRERO; 1, 2, 3, 6, 10, 11, 18 APARTADO A FRACCIONES I Y III Y 22 DE LA LEY ORGÁNICA\nDE LA ADMINISTRACIÓN PÚBLICA DEL ESTADO DE GUERRERO NÚMERO 08; 1o Y 2o DEL\nREGLAMENTO INTERIOR DE LA SECRETARÍA DE FINANZAS Y ADMINISTRACIÓN; 60, 60 A Y 60 B\nDE LA LEY DE HACIENDA DEL ESTADO DE GUERRERO NÚMERO 428; 1o, 4o FRACCIÓN VIII, 11\nFRACCIÓN I Y II, 13, 18 Y 19 DEL CÓDIGO FISCAL DEL ESTADO DE GUERRERO NÚMERO 429; Y\nGuerrero, la recaudación de los impuestos, derechos, productos y aprovechamientos que correspondan al Estado, vigilando siempre el cumplimiento de las leyes, reglamentos y demás disposiciones de carácter fiscal vigente en la Entidad, sin variar su esencia.\nQue la Ley de Hacienda del Estado de Guerrero Número 428, es una de las leyes fiscales e instrumento jurídico que fundamenta la materia fiscal en el Estado.\nQue la mencionada Ley de Hacienda del Estado, en forma específica en su artículo 60 contempla la tarifa en cantidades para el cobro del Impuesto Sobre Tenencia o Uso de Vehículos, para vehículos nuevos y además, establece que dichas cantidades se actualizarán en el mes de enero de cada año, aplicando, el factor que se obtenga de dividir el Índice Nacional de Precios al Consumidor del noviembre de dos años inmediatos anteriores a dicha aplicación, el cual se publicará en el Periódico\nOficial del Estado, a más tardar el diez de enero de cada año.\nQue la multicitada Ley de Hacienda Estatal en sus artículos 60 A y 60 B, establece tabulares del factor de cobro específicos, a vehículos usados de fabricación nacional o importados de menos o más de quince pasajeros o de carga cuyo peso bruto vehicular sea menor a quince toneladas, así como los destinados al transporte público, embarcaciones, veleros, esquí acuático motorizado, motocicleta acuática, tabla de oleaje con motor, automóviles eléctricos, motocicletas y aeronaves, además establece\nHACIENDA DEL ESTADO DE GUERRERO NÚMERO que las cantidades que resulten de la aplicación de los factores de cada tabla, se actualizarán en el mes de enero de cada año, aplicando el factor que se obtenga de dividir el Índice Nacional de Precios al factores entre el mes de noviembre de dos años inmediatos anteriores a dicha aplicación el cual se publicará en el Periódico Oficial del Gobierno del Estado de Guerrero a más tardar el día 10 de enero de cada año.\nQue tomando en cuenta el Índice Nacional de Precios al Consumidor correspondiente al mes de noviembre de 2015, publicado en el Diario Oficial de la Federación el 10 de diciembre del mismo año, por el Banco de México es de 118.0510 puntos y el correspondiente al mes de noviembre de 2014 que fue de\n115.4930 puntos y en cumplimiento de lo dispuesto en los artículos 60, 60 A y 60 B de la Ley de\nHacienda del Estado de Guerrero Número 428, es necesario determinar los factores de actualización correspondientes, aplicando la operación matemática siguiente:\n118.0510/115.4930 = 1.0221\n(Índice Nacional de Precios al Consumidor de Noviembre de 2015, entre Índice Nacional de\nPrecios al Consumidor de Noviembre de 2014, da como resultado el Factor de Actualización)\nPor lo anteriormente expuesto y fundado, he tenido a bien expedir el siguiente:\nACUERDO POR EL QUE SE DETERMINAN LOS FACTORES DE ACTUALIZACIÓN PARA LOS\nEFECTOS DE LOS ARTÍCULOS 60, 60 A Y 60 B DE LA LEY DE HACIENDA DEL ESTADO DE\nGUERRERO NÚMERO 428.\nARTÍCULO PRIMERO: Se determina el 1.0221 puntos como factor de actualización para el ejercicio fiscal del presente año 2016, para los efectos del artículo 60 de la Ley de Hacienda del Estado de Guerrero Número 428, por lo que el Impuesto Sobre Tenencia o Uso de Vehículos se cobrará atendiendo la siguiente:\nLÍMITE INFERIOR LÍMITE SUPERIOR CUOTA FIJA. TASA PARA APLICARSE\n$ $ $ SOBRE EL EXCEDENTE\nDEL LÍMITE INFERIOR %\n0.00 552,427.89 0.00 3.0\n552,427.90 1063,116.79 16,572.83 8.7\n1063,116.80 1,429,058.49 61,002.76 13.3\n1,429,058.50 1,794,776.88 109,658.17 16.8\n1,794,776.89 En adelante 171,117.60 19.1\nHACIENDA DEL ESTADO DE GUERRERO NÚMERO\nARTÍCULO SEGUNDO: Se determina como factor de actualización a que se refiere la fracción\nII, párrafo segundo del artículo 60 A de la Ley de Hacienda del Estado de Guerrero número 428, el\n1.0221 puntos, para el ejercicio fiscal 2016.\nARTÍCULO TERCERO: Se determina como factor de actualización a que se refiere el párrafo segundo del inciso b) del artículo 60 B de la Ley de Hacienda del Estado de Guerrero Número 428, el\n1.0221 puntos, para el ejercicio fiscal 2016.\nÚNICO: El presente Acuerdo entrará en vigor al día siguiente de su publicación en el Periódico\nOficial del Gobierno del Estado.\nDado en la oficina del titular del Poder Ejecutivo, ubicada en el 2° piso del Edificio Centro de\nPalacio de Gobierno, Boulevard René Juárez Cisneros No. 62 colonia Ciudad de los Servicios en la\nCiudad de Chilpancingo de los Bravo, Capital del Estado de Guerrero, el primer día del mes de enero del año dos mil dieciséis.\nEL GOBERNADOR CONSTITUCIONAL DEL ESTADO\nLIC. HÉCTOR ANTONIO ASTUDILLO FLORES.\nEL SECRETARIO GENERAL DE GOBIERNO.\nLIC. FLORENCIO SALAZAR ADAME.\nEL SECRETARIO DE FINANZAS Y ADMINISTRACIÓN.\nLIC. HÉCTOR APREZA PATRÓN.",
  "ordenamiento": "ACUERDO",
  "jurisdiccion": "GUERRERO",
  "fuente_oficial": "DIARIO OFICIAL DE LA FEDERACION",
  "Fecha de Publicación": "01 de Enero de 2016",
  "ULTIMA REFORMA PUBLICADA": null,
  "status": "VIGENTE",
  "es_escaneado": false,
  "tiene_tablas": true,
  "materia": [
    "general"
  ]
}