{
  "titulo": "Ley DE MEJORA REGULATORIA y GESTIÓN EMPRESARIAL PARA EL ESTADO DE AGUASCALIENTES",
  "Contenido": "ESTADO DE AGUASCALIENTES\nDE 2024.\nLey publicada en el Periódico Oficial del Estado de Aguascalientes, el\nMARTÍN OROZCO SANDOVAL, Gobernador Constitucional del Estado de\nAguascalientes, a sus habitantes sabed:\nAguascalientes, en virtud de su función y facultad constitucional, ha tenido a bien expedir el siguiente\nDecreto Número 250\nARTÍCULO PRIMERO.[…]\nARTÍCULO SEGUNDO.- Se Expide la Ley de Mejora Regulatoria y Gestión\nEmpresarial para el Estado de Aguascalientes, para quedar como sigue:\nLEY DE MEJORA REGULATORIA Y GESTIÓN EMPRESARIAL PARA EL\nESTADO DE AGUASCALIENTES\nÍNDICE\nTÍTULO PRIMERO\nGENERALIDADES\nCAPÍTULO ÚNICO\nDisposiciones Generales\nTÍTULO SEGUNDO\nMEJORA REGULATORIA\nCAPÍTULO I\nPrincipios\nCAPÍTULO II\nObjetivos\nCAPÍTULO III\nSistema Estatal de Mejora Regulatoria\nSección Primera\nIntegración\nSección Segunda\nConsejo Estatal de Mejora Regulatoria\nSección Tercera\nEstrategia Estatal de Mejora Regulatoria\n(REFORMADA SU DENOMINACIÓN, P.O. 30 DE SEPTIEMBRE DE 2022)\nSección Cuarta\nSecretaría de Innovación y Gobierno Digital\nSección Quinta\nMunicipios\nSección Sexta\nSujetos obligados\nCAPÍTULO IV\nImplementación de la Política de Mejora Regulatoria por los Poderes\nLegislativo y Judicial y los Órganos Constitucionales Autónomos\nTÍTULO TERCERO\nHERRAMIENTAS DE MEJORA REGULATORIA\nCAPÍTULO I\nCatálogo de Regulaciones, Trámites y Servicios\nSección Primera\nRegistro Estatal de Trámites y Servicios\nSección Segunda\nRegistro de Regulaciones\nSección Tercera\nExpediente para Trámites y Servicios\nSección Cuarta\nRegistro de Visitas Domiciliarias, Inspecciones y Verificaciones\nSección Quinta\nProtesta Ciudadana\nCAPÍTULO II\nAgenda Regulatoria\nCAPÍTULO III\nAnálisis de Impacto Regulatorio\nCAPITULO IV\nProgramas de Mejora Regulatoria\nSección Primera\nProgramas de Mejora Regulatoria\nSección Segunda\nProgramas Específicos de Simplificación y Mejora Regulatoria\nCAPÍTULO V\nEncuestas, Información Estadística y Evaluación en Materia de Mejora\nRegulatoria\nTITULO CUARTO\nGESTIÓN EMPRESARIAL\nCAPÍTULO I\nApertura y Operación de Negocios\nCAPÍTULO II\nApertura de Empresas\nTÍTULO QUINTO\nREGULATORIA\nCAPÍTULO ÚNICO\nTRANSITORIOS\nESTADO DE AGUASCALIENTES\nTÍTULO PRIMERO\nGENERALIDADES\nCAPÍTULO ÚNICO\nDisposiciones Generales\nArtículo 1°. La presente Ley es de orden público y de observancia general gestión empresarial, que tiene por objeto:\nI. Establecer los principios, bases y obligaciones en materia de gestión empresarial que deberán cumplir los Poderes Ejecutivo, Legislativo y\nJudicial, Municipios y Órganos Constitucionales Autónomos, en sus respectivos ámbitos de competencia;\nII. Establecer la obligación de las autoridades de los órdenes de gobierno estatal y municipal, en el ámbito de su competencia, de implementar políticas de mejora regulatoria y gestión empresarial para el perfeccionamiento de las regulaciones y la simplificación de los trámites y servicios;\nIII. Armonizar el marco normativo de la mejora regulatoria del Estado de\nAguascalientes con la Ley General;\nIV. Establecer la organización y el funcionamiento del Sistema Estatal de\nMejora Regulatoria;\nV. Establecer los instrumentos, herramientas, acciones y procedimientos de mejora regulatoria, así como las responsabilidades de los sujetos obligados para facilitar los trámites y la obtención de servicios, incluyendo el uso de tecnologías de la información;\nVI. Establecer la creación y el funcionamiento del Catálogo Estatal de\nRegulaciones, Trámites y Servicios de conformidad con la Ley General y\nMejora Regulatoria; e\nVII. Incorporar el uso de medios electrónicos, magnéticos o de cualquier gestión empresarial.\nArtículo 2°. Para efectos de esta Ley, se entenderá por:\nI. Agenda Regulatoria: La propuesta de las regulaciones que los sujetos obligados pretendan expedir;\nII. Análisis de Impacto Regulatorio: Herramienta prevista en el Título\nTercero, Capítulo III de la Ley General, y que debe contener, cuando menos, los elementos descritos en el artículo 69 de dicha Ley;\n(REFORMADA, P.O. 10 DE MAYO DE 2023)\nIII. Autoridad de Mejora Regulatoria: La Secretaría de Innovación y\nGobierno Digital para el ámbito estatal, y la instancia que se determine en el ámbito municipal, cuyo titular debe designarse conforme a lo previsto en el artículo 12 de la Ley General;\n(ADICIONADA, P.O. 24 DE MAYO DE 2023)\nIV. Catálogo: El Catálogo Estatal de Regulaciones, Trámites y Servicios;\nV. Consejo Estatal: El Consejo Estatal de Mejora Regulatoria;\nVI. Consejos Municipales: Los Consejos Municipales de Mejora\nRegulatoria;\n(REFORMADA, P.O. 10 DE MAYO DE 2023)\nVII. Dictamen: El documento que emite la Autoridad de Mejora\nRegulatoria respectiva, conforme a lo previsto en el artículo 75 de la Ley\nGeneral;\nVIII. Enlace de Mejora Regulatoria: El responsable oficial de mejora regulatoria en cada sujeto obligado, referido en el artículo 13 de la Ley\nGeneral;\nIX. Estrategia Estatal: La Estrategia Estatal de Mejora Regulatoria;\nX. Expediente para Trámites y Servicios: El conjunto de documentos electrónicos emitidos por los sujetos obligados, que están asociados a las personas físicas y morales, y que pueden ser utilizados por cualquier autoridad competente para resolver trámites y servicios;\nXI. Ley: La Ley de Mejora Regulatoria y Gestión Empresarial para el Estado de Aguascalientes;\nXII. Ley General: La Ley General de Mejora Regulatoria;\nXIII. Padrón: El Padrón Estatal de Servidores Públicos con nombramiento de inspector, verificador, visitador o supervisor, cuyas competencias sean las de vigilar el cumplimiento de alguna regulación;\nXIV. (DEROGADA, P.O. 10 DE MAYO DE 2023)\nXV. Propuesta regulatoria: Los anteproyectos de leyes o regulaciones que pretendan expedir los sujetos obligados, en el ámbito de su competencia, y que se presenten a consideración de las Autoridades de\nMejora Regulatoria para su respectivo dictamen;\n(REFORMADA, P.O. 24 DE MAYO DE 2023)\nXVI. Protesta Ciudadana: La herramienta por medio de la cual el solicitante puede presentar una acción u omisión contra los servidores públicos de los sujetos obligados, encargados de algún trámite o servicio que, sin causa justificada, altere o incumpla lo previsto en la presente Ley;\n(REFORMADA [N. DE E. ADICIONADA], P.O. 24 DE MAYO DE 2023)\nXVII. Registro Estatal: Al Registro Estatal de Trámites y Servicios;\nXVIII. Registro de Regulaciones: A la recopilación de la normatividad aplicable vigente;\nXIX. Regulación o regulaciones: Cualquier normativa de carácter general que puede ser denominada ley, reglamento, decreto, acuerdo o demás normas de naturaleza jurídica que expida cualquier sujeto obligado;\nXX. SARE: Al Sistema de Apertura Rápida de Empresas;\nXXI. Secretaría: Secretaría de Innovación y Gobierno Digital;\nXXII. Servicio: Cualquier beneficio o actividad que los sujetos obligados, en el ámbito de su competencia brinden a particulares, previa solicitud y cumplimiento de los requisitos aplicables;\nXXIII. Simplificación: Al procedimiento por medio del cual se propicia la regulaciones y procesos administrativos, así como la reducción de plazos de tales disposiciones de carácter general, que buscan eliminar cargas al ciudadano;\nXXIV. Sistema Estatal: El Sistema Estatal de Mejora Regulatoria;\nXXV. Solicitante: La persona física o moral que busca conocer o bien realizar un trámite o servicio;\n(REFORMADA, P.O. 10 DE MAYO DE 2023)\nXXVI. Sujetos obligados: Las dependencias y entidades paraestatales de la Administración Pública Estatal y Municipales, los poderes legislativo y judicial, así como los Órganos Constitucionales Autónomos serán sujetos obligados para efectos de lo previsto en el Capítulo VI del Título Segundo de la Ley General; y\nXXVII. Trámite: Cualquier solicitud o entrega de información que las personas físicas o morales realicen ante la autoridad competente, ya sea para cumplir una obligación o con la finalidad de que se emita una regulación.\nArtículo 3°. La aplicación de la presente Ley corresponde al Sistema\nEstatal, al Consejo Estatal, la Secretaría, a las Autoridades de Mejora\nRegulatoria en los municipios, a los Poderes Legislativo y Judicial, y\nÓrganos Constitucionales Autónomos.\nArtículo 4°. Este ordenamiento no será aplicable a las materias de públicos; tampoco lo será para el Ministerio Público en ejercicio de sus funciones constitucionales.\nArtículo 5°. Para los efectos de la presente Ley, se aplicará de manera\nAguascalientes, el Código Civil del Estado de Aguascalientes y, en su caso, los principios generales del derecho, así como la demás normatividad aplicable en la materia.\nArtículo 6°. Cuando los plazos fijados por esta Ley sean en días, éstos se entenderán como días hábiles. Respecto de los establecidos en meses o años, el cómputo se hará de fecha a fecha, considerando incluso los días inhábiles.\nCuando no se especifique el plazo, se entenderán cinco días hábiles para cualquier actuación.\nTÍTULO SEGUNDO\nMEJORA REGULATORIA\nCAPÍTULO I\nPrincipios\nArtículo 7°. La mejora regulatoria es la política pública sistemática, participativa, permanente y transversal consistente en la generación de regulaciones, trámites y servicios simplificados con base en la transparencia y la consulta pública, orientada a obtener el mayor valor posible de los recursos disponibles y del óptimo funcionamiento de las actividades comerciales, industriales, productivas, de servicios y de desarrollo humano de la sociedad en su conjunto, con los menores costos posibles, a fin de hacer eficientes, agilizar y economizar los procedimientos que requieran realizar los solicitantes ante los sujetos obligados.\nArtículo 8°. Los sujetos obligados, en la expedición de las regulaciones, trámites y servicios, deberán respetar los principios de legalidad, reserva de ley, jerarquía normativa, máximo beneficio, máxima publicidad, de los objetivos de esta Ley.\nArtículo 9°. La política de mejora regulatoria se orientará por los siguientes principios:\nI. Procurar que las regulaciones que se expidan generen beneficios superiores a los costos y produzcan el máximo bienestar para la sociedad;\nII. Simplificación, mejora y no duplicidad en la emisión de regulaciones, trámites y servicios;\nIII. Seguridad jurídica que propicie la certidumbre de derechos y obligaciones;\nIV. Coherencia y armonización de las disposiciones que integran el marco regulatorio estatal;\nV. Accesibilidad tecnológica;\nVI. Proporcionalidad, prevención razonable y gestión de riesgos;\nVII. Transparencia, responsabilidad y rendición de cuentas;\nVIII. Generar seguridad jurídica, claridad y transparencia en la elaboración y aplicación de las regulaciones y resolución de trámites y servicios;\nIX. Fomento a la competitividad y el empleo;\nX. Promoción de la libre concurrencia y competencia económica, así como del funcionamiento eficiente de los mercados; y\nXI. Reconocimiento de asimetrías en el cumplimiento regulatorio.\nCAPÍTULO II\nObjetivos\nArtículo 10. La política de mejora regulatoria tiene los siguientes objetivos:\nI. Procurar que las regulaciones que se expidan generen beneficios superiores a los costos y produzcan el máximo bienestar para la sociedad;\nII. Promover la eficacia y eficiencia de las regulaciones, trámites y servicios que lleven a cabo los sujetos obligados;\nIII. Facilitar, a través del Sistema Estatal, los mecanismos de coordinación obligados para el cumplimiento de los objetivos de esta Ley;\nIV. Simplificar y modernizar los trámites y servicios;\nV. Fomentar una cultura que ponga a la persona como centro de la gestión gubernamental;\nVI. Impulsar la homologación de trámites, formatos, requerimientos, padrones y reglamentos, así como cualquier acto administrativo de los sujetos obligados;\nVII. Promover la participación de los sectores público, social, privado y académico en la política de mejora regulatoria;\nVIII. Facilitar a las personas el ejercicio de los derechos y el cumplimiento de sus obligaciones, a través de la política de mejora regulatoria;\nIX. Armonizar el marco normativo de la mejora regulatoria en el Estado atendiendo los principios de esta Ley;\nX. Facilitar y mejorar el ambiente para hacer negocios;\n(REFORMADA, P.O. 15 DE ENERO DE 2024)\nXI. Facilitar a la sociedad, el conocimiento y entendimiento de la regulación, trámites y servicios, mediante la accesibilidad y adaptabilidad en el uso de lenguaje, lo que implica que éste sea sencillo, claro y no técnico, salvo que sea necesario para la certidumbre del acto jurídico, regulación, trámite o servicio;\n(REFORMADA, P.O. 24 DE MAYO DE 2023)\nXII. Procurar que las regulaciones no impongan barreras al comercio internacional, a la libre concurrencia, a la competencia económica y al empleo;\nXIII. Favorecer la coordinación permanente entre los sujetos obligados y los sectores social y privado, en las tareas de mejora regulatoria y eficiencia gubernamental;\nXIV. Contribuir a la eliminación de la discrecionalidad, la reducción de duplicidad de requerimientos, trámites y disposiciones normativas que afecten la actividad económica, el establecimiento y operación de las empresas;\nXV. Promover reformas al marco regulatorio que faciliten y fortalezcan las actividades económicas del Estado;\nXVI. Generar seguridad jurídica, claridad y transparencia en la elaboración y aplicación de las regulaciones, trámites y servicios;\nXVII. Propiciar mecanismos que permitan la presentación formal de quejas y propuestas de mejora regulatoria y garantizar su atención;\nXVIII. Colaborar en el diseño de los planes o programas de desarrollo de los sujetos obligados, relativos a la mejora regulatoria y la simplificación administrativa;\nXIX. Atender al cumplimiento de los objetivos de esta Ley considerando las condiciones de desarrollo institucional y las capacidades técnicas, financieras y humanas;\nXX. Impulsar programas de capacitación en materia de mejora regulatoria entre los servidores públicos de los sujetos obligados;\nXXI. Promover el uso de las tecnologías de la información, así como el uso de la firma electrónica avanzada en los trámites y servicios como herramienta transversal;\nXXII. Fomentar el conocimiento por parte de la sociedad en general, de la normatividad estatal y municipal asociada con trámites y servicios públicos;\nXXIII. Coadyuvar en las acciones para reducir el costo social y económico derivado de los requerimientos de trámites y servicios establecidos por parte de los sujetos obligados;\nXXIV. Diferenciar los requisitos, trámites y servicio (sic) para facilitar el de riesgo, tamaño, rentabilidad social, ubicación en zonas de atención prioritaria, así como otras características relevantes para el desarrollo económico del Estado; y\nXXV. Los demás necesarios para el cumplimiento de los fines de la presente Ley y demás disposiciones aplicables.\nCAPÍTULO III\nSistema Estatal de Mejora Regulatoria\nSección Primera\nIntegración\nArtículo 11. El Sistema Estatal tiene por objeto coordinar a los sujetos obligados, en su respectiva competencia, a través de las normas, principios, objetivos, planes, directrices, órganos y procedimientos para la formulación, desarrollo e implementación de la Estrategia Estatal, así como la política en materia de mejora regulatoria.\nEl Sistema Estatal se coordinará con la (sic) Sistema Nacional, para\nNacional de Mejora Regulatoria.\nArtículo 12. El Sistema Estatal contará con la Estrategia Estatal como eje rector vinculante para los sujetos obligados, con el fin de articular la política de mejora regulatoria de los sujetos obligados y garantizar el cumplimiento del objeto de esta Ley.\nArtículo 13. El Sistema Estatal estará integrado por:\nI. El Consejo Estatal;\nII. Los Consejos Municipales;\nIII. Las Autoridades de Mejora Regulatoria; y\nIV. Los sujetos obligados.\nArtículo 14. Son herramientas del Sistema Estatal:\nI. El Catálogo;\nII. La Agenda Regulatoria;\nIII. El Análisis de Impacto Regulatorio;\nIV. Los Programas de Mejora Regulatoria; y\nV. Las Encuestas, Información Estadística y Evaluación en Materia de\nMejora Regulatoria.\nSección Segunda\nConsejo Estatal de Mejora Regulatoria\nArtículo 15. El Consejo Estatal es la instancia responsable de coordinar la política de mejora regulatoria, integrado por:\nque en caso de ausencia, será suplido por el Secretario de Innovación y\nGobierno Digital;\nII. La persona titular de la Secretaría General de Gobierno;\n(REFORMADA, P.O. 24 DE MAYO DE 2023)\nIII. La persona titular de la Secretaría de Innovación y Gobierno Digital;\n(REFORMADA, P.O. 24 DE MAYO DE 2023)\nIV. La persona titular de la Secretaría de Desarrollo Económico, Ciencia y\nTecnología;\n(REFORMADA, P.O. 24 DE MAYO DE 2023)\nV. La persona titular de la Secretaría de Planeación, Participación y\nDesarrollo;\n(REFORMADA, P.O. 24 DE MAYO DE 2023)\nVI. La persona titular de la Secretaría de Finanzas;\nVII. La persona titular de la Secretaría de Administración;\nVIII. La persona titular de la Contraloría del Estado;\nIX. La persona titular de la Coordinación General Ejecutiva de Gabinete;\nX. La persona titular de la Consejería Jurídica del Estado;\nXI. Las personas titulares de las Presidencias Municipales de los cuatro\nUnidades Económicas, según el Instituto Nacional de Estadística y del Consejo;\nXII. Dos personas representantes del sector empresarial;\nXIII. Una persona representante de instituciones de Educación Superior en el Estado; y\n(REFORMADA [N. DE E. ADICIONADA], P.O. 24 DE MAYO DE 2023)\nXIV. Una persona representante de organizaciones no gubernamentales en el Estado.\n(REFORMADO, P.O. 24 DE MAYO DE 2023)\nLas personas integrantes descritas en las fracciones XII, XIII y XIV del presente artículo serán designados por la persona que presida el Consejo\nEstatal.\n(REFORMADO, P.O. 24 DE MAYO DE 2023)\nLas personas integrantes del Consejo Estatal podrán designar a sus respectivos suplentes, quienes deberán tener el nivel jerárquico inmediato inferior o equivalente y tendrán las mismas atribuciones, con excepción de aquellos designados por la persona que presida el Consejo\nEstatal, cuyo suplente podrá ser nombrado también por éste.\n(REFORMADO, P.O. 24 DE MAYO DE 2023) voto en las sesiones.\ntales efectos.\nArtículo 16. Serán invitados permanentes del Consejo Estatal y podrán participar con voz, pero sin voto:\nIII. Una persona de cada uno de los Órganos Constitucionales Autónomos en el Estado; y\nIV. El o la persona titular de cada Presidencia Municipal o alcaldía de artículo 15.\nArtículo 17. El Consejo Estatal tendrá las siguientes atribuciones:\nI. Fomentar y dar seguimiento a la aplicación de las directrices, bases, instrumentos, lineamientos y mecanismos que establezca el Consejo\nNacional de Mejora Regulatoria, tendientes a la implementación de la política de mejora regulatoria;\nII. Conocer e implementar, en el ámbito de su competencia, la Estrategia\nNacional de Mejora Regulatoria;\nIII. Aprobar la Estrategia Estatal y la Agenda Regulatoria;\n(REFORMADA, P.O. 10 DE MAYO DE 2023)\nIV. Fomentar y dar seguimiento a la implementación de los mecanismos que determine el Consejo Nacional de Mejora Regulatoria, sobre el suministro, intercambio, sistematización y actualización de la información que sobre esta materia generen los sujetos obligados y las\nAutoridades de Mejora Regulatoria;\nV. Conocer, analizar y atender los resultados de las encuestas, información estadística y evaluación en materia de mejora regulatoria;\nVI. Fomentar y dar seguimiento a la implementación de los indicadores que apruebe el Consejo Nacional de Mejora Regulatoria, que las\nAutoridades de Mejora Regulatoria y los sujetos obligados, deberán la mejora regulatoria y la simplificación de trámites y servicios;\nVII. Conocer y opinar, en el ámbito de su competencia, sobre la evaluación de resultados a la que se refiere la fracción anterior;\nVIII. Promover el uso de principios, objetivos, metodologías, instrumentos, programas, criterios y herramientas acordes con las buenas prácticas estatales, nacionales e internacionales en materia de mejora regulatoria;\nIX. Conocer problemáticas, obstáculos y fallos regulatorios que impidan el solución;\nX. Emitir recomendaciones a los sujetos obligados para el debido cumplimiento de las disposiciones de esta Ley;\nXI. Conocer, analizar y emitir recomendaciones derivadas de las propuestas que emita el Observatorio Nacional de Mejora Regulatoria;\nXII. Conformar grupos de trabajo especializados para la consecución de los objetivos de esta Ley;\n(REFORMADA, P.O. 24 DE MAYO DE 2023)\nXIII. Aprobar su Reglamento Interior;\n(ADICIONADA, P.O. 24 DE MAYO DE 2023)\nXIV. Notificar al Consejo Nacional de las designaciones de la autoridad de mejora regulatoria en el estado; el informe anual de actividades del\nConsejo, que deberá contener al menos un reporte de la implementación de la Estrategia Nacional de Mejora Regulatoria; así como los mecanismos de coordinación establecidos entre el Consejo estatal con los municipios del Estado; y\nXV. Las demás que establezcan esta Ley u otras disposiciones normativas aplicables.\nArtículo 18. El Consejo Estatal sesionará de forma ordinaria por lo menos naturaleza de los temas a tratar, a juicio del Presidente del Consejo\nSe deberá convocar a los miembros del Consejo Estatal, por conducto del secretario ejecutivo, con una anticipación de por lo menos diez días en extraordinarias.\nde por lo menos la mitad más uno de sus integrantes, sus acuerdos deberán tomarse preferentemente por consenso, pero tendrán validez cuando sean aprobados por mayoría de votos de los presentes y, en caso de empate, el presidente del Consejo Estatal tendrá voto de calidad.\npertinentes, quienes podrán participar con voz, pero sin voto.\nde manera honorífica, por lo que no recibirán retribución económica alguna por las funciones que desempeñen con tal carácter.\nArtículo 19. El Consejo Estatal contará con un secretario ejecutivo, quien responsable de coordinar la política pública de mejora regulatoria y tendrá las siguientes facultades:\nI. Elaborar y distribuir, en acuerdo con el presidente del Consejo Estatal, la convocatoria y orden del día de las sesiones;\nII. Compilar los acuerdos que se tomen en el Consejo Estatal, llevar el archivo de estos y de los instrumentos jurídicos que deriven, y expedir constancia de los mismos;\nIII. Elaborar y publicar informes de actividades del Consejo Estatal;\nIV. Solicitar la publicación en el Periódico Oficial del Estado de los instrumentos a los que se refieren las fracciones I, III y XIII del artículo 17 de esta Ley;\nV. Recibir e integrar la Agenda Regulatoria;\nVI. Ejecutar los acuerdos, directrices y demás resoluciones adoptados por el Consejo Estatal, en el ámbito de su competencia;\nVII. Solicitar la publicación en el Periódico Oficial del Estado de los lineamientos, acuerdos y demás disposiciones necesarias para el funcionamiento de la Estrategia Estatal;\nVIII. Participar en representación de la Secretaría en foros, conferencias, coloquios, diplomados, seminarios, talleres, reuniones, eventos, nacionales e internacionales, cuando se refieran a temas relacionados regulatoria;\nIX. Colaborar con las Autoridades de Mejora Regulatoria para fortalecer y hacer eficientes los mecanismos de coordinación;\nX. Convocar, a petición del Presidente, a las sesiones del Consejo Estatal; y\nXI. Las demás que le confieran esta Ley y cualquier otra disposición normativa aplicable.\nSección Tercera\nEstrategia Estatal de Mejora Regulatoria\nArtículo 20. La Estrategia Estatal es el instrumento programático que de esta Ley. Deberá estar alineada con la Estrategia Nacional de Mejora\nRegulatoria y el Plan Estatal de Desarrollo y ser aprobada por el Consejo\nEstatal y publicada en el Periódico Oficial del Estado de Aguascalientes.\nLa Estrategia Estatal será vinculante para los sujetos obligados.\nArtículo 21. La Estrategia Estatal comprenderá, al menos, lo siguiente:\nI. Un diagnóstico por parte de la Secretaría de la situación de la política de mejora regulatoria en el Estado;\nII. Las buenas prácticas estatales, nacionales e internacionales en materia de mejora regulatoria;\nIII. Los objetivos en el corto, mediano y largo plazo en materia de mejora regulatoria;\nIV. Los elementos para la instrumentación de la mejora regulatoria;\nV. Las acciones, medidas y programas de mejora regulatoria que económico estatal;\nVI. Las herramientas de mejora regulatoria, así como su uso sistemático;\nVII. Las metodologías para la aplicación de las herramientas de la mejora regulatoria;\nVIII. Las metodologías para el diagnóstico periódico del acervo regulatorio;\nIX. Las políticas y acciones específicas para atender la problemática regulatoria de materias, sectores o regiones del Estado;\nX. Las directrices, mecanismos y lineamientos técnicos para integrar, actualizar y operar el Catálogo, incluyendo procedimientos, formatos y correspondiente;\nXI. Los lineamientos generales para la aplicación del Análisis de Impacto\nRegulatorio;\nXII. Los criterios para revisar, actualizar y mejorar el acervo regulatorio estatal;\nXIII. Los mecanismos para fortalecer las capacidades jurídicas e institucionales en materia de mejora regulatoria;\nXIV. Las medidas para reducir, simplificar y, en su caso, automatizar trámites y servicios;\nXV. Los mecanismos de observación y cumplimiento de indicadores que permitan conocer el avance de los objetivos, programas y acciones derivados de la política de mejora regulatoria;\nXVI. Los estándares mínimos para asegurar la correcta implementación\nLey, incluyendo entre otros, la consulta pública, transparencia y rendición regulación;\nXVII. Los mecanismos de coordinación para garantizar la congruencia de la regulación que expidan los sujetos obligados en términos de esta Ley;\nXVIII. Los mecanismos que regulen el procedimiento a que se sujete la\nProtesta Ciudadana; y\nXIX. Los demás que señale esta Ley, otras disposiciones jurídicas aplicables y las necesarias para el cumplimiento de sus objetos.\nSección Cuarta\nArtículo 22. En materia de Mejora Regulatoria la Secretaría tiene como trámites y servicios, así como la transparencia en la elaboración y aplicación de los mismos, procurando que generen beneficios superiores a sus costos y el máximo beneficio para la sociedad.\n(REFORMADO, P.O. 30 DE SEPTIEMBRE DE 2022)\nLa Secretaría en materia de Mejora Regulatoria y la Secretaría de\nDesarrollo Económico en lo relativo a la Gestión Empresarial, deberán contar en su estructura orgánica, con las Unidades Administrativas necesarias, de acuerdo con el presupuesto establecido para tal efecto.\n(REFORMADO PRIMER PÁRRAFO, P.O. 30 DE SEPTIEMBRE DE 2022)\nArtículo 23. La Secretaría, a través de su Unidad Administrativa encargada de la Mejora Regulatoria, tendrá las siguientes atribuciones:\nI. Desempeñar las funciones de coordinación, supervisión y ejecución que establece esta Ley, promoviendo la mejora regulatoria y la competitividad en el Estado;\n(REFORMADA, P.O. 10 DE MAYO DE 2023)\nII. Dictaminar las propuestas regulatorias y los Análisis de Impacto\nRegulatorio correspondientes a la Administración Pública Estatal;\nIII. Proponer al Consejo Estatal la Estrategia Estatal y desarrollar, monitorear, evaluar y dar seguimiento y publicidad a la misma;\nIV. Proponer al Consejo Estatal la emisión de directrices, instrumentos, lineamientos, mecanismos y buenas prácticas para el cumplimiento del objeto de esta Ley;\nV. Proponer al Consejo Estatal las metodologías para la organización y sistematización de la información administrativa y estadística, así como mejora regulatoria;\nVI. Establecer los mecanismos para dar publicidad a la Agenda\nRegulatoria de los sujetos obligados de la Administración Pública Estatal;\nVII. Promover la evaluación de regulaciones existentes a través del\nAnálisis de Impacto Regulatorio ex post;\nVIII. Proponer, coordinar, publicar, monitorear, opinar y evaluar los\nAdministración Pública Estatal, así como emitir los Lineamientos para su operación;\nIX. Administrar el Catálogo y supervisar que los sujetos obligados de la administración pública estatal tengan actualizada la parte que les corresponde del Catálogo Nacional/Estatal de Regulaciones, Trámites y\nServicios, así como mantener actualizado el segmento de las regulaciones; de conformidad con la Ley General y los lineamientos que para tal efecto emita la Comisión Nacional de Mejora Regulatoria;\nX. Establecer acuerdos y convenios de colaboración, concertación y coordinación que contribuyan al cumplimiento de los objetivos de la mejora regulatoria;\nXI. Promover el uso de los medios de comunicación electrónica, así como el uso de la firma electrónica avanzada, a fin de hacer más eficientes los servicios y trámites;\nXII. Promover entre los sujetos obligados la revisión de su acervo regulatorio y de sus trámites y servicios;\nXIII. Brindar asesoría técnica y capacitación en materia de mejora regulatoria a los sujetos obligados;\nXIV. Revisar el marco regulatorio estatal, diagnosticar su aplicación y, en su caso, brindar asesoría a las autoridades competentes para mejorar la regulación en actividades o sectores económicos específicos;\nXV. Proponer a los sujetos obligados acciones, medidas o programas que económico del Estado, y coadyuvar en su promoción e implementación;\nXVI. Calcular el costo económico de los trámites y servicios, con la\nAdministración Pública Estatal;\nXVII. Interpretar lo previsto en esta Ley para efectos administrativos dentro del ámbito de la Administración Pública Estatal;\nXVIII. Celebrar acuerdos interinstitucionales en materia de mejora regulatoria;\nXIX. Promover el estudio, divulgación y aplicación de la política de mejora regulatoria;\nXX. Integrar y administrar, así como supervisar que los sujetos obligados mantengan actualizada la información que les corresponde en el\nRegistro Nacional de Regulaciones y sus Registros de Trámites y\nServicios, atendiendo a lo establecido en los artículos 40 a 48 de la Ley\nGeneral;\nXXI. Elaborar y presentar al Consejo Estatal un informe anual sobre los avances, resultados y retos de la política pública de mejora regulatoria;\nXXII. Elaborar y promover programas académicos directamente o en colaboración con otras instituciones para la formación de capacidades en materia de mejora regulatoria;\nXXIII. Convocar y organizar foros, conferencias, coloquios, diplomados, seminarios, talleres, reuniones, eventos, convenciones y congresos de mejora regulatoria;\nXXIV. Crear, desarrollar, proponer y promover programas específicos de simplificación y mejora regulatoria;\nXXV. Procurar que las acciones y programas de mejora regulatoria de los sujetos obligados se rijan por los mismos estándares de operación;\nXXVI. Sistematizar y dar seguimiento a la Estrategia Nacional de Mejora\nRegulatoria en el ámbito de la administración pública estatal; y\nXXVII. Las demás atribuciones que establezcan esta Ley y otras disposiciones jurídicas aplicables.\nArtículo 24. La Secretaría proporcionará el apoyo que resulte necesario\nNacional de Mejora Regulatoria, conforme a lo previsto en la Ley General.\nSección Quinta\nMunicipios\nArtículo 25. Para el cumplimiento de los objetivos de la Ley, los disposiciones jurídicas de mejora regulatoria.\nel Presidente Municipal.\nLa Autoridad de Mejora Regulatoria será el área de coordinación y comunicación entre el sujeto obligado municipal y la Secretaría, y tendrá las atribuciones previstas en la Ley y en las disposiciones normativas aplicables.\nArtículo 26. Compete a los municipios en materia de mejora regulatoria, lo siguiente:\nI. Coordinar por medio de la Autoridad de Mejora Regulatoria Municipal correspondiente a las dependencias y entidades municipales con los demás sujetos obligados y con los organismos estatales y federales, en los programas y acciones que lleven a cabo para lograr el cumplimiento de la Ley;\nII. Elaborar la Agenda Regulatoria y las acciones para lograr una mejora regulatoria integral, bajo los principios de máxima utilidad para la sociedad y transparencia; y\nIII. Las demás que establezca la Ley y otras disposiciones normativas aplicables.\nLos titulares de las dependencias y de las entidades paramunicipales, inferior a ellos, quien será el Enlace de Mejora Regulatoria y tendrá las para tal efecto se emitan.\nArtículo 27. Los Consejos Municipales se conformarán y sesionarán en sus Ayuntamientos.\nArtículo 28. Los Consejos Municipales tendrán, en su ámbito de competencia, las facultades y responsabilidades siguientes:\nI. Establecer acciones, estrategias y lineamientos conforme a los cuales se\nLey General y esta Ley;\nII. Aprobar el programa de mejora regulatoria y la Agenda Regulatoria;\nIII. Aprobar la suscripción de convenios interinstitucionales de coordinación y cooperación en la materia con dependencias y entidades federales y/o estatales, y con otros municipios;\nIV. Proponer las acciones necesarias para optimizar el proceso de mejora regulatoria en las dependencias y entidades municipales;\nV. Aprobar el proyecto de Reglamento de Mejora Regulatoria Municipal y canalizarlo al H. Ayuntamiento correspondiente para su análisis y, en caso, aprobación; y\nVI. Las demás que le confiera esta Ley y demás disposiciones normativas aplicables.\nSección Sexta\nSujetos obligados\nArtículo 29. Los titulares de los sujetos obligados designarán a un servidor público como Enlace de Mejora regulatoria, conforme a lo previsto en el artículo 13 de la Ley General, mismo que será responsable de coordinar, Estrategia Estatal al interior de cada sujeto obligado, de conformidad con lo dispuesto en la propia Ley General, en esta Ley y en las demás disposiciones normativas aplicables.\nregulatoria, el Enlace de Mejora Regulatoria se auxiliará por un enlace operativo, así como por los titulares de las áreas responsables de los trámites y servicios.\nde Mejora Regulatoria correspondiente, se llevará a cabo a través del\nEnlace de Mejora Regulatoria.\nArtículo 29 Bis. Los Sujetos Obligados deberán asegurase de que las\nRegistro Estatal de Regulaciones. En caso de que la Autoridad de Mejora\nRegulatoria identifique errores u omisiones en la información inscrita, efectuará un apercibimiento al Sujeto Obligado para que éste subsane la información en un plazo que no deberá exceder de diez días.\n(REFORMADO PRIMER PÁRRAFO, P.O. 10 DE MAYO DE 2023)\nArtículo 30. Son atribuciones del Enlace de Mejora Regulatoria las siguientes:\nI. Coordinar el proceso de mejora regulatoria al interior del sujeto obligado y supervisar su cumplimiento, de conformidad con la presente\nLey y los lineamientos que se emitan para tal efecto;\n(REFORMADA, P.O. 10 DE MAYO DE 2023)\nII. Elaborar, de acuerdo con el calendario aplicable, un Programa de\nMejora Regulatoria en relación con su Regulación, Trámites y Servicios, así como reportes periódicos sobre los avances correspondientes, lo anterior, para que el sujeto obligado lo someta a consideración de la\nAutoridad de Mejora Regulatoria;\n(REFORMADA, P.O. 10 DE MAYO DE 2023)\nIII. Dar seguimiento a la ejecución del Programa de Mejora Regulatoria de su sujeto obligado;\nIV. Suscribir y enviar a la Secretaría, o a la Autoridad de Mejora\nRegulatoria que corresponda, las propuestas regulatorias y el Análisis de\nImpacto Regulatorio que deba elaborar su sujeto obligado;\nV. Realizar las actualizaciones que correspondan a su sujeto obligado, en\nServicios, atendiendo a lo establecido en los artículos 40 a 48 de la Ley\nGeneral;\nVI. Dar seguimiento a las observaciones remitidas por la Autoridad de\nMejora Regulatoria, respecto a los errores u omisiones que, en su caso, Trámites y Servicios, de conformidad con los artículos 42 y 44 de la Ley\nGeneral;\nVII. Recibir y atender, en el ámbito de su competencia, las quejas y propuestas regulatorias de las empresas y los ciudadanos;\n(REFORMADA, P.O. 10 DE MAYO DE 2023)\nVIII. Trabajar de manera permanente y coordinada con la Autoridad de\nMejora Regulatoria para el cumplimiento de los objetivos de la Estrategia\nEstatal;\n(REFORMADA, P.O. 10 DE MAYO DE 2023)\nIX. Dar seguimiento a la implementación de las herramientas de mejora regulatoria en su sujeto obligado;\n(REFORMADA, P.O. 10 DE MAYO DE 2023)\nX. Elaborar un informe anual sobre las acciones y resultados en materia de mejora regulatoria, para que su sujeto obligado lo presente al Consejo\nEstatal;\nXI. Analizar propuestas ciudadanas enfocadas a impulsar la competitividad; y\nXII. Las demás que señalen las disposiciones normativas aplicables.\nCAPÍTULO IV\nArtículo 31. Los Poderes Legislativo y Judicial, así como los Órganos\nConstitucionales Autónomos, atendiendo a su presupuesto, deberán designar, dentro de su estructura orgánica, una instancia responsable la Ley General en relación con el Catálogo Nacional de Regulaciones, Trámites y Servicios, o bien, coordinarse con la Secretaria.\njurisdiccionales.\nTÍTULO TERCERO\nHERRAMIENTAS DE MEJORA REGULATORIA\nCAPÍTULO I\nCatálogo Estatal de Regulaciones, Trámites y Servicios\nArtículo 32. El Catálogo Estatal de Regulaciones, Trámites y Servicios es la herramienta tecnológica que compila las regulaciones, los trámites y los servicios de los sujetos obligados, con el objeto de otorgar seguridad jurídica a las personas, dar transparencia, facilitar el cumplimiento regulatorio, así como fomentar el uso de tecnologías de la información.\nDicha herramienta tiene carácter público y su información es vinculante para los sujetos obligados, en el ámbito de sus competencias.\nArtículo 33. El Catálogo estará integrado por:\nI. El Registro Estatal;\nII. El Registro de Regulaciones\nIII. El Expediente para Trámites y Servicios;\nIV. El Registro de Visitas Domiciliarias, Inspecciones y Verificaciones; y\nV. La Protesta Ciudadana.\nSección Primera\nRegistro Estatal de Trámites y Servicios\nArtículo 34. El Registro Estatal es la herramienta tecnológica, con carácter público, que compila los trámites y servicios de los sujetos obligados, con el objeto de otorgar seguridad jurídica a las personas, dar transparencia, facilitar el cumplimiento regulatorio, así como fomentar el uso de tecnologías de la información.\npermanente y obligatorio para los sujetos obligados.\nArtículo 35. La Secretaría será la responsable de administrar y operar el\nRegistro Estatal; sin embargo, es responsabilidad de los sujetos obligados, ingresar y actualizar los registros de sus trámites y servicios. La legalidad y el contenido de la información que inscriban los sujetos obligados son de su estricta responsabilidad.\nSi la Secretaría identifica errores y omisiones en la información ingresada al Registro Estatal, deberá notificarlas al sujeto obligado dentro de un plazo de cinco días hábiles, a partir de que identificó el error, dichas observaciones deberán ser atendidas por los sujetos obligados en un plazo de cinco días a partir del día siguiente a que reciban la notificación.\nUna vez agotado el procedimiento anterior y habiéndose solventado las observaciones, el sujeto obligado publicará dentro del término de cinco días la información en el Registro Estatal.\nLa omisión o la falsedad de la información que los sujetos obligados inscriban en el Registro Estatal será sancionada en términos de la Ley de\nResponsabilidades Administrativas del Estado de Aguascalientes.\nLa Secretaría deberá publicar el Registro Estatal en el portal de internet solicitantes.\najustará a lo previsto en esta Ley y sus disposiciones reglamentarias.\nArtículo 36. Los sujetos obligados deberán inscribir y mantener trámites y servicios:\nI. Nombre y descripción del trámite o servicio;\nII. Modalidad;\nIII. Fundamento jurídico de la existencia del trámite o servicio;\nIV. Descripción con lenguaje claro, sencillo y conciso de los casos en que debe o puede realizarse el trámite o servicio, y los pasos que debe llevar a cabo el particular para su realización;\nV. Enumerar y detallar los requisitos. En caso que existan requisitos que necesiten alguna firma, validación, certificación, autorización o visto bueno de un tercero, se deberá señalar la persona o empresa que lo emita. En caso de que el trámite o servicio que se esté inscribiendo incluya como requisitos la realización de trámites o servicios adicionales, deberá de identificar plenamente los mismos, señalando además el sujeto obligado ante quien se realiza;\nVI. Especificar si el trámite o servicio debe presentarse mediante formato, escrito libre, ambos o puede solicitarse por otros medios;\nVII. El formato correspondiente y la última fecha de publicación en el\nPeriódico Oficial del Estado de Aguascalientes;\nVIII. En caso de requerir inspección o verificación, señalar el objetivo de la misma;\nIX. Datos de contacto oficial del sujeto obligado responsable del trámite o servicio;\nX. Plazo que tiene el sujeto obligado para resolver el trámite o servicio y, en su caso, si aplica la afirmativa o la negativa ficta;\nXI. El plazo con el que cuenta el sujeto obligado para prevenir al prevención;\nXII. Monto de los derechos o aprovechamientos aplicables, en su caso, o la forma de determinar dicho monto, así como las alternativas para realizar el pago;\nXIII. Vigencia de los avisos, permisos, licencias, autorizaciones, registros y demás resoluciones que se emitan;\nXIV. Criterios de resolución del trámite o servicio, en su caso;\nXV. Todas las unidades administrativas ante las que se puede presentar el trámite o solicitar el servicio, incluyendo su domicilio;\nXVI. Horarios de atención al público;\nXVII. Números de teléfono y medios electrónicos de comunicación, así permita el envío de consultas, documentos y quejas;\nXVIII. La información que deberá conservar para fines de acreditación, inspección y verificación con motivo del trámite o servicio; y\nXIX. La demás información que se prevea en la Estrategia Estatal.\npermitan la clara y sencilla identificación de todo lo que se requiere a los solicitantes.\nTratándose de las fracciones V, VI, VIII, X, XI, XII, XIII, XIV y XVIII los sujetos obligados deberán establecer el fundamento jurídico aplicable, relacionándolo con la regulación inscrita en los Registros Nacional y\nEstatal de Regulaciones.\n(REFORMADO [N. DE E. ADICIONADO], P.O. 24 DE MAYO DE 2023)\nArtículo 37. Los sujetos obligados deberán inscribir en el Registro Estatal la información a que se refiere el artículo anterior y la Secretaría deberá efectuar la publicación sin cambio alguno, dentro de los cinco días hábiles siguientes, siempre que la disposición que dé fundamento a la actualización de la información contenida en el Catálogo se encuentre vigente. En caso contrario, la Secretaría no podrá efectuar la publicación correspondiente sino hasta la entrada en vigor de la disposición que fundamente tal modificación.\nLos sujetos obligados deberán inscribir, modificar o eliminar trámites y disposición que lo fundamente.\nCatálogo.\nArtículo 38. Los sujetos obligados no deberán aplicar trámites y servicios adicionales a los establecidos en el Registro Estatal, ni podrán exigir mismo, salvo que:\nI. La existencia del trámite o servicio sea por única ocasión y no exceda los sesenta días; o\nII. Respecto de los cuales se pueda causar perjuicio a terceros con interés jurídico.\nEn tales supuestos, los sujetos obligados deberán dar aviso previo a la\nSecretaría.\nEn caso de incumplimiento del artículo anterior, la Secretaría dará aviso a la autoridad competente para que realice la investigación y, en su caso, aplique la sanción que corresponda de acuerdo con la Ley de\nResponsabilidades Administrativas del Estado de Aguascalientes.\nSección Segunda\nRegistro de Regulaciones\n(REFORMADO [N. DE E. ADICIONADO], P.O. 24 DE MAYO DE 2023)\nArtículo 39. El Registro de Regulaciones es una herramienta tecnológica que compila las regulaciones aplicables a los sujetos obligados.\nLa Secretaría General de Gobierno en coordinación con la Secretaría, deberá publicar y administrar el Registro de Regulaciones de conformidad con la normatividad aplicable.\npermanentemente la información que les corresponde, y deberán encuentren contenidas en el Registro de Regulaciones.\nsujeto obligado, corresponderá a la Secretaría su registro y actualización.\nArtículo 40. El Registro de Regulaciones deberá contemplar, de conformidad con lo establecido en la Ley General, lo siguiente:\nI. Nombre de la regulación;\nII. Fecha de expedición, publicación, o en su caso, vigencia de la regulación;\nIII. Autoridad o autoridades que la emiten;\nIV. Autoridad o autoridades que la aplican;\nV. Ámbito de aplicación;\nVI. Fechas en que ha sido actualizada;\nVII. Tipo de ordenamiento jurídico;\nVIII. Índice de la regulación;\nIX. Objeto de la regulación;\nX. Materias reguladas;\nXI. Sectores regulados;\nXII. Sujetos regulados;\nXIII. Otras regulaciones vinculadas o derivadas de esta regulación;\nXIV. Trámites y servicios relacionados con la regulación;\nXV. Fundamento jurídico para la realización de inspecciones, verificaciones y visitas domiciliarias; y\nXVI. La demás información que se prevea en las disposiciones normativas aplicables.\nSección Tercera\nExpediente para Trámites y Servicios\nArtículo 41. El Expediente para Trámites y Servicios operará conforme a los lineamientos que aprueben el Consejo Nacional y el Consejo Estatal, considerando mecanismos confiables de seguridad, disponibilidad, integridad, autenticidad, confidencialidad y custodia.\nLos sujetos obligados, en el ámbito de su competencia, incluirán en sus sujetos obligados, a través del Expediente para Trámites y Servicios, el acceso, consulta y transferencia de manera segura de las actuaciones electrónicas que se generen con motivo de un trámite o servicio.\nArtículo 42. Los sujetos obligados no podrán solicitar información que ya consté en el Expediente para Trámites y Servicios, ni podrán requerir documentación que tengan en su poder, por lo que sólo podrán solicitar aquella información y documentación particular o adicional, que esté prevista en el Catálogo.\n(REFORMADO [N. DE E. ADICIONADO], P.O. 24 DE MAYO DE 2023)\nArtículo 43. Los documentos electrónicos que integren los sujetos obligados al Expediente para Trámites y Servicios conforme a lo dispuesto por esta Ley, producirán los mismos efectos que las leyes otorgan a los documentos firmados autógrafamente y, en consecuencia, tendrán el mismo valor probatorio que las disposiciones aplicables les otorgan a éstos.\n(REFORMADO [N. DE E. ADICIONADO], P.O. 24 DE MAYO DE 2023)\nArtículo 44. Los sujetos obligados integrarán al Expediente para Trámites y Servicios los documentos firmados autógrafamente cuando se encuentre en su poder el documento original y se cumpla con lo siguiente:\nI. Que la migración a una forma digital haya sido realizada o supervisada por un servidor público que cuente con facultades de certificación de documentos en términos de las disposiciones aplicables;\nII. Que la información contenida en el documento electrónico se consulta;\nIII. Que el documento electrónico permita conservar el formato del documento impreso y reproducirlo con exactitud; y que se refiere la fracción I de este artículo.\nArtículo 45. Para efectos de esta Ley, tratándose de procedimientos empresas, el Expediente Electrónico Empresarial hará las veces del\nExpediente para Trámites y Servicios.\nSección Cuarta\nRegistro de Visitas Domiciliarias, Inspecciones y Verificaciones\nArtículo 46. El Registro de Visitas Domiciliarias, Inspecciones y\nVerificaciones estará integrado por:\nI. El Padrón;\nII. El listado de inspecciones, verificaciones y visitas domiciliarias que pueden realizar los sujetos obligados;\nIII. Los números telefónicos de los órganos internos de control del sujeto obligado al que pertenezcan los inspectores, verificadores y visitadores respectivos para presentar quejas y/o denuncias;\nIV. Los números telefónicos de las autoridades competentes encargadas de ordenar inspecciones, verificaciones y visitas domiciliarias, con la finalidad de que las personas puedan cerciorarse de la veracidad de las mismas; y\nV. La información que se determine en los lineamientos que al efecto expidan el Consejo Nacional y el Consejo Estatal.\nArtículo 46 Bis. Lo dispuesto en el artículo anterior no será aplicable a aquellas inspecciones, verificaciones o visitas domiciliarias requeridas para atender una situación de emergencia.\nPara tales efectos, dentro de un plazo de cinco días posteriores a la emergencia, el Sujeto Obligado deberá inscribir al registro las inspecciones o inspectores correspondientes, así mismo deberá informar a nuevos inspectores, verificadores, ejecutores, visitadores o supervisores requeridos para atender la situación de emergencia, o en su caso, las inspecciones, verificaciones y visitas domiciliarias.\nArtículo 47. El Padrón contendrá la lista de servidores públicos autorizados para realizar las visitas domiciliarias, inspecciones y verificaciones en el ámbito administrativo.\nEn caso de visitas domiciliarias, inspecciones y verificaciones requeridas para atender situaciones de emergencia, los sujetos obligados podrán habilitar a nuevos inspectores o verificadores, siempre y cuando dentro ante la Autoridad de Mejora Regulatoria correspondiente.\n(REFORMADO [N. DE E. ADICIONADO], P.O. 24 DE MAYO DE 2023)\nArtículo 48. La Secretaría será la responsable de administrar y publicar la información del Padrón.\nLas Autoridades de Mejora Regulatoria serán las responsables de supervisar y coordinar el Padrón en el ámbito de sus competencias.\nLos sujetos obligados serán los responsables de ingresar y actualizar la información al Padrón de los servidores públicos a que se (sic) hace referencia el artículo anterior, incluyendo información estadística sobre inspecciones, verificaciones y visitas domiciliarias realizadas en el periodo a reportar y la demás información que se prevea en la Estrategia Estatal, misma que determinará la periodicidad para su actualización.\nEn caso de que la Secretaría identifique errores u omisiones en la información proporcionada, lo comunicará al sujeto obligado en un plazo de cinco días.\nEstas observaciones tendrán carácter vinculante para el sujeto obligado, dichas observaciones. Una vez agotado el procedimiento anterior y habiéndose solventado las observaciones, la Secretaría publicará dentro del término de cinco días la información en el Padrón.\nSección Quinta\nProtesta Ciudadana\nArtículo 49. El solicitante podrá presentar una Protesta Ciudadana trámite o servicio, sin causa justificada, niegue la gestión, o altere o incumpla lo previsto en los artículos 36 fracciones V, VI, VIII, IX, X, XI, XII, XIII, XIV, XV, XVI, XVII y XVIII, y 38 de la Ley.\nArtículo 50. Las Autoridades de Mejora Regulatoria dispondrán lo tanto de manera presencial como electrónica. Recibida la Protesta, la\nAutoridad de Mejora Regulatoria emitirá su opinión en un plazo de cinco días, dando contestación al ciudadano que la presentó, dará vista de la misma al sujeto obligado y, en su caso, al órgano competente en materia de responsabilidades.\nEl procedimiento de la Protesta Ciudadana se regulará conforme a los lineamientos que emita el Consejo Estatal, los que deberán estar conforme a los que emita el Consejo Nacional.\nLas Autoridades de Mejora Regulatoria darán seguimiento a la atención que los sujetos obligados y los órganos competentes en materia de responsabilidades den a la Protesta Ciudadana, lo que informarán anualmente al Consejo Estatal.\nCAPÍTULO II\nAgenda Regulatoria\n(REFORMADO, P.O. 10 DE MAYO DE 2023)\nArtículo 51. La Agenda Regulatoria es la herramienta regulada en el Título\nTercero, Capítulo II de la Ley General, misma que los sujetos obligados cinco días de los meses de mayo y noviembre de cada año, para que de diciembre a mayo respectivamente.\npúblico la Regulación que pretenden expedir en dichos periodos, sujetándose al trámite que, para el efecto, establece la Ley General.\nArtículo 52. La Agenda Regulatoria será pública, podrá consultarse a través del portal de internet y deberá contener, al menos, la información que refiere el artículo 64 de la Ley General.\nCAPÍTULO III\nAnálisis de Impacto Regulatorio\nArtículo 54. El Análisis de Impacto Regulatorio es la herramienta regulada en el Título Tercero, Capítulo III de la Ley General, que tiene por objeto costos y que éstas representen la mejor alternativa para atender una problemática específica; su finalidad es garantizar que las Regulaciones salvaguarden el interés general, considerando los impactos o riesgos de la actividad a regular, así como las condiciones institucionales de los sujetos obligados.\nConforme al artículo 5o de la Ley General, las regulaciones, para que produzcan efectos jurídicos, deberán ser publicadas por los sujetos obligados en el Periódico Oficial del Estado de Aguascalientes.\n(REFORMADO, P.O. 10 DE MAYO DE 2023)\nArtículo 55. Conforme al artículo 66 de la Ley General, en el ámbito estatal y municipal, cada Autoridad de Mejora Regulatoria expedirá el Manual generales aprobados por el Consejo Nacional.\nCAPITULO IV\nProgramas de Mejora Regulatoria\nSección Primera\nProgramas de Mejora Regulatoria\n(REFORMADO, P.O. 10 DE MAYO DE 2023)\nArtículo 70. Los Programas de Mejora Regulatoria, son una herramienta regulada en el Título Tercero, Capítulo IV, Sección I de la Ley General, que tienen por objeto mejorar la Regulación vigente e implementar acciones de simplificación de Trámites y Servicios.\nEn términos de lo establecido en el artículo 80 de la Ley General, la los calendarios, mecanismos, formularios e indicadores para la implementación de los Programas de Mejora Regulatoria, los cuales, cada sujeto obligado, someterá a la propia Autoridad de Mejora\nRegulatoria; dichos Programas, tendrán una vigencia anual, bienal o por el tiempo que dure la administración, conforme a lo previsto en la Ley\nGeneral.\nSección Segunda\nArtículo 78. Los programas específicos de simplificación y mejora regulatoria, son la herramienta regulada en el Título Tercero, Capítulo IV,\nSección II de la Ley General, para promover que las regulaciones, trámites y servicios de los sujetos obligados cumplan con el objeto de la Ley\nGeneral y esta Ley, a través de certificaciones otorgadas por la Autoridad de Mejora Regulatoria, y para fomentar la aplicación de buenas prácticas nacionales e internacionales en materia de mejora regulatoria.\nConforme al artículo 85 de la Ley General, en la creación y diseño de los\nProgramas Específicos de Simplificación y Mejora Regulatoria, la autoridades competentes en la materia.\nCAPÍTULO V\nEncuestas, Información Estadística y Evaluación en Materia de Mejora\nRegulatoria\nArtículo 82. Las Encuestas, Información Estadística y Evaluación en\nMateria de Mejora Regulatoria, son la herramienta regulada (sic) en el\nTítulo Tercero, Capítulo V de la Ley General.\nArtículo 83. El Consejo Estatal coadyuvará con el Consejo Nacional de\nMejora Regulatoria, a fin de compartir la información relativa a los registros administrativos, censos y encuestas que, por su naturaleza estadística, sean requeridos por el Instituto Nacional de Estadística y nacionales en materia de mejora regulatoria.\nConforme al artículo 91 de la Ley General, los sujetos obligados y la\nAutoridad de Mejora Regulatoria deberán brindar todas las facilidades y proporcionar la información en materia de mejora regulatoria que les sea requerida por el Instituto Nacional de Estadística y Geografía.\nEn los ámbitos estatal y municipal, los sujetos obligados y la Autoridad de\nMejora Regulatoria, también deberán brindar todas las facilidades y proporcionar la información que les requiera el Observatorio Nacional de\nMejora Regulatoria.\nAdicionalmente, la Secretaría deberá promover, entre los sectores social, privado, público y académico, la realización de las encuestas sobre aspectos generales y específicos que permitan conocer el estado que guarda la mejora regulatoria en el Estado.\nTITULO CUARTO\nGESTIÓN EMPRESARIAL\nCAPÍTULO I\nApertura y Operación de Negocios\nArtículo 84. La Secretaría de Innovación y Gobierno Digital con el objetivo de generar y promover un mejor clima de negocios, trabajará de manera ciclo de la apertura y operación de negocios. Para ello se apoyará de:\nI. Centros de Atención Empresarial; y\nII. Ventanilla Digital Empresarial.\nArtículo 85. Los Centros de Atención Empresarial serán las áreas físicas, integradas con los recursos humanos, materiales y tecnológicos que los para trámites o actos administrativos, con la finalidad de brindar una atención integral a los emprendedores, así como a las micro, pequeñas y medianas empresas.\nArtículo 86. La Ventanilla Digital Empresarial será la herramienta digital, los trámites relacionados con la apertura y funcionamiento de una empresa.\n(REFORMADO, P.O. 30 DE SEPTIEMBRE DE 2022)\nLos municipios trabajarán coordinadamente en la Secretaría de\nInnovación y Gobierno Digital para implementar la Ventanilla Digital, permitiendo la interacción e intercambio de información a fin de hacer eficientes los trámites y servicios.\nLa Ventanilla Digital Empresarial se vinculará con el Expediente para\nTrámites y Servicios, a fin de que el empresario presente por única vez los documentos requeridos en todo el proceso.\n(REFORMADO, P.O. 30 DE SEPTIEMBRE DE 2022)\nLa Secretaría de Innovación y Gobierno Digital emitirá los lineamientos que detallarán el funcionamiento, operación y administración de la\nVentanilla Digital.\nCAPÍTULO II\nApertura de Empresas\nArtículo 87. El SARE es la herramienta que integra y consolida todos los trámites municipales para abrir una micro, pequeña, mediana o grande empresa que realiza actividades de bajo riesgo, a través de un proceso funcionamiento.\nde su competencia el SARE en sus diversas modalidades.\nArtículo 88. El SARE será implementado por los municipios en\nComisión Nacional de Mejora Regulatoria, con base en los acuerdos o\nConvenios signados al respecto contemplando los siguientes elementos:\nI. Ventanilla única de forma física o electrónica en donde se encuentre toda la información, la recepción y la gestión de todos los trámites municipales necesarios para la apertura de una empresa;\nII. Enlazará, en su caso, los trámites federales y/o estatales de apertura, de conformidad con la legislación aplicable, fomentando el uso de las tecnologías de información;\nIII. Formato Único de Apertura para la solicitud del trámite, impreso o en forma electrónica, en el que se incluyan todos los requisitos y costos para realizar el trámite. El formato único, en sus diversas modalidades, incluyendo los requisitos y tiempos de respuesta de los trámites iniciados, deberá publicarse en el Periódico Oficial del Estado, así como en las páginas de internet de los municipios y de la Secretaría;\nIV. Catálogo de giros de bajo riesgo, alineado al Sistema de Clasificación\nIndustrial de América del Norte, el cual tendrá como objetivo determinar los giros empresariales que podrán realizar los trámites municipales para abrir una empresa a través del SARE. Se publicará en la página de\nInternet de los municipios el catálogo de giros comerciales SARE, previa autorización del Cabildo correspondiente;\nV. Manual de operación del SARE en el que se describa el proceso interno de resolución, coordinación con otras dependencias e interacciones con el emprendedor;\nVI. La resolución máxima se deberá otorgar en un tiempo máximo de setenta y dos horas; y\nVII. Las demás que determine esta Ley.\nTÍTULO QUINTO\nREGULATORIA\nCAPÍTULO ÚNICO\nArtículo 89. El incumplimiento de las obligaciones establecidas por la presente Ley, por parte de los servidores públicos de los sujetos\nAdministrativas del Estado de Aguascalientes.\nArtículo 90. Las Autoridades de Mejora Regulatoria deberán informar a responsabilidades administrativas y hechos de corrupción, de los incumplimientos que tenga conocimiento.\nARTÍCULO PRIMERO. El presente Decreto entrará en vigor al día siguiente de su publicación en el Periódico Oficial del Estado de\nAguascalientes, salvo lo dispuesto en el ARTÍCULO TERCERO, cuya vigencia comenzará a partir del 01 de enero de 2020.\nARTÍCULO SEGUNDO. A partir del 1° de enero de 2020 se abrogan la Ley de Gestión Empresarial y Mejora Regulatoria para el Estado de\nAguascalientes, publicada en el Periódico Oficial del Estado de\nAguascalientes con fecha 11 de noviembre de 2013, así como la Ley que\nCrea el Centro de Competitividad e Innovación del Estado de\nAguascalientes, publicada en el Periódico Oficial del Estado de\nAguascalientes con fecha 20 de enero de 2014, incluidas todas sus reformas y adiciones subsecuentes de ambos ordenamientos.\nARTÍCULO TERCERO. A partir de la entrada en vigor del presente\nDecreto, el Instituto Estatal de Gestión Empresarial y Mejora Regulatoria, Aguascalientes, llevarán a cabo la resolución de los vínculos administrativos, legales, judiciales y financieros, así como la celebración de la Administración Pública Estatal, atendiendo a la naturaleza de su competencia.\nLos casos no previstos en el presente Decreto, serán resueltos mediante acuerdos administrativos, celebrados por las dependencias o entidades\nAdministración Pública del Estado de Aguascalientes.\nARTÍCULO CUARTO. Los encargados de llevar los trabajos y operaciones, desde la entrada en vigor del presente Decreto y hasta su extinción, será\n(sic) quien ocupe la titularidad del Instituto Estatal de Gestión\nEmpresarial y Mejora Regulatoria, y del Centro de Competitividad e\nInnovación del Estado de Aguascalientes, respectivamente, quienes además contarán con las siguientes facultades:\nI. Formular y actualizar el inventario de los activos pertenecientes al\nInstituto Estatal de Gestión Empresarial y Mejora Regulatoria, y al Centro de Competitividad e Innovación del Estado de Aguascalientes, así como de los pasivos a cargo de cada uno de estos;\nII. Administrar los activos de los organismos, respectivamente, hasta su transferencia a las dependencias o entidades que correspondan;\nIII. Elaborar los acuerdos administrativos de transferencia en conjunto con las dependencias o entidades que, de conformidad con lo establecido en la Ley Orgánica de la Administración Pública del Estado de Aguascalientes, les competa conocer;\nIV. Contratar un despacho externo para dictaminación de los estados financieros;\nV. Informar a la Secretaría de Desarrollo Económico, a la Secretaría de\nFinanzas, a la Secretaría de Administración y a la Contraloría del Estado, sobre el avance y estado que guarde los actos tendientes a la extinción, atendiendo a la naturaleza de su competencia, a fin de que manifiesten lo que a su interés convenga;\nVII. Las demás que se consideren necesarias para la extinción del\nInstituto Estatal de Gestión Empresarial y Mejora Regulatoria, y del\nCentro de Competitividad e Innovación del Estado de Aguascalientes, y para los efectos del presente Decreto.\nARTÍCULO QUINTO. Los asuntos administrativos, legales, judiciales;\narchivos, expedientes, documentos y carpetas del Instituto Estatal de\nGestión Empresarial y Mejora Regulatoria, y del Centro de\nCompetitividad e Innovación del Estado de Aguascalientes, serán transferidos a la Secretaría de Desarrollo Económico, a través de los acuerdos administrativos de transferencia respectivos.\nARTÍCULO SEXTO. Los bienes muebles e inmuebles del Instituto Estatal de Gestión Empresarial y Mejora Regulatoria, y del Centro de\nCompetitividad e Innovación del Estado de Aguascalientes, serán mediante los acuerdos administrativos de transferencia respectivos;\nARTÍCULO SÉPTIMO. Los recursos financieros del Instituto Estatal de\nGestión Empresarial y Mejora Regulatoria, y del Centro de\nCompetitividad e Innovación del Estado de Aguascalientes, serán transferidos al Gobierno del Estado, a través de la Secretaría de Finanzas del Estado; mediante los acuerdos administrativos de transferencia respectivos.\nARTÍCULO OCTAVO. Las obligaciones laborales respecto de los trabajadores que serán transferidos del Instituto Estatal de Gestión\nEmpresarial y Mejora Regulatoria, y del Centro de Competitividad e\nInnovación del Estado de Aguascalientes, al Gobierno del Estado de\nAguascalientes, a través de la Secretaría de Desarrollo Económico, serán asumidas por esta última, respetando los derechos de los trabajadores en términos de las disposiciones legales aplicables.\nLos derechos laborales de los trabajadores transferidos, serán garantizados atendiendo a lo establecido en el Estatuto Jurídico de los\nTrabajadores al Servicio de los Gobiernos del Estado de Aguascalientes, sus Municipios, Órganos Constitucionales Autónomos y Organismos\nDescentralizados, en la transferencia institucional que se realice a la\nSecretaría de Desarrollo Económico.\nLa Secretaría de Desarrollo Económico, de acuerdo con las necesidades conjuntamente con la Secretaría de Administración, las transferencias de personal o la terminación de la relación laboral.\nARTÍCULO NOVENO. La publicación en el Periódico Oficial del Estado de\nAguascalientes de los acuerdos administrativos de transferencia, Regulatoria, y del Órgano Interno de Control en el Centro de\nCompetitividad e Innovación del Estado de Aguascalientes, hará las veces de notificación para los efectos legales a que haya lugar.\nARTÍCULO DÉCIMO. En virtud de la extinción del Instituto Estatal de\nGestión Empresarial y Mejora Regulatoria, y del Centro de\nCompetitividad e Innovación del Estado de Aguascalientes, inician los procesos de liquidación de éstos.\nde Desarrollo Económico.\nARTÍCULO DÉCIMO PRIMERO. El titular de la Secretaría de Desarrollo\nEconómico, tendrá las siguientes facultades y atribuciones, en términos del artículo transitorio anterior:\nI. Ejercer las facultades y atribuciones de apoderado general para pleitos y cobranzas, actos de administración y dominio, con todas las facultades generales y aún las especiales que de acuerdo con las leyes requieran poder o cláusula, así como para delegar su representación mediante poderes generales o especiales;\nII. Reintegrar el recurso no ejercido del presupuesto asignado al Instituto\nEstatal de Gestión Empresarial y Mejora Regulatoria, y al Centro de\nCompetitividad e Innovación del Estado de Aguascalientes, para el\nEjercicio Fiscal 2019, a la Secretaría de Finanzas del Estado, en los términos que ésta señale;\nIII. Informar a la Secretaría de Finanzas, a la Secretaría de Administración proceso de liquidación, según los asuntos que le competa conocer;\nIV. Presentar ante el Servicio de Administración Tributaria, el aviso de cancelación del Registro Federal de Contribuyentes, conjuntamente con\nGestión Empresarial y Mejora Regulatoria, y del Centro de\nCompetitividad e Innovación del Estado de\n(sic) Aguascalientes;\nV. Elaborar el cierre contable y someter a revisión de la Contraloría y la\nVI. Elaborar el libro blanco de los resultados obtenidos del proceso de liquidación;\nVII. Conservar en depósito la documentación correspondiente al proceso establecido en la legislación aplicable;\nVIII. Atender las auditorías y/o requerimientos de los entes fiscalizadores estatales y/o federales; y\nIX. Las demás inherentes a sus atribuciones que le otorgue la legislación\nEstatal de Gestión Empresarial y Mejora Regulatoria, y del Centro de\nCompetitividad e Innovación del Estado de Aguascalientes.\nARTÍCULO DÉCIMO SEGUNDO. El titular de la Secretaría de Desarrollo\nEconómico, deberá inscribir la extinción del Instituto Estatal de Gestión\nEmpresarial y Mejora Regulatoria, y del Centro de Competitividad e\nInnovación del Estado de Aguascalientes, en el Registro Público de la\nPropiedad y del Comercio del Estado, en la sección relativa a las\nEntidades Paraestatales.\nARTÍCULO DÉCIMO TERCERO. Para los efectos legales a que haya lugar, las referencias que se hagan tanto al Instituto Estatal de Gestión\nEmpresarial y Mejora Regulatoria, así como al Centro de Competitividad e Innovación del Estado de Aguascalientes, en otras disposiciones o instrumentos jurídicos emitidos con anterioridad a la entrada en vigor del presente Decreto, se entenderán efectuadas a la Secretaría de\nDesarrollo Económico.\nARTÍCULO DÉCIMO CUARTO. El Poder Ejecutivo del Estado, a través de las Dependencias de la Administración Pública Estatal competentes, llevará a cabo todos aquellos actos administrativos, jurídicos y financieros\nEconómico en materia de\n(sic) Gestión Empresarial y Mejora Regulatoria, así como en materia de\nCompetitividad e Innovación, con base en el techo presupuestal que se autorice para dar cumplimiento al presente Decreto.\nARTÍCULO DÉCIMO QUINTO. Se deberán considerar en el Presupuesto de Egresos del Estado de Aguascalientes para el Ejercicio Fiscal 2020 los administrativas de la Secretaría de Desarrollo Económico, encargadas de la mejora regulatoria y gestión empresarial, así como de la competitividad e innovación en el Estado.\nadecuaciones normativas correspondientes, a más tardar el 1° de enero de 2020, a efecto de garantizar los principios de legalidad, certeza y\nDecreto.\nARTÍCULO DÉCIMO SÉPTIMO. El Consejo Estatal de Mejora Regulatoria deberá sesionar para su instalación, dentro de un plazo que no exceda los\nDecreto.\nARTÍCULO DÉCIMO OCTAVO. Las Autoridades de Mejora Regulatoria y los sujetos obligados deberán considerar en su presupuesto anual los recursos económicos necesarios para el cumplimiento e implementación de las acciones en materia de mejora regulatoria y en términos del presente Decreto.\nARTÍCULO DÉCIMO NOVENO. El Consejo Estatal de Mejora Regulatoria deberá expedir los lineamientos, instrumentos, bases, mecanismos y demás normatividad necesaria para el cumplimiento de la Ley de Mejora\nRegulatoria y Gestión Empresarial para el Estado de Aguascalientes dentro del plazo que no exceda a un año contado a partir de la entrada en vigor este Decreto.\nARTÍCULO VIGÉSIMO. En un plazo que no exceda de un año contado a partir de la entrada en vigor de este Decreto, la Secretaría de Desarrollo\nEconómico deberá expedir los lineamientos para establecer los calendarios, mecanismos, formularios e indicadores para la implementación de los programas de mejora regulatoria y demás disposiciones necesarias para el cumplimiento de la Ley de Mejora\nRegulatoria y Gestión Empresarial para el Estado de Aguascalientes.\nARTÍCULO VIGÉSIMO PRIMERO. Las Autoridades de Mejora Regulatoria\nAguascalientes, dentro del plazo que no exceda a un año contado a partir de la entrada en vigor este Decreto.\nARTÍCULO VIGÉSIMO SEGUNDO. La Estrategia Estatal de Mejora términos de las disposiciones de la Ley General de Mejora Regulatoria.\nARTÍCULO VIGÉSIMO TERCERO. En un plazo de ciento ochenta días siguientes a la entrada en vigor del presente Decreto, las Herramientas\nEmpresarial para el Estado de Aguascalientes.\nHerramientas de Mejora Regulatoria previstas en esta Ley, tomando en consideración la complejidad de las herramientas y su capacidad técnica, operativa y presupuestal.\nEl funcionamiento de las Herramientas de Mejora Regulatoria no podrá exceder de los tres años posteriores a la entrada en vigor de la Ley de\nMejora Regulatoria y Gestión Empresarial para el Estado de\nAguascalientes.\nARTÍCULO VIGÉSIMO CUARTO. Los Municipios, Poderes Legislativo y\nJudicial y Órganos Constitucionales Autónomos, en un plazo no mayor a un año calendario, contado a partir de la entrada en vigor de este\nDecreto, deberán adecuar sus disposiciones reglamentarias para dar cumplimiento a la Ley de Mejora Regulatoria y Gestión Empresarial para el Estado de Aguascalientes.\nARTÍCULO VIGÉSIMO QUINTO. Los Consejos Municipales de Mejora\nRegulatoria deberán instalarse formalmente dentro de un plazo de noventa días naturales siguientes a la entrada en vigor de las adecuaciones correspondientes a sus disposiciones reglamentarias.\nARTÍCULO VIGÉSIMO SEXTO. Las menciones contenidas en cualquier\nRegulatorio se entenderán referidas al Análisis de Impacto Regulatorio.\nEstado de Aguascalientes, serán concluidas conforme a las disposiciones aplicables vigentes a la fecha de su presentación.\nARTÍCULO VIGÉSIMO SÉPTIMO. Quedan derogas todas aquellas disposiciones que se opongan al presente Decreto.\nAl Ejecutivo para su promulgación y publicación.\nDado en el Salón de Sesiones “Soberana Convención Revolucionaria de\nAguascalientes”, del Palacio Legislativo, a los veintiocho días del mes de noviembre del año dos mil diecinueve.\nLo que tenemos el honor de comunicar a usted, para los efectos\nConstitucionales conducentes.\nAguascalientes, Ags., a 28 de noviembre del año 2019.\nLA MESA DIRECTIVA\nALEJANDRO SERRANO ALMANZA\nDIPUTADO PRESIDENTE\nLUIS ENRIQUE GARCÍA LÓPEZ\nDIPUTADO PRIMER SECRETARIO\nERICA PALOMINO BERNAL\nDIPUTADA SEGUNDA SECRETARIA\nEn cumplimiento de lo dispuesto por los Artículos 32 párrafo primero, 35 para su debida publicación y observancia, promulgo el presente Decreto en la Residencia del Poder Ejecutivo del Estado, en la Ciudad de\nAguascalientes, Ags., a 28 de noviembre de 2019.- Martín Orozco\nSandoval.- Rúbrica.- El Secretario General de Gobierno, Lic. Ricardo\nEnrique Morán Faz.- Rúbrica.\n[N. DE E. A CONTINUACIÓN SE TRANSCRIBEN LOS ARTÍCULOS\nORDENAMIENTO.]\n[N. DE E. TRANSITORIOS DEL “DECRETO NÚMERO 180.- SE REFORMAN\nEMPRESARIAL PARA EL ESTADO DE AGUASCALIENTES”.]\nARTÍCULO PRIMERO.- El presente Decreto entrará en vigor el día siguiente al de su publicación en el Periódico Oficial del Estado.\nARTÍCULO SEGUNDO.- Al crease la Secretaría de Innovación y Gobierno\nDigital, se transfieren a esta, de la Unidad Administrativa de mejora respectivamente, el personal de base que continúe laborando a su servicio, sin perjuicio de sus derechos adquiridos; así como los recursos encargados antes de la entrada en vigor de este Decreto.\nARTÍCULO TERCERO.- Se deberán considerar en el Presupuesto de\nEgresos del Estado de Aguascalientes para el Ejercicio Fiscal 2023 los recursos necesarios para la operatividad y funcionamiento de las unidades administrativas de la Secretaría de Innovación y Gobierno\nDigital que sean necesarias para operar de forma eficiente la mejora regulatoria en términos de la Ley de la materia.\nARTÍCULO CUARTO.- El Ejecutivo del Estado deberá emitir las modificaciones a los reglamentos internos de las entidades materia de la reforma, en un plazo no mayor de 90 días naturales, contados a partir de la entrada en vigor del presente Decreto.\nP.O. 10 DE MAYO DE 2023.\n[N. DE E. TRANSITORIO DEL \"DECRETO NÚMERO 338.- REFORMA A LA\nLEY DE MEJORA REGULATORIA Y GESTIÓN EMPRESARIAL PARA EL\nESTADO DE AGUASCALIENTES\".]\nARTICULO UNICO.- El presente Decreto entrara en vigor al día siguiente de su publicación en el Periódico Oficial del Estado de Aguascalientes.\n[N. DE E. TRANSITORIO DEL “DECRETO NÚMERO 371.- REFORMA A LA\nESTADO DE AGUASCALIENTES”.]\nARTÍCULO ÚNICO.- El presente Decreto entrará en vigor al día siguiente\n[N. DE E. TRANSITORIOS DEL “DECRETO NÚMERO 544.- SE REFORMAN\nLAS FRACCIONES XI DEL ARTÍCULO 10, Y II Y III DEL ARTÍCULO 16; Y SE\nADICIONA LA FRACCIÓN IV DEL ARTÍCULO 16, DE LA LEY DE MEJORA\nAGUASCALIENTES”.]\nARTÍCULO PRIMERO. - El presente Decreto iniciara su vigencia al día\nAguascalientes.\nARTÍCULO SEGUNDO. –Quedan sin efecto todas aquellas disposiciones normativas y/o reglamentarias que se opongan al presente decreto.",
  "ordenamiento": "REGLAMENTO",
  "jurisdiccion": "AGUAS CALIENTES",
  "fuente_oficial": "DIARIO OFICIAL DE LA FEDERACION",
  "Fecha de Publicación": "28 de noviembre de 2019",
  "Última Reforma Publicada": "15 DE ENERO \nDE 2024",
  "es_escaneado": false,
  "tiene_tablas": false,
  "materia": [
    "administrativo"
  ]
}