{
  "titulo": "Ley de Prestación de Servicios para la Atención, Cuidado y Desarrollo Integral Infantil para el Esta",
  "Contenido": "ORDEN JURÍDICO NACIONAL\nLEY DE PRESTACIÓN DE SERVICIOS PARA LA ATENCIÓN, CUIDADO Y\nAGUASCALIENTES\nDE 2024.\nCARLOS LOZANO DE LA TORRE, Gobernador Constitucional del Estado de Aguascalientes, a sus habitantes sabed:\nQue por el H. Congreso del Estado se me ha comunicado lo siguiente:\nAguascalientes, en virtud de su función y facultad constitucional, ha tenido a bien expedir el siguiente\nDecreto Número 325\nARTÍCULO ÚNICO.- Se aprueba la Ley de Prestación de Servicios para la\nAtención, Cuidado y Desarrollo Integral Infantil para el Estado de\nAguascalientes, quedando en los siguientes términos:\nLEY DE PRESTACIÓN DE SERVICIOS PARA LA ATENCIÓN, CUIDADO Y\nDESARROLLO INTEGRAL INFANTIL PARA EL ESTADO DE\nAGUASCALIENTES\nCAPÍTULO I\nDisposiciones Generales\nArtículo 1°.- La presente Ley es de orden público, interés social y garantizar el acceso de niñas y niños a los servicios para la atención, cuidado y Desarrollo Integral Infantil, garantizando el acceso en condiciones de igualdad, calidad, calidez, seguridad y protección adecuadas, que promuevan el ejercicio pleno de sus derechos, en términos de lo establecido en la Ley General de la materia.\nen el ámbito de sus respectivas competencias.\nArtículo 3°.- La interpretación y la aplicación de esta Ley corresponde al\nGobierno, al Instituto de Servicios de Salud del Estado, a la Secretaría de\nDesarrollo Social, al Sistema para el Desarrollo Integral de la Familia del\nEstado y al Instituto de Educación, así como a los Municipios, en el ámbito de sus respectivas competencias.\nArtículo 4°.- Las dependencias, entidades y demás organismos de seguridad social que presten servicios para la atención, cuidado y\nDesarrollo Integral Infantil, deberán observar lo dispuesto en la Ley\nGeneral y en este ordenamiento.\nArtículo 5°.- Los Centros de Atención y los Prestadores de Servicios en cualquiera de sus modalidades y tipos, quedan sujetos a lo dispuesto en la Ley General, el presente ordenamiento, y en su caso, a las disposiciones legales y administrativas aplicables relacionadas con servicios educativos, salubridad, infraestructura, equipamiento, seguridad, protección civil, desarrollo integral de la familia y medidas de higiene.\nArtículo 6°.- Los Centros de Atención que impartan educación preescolar y/o primaria deberán contar con la autorización a que se refiere el\nArtículo 3° de la Constitución Política de los Estados Unidos Mexicanos, la\nLey General de Educación y Ley de Educación para el Estado de\nAguascalientes y ajustar la prestación de dichos servicios a las disposiciones de estos ordenamientos.\nArtículo 7°.- Para efectos de esta Ley se entenderá por:\nI. Centros de Atención: Espacios, cualquiera que sea su denominación de modalidad pública, privada o mixta, donde se prestan servicios para la atención, cuidado y Desarrollo Integral Infantil en un marco de ejercicio nacidos;\nII. Consejo: Consejo Estatal de Prestación de Servicios para la Atención, Cuidado y Desarrollo Integral Infantil;\nIII. Desarrollo integral infantil: es el derecho que tienen niñas y niños a formarse de manera física, mental, emocional y socialmente en condiciones de igualdad, eficiencia, calidad, seguridad y protección adecuada;\nIV. Ley: Ley de Prestación de Servicios para la Atención, Cuidado y\nDesarrollo Integral Infantil para el Estado de Aguascalientes;\nV. Ley General: Ley General de Prestación de Servicios para la Atención, Cuidado y Desarrollo Integral Infantil;\nVI. Medidas Precautorias: Aquellas que con motivo de la prestación de los servicios para la atención, cuidado y Desarrollo Integral Infantil emitan las autoridades competentes, para salvaguardar la vida y la integridad de niñas y niños, de conformidad con lo que establece la presente Ley;\nVII. Política Estatal: Política Estatal de Servicios para la Atención, Cuidado y Desarrollo Integral Infantil;\nVIII. Prestadores de Servicios: Aquellas personas físicas o morales que cuenten con permiso, licencia o autorización, emitido por la autoridad competente, para instalar y operar uno o varios Centros de Atención en cualquier modalidad y tipo;\nIX. Programa Interno de Protección Civil: Aquel que se circunscribe al ámbito de una Dependencia, Entidad, Institución y Organismo pertenecientes a los sectores público, privado y social, que se instala en los inmuebles correspondientes con el fin de salvaguardar la integridad física de niñas y niños, empleados y de las personas que concurran a dichas instalaciones;\nX. Registro Estatal: Catálogo público en el cual se incluyen todos los datos de los Centros de Atención, bajo cualquier modalidad y tipo, ubicados en el territorio del Estado;\nAtención, Cuidado y Desarrollo Integral Infantil para el Estado de\nAguascalientes; y\nXII. Servicios de Atención: Medidas dirigidas a niñas y niños en los Centros de Atención, consistentes en la atención y cuidado para su Desarrollo\nIntegral Infantil.\nCAPÍTULO II\nDe los Sujetos de Servicios de Atención\nArtículo 8°.- Las niñas y los niños tienen derecho a recibir los Servicios de materia, en condiciones de calidad, calidez, seguridad, protección y respeto a sus derechos, identidad e individualidad con el fin de garantizar el interés superior de la niñez.\nArtículo 9°.- El Ejecutivo Estatal por conducto de sus dependencias y entidades, y los Municipios en el ámbito de su competencia, garantizarán que la prestación de los Servicios de Atención sea conforme lo dispuesto en la Ley de los Derechos de las Niñas, Niños y Adolescentes para el\nEstado de Aguascalientes, orientado a lograr la observancia y ejercicio de los derechos previstos en el Artículo 11 de la Ley General y fomentando en niñas y niños una cultura de protección civil y autoprotección.\nArtículo 10.- Con el fin de garantizar el cumplimiento de los servicios a que se refiere esta Ley, en los Centros de Atención se contemplarán las actividades previstas en el Artículo 12 de la Ley General.\n(ADICIONADO PÁRRAFO, P.O. 27 DE MAYO DE 2024)\nEn los casos de niñas y niños de la primera infancia, que van de los 0 a los 5 años de edad, recibirán servicios de estimulación temprana para el desarrollo integral físico y mental que les permita desarrollar al máximo sus capacidades cognoscitivas, emocionales, motrices, lingüistas y sociales.\nArtículo 11.- Para el ingreso de una niña o niño con alguna discapacidad a un Centro de Atención, se deberá contar con una constancia de de discapacidad.\nEn el supuesto de que los padres, tutores o quienes tengan la discapacidad, por razones económicas no puedan tramitar la constancia referida en el párrafo anterior, previo estudio socioeconómico, será facultadas para ello.\nArtículo 12.- El ingreso de niñas y niños a los Servicios de Atención, se hará en las disposiciones normativas aplicables a cada caso.\nArtículo 13.- Las niñas y los niños sin discriminación y con igualdad, Centro de Atención.\nniño con alguna discapacidad, determinará la procedencia o improcedencia de la inscripción, considerando la constancia de evaluación referida en el artículo 10 de esta Ley, las características del personal especializado con que cuente, así como a su tipo de capacidad instalada para dar servicio, debiendo informar de manera expresa su determinación a quien haya presentado la solicitud así como al Consejo.\nArtículo 14.- Cuando el Centro de Atención no tenga personal capacitado para brindar la atención especializada por el tipo y grado de discapacidad, o que no existan lugares disponibles atendiendo a su tipo de capacidad instalada, se deberá canalizar a la niña o niño a un Centro de Atención que le pueda brindar el servicio.\nCAPÍTULO III\nDe la Política Estatal de Servicios para la Atención, Cuidado y Desarrollo\nIntegral Infantil\n(REFORMADO, P.O. 29 DE JUNIO DE 2020)\nArtículo 15.- Para la observancia de los derechos contenidos en esta Ley, el Estado y los Municipios establecerán la Política Estatal, en materia de prestación de servicios de atención, cuidado y desarrollo integral infantil, que tendrá por objeto la coordinación de instrumentos, políticas, planes, programas y acciones interinstitucionales.\nArtículo 16.- La rectoría de los Servicios de Atención recae en el Estado, el cual tendrá la responsabilidad de autorizar, monitorear, supervisar y evaluar el funcionamiento de dichos servicios, en términos del programa previsto en el Artículo 63 de la Ley General, el Artículo 60 de la presente\nLey y demás disposiciones legales y administrativas aplicables.\nArtículo 17.- Es prioritaria y de interés público la Política Estatal misma que será diseñada e instrumentada por el Consejo, a propuesta del Poder\nEjecutivo del Estado, y observará en forma enunciativa más no limitativa, los siguientes objetivos:\nI. Garantizar el reconocimiento de la dignidad de niñas y niños, a partir de la creación de las condiciones necesarias de respeto, protección y ejercicio pleno de sus derechos;\nII. Promover el acceso de niñas y niños, especialmente de aquellos con alguna discapacidad o que vivan en condiciones de vulnerabilidad, marginalidad o pobreza, a los servicios que señala esta Ley, sin importar sus condiciones físicas, intelectuales o sensoriales, acorde con los modelos de atención;\nIII. Establecer criterios estandarizados de calidad y seguridad en la prestación de los servicios que la Ley regula;\nIV. Promover la convivencia familiar y comunitaria instituidas en el respeto, protección y ejercicio de los derechos de niñas y niños;\nV. Contribuir con el mejoramiento progresivo y el fortalecimiento de los servicios para la atención, cuidado y Desarrollo Integral Infantil;\nVI. Fomentar la equidad y la igualdad de género; y\nVII. Garantizar criterios cuantitativos y cualitativos de los servicios, de conformidad con los objetivos y prioridades que establezca el Consejo y los requerimientos y características de los diferentes modelos de atención.\nArtículo 18.- Para el diseño, implementación, monitoreo y evaluación de la\nPolítica Estatal a que se refiere el presente Capítulo, en la aplicación e interpretación de la presente Ley, así como en la prestación de los\nServicios de Atención, según corresponda, se deberán observar los siguientes principios:\nI.- El interés superior de la niñez: Las decisiones en torno a los Centros de\nAtención deben velar en todo momento por el respeto a este principio, por encima de intereses económicos o de cualquier otro tipo.\nII.- Seguridad: Entendida como el derecho de las niñas y los niños a ser integridad física, sin lesiones de ningún tipo;\nIII.- Respeto, Igualdad y No Discriminación: En todo momento se debe respetar la dignidad y derechos de las niñas y niños.\nIV.- Participación: El derecho de las madres, padres o tutores para intervenir en la prestación de los Servicios de Atención, de manera de que velen por la debida tutela de los derechos de las niñas y niños, especialmente en materia de seguridad e higiene, así como de niñas en\n(sic) niños en todos los asuntos que les atañen;\nV.- Desarrollo Integral: Los Servicios de Atención deben buscar el desarrollo integral de niñas y niños en todos los aspectos de su vida, ya sean físicos, emocionales, psicosociales, cognitivos, sociales, educativos o culturales;\nVI.- Calidad: Que los servicios de los Centros de Atención cubran los requerimientos mínimos en materia de instalaciones, alimentación, salud, educación y demás aspectos previstos en esta ley.\nCAPITULO IV\nDe la Distribución de Competencias\nArtículo 19.- Corresponde al Ejecutivo del Estado, por conducto y en coordinación con las dependencias y entidades en el ámbito de sus respectivas competencias, las siguientes atribuciones:\nI. Formular, conducir y evaluar la Política Estatal en materia de prestación de servicios para la atención, cuidado y Desarrollo Integral Infantil, en congruencia con la política nacional en la materia;\nII. Elaborar, aprobar, ejecutar y evaluar el programa estatal en materia de prestación de servicios para la atención, cuidado y Desarrollo Integral\nInfantil, conforme al objeto de la presente Ley, la Ley General y con los fines establecidos por el Consejo Nacional; asimismo, con las directrices del Estado, así como por lo dispuesto en el Programa Nacional de\nPrestación de Servicios para la Atención, Cuidado y Desarrollo Integral\nInfantil;\nIII. Organizar el Sistema Estatal de Prestación de Servicios para la\nAtención, Cuidado y Desarrollo Integral Infantil y coadyuvar con el\nConsejo;\nIV. Coordinar y operar el Registro Estatal;\nV. Verificar que la prestación de los servicios cumpla con los estándares niñez;\nVI. Determinar los indicadores que permitan evaluar la aplicación del programa estatal en materia de prestación de servicios para la atención, cuidado y Desarrollo Integral Infantil;\nVII. Asesorar a los gobiernos municipales que lo soliciten, en la elaboración, ejecución o evaluación de sus respectivos programas en la materia;\nVIII. Celebrar convenios de coordinación en la materia con los demás órdenes de gobierno, para alcanzar los fines de la presente Ley;\nIX. Promover y celebrar convenios de concertación con los sectores privado y social, para llevar a cabo acciones tendientes a favorecer la prestación de servicios para la atención, cuidado y Desarrollo Integral\nInfantil;\nX. Vigilar, en el ámbito de su competencia, el cumplimiento de esta Ley y de las disposiciones estatales que se relacionen y deriven de la misma, por parte de los prestadores de servicios para la atención, cuidado y desarrollo integral infantil, en cualquiera de sus tipos y modalidades;\nXI. Fomentar, realizar y difundir estudios e investigaciones que coadyuven a mejorar la prestación de servicios a que se refiere esta Ley;\nXII. Decretar, en el ámbito de su competencia, las Medidas Precautorias necesarias a los Centros de Atención;\nXIII. Imponer las sanciones que correspondan a su ámbito de competencia, por el incumplimiento a las disposiciones de esta Ley;\nXIV. Hacer del conocimiento de la autoridad competente, toda aquella información que pueda constituir un hecho ilícito; y\nXV. Las demás que les señalen esta Ley y la normatividad aplicable.\nArtículo 19 A.- El Instituto de Educación del Estado tendrá las siguientes atribuciones:\nI.- Verificar que los planes y programas de estudio ofertados en los educativa federal;\nII.- Implementar acciones que tiendan a garantizar la calidad de la educación que se brinde en los Centros de Atención;\nIII.- Establecer mecanismos de identificación y seguimiento de alumnos que reciban educación en los Centros de Atención;\nIV.- Participar en la capacitación del personal docente de los Centros de\nAtención; y\nV.- Las demás que le otorguen esta ley y otros ordenamientos aplicables.\n(ADICIONADO, P.O. 29 DE JUNIO DE 2020)\nArtículo 19 B.- La Secretaría de Salud tendrá las siguientes atribuciones:\nI.- Realizar acciones encaminadas a vigilar la salud integral de niñas y niños dentro de los centros de atención;\nII.- Impulsar campañas de difusión para el personal de los centros de atención, encaminadas a la prevención y atención de accidentes, padecimientos y enfermedades entre niñas y niños que atienden;\nIII.- Supervisar que los centros de atención cumplan con los requerimientos de salubridad y control sanitario;\nIV.- Llevar a cabo, en los centros de atención, actividades de educación en materia de nutrición, encaminados a\n(sic) promover hábitos alimenticios adecuados; y\nV.- Las demás que le otorguen esta ley y otros ordenamientos aplicables.\nArtículo 19 C.- La Secretaría de Desarrollo social, tendrá las siguientes atribuciones:\nI.- Generar acciones tendientes a apoyar los centros de atención, que previa evaluación, lo requieran;\nII.- Vincular a los usuarios de los Centros de Atención, que así lo requieran, con sus programas;\nIII.- Impulsar acciones encaminadas a que los usuarios de los Centros de\nAtención cuenten con mejores condiciones de desarrollo; y\nIV.- Las demás que le otorguen esta Ley y otros ordenamientos aplicables.\nArtículo 19 D. La Unidad Estatal de Protección Civil tendrá las siguientes atribuciones:\nI.- Dictar los lineamientos generales que deben observar los Centros de\nAtención en materia de protección civil y gestión integral de riesgos;\nII.- Celebrar convenios con la Federación y las autoridades competentes, a fin de recibir apoyo en la formulación de los lineamientos generales referidos en la fracción anterior;\nIII.- En colaboración con las unidades municipales de protección civil, llevar a cabo campañas de difusión sobre temas relacionados con la protección civil en los centros de atención;\nIV.- Celebrar convenios de concertación con los sectores social y privado que tengan por objeto la protección civil en los centros de atención; y\nV.- Las demás que le otorguen esta ley y otros ordenamientos aplicables.\n(ADICIONADO, P.O. 29 DE JUNIO DE 2020)\nArtículo 19 E.- El Sistema para el Desarrollo Integral de la Familia del\nEstado de Aguascalientes, tendrá las siguientes atribuciones:\nI.- Instrumentar y articular las políticas públicas en materia de prestación de servicios de atención, cuidado y desarrollo integral infantil en\nIntegral de los Derechos de Niñas, Niños y Adolescentes del Estado de\nAguascalientes;\nII.- Organizar el Registro Estatal de las niñas y niños usuarios de los servicios a que se refiere la presente ley;\nIII.- En colaboración con los sistemas municipales para el desarrollo derechos de niñas y niños en los centros de atención;\nIV.- Celebrar convenios con la Federación, las autoridades competentes, así como con los sectores social y privado, con la finalidad de enriquecer los servicios que se prestan en los centros de atención; y\nV.- Las demás que le otorguen esta ley y otros ordenamientos aplicables.\nArtículo 20.- Corresponde a los Municipios, en el ámbito de su competencia y de conformidad con lo dispuesto en esta Ley, su\nReglamento y demás disposiciones aplicables, las siguientes atribuciones:\nI. Formular, conducir y evaluar la política municipal en materia de prestación de servicios para la atención, cuidado y Desarrollo Integral\nInfantil, en congruencia con la Política Estatal y federal en la materia;\nII. Elaborar, aprobar, ejecutar y evaluar el programa municipal en materia de prestación de servicios para la atención, cuidado y Desarrollo Integral\nInfantil, de conformidad con el objeto de la presente Ley y los fines del\nConsejo. Para tal efecto se considerarán las directrices previstas en el\nPlan Sexenal del Gobierno del Estado, la Política Estatal y los programas de la materia;\nIII. Coadyuvar con el Sistema Estatal de Prestación de Servicios para la\nAtención, Cuidado y Desarrollo Integral Infantil; así como en la integración y operación de su Registro Estatal;\nIV. Verificar en su ámbito de competencia, que la prestación de los principio del interés superior de la niñez;\nV. Celebrar convenios de coordinación en la materia con los demás niveles de Gobierno, para alcanzar los fines de la presente Ley;\nVI. Promover y celebrar convenios de concertación con los sectores privado y social, tendientes a favorecer la prestación de servicios para la atención, cuidado y Desarrollo Integral Infantil, en los términos de la presente Ley;\nVII. Fomentar, realizar y difundir estudios e investigaciones en la materia;\nVIII. Vigilar el cumplimiento de esta Ley, su Reglamento y demás y deriven de la misma, por parte de los Prestadores de Servicios;\nIX. Decretar las Medidas Precautorias necesarias a los Centros de\nAtención autorizados por el Municipio;\nX. Imponer las sanciones a las que se refiere la presente Ley, su\nReglamento y las legislaciones municipales que de ella deriven, en el ámbito de su competencia, respecto de los Prestadores de Servicios;\nXI. Determinar los indicadores que permitan evaluar la aplicación del atención, cuidado y Desarrollo Integral Infantil;\nXII. Hacer del conocimiento de la autoridad competente cualquier situación que pueda constituir un hecho ilícito; y\nXIII. Las demás que les señale esta Ley, su Reglamento y otras disposiciones jurídicas aplicables.\nArtículo 21.- A través de las políticas públicas relacionadas con la prestación de servicios para la atención, cuidado y Desarrollo Integral\nInfantil, se fomentará la participación de los sectores social y privado, en la consecución del objeto de esta Ley, su Reglamento y demás legislación aplicable en la materia.\nCAPÍTULO V\nDel Consejo Estatal de Prestación de Servicios para la Atención, Cuidado y Desarrollo Integral Infantil\nArtículo 22.- El Consejo es una instancia de consulta y coordinación, a establecer políticas públicas y estrategias de atención en la materia;\ntendrá como objetivos diseñar políticas públicas, estrategias y acciones coordinadas para garantizar la atención integral a niñas y niños; así como, impulsar acciones de gobierno para ofrecer un servicio de atención, cuidado y Desarrollo Integral Infantil con criterios comunes de calidad, a través del fomento de actividades de capacitación, certificación, supervisión y seguimiento de los servicios.\nServicios para la Atención, Cuidado y Desarrollo Integral Infantil, en términos de la legislación aplicable.\nArtículo 23.- El Consejo se integrará por los titulares de las siguientes dependencias, entidades y organismos, o por quienes éstos designen en su representación:\nI. La Secretaría General de Gobierno;\nII. La Secretaría de Bienestar y Desarrollo Social;\nIII. El Instituto de Servicios de Salud;\nIV. El Instituto de Educación;\nV. El Sistema para el Desarrollo Integral de la Familia del Estado, quien lo presidirá;\nVI. La Comisión Estatal de Derechos Humanos;\nVII. Instituto de Seguridad y Servicios Sociales para los Servidores\nPúblicos del Estado;\nVIII. Instituto Aguascalentense de las Mujeres;\nIX. Coordinación Estatal de Protección Civil; y\nX. Dos Presidentes Municipales, de conformidad con lo establecido en el\nReglamento de la Ley.\nArtículo 24.- Cada integrante del Consejo contará con voz y voto y sus cargos serán honoríficos; en caso de empate el presidente contará con voto de calidad.\nArtículo 25.- El Consejo podrá invitar para que participen únicamente con voz en sus sesiones, a representantes de otras dependencias o entidades de los Gobiernos Federal, Estatal o Municipales así como de otros así como de los sectores obrero y empresarial.\nArtículo 26.- El Consejo contará con una Secretaría Técnica que será responsable de coordinar las acciones objeto del mismo. El Presidente el Reglamento de la presente Ley.\nArtículo 27.- El Consejo tendrá las siguientes atribuciones:\nI. Formular, conducir y evaluar la Política Estatal, la cual deberá permitir público, privado y social, en la promoción de condiciones favorables al cuidado y Desarrollo Integral Infantil;\nII. Impulsar la coordinación interinstitucional a nivel estatal y municipal, así como la concertación de acciones entre los sectores público, social y privado;\nIII. Vigilar el estricto cumplimiento de esta Ley, así como las disposiciones que se dicten con base en ella, sin perjuicio de las facultades que en la materia competan a las dependencias y entidades Federales, Estatales o\nMunicipales;\nIV. Impulsar programas conjuntos de capacitación y seguimiento para el personal que labora en los Centros de Atención a cargo de las dependencias y entidades de la administración pública estatal;\nV. Promover ante las instancias competentes, la certificación de competencias laborales para el personal que preste sus servicios en los\nCentros de Atención;\nVI. Promover el diseño y uso de indicadores, así como la implementación de mecanismos de seguimiento y evaluación de la cobertura y calidad de los servicios que se ofrecen;\nVII. Impulsar la investigación y la generación de estudios que contribuyan con el objeto de esta Ley;\nVIII. Celebrar acuerdos y convenios para mejorar los servicios que presten los Centros de Atención;\nIX. Supervisar el Registro Estatal y control general de los Centros de\nAtención del Estado;\nX. Promover el monitoreo ciudadano y el acceso a la información de los programas de servicios de los Centros de Atención, a fin de garantizar la transparencia y el uso eficiente de los recursos públicos;\nXI. Promover la participación, corresponsabilidad y solidaridad de las familias, la sociedad civil, así como de niñas y niños en la observación y\nAtención;\nXII. Llevar a cabo la inspección y vigilancia de los Centros de Atención, en\nAtención, Cuidado y Desarrollo Integral Infantil de conformidad con la\nLey General, así como con el Gobierno Estatal y los Ayuntamientos según las disposiciones establecidas en el Capítulo XI de la presente Ley;\n(ADICIONADA, P.O. 29 DE JUNIO DE 2020)\nXIII. Realizar, de manera continua, campañas de difusión dirigidas a la ciudadanía para coadyuvar con el cumplimiento del objeto de la presente Ley; y\n(ADICIONADA [N. DE E. REFORMADA], P.O. 29 DE JUNIO DE 2020)\nXIV. Las demás que le confiera otras disposiciones legales, reglamentarias o administrativas que resulten aplicables.\nArtículo 28.- El Consejo para el cumplimiento de sus fines atenderá a lo siguiente:\nI. Se reunirán en sesiones ordinarias cada tres meses, para dar seguimiento a las acciones acordadas entre sus integrantes;\nII. En cualquier momento podrán reunirse en sesiones extraordinarias para atender asuntos que merezcan atención inmediata, las cuales serán integrantes; y\nIII. Deberán entregar un informe semestral de actividades al Congreso del Estado, quien en su caso podrá solicitar la comparecencia de sus integrantes. Dicho informe deberá difundirse entre la ciudadanía.\nCAPÍTULO VI\nArtículo 29.- El Registro Estatal se organizará conforme a lo dispuesto por el Reglamento y tendrá por objeto:\nI. Coadyuvar al cumplimiento de los objetivos de esta Ley y de la Política\nEstatal y del Consejo;\nII. Concentrar la información de los Centros de Atención de los sectores público, social y privado que presten servicios para la atención, cuidado y\nDesarrollo Integral Infantil en el Estado;\nIII. Contar con un control estadístico que contribuya a la definición de políticas públicas a que se refiere esta Ley;\nIV. Facilitar la supervisión de los Centros de Atención;\nV. Identificar a los Prestadores de Servicios en cualquiera de sus modalidades y tipos así como a su personal, sus usuarios y además mantener actualizada la información que lo conforma.\nArtículo 30.- En el Registro Estatal se deberá proteger y garantizar la integridad y el buen uso de los datos personales de Prestadores de\nServicios, sus empleados y usuarios, de conformidad con la normatividad aplicable.\nArtículo 31.- El Registro Estatal deberá orientarse por los principios de máxima publicidad, transparencia y legalidad, cumpliendo con la normatividad en la materia.\nArtículo 32.- Cuando las autoridades competentes emitan permisos, licencias o autorizaciones a que se refiere esta Ley, procederán a informar al Registro Estatal dicha emisión. El Registro Estatal deberá actualizarse cada seis meses.\nArtículo 33.- Todo Centro de Atención que preste sus servicios en la entidad, deberá informar al Registro Estatal el número de niñas y niños educativa, de salud y de protección civil, además de la información que les sea solicitada en términos de la presente Ley, su Reglamento o cualquier disposición administrativa aplicable.\nArtículo 34.- El Registro Estatal deberá contener:\nI. Nombre del Centro de Atención Infantil;\nII. Identificación del prestador del servicio, sea persona física o moral; así como de su personal y de sus usuarios\nIII. Identificación, en su caso, del representante legal;\nIV. Ubicación del Centro de Atención;\nV. Fecha de inicio de operaciones;\nVI. Modalidad y modelo de atención bajo el cual opera;\nVII. Capacidad instalada y, en su caso, ocupada; y\nVIII. Números telefónicos del Centro de Atención Infantil y del o los responsables del mismo.\ninformación señalada en artículo 38 de la Ley General.\nEl Sistema para el Desarrollo Integral de la Familia del Estado, operará y actualizará el Registro Estatal.\nCAPÍTULO VII\nDe las Modalidades y Tipos de los Centros de Atención\nArtículo 35.- Los Centros de Atención, de acuerdo a su modalidad pueden ser:\nI. Públicos: Aquellos creados, financiados y administrados por la\nFederación, el Estado, los Municipios y sus Instituciones;\nII. Privados: Aquellos cuya creación, financiamiento, operación y administración sólo corresponde a particulares; y\nIII. Mixtos: En estos la Federación, el Estado, los Municipios o en su conjunto, participan en el financiamiento, instalación o administración con instituciones sociales o privadas.\nArtículo 36.- En función de su capacidad instalada, los Centros de\nAtención se clasifican conforme a lo dispuesto por el Artículo 40 de la Ley\nGeneral; en todo caso, deberán acatar las disposiciones de protección civil a fin de garantizar la seguridad de los sujetos atendidos.\nArtículo 37.- Los Centros de Atención deberán ser administrados por personal capacitado de acuerdo al tipo de servicio.\nPara determinar si la capacidad de las instalaciones es la adecuada, se superficie del inmueble y con el número de personal capacitado, pública estatal.\nCAPÍTULO VIII\nArtículo 38.- Para salvaguardar la integridad física de niñas y niños, empleados y de las personas que concurran a los Centros de Atención, éstos deberán contar con un Programa Interno de Protección Civil, conforme a su clasificación.\nEl programa referido en el párrafo anterior, deberá contener, por lo menos, el ámbito de competencia y responsabilidad de los Prestadores de Servicio en cada una de las modalidades, el estado en el que se encuentra el inmueble, las instalaciones, el equipo y el mobiliario utilizado para la prestación del servicio. Este programa deberá ser aprobado por las Unidades de Protección Civil Estatal o municipales, según sea el caso, y será sujeto a evaluación de manera periódica, por las instancias correspondientes.\n(REFORMADO, P.O. 29 DE JUNIO DE 2020)\nArtículo 39.- Los Centros de Atención deberán contar con instalaciones hidráulicas, eléctricas, contra incendios, de gas, intercomunicación y especiales, de acuerdo con los reglamentos establecidos por la\nFederación y el Estado.\nintegridad física y emocional de niñas y niños, así como de las demás personas que concurran a los Centros de Atención, podrá estar ubicado a una distancia menor a cincuenta metros.\nhidrocarburo o sustancias inflamables.\nArtículo 40.- Para el funcionamiento de los Centros de Atención, se deberán definir las rutas de evacuación, así como la señalización y avisos de protección civil, de acuerdo con el Reglamento y otras disposiciones legales. Al diseñar estas rutas, se deberá tomar en cuenta, además de la seguridad y rapidez, el sitio de refugio al que se les conducirá a niñas, niños y personal que preste sus servicios, el cual tiene que estar lejos del conduzcan gas o sustancias químicas.\nelementos de evacuación, así como las salidas del inmueble en caso de riesgo. Además se deben prever medidas específicas relacionadas con la evacuación de personas con discapacidad.\nArtículo 41.- En los Centros de Atención se deberá realizar un simulacro en materia de protección civil cuando menos cada dos meses, con la participación de todas las personas que ocupen regularmente el inmueble; dos de dichos simulacros deberán ser supervisados por las autoridades de protección civil estatal o municipales. Igualmente, deberán llevarse a cabo sesiones informativas con el objeto de transmitir a los ocupantes las instrucciones de comportamiento frente a situaciones de emergencia.\nArtículo 42.- Cualquier modificación o reparación estructural del establecimiento deberá realizarse por personal capacitado fuera del horario en el que se prestan los servicios, previa obtención del dictamen técnico estructural de habitabilidad.\nArtículo 43.- Las zonas de paso, patios y zonas de recreo no se podrán utilizar en ningún caso como zonas de almacenaje. Cuando por necesidad, y siempre de forma transitoria, se tuvieran que utilizar estas zonas para depositar objetos, se procurará que esto se realice fuera del necesarias para evitar accidentes.\nArtículo 44.- El mobiliario y materiales que se utilicen en el inmueble deben mantenerse en buenas condiciones de uso, retirándose aquellos estado. Los acabados interiores de los inmuebles serán adecuados a la edad de niñas y niños.\nArtículo 45.- El inmueble deberá, como mínimo para su funcionamiento, a fin de prevenir y/o proteger de cualquier situación de riesgo o emergencia, contar con los requerimientos establecidos en el Artículo 49\nAguascalientes.\nArtículo 46.- Las niñas y los niños sólo serán entregados a los padres, tutores y/o a las personas autorizadas para recogerlos, previa exhibición oficial con fotografía.\nuna medida de seguridad adicional para prevenir cualquier riesgo o emergencia que se presente en las instalaciones, salvaguardando la integridad de los infantes en términos de las disposiciones legales aplicables.\nCAPÍTULO IX\nDe las Autorizaciones a Centros de Atención\n(REFORMADO, P.O. 29 DE JUNIO DE 2020)\nArtículo 47.- El Consejo Estatal y los Municipios, en el ámbito de sus respectivas competencias, otorgarán las autorizaciones respectivas a los\nCentros de Atención cuando los interesados cumplan las disposiciones de esta Ley, su Reglamento y los requisitos establecidos en el Artículo 50 de la Ley General.\n(REFORMADO, P.O. 29 DE JUNIO DE 2020)\nArtículo 48.- Las autorizaciones referidas en el Artículo anterior, tendrán una vigencia de por lo menos un año, sin perjuicio de lo dispuesto en las disposiciones legales y administrativas aplicables. Ningún Centro de\nConsejo Estatal, ni sin las autorizaciones, permisos o licencias en materia de uso de suelo, funcionamiento, ocupación, seguridad, protección civil y operaciones, seguridad estructural del inmueble y aspectos de carácter sanitario que correspondan.\nArtículo 49.- Las autorizaciones de funcionamiento que concedan las definitiva o temporalmente, atendiendo las siguientes causas:\nI. Cuando exista un riesgo o peligro para la seguridad o la salud de niñas y niños atendidos;\nII. Por incumplimiento de algún requisito legal; y\nIII. Por resolución que emane del procedimiento administrativo que esta\nLey establece.\nArtículo 50.- Para la terminación voluntaria de la autorización, el responsable del Centro de Atención, deberá avisar con treinta días de anticipación al Consejo y al Ayuntamiento. La falta del aviso dará lugar a las sanciones administrativas señaladas en esta Ley.\n(REFORMADO, P.O. 29 DE JUNIO DE 2020)\nArtículo 51.- Los Centros de Atención deberán contar con un reglamento interno en el que, por lo menos, se establecerán las disposiciones respecto de las características de los servicios, el uso y mantenimiento de las instalaciones, los aspectos de seguridad, higiene y protección civil, los cuidados de la salud, los horarios de la prestación del servicio, el procedimiento de admisión de niñas y niños y para designar a las personas autorizadas para recogerlos, la tolerancia de entrada y salida, los derechos y obligaciones de los usuarios, y, en su caso, la cuota mensual y las (sic) modalidad de pago de la misma.\nAdemás, deberán contar con Programa de Trabajo, el cual deberá ser proporcionado a las personas que tengan la tutela, custodia o que tengan la responsabilidad del cuidado de las niñas y niños, mismo que en términos del Artículo 52 de la Ley General, deberá contemplar como mínimo lo siguiente:\nI.- Los derechos de niñas y niños, previstos en esta Ley y los mecanismos e instrumentos para satisfacerlos;\nII.- Las actividades formativas, educativas, culturales y deportivas que se desarrollarán, los obejtivos y resultados esperados;\nIII.- La forma en que se dará cumplimiento a cada una de las actividades que señala el artículo 12 de la Ley General;\nIV.- Los perfiles del personal que laborará en el centro de atención directamente vinculados al trabajo con niñas y niños, así como las actividades que se les encomendarán;\nV.- Las formas y actividades de apoyo a los padres, las personas que para fortalecer la comprensión de sus funciones en la atención, cuidado y desarrollo integral de la niña o el niño;\nVI.- El mecanismo que garantice la confiabilidad y seguridad para la entregar y recibir a niñas y niños;\nVII.- Los procedimientos de recepción, procesamiento, resolución y y niños beneficiarios del servicio o de cualquier interesado;\nVIII.- El procedimiento para la entrega de información a los padres, a las personas que ejerzan la tutela o custodia o quien sea responsable del cuidado y crianza de niñas y niños, sobre su desempeño y desarrollo integral; y\nIX.- La (sic) demás que establezca el Reglamento de esta Ley.\nCAPÍTULO X\nDe la Capacitación y Certificación\nArtículo 52.- Los Centros de Atención a través de las instancias competentes, están obligados a certificar la formación, capacitación y actualización del personal que labora en ellos.\n(REFORMADO, P.O. 29 DE JUNIO DE 2020)\nArtículo 53.- El Estado y los Municipios, en el ámbito de sus respectivas competencias, implementarán acciones dirigidas a certificar y capacitar permanentemente al personal que labora en los Centros de Atención, cuya certificación deberá ser actualizada, por lo menos, cada dos años.\nlos programas de formación, actualización, capacitación y certificación de competencias, así como de protección civil que establezcan las autoridades competentes.\nambiente de respeto en el marco de los derechos de niñas y niños.\nArtículo 54.- Los Prestadores de Servicios promoverán la capacitación de su personal, por lo que deberán brindarles las facilidades necesarias para este efecto, estableciendo programas permanentes de capacitación para su personal; o bien, apoyando a éstos para que participen en aquellos competencia, los que en todo caso tendrán valor curricular, lo anterior sin perjuicio de lo establecido por la legislación laboral.\nArtículo 55.- Las autoridades en la esfera de su competencia, determinarán conforme a la modalidad de atención, las competencias, pretenda laborar en los Centros de Atención. De igual forma, determinarán los tipos de exámenes a los que deberá someterse dicho personal, a fin de garantizar la salud, la educación, la seguridad y la integridad física y psicológica de niñas y niños.\nCAPÍTULO XI\nDe la Inspección y Vigilancia\nArtículo 56.- El Estado por conducto de la Coordinación Estatal de\nProtección Civil y los Municipios a través de las unidades administrativas encargadas de dicha materia en el ámbito de sus respectivas competencias y conforme lo determine el Reglamento, deberán efectuar, cuando menos cada seis meses, visitas de verificación administrativa a los Centros de Atención, de conformidad con la Ley del Procedimiento\nAdministrativo del Estado de Aguascalientes y las disposiciones que al respecto establezca esta Ley.\nArtículo 57.- Las visitas de verificación, tendrán los siguientes objetivos:\nI. Verificar el cumplimiento de los requisitos señalados por esta Ley y\nServicios;\nII. Inspeccionar las condiciones de seguridad e higiene de los Centros de\nAtención;\nIII. Vigilar que los Centros de Atención cuenten con personal adecuado y capacitado para desempeñar sus servicios;\nIV. Inspeccionar que los Prestadores de Servicios, mantengan los respectivos;\nV. Requerir a los Prestadores de Servicios la documentación relativa a sus permisos; y\nVI. Informar a la autoridad responsable de la detección de cualquier su oportuna actuación.\nArtículo 58.- El personal autorizado, al realizar las visitas de inspección y vigilancia y/o verificación sanitaria, deberá presentar identificación y/o documento oficial que lo acredite como tal, así como orden escrita debidamente fundada y motivada, expedida por autoridad competente, en la que establezca el lugar que habrá de inspeccionarse, el objeto de la diligencia y el alcance de ésta.\nArtículo 59.- El Instituto de Servicios de Salud del Estado, llevará a cabo la vigilancia sanitaria de los Centros de Atención mediante visitas de verificación a cargo del personal expresamente autorizado para ello, el cual deberá realizar las respectivas diligencias de conformidad con las prescripciones de la Ley General de Salud, la Ley de Salud del Estado, esta Ley, su Reglamento y demás disposiciones aplicables.\nEl Instituto de Educación así como el Sistema para el Desarrollo Integral de la Familia del Estado, podrán realizar visitas de verificación o inspección en relación a los aspectos relacionados con su competencia.\n(REFORMADO PRIMER PÁRRAFO, P.O. 29 DE JUNIO DE 2020)\nArtículo 60.- El Consejo, en coordinación con la Federación, el Gobierno\nEstatal y los Ayuntamientos, implementará el Programa Integral de\nSupervisión, Acompañamiento, Monitoreo y Evaluación del funcionamiento, el cual tendrá los siguientes objetivos:\nI. Garantizar el mejoramiento progresivo y el fortalecimiento de los\nServicios de Atención;\nII. Establecer, en el marco de la coordinación entre dependencias y entidades estatales, con las autoridades competentes de los gobiernos municipales, los mecanismos de colaboración técnico operativa para normatividad que regula los servicios de los Centros de Atención;\nIII. Contemplar las medidas que resulten necesarias y efectivas, en el ámbito de sus competencias, para evitar la discrecionalidad y la los Centros de Atención; y\nIV. Garantizar la detección y corrección oportuna de cualquier riesgo para la integridad física o psicológica de niñas y niños.\nArtículo 61.- La madre, el padre, tutor o la persona que tenga la responsabilidad de cuidado y crianza, podrá solicitar la intervención de la riesgo en los Centros de Atención.\nCuando se aplique suspensión o revocación de la autorización y cancelación del registro de algún Centro de Atención, las autoridades competentes tomaran las medidas necesarias para que los usuarios reciban la atención de manera inmediata.\nCAPÍTULO XII\nDe la Evaluación de la Política Estatal\n(REFORMADO, P.O. 29 DE JUNIO DE 2020)\nArtículo 62.- La evaluación de la Política Estatal estará a cargo del\nConsejo. El objetivo de la evaluación será conocer el grado de cumplimiento de los principios, resultados, criterios, lineamientos y directrices a seguir por las dependencias y entidades del Ejecutivo del\nEstado y de los municipios, competentes en la materia, así como medir el impacto de la prestación de los servicios de atención, cuidado y desarrollo integral infantil.\nArtículo 63.- El Consejo llevará a cabo la evaluación, a través de uno o educación superior, de investigación científica u organizaciones no gubernamentales sin fines de lucro. Los lineamientos para realizar la para el efecto establezca el Consejo de manera anual.\nLos resultados de la evaluación referida en el párrafo anterior, deberán de Prestación de Servicios para la Atención, Cuidado y Desarrollo Integral\nInfantil.\nCAPÍTULO XIII\nDe las Medidas Precautorias\nArtículo 64.- La autoridad verificadora competente, tendrá la facultad de imponer Medidas Precautorias, en los Centros de Atención, cuando se integridad de niñas y niños que reciben el servicio.\nLas Medidas Precautorias que podrán imponerse son las siguientes:\nI. Recomendación por escrito, en el cual se fijará un plazo de hasta treinta días para subsanar la o las causas que le dieron origen;\nII. Apercibimiento escrito, el cual procederá en caso de que no se atienda la recomendación en el plazo establecido, señalándose un término de hasta diez días para corregir la causa que lo motivó; y\nIII. Suspensión total o parcial de actividades en el Centro de Atención, misma que se mantendrá hasta en tanto se subsane la situación que la motivó. Cuando a juicio de la autoridad la causa lo amerite, ésta disposición podrá imponerse con independencia de las demás Medidas\nPrecautorias señaladas en este Artículo.\nSi durante la verificación se advierte alguna conducta que sancione una ley diversa, se informará a la autoridad competente para que proceda conforme a derecho.\nArtículo 65.- Los plazos a que se refiere el artículo anterior, podrán específica que originó la medida.\nCAPÍTULO XIV\nDe las Infracciones y Sanciones\nArtículo 66.- Las autoridades competentes, podrán imponer las siguientes sanciones administrativas:\nI. Amonestación con apercibimiento cuando las infracciones sean menores, entendiéndose por éstas las que se cometan por error o ignorancia, siempre y cuando no hayan afectado la seguridad o salud de niñas y niños.\nreglamentarias.\nII. Multa de 100 a 1000 veces el valor diario de la Unidad de Medida y\nActualización, cuando:\na) Exista reincidencia en faltas menores, referidas en la Fracción I de este\nArtículo;\nb) Se impida total o parcialmente el desarrollo de la visita por parte de los supervisores correspondientes;\nc) No elaborar los alimentos ofrecidos a niñas y niños conforme al plan nutricional respectivo, y/o no cumplir con los requisitos mínimos de alimentación balanceada establecidos en la Norma Oficial respectiva; o bien, no cumplir con las medidas sanitarias pertinentes;\nd) Se modifique la estructura del inmueble o la distribución de los espacios sin contar con los permisos de la autoridad competente;\ne) Se incumpla con las medidas de salud y de atención médica en los términos que establezca la normatividad correspondiente; o\nf) Se realice por parte del personal de los Centros de Atención, algún acto de discriminación contra alguna niña o niño, de sus padres o tutores, o bien de cualquiera de sus integrantes.\nfiscales del Estado o del Ayuntamiento respectivo, a través del procedimiento administrativo de ejecución, en los términos previstos por las disposiciones legales aplicables.\nIII. Suspensión temporal de la autorización de tres a treinta días, en los casos siguientes:\na) Cuando no se cuente con el personal competente o suficiente para brindar los servicios para la atención, cuidado y Desarrollo Integral\nInfantil;\nb) Cuando no se regularice la situación que dio origen a la imposición de la multa, de forma que prevalezcan las causas que la originaron;\nc) Por realizar actividades con niñas y niños fuera de las instalaciones del padres, tutores o quienes tengan la responsabilidad de su atención, cuidado y crianza;\nd) El incumplimiento de los estándares mínimos de calidad y seguridad;\ne) Por el incumplimiento de los requisitos de autorización;\nf) Por el descuido por parte del personal del Centro de Atención que los niños;\ng) Por reincidir en alguna de las causas que originen las sanciones contenidas en la Fracción II de este Artículo; o\n(REFORMADO, P.O. 29 DE JUNIO DE 2020)\nh) Por la pérdida de la vida, la existencia de lesiones o afectaciones físicas y/o psicológicas en una niña o niño. En este caso la suspensión prevalecerá en tanto se determine la responsabilidad al Centro de\nAtención o personal relacionado con el mismo.\nIV. Revocación de la autorización y cancelación del registro, cuando concurran las siguientes causas:\n(REFORMADO, P.O. 29 DE JUNIO DE 2020)\na) Pérdida de la vida, la existencia de lesiones o afectaciones físicas y/o psicológicas en una niña o niño, acreditadas mediante sentencia incumplimiento de las disposiciones contenidas en la presente Ley;\nb) Comisión de cualquier delito sexual acreditado al personal del Centro de Atención mediante resolución judicial;\nc) Falta de regularización oportuna de la situación que dio origen a la imposición de una suspensión temporal, de tal forma que las causas que originaron a la misma sigan vigentes;\nd) Interrupción sin causa justificada de las actividades del Centro de\nAtención por un lapso mayor de 5 días naturales; o\ne) Realización reiterada de actividades diferentes a las autorizadas.\nnueva licencia de funcionamiento.\nArtículo 67.- Son parámetros para calificar las infracciones y para individualizar las sanciones los siguientes:\nI. El riesgo o daño que se haya producido o pueda producirse en la salud de las niñas y los niños, así como de las demás personas;\nII. Las condiciones socioeconómicas del infractor; y\nIII. La calidad de reincidente del infractor, en tal caso.\nArtículo 68.- En caso de que las violaciones a los preceptos de esta Ley, o a los reglamentos y disposiciones que de ella emanen, sean cometidas por servidores públicos del Estado o de los Municipios, se sujetarán a los términos de la Ley de Responsabilidades Administrativas del Estado de\nAguascalientes.\nLas sanciones administrativas serán independientes de aquellas que correspondan como consecuencia de que dichas violaciones impliquen la comisión de alguna conducta calificable como delito.\nARTÍCULO PRIMERO.- El presente Decreto iniciará su vigencia al día siguiente de su publicación en el Periódico Oficial del Estado de\nAguascalientes.\ndel Estado, en el ámbito de sus respectivas competencias y con apego a las disposiciones contenidas en el presente ordenamiento, expedirán las normas reglamentarias dentro de los 120 días naturales siguientes a partir de la entrada en vigor del presente Decreto.\nARTÍCULO TERCERO.- El Consejo al que se refiere la presente Ley, deberá instalarse en un plazo que no exceda de los 90 días naturales, contado a partir de la entrada en vigor del Decreto.\nARTÍCULO CUARTO.- El Consejo tendrá un plazo de 180 días naturales, contados a partir de su instalación, para elaborar un diagnóstico sobre el estado que guardan los Centros de Atención en el Estado.\nAl Ejecutivo para su promulgación y publicación.\nDado en el Salón de Sesiones “Soberana Convención Revolucionaria de\nAguascalientes”, del Palacio Legislativo, a los diez días del mes de marzo del año dos mil dieciséis.\nLo que tenemos el honor de comunicar a usted, para los efectos\nConstitucionales conducentes.\nAguascalientes, Ags., a 10 de marzo del año 2016.\nLA MESA DIRECTIVA:\nDip. J. Luis Fernando Muñoz López,\nPRESIDENTE.\nDip. Salvador Dávila Montoya,\nPROSECRETARIO EN FUNCIONES DE PRIMER SECRETARIO\n(Artículo 112 del Reglamento de la Ley Orgánica del Poder Legislativo).\nDip. María de Lourdes Dávila Castañeda,\nSEGUNDA SECRETARIA.\nEn cumplimiento de lo dispuesto por la fracción I del Artículo 46 de la publicación y observancia, promulgo el presente Decreto en la\nRúbrica.- Lic. Alejandro Bernal Rubalcava, en suplencia del Secretario\nGeneral de Gobierno por ministerio de Ley. Rúbrica.\n[N. DE E. A CONTINUACIÓN SE TRANSCRIBEN LOS ARTÍCULOS\nORDENAMIENTO.]\n[N. DE E. TRANSITORIOS DEL \"DECRETO NÚMERO 353.- ARTÍCULO\nÚNICO.- REFORMAS Y ADICIONES A LA LEY DE PRESTACIÓN DE\nSERVICIOS PARA ATENCIÓN, CUIDADO Y DESARROLLO INTEGRAL\nINFANTIL PARA EL ESTADO DE AGUASCALIENTES\".]\nARTÍCULO PRIMERO. - El presente Decreto iniciará su vigencia al día siguiente de su publicación en el Periódico Oficial del Estado, salvo lo expedidas en términos del Artículo Segundo Transitorio del Decreto 325 de la LXII Legislatura, publicado en fecha 04 de abril de 2016 en el\nPeriódico Oficial del Estado, al contenido del presente Decreto, en un plazo que no exceda de 180 días naturales.\nARTÍCULO TERCERO. - Los Centros de Atención contarán con el plazo de un año contado a partir de la entrada en vigor del Artículo 39, para prescrito en dicho Artículo.\n[N. DE E. TRANSITORIOS DEL “DECRETO NÚMERO 674.- SE ADICIONA EL\nPÁRRAFO SEGUNDO AL ARTÍCULO 10 DE LA LEY DE PRESTACIÓN DE\nSERVICIOS PARA LA ATENCIÓN, CUIDADO Y DESARROLLO INTEGRAL\nINFANTIL PARA EL ESTADO DE AGUASCALIENTES”.]\nARTÍCULO ÚNICO. - El presente Decreto iniciará su vigencia al día siguiente de su publicación en el Periódico Oficial del Estado.",
  "ordenamiento": "REGLAMENTO",
  "jurisdiccion": "AGUAS CALIENTES",
  "fuente_oficial": "DIARIO OFICIAL DE LA FEDERACION",
  "Fecha de Publicación": "4 de abril de 2016",
  "Última Reforma Publicada": "27 DE MAYO \nDE 2024",
  "es_escaneado": false,
  "tiene_tablas": false,
  "materia": [
    "general"
  ]
}