{
  "titulo": "Acuerdo DEL EJECUTIVO DEL ESTADO POR EL QUE SE DAN A CONOCER LAS VARIABLES y FÓRMULAS UTILIZADAS PAR",
  "Contenido": "MUNICIPIO DEL ESTADO DE CAMPECHE, ASÍ COMO EL CALENDARIO DE MINISTRACIONES\nPARA EL EJERCICIO FISCAL 2020 DEL FONDO DE APORTACIONES PARA EL FORTALECIMIENTO\nDE LOS MUNICIPIOS Y DE LAS DEMARCACIONES TERRITORIALES DEL DISTRITO FEDERAL.\nLIC. CARLOS MIGUEL AYSA GONZÁLEZ, Gobernador del Estado de Campeche, en ejercicio de la facultad que me confiere la fracción XIX del artículo 71 y el artículo 73 de la Constitución Política del\nEstado de Campeche, y con fundamento en los artículos 26 y 115 de la Constitución Política de los\nEstados Unidos Mexicanos; 25, fracción IV, 36, 37 y 38 de la Ley de Coordinación Fiscal; los Anexos 1, apartado C y 22 del Decreto de Presupuesto de Egresos de la Federación para el Ejercicio Fiscal 2020, publicado en el Diario Oficial de la Federación el 11 de diciembre de 2019; los artículos 47 y 49 de la Ley del Sistema de Coordinación Fiscal del Estado de Campeche y los artículos 14, 15, 16 fracción II y 22 de la Ley Orgánica de la Administración Pública del Estado de Campeche; y\nCONSIDERANDO\nQue el 3 de enero de 2020 fue publicado en el Diario Oficial de la Federación el ACUERDO por el que se da a conocer a los gobiernos de las entidades federativas la distribución y calendarización para la ministración durante el ejercicio fiscal 2020, de los recursos correspondientes a los Ramos Generales 28\nParticipaciones a Entidades Federativas y Municipios, y 33 Aportaciones Federales para Entidades\nFederativas y Municipios, mismo que contiene los recursos otorgados para el Fortalecimiento de los\nMunicipios, incluidos los que forman parte del Estado de Campeche.\nQue el artículo 36 de la Ley de Coordinación Fiscal obliga a las Entidades federativas a publicar anualmente, en el correspondiente Periódico Oficial del Estado, las variables y fórmulas utilizadas para determinar los montos que correspondan a cada Municipio o Demarcación Territorial por concepto del\nFondo de Aportaciones para el Fortalecimiento de los Municipios y de las Demarcaciones Territoriales del\nDistrito Federal, a más tardar el día 31 de enero de cada ejercicio fiscal.\nQue conforme lo expuesto con anterioridad, y en cumplimiento a las obligaciones previstas en los artículos 36, 37 y 38 de la Ley de Coordinación Fiscal, tengo a bien expedir el siguiente:\nACUERDO DEL EJECUTIVO DEL ESTADO POR EL QUE SE DAN A CONOCER LAS VARIABLES Y\nFÓRMULAS UTILIZADAS PARA DETERMINAR LOS MONTOS QUE CORRESPONDEN A CADA\nMUNICIPIO DEL ESTADO DE CAMPECHE, ASÍ COMO EL CALENDARIO DE MINISTRACIONES\nPARA EL EJERCICIO FISCAL 2020 DEL FONDO DE APORTACIONES PARA EL FORTALECIMIENTO\nDE LOS MUNICIPIOS Y DE LAS DEMARCACIONES TERRITORIALES DEL DISTRITO FEDERAL.\nARTÍCULO PRIMERO.- Los Municipios de Calakmul, Calkiní, Campeche, Candelaria, Carmen, Champotón, Escárcega, Hecelchakán, Hopelchén, Palizada y Tenabo contarán con la cantidad de $654´333,831 (Seiscientos cincuenta y cuatro millones trescientos treinta y tres mil ochocientos treinta y un pesos 00/100 M.N.), para el ejercicio fiscal 2020, como parte de los recursos otorgados por\nDemarcaciones Territoriales del Distrito Federal (FORTAMUNDF), misma que será distribuida entre ellos conforme las disposiciones del presente Acuerdo.\nARTÍCULO SEGUNDO.- La distribución del FORTAMUNDF entre los Municipios del Estado de Campeche se realizará en proporción directa al número de habitantes con que cuenta cada Municipio, teniendo como base la información estadística de la Encuesta Intercensal 2015 realizada por el Instituto Nacional de\nEstadística y Geografía (INEGI), utilizando para tal efecto la fórmula siguiente:\nCuyas variables de cálculo se definen de la siguiente manera:\nF = Monto del Fondo de Aportaciones para el Fortalecimiento de los Municipios y de las Demarcaciones i,t\nTerritoriales del Distrito Federal (FORTAMUNDF) del Municipio i en el año t.\nMD = Monto a distribuir del FORTAMUNDF entre los Municipios del estado en el año t.\nFD = Factor de distribución del Municipio i en el año t.\ni,t\nPM = Población del Municipio i, de acuerdo con la información más reciente publicada por el INEGI.\ni,t\nARTÍCULO TERCERO. - La distribución que resulta de aplicar la metodología de la fórmula señalada en el artículo anterior es la siguiente:\nVariables de distribución para determinar los montos que corresponden a cada municipio por concepto de FORTAMUNDF 2020\nFactor de Monto a distribuir\nMunicipio Habitantes\nDistribución (Pesos)\nTOTAL 899,931 1.0000000000 654,333,831\nCalakmul 28,424 0.0315846437 20,666,901\nCalkiní 56,537 0.0628237054 41,107,676\nCampeche 283,025 0.3144963336 205,785,591\nCandelaria 43,879 0.0487581826 31,904,128\nCarmen 248,303 0.2759133756 180,539,456\nChampotón 90,244 0.1002787992 65,615,811\nEscárcega 58,553 0.0650638771 42,573,496\nHecelchakán 31,230 0.0347026605 22,707,125\nHopelchén 40,100 0.0445589717 29,156,443\nPalizada 8,971 0.0099685420 6,522,754\nTenabo 10,665 0.0118509086 7,754,450\nFuente: Encuesta Intercensal 2015. Estados Unidos Mexicanos, publicada por el\nInstituto Nacional de Estadística y Geografía (INEGI).\nFuente: Cálculo de la Secretaría de Finanzas, con base en el ACUERDO por el que se calendarización para la ministración durante el ejercicio fiscal 2020, de los recursos correspondientes a los Ramos Generales 28 Participaciones a Entidades Federativas y\nMunicipios, y 33 Aportaciones Federales para Entidades Federativas y Municipios. DOF\nARTÍCULO CUARTO.- Las ministraciones de los recursos que corresponden a cada Municipio del Estado de Campeche se realizarán mensualmente, en las fechas establecidas en el Calendario de Ministraciones para el Ejercicio Fiscal 2020, que se menciona a continuación, considerando los montos establecidos en la Tabla 1 del presente Acuerdo\nCalendario de ministraciones del\nFORTAMUNDF. 2020\nFecha de Ministración del\nFORTAMUNDF\nEnero 31\nFebrero 28\nMarzo 31\nAbril 30\nMayo 29\nJunio 30\nJulio 31\nAgosto 31\nSeptiembre 30\nOctubre 30\nNoviembre 30\nDiciembre 14\nTabla 1\nCalendario de ministraciones mensuales por municipio del FORTAMUNDF. 2020\nMunicipio Enero Febrero Marzo Abril Mayo Junio Julio\nCalakmul 1,722,242 1,722,242 1,722,242 1,722,242 1,722,242 1,722,242 1,722,242\nCalkiní 3,425,640 3,425,640 3,425,640 3,425,640 3,425,640 3,425,640 3,425,640\nCampeche 17,148,799 17,148,799 17,148,799 17,148,799 17,148,799 17,148,799 17,148,799\nCandelaria 2,658,677 2,658,677 2,658,677 2,658,677 2,658,677 2,658,677 2,658,677\nCarmen 15,044,955 15,044,955 15,044,955 15,044,955 15,044,955 15,044,955 15,044,955\nChampotón 5,467,984 5,467,984 5,467,984 5,467,984 5,467,984 5,467,984 5,467,984\nEscárcega 3,547,791 3,547,791 3,547,791 3,547,791 3,547,791 3,547,791 3,547,791\nHecelchakán 1,892,260 1,892,260 1,892,260 1,892,260 1,892,260 1,892,260 1,892,260\nHopelchén 2,429,704 2,429,704 2,429,704 2,429,704 2,429,704 2,429,704 2,429,704\nPalizada 543,563 543,563 543,563 543,563 543,563 543,563 543,563\nTenabo 646,204 646,204 646,204 646,204 646,204 646,204 646,204\nTotal 54,527,819 54,527,819 54,527,819 54,527,819 54,527,819 54,527,819 54,527,819\nCalakmul 1,722,242 1,722,242 1,722,242 1,722,242 1,722,239 20,666,901\nCalkiní 3,425,640 3,425,640 3,425,640 3,425,640 3,425,636 41,107,676\nCampeche 17,148,799 17,148,799 17,148,799 17,148,799 17,148,802 205,785,591\nCandelaria 2,658,677 2,658,677 2,658,677 2,658,677 2,658,681 31,904,128\nCarmen 15,044,955 15,044,955 15,044,955 15,044,955 15,044,951 180,539,456\nChampotón 5,467,984 5,467,984 5,467,984 5,467,984 5,467,987 65,615,811\nEscárcega 3,547,791 3,547,791 3,547,791 3,547,791 3,547,795 42,573,496\nHecelchakán 1,892,260 1,892,260 1,892,260 1,892,260 1,892,265 22,707,125\nHopelchén 2,429,704 2,429,704 2,429,704 2,429,704 2,429,699 29,156,443\nPalizada 543,563 543,563 543,563 543,563 543,561 6,522,754\nTenabo 646,204 646,204 646,204 646,204 646,206 7,754,450\nTotal 54,527,819 54,527,819 54,527,819 54,527,819 54,527,822 654,333,831\nARTÍCULO QUINTO.- Los Municipios deberán ejercer los recursos que reciban derivados del\nFORTAMUNDF en los destinos que expresamente señala el artículo 37 de la Ley de Coordinación Fiscal.\nLos Municipios que reciban recursos del FORTAMUNDF tendrán las siguientes obligaciones:\na) Hacer del conocimiento de sus habitantes, conforme a los lineamientos de información pública financiera en línea emitidos por el Consejo Nacional de Armonización Contable, los montos que reciban, las obras y acciones a realizar, el costo de cada una, su ubicación, metas y beneficiarios; e\nb) Informar a sus habitantes los avances del ejercicio de los recursos trimestralmente y al término del\nEjercicio Fiscal 2020, sobre los resultados alcanzados, conforme a los lineamientos de información pública emitidos por el Consejo Nacional de Armonización Contable, en los términos de la Ley General de Contabilidad Gubernamental.\nTRANSITORIO\nÚNICO. - El presente Acuerdo entrará en vigor al día siguiente de su publicación en el Periódico Oficial del Estado.\nFrancisco de Campeche, Municipio y Estado de Campeche, Estados Unidos Mexicanos, a los veintitrés días del mes de enero del año dos mil veinte.\nLic. Carlos Miguel Aysa González\nGobernador del Estado de Campeche\nC.P. Guadalupe Esther Cárdenas Guerrero\nSecretaria de Finanzas",
  "ordenamiento": "ACUERDO",
  "jurisdiccion": "CAMPECHE",
  "fuente_oficial": "DIARIO OFICIAL DE LA FEDERACION",
  "Fecha de Publicación": "11 de diciembre de 2019",
  "es_escaneado": false,
  "tiene_tablas": true,
  "materia": [
    "general"
  ]
}