{
  "titulo": "Acuerdo POR EL QUE SE REANUDAN LOS PLAZOS y TÉRMINOS DE LOS PROCEDIMIENTOS, RECURSOS, ACTUACIONES y",
  "Contenido": "DEL ESTADO DE CAMPECHE.\ndel Estado de Campeche, con fundamento en lo establecido en los artículos 72 de la la Ley Orgánica de la Administración Pública del Estado de Campeche; 1, 2, 3, 5, 7 Bis, 8, 9, 10, 11, 12, 13, 14, 15, 16, 17, 18, 19, 20, 21, 22, 23, 24, 25, 26, 28, 29, 30, 31, 32, 33, 34, 35, 36, 37, 38, 39, 40, 41, 42, 43 y 43 Bis del Reglamento Interior de la Secretaría\nGeneral de Gobierno de la Administración Pública del Estado de Campeche; y\nCONSIDERANDO\nQue el Gobernador del Estado de Campeche expidió el Acuerdo por el que se instruye a las personas titulares de las Dependencias y Entidades de la Administración Pública del\nEstado de Campeche para suspender, de manera temporal, los procedimientos, recursos, programas, acciones, plazos y términos legales de la Administración Pública del Estado de\nCampeche, como medida frente a la Epidemia por el virus SARS-COV2 (COVID-19), publicado en el Periódico Oficial del Estado el 31 de marzo de 2020.\nQue en misma fecha fue publicado en esa gaceta oficial, el Acuerdo del Secretario General de Gobierno del Poder Ejecutivo del Estado de Campeche, por el que se suspenden los plazos y términos de los procedimientos, recursos, actuaciones y diligencias administrativas de la Secretaría General de Gobierno, como medida preventiva para la mitigación y control de los riesgos para la salud que implica la enfermedad por el virus SARS-CoV2 (COVID-\n19), en cumplimiento al numeral Primero del Acuerdo citado en el párrafo que antecede.\nQue con la finalidad de exceptuar el servicio registral, mediante el uso de los medios de comunicación electrónica, trabajo a distancia de manera virtual (Home Office), servicios en línea, aplicaciones APPS gubernamentales y firma electrónica, en fecha 6 de mayo de 2020, fue publicado en el Periódico Oficial del Estado, el Acuerdo por el que se modifica el diverso Acuerdo del Secretario General de Gobierno del Poder Ejecutivo del Estado de\nCampeche, por el que se suspenden los plazos y términos de los procedimientos, recursos, actuaciones y diligencias administrativas, de la Secretaría General de Gobierno, como medida preventiva para la mitigación y control de los riesgos para la salud que implica la enfermedad por el virus SARS-CoV2 (COVID-19), publicado en el Periódico Oficial del\nInnovación Gubernamental de esta Administración Pública Estatal, por el que establecen con un comité interno encargado de implementar, vigilar y supervisar el cumplimiento de las medidas sanitarias en el centro de trabajo al que pertenezcan, de conformidad con lo\nEstado, el Acuerdo del Secretario General de Gobierno por el que se crea el Comité Interno para la implementación, vigilancia y supervisión del de las medidas de seguridad sanitaria para la reactivación laboral de los centros de trabajo de la Secretaría General de Gobierno de la Administración Pública del Estado de Campeche, con el objeto de proteger y salvaguardar la salud de las personas servidoras públicas, así como de la ciudadanía que requiera de los servicios de esta dependencia.\nQue derivado de las acciones para el restablecimiento paulatino de las labores presenciales en los centros de trabajo de la Secretaría General de Gobierno, así como del semáforo por regiones que evalúa el riesgo epidemiológico relacionado con la apertura de actividades en las entidades federativas, es necesario reanudar los los plazos y términos de los procedimientos, recursos, actuaciones y diligencias administrativas de esta dependencia, con las medidas sanitarias necesarias para preservar la salud de la población campechana.\nQue, por todo lo expuesto, se emite el siguiente:\nACUERDO POR EL QUE SE REANUDAN LOS PLAZOS Y TÉRMINOS DE LOS\nPROCEDIMIENTOS, RECURSOS, ACTUACIONES Y DILIGENCIAS ADMINISTRATIVAS\nDE LA SECRETARÍA GENERAL DE GOBIERNO DE LA ADMINISTRACIÒN PÙBLICA\nDEL ESTADO DE CAMPECHE.\nArtículo único. Se reanudan a partir del 19 de octubre de 2020, los términos y plazos dentro de los procedimientos, recursos, actuaciones y diligencias administrativas, de la competencia de la Secretaría General de Gobierno del Poder Ejecutivo del Estado, de conformidad con los artículos 3, 31, 32, 33, 34 y 35 de la Ley de Procedimiento\nAdministrativo para el Estado y los Municipios de Campeche.\nTRANSITORIOS\nPrimero. El presente Acuerdo entrará en vigor al día siguiente de su publicación en el\nPeriódico Oficial del Estado.\ndel Estado de Campeche, por el que se suspenden los plazos y términos de los\nDado en la Ciudad de San Francisco de Campeche, Municipio y Estado de Campeche, el día quince del mes de septiembre del año dos mil veinte.",
  "ordenamiento": "ACUERDO",
  "jurisdiccion": "CAMPECHE",
  "fuente_oficial": "DIARIO OFICIAL DE LA FEDERACION",
  "Fecha de Publicación": "6 de mayo de 2020",
  "es_escaneado": false,
  "tiene_tablas": true,
  "materia": [
    "general"
  ]
}