{
  "titulo": "Acuerdo DEL EJECUTIVO DEL ESTADO DE CAMPECHE POR EL QUE SE SUSPENDE TEMPORALMENTE EL COBRO FÍSICO EN",
  "Contenido": "ESTADO DE CAMPECHE.\nLic. Carlos Miguel Aysa González, Gobernador del Estado de Campeche, en ejercicio de la del Estado de Campeche; 1, 3, 14 y 15 de la Ley Orgánica de la Administración Pública del Estado de Campeche; 132 de la Ley de Salud para el Estado de Campeche y el artículo 3 del Código\nFiscal del Estado de Campeche en vigor; y\nCONSIDERANDO\nQue en fecha 31 de enero de 2020 fue publicado en el Periódico Oficial del Estado de Campeche el Acuerdo del Ejecutivo del Estado de Campeche por el que se otorgan beneficios fiscales en materia de derecho por canje de placas de fecha 30 de enero de 2020.\nQue por medio del referido Acuerdo se otorgó un estímulo fiscal en concepto de subsidio por parte del Poder Ejecutivo del Estado, con vigencia determinada del 1° de febrero de 2020 al 31 de marzo de 2020, consistente en que el Estado de Campeche por única ocasión se haría cargo de pagar el monto diferencial de la UMA vigente al 31 de enero de 2020 que es de $84.49 contra la vigente a partir del día 1 de febrero de 2020 que se ubicará en $86.88, subsidio estatal que aplica al cobro de derechos por servicios que prestan las autoridades de tránsito de los municipios por juego de placas de circulación, incluyendo calcomanía y tarjeta de circulación del año establecidos en el artículo 74 de la Ley de Hacienda de los Municipios del Estado de Campeche.\nQue dicha medida en la actualidad resulta insuficiente, en razón de la contingencia sanitaria provocada por el virus COVID-19.\nQue el Director General de la Organización Mundial de la Salud en la rueda de prensa sobre la\nCOVID-19 celebrada el 11 de marzo de 2020, llegó a la conclusión de que la COVID-19 puede considerarse una pandemia y que todos los países deben encontrar un delicado equilibrio entre la protección de la salud, la minimización de los trastornos sociales y económicos, y el respeto de los derechos humanos.\nLa pandemia de la COVID-19 es una emergencia sanitaria y social mundial que requiere una acción efectiva e inmediata de los gobiernos y las personas. Todos los gobiernos tienen un papel esencial que desempeñar minimizando la probabilidad de transmisión y el impacto en la sociedad.\nLa adopción de medidas tempranas, audaces y eficaces reducirá los riesgos de corto plazo para la sociedad y los costos de largo plazo para la economía.\na la población del Estado.\nQue como parte de estas acciones, se ha considerado necesario suspender temporalmente el del Estado de Campeche, con la facultad que al Ejecutivo le confiere el artículo 3 del Código materia de sana distancia y, se toma con el fin prevenir una mayor propagación del virus en lugares concurridos, como son las áreas físicas de cobro.\nQue esta Administración Gubernamental Estatal tiene el más alto propósito de velar por la salud y apoyar la economía de las familias campechanas con la finalidad de emitir las medidas sanitarias necesarias y, a su vez, ayudarles en sus obligaciones contributivas, sin que resulten afectados en su salud y economía familiar y tampoco resulte afectada la hacienda pública municipal. Para materializar esta medida, el Ejecutivo a mi cargo ha decidido emitir el siguiente:\nACUERDO DEL EJECUTIVO DEL ESTADO DE CAMPECHE POR EL QUE SE SUSPENDE\nTEMPORALMENTE EL COBRO FÍSICO EN MÓDULOS DEL “SEAFI” DEL PAGO DEL\nDERECHO POR CANJE DE PLACAS Y SE PRORROGA EL OTORGAMIENTO DE\nBENEFICIOS FISCALES POR ESE CONCEPTO A LAS Y LOS CONTRIBUYENTES DEL\nESTADO DE CAMPECHE.\nPrimero: Se suspende temporalmente el cobro físico, en Módulos del Servicio de Administración\nFiscal del Estado de Campeche, del derecho por canje de placas, por el plazo comprendido del día jueves 19 de marzo de 2020 al domingo 19 de abril de 2020, reanudándose los cobros en un nuevo plazo a partir del día lunes 20 al 30 de abril de 2020, en los horarios, días y lugares establecidos, en razón de que dicho cobro físico genera mayor afluencia de contribuyentes en los\nMódulos.\nEl SEAFI deberá adoptar las medidas necesarias a fin de garantizar el cobro y presentación de declaraciones relacionadas con el cumplimiento de obligaciones fiscales de carácter estatal y municipal convenidas, privilegiando el uso de Medios electrónicos.\nSegundo: Se prorroga el estímulo fiscal otorgado mediante el Acuerdo del Ejecutivo del Estado locales del Estado.\nLa aplicación de este beneficio fiscal no dará lugar a devolución alguna.\njuego de placas de circulación, incluyendo calcomanía y tarjeta de circulación en los lugares establecidos.\nEl SEAFI, para el cumplimiento de las obligaciones fiscales de pago y presentación de declaraciones, deberá orientar y difundir a las y los contribuyentes respecto de la utilización de medios electrónicos y de contacto.\nTRANSITORIOS\nPrimero: El presente Acuerdo entrará en vigor el día 19 de marzo de dos mil veinte, previa publicación en el Periódico Oficial del Estado.\nSegundo: Se faculta a la Secretaría de Finanzas de la Administración Pública del Estado de\nCampeche para que lleve a cabo los ajustes al presupuesto estatal y los registros contables de conformidad con la legislación aplicable para el debido cumplimiento de este Acuerdo.\nTercero: La Secretaría de Finanzas deberá comunicar de la emisión de este Acuerdo a los\nMunicipios de Calakmul, Calkiní, Campeche, Candelaria, Carmen, Champotón, Escárcega, Hecelchakán, Hopelchén, Palizada y Tenabo; así como al Servicio de Administración Fiscal del\nEstado de Campeche.\nSan Francisco de Campeche, Municipio y Estado de Campeche, a los 18 días del mes de marzo del año dos mil veinte.\nLIC. CARLOS MIGUEL AYSA GONZÁLEZ\nGOBERNADOR DEL ESTADO DE CAMPECHE",
  "ordenamiento": "ACUERDO",
  "jurisdiccion": "CAMPECHE",
  "fuente_oficial": "DIARIO OFICIAL DE LA FEDERACION",
  "Fecha de Publicación": "31 de enero de 2020",
  "es_escaneado": false,
  "tiene_tablas": false,
  "materia": [
    "municipal"
  ]
}