{
  "titulo": "Acuerdo DEL SECRETARIO DE DESARROLLO ECONÓMICO DEL PODER EJECUTIVO DEL ESTADO DE CAMPECHE POR EL QUE",
  "Contenido": "DESARROLLO ECONÓMICO, ENCARGADO DE LA IMPLEMENTACIÓN, EJECUCIÓN, VIGILANCIA Y\nLABORAL EN ESTA SECRETARÍA.\nLIC. RICARDO AUGUSTO OCAMPO FERNÁNDEZ, Secretario de Desarrollo Económico del Poder\nEjecutivo del Estado de Campeche, con fundamento en lo dispuesto en el artículo 4 de la Constitución\nPolítica de los Estados Unidos Mexicanos; artículos 1, 2, 10, 12, 15, 16 fracción XI y 31 de la Ley Orgánica de la Administración Pública del Estado de Campeche; 1, 2, 4, 10 y 11 del Reglamento Interior de la tercero transitorio del Acuerdo que emitieron en conjunto la Secretaría de Salud y la Secretaría de\nAdministración e Innovación Gubernamental, publicado en el Periódico Oficial del Estado el día 20 de agosto de 2020, bajo el tenor de los siguientes:\nCONSIDERANDOS\nI.- Que el 14 de mayo de 2020, la Secretaría de Salud de la Administración Pública Federal publicó en el\nDiario Oficial de la Federación el Acuerdo por el que se estableció una estrategia para la reapertura de las actividades sociales, educativas y económicas, así como un sistema de semáforo por regiones para evaluar semanalmente el riesgo epidemiológico relacionado con la reapertura de actividades en cada entidad federativa, así como se establecieron acciones extraordinarias.\nII.- Que el 29 de mayo del año 2020, se publicó en el Diario Oficial de la Federación el Acuerdo emitido por la Secretaría de Salud de la Administración Pública Federal, mediante el cual se establecieron los\nLineamientos Técnicos Específicos para la Reapertura de las Actividades Económicas, mismos que son de aplicación general en todos los centros de trabajo, y que tienen por objetivo establecer las medidas específicas que se deberán implementar en el marco de la estrategia general para la “Nueva Normalidad”, con el fin de lograr un retorno o la continuidad de las actividades laborales de manera segura, escalonada y responsable.\nIII.- Que se considera prioritario dar cumplimiento a las medidas sanitarias para la reactivación laboral en las oficinas del Poder Ejecutivo del Estado de Campeche, a fin de salvaguardar la salud e integridad de las y los servidores públicos.\nIV.- Que con fecha 20 de agosto de 2020, se publicó en Periódico Oficial del Estado de Campeche el\nAcuerdo que emitieron en conjunto la Secretaría de Salud y la Secretaría de Administración e Innovación\nGubernamental, ambas de la Administración Pública del Estado de Campeche, mediante el cual se el Derecho a la Salud de las y los Servidores Públicos, ante las nuevas Condiciones Generales originadas por la Pandemia SARS-CoV2 (COVID-19).\nEstado, prevé la creación de un Comité Interno en cada una de las Dependencias y Entidades del Poder\nEjecutivo del Estado de Campeche, mismo que será el encargado de implementar, vigilar y supervisar el cumplimiento de las medidas sanitarias de la Dependencia o Entidad a la que pertenezcan, de conformidad la Reapertura de las Actividades Económicas.\nVI.- Que el presente Comité Interno estará presidido por la persona titular de la Secretaría de Desarrollo persona titular de la Dirección Administrativa; asimismo, tendrá 11 vocales que serán las personas titulares de la Subsecretaría de Planeación, Innovación y Competitividad, de la Subsecretaría de Vinculación y\nSectores Estratégicos, de la Dirección de Asuntos Jurídicos, de la Dirección de Planeación, de la Dirección de Competitividad, de la Dirección de Innovación y Desarrollo Tecnológico, de la Dirección de Vinculación\nInterinstitucional y Municipios, del Instituto Campechano del Emprendedor, del Instituto para el Desarrollo de la Micro, Pequeña y Mediana Empresa, de la Promotora de Productos y Servicios de Campeche y de la\nComisión de Mejora Regulatoria del Estado de Campeche. De igual forma, el Órgano Interno de Control tendrá la calidad de invitado permanente en las sesiones del Comité Interno, debido a que, con fundamento en el artículo 24 de la Ley Orgánica de la Administración Pública del Estado de Campeche, se encuentra adscrito a la Secretaría de la Contraloría y tiene a su cargo, entre otras atribuciones, la responsabilidad de mantener el control interno de la Dependencia o Entidad a la que se encuentra adscrito, la función de apoyar la política de control interno y de la toma decisiones relativas al cumplimiento de los objetivos y las políticas institucionales, así como el desempeño de las y los servidores públicos y órganos, a la modernización continua y desarrollo eficiente de la gestión administrativa y al correcto manejo de los recursos públicos.\nVII.- Que en cumplimiento de lo establecido en el artículo Tercero Transitorio del Acuerdo que emitieron en conjunto la Secretaría de Salud y la Secretaría de Administración e Innovación Gubernamental, ambas de la Administración Pública del Estado de Campeche, publicado el 20 de agosto de 2020 en el Periódico\nOficial del Estado; se emite el siguiente:\nACUERDO DEL SECRETARIO DE DESARROLLO ECONÓMICO DEL PODER EJECUTIVO DEL\nESTADO DE CAMPECHE POR EL QUE SE CREA EL COMITÉ INTERNO DE LA SECRETARÍA DE\nDESARROLLO ECONÓMICO, ENCARGADO DE LA IMPLEMENTACIÓN, EJECUCIÓN, VIGILANCIA Y\nSUPERVISIÓN DEL CUMPLIMIENTO DE LAS MEDIDAS SANITARIAS PARA LA REACTIVACIÓN\nLABORAL EN ESTA SECRETARÍA.\nPRIMERO. – El presente Acuerdo tiene como objeto establecer la creación, organización y funcionamiento del Comité Interno, encargado de la implementación, ejecución, vigilancia y supervisión de las medidas sanitarias que deben observarse para la reactivación laboral en las oficinas e instalaciones de la Secretaría de Desarrollo Económico, a fin de proteger el derecho a la salud de las y los servidores públicos, de conformidad con el Acuerdo que emitieron en conjunto la Secretaría de Salud y la Secretaría de\nAdministración e Innovación Gubernamental, publicado en el Periódico Oficial del Estado el día 20 de\nSEGUNDO. - El Comité Interno se integrará de la siguiente forma:\nI. Una o un Presidente, que será la persona titular de la Secretaría de Desarrollo Económico;\nII. Una o un Secretario Técnico, que será la persona titular de la Dirección Administrativa;\nIII. 11 Vocales, que serán:\na) La persona titular de la Subsecretaría de Planeación, Innovación y Competitividad;\nb) La persona titular de la Subsecretaría de Vinculación y Sectores Estratégicos;\nc) La persona titular de la Dirección de Asuntos Jurídicos;\nd) La persona titular de la Dirección de Planeación;\ne) La persona titular de la Dirección de Competitividad;\nf) La persona titular de la Dirección de Innovación y Desarrollo Tecnológico;\ng) La persona titular de la Dirección de Vinculación Interinstitucional y Municipios;\nh) La persona titular del Instituto Campechano del Emprendedor;\ni) La persona titular del Instituto para el Desarrollo de la Micro, Pequeña y Mediana Empresa;\nj) La persona titular de la Promotora de Productos y Servicios de Campeche; y\nk) La persona titular de la Comisión de Mejora Regulatoria del Estado de Campeche.\nCada integrante del Comité Interno podrá nombrar a una o un suplente, quien le representará en el Comité.\nun Servidor Público que sirva como enlace con el Comité Interno, y que colabore con éste en el cumplimiento de su objeto.\nLos cargos de las personas integrantes del Comité Interno son de carácter honorífico, por lo tanto, quienes los ocupen no recibirán retribución alguna por su desempeño.\nEl Órgano Interno de Control tendrá la calidad de invitado permanente en las sesiones del Comité Interno.\nTERCERO. - El Comité Interno, además de las atribuciones establecidas en las disposiciones emitidas por las autoridades competentes, tendrá a su cargo las responsabilidades que a continuación se señalan:\nI. Decidir las formas de entrada y salida del personal de nómina y personal asimilados a salarios, en las labores presenciales, en horarios escalonados, para evitar los horarios pico tanto en los accesos como en el transporte público o en el transporte del personal;\nII. Fijar las fechas y horas en las que se requerirá la presencia de las y los prestadores de servicios profesionales para acudir a esta Dependencia a entregar sus encomiendas y los reportes de sus actividades;\nIII. Establecer las formas en las que se ejecutarán las medidas sanitarias, verificar su implementación y vigilar el desarrollo de las actividades que permitan su establecimiento para la seguridad de las y los trabajadores de esta Dependencia;\nIV. Realizar las gestiones y trámites administrativos necesarios, a efecto de contar con la disponibilidad y suficiencia presupuestal que permita realizar las adquisiciones y contratación de servicios, en los términos y formas previstas en la normatividad vigente en la materia, para el debido cumplimiento de las acciones de seguridad e higiene, debiendo ajustarse a los recursos disponibles autorizados en el presupuesto de egresos vigente;\nV. Entregar cubrebocas al personal de nómina y al personal asimilados a salarios, así como verificar su correcto uso;\nVI. En caso de que se detecte personal con signos de enfermedades respiratorias y/o temperatura corporal mayor a 37.5 °C, designar un área de estancia y aislamiento y remitirlas al domicilio particular o a los servicios médicos correspondientes y, cuando sea procedente, asistirlas para el trámite de su incapacidad digital;\nVII. Identificar, para cada unidad administrativa, al personal en situación de vulnerabilidad y verificar que padezcan;\nVIII. Llevar el registro y seguimiento del personal en resguardo domiciliario voluntario, e informar a casos de contagio;\nIX. Vigilar que se limpien y desinfecten constantemente superficies y objetos de uso común en oficinas, sitios cerrados, centros de reunión, entre otros;\nX. Verificar y garantizar la disponibilidad permanente de agua potable, jabón, papel higiénico, gel a base de alcohol al 70 por ciento y toallas desechables para el secado de manos;\nXI. Establecer los lugares para la colocación de filtros en los que se verifique la temperatura corporal de las personas que entren a esta Dependencia, así como la identificación de personas con infección respiratoria aguda, en cumplimiento con las disposiciones de las autoridades sanitarias;\nXII. Establecer entradas y salidas exclusivas del personal. En caso de que se cuente con un solo acceso, éste se deberá dividir por barreras físicas a fin de contar con espacios determinados para el ingreso y salida del personal;\nXIII. Colocar en las áreas comunes (como baños, comedores y salas de juntas) marcas en el piso, paredes y/o mobiliario, recordando la distancia mínima de 1.5 metros entre personas;\nXIV. Garantizar que los sanitarios cuenten con lavamanos y con las condiciones adecuadas para la limpieza del personal (agua, jabón y toallas de papel desechable);\nXV. Establecer un programa de limpieza y mantenimiento permanente de la oficina, utilizando los productos de limpieza adecuados para prevenir la propagación del virus;\nXVI. Contar con suficientes depósitos de productos desechables y de uso personal, procurando la limpieza continua de los mismos;\nXVII. En caso de ser posible, favorecer la ventilación natural en espacios comunes o de mayor concentración de personal, además de aquellas áreas de trabajo con gran afluencia de personal;\nXVIII. Revisar el funcionamiento de los sistemas de extracción, en caso de contar con éstos, además de dar mantenimiento y cambios de filtros para su correcta operación;\nXIX. Verificar el uso apropiado de cubrebocas para todas las personas que ingresen o egresen de la oficina;\nXX. Proporcionar información general sobre el SARS-CoV-2 (COVID-19), los mecanismos de contagio, síntomas que ocasiona y las mejores maneras de prevenir la infección y el contagio de otras personas;\nXXI. Informar sobre la importancia que tiene el no acudir al trabajo o reuniones sociales cuando se presenten síntomas compatibles con el SARS-CoV-2 (COVID-19), para no ser un riesgo de potencial contagio para otras personas;\nXXII. Organizar un programa de capacitación para el personal directivo sobre las acciones y medidas para prevenir y evitar cadenas de contagio por SARS-CoV-2 (COVID-19), solicitando el apoyo de las Dependencias del Poder Ejecutivo correspondientes;\nXXIII. Dar a conocer al personal el teléfono de emergencia y otros medios de contacto con la autoridad sanitaria;\nXXIV. Implementar una política para el uso de las escaleras y elevadores manteniendo la sana distancia, evitando tocar, en la medida de lo posible, las superficies y procurando su limpieza constante;\nXXV. Establecer zonas exclusivas en área de alimentos y comedores, para reducir el riesgo de exposición del personal vulnerable; en caso de no ser posible, se deberán establecer horarios diferenciados para reducir el riesgo de contagio del personal identificado como vulnerable; y\nXXVI. Las demás que deriven de las medidas e instrucciones generadas por las autoridades sanitarias y por la Secretaría de Administración e Innovación Gubernamental.\nCUARTO. - La Secretaría Técnica será la responsable de realizar la supervisión de las medidas sanitarias, Económico.\nAsimismo, deberá informar oportunamente a la o el Secretario de Desarrollo Económico de todas las decisiones tomadas por el Comité Interno. También, comunicará a la o el Secretario de Desarrollo\nEconómico de las decisiones tomadas y de las acciones llevadas a cabo por el mismo Comité.\nQUINTO. - El Comité Interno sesionará de manera ordinaria, por lo menos, dos veces al año, salvo que no existan asuntos a tratar; y de manera extraordinaria, cuando la persona que ocupe la Presidencia lo estime pertinente o lo soliciten la mayoría de las personas integrantes. Las sesiones del Comité Interno podrán celebrarse bajo la modalidad presencial o en línea, según lo determine la persona que ocupe la\nPresidencia. Las sesiones del Comité Interno que se celebren bajo la modalidad en línea, así como los acuerdos que en ellas se tomen serán válidas, siempre y cuando se observen las formalidades establecidas para ello en este Acuerdo.\nLa persona que ocupe la Secretaría Técnica convocará a cada una de las personas integrantes del Comité\nInterno con una anticipación de, por lo menos, tres días hábiles a la fecha en que habrán de celebrarse las sesiones ordinarias, y de veinticuatro horas en el caso de las sesiones extraordinarias y de la sesión de instalación.\nLas convocatorias de las sesiones podrán realizarse mediante oficio o por correo electrónico y deberán señalar, por lo menos, el carácter y el número de la sesión, la modalidad, la fecha, la hora y el lugar de su celebración. Del mismo modo, llevarán adjuntas, en formato físico o electrónico, según la modalidad de la sesión de que se trate, el orden del día y la documentación necesaria para desahogar los asuntos a tratar en la sesión correspondiente.\nSEXTO. - Las decisiones sobre los asuntos que conozca el Comité Interno se aprobarán con el voto de la mayoría de las personas integrantes que asistan a la sesión correspondiente. En caso de empate, la persona que ocupe la Presidencia tendrá el voto de calidad.\nTodas las actas de las sesiones del Comité Interno deberán señalar, por lo menos, la modalidad, la fecha, la hora y el lugar de su celebración, así como los acuerdos alcanzados, identificados con un número consecutivo de seguimiento, y los asuntos discutidos durante la sesión correspondiente. Adicionalmente, las actas llevarán adjunta la lista de asistencia firmada por todas las personas que hubiesen participado en la sesión de que se trate y los documentos utilizados durante ésta.\nLa persona que ocupe la Secretaría Técnica será la encargada de levantar las actas a las que se hace referencia en el presente artículo.\nSÉPTIMO: En caso de que el Comité Interno tenga conocimiento del posible incumplimiento de las medidas establecidas en este Acuerdo, así como de cualquier disposición emitida aplicable, se deberá dar aviso inmediato al Órgano Interno de Control para que, en su caso, se inicie el procedimiento respectivo.\nTRANSITORIOS\nPRIMERO. - El presente Acuerdo entrará en vigor al día siguiente de su publicación en el Periódico Oficial del Estado.\nSEGUNDO. – A partir de la entrada en vigor del presente acuerdo se crea el Comité Interno de la Secretaría de Desarrollo Económico, encargado de la ejecución, implementación, vigilancia y supervisión del cumplimiento de las medidas sanitarias para la reactivación laboral en esta Secretaría; por lo que la sesión de instalación de dicho Comité Interno, a la que hace referencia el segundo párrafo del artículo Quinto del presente Acuerdo, deberá celebrarse, a más tardar, en un plazo no mayor a tres días naturales contados a partir de la entrada en vigor de este Acuerdo.\nTERCERO. - Las y los titulares de las unidades administrativas de esta Dependencia y de los órganos administrativos desconcentrados tendrán un plazo de tres días naturales, contados a partir de la entrada en vigor del presente Acuerdo, para comunicar a la persona titular de la Secretaría de Desarrollo Económico el nombramiento de la persona encargada de ser su enlace, conforme a lo dispuesto en el artículo Segundo del mismo.\nDado en la ciudad de San Francisco de Campeche, Municipio y Estado de Campeche, a los treinta y un días del mes de agosto del año dos mil veinte.\nLIC. RICARDO AUGUSTO OCAMPO FERNÁNDEZ\nSECRETARIO DE DESARROLLO ECONÓMICO",
  "ordenamiento": "ACUERDO",
  "jurisdiccion": "CAMPECHE",
  "fuente_oficial": "DIARIO OFICIAL DE LA FEDERACION",
  "Fecha de Publicación": "20 de agosto de 2020",
  "es_escaneado": false,
  "tiene_tablas": true,
  "materia": [
    "municipal",
    "económico"
  ]
}