{
  "titulo": "Acuerdo POR EL QUE SE CREA EL COMITÉ INTERNO DE LA SECRETARÍA DE EDUCACIÓN DE LA ADMINISTRACIÓN PÚBL",
  "Contenido": "______________________________________________\nLA ADMINISTRACIÓN PÚBLICA DEL ESTADO DE CAMPECHE, APLICABLE PARA EL PERSONAL\nQUE LABORA EN: EDIFICIO CENTRAL, EDIFICIO “B”, PAGADURÍA, CENTRO DE EVALUACIÓN, LOS\nCEDES Y ALMACENES; ENCARGADO DE LA IMPLEMENTACIÓN, VIGILANCIA Y SUPERVISIÓN DEL\nSECRETARÍA\nRICARDO ALFONSO KOH CAMBRANIS, Secretario de Educación de la Administración Pública del Estado de Campeche, con fundamento en lo establecido en los artículos 4 de la Constitución Política de los Estados\nUnidos Mexicanos; 1, 10, 12, 16, fracción VI, 26 fracciones I, II y III de la Ley Orgánica de la Administración\nPública del Estado de Campeche; 1, 9, 10, fracciones I, IV, XVII, y XXIII del Reglamento Interior de la\nSecretaría de Educación de la Administración Pública del Estado de Campeche, publicado en el Periódico\nOficial del Estado el 27 de abril de 2020; artículos Noveno y Tercero Transitorio del Acuerdo que emitieron en conjunto la Secretaría de Salud y la Secretaría de Administración e Innovación Gubernamental, ambas de la Administración Pública del Estado de Campeche, mediante el cual se establecieron los Lineamientos de Seguridad Sanitaria que deberán implementarse para la reactivación laboral en las Dependencias y\nEntidades del Poder Ejecutivo del Estado de Campeche, a efecto de proteger el Derecho a la Salud de las y los Servidores Públicos, ante las nuevas Condiciones Generales originadas por la Pandemia SARS-CoV2\n(COVID-19), y\nCONSIDERANDO\nQue con fecha 11 de marzo de 2020, la Organización Mundial de la Salud declaró que el brote del virus\nSARS-CoV2 (COVID-19) es una pandemia, por lo que consideró tal circunstancia como una emergencia de salud pública de relevancia internacional.\nQue el 30 de marzo de 2020, se publicó en el Diario Oficial de la Federación, el Acuerdo del Consejo de\nSalubridad General, en el que determina declarar como emergencia sanitaria por causa de fuerza mayor a la enfermedad causada por el virus SARS-CoV2 (COVID-19).\nQue el pasado 14 de mayo de 2020, se publicó en el Diario Oficial de la Federación, el Acuerdo emitido por la Secretaría de Salud de la Administración Pública Federal por el que se establece una estrategia para la reapertura de las actividades sociales, educativas y económicas, así como un sistema de semáforo por regiones para evaluar semanalmente el riesgo epidemiológico relacionado con la reapertura de actividades en cada entidad federativa, así como se establecen acciones extraordinarias.\nLineamientos Técnicos Específicos para la Reapertura de las Actividades Económicas, de aplicación general para todos los centros de trabajo, y que tienen por objetivo establecer las medidas específicas que las\nNormalidad, para lograr un retorno o la continuidad de las actividades laborales seguro, escalonado y responsable\nGubernamental, ambas de la Administración Pública del Estado de Campeche, mediante el cual se el Derecho a la Salud de las y los Servidores Públicos, ante la nuevas condiciones generales originadas por la Pandemia SARS-COV2 (COVID-19).\nQue el artículo Noveno y Tercero Transitorio del Acuerdo referido en el párrafo precedente, establece la de Campeche, mismo que será el encargado de implementar, vigilar y supervisar el cumplimiento de las medidas sanitarias de la Dependencia o Entidad a la que pertenezcan, de conformidad con lo establecido\nActividades Económicas y asimismo que el Comité Interno deberá crearse en un plazo no mayor a diez días naturales, contados a partir de la entrada en vigor del citado Acuerdo.\nEn razón de lo anterior, he tenido a bien expedir el siguiente:\nACUERDO POR EL QUE SE CREA EL COMITÉ INTERNO DE LA SECRETARÍA DE EDUCACIÓN DE\nLA ADMINISTRACIÓN PÚBLICA DEL ESTADO DE CAMPECHE, APLICABLE PARA EL PERSONAL\nQUE LABORA EN: EDIFICIO CENTRAL, EDIFICIO “B”, PAGADURÍA, CENTRO DE EVALUACIÓN, LOS\nCEDES Y ALMACENES; ENCARGADO DE LA IMPLEMENTACIÓN, VIGILANCIA Y SUPERVISIÓN DEL\nCUMPLIMIENTO DE LAS MEDIDAS SANITARIAS PARA LA REACTIVACIÓN LABORAL EN ESTA\nSECRETARÍA\nPRIMERO.- El presente Acuerdo tiene como objeto establecer la creación, organización y funcionamiento del Comité Interno encargado de implementar, vigilar y supervisar el cumplimiento de las medidas sanitarias que deberán observarse para la reincorporación laboral en las oficinas e instalaciones de la Secretaría de\nEducación, en lo sucesivo “LA SEDUC”, con el fin de proteger el derecho a la salud de las y los servidores públicos, así como el de la población que acuda a las oficinas de esta Dependencia pública estatal a realizar trámites, de conformidad con lo establecido en el Acuerdo que emitieron en conjunto la Secretaría de Salud y la Secretaría de Administración e Innovación Gubernamental, ambas de la Administración Pública del\nEstado de Campeche, mediante el cual se establecen los Lineamientos de Seguridad Sanitaria que deberán implementarse para la Reactivación Laboral en las Dependencias y Entidades del Poder Ejecutivo del\nEstado de Campeche, a efecto de proteger el Derecho a la Salud de las y los Servidores Públicos, ante la nuevas condiciones generales originadas por la Pandemia SARS-COV2 (COVID-19)\nSEGUNDO. - El Comité Interno se integrará de la forma siguiente:\nI. Una o un Presidente, que recaerá en la persona titular de la Subsecretaría de Administración;\nII. Una o un Secretario Técnico, que será la persona titular de la Coordinación de Participación\nSocial;\nIII. Diez Vocales, que serán:\na) La persona titular de la Subsecretaría de Servicios Administrativos;\nb) La persona titular de la Subsecretaría de Educación Básica;\nc) La persona titular de la Subsecretaría de Educación Media Superior y Superior\nd) La persona titular de la Dirección de Recursos Humanos;\ne) La persona titular de la Dirección de Planeación y Programación;\nf) La persona titular de la Dirección de Educación Media Superior y Superior;\ng) La persona titular de la Dirección de Educación Básica\nh) La persona titular de la Unidad de Asuntos Jurídicos;\ni) La persona titular de la Coordinación de Innovación y Desarrollo Tecnológico\nj) La persona titular de la Subdirección de Recursos Materiales\nEl Órgano Interno de Control tendrá la calidad de invitado permanente en las sesiones del Comité Interno.\nPara efectos del cumplimiento del objeto del presente Acuerdo, todas las Unidades Administrativas de “LA\nSEDUC” deberán designar a una o un Servidor Público que sirva como enlace con el Comité Interno.\nLos integrantes del Comité Interno tendrán derecho a voz y voto en las sesiones, cada representante titular deberá nombrar una o un suplente, quien le representará en el Comité.\nLos cargos de las personas integrantes del Comité Interno son de carácter honorífico, por lo tanto, quienes los ocupen no recibirán retribución alguna por su desempeño.\nTERCERO: El Comité Interno, además de las disposiciones establecidas en los Lineamientos Técnicos\nEspecíficos para la Reapertura de Actividades Económicas, tendrá a su cargo las responsabilidades que a continuación se señalan:\nI. Verificar la implementación y vigilar el desarrollo de las actividades que permitan el establecimiento de las medidas sanitarias necesarias para la seguridad de las y los trabajadores de “LA SEDUC”;\nII. Realizar las gestiones y trámites administrativos necesarios, en conjunto con las áreas de “LA\nSEDUC”, a efecto de contar con la disponibilidad y suficiencia presupuestal que permita realizar las adquisiciones y contratación de servicios, en los términos y formas previstas en la normatividad vigente en la materia, para el debido cumplimiento de las acciones de seguridad e higiene, debiendo ajustarse a los recursos disponibles autorizados en el presupuesto de egresos vigente;\nIII. Proporcionar a todo el personal de “LA SEDUC” que realiza trabajo presencial en sede administrativa, cubrebocas. Para el caso de personal que otorga atención en forma directa a la ciudadanía, adicionalmente, deberá otorgar careta o lentes de seguridad\nIV. Permitir al personal la entrada y salida de labores presenciales en horarios escalonados, para evitar los horarios pico tanto en los accesos, como en el transporte público o en el transporte del personal;\nV. En caso de que se detecte personal con signos de enfermedades respiratorias y/o temperatura corporal mayor a 37.5 °C, designar un área de atención, dotarlas de información para su atención médica correspondiente y remitirlas al domicilio particular.\nVI. Identificar para cada departamento o área de la oficina al personal en situación de vulnerabilidad y verificar que estas personas cuenten con la información sobre su situación de riesgo.\nVII. Llevar el registro y seguimiento del personal en resguardo domiciliario voluntario e informar a la\nSecretaría de Salud del Poder Ejecutivo del Estado de Campeche, para evaluar posibles casos de contagio;\nVIII. Vigilar que se limpien y desinfecten constantemente superficies y objetos de uso común en oficinas, sitios cerrados, centros de reunión, entre otros;\nIX. Verificar y garantizar la disponibilidad permanente de agua potable, jabón, papel higiénico, gel a base de alcohol y toallas desechables para el secado de manos;\nX. Establecer un filtro de acceso a inmuebles conforme a las disposiciones emitidas por las autoridades sanitarias federal y estatal.\nXI. Establecer una sola área de acceso y salida de personal. En caso de no contar con ella se deberá personal;\nXII. Señalizar las áreas comunes con marcas en el piso, paredes y/o mobiliario, recordando la distancia mínima de 1.5 metros entre personas;\nXIII. Garantizar que los sanitarios cuenten con lavamanos y con condiciones adecuadas para la limpieza del personal (agua, jabón y toallas de papel desechable);\nXIV. Establecer un programa de limpieza y mantenimiento permanente de la oficina, utilizando los productos de limpieza adecuados para prevenir la propagación del virus;\nXV. Contar con suficientes depósitos de productos desechables y de uso personal, procurando la limpieza continua de los mismos;\nXVI. Verificar el uso apropiado de cubrebocas para todas las personas que ingresen o egresen de la oficina;\nXVII. Establecer una política de atención a público por cita o por medios electrónicos, con el fin de prevenir el riesgo de contagio originado en personas ajenas a la oficina;\nXVIII. Proporcionar información general sobre el SARS-CoV-2 (COVID-19), los mecanismos de contagio, síntomas que ocasiona y las mejores maneras de prevenir la infección y el contagio de otras personas;\nXIX. Informar sobre la importancia que tiene el no acudir al trabajo o reuniones sociales cuando se presenten síntomas compatibles con el SARS-CoV-2 (COVID-19), para no ser un riesgo de potencial contagio para otras personas;\nXX. Establecer un programa de capacitación para el personal directivo sobre las acciones y medidas para prevenir y evitar cadenas de contagio por SARS-CoV-2 (COVID-19);\nXXI. Dar a conocer al personal el teléfono de emergencia de la autoridad sanitaria (911);\nXXII. Las demás que deriven de las medidas e instrucciones generadas por las autoridades sanitarias.\nCUARTO: La Secretaria o el Secretario Técnico será la o el responsable de supervisar el cumplimiento de las medidas sanitarias, por lo que periódicamente deberá realizar la autoevaluación de las mismas con la información que le proporcionen los enlaces designados en cada una de las unidades administrativas de “LA SEDUC”. Asimismo, deberá informar oportunamente a la Secretaria o el Secretario de Educación de todas las acciones llevadas a cabo por el Comité Interno.\nQUINTO: El Comité Interno sesionará de manera ordinaria, por lo menos, dos veces al año, salvo que no existan asuntos a tratar; y de manera extraordinaria, cuando la persona que ocupe la Presidencia lo estime pertinente o lo soliciten la mayoría de las personas integrantes.\nLas sesiones del Comité Interno podrán celebrarse bajo la modalidad presencial o en línea, según lo determine la persona que ocupe la Presidencia. Las sesiones del Comité Interno que se celebren bajo la modalidad en línea, así como los acuerdos que en ellas se tomen serán válidas, siempre y cuando se observen las formalidades establecidas para ello en este Acuerdo.\nInterno con una anticipación de, por lo menos, tres días hábiles a la fecha en que habrán de celebrarse las sesiones ordinarias, y de veinticuatro horas en el caso de las sesiones extraordinarias y de la sesión de instalación.\nseñalar, por lo menos lo siguiente:\na) El carácter y el número de la sesión;\nb) La modalidad;\nc) La fecha, la hora y el lugar de su celebración.\nDel mismo modo, llevarán adjuntas, en formato físico o electrónico, según la modalidad de la sesión de que se trate, el orden del día y la documentación necesaria para desahogar los asuntos a tratar en la sesión correspondiente.\nSEXTO: Las decisiones sobre los asuntos que conozca el Comité Interno se aprobarán con el voto de la mayoría de las personas integrantes que asistan a la sesión correspondiente. En caso de empate, la persona que ocupe la Presidencia tendrá el voto de calidad.\nTodas las actas de las sesiones del Comité Interno deberán señalar, por lo menos:\na) La modalidad;\nb) La fecha, hora y lugar de su celebración;\nc) Los acuerdos alcanzados, identificados con un número consecutivo de seguimiento, y\nd) Los asuntos discutidos durante la sesión correspondiente.\nAdicionalmente, las actas llevarán anexas la lista de asistencia firmada por todas las personas que hubiesen participado en la sesión de que se trate y los documentos utilizados durante ésta.\nLa persona que ocupe la Secretaría Técnica será la encargada de levantar las actas a las que se hace referencia en el presente artículo.\nSÉPTIMO: En caso de que el Comité Interno tenga conocimiento del incumplimiento de las medidas establecidas en el Acuerdo que emitieron en conjunto la Secretaría de Salud y la Secretaría de\nAdministración e Innovación Gubernamental, ambas de la Administración Pública del Estado de Campeche, mediante el cual se establecieron los Lineamientos de Seguridad Sanitaria que deberán implementarse para la reactivación laboral en las Dependencias y Entidades del Poder Ejecutivo del Estado de Campeche, a efecto de proteger el Derecho a la Salud de las y los Servidores Públicos, ante las nuevas Condiciones\nGenerales originadas por la Pandemia SARS-CoV2 (COVID-19); en el presente Acuerdo y, en general, en cualquier disposición emitida por las autoridades sanitarias relativas a las medidas a aplicar, deberá dar aviso inmediato al Órgano Interno de Control para que, en su caso, se inicie el procedimiento respectivo.\nTransitorios\nPRIMERO. - El presente Acuerdo entrará en vigor al día siguiente de su publicación en el Periódico Oficial del Estado.\nSEGUNDO. – La sesión de instalación del Comité Interno, a la que hace referencia el último párrafo del artículo Quinto de este Acuerdo, deberá celebrarse de inmediato.\nDado en la Ciudad de San Francisco de Campeche, Municipio y Estado de Campeche, a los 27 días del mes de agosto del año dos mil veinte.\nRicardo Alfonso Koh Cambranis. Secretario de Educación de la Administración Pública del Estado de\nCampeche. Rúbrica",
  "ordenamiento": "ACUERDO",
  "jurisdiccion": "CAMPECHE",
  "fuente_oficial": "DIARIO OFICIAL DE LA FEDERACION",
  "Fecha de Publicación": "27 de abril de 2020",
  "es_escaneado": false,
  "tiene_tablas": false,
  "materia": [
    "educación"
  ]
}