{
  "titulo": "Acuerdo DEL EJECUTIVO POR EL QUE SE DA A CONOCER EL CALENDARIO DE ENTREGA, PORCENTAJE, FÃ“RMULAS y VA",
  "Contenido": "ACUERDO DEL EJECUTIVO POR EL QUE SE DA A CONOCER EL CALENDARIO DE ENTREGA,\nPORCENTAJE, FÃ“RMULAS Y VARIABLES UTILIZADAS, ASÃ COMO LOS MONTOS ESTIMADOS DE LAS\nPARTICIPAR A SUS MUNICIPIOS EN EL EJERCICIO FISCAL 2020.\nLIC. CARLOS MIGUEL AYSA GONZÃLEZ, Gobernador del Estado de Campeche, en ejercicio de las facultades que me confieren las fracciones IX, XIX y XXXVII del artÃ­culo 71 de la ConstituciÃ³n PolÃ­tica del Estado de Campeche y, con fundamento en lo establecido por el artÃ­culo 73 de la ConstituciÃ³n 5, 6, 7, 8, 9, 10, 15 y 25 de la Ley del Sistema de CoordinaciÃ³n Fiscal del Estado de Campeche; los artÃ­culos 8, 12, 14, 15, 16 fracciÃ³n II, y 22 fracciones II, VII y XXXVIII de la Ley OrgÃ¡nica de la\nAdministraciÃ³n PÃºblica del Estado de Campeche y los artÃ­culos 1, 3 inciso A fracciÃ³n I, 9 y 10 fracciones\nIV, VII y XXVI del Reglamento Interior de la SecretarÃ­a de Finanzas de la AdministraciÃ³n PÃºblica del\nEstado de Campeche, y\nCONSIDERANDO\nQue el artÃ­culo 6 de la Ley de CoordinaciÃ³n Fiscal establece el derecho de los Municipios a recibir, por lo menos, el 20% de los recursos derivados del Fondo General de Participaciones que le correspondan a la Entidad Federativa, ademÃ¡s de que seÃ±ala la obligaciÃ³n de la Entidad Federativa de publicar anualmente el calendario de entrega, porcentaje, fÃ³rmulas y variables utilizadas, asÃ­ como el monto estimado de las Participaciones que reciba y de las que tenga obligaciÃ³n de participar a los Municipios.\nQue el Acuerdo por el que se expiden los Lineamientos para la PublicaciÃ³n de la InformaciÃ³n a que se refiere el artÃ­culo 6 de la Ley de CoordinaciÃ³n Fiscal, publicado en el Diario Oficial de la FederaciÃ³n el dÃ­a 14 de febrero de 2014, expresamente establece las caracterÃ­sticas de la informaciÃ³n que debe publicarse, los conceptos que no se integrarÃ¡n y las formas en que debe hacerse la publicaciÃ³n de la informaciÃ³n.\nQue, el dÃ­a 30 de enero de 2020, se publicÃ³ en el Diario Oficial de la FederaciÃ³n el Acuerdo por el que se da a conocer el calendario de entrega, porcentaje, fÃ³rmulas y variables utilizadas, asÃ­ como los montos estimados que recibirÃ¡ cada Entidad Federativa del Fondo General de Participaciones y del\nFondo de Fomento Municipal, por el ejercicio fiscal 2020.\nQue, con base en lo anterior y con la finalidad de dar cumplimiento a las obligaciones seÃ±aladas por el artÃ­culo 6 de la Ley de CoordinaciÃ³n Fiscal, he tenido a bien expedir el siguiente:\nACUERDO DEL EJECUTIVO POR EL QUE SE DA A CONOCER EL CALENDARIO DE ENTREGA,\nPORCENTAJE, FÃ“RMULAS Y VARIABLES UTILIZADAS, ASÃ COMO LOS MONTOS ESTIMADOS\nOBLIGACIÃ“N DE PARTICIPAR A SUS MUNICIPIOS EN EL EJERCICIO FISCAL 2020.\nPRIMERO. â€“ Este acuerdo tiene por objeto, de conformidad con el artÃ­culo 6Â° penÃºltimo pÃ¡rrafo de la Ley de CoordinaciÃ³n Fiscal, el dar a conocer el calendario de entrega, porcentaje, fÃ³rmulas y variables utilizadas, asÃ­ como los montos estimados de las Participaciones que reciba la Entidad, en el Ejercicio Fiscal 2020, y de las que tenga obligaciÃ³n de participar a sus Municipios.\nSEGUNDO. â€“ Los conceptos de las Participaciones Federales que el Estado de Campeche tiene la obligaciÃ³n de distribuir a sus Municipios, de acuerdo con el artÃ­culo 4Â° de la Ley del Sistema de\nCoordinaciÃ³n Fiscal, son:\na) El 100% del Fondo de Fomento Municipal;\nb) El 24% del Fondo General de Participaciones;\nc) El 20% del monto de la recaudaciÃ³n del Impuesto Especial sobre ProducciÃ³n y Servicios;\nd) El 20% del monto de la recaudaciÃ³n del Impuesto sobre AutomÃ³viles Nuevos;\ne) El 20% del Fondo de CompensaciÃ³n del Impuesto sobre AutomÃ³viles Nuevos;\nf) El 24% del Fondo de ExtracciÃ³n de Hidrocarburos;\ng) El 24% del Fondo de FiscalizaciÃ³n y RecaudaciÃ³n;\nh) El 20% de la aplicaciÃ³n de las cuotas previstas en el artÃ­culo 2-A, fracciÃ³n II de la Ley del Impuesto\nEspecial sobre ProducciÃ³n y Servicios;\ni) El 100% de la recaudaciÃ³n del Impuesto Sobre la Renta en los tÃ©rminos que establece el artÃ­culo 3B de la Ley de CoordinaciÃ³n Fiscal; y\nj) El 20% de la recaudaciÃ³n del Impuesto sobre Tenencia o Uso de VehÃ­culos.\nLo anterior, en el entendido que segÃºn corresponda, los conceptos seÃ±alados sean sustituidos, modificados, adicionados o complementados de tiempo en tiempo.\nTERCERO. â€“ Los dÃ­as en que deberÃ¡n depositarse los recursos a los Municipios en cada uno de los meses del aÃ±o correspondiente al Ejercicio Fiscal 2020 son:\nCALENDARIO DE ENTREGA DE PARTICIPACIONES\nFEDERALES A LOS MUNICIPIOS\nCORRESPONDIENTE AL EJERCICIO FISCAL 2020\nMes DÃ­as\nEnero 31\nFebrero 28\nMarzo 31\nAbril 30\nMayo 29\nJunio 30\nJulio 31\nAgosto 31\nSeptiembre 30\nOctubre 30\nNoviembre 30\nDiciembre 31\nEn caso de retraso en la entrega de las Participaciones, atribuible al Estado, darÃ¡ lugar a los pagos y consecuencias que establece el segundo pÃ¡rrafo del artÃ­culo 6 de la Ley de CoordinaciÃ³n Fiscal y el artÃ­culo 15 primer pÃ¡rrafo de la Ley del Sistema de CoordinaciÃ³n Fiscal del Estado de Campeche.\nCUARTO - El Fondo Municipal de Participaciones se integrarÃ¡ con los recursos de los fondos que se de CoordinaciÃ³n Fiscal del Estado de Campeche, esto es:\na) El 24% del Fondo General de Participaciones;\nb) El 20% del monto de la recaudaciÃ³n del Impuesto Especial sobre ProducciÃ³n y Servicios;\nc) El 20% del monto de la recaudaciÃ³n del Impuesto sobre AutomÃ³viles Nuevos;\nd) El 20% del Fondo de CompensaciÃ³n del Impuesto sobre AutomÃ³viles Nuevos; y\ne) El 100% de las participaciones recibidas por el Estado de Campeche del Fondo de Fomento\nMunicipal, descontando de Ã©ste el monto de participaciones que de este fondo se distribuya al Estado correspondiente al 30% del excedente del Fondo de Fomento Municipal con respecto a 2013 mediante el coeficiente CPi,t al que se refiere la fÃ³rmula de distribuciÃ³n del Fondo de Fomento Municipal establecida en el artÃ­culo 2-A, fracciÃ³n III, de la Ley de CoordinaciÃ³n Fiscal.\nQUINTO. - Las fÃ³rmulas utilizadas para la distribuciÃ³n de las Participaciones Federales son:\nA. FÃ³rmula utilizada para la distribuciÃ³n del Fondo Municipal de Participaciones, con la nomenclatura de cada una de las variables usadas, asÃ­ como la informaciÃ³n que se utiliza para su determinaciÃ³n y, en su caso, la descripciÃ³n detallada del procedimiento de cÃ¡lculo correspondiente.\nDe acuerdo al artÃ­culo 6Â°, de la Ley del Sistema de CoordinaciÃ³n Fiscal del Estado, se determinarÃ¡n conforme a la siguiente formula:\nğ¹ğ‘€ğ‘ƒ =ğ¹ğ‘€ğ‘ƒ +âˆ†ğ¹ğ‘€ğ‘ƒ (0.6ğ¶1 +0.2ğ¶2 +0.1ğ¶3 +0.1ğ¶4) ğ‘–,ğ‘¡ ğ‘–,16 16,ğ‘¡ ğ‘–,ğ‘¡ ğ‘–,ğ‘¡ ğ‘–,ğ‘¡ ğ‘–,ğ‘¡\nDonde:\nğ¹ğ‘€ğ‘ƒ es la participaciÃ³n del fondo al que se refiere este artÃ­culo del Municipio ğ‘– en el aÃ±o ğ‘¡;\nğ‘–,ğ‘¡\nğ¹ğ‘€ğ‘ƒ es la participaciÃ³n del fondo al que se refiere este artÃ­culo que el Municipio ğ‘– recibiÃ³ en el aÃ±o ğ‘–,16 2016 excluyendo el monto distribuido por concepto del Fondo de ExtracciÃ³n de Hidrocarburos;\nâˆ†ğ¹ğ‘€ğ‘ƒ es el crecimiento en el Fondo Municipal de Participaciones en el aÃ±o 2016 y el periodo ğ‘¡, 16,ğ‘¡ excluyendo el monto distribuido por concepto del Fondo de ExtracciÃ³n de Hidrocarburos;\nğ¶1 es el coeficiente de poblaciÃ³n, el cual se determina en proporciÃ³n directa al nÃºmero de habitantes ğ‘–,ğ‘¡ que tenga cada Municipio, segÃºn la Ãºltima informaciÃ³n oficial del INEGI;\nğ‘› ğ‘–,ğ‘¡\nğ¶1 = ğ‘– ğ‘–,ğ‘¡\nğ¶2 es el coeficiente por eficiencia recaudatoria, medida por la proporciÃ³n que represente la ğ‘–,ğ‘¡ recaudaciÃ³n por habitante en el total de contribuciones municipales, la que se determinarÃ¡ acumulando la recaudaciÃ³n de todos los impuestos y derechos, excepto las Participaciones que la FederaciÃ³n les entrega directamente;\nğ‘…ğ‘‡ ğ‘› ğ‘–,ğ‘¡âˆ’1 ğ‘–,ğ‘¡\nğ¶2 = ğ‘– ğ‘–,ğ‘¡âˆ’1 ğ‘–,ğ‘¡\nğ¶3 es el coeficiente de la proporciÃ³n que represente el crecimiento en la recaudaciÃ³n del impuesto ğ‘–,ğ‘¡ predial y los derechos por suministro de agua, en los dos ejercicios inmediatos anteriores para el que se realiza el cÃ¡lculo, respecto al crecimiento de todos los Municipios;\nğ‘–,ğ‘¡âˆ’1ğ‘›\nğ‘… ğ‘–,ğ‘¡\nğ¶3 = ğ‘–,ğ‘¡âˆ’2 ğ‘–,ğ‘¡ ğ‘… âˆ‘ ğ‘–,ğ‘¡âˆ’1ğ‘› ğ‘–ğ‘… ğ‘–,ğ‘¡ ğ‘–,ğ‘¡âˆ’2\nğ¶4 es el coeficiente de la proporciÃ³n que represente el crecimiento en la recaudaciÃ³n de todos los ğ‘–,ğ‘¡ impuestos, con excepciÃ³n del impuesto predial, de todos los derechos, exceptuando los derechos por suministro de agua, excluyendo las Participaciones que la FederaciÃ³n otorga en forma directa a los\nMunicipios, respecto al crecimiento de todos los Municipios en los dos ejercicios inmediatos anteriores para el que se realiza el cÃ¡lculo;\nğ‘–,ğ‘¡âˆ’1ğ‘›\nğ‘…ğ¶ ğ‘–,ğ‘¡\nğ¶4 = ğ‘–,ğ‘¡âˆ’2 ğ‘–,ğ‘¡ ğ‘…ğ¶ âˆ‘ ğ‘–,ğ‘¡âˆ’1ğ‘› ğ‘–ğ‘…ğ¶ ğ‘–,ğ‘¡ ğ‘–,ğ‘¡âˆ’2 ğ‘› es la Ãºltima informaciÃ³n oficial de poblaciÃ³n que hubiere dado a conocer el INEGI para el Municipio ğ‘–,ğ‘¡ ğ‘–;\nğ‘…ğ‘‡ es la recaudaciÃ³n de todos los impuestos, mÃ¡s los derechos, excepto las Participaciones que la ğ‘–,ğ‘¡\nFederaciÃ³n les entrega directamente;\nğ‘… es la recaudaciÃ³n del impuesto predial y los derechos por suministro de agua del Municipio ğ‘– en el ğ‘–,ğ‘¡ aÃ±o ğ‘¡;\nğ‘…ğ¶ es la recaudaciÃ³n de todos los impuestos, con excepciÃ³n del impuesto predial, de todos los ğ‘–,ğ‘¡ derechos, exceptuando los derechos por suministro de agua, excluyendo las Participaciones que la\nFederaciÃ³n otorga en forma directa a los Municipios.\nPara efectos del cÃ¡lculo previsto en este artÃ­culo, se considerarÃ¡ la informaciÃ³n relativa de recaudaciÃ³n de los impuestos y derechos, contenida en la Ãºltima Cuenta PÃºblica correspondiente, presentada al H.\nCongreso del Estado.\nEl coeficiente mensual a que se refiere ğ¹ğ‘€ğ‘ƒ ascenderÃ¡ a la cantidad mensual promedio que ğ‘–,16 corresponda a lo que el Municipio recibiÃ³ en el ejercicio de 2016 por concepto del Fondo Municipal de\nParticipaciones, excluyendo los montos percibidos por el Fondo de ExtracciÃ³n de Hidrocarburos;\nmismos que se publicarÃ¡n en el PeriÃ³dico Oficial del Estado dentro del Calendario de entrega, porcentaje, fÃ³rmulas y variables que menciona el artÃ­culo 15 de la Ley del Sistema de CoordinaciÃ³n\nFiscal del Estado de Campeche.\nque en el periodo que se calcula, el monto de dicho fondo sea inferior al obtenido en el Ejercicio Fiscal\n2016. En dicho supuesto, la distribuciÃ³n se realizarÃ¡ en funciÃ³n de la cantidad efectivamente generada concepto de este fondo en el aÃ±o 2016.\ncoeficientes a los que se refiere el presente apartado.\nB. FÃ³rmula utilizada para la distribuciÃ³n del Fondo por ColaboraciÃ³n Administrativa del Predial, con la nomenclatura de cada una de las variables usadas, asÃ­ como la informaciÃ³n que se utiliza para su determinaciÃ³n y, en su caso, la descripciÃ³n detallada del procedimiento de cÃ¡lculo correspondiente.\nDe acuerdo con el inciso b) del artÃ­culo 5 de la Ley del Sistema de CoordinaciÃ³n Fiscal del Estado de\nCampeche, el 30% del excedente del Fondo de Fomento Municipal, con respecto a 2013, se destinarÃ¡\nMunicipios que hayan suscrito y mantengan vigente un Convenio de ColaboraciÃ³n con el Estado en materia del impuesto predial, en los tÃ©rminos establecidos en el artÃ­culo 2-A de la Ley de CoordinaciÃ³n\nFiscal y este haya sido publicado en el PeriÃ³dico Oficial del Estado. La distribuciÃ³n a los Municipios se realizarÃ¡ conforme a la siguiente fÃ³rmula:\nğ¹ =ğ¹ğ‘‚ğ¶ğ´ğ‘ƒ(ğ¶) ğ‘–,ğ‘¡ ğ‘¡ ğ‘–,ğ‘¡\nğ‘…ğ‘ ğ‘–,ğ‘¡âˆ’1ğ‘›ğ‘\nğ‘…ğ‘ ğ‘– ğ‘–,ğ‘¡âˆ’2 ğ‘–,ğ‘¡ ğ‘…ğ‘ âˆ‘ ğ‘–,ğ‘¡âˆ’1ğ‘›ğ‘ ğ‘–ğ‘…ğ‘ ğ‘– ğ‘–,ğ‘¡âˆ’2\nDonde:\nğ¹ğ‘‚ğ¶ğ´ğ‘ƒ es el monto del Fondo por ColaboraciÃ³n Administrativa del Predial a distribuir en el aÃ±o ğ‘¡ para ğ‘¡ el que se efectÃºa el cÃ¡lculo.\nğ¶ es el coeficiente de distribuciÃ³n del Fondo por ColaboraciÃ³n Administrativa del predial del Municipio ğ‘–,ğ‘¡ ğ‘– en el aÃ±o t en el que se efectÃºa el cÃ¡lculo.\nğ¹ es la participaciÃ³n del ğ¹ğ‘‚ğ¶ğ´ğ‘ƒ del Municipio ğ‘– en el aÃ±o ğ‘¡.\nğ‘–,ğ‘¡ ğ‘¡\nğ‘…ğ‘ es el monto de la recaudaciÃ³n del impuesto predial del Municipio ğ‘– en el Ejercicio Fiscal anterior ğ‘–,ğ‘¡âˆ’1 al que se realiza el cÃ¡lculo y que registre un flujo de efectivo, reportado en la Ãºltima Cuenta PÃºblica presentada al H. Congreso del Estado.\nğ‘…ğ‘ es el monto de la recaudaciÃ³n del impuesto predial del Municipio ğ‘– en los dos ejercicios fiscales ğ‘–,ğ‘¡âˆ’2 anteriores al que se realiza el cÃ¡lculo y que registre un flujo de efectivo, reportada en las Ãºltimas dos ğ‘›ğ‘ es la Ãºltima informaciÃ³n oficial de poblaciÃ³n que hubiere dado a conocer el INEGI del Municipio ğ‘–.\nğ‘– coeficientes a los que se refiere el presente apartado.\nC. FÃ³rmula utilizada para la distribuciÃ³n del 20% de la recaudaciÃ³n derivada de la aplicaciÃ³n de las cuotas previstas en el artÃ­culo 2Âº-A de la fracciÃ³n II de la Ley del Impuesto Especial sobre\nProducciÃ³n y Servicios, conforme a lo dispuesto en el artÃ­culo 4Âº-A de la Ley de CoordinaciÃ³n\nFiscal (Cuotas Especiales de IEPS a la Gasolina y DiÃ©sel), con la nomenclatura de cada una de las variables usadas, asÃ­ como la informaciÃ³n que se utiliza para su determinaciÃ³n y, en su caso, la descripciÃ³n detallada del procedimiento de cÃ¡lculo correspondiente.\nDe acuerdo al artÃ­culo 7Â° de la Ley del Sistema de CoordinaciÃ³n Fiscal del Estado; el 20% de los previstas en el artÃ­culo 2o-A de la fracciÃ³n II de la Ley del Impuesto Especial sobre ProducciÃ³n y\nServicios, conforme a lo dispuesto en el artÃ­culo 4o-A de la Ley de CoordinaciÃ³n Fiscal, se distribuirÃ¡ a los Municipios de conformidad con la fÃ³rmula siguiente:\nğ‘ƒğ¶ğº =ğ¶ğº (0.7ğ¶1 +0.2ğ¶2 +0.1ğ¶3) ğ‘–,ğ‘¡ ğ‘–,ğ‘¡ ğ‘–,ğ‘¡ ğ‘–,ğ‘¡ ğ‘–,ğ‘¡\nğ‘ƒğ¶ğº es el monto de participaciÃ³n que corresponde al Municipio ğ‘– en el aÃ±o ğ‘¡ en que se efectÃºa el ğ‘–,ğ‘¡ cÃ¡lculo;\nğ¶ğº es el monto de los recursos a distribuir entre los Municipios en el aÃ±o ğ‘¡;\nğ‘–,ğ‘¡\nğ¶1 es el coeficiente de poblaciÃ³n, el cual se determina en proporciÃ³n directa al nÃºmero de habitantes ğ‘–,ğ‘¡ que tenga cada Municipio, segÃºn la Ãºltima informaciÃ³n oficial del INEGI;\nğ‘› ğ‘–,ğ‘¡\nğ¶1 = ğ‘– ğ‘–,ğ‘¡\nğ¶2 es el coeficiente de la proporciÃ³n que represente el crecimiento en la recaudaciÃ³n del impuesto ğ‘–,ğ‘¡ predial y los derechos por suministro de agua, en los dos ejercicios inmediatos anteriores para el que se realiza el cÃ¡lculo, respecto al crecimiento de todos los Municipios;\nğ‘–,ğ‘¡âˆ’1ğ‘›\nğ‘… ğ‘–,ğ‘¡\nğ¶2 = ğ‘–,ğ‘¡âˆ’2 ğ‘–,ğ‘¡ ğ‘… âˆ‘ ğ‘–,ğ‘¡âˆ’1ğ‘› ğ‘–ğ‘… ğ‘–,ğ‘¡ ğ‘–,ğ‘¡âˆ’2\nğ¶3 es el coeficiente por eficiencia recaudatoria del impuesto predial y derechos por suministro de ğ‘–,ğ‘¡ agua, medida por la proporciÃ³n que represente la recaudaciÃ³n por habitante en el total de contribuciones municipales.\nğ‘–,ğ‘¡âˆ’1 ğ‘–\nğ¶3 = ğ‘– ğ‘–,ğ‘¡âˆ’1 ğ‘–,ğ‘¡\nğ‘… es la informaciÃ³n relativa a la recaudaciÃ³n del impuesto predial y derechos de agua potable del ğ‘–,ğ‘¡\nMunicipio ğ‘– en el aÃ±o ğ‘¡ contenida en la Ãºltima Cuenta PÃºblica presentada al H. Congreso.\nğ‘› es el nÃºmero de habitantes del Municipio ğ‘–, segÃºn la Ãºltima informaciÃ³n oficial del INEGI.\nğ‘–\nPara estos efectos se consideran los derechos de agua potable efectivamente pagados, independientemente del Ejercicio Fiscal en que se hayan causado, por su consumo, drenaje, alcantarillado, recargos, multas, gastos de ejecuciÃ³n, conexiones, reconexiones, intereses no bancarios e indemnizaciones, excluyendo las contribuciones adicionales o cualquier otro concepto distinto que recaiga sobre el mismo. A la cantidad pagada se descontarÃ¡n las devoluciones que se hayan efectuado por cualquier tÃ­tulo o motivo.\nAsimismo, para estos efectos se considerarÃ¡ el impuesto predial efectivamente recaudado en la\nEntidad en el aÃ±o calendario de que se trate, independientemente del Ejercicio Fiscal en que se haya causado, asÃ­ como los recargos, multas, gastos de ejecuciÃ³n, intereses no bancarios e indemnizaciones que se apliquen en relaciÃ³n a este impuesto, excluyendo las contribuciones adicionales o cualquier otro concepto distinto que recaiga sobre el mismo. A la cantidad recaudada se descontarÃ¡n las devoluciones que se hayan efectuado por cualquier tÃ­tulo o motivo.\ncoeficientes a los que se refiere el presente apartado.\nD. FÃ³rmula utilizada para la distribuciÃ³n del Fondo de FiscalizaciÃ³n y RecaudaciÃ³n, con la nomenclatura de cada una de las variables usadas, asÃ­ como la informaciÃ³n que se utiliza para su determinaciÃ³n y, en su caso, la descripciÃ³n detallada del procedimiento de cÃ¡lculo correspondiente.\nDe acuerdo al artÃ­culo 8Â° de la Ley del Sistema de CoordinaciÃ³n Fiscal, el monto correspondiente a los siguiente fÃ³rmula:\nğ¹ğ‘‚ğ¹ğ¼ğ‘… =ğ¹ğ‘‚ğ¹ğ¼ğ‘… +âˆ†ğ¹ğ‘‚ğ¹ğ¼ğ‘… (0.6ğ¶1 +0.2ğ¶2 +0.1ğ¶3 +0.1ğ¶4) ğ‘–,ğ‘¡ ğ‘–,16 16,ğ‘¡ ğ‘–,ğ‘¡ ğ‘–,ğ‘¡ ğ‘–,ğ‘¡ ğ‘–,ğ‘¡\nDonde:\nğ¹ğ‘‚ğ¹ğ¼ğ‘… es la participaciÃ³n del fondo al que se refiere este artÃ­culo del Municipio ğ‘– en el aÃ±o ğ‘¡;\nğ‘–,ğ‘¡\nğ¹ğ‘‚ğ¹ğ¼ğ‘… es la participaciÃ³n del fondo al que se refiere este artÃ­culo que el Municipio ğ‘– recibiÃ³ en el aÃ±o ğ‘–,16\n2016;\nâˆ†ğ¹ğ‘‚ğ¹ğ¼ğ‘… es el crecimiento en el Fondo de FiscalizaciÃ³n y RecaudaciÃ³n en el aÃ±o 2016 y el periodo 16,ğ‘¡ ğ‘¡;\nğ¶1 es el coeficiente de poblaciÃ³n, el cual se determina en proporciÃ³n directa al nÃºmero de habitantes ğ‘–,ğ‘¡ que tenga cada Municipio, segÃºn la Ãºltima informaciÃ³n oficial del INEGI;\nğ‘› ğ‘–,ğ‘¡\nğ¶1 = ğ‘– ğ‘–,ğ‘¡\nğ¶2 es el coeficiente por eficiencia recaudatoria, medida por la proporciÃ³n que represente la ğ‘–,ğ‘¡ recaudaciÃ³n por habitante en el total de contribuciones municipales, la que se determinarÃ¡ acumulando la recaudaciÃ³n de todos los impuestos y derechos, excepto las Participaciones que la FederaciÃ³n les entrega directamente;\nğ‘…ğ‘‡ ğ‘› ğ‘–,ğ‘¡âˆ’1 ğ‘–,ğ‘¡\nğ¶2 = ğ‘– ğ‘–,ğ‘¡âˆ’1 ğ‘–,ğ‘¡\nğ¶3 es el coeficiente de la proporciÃ³n que represente el crecimiento en la recaudaciÃ³n del impuesto ğ‘–,ğ‘¡ predial y los derechos por suministro de agua, en los dos ejercicios inmediatos anteriores para el que se realiza el cÃ¡lculo, respecto al crecimiento de todos los Municipios;\nğ‘–,ğ‘¡âˆ’1ğ‘›\nğ‘… ğ‘–,ğ‘¡\nğ¶3 = ğ‘–,ğ‘¡âˆ’2 ğ‘–,ğ‘¡ ğ‘… âˆ‘ ğ‘–,ğ‘¡âˆ’1ğ‘› ğ‘–ğ‘… ğ‘–,ğ‘¡ ğ‘–,ğ‘¡âˆ’2\nğ¶4 es el coeficiente de la proporciÃ³n que represente el crecimiento en la recaudaciÃ³n de todos los ğ‘–,ğ‘¡ impuestos, con excepciÃ³n del impuesto predial, de todos los derechos, exceptuando los derechos por suministro de agua, excluyendo las Participaciones que la FederaciÃ³n otorga en forma directa a los\nMunicipios, respecto al crecimiento de todos los Municipios en los dos ejercicios inmediatos anteriores para el que se realiza el cÃ¡lculo;\nğ‘–,ğ‘¡âˆ’1ğ‘›\nğ‘…ğ¶ ğ‘–,ğ‘¡\nğ¶4 = ğ‘–,ğ‘¡âˆ’2 ğ‘–,ğ‘¡ ğ‘…ğ¶ âˆ‘ ğ‘–,ğ‘¡âˆ’1ğ‘› ğ‘–ğ‘…ğ¶ ğ‘–,ğ‘¡ ğ‘–,ğ‘¡âˆ’2 ğ‘› es la Ãºltima informaciÃ³n oficial de poblaciÃ³n que hubiere dado a conocer el INEGI para el Municipio ğ‘–,ğ‘¡ ğ‘–;\nğ‘…ğ‘‡ es la recaudaciÃ³n de todos los impuestos, mÃ¡s los derechos, excepto las Participaciones que la ğ‘–,ğ‘¡\nFederaciÃ³n les entrega directamente;\nğ‘… es la recaudaciÃ³n del impuesto predial y los derechos por suministro de agua del Municipio ğ‘– en el ğ‘–,ğ‘¡ aÃ±o ğ‘¡;\nğ‘…ğ¶ es la recaudaciÃ³n de todos los impuestos, con excepciÃ³n del impuesto predial, de todos los ğ‘–,ğ‘¡ derechos, exceptuando los derechos por suministro de agua, excluyendo las Participaciones que la\nFederaciÃ³n otorga en forma directa a los Municipios.\nPara efectos del cÃ¡lculo previsto en este artÃ­culo, se considerarÃ¡ la informaciÃ³n relativa de recaudaciÃ³n de los impuestos y derechos, contenida en la Ãºltima Cuenta PÃºblica correspondiente, presentada al H.\nCongreso del Estado.\nEl coeficiente mensual a que se refiere ğ¹ğ‘‚ğ¹ğ¼ğ‘… ascenderÃ¡ a la cantidad mensual promedio que ğ‘–,16 corresponda a lo que el Municipio recibiÃ³ en el ejercicio de 2016 por concepto del Fondo de\nFiscalizaciÃ³n y RecaudaciÃ³n; mismos que se publicarÃ¡n en el PeriÃ³dico Oficial del Estado dentro del\nCalendario de entrega, porcentaje, fÃ³rmulas y variables que menciona el artÃ­culo 15 de la Ley del\nSistema de CoordinaciÃ³n Fiscal del Estado de Campeche.\nque en el periodo que se calcula, el monto de dicho fondo sea inferior al obtenido en el Ejercicio Fiscal\n2016. En dicho supuesto, la distribuciÃ³n se realizarÃ¡ en funciÃ³n de la cantidad efectivamente generada concepto de este fondo en el aÃ±o 2016.\ncoeficientes a los que se refiere el presente apartado.\nE. FÃ³rmula utilizada para la distribuciÃ³n del Fondo de ExtracciÃ³n de Hidrocarburos, con la nomenclatura de cada una de las variables usadas, asÃ­ como la informaciÃ³n que se utiliza para su determinaciÃ³n y, en su caso, la descripciÃ³n detallada del procedimiento de cÃ¡lculo correspondiente.\nDe acuerdo al artÃ­culo 9Â° de la Ley del Sistema de CoordinaciÃ³n Fiscal del Estado; el monto\nMunicipios conforme a la siguiente fÃ³rmula:\nğ¹ğ¸ğ‘‹ğ»ğ¼ =ğ¹ğ¸ğ‘‹ğ»ğ¼ +âˆ†ğ¹ğ¸ğ‘‹ğ»ğ¼ (0.6ğ¶1 +0.2ğ¶2 +0.1ğ¶3 +0.1ğ¶4) ğ‘–,ğ‘¡ ğ‘–,16 16,ğ‘¡ ğ‘–,ğ‘¡ ğ‘–,ğ‘¡ ğ‘–,ğ‘¡ ğ‘–,ğ‘¡\nDonde:\nğ¹ğ¸ğ‘‹ğ»ğ¼ es la participaciÃ³n del fondo al que se refiere este artÃ­culo del Municipio ğ‘– en el aÃ±o ğ‘¡;\nğ‘–,ğ‘¡\nğ¹ğ¸ğ‘‹ğ»ğ¼ es la participaciÃ³n del fondo al que se refiere este artÃ­culo que el Municipio ğ‘– recibiÃ³ en el aÃ±o ğ‘–,16\n2016;\nâˆ†ğ¹ğ¸ğ‘‹ğ»ğ¼ es el crecimiento en el Fondo de ExtracciÃ³n de Hidrocarburos en el aÃ±o 2016 y el periodo 16,ğ‘¡ ğ‘¡;\nğ¶1 es el coeficiente de poblaciÃ³n, el cual se determina en proporciÃ³n directa al nÃºmero de habitantes ğ‘–,ğ‘¡ que tenga cada Municipio, segÃºn la Ãºltima informaciÃ³n oficial del INEGI;\nğ‘› ğ‘–,ğ‘¡\nğ¶1 = ğ‘– ğ‘–,ğ‘¡\nğ¶2 es el coeficiente por eficiencia recaudatoria, medida por la proporciÃ³n que represente la ğ‘–,ğ‘¡ recaudaciÃ³n por habitante en el total de contribuciones municipales, la que se determinarÃ¡ acumulando la recaudaciÃ³n de todos los impuestos y derechos, excepto las Participaciones que la FederaciÃ³n les entrega directamente;\nğ‘…ğ‘‡ ğ‘› ğ‘–,ğ‘¡âˆ’1 ğ‘–,ğ‘¡\nğ¶2 = ğ‘– ğ‘–,ğ‘¡âˆ’1 ğ‘–,ğ‘¡\nğ¶3 es el coeficiente de la proporciÃ³n que represente el crecimiento en la recaudaciÃ³n del impuesto ğ‘–,ğ‘¡ predial y los derechos por suministro de agua, en los dos ejercicios inmediatos anteriores para el que se realiza el cÃ¡lculo, respecto al crecimiento de todos los Municipios;\nğ‘–,ğ‘¡âˆ’1ğ‘›\nğ‘… ğ‘–,ğ‘¡\nğ¶3 = ğ‘–,ğ‘¡âˆ’2 ğ‘–,ğ‘¡ ğ‘… âˆ‘ ğ‘–,ğ‘¡âˆ’1ğ‘› ğ‘–ğ‘… ğ‘–,ğ‘¡ ğ‘–,ğ‘¡âˆ’2\nğ¶4 es el coeficiente de la proporciÃ³n que represente el crecimiento en la recaudaciÃ³n de todos los ğ‘–,ğ‘¡ impuestos, con excepciÃ³n del impuesto predial, de todos los derechos, exceptuando los derechos por suministro de agua, excluyendo las Participaciones que la FederaciÃ³n otorga en forma directa a los\nMunicipios, respecto al crecimiento de todos los Municipios en los dos ejercicios inmediatos anteriores para el que se realiza el cÃ¡lculo;\nğ‘–,ğ‘¡âˆ’1ğ‘›\nğ‘…ğ¶ ğ‘–,ğ‘¡\nğ¶4 = ğ‘–,ğ‘¡âˆ’2 ğ‘–,ğ‘¡ ğ‘…ğ¶ âˆ‘ ğ‘–,ğ‘¡âˆ’1ğ‘› ğ‘–ğ‘…ğ¶ ğ‘–,ğ‘¡ ğ‘–,ğ‘¡âˆ’2 ğ‘› es la Ãºltima informaciÃ³n oficial de poblaciÃ³n que hubiere dado a conocer el INEGI para el Municipio ğ‘–,ğ‘¡ ğ‘–;\nğ‘…ğ‘‡ es la recaudaciÃ³n de todos los impuestos, mÃ¡s los derechos, excepto las Participaciones que la ğ‘–,ğ‘¡\nFederaciÃ³n les entrega directamente;\nğ‘… es la recaudaciÃ³n del impuesto predial y los derechos por suministro de agua del Municipio ğ‘– en el ğ‘–,ğ‘¡ aÃ±o ğ‘¡;\nğ‘…ğ¶ es la recaudaciÃ³n de todos los impuestos, con excepciÃ³n del impuesto predial, de todos los ğ‘–,ğ‘¡ derechos, exceptuando los derechos por suministro de agua, excluyendo las Participaciones que la\nFederaciÃ³n otorga en forma directa a los Municipios.\nPara efectos del cÃ¡lculo previsto en este artÃ­culo, se considerarÃ¡ la informaciÃ³n relativa de recaudaciÃ³n de los impuestos y derechos, contenida en la Ãºltima Cuenta PÃºblica correspondiente, presentada al H.\nCongreso del Estado.\nEl coeficiente mensual a que se refiere ğ¹ğ¸ğ‘‹ğ»ğ¼ ascenderÃ¡ a la cantidad mensual promedio que ğ‘–,16 corresponda a lo que el Municipio recibiÃ³ en el ejercicio de 2016 por concepto del Fondo de ExtracciÃ³n de Hidrocarburos; mismos que se publicarÃ¡n en el PeriÃ³dico Oficial del Estado dentro del Calendario de entrega, porcentaje, fÃ³rmulas y variables que menciona el artÃ­culo 15 de la Ley del Sistema de\nCoordinaciÃ³n Fiscal del Estado de Campeche.\nLa fÃ³rmula de distribuciÃ³n del Fondo de ExtracciÃ³n de Hidrocarburos no serÃ¡ aplicable en el evento de que en el periodo que se calcula, el monto de dicho fondo sea inferior al obtenido en el Ejercicio Fiscal\n2016. En dicho supuesto, la distribuciÃ³n se realizarÃ¡ en funciÃ³n de la cantidad efectivamente generada en el aÃ±o que se calcula y de acuerdo con el coeficiente efectivo que cada Municipio haya recibido por concepto de este fondo en el aÃ±o 2016.\nEn el Anexo I fracciÃ³n V del presente Acuerdo se detallan las variables utilizadas y el cÃ¡lculo de los coeficientes a los que se refiere el presente apartado.\nSEXTO.- De acuerdo con el artÃ­culo 16 de la Ley del Sistema de CoordinaciÃ³n Fiscal del Estado de\nCampeche, la SecretarÃ­a realizarÃ¡ los ajustes a los montos pagados a los Municipios derivados del\nFondo por ColaboraciÃ³n Administrativa del Predial, del Fondo Municipal de Participaciones y del Fondo de los dos meses siguientes, asimismo el Fondo de FiscalizaciÃ³n y RecaudaciÃ³n se ajustarÃ¡ cada tres meses y las diferencias resultantes serÃ¡n liquidadas dentro del mes siguiente, de conformidad a los montos de Participaciones que la SecretarÃ­a de Hacienda y CrÃ©dito PÃºblico entere al Estado. Una vez que la FederaciÃ³n determine las Participaciones del Ejercicio Fiscal correspondiente, la SecretarÃ­a liquidaciones que procedan, en los tÃ©rminos previstos en el artÃ­culo 7 de la Ley de CoordinaciÃ³n Fiscal.\nPara los efectos del presente Acuerdo, en lo no dispuesto por el presente Acuerdo se aplicarÃ¡n las disposiciones del Acuerdo 02/2014 por el que se expiden los Lineamientos para la publicaciÃ³n de la informaciÃ³n a que se refiere el artÃ­culo 6Âº de la Ley de CoordinaciÃ³n Fiscal.\nUna vez realizados los ajustes a las Participaciones por cada fondo, se realizarÃ¡ de nuevo el cÃ¡lculo aplicable para la distribuciÃ³n a los Municipios para el fondo correspondiente; es decir, el cÃ¡lculo de realizado su ajuste y no sobre el monto del ajuste correspondiente.\nestos, se realizarÃ¡n y aplicarÃ¡n en el transcurso de los seis meses siguientes al cierre de cada Ejercicio\nFiscal, tomando en cuenta las cantidades que se hubieran afectado provisionalmente.\nF. Mecanismo para la determinaciÃ³n de los ajustes cuatrimestrales y el ajuste definitivo serÃ¡ el siguiente:\nEl Tercer Ajuste Cuatrimestral 2019, (a ministrarse en febrero del ejercicio 2020), que considera los recursos definitivos de septiembre, octubre, noviembre y diciembre de 2019.\nEl Ajuste Definitivo del 2019, que considera los recursos definitivos de enero a diciembre de 2019, el cÃ¡lculo del primero, segundo y tercer ajuste cuatrimestral de 2019, asÃ­ como los ajustes de coeficientes realizados de enero a mayo de 2019 (a ministrarse en mayo de 2020).\nEl Primer Ajuste Cuatrimestral 2020, (a ministrarse en junio 2020), que considera los recursos definitivos de enero, febrero, marzo y abril de 2020.\nEl Segundo Ajuste Cuatrimestral 2020, (a ministrarse en octubre 2020), que considera los recursos definitivos de mayo, junio, julio y agosto 2020.\nG. Mecanismo para la determinaciÃ³n de los ajustes trimestrales al Fondo de FiscalizaciÃ³n y\nRecaudaciÃ³n serÃ¡ el siguiente:\nEl Cuarto Ajuste Trimestral 2019, (a ministrarse en enero del aÃ±o 2020), que considera los recursos de octubre, noviembre y diciembre 2019.\ncÃ¡lculo del primero, segundo, tercer y cuarto ajuste trimestral de 2019, asÃ­ como los ajustes de El Primer Ajuste Trimestral 2020, (a ministrarse en abril del aÃ±o 2020), que considera los recursos definitivos de enero, febrero y marzo 2020.\nEl Segundo Ajuste Trimestral 2020, (a ministrarse en julio del aÃ±o 2020), que considera los recursos definitivos de abril, mayo y junio 2020.\nEl Tercer Ajuste Trimestral 2020, (a ministrarse en octubre del aÃ±o 2020), que considera los recursos definitivos de julio, agosto y septiembre 2020.\nH. Mecanismo para la determinaciÃ³n del ajuste de coeficientes de las variables del Impuesto\nPredial y Derechos por Suministro de Agua serÃ¡ el siguiente:\ndatos (Impuesto Predial y Derechos por Suministro de Agua) utilizados en las fÃ³rmulas de distribuciÃ³n a los municipios de las Participaciones Federales de enero a mayo 2020.\nmunicipal del impuesto predial y los derechos por suministro de agua potable, las cuales forman parte de las variables de distribuciÃ³n de las Participaciones Federales.\nA partir del mes de junio del 2020 se dispondrÃ¡ de cifras validadas por la Secretaria de Hacienda y\nCrÃ©dito PÃºblico en cumplimiento al artÃ­culo 2Â° y 2Â°-A fracciÃ³n III de la Ley de CoordinaciÃ³n Fiscal; en donde la SecretarÃ­a de Finanzas del Poder Ejecutivo del Estado de Campeche y la AuditorÃ­a Superior del Estado de Campeche, turnan a la SecretarÃ­a de Hacienda y CrÃ©dito PÃºblico dicha informaciÃ³n para su validaciÃ³n, con base al CapÃ­tulo Tercero de las â€œReglas de validaciÃ³n de la informaciÃ³n para el cÃ¡lculo de los coeficientes de distribuciÃ³n de las Participaciones Federalesâ€. Con la finalidad de brindar mayor objetividad al cÃ¡lculo ya que permite sustituir las cifras provisionales por las reales.\nUna vez validada la informaciÃ³n por la Secretaria de Hacienda y CrÃ©dito PÃºblico, la Secretaria de\nFinanzas realizarÃ¡ el cÃ¡lculo del ajuste de coeficientes para la distribuciÃ³n de las Participaciones\nFederales correspondientes a los meses de enero a mayo del Ejercicio Fiscal 2020, con las nuevas cifras validadas del impuesto predial y los derechos por suministro de agua. Una vez obtenidas las cifras del ajuste de coeficientes, se realiza la compensaciÃ³n a los municipios respecto del monto que habÃ­a sido distribuido en los meses de enero a mayo del mismo Ejercicio Fiscal.\nANEXO I\nDescripciÃ³n detallada del procedimiento del cÃ¡lculo de las Participaciones Federales, descritas en el artÃ­culo CUARTO de este Acuerdo.\nI.- Variables del Fondo Municipal de Participaciones\nCuadro 1: DeterminaciÃ³n del ğ¹ğ‘€ğ‘ƒ es la participaciÃ³n del fondo al que se refiere este artÃ­culo que el ğ‘–,16\nMunicipio ğ‘– recibiÃ³ en el aÃ±o 2016 excluyendo el monto distribuido por concepto del Fondo de\nExtracciÃ³n de Hidrocarburos.\nFONDO MUNCIPAL DE PROMEDIO BASE\nMUNICIPIO\nPARTICIPACIONES MENSUAL 2016\nCalakmul $61,700,117 $5,141,676\nCalkinÃ­ $83,196,107 $6,933,009\nCampeche $319,921,111 $26,660,093\nCandelaria $79,094,562 $6,591,213\nCarmen $299,409,538 $24,950,795\nChampotÃ³n $124,111,490 $10,342,624\nEscÃ¡rcega $94,660,241 $7,888,353\nHecelchakÃ¡n $59,358,415 $4,946,535\nHopelchen $73,901,741 $6,158,478\nPalizada $74,127,673 $6,177,306\nTenabo $52,320,811 $4,360,068\nSUMA $1,321,801,806 $110,150,151\nEl Fondo Municipal de Participaciones, comprende los recursos a ministrarse en flujo de ingresos del ejercicio 2016 de los siguientes fondos: Fondo General de Participaciones, el\nFondo de Fomento Municipal (Base 2013+70%), el Impuesto Sobre ProducciÃ³n y Servicio, el\nImpuesto Sobre AutomÃ³viles Nuevos, el Fondo de CompensaciÃ³n del ISAN; asÃ­ mismo lo a ministrarse de Enero a Diciembre del 2016, el 1Â°, 2Â° ajuste cuatrimestral 2016, el 3Â° ajuste cuatrimestral 2015, el ajuste definitivo 2015 y el ajuste de coeficientes.\nCuadro 2: DeterminaciÃ³n del ğ¶1 es el coeficiente de poblaciÃ³n, el cual se determina en proporciÃ³n ğ‘–,ğ‘¡ directa al nÃºmero de habitantes que tenga cada Municipio, segÃºn la Ãºltima informaciÃ³n oficial del INEGI.\nğ‘› ğ‘–,ğ‘¡\nğ¶1 = ğ‘– ğ‘–,ğ‘¡\nPoblaciÃ³n\n(Encuesta Intercensal INEGI 2015)\nMunicipio Porcentaje\nNÃºmero ğ‘› ğ‘› ğ‘–,ğ‘¡ ğ‘– ğ‘–,ğ‘¡\nCalakmul 28,424 3.15846437116\nCalkinÃ­ 56,537 6.28237053730\nCampeche 283,025 31.44963336078\nCandelaria 43,879 4.87581825718\nCarmen 248,303 27.59133755810\nChampotÃ³n 90,244 10.02787991524\nEscÃ¡rcega 58,553 6.50638771195\nHecelchakÃ¡n 31,230 3.47026605373\nHopelchen 40,100 4.45589717434\nPalizada 8,971 0.99685420327\nTenabo 10,665 1.18509085697\nTotal 899,931 100.00000000000\nCuadro 3: DeterminaciÃ³n del ğ¶2 es el coeficiente por eficiencia recaudatoria, medida por la proporciÃ³n ğ‘–,ğ‘¡ que represente la recaudaciÃ³n por habitante en el total de contribuciones municipales, la que se determinarÃ¡ acumulando la recaudaciÃ³n de todos los impuestos y derechos, excepto las\nParticipaciones que la FederaciÃ³n les entrega directamente;\nğ‘…ğ‘‡ ğ‘› ğ‘–,ğ‘¡âˆ’1 ğ‘–,ğ‘¡\nğ¶2 = ğ‘– ğ‘–,ğ‘¡âˆ’1 ğ‘–,ğ‘¡\nProporciÃ³n de la\nImpuesto y RecaudaciÃ³n por\nHabitantes RecaudaciÃ³n por Habitante\nMunicipio Derechos 2018 Habitante ğ‘–,ğ‘¡âˆ’1 ğ‘–,ğ‘¡âˆ’1 ğ‘–,ğ‘¡ ğ‘–,ğ‘¡ âˆ‘ ğ‘…ğ‘‡ ğ‘› ğ‘– ğ‘–,ğ‘¡âˆ’1 ğ‘–,ğ‘¡\nCalakmul 4,862,290 28,424 138,205,730,960 0.000769057\nCalkinÃ­ 11,222,787 56,537 634,502,708,619 0.003530744\nCampeche 347,975,223 283,025 98,485,687,489,575 0.548031948\nCandelaria 13,052,920 43,879 572,749,076,680 0.003187111\nCarmen 302,949,586 248,303 75,223,291,052,558 0.418586373\nChampotÃ³n 30,371,132 90,244 2,740,812,436,208 0.015251483\nEscÃ¡rcega 22,921,199 58,553 1,342,104,965,047 0.007468257\nHecelchakÃ¡n 3,592,121 31,230 112,181,938,830 0.000624246\nHopelchen 9,624,621 40,100 385,947,302,100 0.002147636\nPalizada 4,942,202 8,971 44,336,494,142 0.000246714\nTenabo 2,635,883 10,665 28,111,692,195 0.000156430\nTotal 754,149,964 899,931 179,707,930,886,914 1.000000000\nCuadro 4: DeterminaciÃ³n del ğ¶3 es el coeficiente de la proporciÃ³n que represente el crecimiento en ğ‘–,ğ‘¡ la recaudaciÃ³n del impuesto predial y los derechos por suministro de agua, en los dos ejercicios inmediatos anteriores, para el que se realiza el cÃ¡lculo, respecto al crecimiento de todos los Municipios;\nğ‘–,ğ‘¡âˆ’1ğ‘›\nğ‘… ğ‘–,ğ‘¡\nğ¶3 = ğ‘–,ğ‘¡âˆ’2 ğ‘–,ğ‘¡ ğ‘… âˆ‘ ğ‘–,ğ‘¡âˆ’1ğ‘› ğ‘–ğ‘… ğ‘–,ğ‘¡ ğ‘–,ğ‘¡âˆ’2\nCoeficiente de la\nRecaudaciÃ³n Predial y\nProporciÃ³n del VariaciÃ³n de ProporciÃ³n del Crecimiento\nAgua NÃºmero de\nCrecimiento la PoblaciÃ³n ğ‘…\nMunicipio Habitantes ğ‘–,ğ‘¡âˆ’1ğ‘› 2017 2018 ğ‘–,ğ‘¡âˆ’1 ğ‘› ğ‘–,ğ‘¡âˆ’1 ğ‘› ğ¶3 = ğ‘–,ğ‘¡âˆ’2\nğ‘… ğ‘–,ğ‘¡âˆ’2 ğ‘… ğ‘–,ğ‘¡âˆ’1 ğ‘… ğ‘–,ğ‘¡âˆ’2 ğ‘–,ğ‘¡ ğ‘… ğ‘–,ğ‘¡âˆ’2 ğ‘–,ğ‘¡ ğ‘–,ğ‘¡ âˆ‘ ğ‘– ğ‘… ğ‘… ğ‘–,ğ‘¡âˆ’1ğ‘› ğ‘–,ğ‘¡ ğ‘–,ğ‘¡âˆ’2\nCalakmul 3,220,153 3,050,442 0.947297225 28,424 26,926 0.027480479\nCalkinÃ­ 5,641,122 5,865,023 1.039690863 56,537 58,781 0.059991514\nCampeche 148,364,844 165,037,090 1.112373292 283,025 314,829 0.321312921\nCandelaria 9,897,967 8,856,981 0.894828302 43,879 39,264 0.040072761\nCarmen 186,368,410 169,685,981 0.91048682 248,303 226,077 0.230732339\nChampotÃ³n 9,070,230 15,154,257 1.670768768 90,244 150,777 0.153881894\nEscÃ¡rcega 11,155,229 12,577,140 1.127465873 58,553 66,017 0.067376026\nHecelchakÃ¡n 2,669,019 2,724,771 1.020888574 31,230 31,882 0.032538922\nHopelchen 3,171,419 3,365,370 1.061155905 40,100 42,552 0.043428658\nPalizada 2,768,000 3,397,097 1.227274928 8,971 11,010 0.011236616\nTenabo 1,349,268 1,481,068 1.097682595 10,665 11,707 0.011947870\nTotal 383,675,661 391,195,220 12.10991314 899,931 979,822 1.000000000\nCuadro 5: DeterminaciÃ³n del ğ¶4 es el coeficiente de la proporciÃ³n que represente el crecimiento en ğ‘–,ğ‘¡ la recaudaciÃ³n de todos los impuestos, con excepciÃ³n del impuesto predial, de todos los derechos, exceptuando los derechos por suministro de agua, excluyendo las Participaciones que la federaciÃ³n otorga en forma directa a los Municipios, respecto al crecimiento de todos los Municipios en los dos ejercicios inmediatos anteriores, para el que se realiza el cÃ¡lculo;\nğ‘–,ğ‘¡âˆ’1ğ‘›\nğ‘…ğ¶ ğ‘–,ğ‘¡\nğ¶4 = ğ‘–,ğ‘¡âˆ’2 ğ‘–,ğ‘¡ ğ‘…ğ¶ âˆ‘ ğ‘–,ğ‘¡âˆ’1ğ‘› ğ‘–ğ‘…ğ¶ ğ‘–,ğ‘¡ ğ‘–,ğ‘¡âˆ’2\nImpuestos y Derechos, sin Coeficiente de la\nImpuesto Predial y sin ProporciÃ³n del VariaciÃ³n de ProporciÃ³n del Crecimiento\nNÃºmero de\nMunicipio Derecho de Agua Crecimiento Habitantes la PoblaciÃ³n ğ‘…ğ¶ ğ‘–,ğ‘¡âˆ’1ğ‘›\nğ‘…ğ¶ ğ‘…ğ¶ ğ‘…ğ¶ ğ‘–,ğ‘¡\n2017 2018 ğ‘…ğ¶ ğ‘–,ğ‘¡âˆ’1 ğ‘› ğ‘–,ğ‘¡ ğ‘…ğ¶ ğ‘–,ğ‘¡âˆ’1 ğ‘› ğ‘–,ğ‘¡ ğ¶4 ğ‘–,ğ‘¡ = ğ‘… ğ‘– ğ¶,ğ‘¡âˆ’2\nğ‘…ğ¶ ğ‘…ğ¶ ğ‘–,ğ‘¡âˆ’2 ğ‘–,ğ‘¡âˆ’2 âˆ‘ ğ‘–,ğ‘¡âˆ’1ğ‘› ğ‘–,ğ‘¡âˆ’2 ğ‘–,ğ‘¡âˆ’1 ğ‘–ğ‘…ğ¶ ğ‘–,ğ‘¡ ğ‘–,ğ‘¡âˆ’2\nCalakmul 2,230,196 1,811,848 0.812416487 28,424 23,092 0.025483083\nCalkinÃ­ 6,961,215 5,357,764 0.769659320 56,537 43,514 0.048019688\nCampeche 165,023,878 182,938,133 1.108555533 283,025 313,749 0.346234460\nCandelaria 5,934,511 4,195,939 0.707040395 43,879 31,024 0.034236470\nCarmen 160,387,647 133,263,605 0.830884470 248,303 206,311 0.227672536\nChampotÃ³n 15,655,567 15,216,875 0.971978530 90,244 87,715 0.096797256\nEscÃ¡rcega 7,354,603 10,344,059 1.406474150 58,553 82,353 0.090880131\nHecelchakÃ¡n 896,080 867,350 0.967938131 31,230 30,229 0.033358585\nHopelchen 5,107,963 6,259,251 1.225390826 40,100 49,138 0.054225933\nPalizada 547,066 1,545,105 2.824348433 8,971 25,337 0.027960644\nTenabo 898,230 1,154,815 1.285656235 10,665 13,712 0.015131213\nTotal 370,996,956 362,954,744 12.910342508 899,931 906,175 1.000000000\nII. Fondo por ColaboraciÃ³n Administrativa del Predial.\nCuadro 1: DeterminaciÃ³n del ğ¶ es el coeficiente de distribuciÃ³n del Fondo por ColaboraciÃ³n ğ‘–,ğ‘¡\nAdministrativa del predial del Municipio ğ‘– en el aÃ±o t en el que se efectÃºa el cÃ¡lculo.\nğ‘…ğ‘ ğ‘–,ğ‘¡âˆ’1ğ‘›ğ‘\nğ‘…ğ‘ ğ‘– ğ‘–,ğ‘¡âˆ’2 ğ‘–,ğ‘¡ ğ‘…ğ‘ âˆ‘ ğ‘–,ğ‘¡âˆ’1ğ‘›ğ‘ ğ‘–ğ‘…ğ‘ ğ‘– ğ‘–,ğ‘¡âˆ’2\nCoeficiente\nProporciÃ³n del VariaciÃ³n de FOCAP\nRecaudaciÃ³n de RecaudaciÃ³n de NÃºmero de\nMunicipio Predial 2017 Predial 2018 Crecimiento Habitantes la PoblaciÃ³n ğ‘…ğ‘ ğ‘–,ğ‘¡âˆ’1ğ‘›ğ‘\nğ‘…ğ‘ ğ‘…ğ‘ ğ‘…ğ‘ğ‘–,ğ‘¡âˆ’1 ğ‘›ğ‘ ğ‘…ğ‘ ğ‘–,ğ‘¡âˆ’1 ğ‘›ğ‘ ğ¶ = ğ‘…ğ‘ ğ‘–,ğ‘¡âˆ’2 ğ‘– ğ‘–,ğ‘¡âˆ’2 ğ‘–,ğ‘¡âˆ’1 ğ‘…ğ‘ğ‘–,ğ‘¡âˆ’2 ğ‘– ğ‘…ğ‘ ğ‘–,ğ‘¡âˆ’2 ğ‘– ğ‘–,ğ‘¡\nâˆ‘\nğ‘…ğ‘ ğ‘–,ğ‘¡âˆ’1ğ‘›ğ‘ ğ‘–ğ‘…ğ‘ ğ‘– ğ‘–,ğ‘¡âˆ’2\nCalakmul 1,756,632 1,504,836 0.85665978987 28,424 24,350 0.02589052794\nCalkinÃ­ 3,891,458 3,972,839 1.02091272731 56,537 57,719 0.06137177830\nCampeche 65,189,924 65,935,139 1.01143144453 283,025 286,260 0.30437472061\nCandelaria 4,781,442 5,561,612 1.16316625821 43,879 51,039 0.05426825367\nCarmen 100,668,964 82,136,942 0.81591126735 248,303 202,593 0.21541315760\nChampotÃ³n 7,377,210 13,548,087 1.83647842477 90,244 165,731 0.17621849869\nEscÃ¡rcega 6,560,768 6,385,908 0.97334763247 58,553 56,992 0.06059886049\n{\"tabla_1\":{\"columnas\":[\"Municipio\",\"(sin encabezado)\",\"(sin encabezado)\",\"(sin encabezado)\",\"PoblaciÃ³n\\n(Encuesta Intercensal INEGI 2015)\",\"(sin encabezado)\",\"(sin encabezado)\",\"(sin encabezado)\"],\"filas\":[{\"columna_1\":\"(sin dato)\",\"columna_2\":\"(sin dato)\",\"columna_3\":\"(sin dato)\",\"columna_4\":\"NÃºmero\\nğ‘›\\nğ‘–,ğ‘¡\",\"columna_5\":\"(sin dato)\",\"columna_6\":\"(sin dato)\",\"columna_7\":\"(sin dato)\",\"columna_8\":\"Porcentaje\\nğ‘›\\nğ‘–,ğ‘¡\\nâˆ‘ ğ‘›\\nğ‘– ğ‘–,ğ‘¡\"},{\"columna_1\":\"Calakmul\",\"columna_2\":\"(sin dato)\",\"columna_3\":\"(sin dato)\",\"columna_4\":\"28,424\",\"columna_5\":\"(sin dato)\",\"columna_6\":\"(sin dato)\",\"columna_7\":\"3.15846437116\",\"columna_8\":\"(sin dato)\"},{\"columna_1\":\"CalkinÃ­\",\"columna_2\":\"(sin dato)\",\"columna_3\":\"(sin dato)\",\"columna_4\":\"56,537\",\"columna_5\":\"(sin dato)\",\"columna_6\":\"(sin dato)\",\"columna_7\":\"6.28237053730\",\"columna_8\":\"(sin dato)\"},{\"columna_1\":\"Campeche\",\"columna_2\":\"(sin dato)\",\"columna_3\":\"(sin dato)\",\"columna_4\":\"283,025\",\"columna_5\":\"(sin dato)\",\"columna_6\":\"(sin dato)\",\"columna_7\":\"31.44963336078\",\"columna_8\":\"(sin dato)\"},{\"columna_1\":\"Candelaria\",\"columna_2\":\"(sin dato)\",\"columna_3\":\"(sin dato)\",\"columna_4\":\"43,879\",\"columna_5\":\"(sin dato)\",\"columna_6\":\"(sin dato)\",\"columna_7\":\"4.87581825718\",\"columna_8\":\"(sin dato)\"},{\"columna_1\":\"Carmen\",\"columna_2\":\"(sin dato)\",\"columna_3\":\"(sin dato)\",\"columna_4\":\"248,303\",\"columna_5\":\"(sin dato)\",\"columna_6\":\"(sin dato)\",\"columna_7\":\"27.59133755810\",\"columna_8\":\"(sin dato)\"},{\"columna_1\":\"ChampotÃ³n\",\"columna_2\":\"(sin dato)\",\"columna_3\":\"(sin dato)\",\"columna_4\":\"90,244\",\"columna_5\":\"(sin dato)\",\"columna_6\":\"(sin dato)\",\"columna_7\":\"10.02787991524\",\"columna_8\":\"(sin dato)\"},{\"columna_1\":\"EscÃ¡rcega\",\"columna_2\":\"(sin dato)\",\"columna_3\":\"(sin dato)\",\"columna_4\":\"58,553\",\"columna_5\":\"(sin dato)\",\"columna_6\":\"(sin dato)\",\"columna_7\":\"6.50638771195\",\"columna_8\":\"(sin dato)\"},{\"columna_1\":\"HecelchakÃ¡n\",\"columna_2\":\"(sin dato)\",\"columna_3\":\"(sin dato)\",\"columna_4\":\"31,230\",\"columna_5\":\"(sin dato)\",\"columna_6\":\"(sin dato)\",\"columna_7\":\"3.47026605373\",\"columna_8\":\"(sin dato)\"},{\"columna_1\":\"Hopelchen\",\"columna_2\":\"(sin dato)\",\"columna_3\":\"(sin dato)\",\"columna_4\":\"40,100\",\"columna_5\":\"(sin dato)\",\"columna_6\":\"(sin dato)\",\"columna_7\":\"4.45589717434\",\"columna_8\":\"(sin dato)\"},{\"columna_1\":\"Palizada\",\"columna_2\":\"(sin dato)\",\"columna_3\":\"(sin dato)\",\"columna_4\":\"8,971\",\"columna_5\":\"(sin dato)\",\"columna_6\":\"(sin dato)\",\"columna_7\":\"0.99685420327\",\"columna_8\":\"(sin dato)\"},{\"columna_1\":\"Tenabo\",\"columna_2\":\"(sin dato)\",\"columna_3\":\"(sin dato)\",\"columna_4\":\"10,665\",\"columna_5\":\"(sin dato)\",\"columna_6\":\"(sin dato)\",\"columna_7\":\"1.18509085697\",\"columna_8\":\"(sin dato)\"},{\"columna_1\":\"(sin dato)\",\"columna_2\":\"Total\",\"columna_3\":\"(sin dato)\",\"columna_4\":\"(sin dato)\",\"columna_5\":\"899,931\",\"columna_6\":\"(sin dato)\",\"columna_7\":\"(sin dato)\",\"columna_8\":\"100.00000000000\"}]}}\n{\"tabla_2\":{\"columnas\":[\"Campeche\",\"(sin encabezado)\",\"(sin encabezado)\",\"148,364,844\",\"(sin encabezado)\",\"165,037,090\",\"(sin encabezado)\",\"1.112373292\",\"(sin encabezado)\",\"(sin encabezado)\",\"283,025\",\"(sin encabezado)\",\"(sin encabezado)\",\"314,829\",\"(sin encabezado)\",\"(sin encabezado)\",\"0.321312921\",\"(sin encabezado)\"],\"filas\":[{\"columna_1\":\"Candelaria\",\"columna_2\":\"(sin dato)\",\"columna_3\":\"(sin dato)\",\"columna_4\":\"9,897,967\",\"columna_5\":\"(sin dato)\",\"columna_6\":\"8,856,981\",\"columna_7\":\"(sin dato)\",\"columna_8\":\"0.894828302\",\"columna_9\":\"(sin dato)\",\"columna_10\":\"(sin dato)\",\"columna_11\":\"43,879\",\"columna_12\":\"(sin dato)\",\"columna_13\":\"(sin dato)\",\"columna_14\":\"39,264\",\"columna_15\":\"(sin dato)\",\"columna_16\":\"(sin dato)\",\"columna_17\":\"0.040072761\",\"columna_18\":\"(sin dato)\"},{\"columna_1\":\"Carmen\",\"columna_2\":\"(sin dato)\",\"columna_3\":\"(sin dato)\",\"columna_4\":\"186,368,410\",\"columna_5\":\"(sin dato)\",\"columna_6\":\"169,685,981\",\"columna_7\":\"(sin dato)\",\"columna_8\":\"0.91048682\",\"columna_9\":\"(sin dato)\",\"columna_10\":\"(sin dato)\",\"columna_11\":\"248,303\",\"columna_12\":\"(sin dato)\",\"columna_13\":\"(sin dato)\",\"columna_14\":\"226,077\",\"columna_15\":\"(sin dato)\",\"columna_16\":\"(sin dato)\",\"columna_17\":\"0.230732339\",\"columna_18\":\"(sin dato)\"},{\"columna_1\":\"ChampotÃ³n\",\"columna_2\":\"(sin dato)\",\"columna_3\":\"(sin dato)\",\"columna_4\":\"9,070,230\",\"columna_5\":\"(sin dato)\",\"columna_6\":\"15,154,257\",\"columna_7\":\"(sin dato)\",\"columna_8\":\"1.670768768\",\"columna_9\":\"(sin dato)\",\"columna_10\":\"(sin dato)\",\"columna_11\":\"90,244\",\"columna_12\":\"(sin dato)\",\"columna_13\":\"(sin dato)\",\"columna_14\":\"150,777\",\"columna_15\":\"(sin dato)\",\"columna_16\":\"(sin dato)\",\"columna_17\":\"0.153881894\",\"columna_18\":\"(sin dato)\"},{\"columna_1\":\"EscÃ¡rcega\",\"columna_2\":\"(sin dato)\",\"columna_3\":\"(sin dato)\",\"columna_4\":\"11,155,229\",\"columna_5\":\"(sin dato)\",\"columna_6\":\"12,577,140\",\"columna_7\":\"(sin dato)\",\"columna_8\":\"1.127465873\",\"columna_9\":\"(sin dato)\",\"columna_10\":\"(sin dato)\",\"columna_11\":\"58,553\",\"columna_12\":\"(sin dato)\",\"columna_13\":\"(sin dato)\",\"columna_14\":\"66,017\",\"columna_15\":\"(sin dato)\",\"columna_16\":\"(sin dato)\",\"columna_17\":\"0.067376026\",\"columna_18\":\"(sin dato)\"},{\"columna_1\":\"HecelchakÃ¡n\",\"columna_2\":\"(sin dato)\",\"columna_3\":\"(sin dato)\",\"columna_4\":\"2,669,019\",\"columna_5\":\"(sin dato)\",\"columna_6\":\"2,724,771\",\"columna_7\":\"(sin dato)\",\"columna_8\":\"1.020888574\",\"columna_9\":\"(sin dato)\",\"columna_10\":\"(sin dato)\",\"columna_11\":\"31,230\",\"columna_12\":\"(sin dato)\",\"columna_13\":\"(sin dato)\",\"columna_14\":\"31,882\",\"columna_15\":\"(sin dato)\",\"columna_16\":\"(sin dato)\",\"columna_17\":\"0.032538922\",\"columna_18\":\"(sin dato)\"},{\"columna_1\":\"Hopelchen\",\"columna_2\":\"(sin dato)\",\"columna_3\":\"(sin dato)\",\"columna_4\":\"3,171,419\",\"columna_5\":\"(sin dato)\",\"columna_6\":\"3,365,370\",\"columna_7\":\"(sin dato)\",\"columna_8\":\"1.061155905\",\"columna_9\":\"(sin dato)\",\"columna_10\":\"(sin dato)\",\"columna_11\":\"40,100\",\"columna_12\":\"(sin dato)\",\"columna_13\":\"(sin dato)\",\"columna_14\":\"42,552\",\"columna_15\":\"(sin dato)\",\"columna_16\":\"(sin dato)\",\"columna_17\":\"0.043428658\",\"columna_18\":\"(sin dato)\"},{\"columna_1\":\"Palizada\",\"columna_2\":\"(sin dato)\",\"columna_3\":\"(sin dato)\",\"columna_4\":\"2,768,000\",\"columna_5\":\"(sin dato)\",\"columna_6\":\"3,397,097\",\"columna_7\":\"(sin dato)\",\"columna_8\":\"1.227274928\",\"columna_9\":\"(sin dato)\",\"columna_10\":\"(sin dato)\",\"columna_11\":\"8,971\",\"columna_12\":\"(sin dato)\",\"columna_13\":\"(sin dato)\",\"columna_14\":\"11,010\",\"columna_15\":\"(sin dato)\",\"columna_16\":\"(sin dato)\",\"columna_17\":\"0.011236616\",\"columna_18\":\"(sin dato)\"},{\"columna_1\":\"Tenabo\",\"columna_2\":\"(sin dato)\",\"columna_3\":\"(sin dato)\",\"columna_4\":\"1,349,268\",\"columna_5\":\"(sin dato)\",\"columna_6\":\"1,481,068\",\"columna_7\":\"(sin dato)\",\"columna_8\":\"1.097682595\",\"columna_9\":\"(sin dato)\",\"columna_10\":\"(sin dato)\",\"columna_11\":\"10,665\",\"columna_12\":\"(sin dato)\",\"columna_13\":\"(sin dato)\",\"columna_14\":\"11,707\",\"columna_15\":\"(sin dato)\",\"columna_16\":\"(sin dato)\",\"columna_17\":\"0.011947870\",\"columna_18\":\"(sin dato)\"},{\"columna_1\":\"(sin dato)\",\"columna_2\":\"Total\",\"columna_3\":\"(sin dato)\",\"columna_4\":\"(sin dato)\",\"columna_5\":\"383,675,661\",\"columna_6\":\"(sin dato)\",\"columna_7\":\"391,195,220\",\"columna_8\":\"(sin dato)\",\"columna_9\":\"12.10991314\",\"columna_10\":\"(sin dato)\",\"columna_11\":\"(sin dato)\",\"columna_12\":\"899,931\",\"columna_13\":\"(sin dato)\",\"columna_14\":\"(sin dato)\",\"columna_15\":\"979,822\",\"columna_16\":\"(sin dato)\",\"columna_17\":\"1.000000000\",\"columna_18\":\"(sin dato)\"}]}}\nIV. Fondo de FiscalizaciÃ³n y RecaudaciÃ³n\nCuadro 1: DeterminaciÃ³n del ğ¹ğ‘‚ğ¹ğ¼ğ‘… es la participaciÃ³n del fondo al que se refiere este artÃ­culo que ğ‘–,16 el Municipio ğ‘– recibiÃ³ en el aÃ±o 2016;\nFONDO DE\nPROMEDIO BASE\nMUNICIPIOS FISCALIZACIÃ“N Y\nMENSUAL 2016\nRECAUDACIÃ“N\nCalakmul $2,372,078 $197,673\nCalkinÃ­ $3,252,259 $271,022\nCampeche $11,748,586 $979,049\nCandelaria $2,997,649 $249,804\nCarmen $11,286,040 $940,503\nChampotÃ³n $4,440,969 $370,081\nEscÃ¡rcega $3,452,257 $287,688\nHecelchakÃ¡n $2,208,461 $184,038\nHopelchen $2,569,231 $214,103\nPalizada $2,307,072 $192,256\nTenabo $1,723,035 $143,586\nSUMA $48,357,637 $4,029,803\nEl Fondo de FiscalizaciÃ³n y RecaudaciÃ³n, comprende lo a ministrarse en flujo de ingresos del ejercicio 2016; es decir lo a ministrarse de enero a diciembre 2016 y el\nAjuste de Coeficiente de 2016.\nCuadro2: DeterminaciÃ³n del ğ¶1 es el coeficiente de poblaciÃ³n, el cual se determina en proporciÃ³n ğ‘–,ğ‘¡ directa al nÃºmero de habitantes que tenga cada Municipio, segÃºn la Ãºltima informaciÃ³n oficial del INEGI.\nğ‘› ğ‘–,ğ‘¡\nğ¶1 = ğ‘– ğ‘–,ğ‘¡\nPoblaciÃ³n\n(Encuesta Intercensal INEGI\n2015)\nMunicipio\nPorcentaje\nNÃºmero ğ‘› ğ‘› ğ‘–,ğ‘¡ ğ‘–,ğ‘¡ âˆ‘ ğ‘– ğ‘› ğ‘–,ğ‘¡\nCalakmul 28,424 3.15846437116\nCalkinÃ­ 56,537 6.28237053730\nCampeche 283,025 31.44963336078\nCandelaria 43,879 4.87581825718\nCarmen 248,303 27.59133755810\nChampotÃ³n 90,244 10.02787991524\nEscÃ¡rcega 58,553 6.50638771195\nHecelchakÃ¡n 31,230 3.47026605373\nHopelchen 40,100 4.45589717434\nPalizada 8,971 0.99685420327\nTenabo 10,665 1.18509085697\nTotal 899,931 100.00000000000\nCuadro 3: DeterminaciÃ³n del ğ¶2 es el coeficiente por eficiencia recaudatoria, medida por la proporciÃ³n ğ‘–,ğ‘¡ que represente la recaudaciÃ³n por habitante en el total de contribuciones municipales, la que se determinarÃ¡ acumulando la recaudaciÃ³n de todos los impuestos y derechos, excepto las participaciones que la federaciÃ³n les entrega directamente;\nğ‘…ğ‘‡ ğ‘› ğ‘–,ğ‘¡âˆ’1 ğ‘–,ğ‘¡\nğ¶2 = ğ‘– ğ‘–,ğ‘¡âˆ’1 ğ‘–,ğ‘¡\nProporciÃ³n de la\nImpuesto y NÃºmero de RecaudaciÃ³n por\nRecaudaciÃ³n por Habitante\nMunicipio Derechos 2018 Habitantes Habitante\nğ‘…ğ‘‡ ğ‘› ğ‘–,ğ‘¡âˆ’1 ğ‘–,ğ‘¡ ğ‘–,ğ‘¡âˆ’1 ğ‘–,ğ‘¡ ğ‘–,ğ‘¡âˆ’1 ğ‘–,ğ‘¡ ğ‘–,ğ‘¡ âˆ‘ ğ‘…ğ‘‡ ğ‘› ğ‘– ğ‘–,ğ‘¡âˆ’1 ğ‘–,ğ‘¡\nCalakmul 4,862,290 28,424 138,205,730,960 0.000769057\nCalkinÃ­ 11,222,787 56,537 634,502,708,619 0.003530744\nCampeche 347,975,223 283,025 98,485,687,489,575 0.548031948\n{\"tabla_3\":{\"columnas\":[\"Municipio\",\"RecaudaciÃ³n Predial y Agua\",\"(sin encabezado)\",\"(sin encabezado)\",\"ProporciÃ³n del\\nCrecimiento\\nğ‘…\\nğ‘–,ğ‘¡âˆ’1\\nğ‘…\\nğ‘–,ğ‘¡âˆ’2\",\"(sin encabezado)\",\"NÃºmero de\\nHabitantes\\nğ‘›\\nğ‘–,ğ‘¡\",\"(sin encabezado)\",\"VariaciÃ³n de\\nla PoblaciÃ³n\\nğ‘…\\nğ‘–,ğ‘¡âˆ’1\\nğ‘›\\nğ‘–,ğ‘¡\\nğ‘…\\nğ‘–,ğ‘¡âˆ’2\",\"(sin encabezado)\",\"(sin encabezado)\",\"(sin encabezado)\",\"Coeficiente de la\",\"(sin encabezado)\"],\"filas\":[{\"columna_1\":\"(sin dato)\",\"columna_2\":\"(sin dato)\",\"columna_3\":\"(sin dato)\",\"columna_4\":\"(sin dato)\",\"columna_5\":\"(sin dato)\",\"columna_6\":\"(sin dato)\",\"columna_7\":\"(sin dato)\",\"columna_8\":\"(sin dato)\",\"columna_9\":\"(sin dato)\",\"columna_10\":\"(sin dato)\",\"columna_11\":\"(sin dato)\",\"columna_12\":\"(sin dato)\",\"columna_13\":\"ProporciÃ³n del Crecimiento\",\"columna_14\":\"(sin dato)\"},{\"columna_1\":\"(sin dato)\",\"columna_2\":\"(sin dato)\",\"columna_3\":\"(sin dato)\",\"columna_4\":\"(sin dato)\",\"columna_5\":\"(sin dato)\",\"columna_6\":\"(sin dato)\",\"columna_7\":\"(sin dato)\",\"columna_8\":\"(sin dato)\",\"columna_9\":\"(sin dato)\",\"columna_10\":\"(sin dato)\",\"columna_11\":\"(sin dato)\",\"columna_12\":\"(sin dato)\",\"columna_13\":\"ğ‘…\\nğ‘–,ğ‘¡âˆ’1\\nğ‘›\\nğ‘… ğ‘–,ğ‘¡\\nğ‘–,ğ‘¡âˆ’2\\nğ¶3 =\\nğ‘–,ğ‘¡ ğ‘…\\nğ‘–,ğ‘¡âˆ’1\\nâˆ‘ ğ‘›\\nğ‘– ğ‘… ğ‘–,ğ‘¡\\nğ‘–,ğ‘¡âˆ’2\",\"columna_14\":\"(sin dato)\"},{\"columna_1\":\"(sin dato)\",\"columna_2\":\"(sin dato)\",\"columna_3\":\"2017\\nğ‘…\\nğ‘–,ğ‘¡âˆ’2\",\"columna_4\":\"2018\\nğ‘…\\nğ‘–,ğ‘¡âˆ’1\",\"columna_5\":\"(sin dato)\",\"columna_6\":\"(sin dato)\",\"columna_7\":\"(sin dato)\",\"columna_8\":\"(sin dato)\",\"columna_9\":\"(sin dato)\",\"columna_10\":\"(sin dato)\",\"columna_11\":\"(sin dato)\",\"columna_12\":\"(sin dato)\",\"columna_13\":\"(sin dato)\",\"columna_14\":\"(sin dato)\"},{\"columna_1\":\"Calakmul\",\"columna_2\":\"3,220,153\",\"columna_3\":\"(sin dato)\",\"columna_4\":\"3,050,442\",\"columna_5\":\"0.947297225\",\"columna_6\":\"(sin dato)\",\"columna_7\":\"28,424\",\"columna_8\":\"(sin dato)\",\"columna_9\":\"26,926\",\"columna_10\":\"(sin dato)\",\"columna_11\":\"(sin dato)\",\"columna_12\":\"0.027480479\",\"columna_13\":\"(sin dato)\",\"columna_14\":\"(sin dato)\"},{\"columna_1\":\"CalkinÃ­\",\"columna_2\":\"5,641,122\",\"columna_3\":\"(sin dato)\",\"columna_4\":\"5,865,023\",\"columna_5\":\"1.039690863\",\"columna_6\":\"(sin dato)\",\"columna_7\":\"56,537\",\"columna_8\":\"(sin dato)\",\"columna_9\":\"58,781\",\"columna_10\":\"(sin dato)\",\"columna_11\":\"(sin dato)\",\"columna_12\":\"0.059991514\",\"columna_13\":\"(sin dato)\",\"columna_14\":\"(sin dato)\"},{\"columna_1\":\"Campeche\",\"columna_2\":\"148,364,844\",\"columna_3\":\"(sin dato)\",\"columna_4\":\"165,037,090\",\"columna_5\":\"1.112373292\",\"columna_6\":\"(sin dato)\",\"columna_7\":\"283,025\",\"columna_8\":\"(sin dato)\",\"columna_9\":\"314,829\",\"columna_10\":\"(sin dato)\",\"columna_11\":\"(sin dato)\",\"columna_12\":\"0.321312921\",\"columna_13\":\"(sin dato)\",\"columna_14\":\"(sin dato)\"},{\"columna_1\":\"Candelaria\",\"columna_2\":\"9,897,967\",\"columna_3\":\"(sin dato)\",\"columna_4\":\"8,856,981\",\"columna_5\":\"0.894828302\",\"columna_6\":\"(sin dato)\",\"columna_7\":\"43,879\",\"columna_8\":\"(sin dato)\",\"columna_9\":\"39,264\",\"columna_10\":\"(sin dato)\",\"columna_11\":\"(sin dato)\",\"columna_12\":\"0.040072761\",\"columna_13\":\"(sin dato)\",\"columna_14\":\"(sin dato)\"},{\"columna_1\":\"Carmen\",\"columna_2\":\"186,368,410\",\"columna_3\":\"(sin dato)\",\"columna_4\":\"169,685,981\",\"columna_5\":\"0.91048682\",\"columna_6\":\"(sin dato)\",\"columna_7\":\"248,303\",\"columna_8\":\"(sin dato)\",\"columna_9\":\"226,077\",\"columna_10\":\"(sin dato)\",\"columna_11\":\"(sin dato)\",\"columna_12\":\"0.230732339\",\"columna_13\":\"(sin dato)\",\"columna_14\":\"(sin dato)\"},{\"columna_1\":\"ChampotÃ³n\",\"columna_2\":\"9,070,230\",\"columna_3\":\"(sin dato)\",\"columna_4\":\"15,154,257\",\"columna_5\":\"1.670768768\",\"columna_6\":\"(sin dato)\",\"columna_7\":\"90,244\",\"columna_8\":\"(sin dato)\",\"columna_9\":\"150,777\",\"columna_10\":\"(sin dato)\",\"columna_11\":\"(sin dato)\",\"columna_12\":\"0.153881894\",\"columna_13\":\"(sin dato)\",\"columna_14\":\"(sin dato)\"},{\"columna_1\":\"EscÃ¡rcega\",\"columna_2\":\"11,155,229\",\"columna_3\":\"(sin dato)\",\"columna_4\":\"12,577,140\",\"columna_5\":\"1.127465873\",\"columna_6\":\"(sin dato)\",\"columna_7\":\"58,553\",\"columna_8\":\"(sin dato)\",\"columna_9\":\"66,017\",\"columna_10\":\"(sin dato)\",\"columna_11\":\"(sin dato)\",\"columna_12\":\"0.067376026\",\"columna_13\":\"(sin dato)\",\"columna_14\":\"(sin dato)\"},{\"columna_1\":\"HecelchakÃ¡n\",\"columna_2\":\"2,669,019\",\"columna_3\":\"(sin dato)\",\"columna_4\":\"2,724,771\",\"columna_5\":\"1.020888574\",\"columna_6\":\"(sin dato)\",\"columna_7\":\"31,230\",\"columna_8\":\"(sin dato)\",\"columna_9\":\"31,882\",\"columna_10\":\"(sin dato)\",\"columna_11\":\"(sin dato)\",\"columna_12\":\"0.032538922\",\"columna_13\":\"(sin dato)\",\"columna_14\":\"(sin dato)\"},{\"columna_1\":\"Hopelchen\",\"columna_2\":\"3,171,419\",\"columna_3\":\"(sin dato)\",\"columna_4\":\"3,365,370\",\"columna_5\":\"1.061155905\",\"columna_6\":\"(sin dato)\",\"columna_7\":\"40,100\",\"columna_8\":\"(sin dato)\",\"columna_9\":\"42,552\",\"columna_10\":\"(sin dato)\",\"columna_11\":\"(sin dato)\",\"columna_12\":\"0.043428658\",\"columna_13\":\"(sin dato)\",\"columna_14\":\"(sin dato)\"},{\"columna_1\":\"Palizada\",\"columna_2\":\"2,768,000\",\"columna_3\":\"(sin dato)\",\"columna_4\":\"3,397,097\",\"columna_5\":\"1.227274928\",\"columna_6\":\"(sin dato)\",\"columna_7\":\"8,971\",\"columna_8\":\"(sin dato)\",\"columna_9\":\"11,010\",\"columna_10\":\"(sin dato)\",\"columna_11\":\"(sin dato)\",\"columna_12\":\"0.011236616\",\"columna_13\":\"(sin dato)\",\"columna_14\":\"(sin dato)\"},{\"columna_1\":\"Tenabo\",\"columna_2\":\"1,349,268\",\"columna_3\":\"(sin dato)\",\"columna_4\":\"1,481,068\",\"columna_5\":\"1.097682595\",\"columna_6\":\"(sin dato)\",\"columna_7\":\"10,665\",\"columna_8\":\"(sin dato)\",\"columna_9\":\"11,707\",\"columna_10\":\"(sin dato)\",\"columna_11\":\"(sin dato)\",\"columna_12\":\"0.011947870\",\"columna_13\":\"(sin dato)\",\"columna_14\":\"(sin dato)\"},{\"columna_1\":\"Total\",\"columna_2\":\"(sin dato)\",\"columna_3\":\"383,675,661\",\"columna_4\":\"391,195,220\",\"columna_5\":\"12.10991314\",\"columna_6\":\"(sin dato)\",\"columna_7\":\"899,931\",\"columna_8\":\"(sin dato)\",\"columna_9\":\"(sin dato)\",\"columna_10\":\"979,822\",\"columna_11\":\"(sin dato)\",\"columna_12\":\"(sin dato)\",\"columna_13\":\"1.000000000\",\"columna_14\":\"(sin dato)\"}]}}\nImpuestos y Derechos, sin Coeficiente de la\nNÃºmero de de Agua Crecimiento la PoblaciÃ³n ğ‘…ğ¶\nMunicipio Habitantes ğ‘–,ğ‘¡âˆ’1ğ‘›\nğ‘…ğ¶ ğ‘…ğ¶ ğ‘…ğ¶ ğ‘–,ğ‘¡ 2017 2018 ğ‘–,ğ‘¡âˆ’1 ğ‘› ğ‘–,ğ‘¡âˆ’1 ğ‘› ğ¶4 = ğ‘–,ğ‘¡âˆ’2\nğ‘…ğ¶ ğ‘–,ğ‘¡ ğ‘…ğ¶ ğ‘–,ğ‘¡ ğ‘–,ğ‘¡ ğ‘…ğ¶\nğ‘…ğ¶ ğ‘…ğ¶ ğ‘–,ğ‘¡âˆ’2 ğ‘–,ğ‘¡âˆ’2 âˆ‘ ğ‘–,ğ‘¡âˆ’1ğ‘› ğ‘–,ğ‘¡âˆ’2 ğ‘–,ğ‘¡âˆ’1 ğ‘–ğ‘…ğ¶ ğ‘–,ğ‘¡ ğ‘–,ğ‘¡âˆ’2\nCalakmul 2,230,196 1,811,848 0.812416487 28,424 23,092 0.025483083\nCalkinÃ­ 6,961,215 5,357,764 0.769659320 56,537 43,514 0.048019688\nCampeche 165,023,878 182,938,133 1.108555533 283,025 313,749 0.346234460\nCandelaria 5,934,511 4,195,939 0.707040395 43,879 31,024 0.034236470\nCarmen 160,387,647 133,263,605 0.830884470 248,303 206,311 0.227672536\nChampotÃ³n 15,655,567 15,216,875 0.971978530 90,244 87,715 0.096797256\nEscÃ¡rcega 7,354,603 10,344,059 1.406474150 58,553 82,353 0.090880131\nHecelchakÃ¡n 896,080 867,350 0.967938131 31,230 30,229 0.033358585\nHopelchen 5,107,963 6,259,251 1.225390826 40,100 49,138 0.054225933\nPalizada 547,066 1,545,105 2.824348433 8,971 25,337 0.027960644\nTenabo 898,230 1,154,815 1.285656235 10,665 13,712 0.015131213\nTotal 370,996,956 362,954,744 12.910342508 899,931 906,175 1.000000000\nV.- Fondo de ExtracciÃ³n de Hidrocarburos\nCuadro 1: DeterminaciÃ³n del ğ¹ğ¸ğ‘‹ğ»ğ¼ es la participaciÃ³n del fondo al que se refiere este artÃ­culo que ğ‘–,16 el Municipio ğ‘– recibiÃ³ en el aÃ±o 2016;\nFONDO DE EXTRACCIÃ“N PROMEDIO BASE\nMUNICIPIOS\nDE HIDROCARBUROS MENSUAL 2016\nCalakmul $20,900,587 $1,741,716\nCalkinÃ­ $29,057,291 $2,421,441\nCampeche $95,618,654 $7,968,221\nCandelaria $26,032,251 $2,169,354\nCarmen $96,844,213 $8,070,351\nChampotÃ³n $46,950,969 $3,912,581\nEscÃ¡rcega $28,255,950 $2,354,662\nHecelchakÃ¡n $19,513,290 $1,626,107\nHopelchen $26,001,904 $2,166,825\nPalizada $25,790,139 $2,149,178\nTenabo $15,150,348 $1,262,529\nSUMA $430,115,595 $35,842,965\nEl Fondo de ExtracciÃ³n de Hidrocarburos comprende lo a ministrarse en flujo de ingresos del ejercicio 2016; es decir lo a ministrarse de enero a diciembre 2016, el Ajuste de Coeficiente 2016 y el Ajuste Definitivo 2015.\nCuadro 2: DeterminaciÃ³n del ğ¶1 es el coeficiente de poblaciÃ³n, el cual se determina en proporciÃ³n ğ‘–,ğ‘¡ directa al nÃºmero de habitantes que tenga cada Municipio, segÃºn la Ãºltima informaciÃ³n oficial del INEGI.\nğ‘› ğ‘–,ğ‘¡\nğ¶1 = ğ‘– ğ‘–,ğ‘¡\nPoblaciÃ³n\n(Encuesta Intercensal INEGI 2015)\nMunicipio Porcentaje\nNÃºmero ğ‘› ğ‘› ğ‘–,ğ‘¡ ğ‘– ğ‘–,ğ‘¡\nCalakmul 28,424 3.15846437116\nCalkinÃ­ 56,537 6.28237053730\nCampeche 283,025 31.44963336078\nCandelaria 43,879 4.87581825718\nCarmen 248,303 27.59133755810\nChampotÃ³n 90,244 10.02787991524\nEscÃ¡rcega 58,553 6.50638771195\nHecelchakÃ¡n 31,230 3.47026605373\nHopelchen 40,100 4.45589717434\nPalizada 8,971 0.99685420327\nTenabo 10,665 1.18509085697\nTotal 899,931 100.00000000000\nCuadro 3: DeterminaciÃ³n del ğ¶2 es el coeficiente por eficiencia recaudatoria, medida por la proporciÃ³n ğ‘–,ğ‘¡ que represente la recaudaciÃ³n por habitante en el total de contribuciones municipales, la que se determinarÃ¡ acumulando la recaudaciÃ³n de todos los impuestos y derechos, excepto las\nParticipaciones que la FederaciÃ³n les entrega directamente;\nğ‘…ğ‘‡ ğ‘› ğ‘–,ğ‘¡âˆ’1 ğ‘–,ğ‘¡\nğ¶2 = ğ‘– ğ‘–,ğ‘¡âˆ’1 ğ‘–,ğ‘¡\nProporciÃ³n de la\nImpuesto y NÃºmero de RecaudaciÃ³n por\nRecaudaciÃ³n por Habitante\nMunicipio Derechos 2018 Habitantes Habitante\nğ‘…ğ‘‡ ğ‘› ğ‘–,ğ‘¡âˆ’1 ğ‘–,ğ‘¡ ğ‘–,ğ‘¡âˆ’1 ğ‘–,ğ‘¡ ğ‘–,ğ‘¡âˆ’1 ğ‘–,ğ‘¡ ğ‘–,ğ‘¡ âˆ‘ ğ‘…ğ‘‡ ğ‘› ğ‘– ğ‘–,ğ‘¡âˆ’1 ğ‘–,ğ‘¡\nCalakmul 4,862,290 28,424 138,205,730,960 0.000769057\nCalkinÃ­ 11,222,787 56,537 634,502,708,619 0.003530744\nCampeche 347,975,223 283,025 98,485,687,489,575 0.548031948\nCandelaria 13,052,920 43,879 572,749,076,680 0.003187110\nCarmen 302,949,586 248,303 75,223,291,052,558 0.418586373\nChampotÃ³n 30,371,132 90,244 2,740,812,436,208 0.015251483\nEscÃ¡rcega 22,921,199 58,553 1,342,104,965,047 0.007468257\nHecelchakÃ¡n 3,592,121 31,230 112,181,938,830 0.000624246\nHopelchen 9,624,621 40,100 385,947,302,100 0.002147636\nPalizada 4,942,202 8,971 44,336,494,142 0.000246714\nTenabo 2,635,883 10,665 28,111,692,195 0.000156430\nTotal 754,149,964 899,931 179,707,930,886,914 1.000000000\nCuadro 4: DeterminaciÃ³n del ğ¶3 es el coeficiente de la proporciÃ³n que represente el crecimiento en ğ‘–,ğ‘¡ la recaudaciÃ³n del impuesto predial y los derechos por suministro de agua, en los dos ejercicios inmediatos anteriores para el que se realiza el cÃ¡lculo, respecto al crecimiento de todos los Municipios;\nğ‘–,ğ‘¡âˆ’1ğ‘›\nğ‘… ğ‘–,ğ‘¡\nğ¶3 = ğ‘–,ğ‘¡âˆ’2 ğ‘–,ğ‘¡ ğ‘… âˆ‘ ğ‘–,ğ‘¡âˆ’1ğ‘› ğ‘–ğ‘… ğ‘–,ğ‘¡ ğ‘–,ğ‘¡âˆ’2\nCoeficiente de la\nRecaudaciÃ³n Predial y VariaciÃ³n\nProporciÃ³n del ProporciÃ³n del Crecimiento\nAgua NÃºmero de de la\nCrecimiento ğ‘…\nMunicipio Habitantes PoblaciÃ³n ğ‘–,ğ‘¡âˆ’1ğ‘›\n2017 2018 ğ‘… ğ‘–,ğ‘¡âˆ’1 ğ‘› ğ‘–,ğ‘¡ ğ‘… ğ‘–,ğ‘¡âˆ’1 ğ‘› ğ¶3 ğ‘–,ğ‘¡ = ğ‘… ğ‘–,ğ‘¡âˆ’2\nğ‘… ğ‘… ğ‘–,ğ‘¡âˆ’2 ğ‘… ğ‘–,ğ‘¡ âˆ‘ ğ‘–,ğ‘¡âˆ’1ğ‘› ğ‘–,ğ‘¡âˆ’2 ğ‘–,ğ‘¡âˆ’1 ğ‘–,ğ‘¡âˆ’2 ğ‘–ğ‘… ğ‘–,ğ‘¡ ğ‘–,ğ‘¡âˆ’2\nCalakmul 3,220,153 3,050,442 0.947297225 28,424 26,926 0.027480479\nCalkinÃ­ 5,641,122 5,865,023 1.039690863 56,537 58,781 0.059991514\nCampeche 148,364,844 165,037,090 1.112373292 283,025 314,829 0.321312921\nCandelaria 9,897,967 8,856,981 0.894828302 43,879 39,264 0.040072761\nCarmen 186,368,410 169,685,981 0.91048682 248,303 226,077 0.230732339\nChampotÃ³n 9,070,230 15,154,257 1.670768768 90,244 150,777 0.153881894\nEscÃ¡rcega 11,155,229 12,577,140 1.127465873 58,553 66,017 0.067376026\nHecelchakÃ¡n 2,669,019 2,724,771 1.020888574 31,230 31,882 0.032538922\nHopelchen 3,171,419 3,365,370 1.061155905 40,100 42,552 0.043428658\nPalizada 2,768,000 3,397,097 1.227274928 8,971 11,010 0.011236616\nTenabo 1,349,268 1,481,068 1.097682595 10,665 11,707 0.011947870\nTotal 383,675,661 391,195,220 12.10991314 899,931 979,822 1.000000000\nCuadro 5: DeterminaciÃ³n del ğ¶4 es el coeficiente de la proporciÃ³n que represente el crecimiento en ğ‘–,ğ‘¡ la recaudaciÃ³n de todos los impuestos, con excepciÃ³n del impuesto predial, de todos los derechos, exceptuando los derechos por suministro de agua, excluyendo las Participaciones que la federaciÃ³n otorga en forma directa a los Municipios, respecto al crecimiento de todos los Municipios en los dos ejercicios inmediatos anteriores para el que se realiza el cÃ¡lculo;\nğ‘–,ğ‘¡âˆ’1ğ‘›\nğ‘…ğ¶ ğ‘–,ğ‘¡\nğ¶4 = ğ‘–,ğ‘¡âˆ’2 ğ‘–,ğ‘¡ ğ‘…ğ¶ âˆ‘ ğ‘–,ğ‘¡âˆ’1ğ‘› ğ‘–ğ‘…ğ¶ ğ‘–,ğ‘¡ ğ‘–,ğ‘¡âˆ’2\nImpuestos y Derechos, sin Coeficiente de la\nDerecho de Agua Crecimiento NÃºmero de de la ğ‘…ğ¶\nMunicipio ğ‘…ğ¶ Habitantes PoblaciÃ³n ğ‘…ğ¶ ğ‘–,ğ‘¡âˆ’1ğ‘› ğ‘–,ğ‘¡ ğ‘–,ğ‘¡âˆ’2\nCalakmul 2,230,196 1,811,848 0.812416487 28,424 23,092 0.025483083\nCalkinÃ­ 6,961,215 5,357,764 0.769659320 56,537 43,514 0.048019688\nCampeche 165,023,878 182,938,133 1.108555533 283,025 313,749 0.346234460\nCandelaria 5,934,511 4,195,939 0.707040395 43,879 31,024 0.034236470\nCarmen 160,387,647 133,263,605 0.830884470 248,303 206,311 0.227672536\nChampotÃ³n 15,655,567 15,216,875 0.971978530 90,244 87,715 0.096797256\nEscÃ¡rcega 7,354,603 10,344,059 1.406474150 58,553 82,353 0.090880131\nHecelchakÃ¡n 896,080 867,350 0.967938131 31,230 30,229 0.033358585\nHopelchen 5,107,963 6,259,251 1.225390826 40,100 49,138 0.054225933\nPalizada 547,066 1,545,105 2.824348433 8,971 25,337 0.027960644\nTenabo 898,230 1,154,815 1.285656235 10,665 13,712 0.015131213\nTotal 370,996,956 362,954,744 12.910342508 899,931 906,175 1.000000000\nVI.- Porcentajes y montos estimados de Participaciones Federales correspondientes a los municipios del Ejercicio Fiscal 2020\nPARTICIPACIONES FEDERALES ESTIMADAS AL ESTADO DE CAMPECHE EN EL EJERCICIO FISCAL 2020\nMONTO TOTAL MONTO TOTAL A DISTRIBUIR A\nCONCEPTO AL ESTADO DE LOS MUNICIPIOS DEL ESTADO DE\nCAMPECHE CAMPECHE\nFONDO MUNICIPAL DE PARTICIPACIONES\nFONDO GENERAL 5,593,823,248 24% 1,342,517,579\nFONDO DE FOMENTO MUNICIPAL (BASE 2013+70%) 303,955,667 100% 303,955,667\nIMP. ESPECIAL 64,626,952 20% 12,925,391\nIMP. DE ISAN 53,212,978 20% 10,642,595\nFONDO COMP. ISAN 13,638,672 20% 2,727,732\nSUMA DEL FONDO MUNICIPAL DE 6,053,562,001 1,697,073,448\nPARTICIPACIONES\nFEDERALES\nFONDO DE COLABORACIÃ“N ADMINISTRATIVA DE 62,679,981 100% 62,679,981\nPREDIAL (30% DEL FONDO DE FOMENTO MUNICIPAL)\nArt. 4Â°-A FRACCIÃ“N I DE LA LEY DE COORDINACIÃ“N\n201,658,828 20% 40,331,765\nFISCAL (GASOLINA)\nFONDO DE FISCALIZACIÃ“N Y RECAUDACIÃ“N 244,267,139 24% 58,624,110\nFONDO DE EXTRACCIÃ“N DE HIDROCARBUROS 1,811,315,881 24% 434,715,812\nArt. 3Â°-B DE LA LEY DE COORDINACIÃ“N FISCAL\n525,000,000 157,510,405\n(FONDO DE ISR)*\nTOTAL DE PARTICIPACIONES FEDERALES 8,874,179,346 2,426,631,037\n*Las entidades deberÃ¡n participar a sus municipios o demarcaciones territoriales, el 100% de la recaudaciÃ³n del impuesto al que se refiere el pÃ¡rrafo primero del artÃ­culo\n3-B de la Ley de CoordinaciÃ³n Fiscal, correspondiente al personal que preste o desempeÃ±e un servicio personal subordinado en el municipio o demarcaciÃ³n territorial de que se trate.\nCon base en el Anexo II del Acuerdo 02/2014 por el que se expiden los Lineamientos para la publicaciÃ³n de la informaciÃ³n a que se refiere el artÃ­culo 6Â° de la Ley de CoordinaciÃ³n Fiscal, a continuaciÃ³n, se presentan los porcentajes y montos estimados de Participaciones Federales correspondiente a los Municipios para el Ejercicio Fiscal 2020:\nFondo de Fomento Fondo de CompensaciÃ³n del Impuesto Sobre\nMonto Monto Monto Monto\nPorcentaje Monto (Pesos) Porcentaje Porcentaje Porcentaje Porcentaje Porcentaje Monto (Pesos)\n(Pesos) (Pesos) (Pesos) (Pesos)\nCALAKMUL 4.198262 $56,362,407 4.209284 $12,794,358 4.212035 $544,422 4.207827 $447,822 4.217203 $115,034 4.200463 $70,264,043\nCALKINI 6.004506 $80,611,544 6.011304 $18,271,698 6.01301 $777,205 6.010395 $639,662 6.016134 $164,104 6.005863 $100,464,213\nCAMPECHE 26.796775 $359,751,417 26.735908 $81,265,307 26.720623 $3,453,745 26.744004 $2,846,256 26.692175 $728,091 26.78462 $448,044,816\nCANDELARIA 5.509224 $73,962,295 5.520363 $16,779,456 5.523168 $713,891 5.518889 $587,353 5.528439 $150,801 5.511448 $92,193,796\nCARMEN 24.09749 $323,513,044 24.063556 $73,142,541 24.055025 $3,109,206 24.068059 $2,561,466 24.039055 $655,721 24.090713 $402,981,978\nCHAMPOTÃ“N 9.271306 $124,468,909 9.274081 $28,189,095 9.274783 $1,198,802 9.273697 $986,962 9.276058 $253,026 9.27186 $155,096,794\nESCARCEGA 6.839838 $91,826,026 6.847387 $20,813,020 6.849286 $885,297 6.846375 $728,632 6.852836 $186,927 6.841345 $114,439,902\nHECELCHAKÃN 4.124539 $55,372,664 4.133134 $12,562,896 4.135287 $534,502 4.131972 $439,749 4.139336 $112,910 4.126255 $69,022,721\nHOPELCHÃ‰N 5.190897 $69,688,707 5.200287 $15,806,567 5.202643 $672,462 5.199042 $553,313 5.207036 $142,034 5.192772 $86,863,083\nPALIZADA 4.635645 $62,234,343 4.658467 $14,159,675 4.664199 $602,866 4.655472 $495,463 4.674873 $127,518 4.640202 $77,619,865\nTENABO 3.331519 $44,726,223 3.346229 $10,171,054 3.349941 $432,993 3.344269 $355,917 3.356855 $91,566 3.334456 $55,777,753\nTOTAL 100 $1,342,517,579 100 $303,955,667 100 $12,925,391 100 $10,642,595 100 $2,727,732 100 $1,672,768,964\nFondo de ColaboraciÃ³n\nTOTAL DE\nAdministrativa de Predial Art. 4Â°-A FracciÃ³n I de la Art. 3Â°-B de la Ley de\nFondo de FiscalizaciÃ³n y Fondo de ExtracciÃ³n de PARTICIPACIONES\nLey de CoordinaciÃ³n Fiscal CoordinaciÃ³n Fiscal\nRecaudaciÃ³n Hidrocarburos FEDERALES ESTIMADAS\nMunicipio (30% del Fondo de Fomento (Gasolina) (Fondo de ISR) PARA 2020.\nMunicipal)\nMonto Monto Monto Monto\nPorcentaje Monto (Pesos) Porcentaje Porcentaje Porcentaje Porcentaje Porcentaje Monto (Pesos)\n(Pesos) (Pesos) (Pesos) (Pesos)\nCALAKMUL 2.589055 $1,622,819 2.769956 $1,117,172 4.263601 $2,499,498 4.763522 $20,707,782 1.899231 $2,991,487 4.088088 $99,202,801\nCALKINI 6.137176 $3,846,781 5.633527 $2,272,101 6.25551 $3,667,237 6.683026 $29,052,170 2.098903 $3,305,990 5.87681 $142,608,492\nCAMPECHE 30.437471 $19,078,201 33.517006 $13,518,000 27.47363 $16,106,171 22.796056 $99,098,061 29.532323 $46,516,481 26.471339 $642,361,730\nCANDELARIA 5.426825 $3,401,533 4.256756 $1,716,825 5.556869 $3,257,665 5.960535 $25,911,387 5.113094 $8,053,655 5.5441 $134,534,861\nCARMEN 21.541318 $13,502,094 28.507297 $11,497,496 24.945233 $14,623,921 22.792774 $99,083,791 46.600379 $73,400,445 25.347476 $615,089,725\nCHAMPOTÃ“N 17.621846 $11,045,370 10.245778 $4,132,303 9.091176 $5,329,621 10.833259 $47,093,892 5.65442 $8,906,300 9.544273 $231,604,280\nESCARCEGA 6.059885 $3,798,335 5.982019 $2,412,654 6.747719 $3,955,790 6.532423 $28,397,476 2.458095 $3,871,755 6.464762 $156,875,912\nHECELCHAKÃN 3.384824 $2,121,607 3.089218 $1,245,936 4.094931 $2,400,617 4.466161 $19,415,107 0.817243 $1,287,242 3.935218 $95,493,230\nHOPELCHÃ‰N 4.455075 $2,792,440 4.002369 $1,614,226 4.891296 $2,867,479 5.952203 $25,875,169 1.472894 $2,319,961 5.041243 $122,332,358\nPALIZADA 1.172344 $734,825 0.925841 $373,408 3.788008 $2,220,686 5.798106 $25,205,282 2.78755 $4,390,681 4.555482 $110,544,747\nTENABO 1.17418 $735,976 1.070233 $431,644 2.892027 $1,695,425 3.421936 $14,875,695 1.56587 $2,466,408 3.131209 $75,982,901\nTOTAL 100 $62,679,981 100 $40,331,765 100 $58,624,110 100 $434,715,812 100 $157,510,405 100 $2,426,631,037\nLas participaciones de los Fondos seÃ±alados en el presente acuerdo, asÃ­ como los montos que finalmente reciban los municipios de la entidad, pueden verse modificados por la variaciÃ³n de los ingresos federales efectivamente captados, por el cambio de los coeficientes y, en su caso, por la correspondientes a los ejercicios 2019 y 2020.\nDerivado de lo antes expuesto, se incluye la distribuciÃ³n mensual estimada de las Participaciones\nFederales correspondientes a los Municipios para el Ejercicio Fiscal 2020; emanado del Acuerdo por el que se da a conocer el calendario de entrega, porcentaje, fÃ³rmulas y variables utilizadas, asÃ­ como enero del 2020.\nRAMO GENERAL 28: PARTICIPACIONES FEDERALES A LOS MUNICIPIOS DEL ESTADO DE CAMPECHE\nESTIMACIÃ“N DEL FONDO GENERAL DE PARTICIPACIONES DE 2020\n(PES OS)\nTotal 1,342,517,579 95,954,694 137,586,684 106,885,559 128,976,312 115,522,111 124,908,804 111,598,055 113,272,641 104,705,375 94,050,397 102,547,075 106,509,872\nCALAKMUL 56,362,407 4,282,019 5,358,553 4,562,615 5,140,665 4,792,066 5,074,288 4,689,945 4,733,125 4,506,642 4,206,351 4,457,655 4,558,483\nCALKINI 80,611,544 5,918,007 8,003,784 6,464,378 7,575,338 6,900,850 7,395,487 6,703,851 6,787,673 6,355,399 5,806,303 6,251,475 6,448,999\nCAMPECHE 359,751,417 24,312,368 39,175,440 28,226,171 36,075,148 31,275,692 34,408,723 29,878,360 30,476,881 27,445,595 23,778,445 26,637,379 28,061,215\nCANDELARIA 73,962,295 5,542,650 7,157,811 5,964,645 6,828,574 6,305,900 6,709,987 6,153,003 6,217,847 5,880,470 5,442,063 5,803,632 5,955,713\nCARMEN 323,513,044 22,341,916 34,440,953 25,524,967 31,923,957 28,016,054 30,622,396 26,877,657 27,364,700 24,890,123 21,869,852 24,241,873 25,398,596\nCHAMPOTON 124,468,909 8,960,114 12,650,894 9,928,644 11,888,762 10,695,839 11,537,939 10,347,797 10,496,222 9,735,467 8,784,639 9,545,847 9,896,745\nESCARCEGA 91,826,026 6,736,816 9,124,647 7,362,354 8,634,054 7,861,903 8,427,334 7,636,390 7,732,353 7,237,584 6,609,496 7,118,466 7,344,629\nHECELCHAKAN 55,372,664 4,155,424 5,349,120 4,467,235 5,105,952 4,719,643 5,019,582 4,606,622 4,654,541 4,405,038 4,080,217 4,348,474 4,460,816\nHOPELCHEN 69,688,707 5,196,953 6,786,129 5,612,453 6,461,511 5,947,345 6,339,303 5,797,001 5,860,819 5,529,574 5,101,749 5,453,001 5,602,869\nPALIZADA 62,234,343 4,973,224 5,513,108 5,110,714 5,411,308 5,235,395 5,438,910 5,183,158 5,204,621 5,083,276 4,893,810 5,069,416 5,117,403\nTENABO 44,726,223 3,535,203 4,026,245 3,661,383 3,931,043 3,771,424 3,934,855 3,724,271 3,743,859 3,636,207 3,477,472 3,619,857 3,664,404\nEstimaciÃ³n del Fondo General de Participaciones, conforme a los artÃ­culos 3o., 4o. FracciÃ³n II y 6o. de la Ley de Sistema de CoordinaciÃ³n Fiscal del Estado de Campeche\nLas cifras parciales pueden no coincidir con el total debido al redondeo\nRAMO GENERAL 28: PARTICIPACIONES FEDERALES A LOS MUNICIPIOS DEL ESTADO DE CAMPECHE\nESTIMACIÃ“N DEL FONDO DE FOMENTO MUNICIPAL (BASE 2013+70%) DE 2020\n(PES OS)\nMunicipios Anual Enero Febrero Marzo Abril Mayo Junio Julio Agosto Septiembre Octubre Noviembre Diciembre\nTotal 303,955,667 23,283,454 28,366,237 24,807,715 27,888,173 26,012,044 24,266,869 25,464,852 25,698,366 24,503,698 24,706,200 24,202,732 24,755,327\nCALAKMUL 12,794,358 1,039,034 1,104,772 1,058,965 1,111,551 1,079,027 985,816 1,070,169 1,073,812 1,054,668 1,104,971 1,052,077 1,059,496\nCALKINI 18,271,698 1,436,007 1,650,139 1,500,357 1,637,993 1,553,860 1,436,771 1,529,709 1,539,932 1,487,324 1,525,264 1,475,447 1,498,895\nCAMPECHE 81,265,307 5,899,408 8,076,798 6,551,182 7,800,424 7,042,329 6,684,813 6,817,753 6,914,344 6,422,961 6,246,385 6,286,843 6,522,067\nCANDELARIA 16,779,456 1,344,927 1,475,725 1,384,370 1,476,523 1,419,896 1,303,594 1,404,015 1,410,654 1,376,178 1,429,581 1,369,749 1,384,244\nCARMEN 73,142,541 5,421,277 7,100,689 5,924,244 6,902,824 6,308,358 5,949,218 6,133,042 6,208,278 5,824,916 5,745,015 5,721,466 5,903,214\nCHAMPOTON 28,189,095 2,174,176 2,608,234 2,304,399 2,570,673 2,408,375 2,241,552 2,361,198 2,381,297 2,278,345 2,307,646 2,252,971 2,300,229\nESCARCEGA 20,813,020 1,634,692 1,881,228 1,708,773 1,866,917 1,770,260 1,637,234 1,742,499 1,754,253 1,693,777 1,736,256 1,680,071 1,707,060\nHECELCHAKAN 12,562,896 1,008,316 1,102,828 1,036,828 1,104,045 1,062,719 975,188 1,051,156 1,055,984 1,030,890 1,071,837 1,026,309 1,036,796\nHOPELCHEN 15,806,567 1,261,043 1,399,096 1,302,628 1,397,154 1,339,160 1,231,579 1,322,781 1,329,654 1,294,060 1,340,184 1,286,994 1,302,234\nPALIZADA 14,159,675 1,206,755 1,136,637 1,186,176 1,170,071 1,178,851 1,056,653 1,182,712 1,180,782 1,189,615 1,285,560 1,196,462 1,189,401\nTENABO 10,171,054 857,819 830,091 849,793 849,998 849,209 764,451 849,818 849,376 850,964 913,501 854,343 851,691\nEstimaciÃ³n del Fondo de Fomento Municipal (Base 2013 +70%), conforme a los artÃ­culos 3o., 4o. FracciÃ³n I, 5o. Inciso a) y 6o. de la Ley de Sistema de CoordinaciÃ³n Fiscal del Estado de Campeche\nRAMO GENERAL 28: PARTICIPACIONES FEDERALES A LOS MUNICIPIOS DEL ESTADO DE CAMPECHE\nESTIMACIÃ“N DEL IMPUESTO ESPECIAL SOBRE PRODUCCIÃ“N Y SERVICIOS DE 2020\n(PES OS)\nTotal 12,925,391 938,238 1,316,322 1,326,125 830,861 991,503 1,046,925 1,080,680 1,117,506 1,395,722 921,899 924,546 1,035,064\nCALAKMUL 544,422 41,869 51,267 56,608 33,116 41,129 42,530 45,416 46,695 60,073 41,231 40,189 44,299\nCALKINI 777,205 57,866 76,574 80,203 48,800 59,229 61,986 64,918 66,965 84,717 56,914 56,362 62,671\nCAMPECHE 3,453,745 237,725 374,800 350,201 232,395 268,433 288,397 289,332 300,674 365,850 233,081 240,158 272,699\nCANDELARIA 713,891 54,196 68,480 74,003 43,989 54,122 56,240 59,584 61,343 78,387 53,344 52,325 57,878\nCARMEN 3,109,206 218,458 329,504 316,687 205,653 240,456 256,662 260,275 269,970 331,785 214,372 218,560 246,824\nCHAMPOTON 1,198,802 87,611 121,034 123,184 76,587 91,800 96,705 100,205 103,552 129,774 86,109 86,064 96,177\nESCARCEGA 885,297 65,872 87,298 91,345 55,620 67,477 70,634 73,948 76,284 96,477 64,788 64,179 71,375\nHECELCHAKAN 534,502 40,631 51,176 55,425 32,892 40,508 42,072 44,609 45,920 58,719 39,995 39,205 43,350\nHOPELCHEN 672,462 50,815 64,924 69,634 41,625 51,045 53,133 56,136 57,821 73,709 50,008 49,163 54,449\nPALIZADA 602,866 48,628 52,745 63,408 34,860 44,934 45,586 50,192 51,347 67,760 47,970 45,705 49,731\nTENABO 432,993 34,567 38,520 45,427 25,324 32,370 32,980 36,065 36,935 48,471 34,087 32,636 35,611\nEstimaciÃ³n del Impuesto Especial Sobre ProducciÃ³n y Servicios, conforme a los artÃ­culos 3o., 4o. FracciÃ³n III y 6o. de la Ley de Sistema de CoordinaciÃ³n Fiscal del Estado de Campeche\nLas cifras parciales pueden no coincidir con el total debido al redondeo\nRAMO GENERAL 28: PARTICIPACIONES FEDERALES A LOS MUNICIPIOS DEL ESTADO DE CAMPECHE\nESTIMACIÃ“N DEL IMPUESTO SOBRE AUTOMÃ“VILES NUEVOS DE 2020\n(PES OS)\nMunicipios Anual Enero Febrero Marzo Abril Mayo Junio Julio Agosto Septiembre Octubre Noviembre Diciembre\nTotal 10,642,595 929,875 1,205,711 949,529 839,709 911,211 811,168 862,819 840,795 813,735 836,647 788,058 853,338\nCALAKMUL 447,822 41,496 46,959 40,532 33,469 37,799 32,953 36,260 35,133 35,024 37,419 34,256 36,522\nCALKINI 639,662 57,350 70,139 57,427 49,320 54,432 48,027 51,831 50,383 49,392 51,651 48,042 51,668\nCAMPECHE 2,846,256 235,606 343,305 250,750 234,870 246,695 223,453 231,004 226,223 213,298 211,527 204,704 224,821\nCANDELARIA 587,353 53,713 62,726 52,988 44,458 49,739 43,575 47,572 46,154 45,701 48,411 44,600 47,716\nCARMEN 2,561,466 216,510 301,816 226,754 207,843 220,984 198,864 207,804 203,121 193,438 194,548 186,295 203,489\nCHAMPOTON 986,962 86,830 110,863 88,202 77,402 84,366 74,928 80,004 77,911 75,661 78,146 73,358 79,291\nESCARCEGA 728,632 65,285 79,962 65,404 56,212 62,013 54,728 59,041 57,395 56,248 58,796 54,704 58,844\nHECELCHAKAN 439,749 40,269 46,876 39,685 33,243 37,227 32,598 35,616 34,549 34,234 36,296 33,417 35,739\nHOPELCHEN 553,313 50,363 59,469 49,859 42,068 46,911 41,168 44,819 43,503 42,974 45,384 41,906 44,889\nPALIZADA 495,463 48,194 48,313 45,402 35,231 41,297 35,321 40,074 38,633 39,506 43,534 38,958 41,000\nTENABO 355,917 34,259 35,283 32,526 25,593 29,748 25,553 28,794 27,790 28,259 30,935 27,818 29,359\nEstimaciÃ³n del Impuesto Sobre AutomÃ³viles Nuevos, conforme a los artÃ­culos 3o., 4o. FracciÃ³n IV y 6o. de la Ley de Sistema de CoordinaciÃ³n Fiscal del Estado de Campeche\nRAMO GENERAL 28: PARTICIPACIONES FEDERALES A LOS MUNICIPIOS DEL ESTADO DE CAMPECHE\nESTIMACIÃ“N DEL FONDO DE COMPENSACIÃ“N DEL IMPUESTO SOBRE AUTOMÃ“VILES NUEVOS DE 2020\n(PES OS)\nTotal 2,727,732 227,311 227,311 227,311 227,311 227,311 227,311 227,311 227,311 227,311 227,311 227,311 227,311\nCALAKMUL 115,034 10,144 8,853 9,703 9,060 9,429 9,234 9,553 9,498 9,784 10,166 9,881 9,729\nCALKINI 164,104 14,019 13,223 13,748 13,351 13,579 13,458 13,655 13,621 13,797 14,033 13,857 13,763\nCAMPECHE 728,091 57,595 64,723 60,028 63,580 61,541 62,618 60,859 61,160 59,583 57,470 59,046 59,888\nCANDELARIA 150,801 13,130 11,826 12,685 12,035 12,408 12,211 12,533 12,478 12,766 13,153 12,865 12,711\nCARMEN 655,721 52,927 56,901 54,283 56,263 55,127 55,727 54,746 54,914 54,035 52,857 53,736 54,205\nCHAMPOTON 253,026 21,226 20,901 21,115 20,953 21,046 20,997 21,077 21,063 21,135 21,232 21,160 21,121\nESCARCEGA 186,927 15,959 15,075 15,657 15,217 15,470 15,336 15,554 15,517 15,713 15,975 15,779 15,675\nHECELCHAKAN 112,910 9,844 8,837 9,500 8,999 9,287 9,135 9,383 9,341 9,563 9,862 9,639 9,520\nHOPELCHEN 142,034 12,311 11,212 11,936 11,388 11,702 11,536 11,808 11,761 12,005 12,330 12,087 11,958\nPALIZADA 127,518 11,781 9,108 10,869 9,537 10,301 9,898 10,557 10,445 11,036 11,828 11,237 10,921\nTENABO 91,566 8,375 6,652 7,787 6,928 7,421 7,161 7,586 7,513 7,894 8,405 8,024 7,820\nEstimaciÃ³n del Fondo de CompensaciÃ³n del Impuesto Sobre AutomÃ³viles Nuevos, conforme a los artÃ­culos 3o., 4o. FracciÃ³n V y 6o. de la Ley de Sistema de CoordinaciÃ³n Fiscal del Estado de Campeche\nLas cifras parciales pueden no coincidir con el total debido al redondeo\nRAMO GENERAL 28: PARTICIPACIONES FEDERALES A LOS MUNICIPIOS DEL ESTADO DE CAMPECHE\nESTIMACIÃ“N DEL FONDO DE COLABORACIÃ“N ADMINISTRATIVA DE PREDIAL (30% DEL FONDO DE FOMENTO MUNICIPAL) DE 2020\n(PESOS)\nTotal 62,679,981 3,257,390 8,140,848 4,721,875 7,681,531 5,878,976 4,202,239 5,353,242 5,577,598 4,429,780 4,624,342 4,140,618 4,671,542\nCALAKMUL 1,622,819 84,336 210,771 122,252 198,879 152,210 108,798 138,598 144,407 114,689 119,727 107,203 120,949\nCALKINI 3,846,781 199,912 499,618 289,790 471,429 360,803 257,899 328,538 342,307 271,863 283,804 254,117 286,701\nCAMPECHE 19,078,201 991,467 2,477,868 1,437,219 2,338,064 1,789,412 1,279,055 1,629,392 1,697,680 1,348,313 1,407,533 1,260,299 1,421,899\nCANDELARIA 3,401,533 176,773 441,790 256,248 416,863 319,042 228,048 290,511 302,686 240,397 250,955 224,704 253,516\nCARMEN 13,502,094 701,684 1,753,646 1,017,154 1,654,703 1,266,409 905,218 1,153,159 1,201,488 954,233 996,144 891,944 1,006,312\nCHAMPOTON 11,045,370 574,012 1,434,568 832,082 1,353,628 1,035,984 740,512 943,340 982,876 780,609 814,894 729,653 823,212\nESCARCEGA 3,798,335 197,394 493,326 286,140 465,492 356,259 254,651 324,400 337,996 268,440 280,230 250,917 283,090\nHECELCHAKAN 2,121,607 110,257 275,553 159,827 260,006 198,993 142,238 181,198 188,792 149,940 156,526 140,153 158,124\nHOPELCHEN 2,792,440 145,119 362,681 210,363 342,218 261,912 187,213 238,491 248,486 197,350 206,018 184,468 208,121\nPALIZADA 734,825 38,188 95,439 55,357 90,054 68,922 49,265 62,758 65,389 51,932 54,213 48,542 54,766\nTENABO 735,976 38,248 95,588 55,443 90,195 69,030 49,342 62,857 65,491 52,014 54,298 48,618 54,852\nEstimaciÃ³n del Fondo de ColaboraciÃ³n Administrativa de Predial (30% del Fondo de fomento Municipal), conforme a los artÃ­culos 3o., 4o. FracciÃ³n I y 5o. Inciso b) de la Ley de Sistema de CoordinaciÃ³n Fiscal del Estado de Campeche.\nRAMO GENERAL 28: PARTICIPACIONES FEDERALES A LOS MUNICIPIOS DEL ESTADO DE CAMPECHE\nESTIMACIÃ“N DEL 4Â°-A FRACCIÃ“N I DE LA LEY DE COORDINACIÃ“N FISCAL (GASOLINA) DE 2020\n(PES OS)\nTotal 40,331,765 3,371,955 3,397,347 3,232,693 3,486,481 3,415,875 3,548,103 3,382,467 3,439,738 3,360,429 3,221,043 3,310,318 3,165,316\nCALAKMUL 1,117,172 93,402 94,105 89,544 96,574 94,618 98,281 93,693 95,279 93,082 89,222 91,694 87,678\nCALKINI 2,272,101 189,960 191,390 182,115 196,412 192,434 199,883 190,552 193,779 189,311 181,458 186,488 178,319\nCAMPECHE 13,518,000 1,130,178 1,138,689 1,083,502 1,168,564 1,144,899 1,189,218 1,133,702 1,152,897 1,126,315 1,079,597 1,109,520 1,060,919\nCANDELARIA 1,716,825 143,536 144,617 137,608 148,411 145,406 151,034 143,983 146,421 143,045 137,112 140,912 134,740\nCARMEN 11,497,496 961,253 968,492 921,554 993,901 973,774 1,011,468 964,250 980,576 957,968 918,232 943,682 902,346\nCHAMPOTON 4,132,303 345,483 348,085 331,214 357,217 349,983 363,531 346,560 352,428 344,302 330,021 339,168 324,311\nESCARCEGA 2,412,654 201,711 203,230 193,380 208,562 204,338 212,248 202,340 205,766 201,022 192,683 198,024 189,350\nHECELCHAKAN 1,245,936 104,167 104,951 99,865 107,705 105,524 109,609 104,492 106,261 103,811 99,505 102,263 97,783\nHOPELCHEN 1,614,226 134,958 135,974 129,384 139,542 136,716 142,008 135,379 137,671 134,497 128,918 132,491 126,688\nPALIZADA 373,408 31,219 31,454 29,930 32,279 31,625 32,850 31,316 31,847 31,112 29,822 30,648 29,306\nTENABO 431,644 36,088 36,360 34,597 37,314 36,558 37,973 36,200 36,813 35,964 34,473 35,428 33,876\nEstimaciÃ³n del 4Â°-A FracciÃ³n I de la Ley de CoordinaciÃ³n Fiscal (Gasolina), conforme a los artÃ­culos 3o., 4o. FracciÃ³n VIII y 7o. de la Ley de Sistema de CoordinaciÃ³n Fiscal del Estado de Campeche\nRAMO GENERAL 28: PARTICIPACIONES FEDERALES A LOS MUNICIPIOS DEL ESTADO DE CAMPECHE\nESTIMACIÃ“N DEL FONDO DE FISCALIZACIÃ“N Y RECAUDACIÃ“N DE 2020\n(PES OS)\nTotal 58,624,110 6,604,983 3,613,693 3,613,693 8,543,705 3,613,693 3,613,693 7,374,758 3,613,693 3,613,693 7,191,120 3,613,693 3,613,693\nCALAKMUL 2,499,498 250,252 177,262 177,262 297,559 177,262 177,262 269,036 177,262 177,262 264,555 177,262 177,262\nCALKINI 3,667,237 390,212 243,036 243,036 485,600 243,036 243,036 428,086 243,036 243,036 419,051 243,036 243,036\nCAMPECHE 16,106,171 1,969,951 877,954 877,954 2,677,699 877,954 877,954 2,250,964 877,954 877,954 2,183,925 877,954 877,954\nCANDELARIA 3,257,665 335,655 224,010 224,010 408,014 224,010 224,010 364,385 224,010 224,010 357,531 224,010 224,010\nCARMEN 14,623,921 1,726,136 843,389 843,389 2,298,264 843,389 843,389 1,953,301 843,389 843,389 1,899,108 843,389 843,389\nCHAMPOTON 5,329,621 595,954 331,867 331,867 767,115 331,867 331,867 663,914 331,867 331,867 647,702 331,867 331,867\nESCARCEGA 3,955,790 426,564 257,982 257,982 535,826 257,982 257,982 469,947 257,982 257,982 459,597 257,982 257,982\nHECELCHAKAN 2,400,617 247,404 165,035 165,035 300,789 165,035 165,035 268,600 165,035 165,035 263,544 165,035 165,035\nHOPELCHEN 2,867,479 302,464 191,994 191,994 374,061 191,994 191,994 330,892 191,994 191,994 324,110 191,994 191,994\nPALIZADA 2,220,686 202,168 172,404 172,404 221,459 172,404 172,404 209,827 172,404 172,404 208,000 172,404 172,404\nTENABO 1,695,425 158,223 128,760 128,760 177,319 128,760 128,760 165,806 128,760 128,760 163,997 128,760 128,760\nEstimaciÃ³n del Fondo de FiscalizaciÃ³n y RecaudaciÃ³n, conforme a los artÃ­culos 3o., 4o. FracciÃ³n VII y 8o. de la Ley de Sistema de CoordinaciÃ³n Fiscal del Estado de Campeche\nRAMO GENERAL 28: PARTICIPACIONES FEDERALES A LOS MUNICIPIOS DEL ESTADO DE CAMPECHE\nESTIMACIÃ“N DEL FONDO DE EXTRACCIÃ“N DE HIDROCARBUROS DE 2020\n(PESOS)\nMunicipios Anual Enero Febrero Marzo Abril Mayo Junio Julio Agosto Septiembre Octubre Noviembre Diciembre\nTotal 434,715,812 38,899,642 36,540,944 32,484,927 33,248,951 32,225,447 34,368,369 34,277,266 36,865,856 38,288,528 38,042,385 40,102,295 39,371,202\nCALAKMUL 20,707,782 1,816,302 1,758,747 1,578,538 1,615,665 1,565,930 1,670,061 1,665,634 1,766,675 1,801,390 1,795,384 1,845,648 1,827,808\nCALKINI 29,052,170 2,571,834 2,455,783 2,194,582 2,246,197 2,177,052 2,321,822 2,315,667 2,471,769 2,541,766 2,529,656 2,631,006 2,595,036\nCAMPECHE 99,098,061 9,084,088 8,223,024 7,221,698 7,391,548 7,164,013 7,640,404 7,620,151 8,341,637 8,860,996 8,771,139 9,523,127 9,256,236\nCANDELARIA 25,911,387 2,283,439 2,195,405 1,966,113 2,012,354 1,950,408 2,080,106 2,074,592 2,207,532 2,260,630 2,251,443 2,328,326 2,301,039\nCARMEN 99,083,791 8,972,394 8,276,329 7,314,260 7,486,286 7,255,836 7,738,333 7,717,820 8,372,212 8,792,051 8,719,412 9,327,304 9,111,554\nCHAMPOTON 47,093,892 4,182,441 3,974,202 3,546,021 3,629,421 3,517,696 3,751,615 3,741,671 4,002,887 4,128,489 4,106,758 4,288,618 4,224,073\nESCARCEGA 28,397,476 2,526,929 2,393,998 2,134,060 2,184,252 2,117,014 2,257,790 2,251,806 2,412,310 2,492,488 2,478,616 2,594,708 2,553,505\nHECELCHAKAN 19,415,107 1,710,276 1,645,327 1,473,761 1,508,423 1,461,990 1,559,209 1,555,075 1,654,273 1,693,448 1,686,671 1,743,393 1,723,261\nHOPELCHEN 25,875,169 2,279,709 2,192,602 1,963,821 2,010,008 1,948,134 2,077,681 2,072,174 2,204,601 2,257,141 2,248,050 2,324,124 2,297,124\nPALIZADA 25,205,282 2,179,593 2,156,123 1,947,827 1,993,639 1,932,268 2,060,760 2,055,297 2,159,356 2,173,512 2,171,063 2,191,559 2,184,285\nTENABO 14,875,695 1,292,637 1,269,404 1,144,246 1,171,158 1,135,106 1,210,588 1,207,379 1,272,604 1,286,617 1,284,193 1,304,482 1,297,281\nEstimaciÃ³n del Fondo de ExtracciÃ³n de Hidrocarburos, conforme a los artÃ­culos 3o., 4o. FracciÃ³n VI y 9o. de la Ley de Sistema de CoordinaciÃ³n Fiscal del Estado de Campeche\nRAMO GENERAL 28: PARTICIPACIONES FEDERALES A LOS MUNICIPIOS DEL ESTADO DE CAMPECHE\nESTIMACIÃ“N DEL ART. 3Â°-B DE LA LEY DE COORDINACIÃ“N FISCAL (FONDO DE ISR) DE 2020\n(PES OS)\nTotal 157,510,405 12,770,463 10,787,520 11,985,106 14,759,620 12,796,456 11,911,991 13,213,031 6,109,206 19,314,658 9,788,895 7,151,566 26,921,893\nCALAKMUL 2,991,487 224,396 213,349 216,318 215,692 225,822 532 237,289 208,924 240,761 349,150 425,658 433,596\nCALKINI 3,305,990 87,138 0 0 0 144,518 234,244 279,871 223,437 1,912,870 248,475 93 175,344\nCAMPECHE 46,516,481 4,163,239 2,890,934 2,836,999 5,443,378 2,969,780 3,305,282 3,792,501 3,364,224 4,214,908 1,975,821 3,713,496 7,845,919\nCANDELARIA 8,053,655 585,074 625,630 646,087 33,316 652,388 32,592 668,257 651,445 1,769,135 654,593 645,312 1,089,826\nCARMEN 73,400,445 6,165,138 5,399,878 6,135,104 6,338,225 6,310,996 6,149,397 6,320,460 539,055 9,203,760 6,132,956 384,870 14,320,606\nCHAMPOTON 8,906,300 710,324 713,175 722,889 755,406 907,502 829,354 774,405 816,985 774,935 40,693 845,295 1,015,337\nESCARCEGA 3,871,755 498,133 445,006 523,404 506,877 501,771 255,451 24,362 26,004 0 0 371,146 719,601\nHECELCHAKAN 1,287,242 89,535 87,762 84,681 83,733 80,245 78,355 59,762 80,613 137,580 161,198 182,248 161,530\nHOPELCHEN 2,319,961 41,421 174,042 108,304 175,538 179,989 238,077 225,849 197,552 675,887 211,504 70,752 21,046\nPALIZADA 4,390,681 11,840 17,410 485,104 536,714 588,127 575,477 578,340 967 87,065 14,505 512,696 982,436\nTENABO 2,466,408 194,225 220,334 226,216 670,741 235,318 213,230 251,935 0 297,757 0 0 156,652\nEstimaciÃ³n del artÃ­culo 3Â°-B de la Ley de CoordinaciÃ³n Fiscal (Fondo de ISR), conforme a los artÃ­culos 3o., 4o. FracciÃ³n IX y 10o. de la Ley de Sistema de CoordinaciÃ³n Fiscal del Estado de Campeche\nLas cifras parciales pueden no coincidir con el total debido al redondeo\nRAMO GENERAL 28: PARTICIPACIONES FEDERALES A LOS MUNICIPIOS DEL ESTADO DE CAMPECHE\nCONSOLIDADO DE MUNICIPIOS PARA EL EJERCICIO FISCAL 2020\n(PES OS)\nMunicipios Anual Enero Febrero Marzo Abril Mayo Junio Julio Agosto Septiembre Octubre Noviembre Diciembre\nTotal 2,426,631,037 186,238,005 231,182,617 190,234,533 226,482,654 201,594,627 208,905,472 202,834,481 196,762,710 200,652,929 183,610,239 187,008,212 211,124,558\nCALAKMUL 99,202,801 7,883,250 9,024,638 7,912,337 8,752,230 8,175,292 8,199,755 8,255,593 8,290,810 8,093,375 8,018,176 8,241,523 8,355,822\nCALKINI 142,608,492 10,922,305 13,203,686 11,025,636 12,724,440 11,699,793 12,212,613 11,906,678 11,932,902 13,149,475 11,116,609 11,159,923 11,554,432\nCAMPECHE 642,361,730 48,081,625 63,643,535 48,895,704 63,425,670 52,840,748 55,959,917 53,704,018 53,413,674 50,935,773 45,944,923 49,912,526 55,603,617\nCANDELARIA 134,534,861 10,533,093 12,408,020 10,718,757 11,424,537 11,133,319 10,841,397 11,218,435 11,280,570 12,030,719 10,638,186 10,846,435 11,461,393\nCARMEN 615,089,725 46,777,693 59,471,597 48,278,396 58,067,919 51,491,383 53,730,672 51,642,514 46,037,703 52,045,698 46,742,496 42,813,119 57,990,535\nCHAMPOTON 231,604,280 17,738,171 22,313,823 18,229,617 21,497,164 19,444,458 19,989,000 19,380,171 19,567,088 18,600,584 17,217,840 18,514,001 19,112,363\nESCARCEGA 156,875,912 12,369,355 14,981,752 12,638,499 14,529,029 13,214,487 13,443,388 12,800,287 12,875,860 12,319,731 11,896,437 12,605,976 13,201,111\nHECELCHAKAN 95,493,230 7,516,123 8,837,465 7,591,842 8,545,787 7,881,171 8,133,021 7,916,513 7,995,309 7,788,258 7,605,651 7,790,136 7,891,954\nHOPELCHEN 122,332,358 9,475,156 11,378,123 9,650,376 10,995,113 10,114,908 10,513,692 10,235,330 10,283,862 10,409,191 9,668,255 9,746,980 9,861,372\nPALIZADA 110,544,747 8,751,590 9,232,741 9,107,191 9,535,152 9,304,124 9,477,124 9,404,231 8,915,791 8,907,218 8,760,305 9,317,627 9,831,653\nTENABO 75,982,901 6,189,644 6,687,237 6,186,178 6,985,613 6,294,944 6,404,893 6,370,711 6,169,141 6,372,907 6,001,361 6,059,966 6,260,306\nConsolidado de las Participaciones a Municipios, conforme a los artÃ­culos 3o., 4o., 5o., 6o., 7o., 8o., 9o., y 10o. de la Ley de Sistema de CoordinaciÃ³n Fiscal del Estado de Campeche\nTRANSITORIOS\nPrimero. - El presente Acuerdo entrarÃ¡ en vigor al dÃ­a siguiente al de su publicaciÃ³n en el PeriÃ³dico\nOficial del Estado.\nSegundo. - Se derogan todas las disposiciones reglamentarias y administrativas de igual o menor jerarquÃ­a del marco jurÃ­dico estatal que se opongan al contenido del presente Acuerdo.\nFrancisco de Campeche, Municipio y Estado de Campeche, Estados Unidos Mexicanos a los doce dÃ­as del mes de febrero de dos mil veinte.\nLIC. CARLOS MIGUEL AYSA GONZÃLEZ\nGOBERNADOR DEL ESTADO DE CAMPECHE\nC.P. GUADALUPE ESTHER CÃRDENAS GUERRERO\nSECRETARIA DE FINANZAS",
  "ordenamiento": "ACUERDO",
  "jurisdiccion": "CAMPECHE",
  "fuente_oficial": "DIARIO OFICIAL DE LA FEDERACION",
  "Fecha de PublicaciÃ³n": "14 de febrero de 2014",
  "es_escaneado": false,
  "tiene_tablas": true,
  "materia": [
    "general"
  ]
}