{
  "titulo": "Reglamento INTERIOR DEL CENTRO DE CONCILIACIÓN LABORAL DEL ESTADO DE CAMPECHE (CENCOLAB)",
  "Contenido": "ESTADO DE CAMPECHE (CENCOLAB)\nLa Junta de Gobierno, como órgano máximo de decisión y establecimiento de políticas del Centro de Conciliación Laboral de Estado de Campeche, en ejercicio de Campeche, los artículos 5, 14, 17 y 67 fracción VIII de la Ley de la Administración\nPública Paraestatal del Estado de Campeche, así como los artículos 1, 3, 6, 8, 9, 10 y 11 fracción II, todos de la Ley Orgánica del Centro de Conciliación Laboral del\nEstado de Campeche y\nCONSIDERANDO:\nI.- Que el artículo 48 de la Ley Orgánica de la Administración Pública del Estado de\nCampeche establece que la Administración Pública Paraestatal del Estado la componen los organismos descentralizados, las empresas de participación estatal mayoritaria y los fideicomisos públicos.\nII.- Que la organización y funcionamiento de las entidades paraestatales se encuentran reguladas en la Ley de la Administración Pública Paraestatal del Estado de Campeche, publicada en el Periódico Oficial del Estado el día 22 de julio del año 2010, la cual se encuentra en vigor hasta la presente fecha.\nIII.- Que la función conciliatoria en el ámbito local, en materia laboral, que establece la Constitución Política de los Estados Unidos Mexicanos, estará a cargo del Centro de Conciliación Laboral del Estado de Campeche, organismo descentralizado de la\nAdministración Pública del Estado de Campeche, especializado e imparcial, de\nCampeche.\nIV.- Que mediante Decreto 124 publicado en el Periódico Oficial del Estado de\nCampeche el día 6 de abril de 2020, se expidió la Ley Orgánica del Centro de\nConciliación Laboral del Estado de Campeche. En el artículo 3 del mismo se estableció que el organismo descentralizado, denominado Centro de Conciliación\nLaboral, identificado por su acrónimo “CENCOLAB”, se encuentra sectorizado a la\nCampeche.\nV.- Que el presente Reglamento Interior se encuentra en concordancia con lo que dispone el Eje 2 del Plan Estatal de Desarrollo 2019-2021, denominado\n“CRECIMIENTO ECONÓMICO INCLUSIVO”, con el objetivo específico 2.4.\ndenominado “EMPLEO Y DERECHOS LABORALES”, con la estrategia 2.4.4.\n“Preservar y fomentar la paz laboral” y con las líneas de acción 2.4.4.1. “Atender laboral.”, 2.4.4.2. “Promover la conciliación, procuración e impartición de justicia laboral.” Y 2.4.4.3. “Garantizar una justicia pronta y expedita, otorgando certeza jurídica a empleadores/as y trabajadores/as en las resoluciones laborales.”\nVI.- Que en el artículo 14 de la Ley de la Administración Pública Paraestatal, así como en el artículo 11, fracción II, de la Ley Orgánica del Centro de Conciliación de aprobar el Reglamento Interior del organismo descentralizado.\nVII.- Que, teniendo como base los numerales señalados en el punto anterior, el día 15 de octubre de 2020 la Junta de Gobierno aprobó la expedición del Reglamento\nInterior.\nVIII.- Que por todo lo antes expuesto y, con fundamento en las disposiciones legales previamente señaladas, se tiene a bien expedir el siguiente:\nREGLAMENTO INTERIOR DEL CENTRO DE CONCILIACIÓN LABORAL DEL\nESTADO DE CAMPECHE (CENCOLAB)\nCAPÍTULO I\nDE LA COMPETENCIA Y ORGANIZACIÓN\nArtículo 1.- El Centro de Conciliación Laboral del Estado de Campeche identificado con el acrónimo “CENCOLAB”, es un organismo descentralizado de la\nAdministración Pública Estatal, especializado e imparcial, con personalidad jurídica y patrimonio propio, dotado de plena autonomía técnica, operativa, presupuestaria, de decisión y de gestión, en los términos de lo dispuesto en el artículo 76 Ter de la\nConciliación Laboral del Estado de Campeche, cuyo objeto es ofrecer el servicio trabajadores y empleadores en asuntos del orden local, procurando el equilibrio expedita para ello. Este organismo se encuentra sectorizado a la Secretaría de\nTrabajo y Previsión Social de la Administración Pública del Estado de Campeche.\nArtículo 2.- El presente Reglamento Interior tiene por objeto regular la estructura\nCampeche, identificado por su acrónimo “CENCOLAB”.\nArtículo 3.- El Centro de Conciliación Laboral del Estado de Campeche, “CENCOLAB”, conducirá sus actividades de planeación, coordinación, ejecución, evaluación y control con base en los objetivos, políticas, estrategias, prioridades y\nEstado de Campeche, la Ley de la Administración Pública Paraestatal del Estado de Campeche, los Reglamentos, los Planes Nacional y Estatal de Desarrollo, La Ley de Planeación del Estado de Campeche y sus Municipios, así como lo que disponga la Junta de Gobierno, en ejercicio de sus atribuciones.\nArtículo 4.- El Centro de Conciliación Laboral del Estado de Campeche, “CENCOLAB”, para su debido funcionamiento y desarrollo contará con 2 sedes: una ubicada en la ciudad de San Francisco de Campeche y otra en Ciudad del Carmen, delimitando su competencia territorial de la siguiente manera:\na). Sede San Francisco de Campeche, la cual comprende los Municipios de:\nCalakmul, Calkiní, Campeche, Candelaria, Champotón, Dzitbalché, Escárcega, Hecelchakán, Hopelchén, Palizada, Seybaplaya y Tenabo.\nb). Sede Ciudad del Carmen, la cual comprende el Municipio de: Carmen.\nArtículo 5.- Para los efectos del presente Reglamento Interior se entiende por:\nI. CENCOLAB: Al Centro de Conciliación Laboral del Estado de Campeche.\nII. Conciliación: Al proceso en el que uno o más conciliadores asisten a las partes en conflicto, para facilitar las vías de diálogo, proponiendo alternativas y soluciones al conflicto.\nIII. Constitución General: A la Constitución Política de los Estados Unidos\nMexicanos.\nV. Directora o Director General: A la Directora o Director General del Centro de Conciliación Laboral del Estado de Campeche.\nVI. Junta de Gobierno: A la Junta de Gobierno del Centro de Conciliación\nLaboral del Estado de Campeche.\nVII. Ley: A la Ley Orgánica del Centro de Conciliación Laboral del Estado de\nCampeche.\nVIII. Reglamento: Al Reglamento Interior del Centro de Conciliación Laboral del\nEstado de Campeche.\nIX. Miembros: A las y los integrantes de la Junta de Gobierno del Centro de\nConciliación Laboral.\nX. Presidencia: A la Presidenta o Presidente de la Junta de Gobierno del\nCentro de Conciliación Laboral.\nXI. Secretaría de Trabajo: A la Secretaría de Trabajo y Previsión Social de la\nAdministración Pública del Estado de Campeche (STPSCAM).\nXII. Secretaría Técnica: A la Secretaría Técnica de la Junta de Gobierno del\nCentro de Conciliación Laboral del Estado de Campeche.\nXIII. Secretaria o Secretario Técnico: A la persona Titular de la Secretaría\nTécnica de la Junta de Gobierno del Centro de Conciliación Laboral.\nXIV. Conciliador: A la persona responsable de llevar a cabo el procedimiento de\nConciliación.\nXV. Convenio: Al acuerdo celebrado entre las partes.\nXVI. Constancia de No Conciliación: Al documento de no arreglo entre las partes.\nXVII. Notificador: A la persona responsable de notificar a las partes.\nArtículo 6.- La administración del Centro de Conciliación Laboral del Estado de\nCampeche, “CENCOLAB”, estará a cargo de la Junta de Gobierno y de la Dirección\nGeneral, cuya integración y funciones se establecen en la Ley Orgánica del Centro de Conciliación Laboral del Estado de Campeche y la Ley de la Administración\nPública Paraestatal del Estado de Campeche, las cuales se ejercerán de conformidad con lo dispuesto en las mismas, en el presente Reglamento y en las demás disposiciones legales aplicables.\nArtículo 7.- La Junta de Gobierno estará integrada por:\nI. Una Presidenta o Presidente, que será la persona titular de la Secretaría de\nTrabajo y Previsión Social.\nII. Las personas titulares de:\na) La Secretaría General de Gobierno;\nb) La Secretaría de la Contraloría;\nc) La Secretaría de Finanzas;\nd) La Secretaría de Desarrollo Económico.\nla misma. Las o los suplentes de las personas titulares de las Secretarías que forman parte de la Junta de Gobierno deberán tener, por lo menos, el nivel de\nSubsecretario o Subsecretaria.\nLas atribuciones de la Junta de Gobierno, además de las establecidas en la Ley de la Administración Pública Paraestatal del Estado de Campeche, están señaladas en el artículo 11 de la Ley Orgánica del Centro de Conciliación Laboral del Estado de\nCampeche.\nArtículo 8.- Para el estudio, planeación y despacho de los asuntos que le competen, el Centro de Conciliación Laboral del Estado de Campeche, “CENCOLAB”, contará con las unidades administrativas siguientes:\nI.- La Directora o Director General;\nII.- Una Subdirectora o Subdirector;\nIII.- Una Coodinadora o Coordinador Jurídico\nIV.- Una Coordinadora o Coordinador Administrativo\nV.- La Unidad de Transparencia;\nVI.- La Unidad de Informática;\nVII.- Las y los Conciliadores; y\nVIII.- Las y los Notificadores.\nArtículo 9.- El “CENCOLAB” podrá contar con las demás unidades administrativas necesarias que, para su buen funcionamiento, le sean autorizadas en el presupuesto, cuyas funciones y líneas de autoridad se establecerán en su Manual de Organización y demás normativa aplicable.\nAsimismo, se podrá auxiliar de las y los servidores públicos necesarios para el cumplimiento de sus atribuciones, de acuerdo con el presupuesto, estructura orgánica y normatividad.\nArtículo 10.- Al frente “CENCOLAB” habrá una o un Director General, quien conducirá sus actividades conforme a las disposiciones normativas aplicables y las políticas que emita la Junta de Gobierno, y se auxiliará del personal técnico y administrativo necesario para el ejercicio de sus funciones.\nCAPÍTULO II\nArtículo 11.- La o el Director General, además de las previstas en la Ley de la\nAdministración Pública Paraestatal del Estado de Campeche y en el artículo 47 de la Ley Orgánica del Centro de Conciliación Laboral del Estado de Campeche, tendrá las siguientes atribuciones y facultades:\nI. Dirigir técnica y administrativamente las actividades y funciones atribuidas del Centro;\nII. Administrar y representar legalmente al Centro;\nIII. Ejercer las más amplias facultades de administración y de pleitos y cobranzas, aún de aquellas que requieran de autorización especial según otras disposiciones legales o reglamentarias con apego a esta Ley, la ley, decreto o acuerdo de creación y el reglamento interior del organismo. Para gobierno;\nIV. Emitir, avalar y negociar títulos de crédito;\nV. Formular querellas y otorgar perdón;\nVI. Ejercitar y desistirse de acciones judiciales, inclusive del juicio de amparo;\nVII. Comprometer asuntos en arbitraje y celebrar transacciones;\nVIII. Otorgar poderes generales y especiales con las facultades que les competan, entre ellas las que requieran autorización o cláusula especial. Para el otorgamiento y validez de estos poderes bastará la comunicación oficial que se expida al mandatario por la o el Director General. Los poderes generales para surtir efectos frente a terceros deberán inscribirse en el Registro Público de Organismos Descentralizados;\nIX. Sustituir y revocar poderes generales o especiales. Los poderes generales para surtir efectos frente a terceros deberán inscribirse en el Registro Público que corresponda;\nX. Nombrar y remover libremente al personal administrativo del Centro;\nXI. Proponer la convocatoria para el procedimiento de selección de conciliadores a propuesta del titular del Centro de Conciliación;\nXII. Proponer la calendarización y sedes para llevar a cabo las etapas del o los concursos correspondientes y autorizar algún cambio en las mismas, cuando éste sea debidamente justificado u obedezca a causas de fuerza mayor;\nXIII. Proponer ante la Junta de Gobierno, los Lineamientos del proceso de selección de conciliadores públicos en materia laboral;\nXIV. Participar en los procedimientos de selección para los conciliadores de acuerdo a lo que señala la Ley Federal del Trabajo y demás disposiciones normativas aplicables;\nXV. Celebrar actos y otorgar toda clase de documentos inherentes al objeto del\nCentro;\nXVI. Acudir a las sesiones de la Junta de Gobierno con derecho a voz pero sin derecho a voto;\nXVII. Organizar, controlar y evaluar el funcionamiento de las unidades administrativas del CENCOLAB;\nXVIII. Proponer a la Junta de Gobierno, la concertación de convenios de coordinación con entidades homólogas de la Federación, de los municipios del Estado, y de otras Entidades Federativas, para la realización del objeto del CENCOLAB;\nXIX. Someter a la aprobación de la Junta de Gobierno, las modificaciones a la estructura orgánica del CENCOLAB, así como aquellas de carácter jurídico y administrativo que tiendan a mejorar su organización y funcionamiento;\nXX. Presentar para aprobación de la Junta de Gobierno, el proyecto de Manual de Organización, Manual de Procedimientos, Manual de Servicios al Público, Código de Conducta, Reglamento Interior y demás disposiciones administrativas que regulen la operación y el funcionamiento del Centro;\nXXI. Proponer a la Junta de Gobierno, para su aprobación, las bases para la organización, funcionamiento y desarrollo del Sistema de Servicio\nProfesional de Carrera;\nXXII. Presentar a la Junta de Gobierno, durante el primer trimestre de su gestión para su aprobación, el proyecto de programa institucional que deberá contener metas, objetivos, recursos, indicadores de desempeño y cumplimiento, y deberá considerar las prioridades y lineamientos sectoriales;\nXXIII. Rendir de manera semestral a la Junta de Gobierno, un informe de resultados del programa institucional, el cual incluya diagnóstico de las problemáticas presentadas durante dicho periodo y las estrategias para su solución;\nXXIV. Presentar a la Junta de Gobierno, para su aprobación, el programa anual y el anteproyecto de presupuesto correspondiente, así como un informe de resultados respecto del ejercicio anterior; además de las metas, objetivos, recursos, indicadores de desempeño y cumplimiento, y deberá considerar las prioridades y lineamientos sectoriales;\nXXV. Someter a la aprobación de la Junta de Gobierno, el establecimiento, reubicación y cierre de oficinas en el territorio del Estado. El Manual de\nOrganización determinará el ámbito de actuación de tales oficinas;\nXXVI. Definir las políticas de instrumentación de los sistemas de control que fueren necesarios, incorporando información estadística para la mejora de la gestión;\nXXVII. Proponer a la Junta de Gobierno la creación de comités de apoyo y, en su caso, la participación y honorarios de profesionistas independientes en los mismos;\nXXVIII. Imponer medios de apremio contenidos en la Ley Federal del Trabajo, para el caso de inasistencia de la o el solicitado cuando éste sea la o el patrón, dentro del procedimiento de conciliación contemplado en la mencionada Ley;\nXXIX. Proponer a la Junta de Gobierno los programas permanentes de actualización, capacitación y certificación de conciliadores; y\nXXX. Las demás dispuestas por la Ley Federal del Trabajo, la Ley de la\nAdministración Pública Paraestatal del Estado de Campeche, la Ley\nOrgánica del Centro de Conciliación Laboral, y demás disposiciones aplicables.\nArtículo 12.- Para acreditar la personalidad y atribuciones de la o el Director\nDescentralizado, bastará con exhibir una certificación de la inscripción de su nombramiento o mandato en el Registro Público de Organismos Descentralizados.\nCAPÍTULO III\nATRIBUCIONES GENÉRICAS\nArtículo 13.- Al frente de cada unidad administrativa habrá una o un titular, quienes se auxiliarán del personal que sea necesario, de acuerdo a la asignación respectivamente, conforme al presente Reglamento Interior y demás disposiciones normativas aplicables.\nArtículo 14.- Las y los titulares de las unidades administrativas del “CENCOLAB”, ejercerán sus facultades y conducirán sus actividades conforme a los objetivos, programas, políticas y lineamientos que emita la Junta de Gobierno, la o el Director\nGeneral y demás disposiciones normativas aplicables.\nArtículo 15.- A las y los titulares de las unidades administrativas les corresponde el ejercicio de las siguientes atribuciones genéricas:\nI. Planear, programar, organizar, dirigir y evaluar el desempeño de las atribuciones encomendadas a la unidad administrativa a su cargo;\nII. Formular, en el ámbito de su competencia, propuestas de política, lineamientos y normas técnicas para las actividades que se desarrollan en su unidad administrativa;\nIII. Participar en la formulación, ejecución y evaluación del programa operativo anual y de los anteproyectos de presupuesto del “CENCOLAB”;\nIV. Proponer la celebración y ejecución de acuerdos, convenios, contratos y demás instrumentos jurídicos necesarios para el cumplimiento de los objetivos del “CENCOLAB”;\nV. Proponer a la o el Director General las modificaciones a las disposiciones jurídicas y administrativas en las que se sustenta la organización y ejecución de los programas específicos del “CENCOLAB”;\nVI. Acordar con la o el Director General los asuntos a su cargo que requieran de su intervención;\nVII. Participar en la elaboración, actualización y aplicación de los reglamentos, funcionamiento del “CENCOLAB”;\nVIII. Elaborar y promover programas de capacitación, asesoría y asistencia técnica en materia de su competencia, según les corresponda;\nIX. Coordinar sus actividades con las y los titulares de las demás unidades administrativas del “CENCOLAB”, cuando la ejecución de los programas, proyectos o acciones así lo requieran;\nX. Atender con diligencia las comisiones que les encomiende la o el Director\nGeneral, así como informarle sobre el cumplimiento y resultado de las mismas;\nXI. Proponer a la o el Director General los ingresos, licencias, promociones, remociones y ceses del personal de la unidad a su cargo, de conformidad a las necesidades de servicio;\nXII. Ejercer el presupuesto aprobado y asignado a su cargo, así como observar correspondientes;\nXIII. Coordinar y concertar con las y los titulares de otras Dependencias y\nEntidades de la Administración Pública, previo acuerdo de la o el Director\nGeneral, todas las acciones que sean necesarias para el cumplimiento de los programas del “CENCOLAB”;\nXIV. Proporcionar, previo acuerdo de la o el Director General, la información, datos o la cooperación técnica que le sean requeridos por otras dependencias y entidades de la Administración Pública, de acuerdo a las políticas establecidas a este respecto;\nXV. Coadyuvar a la implantación de manuales de organización y procedimientos administrativos que se requiera, e integrar y mantener actualizados los inventarios y archivos de la Unidad; y\nXVI. Las demás que le señalen las diversas disposiciones legales, el presente\nReglamento, los manuales de organización y acuerdos de delegación de facultades que expida la Junta de Gobierno o la o el Director General.\nCAPÍTULO IV\nDE LAS ATRIBUCIONES ESPECÍFICAS DE LA SUBDIRECTORA O\nSUBDIRECTOR, DE LA COORDINADORA O COORDINADOR JURÍDICO, DE\nLA COORDINADORA O COORDINADOR ADMINISTRATIVO, DE LA UNIDAD\nDE TRANSPARENCIA Y UNIDAD DE INFORMÁTICA\nArtículo 16.- La Subdirectora o Subdirector tendrá́ las siguientes atribuciones:\nI. Acordar con la o el Director General los asuntos que le sean encomendados;\nII. Coordinar y evaluar el funcionamiento del personal a su cargo y, en su caso, de las Unidades administrativas bajo su adscripción, e informar a la o el\nDirector General de las actividades que éstas realicen;\nIII. Supervisar el cumplimiento de las políticas, normas, criterios, sistemas y adscripción y el personal a su cargo;\nIV. Ejercer las funciones que se le deleguen, realizar los actos que les\nGeneral;\nV. Coordinar la elaboración del Programa Operativo Anual y del anteproyecto adscripción y supervisar su correcta y oportuna ejecución;\nVI. Participar en la formulación, ejecución, control y evaluación de los programas sectoriales del CENCOLAB;\nVII. Proponer a la o el Director General, junto con la Coordinadora o Coordinador\nAdministrativo, las acciones de modernización, desconcentración y simplificación administrativa que sean necesarias en las Unidades administrativas de su adscripción;\nVIII. Proponer a la o el Director General, en los casos procedentes, el nombramiento y remoción de las y los servidores públicos de las Unidades administrativas que tengan adscritas;\nIX. Suscribir los documentos relativos al ejercicio de sus atribuciones y aquellos que les sean señalados por delegación o les correspondan por suplencia;\nX. Participar y evaluar el levantamiento de actas administrativas del personal adscrito a su cargo o de las Unidades administrativas bajo su adscripción.\nXI. Coordinar, dirigir y evaluar los proyectos de manuales de organización, manuales de procedimientos de trámites y servicios ciudadanos, manuales de relaciones interdepartamentales y de manejo de dinero, memoria de gestión y todo informe o escrito que requiera de la intervención de las\nUnidades administrativas bajo su adscripción;\nXII. Proporcionar la información y auxilio que les requieran el Órgano Interno de\nControl y la Coordinadora o Coordinador Jurídico para el desempeño de sus funciones;\nXIII. Representar al Centro en los foros, eventos, reuniones en materia de asuntos de su competencia y dar cumplimiento a los acuerdos y convenios que se celebren;\nXIV. Recibir en acuerdo a las y los servidores públicos homólogos, así como al personal subalterno de su unidad, y conceder audiencias al público sobre los asuntos de su competencia, de conformidad con las políticas establecidas al respecto;\nXV. Expedir certificaciones de documentos y expedientes relativos a los asuntos de su competencia;\nXVI. Proporcionar la información o la cooperación que les sean requeridas por otras Dependencias y Entidades de la Administración Pública Estatal, previo acuerdo con la o el Director General;\nXVII. Levantar las actas administrativas y otros documentos similares que cargo y remitirlas a la Coordinadora o Coordinador Administrativo, conforme a la normatividad aplicable;\nXVIII. Respetar las obligaciones señaladas en la Ley General de responsabilidades administrativas;\nXIX. Respetar y conducirse conforme al Código de Ética que deberán sujetarse las y los servidores públicos de las Dependencias y Entidades de la\nAdministración Pública del Estado de Campeche;\nXX. Respetar, difundir y hacer cumplir los lineamientos establecidos en el Código de Conducta del “CENCOLAB”, aprobado y publicado en el Periódico Oficial del Estado; y\nXXI. Las demás que le atribuyan otras disposiciones legales y reglamentarias, así como las que le confiera la o el Director General.\nArtículo 17.- La Coordinadora o Coordinador Jurídico tendrá las siguientes atribuciones:\nI. Atender, dirigir y supervisar los asuntos jurídicos del “CENCOLAB”; así como proponer a la o el Director General los cambios que resulten adecuados en la regulación interna del mismo;\nII. Fungir como órgano de consulta, asesoría, apoyo y asistencia jurídica en las materias de su competencia para todas las unidades administrativas del “CENCOLAB”; en los asuntos que deriven del ejercicio de sus atribuciones;\nasí como procurar la unificación de criterios en la aplicación de normas y el cumplimiento de las formalidades previstas en los procedimientos administrativos;\nIII. Representar legalmente al “CENCOLAB”, previo poder que al efecto le otorgue la o el Director General, con todas las facultades generales y las especiales que requieran cláusula especial conforme a la legislación que resulte aplicable, ante los órganos administrativos o jurisdiccionales competentes federales y estatales, en toda clase de juicios, procedimientos, investigaciones y cualquier otra controversia en que aquella sea parte. Así mismo, ejercitar las acciones, excepciones y defensas que correspondan, actuando en todas las instancias del juicio, procedimiento o recurso de que se trate hasta su total conclusión y, en su caso, interponer los medios de impugnación que establezcan las leyes en la materia e intervenir en el cumplimiento de las resoluciones dictadas en los juicios, procedimientos y controversias en los que el “CENCOLAB” sea parte;\nIV. Formular denuncias o querellas ante el Ministerio Público de los hechos delictuosos en que el “CENCOLAB” resulte agraviado; otorgar el perdón legal cuando proceda, previa autorización por escrito de la o el Director General, “CENCOLAB”, salvo que sea atribución de otra dependencia o entidad de la administración pública estatal, tomando en cuenta que, tratándose de bienes muebles, se seguirá el procedimiento contenido en el artículo 23 del\nReglamento de Bienes Muebles de la Propiedad del Estado de Campeche;\nV. En el caso de los juicios de amparo podrá representar al “CENCOLAB” y sus unidades administrativas, con cualquier carácter con el que intervenga en el juicio, para lo cual podrá rendir en su representación, por la vía de suplencia, los informes que se les soliciten, así como interponer los recursos que correspondan durante la tramitación de tales juicios, actuando en todas sus instancias, incluso pedir los sobreseimientos y manifestar las causales de improcedencia que se adviertan; para ese efecto, las unidades administrativas señaladas como partes deberán proporcionarle, dentro del término de ley, las pruebas documentales que resulten necesarias para acreditar la constitucionalidad de sus actos, así como proponer los contenidos que deban rendirse en los informes;\nVI. Elaborar los documentos jurídicos, convenios y contratos que resulten necesarios para el ejercicio de las atribuciones del “CENCOLAB” o, en su caso, revisar y emitir opinión sobre los proyectos ya elaborados y de aquellos que ya se encuentren en ejecución;\nVII. Compilar, ordenar y actualizar el acervo legal de la entidad paraestatal, incluyendo las leyes, decretos, reglamentos, contratos, acuerdos, convenios, circulares y demás disposiciones vigentes relacionadas con sus atribuciones y funciones, e informar a las y los titulares de las unidades administrativas del, “CENCOLAB” respecto de las disposiciones publicadas en el Diario\nOficial de la Federación y en el Periódico Oficial del Estado, relacionadas con atribuciones de su competencia;\nVIII. Levantar las actas administrativas y otros documentos similares que correspondan con respecto al desempeño de las funciones del personal a su cargo y remitirlas a la Coordinadora o Coordinador Administrativo, conforme a la normatividad aplicable; así como asesorar a las unidades administrativas en las áreas que le requieran;\nIX. Desarrollar todas aquellas funciones inherentes al área de su competencia;\nX. Las demás que le señalen las diversas disposiciones legales, el presente reglamento, los manuales de organización y acuerdos de delegación de facultades que expida la Junta de Gobierno, o la o el Director General.\nArtículo 18.- La Coordinadora o Coordinador Administrativo tendrá las siguientes atribuciones:\nI. Planear, programar, organizar y controlar los recursos humanos, materiales, funciones de las unidades administrativas “CENCOLAB”;\nII. Aplicar las normas y políticas generales en cuanto a personal, presupuesto, servicios generales y recursos materiales;\nIII. Establecer mecanismos e instrumentos que contribuyan a elevar la eficiencia y eficacia en la administración de los recursos asignados al “CENCOLAB”;\nIV. Ejecutar las medidas que dicte la o el Director General para la mejor atención de las necesidades del “CENCOLAB” en materia de personal, presupuesto, servicios generales y recursos materiales;\nV. Coordinarse con las y los titulares de las demás unidades administrativas, cuando así se requiera, para el mejor funcionamiento “CENCOLAB”;\nVI. Auxiliar a las y los titulares de las unidades administrativas del “CENCOLAB” a tramitar, a solicitud de los mismos y con la aprobación de la o el Director\nGeneral, los movimientos de personal, así como las solicitudes de servicios generales;\nVII. Vigilar la aplicación de las condiciones generales de trabajo, así como coordinar las acciones de protección civil y de seguridad e higiene del “CENCOLAB”, con base en las normas y políticas aplicables para estos fines;\nVIII. Coordinar la formulación de los programas de trabajo, así como la integración de los programas operativos y actualización de los manuales del\n“CENCOLAB”;\nIX. Elaborar el anteproyecto de Presupuesto de Ingresos y Egresos del “CENCOLAB”, así como su calendarización para los recursos del presupuesto asignado de acuerdo con los programas de trabajo;\nX. Ejercer y controlar, con autorización de la o del Director General, el presupuesto anual asignado al “CENCOLAB”, así como los ingresos que se generen por servicios que se presten o por las donaciones que reciba;\nXI. Analizar y consolidar los estados financieros, así como los reportes del avance programático del presupuesto del “CENCOLAB”;\nXII. Coordinar la integración y actualización de los inventarios de bienes muebles e inmuebles, así como de los bienes de consumo “CENCOLAB”;\nXIII. Evaluar los planes de protección civil y de seguridad e higiene en el\n“CENCOLAB”;\nXIV. Levantar toda clase de actuaciones administrativas al personal de base y de confianza de la entidad por violación a las disposiciones contenidas en la Ley\nGeneral de Responsabilidades Administrativas y en Ley de los Trabajadores\nXV. Las demás que le señalen las diversas disposiciones legales, el presente reglamento, los manuales de organización y acuerdos de delegación de facultades que expida la Junta de Gobierno o la o el Director General.\nArtículo 19.- El CENCOLAB contará con una Unidad de Transparencia cuya\nGeneral, y tendrá a su cargo el ejercicio de las facultades que le atribuyen la Ley\nProtección de Datos Personales en Posesión de Sujetos Obligados, así como la\nPersonales.\nArtículo 20.- El CENCOLAB contará con una Unidad de Informática cuya persona\nCoordinador Administrativo, y tendrá a su cargo las siguientes atribuciones: proveer soluciones de tecnologías de información a los centros, programas y áreas de apoyo, así como asesorar y apoyar a las áreas de desarrollo de redes y soporte en la resolución de problemas y toma de decisiones.\nCAPÍTULO V\nDE LAS Y LOS CONCILIADORES\nArtículo 21.- Las y los Conciliadores tendrán las siguientes atribuciones y obligaciones:\nI. Realizar sus actividades bajo los principios de eficiencia, eficacia e imparcialidad en el desempeño de sus funciones.\nII. Emitir el citatorio a la audiencia de conciliación, de conformidad con lo dispuesto en la ley federal del trabajo;\nIII. Aprobar o desestimar, según sea el caso, las causas de justificación para la inasistencia a la audiencia de conciliación, con base en los elementos que se le aporten;\nIV. Comunicar a las partes el objeto, alcance y límites de la conciliación;\nV. Exhortar a las partes para que presenten fórmulas de arreglo;\nVI. Evaluar las solicitudes de las y los interesados con el fin de determinar la forma más adecuada para formular propuestas de arreglo, sin que ello implique la imposición de acuerdos;\nVII. Redactar, revisar y sancionar los acuerdos o convenios a que lleguen las partes;\nVIII. Elaborar el acta en la que se certificará la celebración de audiencias de conciliación y dar fe, en su caso, de la entrega al trabajador de las cantidades o prestaciones convenidas;\nIX. Expedir las actas de las audiencias de conciliación a su cargo, autorizar los convenios a que lleguen las partes, y las constancias de no conciliación en aquellos casos que ésta no fuere posible. expedir las copias certificadas de los convenios y las actas de su cumplimiento;\nX. Cuidar y verificar que en los acuerdos a que lleguen las partes no se vulneren los derechos de las y los trabajadores. Lo anterior sin perjuicio de que busque la potencialización con perspectiva de derechos sociales;\nXI. Vigilar que los procesos de conciliación en que intervenga, no se afecten derechos de terceros y disposiciones de orden público, y\nXII. Las demás que establezca la Ley Federal de Trabajo y demás normatividad aplicable.\nArtículo 22.- Las y los Conciliadores, en el desempeño de sus atribuciones, tendrán las siguientes obligaciones especiales:\nI. Salvaguardar los derechos irrenunciables del trabajador;\nII. Observar los principios de conciliación, imparcialidad, neutralidad, flexibilidad, legalidad, equidad, buena fe, información, honestidad, y confidencialidad;\nIII. Tratar con la debida equidad y respeto a los interesados, procurando que todas las conciliaciones que se realicen concluyan en arreglos satisfactorios para los mismos respetando los derechos de las partes;\nIV. Cumplir con programas de capacitación y actualización para la renovación de la certificación;\nV. Abstenerse de fungir como testigos, representantes jurídicos o abogados de los asuntos relativos a los mecanismos alternativos en los que participen posteriormente en juicio;\nVI. Ser proactivo para lograr la conciliación entre las partes, y\nVII. Procurar el equilibrio entre los factores de la producción y la justicia social, así como el trabajo digno y decente.\nArtículo 23.- Las y los Conciliadores tendrán fe pública para certificar:\nI. Los instrumentos con los que las partes acrediten la personalidad e identidad con que comparecen a la audiencia, para efecto de conservar una copia en el expediente respectivo;\nII. Todo lo que asiente en las actuaciones del procedimiento de conciliación y, en su caso, los convenios a los que lleguen las partes;\nIII. Las copias de los convenios que ante su presencia se celebren; y\nIV. Las actas de no conciliación que se emitan.\nArtículo 24.- Las y los Conciliadores y el personal de las Autoridades Conciliadoras\nTribunales.\nCAPÍTULO VI\nDE LAS Y LOS NOTIFICADORES\nArtículo 25.- Las y los Notificadores tendrán las siguientes atribuciones y obligaciones:\nI. Realizar sus actividades bajo los principios de eficiencia, eficacia e imparcialidad en el desempeño de sus funciones.\nII. Realizar las notificaciones en los términos fijados en el procedimiento de\nConciliación Prejudicial que establece la Ley.\nIII. Levantar las cédulas de notificación correspondientes a los citatorios turnados para su debida diligenciación, así como los elementos de convicción necesarios para robustecer sus actuaciones, en los términos fijados en el procedimiento de Conciliación Prejudicial que establece la Ley.\nIV. Turnar las constancias de notificación respectivas de manera inmediata al responsable del área, para la debida integración del expediente y evitar dilaciones que pudieran entorpecer el debido proceso de conciliación prejudicial.\nV. Vigilar y verificar la asignación del buzón electrónico a las partes, en los términos fijados en el procedimiento de Conciliación Prejudicial que establece la Ley.\nVI. Emitir los informes que se les requieran en los términos señalados por la o el\nDirector General o, en su caso, la o el Subdirector.\nVII. Ejercer las funciones que se les deleguen y aquellos otros que les instruya la o el Director General o en su caso la o el Subdirector.\nVIII. Comunicar a las partes los apercibimientos contemplados en el procedimiento de Conciliación Prejudicial, al no asistir sin justificación a la\nAudiencia de Conciliación fijada para tal efecto.\nIX. Las demás que establezca la Ley Federal de Trabajo y demás normatividad aplicable.\nCAPÍTULO VII\nArtículo 26.- El “CENCOLAB” contará con un órgano de vigilancia y un órgano interno de control, los cuales estarán integrados y regulados por lo dispuesto en la\nLey de la Administración Pública Paraestatal del Estado de Campeche.\nde la Administración Pública Estatal.\nCAPÍTULO VIII\nDE LA UNIDAD DE IGUALDAD DE GÉNERO\nArtículo 27.- La Unidad de Igualdad de Género tendrá como objeto garantizar de manera efectiva el derecho fundamental a la igualdad entre hombres y mujeres, a través del fomento, promoción y generación de acciones y políticas públicas, dentro del marco competencial del Centro de Conciliación Laboral. Esta Unidad funcionará como un comité y estará integrado por tres servidoras y servidores públicos, procurando la paridad de género en su integración. De estas y estos integrantes, una o uno será la o el Titular, una o uno será la o el Secretario y una o uno será la o el Vocal.\nLa Unidad de Igualdad de Género se organizará y funcionará de conformidad con los lineamientos que para tal efecto emita el Ejecutivo Estatal y tendrá, además de las atribuciones que en dicho instrumento se establezcan, las siguientes:\nI. Contribuir al cumplimiento de la normativa vigente en materia de igualdad entre mujeres y hombres en todo quehacer institucional;\nII. Fortalecer la igualdad entre mujeres y hombres, la no discriminación y la inclusión en el Centro de Conciliación Laboral;\nIII. Consolidar una cultura laboral y organizacional de igualdad de oportunidades, sin violencia y libre de discriminación al interior del Centro de Conciliación Laboral;\nIV. Planificar, verificar y dar seguimiento a la introducción de la perspectiva y transversalidad de género en la planeación, programación, ejecución y evaluación de programas, proyectos, acciones y políticas públicas al interior del Centro de Conciliación Laboral;\nV. Organizar y coordinar la capacitación, formación y en su caso, certificación del personal en materia de género, transversalidad e igualdad sustantiva entre mujeres y hombres;\nVI. Asegurar que la prestación de atención y servicios a la población se lleve a cabo con perspectiva de género, sin violencia y sin discriminación;\ntransversalidad de género entre mujeres y hombres;\nVIII. Difundir información referente al proceso y resultados de la incorporación y en las políticas públicas del Centro de Conciliación Laboral;\nIX. Diseñar un Programa Anual de Trabajo que contemple una agenda institucional para incorporar la perspectiva de género;\nX. Participar en los procesos de planeación, programación y presupuesto del Centro de Conciliación Laboral; con el propósito de proponer las medidas que permitan la incorporación de la perspectiva de género;\nXI. Planear, ejecutar y evaluar acciones enfocadas a disminuir las brechas\nLaboral; y\nXII. Las demás que le confieran expresamente las disposiciones legales y reglamentarias aplicables, así como las que confiera la o el Director\nGeneral del Centro de Conciliación Laboral.\nCAPÍTULO IX\nDE LAS CONDICIONES DE TRABAJO\nArtículo 28.- Todo lo relativo a las condiciones de trabajo se realizará con apego a lo establecido en el Ley General de Responsabilidades Administrativas, la Ley de los Trabajadores al Servicio del Gobierno del Estado de Campeche, las Condiciones\nGenerales de Trabajo del Poder Ejecutivo del Estado, el Código de Ética de las y los Servidores Públicos, de las Dependencias y Entidades de la Administración\nPública del Estado de Campeche, los Manuales de Organización, y de\nProcedimientos, y el presente Reglamento.\nArtículo 29.- El registro de asistencias se llevará a cabo por los medios que establezca el “CENCOLAB”.\nCAPÍTULO X\nDE LA SUPLENCIA DE LOS TITULARES\nArtículo 30.- La o el Director General será suplido en sus ausencias temporales no mayores de quince días, por la o el servidor público subalterno que para tal efecto\nCoordinador de Sector; si la ausencia excede de este término, la o el Director público que la cubrirá.\nEn caso de que la ausencia se convierta, en definitiva, corresponderá a la o el\nGobernador del Estado designar a la o al servidor público que, con carácter de\nEncargada o Encargado de Despacho, la o lo sustituya entretanto se nombra una o un nuevo titular del CENCOLAB, en términos de lo dispuesto por el artículo 76 Ter\nArtículo 31.- Las ausencias temporales o accidentales no mayores a los quince días naturales de las y los Subdirectores, Coordinadores y Jefes de Departamento, serán suplidos por la o el servidor público subalterno que ellos designen, con el consentimiento de la o el Director General. En caso de ausencias mayores o definitivas, será suplido por la persona que designe la o el Director General con la aprobación de la Junta de Gobierno.\nCAPÍTULO XI\nINTERPRETACIÓN\nArtículo 32.- En los casos no previstos en este Reglamento y en caso de presentarse alguna controversia sobre su interpretación y/o aplicación de su contenido, la o el Director General resolverá lo conducente.\nTRANSITORIOS\nPrimero.- El presente Reglamento entrará en vigor al día siguiente de su publicación en el Periódico Oficial del Estado.\nSegundo.- Lo relativo a los Municipios de Dzitbalché y Seybaplaya, señalados en el artículo 4 del presente Reglamento, se encontrará a lo dispuesto en los Decretos vigor queda sujeto a éstos.\nDado en la ciudad de San Francisco de Campeche, Municipio y Estado de\nCampeche, a los 15 días del mes de octubre del año dos mil veinte.\nMtra. Laura Luna García\nSecretaria de Trabajo y Previsión Social y\nPresidenta de la Junta de Gobierno del CENCOLAB.\nLic. Pedro Armentía López. Mtra. Lidia Carrillo Díaz.\nC.P. Guadalupe Cárdenas Montero. Lic. Ricardo Augusto Ocampo\nSecretaria de Finanzas Fernández.\nSecretario de Desarrollo\nEconómico",
  "ordenamiento": "REGLAMENTO",
  "jurisdiccion": "CAMPECHE",
  "fuente_oficial": "DIARIO OFICIAL DE LA FEDERACION",
  "Fecha de Publicación": "6 de abril de 2020",
  "es_escaneado": false,
  "tiene_tablas": false,
  "materia": [
    "laboral",
    "municipal"
  ]
}