{
  "titulo": "Reglamento INTERIOR DE LA CONSEJERÍA JURÍDICA DE LA ADMINISTRACIÓN PÚBLICA DEL ESTADO DE CAMPECHE",
  "Contenido": "LIC. RAFAEL ALEJANDRO MORENO CÁRDENAS, Gobernador del Estado de\nCampeche, en ejercicio de la facultad que me confiere el artículo 71, fracción XIX, de la artículo 73 de la propia Constitución; y 3, 8, 10, 12, 14, 15, 16, fracción XX y 40 de la Ley\nOrgánica de la Administración Pública del Estado de Campeche; y,\nCONSIDERANDO:\nque para el despacho de los asuntos que correspondan al Ejecutivo del Estado existirán las Secretarías de los ramos de Administración Pública y el número de Dependencias que establezca la Ley Orgánica relativa, misma que distribuirá las funciones que a cada una deba corresponder y señalará los requisitos que el Gobernador observará para nombrar a los titulares de las mismas.\nQue en la fracción XX del artículo 16 de la Ley Orgánica de la Administración Pública del\nEstado de Campeche en vigor, se consideró a la Consejería Jurídica como una\nDependencia de la Administración Pública Centralizada, estableciéndose sus atribuciones en el artículo 40 de la citada Ley.\nQue el Reglamento Interior de la Consejería Jurídica de la Administración Pública del\nEstado de Campeche, vigente, fue publicado en el Periódico Oficial del Estado el día 12 de septiembre de 2016.\nQue ante la importancia de la lucha de las mujeres para poder participar en la vida pública, mujeres son parte inalienable e indivisible de los derechos humanos universales, resulta contribuyendo, mediante acciones afirmativas, en el proceso de democratización de nuestro sistema político, a través de nuestra legislación.\nQue de acuerdo con el Consejo Nacional para Prevenir la Discriminación (CONAPRED), “El lenguaje es una expresión de nuestro pensamiento, un reflejo de los usos y costumbres de una sociedad y cultura determinadas. Durante mucho tiempo, el lenguaje ha sido fuente de violencia simbólica, una herramienta más a través de la cual se ha mujeres y hombres, las cuales tienen su origen en los roles y estereotipos de género que limitan y encasillan a las personas partiendo de sus diferencias sexuales y biológicas”.\nQue el lenguaje, y su estrecha relación con nuestro pensamiento, permite que por medio de él se nombre e interprete la realidad en la que vivimos, por lo que éste debe evolucionar de acuerdo a los avances que experimenta la humanidad.\nQue, en ese sentido, la transformación del lenguaje hacia uno más inclusivo representa un cambio que, aunque no parezca, es trascendental para la eliminación de la discriminación basada en el sexo o género; puesto que el lenguaje jurídico, particularmente, enmarca una gran variedad de expresiones que constituyen funciones directivas enfocadas exclusivamente al género masculino, las cuales a partir de “pequeñas correcciones” coadyuvan a la construcción de una realidad más incluyente.\nQue en concordancia con el Plan Estatal de Desarrollo 2015-2021, que contempla dentro de sus ejes de política pública el Eje Transversal Perspectiva de Género, el cual establece en su objetivo específico 6.6.1 “Lograr que las acciones del gobierno contribuyan a la igualdad de género entre mujeres y hombres”, se propone esta nueva versión del\nReglamento Interior de la Consejería Jurídica; asimismo, conforme a lo establecido en la línea de acción 6.6.1.2.5., que plantea textualmente “Aumentar la cantidad de mujeres en los niveles de mandos medios y superiores”, esta Consejería contribuye sustancialmente mediante el uso de lenguaje incluyente.\nQue con el objetivo de mejorar la competencia laboral e impulsar el desarrollo humano y profesional de las servidoras públicas y los servidores públicos de la Consejería Jurídica, se confieren facultades a la coordinación de planeación y apoyo técnico para proponer, diseñar, desarrollar, implementar y coordinar las estrategias o programas para impartir y recibir capacitación sobre los temas de interés que se requieran, respectivamente; misma que ahora tendrá la denominación de Coordinación de Planeación, Capacitación y Apoyo\nTécnico.\nQue en atención a todo lo señalado con anterioridad, este nuevo reglamento reconoce que sirva como señal política concreta dentro de nuestra concepción del mundo.\nQue en base al fundamento anterior tengo a bien expedir el siguiente:\nCapítulo I\nDe la Competencia y Organización\nArtículo 1.- La Consejería Jurídica es la Dependencia de la Administración Pública\nEstatal Centralizada que tiene a su cargo la función prevista en el artículo 76 de la asesoría y apoyo técnico-jurídico al Gobernador del Estado, así como las demás atribuciones que le confiere el artículo 40 de la Ley Orgánica de la Administración Pública del Estado de Campeche y los demás ordenamientos jurídicos aplicables.\nCorresponde igualmente a la Consejería, coordinar los programas de normatividad jurídica de la Administración Pública Estatal que apruebe el Gobernador y procurar la congruencia de los criterios jurídicos entre Dependencias.\nArtículo 2.- Para efectos del presente Reglamento se entenderá por:\nI. Consejería: a la Consejería Jurídica de la Administración Pública del Estado de\nCampeche;\nII. Consejera o Consejero: A la o el titular de la Consejería Jurídica de la\nAdministración Pública Estatal;\nIII. Criterio Jurídico: a la regla, opinión o interpretación emitida por la Consejería\nJurídica de la Administración Pública del Estado que sirve de base para establecer un juicio o tomar una determinación en materia jurídica;\nIV. Dependencias: a las Secretarías de la Administración Pública Estatal señaladas en el artículo 16 de la Ley Orgánica de la Administración Pública del Estado de\nCampeche:\nV. Entidades: a los Organismos Descentralizados, Empresas de Participación\nParaestatal, señalados en el artículo 48 de la Ley Orgánica de la Administración\nPública del Estado; y\nVI. Visado: a la validación o visto bueno de la Consejería Jurídica de la\nAdministración Pública Estatal que se hace constar en los documentos.\nArtículo 3.- Al frente de la Consejería estará la Consejera o Consejero, quien tendrá\nCampeche, en términos del artículo 10 de la Ley Orgánica de la Administración Pública del Estado de Campeche.\nLa Consejera o el Consejero dependerá en forma directa de la o el Gobernador, quien que se deberá integrar.\nArtículo 4.- Para el estudio, planeación y despacho de los asuntos de su competencia, la Consejera o Consejero tendrá apoyo de las unidades administrativas siguientes:\nI. La Oficina de la Consejera o Consejero;\nII. La Oficina de la Consejera o Consejero Jurídico Adjunto;\nIII. La Dirección de Estudios Legislativos;\nIV. La Dirección de Estudios Jurídicos;\nV. La Dirección de Servicios Legales;\nVI. La Dirección de Coordinación de Archivos e Igualdad de Género;\nVII. La Coordinación de Administración;\nVIII. La Coordinación de Planeación, Capacitación y Apoyo Técnico;\nIX. La Secretaría Particular y de Comunicación Social; y,\nX. La Unidad de Transparencia.\nArtículo 5.- Las unidades de la Consejería señaladas en el artículo 4 que antecede quedan adscritas, para efectos administrativos, de la siguiente forma:\nA. En la Oficina de la Consejera o Consejero:\nI. La Secretaría Particular y de Comunicación Social;\nII. La Coordinación de Administración; y,\nIII. La Unidad de Transparencia.\nB. En la Oficina de la Consejera o Consejero Jurídico Adjunto:\nI. La Dirección de Estudios Legislativos;\nII. La Dirección de Estudios Jurídicos;\nIII. La Dirección de Servicios Legales;\nIV. La Dirección de Coordinación de Archivos e Igualdad de Género; y,\nV. La Coordinación de Planeación, Capacitación y Apoyo Técnico.\nArtículo 6.- La Consejería contará con las unidades subalternas y demás personal que\nEstructuras, en los que se establecerán cuáles serán sus atribuciones. El personal\nConsejera o Consejero, a la Consejera o Consejero Jurídico Adjunto, y a las Direcciones y Coordinaciones, recibirá la denominación de Consultora o Consultor Jurídico.\nArtículo 7.- La Consejería contará con un Órgano Interno de Control, cuyo titular y demás personal estará adscrito presupuestal y orgánicamente a la Secretaría de la Contraloría, del Estado de Campeche y la Ley General de Responsabilidades Administrativas.\nArtículo 8.- Las y los servidores públicos, así como las unidades administrativas de la\nÓrgano Interno de Control, la Secretaría Particular y de Comunicación Social y la Unidad de Transparencia para el desempeño de sus funciones.\nArtículo 9.- Toda iniciativa de ley, proyecto de reglamento, acuerdo, protocolo, lineamiento, convenio, contrato o cualquier otro instrumento jurídico que se remita a la\nConsejería, para su revisión y posterior visado por parte de la Dependencia, deberá cumplir con los Lineamientos de la Comisión de Estudios Jurídicos del Poder Ejecutivo del Estado de Campeche.\nLo anterior, para efectos de incluir todas las formalidades mínimas que se requieren para la revisión y visado de la Consejería Jurídica, en términos de los Lineamientos respectivos\nCapítulo II\nEstatal\nArtículo 10.- Corresponde originalmente a la Consejera o Consejero la representación de la Consejería, el visado de los documentos, así como el trámite y resolución de los asuntos de la competencia de ésta, y el ejercicio de las facultades que las disposiciones legales, reglamentarias y administrativas de carácter general le confieren.\njurídico.\nArtículo 11.- La Consejera o Consejero podrá delegar en las y los servidores públicos subalternos, aquellas facultades que estime pertinentes mediante escrito de delegación.\nConsejero cuando éste así lo estime pertinente.\nArtículo 12.- La Consejera o Consejero tendrá las facultades siguientes:\nI. Establecer, dirigir y controlar las políticas de la Consejería, así como planear, propios de su competencia, en términos de la legislación aplicable;\nII. Someter al acuerdo de la o el Gobernador los asuntos encomendados a la\nConsejería; asimismo, desempeñar las comisiones y funciones que le confiera, informando sobre el desarrollo de las mismas;\nIII. Proporcionar asistencia jurídica a la o el Gobernador del Estado en los actos propios de su investidura que así lo requieran y a las Dependencias centralizadas de la Administración Pública estatal; salvo los asuntos e instrumentos jurídicos cuyo objeto sea la contratación de personal, prestación de servicios distintos de la materia jurídica, asuntos laborales, de seguridad social, fiscales, contables, expropiaciones y de bienes propiedad del Estado;\nIV. Revisar y, en su caso, visar los instrumentos jurídicos relativos a la\nAdministración Pública o en los que se hagan constar actos jurídicos que celebre el Estado, ya sea que lo represente la o el Gobernador o la o el titular de una Secretaría de Estado, de conformidad con la Ley Orgánica de la\nAdministración Pública Estatal y que resulten de la competencia de la\nConsejería;\nV. Emitir criterios jurídicos, realizar observaciones y recomendaciones sobre los correspondan a la o el Gobernador;\nVI. Proponer a la o el Gobernador los proyectos de iniciativas de leyes, así como de reglamentos y acuerdos, cuya formulación no sea exclusiva de alguna otra\nDependencia de la Administración Pública del Estado, conforme a lo dispuesto por la Ley Orgánica de la Administración Pública del Estado;\nVII. Colaborar, cuando así lo disponga la o el Gobernador, en la integración de los elaboración de propuestas de designación o, en su caso, ratificación de las y los servidores públicos que, de conformidad con las disposiciones aplicables, correspondan a la o el Gobernador;\nVIII. Representar a la o el Gobernador del Estado en los juicios de amparo, controversias constitucionales, acciones de inconstitucionalidad, o cualquier otro proceso de carácter constitucional, así como en todos aquellos procesos contenciosos y no contenciosos, del fuero común o del fuero federal, en los que el Ejecutivo Estatal intervenga con cualquier carácter;\nIX. Visar los decretos promulgatorios respecto de leyes o decretos aprobados por\nX. Expedir los Manuales de Organización, de Estructuras y de Procedimientos de la Consejería, y remitirlos para la aprobación de la Dependencia correspondiente;\nXI. Emitir las disposiciones o lineamientos a las que deberán sujetarse las\nDependencias y Entidades de la Administración Pública Estatal para la elaboración, revisión y trámite de los proyectos de leyes, acuerdos o decretos que deba ser sometidos a la revisión y posterior visado de la Consejería para ser remitidos al H. Congreso del Estado;\nXII. Emitir las disposiciones a las que deberán sujetarse las Dependencias y\nEntidades de la Administración Pública Estatal para la elaboración, revisión y trámite de proyectos de reglamentos, acuerdos, lineamientos, protocolos, convenios, contratos, resoluciones y demás instrumentos de carácter jurídico que deban ser sometidos a la revisión y posterior visado de la Consejería;\nXIII. Suscribir, en ejercicio de sus funciones, los convenios, contratos y demás actos jurídicos que la Consejería celebre con los Poderes Legislativo y Judicial, tanto en el nivel federal como local, con otras Dependencias o Entidades de la\nAdministración Pública Federal, con Organismos Constitucionales Autónomos y con Municipios del Estado, así como con otras personas de derecho público o privado;\nXIV. Aprobar el anteproyecto de presupuesto de egresos de la Consejería y sus programas internos de trabajo;\nXV. Proponer el nombramiento y remoción, aceptar la renuncia, asignar y cambiar de adscripción, y conceder licencia para separarse temporalmente de sus funciones a la Consejera o Consejero Jurídico Adjunto, a las Directoras y los\nDirectores, las Coordinadoras y los Coordinadores, la o el titular de la unidad administrativa, Consultores Jurídicos y demás personal de la Consejería, de conformidad con el artículo 23 de la Ley Orgánica de la Administración Pública del Estado;\nXVI. Establecer la organización interna de la Consejería, adscribir orgánicamente la asesoría jurídica que requiera, independientemente de su adscripción;\nXVII. Evaluar la viabilidad y, en su caso, autorizar las contrataciones en la prestación externos;\nXVIII. Presidir la Comisión de Armonización Legislativa, la Comisión de Estudios\nJurídicos, y la Comisión de Temas Constitucionales y Proyectos Especiales, funcionamiento;\nXIX. Resolver las dudas que se susciten con motivo de la interpretación o aplicación de este Reglamento, así como los casos no previstos en el mismo; y\nXX. Las demás que le atribuyan expresamente las disposiciones legales y reglamentarias o el Depositario del Poder Ejecutivo.\nCapítulo III\nDe las facultades de la Consejera o Consejero Jurídico Adjunto del Poder\nEjecutivo Estatal\nArtículo 13.- La Consejera o Consejero Jurídico Adjunto del Poder Ejecutivo Estatal, en lo sucesivo, la Consejera o Consejero Adjunto, tendrá las facultades siguientes:\nI. Ser el enlace entre la Consejera o Consejero y las Direcciones y Coordinaciones que para efectos administrativos le estén adscritas;\nII. Acordar con las y los titulares de las Direcciones que le estén adscritas e informar a la Consejera o Consejero sobre el particular;\nIII. Vigilar, en auxilio de la Consejera o Consejero, que los titulares de las direcciones, coordinaciones, unidades y demás personal de la Consejería den cabal cumplimiento a las obligaciones que el presente Reglamento les impone;\nIV. Ejercer las facultades señaladas en el artículo 12 de este Reglamento, en ausencia de la Consejera o Consejero;\nV. Participar en las Comisiones señaladas en el capítulo VIII de este reglamento, en los términos de la normatividad respectiva;\nVI. Desempeñar las comisiones que la Consejera o Consejero le asigne; y,\nVII. Las demás que le atribuya específicamente la Consejera o Consejero.\nLa Consejera o Consejero Adjunto, tendrá rango de Subsecretaria o Subsecretario de la Administración Pública Estatal.\nCapítulo IV\nArtículo 14.- Las y los titulares de las Direcciones y Coordinaciones tendrán las siguientes atribuciones genéricas:\nI. Planear, coordinar, controlar y evaluar el funcionamiento de la Dirección o\nConsejero y, en su caso, a la Consejera o Consejero Adjunto;\nII. Preparar y someter a la consideración de la Consejera o Consejero, los estudios, opiniones, dictámenes o proyectos de instrumentos que correspondan a la competencia de la Dirección a su cargo, o los que deban remitirse a la firma\nIII. Establecer la coordinación que sea necesaria con las Dependencias y\nEntidades de la Administración Pública Estatal para el trámite y resolución de los asuntos que requieran la intervención de la Consejería;\nIV. Suscribir los documentos relativos al ejercicio de las facultades que les correspondan conforme a este Reglamento, por delegación de facultades o por suplencia;\nV. Coordinarse entre sí para la atención de programas de trabajo, la preparación de estrategias y el adecuado desempeño de las facultades que las Direcciones a su cargo tienen encomendadas, a fin de contribuir al mejor despacho de los asuntos que son competencia de la Consejería;\nVI. Participar en la elaboración y actualización de los Manuales de Organización de\nEstructuras y de Procedimientos de la Consejería;\nVII. Examinar y evaluar el desempeño de carácter administrativo de la Dirección a su cargo y, en su caso, proponer a su superior jerárquico los proyectos y\nConsejería;\nVIII. Expedir, cuando proceda, certificaciones de los documentos que obren en los\nConsejero y de la Consejera o Consejero Adjunto;\nIX. Desempeñar comisiones o representaciones oficiales de la Consejería, en términos de las instrucciones de la Consejera o Consejero;\nX. Establecer comunicación con miembros o autoridades de los otros poderes\nConsejería;\nXI. Delegar, previa anuencia de la Consejera o Consejero, el ejercicio de sus respectivas Direcciones;\nXII. Acordar los asuntos que sometan a su consideración las y los servidores públicos asignados a la Dirección a su cargo; y\nXIII. Las demás que deriven de los instructivos, órdenes o circulares que expida la\nConsejera o Consejero o, en su caso, las que indique la Consejera o Consejero\nAdjunto.\nCapítulo V\nDe las Facultades específicas de las Direcciones y Coordinaciones\nArtículo 15.- La Dirección de Estudios Legislativos, por conducto de su titular y personal que le esté adscrito, tiene las facultades siguientes:\nI. Formular y revisar los anteproyectos de iniciativas de leyes que la o el\nGobernador pretenda presentar al H. Congreso del Estado;\nII. Formular y revisar los proyectos de acuerdos, reglamentos, lineamientos, protocolos, órdenes, circulares y demás ordenamientos jurídicos que sean competencia de la Administración Pública Estatal, para someterlos a la aprobación de la Consejera o Consejero;\nIII. Analizar y proponer a la Consejera o Consejero, en su caso, dentro del término de ley, observaciones de carácter constitucional respecto de leyes o decretos para su sanción, promulgación y posterior publicación;\nIV. Proponer a la Consejera o Consejero la necesidad de actualizar, armonizar y simplificar el marco normativo jurídico del Estado;\nV. Dar seguimiento y coordinar las actividades relacionadas con la elaboración, emitir la Consejera o Consejero;\nVI. Resolver consultas jurídicas y brindar la asesoría que soliciten las\nDependencias de la Administración Pública Estatal, respecto a la elaboración de anteproyectos de leyes, reglamentos y acuerdos que reforman, adicionan o derogan disposiciones jurídicas, previo pronunciamiento jurídico que envíe la\nDependencia o Entidad solicitante;\nVII. Dar seguimiento a la modificación de la legislación estatal con el propósito de proponer la expedición o modificación de disposiciones reglamentarias, por parte de las Dependencias o Entidades;\nVIII. Proponer a la Consejera o el Consejero los criterios de interpretación de las\nAdministración Pública del Estado, cuando esta facultad no esté conferida a otra Dependencia;\nIX. Coordinar la Comisión de Armonización Legislativa del Poder Ejecutivo Estatal, en los términos que establezcan los lineamientos respectivos; y\nX. Las demás que le atribuya específicamente la Consejera o Consejero, por sí o a través de la Consejera o Consejero Adjunto.\nArtículo 16.- La Dirección de Estudios Jurídicos, por conducto de su titular y personal que le esté adscrito, tiene las facultades siguientes:\nI. Ser enlace entre la Consejería y las unidades de apoyo jurídico de las\nDependencias y Entidades de la Administración Pública Estatal;\nII. Coordinar las actividades de la Comisión de Estudios Jurídicos del Poder\nEjecutivo Estatal conforme a los lineamientos respectivos;\nIII. Llevar a cabo los estudios jurídicos necesarios para elaborar el proyecto de opinión que la Consejera o Consejero emita respecto de las consultas que le formulen las Dependencias y Entidades de la Administración Pública Estatal;\nIV. Elaborar el proyecto de opinión que deberá emitir la Consejera o Consejero respecto de los proyectos de convenios, contratos y acuerdos de coordinación, de colaboración o de concertación que, en representación del Estado de\nCampeche, pretendan celebrar la o el Gobernador, o las y los titulares de las\nDependencias y Entidades de la Administración Pública Estatal, con la\nFederación, otras Entidades Federativas, los Municipios del propio Estado u otras personas de derecho público o privado, previo análisis y revisión de los mismos, así como proponer su visado;\nV. Elaborar el proyecto de criterio jurídico que deberá validar la Consejera o corresponda emitir a la o el Gobernador, previo análisis y revisión de los mismos, así como proponer su visado a la Consejera o Consejero;\nVI. Elaborar el proyecto de criterio jurídico que deberá validar la Consejera o\nConsejero respecto de los dictámenes en materia de explosivos, caza, pesca, tiro y demás dictámenes que corresponda emitir a la o el Gobernador, previo análisis y revisión de los mismos, así como proponer su visado a la Consejera o Consejero;\nVII. Elaborar el proyecto de criterio jurídico que deberá emitir la Consejera o\nConsejero respecto de proyectos de acuerdos notariales, previo análisis y revisión de los mismos, así como proponer su visado;\nVIII. Preparar y someter a la consideración de la Consejera o Consejero los proyectos de interpretación y homologación de criterios jurídicos que permitan la adecuada protección de los intereses generales y del patrimonio del Estado;\nIX. Convocar, coordinar y supervisar reuniones de trabajo con las diferentes áreas jurídicas de las Dependencias y Entidades, a efecto de recoger las principales inquietudes en materia jurídica y proponer la solución a las mismas;\nX. Dar seguimiento y supervisar la correcta aplicación de las interpretaciones que la Consejería emita en materia jurídica;\nXI. Coadyuvar en la capacitación del personal de las áreas jurídicas de las\nDependencias y Entidades, con la finalidad de que se aplique la normatividad en materia de contratos y convenios; y\nXII. Las demás que le atribuya específicamente la Consejera o Consejero, por sí o a través de la Consejera o Consejero Adjunto.\nArtículo 17.- La Dirección de Servicios Legales, por conducto de su titular y personal que le esté adscrito, tiene las facultades siguientes:\nI. Elaborar los proyectos de demanda, contestación de demanda, reconvención, ofrecimiento de pruebas, alegatos y de interposición de recursos, así como otras promociones que sean necesarias, en los procedimientos contenciosos y no contenciosos, de carácter federal o estatal, incluidas las controversias constitucionales, las acciones de inconstitucionalidad y los juicios de amparo, en las que el Estado, la o el Gobernador intervengan con cualquier carácter; y someterlos a la aprobación de la Consejera o Consejero;\nII. Elaborar los proyectos de informes previo y justificado en los juicios de amparo en los que la o el Gobernador, la Consejería, la Consejera o Consejero aparezcan como autoridad responsable o tercero perjudicado, y someterlos a la aprobación de la Consejera o Consejero;\nIII. Fungir como delegado de la o el Gobernador, de la Consejera o Consejero en los juicios de amparo, controversias constitucionales y acciones de inconstitucionalidad;\nIV. Llevar a cabo las visitas especiales que ordene la Consejera o Consejero, en el ejercicio de sus atribuciones;\nV. Requerir a las Dependencias y Entidades de la Administración Pública Estatal, los informes, dictámenes, documentación, objetos, apoyo técnico y demás elementos necesarios para la defensa de los intereses del Estado;\nVI. Elaborar los proyectos de querellas y/o denuncias por delitos cometidos en conformidad con la fracción I del artículo 40 de la Ley Orgánica de la\nAdministración Pública del Estado, y someterlos a la consideración de la\nConsejera o Consejero;\nVII. Proponer a la Consejera o el Consejero la celebración de convenios con instituciones educativas para allegarse de prestadores de servicio social de las carreras técnicas y profesionales que correspondan a las actividades de la\nConsejería, así como para apoyos en capacitación y proyectos afines a la misma;\nVIII. Llevar a cabo los estudios y análisis jurídicos de la problemática de origen que incide en los juicios en los que participa la Consejería y proponer a la Consejera o Consejero los mecanismos de solución correspondientes; y\nIX. Las demás que le atribuya específicamente la Consejera o Consejero, por sí o a través de la Consejera Adjunta o Consejero Adjunto.\nArtículo 18.- La Dirección de Coordinación de Archivos e Igualdad de Género, por conducto de su titular y personal que le esté adscrito, tendrá las facultades siguientes:\nI. Elaborar e implementar criterios internos, procedimientos técnicos y prácticas destinadas para administrar el flujo de documentos de archivo de la Consejería, que permitan la organización, registro, clasificación, uso, seguimiento y conservación, de conformidad con lo establecido en las disposiciones normativas aplicables;\nII. Coordinar las acciones necesarias para garantizar que los responsables de los archivos de trámite, de concentración y, en su caso, histórico, cumplan con los ordenamientos jurídicos aplicables;\nIII. Coordinar con el área de tecnologías de la información, previa autorización de su superior jerárquico, las actividades destinadas a la automatización de los archivos y de documentos electrónicos, así como coordinar los procedimientos aplicable;\nIV. Presidir el Comité de Transparencia de la Consejería y presidir la Unidad de\nIgualdad de Género, conforme a la normatividad aplicable;\nV. Coadyuvar con la Dirección de Estudios Legislativos en la elaboración y revisión de iniciativas y reformas de Ley relacionadas con los temas de transparencia, archivos, simplificación administrativa, modernización gubernamental, mejora regulatoria, igualdad de género, y los demás que le indique su superior jerárquico.\nVI. Proponer el diseño y desarrollo de estrategias para promover la generación de ambientes laborales libres de violencia y discriminación en la Consejería, en colaboración con las unidades administrativas, así como proponer y coadyuvar en la instrumentación de políticas de intercambios académicos, estrategias de capacitación, divulgación, supervisión y evaluación en materia de Igualdad de\nGénero;\nVII. Dar seguimiento al cumplimiento de las obligaciones de incorporación de la\nIgualdad de Género en todos los instrumentos jurídicos que sean competencia del Poder Ejecutivo del Estado;\nVIII. Ser el enlace y representante de la Consejería ante las Dependencias, Entidades, organismos y órganos relacionados con los temas de transparencia, archivos, simplificación administrativa, modernización gubernamental, mejora regulatoria, igualdad de género, y los demás que designe la Consejera o\nConsejero;\nIX. Facilitar la transversalización de la perspectiva de género en todas las áreas de la Consejería Jurídica;\nX. Apoyar, coordinar y, en su caso, evaluar las acciones que le darán seguimiento a los procesos de acreditación y certificación en materia de igualdad de género y equidad de género;\nXI. Generar estrategias de trabajo que garanticen la permanencia de un ambiente laboral libre de hostigamiento, discriminación y violencia, con igualdad de oportunidades y trato para mujeres y hombres; así como la creación de comités, mesas y grupos de trabajo necesarios para tales fines;\nXII. Dar respuesta efectiva a las necesidades de género que surjan con respecto al en la Consejería;\nXIII. Desarrollar y dar capacitación en temas de género para lograr la participación y sensibilización activa de todo el personal de la Consejería, en conjunto;\nXIV. Las demás que le atribuya específicamente la Consejera o Consejero, por sí o a través de la Consejera o Consejero Adjunto.\nArtículo 19.- La Coordinación de Administración, por conducto de su titular y personal que le esté adscrito, tiene las facultades siguientes:\nI. Determinar las políticas, normas y procedimientos internos para la eficiente\nAdministración de los recursos humanos, materiales y financieros de la\nConsejería;\nII. Cumplir las disposiciones legales y reglamentarias, así como la normatividad en materia administrativa que emitan las Secretarías de Finanzas, de la\nContraloría y de Administración e Innovación Gubernamental, en materia de presupuesto, contabilidad, gasto público, obra Pública, adquisiciones, arrendamientos, servicios y en materia de recursos humanos;\nIII. Aplicar, dar seguimiento, controlar y evaluar el ejercicio del presupuesto de egresos de la Consejería;\nIV. Establecer y administrar los servicios de apoyo en materia de programación, presupuestación, informática y telecomunicaciones, recursos humanos y materiales, contabilidad, archivos y los demás que sean necesarios para el cumplimiento de los objetivos de la Consejería;\nV. Someter a la consideración de la Consejera o Consejero los asuntos a su cargo, así como elaborar y rendir los informes que le sean solicitados;\nVI. Suscribir los documentos relacionados con el ejercicio de sus atribuciones;\nVII. Tramitar ante la Secretaría de Administración e Innovación Gubernamental todo lo relativo a nombramientos, remociones, licencias, incapacidades, renuncias, estímulos y recompensas, pensiones y jubilaciones de las y los servidores públicos de la Consejería;\nVIII. Dirigir y coordinar los procesos de elaboración de los Manuales de\nOrganización, de Estructuras y de Procedimientos de la Consejería y someterlos a la consideración y aprobación de la Consejera o Consejero;\nIX. Elaborar y tramitar ante la Dependencia correspondiente las solicitudes de mantenimientos de bienes muebles e inmuebles;\nX. Elaborar, en coordinación con las demás unidades administrativas de la\nConsejería, el proyecto de presupuesto anual de la Dependencia y someterlo a la consideración y aprobación de la Consejera o Consejero;\nXI. Establecer, operar y evaluar el programa interno de protección civil; y,\nXII. Las demás que le atribuya específicamente la Consejera o Consejero.\nArtículo 20.- La Coordinación de Planeación, Capacitación y Apoyo Técnico, por conducto de su titular y personal que le esté adscrito, auxiliará a la Consejera o Consejero\nAdjunto, conforme a las facultades siguientes:\nI. Proporcionar la orientación, asesoría técnica y apoyo logístico en actividades las unidades administrativas adscritas a la Consejería Jurídica Adjunta;\nII. Coordinarse con la Consejera o Consejero Adjunto, las Directoras y los\nDirectores para la asesoría técnica y el apoyo logístico que requieran;\nIII. Administrar y operar el sistema de trámite de los instrumentos jurídicos que permita el control de su entrada, procedimiento y salida, así como supervisar los sistemas de seguimiento de asuntos turnados a las unidades administrativas de la Consejería;\nIV. Llevar la estadística general de los asuntos atendidos por la Consejería, sin perjuicio de las que realicen, específicamente, por tipo de asunto, cada una de las demás unidades administrativas de la Dependencia;\nV. Establecer y operar los procedimientos para la ejecución de las acciones de planeación, dirección y control que requieran las unidades administrativas de la Consejería;\nVI. Coordinar la planeación, gestión y logística de las Comisiones de Estudios\nJurídicos, de Armonización Legislativa, y de Temas Constitucionales y\nProyectos Especiales;\nVII. Proponer estrategias de capacitación para el personal de la Consejería;\nVIII. Diseñar, elaborar y coordinar los programas de capacitación que requiera o vaya a impartir la Consejería;\nIX. Preparar el material que se requiera para impartir o recibir capacitación;\nX. Establecer vínculos de coordinación y capacitación con entidades gubernamentales y privadas;\nXI. Ser el enlace de la Consejería con los poderes\nLegislativo y Judicial, y los organismos constitucionales autónomos, en los asuntos que expresamente le indique la Consejera o Consejero Adjunto;\nXII. Coordinarse con las Dependencias y Entidades de la Administración Pública, tanto federal como estatal, y de otras Entidades federativas, para el trámite y desahogo de asuntos que le encomiende la Consejera o Consejero Adjunto;\ny,\nXIII. Las demás que le atribuya específicamente la Consejera o Consejero\nAdjunto.\nArtículo 21.- La Secretaría Particular y de Comunicación Social, por conducto de su titular y personal que le esté adscrito, tiene las facultades siguientes:\nI. Apoyar directamente a las funciones de la Consejera o Consejero, a través de la asistencia en asuntos oficiales y actividades Públicas;\nII. Acordar la agenda de la Consejera o Consejero;\nIII. Acompañar, ayudar y asistir a la Consejera o Consejero en reuniones o en cualquier otra actividad que disponga;\nIV. Apoyar a la Consejera o Consejero en la atención y control de los asuntos que le encomiende;\nV. Recibir y despachar la correspondencia a las áreas competentes, de los asuntos recibidos en la Oficina de la Consejera o Consejero, para su debida gestión;\nVI. Dar seguimiento a los acuerdos tomados en las reuniones de trabajo de la\nConsejera o Consejero;\nVII. Supervisar el cumplimiento de las disposiciones emitidas en asuntos atendidos directamente por la Consejera o Consejero, que por su importancia requieran de atención urgente y extraordinaria;\nVIII. Formular el informe mensual de los asuntos recibidos, despachados y pendientes, así como el avance en la atención y resolución de los asuntos de su competencia;\nIX. Supervisar y coordinar las actividades del personal adscrito a la Oficina de la\nConsejera o Consejero;\nX. Recepcionar y dar seguimiento a la correspondencia dirigida y emitida por la\nConsejera o Consejero, debiendo establecer los mecanismos que garanticen un manejo ágil, eficaz y controlado de la documentación de la Oficina de la\nConsejera o Consejero, así como realizar la clasificación correspondiente;\nXI. Realizar el monitoreo de los medios de comunicación respecto a las actividades del Poder Ejecutivo del Estado;\nXII. Elaborar, autorizar y difundir las síntesis informativas;\nXIII. Coordinar y atender las relaciones Públicas de la Consejería con los medios de comunicación;\nXIV. Difundir los criterios de aplicación de normas que emita la Consejería;\nXV. Conservar y actualizar el archivo de comunicados, fotografía y de video de las actividades relevantes de la Consejería;\nXVI. Informar a la Consejera o Consejero de los asuntos de su interés que se generen en los medios de comunicación; y\nXVII. Las demás que le atribuya específicamente la Consejera o Consejero.\nCapítulo VII\nDe la Unidad de Transparencia\nArtículo 22.- La Unidad de Transparencia tendrá las atribuciones que le confieran la Ley\nProtección de Datos Personales en Posesión de Sujetos Obligados, la Ley de\nCampeche, y la demás normatividad aplicable.\nArtículo 23.- La Unidad se integrará con un titular y el personal que se requiera y permita la previsión presupuestal de la Dependencia.\nCapítulo VIII\nDe la Comisiones\nArtículo 24.- La Comisión de Estudios Jurídicos del Poder Ejecutivo del Estado es un cuerpo colegiado de análisis, consulta, discusión, coordinación y elaboración de propuestas sobre temas jurídicos de trascendencia e interés para las Dependencias y\nEntidades de la Administración Pública Estatal, así como para uniformar los criterios de interpretación y aplicación del marco jurídico que rige a dichas Dependencias y\nEntidades.\nLa Comisión será presidida por la Consejera o Consejero y se integrará con la Consejera o Consejero Adjunto, las y los Directores de la Consejería, las y los titulares de las unidades de asuntos jurídicos de cada una de las Dependencias y Entidades de la\nAdministración Pública Estatal.\nfungirá la Consejera o Consejero Adjunto.\nanterior, sin perjuicio de que la Consejería Jurídica participe en la Comisión de\nPoderes del Estado, conforme al acuerdo de creación respectivo o en otras Comisiones\nLa Comisión será presidida por la Consejera o Consejero. Como Secretaria Técnica o\nConsejera o Consejero Adjunto.\nArtículo 26.- La Comisión de Temas Constitucionales y Proyectos Especiales del Poder\nEjecutivo del Estado es un cuerpo colegiado de análisis, consulta, discusión, coordinación, elaboración de documentos jurídicos y seguimiento de procedimientos sobre temas jurídicos de carácter constitucional y de derechos humanos, en especial, de amparos, acciones de inconstitucionalidad, controversias constitucionales, y cualquier otro procedimiento de carácter constitucional, en el que intervengan, con cualquier carácter, el Ejecutivo Estatal o las Dependencias y Entidades de la Administración\nPública Estatal.\nLa Comisión será presidida por la Consejera o Consejero y se integrará con la Consejera o Consejero Adjunto, así como las Directoras y los Directores de la Consejería.\nComo Secretaria o Secretario Técnico de la Comisión fungirá la Consejera o Consejero\nAdjunto y como Secretaria o Secretario de Actas fungirá la o el titular de la Dirección de\nServicios Legales.\nArtículo 27.- La Comisiones funcionarán en los términos que señalen los lineamientos que al efecto emita la Consejería.\nCapítulo IX\nDisposiciones Generales\nArtículo 28.- La Consejería, por conducto de las y los servidores públicos y de sus unidades administrativas, conducirá sus actividades en forma programada y con base en de la Dependencia.\nArtículo 29.- La Consejera o Consejero dispondrá la evaluación periódica de los avances en las metas y objetivos de los programas respectivos.\nArtículo 30.- El ingreso, desempeño, permanencia y evaluación de las y los servidores públicos de la Consejería se regirá por los principios que señala el artículo 6 de la Ley\nOrgánica de la Administración Pública del Estado de Campeche y los de confidencialidad, profesionalismo, probidad, excelencia y rotación, conforme a las indicaciones que para esos efectos emita la Consejera o Consejero en los términos de la legislación aplicable.\nCapítulo X\nDe las Suplencias\nArtículo 31.- En sus ausencias temporales y accidentales la Consejera o Consejero será suplido por la Consejera o Consejero Adjunto, y a falta de éste, por la Directora o el\nDirector que designe la Consejera o Consejero.\nEn caso de ausencia definitiva de la o el titular de la Dependencia fungirá como encargada o encargado del despacho la Consejera o el Consejero Adjunto, en tanto la o el\nGobernador emite el nombramiento del nuevo titular.\nArtículo 32.- En sus ausencias temporales y accidentales la Consejera Adjunta o el\nConsejero Adjunto será suplido por la Directora o el Director que designe la Consejera o el Consejero.\nArtículo 33.- En sus ausencias temporales y accidentales las y los titulares de las\nDirecciones y Coordinaciones, y demás titulares de las unidades administrativas de la\nConsejero, de entre los del nivel jerárquico inmediato inferior que de ellos dependan.\nArtículo 34.- Las y los servidores públicos de la Consejería en sus ausencias temporales quienes se encuentren adscritos a la misma unidad administrativa.\nTRANSITORIOS\nPrimero. - El presente Reglamento entrará en vigor al día siguiente de su publicación en el Periódico Oficial del Estado.\nSegundo. - Se abroga el Reglamento Interior de la Consejería Jurídica de la\nTercero. - Se derogan todas las disposiciones legales y reglamentarias de igual o menor jerarquía del marco jurídico estatal, en lo que se opongan al contenido del presente reglamento interior.\nde San Francisco de Campeche, Municipio y Estado de Campeche, a los veintinueve días del mes de noviembre del año dos mil dieciocho.\nLIC. RAFAEL ALEJANDRO MORENO CÁRDENAS\nGOBERNADOR DEL ESTADO DE CAMPECHE\nMTRA. LAURA LUNA GARCÍA\nCONSEJERA JURÍDICA",
  "ordenamiento": "REGLAMENTO",
  "jurisdiccion": "CAMPECHE",
  "fuente_oficial": "DIARIO OFICIAL DE LA FEDERACION",
  "Fecha de Publicación": "12 \nde septiembre de 2016",
  "es_escaneado": false,
  "tiene_tablas": true,
  "materia": [
    "administrativo",
    "municipal"
  ]
}