{
  "titulo": "Reglamento Interior de la Secretaría de Desarrollo Rural de la Administración Pública del Estado de",
  "Contenido": "ADMINISTRACIÓN PÚBLICA DEL ESTADO DE CAMPECHE.\nLIC. RAFAEL ALEJANDRO MORENO CÁRDENAS, Gobernador del Estado de Campeche, en ejercicio de la facultad que me confiere el artículo 71, fracción XIX, de la Constitución Política del Estado de Campeche y con fundamento en lo que disponen los artículos 73 de la propia\nConstitución; 3, 8, 10, 12, 16 fracción XII y 32 de la Ley Orgánica de la Administración Pública del Estado de Campeche, y:\nCONSIDERANDO:\nel despacho de los asuntos que correspondan al Ejecutivo del Estado existirán las Secretarías de los ramos de administración pública y el número de dependencias que establezca la Ley\nOrgánica relativa, misma que distribuirá las funciones que a cada una deba corresponder y señalará los requisitos que el Gobernador del Estado observará para nombrar a los Titulares de las mismas.\nQue con fundamento en el artículo antes señalado se publicó el día 11 de septiembre de 2015, en el Periódico Oficial del Estado, el Decreto número 290 que contiene reformas a la Ley\nOrgánica de la Administración Pública del Estado de Campeche, las cuales entraron en vigor el día 16 de septiembre de 2015 de conformidad con su Artículo Primero Transitorio.\nQue en la fracción XII del artículo 16 de la vigente Ley Orgánica de la Administración Pública del Estado de Campeche se consideró a la Secretaría de Desarrollo Rural como una dependencia de la administración pública centralizada, estableciéndose sus atribuciones en el artículo 32 de la citada Ley.\nQue con motivo de los cambios normativos y sociales que se han generado en nuestro Estado, los avances en la administración pública centralizada, la transformación estructural de la\nSecretaría de Desarrollo Rural, resulta necesario modificar las disposiciones reglamentarias de dicha Dependencia para estar en posibilidad de cumplir con las atribuciones que le establece la\nLey Orgánica antes citada y la nueva legislación imperante en la Entidad.\nQue con base al fundamento anterior tengo a bien expedir el siguiente:\nREGLAMENTO INTERIOR DE LA SECRETARÍA DE DESARROLLO RURAL DE LA\nADMINISTRACIÓN PÚBLICA DEL ESTADO DE CAMPECHE\nCAPÍTULO I\nDE LA COMPETENCIA Y ORGANIZACIÓN\nArtículo 1.- El presente Reglamento tiene por objeto definir las atribuciones y competencias de la Secretaría de Desarrollo Rural y de las Unidades Administrativas que la conforman.\nArtículo 2.- La Secretaría de Desarrollo Rural es una dependencia de la administración pública estatal centralizada que tiene a su cargo las funciones previstas en el artículo 32 de la Ley\nOrgánica de la Administración Pública del Estado de Campeche; así como las demás atribuciones que le confieren las leyes locales vigentes, los reglamentos, decretos, acuerdos, circulares y órdenes del Ejecutivo del Estado.\nArtículo 3.- Al frente de la Secretaría de Desarrollo Rural habrá un Secretario, titular de la misma, quien tendrá el rango de Secretario de la administración pública centralizada del Estado de Campeche, en términos de la Ley Orgánica de la Administración Pública del Estado de\nCampeche, quien para el desahogo de los asuntos de su competencia, se auxiliará de los servidores públicos y Unidades Administrativas siguientes:\nA. Unidades Administrativas:\nI. Oficina del Secretario;\nII. Subsecretaría de Fomento Agropecuario;\nIII. Subsecretaría de Sanidad e Inocuidad Agropecuaria;\nIV. Coordinación de Evaluación y Seguimiento;\nV. Coordinación Administrativa;\nVI. Coordinación del FOFAE;\nVII. Coordinación de Regiones de Desarrollo Rural;\nVIII. Dirección de Seguimiento de Compromisos de Gobierno;\nIX. Dirección de Cultivos Perennes;\nX. Dirección de Cultivos Anuales;\nXI. Dirección de Especies Menores;\nXII. Dirección de Especies Mayores;\nXIII. Dirección de Infraestructura Rural;\nXIV. Dirección de Recursos Financieros y Servicios;\nXV. Dirección de Sanidad e Inocuidad Vegetal;\nXVI. Dirección de Sanidad e Inocuidad Animal;\nXVII. Dirección Jurídica;\nXVIII. Dirección de Región de Desarrollo Rural 1, Calkiní\nXIX. Dirección de Región de Desarrollo Rural 2, Hecelchakán;\nXX. Dirección de Región de Desarrollo Rural 3, Campeche;\nXXI. Dirección de Región de Desarrollo Rural 4, Hopelchén;\nXXII. Dirección de Región de Desarrollo Rural 5, Champotón;\nXXIII. Dirección de Región de Desarrollo Rural 6, Carmen;\nXXIV. Dirección de Región de Desarrollo Rural 7, Escárcega;\nXXV. Dirección de Región de Desarrollo Rural 8, Calakmul;\nXXVI. Dirección de Región de Desarrollo Rural 9, Palizada; y\nXXVII. Dirección de Región de Desarrollo Rural 10, Candelaria.\nArtículo 4.- Las Unidades Administrativas de la Secretaría de Desarrollo Rural quedan adscritas de la siguiente forma:\nA. En la Oficina del Secretario:\nI. La Coordinación de Evaluación y Seguimiento;\nII. La Coordinación Administrativa;\nIII. La Coordinación del FOFAE;\nIV. La Dirección Jurídica; y\nV. La Dirección de Seguimiento de Compromisos de Gobierno.\nB. A la Subsecretaría de Fomento Agropecuario;\nI. La Dirección de Cultivos Perennes;\nII. La Dirección de Cultivos Anuales;\nIII. La Dirección de Especies Menores;\nIV. La Dirección de Especies Mayores; y\nV. Dirección de Infraestructura Rural.\nC. A la Subsecretaría de Sanidad e Inocuidad Agropecuaria:\nI. La Dirección de Sanidad e Inocuidad Vegetal; y\nII. La Dirección de Sanidad e Inocuidad Animal.\nD. A la Coordinación Administrativa:\nI. La Dirección de Recursos Financieros y Servicios.\nE. A la Coordinación de Regiones de Desarrollo Rural:\nI. Dirección de Región de Desarrollo Rural 1, Calkiní;\nII. Dirección de Región de Desarrollo Rural 2, Hecelchakán;\nIII. Dirección de Región de Desarrollo Rural 3, Campeche;\nIV. Dirección de Región de Desarrollo Rural 4, Hopelchén;\nV. Dirección de Región de Desarrollo Rural 5, Champotón;\nVI. Dirección de Región de Desarrollo Rural 6, Carmen;\nVII. Dirección de Región de Desarrollo Rural 7, Escárcega;\nVIII. Dirección de Región de Desarrollo Rural 8, Calakmul;\nIX. Dirección de Región de Desarrollo Rural 9, Palizada; y\nX. Dirección de Región de Desarrollo Rural 10, Candelaria.\nPara el mejor desempeño de sus actividades, la Oficina del Secretario contará con las siguientes unidades de apoyo: la Secretaría Ejecutiva, la Secretaría Técnica, la Unidad de\nTransparencia y el Enlace Institucional, las cuales tendrán la estructura administrativa que requieran y que se encuentre autorizada en el presupuesto de la Secretaría.\nArtículo 5.- Para el desempeño de sus actividades, la Secretaría de Desarrollo Rural contará también con las unidades subalternas que figuren en su presupuesto, cuyas funciones deberán especificarse y regularse en el manual de organización de la propia Secretaría.\nArtículo 6.- La Secretaría de Desarrollo Rural, a través de sus Unidades Administrativas planeará y conducirá sus actividades conforme a los objetivos, estrategias y programas establecidos en el marco jurídico que rige en el Estado, el Sistema Estatal de Planeación, el\nPlan Estatal de Desarrollo, así como las políticas y programas que determine el Gobernador del\nEstado.\nArtículo 7.- La Secretaría de Desarrollo Rural contará con un Órgano Interno de Control, cuyo titular y personal estará adscrito presupuestal y orgánicamente a la Secretaría de la Contraloría, y tendrá a su cargo el ejercicio de las facultades que le confiere la Ley Reglamentaria del señale el Reglamento Interior de la Secretaría de la Contraloría de la administración pública del\nEstado de Campeche.\nCAPÍTULO II\nDE LAS FACULTADES DEL SECRETARIO\nArtículo 8.- La representación de la Secretaría de Desarrollo Rural y las facultades que las de la distribución de competencias que disponen los ordenamientos legales, este Reglamento o por acuerdo del titular.\nEn todo caso, la delegación surtirá efectos sin perjuicio del ejercicio directo por el titular de la facultad respectiva, cuando éste lo considere conveniente.\nArtículo 9.- El Secretario tendrá las siguientes atribuciones indelegables:\nI. Representar al Gobernador del Estado cuando se requiera, en los asuntos de su competencia;\nII. Fijar, conducir y controlar la política interna de la Secretaría, en los términos de la legislación aplicable;\nIII. Someter al acuerdo del Gobernador del Estado, los asuntos relevantes encomendados a la Secretaría;\nIV. Atender las comisiones y funciones especiales que el Gobernador del Estado le confiera y mantenerlo informado sobre su desarrollo y ejecución;\nV. Establecer las comisiones, consejos, grupos de trabajo y comités internos que sean necesarios para el buen funcionamiento de la Secretaría, así como designar a los integrantes de los mismos;\nVI. Someter a consideración del Gobernador del Estado las modificaciones que sean conducentes respecto a la estructura orgánica de la dependencia;\nVII. Refrendar, para su validez y observancia constitucional, los reglamentos, decretos, acuerdos, órdenes y demás disposiciones de carácter administrativo relativas a su ramo;\nVIII. Promover y estimular mediante la operación o apoyo, en su caso, a los Subcomités\nSectoriales del Comité de Planeación para el Desarrollo del Estado de Campeche, así como elaborar y turnar a la Secretaría de Planeación los programas anuales y calendarios de trabajo correspondientes y efectuar, cuando menos, una reunión bimestral de los citados subcomités;\nIX. Ejercer las atribuciones que en materia de su competencia se deriven de los convenios que celebre el Gobierno del Estado con Instituciones Públicas y Privadas, dependencias Federales, Estatales y Municipales;\nX. Atender, mediante el proceso de programación y presupuestación, aquellas solicitudes comunitarias que, por disposición del Gobernador del Estado, adquieran carácter de compromiso gubernamental, además de darles el seguimiento adecuado para garantizar su cumplimiento;\nXI. Realizar, ante las dependencias y entidades de la administración pública federal, la gestión de recursos para fortalecer la capacidad ejecutora de las entidades de su sector.\nXII. Someter a la consideración de la Secretaría de Planeación, las medidas administrativas necesarias para lograr una mejor coordinación entre las entidades de su sector, a fin de uniformar criterios de realización de acciones, ejecución de programas de interés común y efectuar un mejor seguimiento y control de la inversión pública federal en el Estado;\nXIII. Someter a la consideración del Gobernador del Estado, los proyectos de acuerdo para fusionar, disolver o liquidar aquellas entidades del sector a su cargo que no cumplan los fines para las que fueron establecidas, o cuyo funcionamiento no sea ya conveniente desde el punto de vista económico o social;\nXIV. Someter a la consideración del Gobernador del Estado, los programas sectoriales que corresponda coordinar a la Secretaría, así como vigilar su congruencia con el\nPlan Estatal de Desarrollo, y coordinar, dirigir y supervisar su ejecución a través de las Unidades Administrativas que integran la Secretaría;\nXV. Aprobar el Programa Operativo Anual y el anteproyecto de presupuesto de egresos anual de la Secretaría, y del sector bajo su coordinación, en los casos que proceda, conforme a la normatividad aplicable;\nXVI. Aprobar y autorizar los proyectos de resolución que le sean propuestos en los recursos administrativos que legalmente le corresponda resolver;\nXVII. Proponer al Gobernador del Estado los proyectos de iniciativa de leyes, reglamentos, decretos, acuerdos, circulares y órdenes sobre los asuntos de la competencia de la\nSecretaría;\nXVIII. Suscribir convenios, contratos y demás actos jurídicos dentro de la esfera de sus atribuciones, con la Federación, con las demás Entidades Federativas, con los\nMunicipios del Estado, con los organismos públicos federales y estatales, así como con personas físicas o morales, privadas y públicas;\nXIX. Proporcionar los datos de labores desarrolladas por la Secretaría para la formulación del Informe Anual del Gobernador del Estado;\nXX. Resolver las dudas que se susciten con motivo de la interpretación de este\nReglamento, así como los casos no previstos en el mismo; y\nXXI. Las demás que, con carácter no delegable, le otorgue el Gobernador del Estado y otras disposiciones legales y reglamentarias.\nCAPÍTULO III\nArtículo 10.- Los Subsecretarios tendrán las siguientes atribuciones genéricas:\nI. Acordar con el Secretario los asuntos y la ejecución de los programas que le sean encomendados;\nII. Coordinar y evaluar el funcionamiento de las Unidades Administrativas bajo su adscripción, e informar al Secretario de las actividades que éstas realicen;\nIII. Supervisar el cumplimiento de las políticas, normas, criterios, sistemas y procedimientos que deban regir en las Unidades Administrativas de su adscripción;\nIV. Ejercer las funciones que se les deleguen, realizar los actos que les correspondan por suplencia y aquellos otros que les instruya el Secretario;\nV. Coordinar la elaboración del Programa Operativo Anual y del anteproyecto de presupuesto de egresos de las Unidades Administrativas bajo su adscripción y supervisar su correcta y oportuna ejecución;\nVI. Participar en la formulación, ejecución, control y evaluación de los programas sectoriales de la Secretaría;\nVII. Proponer al Secretario, en los casos procedentes, el nombramiento y remoción de los servidores públicos de las Unidades Administrativas que tengan adscritas;\nVIII. Suscribir los documentos relativos al ejercicio de sus atribuciones y aquellos que les sean señalados por delegación o les correspondan por suplencia;\nIX. Participar y evaluar el levantamiento de actas administrativas del personal adscrito a su cargo o de las Unidades Administrativas bajo su adscripción;\nX. Coordinar, dirigir y evaluar los proyectos de manuales de organización y manuales de procedimientos y todo informe o escrito que requiera de la intervención de las\nUnidades Administrativas bajo su adscripción;\nXI. Proporcionar la información y auxilio que les requieran el Órgano Interno de Control, la Unidad de Transparencia y la Dirección Jurídica para el desempeño de sus funciones;\nXII. Representar a la Secretaría en los foros, eventos, reuniones en materia de asuntos de su competencia, y dar cumplimiento a los acuerdos y convenios que se celebren;\nXIII. Recibir en acuerdo a los servidores públicos homólogos, así como al personal subalterno de su unidad, y conceder audiencias al público sobre los asuntos de su competencia, de conformidad con las políticas establecidas al respecto;\nXIV. Proporcionar la información o la cooperación que les sean requeridas por otras dependencias de la administración pública estatal, previo acuerdo con el Secretario;\nXV. Respetar las obligaciones señaladas en la Ley Reglamentaria del Capítulo XVII de la\nXVI. Respetar y conducirse conforme al Código de Ética al que deberán sujetarse los del Estado de Campeche; y\nXVII. Las demás que le atribuyan otras disposiciones legales y reglamentarias, así como las que le confiera el Secretario.\nCAPÍTULO IV\nArtículo 11.- A la Subsecretaría de Fomento Agropecuario le competen las siguientes atribuciones:\nI. Formular, supervisar, evaluar y controlar los programas enfocados al desarrollo del sector, así como las políticas y estrategias de desarrollo en materia de productividad agrícola, agroindustrial y bioenergética;\nII. Formular y proponer al Secretario los programas dirigidos al fortalecimiento del desarrollo agropecuario en el Estado;\nIII. Coordinar sus trabajos con la Coordinación de Evaluación y Seguimiento orientados acompañamiento a productores agropecuarios, para el uso eficiente de los recursos naturales, y la preservación ecológica;\nIV. Brindar la asesoría especializada dirigida al sector agropecuario en el Estado, relativa a los procedimientos del manejo de insumos, maquinaria, técnicas de producción y promoción de los resultados generados;\nV. Coordinar trabajos con las demás Unidades Administrativas de la Secretaría, además de realizar estudios, proyectos y programas agropecuarios necesarios para el adecuado funcionamiento de la Secretaría;\nVI. Fomentar acciones encaminadas a conservar y apoyar los cultivos tradicionales y aquellos con potencial comercial y asistir la producción agrícola, con la intención de aumentar su competitividad, de manera que atienda las demandas del mercado local, nacional e internacional;\nVII. Elaborar y someter a consideración del Secretario los programas de investigación del sector agropecuario en coordinación con las organizaciones de productores y de instituciones de enseñanza e investigación estatales, nacionales e internacionales;\nVIII. Promover el desarrollo del sector agropecuario mediante el apoyo de las iniciativas de los productores del Estado;\nIX. Promover y concertar el desarrollo de proyectos de coinversión entre el sector privado y el sector público encaminados a la modernización y desarrollo del sector agropecuario en el Estado;\nX. Desarrollar programas de apoyo financiero, de abasto de insumos, de industrialización y comercialización que fomenten la producción agropecuaria en todo el territorio estatal;\nXI. Representar a la Secretaría ante las dependencias y entidades de las\nAdministraciones Públicas Federal, Estatal y Municipal e instituciones del sector rural, conforme lo acuerde el Secretario;\nXII. Establecer, dentro de su ámbito de competencia, las políticas y líneas de acción a que deberán sujetarse las Direcciones de Cultivos Anuales, de Cultivos Perennes de Especies Menores, de Especies Mayores y de Infraestructura Rural;\nXIII. Proporcionar a la Unidad de Transparencia la información que emane y se derive del ejercicio de sus funciones y dentro del ámbito de su competencia para actualización de la página electrónica de la Secretaría, de tal forma que permita su fácil identificación, acceso y consulta por particulares, así como la obligatoriedad de dar cumplimiento a los mecanismos establecidos en la Ley General de\nTransparencia y Acceso a la Información Pública y la legislación local en la materia;\nXIV. Las demás que las disposiciones legales y reglamentarias le atribuyan, así como las que les confiera el Secretario.\nArtículo 12.- A la Subsecretaría de Sanidad e Inocuidad Agropecuaria le competen las siguientes atribuciones:\nI. Proponer, para consideración del Secretario, las buenas prácticas pecuarias y agrícolas, así como la formulación de los programas de prevención de agentes contaminantes en los productos agroalimentarios en el Estado;\nII. Coadyuvar con las instancias federales competentes, en las acciones de monitoreo y vigilancia que salvaguarden el estatus zoosanitario en el Estado;\nIII. Coordinarse con los organismos auxiliares en el Estado, para la implementación de políticas que fortalezcan las acciones de prevención de amenazas agroalimentarias;\nIV. Promover y concertar el desarrollo de proyectos de coinversión entre el sector privado y el sector público encaminados al fortalecimiento sanitario en el Estado;\nV. Colaborar con las instancias federales competentes, para la divulgación en el residuos de plaguicidas agrícolas, así como los límites máximos de residuos permitidos de antibióticos, compuestos hormonales y químicos;\nVI. Fomentar el desarrollo de programas que permitan el monitoreo de los residuos tóxicos y contaminantes en los productos de origen animal y vegetal en el Estado;\nVII. Ejecutar los programas tendientes a mejorar las condiciones de sanidad agropecuaria y prácticas de manejo zoosanitario de los productores, con la finalidad de cumplir con los planes sanitarios en el Estado;\nVIII. Coadyuvar con la operación de centros de expedición de documentación para las movilizaciones de animales y vegetales, con el fin de cumplir con las disposiciones emanadas de los acuerdos estatales y/o federales;\nIX. Establecer la supervisión dentro del territorio estatal de sistemas de minimización de riesgos;\nX. Dar seguimiento conforme a la Ley de Fomento Pecuario para el Estado de\nCampeche y a la Ley Agrícola del Estado, a los acuerdos y disposiciones del\nGobernador del Estado en el que se dicten las medidas zoosanitarias;\nXI. Informar al Secretario sobre los acuerdos, convenios y demás disposiciones reglamentarias que suscriba el Ejecutivo del Estado en materia agroalimentaria;\nXII. Proporcionar a la Unidad de Transparencia la información que emane y se derive del ejercicio de sus funciones y dentro del ámbito de su competencia, para la actualización de la página electrónica de la Secretaría, de tal forma que permita su fácil identificación, acceso y consulta por particulares, así como la obligatoriedad de dar cumplimiento a los mecanismos establecidos en la Ley General de\nTransparencia y Acceso a la Información Pública y la legislación local en la materia;\nXIII. Las demás que las disposiciones legales y reglamentarias le atribuyan, así como las que les confiera el Secretario.\nCAPÍTULO V\nDE LAS ATRIBUCIONES GENÉRICAS DE LAS DIRECCIONES\nY UNIDADES\nArtículo 13.- Los Titulares de las Direcciones y Unidades tendrán las siguientes atribuciones genéricas:\nI. Planear, programar y presupuestar las actividades concernientes a su cargo, así como formular, ejecutar, controlar y evaluar los programas y presupuestos necesarios para el ejercicio de sus atribuciones;\nII. Acordar con su superior inmediato la resolución de los asuntos a su cargo;\nIII. Ejercer las atribuciones que les sean delegadas y aquellas que les correspondan por suplencia, así como realizar los actos que les instruyan sus superiores;\nIV. Formular los dictámenes, opiniones e informes que les sean solicitados por sus superiores;\nV. Proponer la suscripción de contratos y convenios relativos al ejercicio de sus atribuciones;\nVI. Emitir opinión en la selección, contratación, desarrollo, capacitación, promoción, adscripción y licencias del personal a su cargo;\nVII. Formular las demandas y denuncias ante las autoridades judiciales y administrativas que correspondan respecto a su competencia; contestar las demandas, quejas y respecto de las funciones que realiza, así como los recursos y promociones que correspondan;\nVIII. Acordar, realizar, tramitar y gestionar ante la Coordinación Administrativa los movimientos del personal de los servidores públicos bajo su adscripción, en lo referente a altas, cambios de nivel, adscripciones, comisiones, permisos, sanciones, bajas, reingresos, licencias médicas, vacaciones, seguros de vida, expedición de nombramientos y similares, de conformidad a la normatividad vigente, así como llevar el debido control de los mismos;\nIX. Levantar las actas administrativas que correspondan conforme a lo dispuesto por la\nX. Expedir, controlar y aplicar las notas de méritos y sanciones a que se refieren las\nCampeche;\nXI. Proporcionar la información y la cooperación técnica que les sea requerida oficialmente;\nXII. Promover, diseñar e instrumentar las acciones de modernización administrativa y mejora institucional que correspondan dentro del ámbito de su responsabilidad;\nXIII. Elaborar y proponer a su superior jerárquico los cambios en los manuales de organización y procedimientos de trámites y servicios ciudadanos y relaciones interdepartamentales de la dirección o unidad administrativa a su cargo;\nXIV. Proponer a su superior jerárquico los anteproyectos de leyes, reglamentos, decretos, acuerdos, circulares y órdenes sobre asuntos de su competencia;\nXV. Proponer el nombramiento y remoción de los servidores públicos de las Unidades\nAdministrativas que tengan adscritas;\nXVI. Suscribir los documentos relativos al ejercicio de sus atribuciones y aquellos que les sean señalados por delegación o les correspondan por suplencia;\nXVII. Proporcionar la información y auxilio que les requieran el Órgano Interno de Control y la Dirección Jurídica para el desempeño de sus funciones;\nXVIII. Recibir en acuerdo a los servidores públicos homólogos, así como al personal subalterno de su unidad, y conceder audiencias al público sobre los asuntos de su competencia, de conformidad con las políticas establecidas al respecto;\nXIX. Respetar las obligaciones de todo servidor público señaladas en la Ley\nCampeche;\nXX. Respetar y conducirse conforme al Código de Ética al que deberán sujetase los\nServidores Públicos de las dependencias y entidades de la administración pública del Estado de Campeche; y\nXXI. Las demás que las disposiciones legales y reglamentarias le atribuyan, así como las que le confiera el Secretario.\nCAPÍTULO VI\nDE LAS ATRIBUCIONES ESPECÍFICAS DE LAS DIRECCIONES Y UNIDADES\nArtículo 14.- La Dirección de Cultivos Perennes tendrá las siguientes atribuciones:\nI. Planear e implementar acciones de asesoría especializada y transferencia de tecnología, mediante paquetes científicos, de pastos de corte y frutales, en coordinación con instituciones educativas, de investigación y organismos públicos y privados, a efectos de elevar el nivel de vida de los productores del sector agrícola;\nII. Instrumentar servicios y apoyos a los productores agrícolas en materia de asistencia técnica y capacitación, dirigidos a mejorar la producción de cultivos perennes, pastos de corte y frutales de alta densidad;\nIII. Elaborar proyectos y programas de mejoramiento genético en espacios vegetativos, para impulsar el sector agrícola del Estado;\nIV. Capacitar a los productores agrícolas, a efectos de implementar esquemas adecuados para el mejoramiento productivo del campo en el Estado;\nV. Promover entre los productores agrícolas, su participación y asistencia a ferias, foros y exposiciones de capacitación y asistencia técnica en el sector;\nVI. Establecer unidades de producción de especies y variedades frutícolas con que dañen el umbral económico, así como adaptables a las condiciones productividad;\nVII. Proporcionar a la Unidad de Transparencia la información que emane y se derive del de la página electrónica de la Secretaría, de tal forma que permita su fácil identificación, acceso y consulta por particulares, así como la obligatoriedad de dar cumplimiento a los mecanismos establecidos en la Ley General de Transparencia y\nAcceso a la Información Pública y la legislación local en la materia; y\nVIII. Las demás que le confieran otras disposiciones legales y reglamentarias aplicables, así como las que le atribuya el Secretario.\nArtículo 15.- La Dirección de Cultivos Anuales tendrá las siguientes atribuciones:\nI. Planear, concertar, supervisar y evaluar las políticas y estrategias de desarrollo en materia de producción y productividad agrícola, en coordinación con las dependencias y entidades de las administraciones públicas federal, estatal y municipal, así como con instituciones y organizaciones sociales o privadas involucradas o con injerencia en el sector;\nII. Elaborar, proponer y ejecutar programas y proyectos operativos sectoriales de producción y productividad, tanto de los cultivos de importancia socioeconómica como de otros alternativos, en apoyo a los productores;\nIII. Promover la realización de convenios y acuerdos de concertación con las instituciones, organizaciones sociales y productores privados que tengan injerencia en el sector productivo;\nIV. Apoyar y promover estudios, proyectos y actividades de fomento productivo;\nV. Revisar, actualizar y concentrar las estadísticas de producción y productividad que se generen en el Estado;\nVI. Promover y, en su caso, dotar de la utilización de semillas mejoradas (básicos y hortícolas), fertilizantes y demás insumos en atención a requerimientos de la producción y productividad, con énfasis en la protección del entorno ecológico;\nVII. Proporcionar a la Unidad de Transparencia la información que emane y se derive del ejercicio de sus funciones y dentro del ámbito de su competencia para actualización de la página electrónica de la Secretaría, de tal forma que permita su fácil identificación, acceso y consulta por particulares, así como la obligatoriedad de dar\nAcceso a la Información Pública y la legislación local en la materia; y\nVIII. Las demás que le confieran otras disposiciones legales y reglamentarias aplicables, así como las que le atribuya el Secretario.\nArtículo 16.- La Dirección de Infraestructura Rural tendrá las siguientes atribuciones:\nI. Administrar, resguardar y vigilar que se haga buen uso de las herramientas, equipos de los proyectos y programas de desarrollo a su cargo;\nII. Definir los lineamientos que regulen el uso, control, conservación y operación de los equipos, de las herramientas y demás maquinaria que sean propiedad de la\nSecretaría o que se encuentren bajo su resguardo;\nIII. Acordar y elaborar, en conjunto con las demás Unidades Administrativas de la\nSecretaría, un programa mensual de los trabajos a realizar como parte de los programas y proyectos a cargo de la Secretaría, con la finalidad de distribuir adecuadamente la utilización de los equipos, herramientas y maquinaria;\nIV. Elaborar y mantener actualizado un inventario donde obren los datos generales de de la Secretaría, así como también elaborar una bitácora general donde se pueda consultar y conocer el estado técnico-mecánico de los mismos;\nV. Elaborar y someter a consideración del Secretario los programas de asistencia técnica y operativa del manejo y operación de maquinaria agrícola y equipo especializado, con el objetivo de capacitar a los productores agrícolas del Estado;\nVI. Definir un lugar que cumpla con las características necesarias para almacenar y resguardar de manera adecuada las herramientas y demás maquinaria que sean responsabilidad de la Secretaría;\nVII. Llevar un inventario actualizado de proveedores de repuestos y de técnicos especializados en mantenimiento y reparación de los equipos y maquinarias con los que cuenta la Secretaría;\nVIII. Planear y programar la construcción, mantenimiento y rehabilitación de la infraestructura de riego para las unidades de producción agrícola en el Estado;\nIX. Coordinarse con las dependencias y entidades de las administraciones públicas federal, estatal y municipal en la elaboración de los programas de construcción, mantenimiento y rehabilitación de la infraestructura de riego para las unidades de producción agrícola en el Estado;\nX. Formular y someter a consideración del Secretario los proyectos para la construcción de la infraestructura de riego requerida en las unidades de producción agrícola en el\nEstado;\nXI. Presupuestar y ejecutar las obras de construcción, mantenimiento y rehabilitación de la infraestructura de riego, perforación, equipamiento de pozos para uso agrícola, construcción de sistemas de riego, mantenimiento y rehabilitación de los equipos de bombeo;\nXII. Mantener una campaña constante de información dirigida a los productores agrícolas de las distintas comunidades del Estado sobre diagnósticos, mantenimientos preventivos y correctivos a sus unidades de bombeo que se encuentren en operación;\nXIII. Elaborar los costos de operación de maquinaria, dependiendo del o de los conceptos de obra a realizar conforme a las disposiciones aplicables;\nXIV. Elaborar los presupuestos de infraestructura para la contratación y supervisión de obras de rehabilitación de granjas porcícolas y avícolas, así como presentárselos a su superior jerárquico;\nXV. Elaborar los planos y los programas de las obras a realizar, que sean de su competencia;\nXVI. Trabajar, en conjunto con las demás Unidades Administrativas de la Secretaría, en la elaboración de documentos necesarios para realizar las licitaciones a cargo de la\nSecretaría;\nXVII. Coordinar acciones con las dependencias que correspondan de la administración pública del Estado, en los programas de donación de Petróleos Mexicanos “PEMEX” para programas de esta Secretaría;\nXVIII. Planear, en coordinación con las dependencias correspondientes de la administración pública estatal, los estudios y proyectos para la construcción y reconstrucción de la infraestructura hidráulica estatal;\nXIX. Elaborar los programas y ejecutar las obras de infraestructura agropecuaria, tales como rehabilitación de áreas mecanizadas y construcción de jagüeyes en el ámbito\nEstatal;\nXX. Participar en la elaboración del Programa Operativo Anual de la Secretaría;\nXXI. Proporcionar a la Unidad de Transparencia la información que emane y se derive del de la página electrónica de la Secretaría, de tal forma que permita su fácil identificación, acceso y consulta por particulares, así como la obligatoriedad de dar\nAcceso a la Información Pública y la legislación local en la materia; y\nXXII. Las demás que las disposiciones legales y reglamentarias le atribuyan, así como las que le confiera el Secretario.\nArtículo 17.- La Dirección de Especies Mayores tendrá las siguientes atribuciones:\nI. Elaborar y conducir los programas de fomento y protección de especies mayores, de conformidad con los lineamientos establecidos en el Plan Estatal de Desarrollo y el\nPrograma Sectorial correspondiente;\nII. Planear, programar y establecer los mecanismos que permitan el desarrollo de los programas pecuarios, con la finalidad de mejorar e incrementar la producción en el\nEstado;\nIII. Establecer los lineamientos para la realización de estudios y proyectos que permitan el mejoramiento del hato ganadero de los productores del Estado, con el objetivo de elevar la producción de las especies, en donde se tomen como marco operativo los lineamientos emitidos por las dependencias de las administraciones públicas federal, estatal y municipal en materia de desarrollo rural;\nIV. Brindar asesoría técnica respecto a las solicitudes planteadas por los productores a través de las Direcciones de Región de Desarrollo Rural en los Municipios, o directamente ante la Secretaría y que correspondan a los diversos programas a cargo de la Dirección;\nV. Elaborar y someter a consideración del Secretario, la implementación de los programas pecuarios en atención a las necesidades de los productores de especies mayores;\nVI. Asistir y participar en las comisiones, consejos y comités que se celebren en el\nEstado en materia de especies mayores y a los que directamente le encomiende el\nSecretario;\nVII. Promover las acciones encaminadas a la investigación y estudio de las especies mayores, en beneficio de los productores pecuarios del Estado;\nVIII. Difundir y fomentar, entre los productores pecuarios del Estado, la utilización de nuevos y mejores insumos y tecnologías para el incremento de su producción;\nIX. Crear y mantener actualizado un inventario de especies mayores con las que se cuenta en el Estado, para establecer los programas que sean necesarios para el mejor desarrollo de las actividades productivas;\nX. Participar e integrar reuniones de coordinación con dependencias y entidades de las administraciones públicas federal, estatal y municipal y del sector social y privado en el ámbito de su competencia, así como la realización de congresos, concursos, ferias y exposiciones estatales, nacionales e internacionales en coordinación con las diferentes asociaciones pecuarias del Estado y del País;\nXI. Informar a los productores pecuarios del Estado el acceso a los mecanismos de financiamiento, convenios de colaboración en los que se implementen proyectos rentables de desarrollo pecuario, que les permita lograr altos niveles de producción y una mejor comercialización de sus productos y subproductos;\nXII. Evaluar los programas que se implementen en materia de desarrollo, fomento y asistencia técnica pecuaria, con la intención de buscar los mecanismos que permitan obtener mejores resultados que puedan ser utilizados en nuevos proyectos;\nXIII. Proporcionar a la Unidad de Transparencia la información que emane y se derive del de la página electrónica de la Secretaría, de tal forma que permita su fácil identificación, acceso y consulta por particulares, así como la obligatoriedad de dar\nAcceso a la Información Pública y la legislación local en la materia; y\nXIV. Las demás que las disposiciones legales y reglamentarias le atribuyan, así como las que le confiera el Secretario.\nArtículo 18.- La Dirección de Especies Menores tendrá las siguientes atribuciones:\nI. Planear, concertar, supervisar y evaluar las políticas y estrategias de desarrollo apícola, porcícola, avícola y ovino en coordinación con las dependencias y entidades de las administraciones públicas federal, estatal y municipal, así como con las instituciones y organizaciones federales, estatales o municipales que tengan injerencia en el sector;\nII. Promover la participación de los productores de especies menores en los consejos o grupos colegiados especializados de la materia;\nIII. Elaborar y someter a consideración del Secretario la ejecución de los programas y proyectos operativos sectoriales de producción apícola, porcícola, avícola y ovino en apoyo a los productores locales;\nIV. Promover y gestionar el financiamiento para el desarrollo del sector con el objetivo de buscar mejores resultados e impulsar la participación pública, social y privada en proyectos para el desarrollo de las especies menores;\nV. Asistir directamente al Secretario e informarle sobre los convenios, acuerdos o convenios de colaboración o concertación con las instituciones, organizaciones sociales y productores del sector, que la Secretaría pueda suscribir para beneficio del Estado;\nVI. Fomentar la participación de las dependencias correspondientes, en los programas de promoción de las exportaciones y de inversión en el sector;\nVII. Crear y mantener actualizado el Padrón Estatal de Productores de Especies\nMenores;\nVIII. Promover la modernización de la industria y el desarrollo de proyectos orgánicos en el Estado;\nIX. Coordinar la operación de los programas a cargo de la Secretaría en materia de especies menores que implemente o en los que ésta sea parte;\nX. Coordinar la realización de campañas de difusión y promoción de los objetivos y resultados alcanzados a través de los programas de desarrollo de especies menores en el Estado;\nXI. Crear un programa o realizar las acciones necesarias que fomenten una cultura de protección a la industria del sector en el Estado;\nXII. Proporcionar a la Unidad de Transparencia la información que emane y se derive del ejercicio de sus funciones y dentro del ámbito de su competencia para actualización de la página electrónica de la Secretaría, de tal forma que permita su fácil identificación, acceso y consulta por particulares, así como la obligatoriedad de dar cumplimiento a los mecanismos establecidos en la Ley General de Transparencia y\nAcceso a la Información Pública y la legislación local en la materia; y\nXIII. Las demás que las disposiciones legales y reglamentarias le atribuyan, así como las que le confiera el Secretario.\nArtículo 19.- La Dirección de Sanidad e Inocuidad Animal tendrá las siguientes atribuciones:\nI. Coordinarse con las demás Unidades Administrativas de la Secretaría, en la elaboración de programas, proyectos y estudios de sanidad pecuaria, asistencia técnica, capacitación y difusión de tecnología para la prevención, control y erradicación de enfermedades que afecten a las especies pecuarias en el Estado;\nII. Vigilar el cumplimiento de las políticas sanitarias en el Estado, que resulten pecuarias, con la finalidad de asegurar una producción enfocada a facilitar la competencia;\nIII. Brindar asesoría técnica respecto a las solicitudes emitidas por los productores a través de las Direcciones de Región de Desarrollo Rural en los Municipios, o directamente ante la Secretaría;\nIV. Someter a consideración del Secretario la ejecución de los programas y acciones en el Estado;\nV. Realizar los estudios y proyectos necesarios para la presupuestación anual de las programas y acciones a cargo de la Dirección;\nVI. Participar e integrar reuniones, tanto de coordinación con dependencias y entidades de las administraciones públicas federal, estatal y municipal y del sector social y privado, así como las correspondientes a los Comités y Subcomités en los que intervenga directamente el Secretario;\nVII. Coordinar las acciones zoosanitarias que se realicen en el Estado, para la ejecución de programas que busquen la mejoría de la calidad sanitaria, apoyándose con el organismo auxiliar denominado Comité de Fomento y Protección Pecuaria del\nEstado de Campeche “COFOPECAM”;\nVIII. Establecer, acordar y regular acciones que incrementen la seguridad zoosanitaria en acuerdo con las organizaciones de productores pecuarios reconocidas en el Estado;\nIX. Asistir y participar en las reuniones de trabajo, foros, convenciones, entre otros, a nivel estatal, regional y nacional, cuando se traten asuntos inherentes a la salud animal;\nX. Proporcionar a la Unidad de Transparencia la información que emane y se derive del ejercicio de sus funciones y dentro del ámbito de su competencia para actualización de la página electrónica de la Secretaría, de tal forma que permita su fácil identificación, acceso y consulta por particulares, así como la obligatoriedad de dar cumplimiento a los mecanismos establecidos en la Ley General de Transparencia y\nAcceso a la Información Pública y la legislación local en la materia; y\nXI. Las demás que las disposiciones legales y reglamentarias le atribuyan, así como las que le confiera el Secretario.\nArtículo 20.- La Dirección de Sanidad e Inocuidad Vegetal tendrá las siguientes atribuciones:\nI. Elaborar los programas, proyectos y estudios de sanidad vegetal, asistencia técnica, capacitación y difusión de tecnología para la prevención, control y erradicación de plagas y enfermedades que afecten a la agricultura;\nII. Definir las zonas del Estado que deban sujetarse a las medidas regulatorias y cuarentenarias en materia de sanidad vegetal, así como establecer las acciones para combatir las plagas y enfermedades que afecten a la agricultura;\nIII. Participar conjuntamente con las autoridades federales competentes, en la entrada, salida y movilización de vegetales, así como sus productos y subproductos agrícolas en el Estado;\nIV. Proporcionar asistencia técnica a los productores agrícolas del Estado para la importación, exportación y movilización de plaguicidas y de la maquinaria y equipos para su aplicación, así como de productos químicos, cuando impliquen riesgo sanitario;\nV. Coordinar y organizar acciones de prevención, control y erradicación de plagas que ataquen a los productos y subproductos vegetales;\nVI. Participar conjuntamente con las autoridades federales y estatales competentes, en la preservación de la sanidad de las plantas en el Estado, y evitar que los medios empleados para este fin contaminen el ambiente;\nVII. Coordinar, supervisar y validar, conjuntamente con las autoridades federales competentes, las acciones de las Juntas Locales de Sanidad Vegetal, con base en las normas oficiales mexicanas;\nVIII. Coordinar las Comisiones de Regulación y Seguimiento establecidas para vigilar el de Campeche;\nIX. Supervisar y vigilar, en las Comisiones de Regulación y Seguimiento, los avances mensuales físico-financieros de las campañas sobre inocuidad vegetal;\nX. Difundir a los productores, a través de las Direcciones de Región de Desarrollo Rural en los Municipios, técnicas para la correcta aplicación de plaguicidas, y el uso del equipo para el combate de plagas que afecten la agricultura;\nXI. Formular y ejecutar, en coordinación con las instancias competentes, los programas de contingencia por regiones cuando se afecte la sanidad de las plantas, así como realizar conjuntamente campañas para su prevención y control;\nXII. Promover y coordinar acciones para la certificación de unidades de producción agrícolas, en el uso de buenas prácticas de manejo;\nXIII. Proporcionar a la Unidad de Transparencia la información que emane y se derive del ejercicio de sus funciones y dentro del ámbito de su competencia para actualización de la página electrónica de la Secretaría, de tal forma que permita su fácil identificación, acceso y consulta por particulares, así como la obligatoriedad de dar cumplimiento a los mecanismos establecidos en la Ley General de Transparencia y\nAcceso a la Información Pública y la legislación local en la materia; y\nXIV. Las demás que le atribuyan otras leyes y disposiciones reglamentarias aplicables, así como las que le confiera el Secretario.\nArtículo 21.- La Dirección de Seguimiento de Compromisos de Gobierno tendrá las siguientes atribuciones:\nI. Dar seguimiento a los compromisos del Gobernador del Estado inherentes al sector agropecuario que emanen de los diversos programas correspondientes a las atribuciones de la Secretaría;\nII. Fungir de enlace con las Unidades Administrativas correspondientes de la Secretaría para dar seguimiento del cumplimiento, atención y resolución de las gestiones recibidas del sector agropecuario, conforme al ámbito de competencia de cada una de ellas;\nIII. Generar información, cuantitativa y cualitativa, sobre los resultados obtenidos por las direcciones de la Secretaría, en la atención y cumplimiento de las peticiones recibidas del sector agropecuario;\nIV. Asistir a las reuniones de trabajo inherentes a las acciones que realiza esta\nDirección, con las diversas dependencias y entidades de la administración pública,\nV. Dar atención personalizada a los productores al momento de acudir a la Institución canalizadas para su atención y el estatus que éstas guarden;\nVI. Fungir de enlace con otros entes públicos para coadyuvar a la ejecución de los compromisos de gobierno;\nVII. Recibir, clasificar y analizar las solicitudes de los productores del Estado;\nVIII. Proporcionar a la Unidad de Transparencia la información que emane y se derive del de la página electrónica de la Secretaría, de tal forma que permita su fácil identificación, acceso y consulta por particulares, así como la obligatoriedad de dar\nAcceso a la Información Pública y la legislación local en la materia; y\nIX. Las demás que le confieran otras disposiciones legales y reglamentarias aplicables, así como las que le atribuya el Secretario.\nArtículo 22.- La Dirección de Recursos Financieros y Servicios tendrá las siguientes atribuciones:\nI. Tramitar los pagos de proveedores de bienes y servicios;\nII. Difundir ante el personal las disposiciones normativas para el ejercicio del gasto corriente, viáticos y pasajes, fondo revolvente y similares otorgados a la Secretaría;\nIII. Proponer a la Coordinación Administrativa, las políticas para la administración de los recursos financieros de la dependencia, de acuerdo a los programas y objetivos fijados cumpliendo con la normatividad en la materia;\nIV. Mantener informada permanentemente a la Coordinación Administrativa de todos los asuntos que ésta le encomiende, relacionados con el manejo de los recursos financieros de la dependencia;\nV. Ejercer los recursos financieros dados a la Secretaría mediante asignación, validación, comprobación y ajuste presupuestal, de acuerdo con las necesidades de las unidades administrativas y de conformidad con las disposiciones legales aplicables;\nVI. Ejecutar en tiempo los recursos financieros asignados a las unidades administrativas de la Secretaría, con la finalidad de facilitar las acciones que se lleven a cabo para su operatividad;\nVII. Elaborar, en coordinación con las unidades administrativas de la Secretaría, la programación presupuestal de conformidad con las disposiciones legales y reglamentarias correspondientes;\nVIII. Tramitar ante la Secretaría de Finanzas la asignación de los recursos financieros de las diferentes partidas de gasto autorizado, previa validación de la Coordinación\nAdministrativa;\nIX. Controlar la eficiencia presupuestal del ejercicio de los recursos asignados a la\nSecretaría;\nX. Registrar y actualizar las firmas de funcionarios facultados para el manejo de recursos, así como, autorizar la documentación soporte para la comprobación del gasto o programación de pagos;\nXI. Elaborar conciliaciones bancarias correspondientes a las cuentas que tenga asignadas;\nXII. Dar atención a la Secretaría en las necesidades de servicios generales y mantenimiento, sin incluir lo relacionado a informática, así como coordinar al personal de dicha área;\nXIII. Proporcionar a la Unidad de Transparencia la información que emane y se derive del de la página electrónica de la Secretaría, de tal forma que permita su fácil identificación, acceso y consulta por particulares, así como la obligatoriedad de dar\nAcceso a la Información Pública y la legislación local en la materia; y\nXIV. Las demás que le atribuyan las disposiciones legales y reglamentarias aplicables, así como las que le encomiende la Coordinación Administrativa.\nArtículo 23.- La Dirección Jurídica tendrá las siguientes atribuciones:\nI. Atender, dirigir y supervisar los asuntos jurídicos de la Secretaría, así como proponer la Dependencia;\nII. Fungir como órgano de consulta, asesoría, apoyo y asistencia jurídica, en las materias de su competencia, para todas las unidades administrativas y los de sus atribuciones; procurando la unificación de criterios en la aplicación de normas administrativos;\nIII. Formular los anteproyectos de leyes, reglamentos, decretos, acuerdos y órdenes que el Secretario proponga, en su caso, al Gobernador del Estado, y demás disposiciones normativas que correspondan o sean materia de competencia de la\nSecretaría;\nIV. Resguardar, controlar y vigilar la operación del Archivo General de la Secretaría, observando la aplicación de la normatividad que rige en la materia;\nV. Elaborar los documentos jurídicos, convenios y contratos que resulten necesarios para el ejercicio de las atribuciones de la Secretaría o, en su caso, revisar y emitir opinión sobre los proyectos ya elaborados y de aquellos que ya se encuentren en ejecución;\nVI. Compilar, ordenar y actualizar el acervo legal de la dependencia, incluyendo las leyes, decretos, reglamentos, contratos, acuerdos, convenios, circulares, y demás disposiciones vigentes relacionadas con sus atribuciones y funciones, informando a los titulares de las unidades administrativas de la Secretaría, las disposiciones publicadas en el Diario Oficial de la Federación y en el Periódico Oficial del Estado, relacionadas con las atribuciones de su competencia;\nVII. Auxiliar a las unidades administrativas de la Secretaría en la elaboración de los manuales de organización, de estructuras y de procedimientos, y vigilar que éstos se apeguen a la legislación, reglamentación y demás normatividad vigente, así como ordenar, en su caso, su corrección o ajuste;\nVIII. Revisar que los manuales, formatos y lineamientos correspondientes a las unidades administrativas de la Secretaría, se apeguen a la legislación, reglamentación y demás normatividad vigente, cuando se le solicite, e instruir su corrección o ajuste;\nIX. Informar a las autoridades competentes de la comisión o presunta comisión de delitos de los servidores públicos de la Secretaría en el desempeño de sus funciones;\nX. Resolver los recursos administrativos que se interpongan ante la Secretaría contra actos o resoluciones de la misma; substanciando hasta su total conclusión los procedimientos administrativos y legales ante las instancias correspondientes;\nXI. Representar legalmente al Secretario y a los titulares de las unidades administrativas de la Secretaría, con todas las facultades generales y las especiales conforme a la legislación que resulte aplicable, ante los órganos administrativos o jurisdiccionales competentes federales y estatales, en toda clase de juicios, procedimientos, investigaciones y cualquier otra controversia en que aquélla sea parte, e intervenir en reclamaciones, indagatorias, procesos y juicios que se refieran a hechos o actos susceptibles de causar daño o perjuicio a los intereses de la Secretaría. Asimismo, ejercitar las acciones, excepciones y defensas que correspondan, actuando en todas las instancias del juicio, procedimiento o recurso de que se trate hasta su total conclusión y, en su caso, interponer los medios de impugnación que establezcan las los juicios, procedimientos y controversias en los que la Secretaría sea parte;\nXII. Formular denuncias o querellas ante el Ministerio Público de los hechos delictuosos en que la Secretaría resulte víctima u ofendido; otorgar el perdón legal cuando proceda, previa autorización por escrito del Secretario, así como denunciar o los servidores públicos de la Secretaría e intervenir, en la esfera de sus atribuciones, dependencia;\nXIII. En el caso de los juicios de amparo, representar a la Secretaría, a su titular y a cualesquiera de sus unidades administrativas, cuando éstos sean designados con el carácter de autoridades responsables ordenadoras o ejecutoras del acto o actos que se reclamen, para lo cual podrá rendir en su presentación, por la vía de suplencia, los informes que se les soliciten, así como interponer los recursos que correspondan durante la tramitación de tales juicios, actuar en todas sus instancias, incluso pedir los sobreseimientos y manifestar las causales de improcedencia que se adviertan;\npara ese efecto, las unidades administrativas señaladas como responsables deberán proporcionarle, dentro del respectivo plazo de ley las pruebas documentales que resulten necesarias para acreditar la constitucionalidad de sus actos, así como proponer los contenidos de los informes que deban rendirse;\nXIV. Ser el enlace en los asuntos jurídicos de la Secretaría con otras áreas y dependencias de la administración pública centralizada y paraestatal;\nXV. Levantar las actas administrativas que correspondan con respecto al desempeño de las funciones del personal a su cargo y remitirlas a la Coordinación Administrativa conforme a la normatividad aplicable; asesorar a las unidades administrativas de la\nSecretaría en los asuntos laborales relativos a su personal, incluyendo la práctica y levantamiento de constancias, actas administrativas y otros documentos similares;\nXVI. Participar en los actos de entrega-recepción de los servidores públicos de la\nSecretaría;\nXVII. Expedir certificaciones de documentos y expedientes que obren en los archivos de trámite de todas las unidades administrativas de la Secretaría;\nXVIII. Formar parte de la Comisión de Estudios Jurídicos del Poder Ejecutivo del Estado que preside la Consejería Jurídica;\nXIX. Instaurar los procedimientos administrativos que se deriven de las violaciones a las reglamentaciones de las atribuciones de la Secretaría y en su caso emitir las respectivas resoluciones conforme a lo establecido en la Ley de Procedimiento\nAdministrativo para el Estado y los Municipios de Campeche;\nXX. Desarrollar todas aquellas funciones jurídicas contenidas en el presente artículo y aquellas que resulten inherentes a la Dirección en comento debiendo contar, para la ejecución de las mismas, con el título y la cédula profesional que ampare el ejercicio profesional en materia jurídica;\nXXI. Proporcionar a la Unidad de Transparencia la información que emane y se derive del de la página electrónica de la Secretaría, de tal forma que permita su fácil identificación, acceso y consulta por particulares, así como la obligatoriedad de dar\nAcceso a la Información Pública y la legislación local en la materia; y\nXXII. Las demás que le confieran otras disposiciones legales y reglamentarias.\nCAPÍTULO VII\nDE LAS COORDINACIONES\nArtículo 24.- La Coordinación del FOFAE tendrá las siguientes atribuciones:\nI. Emitir mensualmente las convocatorias pertinentes para la celebración de las\nEstado de Campeche;\nII. Notificar a los integrantes del Comité Técnico del Fondo de Fomento Agropecuario del Estado de Campeche, la celebración de las reuniones de trabajo, con un mínimo de tres días hábiles de anticipación;\nIII. Informar a los integrantes del Comité Técnico del Fondo de Fomento Agropecuario del Estado de Campeche, los puntos a tratar en las reuniones de trabajo, con un mínimo de tres días hábiles de anticipación;\nIV. Al término de las reuniones de trabajo, someter a consideración de los integrantes del Comité Técnico del Fondo de Fomento Agropecuario del Estado de Campeche, el resumen de los acuerdos tomados durante la reunión;\nV. Llevar un control actualizado y resguardar todos los documentos donde obren los acuerdos tomados en las reuniones de trabajo del Comité Técnico del Fondo de\nFomento Agropecuario del Estado de Campeche;\nVI. Elaborar las instrucciones de pago del fiduciario;\nVII. Llevar a cabo la programación y control de los gastos de operación de los programas en co-ejercicio;\nVIII. Elaborar los anexos técnicos y operativos con fundamento en los convenios de trabajo suscritos por la Secretaría;\nIX. Elaborar las convocatorias de los programas en co-ejercicio, así como la publicación de las mismas;\nX. Elaborar los reportes físicos y financieros de los programas de los que sea parte la\nSecretaría, dentro del plazo establecido en las reglas de operación y la demás normatividad aplicable;\nXI. Elaborar las conciliaciones bancarias con el fiduciario;\nXII. Trabajar en colaboración con las demás comisiones y unidades administrativas para el correcto funcionamiento de la Secretaría;\nXIII. Formular el finiquito de los programas;\nXIV. Proporcionar a la Unidad de Transparencia la información que emane y se derive del ejercicio de sus funciones y dentro del ámbito de su competencia para actualización de la página electrónica de la Secretaría, de tal forma que permita su fácil identificación, acceso y consulta por particulares, así como la obligatoriedad de dar cumplimiento a los mecanismos establecidos en la Ley General de Transparencia y\nAcceso a la Información Pública y la legislación local en la materia; y\nXV. Las demás que las disposiciones legales y reglamentarias le atribuyan, así como las que le confiera el Secretario.\nArtículo 25.- La Coordinación de Regiones de Desarrollo Rural, tendrá las siguientes atribuciones:\nI. Coordinar las acciones operativas, los programas de apoyo y demás servicios a cargo de la Secretaría a favor de los productores agropecuarios, a través de las\nDirecciones de Región de Desarrollo Rural localizadas en los Municipios del Estado;\nII. Ser el enlace inmediato del Secretario con las Direcciones de Región de Desarrollo\nRural;\nIII. Coordinar las acciones pertinentes a efecto de llevar el seguimiento de los programas;\nIV. Coordinar y vigilar el cumplimiento de los programas y proyectos a cargo de las\nDirecciones de Región de Desarrollo Rural;\nV. Gestionar ante la Dirección de Recursos Financieros y Servicios y ante la funcionamiento de las Direcciones de Región de Desarrollo Rural;\nVI. Representar a la Secretaría en los foros, eventos, reuniones de carácter eventos que le ordene el Secretario;\nVII. Proporcionar a la Unidad de Transparencia la información que emane y se derive del ejercicio de sus funciones y dentro del ámbito de su competencia para actualización de la página electrónica de la Secretaría, de tal forma que permita su fácil identificación, acceso y consulta por particulares, así como la obligatoriedad de dar cumplimiento a los mecanismos establecidos en la Ley General de Transparencia y\nAcceso a la Información Pública y la legislación local en la materia; y\nVIII. Las demás que las disposiciones legales y reglamentarias le atribuyan, así como las que le confiera el Secretario.\nArtículo 26.- La Coordinación Administrativa tendrá las siguientes atribuciones:\nI. Autorizar solicitudes de viáticos que requieran las unidades administrativas de la\nSecretaría, a solicitud de éstas, para el desempeño de sus funciones;\nII. Tramitar transportación terrestre, marítima o aérea de personas, gastos de alimentación y demás servicios de proveeduría, que requieran las unidades administrativas de la Secretaría, a solicitud de éstas, para el desempeño de sus funciones;\nIII. Tramitar y dar seguimiento ante la Secretaría de Administración e Innovación\nGubernamental, los movimientos que genere el personal de la Secretaría, que incluyan la propuesta y expedición de nombramientos, dentro del marco de su competencia;\nIV. Tramitar y dar seguimiento a los pagos y descuentos que por efectos de nombramientos, reclasificaciones, horas extras, licencias y demás movimientos genere el personal de la Secretaría, dentro del marco de su competencia;\nV. Llevar un registro interno de los activos inventariables asignados a la Secretaría y vigilar su actualización conforme a la información que le proporcionen los responsables de los resguardos;\nVI. Integrar y validar los anteproyectos presupuestales de las unidades administrativas de la Secretaría y someterlos a la consideración del Secretario;\nVII. Administrar el fondo revolvente asignado a la Secretaría y, transferir o ministrar, en su caso, los recursos de éste, a las unidades administrativas autorizadas por el\nTitular de la Secretaría, para su ejercicio directo;\nVIII. Controlar, conforme a la disponibilidad financiera y las solicitudes recibidas, el ejercicio del presupuesto que tengan asignado las unidades administrativas de la\nSecretaría;\nIX. Revisar las conciliaciones bancarias correspondientes a las cuentas que tenga asignadas, en materia de su competencia;\nX. Proporcionar a la Unidad de Transparencia la información que emane y se derive del de la página electrónica de la Secretaría, de tal forma que permita su fácil identificación, acceso y consulta por particulares, así como la obligatoriedad de dar\nAcceso a la Información Pública y la legislación local en la materia; y\nXI. Las demás que le confiera el Secretario, así como las disposiciones legales o reglamentarias aplicables.\nArtículo 27.- La Coordinación de Evaluación y Seguimiento, tendrá las siguientes atribuciones:\nI. Establecer las políticas para la planeación de los programas, obras y acciones que ejecute la Secretaría; así como vigilar su adecuada alineación estratégica al Plan\nNacional de Desarrollo, Plan Estatal de Desarrollo, Programas Sectoriales y\nEspeciales;\nII. Participar en la elaboración, aplicación y evaluación de los programas a cargo de la\nSecretaría;\nIII. Proporcionar la información o la cooperación que les sean requeridas por otras dependencias de la administración pública estatal, previo acuerdo con el Secretario;\nIV. Coordinarse con las dependencias y entidades de las administraciones públicas federal, estatal y municipal, en materia de planeación seguimiento y evaluación de programas enfocados al desarrollo rural;\nV. Elaborar, integrar y evaluar el Programa Sectorial a cargo de la Secretaría, así como llevar el seguimiento y coordinación de las reuniones del Subcomité Sectorial;\nVI. Integrar y elaborar el programa operativo general y el programa operativo anual de la\nSecretaría para el ejercicio fiscal correspondiente, así como el de la Coordinación y auxiliar a las demás unidades presupuestales de la Secretaría en la elaboración de sus planes de trabajo, así como establecer las estrategias para su evaluación y seguimiento;\nVII. Definir y establecer mecanismos de planeación que permitan llevar un seguimiento y evaluación física-financiera de los programas y proyectos que ejecuta la Secretaría de Desarrollo Rural, con los recursos que a ella se le asignen;\nVIII. Supervisar y evaluar el desarrollo y el resultado de programas a cargo de la\nSecretaría, así como proponer modificaciones a las estrategias, programas, proyectos, y acciones para el fomento productivo del sector;\nIX. Vigilar, controlar y evaluar el ejercicio del presupuesto autorizado a la Secretaría, en conjunto con la Coordinación Administrativa de los recursos aplicados y ejercidos con el objeto de reorientar metas estratégicas a través de informes emitidos por ésta;\nX. Promover y concertar el desarrollo de proyectos conjuntos de coinversión entre el sector privado y el sector público, encaminados a la modernización y desarrollo del sector;\nXI. Coordinar e integrar los estudios y expedientes técnicos que respalden la viabilidad de los proyectos a cargo de la Secretaría;\nXII. Dar seguimiento a los acuerdos concertados entre la Secretaría y las dependencias y entidades de las administraciones públicas federal, estatal y municipal, así como con las organizaciones de productores, con la finalidad de evaluar los resultados obtenidos y en su caso, redireccionar las acciones programadas;\nXIII. Integrar las autorizaciones, aprobaciones y modificaciones presupuestales de inversión de los programas federales y estatales, así como de los programas que ejecute la Secretaría;\nXIV. Elaborar los informes mensuales sobre el seguimiento y avance físico-financiero de los programas a cargo de la Secretaría, así como la integración del cierre presupuestal anual;\nXV. Elaborar el informe anual de las actividades, proyectos y programas a cargo de la\nSecretaria;\nXVI. Desarrollar el Plan Anual de Tecnologías de la Información de la Secretaría, en el marco del Programa de Modernización Gubernamental, privilegiando la mejora y sistematización de procesos;\nXVII. Administrar los sistemas, servicios y herramientas en materia de tecnología informática, a fin de ser utilizadas en el cumplimiento de los objetivos para los cuales fueron adquiridas o desarrolladas;\nXVIII. Establecer mecanismos y procesos de recopilación, integración, análisis e interpretación de información y datos estadísticos derivados de las acciones, obras y programas que ejecutan las unidades administrativas de la Secretaría, para facilitar la toma de decisiones;\nXIX. En materia de su competencia, participar en la elaboración, difusión y actualización\nXX. Proporcionar a la Unidad de Transparencia la información que emane y se derive del de la página electrónica de la Secretaría, de tal forma que permita su fácil identificación, acceso y consulta por particulares, así como la obligatoriedad de dar\nAcceso a la Información Pública y la legislación local en la materia; y\nXXI. Las demás que las disposiciones legales y reglamentarias le atribuyan, así como las que le confiera el Secretario.\nCAPÍTULO VIII\nDE LAS UNIDADES DE APOYO\nArtículo 28.- La Secretaría Ejecutiva tendrá las siguientes atribuciones:\nI. Acordar la agenda del Secretario;\nII. Apoyar al Secretario en la atención y control de los asuntos que le encomiende;\nIII. Tramitar los asuntos que le competan y desempeñar las comisiones que le encomiende el Secretario, así como elaborar un análisis de las mismas con el objeto de coadyuvar con las funciones de la Secretaría;\nIV. Organizar y turnar la información a las distintas áreas que conforman la Secretaría, y dar seguimiento de los asuntos relacionados con su gestión;\nV. Dar seguimiento a los acuerdos tomados en las reuniones de trabajo del Secretario;\nVI. Supervisar el desahogo de los asuntos atendidos directamente por el Secretario, que por su importancia requieren de atención urgente y extraordinaria;\nVII. Formular el informe mensual de los asuntos recibidos, despachados y pendientes, así como el avance en la atención y resolución de los asuntos de su competencia;\nVIII. Supervisar y coordinar las actividades del personal adscrito a la Oficina del\nSecretario;\nIX. En colaboración con la Coordinación Administrativa de la Secretaría, atender y verificar el pronto y oportuno suministro de los recursos materiales, humanos, financieros e informativos que solicite el Secretario; y\nX. Las demás que las disposiciones legales y reglamentarias le atribuyan, así como las que disponga el Secretario.\nArtículo 29.- La Secretaría Técnica tendrá las siguientes atribuciones:\nI. Atender las acciones de apoyo técnico y asesoría que le encomiende expresamente el Secretario;\nII. Llevar el seguimiento del debido cumplimiento de los acuerdos e instrucciones que le encomiende el Secretario;\nIII. Mantener informado al Secretario de la situación que guarda el cumplimiento de los compromisos y acuerdos institucionales que le fueran instruidos;\nIV. Verificar la realización de los programas y acciones que expresamente señale el\nSecretario;\nV. Recabar, de las demás áreas que integran la Secretaría, información actualizada sobre el cumplimiento de las metas y objetivos logrados, para el conocimiento del\nSecretario;\nVI. Coordinar, analizar, supervisar, autorizar y emitir la opinión sobre los proyectos, turnados;\nVII. Proporcionar a la Unidad de Transparencia la información que emane y se derive actualización de la página electrónica de la Secretaría, de tal forma que permita su fácil identificación, acceso y consulta por particulares, así como la obligatoriedad materia; y\nVIII. Las demás que las disposiciones legales y reglamentarias le atribuyan, así como las que disponga el Secretario.\nArtículo 30.- El Enlace Institucional tendrá las siguientes atribuciones:\nI. Elaborar informes e investigaciones sobre temas específicos que sean solicitados por el Secretario;\nII. Coordinar la elaboración de estadísticas e información general que requiera el\nSecretario;\nIII. Elaborar documentos informativos para las giras de trabajo del Secretario;\nIV. Proponer al Secretario acciones y proyectos que favorezcan el desarrollo e incremento de la productividad y rentabilidad económica del campo;\nV. Apoyar al Secretario en la coordinación de acciones con instancias externas u otras dependencias y entidades de la administración pública estatal;\nVI. Proporcionar a la Unidad de Transparencia la información que emane y se derive del ejercicio de sus funciones y dentro del ámbito de su competencia para actualización de la página electrónica de la Secretaría, de tal forma que permita su fácil identificación, acceso y consulta por particulares, así como la obligatoriedad de dar cumplimiento a los mecanismos establecidos en la Ley General de Transparencia y\nAcceso a la Información Pública y la legislación local en la materia; y\nVII. Las demás que le confieran otras disposiciones legales y reglamentarias, así como las que le atribuya el Secretario.\nArtículo 31.- La Unidad de Transparencia tendrá las atribuciones que le confieran la Ley\nGeneral de Transparencia y Acceso a la Información Pública y la legislación local en la materia.\nCAPÍTULO IX\nDE LAS DIRECCIONES DE REGIÓN DE DESARROLLO RURAL\nArtículo 32.- Las Direcciones de Región de Desarrollo Rural en los Municipios de Hecelchakán, Champotón, Palizada, Escárcega, Calakmul, Hopelchén, Candelaria, Calkiní, Campeche y\nCarmen tendrán las siguientes atribuciones:\nI. Llevar en forma ágil y oportuna los servicios y apoyos que proporciona la Secretaría hasta los productores, así como atender sus demandas en sus lugares de origen;\nII. Promover la participación activa y conjunta de los agentes económicos y sociales involucrados en el desarrollo rural;\nIII. Coordinar las acciones que se requieran en los diferentes sectores para fortalecer sostenido, diversificando gradualmente las actividades del medio rural;\nIV. Programar las acciones institucionales y sectoriales e identificar para ello las necesidades del sector, así como los proyectos productivos, para atender con mayor productiva de acuerdo a sus características regionales, técnicas y sociales, garantizándoles calidad y oportunidad en los apoyos institucionales;\nV. Proporcionar a la Unidad de Transparencia la información que emane y se derive del de la página electrónica de la Secretaría, de tal forma que permita su fácil identificación, acceso y consulta por particulares, así como la obligatoriedad de dar\nAcceso a la Información Pública y la legislación local en la materia; y\nVI. Las demás que les atribuyan otras disposiciones legales y reglamentarias, así como las que le confiera el Secretario.\nCAPÍTULO X\nDE LA SUPLENCIA DE LOS TITULARES\nArtículo 33.- El Secretario será suplido en sus ausencias temporales o accidentales no mayores de quince días por el servidor público subalterno que para tal efecto designe, previo informe al Gobernador del Estado; si la ausencia excede de este término, el Secretario deberá someter a la consideración del Ejecutivo la designación del servidor público que cubra la ausencia. En caso de que la ausencia, por el motivo que fuere, se convierta en definitiva, entretanto se nombra al nuevo titular de la dependencia, el Gobernador del Estado designará al servidor público que con carácter de Encargado del Despacho lo sustituya.\nArtículo 34.- Las ausencias temporales y accidentales de los subsecretarios serán suplidas por los directores de área que de ellos dependan, conforme lo disponga el Secretario.\nArtículo 35.- Las ausencias temporales y accidentales de los titulares de las Direcciones, Subdirecciones y Jefaturas de Departamento serán suplidas por los servidores públicos del nivel jerárquico inmediato inferior que de ellos dependan, conforme lo disponga el Secretario.\nArtículo 36.- Las ausencias temporales y accidentales de los demás servidores públicos de la\nSecretaría se suplirán conforme lo disponga su superior jerárquico inmediato, previa consulta al\nCoordinador Administrativo.\nArtículo 37.- Las ausencias definitivas de cualquiera de los servidores públicos de la Secretaría se suplirán con un nuevo nombramiento.\nCAPÍTULO XI\nINTERPRETACIÓN\nArtículo 38.- En los casos no previstos en este Reglamento, y en caso de presentarse alguna controversia sobre la interpretación y/o aplicación de su contenido, el Secretario resolverá lo conducente.\nTRANSITORIOS\nPrimero.- El presente Reglamento entrará en vigor al día siguiente de su publicación en el\nPeriódico Oficial del Estado.\nSegundo.- Se abroga el Reglamento Interior de la Secretaría de Desarrollo Rural publicado en\nTercero.- Se derogan todas las disposiciones legales y reglamentarias de igual o menor jerarquía del marco jurídico estatal, en lo que se opongan al contenido del presente\nReglamento.\nde San Francisco de Campeche, Municipio y Estado de Campeche, a los once días del mes de abril del año dos mil diecisiete.\nLic. Rafael Alejandro Moreno Cárdenas, Gobernador del Estado de Campeche; Ing.\nArmando Constantino Toledo Jamit, Secretario de Desarrollo Rural.- Rúbricas.",
  "ordenamiento": "REGLAMENTO",
  "jurisdiccion": "CAMPECHE",
  "fuente_oficial": "DIARIO OFICIAL DE LA FEDERACION",
  "Fecha de Publicación": "16 de septiembre de 2015",
  "es_escaneado": false,
  "tiene_tablas": false,
  "materia": [
    "administrativo",
    "agrario"
  ]
}