{
  "titulo": "Reglamento Interior del Consejo de la Judicatura del Estado",
  "Contenido": "El Consejo de la Judicatura del Estado de Coahuila de Zaragoza, en sesión celebrada el catorce de agosto cual se aprueba el siguiente:\nTÍTULO PRIMERO\nDISPOSICIONES GENERALES\nCAPÍTULO PRIMERO\nArtículo 1.- El presente ordenamiento tiene como finalidad reglamentar la organización y funcionamiento del Consejo de la Judicatura del Estado, atendiendo a las atribuciones y lineamientos establecidos por la\nPara los efectos del presente Reglamento, se entenderá:\nLEY ORGANICA: Ley Orgánica del Poder Judicial.\nREGLAMENTO: El Reglamento Interior del Consejo de la Judicatura del Estado.\nTRIBUNAL: El Tribunal Superior de Justicia.\nCONSEJO: El Consejo de la Judicatura.\nPLENO DEL CONSEJO: La reunión, para acuerdo de los integrantes del Consejo de la Judicatura.\nPRESIDENTE: Presidente del Tribunal Superior de Justicia del Estado y Presidente del Consejo de la\nJudicatura.\nCONSEJERO(S): Quienes integran el Consejo de la Judicatura.\nSECRETARIO(S): Quienes desempeñan la función de Acuerdos; Estudio y Cuenta.\nPERSONAL OPERATIVO: El demás personal que labora en el Consejo de la Judicatura.\nVISITADURIA: El órgano auxiliar del Consejo de la Judicatura.\nVISITADORES: Visitador Judicial General y Visitadores Judiciales.\nArtículo 2.- Lo no previsto en el presente Reglamento, será materia de Acuerdos generales que emita el\nPleno del Consejo.\nArtículo 3.- El Consejo de la Judicatura estará integrado por seis consejeros, en los términos de los artículos 143 de la Constitución y 56 de la Ley Orgánica. El Presidente del Tribunal Electoral formará parte del Consejo cuando se traten asuntos relativos al Tribunal que preside.\nEl Presidente del Tribunal Superior de Justicia, estará representado en su caso, por el Magistrado\nNumerario que designe. Los Consejeros Magistrado de Tribunal Unitario de Distrito y Juez de Primera\nInstancia serán representados por el respectivo Magistrado Unitario o Juez que tenga mayor antigüedad en el cargo.\nEl Consejero designado por el Ejecutivo, será representado en sus ausencias por el servidor público que a su vez designe.\nDe igual manera, el Congreso del Estado nombrará la persona que represente al Consejero que le corresponde, procurando que reúna el perfil requerido para el titular.\n(REFORMADO, MARTES 14 DE MAYO DE 2002. P.O. NO. 39)\nEl Presidente del Tribunal Electoral estará representado por el Magistrado del citado órgano jurisdiccional de mayor antigüedad al servicio del Poder Judicial del Estado.\n(REFORMADO, MARTES 14 DE MAYO DE 2002. P.O. NO. 39)\nArtículo 4.- El Consejo de la Judicatura es un órgano del Poder Judicial del Estado, que tendrá como funciones la administración, vigilancia y disciplina de los órganos jurisdiccionales, y estará a cargo del desarrollo de la carrera judicial.\nLa administración de las dependencias del Pleno, la Presidencia y las Salas, estará a cargo del Presidente del Tribunal Superior de Justicia.\n(REFORMADO, PRIMER PÁRRAFO, MARTES 14 DE MAYO DE 2002. P.O. NO. 39)\nArtículo 5.- El consejo funcionará en pleno o en comisiones y ejercerá sus atribuciones a través de:\nI.- El Pleno del Consejo;\nII.- El Presidente;\nIII.- Las comisiones del Consejo;\nIV.- Los Consejeros;\nV.-Los Secretarios de Acuerdo y Trámite y de Estudio y Cuenta del Consejo;\nVI.- Los Magistrados y Jueces;\nVII.- La Visitaduría Judicial General;\nVIII.- El Administrador del Fondo;\nIX.- Los demás órganos que se creen para desempeñar las funciones que le correspondan.\nArtículo 6.- Por comisión se entiende la facultad que se da a uno o más consejeros para que realice una o varias actividades. Las comisiones podrán ser colegiadas o unitarias.\nArtículo 7.- En los términos establecidos por el articulo 57 de la Ley: Orgánica, para que el Consejo funcione en pleno, bastará la presencia del Presidente y de la mayoría de sus integrantes.\nLas comisiones del Consejo tendrán el carácter de permanentes o transitorias, y sus facultades se apoyarán en las atribuciones que el Consejo le confiere el artículo 57 de la Ley Orgánica y sólo podrán ser de instrumentación.\nArtículo 8.- Para el cumplimiento de su función, el Consejo ejercerá las atribuciones enumeradas en el artículo 57 de la Ley Orgánica y además tendrá las siguientes:\nI.- Expedir el estatuto del Consejo del Instituto de Especialización Judicial, oyendo la opinión del mismo como lo señala el artículo 143 de la Ley Orgánica;\nII.- Establecer las políticas generales para elaborar el proyecto de presupuesto de egresos de las dependencias del Poder Judicial;\nIII.- Establecer las medidas necesarias para propiciar la carrera judicial;\nIV.-Fijar los criterios de selección de los visitadores judiciales;\nV.- Aprobar la creación, modificación de estructura y desaparición de los órganos de control interno;\nVI.- Administrar el Fondo para el Mejoramiento de la Administración de Justicia;\n(REFORMADO, MARTES 14 DE MAYO DE 2002. P.O. NO. 39)\nVII.- Ejercer la jurisdicción disciplinaria, de acuerdo con lo dispuesto en la Sección Cuarta de la Ley;\nVIII.- (DEROGADO, MARTES 14 DE MAYO DE 2002. P.O. NO. 39)\nIX.- Crear Visitadurías Regionales, conforme lo requiera la administración de justicia;\nX.- Calificar los impedimentos o excusas de sus miembros;\nXI.- Las demás que se deriven de los ordenamientos jurídicos aplicables.\nLos acuerdos del Consejo que se estimen de interés general, podrán publicarse en el Boletín de\nInformación Judicial o en el Periódico Oficial del Estado.\nArtículo 9.- Son atribuciones del Presidente, además de las establecidas en el articulo 14 de la Ley\nOrgánica, las siguientes:\nI.- Representar legalmente al Consejo;\nII.- Tramitar los asuntos de la competencia del Pleno del Consejo;\nIII.- Recibir quejas sobre demoras y faltas en el despacho de los asuntos;\nIV.- Practicar por sí mismo visitas a Salas, Juzgados, y dependencias administrativas y judiciales;\nV.- Presidir el Pleno del Consejo y sus comisiones, dirigir los debates, conservar el orden en las sesiones y llevar la correspondencia del Consejo;\nVI.- Convocar a sesión extraordinaria cada vez que lo estime necesario, o si así lo piden más de tres consejeros;\nVII.- Proponer al Consejo el nombramiento y remoción del Visitador Judicial General y los demás visitadores;\nVIII.- Resolver los asuntos cuya atención no admita demora, dando cuenta al Consejo en la siguiente sesión;\nIX.- Conceder licencias con o sin goce de sueldo, cuando no excedan de quince días a los servidores\nX.- Celebrar acuerdos y convenios, previo consentimiento del Consejo, con instituciones públicas o privadas para la mejor administración de justicia, y;\nXI Firmar las resoluciones, acuerdos y actas del Pleno del Consejo, conjuntamente con los demás consejeros que integran el Pleno del Consejo y legalizar, por sí o por conducto del secretario que al efecto designe, la firma de los servidores públicos del Consejo de la judicatura en los casos que la ley exija este requisito;\nXII.- Las demás que determinen las leyes, este reglamento y los acuerdos generales del Pleno del\nConsejo.\nArtículo 10.- Son facultades y obligaciones de los Consejeros:\nI.- Proponer y ejecutar, en el ámbito de su competencia, las medidas necesarias para el pronto y expedito despacho de los asuntos que le sean encomendados;\nII.- Rendir al Consejo, por conducto de la Secretaría, un informe de actividades en que hubieran intervenido;\n(REFORMADA, MARTES 14 DE MAYO DE 2002. P.O. NO. 39)\nIII.- Instruir el procedimiento de responsabilidad administrativa y formular el proyecto de resolución que corresponda, cuando sean comisionados para ello actuando, en estos casos, asistido del secretario del propio Consejo;\n(REFORMADA, MARTES 14 DE MAYO DE 2002. P.O. NO. 39)\nIV.- Participar, en su caso, en la aplicación de los exámenes de mérito para la integración de la lista de reserva o para la designación de Magistrados Unitarios y Jueces;\nV.- Coadyuvar en las revisiones correspondientes a las actas de visita efectuadas a las Salas, Tribunales\nUnitarios y Juzgados del Estado, cuando sea comisionado para ese efecto;\nVI.- Participar en todas y cada una de las sesiones ordinarias y extraordinarias celebradas por el Pleno del\nConsejo, analizando, discutiendo y aprobando los acuerdos que este tome, o emitiendo su voto particular en los casos en que no estuviera conforme con las resoluciones de la mayoría de los consejeros, el cual deberá razonar;\nVII.- Someter a la consideración del Pleno del Consejo, los asuntos que, por su naturaleza, considere que deban ser resueltos por dicho órgano;\nVIII.- Participar en la elaboración y revisión de los reglamentos, reformas y acuerdos que emita el Pleno;\nIX.- Representar al Presidente en los eventos cuya atención le encomiende de el mismo;\nXI.- Las demás que le confieran la Ley Orgánica y demás disposiciones legales aplicables.\nArtículo 11.- Para realizar las actividades que le competen, el Consejo tendrá un Secretario de Acuerdo y\nTrámite, un Secretario de Estudio y Cuenta y los órganos y personal auxiliar que se requieran para eficientar el cumplimiento de los objetivos para los que se creó, quienes que serán designados y removidos, a propuesta del Presidente.\nArtículo 12.- Los órganos auxiliares del Consejo tienen como función dar un tratamiento eficaz a los asuntos que les corresponden.\nArtículo 13.- Para el desempeño de sus funciones, los consejeros, incluyendo al Presidente, se auxiliarán del personal de apoyo operativo adscrito a la Presidencia del Tribunal Superior de Justicia y del adscrito a la Oficialía Mayor; así como del que autorice el Presupuesto de Egresos.\nArtículo 14.- Los servidores públicos operativos y de estructura de las áreas que se creen para que el\nConsejo cumpla sus atribuciones, serán designados por el Pleno del Consejo.\nArtículo 15.- Para ser Secretario de Acuerdo y Trámite ó Secretario de Estudio y Cuenta del Consejo, se requiere:\nI.- Ser ciudadano mexicano por nacimiento, en pleno ejercicio de sus derechos civiles y políticos;\nII.- No tener más de 65 años de edad, ni menos de 21, el día de la designación;\nIII.- Tener título oficial de abogado;\nIV.- Gozar de buena reputación y no haber sido condenado por delito intencional que amerite pena corporal de más de un año de prisión; pero si se tratare de delitos patrimoniales ú otro que lastime la buena fama en concepto público, inhabilitará para el cargo cualquiera que haya sido la pena; y\nV.- Sustentar y aprobar el examen de méritos.\nCAPÍTULO SEGUNDO\nDEL PLENO DEL CONSEJO\nArtículo 16.- El Consejo sesionará cuando menos una vez al mes en forma ordinaria, y en forma extraordinaria cuando se convoque por el Presidente o por más de tres de sus miembros. Las sesione serán privadas y por excepción serán públicas cuando lo determine el Consejo.\nArtículo 17.- En cada sesión se desahogarán todos los puntos contenidos en el orden del día y en caso de quedar algún punto pendiente, será tratado en la siguiente sesión; quedando como resueltos aquellos que hubieren sido aprobados.\nArtículo 18.- Tanto las sesiones ordinarias como las extraordinarias, serán presididas por el Presidente del Consejo, o por quien lo supla en su ausencia temporal o por excusa.\nArtículo 19.- El Consejo nunca podrá sesionar sin la presencia del Presidente o de quien lo supla legalmente.\nArtículo 20.- Los consejeros deberán asistir a las sesiones públicas o privadas que se convoquen, salvo causa justificada de inasistencia.\nArtículo 21.- Los acuerdos del Consejo se tomarán por mayoría de los votos de los consejeros presentes.\nCuando haya empate, tendrá calidad el sentido en que haya votado el Presidente.\nArtículo 22.- A los consejeros corresponde desempeñar unitaria o colegiadamente, las comisiones que les sean encomendadas, pudiendo formar parte simultáneamente de diversas comisiones.\nCAPÍTULO TERCERO\nDE LOS CONSEJEROS\nArtículo 23.- Cuando un consejero actuando en colaboración con la Presidencia, o de su propio criterio, sea ponente en los asuntos que deba resolver el Pleno, deberá remitir a cada uno de los demás consejeros, una copia de los proyectos de resolución, con dos días de anticipación pop lo menos, a la fecha de la sesión en la que los presentará, la que formará parte del orden del día.\nArtículo 24.- Cuando algún consejero advierta que hay contradicción de criterios generales sustentados por otros consejeros en asuntos similares, someterá a la consideración del Pleno el punto para que este determine el criterio prevaleciente.\nArtículo 25.- Las ausencias temporales de los consejeros serán cubiertas en los términos del artículo 4° de este Reglamento.\n(ADICIONADO, MARTES 14 DE MAYO DE 2002. P.O. NO. 39)\nCAPÍTULO TERCERO BIS\nDEL COMITÉ CONSULTIVO\n(ADICIONADO, MARTES 14 DE MAYO DE 2002. P.O. NO. 39)\nArtículo 25 A.- El comité Consultivo del Consejo, es un órgano honorífico, de opinión y de consulta, Superior.\nSe integrará por cinco abogados de reconocido prestigio en el Estado, designados por el Pleno del\nConsejo que durarán en su encargo tres años.\nLos Colegios, Barras y Asociaciones de Abogados con registro en el Tribunal Superior de Justicia, podrán presentar una propuesta de candidatos para desempeñar la función en el Comité Consultivo. del Tribunal y del Consejo, por lo menos dos veces al año.\nArtículo 25 B.- El Consejo de la Judicatura podrá crear comisiones interinstitucionales y ciudadanas en el\nComité Consultivo, para emitir su opinión sobre los asuntos que acuerde el Pleno del Tribunal o del el Consejo de la Judicatura.\nCAPITULO CUARTO.\nESTUDIO Y CUENTA\nSECCIÓN PRIMERA.\nREGLAS GENERALES\nArtículo 26.- El Secretario de Acuerdo y Trámite del Consejo, dirigirá las labores de la oficina en el orden administrativo conforme a las instrucciones que por acuerdo del Consejo y del Presidente le sean giradas.\nArtículo 27.- La Secretaría contará con el personal de apoyo y técnico operativo que para el cumplimiento de sus funciones le asigne el presupuesto respectivo.\nArtículo 28.- Al Secretario de Acuerdo y Trámite le corresponde:\n(REFORMADA, MARTES 14 DE MAYO DE 2002. P.O. NO. 39)\nI.- Dar fe de los actos del Pleno, del Presidente y de los Consejeros, en el ejercicio de sus atribuciones y en sus respectivas competencias, y autorizar con su firma el documento de que se trate.\n(REFORMADA, MARTES 14 DE MAYO DE 2002. P.O. NO. 39)\nII.- Asistir al Presidente o al Consejero comisionado, en la instrucción de los procedimientos de responsabilidad administrativa, hasta ponerlos en estado de resolución, cuando la jurisdicción disciplinaria la ejerza el Consejo en los asuntos que le competa conocer.\nIII.- Asentar en los expedientes las certificaciones que le sean ordenadas.\n(REFORMADA, MARTES 14 DE MAYO DE 2002. P.O. NO. 39)\nIV.- Dar cuenta al Presidente, dentro las veinticuatro horas siguientes a su recepción, con los asuntos que le competa conocer.\nV.- Expedir las copias simples o certificadas que le sean ordenadas.\nVI.- Cuidar que los expedientes sean debidamente foliados, sellados y rubricados, identificándolos con el número estadístico que le corresponda de cada año.\nVII.- Ordenar y vigilar que se despachen sin demora los asuntos y la correspondencia del Consejo, y el desahogo de los oficios que se manden girar previo decreto.\nVIII.- Ejercer bajo su responsabilidad, por sí mismo o por conducto de los servidores subalternos de la\nSecretaría, la vigilancia que sea necesaria, para evitar la pérdida ó extravío de expedientes.\nIX.- Hacer llegar, en su caso, los asuntos en estado de resolución al consejero ponente, a quien el\nConsejo encomiende la elaboración del proyecto.\nX.- Efectuar las notificaciones ordenadas por el Pleno del Consejo o por el Presidente, conforme a las normas y términos que marca la ley.\nXI.- Recibir y registrar los requerimientos relacionados con los juicios de amparo que se promuevan proceda.\nXII.- Llevar los libros de registro que acuerde el Consejo.\nXIII.- Las demás que determinen las leyes y las que le sean asignadas por el Presidente del Consejo o el\nPleno.\nArtículo 29.- Los Secretarios de Estudio y Cuenta proyectarán bajo la más absoluta reserva, las resoluciones que les encomiende el Pleno del Consejo, su Presidente, o el consejero comisionado para elaborar el proyecto, previo estudio que se haga del asunto. Para tal efecto, se instruirá al secretario que corresponda, sobre los motivos de hecho y de derecho que deben fundar el proyecto de resolución.\nTITULO SEGUNDO\nFUNCIONES DE ADMINISTRACIÓN, VIGILANCIA, DISCIPLINA Y CARRERA JUDICIAL\nCAPITULO UNICO.\nDE LA FUNCIÓN DE ADMINISTRACIÓN DEL CONSEJO.\nArtículo 30.- La función de administración del Consejo tiene como finalidad el manejo de los fondos destinados al Mejoramiento de la Administración de Justicia.\nArtículo 31.- La administración del fondo estará a cargo del Consejo por conducto de su Presidente, como lo dispone el articulo 150 de la Ley Orgánica y su patrimonio se destinará a los fines previstos por el articulo 152 de dicha Ley.\nArtículo 32.- Para el mejor cumplimiento de la administración del fondo, el Consejo contará con un administrador que deberá ser perito en las ciencias administrativas, y tendrá las facultades y obligaciones que señale el Reglamento respectivo.\nTITULO TERCERO.\nFUNCIONES DE VIGILANCIA, DISCIPLINA Y CARRERA JUDICIAL.\nCAPITULO PRIMERO.\nDE LA FUNCIÓN DE VIGILANCIA DEL CONSEJO\nArtículo 33.- Corresponde al Consejo la función de vigilancia judicial en los términos del artículo 119 y administración de justicia, el Consejo ordenará, por conducto del Presidente, que la Visitaduría Judicial\nGeneral ó a quien se le ordene, realice las auditorías especiales o las visitas de inspección ordinarias a las\nSalas del Tribunal, a los Tribunales Unitarios de Distrito, a los Juzgados de Primera Instancia, a los\nArtículo 35.- Cuando a juicio del Presidente sea urgente, ordenará las visitas extraordinarias que sean necesarias, solicitando la colaboración de los Magistrados numerarios y supernumerarios o por medio de la Visitaduría, debiendo informar de ello al Consejo en la sesión más próxima.\n(REFORMADO, MARTES 14 DE MAYO DE 2002. P.O. NO. 39)\nArtículo 36.- El Consejo analizará y, en su caso, aprobará el programa de visitas ordinarias semestrales que presente la Visitaduría, y lo pondrá en ejecución, por conducto de su Presidente.\nArtículo 37.- El Pleno del Consejo, al tener conocimiento de que alguno o varios servidores públicos judiciales o administrativos del Poder Judicial, con excepción de los integrantes del Pleno del Tribunal y de su Presidencia ha cometido alguna presunta falta administrativa, ordenará una visita de inspección, que deberá constreñirse a los hechos consignados en la orden respectiva.\nArtículo 38.- El titular de la oficina o la persona con quien se entienda la diligencia, y las demás personas que laboren en la misma, están obligados a dar las facilidades e información que requiera quien efectúe la visita para que pueda practicar la inspección adecuada. En caso de que no es dieren las facilidades al visitador, éste lo hará del conocimiento del Consejo, por conducto del Presidente, para acordar lo procedente.\n(REFORMADO, MARTES 14 DE MAYO DE 2002. P.O. NO. 39)\nArtículo 39.- En la práctica de las visitas ordinarias, se observarán las reglas contenidas en el artículo\n122A de la Ley Orgánica; y las siguientes:\n(REFORMADA, MARTES 14 DE MAYO DE 2002. P.O. NO. 39)\nI.- El visitador, o quien practique la inspección, verificará que los órganos jurisdiccionales con competencia en materia civil y familiar, lleven los registros de sanciones impuestas a las partes, en los términos previstos por el cuarto párrafo del artículo 12 del Código Procesal Civil, y que en el libro correspondiente se contengan los datos que precisa la citada disposición legal.\n(REFORMADA, MARTES 14 DE MAYO DE 2002. P.O. NO. 39)\nII.- Al realizar la inspección, el servidor público que la realice, verificará el cabal cumplimiento con los órganos jurisdiccionales hayan dando a lo dispuesto por los artículo 239, 240 y 244 a Ley Orgánica, Administración De Justicia, para efectos administrativos.\nIII.- En el acta de visita se asentará:\na).- Lugar y fecha en que se realice, así como la hora de inicio y conclusión.\nb).- Nombre y apellidos de la persona con quien se entienda y, el carácter que ostenta, así como de quienes intervengan en la diligencia.\nc).- La firma, al margen y al calce, de quienes en ella hayan intervenido.\nIV.- El visitador podrá hacer las observaciones generales que estime pertinente y asentará las que el titular de la dependencia formule. En caso de que no desee manifestar cuestión alguna, así se asentará en el acta.\nV.- En el acta se harán constar las irregularidades que se observen, consignando los puntos, así como las explicaciones, aclaraciones y fundamentos que exponga la persona con quien se entienda la visita.\nSi como resultado de la visita, a juicio del Pleno del Consejo se requiere que el titular de la dependencia inspeccionada o la persona con quien se entendió la visita, rinda un informe acerca de las medidas que instrumentó y de los avances obtenidos, a fin de subsanar las deficiencias advertidas en la visita, se le señalará un plazo de 3 al 10 días como máximo para que lo rinda.\n(REFORMADO, MARTES 14 DE MAYO DE 2002. P.O. NO. 39)\nArtículo 40.- En las visitas a os órganos administrativos o de apoyo judicial, se levantará el acta correspondiente al estado en que se encuentre, observándose en lo conducente, las reglas a que se refiere el artículo anterior. Con el acta se dará cuenta al Consejo, por conducto del Presidente.\n(REFORMADO, MARTES 14 DE MAYO DE 2002. P.O. NO. 39)\nArtículo 41.- Las visitas tendrán, además, por objeto que el Consejo se entere del estado de conservación o deterioro de las instalaciones que ocupa la dependencia visitada, para proveer lo conducente a fin de lograr su mejoría o mantenimiento propio del adecuado marco de dignidad y decoro que demanda la administración de justicia.\n(REFORMADO, MARTES 14 DE MAYO DE 2002. P.O. NO. 39)\nArtículo 42.- El registro de las visitas ordinarias y extraordinarias efectuadas, lo hará el Secretario del\nConsejo, y dará cuenta de ello al Pleno del mismo.\nCAPITULO SEGUNDO.\nDE LA JURISDICCIÓN DISCIPLINARIA.\nSECCION PRIMERA.\nREGLAS GENERALES PARA LA SUSTANCIACION DE LOS PROCEDIMIENTOS DISCIPLINARIOS.\nArtículo 43.- El procedimiento administrativo disciplinario tiene por objeto analizar los hechos imputados a la autoridad que constituyan una falta, sin establecer una relación directa con el quejoso, sino únicamente entre la autoridad señalada como responsable y el Consejo de la Judicatura.\nArtículo 44.- La jurisdicción disciplinaria que ejerza el Consejo, tendrá como propósito determinar, en su integrantes del Pleno del Tribunal y de la Presidencia, y se sustanciará observando las formalidades esenciales establecidas en el articulo 204 de la Ley Orgánica y con las reglas específicas que se señalan en este reglamento.\nArtículo 45.- El escrito de queja deberá contener:\nI.- Nombre del quejoso y domicilio para oír y recibir notificaciones, en el lugar en que se trámite el procedimiento disciplinario, y en su caso, la autorización a persona de confianza, preferentemente profesional del derecho, para que oiga notificaciones en su nombre.\nII.- Datos bastantes para la identificación del Servidor Público judicial contra quien se interpone, así como el lugar donde desempeña su función.\nIII.- Los hechos concretos y la conducta o conductas que se estimen constitutivas de la falta o faltas; y\nIV.- Las pruebas con las que se estima se acreditan la falta o faltas atribuidas al servidor público de que se trate, relacionándolas con los hechos y la conducta o conductas que se le imputan; y en su caso acompañando los documentos que se ofrezcan con tal carácter, o el escrito, con acuse de recibo, mediante el que se solicitaron a la autoridad correspondiente. quejoso para que la aclare dentro de los tres días siguientes; de no subsanarse la falta de domicilio, todas las notificaciones se le harán por estrados, y la falta de identificación del servidor público judicial contra quien se presente la queja, tendrá como consecuencia su improcedencia.\nSi la queja no reúne los requisitos de las fracciones III y IV de este artículo, será declarada improcedente.\nArtículo 46.- La queja se presentará ante la Secretaría del Consejo, la que asentará razón de la fecha y hora en que se reciba, así como de los documentos que se anexen.\n(REFORMADO, MARTES 14 DE MAYO DE 2002. P.O. NO. 39)\nSólo producirá efectos la queja que sea ratificada dentro de las setenta y dos horas siguientes a su presentación, ante la Secretaría, quien le dará trámite, asignándole el número de identificación que corresponda y dará cuenta al Presidente para que en la sesión inmediata posterior, el Consejo resuelva si la misma reúne los requisitos legales de procedencia, a efecto de que pueda ser radicada e instaurada el procedimiento, en caso contrario será declarada improcedente.\nArtículo 47.- Si la queja fuere procedente, el Consejo ordenará correr traslado al funcionario de que se, trate, con copia de la misma, para que rinda informe por escrito dentro del término de cinco días; señalándose lugar, día y hora para la celebración de la audiencia de pruebas y alegatos.\nEl Consejo podrá designar al Presidente para instruir la causa, o comisionar a uno de sus miembros o\nSecretarios para que instruya el proceso, hasta ponerlo en estado de resolución de la que podrá presentar un proyecto.\n(ADICIONADO, MARTES 14 DE MAYO DE 2002. P.O. NO. 39)\nSon causas de improcedencia, cuando de los hechos o las pruebas que se presentan, se acredite que se trata de un asunto de carácter jurisdiccional; cuando se hubieren ejecutado actos posteriores de los que se infiera la aceptación o conformidad con el que se estime constitutivo de queja; o cuando hubieren transcurrido tres años desde la fecha del acto que se estima causa agravio.\nLa resolución de improcedencia, será pronunciada por el órgano a quien corresponda resolver el fondo, la que podrá dictar en cualquier momento del procedimiento.\nArtículo 48.- En el ofrecimiento y desahogo de las pruebas se observarán las siguientes reglas:\nI.- La carga de la prueba la tiene quien presenta la queja, la que será declarada desierta si es el quejoso quien ofrece las pruebas y no las exhibe a más tardar en la audiencia relativa;\nII.- La pruebas deberán de ofrecerse en el escrito inicial de queja y en el informe que rinda la autoridad, relacionándolas con los hechos que se imputan o contestan;\nIII.- Cuando se ofrezca prueba testimonial deberá señalarse el objeto de la misma y citar el nombre y domicilio de los testigos, a efecto de que pueda ser citados oportunamente; o podrán ser presentados por el quejoso en la fecha señalada para la audiencia. Si estuvieren fuera de su control, bajo protesta de decir verdad, lo hará saber con anticipación a la audiencia.\nArtículo 49.- La audiencia de pruebas y alegatos a que se refiere el artículo 206 de a Ley Orgánica, será pública, y por excepción, cuando la naturaleza del asunto lo amerite, será privada; y serán presididas por el Presidente o por quien legalmente lo supla. En ellas se recibirán y desahogarán las pruebas ofrecidas y se formularán alegatos, quedando el procedo en estado de resolución.\nLa inasistencia del quejoso, del servidor público o de ambos, no impedirá la celebración de la audiencia, haciendo constar dicha circunstancia en el acta relativa.\n(REFORMADO, MARTES 14 DE MAYO DE 2002. P.O. NO. 39)\nArtículo 50.- El Consejo, para determinar la procedencia o improcedencia de la queja podrá ordenar, para mejor proveer, la práctica de las diligencias que estime necesarias.\nAsimismo, en cualquier tiempo antes de pronunciarse la resolución que proceda, el Consejo podrá decretar pruebas para mejor proveer.\nArtículo 51.- El Presidente o quien el designe, atenderá al público, tratándose de quejas que por comparecencia se presenten contra servidores públicos de la administración de Justicia, de la cual se levantará acta circunstanciada por la Secretaría.\nArtículo 52.- La acumulación procederá cuando se sustancien varias quejas contra el mismo servidor público, ya sean por un mismo hecho o hechos diferentes, hasta antes de pronunciarse sentencia; sin que pueda imponerse sanción de la misma naturaleza por una misma conducta.\nArtículo 53.- Lo no previsto en este reglamento en cuanto al Procedimiento Administrativo Disciplinario, se regulará por el Código de Procedimientos Penales del Estado.\nSECCION SEGUNDA.\nDE LAS RESOLUCIONES.\nArtículo 54.- En el procedimiento administrativo disciplinario no se instaurarán incidentes de ninguna naturaleza.\nEn contra de las sentencias que se pronuncien no procede recurso ordinario.\nArticulo 55.- En los casos de excitativa de justicia a que se refiere el articulo 202 de la Ley, la promoción\nTribunal; si fuere procedente la excitativa se hará del conocimiento de la autoridad correspondiente.\nArtículo 56.- Las quejas y los procedimientos de oficio serán resueltas por el Pleno del Consejo. En su caso, los expedientes podrán ser turnado a los consejeros a quienes el Pleno encomiende la elaboración del proyecto de resolución.\nLas resoluciones del Pleno del Consejo, constarán en acta y deberán firmarse por los consejeros intervinientes, ante la presencia del Secretario del Consejo que dará fe. Los consejeros no podrán la discusión del asunto de que se trate. El Pleno del Consejo, calificará los impedimentos de sus miembros, siempre que fueren planteados en asuntos de su competencia.\nArtículo 57.- Quien formule un proyecto de Sentencia lo expondrá en la sesión siguiente y si es aprobado lo firmarán los que hubieren asistido, por ante el Secretario que dará fe. La resolución tendrá el carácter de Cosa Juzgada.\nEn caso de que se hagan observaciones se ajustarán a las mismas y en la próxima sesión se presentará el nuevo proyecto.\nSi es aprobado lo signarán los integrantes del Consejo que hubiesen acudido y fueran mayoría, teniendo los efectos ya mencionados.\nSi nuevamente es objetado, se designará un nuevo consejero para que en la sesión inmediata posterior presente un proyecto, por una sola vez, pasando a votación el proyecto de resolución y aprobado por mayoría tendrá efectos de sentencia.\nArtículo 58.- Las resoluciones.del Consejo se darán a conocer al Pleno de Tribunal Superior de Justicia, para los efectos legales a que haya lugar.\nArtículo 59.- Las resoluciones en las que se determine la responsabilidad del servidor público emitidas por el Consejo, se remitirán ala Oficialía Mayor del Tribunal, para la integración de los expedientes personales correspondientes.\nArtículo 60.- Las resoluciones dictadas por el Consejo, serán notificadas personalmente. Se practicarán en días y horas hábiles, de nueve a quince horas y de diecisiete a diecinueve horas, sin perjuicio de que el\nConsejo, en casos urgentes, habilite días y horas.\nLas notificaciones personales surtirán efecto el mismo día en que se practiquen.\n(REFORMADO, MARTES 14 DE MAYO DE 2002. P.O. NO. 39)\nArtículo 61.- Los casos previstos en el artículo 52 se resolverán conjuntamente observándose, en su caso, las reglas del concurso.\nArtículo 62.- Corresponde a la Secretaría, realizar todos los trámites tendientes a la ejecución de las resoluciones.\nCAPITULO CUARTO.\nDEL DESARROLLO DE LA CARRERA JUDICIAL.\nArtículo 63.- El desarrollo de la carrera judicial se regirá por los principios de excelencia, objetividad, imparcialidad, profesionalismo, independencia, y honorabilidad en los términos señalados por el artículo\nArtículo 64.- El Consejo promoverá lo necesario para la institucionalización de la carrera judicial.\nArtículo 65.- Las condiciones para el ingreso, formación, permanencia, ascenso y retiro del personal de servicio de la Administración de Justicia, se sujetarán a las bases contenidas en el articulo 62 de la Ley\nOrgánica.\nArtículo 66.- Para el desarrollo de la carrera judicial, el Pleno del Consejo observará las disposiciones generales conducentes, contenidas en el Título Cuarto, Capítulo II, de la Ley Orgánica.\nArtículo Primero.- Este Reglamento entrará en vigor a los tres días posteriores a su publicación en el\nPeriódico Oficial.\nArtículo Segundo.- Publíquese en el Boletín de Información Judicial; así mismo difúndase en los estrados de los Juzgados de la Entidad y demás dependencias administrativas el Acuerdo del Pleno del\nConsejo en el cual se aprobó este ordenamiento.\nEL PRESIDENTE DEL TRIBUNAL SUPERIOR DE JUSTICIA Y DEL CONSEJO DE LA JUDICATURA DEL\nESTADO DE COAHUILA\nMAG. LIC. RAMIRO FLORES ARIZPE\n(RÚBRICA)\nCONSEJERO LlC. OSCAR CALDERÓN SÁNCHEZ\nPROCURADOR GENERAL DE JUSTICIA DEL ESTADO DE COAHUILA\n(RÚBRICA)\nCONSEJERO DIP. LIC. LUIS ALFONSO RODRÍGUEZ BENAVIDES REPRESENTANTE DESIGNADO POR EL H.\nCONGRESO DEL ESTADO.\n(RÚBRICA)\nCONSEJERA MAG. LIC. MARTHA ELENA AGUILAR DURÓN\n(RÚBRICA)\nCONSEJERO JUEZ LIC. ALDO ELlO PEÑA SAENZ\n(RÚBRICA)\nCONSEJERO LIC. INDALECIO MARTÍNEZ RODRÍGUEZ\nNOTARIO DECANO DE LA CAPITAL DEL ESTADO\n(RÚBRICA)\nJUDICATURA DEL ESTADO DE COAHUILA.\nLIC. ANA GUADALUPE GONZÁLEZ SIFUENTES\n(RÚBRICA)\nLA LICENCIADA ANA GUADALUPE GONZÁLEZ SIFUENTES, SECRETARIA DE ACUERDOS DEL CONSEJO DE\nJUDICATURA FUE APROBADO POR UNANIMIDAD DE VOTOS' DE LOS MIEMBROS INTEGRANTES DEL\nCONSEJO DE LA JUDICATURA DEL ESTADQ, MEDIANTE ACUERDO NÚMERO C-192/2000, EN SESIÓN DE\nFECHA CATORCE DE AGOSTO DEL PRESENTE AÑO\nSALTILLO, COAHUILA, A 07 DE SEPTIEMBR DEL 2000.\nN. DE E. A CONTINUACION SE TRANSCRIBEN LOS ARTICULOS TRANSITORIOS DE LOS DECRETOS DE\nREFORMAS A LA PRESENTE LEY.\nArtículo Primero.- Las presentes reformas entrarán en vigor a os tres días posteriores a su publicación en el Periódico Oficial.\nArtículo Segundo.- Publíquese en el Boletín de Información Judicial; así como difúndase en los estrados cual se aprobó ordenamiento.",
  "ordenamiento": "REGLAMENTO",
  "jurisdiccion": "COAHUILA",
  "fuente_oficial": "DIARIO OFICIAL DE LA FEDERACION",
  "Fecha de Publicación": "3 de octubre de 2000",
  "ULTIMA REFORMA PUBLICADA": "14 DE MAYO DE 2002",
  "es_escaneado": false,
  "tiene_tablas": false,
  "materia": [
    "judicial"
  ]
}