{
  "titulo": "Reglamento Interior para el Organismo Público Descentralizado de la Administración Pública Estatal D",
  "Contenido": "denominado “Servicios de Salud de Coahuila”, con fundamento en lo dispuesto por el artículo 7 fracción VII, del Decreto por el que se crea el Organismo, publicado en el Periódico Oficial del\nQue el Plan Estatal de Desarrollo 2005-2011, contempla la justicia social como una de las vertientes estratégicas en la que se tiene como visión, en cuanto a salud se refiere, un Estado de\nCoahuila con una cultura de vida más saludable que cuente con servicios de salud modernos, accesibles para todos, con trato personalizado y atención de calidad. Que la Ley Orgánica de la\nAdministración Pública del Estado de Coahuila de Zaragoza, publicada en el Periódico Oficial del\nGobierno del Estado en fecha 7 de diciembre de 2005, en su artículo noveno transitorio, establece que las dependencias deberán elaborar su reglamento interior en un término de 180 días. Que el\nDecreto publicado en el Periódico Oficial del Gobierno del Estado el 29 de noviembre de 1996, por el que se crea el Organismo Público Descentralizado de la Administración Pública Estatal denominado “Servicios de Salud de Coahuila”, establece que el Órgano Superior de Gobierno del\nOrganismo será la Junta de Gobierno a quien le corresponde conforme a sus atribuciones, la de aprobar el Reglamento Interior. Que conforme al marco normativo que le corresponde ejercer al\nOrganismo, es necesario redefinir la denominación de unidades administrativas y complementar sus atribuciones para contar con un sustento jurídico necesario para su acción, lo que se reflejará en una mayor eficacia en el ejercicio de sus facultades. viernes 15 de septiembre de 2006 PERIODICO OFICIAL En virtud de lo anterior, la Junta de\nGobierno del Organismo Público Descentralizado de la Administración Pública Estatal denominado\n“Servicios de Salud de Coahuila”, ha tenido a bien expedir el siguiente:\nREGLAMENTO INTERIOR PARA EL ORGANISMO PÚBLICO DESCENTRALIZADO DE LA\nADMINISTRACIÓN PÚBLICA ESTATAL DENOMINADO \"SERVICIOS DE SALUD DE\nCOAHUILA\"\nCAPÍTULO PRIMERO\nDISPOSICIONES GENERALES\nARTÍCULO 1.- \"Servicios de Salud de Coahuila\" es un Organismo Público Descentralizado de la\nAdministración Pública Estatal, con personalidad jurídica y patrimonio propio, que tiene por objeto prestar servicios de salud a la población abierta en el Estado, de conformidad con las disposiciones previstas en las leyes General y Estatal de Salud, así como en los términos del Acuerdo de\nCoordinación que para la Descentralización de los Servicios de Salud fue suscrito por los\nGobiernos Federal y Estatal el 20 de agosto de 1996.\nARTÍCULO 2.- El presente Reglamento tiene por objeto establecer las disposiciones a que deberá sujetarse la organización y el funcionamiento del Organismo Público Descentralizado \"Servicios de\nSalud de Coahuila\", mismo que para el adecuado cumplimiento del objeto que se le asigna, así como de las atribuciones que le encomienda el instrumento de su creación, tendrá, además, las que se consignen en este Reglamento y otras disposiciones legales aplicables.\nARTÍCULO 3.-El organismo conducirá sus actividades en forma programada y con estricto apego a derecho, para servir a la comunidad con base en las políticas, estrategias, prioridades y restricciones que para el logro de los objetivos, metas, planes y programas le establezca el Titular del Ejecutivo Estatal, así como en las que determine la Junta de Gobierno del propio Organismo\nEstatal.\nARTÍCULO 4.- El Gobierno y la Administración General del Organismo corresponderá a la Junta de\nGobierno del mismo, la cual estará integrada conforme lo establezcan las disposiciones legales aplicables.\nARTÍCULO 5.- Para los efectos del presente instrumento se entenderá por:\nIII. Organismo, el Organismo Público Descentralizado de la Administración Pública Estatal denominado \"Servicios de Salud de Coahuila\".\nCAPÍTULO SEGUNDO\nLAS ATRIBUCIONES DEL ORGANISMO\nARTÍCULO 6.-Para el debido cumplimiento de su objeto, el organismo tendrá, además de las atribuciones que le confiere su Decreto de creación, las siguientes:\nI. Aplicar, en el ámbito de su competencia, la normatividad general de carácter nacional y, en su caso, internacional, en materia de salud;\nII. Promover en la entidad la difusión y debida observancia del Plan Maestro de Infraestructura\nFísica en Salud para la Población Abierta, así como, en su caso, su actualización;\nIII. Prestar los servicios de salud pública que mediante el acuerdo respectivo la Secretaría descentralice, así como los servicios de carácter local que le confieran las disposiciones legales aplicables y los que le encomiende el Titular del Ejecutivo Estatal, en su caso, de acuerdo con los Planes y Programas Federales, Estatales y Municipales en la materia;\nIV. Administrar, en los términos de las disposiciones aplicables y de conformidad con los lineamientos que establezcan las autoridades competentes, los recursos propios, así como los financieros y materiales que le sean asignados por la Secretaría y el Gobierno del\nEstado;\nV. Operar, conservar, mantener, rehabilitar y, en su caso, ampliar las instalaciones y equipos de su propiedad o de aquellos en que se encuentre en legal posesión;\nVI. Operar en el Estado los Servicios de Salud en las materias de Regulación y Control\nSanitario, conforme a lo dispuesto en la Ley General de Salud, la Ley Estatal de Salud, el\nAcuerdo de Coordinación para la Descentralización Integral de los Servicios de Salud, Reglamentos, Acuerdos, Convenios, Normas y demás disposiciones aplicables en estas materias, así como las que en virtud de convenios y acuerdos sean descentralizadas o transferidas al Estado; y\nVII. Las demás que sean necesarias para el cumplimiento de su objeto y las que le asigne el presente reglamento y otras disposiciones aplicables.\nCAPÍTULO TERCERO\nLA JUNTA DE GOBIERNO DEL ORGANISMO\nARTÍCULO 7.- La Junta de Gobierno del Organismo sujetará su organización y funcionamiento a las disposiciones contenidas en la Ley Orgánica de la Administración Pública del Estado de\nCoahuila, a su decreto de creación y a otras disposiciones aplicables; La Junta de Gobierno estará integrada por\nI. Un presidente que será el Titular del Ejecutivo del Estado\nII. Un presidente Ejecutivo que será el Titular de la Secretaría de Salud\nIII. Un secretario técnico que será el Director General del Organismo y/o quien designe el mismo, quien participará con voz pero sin voto; y\nIV. Por los vocales siguientes:\nA).- El Secretario de Finanzas\nB).- El Secretario de la Función Pública\nC).- El Secretario de Desarrollo Social\nD).- Un Representante de la Secretaría de Salud de la Administración Pública Federal\nE).- Un representante de los Trabajadores que será designado por el Comité Ejecutivo del\nSindicato Nacional de Trabajadores de la Secretaría de Salud.\nF).- Un Comisario que será designado por el Titular de la Secretaría de la Función Pública, que participará con voz pero sin voto. Cada miembro propietario designará a quien deba suplirlo en sus ausencias. Todos los cargos del órgano de gobierno a que se refiere el presente artículo serán honoríficos, por lo que sus titulares no recibirán emolumento alguno por su desempeño. En las sesiones en que se encuentra el presidente, el presidente ejecutivo participará como vocal, y en ausencia del primero quien presidirá la sesión será el presidente ejecutivo. En los demás casos, los suplentes tendrán que ser designados por oficio dirigido al presidente ejecutivo.\nARTÍCULO 8.- El Presidente de la Junta de Gobierno tendrá las atribuciones siguientes:\nI. Presidir las sesiones que celebre la Junta y declarar resueltos los asuntos en el sentido de las votaciones;\nII. Representar a la Junta de Gobierno;\nIII. Vigilar la debida ejecución de los acuerdos y resoluciones que emita la Junta de Gobierno;\nIV. Someter a la consideración de los miembros de la Junta, para su análisis y aprobación, en su caso, los programas de trabajo a desarrollar por la propia Junta;\nV. Convocar a los miembros de la Junta a las sesiones que hayan de celebrarse;\nVI. Someter a votación los asuntos tratados en las sesiones y resolver, en caso de empate, con voto de calidad; y\nVII. Las demás que le confiera el presente Reglamento y otras disposiciones aplicables.\nARTÍCULO 9.- Los vocales de la Junta tendrán las siguientes atribuciones:\nI. Asistir con voz y voto a las sesiones que sean convocadas;\nII. Desempeñar las comisiones que se les asignen, así como integrar los grupos de trabajo que se organicen para la realización de tareas específicas;\nIII. Proponer la realización de programas o estudios que estimen convenientes para el adecuado cumplimiento del objeto del organismo;\nIV. Suscribir las actas de las sesiones a las que asistieren;\nV. Presentar a la Junta los informes que les sean requeridos; y\nVI. Las demás que les confiera el presente Reglamento y otras disposiciones aplicables.\nARTÍCULO 10.- El Secretario Técnico tendrá las atribuciones siguientes:\nI. Asistir a las sesiones que celebre la Junta con voz, pero sin voto;\nII. Someter a la aprobación de los miembros de la Junta el calendario para la celebración de las sesiones;\nIII. Tomar las votaciones de los miembros presentes en las sesiones;\nIV. Elaborar y suscribir, en unión del Presidente y de los vocales que asistieron a las sesiones, las actas correspondientes, así como asentarlas en el libro que para el efecto lleve;\nV. Remitir a los miembros de la Junta, cuando menos con cinco días hábiles de anticipación, las convocatorias, el orden del día y la documentación correspondiente a la sesión a celebrarse; lo anterior tratándose de sesiones ordinarias y de un día natural si se trata de sesiones extraordinarias. Las convocatorias deberán contener el lugar, fecha y hora en que se celebrará la sesión y para las sesiones extraordinarias se indicará además, el asunto específico que las motive;\nVI. Elaborar los proyectos de programas y planes anuales de trabajo que la Junta le encomiende;\nVll. Redactar las comunicaciones oficiales y someterlas a la aprobación del Presidente de la\nJunta;\nVlll. Auxiliar al Presidente de la Junta en la tramitación de todos aquellos asuntos que le encomiende;\nIX. Dar seguimiento puntual a los acuerdos adoptados en las sesiones de la Junta, para informar a la misma de su cumplimiento, trámite ó situación en que se encuentran;\nX. Elaborar y someter a la aprobación de la Junta el informe anual de labores, así como aquellos que en cualquier tiempo, le sean requeridos; y\nXI. Las demás que le confiera el presente Reglamento y otras disposiciones aplicables.\nCAPÍTULO CUARTO\nLAS SESIONES DE LA JUNTA\nARTÍCULO 11.- La Junta de Gobierno, celebrará sesiones ordinarias trimestralmente, así como las extraordinarias que se requieran en cualquier tiempo.\nARTÍCULO 12.- Las convocatorias, así como el orden del día y la documentación que corresponda serán elaboradas por el Secretario Técnico de la Junta, quien deberá remitirlas a los miembros de la misma, conforme a lo dispuesto por la fracción V del artículo 10 de este reglamento. menos:\nI. La lista de asistencia;\nII. Aprobación del acta levantada en la sesión anterior;\nIII. En su caso, informe del Secretario Técnico sobre el avance en la ejecución de los acuerdos emanados de la Junta de Gobierno; y\nIV. Asuntos que serán desahogados en la sesión correspondiente, así como los generales que pudieren presentarse.\nARTÍCULO 13.- En el supuesto de que fuere necesario cancelar la celebración de una sesión, el\nSecretario Técnico deberá comunicar inmediatamente a los miembros de la Junta dicha circunstancia, haciendo de su conocimiento las causas que la motiven.\nARTÍCULO 14.- Las sesiones que celebre la Junta serán válidas cuando el quórum se integre con la mitad más uno de sus miembros, siempre que estuviere presente su Presidente o quien deba sustituirlo.\nLas votaciones de la junta se tomarán por mayoría de votos de los miembros de la junta, teniendo voto de calidad el presidente. Si no se integrare en la fecha señalada en la convocatoria el quórum requerido, se citará para nueva sesión. Tratándose de la celebración de sesiones extraordinarias, las mismas podrán llevarse a cabo con el número de miembros que atendieren la convocatoria.\nARTÍCULO 15.- De cada sesión que celebre la Junta, el Secretario Técnico deberá levantar un acta en la que asentará los asuntos tratados durante ella, así como un extracto de las opiniones vertidas por los miembros de la propia Junta y los acuerdos que tomaren. Las actas deberán numerarse en orden cronológico y serán suscritas, una vez aprobadas, por el Presidente de la\nJunta, los vocales que asistieron a la sesión y por el Secretario Técnico.\nARTÍCULO 16.-El acta a que se refiere el artículo que antecede será sometida a la aprobación, en su caso, del pleno de la Junta de Gobierno en la siguiente sesión.\nARTÍCULO 17.- A las sesiones que celebre la Junta de Gobierno podrán invitarse a todas aquéllas prevea desahogar. Dichos invitados podrán participar con voz, pero sin voto.\nARTÍCULO 18.- La Junta de Gobierno podrá constituir, cuando así lo considere conveniente para el análisis y estudio de asuntos específicos, grupos de trabajo, mismos que serán coordinados operativamente por el Secretario Técnico. Los grupos de trabajo que se integren, una vez concluida su función, desaparecerán.\nCAPÍTULO QUINTO\nDEL DIRECTOR GENERAL\nARTÍCULO 19.-La dirección y el ejercicio del propio Organismo estarán a cargo de un Director\nGeneral cuyo titular será quien desempeñe el cargo de Secretario de Salud en la Entidad, teniendo propio organismo, las siguientes:\nI. Delegar, para una mayor eficacia en el despacho de los asuntos, sin perjuicio de su ejercicio directo, facultades en los servidores públicos responsables dentro del ámbito competencial respectivo;\nII. Resolver los recursos de inconformidad que se interpongan con base en las Leyes General y\nEstatal de Salud, confirmando, modificando o revocando el acto o resolución que se impugne;\nIII. Asistir a las sesiones que celebre la Junta de Gobierno con voz, pero sin voto;\nIV. Ejecutar las políticas del organismo en los términos que determine la legislación aplicable, así como las que defina la Junta de Gobierno del propio organismo en el ámbito de su competencia;\nV. Sustituir las ausencias temporales del Presidente, en las sesiones de la junta y asumir sus atribuciones;\nVI. Someter a la consideración del Titular del Ejecutivo Estatal, por conducto de la Secretaría de\nGobierno, y previo acuerdo de la Junta, los proyectos de iniciativas de leyes, decretos, reglamentos, acuerdos y demás disposiciones que resulten necesarias para el cumplimiento del objeto del organismo;\nVII. Resolver las dudas que se susciten internamente con motivo de la interpretación del presente Reglamento;\nVIII. Nombrar y remover a los servidores públicos del Organismo, así como determinar sus atribuciones, ámbito de competencia y retribuciones con apego al presupuesto aprobado y demás disposiciones aplicables;\nIX. Suscribir los convenios, contratos y demás documentos en representación del organismo; y\nX. Las demás que le confiera otras disposiciones aplicables y las que le asigne la Junta de\nGobierno del Organismo.\nCAPÍTULO SEXTO\nLAS UNIDADES ADMINISTRATIVAS DEL ORGANISMO\nARTÍCULO 20.- Para la eficaz atención de los asuntos de su competencia, el Organismo contará con las siguientes unidades administrativas:\nI. Dirección de Servicios de Salud;\nII. Dirección de Regulación y Fomento Sanitario;\nIII. Dirección de Administración;\nIV. Dirección del Régimen Estatal del Sistema de Protección Social en Salud.\nV. Dirección de Asuntos Jurídicos;\nVI. Coordinación de Planeación y Evaluación del Desempeño;\nVII. Jurisdicciones Sanitarias;\nVIII. Unidades Aplicativas;\nIX. Laboratorio Estatal de Salud Pública; y\nX. Centro Estatal de Transfusión Sanguínea.\nEl Director General, previo acuerdo de la Junta de Gobierno, podrá designar funcionarios para coordinar programas especiales destinados a mejorar los servicios de salud. El Acuerdo respectivo, señalará sus actividades específicas. Los Manuales de Organización precisarán la estructura que se refiere este artículo.\nARTÍCULO 21.- La Dirección de Servicios de Salud, cuyo Titular será quien desempeñe el cargo de Subsecretario de Salud de la Secretaría Estatal, tendrá las atribuciones y obligaciones siguientes:\nI. Operar, coordinar, supervisar y evaluar, en el ámbito de su competencia, los programas estatales de salud en materia de promoción de salud; vigilancia epidemiológica; medicina preventiva; salud reproductiva; salud bucal; planificación familiar; y prestación, control y\nSecretarías Federal y Estatal;\nII. Participar en el proceso de planeación, programación, presupuestación y evaluación de programas y proyectos en el área de su competencia, en coordinación con las áreas correspondientes, definiendo las metas para el cumplimiento de los objetivos federales y estatales establecidos en el Plan Nacional de Desarrollo, el Programa de Reforma del\nSector Salud, el Modelo de Atención a la Salud a Población Abierta y el Diagnóstico Estatal de Salud;\nIII. Coordinar la adopción de sistemas, métodos e indicadores para la evaluación periódica y anual de los programas de salud a su cargo;\nIV. Formular y coordinar la elaboración de los informes de resultados de corto, mediano y largo salud en el ámbito de su competencia;\nV. Ejecutar, coordinar y difundir programas que fomenten el auto cuidado de la salud de la población;\nVI. Planear, operar y, en su caso, coordinar, supervisar y evaluar, en la esfera de su competencia, los programas de prevención y control de enfermedades transmisibles, no transmisibles y de accidentes, en el ámbito estatal, jurisdiccional y local, conforme al\nDiagnóstico Estatal de Salud y a las Normas, Políticas y Estrategias implementadas a nivel estatal y/o federal;\nVII. Planear, ejecutar y evaluar las acciones del Programa de Atención a la Salud de la Infancia y\nAdolescencia en el ámbito estatal, de conformidad con los lineamientos emitidos por el\nCentro Nacional para la Salud de la Infancia y Adolescencia (CENSIA);\nVIII. Establecer y operar sistemas que permitan la obtención y emisión de información estadística local relativa a la prestación de los servicios que ofrece el Organismo;\nIX. Operar y evaluar, en el ámbito de su competencia, el Sistema Único Interinstitucional de\nVigilancia Epidemiológica (SUIVE), así como llevar a cabo las actividades de sanidad internacional cuya atención corresponda al Organismo, vigilando el cumplimiento de las disposiciones respectivas;\nX. Coordinar, supervisar y evaluar los programas estatales de servicio social, de conformidad con las normas, políticas y estrategias que se determinen a nivel estatal o federal;\nXI. Planear, implementar, supervisar y evaluar en el ámbito de su competencia, los Programas y Acciones Educativos para la Salud en el Ámbito Familiar, Escolar y Comunitario;\nXII. Coordinar el Comité Estatal de Vigilancia Epidemiológica así como aplicar y evaluar el\nSistema Único de Información para la Vigilancia Epidemiológica (SUIVE) y el Automatizado para la Vigilancia Epidemiológica (SUAVE), con la participación de los sectores público, social y privado;\nXIII. Atender las emergencias epidemiológicas que se presenten en la entidad, así como coadyuvar con las autoridades competentes en materia de protección civil, en casos de desastres, calamidades o catástrofes públicas, coordinando a las brigadas integradas para tales propósitos;\nXIV. Dirigir, en el ámbito de su competencia, las acciones para prevenir y combatir los problemas de salud pública, así como apoyar, en su caso, las actividades de los Consejos Estatales de\nPrevención del Síndrome de Inmunodeficiencia Adquirida (COESIDA), Contra las Adicciones\n(CECA) y del Centro Estatal para la Salud de la Infancia y Adolescencia;\nXV. Vigilar, en el ámbito de su competencia, el debido cumplimiento de las disposiciones de la\nLey Estatal de Salud, Ley General de Salud y sus Reglamentos, respecto a Salud Pública, Atención Médica y Asistencia Social;\nXVI. Apoyar a la Dirección de Regulación y Fomento Sanitario en la ejecución de visitas de verificación sanitaria, para dar cumplimiento a las disposiciones aplicables en la materia de prestación de servicios médicos;\nXVII. Participar en la operación del sistema de encuestas nacionales de salud y desarrollar, conforme a las normas de carácter estatal o federal, encuestas estatales de salud;\nXVIII. Diseñar, implementar, supervisar y evaluar el Modelo de Atención a la Salud, para la\nNormas, Políticas y Estrategias implementadas a nivel estatal o, en su caso federal, y establecer los procesos de mejora en la calidad, eficiencia y oportunidad que requiera la prestación de los servicios;\nXIX. Autorizar la aplicación de la tecnología apropiada, a efecto de verificar el cumplimiento de la normatividad aplicable en materia de vigilancia epidemiológica;\nXX. Proponer ante las instancias competentes, en coordinación con las autoridades e instituciones educativas de la entidad, las políticas y estrategias para la formulación de los planes y programas académicos, de investigación, capacitación y adiestramiento en materia de salud;\nXXI. Definir y, en su caso, hacer del conocimiento de las instancias correspondientes, las prioridades estatales con relación a la formación de profesionales, técnicos y auxiliares para y largo plazo;\nXXII. Coordinar el ejercicio de sus atribuciones con las que desarrolle el Comité Estatal\nInterinstitucional para la Formación de Recursos Humanos para la Salud;\nXXIII. Evaluar en coordinación con las instituciones del sector salud y de las unidades responsables en la entidad, los campos clínicos de internado médico y de servicio social de estudiantes, profesionales, así como de las residencias médicas;\nXXIV. Revisar en forma periódica la operación del sistema de información y establecer, en su caso, los ajustes que se requieran dentro de un marco integral de modernización administrativa, promoviendo el uso adecuado de los sistemas de información y de la red nacional y estatal con que se cuente;\nXXV. Vigilar la adecuada observancia de las normas emitidas en materia de informática por la\nSecretaría, así como por la Secretaría de la Función Pública del Gobierno de Estado, que rijan el uso y operación de los sistemas informativos tanto en las Unidades Administrativas\nEstatales, como en las Jurisdicciones y Unidades Aplicativas;\nXXVI. Establecer y difundir los sistemas de información y estadística, programación y evaluación que se requieran para el funcionamiento del organismo;\nXXVII. Coordinar, supervisar y evaluar la prestación de servicios médicos, de diagnóstico y tratamiento que brindan las unidades hospitalarias del Organismo;\nXXVIII. Elaborar de acuerdo a los lineamientos de la Coordinación Administrativa de la Secretaría de Salud, los Manuales de Organización, de Políticas y Procedimientos y demás de naturaleza similar que se requieran para el adecuado funcionamiento de las unidades adscritas a la Dirección;\nXXIX. Observar los criterios que emita la Dirección de Asuntos Jurídicos y consultarla cuando los asuntos impliquen cuestiones jurídicas, así como proporcionar la información que requiera en los plazos y en los términos que dicha unidad administrativa le solicite; y\nXXX. Las demás que le confiera otras disposiciones aplicables, así como las que le asigne la\nDirección General del Organismo o la Junta de Gobierno.\nARTÍCULO 22.-La Dirección de Regulación y Fomento Sanitario, cuyo titular será quien desempeñe el cargo de Subsecretario de Regulación y Fomento Sanitario de la Secretaría Estatal, tendrá las atribuciones y obligaciones siguientes:\nI. Planear, organizar, dirigir, vigilar, controlar y evaluar los proyectos y programas de regulación y fomento sanitario;\nII. Aplicar y administrar los sistemas informáticos que sean desarrollados por el Organismo en el ámbito de la regulación y fomento sanitario que permitan apoyar la operación en la materia, la integración de diagnósticos situacionales a fin de planear las acciones de fomento sanitario que resulten necesarias;\nIII. Conducir la aplicación del Programa de Modernización y Descentralización de las Funciones de Regulación y Fomento Sanitario de la Entidad, a fin de elevar la eficacia y eficiencia de las actividades de regulación y fomento sanitario, atendiendo, en su caso, a los lineamientos establecidos por las unidades competentes;\nIV. Observar las disposiciones relativas a los mecanismos, procedimientos y lineamientos administrativos, para llevar a cabo la regulación sanitaria en materia de salubridad local en la entidad;\nV. Mantener actualizado el padrón estatal de establecimientos, actividades, productos y servicios referentes a la salubridad general y local, así como vigilar la guarda y custodia de los expedientes respectivos;\nVI. Participar en la Comisión Estatal sobre Plaguicidas, Fertilizantes y Sustancias Tóxicas\n(COESPLAFEST), y coordinarse con las instancias estatales análogas de las dependencias que integran la Comisión Interinstitucional sobre Plaguicidas, Fertilizantes y Sustancias\nTóxicas (CICOPLAFEST), y colaborar con ésta en el control sanitario de productos que pretendan ser ingresados en la entidad;\nVII. Proponer y promover la desconcentración de funciones y actividades de fomento y control sanitario a nivel jurisdiccional y, en su caso, apoyar su implementación, operación y evaluación;\nVIII. Expedir las autorizaciones y ejercer la vigilancia y control sanitario de la publicidad de las disposiciones aplicables;\nIX. Establecer, en el ámbito de su competencia, los mecanismos de supervisión y coordinación en materia de regulación sanitaria con las jurisdicciones sanitarias;\nX. Planear, organizar, dirigir y controlar los recursos humanos, materiales y financieros asignados a su dirección, de acuerdo con las políticas y lineamientos aplicables;\nXI. Establecer mecanismos de coordinación con las áreas de enseñanza e investigación de la\nSecretaría, así como de la Secretaría Estatal, a fin de promover la capacitación de los recursos humanos adscritos al Organismo y su participación en investigaciones relacionadas con la materia sanitaria;\nXII. Dirigir los sistemas de información sanitaria en materia de regulación y fomento sanitario;\nXIII. Recopilar y difundir la información relativa a leyes, reglamentos, acuerdos, normas oficiales mexicanas, lineamientos y disposiciones sanitarias publicadas en el Diario Oficial de la\nFederación y en el Periódico Oficial del Gobierno del Estado, así como las que sean emitidas por la Secretaría;\nXIV. Operar el sistema estatal de farmacovigilancia, otorgar autorizaciones para prescribir medicamentos que sean o contengan estupefacientes, suscribir los documentos que se requieran para el trámite y otorgamiento de Licencias Sanitarias a farmacias, droguerías y boticas e integrar la información de reacciones adversas de medicamentos de conformidad con la normatividad vigente en la materia;\nXV. Evaluar el resultado e impacto de las actividades de fomento y regulación sanitaria y proponer indicadores que retroalimenten el proceso de planeación y programación de actividades de dicha materia;\nXVI. Participar en el proceso de planeación, programación, presupuestación y evaluación del área de regulación y fomento sanitario, en coordinación con las Direcciones de Administración y\nServicios de Salud del Organismo, proponiendo las metas para el cumplimiento de los objetivos federales y estatales establecidos en el Plan Nacional de Desarrollo, el Programa de Reforma del Sector Salud, el Modelo de Atención a la Salud a Población Abierta y el\nDiagnóstico Estatal de Salud;\nXVII. Vigilar, en el ámbito de su competencia, el debido cumplimiento de las disposiciones legales aplicables y ejercer el control sanitario de los programas de salud, en materia de productos y servicios, insumos para la salud, salud ambiental, atención médica y publicidad, entendiéndose por control sanitario, el conjunto de acciones de orientación, educación, muestreo, verificación, citatorios, notificaciones y sanciones, que se ejercen a través de visitas de verificación a cargo de los verificadores expresamente autorizados, mediante órdenes de visita de verificación sanitaria suscritas por el titular de esta Dirección;\nXVIII. Ejercer el control y vigilancia sanitaria en materia de salubridad local de los establecimientos y servicios que se contienen en el artículo 4°, apartado A) fracción XVIII y el Apartado B) de la Ley Estatal de Salud.\nXIX. Pronunciar acuerdos y formular opiniones técnicas en materia de: productos y servicios, insumos para la salud, salud ambiental, control sanitario de la atención médica y publicidad, en el ámbito de su competencia;\nXX. Remitir a las autoridades fiscales correspondientes, las resoluciones administrativas en las que imponga sanciones económicas, para los efectos de su ejecución;\nXXI. Coordinar el Sistema Estatal de Saneamiento Básico y, en su caso, certificar, en la esfera de su competencia, la calidad sanitaria del agua para uso y consumo humano, los pozos públicos, privados y los sistemas formales de abastecimiento de agua potable, así como el agua para uso industrial;\nXXII. Coordinar las actividades de los Centros de Información Toxicológica;\nXXIII. Hacer del conocimiento de la instancia competente, los accidentes y contingencias que se presenten en el área de su competencia, así como proporcionar aquella información periódica sobre el seguimiento de los mismos;\nXXIV. Ejecutar los programas de bienes y servicios, salud ambiental, atención médica, insumos para la salud y publicidad a nivel estatal, a través de la administración de sistemas informáticos y realizar las acciones de fomento que deriven de su aplicación;\nXXV. Expedir y revocar los permisos previos de importación, la atención de avisos previos de importación y operar en la entidad la prestación de servicios relacionados con la importación de productos y de servicios, establecidos en los acuerdos de coordinación, conforme a los lineamientos emitidos por la Secretaría apoyándose en los sistemas informáticos diseñados para tal efecto;\nXXVI. Fomentar las buenas prácticas sanitarias para la inocuidad de los alimentos, bebidas no alcohólicas, suplementos alimenticios, bebidas alcohólicas, productos de perfumería, belleza y aseo, tabaco, aditivos;\nXXVII. Autorizar y actualizar las credenciales de los verificadores para realizar las funciones que se les encomienden por la autoridad competente;\nXXVIII. Ejercer el control y vigilancia sanitaria en el ámbito de su competencia de los establecimientos dedicados a la obtención, recolección, análisis, conservación, distribución y aplicación de sangre humana y sus componentes; así como realizar visitas de verificación, muestreo de productos, aplicar medidas de seguridad y en su caso, las sanciones que correspondan conforme a la Ley General de Salud, su Reglamento en Materia de Control\nSanitario de la Disposición de Órganos, Tejidos y Cadáveres de Seres Humanos, Acuerdo de Coordinación para la Descentralización Integral de los Servicios de Salud, Reglamentos, Acuerdos, Convenios, Normas y demás disposiciones aplicables en esta materia;\nXXIX. Otorgar y revocar previo cumplimiento de los requisitos correspondientes las licencias sanitarias para establecimientos dedicados a la obtención, recolección, análisis, conservación, distribución y aplicación de sangre humana y sus componentes;\nXXX. Elaborar de acuerdo a los lineamientos de la Coordinación Administrativa de la Secretaría de Salud, los Manuales de Organización, de Políticas y Procedimientos y demás de naturaleza similar que se requieran para el adecuado funcionamiento de las unidades adscritas a la Dirección;\nXXXI. Dirigir y controlar el funcionamiento de los laboratorios de salud pública en el Estado, de acuerdo a los lineamientos establecidos por las áreas normativas de la Secretaría Estatal y la Secretaría;\nXXXII. Dirigir y controlar el funcionamiento del Centro Estatal de la Transfusión Sanguínea, de acuerdo a los lineamientos establecidos por las áreas normativas de la Secretaría y la\nSecretaría Estatal;\nXXXIII. Observar los criterios que emita la Dirección de Asuntos Jurídicos y consultarla cuando los asuntos impliquen cuestiones jurídicas, así como proporcionar la información que requiera en los plazos y en los términos que dicha unidad administrativa le solicite; y\nXXXIV. Las demás que le confiera otras disposiciones aplicables, así como las que le asigne la\nDirección General del Organismo o la Junta de Gobierno.\nARTÍCULO 23.- La Dirección de Administración, cuyo titular será quien desempeñe el cargo de\nCoordinador Administrativo de la Secretaría Estatal, tendrá las atribuciones y obligaciones siguientes:\nI. Establecer las políticas y procedimientos para regular la administración de los recursos humanos, materiales y financieros del Organismo, de conformidad con la normatividad estatal y federal aplicable en la materia;\nII. Participar en colaboración con las áreas competentes del Organismo en la elaboración de los Programas Estatales de Salud;\nIII. Planear, organizar, integrar, dirigir, controlar y evaluar la operación de las áreas a su cargo;\nIV. Vigilar el cumplimiento y observancia de las políticas, normas, sistemas y procedimientos en materia de administración pública;\nV. Establecer con la autorización del Director General, las políticas, normas, sistemas y procedimientos para la programación, presupuestación y administración integral de los recursos humanos, materiales y financieros de que disponga el Organismo;\nVI. Establecer programas de supervisión interna para evaluar la operación y funcionamiento de las áreas administrativas del Organismo y sus Unidades Aplicativas;\nVII. Registrar y controlar los movimientos financieros y contables del Organismo, así como brindar asesoría a las diferentes áreas del mismo en el manejo y aplicación de los recursos, elaborando y presentando a la Dirección General, los estados financieros del Organismo, haciéndose responsable de los mismos;\nVIII. Elaborar y ejecutar los programas de apoyo para la realización de las funciones de la\nSecretaría del Estado, particularmente en materia de cooperación técnico-administrativa y presupuestal;\nIX. Coordinar el proceso anual de programación y presupuestación, así como el ejercicio y control presupuestal del Organismo, de acuerdo a las disposiciones aplicables en la materia;\nX. Presentar ante la Junta de Gobierno y las instancias competentes, la información contable y presupuestal correspondiente, de acuerdo a los ordenamientos y disposiciones legales aplicables;\nXI. Expedir los nombramientos y realizar las reubicaciones, liquidaciones y pago de cualquier remuneración del personal al servicio del Organismo y conducir las relaciones laborales del\nOrganismo con sus trabajadores, de conformidad con las Condiciones Generales de\nTrabajo;\nXII. Proponer al Director General, la designación o remoción, en su caso, de los representantes del Organismo ante las comisiones o comités mixtos en materia laboral;\nXIII. Implementar programas de capacitación al personal adscrito al Organismo, así como brindar asesoría y apoyo técnico en materia de rehabilitación de equipo médico y de infraestructura;\nXIV. Controlar y supervisar el inventario físico de los bienes muebles e inmuebles del Organismo, promoviendo su regularización con el apoyo de las instancias correspondientes;\nXV. Integrar y desarrollar el programa de levantamiento de datos en las diferentes unidades médicas, a fin de elaborar los proyectos de obra que se requieran;\nXVI. Formular y ejecutar los programas de conservación, mantenimiento y reparación de los bienes muebles e inmuebles del Organismo;\nXVII. Presidir los Comités Institucionales de Adquisiciones, Arrendamientos y Servicios; de Obras\nPúblicas, de Baja, Destino Final y Enajenación de Bienes Muebles del Organismo;\nXVIII. Llevar a acabo, en los términos de las disposiciones vigentes en la materia, las licitaciones para la adquisición de bienes, contratación de servicios, conservación y mantenimiento de obras, así como para la contratación de bienes y servicios y la dictaminación de fallos;\nXIX. Coordinar y supervisar en los términos de las disposiciones aplicables la entrega-recepción de las obras ejecutadas;\nXX. Coadyuvar en la definición de prioridades del programa de investigaciones con base en el\nPlan Estatal Maestro de Infraestructura Física en Salud para la Población Abierta\n(PEMISPA), así como coordinar el ejercicio de sus atribuciones con el Comité de Planeación\nMunicipal;\nXXI. Elaborar y suscribir los convenios, contratos y demás documentos que impliquen actos de administración, así como autorizar, en su caso, aquellos que afecten el presupuesto del\nOrganismo;\nXXII. Proponer en coordinación con las dependencias competentes la definición de proyectos en materia de Modernización Administrativa;\nXXIII. Coordinar la elaboración de los Manuales de Organización, de Políticas y Procedimientos y\nOrganismo y sus unidades administrativas y aplicativas;\nXXIV. Coordinar de acuerdo a los lineamientos de la Secretaría de la Función Pública, los procesos de entrega-recepción de los servidores públicos del Organismo;\nXXV. Observar los criterios que emita la Dirección de Asuntos Jurídicos y consultarla cuando los asuntos impliquen cuestiones jurídicas, así como proporcionar la información que requiera en los plazos y en los términos que dicha unidad administrativa le solicite; y\nXXVI. Las demás que le confiera otras disposiciones aplicables, así como las que le asigne la\nDirección General del Organismo o la Junta de Gobierno.\nARTÍCULO 24.- Corresponde a la Dirección del Régimen Estatal del Sistema de Protección Social en Salud, el ejercicio de las siguientes atribuciones y obligaciones:\nI. Coordinar y vigilar las acciones de Protección Social en Salud en el Estado, de conformidad con lo establecido en la Ley General de Salud, su Reglamento en Materia de Protección\nSocial en Salud y el Acuerdo de Coordinación para su Ejecución en el Estado;\nII. Integrar, administrar y actualizar el padrón de beneficiarios del Sistema de Protección Social en Salud de la Entidad, conforme a los lineamientos establecidos en la Ley General de\nSalud, su Reglamento en Materia de Protección Social en Salud y en el Acuerdo de\nCoordinación;\nIII. Administrar de manera eficiente y transparente los recursos provenientes de las aportaciones de la Federación y del Estado, así como de las cuotas familiares, para la ejecución de las acciones de Protección Social en Salud, de conformidad con lo establecido en la Ley General de Salud, su Reglamento en Materia de Protección Social en Salud y en el Acuerdo de Coordinación;\nIV. Dar seguimiento a las quejas que, en su caso, presenten los afiliados al Sistema de\nProtección Social en Salud, derivadas de la prestación de servicios;\nV. Programar de los recursos provenientes de las aportaciones de la Federación y de Estado, aquellos que sean necesarios para el mantenimiento, desarrollo de infraestructura y equipamiento conforme a las prioridades que se determinen en la entidad, en congruencia con el Plan Maestro de Infraestructura;\nVI. Aplicar los esquemas que mejoren la atención, modernización de la administración de los servicios y registros clínicos, tendientes a alentar la certificación del personal y promover la certificación de establecimientos de atención médica;\nVII. Proporcionar a la Secretaría, la información relativa al ejercicio de los recursos transferidos, así como la correspondiente a los montos y rubros de gasto, además de la relativa a las familias incorporadas al padrón del Sistema de Protección Social en Salud;\nVIII. Proporcionar a la Secretaría Estatal la información relativa al ejercicio de los recursos asignados al Sistema de Protección Social en Salud;\nIX. Promover la participación de los municipios en el Sistema de Protección Social en Salud y sus aportaciones económicas, de conformidad con la legislación aplicable;\nX. Elaborar de acuerdo a los lineamientos de la Coordinación Administrativa de la Secretaría\nEstatal, los Manuales de Organización, de Políticas y Procedimientos y demás de naturaleza similar que se requieran para el adecuado funcionamiento de las unidades adscritas a la Dirección, de conformidad con las disposiciones emitidas por la Secretaría;\nXI. Observar los criterios que emita la Dirección de Asuntos Jurídicos y consultarla cuando los asuntos impliquen cuestiones jurídicas, así como proporcionar la información que requiera en los plazos y en los términos que dicha unidad administrativa le solicite; y\nXII. Las demás que le confiera otras disposiciones aplicables, así como las que le asigne la\nDirección General del Organismo o la Junta de Gobierno.\nARTÍCULO 25.- Corresponde a la Dirección de Asuntos Jurídicos, cuyo titular será quien desempeñe el cargo de Director General de Asuntos Jurídicos de la Secretaría Estatal, el ejercicio de las atribuciones y obligaciones siguientes:\nI. Elaborar y proponer los anteproyectos de leyes, reglamentos, decretos, acuerdos y demás organismo;\nII. Compilar las leyes, reglamentos, decretos, acuerdos, circulares y demás ordenamientos jurídicos, así como sus reformas en materia de salud;\nIII. Remitir a la dependencia de la Administración Pública Estatal competente, los documentos conforme a las disposiciones legales;\nIV. Definir los criterios de interpretación de las disposiciones jurídicas en materia de salud, a fin de facilitar su aplicación y debido cumplimiento;\nV. Brindar asesoría y apoyo jurídico a las unidades administrativas del Organismo;\nVI. Coadyuvar con las autoridades competentes en la entidad, en la integración de las\nOrganismo;\nVII. Presentar los informes previo y justificado en los juicios de amparo en que sean señalados como autoridades responsables los servidores públicos del Organismo; VIII, Supervisar que las unidades administrativas del Organismo cumplan debidamente con las determinaciones que les impongan, mediante resolución, las autoridades judiciales;\nIX. Atender, tramitar y proyectar las resoluciones que correspondan en virtud de los recursos interpuestos por actos o resoluciones emitidas por las unidades administrativas del\nOrganismo;\nX. Revisar y opinar, en los términos de las disposiciones aplicables, sobre la procedencia y legalidad de las bases y requisitos legales a que deberán sujetarse los contratos, convenios, acuerdos, bases, concesiones, autorizaciones, adquisiciones o permisos que celebre o expida el organismo en ejercicio de sus atribuciones;\nXI. Representar al Organismo, cuando así proceda en virtud de los poderes especiales y generales que le otorgue la Dirección General del mismo, en procedimientos en que éste sea parte; XlI. Expedir certificaciones de las constancias que obren en los archivos del\nOrganismo, a fin de ser exhibidos ante autoridades judiciales o administrativas o cuando sean requeridas por dichas autoridades y siempre que no constituyan información reservada o confidencial, en los términos de las disposiciones legales;\nXIII. Dictaminar en definitiva sobre las actas administrativas que se levanten a los trabajadores del Organismo por violación o infracción a las disposiciones laborales aplicables, así como ejecutar o reconsiderar, en su caso, los dictámenes de cese que hubiere emitido;\nXIV. Iniciar, tramitar, desahogar y resolver de los procedimientos administrativos disciplinarios, derivados del incumplimiento de las obligaciones de los servidores públicos del Organismo, así como imponer las sanciones que correspondan en la forma y términos que determine la\nLey de la Materia, previo acuerdo del Director General;\nXV. Realizar todas las investigaciones y diligencias necesarias para determinar el inicio de los procedimientos administrativos disciplinarios o de responsabilidad y los que se deriven por violación o infracción a las disposiciones laborables aplicables;\nXVI. Emitir opinión respecto a la legalidad y aplicación de los procedimientos de verificación, dictaminación y resolución en materia de regulación sanitaria;\nXVII. Recibir y tramitar las quejas que presenten los particulares con motivo de la prestación de los servicios por parte de los servidores públicos del Organismo;\nXVIII. Rendirante la Dirección General del Organismo los informes de actividades que le sean solicitados en cualquier tiempo;\nXIX. Elaborar de acuerdo a los lineamientos de la Coordinación Administrativa de la Secretaría de Salud, los Manuales de Organización y demás de naturaleza similar que se requieran para el adecuado funcionamiento de la Dirección; y\nXX. Las demás que le confiera otras disposiciones aplicables, así como las que le asigne la\nDirección General del Organismo o la Junta de Gobierno;\nARTÍCULO 26.-Corresponde a la Coordinación de Planeación y Evaluación del Desempeño, cuyo titular será quien ejerza el mismo cargo en la Secretaría Estatal, el ejercicio de las atribuciones y obligaciones siguientes:\nI. Dirigir el sistema de información estadística del Organismo, conforme a los lineamientos que dicten las dependencias competentes; así como emitir las normas para la elaboración y actualización de la información estadística en salud y vigilar su cumplimiento;\nII. Conducir el proceso de evaluación del desempeño del Sistema Estatal de Salud en cuanto a las condiciones de salud, trato adecuado, distribución entre la población y equidad en el financiamiento, así como en su caso analizar y proponer alternativas;\nIII. Conducir y determinar las acciones relacionadas con el Programa de Capacitación en\nInformática, a fin de fortalecer el aprovechamiento de la tecnología de la información por parte del personal del Organismo;\nIV. Dictaminar sobre las necesidades de uso de tecnología de la información e infraestructura de telecomunicaciones, así como emitir los dictámenes técnicos de proyectos de informática y de desarrollo e implementación de sistemas automatizados de información;\nV. Coordinar las actividades relacionadas con el desarrollo de proyectos interinstitucionales de tecnología de la información en los que participe el Organismo;\nVI. Diseñar, desarrollar e implementar instrumentos para la innovación y la modernización del\nSistema Nacional de Salud, fortaleciendo la función rectora y de coordinación del Organismo con las unidades que lo conforman o que en él participan, vigilando permanentemente en ello el cumplimiento de las políticas y estrategias en materia de equidad;\nVII. Planear, organizar, coordinar y difundir los sistemas de informática, estadística, evaluación y programación de los Servicios de Salud en coordinación con las áreas sustantivas y administrativas del Organismo, vigilando su funcionamiento mediante la supervisión;\nVIII. Planear y definir los mecanismos de evaluación y seguimiento a los programas sustantivos para optimizar la asignación de recursos, el mejoramiento de la productividad, la mejora continua de la calidad y la racionalización de la tecnología de las Unidades Administrativas del Organismo;\nIX. Establecer los procedimientos para el desarrollo de las actividades de planeación, de conformidad con las estrategias nacionales instruidas en el Plan Nacional de Desarrollo, el\nPrograma de Reforma del Sector Salud y los ordenamientos normativos federales y estatales sobre la materia, en concordancia con el Plan Estatal de Desarrollo;\nX. Fomentar el desarrollo de la Tecnología Informática acorde con los proyectos y programas internos y de coordinación con los propuestos por la Federación, los Comités, el Estado y\nOrganismos Extrainstitucionales;\nXI. Coordinar el Sistema de Información Estadística local, de acuerdo a lo establecido en el nivel nacional y estatal, vigilando su funcionamiento mediante la supervisión;\nXII. Conducir y coordinar la elaboración del diagnóstico estatal de salud, con la participación de las áreas de Servicios de Salud, Fomento Sanitario y administración, como instrumento fundamental de la planeación institucional;\nXIII. Coadyuvar en la definición de prioridades del programa de inversión con base en el Plan\nEstatal Maestro de Infraestructura Física en Salud para Población Abierta (PEMISPA), y la coordinación con el Comité de Planeación y Desarrollo del Estado de Coahuila y los\nComités de Planeación y Desarrollo Municipales, en consonancia con las actividades priorizadas de las áreas de Servicios de Salud, Regulación y Fomento Sanitario y\nAdministración;\nXIV. Elaborar de acuerdo a los lineamientos de la Coordinación Administrativa de la Secretaría de Salud, los Manuales de Organización, de Políticas y Procedimientos y demás de naturaleza similar que se requieran para el adecuado funcionamiento de las unidades adscritas a la coordinación;\nXV. Observar los criterios que emita la Dirección de Asuntos Jurídicos y consultarla cuando los asuntos impliquen cuestiones jurídicas, así como proporcionar la información que requiera en los plazos y en los términos que dicha unidad administrativa le solicite; y\nXVI. Las demás que le confiera otras disposiciones aplicables, así como las que le asigne la\nDirección General del Organismo o la Junta de Gobierno.\nARTÍCULO 27.-Corresponde a los titulares de las Jurisdicciones Sanitarias, en el ámbito de su competencia, el ejercicio de las siguientes atribuciones y obligaciones;\nI. Ejecutar y conducir la ejecución de las actividades que les correspondan conforme al Modelo de Atención para la Población Abierta;\nII. Coordinar sectorial e intersectorialmente la ejecución de los programas de salud en la jurisdicción sanitaria, así como participar, en su caso, en las acciones de asistencia social que implementen las autoridades competentes en la materia;\nIII. Proporcionar acceso, información y facilitar la recabación de datos a las instancias de fiscalización, control, verificación y auditoría competentes;\nIV. Brindar y proporcionar apoyo médico a la población e instancias estatales competentes en los casos en que se presenten desastres, calamidades o catástrofes públicas, o cualquier otra situación de riesgo o emergencia;\nV. Elaborar y mantener actualizado el diagnóstico jurisdiccional sectorial de salud, así como el estudio de regionalización operativa de los servicios de salud a la población abierta, a fin de elaborar el programa jurisdiccional de salud;\nVI. Operar el sistema de información en salud, así como administrar, en los términos de las disposiciones aplicables, la función informática;\nVII. Promover ante las instancias municipales competentes la implementación de acciones en materia de salud;\nVIII. Elaborar y conducir los programas jurisdiccionales de promoción de la salud y de medicina preventiva, así como fomentar la participación social en apoyo a los programas de salud;\nIX. Organizar, coordinar, supervisar y controlar la prestación de servicios de atención médica a la población abierta en las unidades de primero, segundo y tercer nivel;\nX. Vigilar la operación y funcionamiento de establecimientos de atención a la salud de conformidad con las disposiciones administrativas y legales aplicables;\nXI. Conducir los programas jurisdiccionales de regulación y fomento sanitario y realizar las acciones de salud ambiental, saneamiento básico y salud ocupacional en materia de su competencia y en coordinación con las dependencias correspondientes;\nXII. Coordinar las acciones de supervisión de las unidades de salud de primer nivel mediante los equipos zonales que correspondan, así como establecer las medidas para su atención;\nXIII. Conducir el programa de formación y desarrollo del personal médico, paramédico, técnico y administrativo adscrito a la jurisdicción, así como participar en las investigaciones operativas que se lleven a cabo;\nXIV. Vigilar, en el ámbito de su competencia, la aplicación de los acuerdos que emanen de las\nComisiones Mixtas de Escalafón, Capacitación y de Seguridad e Higiene en el Trabajo;\nXV. Ejercer el control sanitario, en el ámbito de su competencia, de los programas en materia de salubridad local; entendiéndose por ésta el conjunto de acciones de orientación, educación, emisión de órdenes de verificación, mediante visitas de verificación a cargo del personal expresamente autorizado por la autoridad competente, o en su caso a través de muestreos, acuerdos, opiniones técnicas, notificaciones, citatorios y en su caso aplicación de medidas de seguridad y sanciones, basándose en la Ley General de Salud, Ley Estatal de Salud, sus\nReglamentos, Normas Oficiales Mexicanas y otras disposiciones aplicables;\nXVI. Operar en el ámbito de su competencia, las funciones de regulación y fomento sanitario que se desconcentren respecto a los giros, registros y permisos, así como ejercer el control sanitario, de los programas de salud en materia de control sanitario de productos y servicios, insumos para la salud, salud ambiental, atención médica y control sanitario de la publicidad;\nXVII. Conducir el sistema de administración de personal, en los términos de las disposiciones aplicables;\nXVIII. Formular, implementar y controlar el Programa Operativo Anual de la jurisdicción, así como apoyar y controlar la integración y ejecución del Programa Operativo Anual de las Unidades\nHospitalarias;\nXIX. Recabar y controlar los ingresos que correspondan por cuotas de recuperación por los servicios que presten las unidades de la jurisdicción, así como enterarlas a la instancia correspondiente;\nXX. Operar y controlar, en los términos de las disposiciones conducentes, los sistemas de abasto, servicios generales, así como los programas de conservación, mantenimiento e inventario de los bienes muebles e inmuebles asignados a las unidades de primero, segundo y tercer nivel de la jurisdicción;\nXXI. Participar en la elaboración, actualización, ejecución y control del Plan Estatal Maestro de\nInfraestructura Física en Salud para Población Abierta;\nXXII.- Elaborar de acuerdo a los lineamientos de la Coordinación Administrativa de la Secretaría\nEstatal, los Manuales de Organización, de Políticas y Procedimientos y demás de naturaleza área;\nXXIII. Observar los criterios que emita la Dirección de Asuntos Jurídicos y consultarla cuando los asuntos impliquen cuestiones jurídicas, así como proporcionar la información que requiera en los plazos y en los términos que dicha unidad administrativa les solicite; y\nXXIV. Las demás que le confiera otras disposiciones aplicables, así como las que le asigne la\nDirección General del Organismo o la Junta de Gobierno. Para los efectos del presente artículo son jurisdicciones sanitarias en Coahuila las siguientes:\nA).- Jurisdicción Sanitaria Número 1, ubicada en Piedras Negras, Coahuila, con competencia en los Municipios de Piedras Negras, Guerrero, Hidalgo, Allende, Nava y\nVilla Unión;\nB).- Jurisdicción Sanitaria Número 2, ubicada en Acuña, Coahuila, con competencia en los\nMunicipios de Acuña, Jiménez, Zaragoza y Morelos;\nC).- Jurisdicción Sanitaria Número 3, ubicada en Sabinas, Coahuila, con competencia en los Municipios de Sabinas, Juárez, Progreso, San Juan de Sabinas y Múzquiz;\nD).- Jurisdicción Sanitaria Número 4, ubicada en Monclova, Coahuila, con competencia en los Municipios de Monclova, Frontera, Abasolo, San Buenaventura, Escobedo, Candela, Nadadores y Castaños;\nE).- Jurisdicción Sanitaria Número 5, ubicada en Cuatrociénegas, Coahuila, con competencia en los Municipios de Cuatrociénegas, Lamadrid, Sacramento, Ocampo y\nSierra Mojada;\nF).- Jurisdicción Sanitaria Número 6, ubicada en Torreón, Coahuila, con competencia en los Municipios de Torreón, Matamoros y Viesca;\nG).- Jurisdicción Sanitaria Número 7, ubicada en Francisco l. Madero, Coahuila, con competencia en los Municipios de Francisco I. Madero y San Pedro;\nH).- Jurisdicción Sanitaria Número 8, ubicada en Saltillo, Coahuila, con competencia en los\nMunicipios de Saltillo, General Cepeda, Arteaga, Ramos Arizpe y Parras de la Fuente;\nI).- Las demás que se establezcan o se modifiquen para el adecuado cumplimiento del objeto del Organismo.\nARTÍCULO 28.-Corresponde a los titulares de las Unidades Aplicativas del Organismo, las siguientes atribuciones y obligaciones;\nI. Planear, organizar, dirigir, coordinar y evaluar los programas de actividades para proporcionar eficientemente los Servicios de Salud a su cargo;\nII. Elaborar el presupuesto por programas que correspondan a la unidad con base en el\nDiagnóstico Estatal y Regional de Salud;\nIII. Cumplir y vigilar la debida observancia de las disposiciones, políticas y lineamientos en materia de salud;\nIV. Impulsar y aplicar como responsables, un sistema racional de administración de los recursos financieros y materiales que se asigne a la unidad;\nV. Establecer un sistema de registro y seguimiento de las quejas y sugerencias que se presenten por los usuarios y remitirlas, en su caso, al Órgano de Control Estatal para su atención;\nVI. Definir los estándares de calidad en la prestación de los servicios, fomentando la retroalimentación del personal en dicho rubro;\nVII. Informar a la Dirección General del organismo los resultados de gestión y desempeño obtenidos en los asuntos médico-administrativos realizados;\nVIII. Vigilar la calidad de la atención médica integral que se proporcione, considerando la promoción y protección específica en la salud, el diagnóstico médico temprano y el tratamiento oportuno;\nIX. Gestionar ante las instancias correspondientes la asignación de recursos humanos, financieros y materiales que se requieran para la prestación de los servicios a su cargo;\nX. Participar en la elaboración del programa de prevención de infecciones intrahospitalarias y coordinar el servicio de medicina preventiva;\nXI. Elaborar en coordinación con la Dirección de Administración, los Manuales de Organización, adecuada prestación de los servicios a su cargo;\nXII. Supervisar y evaluar, de conformidad con la programación establecida, el desarrollo de las actividades de la propia unidad;\nXIII. Supervisar el oportuno abasto de medicamentos, materiales, equipo, instrumental y demás mobiliario que se requiera para la adecuada prestación de los servicios a su cargo;\nXIV. Vigilar el adecuado funcionamiento operacional de la unidad;\nXV. Presidir las juntas científicas, socio-culturales y aquéllas que se programen al interior de la unidad;\nXVI. Implementar programas de relaciones públicas internas y externas;\nXVII. Proporcionar a la Dirección General del Organismo los informes técnicos, estadísticos, de actividades, de productividad, los médico-legales y demás que les sean solicitados en cualquier tiempo;\nXVIII. Proponer ante las instancias correspondientes que la implementación de programas de investigación médica, paramédica y administrativa sean acordes con los requerimientos de la propia unidad;\nXIX. Observar los criterios que emita la Dirección de Asuntos Jurídicos y consultarla cuando los asuntos impliquen cuestiones jurídicas, así como proporcionar la información que requiera en los plazos y en los términos que dicha unidad administrativa les solicite; y\nXX. Las demás que le confiera otras disposiciones aplicables, así como las que le asigne la\nDirección General del Organismo o la Junta de Gobierno. Para los efectos del presente artículo, son Unidades Aplicativas en Coahuila, las siguientes:\nA).- Los Hospitales Generales de: Piedras Negras, Acuña, Torreón, Allende, Monclova, Nueva Rosita, Sabinas, San Pedro y Saltillo;\nB).- Los Hospitales integrales de: Matamoros y Francisco I. Madero;\nC).- Los Centros de Salud con Hospital de: Cuatrociénegas, Múzquiz, Parras y Zaragoza.\nD).- Los Centros de Salud Urbanos, Centros de Salud Rural, Centros Antirrábicos, Unidades Auxiliares de Salud, el Centro Estatal de Transfusión Sanguínea y el\nLaboratorio Estatal de Salud Pública; y\nE).- Las demás Instituciones de Salud que se incorporen al Organismo, en atención a las necesidades que sobre la materia se determinen.\nARTÍCULO 29.- Corresponde al titular del Laboratorio Estatal de Salud Pública, el ejercicio de las siguientes atribuciones y obligaciones;\nI. Aplicar las políticas, procedimientos y normas de operación para los laboratorios del organismo y supervisar el cumplimiento de las mismas, de acuerdo a las disposiciones emitidas de la Secretaría y la Secretaría Estatal;\nII. Participar en la planeación de programas y proyectos en el ámbito de su competencia, en coordinación con las áreas correspondientes, definiendo los recursos necesarios para su cumplimiento conforme al Diagnóstico Estatal de Salud y a las Normas, Políticas y\nEstrategias que se señalen a nivel Estatal y/o Federal;\nIII. Operar sistemas que permitan la obtención y emisión de información estadística local relativa a los servicios que ofrece el Laboratorio Estatal de Salud y proporcionarla en su caso a la\nSecretaría y al Gobierno del Estado, conforme a las disposiciones aplicables;\nIV. Ejecutar los procedimientos establecidos en las normas oficiales mexicanas, el Instituto\nNacional de Referencia Epidemiológica, el Laboratorio Nacional de Salud Pública y otras\nInstituciones acreditadas;\nV. Desarrollar, evaluar y difundir los métodos y procedimientos de laboratorio a las Unidades con objeto de fortalecer la red de Laboratorios Estatales;\nVI. Integrar y actualizar un sistema de información periódica sobre publicaciones oficiales, académica y técnica; VII.- Organizar, coordinar y supervisar las actividades relacionadas con el control fisicoquímico sanitario de los alimentos y agua;\nVIII. Organizar, coordinar y supervisar las actividades relacionadas con el área de toxicología;\nIX. Verificar que los programas epidemiológicos y los ensayos fisicoquímicos y microbiológicos en alimentos y agua, se ejecuten de acuerdo a los procedimientos analíticos establecidos por las Normas Oficiales Mexicanas o los validados por otras instituciones acreditadas;\nX. Vigilar el cumplimiento de las disposiciones que establecen las buenas prácticas de laboratorio, elaborando los procedimientos de operación;\nXI. Coordinar, supervisar y evaluar las investigaciones y estudios especiales que se lleven a cabo en el Laboratorio Estatal de Salud;\nXII. Participar en la elaboración del Programa Operativo anual del área de su responsabilidad;\nXIII. Elaborar, implementar y supervisar en coordinación con el área de Enseñanza e\nInvestigación del Organismo, los programas de capacitación, educación e investigación congruentes con la infraestructura y las necesidades particulares de cada laboratorio;\nXIV. Coordinar, supervisar y evaluar el programa anual de actividades del Laboratorio Estatal de\nSalud, así como los lineamientos para el cumplimiento del presupuesto que se le asigne;\nXV. Establecer y vigilar la operación de los programas de control de calidad en los procesos de análisis y diagnóstico, que aseguren a los usuarios resultados confiables y oportunos, promoviendo el intercambio de muestras biológicas y material de referencia para estudios de investigación;\nXVI. Elaborar de acuerdo a los lineamientos de la Coordinación Administrativa de la Secretaría de Salud, los Manuales de Organización, de Políticas y Procedimientos y demás de naturaleza similar que se requieran para el adecuado funcionamiento de las unidades adscritas a su área;\nXVII. Observar los criterios que emita la Dirección de Asuntos Jurídicos y consultarla cuando los asuntos impliquen cuestiones jurídicas, así como proporcionar la información que requiera en los plazos y en los términos que dicha unidad administrativa le solicite; y\nXVIII. Las demás que le confiera otras disposiciones aplicables, así como las que le asigne la\nDirección General del Organismo o la Junta de Gobierno.\nARTÍCULO 30.-Corresponde al titular del Centro Estatal de Transfusión Sanguínea, el ejercicio de las siguientes atribuciones y obligaciones;\nI. Aplicar las políticas, procedimientos y normas de operación para el Centro Estatal de\nTransfusión Sanguínea del Organismo y supervisar el cumplimiento de las mismas, de acuerdo a las disposiciones emitidas de la Secretaría y la Secretaría Estatal;\nII. Participar en la planeación de programas y proyectos en el ámbito de su competencia, en coordinación con las áreas correspondientes, definiendo los recursos necesarios para su cumplimiento conforme al Diagnóstico Estatal de Salud y a las Normas, Políticas y\nEstrategias que se señalen a nivel Estatal y/o Federal;\nIII. Investigar y operar, en su caso, métodos y técnicas relativas a la captación, estudio, procesamiento, almacenamiento, distribución y aplicación de sangre humana, componentes sanguíneos y células progenitoras hematopoyéticas;\nIV. Promover y supervisar las campañas de captación voluntaria de sangre del Sistema Estatal de Salud, así como establecer y aplicar procedimientos para facilitar en todo el territorio estatal, la obtención de sangre, componentes sanguíneos y de células progenitoras hematopoyéticas con fines terapéuticos; V.- Apoyar técnicamente al Sistema Nacional de\nSalud en la captación, fraccionamiento y distribución de la sangre humana, así como en la obtención de plasma excedente para la producción de derivados de plasma;\nVI. Actuar como Laboratorio Estatal de referencia para el estudio de problemas inmunohematológicos y de enfermedades transmisibles por transfusión, en programas de control de calidad externo del desempeñó técnico de los bancos de sangre humana;\nVII. Promover y coordinar la capacitación y actualización de los recursos humanos que participen en la ejecución del Programa Estatal de Transfusión Sanguínea;\nVIII. Promover actividades de actualización relativas a los actos de disposición de sangre humana, componentes sanguíneos y de células progenitoras hematopoyéticas;\nIX. Concentrar y evaluar la información relativa a las unidades de sangre, componentes sanguíneos y células progenitoras hematopoyéticas recolectadas en el territorio estatal, así como de los actos de disposición de la materia, en coordinación con los bancos de sangre humana;\nX. Captar, procesar y registrar disponentes voluntarios de sangre, componentes sanguíneos y células progenitoras hematopoyéticas y de aquellos con grupos sanguíneos poco frecuentes;\nXI. Llevar registros de los establecimientos de salud que realicen actos de disposición de sangre humana, componentes sanguíneos y células progenitoras hematopoyéticas con fines terapéuticos;\nXII. Realizar cualquier acto de disposición de sangre humana, componentes sanguíneos y de células progenitoras hematopoyéticas;\nXIII. Fungir como apoyo técnico de los bancos de sangre humana y de servicios de transfusión sanguínea;\nXIV. Establecer un registro para el censo de servicios de medicina transfusional, en coordinación con las unidades administrativas componentes;\nXV. Vigilar el cumplimiento de las normas oficiales mexicanas para la organización y funcionamiento de los servicios transfusionales;\nXVI. Elaborar de acuerdo a los lineamientos de la Coordinación Administrativa de la Secretaría de Salud, los Manuales de Organización, de Políticas y Procedimientos y demás de naturaleza similar que se requieran para el adecuado funcionamiento de las unidades adscritas a su área;\nXVII. Observar los criterios que emita la Dirección de Asuntos Jurídicos y consultarla cuando los asuntos impliquen cuestiones jurídicas, así como proporcionar la información que requiera en los plazos y en los términos que dicha unidad administrativa le solicite; y\nXVIII. Las demás que le confiera otras disposiciones aplicables, así como las que le asigne la\nDirección General del Organismo o la Junta de Gobierno.\nCAPÍTULO SÉPTIMO\nLAS REFORMAS AL REGLAMENTO\nARTÍCULO 31.- La Junta de Gobierno, por acuerdo de las dos terceras partes de sus miembros, podrá aprobar las reformas que se estimen procedentes a las disposiciones del presente\nReglamento.\nARTÍCULO 32.- Corresponde presentar e iniciar ante la Junta de Gobierno la reforma a las disposiciones de este reglamento a:\nI. El Presidente de la Junta;\nII. Cuando menos dos vocales de la misma; y\nIII. Al Director General del Organismo.\nTRANSITORIOS\nPRIMERO.-El presente reglamento entrará en vigor el día siguiente al de su publicación en el\nSEGUNDO.-Se abroga el Reglamento Interior para el Organismo Público Descentralizado de la\nAdministración Pública Estatal denominado “Servicios de Salud de Coahuila”, publicado en el derogan todas las disposiciones que se opongan al presente Reglamento.\nDADO por los miembros de la Junta Directiva del Organismo Público Descentralizado “Servicios de\nSalud de Coahuila”, en la Cuidad de Saltillo, Coahuila, a los dos días del mes de agosto del año\n2006.\nDIRECTOR GENERAL DEL ORGANISMO\nDR. RAYMUNDO S. VERDUZCO ROSÁN (RÚBRICA)\nVOCAL SUPLENTE\nDE SALUD DE LA ADMINISTRACIÓN PÚBLICA FEDERAL. (RÚBRICA)\nVOCAL SUPLENTE\nC.P. JOSÉ LUIS GONZÁLEZ JAIME. REPRESENTANTE DE LA SECRETARÍA DE LA\nFUNCIÓN PÚBLICA (RÚBRICA)\nVOCAL SUPLENTE\nDR. JESÚS RENE TIJERINA CANTÚ REPRESENTANTE DEL COORDINADOR DE\nDESCENTRALIZADOS (RÚBRICA)\nVOCAL SUPLENTE\nLIC. ALBERTO VILLARREAL GUERRA\nREPRESENTANTE DE LA SECRETARÍA DE\nGOBIERNO DEL ESTADO.\n(RÚBRICA)\nVOCAL SUPLENTE\nLIC. VÍCTOR CORPI TRUJILLO.\nREPRESENTANTE DE LA SECRETARÍA DE\nFINANZAS.\n(RÚBRICA)\nVOCAL SUPLENTE\nLIC. CARLOS ALEJANDRO BOONE GODOY.\nREPRESENTANTE DE LA SECRETARÍA DE\nDESARROLLO SOCIAL DEL ESTADO.\n(RÚBRICA)\nSECRETARIO TÉCNICO DE LA JUNTA DE\nGOBIERNO.\nDR. CARLOS RODRÍGUEZ FLORES.\n(RÚBRICA)\nDescentralizado de la Administración Pública Estatal denominado “Servicios de Salud de\nVOCAL SUPLENTE\nPROFRA. MARISA RAMÍREZ DE BERRUETO REPRESENTANTE DE LA SECRETARÍA DE\nEDUACIÓN Y CULTURA DEL ESTADO (RÚBRICA) VOCAL PROPIETARIO\nC. BRAULIO CÁRDENAS CANTÚ REPRESENTANTE DE LA INICIATIVA PRIVADA ANTE LA\nJUNTA DE GOBIERNO. (RÚBRICA)",
  "ordenamiento": "REGLAMENTO",
  "jurisdiccion": "COAHUILA",
  "fuente_oficial": "DIARIO OFICIAL DE LA FEDERACION",
  "Fecha de Publicación": "29 de noviembre de 1996",
  "ULTIMA REFORMA PUBLICADA": null,
  "es_escaneado": false,
  "tiene_tablas": false,
  "materia": [
    "administrativo"
  ]
}