{
  "titulo": "Acuerdo por el Cual Se Crea el Protocolo Violeta Como Una Estrategia Integral Preventiva y de Reacci",
  "Contenido": "PROTECCIÓN O BÚSQUEDA DE NIÑAS, MUJERES\nADOLESCENTES Y MUJERES ADULTAS, QUE SE\nENCUENTREN EN RIESGO INMINENTE DE SUFRIR\nALGÚN DAÑO GRAVE A SU INTEGRIDAD PERSONAL\nY LA ALERTA VIOLETA\nTEXTO ORIGINAL.\nDecreto publicado en el Periódico Oficial del Gobierno del Estado Edición Extraordinaria I, el Lunes\n18 de Julio de 2022.\nACUERDO POR EL CUAL SE CREA EL PROTOCOLO VIOLETA COMO UNA ESTRATEGIA\nINTEGRAL PREVENTIVA Y DE REACCIÓN INMEDIATA PARA LA PROTECCIÓN O BÚSQUEDA DE\nNIÑAS, MUJERES ADOLESCENTES Y MUJERES ADULTAS, QUE SE ENCUENTREN EN RIESGO\nINMINENTE DE SUFRIR ALGÚN DAÑO GRAVE A SU INTEGRIDAD PERSONAL Y LA ALERTA\nVIOLETA.\nGuerrero.- Poder Ejecutivo.\nMTRA. EVELYN CECIA SALGADO PINEDA, GOBERNADORA CONSTITUCIONAL DEL\nESTADO DE GUERRERO, CON FUNDAMENTO EN LO DISPUESTO POR LOS ARTÍCULOS 71, 87, 88,\n90 NUMERAL 2 Y 91 FRACCIONES XIX, XX, XXII y XLVI DE LA CONSTITUCIÓN POLÍTICA DEL\nCONFIEREN ARTÍCULOS 1, 2, 3, 4, 6, 7, 11, 18 APARTADO A FRACCIONES I Y VI, 20 FRACCIÓN III\ny 25 DE LA LEY ORGÁNICA DE LA ADMINISTRACIÓN PÚBLICA DEL ESTADO DE GUERRERO\nNÚMERO 08; 1, 3, 4, 8 FRACCIÓN IV LEY NÚMERO 553 DE ACCESO DE LAS MUJERES A UNA VIDA\nQue el Plan Estatal de Desarrollo 2022-2027, contempla el Eje Transversal Igualdad de Género e\nInclusión Social, mismo que sus 11 objetivos están direccionados a la atención de las necesidades, las desigualdades, la violencia de género y los derechos humanos de las mujeres guerrerenses, que son el motor de esta Cuarta Transformación, a los jóvenes, a nuestros hermanos indígenas y afromexicanos, y a los grupos más vulnerables de nuestro estado.\nEl artículo 21 de la Constitución Política de los Estados Unidos Mexicanos, establece que la seguridad pública es una función del Estado a cargo de la Federación, las entidades federativas y los\nMunicipios, cuyos fines son salvaguardar la vida, las libertades, la integridad y el patrimonio de las personas, así como contribuir a la generación y preservación del orden público y la paz social, de conformidad con lo previsto en esta Constitución y las leyes en la materia.\nPor su parte, el artículo 2 de la Ley General de Acceso de las Mujeres a Una Vida Libre de\nViolencia, establece que la Federación, las entidades federativas, las demarcaciones territoriales de la\nPROTECCIÓN O BÚSQUEDA DE NIÑAS, MUJERES\nADOLESCENTES Y MUJERES ADULTAS, QUE SE\nENCUENTREN EN RIESGO INMINENTE DE SUFRIR\nALGÚN DAÑO GRAVE A SU INTEGRIDAD PERSONAL\nY LA ALERTA VIOLETA\nCiudad de México y los municipios, en el ámbito de sus respectivas competencias expedirán las normas legales y tomarán las medidas presupuestales y administrativas correspondientes, para garantizar el derecho de las mujeres a una vida libre de violencia, de conformidad con los Tratados Internacionales en\nMateria de Derechos Humanos de las Mujeres, ratificados por el Estado mexicano. La Federación, las entidades federativas, las demarcaciones territoriales de la Ciudad de México y los municipios deberán instrumentar las medidas presupuestales y administrativas necesarias y suficientes de carácter extraordinario para hacer frente a la Alerta de Violencia de Género contra las mujeres. establecen entre otras cosas que son deberes fundamentales del estado promover el progreso social y económico, individual o colectivo, el desarrollo sustentable, la seguridad y la paz social, y el acceso de todos los guerrerenses en los asuntos políticos y en la cultura, atendiendo en todo momento al principio de equidad, que en el estado de Guerrero toda persona gozará de los derechos humanos y las garantías reconocidos por la Constitución Política de los Estados Unidos Mexicanos, esta Constitución y los instrumentos internacionales incorporados al orden jurídico mexicano, el derecho a la libertad y a la seguridad personal, individual y colectiva, así como que, todas las autoridades del estado, en el ámbito de sus respectivas competencias, tienen la obligación de promover, respetar, proteger, garantizar y defender los derechos humanos, atendiendo a los principios de universalidad, interdependencia, indivisibilidad, progresividad y máxima protección.\nLa Ley Número 553 de Acceso de las Mujeres a una Vida Libre de Violencia del Estado Libre y\nSoberano de Guerrero en su precepto 8 señala que es responsabilidad del estado, de los poderes legalmente constituidos y de los municipios, en los ámbitos de sus respectivas competencias, adoptar, por todos los medios apropiados y sin dilaciones, políticas orientadas a prevenir, sancionar y erradicar todas las formas de violencia contra la mujer.\nEn razón de lo anterior en México ya existen mecanismos de protección a niñas y mujeres víctimas, así como protocolos específicos para atender los casos de desaparición de las mismas. Sin embargo, son programas muchas veces aislados entre sí que se realizan desde diferentes dependencias, con presupuesto pulverizado y diferentes canales de difusión.\nNo hay discusión en torno al efecto diferenciado de las violencias sobre niñas y mujeres. de manifiesto patrones en los cuales las diferentes formas de violencia, así como las desapariciones de mujeres tienen características específicas que las distinguen de las ejercidas sobre varones. o feminicidio. Incluso, las posibilidades no se agotan en la presunta comisión de un delito, sino que,\nPROTECCIÓN O BÚSQUEDA DE NIÑAS, MUJERES\nADOLESCENTES Y MUJERES ADULTAS, QUE SE\nENCUENTREN EN RIESGO INMINENTE DE SUFRIR\nALGÚN DAÑO GRAVE A SU INTEGRIDAD PERSONAL\nY LA ALERTA VIOLETA derivado de la existencia de un esquema sistemático de violencia por motivos de género, existe un contexto social generalmente adverso.\nPor ejemplo, para el caso de desaparición, existen diversos protocolos. El Protocolo Alba es un esfuerzo nacional que se detona a partir de la sentencia por el caso campo algodonero en Ciudad Juárez, este protocolo tiene como autoridad responsable a las fiscalías, y se activa inmediatamente al conocer de la desaparición de una mujer, adolescente o niña. Es necesario realizar un reporte y el protocolo implica la búsqueda e investigación del caso, de la mano de las autoridades competentes. Es importante hacer mención que no es obligatoria una denuncia, puesto que la familia de la víctima puede dar reporte ante la\nComisión Estatal de Búsqueda, esta es obligada a dar aviso a la fiscalía competente, en caso de que no exista denuncia todavía.\nOtro Protocolo importante es el Protocolo Adicional para la Búsqueda de Niñas, Niños y\nAdolescentes (PABBNA), mismo que es una herramienta para mejorar la eficiencia de la búsqueda de niñas, niños y adolescentes, además de tomar en cuenta diferentes tipos de delitos en los que estos, pudieran haber sido víctimas.\nUn mecanismo adicional es el Programa Alerta AMBER, que también ayuda a coadyuvar en la búsqueda y pronta localización de niñas, niños, y adolescentes que se encuentren en riesgo inminente de sufrir daño grave a su integridad personal o cualquier otra circunstancia donde se presuma la comisión de algún ilícito, ocurrido en territorio nacional.\nEn cualquier Protocolo de Búsqueda específico se debe de actuar con base en la capacitación y certificación de los enlaces entre otros lineamientos, que en su conjunto, representan la acción integral del\nEstado Mexicano, anteponiendo ante todo el principio del interés superior de la niñez, tutelado en el artículo\n4°, de la Constitución Política de los Estados Unidos Mexicanos, y en relación con el artículo 1°, del mismo ordenamiento.\nPara la prevención, sanción y erradicación de la violencia contra la mujer, prácticamente todos los gobiernos tienen programas transversales con perspectiva de género. Sin embargo, muchos de ellos tienen funciones limitadas.\nDe acuerdo a los datos sociodemográficos del Censo 2020 del INEGI, la población total de\nGuerrero es del 3,540,685 personas, de las cuales un 52% son mujeres, es decir, 1,841,156. La mitad de la población tiene 27 años o menos, y el 34% de la misma vive en los municipios de Chilpancingo, Acapulco e Iguala. En términos económicos, el 41.9% de la población económicamente activa son mujeres, mientras que dentro de la población no económicamente activa tienen un porcentaje mayoritario.\nPROTECCIÓN O BÚSQUEDA DE NIÑAS, MUJERES\nADOLESCENTES Y MUJERES ADULTAS, QUE SE\nENCUENTREN EN RIESGO INMINENTE DE SUFRIR\nALGÚN DAÑO GRAVE A SU INTEGRIDAD PERSONAL\nY LA ALERTA VIOLETA\nDe acuerdo al Secretariado Ejecutivo del Sistema Nacional de Seguridad Pública (SESNSP), las estadísticas sobre violencia de género en Guerrero, para el periodo enero – mayo 2022, son las siguientes:\n• Presuntos delitos de feminicidio: 4 (lugar 24 a nivel nacional)\n• Presuntas víctimas mujeres de homicidio doloso: 48 (lugar 11 a nivel nacional)\n• Presuntas víctimas mujeres de homicidio culposo: 54 (lugar 12 a nivel nacional)\n• Presuntas víctimas mujeres de lesiones dolosas: 638 (lugar 16 a nivel nacional)\n• Presuntas víctimas mujeres de secuestro: 4 (lugar 4 a nivel nacional)\n• Presuntos delitos de violencia familiar: 1,477 (lugar 23 a nivel nacional)\n• Presuntos delitos de violencia de género en todas sus modalidades distinta a la violencia familiar:\n139 (lugar 4 a nivel nacional).\n• Presuntos delitos de violación: 182 (lugar 19 a nivel nacional).\nRespecto a las llamadas al 9-1-1, para el mismo periodo, el SESNSP tiene los siguientes datos para Guerrero:\n• 2,379 llamadas relacionadas con incidentes de violencia contra la mujer;\n• 37 llamadas relacionadas con incidentes de abuso sexual;\n• 91 llamadas relacionadas con incidentes de acoso u hostigamiento sexual;\n• 32 llamadas relacionadas con incidentes de violación;\n• 1,717 llamadas relacionadas con incidentes de violencia de pareja;\n• 2,057 llamadas relacionadas con incidentes de violencia familiar.\nEn este contexto de violencia de género el estado de Guerrero cuenta con dos mecanismos Alertas de Violencia de Género contra las Mujeres, la primera implementada desde 2016 por violencia feminicida y la segunda por agravio comparado en 2020, en 9 municipios del Estado.\nEstas estadísticas son importantes para conocer la dimensión de la problemática de la violencia contra las mujeres en la entidad. De ahí que resulta de primordial importancia la generación de estrategias ejercicio de los derechos de todas y todos los guerrerenses.\nAnte este reto que tiene el estado para la atención de las demandas de las niñas, mujeres adolescentes y mujeres, mi Gobierno en busca el fortalecimiento de los mecanismos existentes realizó un análisis para determinar las formas de atención y respuesta de las demandas este sector poblacional, congruencia operacional, aunado a que carecen de una debida coordinación y cooperación lo que impactan en sus resultados.\nPROTECCIÓN O BÚSQUEDA DE NIÑAS, MUJERES\nADOLESCENTES Y MUJERES ADULTAS, QUE SE\nENCUENTREN EN RIESGO INMINENTE DE SUFRIR\nALGÚN DAÑO GRAVE A SU INTEGRIDAD PERSONAL\nY LA ALERTA VIOLETA\nEn este contexto, el Gobierno del Estado de Guerrero, en el marco de la implementación de estrategias y políticas públicas más eficaces, crea el “Protocolo Violeta” como una estrategia integral para prevenir, atender y erradicar la violencia de género en todas sus dimensiones.\nEste “Protocolo Violeta” de la suma de esfuerzos interinstitucionales, fomentando el trabajo coordinado, en colaboración, cooperación y solidaridad efectiva entre autoridades, colectivos de víctimas, organizaciones no gubernamentales, sector empresarial, medios de comunicación y sociedad civil, con la intención de articular una herramienta de prevención, atención y reacción a través de todos sus componentes.\nDerivado de este Protocolo se presenta la Alerta Violeta que tiene como objetivo general establecer mecanismos eficientes y eficaces de reacción inmediata para coadyuvar en la búsqueda y pronta localización de niñas, adolescentes y mujeres que se encuentren en riesgo de sufrir un daño a su integridad personal por motivo de ausencia, desaparición o extravío.\nEs importante precisar que el Protocolo Violeta es un esfuerzo no limitativo ni excluyente respecto de los mecanismos que actualmente existen en la materia., sino que es instrumento base de acción que determina con claridad los mecanismos de ejecución y funcionamiento a nivel regional y estatal. Además, establece las formas de participación y colaboración entre los diferentes sectores de la población y las autoridades, los procedimientos y criterios de activación, actualización y desactivación del mismo, así como la capacitación a los enlaces y servidores públicos participantes en su implementación.\nEl Gobierno del Estado buscará coadyuvar en los esfuerzos de las instituciones correspondientes y aportar, desde una estrategia articulada, con elementos de comunicación social y difusión informativa, así como mecanismos más efectivos para prevenir y atender la violencia, en todas sus dimensiones, contra las niñas, adolescentes y mujeres.\nEn este sentido, el Protocolo Violeta se presenta como una estrategia integral, coadyuvante y no erradicación de la violencia, en todas sus formas y dimensiones, hacia niñas, mujeres adolescentes y mujeres.\nI. Implementar un mecanismo de coordinación en apego al respeto y garantía de derechos humanos para la difusión de información ágil y eficiente, que coadyuve a la preservación de la seguridad e integridad de las niñas y mujeres de Guerrero;\nPROTECCIÓN O BÚSQUEDA DE NIÑAS, MUJERES\nADOLESCENTES Y MUJERES ADULTAS, QUE SE\nENCUENTREN EN RIESGO INMINENTE DE SUFRIR\nALGÚN DAÑO GRAVE A SU INTEGRIDAD PERSONAL\nY LA ALERTA VIOLETA\nII. Establecer los medios de colaboración entre los diferentes órdenes de gobierno, colectivos de víctimas, medios de comunicación, organizaciones no gubernamentales, sector empresarial y sociedad civil, desde el ámbito de sus respectivas competencias, y\nIII. Capacitar al personal involucrado en la implementación del Protocolo Violeta, siendo el primer programa que articula los esfuerzos del Gobierno del estado para la atención a este sector poblacional.\nEl Protocolo Violeta está constituido en dos fases o momentos, la preventiva y la operativa siendo el primer caso facultad de todas las secretarías, dependencias y entidades para estatales del Gobierno del\nEstado, su implementación, que tiene como eje transversal la perspectiva de género, el segundo caso el operativo, corresponde su implementación a la secretaria de seguridad pública y otras instancias involucradas.\nEl marco normativo que regula la creación e implementación del Protocolo Violeta es el siguiente:\nLEGISLACIÓN INTERNACIONAL\n• Declaración Universal de los Derechos Humanos. Publicada en el Diario Oficial de la Federación, el 28 de abril de 1981.\n• Convención sobre la Eliminación de todas las Formas de Discriminación contra la Mujer\n(CEDAW). Publicada en el Diario Oficial de la Federación, el 28 de abril de 1981.\n• Convención Americana sobre Derechos Humanos (Pacto de San José). Publicada en el Diario\nOficial de la Federación, el 7 de mayo de 1981.\n• Convención de la Haya sobre los Aspectos Civiles de la Sustracción Internacional de Menores.\nPublicada en el Diario Oficial de la Federación, el 14 de enero de 1991.\n• Convención sobre los Derechos del Niño (CDN).\n• Convención Interamericana para Prevenir, Sancionar y Erradicar la Violencia contra la Mujer\n(Convención de Belém do Pará).\n• Convención Interamericana sobre el Tráfico Internacional de Menores.\n• Convención Interamericana sobre Restitución Internacional de Menores.\n• Convención Internacional sobre los Derechos de las Personas con Discapacidad.\n• Convención Internacional sobre la protección de los derechos de todos los trabajadores migratorios y de sus familiares.\n• Convención sobre los Aspectos Civiles de la Sustracción Internacional de Menores.\n• Convenio 138 de la Organización Internacional del Trabajo (OIT) sobre la edad mínima laboral.\n• Convenio 182 de la Organización Internacional del Trabajo (OIT) sobre la Prohibición de las\nPeores Formas de Trabajo Infantil y la Acción Inmediata para su Eliminación.\n• Convención de las Naciones Unidas contra la Delincuencia Organizada Trasnacional\n(Convención de Palermo).\nPROTECCIÓN O BÚSQUEDA DE NIÑAS, MUJERES\nADOLESCENTES Y MUJERES ADULTAS, QUE SE\nENCUENTREN EN RIESGO INMINENTE DE SUFRIR\nALGÚN DAÑO GRAVE A SU INTEGRIDAD PERSONAL\nY LA ALERTA VIOLETA\n• Comité de las Naciones Unidas sobre los Derechos del Niño, Observación General No. 5 (2003) sobre las medidas generales de la aplicación de la convención.\n• Comité de las Naciones Unidas sobre los Derechos del Niño, Observación General No. 12 (2009) sobre el derecho del niño a ser escuchado.\n• Comité de las Naciones Unidas sobre los Derechos del Niño, Observación General No. 13 (2011) sobre el Derecho del niño a no ser objeto de ninguna forma de violencia.\n• Comité de las Naciones Unidas sobre los Derechos del Niño, Observación General No. 14 (2013) sobre el derecho de los Niños, Niñas y Adolescentes a que su interés superior sea una consideración primordial.\n• Comité de las Naciones Unidas sobre los Derechos del Niño, Observación General No. 20 (2016) sobre la efectividad de los derechos del niño y de la niña durante su adolescencia.\n• Comité de las Naciones Unidas sobre los Derechos del Niño, Observación General No. 24 (2019) relativa a los derechos del niño en el sistema de justicia juvenil.\n• Protocolo para prevenir, reprimir y sancionar la trata de personas, especialmente mujeres y niños, que complementa la Convención de Naciones Unidas contra la Delincuencia Organizada Transnacional.\n• Protocolo Facultativo de la Convención sobre los Derechos del Niño Relativo a la Venta de Niños, la Prostitución Infantil y la Utilización de Niños en la Pornografía.\n• Protocolo Facultativo de la Convención sobre los Derechos del Niño relativo a la participación de niños en conflictos armados.\n• Reglas Mínimas de las Naciones Unidas para la Administración de la Justicia de Niños y Niñas\n(“Reglas de Beijing”).\n• Reglas de las Naciones Unidas para la Protección de los Niños, Niñas y Adolescentes Privados de la Libertad (“Reglas de la Habana”).\n• Directrices de las Naciones Unidas para la Prevención de la Delincuencia Juvenil (“Directrices de Raid”).\n• Directrices sobre la Justicia en Asuntos Concernientes a Niños Víctimas y Testigos de Delitos.\n• Principios y Directrices de París sobre los Niños, Niñas y Adolescentes Asociados a Fuerzas\nArmadas o Grupos Armados (2007).\n• Decreto de Promulgación de la Convención Americana sobre Derechos Humanos, adoptada en\n• Decreto da Promulgación del Pacto Internacional de Derechos Económicos, Sociales y\nLEGISLACIÓN FEDERAL\nFederación, D.O.F. 11-06- 2003.\nPROTECCIÓN O BÚSQUEDA DE NIÑAS, MUJERES\nADOLESCENTES Y MUJERES ADULTAS, QUE SE\nENCUENTREN EN RIESGO INMINENTE DE SUFRIR\nALGÚN DAÑO GRAVE A SU INTEGRIDAD PERSONAL\nY LA ALERTA VIOLETA\n• Ley General de los derechos de Niñas, Niños y Adolescentes.\n• Ley General para Prevenir y Sancionar los Delitos en Materia de Secuestro, Reglamentaria de la fracción XXI del artículo 73 de la Constitución Política de los Estados Unidos Mexicanos\n• Ley General en Materia de Desaparición Forzada de Personas, Desaparición Cometida por\nParticulares y del Sistema Nacional de Búsqueda de Personas.\n• Ley General para Prevenir, Sancionar y Erradicar los Delitos en Materia de Trata de Personas, y para la Protección y Asistencia a la Víctimas de estos Delitos.\n• Código Penal Federal.\n• Código Nacional de Procedimientos Penales.\n• Conferencia Nacional de Procuración de Justicia.\n• Ley de la Comisión Nacional de los Derechos Humanos.\n• Ley de Amparo, Reglamentaria de los artículos 103 y 107 de la Constitución Política de los\nEstados Unidos Mexicanos.\n• Ley General de Transparencia y Acceso a la Información Pública.\n• Ley General de Responsabilidades Administrativas.\n• Ley General del Sistema Nacional Anticorrupción.\n• Ley General de Protección de Datos Personales en Posesión de Sujetos Obligados.\n• Ley General de Acceso de las Mujeres a una Vida Libre de Violencia.\n• Ley General de Víctimas.\n• Protocolo Homologado de Búsqueda y su Protocolo Adicional para la Búsqueda de Niñas, Niños y Adolescentes.\n• Protocolo Nacional Alerta Amber México (02 de agosto de 2012).\n• Protocolo Homologado de Investigación para los Delitos de Desaparición Forzada de Personas y Cometidas por Particulares (julio 2018).\n• Protocolo Alba estatal de Guerrero.\n• Reglamento de la Ley General de Víctimas.\n• Reglamento de la Ley General de Acceso de las Mujeres a una Vida Libre de Violencia.\n• Reglamento de la Ley General para Prevenir, Sancionar y Erradicar los Delitos en Materia de\nTrata de Personas y para la Protección y Asistencia a las Víctimas de estos Delitos.\n• Decreto por el que se aprueba el Plan Nacional de Desarrollo 2019-2024.\n• Acuerdo por el que se emiten las Reglas de Operación del Programa de Fortalecimiento a la\nTransversalidad de la Perspectiva de Género para el ejercicio fiscal 2022.\n• Acuerdo por el que se emiten las Reglas de Operación del Programa de Apoyo a las Instancias de Mujeres en las Entidades Federativas (PAIMEF), para el ejercicio fiscal 2022.\nLEGISLACIÓN ESTATAL\n• Ley Orgánica de la Administración Pública del Estado de Guerrero Número 08.\nPROTECCIÓN O BÚSQUEDA DE NIÑAS, MUJERES\nADOLESCENTES Y MUJERES ADULTAS, QUE SE\nENCUENTREN EN RIESGO INMINENTE DE SUFRIR\nALGÚN DAÑO GRAVE A SU INTEGRIDAD PERSONAL\nY LA ALERTA VIOLETA\nLey número 207 de Transparencia y Acceso a la Información Pública del Estado de Guerrero. P.O.\n06-05-2016. Última reforma 15-10-2021.\n• Ley número 464 del Sistema Estatal Anticorrupción de Guerrero. P.O. 18-07-2017.\n• Ley número 466 de Protección de Datos Personales en Posesión de Sujetos Obligados del\nEstado de Guerrero.\n• Ley de Prevención y Atención de la Violencia Familiar del Estado de Guerrero número 280.\n• Ley Número 553 de Acceso a las Mujeres a una Vida Libre de Violencia del Estado Libre y\nSoberano de Guerrero.\n• Ley número 494 para la Igualdad entre Mujeres y Hombres del Estado de Guerrero.\n• Ley número 417 para Prevenir y Erradicar la Trata de Personas y para la Protección, Atención y\nAsistencia de las Víctimas, Ofendidos y Testigos de estos delitos en el Estado de Guerrero.\n• Ley Número 696 de la Comisión de los Derechos Humanos del Estado de Guerrero\n• Reglamento del Sistema Estatal para Prevenir, Atender, Sancionar y Erradicar la Violencia contra las Mujeres.\n• Reglamento de la Ley número 553 de Acceso de las Mujeres a una Vida Libre de Violencia del\n• Reglamento Interior para la Organización y Funcionamiento del Sistema para la Igualdad entre\nMujeres y Hombres del Estado de Guerrero.\n• Reglamento de la Ley número 494 para la Igualdad entre Mujeres y Hombres del Estado de\nGuerrero.\n• Reglamento para la Prevención, Atención y Sanción del Hostigamiento y Acoso Sexual para las y los Servidores Públicos del Poder Ejecutivo del Estado de Guerrero.\n• Código de Procedimientos Penales para el Estado de Guerrero, número 357.\n• Reglamento para la Prevención, Atención y Sanción del Hostigamiento y Acoso Sexual para las y los Servidores Públicos del Poder Ejecutivo del Estado de Guerrero.\n• Decreto Número 181 por el que se aprueba el Plan Estatal de Desarrollo 2022-2027.\n• Decreto por medio del cual se crean las Unidades de Género como áreas administrativas de cada una de las Dependencias, Entidades y demás Organismos de la Administración Pública Estatal.\n• Decreto por el que se crea la Comisión Estatal de Búsqueda de Personas, como Órgano\nAdministrativo Desconcentrado de la Secretaría General de Gobierno.\n• Decreto por el que se crea el Centro de Justicia para Mujeres de la Región Montaña del Estado de Guerrero, especializado para la Atención y Prevención a Mujeres Víctimas de Violencia de la Secretaría de la Mujer.\n• Acuerdo que crea la Procuraduría de la Defensa de los Derechos de la Mujer.\nPROTECCIÓN O BÚSQUEDA DE NIÑAS, MUJERES\nADOLESCENTES Y MUJERES ADULTAS, QUE SE\nENCUENTREN EN RIESGO INMINENTE DE SUFRIR\nALGÚN DAÑO GRAVE A SU INTEGRIDAD PERSONAL\nY LA ALERTA VIOLETA\n• Acuerdo por el que se crea el Centro Comunitario para Mujeres del Municipio de Ayutla de los\nLibres, Guerrero.\n• Acuerdo por el que se crea el Comité Técnico Interinstitucional para la implementación del\nProtocolo Alba Guerrero.\nEn razón de lo anterior por la protección, seguridad y respeto de los derechos humanos de las niñas, mujeres adolescentes y mujeres del estado de Guerrero, he tenido a bien expedir el siguiente:\nACUERDO POR EL CUAL SE CREA EL PROTOCOLO VIOLETA COMO UNA ESTRATEGIA INTEGRAL\nPREVENTIVA Y DE REACCIÓN INMEDIATA PARA LA PROTECCIÓN O BÚSQUEDA DE NIÑAS,\nMUJERES ADOLESCENTES Y MUJERES ADULTAS, QUE SE ENCUENTREN EN RIESGO INMINENTE\nDE SUFRIR ALGÚN DAÑO GRAVE A SU INTEGRIDAD PERSONAL Y LA ALERTA VIOLETA.\nArtículo 1. Las disposiciones del presente Acuerdo son de orden público, interés social, de observancia general en el estado de Guerrero y tienen por objeto crear el Protocolo Violeta para la prevención, atención y erradicación de la violencia, en todas sus formas contra las niñas, mujeres adolescentes y mujeres que se encuentren en riesgo inminente de sufrir algún daño grave a su integridad personal en el estado de Guerrero; como una estrategia integral de reacción inmediata para su protección o búsqueda y la Alerta Violeta.\nArtículo 2. La implementación del Protocolo Violeta corresponde a toda la Administración Pública\nEstatal en el ámbito de su competencia, fomentando el trabajo coordinado, en colaboración, cooperación y solidaridad efectiva entre autoridades, colectivos de víctimas, organizaciones no gubernamentales, sector empresarial, medios de comunicación y sociedad civil.\nArtículo 3. El Protocolo Violeta contempla de manera enunciativa más no limitativa las acciones siguientes:\nI. Fase preventiva:\na) La operación de los Centros de Atención Especializada a Mujeres Víctimas de Violencia;\nb) El programa de apoyo productivo para el desarrollo integral de las mujeres en situación de vulnerabilidad;\nc) La operación de refugio para madres, hijos e hijas en situación de violencia extrema;\nd) La operación del Centro de Justicia para la Atención de la Violencia a las Mujeres;\nPROTECCIÓN O BÚSQUEDA DE NIÑAS, MUJERES\nADOLESCENTES Y MUJERES ADULTAS, QUE SE\nENCUENTREN EN RIESGO INMINENTE DE SUFRIR\nALGÚN DAÑO GRAVE A SU INTEGRIDAD PERSONAL\nY LA ALERTA VIOLETA\ne) El programa de prevención de matrimonios de menores de edad y protección de niñas en el estado de Guerrero, y\nf) La rehabilitación y mantenimiento del refugio estatal para mujeres en situación de violencia intrafamiliar.\nII. Fase operativa:\na) Código Rojo: Estrategia de coordinación con los 3 niveles de gobierno, así como con las instituciones de prevención y procuración de justicia.\nEl protocolo de seguridad será activado ante un delito de alto impacto, en dos formas: la primera será por medio de una llamada al 9-1-1, y la segunda, cuando algún ciudadano denuncie de manera presencial, a un oficial, la existencia de un hecho ilícito grave.\nTras la activación, trabajarán en coordinación las fuerzas del Estado: Ejército Mexicano, Guardia\nNacional, Marina, Fiscalía General del Estado y Policía Municipal, para brindar seguridad en la zona del municipio en el que se aplique.\nb) Alerta Violeta: Estrategia para la atención de niñas, mujeres adolescentes y mujeres desaparecidas desde una perspectiva de prevención y coordinación, detonada a través del 9-1-1.\nArtículo 4. Los principios que regirán el Protocolo Violeta son:\nI. Interés superior de las niñas y mujeres adolescentes: Realizar todas las acciones que permitan la pronta la prevención, atención y erradicación de la violencia, búsqueda y localización de las de niñas y mujeres adolescentes;\nII. Protección de los Derechos Humanos: Realizar todas las acciones que permitan la prevención, atención y erradicación de la violencia, búsqueda y localización de niñas, mujeres adolescentes y mujeres.\nIII. Celeridad: La urgencia, prioridad e inmediatez con que se realicen las acciones de prevención, atención y erradicación de la violencia, búsqueda y localización de niñas, mujeres adolescentes y mujeres;\nIII. Gratuidad: El acceso a los beneficios que otorga el presente protocolo es gratuito;\nIV. Enfoque humanitario: Es la atención centrada en el alivio del sufrimiento, de la incertidumbre y basada en la necesidad de respuestas a los familiares;\nPROTECCIÓN O BÚSQUEDA DE NIÑAS, MUJERES\nADOLESCENTES Y MUJERES ADULTAS, QUE SE\nENCUENTREN EN RIESGO INMINENTE DE SUFRIR\nALGÚN DAÑO GRAVE A SU INTEGRIDAD PERSONAL\nY LA ALERTA VIOLETA\nV. Igualdad y no discriminación: Las actuaciones y diligencias deben ser conducidas sin distinción, exclusión, restricción o preferencia que tenga por objeto o efecto impedir o anular el reconocimiento o el ejercicio de los derechos o la igualdad real de oportunidades de las niñas, mujeres adolescentes y mujeres;\nVI. No revictimización: La obligación de aplicar las medidas necesarias y justificadas de conformidad con los principios en materia de derechos humanos establecidos en la Constitución Política de los Estados Unidos Mexicanos y en los Tratados Internacionales, para evitar que las niñas, mujeres adolescentes y mujeres sean revictimizadas o criminalizadas en cualquier forma, agravando su condición, obstaculizando o impidiendo el ejercicio de sus derechos o exponiéndolas a sufrir un nuevo daño;\nVII. Máxima protección: La obligación de adoptar y aplicar las medidas que proporcionen la protección más amplia para garantizar el trato digno, la seguridad, el bienestar físico y psicológico e intimidad de las niñas, mujeres adolescentes y mujeres;\nVIII. Perspectiva de género: Las diligencias que se realicen deberán realizarse libres de prejuicios, estereotipos y de cualquier otro elemento que, por cuestiones de sexo, género, identidad u orientación sexual, propicien situaciones de desventaja, discriminación, violencia o se impida la igualdad;\nIX. Presunción de vida: Todas las acciones, mecanismos y procedimientos que se implementen para la búsqueda, localización de niñas, mujeres adolescentes y mujeres, se realizarán bajo la premisa de que la persona está con vida;\nX. Verdad: El derecho de conocer con certeza lo sucedido y recibir información sobre las circunstancias en que se cometieron los hechos constitutivos de los delitos previstos en la ley de la materia,\nXI. Interseccionalidad: El enfoque mediante un marco analítico que permite contemplar los problemas desde una perspectiva integral, para evitar de discriminación y privilegio derivados de la simplificación de conclusiones sobre los aspectos de las identidades sociales y políticas de una persona.\nArtículo 5. El Protocolo Violeta contará con un Comité Estatal, que será la instancia superior de coordinación, definición y de ejecución de todas las acciones, el cual estará integrado por las personas titulares de:\nI. La Secretaría General de Gobierno, quien lo presidirá;\nII. La Oficina de la C. Gobernadora;\nIII. La Secretaría de Seguridad Pública;\nPROTECCIÓN O BÚSQUEDA DE NIÑAS, MUJERES\nADOLESCENTES Y MUJERES ADULTAS, QUE SE\nENCUENTREN EN RIESGO INMINENTE DE SUFRIR\nALGÚN DAÑO GRAVE A SU INTEGRIDAD PERSONAL\nY LA ALERTA VIOLETA\nIV. La Secretaría de Salud;\nV. La Secretaría de Desarrollo y Bienestar Social;\nVI. La Secretaría de la Mujer;\nVII. La Comisión Estatal de Atención a Víctimas;\nVIII. La Comisión Estatal de Búsqueda de Personas;\nEl Comité Estatal podrá invitar a las personas físicas o morales, públicas o privadas, los representantes del sector educativo, empresarial, medios de comunicación, académicos, instituciones y representantes de la sociedad civil que puedan exponer conocimientos y experiencias para el cumplimiento de las acciones del Protocolo Violeta.\nArtículo 6. Los cargos de las personas que integran el Comité Estatal serán honoríficos; cada integrante tendrá el carácter de propietaria, quienes podrán designar a su respectivo suplente de nivel jerárquico inferior inmediato.\nArtículo 7. El Comité Estatal tendrá las atribuciones siguientes:\nI. Coordinar, impulsar y ejecutar los trabajos de implementación y funcionamiento del Protocolo\nVioleta;\nII. Contribuir a la coordinación y colaboración entre los diferentes órdenes de gobierno, colectivos de víctimas, medios de comunicación, organizaciones no gubernamentales, sector empresarial y sociedad civil, en las acciones de búsqueda y localización de niñas, mujeres adolescentes y mujeres.\nIII. Vigilar el respeto y garantía de los derechos humanos de las niñas, mujeres adolescentes y mujeres en la aplicación del Protocolo Violeta.\nIV. Promover la capacitación del personal involucrado en la implementación del Protocolo Violeta.\nV. Establecer los mecanismos necesarios para la coordinación de las instituciones participantes, y todas las que se sumen o colaboren, con el objeto de facilitar el intercambio de información institucional, localización de niñas, mujeres adolescentes y mujeres;\nPROTECCIÓN O BÚSQUEDA DE NIÑAS, MUJERES\nADOLESCENTES Y MUJERES ADULTAS, QUE SE\nENCUENTREN EN RIESGO INMINENTE DE SUFRIR\nALGÚN DAÑO GRAVE A SU INTEGRIDAD PERSONAL\nY LA ALERTA VIOLETA\nVI. Dictar las directrices para la coordinación con todas las autoridades homólogas de las entidades federativas colindantes con él estado y con los que exista convenios de colaboración para la implementación del Protocolo Violeta;\nVII. Instaurar mecanismos para la colaboración y coordinación con los municipios del estado, para la formulación, ejecución e instrumentación de programas de actuación para la implementación del\nProtocolo Violeta, y\nVIII. Las demás que le otorga este Acuerdo y otras disposiciones jurídicas aplicables.\nArtículo 8. Las acciones que contempla el Protocolo Violeta se desarrollarán de conformidad a sus disposiciones legales específicas, con excepción de la Alerta Violeta la cual tendrá como ejes rectores tres enfoques que resaltan como el distintivo en esta política de búsqueda de personas, los cuales son:\nI. Enfoque diferencial: En el cual se considerarán las circunstancias particulares de la persona desaparecida y de sus familiares. Con la finalidad de establecer si algún atributo de la niña, mujer adolescente o mujer adulta constituye un factor de atención prioritaria que se asocia a esta situación, y de ser el caso, considerar dicho atributo como línea central de búsqueda.\nEn este enfoque se deberá considerar la actividad social o profesional de la persona, para identificar si es un factor asociado a su desaparición.\nII. Perspectiva de Género: Este eje permite el examen sistemático de las prácticas, los roles y las relaciones de poder asignadas a las personas a partir de diferencias biológicas y diferencias culturales asignadas a los seres humanos como la identidad sexual, orientación sexual e identidad de género. de género, cuando se trate de la desaparición de una persona por su condición o identidad de género. factores de género, deben tomarse en cuenta las afectaciones y violencias diferenciadas que una mujer puede padecer por su condición de género.\nIII. Enfoque basado en los derechos humanos de niñas y mujeres adolescentes: Las niñas y mujeres adolescentes son todas las personas menores de 18 años. Las niñas son las mujeres menores de 13 años y las mujeres adolescentes son las personas de 12 a menos de 18 años de edad.\nPROTECCIÓN O BÚSQUEDA DE NIÑAS, MUJERES\nADOLESCENTES Y MUJERES ADULTAS, QUE SE\nENCUENTREN EN RIESGO INMINENTE DE SUFRIR\nALGÚN DAÑO GRAVE A SU INTEGRIDAD PERSONAL\nY LA ALERTA VIOLETA\nEl enfoque basado en los derechos humanos de niñas y mujeres adolescentes consiste en su reconocimiento como personas titulares de derechos, con base en el respeto de su dignidad, vida, supervivencia, bienestar, salud, desarrollo, participación y no discriminación, garantizando integridad en el ejercicio de sus derechos.\nDeberá existir un deber reforzado en la debida diligencia de la búsqueda de personas si se trata de niñas y mujeres adolescentes, pues son particularmente vulnerables a múltiples delitos y violaciones de sus derechos humanos, incluida la sustitución de su identidad, la trata de personas, la esclavitud sexual y el reclutamiento forzoso, entre otros.\nLas niñas y mujeres adolescentes son sujetos de derecho en igualdad de circunstancias que las personas adultas, lo que implica que deben tener el acceso al mismo trato y oportunidades de reconocimiento, goce o ejercicio de sus derechos humanos y las libertades fundamentales, incluyendo los derechos a la participación y a la información para los familiares de personas desaparecidas.\nEn la aplicación del enfoque diferencial, también debe considerarse el derecho de prioridad que les reconoce la legislación mexicana, especialmente para que se les brinde protección y socorro oportuno en cualquier circunstancia, y a que se les considere para el diseño y ejecución de toda política necesaria para su protección. En la búsqueda, debe aplicarse el interés superior de la niñez, es decir, que las autoridades deberán proteger primordialmente los derechos de niñas y mujeres adolescentes, y velar que cuando sean víctimas o testigos, la protección que se les brinde sea armónica e integral, atendiendo a su desarrollo evolutivo y cognitivo.\nArtículo 9. El logo del “Protocolo Violeta” consistirá en la formación de un círculo con las palabras\n“Protocolo Violeta” en la parte superior y en la parte inferior las palabras “cada minuto cuenta”, dentro de\nArtículo 10. El logo de la \"Alerta Violeta\" consistirá en la formación de un círculo con las palabras\n“Alerta Violeta” en la parte superior y en la parte inferior las palabras “cada minuto cuenta”, dentro de este\nArtículo 11. Los principios de la alerta violeta son los siguientes:\nI. Interés superior de la niñez: todas las acciones que permitan la pronta búsqueda, localización, recuperación y resguardo de las de niñas y mujeres adolescentes, que hayan\nPROTECCIÓN O BÚSQUEDA DE NIÑAS, MUJERES\nADOLESCENTES Y MUJERES ADULTAS, QUE SE\nENCUENTREN EN RIESGO INMINENTE DE SUFRIR\nALGÚN DAÑO GRAVE A SU INTEGRIDAD PERSONAL\nY LA ALERTA VIOLETA desaparecido, raptado, sustraído y/o secuestrado, se debe actuar atendiendo a la protección del interés superior del niño;\nII. Celeridad: las acciones de búsqueda, localización y resguardo de niñas, mujeres adolescentes y mujeres adultas, desaparecidas, raptadas, sustraídas o secuestradas se deben de realizar de manera urgente, prioritaria e inmediata para asegurar su vida, integridad y resguardo;\nIII. III. Gratuidad: el presente protocolo debe ir a cargo de la estructura organizativa y financiera del Estado;\nIV. IV. Enfoque humanitario: Conforme a este principio es la atención centrada en el alivio del sufrimiento, de la incertidumbre y basada en la necesidad de respuestas a los familiares;\nV. Igualdad y no discriminación: para garantizar el acceso y ejercicio de los derechos y garantías de las víctimas a los que se refiere esta Ley, las actuaciones y diligencias deben ser conducidas sin distinción, exclusión, restricción o preferencia que tenga por objeto o efecto impedir o anular el reconocimiento o el ejercicio de los derechos o la igualdad real de oportunidades de las personas. Toda garantía o mecanismo especial debe fundarse en razones de enfoque diferencial y especializado;\nVI. No revictimización: la obligación de aplicar las medidas necesarias y justificadas de conformidad con los principios en materia de derechos humanos establecidos en la para evitar que la persona desaparecida y las víctimas a que se refiere esta Ley, sean revictimizadas o criminalizadas en cualquier forma, agravando su condición, daño;\nVII. Máxima protección: la obligación de adoptar y aplicar las medidas que proporcionen la protección más amplia para garantizar el trato digno, la seguridad, la protección, el bienestar físico y psicológico e intimidad de las víctimas a que se refiere esta Ley;\nVIII. Perspectiva de género: en todas las diligencias que se realicen para la búsqueda de la persona desaparecida, así como para investigar y juzgar los delitos previstos en la Ley\nGeneral, se deberá garantizar su realización libre de prejuicios, estereotipos y de cualquier otro elemento que, por cuestiones de sexo, género, identidad u orientación sexual de las\nPROTECCIÓN O BÚSQUEDA DE NIÑAS, MUJERES\nADOLESCENTES Y MUJERES ADULTAS, QUE SE\nENCUENTREN EN RIESGO INMINENTE DE SUFRIR\nALGÚN DAÑO GRAVE A SU INTEGRIDAD PERSONAL\nY LA ALERTA VIOLETA personas, propicien situaciones de desventaja, discriminación, violencia o se impida la igualdad;\nIX. Presunción de vida: en las acciones, mecanismos y procedimientos para la búsqueda, localización y desarrollo de las investigaciones, las autoridades deben presumir que la persona desaparecida está con vida;\nX. Verdad: el derecho de conocer con certeza lo sucedido y recibir información sobre las circunstancias en que se cometieron los hechos constitutivos de los delitos previstos en la\nLey General, en tanto que el objeto de la misma es el esclarecimiento de los hechos, la protección de las víctimas, el castigo de las personas responsables y la reparación de los daños causados, en términos de los artículos 1o. y 20 de la Constitución Política de los\nEstados Unidos Mexicanos.\nArtículo 12. Las dependencias y entidades de la administración pública estatal y organizaciones de la sociedad civil involucradas en la aplicación de la alerta violeta son las siguientes:\nI. Autoridades estatales: a. Oficina de la C. Gobernadora. b. Secretaría General de Gobierno.\n1. Comisión Estatal de Búsqueda de Personas.\n2. Comisión Estatal de Atención a Víctimas. c. Secretaría de Seguridad Pública. d. Secretaría de Protección Civil. e. Secretaría de Salud. f. Secretaría de Desarrollo y Bienestar Social. g. Secretaría de Asuntos Indígenas y Afromexicanos. h. Sistema Nacional para el Desarrollo Integral de las Familias (DIF). i. Procuraduría de protección de niñas, niños y adolescentes. j. Fiscalía General del Estado de Guerrero. k. Comisión de los Derechos Humanos del Estado de Guerrero. l. Albergues estatales y privados para: mujeres, niñas, niños y adolescentes.\nII. Autoridades municipales del estado de Guerrero: a. Policías municipales. b. Áreas de Protección Civil. c. Cuerpos de Bomberos municipales. d. Unidades de género.\nIII. Autoridades federales en el estado de Guerrero: a. Guardia Nacional.\nPROTECCIÓN O BÚSQUEDA DE NIÑAS, MUJERES\nADOLESCENTES Y MUJERES ADULTAS, QUE SE\nENCUENTREN EN RIESGO INMINENTE DE SUFRIR\nALGÚN DAÑO GRAVE A SU INTEGRIDAD PERSONAL\nY LA ALERTA VIOLETA b. Secretaría de la Defensa Nacional. c. Secretaría de Marina. d. Delegaciones federales.\nIV. Autoridades de otras entidades federativas: a. Los que suscriban el Convenio.\nV. Grupos de apoyo involucrados a. Sociedad civil. b. Sector empresarial. c. Redes vecinales. d. Medios de comunicación. e. Organizaciones no gubernamentales. f. Sector médico. g. Magisterio. h. Universidades. i. Sindicatos. j. Colectivos. k. Otros que se adhieran al programa.\nLa participación de cada una de las partes involucradas se regirá por lo establecido en la Alerta\nVioleta y los convenios celebrados entre el Gobierno del estado, autoridades municipales del estado, autoridades federales, autoridades de otras entidades federativas, el sector empresarial y grupos de apoyo involucrados.\nArtículo 13. Los Criterios para la activación de la alerta violeta son los siguientes:\nI. Cuando la persona desaparecida sea niña y mujer sin importar edad o condición, pertenencia cultural o étnica o nacionalidad, y con independencia de si se trata de un delito o no;\nII. Cuando se presuma que se encuentra en peligro su vida o integridad por motivo de desaparición.\nIII. Cuando exista información sobre la niña, adolescente mujer tales como: circunstancias de modo, tiempo y lugar del hecho, nombre, edad, sexo, señas particulares, padecimientos, capacidades diferentes, vestimenta, lugar, personas, vehículos involucrados de ser el caso y cualquier otra información relevante.\nPROTECCIÓN O BÚSQUEDA DE NIÑAS, MUJERES\nADOLESCENTES Y MUJERES ADULTAS, QUE SE\nENCUENTREN EN RIESGO INMINENTE DE SUFRIR\nALGÚN DAÑO GRAVE A SU INTEGRIDAD PERSONAL\nY LA ALERTA VIOLETA\nIV. Cuando exista información suficiente de la persona alterante. Debe presentar sus datos de identificación. En caso de que se trate de una niña o mujer adolescente confirmar su relación de parentesco (Madre, padre o tutor(a)).\nEsta alerta tendrá en cuenta la pluriculturalidad del Estado Mexicano y será incluyente tomando en cuenta a las mujeres pertenecientes a los Pueblos y Comunidades Indígenas y Afromexicanas en todos los ámbitos.\nArtículo 14. Las Consideraciones para la activación de la Alerta Violeta son las siguientes:\nI. El análisis de riesgo para activar la Alerta Violeta dentro del nivel de difusión se determinará a través de una valoración del Grupo Específico del Protocolo Violeta, mismo que estará conformada por: Unidad Policial de Género, Prevención Social de Delito y la Unidad de\nGénero de la SSP, también la Comisión Estatal de Búsqueda. Este grupo recibirá la canalización de la llamada por los operadores del 9-1-1 de forma que mantendrán el acompañamiento a la víctima o reportante, para proveer acompañamiento desde la llegada del primer respondiente, orientación legal, médica y psicológica, así como invitarlos a presentar la denuncia formal. Además, serán los encargados de difundir la alerta.\nII. Todo el mecanismo de ejecución de la Alerta Violeta será aplicado con perspectiva de género, entendida esta como “La visión científica, analítica y política sobre las mujeres y los hombres.\nQue propone eliminar las causas de la opresión de género como la desigualdad, la injusticia y la jerarquización de las personas basada en el género. Promueve la igualdad entre los géneros a través de la equidad, el adelanto y el bienestar de las mujeres; contribuye a construir una sociedad en donde las mujeres y los hombres tengan el mismo valor, la igualdad de derechos y oportunidades para acceder a los recursos económicos y a la representación política y social en los ámbitos de toma de decisiones”\nIII. La activación será inmediata, a partir del reporte al 911, mediante una llamada telefónica, operada por el Centro de Control, Comando, Comunicación, Cómputo y Coordinación, de la\nSecretaría de Seguridad Pública del Estado de Guerrero, que alerta sobre la desaparición de la niña o mujer.\nIV. La activación del Alerta Violeta será independiente de los procesos, protocolos e atribuciones.\nV. La activación se realizará con perspectiva de género, sin revictimización, discriminación y en estricta observancia de los derechos humanos.\nVI. En los casos que la desaparición de la niña o mujer se de en un municipio limítrofe con otra\nEntidad Federativa afín con la Alerta Violeta, el mismo se activará en ambas, conforme al convenio de colaboración suscrito.\nPROTECCIÓN O BÚSQUEDA DE NIÑAS, MUJERES\nADOLESCENTES Y MUJERES ADULTAS, QUE SE\nENCUENTREN EN RIESGO INMINENTE DE SUFRIR\nALGÚN DAÑO GRAVE A SU INTEGRIDAD PERSONAL\nY LA ALERTA VIOLETA\nArtículo 15. La responsabilidad de activar, desactivar y coordinar los esfuerzos de la Alerta\nVioleta corresponde a la Secretaría de Seguridad Pública del estado de Guerrero, a través del Sistema\nEstatal de Información Policial, avisando a la Comisión Estatal de Búsqueda de Personas.\nArtículo 16. La Secretaría de Seguridad Pública del Estado de Guerrero, a través del Sistema\nEstatal de Información Policial, revisará cada 6 horas los casos activos, para evaluar si se mantiene la activación o no del Alerta Violeta, con el fin de evitar el desgaste social.\nArtículo 17. Los Criterios para la desactivación de la alerta violeta son los siguientes:\nI. La localización de la persona.\nII. Cuando derivado de la Alerta Violeta se ponga en riesgo la integridad de la persona.\nIII. Que afecte de manera negativa al interés superior de la niña o mujer adolescente.\nLa alerta durará, en su ciclo completo, 48 horas con dos publicaciones, además se brindará el acompañamiento para que en el lapso de estas 48 horas las víctimas puedan presentar su denuncia y así se puedan activar los protocolos homologados de búsqueda, investigación, y demás que apliquen de forma que se garantice la integridad de la víctima.\nArtículo 18. El Desarrollo de la Alerta Violeta tendrá las siguientes etapas:\nI. Reporte al 911, con la posibilidad de reportarlo de forma presencial o por llamada telefónica, redes sociales de la Secretaría de Seguridad Pública de la desaparición de la niña o mujer. En esta fase, el Sistema Estatal de Información Policial será la autoridad encargada.\nII. Dentro del catálogo de posibilidades de operadores se encuentra la materia de seguridad, cuando se identifique que además de esta materia se contemplan los supuestos de activación de la alerta violeta, se canalizará al área de \"Protocolo Violeta\" cuyos responsables son la Unidad Policial de Género, Prevención Social de Delito y la Unidad de Género de la SSP.\nIII. Es importante mencionar que esta ALERTA VIOLETA se activará en los casos de desaparición, siempre que esto se confirme en la entrevista con el primer respondiente. También, serán activados los Protocolos de Búsqueda que apliquen, mismos que son coexistentes con la ALERTA\nVIOLETA.\nIV. El sistema estatal de información policial será la instancia encargada de la generación de una ficha búsqueda que contenga, cuando menos, los datos de la niña o mujer, así como toda la información necesaria para su localización. Los datos son los siguientes: circunstancias de modo, tiempo y lugar del hecho, nombre, edad, sexo, señas particulares, padecimientos, capacidades diferentes,\nPROTECCIÓN O BÚSQUEDA DE NIÑAS, MUJERES\nADOLESCENTES Y MUJERES ADULTAS, QUE SE\nENCUENTREN EN RIESGO INMINENTE DE SUFRIR\nALGÚN DAÑO GRAVE A SU INTEGRIDAD PERSONAL\nY LA ALERTA VIOLETA vestimenta, lugar, personas, vehículos involucrados de ser el caso y cualquier otra información relevante. Todos estos datos se recabarán con el Informe Policial Homologado, que servirá de base para la generación de la ficha y dará la garantía jurídica para la difusión de la información personal.\nV. Activación de la Alerta Violeta y difusión de la ficha de búsqueda entre los enlaces designados por las partes involucradas.\nVI. Difusión masiva de la ficha de búsqueda en los medios de comunicación institucionales y no institucionales.\nVII. Valoración periódica de la activación o desactivación de la Alerta Violeta con base en los avances del caso, para evaluar si se mantiene la activación o no, hasta cumplir con las 48 horas, o en su caso habiéndose presentado la denuncia o activándose otro protocolo homologado.\nArtículo 19. Con el objetivo de brindar una estrategia de búsqueda integral y con perspectiva de género, el Alerta Violeta tomará las siguientes medidas de prevención para proteger a las niñas, mujeres adolescentes y mujeres adultas:\nI. Brindar atención médica, psicológica o psiquiátrica gratuita, de forma inmediata, adecuada y efectiva, a través de instituciones estatales de salud especializadas.\nII. Asegurar que los profesionales de las instituciones de salud especializadas que sean asignados para el tratamiento de las víctimas valoren debidamente las condiciones psicológicas y físicas de cada víctima y tengan la experiencia y formación suficiente para tratar tanto los problemas de salud físicos que padezcan los familiares como los traumas psicológicos ocasionados como resultado de la violencia de género.\nIII. Continuar implementando programas y cursos permanentes de educación y capacitación en:\na) Derechos humanos y género;\nb) Perspectiva de género y\nc) Superación de estereotipos sobre el rol social de las mujeres.\nIV. El estado de Guerrero reconoce que las medidas de prevención abarcan todas aquellas medidas de carácter jurídico, político, administrativo y cultural que promuevan la salvaguarda de los efectivamente consideradas y tratadas como un hecho ilícito que, como tal, es susceptible de acarrear sanciones para quien las cometa, así como la obligación de indemnizar a las víctimas por\nPROTECCIÓN O BÚSQUEDA DE NIÑAS, MUJERES\nADOLESCENTES Y MUJERES ADULTAS, QUE SE\nENCUENTREN EN RIESGO INMINENTE DE SUFRIR\nALGÚN DAÑO GRAVE A SU INTEGRIDAD PERSONAL\nY LA ALERTA VIOLETA sus consecuencias perjudiciales. Es claro, a su vez, que la obligación de prevenir es de medio o comportamiento y no se demuestra su incumplimiento por el mero hecho de que un derecho haya sido violado.\nV. La estrategia de prevención debe ser integral, es decir, debe prevenir los factores de riesgo y a la vez fortalecer las instituciones para que puedan proporcionar una respuesta efectiva a los casos de violencia contra la mujer.\nVI. Adoptar medidas preventivas en casos específicos en los que es evidente que determinadas mujeres adultas y niñas pueden ser víctimas de violencia.\nVII. Prestar especial atención a las necesidades y los derechos de las presuntas víctimas en consideración a su condición de niñas, como mujeres que pertenecen a un grupo en una situación vulnerable.\nVIII. Se pretende que este mecanismo de Alerta Violeta sea una de las medidas garantice el cumplimiento de las medidas establecidas en las declaratorias de Alerta de Violencia de Género contra las Mujeres (DAVGM).\nPrimero. El presente Acuerdo entrará en vigor al día siguiente de su publicación en el Periódico\nOficial del Gobierno del Estado de Guerrero.\nSegundo. El Comité Estatal del Protocolo Violeta resolverá los asuntos no establecidos o extraordinarios para la implementación y operación del Protocolo Violeta y sus acciones.\nTercero. El Titular de la Secretaría Técnica de la C. Gobernadora expedirá los lineamientos de operación de la “Alerta Violeta” en un plazo que no exceda los 120 días contados a partir de la entrada en vigor del presente decreto.\nBoulevard René Juárez Cisneros, de la Ciudad de los Servicios en Chilpancingo de los Bravo, capital del estado de Guerrero, a los dieciocho días del mes de julio del año dos mil veintidós.\nLA GOBERNADORA CONSTITUCIONAL DEL ESTADO DE GUERRERO.\nMTRA. EVELYN CECIA SALGADO PINEDA.\nRúbrica.\nPROTECCIÓN O BÚSQUEDA DE NIÑAS, MUJERES\nADOLESCENTES Y MUJERES ADULTAS, QUE SE\nENCUENTREN EN RIESGO INMINENTE DE SUFRIR\nALGÚN DAÑO GRAVE A SU INTEGRIDAD PERSONAL\nY LA ALERTA VIOLETA\nEL SECRETARIO GENERAL DE GOBIERNO.\nMTRO. LUDWIG MARCIAL REYNOSO NÚÑEZ.\nRúbrica.\nEL SECRETARIO DE SEGURIDAD PÚBLICA.\nCAPITÁN EVELIO MÉNDEZ GÓMEZ.\nRúbrica.\nPROTECCIÓN O BÚSQUEDA DE NIÑAS, MUJERES\nADOLESCENTES Y MUJERES ADULTAS, QUE SE\nENCUENTREN EN RIESGO INMINENTE DE SUFRIR\nALGÚN DAÑO GRAVE A SU INTEGRIDAD PERSONAL\nY LA ALERTA VIOLETA",
  "ordenamiento": "PROTOCOLO",
  "jurisdiccion": "GUERRERO",
  "fuente_oficial": "DIARIO OFICIAL DE LA FEDERACION",
  "Fecha de Publicación": "18 de Julio de 2022",
  "ULTIMA REFORMA PUBLICADA": null,
  "status": "VIGENTE",
  "es_escaneado": false,
  "tiene_tablas": false,
  "materia": [
    "general"
  ]
}