{
  "titulo": "Ley DE VIVIENDA PARA LA CIUDAD DE MÉXICO",
  "Contenido": "PUBLICADO EN LA GACETA OFICIAL DE LA CIUDAD DE MÉXICO\nEL 23 DE MARZO DE 2017\nTEXTO VIGENTE\nÚLTIMA REFORMA PUBLICADA EN LA G.O. CDMX\nEL 02 DE SEPTIEMBRE DE 2021\nDECRETO QUE CONTIENE LAS OBSERVACIONES RESPECTO DEL DIVERSO POR EL QUE SE EXPIDE LA LEY DE\nVIVIENDA PARA LA CIUDAD DE MÉXICO\nMIGUEL ÁNGEL MANCERA ESPINOSA, Jefe de Gobierno de la Ciudad de México, a sus habitantes sabed:\nQue la H. Asamblea Legislativa del Distrito Federal, VII Legislatura se ha servido dirigirme el siguiente\nD E C R E T O\nASAMBLEA LEGISLATIVA DE LA CIUDAD DE MÉXICO\nVII LEGISLATURA.\nD E C R E T A\nDECRETO QUE CONTIENE LAS OBSERVACIONES RESPECTO DEL DIVERSO POR EL QUE SE EXPIDE LA LEY DE\nVIVIENDA PARA LA CIUDAD DE MÉXICO\nARTÍCULO ÚNICO. - Se expide la Ley de Vivienda para la Ciudad de México, para quedar como sigue:\n\nTÍTULO I\nDE LAS DISPOSICIONES GENERALES, DE LAS AUTORIDADES, SU\nCOMPETENCIA Y SU COORDINACIÓN\nCAPÍTULO I\nDISPOSICIONES GENERALES\nArtículo 1. La presente Ley es aplicable en el territorio de la Ciudad de México, sus disposiciones son de orden público e interés social y tiene por objeto:\nI. Garantizar el derecho a la vivienda como un derecho humano universal conforme a lo dispuesto en la Constitución Política de los Estados Unidos Mexicanos, al Estatuto de Gobierno del Distrito\nFederal y los Tratados Internacionales en los que México es parte de la materia.\nII. Establecer los lineamientos generales de la política y los programas de vivienda en la entidad;\nIII. Garantizar el derecho a la ciudad, de tal manera que todas las personas, sin importar su origen, raza, color, estatus social u otro, tengan acceso al uso y goce de los beneficios de la ciudad y al espacio público seguro y accesible, con un enfoque de derechos humanos, igualdad de género y de sustentabilidad, con la finalidad de evitar la segregación socioespacial activa o pasiva;\nIV. Establecer un ordenamiento jurídico armonizado que permita promover acciones orientadas a la política de vivienda, programas, instrumentos, apoyos y acciones habitacionales del\nGobierno de la Ciudad de México, en coordinación con los Órganos Políticos Administrativos y los municipios que conformen la Zona Metropolitana del Valle de México, teniendo en cuenta el desarrollo social, ambiental, cultural, económico, de movilidad y urbano, que permita ofrecer una respuesta efectiva a las necesidades de vivienda a todos sus habitantes;\nV. Establecer los lineamientos generales, que fortalezcan la ciudad solidaria y permitan la creación de una ciudad compacta, entendida como aquella que presenta una estructura y trama urbana de cierta densidad, está cohesionada socialmente, genera espacios de sociabilidad, crea un territorio con cercanía a los servicios y equipamientos, propicia el encuentro de actividades, permite el desarrollo de la vida en comunidad y fomenta la movilidad urbana sustentable;\n\nVI. Establecer y aplicar medidas concretas de apoyo y fomento a la construcción de vivienda y el hábitat, que se lleve a cabo a través del Instituto:\na) Garantizar la certeza jurídica de la vivienda, de los conjuntos o unidades habitacionales, mediante las facilidades administrativas, notariales y registrales necesarios;\nb) Otorgar facilidades administrativas relacionadas con el transmisión de propiedad que los proyectos autorizados requieran;\nc) Diseñar estímulos, apoyos fiscales, créditos y subsidios para fomentar la construcción la vivienda de interés social y popular;\nVII. Establecer las normas para la producción de vivienda en la Ciudad de México.\nVIII. Determinar y definir competencias y responsabilidades específicas de los órganos de gobierno para cumplir con su obligación de respetar, garantizar, proteger y promover el derecho de los habitantes a una vivienda adecuada.\nIX. Establecer los mecanismos a través de los cuales los habitantes de la Ciudad de México, en forma individual y/o colectiva por medio de sus organizaciones sociales, sectoriales, vecinales, ya sea de carácter social o privado; participarán corresponsablemente con el Estado, para garantizar la realización de este derecho.\nX. Definir los lineamientos y criterios de la política pública que en materia de derecho a la vivienda deberán aplicar los órganos de gobierno en sus normas internas, programas, proyectos y acciones.\nXI. Establecer los instrumentos y mecanismos institucionales para que los órganos de gobierno cumplan con las obligaciones generales del Estado.\nXII. Promover que las viviendas se ubiquen en zonas que cuenten con infraestructura urbana y vial que fomenten la accesibilidad y una movilidad urbana sustentable, en donde se privilegien el uso de vehículos limpios, los medios de transporte no motorizados y/o eficientes y se favorezca la calidad de vida de las y los habitantes de la Ciudad de México;\nXIII. Integrar el Consejo de Vivienda;\n\nXIV. Propiciar, orientar y fomentar la participación de los sectores público, social, académico y privado para la producción social de la vivienda, del hábitat, mejoramiento y autoproducción de vivienda en todas sus modalidades;\nXV. Integrar el Sistema de Información de Vivienda de la Ciudad de México.\nXVI. Disponer las sanciones aplicables a los particulares que incumplan con lo establecido en esta Ley y normas reglamentarias aplicables, así como a los servidores públicos que no cumplan con estas disposiciones, independientemente de las sanciones contempladas en los ordenamientos relativos a las responsabilidades de servidores públicos.\nArtículo 2. Son de aplicación supletoria a lo no previsto en este ordenamiento, los siguientes:\nI. Ley Ambiental y de Protección a la Tierra del Distrito Federal;\nII. Ley de Desarrollo Urbano del Distrito Federal;\nIII. Ley Federal de Responsabilidades de los Servidores Públicos;\nIV. Ley de Procedimiento Administrativo del Distrito Federal;\nV. Ley de Régimen en Propiedad en Condominio para el Distrito Federal; y\nVI. El Código Civil del Distrito Federal.\nAsí como los demás ordenamientos legales relacionados con la materia de vivienda del ámbito Federal y de la Ciudad de México.\nArtículo 3. El derecho a la vivienda es un derecho humano fundamental, el cual se deberá reconocer con base en los principios establecidos en la Constitución Política de los Estados Unidos Mexicanos, y en particular la Constitución de la Ciudad de México, así como en los tratados internacionales de los que el\nEstado mexicano sea parte. La presente Ley reconoce que el derecho a una vivienda adecuada deberá cumplir con los siguientes elementos:\nI. Seguridad y certeza jurídica de la propiedad o legítima posesión;\n\nII. Disponibilidad de infraestructura, equipamientos y servicios básicos y espacios públicos;\nIII. Habitabilidad, la vivienda debe contar con espacios suficientes con relación al número de ocupantes, que permita el disfrute de la intimidad, la integración y el desarrollo personal, familiar y comunitario; también que cuente con seguridad estructural, condiciones higiénicas para evitar riesgos a la salud, y aquellos fenómenos perturbadores que están enumerados en la\nLey de Sistema de Protección Civil del Distrito Federal, así como el mejoramiento de aquellas viviendas que se encuentren declarados como afectos al Patrimonio Arquitectónico Urbanístico del Distrito Federal;\nIV. Asequibilidad, de acuerdo con el nivel de ingresos de sus adquirentes o usuarios; en donde su costo no ponga en peligro o dificulte el disfrute de otros derechos humanos por sus ocupantes;\nV. Accesibilidad a todos aquellos que por sus condiciones de edad, capacidad física o salud, requieren de condiciones especiales para resolver sus necesidades habitacionales y garantizar su movilidad urbana;\nVI. Ubicación tomando en cuenta el acceso a oportunidades de empleo, servicios de salud, escuelas, guarderías y otros servicios e instalaciones sociales, no debe de estar ubicada en zonas contaminadas o peligrosas; y\nVII. Adecuación a las soluciones arquitectónicas y urbanísticas, de los procesos productivos de la vivienda y el uso de materiales, con base en el respeto a la diversidad cultural, medioambiental y geográfica.\nArtículo 4. Por ningún motivo será obstáculo para el ejercicio del derecho a la vivienda, la condición económica, el origen étnico o nacional, apariencia física, color de piel,lengua, genero edad, discapacidades, condición social,situación migratoria, condiciones de salud, embarazo, religión, opiniones, preferencia sexual, orientación sexual, identidad de género, expresión de género, características sexuales, estado civil, creencias políticas.\nArtículo 5. Para efectos de esta Ley, se entiende por:\nI. ACCIÓN HABITACIONAL: La actividad tendiente a la producción, distribución, uso y mejoramiento de viviendas, equipamiento y los servicios urbanos de las mismas;\n\nII. ASESORÍA INTEGRAL: Acciones conjuntas que se lleven a cabo, con base en la capacidad y experiencia de los servidores públicos, enfocadas a la información, gestión, seguimiento y respuesta que brinden a las personas de la Ciudad de México, en los aspectos técnicos, sociales, jurídicos, financieros, administrativos o cualquier otro que coadyuve a brindar un servicio sin fines de lucro y con un trato digno hacia los solicitantes en materia de vivienda;\nIII. AUTOADMINISTRACIÓN: Es el proceso mediante el cual los recursos financieros para la edificación de vivienda son administrados por los beneficiarios de manera individual o colectiva;\nIV. AUTOCONSTRUCCIÓN: Es el proceso de construcción o edificación de la vivienda realizada directamente por sus propios usuarios, en forma individual, familiar o colectiva;\nV. AUTOPRODUCCIÓN: Es el proceso de gestión de suelo, construcción y distribución de vivienda bajo control directo de los usuarios de forma individual o colectiva, el cual puede desarrollarse mediante contratación de terceros o por medio de procesos de autoconstrucción.\nVI. AYUDAS DE BENEFICIO SOCIAL: Son un complemento de la inversión recuperable y tiene por objeto, que todo beneficiario de los programas del Instituto hagan realidad su garantía de derecho a la vivienda, sin que para ello se limite a su capacidad de pago;\nVII. BARRIOS ORIGINARIOS: Las subdivisiones territoriales de los pueblos originarios caracterizadas por compartir elementos comunes ya sean históricos, políticos, patrimoniales, culturales, ambientales, sociales y religiosos; o aquellas otras subdivisiones territoriales con antigüedad y arraigo centenario a través de los cuales se genera cohesión social, sentido de pertenencia e identidad;\nVIII. BENEFICIARIOS: Los sujetos favorecidos por un apoyo social o subsidio, para una acción habitacional o de un crédito para una vivienda;\nIX. BIENES VACANTES: De acuerdo con el Código Civil para el Distrito Federal, son aquellos inmuebles que no tienen dueño cierto y conocido;\nX. BOLSA DE SUELO: El conjunto de predios con vocación urbana y habitacional, debidamente inscritos, que formen parte de la reserva territorial de la Ciudad;\nXI. CIUDAD SOLIDARIA: Es la afirmación de que los derechos humanos y sociales, individuales y colectivos, no pueden subordinarse al mercado mundial, ni al sistema financiero. Además, es\n\nparte fundamental del derecho a la vivienda, al hábitat, a los servicios públicos y el derecho a la ciudad;\nXII. COMUNIDADES INDÍGENAS: Son aquellos que descienden de poblaciones que habitaban en el territorio actual del país al iniciarse la colonización y que conservan sus propias instituciones sociales, económicas, culturales y políticas, o parte de ellas;\nXIII. CRÉDITO DE VIVIENDA: Son los préstamos que se conceden con la finalidad de adquirir suelo, construir, rehabilitar, mejorar y ampliar, complementar o adquirir una vivienda;\nXIV. DERECHO A LA CIUDAD: Es el usufructo equitativo, de las ciudades dentro de los principios de sustentabilidad, democracia, equidad y justicia social. Es un derecho colectivo de las y los habitantes de la ciudad, que les confiere legitimidad de acción y de organización basado en el respeto de sus diferencias, expresiones y prácticas culturales, con el objetivo de alcanzar el pleno ejercicio del derecho a la libre autodeterminación y aun nivel de vida adecuado. Además, es un derecho interdependiente de todos los derechos humanos, internacionalmente reconocidos concebidos integralmente e incluye por tanto todos los derechos civiles, políticos, económicos, sociales, culturales, ambientales, sexuales y reproductivos reglamentados en los tratados internacionales de derechos humanos;\nXV. DERECHO A UNA VIVIENDA DIGNA Y ADECUADA: Es el derecho que tiene toda persona a tener una vivienda adecuada para sí y su familia, con una mejora continua de las condiciones de existencia;\nXVI. DESARROLLO ORIENTADO AL TRANSPORTE: Es un modelo que replantea el desarrollo urbano y la vivienda en torno al transporte público;\nXVII. ECOTECNIAS: Son aplicaciones, sistemas de instalaciones, herramientas e innovaciones tecnológicas que se pueden adaptar a cualquier espacio habitable para ayudar a conservar y restablecer el equilibrio natural, a través del uso racional de los recursos naturales;\nXVIII. EMPRESAS DESARROLLADORAS DE VIVIENDA: Son aquellas que primordialmente se dedican al desarrollo de vivienda con recursos propios y financiamientos privados;\nXIX. ESTÍMULO: Las medidas de carácter jurídico, administrativo, fiscal o financiero que aplican las dependencias, entidades y organismos del sector público, para promover y facilitar la\n\nparticipación de los sectores social y privado, en la ejecución de acciones, procesos o programas de vivienda;\nXX. FACILIDADES ADMINISTRATIVAS: Mecanismos administrativos que logran una mejora regulatoria y simplificación de trámites, a fin de garantizar el derecho a la vivienda;\nXXI. HÁBITAT: Es el conjunto de condiciones ambientales y materiales que permiten la satisfacción de las necesidades básicas de las y los habitantes al interior y exterior de su vivienda, permitiendo una adecuada habitabilidad;\nXXII. INDÍGENA: Es la persona integrante de algún pueblo o comunidad que preserva las características de su identidad originaria; la conciencia de su identidad indígena es el criterio fundamental para determinar a quienes se aplican las disposiciones contenidas en la presente\nLey;\nXXIII. INSTITUTO: El Instituto de Vivienda de la Ciudad de México; organismo encargado de la protección y realización del derecho a la vivienda de la población que por su condición socioeconómica o por otras condiciones de vulnerabilidad requieren de la acción del Estado;\nXXIV. LEY: La Ley de Vivienda para la Ciudad de México;\nXXV. MEJORAMIENTO DE VIVIENDA: La actividad orientada a atender el deterioro del inventario habitacional, ampliar, rehabilitar o restaurar el espacio de una vivienda ya construida, con la finalidad de mejorar la calidad de vida de sus ocupantes;\nXXVI. NAMA MEXICANA DE VIVIENDA SUSTENTABLE O NAMA DE VIVIENDA: Conjunto de instrumentos que certifican que la vivienda nueva en México, será construida bajo lineamientos que optimicen el uso de energía y agua, mediante el diseño arquitectónico, así como el uso de tecnologías cuyo costo-beneficio asegure la prosperidad del habitante, reduciendo la emisión de\nGases Efecto Invernadero;\nXXVII. ORGANISMOS NACIONALES DE VIVIENDA: Instituto del Fondo Nacional de Vivienda\n(INFONAVIT) y Fondo de la Vivienda del Instituto de Seguridad y Servicios Sociales de los\nTrabajadores del Estado (FOVISSSTE);\n\nXXVIII. ORGANIZACIONES SOCIALES DE VIVIENDA: Son aquellas agrupaciones de personas físicas que, actuando de manera solidaria, con un sentido social y sin fines de lucro participan en los programas y acciones que el Instituto realiza en materia de vivienda de interés social;\nXXIX. ÓRGANO LEGISLATIVO: El órgano de Gobierno encargado de la función legislativa;\nXXX. ÓRGANOS POLÍTICOS ADMINISTRATIVOS: Las Demarcaciones Políticas, Alcaldías o\nDemarcaciones Territoriales del Distrito Federal;\nXXXI. POBLACIÓN CALLEJERA: Toda persona o grupos de personas con o sin relación entre sí, que subsisten en la calle o el espacio público, utilizando recursos propios y precarios para satisfacer sus necesidades elementales;\nXXXII. POBLACIÓN EN SITUACIÓN DE RIESGO SOCIAL: Los habitantes que se encuentran en condiciones de hacinamiento, que su vivienda carezca de servicios, estén en mal estado o sean insalubres;\nXXXIII. GRUPOS DE ATENCION PRIORITARIA: Los que señala la Constitución Política de la Ciudad de México en su artículo 11\nXXXIV. POLÍTICA DE VIVIENDA: Son las medidas de carácter general que establece el Gobierno de la Ciudad de México para garantizar el derecho a la vivienda;\nXXXV. PREDIOS BALDÍOS URBANIZABLES: El inmueble situado en la zona urbana que no cuenta con edificaciones y cuya zonificación, conforme a los programas de desarrollo urbano aplicables, tiene posibilidad de aprovechamiento para edificación de vivienda;\nXXXVI. PRODUCCIÓN SOCIAL DE VIVIENDA: Es el conjunto de actividades que se realizan bajo la gestión y control directo de auto-productores y auto-constructores, que operan sin fines de lucro y que se orientan prioritariamente a atender las necesidades de la población de bajos ingresos, utilizando recursos, procedimientos constructivos y tecnologías, con base en sus propias necesidades y su capacidad de gestión y toma de decisiones. Asimismo, incluye aquella que se realiza por procedimientos de autogestión y solidarios que dan prioridad al valor de uso de la vivienda sobre la definición mercantil;\nXXXVII. PRODUCCIÓN SOCIAL DEL HÁBITAT: Conjunto de actividades de gestión para el mejoramiento ambiental, con un enfoque sustentable del espacio público, el uso de suelo,\n\ninfraestructura, servicios, equipamientos básicos y vivienda, que realizan las personas físicas o morales, productores sociales, instituciones académicas, organizaciones sociales o civiles, sin fines de lucro, bajo su control directo y que pueden utilizar recursos, asistencia técnica, financiamiento y trabajo de las personas para mejorar su calidad de vida, además de sus espacios habitacionales y comunitarios, de conformidad con los planes de desarrollo urbano vigentes;\nXXXVIII. PRODUCTORES SOCIALES: Son los pertenecientes al sector social y pueden ser personas físicas o morales, grupos organizados, organizaciones sociales, cooperativas y asociaciones de vivienda o de producción de bienes y servicios, gremios profesionales e institutos de asistencia técnica, que realizan procesos de autogestión para desarrollar la producción social del hábitat y la producción social de la vivienda, sin fines de lucro;\nXXXIX. PROGRAMAS DE VIVIENDA: Son los Programas Sectorial, Institucional y Especiales;\nXL. PROGRAMAS ESPECIALES DE VIVIENDA: Son los que desagregan en objetivos y metas de mediano y corto plazo las políticas y diferentes esquemas a aplicar por el Programa Sectorial, con la finalidad de garantizar el derecho a una vivienda digna y adecuada.\nXLI. PROGRAMA INSTITUCIONAL: El que desagrega en objetivos y metas de mediano y corto plazo las políticas y diferentes esquemas a aplicar por el Instituto, y que se deriva del Programa\nSectorial. Su vigencia será de seis años y su revisión y actualización será bianual;\nXLII. PROGRAMA SECTORIAL DE VIVIENDA: Es aquel que establecerá los ejes, objetivos, estrategias, metas y acciones que se realizarán de acuerdo a lo que establece la Ley de Planeación del Desarrollo del Distrito Federal, Su vigencia será de seis años y su revisión y actualización será bianual;\nXLIII. PUEBLOS ORIGINARIOS: Aquellos que descienden de poblaciones que habitaban en el territorio actual de la Ciudad de México en la época de la conquista o la colonización, o del establecimiento de sus actuales fronteras territoriales, y que actualmente conservan sus instituciones sociales, económicas, culturales y políticas o parte de ellas, manteniendo una continuidad histórica y que están asentados en un territorio determinado;\nXLIV. SECRETARÍA: La Secretaría de Desarrollo Urbano y Vivienda del Ciudad de México;\nXLV. SECTOR PRIVADO: Toda persona física o moral que produzca bienes o servicios relacionados con la vivienda, con fines preponderantemente de lucro;\n\nXLVI. SECTOR PÚBLICO DE VIVIENDA: Toda dependencia o entidad de la Administración Pública de la Ciudad de México, cuyas atribuciones comprendan el financiamiento, la gestión y la producción del proceso habitacional o la ordenación del territorio que incluya la vivienda, la infraestructura, los equipamientos o los servicios complementarios para la vivienda;\nXLVII. SECTOR SOCIAL: Toda persona física, moral o grupo social, que sin fines preponderantemente de lucro, realicen acciones o procesos habitacionales en beneficio de personas con ingresos iguales o inferiores a los que se requieren para adquirir una vivienda de interés social o popular, así como sus elementos complementarios;\nXLVIII. SEDATU: Secretaría de Desarrollo Agrario, Territorial y Urbano;\nXLIX. SIEDU: Sistema de Información y Evaluación del Desarrollo Urbano;\nL. SISTEMA DE INFORMACIÓN DE LA VIVIENDA: La base de datos que la Secretaría debe integrar y operar con el objeto de registrar, procesar y actualizar la información en materia de vivienda de la Ciudad de México. Esta información deberá cumplir con las disposiciones establecidas en la\nLey de Transparencia, Acceso a la Información Pública y Rendición de Cuentas de la Ciudad de\nMéxico;\nLI. SOCIEDADES COOPERATIVAS DE VIVIENDA: Es una forma de organización social, integrada por personas físicas, con base en intereses comunes y en los principios de solidaridad, democracia, equidad e igualdad, esfuerzo propio y ayuda mutua, con el propósito de satisfacer necesidades individuales y colectivas en materia de vivienda. Se constituyen con objeto de construir, adquirir, arrendar, mejorar, mantener, administrar o financiar viviendas, o de producir, obtener o distribuir materiales básicos de construcción para sus socios;\nLII. SUBSIDIO: Es el apoyo económico, en especie, servicios técnicos o administrativos, no recuperables que otorga el Gobierno de la Ciudad de México a las y los beneficiarios de los diversos Programas en materia de vivienda, con la finalidad de financiar el acceso a una vivienda, de acuerdo con los criterios de objetividad, equidad, transparencia, publicidad y temporalidad, para que sea aplicado en la obtención de una solución habitacional;\nLIII. SUSTENTABILIDAD: Conjunto de acciones que buscan un equilibrio entre los recursos económicos, sociales y ambientales, a través de la incorporación de ecotecnologías que permitan\n\nuna interrelación con el entorno urbano, de manera que se garantice el uso de los recursos del presente, preservando los recursos para futuras generaciones;\nLIV. VIVIENDA ACCESIBLE: Es aquella que está orientada hacia el diseño de la vivienda y el entorno, de tal manera que las personas puedan acceder a éstas, independiente de su condición física o social;\nLV. VIVIENDA DE INTERÉS POPULAR: vivienda cuyo precio de venta al público es superior a 6,000 veces el valor diario de la Unidad de Medida y Actualización vigente y no exceda de 10,800 veces el valor diario de dicha Unidad;\nLVI. VIVIENDA DE INTERÉS SOCIAL: vivienda cuyo precio máximo de venta al público es de 6,000 veces el valor diario de la Unidad de Medida y Actualización vigente;\nLVII. VIVIENDA PARA LOS TRABAJADORES DERECHOHABIENTES DE LOS ORGANISMOS\nNACIONALES DE VIVIENDA: vivienda cuyo precio máximo de venta al público no exceda de\n21,000 veces el valor diario de la Unidad de Medida y Actualización vigente;\nLVIII. VIVIENDA PROGRESIVA: acción destinada a satisfacer las necesidades habitacionales y cambiantes de las personas, desde las etapas iniciales, en el proceso paulatino, escalonado y discontinuo de construcción y adaptación. Se realiza en etapas a través de mejoramientos y/o ampliaciones de acuerdo con los recursos económicos y necesidades de las y los habitantes;\nLIX. VIVIENDA RURAL: Edificaciones construidas en localidades que tengan menos de 2,500 habitantes, y su principal actividad económica sea el sector primario, y\nLX. VIVIENDA SUSTENTABLE: vivienda cuyo precio de venta al público es superior a 10,800 veces el valor diario de la Unidad de Medida y Actualización vigente y no exceda de 17,314 veces el valor diario de dicha Unidad.\nCAPÍTULO II\nDE LAS AUTORIDADES Y SU COMPETENCIA\nArtículo 6. El Gobierno de la Ciudad de México, diseñará y ejecutará una política de vivienda con la participación de los sectores público, privado, social, colegios, académico, entre otros, de acuerdo con las disposiciones de esta Ley.\n\nArtículo 7. Son autoridades competentes para la aplicación de esta Ley y demás disposiciones legales en materia de vivienda, las siguientes:\nI. La o el Titular de la Jefatura de Gobierno de la Ciudad de México;\nII. La Secretaría;\nIII. El Instituto;\nIV. Los Órganos Políticos Administrativos; y\nV. El Órgano Legislativo de la Ciudad de México.\nArtículo 8. La o el Titular de la Jefatura de Gobierno de la Ciudad de México, a través de la Secretaría, elaborará y enviará para conocimiento del Órgano Legislativo de la Ciudad de México, dentro del primer año de cada período de gobierno el Programa Sectorial de Vivienda.\nArtículo 9. Las dependencias y entidades de la Administración Pública de la Ciudad de México, con injerencia en la materia, participarán en la ejecución de la política de vivienda y el desarrollo habitacional, de manera coordinada con el sector público federal y estatales colindantes, con la finalidad de coadyuvar en la ejecución de la política de vivienda y el desarrollo habitacional en la Ciudad de México y el área metropolitana, conforme a los ordenamientos jurídicos aplicables en la materia.\nArtículo 10. El Fideicomiso de Recuperación Crediticia (FIDERE) es el organismo encargado de la recuperación de los créditos del Instituto.\nSección I\nTitular De La Jefatura De Gobierno\nArtículo 11. La o el Titular de la Jefatura de Gobierno del Ciudad de México, para efectos de esta Ley, tiene las siguientes atribuciones:\nI. Formular, conducir y evaluar la política y programación de vivienda en el Ciudad de México, conforme a los ordenamientos jurídicos aplicables en la materia de planeación urbana y de vivienda, así como a otros programas que incidan en la materia;\n\nII. Implementar las acciones conducentes que garanticen la transversalidad en materia de vivienda, desarrollo urbano, movilidad, social, económico, espacio público, patrimonio cultural y urbano, y medio ambiente, en coordinación con las dependencias y entidades de la\nAdministración Pública Local;\nIII. Fomentar, reconocer y concertar la participación de los diferentes actores y productores de vivienda, instituciones académicas y organismos de los sectores social y privado;\nIV. Fomentar la creación de instrumentos económicos, técnicos, jurídicos, administrativos, ambientales y sociales que estimulen la producción de vivienda, prioritariamente la producción social del hábitat;\nV. Promover instrumentos y mecanismos que propicien la simplificación y faciliten los procedimientos y trámites para el desarrollo de la producción social de vivienda y del hábitat;\nVI. Celebrar convenios o acuerdos de coordinación con la Federación y la entidades federativas en materia habitacional, en concordancia con el Programa General de Desarrollo Urbano de la\nCiudad de México; de manera que se estimule y fomente la producción de vivienda en sus diferentes tipos y modalidades;\nVII. Presentar, a través de la Secretaría, el Programa Sectorial de Vivienda, así como su publicación, teniendo en cuenta las opiniones del Consejo de Vivienda en lo que se considere conducente;\nVIII. Fomentar la creación de instrumentos fiscales y financieros que estimulen la producción social de vivienda y del hábitat en sus diferentes modalidades; además de promover una simplificación administrativa que facilite su desarrollo;\nIX. Proponer al Órgano Legislativo los mecanismos que permitan incrementar la densidad habitacional en aquellas zonas que se consideren adecuadas para la construcción de vivienda social, popular y para los Trabajadores Derechohabientes de los Organismos Nacionales de\nVivienda; y\nX. Las demás que, conforme a esta Ley y demás disposiciones legales, le correspondan.\n\nSección II\nDe La Secretaría\nArtículo 12. La Secretaría conforme a sus atribuciones, será la responsable de diseñar, proponer y coadyuvar a la integración, coordinación, análisis y ejecución de la política de vivienda. En este sentido, corresponde a la Secretaría:\nI. Elaborar los Programas Sectorial y Especiales de Vivienda, para satisfacer las diversas necesidades que tiene la población en materia de vivienda en el ámbito de sus competencias;\nII. Aplicar el Programa Sectorial de Vivienda;\nIII. Proponer, en congruencia con los Programas de Desarrollo Urbano, los criterios normativos para la dotación de suelo, infraestructura, servicios y equipamiento adecuados para la vivienda;\nIV. Determinar las políticas de desarrollo urbano para la localización, provisión de infraestructura, servicios y equipamientos, que contribuyan al ordenamiento en la ocupación y uso del territorio de la Ciudad de México, conforme a los ordenamientos jurídicos aplicables en la materia;\nV. Celebrar convenios de coordinación con el Gobierno Federal y entidades federativas colindantes, para el establecimiento de acciones que fortalezcan la ejecución de una política de vivienda en la Ciudad de México y en su Zona Metropolitana, en los términos de la legislación aplicable;\nVI. Promover esquemas y proponer programas para fomentar la vivienda en arrendamiento;\nVII. Diseñar y operar el Sistema de Información de la Vivienda, el cual complementará al Sistema de Información y Evaluación del Desarrollo Urbano;\nVIII. Brindar un informe sobre las medidas de mitigación, en el cual se establezca el monto y el predio por el que fueron cobradas, así como la zona en la cual incidieron;\nIX. Desarrollar una política de suelo, reservas territoriales con viabilidad financiera, técnica, ambiental y jurídica, para el desarrollo del Programa Institucional, en concordancia con los diferentes Programas de Desarrollo Urbano y de Ordenamiento Ecológico del Ciudad de México;\ny\n\nX. Diseñar estrategias que permitan atender, integrar y desincentivar los asentamientos humanos irregulares.\nXI. Vigilar que los programas de construcción de vivienda para la venta, promovidos por el sector privado, cumplan con los requisitos establecidos para el otorgamiento de facilidades administrativas.\nSección III\nDel Instituto\nArtículo 13. El Instituto es el principal instrumento del gobierno de la Ciudad de México para la protección y realización del derecho a la vivienda de la población que por su condición socioeconómica o por otras condiciones de vulnerabilidad, requieren de la acción del Estado para garantizarlo, de tal manera que para dar cumplimiento a esta Ley tendrá además de las atribuciones comprendidas en su decreto de creación, las siguientes:\nI. Elaborar el Programa Institucional de Vivienda de interés social y popular en términos de lo establecido por la Ley de Planeación del Desarrollo del Distrito Federal, que contenga por lo menos, los siguientes elementos: Programa de Vivienda en Conjunto, Programa de\nMejoramiento de Vivienda, Rescate de Cartera Hipotecaria, Programa de Vivienda en Riesgo,\nPrograma Comunitario de Producción y Gestión Social del Hábitat, y Vivienda en Uso.\nII. Diseñar, implementar y realizar las acciones que permitan satisfacer las necesidades de vivienda de interés social y popular, producción social del hábitat y de la vivienda para las y los habitantes de la Ciudad de México;\nIII. Deberá promover esquemas y programas para fomentar la vivienda en arrendamiento de interés social;\nIV. Establecer las medidas conducentes para asegurar el cumplimiento de los programas aprobados en materia de vivienda de interés social;\nV. Coordinar las acciones que adopten otros organismos públicos relacionados con la vivienda de interés social y popular;\n\nVI. Fomentar la creación de instrumentos fiscales y financieros que estimulen la producción social de la vivienda en sus diferentes modalidades;\nVII. Supervisar integralmente los mecanismos que le permitan dar seguimiento, vigilar y controlar la adecuada aplicación de los recursos en las diversas fases del ejercicio del crédito.\nVIII. Diseñar esquemas de crédito, subsidio y brindar asistencia técnica a los beneficiarios en los programas de autoproducción, autoadministración, autoconstrucción y producción social de la vivienda;\nIX. Elaborar el padrón de las organizaciones sociales de vivienda con la finalidad de registrar, apoyar y evaluar las acciones individuales que realicen en materia de vivienda de interés social.\nDicha información deberá ser publicada y actualizada al menos una vez cada tres meses en el portal del Instituto, conforme a los ordenamientos jurídicos aplicables en la materia;\nX. Otorgar crédito de manera individual o colectiva a los miembros de las organizaciones sociales, cooperativas de vivienda y asociaciones civiles, siempre y cuando se sujeten a las Reglas de\nOperación del mismo; y\nXI. Fortalecer una vez concluidos los proyectos de vivienda y entregadas éstas a los beneficiarios, la organización de los vecinos, de modo que se garantice el mantenimiento de los inmuebles y se propicie una cultura condominal, a través de la Procuraduría Social de la Ciudad de México.\nArtículo 14. El Instituto, en el ámbito de sus atribuciones, será el responsable de evaluar e informar al\nConsejo de Vivienda de la ejecución del Programa Institucional de Vivienda.\nArtículo 15. Para ser titular de la Dirección General del Instituto, se requiere:\nI. Ser ciudadana o ciudadano mexicano en pleno goce y ejercicio de sus derechos;\nII. Contar con título profesional;\nIII. Contar con formación y experiencia acreditable en materia de vivienda;\nIV. No ser, ni haber sido dirigente de algún partido político cuando menos tres años antes al momento de su designación;\n\nV. No estar inhabilitado para ocupar un cargo como servidor público; y\nVI. No tener conflicto de interés.\nArtículo 16. Las y los servidores públicos se apegarán a los principios de legalidad, honradez, lealtad, imparcialidad y eficiencia, a que alude la Ley Federal de Responsabilidades de los Servidores Públicos.\nArtículo 17. El Instituto, anualmente, a través de su Órgano de Gobierno, emitirá y publicará los criterios de inversión, evaluación y asignación de recursos, adquisición de inmuebles y reglas de operación y funcionamiento, a efecto de asegurar la eficiencia, transparencia, rentabilidad y el cumplimiento de sus fines, para lo cual ordenará su publicación en la Gaceta Oficial de la Ciudad de México.\nSección IV\nDe Los Órganos Políticos Administrativos\nArtículo 18. Los Órganos Políticos Administrativos tendrán como atribuciones en materia de vivienda, las siguientes:\nI. Formular diagnósticos a través de la participación ciudadana, sobre los requerimientos de vivienda en cada demarcación, para que la Secretaría y el Instituto los consideren en los programas de vivienda; y\nII. Velar, en coordinación con la Secretaría y las autoridades competentes, por el mantenimiento y mejora del entorno de la vivienda, de tal manera que el espacio público sea equitativo, accesible, seguro y de calidad.\nSección V\nDel Órgano Legislativo De La Ciudad De México\nArtículo 19. El Órgano Legislativo de la Ciudad de México, será competente en materia de vivienda, para:\nI. Velar por los intereses de la ciudadanía en materia de vivienda;\nII. Salvaguardar la convivencia y coordinación entre las autoridades de la presente Ley;\n\nIII. Vigilar el cumplimiento de la política de vivienda;\nIV. Aprobar anualmente el presupuesto en materia de vivienda y suelo;\nV. Citar a las y los servidores públicos de la Administración Pública de la Ciudad de México, para que rindan su informe anual sobre las labores en materia de vivienda, de conformidad con las leyes reglamentarias del propio Órgano Legislativo de la Ciudad de México,\nVI. Dar seguimiento y opinar sobre los programas de vivienda;\nVII. Analizar, dictaminar y, en su caso, aprobar los cambios de zonificación propuestos por la o el titular de la Jefatura de Gobierno para dar cumplimiento a los Programas de Vivienda; y\nVIII. Las demás que otorga la Constitución Política de los Estados Unidos Mexicanos, el Estatuto de Gobierno del Distrito Federal, la Ley Orgánica del Órgano Legislativo de la Ciudad de México, y demás ordenamientos aplicables en la materia.\nSección VI\nDe La Coordinación\nArtículo 20. La coordinación entre las autoridades locales y federales en materia de vivienda, corresponderá a la o el Titular de la Jefatura de Gobierno, y tendrá como principal objetivo realizar acciones de fomento y apoyo a la vivienda, con el fin de reducir el rezago de vivienda que existe en la Ciudad de México, así como mejorar su entorno urbano, a través de convenios y acuerdos que para tales efectos se emitan.\nLos convenios y acuerdos de coordinación que al efecto se formulen, serán públicos.\nArtículo 21. Los órganos de gobierno la Ciudad de México, en coordinación con las entidades federales, fomentarán:\nI. La articulación y congruencia de las políticas y de los programas nacionales de vivienda, con los de los municipios de otros estados de la República Mexicana y los Órganos Políticos\nAdministrativos;\nII. La disposición y transferencia de recursos, para la ejecución de los programas de vivienda;\n\nIII. La donación, transferencia, asignación, venta, entre otras acciones, de suelo e inmuebles para el desarrollo de los programas de vivienda;\nIV. El otorgamiento de estímulos y apoyos para la adquisición, construcción y mejoramiento de la vivienda;\nV. La asistencia técnica y capacitación a los municipios y Órganos Políticos Administrativos para la programación, instrumentación, ejecución y evaluación de los programas de vivienda;\nVI. El establecimiento de mecanismos de información y elaboración de estudios sobre las necesidades, inventario, modalidades y características de la vivienda y de la población;\nVII. Priorizar la construcción, dotación y operación de servicios públicos y equipamientos para la vivienda, de acuerdo con los lineamientos establecidos;\nVIII. Les corresponde a las autoridades, coordinarse en proyectos de vivienda tanto al interior de la Ciudad de México, así como con los municipios conurbados, con la finalidad de sumar esfuerzos y tener un uso adecuado de los recursos, teniendo en cuenta siempre una visión metropolitana;\nIX. Establecer los mecanismos para garantizar una adecuada distribución de responsabilidades, así como la congruencia y complementariedad entre las políticas, programas y acciones estatales de vivienda y suelo, con los de los Órganos Políticos Administrativos y municipios;\nX. Fomentar y apoyar los procesos de producción social de vivienda, del hábitat y de vivienda rural;\nXI. Fomentar y apoyar a las cooperativas de ayuda mutua;\nXII. Organizar y promover la producción y distribución de materiales de construcción que satisfagan las Normas Oficiales Mexicanas;\nXIII. Promover la simplificación de los trámites administrativos que se requieran para la ejecución de acciones de vivienda, reconociendo los distintos tipos y modalidades de producción habitacional;\n\nXIV. Promover mecanismos de coordinación y planeación que permitan identificar las prioridades comunes para la Zona Metropolitana y conjuntar recursos para financiar proyectos que detonen los Programas de Vivienda con una visión regional y metropolitana;\nXV. Trabajar en conjunto con los Órganos Políticos Administrativos y con los municipios de la\nZona Metropolitana, para la provisión de los servicios públicos; y\nXVI. Realizar las demás acciones tendientes a cumplir con los fines previstos en esa Ley.\nArtículo 22. Los Órganos Políticos Administrativos, junto con las diversas instituciones de la Administración\nPública de la Ciudad de México en materia de vivienda, trabajarán de manera conjunta y coordinada para hacer un uso racional de los recursos públicos.\nSección VII\nDe La Concertación Con Los Sectores Social Y Privado\nArtículo 23. La o el Titular de la Jefatura de Gobierno, a través de la Secretaría y el Instituto, promoverá la participación de los sectores social y privado en la instrumentación de los programas y acciones de vivienda, así como para integrar los diferentes sistemas de información de los Organismos Nacionales de Vivienda al SIEDU, conforme al objeto de la presente Ley, siempre procurando el bien común por encima de todo.\nArtículo 24. Los acuerdos y convenios que se celebren con los sectores social y privado podrán tener por objeto:\nI. Buscar que un mayor número de personas, tengan acceso a una vivienda, estableciendo mecanismos que garanticen este derecho, preferentemente a la población en situación de pobreza;\nII. Promover la creación de fondos e instrumentos para la generación oportuna de vivienda y suelo para el desarrollo del Programa Institucional;\nIII. Desarrollar, aplicar y evaluar normas, tecnologías, técnicas y procesos constructivos que reduzcan los costos de construcción y operación, faciliten la autoproducción, autoadministración y autoconstrucción de vivienda, eleven la calidad y la eficiencia energética de la vivienda, y propicien la preservación y el cuidado del ambiente y los recursos naturales;\n\nIV. Ejecutar acciones y obras urbanas para la construcción, mejoramiento y conservación de vivienda, así como para la adquisición de suelo para el desarrollo del Programa Institucional;\nV. Mantener actualizada la información referente al inventario habitacional, para su integración al Sistema de Información;\nVI. Impulsar y desarrollar modelos educativos para formar especialistas en vivienda, capacitar a usuarios y fomentar la investigación en vivienda y suelo;\nVII. La utilización de tecnologías para el aprovechamiento, captación, tratamiento y potabilización del agua; y\nVIII. Las demás acciones que acuerden las partes para el cumplimiento de esta.\nArtículo 25. Todos los acuerdos y convenios que se celebren con el sector privado, se considerarán un bien común de dominio público, accesible a cualquier persona en los términos y condiciones conforme a los ordenamientos aplicables a la materia.\nTÍTULO II\nDE LA POLÍTICA Y DE LOS PROGRAMAS DE VIVIENDA\nCAPITULO I\nDE LA POLÍTICA DE VIVIENDA\nArtículo 26. La política de vivienda de la Ciudad de México, se orientará por los siguientes principios y lineamientos generales con la finalidad de respetar, proteger, promover y garantizar, bajo el principio de igualdad y no discriminación, el derecho a una vivienda adecuada para todas las personas que habitan en la Ciudad de México, en función de los siguientes principios:\nI. Garantizar la congruencia entre los programas de vivienda y el Programa General de Desarrollo, el Programa General de Derechos Humanos, y los programas relacionados con el ordenamiento territorial y el desarrollo sustentable de la Ciudad de México.\nII. Adoptar medidas de protección y de garantía de realización para atender prioritariamente a la población que:\n\na) Habita en viviendas en condiciones de riesgo estructural, riesgo hidrometeorológico u otro tipo de riesgo que pueda afectar su salud o su integridad física;\nb) Ocupa viviendas que carecen de servicios básicos;\nc) No cuenta con seguridad jurídica de la posesión o la propiedad de la vivienda que habita;\nd) Requiere de un espacio adecuado en donde vivir;\ne) Vive en condiciones de hacinamiento;\nf) Cuya vivienda está construida parcial o totalmente con materiales precarios, o requiere mantenimiento.\nIII. Incrementar los recursos públicos destinados al desarrollo de los Programas de Vivienda;\nIV. Garantizar que los recursos y los programas públicos atiendan a la población objetivo.\nV. Ampliar y adecuar los Programas y sus reglas para atender las diversas problemáticas que impiden la plena realización del derecho a la vivienda.\nVI. Promover y ampliar la participación de la sociedad en la planeación y en el diseño de los programas de vivienda, así como en su ejecución y evaluación, reconociendo tanto las formas de organización social no lucrativas como las del sector privado, e involucrando además a las instituciones públicas y privadas de educación e investigación.\nVII. Apoyar prioritariamente la producción social de la vivienda en sus diversas modalidades.\nVIII. Promover la participación del sector financiero para ampliar las posibilidades de acceder a una vivienda adecuada a más amplios sectores de la población.\nIX. Destinar recursos a la investigación tecnológica, innovación y promoción de sistemas constructivos eficientes y sustentables;\nX. Establecer una adecuada y permanente coordinación con las áreas del gobierno federal que diseñan y ejecutan los programas federales de vivienda.\nXI. Diseñar mecanismos o programas especiales que permitan la mejor aplicación de los recursos con los que cuentan los derechohabientes de los organismos nacionales de vivienda.\n\nXII. Proteger los inmuebles de uso habitacional que forman parte de nuestro patrimonio histórico, artístico y cultural.\nXIII. Incorporar el uso de materiales y de ecotecnologías y otras medidas en las acciones de mejoramiento y construcción de vivienda, que contribuyan a un desarrollo sustentable de la\nCiudad.\nXIV. Disminuir el rezago habitacional;\nXV. Fomentar la construcción de vivienda en usos mixtos, la existencia de plantas bajas activas, incorporación de espacios comunitarios, en donde las viviendas cuenten con la infraestructura de servicios públicos, equipamientos, redes de transporte público e infraestructura de movilidad, que propicie el uso de medios no motorizados, así como el diseño de desarrollos orientados al transporte;\nXVI. Fomentar el Desarrollo Orientado al Transporte;\nXVII. Impulsar zonas policéntricas, compactas, productivas, incluyentes y sustentables, que faciliten la movilidad urbana y eleven la calidad de vida de sus habitantes;\nXVIII. Fomentar, apoyar y vincular los procesos de autoconstrucción, autoadministración y autoproducción;\nXIX. Promover la producción de la vivienda rural y para los grupos de atención prioritaria de acuerdo a las necesidades y circunstancias de cada sector;\nXX. Crear mecanismos para combatir los procesos de acaparamiento, subutilización y especulación de los terrenos, que tiendan a revertir a favor de la sociedad el valor generado por el desarrollo y el crecimiento urbano;\nXXI. Difundir de forma permanente, clara y sencilla los programas públicos de vivienda y los resultados de su ejecución, así como la información relativa al diagnóstico de la situación que guarda el derecho a la vivienda en la Ciudad de México;\nXXII. Las demás que establezcan las disposiciones legales en la materia.\n\nCAPÍTULO II\nDE LOS PROGRAMAS DE VIVIENDA\nArtículo 27. El gobierno de la Ciudad de México aplicará los principios y lineamientos de la política de vivienda, principalmente, mediante los siguientes Programas:\nI. El Programa Sectorial de Vivienda;\nII. El Programa Institucional; y\nIII. Los Programas Especiales.\nArtículo 28. El Programa Sectorial de Vivienda de la Ciudad de México contendrá por lo menos, los siguientes elementos:\nI. Diagnóstico de la situación habitacional, así como los escenarios de corto, mediano y largo plazo;\nII. Las metas y objetivos específicos en función de las prioridades establecidas en los principios y lineamientos de la política de vivienda y en el Programa General de Desarrollo de la Ciudad de\nMéxico;\nIII. Congruencia con la programación de desarrollo económico, social y urbano sustentable de la\nCiudad de México;\nIV. Estrategia general de mediano y largo plazo;\nV. Estrategia e instrumentos financieros, jurídicos y administrativos, especialmente los dirigidos a la producción social de vivienda y del hábitat, la atención a la vivienda en condiciones de emergencia y en situación de riesgo, además de la de vivienda popular y de interés social y aquellos que promuevan el establecimiento de vivienda ecológica;\nVI. Estrategia para propiciar la participación de la población, de los productores sociales y privados;\nVII. Estrategia para la implementación del Desarrollo Orientado al Transporte en coordinación con la Secretaría y la Secretaría de Movilidad;\n\nVIII. Metas de corto, mediano y largo plazo compatibles con el ejercicio del derecho a la vivienda y con los intereses del sector público, social y privado;\nIX. Programación anual;\nX. Mecanismos de coordinación con el Gobierno Federal y con los gobiernos de las entidades colindantes;\nXI. Lineamientos de concertación con los productores sociales y privados; y\nXII. Lineamientos para que los desarrollos de vivienda garanticen el cumplimiento de las disposiciones aplicables en materia de medio ambiente y se edifiquen con elementos de ecotecnias y sustentabilidad, que permitan el uso eficiente de los recursos naturales.\nArtículo 29. El Programa Sectorial de Vivienda se ejecutará de acuerdo a las siguientes modalidades individuales o colectivas de financiamiento:\nI. Inversión directa del Gobierno de la Ciudad de México;\nII. Ahorro de los beneficiarios; y\nIII. Otros fondos e instrumentos financieros nacionales y/o internacionales que promuevan recursos para la vivienda, que garanticen la atención de los grupos de atención prioritaria.\nArtículo 30. Dentro del primer año de cada período de gobierno, quien ocupe la Jefatura de Gobierno de la Ciudad de México, a través de la Secretaría, elaborará y enviará para conocimiento del Órgano\nLegislativo, el Programa Sectorial de Vivienda, el cual se publicará y difundirá de conformidad con lo establecido en la normatividad correspondiente.\nArtículo 31. En la definición de los objetivos, las líneas programáticas, metas y estrategias del Programa\nSectorial se deberán contemplar el diagnóstico, las estrategias y las acciones respecto a la situación del derecho a la vivienda, contenidas en el Programa General de Derechos Humanos de la Ciudad de México.\nArtículo 32. Los Programas Institucional y Especiales de Vivienda, deberán contener como mínimo:\nI. El diagnóstico;\n\nII. Las metas y objetivos específicos en función de las prioridades establecidas en el Programa\nSectorial de Vivienda;\nIII. Los subprogramas, líneas programáticas y acciones, que especifiquen la forma en que contribuirán a la conducción del desarrollo de la entidad;\nIV. Las relaciones con otros instrumentos de planeación;\nV. Las responsabilidades que regirán el desempeño en su ejecución;\nVI. Las acciones de coordinación, en su caso, con dependencias federales y otras entidades o municipios; y\nVII. Los mecanismos específicos para la evaluación, actualización y, en su caso, corrección del programa.\nArtículo 33. La o el Titular de a Jefatura de Gobierno y la Secretaría, deberán considerar las opiniones emitidas por el Consejo de Vivienda, sobre los programas de vivienda.\nArtículo 34. Para la elaboración de la política y los programas de Vivienda, el ejecutivo tomará en cuenta y se apoyará en las propuestas que los sectores social, privado y los particulares interesados, envíen al\nConsejo de Vivienda.\nArtículo 35. Los programas de vivienda podrán realizarse en los predios que cuenten con los siguientes criterios:\nI. Se ubiquen en suelo urbano conforme a los Programas de Desarrollo Urbano vigentes;\nII. Se localicen preferentemente en la proximidad de las estaciones del sistema de transporte público estructurado; y\nIII. Se garantice el equipamiento urbano básico.\nArtículo 36. Los Programas de Vivienda deberán apegarse a lo establecido en los ordenamientos jurídicos aplicables en la materia.\n\nCAPÍTULO III\nDEL CONSEJO DE VIVIENDA\nArtículo 37. El Consejo de Vivienda, será la instancia de consulta y asesoría del Ejecutivo, que tendrá como objeto:\nI. Proponer medidas para la planeación de vivienda; y\nII. Formular opiniones, dar seguimiento y evaluar la Política de Vivienda de la Ciudad de México.\nEl Consejo de Vivienda deberá enviar sus opiniones a las autoridades encargadas de formular y conducir la política de vivienda en la Ciudad.\nLas autoridades, en un lapso no mayor a 60 días hábiles, tendrán la obligación de informar a la opinión pública la respuesta a los planteamientos del propio Consejo.\nArtículo 38. Para el cumplimiento de su objeto, el Consejo de Vivienda tendrá las siguientes funciones:\nI. Conocer, analizar y formular propuestas con respecto a las políticas de vivienda y desarrollo urbano, contenidas en los programas de Vivienda y emitir opiniones sobre su cumplimiento, con una visión de coordinación metropolitana;\nII. Conocer, analizar y formular propuestas del Sistema de Información de la Vivienda;\nIII. Opinar sobre los presupuestos destinados a programas de vivienda;\nIV. Presentar estudios en materia de vivienda;\nV. Recibir y analizar las propuestas que los sectores social y privado y los particulares interesados, les hagan llegar;\nVI. Emitir los lineamientos para su operación y funcionamiento; y\nVII. Aprobar la creación de comités y grupos de trabajo, para la atención de temas específicos y emitir los lineamientos para su operación.\n\nArtículo 39. El Consejo de Vivienda se integrará de la siguiente manera:\nI. Lo presidirá la o el Titular de la Jefatura de Gobierno;\nII. La suplencia, recaerá en la o el Titular de la Secretaría;\nIII. El Secretario Técnico será la o el Titular de la Dirección General del Instituto;\nIV. Quien presida las Comisiones de Vivienda, Desarrollo e Infraestructura Urbana, Movilidad y\nPreservación de Medio Ambiente, Protección Ecológica y Cambio Climático del Órgano\nLegislativo de la Ciudad de México,\nV. Un representante nombrado por la SEDATU;\nVI. Un representante de cada una de las dependencias, órganos desconcentrados, organismos descentralizados y entidades de la administración pública local relacionadas con la vivienda;\ndesarrollo urbano, medio ambiente y movilidad;\nVII. Un representante de cada colegio, del sector académico y de las cámaras empresariales que estén relacionados con el sector vivienda; y\nVIII. Representantes del sector social, cuya participación será paritaria con respecto al resto de los representantes.\nArtículo 40. El Consejo de Vivienda sesionará de manera ordinaria, cuando menos una vez por trimestre, y de manera extraordinaria cuando así se requiera.\nArtículo 41. La participación y desempeño del cargo como miembro en el Consejo, será a título honorífico, por lo que sus integrantes no percibirán retribución o contraprestación alguna por este concepto.\nArtículo 42. Para su funcionamiento, el Consejo de Vivienda deberá emitir su reglamento, el cual determinará su forma de organización, integración y de trabajo, observando siempre los principios de pluralidad, equidad y autonomía del Gobierno de la Ciudad de México en su toma de decisiones.\nTÍTULO III\n\nDE LA SUSTENTABILIDAD DEL MEDIO AMBIENTE, DEL HÁBITAT Y DEL\nESPACIO PÚBLICO DE LA CIUDAD DE MÉXICO\nCAPÍTULO I\nDE LA SUSTENTABILIDAD DEL MEDIO AMBIENTE\nArtículo 43. El Instituto, en coordinación con las autoridades competentes, deberá prever en la construcción de la vivienda, la implementación de calentadores solares, huertos urbanos, así como sistemas de tratamiento, recolección y potabilización del agua, entre otras.\nArtículo 44. El Instituto, en coordinación con el Gobierno de la Ciudad y dependencias federales, gestionará apoyos, subsidios o créditos para la implementación de ecotecnologías en las viviendas.\nArtículo 45. La administración pública de la Ciudad de México, diseñará mecanismos de promoción para la innovación e intercambio tecnológico en la producción y el empleo de materiales y productos para la construcción de vivienda, privilegiando las propuestas que realicen las instituciones públicas de investigación y educación superior del país.\nArtículo 46. El objeto de la aplicación de las ecotecnologías, será:\nI. Mejorar la calidad de vida de las y los beneficiarios;\nII. Disminuir el consumo de agua, gas y energía eléctrica, optimizando el uso de los recursos naturales implicados;\nIII. Mitigar las emisiones de Dióxido de Carbono a la atmósfera; e\nIV. Incrementar el valor patrimonial de la unidad de vivienda.\nArtículo 47. Las ecotecnologías que se incorporen a las unidades de vivienda, deberán garantizar un ahorro, buscando cumplir con los estándares de la NAMA de Vivienda Sustentable o, en su caso, de la política de vivienda sustentable vigente, ligado al nivel de ingreso de la o el beneficiario de una acción habitacional o de un crédito para la obtención de una unidad de vivienda.\nArtículo 48. Con el objeto de que las ecotecnologías cumplan con los ahorros esperados y la calidad, durabilidad y eficiencia indicadas por los fabricantes y/o proveedores, el usuario final de la vivienda deberá recibir de la empresa desarrolladora de vivienda y/o del proveedor de ecotecnologías, una capacitación\n\nbásica sobre el uso y mantenimiento de las ecotecnias instaladas en su vivienda; así como las garantías correspondientes en cuestión de calidad, funcionamiento e instalación.\nAdicionalmente deberán entregar el manual de mantenimiento preventivo y correctivo, impreso y de ser posible, electrónico, de cada ecotecnia.\nArtículo 49. El Gobierno de la Ciudad, a través de la Secretaría del Medio Ambiente, promoverá la utilización, educación y capacitación para el uso de las ecotecnias y el cuidado y respeto del medio ambiente.\nCAPÍTULO II\nPRODUCCIÓN SOCIAL DEL HÁBITAT Y EL ESPACIO PÚBLICO\nArtículo 50. Las áreas donde se concentren proyectos de vivienda para satisfacer la demanda de la población, deberán contemplar acciones de mejoramiento en el entorno de la vivienda, el diseño de infraestructura urbana para fomentar la movilidad no motorizada, con la finalidad de mejorar el espacio público así como para garantizar el abastecimiento de los servicios públicos y la movilidad urbana sustentable.\nArtículo 51. El Instituto deberá promover la producción social del hábitat, para el mejoramiento ambiental, con un enfoque sustentable del espacio público, el uso de suelo, infraestructura, servicios, equipamientos básicos y vivienda; en coordinación con las personas físicas o morales, productores sociales, instituciones académicas, organizaciones sociales o civiles, sin fines de lucro, que puedan utilizar sus recursos, asistencia técnica, financiamiento y trabajo, para garantizar el mejoramiento de la calidad de vida de las y los habitantes de las unidades habitacionales de interés social y popular, a través del impulso del Programa\nComunitario de Mejoramiento Barrial, entre otros.\nArtículo 52. La Secretaría, en coordinación con las autoridades competentes, deberá fomentar la conformación, rehabilitación y preservación de los espacios públicos, con la finalidad de brindar beneficios físicos y emocionales, que se traduzcan en un sentimiento de bienestar y libertad, pérdida o reducción considerable del estrés y la inseguridad, mejoramiento de la imagen y el entorno de las unidades habitacionales en general.\nEn todas las acciones que se realicen, se deberá garantizar la seguridad a toda la población y en especial a las mujeres, niñas, niños, adultos mayores y personas con discapacidad, en el espacio público.\n\nTÍTULO IV\nVIVIENDA ADECUADA E INCLUYENTE\nCAPÍTULO ÚNICO\nDE LA VIVIENDA ACCESIBLE Y ASEQUIBLE\nArtículo 53. El Gobierno de la Ciudad de México, a través de la Secretaría y el Instituto, dentro de los\nProgramas de Vivienda, deberán promover condiciones de igualdad y equidad que garanticen el derecho a una vivienda a los diferentes sectores de la población conforme a sus características socioeconómicas, culturales y demográficas, prioritariamente a la población de bajos recursos económicos.\nArtículo 54. La Secretaría y el Instituto, en el ámbito de sus atribuciones, deberán prever acciones en las viviendas para fomentar la accesibilidad para personas con discapacidad y adultos mayores, dándoles preferencia en plantas bajas y primeros pisos.\nArtículo 55. La Secretaría y el Instituto, establecerán en los Programas de Vivienda, los mecanismos necesarios a fin de facilitar el acceso a una vivienda a las y los jóvenes, de conformidad con lo siguiente:\nI. Promover el fortalecimiento de sus derechos humanos; y\nII. Procurar el establecimiento de condiciones de igualdad en el entorno físico, promoviendo la equidad y la participación social, con el propósito de ampliar la cobertura de atención para la adquisición de una vivienda y el acceso a los diversos Programas de Vivienda.\nArtículo 56. En la Ciudad de México, existen pueblos originarios, barrios y comunidades de indígenas residentes, por lo que los Programas de vivienda, contemplarán lo siguiente:\nI. El mejoramiento y producción social de viviendas que contribuyan al aumento del nivel de vida de la población indígena de la Ciudad de México;\nII. El financiamiento e impulso de programas de vivienda rural;\nIII. Las particularidades culturales y el respeto al hábitat de dicha población o comunidad indígena, ya sea originaria o residente en la Ciudad de México;\nIV. En la edificación y construcción de la vivienda específica para la población indígena, se incorporarán los espacios comunitarios destinados a desarrollar actividades culturales y\n\nproductivas propias de sus usos y costumbres, de manera que se fortalezca su identidad étnica en la Ciudad de México;\nV. El acceso a la información, requerimientos y servicios a la población indígena se hará en su lengua materna cuando así lo requieran;\nVI. Para la autoconstrucción, autoproducción y autoadministración, se brindará capacitación y asesoría técnica; y\nVII. Para el financiamiento de vivienda para la población indígena, se deberán aplicar esquemas de crédito y subsidio específicos, de acuerdo a su situación económica o social.\nArtículo 57. El Gobierno de la Ciudad de México, a través de la Secretaría y el Instituto, aplicará, de manera igualitaria los Programas de Vivienda para jefas y jefes de hogar y los grupos de atención prioritaria, con el objeto de satisfacer sus necesidades de acceso a una vivienda.\nArtículo 58. El Gobierno de la Ciudad de México, a través de la Secretaría y el Instituto, diseñará y aplicará\nProgramas de Vivienda para las y los trabajadores de la Ciudad de México, cuyo objeto será establecer estímulos y condiciones para la producción de vivienda que se orientan prioritariamente a atender las necesidades habitacionales de la población. Asimismo, deberá considerar todas las acciones y medidas administrativas, jurídicas y operativas que garanticen su cumplimiento, respetando siempre la zonificación establecida en los Programas de Desarrollo Urbano o, en su caso, llevar a cabo el procedimiento establecido para su modificación por parte del Órgano Legislativo.\nSe garantizará la aplicación de programas de vivienda para las y los trabajadores de la Ciudad de México, derechohabientes de los organismos nacionales de vivienda con los mismos objetivos señalados en el párrafo anterior.\nTÍTULO V\nDE LA VIVIENDA EN ARRENDAMIENTO, DE LA VIVIENDA USADA Y DEL\nMEJORAMIENTO DE LA VIVIENDA\nCAPÍTULO I\nVIVIENDA EN ARRENDAMIENTO\n\nArtículo 59. El Gobierno de la Ciudad de México, a través de la Secretaría y/o el Instituto, en el ámbito de sus atribuciones, deberá fomentar la vivienda en arrendamiento, mediante esquemas y programas dirigidos a los grupos de atención prioritaria, que contengan como mínimo:\nI. Ámbito de Aplicación;\nII. Lineamientos de Diseño;\nIII. Estímulos e Incentivos;\nIV. Procedimientos de seguimiento, control y evaluación; y\nV. Esquemas que garanticen la certeza jurídica de la ocupación del inmueble por parte de las y los beneficiarios.\nArtículo 60. El Gobierno de la Ciudad de México a través del Instituto, podrá promover la vivienda en arrendamiento, además de proponer a la Secretaría de Finanzas facilidades administrativas y/o fiscales para apoyar la construcción de este tipo de vivienda conforme al Programa Institucional.\nArtículo 61. La Secretaría, de acuerdo a sus atribuciones, deberá fomentar, implementar y celebrar los convenios, acuerdos e instrumentos necesarios para la formulación y ejecución de programas de arrendamiento y de arrendamiento con opción a compra.\nArtículo 62. La vivienda en arrendamiento no deberá presentar ninguna de las características del rezago habitacional siguientes:\nI. Que exista hacinamiento: que en una vivienda particular habitada residan dos o más hogares.\nII. Que las viviendas estén construidas con materiales deteriorados: material de desecho, lámina de cartón, carrizo, bambú, palma, embarro o bajareque. En techos: material de desecho, lámina de cartón, palma o paja;\nIII. Que las viviendas edificadas estén construidas con materiales irregulares, tales como lámina metálica o de asbesto, madera o adobe; o en techos lámina metálica o de asbesto, madera, tejamanil o teja\n\nArtículo 63. Las acciones en vivienda en arrendamiento, no tendrán vicios ocultos o defectos que impidan el uso de ellas. Su regulación, será conforme a los ordenamientos jurídicos aplicables en la materia.\nCAPÍTULO II\nDE LA VIVIENDA USADA\nArtículo 64. El Gobierno de la Ciudad de México, en coordinación, con la Secretaría y el Instituto, de acuerdo a sus atribuciones, deberán promover esquemas para fomentar la adquisición de vivienda usada para los distintos sectores de la población, las cuales deberán contar con las condiciones de habitabilidad que se establecen en los demás ordenamientos jurídicos aplicables en la materia.\nArtículo 65. El Instituto, a través de su Programa de Adquisición a Terceros, deberá diseñar esquemas de susidios para fomentar la adquisición de vivienda usada.\nCAPÍTULO III\nDEL MEJORAMIENTO DE LA VIVIENDA\nArtículo 66. El Gobierno de la Ciudad de México, a través de la Secretaría y el Instituto, de acuerdo a sus atribuciones, o, para efectos de esta Ley, deberá promover programas que incentiven:\nI. El mejoramiento de las viviendas; incluyendo aquellas registradas en régimen de propiedad en condominio de la Ciudad de México;\nII. La participación ciudadana en el mejoramiento de las viviendas;\nIII. Vivienda progresiva.\nArtículo 67. La Secretaría de Finanzas analizará un programa anual de estímulos para que los propietarios de las viviendas que se encuentren declarados afectos al Patrimonio Arquitectónico Urbanístico del Distrito\nFederal, y requieran de acciones de mejoramiento, puedan realizar mejoras en su vivienda previo dictamen de las autoridades facultadas.\nTÍTULO VI\nDE LA PRODUCCIÓN SOCIAL DE VIVIENDA\n\nCAPÍTULO ÚNICO\nArtículo 68. El Gobierno de la Ciudad de México, a través del Instituto establecerá y aplicará medidas concretas de apoyo y fomento a la producción social de vivienda y a los productores sociales de vivienda y del hábitat, entre ellas, las siguientes:\nI. Garantizar la certeza jurídica de la vivienda de los conjuntos o unidades habitacionales, mediante las facilidades administrativas y los apoyos fiscales, notariales y registrales necesarios;\nII. Gestionar ante la Secretaría facilidades administrativas para la obtención de alineamiento y número oficial, constancia de zonificación y uso de suelo, manifestaciones de obra y licencias de construcción, subdivisiones, fusiones, factibilidad ambiental, exención total o parcial de cajones de estacionamiento, reducciones fiscales y avalúos entre otras de naturaleza semejante;\nIII. Gestionar ante la Secretaría de Finanzas apoyos en el pago de impuestos y derechos previstos en los ordenamientos jurídicos aplicables en la materia, relacionados con la transferencia de propiedad que los proyectos autorizados requieran y con otros de carácter similar;\nIV. Brindar asesoría y capacitación técnica integral durante la autoconstrucción, autoproducción y autoadministración de la vivienda;\nV. Diseñar estímulos, apoyos, créditos, ayudas de beneficio social y susidios para fomentar la producción social del hábitat y la vivienda; y\nVI. En la edificación y construcción de la vivienda, se incorporaran los espacios comunitarios destinados a desarrollar actividades culturales y productivas, con el fin de fortalecer la cohesión social.\nArtículo 69. El Gobierno de la Ciudad de México en coordinación con la Secretaría y el Instituto, de acuerdo con sus atribuciones, deberá promover la asistencia técnica integral calificada a favor de todos los actores involucrados en la producción social de vivienda, mediante programas de capacitación, difusión e intercambio de experiencias entre los equipos técnicos de organizaciones sociales y civiles, institutos, centros o profesionales independientes que brinden asistencia técnica, instituciones académicas, científicas y tecnológicas; colegios, asociaciones o gremios profesionales; cámaras empresariales; las dependencias y organismos del sector público, las empresas prestadoras de servicios y proyectistas.\n\nArtículo 70. Las acciones que se implementen para apoyar la producción social de vivienda, deberán respetar y contemplar capacidades, saberes, cultura y valores de los beneficiarios.\nArtículo 71. El Gobierno de la Ciudad fomentará el reconocimiento de sociedades cooperativas de vivienda para la producción social del hábitat y la vivienda.\nI. Se reconocerá su propiedad colectiva;\nII. Se reconocerá y apoyará con recursos la educación cooperativa; y\nIII. Se impulsaran los principios y valores cooperativistas.\nTÍTULO VII\nDEL FINANCIAMIENTO\nCAPÍTULO ÚNICO\nArtículo 72. El Gobierno de la Ciudad de México deberá adoptar las acciones necesarias para garantizar el derecho a la vivienda; para lograr este propósito podrá valerse del financiamiento público, la aplicación de medidas de carácter fiscal, la promoción en la aplicación de recursos de los Organismos Nacionales de\nVivienda, de los Órganos Políticos Administrativos y del Gobierno Federal, así como de la participación de empresas y entidades financieras del sector privado.\nArtículo 73. Las medidas que adopte y promueva el Gobierno de la Ciudad de México deberán orientarse a la ejecución de los Programas contemplados en esta Ley y tendrán como principio generar una redistribución del ingreso para garantizar prioritariamente la realización de este derecho de los sectores de más bajos ingresos y de los grupos de atención prioritaria.\nArtículo 74. La Secretaría y el Instituto, de conformidad con sus atribuciones, promoverán mecanismos de cofinanciamiento entre instituciones públicas y del sector social.\nAsimismo promoverán esquemas que incorporen el ahorro previo de los beneficiarios para ampliar las posibilidades económicas de la población en la realización de las acciones de vivienda.\nArtículo 75. El presupuesto de la Ciudad de México destinado al gasto para vivienda, deberá actualizarse conforme a la inflación y tener un carácter progresivo.\n\nArtículo 76. Los recursos públicos no podrán destinarse al financiamiento o al otorgamiento de subsidios para la producción de vivienda por el sector privado. Los recursos públicos estarán destinados a los programas que lleve a cabo el Instituto y a las acciones de las dependencias y entidades del Gobierno de la Ciudad de México que estén consideradas en el Programa Institucional de Vivienda.\nArtículo 77. El concepto de pago del crédito de vivienda otorgado por el Instituto no debe superar el veinte por ciento de los ingresos nominales mensuales de la persona o familia beneficiaria.\nArtículo 78. Los beneficiarios de créditos otorgados por el Instituto deben cumplir los siguientes requisitos:\na) Ser habitante del Distrito Federal;\nb) No ser propietario de otra vivienda;\nc) Los propietarios de vivienda sólo podrán solicitar crédito para las acciones destinadas a la rehabilitación, la ampliación y/o mejoramiento;\nd) Presentar declaración bajo protesta, en la que manifieste que habitará la vivienda, sujetándose a las sanciones correspondientes que en caso de incumplimiento determine el\nInstituto;\ne) Contar con el nivel de ingresos que señale las Reglas de Operación y Políticas de\nAdministración crediticia del Instituto;\nf) En la determinación de sus ingresos, corresponde al beneficiario entregar la documentación que respalde su dicho, quien además está obligado a permitir por parte de las autoridades del\nInstituto, la verificación de la información que proporcione;\ng) En el caso de la población informal la determinación de sus ingresos se ajustará a lo que establezcan las reglas de operación del Instituto; y h) Las demás que estén contenidas en las Reglas de Operación y Políticas de Administración crediticia del Instituto.\n\nArtículo 79. El Instituto deberá proporcionar la información de los beneficiarios de sus programas a la\nSecretaría de Desarrollo Social para su integración en el padrón único de beneficiarios, conforme a los ordenamientos jurídicos aplicables en la materia.\nArtículo 80. Asimismo, las demás dependencias u otras entidades del Gobierno de la Ciudad de México, deberán proporcionar a la Secretaría de Desarrollo Social la información de los beneficiarios de acciones de carácter social orientadas a la realización de los programas de vivienda. Cuando se trate de beneficios, estímulos y facilidades administrativas, las entidades y dependencias que las otorguen deberán proporcionar la información de los beneficiarios a la Secretaría para su publicación y para integrarla al\nSistema de Información de Vivienda.\nArtículo 81. Los programas de construcción de vivienda para la venta promovidos por el sector privado, podrán gozar de las facilidades administrativas que emita la o el Titular de la Jefatura de Gobierno, siempre y cuando se incluyan en el contexto de los Programas de Vivienda, cumplan con los requisitos que establezca la Secretaria, la cual vigilará el cumplimiento estricto de los mismos.\nArtículo 82. Cuando se trate de construcción o mejoramiento de vivienda, la reducción en los costos de dichas acciones que se origine por las facilidades administrativas otorgadas, deberán reflejarse de manera directa y clara en un menor precio o en mejores condiciones habitacionales de las mismas.\nArtículo 83. En ningún caso, las facilidades administrativas que se establezcan podrán implicar la exención de las autorizaciones o permisos en materia de impacto urbano, ambiental, riesgo, derribo de árboles o de cualquier otra acción que pueda implicar afectaciones al medio ambiente, al ordenamiento del territorio o al patrimonio histórico, cultural, artístico y urbano de la Ciudad de México.\nTÍTULO VIII\nDE LOS ESTÍMULOS Y DEL SUELO PARA LA VIVIENDA\nCAPÍTULO I\nDE LOS ESTÍMULOS PARA LA VIVIENDA\nArtículo 84. El Gobierno de la Ciudad de México concederá, a través de sus dependencias y organismos, los beneficios, estímulos y facilidades administrativas que se consignan en esta Ley, en el Código Financiero, así como las contenidas en otras disposiciones legales y administrativas vigentes.\n\nLa o el Titular de la Jefatura de Gobierno, de conformidad con sus atribuciones, podrá emitir los acuerdos administrativos y/o fiscales que considere pertinentes para la promoción de la vivienda.\nArtículo 85. La o el Titular de la Jefatura de Gobierno, de conformidad con sus atribuciones, expedirá los acuerdos correspondientes para instrumentar dichos estímulos para los Programas de Vivienda, conforme a los ordenamientos jurídicos aplicables en la materia; así como en las recomendaciones que dicte el\nConsejo de Vivienda de la Ciudad de México.\nArtículo 86. Cuando se trate de medidas que involucren pagos de contribuciones o derechos, éstas deberán ser presentadas por la Secretaría de Finanzas en las iniciativas relativas a los presupuestos de ingresos y egresos que se envían anualmente al Órgano Legislativo para su aprobación.\nArtículo 87. El Gobierno de la Ciudad de México establecerá y aplicará medidas concretas de apoyo y fomento a la producción social de vivienda, entre ellas, las siguientes:\nI. Promover la regularización de la tenencia de la tierra, de la vivienda y de los conjuntos o unidades habitacionales mediante las facilidades administrativas y los apoyos fiscales, notariales y registrales necesarios;\nII. Otorgar facilidades para la obtención de alineamiento y número oficial, constancia de zonificación y uso de suelo, licencias de construcción y otras de naturaleza semejante; y\nIII. Conceder facilidades y apoyos en el pago de impuestos y derechos relacionados con los conceptos establecidos en la fracción anterior, igualmente los relacionados con la transferencia de propiedad que los proyectos autorizados requieran y con otros de carácter similar.\nArtículo 88. Para la autorización definitiva de las escrituras, contratos y documentos, en los que se hagan constar las adquisiciones de inmuebles a que se refiere esta Ley, o a la constitución del régimen de propiedad en condominio, cuando los bienes inmuebles provengan del régimen privado del Gobierno de la Ciudad de México o del Instituto, no será necesaria la expedición del certificado de libertad de gravámenes, ni la obtención de constancia de no adeudos de la Tesorería de la Ciudad de México a que se refiere la legislación de la materia, asimismo se tendrá como avalúo el mismo precio de venta.\nArtículo 89. Los contratos, las operaciones y actos relacionados con los inmuebles a que se refiere la presente Ley, quedan sujetos a los subsidios y reducciones del pago de impuestos, derechos o contribuciones de conformidad con las normas que al efecto expida la o el Titular de la Jefatura de\nGobierno.\n\nArtículo 90. Para efectos de titulación, registrales o catastrales, los datos del inmueble relativos a ubicación, superficie, medidas y linderos serán los que aparezcan en el Registro Público de la Propiedad.\nCAPÍTULO II\nDEL SUELO PARA VIVIENDA\nArtículo 91. El Gobierno de la Ciudad y el Órgano Legislativo, en el ámbito de sus atribuciones, impulsarán medidas de orden administrativo y/o de carácter legal que propicien o induzcan el aprovechamiento o un mejor aprovechamiento del suelo.\nEstas medidas se llevarán a cabo en las zonas y predios, en las que los programas de desarrollo urbano, aprobados por el Órgano Legislativo, permitan la edificación de vivienda, así como las condiciones de uso y aprovechamiento del suelo.\nArtículo 92. El Gobierno de la Ciudad de México, en conjunto con la Secretaría impulsará una política de suelo y reservas territoriales para el desarrollo urbano y la vivienda, que asegure la función social de la propiedad y de la ciudad, bajo los siguientes principios:\nI. Prevalencia del interés público frente al interés privado;\nII. Distribución equitativa de las cargas y beneficios que genera el desarrollo urbano;\nIII. Acceso sustentable de los recursos naturales, priorizando el interés social, cultural y ambiental de la propiedad;\nIV. Acceso igualitario a toda la población a los servicios, equipamientos, espacios públicos y, en general, a los diversos satisfactores que deben ofrecer la ciudad;\nV. Pleno aprovechamiento del suelo urbano y de los inmuebles públicos y privados no edificados, no utilizados, subutilizados o no ocupados, así como su reciclamiento, para el cumplimiento de la función social de la propiedad; y\nVI. Rescate y revaloración del espacio público.\n\nArtículo 93. El Instituto destinará recursos y desarrollará acciones, por vías de derecho público o privado, tendientes a:\nI. La ejecución de acciones estratégicas para la generación de una oferta oportuna de suelo para la producción de vivienda de interés social y popular, mediante la adquisición de suelo y reservas territoriales;\nII. Fomentar esquemas y programas que contemplen recursos provenientes de crédito, ahorro y subsidio, para la adquisición de suelo; y\nIII. Reducir y abatir los procesos de ocupación irregular de áreas y predios, en especial en suelo de conservación, áreas naturales protegidas o con valor ambiental o que propicien situaciones de riesgo a la población, mediante la oferta de la tierra que atienda preferentemente, las necesidades de la población indígena, en situación de pobreza, vulnerabilidad, formen parte de los grupos de atención prioritaria o que habiten en situación de riesgo.\nArtículo 94. El Gobierno de la Ciudad de México, destinará los recursos recabados por concepto de mejoras, medidas de mitigación y/o incrementos a la densidad, por parte de empresas desarrolladoras, al mejoramiento del espacio público, infraestructura urbana y, en general, del entorno de la zona donde se llevó a cabo el desarrollo.\nAsimismo, podrá proponer modificaciones al Órgano Legislativo en materia de Desarrollo Urbano, a fin de contribuir al financiamiento e instrumentación del ordenamiento territorial, el Desarrollo Urbano\nSustentable y el Desarrollo Metropolitano en condiciones de equidad, conforme a lo establecido en la Ley\nGeneral de Asentamientos Humanos, Ordenamiento Territorial y Desarrollo Urbano.\nLa Secretaría de Finanzas propondrá, conforme a sus atribuciones, asignar al Instituto un porcentaje de estos recursos para la adquisición de reservas territoriales para la construcción de vivienda de interés social y popular, así como para la producción social del hábitat y de vivienda.\nArtículo 95. Las organizaciones sociales de vivienda, podrán aportar los terrenos de su propiedad para la construcción de vivienda de interés social y popular, siempre y cuando sus integrantes cumplan con los criterios de priorización y focalización que determine el Instituto. Asimismo, las personas que no pertenecen a una organización social de vivienda, podrán aportar los terrenos o predios.\n\nArtículo 96. Los Órganos Políticos Administrativos deberán coordinarse, en la política de vivienda, con los municipios que forman parte de la Zona Metropolitana del Valle de México, con la finalidad de promover políticas que incidan en el precio del suelo y evitar que siga creciendo la expansión de la Ciudad.\nArtículo 97. Para el desarrollo de su programa, el Instituto en coordinación con otras entidades del\nGobierno de la Ciudad de México, y de acuerdo con sus atribuciones, deberá realizar acciones orientadas a la adquisición de reservas territoriales para la conformación de una bolsa de suelo.\nConforme a los ordenamientos aplicables en la materia, a la bolsa de suelo podrán incorporarse predios baldíos, construcciones abandonadas, inmuebles con uso distinto al de vivienda, viviendas en condiciones de alto riesgo estructural en predios que puedan redensificarse. Para tal efecto, la Secretaria y el Instituto podrán proponer expropiación de áreas, predios y/o inmuebles por causa de utilidad pública para el\nPrograma Institucional de conformidad con los Programas de Desarrollo Urbano.\nArtículo 98. La bolsa de suelo deberá ser viable técnica y jurídicamente, que evite la especulación de suelo urbano y el crecimiento urbano en zona de reserva ecológica, en concordancia con los diferentes Programas contemplados en el artículo anterior.\nArtículo 99. Cuando la Secretaría o el Instituto tengan conocimiento de la existencia de bienes vacantes, por no tener dueño cierto y conocido, podrá informara la autoridad correspondiente para, en caso de ser procedente, se adjudiquen a la Hacienda Pública de la Ciudad de México, conforme a los ordenamientos jurídicos aplicables en la materia.\nArtículo 100. El Gobierno de la Ciudad de México, en coordinación, con la Secretaría y el Instituto, de acuerdo a sus atribuciones, buscaran que los bienes inmuebles adjudicados bajo el procedimiento de\nExtinción de Dominio, se destinen a la bolsa de suelo, conforme a los estipulados con la Ley de Extinción de Dominio para el Distrito Federal.\nTÍTULO IX\nSISTEMA DE INFORMACIÓN DE LA VIVIENDA\nCAPÍTULO ÚNICO\nArtículo 101. El Sistema de Información de la Vivienda tendrá por objeto integrar, generar y difundir la información que se requiera para la adecuada planeación, instrumentación, seguimiento y evaluación de la Política de Vivienda de la Ciudad de México, así como para el fortalecimiento de la oferta articulada de\n\nvivienda. Dicho sistema deberá formar parte del SIEDU, y ser publicado en el portal de la Secretaría, conforme a los ordenamientos jurídicos aplicables en la materia.\nArtículo 102. La Secretaría integrará y administrará el Sistema de Información de la Vivienda, el cual se sujetará, en lo conducente, a las disposiciones previstas en la Ley del Sistema Nacional de Información\nEstadística y Geográfica y se conformará con la información que proporcionen las dependencias y entidades de la Administración Pública de la Ciudad de México, en aspectos vinculados con la vivienda, así como la que permita identificar la evolución y crecimiento del mercado, con el objeto de contar con información suficiente para evaluar los efectos de la política habitacional.\nDe igual forma, deberá incorporar la información relacionada con la producción social de vivienda, los créditos y subsidios otorgados.\nArtículo 103. El Sistema de Información de la Vivienda deberá actualizarse anualmente.\nArtículo 104. El Sistema de Información de la Vivienda contendrá, tomando en cuenta los criterios del\nPrograma General de Derechos Humanos de la Ciudad de México, los elementos que permitan mantener actualizado el inventario habitacional, a través de determinar los cálculos sobre:\nI. Rezago;\nII. Arrendamiento;\nIII. Necesidades y características de la vivienda, su calidad y espacios;\nIV. Acceso a los servicios, espacios públicos y equipamientos;\nV. Oferta y demanda de Vivienda; y\nVI. Requerimientos de suelo adecuado para urbanizar.\nArtículo 105. El Sistema de Información, además de lo contemplado en el artículo anterior, deberá considerar lo siguiente:\nI. Objetivos, metas y alcances generales así como por cobertura territorial;\nII. Beneficiarios por grupo de ingreso en veces Unidad de Cuenta;\n\nIII. Avances y resultados de los Programas de Vivienda, así como de la estrategia para la implementación del Desarrollo Orientado al Transporte;\nIV. Evaluación de los productos habitacionales en términos de su ubicación, con respecto a las fuentes de empleo, habitabilidad de la vivienda y adaptabilidad a las condiciones culturales, sociales, ambientales; y\nV. Evaluación de los precios de suelo, medidas de control que se aplican para evitar su especulación y sus efectos en los programas habitacionales.\nArtículo 106. Para garantizar el derecho a la información sobre el ejercicio de los recursos públicos, las autoridades de vivienda o cualquier otra entidad, dependencia u organismo público, relacionados con la producción de vivienda, comunicarán y difundirán con claridad y oportunidad, sobre los programas y ejercicio de dichos recursos, conforme a los ordenamientos jurídicos aplicables en la materia.\nTÍTULO X\nDE LAS SANCIONES\nCAPÍTULO ÚNICO\nArtículo 107. La Secretaría y el Instituto, en el ámbito de sus competencias, realizará las denuncias correspondientes en caso de una conducta ilícita a las autoridades competentes, de profesionales inmobiliarios, directores responsables de obra, empresas desarrolladoras de vivienda, supervisores, organizaciones sociales de vivienda, encargados de cumplir con lo dispuesto en la presente Ley.\nArtículo 108. La denuncia deberá estar apoyada en pruebas documentales o elementos probatorios, suficientes para establecer la existencia de la comisión de una conducta que sea contraria a los objetivos y principios de la presente Ley, y estar en condiciones de presumir la responsabilidad del denunciado. Las denuncias anónimas no producirán ningún efecto.\nArtículo 109. El interesado afectado por los actos y resoluciones de la autoridad, podrá interponer recurso de inconformidad conforme a los ordenamientos jurídicos aplicables en la materia o promover juicio nulidad ante el Tribunal de lo Contencioso Administrativo local.\n\nArtículo 110. Se suspenderá la relación de gestión ante el Instituto, a la Organización Social de Vivienda que fomenten acciones contrarias a lo dispuesto por esta Ley, hasta que se resuelva la irregularidad.\nCuando algún miembro de la organización realice actos con evidentes fines de lucro, el asunto se considerará grave y se procederá a suspender indefinidamente.\nArtículo 111. La Secretaría y el Instituto incluirán en el Sistema de Información de la Vivienda, la información de los servidores públicos, profesionales inmobiliarios, directores responsables de obra, empresas desarrolladoras de vivienda, supervisores, organizaciones sociales de vivienda sancionadas\nIgualmente, remitirán dicha información a las Cámaras de Comercio, conforme a las leyes aplicables en la materia.\nArtículo 112. Constituyen sanciones para los directores responsables de obra, cuando contravengan con las disposiciones de esta Ley, y demás disposiciones legales aplicables en la materia.\nArtículo 113. En caso de que el Director Responsable de Obra, ejecute obras distintas a las autorizadas, estará obligado a demolerlas, previa resolución de la autoridad competente, sin perjuicio de las sanciones administrativas, civiles y penales a que haya lugar.\nArtículo 114. Las sanciones para las empresas desarrolladoras de vivienda y Directores Responsables de\nObra podrán ser:\nI. Suspensión temporal;\nII. Cancelación de la autorización;\nIII. Clausura temporal o definitiva;\nIV. Multa; y\nV. La cancelación de su registro ante la Secretaría hasta por seis años.\nArtículo 115. La Secretaría, deberá hacer del conocimiento público, la falta de autorización del desarrollo inmobiliario, en la Gaceta Oficial de la Ciudad de México y en algún diario de mayor circulación.\n\nArtículo 116. Las y los beneficiarios del esquema de vivienda en arrendamientos, serán sancionados cuando exista un incumplimiento que vulnere, lo establecido en los programas de vivienda respectivos.\nLas cuales podrán ser las siguientes:\nI. Recisión del contrato de vivienda en arrendamiento;\nII. El pago de daños y perjuicios, en caso de ocasionar alteraciones dolosas, que afecten la estructura de la vivienda en arrendamiento; y\nIII. Suspensión de los beneficios que haya recibido, derivados del programa en comento.\nArtículo 117. En caso de incumplimiento de esta Ley y lo establecido en los Programas de Vivienda; las sanciones para las empresas desarrolladoras de vivienda, podrán ser:\nI. Rescisión de los contratos celebrados;\nII. Cancelación de la autorización;\nIII. Aplicación de las penas convencionales;\nIV. Pago de daños y Perjuicios;\nV. La cancelación de su registro ante la Secretaría y el Instituto, hasta por seis años; y\nVI. Hacer efectiva la fianza de modo inmediato de los terceros afectados.\nArtículo 118. Para el debido cumplimiento de las obligaciones de las empresas desarrolladoras de vivienda, el Instituto y la Secretaría, podrán someter cualquier tipo de controversia, ante los Tribunales de la Ciudad de México.\nARTÍCULOS TRANSITORIOS\nARTÍCULO PRIMERO. - Remítase al Titular de la Jefatura de Gobierno de la Ciudad de México para su respectiva promulgación y publicación en la Gaceta Oficial de la Ciudad de México.\n\nARTÍCULO SEGUNDO. - El presente Decreto entrará en vigor al día siguiente de su publicación en la Gaceta\nOficial de la Ciudad de México.\nARTÍCULO TERCERO. - Publíquese el presente Decreto en la Gaceta Oficial de la Ciudad de México y en el\nDiario Oficial de la Federación para su mayor difusión.\nARTÍCULO CUARTO. - Se abroga la Ley de Vivienda del Distrito Federal, publicada en la Gaceta Oficial del\nDistrito Federal, el día 2 de marzo del 2000.\nARTÍCULO QUINTO. - Se derogan todas aquellas disposiciones administrativas que se opongan al presente ordenamiento.\nARTÍCULO SEXTO. - El Jefe de Gobierno de la Ciudad de México deberá emitir, en un plazo no mayor a 60 días naturales a partir de la entrada en vigor del presente Decreto, el Reglamento de la Ley que se crea, el cual deberá prever las condiciones de habitabilidad que aquí se encuentran, así como estar armonizado con el marco legal internacional en materia de derechos humanos, firmado y ratificado por México.\nARTÍCULO SÉPTIMO. -Con la finalidad de que la Secretaría y el Instituto puedan cumplir con lo que establece la presente Ley, deberá contar con el presupuesto adecuado y la estructura administrativa necesaria.\nARTÍCULO OCTAVO. -Una vez que se haya promulgado la Constitución de la Ciudad de México, el órgano legislativo, en un plazo de 180 días hábiles, se llevará a cabo la armonización de esta Ley con toda la legislación en la materia, y la correspondiente a los derechos estrechamente interrelacionados con el derecho a la vivienda, de acuerdo con los lineamientos del Programa de Derechos Humanos.\nRecinto de la Asamblea Legislativa del Distrito Federal, a los quince días del mes de diciembre del año dos mil dieciséis. -POR LA MESA DIRECTIVA. - DIP. ADRIÁN RUBALCAVA SUÁREZ, PRESIDENTE. - DIP. EVA ELOISA\nLESCAS HERNÁNDEZ, SECRETARIA. - DIP. NURY DELIA RUIZ OVANDO, SECRETARIA. - FIRMAS.\nCon fundamento en lo dispuesto por los artículos 122, Apartado A, Base III, de la Constitución Política de los Estados Unidos Mexicanos; Transitorios Primero y Segundo del Decreto por el que se declaran reformadas y derogadas diversas disposiciones de la Constitución Política de los Estados Unidos Mexicanos, en materia de la Reforma Política de la Ciudad de México; 48, 49 y 67, fracción II, del Estatuto de Gobierno del Distrito Federal, para su debida publicación y observancia, expido el presente Decreto Promulgatorio en la Residencia Oficial del Jefe de Gobierno de la Ciudad de México, a los veintiocho días del mes de febrero del año dos mil diecisiete.- EL JEFE DE GOBIERNO DE LA CIUDAD DE MÉXICO, MIGUEL ÁNGEL\nMANCERA ESPINOSA.- FIRMA.- LA SECRETARIA DE GOBIERNO, DORA PATRICIA MERCADO CASTRO.- FIRMA.-\n\nEL SECRETARIO DE DESARROLLO URBANO Y VIVIENDA, FELIPE DE JESÚS GUTIÉRREZ GUTIÉRREZ.- FIRMA.-\nEL SECRETARIO DE DESARROLLO ECONÓMICO, SALOMÓN CHERTORIVSKI WOLDENBERG.- FIRMA.- LA\nSECRETARIA DEL MEDIO AMBIENTE, TANYA MÜLLER GARCÍA.- FIRMA.- LA SECRETARIA DE DESARROLLO\nRURAL Y EQUIDAD PARA LAS COMUNIDADES, ROSA ÍCELA RODRÍGUEZ VELÁZQUEZ, FIRMA.- EL SECRETARIO\nDE MOVILIDAD, HÉCTOR SERRANO CORTES.- FIRMA.- EL SECRETARIO DE FINANZAS, EDGAR ABRAHAM\nAMADOR ZAMORA.- FIRMA.\nTRANSITORIOS DEL DECRETO POR EL QUE SE REFORMAN DIVERSAS DISPOSICIONES DE LA LEY DE VIVIENDA\nPARA LA CIUDAD DE MEXICO, PUBLICADO EN LA GACETA OFICIAL DE LA CIUDAD DE MÉXICO, EL 11 DE\nOCTUBRE DE 2019.\nPRIMERO. – Túrnese a la Jefa de Gobierno de la Ciudad de México, para los efectos de su publicación en la\nGaceta Oficial de la Ciudad de México.\nSEGUNDO.- El presente decreto entrará en vigor al día siguiente de su publicación en la Gaceta Oficial de la Ciudad de México.\nPalacio Legislativo del Congreso de la Ciudad de México, a los veintitrés días del mes de mayo del año dos mil diecinueve.- POR LA MESA DIRECTIVA.- DIPUTADO JOSÉ DE JESÚS MARTÍN DEL CAMPO CASTAÑEDA,\nPRESIDENTE.- DIPUTADA ISABELA ROSALES HERRERA, SECRETARIA.- DIPUTADA ANA PATRICIA BAEZ\nGUERRERO, SECRETARIA.- (Firmas)\nCon fundamento en lo dispuesto por los artículos 122, Apartado A, fracción III, de la Constitución Política de los Estados Unidos Mexicanos; 32 apartado C, numeral 1, inciso a) de la Constitución Política de la\nCiudad de México; 2, 3, fracciones XVII y XVIII, 7, 10 fracción II, 12 y 21 párrafo primero de la Ley Orgánica del Poder Ejecutivo y de la Administración Pública de la Ciudad de México; para su debida publicación y observancia, expido el presente Decreto Promulgatorio en la Residencia Oficial de la Jefatura de Gobierno de la Ciudad de México, a los veintiocho días del mes de junio del año dos mil diecinueve.- LA JEFA DE\nGOBIERNO DE LA CIUDAD DE MÉXICO, DRA. CLAUDIA SHEINBAUM PARDO.- FIRMA.- LA SECRETARIA DE\nDESARROLLO URBANO Y VIVIENDA, ILEANA AUGUSTA VILLALOBOS ESTRADA.\nTRANSITORIOS DELDECRETO POR EL QUE SE REFORMAN LA LEY DE VIVIENDA PARA LA CIUDAD MÉXICO, LA\nLEY DE DESARROLLO URBANO DEL DISTRITO FEDERAL, EL CÓDIGO FISCAL DE LA CIUDAD DE MÉXICO Y LA\nNORMA DE ORDENACIÓN NÚMERO 26 QUE FORMA PARTE DE LA LEY DE DESARROLLO URBANO DEL\n\nDISTRITO FEDERAL Y DEL PROGRAMA GENERAL DE DESARROLLO URBANO DE LA CIUDAD DE MÉXICO,\nPUBLICADO EN LA GACETA OFICIAL DE LA CIUDAD DE MÉXICO EL DÍA 02 DE SEPTIEMBRE DE 2021.\nPRIMERO.- Remítase a la persona titular de la Jefatura de Gobierno de la Ciudad de México para su promulgación y publicación en la Gaceta Oficial de la Ciudad de México.\nSEGUNDO.– Por lo que se refiere a la Reforma a la Norma de Ordenación Número 26, inscríbase lo establecido en el presente Decreto tanto en el Registro de los Planes y Programas de Desarrollo Urbano como en el Registro Público de la Propiedad y Comercio de la Ciudad de México.\nTERCERO.– El presente Decreto entrará en vigor el día siguiente al de su publicación.\nCUARTO.- Los Acuerdos emitidos por la Secretaría de Desarrollo Urbano y Vivienda de la Ciudad de México para la aplicación de la Norma de Ordenación Número 26, continuarán vigentes en lo que no contravengan al presente Decreto.\nPalacio Legislativo del Congreso de la Ciudad de México, a los treinta días del mes de agosto del año dos mil veintiuno.- POR LA MESA DIRECTIVA, DIPUTADA ANA PATRICIA BAEZ GUERRERO, PRESIDENTA, DIPUTADA\nDONAJI OFELIA OLIVERA REYES, SECRETARIA, DIPUTADO PABLO MONTES DE OCA DEL OLMO (Firmas)\nCon fundamento en lo dispuesto por los artículos 122, apartado A, fracción III de la Constitución Política de los Estados Unidos Mexicanos; 32, apartado C, numeral 1, inciso a) de la Constitución Política de la Ciudad de México; 2 párrafo segundo, 3 fracciones XVII y XVIII, 7 párrafo primero, 10 fracción II, 12 y 21 párrafo primero de la Ley Orgánica del Poder Ejecutivo y de la Administración Pública de la Ciudad de México; para su debida publicación y observancia, expido el presente Decreto Promulgatorio en la Residencia Oficial de la Jefatura de Gobierno de la Ciudad de México, a los treinta y un días del mes de agosto del año dos mil veintiuno.-LA JEFA DE GOBIERNO DE LA CIUDAD DE MÉXICO, DRA. CLAUDIA SHEINBAUM PARDO.- FIRMA.-\nEL SECRETARIO DE DESARROLLO URBANO Y VIVIENDA, CARLOS ALBERTO ULLOA PÉREZ.- FIRMA.- EL\nCONSEJERO JURÍDICO Y DE SERVICIOS LEGALES, NÉSTOR VARGAS SOLANO.- FIRMA.",
  "ordenamiento": "Marco Jurídico",
  "jurisdiccion": "CIUDAD DE MEXICO",
  "fuente_oficial": "Congreso de la Ciudad de México",
  "status": "Vigente",
  "Fecha de Publicación": "17-10-2023",
  "Fecha de Última Reforma": "02 de septiembre de 2021",
  "numero_paginas": 50,
  "es_escaneado": false,
  "tiene_tablas": false,
  "url": "https://www.congresocdmx.gob.mx/archivo-6f72067c0037acb3c27f1dc68b5fd3bd06f5f602.pdf"
}