{
  "titulo": "Acuerdo del Consejo General del Instituto Nacional Electoral por el Que Se Aprueban los Lineamientos",
  "Contenido": "CONSEJEROS PRESIDENTES Y CONSEJEROS\nELECTORALES DE LOS ORGANISMOS PÚBLICOS\nLOCALES\nTEXTO ORIGINAL. de 2014.\nINSTITUTO NACIONAL ELECTORAL\nINE/CG44/2014\nACUERDO DEL CONSEJO GENERAL DEL INSTITUTO NACIONAL ELECTORAL POR EL QUE SE\nAPRUEBAN LOS LINEAMIENTOS PARA LA DESIGNACIÓN DE CONSEJEROS PRESIDENTES Y\nCONSEJEROS ELECTORALES DE LOS ORGANISMOS PÚBLICOS LOCALES.\nI. El 31 de enero de 2014, el Presidente de la República promulgó la Reforma Constitucional en\nMateria Político-Electoral, aprobada por el Congreso de la Unión y la mayoría de las legislaturas estatales.\nII. El 10 de febrero de 2014, se publicó en el Diario Oficial de la Federación el \"Decreto por el que se reforman, adicionan y derogan diversas disposiciones de la Constitución Política de los Estados\nUnidos Mexicanos, en materia política-electoral\".\nIII. El Decreto de reforma contiene diversas disposiciones que modifican la denominación, estructura, funciones y objetivos del Instituto Federal Electoral para transformarse en Instituto Nacional\nElectoral, entre las que destacan la modificación de la integración de su Consejo General y la inclusión de nuevas atribuciones.\nIV. El Transitorio Segundo del Decreto de la mencionada reforma, establece que el Congreso de la Unión debe expedir las leyes generales en materia de delitos electorales, así como las que distribuyan competencias entre la Federación y las entidades federativas en materias de partidos políticos; organismos electorales y procesos electorales, de conformidad con lo previsto en el inciso a) de la fracción XXI, y en la fracción XXIX-U del artículo 73 de la Constitución, a más tardar el 30 de abril de\n2014.\nV. Por otro lado, el primer párrafo del Transitorio Cuarto, refiere que las adiciones, reformas y derogaciones que se hacen, entre otros, al artículo 116, fracción IV, de la Constitución, entrarán en vigor en la misma fecha en que lo hagan las normas a que se refiere el Transitorio Segundo, sin perjuicio de lo previsto en el Transitorio Quinto.\nVI. El transitorio Quinto, dispone que el Instituto Nacional Electoral deberá integrarse dentro de atribuciones a partir de que entren en vigor las normas previstas en el Transitorio Segundo antes referido.\nCONSEJEROS PRESIDENTES Y CONSEJEROS\nELECTORALES DE LOS ORGANISMOS PÚBLICOS\nLOCALES previstas en el transitorio Segundo, ejercerá las atribuciones que las leyes vigentes otorgan al Instituto\nFederal Electoral.\nVII. El 03 de abril de 2014, el pleno de la H. Cámara de Diputados, designó al Consejero\nPresidente y a los diez Consejeros Electorales del Consejo General del Instituto Nacional Electoral. El\nDecreto relativo se publicó en el Diario Oficial de la Federación el día siguiente.\nVIII. El 04 de abril de 2014, los Consejeros electos rindieron protesta en sesión convocada para tal efecto conforme a lo dispuesto por el artículo 110 numeral 7 del Código Federal de Instituciones y\nProcedimientos Electorales. Acto con el cual quedó integrado el Consejo General del Instituto Nacional\nElectoral, en términos de lo establecido en el artículo 41, Base V, apartado A, párrafo segundo de la\nIX. El 23 de mayo de 2014 se publicó la Ley General de Instituciones y Procedimientos\nElectorales en el Diario Oficial de la Federación, iniciando vigencia el día 24 de mayo de 2014.\n1. Que de conformidad con lo dispuesto en el artículo 41, Párrafo Segundo, Base V, Apartado A, párrafo primero y segundo de la Constitución Política de los Estados Unidos Mexicanos, el Instituto\nNacional Electoral es un organismo público autónomo dotado de personalidad jurídica y patrimonio propios, en cuya integración participan el Poder Legislativo de la Unión, los partidos políticos nacionales y los ciudadanos, en los términos que ordene la ley. En el ejercicio de esta función estatal, la certeza, legalidad, independencia, imparcialidad, máxima publicidad y objetividad serán principios rectores.\n2. Que el Artículo Transitorio Noveno del Decreto por el que se reforman, adicionan y derogan diversas disposiciones de la Constitución Política de los Estados Unidos Mexicanos, en materia políticaelectoral, señala que el Consejo General del Instituto Nacional Electoral designará a los nuevos consejeros de los organismos locales, en términos de lo dispuesto por el inciso c) de la fracción IV del artículo 116 de esta Constitución; que los actuales consejeros continuarán en su encargo hasta en tanto electoral posterior a la entrada en vigor del mencionado Decreto.\n3. El artículo 2, párrafo 1, inciso d) de la Ley General de Instituciones y Procedimientos\nElectorales, en lo sucesivo la Ley General, establece que reglamenta, entre otras, las normas constitucionales relativas a la integración de los organismos electorales.\n4. El artículo 6, párrafo 2 de la Ley General, establece que el Instituto dispondrá lo necesario para asegurar el cumplimiento de las normas antes establecidas y de las demás dispuestas en esta ley.\nCONSEJEROS PRESIDENTES Y CONSEJEROS\nELECTORALES DE LOS ORGANISMOS PÚBLICOS\nLOCALES\n5. El artículo 31, párrafo 1, de la Ley General, establece que el Instituto es autoridad en materia electoral, independiente en sus decisiones y funcionamiento y profesional en su desempeño.\n6. El artículo 42, párrafo 5, de la Ley General, dispone que el Consejo General integrará la\nComisión de Vinculación con los Organismos Públicos Locales, que funcionará permanentemente y se conforma por cuatro Consejeros.\n7. El artículo 44, párrafo 1, incisos g) y jj), de la Ley General, señalan como atribución del\nConsejo General designar y remover, en su caso, a los Presidentes y Consejeros Electorales de los\nOrganismos Públicos Locales, conforme a los procedimientos establecidos en la propia Ley, así como dictar los Acuerdos necesarios para hacer efectivas sus atribuciones.\n8. El artículo 60, párrafo 1, inciso e), de la Ley General, establece que a la Unidad Técnica de\nVinculación con los Organismo Públicos Locales, entre otras, corresponde coadyuvar con la Comisión de\nVinculación con los Organismos Públicos Locales en la integración de la propuesta para conformar los órganos superiores de dirección de los Organismos Públicos Locales.\n9. El Artículo 100 de la Ley General indica los requisitos para ser consejero electoral local.\n10. El Artículo 101 de la Ley General establece el proceso de elección de los Consejeros\nElectorales locales.\n11. El artículo transitorio sexto del Decreto que expide la Ley General establece que el Consejo\nGeneral del Instituto Nacional Electoral dictará los Acuerdos necesarios para hacer efectivas las disposiciones de esta Ley y deberá expedir los Reglamentos que se deriven del mismo a más tardar en\n180 días a partir de su entrada en vigor.\n12. El artículo transitorio décimo del Decreto que expide la Ley General dispone que para los procesos electorales locales cuya jornada electoral se celebre en 2015, el Consejo General del Instituto deberá realizar los nombramientos de los Consejeros Electorales locales a más tardar el 30 de siguientes términos:\na) Tres consejeros que durarán en su encargo tres años;\nb) Tres consejeros que durarán en su encargo seis años, y\nc) Un consejero que durará en su encargo siete años.\n13. En la valoración y selección de las y los aspirantes se considerarán, entre otros aspectos, el apego a los principios de certeza, legalidad, independencia, imparcialidad, máxima publicidad y\nCONSEJEROS PRESIDENTES Y CONSEJEROS\nELECTORALES DE LOS ORGANISMOS PÚBLICOS\nLOCALES objetividad, establecidos en el apartado A, Base V, del artículo 41 constitucional y en el párrafo 2 del artículo 30 de la Ley General.\n14. Que dado que corresponde al Instituto Nacional Electoral designar y remover a los integrantes del órgano superior de dirección de los Organismos Públicos Locales, en los términos de la\nProcedimientos Electorales, es necesario expedir el presente Acuerdo para aprobar los Lineamientos que contenga el procedimiento para la designación de los integrantes de los órganos superiores de dirección de los Organismos Públicos Locales.\nEn virtud de lo señalado y con fundamento en lo previsto en los artículos 41, Base V y 116, Base\nIV, inciso c) de la Constitución Política de los Estados Unidos Mexicanos; así como el Artículo Noveno\nTransitorio del Decreto por el que se reforman, adicionan y derogan diversas disposiciones de la\nd); 4, párrafo 2; 6, párrafo 2; 29, párrafo 1; 30, párrafo 2; 31, párrafos 1 y 4; 32, párrafo 2, inciso b); 39, párrafo 2; 42, párrafos 5, 6, 8 y 10; 43; 44, párrafo 1, incisos a), g), jj); 45, párrafo 1, inciso a); 46, párrafo\n1, inciso k); 60; 99, párrafo 1; 100; y 101, de la Ley General de Instituciones y Procedimientos Electorales, así como sexto y décimo transitorios del decreto que expide la Ley General de Instituciones y\nProcedimientos Electorales, el Consejo General ha determinado emitir el siguiente:\nPRIMERO. Se aprueban los Lineamientos del Instituto Nacional Electoral para la designación de\nConsejeros Presidentes y Consejeros Electorales de los Organismos Públicos Locales, en los términos del Anexo que forma parte integrante del presente Acuerdo.\nSEGUNDO. Los presentes Lineamientos entrarán en vigor a partir de su publicación en el Diario\nOficial de la Federación.\nTERCERO. Difúndase en el portal del Instituto Nacional Electoral.\nCUARTO. Se instruye a los Vocales Ejecutivos Locales para que por su conducto se realicen las de comunicación oficial de su entidad federativa.\nEl presente Acuerdo fue aprobado en sesión extraordinaria del Consejo General celebrada el 6 de junio de dos mil catorce, por votación unánime de los Consejeros Electorales, Licenciado Enrique\nAndrade González, Maestro Marco Antonio Baños Martínez, Maestra Adriana Margarita Favela Herrera, Maestra Beatriz Eugenia Galindo Centeno, Doctor Ciro Murayama Rendón, Doctor Benito Nacif\nHernández, Doctor José Roberto Ruiz Saldaña, Licenciada Alejandra Pamela San Martín Ríos y Valles,\nCONSEJEROS PRESIDENTES Y CONSEJEROS\nELECTORALES DE LOS ORGANISMOS PÚBLICOS\nLOCALES\nMaestro Arturo Sánchez Gutiérrez, Licenciado Javier Santiago Castillo y del Consejero Presidente, Doctor\nLorenzo Córdova Vianello.\nEL CONSEJERO PRESIDENTE DEL CONSEJO GENERAL.\nDR.LORENZO CÓRDOVA VIANELLO.\nRúbrica.\nEL SECRETARIO DEL CONSEJO GENERAL.\nLIC. EDMUNDO JACOBO MOLINA.\nRúbrica.\nLINEAMIENTOS DEL INSTITUTO NACIONAL ELECTORAL PARA LA DESIGNACIÓN DE\nCONSEJEROS PRESIDENTES Y CONSEJEROS ELECTORALES DE LOS ORGANISMOS PÚBLICOS\nLOCALES.\nCapítulo I\nDisposiciones Generales.\nPrimero\nObjeto de regulación.\n1. Los presentes Lineamientos tienen por objeto establecer las disposiciones conforme a las cuales se instrumentará el procedimiento para la selección y designación de los Presidentes y Consejeros\nElectorales integrantes de cada órgano superior de dirección de los Organismos Públicos Locales.\nSegundo\nÁmbito de aplicación.\n1. Las disposiciones de este ordenamiento son de observancia general y obligatoria para el\nInstituto Nacional Electoral, los Organismos Públicos Locales, así como para los partidos políticos y todas las personas que participen en el procedimiento objeto de estos Lineamientos.\n2. Su aplicación corresponde a los órganos establecidos en el numeral 7 de los presentes\nLineamientos.\nTercero\nDel glosario.\n1. Para los efectos de estos Lineamientos, se entenderá:\na) Por lo que se refiere a los ordenamientos jurídicos:\nCONSEJEROS PRESIDENTES Y CONSEJEROS\nELECTORALES DE LOS ORGANISMOS PÚBLICOS\nLOCALES\nConstitución: Constitución Política de los Estados Unidos Mexicanos;\nLey General: Ley General de Instituciones y Procedimientos Electorales;\nLey de Medios: Ley General del Sistema de Medios de Impugnación en Materia Electoral;\nLineamientos: Lineamientos del Instituto Nacional Electoral para la designación de Consejeros\nPresidentes y Consejeros Electorales de los Organismos Públicos Locales;\nb) Por lo que hace a las autoridades, organismos, órganos y dependencias:\nComisión: Comisión de Vinculación con los Organismos Públicos Locales;\nConsejo General: Consejo General del Instituto Nacional Electoral;\nGrupos de Trabajo: Los integrados por los Consejeros Electorales para auxiliar los trabajos de la Comisión.\nInstituto: Instituto Nacional Electoral;\nJunta Local: Las Juntas Locales Ejecutivas del Instituto;\nJunta Distrital: Las Juntas Distritales Ejecutivas del Instituto;\nOrganismos Públicos Locales: Los organismos públicos, autónomos en su funcionamiento e independientes en sus decisiones en la materia;\nSecretaría: La Secretaría Ejecutiva y del Consejo General del Instituto Nacional Electoral;\nSecretario Técnico: El Secretario Técnico de la Comisión, el cual recaerá en la o el titular de la\nUnidad Técnica de Vinculación con los Organismos Públicos Locales;\nUnidad Técnica: La Unidad Técnica de Vinculación con los Organismos Públicos Locales;\nc) Por lo que hace a la terminología:\nAspirante: Las y los ciudadanos mexicanos que una vez abierto el proceso de selección y designación para la integración de los órganos superiores de dirección de los Organismos Públicos\nLocales, presenten el formato de solicitud de registro para tal fin y entreguen al Instituto toda la documentación que se precise en la Convocatoria;\nDías: Los hábiles, salvo que, por disposición expresa, se prevea que los mismos sean naturales;\nEntrevista virtual: Forma de concurrir a distancia y no de manera presencial a la entrevista con el Consejero Presidente y los Consejeros Electorales a través de una transmisión y recepción simultánea de audio y video mediante el uso de tecnologías de la información;\nPortal: La página de Internet del Instituto; y\nRequisitos: Los establecidos en la Constitución, en la Ley General, los presentes Lineamientos de dirección de los Organismos Públicos Locales.\nCuarto\nDe los criterios de interpretación.\n1. La interpretación de las disposiciones de este ordenamiento se realizará conforme a los criterios gramatical, sistemático y funcional, atendiendo a lo dispuesto en los artículos 1° y 14, último párrafo, de la Constitución y el artículo 5, párrafo 2 de la Ley General.\nCONSEJEROS PRESIDENTES Y CONSEJEROS\nELECTORALES DE LOS ORGANISMOS PÚBLICOS\nLOCALES\n2. Lo no previsto será resuelto por la Comisión o bien por el Consejo General, conforme a sus atribuciones respectivas, de conformidad con los principios generales del derecho en materia electoral o la jurisprudencia aplicable.\nQuinto\nDe la supletoriedad.\n1. A falta de disposición expresa en los presentes Lineamientos, se aplicarán, en lo que no se opongan a su naturaleza y fines, los demás ordenamientos del Instituto Nacional Electoral.\nSexto\nTransparencia y máxima publicidad.\n1. Todas las etapas del proceso de selección y designación se deben regir por los principios de la materia electoral, por las reglas de transparencia aplicables a los entes públicos y en especial, por el principio de máxima publicidad.\n2. Los datos personales de las y los aspirantes, y la información que por mandato de ley deba considerarse confidencial, se manejará con ese carácter, en los términos de la legislación aplicable.\nSéptimo\nDe los órganos competentes.\n1. El Instituto ejercerá las facultades en la materia de los presentes Lineamientos por medio de los siguientes órganos: a. El Consejo General; b. La Comisión; c. La Secretaría; d. La Unidad Técnica; y e. Las Juntas Locales y Distritales, que tendrán funciones auxiliares en esta materia.\nCapítulo II\nDe los órganos que intervienen el proceso.\nOctavo\nDe las atribuciones de los órganos competentes del Instituto.\n1. Corresponde al Consejo General:\nCONSEJEROS PRESIDENTES Y CONSEJEROS\nELECTORALES DE LOS ORGANISMOS PÚBLICOS\nLOCALES a. Ejercer de manera permanente sus facultades como autoridad única para la designación de los integrantes del órgano superior de dirección de los Organismos Públicos Locales, de conformidad con lo establecido en la Constitución, la Ley General, las demás leyes aplicables y estos Lineamientos; b. Establecer los mecanismos a partir de los cuales se harán públicas las distintas etapas del proceso de selección y designación a que se refieren los presentes Lineamientos; c. Emitir las convocatorias para los procedimientos de selección y designación; d. Votar las propuestas que presente la Comisión; e. Designar a la Consejera o Consejero Presidente de los órganos de dirección superior de los\nOrganismos Públicos Locales; f. Designar a las y los Consejeros Electorales de cada uno de los órganos de dirección superior de los Organismos Públicos Locales; g. Resolver los asuntos no previstos en los presentes Lineamientos; h. Las demás que le confiera la Constitución, la Ley General y los presentes Lineamientos.\n2. Corresponde a la Comisión: a. El desarrollo, vigilancia y la conducción del proceso de selección y designación; b. Instrumentar, conforme a la Ley General y los presentes Lineamientos, el proceso para la selección y designación de las y los integrantes del órgano superior de dirección de los Organismos\nPúblicos Locales; c. Recibir de la Secretaría las listas y expedientes de las y los aspirantes; d. Revisar las solicitudes recibidas y verificar el cumplimiento de los requisitos legales; e. Formar, en su caso, los grupos de trabajo necesarios para coadyuvar con la propia Comisión en la integración de las propuestas que serán sometidas al Consejo General; f. Aplicar y vigilar el cumplimiento de los mecanismos de evaluación sobre la idoneidad y capacidad del perfil para ocupar los cargos; g. Determinar la idoneidad de las y los aspirantes para desempeñar el cargo, conforme a los criterios establecidos en los presentes Lineamientos; h. Evaluar los perfiles curriculares; i. Seleccionar a los aspirantes que accedan a la siguiente etapa de las previstas en la\nConvocatoria correspondiente; j. Realizar entrevistas; considerar necesaria;\n1. Presentar al Consejo General las listas necesarias para ocupar los cargos de Consejero o\nConsejera Presidente y de Consejeros Electorales, en atención a las vacantes existentes, en términos de lo previsto en la Ley General; m. A la conclusión de los procesos de selección y designación, presentar un informe de sus labores al Consejo General; n. Convocar a los Consejeros Electorales para participar en las entrevistas;\nCONSEJEROS PRESIDENTES Y CONSEJEROS\nELECTORALES DE LOS ORGANISMOS PÚBLICOS\nLOCALES o. Resolver los asuntos no previstos en la Convocatoria, siempre que no impliquen modificar las etapas, requisitos o plazos estipulados; y p. Las demás que le confiera la Ley General, los presentes Lineamientos y las disposiciones aplicables en la materia.\nLas atribuciones señaladas en los incisos g), h), i), j) y k), se ejercerán con apoyo de los Grupos de Trabajo que, en su caso, determine la Comisión.\n3. Corresponde al Presidente de la Comisión: a. Convocar a las reuniones de la misma; b. Conducir los trabajos de la Comisión; c. Requerir, a través del Presidente del Consejo General, a las autoridades, ciudadanos, afiliados o dirigentes de un partido político y representantes de los partidos políticos ante el Consejo General, la información o el apoyo que se estime necesario para el procedimiento de evaluación de candidatos, en los términos establecidos en el Lineamiento Décimo Primero; d. Requerir información y solicitar el apoyo de la Secretaría y de los órganos desconcentrados del Instituto; e. Recibir de la Secretaría los expedientes de las y los aspirantes; f. Remitir y someter al Consejo General las propuestas para la ocupación de cargos que apruebe la Comisión; y g. Las demás que le confiera la Ley General, los presentes Lineamientos y las disposiciones aplicables en la materia.\n4. Corresponde a la Secretaría: a. Auxiliar a la Comisión con los trabajos que ésta instruya para cumplir con los presentes\nLineamientos; b. En auxilio a la Comisión, coordinar la oportuna comunicación y trabajos con las Juntas\nLocales y Distritales Ejecutivas; c. En auxilio a la Comisión, coordinar la oportuna comunicación y trabajos con las áreas ejecutivas del Instituto; d. Recibir los expedientes que remitan las Juntas Locales; e. Remitir los expedientes de las y los aspirantes al Presidente de la Comisión; y f. Las demás que le confiera la Ley General, los presentes Lineamientos y las disposiciones aplicables en la materia.\n5. Corresponde a la Unidad Técnica: a. Coadyuvar con la Comisión en la integración de la propuesta para conformar los órganos superiores de dirección de los Organismos Públicos Locales;\nCONSEJEROS PRESIDENTES Y CONSEJEROS\nELECTORALES DE LOS ORGANISMOS PÚBLICOS\nLOCALES b. Poner a disposición de la Comisión la información que le solicite; c. Realizar los informes y estudios que le solicite la Comisión; y d. Las demás que le confiera la Ley General, los presentes Lineamientos y las disposiciones aplicables en la materia.\n6. Corresponde a las Juntas Locales: a. Atender las instrucciones de la Comisión, y por conducto de la Secretaría, remitir información a la misma; b. Difundir ampliamente el contenido de las Convocatorias en su entidad federativa conforme a lo que establezca el Consejo General y los presentes Lineamientos; c. Recibir las solicitudes de registro de las y los aspirantes, en los formatos previstos en la\nConvocatoria, y proporcionarles un comprobante de recepción de la documentación que presenten. El mencionado comprobante tendrá como único propósito acusar recibo de la documentación ahí referida, por lo que en ningún caso se podrá considerar como constancia de cumplimiento de los requisitos previstos en la Convocatoria; lo anterior deberá asentarse en cada uno de los comprobantes de recepción que se emitan; d. Inscribir y concentrar las solicitudes correspondientes a su entidad federativa; e. Listar a las y los aspirantes que presentaron su solicitud y la documentación que exhibieron; f. Remitir a la Secretaría los expedientes de las y los ciudadanos que se inscribieron, de forma física y a través del medio electrónico dispuesto para ello; y g. Las demás que le confiera la Ley General, los presentes Lineamientos y las disposiciones aplicables en la materia.\n7. Son atribuciones de las Juntas Distritales: a. Coadyuvar con la Junta Local de su entidad, en los actos y diligencias que le sean instruidos; b. Las demás que le confiera la Ley General, los presentes Lineamientos y la Convocatoria respectiva.\nNoveno\nDel funcionamiento de la Comisión en el proceso de selección y designación.\n1. En lo que no se oponga a la naturaleza del procedimiento, el funcionamiento de la Comisión\nInstituto.\n2. Las decisiones de la Comisión buscarán el máximo consenso y serán tomadas conforme al principio de mayoría mediante la libre expresión y participación de sus integrantes.\nCONSEJEROS PRESIDENTES Y CONSEJEROS\nELECTORALES DE LOS ORGANISMOS PÚBLICOS\nLOCALES\n3. Concluida cada etapa prevista en la Convocatoria, la Comisión hará público el avance del trabajo correspondiente.\n4. La Comisión será la única instancia facultada para presentar a consideración del Consejo\nGeneral las propuestas para integrar los órganos superiores de dirección de los Organismos Públicos\nLocales. La Comisión podrá apoyarse en grupos de trabajo para el desarrollo del proceso de selección.\nDécimo\nGrupos de trabajo.\n1. La Comisión podrá crear grupos de trabajo con los demás Consejeros Electorales que no forman parte de la Comisión, para desahogar las tareas que le correspondan.\nDécimo Primero\nApoyo de autoridades y de los ciudadanos; afiliados, dirigentes y representantes de los partidos políticos.\n1. En caso de que para la evaluación de los aspirantes sea necesario comprobar o contar con información adicional de los mismos, la Comisión, por conducto del Presidente del Consejo General, podrá requerir la información que de manera fundada y motivada estime pertinente, a la autoridad que corresponda, a los ciudadanos, a los afiliados y dirigentes de los partidos políticos y a sus representantes ante el Consejo General.\nCapítulo III\nConvocatoria.\nDécimo Segundo\nDe la Convocatoria.\n1. El proceso de selección y designación inicia con la publicación del Acuerdo del Consejo\nGeneral por el que se emite la Convocatoria.\n2. Las Convocatorias para la selección y designación de uno o varios Consejeros Electorales de los Organismos Públicos Locales, serán propuestas al Consejo General para su aprobación, por parte de la Comisión, cada vez que sea necesario ocupar una vacante o cuando se deban renovar los órganos superiores de dirección respectivos. Lo anterior tomando en consideración lo dispuesto en el Artículo 116, Base IV, inciso c), párrafo segundo de la Constitución.\n3. Para integrar los órganos superiores de dirección de los Organismos Públicos Locales deberá emitirse una Convocatoria por cada entidad federativa.\n4. La Convocatoria deberá tener al menos lo siguiente:\nCONSEJEROS PRESIDENTES Y CONSEJEROS\nELECTORALES DE LOS ORGANISMOS PÚBLICOS\nLOCALES a. Bases; b. Cargos y periodos a designar; c. Requisitos que deben cumplir las y los ciudadanos interesados en integrar los órganos superiores de dirección de los Organismos Públicos Locales; d. Órganos del Instituto ante quienes se pueden registrar los aspirantes y entregar los documentos que comprueben el cumplimiento de los requisitos legales; e. Funcionarios y teléfonos en los que se aclararán dudas; f. Etapas del proceso de designación; g. Plazos del proceso de designación; h. Mecanismos y criterios de evaluación; i. Forma en que se realizará la notificación de la designación; j. Los términos en que rendirán protesta los candidatos que resulten designados; y k. La atención de los asuntos no previstos.\nDécimo Tercero\nDifusión.\n1. La Convocatoria deberá difundirse ampliamente en los medios de comunicación, debiendo utilizar primordialmente los tiempos del Estado que correspondan al Instituto, en el portal del mismo, así como en los portales de los Organismos Públicos Locales, en los estrados de las oficinas del Instituto en todo el país, y publicarse en tres periódicos de circulación nacional, la Gaceta Oficial de la entidad federativa y tres medios de circulación regional o local en la entidad federativa en la que se realizará el proceso de selección y designación, entre otros medios de difusión.\n2. Los Vocales Ejecutivos deberán asistir a los medios de comunicación de su entidad a fin de divulgar el contenido de la Convocatoria.\n3. El resto de los vocales integrantes de las Juntas Locales y Distritales deberán difundir ampliamente el contenido de la Convocatoria en las universidades, instituciones de educación superior, colegios, organizaciones de la sociedad civil, en organizaciones indígenas y con líderes de opinión de su entidad.\nCapítulo IV\nRegistro de aspirantes.\nDécimo Cuarto\nDel registro de aspirantes.\n1. El registro de aspirantes iniciará diez días después de la publicación de la Convocatoria, contados a partir del día siguiente de la publicación, y hasta el día que se señale en la misma.\nCONSEJEROS PRESIDENTES Y CONSEJEROS\nELECTORALES DE LOS ORGANISMOS PÚBLICOS\nLOCALES\n2. La inscripción y entrega de documentos para el proceso de selección y designación se hará en cada entidad federativa en las Juntas Locales, pudiendo contar con el apoyo de Juntas Distritales, o ante la Secretaría.\n3. Con las solicitudes y la documentación presentada por los aspirantes, se integrarán los expedientes de las y los ciudadanos que se inscribieron para participar en el proceso.\n4. Los expedientes formados en las Juntas Locales serán remitidos a la Secretaría, para que, junto con los formados en dicha instancia, sean remitidos al Presidente de la Comisión.\n5. El Secretario Técnico resguardará los expedientes, los cuales podrán ser consultados por los integrantes del Consejo General.\nDécimo Quinto\nDel procedimiento para el registro de aspirantes.\n1. El procedimiento de registro de aspirantes consistirá en los pasos siguientes:\n1.1 Presentación del formato de solicitud de registro con firma autógrafa.\n1.2 A la solicitud de registro se adjuntará, al menos, la documentación siguiente:\na) Copia certificada del acta de nacimiento.\nb) En caso de no ser originario de la entidad federativa correspondiente, constancia de residencia efectiva de por lo menos cinco años anteriores a la fecha de designación establecida en la\nConvocatoria, en dicha entidad federativa, expedida por autoridad competente.\nEn su caso, el documento con el que compruebe ubicarse en una excepción por razón de ausencia del país por servicio público, educativo o de investigación por un tiempo menor de seis meses.\nc) Copia certificada del anverso y reverso de la credencial para votar vigente.\nd) Copia certificada del título o cédula profesional de nivel licenciatura con antigüedad mínima de cinco años, conforme al día que se establezca para la designación en la Convocatoria.\ne) Curriculum vitae firmado por el o la aspirante; el cual deberá contener, entre otros datos, nombre, domicilio, teléfonos y correo electrónico; estudios realizados, trayectoria laboral, académica, política, docente y profesional; publicaciones en materia electoral, actividad empresarial, cargos de elección popular, organizaciones de cualquier tipo a las que pertenezca y el carácter de su participación.\nf) Carta con firma autógrafa en la que él o la aspirante manifieste, bajo protesta de decir verdad:\n- Ser ciudadano mexicano por nacimiento y no haber adquirido otra nacionalidad, además de estar en pleno goce de sus derechos civiles y políticos;\n- No haber sido condenado por delito alguno, salvo que hubiese sido de carácter no intencional o imprudencial;\nCONSEJEROS PRESIDENTES Y CONSEJEROS\nELECTORALES DE LOS ORGANISMOS PÚBLICOS\nLOCALES\n- No haber sido registrado como candidata o candidato a cargo alguno de elección popular durante los cuatro años anteriores a la designación;\n- No desempeñar ni haber desempeñado cargo de dirección nacional o estatal en algún partido político en los últimos cuatro años anteriores a la designación;\n- No estar inhabilitado para ejercer cargos públicos en cualquier institución pública federal o local;\n- No haberse desempeñado durante los cuatro años previos a la designación como titular de secretaría o dependencia del gabinete legal o ampliado tanto del gobierno de la federación o de las entidades federativas, ni subsecretario u oficial mayor en la administración pública de cualquier nivel de gobierno. No ser jefe de gobierno del Distrito Federal, ni gobernador, ni secretario de gobierno o su equivalente a nivel local. No ser presidente municipal, síndico o regidor o titular de dependencia de los ayuntamientos;\n- Toda la información que, con motivo del procedimiento de elección a que se refiere la respectiva Convocatoria, ha proporcionado o llegue a proporcionar es veraz y toda la documentación que ha entregado o llegue a entregar es auténtica.\ng) Adicionalmente, el aspirante deberá llenar un formato en el que registre su dirección, teléfono y correo electrónico, con el propósito de ser localizado de inmediato en caso de ser necesario.\n2. Las Juntas Locales serán las responsables de concentrar las solicitudes de las y los aspirantes correspondientes a su entidad que se presenten ante las mismas o ante las Juntas Distritales.\n3. Las Juntas Locales serán responsables de integrar las solicitudes y los expedientes de cada ciudadano registrado y reportarán sobre su contenido.\nPara lo anterior, se acatarán los puntos siguientes:\n3.1 Durante el periodo de recepción de solicitudes y hasta el día que señale la Convocatoria, integrarán las solicitudes y los expedientes correspondientes.\n3.2 Capturarán el contenido de cada uno de los expedientes, en el formato electrónico diseñado para tal efecto.\n3.3 El registro de aspirantes podrá ser consultado en todo momento por las y los Consejeros\nElectorales mediante un sistema informático.\nLo anterior, en lo conducente, es aplicable a los registros de aspirantes que se presenten ante la\nSecretaría.\nCONSEJEROS PRESIDENTES Y CONSEJEROS\nELECTORALES DE LOS ORGANISMOS PÚBLICOS\nLOCALES\n4. La información y documentación que integre los expedientes individuales de los aspirantes y Acceso a la Información Pública Gubernamental y en el Reglamento del Instituto en materia de\nTransparencia y Acceso a la Información Pública, no podrá tener otro fin que el previsto en el procedimiento objeto de estos Lineamientos, ni ser utilizada o difundida salvo que medie el consentimiento expreso del titular.\n5. Al momento de presentar la solicitud de registro, las y los aspirantes recibirán un acuse con la descripción de la información y documentación entregada al Instituto, el cual deberán firmar de conformidad. El mencionado comprobante tendrá como único propósito acusar de recibo la documentación ahí referida, por lo que en ningún caso se podrá considerar como constancia de cumplimiento de los requisitos previstos en la Convocatoria; lo anterior deberá asentarse en cada uno de los comprobantes de recepción que se emitan.\nDécimo Sexto\nRecepción de la documentación.\n1. La Secretaría y las Juntas Locales no podrán descartar o rechazar solicitud alguna que se les presente.\n2. En caso de que algún aspirante no presente la totalidad de la documentación, podrá subsanar la omisión siempre y cuando se encuentre dentro del plazo que establezca la Convocatoria; de no subsanar la omisión, quedará asentado en el apartado correspondiente del formato mencionado.\n3. La recepción de la documentación no prejuzga sobre el cumplimiento del requisito en cuestión. La validación y determinación del cumplimiento corresponde a la Comisión en términos de lo previsto en la Ley General y los presentes Lineamientos.\nDécimo Séptimo\nRemisión de los expedientes a la Secretaría.\n1. El día que señale la Convocatoria, las Juntas Locales remitirán a la Secretaría los expedientes originales de las y los ciudadanos inscritos, tanto en formato físico como electrónico, a través del mecanismo dispuesto para ello.\n2. En el desarrollo de esta actividad, la Secretaría podrá instruir a la Dirección Ejecutiva de\nOrganización Electoral para que organice e implemente la logística de recepción, preparación y envío de los documentos.\n3. La Secretaría concentrará los expedientes referidos junto con aquellos que por su conducto se hayan integrado.\nCONSEJEROS PRESIDENTES Y CONSEJEROS\nELECTORALES DE LOS ORGANISMOS PÚBLICOS\nLOCALES\nDécimo Octavo\nRemisión de los expedientes a la Comisión.\n1. A más tardar en el plazo de dos días hábiles siguientes, contados a partir de su recepción, la\nSecretaría remitirá al Presidente de la Comisión los originales de los expedientes de las y los aspirantes, los cuales estarán a disposición de los integrantes del Consejo General para su consulta.\nCapítulo V\nDel proceso de selección.\nDécimo Noveno\nEtapas del proceso de selección.\n1. Las etapas del proceso de selección se determinarán en la Convocatoria correspondiente e incluirán: a. Verificación de los requisitos legales. b. Examen de conocimientos. c. Ensayo presencial. d. Valoración curricular y e. Entrevista.\n2. El resultado de cada una de las etapas es definitivo y deberá hacerse público a través del portal del Instituto y por los demás medios que determine la Comisión.\n3. La Convocatoria respectiva establecerá los requerimientos mínimos que deberán acreditar las y los aspirantes para cada etapa. Lo anterior será condición necesaria para acceder a las subsiguientes etapas.\n4. En el proceso de selección, se considerarán los siguientes aspectos:\na) Historia profesional y laboral.\nb) Apego a los principios rectores de la función electoral.\nc) Aptitudes e idoneidad para el desempeño del cargo.\nd) Participación en actividades cívicas y sociales.\ne) Experiencia en materia electoral.\nCONSEJEROS PRESIDENTES Y CONSEJEROS\nELECTORALES DE LOS ORGANISMOS PÚBLICOS\nLOCALES\nVigésimo\nCriterios de selección.\n1. En cada una de las etapas se procurará atender la equidad de género y una composición multidisciplinaria. En los casos específicos que se requiera, también se procurará atender a una integración multicultural.\n2. Las y los aspirantes serán evaluados en atención a los principios de objetividad e imparcialidad y sin discriminación motivada por origen étnico, género, condición social, orientación religiosa, preferencias sexuales, estado civil o cualesquier otra que atente contra la dignidad humana y tenga por objeto anular o menoscabar los derechos y libertades de las personas.\n3. En la integración del órgano superior de dirección de los Organismos Públicos Locales, se procurará una conformación de por lo menos tres consejeros electorales del mismo género.\nVigésimo Primero\nVerificación del cumplimiento de los requisitos.\n1. La Comisión conocerá y aprobará la lista de las y los aspirantes que cumplen con los requisitos legales.\n2. Una vez aprobada la lista, la Comisión ordenará su publicación en el portal del Instituto, agregando un resumen curricular de las y los aspirantes incluidos.\n3. Derivado de la verificación de requisitos, y en caso de no existir aspirantes que cumplan con ellos, la Comisión establecerá el inicio de una nueva Convocatoria en la o las entidades que se encuentren en el supuesto. La Comisión podrá ajustar los plazos para una pronta integración del órgano superior de dirección.\nVigésimo Segundo\nInstrumentos de evaluación.\n1. Los aspirantes que hayan cumplido los requisitos legales presentarán un examen de conocimientos y, en su caso, un ensayo cuya evaluación será tomada en cuenta al momento de valorar su idoneidad y capacidad para el cargo, de conformidad con las etapas previstas en la Convocatoria.\n2. El Consejo General a petición de la Comisión podrá pedir a una institución de educación superior, de investigación o evaluación, la elaboración de los reactivos y/o la aplicación y evaluación de los exámenes. Asimismo, podrá convenir con universidades, instituciones de educación superior o de investigación, la aplicación y dictaminación de los ensayos presentados por los aspirantes.\nCONSEJEROS PRESIDENTES Y CONSEJEROS\nELECTORALES DE LOS ORGANISMOS PÚBLICOS\nLOCALES\nVigésimo Tercero\nIdoneidad y capacidad del perfil.\n1. La Presidencia de la Comisión convocará a las sesiones y reuniones de trabajo que sean necesarias, para que los Consejeros Electorales integrantes de la misma, y en su caso, los integrantes de los grupos de trabajo, evalúen la idoneidad y el perfil de las y los aspirantes que cumplieron los requisitos.\nVigésimo Cuarto\nElaboración de listas de aspirantes que acceden a la siguiente etapa.\n1. La Comisión elaborará listas, por cada entidad federativa, respecto de los aspirantes que accedan a las etapas subsecuentes del proceso de selección, en los términos previstos en el Lineamiento\nVigésimo.\nVigésimo Quinto\nParticipación de los partidos políticos y Consejeros del Poder Legislativo.\n1. Aprobadas por la Comisión las listas de los aspirantes que hayan avanzado en las etapas correspondientes, en términos de lo previsto en la Convocatoria, la Presidencia de la misma, en un plazo máximo de dos días hábiles hará entrega de esas listas a los representantes de los partidos políticos y a los Consejeros del Poder Legislativo ante el Consejo General, para sus observaciones y comentarios. La entrega de información deberá hacerse el mismo día para todos.\n2. Dentro de un plazo de cinco días hábiles contados a partir del día en que se les haga entrega de las listas, los representantes de los partidos políticos y los Consejeros del Poder Legislativo podrán presentar por escrito ante la Comisión, las observaciones y comentarios que consideren convenientes, debiendo acompañar, en su caso, los elementos objetivos que sustenten o corroboren sus afirmaciones.\n3. La Presidencia de la Comisión distribuirá a los integrantes de la Comisión y demás Consejeros\nElectorales, las observaciones emitidas por los representantes de los partidos políticos y de los\nVigésimo Sexto\nDe las entrevistas.\n1. Una vez recibidas las observaciones de los representantes de los partidos políticos y los concurrirán a la etapa de entrevistas.\n2. La Convocatoria debe señalar las fechas y el lugar para llevar a cabo las entrevistas a las y los aspirantes que hayan accedido a dicha etapa.\nCONSEJEROS PRESIDENTES Y CONSEJEROS\nELECTORALES DE LOS ORGANISMOS PÚBLICOS\nLOCALES\n3. La Comisión establecerá un calendario específico para la realización de las entrevistas a las y los aspirantes.\n4. Los Consejeros Electorales realizarán las entrevistas de manera presencial, o excepcionalmente de manera virtual, cuando sea posible y existan causas justificadas a juicio de la\nComisión. Cuando las entrevistas no puedan efectuarse por razones ajenas a los aspirantes o por causas de fuerza mayor, procederá su reprogramación, el día y la hora que para tales efectos señale la\nComisión.\n5. El Consejero Presidente y los Consejeros Electorales podrán participar en dichas entrevistas.\n6. Las entrevistas se realizaran por grupos de al menos dos Consejeros Electorales.\n7. Los aspirantes convocados se entrevistarán con los consejeros en el lugar, fecha y hora señalados por la Comisión, y se abstendrán de buscar contactos individuales con los Consejeros\nElectorales durante el plazo de vigencia de la Convocatoria, para tratar asuntos relacionados con el proceso de selección.\nCapítulo VI\nDel proceso de designación.\nVigésimo Séptimo\nDe la remisión de las propuestas al Consejo General.\n1. Concluida la etapa de entrevistas y se trate de la designación de más de una vacante, la\nComisión elaborará una sola lista con los nombres de la totalidad de candidatos a ocupar los cargos y los periodos respectivos por cada entidad federativa.\n2. Cuando se trate de la designación de una sola vacante, la Comisión presentará al Consejo\nGeneral una lista de cinco nombres por vacante en la entidad federativa.\n3. Las propuestas de las y los candidatos deberán contener un Dictamen debidamente fundado y motivado, que incluya todas las etapas del proceso de selección, además de los elementos a partir de los cuales se determinó la idoneidad y capacidad para el cargo de las y los candidatos.\n4. En los casos en que se designe más de una vacante, adicionalmente se incluirá un análisis\nPúblicos Locales.\n5. Una vez elaboradas las propuestas de candidatos respaldadas con los dictámenes respectivos, la Comisión deberá someterlas a la consideración del Consejo General, con una anticipación no menor de 72 horas previas a la sesión que corresponda.\nCONSEJEROS PRESIDENTES Y CONSEJEROS\nELECTORALES DE LOS ORGANISMOS PÚBLICOS\nLOCALES\nVigésimo Octavo\nDe la discusión y aprobación de las propuestas en el Consejo General.\n1. Para efectos de la votación en el Consejo General, las propuestas se pondrán a su consideración de la siguiente manera:\n1.1 Cuando se trate de la designación de más de una vacante, se someterá a la consideración del Consejo General una lista con los nombres de las personas propuestas para ocupar cada cargo.\n1.2 Cuando se trate de la designación de una sola vacante, el Consejo General elegirá de una lista de cinco ciudadanas y ciudadanos, a quien asumirá el cargo de que se trate.\n2. El Consejero Presidente y los Consejeros Electorales deberán abstenerse de votar a propósito de algún candidato o candidata, cuando hagan del conocimiento del Consejo General, la existencia de algún impedimento en términos del artículo 8, fracción XI de la Ley Federal de Responsabilidades\nAdministrativas de los Servidores Públicos o por cualquier otra disposición legal.\n3. La votación se realizará conforme a la Ley General y a las reglas y procedimiento dispuestos en el Reglamento de Sesiones del Consejo General.\nVigésimo Noveno\nNotificación a los designados.\n1. Al término de la sesión de designación, la Secretaría procederá a notificar en forma personal el Acuerdo respectivo a las y los ciudadanos designados y procederá a su publicación en el Diario Oficial de la Federación y en la Gaceta Oficial de la entidad de que se trate.\nTransitorios\nPrimero\nEn tanto no se constituya la Unidad Técnica de Vinculación con los Organismo Públicos\nElectorales y no se nombre al Titular, el Presidente del Consejo General designará al Secretario Técnico de la Comisión.\nSegundo de lo dispuesto en el artículo transitorio noveno del Decreto por el que se reforman, adicionan y derogan\nFederación el dos de febrero de dos mil catorce, así como en el artículo transitorio décimo del Decreto deberá publicarse a más tardar el treinta de junio del dos mil catorce.\nCONSEJEROS PRESIDENTES Y CONSEJEROS\nELECTORALES DE LOS ORGANISMOS PÚBLICOS\nLOCALES\nEl que suscribe, Licenciado José Héctor Rojas, Secretario de la Junta Local del Instituto Nacional\nElectoral en el Estado de Guerrero, con fundamento en lo dispuesto por el artículo 64 párrafo 1 incico e), de la Ley General de Instituciones y Procedimientos Electorales y 8 párrafo 1, inciso n) del Reglamento de sesiones de los Conseptos Locales y Distritales del Instituto Federal Electoral;\nQue las presentes copias fotostáticas, que consta de veintisiete fojas útiles por un solo de sus lados, son fiel reproducción del Acuerdo del Consejo General del Instituto Nacional Electoral por el tuve a la vista para su cotejo, con el que concuerda en todas y cada una sus partes.\nLo que se hace constar para los efectos legales correspondientes, en la ciudad de Chilpancingo de los Bravo, Guerrero, a los doce días del mes de junio de dos mil catorce.\nRúbrica.",
  "ordenamiento": "LINEAMIENTO",
  "jurisdiccion": "GUERRERO",
  "fuente_oficial": "DIARIO OFICIAL DE LA FEDERACION",
  "Fecha de Publicación": "24 de Junio \nde 2014",
  "ULTIMA REFORMA PUBLICADA": null,
  "status": "VIGENTE",
  "es_escaneado": false,
  "tiene_tablas": false,
  "materia": [
    "electoral"
  ]
}